0,1,2
20170227,10,"최고의 평론가 ""박평식""님께서 ""애처롭고 애틋할 줄이야""라는 말과 함께 평점""7""점을 주셨다...그냥 아무 말 없이 감상하라는거다  "
20170227,8,오 평식이 형님 7점 주심 거의 다크나이트급이네  
20170227,10,라스트 오브 어스! 로건! 멋진 중년남자와 가녀린 소녀의 궁합은 절대로 깨질수 없는 환상의 영역이다!  
20170227,9,"울버린과의 이별이라니 아쉽다. 캐릭터의 매력, 내면의 딜레마와 갈등이 잘 녹아 있는.... 다만 아린 소녀의 잔혹한 액션은 다소 불편할 수도.  "
20170227,10,더 울버린때문에 기대도 안했는데 로튼 90점 넘어가더라 왠일로 전문가평점도 높고...보고싶어지네  
20170226,1,하 청불이라니 실망함 진심 울버린부터 액스맨 다 청불이 아닌데 왜 이건청불임 전부터 기대하고 있는데  
20170226,10,평식이 7점 ㅇㅈㄱ입니다  
20170226,10,로건...뭔가 했더니 엑스맨....ㄷㄷㄷ  
20170226,10,그가 꾸준히 걸어온 길을 같은 시대에서 볼 수 있다는게 얼마나 행운일까..  
20170226,10,로건=울버린=휴잭맨  
20170226,8,근데 이거 청불이네. 히어로물이 킥애스 급 잔인함인가? 기대가 좀 된다.  
20170226,10,너무 기대 됩니다. 울버린이란 케릭터도 휴 잭맨이란 배우도 너무 좋아하는데. 경건한 마음으로 관람해야겠네요.  
20170225,10,박.. 박평식  7점?!!!  이 말은 다크나이트 라이즈랑 동급?  
20170225,10,기대된다 믿고본다!ㅎㅎ  
20170225,10,박평식...평론가가 7점?? 보고싶다만 미성년자 하하  
20170225,7,울버린 왜 늙어 보면서도 지치네  
20170225,10,휴잭맨의 마지막 울버린 기대하고도 아쉽습니다엑스맨 1부터 봤지만 휴잭맨의 울버린은 잊지못할겁니다 개봉하고 영화관 달려갑니다  
20170225,10,안봐도. 느낌이. 팍팍팍!!!  온다..전율이 느껴진다. 소름이 돋는다..그리고. 많이....아쉽다..수고하셨읍니다..휴...잭..맨  
20170223,9,근데 프로세서x는 죽지않았음?액스맨 시리즈에서;;이거 당최 순서가 우째된겨미래라는데  
20170223,10,로건 이정도로 처절한 히어로 무비가 있었던가.. 한숨 푹푹 나오는 설정에 다들 암울 하실겁니다.. 최초시사회 보고 나오는데 액션은 R등급을 무기로 아드레날린을 뿜게 하네요. 이세계관 설정이 정말 꿈도 희망도 없습니다.. 역대급  걸작이 나왔네요  
20170223,10,청불이라 더 기대되네...뭔가 표현에 제약없이 시나리오 썻을듯  
20170223,10,잼있고 슬퍼요~~꼭 보세요 ♡  
20170223,10,울버린 마지막 시리즈의 유종의 미를 거뒀다  
20170223,7,마지막은 아쉽지만 너무 잘 봣음! 꿀잼  
20170223,10,정말 마지막이라니 대단하네요  
20170223,10, 기대한대로 대미를장식한 영화  
20170223,10,스릴있고 재미있어요~~~~  
20170223,10,"역시 로건, 역시 울버린..최고의 마지막 장식하다.  "
20170223,9,재밌어요 아주 흑흑흑 아이고 흑흑로건  
20170223,10,영원한 울버린 휴 잭맨! 그동안 수고 많았습니다!  
20170223,10,휴잭맨의 울버린에 작별을  
20170223,9,마블시리즈중 가장 인간적인 영화. 로건.  
20170223,10,로건 재미있고 슬프네요ㅠㅠ  
20170223,10,역대급강추핮니다다다ㅏ아존잼  
20170223,8,"완벽한 울버린영화, 그의 퇴장이 씁쓸하다  "
20170223,10,너무너무 신나게 봤어요 많이 보세요  
20170223,9,잔인하고 처절하고 애잔하다!  
20170223,9,아름답고 멋있게 엑스맨 울버린의 세대교체한 영화  
20170223,10,정말 최고의 영화입니다.  
20170223,9,울버린의 이렇게 가슴 저린 퇴장이라니!  
20170223,10,과연 최고의 마지막. 사무치는 안타까움.  
20170223,10,시사회 보고 나왔습니다 ㅎㅎ정말 재미있습니다 꼭 보세요!!  
20170223,10,세기의 캐릭터와 배우에게 보내는 최고의 찬사  
20170223,9,재밌습니다 꼭 보세요ㅇㅇ  
20170223,10,울버린 그 자체였던 휴 잭맨의 아름다운 퇴장  
20170223,8,휴잭맨의 마지막 로건 감동적이었습니다  
20170223,10,역대 엑스맨 시리즈 통틀어 최고였다!  
20170223,10,언제봐도 감동적인 엑스맨! 10년ㄹ 함께한만큼 결말까지 완벽한 영화였습니다!  
20170223,10,기대한 그 이상을 보여주는 로건!  
20170223,8,엑스맨의 끝 시간낭비는 아니었다 재밌었고 감정 뭉클  
20170223,10,로건 정말대박이네요..  
20170223,10,마지막까지 최고였어요  
20170223,9,마지막인 만큼 맘이 아프네여ㅜㅜ 마지막 여운이 심해서 또 보러갈 예정입니당  
20170223,10,울버린시리즈의 완전판!!!!  꼭 봐야하는 명작입니다!  
20170223,10,너무 잘보았습니다 홍보할께요  
20170223,9,로건 마지막 가는 모습이 너무  짠하네요  
20170223,10,울버린 최고의 영화!!  
20170223,10,처절한 로건에데 박수를!!  
20170223,9,잼있어요 꼭보세요  추천추천  
20170223,10,시사회에사 봤는데 잘 봤습니다  
20170223,10,역대최고의 엑스맨 로건  
20170223,10,아..마블 보면서 이런 휴머니즘과 액션까지 챙기게 해 주다니 완벽합니다  
20170223,10,로건 아주 강추해~!!!^^  
20170223,10,최고의 로건! 다시보고싶습니다  
20170223,10,로건 너무너무 재미있고 감동적이었어요! 추천하고 싶은 작품이네요~  
20170223,9,눈물없이 볼 수 없는 로건추천해요  
20170223,10,시사회로 보고왔습니다. 미쳤어요... 울버린 안녕ㅠㅠ  
20170223,10,차가운 칼날 끝에 맺힌 뜨거운 눈물. 최후이자 최고의 울버린 영화.  
20170223,10,마지막 울버린 영화 최고입니다!  
20170223,10,아 진짜 무조건  꼭 봐야돼요 울버린 엑스맨팬이라면 꼭  
20170223,10,너무 재밌었어요. 첨 봤는데 몰입도 장난아닙니다!!! 꼭 보세요 강추강추ㅎㅎ  
20170223,10,재밌고 환상적입니다추천  
20170223,10,휴잭맨이 울버린으로 나오는 마지막 영화.감동이예요  
20170223,10,너무나도 완벽한 울버린 사가의 결말.. 유종의 미란 이런것  
20170223,10,마지막을 장식하는 최고의 영화  
20170223,9,울버린의 마지막 시리즈 대미를 멋지게 장식한 작품 무척이나 강렬하고 가슴아픈 스토리 강추~  
20170223,10,최고에요 !! 역시 마블  
20170223,10,시사회로 본 로건. 마지막 울버린을 잘장식했다  
20170223,10,최고중에최고로건대박  
20170223,9,로건 대미의 끝은 눈물로 장식  
20170223,10,영원한 히어로 로건. 이번 영화 정말 최고다  
20170223,10,오늘 시사회 보고 왔어요  
20170223,10,울버린 마지막 너무 멋져요 강추!!  
20170223,10,굿넘좋아요굿넘좋아요  
20170223,10,영화 완전 감동적이네요 ㅜㅜ 완전 추천합니다  
20170223,9,안녕 로건 그동안 고마웠어요  
20170223,10,로건. 영원한 엑스맨 울버린  
20170223,10,울버린 시리즈 중 가장 최고네요 휴잭맨 울버린의 유종의 미를 거둔 영화!!!  
20170223,10,휴잭맨이 만들고싶었던 최고의 울버린영화... 정말 최고네요.  
20170223,10,엄청나다. 이렇게 찡하고 감동적으로 이별을 고하면 어떻게 하라고. 울버린 시리즈를 가장 사랑하게 만들어버리는 마지막 가족 이야기에 펑펑 울었다. 아버지 로건의 손 꼭 잡아주고 싶다.  
20170223,10,휴 잭맨의 마지막 울버린이라 ㅠㅠ 슬프지만 한캐릭터를 한결같이 최고로 연기해온 그에게 박수를!! 영화도 예술 !  
20170223,10,adieu wolverine. .  
20170223,10,로건 기대가 많았는데 좋아요~ 화이팅 입니다^^  
20170223,10,청불이라 기대되는데 더울버린때만큼만아니길..  
20170223,10,"로건 울버린의 마지막이라는데, 극장사수 해야지! 그러나 저러나 등급이 청불이군~ 처절한 영화가 되려나...  "
20170222,10,마지막 열정을 존경하는 마음으로 10점 드립니다.  
20170222,9,일단 꿀잼 요소 중년 간지 귀여운 소녀 조합 레옹 아저씨 맨 온 파이어 등등 이 영화 끝장 났다.  
20170222,10,오 엑스맨 휴잭맨 마지막편이라. 꼭봐야죠..  청소년관람불가인이유가 알고싶네요.. 아주잔인하나?  
20170222,10,메인 영상 보면서... 와~~ OST 괜찮네~~~ 속으로 안마디~ ㅎㅎ  
20170222,10,울버린에 놀라고 x-23 에 또 한번 놀랄 것입니다  
20170222,8,한번더 믿고 볼게요..  
20170222,2,울버린에 흉터 수염 복장 배경 여주의 당돌함 등등 모든것이 라스트오브어스와 설정이 같은데...이만하면 표절 아닌가  
20170222,10,베를린 영화제에서 보고 옴. 상업성을 내려놓고 청소년관람불가로 만든것이 신의한수이며 왜 제목이 울버린이 아니라 로건인지 알 수 있음. 로라역을 뽑아두고 영화를 만들었는지 로라의 연기를 보면 입을 다물 수 없음. 강추  
20170222,10,일단 청불. 완성도가 꽤 있다고 봅니다. 기대 와방.  
20170221,7,청불만 아니어도 최소 5백만 돌파인데 너무 쎄게 만들어쪄  
20170221,10,청불이라니 너무 좋다.청불인데도 떠들거나 민폐끼치는 사람은없겠죠 ㅡㅡ  
20170221,10,울버린 영화가 청불인건 첨 봤다.. ㄷㄷ  
20170221,10,청소년은웁니다....  
20170221,10,휴잭맨 그동안 고생하셨습니다  
20170220,10,아아새ㆍ아아앙아아상  
20170220,9,아직 예매가 안떴내 일주일은 더 남았지만.. 음  
20170220,10,너무기대된다  그냥 울버린 마지막으로 보는 느낌으로!!  
20170219,10,청불이라니... 슬프도다  
20170218,10,로튼 96퍼센트!! 현재로선 90퍼센트대는 확실한거 같고 평을보니 울버린 시리즈중 최고작은 확실하고 엑스맨 시리즈 통틀어서도 베스트에 꼽히는거 같고 일각에서는 다크나이트와 비교하는걸 보니 영화 이번에 진짜 제대로 나온듯  
20170218,10,"기다린다고 힘들었네요,. 이제 곧 볼 수 있겠네요.  "
20170218,10,더울버린은 안보았지만 이건 무조건 보겠어요 나의 이번년도 첫N차관람 영화가 되기를  
20170218,8,아오 씹ㅂ.. 왜 청불인건데;;;  
20170218,10,이거 기다리는분들 영화 걱정 안해도 될거 같네요 현재 로튼 97에 메타 73이네요 해외평단의 평가도 정말 좋고요  
20170217,10,일단 청불이라서 볼만 한듯  
20170216,10,어제 처음 엑스맨 탄생: 울버린 봤는데 너무 재밌어서 이번엔 꼭 보려그랬눈뎅.. 오늘 보니까 청불이 되있더라구요. 2살만 많았으면ㅠㅠ 휴잭맨(하트)  
20170216,9,이거 미국판 아저씨 같은데 소녀를지키는내용인거보니.  
20170216,10,늙어버린 휴 잭맨 그러나 울버린의 영원한 울버린일거구 로건이 마지막이기에 더 특별한거 같네요~ 이젠 다른 인물의 울버린 나오겠지만 휴잭맨을 능가 하지 못할거이구 그래서 로건이 더 기대 되네요~  
20170216,10,분위기가 더 라스트오브어스 랑 많이 비슷하네요 스토리도 그럴듯하고 이러고 보면 라오어가 정말 대단한 게임이었던듯 .... 영화보다 더 영화같은 게임...  
20170216,5,"울버린은 젋은 유지인데, 휴잭맨은 늙었음.이젠 은퇴작일 바람  "
20170216,5,예고편만 봐선 편의점에서 훔쳐먹어다가 점주가 돈받으려고 친구들 불러왔는데 로건과 같은 능력같은 애가 몰살하는 내용으로 보이는데 설마 아니겠지  
20170216,9,15세 보단 더 잔인하고 화끈한 청불이 낫죠. 이번 영화 극장가서 꼭 보도록 하겠습니다 휴 잭맨 의 마지막 빛나는 순간까지도 !!  
20170216,10,이런거 처음 남겨보는데 진짜 울면서 볼거 같다. 청불이라 적어도 시끄럽게 하는 키즈들은 없겠지!  
20170216,10,울버린 마지막이라니 ㅠ 울면서 볼 예정 ㅠㅠ  
20170213,10,제임스 맨골드의 영화가 더 울버린만 있는 게 아니다. 무려 반전영화 전설의 아이덴티티도 이 감독이 만들었다. 로건도 충분히 기대할만함  
20170213,10,이거 설마 청소년관람불가는 아니겠지? 마지막인만큼 보고싶었는데....  
20170212,8,예고편에서..레옹의 오마주가 느꺼진다..약간 진부한설정이지만..잘만  만들면 울버린의 성공적인 세대교체가 될듯..울버린수고했다  
20170212,10,"더울버린 해외평가도 좋고, 원작내용반영잘한건데 내용이나 액션도 나쁘지 않고..그냥 일본이라고 까는건 이해가 안간다..  "
20170212,10,아개좋아 로건 ㅋㅋ 휴잭맨 형님 짱좋아하는데 이영화가 울버린 은퇴작이라니 ㅠㅜ  
20170211,10,청불인게 아쉽다...  
20170209,10,영화 등장인물이 자기 영화를 못봄 ㅋㅋㅋㅋ진짜 꼭 보고 싶은 영화 중 하나  
20170209,10,^오^ 꼬꼬마 울버린 지렸다~액션 ㅋㅋ  
20170209,10,내가 좋아하는 영화가 마블꺼인데 로건 진짜 기대된다 휴 잭맨 개좋다  
20170209,10,3월3일로건개봉일이다기대된다.  
20170208,1,무슨 연줄이있길래 전작후려처놓고 감독을 또잡음ㅋㅋ 울버린1 만든감독이 보다 능력있고 기승전결 마무리도 더 잘하던데 왜지?ㅋㅋ  
20170206,10,나는 감정장애인가보다... 나이 스물여덟에 트레일러 보고 눈물 뚝뚝 흘렸다.  
20170206,10,로건 트레일러보고 소름돋았다 내가 정말 알던 그 단어로건이 맞는지 의문이 들엇고 트레일러에서 우리 휴잭맨형을 0.1초만에 못알아봤다는게 너무 소롬이다 더울버린처럼 팬들물먹였다간 내가 꽁할꺼니까 꼭 기대할테니 몇주뒤에보자 로건♡♡♡♡  
20170206,10,"형와의 기대치는 정말 엄청나지만 제임스, 이번에도 휴 잭맨이 나오는 영화를 망쳐놓으면 진짜 가차없이 비난글을 올릴거다;  "
20170206,10,보고싶다  언능 언능 빨리 개봉해라잇  
20170205,10,이건 분명 재밌을거야 그렇고말고  
20170204,5,아 더 울버린 만든 감독이네.. 그 밑 필모는 아인덴티티도 있고 나름 화려하던데 더 울버린은 왜 일본홍보영상으로 만든지 노이해. 걱정된다  
20170203,10,19세예상해봅니다 허허  
20170203,10,꼭 보러 가야지!! 감성 액션 기대합니다.  
20170203,10,제발 15세 관람가이길....  
20170202,10,예고편 보고 몸에 전율이..꼬마여자애는 로건 핏줄 같은데 기대된다. 일단 10점 주고 간다  
20170202,10,개인적으로 휴잭맨의 울버린이 어밴저스에 합류하는 모습을 보고싶었는데...  
20170131,10,예고편보고 지린게  다크나이트이후 오랜만이네요  꼭극장가서 봐야겠네요  본편은어떨지...  
20170128,1,곧휴...  잭맨을 울버린으로 더는 볼 수 없을 때가 오는 건가  
20170127,9,보고 싶어죽어서 당장 나오길 기대될것임  
20170127,10,왠지 엄청 슬플걸같음....울버린 마지막편라서 그런지 더슬픈것같음....그래도 기댜되고 셀랜다!!!  
20170127,10,어두워도 너무어둡다...  
20170126,10,휴잭맨이 나온다면 보고 싶다 믿고 보는 휴잭맨  
20170125,10,더 울버린과 다른 모습을 보여주시기를!  
20170125,10,포스터만 봐도 이건 봐야된다  
20170125,2,내밑에 나무늘보 바보 임돠 ㅋ  
20170125,10,올해 19세 딱넘는다.  
20170124,10,"아.. 이 영화가 청불이라는 게 참 안타깝다.. 휴잭맨의 마지막 울버린 영화이자 울버린이라는 캐릭터의 마지막 영화인데.. 그래서 기대도 더 많이되고 너무 아쉽다..ㅠ  이 영화를 본 울버린, 휴잭맨 팬들은 분명히 눈물을  흘릴 것 같다..  "
20170123,10,이게 휴잭맨의 마지막 울버린이라니 ㅠㅠ  
20170122,10,울버린의 마지막과 X-23의 시작이 공개되는 영화! 기대됩니다.  
20170120,9,예고편보니 볼만할거같네요...근데여자아이가 투톱주연이라고볼수있는데 인물소개에 없네요 ㅋㅋ  
20170119,10,로건-복권-연금-부자-만수르-사우디아라비아-석유-자동차-현대-대기업-국정농단-특검-청문회  
20170118,10,라스트 오브 어스 느낌난다...  
20170118,10,아름다운 은퇴가 되길 기대하며  
20170117,10,"감독이 더 울버린 감독? 이건 휴잭맨의 마지막작품이므로팬들도 휴잭맨,도 만족하고 좋게 끝내야 되는데 나는 좀걱정된다.그래도 감독이 나름 흥한 작품이 있으니까 믿는다.  "
20170116,10,이 영화가 엑스맨의 분기점이 되겠군  
20170110,9,휴 잭맨...믿고 보겠습니다. 이번에는 좋은 각본이 나오길  
20170108,10,"이 영화의 등급은 ""청소년 관람불가"" 입니다  "
20170104,10,이건 또 무슨 개신선한 컨셉이지? 궁금하게 만들기는 하네  
20170103,10,로건이 청불이라니요 ㅠㅠㅠㅠ 액스맨 팬이지만 아직 청소년이라 극장에서 볼 수가 없다니 ㅠㅠㅠ 너무 슬프네요. 아무리 나이가 될때까지 기다린다 하더라도 로건을 극장에서 못본다는건 끔찍합니다. 제발 한국에 들어올땐 15세로 되길 빌며...  
20170102,9,예고편이고 포스터고 너무 멋있고 간지나서 기대치를 너무 올리는게 아닌가 싶다. 부디 자신감의 표시이기를  
20161230,10,  엑스맨을 보고 정말무한  감동을 받고 컷는데 내 나이도 어느듯42이 되어버렸네요울버린 에서 약간..  힘들었지만 로건은 정말 내 인생 영화가 될듯 3월 3일 금방 오잖아요 잭형 극장에서 만나요  
20161226,10,시나리오가 좋아 보인다... 기대됌  
20161223,8,영화 제목이 울버린이 아니고 로건이라는 점으로 보아 더 이상 돌연변이 명칭인 울버린이 아닌 인간 이름 로건으로써 로건의 인간적인 면모와 삶을 보여주는 휴먼 드라마 장르의 훈훈한 영화일듯  
20161223,10,울버린의 마지막 이야기. 지금까지 모든 엑스맨 시리즈를 본 1인으로서 이 편도 매우 매우 기대된다. 아포칼립스보다 더 발전하길.  
20161218,7,점수:7 울버린이 이렇게 나오다니 말도안돼  
20161218,8,제목이 왜 이럼? 마치 영화 록키 발보아 처럼???  
20161216,10,레옹삘 나는건 나뿐인가..?  
20161210,1,예고편만 보고 실망을 느꼈다.  
20161201,10,우리의 영원한 울버린 휴 잭맨... 벌써 마지막이네...  
20161128,10,리브 슈라이버는 왜 안나오는거야...ㅠㅠ 울버린 형은 OOO 영원히 결별했냐? 울버린 탄생 떡밥 회수 좀 하고 끝내지 게빈 후드인가 뭔가 후드티 같은 새1끼 맨골드 형한테 인수인계는 해야할거 아냐  
20161125,10,제발 잘만들어주길..휴잭맨의 울버린 은퇴작..  
20161122,10,휴잭맨의 울버린이 마지막이라니! 영원할 것만같았던 ㅜㅠ  
20161119,10,이게 왜 마지막이냐고 ㅠ 노래 참 우울하더라  
20161116,10,제발  청불 아니길 제발 청불 아니길!!!  
20161116,10,하 예고편 음악부터 왜 이렇게 암울하고 슬프게 나오냐 ㅋㅋㅋㅋ ㅠㅠ  
20161114,10,"마지막 휴잭맨의 울버린, 로건.  "
20161110,10,흥해라10101010  
20161107,10,왜 엘리와 조엘이..??  
20161107,3,폭스라서 망함 ㅋㅋ휴잭맨이 연기를잘한거지 울버린과어울리진않음... 얼굴은 수염덕에 어울리는데 연기가 넘사벽인거임 울버린 아우뚱하고 작고 넓직한 모델이 어울림  
20161107,10,감독아 이 영화 살리면 다 용서해줄게  
20161107,10,캬.. 잭형 엑스맨 은퇴작이네.. 이건 꼭 봐야지 ㅠ  
20161107,10,1세대 울버린X맨의 마지막작... 기대되네요.. 감동도 있을듯...  
20161107,10,예고편보고  소름 돋았습니다....기대하겠습니다.  
20161106,10,과연 이번 마지막 편에서 명작을 남길 것인가... 예고편 정도만 나와도 성공 같은데...  
20161106,10,"예고편만봐서는 역대 최고의 게임중 하나인 ""더 라스트 오브 어스"" 느낌이 든다... 세기말 분위기, 초반에는 서로 티격태격하는 분위기였지만 뒤로가면 환상의 전투호흡을 보여주는 모습 등.. 과연 이 영화도 역대급 영화가 될 수 있을지 궁금하다.  "
20161104,10,이거 처음 나왔을때는 몇살이었는데... 지금은... 하시는 분들 많으실듯..  
20161104,1,더 울버린 감독 ;;;;  
20161104,10,아아..  무한도전이끝난다면 이런느낌일거야....엑스맨1부터 지금까지16년이란 세월동안 울버린으로 있어줘서고마워요ㅠ  
20161104,10,많이 늙엇다ㅠ슬픈영화가 될듯  
20161103,10,아마 코믹스에서도 나왔던 울버린의 사망 하차에 관해서 진행될것 같네요  
20161103,10,올드맨 로건 영화화인가?  
20161103,10,돌연변이 버전 아조씨넹...기대 됩니다.  
20161103,10,이영화 망작이라도 볼거다  
20161103,10,저 여자아이가 자라서 여자 울버린이 되는거군요...휴잭맨 안뇽...  
20161103,1,아나 이거 완전 아저씨 따라한거아니셈 ㅡㅡ?  
20161103,10,와~~~ 설정부터 기대되는구만..  
20161103,10,이번 영화는 원작 올드맨 로건을 배경으로 한거고 울버린이 늙고 흉터생긴건 힐링펙터가 없어진게아니고 그냥 약화된걸로나옴몸에 아만다티움때메 원래 죽어야되는데 힐링펙터때매 살아있는거죠  
20161102,10,더 울버린은 아무래도 쪽바리 자본이 많이 들어가서 그랬다고 생각합니다 이번은 예고편 봤는데 너무 기대가 되요 ^^ 당신의 연출력을 보여주세요!!!  
20161102,10,데오퓨에서  개고생해서 미래 바꿔놨더니 또 디스토피아네...ㅠㅠㅠㅠ  하지만 트레일러에서 보여준 분위기랑 배우들 연기가 너무 좋아서 기대를 안 할 수가 없다  
20161101,10,휴 잭맨ㅠㅠ 하차 하지마세요ㅠㅠ  
20161101,6,말앗던 경력이 있으셔서 살포시 6점...아시죠? 로건은 엑스맨 메인급 캐릭터인거?...  
20161031,10,예고편. 음 황폐화된 찰스와 울버린에 눈물날뻔~ 엑스맨 시리즈와는 다른 배경으로 봐야하는건지. 당최 원작은 모르고 영화만으로 꿰어 맞추려니 나이 50에 한계에 이름. 그래도 여전한 매력의 돌연변이들.  
20161030,10,예고편 분위기대로만 나온다면 히어로 영화의 카테고리 하나를 개척할 수 있다고 생각합니다~~  
20161024,10,예고편 포스가 장난아니네;;  
20161024,10,19금이 아니면 좋겠다.  
20161024,10,예고편 봤다 진짜 이대로만 나오면 진짜 지린다.  
20161023,10,예고편만 봤는데도 벌써 마음이 쓸쓸하고 찡하군요. 배우가 배역과함께 늙어가는건 멋지면서도 아쉬운거같네요 학생때부커 휴잭맨의 울버린과 같은시대를 쭉봐와가며 살아가는 저로써는 다소 중간에 삐걱거렸던 영화와는달리 멋지고 아름다운 퇴장이됬으면하네요 기대됩니다  
20161023,10,이번앤 소박한 느낌이 많이든다 분위기도 지금까지 엑스맨 영화 와는 다를것같음...  
20161023,10,로건 트레일러가 뜨자 엑스맨 데이즈 오브 퓨처 패스트를 본 사람들은 모두 눈물을 쏟아내는데....  
20161023,10,DC팬이지만 엑스맨 시리즈는 좋아했고 특히 이 영화는 다크나이트 분위기가 난다... 하앍 제발 15세로 나와주세요  
20161023,10,여러분 팬티챙기세요 하하  
20161023,10,진짜 정말 기대된다. 역대 히어로 영화의 최고가 될 가능성이 보인다  
20161022,10,예고편만 봤을 땐 마블이 원작인 영화 중 최고의 영화가 될 수도 있다.  
20161022,10,"장장 17년간의 울버린, 휴잭맨의 이야기를 마무지 짓는 영화이니 만큼 그에 걸맞는 멋진 영화로 마무리 되었으면 좋겠습니다. 기대합니다.  "
20161022,10,가지마요...울버린ㅠㅜ  
20161021,10,아 ㄹㅇ예고편 오졌다  이건 꼭본다  
20161021,10,배경음악이 휴잭맨이 참여하는시리즈의 대미와 잘 상응한다. 영생을 빼앗긴 울버린과 나약함이 더욱 돋보이는 프로페서X.잘 뽑혀진 예고편이 본편을 기대하게 합니다.  
20161021,10,울버린이 왜 늙었냐고 평점 깎는 무식한 것들 원작에서도 올드맨 로건이라고 있는데 뭔 개소리들하냐  
20161021,9,불안하지만 전작 꼴만 나지 않기를  
20161021,10,마지막인 만큼 엄청 흥했으면 좋겠다. 전설이 될 한 남자의 이야기  
20161021,10,"안녕, 휴잭맨 그 동안 수고하셨습니다.당신은 우리들 기억속의 영원한 울버린로건으로 기억될겁니다.  "
20161021,10,제발 더 울버린처럼 하지마라 ㅠㅠ 예고편보니까 death of Wolverine 같아 보이는대 ㅠㅠ 제발 저 명작을 잘 풀어서 개봉하길 제발 ㅠㅠ  
20161021,10,슈퍼히어로도 늙고 죽음을 맞이하는건가...예고편에서 익숙한 모습의 노인이 프로페서 X라는걸 알고나서 우울해졌다.. 로건마저 늙어버리고... 다들 그렇게 가버리는건가.  
20161021,10,"더울버린은 배경이 일본이라고 별 이유도없이 까이는데 이건 안까이겠당, 원래 울버린은 일본과 땔래야 땔 수 없는 관계의 캐릭터인데 자칭 울버린 팬이라는 사람들이 울버린 영화에 일본이 나오는걸 싫어함 ㅋㅋㅋㅋ  "
