0,1,2
20170301,9,"눈물을 닦고 일어나 당당히 전하라. 그쪽에 브루스웨인이 있다면 우리에겐 로건이란 남자가 있었다고.. 마블도 영원히 풀지못할 행복한 딜레마가 생겼다. 앞으로 누군가를 퇴장 시킬 때, 로건의 마지막 장면을 넘어설 방법이 있겠는가? ""이런 느낌이었구나""  "
20170301,10,영화내내 대사람 비명밖에없던 로라가 마지맊에 데디...할때 눈물 진짜 왕창쏟음 여자친구도 영화같은거보고잘안우는데 마지막장면보고 엄청율었음... 히어로영화가아님 ㅠㅠㅠ로라 로건 짱  
20170301,9,새해에 처음 본 영화... 처음부터 대작으로 시작해서 기분이 좋네요  
20170228,10,좀 잔인하기는 하지만 재미있어요!  
20170228,10,시사회로 보고왔는데 진짜 지렸다....  
20170228,10,그냥 대박이라는 한 단어만 떠오르네요..  
20170228,10,왠만함 10점 안주는데 보는내내 울컥..캐릭터들과 이별한다생각하니 넘 슬픔ㅜㅜ 시리즈중 가장 재밋엇음 역대급이삼!  
20170228,10,오늘  혼자 보러갔었습니다.  재미있게 보았습니다.  휴잭맨이 나이들어가는것이  많이  아쉽습니다.  
20170228,10,초등학생 때 처음 봤던 게 엊그제 같은데 이렇게나 노쇠한 울버린이라니..ㅠㅠ그동안 너무 즐거웠어요. Goodbye Logan.  
20170228,10,너무 슬펐다.. 무적이라고 생각했던 엑스맨이.. 이렇게 약해진 모습을 보고있자니 먹먹해지는 영화.잔인하면서도 슬픈영화.  
20170228,8,마지막화... 깜놀했네 ㅠㅠ 너무너무 잔인행  
20170228,10,휴잭맨의 마지막영화 정말 재밌게 봤습니다~^^  
20170228,10,10대때부턴 울버린팬이었습니다.. 울버린을 보내기엔 아쉽지만 마지막인사론 충분했습니다  
20170228,10,기대 이상이며 왜 x-man 시리즈와 다른지 알겠음  
20170228,9,좋좋음 좋음 굿굿굿ㅇ56565  
20170228,10,영웅의 다른 면을 볼 수 있는 히어로물 ㅜ  
20170228,10,진짜 마무리 대박.... 울버린 영화 역사상 최고입니다. 마지막 장면은 눈물이 나더군요  
20170228,10,방금봄...우리들의영원한엑스맨로건을위하여  
20170228,10,마지막은 언제나 적응이 안됩니다...ㅠㅠ  
20170228,10,살면서 영화 500편도 넘게보며 단한번도 리뷰 쓴 적 없습니다만 오늘 처음 씁니다...일반적인 히어로 영화를 기대하신다면 안보시는게 나을지도 모르겠습니다.. 나올때도 불평하는 분 봤습니다..하지만 제 입장에선 히어로 영화 중 가장 최고입니다..  
20170228,10,"울버린의 팬으로서 정말 슬펐지만, 최고의 영화였습니다.  "
20170228,10,찡찡이 찡찡이 찡찡이 찡찡이  
20170228,1,최악극장가서본영화중 젤 재미없었음  
20170228,9,거의 20여년 가까이 연기해온 울버린을 떠나보내는 휴잭맨의 인생연기  
20170228,10,아쉽게로건이끝났지만이게또끝이아니라고생각합니다 잔잔하게괜찮았네요  
20170228,9,휴 잭맨을 위한 헌정영화 탄생!  
20170228,10,2017년 상반기 최고의영화  
20170228,9,으허어엉어너무슬퍼용  
20170228,10,선개봉으로 봣는데 눈물 존나 나네ㅠㅠ  
20170228,10,아~ 감동 로건...최고라 말할수 있다  
20170228,9,특별출연 : 로건에 김보성 나옵니다  
20170228,10,그냥.. 꼭 그렇게 보내야 했냐..싶다 분노의질주 같은 마무리를 생각했는데..  그래도 볼만함!! 지금 막 보고 올리는 후기!  
20170228,8,큰기대하고 갔는데 그나마 액션씬이 좋아서...여자 울버린 이 기대된다  
20170228,10,보고나니 로라 같은 딸이 낳고 싶어졌습니다.넘나 매력적..  
20170228,10,정말 짠합니다 진짜 너무좋았습니다 ㅜㅜ  
20170228,9,마지막이라니... 마지막이라니... 마지막장면보면서 울뻔  
20170228,8,기대했던것만큼은 아니지만 딱 킬링타임용이네요.  
20170228,10,엑스맨 새역사다 이건 다크나이크 후속  
20170228,10,명작 탄생. 로건은 휴잭맨. 모든 사람이 기억 할 것.  
20170228,10,영화이지만 현실성 넘치게 몰입해서 재밌게 봤습니다.개인적으로 X-MAN 보다 더 재밌게 봤습니다.나름 현실감 넘치는 액션이 좋았습니다.  
20170228,8,"적절한 마무리, 울버린의 이별여행  "
20170228,10,너무 재밋어서 스트레스 받음 ㅡㅡ몇일 후유증에 시달릴듯  
20170228,10,내가 이영화에 10점밖에 줄수없는게 미안할정도다 진짜 대박이다 꼭봐야함  
20170228,10,뻔하지 않은 마블코믹스영화 ... 더울버린에서 실망을 많이 했지만 이번영화는 갠적으로 감성적이고 마지막에 여운이 많이 남는 영화임  
20170228,10,마지막에 눈물 찡하네... 초딩때 엑스맨1 보고 로건 보니20대후반이라니... 수고햇어 휴잭맨.. 그와중 찰스 두번이나 죽네..  
20170228,10,볼만하다열자열자열자  
20170228,10,여운이 많이 남내요 다크나이트 이후로 이런 히어로 영화가 나올줄이야 ..가히 최고  
20170228,10,재밌어용 쿠키영상은 없습니다  
20170228,7,진부한 느낌이 들지만 그래도 완성도가 나쁘지 않은 영화에요!!  
20170228,10,이시대 마지막 엑스맨이 보내는 레퀴엠  
20170228,4,마케팅에 속았다 유치합니다  
20170228,7,로건은 마블의 세계관서 소소한 에피를 담당할 테지만 늙은 울버린이란 우울한 타이틀에 힘겨운 액션과 부성애를 곁들인 플롯이 영화를 진중하게 이끌었다.  
20170228,10,방금 보고왔습니다. 영화자체는 최고였지만 예고편이 너무 많은걸 말해줘서 안타까웠습니다.  
20170228,10,우리들과 함께 세월을 함께한 로건.엑스맨 굿바이~♡  
20170228,8,금일 전야개봉으로 봤습니다. 뭔가 액션보다는 로건의 심리가 많이 묘사되서 기존 울버린팬이 아닌 그냥 마블의 오락영화를 원한다면 좀 지루할수도 있습니다. 쿠키영상은 없네요ㅜㅜ  
20170228,10,엑스맨 시리즈중 제일 슬픈 영화  
20170228,10,완벽한 영화이다...  
20170228,6,네 머리에 한발. 나는 자연사로  
20170228,10,일단그냥봐라 기대한만큼 딱나옴...맘찢임 울버린보면  
20170228,10,잘가요 로건ㅠㅜ보고싶을꺼야  
20170228,8,기대가 컸나보다. 너무 뻔한 전개여서 아쉬움  
20170228,10,역대 마블 디씨 통틀어서 최고의 영화였습니다 휴잭맨씨 고생하셨습니다  
20170228,10,금방 보고왔는데 개꿀잼..  
20170228,10,대디...에서 눈물이 흐르더라 엑스맨 안좋아했는데 11점주고싶을정도  
20170228,10,그가 진정한 X MAN ...  
20170228,10,엑스맨 시리즈를 전부 챙겨봤다면 로건의 심리상태에 공감하면서 굉장히 슬프고 애잔한 영화.. 처음부터 끝까지 진지해서 좋았다  
20170228,10,언젠간 처음부터 다시 보겟지...ㅎㅎ  
20170228,8,"디즈니는 ""절대"" 못 만드는 청불 히어로의 가장 명예로운 은퇴작.  "
20170228,10,재미있었습니다 아빠와 딸이 공격적인껀 ...  
20170228,8,아빠.. 라는 한마디에 울버린은 로건이 됐다..  
20170228,9,이런 느낌이였구나...ㅠㅜ  
20170228,10,시리즈 중 가장 완성도가 높았다  
20170228,7,로라는 말을안할때가 더좋았다  
20170228,10,좀 잔인하지만 잘만든 영화. 죽을때 만큼은 편안히. .  
20170228,10,X맨 시리즈 중 가장 명작!! 감동적이고 씁쓸한 히어로의 인생을 잘 그려냈다  
20170228,10,"오랜시간 동안 즐겁게 해 주었던엑스맨 씨리즈고생했어요 휴잭맨, 굿바이 울버린...당신이 지켜온 이길을 멋진 후배님들이 이어갈겁니다.박수를 보냅니다.  "
20170228,8,여운이 이렇게 길 줄이야 참고로 보너스 영상은 없습니다  
20170228,9,재미있게 잘봤어요. 굿  
20170228,10,굿바이 나의 영웅!내가 사랑한 로건!  
20170228,10,"휴 잭맨의 울버린을 떠나보내다! 굿바이, 로건.  "
20170228,10,휴잭맨과 함께 나이가 드네요. 이제 울버린을 못본다고 생각하니 서글퍼요ㅠㅠ 완전 잼게 봤어요 후회는 없으실 듯! 근데 엔딩 크레딧 기다리지마세요! 없어요ㅋ  
20170228,10,강추해요 마지막 십자가 X할때 눈물  
20170228,10,눈물남  열자열자으믕아  
20170228,10,쓸쓸하고 찬란한 울버린.  
20170228,10,명작은 커녕 평작도 안나오던 울버린 트릴로지에서 이단아가 튀어나왔다 울버린의 마지막 여정이 나쁜 영화가 아니라 다행  
20170228,10,지리네.. 액션 대박이고 스토리 대박애처롭고 넘 슬프다  
20170228,10,정말 최고였다. 최고의 마지막이었다.  
20170228,10,방금전에 보고나옴  이 영화가 재미없다고 하면 정말 안된다  
20170228,2,혹시나하고 갔지만 역시나였다. ㅠㅠ참고로 엔딩에 보너스 영상 없습니다.  
20170228,10,마블 스토리가 이렇게나 진심으로 다가올수가 있구나...역시 로건!!  
20170228,10,와... 기다렸다가 오늘 본 보람이 잇네요..대박 bb  
20170228,3,마블에서나온 영화라서 기대하고 봤지만...잼없었다  
20170228,10,울버린의 끝과 또 다른시작  
20170228,10,마블 히어로 영화 중에 이렇게 강하고 감동적인 영화가 있을까? 로건  넘 좋네요! 3번 이상은 봐야 할 듯!  
20170228,10,청불이어서 더욱 울버린을 진하게 담은 느낌이었음 근데 보면 볼수록 스토리 흘러가는 라인이 더 라스트 오브 어스랑 분위기도 그렇고  흐름도 비슷해서 결말을 예측 할 수가 있었음  
20170228,10,It is for Laura.안녕 패트릭 슈트어트안녕 휴 잭맨  
20170228,4,영화관에서 본 영화 중 지루하다 느낀건 처음인 영화다른 장르이긴 하지만 인터스텔라보다 30분이나 짧다는게 믿기지가 않음3시간 짜리같고 지루했음끝나기만을 기다린 영화  
20170228,10,이런 마블 히어로를 볼 수 있다는건 행운이다. 진짜 그간의 인생를 느끼게한 최고의 작품!!  
20170228,10,그 어떤 영화보다 멋진 피날레다 너무 고맙습니다.  휴 잭맨  
20170228,10,휴잭맨 ㅠㅜㅠㅜ 가지마  끝내지마  
20170228,8,울버린에 없었던 심리묘사. 조금 늘어지는 전개가 없짐 않았는데 작별인사로는 부족하지 않은듯  
20170228,10,올해 만난 작품 중 단연최고!! 극장가서 두번 세번 보세요  
20170228,10,울버린 가디마ㅠㅠㅠ 진짜 최고임 기대 이상으로 최고임ㅠㅠ 또볼거야ㅠㅠㅠㅠ  
20170228,10,로건 방금 보고 나왔어요! 존잼 ㅠㅠ 마지막에 울었다능사랑해요 휴 잭맨!!  
20170228,10,잘가요 울버린 . 로건감사했습니다  
20170228,10,ㅠㅠㅠ마지막이라니 가지마 울버린  
20170228,8,야수에서 인간으로 마무리된 휴잭맨의 울버린.. 아직 미련이 남는다  
20170228,8,시간이 흘러도 울버린은 울버린  
20170228,9,마지막 장면에 X 보고 울컥했네 ...  
20170228,10,꼭봐라두번 봐라세번보면 더좋고  
20170228,8,아름다운 마무리... 국내영화 아저씨가 떠오르기도 했음..ㅎㅎㅎ 액션씬은 진짜 최고였다!乃  
20170228,2,기대가 크면 실망도 큰법  
20170228,10,방금보고옴~ ㅎ 엑스맨 시리즈중최고~ 로라 카리스마 쩔음~~ ㅎ  
20170228,9,영화관 알바생인데요쿠키영상없어요 ㅠㅠ크레딧 노래도 그닥 좋은편아니에여..즐감들 하세요!  
20170228,4,기존  엑스맨의 화려한 액션 대신 잔인함과 지루함이 뒤섞여서  슈퍼플렉스G관 임에도 힘들었습니다.  
20170228,10,이렇게 마음을 울리는 슈퍼히어로가 또 나올수 있을까?  새로운 세상을 본듯...  
20170228,5,조금 밋밋하고 심플했지만 울버린시리즈의 마지막으로는 의미있는 것 같습니다.  
20170228,5,지루하네요 비추입니다  
20170228,10,굿바이 마이 울버린ㅠㅠ  
20170228,5,앞에 작품들을 안봐서인지 너무 지루했음?내용도 없고  
20170228,10,"매우 다행이도 다크나이트 배트맨과 맞먹을 멋진 히어로로 사람들 마음속에 기억될 로건 아니 울버린.  특히 로건이 로라에게 하는 마지막 대사는 찰스의 염원, 그리고 매그니토가 한때 가졌던 염원, 엑스맨이 가졌던 희망의 실현이다. 겨우 마침내..  "
20170228,10,맨날 살아남겨지는 쪽이었지만  이번엔 희생하는 쪽을 선택한 로건 매우 감동적이었습니다 마지막 대사가 정말 가슴을 먹먹하게 했어요! 하지만 주인공 죽음치곤 너무 허무하고 쓸쓸했다는 생각이 드네요ㅠ 이게 마지막이라니 말도안돼ㅠㅠ  
20170228,9,"가장 사실적인, 가장 처절한 슈퍼히어로 영화  "
20170228,10,로건 휴잭맨 여전히 잘생잘생 영화 재밌게봤습니다 ㅠㅠ 앞으로 울버린 어떻게 전개될지 기대반 걱정반 ㅠ  
20170228,9,데이즈 오브 퓨쳐패스트에서 간신히 간신히 되돌려놨는데 뮤턴트들 결국은 멸종하나보군요 아 빨리 보러가야지  
20170228,10,로건 ㅠㅠㅠㅠ하 보길잘해따  
20170228,10,울버린의 장렬하고 처절한 마지막을보니 세월이 느껴집니다 엑스맨 시리즈를 꾸준히 즐겨봤던 저에게 끝은 정말 슬펐습니다  전체적으로 어둡지만 마지막 제대로된 울버린을 보고싶으면 추천합니다  
20170228,10,찬란하고 쓸쓸하신 울버린의 따뜻한 피날레... Rust in peace 로건... 수고했어  
20170228,10,"역대급 울버린,,이 정도일 줄은 몰랐다..금년 상반기 에 나온 영화중 단연 최고!  "
20170228,10,재밌음.마지막 울버린  
20170228,10,로건을 위한 나라는 없다.늙고 처절할줄은 알았는대 이정도일줄은 몰랐다.  
20170228,10,엑스맨보고 울줄이야  ㅠㅠ  
20170228,10,"전야 개봉 관람 후기해피엔딩,오랜 시간동안 로건을 좋아했던 사람이라면 보지 말 것.더 이상 시리즈가 나오지 않음에 공허하고 울적 해짐.그는 최고였고, 앞으로도 그럴 것이다.  "
20170228,8,마지막 울버린에 딱 어울리는 결말  
20170228,10,울버린이 슬플줄이야..  
20170228,10,재밌게 잘 봤음 돌아와요 휴잭맨  
20170228,10,근처 극장에서 오늘 개봉해서 먼저 보고왔습니다.모든 엑스맨 시리즈 포함해서 역대급입니다.. 꼭 보세요. 평점 난생처음 올려봅니다..  
20170228,9,정말 과장없이 딱 9점이다. 뭔가 마지막이 내기준에서는 애매하게끝나는것같아서 약간 아주약간 아쉬웠지만 그래도 액션이진짜 역대급인것같다 스토리도최고고 진짜 후반부로갈수록 눈무나왔따  
20170228,1,2시간 20분 동안 스토리진행이 너무 느리고 이거 이러다가 언제 끝내려나 싶을정도... 영화 보면서 시계만 5번 넘게 봤어요... 중간에 나가고 싶을 정도. 액션도 눈호강 정도도 아니구... 대실망한 영화 영화 평점 원래 안쓰는데 너무 실망스러워서 씀  
20170228,8,십자가를 눞히니 엑스가 되었다.. 영웅이 되기를 거부했던 울버린의 아름답고 화려한 은퇴식을 부성애로 보낼줄이야.. 언제라도 부활되길 희망하며.. 떠나는 관객들과 우는 관객들이 공존한 극장에서..  
20170228,9,상영시간동안 지루할틈도 없이 너무 재밌었네요~  
20170228,9,쿠키영상 없다는게 안타까웠다. 오-로건...오- 찰스 ㅠ ㅠ 아버지가 보고싶어졌다  
20170228,10,수고하셨습니다.  휴잭맨~ 당신은 제 기억 속에 영원한  울버린입니다.  
20170228,10,그냥 쪈다! 처절하고 강렬하지만 로건의 인간미가 느껴진다  
20170228,8,영웅의 아름다운 퇴장~~  
20170228,10,재미지네요 긴장감 잔인하고  
20170228,3,아재 힘겨워 보여서 보기가 안쓰럽...다소 징그럽고 더티하고 시끄럽고...러닝타임도 넘 길고- -;;  
20170228,9,다 괜찮았는데 쿠키영상이 없었음 ㅠㅠ  
20170228,10,강력한 SF보다는 휴먼니즘에 대한 스토리~ 라스트 울버린  
20170228,3,마지막 엑스맨인데 기다리다 지루하고 결말이 너무 .. 재미없네요 실망이예요 ㅠㅠ  
20170228,10,새드하면서 어떤의미론 해피  
20170228,10,생각보다 잼잇네요 볼만합니가  
20170228,10,울버린의 대미를 장식하는 완벽한 영화.  
20170228,10,한마디로 굿!!! 완벽한 영화  
20170228,8,굿바이 휴잭맨 그동안  즐거웠어요  
20170228,10,올해 본 영화 중에 최고였다.잔인하고 먹먹한 감정. 뒤섞이기 힘든 건데 이 영화는 해냈다.  
20170228,1,왜! 청불이야! 왜!!!  
20170228,10,로건이었던 그가 후반부에 다시 '울버린' 이 되는순간 감동  
20170228,10,잊지 못할 영화... 이런 기분이군...  
20170228,10,허남웅 정말 평론가 맞나? 박평식보다 저질평이네  
20170228,8,르느와르도 아닌데 피빛 비장미라니. 그래도 마지막 울버린이기에 인정.  
20170228,10,휴잭맨 말이 필요한가?  
20170228,10,5분 스트레이트로 질질짯습니다ㅠㅠ  
20170228,10,여자애가 잘 커줬으면 좋겠다..  
20170228,10,벌써 짠하다.쓸쓸하게 들리는 hurt와 내 생애 최고의 마지막 울버린..  
20170228,10,슬프다 이런 결말이라니... 담담하게 마무리했다  
20170228,9,재미있습니다. 잔인하지만 볼만합니다.  
20170228,10,"이것은 헌정사, 슬프고도 아름다운 울버린의 마지막을 함께하는 것에 벅참을 느꼈다.  "
20170228,10, Goodbye Logan.  
20170228,7,2003 성인 둘리를 본 기분  
20170228,10,울버린으로서의 삶이 아니라 로건으로서의 삶  
20170228,1,악당이 하는게 1도 없음 억지 휴면스토리에 스케일은 ㅉㅉ  
20170228,10,이 감독이 더 울버린을 만들었다고??헐 그동안 무슨일이 생긴겨.. 최악의 망작다음에 최고의 명작을 만들다니  
20170228,10,보는내내 참 슬펐다..  
20170228,10,쿠키없다 기다리지마라  
20170228,10,역대 울버린 시리즈 중 가장 재밌었음  
20170228,10,후... 프로페서x보는 순간부터 계속 충격이네요...영화 내용도 괜찮았어요  
20170228,10,와 간만에 진짜재밌게봤다 최고  
20170228,9,로건의 마지막 로건의 씁쓸함...  
20170228,10,띵작. 엑스맨 시리즈중 최고  
20170228,10,5시 영화 보고 왔습니다.눈을 즐겁게 하는 히어로 영화는 수도 없이 많았지만가슴을 울리게 하는 히어로 영화는 처음인거 같네요..잘가요 로건..  
20170228,8,잔인했지만 재밌게봤어요!  
20170228,8,기존 히어로물과 다른것이 신선합니다 많은것을 생각하게 만드는영화인것같네요  
20170228,8,내면으로 파고든 울브린...  
20170228,9,케릭터도 배우도 스태프도 모두 그동안 고생하셨습니다.  
20170228,10,이때까지 울버린중에 최고다  로건  
20170228,10,초딩부터 엑스맨 팬입니다. 휴잭맨을 보내기가 이렇게나 힘드네요. 슬픕니다.  
20170228,10,정말 슬픕니다 ㅠㅠ로건....  
20170228,10,전야개봉으로 오늘 저녁에 봣는데 스토리가 참 좋은거 같네요 보면서 감동받은 것도 조금 잇고요 울버린=휴잭맨 사라져서 아쉽네요 ㅠㅠ  
20170228,10,아빠랑 딸의 합작이다!  
20170228,10,울산 하루 앞서 개봉했길래 5시 40분영화 보고 후기 바로 남깁니다 여운이 엄청 남는 영화네요.. 아역도 매력있고 재밌게 잘봤습니다 굿바이 엑스맨  
20170228,10,마지막을 이렇게 잔잔하면서 멋지게 마무리하다니 마지막에 울었네요.  
20170228,10,서부극  셰인입니다  1980년대 티비로 셰인을 본사람 추천  
20170228,10,히어로영화보면서 한 영웅이 추억속에 사라지게되어 울은적은 처음이다  
20170228,1,오후 5시 영화 보고나왔습니다..완전 빵점입니다 오락 영화도 아니고 휴머니즘도 아니고 이건 뭐 청불인데 애들 많이 나오고 목 짤리는것만 잔뜩나오고 개봉하자마자 3일안에 평점 4-5점대로 떨어집니다 알바들도 이건 못살림  
20170228,10,오늘 전야로 보고왔습니다 근데 혹시나 기다리시는 분들께  엔딩크레딧 없었습니다 추가됐다해서 제작자들 이름 다 올라가고 후에 15000뭐시기 숫자 적힌 영어 두줄 나오고 걸그룹 노래 흘러나오더군요..그래도 혹시모르니 기다리실 사람은 기다리시길  
20170228,9,정말재밌었는데 두번졸았당.여자애가 크면 울버린보다더멋질듯  
20170228,10,정말 울버린 너무나 좋아했엇는데 이렇게 마지막을 잘만들어줘서 정말 감사합니다. 엔딩장면에서는 극장에서 펑펑울었습니다 엔딩크레딧이 올라가면서 깊은여운에 빠지더군요 단순한 슈퍼히어로 영가아닌 그이상의 명작이라고 불러도 무방할정도로 최고의 영화였습니다  
20170228,10,ㅜㅜ 눈물과 감동....너무 잘봤습니다. 수고했어요 휴잭맨  
20170228,10,장르는 액션영화인데 사람들이 보는동안 훌쩍거림  
20170228,10,울버린이 아닌 로건으로 마지막 X  
20170228,10,씁쓸하고 아련했다..  
20170228,10,박평식이 7점 줬다...그래도 안 볼겄인가?공감 눌러다오  
20170228,10,X맨 시리즈 하나도 안봤는데도 상당히 재밌게 보았네요  
20170228,10,로건이죽어요ㅠㅠ이럴수가!!!  
20170228,10,Good bye Logan....ㅠㅠ  
20170228,9,울버린 시리즈는 이전부터 19세로 만들어야 했다.  
20170228,10,마지막 울버린 다시 못보다니 ㅠㅠ  
20170228,10,동서남북으로 날뛰면서 광광 울부짖었다  
20170228,10,적과의 써움에서 이렇게 힘들게 싸워 이기는 모습이 마치 인간의 시작과 끝의 사투를 보는 듯 했다. 한때 젊음과 흥했던 모든것이 사라지고 시간이 흐르면 누구하나 빠지지 않고 모두가 이렇게 될것이란 깊은 철학과 진실 아래서 영화는 고결한 사투를 시작한다.  
20170228,8,전작은 말아먹더니 이번에 확실히 다시 명성을 찾은 후속작. 쿠키영상은 읍네요  
20170228,10,최고의 마무리다. 여운때문에 자리에서 일어날 수가 없엏다.  
20170228,10,진짜 눈물날뻔함 꼭 보세요 명작입니다  
20170228,10,진짜 너무 재밌게 봤다 요즘 알바 투성이 쓰레기 영화속에서 정말 영화다운 영화 봤다.. 엑스맨 팬이시라면 꼭 보시길 두번보시길  
20170228,10,아 울버린...내최애케인데...안녕 이제극장에선 못보겠구나ㅠㅠㅠㅠ진짜 이런결말 슬프면서도 받아들일수있다ㅠㅠㅠ으헣헣  
20170228,10,히어로 영화를 이정도로까지 끌어올리다니 대단하다는 말 밖에 안나온다. 2시간이 넘는 영화임에도 불구하고 지루할 장면 없이 모든게 완벽하다.  
20170228,10,왜 청불울 택했는지 알수있음.. 진짜 다른 엑스맨이면 몰라도 울버린은 첨부터 청불했어야 했네요ㅋㅋㅋ액션 역대급이고 로라와 버디무비같은느낌. 참고로 쿠키영상 없습니다ㅋㅋㅋㅋ 있는줄알고 다들 기다렸는데 없더라구요  
20170228,10,굿바이 로건...ㅠㅠ  
20170228,10,레전드다 이건 광광우럭따 ㅜㅜ  
20170228,10,영화 크레딧 올라가도 아무도 나가지 않고 있다 몇명은 울고...  
20170228,10,진짜 최고 명작이다 10자이상  
20170228,10,불멸의 상징이 석양처럼 황홀히 지는구나  
20170228,10,박평식 평론가가 7점을 줬다니 내 눈을 의심했다  
20170228,9,평식이형이 7점 줬음 말 다한거 아니냐.  
20170228,10,왜  청불이냐 극장에서 못보겠네  
20170228,9,ㅋㅋㅋ 19금이라 급식들 안보여서 좋겠군. 아 형 아재가 먼저 보고 후기 남기마 ㅋㅋㅋ  
20170228,10,평식이 형이 7점 줫다보러가야겟다  
20170228,10,샘레이미의 스파이더맨처럼 인간적인 영웅을 볼수있는건가  
20170228,10,박평식님이 7점 줬으면  볼 만한 영화입니다  
20170228,10,"짠물 박평식, 이용철이 별3개 이상을 줬다. 일단 봐야겠다.  "
20170228,10,평식이 횽님이 7점주고 애처롭단다 믿고 보자!!!  
20170228,10,평식이형이 인정했다 게임끝  
20170228,10,왜...청불...진짜보고싶었는데  
20170228,10,OO 이건 꼭봐야되.... 로건보면서 울어버릴거 같다. ㅜㅜ  
20170228,1,울버린이 왜 능력을 잃냐~늙긴 왜 늙어? 아주 설정부터 개판이네  
20170228,10,캬 역시 명불허전.ㅎㅎㅎ  
20170228,10,시사회로 본 사람들  전부다 최고 중에 최고다라고 하네.. 어느정도길래.. 시사회 평 몇개만 찾아봤는데도 소름이 돋는다  
20170228,10,급식충들 못봐서 기분 딱 좋아서 10점. 아 물론 난 엑스맨 처음부터 끝까지 다 본 33살 아재  
20170227,10,박평식이 애처롭고 애틋하다 는 말에 말 다한거지  
20170227,10,내가 아직 성인이 되지못해 이 영화를 극장에서 볼수 없다는것이 한스러울 따름이다 예고편만 보고도 알수있다 역대 최고의 울버린이자 역대 최고의 히어로영화중 하나가 될것이다  
20170227,10,울버린 형님 28일 23:20 전야개봉 예약했습니다. 그 날 봅시다 !  
20170227,10,박평식이 7점 줬으면 이 영화는 걸작입니다  
20170227,10,dsfvsfsfSSSS  
