0,1,2
20161020,10,더울버린처럼만하지말자...  
20161020,1,제임스 맨골드가 울버린 캐릭터 망치려고 작정했구만. 터미네이터5처럼 배우가 늙으니까 억지로 스토리 짜내서 '절대 안 늙지만 늙는 걸로 바꿨어~'로 해버리다니! 안 봐도 뻔하다. 배우가 아깝다. 왜!!! 설정을!!! 늙는 걸로!!! 했냐고!!!!  
20161019,10,휴잭맨 너무멋있다 기대된다  
20161015,10,빌런은 미스터시니스터 확정이니..감독님이 더울버린 감독님이지만 기대해봅시다! 휴잭맨과 미스터시니스터는 봐야죠!  
20161013,9,제임스맨골드 너잘들어 너저번처럼 휴잭맨을 걍가지고놀아서 영화망치면 니모가지꺾는다  
20161011,9,OO 이거 청불이래ㅠㅜ  
20161009,10,이번엔 좀 재밌개 해라  사람들이 딱 볼수 있게  
20160814,5,왜 감독이... 마블아 기회를 다시 준거니 ㅠ 믿어봄  
20160724,10,기대기대하고있습니다  
20160705,1,아포칼립스 쿠키영상에 울버린 혈청을 가져가는게 나오는데 울버린 혈청으로 만들어지는게 데드풀말고 또 있다면 영화가 산으로 가는거지.  그러게 오리진에서 데드풀을 왜 등장시켜?  
20160619,10,그래도 X맨 하면 울버린 울버린 하면 휴잭슨  
20160616,10,에섹스는 엑스맨 오리지널편 빌런으로 나올거라던데 울버린 빌런은 누가 나오려나  
20160607,1,감독보니 걸러야겠다 믿긴뭘믿냐  
20160531,5,휴잭맨 생각하면 만점이지만..이거 감독이 울버린으로 말아먹은 그 감독이잖아. 아오...휴 잭맨이 아깝다ㅠ  
20160530,10,평점 수정함..잭맨이형 마지막 울버린만은 별밭을 걸었으면 합니다.  
20160528,3,OCN에서 더울버린 방영중인데.. 시리즈 중에 최악이다.. 제발 좀 참아쥬라...  
20160526,1,감독이 더 울어버린 감독..ㅎ ㅏ...슬프다..  
20160520,10,더 울버린 평가가 안좋은 나라는 단 한나라밖에 없다. 바로 한국. 더 울버린 로튼토마토 지수가 70이다. 더 울버린 충분히 수작인데 왜 욕질? 오히려 엑스맨 탄생 울버린은 38로 망작 평가 받음.  
20160515,10,빨리 보고 싶은 영화 입니다.  
20160514,6,기대했는데 감독이....  
20160508,10,울버린 사랑해요 ㅋㅋ호홓ㅎ  
20160501,10,fewfewafadvggbeaqbdf  
20160428,10,보고싶은데 R등급이라면서요ㅠㅠ....  
20160427,9,휴잭맨은최고지만이감독은쫌ㅡ?ㅡ  
20160423,10,휴잭맨에 울버린은 이영화로 끝인가. 제발 울버린 시리즈중 최고였으면 좋겠다.  
20160423,9,50세면 어떰 ㅋㅋㅋㅋ 미션임파서블 톰 크루즈도 50이넘는대 ㅋㅋㅋ  
20160307,10,휴잭맨이니 기다려집니다  
20160226,10,아이덴티티만큼 만들어라 믿고보는 맨골드  
20160220,5,더 울버린 감독이라니... 판타스틱4 보다 더 충격이었다 정말.  
20160112,10,얘들아 휴아저씨가 이 영화만 찍고 떠난다던데ㅠㅠ  
20151225,10,기대되요 빨리보고십네요.  
20151031,10,올드맨 로건 스토리로 가거나 제대로 된 세이버투스 보여주거나 오메가레드 보여주거나 제발 오리진같은 웨폰X스토리말고 제대로된 과거스토리 찍거나 제발 이번엔 잘 찍어보자 제발 울버린도 흥해보자 덷풀도 개봉하는데 덷풀 까메오라도 불러보는거 어때  
20150723,1,감독이 '더 울버린'동일감독....  
20150704,2,하필왜....매튜본 싱어 ㅈㄴ조흔감독 놔두고 왜 저감독을ㄷㄷ어휴  
20150528,10,어벤져스에 휴잭맨이 울버린으로 연기할수가있을 때까지 연기해주셨으면..  
20150415,1,더울버린 일본홍보영화로 말아먹고 또 아류작 찍어내면 죽는다 감독아  
20150313,10,분명 재밌을거라고 믿음니다 잭맨 형만 믿으며..  
20150215,2,썅 왜 또 이감독이야 폭스가 미쳤나  
20150131,10,덷풀 2016년에 개봉한다는데 콜라보해줘요ㅠㅜㅠㅠ둘이 티격태격ㅠㅠㅜ보고싶다ㅠㅜㅠㅜ기대만땅!  
20141019,10,휴잭맨 너무좋아 멋있어요♥♥♥빨리나왔으면♥♥크하♥  
20141003,10,"제임스 형.. 더울버린은 잠깐 약 빨고 만드셨다고 생각할게. 형은 그런 사람 아니잖아. 3:10투유마, 나잇앤데이, 앙코르 ㅅㅂ 말하자면 끝이 없어 형의 능력은. 난 형을 믿어. 약만 빨지마.  "
20140914,7,믿는다 재밌을거라고~~~아씨  
20140818,1,엑스맨 시리즈 사상 최악이라는 평을 받는 더 울버린을 만든 감독이네요.. 안봐도 뻔합니다.  
20140727,10,팀 엑스 나와줘 오메가 레드 나와줘 제대로 된 세이버투스 나와줘....진짜 오메가 레드 보고싶다 영화에서...  
20140715,10,더 울버린처럼 sf·액션영화가아닌 로맨스가 대부분인영화를 또 보게된다면 때려치울거임. 오직 휴잭맨때매 10점줌.기대하게씀  
20140627,10,하... 휴잭맨 형만 믿을게요  
20140616,10,데오퓨덕분에 더 울버린 후속은 아닐 겁니다.역사가 바뀌었으므로 전혀 다른 울버린이 나올 수 도 있습니다.  
20140602,10,감독 만회해라 진짜 또 그런식이면 그냥 울버린 팬으로 만족해라  
20140531,1,감독이  더울버린감독이네ㄷㄷ  
20140528,10,세이버 투스는 나온girl로알고있는데엑스맨:울버린 탄생  
20140513,10,저번작보다만 나으면 됩니다  
20140506,10,이번판 빌런은 세이버투스가 좋겟음  
20140430,1,이 감독 또 쓰냐 !!! 휴잭맨 불쌍해 !!!!  뼈잭맨 어쩔껴 !!!! 이 변태 감독아 !!!!  
20140426,10,휴잭맨이 아닌 울버린은 상상도 하기 싫지만 이 영화 개봉했을때 휴잭맨 나이가 50살임  
20140423,10,마블 시리즈는 왠지 모르게 기대가 된다...  
20140323,10,울버린도 삼부작으로 가려는건ㄱ．  
20140219,10,이번에도기대해봄 진짜변태영화금지아니솔직히까놓고일본그자식들이찍는건 요즘들어변태가존나많이나와솔까그런거저남자인대 왠지엑스맨에는않어울려 그리고싫어요이번에기대해봅니다.  
20140205,10,이번엔 한국에서 하는걸로  
20140102,10,악당은 미스터시니스터나 다켄으로...  
20131126,10,더 울버린에서 실망했지만 그래도 휴잭맨믿고 기대해본다.  
