0,1,2
20170130,5,아이와 함께 이 영화를 본다고??사랑하는 사람의 죽음을 받아드린다는게학습으로 가당키나 한단 말인가..영화는 지루한감이 없잖아 있지만 영상미와 음악이 좋아 5점 드립니다.  
20170130,1,또 꿈이면 그만 본다 싶은 때 또 꿈에서 깨어났다. 꿈만 꾸다 세월 다 가는 한심한 영화다.  
20170130,10,잘못 번역된것을 보시면 이해보다 오해로 호불호가 갈리겠네요...  
20170130,8,"연령대나 공감대에 따라 호불호가 갈릴듯 하다. 똑같이 지루한 영화라도, 남들이 빨아주거나 놀란이 만들었다면, 자신도 그저 같이 핥아주기에 바쁜 그런 사람들에겐 어렵고도 감흥이 없는 그런 영화 되시겠다.  "
20170130,1,평점 높은데 보고나서 실망한 첫 작품..  그냥 어린애 성장이야기인데.. 너무 재미 없게 풀어 놨음.. 절대 보지 않는것을 추천한다.. 감동도 없고... 그냥 개똥임  
20170129,9,자신이 처한 현실로부터 도피하기위해서 어릴적부터 들어온 엄마의 동화속 이야기로 도망쳤다...어릴때 부모를 잃어본 사람이라면.. 그때 그 아픔을 동화로 풀어보고자 한다면.. 충분히.. 아니 꼭 봐야하는 영화라고 생각한다..  
20170129,5,아...좀...아닌데...별얘기도 없는걸 1시간40분 존내 늘여놨음...심지어 볼거리도 없음;; 5점  
20170129,7,A Monster Calls  
20170129,9,엄마는 아들이 이겨낼꺼란걸 믿고 있었던가 같다..  
20170129,9,"너무 아픈 성장통, 엄마의 동화책을 보는 소년의 눈빛과 아름답고 시린 OST에 진한 여운이 남는다.  "
20170129,9,영화에 삽입된 음악도 너무좋고..여운이 남는 영화네요..슬픔과 절망적인 현실속에 방황하는 어린주인공의 스토리에 판타지가 가미 되니 감동적이고 잼있게 봤네요~  
20170129,10,다른 영화중 미스페린이나 BFG나 Somnia처럼 판타지 성장영화인데 이 영화가 단연코 최고다. 별 기대하지않고 봤는데 수작임.  
20170129,10,"영화가 상당히.. 난해해서 이해가안되는부분이 좀 있다.  빨리 리뷰가떳으면좋겠네. 그리고 영화에나오는 애들이 죄다 사이코니 소시오패스니  그런말을 하는 사람은, 파도는커녕 물결조차 일지않는 고인물처럼 너무나 평범하고순탄한 인생만을 살아왔나보다.  "
20170129,7,아이 빼고 다른 배우들의 비중이 음;  
20170128,8,생김새는 그루트 목소리는 옵티머스 프라임..  
20170128,4,아픈 현실의 도피처이자 치유의 산물  
20170128,10,리암리슨이라면 정말기대된다구 !!ㅎㅎ  
20170128,7,성장통은 결국 자신이 이겨내는것  
20170128,9,왠만한 영화 점수주고 그러는 사람 아닌데.. 이건 좀 찡하다.. 시고니위버의 약간 어설픈 영국식 영어발음이 좀 거슬리긴 했지만..  너무 재미있고 감동적이었다.  
20170127,1,보면서 내내 판의미로가 생각낫다.  판의미로같은스타일을 만들려고한  성장통드라마인데  명작은 아니라는 생각이 든다   그닥 봐도 그만 안봐도 그만인듯한 영화  
20170127,7,그냥 잘만들었네 마지막에 주인공 엄마 어릴적 그림에 나무정령과 함께 있는 모습이 인상깊었다.  
20170126,1,재미없습니다  처지는영화라그닥  
20170126,6,인내심이 필요한 영화..  
20170125,6,괜찮은 척 자기의 감정을 숨기고 살았던 주인공이 진정 자신의 감정과 마주하면서 성장하게 되는 내용을 잘 다루고 있다. 익숙한 내용과 다소 느린 진행 탓에 조금 처지는 건 아쉽다.  
20170124,8,아이 앰 그루우우우우트!!!  
20170124,5,현실을 도피하려 해봤자 기다리는건 괴물  
20170115,10,"딸애와 함께 원작을 읽었는데, 기대 이상의 감명을 받았어요.어른 아이 구분없이 꼭 권하고 싶어요.북미 쪽 개봉소식을 접하고, 우리나라 개봉을 애타게 기다리고 있어요.개봉 첫날 달려가 보려구요.주변 지인들에게도 추천해 두었는데, 기대가 큽니다.  "
20170107,10,아.. 스토리.. 80년대 성장기 SF영화들이 생각나는 간료하고도 설레이는 내용이네요.  
20170107,8,오데온 리밋리스 카드 뽕도 뽕을겸 예고편이 괜찮은 것 같아서 봤습니다. 처음엔 뜬금없네 거리다 뭔가 이해되기 시작하고 막판에 좀 울다가 마지막에 아.. 거리면서 끝나는 영화  
20170103,9,아 진짜 보고 싶은데 개봉했음 좋겠다  
20170101,10,저 지금 캐나다 살고 잇는데여기에서 엄청난 호평이네요  
20161206,10,keane의 음악에 지리고 갑니다.  
20161105,10,엄청 재밌을것같다...배우들 라인업도 장난없네요...ㄷㄷ  
20161101,10,2012년에 책으로 정말 재미있게 읽어서 기대하고있엇는데 왜 한국개봉은 안하는것같죠..? 개봉했으면 좋겟네요...  
20160930,10,keane이 ost 해서 10점 먹고 갑니다  
20160822,10,패트릭 네스의 원작이 대단히 감동적이면서도 의미있는 작품이었어요. 영화화 된다니 많이 기대가 되고 어서 보고 싶네요.  
20160805,2,저 이거 원작 봤는데 완전 성장소설이에요. 영화도 그렇게 될 것 같네요.  
20160531,8,원작 소설을 재미있게 읽어서 기대가 됩니다그런데 줄거리가 이상한거같아요.. 원작이랑 다른데...  
20160303,10,리암니슨형님은 80대 되셔도 클라스는 영원하시다.  
20150917,10,ㄹㅇ 기대되는영화!  클라스 증명해주시길  
20150820,10,리암니슨기대됩니다그리고시고니위버도플러스로기대중.  
20150412,1,은퇴안하냐? 60대인것같더만  
20141021,10,후안 안토니오 바요나 감독의 행보가 심상치 않다. 이 감독을 주목하라  
20140828,10,오 시고니위버에 리암니슨이라 ㅎㅎ  기대된다 어떤 스타일의 판타지 영화가될지  
