0,1,2
20170913,8,몬스터는할아버지 일지도 모르겠다  
20170913,10,그루트 프리퀄인가요  ㅋㅋ  
20170913,10,민서가 보고싶대 언제 보러가지  
20170913,6,지루함은 어쩔수 없다.  판타지를 기대했다면 기대이하...  
20170913,8,하필 초반  평론가 평점이 믿고 거르는 애들이 둘이나 껴있네  
20170913,10,사람감정선은 동서양이 구분없구나  
20170913,10,몬스터 성우가 리암니슨... 미쳐따  
20170912,10,판타지와 다른 내면의 판타지 슬픔과 감동을 소름돋음으로 표현하는 영화.판타지 그것은 진실이였다.  
20170912,4,좋은 대사도 있고 중간 중간에 애니메이션이 독특하지만 반전도 작고 기대만큼 감동도 크지않다.  
20170912,9,코너의 심정이 이해가서 너무 마음이 아팠어요. 한바탕 펑펑 울었어요  
20170912,7,어찌된게 영화보다 괴물이 들려주는 동화가 더 재밌냐 ㅋㅋ.. 영상미 하나는 진짜 맘에 듦  
20170912,8,엄마가 그랬듯 어른도아닌 소년도아닌 이가 그랬듯 우리도 그렇다. 사랑하는 이를 떠나보내는 슬픔을 다독여주는영화  
20170911,1,개실망 감히 최악이라고 말할수있다예고편보다 재미없는 본편  
20170911,7,때론 고통스런 진실보다 거짓스런 위로가 필요하다.  
20170911,10,감동적이였다 생각보다 괜찮은 영화  
20170911,9,두려움을  극복해나가고 성장하는 코너의 모습이 인상깊다  
20170911,10,다시 보고싶은영화. 포스터도 인상적  
20170911,10,아무 생각없이 봤는데 너무 슬펐어요 꼭 보세요  
20170911,8,두려움을 극복하고 마주한 진실은 엄마가 아들에게 남겨주는 위로와 사랑. 몬스터가 들려주는 이야기를 수채화 기법으로 풀어내는 점도 환상적인 연출에 한 몫 거든다.  
20170911,10,잔잔할줄만 알았던 몬스터콜...스토리가 굉장히 흥미진진 하네요~... 눈을 못떼고 봤습니다.  
20170911,7,감동적인 스토리였어요:)  
20170911,7,외양은 거칠지만 섬세하게 마음을 다독이는 몬스터.  
20170911,7,마지막이  좀 이해 하기 힘드네요ㅠ.ㅜ  
20170911,8,환상적인 이야기 감동입니다  
20170911,10,현실적이고 감동과 여운이 남는 판타지 성장이야기재관람 추천이요  
20170911,8,내마음에도 몬스터가~짠~한~  
20170911,8,아름다운 성장 스토리네요. 영상미가 매우 아름답습니다.  
20170911,10,마지막 장면에서 눈물이 왈칵! ㅠㅠ 영화가 끝난 후에도 한동안 생각하게 만드는 영화.  
20170911,10,미친듯이 감정이입이 되서... 나도 모르게 눈물이 쏟아짐.최고의명작...!!!  
20170911,10,역시 이거 짱이네.ㅎㅎ  
20170911,10,어린 주인공 배우가 연기를 너무 잘 해서 감정이입이 잘됬어요  
20170910,1,사랑하는 여자를 칼로 죽이고 평생 행복하게 산 왕자????  
20170910,10,"마음이 먹먹해요. 쉬웠던일이 어려워지고, 어려웠던일이 쉬워지는  무섭고. 먹먹한데 그래도 마지막엔 미소를 지을수 있어요. 오랫만에 눈물짓게되는 영화네요.  "
20170910,9,"보고 나서도 잊혀지지 않는 영화입니다. 아름다운 화면에 슬프고, 울고난 후 주인공 코너를 응원하게 됩니다. 성장이란 삶이란 이런 성장통이 동반되는걸 알면서도. 늘 아픕니다.  "
20170910,6,어린이용 눈물빼기 영화. 비슷한 영화를 봤다면 스킵가능  
20170910,8,판의미로 같은 느낌의 영화인건가??  
20170910,10,마지막 30분은 휴지없이 못본다  
20170910,10,우선 나에게는 몬스터 콜의 이야기에 공감했다. 나는 영화 속의 코너처럼 집단 따돌림도 받고 지역사회의 냉대와 가족 및 친척의 무관심도 받았다. 나는 이 영화를 보며 웬만해서는 영화를 보며 울지 않은 나조차도 울어버렸다. 이 영화는 내게는 인생영화였다.  
20170910,5,"아직개봉안했는데 개봉하기 15일전 부터 봤는데,, 쫌 지루해요,,,  "
20170910,7,아이 엠 그루트 그루트 최종 진화형  
20170910,10,10점   만점에   10점  .  
20170909,10,암병동에서 환자가 힘들어하는 모습을 지켜보며 그 옆자리를 꿋꿋하게 지키고 있는 가족의 마음을 직접 경험했기에 너무 와닿네요  
20170909,8,어제 시사회에서 봤습니다 잔잔하면서도 죽음에 대해.. 곁에있는사람의 고마음에 대해 ..뭔가가 가슴한켠을 때린듯한 충격(?)...  
20170909,10,마치 내 이야기같다. 지난 겨울 엄마를 떠나보내야 했던 그 슬픔을 어린 소년을 통해 다시 느낄 수 있었다. 짧게 자른 머리와 깡마른 엄마의 모습도 어찌 이리 닮았을까... 내가 잘 이겨내고 있는 것처럼 저 소년도 잘 이겨내리라 믿는다.  
20170909,10,잼있습니다... 동화같은 아름다운 슬픈이야기네요... 사실 억지로 눈물을 짜내려 하지 않고 환상적인 스토리들로 자연스럽게 이야기를 풀어가네요.. 그리고 그 대사들이란....강추입니다...  
20170908,9,아이와 함께봤는데 너무 슬퍼서 눈물이 멈추지않았어요 동화적인 이야기가 가미되어있어 더 흥미로웠구요 오랜만에 재미있게 잘봤어요  
20170908,1,자폐증 환자보는줄 ....  
20170908,10,세상의 모든 아픔도 치유해줄 리암 니슨의 그윽한 음성... 정말 슬프게 행복한 치유 성장 영화!  
20170908,10,아프지만 아름다운 믿음과 사랑... 영화 정말 강추합니다 매혹적이면서도 슬퍼요.. 사랑할 수 밖에 없는 영화네요 꼭 보세요  
20170908,8,"마지막에  너무  슬펐어요 ㅜㅜ눈물훔침. . . 내 내면을 다시 들여다 보게만드는 영화 , 어른들이 봐야할듯  "
20170908,10,올만에 동생이랑 시사회되어 보러갔는데 잼나그 치유되는 맘으로 봤네요 강추  
20170908,10,시사회 보러 아무 기대 안하고 있었는데 나도 모르게 빠져들었다 돈을 주고 봐도 미안할 정도로 가치 있는 영화다 중학생 정도부터 이 내용의 의미를 알뜻 하다.  
20170908,7,떠나보내야 하는 사람의 고통. 괴물이 겨우 막아줄 수 있는 마음의 싱크홀. 사려깊게 위로해준다.  
20170908,10,뻔한  이야기를  아이관점으로 감동적으로 표혆함  
20170908,10,나에게는 올해 최고의 영화. 영화관에서 이렇게 울어본 것 처음이다. 너무 따뜻하고 슬프다.  
20170908,8,되게 좋은 소재와 좋은연출력이긴 한데 후반부를 위한 초반 러닝부분이 좀 지루했었음  
20170908,6,"주제, 내용, 연기 모두 좋았음에도 의외로?? 나에겐 무덤덤했다  "
20170908,4,오늘 시사회 보고 왔는데 트렌스포머보다 재미가 없더군요...  
20170908,10,이건 절대 돈이 아깝지 않은 영화입니다. 이런 감성판타지 는 지금 가을에 보면 더할나위없이 최고집니다.  
20170907,10,9월7일 수유 시사회관람.내가 마주하고싶지않은것을 인정하고 받아드리는것마치 내자신이 죽을것만같은기분.. 어른이던 아이던 그것을 이겨낸다는것은 너무힘든일이다  
20170907,10, 처음의 느린 전개를 통해 후에 큰깨달음을 얻을 수 있는 스토리.몬스터와 소년의 일체화로 비로소 솔직한 자신을 표현하게 되는 모습이 인상적!부모는 자식에 대한 사랑과 삶에 대해 돌아보게되는 순간.자식은 부모의 죽음과 자신의 두려움에 당당히 맞서는 순간  
20170907,10,재미있다는 표현보단 좋다는 말을 하고 싶은 영화  
20170907,9,누구나 가슴 속에 몬스터가 있다.  
20170907,10,오랜만의 감동의 영화 코너의 마음이 너무도 와닿는 영화  
20170907,9,기대하지 못했던 가슴 뭉클함이??  
20170907,7,시사회에서 봤습니다일상의 동화네요볼만합니다  
20170907,10,엄청 기다렸던 영화인데 롯시 생일맞이 이벤트에 당첨돼서 드디어 보게 됐네요. 이제 곧 시작 되겠죠. 넘넘 기대됩니다. 잘 보겠습니다 ^^  
20170907,10,정말 너무 좋은 영화라 많은 분들이 보셨으면 좋겠어요. 펑펑 울고 나옴ㅠㅠ  
20170907,10,어른들을 위한 아름다운 동화.. 가을의 초입에 너무나 잘 어울리는 영화에요  
20170907,10,마음이 따뜻해지는 영화 많이 감동받고 왓어요  
20170906,9,9월 개봉작중 가장 큰 수확이자 선물  
20170906,10,몰입도 최고에 강요하지 않는 슬픔. 너무 좋은 영화!!  강력 추천!  
20170906,10,"대사 하나하나 장면 하나하나 곱씹게 되고, 끝난 후 다시 봐야겠다는 영화였습니다. .. 우리를 위한 어른을 위한 영화  "
20170906,10,눈물 뚝뚝 흘리면서 봤다 ㅠㅠ 강추ㅠㅠ  
20170906,10,시사회로 봤는데 남주 너무 귀엽고 내용이 너무너무 공감됨ㅠㅠㅠ강추합니다  
20170906,10,시사회로 보고 왔는데 진짜 감동 ...ㅠㅠ 어른아이 할 것 없이 모두가 좋아할 애니일 듯  
20170906,10,진짜 대사하나하나가 모두 가슴에  꽃히는..ㅠ 너무 감동적이었어욤..  
20170906,10,엄청 기대돼요!!!!  
20170906,10,에이씨 안 울려고 했는데...ㅜ.ㅜ  
20170906,10,"시사회보고 왔는데, 강추해요!! 감성돋는 판타지 진짜 보고싶었는데 너무 재밌게 봤어요!!  "
20170906,10,시사회 보고왔는데 어른들을 위한 힐링 영화라는게 확 와닿았음 좋네요 이영화  
20170906,10,애들을 위한 영화일줄 알았는데 너무 슬퍼서 펑펑울었다..  
20170906,10,시사회 보고 왔는데 주인공은 학생이지만... 20대인 나에게도 많은 생각을 하게 해주는 영화였어요  
20170906,10,시사 보고왔는데 뭔가 오랫만에 이렇게 가슴 따듯해지는 영화를 본거같아요 너무 슬펐어요 ㅠㅠ  
20170905,10,오 예고편보니 넘 보고싶어지네. 새로운 느낌. 판타지 같기도 하고 따뜻한데 무서울것도 같고..  
20170905,10,진짜 인생영화 ㅜㅜ 완전 위로와 용기 힘을 받았습니다.세상의 모든 코너들 힘냅시다..시사회보고왔는데 개봉하면 한번 더 보고싶네요.  
20170905,9,모든 홀로서기에 나선 이들을 위하여... 그리고 어머니 고맙습니다...  
20170904,10,원피스로 따지면 버스터콜  
20170904,10,기대되는성인동화죠  미리 관람하신 분들의 평이 좋아서 꼭 보려구요.  
20170904,10,아이 엠 그루트 : ) 아이 엠 그루트  
20170903,6,몬스터를 색다르게 이용한  성장 드라마. 하지만 다소 지루함이 느껴졌던 영화  
20170902,9,그루트 다시 커졌네? 축하~  
20170902,10,차원이 다른 힐링을 경험할 수 있도록 만들어주는 영화입니다. 현대사회에서의 복잡한 인간관계 안에서 지혜롭게 헤쳐나갈 수 있도록 도와주고 교훈을 일깨워주었습니다.  
20170902,8,감독이 유병잰줄 알았다  
20170902,10,매우 현실적인 판타지 동화로 가슴이 먹먹한 감동이었다..  
20170901,10,원작이 소설이죠? 학교에서 보고 반해서 볼려구요. 이 작품 미쳤습니다! 하하 소설책도 꼭사야지 그래서 평생 소장할꺼!  
20170901,1,많이 지겨워 그다지 별로  
20170831,6,"삶과 마주하며 성장하는, 그 감성적 잔혹동화 메시지.  "
20170831,10,올해 최고의 영화 가족의 소중함을 느끼게하는 가슴찡한 감동작품 또 보고싶음  
20170831,10,소중한 사람과 함께 보고싶은 아름다운 동화  
20170831,9,첨엔 보면서 그냥 그런가..했는데 보고나니 여운이남고 마음아프면서 따뜻한영화네요  
20170831,10,최고의 감동 최고의 배우 최고의 영화  
20170831,10,인생명작이다. 상처를 마주할 용기를 얻고 내면을 치유해가는 위로의 메시지가 넘 아름답고 뭉클하다. 마지막에 엄청 울었다ㅜㅜ 그리고 소중한 내사람들을 다시한번 생각하게됐다  
20170831,10,눈가에 눈물이 맺혔네요. 여기저기 훌쩍이는 소리가 좀 들리더라구요. 아마도 같은 일을 겪으신 분들은 더 공감 됐을것 같아요  
20170830,9,"동화인듯 동화아닌 내면을 성찰하게 하는 영화,암투병 엄마와 아들의 이별과정을 그린 영화,항상 옳지 않아도 괜찮다고 위로를 건네는 영화,사랑하는 가족이 생각나는 영화,가슴속에 뭍어둔 환자와 그가족들이 떠오르는 영화,안구건조증에 효과적인 영화!  "
20170830,10,"가슴으로 느껴지는 여운 ,아름답지않은  고통이지만 어쩔수 없는 . . 아픔  "
20170830,10,아름다운 성장영화의 큰 감동적 동화 힐링된다  
20170830,9,모든 사람에게 분명 감동을 줄 영화!상처를 치유해줄 영화!  
20170830,9,넘 아름답고 멋진 영화에요!~감동!~~^^  
20170830,10,감동적이었어요.. 평이 좋아서 기대했었는데 기대 이상이었습니다  여운이 강하게 남아요.. 그냥 꼭 보시길 추천드립니다  
20170830,10,오랜만에 감동적인 영화를 봐서 마음이 따뜻해지네요  
20170830,10,아이에겐 늘 위로가 필요하다.  
20170828,10,"이별을 준비하는 소년의 성장통! 리암니슨의 목소리에 시고니위버 출연마으로도 무게가 느껴지는 영화였습니다,  "
20170827,9,I AM GROOT.I AM GROOT.  
20170827,10,"원작을 본 사람으로써,판타지적인 요소는 많이 있지는 않습니다. 하지만, 결말의 감동은 정말 명작이라고 할 수 밖에 없는 영화입니다. 아이들과 함께 보시길.  "
20170827,5,판의 미로보다 두세수 아래의 영화임ㅡㅡ 판의 미로는 여자아이가 허공에 대고 말하는 장면에서 그간 뿌린 떡밥이 한방에 정리가 되는데 이건뭐 영화가 끝나도 뭔 소린지  
20170827,7,아름다운 수작! 어메이징!!!  
20170826,6,"좀 지루함! 영화의 상영시간에서 60-70분의 지루함을 참는다면  그나마 볼만한 영화일까? ,..,그리고, 영화를 보는 사람들이 느끼는 감동의 기준은 분명히 다르다! 나는 다른 사람들의 영화를 보고 난 이후의 평점에 대해서는 존중을 한다!  "
20170826,10,동화는 아름답고 슬프고 잔인하고 따뜻했다  
20170826,10,중학교때 감명깊게 봤던 '몬스터 콜스'라는 책을 원작으로 하여 만들어진 영화라 기대가 되네요  
20170826,10,통곡하면서 한풀이 하듯이 봤습니다.  
20170825,7,말그대로 판타지긴 하지만 잔잔하면서도 마음의 동요를 불러일으키는 위로적인 영화였다. 아픔을 보듬어주기 위한 영화랄까  
20170825,9,몬스터콜...선과 악...좋은 사람 나뿐 사람....기준이 머호한 세상에서 잘 이야기 한듯합니다...우리나라에서 이런 영화가 나왔음 좋겠다 생각하며 봤네요중2병  걸린 아들과 보면 좋을듯  
20170825,1,"다들 알고있는 단순한 교훈들을 비비 꼬아서 표현했다.  중간중간 개독스런 대사도 나오고,   해로운 영화다.    절대 비추천  "
20170824,10,"저는 개인적으로 참 인상 깊었던 영화였습니다. 아이들 뿐 아니라 어른에게 더 많이 느끼게 해주고 이해가 가지 않았나 싶습니다. 가슴 안에 억누른 슬픔과 분노, 그리고 사랑에 대한 이야기를 현실적이면서도 판타지스럽게 잘 풀어서 더 좋았습니다. ^^  "
20170824,9,저도 동생네 애기를 하늘 나라로 보낸 입장에서 이 영화보면서 동감되는 부분이 많더라구요. 마음 속으로는 빨리끝나는게 더 나은 일이라면서. 가슴 짠하면서 재미나게보았습니다.  
20170824,9,(가족영화로 삼기엔 꼬꼬마 친구들은 해석이 어려울 것 같다.) 마음의 상처가 있는 분들껜 심심한 위로를 안겨줄 영화. 티슈 필!  
20170824,10,아이들에겐 오히려 별로라 생각될 수 있는 영화.이건 어른들을 위한 따뜻한 동화다.거창한 영상보다 아날로그적인 감성으로 더 큰 감동을 준다. 이렇게 인생영화를 한편 더 찾았다.  
20170824,7,어린감성을 잘 나타내는 좋은영화다!스토리도 괜찮고 장면하나하나 의미있는 영화다 다만 솔직히 지루한감이 없지 않다!판타지는 맞지만 모험 판타지는 아니고가족애를 느끼게 해주는 감성 판타지가 더 맞는듯  
20170824,10,마음을짠하게만드는 그런영화네요...ㅠ  
20170823,10,사랑해 엄마 많이 보고싶어요  
20170820,10,동화가 아닌 어른이 봐야될 성장영화~ 엄마가 아들에게 바라는 마음을 나무에 담았다 그리고 마지막까지 아들이 듣기 좋은말만 하지만 실은 엄마가 아들에게서 정말 듣고 싶었던 답은 단순하고도 명료했다  
20170818,10,아름답고 슬픈동화...  
20170818,1,아..모야진짜 괜히봤네  
20170817,10,그저그런 판타지물이 아니다 몰입하다 보면 뜨거운것이 흘러내린다  어느장면 마다 의미같은걸 부여하지 마라 그냥 흘러가는대로 보이는대로 느끼면 라스트에서 울컥 눈물이 쏟아진다  
20170817,6,시고니위버에 혹해서 밨는데 뭐냐 이 영화~초중딩용 영화였다. 시고니위버에 속지말자  
20170817,10,아 너무 많이 울어버렸다.. 난 처음에 코너가 만들어 낸 나무라고 생각했는데 엄마의 어린시절을 함께 한 나무였어.. 투명인간얘기가 아마 엄마이야기인듯.. 엄마의 친구였던 나무가 이제 코노를 지켜주러 온듯...  
20170817,10,"예고편 보고 블록버스터라고 생각하며 보실 액션무비 팬이라면 실망할 수 있지만, 인생에서 손에 꼽을 명작입니다. 인간의 내면을 괴물의 이야기로 풀어내고, 모든 배우들의 행동 하나하나와 대사 한 마디 한 마디가 전부 욕망과 사랑의 여러 형태를 암시합니다.  "
20170816,10,기대되는 영화에요 친구가 재밌게 봤다고 했는데 빨리 보고 싶네요  
20170815,10,진짝마동적을 ㅗ잘봤습니다.  
20170814,10,이걸 이제 개봉시키네... 기다리다 목빠지는줄  
20170814,10,대리 아니 몬스터 부르신분  
20170808,10,꼭 끝까지 봐야함. 이 영화를 제대로 이해하려면 어느정도 나이를 먹어야 하는듯. 올해 본영화중 최고였다. ㅜ.ㅜ  
20170723,9,비행기에서 봤는데 가는 내내 울었다. 나의라임오렌지나무의 제제가 생각났다. 이런 깊이있는 한국 영화가 요즘 나오지 않아 아쉽다.  
20170709,10,"동화속의 현실 이야기. 아이이기엔 성숙하고 어른이기엔 아직 어린, 코너와 같은 사람들을 위한 영화. 세상에 완벽한 어른은 없죠 상받을 가치가 있는 영화  "
20170702,10,정말 말도안되는 판타지 영화지만 매우 현실적인 영화... 고통을 받아들이는 모습에서 말로 표현할수없는 감동이 왔어요 다른사람들은 어떨지 모르겠지만 저에게는 또하나의 인생영화였습니다  
20170702,6,삽화동화가 삽입되어 이어지는 가족의 내려오는 동화이야기를 바탕으로 한 삶과 이별  
20170604,10,너무 재밌었다 아역 연기도 대단하다  
20170519,9,무척이나 아름답고 음울한 영상을 보여 준다. 고양이를 부탁해 같은 느낌이랄까. 어쩔수 없는 슬픔 앞에서 절망하고 괴로워하고 다시 일어서는 성장영화!  
20170513,8,미장센은 마음에 들지만 내게는 이해하기 힘든 비유  
20170508,10,마지막에 나무가 왜 그렇게 답을 요구했는지 알고 많이 울었습니다. 모성애는 정말 고귀합니다. 오랜만에 보는 명작이네요.  
20170505,10,명작입니다 더이상 말이 필요없어요  
20170424,10,많이 울었다.  인간의 내면을 잘 표현한 영화다  누구의 행동을 바라볼때  조금더 한번더 생각해야 하는 이유를 이 영화가 말해준다  사람을 편견으로 바라보는 세상에 대한 외침이다  
20170417,10,위 알 더 그루트!!!~~  
20170416,10,개슬픔 코너 왜케불쌍해 눈물  
20170415,9,"이야기 전개와 풀어나가는 방식, 그리고 표현들.... 미쳤다 진짜.... 감독은 천재가 확실하다  "
20170413,9,I don't want you to go  
20170410,9,말하지 않음의 악몽을 끝내고 엄마를 보낸 꿈꾸는 소년의 성장기. 무겁게 흐르는 이야기라 많은 타켓층들에게 불편하게 받아들여지고 소외받을 게 아쉬운 명작.  
20170404,6,영화가 말을하는건지 방구를끼는건지 똥을싸는건지는 당신의 생각에 달려있다이게 영화야 방구야 똥이야ㅎㅎㅎ  
20170331,2,내가 너무 많은걸 바랬나보다..  
20170329,10,감동적 내 가슴에 와닿은  
20170326,10,"내가 제일 좋아하는 책을 훌륭하게 스토리로 담아냈다. 얼굴을 보여줌으로써 엄한 스승이던 몬스터가 조금 더 다정해졌고, 내 짧은 상상력으로 그려볼 수밖에 없던 모든 배경이 살아나서, 이 영화가 참 좋았다.  "
20170322,10,어찌 되든 상관 없어..  
20170313,7,그럭저럭 볼만한 현대판 동화.  
20170312,1,아.. 나랑은 안 맞네요  
20170312,8,여운남는 영화전문 바요니....이 영화도 단순한 비유에도 불구하고 충분한 여운이 남는 영화...  
20170228,10,"몇몇분들은 영화를 보고 평점을 단건가?  잔잔하고 판타지적이면서도 감동적인 ....어린이용 판의 미로같음,  "
20170228,10,아이 엠 그 루 트!!! ~ ~  
20170226,1,리암니슨 나온대서 막찾아본 내바 바보  
20170226,7,볼만하다이야기들이잼있다  
20170223,2,기분 다운되는 좋은 영화였다.  
20170218,6,지루하고 도저히 무슨 내용인지 1도모르겠어요ㅠ  
20170216,6,모든 것에는 양면성이 있고...말을 안하면 악몽이 될 수도 있다...이야기속으로 들어갈때마나 펼쳐지던 프랑스 애니메이션 같은 느낌의 아름다운 영상미와 색감...그리고 서정적인 배경음악도...!!!  
20170214,1,이것도 저것도 아닌 닭쫓던  개같은 영화  
20170214,1,소설에서 그쳤어야.... 영화로 보기에는 많이 부족한 감성. 보고나면 기분 다운되는건 덤.  
20170214,1,재미도 없고 감동도 없고... 얻는건 우울함과 신파  
20170212,9,힐링이 되는 신비롭고 슬픈 영화 . 감독의 다음영화도 기대  
20170212,8,좋은 성장영화 한편 잘 봄  
20170212,10,마음을 움직이는영화였습니다  
20170212,10,오랜만에 정말 마음을 움직이는 영화를 보았다. 후안 안토니오 바요나 감독이 앞으로 어떤 영화를 만들어갈지 정말 기대된다. 멋지다 그리고 아름답다.  
20170211,4,억지 끼워맞추기로 눈물 한방울 짜볼려 애쓰던 영화..  
20170211,9,"나무 스킨의 옵티머스 프라임이 엄마 잃을 소년을 보살펴주는 감동적인 판타지 영화~해리포터류를 기대하면 내내 지루하겠으나, 차분히 배우들의 감정선을 따라가면 탄성이 나올 명작이네요~ ^- ^//  "
20170211,10,리암리슨은 나무괴물역할입니다 목소리만 아니라 실제로 나무연기도 했습니다 가슴에 와닿는 훌륭한 영화입니다  
20170211,1,딱스터콜 딱스터콜 느금마  
20170211,6,감동이구만 드라마네요 한 편의...  
20170211,10,마음의 상처 혹은 지쳐있는 사람에게 어쩌면 힐링이 될 수도 있는 영화. 빼어나게 잘 만들어진 세련된 영화. 그리고 반가웠던 시고니 위버  
20170210,10,"똑같은 아픔을 격은 사람으로서, 위로가 됬고 공감했고 그리고 눈물이 멈추지 않았어요, 같은 아픔을 가진 다른 분들도 이 영화를 보고 조금이나마 위로를 받기를..  "
20170209,10,소중한 사람을 떠나 보낸 이들을 위한 판타지.  
20170209,5,아빠는 멀리 일하로 가고..엄마는 투병중인 가운데 12살 어린아이가 힘들게 과대망상에 사로 잡혀 왕따로 살아가는 슬픈 이야기를 그린 영화입니다. 가정의 역할이 아이에게 얼마나 중요한가를 다시한번 느끼게 됩니다.  
20170209,1,너무 잔잔해서 잠옴.. 꼬마가 방황하는 게 이입된다기 보다 좀 짜증남..ㅎ 평점좀 낮아질 필요가 있는 것 같아서 1점  
20170207,10,끝까지 보고  평가해라..가슴아픈 아이의 이야기.엄마와의 추억..그리고 사랑..누구나 사랑은 기억을 아프게 만든다..  
20170205,10,정말 아름답고 슬픈 이야기 입니다. 감독 정말 대단  
20170204,6,폭발해야 될 부분에서 너무 미적지근해서 김이 샌다  
20170204,8,아이들을 위한 영화가 아닌 어른들이 보아야할 어른들의 동화같은 이야기다  
20170203,6,어른보단 어린 나이대에게 더 맞는 영화..성장통과 감동  
20170202,10,볼거리만이 아닌 감동과 용기를 주는.. 기립박수  
20170202,7,몇몇 장면에서 보여주는 주인공의 연기력과 연출로 이 영화가 괜찮다라고 평하기엔 부족한 부분들이 많다.  
20170131,5,아역 연기빼곤 그닥... 정신병은 유전인건가...  
20170131,10,리암니슨은 나무괴물 목소리출현입니다  
20170131,8,"사람이 성공했다면, 오직 천사 같은 어머니 덕분이다.  "
