0,1,2
20170204,9,시사회가서 봤어요~지창욱씨!정말 고생 많이 한듯 ~~ 재미있게 봤습니다.  
20170203,10,"배우 떄문에 봤는데, 너무나 재미 있어요!  "
20170203,10,피곤해서 잠들줄 알았는데 처음부터 끝까지 너무 재밌는거 아닌가요ㅜㅜㅜ지창욱팬이지만 기대이상이에요 정말 강추!돈주고 또 볼수도있음ㅎㅎ흥해라 조작된 도시!(시사회평)  
20170203,10,참신한 오락 영화랄까? 재미로 보기엔 이만한 영화는 없을듯ㅋㅋ 개봉하면 무조건 보시길  
20170203,10,조작작조조작조작작마주작  
20170203,10,유쾌한 오락물ㅋㅋ 요즘 한국영화들 재밌는거 많이 나오넹  
20170203,10,액션 재미 감동 다 들어가 있음ㅜㅜㅜ 오락영화로 딱  
20170203,10,지창욱 스크린 데뷔는 성공적  
20170203,10, 2017년 여태나온 영화중 역대급으로 재밌는 영화인것같아요 영화중간중간 나오는 충격적인 반전들땜에 첨에 좀 지루하다고 느꼈던부분을 전부 잊어버리게 만드는 정말 재밌게 본 영화입니다 모두 조작된도시 꼭보세요 정말 재미있습니다!(시사회평)  
20170203,9,제목부터 흥미로운데요 ~??  
20170203,10,여러분 조작된도시 두번봐요 세번봐요 백번봐요진짜 재밌어요 소재도 신선하고 스토리도 너무너무 좋았습니다!!인생영화예요??  
20170203,10,어제 시사회에서 영화관람했는데 너무 재밌고 2시간 내내 긴장감 대박이에요!! 볼거리많고 스토리탄탄하고 중간중간 웃음포인트도잇구요 지창욱잘생겼습니다ㅎㅎㅎㅎ 감독님말대로 지금까지 볼수없었던 신선한 영화인것같네요! 창욱오빠사랑해요..♡  
20170203,10,또 한번 여심 흔드는 지창욱..♡  
20170203,10,시사회 다녀 왔는데 영화 좋습니다! 재밌어요  
20170203,10,짜릿하고 통쾌하다 ㅎㅎ  
20170203,9,어제 시사회에서 보고왓는데요 말이필요없습니다!강추합니다!초반엔 슬픔 중반엔 웃기고 후반부엔 통쾌 합니다!지창욱은 존멋이고요 안재홍이랑 김민교ㅋㅋ진짜 개웃겨요ㅋㅋ  
20170203,8,시사회 보고 왔습니다. 연기력들은 정말 말이 필요없습니다!!  
20170203,10,시사회보고왔는데 정말소름돋게 재밌어요!!!강추입니당  
20170203,10,액션도 좋고 스토리도 아주 흥미진진했어요!!ㅜㅠㅠㅠ또 봐도 될만큼 재밌고요>_<특히 지창욱배우님 아주 멋잇네요  
20170203,9,통쾌한 액션도 재미있지만 스토리도 의외로 탄탄웃음코드도 많고 배우님들의 케미도 굳또 한번 보고싶네요♡  
20170203,10,안재홍이넘나 귀여움ㅋㅋㅋ  
20170203,10,시사회 보고 왔습니다. 처음엔 기대 안 했는데 보고 나서는 또 한 번 보고 싶을 정도로 재밌었어요ㅠ 중간중간 빵 터지는 장면도 많았고 정말 10초도 지루한 적이 없었어요! 연기도 전부 좋았고 아쉬움 없었어요~ 평은 처음 쓰는데 정말 재밌게 봐서 씁니당  
20170203,10,지창욱 팬임에도 전혀 기대가 안되는 영화였어요. 그런데 예상 밖으로 영화가 너무나 기대 이상이었어요. 정말 팬심 다 내려놓고 재밌어요! 단순히 지창욱 내세워 관객몰이하려는 영화가 아닐까 의심스러운 분들! 영화 정말 잘 만들었어요. 믿고 보세요!!!  
20170203,10,목요일 시사회로 보고왔는데요평소에도 액션영화마 파서 보는 사람인데진짜 꿀잼입니다! 진짜진짜 꼭 꼭 보세요!!!꼭보십쇼 배우부들 연기도 진짜 bb변호사님 연기 진짜 소오름 돋았습니더진짜 강추  
20170203,7,그냥 가볍게 즐기기 딱 좋네요. 액션도 여타 영화보단 색다른 면도 잇고..다만 뭔가 b급 분노의질주 느낌도 나고 스토리도 조금 아쉽내요. 그래도 액션영화니까 이건 봐줌 ㅎ  
20170203,9,한국판 매트리스를 보는 듯 시작부터 끝까지 쭈욱 빨려들어가는 영화~시원하게 깨지고 부수며 재미난 영화~!!!  
20170203,10,시시회를 갔다왔습니다! 초반에는 슬펐다가 중반에는 웃겼다가 후반에는 통쾌했습니다 액션씬은 영화에서 본적없는 처음보는 액션씬이 있습니다 궁금하시다면 영화를 예매하세요★ 배우분들 케미도 짱이였습니다 조작된도시 대박날거같습니다 화이팅 사랑해요  
20170203,10,배우 지창욱님 처음스크린 데뷔인데 연기를잘하신것같아요 액션신 너무 긴장감있게봤어요 영화보는내내 재미있고 다른 배우님들도 연기를 주연 못지안게 해주셔서 너무 독보여서 더 집중하면서 보게됬어요 영화 강추해요  
20170203,10,시사회덕분에 호강했구요. 저도영화참좋아하는데 이건 역대급이네요ㅠㅠ 겨울에 땀흘리면서 영화본적 처음이에요. 지창욱사랑합니다 ♥  
20170202,10,감독이 참 대단하다 살인자가 누명을벗는 뻔한 액션영화일수있겠지만 스토리나 액션에서나 전혀 안뻔함~ 오히려 영화는 비현실적인내용을 어떻게 구상하는가에 따라 감독의 창의력과 시도가 돋보인다고 본다ㅋㅋ 그리고 지창욱 첫 주연영화 참 잘 선택했네  
20170202,10,많이 기대하고 있습니다. 천만 대박 기원합니다.  
20170202,3,음..너무 맥락없고 요점없는 보고나서 왜 본건지 모르겠는ㅠㅠ지창욱 믿고 봤는데..조금 실망했습니다...추천은 하고 싶지 않아요...  
20170202,10,시사회에서 보고 왔는데 정말 볼만합니다. 재밌습니다. 시간 가는 줄 몰라요! 지창욱 배우님 조작된 도시 대박기원  
20170202,10,지창욱진짜 매력적인 배우인듯  
20170202,10,시사회로 보고왔는데 볼거리도 많고 코믹요소도 있구 재밌었어요!액션이 빛난 영화현실적인거 좋아하시는 분들한테 호불호 나뉠 수도 있을 것 같은데 평점높으면 댓글알바라 하는 건 좀 ㅎㅎ 다들 다른거지  
20170202,10,"주연, 조연 가릴 것 없이 모든 배우들이 하나같이 연기를 잘했고 지루할틈이 없는 영화!! 방금 시사회에서 봤지만 돈 주고 봐도 후회가 없습니다! 지창욱은 정말 잘생겼고 연기도 좋고 감독님 영화 너무 잘 만드셨습니다! 대박나세요!!  "
20170202,10,쇼케이스 방금 보고 왔는데 진짜 믿고보는 감독님ㅠㅠ 지루하지않고 스릴 넘칩니다!! 시간 가는줄 모르고 봤네요ㅜㅜ 흥행하길!!  
20170202,10,이제껏 보지못한 새로운 스타일의 범죄 스릴러  
20170202,10,영화 생각보다 많이 재밌었어요!!  
20170202,10,시사회 보고왔는데 너무 재밌어요! 스릴넘치고 스토리도 탄탄하고 여운이남네요! 또 보고싶을 정도에요~  
20170202,9,넘 보고 싶었던 영화인데 시사회로 잘 보았네요^^ㅎ  
20170202,10,시사회 봤습니다 지창욱 지립니다 하드캐리 조연들 다 녹아서 완벽합니다 초반 케임신이 다소 오글거림이 있지만 상관없습니다 완벽합니다 저는 영화의 악당을 주로 관찰하는데 이 영화의 악당'들'은 감히 다크나이트의 히스레져의 목끝까지 치고 올라온 정도입니다  
20170202,10,조작된도시시사회 다녀왔는데 한국판 마블? 느낌지창욱이 이렇게 액션을 잘했나? 싶다대역없이 해서 그런지 얼굴 클로즈업도 확실하고 몸 곡선도 너무 멋졌음 액션에 빠져보다가지창욱 연기에 더욱 깊게 빠져서 본듯 섬세한 연기 장난아니더라 !!  
20170202,10,감독의 뇌세포가 궁금합니다  
20170202,10,시사회로 봤는데 완전 재밌어요!!!! 한번더 볼 생각임ㅋㅋㅋㅋ  
20170202,10,방금 코엑스 메가박스 시사회보고왔습니다!감동적이고 가슴쫄깃한 영화 대박입니다♡지창욱존잘!!  
20170202,9,마티즈의 재발견 ㅋㅋㅋㅋ  
20170202,10,시사회 봤는데 재밌네요! 큰 의미 부여없이 생각없이 보면 시간 잘가고 재밌어요~ 중간중간 웃긴 장면도 많고 액션도 속도감있고 좋아요~  
20170202,10,"재밌어요, 지창욱 멋있네요  "
20170202,10,영화 진짜 잘됬으면 좋겟어요ㅠㅠ!  
20170202,10,지창욱의 액션연기! 기대됩니다  
20170202,9,"기존의 범죄 스릴러물과는 사뭇 다른 느낌, 기분좋게 볼 수 있어 더 좋았습니다  "
20170202,10,스크린에서 보는 지창욱이 기대될뿐..  
20170202,10,말이 필요없다...아직 못봤으니까...헤  
20170202,2,소문난 잔치에는 먹을 것 없다ㆍ거품만 가득한 영화  
20170202,6,과연.정우성.현빈.조인성.이렇게 빵빵한 연기자들이나와도 500만을 간신히넘기는데 지창욱이란 배우로 성공할지의문입니다만.열심히찍으셨으니 홧팅!하세요~~~  
20170202,10,지창욱씨나오는 액션영화는 항상 성공적 그래서 더 기대됩니다♥  
20170202,10,조작된도시흥해라흥흥흥!  
20170202,10,"지창욱 심은경 안재홍 조작된 도시, 파이팅!!  "
20170202,10,예고편 봤는데 꿀잼일듯ㅋ  
20170202,10,그냥 오락영화인줄 알았는데 여운도 남고 짱..  
20170202,10,조작된도시 흥행 성공하길 기도할게요!!  
20170202,10,두시간내내 눈을 뗄 수 없었습니다 시사회로 보고 왔는데 시사회 반응도 되게 좋았고 같이 본 친구도 재밌다고 난리였습니다  
20170202,10,조작된도시 빨리 보고싶음 이런 액션영화 좋음ㅋㅋ  
20170202,10,꺅!!! 지창욱 영화 기다리고 있었어요!!!  
20170202,10,오늘 시사회 보는데 완전 기대됩니다!! *.*  
20170202,5,시사회평 그지같드만...또 알바들 쫘악~~~9점대 이상 클릭해보면 전부 알바들임ㅋㅋ  
20170202,10,이 한파에 땀을 한바가지 흘림. 2017년 처음으로 '와 이거 재밌다'라고 생각한 영화  
20170201,10,기대되는영화ㅠㅠㅠㅠ  
20170201,10,완전 흥미진진 대박나라 지창욱!  
20170201,10,어디서도 본적없는 액션 짱!! 웰컴투동막골의 팝콘터지는 장면을 능가하는 하이라이트 액션은 정말 감탄.. 킹스맨과 데드풀이 떠오른다 기발하고 가슴을 울리면서도 재밌고 통쾌한 영화!! 스케일과 특수효과 정말대박입니다  
20170201,7,시사회로 봣는데 아쉬운게 꽤나 많지만 이정도면 볼만은합니다  
20170201,10,어제 시사회로 보고왔는데 진심 꿀잼. 돈주고 봐도 안아까울듯함ㅋ  
20170201,10,지창욱 안재홍!!! 둘다 넘나 좋아하는 배우들~~ 흥해라^^  
20170201,10,나도 생각보다 재밌던데 ㅋㅎ지창욱한테 또 한번 반함  
20170201,9,기대이상. 재미있었음.  
20170201,1,결국 개봉하네 2017년 최악의 쓰레기  
20170201,10,박진감 넘치는 스토리 전개에 나도 모르게 빠져들던 영화 기대해도 좋음  
20170201,10,지창욱 첫 스크린 데뷔 아닌가?! 개봉하면 꼭 보는걸로!  
20170201,10,오락영화로 즐기기엔 좋음 ㅋㅋ 배우들 연기 하나같이 너무 좋아서 실감남  
20170201,1,댓글전부알바임. 어제 8시 왕십리 시사회직접관람 너무 재미없어서 최악이었음.  
20170201,5,오락영화로는 좋다 ! 다만 설마 설마 했던게 사실로 들어나니 .... 아오 ....  
20170201,10,이번엔 웰 컴 투 다크나이트!!  
20170201,10,지창욱 완젼 좋아♡ 꼭봐야지  
20170201,10,시사회다녀왔어요 ! 박진감넘치고 2시간내내 스크린에서 눈을뗄수없었네요 ㅎ 스토리도 좋고 액션이 정말 너무 좋았습니다 !! 여운이 길게 남는 영화였어요 몇번 더 보러가려고합니다 ~  
20170201,10,영화 기대해요~화이팅~  
20170201,10,시사회다녀왔습니다!! 연기도 다들 좋았고 내용도 너무 좋았습니다!! 긴장감을 놓을 수 없는 영화에요ㅠㅠ  
20170201,9,시사회 당첨돼서 보고왔어요!예고편이 재미없어 보여서 재미없을줄 알았는데 진짜 너무 재미있습니다ㅠㅠ! 다들 꼭 보세요  
20170201,10,시사회 봤어요. 장르상 비현실적인 상황도 나오는데 거슬리지 않고 웃으며 봐지고 재밌는 요소들 때문에 신선했어요. 캐릭터들 개성넘치고 연기도 모두 훌륭해요. 오락영화지만 보고나니 하고싶은 말이 꽤 생겨서 흥행해서 영화에대해 읽을 얘기들 많아졌음 좋겠네요  
20170201,10,시사회로 보고 왓는데 완전 재밌네요 공조 더킹이랑 같이 개봉했으면 이겼을듯 ㅎㅎㅎ 맨날 정치이야기하고 나라 어두운 이야기해서 좀 그랬는데 통쾌함  
20170201,10,시사회보고왔습니다! 기대이상이네요 ㅎㅎ 웃기고 슬프고 스릴있고 잘생겼습니다 간혹 말도안되는 장면이있지만 너무 재미있게봤어요 ㅎㅎ 짱입니다!!!!  
20170131,10,시사회 당첨돼서 보고 왔는데 정말 재밌어요!!!! 정말 강추하는 영화입니다!!! 내용도 지루하지 않고 스크린에서 눈을 뗄 수 없을 정도로 몰입도도 최고! 개봉하면 꼭 보러 가세요ㅜ  
20170131,10,시사회로 보고 왔는데 너무너무 재밌네요 전에 볼 수 없던 한국 영화 너무 잘 보고 왔습니다 지루할 틈이 없었어요  
20170131,10,시사회가서 봤는데 와 영화 대박나길 기원합니다!! 너무 재밌네요!!!!  
20170131,10,"시사회 통해서 봤는데, 심장 쫄깃해지는 액션때문에 2시간이 빨리 지나갔네요! 지창욱이 이렇게 연기 잘하는지 몰랐어요 ㅎㅎ  "
20170131,10,"영화평 잘 안남기는데, 예고편보니 왠지 스토리가 흥미있네. 잘 한번 뽑아보삼~ ㅎㅎ  "
20170131,9,뻔한스토리이긴한데요. 진짜 속시원하고 기분좋게봤어요.완전몰입도 짱 회사일암것도생각안남 ㅋ  
20170131,10,너무 재밌었습니다!!  
20170131,10,예고편보고 실망하시지말고 꼭 보러가세요 !  
20170131,10,영화 시사회 보고 나왔어요!!액션도좋고 스토리도 재미있고 신선했어요!!  남동생도 영화 재미있고 영화 괜찮다면서 굿굿!!! 보는 내내 지루한건 하나도 없고 즐겁게 관람했네요흥행 할 듯 해요!!  
20170131,9,시원하고 통쾌합니다.꼭보세요.  
20170131,10,지창욱짱!재미있었어요!  
20170131,10,화려한 액션과 재미로 강추!!!!  
20170131,10,진짜 재밌어요ㅠ짱짱조작된도시 대박나세요  
20170131,10,사이다같은 액션과 통쾌한 스토리로 보는내내 긴장을 늦출수없었네요 재밌게 잘봤습니다!  
20170131,10,완전 몰입해서 봤는데 짱입니다  
20170131,10,완전 재밋고 손이 저릴만큼 긴장감 넘쳤다 ! 또보러 가야지!!  
20170131,10,지창욱 너무 멋있고 변호사 연기력에 감탄했습니다 정말 좋은 작품이에요  
20170131,10,재미와 풍자를 완벽하게 담은 완벽한 영화!!!  
20170131,10,끝까지 결말을 예측할수 없는 심장 쫄깃 영화  
20170131,10,대박날거같아요. 개봉하고 볼게요  
20170131,10,역시 지창욱이네요!개봉하면 또 볼게요  
20170131,10,넘넘재밌당!!!지창욱 너무 잘생겻엉!!ㅠ  
20170131,10,조작된도시 심장쫄깃 두근두근  
20170131,8,기존에 보지 못하고 지루할 틈 없었네요  
20170131,9,액션인상깊었습니다^^  
20170131,10,보는 내내 소름이 ㄷㄷ 추천합니다!  
20170131,10,완전재밌어요!짱짱지창욱짱  
20170131,10,완전재미있었 습니다꼭보세요  
20170131,8,장르영화로서 만족스러운 쾌감!  
20170131,9,액션 짱 강추해요 주변사람들에게 추천해야겠어요  
20170131,9,지창욱과 심은경의 새로운 발견  
20170131,10,완전 꿀잼 보는내내 두근두근!!짜릿한영화 개봉하면 한번더 볼게요!  
20170131,10,재미있었어요~~^^  
20170131,9,재밌어요 스펙타클 !!! 또보고싶음.  
20170131,10,넘 잼있었어요~ 또 볼게요  
20170131,10,다음에 개봉하면 또 보러갈래요!!!  
20170131,10,조작된도시.. 강추예요  
20170131,10,정말 재밌게 잘 봣슴니다 강추!  
20170131,10,조작된도시지창욱 멋있음  
20170131,10,스토리구성도 너무 좋고 감동도있소 액션도 좋다 적극추천  
20170131,10,재밌어요 액션진짜 짱이에요  
20170131,10,지창욱 스크린도전 성공적!!  
20170131,9,재밌어요 재밌어요~ ㅋㅋ  
20170131,10,재밌었어요너무너무너무  
20170131,10,최고의 오락 영화 지창욱 군대가기전 제대로된 발도장  
20170131,10,진짜재밋라요!!!!꼭보세요!  
20170131,10,완전 잼나요 강추! 유쾌한 오락물!  
20170131,10,너무재밋었습니다^~^  
20170131,10,박진감 넘치고 완전 재미있어요 짱!!  
20170131,10,넘재밌었어요!! 빨리 개봉했으면좋겠네요♡  
20170131,10,진짜완전재밌어요 말이필요없음 그냥..  
20170131,10,화끈한 액션 대박!!!  
20170131,10,조작된도시재밌습니다  
20170131,9,너무나 재미 있게 봤습니다...  
20170131,10,참신한 조작된 도시 재밌네요  
20170131,10,유머 액션 스릴 뭐하나 빠질께 없는 시원한 영화  
20170131,10,조작된도시너무재밌습니다  
20170131,10,재밌어요~!!!지창욱 연기 짱  
20170131,10,진찌 꼭보세요 백번보세요!!!  
20170131,1,아직 개봉을 하지 않았는데 평점을 줄 수도 있나보네요???  
20170131,10,2.8일 연차냈는데 9일개봉이라니ㅠ  
20170131,10,정말정말 기대가 됩니다!개봉되기 손꼽아기다리는중  
20170131,10,액션은 지창욱이지!!  
20170131,10,"액션하면 지창욱, 지창욱하면 액션이지  "
20170131,6,2002년도 개봉한 예스터데이 스멜이... 아니겠지?  
20170131,10,최고의 액션영화입니다스릴만점 강추해요!  
20170131,10,2년을 기다렸다. 믿고 보는 지창욱  
20170131,1,예고편만 봐도 개노잼 예상...  
20170131,10,조작된도시!!!대박나길....!!!!  
20170131,10,왜 12년만에 나타난거냐 얼마나 보고 싶었는데 당신 영화 웰컴이다 박광현  
20170131,6,"Cj 스크린독점에 배우빨로 승부,예고편 cg 구림,레고 배트맨 무비가 훨씬 꿀잼각  "
20170130,1,예고편만 봐도 평점이나온다.  
20170129,10,남자 배우들보다 여자배우들이 연기 잘하시는거 같아서 심은경 대박 꼭 보러가야징  
20170129,1,안봐도 노잼일겄같습니다  
20170129,10,망한다에 1표 ㅎㅡㅡ ㅡㅡ  
20170129,10,아진짜 평소에도 지창욱오빠 팬인데 너무 재밌어보여요 예고편 조는 순간 와 이거다 했어요 죽기전에진짜 지창욱오빠보고싶어요 사랑해요?? 심은경과의 케미도 궁금하고 액션연기 꼭보고싶어요 정말 영화관 큰 스크린에서 오빠를 볼 수 있다니 행복해요 벌써 기대되요  
20170129,10,국내에선 흔히 볼수 없는 스토리인거 같아요~~ 예고편을 보니 스케일또한 엄청나게 크네요!! 너무 기대되고 개봉하면 얼른 보러가야겠어요ㅎㅎ 지창욱 너무 잘생김ㅠㅠ  
20170128,5,딱 5점짜리 영화일 것 같다???  
20170128,1,아오OO 한국영화라서예고편만봐도퀄리티 팍팍떨어지는게보인다ㅉ1점도아까워ㅜㅜ  
20170128,10,영화 예고편보니까 여태껏 봤던 범죄 액션 영화중에 게임세계가 들어간건 조작된 도시가 처음이던데 새롭다!! 게다가 주연이 스크린 첫 주연인 지창욱에 심은경 안재홍까지!!!  
20170128,10,너무보고싶어요좋아하는배우의작품이라 더기대가돼네용  
20170128,9,연기는 믿어 의심치 않는데 예고편 cg때매 조잡한 느낌이 든다 ㅠㅠ  
20170127,10,아까르무 유까르작 두닥두닥닥 두두닥  
20170127,10,지창욱 화이팅><♡♡♡  
20170127,9,배우와 영화 둘 다 기대되네요 . 또한 배우들간에 케미도 기대되어서 빨리 보구 싶어요 ㅎㅎ  
20170126,10,유튜브에서 이 영화 예고편 나왔을 때 진심으로  영화와 관련없는 일반광고인 줄...  
20170126,10,3분16초♡316 기대  
20170126,10,지창욱의 액션 정말 기대되네요 꼭 보고싶어요  
20170126,1,알바 들  많이 풀었네....  
20170126,10,액션! 비주얼! 모든 것이 새롭다!  
20170125,10,스크린에서도 지창욱!  
20170125,10,지배우....♡영화 정말 기대되고 꼭 흥행하길!  
20170125,1,설정이 딱 프리즌브레이크 따라했네 노답  
20170125,9,기대되는 영화네요! 1점은 영화보구 나서ㅎㅎ  
20170125,10,화이팅입내다헤헤헤화이팅  
20170125,10,박광현 감독님과 이제는 대한민국 영화계에 한 획을 이을 인생 액션 연기를 선보여줄~ 지창욱 배우님이 만나게 되어 '조작된 도시' 란 영화가 너무 기대가 되네요!  
20170124,10,믿고보는 액션 지창욱! 기대중ㅠㅜ  
20170124,10,지창욱씨 팬되고 이것저것 드라마 찾아보면서 나오기만을 기다렸답니다! 지창욱씨하면 액션! 스크린에서도 지창욱씨의 액션연기를 볼 수 있다니ㅜㅜㅜ 너무너무 기대되요! 조작된 도시 정말 대박났으면 좋겠어요! 다른 배우님들 연기도 기대되고! 개봉되면 보러갈게요  
20170124,10,대박 기대되요 언넝 개봉해랏  
20170124,10,범죄액션은 항상 옳죠! 너무너무 기대됩니다.  
20170124,10,힐러 2인거 같앙 ㅎㅎㄹ  
20170124,10,영화 기대가 많이 됩니다. 개봉하자마자 볼게요 조작된 도시 화이팅!  
20170124,5,저거 예고편 첫장면에 트랜스포머3에 나온장면이랑 ㅈㄴ비슷한데??  
20170122,10,믿고보는 지창욱!! 뮤지컬도 드라마도 영화에서도 팔방미남 대박나길 기원해요^^^^  
20170122,10,안재홍배우님의 연기기대됩니당!!!  
20170122,10,오빠를 드디어 큰 스크린에서 보다니 ㅜ 고마워요 오빠 안봐도 명작이겠지만 개봉하자마자 영화보러갈게요 사랑해요  
20170122,10,블랙스쿼드 어디에나옴?  
20170122,10,하하!! 기대하고있음 ...예고편만 봐도 ...내스타일...꼭보고싶음..2월9일 기대기대...  
20170122,10,"역시지창욱눈빛만봐도느낄수있죠참좋은사람참좋은느낌밝은느낌!,봐도봐도좋은사림살맛나게하는사람빨리보고싶다지창욱최고다  "
20170121,10,조작된 도시 천만 가자!!!!지창욱 심은경 안재홍 화이팅!!!  
20170121,10,뭐지.. 대박터질거 같은 B급포스터는..  
20170121,10,지창욱 액션은 언제나 옳다~  예교편 완전 대박!!!  
20170121,10,예고편만 봐도 스케일이 다른! 꼭 보고싶은 영화 조작된 도시!! 조작된 도시가 어떤 세계인지 엄청 궁금하네요!! 지창욱배우님 백수 and 액션 연기 기대가 됩니다!! 예고편만 봐도 너무 멋있어요!! 권유 여울 데몰리션 화이팅! 영상미 최고일듯!!  
20170121,1,유치하고 조잡해보인다.. 정말 쓰레기 영화라는걸 예고편만 보고 알수있다니 ㅋㅋ 기대되는것도 지창욱 배우분이지 영화가 아닌듯 하다  
20170121,10,믿고보는 지창욱 배우님!!!개봉날이 너무기대되요ㅠㅠㅠ  
20170120,10,조작된도시 손꼽아 기다리고있어요 대박나길 기원합니다 지창욱화이팅!!!  
20170120,3,이딴 영화좀 그만 만들어 제발...; 라라랜드보고 느끼는거 없냐 ㅋㅋ  
20170120,1,팬심 같은건 접어두고 객관적으로 한번만 생각해보자 스토리는 기대도 안하지만 그냥그런 C급 영화일듯  
20170120,1,겉멋든 액션; 얼굴에 상처하나 내고 머리 흐트러뜨리면 다 멋있는 줄 아는 전형적인 한국식 액션.... 우리나라가 영화를 참 못 만들긴 하지 개인적인 의견이니 비추 누르면 알바로 생각할께오...ㅜ  
20170119,10,안재홍 배우 진짜 기대됩니다!! 영화도 너무 기대돼요! 빨리 2월이 되서 영화보고싶어요!! 데몰리션 짱짱짱!!!!  
20170119,8,흠... 영화보다 영화같은 현실인데... 뉴스랑 같은내용이거나 비슷한내용일듯.  
20170119,10,지창욱 눈빛 볼 생각에 기대된당 ㅎㅎㅎ  
20170119,10,빨리 보고 싶다..기다리고 있어요  
20170119,10,예고도 보니까 가볍게 볼수있...는 액션영화일듯한데 지창욱 배우님 얼굴에서 가볍게 넘어가지는 않을 듯하다  
20170119,10,개봉전에 이렇게 떨리긴 처음~넘 기대됩니다  빨리보고싶어요 지배우님 액션 끝내주는군요~~^^  
20170118,1,알바 ㅅㄲ들 더럽게 많네  
20170118,3,영화들은 대충 스틸컷보면 감이 오던데 망작인거같다 ㅠㅠ  
20170118,10,지창욱배우의 액션연기 기대됩니다!  
20170118,10,영화가 너무기대가되고 지창욱의 조각미모를 볼수있다니 더 기대가됩니다~~  조작된도시 화이팅 !! 빨리 보고파요  
20170117,10,기대만으로 10점!! 액션기대 감독기대 빨리 개봉하길!!  
20170117,10,조작된 도시 대박 기원ㅋ  
20170117,5,노잼일듯 한국은 안어울린다 이런영화에  
20170117,10,예고편 봤는데 너무 기대된다 무지 재미있을거 같다 어드벤처 조작된 도시!! 사랑스런 심은경 지창욱 안재홍 대박나라!!  
20170117,6,남자주인공 티켓파워가 1도 없는데...안봐도 망했음..  
20170117,10,박그네 최순실에게 완전 조작된  나라.  
20170117,1,이런 영화가 우리나라에서 성공한적이 있나... 쓸데없는 것들 빼고 각본과 연출이 좋아야할 것이다.  
20170117,5,줄거리만 읽어도 재미없을 수가 있다니 역시 한국영화는 대단함.  
