0,1,2
20170208,10,시사회 보고옴 그냥 짱임  
20170208,10,모든출연진들의연기 감명깊게봤습니다  
20170208,10,나무 재밌어요!! 역시 지창욱 배우님 연기 최고!! 또 보러 갈거에요~~ㅎㅎ  
20170208,10,진짜 관객들 숨쉴틈 안주는 영화입니다. 너무재밌어서 여운이 계속 남네요. ㅠㅠ 강추입니다 이런평점도첨써봐요 넘넘재밌어요  
20170208,10,방금 시사회 보고왔는데 정말 긴장감넘쳤고 마지막 사이다까지 완벽한 영화였습니다! 추천합니다~  
20170208,10,시사회보고 왔어요!!!영화는 후회없는 선택이 될것입니다.짱 재미있어요~~  
20170208,10,시사회보고 지금 나왔는데 이영화 완전 재밌네요~출연하시는 모든배우분들의 훌륭한연기 짱짱짱과 빠른전개..깨알같은 재미..반전까지~~~너무잘봤습니다~~~낼 개봉인데 대박날듯싶어요~  
20170208,10,완전 재밌는 영화!! 긴장감도 최고 액션도 스릴넘치는 영화였어요 굿굿  
20170208,7,시사회 보고 왔습니다. 감독님의 판타지가 가득 담긴 액션 영화라는게 보는 내내 느껴졌어요. 비현실적인 장면들도 있었지만 웃으면서 보고 나왔네요. 흥하세요!:)  
20170208,10,재밌어요!감독님이 헐리웃 영화  마니 보신듯요즘같은때 통쾌한 영화입니다  
20170208,10,이거 꼭 보셈 영화 잘 만들었다 진짜 잘보고나옴ㅋㅋㅋㅋ긴장감 최고. 연기 다들 잘하고 !!!! 그리고 진짜 웃기고 재밌기도함ㅋㅋㅋ  
20170208,10,시사회 대박..볼거리..반전스토리..통쾌함까지 만족합니다..  
20170208,10,진짜 처음 시작할때 외국 액션영화같고... 그뒤는 좀 막 화가 나지만 마지막 진짜 와ㅠㅠㅠ 핵꿀잼 짱재밌어요!!  
20170208,8,예상가능한 전개이지만 요소요소 웃을수도 있고 끝까지 지루하지 않았어요. 주인공이 못하는게 없는 만능이라서 약간 오글거리지만 연기가 오글거리진 않아요. 영화를 보면 중간중간 지루해서 엉덩이를 들썩이는 울아들이 첨부터 끝까지 집중해서 봤어요.  
20170208,10,오랜만에 괜찮은 영화를 만났다  
20170208,10,믿고보는 지창욱!!!!액션도 전문가 수준에 스토리도 좋고 모든게 최고지루할틈 없이 중간에 재미도있고 또 보러갈꺼임  
20170208,8,"속도감있는 진행 부족하지않은 물량공세의 잘 짜여진 오락액션. 시사회 잘 봤어요,!  "
20170208,10,완죤 스릴있고 유쾌 상쾌 통쾌 3가지를 모두 갖춘 영화인거 같아요짱~ 재미 추천할만한 영화에요~^^  
20170208,10,지창욱의 액션은 사랑입니다!!!  
20170208,10,오락영화로 재밌게 볼 수 있고 마지막엔 희열도 느낄 수 있는!!  
20170208,1,우리나라는 이런물의 영화를 만들면 안된다...  
20170208,10,평론평점 왜저럼? 재밌기만 해봐!!  
20170208,10,시간가는줄 모르고 빠져서 보고왔네요 ㅋㅋ  
20170208,8,시사회에서 봤는데 영화 시작부터 끝까지 정말 한순간도 눈을 뗄 수 없을 만큼 몰입도가 좋았어요! 특히 배우 오정세님의 연기가 인상적이에요 :)  
20170208,10,짱잼입니다ㅎㅎㅎㅎ지창욱 짱  
20170208,8,"두손을 모으고 그들을 응원하고있는 날 보게된다. 개연성 따질거면 다큐봐라. 신나는 게임한판 하고나온이기고나온 느낌이다. 극장문을 나서는 내 등뒤에서""넌 썩은 나무가 아니야""라고 토닥거려준다. 고맙다  "
20170208,10,화끈한 스토리와 액션 두말 필요없어요  
20170208,10,후반부로 갈수록 더 볼만해지는것 같다 조작된 도시 대박!!  
20170208,10,형광색의 쌀알이 흩뿌려지는 그 장면은 정말 한국 영화에서 볼 수 없었던 기발한 장면이라고 생각됨 ㅎㅎ 역시 박광현 감독님 ㅋㅋ 전작 팝콘 비 부터 알아봄  
20170208,8,개연성은매우떨어질수있으나액션도너무좋았고 중간중간나오는 웃음포인트도너무좋았습니다~~  
20170208,9,일단 너무 재밌습니다 초반 전투씬도 대박  
20170208,7,맨인더다크 장님 아저씨의 주식이 쌀밥이 아니어서 다행이다 싶었다.  
20170208,1,줄거리만 읽어봐도 1998년쯤 만들어졌을 법 한 촌시러움  
20170208,10,짜릿하게 즐길만한 액션 영화로 추천해요  
20170208,10,스펙타클한 액션으로 찾아온 조작된 도시 역시 기대 이상  
20170208,10,기자들이 평점이 낮은거는 꼭 재밌드라  
20170208,10,시사회  통해서 개봉전 봤는데  중간중간 오글거리는 씬이 좀 있지만 매우매우 스피디해서 재밌게 본~!! 약간 심파로 빠지거나 할수 있는 부분에서 바로 웃음포인트가 있는 씬으로 넘어가구 ㅋㅋ 마지막엔 사이다! 배우들은 주조연 할것이 없이 모두 연기 잘한  
20170208,1,핵노잼..개연성없고 현실감없고  
20170208,9,예고가 다가아님!! 예고보다 훨씬흥미롭고 재밌고 쫄깃하고..본편보고나니 예고가 쫌 아쉽더라는...이런영화가 한국영화라니 좀 놀라웠어요!!이영화 강추입니다!!  
20170208,10,지창욱에 심은경이라니 무조건 사수할 영화 아닌가요? 재밌었어요  
20170208,9,이 영화의 소름포인트는  오정세님의 연기력인듯  
20170208,1,예고편 드론에서 미사일 쏘는거보고 뿜었네 거른다.  
20170208,10,화려한 액션에 눈을 뗄 수 없었다ㅜㅜ스토리도 재밌고 진짜 시간가는줄 모르고 봄  
20170208,10,지창욱이라면 무조건 좋아요  
20170208,9,"생각보다 몰입하며 볼수 있었고,신선한 소재에 참신한 스크린에 재미있었다. 다소 잔인한것도 있었지만.. 요즘 시대에 걸맞는 이야기이고, 조연들이 웃음포인트들이 있어서 유쾌하게 볼수 있었다. 혹평은 신경쓰지 마세요~!! 다들 괜찮았음. 보시면 알게됨~  "
20170208,8,스타일리쉬한 지창욱의 액션에 압도당했다 ㅋㅋ  
20170208,10,스크린 압도하는게 장난아니네 지창욱과 심은경 케미 죽임  
20170208,8,"댓에 알바니 조작이니 글쓰는 사람들은 뭐냐..본인이 존잼이면 그런거고 노잼이면 그냥 평쓰면되지..영화가 다 취향이란게 있는데 자기랑 다르다고 조작,알바라니..꼭 평점테러하는것들이 영화마다 찾아다니며 댓알바운운하더라..그거야말로 조작이아닌가?..  "
20170208,9,마블영화 좋아하면 존잼임  
20170208,7,손익분기가 300만이라던데 흥행하려나...  
20170208,9,기대 이상이었어요 한달전부터 기다린 영환데 시사회 당첨되서 봤어요 ㅎ 이정도면 개봉후에 돈주고 봐도 만족스러웠을것 같아요  
20170208,5,"어제 건대 롯시에서 "" 조작된 도시 "" 영화 시사회 참석해서 관람을 했습니다. 스포일러는 한국에서도 오락액션이 기대 이상으로 괜찮아보였는데.... 저는  soso  감독의 노력도 많이 볼 수 있었고 그래도 아직은 미흡한 부분이 없지않아 있었습니다  "
20170208,1,인성 바닥인 지창욱 나와서 기대가 안갑니다.  
20170208,7,개연성1도없지만 스트레스풀고옴 뿌셔뿌셔  
20170208,5,댓글들이 너무 댓글알바가 적은거처럼 적혀잇네  
20170208,9,(월요일왕십리CGV(8시)관람)우려와는 달리 액션영화로써의 미덕을충분히(오히려 과함^^) 가지고있어서 긴런닝타임인데도 전혀 지루함없이 잘보았네요^^  
20170208,10,"운좋게 위메프 관람권 이벤트에 당첨되서 엊저녁 보고왔어요. 너무너무 재미있었어요. 최근에 ""공조""도 봤었는데 그보다 훨씬 더 좋았어요.지창욱이란 배우를 다시 보게 된 영화입니다.강추~^^  "
20170208,9,"말이 안되는 부분이야 있지만. 말이되면 영화가 아니지 않은가 다큐지. 기대했던 만큼의 알찬 스케일과 볼거리가 가득하다. 꼭 극장에서 보길 추천한다. 현실에 던지는 한마디의 의미도 크다. ""그 나무는 썩지 않았다"" 공감합니다.  "
20170208,7,어제 시사회로 영화 보고 왔습니다. 개연성도 현실성도 없어 어찌보면 좀 뻔한 내용이지만 배우들의 캐릭터 궁합도와 신선함은 높았습니다. 나름 박진감 있어 스트레스도 풀리는 것 같구요. 생각 없이 보기 좋은 오락영화였습니다.  
20170208,10,이 감독이 또 해낸듯! 완전 웃고 즐기다 나옴! 루저 만세!  
20170208,1,별루에요  뭔가 좀...  
20170208,4,시사회 처음가봤는데 글도 댓글도 전부 알바...  
20170208,5,지창욱이 아니라 변요한 이였다면? 아마 덜 조잡했을듯  
20170208,9,"시사회보고왔는데 기대보다 백배 재밌었고.. 배우들의 연기 엄지척이에요 특히 지창욱 액션 간지 짱짱,오정세ㄷㄷㄷ 근데 평론가 평점 너무 짠거 아닌가요 ㅋㅋ만화적인 요소가 많은 이런 부류의 영화에서 개연성을 따지는게 좀 이해안가네요  "
20170208,10,정말 재밌게 잘 봤습니다~! 배우들 연기가 워후~~  
20170208,1,이런류의 할리웃 액션영화도 봐줄까 말까한데 한국 영화라...  
20170208,10,배우들의 연기와 짜임있는 스토리와 끝날 때까지 계속되는 액션이 화려한 영화였다  
20170208,7,이 영화만든지는 1년전인데 지창욱 k2빨이 어디까지갈지 ㅋㅋ 개봉을 늦춘 신의한수를보여줄것인가  
20170208,1,내가 이 영화를 보게 된 상황들이 제발  조작되었길 바라는 생각이 들거다.  
20170208,10,이번에도 여지없이 전문가들의 참패!! 대중영화란것이 재밌는것보다 중요한게 없는데~~  
20170208,1,조작된 도시? 조잡한 도시!  
20170208,10,시사회 보고왔는데 이건 천만영화다 진짜 짱이다액션 감동 스토리 반전 모두있음 코믹까지  
20170207,8,시사회 당첨되서 보고 왔는데 생각보다 잘 나와서 좋았네요 액션만큼은 최고입니다  
20170207,10,스릴 짱짱! 재밌었어요!  
20170207,10,진짜 진짜 너무재밌습니다ㅠㅠㅠㅠ시사회가서 봤는데 지창욱 원래 액션연기잘하지만 진짜 너무잘해요ㅠㅠㅜ 대박배우 진짜 천만 찍을것같은 영화에요  덕분에 진짜 잘봤습니다ㅠㅠㅠ  
20170207,10,진짜 너무 재밌고 내 인생영화 top3안에 듬!!!!지창욱 액션연기 완전 멋잇고 쩔었고 정말 너무너무 잘생김!!!!ㅋㅋ사람들 마지막에 다들 감탄함!!! 레알 꼭 보세요♡♡♡♡  
20170207,10,뻔한 얘기지만 정말 재밌음  
20170207,8,VIP시사회로미리봤는데포스터랑제목보고 엥노잼이겠군했는데....생각보다빵터지는부분많았고출연진참좋았음.재밌었음.진짜  
20170207,10,오늘 8시에 건대롯데시네마에서 시사회로 봤는데 진짜 너무 재미있어요!! 저 평점한번도 안남겨봤는데 처음으로 남겨봐요 정말 이만큼 재미있습니다! 출연하시는 모든배우분들도 장난없구요 퀄리티도 장난없습니다 ㅠ 추천해요!  
20170207,10,CGV VIP시사회 관람배우분들 연기력.스토리 좋아요.기대이상!후반으로갈수록!!더욱 흥미진진  
20170207,10,시간가는줄 모르게 긴장하며 몰입해서 잘 봤습니다! 최선을 다한 출연배우들 완전 짱!!  
20170207,10,"우와~ 방금 시사회로 봤는데 기대이상으로 재밌네!! 지창욱 넘 잘함~ 액션 시원시원하고, 웃음도 빵빵하고, 새로웠다~ 소름돋는 악역도 잘했고ㅋㅋ  "
20170207,9,시사회로봤는데 시간가는줄 몰랐던 몰입도 엄청난 영화!!!유머적인요소도 적당히 가미되있구 지창욱의 액션은 퍼펙깔끔한 결말까지 퍼펙그렇지만 살짝 허구적인요소들이 좀 많?아서 만점은 아니지만... 연기는 모두퍼펙!!!!  
20170207,2,.... 인생에 한번 물러서야할 때가 있다면 바로 지금입니다 여러분...  
20170207,10,지금 막 시사회로 보고왔어요~ 한국영화보면서 이렇게 통쾌하게 속 쉬원하게 본건 처음이예요~ 진짜 너무너무 재미있네요!! 와 진짜 속이 다 후련하네요!! 최고예요!!^^ 기대없이 보기시작했는데 이렇게 재미있을줄은~ 기대하고 보셔도 절대 후회없을 정도!!  
20170207,10, 역시 믿고 보는 지창욱 배우님!!^^무대인사 시사회 다녀왔는데 역시 재미있고 예측못했던 스토리라 더욱 흥미진진했습니다배우님들 모두 정말 수고하신게 티가나구요너무 행복했던 시사회 였습니다 꼭보세요조작된도시 대박납시당!!!꼭보세요꼭보세요! 두번보세요  
20170207,9,시사회 보고 왔는데 생각했던 것보다 너무 재밌어요ㅠㅠㅠㅠ마지막에 터지는 사이다 ㅠㅠㅠㅠ!!!! 진짜 재밌게 보고왔어요 ♡  
20170207,10,시사회 보고왔는데 진짜 꿀잼!!!!지창욱 마지막에 광고인줄ㅋㅋ  
20170207,9,지창욱 넘 멋있게 나오고 생각한것보다 재밌더라 ㅋ  
20170207,8,와 조작된도시 드디어 개봉하는구나;;  
20170207,10,개꿀잼 ㅋㅋㅋ 친구 덕에 시사로 보고 왔는데 내 돈주고 봐도 아깝지 않을 그런 영화였음  
20170207,10,드디어 우리 창욱오빠를 스크린으로 볼 수 있겠구나ㅜ  
20170207,1,연기.톤~늘지 않고 늘 똑같은 배우가 나오는군!보나마나 긋당! 연기력은 빼고 스토리만 느껴야겠군!조.주연이 바뀌겠당!  
20170207,10,조작된도시 진짜 추천하는 영화임 꼭 보시길  
20170207,10,배우 보러 갔다가 감독님의 작품에 놀라는 영화. 한국에서 이런 영화를 볼 수 있다는 사실에 즐거웠다.  
20170207,10,역시 박광현감독!! 앞으로도 다양한 장르의 영화들을 보여주셨으면 좋겠어요!!  
20170207,9,간만에 즐길만한 오락무비 탄생ㅎㅎㅎ  
20170207,10,아니 지창욱 너무 멋있는거 아니니..?  
20170207,10,호평이 많아서 기대중입니다~예고편에서 감각적인 영상들 정말 멋있구요~~!!범죄오락액션 영화 넘 좋아해서 개봉이 반갑습니다~~흥행예감!!  
20170207,10,좋은 영화 좋은 배우 감사합니다  
20170207,10,연기 연출 스토리 스릴 유머까지 뭐 하나 빠지는게 없다ㅠㅠ  
20170207,10,유쾌한 반전이 있는 오락 액션 영화  
20170207,9,시사회로 미리 보고 왔는데 개봉하면 한번 더 볼 생각ㅋㅋㅋ  
20170207,1,평론가들의 한줄평으로 대신합니다  
20170207,10,오락영화로 즐기기엔 딱임 시간 가는줄도 모르고 몰입할 수 밖에 없음  
20170207,10,기대되는 배우들의 케미~~!! 조작된 도시 꼭 극장사수 할게용~!  
20170207,10,시간 가는줄 모르고 관람.. 시사 반응도 좋고 개봉하면 반응 더 핫할듯  
20170207,10,예고부터 장난 아니던데 영화 자체는 더 장난 아니였어요 진짜 존잼입니다  
20170207,8,범죄 액션 영화ㅋㅋ재밌겠다  
20170207,10,오정세오빠 잘생겻당♥♥무대인사 보러가오ㅜㅜㅜ(기대)  
20170207,10,시사회 갔다 온 친구가 꼭 보라고 해서 이미 예매완료!!  
20170207,9,조작된도시 개봉일만 기다렸잖아ㅜㅜㅜ  
20170207,10,나오는 배우들 하나같이 호감 ㅎㅎ 드뎌 곧 개봉이네  
20170207,10,"시사회 다녀와서 기대치 않게 너무 재미있게 보고 왔는데. 기자, 평론가의 평점 테러를 보고 어이가 없어서 10점 남겨요  "
20170207,1,영화가 좋다에서 봤는데 진지한 액션이 아닌 C급 물이다. 보러가지 않을 예정.  
20170207,1,딱봐도 작품성없고 배우로 흥행하려는 영화...소재도 존나 흔함...우리나라는 이딴영화좀 그만좀 만들었으면...  
20170207,10,지창욱 액션 완전 짱이요!!! 기대기대기대 이상임!!!  
20170207,10,박광현감독님의 웰컴투동막골은 진짜 재밌게 봤었는데 이번 신작 조작된도시도 기대를 안할수가 없네요ㅎㅎ  
20170207,9,요즘 재밌는 한국 영화들 많이 나오는듯ㅋㅋㅋ 조작된 도시 벌써부터 입소문 제대로 탔던데 개봉일날 바로 보러 간다  
20170207,10,지창욱의 첫 스크린 데뷔는 성공적!!  
20170207,10,박광현 감독님 12년만의 영화!  
20170207,8,다양한 액션을 보는 재미가 쏠쏠해요  
20170207,10,시사회로 보고 왔는데 개봉하면 한번 더 볼 생각ㅋㅋㅋ  
20170207,10,개꿀잼 예상^^ 조작된도시 파이팅^^  
20170207,10,범죄 액션은 언제나 옳다..♡  
20170207,9,스케일부터 비쥬얼까지ㅋㅋㅋ 기대된다  
20170207,10,시사회 다녀왔는데 영화 보고 처음으로 이거다! 한 영화는 이게 처음이다..  
20170207,10,스토리 구성뿐 아니라 액션과 연기 등등 흠 잡을 곳이 없네요 적극적으로 추천해요  
20170207,10,간만에 즐길만한 영화 탄생ㅋㅋㅋ 요즘 한국영화들 왜이렇게 다 재밌냐  
20170207,10,한국영화에서는 흔하지 않은 스토리인거 같아서 더 기대중  
20170207,9,박광현감독님의 웰컴투동막골 5번은 본 거 같은데 이번 영화도 기대해 볼게요 파이팅입니다^^  
20170207,10,조작된 도시 진짜 재밌어요ㅋㅋ 꼭 보세요  
20170207,10,예고편만 봤는데도 내 스탈..  
20170207,10,오래걸린 만큼 확실한 영화가 나오지 않았을까 싶다  
20170207,1,vip 시사회 다녀왔습니다. 관람내내 아랫배가 아팠습니다. 상영종료 후 급히 화장실에 가보니  제 몸에서 사리가 나왔습니다.  
20170207,1,조작으로 조종되어버린 어리석은 인간몰락 경험  
20170207,10,시간가는줄 모르고 ... 잼나던데.. 평론가 평점 왜 저래  
20170207,5,오락이나 게임 좋아하는 넘들이나 좋지 나같은 컴맹은 딱히...  
20170207,9,세배우들의 케미 폭발 기대됨~~~꼭 볼거임~~~~!!  
20170207,1,진짜돈이아까움;;스토리도없고결말허무진짜돈이아깝다  
20170207,10,스릴넘치고 재밌습니다. 유쾌한 반전 액션영화  
20170207,9,어제 시사회 봤는데 간만에 액션 스토리 까리한 영화 배우들은 구멍없이 연기 다 잘하고 감독의 연출에 감탄했다.  
20170207,1,예고편 보아하니 b급이네  
20170207,10,시간가는줄모르고 빠져서봤음 진짜 졸잼 !!!! 개봉하면 두번보고 세번보고 또보고 계속 볼거임 ㅠㅠ 지창욱 대존잘조작된도시 대박날듯  
20170207,1,조잡한 도시 조작된 평점 그래도 중간중간 쫄깃 잼!  
20170207,9,오늘 시사회서 보구왔는데 ㅜ존잼 스트레스풀려요 ㅋㅋ  
20170206,1,나우유씨미 평점조작단에이은 또하나의 평점조작영화의 탄생! 개봉도 전에 벌써 알바들의 조작이 시작돼따! 과연 알바들의 조작질에 내 피같은 9천원을 지킬 수 있을것인가!  
20170206,4,도시는 조작 되었어도 평점은 조작하지 말자..  
20170206,10,시사회에서 봤는데 이영화가 헐리우드에서 나왔다면 더 극찬받지 않았을까 하는 생각이듬. 천재 감독과 연기천재 지창욱의 조합이 갑!  
20170206,9,액션 스릴 유머 재미까지 뭐 하나 빠지질 않아요  
20170206,10,시사회로 보고 왔는데 존잼 ㅋ 지창욱 존멋  
20170206,10,간만에 즐길 수 있는 오락영화가 나온거 같음  
20170206,6,"현실성없는 스토리,,이런거 매니아 만 보지,,200만명 이상 힘듬-더더욱 공조와 싱글라이더(이병헌)때문에,,더더욱..120-140만명 정도 예상~~그러나 심은경은 연기는  인정  "
20170206,10,에휴 평론가들 지들이 영화만들어봐라 무슨영화든 다 단잠만꼬투리잡고 OO들;  
20170206,10,볼거리와 즐길거리가 풍성ㅋㅋㅋ 기대해도 좋아요  
20170206,10,다 찍고 무려 1년이나 다듬어진 영화… 탄탄한 작품 기대할게여  
20170206,10,군대있을때 참! 재밌는 영화 많이도 개봉한다..  
20170206,10,지창욱 ㅠㅠㅠ진짜 개봉 하자마자 달려가서 볼거임  
20170206,1,"예고에서 ""흥미진진한데요~""라고하는거보니 영화보기싫어진다.절떼안볼꺼임.  "
20170206,6,내용은 재밌겠는데 조금 뜬금 없는게 지창욱이 전직 뭐 길래 액션을 저리 잘하고 운동신경이 저리 좋나?ㅎ  
20170206,10,지창욱을 스크린으로 볼 수 있다니 너무 좋다  
20170206,10,스토리가 탄탄하고 다양한 액션으로 볼거리가 풍성한 영화로 보여집니다♡ 거기다 감독의 메세지가 들어있다고 하니 더욱 궁금합니다♡ 빨리 보고싶네요♡  
20170206,10,조작된 도시 정말 오래 기다렸어요ㅠㅠㅠ 빨리 만나 보고싶습니다  
20170206,9,웃음 재미 스릴 액션 감동 등등 다양한 장르가 들어가 있지만 어우선하지 않아요 좋은 기회로 좋은 영화 잘 보고 왔습니다  
20170206,10,요즘은 헐리우드 영화보다 한국영화가 훨 재미 있네요..한국영화 화이팅  
20170206,10,아 지창욱 너무 좋아;; 진짜 존잘;  
20170206,9,새롭고 재밌다. 영화를 만드는 사람이라면 이 두가지가 얼마나 어려운건지 알거다.  
20170206,10,개봉일만 기다리고 있는 영화… 하루 빨리 보고 싶은 마음..bb  
20170206,10,참신한 오락 영화랄까? 재미로 보기엔 이만한 영화는 없을듯ㅋㅋ 개봉하면 무조건 보시길  
20170205,10,시사회로 봄!! 근데말여~ 근래 본 영화중 제일 신나고 재밌음!  
20170205,1,피고인드라마내용이랑똑같네요.영화가아니라 액션인되요? 대본 다시만들길 ㅡ ^^  
20170205,10,지창욱의 첫 스크린 주연작~★ 정말 기대됩니다!  
20170205,10,지창욱이라면 믿고 볼께요~~신랑이랑 예매해서 보러가야겠다~~^^  
20170205,10,시사회로 봤는데여러분 영화 볼 때 사이다 사가지 마세요.마지막에 사이다 800개 먹은듯한 통쾌함이 계속 됨.진짜 재밌어요!!!! 역시 박광현감독님  
20170205,7,심은경 나온다니 기본은 하겠네  
20170205,10,유쾌한 오락물ㅋㅋ 요즘 한국영화들 재밌는거 많이 나오넹  
20170205,10,액션 재미 감동 다 들어가 있음ㅜㅜㅜ 오락영화로 딱  
20170205,9,지창욱 스크린 데뷔는 성공적  
20170205,10,제목부터 흥미로운데요 ~??  
20170205,9,알바가 조작한다면서 예고만 보고 영화는 보지도 않고 1점 테러하는건 조작 아닌가? ㅋ 웃기넼ㅋ 시사회때 재밌게 봤음. 개봉하면 또 볼거임. 음악이 좋고 고구마 전개 없어서 좋음 ㅋ  
20170205,10,또 한번 여심 흔드는 지창욱..♡  
20170205,1,예고편만봐도 망작삘 나는건 나만그런거임??  
20170205,10,지창욱액션연기 완전 기대중!!  
20170205,1,제목답다 ! 평점도 조작해버리는 도시 !  
20170205,10,이 영화가 해외영화였다면 아마 전문가들이 별두개씩은 더 박았을거라고 감히 자신한다.  
20170205,3,공조를 재밌게봐서...실망이 클수도..기대는안하고볼게요!!그래야더 재밌으니..  
20170205,10,믿고 보는 지배우!! 영화 잘 되길 바라고 기대 하고 있을게요!  
20170205,10,시사회에서 본 사람입니다. 이 영화는 진짜 추천합니다! 조작된도시는 진짜 놀라면서 봤습니다! 완전 소름의소름.. 지창욱님의 액션씬ㅠㅠ 진짜 대박이였어요! 이 영화 꼭 보세요! 후회안하실꺼에요ㅠㅠ진짜 첫 스크린 주연작 지창욱 조작된도시 천만관객되길♥♥  
20170205,10,지창욱씨 연기는 정말 기대되긴하는데 스토리가 좀 웃기다ㅋㅋ사기를당한것까진 이해하겠는데 같이 게임하던 애가 갑자기 해커라니..해커가 왜 그렇게 오랫동안 게임을하고있어ㅋㅋㅋ쨋든 기대는해본다  
20170204,8,예고편보고 딱 드는 생각은 영화 게이머  
20170204,10,요즘은 어떤 영화든 소재가 전부 진부하고 식상한거 같아 그래도 선입견 가지면 안되겠지?  
20170204,10,그동안 한국영화에서 잘 다뤄지지않은 독특한소재이기때문에  상당히 흥미진진하고 유쾌할거같다.  
20170204,4,포스터만 봐도 망할거 같은데...  
20170204,1,아니 ㅋㅋㅋㅋ 캐스팅 싼맛에 한건가? 어중간한 영화인듯  
20170204,4,= 소문난 잔치에 먹을 것 없다. 산만한 영화  
20170204,1,알바댓글 거르자...  
20170204,9," 2월2일 시사회때 보니, 권유대장과 그팀원들의 작전들이 예측불허!!! 몰입도최강!!! 대박~~사건!!!영화볼때, 팝콘은 사지마시길~~~ㅎ먹을 새 없더이다....  "
20170204,10,범죄액션의 신세계라더니 ㅎㅎ 진짜 신세계를 보고 왔음 진짜 액션이 훠우~~ 특히 그 마지막에 카체이싱이 진짜 ㅎ  
20170204,9,"액션 대박인데, 특히 카체이싱이 역대급!! 기존 한국 영화에서 보지 못했던 카체이싱 장면들이 조작된 도시 하이라이트임 마티즈 위엄이 ㄷㄷ  "
20170204,10,으느그으븯스스읍ㄷ느으그으ㄷ으으윽  
20170204,1,보기도전에 실망부터하는 영화  
20170204,1,2017년판 성냥팔이소녀의 재림  
20170204,6,조연들이 더 화려하네. ㅋ  
20170204,1,조작된 평점어찌 모두 10점이냐?조작된 도시에 대한 조작된 평점인 듯 하다.  
20170204,1,죄다 10점이네 ㅋㅋ 뭔 알바를 이리 풀었냐? ㅡㅡ저런 캐스팅으로 흥행 바라지 마라~ 그것도 액션 영화인데..마스터처럼 망할듯 싶다..ㅇㅈ?  
20170204,8,숨가쁜 126분 속 모닝의 재발견  
