0,1,2
20170513,9,별 기대 안했는데 생각보다 엄청난 영화임. 천재감독이 풀어낸 정석형 판타지 영화 느낌.  
20170513,1,로튼 27퍼면 말다했지않냐  
20170513,10,정말 오랜만에 재미있는 영화 봤습니다.  
20170513,9,스케일도 스케일인데 퀄리티가 쩔음….  
20170513,10,요즘 판타지 영화가 부진하길래 기대 안했는데 흥미진진하데요~ 나름 괜찮은 영화였습니다~  
20170513,10,감독 이름만 봐도 꼭 보고싶은데 출연진이 무려 찰리 허냄과 주드로..  
20170513,9,일단 킹아서 제왕의검 을 제2롯데 시네마 에서빨리볼수있어서 보기로했다 반지의제왕  쓰리즈를 점목한거갇은 느낌이드는건 전체적으로 환타지화를 모티브로 반지의제왕을 잡은걷갇아서 시각적으론 볼만하지만 처음시작해서 너무빠른전개로  네용적으로 비냑한느낌을주게한다  
20170513,10,아더와 이야기는 항상 흥미진진하듯  
20170513,10,나만 먼저 시사회로 봐서 미안하네..ㅎㅎㅎ 완전 재밌던데 ㅎㅎ  
20170513,9,찰리허냄의 아서왕도 멋있네  
20170513,9,왕으로 보는 찰리 허냄도 넘나 멋있음ㅠㅠ 퍼시픽림에서보다 더 멋있는듯  
20170513,10,시사평들 보니 나쁘지 않은것 같은데? 나도 빨랑 보고싶다  
20170513,10,환타지 액션의 신세계를 봤닼!  진정한왕의 모습을 알려주는 영화!!  
20170513,10,전쟁씬 대박임. 이건 극장에서 봐야함  
20170513,10,"가이리치감독의 연출력과 찰리허냄, 주드로 등 최고의 배우들의 조합은 옳았다  "
20170513,9,예고편 그 이상이더라. 오랜만에 시간가는줄 몰랐다  
20170513,10,넘 재밋었어요! 끝나고 아쉬웠는데 친구가 6부작으로 나온다는 얘기를 해줘서 기뻤다능ㅠㅠㅠ  
20170513,1,알바들한테 낚였네 ㅋㅋㅋㅋ  
20170513,1,사전 개봉 보고 왔는데 진짜 최악이네요.... 이런 쓰레기 영화를 만드는 것도 재주라서 1점 드립니다.  
20170513,10,오랜만에 판타지 영화 재미있게 즐겼네요 ost들도 다 너무 좋고 특히 주인공 존잘러~~^^  
20170513,9,역시 가이 리치. 충분히 잘 만든 또 하나의 아서왕 이야기. 몇몇 장면에선 그의 전작들이 자연스레 떠오른다. 다음 이야기가 기대된다.  
20170513,9,빠른전개에 영상미는 확실히 최고!!  
20170513,10,초반부터 흥미진진 ㅠ_ㅠ 완전 취향저격! 유료시사회로 먼저 봐서 꿀잼  
20170513,10,"눈이 즐거운 영화, 화려한 볼거리와 액션, 배우들의 연기는 흠잡을 게 없다  "
20170513,10,주드로 진짜 멋있게 나옴..♡  
20170513,10,반지의 제왕을 잇는 최고의 판타지 액션 영화가 될 것 같다  
20170513,1,이 영화는 킹이다...  
20170513,10,역시 가이리치감독의 연출력은…good  
20170513,10,저도 유료시사회로 봤는데 아이맥스나 4D로 보면 색다를 것 같다는 생각이 드네요. 상영관 나오면 다시 찾아봐야겠어요  
20170513,9,스토리는 별볼일 없으나 눈과 귀가 즐겁네요 돈아깝지않은 영화였습니다 추천드려요  
20170513,2,유료시사화보고옴. 이걸볼거면 그냥 돈을 구워먹으세요  
20170513,10,이영화 완전 강츄 ㅠㅠㅠ!! 시스케일 오지구 깜짝 출연으로 베컴도나옴..♡  
20170513,10,"찰리허냄, 주드로 둘다 너무 멋있었어요.. 스크린 X 효과 몰입도 대박!!  "
20170513,10,액션+판타지 모두 충족시키는 영화  
20170513,9,5월에 기대되는 영화가 너무 많아 ㅠ  
20170513,10,"남자들이 딱 좋아할만한 영화인것 같네요, 재밌게 보고 왔어요  "
20170513,10,스크린 X 로 봤는데 진짜 멋있는 영화네요. 깨알 베컴도 좋았음.  
20170513,5,볼사람만 보세요 전 졸려죽는줄  
20170513,8,기대했던웅장함은없었지만나름재밌게봄  
20170513,9,영상미 좋습니다. 내용도 볼만하고  
20170513,1,보지마세여 우메볼영화급 진짜 이건아님 반지의 제왕급? 개뿔 개봉한데서 봣는데  
20170513,10,"예고편 보고, 아더왕이야기를 뭔 또 판타지로 만들어서 저러냐.. 했는데 스크린엑스로 한다 하여 궁금해서 봤는데, OST 가 열일 하네요. 영상미 + 음악이 자칫 유치할 수 있는 영화를 스타일리쉬한 판타지액션으로 만듭니다. 추천해요~~  "
20170513,10,굿 무비~~ 워너에서 작정하고 만든 티가 나드라 ㅋㅋ  
20170513,10,그동안 봤던 아서왕을 소재로 한 작품들 중 가장 화려하고 멋있었던 것 같네요  
20170513,10,보고싶다.. 재밌을것 같아 ㅋ  
20170513,10,이거슨 5월 최고의 영화  
20170513,10,이런 스케일의 영화를 오랬만에 보고 눈호강함 ㅋㅋ  
20170513,10,창동 메박에서 방금봤는데! 최근 봤던 판타지 영화 중 제일 재밌어요  
20170513,10,주드로!! ㅠ_ㅠ 아 진짜 오랜만에 영화나오는듯!! 빨리 보고푸당  
20170513,10,시리즈물로 제작한다던데 매년 나왔으면 하는 바램 ㅎㅎ  
20170513,10,과연제2에반지에제왕시리즈될까요  
20170513,10,"재밌습니다.올 해 본 영화 중 재미로 따지면 으뜸 입니다.- 영상, OST 등이 뛰어난 것 같습니다.  "
20170513,8,오늘 봄. 7점대 후반을 주고 싶음 전체적인 재미와 액션감은 좋지만 너무 어지러운 카메라와 너무 클리쉐한 스토리. 그래도 개인적으론 가디언즈보단 잼있었음.  
20170513,10,"유료시사회 조조 보고옴.로튼토마토지수 안좋길래 걱정했는데, 연출이 상당히 흥미롭고 재미있었음.스토리는 무난함.  "
20170513,9,흔한 카멜롯.아서.엑스칼리버가 아니다..제대로 판타지임.근데 주인공이 잘하긴하는데 주드로 만큼 포스가 아쉽다..보기드문 판타지 인건 확실...  
20170513,5,이거 해외평들 극악이라던데? 성검닦이 소리까지 나오더라. 작년 워크 영화 수준인가 봄.  
20170512,10,오랜만에 이런장르 영화나오네  
20170512,10,와 이거 대박.ㄷㄷㄷㄷ  
20170511,1,내 마음속 아서왕은 세이버 한명뿐이다.  
20170511,10,사용불가 웃긴새끼네 ㅋㅋㅋ 관심없으면 안쳐보면 되지 가정의달이 뭔상관이야 ㅋㅋㅋ 에이리언도 가정의달에 개봉했는데 ㅋㅋㅋ  
20170511,10,에쿠스☆카리바! 영국인인 아서는 왜 에미야시로보다 영어발음이 구린가? 그 미스테리가 파헤쳐진다!  
20170511,10,페이트 스테이 나이트  세이버 맞나요??  
20170511,8,5/10 시사회 후기 빠른전개와 다이나믹한 액션은 나무랄때 없다 하지만 왜 주인공은 당하고서야 각성하는지 아쉬움이 들수밖에 없는 스토리 참고로 배컴형 얼굴 잠깐 비춘다.  
20170510,1,아서왕이 왜 남자죠??  
20170510,10,이게 그렇게 갓갓 영화라면서요?  
20170510,7,영등포스타리움에어 봤는데 스케일 큽니다.조금 지루한면도 없지않안아있구 넘 질질 끄는느낌?그래도 큰스케일은 압권~~!  
20170510,10,액션 스타일리쉬! 가이리치 멋지다  
20170510,10,이처럼 재밌고 이처럼 신나는 영화 오랜민이다. 가이 리치의 연출력 최고찰리허냄의 매력 최고다.  
20170509,10,내가 가서 엑스 칼리버 하나 뽑고온다  
20170508,7,주드 로 오랫만에 보네..  
20170507,1,세이버쨩이 아닌 아서따윈 필요없써!  
20170505,8,아서왕은 사실 여자다.  
20170504,7,예편만 봐도 스케일 보인다  박진감 넘치고 빠른전개의 영화일것 같다 도망자 검을 같고 튀어라 ㅋㅋ  
20170503,5,란슬롯 원탁기사 이딴건 다 기독교에서 지어낸거고 원래켈트신화에선 멀린하고 아서 밖에 없으  
20170502,5,우리 주드로 형님은 나날이 이마가 선명한 갈매기가 되어가네.. 아아 세월이여  
20170501,9,베컴 커온! 목소리는 영 아닌데 연기는 어떨지???기대된다.  
20170501,10,다 필요없고 베컴형님 10점  
20170430,10,신화를 야겜으로 배운 달빠가 또;; 페이트는 문학이라는 달빠가 또;; 서양측의 신화학자들과 언어학자들의 견해는 필요없고 가지버섯이 답이라는 달빠가 또;;  
20170429,10,"줄거리에 오류남.원래 바위에꽂힌검은 칼리번이고,그 검은 란슬롯과의 결투에 썰립니다.그래서 호수의 요정이 칼을 주는데 그검이 엑스칼리버 입니다. 칼리번ㅡ겁나쎈 성검엑스칼리버ㅡ약속된승리의검칼리번ㅡ엑스칼리버 검집으로  회복 오짐. . .  "
20170429,10,가이리치 감독에 주드로 까지! 무조건 본다!!  
20170429,10,재미있겠다 꼭 봐야지 근데 아서가 아니라 아더 아닌가?  
20170429,8,처음 검 제대로 쓰는 장면은 저어엉말 멋있지만 자아성찰 과정으로 인해 영화내내 검을 너어어무 아껴씀...  
20170428,8,빠른 전개와 특유의 편집이 인상적이나 아서를 제외한 주변인물은 병풍이고 후반부는 극장시간때문인지 너무 대충 지나간다. 하지만 그런 불만을 다 날려버릴 액션씬은 감탄하게된다.  
20170428,10,시사회 보고 왔는데 핵잼이다. 두번바라  
20170428,7,시사회로 봤어요. 기대안했는데 생각보다 괜찮았네요ㅋㅋ 무거운 분위기아니고 액션이 스타일리쉬하다고해야하나 그래서 즐기기 좋았어요. 내용은 뻔하지만 괜찮게 봤어요!  
20170428,8, 갑자기 전설의 검??..  
20170428,9,예고편에 맥그리건줄ㅋㅋㅋㅋ  
20170427,10,마법과 인간이 공존하는 세상. 판타지 영화의 새로운 장을 열다!  
20170427,10,괜찮은 영화인 것 같네요 눈이 즐거워요 ㅋㅋ  
20170427,9,반지의제뫙처럼  시리즈로 나와도 괜잖을듯해요.  
20170427,8,"화면, 사운드 멋지지만...난 왜 졸았을까? ㅋ  "
20170427,10,시사회로 보고왔는데 가오갤+해리포터 느낌임 개인적으로 중세시대 별로안좋아하는데 이건 정말 재밌음 영화구성도 약간 퓨전느낌도 있음  
20170427,10,"배우들의 연기, 액션 스케일 모두 만족만족~~♡  "
20170427,10,이런 영화는 돈주고 봐도 아깝지 않음..  
20170427,10,오랜만에 가이리치 감독이 제대로 삘 받았다  
20170427,10,짱잼 존잼. 6부작이라는 얘기가 있던데 빨리 다음편 고고  
20170427,10,아ㅜㅜ 쫌 늦어서 앞부분 놓쳤어요. 그래도 이해하는데는 문제 없었구요~ 시간가는줄 모르고 봤네요. 앞부분 궁금해서 개봉하면 다시 보려구요  
20170427,10,오늘 시사회 보고 왓습니다. 와.. 이 감동은 마치 반지의 제왕을 보고 나왔을때 그 느낌이랄까..  
20170427,10,시사회 당첨되서 보고왓는데..꿀잼입니다!  
20170427,10,진심 개 대작이다. 졸잼이다..광명아울렛에서 4월27일 시사회보고 남김.  
20170427,9,아주 제대로된 시작. 제왕의. ㅏㄴ생이니 어서 다음펀을 내놔라!  
20170427,9,액션도  좋고 시간가는줄몰랐네요~!!^^꼭보세요  
20170427,10,전설의 왕 아서...판타지로 새롭게 선보이다니...정말 최고네요.  
20170427,9,오 이게 그 유명한 바위에 꼽힌 엑스칼리버 뽑는 서양 전설 판타지 영화화구나  
20170426,8,배컴 특별출연롸 라티 리치 감독의 2017년 2년 만의 신작. 찰리 허냄과 가이 리치의 액션 격돌  
20170426,10,가이리치 영화인데 연출은 일단 보장된거임ㅋㅋ  
20170425,10,찰리허냄 졸멋 주드로는 나이들어도 멋있네  
20170425,10,제대로 된 판타지 액션이 개봉하는구나! 기대됨!  
20170425,10,예고편 보니 겁나 기대된다  
20170424,1,뭐야.. 아서왕이 여자가 아니네?  
20170420,10,세이버 / 아르토리아 팬드래곤  
20170418,10,오홍? 주드로?? 레알??? 멋뿜폭발  
20170418,10,오 드디어 아서왕 완전 취저  
20170418,10,가이리치+아서왕 이야기 = 꿀잼각  
20170418,10,가이리치 영화라니 기대중ㅎ  
20170418,10,가이 리치인데... 그냥 봐줘야지~  
20170418,10,재밌을 것 같다!!! 배우들 때문에라도 봐야겠다 ㅋㅋㅋ  
20170418,10,개존잼 스멜 예고편 보고 뻑감  
20170418,10,예고편 보니 겁나 재밌을 것 같네- 판타지 좋아하는데 겁내 취저  
20170410,1,가이리치 가이리치해도 결국 주드로가 죽고 저 사람이 왕될거 아냐? 내용이 너무 뻔하고 식상한데?...  
20170407,2,올드한 스토리. 가이리치는 왜???  
20170407,8,"개인적으로 역사 전쟁 영화 좋아함, 기대됨.  "
20170407,10,일단 음악 만든놈 맞고 시작하자  
20170403,10,가이리치 ㅎㄷ ㄷ 이형님 영화는 기본을 넘어서 망작이 없다 무조건 봐라 그리고 킹 아서 멀린 ㅎㄸㄸ  
20170402,10,얼마나 지리는 영화가 탄생할지 지켜보겠으  
20170309,10,절대 꽝은 안치는 가이리치  
20170117,9,가이 리치 감독의 셜록홈즈를 보고나니 이것도 보고 싶어지네요  
20161112,1,스내치 이후로 쭉 상업영화만 찍는 가이리치와 축구선수 조합 물론 작품성은 기대도 안한다  
20160116,10,베컴 잠깐보러 극장가야겠네  
20151222,10,베컴이라 보고 아서왕이라 또 본다  
20151122,10,우리 베컴형님 나오는 영화다 무조건 본다.  
20151102,10,우리 형 베컴 영화 데뷔하는거?  
20151102,8,아서왕 미드같지 않다면 꼭 봐야지  
20150912,10,베컴나오네 ㅋㅋㅋㅋ 모기형  
20150908,9,베컴 나오네 ㅋㅋ  목소리 고칠라고 노력 많이 했다던데  
20150817,2,엥 아더왕이 남자라니 깨네요 ㅡㅡ; 와타시다찌노 아사오와 온나데스네..~~!  
20150724,10,스틸컷을 보니 주드로가 이쁘게 나온다. 봐야한다.  
20141019,10,가이리치는 닥치고 10점  
