0,1,2
20171024,10,헬라..꼭 그렇게 걸어야 했니?  
20171024,10,시사회 보고왔는데  상상이상으로 좋았다 로키가 너무 귀여워..  
20171024,10,긴말 필요없이 역시... 마블입니다!유머러스한 부분도 스토리에 피해없이 잘 녹여냈다고 생각합니다마블인것 만으로 믿고 보세요ㅜㅠ♡♡  
20171024,10,토르 정말 잼있어요마블영화 좋아하는데^^  
20171024,10,아진짜 세상 재밌게봄ㄱㅋ스트레스 다 풀리고 다 뚜까뿌셔버림ㅜㅠ 지루한 부분도 없고 그렇다고 가볍기만 한것도 아니고 진짜 딱 마블다움이 뿜뿜ㅜㅠ 근래 본 영화 중에 최고다ㅜㅠ  
20171024,10,"아이언맨이 마블의 전성기를 이끌었다면, 토르 라그나로크는 제2의 전성기의 시작. 스토리, 코믹, 연출 ""이게 마블이다""를 다시 보여주는 영화.  "
20171024,10,"시사회 관람 완료! 토르 트릴로지 중 최고 아니, 마블 히어로 시리즈중에서도 역대급 완성도와 재미를 보증합니다! 정말 유머러스하고 유쾌하고 시원시원해요! 추천!!  "
20171024,10,"최초시사회 당첨되서 영화 남들보다 먼저 보고 지금 집에 귀가했습니다.정말!정말!!정말로!!! 진짜  재밌었습니다.영화 BGM도 정말 끝내줬고,액션도 너무 맘에 들었고 특히 오늘시사회 오셨던 모든분들이 영화 보는내내 웃음이 끊이질 않았는거 첨봤습니다!ㅎ  "
20171024,10,믿고 보는 마블 시네마틱 유니버스!  
20171024,10,진짜 미쳤다 너무 재밌다 장면 하나 하나 놓칠 틈이 없는 빠른 전개와 앞전의 마블 영화를 쭉 함께 보았던 팬이라면 공감하며 즐길 수 있는 장면까지 진짜 미치도록 재밌었다 모두 모두 꼭 보시길 바라며 10점드립니다  
20171024,10,도입부 부터 화려한 액션에 몰입햇는데 그게 영화 끝까지쭉 이어집니다.스토리 연결부에 지루할수잇늠 부분을 코미디로 채워주네요정말 재밋게봣오요  
20171024,10,스파이디는 홈커밍을 통해 히어로로 거듭났고토르는 라그나로크를 통해 가장 쎈 어벤져스라고셀프인증했다.아스가르드의 킹이자 왕이자 짱이며무엇보다 로키 형임  
20171024,10,정말 재미있게 봤습니다 여자친구도 엄청 집중해서 볼정도로몰입감이 장난아니였습니다 ㅎㅎ  
20171024,10,토르 라그나로크 보고 왔는데 정말 보는 내내 북유럽신화와 마블영화 그리고 영화 ost까지 정말정말 소름돋는 콜라보레이션에 시간이 순식간에 지나가는 마법 한 편을 보고 온 기분입니다.!  
20171024,10,"시사회 보고 왔습니다1,2보다 몇배는 재미있고 토르 헐크의 캐미를 즐기실 수 있을겁니다  "
20171024,10,오늘 오후4시부터 시사회 좋은 자리를 위해 줄을서며 기다린만큼 완벽하고 대박 영화였어요!!정말로 로튼 토마토 신선도 지수가 98%이나 되는 이유를 알 것 같았어요!!  
20171024,10,토르:라그나로크 마블 최초 전국시사회!!! 용산 아맥으로 보았는데요 처음부터 끝날때까지 모든 장면이 빵빵 터집니닼ㅋㅋㅋㅋ너무 재미있고 액션씬은 음악과 어우러져 소름돋고 정말 130분이라는 긴시간이 휙휙지나가는 몰임감 쩌는 영화였어요!!!  
20171024,10,와.... 마블 영화들은 정말.... 오늘 시사회 다녀 왔는데 너무 재밌었어요ㅠㅠㅠ다들 꼭 보시길... 기대 안하고 가서 봐야 더 짱이겠죠..?! ㅋ  
20171024,10,시사회 보고왔습니다.쿠키영상 이번에도 2개구요.기대하셔도 좋습니다. 믿고보는 마블이잖아요?ㅋ  
20171024,9,진짜 역대급 졸잼 ㅋㅋㅋㅋ 재미와 스토리를 모두 잡았다. 대만족!!  
20171024,10,시사회로 보고왔는데 정말 마블은 실망시키지않는구나 또 다른 대박을 터트렸네요 진짜 재밌습니다  
20171024,10,시사회로 광천 CGV에서 관람했는데 너무너무 재미있고 몰입도 장난 아님! 완전 흥미로웠어요 ㅎㅎㅎ  
20171024,10,"시사회로 방금 보고왔어요  토르와 헐크 한판 대결 정말 빵~~ 터지네요  토르 보니 역시 스파이더맨은 애송이였어요 액션, 조크, CG 모두 한수 위!! 쿠키 영상 2개!  "
20171024,10,와 히어로 영화 역대급 유잼 ㅋㅋ 10차까지 찍을 의향 있습니다 ㅋㅋ  
20171024,10,"이제야 진짜 토르 다워 진것 같네요. 마블의 개그담당 토르, 헐크와 토르의 캐미  "
20171024,8,최근 몇 년간 봤던 마블 영화중에 가장 많이 웃었고 재밌었습니다!!  
20171024,10,마블 시리즈 중 최고의 명작  
20171024,10,토르: 라그라로크 상황전개는 매우 마음에 든다 자연스럽게 바뀌는 방면 연기도 괜찮고 자막도 매우 괜찮았다.시사회를 처음 갔는데 괜찮고 아쉬운 점은 선물을 기대했지만 너무 큰 꿈을 꾼거같다.액션신도 충분하고 헐크의 과격함이 개그로 변하는것이 재미있다  
20171024,10,아 마블 .. 아 진짜 기대했는데 기대이상 역시마블 아정말보는내내 가슴벅차 눈물흘릴뻔  .. 유쾌하고도감동적이고 정말 스토리가 탄탄쓰  
20171024,10,"시사회로 보고왔는데 마블 영화 중 가장 재미있어요!!! 역대 마블 영화 중 가장 많이, 가장 크게 웃었던 토르: 라그나로크!!! 토르, 헐크, 로키 케미 진짜 최고고.. 헬라, 발키리 진짜 너무 멋있어요ㅠㅠ 영화 시간이 너무 짧게 느껴져서 아쉬워요!!  "
20171024,10,광주 시사회 다녀왔어요!!! 마블 짱! 토르 완전 멋있음 로키와의 캐미도 짱 재밌고!! 꼭 보시길♡  
20171024,10,오늘 용산에서 아이맥스 시사회로 보고 왔는데 와 그냥 최고... 앞으로 마블영화는 아이맥스로만 볼 것!! ^^7 재미 감동 액션 다잡았구... 인피니티워가 넘나 기대되는것!!  
20171024,10,시사회 다녀 왔어요!!기대하고 있었는데 정말 그 이상으로 재밌고 멋졌어요!!!또보고싶네요ㅜ  
20171024,10,시사회 당첨 안될줄 알았지만  되버렸네~~~ㅋㅋㅋ마블 광팬으로써 이번 토르 넘 꿀잼 ^  
20171024,10,귀엽고돌아온토르와 헐크 거기다 새로운케릭터까지~볼거리풍성하네요~~n차로 4dx로 보면더할나이없을듯~  
20171024,10,지루할틈 없이 너무 재미있었어요ㅎ 러닝타임이 짧은게 아닌데도 시간이 금방 흐르더라구요! 꼭 보세요!!!  
20171024,10,2017년 마지막 마블 영화라서 기대하고 있었는데 역시 기대를  저버리지 않았습니다^^ 왜 마블'코믹스' 영화인지 잘 알것같습니다!!! 완전  웃음터지고 나왔어요ㅎㅎㅎ 올 한해도 마블은 멋지게 마무리했군요^^  
20171024,10,시사회 보고왔어요~ 여태까지 토르랑은 다릅니다 달라요! 진짜 개꿀잼 입니다 ㅋㅋㅋㅋ  
20171024,10,제발 2편보다  재밌길  2편은  솔직히 노잼이 였는데3탄에서는 헐크도 나오고  재밌을것같다.  
20171024,10,미쳤어 그냥.... 오조오억번 보세옄ㅋㅋㅋ  
20171024,10,오우 최고였어요!!^^  역시 마블입니다~~!^^토르~~다음 편이 또 기다려집니다^^  
20171024,10,마블다운 엄청난 스케일과 쉴 새 없이 터지는 웃음폭탄! 마블 영화 중 가장 유쾌하고 화려했다.  
20171024,10,진짜 역대급이에요 꼭 보세요 진짜ㅠㅠㅠ  
20171024,10,시사회로 다녀왔습니다.일단 토르시리즈 통틀어서 가장재밌고 마블 시리즈 통틀어서 가장 유쾌하다. 진짜재밌고 헐크 귀엽다  
20171024,9,아이맥스 시사회 잘 봤습니다 전 편들보다 코믹요소가 더 많이 들어가서 웃으면서 봤습니다~ 아쉬운 건 어벤져스2 기억이 가물가물해서 복습하고 가면 좋을듯하네요.  
20171024,8,시사회보고왔는데 약간 판타지영화였다가 스타워즈보는거같은 느낌??재밌음  
20171024,10,스페이스 오페라 장르와 판타지의 완벽한 조화! 하나도 힘든 데 이 두 개를 <토르:라그나로크>가 완벽하게 해냈다. 거기다 코미디와 진지한 액션까지..!  
20171024,10,토르 라그나르크 IMAX관 시사회 너무 재미있어요 개봉하면 친구들과 1번더 보고싶어요  
20171024,10,그냥 진짜 꼭 봐야해요 믿고 보는 마블. 2번 3번 4번 몇 번을 봐도 재밌을 거 같아요 꼭 보세요 진짜 꿀잼♥  
20171024,10,시시회로 봤는데 기존 토르의 영화랑 다르고 너무재밌게봣어요 아 쿠키영상은 완전 대박입니다 엄청난게 숨겨져있네요 꼭 보세요 굳  
20171024,10,토르 시리즈 제일 재밌어요.강추해요.^^  
20171024,10,"진짜,,이래도될정도로,,,? 재밌었어요. 시사회를 통해서 관람하게 됬습니당! 진짜 너무 말이 안나올정도로 재밌어요! 역시 마블,,,아스가르드의 미래가 궁금하다면 극장 고고하시길|  "
20171024,10,핵꿀잼!! 마블 특유의 감성이 정확하게 녹아든 영화! 그리고 정말 마블의 세계관이 집중된 영화다! 강추!!  
20171024,10,역대급!!!! 토르짱짱맨~~~~  
20171024,10,진짜 정말×100 완벽하다!스토리도 영상도 연기도 재미도 음악도 모두 최고였다!!더할나위 없이 모든게 완벽했다!보고 또 보고 봐도 재밌을 토르:라그나로크♡10점 만점에 백점♡♡♡  
20171024,10,아니 마블영화 점점 더 대박이 출시가되네요발전해가는 모습이 너무 보기 좋습니다 ㅋㅋ시사회로 봤는데 너무너무 재미있네요 최고 짱짱!!  
20171024,10,초청시사회갔다왔는데 진짜 역시 마블은 마블인듯 토르짱  
20171024,10,"아이언맨 시리즈, 가오갤2를 뛰어넘는 유쾌함!다시 태어난 토르, 시리즈중 단연 최고였어요!무조건 극장에서! 놓치면 후회합니다  "
20171024,10,무조건 10점 ㅠㅠㅠㅠ 시사회로 보고왔는데 역시 마블 ㅠㅠㅠ너무 재밌다진짜ㅠㅠ와 또볼거임 하ㅠㅠ  
20171024,10,와.  마블역대급으로 재밋다 ㅋㅋㅋㅋ근육 빵빵토르 굿  
20171024,10,하하....보고 나와서 말을 못하겟네ㅋ진짜 마블 요즘 제대로다...와 마블영화중에 손꼽힐만한 걸작중걸작그 와중에 헐크졸귀...ㅎ 토르랑케미good!  
20171024,10,개봉전 시사회로 보고왔는데 역시나 실망시키지않는 !! 정말 시간가는줄 모르고 푹 빠져서 봤네요 다음편이 벌써부터 궁금해져요 ㅎㅎ  
20171024,10,대박적 즐거움! 호쾌 상쾌! 신나게 재미있게 즐기기 좋은 영화!헬라 넘 좋아여ㅠㅜ으아 역대 시리즈 중 제일 재밌습니다 추천!  
20171024,10,시사회보고왔는데 역시 마블 그자체로 믿을수있다. 요번편은 웃음도 책임진다 ㅠㅠㅠ그렇다고 웃기기만 한것도 아니다 ㅠㅠㅠ그냥 봐세요 ㅠㅠ보면안다 얼마나 멋있고 노래도 선정잘하고 웃기고 재밌는지 ㅠㅠ 진짜 다들 한번 두번 세번 보세요 ㅠㅠ  
20171024,10,MARVEL 영화다운 영화가 나와서 정말 재미있게 봤습니다. 마블식 조크 마블식 사운드 마블식 액션이 피곤한 직장인들의 피로도 날려주는것같습니다! 올해 최고의 영화가 될거같아요 정말재미있습니다 꼭 보세요!!!  
20171024,10,역시 마블...타이카 와이티티 진짜 최고 토르 최고 시리즈 중에 가장 재밌고 매력적이다!  
20171024,10,방금 시사회로 봤는데 ~ 정말 재밌네요.시간 간줄 모르게 봤어요^^ 다음 편 기대되요!!  
20171024,10,햄스워스형 히들이형 다시 내한 고고고 ㅎ  
20171024,10,완벽한 토르영화가 이제야 나왔다. 버디무비 같기도 하고 시리즈의 정점을 찍은 듯 하다. 그러나 가장 훌륭한 점은 어벤저스 프리퀄 같지 않고 개별 영화로서의 가치도 높다는 점 이다  
20171024,10,역시 믿보마! 마블공식 페이스북 시사회에 깊은 감사를 드립니다!  
20171024,10,오우! 더 재밌어지고 더 멋있어졌네요!! 진짜 이런류의 유머 딱 제스타일입니다ㅋㅋㅋ 짧은 머리 토르도 너무 멋있고 토르 시리즈중에 제일 좋았네요! 또 보러 가야겠어요ㅋㅋㅋ  
20171024,10,오늘 마블 페이스북 시사회 당첨되서 방금 관람했는데 마블 시리즈중 가장 재밌고 유쾌했어요 2시간동안 시간 가는줄 모르고 봤네요 토르 시리즈중 가장 재밌구요 꼭 영화관 과거 관람하세요 개꿀잼  
20171024,10,꼭보세요 만화랑은 살짝 다르지만 꼭봐야할 작품 재밋을땐 재밋고 싸울땐 과감하게!  
20171024,10,웃다 끝난것같음 ㅋㅋㅋ 내가 본 마블 영화중에 제일 재밌다이거 안보면 마블팬아닐정도로 개꿀잼  
20171024,10,역시 마블 후회안함 강추 ㅎㅎ 헬라 도 예쁘지만 발키리는 숨은 진주였음 페가수스급 ㅋㅋㅋ 정말 화려한 CG 보는 내내 황홀감 업그이상 강추임.  
20171024,10,우주에서 제일 잔망넘치는 형제가 다시뭉쳐버렸으니ㅜㅜㅜ 좋을수 밖에ㅠㅠㅠ  
20171024,10,역대급 스케일 역대급 토르 역대급 액션  
20171024,10,평일 대낮에 영화 쳐보러오는 백수가 조온나게 많네요  
20171024,10,시사회 갔다왔는데 ㄹㅇ 줘어어어엇나 잼따ㅋㅋ그리고 헬라느님 보고 반해버렸오ㅠㅠ10이쁨  
20171024,9,마블 최고의 해맑음으로 빅웃음 주는 이 금수저히어로 너무 좋다!! 초긍정 해맑음으로 헐크와 닥스까지 유쾌함 넘치는 그의 세계로 끌어들였다. 점점 중요한 그의 역할과 매력에 다시한번 빠져들었음!!  
20171024,10,낼 개봉이라 퇴근하고 바로 보고싶은데ㅠㅠ 야구 한국시리즈 1차전이라ㅠ 시리즈 끝나면 볼게ㅠ 기아 화이팅♥  
20171024,10, 다시 스크린으로 만나는 헐크와 토르의 완벽한 만남. 마블 영화 세계관의 변화와 유쾌한 유머를 잊지 않는 연출에 흥미진진. 사상 최대 규모의 액션  
20171024,10,쿠키영상꼭보세요 꼭이요 꼬오오오옥!  
20171024,10,토르 시리즈중 제일 재미있다! 유머와 액션 어드벤쳐의 훌륭한 조합!!  
20171024,10,역시 마블 영화! 역대급 재미와 스케일! 정말 재밌어요~  
20171024,10,언제나 최고를 선사하는 마블...정말 강력하게 돌아온 토르 : 라그나로크...토르시리즈 사상 최고로 찾아왔네요.  
20171024,10,꼭 본다아아아으아아아  
20171024,10,어제 시영했는데 개쩜 이미그랜트송 나오는장면 두번있는데 그때 개소름 + 쿠키영상도 2개  
20171024,10,드디어 올것이왔다♡♡♡  
20171024,10,"된장! 빨리 보고 싶은데 같이 보기로 한놈이 금욜에 보재!! 아놔 인내심 바닥인데ㅡ,.ㅡ  "
20171024,9,기존 토르 시리즈에 비해 코미디 요소가 좀더 증가했습니다.어벤져스 같은 분위기가 풍깁니다. 토르와 로키 사이도 좀 더 심플해졌고 진지 빨던 토르가 아닙니다. 여러분이 생각하고 원하는 마블 영화 분위기입니다.  
20171024,10,12시되자마자봐야지  
20171024,9,"이번엔 어벤져스가 아닌 리벤져스가 나온다네요,, 기대가 됩니다.  "
20171024,10,토르 너무 기대된다~♥  
20171024,7,마블 영화들은 계속 쏟아지네  
20171023,10,토르는 기본이고 캐롤의 케이트 블란쳇. 잠시라도 나오는 닥터스트레인저의 베네딕트. 좋아하는 배우 다나오네. 꼭 극장서 봐야지. 예고보니 음향효과도 끝내줌ㅜ  
20171023,10,감독과 배우에게 기립박수를  
20171023,2,곰탕도 이런곰탕이... 아무거나 막 갖다붙혀도 되네 어벤져스 gs2.5 어떠냐 편의점 광고물품 좌악 깔고  
20171023,10,우리나라 평론가들은 정치색이 있는 영화는 평점 존나 높게주면서.. 해외영화들은 평점 그지같이 주더라..  영화관도 독과점하면서.. 돈처받고 평점주는 쓰레기 평론가들  
20171023,10,오늘 범죄도시 재밌게 봐서 한동안 영화안보려 했는데..이틀뒤 토르 개봉이라니 안볼수가 없잖아 ㅋㅋ 행복하다  
20171023,10,톰 히들스턴입니다 여러분 다른 말이 필요하나요...?  
20171023,10,역대 마블 영화중 코미디 갑!  
20171023,9,킹스맨2  개노잼이라 이거에라도 올인한다...  
20171023,10,토르에는 무작건 로키가 나와야됨 그래야 토르와 케미가 맞으면서 2배로 더 재밌어짐  
20171023,8,엘프를 믿으면 안됩니다.  
20171023,10,헐 헬라 진짜 쩔어 너무 멋있어 걸크러쉬 대박이다 진짜 너무 기대됨 헬라 너무 멋있음 ㅜㅜ 헬라 짱  
20171023,10,개봉 얼마 안남았다고 슬슬 알바들 기어나오네... ㅁㅊ넘들아 마블은 아무리 실패해도 DC나 다른영화들보단 성공이다...물논 인크레더블 헐크빼고...힣  
20171023,10,저는 일단 닥터스트레인지 활약이 기대됩니다.그리고 헐크는 어쩌다가  저런모양이 되었는지도 궁금하고요  
20171023,1,상업성ㅡㅡㅡㅡ 유치ㅡㅡㅡㅡ  
20171023,10,토르에서 스파르타쿠스 냄새가 난다~  
20171023,1,ㅈ노잼...신이 망치를 왜 들고 다녀? ㅋㅋ  
20171023,1,이거 좀 별로임...ㅠㅠ  
20171023,10,오딘 아버님 안녕히가십시오...  
20171023,10,쏘르~ 안 볼 수가 없지...ㅋㅋㅋ  
20171022,10,해외 평이 마블 시리즈중 최고라던데 기대 기대  
20171022,10,헬라자체가 소울스톤??  
20171022,1,망치망치 뿅망치 이종현짱짱맨!  
20171022,10,로튼평점 오져따리 지려따리...ㄷㄷ최대 기대작임  
20171022,10,그냥 할 말이 없음 100퍼 꿀잼각  
20171021,2,마블영화중 토르시리즈가 제일 노잼이던데..악역맡은 토르동생 임펙트가 너무없고 가공하다만넙대대망치는 유치뽕이고 과연이번엔....  
20171021,10,내가 좋아하는 케이트 블란쳇과 칼 어번 베네딕트 컴버배치가 나오는구나..꼭 봐야지~  
20171021,10,장르에 코미디는 왜 안적혀있는지 모르겠다  
20171021,10,아마도 토르랑 헐크랑싸우다가 로키죽이러가는데 로키가 설득을해사 발키리죽이고 로키가 다시 배신할것같네요(엄연한 제 추축입니다)  
20171021,1,어우 초 중.고 딩들 겁나 시끄럽겠내  
20171021,4,3d 왜 안해주냐 나 마블은 꼭 3d로 보는 매니안게...ㅡㅡ;; 본 별점은 삼디 안해주는 것의 저항이다.  
20171021,8,2편 존나 별로였는데 기대해본다 3편  
20171021,10,토르 감독 다른 연출작 진짜 웃김.. 연기도 잘하고 ㅋㅋ 그땐 그냥 저예산영화에서 보고 오 했는데 토르 감독으로 돌아오다니  
20171020,10,로튼98실화냐 꼭 보러간다  
20171020,10,로튼 토마토 98% 꼭 봐야지~~~  
20171020,10,닥터 스트레인지 많이 나왔음 좋겠다  
20171020,10,마블의 메인 이벤트라는데 이게 인피니티 워로 가는 관문으로서 성공해주길!  
20171019,8,저 불뿜는색기 dc수어사이드스쿼드에 나왔던놈 아니냐?  
20171019,10,토르신인데 왜 헬라한테발리지? 어쨌든기대합니당~!!  
20171019,10,안봤지만 마블영화는 닥 10점이지  
20171019,10,저는 극장가서 영화를 보았고 감동의 눈물과 박수를 치면서 영화를 감상했습니다 역대급 최고의 영화입니다그리고 영화 끝나고 벌떡 일어나서 기립박수를 쳤습니다 정 말 역대급 최고의 영화라는 찬사를 보냅니다 바로 이영화 입니다 선택하세여 놓치지마세요  
20171018,10,베댓이 다 2015년에 쓴거얔ㅋㅋㅋㅋ  
20171018,9,음..살며시 기대해 봅니다  
20171018,10,당연히 10점을 받아야 마땅하다..진짜 너무 재밌을듯♡♡  
20171018,5,아이먁스할거면 3d도 해주지 그래야 영화관가서 볼만하지 글고 요즘 3d로 날올만한영화도 2d로나오고 참...  
20171018,10,이 영화는 마블에 기대하는 모든 것이 다 있다  
20171018,10,다음주네. 일주일이 참 기네 ㅠㅠ  
20171018,10,케이트 블란쳇 완전 기대중 ㅜㅜ  
20171018,10,ㅋㅋㅋ 토르 상대가 헐크라고 좋아하는것봐 동료라고 ㅋㅋㅋ  
20171018,10,이건 무조건 10점이다 ㅎㅎㅎㅎ  
20171017,4,"마블 .. 그냥저냥 시간떼우기로 보는 영화기는 한데, 이번 시리즈는 심하게 유치할 거 같음.  "
20171017,10,볼래요 만개. 돌파!!!축하!  
20171017,10,"하아, DC미안 해 ㅎㅋ  "
20171017,10,토르 라그나로크 너무 기대된다!  
20171017,10,빨리보고싶어 긴장됨 ㅠㅠ  
20171017,1,나의 케이트 블란쳇 누님을 딱정벌레로 만들어 버렸어야 1점받아 마땅하다 -2억점을 주고싶다  
20171016,10,ㅠㅠㅠ 언능개봉해줘 ㅠㅠ  
20171016,7,토르 헐크는 벗고 나오는데 헬라는 과연...  
20171016,10,토르 라그나로크가 개봉한단 말이지( ?° ?? ?°) 르으으~ ( ?° ?? ?°) 라랄라 ~( ?° ?? ?°) 그냥있을 수 있나( ?° ?? ?°) 나 갔다올께( ?° ?? ?°) 로디로 가나요?크으 내 마음속에 저장( ?° ?? ?°)  
20171016,10,오우 너무 기대되는데여  
20171015,10,믿고보는 마블이 또 해낼까요?!?!?!  
20171015,7,요즘 마블 영화 스토리보다는 화려한 액션위주로 나오는것 같아서별로던데 .. 포스터만 봐도 할리우드판 파워레인저 같음  
20171015,10,어라 케이트 여사님? 요거 무조건 두번이상 봐야겠네  
20171015,5,스크린수...헐 겁나 적네  
20171014,10,토르형마지막에 전기로둘러싸고눈이파래지고나는무슨신이라고하고적이랑 싸우거나 아니면 같은편이랑싸우다가저멀리우주로 둥둥 떠다니게된다그리고 로키는토르를또배신하고어벤져스3에등작한다저는미래에서왔어요진심입니다이거 맞으면 신세계상품권 백만원권보내줘야되요 okay??  
20171014,10,"와드딛ㅇ어ㅜㅠㅜㅠ토르3 개봉이다 진짜 오래기다렸는데ㅠㅜㅠㅠ히들아  또 한국ㄱ와줄거지,,? 사랑한다ㅠ  "
20171014,3,옷과 내용이 너무 유치해. 우뢰매 같애  
20171014,1,머가리만 상상해도 벌써 허두슴나서  
20171013,10,스타워즈 같은 느낌은 나만 드는건가?  
20171013,10,빨리 나와라아 나와라요  
20171013,10,예고편보고 기대되서 넘나 기다리게되유..  
20171013,10,이 영화 보고 힐링 해야겠다!!! 《토르: 라그나로크》 열 번 보자!!  
20171013,10,포스터 보고 짭인줄...  
20171013,10,아 진짜 엄청 기다리고 있어요!!완전 기대되요!!  
20171012,10,케이트 블란쳇 탑배우 날려먹지나 말고 빌런 제대로 만들자 제발  
20171012,10,올해 최고의 기대작 옛다 10자  
20171012,10,환상적인 스토리와 화려한 영상이 많이 기대가 돼요.  
20171012,10,마지막 인피니티 스톤 소울스톤 나왔으면 좋겠다헤임달 기대됨...ㅎ  
20171012,10,믿고 거르는 마블인 만큼 그 기대를 충족시켜주기를...  
20171011,10,빨리 보고싶다..!!!  
20171011,10,존~나 기대된다~~~기모링  
20171011,10,이미  볼준비를 마쳤다....헌혈하러 가야지....ㅎㅎ  
20171010,10,11월 1일 제 생일 날 꼭 보겠습니다.베네딕트컴버배치가 나와서 꼭 보겠습니다.  
20171009,10,ㄴ 토르 다음 블랙팬서 그다음이 어벤져스 인피니티워  이다  
20171009,9,토르: 라그나로크 다음이 어벤져스 인피니트 워 인가?  
20171009,10,빨리 보고싶네요~ 개봉언제하나요  
20171009,10,마블아 DC를 밟고올라가라 그리고 토르3 히트치기를^^  
20171009,10,인간인가 그래픽인가??  
20171008,10,마블 사랑해요ㅠㅠ진짜 꼭 본다!!  
20171008,10,이건 개봉하자마자 IMAX로 보고 2D로 또 봐야지  
20171008,7,CG가 중국틱 한데 중국 자본이 들어갔나?  
20171007,10,마블영화는 로키나와야 마블이 더재밌어진다  
20171007,10,케이트 팬들은 악당 응원할듯(저도 헬라 응원합니다)  
20171007,10,"토르1과 토르2는 재미없었는데 닥스도 나오고 헐크도 나오니 흥분된다, 흥분되;;;  "
20171007,10,아니 그래서 닥터스트레인지는 나오는거?안나오는거?엑스트라수준 각  
20171007,8,라그나로크  추억의 게임이였는데 ㅋ  
20171006,6,악당이 너무 약하게 생겼어  
20171006,10,드디어 10월개봉이 왔다!  
20171005,10,결국 로키는 안죽었네요 하는분....다크월드한번 보고오시죠..마지막에 대놓고 나와선 내가더고맙지 이러는데  
20171004,10,토르 영화 분위기가 밝아서 좋다  
20171004,10,토르 망치를 헬라가 망치네요 (아재개그아님 소근소근)  
20171003,1,기대해요 토...~.~~~.르  
20171003,10,꼭본다꼭본다꼭본다꼭  
20171003,10,케이트 블란쳇 묠니르 잡는씬 존나 쎅시하다  
20171002,10,마블영화 개잘만드네 오늘  
20171002,9,머리 짧은거..ㅈㄴ 매력..쩔엇..  
20171002,10,영화 안보면 되지 왜 악플다는지 이해를 못하겠음  
20171002,10,케이트 블란쳇 등장이라니..감사합니다ㅜㅜ 하... 기대돼요 너무너무  
20170930,10,"토르가 짱이야,,,!!!!  "
20170930,10,토르 망치 어디갔나요?  
