0,1,2
20170929,10,믿고 거르는 마블 진짜 유치해서 못봐주겠다ㅡㅡ 이번에도 또 재미도 더럽게 없는 개그치면서 존나 유쾌하고 밝게가네 ㅉㅉ 마블은 변하는게 없다 맨날 똑같은 방식 ㅋㅋㅋㅋ 진짜 OO노잼... 좀 망해야 정신차리는데.. 솔직히 볼 때마다 오글거린다 에휴  
20170929,5,토르시리즈는 영...별로...  
20170929,10,귀요미 헐크 기대된다. 두근두근~  
20170928,10,믿고보는 마블 10점달고 본다  
20170928,10,얼른 와라. 10월 말이여.  
20170928,10,아ㅠㅠㅠㅠ 토르 넘 기다렸다.. 닥터스트레인지도 여기서 뭐할지 기대되고><  
20170928,10,머리 짤랐는데 왜 라이언레이놀즈가 보여..ㅋㅋ  
20170927,10,난 마블 캐릭터 중에 토르가 젤 좋더라!  
20170927,10,기대중입니다 여러분 같이봐요  
20170926,10,라그나로스님의 힘이 느껴지는 부분 ㅇㅈ? ㅇㅇㅈ 이거 바박할시 타우릿산인 부분 인정하십니까? 타우릿산이 검바산에서 뛰쳐나와서 토르 (부-랄)치고 가는 부분입니다 행님들  
20170926,5,역시 1편을 못따라가는군. . .  
20170924,10,헐 출연배우 펼쳐보기 하니까 베니도 나오네..햄식 히들 베니..완벽 그자체..  
20170924,10,인피니티워 전 마지막 떡밥ㅜㅜㅠ♡  
20170924,7,어직 안봐서 함부로 평은 못하겠지만..사실 가장 심각해야할 주제를 정말 가볍게 만들었다니 불안하다  
20170923,10,두유 원트 수픽?  노 있츠 뫄블  
20170921,10,아...나 왜 지금 고3....왜 10월 개봉ㅠㅜㅜ  
20170917,10,기대중  완전 잼 있겠다 ㅋㅋ  
20170917,10,토르 각성계기 초딩새끼들 깔봐서 ㅋㅋ그래소 룬킹 토르로 각성함 ㅋㅋ 토르 또달은 무기뭔지알겠는데 말안할래 ㅋㅋ  
20170916,1,이거 결국은 토르가 이김 ㅅㄱ  
20170916,1,유치하고 개노잼 마블영화중에서 제일 실망한 영화....  
20170915,10,조금만 더 기다리면 된다ㅠㅠ 빨리 햄식이랑 베니 보고싶다  
20170915,10,그냥 이건 무조건 그냥 보는겁니다. 그냥 본능적으로  
20170915,10,완전~기대가득!!!! 점점 잼나는 마블~~^^  
20170914,10,예고편만 보고도  팬티를 갈아입다니....  
20170913,1,전세계 초대박 흥행예감.총 수익 3천만불..한국관객 총 24만 동원 예감..초대박..  
20170913,10,한달도 안남았다!!!! 아싸  
20170911,2,마블도 거품이 슬슬... 리얼급 실망을 안겨줄듯  
20170910,10,로키가 보고싶다히들이가 보고싶다둘째왕자님이 보고싶다토르가 보고싶다햄식이가 보고싶다첫째왕자님이 보고싶다  
20170910,10,이제 한달남았다 학 ㅠ ㅠ ㅠ 톰 히들스턴 본다니까 너무기대돼 ㅠ ㅠ 토르 시즌 다봤는제 흑 ㅠ ㅠ  
20170909,10,이거 꿀잼일듯. 10월까지 기다리자!  
20170908,6,일단  감독이  맘에  안들어!!!!  
20170908,10,빨리 보고싶어 ㅠㅜㅠㅜ 10월아 빨리와주라  
20170908,10,빨리 보구싶당~~~ㅋㅋ  
20170907,10,오 드디어 ㅠㅠ 곧개봉하니깐 다크월드또봐놔야겠다 ㅋㅋ  
20170907,10,"토르,헐크,닥터스트레인지 이셋을 누가 막을소냐  "
20170907,10,글쎄요 누르기만 해봐라  
20170907,10,예고만 봐도 이건 만점이다...ㅋㅋㅋ  
20170907,10,갓마블이 돌아왔다!!!  
20170906,10,빨리 앞당겨서 9월말 개봉 했으면 좋겠다....  
20170906,1,발키리 자체가 원래 백인인데 바이킹 역사보면 흑인 도랏네 블랙쿼터제 차라리 아시아인 여자를 써라 흑인들보다 아시아사람이 더 차별 받는다 발키리가 흑인이라서 1점 줍니다  
20170903,10,으아아아 짧은머리라니ㅜㅜ 사랑합니다♥  
20170902,10,크리스 햄스워스 짧은머리봐 ㅠㅠ 심쿵 ㅜㅜㅜ  
20170830,10,토르라그나로크!!!  
20170828,10,분위기긴 뭔가 가오갤같아짐 인피니티워 큰그림인가?  
20170827,10,한국에서도 대박났으면좋겠다!  
20170824,10,"예고편도 웃겨 디짐(웃음)거침없는 웃음 폭풍이 예상된다.3번째니까 극장에서만 3번 볼끄나.아이맥스로1번,3D로1번,4DX로1번  "
20170824,10,믿마블. 아무리 벨붕이라도 토르 상향좀 하자 너무 약해짐.. 진짜 토르를 보고 싶음..ㅠ  
20170822,6,라그나로크 망한지가언젠데  ㄱ고전게임즐  
20170821,10,마블 영화 또 기대해봅니다.  
20170821,10,"하. 스파이더맨 봤는데, 또 토르 나오네 ? 개꿀~~  "
20170821,10,"나탈리 포트만 하차로 둘의 이야기는 아무것도 설명 못하고 끝났지만, 그냥 이대로 마치 원래 없었던 듯 묻어버리는게 것도 토르 시리즈의 마무리를 위해서 더 좋은  방법일 수도 있다는 생각은 든다. 나중에 토르가 된 제인을 등장시킬게 아니라면 말이지.  "
20170820,10,2017년이 왔습니다.  
20170819,10,오 이번영화작 기대해볼만하겠다 토르   많이 바꺼서   빨맂개봉했으면   헐크   닥터 스트레인저  기대작♡~♡  
20170818,10,쏘~르~~  포스터는 제이미 라니스터  
20170817,10,믿고 보는 마블♡ 토르 응원합니다!!  
20170814,5,오잉ㅜㅜ 나탈리포트만은 안나오냐??  
20170814,10,정말 오래기다렸다..  마블에서 가장 애정하는  캐릭터 ㅜㅜ 재미만 있다면 수 번 볼 준비는 되어있다 영화가 잘 뽑혔기만을 바란다  
20170813,10,마블영화중최고의영화닥스로키토르헐크발키리의콜라보  
20170812,10,신들의 황혼은 오지만 마블에게 황혼이란 없다  
20170811,10,어벤져스3로가는 두번째 관문인가. .  
20170810,10,10월까지 어떻게 기다려 ㅠㅠ  
20170806,10,와 닥터스트레인지 쿠키영상에서 예상한대로 여기서 닥터스트레인지가 나오네  
20170806,10,"노잼 조선영화뿐인 극장가에, 올만에 볼 만 한 놈이 오네~  "
20170804,10,와 케이트블란쳇.. 반지의제왕때와 정반대의 변신이네.. 백색 요정의 여왕에서 흑색 죽음의 신이라니..  
20170803,10,내가 남깁니다 하하하하  
20170803,10,조연봐! 닥터 스트레인지가 있어!  
20170802,10,분량은 기대 안 한다 칼 어번 제발 내한만 와줘라 진짜ㅠㅠㅠㅠ 한 번만 와줘라ㅠㅠㅠ  
20170802,10,마블 너무 좋아 dc보단 마블 기대된다  
20170729,9,개봉 대기중인 영화이다  
20170729,10,헐크 토르 시빌워 안나왔다고 삐치셨네 머 둘만의 재밌는 스토리가 나오겠죠 어차피 만날텐데  
20170728,10,빨리 보고싶어서 미칠 지경이다 현재로선 인피니티워 보다 더 기대됨  
20170727,10,태어났을때부터 마블영화는 무조건 개봉 일주일안에 영화관에서 돈내고 본다... 지금까지 우리반에 마블덕후없어서 슬픈 1인이었습니다..  
20170727,10,넘나 기대되는  것.. 웰메이드 SF 영화  
20170726,10,마블은 일단 예매하고 봅니다  
20170725,10,소문난 잔치에 먹을 게 많았으면 좋겠네요. 기대 한 만큼 재미있겠죠? 개봉하는 날 무조건 봐야지.  
20170725,10,의사양반 조연이라고 나와있잖아요..  
20170725,2,마블은  아이언맨은퇴하면   스파이더맨하고  어벤져스밖에  기대가... 토르시리즈가  젤  졸리다.  
20170724,10,닥터 스트레인지는 나오는거 맞나요?? 거의 까메오로 나오는거라서 홍보를 안해주는건가요ㅠㅠ  
20170724,10,헐 조연 봐 ㅎㄷㄷ 기대하고있을께요!  
20170724,10,가오갤 예고편인줄;;;  
20170724,10,헐크 방어구 착용하니 와우 오크와 똑같다잉  
20170724,10,마블은 진짜 미쳤다 뭘해도 재밌고 뭘해도 흥행하고 ㅋㅋㅋㅋ  
20170723,9,스파이더맨 정도는 안되겠지만 어느정도 흥행은 할듯... 냉정한 판단으로보면 토르는 한국인에게 친숙한  히어로가 아님. 스파이더맨은 전작 시리즈가 이미 많이 알려졌기에 ..이하 땡땡~ 영화의 완성도만 보자면 9점. 흥행몰이는 중간 예상.  
20170723,1,기대는 안되지만 보기는 할듯  
20170723,10,부라더 다메요 (쾅콰과쾅) ㅅㅂ 깜짝 놀랐다 데스 엌ㅋㅋ 닝겐노 유리와 튼튼 데스넼ㅋㅋㅋㅋ  
20170723,10,안녕하세요.. 두번째 베댓입니다ㅋㅋㅋ 히들이 내한오면 로키 코스하고 내한시사회 갑니드ㅏ...  
20170723,10,아스가르드가  통수의 여신 헬라에 의해 궁전밑에 tnt가 설치되고 무기고 및 교도소가 습격되며 아비규환이 되는 장면~~ 신들의 평화로운 땅이 아스가라도로 바뀌는 것이 정말 참혹하네요.  토르가 사절 기술을 써 평화가 오니 감동이 두 배  
20170723,10,"젠장.. 이번껀 ""진짜""다.. 못기다리겟다  "
20170723,10,아니 이거 예고편이 미쳤내 ㅎㄷㄷ!  
20170723,10,이것 무조건 극장 가서 4D로 봐야 해 ㅎㅎ  
20170723,10,아 진짜 이거 대박재밌겠다!!!  
20170723,10,기대된다 마블이 내놓는 올해 마지막 3번째 영화인만큼 멋있었으면 좋겠다. (아래 AD(kimm****)님 뭔 소리인지. 퍼스트어벤져 노잼  
20170723,9,어떨런지 모르겠지만 꽤나 가오갤스럽네요 분위기가  
20170723,10,와 새 예고편 보고왔는데 케이트 헬라 포스쩔어ㄷㄷ토르는 머리 자르니 더 존잘되고 로키는 여전히 귀엽고ㅋㅋ토르랑 헐크랑 나란히 앉아서 도란도란 얘기하는거 졸귀ㅋㅋ근데 닥터스트레인지 베네딕트는 안보이던데 비중 적은거 아니겠지..?암튼 10월만 기다립니다!  
20170723,8,"마블은 딱 퍼스트어벤져, 아이언맨3까지가 좋았음 그담부터는 절대 돈내고 안본다  "
20170723,1,마블영화 좋아한다는사람 최소 정신연령 초딩  
20170723,10,와 개봉전인데 벌써부터 실검 뜨네 역시 믿고보는 마블 화제성도 갑  
20170723,10,그냥 토르 존잘....  
20170722,1,하필이면 블레이드러너랑 같은 날이냐  
20170719,9,츤데레 동생의 만행으로 잠자해 있다가 다른 종족에게 쳐 맞는 토르 어른이의 감동적인 스토리 입니다  
20170716,10,토르 1 도 2도 개꿀잼이엿으니 역시 3도 핵꿀잼일듯ㅎ  
20170716,10, 닥터스트레인지도 나온다니!!ㅋㅋㅋ ㄹㅇ 기대 중ㅋㅋ 하..ㅋ 빨리 보고싶으나 이거 개봉할 때되면 곧 수능이넼ㅋㅋㅋㅋ 하ㅋㅋ ..  에휴...  11월 말까지 상영했으면 좋겠다..ㅋㅋ  
20170715,10,요즘 1년의 시간을 기다리는 하루하루가 너무 행복하네요 ㅠㅠ 이게 다 마블 덕분이에요  
20170714,10,기대할께오 . . 얼른 나왕 ㅜ  
20170714,10,ㅋㅋㅋㅋ빨리 보고 싶다  
20170713,10,토르 이발 예쁘게했네 머리 예뻐서 10점줘요 ~  
20170713,9,토르는 진짜 ㅜㅜ 훨씬 더 쎄게 나와야하는데 너무 너프먹여서 안타까움 ㅜㅜ  아무튼 케이트 블란쳇도 나오네 대박....블란쳇 대박...  
20170712,10,토르 시리즈 완전 재미있음. 이것도 완전 기대중. 톰 히들턴의 매력적인 악동역 완전 기대~! 형제의 아웅다웅이 화해와 협력으로 나가길...^^  
20170711,10,와우 헐크랑 닥터스트레인지 나오는거보고 기대중  
20170710,10,마블영화 꿀잼 이영화 꼭봐야지  
20170709,10,스파이더맨 두번째 쿠키영상에 떡밥나옴  
20170708,10,정말 기대 됩니다!!!  
20170708,10,하...마블영화 어떡해이렇게잘만들지? 꼭본다  
20170708,10,싸라해요 마블 영원히 함께할게염 맹세합니다  
20170706,10,제발 인종차별이라고 아무도 뭐라 안하니까 원래 발키리로 돌려줘라..아니면 인종 바꾸더라도 어느정도 비슷해야할 거 아냐  
20170702,10,토르와 헐크의 낯선곳에서의 만남 캬하하하 생각만해도 두근두근  
20170701,10,시험땜에 개봉일 무섭다  
20170629,9,와 워헐크 나오네 ㅡㅡ..ㅣㅣ..  
20170626,10,토르 머리짤랐네 존잘이네  
20170622,10,예고편이 느낌이 조타. 이번에는 토르도 잘 나올 듯  
20170619,10,내 예상하는데 토르 라그라로크 이영화 쿠키영상에서 가오갤 맴버 백퍼나온다 굿굿굿  
20170618,10,역시 믿고보는 배우 케이트블란쳇 예고편만 봐도 포스가 ㄷㄷ;;다음예고편에는 닥스 베네딕 나오려나  
20170617,10,3편만에 처음으로 만화같이 머리에 헬멧쓰네 기대만빵  
20170611,8,내가 젤 좋아하는 영웅!  
20170611,10,1이랑 2는 노잼인데 이건 재밋어보인다  
20170607,10,마지막 스톤하나 나오겠지  
20170601,10,미국은 마블만 찍고...중국은 서유기만 찍어라... 난 이게 젤 잼 있다... 미치도록...  
20170601,5,토르가 날고 기어봤자 원더우먼 발 아래임  
20170529,10,마블은 뭘 해도 성공한다!!!  
20170510,9,북유럽신화를 봐도 마블 원작을 봐도 로키는 이번편에 죽음으로 가겠네요. 원작에선 로키와 헤임달이 서로를 찔러 죽는걸로 나옵니다. 헤임달이 인피니티스톤으로 반 확정된 시점에서 가장 근거잇는 이야기이며 토르가 미래를 볼때 로키의 모습이 중간중간나왓었죠.  
20170505,10,베스트 중에 로키 죽은게 아니였어라고 하는 사람 있는데 로키 전편에서 마지막에 대놓고 안죽은거 나왔는데 이시리즈 잘 모르는 사람인듯;;?  
20170505,10,어벤져스 인피니티 워로 가는 마지막 관문  
20170503,10,2017년 10월 10월?  하!  빨리 coming soon  
20170502,10,토르라그나로크 가스파이더맨홈커밍을이긴다  
20170430,10,재미있을꺼 같은 느낌 어밴져스보다 이게 더 기다려짐!!!!  
20170419,10,팀 토르 영상에 나온 데릴이 라그나로크 시작할때 앞부분에 토르랑 같이 호주에서 나온다는데 정말인가요? 너무너무 기대돼요 진짜 나오면 재밌겠다  
20170419,10,드디어 2017년. 댓글 평균 2015년 2년 다 됫다. 이제 6달 남음  
20170418,10,"케이트 누나 때문에 기대가 큽니다.그 외에도 골드블럼,샘 닐 등 쥬라기 라인에 헐크와 스트레인지까지 참 화려하네요ㅋㅋ솔직히 앞서 두 영화는 평작이라 생각하지만 이번엔 진짜 대박쳤으면 합니다.햄식이 짧은 머리와 투구도 대박 멋지네요  "
20170417,10,예고편에서 가오갤느낌이나는건 뭘까..  
20170417,10,와 드디어 예고편 ㄷㄷ 아니 근데 헐크가 어벤져스2 이후로 왜 저행성에 나타났는지 헐크영화는 안맹길어줘요?  
20170414,10,아 10월까지 언제기다려ㅋㅋ  
20170414,10,"기대됨~ 아 근데 로키야~ 나는 니가 좋아, 근데 토르도 좋거든~그니깐 이제 토르 그만 괴롭혀줘~~~  "
20170414,10,캐스트 목록 오졌다리 오졌다ㅜ 빨리 보고싶다 11월 언제오냐~~~  
20170414,10,음ㅋㅋㅋ 베네딕트 컴퍼비치 닥터스트레인지 나오네요 묠리르는 스트레인지가 고쳐주네요  
20170414,10,진지하긴개뿔 포스터가낚았다  
20170413,7,블랏쳇 역사물 현모양처 스타일인데 저리하니 카리스마 어울리네 표정연기력이 우선인듯..  
20170413,10,10월에 개봉이다!!  
20170412,10,토르: 가디언즈 오브 더 아스가르드  
20170412,10,lmmigrant song 예고편 음악  
20170412,10,벌써부터 기대가 되네요^^  
20170412,10,토르 짧은 머리 ㅠㅠㅠ 넘나 보고싶어 꼭 영화관가서 봐야지  
20170412,10,빨리보고싶다 언제 기다려!!! 아이맥스로 볼꺼야!!  
20170411,10,헐크 월드워 헐크인가 ㅋㅋ 개기대되네 ㅋ 헬라도 원작이랑 싱크가 똑같고 ㅋ 믿고보는 마블코믹스  
20170411,10,아스가디언 오브 갤럭시...  
20170411,10,토르3라 쓰고 가오갤3라 읽는다 ㅋㅋㅋ 마블역사상 가장 어두운영화라고 하더니만 왜케 웃기는거야 ㅋㅋ.바보근육쟁이 토르찡 ㅠㅠ 빨리보고프다. 예고편 음악은 immigrant song 입니다.  
20170411,10,예고편 음악 먼가요? ㅋ  
20170411,10,키야 ㅋㅋㅋ역시 마블 예고편 기가막히게 찍어냈구만 기대된다!!!  
20170411,10,헐크가 살아있다!ㅁㅁ  
20170411,10,와 예고편 봤는데 기가막힙니다.완전 기대되요 토르시리즈중에서는 최고작이 되지않을까 생각이 드네요 하하  
20170411,10,와 베네딕트 오이베치 아니 컴버베치가 닥터 스트레인지로 2016년 11월에 MCU 데뷔했는데 딱 1년뒤에 토르:라그나로크에서 또 등장하다니! 정말 기대되는군! 예고편도 장난 아니던데...  
20170405,10,로키와 다시 대련하겠네요. 헐크는 여기 나오는이유는 무엇일지 궁금해서 봐야겠어요. 마블 히어로영화는 다 재미있어서 로키vs토르 스토리 토르1과 어벤져스1이후로 또 싸우겠네 어쨌듯 재미있겠어요.  
20170324,10,"이번작품 악당이 진짜 불쌍하다 헐크,토르만으로 힘든데 최강사기캐인 스트레인지 까지 등장함  "
20170320,10,기대하고 있어요!!♡  
20170317,10,마블은 진짜 영화계에 한획을 긋는다 한획 정도가 아니라 몇십획 정도  
20170228,10,모아나는 성공을 시켰는데 그린랜턴이.... 암튼 기대는 된다...  
20170225,10,엉엉엉 너무보고싶은데 몇월에 개봉하지?  
20170221,10,"재미없을 수 없는 조합인데, 재미없어도 본다.  "
20170216,10,무조건 본다... 로건도 청불이라 못보는데 가오갤 스파이더맨 토르3개는 봐야지...  
20170215,10,닥터는 알고있었는데 헐크는 처음 알았네(시빌워에서 안나와서 여기서라도 출연시키나봄)  
20170213,10,와 젠장 라인업 봐라...ㅎㄷㄷ하네...  
20170213,10,오오 토르에 탁터에 거기서 헐크까지 ㄸㄸㄸ  
20170211,10,헉 라그나로크에서 로키 죽는건 아니죠????안돼!!!!  
20170211,10,토르 닥터 스트레인지 헐크..  싸우는 상대가 불쌍하다.  
20170209,10,대체 예고편은 언제나오는 겁니까 빨리보고싶은데  
20170208,10,돈마블은 마블이란 이름 쓰지마라  
20170206,8,닥터스트레인지 보러 가야겠네  
20170202,10,ㅂㄷ 닥스까지 나온다니  
20170202,10,DC가 너무 불쌍해진다. 마블이 DC기세를 죽여버리네 ㅋㅋ.  
20170127,10,닥터스트레인지와 토르가 어떤 모습을 보여줄지 기대가된다.  
20170127,10,2017년에 볼거리 겁나 넘처나네 ㅠㅠ 스파이더맨 홈커밍 가디언즈 오브 더 갤럭시 토르 라그나로크  
20170126,10,"쥬라기공원1,2 주인공 다나오네  "
20170121,10,마블이여 영원하라 ~ !!  
20170120,10,"스타트렉 리부트 시리즈 배우들이 나오네. 조지 커크(헴스워스/커크아빠,비기닝 시작하자마자 죽음....), 칸 누니언 싱(컴버배치/다크니스 악당), 레너드 맥코이(칼어반/본즈), 크롤(이드리스엘바/비욘드 악당)  "
20170118,10,이번 토르마지막 시리즈인만큼..캐스팅이덜덜하구나..베니도 캐스팅에추가되고 한번더 히들이에 천연덕스러운 로키연기를!!  
20170115,10,대박 베네딕도 나온다니ㅠㅠㅠ11월까지 언제 기다려....  
20170114,8,진짜 스토리를 떠나서 보러오라고 손짓하는 구만  
20170112,10,♥♥♥마블♥♥♥ 기대합니다!  
20170112,10,토르를몇년기다렸는데..♡로키짱  
20170105,10,토르 영화에 닥터 스트레인지가 나온다고요?!?  
20170102,10,EKRXJTMXMFPDLSWLEH SKDHSEK.  
20170101,10,소울스톤 토르3에서 다루나연~ 어벤져스3 ㄱㄱ하기위해선 토르3를 거쳐야 된다역시 마블은 우리를 실망시키지 않아!  
20161215,10,너무 기대되지만 한편으론 감독이 그린랜턴 연출했던 사람이라...걱정반 기대반  
20161214,10,여기서 인피니티워에 대한 떡밥이 많이 풀릴거같은데.... 소울 잼의 행방과 타노스등장배경이 나올거같은느낌  
20161126,10,펜드럴은 안나오나..? 으어어어 1년 어떻게기다려  
20161126,10,조연에 존시나 넣으시죸ㅋㅋ  
20161118,10,햄식이 인간적으로 내한 한번만..;ㅁ;  
20161115,10,토르라면 어디서든 10  
20161031,10,토르는 극장가서 보는거 별로 안좋아하지만 닥터스트레인지가 나올거 같으니 꼭 본다  
20161029,10,닥터 스트레인지도 나오는거냐?? 캐스팅엔 안보이던데..  
20161029,10,감독이 아니다 이 악마야! 잖아? 진짜 베네딕트만 기대한다...  
20161029,10,전역후에 나오려나 ㅋㅋ  
20161029,10,닥터 스트레인지 쿠키에 토르 나오던데... 토르에 탁스 출연하나요?  
20161026,10,닥터스트레인지 합류 추가여ㅋㅋㅋ  
20161026,10,닥터스트레인지보고왔어요  
20161015,10,왜 나는 헐크에 더 기대돼지...? 월드워 헐크처럼 칼이랑 팔에 보호구 장착하고 나오면 좋겠다..  
20161005,10,마블은 사랑입니다 10자 10자 10자  
20160915,10,토르야 죽을 위기엔 쳐해도 죽지는마라....  
20160913,10,"정말 기대됩니다. 토르 참 멋있죠,  "
20160911,10,여기서 죽을 듯 신화에서는 뱀과 싸우다 죽음  
20160901,10,플래닛헐크가 나올지 기대된당  
20160824,9,기대된다...근데 왜 나탈리포트만이 출연명단에 없지????ㅠㅠ박사님이랑 인턴도나와야 재미진데..ㅠㅠ  
20160816,10,꺜 케이트 나와 개좋아ㅠㅠㅠㅠ  
20160815,10,이걸넘으면 어벤져스3가 온다..  
20160815,10,이것도  꼭본다 안보면 후화된다  
20160806,10,어서 개봉했으면 좋겠다. 토르랑 헐크 케미 기대중  
20160715,10,쩌리들은 지구에서 놀고 헐크랑 토르는 우주에서 논다  
20160712,3,마블영화 중 토르는 전혀 기대가 안된다...  
20160710,10,실수로 글쎄요 눌렀다ㅠㅠ왜 취소가 안되는거야ㅜㅜㅜㅜ대신 극장으로 두번 보러갈게요 완전 기대돼요!!!  
20160704,10,헐대박 헐크 출연이라니!!  
20160702,1,토르야  뭐... 항상 그렇지...  
20160628,10,와 빨리 보고 싶다 ㅎㄷㄷ  
20160623,10,와우 마블 진짜 사랑해영넘나 좋아서 울고시퍼엉  
20160610,10,꺜!!!!케이트블란쳇나온다!!!!  
20160602,10,너무기대되요ㅠㅠ 1년이나기다려야되다니... 마블영화너무재밌어서요즘에도 계속 보고있어요ㅋㅋㅋ  
20160526,10,헐크가 나오는이유 로키가 조정해서 토르랑 뜨게하려고  
20160525,10,오....멀었네 로키볼려고 토르 보는데ㅠㅠ  
20160524,10,나탈리 포드만 결국 하차했군요ㅠㅠ.. 개인적으로 재인과 토르의 사랑이야기에 빠져있었는데 말이죠.. 대체 어떻게 다른 여자랑 이어주실지가 의문이네요  
20160524,8,"[토르:라그나로크]야말로 지구와 우주, 어벤져스와 타노스를 연결시키는 영화라는 점에서 [인피니티 워]로 향하는 페이즈3의 전반적인 흥행을 점치게 할 중요한 작품이 아닐까 생각된다. 감독의 선택이 다소 의아스럽지만 아무튼 기대된다.  "
20160520,10,마블 짱! 복제토르라니 완전 재미있겠다!!!  
20160517,10,난 토르와 로키도 궁금하지만 헐크의 행방과 토르의 아버지 오딘의 행방이 더 궁금하다  
20160512,10,나탈리 안 나와서 별점 좋지 않게 평가하시는 분들 계시는데 그럴 필요 없는데 나탈리가 안 나온다고 그런 거라서 어쩔 수 없음 나탈리가 토르 3를 거절한 건 자기 손해라고 생각함 물론 영화가 대박이 난다면!  
20160508,10,톰 히들스턴 왕팬입니다 엄청 기다려지네요~사랑해용 호호  
20160506,10,히들ㅠㅠ꼭 토르 봐야지  
20160505,10,헐크도 나와랑ㅎ앙 기모띠  
20160504,10,캡틴아메리카 시리즈는 시빌워를 마지막으로 정말 내 기대를 충족시켜주며 유종의 미를 거두었는데토르의 마지막 시리즈(?)인 라그나로크는 또 어떻게 결말이 날지 기대되네요 더더군다나 이번엔 토르와 헐크 투톱!! 시빌워의 현실성보다 그야말로 화려할듯한데!  
20160503,8,토르 1은 걍 망치장이였지만 다크월드는 히어로. 쨋든 2017년을 기달려본다~! 　 근데 감독이 그린랜턴 만든 놈이야. (불안)  
20160501,10,헐크와 토르 너무 기대된다  
20160501,10,"마블은 정말로 세계관구축을 정말로 훌륭하게 해나가고 있다.각 캐릭터의 고유 영화마다 기존의 어벤져스 캐릭터와 크로스 오버를 하는 형식으로 구축해나가고 있는데, 이는 앤트맨에서 먼저 활용된 성공적 사례가 있기에 차용된 것 같다. 헐크가 기대된다.  "
20160430,10,마블은 이제 타노스 결전하면 때돈 번다  
20160429,10,언능 보고 싶다!!!! 토르 ㅠㅠㅠ 근데 나탈리 포트만 어디쪙??... 제인 포스터 어디 있냐구..ㅠㅠㅠㅠ  
20160428,10,라그나로크의 시대 기다려진다  
20160428,10,어벤져스2 에이지오브울트론에서 스칼렛위치가 토르의 기억조작을했을때 미래같은게보였는데 아스가르드의 파괴였습니다 과연 떡밥일까요? 기대됩니다 중요한캐릭터가죽는다고들었는데ㅎㅎ  
20160420,10,제인이 안나오는 토르라니.. 먼가 새롭기도 하고 웃기기도 하고.. 제인은 나중에 토르가 될텐데.. 그런케릭을 아애 빼버리다니.. ?  
20160420,10,나탈리포트만 안소니홉킨스도 다 나왔으면 좋겠다 해임달도 이어서 나오는 건가 안젤라도 나오는건가 예매율 압박인데 이거  
20160416,10,이때쯤이면 여자친구와 손잡고 볼수있었으면...  
20160413,10,나탈리도 나왔으면 좋겠다  
