0,1,2
20170821,10,책을 재미있게 봐서 엄청 기대중~~ㅎㅎ 근데 설현이 안티가 많은듯~~ㅠㅠ 사실 예고편만 보구 설현 때문에...평점 낮게 주는건 아닌듯~~~  
20170821,5,예고부터 설현 발연기...  
20170821,10,설현보러간다 잘하자ㅋㅋ  
20170821,10,설경구 표정보니 역대급 영화나오겠네 제대로 몰입했다  
20170821,2,응 메멘토 짝퉁판 소재가 진부하다 feat 파이트 클럽  
20170821,5,보고싶은 영화인데 설현의 발음이 몰입도를 떨어트릴까 걱정이된다...  
20170820,10,설경구 주연 대체 무슨 말이 더 필요한가  
20170820,10,너무 재밌게본 책인데 다된밥에 아이돌뿌리기  
20170820,10,살인자의 기억법 책으로 수 없이 많이 읽으면서 내가 상상하던 병수의 이미지가 설경구에 딱 들어 맞는 듯. 설현이 좀 걸리긴 하는데 병수랑 태주에 비해 별역할 없으니까 뭐  
20170820,1,설현에서 거른다 원작이나 망치지 마시길  
20170820,6,설경구의 연기 기대되는데... 갑자기 설현에서 깬다;;;  분명한건 설현은 이 작품에 안맞는다는것. 광고 이미지가 강해서인지? 부실한 연기력 때문인지? 등장 자체로 분위기 깨버린다.  
20170819,10,일단 설경구 김남길 오달수면 말 다했지... 이번 영화 찍기위해 설경구 배우님은 14키론가 빼시고 김남길 배우님은 찌우셨다고.. 진짜 기대하겠습니다  
20170819,10,설경구 영화는 믿고볼수 있다!  
20170819,3,"왠지 메멘토 같은 예전 헐리우드 영화의 전개를 따라 모든게 살인자의  환상이고 딸도 환상일거 같아 불안하지만, 그런 뻔한 플롯에서 벗어난  영화라 믿고 극장으로 향합니다. 재밌는 영화가 됐으면 좋겠습니다 :)  "
20170819,1,원작은 매우 좋아하는 편이지만 감독과 설경구가 그닥..  
20170819,1,다된밥에 설현....  
20170819,1,설경구 + 설현 = 설마 폭망?  
20170819,9,찝찝한것도 아닌것이 반전도 아닌것이 뭔가 요상하다영화는 (아직)안봤지만 마지막 10분에 혼란을 줄듯 싶다마지막 10분 이전의 내용은  무엇인건지....투명인간 최장수가 기억나는건 왜일까..설경구 연기가 기대된다  
20170819,5,개 기대하고 출연자 보는데 여주 내가 잘못본건가  
20170818,10,설경구는 항상 믿고 봅니다!!!  
20170818,10,와~ 마지막에 눈 떨림장면  소름~~ 연기 갑~~짱  김남길 명불허전에서 고믹연기 재밌있었는데 스크린에도 보니 좋네요~  
20170818,1,"믿고 거르는 배우 1순위가 설경구 아니냐? 해운대, 타워 , 루시드 드림, 불한당ㅋㅋㅋ 돈 주고 보라해도 안봄 ㅅㄱ  "
20170818,10,메멘토 떠오른다. 설현보니까 그냥 아이돌설현이미지가 강해 예고편만 봐도 몰입에 방해되는거같다. 설경구는 설경구같이 안보이게 신선하네  
20170818,5,아이돌끼면 영화망하는거 공식아닌가?  
20170817,10,오호. .  설경구는  연기는  참  좋은데. .  
20170817,1,이거 '메멘토' 따라한 영화네.. 베끼는거 적당히 하자. 좀  
20170817,1,아이돌ㅋㅋㅋ 또냐? 연극생활하면서 연기를 좀 배우고 찍던가.. 껴팔기좀 그만해라 거지같은 한국영화들아  
20170817,1,도대체 왜 아이돌들은 이런 영화에 나오는대? 진짜 이해불가  
20170817,10,꾸...응원해요...  
20170817,10,꾸사랑해 ♥ 진자 재밌겠다  
20170817,1,캐스팅 미쓰네...좀더 나이가 들은배우가 했어야...예를들면 최민식이나 한석규등등..설경구 연기도 식상...모습만 바꼈을뿐...  
20170817,1,음..이거 별로 같음....  
20170817,10,와 이것도 영화화되구나  
20170816,1,메멘토 표절인 건가..  
20170816,1,내 지뢰 3인방이 있지 설경구 이병헌  이경영 왜인지는 말 다했찌 ㅎ 이게 그래도 인기가 많은건 설경구를 제외한 다른 배우들 덕분이다  
20170816,10,설경구 배우님 신들린 연기 너무 기대됩니다. 다른 배우님들도 너무너무 기대 돼요! 항상 응원합니다 살기법!  
20170816,10,설경구씨 항상응원합니다.일어나세요!!!  
20170815,10,기대하고 있습니다 !!  
20170815,1,다된영화에 긴또깡뿌리기 진짜 쟤는 안나오는데가없냐  
20170815,1,배우 누구 한명때문에 노잼 예상  
20170814,10,김남길씨 헤어스타일이 공공의적인가 그때 영화가 생각나네요 그때도 설경구씨랑 나왔죠 잼있게 봤었는데 기대되네요  
20170814,1,아무리 원작이 유명한 소설이라지만 떡하니 알츠하이머살인자라고 밝히고 시작하다니...각색이 어떻게 이뤄졌는지 모르겠지만 과연 좋은 수였을까 궁금하네요  
20170814,1,연기 잘하는 신인배우들이 얼마나 많은데 왜자꾸 아이돌을 쓸까 김설현이 예고 연영과도 나오고 드라마도 찍고연기도 하고싶다하는데 여태까지 연기공부하고있는 지망생이나 신인배우들이 너무 안타깝다 그자리를 아이돌들이 채우고있으니  
20170814,10,기대된다 믿고보는 설경구!  
20170814,10,책이 정말 잼있어여~~*  
20170814,10,김영하 원작에 설경구 김남길이라니 완전 기대됩니다! 영화 완전 잘만들어졌다고 하던데 무조건 보러갑니다!  
20170814,1,연기잘하는  신인연기자를쓰지ㅡ 설현?ㅋ 아 극혐..아이돌좀그만써라ㅡ  
20170813,9,기대합니다!!얼른개봉했으면좋겠어요  
20170813,1,야 어떻게 오달수가 조연이고 설현이 주연이냐..  
20170813,10,오랜만에 이상하고 탁월한 영화 나왔네. 기억법 화이팅입니다~~!!!  
20170813,10,설경구 김남길에 소제까지 너무 좋다  
20170813,10,"설경구를 믿고보는 영화, 특히 김남길 나오면 몰입되겠네  "
20170813,1,배우가 그렇게 없나 설경구라니  
20170813,10,불륜 사실로 뜬 것도 아니고 아니라고 몇 번을 해명을 했는데 귀 막고 빽빽거리면서 싫다고 하는 거 정말 이해 안 가네요 불한당에서 이태까지랑 다른 모습 보여줘서 인기 엄청 끄셨는데 보지도 않으시고 똑같다고 욕부터 한심하네요 평생 방 구석에 계세요  
20170813,9,다 좋은데 오달수??그분만 좀 안썼으면. 얼굴도 그런데 연기도 늘 비슷비슷하고.. 이분 영화는 보기가 힘든데 유명한 영화에 너무 많이 나옴. 외모만 보면 연기파 배우인데 외모덕(?)을 아주 많이 보는듯.  
20170812,10,설경구는 진짜 나의 독재자보면 기가막힘.. 사실 거의 송강호급인디... 불한당은 감독땜에 못봤는데 이번껀 징짜 개봉하자마자 볼겁니다!  
20170812,6,메멘토 같은 영화내...  
20170812,1,믿고 걸러 내는 설배우 영화 안봐도 졸작  
20170812,1,설경구씨 다작으로 승부수 띄우는 듯 해운대 이후 흥행이 좀 그렇지요.감시자들은 솔직히 한효주 정우성 쓰리톱이고  
20170812,1,"설경구, 설현을 캐스팅 한게 최대 단점 책으로 재미있게 읽었지만 영화는 저 두사람때문에 안봄  "
20170812,1,배우는연기하는 사람이고 가수는 노래부르는 사람이다 본업에 충실하자...  
20170812,10,김남길이야 아직 인생작을 못만나서 그렇지 정말 연기파고 설경구 이미지는 망인데 불한당 보고 역시 연기는 잘하는구나 생각했다. 원신연감독이야 쫄깃한 영화 특화된 분이고 절대적으로 지지한다. 김영하 원작소설 진짜 심장 들었다놨다 최고고. 키는 설.현!  
20170812,10,시나리오 배우 다 좋다..  
20170811,1,설현이 언제부터 연기자였지...  
20170811,10,김남길 나오니깐 무조건 본다!믿고보는 배우 김남길 연기하는거 보는거 너무좋음남길이횽 화이팅! 아 근데 설현 연기 잘하려나  
20170811,1,설현의피해로인해 내돈 나가는게 아까워 안볼랜다  
20170811,10,설경구 배우님 너무너무 보고 싶어요! 얼른 개봉해주세요ㅠㅅㅠ  
20170811,5,감독 각본 스토리 남자배우 다좋은데   설현이라니...  
20170811,10,경구형 갑자기 팍 늙으셨대 ㅠㅠ꼭 보러 갈겁니다!!!  
20170811,10,오랜만에 볼만한 스릴러 나온듯  
20170811,10,무조건 봅니다!! 너무 기대됩니다!!  
20170810,5,아놔.. 설현땜 반만 평가 ㅡㅡ.ㅉㅉ 연기가 안되는 앨 왜ㅡㅡ  
20170810,10,원작보면서 오래오래 기다린 영화ㅠㅠ빨리 스크린으로 보고싶다  
20170810,10,두근두근 기대되요!! 꼭볼게요  
20170810,1,0점은 없는건가요...ㅜㅜ  
20170810,10,설현의 첫 주연작이니 꼭 봐야겠다 살기법 대박나자  
20170810,10,설현보러 가려구요..  
20170810,9,다 된 밥에 설현 뿌리기?...  
20170810,3,설현 연기는 하지 마ㅠㅠ  
20170809,1,인간아니  배우가 주연한 영화는 무조건 패스~  
20170809,10,믿고 고르는 설경구 설현 설리설트리오!내년 설에 tv에서 만나요  
20170809,10,기대 됩니다! 꼭 볼꼐요. ㅎㅎ  
20170809,5,예고편에서 돈크라이 마미'와  도리화가'가 보이는데...  
20170809,5,예고편 금방 처음 봤는데 흥미진진하며 몰입되다가 설현 나오는 순간 몰입 바로 떨어짐.. 목소리 톤이며 .. 연기며 .. 도대체 왜 캐스팅 했는지 이해가 안되네 ..  
20170809,1,다 된밥에 설현뿌리기;;; 최악일세  
20170809,1,설현에서 걸렀다...  
20170809,10,설경구님 나오니까 꼭 꼭 봐야지!!!  
20170808,1,다 된 밥에 설경구 뿌리기.  
20170808,10,설경구 배우님이시다! 꼭 봐야지~ 살기법 화이팅!  
20170808,1,주연이 설 경 구 라... 관객수 15만 확정.  
20170808,1,믿고 거르는 설경구. 더 볼거 있냐? ㅋㅋ  
20170808,10,설경구를 앞두고 김남길이 왠말들이냐 빠순이들아ㅋㅋ설경구의 똘끼 넘치는 신들린 연기 완전 기대된다.  
20170808,10,와..설경구씨 또 살을뺀거에요?? 얼굴만봐도살벌하네여..대단한배우임에 틀림없는듯  
20170808,1,우리나라 연기력 개거품 투탑 조재현.설경구 처음엔신선했지만진짜 연기발전이없구 못하는데 왜이리 과대평가 되는지모르겠음  
20170808,9,원작의 반만이라도 닮으면 손익분기점은 넘을 거다  
20170808,10,확실히 설현이 이미지 폭망했나보다 ㅋㅋㅋ 설현 리뷰만 달리면 비공감이 엄청 박히네 ㅋㅋㅋ 짠하다 증말  
20170808,9,"설현 내 딸 서영이에서 연기 진짜 좋았는데, 개인적으로 연기를 못한다기보단 원래 특유의 발음?목소리톤 자체때문에 못해보이는 느낌이 있는것 뿐이지 감정연기자체는 잘하는것같은데ㅠㅠ 이번에 그런거 잘 다듬어서 영화에서 더 잘했길 응원해요~  "
20170808,1,절대로 안봐 재미없을 것 같아 그냥 망해라  
20170808,1,예~설경구 패스요~ㅎㅎ  
20170808,10,영화로 나오네요 책으로 먼저 본 작품인데 기대됩니다!  
20170808,1,설현이 나온다니  그럼 망작예정 아니냐!  
20170808,5,근데 왜 또 설경구냐..  
20170808,8,"대박 벌써부터 기대다! 김영하작가의 소설진짜 몰입도 있게 봤었고, 구타유발자들 정말 몰입있게 봣던 1인으로써 너무 기대되는 조합이네요><  "
20170808,1,설경구와 설현.. 설씨들이 영화 망쳤다 ㅋㅋ  
20170808,1,믿고 거르는 설경구!!!  
20170808,2,"설경구 극혐~~~!.,.,.,  "
20170808,1,감독의 필모그라피만 봐도...ㅋㅋ에휴... 설현은 또 뭔데  
20170808,3,설경구떄매 안볼래 연기 존나 못해 ㅋㅋ  
20170808,1,설현때문에 망칠 것 같다...  
20170808,10,일단 소설 원작이 명작이니 기대 되네요  
20170808,10,와 내가 가장 오락적으로 재밌게 읽은 소설인데...정말 기대됩니다. 부디 잘 만들었으면 하네요!  
20170808,1,범죄영화 아니면 만들거 없냐?  
20170808,3,살인지의 영화로 떱똑하라.  
20170808,2,또 아이돌이야?....  
20170808,7,스토리까지 괜찮고 배우들도 잘 캐스팅했는디 뜬금 설현 뭐임? 제발 흥행을 위해 아이돌좀 쓰지말자 아이돌을 쓴다해도 연기잘하는아이돌을 써야지 이영화는 설현 안써도 잘될거같은데ㅠㅠ 설현때메 별1.5깍음ㅠㅠ  
20170808,3,다 된밥에 설현인가...  
20170808,9,"김영하 작가의 원작이 버젓히 있는데, 메멘토 뱃겼다고 하는 인간들은 뭐임??  "
20170808,1,아깝다 김날길 비호감 투톱이랑 영화찍네 제발 그런것좀 생각하면서 영화찍자  
20170808,10,설경구님의 연기 정말 기대됩니다.설현님도 멋진 연기 보여주세요 화이팅!!  
20170808,5,메멘토의 연장선인듯... 아직 안봤는데 보고싶긴함 둘중하나는 범인이겠지ㅋㅋㅋ  
20170808,10,설경구씨가 나온다니 당연히본다 !!!최고의 배우 설경구 화이팅  
20170808,1,믿고 거르는 설경구 아직도 설경구가 나오는 영화가 있네 ㅋ  
20170808,10,떠려니 연기 기대해봄 !  
20170808,4,설경구는 영화좀 그만찍었음 좋겠다. 얼마전 스파이 티비에서 봤는데 경악했다. 재미없는 영화만골라서 찍는건가  
20170808,3,솔직히 스토리부터가 이해안감..감독의 역량에 맡겨야할듯  
20170808,10,믿고보는 설현... 눈정화하러 극장갑니다!!  
20170808,8,달수형  뒤로좀가요~~~  티비로나오겠어요~~  ㅎㅎㅎㅎ  
20170808,8,"다된밥에 설현뿌리기,,,  "
20170808,10,설현아 꼭 보러갈게~ 설경구 김남길 케미가 기대되네여ㅎ  
20170808,10,"원작도 좋았고, 설현 나온다고 무작정 까는 쿵쾅이들 때문에 10점 준다. 설현 왜 이렇게 까냐  "
20170808,3,아... 하필 설현...  
20170808,10,스토리를 기대해 봅니다  
20170808,1,믿고 거르는 설경구...  
20170808,10,아직 고 2 지만 살면서 읽었던 책중에 가장 인상깊고 좋아했던 책이 이렇게 영화로 나온다는 사실이 너무나도 기적같고 행복합니다~!! 기대하겠습니다  
20170808,10,와 설경구 살뺀거봐 ㅎㄷㄷ 진짜 연기력으로는 못까겠다..  
20170808,1,위안부의 증언 만큼이나 믿을수 없겠지  
20170808,10,하 진짜 설경구 배우님 얼른 스크린에서 뵙고싶어요 ㅠㅠ 다른 배우님들두 넘 기대됩니다ㅜㅜ  
20170808,10,설현이 보러가야지 ㅋㅋㅋㅋ  
20170808,10,설경구 김남길 !  너무 보고싶어요!  
20170808,4,설현때매 폭망각...!!!!..  
20170808,4,이도 저도 아닌 영화가 될 것 같다 피자에 초고추장 뿌려 먹는 기분  
20170808,1,믿고 거르는 설경구 믿고 거르는 설경구  
20170808,10,재밌겠다.ㅎㅎㅎ..  
20170808,9,설현때문에 망할듯..아니 난진짜왜 아이돌을 주연으로 하는지 모르겠음;;  
20170808,7,평점이 영화 개봉하면 원작보다 못하다느니 그러겠지 ㅋㅋ 안봐도 뻔하다 뻔해  
20170808,1,남자 설씨 땜에 망한 영화네. 누가 본다고 그낯짝 들고 매번 나오냐고?  
20170808,1,어휴 그예고편 잠깐동안인데도 설현연기 토나오네 대체 저런 연기파배우속에 저런 발연기를 넣지... 쟤때매 집중다깨질듯  
20170808,10,뭔 설현이냐... 요즘 아이돌 가수들은 노래 할 생각은 없고 죄다 배우하려고 애쓰네  
20170808,10,와 이거 얼마전에 읽으면서 영화로 나오면 재밌겠네 했는데 진짜 나오네 ㅋㅋ 소름  
20170808,2,다 된 영화에 설현 뿌리기  
20170808,10,남길오빠ㅠㅠ 선덕여왕때부터 모든 작품 다봤어요! 너무 멋있고 존잘 배우ㅎ 이번 영화도 기대할게요~~!!어느날 시사회 때 셤 기간이라 못갔는데 이번엔 꼭 갈거예유ㅠㅠ  
20170808,10,대박 김영하소설 읽기 시작한 이유기 이거임ㅋㅋㅋ영화 잘 뽑아 내주세요ㅠㅠ 영화보고 실망한 작품이 꽤나 많음요ㅠ  
20170808,1,"진짜 재미없겠다 작품만 찍어내는 설경구가 선택한거 보면 ㅠ늙은이들이나 보러가겠네그리고 예고편에 뉴스장면, 아나운서 목소리좀 빼라 몇년째 똑같네 ;; 드럽게 식상함 ㅠ  "
20170808,5,그냥.. 왜 .. 요즘.. 아이돌이..한명씩꼭 낑기는거죠...설현홧팅!ㅋ  
20170808,10,소재는 괜찮은데...딴죽이 끓이지 않을것 같은데요...아 영화는 안봤으니깐 무시하셔도 되요...주인공이 연쇄살인범인데 왜 연쇄살인범을 잡는 걸까요? 이부분이 이해가 안되요...  
20170808,9,이 책을 읽은 사람으로서 정말 기대돼요! 음.. 설현씨의 전작들을 봤을 때 조금 우려가 되긴하지만.. 원작을 정말 재밌게 읽어서.. 음.. 잘 되었으면.. 잘 살렸으면 좋겠네요!  
20170808,10,얼굴부터 연기파로 먹고 들어가는 갓경구표 스릴러 믿고볼게요  
20170808,10,영화 무서워요 어린이들과 노약자분들은 조심하세요  
20170808,8,예고편 마지막 장면 설경구의 모습 시저인줄 착각  
20170808,1,스토리 쭉 읽고 배우제작진 살피다가 설현보고 믿고 거릅니다 ㅅㄱ  
20170808,1,알바 기용해서 밑밥 까는게 너무 오글거릴 정도로 보이네  초등학생도 문구 몇개만 봐도 알겠구만 영화가 흥하는것도 좋치만 지금 이시대에 좀 치졸해보이는건 어쩔수없네요 좋은 작품은 관객이 먼저 알아보는법 너무 서둘지 마시길 왠지 개봉도전에 빈약해보이니ㅉㅉ  
20170808,1,살인자의 처자식 버리고 바람  
20170808,7,이 소설은 난해한 맛과 열린결말로 보는건데 영화가 얼마나 살렸을려나  
20170808,10,FNC의 마케팅에 별점  
20170808,2,제발 아이돌좀 그만;;;왜맨날하나씩 낑기지..  
20170808,10,김영하님 소설. 원작이라 더 기대 되네요.  
20170808,1,설경구도 너무나 정형화된 뻔한 연기.... 질린다 질려 우리나라 연기파들이 다 이모양이긴 하지만  
20170808,1,이제는 믿고 거르는 설경구  
20170808,1,설경구가 나오기만 하면 개폭막각~  
20170808,1,설경구 때문에 패스...  
20170808,10,195번 손님~화이팅!!  
20170808,1,ㅇㅁ모오소사마뫼람너  
20170808,10,오달수 나오는거보니 성공하겠네  
20170808,10,설현 설리 같은 설씨인데 이리도 다르니...  
20170808,1,설경구때문에 보기싫네. 매번 똑같은 소리만지르는 연기  
20170808,10,와 진짜 디자인스페이스님 말 공감.  
20170808,10,설경규 얼굴에서 혹성탈출 시저가 보인다.  
20170808,10,기대되네요 ㅎㅎ 근데 15세 관람가라고 써있는데 19금 아니겠지 하는 분들은 뭔가요 ㅋㅋ  
20170808,10,김남길 최고 설씨는 글쎄요  
20170808,10,"개봉이 가다려 집니다,,,,  "
20170808,10,초기대작 김영하작가의 소설원작이라 기대됩니다.  
20170808,10,영화가 김영하 작가님 빨 받았네요ㅋㅋㅋ 이제야 개봉이라니원작 소설 너무 잘 읽었어요!! 근데 배우들 진짜 ㄱㄴㄱ 빼고 미스 캐스팅... 아쉬워요  
20170808,10,둘다 공공의적에서 나왓네 ㅋㅋㅋㅋ  
20170808,8,10점 주려다 설현이 주연이라 8점  
20170808,7,설현이 나오는 영화니까 꼭 봐야되이건 꼭봐야되 ㅋ 흥행한다 ㅋ  
20170808,1,응 경구야 너가 범인이었어 ㅋㅋ  뻔해~  
20170808,4,걍 이런 소설은 소설로서 냅두는게 더 가치가 있다 ㅠㅠ 미쓰 캐스팅하지 말고  
20170808,10,설배우 연기 기대된다ㅎㅎㅎ  
20170808,3,중2병 싸이코패스물 냄새오지게 나쥬? 그츄?  
20170808,10,다된밥에 설현뿌리기 영화가 되지않길 바란다  
20170808,1,예고편에서 몰입하고 보다가.. 설현목소리나오니.. 순간적으로 몰입이 안됨..ㅋㅋㅋ 진짜임 ㅋㅋ  
20170808,2,연쇄살인마가 연쇄살인마를 잡는다는 내용이 말이 되는가?  
20170808,10,포스터보고 혹성탈출인줄  
20170808,1,간통범의 기억법...  
20170808,7,설경구싫지만 포스터만봤을때 보고싶긴하네 이영화.. 알츠하이머걸린연쇄살인범이라는 캐릭터가 참신하기도하고 ㅋ  
20170808,10,예고편만 봐도 기대됨 10점  
20170808,10,원작의 그 뒤틀린 반전을 구현할 수만 있다면 식스센스급이 될거다  
20170808,1,설현 뭐냐? 아이돌? ???  
20170808,10,설배우님 나오시네요 완전 기대돼요 10키로 씩이나 감량하시고 완전 기대되는 영화~^^  
20170808,10,코리안 놈보원 히얏 히이얏  
20170808,1,설경구 하.. 그냥  보고  싶지  않다..  
20170808,1,그놈의 살인. 살인말고는 영화 못만들지?  
20170808,10,되게 재밌겠따 근데 설현이 깬닼ㅋ  
20170808,10,김남길? 말이 필요 없는 믿고 보는 배우  
20170808,1,설현이라니...갑자기...하아...보기싫다...다해놓은 요리에 침을....  
20170808,10,예고편...긴장감이...정말대단합니다...!^^♧  
20170808,10,차량 전북 장면...지렸다  
20170808,10,와... 예고편에 언뜻 나오는 김남길 미모보고 감탄..역대급 대존잘ㅠㅜㅜ  
20170808,1,"사실 설경구, 김남길 같은 연기자 급이 주연일때는 그 연기를 받혀주고 빛나게해야하는 또 다른 주연이 필수다. 왜 명작이 될 수 있는 작품에...영화를 관람하는 사람들은 그 작품과 배경 그리고 연기력이 중요하지 생뚱맞은 연기는 손발오그라드는 역겨움이다.  "
20170808,1,설현과 설경구라 별로네  
20170808,7,영화를 소설의 느낌  그대로 살려낼 감독이 대한민국에 있을까? 또 연기자가 있을까?  
20170808,10,"김남길, 설현 연기 기대된다! 살기법 흥해라!!  "
20170808,4,주연배우 좋은데!!! 설현 맘에 걸려..ㅠ 잘할수 있을까... 스프라이트 샤워..ㅠ  
20170808,10,설경구 배우님이 나오니 무조건 보러 가야죠  
20170808,10,원작으로 읽었을 때 앉은 자리에서 처음부터 끝까지 단번에 읽히던 소설이었어요 그만큼 몰입도도 긴장감도 느껴지는 작품이라 더 기대됩니다^^  
20170808,1,다 된 캐스팅에 설현 악성 조미료  
20170808,6,진짜 좋아하는 책이어서 꼭 보고싶었는데.. 설현이라니.. 개봉하고 본 후에 판단 할 일이지만 걱정된다.  
20170808,10,믿고 보는 설경구 원신연  
20170808,10,드뎌 군산서 찍은 살인자의 기억법 개봉하는구나~ 오래 기다렸다 한발짝 앞에서 설경구와 설현 지나가는모습을 봤던게 1년 넘었네ㅋ 꼭 봐야지ㅋ  
20170808,3,설현때문에 이영화말고 다른거봐야겠닼ㅋㅋㅋ그 비싼 영화값내면서 설현의 발연기를 보고싶지않아..  
20170808,10,진짜 김영하 작가님 살인자의 기억법 재미있게 읽었는데 완전 기대되요 !!!  
20170808,5,아...놔...설현~~??  
20170808,1,강남 머시기도 김래원 때문에 봤지만 설현 때문에.. 이 영화도 설현 때문에 거른다  
20170808,1,비슷한 영화 있었는데. 알츠하이머 걸린 킬러.  그리고 설경구 연기는 모두 강철중.  
20170808,10,와 이거 진짜 기대댄다!!  
20170808,1,또 설경구네ㅡㅡ;;...  
20170808,1,설현?? 미친거 아니냐? ㅋㅋㅋ 딱 봐도 망삘 ㅋㅋㅋ  
20170808,3,"설경구 나오면 안보는데,,  "
20170808,7,아 설현 말고 다른 배우 쓰지....  
20170808,5,기대는되는데 포스터에 설경구얼굴만 봐도 톤이랑 연기가 그려진다. 그렇게 배우가 없나...  
20170808,5,경구 연기가 좀바뀌길...매번 비겁한 변명입니다!!! 아니면 강철중이니...  
20170808,3,믿고 거르는 설경구 노잼 ㅇㅇ 언제적 퇴물 배우인가? 최민식이 짱임  
20170808,10,김영하 원작 소설 너무 재밌게 봤는데  기대됩니다!  
20170808,5,설경구와 김남길은 좋지만 마지막에 과연 다된밥에 설현뿌리기가 될것인지 궁금하니까 반반  
20170808,10,엑설런트♥★♥★♥★♥★♥★  
20170808,10,설경구 배우 연기 기대됩니다  
20170808,8,스틸컷의 느낌은 정말 좋내요 원작을 많이 벗어나면 좋겠네요  
20170807,10,예고편에서 설경구 연기...벌써부터 기대됨  
20170807,10,"김영하 작가님의 소설을 영화화 했고, 설경구, 설현, 김남길 배우님들이 나오는 영화 너무 기대돼요 ! 꼭 보러 가겠습니다 ~  "
20170807,10,김남길영화는 무조건 10점!박하사탕의  주인공 연기도  기대만땅  
20170807,10,설경구님의 연기가 정말 소름돋고 좋네요. 역시 믿고 보는 설경구 배우님!  
20170807,10,개봉날만을 기다리고 있어요 ! 설경구 배우님의 70대 노인 연기 넘 기대돼요 !  
20170806,10,김설현 파이팅!!! 좋은 평 많이 듣자~~~  
20170805,10,원작 느낌 잘 살리기만 하면 크리스토퍼 놀란급 영화 나올텐데 뭔가 막판 신파극이 될거 같은...  
20170804,10,믿고 보는 배우 설경구씨ㅠㅠ!!  
20170804,10,설경구 배우님의 또 한번의 연기변신 정말 기대됩니다. 이번에 작품 속 캐릭터를 위해 체중 감량도 많이 하셨다는데 정말 연기 열정이 대단하신 것 같아요~ 원작도 감명깊게 읽었는데 영화도 많이 기대하겠습니다~!!  
20170804,10,이건 포스터부터 대박이다... 설경구 연기 또 개잘할듯 다들 기대되는 배우들 밖에 없어서 너무 기대되고 얼른 보고싶다  
