0,1,2
20170906,10,설경구 배우님의 연기가 최고입니다!  
20170905,1,아 설현 대사치는거 진짜 못봐주겄다...야한옷입고 춤이나 출것이지  
20170905,9,설경구 연기 대박.... 알츠하이머 환자 연기는 미쳤다 ㄷㄷ 영화보기전에 설현 연기에 대한 악평 은 영화개봉하면 사라질것... 작중몰입도 깨지않고 작중배역에 몰입해 무난하게 잘했음  
20170905,9,김영하 베스트셀러 소설 원작으로알츠하이머에 걸린 연쇄살인범으로 설경구와김남길의 연기는멋졌습니다. 특히 설경구의 눈빛과 눈의 떨림. 연기자들의 연기력에 반했습니다.  
20170905,10,"시사회에 다녀 왔습니다. 정말 수작 입니다. 원작에 대한 정보하나 없이 봤는데 연기며 스토리며 뭐하나 아쉬울게 없는 최고의 영화였습니다. 개인적으로 메멘토를 너무 재밌게 봤는데, 메멘토를 재밌게 보신분들은 절대 후회하지 않을듯 합니다.  "
20170905,10,울설현이 나오면 무조건 만점 이야. 몸매도 만점. 연기도 만점. 노래도 (?) 만점. 갓설현 천만가자.  
20170905,10,설경구님의 명연기 시원하게 꼭 볼래요~~^^설경구님 늘 연기에 대한 열정과 노력!!고맙습니다~~^^♡  
20170905,10,세계적인 여배우 설현의 연기를 스크린에서 보다니너므 감동적입니다  
20170905,10,"김남길, 설경구 두배우의 조합부터 넘 기대되는 영화!!믿고보는 두배우!! 설현, 오달수 두배우의 연기도 기대됩니다.살인자의 기억법 연기력에 믿고봅니다.  "
20170905,10,"원작이 너무 좋아서 걱정이 많았는데, 소설을 원작으로 각색한 영화의 교과서를 본 것 같다. 스릴과 액션에 의외로 눈물까지 났다. 가을에 어울리는 명품 스릴러.  "
20170905,10,설경구 김남길의 소름돋는연기. 보는내내 와~ 별기대 없이봤는데 주변 사람들한테 다 추천했어요!!  
20170905,10,너무너무 기대됩니다. 낼 당장가야징~~남기르님 화이팅  
20170905,10,설경구는 완벽하게 병수였다! 의외의 유머코드와 점점 고조되는 긴장감..여운이 남는 결말.. 몰입해서 봤다. 김남길은  분량에 비해 영화 전반적인 공포감을 효율적으로 조성하고(섬찟한 느낌) 설현은 역할이 아쉽지만 배우로서 충분한 가능성을 보여줬다.  
20170905,10,뭐이딴 영화가 다있냐 설경구 연기존나 못하는구만ㅋㅋ 설현은 더 최악이고 ^^  
20170905,1,설현잘할수있을까?걍가수나하지  
20170905,7,설경구라 보기싫었느데 김남길이 나온다니 흥미가 생겼딘. 어떻게 연기할지 궁금하다.근데 살인자 주연인 영화는 솔직히 그만보고싶다. 현실에서 끔찍한범죄자인데 영화에선 자주 주인공이 되어 나온다니 참..  
20170905,10,최고의 영화. 너무 재밌다  
20170905,10,김남길 설경구 오달수 이셋만봐도 성공보증수표아님?  
20170905,10,이번에는 배우에 의한 예술을 만들었네요. 역시 설경구다.  
20170905,8,설현 연기 총체적난국.  
20170905,10,보고난 이후에도 잔상으로 남는 이야기들  
20170905,10,택시운전사보다 100배는 재밌다  
20170905,9,"굉장히 짜임새있고 재미면에서도 훌륭하다! 보고나면 딱 드는 생각 ""와 이거 설경구 아니면 누가 소화할까?"" 대체불가 연기력...  "
20170905,10,어제 시사회갔었는데 설경구 김남길 설현 기대이상으로 원작과 어울림 좋았고 연출에 있어서는 아쉬운점이 있긴해도 배우들 연기가 다 카바침 뭐 볼만한 스릴러가 나온건 확실합니다 많이들보시길  
20170905,10,시사회로 본 느낌은 설현의 연기는 실망스럽지 않았고 김남길 설경구의 연기를 보지 않고 넘긴다몃 후회가 될꺼 같음 원작을 봤어도 보지 않았어도 충분히 매력있는 영화였다  
20170905,4,설경구 혼자 너무 열일한 영화김남길의 매력은 하나도 살리지 못했다욕심은 엄청 부리고 그러면서 디테일은 살리지 못해마치 시험 치기 전날 먹지만 엄청 쓰고 스트레스만 디립따 받다가밤만 꼴딱 새고 에라 모르겠다 해버린 것 같은 중간중간의 허술함  
20170905,8,"설현은 백치미(?) 아닌 순수함을 뽐냈고, 김남길은 자신이 가진 모습 중 하나를 제대로 꺼내놨으며, 설경구는 덩치큰 형사가 아닌 살인자와 아버지의 모습을 돋보이게 선보였음. 원작이 좋기도하지만 감독의 연출도 못지않게 좋았음. 시사회평  "
20170905,1,설씨 두명때문에 패스 ~  
20170904,10,시사회.  . .정말 대박 잼났습니다 딴건모르겠고 설경구의 연기 . 닭살돋는다는게 이럴때 쓰는말  . 하여튼 대박  
20170904,10,시사회로 봣는데 책을 사전에 봣음에도 색다른 재미가 잇엇다  
20170904,1,설현 목소리 고자... 그냥 인형답게 cf나 찍고 이쁜척만 해라. 민폐덩어리 짜증유반ㅅ  
20170904,10,오늘 시사회에서 봤는데... 두번 보세요. 지금 제 기억을 믿지 못하겠음.  
20170904,10,설현이 연기괜찮았고 설경구연기.짱짱  
20170904,1,스폰하면 배우 시켜주나보내  
20170904,10,이야기의 스토리가 멋진영화  
20170904,4,태권브이 만든다더니 언제 만드는거임!??  
20170904,10,예고편 설경구 얼굴표정만으로 10점 드립니다.  
20170904,1,설경구 때문에 고민이 되네요  
20170904,10,소재가 좋아서 보고싶다  
20170904,8,"영화적으로 잘 각색했단 느낌으로 봤다. 설경구는 요즘 욕먹지만 늘 좋은 연기를 보여주는 배우..김남길도 괜찮고 설현은 초중반은 외모, 후반엔 연기가 보이더라  "
20170904,1,개인취향인데  사람 죽이는 영화좀  안만들면 안되나?? 사람들은 왜 사람죽이는 영화좋아할까? 나도 모르는 숨겨진 폭력성인가?  
20170904,10,배우분들 덕분에 더욱 기대됩니다  
20170903,10,김영하 작가님의 오랜 팬입니다! 소설을 너무 재미있게 읽었기에 영화가 정말 기대됩니다. 김영하 작가님이 설경구 배우 분의 연기에 대한 평이 좋아서 더욱 그렇네요. 개봉날 달려가겠습니다! :)  
20170903,6,다된 영화에 설현  뿌리기... 캐스팅 진짜 이해안간다...  
20170903,5,설현 ㅜㅜ 제발 연기잘하는 연기자쓰자. 아이돌 드라마도 모잘라 티켓팔이할려고 영화까지 ㅜㅜ  
20170903,5,기대했던 영화인데 설경구는 왜나오나 연기도 별로던데.. 진짜 짜증나네  
20170903,10,원작 소설이 워낙 몰입도가 높아서 영화가 기대되네요!  
20170903,10,설경구 배우님이야 연기의 신이고 개성있는 김남길 배우님 후기 연기평이 좋아서 기대되는 설현님 거기에 천만요정 오달수 배우님까지 예고편도 흡입력 장난없고 기대되는 작품입니다  
20170903,10,설경구 배우님 정말로 너무 많이 기대됩니다  
20170903,1,캐스팅미스ㅡㅡ 안볼꺼임  
20170903,10,시사회 보고 왔습니다 책도 읽었는데 각색을 잘 해서 원작과는 평행이론 느낌이고 연출이 짜임새 있고 쫄깃하네요 설현은 생각보다 연기 잘 해서 놀랐고 김남길은 서늘한 연기가 소름끼치게 무서웠습니다 설경구는 인생작 갱신 남우주연상 확정입니다 OOO기  
20170903,1,"평론가 마져도 5점 때리는 영화에 벌써 알바 천국이라니, 쩐다.  "
20170903,10,배우들 연기 최고임 이 배우들의 연기라면 꼭 봐야 한다  
20170903,10,김영하 작가팬이고 남배우들도 연기짱들이라 개봉전부터 기대하고 있는중요. 믿고보는 김영하!  
20170903,10,시사회 다녀왔어요 원작과는 다르지만 더 흥미진진하네요  
20170903,10,믿고 보는 배우 김남길 설경구씨가 나온다니 매우 기대됩니다  
20170903,10, 예고편 잠깐  보는데  연기파배우들속에  설현이  넘나연기잘하는것같네요  큰배우로  시작하는  작품되길  
20170903,10,시사회 보고왓어요. 너무너무 재밌었습니다. 특히 설경구 배우님이 엄청 노력해서 만들어낸 병수 캐릭터에 특히 감동을 많이 받고 나왔어요;; 진짜 소름 돋더군요. 남길배우님은 정말 역할 잘 소화하신 것 같고 설현배우도 나쁘지않았어요~영화 잘됐으면 좋겠네요  
20170903,8,설현씨가 딸역할같은데 전문연기파 배우가 아니라 살짝 걱정됩니다만 잘소화해 내시고 원작느낌 잘사리면 대박 터질거같습니다기대됩니다 개봉하면 보러 갈께요^^  
20170903,1,설경구는 누가 자꾸 써주는거야!! 이 영화 보고싶긴한데 진심 이아재 안보고싶다 연기도 극혐  
20170903,1,"에휴 아이돌 출현,,,  "
20170902,10,시사회에서 좋은 반응을 얻었다고 들어서 기대되네요!  
20170902,10,시사회 본 사람으로서 이 영화는 된다! 설경구 김남길 연기는 말할 필요도 없고 설현도 너무너무 잘해서 놀랐다. 영화 짜임새도 좋고 그냥 참 잘 만든 영화.  
20170902,10,설경구 김남길 믿고보는 배우들 . 설현의 새로운 도전도 응원한다 !  
20170902,10,원작이 좋기에 영화도 잘 나왔을거라 기대합니다  
20170902,9,김남길 설경구 보고왔는데 설현... 왜죠 왜 설현이죠 왜죠 진짜  
20170902,1,설현 연기 정말 못하는데.. 이 영화는 망했네요 개봉 전부터  
20170902,10,"예고나 스포 등으로 스토리는 대충 그려지는데, 배우들 연기가 너무 궁금합니다.  "
20170902,10,김남길 이거 찍는다고 14kg 찌웠다고 했다 믿고 본다 완전 기대중  
20170902,10,설경구가 범인 아닐까?  
20170902,10,소설로 읽었는데 영화는 소설과 어떤 맥락에서 닮았고 또 다를지 기대가 큽니다. 개봉날 꼭 보러갈 생각입니다.  
20170902,10,너무기대되요 !! 살기법 화이팅  
20170902,9,원작도 봤고 영화만 기다리는중  
20170902,10,뭔가 재밌을듯 ㅋㅋ기대  
20170902,10,김남길 연기 기대된다♥  
20170902,1,영화에서는 풀네임으로 써야지 김설련.괜히 이미지 나쁜 애 캐스팅해서 다른 대배우들 이름 먹칠하는 꼴  
20170902,10,완전기대됨완전기대됨  
20170902,10,지인이 보구왔는데 대박이라고ㅋㅋ 개봉하면 보러갈꺼임ㅋ  
20170902,10,"설경구,김남길,오달수,설현의 연기와 김영하 작가의 원작이 어떻게 어울려 효과를 낼지 많이 기대됩니다.^^  "
20170902,10,김남길과 설경구라니 무조건 믿고 봅니다!!  
20170902,10,예고편보고 완전 기대중~ 김남길 눈빛연기 빨리 보고싶네요  
20170902,10,재밌는 영화일 듯!! 기대기대  
20170902,10,시사회 관람했습니다! 소설을 너무 재미 있게 읽어서 사실 살짝 걱정했는데 완전 최고였어요ㅠㅠㅠ  배우님들 연기가 너무 좋고 심장이 쫄깃한 전개에 시간 가는 줄 모르고 빠져들었습니다!  
20170902,10,헉 완전 기대됩니다 설경구 김남길이라니 연기 보는 맛은 확실히 보장일 듯  
20170902,10,재미있을 거라고 믿어 의심치 않습니다.  
20170902,5,이거마져 망하면 갱구형이제 어케돼죠?  
20170902,10,설현 나오는게 불편한 메갈년들ㅋㅋㅋㅋ아직 영화개봉도 안했는데 어떤지 보지도 않고 무조건 욕부터박는구나 너 그렇게 낳은 부모를 원망하길ㅠ  
20170902,10,ㄱ기대돼요!! 책 정말 재밌게 봤습니다!:)  
20170902,8,연기자는 최상급인데... 연출과 스토리가 문제지 항상...90년대 2000년대 쯤엔 영화가 스토리도 있어서 좋았는데... 어느 순간부터 그냥연출에만 신경쓰더라... 연출 스토리다 괜찮길...  
20170902,8,저 좋은 배우들 사이에... 설현이라... 꼭 그래야만 했나?? 진짜 배우 지망생들 정말 잘하는 사람들 많은데... 왜?? 꼭 아이돌을 넣어야 했나...물론 영화를 봐바야 알겠지만..갠적으로 오렌지마멀레이드 보고 연긴지 발인지 했었어서...  
20170902,10,김남길 나와서 ㅜㅜㅜㅜ꼭본다ㅠㅜㅠㅠ요새 찍고있는드라마에서도 코믹 연기 진짜 잘하는데 이영화에서는 어떻게 보여줄지ㅠㅠ완전 기대  
20170902,10,드립니당감사합니다 응 그래  
20170902,1,다된밥에 동호뿌리기이후 다된밥에 ㅎㅎ 무명배우들많은데 열심히 연기 노력하는 무명배우들에게도 기회를줍시다  
20170902,2,흠 메멘토냄새가 나네ㅋㅋ  
20170902,10,언제인가부터 설경구나오는영화 다 망하던데..이번엔 좀 떴으면 좋겠네요!  
20170902,5,김남길때문에 보고싶은데 무개념 설경구가 거슬린다  
20170902,10,"믿고보는 설경구님의 연기 , 완전  기대합니다. 개봉하자마자 극장 go!  "
20170902,1,김설현 은안이다 ...  
20170902,10,설경구 김남길 배우님 완전 기대중이예요^^  
20170901,1,설경구? 응!! 안봐~.  
20170901,10,예고편 보니 설경구씨 또 변신하셨더라구요! 기대됨  
20170901,10,배우들의 열연 기대됩니다!!  
20170901,10,얼마 안 있으면 개봉하는데 너무 기다려지고ㅠ설렙니다!!!살기법 흥해라!!!  
20170901,10,불한당 설경구 연기보고 이건 거의 이정재 관상급 변화가보였었는데 이번에도 정말 기대가 됩니다 예고편만으로도 너무 설레는군요  
20170901,10,시사회 보고 왔습니다. 연기도 연출도 다 잘하는 영화. 주연도 단역도 조연도 다 잘하는 영화  
20170901,10,이건 대박이 날 수 있다!  
20170901,10,설경구! 김남길! 설현! 너무 기대 되는 영화예요 ㅠㅠㅠ 첫주에는 퇴근하고 매일매일 한 편씩 보러 갈 겁니다  
20170901,10,설경구는 연기의 신이다....  
20170901,10,경지에 오른 연기와 눈을 뗄수 없는 전개  
20170901,10,대배우 설경구의 귀환. 한국 영화계 전무후무한 신성이었던 천재배우가  20년 묵으면 이런 독보적인 연기신이 됩니다.  
20170901,10,한국의 메멘토!  출연 배우들 연기  엄지척!  
20170901,10,설경구의 연기 기대하고 있습니다! 빨려들어갈것같은 연기력~ >.<  
20170901,10,넘흐기대돼요 책 두번 읽고 개봉전 한번 더 복습 했어요. 이 소설은 각색과 연출이 어떻게 되었는지 너무 궁금하네요. 나 이런 장르 너무 좋아요 ㅋㅋㅋ  
20170901,10,어제 시사회때 보고 왔습니다. 정말 재밌고 정말 무섭고 정말 슬퍼요..설현님 연기 잘하셔서 영화 후반부에 설경구 배우님과 설현배우님 두분의 씬에서 너무 몰입해서 무서워하고 슬퍼했어요ㅠㅠ 설경구 김남길 설현 짱!!!  
20170901,10,기대된다!! 원작도 넘 재밌었고 설경구 연기도 기대된다 인터뷰에서 다짐이 굳던데 정말 기대된다 그리고 김남길 설현은 당연히!! 기대된다!  
20170901,10,믿보설 (믿고보는 설경구) 이번에도 기대합니다.  
20170901,9,기대됨... !! 개봉날  보러가야지  
20170901,10,이벤트 시사회 다녀왔구요 설경구 배우님의 연기가 너무 대단해서 소름끼쳐요 한쪽눈에 경련오는 연기는 영화에 집중할수밖에 없게 만듭니다 책처럼 영화도 내용이 빠르게 흘러가고 집중도 잘되고 웃음포인트가 좋았습니다 살인에 대한 영화가 아니고 기억에 대한 영화  
20170901,10,훠우 설경구에 김남길...!  예고편보니까 장난 아니던데 재밌을거 같음  
20170901,1,설현 나온대서 기대안함  
20170901,10,원작소설이 워낙 줄거리가 확실한데다 연기력 되는 배우들이라 몹시 기대됨.  
20170901,10,말할 필요없는 설경구의 연기와 김날길. 그리고 발견한 좋은 원석 설현.  
20170901,10,시사회를 통해서 먼저 영화를 접하게 되었는데 원작을 잘 살리면서도 원작과는 또 다른 매력이 정말 잘 산 영화였습니다ㅠㅠ 특히 설경구 배우님이 연기하신 병수는 정말 많은 연구를 했구나 싶을 정도로 인물이 입체적으로 살아있다는 느낌이었어요! 너무좋았습니다  
20170901,10,시사회에서 봄 마지막까지 긴장하면서 봤고 웃음 터지는 부분들도 적절하게 있어서 재밌게 봤음  
20170901,9,잘 짜여진 각본에 배우들 연기까지 더해져 완전 몰입해서 봣습니다!! N차느낌 오는 영화!!  
20170901,10,너무 기대중이에요 ! 정말정말 보고싶어요 ㅜ  
20170901,10,너무 기대된다 원작 어떻게 살렸을지도 궁긍하고 워낙 연기력 보장된 배우들이라 서로간의 케미도 좋을것같아ㅠㅜㅠ  
20170901,10,이미 팬시사회에 다녀오신 분들의 호평을 보니 정말 기대가 큽니다 수요일만 기다리고 있어요!  
20170901,10,설경구 연기 너무 잘함...  
20170901,10,시사회 반응 좋아서 기대됨  
20170901,10,소설 재밌게 읽었는데 정말 기대되네요  
20170901,10,어제 시사회 다녀왔다. 설경구는 이 영화로 남우주연상을 받아야 한다.  
20170901,10,배우들의 연기력이 기대되는 영화  
20170901,10,"배우들의 연기, 스토리, 오스트 뭐 하나 빠질 것 없는 작품!! 믿고보는 설경구배우의 연기는 정말 최고였습니다!!! 살기법 화이팅!  "
20170901,1,갈수록 돈이 아까운 영화 ?돈내고 보는사람들 눈몰 ~~  
20170901,10,시사회로 미리 봤는데 재밌어요. 사실 원작소설을 워낙 재밌게 읽어서 영화는 어떨까 궁금하면서 기대가컸는데 책이랑은 살짝 다른내용인점도 신선하고 좋았음  
20170901,3,근데 여기에 줄거리 설명이 이상하네요 왜 살인범을 살인범이 쫓아야 되는지 나오지 않는데 누가 쓴건가요? 차라리 다른  블로그 설명이 더 나은거 같네요  
20170901,1,책값으로 이미 만원 태웠다. 영화값으로 또 만원 태울쏘냐?  
20170901,9,원작과 같고도 다른 영화.표정만으로 영화를 압도하는 배우들의 연기가 인상적이다.살인이 아니라 '기억'에 관한 영화!!  
20170901,10,평도 좋고 매우 기대 됩니다 개봉날만 기다려요 ~  
20170901,10,"팬시사로 우선 관람했습니다. 빠른 전개와 원작과 닮은듯 색다른 재미가 곳곳에 묻어있습니다! 긴말하지 않겠습니다. 재미있습니다. 물론 설경구 배우님은 영화의 신이었고, 김남길 배우님, 설현 배우님의 연기 역시 최고였습니다.  "
20170901,9,시사회 다녀왔고 영화 무지 좋았습니다 최고입니다 손에 땀을 쥐고 봤습니다 이건 꼭 봐야합니다 연기도 다 너무 잘합니다  
20170901,10,배우들의 캐릭터와 하나가 된 연기 너무 좋았습니다. 지루함을 느낄 틈 없는 영화였어요. 살기법 꼭 대박나실거예요!!  
20170901,10,기대감 최고. 빨리보고싶다  
20170901,10,"전반부터 시작되는 높은 몰입도가 한시도 영화에 대한 긴장의 끈을 놓을 수 없게 했다. 함부로 영화의 결말을 예측했다가 당했다. 원작을 먼저 읽어봤다면 영화와 비교하는 재미가 있을 것이고, 나처럼 영화를 먼저 봤다면 원작을 읽어보고 싶을 것이다.  "
20170901,9,원작을 보고 봐도 무방하다. 완전히 다르진 않지만 새롭고 흥미롭다. 설경구가 알츠하이머를 간접체험하게 해주고 김남길이 그 서늘한 눈빛으로 체온을 낮춘다. 설현의 연기도 훌륭했다. 몰입감 좋은 영화  
20170901,9,원작이 어떤식으로 그려질지 기대됩니다!! 빨리 개봉했으면 좋겠네요  
20170901,10,설배우님 영화 기대하겠습니다!!!  
20170901,10,영화는 끝나도 스토리는 끝나지 않는다. 살아숨쉬고 있을 것만같은 김병수와 민태주를 만났다.  
20170901,10,시사회 보고 옴. 영화 흡입력이 장난 아님. 연출이 상당히 노련해서 지루할 틈없이 강약조절이 훌륭하다. 배우들의 연기야 말할 것도 없이 엄청남.  
20170901,10,"원작이 영화로는 어떻게 그려질지 너무기다려지고, 배우분들 연기도 기대되요  "
20170901,10,설경구님 연기가 걍 말이 필요없음..  
20170901,9,시사회로 미리 봤는데 괜찮아요. 원작 소설보다 주인공 병수의 행동에 더 정당화를 주려고 노력한 거 같고 나름 설득력 있게 먹혀요. 설현 배우 연기도 나쁘지 않고 설경구 김남길 배우 연기는 진짜 대박입니다 영화관에서 볼만한 가치가 있는 영화예요  
20170901,10,"영화가 가득차 있는 느낌을 받았습니다. 소설이 원작이라 그런지 스토리 진행도 안정적이었고, 진행이 빠르면서 납득이 가는 전개라서 좋았습니다. 배우분 연기가 너무 리얼해서 몰입감도 최고였습니다! 개봉하고 몇 번 더 보러 영화관을 가게될 것 같습니다~^^  "
20170901,10,"설경구 배우나 김남길 배우는 믿고 볼 수 있고, 설현 도 이번에 잘했다고 해서 기대중!  "
20170901,10,심리가 주를 이루는 소설 원작이라 지루하면 어쩌나 했는데 수작이다 ㅠ  
20170901,10,설경구의 연기가 대단하다  
20170901,10,설경구 배우님의 연기가 매우 기대됩니다!!  
20170901,10,보고 나오니 진이 다 빠질 만큼 몰입했습니다. 감정의 폭을 마구 넘나듭니다. 흔히 하는 홍보용 멘트가 아니라 '김영하 작가님 원작 X 원신연 감독님 연출' 이라 자랑해도 됩니다. 타협 없는 설경구 배우님 연기까지요. 상영관에서 보실 영화 나왔습니다.  
20170901,10,원작도 유명한 소설인데다 시사회 평도 좋아서 기대감 상승중이에요! 설경구 배우님 김남길 배우님 설현 배우님 오달수 배우님 모두 연기도 잘하시고 노력하시는 배우님들이라 더 기대돼요!  게다가 예고편만 봐도 긴장감이 넘치는 영화예요 살기법 빨리 개봉했으면  
20170901,10,"오늘 시사회 보고왔는데 정말 기대이상이었습니다! 주연배우 설경구 김남길의 연기 아주 좋았고, 설현님은 딕션 열심히 연습하셨나봐요 대사가 다 잘 들리네요! 개봉하면 또 보러갈 의향 100프로 있습니다^^ 작가님 말씀도 너무 잘듣고왔어요!  "
20170901,10,"오늘 시사회에서 보고 왔습니다. 원작을 읽고 봤는데 여부 상관 없이 즐길 만한 좋은 영화입니다. 불편한 장면도 비교적 적은 편이어서 좋았고요, 무엇보다 설경구 배우님 연기가 정말 대단합니다 꼭 보세요 올 가을을 감아버릴 대작입니다...  "
20170901,10,진짜 오졌다... 소설이랑은 다른데 그게 또 새로운 매력이 있음. 소설 그대로를 재현하지는 않았는데 영화에서 더 잘 보여줄 수 있는 내용으로 잘 풀어갔습니다. 어제 시사회로 봤는데 개봉후에 또 보려구요. 여운이 정말 길게 남습니다.  
20170901,10,원작 읽는 중입니다. 책의 독백을 나레이션으로 표현한다고 하는데 귀 녹을 예정이구요..설경구 배우님 불한당에서 거칠고 섹시한 캐릭터를 보여줬다면 이번에는 어떤 캐릭터를 보여주실지 색다른 모습 기대합니다.원신연 감독님의 작품 중에서 제일 기대가 큽니다.  
20170901,10,소설 재미있게 봤는데 영화도 기대가 되네요~!  
20170901,10,설경구 너무나 완벽하게 변신했다  
20170901,10,"저는 원작소설 읽지않고 봤고, 뒷장면 예상하지 않고 장면장면에 몰입할 수 있어서 좋았어요. 한번으로는 부족한 것 같아서 저는 또 보려구요!그리고 주연 배우님들의 연기가 정말 대박입니다. 이렇게 지뢰없는 연기력 흔하지 않으니까 꼭 보세요!  "
20170901,10,시사회 같다 왔습니다.솔직히 책을 안읽고 봤는데 전개도 재밌고 유머코드도 생각보다 많아서 재밌게 또 스릴넘치게 보았습니다 나중에 책을 읽고 또 볼생각입니다.설경구님 연기도 감탄스럽고 김남길씨 연기도 좋았습니다  
20170901,9,소설과는 또 다른 매력을 만날 수 있는!!!살아움직이는 영화 속 인물들을 보며 재미를 느낄 수 있음ㅋ당신의 기억을 믿지 마라영화를 보는 내내 의심하게 될지도ㅎㅎ간만에 재미난 한국영화를 만나 기분좋음ㅋㅋ  
20170901,9,"시사회 다녀왔습니다!! 평소 즐겨보는 장르와 거리가 멀어 걱정을 했었는데 막상 영화를 볼 땐 아무 걱정 없이 아주 재밌게 보았습니다!!! 정당한 유머코드도 좋았고, 배우님들의 열연이 돋보였습니다 설배우님 최고~~!!  "
20170901,8,"시사회로 봤습니다. 극장에서 볼 만한 영화 같습니다. 설경구씨의 기억에 혼란스러워 하는 연기 좋았어요. 설현씨는 생각보다 더 연기를 잘 하시더라고요. 앞으로도 응원합니다. 주조연 분들 모두 좋았고, 원작과는 다른 이야기가 있어요. 추천합니다.  "
20170901,10,설경구는 연기의 신이다! 이런 연기를 그가 아니면 누가 할 수 있겠는가! 영화를 보면 알 수 있을 것이다!  
20170901,10,정말....말을 할수가 없네요 원작도 읽어볼 예정입니다  
