0,1,2
20170804,10,원작소설영화ㅠㅠ 넘기대됩니다!! 나오시는 배우님들 연기도 너무 기대됩니다^^  
20170804,10,설경구  배우의  연기가 너무나도 기대된다  
20170804,10,마지막 감정표현을 어떻게 할지 상당히 기대가 됩니다  
20170804,10,우리 설현이 나오네 ㅎㅎㅎ  
20170803,10,포스터에서 부터 설경구 눈빛 진짜 기대된다...믿고보는 설배우???  
20170803,10,믿고 보는 설경구!!!  
20170803,8,여배우 캐스팅이 아쉽다. 몰입도 방해만 안해줬으면.  
20170803,10,"원작 훼손만 안 되면 정말로 좋은 영화가 나올 것이라 믿어 의심치 않음. 설경구, 김남길.... 젤 중요한건 설현이 연기를 잘 하나, 안 하나 일 듯  "
20170803,10,다른거 없이 김남길 형 때매 꼭 본다ㅇㅇ  
20170803,10,아이돌 쓰지말라고 진짜;; 아이돌들 발연기때문에 영화에 집중이안된다고;;;  
20170803,10,드디어 나오는 군여 기대됩니다 포스터 겁나 잘만들었네 ㅋㅋㅋ  
20170802,1,"나도 설현 좋아하는 남성팬인데 제발 아이유,설현같은 아이돌들 좀 영화에 안쓰면안되냐 다른 연기 더 잘하는 배우들이 널렸는데?  임시완 정도 재능이면 몰라  "
20170802,10,설경구 형님 나오시네요   그리고  aoa설현도 나오네요 ㅎㅎ   볼만 하겠네요 ㅎ  
20170802,8,별 관심 없었는데 포스터가 마음에 든다. 설경구의 눈빛과 그 위에 써있는 문장들.  책한번 더 읽고 보러가야겠다  
20170802,10,설경구와 김남길 믿고 봅니다!  
20170802,10,갓경구!! 너무너무 기대돼요!!  
20170801,10,믿고 보는 설경구 배우님의 영화!  
20170801,4,김남길 설경구 오달수에 갑자기 찬물확...설현.... 가수들이 연기하는거 반대는 안하는데 연기력안돼면 제발 알아서들 좀 안했으면함.. 저 명배우들 연기에 흐름만 안끊기를...  
20170801,5,"설현의 연기가 어떠느냐에 따라, 영화를 어떻게 연출하느냐에 따라,적어도 설현을 캐스팅한 감독에 능력에 의심을 품으면 5점  "
20170801,10,설경구의 살인마 연기를 볼 수 있다는 것 만으로도  
20170801,5,박찬욱-안성기-김태리-김남길이었으면....  
20170801,9,책으로 진심 재밌게봤는데..영화로 잘만들어주셨겠죠?!????  
20170801,10,살기법 파이팅!!!!  
20170801,1,설경구의 같은 패턴의 강철중연기 너무나 식상하고 설현하면 김또깡이 생각나서 헛웃음만 나와서 집중이 안될듯!!  
20170801,10,설경구 기대됩니다.!  
20170731,10,나는 김남길의 연기가 좋다  
20170729,1,다된 밥에 설현뿌리기ㅋㅋ  
20170729,10,"김남길,설경구,오달수 좋다  김남길 그 특유의 분위기 너무 좋음ㅠㅠ  "
20170729,1,믿고 거르는 설경구. 설현아 어쩌다 믿고거 랑 영화찍었니 ㅠㅠ  
20170727,10,아아...설경구와 김남길 조합은 최고인거시다...  
20170726,10,소설책으로 보면서 느꼈던 섬뜩함 영화에서도 볼수 있었으면 좋겠어요~  
20170726,10,김남길 나오니까.... 설경구설현 무릅쓰고 본다...  
20170726,1,설경구 분장한 모습을 보니 ... 훅~  
20170726,1,"김남길, 김설현 좋아하는 배우들인데다 소제도 좋아 기대가 큰 데, 설경구라니... 참나...  "
20170726,1,은퇴한....이란 말이 거슬리네요  마치 연쇄살인범이 직업인냥...   연쇄살인범을 하나의 캐랙터로 자리잡게 하는 스토리들 반대합니다  살인자를 끊임없이 양성해내고 있는 이 사회  
20170725,2,책을 본 사람은 절대 실망할 듯. 책이 재밌을수록 영화는 못 따라감. 게다가 맨날 박하사탕 연기하는 설경구라니...ㅡㅡ  
20170724,10,오랜만에 설배우님 팬으로 채워진 시사회장을 보여드릴 생각에 저까지 설래네요! 믿보설 기대하고있겠습니다  
20170722,10,경구형님 기대할께요.  
20170721,1,여배우 쓸 사람이 저렇게도 없냐. 짜증.  
20170720,10,다 된 영화에 설현 뿌리기...아;;  
20170720,10,믿고보는 설경구. 기대된다.  
20170719,4,배우캐스팅이 약간 아쉽네요. 제목만 봐서는 청불일거 같은데..  
20170719,10,김남길 나온다닝 무조건!!책도 재밌게 봤는데  완전 기대된당 > <  
20170719,10,꾸꾸 사랑해♥♥♥♥+  
20170719,10,김남길 보러 갑니다 9월개봉예정  
20170713,9,뭐 무슨 의도인지 때문인지는 알수없지만 좋은 영화에 설현 뿌리기 이런건 아니길 바랄께요.  
20170705,10,설경구 배우님~ 응원해요S2 빨리 보고싶당  
20170601,10,악에 대한 감독의 또 다른 고찰이 기대되네요 김병수의 연쇄살인은 첫살인에 대한 속죄였음을...  
20170519,10,김남길이 나온다니 꼭 봐야겠다  
20170515,5,"세븐데이즈 용의자의 원신연 감독이면 기대하지만,,,주연이 설경구,,라 망설여짐,,설경구는 공공의적3,감시자 이후,,5년째 히트작도 없는 배우인데...비호감 배우  "
20170504,5,설현이 은희... 글쎄 내가 생각하는 설현의 이미지랑은 조금 어울리지 않는 면도 있을 것 같다 물론 설현의 연기는 좋아하는 편이지만  
20170427,10,기대되네요 영화 꼭 보러갈레요~~~  
20170423,10,헐 하반기 개봉 나이쓰~~  
20170323,10,설경구와 김남길의 대결이라니 잠시 주춤하던 설경구 재기했으면좋겠습니다  
20170321,10,김남길은 본다.하지만 설사는 싫다.  
20170321,10,무조건보러갈거에요  설경구 김남길 설현 님 너무팬입니다 ~책으로 먼저 읽어서 더기대되네요  개봉하면 꼭보러가겠습니다 .설현 어떤역할일지 궁금하네요  
20170321,9,"책으로 볼때, 정말 잘 읽히고, 몰입감 최고로 2시간만에 다 읽었지요. 충분히 영화로써도 기대이상의 작품이 나오지않을까 생각됩니다. 배우분들도 빵빵하고 기대됩니다.  "
20170317,10,믿고보는 배우 김남길이 나온다니!! 이건 꼭 봐야겠다. 책으로도 재밌었는데 이 스토리와 김남길 이라면 이 영화 엄청 재밌겠다  
20170213,10,설현 있어서 본다 ㄹㅇ 떠려니 캐리  
20170212,10,이거 도대체 언제개봉하니?  
20170211,10,언제 개봉하나요 ㅜㅠㅠ 벌써 2017년인뎅..  
20170209,10,완전 기대되요!!! 문장 하나하나 긴장감이 느껴져서 심장을 졸이며 본 책인데 엄청 기대되네요!!  
20170207,10,보고싶다 대체 언제 개봉하나요ㅠ  
20170205,10,"이 책 엄청 재밌게봤는데 영화로 나와서 엄청기대됨 특히 설현,김남길,설경구 출연진이 어밴저스급  "
20170205,8,설현만 없었으면 10점 줄텐데  
20170201,7,다된밥에 설현 뿌리기 될거 같다  
20170130,10,그래서 도대체 개봉은 언제...? 언제....???  
20170129,1,그많은 배우중에 설경구라니‥‥ 참  
20170129,10,설현?... 왜하필?  
20170129,1,약은 약사에게영화는 배우에게  
20170116,1,제발  영화나 드라마 같은곳에 연기못하는 아이돌 끼우지 말고  연기잘하는 신인배우를  캐스팅하는게  훨씬 좋을것 같은데...괜히  욕만 먹지요ㅠㅠ  
20170116,1,그닥 기대가 안됨....  
20170115,10,김영하소설의 시니컬함을 잘 이끌어내길  
20170110,5,"김남길, 설경구는 믿고 보는데 설현은...  "
20170101,1,설경구에 설현까지 믿고 거르면 되겠군요 안보고싶다  
20161230,1,진짜재밋게읽은소설인데 왜 설현이 나와 아  
20161228,4,책 읽고나서 영화로도 나오는걸 알고 쳐보니까 설현..? 김남길 설경구는 말할 것도 없이 대박이지만 왜 하필이면 아이돌이지  
20161228,1,믿고 거르는 설현 돈주고 아이돌연기볼필요는 없지  
20161228,10,와 설현을 영화에서 보게 됐다니; 생각지도 못했는데. 다른 배우들한테 폐 안끼치고 잘했으면. 연기 잘해도 욕먹을텐데 잘해야지ㅇㅇ  
20161226,10,우선 저는 빛의 제국에 이어 김영하 작가의 책 중에서 재미 있게 본 소설이 바로 살인자의 기억법인데 과연 영화로는 어떻게 나올 수 있을 지가 궁금해지고 설현의 연기력에 대해서는 영화가 나와서 볼 수 있을 때까지는 지켜보는 것이 맞다고 저는 생각합니다.  
20161218,10,설현 연기늘어있었으면...  
20161213,10,믿고보는 김남길이지만 설경구땜에 패스 설현은 또뭐니?설현좋아하지만ㅠ왜ㅠ  
20161212,6,"설경구, 김남길사이에 설현이라뇨  "
20161212,10,김남길 올해에 영화만 해도  3편이나? 그것도 다 주연이라니 능력좋다몽 드라마는 또 언제 나오냐몽?  보고싶네잉  
20161209,1,설현도 나오냐?설경구에 설현에 비호감두명이나 나오네믿고거르자김남길이 아깝다  
20161128,8,분명 책은 정말 좋은 책인데 설현...?  
20161128,10,어서 개봉해라아! 어서보고싶다..  
20161128,8,마지막이 좀 황당해서 책도 읽고나서 좀 어리둥절하고 혼란스러웠는데 영화로 그 마지막을 어떻게살리느냐가 관건인거같네요....  
20161125,10,"설경구,김남길,설현 이  세명의 캐미가 너무 기대되요설현누님 앞으로도 좋은활동 화이팅  "
20161115,10,설현언니 응원합니다 사랑해요! 조연부터 차근차근 쌓아온연기 빛을 발하길빌게요ㅎㅎ  
20161108,10,믿고 보는 갓설현 말이 필요없는 갓남길 갓경구  
20161104,10,원작을 정말재밌게 읽었습니당 기대되네요옹!!!!  
20161102,10,"캐스팅 연지자들 모두 화이팅, 감독님 화이팅 ^^  "
20161022,10,설현나온대서 원작도 빌려서 읽었는데 진짜 꿀잼.. 이건 반드시 봐야하는 영화 설경구에 김남길이라니 . .  
20161021,5,설경구 김남길 좋은데 뭐? 설현? 미쳤나보다;  
20161004,1,무슨말이 더 필요하나 설현  
20161001,5,원작의 힘은 극단적인 단문에서 오는 속도감. 이게 소설 속 장치를 부지불식간에 흘려버리게 함으로써 반전에 힘이 실리는건데... 이걸 영화로 어떻게 살릴지;;  
20161001,8,설현때문에 원작 느낌 조질듯  
20161001,10,설현이 나왔으니 10점  
20160930,10,믿고보는 원신연감독.  
20160930,10,개봉 언제하나요?ㅠㅠ  
20160917,1,김남길 설경구 메인 좋은데 설현을 뿌려버리네 ㅋㅋㅋㅋ 잘가라 안본다  
20160916,1,설....현? ㅋㅋㅋㅋ  
20160909,1,"김영하 작품 정말로 좋아합니다. 이번에 영화로 나온다고 해서 정말 많이 기대하고 있었는데,, 캐스팅이 정말,,, 제 개인적으로 설경.. 휴우.. 캐스팅이  제 개인적으로 너무 아쉬워요 ㅠㅠ  "
20160812,1,평택에서 찍었는데설현이  목소리가 꽝..  연기도 꽝..  우짜노  
20160811,10,김남길나오니까 믿고 보겠습니다!!  
20160810,5,다 된 배우섭외 후 재뿌리는 영화같다.. 본업에 충실하자  
20160803,10,갓설현 연기로 보여주자  
20160727,10,정말 기대됩니다! 설경구님 설현님 응원해요  
20160726,10,믿고 보는 김남길... 근데 뜬금 설현..응...?  
20160720,10,빨리 개봉해 주세요..달려갑니다..2번 보는걸로..김배우님보러 가 보시죠~!!^^  
20160719,10,정말 재밌게 읽은 책입니다. 배우들이 문체와 작가의 감성을 잘 살려주길 바래요! 연기력은 필수구요!!  
20160708,10,설현 때문에 꼭 봐야 겠다. 김설현 화이팅??  
20160705,10,일단 설현 나온다는 거에 기대가 급상승함. 소설기반이면 스토리도 탄탄할 것 같고. 설현아 우린 항상 여기 있어!  
20160705,10,연기자로써의 설현을 왤케 빠는지 이해불가... 돈크라이마미급 다 된 영화에 아이돌 뿌리기 나올 것 같아서 심히 걱정된다 진짜 재밌게 읽은 책인데  
20160628,10,설현 응원합니다!!! 너무 예뻐요!!  
20160628,10,기대기대 제 점수는요~  
20160628,10,영화 기대하고 설현씨 응원합니다~  
20160628,10,설현님 연기 기대하고 있습니다~!  
20160628,10,설현님의 연기 기대하고 있습니다! 화이팅하세요~  
20160628,10,설현양 연기 기대하고 있어요!!  
20160628,10,김남길? 무조건 봐야지 그럼  
20160628,10,쵝오 연기돌 탄생!!!!  
20160628,10,설현님 기대합니다!!  
20160628,10,설현님 영화 정말정말 기대돼요!! 대박 기원합니다  
20160628,10,영화 무지 기대되요화이팅  
20160628,10,너무 기대되는 영화. 설현의 연기도 기대된다!  
20160628,10,영화 기대중 입니다. 화이팅  
20160628,10,설현양 연기 기대합니다~★  
20160628,10,와 설현님도 출연하고 너무 기대되요  
20160628,10,기대됩니다!재밌을거같아요!  
20160628,10,설현씨 연기가 기대돼요 화이팅!!  
20160628,10,영화 너무 기대돼요. 개봉일 기다립니다~  
20160628,10,얼른보고싶네요!!!  
20160628,10,"살인자의 기억법 기대하고 무척 기대하고 있습니다. 셜경구, 김남길 두 배우의 연기도 기대되지만, 설현이 연기도 기대합니다.  "
20160628,10,설현 연기 기대감 큽니다.  
20160628,10,완전 기대합니다. ..  
20160628,10,설현양 응원합니다!!  
20160628,10,설현 만으로도 기대감 충족  
20160628,10,기대치 높아집니다!!!  
20160628,10,설배우의 오랜만의 복귀작! 너무 기대됩니다~♡살인자의 기억법 파이팅!  
20160628,10,기대되네요 꼭 보러 갈께요  
20160628,10,영화 너무기대됩니다ㅎㅎ설현 화이팅~  
20160627,10,라인업부터 대박예감입니다. 특히나 설현씨가 나온다니 꼭 보고싶네요!  
20160627,10,설현만 보고 간다!!!  
20160627,10,설현님 때문에 더 기대되는 영화예요. 항상 응원합니다.  
20160627,10,너무 기대되는 영화입니다. 설현 화이팅!  
20160627,10,재밌을꺼같음 기대하겠습니다  
20160627,10,설현 누나의 연기가 좋아요.~~^-^~~♥  
20160627,10,기대됩니다 꼭 볼게요!!!  
20160627,10,설현양 기대하고 있어요^^  
20160627,10,설현님 짱짱맨이올시다  
20160627,10,살인자의 기억법 너무나 기대됩니다~ 설현양 이번에도 좋은 연기 보내주시길!!!!  
20160627,10,영화 기대됩니다 !!!ㅎㅎ  
20160627,10,너무너무 기대되요!!!!  
20160627,10,매우 기대됩니다!ㅎㅎ설현 화이팅  
20160627,10,기대하고있어요 재밌겠다  
20160627,10,살인자의기억법 ~설현 때문에 기다리는 중  
20160627,10,영화 기대됩니다!!!!  
20160627,10,진짜 너무 기대됩니다 ~  
20160625,10,설경구의 연기가 정말맘에들었습니다아무것도모르는듯 뻔뻔한모습으로 정말 예상하지도 못하게연기를 잘하더군요그러고보니 아버지(설경구)  딸(설현) 의 성이 설 씨로 똑같군요이부분도 노린건지도 궁감하네요  
20160623,10,"퍄퍄 세븐데이즈 연출하신 감독님에 설경구, 김남길, 설현까지 정말 기대되는 작품이네요!  "
20160623,10,갓설현 연기 매우 기대하고있습니다.  
20160623,10,설현양  나오는  영화라  기대가  되고  좋은  적품일것  같습니다.  
20160623,10,재미있을거 같군요 보겠습니다  
20160621,10,기대기대된당 써려나ㅜ♡  
20160621,10,대박 캐스팅!! 설현님 연기도 기대가 되네요~ 화이팅!  
20160621,10,설현씨 나온다니 기대되요!!!  
20160620,10,캐스팅 완벽하네요. 설경구+김남길+설현 조합이 기대됩니다.  
20160620,10,기대가 됩니다~!!!!  
20160620,10,설현님 연기 기대기대! 영화 흥하자!  
20160620,10,설현님 나오시는 영화 기대중입니다 대박나세요  
20160620,10,설현양 너무 기대됩니다!  
20160620,10,좋은 배우분들의 멋진 연기 기대합니다  
20160620,10,설현양 나오는 살인자의기억법 너무 기대됩니다!!  
20160620,10,여주인공이 기대됩니다 ㅎㅎ  
20160620,10,설현양 연기 기대됩니다! 빨리 보고싶어요  
20160620,10,설현양 기대됩니다 화이팅  
20160620,10,기대됩니다! 설현씨까지 나온다니 대박날것같아요  
20160620,10,기대 많이하고 있습니다~!!  
20160620,10,설현이 나온다니 기대됩니다!!  
20160620,10,설현 응원합니다~~~  
20160620,10,너무 이쁜 설현이 출연한다니 꼭 보고싶네요!  
20160620,10,명품배우들! 기대합니다!!  
20160620,8,책으로읽었던건데 기대가되네요ㅎㅎ 설현은 생각치도못했지만 잘어울릴거같네요  
20160620,8,책으로읽었던건데 기대가되네요ㅎㅎ 설현은 생각치도못했지만 잘어울릴거같네요  
20160620,10,설현님을 응원합니다!!  
20160620,10,기대되는 영화입니다!  
20160619,10,책다 읽고 그냥 아무생각없이 검색해봤는데 영화로 만들어진다고하니까!!! 엄청기대되네요!!!  
20160618,10,살인자의 기억법 기대합니다!  
20160618,10,좋은 연기 기대하고 있어요~  
20160618,10,"책으로 봤을 때 정말 스릴 넘치고 재밌게 봤는데 영화로 나온다니 너무 기대됩니다!! 거기다 라인업도 설경구, 김남길, 설현 씨..스크린을 꽉 채우는 연기력 기대하겠습니다 살기법 대박나라!  "
20160618,10,출연진 모두 기대가 되는 영화네요  
20160617,10,살인자의 기억법 기대돼요!!  
20160617,10,기대중이예여~~!!!  
20160617,10,책으로 읽었는데 많이 기대되네요 화이팅  
20160617,10,화이팅 입니다 영화기대하고있어요  
20160617,10,"좋은스토리 좋은 배우, 좋은작품 기대하고 있겠습니다.  "
20160617,10,살인자 기억법 은희 기대됩니다!!  
20160617,10,기대되는 영화입니다.  
20160617,10,안봐도 비디오 굳럭 설혀니 싸라해  
20160617,10,설현이 어떤 연기 보여줄지 기대할게요~  
20160617,10,빨리 상영됬으면 하는 영화중에 하나에요! 기대됩니다!!  
20160617,10,와 설현 기대된다♡♡♡♡  
20160617,10,기대 많이 하고 있습니다^^  
20160615,10,설현아 성장하는 과정을 함께 할게!  
20160615,10,김남길 설경구 설현님 나온다니 정말 기대되네요  
20160615,10,다른 배우들도 기대되지만 설현 나온다니 기대됨  
20160615,10,너무너무 기대됩니다 ㅠㅠㅠ 배우분들도 그렇고 스토리도 그렇고 최고의 기대작!!!  
20160615,10,기대되는 배우로써의 설현님의 새 영화 살인자의 기억법! 개봉만 기다립니다.  
20160615,10,기대됩니다.. 대박나시길!!  
20160615,10,기대하고 있습니다 무조건 볼거에요!!!  
20160615,10,탄탄한 배우진에 연기 역시 기대됩니다  
20160615,10,설현님 연기 기대할게요~  
20160615,10,정말 재밌겠네요. ..  
20160615,10,재밌게 읽었던 소설이라 기대됩니다^^  
20160615,10,영화 대박나세요 화이팅  
20160615,10,출연진들을 보니 재밌을거같아요!!! 대박영화 탄생하길!!! 기대합니다!  
20160615,10,대박재미있을듯!기대많이된다:)  
20160615,10,설경구라니 ㅠㅠㅠ너무 기대됩니다!!  
20160615,10,설현양 기대합니다! 흥행대박나길!!  
20160615,10,살인자의 기억법 정말 기대됩니다.  
20160615,10,김영하씨의 소설 리메이크에 훌륭한 남배우와 설현씨까지!! 올해의 영화감이네요 ㅎㅎㅎㅎ  
20160615,10,설현님 연기도전! 화이팅~~~  
20160615,10,기대하고 있습니다!!  
20160615,10,좋은영화기대됩니다~  
20160615,10,재미있을것같아요!!  
20160615,10,설현님 기대 됩니다. 영화 대박나세요.  
20160615,10,영화 기대하고 있어요!!  
20160615,10,남길이형 넘나 기대되는것  
20160615,10,기대되는 영화입니다 꼭 보러가겠습니당  
20160615,10,기대많이 하고 있어요!! 대박나세요  
20160615,10,설현님 응원해요 힘내세요!!  
20160615,10,영화 기대중입니다 잘되라~  
20160615,10,설현 나오네  보러 가야지  
20160615,10,너무 재밌을꺼 같아요 설현 대박 기대중  
20160615,10,설현님 너무 기대되요!  
20160615,10,설현님 연기 기대해 볼께요~  
20160615,10,매우 기대되네요 영화 대박나길~!  
20160615,10,기대되용ㅎㅎ화이팅입니당  
20160615,10,배우들 모두 맘에 들어요 많이 기대하고 있어요!  
20160615,10,설현님 새작품 기대됩니다!!  
20160615,10,기대합니다.ㅎㅎㅎㅎ  
20160615,10,김남길배우님 설경구배우님에 설현님까지ㅠㅠ라인업이 너무기대되네요ㅠㅠ영화개봉빨리됬으면ㅠㅠ설현 화이팅!!  
20160615,10,엄청 난 배우분들 설현양 까지 ~ 너무 기대되는 영화네요!! 개봉하자마자 영화관 달려갑니다  
20160615,10,설경구. 김남길 쟁쟁한 연기파 배우븐둘에 핫한 설현까지! 기대중입니다!  
20160615,10,연기파배우들에 요새 핫한 설현까지 나온다니 기대됨  
20160615,10,아직 개봉은 안됐지만 기대 많이 되네요  
20160615,10,설현님 연기 기대됩니다! 화이팅  
20160615,10,살인자의 기억법이 영화로 나온다니 기대하고 있을게요!  
20160615,10,설현양 연기 너무 기대 됩니다! 화이팅!!  
20160615,10,와... 엄청 기대됩니다!! 설현님 파이팅!!!  
20160615,10,좋아하는 배우분들 다 나와서 너무 기대됩니다! 영화 대박나시길~  
20160615,10,우와 배우들 빵빵한 영화다 ㅋㅋ 설현양 기대할께요  
20160615,10,꼭 보러갈게요~~설현 좋은모습 기대할게요~영화꼭 흥행했으면 좋겠다..홧팅!  
20160615,10,설현 연기 기대기대 ㅎㅎ  
20160615,10,너무 재밋을거 같아서 기대중입니다.  
20160615,10,설경구 배우님에 김남길 배우님까지.. 기대되는 조합이네요. 거기에 오렌지 마말레이드에서 좋은 모습 보여준 설현양까지! 좋은 영화로 만날수 있을거 같아서 벌써 기대됩니다!  
20160615,10,영화 기대됩니다 화이팅  
20160615,10,"김남길, 설경구에 설현까지?! 완전 기대된다!!  "
20160615,10,살인자의 기억법 기대됩니다 !!  설현 화이팅!  
20160615,10,라인업 진짜 후덜덜하네요 와 ㅋㅋㅋ 기대됩니다 그리고 설현 젤 기대됨!! 두근두근...  
20160615,10,영화 대박나시길 진심으로 기원할께요 ㅎ꼭 보러 갑니다 ㅎ  
20160615,10,영화 기대 돼요 김남길 배우님도 그렇고 설현양 좋은 모습 기대할게요!  
20160614,10,설현나오네요! 기대 됩니다!  
20160613,10,서려니가 주연이라니!!!완전 기대됨!! 흥해라  
20160613,10,설현이의 첫 영화 주연작 퍄퍄  
20160613,10,갓설현 첫주연 ! 너무나 기대 된다~ 흥하자! 살인자의 기억법 대박!  
20160613,10,설경구 김남길 설현이 나온다니 이건 꼭 봐야돼!  
20160613,10,믿고봅니다 열자열자열자  
20160613,10,설경구 김남길 설현이라니! 영화 기대됩니다♡  
20160613,10,살인자의 기억법! 기대됩니다!  
20160613,10,설현 나온다니 꼭 성적 좋았으면 좋겠다..설현아 힘내  
20160613,10,오 재밌겠다 기대됩니다  
20160613,10,오 김남길에 설경구에 설현이라니 어떨지 정말 기대되네요  
20160613,10,정말 기대됩니다!! 배우라인업도 좋고~ 스토리도 짱짱!  
20160611,10,"영화 개봉일에 바로 관람한 적은 없는데, 웬만하면 개봉일에 보고싶다  "
20160607,10,김남길에 설현까지  꼭 봅니다 기대기닥  
20160528,9,아이돌이 주연 까지는...보면 알겠지만 쨋든 힘냅시다! !!  
20160526,1,설현????별로다  
20160520,10,♡ 김남길 나오면 무조건 만점 ♡  
20160520,10,설현 너무이뻐요 연기도잘하고 화이팅!  
20160518,8,한국판 메멘토가 되겠네요  
20160514,1,살인자의 기억법은 알지만 안중근은ㅜㅜ 몰라  
20160509,10,설현 화이팅!  개봉하면 꼭볼거예요  
20160509,10,하필설경구라니ㅜㅜ김남길  설현 이라 보고는 싶은데?  이를어째..  
20160507,10,설경구 김남길 믿고 보는 배우들에 설현이 까지!! 개봉일이 너무 기다려 진다^^ 설현이도 이번 영화로 본인 역량 충분히 발휘해서 그간 말도 안되는 악플들 보란듯이 잠재웠으면 좋겠다 화이팅!!  
20160424,10,김영하 작가님 팬으로서 영화 정말 기대 됩니다! 근데 박주태가 갑자기 태주가 된거에 의문을 갖는건 저뿐인가요...  
20160421,10,김남길 설경구는 좋아ㅎㅎㅎㅎ근데 설현은 연기 잘함?  
20160412,10,이거 원작소설 소설진짜 재밌음 첫장 펼치자마자 미친듯이 몰입해서 앉은자리에서 다 읽었다  
20160412,10,소설을 영화로 만드는건가요..? 설경구.. 이번에는 대박나시길..  
20160407,10,일단 뭐...설현이 나온다고 하니 십점....!ㅋㅋ  
20160401,9,소설읽으면서 이거 영화나오면 무조건  대박이다 했는데 전 사실 .. 노인 역할에 최민식이 정말 제대로다 생각했는데 설경구씨는  분장으로 극복하긴 조금 ...  
20160331,10,설현 나이스 개이득 설현나오네  
20160328,10,설현이 있기 때문에 10점 주고감.  
20160318,10,완전 기대됨 근데 원래 은희 남친 이름이 주태 아니었나? 주태키 170 조금 넘는데 김남길은 184ㅎ 그래도 김남길 연기가 좋으니 너무 기대된다  
20160318,10,설현이는 다니엘 데이 루이스보다 연기를 잘하고 나탈리 포트만보다 이쁘다 왜냐하면 내가 좋아하는 여자니까  
