0,1,2
20170901,10,"시사회 다녀왔습니다. 설현씨는 조금 걱정했었는데 극에 잘 녹아들었던것 같고, 김남길씨 이런역할 정말 잘 어울리는것 같아요. 설경구씨는 더이상 놀랄 수 없을거라 생각했는데 상상 이상의 연기를 보여주네요. 개봉하면 다시가서 볼예정입니다!  "
20170901,10,시사회에서 보고 왔습니다 설경구 배우의 연기는 연기라고 믿겨지지 않을 정도였어요 전개가 흥미롭고 반전과 영화 흐르는 긴장감 때문에 한시도 눈을 뗄 수 없게 만드네요 그리고 김남길 배우와 김설현 배우의 연기도 흠 잡을 데 없습니다 꼭 꼭 보시길 추천해요  
20170901,10,어제 시사회로 보고 왔습니다 생각 이상으로 영화 잘 빠졌고 스토리는 물론 주조연 배우들 모두 연기 쩔어줍니다 영화 보는 내내 웃었다 울었다 긴장했다 무서워했다 롤코 장난아니에요 다시 한번 더 극장에서 보고싶어요!  
20170901,10,"설경구와 김남길의 연기는 단연 최고! 설현의 연기 실력은 정말 놀랐다. 연기 너무너무 잘하더라ㅜㅜ 숨막히는 전개에 감탄... 정말 지루하지 않고 재밌게, 시간 가는 줄 모르고 봤다. 살기법 화이팅!!  "
20170901,8,지루할 새 없는 영화. 감독도 배우도 베테랑이라서 어설프지 않다.  
20170901,10,최고예요^_^ 너무 재밌게 봤어요!! 배우님들 연기도 장난아닙니당~  
20170901,10,설경구 배우님 연기 기대합니다!!  
20170901,10,너무너무너무 재미있었다 설경구는 완전 신들렸고 김남길과 설현의 연기도 부족함 없었다 간만에 괜찮은 영화 나온듯  
20170901,10,"먼저 보았는데, 생각보다 수작이었고 소설과는 또 다른 매력을 가지고 있었어요 또 보고싶음!  "
20170901,10,"오늘 시사회로 영화도 보고왔습니다! 원작 나름대로의 매력도 있지만 영화화 된 내용이 너무 재밌고, 숨 죽이고 볼 정도로 몰입 됐습니다. 배우 세분의 합도 정말 좋았고 설경구 배우님의 연기가 정말 최고였어요! 다시한번 보고 싶어지는 영화입니다 강추해요!  "
20170901,10,설경구씨 연기 기대되네요  
20170901,9,중간에 들어간 유머가 자연스러운 게 인상적. 여성 캐릭터 사용이 아쉽긴한데 이 영화만의 문제는 아닌듯. 주조연 배우들의 연기가 대단함. 김남길 배우를 다시 봤고 설경구 배우는 완전히 캐릭터와 한 몸처럼 느껴짐. 설현 배우도 아주 괜찮았음.  
20170901,10,원작을 안읽고 영화를 먼저 봤어요. 책까지 궁금해지네요! 설경구 김남길 설현 누구하나 빠지지 않고 연기 잘 하신듯! 특히 설경구님은 빠지는 부분이 거이 없을 정도에요! 재밌게 잘 봤습니다. 푹 빠져서 웃고 울며 본 영화였어요!  
20170901,10,먼저 보고왔는데 쇼박스에서 왜 이렇게 홍보하는지 알것같아요ㅎㅎ 영화 좋았고 대중적이면서도 연기가 꽤 좋아서일까 그저그렇다는 느낌은 안들었구요 배우들과 작품의케미까지 좋았어요! 그리고  당신편이라 행복합니다!  
20170901,10,설경구 배우님의 연기가 무척 궁금하다 영화는 원작과 다를 거라니 더 기대되고 2번 이상 볼 것임!!  
20170901,10,시사회 보고 왔는데 설경구 설현 김남길 주연배우 전부 연기 대박임!!! 개봉날 한번더 보겠습니다.  
20170901,10,오늘 특별상영회 다녀왔습니다~ 어둡고 무거운 카타르시스만 있겠지 했는데 의외로 빵 터지고 여운이 긴 영화입니다. 배우들 연기가 완벽히 부족하지도 넘치지도 않아 좋았구요! 특히 설경구 배우님은 또 다른 인격체 그 자체셔서 감탄을 금치 못했어요 강추입니다  
20170901,10,설경구님 연기가 너무 기대돼요!!  
20170901,10,김남길 설경구 나오는거면 연기는 끝내줄것같아요설현도 궁금합니다  
20170901,10,흑 너무 기대된다 빨리 개봉했으면....!  
20170901,10,설경구배우님과 김남길배우님의 연기가 기대되는영화! 얼른 개봉했으면  
20170831,10,"중반부터 반전의 연속이고 설경구의 알츠하이머 연기 대단하다.. 눈 경련오는것까지 연기하다니 .. 원작 안보고가도 전혀 무리없고 ,  살인보다는 '기억',  그리고 부성애에 초점이 맞춰진듯.  "
20170831,10,오늘 시사회 갔다왔음 평론가들 평이 좋아서 잔뜩 기대하고 갔는데도 엄청 재밌었던 영화.영상미도 많이 신경썼고 무엇보다 배우들의 연기가 압도적. 설경구 김남길 연기잘하는건 이미 알고 있고 설현도 굉장히 많이 노력한게 눈에 보여서 좋았다.  
20170831,9,오늘 시사회로 보고왔어요 다들 연기가 정말.. 시간이 금방가는 영화입니다 꼭 보세요!  
20170831,10, 원래 눈물이많어서 오늘 정말 많이 울었어요 그치만 아직 이해못한부분과 놓친부분이 많아서 n차관람 필수로 하게 될 것 같네요 설배우님 너무사랑하고 설현님 연기 진짜 자연스럽고 좋았고 남길배우님 또다른 이미지 멋있었습니다!!!  
20170831,10,설경구의 하드캐리! 원신연의 연출력! 대박조짐 살인자의 기억법  
20170831,1,네다음 가정파탄범 나오세요~  
20170831,10,개봉 얼마 안 남았네요 개봉 당일에 보러가려고 기다리는 중입니다! 설경구 배우님이 영화 본 다음에 책 보는 걸 추천한다고 하셔서 책도 아껴두는 중 .. 대박 나자 살기법!  
20170831,10,저 오늘 시사회로 보고 왔는데 진짜 대박이네요....소오름....마지막 결말 대체 무슨 의미일까 아무나 붙잡고 얘기하고 의견 나누고 싶음 ㅜㅜ  
20170831,10,믿고보는 설배우님 영화 싸랑합니다 :-)  
20170831,10,"숨막히게 봤습니다. 설경구, 김설현, 김남길 배우님들의 열연이 돋보이며 원작과는 다른 진행으로 끊임없이 집중해야했네요. 영화가 끝나고 탄식과 동시에 와 대박.. 내가 뭘 본거지? 와... 소리가 절로 나왔네요ㅜㅜ 살기법 화이팅 니 기억을 믿지마라!  "
20170831,10,설경구 치열하게 고민하고 노력했네요 김남길은 눈동자까지도 연기하는게 대단해요 설현은 두 배우에 못지 않아요 너무나 열심히 만든 영화라는게 느껴지는 작품이었어요 올해 본 영화 중에 손에 꼽아요 영화 좋았습니다  
20170831,10,정말 많이 기대하고있습니다~!!!! 살기법 뽜이링~!!~!!!!+  
20170831,10,시사회로 보고왔습니다. 영화 전체를 이끌언가는 설경구 배우의 연기에 놀랐습니다. 설경구 배우라기보다 정말 70대 치매노인 김병수로 보이군요..김남길 배우의 연기는 말할 것 없고 설현 배우님 연기도 좋았습니다. 소설과 또 다른 매력...심리스릴러 강추요  
20170831,10,"몰입시키는 힘이 굉장한 영화였고, 무겁지 않지만 그렇다고 너무 가볍지도 않은 유머코드들도 좋았습니다. 설경구씨의 연기는 정말이지 대단했습니다. 설경구 없고, 김병수만 있었습니다. 김남길씨, 설현씨 연기도 정말 훌륭했습니다. 살기법 대박났으면 좋겠네요!  "
20170831,10,올 가을 괜찮은 스릴러 연기들이 좋다  
20170831,10,시사회 참석해서 영화 봤습니다. 소설과는 전개가 다르니 소설보셔도 영화도 재밌게 관람하실수 있으실거에요  소설도 재밌고 영화도 또다른 매력이 있으니 추천합니다. 배우님들 연기는 모두 잘하시니 걱정할필요 없습니다.  
20170831,10,몰입감 개쩔고 올해 한국 영화 중에 제일 나음  
20170831,10,오늘 시사회에서 보고 왔는데 하반기에 가장 기억에 남는 강렬한 영화가 될 것 같습니다. 원작 읽고 한번 더 보려고요  
20170831,10,와 이거는 진짜 함 봐야됨 ㅇㅇ  
20170831,8,만듦새가괜찮아요. 최근 한국영화중에선 가장 볼만한듯 합니다. 배우들의 연기 훌륭합니다.  
20170831,10,설경구는 연기의신이다  
20170831,10,"설경구, 김남길. 두말할 것 없는 연기  "
20170831,10,개봉 전부터 기대되는 영화! 설경구는 연기의 신이다  
20170831,7,오늘시사회로 봤고 원작은 못읽어봤지만 영화 잘 나왔네요 긴장감을 놓지 않고 봤습니다 설경구 연기는 너무 좋고 김남길도 연기 너무 잘하시고 설현은 솔직히 좀 걱정했는데 정말 괜찮아요 개인적으로 아이돌출신배우에대한 편견이 계속 있었는데 이젠 버려도될듯ㅋㅋ  
20170831,10,끝으로 갈수록 휘몰아친다는 표현이 가장 적절한 것 같습니다 주연 배우님들 모두 연기 정말 좋았어요 꼭 보셨으면 합니다  
20170831,10,설경구 믿고본다원작소설도 진짜 재밌다고 하던데 영화보고 볼려구 꾹 참는중  
20170831,10,긴장감이 끝까지 가는 영화에요. 마지막 반전도 있고 설경구 배우님 연기가 진짜 OOO기입니다. 몰입할 수밖에 없게 만들어요. 꼭 한번 보시길 추천해요.  
20170831,10,시사회로 봤는데 올해 본 영화 중에 손에 꼽는다. 병수와 같이 끊임없이 의심하며 보게 됨ㅋ 개봉하면 또 보러갈거다. 원작 안봐도 충분히 즐길 수 있음. 연기측면으로는 명불허전 설경구다 그의 연기에 실패란 없다. 그냥 이 영화에는 연기 구멍이 없다.  
20170831,10,오늘 시사회 보고 왔습니다 배우들의 연기력이 마지막까지 관객으로 하여금 어느 쪽도 믿지 못하게 만들더군요 빠른 속도감과 중간 중간 긴장감과 유머 사이의 균형이 좋아 지루하지 않게 몰입할 수 있었습니다  
20170831,10,원작도 재밌게 본지라 너무 기대되네요! 주연배우들 연기야 믿고 봅니다~  
20170831,10,시사회로 먼저 봤는데 정말 기대 이상이었습니다.. 최고의 배우님들이 연기하셔서 그런지 시간가는 줄도 모르고빠져들어서 봤네요ㅠㅠ대박나세요!!!  
20170831,10,오늘 시사회에서 봤습니다. 끝나자마자 소름돋아서 와.... 싶었고 자동으로 박수가 나오더군요. 잘 될 영화인 것 같습니다.  
20170831,10,"속도감의 완급조절, 색감, 호흡, 연출, 연기 모두 좋았다. 명불허전 설경구라는 말이 나오게하는 설경구의 연기. 책을 읽고가도 결말을 생각할 겨를 없는 흡입력. 읽고가도 무방. 설현 연기 걱정 안해도 됨. 영화가 따라오라는대로 잘 따라가길  "
20170831,10,"배우 설경구, 김남길, 설현, 오달수 네 명의 연기의 어울러짐!액션장인 원신연 감독! 원작과는 또 다른 느낌으로 살인자의 기억법을 느낄 수 있어서 좋았다!!! 설경구는 연기의 신!!!! -시사회 다녀온 1人-  "
20170831,9,이 영화는 단 한마디로 종합된다.끝까지 네 기억을 믿지 마라.  
20170831,10,"원작을 보고 봐도 안보고 봐도재밌는 영화. 시사회 보고 왔는데설경구,김남길 연기에 반했다  "
20170831,10,시사회보고왔는데 대박임... 원작을 읽은사람도 놀랄거고 안읽은사람도 놀랄듯 진짜 흡입력 쩔고 연기 거슬리는배우도 없었고 아됐고 걍 대박임  
20170831,10,소설을 리메이크 하는게 결코 쉬운 일이 아니었을 것 같은데 정말 잘 옮겼네요 설경구와 김남길의 연기도 놀라움 영화의 배경까지 매력적인 영화입니다  
20170831,10,오늘 팬시사회 후기 보고 너무너무 궁금해졌어요!!!! 꼭 봅니다!!!!  
20170831,10,"끝까지 긴장을 풀 수가 없다. 그만큼 영화의 몰입도는 최강!! 설경구, 김남길, 설현. 이 세배우의 연기는 말할필요도 없이 대단하다!!!! 후반부로 갈수록 더더욱 재미있어지는 영화.!!  "
20170831,10,시사회 평을 보니 더더욱 기대가 됩니다. 설현씨의 새로운 모습도 기대되네요. 응원합니다!  
20170831,10,설경구라는 연기의 신과 다채로움이 묻어나는 김남길이라는 배우가 만났다. 거기에 김영하 베스트셀러 원작이라니. 보지 않을 이유가 없다. 봐야한다.  
20170831,10,시사회 보고 왔습니다 설경구 배우님 최고의 연기 최고의 배우 최고의 영화 추천합니다  
20170831,10,기억을 믿지마라!!!  
20170831,10,정말 쫄깃한 긴장감과 엄청난 몰입감.. 후반부로 갈수록 배우들의 연기가 엄청나게 폭발합니다 꼭 보세요  
20170831,9,캐스팅은 좋은데 설현 뭔가요 ..  
20170831,10,설경구씨연기력은 최고다  
20170831,10,영화 너무 기대됩니다 배우 여러분 화이팅!!!  
20170831,1,설현이 노출이 없다길래..볼생각없음.  
20170831,7,볼만은한데 영화관가서 보기에는 지루하네요.결과도 예측가능하구요. 설경구  연기는 정말 잘하네요.^^  
20170831,10,설경구씨 연기변신 너무 기대됩니다..  
20170831,8,기대된다 기대되... 다 된 밥에 설현 빠트리기만 되지 말아다오.  
20170830,10,설경구 김남길 조합 좋은데 괜히 어정쩡하게 나온 설현이 영화의 초를 안쳤으면 하는 바람.  
20170830,1,설경구의 식상한 표정연기  
20170830,10,시사회보고왔는데 너무 재미있네요 원작을 정말 잘살림  
20170829,1,설현떄문에 1점 놓고 갑니다.  
20170829,1,한국영화가 이래서 안돼  
20170829,1,살인범에게 감정이입해야 되는 영화?  
20170829,1,오달수가 왜 나옵니까 이런 정극에...아...보다 또 아...이럴듯.  
20170829,10,설현누나 땜에 볼까 생각중 제가 aoa 광팬이라서  
20170829,7,김남길님이 아깝다.   왜 저런분들 하고 이런영활  하셨나요.   캐스팅 화려한 영화는 이유가 있는듯.  
20170829,10,설현때문에본다  설현 사랑합니다 ♡  
20170829,1,"연기바들을 갖다쓰라고,설현같은애말고-)ㅡㅡ감독도 인기빨로가네이준익감독처럼 숨은 연기자들을 찾아야지..ㅉㅉ  "
20170829,10,아직 개봉하지도 않았는데 평점테러 하지 맙시다.  
20170829,3,또한번 경구는 몸을 안사리고 처절히 찢겨졌지만 냉소한 세상은 그에게 돌을 던졌다  
20170829,10,설경구 연기 미쳤네 원작스토리를 각색으로 엄청나게 잘 살린 것 같다. 대박이다.  
20170829,1,설현ㅋㅋㅋ강남1970에서도 썩은연기 보여주더만 이번엔 어떤 연기 보여줄까ㅎㅎ  
20170829,1,"다된 밥에 설현뿌리기... 작가도 좋아하고 설경구, 김남길 다 좋아해서 정말 기대했는데, , 설현 나온다는 말에 기대감 급 다운,.낄끼빠빠.. 영화 격이 확 떨어졌다.. 차라리 연기 경력이라도 있는 수지를 넣든가 ㅡㅡ  참고로 나 남자임..ㅡㅡ  "
20170829,10,김남길 배우님이 싸이코 연기를 할 것만 같은...  
20170829,10,포스터가 혹성탈출인줄...  
20170829,6,대한민국에선 원작을 넘는 영화는 없었다.. 이것또한 그럴것이다!!  
20170829,5,근데 왜 하필 설현이냐..  
20170829,10,참고로 원작과 설정만 같고 중후반부는 다르다고 합니다.  김영하 작가님 알쓸신잡에서 보고 좋아하게 되어서 기대되네요~  
20170829,1,설경구도 이제 퇴물이 되었다  
20170829,1,아 연기진들 좋은데 믿고거르는 설경구라 다음에 무료로 틀어주면 봐야겠다  
20170829,10,김남길 설경구 좋아하는데 단지 흥행만을 위해서 연기력 검증 안됀 아이돌 좀 안너었으면 좋겠다 설리 설현 이런애들  
20170829,10,설현 아이돌이라고 욕먹네 ㅋㅋ 연기하는건 봣냐?  
20170829,1,출연진에 설현 보는 순간..안 봐야겠다는 생각이...몰입도 떨어지네.  
20170829,7,설경구.. 연기는 좋은데 작품 고르는 센스가;; 이번엔 진짜 멋진 연기 보여쥬길!!  
20170829,10,설경구 도약작이 되길 바랍니다.  
20170829,10,아이돌 안넣으면 투자를 못받냐??작품은 충분히 기대가 되는데 연기 구멍 큰거 하나가 있네...걱정이다. 원작에서의 비중이 그렇게 크진 않아 다행이지만..  
20170829,1,누구땜에 보기 불편하다 진짜...  
20170829,2,설경구씨는 점점  가식적으로 보여서 몰입이 안되어  피하고 싶어요. 참 좋아하는 배우였는데 이젠 도저히 볼 수가 없네요. 사람은 인성이 얼굴에 나타나게 되나봐요. 마음 잘 다스리며 살아야겠어요.  
20170829,1,기대에 못미친다. 설경구 그이미지 그대로임.  
20170829,1,설경구 연기가 다 똑같음...다 강철중이여  
20170829,10,설경구 짱 기대할게요 김남길도  
20170829,1,걸작만들영화에 왜 아이돌 쓰냐  
20170829,1,원신연 감독은 구타 유발자 이후 모든 작품이 별로 감각과 감성이별루  
20170828,8,예고편 설경구 연기오지네 ....ㅡㅡ  
20170828,4,딴 이야기네 냉정하게 책이랑 별개의 영화다 책에 뭐가 용선인지 모르네 살인자가 치매인 소재만 갖다썼다 각색 누가 했냐!글구 요기 댓글 알바들 다 잡아가라 좀!! 그네 국정농단 댓글부대같네 이것들  
20170828,6,설현이 나온다면 무조건 봐야겠다 설경구는 덤이다  
20170828,1,"원작 봤는데 원작 씹노잼, 아마 영화도 씹노잼일것같다. 전부 치매노인의 망상  "
20170828,1,원작 건드리지 말지....  
20170828,10,김남길 연기 기대되요!  
20170828,10,김남길의 그 미친듯한 연기 기대됩니다... 5년전인가 나쁜남자의 심건욱이나 비담같은 내면연기보고 정말 크게 될 배우라고 생각했는데 역시.. 기대합니다!  
20170828,10,요즘 국산영화가 하나같이  너무 뻔하고 진부한 소재들 영화만 난무해서 심심했는데... 모처럼 색다른 소재의 영화가 나온 것 같네요.  설경구 영화중에 있는 나의 역대작 오아시스처럼 소름끼치는 영화이기 바라면서 개봉하면 꼬옥 보리다. 기대점수 별5  
20170828,1,주연 배우들 보니깐 기대치가 떨어지네...  
20170828,9,청불이길 바랍니다 애들이 볼만한 주제는 아니지요 괜히설현땜시 애들보게 등급을 낮게 찍었다면 난 안보렵니다  
20170827,10,배우때문에 평점테러하지말자. 이거 소설도 되게 재미있어서 기대됨  
20170827,4,박평식 5준다는데에 내돈모두와 내손모가지를 건다 너는 무엇을걸래 ???  
20170827,10,이 모든게 치매 노인(김병수)의 망상이였다니...혼란스럽다 ... 영화 기대 하겠습니다.  
20170827,5,설현이왜껴있을까??연기못하는애들껴있으면몰입감떨어질텐데  
20170827,1,무슨 연기를 해도 강철중이네 ㅋ  
20170827,7,설현 빼고 다 기대된다.  
20170827,1,경구형 왜케 늙은거여~ㅜㅠ  
20170827,10,메멘토가 생각나네요~~  
20170827,5,아..설경구랑 줄거리때문에 볼랬는데 여주가..아이돌이냐 왜...여배우가 없어? ....편견버리고 볼테니 연기잘하면좋겠다..ㅠㅠ  
20170827,1,또 아이돌 영화인가.. 이제 한국영화는 아이돌 넣지 않으면 허전한가 봅니다.  
20170826,7,왠지 보는내내 짜증과 발암을 이르킬것같다 그리고 설횬의 연기가기대되지않음...근데 다른 남자배우들은 보고싶다  
20170826,1,음 잘모르겠습니다 과연  
20170826,5,전반적으로 보고 싶은 영화인데 여자주인공이 누구인줄 알고 망설여진다.  연기력이 뛰어난 여주인공이었었다면...  
20170826,1,설현은 뭐냐 ㅋㅋ 아이돌을 주연감으로 쓰다니  차라히 민아를 써라;  
20170826,7,아이돌은 박힌 이미지 때문에 몰입 방해하던데 왜 하필...  
20170826,9,슬프지만 추악하고 몰입된다  
20170826,10,설현 언니 화이팅! 아자  
20170826,10,설경구씨와 김남길씨가 그렇게 노력했다는 점... 분명 먼가 있는 영화일듯 싶네요.. 스토리는 너무맘에 듭니다. 기대만빵입니다. 설현씨만 연기를 검증해볼 만 한 ..암튼 기대만빵  
20170826,10,최고의 연기 최고의 배우 최고의 명작이다. 이경구  
20170826,1,"설경구, 설현에서 거른다.  "
20170826,4,포스터 부터 글렀다 영화라는 다른 차원의 이야기지만 . 그냥 소설로 읽고 느끼세요  
20170825,10,믿고 보는 연기의 신 설경구!! 아 이번 작품 엄청 기대됩니다! 빨리 보고싶어요!  
20170825,7,강철중 기대합니다 ㅋㅋㅋ  
20170825,1,믿고거르는  설경구... &   김명민....  
20170825,9,여러분 책을 먼저 보시는걸 추천드려요 진짜 진짜 최고입니다 영화로 어떻게 표현될지 궁금하기도 하고 이게 될까? 라는 생각이 들만큼 책이 정말 최고입니다그리고 딸 은희를 어떻게 잘 나타냈는지 궁금하기도 하네요  
20170825,1,설현이 과연 주연감일까..절대적인비호감이다.  
20170825,9,아니 다좋은데 설현 왜넣음?  
20170825,1,배우보고 기대치가 사라졌다. 원작은 재밌음  
20170824,10,최고원작에 정말 잘하는감독~ 전문가가 인정하는 배우 설경구~ 오달수. 설현 보는 재미는 덤이다....  
20170824,10,이거 소설 원작도 재밌음 얇아서 읽기 편함 읽어보시고 영화ㄱㄱ 기대된닼ㅋㅋ  
20170824,5,김남길 오달수에 설경구 설현을 끼얹으면 반반이니 별5개는 드려야죠  
20170824,9,믿고 볼수 있을듯..ㅇㅇ  
20170824,1,설씨 생긴거 극혐...  
20170824,9,"애써 섣불리 판단 하면 안 된다고 생각한다 또한 주연을 비판적으로 말하는 사람들을 여자로 싸잡아서 보적보 이 OO하는 새끼들도 다를 바 없다 생각도 없고 여자라는 증거도 없는데 력시 보적보 쿰척,,! 메가려냬! 하여간 냄져들이란ㅋㅋ OO도 아니궁ㅠㅠ  "
20170824,10,남자아이돌 xx 주연: 어맛 기대돼//설현 주연: 다된밥에 설현뿌리기 보적보지림  
20170824,1,설경구 나와서 보기싫음  
20170823,1,예고편보니 또 강철중이 생각나네요  시간되면 다운 받아서 볼께요  
20170823,10,기대됩니다. 기대됩니다. 기대됩니다.  
20170823,5,다된 영화에 설현뿌리기..개인적으로 설현분량 적었으면 한다  
20170823,5,설경구는 기억남는게 깡패같은경찰이나 그냥깡패같은 연기밖에 할줄모르는거 같은데 떠련이는 발성을 말하듯편한한 발성이아니라 정말 평소 말하는것처럼하고  
20170823,5,설경구는 기억남는게 깡패같은경찰이나 그냥깡패같은 연기밖에 할줄모르는거 같은데 떠련이는 발성을 말하듯편한한 발성이아니라 정말 평소 말하는것처럼하고  
20170823,8,경구형 간만에 제대로 한건합시다~~  
20170823,10,설경구님 연기 기대하고 있습니다. 쵝오!!!  
20170823,10,소재가 취향이라서 퐁당퐁당이길 바라며 10점.. 지극히 개인적으로 세븐데이즈 꿀잼 용의자 노잼이었기 때문에.. 카메라는 덜 흔들렸음 좋겠어요 눈 아파여  
20170823,10,ㅋㅋㅋ 설현 나온다고 메갈녀들 난리 났네  
20170823,1,배우보고 영화보는것들 역시 니들수준하고는  이거 소설 빼긴영화아니냐 설현 연기 존나 못하더만  
20170823,9,설현 까봐야알겠지만 일단 이미지는 어울리는듯  
20170823,10,설경구도 날이 갈수록 더 중후하고 멋지게 세월을 맞는거 같다..살인마 VS 살인마 구도일거 같은데..김남길도 김남길이지만 설경구가 더 매력적이게 다가오는 예고편..기대된다!!  
20170823,4,설현때문에 집중도 떨어질까봐 책으로 읽음결국 딸도 아빠가 죽임 ㅋ  
20170823,10,"덥, 똑카라! 덩부하쟤  "
20170823,10,세븐데이즈 쩔었는데. 김남길과 설경구!!  
20170823,8,생각없이 보면 재미있습니다.  
20170823,7,다된영화에 설현 끼얹기 이거 무엇? 뒷돈의 냄새가..  
20170823,1,설현 믿고거른다 오렌지마말레이드였나 거기드라마보고 개충격먹어서ㅋㅋㅋㅋ니는 연기를 하지마 제발 얼굴몸매 괜찮은데 왜 연기를하려들어  
20170823,1,"설현은 왜나오는지도 모르겠지만 수익,홍보문제니 어쩔수없고 제끼고 설경구는 하...소설읽어보면 나오지만 저런캐릭터가 아님 캐릭터 분석좀해라진짜 매냥 똑같은연기 지멋대로 캐릭터바꾸기 소설은 읽어봤는지 궁금하네  "
20170822,1,맨날같은설경구연기..  
20170822,5,"원작은 병주(설경구)의 독백, 소위 말하는 1인칭주인공시점으로 진행되는데 이 뚝뚝 끊기는 생각의 나열들을 어떤 영상과 연기로 표현할 수 있을지 궁금하네요.  "
20170822,10,설경구가 주연이라니 너무나 기대된다  
20170822,10,소설책에서는 연쇄살인범이 치매걸려서 벌인 살인사건인데 영화에서도 주인공이 범인일까? 김남길은 진짜형사로 나오고  
20170822,9,설경구 요새 하는영화마다 잘 안됬는데 이번에는 대박나길 바랍니다 김남길 설경구 연기력이야 믿고보지만 설현의 연기력이 이번 영화에 큰 영향을 미칠꺼같네요  
20170822,10,떠려니 누나 화이팅~^^  
20170821,1,싼티나는 발연기 설현을 왜 끼워 놨는가?!그것도 조연이 아닌 주연으로;; ㅉㅉㅉ  
