0,1,2
20170227,1,잘못된 신념임. 총이 있기에 서로 존중하는 거다. 눈마주치면 눈인사하는 문화를 있게 한 것이 총기다. 반대로 헬조선봐라. 총이 없으니 상호간의 존중이 없다. 눈 마주치면 마 꼬라봤나 하면서 시비거는 게 헬센징들이다. 총이 있어야 사람 귀한 줄 안다.  
20170227,9,지루한 소재로 이런 사이다를 만들어 내다니  
20170223,10,제시카 차스테인이라니 기대되네 스토리도 괜찮은 것 같고  
20170223,10,새벽에 진짜 명작하나보고간다 .. 제시카 매력 오진다오져..  
20170222,10,한 번 사는 인생 저렇게 살아야겠다...  
20170222,10,"하수를 가지고 노는 고수의 이야기,아 그리고 제시카 차스테인은 여전히 이쁘다.ㅎㅎ  "
20170220,10,10수를 앞서 내다보는 놀라운 수작.  제시카 차스테인의 실제모습을 본듯하다.  
20170220,9,"와, 방금 봤는데 정신이 번뜩 든다. 웰메이드 정치영화!!!  "
20170219,9,몰입도 높은 수작 여배우도 너무 매력적~  
20170218,9,"머니몬스터 조지클루니, 미스슬로운 제시카챠스테인 괴짜 이야기, 내 취향  "
20170218,7,그래... 저 정도 할려면 잠 안 자야겠네...  
20170217,10,오늘만큼은 정치드라마중 최고의 Storytelling  
20170217,5,제시카 차스테인의 일방적 하드 캐리  
20161002,10,제시카 차스테인- 기대되는 영화  
