0,1,2
20170328,6,흔치 않은 소재에 잔잔한 흡입력  
20170328,10,새로운 여성 캐릭터. 너무나 철저하고 명석한 두뇌가 부럽다.마지막 반전에서는 소오름.  
20170328,10,"헐헐헐, 대박대박대박 하면서 봤다.  "
20170327,10,시사회로 오늘 보고 왔어요 처음에는 약간 지루할 수 있는데 그 부분만 참고 서서히 중반으로 가면 이야기가 빠르게 진행 되면서 굉장히 재미있어요 마지막까지 정말 긴장을 늦추지 못했네요 특히 주인공의 연기가 정말 최고입니다!!!  
20170327,10,130분이 넘는 시간동안 지루할틈없이 빠져들어봤습니다오랜만에 정말 만족할만한 영화였습니다  
20170327,10,흡입력이 장난아닙니다.. 정말 재밌게 봤어요!  
20170327,10,마지막 한방... 캬...  
20170327,10,다시보기 할것임~꼭...  
20170327,8,로비스트 세계를 간접적으로 보여준 영화  
20170327,8,멋진 영화 빠른 스피드 잼나요  
20170327,10,넘 재밌어요ㅠㅠ 제시카 차스테인 연기 미쳤음ㅠㅠ꼭 보세요!!  
20170327,9,시기적절하다 여주인공 연기력이 돋보임  
20170327,8,너무 멋진 영화 잘봤습니다.  
20170327,10,연기와 미장센의 조화가 놀라운 영화.  
20170327,10,"[시사회 관람평]빈틈없는 전개, 숨막히는 연기  "
20170327,10,보는 사람 지치게 만드는 영화  
20170327,8,확실히게 뭔지 끝까지 가봐야 승부도...  
20170327,8,반전과 치열한 싸움을 담은 영화~~  
20170327,10,반전쩌는영화 몇수는 앞을 내다본 여주인공  
20170327,10,보는내내 집중 하면서 봐야한다  
20170327,10,이 영화 정말 반전을 알면 엄청 두뇌에 주름이 갈라질거다 정말 엄청나다  
20170327,10,되게 어렵지만 치열했던 영화!!  
20170327,10,무지 재미있어요^^~  
20170327,9,조금 전개가 빨라서 어렵지만 잘봤습니다  
20170327,10,시라리오. 그리고 배우들의 꽉찬 연기. 압도하네요 하하하!!  
20170327,10,진짜 소름...반전 최고액션영화만 보는 나도 넋놓고봄하나하나 뒤통수치는 전개 최고  
20170327,7,'엎어 진 줄 알았지만 서 있었고 마지막까지 뒷면인지 앞면인지 손을 펴봐도 알 수 없다.  
20170327,9,반전이 좋은 영화군요 좋았습습니다  
20170327,8,꽤나 흥미로운 내용이었고 전개방식도 맘에 드네요  
20170327,9,그녀의 연기에 대한 기대로 보기엔 너무도 아까운 영화! 반전 또 반전. 최소 두번 보세요  
20170327,10,재밌어요 다시 보고싶어요  
20170327,10,반전에ㅡ반전 예상 밖의 걀말!!  
20170327,10,이거 꼭 보세요 반전 대박!!  
20170327,10,반전의 반전 한시도 눈을 뗄수없는 영화였습니다!!  
20170327,10,차스테인은 연기의 신이다 !!!!  
20170327,10,제시카의 명연기 !!! 두번도 볼 영화 ~~ 내용이 조금 어렵지만 마지막 반전 굳!!  
20170327,10,쉴 새 없이 몰아치는 전개!! 굿이네!!  
20170327,9,주인공 연기가 정말 뛰어나고 스토리도 탄탄하네요쪼  
20170327,8,마지막의 시원한 반전이 최고!!ㅋㅋㅋ 엄청나게 똑똑한 여주ㅋㅋㅋ  
20170327,8,긴 영화인데 지루하지도 않고 긴장감 넘쳐서 재밌게 봤어요!! 제시카 차스테인 연기  마지막에 소름돋았어요!  
20170327,10,반전의 반전의 연속인 영화 정말 재미있게 봤습니다!  
20170327,10,오랜만에 보는 명작이었습니다 꼭 보시길 추천드립다  
20170327,9,재미있어요 시간가는줄 몰랐어요  
20170327,9,아주 잼있었습니다. 반전 좋았네요  
20170327,8,로비스트가 보여준 모범시민  
20170327,10,긴박감 넘치는 스토리에 짜릿한 반전 넘치는 결말!! 진짜 보길 잘했네요.  
20170327,9,중반까지는 빠른 대사에 눈이 바빴는데 점점 긴장의 연속에 여주인공의 매력에 흠뻑 빠져든다  
20170327,10,길지만 재미나게 봣어요 ㅋㅋ  
20170327,10,완전 통쾌하고멋있네요  
20170327,9,런닝타임이 전혀 지겹게 느껴지지 않는 몰입감이 진짜 최고!! 특별한 액션신도 없이 2시간의 런닝타임이 순식간에 지나간다!!  
20170327,10,시간 가는줄 몰랐어요 존잼!bb  
20170327,10,흥미진진하게 잘봤어요 반전짱!  
20170327,10,미스슬로운 정말최고에요 많이추천할께요  
20170327,10,최고입니다 최고의 영화예요 꼭 보세요 정말 후회없숩니다. 전 또 볼겁니다.  
20170327,10,넘나잼밌어용 재밌어요 정말정말  
20170327,10,정말정말 잼있어요~!!  
20170327,9,총기 규제를 둘러싼 미국 사회 이면의 예민한 부분을 잘 다룬 것 같습니다. 추천!  
20170327,10,재미났어요 다시 보고 싶었어요  
20170327,9,법에 대해 관심이 많은 사람으로써 재밌게 봤어요~!반전에 반전 좋아요!!  
20170327,9,참스릴이있고 통쾌하고 짜릿했어요~^^  
20170327,9,총기법안을 상대로 멋진한방을 남긴 그녀 미스 브라운  
20170327,8,걸크러쉬 쩔어요 ㅋㅋㅋ 멋진여자!! 흡입력쫑  
20170327,8,끝까지 긴장하게 만드는 영화.  
20170327,9,재밌고 또 빠져드는 매력적인 영화예요  
20170327,10,이벤트 당첨으로 보게됐는데 정말 걸크러쉬:)  
20170327,10,똑똑하게 사는게 맞는걸까  
20170327,10,재밌어요 미스슬로운 천재인듯ㅋㅋ통쾌하네요  
20170327,8,스릴감있고 재미있지만 ㄷ후반부로 갈수록 반전이잇고 소름끼쳐요  
20170327,10,완벽한 계획 끝내주는 슬로운 굿  
20170327,10,정말 영리한 영화! 너무 좋았어요ㅠㅠㅠㅠ  
20170327,9,시사회로봤는데 와우 연기력과 스토리 대단합니다  
20170327,10,영화 처음부터 끝까지 긴장을 놓치 못하게 함  
20170327,9,진지하게 그녀의 카리스마에 빠져들다  
20170327,10,회심의 한방 미스슬로운 모조건 간다  
20170327,10,로비스트의 냉혹한 세계를 엿볼 수 있는 영화시간이 너무 빨리 지나갈 정도로 몰입도가 높았던...  
20170327,10,인생영화 이거로 영어공부하자  
20170327,10,흥미진진 하고 제시카차스테인의연기가 훌륭하네요  
20170327,10,재미있었어요. 끝까지 ~  
20170327,10,엄청난 명작을 보고 갑니다 마지막이.대박  
20170327,9,연기력 대박...마지막까지 긴장감 있네요  
20170327,10,정말 똑똑한여성!! 너무 재밌고 흥미로웟어요~~ 후회하지않을영화!  
20170327,10,차스테인 원톱의 강렬한 영화  
20170327,10,이건진짜 여러번봐도 좋을 영화..시사회 봤지만 보러 꼭 와야겠는 영화!  
20170327,10,오랜만에 반전 완전 대박이네요.  꼭 보세요  
20170327,10,로비스트 그리고 여자. . . 멋지다.  통쾌했다  
20170327,10,아주 극적이네요. 매우 볼만한 영화네요.  
20170327,10,미스슬로운 정말 재미있고 흥미진진한 스토리입니다~정말 재미있게 잘 보았습니다.  
20170327,10,미스슬로운 제시카차스테인 영화 너무 재밌게 잘봤습니다  
20170327,10,너무나 매력적인 로비스트의 삶 기대됨.  
20170327,8,제시카차스테인의 출연만으로도!!  기대되는 영화!!거대권력에 맞서 싸우는 여전사^^  딱!!이다~  
20170327,10,이영화를 별로다하는사람들은 사회권력에 빌붙는 쥐새끼일 확률100%  
20170327,10,반전의 반전. 정말 탄탄한 각본  
20170327,6,초반엔 얘네 뭐하나 싶지만 결국 무슨 이야긴지 알게됨....그닥 뛰어난 흐름은 아님...  
20170326,8,이영화의 반전이 놀라운건 반전의 내용이 아니라 반전을 위해 자신까지 걸었다는점. 진짜 승부사다.  
20170326,7,완벽한 연출은 아니지만 매력적인 영화~!  제시카 차스테인은 정말 빛나는 보석~!  
20170326,9,시간 가는 줄 모르고 몰입했던 정치 자본주의와의 싸움이었어요.. 연기와 몰입력이 좋았습니다  
20170326,1,미국패권의 밑바탕이 군수산업이고 전국민의 총기소지인데 감성적 좌파영화라 ㅁㅈㅎ  
20170326,10,"정말 영화 매니아지만 오랜만에 제대로 영화를 본느낌. 제시카차스테인의 연기는 노미네이트되어야 할정도, 많은걸 느끼고 많은걸 생각하게된 영화, 단순히 고지식한 정치판이라고 여긴다면 평점은 당연히 낮을것이고 그 사람들은 다시한번 대사 하나하나 보기를 추천  "
20170325,6,진행이 느려서 피곤한게 아니고 진행이 빠르기만 해서 지루하다. 다 보고 나면 피곤만 남는다.  
20170325,10,꼭 두번은 보셔야 하는 영화.처음과 다음의 감상포인트가 완전히 바뀌는 아주 영리한 영화!  
20170324,10,"눈빛,목소리톤, 다 완벽했다 처음봤을땐 '와~' 다시 봤을땐 소름과 감동이 밀려왔다 엄청난 그녀의 연기력에 감탄했다..  "
20170324,10,자본 정치와 맞서 싸우는 현대판 다크히어로  
20170323,9,"스릴있는 전세역전, 지적 유희의 극치였다. 말빨 하나만으로 이런 스릴러(?)를 만들어내다니. 펄펄 날아다니는 차스테인의 연기와 스토리 라인이 인상깊다.  "
20170323,10,이야~ 걸작이다! 초중반 계속 알듯모를듯 슬로운이 잘하는건지 아닌지 헷갈리다가 마지막에 제대로 강펀치 한방 먹었다ㅋㅋ이욜! 멋있다! 제시카 인생연기 나온듯~ 그많은 대사와 연기 꽤나 어려웠을텐데..  
20170323,8,영리하게 짜여진 정치 스릴러. 끝까지 몰입감을 잃지않고 극을 이어나간다.  
20170322,7,말로 만든 블록버스터.  
20170322,6,2017년 최고의 액션 혀록버스터!!  
20170322,10,소름돋는 천재 로비스트이해안됐는데 나중에 정확히 이해하고나니까 소름..  
20170322,9,재밌었어요~! 연기 굳 bbbb 나름의 반전도 있네요~!  
20170322,8,긴장감 있는 미드같은 법정 드라마  
20170322,8,"오랜만에 영화다운 영화를 봤고, 제시카 차스타인의 연기는 최고였다.  "
20170322,10,카타르시스 느끼면서 본 영화 너무 오랜만이다  
20170322,8,여성 로비스트의 쾌거!  
20170322,8,다이해하기엔 내 독해실력이 부족해ㅠ내용은 굿  
20170322,9,제시카 차스테인의 작품중 최고  
20170322,9,쉴 틈 없이 몰아세우는 '대화형' 정치드라마. 제시카 차스테인의 연기는 언제나 옳다  
20170322,10,제시카 차스테인의 인생작! 인생연기 등극! 로비스트  완벽빙의!  
20170322,10,체시카 차스테인 냉철한 연기 좋으네요  
20170322,10,끝까지 긴장을 풀수 없는영화임! 마지막까지 재밌게 보고 왔어요!  
20170322,10,상상을 초월하는 로비의 신! 제시카 차스테인 걸크러쉬 후덜덜!  
20170322,7,자신을 탄환으로 삼을 줄 아는 제시카 차스테인.  
20170322,10,시간이 이렇게나 빨리 가다니  
20170322,9,반전에 반전 최고!입니다  
20170322,9,지루할 틈이 없는 말과 지략의 전쟁.  
20170322,9,잘봤어요 좋네요 재밌음  
20170322,10,정말 끝까지 집중하며 재미있어요  
20170322,9,영화 재미있게 봤습니다..  
20170321,10,기대 안하고 봤다가 인생영화 됨  
20170321,4,"발암물질은? 바로 많은 분량의 대사들... 끊임없이 이어지는 대사로 배우들 연기를 볼 수 없고...이건 미국이만을 위한 드라마지...대사도 이해하려하면 벌써 흐름은 저만치 가 있네.., 알바들이 이젠 지능적으로 긴평점을 남기는게 꼭 영화같다..  "
20170321,9,"""요즘 괜찮은 영화가 안나오네..."" 를 반전시킨 영화.  "
20170320,10,여배우 연기 엄청남  역시 아카데미여우후보재미 긴장감 그리고  반전까지대사 연기력으로  2시간 영화에 빠져들게 하네  
20170320,9,반전까지 기다려야 하는 영화  
20170320,9,무모함 뒤에 치밀함...한 방이란 것이 이런 것..  
20170320,8,충분히 즐길만한....  
20170319,10,정말 명작이네요 제시카차스테인 배우 원래 좋아했지만 이 영화를 보고 열렬한 팬이 되었습니다. 감독도 훌륭하지만 이건 제시카차스테인이라는 훌륭한 여배우의 힘으로 이끌어갔기 때문에 더 훌륭한 영화가 되었다고 생각합니다. 오래보고 싶은 배우네요 열일해주세요  
20170318,10,에이미아담스와 이번년도 역대작이었다.       차스테인 굿잡!!  
20170317,9,재밌어요!! 보세요~~~  
20170317,10,진짜 멋있었다 여자로서 방전된 야망을 엄청나게 자극하는 영화?  
20170316,10,제시카차스테인의 인생연기인거 같네요..영화도 좋고 연기도 좋았네요  
20170316,8,와 정말 마지막 빅 픽처가 대단합니다. 꼭 끝까지 보세요. 반전에 반전이 엄청납니다. 머리가 얼마나 빨리 회전해야 저렇게 될 수 있는지 모르겠어요. 감탄이 절로 나옵니다.  
20170316,7,끝없이 덮치고 덮는 암투  
20170316,10,너무재밋네여 미스슬로운 멋잇어요  
20170316,10,지루할 수도 있는 소재를 기막히게 풀어냈고 끝까지 예측할 수 없는 전개였습니다  
20170316,8,제시카 차스테인의 독주가 돋보이는 극. 치열한 법정공방도 두뇌싸움 덕에 즐겁게 관람했어요  
20170316,9,짱잼꿀잼핵잼!!!!  
20170316,10,나를 찾아줘의 소름돋는 반전이 여기서도 계속된다. 빅픽쳐의 결정판  
20170316,9,마지막에 완전 대박 반전  
20170316,10,미스슬로운 걸크러쉬b 나도 인생 저렇게 살고싶다 :-)  
20170316,10,지루할틈이 없음!!!한번 더보고 느껴야지!!  
20170316,8,단순한 로비나 심리전을 넘어선 강렬함이 있는 한 방.  
20170316,10,한 여자의 승리를 위한 무서움을 느낄수 있단 영화였습니다 -! 재밌게 봤습니다  
20170316,9,심각한 주제를 빠른 속도와 친절한 진행으로 풀어간다  
20170316,10,재밌어요. 두근두근. 멋진 걸크러쉬  
20170316,10,최고다 한번더보고싶어♡  
20170316,8,회심의 한방이 주는 쾌감!  
20170316,10,흥미진진하고 재밌옸어요  
20170316,10,진짜 재밋어요! 인생 캐릭터에용 제시카 차스테인  
20170316,10,반전에 반전에 반전. 마지막을 위한 큰 걸음이었네요. 잘봤습니다ㅎ  
20170316,10,흥미롭고 재미있게 봣습니다^^  
20170316,9,미스슬로운  간지 정말로 멋짐  
20170316,8,놀라운결말~~지루하지않은전개!!^^  
20170316,10,로비스트의 세계를 알수있아 좋았어요  
20170316,9,제시카 너무 멋졌어요~!!  
20170316,10,마지막 대사는 정말 좋았다. 미스 슬로은 완전 강추.  
20170316,7,"잠, 성적 욕망, 승리에 대한 갈망. 이 모든 욕망을 원하는 미스 슬로운. 총기규제는 그 껍데기일뿐  "
20170316,10,시사회로 봤는데 재밌어요! 여자 주인공이 넘나 매력적^^ 추천 합니다!  
20170316,10,제시카 차스테인 연기가 대박이에요  
20170316,8,시사회로 봤는데 빠른 전개로 지루하지 않고 재밌게 관람했습니다^.^  
20170316,9,사람을 리소스로 이용하는 냉혈한 로비스트의 삶을 보여준다. 아무에게도 계획을 가르쳐주지 않는 리더. 자신의 부하를 이용하는 리더. 이기기 위해 모든 것을 사용하는 리더 그것이 자신일 지라도... 그 리더가 가진 노력 고뇌 그리고 무게를 보여준다  
20170316,10,시사회로 보고 나왔는데 최고에요^^  
20170316,9,먼가 한방이 있을 거 같아는데 아는데도 소름ㅠㅠ제시카 차스테인 넘 멋있어ㅠㅠㅠ  
20170316,10,감사합니다 재미있게잘 봤습니다  
20170316,10,시사회로 봤는데 재밌게 잘봤어요!  
20170316,9,반전이 있는 영화~몰입도 있는 영화에요^^  
20170316,9,영화를 끌고 가는 제시카 차스테인의 힘  
20170316,9,위에서 내려보는듯한 영리함  
20170316,10,여자주인공이 캐리하는 영화  
20170316,10,"마지막 한방을 예상했지만, 그 방법은 도저히 상상할 수 없는 것이었다. 짜릿하다. 극장에서 제대로된 자막으로 보길 추천함.  "
20170316,10,"진짜 주인공 매력 쩔고, 영화 몰입도 개쩔고. 진짜 보기 드문 명작이다  "
20170316,10,"'명작은 이런것이다' 라는 것을 보여준 영화. 극 중 명대사는 단연 ""Lobbying is about Foresight. 로비는 선견지명이다."" 시시한 결말이나 열린 결말에 질렸던 분들이라면 이 영화를 무조건적으로 추천한다. 물론나도또볼거다  "
20170315,9,첨엔 어려운소재인듯했으나 보면서 빠져들다 마지막에 오와 햇네요 역시 사람은 겪어보고 그속을 알때그게 진짜다  
20170315,8,한국에선 이런영화가 흥행이 안되니 제작되기 힘들겠지만이런 영화볼때마다 헐리웃이 부럽다  
20170315,10,존잼꿀잼핵잼재미있쪄요  
20170315,10,인생에 옳고 그름은 정해진것이 아니라 방향을 잃지 않는한에 만들어 나갈수 있는 자신감!  
20170314,10,"""이기기위해"" 벌인 일인줄 알았는데, ""이겨야 하는일""이라 벌인 일이었어...짜릿했다.  "
20170314,1,여자가 나대는 영화 짱시름!!  
20170314,10,왜자꾸 현지에서 상영 끝나고 블루레이로 이미 발매까지 된 영화들이 스크린에 걸리는거지? 자막만 없다면 한국인은 못볼거란 생각인가? 영화는 꽤 재밋어요~  
20170314,10,와 진짜 제대로 한방 먹었다. 상당히 멋진 영화였다.  
20170314,9,놀라운 전개와 많은 대사량에 놀람. 여주는 어지간한 영화 10편의 대사를 읊음. 개런티 열배는 줘야할 판임.  
20170313,8,쉴 틈 없이 몰아치는 로비전쟁 드라마여주인공  혼자 극의 95%정도를 혼자서 이끌고 가면서 엄청난 양의 대사와 감정연기...여주인공 대박!!극의 95%정도를 혼자서 이끌고 가면서 엄청난 양의 대사와 감정연기...영화가 정  
20170313,10,선경지명 선경지명 선경지명  
20170313,10,대박일세  이영화...  
20170313,7,제시카 차테스인의 차가운 연기력이 어디까지 찔러올 것인가가 무척이나 기대된다.  
20170312,10,여주인공 진짜 매력 터진다... 핵 사이다~  
20170312,9,제시카차스테인의 연기력 하나로 자칫 지루할 수 있는내용을 전혀 지루하지않고 러닝타임이 길어질수록 몰입할 수 있도록 도와줌  
20170312,10,이영화는 내가 영화를 보는데 있어 더 넓은 시각을 가지게 했다고 평하고싶다. 조금 심심한듯 안심심한듯한 기승전부분도 결말의 소름돋는 스토리가 모두커버하며 스케일이 너무작은듯한데도 이렇게 영화의 여운이 남을수있고 2시간을 이끌어갈수있는것에놀라지않을수없다  
20170312,7,"초반엔 '왜저러지...'막판엔 '헐' 뇌르가즘영화라고 하는데, 이해하느라 뇌가 저림  "
20170312,10,영화 초반 왔더로 시작해 퍽으로 끝났다. 좋은의미에서~ 초반 왔더만 견디면 달콤한 빅엿을 선물받으리라.  
20170312,4,30분보다 그냥  꺼버렸슴..너무 지루하고 주인공이 너무 쓰레기여서 암걸릴꺼같았슴  
20170312,10,"몇몇 낮은 평점의 글들은 이 영화를 제대로 본건지 싶은 의심이 든다. 디테일을 알면 재미없으므로 한마디만 하겠다. ""일단 봐라. 그리고 끝까지 보길바란다""  "
20170311,7,목적이 수단을 정당화하고야 마는 치열한 두뇌 게임  
20170311,9,인터스텔라에 주인공이 누규??  
20170311,9,간만에 잼있게 봤네요.. 이런건 극장에서 봤으면 좋았을 것을..곧 개봉 하는데 또 보기도 그렇고 ㅋㅋ여튼 멋지네요  
20170311,10,미국스타일 무협지네 강호에 의리~  
20170311,1,한시간 넘도록 진행이없다.지겨워 ..평점에 낚였네  
20170311,10,그녀는 마지막까지 완벽한 승부사였다.  
20170311,10,처음부터 마지막까지 의도하고 한수를생각하면 그뒤의한수 로 모든걸 역전시키는 로비스트 영화 이기기 위해서 모든정보와 사람을 이용해서 판을짜고 그들만의 판위 의회에서 처음부터 계획된듯한 반전영화  
20170311,8,쓸데없는 대사가 너무 많다. 좀 더 묵직하게 갔더라면...기성용이 생각 나는 하루다.  
20170311,9,자본주의와 민주주의의 이종교배가 낳은 기형아. 아찔할 만큼 매혹적이다. 차여사의 인생작^^  
20170311,5,무언가를 바로 잡으려면 착한 사람만으로는 부족하다. 누군가는 눈물을 머금고 나쁜새끼가 되어야 한다. 그러나 흥미로운 주제에 비해  연출이 좀 지루. 클라이막스는 생뚱맞은 오버. 중간중간 반전을 위해서 희생한 씬들이 있다. 무게감 있으려 노력했다.  
20170310,10,영화 개오졌다 두시간을 여주혼자 끌어 가다니 진짜 대단하다. 마지막에 개소오름.  
20170310,7,여주인공의 매력은 정말 수준급이었지만 영화를 너무 이해하기 어렵게 만든 감이 없지 않아 있다. 정치계 문외한은 정말 감으로 영화가 어떻게 흘러가는지 때려맞춰야 한다. 다만 마지막에 속시원한 결말이 우리나라에서도 바로 오늘 일어난것 같아 너무 좋았다.  
20170310,10,"목적을 위해 수단과 방법을 가리지 않는다, 단 지킬것은 지키면서...  "
20170310,10,와 이거 진짜 최고다. 저런 사람이 진짜 애국자지...  
20170310,10,전혀 지루하지 않은 전개. 제시카차스테인의  me친연기  
20170310,10,마지막 짜릿함이란 최고!! 역대급 걸크러쉬  
20170310,10,시사로 봤는데!! 넘나 통쾌한 것!! 킹사이다 한잔 마시고 나온 영화~  
20170310,9,초반에 지루한데 중반으로 넘어가면 어느새 몰입을 하고있고 마지막의 그 짜릿함이란....  
20170310,8,잠깐만?! 포드는 왜 위증을 했는가?  
20170310,5,도저희 뭐가 맞는건지 모르겠다 . 주인공도 인성쓰레기였고 상대도 인성쓰레기였다 근데 마지막에만 잠깐 내가 잘못했다 그래도 날믿어라 이러니까 그냥 최고의 영웅처럼됬다. 그냥 어짜피 둘다 인성쓰레기였는데 아무리봐도 주인공은 사람이아닌악마다  
20170310,10,간만에 몰입해서 본 영화!  
20170310,10,모든걸 희생하여 자신과 팀의 신념을 지켰다.이렇게 통쾌하긴 정말 오랜만이다.  
20170310,9,"로비스트계의 리암니슨,제이슨본 이랄까나제시카차스테인 이미지가 새로써지네  "
20170310,10,마지막 반전 최고! 눈을 뗄 수 없다  
20170310,9,최근에 본 중 가장 통쾌한 역전극으로 사이다 마신 기분!  
20170309,8,현란한 말빨과 기선제압에 속으면 게임 끝. 그녀가 주무르면 그게 무엇이든 쑥대밭. 천재적인 통찰력과 무시무시한 통제력으로 주도권을 장악하는 궁예 로비의 퀸! 아이스퀸 차그테인이기에 가능한 매력 뽐뿌!  
20170309,9,시간가는줄 모르고 봣네요  
20170309,10,로비스트의 차가운뒷모습 최고에요  
20170309,9,처음에는 지루한듯한데 반전도 있고 좋네요.  
20170309,9,배우의 압도적인 연기력에 감탄한 영화  
20170309,8,영화 잘 보고 가요.  
20170309,10,최고 지루할 틈이 없고 여주인공의 두뇌회전에 감탄이 나온다  
20170309,9,최고의 한방 그녀는 강했다.  
20170309,10,영화 정말 좋아요 연기도 OOO기!  
20170309,8,좋아요조아조아조아조아아ㅏㅏ  
20170309,10,"인생 까지꺼 한번인데 자신의 삶,  직업에염증이 날때 저렇게 시원하게 날 불태워서라도 큰일을하고싶다  "
20170309,8,넘 흥 미롭고 재밌어요.볼만해요  
20170309,9,멋진 한방!! 통쾌합니다  
20170309,10,제스카 차스테인의 놀라운 연기 최고에요  
20170309,9,조금 지루하기도 했지만 so so~~^^  
20170309,10,신념의 힘! 강추입니다  
20170309,10,대박!!! 청문회 마지막 소름 ㄷㄷ  
20170309,10,미스 슬로우 좋아요~ 미스 슬로우 화이팅 입니다^^  
20170309,10,제시카 차스테인 하드캐리!  
20170309,10,좋아요 참재미가있어요 또볼래료  
20170309,10,로비스트와 총기규제를 소재로 한 영화라궁금해서 예고편을 보니 이건 봐야겠다싶네요!!좋아하는 장르에 카리스마 있는 여배우의 출연이라엄청 기대됩니다~!!  
20170309,10,로비스트  다시태어난다면 해보고싶은 직업중하나  잘봤습니다 감사합니다  
20170309,9,주인공이 너무 아쉽네요 재미있습니다.  
20170309,10,재미있게 봤습니다 강추합니다  
20170309,8,우왓 로비스트이야기멋지네요!!!  
20170309,10,이렇게나 통쾌할 수 있다니...엄지척!  
20170309,9,나쁜년인척하면서 바른년짓하기  
20170305,10,무슨 이런미친영화가 다있나싶다 로비스트는 무엇을위해사는가  
20170304,10,영화 중후반까지는 주인공이 너무 나댓구나;; 사람은역시 즉당히나대야된다 라고생각하고있다가 한방 퍽먹었다;; 마지막에 감동과 여러 생각들이 한순간에 스쳐지나가고 감동이밀려온다;; 오랜만에 명작하나봤다.... 아련하면서도 멋지다..  
