0,1,2
20170315,1,최악의 영화 시사회갔는데 보지마세요  
20170315,10,장거리 사랑을 하는 입장에서 꿈꾸게되네요  
20170315,10,로매틱하고 재밌는 영화였습니다.  
20170315,9,귀여운 첫사랑~ ost가 너무 좋아용  
20170315,10,완전 올해들어 본 영화중에 제일 재밌었어요ㅠㅠ!!  
20170315,10,세상에서 가장 멀고 아름답고 사랑스러운 아사 버터필드의 스페이스 장거리 로맨스 ㅋㅋㅋ! 화면이 진짜 아름답다!  
20170315,7,잼 있게 봤어요. 또 봐도 잼있을 꺼 같아요.  
20170315,10,시사회로 보고 왔는데 곳곳에 웃음 포인트도 있고 다양한 장르를 조합한 종합선물세트 같은 느낌의 영화 ㅎ  
20170315,8,순수하고 따뜻한 sf영화!! 재밌게봤어요  
20170315,10,제가 좋아하는 그런장르에 영상미랑 스토리가너무좋았음 짱!  
20170315,10,화성소년과 지구소녀의 사랑스럽고도 감동적인 SF 로맨스  
20170315,10,너무 재밌었어요..♥새로운장르  
20170315,10,너무너무 있어요^^  완전 강추합니다^^♡♡  
20170315,9,신선하고    잼나게 잘봤습니다  
20170315,9,꿈이 이뤄진 영화네요.  재미있게 잘봤습니다.  
20170315,10,굿 재밌었어요! 꽤감동적이고 영상미 굿 시사회로 봄  
20170315,10,에이사.버터필드 쵝오!!!  
20170315,6,감동적인 SF 멜로 로드트립!  
20170315,9,사랑과 우정사이에 아름다운 사랑과 아쉼을 그린 수작임  
20170315,10,감동도 있고 로맨스도 있고 너무 재밌게 봤네요  
20170315,9,감동과 재미있는 영화입니다  
20170315,10,화성에서 지구까지  사랑 이야기  
20170315,10,영상미 아름다워요~   화성남자와 지구여자의 아름다운사랑 이야기 추천  
20170315,10,10점 만점이에요ㅠㅠㅠ너무 감동적이고 예뻐요!! 꼭꼭 보세요 강추입니다  
20170315,9,"집이좋긴하네요 완전, 공감 ㅡ 좋은 오에스티도 많고 잼있어요 / 좋네요 오랫만에  "
20170315,10,노래도 좋고 따뜻한 영화네요 재미있네요  
20170315,8,진짜 화성인을 마라러 가자  
20170315,10,너무재밌고 감동적으로봤어요 ㅜ꼭보세요  
20170315,7,우주스케일 자아찾기 성장영화  
20170315,9,기대이상으로 좋았어요전 추천해요^^b  
20170315,8,화성인을 만나러 가봅시다  
20170315,9,재밌네요.. 한번쯤 상상해 볼만한 영화네요  
20170315,8,장거리연애의 한계를 극복한 미래형 로맨스. 화성남자의 심장이 지구에 내려와 큐피드가된 이 귀여운 청춘멜로는 멧데이먼의 마션 이후 가장 현실적 낭만을 보여줌!  
20170315,10,당연히 보러가야지요^^  
20170315,9,독특한 소재를 감동적으로 풀었어요!  
20170315,10,화성소년과 지구소녀의 사랑이야기 재밌게보았어요  
20170315,10,화성에서온 소년의 로맨스 정말 재밌었어요  
20170315,10,우주에서 태어난 시공간에 지구인간과의 사랑이 색다르고 흥미진진합니다^^기대짱입니다  
20170315,9,화성소년과 지구소녀의 셀레는 사랑이야기 아름다울  듯~봄이니 로맨스 영화좋죠  
20170315,10,정말 감명깊게 봤습니다  
20170315,10,정말 감명깊게 봤습니다  
20170315,10,스페이스 비트윈 어스 시사회 왔어요 최고임  
20170315,9,광활한  우주를 배경으로 펼쳐지는  청춘로맨스이야기는 국내관객들에게 신선함과 특별한 사랑이야기를 꿈꾸게해준다  
20170315,7,이거시사회당첨되서가는데가봐야알것같아요  
20170315,10,에이사 어리게만 봤는데 다컸다! 로맨스 설렌다 진짜ㅜㅜ  
20170315,10,너무너무 행복한 시간이네요.^^  
20170315,10,우주판 가위손 같기도 하고 내용 정말 기대된다  
20170315,5,로튼토마토 16%....  
20170315,10,스페이스 비트윈 어스 최고입니다  
20170315,9,시사회 갔다왔는데ㅔ 내용도 특이하고 영화 배경이 너무 이쁘고 재밋었어요!! 배경이 진짜 예쁨  
20170314,7,스페이스 비트윈 어스. 다 보고 나면 제목을 정말 잘 지었다는 생각이 든다. 고급진 하이틴영화.  
20170314,10,순수하고 풋풋하고 두 소년소녀의 사랑은 광활한 우주만큼이나 놀랍고 경이로웠다.  
20170314,6,말하고자 하는 게 뒤죽박죽임 시험끝나고 사회선생님이 틀어줄 것 같은 영화. 주제는 갠찮았는데 아숩  
20170314,10,ㅋㅋㅋㅋ진짜많이컸네용 ㅋㅋㅋ가볍게즐기기좋은듯~^^!!!  
20170314,10,편하게 볼수있고 재밌었다ㅜㅜㅜㅜ  
20170314,10,너무 감동적이예요 재밌어요  
20170314,5,화성소년 눈빛이 두근두근^^  
20170314,8,우주적 풋풋한 로맨스 천문학적 깨알 재미  
20170314,10,둘이 너무 잘 어울리고 재밌었어요  
20170314,10,마션을 뛰어넘는 수작이네요..  
20170314,10,너무 잘 만든 감성영화 굿이에여  
20170314,10,너무나 재미있게 봤습니다..  
20170314,10,스페이스 비트윈 어스 화성남자 지구 여자 컨셉이 좋고 내용도 좋네요~ 추천해요  
20170314,10,너무 좋아요ㅠㅠ 심쿵하기 딱 좋은 데이트 무비  
20170314,8,화성소년과 지구소녀의 하이틴 로앤스가 어떻게 펼쳐질지 기대됩니다.  
20170314,9,화성에서 태어난 소년의 가장 로맨틱한 우주같은 사랑 이야기  
20170314,9,화성은 저중력이지 무중력은 아니죠. 화성은 표면까지 우주 방사선이 엄청나서 지하에 숨어살거나 아니면 돔안에 숨어서 살아야 할겁니다.  
20170313,8,신선해서 기대중입니다  
20170306,10,아사가 아니라 에이사입니다 제발...  
20170306,10,에이사 나오는데 안 볼수 없다 ㅠㅠ 존잘  
20170304,9,"주연배우는 잘 모르겠고,,,우연찮게 예고편을 봤는데 묘하게 끌리는...같은날 미녀와야수도 개봉하던데,이영화가 더 기대되는^^해외평은 좋던데...제발 기대치만큼 나오길~!  "
20170303,10,봐요 본다고요 에이사가나오는데 안볼수가있나요ㅠ 꼭봐야지!  
20170303,10,"우선 게리올드만이 나오는 영화에 , SF와 로맨스라 - 기대됩니다.  "
20170301,10,아사 버터필드가 아니라 에이사 버터필드입니다  
20170228,10,빨리 개봉했으면 좋겠다  
20170227,7,"적당히 기대되고, 적당히 걱정된다. 소재 자체가 일본 애니메이션 소재스럽기도 한게 애니메이션으로 나왔어도 느낌 괜찮았을듯.  "
20170227,10,SF + 로맨스+음악까지 아주 적절한 조화  
20170226,10,게리 올드만은 연기를 아는 몇 안되는 배우라 생각되요...그래서 이영화도 꼭 봐야겠어요 ㅎㅎ  
20170226,5,영화프로에서 예고 봤는데 완전 얼토당토한 영화네. 어거지설정으로 뒤덮힌 정말 영화같은 영화다.  
20170226,10,아사버터필드 나오네 ㄱㅇㄷ~  
20170226,8,배우는 좋은데 느낌이 우주판 트루먼쇼로갔다가 시한부인생같은 느낌이 들까 걱정영화는 결국 뚜껑을 열어봐야안다  
20170226,1,툴사 배역 좀 에러인듯 남자주인공 엄마뻘로보이는데 18살친구?  
20170226,10,게리 올드만과 아사는 나한테는 믿고 보는존재다  
20170226,9,에고편만 봐도 너무좋은데  
20170226,10,지구에서 가장 좋아하는게 '너' 라니... 설렌다  
20170226,2,딱봐도 핵노잼...국내에선 흥행참패 예고수순밟으나?  
20170225,1,나 이배우 매우 좋아합니다  
20170225,10,시사에서 봤는데 넘 잼게 봤어요~ 에이사 심쿵!  
20170225,10,메타크리틱 33점^_^  
20170225,10,독특한 우주영화컨셉두근두근 기대되네요 아사 눈 넘이뻐요  
20170224,10,리얼 작년 6월부터 기다렸따  개봉일자좀!!  
20170221,10,아사 믿고 본다ㅠ예고편부터 심장폭행 쩔  
20170213,6,로튼 토마토 지수 16%  ^^;  
20170212,9,새로운 인생영화 기대해 봅니다.  
20170209,10,빨리 개봉했으면 좋겟다..♡  
20170208,10,쿠알라룸푸르에 개봉해서 봤는데 너무 좋은 영화고 재밌어요!!!  
20170205,3,기대했는데 남미 반응 폭망이네  
20170204,10,엔더스게임도 재미있게 봤는데..  이것도 재미있을것 같네요!!  
20170204,9,에이사가 나온 엔더스 게임같은 영화가 아니길..  
20170124,10,아 너무 기대된다. 3달을 기다렸어요  얼른 개봉해주세요ㅠㅠㅠ  
20170105,10,에이사에 입덕한지 어언 4년 이영화 빨리보고싶어요!!!  
20161106,6,이거 언제나오나요??  
20161017,10,미스페레그린 보고 에이사 버터필드한테 빠져버렸어요 ㅜㅜ 완전 기대됩니다!!! 언제 개봉하나요?  
20161012,5,예고편보니 영화 다본 느낌이 드는 이유는 뭘까  
20160926,10,에이사ㅠㅠㅠㅠ 또 내 취향저격 영화를 찍는구나ㅠㅠㅠ 이 SF 꼭 보구 싶어요!!!  제발 개봉하길!!  
20160917,10,"광고만 봤는데 벌써부터 재밌을듯, 소재가 내가 평소에 보고싶어했던거랑 비슷  "
20160904,10,맷  데이먼이  까메오로  나와주면  참  좋을  듯  
20160804,10,에이사만 봐도 기대된당  
20160619,10,팬으로서 할 수 있는 '누구 나오는데 당연히 봐야지!!'를 저능아라고 까는 이해심 없는 사람이 있네.  
20160529,10,아사에 게리올드만 조합은 정말 좋다 ㅜㅜ 그리고 sf라니!  
20160506,10,아사 버터필드 나오는데 당연히 봐야지!!!  
20160213,10,2등개리올드만 + SF 기대됨.  
20151015,10,뭔지는 모르지만 1등 ㅇㅇㅇㅇ  
