0,1,2
20170425,10,https://story.kakao.com/_BS4Qf6/GO6mHejoBD0  
20170425,10,https://story.kakao.com/_AO8Fo6/eCcZrIrhBD0  
20170425,9,"기대했는데, 역시 기대를 저버리지않네요. 개봉하고나서도 한번 더 보고싶을 정도네요.이건 뭐 지극히 제 개인 생각이지만요...제 친구랑 시사회 같이 보러갔는데, 친구도 인정하고 이 영화 꼭 추천하고 싶다네요. 대박나세요. 정말 재밌게 잘봤습니다.  "
20170425,10,정말 즐겁게 재밌게봤습니다^^  
20170425,10,이선균 배우와 안재홍 배우와 숨겨진 역사 여행을 떠나는 것 같이 재미나요.  
20170425,10,재밌어요 또보고싶어요  
20170425,10,언제나 어디에서나 사건사고는 있다  다만 해결하려는 의지와 실천이 중요하다  
20170425,10,추리와 코미디 사극의 조합이 신선하고 재밌었어요~ 사건이 긴장감있고 궁금하면서 두 주인공이 넘 웃겨서 즐거운 시간이었습니다~ ^^ 적극추천!!  
20170425,10,요즘 웃을일이 별로없는데 실컷웃었네요 추천합니다  
20170425,9,은근히 이선균이 예종 역할에 잘어울렸고 간간이 웃긴 장면들도 많아서 지루하지 않게 볼 수 있었어요  
20170425,10,시사회 내내 웃으면서 봤습니다. 단순히 코미디 생각하고 가면 꿀잼  
20170425,10,"시사회로보았네요. 이번연휴때 맘푹놓고 보기에 좋아요.모범시민은. .보는내내 불편했네요,  "
20170425,10,이선균 안재홍주연 임금님의 사건수첩 포복절도할 웃음의도가니 다들 열심히 웃어요  
20170425,10,진짜 많이 웃었네요 ㅎㅎ 영화 추천합니다  
20170425,10,조금 아쉬운 구석도 있지만 이선균 안재홍 케미가 좋아요. 시리즈로 나와도 재밌을 거 같아요.  
20170425,10,"넘나 재밋엇어여ㅠㅠ 안재홍,이선균 두분다 너무 귀여움 ㅋ  "
20170425,10,가족들과 보면 딱 좋을것 같아요  
20170425,10,가볍게 즐기기 좋은 코미디 영화  
20170425,10,임금님이 이렇게 귀여워도 되는거야?ㅋ  
20170425,9,오.. 예상치 못한 재미 ㅎㅎㅎ  
20170425,10,시사회 다녀왔는데 재밌었어요! 요즘 웃을 수 있는 영화가 필요했는데 굿굿  
20170425,10,요새 이선균 나온 영화 다 재밌었음ㅎㅎㅎ 봉블리야 뭐 말할것도 없지♡  
20170425,10,믿고 보는 이선균 ㅋㅋㅋ 안재홍과의 꿀캐미도  기대된다  
20170425,10,"가족, 친구, 연인 누구와도 함께 즐길 수 있는 코미디 영화  "
20170425,10,조선판 브로맨스~~ㅋㅋ이선균 안어울릴것 같다는 사람 누구야!! 이렇게 잘어울리는걸ㅋㅋ  
20170425,10,믿고보는 이선균...! 안재홍도 족구왕에서 너무 좋게 기억하고 있는데 기대되요ㅎㅎㅎㅎ  
20170425,10,재미도 있고 의외로 액션도 훌륭함 시각적인 요소도 좋고  
20170425,10,이선균과 안재홍의 캐미! 재밌었다!  
20170425,9,원작 만화도 재밌었는데 영화로 보니 더 재밌음 ㅠ-ㅠ  
20170425,10,사극영화는 지루해서 별로 안좋아하는 편인데 코믹적인 요소와 함께 풀어내서 넘 재밌었어요!!+_+ 집중해서 봤네요 ㅎ  
20170425,10,기대되요~ 이영화~^^  
20170425,10,이선균이랑 안재홍 이 둘의 조합은 꿀이다 정말 ㅎㅎㅎ  
20170425,9,원작이 있는 작품이라 그런지 스토리 하난 탄탄하네요 중간중간 웃음 포인트들도 너무 좋았어요  
20170425,10,꿀잼 개잼 졸잼!! 천만가자!!  
20170425,10,시간 가는줄 모르고 관람ㅋ 시사로 봤지만 내 돈주고 봐도 아깝지 않을듯  
20170425,1,안재홍...단타배우인듯. ;; 연극보고 대 애애애애 실망.  
20170425,1,...시대배경잡아놓고 그거 깨려고 하는거 도전이 아니라 적당히 웃겨서 벌어먹겟다는거지  
20170425,10,두 주인공의 케미가 정말 끝내줍니다 >.<bb  
20170425,9,사극물 별로 안좋아하는데 임금님의 사건수첩은 정말 재밌게 봄  
20170425,10,"이선균, 안재홍 조합이라니 신선하네ㅋㅋㅋㅋ 꿀잼각  "
20170425,10,이선균이랑 안재홍이랑 코미디 궁합 잘맞네 ㅋㅋ 중간중간 킬링포인트들이 아직도웃김ㅋㅋ  
20170425,10,시사회가서 보고 웃겨죽는줄ㅋㅋㅋ한번더 보러가욬ㅋㅋㅋ  
20170425,1,하...세련된척좀그만하자  
20170425,10,이선균 안재홍 조합이라니 예고편보고 기대중ㅋㅋㅋㅋ  
20170425,1,알바많네 알바 천국인가 ? 진짜 노잼일거같은데..ㅋㅋ  
20170425,9,오랜만에 볼만한 한국 코미디 영화ㅋㅋㅋ  
20170425,10,시사회로 보고 왔는데 정말 재밌었습니다 별로 기대도 안했는데 기대하고 봐도 재밌을겁니다ㅎ  
20170425,10,ㅋㅋㅋㄱ둘이 케미터져ㅋㅋㅋㅋ간만에 웃음터지는영화나온듯  
20170425,10,예고편만 보고 기대했던 영환데 곧 개봉이네요~ 빨리 만나 보고싶어요~^^  
20170425,10,말이필요없는꿀조합♥ 역대급 브로맨스 기대합니다><  
20170425,10,시사회로 봤는데 안재홍 졸웃ㅋㅋㅋ 연휴에 엄마랑 또 볼거임  
20170425,10,재밌었아 이선균안재홍 조합 굿 ㅎ  
20170425,10,넘나 재밌는것!!! 존잼  
20170425,1,별 반개도 아깝다...감독은 반성하라...  
20170425,1,조선명탐정도 망했다 ㅋㅋ  
20170425,8,어제 무대인사 시사회로 봤는데 꿀잼ㅋㅋㅋ이선균의 첫 사극인데 생각보다 잘 어울린다~안재홍과의 케미도 좋고 재밌게 잘봤다~ㅎㅎ  
20170425,10,시사로 봤는데 케미쩔어요 ㅋㅋㅋㅋ꿀잼임  
20170425,1,예고편보고 기대 1도안되는 영화 ..뻔한 줄거리에 뻔한 소재에 조선시대 막장 장르라니..  
20170425,10,시사회 다녀왔어요 다들 연기 넘 찰지네요 고민 많이한 흔적이 보이는 영화였어요~!  
20170425,10,우주최강귀요미였다 안재홍..ㅠ  
20170425,10,시사 반응 대박이던데 ㅠㅠ 빨리 보곱  
20170425,10,안재홍 이선균 케미가 진짜 좋은 오랜만에 이런 코미디 원츄!!!  
20170425,10,어제 라이브톡에서 봤는데 개꿀잼!!  
20170425,10,이선균 안재홍이라니!! 신선한 캐스팅 조합 기대되네요  
20170425,1,주연 캐스팅이 너무 약함 밀리는거 시간문제임..손익분기점도 한참 못갈듯  
20170425,3,"시사회 당첨되서 보러 갔는데, 소소한 재미는 있습니다. 재미없는건 아닌데 그닥 내 돈 주고 보기는 좀...그렇다는 거?  "
20170425,10,ㅋㅋㅋㅋ둘이 엄청 잘어울려요ㅋㅋㅋㅋ  
20170425,1,예고편도 노잼..캐스팅도 노잼  
20170425,1,딱 생각한 만큼 재미없었음 예고편이 다라고 보면됨  
20170425,1,이런 영화 안봐도 알지 ㅋㅋ 무슨생각으로 만드는 걸까 ..  
20170425,2,개재미없네 내돈으로 안본게 다행  
20170425,2,아....큰기대가 되지 않는 이유는 뭘까  
20170425,5,노철기 시리즈에 아직도 미련이 많아서... 작정하고 영화판 노철기 시리즈를 만든 정도 밖에는... ㅜㅜ  
20170425,3,이런류의 영화가 크게 흥행한적이 있나..꾸준히 나오네  
20170425,1,전 좀 실망했는데.. ㅠㅠ  
20170425,2,안재홍은 기대되는데 이선균은 좀 별로일것 같은데..  
20170425,10,흥행예감! 기대이상으로 유쾌상쾌통쾌했어요^^두배우님의 케미도 역시  
20170425,1,이딴영화가 상영관잡느라 파운더 댄서같은 영화가 일주일만에 막내리는거 진짜 극혐 ㅇㅈ? ㅇ ㅇㅈ 한국영화 제발 어디 격리시켜가지고 느그들끼리 물고빨거라  
20170425,1,왠지 예고편이 전부일 것 같은 불길한 예감..  
20170425,4,스타 라이브로 보고왔다. 조선명탐정을 어정쩡하게 닮았다. 긴장감도 없고 감동도 없고 중간중간의 웃음 몇번이면 설명되는 영화.  
20170425,10,이선균 안재홍캐미가 좋네요  
20170425,10,안재홍의 코믹연기는 정말발군이네요 ㅎㅎㅎ  
20170425,4,이선균이 과연 사극에 어울릴지....  
20170425,7,편안하고 즐겁게 영화를 즐기면 되는 영화! 배우 이선균의 연기가 괜찮네요.  
20170425,10,왕십리 시사회에서 봤습니다 예종&이서 케미 기대하셔도 좋아요 ㅋㅋㅋ 근데 조선명탐정 이연희 처럼 경수진 분량좀 많앗으면 더 좋앗을듯함 ㅠㅠ  
20170425,10,보고 나서 너무 재미나게 봤구나 하는 영화입니다.  
20170425,10,재미가 없을수가 없는 조합이다! ㅋㅋ  
20170425,10,믿고 보는 이선균과 안재홍의 탐정 수사극! ㅎㅎ  
20170424,10,이런 콤비 대환영이오! ㅋㅋ  
20170424,10,왕과 신하의 허물없는 케미가 굿굿굿!  
20170424,2,음..기대보다는 걱정이 더큰..  
20170424,10,"이선균, 안재홍, 김희원 배우님 모두 연기 굿!2시간동안 정말 재밌게 봤어요! 봉블리 너무 귀여움ㅋㅋ  "
20170424,1,글쎄여 배우들은 좋아하는데 좀 안맞는느낌..ㅠㅠ  
20170424,10,"임금님과 사관 이서, 완전 멋지고 너무 귀여워요.  이서는 나올 때마다 빵빵 터지고 임금님은 매력이 빵빵 터지고 재미있었어요.  "
20170424,10,응팔의 정봉이를 능가하는 캐릭터네요안재홍의 능청연기 졸귀ㅋ예고보시지마시고 영화보세요  
20170424,9,재미와 긴장감이 빵빵 터지고 두사람의 케미 짱. 완전 대박날듯  
20170424,10,와 짱잼ㅋㅋ 역시이선균이네요 ^^  
20170424,10,유료관객 1호입니다! 개봉전 라이브톡 관람했어욥!이선균♡안재홍 케미 너무 좋구요!이선균 칼 액션신 너무 멋있어요 ㅠㅠ 진짜 너무 반했어요!! 안재홍의 러블리는 뭘 해도 너무 좋네요♡  
20170424,9,이선균♡ 홍블리♡둘의 조합만으로 충분합니다! 재밌게 많이 웃으면서 봤어요~  
20170424,9,웃다가 긴장하다가 웃다가 심장 조이다가 2시간이 후딱. 너무 재밌었습니다. 흥하세요  
20170424,10,"전부 연기도 잘하시고 깨알같은 웃음포인트!재밌어요,추천합니당  "
20170424,10,임금님의 사건 수첩 완전 재밌네요.ㅎㅎ 코믹합니다. 두 배우의 캐미도 아주 좋았어요. 강추  
20170424,10,시사회보고 왔어요.  만화 원작도 재밌었는데 역시나 재밌네요. 안재홍 너무 귀여워요. 오보에서 삼보야 될때까지 케미 완전 좋아요~5월 연휴에 가족과 함께 또 보려구요.  
20170424,10,2017 최고의 코믹 수사 활극! 가족영화로 완전 추천!  
20170424,8,방금 시사회로 보고나왔는데 재미있게 봤어요!!!역시 두 배우의 연기가 찰떡같고 전반적인 영화 느낌은 조선판 셜록 같아요ㅎ  
20170424,10,이선균 안재홍 무대인사도 보고 영화도 너무 잘  봤네요~ 재미있어요~  
20170424,10,조선판 셜록과 왓슨 콤비! 유머도 빵빵 재치도 빵빵 터진다!  
20170424,10,남녀노소 누구나 좋아하지 않을 수 없는 재밌는 영화!  
20170424,8,편하게 웃고 가는영화입니다  말그대로 코믹활극  재밌게보았습니다.  
20170424,10,영화 재미나요 연인이나 가족들이랑보기 좋은 영화같아요^^  
20170424,9,시사회보구왔어요  이선균님과 안재홍님의  능청스러운 코믹연기가  돋보였네요   ㅋ잼나게 봤습니다  
20170424,10,시사회로 봤는데  웃기고 신나고 재미있어요 역시 믿고보는 이선균  
20170424,10,조선시대의 과학발전이 엄청나다는거에 한번 놀라고 배우 이선균이 멋있었다는거에 한번 더 놀랬다  
20170424,10,뇌색남들이 여기 모여있네요!!! 흥미진진한 스토리에 반전까지♥모든배우들의 합도 잘맞은 영화네요^^  
20170424,8,빵빵터져요. 잼나요. 이 두남자 캐미 잼나네요  
20170424,9,너무너무너무 유쾌 상쾌 통쾌!!!역시 이선균! 그만이 할 수 있는 연기!!!그리고 새로운 콤비 안재홍!!!2탄을 기대합니다!!!염화 대박날겁니다!!!  ^^*  
20170424,10,이선균&안재홍의 브로맨스 캐미에 웃다 나왔네요~간만에 신나게 웃은 영화여요~!!짱짱짱~!!  
20170424,8,깨알같은 웃음과 웅장한 영화음악이 일품입니다 ^^  
20170424,9,명콤비 탄생!! 지루할틈 없는 명랑사극.  
20170424,9,가족끼리 웃으면서 보기 딱! 시간이 술술 가요 ㅎㅎㅎ  
20170424,10,안재홍과 이선균의 케미가 폭발하네요!!  
20170424,10,완전재밌어요 추천추천  
20170424,8,잔잔하게 웃음을 주는 킬링타임 영화로 굿~~재미있고 기대 이상의 만족을 준 영화였어요.러블리한 안재홍씨 연기 좋았어요  
20170424,10,이선균씨랑 안재홍씨 둘이 너무 웃기고 재미있어요^^  
20170424,10,역시 믿고 보는 배우들입니다!너무 재밌었어요!!!  
20170424,9,"안재홍오빠 너무 웃겼구,이선균오빠 목소리 너무 구수했어요!!!!추천추천  "
20170424,10,배우님들의 캐릭터들이 명확하고 콤비가 보여주는 꿀재미 이야기들이 시종일관 이어져 시간가는 줄 몰랐습니다. 볼거리와 음악 충만.  
20170424,7,웃음후 뭐가 남았을까요?!  
20170424,9,재미있네요 케미폭팔!!! 재미폭팔!!!  
20170424,10,임금님의 사건수첩! 대박! 꿀잼!!!이산균과 안재홍의 캐미 장난아니네요~!강추입니다~!  
20170424,8,기대보다 재밌었음. 세상 가장 껄렁한 왕 탄생ㅋㅋ  
20170424,10,역시 이선균님 웃느라 정신 없었다욤 시간 가는줄 모르고 쒼나게~ 완전 굿  
20170424,9,역시 기대했던만큼 즐겁게 볼수 있는 영화네요~ 실컷 웃다 나왔어요~  
20170424,10,완전 꿀잼! 웃음 포인트가 많아 넘 재밌게 봤어요  
20170424,10,영화 대박 웃기네요. 재밌어요.  
20170424,10,임금님의 사건수첩!! 대박!재미있어요이선균과 안재홍의 케미 장난아니네요이렇게 웃긴 영화 오랜만이네요  
20170424,10,재미있었어요.다음에 또 보고 싶어요.  
20170424,10,개잼졸잼그냥웃김이선균목소리개좋ㅁ  
20170424,8,정말재미있어요.줄거리정말재미있음  
20170424,9,ㅋ잼나다 이선균과 안재홍의 케미는. 짱!  
20170424,10,넘넘 재밌고 깔끔한 결말 좋아요 대박예감입니다.믿고보는 영화 임금님의 사건수첩이예요  
20170424,10,한순간도 눈을 땔수가 없네요 ㅎㅎ 계속 집중해서 봄ㅎ  
20170424,10,너무너무 재미있게 보왔어요  
20170424,10,솔솔한 재미가 있는 영화입니다 재미나가 잘 볼것 같아요  
20170424,10,진짜 대박 재미있었어요! 계속 웃었네용ㅋㅋ  
20170424,10,폭소. 캐미. 조선판 명탐정 탄생 ㅋㅋ  
20170424,10,"이선균 안재홍의 꿀잼코믹케미! 신명나는 왕과 신하, 코믹탐정단의 대활약!  "
20170424,8,조선명탐정 이전에 임금님의 사건수첩이 있었다..새로운 조선CSI 명탐정 시리즈의 유쾌통쾌한 시작!  
20170424,10,완전 대박 영화?임금님의 사건수첩.. 오랜만에 마음것 웃었네요^^너무너무 재미나요. 강력 추천해요^^  
20170424,10,너무너무 채미나요 2편이 기다려지네요  
20170424,10,시사회 가서 봤는데 개꿀잼!~~~  
20170424,3,별로 기대는 되지 않지만 보러는 갈게  
20170424,10,이선균과 안재홍의 케미가 최곱니다!! 웃다가 웃다가...  
20170424,9,완전대박재미있어요~~^^  
20170424,2,아직 개봉도 안한영화에 ... 알바들이 판을치는구나  
20170424,9,믿고보는 이선균에 안재홍까지...  추천 합니다^^  
20170424,10,월욜부터 한참 웃고 갑니다. 임금님의 수첩 덕에 활기찬 한 주 시작합니다. 추천~  
20170424,1,흠....원작팬은 웁니다...  
20170424,1,이선균은 진짜 뭐라고하는지 모르겠어..ㄷㄷ  
20170424,10,"이선균,안재홍 배우의 남남캐미ㅎㅎㅎ꿀잼이옵니다~~  "
20170424,2,재미없었음.. 개인적으로 사극코미디는 내 취향이 아닌듯..ㅠ  
20170424,1,딱봐도 걍 노잼 스멜....  
20170424,10,찬희가 단역이라니ㅠㅠㅠㄱ선균님 정봉님 케미라니ㅜㅜㅜ  
20170424,10,재밌어보이네요 한국영화 잘 안봤는데  
20170424,7,두배우의 꿀케미 활약 속 재밌게 웃는 사이 어느덧 사건해결!<임금님의 사건수첩2>를 기대해봅니다.  
20170424,9,아이들과 함께 보기 좋은 영화~이선균 안재홍 두 배우의 새로운 시도가 돋보이는 영화네요  
20170424,10,가볍게 웃으면서 즐길 수 있는 영화 임금님의 사건수첩  
20170424,10,긴박감 있는 스토리 진행으로 끝까지 재밌게 볼 수 있었던 영화ㅎㅎ  
20170424,8,가볍게 볼려고했는데 생각보다 내용도 있고 다들 연기를 잘하시니 흥미진진했네요~  
20170424,8,이선균은 끝까지 간다로 일약 대단한 스타덤에 올랐지만 이후 성난변호사는 뻔한 클리세로 별 반응못받음. 사실 끝까지 간다에 진히어로는 조진웅이였지  
20170424,10,예고영상보고 개봉하면 볼려고 했는데 친구덕에 시사회다녀왔어요!!! 아진짴ㅋㄱㅋ너무재밌어요두사람 케미폭발 오프닝때 배경음 너무 웅장~~~이 음악 맘에 들어섴ㅋ 나중에 다운받고 싶어요  
20170424,10,간만에 갔던 시사회 중에서 제일 꿀잼이어뜸  
20170424,10,엄마랑 시사회로 봤습니다^^ 한참 웃다나왔네요 ㅎㅎ  
20170424,10,시시회로 봤는데 두 배우 케미 어쩔 ㅋㅋ 넘나 재밌음! 강추강추  
20170424,10,쇼케로 봤는데 개꿀잼이던딩 ㅋㅋㅋ  
20170424,10,ㅋㅋㅋ 케미개쩖ㅋㅋㅋ 알았다이놈앜ㅋㅋ  
20170424,10,시사회로 봤는데 진심 졸잼 완전 강추!!!  
20170424,10,연휴에 엄마랑 또봐야지~~~  
20170424,5,"개봉 전 시사회 다녀왔습니다. 대구한일 CGV 시사회 행사 준비 미흡으로 아주 불쾌하고, 늦은 대응으로 영화도 시작 후에나 들어가고...아무튼 기대하고 간 영화인데, 영화관 때문에 제대로 보지도 못했습니다.  "
20170424,10,아주 재밌어요 ㅋㅋ 유쾌 통쾌 상쾌 퓨전사극 영화 짱짱  
20170424,9,시사회 잘 다녀왔어요~ 덕분에 영화도 잘 보고 배우 감독들도 잘 만났네요!! 영화 대박나길~ ㅋㅋㅋ 왠지 좋은말만 해야할거 같은데 사실은... 대박 나기엔 뭔가 좀 아쉽더라구요~ 임금+삼보는 좋았는데 희원씨도 좋았는데! ㅋㅋ  
20170423,10,사극 싫어하는데 임금의 사건수첩은 진짜 재밌게 봄ㅋㅋ 사극 싫어해도 재밌게 볼 수 있을듯  
20170423,9,이선균 안재홍 두 배우의 연기가 사극에서 폭소를 안겨줬네요.  
20170423,10,시사회 당첨되서 봤었는데 생각보다 더 재밌었어요 오랜만에 관객들과 함께 웃으며 재밌게 볼 수 있었던 영화입니다  
20170423,10,이선균과 안재홍의 조합이 너무나 기대되네요  
20170423,3,미안하다. 정승필 실종사건 이후로 제일 재미없었다. 이게 웃기냐? 넘했어  
20170423,10,처음부터 끝까지 심심할 틈이 없다.. 최고  
20170423,10,지루할 틈이 없고 너무 재밌었어요!  
20170423,10,유쾌하고 가족들 친구들하고 같이보기 좋은영화입니다  
20170423,1,이거 단지 이선균이랑정봉이 나온다해서 빠는사람들 그냥 알바들임 직접 시사회보고 왔는데 딱히 재미있다고 하기엔 그닥  
20170423,7,시사회로 봤는데 지루하지 않게 재밌게 잘 풀어낸 거 같아요! 웃고 싶은 분들 영화관에서 이 영화 추천합니다!  
20170423,10,영화 보면서 이렇게 많이 웃은건 정말 간만이당ㅎㅎㅎ  
20170423,10,두사람의 코믹연기가 좋았어요^^ 힐링할수있는 유쾌한 영화~~!!  
20170423,10,두사람의 코믹연기가 좋았어요^^ 힐링할수있는 유쾌한 영화~~!!  
20170423,10,재밌어요!!다들존잘인듯!♡♡♡♡  
20170423,8,재미있어요 자미있어요  
20170423,10,시간가는줄 모르게 봤네요~~!!빵빵 터집니다 ㅋㅋㅋ  
20170423,8,시사회로 보고왔습니다~ 연휴에 가족들과 가볍게 보기에 좋습니다^^  
20170423,10,시사회 다녀왔습니다. 이선균 배우와 안재홍 배우의 유쾌한 멋진 호흡과 김희원 배우의 진지하고 묵직한 연기가 만나 재미를 더합니다!!  
20170423,9,"이선균과 안재홍의 케미좋고, 첫장면부터 잼있게 봤어요^^  "
20170423,9,"빵빵 터지는 유쾌함,통쾌한 반전,길지만 지루하지 않는 영화에요~ 두 배우분들 케미터짐 ㅋㅋㅋ가족들과 보기에도 추천!!  "
20170423,10,"완전 재밌어요 믿고 보는 이선균,요즘 대세 안재홍!둘의캐미 완전 쩔었어요ㅎㅎ 추천 이백개요♥♥♥  "
20170423,10,"이선균, 안재홍님 너무 믓쩌용^^  "
20170423,8,재미있게 봤어요 코믹스러운 부분이 자연스럽게 묻어나오네요  
20170423,10,너무너무재밌어요~강추  
20170423,7,가족들과 보기에 좋네요..색다른진 않지만 지루하지않게 볼만함  
20170423,10,이선균은 진짜 어떤 연기를 해도 매력적임 ㅜㅜ  
20170423,8, 살짝 중간에 늘어지는 구간이 있었지만 참신한 주제의 영화여서 재미있게봤어요ㅎㅎㅎ 믿고보는 이선균이랑 봉블리♡♡♡♡  
20170423,10,두시간의 러닝타임이 후딱 지나감ㅋ  
20170423,6,벚꽃만개 잇몸만개~~~^^ 시사회로 살짝 맛보기이선균 홍블리 김희원씨 너무 좋아요  
20170423,10,두 주인공의 케미가 끝내줍니다  
20170423,10,너무나 재밌었던 코믹 수사물.  
20170423,8,알고보니 탐정 아니고 조선제일검  
20170423,10,내가 좋아하는 배우들만 나와서 그런지 기대할 수 밖에 없음 ㅋㅋ  
20170423,10,유쾌하고 통쾌하고~ 개봉하면 한번 더 볼 예정~  
20170423,10,간만에 재밌었던 한국 영화ㅋ 이런 유쾌한 영화도 좋으다  
20170423,8,티몬 시사회로 무대인사까지 보고 왔어요!조선명탐정이랑은 다른 매력이 있네요 ㅎㅎ엔딩 봐선 흥행도에 따라 2편도 나올 듯?가볍게 보고 오기 괜찮아요!  
20170423,10,믿고 보는 배우들! 영화 기대할게요!  
20170423,10,이선균 사극연기 처음이라고 알고 있는데 너무 잘어울려ㅋㅋㅋ  
20170423,10,개구장이 왕도 넘나 매력적  
20170423,10,믿보균 예종과 홍블리 이서의 캐미는 완전 꿀조합이었어요강추!!!  
20170423,10,시사평이 좋아서 기대하고 있어요~  
20170423,10,웃고 즐기기엔 딱인듯 가족들이랑 보기에도 정말 좋을듯  
20170423,10,이선균 안재홍 최고의 브로맨스다ㅋㅋㅋ  
20170423,10,예고편만 봐도 꿀잼각!! 빨리 보고 싶어요!  
20170423,10,이선균 안재홍 믿고 봅니다!!ㅎㅎ  
20170423,10,시사회로 보고 나서 주위 사람들에게 추천 중임 개봉하면 한번 더 봐야징  
20170423,10,배우들의 케미가 아주 그냥ㅋㅋ  
20170423,8,"별 기대 없이 봤는데, 재밌더군요.스토리도 너무 엉성하지 않고, 연기력도 다들 출중하시구요.  "
20170423,10,안재홍 진짜 너무 귀여운거 아니냐ㅜㅜㅜ  
20170423,10,이선균이랑 안재홍ㅋ 연기력만큼은 인정  
20170423,8,시사회로 먼저봣어요 잼잇어요!! 대박나세요  
20170423,10,개봉일만 기다리구 있습니당  
20170423,10,마냥 웃기기만한게 아니라 생각하게 되는 부분도 있고 좋았네여  
20170423,10,가족과 함께 보기 좋은ㅋㅋㅋ 정말 재밌었다  
20170423,8,이선균 안재홍 둘의 케미가 좋아요^-^  
20170423,10,정통사극이 아닌 퓨전사극이라 더 즐겁게 볼 수 있었음ㅎㅎㅎ  
20170423,8,재미있게 보기 좋아요^^  
20170423,10,시사회평들이 벌써부터 좋던데~ 저도 빨리 보고싶어요~  
20170423,10,아이랑 함께 관람하기 너무 좋았어요. 웃다가요  
20170423,10,이선균과 안재홍의 조합만으로도 기대된당ㅎㅎㅎ  
20170423,8,시사회보라왔다 보고나서 평해줄게요  
20170423,10,이선균 ㅠㅠ 기대할 수 밖에 없다  
20170423,8,부산 시사회 관람하고 왔습니다!! 영화보는내내 주변에서 웃음소리가 빵빵!! 저도 재밌게 잘봤어요! 왠지 2편이 나올것도같은 느낌이 드네요 ㅎㅎ  
20170423,10,이선균이랑 안제홍 꿀케미임~! 어제 보고 왔는데 정말 재미있었어요~ 전혀 돈아깝지 않아요^^  
20170423,3,"시사회로 보고왔어요. 탄탄하지 못해 아쉬운 스토리, 그러나 웃고 가기엔 충분했습니다!!  "
20170423,8,시사회로 재미있게 잘 봤습니다~~  
20170423,9,이선균과 안재홍 연기 짱 잘해요안재홍은 족구왕보고 팬 됐어요지루할 틈이 없이 재미있어요^^  
20170423,8,"이선균, 안재홍 기대됨. 호  "
20170423,8,시사회로 봤는데 소소하게 계속 웃었네요ㅎㅎ 둘의 케미가 너무좋더라구요ㅎㅎ 재미있게 관람했습니다ㅎ  
20170423,9,"살짝만 기대하고 갔는데 생각보다 훨씬 잼나게 봤습니다. 이선균 특유의 대사톤 연기력을 사극으로 컨버전해서 보는 재미, 안재홍의 맛깔나는 연기. 그리고 촥촥 감초의 액션 연기. 경수진님 넘 이쁨~^^♡  "
20170423,10,마성의 봉블리와 마성의 꿀성대가 빚어낸 유쾌한 영화. 정통사극이 아닌 퓨전사극이라 즐겁게 봤어요. 가볍게 700만 예상해봅니다! 두둥!  
20170423,9,시사회 보구왔는데..배우들의 연기두  좋구요~^^ 많이 웃을수 있는 유쾌한  영화였습니다~^^  
