0,1,2
20170422,9,시사회 보고 왔는데 누구나 유쾌하게 볼 수 있는 영화였어요~ 이선균과 안재홍 케미도 좋았구요  
20170422,8,이선균과 안재홍의 케미가 돋보이는 영화!!추천해요^^  
20170422,10,"부산 시사회 다녀왔습니다!영화 내용도 좋고 연기 모두 잘하시네요.시사회 이선균님,  안재홍님,  김희원님 먼곳에서 봤는데도 좋았습니다^^흥하세요!!!  "
20170422,10,온 가족이 함께 보세요~ 정말 재밌어요~~  
20170422,10,최고!! 오랜만에 실컷 웃었습니다!!  
20170422,10,재밌어요.  엄청 웃었네요~  
20170422,10,5월 연휴 온가족이 함께 보면 좋을 듯~!  추천합니다!  
20170422,10,먼 부산까지 와주시고 감사합니다ㅎㅎㅎㅎ 영화대박나세요 ㅎㅎㅎ  
20170422,10,"부산 시사회 잘 보고왔어요. 이선균 같은 왕이 진짜 있다면ㅋㅋ 웃으며 보고, 마지막 무대인사도 좋았어요^^!  "
20170422,8,시사회로 오늘 보고 왔어요~웃으면서 잼있게 보고 왔습니다~^^요즘 웃을일도 많이 없는데 덕분에 많이 웃었어요~대박나세요!!  
20170422,9,꺄~~~~ 역시 이선균!! 깨알재미 ㅋ 천만돌파~ 어명이오~~  
20170422,9,방금 시사회 봤는데 완전 꿀잼 ㅋㅋㅋ 많이들 보세요*.*)  
20170422,8,시간가는줄 모르고 너무 재미나게 봤습니다.^^*  
20170422,10,역시이선균 안재홍입니다 믿고볼만해요  
20170422,9,오늘 센텀시티에서 시사회를 봤어요. 엄마랑 같이 봤는데 정말 재밌었어요. 웃기는장면도 많고 생각하게하는 장면도 있었는데 임금이 먼치킨입니다. ㅎㅎ 잘봤어요  
20170422,8,금방 시사회로 좠는데 생각보다 볼만했음~ 실제로 보니까 주연배우들 잘생겼더라는~~/  
20170422,7,안재홍 귀여움 퍽발하는 영화야용  
20170422,10,재밌어요 시사회로 본거라 기대 안했는데 돈주고 봐도 아깝지 않을것 같네요 ㅎ  
20170422,6,시사회로 관람하였습니다 안재홍 귀여워요  
20170422,10,오랜만에 케미가 맞는 영화를 봤네요.  
20170422,10,"시사회로 개봉 전에 봤는데, 믿고 보는 주연 배우들의 연기 케미가 아주 좋습니다. 어느 배우도 흐름을 방해하지 않아서 좋습니다. 긴박감 있는 스토리 진행으로 끝까지 재미있게 볼 수 있는건 감독님의 띄어난 연출력이 있었기 때문이겠죠? 추천합니다!!!  "
20170422,10,안재홍 넘나 귀여운것 ㅋㅋ  
20170422,10,넘나재밋는것 강추해요 굿  
20170422,10,가족들과 웃고 즐기는 영화로는 최고인거 같아요~~ 기대했던거 만큼 웃기고 재미있는 영화입니다~~  
20170422,9,이선균 사극도 멋져요안재홍 귀염 2017년 최강 브로맨스  
20170422,9,두 주연 배우의 꿀케미가 돋보이는 영화~ 꿀잼이에요.  
20170422,10,시사회다녀왔는데ㅎㅎㅎㅎ하 완전 꿀잼임돠  
20170422,10,탄탄한 스토리와 두배우의 열연!!! 흥행대박 예감 입니다부산시사회 잘 봤습니다!  
20170422,10,진심 존잼ㅋㅋㅋ이선균 안재홍 둘다 너무 좋다잉 ㅋㅋ  
20170422,10,이런 케미를 바랬던거죠ㅋㅋ 이젠 위엄넘치는 왕보다 몸쓰는 개구장이왕이 좋네요  
20170422,9,이선균님 너무 좋아요~ 항상 잘 보고 있습니다.  
20170422,10,이선균과 안재홍의 케미가 너무 좋네요  
20170422,10,이선균 안재홍 주연의 임금님의 사건수첩! 존잼이네요!! 강츄~~  
20170422,10,이선균씨와 안재홍 더럽♥  
20170422,10,솔직히 원작을 알기 떄문에 기대를 별로 안했음. 시사회로 미리 봤는데 생각보다 잘만들어서 놀람 ㅋ 이선균 잘어울리던데??  
20170422,9,시사회 봤는데 꿀잼이었음 ㅋ  
20170422,10,이선균 사극연기는 처음인것 같은데 잘어울릴 것 같아요! 믿고보는 이선균!!ㅎㅎ  
20170422,10,재밌다. 가족들이랑 보기에도 좋을 것 같음~  
20170421,10,택시에서 두 배우 나오는거 봤는데 선후배간의 정이 느껴져서 좋았습니다 ㅎㅎ 영화 나오면 꼭 볼게요 ㅎ  
20170421,10,웃으면서 보기 좋은 영화에요!!  
20170421,10,시사회로 보고 왔어요.조선제일검 이선균 개꿀잼  
20170421,10,"시사회/쇼케이스 통해서 두번이나 본 영화! 하지만 두번봐도 재미있어용>< 짱짱!! 꿀잼, 꿀케미를 만나볼 수 있는 영화! 많이 웃을 수 있는 영화이면서 어떤 사건이 펼쳐질까 궁금해서 눈을 뗄 수 없는 영화! 개봉하면 또 볼꺼예요^^  "
20170421,10,"이선균, 안재홍 둘다 너무 좋아요~^^ 영화도 재밌었습니다^^  "
20170421,10,유쾌한 궁궐콤비 지금 이 시대 꼬옥 필요한 콤비  
20170421,10,"임금님의 사건수첩 개성넘치는 이선균,안재홍 연기가 너무 재미있었습니다. 코미디 추리활극 신선했어요  "
20170421,6,그냥 가볍게 킬링타임용? 그냥..재밌는 한국영화. 하지만 이거 한국영화임에도 불구하고 자막이 필요하다; 특히 이선균 동굴목소리가 그 시대 특유의 단어를 만나서 웅얼웅얼...  
20170421,10,건대 쇼케이스 다녀왔는데 정말 너무 재밌었어요 남녀노소 누구나 좋아할 영화입니다! 꼭 보세요 정말 너무 재밌어서 시간 가는 줄 몰랐고 다시한번 느끼는 거지만 이선균 배우님은 연기를 정말 잘하십니다 이 시대 최고의 배우 목소리도 꿀:) 영화 대박나세요!  
20170421,10,1468년 조선의 명콤비 2017년 대한민국으로 환생해 주셔요. 사이다였습니다  
20170421,10,사실큰기대안했었는데남남남 캐미는 정말짱짱맨!!이선균 사극하고도 넘나잘어울리고 안재홍 넘나귀여운!정말 아무생각안하고 많이웃고 유쾌한 영화:)  
20170421,10,건국대에서하는 시사회에 다녀왔는데요 기대이상으로 재미있었습니다  
20170420,8,이선균 멋짐.안재홍 귀염~색다르네요 풋풋 ㅋ  
20170420,10,시사회다녀왔어요!이선균+안재홍 2분의 캐미최고!!!5월 황금연휴때 가족들이랑 다 같이 재밌게 보기 딱 좋은 영화에요영화 대박나세요~~~!  
20170420,9,이선균x안재홍 만이 보여줄 수 있는 코믹 활극 사극!이선균과 안재홍 캐스팅은 신의 한수인듯..웃겨죽는줄..김희원님이 악역인데 젤 멋있어보이는 건 안비밀...어벤져스급 배경음악도 들을 수 있음! 조금 루즈한 부분을 보완해서 2편 나왔으면 좋겠어요!!  
20170420,10,"짜증계의 스칼렛 요한슨이 안재홍의 엉뚱함을 만났을때, 캐미는 단짠단짠 캐미보다 좋다  "
20170420,10,이선균과 안재홍의 케미 짱짱!!!  
20170420,10,안재홍 완전 웃김! 이선균 안재홍의 케미가 꿀잼이에요  
20170420,10,재미있었어요 다시보고싶어여~  
20170420,10,진짜재밌어요~ 다시한번 더 봐야겠어요^^  
20170420,10,못하게 뭔지 모르는 임금님! 재밌네요.  
20170420,10,이선균 안재홍 잘 맞구 경수진 정말 예쁨  
20170420,10,시사회를 보았는데 생각했던 느낌의 스토리는 아니지만 엄청 재미있네욬ㅇㄱㄹㅇ 존잼그리곸 심심한 반전 너무 잼있어요  
20170420,9,이선균이 탁월하다!!  
20170420,10,유쾌하고 통쾌한 스토리 굿  
20170420,10,흑운 존잘 내사랑. ... 아 만화책도 넘 재밌게 봤는데 영화도 이리 재미나게 만들어주시니 감사하옵니다....  
20170420,9,이선균과 안재홍의 케미가 정말 좋았어요~ 미술팀 음악팀 멋집니다!  
20170420,9,임금 예종 역으로 이선균이 좋은 연기자인데   예리한 추리력을 지닌 막무가내 임금. 웃기기도 하고 재미나네요.안재홍은 천재적 기억력을 가진 어리바리 신입사관 이서 역할으로 두 사람의 호흡이 잘 맞아요.  
20170420,9,짱 재밌어요강추 합니다 하하  
20170420,9,스토리가 탄탄해서 볼만함  
20170420,10,"오랜만에 정말재밌는사극 봄, 통쾌하고 속이시원한 영화였어요!!  "
20170420,10,재미와 연기 모두잡은 영화. 이선균과 안제홍의 케미가 환상적! 보고있으면 웃음이 빵빵 터지게 만드는 웃기는 스토리까지!  
20170420,8,재미난 사건 풀이왕과 사관릐 브로맨스짱!  
20170420,9,역시 환상의 콤비네요.잼남~케미 짱!  
20170420,3,영화를 이렇게 만들어놓고 시사회를 하는 배짱은 인정함  
20170420,10,오랜만의 유쾌한영화 짱짱 봄이즐겁구나  
20170420,10,이선균과 안재홍 그리고 김희원까지 멋진 배우님들의 코믹수사 오늘의 고단함이 싹가시고 넘 웃어서 배아파요~~~대박나세요  
20170420,10,이선균X안재홍의 꿀케미 기대됩니다!  
20170420,9,재미나요 ㅋㅋ  계속웃네요  
20170420,10,믿고 보는 이선균 배우의 연기는 역시 좋았다. 시리즈로 계속 제작되길 응원합니다.  
20170420,10,"신뢰가는  배우들이 모인영화, 당연히봐줘야 함  "
20170420,10,이선균 안재홍씨의 조합이 기대됩니다 :)  
20170420,10,배우들의 케미가 장난 아니네요~흥미로운 스토리~ 잼나요~  
20170420,10,이선균~보고싶다 기대기대  
20170420,10,이선균 안재홍의 멋진 조합으로 즐거움 가득한 영화! 너무 재미나요..  
20170420,10,유쾌 상쾌 통쾌 재밌어요 두남자의 쿨깨미도 짱  
20170420,10,시사회가서 봤어요^^ 이선균씨랑 봉블리씨 합이 아주 좋더라구요^^실컷 웃다 나옴요^^ 흑운으로 나온 정해인씨한테 반해서 나옴^^ 흥행해서 꼭 시즌2 나오길^^  
20170420,10,영화가  너무 기대되고  이선균배우님 안재홍 배우님 너무나  기대됩니다. 응팔 이후 차기작 임금님의 사건수첩 넘나 재미 질것 같아요 !!!!  
20170420,1,응 쓰레기 안봐!!!!  
20170420,1,안 봐도 좆망삘.별점 알바분들 고생 많으십니다^^  
20170420,9,재미보장 역시 이선균 안재홍  
20170420,6,좋은 배우들 데려다..스토리가 너무 부진해서 아쉬웟다..ㅜㅜ 정통 코미디를 할껀지..진지한  역사극을 펼친건지..이것도 저도 아닌..ㅜㅜ  
20170420,7,코믹함이 클 줄 알았는데 의외로 사건을 진지하게 풀어냈어요. 재밌었습니다  
20170419,10,유쾌하고 재밌는 영화입니다. 이선균씨의  특유의 목소리도 있고 역사극에 코믹요소도 많아 보기 편하네요.  
20170419,10,가족끼리 동료끼리 친구끼리 부담없이 즐길수 있는 유쾌한 영화였습니다. 사극에 잘 등장하지 않는 예종의 등장이 신선했네요.  
20170419,10,진짜 너무 재미있었어요~역사를 재미있게 다가갈 수 있어서 좋았고이선균과 안재홍의 케미로 너무너무 재미있게봤어요~국사시간에는 깊이 배우지 못했던 예종의 이야기를 가까이서 볼 수 있어서 뜻깊은 시간 이었습니다^^  
20170419,10,꿀잼 너무  웃기네요 안재홍 멍한게 진짜연기잘하네여  
20170419,10,이선균과 안재홍의 콤비가 이 영화를 멋있게 재밌게 만들어주었다. 기대없이 본 영화지만 역시 보길 잘했다 최고였다  
20170419,5,"이선균 안재홍, 두 배우의 케미가 괜찮다.  "
20170419,10,이선균과 안재홍 콤비의 깨알 웃음. 마지막까지 웃음을 선사해주네요.ㅎㅎ 요즘 세상 삼보 안재홍 같은 충신이 아쉬울 때인 듯.  
20170419,10,예종 이선균과 삼보의 브로맨스 ㅎㅎ  베스트 커플 ㅎㅎ  
20170419,8,재미있고유쾌하네요. 추천추천!! 안재홍너무귀엽당  
20170419,10,시사회 관람했어요 두 배우의 케미 폭발 최고예요 2편 나와줄거죠??  
20170419,9,"시사회로 가서 봤는데, 기대보다 훨씬 재밌게 봤어요!! 안재홍, 이선균 케미가 진짜 키포인트!! 여러분 이거 보세요!!!! 시험 끝나고 보면 기분 더 좋아질 영화  "
20170419,10,너무 정말 재미있었어요~ 흥행대박!!!  
20170419,10,예고만 봐도 두남자 케미 킹왕짱. 빨리 개봉해라.  
20170419,10,5월 연휴 온가족 웃음보장! 추천합니다!  
20170419,8,이선균같은 왕이 있다면~멋짐~~그리고 개그 뻔한듯하지만 이선균만의 매력이 있다  
20170419,10,신선하고 유쾌하지 않을까 하는 예상 기대점수  
20170419,10,두사람의 캐미 재밌었어요~  
20170419,10,이런... 마성의 콤비 ㅠㅠㅠㅠ  
20170419,10,영화 너무 궁금해요!!!! 연휴 때 볼 영화로 기대중입니다  
20170419,10," 스토리, 영상, 디테일까지 대박. 기대안했는데 역시 이선균 배역이랑 너무 잘어울리고 안재홍 졸귀...♥? 캐릭터도 좋고 2탄도 나왔으면 좋겠다  "
20170419,4,c+급영화 영화관에서 보기에는 아까움  
20170418,9,오늘 영등포 시사회로 보고 왔어요~ 안재홍 원래 팬인데 임금님의사건수첩에서도 넘 재밌게 나오네요~ ㅎ 조선명탐정과 약간 비슷하지만 임금님이 직접 후덜덜한 액션 많이 취하시네요~ 강추합니다~  
20170418,10,기대안하고 봤는데 계속 실실 웃었다 ㅋㅋㅋ 웃기고 재밌다 ㅎㅎ 킬링타임으로 굿!  
20170418,10,이선균 안재홍 두분의 미친케미덕에 보는 내내 웃었어요 진짜 계속 시리즈로 만들어주세요  
20170418,10,시사회봤는데 아 진짜 웃느라 시간가는줄 몰랐네요 능청스러운 연기때문에 몰입도가 장난아녔어요  
20170418,10,오랜만의코믹하고재미있는영화1초의따분함없이웃으면서본영화매력적인임금의이선균과넘귀여운안재홍영화개봉하면또봐야겠어요^^  
20170418,10,2시간이란시간이  언제지나갔는지 너무 재미있게 관람하여습니다.배우 이선균님과 재홍님의  꿀케미도  너무 좋았어요.  
20170418,10,반전매력 이선균!! 역시 웃긴 안재홍!!  
20170418,10,둘이 진짜 잘어울리네요 ㅎㅎㅎ  
20170418,10,Cgv 영등포 시사회 보고 왔습니다!! 재미있게 볼 영화로 추천드려요이선균씨 안재홍씨 케미 짱좋아요! 특히 안재홍씨 진짜 너무 웃겨요~ 나중엔 얼굴나오면 웃을 준비했네요(보러가기 전엔 기대 없었는데 막상 영화보니 짱잼이었다는ㅎㅎ)  
20170418,9,"영등포CGV 시사회로 보고왔습니다. 이선균,안재홍 배우 연기 케미가 너무 좋았어요! 조선명탐정 처럼 2도 했으면 좋겠어요~시리즈처럼ㅎㅎ 강추합니다  "
20170418,10,정말 유쾌하고 통쾌한 시간이었어요.재밌어요.ㅎㅎ  
20170418,10,진짜 시간가는줄 모르고 봤습니다. 올봄 최고의 킬링타임 무비 이지 싶습니다. 흥행 장담해요~  
20170418,10,이선균 넘넘 멋지고 안재홍도 신의 한 수!!  
20170418,10,시사회 보고 왔네용 주연배우들 케미에 내내 웃었습니다 가볍게 웃고 즐길 가족영화로 추천!  
20170418,8,시사회로 보고왔는데 두 배우의 케미가 꽤나 좋습니다.  
20170418,8,"웃음빵빵! 신나게 웃네요~이선균, 안재홍의 케미가 굿입니다!!  "
20170418,10,너무 보고싶었는데 봐서 너무 좋아요  
20170418,10,"이선균-안재홍 캐미 굿굿ㅎㅎㅎ가족끼리, 혹은 웃음이 필요할 때 보면 좋을영화 :D  "
20170418,10,방금 시사회로 관람했습니다! 솔직히 기대 많이 안했는데 소소한 웃음이 끊이지 않았네요. 두 주연배우 케미만으로도 볼 만한 영화라고 생각합니다.  
20170418,10,꿀케미  ㅋㅋㅋㅋ 엄청 재밌게 봤어요!!!  
20170418,9,이선균과 안재홍의 남남 케미 짱!  
20170418,7,같이 보러간 언니가 재밌게 본거 같아서 좋았어요 ㅎㅎ  
20170418,10,영등포 CGV에서 시사회 봤어요이선균 안재홍 꿀케미 재밌어요  
20170418,3,시사회로 관람! 배우들은 호감이나 캐릭터의 매력도는 글쎄  
20170418,9,가볍고.재밌게.보기.좋아요. 심각한 거 보기 싫을 때 추천  
20170418,10,시사회 봤는데 2시간을 쉴새없이 웃고 떠들다 갑니다~! 잘봤습니다.^^* 대박나세요~!  
20170418,10,이선균과 안재홍의 미친 드립과 능청스런 연기덕에 보는 내내 웃었어요 흑운 짱 멋지고ㅠ정말 시간가는줄 몰랐어요  
20170418,10,사극 연기에 처음 도전하셨다는 이선균님의 연기는 잘 맞는 옷을 입은듯 어울렸어요. 안재홍님과의 케미도 훌륭했습니다. 재미와 긴장감까지 더해져 종합선물세트 같은 영화였어요. 강추합니다.  
20170418,2,한개는 그냥 귀여워서 준다  
20170418,10,방금 영등포CGV에서 시사회보고나왔는데요진짜 이선균이랑 안재홍 케미 너무 웃겨요ㅠㅠ너무재밌었습니다 어깨가 너무 들썩거려서 참느라 힘들었어요ㅋㅋ 개봉하면 또 보러가려구요!!!최고였습니다  
20170418,10,기대한만큼 유쾌상쾌통쾌하고 코믹한 대박영화~~1000만은 어렵겠지만 500만은 볼 영화~~  
20170418,10,이거는 꼭 봐야한다이선균의 넘치는 매력과 안재홍의 초절정귀여움에 케미가 짱이다  
20170418,8,시사회로 봤어요. 웃겨요  
20170418,10,시사회로 봤는데 진짜 너무 웃겨요!!!안재홍...짱...사랑...♡코미디와 약간의 감동 굿!  
20170418,8,안재홍 너무너무 귀엽고 러블리해요소소한 재미가 있는 영화! 가볍게 보기 추천해요  
20170418,10,이선균과 안채홍의 캐미가 너무 좋았어요♥  
20170418,8,별기대없이 봤는데 생각보다 재미있고 유쾌하네요ㅋ주변에 추천할게요  
20170418,10,재밌게 잘 봤습니다^^~  
20170418,10,"시사회 다녀왔습니다.영화 보는 내내 유쾌,상쾌,통쾌!!!두배우의 케미 역시 최고!!!대박 나길 바래요. 돈주고 또 봅니당  "
20170418,10,오랜만에보는 한국영화역시 잼있다  
20170418,9,재밌어용 그레잇 !!!정말 아껍지 않은 시간이었습니다 !!!!  
20170418,8,"시사회로 봤는데, 안재홍 최고예요ㅎㅎㅎ 안재홍과 이선균의 케미가 좋았어요ㅋㅋ 약간의 현대언어의 퓨전에 적응할 시간이 필요함ㅋ  "
20170418,10,이선균의 까불까불하지만 매력터지는 왕 역할! 너무 재밌게 봤어요.^^  
20170418,10,빵빵터지는 멋진영화 기대해두 좋아요  
20170418,10,오랜만에 실컷 웃다가 갑니다^^  
20170418,8,이선균과 안재홍의 캐미가 좋아서 영화재밌게 보았습니다!! 기대했던 것 보다는 이하입니당....ㅎㅎ  
20170418,9,임금이 너무 재밌네요~~  
20170418,8,대통령 선거를 앞둔 이 시점에 이런 왕이 이번에 뽑히면 얼마나 좋을까 라는 생각을 하게 되었음 지혜롭고 나라를 생각하고 부패를 과감하게 뿌리 뽑읗 수 있었으면 좋겠음이선균씨와 안재홍님이 다 한 영화임 내용은 약간... 산으로 가는 갑이 있음  
20170418,10,넘넘 재밌어요!!!! 영화시작부터 웃음만빵  
20170418,9,시사회봤는데 재밌네요! 이선균님 목소리가 왕왕다우심ㅋㅋㅋ  
20170418,10,즐겁게 온가족이 볼수있는 영화인것 같습니다~  
20170418,10,임금님의 사건수첩 너무 재미있게 보았습니다. 배우들의 연기가 멋지네요~  
20170418,10,요즘 본 영화중 제일 재밌었어요!! 안재홍 귀엽고 이선균 믿고봅니다!!  
20170418,10,시사회로 미리 접하였는데 이선균 안재홍 캐미 짱이네요!!이선균 홍블리 커플상!!♥한국판 셜록을 보는 느낌이었다!!추천!꾸르잼!!  
20170418,10,시사회 다녀왔는데 완전 꿀잼~이선균도 짱이지만 안재홍 역시....대박~!!!!  
20170418,10,임금님의 사건수첩 기대안햇는데 알차고 재밋어용!! 추천!!  
20170418,10,배우보는 재미이선균의 사극의 맛 좋네요  
20170418,7,팝콘영화로 괜찮은거같내요  
20170418,7,미적찌근한 코믹물입니다  
20170418,10,임금님의사건수첩   유쾌한 수사극 재미있어요  
20170418,10,임금님의 사건수첩 재밌어용!! 추천추천  
20170418,9,장영실은 위대하다 재밋엇어요  
20170418,10,주연 조연 모두 훈훈.하고 원작 충실히 재미있게 잘만들었네요. 강추해요  
20170418,10,시사회에서 즐겁게 잘 보고 왔어요! 이선균 멋있네요!! ㅎㅎ  
20170418,8,멋진 임금님이엿군요ㅋㅋ  
20170418,9,역시 믿고보는 이선균~ㅋ 완전 재밌어요~^^  
20170418,10,진짜 핵재밌다 이선균과 안재홍의 미친 케미!!조선명탐정처럼 시리즈로 계속 만들어주세요 제발  
20170418,9,안재헝과 이선균의 멋진 콤비 재밌습니다.강추!!!  
20170418,9,코메디에 스피디한 진행 재미나네요  
20170418,10,이선균과 안재홍의 케미 대박입니다!! 꼭보시길  
20170418,9,케미가 좋은 영화 ~ 2편 기대합니다욧  
20170418,10,추리소설 보는 듯한친구 같은 말투 신세대 말투재미 있다#임금님의사건수첩 #사건수첩  
20170418,10,이선균X안재홍 둘다 짱짱  
20170418,10,이선균의 첫사극! 성공적!  
20170418,10,재밌더라~ 역시 이선균 나오는 영화들은 평타 이상인듯  
20170418,10,어제 왕십리 시사회 갔다왔는데 짱잼 ㅜㅜㅎㅎ자극적이거나부담스럽지 않은 내용이라 가족들이랑 보기에도 좋을 것 같구 무엇보다 이선균이랑 안재홍 실제로 봐서 너무 조아뜸ㅋㅋ♡  
20170418,10,배우들 케미 쩔고 흥미진진하고ㅋㅋㅋ 마지막까지 너무 재밌게 보고 옴 개봉하면 입소문 제대로 타서 흥하길!!  
20170418,10,둘이 은근 잘 어울릴 듯 ㅋ  
20170418,10,진짜 예고편 졸잼임ㅋㅋㅋㅋ 빨리 개봉하라굿!!!!  
20170418,10,예고봤는뎈ㅋㅋ재밌어 보여요  
20170418,1,"에휴, 벌써 손발이 오글.  "
20170418,10,"신선한 조합이 만들어낼 새로운 추리영화여서 기대가 되요! 특히 요즘 웃을 일이 없는데, 많이 웃겨준다면 금상첨화에요 ㅎㅎ  "
20170418,9,두 배우들의 엄청난 케밐ㅋ  
20170418,1,원작팬은 울면서 예고편봤다..진짜... 그 작품을 이렇게 만들어놓냐... 원작따라갔으면 흥행보증인데 ㄹㅇ..  
20170418,8,"시사회 보고왔습니다~ 스토리 짜임이 엉성하고, 조금은 유치하게 느껴지며, 경수진씨의 연기가 몰입 확 깨지만..! 안재홍 이선균 케미가 다함..! 안재홍 세젤귀..계속 빵빵터짐 봉골레선균 멋짐.  "
20170418,10,기대된닼ㅋ 엄청 웃길듯ㅋㅋㅋ  
20170418,10,ㅋㅋㅋ아 재밌겠다 반응 좋던데!! 케미 기다림  
20170418,9,이런 조합 자주자주 나와줬으면 좋겠어요!! 캐스팅부터 코믹 예감 ㅋㅋ  
20170418,10,안재홍 이선균 케미 기대됨!!!  
20170418,10,두 남주의 케미 완전 러블리~~  
20170417,4,시사회 관람했는데ㅜㅜ 두시간내내 졸았다는ㄷㄷ밑의평점들 커피쿠폰땜에 올린것들ㄷㄷ  
20170417,10,"이선균 개 쌕쒸, 안재홍 개 귀염  "
20170417,10,어명인데?! ㅋㅋㅋ 극한직업 ㅋㅋ 안재홍 만세!  
20170417,10,아 완전 낄낄대며 봤어요! 무대인사도 있어서 최고였음!  
20170417,1,와우 정말 재미없네욤ㅎㅎ  
20170417,1,방금 시사회 보고 나왔는대 역대급 핵노잼 진심입니다보지마세요 이거진심임 ㅡㅡ 개빡침진짜  
20170417,10,우리도 다재다능한 임금이 있음 좋겠다 ㅠㅠㅠ  
20170417,9,쟘나게 잘보고가네요ㅋㅋ  
20170417,7,내 이름이 이~전하요!!ㅋㅋㅋㅋ 기대됩니다.  
20170417,10,시사회로 잘 관람했습니다!!  
20170417,10,만화로 미리보고 봐서 더 재밌게 봤어요*_*  
20170417,9,참고로 예종은 19살까지 살았는데 ㅠㅠ 그럼 이선균님은 현실 고등학생나이 ㅠㅠ....  
20170417,1,예고편에 어명인데? 하는거보고 기대감 팍 다운.  
20170417,10,유쾌하고 웃길것 같음ㅋㅋ 재밌겠다  
20170417,10,오 믿고 보는 배우들이구만 재밌겠다 ㅋ  
20170416,7,이선균 사극목소리톤이 너무 일정해서 몰입이좀 떨어지네...  
20170416,10,초대박 아니면 개쪽박 영화 뚜껑열리면 알겠지 500만~600만 or 45만~60만 갑니다포스터만 봐선 노잼  
20170416,1,평점 쥬작할 거면 티 안나게 하자.  
20170415,10,새로운 장르의 사극이네요 기대됩니다  
20170415,10,모두 다 꼭 봅시다 코미디라하면 꼭 봐야하는 법  
20170415,10,뭐냐 또 표절충이냐???? 원작 있다 적인걸보다 먼저다 제발 쫌  
20170415,1,뭐냐 또 적인걸 따라한거냐???? 제발 쫌  
20170414,1,영화도 시대에 맞게 만들어야지 역사 왜곡코미디 아니면 조폭깽판 영화나 만들고잇네  
20170414,1,아니 예고편만 봐도 딱 느끼는건데 이게 조선명탐정이랑 뭐가 다르냐. 관객수준이 개똥이니 제작자들도 개똥처럼 만들지. 입만아프다  
20170414,1,사극 코미디 지겹다 지겨워  
20170414,1,"진짜 웬만하면 댓글 안다는데, 버스에서 맨날 이 광고나오는데 듣기싫음 진짜..  "
20170413,1,알바들 시급이 궁금하다  
20170413,10,이 영화는 꼭 영화관가서 친구들이랑 보고싶네요~  
20170413,10,이선균 안재홍이면 말 다했다  
20170413,10,헐이선균안재홍ㅠㅠ예고편을지금보다니  
20170413,10,조합 기대돼요 ㅋㅋㅋ  사극코미디는 평타이상치는듯  
20170412,10,봉블리 빨리 보고 싶어여 ㅠㅠ  
