0,1,2
20170412,1,뭐만하면 '믿고보는...'이런글 자꾸 적어대는데 제목에서 벌써 다운로드로 직행하라는 뜻이 나타나네.미안하다.이런 영화 열정없이 자꾸 찍지마라.  
20170412,10,뭘 고민하나..이선균이 사극을 찍는다는데 워후!!!!  
20170412,6,영화에 몰입 안될듯 뭔가  
20170411,9,"이런류의 영화 넘 애정하는데...하아,,.개봉일이 좀더 빨랐으면...ㅜㅜ  "
20170411,10,이영화는 500만은 통과한다.  
20170411,10,어떻게 이 조합으로 기대를 안하나?ㅋㅋ  
20170411,10,ㅋㅋㅋㅋ안재홍 진짜 너무너무너무기대중이에요 얼굴이 코믹 젤 잘함  
20170411,10,너무 기대돼요!! 꼭 보고싶어요  
20170411,10,재위기간도 짧고 찌질한왕 예종이 주인공이네??  
20170410,5,4/11 개봉이었잖나...ㅠㅠ  
20170410,10,버스에서 광고 나오는데 여기가 임금님의 사건수첩을 볼 수 있는 극장이 있답니다이보다는 여기에 임금님의 사건수첩을 볼 수 있는 극장이 있답니다가 듣기 좋을 것 같다는 생각 ㅎ0ㅎ  
20170410,10,기다리고 있습니다  두 배우의 캐미!!!!  
20170410,1,하.. 미스캐스팅에 감독전작들..  5월황금연휴 노리는거 같은데.. 첫주말부터 교차상영 될듯..  
20170409,10,꿀케미 기대합니다bb  
20170409,10,이선균 안재홍 믿고보는 흥행보증이다~빨리보구십따~  
20170408,5,으음 원작의 임금님이랑 이선균이랑 별로 안어울림  
20170408,1,예종즉위떼예종19살밑인데  
20170408,10,기대되네 조선판 투캅스ㅋㅋ  
20170408,1,내가 광고보다가 이런거 적으러 안오는 사람인데... 와 진짜 심각하게 노잼 망작냄새나서 그리고 보니까 짜증이나서 적으러 왔다 쓰레기같네  
20170407,10,이선균이랑 정봉이 조합인데 무조건 꿀잼 보장.. 성난변호사도 그렇고 은근히 이선균이 영화선택을 잘하는듯ㅎㅎ 이선균 영화 재밌엉 ㅎㅎ  
20170407,10,보고 싶다!! 예고편만 봐도 꿀잼이네 >_<  
20170406,2,흥행 못할 삘이 온다....b급 재미없는 영화.. 휴.. 좀 색다른 영화 안나오나? 요즘 영화 장르가 다비슷비슷  
20170406,10,포스터 속에 안재홍 표정 넘 귀여움 ㅋㅋㅋㅋ  
20170406,10,예고편 안재홍 너무 웃김ㅋㅋ잘못봐서 오늘 개봉인줄 알았는데 20일이나 더 남았다니ㅠㅠ  
20170406,10,간만에 사극 코미디네요!! 기대됩니다 ㅎㅎㅎ  
20170406,10,예고편 짱웃김ㅋㅋㅋ 영화 재밌어보임  
20170406,10,이선균 안재홍 케미 기대기대  
20170406,1,실제 역사속에 예종은 애비가 왕위찬탈한 콤플렉스를 그대로 물려받아 재위 내내 찌질이 짓 하다가 일찍 급사한 인물인데 피카레스크 구성이라면 모를까 예고편 봐선 꽤나 심각한 역사왜곡 물이 될 가능성이 높아보임. 실제 연산군~선OO지 정국혼란에 일조한 인물  
20170405,10,이선균 정봉이 조합이면 말 다했제~  
20170405,10,목소리 갑 이선균에 봉블리까지 나오면 일단 보는거지 뭐 난 기대중  
20170405,5,"참 b급 스멜 물씬나네.,.  "
20170403,10,예고편 보니까 웃길거같던데 보고싶음ㅋㅋ  
20170402,1,씹노잼일듯 ㅋㅋㅎㅎ.  
20170401,10,좋은 약재가 모인 십전대보탕  
20170330,10,정봉요정~~~~영화 기대되네엽 ㅋ  
20170328,5,배우들께 죄송하지만 원작에 비해 넘나 아쉬운 캐스팅ㅠㅠ  
20170327,10,아니 그래서 개봉은 언제요!!! ㅜㅜ 엉엉 어여보고파영  
20170325,9,이선균 짱죠아하지만 예종은 열아홉에 죽었는데 너무 나이드신거 아닙니까!!!!ㅋㅋ꿀케미 기대합니당  
20170323,8,원작은 스토리만 따온건가 인물들도 좀 따오지  
20170322,10,이선균님 너무좋음ㅜㅜ근데 예고편에서 왠지 자꾸 파스타 쉐프말투같은느낌;  
20170320,10,안재홍에... 경수진까지!(조연이지만) 4월 언제냐 보러가야지 ㅋㅋㅋ  
20170320,10,선균이형.. 저를 가져요.. 사랑해요  
20170319,10,그냥 이선균 연기스타일이 완전 내 스타일.. 빨리 나왔으면..ㅠㅠ  
20170318,10,믿고보는 균임다!!! 얼른 개봉했으면 좋겠어요ㅜㅜㅜㅜ  
20170318,10,캐미도 기대되고 재밌을것같음 ㅎㅎ  
20170318,10,조작된도시이후 잼난거 기댕기고있는데 요게 그거  
20170317,5,역사에서의 예종은 요절하지 않았나요?  
20170317,9,"아기다리 고기다리 던 ""선균!!"" ㅋㅋㅋ  "
20170317,10,예고편보니 대박 냄새가풍긴다  
20170317,10,수양대군 아들인 예종이 주인공이네요ㅋㅋ기대해봅니다  
20170317,9,기대 만빵! 10점 주면 알바라고 할거니까 9점..  
20170316,10,일단 예고편은 기대하게하네 ㅋㅋㅋ너자냐?ㅋ배급사만 같았으면 조선명탐정이랑 크로스오버해도 대박이었을텐데  
20170316,10,이선균 연기 진짜 물흐르듯 좋다ㅋㅋ 진짜 연기는 아무나 하지말자  
20170316,10,안재홍 ㅠㅠ 이선균까지 나오니 짱짱맨  
20170316,10,이조합 끌린다 ㅋㅋㅋㅋ빨리 개봉해라 ㅠ  
20170316,1,별로 예종이 20살때 죽었는데 너무 나이 많아보인다. 아무리 영화라지만 역사인물 쓸거면 고증 지켜자면서 하는게 좋을듯  
20170315,10,아 재밌는 영화도 없는데 이거 대박 기대  
20170315,10,"이선균, 안재홍 조합 무지 기대됩니다!!  "
20170315,10,"한복 입고 사극영화 찍는 균배우, 놓칠 수 없지!!!!  "
20170315,1,포스터에 오류가 있네요;; '짐'은 중국의 황제가 자기 자신을 가르킬때 쓰이는 호칭 입니다. 조선의 임금은 자기 자신을 가르킬때는 '짐'이 아니라 '과인'이라고 합니다. 제발 기본적인 상식을 지킵시다.. 아무리 영화라고 하지만  
20170314,10,의외로 이런 영화가 대박난다는거..살포시 기대해봅니다  
20170314,10,기대하고 있어요~!!  
20170308,10,꺄 이선균!!!! 내가 제일 좋아하는 스토리에 이선균이라닝.. ♥  
20170306,10,이선균과 안재홍ㅋㅋ 캐스팅만봐도 기대된다!! 꿀잼일듯ㅋㅋ  
20170306,10,ㅋㅋㅋ이선균에 안재홍 그리고 정해인까지 완벽해  
20170123,10,진심 기대됨 ㅠㅠ ㅠㅠ 이런 소재 너무 좋다ㅎㅎ  
20170106,10,우리 해인오빠나온대서 타고왔어요♡ 기대되네요 오빠사극♡♡  
20160901,1,스텝이 싸가지를 밥말아 처먹었요 우리보고 치워라고 고성을질렀어요  
20160802,10,좋은배우들..좋아요  
20160720,10,전 주연과조연배우님들 구성어 좋고 빨리개봉했음좋겠네요 보고싶어요 대박기원ㅋㅋ  
20160625,1,"라인업보니간 이미 폭망각이네, 투자자 빈털각이다 안재홍 이선균..  "
20160623,6,만화 원작과 넘나 동떨어진 캐스팅ㅠㅠ 젊은 군주 예종과 꽃돌이 사관 윤이서는 어디로....ㅠㅠ 각색이 많이 되겠죠??  
20160621,8,정봉이 신인중 최고의 기대주  
20160521,10,기대~ 이선균 안재홍이라니 조합 끝내주네요~  
20160407,10,영화사랑 같은 빌딩3층인데 시사회좀초대해주세요^^기대 많이 해봅니다 영화인들이 자주 바쁘게 오가는데.궁금하고 기대됩니다  
20160317,6,글쎄 영화는 봐야 알겠지만 이선균 발성이 사극하곤어울리지않는 중저음톤이라  
20160311,10,이선균의  사극이라...완전 기대됨 !!! 안재홍과의 호흡이라 ~~  보고싶다  언능  
20160309,10,"이선균,안재홍 거기다 문현성감독님 기대만빵 ^^  "
20160221,10,이선균 안재홍의 임금님의 사건수첩 캐스팅 좋다!!!  
20160220,10,코리아 문현성 감독님...진짜 기대 됩니다.^^  
20160218,10,홍블리ㅠㅠ이선균이랑 꿀케미 기대 함ㅠㅠ!!!  
20160218,10,이선균에 러블리 재홍까지 ㅋㅋ 이 두 콤비 기대된다  
20160121,1,이런거 좀 만들지 마라..휴...  
20160112,10,믿보균!!! 믿고보는 이선균 ?균오빠영화는 언제나 실망이없다.  
20151126,10,코리아로 큰 감동을 줬던 문현성감독님~~차기작 정말 기대가 큽니다~^^  
20151111,10,관록의 문현성 감독님 작품이니까  
20151031,10,보고싶어요! 믿고보는 문현성 감독님!ㅎㅎㅎ  
20151015,10,이만화책 마지막이약간급전개긴했지만 제대로만하면 레알꿀잼bb  
20151010,10,이선균 주연이자나ㅎㅎ  
