0,1,2
20161206,10,스무살때 진짜 너무 미칠듯이 가슴 터질듯 좋아했던 그 아이가 생각나는 영화!!!! 그리고 가끔 아주 가끔 너가 너의 스무살을 돌이켜보았을때 내가 있었으면...정말 너무나도 좋아했어...  
20161206,10,시사회로 보고왔는데 크~ 연말과 정말 잘 어울리는 영화에요잔잔하게 2시간을 20분으로 만드는 영화!원작을 궁금하게하는 영화!!부모님께 보여드려도 좋을 영화네요  
20161206,10,이영화 대박이었음.다시한번 보고 싶다.~~^^  
20161206,10,이거 진짜 모두가 봐야할 영화다.. 새롭고 너무 좋았어  
20161206,9,제일 좋아했던 소설이 영화로 나와서 너무 좋아요^^ 빨리 개봉했으면 좋겠습니다~!  
20161206,10,두시간 동안 감동 재미 슬픔의 감정을 다 느낄 수 있어요  
20161206,10,정말 마음이 따뜻해지는 영화임ㅠㅠ보고나니 뭔가 벅차오른다  
20161206,10,한 해 마무리하는데 정말 좋은 영화가 될 것 같다  
20161206,10,어제 부모님께 툴툴대던 내가 생각났다 앞으로 잘해드려야지ㅜㅜ  
20161206,10,평생 후회할 만한 행동을 하면 안되겠다 정말..  
20161206,9,항상 시간을 되돌리고 싶다는 생각을 많이 하는데 이 영화보니까 뭉클하다  
20161206,10,잼있어서시간이후딱지나가네요!!최고였구요~ 현재의소중함부모님소중함인연의소중함이잔잔히느껴지는영화네요!꼭보세요~연기들넘잘해용  
20161206,10,얼마전에 잘못했던 일들이 다 떠오르는..ㅎㅎ  
20161206,10,진짜 겨울영화답게 따뜻해지는 니트같은 영화였다  
20161206,9,그냥 잔잔한 영화인 줄 알았는데 가면 갈 수록 긴장도 되더라  
20161206,10,만약에 나에게도 저런 알약이 주어진다면..하는 생각을 계속 하게 한 영화  
20161206,10,부모님 생각도 많이나네요 앞으로 더 잘해드릴겁니다  
20161206,10,이거 진짜 소설로 인상깊게 봤던 기억이 새록새록 나네요  
20161206,10,옛날 첫사랑이 선물해준 소설책인데.책앞장에 편지까지 써서..영화로나오니 가슴이 찡하네... 그는 지금 어디에.  
20161206,10,시사회 보고왔는데 원작을 너무 잘 살려서 좋았습니다.  
20161206,1,김윤석 말하는거보니 짜증나서 일단 이 영화는 안보는걸로  
20161206,10,저런 알약이 있다면 얼마나 좋을까..ㅋㅋ옛날로 돌아가고싶다  
20161206,10,마음이 벅차오는 영화였어요..여운이 가시질 않네요!  
20161206,9,나중에 후회하지 않기 위해 현재를 열심히 사려구요  
20161206,10,현재의 내 삶을 소중하게 여기게 되었다!영화 정말 좋았다!  
20161206,9,변요한과 김윤석의 케미 정말 대박이네요.. 개봉전 좋은 기회로 좋은 영화 보고 와서 좋아요  
20161206,10,이거 보고 나면 소중한 사람들과의 서로의 소중함을 깨닫게 될듯  
20161206,10,시사회 다녀온 1인으로서 말씀드리자면 김윤석배우님은 멜로해도 눈빛.말투.목소리 ㅜ 너무 좋구요 변요한배우님은 연기시너지 폭발했구요. 채서진배우님은 이뻤습니다.. 아아 이쁘고 연기도 잘했습니다. 결론은 12월24일 개봉에 보러가세요.진짜 보러가세요  
20161206,10,데이트 영화로 정말 좋을 것 같음ㅎㅎ 감성 감성하구만 서로의 소중함을 깨닫게 될듯  
20161206,8,오늘 시사회 보고 왔어요금연 홍보 영화다라는 느낌밖에  
20161205,9,동급 최강 변요한 연기력을 확인한것 만으로도 돈이 아깝지 않음  
20161205,10,알약을 나도 구할수만 있다면..옛추억이 떠오르게 하는 영화였어요  
20161205,10,방금 시사회 갔다 왔는데 영화 너무 잘나왔습니다 배우분들 무대인사도 좋았고 영화 대박날거 같아요!  
20161205,7,소재좋고 배우좋고 연기좋은데.. 아쉽다. 왜 가벼운 웃음을 버리질 못해서는. 좀 더 몽글몽글하게 살짝만 진지하게 임했으면 좋은데..  
20161205,10,"오늘 첫 시사회에 다녀왔습니다. 단순히 '시간여행'을 소재로 한 영화가 아니라, 과거와 현재, 그리고 미래에 대해 다시금 생각해 볼 수 있게 도와주는 따뜻한 영화인것 같아요.   영화의 색감도 참 예뻤고, 순간마다 나오는 절묘한 배경음악들도 좋았어요.  "
20161205,5,뜬금없는 데서 웃음이 터져서 진지한 장면에도 멈추지가 않았다. 감성은 담았으나 2% 부족하다. 변요한이 잘생겼다.  
20161205,10,오늘 최초 시사회 다녀왔습니다원작만큼 최고의 감동과 여운을 주는 영화였어요배우님들 이런대작에 쉽게 연기하기 쉽지않았을텐데너무 잘살려주셔서 제 인생영화 한편 나온것같아요드라마 도깨비가 있다면 영화는 당신 거기 있어줄래요 라고 말할수 있을것같아요b  
20161205,2,흔한 한국 신파극같은 느낌.. 스토리가 너무 뻔하고 눈물이 맺혀야 할 타이밍인 것같은데 도대체 언제 끝나나 시계 확인 했어요ㅠㅠ영화가 끝날듯 절대 끝나지 않아서 120분이 180분처럼 느껴짐ㅎㅎ 그래도 김윤석 연기력에 1점 변요한 얼굴에 1점 드립니다  
20161205,10,인생을 바꿀 10번의 기회. 당신에겐 이 영화를 선택할 단 하나의 기회만 있어요. 감독이 여자분이라 그런지 몰라도 섬세한 연출과 섬세한 스토리. 원작의 감동을 망치지 않은 영화. 진짜 다시 봐도 후회하지 않을 영화.  
20161205,10,십점만점에 십점드림배우들의 열연 너무 감동이었고. 무엇보다 원작에 충실한 스토리 감사합니다.(방금 시사회 봄)  
20161205,10,오늘 시사회로 보고왔는데 재밌게 잘봤어요!! 개봉하면 또 보러가고 싶네요~!!  
20161205,7,드라마로 길게 만들어도 재밌을것같아요.  잘보고왔습니다. 배우들 정말 다 잘 캐스팅하신것 같아요.  
20161205,10,재미있고 따뜼해서 좋았습니다...^^  
20161205,9,오늘  시사회  보고  왔습니다~무대인사도  보고요~~기대는  없이 편한마음으로  보러온건데 감동적이고  재미도 있었습니다~  
20161205,10,시사회봣는데너무재밌어요 ㅎ  
20161205,10,원작이 좋아서인지 영화도 너무 좋았고 배우들의 명연기도 최고였습니다. 강추!  
20161205,9,너무 잘 보고 갑니다..  
20161205,10,첫사랑연아 30년 과거로돌아가는수현 재미있어요  
20161205,10,인생이 뭍어있는 영화네요....  
20161205,10,올해 본 영화중에 제일 최고였다ㅠㅠ다들 연기 왜케잘하능고야  
20161205,10,와~ 감동이예요~ 올겨울에딱  
20161205,10,와 감동이에요~^^♥ 마지막 장면 찡해요~ 올 겨울 훈훈 만들 영화  
20161205,9,책을 인상깊게 읽으신 분이라면 재미있게 볼 수 있습니다. 물론 안봐도 재밌게 볼 수 있습니다. 여운이 많이 남은 영화입니다.  
20161205,10,"김윤석 배우님과 변요한배우의 만남..새롭고도 어딘가 닮은.. 두 배우..과연 나라면.??? 조금은 생각하게  하는 영화..당신, 거기 있어줄래요.???  "
20161205,10,애잔하다 올해최고다 정말  
20161205,9,책이랑 다른듯비슷하지만 꽤 재미있고 좋아요! 괜찮은것같아요!  
20161205,10,많은걸 느끼게 하는 영화였습니다 본걸 후회하지 않게 하네요..  
20161205,9,오늘 시사회로 보고왔는데 기대이상꿀잼!!!시간의소중함을느끼게해주는영화? 눈물은안나오는데감동적 ㅜㅜ  
20161205,10,미쳤다 진짜.. 그냥 스토리도 배우도 완벽함  
20161205,10,감동적이에요~~엄마랑 같이 봤는데 감동이짠해요~~!! 겨울 따뜻한 영화 보세요~^^  
20161205,10,재밋습니다! 감동적입니다  
20161205,9,시간 여행 흥미로운 설정과 달콤한 결말 좋네요  
20161205,10,추운 겨울에 따뜻하게 볼 수 있는 영화같습니다. 강추해요.  
20161205,10,책을 찢고 나온 그들 사실 배경은 기대는 안했지만 그 느낌은 그대로 가지고 온것이 너므 좋았다 따뜻해지는 감성 그대로  
20161205,10,시사회보고 나오는길입니다! 재미와 감동 둘 다 사로잡았네요!! 마지막까지 긴장의 끈을 놓을 수 없었어요. 개봉하면 꼭 보세요^^!  
20161205,10,정말 감동인 영화인것같다.다시한번더 봐도 재미있을영화인거같다.  
20161205,10,책 정말 재밌게봤었는데 책보다도  더 재밌었던  영화! 훈훈했던 결말이 인상적이었습니다!  개봉하면  또 보고싶어요!  
20161205,10,영화보면서 같이 시간여행한 기분..  
20161205,10,마음이 따뜻해지고 좋았어요  
20161205,10,책처럼 잔잔하고 은근한 재미가 있는 영화였어요~~~  
20161205,10,진짜 재밋게봤어요! 책으로도 읽었는데 영화도 재미잇었어요!  
20161205,10,넘넘좋아요기대했던것보다 훨좋은연기역시 김윤석 그리고 충무로의 기대주에서 이젠어엿한주연 변요한 둘의캐미 짱  
20161205,9,원작의 감동 그대로ㅜㅜ  
20161205,9,소중한 사람에 대해 생각하게 되는 영화! 정말 감동받았습니다~  
20161205,10,정 말 너뮤 재밌너요요요요  
20161205,9,영상미와  연기자들 연기가 너무좋았어요  
20161205,10,완전 대박임.저 이렇게 스토리 탄탄한고 영화 보는동안 지루한적 없고 진짜 웃고 우는 영화 처음 보는거 같아요 진심 이영화 두번보고 세번보고 다운받아서 계속 볼거에요ㅠㅠㅠ 일단 변요한오빠 짱!  
20161205,10,따뜻한 영화 너무 잘 봤어요 많은 생각을 하게 만드는 영화네요  
20161205,9,너무 아련하고 좋아요?기대이상  
20161205,10,스토리도 잔잔하고 좋았어요ㅠㅠ  
20161205,10,두 배우의 한 인물 연기가 너무 좋았어요. 감동적이었습니다. 올 겨울 감동적인 영화 기분 좋네요.  
20161205,9,시나리오가 재밌고 감동적이에요  
20161205,10,연기 너무 감동적이게 잘해요  
20161205,10,변요한과 김윤석의 탁월한 연기와 재미있는 스토리 정말 재밌네요 ㅠㅠ  
20161205,10,연기력 탄탄한 분들이라 처음부터 끝까지 너무 재밌었어요!! 추천해요 슬프고 감동적이에요♡  
20161205,10,변요한 너무 잘생겼어요.... 두 배우 연기가 정말 대단합니다! 결말도 마음에 들고 스토리도 완전 흥미진진했어요!!  
20161205,10,잔잔한 스토리가 좋습니다.  
20161205,10,잔잔하고 아름다운 영화였어요♡♡♡  
20161205,10,잔잔하니너무재미있어요  
20161205,10,진짜 내용 탄탄하고 가족끼리던 연인끼리던 꼭 보시길 추천해드립니다!!!! 진짜 감동적 퓨 ㅠㅠㅠ 개봉하면 바로 보고 가세요~  
20161205,10,완전 재밌어요~잔잔한 감동 최고입니다  
20161205,10,정말 감동이있고 즐거운 영화 두 배우의 연기도 훌륭할 뿐만아니라 연출도 좋다  
20161205,10,재밌게 잘 봤어요 :)마음따뜻해지는영화 ㅎㅎ책도 보고싶네요  
20161205,10,영화 재밌게 봤어요!! 과거와 현재를 오가는 영화 ! 마지막까지 마음 따듯해지게 해주네요 강추!!  
20161205,10,방금 시사회 봤는데 재밌어요!!  
20161205,10,완점잼나용..시사회로봤는데 짱잼나욮  
20161205,10,너무 감동이에요^^ 윤석이형 짱  
20161205,10,영화 완전 잼썼어요ㅜㅜ  
20161205,9,너무 좋았어요~~ 연인과 함께보세요~~♡  
20161205,7,볼만해요 그런데 드라마 나인이랑 비슷..  
20161205,10,정말 최고의 영화였습니다  
20161205,10,잔잔하니 재미있었어여 ㅎ  
20161205,10,진짜 재밌어요..완전 몰입해서봤습니다  
20161205,10,꼭보세용 재미있어용ㅎㅎ  
20161205,10,변요한이 연기를 이렇게 잘하는지 몰랐네요 정말 재밌고 이번년도본거중에 제일 재미있어요!!  
20161205,7,원작과는 달리 코믹하네요  
20161205,8,시간 여행이 첫사랑과 함께 묻어나네요.~  
20161205,10,재미있게 잘 봤어요!!!  
20161205,10,삶에 대해 다시한 번 생각하게 되는 영화 연기력이 빛을 발했다 :) 잔잔한 여운이 있는 영화  
20161205,8,잔잔하게 재밌게 봤어요~  
20161205,10,잔잔한감동이몰려오네요ㅜㅜ추천!  
20161205,10,감동적인 영화였어요 강추!!  
20161205,10,와 진짜 상상이상으로 감동적이에요... 꼭 보세요 ??  
20161205,10,나의 당신도 거기에 있어주기를  
20161205,10,정말 감동적이었습니다!!ㅜㅜ  
20161205,10,짱쟈밌어여!!!변요한잘생김  
20161205,10,영화가 끝난 후에에도 여운이 남는 영화네요추천합니다!!!  
20161205,10,건대 롯데시네마 첫시사회에 당첨되서 영화를 봤다. 연기 진짜 장난아니다. 몰입도 너무 좋은 영화였다. 변요한 눈빛이 사람 마음을 이상하게 하는게 있어서 참 좋았다. 책도 한번 읽어보고 싶어진 그런 영화이다. 빨리 개봉했으면 좋겠다!!  
20161205,10,한사람의 인생은 결코 한사람만의 것이 아니였음을~!!!!  
20161205,7,감성이 풍부해지는 영화입니다  
20161205,10,건대 입구역 롯데시네마에서 시사회로 봤는데 웃음과 감동 모두 느낄수있는 영화인 것 같아요ㅠㅠ 계속 울다가 웃었네요ㅠㅠㅠ엉엉 다음에 개봉하면 지인들과 함께 보려구요!  
20161205,10,시간여행과 잘짜여진플롯 좋은작품굿  
20161205,10,현재와 미래가 연결되고 있다는 것을 잘 표현해준 영화이다.  현재의 삶에 충실히 잘 살아야겠다는 생각까지 등게해주는 영화다.  
20161205,10,하..인생영화 예약..  
20161205,10,건대입구 시사회에서 관람 했는데 기대만큼 너무너무 좋았던 였어요!! 마지막에 계속 울었다 웃었다 했어요 ㅠㅜ  
20161205,9,변요한 최고시다ㅠㅠㅠ 채서진 존예..  
20161205,10,책의 주된 줄거리를 너무 잘 표현해줬어요! 연기도 너무 좋고 중간중간 코믹한부분도 많이 넣어주시고 한국배경으로 이 영화가 이렇게까지 잘 표현될줄몰랐어요! 정말 잘 만들었고 재미도 넘치고 눈물까지 나게해준 영화에요 너무 좋아요!  
20161205,10,소설로도  봤었는데  영화로도  잘만든거 같아요 변요한 짱  
20161205,10,기욤뮈소의 작품을 영화로 김윤석님의 명품연기로 볼수있어서 너무 좋았습니다 스토리 탄탄하고 감동있게봤어요  
20161205,10,재밌어요 추천합니다 ㅅㅅㅅ  
20161205,10,완전 감동적이에요!!! 이런 따뜻한 영화 너무 좋아요!! 추천합니다!!!♥?  
20161205,10,진짜 감동이에요!! 짱짱 추천합니당ㅎㅎㅎㅎ  
20161205,10,시사회로 재미있게 봤어요!:)  
20161205,10,엄마랑 고고 가슴따뜻하네 나왔습니다  
20161205,10,완전 꿀잼이에요!!강추합니당 인생명작!  
20161205,9,감동적인 영화입니다~~  
20161205,9,"잔잔하게 감동이 밀려오는 영화, 첫사랑이 생각나는 영화  "
20161205,10,스토리 구성이 너무흥미진진해서 재미있게 봤어요 ^^  
20161205,10,1년만에 스크린에서 보는 김윤석 배우님 넘나 좋아요^^!!  
20161205,10,아련한 첫사랑의추억이 올겨울 따뜻한 감동으로 밀려오네요^^  
20161205,8,시사회 재밌게 잘봤어요~ 담에 또볼거예요~  
20161205,9,올 겨울 가슴 따뜻하게 해 줄 영화네요ㅎ 변요한님 너무 멋있으셔요♡♡♡  
20161205,10,와우 정말잘봤습니다 ㅎㅅㅎ1111  
20161205,10,생각얷이봤는데 그래서 더 잼나게 봤어요♡  
20161205,10,너무 재밌었어요 또 볼게요  
20161205,10,시사회로 보게되었어요. 영화 재밌습니다!  
20161205,10,생각보다 너무 지루하지도 않고 배우들의 연기가 돋보인 영화여서 정말 재밌습니다  
20161205,10,배우들 연기 정말 끝내줬어요ㅠ 시사회에서 봤지만 다시 영화관 봐서 볼거에요!  
20161205,10,너무따뜻한영화예요..여운도많이남고 너무좋아요당신거기있어줄래요 대박나길기도할께요!!!!♡♡♡♡  
20161205,10,정말 재미있게 봤어요 다시한번 보고싶습니다  
20161205,10,신기한 내용 따뜻한 이야기 잘봤습니다!  
20161205,9,배우들의 연기가 인상적... 특히 변요한 .. !  
20161205,10,시사회봣어요 배우들 연기가 좋아 너무 재밌게봤네요  
20161205,10,2016년최고의감성멜로!  
20161205,9,원작소설만큼 영상미가 아름답고 감동적입니다!! 다시한번 보고싶네요!  
20161205,10,아름다운 시간여행. 배우분들의 연기에 몰입했더니 시간 가는줄 몰랐딘  
20161205,9,"내용도 너무 좋고, 연기도 아주 좋았어요! 다른 타임워프영화들과 다르게 모두 해피엔딩인 내용이 아주 특이하네요!!  "
20161205,8,기대안했는데 스토리가 있어서 괜찮았고 과거와미래의 시간을 왔다갔다하는게 신기하고 재밌었습니다. 배우들의 연기도 좋았습니다.^^  
20161205,10,재미잇게 감명깊게 잘 봣어요  원작 소설도 읽어보고 싶을 만큼 잘 만든거같어요!! 굿!!  
20161205,10,연아도 연아디만 태호와의 관계도 너무 감동적이었다 엔딩 취저  
20161205,9,소설을 영화한 작품이라 기대가 많이 됐는데 역시 믿고보는 김윤석 배우님이 나오셔서 정말 재밌게 잘봤어요ㅎ 책 다시 읽어 보고 싶네요~~^^  
20161205,10,재밌습니다! 배우들 연기도 너무 좋습니다  
20161205,10,모든게 아름다웠던 영화  
20161205,10,나는 과연 30년전으로 돌아간다면 어떤 행동을 할지 궁금해지는 영화네요.  
20161205,8,따뜻하고 감동적인 영화.언제나 서렁하는 사람을 위해 언제나 그자리에 있을거예요  
20161205,10,책 재밌게 읽어서 기대했는데 어떻게 영화화 될까 궁금했는데 넘 재밌고 찡했습니다ㅜㅜ 넘 좋았어요!  
20161205,10,변요한님 직접봤는데 와 너무멋있구 영화넘재밋어요!!!  
20161205,8,'김윤석배우님 짱~~재밌네요~  
20161205,10,너무재밋어요 추천이요^^ 배우들 연기끝내줘용♡  
20161205,10,감동적인 작품. 원작 재미 그대로 입니다  
20161205,10,가슴먹먹하게 보고나왔어요. 정말 재밌게 보고왔습니다  
20161205,9,끝까지 감동을 주는 영화였어요..  
20161205,9,첫사랑이 생각나는 영화!! 잘봤습니다^^  
20161205,8,"감동있는 인생이야기. 사랑과 그리움,친구 연인 자식 인간에게 제일 소중한건 역시 사람이라는걸 느끼게 하는 영화  "
20161205,10,잔잔한 감동을 주는 연말 정말 추천하는 영화예요  
20161205,10,매우 재미있고 감동적인 영화입니다  
20161205,10,너무 잼있어요 ㅋㅋ 가슴 따뜻해지는 영화에요!!  
20161205,10,너무 재미있어요 감동적이에요  
20161205,10,그리움이 가득하고 사랑이 가득한 영화  
20161205,10,대사하나가 시와 같아 행복한추억여행을한거 좋았습니다  
20161205,10,너무재미있어요~감동!!!  
20161205,10,시간여행이 끝나지않길바랬어요 너무잘봤습니디  
20161205,10,당신 거기 있어줄래요 너무 감동적이고 좋았어요♡  
20161205,10,재미있었어요!! 꼭보세요~  
20161205,10,원작 잘 각색했습니다ㅎ  
20161205,10,한국형 타임판타지에   흠뻑 빠져들어보자  
20161205,10,변요한 채서진 미모에 반했어요  
20161205,10,정말 재밌는 영화에요 감동적인 영화 한번다들보세요!  
20161205,10,기대이상 추천합니다 타임슬립  
20161205,8,재미있어요 볼만합니다  
20161205,10,재밌어요! 감동적이에요 ㅎㅎ  
20161205,10,감동적이에요!결말이 훈훈  
20161205,10,너무재밌어요 꼭보시길  
20161205,10,너무 재밌게 봤습니다!!!  
20161205,10,연기 최고... 우리나라 영화중에 이런영화 국제시장 이후로 없을듯  
20161205,10,웃음과 감동이 있는 영화보는내내 빠져들었고 무엇보다 30년기다려서 만날만큼 여주인공이 이뻐서 더좋았다 ㅎㅎ  
20161205,9,달달. 해피엔딩은 언제나 옳아요~  
20161205,9,과거를 되돌려 사랑하는 사람을 지키는데 성공해서  다행이네요 시간여행 멋져요  
20161205,10,와 너무 감동적이네요 변요한과 김윤석의 싱크도 너무잘맞았고 너무 슬프지도 너무달달하지도않는딱정닥한영화 영화장면하나하나가 아름다워서 몇번이나 더 볼것같습니다 변요한 김윤석 채서진 너무 좋아요♡영화흥해라♡♡  
20161205,10,시사회로 봤는데 배우들 연기가 너무 좋았어요!  
20161205,8,국내에서 가장 사랑받는 베스트셀러 작가 기욤 뮈소의 원작이면서 전세계 최초로 영화화가됬다는데 대표 연기파 배우 김윤석과 충무로 스타 변요한과 충무로 감성 연출의 대가 홍지영 감독의 시간 여행 판타지 당신 거기 있어줄래요 대박나세요.  
20161205,10,오랜만에 좋은 영화 잘봣습니다.꼭 추천해요^^  
20161205,10,"'당신, 거기 있어줄래요' 는 30년전과 현재의 나가 과거 속에서 사랑하는 연인과 딸을 두고서 갈등하면서 소중한 이들에 대한 사랑 이야기를 안타까운 감성으로 그려준 작품이었네요! 시간과 운명이 함께한 그들과 30년의 세월이 아련하며 아름다웠어요~  "
20161205,10,한순간도 눈을 뗄 수 없는.소름끼치도록 재밌다....  
20161205,9,일단 재미있을것 같다 일단 연기쩌는 연기자들이라서 굳  
20161205,7,영화  시사회  왔어요  재미잏을것같아요  
20161205,10,시사회 봣는데 연기 장난아님;;;;  
20161205,10,개인적으로 작품 선택 능력이 탁월하다고 생각하는 두 배우가 이번에는 어떤 훌륭한 연기를 펼쳐줄지 정말 기대됩니다. 스토리도 탄탄하니 이제 감독의 역량 문제겠군요. 일단 응원하며 기다리도록하겠습니다. 파이팅!  
20161205,10,나인드라마 잼나게 보았는데 나인 뺨치게 잼나네요. 대박날꺼같아요!!  
20161205,10,"시사회이벤트에 당첨되서 영화미리보고왔습니다. 믿고보는배우 김윤석,변요한씨 연기는 실망을 주지않네요. 귀욤뮈소책 중 첫 영화작품인데 흥할것같다는 느낌이듭니다. 탄탄한내용전개때문에 영화에집중할수있었어요!  "
20161205,9,오오 역시.책의 감동과는 살짝 다른 감동이 있지만 이 둘의 연기력은 최고다!!  
20161205,10,김윤석과 변요한 씽크로율 짱짱맨!  
20161205,9,기대 이상으로 감성을 울리는 작품 ^^♥  
20161205,1,부산대정소윤바보ㅋㅋㅋ  
20161205,10,믿고 보는 배우의 영화라서 더 기대가 되는 영화네요.오랜만에 엄마로서가 아니라 여자로서 극장을 찾은 기분입니다.좋았어요.  
20161205,8,과거와 현재의 이야기 넘넘 재밌어요.  
20161205,10,"당신, 거기 있어줄래요 기대되는 영화입니다  "
20161205,8,우왓 역시 김윤석님과 변요환님의 앙상블!  
20161205,10,사랑하는 사람을 찾아떠나는 감동의 시간여행  
20161205,8,재미있게 봤습니다^^  
20161205,10,정말재미있었어요!! 변요한과 김윤석의 만남이라니ㅠㅠㅠ 이 두배우를 좋아하는 저로선 최상의 영화네유 ㅠㅠ  
20161205,8,배우들의 연기는 말할것도 없고 가슴  울리는 스토리에 마음을 빼앗겼네요  
20161205,10,시사회 응모했었는데 안되서 아쉽지만 개봉하면 바로 보러 가겠습니다  
20161205,10,시간 여행 판타지 벌써부터 끌리네요~  
20161205,10,기욤뮈소 원작 소설 진짜 재밌게 봤는데 이거 개봉하면 꼭 볼거임!!  
20161205,9,김윤석 변요한이면 연기는 말할것도 없을듯ㅋㅋ  
20161205,10,원작도 캐스팅도 넘나 기대되는~^^  
20161205,9,김윤석 나오는 영화들은 다 챙겨 보는데 이번에도 기대되는건 어쩔 수 없나 봅니다  
20161205,10,책 진짜 재밌게 읽었던 기억이 있는데 이렇게 영화까지! 기대를 안할수가 없네요!  
20161205,10,브이앱 보고 기대중인 영화♥ 변요한 짱♥  
20161205,10,배우들이 믿고 보라고 출연하는 배우들뿐이네.. 스토리보고 순간 나인이라는 드라마도 떠올랐고.. 기대되네요  
20161205,10,와 이게 영화화 되다니ㅋㅋㅋ 감격스러운건 나뿐인가  
20161205,10,드디어 개봉.. 얼마나 많이 기다렸는지..  
20161205,10,"짧은 예고편에서 김윤석과 변요한이 부딪히는 장면에 참 좋았다. 스릴러 영화에서의 충돌이 아니라, 뭔가 서로의 애절함이 부딪히는 순간이 참 좋았다. 기대됨  "
20161205,10,소설의 느낌 그대로의 배우들이네여  
20161205,10,추워지는 지금 딱 내 감성을 만족시켜줄 수 있는 영화!!!  
20161205,10,"기용뮈소의 세계적 베스트셀러가 한국에서 영화화 되다니.ㅎㅎ 소설도 재밌게 봤었는데, 영화 꼭 볼랍니다 ^^  "
20161205,10,"마음이 엄청 시린 요즘, 따뜻하게 해줄 영화인 듯해서 개봉만 기다립니다! 기욤 뮈소의 베스트셀러를 영화화하다니... 소설만큼이나 좋은 영화를 기대하며!  "
20161205,9,변요한의 연기 너무 기대되요~~  
20161205,10,진심 보고싶은 영화!!좋아하는 소설 원작에 연기파 배우들의 만남이라니!!  
