0,1,2
20161213,10,와 진짜 오늘 시사회 보고 왔는데 아직까지도 그 여운이 가시질 않는다... 진짜 남녀노소 다 볼 수 있는 감탄스러운 영상미와 전개와 스토리였다. 강추  
20161213,9,잔잔한 여운이 남는 영화.  
20161213,8,기대보다 훨씬 좋았습니다. 연말에 어울리는 따뜻한 영화입니다.  
20161213,10,시험 전인덴도 불구하고 학생들이 보러갈 만한 영화  
20161213,10,친구.가족.사랑하는 사람 모두가 떠오르는 영화 잔잔한 감동이 처음부터 끝까지 가는 영화  
20161213,10,오늘 시사회로 보고왔습니다. 너무 좋았어요!!!꼭보시길~!!!!  
20161213,10,너무너무 재밌어요 가족들이랑보라와오!  
20161213,9,"친구랑 봐도, 연인이랑 봐도 좋을! :)  "
20161213,10,재미있었어요~ 부모님이랑 또 보고싶은 영화에요!  
20161213,10,최고의 감성. 때론 웃음. 올겨울 마음이 따뜻해지는 영화입니다. 가족과 꼭 보세요  
20161213,10,어느 연령대나 마음이 따뜻해질 수있는 영화!! 연말강추에요!!!  
20161213,8,김윤석 변요환케미 좋다  
20161213,10,스토리가 정말 좋네요 감동도 있는 영화였습니다  
20161213,10,정말 아름답고 힐링 되는 영화! ㅠㅠ  
20161213,10,엄청 감동적이에요ㅎㅎ  
20161213,9,회귀물 영화로 즐겁게 잘 봤습니다. 여주 예쁘네요.  
20161213,9,마음이 따뜻해지는 영화네요^^  
20161213,9,시사회로 재밌게 보고 갑니다!!  
20161213,10,강추해요. 크리스마스에 기족과 보세요  
20161213,10,되게 잘봣어요!! 꼭 보세요!! 변요한 인생연기요  
20161213,10,완전재미있어요!!!! 책만큼 재미있어요♡♡ 한번꼭보세요  
20161213,10,내용이 정말 알차서 시간가는 줄 모르고 봤네요^^ 배우분들도 연기 너무 잘해요♥?  
20161213,10,왜 30년이나 걸린건진 모르겠지만.  
20161213,10,추운겨울에 따뜻한 영화로 힐링하세요!  
20161213,8,좋은 연기를 보여준 좋은 배우들! 기욤 뮈소 소설이 원작이라 더 좋았다!  
20161213,10,평소 기욤뮈소 책을 다읽었는데 원작과는 많이 다르지만 한국형 으로 잘해석하신거같다 여운이많이남는영화!!  
20161213,10,변요한너무귀여워요!!!! 귀욤뮈소 원작 읽고 봤는데원작이랑 비슷하네요!  
20161213,10,진짜 대박 꼭 보러 오세요!!  
20161213,10,재밌었어요 감동적~ 꼭보러가세요  
20161213,10,진짜 놓치지말고 보세요 ㅠㅠ  
20161213,10,재미있어요!진짜짇짜  
20161213,10,너무나도 감동적이고 생각이 많아지는 영화네요.. 개봉하면 또 보고싶어요..!  
20161213,10,배우들의 연기가 인상적이었어요  
20161213,10,오랜만에 시간가는 줄 모르고 집중해서 볼 수 있어서 행복했어요~^^  
20161213,10,진짜 너무 재밋어요ㅠㅠ잘보고가요  
20161213,10,영화 너무 감동적이에요~~  
20161213,10,"책으로 읽고 영화로 나온다해서 1년을 기다렸는데.. 드디어 개봉전 볼 수 있는 시사회에 당첨되는 기회까지 오고 댑박! 배우들의 연기는 말 할 나위 없고, 책과는 또 다른 감동~ 꼭 보시라 주변분들께 홍보할께요^^  "
20161213,10,책으로 읽고 너무 좋아서 영화로 만들어진다는 소식을 듣고 기다렸는데 운좋게 시사회 당첨되어 보게 되었는데!!역시 기대를 져버리지 않네요!! 원작과 다른 재미가 있네요!! 대박나세요~~!!!  
20161213,10,진짜 너무 재밌어요....감동....ㅜㅜ  
20161213,8,"과거와 미래 속에서 자기 인생 결정한것에 재미있었고, 진지한 이야기가 나타내어서 마음에 들었습니다.  "
20161213,9,보고싶은사람들이 생각나는 영화네요^_^  
20161213,10,소설만큼 감동을 느낄수 있어요ㅠㅠ변요한에 치임ㅜㅠ  
20161213,10,시사회에서 재미있게 봤어요!  
20161213,10,김윤석 연기가 너무 좋ㅇ아요  
20161213,10,정말잼있어요 또보고싶네요  
20161213,10,ㅠㅠ정말 제 스타일이에요. 책보다도 더 재밌었던영화!!  
20161213,9,뻔하지않은스토리여서 집중해서 볼 수 있었어요!! 비주얼 커플도 보기좋아요  
20161213,10,재밌어요!! 꼭 보세요ㅠㅠ!!  
20161213,8,마음이따뜻해지는영화  
20161213,10,스토리나무좋고 연기좋고 너무재밌어요 ㅜㅠ  
20161213,10,"가슴 따뜻하고, 사랑과 사람에 대해 다시 생각할 수 있었습니다. 감사해요:)♡  "
20161213,10,기대한만한 영화였습니당ㅎㅎ  
20161213,9,감동 그자체였다 정말 재밋음!부모님과 꼭 보고싶다  
20161213,10,재밌고 감동적이예요. 가족과 연인과 함께 보시길 강츄  
20161213,9,내가 과거로 돌아간다면 과거를 바꿨을까  
20161213,10,"가족들과함께봐도감동이있고,하루하루감사히살수있을꺼가타요.  "
20161213,10,잘 만든 이야기에 좋은 연기들  
20161213,10,둘다연기짐짜 최고 열저  
20161213,10,제가좋아하는 소설이 영화화되서 바로 보러갔는데 연말에 가족이랑보기 좋은영화인것같네요  
20161213,10,진짜재밌어요꼭보세요ㅜㅜ♡♡  
20161213,7,30년 후의 내 모습을 상상하게 한다!  
20161213,10,감동적이고 재미있어요ㅎㅎ  
20161213,10,감동적이고 정말 재밌어요~!  
20161213,10,한번보고 두번봐도 또보고싶은 감동적인영화 ㅠㅠ  
20161213,10,울다가 웃다가 정말 진짜 재미있어요ㅠㅠㅠㅠ  
20161213,10,너무너무 따듯한영화였습니다 강추해요 ??  
20161213,9,눈물나요ㅠㅠ돌아가신 아빠 생각하다 엉엉 울었네요...ㅎㅎ  
20161213,10,재미있어요~~!!영화잘만들었네요  
20161213,10,원작만큼의 큰 감동..  
20161213,10,진짜..영화너무잘만드셨고너무재밌고최고예요  
20161213,10,너무 재밌고 감동적이예요'  
20161213,10,감동적이에요ㅠㅠㅠㅠ그리고 배우들 연기도 굿입니당  
20161213,10,시사회보고왔는데재밌어요~  
20161213,10,너무재미있게봣어요 변요한씨도너무자미있겝핫어요  
20161213,10,현재 연인들이 소중해지는 영화입니다 너무 감동이에요!!!  
20161213,10,너무 재밌어요다 좋어요꿀잼 다시 볼꺼에요  
20161213,10,시사회에 당첨되어 영화를 보게 되었는데 배우분들의 연기 정말 최고였고 스토리 영상미 무엇하나 빠지지않는 완벽한 영화인 것 같습니다ㅠㅠㅠ 두번 세번 봐야하는 영화입니다! 변요한 짱♡♡  
20161213,10,정말 재미있습니다 해피엔딩이라 너무 좋았어요  
20161213,10,올 겨울 최고의 영화인거 같아요ㅠㅠ 가슴 따뜻한 영화 대박나세요!! ㅠㅠㅠ  
20161213,10,감동받았습니다ㅠㅠㅠㅠ  
20161213,10,기슴먹먹해지고 진짜추천합니다 ㅠㅠ재미있어요  
20161213,10,최고에요!최고최고최고!!!!  
20161213,10,개재밌다듕구규규규귤ㄹ  
20161213,10,너무좋아요감동덕ㅇ예요 연기도 좋고 스토리도 너무 조아요  
20161213,10,연말에 연인이나 친구나 가족이랑 보기 너무 좋은것같아요 다들 연기도 너무 잘하시고 여운이 많이남는 영화에요 꼭보세요~  
20161213,10,잔잔한감동..꼭한번보세요  
20161213,9,감동적이고 배우들 연기짱입니다!  
20161213,9,초반엔지루한테나중엔꿀잼!  
20161213,10,진짜 눈물나고 재밋음ㅠㅠㅠㅠ  
20161213,10,짱재밌어요 ㅠㅠ감도요  
20161213,10,진짜 대박 꼭 보세요ㅠ퓨ㅠㅠㅠ  
20161213,10,완전완전 재미있어요~진짜 짱이에요  
20161213,10,배우분들 연기도 잘하시고 영화도 정~말! 재미있게 봤습니다♡0♡ 또 볼래요  
20161213,10,너무재밌었어요ㅠㅜㅜㅠ7··감동  
20161213,10,뭔가엄청많은 이야기를 해주는 듯한 영화ㅜㅜ 너무 좋아요  
20161213,8,완전재밌어요~~배우분들이 연기너무잘하셔서 몰입도짱이였어요~♡  
20161213,10,너무슬프고 재밋어요ㅠㅠㅠㅠ또보고싶어요ㅠㅠㅠ  
20161213,9,잔잔하게 재미나요~ 김윤석 짱  
20161213,10,진짜 너무 감동적이에요ㅜㅜㅜㅜ안보시면 진짜 후회하실 영화 꼭보세요 두번보세요 ㅠ!!!  
20161213,10,진짜잔잔하게 깊게 여운주는 영화인듯..ㅠㅠ엄청짠해지고 감동적이었다!  
20161213,10,너무 따뜻하고 좋은영화에요 좋아요!!♡  
20161213,10,대박!! 잔잔한 영화려니..보러왔다가엄청 마음 따뜻해쳐갑니다♡♡  
20161213,10,변요한과 채서진 실제연애요망  
20161213,6,대박 외모열일이에요 근게 스토리는 무난무난 뱔생각없이 볼만해요  
20161213,10,재밌었어요 또보고싶어요  
20161213,10,대박끝까지 소름과감동이다  
20161213,10,과거를돌아보게해줄수있는 감동적인 영화입니당  
20161213,10,너무슬퍼요ㅠㅠ 진짜 재미있었어요 변요한짱  
20161213,10,너무감동적이엿어요~~~~??  
20161213,10,재밋어요 너무 재밋어요 꼭보세여  
20161213,10,감동적이고 훈훈하며 재미까지 더해서 추천합니다  
20161213,10,마음이 훈훈해지는 영화였다!  
20161213,10,따뜻하고 좋아요!!!  
20161213,10,감동 ㅠ.ㅠ 재미있어오~!!  
20161213,10,너무재밌어요ㅠㅠ 사랑해요  
20161213,8,이야기가 계속 계속 생겨나는 기분이 들어 흥미로웠습니다  
20161213,10,굿이네요 추천합니다!!!  
20161213,8,굿!!@@ 정말강추합니더  
20161213,10,잔잔하니 재밌어요^^!!!!  
20161213,10,원작 소설을 다 담아내지 못한게 아쉽다 ㅠㅠ 영화가 너무 짧아!! 그래도 오랜만이 마음이 따뜻해지는 영화였다 배우들 연기력은 말할것도 없이 최고!!  
20161213,10,변요한이랑 김윤석이 시간을 오가면서 서로 연기하는모습이 너무 좋았어요 연말에 보기좋은영화 ^^  
20161213,10,재미와 감동^^시사회 재밌게 봤어요!!대박나세요  
20161213,10,김동적 입니다   굿~~~~#  
20161213,10,인생을 고칠수 없도록 열정적으로 살아야겠어요  
20161213,10,너뮤힐링되는영화에요!!  
20161213,10,재밌어요 감동감동ㅠㅠ  
20161213,10,와.... 말이 필요없네요 보고 이야기합시다  
20161213,9,좋아요 괜찮은 영화네요.  
20161213,10,책으로 봤었는데 영화로 보니 더욱 더 진한 감동을 느낄 수 있어서 좋았어요!! 꼭 보세요  
20161213,10,평소에도 좋아하던 기욤뮈소작가의 영화화라니! 배우들의 연기도 너무 좋고 연출도 좋았어요??  
20161213,10,원작보고 기대했는데 진짜기대만큼좋았어요  
20161213,10,재미있어요 배우연기짱  
20161213,10,감동과 재미가 한번에!!! 강추! 기회되면 책을 한번 읽고 다시 한번 보고싶은 영화입니다!!  
20161213,10,태호가 너무 웃기당ㅋㅋㅋ  
20161213,9,생각했던것보다 괜찮았던 영화  
20161213,10,너무 좋아요ㅜㅠㅜㅠ 엄청 울었어요ㅜㅜ  
20161213,10,너무 재미 잇어요. 태호 연기 하신분. 특히 재미잇네요 ㅎ  
20161213,10,아들이랑 재밌게 봤어요  
20161213,9,두 배우의 호흡과 적당한 긴박감이 좋았다 :)  
20161213,10,감동적이고 잔잔한 내용이 참 좀았습니다~~  
20161213,10,너뮤 재미있게 봤네요!다음에 부모님이랑 한번 더 봐야겠네요!추천합니다  
20161213,10,좋았습니다 :)! 원작이랑 비교해도 좋아요!  
20161213,9,원작에 충실해서 더 감동 깊었던 영화 추천! 연말에 좋은 사람들과 보기 좋은 영화  
20161213,10,스토리도 재밌고 지루하지  않은 두시간 이었어요  
20161213,10,여자친구랑 울면서 봣어요 꿀잼  
20161213,10,엄청 울었어요..ㅜㅜㅜㅜ 아빠 생각도 나고 친구 생각도 나고.. 여운이 남는 영화88  
20161213,10,책으로 읽었을때의 감동이 스크린에 고스란히 잘 보여졌어요^^ 감동과 재미를 다 잡은 작품.  
20161213,10,안정적인 시나리오. 무난하게 볼만했음  
20161213,10,굿 완전슬픔 코막힘 ♡♡♡  
20161213,9,감동그자체네요 너무 좋았어요  
20161213,9,시사회 보고나서 평입니다. 타임리프물로 갈등이 여러개 계속되서 전공시험 3개연이어 본 날 봤는데도 하니도 인졸있습니다. 인생에 중요한 걸 느끼게 해주는 영화  
20161213,10,넘 재밌고 슬퍼영 ㅠㅠ시사회로 왔는데 돈주고 또봐야겠어여!!  
20161213,10,감동적이네요 ㅜ 내가 30년전의 나를 본다먄...  
20161213,10,사랑하는 사람과 보면 좋을 것 같아요!  
20161213,9,과거의 소중하고 아련한사랑을 다시금 일깨워주는 따듯한영화  
20161213,10,시간의 소중함.. 완전 재미있어요!  
20161213,8,재밌어요짱짱맨ㅋㅋㅋ  
20161213,9,뭔가억지스러운데엄청감동적인....  
20161213,10,완전  재밌어요~~원작 감동 그대로~~  
20161213,10,믿고 읽던 기욤뮈소의 원작으로 영화가 개봉되어 기대했는데! 완전 완전 재밌고 감동입니다! 두번볼거에용  
20161213,10,너무 감동적이네요~꼭 또보겠습니다 :)  
20161213,10,정말 좋은 영화이고 꼭봐야될영화다  
20161213,10,잔잔하고 마음이 짠한 영화.. 지금에 감사 하며 사랑해야 함을 일깨워 주는 영화.. 사랑하는 연인과 함께 보면 좋을 듯해요~  
20161213,9,좋아요..! 영상도 예쁘고 잔잔하니  
20161213,10,우연한 시사회당첨으로 영화를 보게됐습니다.정말 봐도 후회안할것깉습니다  
20161213,10, ㅠㅠㅠㅠ완전 좋아요. 남자친구랑 또 보고싶어요...!!!!  
20161213,10,영화 너무 재밌어요 개봉하면 다들 꼭 보시길ㅎ  
20161213,10,한 겨울 따뜻하게 이 영화와 함께하세요  
20161213,10,재미있고 감동적이에요  
20161213,8,완전 재미잇엇어요!~~  
20161213,10,완전 감동이야....짱  
20161213,10,폭풍감동에 소름 돋았어요ㅜㅜ시사회 정말 재밌게 잘봤어요!!!  
20161213,10,꼭 보세요..감동입니다..ㅜㅜ 또 봐야겠네요..^^  
20161213,8,정말 잘봤어요. 눈물까지 나더라는  ^^  
20161213,9,감동적이면서 재밌게 볼 수 있는 영화!!  
20161213,10,이쁘다. 여주인공 존예  
20161213,8,잔잔하게 마음 따뜻해 지는 영화에요  약간 영화가 임펙트 있진 않지만 감동적이네요  
20161213,10,펑펑 울었네요 삶을 생각해보게 되는 영화에요 ..ㅎ 추첞ㅎ  
20161213,10,재밌었어요~ 또 보고싶은 영화예용  
20161213,10,올해 꼭 봐야하는 따뜻한 영화인거 같아요 꼭 추천합니다!  
20161213,10,시사회 다녀왔어여. 어머님이랑 봤는데 너무 좋았어요~ 좋은 영화 대박나세여~  
20161213,10,정말 훌륭하네요 꼭 보게요  
20161213,10,너무보고싶었던작품이엇네요 감동적입니다  
20161213,10,잘 봤어요!! 추천합니다  
20161213,10,과거와 미래를 넘나드는 너무너무 재미있는 영화였습니다 대박 확신해요  변요한 채서진 김윤석 파이팅~~  
20161213,8,역시 김윤석! 배우들 감정선이 너무 좋았어요  
20161213,10,완전 재밌어요!! 강추!!!  
20161213,9,"해피엔딩 결말이라 좋았고, 나름대로 탄탄한 스토리구성이마음에들었다  "
20161213,10,30년걸렸어요. 마지막장면이 인상깊음  
20161213,10,너무재미있고 감동적이에요ㅠㅠ!!! 잔잔한 여운이있는영화  
20161213,10,너무 감동적이고 마무리가 훈훈하게 끝나서 보기 좋은거같다  
20161213,9,볼만해용 변요한멋짐 ㅠㅠㅠ  
20161213,10,가족끼리 보기에 좋은 영화임  
20161213,10,완전 짱이에요. 다음에 또 보고싶아요!!!  
20161213,10,믿고보는 김윤석 변요한♡  
20161213,10,시사회 봤습니다... 최곱니다 ㅜㅜ 꼭보세요 두번보세요  
20161213,10,재밌어요..  잔잔한 감동이 있는 영화네요..^^  
20161213,10,책보고 봐도 완전좋다ㅠ  
20161213,10,당신거기있어줄래요 최고예요!  
20161213,10,동생이랑 같이 봤는데 너무 감동적이에요!  
20161213,9,스토리도 감동적이고 중간중간의 코믹한 부분도 너무 좋았습니다♡  
20161213,10,책보고왔는데도 좋았던 영화입니다..!!!  
20161213,10,감동과재미가모두있었네요! 감사합니다 감동얻고가요♡  
20161213,10,인생영화ㅜㅜ진짜 너무 좋아요ㅜㅜ  
20161213,10,30년만에 이룬사랑ㅠㅠ넘슬퍼요  
20161213,10,시사회당첨되서 봣는데 재밋어요.  
20161213,9,재밋어요~~재밋어요~  
20161213,10,짱재미있어요~ 감동감동♡  
20161213,10,너무 감동적인 작품입니다 설래는 마음을 갖게해주는 영화입니다 강추합니다  
20161213,10,좋아요 최고최고최고 짱짱짱  
20161213,9," 타임슬립, 그로인한 자신의 인생 변화가 매우 감동적이었다. 마지막에 약간 정신이 없어서 아쉬웠다  "
20161213,10,원작 그대로 긴장감 넘치고 그림이나 스토리가 너무 이뻤습니다!ㅜㅜ 인생에서 소중한 사람 생각하다보니까 마지막엔 약간 울컥하기도 하네여~  
20161213,10,r감동있도 좋았어요ㅠ잔잠하니 친구랑 보기좋았어요  
20161213,8,"연말에 소중한 것들을 다시 생각해보게 하는 따뜻한 영화로 완전 추천!!! 친구관계, 연인관계가 함께 소중하게 표현되서 좋았다??  "
20161213,8,가족과 함께보가 좋아요 원작 내용 잘 살렸어요^^  
20161213,10,재밌어요 연말에 같이보기 좋은영화!!  
20161213,7,잔잔할줄만 알았는데 중간중간 재미도 있어서 더 볼민했어요 !  
20161213,10,너무 감동적이고 재미있게 봤어요 ㅜㅜ♥? 흥행 하기를!!!  
20161213,7,즐겁게 잘봤습니다! 볼만합니당!  
20161213,10,재미있게 잘봤습니다 감동ㅜ 대박나길!  
20161213,9,당신 거기 있어줄래요 마음이 따뜻해지는 감동영화인 것 같아요!! 자신이 사랑하는 사람을 지키기 위해 과거와 미래에서 자신만의 방법으로 노력하는 주인공이 멋있고 마지막 친구의 우정도 너무 멋있습니다!+  
20161213,9,대박 잼나요 굿입니다 대박나셔요  
20161213,9,굳!  책만큼의 감동이네요  
20161213,10,너무 애뜻해요 재밋어요  
20161213,10,처음부터 끝까지 잔잔하게 볼 수 있는 영화였어요 한국형 일본 영화같은 느낌! 재밌어요!  
20161213,10,보는내내 감동이었습니다  
20161213,10,정말 대단라고 사랑스러운 영화입니다  
20161213,10,완전 감동 잼있게 잘 봤어용^^^  
20161213,10,잔잔하니 판타지요소가 있어서 흥미있게 너무 잘봤어요!!내이루또볼예정입니다배우들 연기 너무 잘하고 재밌습니다!!  
20161213,10,완벽 그 자체 또 볼 것이다  
20161213,9,재밌게봤어요!!!!  
20161213,10,진짜 감동 재밌어요 ㅜㅠㅠ  
20161213,10,영화너무잘봤어요 잔잔한감동  
20161213,9,대박  메세지도  좋구요  대박입니다  
20161213,7,스토리가흥미진진하고 전개가빨라서재밌었습니다 좀지루하긴하지만 볼만해요  
20161213,9,책보다 더 나은 영화. 잔잔하고 감동적이네요^^♥  
20161213,10,완전 감동적이에요 너무 재밌음  
20161213,10,좋아요좋아요꼭보세요요요요용  
20161213,10, 잘봤습니다 좋은영화 잘 보고갑니다  
20161213,10,너무너무 감동적이고 기대이상이에요!!  
20161213,10,완전 재밌다 ㅜㅜㅜ기대 이상임  
20161213,10,기대 이상으로 재미있어요. 책읽고 또 봐도 너무 좋았어요  
20161213,10,정말대단해요정말 재밌어요  
20161213,10,영화 너무 좋아요. 강추에요  
20161213,10,너무 좋아요~~ 가슴이 따뜻~~  
20161213,9,너무 예쁜 영화네요ㅎㅎ  
20161213,10,재밌게 잘봤습니다. 꼭 보세요!  
20161213,9,잔잔한 감동 가슴따뜻한 영화  
20161213,10,가슴따뜻한영화꼭보세요  
20161213,9,좋아하는 책이라 봣너요 좋네요 ㅎㅎ  
20161213,10,재밌고 잔잔한 영화?  여운이 깊은 영화  
20161213,8,영화 너무 재밌어요!!  
20161213,10,진짜 완전 감동적이고 슬프고 재미있어요 ㅠㅠ 너무 맘이 찡해지는 영화네요 ㅠㅠ  
20161213,8,슬프지만 아름다운 이야기에요!  
20161213,10,감동적이예요!잘봣습니다  
20161213,10,책을안읽어봐서 영화로 처음 봤는데 잔잔하고 인생이 느껴지는 감동 얻고갑니다~  
20161213,10,감동적이였다 추천합니다  
20161213,10,시사회로 봤는데 너무 재밌게 봤습니다  
20161213,10,너무좋앗고 ㅅ?설을 보고싶어지게하네요  
20161213,10,꼭보셔요! 후회하지암ㅎ아요  
20161213,8,시간여행으로 첫사랑을  
20161213,9,하..시사회로 봤는데 제돈 주고 한번 더 보고싶은 영화네요.배우들 너무소중합니다.  
20161213,10,시사회 봤습니다. 영화 너무 재미있네요. 백윤식 배우가 너무 좋아서 보러왔는데~ 잘 모르던 변요한의 팬이 되었습니다. 강추강추!  
20161213,10,너무 재밋고 슬펐어요ㅠㅠㅠ  
20161213,10,영화 진짜 잘만들었어요 ~♡감동적이고 흐믓하네요~♡  
20161213,10,정말 재미있었어요. 변요한 출연으로 믿고 봤어요. 저~엉~~말 연애하고픈 배우예요. 생각하면 아직도 가슴 한가운데에 전기가 찌~익 저려오네요.  여친으로 나온 배우도 넘 사랑스러워~닮고 싶다ㅋㅋㅋ  
20161213,10,"두시간 내내 지루할틈이없이 연출,스토리 넘 좋았어요..뻔한거같은 타임슬립소재지만 두배우의 연기 케미도 넘좋았고..보고나서 가슴이 따뜻해지면서 내가 돌아가고 싶은 과거를 잔잔히 생각해보게 하네요..너무 따뜻한영화에요♡  "
20161213,9,역시 기욤뮈소의 원작만큼 좋네요  
20161213,10,역시 소설만큼이나 엄청나고 탄탄한 스토리네요. 어머니랑 같이 보러왔다가 눈물 쏙빼고 갑니다. 강추!!  
20161213,10,"변요한, 김윤석이라는 쟁쟁한 배우들 사이에 신예 배우 채서진. 게다가 소설을 원작으로 한 탄탄한 영화가 되지 않을까 싶어요!  "
20161213,10,잔잔하게 흘러가지만 지루할 틈이 없더라는ㅎㅎㅎ 개봉하면 입소문 제대로 탈 듯  
20161213,8,남자친구랑 같이 보길 잘했어요!서로의 소중함을 더 느끼는 시간이었답니다ㅋㅋ  
20161213,9,시사회평들 되게 좋던데 기대중임ㅋㅋㅋ 드디어 개봉일이다  
20161213,10,배우들의 연기 덕분에 감정이입 제대루~~  
20161213,10,그 사람이 그리울땐 행복했던 추억을 생각하라..  
20161213,10,"잔잔하게 나의 마음을 사로 잡은 당신, 거기 있어줄래요  "
20161213,8,추운 이겨울에 따뜻하게 녹여준 영화♥  
20161213,10,판타지와 로맨스의 결합이 재밌었습니다 겨울과 잘어울리는 영화인거 같아여ㅎㅎ  
20161213,10,두 주인공의 2인 1역 연기가 너무나 볼만함  
20161213,10,시간여행을 다룬 감성 멜로 판타지~~ 새로워서 좋았어요~  
20161213,10,"가슴 아련해지는 첫사랑같은 영화랄까,,  "
20161213,10,기욤뮈소 원작을 영화로 제대로 각색했네ㅋ  
20161213,10,과거와 현재를 오가면서 사랑하는 사람을 위해 고군분투.. 가슴 아프지만 따뜻하고 감동적인 영화  
20161213,8,변요한이랑 김윤석 은근 닮았엉  
20161213,9,두시간이라 지루하지 않을까 했는데 시간 가는줄 모르고 봤었다ㅋㅋㅋ  
20161213,10,나의 인생 소설을 바탕으로! 기대를 안할수가 없잖아ㅠㅠ  
20161213,10,"김윤석, 김상호의 연기력으로 원작소설보다 더 감동적이고 휼륭한 작품 탄생 예감!!  "
20161213,10,"가슴 따뜻해지는 감성 멜로 판타지 당신, 거기 있어줄래요  "
20161213,10,원작 소설을 보고 관람해서 그런지 더 재밌게 느껴지더라구요~  
20161213,10,변요한이랑 채서진이랑 케미가.. 내가 다 설레더라  
20161213,10,사랑하는 사람과 소중한 사람과 보고싶은 영화  
20161213,8,변요한 개좋음 이건 무조건 극장사수  
20161213,10,나도 돌아가고픈 때가 있는데...나도 알약을 가질 수만 있다면ㅠㅠ  
20161213,10,진짜 모든 사람들에게 이 영화를 추천하고싶다ㅠㅠ꼭 보시길  
20161213,10,이 겨울과 너무나도 잘 어울리는 영화였던 것 같습니다^^  
20161213,10,ㅠㅠ과거를 회상하는 시간을 갖게해준 따뜻한 영화  
20161213,8,인생을 되돌릴 10번의 기회가 나에게도 온다면 하고 생각해보는 재미를 주더라  
20161213,10,ㅋㅋ판타지인데 이렇게 감성멜로 같은 느낌이라 묘하지만 좋았다  
20161213,10,두 배우의 케미와 연기 참 좋았고 잘 어울렸어요!  
20161213,10,과거로의 시간여행이라는 소재는 신선한건 아니지만 스토리 전개도 좋았고 연출이 넘 좋았다  
20161213,10,2인1역이라는 것도 나름 새로웠다!두 수현에게 감정이입 제대로함  
20161213,10,저런 알약이 나중에라도 나오긴 할까ㅠㅠ  
20161213,10,채서진 정말 서구적이면서도 매력있게 이쁘더라구여ㅋㅋ  
20161213,8,보는 내내 감동도 받고 깨알같은 코믹연기도 있어서 보는 재미가 있었네요  
20161213,9,과거로 돌아가서 해결하려는 수현도 이해가고 미래를 지키려는 수현도 이해가고ㅜㅜ  
20161213,10,ㅜㅜ많은 관객들이 훌쩍거리던데 물론 저는 눈물폭발했습니다  
