0,1,2
20161207,9,소설 읽어본 사람이라면 이 영화 목빠지게 기다릴겁니다..  
20161207,10,원작인 소설을 영화로 제대로 각색해낸 것 같다 굿이었다  
20161207,10,보고나서 한동안 여운이 가시지 않을거같아요ㅠㅠ..  
20161207,10,드디어 연말에 인생영화 한편이 탄생했군요 개봉 하시면 꼭 보세요  
20161207,9,소설로 읽을때도 눈물폭발이었는데 영화보면서도 역시나 눈물폭발  
20161207,10,개봉일만 기다리는중ㅋ 변요한 요즘 너무 좋아  
20161207,10,과거의 일을 고칠 수 있다는 내용이 정말 꿈만 같았어요 기욤뮈소 소설들 다 좋아하는데 좋은 영화였습니다  
20161207,9,나도 나중에 30년전으로 돌아가고싶다는 생각이 들때가오겠지  
20161207,10,그냥 인생영화 변요한 연기 오져버렸고 여주 그냥 개이쁨...스토리 탄탄하고 중간중간 웃긴장면도 있고 누구랑 봐도 좋은 영화.  
20161207,10,역시 현재가 중요하죠 앞으로 후회할 일 만들지 맙시다!  
20161207,10,각색도 잘되었고 연출 좋고 배우좋고 스토리 짱이고 개봉하면 한번 더 볼 생각!  
20161207,10,ㅋㅋ진짜 이 영화는 연인뿐만 아니라 모든 사람에게 강추!!! 개봉하면 꼭 보시길!  
20161207,10,어쩌면 나중에는 진짜 저런 약이 나올지도…ㅋㅋㅋㅋ  
20161207,9,후회되는 때로 돌아갈수 있다면 얼마나 좋을까  
20161207,10,누구나 한번쯤은 과거로 돌아가고싶은 생각을 하겠지..진짜 공감 백프로다  
20161207,10,갑자기 며칠전에 남자친구한테 못되게 굴었던게 생각나요ㅠㅠ  
20161207,9,너무 좋아요~~ㅜㅂㅜ 보는 내내 조마조마 하고 보고난후에는 너무 기분좋아져서 나왔어요~~  
20161207,9,자극적이지 않고 많은 사람들의 공감을 얻어낼 수 있는 영화라고 생각함  
20161207,10,믿고보는 변요한^_^  
20161207,10,ㅜㅜ현재 옆에 있는 모든 사람들에게 잘해야겠다  
20161207,10,ㅋㅋㅋ와 진짜 이건 연말에 꼭 봐줘야하는 영화라고 생각해요  
20161207,10,소설로 읽을때 영화로 꼭 나왔으면 좋겠다고 생각했는데 드디어!!  
20161207,9,진짜 현재의 중요성을 느끼게 해주는 따뜻한 영화  
20161207,10,워낙 원작이 유명해서 못해도 평타 이상은 할 것 같은데?  
20161207,10,김윤석 변요한 이 둘의 연기에 빠져 들 수 밖에 없을듯  
20161207,10,예고편만 봤는데도 절절하네요ㅠㅠ 빨리 보고싶어요  
20161207,9,내가 유일하게 챙겨 보는 기욤뮈소 소설ㅎㅎㅎ 그 중 제일 재밌게 감명깊게 본 책이 영화로 나오다니 너무 감격스럽네요  
20161207,10,기욤뮈소가 유일하게 한국 영화의 가능성을 보고 영화화를 결정했다는데 영광이다 진짜.. 그만큼 훌륭한 영화가 탄생했기를ㅎㅎ  
20161207,10,저는 부모님 생각이 많이 나더라구요..항상 잘해드릴게요  
20161207,9,ㅠㅠ나중에 후회하지말고 있을때 잘하자!!  
20161207,10,과거로 돌아간다면 난 어디로 갈까?하면서 보게되더라  
20161207,10,살아온 내 삶을 되돌아보게되었다..진짜 인생영화 탄생  
20161207,10,알약 나도 정말 갖고싶다..옛날 베프가 생각나네  
20161207,10,영화가 주는 메시지를 잘 생각해봐야겠어요.. 시사회로 잘보고왔습니다  
20161207,10,좋아했던 소설을 영상으로 만나서 2시간이 어떻게 가는줄도 몰랐어요^^  
20161207,9,과거의 나를 만난다는게 참 신선하고 공감이 많이 됐다  
20161207,10,옛날 그 사람에게 좀 더 잘해줄걸 이라는 생각이 계속 들더라  
20161207,7,괜찮은 드라마 지만 2% 부족한 아쉬움  
20161207,9,"시사회 보고 왔는데 영화 재미있네요! 아무래도 시간이동이라는 비슷한 소재라서 그런지 예전에 방영했던 <나인>과 비슷하다는 느낌은 많이 받았어요, 상대적으로 긴장감이 덜 했지만, 이 영화 나름의 감동과 재미가 있었습니다. 배우분들 호흡도 잘 맞았고요.  "
20161207,10,빨리 보고싶네요...  
20161207,10,책을 안 봤는데도 참 감성깊고 마음 따뜻해지고 삶과 현재를 대하는 태도에 대해 생각하게 만드는 영화다  
20161207,10,"감동도 있고, 중간중간 섞인 코믹요소들이 지루할 틈 없이 봤어요^^추천해요~  "
20161207,8,시사회로 보고 왔는데 소설을 한국식 유머코드에 맞게 잘 담았다.  
20161207,10,시사회 보고 왔습니다진짜 꼭 보시길 ㅎㅎ 추천해융~♥?또 보고싶다  
20161207,10,시사회로 봤습니다.뷰티인사이드같은 감성적인 영화..개인적으로 이런영화 너무 좋습니다.  
20161207,10,시사회보고왔는뎅 음 진지하고 깊게들어가면 의문이 생기지만 감정적으로 멜로영화본다고 생각하면 멋지고 볼만하다 전체적으로 그냥 잘봄 훈훈해짐  
20161207,10,육룡이 변요한이 나오는구나 기대~~  
20161207,5,타임슬립 판타지로 뭐든 묻어가려는 심산.  
20161207,8,"시사회 보구 왔어요 누구나 있을법한 옛사랑, 추억등이 많이 떠오르네요 중간 까지는 재밋게 봤는데 끝 마무리가 좀 어정쩡했어요 이 겨울 연인과 볼 따뜻한 멜로 한 편이  필요하시면 추천드려요..  "
20161207,6,변요한씨는 느낌이 좋았는데 김윤석씨는 멜로연기랑 잘 안어울리는 것 같아요..  
20161207,10,진짜 영화보는내내 너무 좋았어요 원작을 잘 표현했어요 강추합니다 개봉하면 다시가서 보렵니다 옛 추억도생각나고 80년대가 좋았던것 같아요 전 옛날사람이네요  
20161207,9,시간여행을 통해 사랑을 지키고자하는 한 남자의 지고지순한 마음이 잘 그려졌네요. 과거와 현실의 뒤바뀜이 계속 일어나 끝까지 예측불허한 방향으로 흘러 시간가는줄 모르고 몰입할수 있는 영화. 김윤석과 변요한의 연기대결도 볼만해요.  
20161207,8,영화 잘 봤구요.배우님들과 또 영화와 관련된 모든 분들께 감사합니다.영화를 통해서 다시 한 번 생각하게 되는 시간이어서 좋았어요.  
20161207,9,재밌었어요! 그냥 웃으면서 편하게보는 영화라기보다 삶에 대해서 진지하게 생각도해볼수있는 의미있는 영화였어요 강추합니다^^  
20161207,9,시사회에서 보고 왔어요. 배우들 중에 연기 못하는 배우 하나도 없고 괜찮았어요. 연인들이 보긴 너무 좋은 영화같네요.ㅎ  
20161207,10,"초강추!!원작소설이 읽고싶어지는..너무 자~알 만든 영화!지금 곁에 있는 사람의 소중함 그리고 후회, 복합적인 감정들이 왈칵 솟구쳐오른다..애인 생기면 같이 꼭 또 보고싶은 영화  "
20161207,10,"시사회 참석하고온 1인입니다. 영화 꼭 보세요 네티즌성님들 이영화 보고 사랑하는 이성, 친구들이 다시 생각나는 계기가 됐네요! 당신 거기있어줄래요 화이팅!  "
20161207,6,시사회 후기> 어바웃타임보단 긴장감이 떨어지고 무난해서 다소 지루.. 5%부족한 연출..디테일부족..연기는 잘했고 배우들도 멋지고 이뻤음..느낀점은 사람은 어떻게든 맞춰 살아간다..바꾸고싶은 과거라도 인정하면서 기분좋았건기억으로 추억을 먹고산다  
20161207,10,왠만해선 평점 잘 안남기는데 2016년도에 본 영화중 가장재밌게 본 영화같네요 시사회때 정말 재밌게 봤구요 시간에 대해 다시금 깨닫게 해주는 의미있는 영화인것 같습니다. 그리고 두 주연배우 연기력도 대단했습니다..정말 꼭보시길 바래요  
20161207,10,"연기부터 연출까지 무엇하나 빠지지 않는 영화. 남녀간의 사랑, 우정, 부성애 등 많은 의미들을 내포하고 있어 굳이 연인이 아니더라도 소중한 사람들과 보기에 더없이 좋을. 추천합니다!  "
20161207,10,오늘 시사회 보고왔는데 보고나서 기분이 너무 훈훈하네요 돈내고 봐도 전혀 돈아깝지 않을 영화입니다 배우들 연기는 두말할 것도없고 몰입도가 진짜짱이에요 로맨스였다가 스릴러였다가 코믹이었다가 또 슬퍼졌다가.. 원작의 느낌도 아주잘살아있어용 후회안하실거에요  
20161207,10,재밌네. 안지겹고 흥미진진. 잘 짜여진 느낌. 각색 잘함. 소설 구현 잘함. 잘 봄.  
20161207,10,현재의 소중함을 꼭 알면서 살아야겠어여 나는 알약이없으니..  
20161207,9,갑자기 첫사랑이 떠오르네요..후 암튼 여운이 가시지 않는 영화  
20161207,10,이번년도 마무리하면서 보길 잘했다고 생각했어요!!  
20161207,10,개봉한다는거 봤을때부터 엄청 기대하고 기다렸던 영화ㅜㅜ  
20161207,9,책으로 크게 감명받았었는데 영화가 잘 각색했네요~~감동 지대로임~  
20161207,10,저도 친한친구와 크게 다투었는데 나중에 후회하지 않도록 잘 풀어야겠어요 흑  
20161207,10,나도 정말 알약 1개라도 갖고 싶다는 생각이...  
20161207,9,시사회를 통해 관람했습니다. 원작을 재밌게 봤는데 원작과 비슷하면서 잘 각색했더군요. 전반적으로 좋았습니다. 의외의 배우들도 많이 나와서 보다가 놀랐네요ㅎㅎ 딱 겨울에 알맞는 영화인것 같습니다.  
20161207,10,원작을 얼마만큼 표현했을지 궁금했는데 영화로 보니까 더 좋은데요??  
20161207,9,기욤 뮈소의 작품들은 다 아름답고 따뜻한 이야기 인것 같아서 좋다  
20161207,10,남자친구랑 같이 보는데 ㅠㅠ갑자기 뭉클해졌다 남친에게도 잘해줘야지  
20161207,9,소설의 소재는 물론 영상의 분위기와 잘 어우러지더라구요!  
20161207,10,시사회로 보고 왔는데 책을 다시 한 번 또 읽고 싶게 만드는 영화.  
20161207,10,한동안 이 영화의 열풍이 가시지 않을 것 같은 느낌적인 느낌  
20161207,10,항상 현재가 소중하다는건 알지만 다시금 느끼게 해준 영화  
20161207,10,이렇게 공감이 많이 가는 영화도 오랜만인 것 같다  
20161206,10,옛 추억들과 사람들을 떠올릴 수 있었다ㅜㅜ괜히 찡하네  
20161206,9,여자친구가 보자고 해서 본건데 어째 내가 더 재밌게 보고 나왔네;;ㅋㅋ  
20161206,10,앞으로는 항상 옳은 선택을 하면서 살아야겠더라..  
20161206,10,오늘 시사회 보고왔는데 기대 이상으로 너무 좋았어요 오랜만에 감성적이고 따스한 영화본거 같아서 기분좋았어요 개봉하몀 꼭 보세요  
20161206,9,ㅜㅜ진짜 요즘따라 후회되는일 많았는데 이거보니까 더 후회된다  
20161206,9,"내 인생에 아름답고 잔잔한 영화 갑은 벤자민 버튼의 시간은 거꾸로 간다 였는데.. 이 영화보는내내 아련하면서도 행복하면서도, 어느부분에서 감명깊었다고 말하기가 어려운영화다. 그냥.. 너무 좋았다  "
20161206,10,그냥 그 유명했던 소설이 영화로 탄생한것만으로도 대박아닌가?  
20161206,10,잔잔한 영화라고만 생각했더니~긴장감도 있고 재미도 있고!! 대박!  
20161206,10,감정이입 제대로 해서 봤어요..몰입도도 좋고 너무 감동적이네여  
20161206,10,"와 저 이거 시사회로 오늘 보고왔는데 진짜재밌어요.... 와 말이 필요없음 거의 추리소설급으로 생각해야하는 영화! 아 추리소설급은 아니고 조금 생각해야하는 영화.. ㅎㅎㅎ 변요한, 김윤석 배우가 영화를 끌고가네요 연기력에 감탄, 또 감탄  "
20161206,10,시사회 보고 왔습니다. 생각보다 원작을 더 잘 표현할거같아요ㅎㅎ 책보고 보시면 비교하는 재미가있습니다. 하지만 소설과 영화의 본질적인 차이로 설정부분에 있어 표현되지못한 부분이있어 소설 안보신분들은 아마 개연성 못느끼는 부분도 있을듯해요. 그래도 짱잼  
20161206,9,친구와 크게 다퉜는데 후회된다ㅠ나한테 알약 딱 한개만 있었더라면..  
20161206,9,시사회당첨되서 보고왔어요 잔잔하게 감동도주고 은근 몰입도도 쩌네요 뒷부분이 조금 아쉬운면은 있지만 진짜 재밌게 시간가는줄모른채 봤네요 잘봤어요  
20161206,10,몇년 전 소설을 재밌게 읽은 기억이 생생한데 드디어 영화로 나오다니ㅜㅜ!  
20161206,10,과거와 미래를 넘나들 수 있다는 소재가 신선한건 아니지만 안에 들어있는 내용이 참 조아요  
20161206,10,하ㅜㅜ이렇게 감동적인 영화도 오랜만인듯하다  
20161206,9,현재 내 곁에 있어주는 모든 사람들에게 잘해야겠다는 생각이 든다  
20161206,10,모든 사람들의 공감을 얻어낼 수 있는 한편의 영화  
20161206,9,정말 가슴이 따뜻해지는 영화였어요~~연말에 이런영화 딱이네여  
20161206,10,앞으로 후회할 만한 일은 하지 않도록 해야지..  
20161206,10,세계적으로 인기를 끈 원작과 배우들의 조합이 굉장히 좋았어요~  
20161206,10,기욤 뮈소의 소설을 읽은 사람들이라면 이 영화 목빠지게 기다렸을거에요  
20161206,10,커플이라면 이 영화는 관람 필수!!!  
20161206,9,나중에 후회하지 않기 위해 지금을 열심히 삽시다  
20161206,10,과거의 일을 되돌리면서 많은 일이 일어나는 모습을 세심하고 재밌게 다뤄내고있다  
20161206,10,시사회 보고온 사람입니다. 오늘 시사회 8시에 보고왔는데요 역시나 했는데 역시입니다.진짜 꼭 보세요. 6일이지만 14일날 또 보러갈겁니다. 진짜 꼭보세요 인생영화로 추천드립니다. 책도 사러갑니다ㅎ 영화 흥하길!!  
20161206,10,눈물이 쏟아질까 노심초사 하다 터져나오는 웃음속에 아닌척 눈물을 숨겼던 그런 영화.김윤석씨도 멜로가 되는군요?  
20161206,9,연인이 이거 보면 서로에게 엄청 잘해줄듯하다ㅠㅠ  
20161206,10,2시간 집중해서  봤네요 ㅎㅎ 책도 한번 보고 싶어요 ㅎ  
20161206,10,베스트셀러로 엄청난 인기였던 소설이 영화로 나온다는 것부터 좋았음  
20161206,10,누구나 한번쯤 시간을 되돌리는 상상을 해봤을거다..이 영화 정말 공감 100퍼센트  
20161206,7,시사회로 보고 오는 길인데 그냥 쏘쏘하네요. 변요환에 대한 팬심 없어서 객관적으로 봤는데 연기 그냥 무난하고 김윤석 아재는 평소 맡던 캐릭에서 크게 벗어나지 않은 것 같아요. 무뚝뚝한 경상도 남자 역할 잘 소화합니다. 이상 후기 끝.  
20161206,10,시사회로 보고왔습니다살짝 지루한 느낌도 있었지만 가슴 따듯하고 찡하며 마지막엔 눈물과 함께 입가에 미소가 지어지는 영화였습니다 추천해요  역시 믿고 보는 김윤석 님 그리고 변용한 님도 영화 촬영하신 모든 분들 수고하셨습니다  
20161206,10,내 현재도 중요한걸 깨달았지만 내 옆의 모든 사람들에게 잘 할거다ㅜㅜ  
20161206,9,ㅜㅜ영화 중반부 이후로는 계속 나도모르게 긴장하고 봤다  
20161206,10,당분간은 당신거기있어줄래요의 열풍이 불 것 같군!!  
20161206,10,나한테도 저런 기회가 온다면 난 무엇을할까..휴  
20161206,10,소설을 너무 재밌게 봐서 영화로도 봤는데 정말 인생을 다시 한번 돌아보게됨  
20161206,10,이런 감동적인 영화로 한 해 마무리하기 딱 좋다ㅜㅜ  
20161206,10,인생 최고의 영화입니다  
20161206,9,소설을 어떻게 영화로 잘 만들었을지 궁금했는데 연출 잘 한듯??  
20161206,4,감독 흥행작없는 이유있는듯...뭔가이상함  
20161206,10,올 한해를 되돌아볼 수 있게 해주는 영화로 연말에 잘 어울려요^^  
20161206,8,인생의 선물같은 영화 다시돌아간다면..나에선택은 ㅎㅎ 즐겁고 아름다운 영화에요.  
20161206,9,기욤뮈소의 원작을 잘 살린닷  
20161206,9,30년 후의 모습이 기대되는 작품  
20161206,10,너무 따뜻한 영화입니다.  
20161206,10,시간가는줄 모르고 봤습니다:)  
20161206,10,재미 있게 봤습니다....  
20161206,10,시사회로 보게됬는데너무 추천하고 잘봤습니다  
20161206,10,좋아요ㅠㅠㅠ 변요한 짱입니다  
20161206,10,지금시사회 보고 왔는데  넘좋아요추천추천합니다  꼭 봐야하는 영화  
20161206,10,잔잔하니 재밌었어요^^  
20161206,10,재밌게 잘 봤습니다!! 판타지 드라마 흥미진진한 스토리 반전도 재밌었어요!!!  
20161206,10,연기력만 기대하고 봤는데 내용도 매우 만족 했습니다 ㅜㅜ 감동  
20161206,9,기욤뮈소 소설로 정말 재밌게 읽었는데~~각색도 재밌게 잘했네요~  
20161206,10,너무 감동적이었던 영화! 배우들의 연기도 짱!  
20161206,9,감동적입니다. 연기를 정말 잘하네요  
20161206,8,변요한 연기가 아주 좋아요!!  
20161206,10,잔잔한  감동 좋네요.같이 보아요  
20161206,10,영화진짜감동적이었어요....  
20161206,10,굿 재밌어요 감동적이에요  
20161206,9,30년의 세월을 넘나드는 판타지 멜로 강추합니다.  
20161206,9,30년의 시간의 세월을 건너 모든것이 바로잡힌 그들의 아름다운 이야기  
20161206,10,잔잔한 일상의 감동입니다  
20161206,10,정말 인상깊게 보았습니다  
20161206,10,뭉클하고 짠하고 좋은영화네요  
20161206,10,잘 봤어요 재미있고 감동적이에요~  
20161206,10,김윤석의 연기는 역시... 믿고 봐도 됩니다.  꼭 보세요  
20161206,9,너무나감동적이고 열연이좋았어요  
20161206,9,너모나 감동적이고 배우들의 열연이 좋았어요  
20161206,9,소설재밌게 봤는데...영화로 나오다니 기대하고 봐요!.!  
20161206,10,"기욤뮈소 소설 다 본 팬으로서 기대되고, 시사회로 먼저 볼 수 있어서 좋았어요♡ 소설만큼 영화도 재밌길...★  "
20161206,10,원작소설만큼 가슴뭉클한 이야기였어요 ^^  
20161206,10,당신 거기있어줄래요 원작소설만큼 감동적이었어요  
20161206,10,시사회로 봤는데 기대했던것 만큼 좋은이야기였습니다!  
20161206,10,잼있어요 개봉대박나세요  
20161206,10,정말 기대작 입니다.. 잘 볼게요.. 믿고 보는배우 김윤석.. 성장하는 배우 변요한.. 기대되요...ㅎㅎ  
20161206,9,시사회보았는데 배우들의 연기가 몰입이잘되고 집중해서 잘보았어요 추천합니다  
20161206,10,역시나 기대했던거 만큼 재있었습니다.김윤석 최고!  
20161206,10,적극 추천^^ 봐야겠죠  
20161206,8,김윤석 영화좀 자주 찍어라.  요즘 뜸하네  
20161206,10,변요한 김윤석의 타임슬립재밌네요 추천합니다!  
20161206,10,시사회보고왔습니다진짜 너무 마음 따뜻해지는 영화네요..남자친구랑 같이 봤는데 너무 좋네요더욱 사랑하고 싶어지는 영화에요 원작소설 보고와야겠어요ㅠㅠ  
20161206,9,배우분들의 연기력과 감독님의 좋은 연출이 만나 좋은 시너지를 내서 좋았습니다.  
20161206,8,어라 FT아일랜드  지독하게 뮤비가 이 내용을 모티브로 했나?  
20161206,10,어제 시사회 보고왔어요ㅠㅠ 사랑하는 사람과 보면 좋겠어요 인생영화 다들 보세요  
20161206,9,깨달음과 감동과 재미를 주는!가볍게 즐기기에 좋은 영화다  
20161206,10,역시 기욤 뮈소의 작품은 하나같이 따뜻하고 감동적인 것 같다..  
20161206,10,이 영화를 얼마나 기다렸는지 몰름ㅠㅠㅠ  
20161206,10,여기저기 눈물을 흘리시는 분들도 있고..아무튼 여운이 가시지 않을 듯  
20161206,9,김윤석이 딸을 지키려는 마음에 너무 이입해버렸다 눈물이 왈칵 나더라  
20161206,10,있을때 잘하자라는 말이 떠오르게 하는 영화에요 모두들 보시길..  
20161206,9,연인들이나 가족들이나 모두에게 강추해주고 싶은 영화다!!  
20161206,10,간만에 마음이 따뜻해지는 영화였습니다  
20161206,10,진짜 보면서 공감을 많이했어요~ 저는 딱 10년 전으로 돌아가고싶네요ㅎ  
20161206,10,소설도 인생소설이었지만 영화도 인생영화가 되었답니다^^  
20161206,9,정말 재미있게 봤던 소설을 어떻게 영화로 각색했는지 궁금했는데 너무 재밌네요  
20161206,10,"정말 변요한,채서진 기대이상 연기쩔고 김윤석은 그냥조력자같은 연기를하네요 보고난후 여운이 긴 형과 더불어 꼭봐야될 감성 멜로 영화! 연아역에 채서진님 연기도 잘하시고 너무이뻐서 스크린에서 눈을뗄수가없네요오랫만에롯데엔터 대박날듯!추천해주고싶은 유일무일  "
20161206,10,남자친구에게 화낸 어제가 생각났다ㅠㅠ앞으로는 잘해줘야지  
20161206,9,과거의 나를 만나서 사건을 바꾼다는 소재가 신선했다^^  
20161206,10,이런 영화는 꼭 봐줘야 한다ㅜㅜ 교훈적인 영화인듯!  
20161206,10,현재의 소중함과 지금껏 살아온 나의 인생을 되돌아보게 해주는 영화임 개봉하면 꼭 보시길  
20161206,10,내 옆에 있는 사람들의 소중함을 깨달았습니다.. 너무 좋았어요  
20161206,10,누구나 한번쯤은 생각할 만한 소재인데 이렇게 영화로 보니 묘하다..  
20161206,10,수현처럼 그 때 잘해줄걸 이라고 후회하지말고 지금부터 잘하자  
20161206,9,요즘 한국영화중 자극적이지 않고 마음 따뜻해질 수 있는 유일한 영화인듯?  
20161206,7,기욤뮈소의 소설원작에 비해  내실이 부족한 느낌...시간부족때문이 아닐까 싶음 중요한 에피소드도 몇개 춧약시킨 느낌이고 뭐랄까 원작을 본 느낌이라가 보다는 소설을 읽은 사람이 설명해주는 느낌이었음...  
20161206,9,"원작, 그 이상의 한국형 시간여행 판타지! 원작 스토리에 대한 기대를 저버리지 않는 작품 ^^  "
20161206,8,"올 한해, 후회로 가득 찬 우리 모두를 위하여  "
20161206,10,인생을 되돌리고픈 당신에게 온 선물 같은 영화!  
20161206,1,김윤석 무릎담요 발언때문에 영화에 집중못할거같아서 안볼꺼임  
20161206,5,"채서진의 발연기가 영화를 말아먹는 느낌임...특히 변요한이  전화로 부산에 못내려오게 했을때,  여주  전화목소리는 애절함이 아니라 완전 징징대는 느낌?.  또 변요한이  병원에서 애끓는 이별통보때, 멍때리다 보여주는 건조한 눈물연기는 몰입도 완전제로  "
20161206,1,"한국배우는 연기만 잘하면 그만인가? 연기가 그사람의 도덕적 양심이나 행실보다 더 중요하다고 생각하지 않는다.이 시국에담요발언이라니.정치인, 연예인 다 도덕적 검증들어가야 한다. 더이상 대중들도 가만이 있지 않는다! 대중들 관심없으면 연예인도 끝이다!  "
20161206,10,오래전에 책을 읽어서 자세히는 기억이 안났지만 기대하고 있었는데 어제 시사회를 다녀왔습니다. 주인공이 30년을 왔다 갔다 하는 동안 2시간이 어떻게 지나갔는지 모를정도로 전 좋았습니다 기욤뮈소의 소설을 한국적으로 잘 표현하신것 같아요  
20161206,10,"스토리, 연출, 연기, 캐스팅 모두 좋았다 소설을 안보고 봤는데 너무나 만족스러웠고 끝난 후에 오랜만에 잔잔한 여운도 남았다.하지만 김윤석의 논란때문에 조금 불안하긴 하지만 변요한, 채서진과 같은 다른 배우들의 모습도 정말 좋기때문에 봤으면 함.  "
20161206,8,저는 시사회로 봤는데 영화에 대해 잘 모르지만 일단 보면서 졸지않은거에 대해 점수를 높게 줬구요 재밌었던거같아요. 근데 담배를 너무 많이 피워서 변요한님 좋아했는데 약간 실망할뻔했어요  
20161206,10,대박...시간을 거스른 미래의 나 현재의 나...너무너무 좋아요.^^*  
20161206,10,담요 덮을꺼면 치마를 쳐입지를마 ㅉㅉ 윤석이형이 말잘한거임  
20161206,10,소설을 따로 보지 않았기에 영화와 소설이 비슷한지 다를지는 모르겠지만 영화는 조용히 잔잔하게 남는 영화인거 같아요지루할틈없는 전개에 가슴 먹먹함과 중간중간에 웃음도 있었던거 같아요. 배우들 연기는 스토리에 맞게 잘 묻어져나와서 좋았던거 같아요  
20161206,1,보진않을거지만 ㅎㅎㅎ  
20161206,10,기욤 뮈소 작품인가요? ㄷㄷㄷㄷ  
20161206,10,시사회로 진짜 재밌게 봤어요ㅠㅠ 처음부터 끝까지 슬프고 재밌으면서 감동적인 영화! 다시 보고싶은 영화  
20161206,10,청량리시사회 다녀왔습니다!!귀욤 뮈소!!   당거있 최곱니다인생영화!!!   너무재미있어서 아직까지도 여운이천만돌파할꺼같은 느낌은 머지?ㅋㅋ  
20161206,5,연기에 집중을 못하는 주연배우와 산만한 전개 및 스토리  
20161206,5,채서진을 비롯한 몇몇 배우들의 연기력 부재와 가끔 몇번씩 나오는 부자연스러운 설정에 몰입감 떨어졌음. 솔직히 기대이하네요. 스토리 자체는 괜찮은 것 같은데 잘 못 살린 느낌도.. 원작 한 번 읽어봐야겠네요.  
20161206,1,담요남^^안사요 10자  
