0,1,2
20161212,8,소설이 아직도 내 책장에 있는데 또 읽어볼생각입니다ㅜㅜ  
20161212,9,기욤 뮈소의 작품중에서도 제일 좋아했던 소설인데ㅠㅠ짱임  
20161212,10,둘의 이미지가 달라서 의아했는데 자세히 보니 김윤석 변요한 오묘하게 닮았다  
20161212,10,이렇게 후기를 꼭 남기고 싶은 영화는 첨이다 꼭 보세요 무조건 강추함  
20161212,10,시사회 평도 너무 좋길래 많이 기대했는데 기대할만 하군ㅋㅋ  
20161212,9,소설보다 영화로 더 감동받은 사람은 나뿐인가..?  
20161212,10,판타지 영화치고는 잔잔하지만 이런게 난 더 좋더라  
20161212,8,변요한 원래 연기잘하는건 알았지만 이런 새로운 모습 좋다..  
20161212,10,감동도 있고 재미도 있고!딱 요즘같은 때에 어울리는 영화  
20161212,10,이 영화를 손꼽아 기다렸답니다!!!기대한만큼 재밌어요!!  
20161212,10,5년전의 첫사랑이 떠올랐어요ㅠㅠ잠시나마 추억에 젖었네여  
20161212,10,절대 불가능한 일인걸 알면서도 공감하면서 재밌게 봤음  
20161212,10,감동 지대로네요...얼어있던 내 감정을 녹여버렸다  
20161212,8,와 생각보다 잔잔한게 아니고 긴장감도 돌고!!굿굿!  
20161212,10,이 벅차오르는 감정을 가라앉히지못해서 평점남겨요 꼭 보세요  
20161212,10,시간 지나고 한번 더 보고 싶은 영화다ㅠㅠ  
20161212,10,추운 겨울날 따뜻한 영화로 마음을 녹이시길!  
20161212,10,소설로 읽은지 얼마 안되고 영화로 보니 느낌이 색다르고 좋네요  
20161212,9,나중에 후회하지말고 옆의 사람들에게 잘해줍시다  
20161212,10,남자배우들 때문에 본건데 채서진..이렇게나 이뻤나 완전 이뿌다ㅜㅜ  
20161212,8,사랑하는 사람들을 생각하면서 보면 애절하고 애틋하고ㅠㅠ  
20161212,10,기욤 뮈소의 팬이라면 누구나 보고싶어할 영화ㅋㅋ  
20161212,10,이 영화는 꼭 봐야할 영화로 나중에도 생각날 듯한 영화인 것 같다  
20161212,10,남녀노소 누구나 공감하면서 즐겁게 볼 수 있는 가벼운 영화네요^^  
20161212,10,잔잔하지만 지루하지 않은 감동깊은 영화!모두에게 추천합니다  
20161212,10,덕분에 옛 추억들을 회상하는 시간을 가졌답니다 하하  
20161212,10,두시간동안 혼자 울고 웃고ㅋㅋ오랜만에 좋은 영화 감상했어여  
20161212,8,소설로 보면서 감동받았던 때가 생각나더라구요~~  
20161212,9,역시 믿고보는 배우들이라 연기도 대박이군요??  
20161212,10,이 영화 무조건 10점이다!!스토리나 연기나 뭐 빠지는게 없네  
20161212,10,부모님과 함께 봐도 공감하면서 볼 수 있을 것 같더라  
20161212,10,ㅠㅠ나는 30년도 아니고 딱 3년전으로 돌아가고싶다  
20161212,10,저런 알약이 나오는 때가 오지 않을까싶네...  
20161212,9,소설로 봤을때의 감동이 영화에 고스란히 녹아있네여^^  
20161212,10,내 주위 사랑하는 사람들에게 특히나 추천하고픔  
20161212,8,앞으로의 미래를 생각하면서 후회하지 않도록 최선을다해야지ㅜㅜ  
20161212,10,진짜 소설로도 명작 영화로도 명작!!따뜻한 영화에요  
20161212,10,두 수현의 절절하고 애틋한 마음을 잘 나타냈다ㅋㅋ  
20161212,10,영화 분위기가 대박이에요..감성 지대로인 영화다  
20161212,9,생각보다 흥미진진해서ㅋㅋ손에 땀을 쥐고 봤어요 마지막은 감동폭발  
20161212,10,영화관에서 팝콘먹으면서 두시간을 따뜻하게 보내기에 제격인 영화랄까ㅋㅋ  
20161212,8,끝나고나서 많은 생각을 하게 해주었어요ㅜㅜ  
20161212,10,두시간동안 그냥 잔잔하기만 할거라고 생각하면 오산임!  
20161212,10,보면서 울컥해서 눈물도 나고..긴장감도 있고 영화 대박이다  
20161212,10,저한테는 잊혀지지 않는 영화가 될 것 같네요ㅜㅜ  
20161212,8,판타지이지만 공감하면서 볼 수 있는 유일한 영화가 아닐까싶네요^^  
20161212,9,나도 과거의 나를 만난다면 무슨말을 해줄까..  
20161212,10,올해 마무리하면서 보기에 정말 좋을 것 같아여^^  
20161212,10,미래를 중요시하는 현재의 수현의 마음도 이해가가고ㅜㅜ하  
20161212,10,왠지모르게 보고나면 마음이 벅차는걸 느낄 수 있을겁니다  
20161212,10,이런 영화야말로 천만관객 가야한다ㅋㅋㅋ  
20161212,10,ㅜㅜ감정이입 백프로 되더라 진짜 나도 과거로 돌아가고파  
20161212,10,소설로 본 사람들이라면 의리로라도 영화 봐야함^^  
20161212,8,기욤뮈소의 특유의 감정으로 마음을 따뜻하게 해주네여  
20161212,8,연출을 이렇게나 잘하다니!!!!다른 기욤뮈소작품도 만들어주세요!!  
20161212,9,감정이입 제대로 하고 봤다ㅋㅋ공감 백프로인 영화  
20161212,10,과거와 현재의 수현의 마음이 다 이해가 간다ㅜㅜ나라면 어땠을까  
20161212,10,와 진짜 감성 제대로다...연출 진짜 잘한듯  
20161212,10,누구나 과거로 돌아가고픈 상상을 해봤겠죠ㅠㅠ나도 딱 일년전으로 돌아가고싶다  
20161212,9,옛 친구들도 생각나고..첫사랑도 떠오르게 해주는 영화랄까  
20161212,10,잠시나마 내 삶을 되돌아 볼 수 있게 되었다  
20161212,10,진짜 이건 모두에게 추천하고 싶은 인생영화 중 하나가 될 듯??  
20161212,10,현재의 소중함과 내 주변 사람들의 소중함을 다 느끼게 해준다  
20161212,8,이런 교훈적인 영화는 또 오랜만인 듯 하다 연말영화로 굿  
20161212,9,소설과는 또다른 느낌의 감성이 전해졌어요  
20161212,10,요즘같이 추운날 보면 마음이 따뜻해질 수 있는 영화  
20161212,8,ㅠㅠ두 배우의 절절한 마음을 간접적으로나마 잘 느끼고옴  
20161212,10,ㅋㅋㅋ와 진짜 영화화 잘한듯!!기욤 뮈소의 다른 작품도 기대해봅니다  
20161212,10,이 영화 덕분에 한 해를 잘 마무리할 수 있을 것 같네여  
20161212,10,나는 열번도 안바라고 한번이라도 과거로 돌아갈 기회를 갖고싶다ㅜㅜ  
20161212,8,연말의 힘든 마음에 온기를 불어넣어줄 영화  
20161212,9,역시 기욤 뮈소의 작품이라 따뜻하고 감동적이네요^^  
20161212,10,연인들이나 가족들이나 모두에게 추천하고 싶다 정말로  
20161212,8,현재 사랑하는 모든 사람들에게 사랑을 주고싶다ㅠㅠ  
20161212,10,첫사랑 생각 엄청 나고 여주 짱 예쁘다 물론 남주도 존잘  
20161212,10,운좋게 시사회 당첨되서 봤는데 모든 관객이 감탄했음  
20161212,10,보고나서도 여운이 가시지 않고 많은 생각을 하게 되더라ㅜㅜ  
20161212,10,올 겨울을 따뜻하게 만들어줄 영화라고 생각해여  
20161212,8,일단 변요한과 김윤석 배우라면 뭐 믿고볼만하지요  
20161212,9,그냥 잔잔하고 조용할 줄 알았는데 긴장감도 대박ㅋㅋ  
20161212,10,진짜 기대 엄청했는데 기대이상으로 재밌었다  
20161212,10,앞으로 기욤 뮈소의 다른작품들도 영화로 나올듯하다ㅋㅋ  
20161212,9,한국만의 특유의 감성으로 소설을 잘 녹여낸듯!!  
20161212,8,끝나고도 영화의 감동이 밀려와서 한동안 앉아있었음..  
20161212,9,기욤뮈소만의 특유한 감성을 잘 녹여낸 영화가 탄생했길..  
20161212,10,나도 과거로 돌아가면 보고싶은 사람이 있는지 상상해봄ㅋㅋ  
20161212,10,현재도 미래도 모든 순간을 소중하게 여겨야겠어요ㅠㅠ  
20161212,9,배우들의 눈빛연기가 대박이다ㅠㅠ아련하고 애틋하고!  
20161212,9,영상 분위기도 너무 좋았도 ost도 다 좋았던..!  
20161212,10,1인 2역의 영화는 많이 봤는데 2인 1역은 또 첨이다ㅋㅋ  
20161212,8,기욤 뮈소는 정말 한국인이 사랑하는 소설가!!영화화 되서 너무 좋다 ㅎ  
20161212,10,진짜 감성연출 대박이었어요ㅠㅠ분위기만으로도 마음을 녹임  
20161212,10,두 배우를 가만히 보면 참 닮았다는 생각도 들던데..  
20161212,9,진짜 이렇게 영화를 보고 마음이 꽉차는 느낌은 처음입니다!!  
20161212,10,시사회후기들이 너무나 좋아서 더 기대됬던 영화!  
20161212,10,이 영화때문에 책으로도 또 열풍이 불듯합니다ㅋㅋ  
20161212,10,ㅠㅠ이 소설은 많은 사람이 읽었을듯 이제는 영화로 봅시다  
20161212,10,조연으로 나오는 배우들 덕분에 중간중간 웃음포인트 제대로ㅋㅋ  
20161212,10,나는 과거로 돌아간다면 무엇을 할까?하면서 보게되더라구요^^  
20161212,10,소설이랑 비교하면서 보게될줄알았는데 몰입도 쩔어서 그런생각 할 겨를이 없더라  
20161212,9,예고편부터 내 마음을 사로잡았던 영화  
20161212,10,자신의 미래를 중요시하는 수현의 입장도 이해가 가서 더 애틋했음  
20161212,10,채서진이 이렇게나 아름다운 배우였나..진짜 이쁘게 나오더라  
20161211,9,변느님ㅠㅠ이 영화 분위기 대박이다진짜루  
20161211,9,완전 대박으로 감성작품이다ㅠㅠ보다가 눈물폭발함  
20161211,10,출연하는 배우들만 봐도 안볼 수가 없더라구요 라인업 짱  
20161211,9,두시간동안 많은 생각을 하고 추억을 회상하게 만들어줌ㅠㅠ  
20161211,10,이건 진짜 영화관에서 보는 것을 추천ㅋㅋ  
20161211,10,모든 사람들에게 추천해주고 싶은 영화가 나타났다!!!  
20161211,10,본지 한참됬는데도 아직 마음에 잔잔한 감동이ㅋㅋ  
20161211,9,앞으로는 내 사람에게는 정말 잘해야겠다  
20161211,9,ㅋㅋㅋ올해 본 영화중에 이게 젤 감동적이고 기억에 남을듯  
20161211,9,보면서 나도 후회되는 때가 자꾸만 생각나더라  
20161211,10,나도 과거로 돌아가고싶다 그럼 진짜 잘해줄 자신있는데..  
20161211,9,이건 어르신분들이봐도 공감하면서 보실 듯 합니다  
20161211,10,두시간 내내 울고 웃고..긴장도 하고 알찬 시간이었다  
20161211,10,보면서 울컥한 부분도 많고 괜히 옛 친구들이 생각나더군요  
20161211,10,앞으로 당분간은 여운을 그대로 간직할듯ㅠㅠ  
20161211,10,예전에 소설보면서 혼자 펑펑 울었던 기억이 나더라ㅜㅜ  
20161211,10,보고나서 남자친구를 더 사랑해야겠다고 생각했어요^^  
20161211,10,솔직히 원작을 얼만큼 잘 살렸을지 걱정했는데 괜한 걱정이었네여ㅋㅋ  
20161211,9,이건 진짜 인생영화다..안보면 후회할겁니다  
20161211,10,소설 한번 더 보고 영화봤는데 감동은 그대로다ㅜㅜ하 대박이야 진짜  
20161211,10,ㅠㅠ이건 나중에 다시봐도 감동적일 것 같다  
20161211,9,요즘 굉장히 추운데 보고나서 마음이 따뜻해졌어요  
20161211,9,보고나니까 기욤 뮈소의 다른소설들도 영화로 나왔으면 좋겠다는 생각이들었다ㅜㅜ  
20161211,10,이렇게 다시 내 삶을 되돌아볼 수 있는 계기를 만들어줘서 감사합니다  
20161211,9,한해를 되돌아보게 되었어요^^감동적이네요  
20161211,10,영화의 감동이 가슴을 후벼파네요ㅠㅠ한번 더 보고 싶음  
20161211,10,나도 저런 약을 구할수만 있다면ㅜㅜ후회되는 일이 너무 많다  
20161211,10,앞으로 후회할 일 하지말고 지금부터 잘하자구요!!  
20161211,10,김윤석의 아우라를 느낄 수 있었다 물론 변요한도 ㅎㅎ  
20161211,10,ㅠㅠ과거로 돌아가서 일을 해결하려는 김윤석의 마음이 이해가간다  
20161211,1,당신 거기 담요 좀 내려줄래요?  
20161211,9,연말에 이런 따뜻한 영화라면 한해를 잘 마무리할 수 있을듯하네요  
20161211,10,스토리와 연출도 너무 좋지만 두 배우의 연기력이 대단하다  
20161211,9,현재가 중요하다는 것을 다시 느끼게 해준 영화  
20161211,9,드라마 나인?이랑 약간 비슷한 것 같은데 다른느낌ㅎㅎ정말 재밌네요  
20161211,9,한 해를 마무리하기에 딱 좋은 영화다!  
20161211,10,자극적이지 않으면서도 웃음과 감동과 긴장감이 들어있어서 좋았다  
20161211,9,현실에서는 절대 불가능한 일인걸 알면서도 공감하면서 본 1인  
20161211,10,옆에있는 사람의 소중함..현재의 소중함을 알려주는 영화  
20161211,10,요즘 소원해졌다고 생각하는 연인들에게 강추합니다^^  
20161211,10,올해 마지막 영화로 이거다!!!  
20161211,10,사랑하는 사람을 다시 구하려고 하는 김윤석의 마음ㅜㅜ감동이었다  
20161211,9,책은 책대로 영화는 영화대로 다른 매력과 재미가 있네요 대박 기원합니다  
20161211,10,책을 먼저 접한터라 기대를 안할수가 없네요 책이 진짜 명작이였죠  
20161211,10,추운 겨울과 너무나 잘어울리는 따뜻한 영화  
20161211,9,아 빨리 보고싶다 진짜.. 개봉일만 기다리는 중..  
20161211,9,과거의 나를 만난다는게 참 비현실적이지만 몰입해서 잘 봤어요  
20161211,10,한 해를 뒤돌아보게 만들어주는 공감가는 영화였습니다^^  
20161211,9,돌아가고 싶은 때가 많은데ㅠㅠ괜히 찡하더라구여  
20161211,10,후회하는 일 생기지 않도록 항상 최선을 다하면서 살아야겠다는 생각이 들었다  
20161211,10,이 소설을 읽어본 사람들이라면 영화 꼭 봐줘야지요^^  
20161211,10,올겨울 따뜻한 감동을 느끼고 싶다면 이 영화 보시길ㅋㅋ  
20161211,10,시사회로 잘봤어요..여운이 가시질 않아서 다시볼 생각중ㅠㅠ  
20161211,10,배우들의 명품연기가 영화를 잘 살려낸듯!!  
20161211,9,저는 소설로 읽은지 얼마안됬는데 이렇게 영화로 보니 감회가 새롭네여  
20161211,10,스토리 구성이 굉장히 흥미롭더라구요!진짜 강추합니다  
20161211,9,돈이 전혀 아깝지 않았던 영화에요  
20161211,10,잔잔한 영화이긴 하지만 온갖 감정을 다 느낄 수 있다  
20161211,10,ㅋㅋ진짜 이거 볼라고 얼마나 기다렸는지몰라요ㅠㅠ  
20161211,10,누구와 봐도 즐길 수 있는 영화다  
20161211,10,판타지 내용이지만 자극적이지않고 마음이 따뜻해져서 좋다  
20161211,10,현재를 어떻게 사느냐에따라 미래가 달라지는듯ㅠㅠ열심히살자  
20161211,10,나중에 후회하지 않기 위해 최선을 다합시다  
20161211,9,변요한과 김윤석의 연기호흡도 잘 봤어요!역시 연기 천재  
20161211,10,무조건 봐야하는 판타지영화라고 생각함  
20161211,9,예전에 소설로 보면서 엄청 울었던 기억이 나더라구요  
20161211,9,원작이 워낙 좋아서 영화를 좀 걱정했는데 괜한 걱정이었군ㅋㅋ  
20161211,10,나는 과거로 돌아갈 수 없으니..앞으로 최선을 다하며 살아야지  
20161211,9,열심히 달려온 2016년을 다시 되돌아 보는 계기를 마련해준다  
20161211,10,괜히 며칠 전에 남자친구한테 화낸게 후회되네 흑  
20161211,10,"부모님,친구,연인 누구와 봐도 감동적이고 공감할 수 있다고 생각해여  "
20161211,10,보고나면 많은 생각을 해주는 영화ㅋㅋ있을때 잘하자^^  
20161211,10,현재를 소중히 여기게 되었어요 ㅜㅜ현재에 감사하며 살아야지  
20161211,10,개봉전부터 인기폭발..진짜 흥했으면 좋겠다  
20161211,10,이소설 진짜 좋던데 군대에서 봣는데 장난아니였는데영화 라니  기대가 많이됩니다.  
20161211,9,내가 좋아하는 소설을 좋아하는 배우들이 연기해서 더 좋았던!!ㅋㅋ  
20161211,9,영화의 제목만 봐도 가슴이 떨렸던..보고나니 더 대박인영화  
20161211,10,감독이 소설의 분위기를 잘 살려낸듯 ㅠㅠ대박재밌어  
20161211,9,내용도 너무 좋았고 두 배우의 훌륭한 연기가 돋보였다  
20161211,10,소설 한번 더 읽어볼 생각이다 진짜 여운이 가시질 않아ㅠ  
20161211,1,본격 초딩 타케팅영화.  
20161211,10,첨부터 끝까지 슬프기도하고 감동적이기도 한 영화  
20161211,10,기대되는 영화였는데 기대 이상으로 재밌게 봤습니다  
20161211,10,원작인 소설과 나오는 배우들만 봐도 안 볼 수가 없다는거ㅋㅋ  
20161211,10,요즘 다 자극적인 소재의 영화 뿐이었는데 이 영화는 잔잔하면서도 좋음  
20161211,9,영화 정말 대박이네요..글이 아니라 영상으로 보니 더 슬프다  
20161211,10,질투의화신에 나온 영화와 동일 제목이라 궁금했는데.. 봐야겠네요.  
20161211,10,모두가 봐야 될 영화이다..현재와 미래를 소중히 여깁시다  
20161211,9,저는 친구랑 봤는데 부모님이랑 한번 더 볼 생각이에요  
20161211,9,한동안 여운이 가시지 않을 것 같은 영화에요ㅠㅠ  
20161211,10,와 시사회로 먼저봤는데 영화 끝난 후에 막 벅차오르더라  
20161211,10,마음이 따뜻해지고 내 삶에 대해 많은 생각을 하게 해준 영화다  
20161211,10,시사회를 통해 관람했는데 정말 스토리도 탄탄하고 억지로 짜낸 감동 또한 존재하지 않고 영화 자체도 너무 이쁩니다. 정말 한 마디로 마음이 따뜻해지는 그런 영화. 연말에 소중한 사람들과 함께 꼭 보러 가세요. 진짜 재밌어요 후회하지 않으실 겁니다 ㅠㅠㅠ  
20161211,10,평생 후회할 만한 행동은 애초에 하지 말아야겠다  
20161211,10,이 영화 연말에 천만 돌파할 것 같은 느낌적인 느낌..ㅋㅋ  
20161211,10,하 과거로 돌아간다고 내 인생이 바뀌었을까...흠  
20161211,9,과거도 중요하지만 미래를 중요하게 생각하는 변요한도 이해가 가더라  
20161211,9,생각보다 중반부로 갈수록 긴장감 쩐다!!  
20161211,9,소재는 신선한 편은 아니지만 영화 분위기라던지..모든게 좋았다  
20161211,10,지금 내 옆에 있는 사람들에게 잘해야겠다  
20161211,9,영화로 나와도 외국영화일줄 알았는데ㅠㅠ변요한과 김윤석이라니 대박  
20161211,10,얼마전에 소설을 봤는데 영화로 나온다고 해서 기대 엄청했어여^^  
20161211,10,보는 내내 눈물이 찔끔 나오고 웃음도 나고..ㅋㅋ온갖 감정을 다느낌  
20161211,10,제 인생소설을 영화로 만나볼 수 있다는 자체가 감동  
20161211,10,몰입도가 장난 아니었어요 걍 잔잔한 영화라고 생각하면 오산!  
20161211,10,소설로 재밌게 읽었던 기억이 나요..영화로도 감동적이네요  
20161211,9,이 영화를 기다린 사람은 나뿐만이 아닐거다ㅠㅠ드디어 나왔구만  
20161211,10,두시간동안 가볍게 즐기기에 제격인 영화라고 생각해여  
20161211,10,ㅠㅠ와 이건 진짜 안보면 후회할 영화다  
20161211,9,오랜만에 자극적이지 않고 마음이 편안해지고 따뜻해지는 영화였음  
20161211,10,과거의 일을 해결하면서 생기는 모든 에피소드를 세심하게 잘 담아냈다  
20161211,9,옛 추억들을 떠오르게 하는 영화였답니다  
20161211,9,연인들끼리 보면 서로의 소중함을 더 느낄 수 있을듯??  
20161211,10,엄마랑 같이 보길 잘했어요ㅠㅠ흑 앞으로 잘해드려야지  
20161211,9,많은 사람들이 공감하면서 볼 수 있는 영화라고 생각합니다^^  
20161211,10,과거 연인을 구하기 위해 최선을 다하는 모습이 찡하더라구요ㅜㅜ  
20161211,10,그냥 가볍게 볼 생각이었는데 여운이 가시질 않아서 평 남겨요..이 영화 대박ㅠ  
20161211,10,연말 영화로 너무 좋을 것 같아요 꼭 보시길..  
20161211,9,기욤 뮈소의 작품은 사람의 마음을 울리는 뭔가가 있다  
20161211,10,진짜 내 인생영화로 등극..  
20161211,10,ㅠㅠ영화 보러가기 전에 소설로 한번 더봤어요 몇번을 읽어도 감동적임  
20161211,10,있을때 잘해야한다는 말을 떠올리게 하는 영화였음  
20161211,10,"보는 내내 감동,재미,슬픔 다 느낄 수 있어서 마음이 꽉참  "
20161211,9,이제 연말이 다가오면서 내 인생을 한번 뒤돌아보게 해줌  
20161211,9,나는 딱 1년 만이라도 돌아가고싶다ㅠㅠ  
20161211,10,누구나 한번쯤은 해봤을 과거로 돌아가는 소재를 간접적으로 잘 느낄 수 있었음!  
20161211,9,갈끔하게 잘뽑았음 감자 넘 이쁘고  
20161211,4,알바들이 너무 평점올리기만 급급하다 그만쓰세요한국판 어바웃타임인가요?  
20161211,5,김윤석사과하는거존나없어보이네김윤석때문에관객100만명은떨어져나갔다  
20161210,7,"시사회를 통해 보고 왔는데, 한 평생 사랑하는 사람을 위한 한 남자의 애틋한 이야기가 참 좋았습니다!! 많은 사람들이 이영화를 통해 따뜻한 겨울을 보냈으면 합니다!!  "
20161210,10,시사에 다녀왔습니다 정말 재밌게봤어요 잔잔하니 감동적이고 중간중간 감초역할을 해주시는 태오 아저씨 태호던가여...ㅋㅋ 무튼 재밌어요 또 보러갈생각입미다  
20161210,9,남녀노소 누구나 공감하면서 볼 만한 따뜻한 영화  
20161210,9,ㅋㅋㅋ괜히 친구들이랑 여자친구한테 화내고 못되게 행동한게 생각나더라  
20161210,10,보는 내내 마음이 찡하고..나도 과거로 돌아가고싶다는 생각이ㅠㅠ  
20161210,10,데이트하면서 봤는데 여자친구보다 내가 더 재밌어했다는거..  
20161210,9,ㅋㅋ하 이건 진짜 연말에 꼭 봐줘야하는 영화라고 생각함  
20161210,10,가장 좋아했던 소설이 영화로 잘 각색되어 개봉되서 넘나 좋은 것  
20161210,10,나중에 후회하지 않도록 현재를 열심히 살아야겠어요..  
20161210,10,드디어 기다리고 기다리던 영화가 나와서 좋다ㅠㅠ  
20161210,10,스토리 좋고 연기 좋고ㅋ 개봉일날 한번 더 보는걸로  
20161210,9,뭉클하고 아름다운 영화는 정말 오랜만  
20161210,9,시사회 평들 좋아서 더 기대됨ㅠㅠㅠ 빨리 보고싶다 나도  
20161210,10,감동도 있고 재미도 있고 기대이상으로 잼나게 봄ㅋ  
20161210,9,시사회 응모했다가 떨어져서 아쉽지만 개봉하면 바로 볼거예요  
20161210,9,원작 그 이상의 영화가 탄생했다  
20161210,10,변요한의 또 다른 색다른 모습 너무 기대됨!!  
20161210,9,원작도 재밌게 봤었는데 원작만큼이나 재밌는 영화가 탄생했다  
20161210,10,오랜만에 훈훈한 영화 한편을 보고 왔네여 겨울에 딱 보기 좋아여  
20161210,9,원작 자체가 워낙 유명해서 스토리는 걱정 안해도 될 듯  
20161210,9,개봉일만 기다리는중ㅜㅜㅜ 시사회 떨어졌다ㅜ  
20161210,10,기대를 저버리지 않는 원작에 탄탄한 연기까지ㅠㅠ  
20161210,9,출연진들 하나같이 연기력 쩜ㅋㅋㅋ 채서진? 처음 보는데 존예;;  
20161210,10,감성 터지는 판타지 영화!  
20161210,10,아직 원작을 못봣는데 이 영화 보니까 원작도 읽어 보고 싶다는 생각이ㅎㅎ  
20161210,10,소설도 재밌게 봤는데 영화로 보니 더 감동ㅋㅋ  
20161210,9,연기 잘하는 배우들이라 기대중ㅎ  
20161210,10,현재의 소중함을 느끼고 깨닫게 해주는 좋은 영화  
20161210,10,잔잔하고 가슴 따뜻해지는 영화였습니다  
20161210,10,연말에 보기 좋은 영화였습니다  
20161210,10,현실은 시간을 돌릴 수 없다는 사실ㅋㅋㅋ]현재를 충실히 살아야겠다는 큰 교훈을 얻음  
20161210,9,이제부터 나의 인생영화가 될 것 같다  
20161210,9,올해 나온 한국영화 중에서 손에 꼽힐 정도로 재밌게 봤어요  
20161210,10,가슴 따땃하게 보다가 후반에는 겁나 찡~..  
20161210,9,인생을 돌아보게 하는..? 좋다 좋아  
20161210,9,추운 겨울과 잘어울리는 따뜻한 영화ㅎㅎㅎ  
20161210,10,시사회로 보고 왔는데 너무 좋았습니다 올해 마무리 영화로 정말 좋은거 같아요  
20161210,10,잔잔하면서 감동을 주는 영화 좋아요 좋아!  
20161210,9,책으로도 읽어 보고싶을 정도로 재밌게 인상깊게 봤음  
20161210,10,몰입할만한 요소들이 충분하네.. 그냥 시간 가는줄 모르고 감상  
20161210,9,기욤뮈소 원작을 한국 정서에 맞게 잘 각색한거 같아요 책 다시 한번 봐야겠어요  
20161210,9,기대 안하고 봤는데 너무 좋았다 시사회로 봐서 더 좋음 ㅋ  
20161210,10,배우들의 연기는 물론이고 인상깊은 장면들도 많고 좋았어여~~  
20161210,9,올해 마무리는 당신 거기 있어줄래요!  
20161210,10,판타지에 감동과 재미가 더해져서 감성 판타지가 탄생했네요  
20161210,10,안세하 김상호 하드캐맄ㅋㅋㅋ 너무 매력있잖아  
20161210,10,최고다 최고 당신 거기 있어줄래요  
20161210,9,당신 거기 있어줄래요 제목부터 감성 터짐ㅠㅠ  
20161210,10,잔잔하게 흘러가면서 깨알같은 웃음들과 진한 감동까지 굿  
20161210,10,역시 기대한 만큼 재밌고 좋았던 작품  
20161210,10,기대이상 몰입감 쩔었음ㅋㅋㅋ 마지막까지 존잼  
20161210,10,생각외로 너무 재밌게 봤다 솔직히 별로 기대 안했는데 너무 재밌게 봄  
20161210,9,잔잔하게 재밌는 영화 봐도 후회하지 않아요  
