0,1,2
20170425,5,초반에 너무좋았습니다근데 1명죽을때 까지요...두번째는 좀 억지감이...ㅎ어찌 대선때 맞춰서 나왔는지는모르지만~선거랑 상관없이 재미지더라고요~조금 뻔뻔한건 문재인씨 생각도 나고했습니다^^  
20170425,9,잼있어요~!! 블랙코미디같은 부분도 많고 배우연기 좋아요  
20170425,10,최민식의 이정도 공약에 연설이면 최민식을 국회로  
20170425,10,명품배우들의 정치공세가 리얼하고 볼만하네요  
20170425,10,다들 연기 캐미 훌륭합니다 특히 미란언니는 완죤 귀여워요  
20170425,9,또 보고싶을정도로 나름 재미지게 잘봤습니다  
20170425,8,최민식 vs 곽도원 악역대결  
20170425,9,실화같은 영화라서 리얼하게 잘봤습니다  
20170425,9,시사회에서 미리봐서 꿀잼  
20170425,10,선거전 의미심장하게 보라고 나온듯 ㅎ  
20170425,9,생각보다 흥미진진한 내용들~~  
20170425,9,예상안되는 전개에 몰입나쁘지 않았습니다  
20170425,10,역시나 최민식만으로도 볼가치는 충분  
20170425,10,정치비판이야기 다룬 영화중 리얼소개라서 가장 현실감 있는거 같다  
20170425,6,이런 스타일의 영화는 내부자들이 가장 최고라고 본다  
20170425,10,흥행보증수표 최민식 역대급 연기 좋아요  
20170425,9,실감나는 정치이야기 신선한 소재로 배우들이 연기가 돋보였네요  
20170425,9,정치판이 지금 바뀌길 간절히 바라면서 부담없이 관람했네요  
20170425,8,더킹이 이런 이야기이길 바랬는데 더킹때문에 이런 소재 관심 떨어졌지만 조금기대  
20170425,9,마지막은 진심 올드보이 생각나더라 ㅎㅎㅎ  
20170425,9,연출 스토리가 식상하지 않아서 좋았던것  
20170425,10,난 잼나게 봤고 특히 라미란이 빵터짐  
20170425,10,현실적으로 담아서 담백하고 볼만해요  
20170425,9,기대안하고 봤는데 좋았어요  
20170425,9,깨알 조연들 많이 나오고 연기는 정말 누가모래도 일품  
20170425,10,나에겐 의미있는 특별한 시민영화 굿  
20170425,10,배우들이 무대나와서 이야기풀어주니 좀더 잼있게 여운이 남는거 같아서 좋았어요  
20170425,10,최민식 연기 기대된다...  
20170425,10,최민식연기는 정말 일품이고 믿고보는 국민배우  
20170425,8,투표전에 함 봐줘야하는거 아님??  
20170425,10,곽도원연기할때 몰입자동으로 되넹 ㅋㅋㅋ  
20170425,9,우리의 생각을 일깨워주는 사이다같은 영화  
20170425,10,현 시국에 딱 들어맞는 시기에 타이밍 좋네요 ㅎ  
20170425,10,우리가 지금껏 본적없는 선거판 소재 신선하다  
20170425,10,연기력 보는거 좋아하는 덕후들 닥추!  
20170425,9,변종구만의 캐릭터만 봐도 큰재미짐  
20170425,10,국민들에게 투표의 중요성을 인식시켜주는 메세지  
20170425,10,유세 장면들이 아주 현실감 있는게 강약조절이 잘 되있는 영화  
20170425,10,이영화가 말해주는 이야기의 설득력이 투표를 독려할듯  
20170425,10,캐릭터간의 신경전이 제일 볼만하고 곽도원연기 지림  
20170425,9,현실과 너무 닮은 영화라서 암담하네요~  
20170425,5,개졸작일가능성이 농후한 영화  직관적으로 이영화에서 아수라의 냄새가난다..  
20170425,10,곽도원의 악역은 영화마다 신기할정도로 잘어울리는데??  
20170425,10,영화 하루이틀 봅니까 최민식나오면 믿고보는거지  
20170425,1,될대로 되라는 식의 영화인건가..  
20170425,1,이런 내용 인제 지겨운데. 뭐 색다른 영화 없냐?  
20170425,10,대선전이라 그런지 더 기대되네요...ㅎ  
20170425,1,이런건 아이피티비용으로 딱이지 ㅋㅋ  
20170425,1,한국영화는 느와르장르만 내는것인가 ...  
20170425,9,투표하기 전에 반드시 봐야할 영화. 비현실적으로 보이지만 모든 것이 현실 정치판에 존재할 것 같다. 강추  
20170425,1,담주에 가오갤2랑 보스베이비한테 박살나게 되있다  
20170425,2,별로 기대가 썩 안되는..  
20170425,1,최민식 이번에도 말아먹을 것인가?  
20170425,10,블랙코미디라고 하기에는 너무도 씁쓸하고 어두운 우리 정치의 현실 근데 아래 안티 알바들 너무 티나네  
20170425,3,배우들 연기는 좋았으나 다른부부분이 많이 부족해요  
20170425,2,기대한만큼에는 한참 못미치네요  
20170425,1,재미있어야할텐데..  
20170425,3,배우들의 연기력을 연출이 따라가지 못하는듯한 느낌  
20170425,2,심은경 뭔가 이상한데..캐스팅 에러인듯  
20170425,10,와 .. 이기홍 캐스팅은 신의 한수다.. 메이즈러너 진짜 재밌게봤는데 ㅎㅎ  
20170425,1,이런영화 너무 많이 나오는데  
20170425,10,끝없는 권력욕망이 부패한 사회를 만드는 근원.. 먼가 확 바뀌어야할거같은 시기다  
20170425,10,최민식은 마지막까지 악역이지만 멋지다  
20170425,9,어려울수 있는 이야기지만 공감가는부분 90%  
20170425,10,배우들 연기력덕에 몰입하면서 정치풍자이야기 잘 봤음요  
20170425,9,기대안하고 봤는데 최민식 연기력 후덜덜하네요  
20170425,9,시사라서 그런지 잼나게 잘보고 잘만들어 진거 같네요  
20170425,9,연기들을 겁나잘해요.. 최민식 곽도원은 최고  
20170425,10,기대한만큼 이상으로 영화가 흥행하길  
20170425,8,지금 시기에 딱 부담없이 흥미있게 볼만합니다  
20170425,10,시사회 보고 왔습니다. 즐겁고 재미나게 잘보고 왔네요. 런닝타임이 긴데도 시간가는줄 모르고 봤어요. 누구랑 봐도 무난하게 최소한 재밌게 봤다. 정도 반응은 충분히 이끌어낼만한 영화였습니다.  
20170425,10,주제거리도 궁금하고 연기력이야 말할것두 없구 왕 기대중입니다~~~  
20170425,4,최민식 곽도원 때문에 그나마 4점줌.  
20170425,9,곽도원은 예상했지만 반전매력 쩌는구만 소름유발자  
20170425,10,최민식 연기인생 최초로 정치인 역할 맡았다는데 안보면 섭하지  
20170425,10,이번달은 선택의 여지가 없이 이걸로다가..  
20170425,9,각자의 캐릭터들을 완벽히 소화해낸거 같아서 재미났네요  
20170425,10,라미란누나의 생각지도 않은 연기에 엄청 웃다가 옴  
20170425,9,지금 시사회끝나고 오면서 쓰는거 ㅋ 볼만합니다  
20170425,2,배우들은 좋지만....뭔가 연출이 좀 부족한듯 하네요  
20170425,10,연기의 신들이 ㅎㄷㄷ 정말 보고잡아요  
20170425,9,시대적인 분위기랑 맞다보니까 관심이 절로 @_@  
20170425,10,영화가 보여주는건 빙산의 일각?!  
20170424,9,다 알거같은 내용이지만 보면 좀더 구체화 된다  
20170424,2,예고편 보고 많이 기대했는데 시사회로 보니 많이 실망이네요  
20170424,10,검사연기 출신의 곽도원은 역시나 엄지척  
20170424,9,현실에 진저리 나지만 특별한 영화였던건 사실  
20170424,10,예전엔 정치영화 관심도 없었다. 이젠 정치영하 본다. 박인제감독이라면   적나라하게 만들었을꺼라 믿는다. 그리고 영화는 관람후 씹는거다.  
20170424,8,영화가  만들어질때 현실이 이렇게 흥미진진하게 돌아갈줄 몰랐겠지  
20170424,8,대선도 얼마 안남은 상황에 이런영화라니 특별하게 생각하고 보고왔네요 ㄷㄷ  
20170424,10,엄친아 이기홍 오라버니 bbb 짱짱  
20170424,9,간만에 사이다같은 영화 잘봤어요  
20170424,5,시사회로 보고옴. 정치 '영화'라기엔 다소 따분하다. 최순실 때문에 개봉을 못했다던데 아무리 봐도 요샌 현실이 영화를 뛰어넘어서.. 최민식의 연기만 살아 빛난다. 심은경 캐릭터는 많이 아쉽다. 결국 시민으로 돌아간 우리가 무엇을 할 수 있는가?  
20170424,4,이 배우들과 소재를 가지고 이렇게 별로로 만들기도 힘들거 같습니다 ㅠㅠ 시사회로 보고옴  
20170424,10,"문재인 캠프 SNS기동대 ""조직적 대응의 뉘앙스가 풍기지 않도록 엄중 경계하라"" http://m.news.naver.com/read.nhn?mode=LSD&sid1;=001&oid;=047&aid;=0002147154  "
20170424,9,양심에 찔릴짓 하는 정치인들은 이영화보는걸 두려워 할듯  
20170424,10,유료로 시사봤는데 돈안아깝게 시간가는지 모르게 잘 봤습니다  
20170424,10, 매력적인 배우들의 명품연기 안볼수가 없지 기대된다ㅠㅠㅠ  
20170424,10,명언들 막 쏟아져 나오넴.. 충분히 재미짐  
20170424,9,최민식아니면 이역활을 누가함?  
20170424,8,"사람들이 믿게 만드는 것, 그게 바로 선거야.. 정신차리고 선거합시다  "
20170424,9,와 이건 노린거아닌건 알고있는데 노린거같다...대선바로며칠앞에 개봉하는 대선영화 타이밍진짜잘맞아떨어졌다 감독신의한수...  
20170424,10,서울시장으로 변신한 배우 최민식씨의 연기인생 보고픔  
20170424,10,첨부터 최민식등장에 빵터짐 ㅎ 끝에는 올드보이생각나더라  
20170424,2,안봐도 뻔하다.. 최민식 연기하난 볼만하겠네  
20170424,10,헐 이 라인업 실화냐?ㅋㅋㅋㅋ대박캐릭터들의 조합 응원합니다요!!  
20170424,10,충분히 설득력 있고 재미보다는 의미있어 좋았던거 같아요  
20170424,9,정치인들은 정치판 안에서 선거는 전쟁이고 정치는 쇼일뿐인건지…  
20170424,9,류혜영의 똑소리 나는 연기 오랬만에 눈이갑니다 ㅎㅎ  
20170424,10,라미란 기호2번 완전 웃깁니다  
20170424,10,한번더 부모님 모시고 보고싶네요 연기도 최고예요  
20170424,10,오랬만에 역대급 연기자들 영화 나옴 극장각  
20170424,9,내부자들하고는 다른 느낌의 영화라서 감회가 새롭네요  
20170424,9,부패권 세력 메세지 전달방식은 영화가 그나마 좋은듯  
20170424,10,최민식과 곽도원은 진짜 불꽃튀는 데?? 지지않어~~  
20170424,10,대박예감이 느껴짐ㅋㅋㅋ 개봉일 매진예상  
20170424,10,라이브톡 완죤 좋아요 앞으로 계속 이렇게 제대로 보고 싶네요  
20170424,10,리얼하구 실감있는 그 세계를 훌륭하게 표현해 준배우들께 감사  
20170424,10,여배우들도 뒤쳐지지 않는 연기캐미 잼나요~  
20170424,9,감독님 세월호도 찍어주세요 이렇게 리얼한 스토리로 강추강추  
20170424,9,신구 조합의 배우들이 맛깔나는 연기까지 우리의 영웅같은 영화  
20170424,9,이영화가 선거전에 나와야지 끝나고 나오나?? ㅡㅡㅋ 사람들참  
20170424,8,정치가에 메세지를 주는 마지막 커트라인 등급의 영화인듯  
20170424,9,압구정에서 배우들과 만남에서 인상깊었고 이야기 듣고나니 더 잼있엇던  
20170424,10,연기파 배우들의 현실감 있는 연기 구~~웃  
20170424,9,오랬만에 반가운 영화!  
20170424,9,연기할때 몰입도 최고예요!! 진심 진짠줄  
20170424,1,알바들 티가 너무나는데....심하다 믿을게 없네  
20170424,9,현실과 비슷해서 보고난뒤 씁쓸했지만 재미졌어요  
20170424,10,치밀한계획과 전략적인 공세로 선거판을 쥐고 흔드는 인간들이 진짜 함 보셔야겠넹  
20170424,9,우정출연 빵빵하니 볼거리 많은 정지풍자쇼였습니다  
20170424,8,우리는 선거할때만 특별시민이 되는 아이러니..  
20170424,10,"심각한 한국 정치이야기를 맛깔나게 다 표현했네요 유쾌, 상쾌, 통쾌  "
20170424,10,최민식의 정치 인생연기 캐굿  
20170424,10,선거 하루이틀하냐는 대사를 들으니 정말 쇼같은 느낌이 드네요.  
20170424,9,갠적으루 이기홍 나온다구해서 꼭 보구말거예요 ><  
20170424,2,다들 투표합시다 우리나라 정치판은 2점  
20170424,10,"기호1번.. 댓글부대, 포털사이트 점령, 정치는 쇼라는 보여주기식 이미지정치. 국민들을 개돼지 취급하는 정치인들.. 사람들이 겉으로 드러나는 쇼에만 넘어가는 일이 없기를. 대통령후보는 실제 지금까지 해온 일들로 평가 받아야 한다. 신중하게 뽑자 이번엔  "
20170424,2,이런 부류의 영화 그만나왔음좋겠다 진심.  
20170424,7,오랫만에 최민식 나오네  
20170424,10,뒤에 숨겨진정치싸움 이야기를 볼 수있는 기회라 아이들 데리고 보고싶네요  
20170424,10,지금 나라가 이모양인지라.. 이런 정치비리 영화가 관심돋아  
20170424,10,이런영화 한번 나오길 기다렸습니다..  
20170424,9,최민신 vs 곽도원 악역 캐미 쩔었어요  
20170424,10,선거에 관심가지기 시작했는데 이영화보고 나서 완전 생각이 바로 섰다  
20170424,10,선거의 과정을 현실보다 더 리얼하게 그려냈을거같다  
20170424,1,정치 물타기영화..음...시기에 편승하려고하네  
20170424,9,정치와 선거의 세계 여태까지 유사한 영화와는 확연히 다른 진지함  
20170424,10,연기인생 첨으로 정치인 역할에 도전 :) 의심할 여지도 없음  
20170424,10,신선해 아주 넘나 기대되는것 !!  
20170424,10,무게감도 있고 충실히 잘만들어진거 같아요~  
20170424,10,특별한메세지가 있어서 의미있게 보고 왔습니다  
20170424,10,대선후보들이 이번달 젤로 보고싶은영화1위  
20170424,10,갓민식님 나오는 영화네요!! 기대기대  
20170424,10,권력을 향한 거짓된 정치판 쇼.. 다 뒤엎고 싶다 ㅡㅡ  
20170424,9,이배우들이 모였다는게 실화임?  
20170424,10,선거를 앞두고있어서인지 나에겐 특별했던 영화  
20170424,10,제목부터 특별함이 뭔가 느껴짐. 이제부턴 국민이 주인이다!!  
20170424,10,정치의 현실적인 부분을 너무나 직설적으로 잘 보여줌 리얼리티의 성공  
20170424,10,정치란 무엇인지 잘 말해줄 것 같은 느낌이다  
20170424,9,선거라는 소재가 우리시대와 걸맞는거 같아서 다른영화보다 더 눈길이 감  
20170424,10,이 영화로 우릴 어떻게 분노시키고 시원하게 해결해줄지 기대해봅니다 : )  
20170424,10,최민식이 말하는 부패한 정치폭로 연기  
20170424,10,비리폭로를 하는 정치드라마..!! 진짜 같아서 시간가는줄 모르고~~  
20170424,10,현실적인 소재로 리얼한느낌을 빠지게 할 거 같아서 더욱관심이 감ㅋㅋ  
20170424,10,세대를 아우르는 연기파배우들이 총 집합해서 더 호기심이 드는 작품인듯?  
20170424,10,지독한 정치가의 모습을 보여주는것에 연기가 충실해서 나쁘지 않았네요  
20170424,1,흠.. 최민식 빼고는 별로 기대가 되지 않는다.  
20170424,10,영원한 친구도 적도 없다. 권력만이 지배하는 시대  
20170424,9,역시 믿고 봐도 되는 배우들이였다 9점  
20170424,9,대선 전에 꼭봐야할 영화~세 주연배우 연기가 무쟈게 훌륭함  
20170424,10,예고편보니까 개봉날이 기다려져요~~!! 빨리보러가고싶네요!!  
20170424,10,무려 서울시장 3선에 도전하는 지독한 정치인의 모습을 보여준다 최민식의 색다른 모습기대  
20170424,10,ㅋㅋ 사이다같은 영화 최민식한테 걸렸다  
20170424,10,"최민식, 곽도원연기대결이 정말 볼만하고 꼭보세요 꿀잼  "
20170424,10,믿고보는 배우들의 조합이라 깨알재미에 시간 금방 갔네요  
20170424,10,민식이형 오랬만에 정치부패를 적나라하게 보여주시죠  
20170424,9,이런영화 잘 나오면 좋을것같다 게다가 배우들도 좋고 ~  
20170424,3,내부자들의 성공 이후 이런 영화들이 우후죽순 쏟아지는구나. 식상하다.  
20170423,1,또 돈벌려고 OO이 같은 영화 만들었네ㅋㅋㅋ 하긴 대선 기간이니 한철 장사겠네 이 때 많이 법시다~~  
20170423,1,정치성향이 너무 강하네. 감독 알만하다  
20170423,8,정말재미있습니다~  올해개봉작중 쵝오~  
20170423,10,조용히 강하고 유별나지 않아서 괸찮게 봤습니다  
20170423,10,최민식배우 너무 좋아하는데 정치인으로 나오니 현실감 완전 안고 볼수 있을듯ㅎㅎ  
20170423,9,이 예고편만봐도 확 끌리는데 곽도원은 멀해도 잘 어울림  
20170423,10,현실과 딱 맞아떨어지는 영화` 리얼리티 좋네요  
20170423,10,라이브톡으로 부담없이 보고 생각이 많이 드는 영화네요  
20170423,9,요즘같은 시기에 놓치면 안될 스토리  
20170423,9,"선거, 정치이야기라 그만큼 관심가는 영화  "
20170423,10,연기파 배우들 스크린에서 정치싸움 함 해봅시다!  
20170423,10,딱봐도 잼있게 보인다.. 기대충만  
20170423,8,블시로 두세달전에 봤어요..!응근 재밌고 . 러닝타임도 쭉쭉 빠져가요. 다만 연기신들가운데 흐름깨는 분들이 한두분있는거빼곤.무겁지않고 웃으면서 볼수있는 정치영화예요ㅋ  
20170423,10,어째 현실 특별시장과 성남시장 얘기와 비슷하냐 ㅋㅋㅋ  
20170423,8,보통 사람 특별 시민  ㅋㄱㄲㅋ  
20170422,10,딱 지금 시기에 맞는 재밌는 영화일듯 무조건 보러갑니다 민식이행님!!!!  
20170422,10,이런 영화가 많이 만들어져야 한다!! 강추!!  
20170422,4,영화는 안 봤지만 별 재미 없을 것 같네..내용도 그저 그런 뻔할 것 같은 느낌...  
20170422,10,이미지챙기는건 우리 원숭시장님이 최고야!  
20170422,10,"딱봐도 전시행정, 쇼맨쉽의 달인 박원순 얘기인것같다. 너무 기대된다! 그의 더러운 이면을 보여줄것같다!  "
20170422,5,요샌 국뽕보다 정치뽕이나 민주주의뽕이 너무 많아서 짜증난다.  
20170422,10,영화 1번이 현실 1번 보는듯  
20170422,1,우리 박원순 시장님 까는 영화인가요?  진짜별로네요  
20170422,1,음 솔직히 지루하고졸렸어요선거타이밍맞게 개봉한것같은데그거아니였음 빨리내렸을거같은느낌이예요많이 아쉬운영화..  
20170422,1,은근히 현 서울시장을 깔려는 스토리인것 같은데..  
20170422,10,"선거이야기, 정치판에대한 풍자영화네요 대한민국 시민들이 많이보았음합니다  "
20170422,10,심은경배우는 아역때부터 보고있는데 다양한 연기변신이 너무기대되여 ㅠㅠㅠ  
20170422,10,정치판에 나오는 재미있는 볼거리가 가득할 거 같아요 직접영화보면서 확인하고 싶어요  
20170422,9,또 한번 최민식씨의 맛깔나는 연기를 볼 수있는 이번 영화 완죤 기대중…  
20170422,10,주변사람들이 재밌을거같다구 기대중  
20170422,10,정치를 다룬 영화인만큼 현실과 비교하는 재미가 있어요  
20170422,10,"또 정치인가 싶겠지만, 씁쓸하고 숨막혀도 결국 정치는 아는만큼 보인다. 선정적이고 폭력적이지 않아도 충분히 긴장된다 재밌다!!!  "
20170422,9,어떤 메시지지든 배우가가 일단 훌륭하다  
20170422,9,내가 좋아하는 영화 스탈이 딱 나왔네 캐스팅도 오졌음 굿굿  
20170422,10,모비딕 작품 박인제감독의 6년만의 작품이라 기대를 걸어보구싶네유~ㅋㅋ  
20170422,10,여배우들의 블랙코미디 인상깊네요 ㅎ  
20170421,10,우리모두 한사람 한사람이 특별시민이란걸 이 영화에서 많은사람들에게 깨달음을 주었으면합니다  
20170421,10,특히 최민식 배우는 연기 최고  
20170421,10,올해 가장 보고싶었던 작품이라 시사회라도 먼저보구오고싶어요  
20170421,9,연기들이 자연스럽고 리얼해서 좋았습니다  
20170421,10,좋아하는배우들 다 들어있넹 ㅋㅋ  
20170421,10,스피드와 박진감을 기대하지 말고 보면 안지루함요  
20170421,9,세상썩은영화+최민식= 무조건 극장각이다 ㅋㅋㅋ  
20170421,9,최민식의 영화지만 라인업이 무척 훌륭한걸  
20170421,10,"시사회 금방 보고왔습니다. 보는내내 긴장할정도로 대한민국 정치판을 생생하게 경험하고 왔습니다. 믿고보는 최민식배우님의 연기는 감동입니다, 대박나세요!  "
20170421,10,치열한 선거전에 관한 이야기가 영화로 나오니 독특한 소재네요^^  
20170421,10,현실성없는 영화라는 말은 안들을듯ㅋ  
20170421,10,미틴 이기홍 ㅠㅠ녀뮤 좋아 꼭볼거야  
20170421,1,요즘 영화값도 만원 정돈데 한국영화보면 가성비 안나옴  
20170420,10,새자유당..ㅋㅋ 대한민국을 사로잡는영화가 될지?? 무척궁금함  
20170420,10,당장의 대선구도와 비교해 보는 재미가 있네요  
20170420,10,"우리의 선택하나, 투표 하나하나가 얼마나 소중한지 알려주는 영화이길!!  "
20170420,10,최민식은 역시 최민식! 소름끼  표정들 ㄷㄷ  
20170420,10,대박ㅋㅋ 연기파배우들이라서 더더 기대됩니다  
20170420,9,권력싸움의 주제가 최민식과 곽도원의 연기대결로 봐도 될듯  
20170420,9,"지금 우리의 혼란과 기대, 걱정 등 많은걸 담아낸 영화이길 바라며 기대할게요  "
20170420,10,내부자들하고 다른 느낌의 리얼리티..  
20170420,10,5월 대선을 남겨두고 이런 선거영화가 나오다니 그래서 더욱 보고싶네요  
20170420,10,최민식이 포스터에서부터 풍기는 존재감 쩐다  
20170420,9,가오갤vs최민식 2차전이냐  
20170420,6,5월 선거시기에 맞춰서 이런영화 나오는게 뭐 좀 이상하지않나???  
20170419,3,이기홍을 대체 왜 이렇게 망가렸지? 물어네 이기홍 ㅠㅜ  
20170419,4,이명박과 박원순이 상각나는구만 기래 ㅋㅋ  
20170419,10,"곽도원,최민식,라미란...이기홍,심은경  기대...  "
20170419,10,최민식이 포스터에서부터 풍기는 존재감 쩐다  
20170419,10,우리에게 꼭 필요한 영화 특별시민의식!  
20170419,10,cgv라이브톡 봤네요 나쁘지 않고 리얼한 연기로 메세지 전달 확실합니다  
20170419,9,이런장르는 기대안하고 봐야 잼남  
20170419,10,곽도원하고 최민식 슈퍼 캐스팅 -0-  
20170419,10,몇개월동안 예고만 보다가 담주에 개봉 ㅎ 꼭 보러감요  
20170419,9,의미심장한 메세지가 있는 특별시민을 위한영화  
20170419,5,정치영화는 내부자들 하나로 끝이다.. 그이상 뭘 더 표현하겠나..  
20170419,9,있을법한 이야기를 진짜 처럼 만드는 배우들 연기 클라스 일품  
20170419,10,"알고 싶지 않지만, 알아야 하는일들이 있으니 관심을 가져야 한다는걸 느낍니다  "
20170419,10,정치인 역활이 쉽진 않을건데.. 최민식이라면야..  
20170419,9,이시대에 딱 맞는 스토리에 배우들 보는 맛까지 기대기대  
20170419,10,믿고보는 최민식영화 올만에 잼날거 같음~  
20170419,10,어제 cgv라이브톡으로 첨봤어요~ 우리가 지금 꼭 봐야하는 느낌적인 느낌?!  
20170419,10,배우캐스팅 작살나네 ㅎ 곽도원이 이제는 최민식하고 나란히 어깨를  
20170419,7,지금 검색어순위조작 1위가 문재인펀드. 문죄인한테 돈내라는거다. 게이버가 문캠프라서 그런거일수도 있지만 문캠프인터넷선거조작단이 다방면으로 여론조작하고 있는. 결국 이 영화얘기는 감독의도와는 다르게 쇼 잘하는 문죄인 얘기가 될듯.  
20170419,5,제발 이런 소재 좀 그만 만들어 ㅠㅠㅠ  
20170419,5,왠지 이건 망할거같다.  
20170419,10,특별시민이가 뜨니까 비가 그쳐요!  
20170419,10,오늘 스타톡으로 봤는데 기대할만해요 ^^  
20170418,1,보고 왔다. 연기빼고 없다.  미드 정치  판박이  
20170418,10,박혁권 : 꼬긁 이기홍 : 발연기 가 캐리 한 영화  
20170418,10,스ㅡ타톡으로보고왓는데요 특별시민=아수라=프리즌급이네요 배우연기때문에10점주고가요  연기아니었으면. ..  
20170418,1,안봐도 그냥 무슨 내용일지 딱 보이지 않나? 내부자들처럼 느와르 끼운것도 아닌데 어떻게 정치소재하나로 작품하나를 끌고간단거임? 차라리 이번국정농단사태가 더 영화같겠다 ㅋ  
20170418,10,너무나도 현실적인 그래서 찝찝하지만 의미도 있는  
20170418,10,최민식의 연기를 또 보게되다니 벌써부터 가슴이설렌다  
20170418,1,아수라에 이은 망작 비추  
20170418,10,완전기대됨..선거운동할때 개봉하고 시기가 딱 좋다많은 사람들이 봤음 좋겠다  
20170418,10,이건머 봐야지 대선인데... 왠지 영화처럼 더럽우면.. 왠지 이영화  현실정치.... 아니길 바라지만...  
20170418,8,원하는걸 보여줄건가..썩은걸 보여줄건가..  
20170418,9,이명박도 생각이 나는구만ㅋㅋㅋ  
20170418,10,배우들 명불허전 ~~ 진짜 영화다운 영화를 봤다~  
20170418,10,평범했던 범죄 정치적 영화가 아닐거 같은 느낌입니다 2017년도의 첫 천만영화가 될거라고 굳게 믿습니다  
20170417,5,후... 진짜 개인적으로 정치얘기는 그만좀 했으면 좋겠다 이게 몇개째냐 맨날 정치 아니면 비리 형사얘기 뿐이지. 솔직히 독창성 너무 떨어지고 내용이 단순화 되고 있다. 대체 언제까지 정치얘기냐  
20170417,5,"솔직히 이런 부류 영화, 짜증난다.  헐리우드를 보고 배우길.  "
20170417,10,잼있겠당.기대기대기대  
