0,1,2
20170417,10,기대 중입니다 파이팅!  
20170416,10,라인업이 대단합니다. 특히 이기홍의 한국어도 볼 수 있을지... 기대됩니다.  
20170416,10,식상하다 식상해 ㅉㅉ 그래도 볼게없어서 총관객수 200만~250만 예상한다 이 글은 성지가 될것이다  
20170415,9,기대 돈주고 볼만하다는 생각  
20170415,3,미리보는 박원순 시장의 3선 도전기  그래서 3점  
20170415,1,너무  대놓고 만든 영화아닌가요??  
20170415,1,별시덥잖은 감독이 선거철 노리고 만들었네. 이런 상술마케팅에 누가 걸려 ㅋㅋ  
20170414,1,별점조작 벌써 시작됐네 더도말고 7점대까지 가자  
20170414,10,스틸컷 강아지가 너무 졸귀탱이여서 넘 기대됩니당 하핳  
20170414,10,기대됩니당. 좋은 배우들로 망작만 제발 만들지 말아주세요.  
20170413,10,딱봐도 더민주까는 영화인데  
20170413,10,시기를 겁나 잘잡은 영화인듯 ㅋㅋ 이거 보고 투표의 중요성을 깯닫은뒤 서거 투표 모두 합시다  
20170413,10,최민식 형님 프사가 너무 무서워요...  
20170413,1,"더킹 아수라 마스터 등을 보면서 느낀게 있죠.. 영화는 배우가 아닌 감독을 보고 봐라, 시류에 편승한 영화는 보지마라 등등..  망작필이 납니다..  "
20170412,10,최민식가장 사랑♥♥♥♥  
20170412,10,팩트 이거 원라인 보다 더 재밌음  
20170411,10,최민식 또 한번의 인생연기탄생각인가  
20170411,9,최민식이면 보기전에 이미 9점이다.이건 대한민국 최고의 영화배우에대한 예의다  
20170410,7,가디언즈 오브 갤럭시 vs 최민식 2차전.  
20170409,10,명배우 최민식님 출연하신다면 일단 믿고 봅니다~!!  
20170409,10,이기홍보기 위해 볼 영화~~~~후하후하  
20170409,8,기대는 되는데 저번 명량 때 처럼 한국영화가 상영관 독점해서 가오갤 같은 역대급 영화가 묻히는일이 없었으면  
20170409,10,...민식이냐?...  
20170408,10,심은경양  올인 하는 1인 인지라 무조건  봅니다  
20170407,10,완전  보고 시펑  명량 최민식과  곡성 과도원 와   캐스팅은  100점!!    꼭  흥해라!!  
20170407,4,식상하다 우후죽순 쏟아져나오는 정치고뱔영화 ㆍ  
20170407,10,얼마나 현실 상황을 반영할지 초관심  
20170406,10,정말 기대되는 영화에요~!  
20170406,10,완존 기대중이에요!!!  
20170406,8,배역이랑 캐스팅 자체가 장난 아님 기대감도 크고 근데 감독의 연출이 제일 걱정이고 심은진이랑 이기홍 한국어 연기가 조금 걱정됨.  
20170406,1,최민식 배우님 빼고는..라인업이 글쎄...  
20170405,10,이건 무조건 바야할것같네요 정치영화라지만 이거는 기존의 영화들과는 전혀 다른 색일듯  
20170405,10,믿고 보는 최민식 c]:3 )  
20170404,5,여배우들 특히 라미란배우님 류혜영 배우님 팬인데 예고에선 별로 안나와서 아쉽네요. 특히 라미란배우님은 극중 변종구 후보에 대적하는 인물인데도 예고에서 볼 수 없나요?? 7인 캐릭터 영상에선 봤지만..ㅠ 그럼에도 불구하고 영화는 기대하고 있습니다.  
20170403,10,믿고 보는 최민식에 연기파 배우들의 대거 등장 기대됩니다!  
20170402,10,서울시민 900만명대 입니다만.  
20170402,6,대선전이다.꼭 한번 봐보자...  
20170402,5, 지겹다 지겨워??빤한소재  정치색포함?진짜 외국보기 안부끄러운가 ㅎㅎ 예전엔 가끔씩 국제영화시상식서도불러주더만? 하긴  요즘같이 소재뻔하고 기대안되는 한국영화판 역사상있었나? 그들만의천만= 오씨엔 반년컷ㅎ  
20170331,10,기홍리 많이나왔으면 좋겠다  
20170330,6,류혜영이 누구데?...  
20170330,10,최민식 곽도원 라미란 아니 거기에 심은경 류혜영 이기홍 문소리 아니 다데려다놓고 이거 노잼이면 진짜 감독님 이길이 맞는길인지 진지하게 고민하셔야할듯.. 아 일단 기대하고 기다려봅니다..  
20170330,10,최민식.아저씨~최애배우.연기력은 뭐 말 할 필요 없다ㅠ.ㅠ최고최고  
20170329,10,보통사람 봤으니깐 특별시민도 봐야겠군..  
20170329,8,배우진은 좋아서 연기는 당연히 잘하겠지만 최근에 비슷한장르가 대부분 죽쓰는거 보면 크게 기대는안됨..ㅎ  
20170328,10,배우만으로도 신뢰가 가는 영화.  
20170328,4,"개봉전 기대 점수가 뭔 10점이 이리 많누. 출연진 라인업으로 점수 후하게 준다 치더라도 주제가 너무 식상하다. 개봉 후 스토리라인과 연출이 좋다면 8점까지는 줄 수 있겠지만, 이런류는 너무 많이 봐서 날고 기어도 그 이상은 절대 안될듯.  "
20170328,5,제발 비슷 비슷한 영화 좀 안했으면;; 곽도원은 지겹다. 연기폭이 좁아  
20170328,1,왠지 종일 뭔가있는척무게잡다가 개뿔도 없을영화같다.  
20170328,1,댓글아바 모은 작품성없는 영화 또 하나 나왔네 ..에휴  
20170327,10,도원 과 민식횽이 뭉첬다  닥치고 보면된다.  말만쿠 OO 하는 놈은 지는 백수에  나이 처먹구 지베서 놀구  빛만 있는 놈이다^^  
20170327,8,우리나라  배우가 몇명 없나 맨날 보던 얼굴들 뿐이구나  
20170327,10,오메~~!! 이기홍???ㅋㅋㅋ라인업도 쎈데 ㅋㅋㅋㅋ 오 기대된다 ㅋㅋ  
20170327,10,최민식 나온다 아무말말고 10점 박자  
20170327,10,나 특별시민  출연 해서요.  ㅋㅋ  
20170327,10,신자유당 으로 게임끝.  
20170327,10,최민식이 묻는 정치라는 미니시리즈.  
20170327,10,딱   대선 전에 나올만한 영화... 대한국민을 일깨워 줄만한 영화이기를 기대합니다.  
20170326,10,대박.. 출연진 역대급이다...  
20170326,2,"지겹다..한국영화는 맨날천날 범죄, 스릴러, 살인, 추적, 검사, 경찰, 정치물 밖에 없나? 장르가 거기서 거기..  "
20170325,10,대박날듯 배우만 봐도 . 상반기 최고의 영화가 되지 않을까 기대기대  
20170324,10,밉보배 최민식 곽도원!기대되네요  
20170323,10,"완전 기대하고 있습니다. 최민식님, 곽도원님에 심은경님, 문소리님 라미란님 까지 연기력 완전 장착한 분들에 조연에 진선규님까지기대 너무너무 짱 하고 있습니다. 꼭 개봉 첫날 고고~~~  "
20170323,5,이번 감독님은 조작된 도시 처럼 평점 조작하지마시길 양심적으로 승부하세요 감독님 조직된 도시는 제작비도 좀들고 개봉취소 설도 많아서 간신히 개봉한걸로 알고 투자자들 돈 때문인지 몰라도 평점 조작때문에 돈너무뜯어감  
20170323,5,또 정치권이야기네.지겹기도 하고  시대가 이러니 이해가 가기도 하지만 적당히 했으면...  
20170322,1,나라에 대통령이 없어지는 큰일이 생겼는데 흐름타서 지들 주머니채울려는 이딴영화안본다  
20170322,10,영화 못봤는데..출연배우보니..적어도 백만이겠더라...  
20170322,10,음..이거 죽이네 캬..ㅎㅎㅎ  
20170322,10,개봉일 확정!! 소문난잔치에 먹을것 많길  
20170320,10,개봉날짜 잡자. 기대합니다.  
20170319,10,대선전에 개봉이라 타이밍이 좋네요!기대되는영화입니다~  
20170319,10,최민식 곽도원에 문소리래...뭐 말이 더 필요함???최소 700만 봅니다  
20170318,10,이기홍 기대합니다!!  
20170317,10,아 완전 기대됩니다!! 꼭 보러갈께요?  
20170316,10,진주는 꼭 떵물에서 건져야 하나?  ㅇㅇ  
20170316,10,쇼라고 하는거보니까 정치쇼 관련된 그 시장님이 모티브인가보네요!!  
20170315,10,세상에 이기홍...!! 한국말로 연기하는거 듣고싶네요♥ 믿고보는곽블리도♥  
20170315,10,영화 기대되고 꼭 보겟습니다♡  
20170315,10,"와 캐스팅 너무 좋다. .최민식씨,곽도원씨. . . 류혜영. .라미란. . 이기홍씨도 나오네. . 신기방기  "
20170314,10,박모 원숭이가 하는 행동이랑 똑같네요.  
20170314,10,최민식 담배피는장면 많이나왔으면좋겠다  
20170309,10,특별시민 재미있겠네요 ㅎ   최민식행님 나오네요 ㅎ  기대해야되겠군요 ㅎㅎ  
20170309,10,메이즈러너에서 이기홍이란 배우분을 처음봤는뎅...^^ 너무 기대 되네요~ 20OOO에 메이즈러너에서도 만나용~  
20170308,10,최민식형님이면 당연히 믿고봐야죠ㅎㅎ  
20170308,5,최민식씨 곽도원씨 문소리씨나머지는영...기대가안되네요...세분이 기껏잡은 분위기 중간중간 자주깨져버릴것 같아서 안봐야징  
20170305,10,오우... 배우들 보게.... 역대급캐스팅이네..  
20170304,9,명량에 힘입어 이번에도 잘되었으면 좋겠습니다.  
20170304,10,출연진이 ㅎㄷㄷ. 민식형님. 대호의 기억은 잊고 3선 해보입시더  
20170303,1,출연진 라인업은 좋은데 감독 필모그래피가 너무 약해서 약간 불안  
20170302,10,안 볼 수 없는 영화... 4월이 기다려지네요  
20170302,1,기대 된다 곽도원과 최민식 하지만 이것보다 더한 대한민국이기에 식상하다..  
20170302,10,기대됩니다^^ 꼭 극장에서 볼게요 최민식!  
20170302,1,"최민식 곽도원 심은경 문소리.,배우가 좋고 소재가좋아도 결국은 감독이 잘해야함ㅠ  "
20170302,10,최근들어   현 시국을  감안한  비슷한  소재의  영화가  많았지만    최고의 연기파  위주의  라인업은  전혀  식상하지  않고  오히려   더  신선하다.  
20170302,10,영화에서 새자유당이라고 빨간로고로 나오는데 이건 새누리당을 뜻하나보네 ㅋ 개누리당이 해온 쓰레기짓을 본격적으로 영화화하여 알리는거지 무조건 흥행각이다 ㅋ  
20170302,8,요즘 정치판 영화가 너무 많다  
20170302,10,"믿고보는 최민식, 게다가 문소리, 라미란, 이기홍까지! 기대됩니다~~~  "
20170302,10,어째 영화 먼저 찍었을텐데.. 당명에 선견지명이 있으시네...  
20170301,10,이기홍 ㅠㅠㅠㅠ얼른개봉되라 ㅠㅠ기홍이 ♡♡  
20170301,10,심은경 나오는건 다 본다! 넘 좋아하는 배우  
20170228,7,재밌을것이 분명하지만 이 나라를 더욱 싫어지게 만들것 같아 보고싶지 않은 영화  
20170228,10,배우조합 최강라인 입니다~!! 완전 기대되요!!  
20170228,10,요즘진짜볼거없엇는데 드디어♡기대된다  
20170228,10,주연배우만으로 이미 평점 10을 누르게 하는 영화네요  . .  큰기대만큼 좋은 작품이길 바랍니다!  
20170221,10,하진짜이기홍ㅠㅠㅠ넘기대됩니당  
20170217,10,최민식 배우님 멋있는 연기 보여주세요 기대함 ㅎㅎ  
20170206,10,"기대하는 영화입니다만, 이기홍씨는 왜 언급됨?  저로선 전혀 듣도 보도 못한...  "
20170202,10,I say 이 you say 기홍 이!기홍!!이!!기홍!!!!  
20170202,10,개인적으로 라미란님 류혜영님 곽도원님 제일 기대됩니닷 치타여사님과 성보라 조합이라닛 거기다 곽도원까지♡  
20170128,1,일단 배우들은 짱인데.... 감독이...영....  
20170127,10,류혜영 많이 기대됩니다.~~~^^  
20170124,10,이기홍 한국영화라니ㅠㅠㅠ빨리 보고싶어요  
20170106,10,최민식과 이기홍을 비롯해 다 연기하면 최고봉인 배우들인데 무척이나 기대됩니다  
20170101,10,응팔을 보지는 않았지만 알던 류혜영님 그리고 최근들어 부쩍 더 좋아진 이기홍 ㅠㅠㅠㅠ 아 진짜 기대 많이해요! 무슨 내용인지는 잘 모르겠지만 꼭 보고싶은 영화에요!  
20161217,10,"기대할게요! 믿고보는 곽도원,최민식  "
20161217,10,이기홍 나온다♡♡♡♡  
20161129,10,심은경씨 남자영화여서 비중은 크지않겠지만 기대합니다  
20161119,10,믿고보는 배우 류혜영!!  
20161107,10,"믿고보는 곽도원 , 최민식 ♡  "
20161105,10,헐? 기홍? 볼끄양 재밌을것 같음  기대되내요!  
20161103,10,매번 좋은연기 보여주시는 최민식님 이번 작품도 너무 기대됩니다ㅎㅎ  
20161030,10,이기홍!!!!>0<  
20161022,10,"심은경, 이번엔 어떤 역을 보여줄 지 기대가 됩니다  "
20161001,10,곽도원 기대합니다~ 연기 신!  
20160923,10,믿고보는 류혜영배우♥  
20160918,10,나는 여기에 평점을 남기고 내년 개봉날에 이 글을 보며 또 한번 시간의 지배를 또 한번 감탄할 것이다.  
20160917,10,류혜영 이기홍!!!! 우와  
20160904,10,이기홍이 드라마라니..! 그리고 라인업도 죽이네요!! 기대하겠습니다.  
20160829,10,메이즈러너 이기홍이...? 헐리웃배우아녀? 기대되네  
20160828,10,드디어 한국영화에 이기홍이라니....기대많이합니다!!!♡  
20160828,10,출연진 완전 빵빵하네요 기대됩니다!!!  
20160822,10,곽도원 조음... 재밋겟당  
20160819,7,"최민식이라 기대했는데, 라미란이 걸리네.. 신파극일까봐 겁난다  "
20160815,10,이기홍님 정말 기대대네요 와 한국어 영기라니 와  
20160808,10,헐리웃스타 '이기홍' 이 나온다니 굿이다.  
20160806,5,먼가..선동냄새가나는데..  
20160803,5,좌빨영화가 아니길 빕니다.  
20160729,3,망작시나리오에 인기배우라니ㅜㅜ  
20160727,10,믿을수있는 최민식..ㅠㅠ진짜너무좋아.빨리보고싶당  
20160724,10,기홍아왠일이야ㅠㅠㅠㅠ  
20160718,10,오대수 최민식 님과 종구 곽도원 님 ㅋㅋ 기대됩니다  
20160717,10,이기홍님! 그동안 바래왔던 처음찍는 한국영화 기대 많이 할게요!  
20160713,10,배우이기홍이나오는 영화라니..정말보고싶네요!!  
20160708,10,명대사에 리지스트~저항하다. 이거보고 일하다가 현웃터졌다 ㅋㅋㅋ  
20160706,10,정치색 있나보구만ㅉㅉ 최민식 데리고 정치색 띄는 영화 찍으려고 하니까 미뤄지지  
20160705,10,오ㅎㅎㅎ연기파 배우들도 많이 나오고 영화 메이즈러너 민호 역할 이기홍도 나오다니!완전 기대되는 영화>3<  
20160704,10,"오늘 장맛비 맞으시면서  서울 모처에서 촬영하는거 봤습니다.  기대가 많이 되네요~ 스태프, 배우 모두 화이팅 하세요>_<  "
20160704,10,흐ㅡㅡ흐허ㅓ헝 키허어ㅓ허ㅓ어ㅓ엉 ㅠㅠ 꼭 보러가겠습니다.  
20160702,10,제가 좋아하는 기홍오빠때문에 완전대박 기대하는작품이예요 ㅎㅎㅎ 지금 한국오셔서 촬영중인거같은데 좋은결과있길바래요!  
20160630,10,최민식님에 곽도원님에 게다가 한국영화 나오는 이기홍이라니!!!! 기대만발입니다 ㅎㅎㅎ  
20160630,10,연기파배우들만모였네 ㅋㅋ  
20160629,10,우리 기홍이!!민호!!거친민호!!  
20160624,10,이기홍이 나온다! 기홍이가  
20160624,10,와 이기홍 배우라니 정말 기대되네요^^  
20160623,10,기홍♡♡ 기대하고 있어요♡♡  
20160621,10,이기홍형님 한국말하는거 볼수있는거?  
20160619,10,이기홍!! 기홍이!  기홍느님 나온다ㅏㅏ!  
20160616,10,기대는 정말 많아 되는데 소름 돋는 건 심은경이랑 이기홍만 빼면 다 씨제스 소속이네 항상 씨제스는 한 드라마 영화 안에 소속 배우들이 못해도 2-3명씩은 있네 그래도 믿고 볼 수 있을 듯....배우는 이름만은 최고  
20160616,10,"저는 최민식, 곽도원, 심은경, 류혜영 보다 이기홍이 더 기대 됩니다. 한국어로 연기하겠죠?ㅋㅋㅋ  "
20160612,10,최민식 너무 좋아요 사랑합니다...  
20160611,1,스토리부터 망필‥ㅜㅜㅜ되겠냐?  
20160609,10,헐리웃 영화배우 기홍을 모르시나?아무튼 기홍 너무 기대중!!  
20160609,10,최민식 곽도원 심은경 거기다 문소리까지! 환상캐스팅 대박이다  
20160605,10,일단 배우라인업이 좋아보인다 크크  
20160604,10,명실상부 자타공인 대한민국 최고 배우 최민식님!! 기대하고 있을게요~  
20160603,10,혜영 누나 주연이네...보러가야것돠  
20160529,1,뭔 내용이다냐????  
20160523,9,캐스팅 굿인데 촬영한다고 길통제하는거 극혐...  
20160521,10,진짜 캐스팅 장난아니네요  
20160502,10,최민식이나오는영화는정말믿고보는영화.볼때마다기대하고보는데볼때마다기대를져버리지않는다 연기너무잘하셔요ㅜㅜ정말  
20160418,10,이기홍 기대됩니다..  
20160418,10,기홍씨 기대하고 있어요♥♥♥♥  
20160416,10,류혜영 언니의 활약이 기대됩니다♡믿고보는 배우 류혜영언니! 극장에서 만나요 ~^^  
20160414,10,류혜영이라는 배우 기대하고 보려구요♡ 해어화 작은 비중을 차지했지만 귀엽게 잘 봤습니다ㅎ  
20160402,10,류해영 화이팅!!! 정말 너무너무 기대됩니다!!  
20160402,10,다른배우분들도 훌륭하지만 류혜영배우분 기대됩니다!!  
20160402,10,류혜영배우 기대되요~♡  
20160401,10,영화 재미있을 것 같고 류혜영 배우 연기가 많이 기대되네요.  
20160401,10,류혜영 배우의 또다른 모습과 연기 기대되요!+  
20160401,10,배우라인 짱짱하다.. 류배우 화이팅! 대박기원!  
20160401,10,최민식씨 부터 배우 라인업이.. 기대가 안될수가 없네요..믿고 기다립니다  
20160401,10,류혜영이라서 본다!!!!  
20160401,10,류혜영 배우님이 나온다니 기대가됩니다.  
20160331,10,제가 좋아하는 배우들이 많이 나와 기대되는 영화에요 ! 그 중에서 류혜영 배우의 연기는 정말 기대되네요  
20160331,10,서울시장에 도전한다는 줄거리가 뭔가 특이하고 류혜영 배우가 나온다해서 개봉전이지만 기대되네요ㅋㅋ!!! 영화 대박나길바래여  
20160331,10,류배우 응원합니다!!  
20160330,10,아 여기 혜영누나가 나오는 영화군여.와 라인업ㅋㅋ ㅎ 혜영 누나 화이팅 ㅎ  
20160328,10,류혜영 나온다길래 기대함!!  
20160328,10,류혜영 화이팅!!!!  
20160328,10,류혜영 배우님 기대됩니다!!  
20160328,10,류배우님 너무 기대되네요~  
20160328,10,류혜영 배우 연기 너무 기대됩니다!  
20160328,10,배우 류혜영님의 연기 기대됩니다~!!  
20160328,10,류혜영완전기대하고있어요!  
20160328,10,라인업이 ㅎㄷㄷ하네요.. 특히 류혜영 배우님 정말 기대합니다!!  
20160328,10,류배우 작품 기대돼요~! 얼른 개봉하길 기다릴게요♡  
20160328,10,류배우님 연기 기대하고 있솜다~~  
20160328,10,류혜영배우 기대 많이 하고있어요~♥  
20160328,10,"소재도 관심있고, 류혜영 배우 기대가 커서 영화 꼭 보려고 해요. 응원합니다. ^^  "
20160328,10,류혜영씨의 연기가 정말 기대돼요 ♡ 꼭 보러 갈겁니다.  
20160311,10,줄거리읽어보고  완전  끌림 ! 어떤그림이 그려질지  기대된다  
20160304,10,배우들의 연기 뿐만 아니라 감독의 연출도 기대되는 작품!  
20160302,1,배우가 싹다 씨제스  이게 말이되는거임?  
20160224,10,벌써재밌다 나만그런가?  
20160223,10,류혜영 배우님 연기 기대하겠습니다  
20160223,10,이건 일단 10점ㅋㅋㅋ 류혜영 배우 보고 들어왔는데 배우진이 믿고보는 배우들밖에 없네ㅋㅋㅋ 대박이다 진짜  
20160221,10,'특별시민' 내용도 캐스팅도 정말 좋네요~ 나이가 어린데도 불구하고 응팔에서 훌륭한 연기 보여줬던 류혜영 나오니까 더 기대되네요^^ 꼭 봐야지 류혜영 나오니까:D  
20160213,10,혜영언니가 나온다니! 기대되네요^^  
20160213,10,얼른  보고싶어요 기대중  
20160213,10,"믿고 보는 연기파 배우 최민식, 곽도원, 심은경 라인업에 떠오르는 신예 류혜영까지 확정이라니 이것 참 기대가 큽니다. 이 네명의 배우들이 특별시민에선 어떤 얼굴을 연기할지 설렌다.  "
20160213,10,"한동안 응답하라, 성보라에 푹 빠져 살았는데 류혜영 배우님 차기작 특별시민도 너무나 기대가 됩니다. 최민식, 곽도원, 심은경 배우분들과 멋진 시너지 효과를 기대하면서 평점 드리고 갑니다. 특별시민 화이팅!  "
20160213,10,최민식님 한명만으로도 충분히 가치가 있을 영화인데 나머지 배우진도 너무 맘에 들어요 곽도원 류혜영 심은경 전부 호감이고 연기도 잘해서 대박 기대중이에요  
20160212,1,우리나라는 맨날 이딴영화만 나오노  
20160212,10,류혜영배우님이 출연결정하셨다니 더더욱 기대됩니다!  
20160212,8,첨 보는 감독인데 엄청 밀어주네?ㅋㅋ  
20160212,10,최민식님에다가 곽도원님 그리고 심은경님 그리고 응팔에 류혜영님까지 .. 진짜 믿고 보는 영화라는게 이거 아니겠습니까 4월달부터 촬영들어간다고 들었는데 기대하겠습니다 좋은영화 만들어주세요 . 기대하겠습니다 ㅎㅎ  
20160212,10,"응답하라에서 인상깊은 연기 보여준 류혜영배우, 특별시민에서도 기대하겠습니다:)  "
20160212,10,대통령 부정선거도 영화로 꼭 만들어졌으면 합니다.  
20160212,1,"글쎄...,,,..  "
20160212,1,심은경은 왜 나옴? 노이해네  
20160210,10,특별시민 1주만에 2000만가다! 2017  
20160206,10,최민식에 곽도연 ㄷㄷ 배우만봐도  
20160204,10,와..최민식. 심은경...개대합니다.  
20160204,10,줄거리와 주연들에 미리 10점을 드립니다!  
20160131,10,최민식이 나오는 정치영화!너무 기대되네요  
20160131,10,조합만으로 대박일거라는 예감이 ! ㅎㅎ  
20160130,10,대호영화 못봤지만 최민식 차기작 특별시민 기대됩니다  
20160127,10,최민식 배우님 연기 기대하겠습니다!  
20160123,10,정치뒷면을 리얼하게 보는 영화 정말 기대됩니다 최고의 배우 최고의 감독 화이팅!  
20160122,10,심은경씨의 영화는 믿고 봅니다. 최고의 연기파 배우들이 나오셔서 완성도 높은 영화일거라 생각되네요.  
20160122,10,최민시 곽도원 거기다 심은경.기대 만땅해도 후회 안할 영화 되겠네.  
20160116,10,와 이번작품도 설레이는 마음에 기다리겠습니다 ^^^  
20160113,10,오랜만의 최민식 형님 현대물.  
20160109,10,범죄와의 전쟁2 각이다.  
20160108,10,아 개재밌겠다 ㅋㅋㅋ 최익현 캐릭터로 연기했으면 좋겠다 ㅋㅋ  
20160107,10,최민식이 기대되는 이유를 생각해보면 연기를 잘하는것도있지민 생각하는 연기자라 참좋습니다 기대합니다  
20160107,10,특별시민 1주만에 2000만가다! 2017  
20160107,10,최민식 곽도원이 나오는데 안 보면 간첩  
20160107,10,믿고보는 최민식. 기대합니다  
