0,1,2
20170218,1,"온갖 대의 명분 한줄허세를 들이밀어도 그냥 게이영화는 게이영화일뿐. 우리는 평론가가 극찬하는 예술적 재미와 원초적인 본능적 재미를 구분 지을 필요가 있다. 이 영화는 허세떠는 사람들이 좋아하는 영화일진 몰라도, 대다수 사람들에겐 재미없는 영화이다.  "
20170218,10,3명이 연기한 1명의 삶 속에서 나를 찾다..  
20170218,9,우리 모두는 현재의 나이자 과거의 나였다.  
20170218,10,흑인이라는 이유로 남들과 다르다는 인식을 갖게 되는 주인공. 왜 우리는 색안경을 끼고 사람을 보는가  
20170217,10,마지막 블랙이 swag가 너무 멋있더라 ㅠㅠㅠ 외면은 강해졌어도 여린 눈빛은 소년의 모습 그대로였다.  
20170217,10,강렬한 영화. 기대해도 좋을듯  
20170217,10,인생에 대해 다시한번 생각해 볼 수 있었던 영화..  
20170217,9,자넬 모네???나오미해리스 007 머니페니네ㅎㅎ  
20170217,10,기대하고 있는 영화에요 반응이 엄청 나더라구요  
20170217,3,확실히 호불호 갈리는 영화임.... 아카데미 작품상 후보라 봤는데 음 이게 왜..? 이런 생각이 들수도있음  
20170217,10,결론 해석하려고 애쓰지 마세요. 평범하다면 평범하고 특별하다면 특별한 한 소년의 성장기입니다. 물 흐르 듯 자연스럽게 보세요. 이렇게 극찬을 받는 영화들은 다 이유가 있습니다. 믿고 보세요  
20170217,1,흑인의 평범한 삶인데 단지 흑인이 똥꼬충이라고 평점높은거냐?  
20170217,5,진짜 재미없고 하품나옴.그나마 볼 만한게 배우들 연기정도인데 원래 게이영화는 평점이 높아서 이상함.게이들이 평점 조작하는듯 싶다.  
20170217,10,난해하다 난해해 후..  
20170217,10,최근에 본 영화장 가장 수작  
20170217,10,이 영화.. 엄청날 것 같다  
20170217,8,"흑인, 빈민가, 또 다른 하나. 스스로 택하지 않았지만 마이너한 삶을 부여받은 파란 아이 하나가 BLACK으로 편입되는 모습을 인상적으로 그려냈다. 그리고 그 BALCK 안에서 BLUE로 명멸하는 모습을 아주 섬세하게 표현한 수작.  "
20170217,8,아름답다! 101010  
20170217,10,미친 영화.. 구구절절한 설명 없이 마음에 훅 들어온다  
20170217,6,처음엔..몰입이 잘된다.. 기대를 많이해서..후반엔...지루했다  하지만 나쁜영화는 아닌거같다  너무 기대를하지말것!!  
20170217,10,희곡원작자어머니가 실제 빈민촌 마약중독에 에이즈로 죽고난뒤의충격으로 쓴 보고나면 영혼을 후벼파는 영화.카메라로 쓴 흔치'않은 아픈사랑에관한 시.  
20170217,4,이해불과 전형적인 미국 블랙 스토리....  
20170217,10,먹먹하네....시리도록 푸른 인생이...  
20170217,8,재밌다가 마지막에 너무 허무하게 엥?하고 끝난 느낌.... 아니 그리고 ㅋㅋ 동성애 싫다는 애들이 이 영화는 왜 본거임? ㅋㅋ 싫은데 관심은 있나봄??  
20170217,6,그냥 나쁘지는 않은데 게이 영화는 싫다  
20170217,7,Moonlight...  
20170216,8,사실 영화보는 동안에는 좀 지루한감이 있고 기대보다 별로다 생각했는데 이상하게 영화를 보고 나서 계속 생각이 나네요. 한번쯤 봐도 좋을 영화인 것 같습니다. 개인적으로 보이후드보다 재밌게 봤습니다.  
20170216,4,동성애+흑인+성장 영화 = 억지스럽지 않은 연기와 메시지. 근데 왜 이 영화가 역대급이라는 거야? 문화적 차이를 생각하고 봐도 동의가 안 됨  
20170216,9,빠르지 않지만 담백한 영화 좋아하면 만족할만한 영화임.어느정도 좋은 평가 받는것도 이해도 가고리처드 싱글레이터 보이후드 재미있게 봤으면 문라이트도 분명 재미있게 보실거임.ㅋ  
20170216,8,한 소년의 응어리진 성장기 영화로 모기 드문 흑인 수작 영화다. 물론 잘 만들어진 작품이나 대중성을 다소 떨어지고 극의 흐름이 너무 평탄해서 흥행은 어려울 것 같다.  
20170216,4,음..시간낭비라는 생각이 들었음 볼 때 되게 머리아팠음  
20170216,1,영화의 주제와 영화가 말하는 내용이 정 반대인 영화입니다.스토리나 핵심내용 그런건 없고 여러가지 감정만 표현하는 영화라서 그런지 재미는 더럽게 없습니다 영화의 마무리도 영 허접하구요 제목이 문라이트인 이유조차 알기 힘든 3류 감성영화 라는 생각듭니다  
20170216,1,"게이물?;;..;,,  "
20170216,1,진짜 소문난 영화에 이런 평점 안주고 싶다만..정말 이게 왜 소문 난거냐??절대 혹해서 볼만한 영화(?  아니 드라마??)...그 무엇도 아니다..시간아깝다..정말 비판하고 싶지 않았었다 ..  ㅠㅠ  
20170216,1,속지마세요...걍 삶의 의미를 얘길하는 동성애 영환데.. 와닿는 것도 없음  
20170216,9,아카데미 4관왕 예상한다 오스카 쓸어버릴 만 했음  
20170216,10,내 생애 최고의 영화다. 꼭 보시길...  
20170216,8,"각양각색의 그들도 달빛 아래선 모두가 파랗다, 뭐 하나 다를 것 없는,  "
20170216,6,결국은 나와다른 성 정체성 이야기 그들을 이해못하는 것은 아니지만 알았더라면 안봤을 영화  
20170216,6,별 재미는 없는데 사람들의 생각을 주제로 다뤄서 공감도 많이가고 몰입감은 있네요 OST는 역대급이 아닌가 생각해봅니다  
20170216,7,갠적으론 감명깊게봄팩트만 적겠음스토리를 극에달하게하는요소 없음.잔잔하고 먹먹한감성으로 진행.흑인. 마약거리. 동성애세가지가 주제. 한국인 관점과 안맞음긴 대사X 의미있고 짦은 한마디와 배우들연기로 카바쳐짐.총평 : 좋은영화. 역대급은아님  
20170216,8,"비정상적 성장과 꽉막힌 환경에서 폭력을 정당화 할수밖에 없는 현실, 그리고 스스로 위로받기위한 선택. 위로받고싶지만 위로받지 못한 주인공 삶을 3부작 성장기로 냉정하고차분하게 이끌어간다. 레스토랑에서 주인공 감성을 다룬 평범한 촬영 시선은 예술이다  "
20170216,1,동성애영화... 왜 이렇게 재미없는 영화를 139개 수상을 했을까? 미국에서 일고있는 동성애 합헌 때문이다..미쳐가는 미국 ..아니 이미 미쳐버린 미국.. 개 쓰레기 영화를 뛰우느라 온갖 상을 휩쓸고 동성애 합헌당위성을 위한 개 쓰레기 영화  
20170216,8,극찬 일색이지만 영화의 감성을 이해하기엔 내겐 너무 어려운 영화. 무언가 끊어오르고 있는 건 알겠는데 그게 무엇인지 모르겠다. 아마 머리좋은 사람 일부를 제외하고 일반 대중이라면 나처럼 고개를 갸우뚱 하지 않을까. '이게 오스카를 휩쓸었다고?'  
20170215,8,인생이란 ... 영화란 ...  
20170215,9,외롭고 쓸쓸한 시절...그리고 그속에 남아 있던 친구..기대  
20170215,1,"불우,소외된듯한 동성애자 흑인남성의 소년,청소년,성인기를 영화화함. 노잼,노감동. 일단 한국인의감성에 맞지않음.영상미? 전체영상에 looks이펙트나 색감조절로 영상미를 논함? 대부분의 평점은 알바같아요  "
20170215,10,"IMDB 메타크리틱 스코어 총합 99점의 레전드급 작품을 드디어 상영하다니, 꼭 보러 가야겠군요.  "
20170215,10,인생영화각일듯...  
20170215,8,연극대본이 아닌 시를 원작으로 한 것 같은 영화. In Moonlight Black Boys Look Blue  
20170215,9,단순히 퀴어코드라고 저평가하는 이유를 모르겠네요 본인 스스로 소수자를 욕하면서 소수자가 되려하는 소위 말해 자기 무덤을 자기가 판다고 하죠 ㅋㅋ 전 세계 영화제 휩쓴 것에는 다 이유가 있는겁니다  
20170215,1,그냥 더러운 게이 영화    아 괜히 봤어  
20170215,1,시사회 당첨되서 보고 왔는데요 저는 도대체 이게 뭔내용인지도 모르겠고...재미 당연히 없고...감동 없고.... 다른사람들도 영화관에서 한숨쉬는것 같던데요  
20170214,5,기승전'동성애'에 놀라버린..  
20170214,8,햇빛 아래선 어두웠지만 달빛 아래선 파랗게 빛난다...  
20170214,10,"문라이트  꿀잼각이다. !!!!  포스터 자세히 보니 극 중 주인공  흑인 아이의 유년기,청소년기,성인기과정인 것 같네요 ~~ !! 아닌가 ?아 빨리 보고 싶다ㅏ ㅠㅠ 노예 12년과는 또 다른 느낌일 것 같아요 ㅎㅎ  "
20170213,8,내가 본 최초의 경찰없는 흑인영화.. 'About Black'  
20170213,10,시  @발 진짜 맨체스터바이더씨랑 이게 젤 보고싶은데상영을 안해....진짜 개빡치네  
20170213,10,역시 남다르다. 역대급 최고 영화. 너무 감동 받았어요  
20170213,8,이제 우린 어른이야! 나 자신으로 살아야해!!!  
20170212,10,상영관수 제발 아..ㅜㅜㅜ 제발 보고싶어  
20170212,10,문재인이 대세라는 것을 증명하는 영화  
20170210,10,역대급이란 소리 듣고 왔습니다.  
20170210,10,영화 정말 궁금하다!! 극장가서 빨리 확인하고 싶은 마음뿐~  
20170209,10,이게 데뷔한 지 10년도 안 된 감독의 작품이라니... 빨리 보고싶네요  
20170204,10,곧 보러 극장가요:) 기대되요  
20170203,10,농부 후안은 바리스타입니다  
20170203,10,어린아이의 리틀부터..이 영화 꼭 보시길 바랍니다. 마지막에 왈칵하고 올라오는 여운..보이후드랑 비슷한듯 보이지만 그 이상의 것이 있습니다.  
20170203,10,로튼 로마토 지수 무려 98!! 기대됩니다  
20170203,10,2분짜리 예고 보고 줄거리봤는데 퀴어영화인가보네요..? 얼마나 잘만들었길래 극찬인지 기대돼요  
20170130,10,이 영화... 미국에서 2016영화 top10에서 1등 먹었네요.  
20170128,10,개봉일 손꼽아 기다리는중  
20170124,9,담백하다. 안쓰럽다. 떨린다.  
20170124,10,대작스멜이난다1010  
20170123,10,빨리좀 개봉하지 얼마나 대박이길래ㄷㄷ  
20170112,9,대체 언제 개봉하나요 대체 언제!!!! 언제!!!!  
20170112,10,얼마나 역대급이면 상을 휩쓸고 다니는가  
20170110,10,골든글러브는 받았고 오스카 작품상도 이 작품?  
20170109,10,골든글로브 작품상 받은 영화진짜 기대합니다...!!  
20161206,10,빨리보고싶다ㅜㅠ 거 국내개봉이 언제요?  
20161128,10,자넬 모네는 가수 아닌가? 미구엘이랑 prime time 같이 부른 애로 아는뎅 기대 중  
20161127,10,리뷰 쩔던데 빨리 개봉 좀.  
20161120,7,아카데미까진 아니여요.  
20161119,9,와 진짜가 나타났다.. 진짜 보고싶다. 이영화 아카데미상 받는다에 내 이름을 걸겠어!  
20161109,10,황석희 번역가님이  이 영화 수입 됐다고 하십니다ㅎ  
20161020,10,미래에서 왔습니다. 89회 아카데미 시상식에서 작품상 수상했습니다.  
20160918,10,크 이번 tiff에서 공개된 작품 중 가장 기대하고 있는 것 중 하나에요ㅠㅠ 빠른 개봉.. 원합니다....ㅠㅠ  
20160917,10,12개 리뷰 나왔고 90점대 극후반.... 나오면 무조건 봅니다.  
20160905,10,메타크리틱 100점(7개 리뷰) - 2016/09/05 기준  
20160904,10,역대급 영화란 소문이 있던데..  
