0,1,2
20170403,8,"긴장감은 가히 최고.., 되게 무서웠음, 다만 등장인물들이 하나둘씩 갈때 산파씬이 좀 암걸리는부분  "
20170403,3,더이상 믿고보기는 힘든 세상이다.  
20170403,8,무서운건 매 한가지지지만 흉물스럽기만하던 기존의 외계인과는 다릅니다. SF라기보단 스릴러나 호러라고 해야겠네요. 관객들을 끝까지 긴장시키는 힘이 있는 영화.  
20170403,8,"기대하고 봤는데,, 좀 절망적이네요,,,ㅠㅠ  "
20170403,1,후....내시간은 안돌려줘도 됨. 대신 안본눈 삽니다.  
20170403,1,알바들도 새로운 댓글좀 연구해라. 믿고보는 질렌할 이라네..  
20170403,8,존나  그냥 소재 외계인 보고  이런건 뻔하지~ 로 평점이 낮구나 ...  솔까 이런건 외계생물체가 어떻게 생겼나 그냥 감상하러 가는거 아닌갘ㅋㅋㅋ 영화 볼때 괴물 괜찮고 몰입감만 있으면 성공 한거다 . ㅇㅇ 전체적으로  다 흐름 비슷하니깐..  
20170403,9,역시 이거 죽이네 캬.ㅎㅎㅎ  
20170402,8,기존과 비슷한영화지만 늘 재미있는 영화  
20170402,4,감성적이었다 이성적이었다가.. 일관성 없는 주인공들의 행동이 이해가 안됐어요. 그리고 굳이 우주가 아니었더라도 되었을 법한 스토리.. 우주버전 미스트를 보는 듯 했어요. 참고로 미스트가 더 재밌음.  
20170402,1,난 보진 않았는데.. 대충 알거같다 이영화를 알고싶다면 우주생명체 블롭이라는 1988년 영화를 보면 될것이다 이영화는 별로 보고싶지도 않다 뻔하기 때문이다  
20170402,8,충격과 공포 혼돈 그자체임!!  
20170402,5,딱 b급 에일리언참고로 배드엔딩배드엔딩인거 예측하기 쉬움  
20170402,9,4월 1일 씨지비 OO고? 시사회로 봤는데 걍 너무 재밌따 우주 영화 별로 안좋아하는데 뻔하지 않고 스릴있고 .. 보는데 쫄려서 심장이 쿵 했다 그냥 보셈 두번 보셈 잔인한 장면 좀 나와서 무섭기도 했는데 짱잼  
20170402,5,평점 따라 관람해~~ 예고편 보고 왔는데 재밌을 것 같기도 하고 안 재밌을 것 같기도 해서 그냥 보러 갈지는 알아서 판단하길  
20170401,8,시사회로 오늘 보고 왔습니다. SF 좋아하는 분들은 꼭 보세요!! 에일리언 같은 느낌도 좀 나요. 존잼!  
20170401,7,시사회보고왔는데 완전 무서워요ㅋㅋ스릴짱뻔한결말이아니라 신선했어요  
20170401,10,cgv에서 만우절 시사회한거 보고왓어요무슨영화나올지 궁금했는데 라이프 라갤래 뭔지도 모르고 봣는데 대박이네요 너무 잔인하고 무섭웠고 엔딩때문에 여운이 길어요..시간가는줄 모르고  
20170401,6,하.. OOO로 방금봤는데 스토리는 뻔하지만 쪼는 맛은 일품이네요~ 만우절로 이런 영화를 ㅎㅎ 씨지비 아주 칭찬해^^  
20170401,1,OO 그냥 만원으로 동전쌓기놀이하셈 OO  
20170401,10,제목 자체가 만우절급임  
20170401,9,와ㅏ씨 씨지ㅂ이 미친거같음 이런영화를 만우절이벤트로 하면 어쩌자는 거임 와  웬만한영화는 보는데 쫄려서 죽을뻔했으뮤ㅠㅠ 진짜 ㅠㅠㅠ 긴장감쩌는데 잔인한거못보면 보지맙시다 ㅠㅠ 아ㅏ ㅠ 손떨려  
20170401,1,OO고로 개봉예정인거 오늘봤네요...보자마자쓰는 후긴데 진짜 정신없고 멍~한기분....돈주고보기 아까워요ㅜㅜ  
20170401,1,cgv 만우절이벤트로 봤습니다.긴 말 안할게요 여러분 보지마세요^^  
20170401,10,만우절이벤트  시사회 cgv에서 봄 진짜..절망이 뭔지 알려주는 영화 마지막이진짜 절망임  
20170401,8,베트남은 벌써 개봉해서 어제 봤어요.전체적인 분위기는 에이리언하고 비슷하지만 재미있네요레이놀즈가 빨리 죽네요 생각보다그리고 2편 나오겠던데요  
20170401,1,그냥 3류 에일리언 코스프레 영화. 배우도 3류. 오프닝에서 딱 티가 남. 헐리웃에서 잘 흥행안되는 영화 1+1끼워넣기 상품.  
20170401,9,재밌다 캐나다 몬트리올 다운타운 생카테린에 있는 스코티아 영화관에서 7시55분 2관에서 비타민 음료 블루베리맛  마시면서 봤다 해외라면 구라라곶하는 OO들을 위해자세히 썻다  
20170401,10,JAKE  is 뭔들....  
20170331,4,"예고편과 최근 돌고 있는 인터넷 기사를 종합해보면  화성판 ""에일리언""인것 같다. 요즘 소니가 계속 이어가고 있는 망작 릴레이~ 이영화 직전 망작은 바로 ""패신져스""였다 일명 착한 ""팬도럼""~ 소니는 창의력이 없는것 같다.  "
20170331,10,후... 다음오스카는 질렌할  
20170331,10,헐리웃에서 열린 일반 시사회에 갔었는데 전 재미있게 봤습니다. 비쥬얼 적으로 도 너무 멋지고.... 오리지널티는 좀 떨어질지 모르겠지만 오락물로 괜찮은듯....에일리언 팬이라면 5월에 개봉 힐 에일리언 커버넌트와 비교하시면서 봐도 좋을듯...  
20170330,1,"지금 유럽에 있어서 봤는데... 아... 캐스팅 잘해놓고 이게 뭔가요... 질렌할 믿고 봤는데.. 스토리, 세트, 음악, 연출효과 뭐하나 아류스럽지 않은게 없네요 한마디로 에일리언 + 그래비티 입니다.. 마지막에 반전이랍시고 넣어놓은것도 그저 기가찰뿐  "
20170330,10,무슨 다 외국에서 봤대ㅋㅋㅋ 알바티 좀 안나게 해라  
20170329,8,이거 올 상반기 젤 기대하는 영환데 언제 개봉함??  
20170329,1,제발 우주공포영화는 이제 그만!!  
20170329,10,캐나다에서 미리 봤는데 ㅋㅋㅋㅋ영화퀄리티는 뭐 죽이지만 한번 봐보세요 진짜 절망이 뭔지알게되는 영화입니다.  
20170329,10,개가튼 한국영화 독점을 까부수자  
20170328,1,해외에서 봤는데 15세라뇨? ㄹㅇ 영화보다가 토할뻔했습니다.  소리마저 엄청나게 생생한데 이게 15세라니ㅋㅋㅋㅋ정말 많이 징그럽구요..그냥 징그럽습니다.  
20170328,1,미국에서 봤는데 스토리도 그렇고 이번년 내가 본 영화중에 가장 쓰래기 영화  
20170327,8,스토리도 그렇고 주연배우들도 마음에 듬  
20170327,10,말레이시아 사는 사람인데 오늘 보고왓는데 너무 재밌음 보는내내 숨죽임 그렇게 뻔한스토리도 아니고 그리고 긴장감속에 감동도있어서 울었어요 ㅠ큨 꼭 보세여  
20170327,10,북미에서 방금 관람했습니다.존나 무서웠고 보고나서도 소름돋아있음괴생명체가 오버스럽지 않고 순수한 공포만을 줌정말 수작입니다.  
20170327,9,미국에서 봤는데 우주선이라면 작은 공간 안에서 격는 극한의 공포. 전혀 유치하지 않고 되게 공포스럽고 생각보다 잔인했음.. 그래도 긴장감 최고  
20170327,5,평점 남긴영화가 이영화 뿐이라면 알바 의심해야 하는건가요???  
20170326,5,해외에서 봣습니다.엔딩이후이 가장 먼저 나온말이 홀리크랩 이엇고제 뒤에 영화 보던 사람들도 충격으로 말을 잇지 못하더군요 엄청느게 찜찜험이 남는 영화에요  
20170326,8,ㄹㅇ후기입니다 해외에서 오늘 봤는데엔딩이 진짜 압권이었네요.. 근데 좀 심장이 벌렁벌렁하고 징그러워서 못보는 장면이 너어어어무 많았는데ㅠㅠ 약간 토할뻔 했어요.. 심장 약하신 분들은 조심하시길.. 15세 관람가는 아닌 것 같아요..  
20170325,10,해외에서 봤습니다. 좁은 공간에서 긴박감 넘치네요. 꼭 보세요~~  
20170325,10,캐나다에용 어제 보고왔는데 댓글로 걱정 많이하시는데 걱정안하고보셔도되요. One of the best thriller sci-fi ever  
20170324,9,외계 생명체와의 사투..  과연 누가 승자가 될까?  마지막 5분이모든걸 압도합니다.  
20170324,1,"뻔한  외계인 설정, 거기에 컨택트 처럼 어려운 얘기 풀어놨네...  "
20170323,10,좀 뻔하긴 하지만 완전 재미있게 봤네요. 스포하고 싶지만... 참아야지 ㅋㅋㅋ  
20170322,10,글쎄요 테러 쩌네;; 먼 악감정이 잇는건지..  
20170322,2,짜증나게 일본인이 있네  
20170322,10,예고편 재밌어 보였어요  
20170322,10,재익이ㅠㅠㅜㅠ영화 기대합니다!!ㅠㅜ  
20170322,10,소스코드 이후로 질렌할 영화는 무조건 본다! 그는 배신하지 않는다.  
20170315,10,좋인하는 배우가 많이 나오네요~~~ 믿고보는 라이프개봉이 기다려져요  
20170314,10,우주판 7광구 찍지는 않을거란 기대를 가져본다  
20170314,8,질렌할의 연기라면 기대가 충분히 되네요.아직도 브로크백마운틴은 잊지 못합니다.더불어 데드풀로 호감배우된 레이놀즈면 캐스팅만 믿고 봐도 돈은 아깝지 않을 것 같습니다  
20170314,10,재미있을거 같아요^^제이크 오빠 믿고 보는 배우  
20170314,8,포스터는 무슨 제목을 대문짝만하게 찍어놓은게 싸구려저급영화 같은데 막상 예고편보니 기대를 안할 수 없게 하네 ...  
20170314,8,사나다 히로유키 또 우주인으로 나오네요.. 선샤인 에서도 우주인으로 나오는데....  
20170314,10,소재가 에볼루션이랑 비슷하긴한데 데몰리션을 보고 푹 빠진 베우 질렌할이 나오니 기대해봐요  
20170314,10,라이언레이놀즈 봐야지?  
20170314,10,우주에 외계생물체 더이상 설명이 필요한가  이런거 완전 조아 >_<  
20170313,10,페르시안왕자와 데드풀의 조합  
20170313,10,소재부터 흥미를 갖게되는 영화  
20170313,5,질렌할 팬인데.. 영화는 감독의 비중이 너무 커서..글쎄.. 갑자기 괴 생명체로 끝나는건 아니겠지...?  
20170313,1,뭐야 에일리언  이잖아 !  
20170312,1,재밌지만 평점의 균형이 너무 안맞다.  
20170308,10,하필 입대일에 개봉이네 ㅠㅠ  
20170307,10,요즘 SF영화 너무 좋아! SF좋다면 선샤인 이라는 영화도 추천!!  
20170305,6,이거랑 다크스페이스란 영화랑 비슷할거 같네..  
20170304,10,간만에 이런영화 나왔는데 예고편 좋네  
20170303,10,진짜 믿고 봅니다. 질렌할 형님... 기대 기대  
20170303,8,이번엔 재난영화치곤 뻔한스토리보단 좀신선하고 에일리언처럼 공포스럽게가면좋겠다 뭐 감독이 망작만감독도아니고 제이크질렌할이라일단 기대중이긴한데 이상하게갈까봐 불안...  
20170303,10,데드풀에 미션임파서블에 캐스팅 뭐야  
20170303,10,제이크 질렌할 ㅠ_ㅠ 빨리 개봉해주라...!!!  
20170301,1,댓글쓴사람들 대부분이 직원이 쓴것 같은 느낌은 뭐지.  
20170228,9,질렌행님 나오신다 길을 열어라..  
20170228,7,"우주 영화는 항상 중국,일본이 짱이네  "
20170227,10,예고편 보고 왔는데 꽤 재미있을듯  
20170226,10,질렌할이 선택한 영화면 믿고 봐 볼만 하지  
20170224,10,끝짱나는 SF영화 또 하나 나왔네 캬  
20170224,10,재난  sf  너무너무   좋다  
20170223,8,레이놀즈는 항상 입만 열면 농담하는 케릭터만 하는듯 ㅋㅋ  
20170223,10,"정말 너무 보고싶네요. 라이언 레이놀즈, 제이크 질렌할 동생들 ^^;;  "
20170222,10,미래에서왔습니다. 국내개봉 4월 6일임  
20170222,10,진짜 화성영화 젤기대ㅠㅠㅠㅠ항상 다챙겨봅니다 이번라이프도 기대되요  
20170218,10,캐스팅+우주SF=인터스텔라급  
20170217,10,제이크질렌할이면  믿고 본다 그동안 실패한 영화가 없음  
20170210,10,커버넌트랑 라이프 올해는 풍년이구나  
20170207,10,제이크 질렌할이면 무조건 별이 다섯개!  
20170131,10,북미는 3월 개봉이던데 국내는 아직 소식도 전혀 없네..  
20170131,10,제이크 질렌할인데 말해 무엇하랴  
20170122,8,그보다도 선샤인호 선장 또 우주 탐사하다 죽는건가요...  
20170105,10,질렌할 보러 왔습니다 믿고보죠  
20161103,10,"IMDB를 보니 에일리언 1편 (1979년작, 리들리스콧 연출)에서 영감을 얻었다고 하더군요. 우연치않게 트레일러를 보게되었는데 상당히 기대가 되는 작품입니다. ^^  "
20161006,10,"레이놀즈, 질렌할 말다했네 ㄷㄷ  "
20160721,10,믿고보는 질렌할 형님!!  
