0,1,2
20170404,10,러닝타임 103분이 어떻게 흘러깠는지 모를 만큼 굉장한 스릴  
20170404,10,6인의 우주인들 개개인의 감정변화도 잘 그려냈다.  
20170404,10,관객들의 심장을 조여오는 긴장감;;  
20170404,9,그 조그만 생명체가 이런 존재가 될줄이야..  
20170404,10,엄청난 긴장감과 스릴!! 제이크 질렌할의 SF영화는 생각지도 못했는데 잘 스며들었다  
20170404,10,예고편 그 이상을 보여주는 영화  
20170404,10,이전에 나왔던 우주영화들과는 차별화되었어요  
20170404,10,오늘 시사회로 먼저봤습니다. 우선 꼭 극장에서 보세요. 핵떨립니다 제친구때문에 손가락 부서질뻔 했네요ㅋㅋ유명배우들때문에 더 궁금했던 작품이었는데 기대이상으로 꽤 좋았던.15세아닌것같이 꽤많이 잔인하고 긴장감 심함..ㅎ 마지막 충격으로 여운이 가시질않음  
20170404,10,긴장하고 볼 수 밖에 없는 스토리  
20170404,10,뭐라 설명하기 힘들다.. 직접 극장에서 확인해보시길..  
20170404,10,한정된 긴장감이 나오지 않을까 걱정했는데 아니었네요. 지금 까지 봐온 SF스릴러와는 확실히 달라요  
20170404,10,"제주도는 미리 개봉했기에 관람했는데 흡입력,몰입도 개쩜.  앞으로 잘  알지  못하는  생명체는  절대  안만질거임  "
20170404,7,지렸네.. ㄷㄷ결말예측은 가능해도 쫄깃하네요 굿굿  
20170404,9,시시각각 변하는 배우들의 감정연기를 보는 재미도 쏠쏠  
20170404,10,"그래비티, 인터스텔라와는 또 다른 느낌의 리얼함  "
20170404,10,우주선 외부에서 일어나는 외계 생명체와 인간의 추격적은 보는 사람마저 긴장하게 만든다  
20170404,9,오락적으로 매우좋음.약간 그로테스크함. 19는 아닌데 15도 아닌듯...깊게 생각하며 볼 필요없는 sf호러스릴러 정도 되는듯.  
20170404,10,실제로도 일어날 수 있지 않을까?..  
20170404,1,우주라는 것은 존재하지 않습니다.  
20170404,7,그래비티와 에일리언을 섞은느낌.질렌할과 레이놀즈를 기대했지만 약간 실망..배우보는맛에 보았고 마지막 설마설마한 반전은 웃게만들었다.  
20170404,10,멀지 않은 미래의 이야기를 보여주는 것 같았어요 ㅎㅎ  
20170404,10,CGV에서 개봉 하루전 으로 봤습니다.진짜 믿고 보셔도 될 것 같습니다. 사실 뭐지? 하고 봤다가 너무 재밌어서 주변에 다 추천 하고 싶네요. 레이놀즈가 쪼끔 아쉬움..(연기 말고)  
20170404,10,아맥으로 봤더니 내가 우주선 안에 들어가있는 기분!! 연출 짱짱  
20170404,7,유료 시사회로 하루 먼저 보고왔다. 클리셰 범벅인 sf스릴러 였지만 지루하지는 않았다. 끝까지 긴장감을 가지고 볼 수 있었다.  
20170404,6,참신하고 좋쿠먼유 허나 부연설명부족  
20170404,10,갤빈이 단세포에서 급속도로 변화하는 모습에 위압감-0-  
20170404,6,초반 외계생명체가 주는 공포는 압권이지만 후반부가 너무 느슨하고 반전도 놀랍지않다.그냥 배우만 다른 에일리언 짝퉁느낌..  
20170404,10,내가 본 우주 외계 생명체(?) 중에 가장 인상 깊엇음  
20170404,3,헐.. 이런건줄 모르고 친구랑 보러갔다가 욕 디지게먹음..  
20170404,10,금방 부대 오투 시네마에서 보고 나와서 쓰는뎅~~!!평점이라는거 처음 써보는데 진짜 대박입니다..!! 꼭 보세요~~!! 스토리 긴장감 모두 쵝오!  
20170404,10,관객들 숨을 조여오는 스릴감!!  
20170404,9,이런건 극장에서 봐야 제맛.  
20170404,5,포스터랑 배우만 보고 골랐는데 이런영화일줄은 몰랐음.. 그리고 예측 가능한 스토리였지만 흥미진진하게 보긴 했음  
20170404,10,인간의 감정변화까지 연기하는 배우들의 소름 끼치는 연기력..  
20170404,8,ㅠㅠ기대 많이 했는데...  
20170404,10,간만에 등장한 괜찮은 스페이스 스릴러물. 그래비티와 에일리언을 합친느낌.  
20170404,10,제한된 공간에서 변화하는 외계 생명체의 모습에 주먹을 꽉 쥐고 볼 수 밖에 없더라..  
20170404,10,초반부터 긴장을 놓을 수 없게 만드네요  
20170404,10,결말까지 마음에 쏙 든 영화  
20170404,4,그냥 그럼~별로 안 잔인함~결말 반전은 초반부터 예측가능~ 전혀 안놀라운 결말이에요~ 우주스릴러인데 너무 뻔함~ 설정이 독특한 부분도 있는데 어디서 많이 본 듯한 스토리에 설정만 우주로 바뀜~ 기대했는데 실망~ 기대안하면 킬링타임용으로 볼만할 수도~  
20170404,10,와 정말 짜릿해요ㅠㅠㅠ 이렇게 집중해서 본 SF스릴러는 오랜만인것 같아요  
20170404,10,군더더기 없이 깔끔한 영화 긴장감 하나는 인정 ㅎ  
20170404,10,유로 시사회로 개봉 하루앞당겨서 봤는데요 인간의 본질인 생존과 죽음을 제대로 살린 영화에요 결말이 이럴거라고는 끝까지 생각못했어요 제이크질렌할 연기 오지구요 퍼거슨 몰입감 지림니다 정말 끝까지 아무것도 믿지마세요 !  
20170404,10,배우들도 전부 내가 좋아하는 배우들에다가 스토리도 흥미진진하니 시간가는줄 모르고 봤습니다 :)  
20170404,10,영화 속 이야기들이 실제 일어날수도 있을 것 같다는 생각. 한시도 눈을 뗄 수 없게 만든다  
20170404,10,심장이 쫄깃쫄깃해지는 영화…상상력의 끝을 보여주는듯.  
20170404,8,....이런영화인줄 모르고봤다가..소오름..무섭  
20170404,9,간만에 본 제대로 된 SF재난스릴러  
20170404,10,우주를 배경으로 한 영화중에 제일 긴장 넘친듯!!  
20170404,10,확실히 큰 화면에서 보니 더 긴장감 넘치고 몰입도 상당 하더라구요  
20170404,10,한정된 공간에서 벌어지는 이야기들이 스릴 넘치고 흥미진진했다.  
20170404,10,라이언 레이놀즈 이렇게 보니까 또 색다름  
20170404,10,믿고보는 배우 제이크 질렌할. 이번에도 지렷다 ㄷ ㄷ  
20170404,7,"재미있긴 하지만 이런 종류의 영화를 몇번 본 사람에겐 등장인물이 언제 어떻게 죽을지 까지 예측이 되는 교과서적인 영화입니다. 반전은 구태의연하기까지 합니다. 잔인함의 정도나 폐쇄감,긴장감의 표현 또한 딱 15세 관람가에 맞게 평이한 수준입니다. .  "
20170404,9,솔직히 배우들만 봐도 믿고 볼만함 ㅋㅋ  
20170404,4,스릴러엿어요... 끝까지 스트레스만 주는 영화네요ㅜㅜ 콜라 챙겨가세요ㅜㅜ  
20170404,10,믿고 보는 배우 질렌할.. 또 우주 라는 공간에서 벌어질 스펙타클한 스토리 모두 기대 되네요^^ 라이프 화이팅^^  
20170404,10,방금 영화관에서  봄스케일이 작은 에어리언!!끝나기전  반전~~^^SF  좋아 하는 분  강추~~액션은  컨텍트 보다 강렬~~  
20170404,10,"생각지도 못했다. 긴장감, 몰입감 최고.굿굿  "
20170404,8,걍 시원하게 날려보내지.  ㅡㅡㅋ  
20170404,7,시사회 다녀왔습니다. 초반에는 우주라는 설정상 공허한 분위기가 조성돼 살짝 졸렸지만 이후엔 4시간밖에 못자고 봤음에도 재밌게 봤습니다. 캘빈은 적대적이고 이기적이지만 마치 그 모습에 우리 인류가 투영되어 보였습니다. 위기의식과 경고가 느껴집니다.  
20170404,1,"에일리언도 아니고 프로메테우스도 아니고진짜 이거저거 섞을려고 했는데, 스토리도 꽝배역도 잘못 선정한것 같고 최악이네욤  "
20170404,1,내돈9천원내놔  이런영화좀안나왔으면 좋겠다 이사기군들아!!!진심토나온다!  
20170404,1,긴장감 있긴 함. 근데 존나 더러운 긴장감. 본 사람은 이해할 듯. 출연료 엄청 투자했나보네요. 이딴 영화에 저런 배우들이 나오다니.  
20170404,10,의외로 되게 재밌게 봤던ㅋㅋ 돈주고 봐도 아깝지 않았을거 같다 낼 개봉하면 반응 100프로 핫할거 같음  
20170404,8,아니 그냥 결말이 너무 웃기닼ㅋㅋㅋ  
20170404,10,영화 정말 좋았습니다 아이맥스로 또 봐야겠어요  
20170404,6,모여 우주선밖에잇던 캘빈이 언제 들어와서 다리 뜯어먹고있고 캘빈이랑 박사가탄 구명정은 왜지구로  온거야  
20170404,10,영화가 주는 엄청난 긴박감에 압도 당했네여..  
20170404,10,드뎌 내일 개봉이네요 개봉일만 기다렸습니다^^  
20170404,10,시사회로 봤는데 존잼이였당ㅋㅋ  
20170404,10,내가 생각하던거랑은 달랐지만 재밌게 잘보고 옴  
20170404,10,올해들어 최고영화임ㅋㅋ 졸라잼씀ㅋㅋㅋ  
20170404,10,왠만한 공포물보다 더 무서운 스릴러  
20170404,3,일단 오늘 4월4일에 일부 영화관에서 두개의 시간대에 오픈을 해서 친구들이랑 관람했는데요. 너무 고어에요.. 일단 청불판정받아야해요!! 그리고 스토리 개연성이 떨어지고 너무 비극적이에요 ㅠㅠ 심장이 쫄깃한 맛도 없잖아 있지만 그냥 영화끝나고나먼  
20170404,9,재밌고 반전있고 이런게 진짜 영화!  
20170404,10,공포스런 긴박감으로 저절로 숨죽이며 보게 된다능..  
20170404,10,예상외의 결말이랑 적잖게 충격도 받았지만 재밌긴 재밌네  
20170404,10,보는내내 쉴 틈 없이 몰입ㅋㅋㅋ 역시 헐리웃 영화들은 스케일부터 남달라  
20170404,3,방금보고왔는데 프로메테우스+그레비티+인터스텔라 짬뽕^^ 프로메테우스 기대하고 보면 안됌..라이언레이놀즈 왜나왔냐  
20170404,10,마지막까지 안심할 수 없다 정신 똑디 잡아라  
20170404,5,결말이 예상 되어서 조금은 ..  
20170404,10,"충격적인 결말,, 여운도 오래감  "
20170404,10,이런게 바로 웰메이드~! 간만에 제대로된 sf 스릴러를 즐기시길!!  
20170404,10,퀄리티 쩌네요 기대한것 이상입니다  
20170404,10,우주 스케일 장난 아니네요 거기다가 재난영화로 너무 재밌게 보고 왔습니다  
20170404,2,"기억속에서 잊고싶은 더러운영화,,재미도없고 내용도없고 지저분하기만한 저급영화..배우들이 왜 이런영화에 출연햇는지.. 시사회당첨으로 방금봣는데 진짜 잊고싶은 역겨운 영화네요..  "
20170404,9,포스터 보고 맘놓고 봤다가..깜짝깜짝 놀라고 무서웠다근데 결말은 좀...  
20170404,9,어떻게 이런 영화를.. 대단해..  
20170404,10,생각지도 못한 반전과 결말은 진짜 최고였다  
20170404,3,잘만들었는데...분명 잘 만들었는데 ㅠㅠ 저는 왜이리 소름이 돋는걸까요 마지막까지 소름돋는...내가 지금까지 본 영화중에 가장 소름돋고 섬찟한 영화!! 보고나서도 한참동안 기분이 별로다.  
20170404,10,굿굿~~ 스릴러물 좋아하면 재밌게 볼 수 있어요~  
20170404,10,"짚신벌레 아메바 같은것이 처키보다 무서웠고, 넘 재밌어서 2시간 내내 영화가 끝나지 않기를 바라면서 봤습니다 ㅋ 이런 스토리로 이만큼 만들어낼수 있다니 정말 대단하네요 추천!!!  "
20170404,10,시사회로 봤던 영환데 드디어 개봉하네ㅋㅋ 재밌게 봤었는데  
20170404,10,지루하지 않고 반전 잼 ㅋ 기대하고 보셔도 될 듯  
20170404,10,방금 보고 나왔어요...진짜 진짜 재밋음!!!괴물 + 그래비티 느낌? 그 작은 괴물이 점점 커지면서공포감 최대치로 끌어올림.. 마지막반전!!  
20170404,1,이런것도 재밌다고 글 남긴게 재밌네.  
20170404,10,정말 오랜만에 볼만한 sf 스릴러물이다ㄷㄷ  
20170404,10,우리가 생각하는 그 이상을 보여주는 영화  
20170404,10,기대 안하고 봤는데 존잼… 강추  
20170404,10,몰입감 진짜 끝내줌!! 최고 최고!!  
20170404,8,생명존중같은 같잖은 이유로 너무 나대면 안된다는 교훈을 주는 영화 서스펜스 스릴 충분 다만 개연성 아쉬움  
20170404,1,와 결말을 찝찝하게 만드네. 2편을 내놓을려고 결말을 이딴식으로 만든건가? 에일리언보다 훨씬 못한 영화. 감독 도대체 누구냐?  
20170404,1,압도적인 긴장감은 인정 영화의 내용만을 중시한다면 추천 결말까지 완벽한 영화를 원한다면 이 영화는 걸러라여운도 감동도 없는 반전아닌 반전의 허무함만 가득채워준 영화  
20170404,10,짱짱ㅎㅎ 완전재밌어요  
20170404,5,애초에 잔인한 거였으면 안봤다 정말 끔찍하고 잔인하고 소름끼치고 무섭고 공포스럽고 그런 영화인데 잔인한거 좋아하면 봐도 되요ㅠ  
20170404,1,예측 가능한 반전... 기대했던 영화였는데 왜 그랬어요 왜...  
20170404,10,우주를 소재로한 영화들 언제나 흥미롭다ㅋㅋ 이건 스릴까지 장난 아님ㅋ  
20170404,9,"끝날때까지 긴장감을 놓을 수가 없음,,,  "
20170404,10,심장 쫄깃한 몰입감은 정말 오랜만이네요 소재부터가 끌렸던 영환데 정말 만족스러운 영화 한편이였네요  
20170404,10,간만에 정말 볼만한 영화네여 몰입감 장난 아닙니다!  
20170404,9,약간 잔인하긴 한데 대박인듯ㅋㅋ 기대한 보람이 있음  
20170404,10,연기 연출 스토리 음악 등등 모든게 완벽ㅎㅎㅎ  
20170404,10,재미는 확실히 있네요 스릴러나 sf 좋아하면 강력추천해요  
20170404,8,음 그냥 저냥 시간때우기랄까  
20170404,7,어이없는 마무리...  
20170404,9,이런 장르 너무 좋음! 간만에 볼만한 스릴러물!  
20170404,10,오랜만에 쉴 틈 없이 몰입해서 본 영화입니다  
20170404,10,쫄깃쫄깃한 긴장감이 아주 그냥ㅋㅋㅋ 이런 영화를 시사회로 봤다니 개봉하면 또 보고싶음  
20170404,10,결말이 진짜.. 대박이네 이 영화  
20170404,10,기존의 재난 스릴러와는 차원이 다르다.  
20170404,10,이건 무조건 극장사수 각ㅋ  
20170404,10,스릴감 장난 아니고 엔딩에서 소름 돋았다 주말에 한번 더 볼 예정임  
20170404,10,우주영화 좋아하는 나로썬 넘나 기대중!!  
20170404,1,너무 고어에 집착한거같아서 불쾌했어요 ㅠ  
20170404,10,제이크 질렌할 나오는 영화는 무조건 보지요~  
20170404,9,올해 최고의 기대작ㅜㅜㅜ 방금 예매했다  
20170404,9,배우들도 그렇고 소재도 그렇고 기대를 안할수가 없는ㅎㅎ  
20170404,10,진짜 보는내내 긴장감 최고였다 숨 죽여서 보고 온 듯  
20170404,10,시사회로 보고 온 친구가 재밌다고 난리던데.. 기대해볼게요  
20170404,10,sf 스릴러물 개좋아하는데ㅋㅋㅋ 완전 기대됨  
20170404,10,시험기간에 개봉이라니ㅠ  
20170404,3,제이크 믿고 보러갔는데 실망했습니다.. 기분도 찝찝하네요.  
20170404,10,우주영화를 좋아하는 팬으로서 이 영화는 존나 재미없다.  
20170404,10,기대 했던 것 이상입니다  
20170404,10,기대되는영화!! 개봉하면 꼭 극장사수할겁니당!  
20170404,10,이런 SF너무 좋은데 스릴러까지 ㄳ  
20170404,8,적당히 흥미로웠고 적당히 공포스러웠다  
20170404,10,숨을 쉴 수 없는 긴장감. 주인공들이 너무 멋짐.  
20170404,10,짱.. 긴장감+재미 모두 잡았다  
20170404,10,이건 무조건 3D로 봐야한다.  
20170404,1,만우절 미리보기로 본 사람인데요. 고어물 싫어하면 절대 보지 마세요.  
20170404,10,"우주, SF 스릴러?, 재익이, 라이언, 외계생명체까지...안볼래야 안볼수가 없다!  "
20170404,10,예매 완료!! 너무 좋아하는 배우들.. ㅎㅎ 그래비티+에이리언??? 긴장감 최고일 듯..  
20170404,10,SF 장르에 영화를 보는 내내 손에 땀을쥐게하는 긴징감은 시간이 가는줄 몰랐습니다  
20170404,9,제이크 질렌할인데 말해 무엇하랴 2 2 2 2  
20170404,10,인터스텔라 같은영화인줄 알았는데 예고편 보니 에이리언이네요 ㅋㅋ 예고편 보니 완전 땡긴다~ 개봉하면 바로 보러 갈 예정 !  
20170404,10,SF 광팬으로  개봉 되자마자 보러갈예정!  
20170404,10,제이크 질렌할이랑 내가 좋아하는 우주영화라니!!! ㅠㅠㅠ 예고편만 봐도 너무 기대돼요 외계생명체 빨리 보고싶다아아아 빨리 심장 쪼이는 느낌 맛보고싶다ㅠㅠㅠ  
20170404,10,"에일리언이랑 라이프 완전 기대작!SF 영화 그닥 좋아하지 않았는데, 예고편 공개 된거 보고 기대중!!!뭔가 신비롭게 봐야할 것만 같아 ㅋㅋㅋㅋ  "
20170404,10,질렌할 형님 영화면 묻지도 따지지도 않고 봐야죠 ~ ㅋㅋㅋ  
20170404,10,간만에 심장 쫄깃! SF 스릴러 좋아하는 사람들한테는 딱인 듯!  
20170404,10,믿고보는 질렌할! 라이프 완전 기대된다ㅠㅠㅠ  
20170404,9,엄청 스릴있음..엔딩이 완전 골때림..  
20170404,10,제이크 질레할이라면 무조건  믿고봅니다!!!  
20170404,10,제이크 형님! 곧 만나러 갑니다!  
20170404,10,믿고보는 제이크질렌할과 라이언레이놀즈의 만남! 기존SF와 다른 재난스릴러로 기대되고 결말이 궁금하네요!  
20170404,10,조용한 긴장감이 돋보이는 영화. 배우들 연기도 좋고 추천!  
20170404,9,sf빠 기대중임 언능 나오삼  
20170404,10,드뎌 개봉하는건가..재익이랑 사자놀즈 케미 대박 기대.  
20170404,10,생각보다 스토리가 잘짜여진거 같던데 빨리 보고싶네요  
20170404,10,올해 본 영화 중에 최고!!!  믿고 보는 배우들에 심장 쫄깃한 긴장감까지! 또 보러 가고 싶다!ㅋㅋㅋㅋ  
20170404,2,안뇽 케빈 지구는 처음이지. 맛있게 먹으렴  
20170404,10,믿고 보는 제이크 질렌할♥ 예고편만 봐도 완전 기대 폭발이에요!  
20170404,8,우주영화를 좋아하는 팬으로서 기본적으로 바라는 앵글이나 구도감을 보여주면서 동시에 우주선 안 살인이라는 재밌는 요소를 넣음. 스릴도 있고 지루하지 않고 좋은 킬링 타임용 영화. 물론 괴물이 나오는 재난 영화기에 뒤에게 좀 뻔한 점은 있음.  
20170404,10,우주에서 발견한 지구의 최후라니!! 완전 기대됨!!!!  
20170404,8,박평식이 6점 주면 말 다한거 아닌가?. 보러가자  
20170404,10,"보는 내내 손에서 땀나게 했던, 극도로 심장 쪼이는 영화였습니다! 끝나고 내 심장 무사한지 체크를 해봤던..질렌할과 레이놀즈는 물론이고 섹시한 레베카 언니까지..뻔한 SF 스릴러가 아니어서 신선했어요!  "
20170404,6,나도 짜게 주는 편이라 박평식이 6점 줬다면 볼만 할거같네? 함 보러 갈까나  
20170404,10,"심장 쫄깃, 숨막히는 긴장감을 원하는 관객들에게 추천. 마지막 예상치 못한 반전도 인상적이다.  "
20170404,10,처음에는 귀여웠는데...귀엽다고 얕보면 큰코다친다.잔인했음 에일리언시리즈 통틀어서  
20170404,10,쪼는맛쩐다.. 오랜만에 심장이쫄깃했음 !!  
20170404,9,대박사건 진짜 최근 본 영화 중에 결말 최고 충격적임 ㄷㄷ 스트레스 쫙 풀리는 간만에 볼만한 영화임!!!!  
20170404,7,어제 유료시사회? 라서 봤는데 너무 무서웠음..ㅠㅠㅠ 귀막고 눈감고봄... 외계인 진짜 징그럽고 엔딩은 해피엔딩 아니라서 찝찝함...  
20170404,10,아 나 정말 심장 터질 뻔!!!!  
20170404,10,제이크 질렌할 넘나 기대 중!!! 워낙 좋아하는 장르라 기대 많이 하고 있습니다 두근두근  
20170404,9,어제강남에서봣능데 보는내애 스릴지리구...반전지리구...2편나왓음좋겟다 15세라기엔좀...무서움  
20170404,8,개인적으로 취향저격당한 영화입니다. 마지막 반전이 쇼킹하네요. 뭐 어느정도 예상은 했지만..루즈하지 않고 내용전개도 좋고 돈 아깝지는 않습니다. 근데 속편 나오면 망할듯..주말 연인.친구들과 보기에 무난합니다. 가족도좋구요.  
20170404,5,살짝 치열한 그래비티같음  
20170404,8,유료시사로 관람했는데 뻔한sf영화는 아니였네요 소재가특이했고 보는내내 긴장감주었던 뭔지신선했던영화였네요  
20170404,5,흠.... 질렌할 영화는 일단 평타는 치는데 이건 벌써 평이 좀 그렇네. 볼까 말까..  
20170404,1,엔딩도 밋밋하고 기대한것에비해 정말 실망입니다....  
20170404,6,기대하고 가면 실망합니다.  
20170404,8,예상가는 엔딩 그러나 그래서 더 재밌었던!  
20170404,1,쭈꾸미와의 사투. 꺼진불도 다시보자.  마지막 1분은 흥미로웠다. 꼴뚜기 >쭈꾸미>낙지>문어>대왕오징어>과연...오떻게 지구는 아작 날 것인지...그런데 감상평은 그냥 그래요.  마무리가 뒷통수 맞은거 같아서...  
20170404,10,방금 동백 씨지비에서 11시꺼보고왔습니다 인생은역시 라이프죠 라라랜드를 뛰어넘을 대작이 드디어나왔네요  
20170404,8,"메가박스 시사회라고 해서 저녁 9시에 관람한 1인~^^ 일단, 잼있습니다. 비슷한 sf스릴러 장르(에이리언 등)가 많으니까, 못해도 중간은 가겠지라는 마음으로 갔는데, 평점 8점은 줄 수 있는 웰메이드 영화임다. 연출, 특수효과, 음악, 연기 모두^^  "
20170404,5,"유료시사회 관람하고 온 20대초반 남자입니다평소 우주,sf영화 좋아하는대 라이프같은 경우일단 뻔한 스토리 전개와 예상되는 반전, 필요없거나 진부한 캐릭터가 보였습니다.  "
20170404,10,정말 이건 대박인듯 괜찮게 봤어요 살짝 잔인하긴하지만!  
20170404,10,내 위호 다 아닥해 이건 수작이다 진짜. 긴장감 몰입도. 영화가 끝나도 내 몸은 아직도 푸들푸들거리고 있다.  
20170403,9,[유료시사회봄] 현실은 언제나 상상보다 더 참혹하다..  
20170403,10,다른 우주배경 sf물 마션.그래비티.인터스텔라와는 다른 느낌이 있네요. 느낌은 그래비티와 비슷한데 지루하지않고 몰입도가 높아 시간가는지모르고 봤습니다. 보셔도 후회안하시니 고민중이시라면 한번보세요~  
20170403,8,결말은 반전과 함께 찝찝함을 안겨주만 긴장감있는 영화입니다  
20170403,10,마지막에 참 당혹스럽다2편 만들라하나  
20170403,10,재미있는데 무서워요..  
20170403,10,너무 쇼킹하다... 간만에 재밌는 영화 봤다...  
20170403,6,음 예매권 당첨되서 봤는데요... 돈내고 영화관 갈건 아닌거같아요 ㅋㅋㅋㅋ 징그러운거 못보시는 분은 보지마시구요 결말이 좀 별로....????.... 그리고 매드사이언티스트 과학윤리 좀 배우라고 하세요  
20170403,10,보고 왔는데 영화 끝날때까지 긴장을 놓을 수가 없네요 ㄷㄷ 넘나 무서운것... 에어리언 급입니다.  
20170403,10,우주를 소재로 한 SF는 늘 흥미롭다.  
20170403,7,롯데 마트에서 보고 왔습니다.  
20170403,10,마지막 엔딩이 너무 찝찝함 ㅠㅠ 재밋음  
20170403,1,방금유로시사회로 봤는데 그냥그럼. 마지막해피엔딩아님  
20170403,8,이 영화는 마지막이 다 망쳤다.  
20170403,7,잔인하고 결말이 찝찝해요  
20170403,6,산낙지영화 잘봤습니다  
20170403,10,"오늘 보고 왔습니다.. 왤케 평이 낮은지;; 숨쉴 틈도 없이 몰입하게 하는, 연기와 연출다 훌륭한 수작이지만 너무너무 무서워서 ㅠㅠ ㅜ 공포영화 잘보는 사람만 보세요.. 쓸데없이 너무 잘만들어서 너무너무무서움  "
20170403,8,크리피!! 내가 저럴줄 알았어...호러물이네요ㅜ  
20170403,6,"SF 호러 영화 '이벤트 호라이즌' 을 10점으로 기준 삼는다면 이건 딱 6점 짜리, 세월이 흘러도 뻔한 캐릭터 설정과 모호한 괴물... 조조영화로 본다면 적합한 영화  "
20170403,1,진짜 끝나고 ㅈ같네 라는 말만 나오는...2  
20170403,1,개봉전인데 상영하길래 봤거든요? 도가니보다 더 한 기분더러움과 찝찝함과 인간혐오에빠집니다 주인공들이 날 이렇게 화나게 한건 오랜만이야 다 착해빠진건지 아님 멍청한건지 ㅎ  
20170403,10,내가 처음인가..이건 진짜 대박이다. 시작도 소오름. 결말은 완전 쇼크.인터스텔라 블랙홀 파도 저리 가라임.  
20170403,8,결말이찝찝해요  스포될까 말못하겠네요.  긴장감 좋구요. 혼영 입가리고봄.  
20170403,1,긴장감때문에 가슴이계속먹먹하구요 한명씩 죽을때마다 좀 잔인해요 특히첫죽음이 어우ㅠㅠ한국에선 15세로나온거보니 그런장면좀 삭제됐을수도있어요  
20170403,10,믿고 보는 레베카 퍼거슨! 미션 임파서블에서 톰크루즈와 찰떡 호흡을 보여줌~ 기대됩니다 ^^  
20170403,10,2편 나올 각입니다 올만에 제대로 심장 뛰는 SF  
20170403,7,고무장갑이 너무 잘 찢어잖아 멍청이들아 로봇팔을 썼어야지  
20170403,8,나름 재미있음.신선함.  
20170403,10,아 이 영화 몰입도 최고다. 가슴졸이며 봤음.물론 여러 영화 짜깁기한 듯 하지만 연출력으로 극복했다.  
20170403,10,하 방금 미아씨쥬ㅣ부이에서 보고왔습니다.굉장히 힐링받았습니다^^ 완전 추천이요!!! 낙지.문어.오징어류 안드시고 보는걸 추천합니다^^  
20170403,8,재미적인 요소는 충분함. 근데 마지막 반전이 삼류영화급으로 대실망  
