0,1,2
20170221,7,볼만했어요....110분이 순삭  
20170221,8,에쉬튼의 폭풍연기로 한가득 차오른 감정이 후반부에선 묘하게 반토막나는 것 같았습니다. 삶은 진행중이니 어떻게 될지 모르고 미완성이라는 느낌을 주기위해 의도한건지 모르겠지만 아쉽습니다.  
20170221,10,브래드피트 제작?꼭본다  
20170221,10,시사회 갔다 온 친구가 꼭 보라고 난리ㅋㅋ  
20170221,10,기다리고 기대했던 영환데 드뎌 낼 개봉~~  
20170221,10,강렬하진 않지만 좋았던 문라이트  
20170221,10,샤이론의 눈빛을 따라가다 보면 어느새 영화는 끝나 있더라  
20170221,10,잔잔하게 흘러 가는데 흡입력이 장난 아님ㅋㅋ  
20170221,10,다 보고나면 곱 씹어 보게 되는 영화예요 문라이트 정말 좋았습니다ㅠㅠ  
20170221,10,좋은 영화임이 분명합니다~  
20170221,10,시각적으로나 청각적으로나 세심한 연출은 정말 잊지 못할 것이다  
20170221,10,와 감독의 연출이 진짜 쩔었..어….  
20170221,10,마치 한편의 시같은 영화랄까?  
20170221,10,동성애 코드가 아닌 소년에 대한 이야기였다.. 보고나서 배울 점도 많은 영화임  
20170221,10,변함없이 빛나는 달빛처럼  
20170221,10,장면 하나하나 대사 하나하나가 인상 깊고 쉽게 잊지 못할 듯  
20170221,10,정말 평범하지 않은 카메라 이동을 보면서 감독의 예사롭지 않은 시선이 느껴졌네요  
20170221,10,강렬한 영상과 탄탄한 구성에 보는내내 감탄에 감탄을!  
20170221,10,천천히 나를 알아가는 시간..  
20170221,10,너무 꾸미지도 과하지도 않게 담백한 느낌이라 좋았습니다  
20170221,10,요즘 재밌는 영화들 짱 많이 나오네ㅋㅋ  
20170221,10,기대되는 영화 문라이트! 개봉전부터 핫한 반응이여서 너무 기대되요!  
20170221,10,브래드피드가 총괄 제작한 영화라니 더 기대됨!!  
20170221,10,꼭 보세요 꼭 보셔야 합니다  
20170221,10,간만에 제대로된 영화 한편^^  
20170221,10,잔잔하게 스며드는 아픔과 위로.. 덕분에 영화를 본 나도 위로 받은 느낌  
20170221,10,내일은 문라이트 보는 날! 오랫동안 기다렸어요!  
20170221,10,우리가 어디가서 또 이런 영화를 볼 수 있을까  
20170221,10,감독이 천재네 진짜ㅋㅋㅋ 문라이트 꼭 보시길  
20170221,10,브래드피드의 안목은 대단한듯.. 이번에도 역시나 명작 탄생  
20170221,10,이런게 진짜 영화가 아닐까 싶어요  
20170221,10,예고편부터 느낌있던데 본 영화가 기대되네요^^  
20170221,10,꼭 보고싶은 영화 문라이트  
20170221,10,이제부터 문라이트는 내 인생영화  
20170221,10,우리들이 살아가면서 한번은 꼭 봐야되는 영화인것 같다  
20170221,10,이런 영화를 또 어디가서 볼 수 있을까  
20170221,10,개봉전부터 입소문 제대루ㅋ 꼭 극장사수!  
20170221,10,영화를 좋아하는 사람으로써 정말 기대하고 있는 작품입니다  
20170221,10,아름답고 멋진 영화임이 분명하다  
20170221,10,하 정말 상영관ㅡㅡ 이렇게 좋은 영화가 상영관이 왜 이렇게 적냐  
20170221,10,와 드디어 내일 개봉이다ㅠㅠ 얼마나 오래 기다렸는지  
20170221,10,정말 기대할만한 작품ㅋㅋ 기대해도 좋습니다  
20170221,10,명대사도 명장면도 많은ㅎㅎ 보고 느끼는게 많은 영화예요  
20170221,10,나의 인생영화 리스트에 포함  
20170221,10,역대급이라는 소문이 진짜였다ㅋㅋㅋ 진짜 이건 꼭 봐야되는 영화  
20170221,10,시사회로 보고온게 미안할 정도..? 이 좋은 영화를 공짜로 보다니ㅎㅎ  
20170221,10,왜 이렇게 해외에서 극찬을 받지? 했는데 영화를 보고나니 알겠더라구요  
20170221,10,이건 꼭 영화관가서 보고 싶음ㅠㅠ  
20170221,10,최근 자극적인 오락영화들만 보다가 이런 영화 보니 너무 좋아요 내일 개봉이라는데 좋은 결과 있기를 바래봅니다  
20170221,10,감독의 연출 배우들의 연기 영상미 등등 뭐 하나 깔게 없음  
20170221,10,드디어 내일 개봉ㅋㅋㅋ 다행이도 우리 동네엔 상영관있다ㅠㅠ 상영관 좀 늘려라 제발  
20170221,8,내가 어떻게 성장해야하는지 보여주는 영화  
20170221,10,소문 그대로 너무나 좋았던 영화  
20170221,10,여태까지 많은 영화들을 봐왔지만 처음 느끼는 감동이었다 쉽게 잊혀지지 않을듯  
20170221,10,연출력이ㄷㄷ.. 이거 보니까 마이애미라는 나라가 궁금해졌음  
20170221,10,대사 하나하나가 명대사ㅋㅋㅋ 인물 감정선도 좋았고 꼭 집중해서 보시길  
20170221,10,지극히 평범하고 소탈하지만 표현 방식이 정말 대단했던!  
20170221,10,잔잔하게 흘러가지만 영화가 주는 메시지와 느낌은 강하게 다가옴…  
20170221,10,아름답고 멋진 영화가 탄생했다  
20170221,10,잘만들어진 영화… 감독이 천재인가봐..  
20170221,10,"사랑,인생,삶에 대해 다시 한번 뒤돌아 보게 되는 영화였습니다  "
20170221,10,세계적으로 인정받을만한 영화ㅋㅋㅋ 강력추천  
20170221,10,시사회로 보고 왔었는데 한번 더 볼라고 예매했네요~^^  
20170221,10,진한 여운과 큰 울림을 선사해주는 문라이트  
20170221,10,이건 진짜 본 사람만 암ㅜㅜ 최고 최고  
20170221,10,정말 깊이가 다른 영화랄까? 보고나면 느끼는게 많고 배울 점도 많은 영화다  
20170221,10,노예 12년도 인상 깊었는데 브래드피트가 영화 보는 눈이 있네  
20170221,10,최고다 이 영화!!!!  
20170221,8,"나의 색을 찾아서, 푸르름의 세계로  "
20170221,8,여린 소년이 강한척 해야만 하는 슬픔. 내가 선택하지 않고 선택되어 지는 삶을 살게 되는데에서 오는 서글픔.  
20170221,2, 내용이 좋지 않고 전체적으로 부정적인 느낌이 드네요 왜 평이 좋은지 잘 모르겠습니다 어두운 세계에서의 삶을 영화로 만드는게 좋은 일은 아니라고 생각합니다  
20170220,10,달빛 아래에선 모두 푸르다  
20170220,10,좋아요 많은걸 느끼고 깨닫게 되는 그런 작품이에요  
20170220,5,일단.. 쫌..난해함.. 정서가 맞지 않았어요  
20170220,10,그 동안 보지 못했던 그런 영화임  
20170220,10,감독의 연출력이 진짜.. 이건 꼭 봐야됨  
20170220,9,예매완료!! 빨리 만나 보고 싶습니다!  
20170220,10,평식이형님이 7점 주셨으면 무조건 극장간다. 적어도 작품성은 높다는 뜻이니 돈 아까운 적이 없었다.  
20170220,10,감동+여운+메시지 문라이트 대박나길^^  
20170220,10,브래드피트가 진짜 작품 눈은 확실한거 같음..  
20170220,10,여운 대박ㅜㅜ 많은걸 느끼게 해줍니다  
20170220,9,꼭 많은 사람들이 봐야하는 영화  
20170220,10,기대이상의 영화 무엇을 상상하던 그 이상일것  
20170220,6,"누군가의 달빛으로 인해, 세심하게 물들고 또 바라보는.  "
20170220,10,제2롯데월드에서 열린 시사회 다녀왔었는데 정말 좋았습니다  
20170220,10,오랜만에 제대로된 영화를 만났다  
20170220,9,기대되는 영화ㅎㅎ 얼마나 잘만들었길래ㅎ  
20170220,10,드디어 한국에서도 개봉하네ㅋ 개봉일날 바로 보러 가야지  
20170220,10,너무 잘만들어진 영화ㅋㅋㅋ 기대해도 좋을듯  
20170220,10,진짜 보고 싶었던 영화였는데!  
20170220,10,언제 개봉하나 했었는데 곧 개봉이네ㅎ  
20170220,10,작품성은 확실히 있겠네 기대된다요~  
20170220,9,메시지가 확실히 있을거 같은ㅎㅎ?  
20170220,10,골든글로브 최우수작품상이면 말 다했네 무조건 극장사수다  
20170220,8,한 흑인소년의 성장기를 드라이하게 보여주는 영화  과연 강해진 걸까 싶으며 여전히 애정에 고파하는 주인공 의 결말이 담백하게 다가오네요  
20170220,10,와 개봉일 2일전!! 내일 예매해야겠당!!  
20170220,10,진짜 대단한 작품이지 이건..  
20170220,9,제가 여태까지 봐왔던 영화들 중 최고네요 정말  
20170220,10,역대급이라던데ㅋㅋㅋ 대체 어떤 영화길래ㅋㅋ 기대해봄  
20170220,10,역대급 영화라는 소리를 하도 많이 들어서 많은 기대를 하고 시사회를 다녀 왔는데도 기대이상의 재미와 여운을 남겨줬다  
20170220,10,진짜 너무 잘만들어진 영화  
20170220,9,벌써부터 입소문 장난 아니던데ㅋㅋㅋ  
20170220,10,잔잔하게 스며드는 영화랄까..? 기존의 영화들과는 차원이 다른 깊이 있는 영화!  
20170220,10,내가 여태까지 봐왔던 영화들 중 최고라고 할 정도로 감동과 여운이 컸음 이런 영화가 잘되야할텐데  
20170220,10,전세계를 홀린 가장 뜨거운 영화 문라이트!  
20170220,9,아직도 문라이트가 준 감동은 남아 있다..ㅎㅎ  
20170220,10,우리 동네도 문라이트 상영했으면 좋겠다 정말 보고 싶은 영환데 흑  
20170220,10,보기 전과 후의 기분이.. 인상깊다 이거  
20170220,10,대사 하나하나가 어찌나 마음에 와닿던지.. 연기 연출 스토리 영상 등등 뭐 하나 버릴게 없는 영화였다  
20170220,10,정말 좋은 영환데 잘됬으면 좋겠습니다  
20170220,10,브래드피드가 제작한 영화들은 하나같이 다 재밌고 작품성이 있는 영화인듯.. 이번 문라이트도 너무 좋았음  
20170220,10,시사회 당첨되서 보고 왔는데 정말 멋진 영화였습니다  
20170220,10,시사회로 이런 좋은 영화를! 개봉하면 엄마랑 한번 더 볼 생각이에요!  
20170220,9,연출력과 영상미는 정말 끝내주더라  
20170220,10,진한 감동과 진한 여운을 느끼고 싶다면 무조건 보시길  
20170220,10,이건 정말 명작ㅠㅠ 꼭 봐야된당  
20170220,10,호평을 받는덴 다 이유가 있지ㅋㅋㅋ 문라이트 기대해볼게요  
20170220,10,이미 작품성을 인정 받은 영화라 믿고 볼 수 있을듯  
20170220,9,웰메이드무비라는 말은 이런 영화에 쓰는 말이다ㅎㅎ  
20170220,10,완성도도 높고 작품성도 확실히 있음  
20170220,10,시사회 반응도 좋고 해외 평들도 좋으니 믿고 볼 수 있겠네ㅋㅋ  
20170220,10,간만에 볼만한 영화다운 영화가 나왔네  
20170220,10,마이애미 꼭 가보고싶은 나라 중 하나로 추가요~~  
20170220,10,골든글로브 최우수 작품상ㄷㄷ..  
20170220,10,포스터와 예고편만으로도 기대됬던 영환데 곧 만나 볼 수 있겠네요  
20170220,10,유명하지 않은 감독과 배우들이였는데도 불구하고 멋진 작품을 탄생시켰다  
20170220,10,저번에 시사회 갔다 왔는데 영화 정말 좋더라구요~ 블랙 너무 멋있었어요^^  
20170220,10,문라이트 짱짱.. 인생영화 찾은듯  
20170220,10,연기 연출 스토리 정말 최고였다  
20170220,10,역시라는 말이 절로 나오는ㅋㅋㅋ  
20170220,10,몇일 전 시사회로 보고나서 요 몇일 동안은 아직도 생생하게 기억에 남더라구여  
20170220,10,많은걸 느끼게 해주는 영화.. 이런 영화 좋아요~!  
20170220,9,간만에 영화다운 영화 한편^^  
20170220,10,완벽 그 자체.. 꼭 봐야되는 영화가 바로 이거다..  
20170220,10,내 인생영화 중 하나가 될 듯 한ㅎㅎ  
20170220,9,무언가 이영화속에 묵직하게 자리잡고 있다. 다만 아직 내가 많이 부족한것 같다. 장담하건데 지금도 충격적이지만 5년뒤에 보는 이영화는 나에게 더 많은것을 말해줄것같다.  
20170220,10,영상도 연출도 모든게 아름다운 영화ㅎ  
20170220,10,개봉하면 엄청날것 같아요ㅜㅜ 근데 보니까 상영관이 별로 없는거 같아서 너무 아쉬워요.. 진짜 이런 영화가 잘 되야 할텐데ㅜㅜ  
20170220,10,보고나면 그냥 마음에 훅 들어 옴  
20170220,10,진짜 미쳤다 이 영화.. 왜 이렇게 극찬을 받나 했더니 보고 나니까 알 것 같아  
20170220,10,영화의 완성도는 높고 작품성은 확실히 있네요  
20170220,9,마지막 블랙의 swag가 너무 멋있었어..  
20170220,10,많은 사람들에게 인생영화가 될 것 같은ㅋㅋ 개봉일날 또 보러 갈거임  
20170220,10,시사회 갔다 온 뒤로 주위 사람들에게 추천 중인 영화에요~  
20170220,10,감독의 연출력이 빛을 본ㅋㅋ 너무 아름답잖아  
20170220,10,내가 여태까지 본 영화들 중 가장 인상 깊었던 영화가 아닐까 싶다ㅎㅎ  
20170220,10,대사 하나하나 장면 하나하나 모든게 좋았음  
20170220,10,"인종,성,나이에 대한 편견을 모두 잊게 해주는 영화, 문라이트  "
20170220,9,영화를 보고 집으로 가는 내내 어찌나 많은 생각들이 들던지.. 개봉하면 한번 더 봐야겠어요  
20170220,10,브래드피트가 제작한 영화들은 정말 실망 시킨적이 없었다 이번에도 기대할 수 밖에  
20170220,10,역시 대단한 작품이였어  
20170220,10,헐리우드 감성 천재 감독이 만들었다고ㅋㅋㅋ 이건 꼭 봐야해!  
20170220,10,많은 사람들이 보고 느꼈으면 좋겠어여..ㅎ  
20170220,10,빨리 보고싶음 진짜ㅠㅠ 그래도 낼모레 개봉이네ㅠ  
20170220,10,"인생, 삶에 대해 다시 한번 생각해 볼 수 있었던 영화..  "
20170220,9,재미와 감동 그리고 진한 여운까지 쉽게 잊지 못할거 같아요  
20170220,10,정말 대단한 영화지ㅎㅎㅎ 상영관 수 좀 팍팍 늘려라  
20170220,10,외신들이 왜이렇게 극찬를 하고 많은 영화상을 받았는지 영화를 보니 알 것 같아요 좋은 기회로 좋은 영화 감사합니다ㅎㅎ  
20170220,10,내가 기대했던거보다 훨씬 더 좋았던 작품  
20170220,10,영화 마지막에 느껴지는 그 감정은 정말 표현할 수가 없다.. 이건 꼭 보시길  
20170220,10,문라이트 기대할 수 밖에 없음  
20170220,10,오랫동안 내 기억 속에 남을 영화다 시사회로 만나 보고 왔지만 개봉하면 한번 더 볼 생각이다  
20170220,10,하 상영관수.. 이런게 진짜 영환데..  
20170220,10,2017년 올해의 명작  
20170220,9,맨날맨날 예고편만 돌려 보는 즁ㅎ  
20170220,10,개봉일만 기다렸는데 드뎌 2틀 밖에 안남았다ㅠㅠㅠ  
20170220,10,예고편만 봤는데도 깊이가 다르던데 빨리 보고싶어요~  
20170220,10,와 문라이트 드디어 한국에서도 개봉하네여!!  
20170220,10,우리가 한번쯤은 꼭 봐야 할 영화  
20170220,9,극찬 받은 이유가 다 있었네ㅋㅋ 이런 영화를 볼 수 있다는거 만으로도 영광임  
20170220,10,해외에서 극찬 받고 있는 작품이라 더 기대되는거 같아요 빨리 만나 보고싶습니다  
20170220,10,정말 좋은 영화 문라이트.. 상영관 많아서 많은 사람들이 봤으면 좋겠다  
20170220,10,나의 인생영화가 될 것 같다!!!  
20170220,10,보고 느끼고 생각할게 정말 많은..ㅎㅎ  
20170220,9,좋은 기회로 좋은 작품 먼저 보고 왔네여ㅋㅋㅋ 정말 좋았어여  
20170220,10,이런 영화를 평생 기다렸다는 LA타임즈의 평을 보고 개봉일만 손 꼽아 기다리고 있네요 영화를 좋아하는 저로썬 정말 기대가 큰 작품입니다.  
20170220,10,드디어 국내개봉ㅠㅠ 개봉일만 기다리고 있다  
20170220,10,민감하게 다뤄질 수 있는 동성애 코드로 어떤 명작을 만들어냈을지 너무 궁금합니다  
20170220,10,개봉예정영화들 중에서 가장 궁금한ㅋㅋㅋ 대체 어떤 영화길래 빨리 보고싶음  
20170220,9,시사회 갔다 온 친구가 정말 대박이라며 꼭 보라고 했었는데 개봉하면 꼭 봐야겠어요ㅎㅎ  
20170220,10,가슴 울리는 진한 여운이 남는… 오랜만에 깊었던 영화가 아닌가 싶다  
20170220,10,가슴 먹먹하고 아직도 생각남… 시사회로 봤지만 내 돈주고 봐도 전혀 아깝지 않을 영화  
20170220,10,탄탄한 시나리오와 탄탄한 연출~ 문라이트 파이팅입니다~  
20170220,9,이건 두번 세번 봐야 할 작품이다  
20170220,10,생각했던거 보다 훨씬 더 좋았던 영화.. 개봉하면 한번 더 볼 예정  
20170220,10,기대가 큰 영화 문라이트! 빨리 보고싶어요!  
20170220,10,골든글로브 최우수작품상을 수상한거면 이미 인정받은 영화지ㅋㅋ 빨리 보고싶다  
20170220,10,정말 기대되는 영화ㅜㅜ 개봉일만 기다리구 있음!!  
20170220,10,이게 그 영화상 137관왕을..  
20170220,10,시사회 이벤트 당첨되서 보고 왔는데 진짜 재밌습니다 오랜만에 영화보고 많은걸 느끼며 생각하게 됬네요  
20170220,9,시사회 끝나고 여운이 아직도… 감동 그 자체인 영화  
20170220,10,이 영화가 나에게 어떤 영향과 생각을 줄지 너무 기대된다  
20170220,10,시사회 반응도 엄청 좋던데 ㅎㅎ  
20170220,10,찾아보기 드문 스타일~~ 너무 좋다^^  
20170220,10,유명한 감독이나 배우가 없음에도 불구하고 이런 뜨거운 관심을 받는건 그럴만한 영화이기 때문!  
20170220,10,보편적인 이야기를 이렇게 만들어 낼 수도 있구나.. 시선을 뗼 수 없게 만드는 연출력은 정말 최고였다  
20170220,10,"인종, 성, 나이를 모두 떠나 모든걸 잊게해주는 영화  "
20170220,10,"내용은 물론 영상미,OST 등 모든게 완벽하다  "
20170220,10,제목이 너무 예뻐요.. 기대중입니다  
20170220,10,인생영화를 만났다.. 아카데미 휩쓸어도 이상하지 않을듯  
20170220,9,포스터부터 강렬한 느낌!  
20170220,10,플랜B에서 제작했다는 것만으로도 인정할 수 밖에 없는 영화  
20170220,10,감동이 어느정도인지는 직접 본 사람만이 알 수 있다  
20170220,10,큰 울림을 선사할 것 같아요..  
20170220,10,모든 이들의 인생에 바치는 영화. 소개문구부터 가슴에 와닿네..  
20170220,10,개봉하면 한번 더 보고싶을 정도로 여운이 강해요ㅜㅜ  
20170220,10,브래드피트 제작사인 플랜B에서 만든 영화는 실망 시킨적이 없다  
20170220,8,"""리틀도 아닌 샤이론도 아닌 나, 블랙""  "
20170220,10,와 이게 바로 그 헐리우드 감성 천재 감독이 만들었다는 그영화?ㅋㅋㅋ  
20170220,10,세계적으로 인정받고 있다는 문라이트~!! 빨리 보고파용+_+  
20170220,10,기다리고 있는 영화!! 본 사람들이 다 좋았다고 하니까 더 기대됨 ㅎㅎ  
20170220,9,보는 내내 자비에 돌란이 떠오른건 왜일까  
20170220,10,감정은 뼈대를 만들고 사람은 사람을 만든다  
20170220,10,영화를 보기 전과 본 후의 기분이 매우 다르더라..  
20170220,10,"오랜만에 만족스런 영화를 봤습니다. 연기, 비쥬얼은 물론 대사 하나하나 다 가슴에 와닿네요  "
20170220,10,보이후드의 흑인 버전을 보는 듯? 작품성이나 퀄리티는 그 이상임  
20170220,10,영화보고 마이애미를 급 가고 싶어진 1인 ㅎㅎㅎ개봉하면 난리날듯요?ㅎㅎ  
20170220,10,기억 저편에 외롭게 남아있는 자아와 인생의 애환을 끄집어내는 작품.무의식적으로 눈물이 흐르게 하는 영화다.  
20170219,10,"걸작, 내 인생 영화 중 하나가 될듯  "
20170219,10,"개인적으로 완벽한 영화같습니다. 물론 제가 영화덕후라 그런 것도 있지만, 소장해두셨다가 나중에 또 보시면 분명히 새로운 느낌이 들 그런 영화입니당  "
20170219,10,최근 본 영화 중 진짜 인정할만한 영화였음  
20170219,10,은은할 뿐 영원히 존재하는 달빛같은 상흔. 배리 젠킨슨 감독의 천재성이 물씬.  
20170219,10,믿고보는 플랜B!! 반응 엄청 나던데!!  
20170219,10,시사회 다녀온지 꽤 되었는데 아직도 감동에서 벗어나질 못하곘네요  
20170219,10,'노예 12년'도 인상깊었는데.. 브래드 피트가 작품보는 눈은 있는듯.  
20170219,1,도무지 무슨 영환지 갈피를 잡을 수 없는데.. 흥미진진하지도 않고 그냥 아무생각없이 보게 되다가 갑툭튀하는 동성애에 놀람그냥 상 휩쓸었다고 하니까 물타기해서 재밌다고 하는 것 같은데 영..조작된도시보다 재미없음  
20170219,9,놀랍습니다~ 이렇게 아름 다울수 있다니~~  
20170219,8,"바닥,  그 슬픔. 그리고 나를 알아줄 단 한사람  "
20170219,10,너무 잘만들어진 영화! 극찬 받는 이유가 있었다  
20170219,10,아카데미 수상이 유력하다던데 ㅎㅎ기대중 ㅎㅎ  
20170219,10,사랑에 대해 다시한번 생각해볼수있었던..  
20170219,10,연출력에 놀라고 아름다운 영상미에 놀라다  
20170219,8,대사 하나하나가 섬세하고 인물의 감정선도 좋았다. 다만 중반까지 의미심장한 장면들과 대사를 이해하기 어려웠다.  
20170219,10,"사람은 인종과 나이, 학벌과 장애, 빈부의 구분없이, 누구나 위대한 생명과 각자의 삶을 가지고 있음을 극히 평범하고 소탈하게 표현한 최고의 영화이다.  "
20170219,10,잔잔함과 과묵함 속에서 시간이 가는 줄 모르도록 끊임없이 새어나오는 감동.  
20170219,6,보통의 흑인은 아니었다능....  
20170219,1,상 많이 받은 영화는 재미없다는 공식을 다시한번 일깨워준 영화. 영화늘어지고 내용도 그다지  
20170219,7,세명의 블랙이 펼쳐내는 섬세한 감정묘사와 성장으로 마침내 완벽한 정체성 발견의 샤  이  론  탄생...감독의 포인트가 조금은 빗나간 느낌...;;  
20170219,10,달빛 아래에선 모두 푸르다. 꼭 보세요.  
20170219,7,"한 동성애자 흑인의 비참한 삶과 자아찾기. 찰스디킨슨의 ""위대한유산""과 플롯이 유사.  "
20170219,10,"대사 하나하나 시를 읽는 듯한 느낌을 주는 영화, 처음 느껴보는 감동  "
20170219,10,엄청난 영화가 개봉을 앞두고 있는듯.  
20170219,10,기대할 수 밖에 없는 이유가 충분하다  
20170219,8,"기대는 많이 했으나,쉽지 않은 영화  "
20170219,10,호평을 받는덴 다 이유가 있겠지~~  
20170219,1,도대체 감독은 무엇을 나타내려고 한건지 모르겠다. 보고난후에 후회할 사람들 많을듯. 나처럼...  
20170218,10,그저 '영화'가 주는 여러 감정들 사이를 따라가다보면 마지막엔 카타르시스를 느낄수 있을것.  검은 상처와 덧없는 시간이 푸른 달빛으로 치유받는 이야기  
20170218,10,영화 스토리만 봐도 뭉클..  
20170218,8,장담하는데 아카데미 작품상 못받는다. 동성애 소재 때문에 인정 받게되는 부분이 있다. 보이후드 동성애 버전이거나 그냥 좀 잘만들어진 캐롤 니거판 영화정도?  
20170218,5,최악의 경험입니다 택시비15천원에 영화비10500원  날렸습니다 광화문 가다 길에 돈뿌린 것 처음입니다  
20170218,6,흑인 게이 소재를 담담하게 풀어냈고 카메라의 너무나 자연스러운 움직임이 좋았다... 하지만 난 별로였다. 기대를 너무 했는지 몰라도 어떻게 보면 별 내용도 없고 와 닿지도 않았다. 올해 내가 본 영화 중 기대에 비해 큰 실망한 영화.  
20170218,10,좋아요 느낌 있어요 아주 섬세한 감정을 묘사하고 있어요  
20170218,9,그 사람의 인생이 변화하는 3가지 사건이 영화를 통해 드러남으로써 어떻게 그 사람이 되었는지 생동감있게 느낄 수 있었다! 수작이다!  
20170218,10,올해 최고의 영화라는 말이 있던데 궁금ㅋㅋ  
20170218,7,첫번째와 두번째 에피소드가 좋았습니다  
20170218,8,아름다운 영화입니다.  
20170218,6,덤덤하지만 아름다운 영화다. 영상미가 무척 좋다  
20170218,10,157관왕;; 덜덜;; 어마어마하다;;  
20170218,6,"솔직히 말하면, 정서적으로 너무 안맞다. 그리고 등장 인물들의 과거와 미래에 개연성이 잘 안느껴졌음...  "
20170218,7,전체적인 색감과 촬영 구도는 남달랐지만 스토리를  끌고가는 힘은 부족했음  
20170218,10,마음을 적셔주는 영화였어요:)  
20170218,10,영화팬들이라면 다 기다리고 있지 않을까 싶다  
20170218,1,진짜 욕나온다 씨발...  
20170218,10,시사회 갔다왔습니다. 보고나서는 감정이 오지 않습니다. 보고서 걸어가는 동안 글로 쓸 수가 없고 말로 설명할 수 없는 감정이 찾아옵니다. 마음이 벅차네요. 집가는 길에 눈물이 나네요. 달빛에 비친 모든 삶은 공평합니다.  
20170218,4,흑인감성+영상미+성장드라마현대미술관에서 작품보는 느낌  
20170218,10,브래드 피트가 총괄 제작한 작품! 기대된다!!  
20170218,10,아 기대되요!! 로튼 신선도 98이라니; 덜덜덜  
20170218,10,굉장히 세련되고 인상 깊은 영화  
20170218,9,"제목처럼 밤그늘에서 빛나는 영화, 달빛은 모든 것을 비추지 않는다  "
20170218,1,내 2시간을 버렸다 돌아오지 않을 나의 소중한 시간  
20170218,2,waste of tiime.  
20170218,6,핵심적인 건. 소재의 문제가 아니라 표현의 지루함이 문제. 심오한 주제를 흥미롭게 더 몰입감있게 표현하는 영화들이 얼마나 많은데.. 실망했음 기대가 너무 컸나봄.  
