0,1,2
20170802,10,"예약 진즉 벌써부터 했습니다. 그냥 보는 것만으로도 프랑스 여행을 다녀온 듯한... 그런 느낌의... 다이안 레인, 너무 아름답고요~ 정말 오래간만에 제대로 기대되는 영화입니다.  "
20170802,8,빠리여행하고 싶은 영화! 아~~가야해  
20170802,9,프랑스에 가고싶게 만드는 영화.아름다운 풍경. 낭만적 모습.좋아요~~^^  
20170802,8,인생을 즐겁게도 아니면 밋밋하게 갈 수도 있음을 다시 생각하게 한다.  
20170802,10,프랑스 여행을 하고온 느낌이에요! 최고!!  
20170802,10,당장 가야겠다 프랑스로!!  
20170802,8,앤의 솔직하고도 깔끔한 성격이 잘드러나 쟈크의 바람이 넘어가지않고 그녀의   새로운삶을 찾을수있는 능력을 찾게되는 멋진영화다  
20170802,8,여성의심리 를 잘이해할수 있었다  
20170802,8,와인을 궁금하게 한 영화!  
20170802,8,프랑스로 자동차 여행한 느낌!  
20170802,9,파리의밤이 열리면이랑 비슷한느낌이지만 더 음식에대한 깊이감이 있어서 좋았어요~  
20170802,10,좋아요  멋있는 영화입니다  
20170802,8,프랑스를 볼 수 있어서 좋았어요  
20170802,10,장난아님이건꼭봐야해!넘재밌었음  
20170802,9,"영화로 프랑스 로드 트립을 다녀온 기분, 식도락가가 된 기분을 느낄 수 있는 영화!  "
20170802,10,"여름 휴가 첫 날, 지금 보러가고 있는데 완전 기대중♡  "
20170802,9,좋았어요 좋았어요 좋았어  
20170802,9,"""파리로 가는 길""에는 프랑스의 절경과 요리가 있다. 여행안내 책자 보다 친절하고 등장인물들의 미묘한 감정에 설레이고...  "
20170802,10,인생영화에요... 휴식과 위로가 필요한사람들 에게 딱인 영화..  
20170802,8,파리로 가는 길... 영화보는 내내 여행가고 싶다~ 여행가고 싶다~ 100번은 생각한 영화~  
20170802,9,프랑스남자의 진수를 볼 수 잇는 영화  
20170802,8,지나치게 로맨틱한 프랑스 남자와 워커홀릭 미국 남자의 극명한 대비... 지나치게 러블리하지만 영화 속 음식은 맛이 궁금하네요  
20170802,10,파리로 가는 길 최고!!!!  
20170802,9,내 삶을 되돌아 본 최고의 영화  
20170802,9,나를 돌아보는 좋은시간 너무 좋은화예요  
20170802,10,매력적인...너무나 매력적인...  
20170802,8,재미 짱 있었어요~~!!  
20170802,6,잘봤어요 맛있는식사를 하고 싶은..  
20170802,9,잔잔  재미있는 영화 추천  
20170802,10,넘 나안적어었어요파리가고싶어요  
20170802,8,나름 재밌게 봤네요프랑스남자와 미국여자와의 로맨스굿!  
20170802,10,잔잔한 여행 느낌임 좋아요  
20170802,8,재미있엏어요  추천합니다  
20170802,10,영화품위있네요  진짜!  
20170802,10,"편안하게 볼 수 있는 영화, 프랑스의 맛과 멋을 서울에서 고스란히 느낄 수 있었음  "
20170802,9,생각보다 재미있었어요  
20170802,6,나의일상과 흡사한느낌 ㅋㅋㅋ  
20170802,9,굿굿 최근 영화중 최고였습니다  
20170802,7,"홍보는 '냉철한 미국 남자, 낭만적인 프랑스 남자, 어떤 남자가 더 좋을까?'라고 했지만 사랑에 중심을 두지 않은 여성 자신의, 여성 중심의 이야기. 대부의 프란시스 포드 코폴라 감독의 아내인 엘레노어 코폴라 감독이 80세에 만든  첫 영화.  "
20170801,10,제발 상영관 좀 주세요.. 입소문 나서 상영관 늘어났으면..부산인데 적어도 서면에 한 곳..아니 한 회라도 상영해야 하는거 아닌가??보고싶다ㅠㅠ  
20170801,10,시사회당첨되서 봤는데 진짜 최고에요 여행가고싶어지는 영화  
20170801,9,남자들 힘들어지겠구나 ㅜㅜ  
20170801,10,"시사회로 봤는데 개봉하그면 또 볼 예정이다ㅋㅋ프랑스도 프랑스지만, 다이안 레인이 너무 반짝반짝 빛난다:)  "
20170801,7,다이안 레인과 함께한 유쾌한 프랑스 여행.  
20170731,9,프랑스 여행 한 기분 듦! 꼭 보세요!!!! >.<!!!!  
20170731,10,다시보고 또보고 싶어용  
20170731,9,여행가고 싶은 영화에요 다이안 레인은  역시 !! 굳!  
20170731,7,배부른 영화.즐거운 영화  
20170731,10,유쾌한 영화!!사랑넘치는 프랑스로 여행가고싶어지네요!!  
20170731,10,영화보는내내 먹고싶어지는 영화~유쾌하고 재밌었어요!  
20170731,9,지루하지 않은 프랑스 로드무비.  
20170731,9,여름과 너무 잘 어울리는 영화네요다이안 레인 너무 예쁨!!  
20170731,8,계획된 남자의 의도가 구여웠다.재있게 보았어요.  
20170731,10,"영상, 음악, 연기 너무 만족스러운 영화입니다~!! 프랑스 곳곳의 여정들을 간접적으로 볼 수 있답니다~!!  "
20170731,10,영상미도 좋고 힐링되는 영화!!  
20170731,10,영회 보는 내내 와인이 마시고 싶엇던...  
20170731,10,영상도 예쁘고 내내 파리로 여행하는 기분이었다:)  
20170731,10,너무 위트넘치고 사랑스러운 영화! 반했어요  
20170731,10,로맨틱한 휴일을 위한 영화! 힐링여행을 떠난 기분!  
20170731,9,가슴 설레는 칸에서 파리가는 프랑스 지방도로여행!  
20170731,9,러블리함이 넘치는 영화♡♡♡  
20170731,9,음식 맛있겠다 싶었다.  
20170731,10,우연히 차로떠나는 파리로드의 길은 순탄치않다.하지만 자크의 해박한 지식으로 멋진 음식과 주변 관광지를 고루 둘러보며 묘한 감정이 싹트지만 적정선을 유지한채 희노애락이 잘 담겨있는 영화네요.  
20170731,10, 프랑스가 아니더라도 어디론가 떠나고 싶게 만드는 영화네요.  
20170731,10,좋다 잼있다 파리가고싶다  
20170731,10,기대 그 이상의 영화네요재밌게 잘 봤어요쵸콜릿과 여행이 땡기는 영화~  
20170731,9,프랑스는 여행하는 기분으로 봤는데 꼭 보세요.  
20170731,10,이미 프랑스에 다녀온 기분이에요! 너무 행복한 시간이었어요:)  
20170731,9,여행 갔다온 듯 해요!!  
20170731,9,지금 당장 파리로 달려가고싶은 영화~!!  
20170731,10,두 시간동안프랑스 여행을 한 듯한 느낌이었습니다 추천합니다  
20170731,9,볼게 많은 영화!! 다이안 레인이 정말 예뻤다  
20170731,9,너무 멋진 영화예요 꼭 보시기를..  
20170731,10,파리로기는 그 여정이 너무 로맨틱 정말 가고 싶어요  
20170731,9,짱 제미리ㅛ어요+^^  
20170731,10,너무 재밌었어요.힐링되는 영화.볼거리 가득해서 좋았어요~^^  
20170731,9,잔잔한데 재미있는 영화 간만에 힐링하고 나옴  
20170731,9,웃기고  재미있어요 저절로 웃음이 나오네요  
20170731,8,계획없이 가는 여행의 묘미를 느끼게 하는 영화  
20170731,10,작업은 이렇게 하는 거다 남자들아...  
20170731,10,파리로 빨리 가고 싶어지는 영화입니다  
20170731,10,잔잔하면서 유쾌한 영화인데 파리의 모습을 잘보여주는 영화입니다  
20170731,10,내가 하거싶던 바로 그 여행  
20170731,10,다이엔 레인이 너무 매력적. 누군가 나를 이런 여정에 데려가준다면 없는 사랑도 생길 것 같다. 맛있고 멋있고 재미있는 영화!  
20170731,10,프랑스 잘다녀욌어요 아를다워요  
20170731,9,프랑스의  아름다운곳과 맛잇는  음식들이  좋았어요~  
20170731,10,프랑스의 문화나 음식에 대해서 많이 알 수 있었고 영화 자체가 감동이었습니다~~  
20170731,10,낭만적이네요^^ !!!!  
20170731,10,낭만을 찾아 떠나는 그런 90분  
20170731,10,영화 감동입니다 ㅠㅠㅠ 꼭 보세요!!!!  
20170731,9,파리로 가는 아름다운 로드무비  
20170731,10,너무 이쁘고 힐링되는 영화!  
20170731,10,재미 있게 봤습니다..  
20170731,10,오감 만족!  여행하는 기분이었어요  
20170731,10,잼나요 추천용 ㅎㅎ 소소하게웃김  
20170731,9,재미있어요 여행하는 느낌  
20170731,9,사랑스럽고 발칙하다.  
20170731,9,파리의 아름다움에 취했어요~강추!  
20170731,9,파리로 힐링 가고 싶어졌어요~!!  
20170731,10,아름다운 프랑스의 여러 곳이 넘넘 환상적이라 왠지 멋진 일이 생길것 같은 예감에 진짜 가고 싶어지네요.~~^^  
20170731,9,파리 로맨틱 향기 느껴 보고파 ...  
20170731,8,파리로 가는길을  보니  한편의 수채화를 감상하는듯  한아름다운 영화네요!  
20170731,10,예전에 유명했던 탈렉볼드윈과 다이안레인의 모습을 다시 볼 수 있어 반가웠던 영화!  일상에 지쳤던 마음에 단비처럼 위로와 휴식을 선물받은 영화라 더욱 좋았다. 물론 시사회 초청되어 아들과의 뜻밖의 데이트도 굿~~^^  
20170727,10,파리로 여행하고 싶게 만드는 프렌치 로드 트립. 아름다운 프랑스의 풍광과 맛있는 음식들. 낭만가득한 설레임까지...눈이 즐겁고 마음이 행복했던 영화.  
20170727,9,대책없는 프랑스남자와의 영화내내 유쾌하고 맛있는 먹방여행이었습니다. 영화 보는 동안 잔잔한 웃음이 나오는 영화였어요~~^^  
20170727,9,주인공들의 여행이 끝나질 않길 바라는 마음이 드는영화!!  
20170727,9,아름다운경관과 음식들이  매력적이었어요.  
20170727,10,현대판 로마의 휴일. 안행복한데 행복한다고 자꾸 물어봐. 행복해지고싶게.  
20170727,10,프랑스 여행 같은 영화 너무 좋았어요  
20170727,10,"떠나고 싶은 분, 사랑에 빠지고 싶은 분에게 강력 추천하는 영화입니다. 스크린으로 보는 것만으로도 행복 충전!!  "
20170727,9,프랑스 여행하는 기분이었다!! 가고 싶다!!  
20170727,8,영화 정말 잘 만든것 같아욤 카메라 기법이랑 이런게 되게 좋았어욤 ㅋㅋ 조금 살짝 지루햇던거 빼궁 ㅎ  
20170727,10,즐겁고 유쾌한영화 여행을가고싶다..  
20170727,10,영화관에 앉아서 낭만 가득한 푸란스 곳곳을 여행하는기분이네 힐링합니다~^^  
20170727,9,기대안했는데 재미있었습니다!  
20170727,9,여행을 떠나고싶게 하는영화네요  영화를 보는 내내 행복했습니다  
20170727,10,바쁜 일상을 잠시라도 벗어날 수 있는 행복한 영화입니다~^^  
20170727,8,잔잔한감동이있네요!간만에힐링~  
20170727,10,라이카의 뽐뿌가 오는 프랑스 영화  
20170727,10,로맨스 영화 별로 안좋아하는데 재밌었어요!!  
20170727,7,"프랑스 여행 가고 싶게 만드는 영화. 멋진 영상,맛있는 요리, 멋진 음악...여행의 필수 3요소를 조화롭게 보여주는 영화!  "
20170727,9,음식이 맛있어 보였다.  
20170727,10,정말 아름다운 영화였어요 굿!!  
20170727,8,아름다운 프랑스와 아름다운 이야기를 기대해보세요.  
20170727,8,유명관광지가 아닌 현지인 만이 알수있는  ㅇ섯진ㅈ곳을ㅈ보여줘서 좋았어요^^  
20170727,8,내 영혼을 살찌우는 법에 대한 영화.  
20170727,10,패밀리 비즈니스의 좋은 예  
20170727,8,잔잔하고 아름다운 영화  
20170727,8,배경이 여행가듯이  넘 좋으네요  
20170727,9,화면이  함께여행하는듯  너무  예뻐요!!!!  
20170727,10,"프랑스를 다 돌아다 본 것 처럼, 너무 설레고 행복하고 배부른 여행이었어요. 인생에 저런 인연을 만날 수 있을까. 저런 꿈 같은 일이 벌어질 수 있을까// 나는 그럴거라고 믿어요 :)  "
20170727,8,본격 프랑스 지역 균형 발전 기원 영화  
20170727,8,정말 맛있는 영화네요~~  
20170727,10,10년전 파리 여행을 다시 떠올리면서 좋았던 기억을 회상해보는 영화  
20170727,9,넘 재미있었어용  꼭보셈  
20170727,10,정말 낭만적인 영화네요  
20170727,9,저도 같이 여행하는 기분재밌었어요 영상 이뻐요  
20170727,10,오래만에본로맨틱영화  
20170727,9,여행을다녀온느낌이네여  
20170727,9,파리의 명소가 아니더라도 곳곳의 풍경이 너무 아름다웠고 눈이지만 다양한 음식을 즐길 수 있어 행복했습니다  
20170727,8,맛있고 사랑스런 프랑스를 여행해보자  
20170727,10,시사회로 봤는데 진짜 프랑스 여행을 한 느낌이네요!  흘러나오는 음악도 좋고 신선한 느낌ㅎㅎ 정말 잘 봤습니다.  
20170727,8,"프랑스로 여행가고 싶어지는 영화^^보다 보면 초콜릿에 에스프레소, 치즈에 와인한잔 먹고 싶어지는 영화  "
20170727,10,여행의 묘미를 환상적으로 살린 영화네요 낭만적인 여행 꿈꾸는 모든 사람에게 추천  
20170727,10,오늘 시사회왔는데 정말 감동입니다.명배우와 잔잔한 여행 짱이에요  
20170727,10,50대가 보면 짱 좋은영화예요~ 대박 느낌^^  
20170727,10,b열 33번 잔잔하게 잼있어요  
20170727,10,지금 당장 파리로 달려가고 싶었네요. 보는 내내 행복했어요.  
20170727,10,미소지으면서 봤어요 행복한 영화  
20170727,10,다이안 래인과 함께하는 프랑스 먹방 트립무비! 카메오로 등장하는 엘레노어 여사도 찾아보시길  
20170727,10,정말 이런 여행하고 싶네요. 영화 보며 함께 에행한 것 처럼 행복하네요. 굿~  
20170727,7,본격 프랑스에 가고 싶게 만드는 영화 !!여행가고싶다  
20170727,10,여행가고싶게 만드는 영화네요잘봤습니다.  
20170727,8,휴가는 이걸로 대신합시다 ㅋㅋ로드트립이 따로 없군요! 스토리는 살짝 빈약하지만 은근 자미나용!!  
20170727,9,영화와 함께 하는 프랑스 여행 완전 좋아요!!오랜만에 보는 다이안 레인 넘 좋아요^*^  
20170727,10,파리 파리  유럽중 제일 가고 싶은 곳  그리고  프랑스  남자들의 멋진  여유로움등 참 멋진  여행이었습니다  
20170727,10,파리로 가는 아름다운 여정 너무 이쁘네요!  
20170727,10,파리로 가는길 보고 파리로 여행가고싶어졌어요 ^^  
20170727,8,"여전히 아름다운 우리 시대의 배우 ""다이안 레인"" 그녀와 함께 떠나는 파리로의 여행에 초대받는 느낌이네요. 힐링을 원하시는 분께 강추드립니다.  "
20170727,9,시사회에서 봤어요~~ 별내용도 없지만 그 길을 같이 따라 가면서 행복했던영화  
20170718,10,나도 데려가주라 파리!  
20170717,10,여행 떠나고 싶네 만드는 영화네요 ㅎ 음악이 완전 취향저격  
20170717,10,요즘 여행 뽐뿌 오는 영화들로 대리만족중임 ㅠㅠ  
20170717,10,예고편 봤는데 여행뽐뿌각!!  알렌볼드윈 매력적으로 나올듯~ 기대기대  
20170717,10,비포 시리즈 같은 느낌이 들어서 더욱 기대된다! 영상미도 좋고 이런 감성 돋는 영화 좋음  
20170717,10,영화 색감이 너무 좋네요! 빨리 보고싶어요  
20170717,10,영상미 너무 예쁘네ㅠㅠ 진심 취향저격이다ㅠㅠㅠ  
20170715,1,이젠 영화에서 까지 바람피우는걸 남자탓하네ㅋㅋ 불륜조장 오지구요  
20170715,1,본격 불륜조장 영화 남편이 소홀했으니 바람피워도된다?ㅋ 그냥 이혼하고 남자만나면 누가 뭐라 그러니?  
20170712,10,영화색감부터 완전 취향저격!!ㅠ  
20170712,10,파리 가고.. 싶게 만드네.. ㅠ  
20170629,10,다이안 레인  출연 영화는    다  본다  
20170629,10,예고편 너무 예쁘다ㅠㅠㅠㅠ 배우도 예쁘고 나도 파리 가보고 싶다!  
20170628,10,영상미 대박.. 예고편 보니 영화 차제가 이쁠듯!! ㅋㅋ 파리 가고 싶어짐ㅠㅠ  
20170628,10,이런 영화 너무 좋다 ㅠㅠ 힐링하면서 보고싶은 영화!  
20170627,1,마피아 코폴라 집안  안주인 납시었네  
20170627,10,"다이안레인 아직 까지 여신이시네.. 슈퍼맨 엄마로 나올때는 많이 나이든것 같았는데, 실제는 아니네요  "
20170622,10,다이안 레인은 진짜 곱다...  
