0,1,2
20170521,10,"일본 원작도 좋아했어서 한국판도 너무기대됩니다. 류준열,김태리 배우조합도 기대되구요. 개봉하면 꼭 보러가려고 합니다.  "
20170521,10,태리배우의 명품연기가 기대됩니다~  
20170521,10,김태리배우 기대만발이네요..아가씨에서부터 팬입니다.앞으로도 승승장구하시길..:  
20170521,10,기대됩니다~^^ 응원할께요♡♡  
20170520,10,김태리 배우의 연기가 기대되는 작품입니다.  
20170520,10,영화 너무 기대됩니다!!김태리 화이팅!!  
20170516,10,원작영화 봤는데 너무 취향저격입니다 거기다가 김태리 류준열 이라니 세상에  
20170512,10,원작 넘 재밌게 봤는데 류준열 김태리 조합은 어떨지 기대됩니다~  
20170512,9,저희 옆마을에서 촬영하는데 너무 기대되요...ㅋㅋ 이런 촌동네에 영화촬영을 하다니!... 기웃거리면..김태리 볼수있나요..ㅋ... 여잔데도 류준열 보다 김태리 보고싶은마음..  
20170511,10,우와 일본 원작이였구나  기대 준열...정말  기대 할게욤 일본원작은 뛰어넘아 보잣 열아♧  
20170507,10,류준열ㅠㅠ 앓다 죽을 준열이의 영화라니ㅠ 꼭 보러 갈게요!!  
20170507,10,잘찍었음 좋겠다아..  
20170505,10,그래 이런 영화부류 많이나와라 슬픈거면 더좋다  
20170504,10,담백한 영화에 류준열씨가 양념을 너무 많이 치지 않았으면 해요.  
20170503,5,영 좋은 느낌이 안드는데...  
20170421,10,정유미가 했어도 잘어울렸을듯  
20170419,10,지용님도 나오신다는데 기대됩니다~!  
20170331,10,김태리 작품선택 넘 최고네...  
20170321,10,태리여신♡♡♡작품좀마이해줘요ㅠㅠ  
20170321,10,임순례 감독님 류준열 배우 김태리 배우만으로 넘 기대하고 보고 싶은 영화 0순위입니다  
20170313,10,원작도 감동적이었는데 류준열이 나온다니 너무 기대됩니다^^  
20170301,10,한국 정서에 맞게 나올지 일본감성을 살리면서 갈지 궁금하네요  
20170227,10,진짜 기대되는 영화!!! 사랑합니다 류준열ㅜㅜ  
20170224,10,류준열 김태리 캐스팅 좋네요 기대됩니다 !  
20170223,8,하시모토 아이 때문에 봤다가 영화에 빠졌었는데 이게 우리나라에서 리메이크 된다니.. 게다가 감독과 출연배우 라인업 때문에 기대감이 더 크다ㅋㅋ  
20170221,10,영화 너무 기대됩니다!!!!  
20170219,10,김태리 너무 좋다 ㅠㅠ 자기와 맞는 작품을 잘 선택하는듯! 사랑해욤태리  
20170213,10,정말 기대하고 있습니다!!  
20170213,10,기대하고있어요~~!  
20170213,10,김태리님 연기 기대되내요~  
20170213,10,김태리님 화이팅하세요~꽃길만 걸어요~  
20170213,10,정말 기대됩니다!! 정말 보고싶어요!!  
20170213,10,김태리님 아가씨에서 연기력을 인정받았기에 이번작품도 기대되네요 화이팅!!!!  
20170213,10,너무 기대돼요!!!!  
20170213,10,김태리님 영화 기대하겠습니다!!  
20170213,10,태리 기대기대!완전기대!  
20170213,10,태리씨의 연기가 기대되네요. 다른 배우들과의 케미도 집중해서 봐야할 것 같습니다. 재밌어보이네요.  
20170213,10,캐스팅부터 취향 저격!  
20170213,10,김태리 파이팅 영화 잘 되시길  
20170213,10,대단히 기대하고 있습니다!  
20170213,10,김태리님 연기 정말 기대됩니다 빨리 보고 싶네요  
20170213,10,김태리 연기 대박 기대!!!!  
20170213,10,으아아아아 캐스팅 대박!!  
20170213,10,태리양 연기 이번에도 기대할게요~  
20170213,10,"영화도, 배우 김태리님도 너무너무 기대됩니다! 화이팅!  "
20170213,10,충무로의 떠오르는 여배우 김태리씨가 출연 한다고 하니까 정말 기대되네요 또한 배우들의 연기력이 우수하니까 편안하게 볼수 있을거 같아요!  
20170213,10,김태리 배우님 사랑합니다  
20170213,10,"믿고 보는 배우들, 기대되는 작품!  "
20170213,10,김태리님 연기 기대중입니다!  
20170213,10,김태리님 너무 좋아요~기대할게요!  
20170213,10,너무 기대됩니다  아가씨와는 색다른 느낌일것같네요  
20170213,10,태리님 항상 응원해요 앞으로도 기대할게요~  
20170213,10,스크린에서의 모습이 기대됩니다!!  
20170213,10,김태리님 나오신다니 너무기대됩니다 !  
20170213,10,믿고 보는 태리님 영화 너무 기대됩니다!!!  
20170212,10,영화너무기대됩니다!  
20170212,10,기대되네요 김태리님 화이팅!  
20170212,10,김태리님 연기 정말 기대됩니다!  
20170212,10,믿고보는 김태리님. 기대됩니다^^  
20170212,10,이 영화 너무너무 기대돼요~  
20170212,10,기대되는 영화!!! 꼭 볼게요  
20170212,10,김태리님과 류준열님 최고의 조합! 기대하고 있어요!  
20170212,10,김태리님의 연기 너무 기대되네요!  
20170212,10,태리님 여기 너무너무 기대되네요~  
20170212,10,너무너무너무 기대됩니당 ㅎㅎㅎ 태리님 꽃길 걷어연 ㅎ  
20170212,10,영화 완전 기대합니다 ^^  
20170212,10,태리님 연기 정말 기대되네요!!  
20170212,10,와 김태리에 류준열 완전 기대ㅠㅠ 특히 김태리는 연기 진짜 잘해서 이번에도 류준열이랑 같이 믿고볼듯!!  
20170212,10,김태리님 너무 기대됩니다!!♡♡  
20170206,10,대박 ㅋㅋㅋ 꼭보러 가야징~!~!~!  
20170206,10,류준열 너무기대된다...!  
20170206,10,류준열에 김태리 까지 재밌겠네요~~  
20170206,10,김태리 배우와 류준열 배우님 연기 정말 기대됩니다개봉하면 바로 달려갈게요  
20170206,10,캐스팅 굿~ 영화 기대할께요~  
20170206,10,너무너무 기다려지는 영화 화이팅  
20170206,10,영화 아주 기대가 됩니다  
20170206,10,배우분들 보니 정말 기대됩니다!! 좋은 힐링영화 나오길 바래요~  
20170206,10,캐스팅 대박이네요! 영화 기대하고 있겠습니다~  
20170206,10,너무 기대됩니다. 태리님과 준열님에 임순례감독님 ㅠㅠ 개봉하면 꼭 보러 갈게요.  
20170206,10,캐스팅 대박이네요! 기머됩니다!  
20170206,10,캐스팅부터 스토리까지 정말 좋네요~~  
20170206,10,캐스팅 대박이네요! 빨리 개봉했으면~  
20170206,10,김태리 류준열이라니..대박좋다 꼭봐야해!  
20170206,10,충무로의 샛별 류배우님과 김태리님 너무 기대돼요~  
20170204,10,류배우님 화이팅! 영화 대박나세요~~  
20170204,10,류준열님 영화 기대됩니다!!  
20170204,10,류준열님 영화 기대가 큽니다  
20170204,10,정말 꼭 보고시퍼용!!!!  
20170204,10,기대하고 있겠습니다~  
20170204,10,벌써부터 기대되네요!  
20170204,10,따듯한 힐링드라마 기대해봅니다~  
20170204,10,개봉하면 꼭 보고싶네요!  
20170204,10,응원할게요 류준열님~! 리틀 포레스트 대박~!  
20170204,10,동물사랑에 애쓰시는 임순례감독님 응원합니다~이번에도 영화 대박 나세요!!!! 파이팅!!!!  
20170204,10,류배우님 기대하고 있어요~!  
20170204,10,류준열 배우님 나온다니 기대되네요~  
20170203,10,류준열은 어떻게된게 겹치는게 하나도 없어... 진짜 '배우'야.  
20170201,10,사계절을 담은 아름답고 서정적인 영화탄생~ 기대합니다!  
20170131,10,4계절을 어떻게 표현할지 궁금하네요 류준열이라니.. 기대되는군요..!!!  
20170131,10,역시 류준열 2017년 최고의 배우 유망주답게 영화많이찍네  
20170130,10,준 열 아 사 랑 해 흥 하 자 ~ ♡  
20170130,10,재하야ㅠㅠ 얼른 보고싶다!!소처럼 일하는 류준열 흥해라 흥해라!!  
20170126,1,김태리때문에 보기 싫어.  
20170125,1,....일본껀 재밌었는데  
20170125,10,"헐 류준열 캐스팅했으면 무조건 기대발설레발해요,,,☆  "
20170123,10,나오면 꼭 봅니다 류준열나오면 믿고봐야죠 실력파 배우아니겠습니까 게다가 마성의 매력까지♡♡ 더킹도 봤는데 의리 쩔었어요 눈물나더군요 연기 너무 잘하세요 연예인 별로 안좋아하는데 류준열씨는 극도로 팬입니다♡  
20170118,10,갓준열ㅜㅜ기대할께요~~♡♡  
20170118,10,하시모토 아이가 주연한 리틀포레스트 다 봤었는데 그거랑 똑같은건가요??? 똑같은 제목의 작품이 있길래 ㅎ 왠지 기대되요!! 너무 재밌다기보다는 힐링느낌이 강해서 편하게 봤었거든요 기대합니다!! 김태리배우!! 연기너무 잘하더라구요 ㅠ  
20170117,10,김태리에 류준열ㅠㅠㅠ둘다 너무 좋아합니다 꼭보러갑니다♡♥♥♥  
20170117,5,아....왜 류준열 나오냐.... 운빨도 진짜 좋아하는 작품인데 루준열때메 못봤는데... 내가 좋아하는 작품마다 나오네.... 김태리 배우님 혼자 진행가능한 내용인데 다 된 작품에 억지 로맨스만 안 넣었으면  
20170117,10,류준열님 김태리님 둘 다 너무 좋아요!! 기대하겠습니다 화이팅!!!  
20170117,10,"믿고보는 류준열님, 김태리님 두 배우님 모두 기대되네요! 영화 꼭 보러 가야겠네요!  "
20170117,10,류준열×김태리나오면 뭐 그냥 보는거 아님니까?믿고보는 류준열×김태리!  
20170117,10,기대 만땅입니다.특히 태리님 ~꼭 보러 갈게요~  
20170117,10,류준열님 김태리님이라니.... 벌써부터 넘나 기대되네요!!! 대박나길 진심으로 기원합니다~~~  
20170117,10,김태리 배우님! 류준열 배우님! 항상 응원하겠습니다 걸으시는 길이 꽃길이 되길 바랄게요 :)  
20170116,10,기대되는 영화입니다ㅎㅎ  
20170116,10,류준열 김태리 관심있는 배우였는데 꼭 개봉하면 볼게요!!  
20170115,10,두 배우 조합 정말좋네요! 기대 많이하고있습니당  
20170113,10,일본 영화도 있으니 보시길  
20170110,10,김태리배우와 류준열배우!올해 최고로 기대되는 충무로의배우들!! 매우기대되는 작품이네요  
20170110,10,배우와 감독! 모두 너무 기대됩니다~!  
20170109,10,순수함이가득한영화일꺼같다  
20170109,10,"일본원작과는 또다른, 임순례감독님괴 한국특유의 정서와 감성을 기대합니다 개인적으로 원작에서 음식에 초점을 맞춘것과.달리 인물들의 이야기를 더 보고싶네요! 화이팅입니다  "
20170107,10,류준열 나오는 힐링영화 진짜 기대됩니다♡  
20170107,10,전 이런 잔잔한 영화 좋습니다. 류준열과 김태리가 호흡한 리틀포레스트는 어떤 영상으로 담겨질지 기대됩니다  
20170106,10,류준열 배우의 필모그래피 참 알차고 아름답게 채워지네요ㅠㅠ 따뜻한 영화 리틀포레스트! 기대됩니다  
20170106,10,류준열 재하  완전 기대됨~  
20170106,10,우직한 시골청년 재하를 연기할 류준열 배우 응원하고 기대합니다!  
20170106,10,"힐링 스토리, 믿음직한 임순례 감독님, 연기력이 기대되는 김태리 배우와 류준열 배우... 기다려지는 영화입니다~  "
20170106,10,류준열ㅠㅠㅠ완전 기대돼요!!좋은 배우들과 함께여서 더 좋습니다  
20170106,10,기대되는 배우 .기대되는 영화.예쁜영화 만나길 바래봅니다!  
20170106,10,류준열의  재하   너무나  기대됩니다   김태리와의  케미도 좋을  듯  하고   아름다운   힐링 영화가 될 듯  하네요   1년  기다리는거   어럽지  않아요  
20170106,10,사계절 류준열을  본다 ㅠㅠ  
20170106,10,태리님ㅠㅠ진짜 꼭 볼겁니다ㅠㅠ 너무 잘 표현해나갈듯ㅠㅠ  
20170106,10,"주연 김태리 배우에 류준열, 문소리배우까지!!배우들부터가 힐링인 이 영화. 커다란 스크린에서 마주할 자연들을 보며 또 어떤 힐링을 받을지 너무너무 기대됩니다  "
20170106,10,류준열의 재하 기대합니다!!!  
20170106,10,"임순례감독님,김태리배우님,류준열배우님,문소리배우님,진기주배우님이 만들어갈 리포 기대하고 있습니다!!  "
20170106,10,류준열 배우의 리틀포레스트 기대하고 응원합니다 화이팅 ~~~!!!  
20170106,10,4계절을 담은 힐링영화가 될것 같아요..재하역도 너무 기대되고 혜원역도 너무 기대됩니다..이름마저 청량한 느낌 가득  
20170104,10,임순례 ㅜ! 거기에 김태리까지!  
20170104,10,잔잔하고 소박한 영화에 류준열과 김태리~! 이건 꼭 봐야겠죠~^-^  상큼하고 느린이야기가 담길것같아 기대합니다~ 젊은농군 재하역의 류준열~ 진짜 연기스펙트럼이 대단하네요~ 수퍼 리스펙트!!  
20170104,10,너무너무 기대됩니다ㅠㅠㅠㅠ  
20170104,10,열일하는 류준열배우의 담백한 모습 기대됩니다  
20170103,10,"류준열이 농부역이라니, 배우 인생에 할 수 있는 역할들을 차근차근 종류별로 다 해보는 것 같아서 좋다. 류준열 하고픈거 다해!!! 류준열 연기면 믿고 본다.  "
20170103,10,"네이버에 카테고리 생긴지 몰랐내요, 류준열 열일 고맙, 힐링이되는 영상, 잘 나오길  "
20170103,10,충무로의 기대주들이 뭉친 영화 기대할께요류준열 김태리 대박 캐스팅입니다  
20170103,10,배우들 케미 너무 좋아요 류준열이 농부라니 완전 기대됩니다  
20170103,1,내가 좋아하는 영화 망치지 마라. 류준열은 왜 나오냐.  
20170103,10,"류준열이 연기하는 시골청년 재하는 어떤 모습일까 매우 궁금하고 기대됩니다. 충무로의 기대주 김태리와 류준열, 연기의신 문소리까지~기대하며 기다립니다.  "
20170103,10,오~~ 이번엔 사계절  풍경과 요리 재하 시골 청년은 또어떤모습이 될지...  
20170103,10,"원작은 여주 원톱 영화, 나머지는 단역. 기사에 각색 얘기도 없으니 한국판이 그대로 간다면 난 진심 류준열 연기 보고 싶어서 안달 혹은 감질맛 날거 같은데 ..ㅠㅠ 계절별로 한달씩 1년 동안 촬영한다니 그동안 류준열 본인이 힐링하는 걸로 만족합니다..  "
20170103,10,캬 김태리 류준열 캐스팅 좋다!!! 기대중  
20161228,10,김태리배우님 사랑해요 영화 열심히 찍어서 대박나길!!ㅠㅠ  
20161225,10, 힐링영화가 될수있을거라 기대합니다  
20161224,10,너무기대된다 김태리 화이팅 혜원이 얼른보자  
20161219,10,제발 다된 태리에 류준열뿌리기 노노..  
20161121,10,으ㅜ악 태리야끼랑 준여리라니..!!꼭 보러가야지  
20161119,10,으아 류준열!!캐스팅가나여!  
20161109,10,"리틀포레스트 시리즈 보는데, 아무리 생각해도 이 역에는 김태리씨 생각밖에 안드네요. 김태리 색깔이 베어나오는 리틀포레스트가 하루 빨리 개봉됬으면 합니다.  "
20161023,10,빨리 보고싶다 김태리!!!!  
20161023,10,김태리 배우 응원합니다  
20161016,10,이야 우리나라에서 리메이크하는군  
20161015,10,기대합니다~!! 재밌을거같아요~!! 김태리님이 주연이시면 믿고대기타겠습니다ㅎㅎ  
20161015,10,김태리배우분 화이팅♡♡ 너무 아름다우세요!! 이번작품 흥행 기대합니다!  
20161015,10,와방기대되요 !!! 김태리 화이팅  
20161014,10,태리님 기대됩니다ㅎㅎ꽃길 걸으세요~  
20161014,10,엄청난 연기력을 보여준 태리님의 신작 기대되네요!!  
20161014,10,태리님 새로운 영화 기대하고 있습니다. 항상 꽃길만 걸으시길~  
20161011,5,인간적으로 사랑은 넣지 말자  
20161001,10,아가씨 보고 완전 태리 팬됬는데 기대된다 노잼이어도 좋고 꿀잼이면 더 좋고 헤헤 탤 사랑해요  
20160929,10,좋은 영화가 나오길 기대합니다~ 김태리 배우 파이팅!!  
20160928,10,헉 태리라니 너무 기대됨  
20160922,8,대추나무 사랑걸렸네같은 구수한 농촌드라마 될까봐 걱정이다..  너무 어색하게 만들어지지 않았으면  
20160922,10,김태리가 이 영화에 캐스팅됐다는 소리를 듣자마자 김태리가 씻은토마토를 베어물고 사색하는 모습이 떠올랐다 리틀포레스트 이미지랑 너무잘어울림  
20160921,10,"와 일본원작 리틀 포레스트 1,2 다본 나로써는 기대가 무지 되네요 거기다 김태리 주연이라니 대박임  "
20160921,10,정말 기대되요ㅠㅠㅠㅠ 원작영화를 너무너무 좋아해서 꼭 보러갈거에요!!!김태리랑 너무 잘어울리는듯!!!!  
20160921,10,태리 화이팅!!!!항상 응원해  
20160920,10,태리야끼ㅠㅠㅠㅠ드디어 작품한다!!!  
20160920,1,"남쪽으로 튀어, 에 이어 또 일본 작품 리메이크. 히데오 원작도서는 훌륭. 이쯤되면 그녀의 모든 작품 토양 자체가 의심이 가는군요. 아니지 그 원작을 구해서 봐야겠다는 피드백, 감사 드림.  "
20160919,10,김태리는 그냥 넘 좋다 응원합니다 언니 싸랑혀요!!!  
20160919,10,김태리와 시골풍경과 소박한 아침상은 최고의 꿀조합이다  
20160919,7,일본 원작에 반만 이라도 닮은 영화가 나온다면 좋겠습니다  
20160919,10,우리 래리드디어 열일시작 ㅠㅠㅠ 흐엉 너무 설레거 기대하구있다!!! 김태리 꽃길만걷자!! 파이팅!!  
20160919,9,원작이 일본영화  아닌가? 흔히 들일본판 삼시세끼라고 하던데.. 영화는  잔잔히 괜찮지만 흥행할 요소는 없어보였는데...  
20160919,8,과연 원작을 뛰어넘을수 있을까?  
