0,1,2
20180228,10,재미있을거 같아요 기대돼요  
20180227,10,무공해 영화!! 마음이 편한게  좋다  
20180227,5,지금 만나러 갑니다도 그렇고 일본 영화 많이 리메이크 되는데.. 배우들은 다 좋아하는 분들이지만 그 특유의 분위기를 낼지 모르겠다  
20180227,10,정말 따뜻한 영화입니다. 현실에 이리치이고 저리치여 지쳐갈 때 따뜻한 위로가 되었습니다.  
20180227,1,일베  류준열이 나오네??  
20180227,10,나만의  작은숲 류준열  힐링되는 영화  극장에서 꼭 보고 싶어요  
20180227,10,"시사회로 먼저 봤습니다. 영화를 보는 내내 너무 편안함을 느꼈습니다. 내가 그 시골마을에 가서 함께 어울리고 싶단 생각이 들더군요. 세 배우님들의 케미도 너무 좋았고, 김태리님의 음식 먹는 소리마저 힐링의 요인이었어요. 임순례 감독님 감사합니다  "
20180227,9,참잔잔하며..내가 좋아하는 스타일 영화임.. 참좋다  
20180227,10,"어제 시사회 보고 왔는데 진짜 개봉하면 또 가려고요 ㅜㅜ 힐링 제대로.. 뭔가 높게 올라기기만 하려는 사회에 사는게 지쳤는데 이 영화는 그런 삶에 지친 사람들에게 천천히, 자연, 풋풋한 감성으로 치유해주는 듯 배우들도 싱그럽고 영상미도 좋았어요.  "
20180227,10,시사회를 보았습니다.  평화로운 옛고향으로 돌아가 건강한 무언가을 몸과 마음에 담겨지는게 느껴지는 잔잔한 영화입니다. 힐링이라는 키워드가 정말 어울리는 착한 영화입니다.  
20180227,10,"시사회로 미리 보고 왔는데 자극적인 흥행요소 없이도  전혀 지루하지 않고 재밌음. 영상미, 음식들, 그리고 자연 속에 잘 녹아드는 배우들 연기가 너무 좋았다. 부담없이 편안한 마음으로 볼 수 있는 영화.  "
20180227,1,롯시 상영관 몰아주기 뭣같네 진짜 같은 날 개봉하는 영화부터 기존부터 흥행하고 있는 블랙팬서까지 예매 2일전 아침에도 상영관이 리틀 포레스트 빼고 다 안 풀리는데다가 풀릴때까지 기다렸더니 황금 시간대에 개봉하는 영화가 리틀 포레스트랑 궁합 뿐임  
20180227,1,우리나라 문화에 어울리는 소재를 찾아서 창작을 해야지 일본에서 흥했다고 무작정 따라하는 영화들이 올해에만2편이 나오는데 별로 반갑지는 않네요. 일본에서 만들어졌기에 독특한 영상과 감동으로 담아낸것이지 과연 우리나라 실정에 맞을런지... 기대는 안합니다  
20180227,10,믿고 보는 류준열 ㅠㅠ 개봉 날 바로 보러 갑니다.  
20180226,10,영화 진짜 너무 기대되네요 특히 내용이랑 배우분들  너무 맘에 들어요... ㅎㅎ  
20180225,10,시사회 보고 왔는데 개인적으론 일본 원작보다 나았습니다. 10점 줄정도로 대박이다!는 아니지만 1점아니면 10점이라 10점줌 아 그리고 (스포??))))댓글 보다가 럽라 얘기 나와서 말인데 나는 이정도가 딱 좋았음. 그 이상은 오바  
20180225,4,영화 망치지나 말았으면..  
20180225,10,전형적인 일본풍 영화의 소소한 매력을 한국에서 어떻게 살릴지...이런 시도를 하다니!! 기대됩니다!!  
20180225,1,진짜 시골가봐라 웬 80먹은 노인네들뿐인데 전혀 공감이안되  
20180225,10,시사회로 보고 왔는데요. 정말 마음이 깨끗해지고 새로운 희망으로 가득차게 되는 영화예요. 류준열 김태리 조합 최곱니다.  
20180224,10,심심할거 같다 이런 영화를 기다렸다 자극적이지 않고 잔잔한 무공해 영화  
20180223,1,"가장 싫어하는 유형, 스케일이 장대한 것도 아니고 그냥 창작으로 만들어될 정도인데 리메이크. 이미 일본영화 개봉까지 했던건데 굳이 리메이크하는 이유를 모르겠다 창작심이 이렇게들 없나  "
20180223,1,힐링보다는 판타지 영화.  
20180223,1,스토리만봐도 딱 그냥 평범한 드라마가 뭐 이렇게 평점이 높아??  
20180223,10,배우진들을 보니까 일본판의 풋풋함만큼은 제대로 느낄 수 있을 거 같아요. 기다리고 기대한 만큼 좋은 영화가 나오길...!  
20180223,1,평점알바 네이버 점령하다. 댓글에도 창의력이 필요할듯.  
20180222,10,"2월 마지막날..그리고 예비 고1로서, 이영화를 보고 새로운 고등학교생활을 시작 할거같아서 벌써부터 설레고 떨린다!!!류준열 꽃길만 걷자!! 사랑합니다 사랑하세요  "
20180222,10,개인적으로 올해 본 영화 중에 최고였음.  
20180222,9,왠지 잔잔하면서 평온한 영화일듯.. 보러가야디..ㅎ  
20180222,10,시사회 잘보고왔습니다ㅠ 계절이 지나가는게 너무 아쉬울 정도로  계절마다 아름다운 풍경이 잘 담겨있어서 여행하는 느낌이었어요  요리하는과정도 먹는모습도 농사짓는 모습도 너무 힐링이었습니다  세 배우님의 케미도  너무 좋았어요  류준열님 넘 멋있..ㅜ  
20180222,10,"시사회로 먼저 봤습니다~ ""NO MSG, Just Healing""~~참 마음 따듯한 영화입니다.  "
20180222,10,한국인의 밥상.극장판(시사회 보고옴)  
20180221,9,아무 생각없이 김태리님과 류준열님과 진기주님의 연기를 보면서 힐링할 수 있어서 좋앗습니다!!(시사회 다녀와써요~ㅎㅎ) 뭔가 엄마가 시골에서 살고싶다고 하시는 그 마음을 이해할 수 있었다는...ㅎㅎ  
20180221,10,핫딜로 떠서 미리 보게 되었는데 한마디로 정말 힐링되는 영화였어요ㅠㅠ 느리고 잔잔하지만 계속 보게 되는 매력이 있습니다. 계절별로 색감도 예쁘게 표현되었고 요리하는 과정 하나하나가 군침돌게 만들어요ㅠㅠ 정말 추천합니다!! 마음에 평화가 찾아왔어요ㅠㅠ  
20180221,10,시사회로 봤는데 진심 너무~~ 좋았어요. 개봉하면 혼자 극장가서 한번 더 볼려고요^^ 화면을 온전히 느끼고 즐기고픈 영화. 일본원작과 달리 한국정서에 맞게 새롭게 각색한 부분도 인상적. 멜로라인 더 안보여주는게 엄청 아쉽긴 하지만. 그만큼 럽럽무비^^  
20180221,8,가볍게 보기 좋습니다. 풍경이 바뀌는 배경도 좋게 소소한 스토리도 좋아요. 재미는 주관적일 것 같지만 힐링이 되는 영화인것같긴 합니다.  
20180221,4,일본원작 리틀포레스트 안본자는 전혀 이해가지 않을 것 본사람이라면 일본감성을 못 잊고 실망할것억스러운 봄을 강조하는 내용 아직은 봄은 아닌데 자꾸 봄이라 우기는 것 그들이 보여준 따스함이 나무와 자연을 보여주는것인가?연기마져 애드립처럼 느껴졌던  
20180221,10,시사회로 보고왔는데 너무 편안하고 소소한 재미도 있고~ 시작부터 마지막까지 미소가 떠나질 않았어요~ 자극적인것에 지쳤다면 리틀 포레스트에서 잠시나마 쉬어가는건 어떨까요~ 개봉하면 n차각입니다!  
20180221,10,인생 영화 등극이다! 소장하고 싶은 영화 오랜만이다. 힘들때 마다 두고두고 꺼내 보고싶다  
20180221,9,103분의 휴식 속 반짝이는 김태리의 꼰대들을 향한 유쾌한 일침.  
20180221,6,성장과 힐링을 담은 싱싱한 감각.  
20180220,10,힐링영화각이다 개봉날 바로 보러갑니다  
20180220,9,이거 겁나 편안하게 재밌어요.  
20180220,10,"시사회로 미리 보고 왔습니다. 단언컨대, 이 영화를 보면 반드시 배고파지실거에요!! 하지만 너무나 따뜻하고 행복한 영화였어요!  "
20180219,1,이 작품은 배우가 중요한 영화가 아닌데... 원작의 훼손이 너무 심한 듯 하다.  
20180219,10,보고 나면 위로받을 수 있는 휴식같은 영화였습니다. 너무 좋았어요~  
20180219,10,영화가 나에게 위로를 선사하다니ㅜㅜ 눈이 즐겁고 식욕까지 자극되는 영화 ! 개봉하면 또 보러갈듯  
20180219,10,보면 볼수록 배가 고파지는 영화  
20180219,10,이런 힐링영화 기다려따 헤헤  
20180219,10,ㅠㅠ 꼭 볼꺼다 분위기 오진댜 !  
20180219,10,시사회에서 봤는데 생각보다 너무 좋았음 ㅎㅎ  
20180217,6,"대사가 많으면 안될텐데 걱정이다. 일본판이 너무 명작이라서, 그 영화 따라서 지금 한국 cf 20여편은 표절한거같던데..  "
20180217,7,"원래 하시모토쯔~앙의 포레스트 그거는 카모메와 더불어 아무 생각없이 보는 킬링타임용 영환데, , , 내 생애 포레스트 이름 들어가는 영화는 포레스트검프가 최고임.  "
20180217,1,"류준열 얼굴실화냐,ㅋㅋ  "
20180214,10,"지금 우리에게 필요한 영화! 100여분의 시간동안  눈과 귀를 행복하게 만드는 그 영화! 휴식 하고, 힐링 하고, 위로 받을 수 있는 바로 그 영화!! <리틀 포레스트>  "
20180214,10,"보고나면 기분이 좋아지는 영화 , 고향친구가 생각나는 영화  "
20180214,9,내 얘긴 줄... 진짜 공감하면서 봄 ㅠㅠ 너무 좋았어요  
20180214,10,보는것만으로도 힐링 그 자체.. 시사회로 보는내내 기분좋은  영화였어요~  배우들 연기도 너무 편해보임!  
20180214,10,어제 시사회 봤는데 잔잔하니 괜찮은 영화 였어요 생각도 많이 하게 되고 내용도 재미지고  
20180214,1,별점 10개 뭐지...? 보다가 중간에 나온 영화는 처음입니다...  
20180213,10,앞부분 조금 놓쳐서 봤는데도 이해 문제 없었고 힐링하는 영화였다. 잔잔하면서도 중간중간 빵 터지는 영화. 좋다. 한번 더 보고 싶다  
20180213,10,"일본 원작보다 훨씬 좋았습니다. 그리고, 역시 갓태리네요  "
20180213,9,잔잔한 이야기와 아름다운 농촌사계 고민등 추천합니다  
20180213,10,긱색이 궁금했는데 훨씬 재미있게 완성된 이야기!  
20180213,10,공감 내 이야기를 그대로 옮겨 놓은듯 ~ 정말 가슴 뭉클한 내용도 있었어요~즐거운 영화 관람 이었어요~  
20180213,9,김태리의 매력이 뿜뿜. 원작과는 조금 다르지만 충분히 매력적  
20180213,10,먹음직스란 행복으로 배불러지는 영화  
20180213,8,마음이 편해지는 영화였어요~~  
20180213,9,영화가 따뜻하고. 편안해요;-)  
20180213,10,반복되는 일상에 공감되고 힐링되는 영화였어요  
20180213,10,잔잔한 울림과 힐링을 얻을 수 있는 영화  
20180213,8,마음이  따뜻해지고 힐링됬어요  
20180213,10,올해 최고 힐링영화에요ㅠㅠ  
20180213,10,힐링이 되었다. 요즘 세대들에게 강추해요. 오구 귀염  
20180213,10,영화 색감 예쁘고 김턔리 씨 연기 너무조었어요. 류준열 진기주 분들 연기도 좋았음  
20180213,10,따뜻하고 또 따뜻한 영화  
20180213,10,힐링이 되는 마음 편해지는 영화예요  
20180213,10,재밌고감명깊었어요^^  
20180213,10,태리누님과 준열형님 그리고 기주누님 믿고보겠습니다  
20180213,3,근데 원작 만화와 먼저 나온 영화가 있는데  모르시는 분들이 보면 아예 처음 내놓는 영화인줄알것같은데 이것도 마케팅인가요..? 또 걱정되는게 여름과 가을/겨울과봄 이렇게 섹션을 나눴을 때도 빠른흐름이었는데 집중잘안될것같기도하고..연애는 제발안나왔으면ㅠ  
20180212,10,오랜만에 구수한 영화 좋다  
20180210,8,"일본판 영화는 조용조용하면서 무심한듯 따뜻하게 내용을 정말 힐링되게 잘 담았는데 그 느낌 그대로 온다면 성공할거같고 이상하게 연애에 집중하고 그 특유의 분위기를 못 가져온다면 성공하기 힘들거라고 생각합니다.. 제발 연애,개그 없기를 진짜  ㅈㅂ..  "
20180209,10,배우들  좋고 일본 원작과 다른 힐링이 되는영화가 나왔으면 좋겠어요.^^  
20180208,10,장희진 닮았다.포스터에 웃는 여자분  
20180208,9,풀밭에 누워있는 포스터가 훨 나음요;  
20180208,10,왠지 희망적이고 힐링될것같은 영화다 기대된다!  
20180206,10,기대된다 임순례 감독님 좋아요~  
20180205,2,왜..이런 완벽한 작품을 리메이크 하려하나? 어떻게 용을써도 원작에 미치지 못할것을..  
20180202,10,태리야ㅠㅠㅠㅠ 너무 예쁘자낭ㅠㅠㅠㅠ 기대하고있어요!!!  
20180202,5,일본 원작은 안봤지만 관심이 가지없는 내용에 특색없는 배우 이게 될까 의심이 드네요 모험인가요? 개인적인 생각입니다.  
20180130,10,내 주변에서도 할 수 있는건 해보고 싶어요. 소소하지만 행복할 수 있는 영화..편안해지네요  
20180129,10,이거보도 귀농생각하면 오산이지만 원작이 재밌어서 기대해본다 =ㅎㅎ  
20180125,10,김태리 짱짱짱 !!!!  
20180125,10,"충무로 신예배우들이 대거 출동했네요! 너무 기대되는 영화, 4계절을 어떻게 담았을지 너무 궁금합니다! 힐링영화 빨리 보고싶네요!  "
20180125,10,위로와 여유를 느낄 수 있는 휴식같은 영화 리틀포레스트!!! 많이 기다렸습니다. 예고만 봐도 따뜻해지는 느낌이어 너무 좋아요~ 빨리 개봉날만 손꼽아 기다립니다....두근두근!!  
20180123,1,판타지귀경드라마. 순례야 농촌 함 가봐. 무법천지다.  
20180123,10,일본 원작을 수십번 돌려봤는데 한국에서 원작을 능가할 작품이 나오길 기대합니다!!기다리고 있어요~  
20180121,3,임순례 영화가 이제 재미있을리 있겠어? 다 알잖아?  
20180116,10,태리준열팟팅!!!!  
20180116,10,원작을  질릴 정도로 여러번 봤는데 그만큼 기대되요! 영화 소개 프로그램에서 얼핏보니 류준열 배우는 그대로 시골 청년이더만요 ㅋㅋ 캐스팅이 다함 ㅋㅋ  
20180116,10,정말로 재미있을것 같네요!! 꼭 한번 보고싶어요!! 류준열짱!  
20180115,10,류준열님과 김태리님이라니ㅠㅠㅠ기대됩니다!! 둘다 너무 좋아  
20180115,1,김태리.류준열 걍 일본 원작 한 번 더 볼랜다  
20180115,10,너무 기대됩니다 감독님이 딱 태리였다고 했는데 어떻게 완성되고 표현되었을지 기대되네요 개봉하면 바로 보러갈께요 리포도 화이팅 김태리도 화이팅  
20180114,10,아주아주 기대가 커요. 우리 김태리 배우님^^  
20180114,1,미안해요 오늘 영화가 좋다 봤는데 원작이랑 너무 달라요ㅜㅜ 미안합니다. 하지만 꼭 보러갈께요~ 관람후 평점은 1점이 아니길 바랍니다  
20180113,1,역시 조선은 주저리 주저리 말도 많고 설명도 길고.. 어휴.  걍 일본판 표절한 삼시세끼랑 또옥 같은 부류.  
20180112,10,기대된다ㅜㅜ태리야꽃길걷자  
20180112,10,일본 원작을 완전 인생작으로 봐서 너무 기대대요 . 영화 1987로 김태리씨 팬 됐는데 제가 기대하는 영화에 김태리씨가 나와서 너무 좋네요^^  
20180112,10,아가씨  1987  보고 김태리씨 팬됐어요ㅎㅎ  
20180112,10,"굳이 원작 안따라가도 됨. 원작 재밌게 본 입장으로써, 똑같이 만들거면 영화찍을 이유가 없죠. 일본영화 더빙을 하고 말지. 원작초월하새요ㅇㅇ  "
20180111,8,"원작 영화 여러번 다시 볼만큼 팬입니다. 예고편 보고 원작과 또 달라 기대감은 드나 4계절을 전부 담아내면서 주인공과 엄마, 주변 인물까지 한대 담아두기엔 러닝타임이 너무 모자랄까 우려가 드는건 사실.. 그래도 감독님과 김태리씨 때문에 극장으로갈게요!  "
20180111,8,원작과는 조금 다른 분위기인 것 같지만 캐스팅도 마음에 들고 기대해봅니당  
20180110,2,아니 뭐 제목까지 따라하면 어쩌자는건지 ㅎ;  
20180110,9,김태리도 좋지만 진기주♡좋아요  
20180110,3,예고 봤는데 원작파괴각 입니다  
20180110,5,원작은 음식만들기 위주인데 예고보니 연애위주인거 같아 아쉽네요  
20180110,10,태리야 열일하자!!!  
20180109,10,"로맨스 장르로만 가지 말길!로맨스가 살짝 있어도 되지만 그게 주 내용이 되면 진짜 원작의 본의미를 망칠거같움ㅜㅜㅠ내가 이영화를 봤을때 느꼈던 편안함이,큰 갈등이 없어도 충분히 너무 감명깊고 따뜻하고 힐링됬으니깐 제발 이대로만!  "
20180109,10,농부 재하야 얼른 만나자!  
20180109,10,"1년을 기다려온 영화! 재하야, 곧 만나자.~~~  "
20180108,10,내가 제일 좋아하는 배우들 ㅠ 김태리 류준열 이라니 정말 정말 기대하고 있어요 제 인생영화가 됬으면 좋겠어요 얼른 보고싶다♡  
20180105,10,임감독님 잘보겠습니다  
20180105,10,"일본판 너무재밌게봤는데 한국판 너무기대되요,,!!! 태리님 연기도 기대  "
20180105,6,김태리가 어느새 주연이...  
20180104,10,김태리땜에 보러갈꺼에오 ㅎㅎㅎ  
20180102,10,"일본 리틀포레스트 힐링영화로 너무 좋아하는데 한국 음식, 한국 감성으로 따뜻하게  만들어주세요!!  "
20180102,5,아직 안봐서 섣불리 말하긴 그렇지만.줄거리만봐도 불안하다..또 한국적이게 신파드라마로갈까봐. 일본판의 매력은 리얼리티와 정적이고 뜬금없는 스토리진행인데 오히려 다큐에 가깝지..은연중 인생의 깨달음까지도..한국판이 그걸 넘어설수잇을까..일단 기다려본다  
20171231,10,줄거리만봐도 뭔가 힐링하는 영화일듯  
20171229,5,"일본 풍경과 감성에 어울리는 영화였는데, 어설픈 시도가 아니길 바랍니다. 영화가 주는 내면의 이야기까지 담기에는 우리나라 시골의 이미지나 정서가 그만큼 서정적이지 못한데 걱정이네요.  "
20171228,10,김태리 주연이네 무조건 본다 무조건  
20171228,10,빨리 보고싶다ㅠㅠㅠㅠ  
20171227,2,예전부터 느끼는 거지만 명작을 굳이 리메이크해서 뛰어넘을라 하는 이유가 뭔가 싶다. 이미 레전드인것을...  
20171226,10,담담하고 담백하게 풀어나가길 기대하겠습니다!!!’ㅜ  
20171226,10,류준열은 이영화에서도 사투리를 쓸까??  
20171225,4,감상은 안하였지만 리틀포레스트...일본작 아닌가요??? 와이키키브라더스 같은 말할수없는 감정을 느낄수있는 영화는 이제 볼수없나요ㅠㅠ  
20171222,10,김태리..박소담과 더불어 진짜 배우의 길을 뚜벅뚜벅 걷는 지금도 잘하지만 미래가 더욱 기대되는 배우입니다.필모그래피를 보고 배우로서의 작품 선택이 하얀 도화지 위에 예쁘게 그려나가는듯해 보기좋습니다  
20171216,10,김태리 류준열 혜원과 재하 상상만 해도 싱그런 그림이 그려집니다  리포개봉 애타게 기다리는 일인  
20171216,8,김태리는 좋아요남자는 말그대로 조연인데 류준열?....어떻게든 분량 나올텐데 원작 느낌이 나올까 걱정이네요  
20171215,10,현기증나니까 빨리 개봉좀 ;;;  
20171213,10,"너무너무 기대되는 작품 중 하나! 매력만점 배우들이 연기해서 배로 기대되는 작품!! 원작의 감성을 유지했으면 좋겠지만 별개로 한국 정서에 맞는 배경과 사운드, 볼거리들이 제공되었으면 합니다! (개인적으로 원작 분위기 진짜 좋아해요!)  "
20171211,1,일본껀 재미있는데 ..이건 모르겠다..  
20171203,10,오오  무공해  청정  힐링영화^^  류준열  사랑합니다♥  
20171121,10,소박하게 담긴 음식들의 모습 기대된당  
20171121,1,"일본 영화에 확 가 게시나?, 타이틀부터 정신 차리세요. 영홥니다.  생각 좀 하세요.  "
20171112,7,원작에 충실하게 맛있게 보이게끔 만들어지길.  
20171028,10,류준열 미쳤다..!!  
20171027,10,"김태리 배우와 류준열 배우, 진기주 배우의 케미가 기대됩니다.  "
20171018,8,어머~~일본에 원작 영화가 있는 작품이네요 재미있을것같아요배우들도 기대되네요  
20171009,10,제발 연애가 중심이 아닌  원작처럼  힐링되는 영화였으면 좋겠다.  
20171002,10,"원작을 먼저 봐서 그런건지, 준열배우님이 캐스팅 되서 그런거지, 아직 개봉 전인데도 벌써 힐링할것 만 같은 기분♡ 정말 처음부터 기다리고 있어요 개봉까지 열심히 기다릴게요♡  "
20170910,10,김태리랑 원작 여자랑 닮았다는  생각은나만임?  
20170906,10,진기주님 응원합니다~  
20170826,10,믿고 보는 류준열 기대할게요  
20170823,10,류준열의 연기가 기대되군요♡  
20170821,10,와~~넘 기대기대~~^^♥  
20170816,9,원작인 일본 리틀포레스트처럼만 되줘라  
20170816,10,우리 구재식이 기대 된다..  
20170810,10,내가 좋아하는 배우 다 나온당♡♡류준열에 김태리라닝><  
20170809,10,임감독님표 리틀포레스트 너무 기대됩니다원작을 너무 재밌게 봤어요. 따뜻한 스토리와 아름다운 영상미 기대할께요  
20170808,10,미쳤다.. 그냥 이건보자.  
20170802,10,김태리와 류준열이면 말 다한거아님? 캐스팅 하나는 진짜 잘했다. 무슨일이 있어도 무조건 보러간다 진짜ㅠ!!!  
20170724,10,아 태리언니 천만길만 걸어ㅠㅠㅠㅠ  
20170716,3,아니.. 왜 륶임? ㅡㅡ  
20170712,10,원작은 미소된장국처럼 담백하고 수수한 맛이었다.. 한국의 된장찌개처럼 진한맛을 내려하면 원작의 매력을 잃게 될것같다.  
20170707,3,리틀포레스트의 핵심은 담백함이다. 류준열이 망치네...  
20170707,1,시놉이.. 작년에 가장 흥행했던 일본 멜로영화 사랑도감이랑 똑같네..  
20170706,10,일본 원작이 너무 쌘데...  
20170623,9,일본의 리틀포레스트는 사실상 거의 다큐에 가까운데 이 영화는 그렇지 않을것 같은 느낌  
20170622,10,김태리가 캐스팅 됐다는 소릴 듣고 환호성을 질렀다! 원작 리틀포레스트 덕후로서 최소 30번이상은 되돌려본 영화인데 우리나라 배우로는 그녀가 아니면 대안이 떠오르지 않습니다 . 감독도 뭔가 푸근하게 생겨서 이런류 영화 잘만들꺼같음. 일단 매우 기대해봄  
20170616,10,마음을 열어주는 아름다운 영화가 탄생되기를 기대해봅니다.  청량한 재하도 기대하며...  
20170615,10,"류주열배우님과 김태리배우님이라니...!! 두분이 나오시면 이미 재미! 감동! 힐링! 모두 보장 된 영화 아니겠습니까??!!!! 정말 너무나 기대가 되는 영화에요ㅠㅠ! 이런 분위기의 영화를 되게 좋아하는데, 한국에서 리메이크 해주니 너무 좋네요! 대박!  "
20170610,10,멋진 영화 기대할게요~~  
20170527,10,김태리 배우님 좋아하는데 기대하고 있어요~~  
20170526,10,김태리님의 연기가 정말 기대됩니다!! 두근두근?  
20170526,10,리틀포레스트 원작 감명깊게 봤는데 리메이크작을 김태리배우님 주연으로 한다고 해서 더욱 기대됩니다  
20170526,10,김태리님 영화!! 기대하고 있습니다!  
20170526,10,보고싶어요!!! 태리님 영화기대됩니다!!!  
20170526,10,리포 너무 보고싶은 기대작  
20170526,10,최고의 기대작으로 생각하고 개봉날까지 기다리고 있습니다!태리 배우님 화이팅!  
20170526,10,믿고 보는 배우 김태리님ㅎㅎ 응원합니다♡  
20170526,10,김태리님 영화 완전 기대하고있습니다!!!  
20170526,10,김태리의 힐링영화 벌써부터 정말 기대됩니다ㅜㅜㅜ  
20170526,10,너무나 기대됩니다. 빨리 개봉이되었으면 좋겠어요  
20170526,10,일본판 리틀포레스트를 너무 재밌게 봤어요 우리나라에선 누가 여주인공을 하면 좋을까 싶었는데 김태리 배우님이라니ㅜㅜ정말 너무 잘 어울리는 거 같아요 수수하면서도 임팩트 있는 연기 보여주실 거 같아서 너무 기대됩니다!  
20170526,10,김태리 배우님 넘기대되요ㅠㅠㅠ  
20170526,10,원작도 좋아하는데 이번 리메이크에서 김태리 배우님이 나와서 정말 기대됩니다! 개봉하면 꼭 보러갈게요!  
20170526,10,너무 기대됩니다. 김태리님 화이팅!  
20170526,10,김태리 배우님♡ 이번작품도 넘넘 기대되요!!???  
20170526,8,믿고보는 배우들의 열연 기대할께요!  
20170526,10,믿고 보는 배우님들 출연작이라 손꼽아 기다리고 있어요?  
20170526,10,오 김태리 배우의 신작이라니 완전 기대됩니다~♡  
20170526,10,너무 기대됩니다!! 포스터부터 짱 잘 뽑았어요 ㅠㅠ  
20170526,10,김태리 류준열 두 배우 모두 너무 기대됩니다! 화이팅!  
20170526,10,일단 배우들 믿고 볼 것 같은 영화  
20170526,10,자연의 계절별 모습을 담아낸다고 하던데 너무 기대됩니다bb 김태리 류준열 화이팅 배우 때문에 더 보고 싶은 영화!!  
20170525,10,영화 기대하고 있겠습니다!  
20170525,10,류준열 배우님의 힐링 영화라니 정말 기대됩니다! 어서 빨리 보고 싶어요ㅜㅜ  
20170525,10,류준열님께서 나오신다는것만으로도 기대됩니다!  
20170524,10,류준열 배우님!! 넘 기대되네요!!!  
20170523,7,그래도 한국 감독중에선 영화 잘만드는 축에 들어감  
20170523,10,이 영화 너무 기대됩니다 배우 라인업 짱짱 김태리화이팅?  
20170523,10,김태리님 너무너무 기대됩니다♡♡ 응원해요!  
