0,1,2
20170926,1,환생이란게 있나? 과학적 검증 가능?  
20170926,10,너무 잔잔하고 가슴 따뜻한 영화였습니다. 한번쯤 꼭 보시면 좋을것 같아요~  
20170926,10,라다크의 척박한 땅과 사람들 속에서 펼쳐지는 너무 순수하고 아름다운 얘기입니다.   나이든 스승과 린포체의 관계는 인간의 사랑이 얼마나 숭고하고 아름다울 수 있는지 보여주는 것 같습니다. 개봉관도 전국 2개고 개봉일도 하루밖에 안되어 너무 아쉽습니다.  
20170924,10,앙뚜의 천진한 웃음과 노스승의 맑은 미소가 계속 생각납니다… 불교와 윤회를 떠나 두 사람의 우정과 사랑만으로 고결한 가치를 지닌… 마지막에 엄청난 눈물을 흘리게했던… 가을날 마음 따뜻해지는 영화로 추천합니다~  
20170922,8,세상에  쉬운건없구나..   세상에서   아름다운   이별을  보았네요..  회자정리  거자필반  
20170922,10,너무도 순수한 그들의 여정이 눈물겹다  
20170922,10,공들여 만든 작품인 게 보입니다. 최고의 다큐멘터리  
20170922,10,환생을 믿는 그들의 전생을 찾는 여정의 최고의 감동 휴먼드라마 기대됩니다  
20170922,9,감동적일거같아요  기대합니다  
20170922,10,마음이 따뜻해지는 영화~!  
20170922,9,다시태어나도 우리눈물이 주륵주륵 감동스러운~ 영화 일 듯  
20170922,9,사제의 정이상의 유대관계를 어떤 연출력으로 관객들에게 보여줄지 기대됩니다  
20170922,10,인생을 돌아보는 계기가 될 것 같아요  
20170922,10,올 가을 따뜻한 영화 개봉하는것 같아 기대되요  
20170922,10,"올해 최고의 영화였어요감동과 울림, 순수와 아름다움을 느낄 수 있는 영화입니다  "
20170922,9,시사회로 보고 왔는데 마지막에 울고나왔네요. 한 영화에 9년이라는 시간이 담겨있고 또한 린포체의 성장과 스승과의 이별이 모두 담겨있는 영화가 또 있을까요. 제가 봐왔던 영화들과는 많이 다른 장르였지만 본 것을 후회하지 않습니다!!  
20170922,10,"제 의지로 평점을 처음 써보네요. 제 인생다큐 입니다. 요 몇일 제 월급에 얼마나 투정부렸는지, 또 왜 나는 이렇게 생겨먹었나 스트레스 받았는지, 스스로 깊이있는 사람이라 생각하고 있었는데, 제 인생을 통으로 다시 들여다보게 됐어요. 꼭 보세요.  "
20170922,10,시사회 보고왔는데 남친이랑 둘다 OO만에 영화관에서 울었네요 강추합니다  
20170922,10,주인공들이 웃을 때 관객인 나도 진심으로 행복해서 웃었던 영화. 너무나 따뜻한 영화에요  
20170922,1,지루하다...재미는 당연히 없고...  
20170921,10,정말 명작입니다. 8년만에 울었습니다. 꼭~보세요  
20170920,10,추석명절에 가족들과 보기에 좋을 훈훈한 영화네요.너무 감명깊게 봤고 저는 명절에 가족들과 또한번 볼 예정입니다.긴 기간 이 영화찍느라 많이 고생했겠다싶네요..  
20170919,10,"티벳불교와 린포체, 라다크와 히말라야라는 생소한 소재임에도 아름다운 자연 풍광과 앙뚜와 스승님의 동행이 마음을 울리는 영화인 것 같습니다. 소라나팔 소리가 잊히질 않아요~~ 킹스맨에 가려지겠지만 많은 분들이  꼭 보셨으면 하는 영화예요!  "
20170917,10,"인간의 선한 본성을 느끼게 해주는 아름다운 이야기.이런 멋진 다큐를 9년에 걸쳐 찍은 분들, 배급해주는 분들에게 감사를!  "
20170914,10,"이래서 다큐 봅니다ㅠㅠ 사실이 어떻든 전생이 있든없든믿음대로, 사랑하며 살아가는 둘을 보며 많이 울었습니다. 믿는대로 사는것이 진실인지도.. 9년간 감독님 고생하셨고 좋은 영화 만들어주셔 감사합니다.  "
20170913,10,잔잔하고 마음 한곳이 따뜻한 그런 다큐였습니다  
20170913,10,요즘현실에서는  볼수없는  현실이   진한감동입니다꼭보세요.  수입영화인줄알았는데. 순수우리영화여서더욱감동이었습니다  
20170913,10,마음이 깨끗해진 영화..보는 내내 마음이 깨끗해 진 기분이었다.미소짓게 하고 감동적....  
20170913,10,"스승의 섬김과 보살핌, 앙뚜의 스승에 대한 애정과 존경이 정말 감동적입니다. 함께 설산을 오를 때의 장면은 정말 잊지 못할 명장면입니다. 소라나팔 소리도요. 그 감동을 간직하고 싶어 책도 샀습니다.  "
20170907,8,이거 완전 영화가 불심으로 대동단결!! 흐압!  
20170826,10,다른 사람의 삶이 이렇게 마음에 크게 와닿을줄은 상상도 못했네요. 삶의 숭고함과 아름다움이 느껴지는 한편이었습니다. 앙뚜가 스승과 함께하는 한 장면 한 장면들이 잊혀지지 않네요. 제 삶을 돌이켜보게 됩니다. 좋은 작품 감사합니다.  
20170704,10,마지막 티베트로 향하는 길에서 펼쳐지는 넓은 설원장면에서 눈물이 쏟아져 나왔습니다. 알지도 못하는 인생의 행복을 향해 있는  내 머릿속이 초기화 되는 장면이였습니다. MBC스페셜로 보았는데 극장스크린에서 티베트 설원 위 앙뚜와 스승님의 동행을 보고파요  
20170503,10,"진한 감동이 아직도....불자가 아님에도 불구하고 감동적 다큐였고, 앙뚜의 맑은 눈빛이 그리워지네요.  "
20170503,10,"감독님..앙뚜 린포체는 현재 교육을 잘 받고 계시는지, 그의 스승님의 건강은 어떠신지 꼭  소식 좀 알려주세요. 다큐는 끝난게 아닙니다.  "
20170221,1,전형적인 오리엔탈리즘 그리고 서구영화제  
20170221,10,ttv에서 우연히 채널 돌리다가 본 영화(?). 자신의 전생을 기억하고 믿고 묵묵히 삶을 받아들이는 앙뚜를 보면서. 나 자신의 삶을 되돌아 보는 계기가 되었네요^^ 앙뚜와 스승의 행복을 빕니다. 화이팅~~  
20170125,10,"이렇게 귀한 다큐를 만들어 주신 문창용, 전진 감독님께 깊은 감사 인사 드립니다. 앙뚜스님과 스승스님은 지금 잘 지내고 계신지.. 소식이 너무 궁금하네요. 후속작도 꼭 나오길.. ㅠㅠ 그리고 린포체 앙뚜와 스승님이 늘 행복하길..  "
20170121,10,어린 린포체 앙뚜와 헌신적인 노스승 우르간의 우정과 종교적 신념에 감동의 물결이 밀려오는 영화. 라다크의 자연경관은 보너스구요. 오랜만에 잔잔한 감동으로 눈물 지으며 봤습니다. 린포체 앙뚜의 수도와 스승님 아르간의 건강을 위해 늘 기도할게요..  
20170121,10,감명깊은 작품이었어요 ....  
20170118,10,훌륭한 삶에 대한 의지와 열망이 티벳불교의 종교로서의 역할인거 같단 생각이 들었다. 환생한 스님 린포체 !   다시 사바세계에서의 삶을 살며 성불을 위한 고단한 수행을 마다하지 않는 모습에서 티벳불교와 티벳인과 불교의관계를 이해 할 수 있었다.  
20170117,10,노승의 헌신은 아름다움을 넘어 고귀했고 어린 린포체의 삶은 먹먹하지만 성스러웠다  
20170117,10,"잔잔한 여운 따뜻한 감동....영혼이 맑아지고 가슴이 넓어짐을 느낍니다..각박한 세상 몇일이라도 버틸 힘이 생겼어요 ㅎㅎ앙뚜 2부,3부 만들어주세요. 기대하고 응원합니다~~!!  "
20170117,10,가슴으로 울면서  시청했습니다..노스님과 앙뚜의 모습이 너무도 아름답고  아름다웠습니다 .. 가슴따뜻한 이야기를  고스란히 전해주셔서  감사합니다 ..오랫동안 잊지못할 감동으로 남을거 같습니다 .!  
20170117,9,삶이란게 참 숭고 할수있구나  생각하게됬어요..  
20170117,10,1월 16일 MBC스페셜을 통해 보았어요.보는 내내 안타깝고. 마음 아프고. 눈물까지 났어요. 앙뚜곁을 지키는 스승님 존경스럽고. 오래오래 건강하게 앙뚜곁에 있기를 기원해봅니다.  
20170117,10,너무 감동적이였습니다!! 보는 내내 얼마나 눈물이 났는지 몰라요 아직도 가슴이 먹먹하네요  
20170117,10,가슴이 너무 먹먹해져요. 외로운 여정을 스승님과 함께 할 수 있어서 다행이에요. 시킴에서 교육 잘 받고 있는지 궁금해요.  
20170117,10,"마냥 아이이기만 해도 부족할 짧은 삶을 살아온 이에게 시련은 날이 갈수록 더 커질 뿐, 이에 누구도 약해지기 마련인데 단순히 버티는 것을 넘어 강해지는 모습에 가슴이 아려옵니다. 특히 린포체의 친구가 앙뚜에게 부러움을 표현하는 장면이 뇌리에 남습니다.  "
20170117,10,스승님은 대가 없는 그런 무조건적인 사랑이 느껴지고 어린 린포체는 맑고 순수한마음이 많이 느껴졌어요~이 두분 모두 건강하고 행복하게 오래오래 살았으면 좋겠어요~  
20170117,10,"불평불만이 많은 요즘의 나를 돌아보게 하는 그런 다큐입니다. 다른 분들도 이 작품을 통해 각자가 가지고 있는 괴로움, 힘듦이 덜어지길 기도합니다.  "
20170117,10,오랜여정에 힘들어하시는 스승께 간지럽힌다고 스승님웃으시게하겠다고 또스승님을 힌두어못한다고 놀리면서 결국에 스승님을 웃게할때 왜 그장면에 한없이 눈물이 나던지요 스승님과 왕뚜의 건강을 기원합니다  감동이네요 계속 뭉클하네요  
20170117,10,영상까지 아름다웠습니다  
20170117,10,아름다왔다...스승과 린포체 앙뚜....  
20170115,10,DMZ 영화제를 통해 앙뚜를 봤습니다. 화려한 액션이나 많은 대화가 없었어도 연로하신 스승님과 란포체 둘의 신뢰와 사랑이 느껴졌습니다.마지막즈음 둘이 헤어지는  가짜눈싸움장면에선 눈물도 났답니다. 잔잔하지만 깊은 감동을 주는 좋은 영화였습니다.  
20170115,10,"다큐라 지루하지 않을까 기대치 않고 봤는데... 관람하는동안 웃음과 뭉클함, 감동을 주는 시간이여서 넘 좋았답니다. 추천추천!!  "
20161015,10,"다큐멘터리 영화는 워낭소리 후 처음으로 가슴깊이 감명받으며 눈시울이 붉어졌습니다. 린포체라는 티벳불교의 커다란 주제속에 스승과 제자의 사랑 아니, 처음부터 끝까지  영화속에 흐르는  주제는 부모의 무조건적인 자식의 사랑과도 닮아있다.꼭한번 시길 추천!  "
20161014,10,보고나면 따뜻함과 감동이 가슴을 꽉 채우는 영화!  
20161014,10,마음깊은 곳의 따뜻함과 순수함이 느껴지는 영화.앙뚜의 모습을 화면에 잘 표현 했고 한번더 보고 싶은 생각이 듭니다.  
20161012,10,"오랜만에 느껴보는 마음깊은곳의 따뜻함 순수함이있는 영화  ,스승과 제자를 넘어 얼마나 사람들이 서로 신뢰하며 아낄수있는지 험한 인생길을 동행할수있는지를 보게한 잊을수없는 장면들과 잘다듬어진 한글자막이나  영어자막들이 한편의 시 같고 영화  "
20161010,10,앙뚜와 우르갼의 따뜻한 동행에 감동 벅차는 영화이었습니다.다시 한번 더 보고싶은 그런 영화였습니다.  
20161009,10,부국제에서 봤는데 8년이라는 세월동안 준비해오셨다니 정말 대단하신 것 같습니다. 그리고 기대 이상의 재미와 감동으로 저절로 행복해지는 영화였습니다. 꼭 영화관에서 개봉해서 더 많은 사람들이 보길 바랍니다!  
20161006,10,뛰어난 영상미는 물론이고 잔잔한 여운이 주는 감동이 잘 전달된 것 같습니다. 종교적인 의미를 떠나 새로 알게 된 사실 또한 흥미로웠습니다.  
20161004,10,"The doc was really good, and touching.The staff did such a good and hard job to capture all this intimate moment. I really loved the story  "
20161004,10,"보는내내 잔잔한 감동이 흐르는 영화. 린포체와 스승, 그리고 주변 인물들을 화면으로 지켜보면서 그들을 향한 이질감은 서서히 줄어들고 결국에는 공감만이 남는다. 비쥬얼, 내러티브, 사운드, 모든걸 갖춘 다큐 또 보고싶다!!  "
20161004,10,종교를 떠나서 진정한 사랑의 뜻이 무엇인지 잘 전달되는 영화. 그리고 이 어린아이의 시각으로 보는세상의 관점 그리고 그것으로부터 어른들이 느낄 수 있는 것은 말로 표현 할 수 없다. 8년에걸친 다큐로 보는 사람이 같이 성장 하는것같다.  
20161004,10,"DMZ 영화제에서 우연찮게 보았는데 종교적인 면을 떠나서 나이와 신분을 뛰어넘은 사람간의 관계, 사랑을 그려낸 아름다운 다큐멘터리였습니다. 추천합니다 :)  "
20161004,10,너무나도 좋은 영화였습니다. 친구랑 가족과 함께 가서 보았는데 장면 하나하나가 그림이었습니다. 감독님께서 스승과 제자의 관계를 화면에다 잘 담으셨고 내용두 감동이었습니다!  
20160928,10,감독님들의 자유로운 시각을 엿볼 수 있는 다큐영화 추천드림  
20160925,10,"DMZ국제다큐 영화제에서 봤는데 앙뚜와 스승님의 관계와, 신념을 이어나가려고 하는 앙뚜의 모습이 인상깊었습니다.한번쯤 보면 좋을 영화인것 같습니다꼭 보세요 여러분!!  "
20160923,1,혹시 ebs다큐프라임에서?  
20161009,10,부국제에서 봤는데 8년이라는 세월동안 준비해오셨다니 정말 대단하신 것 같습니다. 그리고 기대 이상의 재미와 감동으로 저절로 행복해지는 영화였습니다. 꼭 영화관에서 개봉해서 더 많은 사람들이 보길 바랍니다!  
20161006,10,뛰어난 영상미는 물론이고 잔잔한 여운이 주는 감동이 잘 전달된 것 같습니다. 종교적인 의미를 떠나 새로 알게 된 사실 또한 흥미로웠습니다.  
20161004,10,"The doc was really good, and touching.The staff did such a good and hard job to capture all this intimate moment. I really loved the story  "
20161004,10,"보는내내 잔잔한 감동이 흐르는 영화. 린포체와 스승, 그리고 주변 인물들을 화면으로 지켜보면서 그들을 향한 이질감은 서서히 줄어들고 결국에는 공감만이 남는다. 비쥬얼, 내러티브, 사운드, 모든걸 갖춘 다큐 또 보고싶다!!  "
20161004,10,종교를 떠나서 진정한 사랑의 뜻이 무엇인지 잘 전달되는 영화. 그리고 이 어린아이의 시각으로 보는세상의 관점 그리고 그것으로부터 어른들이 느낄 수 있는 것은 말로 표현 할 수 없다. 8년에걸친 다큐로 보는 사람이 같이 성장 하는것같다.  
20161004,10,"DMZ 영화제에서 우연찮게 보았는데 종교적인 면을 떠나서 나이와 신분을 뛰어넘은 사람간의 관계, 사랑을 그려낸 아름다운 다큐멘터리였습니다. 추천합니다 :)  "
20161004,10,너무나도 좋은 영화였습니다. 친구랑 가족과 함께 가서 보았는데 장면 하나하나가 그림이었습니다. 감독님께서 스승과 제자의 관계를 화면에다 잘 담으셨고 내용두 감동이었습니다!  
20160928,10,감독님들의 자유로운 시각을 엿볼 수 있는 다큐영화 추천드림  
20160925,10,"DMZ국제다큐 영화제에서 봤는데 앙뚜와 스승님의 관계와, 신념을 이어나가려고 하는 앙뚜의 모습이 인상깊었습니다.한번쯤 보면 좋을 영화인것 같습니다꼭 보세요 여러분!!  "
20160923,1,혹시 ebs다큐프라임에서?  
