0,1,2
20170627,7,탄탄한 연기와 더불어 시대를 뚫고 나가는 당찬 정신.  
20170627,9,속이시원하다 일제에 할 말 다하는 박열과 후미코! 중간중간 소소한 재미도 있고 최희서배우의 일본인 연기 굿굿  
20170627,9,이제훈ㆍ최희서의 연기가 넘 빛났던영화ㆍ목숨을건 당당함과  같은 정신과 같은 사상에서오는 사랑의힘에대해 너무 유쾌하게 풀었준영화 추천합니다  
20170627,10,오늘 박열 시사회에서 영화를 관람하고 우리나라 국민 이라는 사실이 너무 자랑스러웠습니다. 이런 영화들이 많이 개봉 되어서 우리 나라의 역사를 정확하게 알려야 한다고 생각 합니다.  
20170627,10,"시사회보고 왔습니다.보면서 ""시대는 변했고 감독은 천재다"" 느꼈습니다.  "
20170627,10,일제가 묻으려 했던 역사와 그것을 반역하려는 조선의 어린 청년과 그와 후미코의 진정한 사랑 너무 좋았음. 일제에 피로 물들인 반역이 아닌 조선인의 정신을 보여주는. 이준익 감독님 다운 영화.  
20170627,10,연기도 정말 좋고 다 좋았습니다. 웃다 울다 했네용  
20170627,10,좀 긴듯 하지만 울다 웃다 재미있게 봤어요~ 한국인이라면 꼭 봐야할 영화~ ^^  
20170627,10,잘몰랐던 인물을 이런 기회로 알게 되어 좋았고 기대했던 만큼 감동적으로 보았습니다.  
20170627,10,박열과 후미코의 진정한 사랑에 감동했어요  
20170627,10,꿀잼!! 이과라 표현할 방법이..  
20170627,9,이제훈도 이제훈이지만 후지코 역할배우분 대박!영화보고 울고 웃고.. 진짜 짱짱  
20170627,10,가슴이 뜨거워지는 영화마냥 교훈적이지 않고 웃기고 슬프고 당당하게 지켜낸 우리 역사를 잘 다룬 듯  
20170627,10,잊을 수 없는 강열한 이름 박열  
20170627,9,연기들이 좋다.  찾아볼만한 영화!  
20170627,9,박열의 이런 일생을 알게되어 좋았다.연기력 굿.  
20170627,9,생각보다 잔잔하지만 우리가 꼭 봐야할 영화~  
20170627,8,포스터에 속은 느낌이지만 재밌었어!  
20170627,8,영화 보고나니 박열에 대해서 더 궁금해지네요.엔딩이 넘 맘에들어요!  
20170627,10,재미있어요!!!!잘봤습니다  
20170627,10,매우 감동적임. 강추합니다  
20170627,8,이제훈과 후미꼬의 열연 너무 멋져요  
20170627,8,정말정말 괜찮은 영화네요  
20170627,9,좋아요 ㅋㅋㅋ 실화여서 더욱 ㅋㅋㅋ  
20170627,10,모레 보러 갈 예정인데 기대됨  
20170627,10,감동적이다!강추합니다~!  
20170627,10,정말 박열이라는 인물에 대해서 새롭게 알게된영화입니다 강추!  
20170627,10,최고의 영화예요! 꼭 봐야하는영화입니다...  
20170627,10,역사에 관심이 없었던 사람이였는데 이 영화를 보고 다시금 관심을가져야겠다고 하는 감동을 받았습니다.  
20170627,10,재밌었고 감동적입니다!!! 추천해요 꼭 보세요~~  
20170627,10,우리가 꼭 봐야할 영화!  
20170627,10,한국사람이라면 꼭 봐야합니다.애국심이 불타오릅니다.  
20170627,10,시간 가는 줄 몰랐어요 꼭 보세요~~  
20170627,9,시간 긴줄도 모르고 재밌게 봤어요~  
20170627,10,가슴이 찡한 한 독립운동가와 그와함께한 이들의 나라에대한 사랑이니껴졌다  
20170627,8,일제 강점기의 아픔을 재밌게 다룬 작품. 이제훈과 여주인공 연기가 돋보인다  
20170627,10,캬 너무 재밌었어요~~~  
20170627,8,슬픈과거를 웃음으로 승화시켰다  
20170627,9,박열에 대해 잘 알게된..잼있어요ㅎㅎ  
20170627,10,이제훈 연기 잘해요박열 대박!  
20170627,9,너무재밌었오요ㅠㅠㅠ진심이에요  
20170627,9,재미와 감동이 함께있는 영화엿습니다??  
20170627,10,감동...박열도 박열인데 후미코가진짜대단한여자다ㅜㅜ  
20170627,10,박열 너무자렁스럽고 꼭기억하겠습니다  
20170627,10,연기들 전부 미쳤다.미친다  
20170627,10,박열 감동적이고 추천해요~~  
20170627,10,"잘봤어요, 재미져욜호호  "
20170627,10,역시 이준익 감독님 작품다워요 박열 알게되어 좋았어요  
20170627,10,박열 잘 봤어요 꼭 보세요~~~  
20170627,10,너무 통쾌하고 감동적이었어요 강추~! ^^  
20170627,9,몰랐던 역사적 사실을 알게되었습니다. 추천합니다~^^  
20170627,10,박열 너무나도 감동적입니다?꼭보세요  
20170627,9,시사회 봤어요 이제훈 연기감명깊고 일본어 너무 잘함 여운이 남는 영화! 몰랐는데 암튼잘봤습니다 통쾌함 각  
20170627,10,이 시대에도 간절한 진정 애국자. 감동!  
20170627,8,진지하고 재밌게봤습니다  
20170627,10,실화라는 것이 믿기지 않을 만큼 그 시절의 불가능한 당당함과 자긍심이 돋보이는 영화였다박진감넘치거나 스릴이 있지 않음에도  상영시간 내내 긴장되고 집중되던 영화였다  
20170627,8,재밌게 봤습니다~!! 이제훈 잘생김 보는 재미도 ㅋㅋㅋㅋ  
20170627,7,괜찮아.요 ~~~^^  
20170627,8,조선의 아나키스트 박열의 이야기가 진심으로 전해집니다  
20170627,10,시사회로 봤는데 너무 재밌고 감동적이에요ㅜㅜ  
20170627,10,영화 너무나도 감동적으로 보았어요?역사에 대해서 다시한번 생각하게 되였어요?모두 한번 꼭 보세요  
20170627,8,후미코가 기억에 남는영화.  
20170627,8,괜찮아요 괜찮아요 괜찮아요 괜찮아요 괜찮아요 괜찮아요  
20170627,10,좋아요 추천합니다!!  
20170627,9,슬프고 생각할게 많은 영화인거 같아요  
20170627,9,가슴 뭉클하고 애틋함. 볼만해요.  
20170627,10,재밋어요 감동잇고 재밋고 중간에빵빵터져요  
20170627,10,너무 재밋어요!! 강추 !! 또 볼래요  
20170627,10,박열 재밋습니다 연기도좋앗습니다 추천합니다  
20170627,10,시사회로 미리보았믄데조선을 동경하는 일본인과그들의 사랑얘기지만진부하지 않은 감정선과 재미까지 !!더쓰면 스포될까봐 이만줄잊니다꼭 보세요  
20170627,10,"재미와 유쾌함 그리고 가슴 뜨거움을 느낄수 있는 영화입니다. 한번 봤지만 또 볼꺼에요. 친구, 부모님과 함께보고 많은 대화를 나눌수 있을것 같습니다.  "
20170627,10,"박열님은 잘 알지못해서 실화인줄 몰랐는데 영화를 통해 알수있게 되어서 좋았습니다. 이제훈님이야 믿고 봤고, 가네코 후미코역의 최희서님 이쁘시더라고요 :)  "
20170627,10,잘 만든 영화 재밌게 잘 봤습니다~ 한번쯤 봐볼만한 영화!!! 아니 꼭 봤으면 하는 영화~ 배우들도 연기 엄지척!!! 이제훈 못지않게 여배우도 연기잘하고 모든 배우들 연기짱입니다  
20170627,9,포스터보다 내용이 더 알차고 재미있음 생각외의 꿀잼  
20170627,10,꼭 한 번 보시길 바랍니다.  
20170627,10,넘 재밌는 영화 관람했습니다  
20170627,7,몰랐던 역사적 사실을 알리는 건 좋았으나 영화적 감흥은 크지않았습니다.  
20170627,10,이 영화 정말 대박입니다~! 꼭보세요!  
20170627,10,꿀잼 꼭 보세요. 재미있어요  
20170627,9,민족열고 코믹과 로멘스가잘되어서 좋아요  
20170627,10,볼만했어요 몰랐던 역사적 사실  
20170627,10,대한독립투사 한명에 대해 더잘알게되고 역사공부가된거같아서 좋았습니다!!  
20170627,10,"멋진 영화, 잘 봤습니다!!!! 많이들 보시길...  "
20170627,10,잘 봤습니다. 꼭 보세요!!  
20170627,10,이제훈이 멋있었어요!!  
20170627,8,몰랐던 역사적 사실을 알게되어 좋았습니다. 하지만 영화 연출은 가벼운 편이네요  
20170627,10,시사회로 봤는데 진짜 감동 재미 웃음 모두역사를 잊지말자!ㅠㅠ  
20170627,10,한국인이라면꼭봐야하는영화에요  
20170627,10,박열에 대해 새롭게 알게되었네요.시간내내 흥미로웠어요.  
20170627,9,재밌습니다 위트있고 재밌어요  
20170627,10,기대밖에 너무 재미있었던 영화엿습니다!!  
20170627,10,꼭 봐야함 넘 감동적이에요  
20170627,10,진심을 느낄수 있는 영화였어요..  
20170627,9,몰랐던독립투사이시네요...이제훈의연기가 빛난던 영화입니다..  
20170627,10,시사회 보고 왔습니다.. .  감정이입되서 엄청 울고왔네요. .  꼭 보시길  
20170627,9,박열~한국인이라면 꼭 봐야할 영화~  
20170627,10,코믹적이만 감동적이였고 재밌었습니다  
20170627,9,실화라서 그런지 더욱 내용이 다가오고 몰랐던 이야기를 전달 받을수있어서 감동적이였습니다. 꼭 보셨으면 하는 영화입니다.  
20170627,9,감동도 있고 재미도 있어요.  
20170627,10,너무 재밌고 한국인으로서 꼭 봐야해요  
20170627,9,통쾌하지만 씁쓸한 그 시대의 사건들...꼭 보세요!  
20170627,10,이제 배우보고 영화보는 시대는 지났다.  검증된 이준익감독 보고 영화 보러갑니다.  
20170627,10,알려지지 않았던 독립투사 박열의 파란만장한 일생을 이준익 감독님과 이제훈 배우가 만들어가는 멋진 영화로 만날수 있어서 무척 기대됩니다!!!  
20170627,2,일제시대 탄압 영화  왜자꾸 나오냐   지겹다 식상한 스토리  
20170627,10,"무대인사때 보고왔는데, 새삼스레 우리나라를 위해 힘들게 희생했던 독립운동가들의 마음이나 아름다운 우리역사를 되돌아 볼 수 있는 뜻깊은 영화였어요 중간중간 재밌는 요소도 있고 역사속 그분들이 있었기에 오늘날이 있음을 깨닫게 되는 좋은 영화~~~  "
20170627,10,박열 너무 기대중이에요ㅎㅎ!!!이제훈.최희서 배우님 연기가 너무좋다고여기저기서 들려오는데 28일 개봉하자마자 달려가겠습니다. 박열 최고!!  
20170627,1,너무 과도한 언플로 보고 싶은 마음도 사라졌다...  
20170627,10,좋은 영화 감사합니다!  
20170627,1,국뽕영화. .이준익 사도. .  
20170626,10,빨리 보고싶다ㅏㅏㅏㅏ  
20170626,1,망망망했어...노잼  
20170626,2,"인물도, 사건도, 개연성도, 스토리도, 카메라 연출도, 엔딩도 모두 난장판. 역사물 영화에서 등장한 흔한 요소와 도전정신과 애매한 캐릭터 설정이 모인다면 여러분의 돈을 쓰레기통에 넣을 <박열>이 완성됩니다! ""당쉬니 빠끄-요루?""  "
20170626,10,대구 개봉전 무대인사 다녀왔었습니다. 시대극은 어쩌면 지루할 수 있는데 박열이라는 캐릭터가 주는 통쾌한 면들 덕에 지루하지 않고 너무 재미있었습니다.  
20170626,10,믿고보는 이제훈이 아니라 믿고보는 이준익일듯 암튼 기대됨  
20170626,10,좋은 영화네요..  초대박나세요  
20170626,10,이준익감독의 전작 동주정도로만 만들어준다면 국내영화중 명작대열에 끼게 될텐데 기대합니다..  
20170626,10,ㅜㅜ얼리버드 놓쳤다..ㅠㅠ  
20170626,8,"박열, 독립투사?의 이야기이지만 연애관, 결혼관에 대해 다시 한 번 생각하게 되었고 그들의 삶에서 힘든 가운데 유쾌함을 느낄 수 있어 좋았다. 주연들 캐릭터가 살아있는 듯했다. 배우들간의 호흡도 좋았다. 정말 간만에 영화보고 '좋다.'라 생각한 영화  "
20170626,10,진심 감사합니다... 여지껏 우리가 몰랐던 박열의사에 대해 더 알수있었고. 이분을 연기한 이제훈 배우 연기력도 수준급이구요 ㅎㅎ 정말 천만관객기대 ㅎㅎ 화이팅입니다. 덕분에 박열이란 독립투사에 대해 저 자세히 알려고 도서까지 구매했습니다ㅎ 감사합니다  
20170626,10,진짜 대박입니다 우리나라에 이런영화가 있다니 자랑스럽습니다 ㅠㅠ  
20170626,10,우리나라역사의 꼭 알아두어야할 한부분이네요.배우들의 열연이 눈에띕니다. ^^  
20170626,10,두 배우의 연기가 돋보이는 작품입니다.  무거운 내용이지만  익살스럽게 푸는것이 매력적이에요! 꼭 관람하세요!  
20170626,1,평점 조작이 넘 심해서 조정들어갑니다.  
20170626,1,알바들 안타깝네 개망작ㅋㅋ  
20170626,1,이거 7월 초에 스파이더맨한테 지게 생겼구만 이런 역사영화 기대 안해  
20170626,10,박열 화이팅!!! 이번에 꼭 보러갑니다 ㅎㅎㅎ 기대할게요 이제훈배우~  
20170625,6,"역사적으로 우리가 알아야할,잊지말아야할 부분. 하지만 영화로써의 매력은 다소 아쉬웠다.  "
20170625,10,"이제훈 보러갔다가 최희서 배우한테 반하고 온 영화 ..♥두 주연 배우 뿐만 아니라 다른배우들 연기도, 작품 스토리도 뭐하나 빠질거 없는 영화예요ㅠㅠ  "
20170625,10,ㅠㅠ이런 영화 진짜 많이 만들어져서 후손들한테 잘 기억되길바라요... 잊으면 안되는 역사입니다.  
20170625,2,이제훈 팬들은 개봉하고 1주일 안에 보세요 ㅋㅋ 1주일 지나면 스파이더맨 나와서 IPTV행 갑니다 ㅋㅋㅋ 전 다운받아서 볼랍니다~  
20170625,10,헐.. 여주 한국인이었어?;;; 예고편보고 진짜 일본인인줄 알았는데ㄷㄷ;;;  
20170625,10,역시 연기파 배우들은 달라  
20170624,10,이제훈 화이팅!!!!  
20170624,10,이제훈!!!!꼭봐야지!!!!  
20170624,10,우리가 대한민국 국민이라고 당당하게 행복하게 살 수 있도록 해주신 존경하는 선배들이 많이 사셨던 시대. 박열은 우리가 잘 몰랐던 분. 한국인이라면 꼭 봤으면 하는 영화다. 가슴이 뜨거워지는 영화. 애국심을 더 불타오르게 하는 영화이다.  
20170624,9,"진심을 담아 9점입니다.나머지 1점은 개봉하고 드릴께요.얼마 전 영화를 보고, 실제 사진 한 장을 찾아보고자 웹검색을 하다가 생각나서 평을 쓰게되네요.남자주인공의 연기도 참 좋았는데, 전 여자주인공 또한 명연기를 했다고 생각이 드네요. 꼭 보세요  "
20170624,10,"개봉전 상영을 보았는데..개봉후에도 꼭 보고싶습니다. 일제강점기, 독립투사 라는 두 단어를 빼더라도 정말 훌륭한 작품이였습니다. 한 인간에 대해서, 인간의 삶에 대해서. 그리고 미치고 싶을때 어디로 미쳐야하는가에 대해서.. 여운이남는작품입니다.  "
20170624,2,이제훈님이 흥행보증 배우도 아닌데 불구 포스트를 얼굴 100% 채운게 이해가 안가네요댓글은 왜 이렇게 알바가 많나요 .. 하나 같이 내세우는게 이제훈이라 신빙성이 떨어지네요  
20170624,10,연기자들의 연기가 대단합니다.  
20170624,10,독립투사....더 말할 필요 있는가?  
20170624,10,이건 진짜 봐야되!!!  
20170624,10,역사물을 만드는 이준익 감독에게서 이제는 장인정신이 묻어난다. 우디 앨런처럼 꾸준히 다작을 해줬으면...  
20170623,8,이준익은 이제 어떤 경지에 오르지 않았나 하는 생각이 들었다. 이제훈 최희서 등 배우들의 연기도 훌륭하다.  
20170623,10,전 재밋었어요! 화가 나는 영화임에도 불구하고 박열이라는 캐릭터 자체가 밝고 재밋었어요!  
20170623,10,올해 본 영화 중 진짜 명작임  
20170623,1,언제까지 반일감정부추겨서 돈벌레?뿔쌍한놈들 역겹다  
20170623,9,시사회 다녀왔습니다. 시간 가는 줄 모르고 보았습니다.꼭 한번은 봐야하는 영화입니다!  
20170623,2,"하필 소재가 사회주의자. 독립운동의 정신은 높게 사지만, 사회주의를 소재로 신격화한것 별로. 이준익감독의 정치적 지향점이 엿보이는 영화. 배우들의 연기력으로 어필.  "
20170623,8,다 좋은데 포스터 느낌은 배가본드 빼박 ㅡㅡ표절 좀 그만하자 시대가 어떤시대인데 아직도표절하냐 ㅡㅡ그리고 일제시대영화 포스터를 일본작품을 표절하냐 생각이 있는건지 없는건지 에휴..  
20170622,10,자꾸 얼핏보면 류승범같다. 외모 이미지가 비슷 ㅋㅋ 이제훈도 좋지만 류슴범이 연기했어도 괜찮았을듯  
20170622,1,이준익 필모 최고의 망작. 좋은 소재와 배우늘을 날려먹었다  
20170622,10,시사회로 보고왔는데 정말 재밌었습니다! 비참하게 억압받는 시대상을 무겁게 보여줌과 동시에 분위기를 환기시켜주는 장면들이 있어 지루하지 않았고 역사속인물 중 크게 알려지지 않았던 박열이라는 인물에 대해 다룬것이 새로우면서도 인상깊게 다가왔습니다.꼭보세요  
20170622,10,진짜 너무너무 재밌게 봤어요. 무대인사때 봤는데 정말 .... 감동과 재미~!!!!  
20170622,1,빨간색으로 이름쓰면 못써  
20170622,10,시사회로 영화관람했습니다. 일제강점기시대를 바탕으로 다른 영화들은 일본의 악행만 보여주는 이미지가 강한 반면 박열은 그 시대속에서 한국인을 도와주고 같이 힘써준 일본사람들이 있다는걸 보여주는 영화이기에 민족관을 넘어 인간관계에서의 감동을 주었네요.  
20170622,10,보러가야지 ㄹㅇ 오지겠다 앞으로ㅇ런영상만ㅇ나오게해주세요  
20170622,10,시사회로 보고왔습니다. 연기력은 말할 것 없고(특히 여주인공...) 꼭 봐야할 뭉클한 영화입니다..  
20170621,5,"최초시사회 관람객입니다. 예술적 감각 그런 거 하나도 없는 그저그런 대중 한 명의 시각에서 이 영화가 뭘 말하고자 하는지 잘 모르겠고, 박열의 개인사와 관람객의 애국심 모두 잡으려다 모두 실패한 느낌이었습니다.  "
20170621,8,상당히 인상 깊게 봤던 이준익 감독의 역사 시리즈들. 동주나 사도에 비하면 조금 가벼워 보이기는 하지만 역시나 기대된다  
20170621,7,화려한 액션을 예상했지만 그것 보다 눈에 띠는 감동. 추천.  
20170621,8,CGV시사회로 관람했습니다.직접적으로 감정을 고조시키는 장면없이 잔잔하게 울림을 주는 영화였다고 생각해요.후미코를 연기한 최희서 배우의 연기가 인상적이었습니다.  
20170621,10,"cgv시사회 보고 후기 남깁니다! 실제 있었던 이야기를 과한 각색없이 보여준다는 생각이 들었어요! 조선인을 정치적으로 이용하는 일본의 야만적인 방식을 드러내고있고, 이에 맞서는 박열, 후미코, 그들의 동료들. 멋진 사람들이 있었음에 감사했습니다.  "
20170621,8,"빛나고 아름다운 최희서의 발견, 이준익 감독의 색채가 강하진 않지만 박열을 알리기엔 충분한 영화  "
20170621,9,끝까지 간다 다음으로 포스터를 거지같이 뽑은 영화인듯. 포스터 보고 흥미가 전혀 없었는데 시사회 당첨돼서 보러갔다가 많은 감명을 받고 나왔습니다 독립 투사분들이 지키신 나라를 우리는 얼마나 함부로 살고 있는지 다시 한 번 생각해보는 시간이었습니다.  
20170621,10,cgv시사회 보고 후기 남깁니다.이영화는 다른 일제강점기 영화에서 보여줬던 느낌이랑은달랐어요 다른 일제 강점기 배경으로 보여줬던 영화는 그시대의 심각한 상황을 우리에게 알리기위해 보여줬다고 하면 이 박열은 마치 일본정부에게 경고하는 느낌이 많았어요  
20170621,1,완전 하자영화고 보면 안되요  
20170621,7,모든 이상이 허상으로 들리는 시대는 그때도 지금도  
20170621,10,박열에 대해 알고 있는것이 없어서 검색 후 시사회를 보러갔는데 딱 그대로의 내용이어서 좋았습니다 이제훈배우의 연기도 너무 멋있었고 저 개인적으론 역사 영화 중 가장 마음에 든 영화입니다  
20170621,1,정말 이건 보고 싶지 않습니다 예고편도 흥미를 유발하는게 별로 없고...아무리 보아도 여름 시즌용은 아닌데...  
20170621,8,일본어 대사가 작위적이고 직역한 부분이 있었다. 대표적인 예로는 빨갱이는 파르티잔이 빨치산이 되고 빨갱이로 우리나라 발음대로 바뀐 건데 일본어 대사에 그냥 아카이라고 대사를 해 감정 몰입에 방해가 되었다. 하지만 박열이라는 사람을 알게 되어서 좋았다.  
20170621,9,극적인요소가 거의 없고 사실적인 요소만으로도 몰입감이 최고였다. 대중적인요소 쫙뺀것같아 누군가한텐 다소 진부할 수도 있을것 같았음. 어쨌든 나는 시간가는줄 모르고 봤다. . 으흐흑 대지진때 무고한 한국인이 대학살을 당했구나. .슬퍼  
20170621,8,두서없이 시작되는 빠른 전개와 러브스토리그래도 한국인이면 꼭 알고잇오야할 인물을 그린 작품이라 감동적으로 느껴졌어요  
20170621,1,시사회를 통해서 이미 관람했습니다.반일감정과 민족애를 교묘히 이용해서 공산사회주의자들을 미화시킨다고밖에 요약이 안되는 B급영화로 밖에 안보이네요.정권이 바뀌었다는게 실감됐던 작품입니다.  
20170621,7,오랫만에 이준익 감독 영화 나왔네..  기대중  
20170621,9,"CGV 시사회로 먼저 보게됐는데 재밌습니다!그 당시 억압과 무거운 분위기를 코미디 요소를 넣어 재밌게 풀어낸 느낌이 많이느껴졌고, 박열 열사에 대한 인물 분석도 신선하게 풀어낸 느낌었습니다.보기전까지 기대하진 않았지만 생각보다 재미있었습니다.  "
20170621,2,알바들 못봐주겠네 ....  
20170621,1,알바봐라 ㅋㅋㅋㅋ족망영화네  
20170621,10,박열을 비롯하여 역사속에 묻혀버린 지금의 우리나라 대한민국을 있게 해주신 수많은 호국영령과 순국선열에게 감사할 따름입니다. 이 영화를 계기로 더 많은 인물들이 알려지길 바라고 그 정신과 뜻을 우리가 계승해 나가길 간절히 바랍니다.  
20170621,10,Cgv vip 시사회'내 몸을 죽일 수는 있어도 내 정신은 죽일 수 없다.'어디선가 들어봤었던 말. 이 말 하나가 끝까지 남아 박열을 다시금 기억시킨다. 슬픈 역사 속에서 일본을 향한 강한 저항을 박열의 성격으로 부드러우면서도 더욱 강하게 나타냈다  
20170621,10,시사회로 봤습니다 가릴수록 더 드러나는 일본의 만행 잊지 말아야 할것 같네요  
20170621,9,시사회 보고왔습니다 다시 보고싶네요 단순한 반일감정만을 다룬것이 아닌 억지감동을 다룬것이 아닌 모든것을 다룬 정말 좋은 영화였습니다  
20170621,10,무겁지않게 잘 풀어낸거같당 잘 봤습니다 - CGV VIP 시사회  
20170621,7,후미코의 이상한 매력 굳!ㅋㅋㅋ  
20170621,10,"2시간이 자연스레 갔다. 지루하지않지만 큰 한방도 없지만 또 한번 잊지말아야 할, 몰랐던 사실을 알게되었다. 연기를 어찌나 잘하시는지 보는 내내 감탄했다. 특히나 최희서 배우님을 알게되어 좋았다. 무겁고 어두울수 있는 내용인데도 재미있게 봤다.  "
20170621,10,"어제 시사회 다녀왔습니다. 역사에 대해 잘몰랐던 제가 한심했던 하루였습니다.. 이번 영화를 통해 박열 선생님을 알게된 좋은 기회였던 것 같아요. 이제훈, 최희서 등 모든 배우들이 일본어를 너무 잘하셔서 진짜 일본인인줄 알았네요.  "
20170621,10,"와..이제훈 팬이라서 봤지만 정말 너무 기대이상으로 괜찮았던영화..배우들의 연기력, 스토리, 내용 구성, 말하고자하는 의미 모두 완벽했던것같아요. 웃음포인트 많아서 빵빵 터지구요, 또 감동적이기까지ㅠㅠ 정말 잘봤어요 또 보러가고싶어요ㅠㅠ  "
20170621,10,시사회에 다녀왔습니다! 일반적으로 역사주제를 다룬영화는 분위기가 무거운경우가 많은데 이영화는 그 내용을 무겁지않게 풀어가서 부담없이 볼수있었습니다! 또 중간에 웃음포인트가 굉장히 많아요. 다들 연기를 너무잘하셔서 집중해서 재밌게 볼 수 있었어요! 최고  
20170621,10,"시사회 보고 왔습니다. 이준익 감독과 이제훈 배우의 만남 자체로 기대가 컸는데 보고나니 그 이상이네요! 가슴 아픈 역사를 눈물과 감동뿐 아니라 웃음 요소도 적절해서 무거울 수 있는 내용을 조화로이, 그렇다고 마냥 가볍지만은 않아서 정말 좋았습니다.  "
20170621,10,"판교 현대백화점에서 시사회를 보았습니다...역시 제가 좋아할 수 밖에 없는 영화이고 배우님입니다..ㅠㅠ 개봉하면  또 볼거에요 이번 영화 시사회 통해서 정말 잘 봤습니다.이준익감독님, 이제훈배우님 그외 출연하신 모든 배우님  고생 많으셨습니다  "
20170621,10,오늘 시사회 당첨되서 보고 왔는데 중간중간 웃기고 스토리가 끝내줍니다. 박열 후미코 멋집니다!만세  
20170621,10,이영화에서 가장 소름돋는다고 느꼈던 것은 개인적으로 박열의 대사 중 덮으려고 했던 것은 꼭 밝혀지는 것이 자연의 순리이다. 라는 대사가 있었는데 그게 이 영화가 아닐까 라고 생각했습니다. 끝나자마자 다시 보고싶어지는 영화였어요 다들 꼭 보셨으면 해요!  
