0,1,2
20170621,10,20일 CGV VIP시사회 다녀왔습니다! 광고를 너무 하길래 재미없나?했는데 무슨 정말 너무 재미있습니다. 영화에 너무 빠져서 이제훈이 잘생겼다도 느끼지 못할만큼! 감독님께서 캐스팅도 잘하시고 내용도 잘잡으셨어요. (일본인이 봐도될만큼) 추천합니다!!  
20170621,10,오늘 시사회보고왔습니다!! 역시 이제훈이네요 재밌고도 슬픈 이야기 잘봤습니다  
20170621,8,"실화이자 안타깝고 답답한 이야기인데 중간중간 나름 풍자적요소로 호탕하게 웃었다.  ""니들이 감당할 수 있겠어?""  "
20170621,10,시사회 보고왔는데 연기력 모두 훌륭해요무엇보다 박열이라는 인물과 우리나라 독립투사들의 일생을 짧게나마 느낄 수 있어서 뜻깊었습니다.  
20170621,7,Anarchist from Colony  
20170621,10,너무 무겁지 않게그렇다고 너무 가볍지 않게그리고 전달하고자한 메시지는 명확한 영화  
20170620,10,이준익 감독님의 작품들은 진지한 분위기에서 계속되는 작품들이 많다고 생각했는데 [박열]은 그렇지 않았어요.:)배우들의 연기력과 스토리 연출 모두 너무너무 좋았던 영화에요.홍보가 다른 영화들에 비해 덜해서 아쉬울 정도에요! 추천합니다♡  
20170620,10,시사회 통해서 봣는데 역사물인데도 불구하고 그렇게 무겁지 않아서 보는데 더 좋았던거 같아요! 역사물을보면서 웃고 감동적이고 빠져드는 영화는 처음인것 같아요!! 정말 강추입니다!!! 재미있어요~!!!!  
20170620,10,박열 선생님을 이 영화를 보고 처음 알게 되었고 정말 22년 동안 꿋꿋히 옥살이를 하시고 또 한명의 독립투사로 우리에게 이렇게 영화를 통해 알게 도와준 이준익 감독님과 그 박열을 소화시켜 열연을 보인 이제훈 배우님 정말 스크린에서 눈을뗄수가 없었습니  
20170620,10,박열 정말 대박나세요!다시한번 우리나라 역사에대해 아는 시간이여서 넘좋았어요!천만돌파기대합니당!!  
20170620,10,"시사회를 보고나왔는데 기대했던만큼 만족~! 역사적 사실을 바탕으로 '박열'이라는 인물을 잘 부각시킨것 같다. 이제훈, 최희서의 열연 정말 최고  "
20170620,9,시사회로 미리 본 관람객으로서 사실을 바탕으로 그려진 다른 영화들과 다르게 너무 무겁지않았습니다.  
20170620,9,시사회로 방금 보고왔어요. 오래전부터 믿고 보는 배우와 감독의 조합이라 기대했던 영화인데 역시 실망시키지 않네요. 꼭 추천합니다.  
20170620,10, 20일 코엑스 쥐브이 관람한 학생입니다! 감독님께 입덕한지는 오래였지만 언니께 입덕한 건 오늘이에요 최희서 배우님 에너지 기운 제가 스크린에서 흡수하고 갑니다 저렇게 에너지틱 하실 수가 없군요..앞으로 정말 오래 오래 스크린에서 봬여 사랑합니다 ㅠㅠ  
20170620,10,재밌어요!!! 감독님과 배우님들 모두 짱입니다!!!  
20170620,10,평점을 먹일 수 없는 가슴으로 보는 영화 후미코..  
20170620,9,"Cgv vip 시사회 통해서 봤는데 이제훈의 연기와 박열의 삶을 느낄 수 있는 좋은 작품이였습니다. 그리고 분노와 반성을 하게 되고 다시 한번 생각해볼 수 있는 좋은 영화 였고 2번, 3번 보고  싶다는 생각이 드는 영화입니다  "
20170620,10,진짜많이보고싶어요 이거 재밋을거같아요  
20170620,10,시사회를 보고왔는데요. 정말 올해 최고 영화인것 같습니다. 영화 재밌는 부분도 있고 또한 많은것을 생각하게 해주는 영화였습니다. 박열이라는 분에 대해 몰랐는데 영화를 통해 알게 되었고 또한 알게되어 너무 기쁩니다. 그리고 존경합니다.  
20170620,10,너무 재밌어요!!! 연기도 다들 너무 잘하시네요!!!  
20170620,10,새로운 역사적 사건과 흥미로운 박열의 스토리가 좋아요  
20170620,8,애잔하고 숨겨졌던사람이 더 알려졌으면좋겠다.  
20170620,8,재밋었습니다 또보고싶어요  
20170620,10,박열이라는 분을 몰랐는데 영화를 보고나서 진지하게 박열이라는 인물을 알 수 있게 되어 감명깊었습니다!!!  
20170620,9,예상가능한스토리가 아니라 재미있음!!  
20170620,10,조금 전 VIP 시사회 보고 오는 길입니다. 무거울 수 있는 주제를 캐릭터의 희화화로 풀어내어 부담없이 감상하였습니다.  
20170620,9,가슴 한켠 묵직함이 남는구나  
20170620,10,보세욤!!꼮꼬꼭고꼬꼬고쏘꼬꼬  
20170620,10,기억해야 할 분입니다 영화도 좋았습니다  
20170620,10,"오늘 시사회 다녀 왔어요! 개봉전 미리 운 좋게 먼저 보게 되었네요!! 멋진 배우, 훌륭한 감독 믿고보는 것을 떠나 한국인이 라면 꼭 연령 상관없이 봐야 된다 생각이 드네요!!영화티켓값 아깝다 생각말고 꼭 보시길 바래요!!!!  "
20170620,9,우리가몰랐던역사를 서사로그려냈다  
20170620,9,실제 인물과 당시 사건을 배경으로 영화로 잘 만들어 놓은것 같다. 추천!!  
20170620,10,시사회 보고 왔습니다. 꼭보세요 ㅠㅠ  
20170620,6, 시사회 관람후 평점 남깁니다~어떠한 재미요소를 기대하고 보기보단 역사중의 내용을 흐름대로 감상하면서 보면 볼만한 영화입니다.^^ 대박나세요.  
20170620,8,실화를 바탕으로 한 일제시대 민중설화  
20170620,10,알지못했던  사실 좋은영화 감사합니다  
20170620,10,아름다운 사랑 이야기~  
20170620,8,굿굿 잼씀 눈물나네며 ㅠㅠ  
20170620,10,볼래여ㅋㅋ잼써여ㅋㅋ크크크흐흐  
20170620,10,많은 사람들이 이 영화를 보시고 잊지 않으셨으면..  
20170620,10,감명깊고 재밌고 슬프고 넘 잘봤습니다 적극추천해요박열이란 인물을 알게된 좋은영화였어요 기억하겠습니다  
20170620,10,다시본다면 다시볼수있는 그런영화였고 장면 내용 모든것이 가슴속에 깊숙히 파고드는 영화였습니다  
20170620,8,이상론자인 박열이었고 그가 허술해보일수 있지만 그게 더 우리와 닮아있어서 와닿았네요.  
20170620,10,재밌었어요. 보고싶어요  
20170620,9,고증 확실한 영화!!!!  
20170620,9,"우리나라 역사에 대해 생각해보는 계기, 노력한 분들에게감사하는 마음을 갖게 되는 계기가 되었습니다  "
20170620,10,이렇게 즐겁게 본 일제시대 본적없음  
20170620,10,정말 재미있어요 ^^강추  
20170620,9,이준익 감독님의 빠른 오케이컷들이 모인게 정말 말이 안됐다..! 순도 영상을 본 것 같아서 좋았어요 추천합니다  
20170620,10,박열의사에대해 잘 몰랐는데 새로운 역사에 대해 알게된거 같아요~~ 영화 굳굳!! 완전추천  
20170620,10,역시 너무나 잼있었어요~  
20170620,8,우리가 알아야 할 내용이네요  
20170620,10,재밌어요!! 또 볼래요  
20170620,8,너무 재밌어요 또볼래요  
20170620,10,너무 재밌습니다~~2번 보고싶은 영화!  
20170620,9,러닝타임이 지루하지 않은 쫄깃쫄깃한 영화  
20170620,9,의미있는영화예요!!  
20170620,7,새로운 인물들에 대해 알게 되어 좋았다  
20170620,10,꼭 보세요 두 번보세요 세번 보세요!!!  
20170620,10,볼만해요~ 감동만점  
20170620,10,시사회로봤는데 재밌네요.  
20170620,8,믿고보는 이준익 이제훈 박열 존잼  
20170620,10,동주와는 다르지만 역시나 좋은 영화  
20170620,8,나는 조선의 OOO로소이다  
20170620,9,이제훈 연기 짱! 가슴 뜨거워 지는 영화^^  
20170620,10,"역사에 새겨진 어느 삐딱한 영웅, 그의 삶에 새겨진 일생의 사랑.  "
20170620,8,두 배우의 연기가 특히 좋았어요!  
20170620,10,몰랐던 박열이라는 인물에대해 알수있어서 좋았습니다  
20170620,8,대한민국의 건국은 임시정부부터입니다!  
20170620,10,애국심을 강요하는 항일 영화가 아니라서 좋았다!  
20170620,10,역사 영화에서 즐겁고 유쾌함을 느끼게 해주신 감독님께 감사드려요 :)  
20170620,8,박열님과 후미코 님의 희생에 감사드립니다  
20170620,10,이토록 유쾌함과 사랑스러움으로 가득한 밝은 열사의 실화 영화라니!  
20170620,10,박열이란 인물에 대해서 잘 몰랐었는데 이번 영화를 통해서 박열이란 인물의 일생에 대해 잘알게 된것같아서 좋았습니다  
20170620,8,심중있는 영화같아요~~  
20170620,9,방금 gv시사회보고 너무 재밌게봐서 평점 바로 올립니다~ 역시 이준익감독님입니다! 전작 동주를 재밌게보셨다면 믿고봐도 됩니다. 개봉후에 한번 더 보고싶네요  
20170620,10,무대인사 보고 왔습니다. 흠잡을것 없는 재밌고 슬픈 영화였습니다! 배우님들 연기도 너무 잘하시고... 진짜 일본인인줄 알았어요 ㅋㅋㅋ 추천드립니다!!!! 다시 한번 독립운동가분들께 감사드립니다.  
20170620,9,시사회 잘 다녀왔습니다. 동주와는 비슷하지만 또 다른 느낌의 매력이있네요. 지루하지않게 어느정도 유머코드도 있고 잘 봤습니다~  
20170620,10,꼭 봐야할 영화입니다.  
20170620,9,시사회로 봤는데 역시 이준익 감옥이네요 몰랐던 인물을 알게돼서 좋았고 신파가 아니라 담담하게 그려서 더 좋았습니다  
20170620,4,제발 남자배우들 틴트좀 못 칠하게 해라.. 교도관도 판사도 색보정 앞에 핑크빛 입술 .. 그리고 깊이있는 인물을 다루려거든 아무배우나 쓰지마시길  
20170620,9,동주를 통해 송몽규를 소개하듯박열을 통해 가네코 후미코를 그린듯하다일제강점기를 배경으로 했음에도 바이올린소리와 쿵짝짝 즐거운 배경음악이 유쾌하게 흘러나와 영화를 보는 내내 재밌게 보았다  
20170620,10,글을 배우고 싶었다..  
20170620,10,시사회 잘보고갑니다 새로운 역사 배워갑니다!!  
20170620,10,시사회 재미 있게봤어요  
20170620,10,정말 괜찮은 그리고 봐야하는 작품  
20170620,7, 역사를 알기에 유익한 영화였습니다. 일제강점기를 표현한 영화라서 또 고문 등 보기 불편한 장면이 있을까봐 긴장한채 봤는데 인격적으로 유쾌하게 잘 표현해서 보기에 불편하지 않았습니다. 다만 임팩트가 없이 물흐르듯 흘러가서 조금 지루한 면이 있었습니다  
20170620,10,왜 개봉도 안한영화에 평론가평점이 설치고다니는가  
20170620,10, vip시사회로 봅니다 기대만빵  
20170620,10,이제훈이 연기하는 또라이연기가 매우 기대되고 궁금해지네요!!!앞으로도 멋진 연기 볼수있었우면 좋겠어요!!  
20170620,10,기대되는 영화 박열 화이팅  
20170620,10,"2시간 내내 이목을 끌었던 주, 조연 모든 배우분들!이제훈 박력넘치는 연기에 매력적인 여주까지!!의미있는 영화 박열 추천합니다!!  "
20170620,10,꼭 봐야지!! 믿고보는 이준익감독  
20170620,9,애국심이 생기는 영화~  
20170620,10,완전 연기력쩔어 대박!!  
20170620,7,배우들 연기들이 좋았어요~  
20170620,9,너무멋있어요 연기력 대박  
20170620,10,"음악 그리고 배우분들의 연기, 너무 감사하고 재밌게 봤습니다. 혹자에게는 어떻게 다가갈지 모르겠지만 저에게는 너무 황홀한 영화였습니다. 고생 많으셨습니다, 그리고 감사합니다.  "
20170620,10,일제시대 배경 영화 굉장히 좋아하는데요이번 박열 기대 많이 되네요!  
20170620,9,호의가 계속 되면...류승범처럼 보이는건 과연 나뿐일까...?  
20170620,10,이제훈 사랑합니다 ♥♥♥  
20170620,10,"울다가, 웃다가 난리난 영화! 유쾌하고 통쾌하다!  "
20170620,10,박열에 대한 인물을 알 수 있었던 좋은 기회. 그리고 배우들의 연기가 참 기억에 강하게 남네요!!  
20170620,10,일부러 캐스팅을 동주랑 비슷하게 한건가요? 다른 느낌의 동주같아서 더 기대됩니다.  
20170620,10,"에너지가 스크린 밖까지 흘러 넘치는 영화. 일제 강점기의 청춘들, 거침없이 저항하며 불꽃같이 타오르다!  "
20170620,10,음..일단 기대 중...  
20170620,10,우리가 모르고 있었던 역사적 진실을 어쩌면 이렇게 감동 깊은 영화로 만들어 냈는지...역시 이준익감독님!믿고보는 배우 이제훈! 그리고 어디서 찾아냈는지 가네꼬후미꼬의 신들린듯한 연기의 최희서!감동 감동 입니다  
20170620,10,역사에 집중하게 만드는 좋은 연기와 시나리오.가볍지 않지만 감정에 호소하지 않는 단백한 시간이었고 앞선 분들에게 감사할 수 있던 유익한 시간이었습니다.  
20170620,10,"시사회로 봤는데, 지금까지 우리에게 익숙해진 일제시대물과 전혀 다른 흐름을 가지고 있더군요.무조건적 애국심에 호소하거나, 비장함과 감동을 강제하지도 않습니다.하지만 보고나서도 마음 속에 남아서 식지 않는 무언가가 느껴집니다.  "
20170620,1,일본말 90프로의 영화앞부분 일본 애니스러운 유치함뒷부분 억지 진지박열이란 인간의 진지한 성찰보단 연애담에 더 치우친 영화  
20170619,9,일단 생각을 하게하는 영화이구요 과연 내가 스물둘일때는 어땠나 돌아보게 되네요 다시한번 박열님 감사합니다~~이제훈씨 너~~~무 레알 진짜 정말 짱 진심 멋찜~~♥♥♥♥  
20170619,10,자칫 무거울 수 있는 역사적 사실을 감독님 특유의 느낌으로 웃으며 보다가.. 나도 모르게 빠져들어서 끝날때까지 영화 안에서 배우들과 함께 호흡했네요. 이제훈과 최희서 주인공 두명과 다른 배우들 모두 연기력이.. 와아.. 주변에 꼭 강추할 영화였어요!!  
20170619,10,"제발 여러분 박열 꼭봐주세효! 배우들의 미친 연기력 뿐만 아니라 감독님이 고증에 대한 장면표현을 얼마나 세심히 하셨는지 느낄 수 있었습니다. 인삼부터해서 사회주의 오뎅까지 ,, 추운겨울날 다들 고생하셨는데 흥행했음 좋겠습니다 ! ♡  "
20170619,10,재밌어요 !! 꼭보세용!!!  
20170619,10,유료시사회 다녀왔습니다 예고편부터 꼭보고 싶었었는데 큰 기대는 없었지만 보고나오니 기대 이상이었습니다 추천합니다!  
20170619,10,시사회로 두번봤어요. 풍자나 해학이 단연 돋보였고 대사도 정말 곱씹을수록 좋아요. 분명히 오래도록 남는 좋은 영화가 되지 않을까 싶습니다.  
20170619,10,"박열 보세요 진짜 꼭 보세요 제가 9일에 당첨돼서 보고 왔는데 한국 영화 또 보고 싶었던 적 반창꼬 이후로 처음이에요. 정말 재미있고, 후미코 연기한 최희서 언니 입덕합니다. 이제훈 포스터 표정 때문에 기대 안 했는데 연기 감칠맛 나게 잘 했습니다.  "
20170619,1,아이고 트랜스포머 피하겟다고 개봉연기하니 뒤앤 스파이더맨 홈커밍이 기다리고 감독님 아모고토 못하죠  
20170619,3,"이제훈 별로....,  "
20170619,9,바쿠열! 이제후니 흥해라  
20170619,8,아무리 그래도 그렇지 제작사는 6 12 개봉도 안 된 날짜 별점 가지고 홍보를 하냐;;;; 그렇게 따지면 노르웨이 뱀장어 10점은 뭔데...  
20170619,8,이제훈 캐스팅은 신의 한수인 듯  
20170619,8,ㅇㅇ 조선망했어 ㅋㅋ 한국도 망하는중이야  
20170619,10,"해외에 있는데 일본인 친구와 서로의 나라에 대해 물어봤었습니다. 식민지로 통치한 것, 관동 대지진, 위안부, 생체실험 등에 대해 미화된 교육을 받아 몰랐으며 친구는 충격을 받았습니다. 영화를 소개시켜주었고 그진실을 알릴 부분이 들어가 있길 바래봅니다.  "
20170619,1,10분짜리 얘기를 두시간짜리로 만든다고 고생은 했다. 지루한 스토리 커버칠라고 중간중간 억지웃음을 넣긴했으나 전혀... 영화 정말 재미없었다.  
20170619,9,"몰랐던 박열 선생님에 대해서 알게 해주셔서 감사합니다이제훈, 여자 주인공 최희서의 연기는 너무나도  훌륭했습니다  "
20170619,10,"무거울거라고 생각하고 봤는데 생각보다 재미있고, 의미있는 영화인거 같아서 또 볼려구요!!! 꼭 한 번씩 봤으면 하는 그런 영화입니다:)  "
20170619,8,어제 시사회 무대 봤습니다. 엄청 어두운 박열의 이야기를 재미있게 풀어내려고 이준익 감독이 노력한 것이 보입니다만 그래서 영화가  수평적인 느낌이 들고 이야기와 인물에 대한 몰입도가 떨어졌다고 생각합니다. 연기는 모두 훌륭합니다!!  
20170619,9,기대합니다~ 10자.  
20170619,10,오늘 시사회보고 왔어요! 그냥 어둡고 진지한 얘기인줄 알았는데 웃기는 장면도 있어서 유쾌하면서도 내용이 있는 영화입니다!!  
20170618,10,"역사에 대한, 애국심에 대한, 순국선열에 대한 부담감이나 무게감을 내려놓고 두번, 세번 보면서 곱씹을 수 있는 영화. 이래야 한다라는 정의는 없다. 다만 우리가 몰랐던 박열의 애국심만이 영화안에 넘쳐흐를뿐.  "
20170618,10,무대인사 보고 왔는데 재밌음ㅋㅋ 박열이랑 후미코 둘다 똘끼넘치고 캐미 쩜....그리고 최희서 연기 개잘함ㅋ  
20170618,10,개봉전 무대인사로 미리보고왔습니다. 어둡고 무거운분위기도 있지만 중간중간 유쾌한장면도 있어요!! 꼭보세요. 한국인이라면 우리가 꼭알아야 할 역사라고 생각합니다.  
20170618,10,오늘 무대인사를 통해 보고왔는데 여운이 진짜 많이남아요! 이 영화덕분에 훌륭한 독립운동가 박열선생님을 알게되서 좋고 영화를 보는동안 시간이 느리게 갔으면 좋겠었어요 정말 몰입도도 짱이고 배우들 연기도 좋아서 더 재밌게 봤던것같아요! 꼭 보세요!  
20170618,10, 무대인사로 개봉전에 미리봤는데 한국인이라면 꼭 봐야할 영화다 90프로가 실화라는데 이런 일이 진짜 사실인가 라는 생각도 들면서 감동적이엿다ㅠㅠ 마지막에 사진 나오는데 진짜 너무 소름이다  
20170618,10,기대하구 있어요!! 시험 끝나면 얼른 가서 봐야지  
20170618,1,그냥 노잼일듯 핵노잼 다운로드용  
20170618,9,재밌었고 최희서 김준한 라이징 스타로 급부상 될 듯!!  
20170618,10,완전 재밌어요 ㅜㅜ 시사회 가서 봤는데 배우 연기 스토리 다 좋아요 ㅜ 대박 진짜 진심 헐 완전 재밌어요  
20170618,10,"무대인사로미리봤었는데,너무잘봤습니다 보는내내울다가웃다가 시대적배경들도잘담으셨고배우님들연기가너무좋아서상영시간내내집중하고본것같아요.여운이많이남는영화였고제훈배우님이잘담아내주신것같아요!본상영하면다시한번더볼생각입니다!  "
20170618,10,잘 알려지지 않은 박열의 이야기 이 영화를 통해서 많은 사람들이 알게됬으면 한다.  
20170618,10,간만에 만난 영화 중 베스트! 배우 이제훈의 연기 인생 중 파수꾼 이후로 가장 잘 어울리는 배역이었다. 배우들의 연기 및 연출 특히 음향 감독이 어느 분 인지는 모르나 피아노 선율과 현악기의 연주 뭔가 밝은 피아노 선율 속 아픔 최고였다.  
20170618,10,"영화의 호흡이 정말 좋았습니다. 박열과 후미코 외 기타 분들 한분 한분 다 너무 좋았고 배경에 깔리는 음악까지 모두가 최고였습이다. 시사회로 봤는데, 개봉하면 한번 더 볼 예정입니다!  "
20170618,10,영화관에서 안보면 후회함 재미있는부분이 많아서 관객들이랑 같이 웃을수있는부분이 많음 그리고 끝은 교훈이 남는다.  진찌 후회안합니다. 꼭봤으면좋겠어요.  
20170618,10,"처음에는, 역사적 비극이 너무 가볍게 다루어지는 게 아닌가 싶었지만, 완전 기우에 불과했습니다. 엔딩을 향해갈수록 마음 속 뜨거운 무언가가 용솟음치는 느낌과 묵직한 감동을 느낄 수밖에 없었습니다. 꼭 보십시오.  "
20170618,10,무거운 주제를 유쾌하지만 가볍지않게! 배우들의 연기도 정말 좋았어요!  
20170618,10,시사회로 먼저봤는데 정말 일제시대에 이런분이있었다니 싶었다실화라고생각하니 더통쾌한영화  
20170618,10,무대인사 보고왔는데 재미잇어요!  
20170618,9,무대인사로보고왔는데 최희서 처음보는 배우분이신데 존재감장난아닙니다ㅋ이제훈이야 연기 역시 굿 영화도 딱딱하지않고 너무 잼있었구요 웃다보니 코믹인가 이생각도했음 잼있어요ㅋㅋㅋ  
20170618,10,이준익감독에 이제훈까지 이건 정말로 재미있을듯  
20170618,10,이제훈~더이상 말이 필요없죠.완전 기대됩니다!!!!  
20170617,10,GV로 개봉 전 먼저 봤네요 너무 잘봤습니다.  정말 하나하나 고증을 거치지 않은게 없어서 너무 대단했고 또 뜻깊었던 것 같아요.  
20170617,9,"오늘 시사회 보고 왔습니다. 이렇게 밝은 일제강점기 영화는 처음봤고, 이것이 과연 실존 인물이 맞는걸까 싶을 정도로 박열이라는 인물에 매력읅 가지게되었습니다. 요근래 개봉한 원더우먼이나 미이라보다도 훨씬 꽉찬영화 였어요.  "
20170617,1,이준익 감독이라서 안봐.  
20170617,10,오늘 보고왔는데 기대이상이에요! 생각보다 많이 유쾌하고 재미있습니다 동주가 훨씬 더 무거운분위기라서 그런 분위기를 원하셨던 분은 조금 아쉬울수도 있을것 같지만 저는 재미있었어요!  
20170617,1,조센징들은 반일센뽕역사왜곡 영화밖에 못만드나  
20170617,10,이준익감독 참 좋아하는 감독인데 꼭 봐야겠어요  
20170617,9,실화라고 하니 영화 보는동안 가슴이 뜨거워졌습니다.  교과서에도 실리지 않아 몰랐을 또 한 분의 영웅을 만나게 되어 기쁘고 감사합니다.  
20170617,9,지난번 '동주'도 너무 잘 봤는데 이번에는 박열이라. 김인우란 분 동주에도 나오셨던 배우 맞죠? 재일동포시라던. 굉장히 인상적이셨는데 박열에도 출연하셨네요. 기대가 많이됩니다. 항상 응원하고 있습니다.. 화이팅!!  
20170616,10,함봐볼까 어떨가 궁굼합니다  
20170616,10,감초 김인우연기 기대 됩니다.  
20170616,10,'웃픈' 항일영화의 새 장을 열다  
20170615,10,이준익이다. 그냥 봐라 전작보다 못한다 한들 이준익이다.  
20170615,10,남자배우는 무쌍이 진리  
20170615,1,그냥딱봐도 노오잼 안보옴  
20170615,10,방사능국 원숭이들과 일뽕맞은 일빠 OO놈들에게 보여주고 싶은 영화.  
20170615,10,기대됨. 입소문 심상치 않던데 영화 꼭 흥하길..  
20170614,8,다소 어두울수있는 내용을 무겁지않게 하지만 진중하게 풀어내서 보는내내 박열이라는 인물이 어떤사람인지 더욱 집중하게 되더라구요.배우들 연기도 너무 좋았어요^^  
20170614,10,정말 기대됩니다!!   사도.. 동주...에 이어서  박열까지..!!!  
20170614,10,어제 보고 왔습니다. 영화 정말 잘 빠졌어요. 기대하셔도 좋아요~  
20170614,1,왜 항상 극찬하는 아이디들은 다른글은 하나도 없는걸까.기대작이라 보고싶어도 알바들때문에 더더욱 보기싫어지는...  
20170614,10,시사회 보구왔어요~~ 다들 너무 연기잘하시고 ♡♡너무 재밌었어요 추천합니다^^  
20170614,10,이준익감독과 이재훈의 만남.. 시대적인 배경이 한몫할 것으로 판단되는... 뻔하지 않은 스토리를 기대할 만하다~  
20170614,10,"정말 제훈배우님때문에 보러간건데요 ㅎㅎ영화 내용에 한번 더 반하게 되었습니다.처음 시작했을때 하품을 하던 내 지인이 감동받았다고 흥했으면 좋겠다고 했을때 , 너무나도 뿌듯했습니다.지인들에게 소개하고싶은 영화에요 ^^ 꼭 보세요!  "
20170613,10,오늘 메가박스 플러스엠 덕분에 개봉전이지만코엑스메가박스에서 박열을 보고왔습니다.이준익 감독님의 작품은 항상 색다른 느낌을 주십니다.영화를 보고 한동안 멍했습니다. 주인공 '박열'처럼 세상을 정면으로 살아가야하는데 잘 하고 있는건지 등..추천입니다!  
20170613,10,웃음도 있고 감동도 있고 역사라 아팠던 작품  
20170613,10,영화가 끝날때까지 집중해서 봤네요.중간에 지루할틈이 없었습니다.  
20170613,10,박열 이제훈 멋졍♥ 너무 잼있어용~  
20170613,10,존잼탱 역시 제훈쓰는 실망시키지않죠..! 최희서님도 연기 너무 잘해서 진짜 일본동폰줄..이준익 감독님 이런 대단한 영화를 탄생시켜주셔서 너무너무너무 감사합니다! 세분 다 사랑합니다??  
20170613,10,기대보다 재밌고 뜨거운영화였어요!  
20170613,10,상반기 최고의 영화임 배우의 열연과 스토리가 완벽  
20170613,10,이제훈배우의 연기는 정말 최고네요~영화도 너무재미있네요~  
20170613,8,멋있다. 진짜. 정말로  
20170613,8,재밌어요!!! 박열 또보고싶어요~  
