0,1,2
20170607,8,기대를 많이하고 있던 영화인데 기대를 했던것보다는 조금지루했고마지막 끝부분이 조금 허무해서 8점남깁니다. 그래도 내용이 너무좋았습니다.  
20170607,10,시사회 처음 당첨되서 봤는데 영화도 너무 재밋어요 대박!!  
20170607,10,박열과 그의 투쟁동지 후미꼬를 따라가며 많이 웃고 감동과 분노와 카타르시스를 느낄 수 있었다.역시 이준익감독! 이제훈은 물론 최희서의 후미꼬 캐릭터가 정말 인상적이다.그분들에게 경의를 표한다.  
20170607,9,이준익 감독 특유의 담담한 서사와 이제훈 이미지 변신의 시너지 효과!  
20170607,10,존잼쓰 대박날 것 같아요  
20170607,10,박열과 후미코의 일본 공략기. 절대 굴복하지않는 강직함. 중간중간 웃음코드는 덤.. 모두가 멋지다.  
20170607,8,생각보다 무겁지 않고 재밌어요! 잘몰랐던 영웅을 알게되서 좋았습니다!  
20170607,10,중간중간 웃음을 주는 해학적인 장면이 꽤 담겨있지만 '박열' 이라는 영화가 우리에게 주는 의미는 결코 가볍지는 않았다. 또한 박열이란 인물을 다시 돌아보게되는 좋은 시간이었다고 생각한다.  
20170607,10,쇼케이스로 너무 재밌게봤네요! 추천입니다~~  
20170607,10,이 영화는 꼭꼭 보세용!!!!  
20170607,10,방금최초시사쇼케이스로 영화봤습니다박열에 대해 많은 생가과 독립투사분들에 감사함을 느꼈습니다좋은 영화 감사합니다  
20170607,10,박열 쇼케이스 보고 평점 남깁니다!역시 이준익 감독님과 이제훈님!!bb 다른 모든 배우님들의 연기도 너무 집중력 있고 무거운 내용을 너무 무겁진 않게 다뤄서 재미와 감동이 둘 다 있었습니다!ㅎㅎ  
20170607,8,박열에 대해서 유쾌하고 담담하게 잘 담아낸것같아요~  
20170607,10,오랜만에 만난 심장을 때리는 영화! 역시 이준익 감독님! 이제훈배우의 인생작!  
20170607,10,역시나 믿고보는 감독님과 배우! 영화 박열 재미와 교훈 모두를 주네요!!!  
20170607,9,박열의 멋진광기에 눈물이 났습니다 몰랐던 인물을 알게되어서 행복했습니다 ..  
20170607,10,박열이라는 인물에 대해 알 수 있었던 시간이었습니다.억압된 식민지 사회에 시원한 사이다 한방 날려주는 영화였어요. 진실은 덮으려 할수록 드러난다는 걸...  
20170607,9,꼭 봐야할 영화입니다!죽음앞에서도  진정한 삶을 살았던 박열과 후미코의 모습을 볼수있어서 좋았습니다  
20170607,10,최고!!!! 꼭보세요 두번보세요  
20170607,10,정말 꼭 봐야하는 영화. 뭉클하기도하고 중간중간 웃음포인트도 있고!  
20170607,9,쇼케이스에서 관람했습니다. 의미있는 영화이기도 했지만 평소 잊고 지내던 것들을 일깨워주는 영화인 것 같습니다. 많은 분들이 보셨으면..  
20170607,10,박열이라기보다는 박열과 후미코라는 제목이 어울리는 영화. 그래 선량한 일본인도 있었어 라는 따뜻한 위로가 되는 영화. 적절한 유머는 덤!! 대만족  
20170607,10,개봉 전 최초 시사회 봤습니다. 무겁지 않으면서도 가슴을 울리는 진한 감동이 있는 영화 <박열> 추천합니다.  
20170607,10,재밌었습니다! 이제훈 멋있다!  
20170607,10,박열은 이제훈이다. 싱크로율도 좋고 연기도 좋고 배우도 좋다!!!  
20170607,10,"이건 정말 10점 줄 수 밖에 없다! 위트, 감동, 그리고 깊이... 뭐 하나 빠지지 않는다. 재관람하고자 하는 영화 몇 없는데 이건 재관람 필!!  "
20170607,10,쇼케이스로 관람하고 왔습니다존잼입니다 (●´ω｀●) 갓제훈...  
20170607,9,박열 열사뿐만 아니라 후미코란 인물에 대해서도 관심을 갖게 됐다. 불덩이 같은 사이다 같은 영화!  
20170607,8,육체는 가만히 앉아서 봤지만 정신은 애국심으로 뜨거워지는영화.  
20170607,9,"매우 새롭게 느껴졌다. 많은생각을 하게 했고 지금 살고 있는 이 시대가 정말 감사했다. 후미코의 나레이션이 영화와 잘 어우러졌고, 배역에 따른 캐스팅이 절묘했다. 역시 이준익감독다운 완성도를 보여주었다. 초반에 나오는 대지진 장면은 정말 실감났다!강추  "
20170607,10,배우 이제훈과 최희서 모두 완벽하게 박열과 후미코였다.  
20170607,10,좋은 영화네요!! 잘 알려지지는 않았던 독립투사였지만 영화를 통해서 알려주심에 감사합니디ㅏ  
20170607,10,개봉하면 또봐야지꼭보세요 꼭 두번봐 세번봐!!실화를 바탕으로그다지 알고있지는 않았던 한 부분을 더자세히 알게되어 뜻깊었던 영화 박열!!나는 조선의 OOO로소이다!!재미와감동까지 진짜 인생영화입니당 꼭보세용  
20170607,10,일제강점기 해방을 위해 희생하신 분을 한 분 더 알게 되어 뜻깊은 영화였습니다.  
20170607,10,시사회에서 관람했네요 ^^ 영화 덕분에 다시한번 나라를 지킨 분들에 대한 감사를 마음속으로 되내어 봅니다. 자극적이지도 않고 지루하지도 않은 좋은 영화 . 추천합니다.  
20170607,8,평범했지만 누구보다 나라를 위해 주인공일생이야기  무거운 이야기지만 유쾌하게 표현해서 좋았습니다  
20170607,10,일본에서 살며 결연한 조선인의 모습을 이제훈이 잘 연기해서 잼께 봤습니다  
20170607,10,이제훈님의 새로운 연기를 본것 같습니다. 영화도 너무 감동적이었습니다  
20170607,10,박열 넘 감동적이에요 영화 넘 좋네요!!  
20170607,10,"이준익감독님 ""박열 ""영화대박  "
20170607,10,이제훈 전혀보지못했던 신선한 모습에 독립투사지만 괴짜라  신박하다!!  
20170607,10,진짜 제훈님 너무 젛아여...  
20170607,10,믿고볼 수있는 이준익 감독님의 박열!  믿을수있는 이제훈배우님의 연기력! 기대를 안 할 수가 없어요!  
20170607,10,이준익감독님 믿고 봅니다  
20170607,10,완전 기대됩니다!! 박열 대박나세요^^  
20170607,10,너무너무 기대되여 믿고보는 이제훈!!  
20170607,10,박열과 싱크로율 100프로!! 이제훈배우님과 최희서배우님의 호연도 기대합니다!!  
20170607,10,멋있다 박열♡ 멋있다 이제훈♡  
20170607,10,믿고 보는 이제훈!!!  
20170607,10,믿고 보는 배우 이제훈!! 너무 기대됩니당ㅎㅎㅎ대박나자!!  
20170607,10,믿고보는 이제훈배우님! 영화 박열이라니 너무너무 좋습니다! 배우님 덕분에 박열이라는 인물도 알게되고 역사에 관심을 가지게 되는 좋은시간이였던거같습니다. 감사합니다 배우님! 영화 흥행해라!  
20170607,10,믿고 보는 이제훈 ! 어서 개봉했으면 좋겠네요 !  
20170607,10,색다른 영화! 한번쯤은 꼭 보면 좋을듯  
20170607,10,박열 기대됩니다!!!  
20170607,10,넘나재밌다능!꼭좀보라고요  
20170607,10,기대한 만큼 역시나인 영화!  
20170607,10,박열이라는 인물을 이제야 알았다니..전무후무한 캐릭터 박열 최고에요!!  
20170607,10,이준익감독님과 이제훈이나오는데 말 다했죠!  
20170607,10,가슴 뭉클해지고 뜨거워지는 실화영화 박열...최고예요.대박입니다.  
20170607,10,박열 영화 넘기대됩니당~^^믿고보는 이제훈 배우의 멋진변신이 기대되는 영화!!무조건 믿고봅니당^^  
20170607,10,우리시대 최고의 영화!!!  
20170607,10,옛날치곤 포스터에 치아가 엄청 깨끗하군....  
20170607,9,윽박이 영화 찍었니? 보러갈게!!  
20170606,10,이제훈님 믿습니다 너무기대돼요!!!ㅠㅠ  
20170606,10,꼭 보고싶네요 ~~~~  
20170606,1,이제훈 얼굴 너무싫음 ...또 역사가지고장난치나  
20170605,10,이준익 감독님에 이제훈 배우님의 조합이 정말 기대됩니다.:)  
20170605,10,굿굿 벌써 너무너무 기대되네요!!!  
20170605,10,이제훈배우님의 신작 기대합니다 거기다 감독님도 제가 좋아하는분이네요 기대중  
20170605,10,이제훈님의 영화는 무조건 믿고 봅니다 흥행대박!!  
20170605,10,믿고보는이제훈 ㅠㅠ얼굴열일 연기열일 영화스토리도 열일할듯 기대중입니당  
20170605,10,믿고보는  이제훈 화이팅  
20170605,10,이제훈배우님 신작이라니! 평소에도 좋아하는 배우님이신데 너무 기대돼요ㅠ와 미쳤다  
20170605,10,"이준익감독 신작, 너무기대됩니다.  "
20170605,10,역시 믿고 보는 배우 이제훈! 응원합니다 박열 화이팅  
20170605,10,믿고 보는 이제훈 기대해보아용  
20170605,10,믿고보는 이제훈 배우님의 신작 기대하겠습니다!!  
20170605,10,포스터가 정말 인상적이에요!!! 이준익 감독에 이제훈 배우라니 기대를 안할수가 없습니다ㅠㅠㅠㅠ빨리 개봉했으면 좋겠어요!!  
20170605,10,이제훈 믿고봅니다!! 넘나 기대되는 영화중에 하나??  
20170605,10,믿고보는 이제훈 기대합니다!  
20170605,10,기대됩니다!~~!!  
20170605,10,너무 기대되는 영화에요ㅎㅎ  
20170605,10,믿고 보는 배우 이제훈님! 개봉날만 기다리고 있습니다!!!  
20170605,10,정말 기대됩니다 믿고보는 조합! 이제훈배우와 이준익감독이라니 이건꼭봐야해요  
20170605,10,재미있을것 같아요 기대합니다  
20170605,10,너무 기대중입니다 ㅎㅎ  
20170605,10,오오 완전 기대됩니다!!!!  
20170605,10,이제훈 배우님 정말 기대됩니다!!  
20170605,10,이제훈배우님 기대합니다!!!  
20170605,10,믿고보는 이제훈 너무기대됨  
20170605,10,와 대박 기대.. 이제훈만 믿고 봅니다 !!  
20170605,10,믿고 보는 이제훈 배우!  
20170605,10,믿고보는 이제훈이라 엄청 기대중이에요 빨리 보고싶다  
20170605,10,이제훈 영화는 믿고보죠! 박열 개봉 기다려집니다  
20170605,10,너무가대가되는영화임  
20170605,10,영화너무기대되요! 개봉하면 보러갈께요~  
20170605,10,믿고보는 제훈님♡ 정말 기대되는 작품입니다.  
20170605,10,이제훈 배우님 기대하고 있습니다!!!  
20170605,10,이제훈의 연기가 기대되는 영화  
20170605,10,믿고보는 배우 이제훈!!!  개봉하면 바로 보러갈게요  
20170605,10,최고최고!말이 필요없는  
20170605,10,이제훈 배우님에 소재까지 너무너무 기대됩니다??  
20170605,10,믿고 보는 이준익 이제훈  
20170605,5,이런사람이 있었나 역사시간엔 안들어본 처음듣는 이름;그래도 5점줄게요..  
20170605,5,이준익 이사람 역사물을 많이하네  
20170604,10,포스터 만으로도 기대가 되는 박열! 실화로 만날 수 있어 더욱 궁금하고 기대가 크네요!  
20170604,10,영화 기대됩니다 이준익감독과 이제훈배우의 만남이라니!  
20170604,10,와 예고편보고 기대감 더더 상승!! 믿고 보는 이제훈♡ 빨리 보고 싶어요!!  
20170604,9,이제훈씨의 무르익은 연기 보고프네요.왠지 재미날 듯 해요.  
20170604,10,극장에서빨리보고싶네요이제훈님응원합니다  
20170604,10,OOO기력이제훈ㅠㅠ얼른보고싶어요  
20170604,10,얼른 극장에서 보고싶습니다믿고보는 이제훈!  
20170604,10,기대하고있습니다 ㅎㅎ 모든 출연작이 다 좋아서 너무 보고싶네요  
20170604,9,믿고보는 배우 이제훈!! 기대됩니다  
20170604,10,박열이라는 캐릭터 하나만으로도 이 영화는 기본이 보장되는 것 같아요. 그리고  그분을 연기하는 배우 이제훈... 그냥 믿고 보는 영화입니다.  
20170604,10,믿고 보는 배우 이제훈님 !! 티저보고 기대 만땅!!  
20170604,10,이제훈 좋아해서 영화도 기대하고있어요 실존했던 독립운동가 박열의 이야기가 궁금하네요  
20170604,10,배우 이제훈과 이준익 감독의 만남으로 이미 기대작입니다 독립운동가 박열을 어떻게 그릴지 빨리 보고싶어요  
20170604,10,이제훈이 연기하는 박열이라니 이준익감독님과 조합까지 대박 기대됩니다!  
20170602,10,감독 배우 모두 보고싶게 만드는 영화네요~~!! 기대하고 있을께요!  
20170602,8,포스터에서 느껴지는 강렬함이 영화에서도 고스란히 전해질듯 해서 보고 싶어지네요.  
20170602,10,이준익감독님 칭찬하고 싶네요!응원합니다~이제훈배우 믿고 봅니다!  
20170601,9,시그널의 이제훈이라는 배우의 변신과 사실 잘 모르는 박열이란 인물의 재발견이 기대되는 영화~~!6월 호국보훈의 달에 보고싶어지는 영화임이준익 감독은 호불호가 나뉘지만 기대해보고프다~~!!개봉하면 바로보러가야지~  
20170601,10,너무나 기대되는 영화네요..우리 역사에 대해서 다시 한번 더생각해 볼 수도 있을 것 같습니다.  
20170531,1,아 주제는 좋으나 영화는 별로...  
20170531,10,역사를 배우면서 이런 독립운동가가 있다는 걸 몰랐습니다. 영화보며 직접 확인하고 싶네요!!  
20170531,10,"너무 좋아하는 이제훈,, 믿고 보는 감독 이준익...한국인이 알아야 할 내용,, 그래서 더 보고싶은 영화 !! 꼭 봐야할 영화 !!  "
20170531,10,예고편보니 기대가 되는 영화예요~  
20170531,10,실화라니 꼭 보고 싶네요.  
20170531,10,너무너무 기대되서 개봉날만 기다리고 있는 영화입니다!! 완전 감동적일 것 같아요^^  
20170531,10,꼭 알아야 할 역사를 이준익 감독님을 통해 이제훈님을 통해 볼 수 있게 되어 기대가 큽니다!!!  
20170531,10,이준익 감독의 영화는 뭔가 긴 여운을 줘서 늘 기대하게 되요. 이제훈씨의 박열 연기도 무척 기대됩니다  
20170531,10,기대되는 이준익감독님 영화에요~ 실화라서 더 기대하게 되는 것 같아요.  
20170531,10,완젼기대하고있는작품입니다..이준익감독화이팅!~  
20170531,10,이제훈의 재발견..우리가 몰랐던 박열열사 이야기..  
20170531,10,완전 기대되는 영화네요~ 호국의 달 6월에 딱 어울리는 영화 꼭 보러 가고 싶어요  
20170531,10,이제훈 기대됩니다 꼭 보고싶어요  
20170531,10,이제훈의 새로운 변신 기대합니다. 실화를 어떻게 표현했는지 궁금하네요  
20170531,10,꼭 봐야할 영화인 듯~~배우들의 연기도 기대되어요  
20170530,10,배우들 보니 이제훈 빼고 제작비 낭비 안하고 영화 자체를 잘찍었을꺼 같네  
20170530,10,메인 예고편을 보고 소름이 돋고 빨리 보고 싶단 생각이 들었습니다. 역시나 이번에도 우리가 갖고 가야 할 기억들을 보여 주시네요. 감독님의 영화는 ‘정의로움의 산물’이라 저는 좋아 합니다.  
20170529,1,아나키즘 사상대해 몰라서  평점 매기나  박열 아나키스트인 아나키즘 절대적으로 추종한다 아나키즘은 극극 좌파이고 오히려 공산주의가 우파일정도임 아나키즘사상이 무정부 지도자가 없는 세상 반자본주의 띈 극좌파 아나키즘 찬양하는 영화 만든자체가 잘못된것이다  
20170529,1,나오는 영화마다 참... 호구님들 홧팅 ㅋ  
20170529,6,어쩐 일로 한정수가 주연을 맡았나 했는데...  저게 이재훈이었다니 ㄷㄷ  
20170529,10,재밋겠네 포스터만 봐도  
20170529,10,"일본인 개개인은 좋아하지만, 일본 전체로 보면 싫어하는 한반도에 흔한 반일사상을 가진 나에게 항일운동의 영화는 재밋든 재미없든 무조건 10점이다!  "
20170529,9,포스터 이미지가 약간 베가본드랑 비슷하네  
20170529,10,재밌겠다...^;^~~~~  
20170529,1,절대 현실적으로 못일어나는 일가지고 자위질하시는 찌질이들의 영화 ㅋ한국남자 일본남자 절대 못이김.ㅋ 일본여자는 일본남자에 의해 만들어진 것. 한국에서 컸으면 절대 못되는. 결국 끝까지 일본남자에게 진 것. 저 영화는 한국남자들의 패배를 그린 것이다.  
20170528,8,영화는 기대되는데 이제훈때문에 천만이란 소리는 뭔소리냐  
20170528,10,위안부 할머니들은 자주 언급되는데 이 사건은 조용히 묻힌거 같네요  
20170528,10,감독과 배우의 조합이 설레임^^ 기대되는 영화  
20170527,10,기대중이예요! 늦어도 꼭보러갈게요 제훈오빠ㅠㅠ♡  
20170527,10,내평점와 진짜 재밌겠다 기소해 할때 킬링파트 대박나라 박열!!!! 티져계속보고 있음 또볼꺼임 계속볼꺼임 이제훈배우님 최고 ㅠㅠ  
20170525,10,이제훈 화이팅 영화 기대중입니다 ≥_≤  
20170525,10,일본을상대로 당당한분 꼭볼께요  
20170525,10,영화 내용도 대략적으로 봤는데 재밌을것같네요!! 그리고 이제훈씨도 나온다니! 꼮 한번 봐야것다요  
20170525,10,그래 우리 집안이 반항빼면 시체지...ㅋㅋㅋ  
20170525,10,최고의 이제훈 최고의 영화 이런영화 우리나라사람이라면 다 봐야하지 않을까  
20170524,10,믿고보는 이제훈 무조건 보러 갈게요 이제훈 화이팅!!  
20170524,10,이준익 사극 X 이제훈... 말 다했다  
20170523,10,이제훈님의 연기 변신 기대되구요 ~감독님 전작에 쿠미로 인상깊었던 최희서님도 엄청 기대중이에요~!  
20170523,10,"포스터 보자마자 기대되네요,  "
20170523,10,제훈이 연기할때 목소리 팍팍냈으면 좋겠다  조용한 목소리 연기할때 너무 보기 싫더라  
20170522,10,아아ㅠㅠ 이제훈눈빛이 다했잖소 어떤일이 있어도 꼭 극장갑니다 진짜ㅠㅠㅠ  
20170521,10,뭐야!! 예고편 보니까 더 기대되네 ㅎㅎㅎ  
20170520,10,너무기대됩니다!!!  
20170520,10,기대되는 영화 네요.~  
20170520,10,제훈 ㄱ싸랑해 ♥?♥? 영화 대박나자 꽃길만 걷기ㅠㅠㅠㅠ  
20170519,9,독립투사 영화는 일단 무조건 기대.  
20170517,10,의외로 파격적인 영화네  
20170517,10,믿는다 그들이기에....  
20170512,10,이제훈의 박열!!! 어떨지 너무 기대돼요!  
20170512,10,이준익 감독님 영화 좋아하는 팬이에요. 이번 영화도 기대하고 있습니다.  
20170512,10,이제훈 박열 캐릭터 매력 오지네 ㅋㅋ 이준익+이제훈 꿀조합기대합니다!  
20170512,10,이~준익제훈의 케미 기대되네요~ ^^ 이제훈이 박열 캐릭터를 미치게! 잘 소화할거 같기도 한~  
20170512,10,"이제훈 싱크로율  100%이준익, 이제훈, 김인우 완전 기대작!!  "
20170512,10,이준익감독 작품은 늘 기대! 강렬한 포스터와 이제훈의 의외의 조합  
20170512,10, 일제강점기 독립운동에 대해 내가 알지못했던 새로운 시선인것 같아 신선하네  
20170512,10,이제훈의 연기변신 기대기대  
20170512,10,믿고보는 배우 이제훈 너무 기대해요  
20170511,1,테러리스트 영화화 기대합니다  
20170511,2,좀 말이 안되는 영화네 말이안되니까 영화인가  
20170511,10,기대됩니다. 어떻게 풀어나간 영화일지  
20170511,10,믿고보는 이준익! 믿고 보는 이제훈!  
20170510,10,이제훈이라뇨 ㅠㅠ믿고 봐야지  
20170510,10,이준익 감독님과 이제훈 배우의 조합 기대해볼게요^^  
20170510,9,기대됨! 존나 파격적이여  
20170510,10,포스터부터 기대된다! 연기는 검증된 배우니까  
20170510,10,갓제훈+갓이준익감독님 조합! 얼른 6월 말 되길 ㅠㅠㅠ!! 티저 예고편 보고 진짜 너무너무 기대됩니다!! 메인 예고편도 기대할게요~~  
20170510,1,일본년과결혼한인간 ㅋㅋ  
20170510,1,독립운동 지겹지도않니아류작좀 그만해  
20170506,10,가라...c....ㅂ....천만...  
20170504,1,"우리나라 영화계의 스펙트럼이 이렇게 좁다....일제시대 or 조선시대(임진왜란) or 부패정치,권력...최근 우리나라 영화의 주된 주제들...이 세 개의 주제 아니면 제대로 된 영화가 안 나옴  "
20170504,10,파파로티에서 양아치 연기보고 완전 놀랬는데ㅋㅋㅋ 이번에도 기대상으로 잘해줄듯  
20170501,1,동주가 잘되니 재미붙였나?좋은것도 지나치면 물리지항일아유작으로 돈벌생각마라  
20170428,10,와 포스터만 보고 눈물 핑 돌긴 처음이네.. 영화도 이제훈도 좋아하는 사람은 아니지만 봐야겠다는 생각부터 든다  
20170428,10,지나다가 박열 포스터 보고 뭔가 느낌 빡 와서 들어와봄.사람들이 이준익 이준익 이제훈 이제훈 하는데는 다 이유가 있음이준익도 이준익이지만 이제훈 요즘 넘 미친거 아님?부담없는 개성에 상당히 안정적인 연기력.. 이 나이대에 잘 찾아보기 힘든 배우임  
20170427,10,재미있어보여요 가기대만발입니다^^  
20170426,10,"포스터 간지도 대박, 이제훈연기 완전 기대! 빨리 극장에서보고싶음 ㅋ 딱봐도 흥행스멜이 ㅋ  "
20170426,10,소재도 좋고 믿고보는 감독 + 이제훈까지 ㅠㅠ 최고당  
20170426,10,이준익 감독 + 이제훈님 조합이면 믿고 봅니다! 박열 때문에 6월만 기다림ㅠㅠ  
20170426,10,이제훈에 이준익 감독님이면 무조건 봐야지ㅠㅠㅠㅠ엉엉ㅠㅠㅠ제훈이시여ㅠㅠ♡  
20170426,10,내남자 ㅠㅠ 열일해조서 고마븜 ㅠㅠㅠㅠ  
20170426,10,몰랐던 이야기를 이렇게 영화로 만들어주는게 언젠가부터 감사하고 있습니다. 잘 보겠습니다.  
20170426,10,좋은영화는 무조건 본다. @@@  대한민국 만세!^0^ /  
20170426,10,이제훈인줄 모르겟다 진짜 어떻게 저렇게 이미지가 확 바뀔수있지 ㅋㅋㅋ 진짜 대단한 배우임 ㅠㅠ 이준익 감독 영화라서 기대되고 이제훈이라 기대되고 박열이라 기대된다!!  
20170426,10,"신비한TV서프라이즈에서 너무 짧게 나와서 아쉬웠는데, 개봉 기다리고 있어요~!  "
20170426,10,이준익 감독의 연출과 이제훈의 연기가 만들어 내는 박열 기대됩니다!  
20170426,10,와 이제훈은 도대체 어디까지 보여주려는거지 진짜 멋있네  
20170426,10,이제훈 이제훈..이제훈!!이준익과 이제훈이라니  
20170426,10,"이제훈, 박열 싱크로율이 장난 아니네요. 처음에 이제훈이 아닌줄 알았어요. 이 영화를 위해~ 박열에 관련된 다큐도 봤는데, 영화 너무 기대되요~^^  "
20170426,10,우리가 몰랐던 박열이라는 인물을 재조명한다는 점에서 굉장히 기대가 됩니다. 포스터의 느낌으로 봤을땐 평범한 인물은 아닐것 같아요 ㅋㅋ  
20170426,10,동주 이후의 이준익 감독님 작품이라 더욱 기대되요 포스터 좋고 임팩트 좋고 기대도 된당  
20170426,9,포스터 보고 이제훈 아닌줄. 진짜 강렬해서 보고싶다. 동주 감독님이라니 더 기대됨 ㅋㅋㅋ  
20170426,10,포스터 삘이 굿. 이제훈이 다시 영화배우로 돌아오나 보다. 이제훈의 OOO 느낌은 기존 배우들과 다르게 와 닿는다.  
20170426,10,"감독부터 배우, 포스터 .. 공개될 때마다 취향 저격이다ㅠ  "
20170426,10,6월 말이 기다려지는 영화.  
20170426,1,왕의남자 보다보다 잼없어 지쳤는데 천만 재수관객덕분에 잘우려더시네요 이감독영화 잼없음  
20170425,10,믿고보는 이준익!!!  
20170425,4,이준익감독 작품은 그냥 딱 거기서 거기같은 작품들이 너무 많더랑 뭐 흥행한것들은 꽤 있긴한데 내 스타일은 아님...  
20170425,8,"기대되는 감독! 작품! 배우! 스텝! 완성도가 어떻게 나올지 벌써 기대가  가득합니다. 단지, 포스터!!! 포스터를  배급,제작사에서 뽑았겠지만, 독립운동가가 주연이며, 소재로한 영화포스터를 인기 일본만화 배가본드 표지를 표절하다시피한건 몰라서인지..  "
20170425,10,영화포스터 엄청 강렬하네 ㅎㄷㄷ  
20170425,1,와우 이준익 감독에 이제훈! 안봐야지 배우도 전부 삼류배우.. 저 짝퉁 두치놈은 그만좀 보고싶다  
20170424,10,꼭 볼께요 진짜 재밌을 것 같아요 !!!!  
20170424,10,동주  감독님 작품이라니.... 많이 기대하고 있습니다.  
20170424,10,"너무 기대됩니다.  우리 제훈님 연기도 최고지만 감독과 스토리 모두 너무너무 기대되요!! 이제훈 화이팅!! 연기신!!! 이제훈씨 연기 볼때마다 너무  깊게  몰입해서  눈물 , 콧물 다 쏟으며 보곤 합니다. 이번 작품도 너무너무 기대되요!  "
20170424,10,믿고보는 제훈오빠 이번엔 독립운동가 역할이라니 너무 기대됩니다 모든 역할을 잘 소화하시니 이번 영화도 무지 재밌을 것 같아요! 오빠의 앞날에 행복이 가득하길 바라요??  
20170424,10,류승범인줄!! 기대하겠습니다.  
20170413,10,이제훈이 파수꾼 만큼의 임팩트를 보여줬으면 좋겠다. 응원합니다.  
20170412,10,믿고보는 이제훈아닌가..  
20170409,10,믿보배 이제훈! 유소준에 이어 인생캐릭터 가나요!ㅎ 너무 기대됩니다. 이준익 감독님의 <사도>도  너무 감명깊게 봤던터라 배로 기대중입니다ㅠㅠ 화이팅!!!!  
20170408,10,난 꼭  봐야징!!   꼭 흥해라!!  
20170404,10,와 이제훈 쩐다  역시 믿고 보는 배우 이제훈 !!이런 좋은 영화에 이제훈이라니..말 다 끝났다  
