0,1,2
20170613,10,박열 재밋어여 두번세번보세요  
20170613,10,무겁지않게 하지만 가볍지않은 멋진 영화~♡  
20170613,10,박열 좋아요!! 꼭 보세요~  
20170613,10,최희서배우 연기 너무좋았어요  
20170613,10,너무 감동적이었고 꼭 봐야할 영화입니다!!! 강력추천!!  
20170613,10,고증을 재미나게 잘 보여준거 같아 재미있엇어요  
20170613,10,새로운 사실을 알았네요~!!! 재밌어요~!!!  
20170613,10,좋은 영화 잘보고 가욤!  
20170613,10,중 후반으로 갈수록 재밌어져요. 박열처럼 실화바탕 영화가 많이 나왔으면 좋겠습니다.  
20170613,10,시사회 보고왔는데 진짜 재밌어요!!  
20170613,10,조용히 강한 영화. 울컥거리게 하는 영화.  
20170613,10,꼭 보세요... 진짜 보다가 화났어요 ㅜㅜㅜㅜ 독립하게 해주셔서 감사합니다  
20170613,10,역시 믿고 보는 배우와 감독이 만든 영화 박열  
20170613,10,재미도있고 감동도있는 영화인거같아요!! 강추!!  
20170613,10,연기도 내용도 귯귯! 박열과 후미코 너무 멋졌습니다  
20170613,8,너무너무기대되요~~ 이제훈오빠 연기력! 믿고봐용~~  
20170613,8,와 봐도봐도 재미있고 볼만해요!!!  
20170613,10,박열 기대됩니다. 오늘 시사회왔는데  이제훈님도 온다고하고 ㅋㅋ 기대되는 작품! 꼭 보고 싶네요  
20170613,10,꼭 한 번 봐야하는 영화!!!!  
20170613,9,박멸인줄 알았다 이준익꺼라 함 봐야지  
20170613,10,이제훈의 인생영화가 또! 탄생했네요웃다가 울다가 분노하다가 어느새두 시간이 훌쩍 갔어요영화에 온전히 바쳐진 감독님 배우분들스텝분들께 경의를 표합니다그리고 살아있는 생생한 캐릭터인박열과 문자에게도!!  
20170613,2,포스터가 베가본드 만화책인데;;  그냥 한국말로 하면 되지 왜 굳이 일본어로 대사를 하는지;; 아님 걍 일본인을쓰던지; 존망할듯  
20170613,10,군인인데 7월에 외박나와서 부모님이랑 봐야겠다.  
20170612,10,일본 본토에서 제일동포들 학살한 일본놈들의 실화 얘기네요. 나중에는 간도대학살 사건 도 영화로 다뤄졌으면 좋겠습니다.  
20170612,1,일바생들 벌써 시작했네  
20170612,8,"일본인 여자를 무릎에 앉히고 찍힌 실제 사진을 보았습니다. 저는 박열에 대해 아는 것은 그것이 전부 입니다. 사악해보이기도하고 용감해보이기도한 예고편의 박열. 이 영화를 통해 박열이 이루고자 했던 것, 느낀 것, 생각한 것들이 너무 궁금해 졌습니다.  "
20170612,6,이제훈의 너무 잘생긴 외모와 고운 목소리가 거칠고 반항아적인 박열의 이미지와 너무 상반된다..  
20170612,10,왜 기대되나했더니 이준익 감독님 작품이었구만 빨리 나오거랕랕!!  
20170612,10,지금 이 시대에 박열 개봉을 위해 뻐꾸기가 그렇게 울었나봅니다. 숨겨진 의인이 주목받는 정의로운 시대를 위하여 건배!  
20170612,8,김민준인줄 알았음.. 하튼 기대됨 이런류 영화.좋음~~  
20170612,10,시사회로 보고 왔는데 기대해도 좋을 영화입니다. 역시 이준익 감독답게 거의 역사적 사실을 그대로 드러내면서도 영화적 긴장감을 유지시킨 점이 좋았네요. 또 이제훈씨와 최희서씨가 정말 열연을 했다고 생각합니다. 재밌게 뿌듯한 마음으로 봤습니다.  
20170611,10,그냥 10점 역사 고발 영화는 그냥 10점줌 쥐 닭 정권에서 묶여있던 날개를 펼처 주세요 감독님들  
20170611,10,이런 역사를 보여주는 영화는 꼭  봅시다  
20170611,10,내가 조선의 개새X다!!!!  
20170610,10,메가토크 시사회에서 개봉전 관람하고왔습니다.벗어날수 없다는 음식의 단짠단짠 같은 영화였습니다!그래서 개봉하면 바로 달려가서 또 보고싶네요!박열 흥행응원합니다 !!우리가 기억해야할 이야기!!  
20170610,10,"박열이라는 인물에 대해서 알게 해준, 마음 깊숙이 끓어오르는 애국심, 감정보다는 이성적으로 항일해온 일제시대를 잘 표현한 영화인것같습니다. 항일운동이라는 무거운 주제에 간간이 들어간 유머코드가 잘 어울러진 영화. 한국인이라면 꼭 보고 느끼는 바가 있길  "
20170610,10,제훈.. 사랑해.. ㅕ열번 볼게.. 존잘.. ㅠㅠㅠ  
20170610,10,"이렇게 개봉전에 시사회를 통해서 보게되었는데 ‥ 정말 재미있고 박열에 대해 한단계 더 알아갈수있었습니다!후미코양도 마지막까지 만세 외치는 모습에 감동하고 ,진짜 개봉후에도 또 보고싶은 영화에요!!  "
20170610,10,"연기도 연기고 영화 연출도 너무 좋았던 , 첫 장면 부터 인상적이였던 영화였어요~! 영화 초반부터 후반까지 몰입해서 볼 수 있었어요 또 보고 싶네요 ! 잘 봤습니다!  "
20170610,10,개봉전 운좋게 두번을 봤는데... 진짜 최고예여 이준익 감독님과 이제훈 배우님의 조합은 말할것도 없고 최희서라는 매력넘치는 배우를 볼수 있어서 넘나 좋았어여~ 진지하고 감동적이고 중간중간 빵 터지는 부분까지~ 모든것이 완벽한 영화~박열 최고  
20170610,10,잘 알지 못했던 박열 열사에 대해 알수 있는 영화였습니다. 철저한 고증을 거쳐 90%이상이 실화이며 등장인물 모두가 실존 인물이라고 하시는걸 보며 단 한 장면도 허투로 찍지 않았겠구나 하는 생각이 들었습니다. 많은 분들이 봤으면 좋겠습니다.  
20170610,10,시사회 보고 나왓는데 강추합니다ㅎ사실 좀 마음이 먹먹하고 어둡고 진지할것만 같앗은데너무 재밋고 감동적이였어요ㅋ빵 터질만한 장면들이 의외로 많았다는ㅋㅋ독립운동가 분들께 감사한 마음을 다시한번 가집니다  
20170609,10,오늘 봤는데 정말 잘 만들어진 영화입니다. 꼭 보세요!  
20170609,9,90%실화 영화이여서 좋았음22살이란 나이에 깡이 참으로 대단한 사람이였다는거그또한 가네코후미코 멋진여성인거 같아욤이준익감독 참..괜찮네욤 동주도 그렇고  
20170609,10,이준익 김독님영화는 역시 믿고 보는거죠!!!! 이제훈배우님 최희서 배우님 연기도 짱짱!! 아나키스트를 영화로 만나서 정말 좋은시간이였어요!!!  
20170609,10,너무 재밌어요!!박열 천만갑시당~~~  
20170609,10,아주 중요한 인물을 뒤늦게 알게된 느낌. 믿고보는 감독님과 이제훈 배우ㅎㅎ  
20170609,10,오늘 봤는데 너무 재미있었어요. 일본어도 어색하지않고 자연스러워어 더 집중이 잘되었던것 같습니다.  멋지신분을 알아가는것 같아 뜻깊은 시간이였네요^^♡ 대박날것같아요 화이팅!!!!  
20170609,10,또..또 뭐? 가 제일 많이 기억에 남지만영화가 끝나고 난 뒤 박수 쳐 본 첫 영화  
20170609,10,재밌게 잘 봤습니다~^^  
20170609,10,객관적으로 기대되는 작품!  
20170609,10,박열이라는 인물에 대해 많은 것을 안 영화입니다배우들이 인물들을 전달하기위해 노력하신것과 연기가 돋보였습니다감동속 웃음도 찾아보세용  
20170609,10,재밌어용잘봤어용사랑햐용  
20170609,9,이준익감독의 역사를 바라보는 시각이 좋다  
20170609,10,한시대를 살았던 아나키스트의 삶 만큼멋있고 재미있는 영화  
20170609,7,감동적이에요~|! 추천합니다!  
20170609,10,이준익 이제훈이라니 안볼수가없다  
20170609,10,기대만큼 좋은 영화였습니당!  
20170609,10,역사적인 사실을 잘 표현한 영화이고~ 뇌를 한번 깨우는 그런 영화인듯~♡ 동주의 연장선이라고 해도 무방~ 강추함~  
20170609,7,동주보고 반해서 보러왔는데 여전한 느낌이 조앗어요  
20170609,10,재밌었어요!!!! 추천  
20170609,10,시사회 보고왔는데 고증도 꼼꼼하게 잘 짜여진 영화였습니다 깨알 귀여운 부분도 있고 다들 꼭 보셨으면 좋겠어요  
20170609,10,너무 재밌어요!! 박열 최고에요  
20170609,9,재밌고 유쾌하면서 먹먹해지는 영화. 완전 추천합니당  
20170609,10,고증이 확실한 만큼 믿고 보는 영화  
20170609,10,이준익 감독만의 일제시대를 바라보는 시각이 보여 좋았고배우들의 열연이 감동적이었습니다! 또보고싶어요  
20170609,10,"감독님의 연출과 배우님들의 열연으로 최고의 영화, 가슴이 먹먹해지는 영화 한 편이 나온 것 같습니다. 이런 영화를 찍어주셔서 감사합니다.  "
20170609,10,이 역사를 알게 해주셔서 감사한 영화. 장르가 적절히 섞여들어간 각본과 연출이 완벽하다.  
20170609,10,영화 짱짱맨 재밌아요~~~  
20170609,10,믿고보는 배우에 감독님 !!!기대됩니다  
20170609,10,많은 사람들이 봤으면 하는 영화. 일본 제국주의에 대한 새로운(?) 시선을 던져준다.  
20170609,10,170609 메가토크로 관람했습니다. 동주에 이어서 이준익 감독이 또 대박작품 하나 만들었네요. 뜨겁고 멋진 영화 감사합니다.  
20170609,10,감동도 있고 웃음도 있고 너무 잘봤습니다ㅠㅠ  
20170609,10,"20170609 코엑스 메가토크로 '박열'을 관람했어요! 감독님 말씀대로 애국심과 더불어 지옥속에서도 웃고싶은 인간의 욕망을 잘 느낄 수 있었어요 :) 힘든 시대를 이겨내주신 독립투사 분들께 감사드리고, 좋은영화 만들어주신 제작진 분들께도 감사드려요!  "
20170609,10,일제시대 이야기임에도 불구하고 재미도 있어서 너무 좋았어요!!! 스토리가 지루하지도 않고 넘넘 좋았습니다!! 보면 절대로 후회하지 않을 영화에요ㅜㅠㅜㅠ개봉하면 또 볼거같습니다!ㅎㅎ  
20170609,10,정말 너무 재밌게 봤고 감동과 웃음이 모두 들어간 영화라고 생각합니다 꼭꼭꼭 보셨으면 좋겠습니다.사랑해요 대한민국#이준익감독 #이제훈#최희서 #김인우#권율 #김준한 대박나자#박열 #메가토크 #메가박스  
20170609,9,메가토크로 먼저봤는데 너무 재미있었습니다 꼭 보세요!! 최희서배우님 연기 너무 잘하세요ㅠㅠㅠㅠ 이제훈 베우님은 말할 필요도 없구요 ㅎㅎㅎ  
20170609,9,꼭 봐야 할 영화에요. 허구가 없다는 점이 인상깊습니다.  
20170609,10,"내용과 연출, 배우님들의 연기력 모두 완벽합니다! 무거운 내용만 있는게 아닌 재미있는 부분도 많고 감동적인 부분도 많고 다시 봐도 처음 봤을때와 똑같이 몰입할 수 있을것 같아요! 꼭 보세요~~~!  "
20170609,8,"개XX, 우리 동거합시다.  "
20170609,10,너무 재밌게 봤다 씁쓸함을 동반하기도 한 것 같다 배우들의 연기가 영화의 몰입도를 살려준다  
20170609,10,박열 선생님의 이야기를  너무 무겁지도 가볍지도 않게 잘 만든 영화 입니다. 배우들의 연기도 너무 훌륭했습니다. 많은 여운과 생각을 남기는 영화였습니다.  
20170609,10,실존인물인 독립운동가 이야기를 다른게 너무 좋았고 진지한 이야기에는 웃기고 이제훈 최희서배우의 연기가 너무 좋았다 이제훈배우님은 이런연기가 진짜잘어울리는듯!!!  
20170609,10,박열 선생님의 공을 높게 삽니다 ~~~ 영화로 볼수 있어서 감동 이었습니다  
20170609,9,9일 메가토크 행사로 미리 먼저 만나게 된 박열! 우리민족의 가장 어두운 시기에 박열이 던진 호탕하고도 당당했던 저항을 잘 만들어진 영화로 즐겁게 볼 수 있어서 좋았습니다. 문자캐릭터가 너무나 매력있어요:D  
20170609,9,재밌었어요! 여배우분 연기 인상적이었습니다  
20170609,10,제훈과 이준익 감독이라면!! 기대됩니다!  
20170609,10,진짜 올해 본 영화 중에 거의 제일 재밌고 뜻 깊은 영화였습니다!! 많은 기억에 남는 장면들 덕분에 보고 후회할 걱정은 없는 영화에요!  
20170609,10,재밌게 봤어용~~~♡  
20170609,9,우리의 아픈 역사와 그 중심의 인물에 대해 무겁지 않게 하지만 의미는 마음속 깊이 다가올 수 있도록 만든 영화!  
20170609,10,"아나키스트 독립운동가 박열에 대해서 재밌으면서도 감동적인 영화 좋았고, 후미코 역할맡은 배우도 연기 좋았어요@!  "
20170609,10,메가토크로 봤는데 진짜 좋았어요 정말 재미도 있었고 역사에 대해 훌륭한 인식을 심어줄 영화입니다 정말정말 강추합니다 단순히 새드로 영화가 구성되지 않습니다 꼭 보셨으면 좋겠어요ㅠㅠ  
20170609,10,정말재밋엇어요 최고에요 이제훈 연기짱!!  
20170609,9,역사에어두운면을 재미있게 표현한거 같아요... 볼만했어요^^ 이제훈 최희서 연기가 좋았어요  
20170609,10,재밌게봤습니다 나중에 또보러갈래요 ㅠ  
20170609,10,박열!! 천만영화!! 모든배우님의 열정이 느껴지는 영화였어요  
20170609,2,3?1절 기념 KBS 스페셜 드라마 본 듯... 그나마 이제훈이 나와 영화 보는 기분 났음ㅜㅜ  
20170609,10,"이준익 감독의 지난 역사와 한 인물을 바라보는 시선은 큰 울림을, 새로움을 주는 것같다. 친구와도 가족과도 혼자라도 또 극장을 찾아 박열과 후미코를 맞이하고 싶다.  "
20170609,9,이 영화는 고증에 충실한 실화입니다! 엔딩크레딧까지 꼭 보세요. 기억해야 할 역사를 만날 수 있어요.  
20170609,10,뻔한 역사물이 아니라 신선하고 좋았음  
20170609,10,감동적이고 가끔 웃음짓게 하는 영화! 완전 강추합니다!!  
20170609,9,"스토리텔링, 배우들의 연기가 좋네요.특히 후미코역할이 무척 인상적이었습니다!감독님 말씀대로 이 역할에 다른 사람을 생각할 수 없을 것 같아요.  "
20170609,8,잔잔한 감동믿고보는 감독님!!!  
20170609,10,재밌습니다~~실화라니 놀랍네요!!  
20170609,10,그 시대의 청춘을 불태운 독립운동가를 볼 수 있습니다.  
20170609,10,나는 조선의 OOO로소이다.. 정말 오래도록 기억에 남을 영화.ㅂ  
20170609,9,믿고보는 연기파 이제훈씨가 나온다니 충분히 기대하고 봅니다!  
20170609,10,조선의독립을위한외침에 가슴이 울리는 영화였다  
20170609,10,"믿고 보는 조합의 믿을만한 영화, 완전 추천합니다!!!  "
20170609,10,잊지말자 기억하자 깨어나자  
20170609,10,영화 아주아주 감명깊게 잘 봤습니다~~!!^^☆☆  
20170609,10,오늘 봤는데 몰랐던 박열의사님에 대해 알게 돼서 너무 좋았어요 배우님들 연기 짱 ㅠㅠ 감독님 짱짱 꼭 보세요 ㅎㅎ  
20170609,10,재밌습니다!! 꼭 보세요ㅠㅠ 역시 이준익감독입니다ㅠㅠ  
20170609,8,가네코 후미코와 박열을 잊지 않겠습니다.  
20170609,10,우리가 알아야할 영화를 만들어 주셔서 감사합니다  
20170609,10,후미꼬 연기 완전 잘하구 감동..영화 완전 사이다에요. 굿굿!!  
20170609,10,이제훈 넘넘 멋있고 내용도 알차고 재밌었어요 몇번씩 울컥울컥 했어요 엉엉  
20170609,8,박열에 대해 알 수 있어서 좋았습니다  
20170609,10,동주 이후 이준익 감독님 영화를 기다렸습니다. 개봉이 기다려집니다~  
20170609,10,두근두근두근두근두근  
20170609,10,최초 시사회 쇼케이스에서 영화 관람 했어요  초반부는 약간 지루하지만 중후반부 대사가 너무 재밌네요 이제훈 보러 갔다가 최희서 배우님도 덤으로 반했어요  정말 연기 잘하시더라구요 웃을때 넘예 ㅠㅠ 박열 화이팅! 꼭 보세용!!!  
20170608,9,<동주>에 이은 이준익의  담백한 역사물 제 2편.  
20170608,1,반일은 돈벌이 마케팅이죠 굿  
20170608,7,쇼케이스로 봤어요. 박열의 당당함이 통쾌하고 짜릿짜릿했습니다. 제훈님 보기전에는 걱정했는데 완전 박열 그자체였어요! 개봉하면 또 보고싶어요. 동주를 기대하면 실망할수도 있을거라고 생각하지만 동주와는 다른 매력이 많은 작품입니다. 꼭 보셨으면 좋겠어요!  
20170608,10,쇼케이스에서 보고왔는데영화같은 실화! 영화 보는 내내  울고 웃고 했습니다박열에 대해 알게 해주셔서 감사하고개봉후 다시한번 보러가야 겠습니다.  
20170608,2,박열:일본왕 암살계획 - 내부밀고로 실패 - 한국에와서 월북해버림 (납북이 아님) - 김일성찬양하며 여생을보냄 (무정부주의자라 북에서도 평가가 갈림)  
20170608,6,알바들 진짜 성의없네.. 매번 똑같은 믿고보는 황정민 믿고보는 송강호 거기까진 인정한다만 하다하다 이제 믿고보는 이제훈까지 왔냐ㅋㅋ 이제훈이라는 이름만으로 믿고볼 만한 영화가 도대체 뭐가 있었길래  
20170608,10,이 영화를 통해 중요하신 분을 알게 되었습니다. 이제훈님의 연기변신은 정말 좋았던 것같아요 다른 배우님들도 연기 너무 잘하셔서 놀랐습니다. 박열 대박나자!  
20170608,10,믿고보는 이제훈ㅜㅜㅜ 영화 보시면 제훈배우님뿐만 아니라 극중 수많은 배우들의 연기에 빠져들게 됩니다ㅜㅜㅜ 오늘 보니까 연기뿐만 아니라 매력도 다들 넘치시던데요?!ㅠㅠㅠ박열 빠이팅! 천만 가쟛  
20170607,10,첫 쇼케&시사회 다녀왔는데요! 진짜 영화 너무 감동적입니다. 사실만을 그대로 담아 억지스러운게 아니라 정말 잔잔하게 마음을 울리고 또 독립운동가분들께 경의를 표하게 되더라구요. 너무 멋진 영화예요 정말로 꼭 보셔야합니다!  
20170607,10,"우리가 알지 못했던, 잊혀져있던 역사를 다시 깨워주고 알려줬던 영화. 배우들의 연기도 대박이었어요~~  "
20170607,10,동주 제 인생작인데 또 그런 작품 봤으면 좋겠습니다!  
20170607,10,시사회가서 봤는데 정말 좋았어요!! 역시 믿고 보는 배우 이제훈  
20170607,10,배우들 연기도 훌륭하고 내용도 재밌어요! 박열 대박♥?  
20170607,10,다시 보고싶은영화입니다  
20170607,10,최초 시사회로 봤는데 정말 정말 재밌습니다ㅠㅠ 열 번 더 볼 거예요 박열 천만영화 가자!!!!  
20170607,10,"막 고문하고 그럴 줄 알았는데, 그런거 없음슬프고 아픈내용인데 대사를 웃기게 쳐서 웃긴데 가슴아픔너무 전개가 빠른거 같지만 한 인물의 삶을 두시간이 담는다는게 힘드니까 개봉하고 다시 보러가야할 듯  "
20170607,10,박열 응원합니다 영화도대박나세요 천만으로  
20170607,10,2017년 상반기 최고의 영화가 아닐까.  
20170607,10,최초 시사회 쇼케이스 봤는데  이제훈배우의 색다른  연기변신!!  또한번 보고싶은 영화입니다  
20170607,10,모든 배우들의 열연 너무 인상적이고 재밌게 봤어요! 진지한 생각하게 만드는 주제지만 웃음요소들도 많아서 너무 무겁게 보지만은 않아서 더 좋았어요??이제훈최고??  
20170607,10,영화 진짜.. 너무 재밌어요.... 유쾌하고 재밌는데 감동적이고.. 정말 재밌있게 역사 공부도 한 기분이었어요. 천만영화 갑시다!!!  
20170607,9,그냥 보세요 봐봐봐봐!!!! 꾸르잼입니달루♡♡♡♡  
20170607,10,대박!!!  천만영화 기원합니다 화이팅  
20170607,10,진짜 너무너무재미있어요! 꼭보세요  
20170607,10,시시회에서 봤는데 박열의 마음이 느껴지는 감동적인 영화였어요 ㅜㅠ 짱짱  
20170607,10,뜨거운 역사적인 인물을 재조명하는 영화입니다! 반드시 우리가 알아야하고 기억해야할 영화에요!  
20170607,10,최초시사회에서 보게되었는데 제일 먼저 보게되어서 영광입니다! 많은 분들이 보셨으면 좋겠어요 ㅎㅎ 박열 대박나라  
20170607,10,뜨겁고 강렬하게 꽂히던 인생 박열  
20170607,10,이제훈 잘생겼다!!!천만돌파!!!  
20170607,10,이제훈배우님의 연기와 다른 모든 배우님의 연기가 대박이고 실존 인물인 박열을 꼭 알아야 한다!!  
20170607,10,포스터 말고 스토리를 읽어보면 안 볼수 없는 영화!안보면 후회해요 ~  
20170607,10,영화보는중간중간 뭉클해서 혼났네요ㅠㅠ 다들 꼭 보세요!!!  
20170607,10,이건 안보면 후회  천만가자 !  
20170607,10,박열 실화이자역사 모두 영화꼭보세요  
20170607,10,의미있는 영화 잘봤습니다 천만소취!!  
20170607,10,이준익감독님과 이제훈 배우님의 캐미! 정말 굿굿  
20170607,10,정말 강렬하고 역사를 재밌게 배우게 해주는 영화. 천만관객 예상합니다  
20170607,10,꼭 봐야하는 영화! 정말 감동과 유쾌함이 공존한 시간이었습니다!  
20170607,10,꼭 봐야 할 영화입니다!  
20170607,10,박열 대박이예요~꼭 봐야할 영화!!  
20170607,10,"방금 최초 쇼케이스 영화 관람했습니다. 숨겨진 박열을 세상에 꺼내주신 이준익 감독께 감사드리고 박열을 연기해주신 이제훈 ,최희서, 민진웅, 김인우 ,권율 외 배우님들과 스태프 여러분들께 감사드립니다. 천만영화 가자!!!!  "
20170607,10,박열에 대해 잘 몰랐지만 알게해준 영화  
20170607,10,독립운동하신분들이 계시기에 지금 우리는 편하게 살고있습니다 감사합니다  
20170607,10,너무 쨩~~~꼭 보셔야하는 영화입니댜  
20170607,10,너무너무 감동적인 영화 ! 박열을 통해 뜨거운 역사를 알게되었슴미댜! 최고!  
20170607,10,"최초시사회. 박열 너무 재미있었어요!!진짜 다시 보고 싶을 만큼 배우들의 연기, 스토리 짱짱♡♡개봉하면 보러가겠습니다!!!♡♡  "
20170607,10,박열 최고 명장과 명배우의 명작품  
20170607,10,이거는 꼭 봐야한다 배우 모두 사랑에 빠질것이다  
20170607,10,진짜  꼭봐야할 영화!!! 강추  
20170607,10,꼭 봐야할 영화! 믿고 보는 이준익 감독님 작품!!  
20170607,10,박열 재밌다아! 잊지말아야할 인물  
20170607,10,박열 짱! 지금시대에 꼭 봐야할영화  
20170607,8,우리가 몰랐던 하지몬 알아야하는 이야기b  
20170607,10,진심 천만간다 !!최고였다~~  
20170607,10,우리가 기억해야할 이야기!! 꼭 보세요~~☆  
20170607,10,감동이에요!!대박나라!!박열화이팅  
20170607,10,너무 재밌어요!!!ㅠㅠㅠ꼭 보세요!!!  
20170607,10,너무너무 감동적인 영화이구요 다시 한번 가슴을 뜨겁게 해주셔서 감사합니다  
20170607,10,최고!완전대박ㅋㅋ짱입니다아아아  
20170607,10,꼭보세요!! 진짜 재밌어요  
20170607,10,또 보러갈까 꿀재므!!!  
20170607,10,최초시사회 봤는데 완전 재밌어요!  
20170607,8,짱 대박이에요!!꼭보세요!!  
20170607,10,박열 최고에요 추천드립니더  
20170607,9,실화라는 점에서 그때를 다시 돌아 보는거 같습니다 배우들이 그때의 감정으로 연기를 잘 하신것을 보고 대단하다고 느꼈습니다!  
20170607,10,실존인물을 이렇게 잘 연기할수가...우리가 알아야될 가슴아픈 역시속의  인물꼭 봐야될 영화!!! 추천합니다  
20170607,8,이준익 감독치고 힘이 빠진 영화  
20170607,10,완전 대박 한국 영화 탄생  
20170607,8,이준익감독이 선사하는 박열의 이야기! 웃음과 감동 공존하며 특별하다! 우리가 몰랐던 사실을 일깨워주는 영화!!  
20170607,10,박열 쇼케이스로 봤는데 잘 알려지지 않은 인물이라 생소했지만 영화를 보고나니 일제에 열렬하게 맞선 박열이란 인물에 대해 잘 알 수 있었고 진지한 소재지만 너무 무겁지 않게 그렇다고 가볍지도 않게 잘 만든 영화입니다  
20170607,10,박열 기억하겠습니다~ 대박!!!  
20170607,10,쇼케이스로 관람했습니다.배우들의 뜨거운 열연과 연기가 돋보였던 영화였습니다.대사한마디와 의미있는 장면에 가슴이 뜨거워졌습니다.  
20170607,9,"이제훈의 연기 변신, 탁월한 고증  "
20170607,10,쇼케이스보고 평점남깁니다 무거운소재일수도 있는데 전혀 지루하지 않고 재밌고 뜻깊은영화입니다 꼭보세요!  
20170607,10,시사회보고 왔어요~ 완전 재밌었고 역사도 알 수있었던시간이었어요.  강추!!!  
20170607,10,영화 너무 감명깊게 잘봤습니다~그리고 제훈이형 너무 잘생겼어요..  
20170607,10,시사회로 봤어요역시 이준익감독다운 작품이예요ㅋ  
20170607,10,잠자던 역사의식을 확 깨운 영화! 강렬한 박열의사를 잊을 수 없으리라…  
20170607,10,이제훈의 연기변신이 돋보이는 박열! 우리가 꼭 알아야 할 역사입니다.  
20170607,7, 박열이라는 실존 인물을 이제훈의 연기력으로써 잘 풀어낸 것 같습니다. 독립투사 박열이 일본에 투쟁하는 과정을 잘 담은 영화인 것 같습니다. 몰입감이 아쉽지만 무겁지 않게 볼만한 영화인 것 같습니다.  
20170607,8,애들이랑 주제는 언제나 깊이 와닿았고 일본팀들의 입장에서 진행이 되었다고 느낌이 드네요 사람들의 가치관의 변화에 좀 더 깊이 감명을 받았습니다  
