0,1,2
20170920,10,최고의 스릴러 대박~~~!!  
20170920,10,반전에반전에 반전끝나기 전까지 뭐가 사실인지 계속 생각하게 되네요처음부터 끝까지 집중되는 영화예요! 강추!!  
20170920,10,대화를 통해서 사건을 재구성해나가는 장면장면이 소름의 연속이더라.... 반전은 덤이고  
20170920,9,와 .. 스페인영화 ...수준엄청나다진짜 개존잼ㅋㅋㅋㅋ 꼭보세요  
20170920,10,개봉하면 꼭 다시 한번 와서 다시보고 싶어요!! 인생영화 입니다 ㅠㅠㅠ  
20170920,9,반전의 반전...!!  
20170920,8,중간에 졸면 안된다 순간순간이 반전이다  
20170920,10,대박반전...누구도믿지마세요...  
20170920,9,와... 소름한번더 보고싶은 영화  
20170920,10,반전 쩔었어요!! 진짜 재밌어요!  
20170920,10,마지막에 완전 소름! 진짜 재밌어요 제가 본 영화중에 top5에 드는갓같아요  
20170920,10,인생영화 지렸다...씹소름  
20170920,10,시사회 보고심장 쫄깃쫄깃 재밌게 봤어요!@  
20170920,9,한쪽 말만 듣고서는 확실히 파악할 수 있는 게 아무것도 없다는 것을 알게 해 준 영화.  
20170920,10,정말 대본과 연기 결말까지 장난아니네요말 그대로 화장실가면 큰 일나는 영화에요  
20170920,10,계속해서 소름돋는 영화였어요 재밌었습니다  
20170920,10,영화가 처음부터 끝까지 반전의 반전??너무무섭지만 꿀잼~  
20170920,10,정말 시간 가는 줄도 모르고 보았던 영화 ... 처음부터 끝까지 소름돋았습니다 추천합니다  
20170920,10,완전 대박! 소름!!반전에반전!재밌어요  
20170920,10,와 진짜 대박 간만에 좋은 영화 봤습니다. 몰입감 최고! 인생 스릴러 대박!!  
20170920,10,끝까지 긴장감을 유지하고 완벽한 반전으로 충격을 줬던 영화! 추천합니다.  
20170920,8,재밋다 반전은생명☆ 반전에 소름돋고 갑니다..  
20170920,10,반전에 반전!! 재밌어용  
20170920,10,연긱가진짜압도적이다진짜  
20170920,10,와 진짜 끝나면 헉소리 나오는 영화. 진짜 말다했다  
20170920,9,오랜만에 잘만든 스페인산 스릴러를 만났다~!  
20170920,10,마지막까지 집중하게 되는영화  
20170920,10,반전에 반전을 거듭하다 마지막 반전은 진짜 생각지도 못했네요.모든 것을 다 이끌어다 반전을 만들어내는 각본 진짜 대단합니다  
20170920,10,호평이 자자해서 기대하고 봤는데 기대이상이네요!!!근래 본 스릴러영화 중에 정말 가장 좋았습니다 적극추천해요!!  
20170920,10,까면 깔수록 밝혀지는 사실들에 긴장감 짱이네요  
20170920,10,최고. 소름. 끝까지 봐야하는 영화  
20170920,10,미쳤다 와 숨막혀 죽는 줄 알았음  
20170920,8,"흡입력 대단하네요. 영화느낌이 비슷하길래 어디서봤나했더니, 더바디랑 줄리아의눈 감독이셨군요. 재밌게 잘 봤습니다.  "
20170920,9,대박 대박 대박!!!대단한 이야기  
20170920,9,인비져블게스트 재밌게 잘봤습니다.  
20170920,10,"이런류의 영화를 굉장히 좋아하는데, 재밌게 본것 같습니다.오랜만에 재밌는 영화 꼭보시길 추천드립니다.  "
20170920,10,오랜만에 재밌는영화 꼭보세요  
20170920,9,여자 변호사가  피해자 엄마임. ㄷㄷㄷㄷ  
20170920,7,막강 반전이라고 해서 기대한다  
20170920,10,평소에 스릴러랑 반전 스토리 영화를 굉장히 좋아하는데 너무 기대가 되네요!!! 개봉날에 꼭꼭 챙겨보고 싶습니다!!  
20170920,9,파울로 감독 정말 대단함 스토리며 몰입도며 관객들을 들었다 놨다함 더 바디 라는 영화도 강추요 zach****   2017.09.20 13:35  삭제  
20170920,10,반전의 싸다구를 몇번 맞아요..마지막의 싸다구는 정말 아프다구요.^^  
20170920,10,재미있었어요 ~~ 스릴러좋아하시면 꼭 보세요 ~!!  
20170920,10,"반전 영화라고 명명하는 작품 많이 봤다. 최고로 꼽는 유주얼 서스펙트, 식스센스, 아이덴티티, 메멘토, 스켈리톤 키 등등의 작품과 견주어도 뒤쳐지지 않는다. 오랜만에 걸작을 만났다. 꼭 보시길...  "
20170920,10,예매해 놓고 영화 개봉날까지 기다리고 있습니다!! 너무 기대되네요  
20170920,9,중간에 예상은 되던데.. 올만에 스릴러 재밌게 봤네요.  
20170920,9,ㅈㄴ 재밌어 그냥봐 알바아님 대박 재밌다  
20170920,8,그럭저럭 볼만한 영화. 할매가 머리 좋네  
20170920,10,기대되네요|~~~~ 꼭 보고싶어요~~  
20170919,10,손수아랑싸운날미안해  
20170919,10,뻔한 내용인줄 알았는데 너무너무 잘 봤습니다  
20170919,10,평이 좋던데 너무 기대돼요  
20170919,10,메멘토 급 영화라니 정말 기대가 됩니다!  
20170919,8,평이좋아서 꼭한번 보고싶네요  
20170919,10,재미있을것같아서 벌써부터 기대되요~!!  
20170919,10,평이 너무 좋아서 기대되요ㅠ얼른 보고싶어요!!  
20170919,10,너무기대되오 재밌을거 같아요  
20170919,10,개봉하면 꼭 보러 가겠습니다 기대돼요!!  
20170919,10,"범죄, 미스터리라니.. 취향저격입니당 너무 기대돼요!!!  "
20170919,1,이렇게 재미없다니..ㅠㅠ1점도 아까움  
20170919,5,예고편만 봐도 기대되네용~~  
20170919,10,믿고보는 감독과 배우들이네요벌써 기대됩니다^^-  
20170919,10,영화 출연진과 동영상만 봐도 벌써 기대된다.  
20170919,10,세상 너무 기대되고 꼭 보고싶어요 ㅠㅠ 얼른 보고싶어요 ㅠㅠ  
20170919,9,범죄 스릴러 장르 너무 좋아하는데ㅜㅜ 엄청 기대되요!21일 개봉하자마자 보러감!!  
20170919,10,기대되는영화입니다.  
20170919,10,영화 안본지 오래됐는데 평점도 좋고 후기들도 좋아서 친구랑 보러가기로했어요!! 기대중입니다ㅎ  
20170919,10,#범죄#미스테리#인비죠블#기대만빵#목욜에만나요  
20170919,10,워후! 범죄 미스테리 스릴러라니 너무너무 기대됩니당!!!  
20170919,10,이제 곧 볼 예정인데 후기들도 좋구 반전에 반전이라고 하니 엄청 기대중이에요~!! 꼭 흥했으면 좋겠네요ㅎ  
20170919,10,정말 기대되요.어떤 반전인지 너무 궁금해요 재밌을꺼 같아요~~  
20170919,10,줄거리 보니까 기대돼요 ㅎㅎㅎ  
20170919,10,정말 기대가 되네욯ㅎㅎ~~~  
20170919,10,"리메이크 된다는 이야기가 있던데,,,보고 싶어요!!!  "
20170919,10,목요일꺼 예매했어요.~기대중입니다  
20170919,10,리뷰 정말 좋던대 기대되요~  
20170919,8,기대되요~^^ 이번주 보러 갑니다.스럴리영화 요즘 없었는데 기대됩니다. 반전에 반전이 연속된다고 하는데 시사회평이 좋네요  
20170919,9,범죄스릴러물 좋아하는데 보신분들 글보니 제가 좋아하는 내용같네요 부디 평대로이길 바라며 예매해보렵니다.  
20170919,9,"평점은 한번도 쓴적이 없는데, 너무 기대되는 영화입니다.  "
20170919,10,개잼있어요 꼭보세요 굿굿굿  
20170919,10,원래 영화볼때 잘 조는 편인데 이거는 처음부터 재밌어서 끝까지 집중해서 재밌게 잘 봤어요!  
20170919,10,시사회다녀온 친구의 추천받아 보러갑니다~더바디 영화도 생각없이 봤는데 인상깊게봐서 기대는했는데추천까지 받으니 더욱 기대되요~~  
20170919,7,그냥 반전을 위한 반전.딱 그수준이다  
20170919,10,유럽영화 처음이라 기대도 안 했는데  스릴러라 참 재미있게 봤습니다~  
20170919,10,시사회로 봤는데 간만에 제대로 된 영화였음 ㅠㅠ 또 볼까 생각 중  
20170919,1,스페인어..짜증나서 .. 못들어 주겠다..그래서 범인이 누구냐...?중간에 짜증나서 꺼버려서 .. 결말을 모르겠다..아..스페인어 종니 짜증나..  
20170918,7,소름 돋는 마무리가 최고였다.  
20170918,5,"반전을 하기 위해 애를 쓴다,,, 감독의 전작 더 바디처럼 반전이 시시하다  "
20170918,1,와 ~ 개봉전이라고 평점알바 쩌는구만 !!!  사고뭉치주인공 보는내내 짜증남  
20170918,10,진짜 재밌습니다. 훌륭합니다 라는 말이 더 어울리려나  
20170918,9,자리를 뜰수없다. 정말 잘 만든 스릴러.  
20170918,10,"제법 잘 만든 스릴러, 아무것도 모르고봐야 제대로 재미를 느낄수 있는 작품이죠.  "
20170918,8,솔직히 예상 못했다 평범한 트릭은 아니어서 나름 신선했음  
20170918,8,"변호사가 죽은젊은이의  엄마라는걸  너무  바로 알아차린 내가이상한건가, 그래서 큰 반전감은  느끼지못했다. 그저 음향효과가 좋았고 배우들의 멋진비주얼과 세련된의상 그리고 변호사와 남주가  밀당하는연기가 탁월했을뿐.  "
20170918,9,그들의 사기극은 노련하고연륜이 느껴진다 무엇보다 명분이확실하다 감독이양념처럼 트릭을 조금만 첨가했다면 반전이 좀더살았을텐데 너무빨리알아버렸다  
20170918,10,음향이 특히 좋았습니다.  
20170917,9,작가나 감독은 천재 ㅋ작가나 감독은 천재 ㅋ  
20170917,5,와.. 할 정도는 아니에요..  
20170917,3,글쎄요~저한테는 반전이 뻔한 내용에 그냥 밋밋하네요.제작비는 정말 안들었을듯~  
20170917,9,탄탄한 스토리와 배우들의 연기력만으로 끝까지 몰입감있게 끌고 나간다.  
20170917,6,아니 포스터는 왜 저렇게 만든거야? 이게 반전이오 하는거 같네 ㅋㅋㅋㅋ  
20170917,9,소...소름...대박...  
20170916,1,말이 많고 변호사는 아무나 하나? 여주인공 스페인어가 몰입이 안된다  
20170916,10,"정말 오랜만에  나를 만족시키는 영화를 봤다  최고다,  "
20170916,10,무조건 보세요 개 명작입니다.  마지막 지렸다.  
20170915,10,정말 간만에 몰입도 있는 작품을 본듯  
20170915,7,반전이 있고   스릴이있는 영화네요  완전 소름돋아요^^  
20170915,7,반전의 반전을 좋아하는 사람들이라면 나름 볼만한 작품  
20170915,10,관객이 유추할 수 있는 뻔한 스토리인 것 같지만 또 그렇지만은 않다는 것에서 스토리가 탄탄하다고 느꼈어요 재밌게 봤어요  
20170915,10,와...이건 정말 예상못했다!!  
20170914,10,오늘 막 이벤트 당첨으로 봤는데 내용과 반전이 알찬 영화더라구요 정식개봉 후에 한번 더 보려구 합니다  
20170914,10,"솔까 말; 스릴러장르 안 좋아하는데 우연히 시사회가서 보고,완전 초집중했음 반전of반전.빠지다보니 어느덧 결말. 과연 범인은 누구인가!!(무서운 스릴러 아님)  "
20170914,10,귀찮아서 이런거 잘 안하는데 이 영화는 10점 주고 가고 싶었습니다.  
20170914,10,꼭 보세요.이 말 한마디면 충분하다.  
20170914,10,오랜만에 쫄깃하게 본 영화입니다~너무 재미있구요.가을에 보면 정말 좋을 것 같네요~~강추!!! 보시면 무슨얘긴지 아실듯합니다ㅎㅎ  
20170914,10,몰입도 최고~!!  정말 오랫만에 잼있는 영화 봤네요!!  
20170914,10,국내 리메이크도 확정했다고 하니 더 보고싶네요 기대됩니다~~  
20170914,6,몰입도 있고 괜찮긴한데 군데군데 너무 엉성함.. 나무에 박아서 운전자 즉사할뻔한 차가 너무 멀쩡하고 오히려 안박은 주인공 차는 고장나고 . 그저 반전있으면 좋아하는 한국인들은 개쩐다고  난리칠 영화... 뻔함  
20170914,10,세밀하게 복선 깔아놓았네요.. 참신한 연출력과 스토리 전개가 아주 죽입니다ㅋ  
20170914,10,와..몰입감..식스쎈쓰 굿  
20170914,10,단순히 폭력만이 복수가 된 근래의 영화들과 차원이 다릅니다. 꼭 보세요!  
20170914,10,처음은 집중이 안됨 이게 뭐가그리 재미있을까.. 속는셈 치고 보긴하는데..  그러다가 점점 몰입되고 마지막엔 소름이...  
20170913,10,영화관에서 모두가 집중해서 보게 되는 영화!  
20170913,10,이건 진짜 처음으로 평점을 남기게 만드는 명작임 무엇을 생각하든 그 이상의 스토리와 결말!!!!  
20170913,10,넘 재밋다고해서 아는 지인분들과 단체로 갑니다.벌써부터 기대만땅 이네요.~^^  
20170913,8,더 바디 감독이라 영화가 풍기는 내용은 너무 똑같음. 근데 너무 잘 만들었음...연출력이 대단한듯...배우들도 연기 정말 잘함...이 영화의 악역은 사슴임. 그리고 교훈은 우리 안전운전 합시다....  
20170913,8,감독 이름 외우는건 오랜만인듯. 오리올파울로. 굉장히 고급스럽고 세련된  잘쓰여진 추리소설 느낌  
20170913,10,정말 재밌네요..훌륭합니다 꼭 보세요!  
20170913,6,"끼워 맞추기식 사건들, 관객을 놀라게 할 반전은 현실성도 포함되어야 한다  "
20170913,8,뛰어난 반전이라는 말이 많아서 반전들에 대해 대부분 예상할 수 있었음. 버지니아 굿맨 역의 배우가 정말 연기 잘 하네요. 주인공이 트렁크 속 시체에 대해 말할 때 굿맨의 표정이 기억에 남음.  
20170913,10,예고편만 봤는데도 시간에 쫓기는 긴박감이 느껴지고 범인이 누굴지 굉장히 궁금해지네요 반전도 있다하니 굉장히 기대되는 작품입니다. 친구랑 바로 보러가야겠네요  
20170912,8,201709.12.  
20170912,10,올리오 파울로 감독은 이런 영화 만드는데에 천재인듯... 데뷔작 '더바디'도 그렇고.. 하지만 이 영화는 더바디 이상으로 소름돋았다.. 개인적으로 반전/스릴러 영화 매니아인데 이 영화는 감히 반전영화 중에 최고봉이라 말할 수 있다bb 꼭 보길 바란다.  
20170912,9,오랜만에 두시간 내내 조용히 집중해서 본 영화.반전의 반전을 거듭하는 스토리도 스토리지만 난 왜그렇게 슬프던지...이미 이 세상은 끝났다는 말에 가슴이....ㅠ  
20170912,10,반전에 반전에 반전에. 끝까지 예측 불허  
20170912,10,스페인산 명품 스릴러 긴장감 대박  
20170912,10,정말 올해 최고 반전영화! 상상력이 정말 놀랍습니다 후회안할듯.. 꼭 보세요!!  
20170912,10,끝까지 예상이 안가는 스릴러 꼭보세용  
20170912,10,아진짜 대박 몰입도도 최고 반전도 최고영화 진짜 재밌네요~!!!  
20170912,10,메멘토급 스릴러인 것 같아요! 재미 있었어요  
20170912,10,완잔 소름돋는 영화예요 반전 짱!  
20170912,10,킹왕짱 ㅋㅋ 정말 기대이상이에요!영화도 재밌지만 너무 슬프네요 .... ㅠㅠ  
20170912,8,탐탄한 스토리 전개와 끝까지 손에 땀을 쥐게 하는 긴장감이 탁월한 영화!  
20170912,10,넘 조은영화 올해본 영화중 강추  
20170912,10,공포는 별로 안좋아해서 보기 망설였는데 공포보다는 추리물이라서 재밌게 봤습니다 밀실살인사건!  
20170912,5,너무 잔잔한 전개눈 아쉬웟으나 반전 너쁘지 안내요  
20170912,9,반전의 반전의 반전!!  
20170912,9,샤말란 이젠 안녕....  
20170912,9,아들의 죽음  범인을 찾기위한 연기 참 좋았읍니다  
20170912,10,몰입감이 쩌네요!!! 마지막에 긴가민가하긴 했는데 진짜 소름 ㄸㄷ  
20170912,9,스토리 전개도 흥미롭고 마지막 소름끼치는 반전 대박입니다  
20170912,10,식스센스 이상의 반전 잼있어요!  
20170912,10,마지막까지 방심할 수 없다. 꾸르잼!  
20170912,10,기대 이상. 올만에 극장에서 볼만한 가치가 있는 스릴러를 만났다.  
20170912,10,사건의 연결고리를 추리하는게임! 마지막반전은 경이롭다  ㄷㄷ  
20170912,10,재밌게 봤습니다. 오랜만에 집중괌 몰입할 수 있는 스릴러  
20170912,10,반전이 끝내주는 영화. 강추.  
20170912,10,끝까지 숨막히는 전개. 근래 본 최고의 스릴러 영화!  
20170912,9,반전에 살짝 놀랐네요!ㅋㅋㅋ스릴러 영화 좋아하는데 재밌게 봤에요 ㅎㅎ  
20170912,8,시시회 당첨으로 보고 왔는데반전이 조금 예상 되긴 하나 간만에 재밌는 영화 였습니다 돈주고 봐도 후회 안합니다 추천 합니다  
20170912,10,꺄오ㆍ 멋지다. 뛰어난 연출력에 박수를‥ ^^♥  
20170912,10,몰입도 최고!! 개봉하면 또 보러올게요!!! 화이팅!!  
20170912,8,설마했던 결과라 소름소름 분위기가 영화에 한몫하네요 개봉하면 꼭 보시기를!  
20170912,10,스토리가 진행될수록 반전에 반전을 거듭하네요!!대박 강추합니다 ~~  
20170912,8,상상을 초월한 결과물인 작품  
20170912,9,역시 전주영화제에서 호평을 받은 영화답게 침착하고 치밀한 서스펜스라 만족했다  
20170912,10,와... 정말 대박이라는 말밖에...처음부터 끝까지 눈을 떼지 않고 집중해서 봤네요.엄청 조밀하고 치밀하게 계획된 영화입니다.보고 나서도 믿기지 않아요.보이는걸 전부 믿어서는 안됩니다.끝까지 의심해야하는 영화예요.  
20170912,10,집중도 있는 영화네요 재미있어요  
20170912,10,재밌게봤어요~!굿!  
20170912,10,100분동안 관객을 가지고 노는 영화 대박!!  
20170912,9,아들을 잃은 부모님 의 마음이 느껴지는 이야기  
20170912,10,반전에 반전 너무재밋엇어요  
20170912,10,엄청난 반전이 있네요연기력 짱  
20170912,10,제가 본 추리물중에 제일 재밌었어요! 반전이 대박!  
20170912,10,정말 끝까지 딥중하게 만드는 영화  
20170912,9,뻔한 얘기려니하고 기대없이 보기 시작.이야기가 진행될수록 집중하게 되고 빠져드는 작품였다는  
20170912,10,스피드한 전개 충격적인 결말 재밌게 잘봤어요  
20170912,10,와 반전의반전 영화보면서 뭔가 진실일까 계속 생각하게됨  
20170912,10,최근 본 영화중에 제일 재밌어썽요!!!  
20170912,10,올해본 스릴러 영화중 최고였어요 ㅎㅎ  
20170912,9,반전의 반전의 반전의 반전의반전  
20170912,10, 몰입감있는 스토리와 치밀한 연출에 박수를!  
20170912,9,친구덕에 첫시사회영화 주연남의 포스터만으로도 멋짐 폭발!연기도 기대기대!!  
20170912,9,긴장감 넘치는 스릴러.. 몹시 기대됩니다  
20170912,9,스릴러라 은근 무서울까 걱정도  되지만 뭔가 흥미로움에 눈을 떨수도  없었던 것 같아요 스릴 짱  
20170912,9,말 그대로 중간에 화장실가면 큰일나는 영화네요ㅎㅎ 정말 스릴넘치는 영화였어요  
20170912,10,"스페인 영화라고 해서 과연 재밌을까... 의구심이 들었는데, 너무나 흥미진진하고 괜찮았습니다 굿굿~  "
20170912,9,재밌네요 볼만합니다~추추  
20170912,8,훙미진진하고 너무 재밌어요.^^  
20170912,10,추리소설 엄청 좋아하는데 인비저블 게스트 너무 재밌어요! 영화를 보면서 저도 추리하는게 떨리고 신나요! 인비저블 게스트 안보신분들 꼭 보세요! 추천합니다!  
20170912,10,엄청난 반전!!대박 스릴러 한편이 나왔네요~  
20170912,10,손에 땀을 쥐고 봤어요 ㅠㅅㅠ  
20170912,9,재밌어요! 강추합니당  
20170912,9,재밌다앙우오아우옹얍  
20170912,8,숨막힐정도로잼있어요!  
20170912,10,미스터리 스릴러로 죄고  
20170912,10,스릴러영화여서 끝까지 긴장놓치면 안되네요ㅎ  
20170912,10,몰입도 높은 영화네요 굿입니다  
20170912,7,반전영화에 이름을 남길 영화라나.. 그정돈 아닌거같고. 솔직히 보다보면 어느정도 예상가능한 결말.. 그렇지만 짜임새가 좋다. 엘시크레토를 따라오지는 못하네  
20170912,6,영화를 정말 많이 보긴 했는지...반전이 너무 쉬움... 30분만에 맞춰 버렸는데 설마 아니겠지 하고 끝까지봄...이런것도 반전임??? 솔직히 이런 영화만 30년 넘게 봐서 그런지 영화 조금만 많이 본사람이라면 그냥 그저그런 영화일 뿐...  
20170912,10,변호사에게 자백할때 변호사 흔들리는 눈빛... 끝나고 생각하니 소름돋는다....  
20170912,8,기대하던 내용의 스릴러물은 아니지만 다른 프레임에서의 재미를 던진다. 상상 가능한 이야기로 관객들을 이리저리 이끌고 다니다가 크게 마무리 짓는다. 여번호사(?)의 연기가 압권이라 뒤를 상상하기 어렵다. 엄청난 스토리는 아니지만 몰입과 연출은 수준있다.  
20170912,10,우연하게 보게되었는데 처음부터 끝까지 몰입도가 최고에요 광고가 아니라 진짜 반전 쩔어요 진짜 스릴러 좋아하시는분들은 꼭 보셧으면해요  
20170912,9,두번봤다 죨라 재밌다.  
20170912,10,와 개소름...진짜 얼마만에느껴보는 허탈함과전율인지  
20170911,9,반전영화 순위에 이름을 남길 영화  
20170911,10,본 직후에 너무 재밌어서 연달아 욕이 나올 정도였다 뒷통수를 몇톤은 되는 망치로 맞는거 같은 역대급 반전. 스토리 너무 잘 짜여짐. 정말 최고다  
20170911,8,속고 속이는 흐름이 연속되는 반전 심리적인 요소가 상당하고 추리소설 한편 본듯 하게 만든다  
20170911,7,예측 가능하고 낡은 반전이긴 하지만 한국적 정서와 잘 맞아떨어진다.  
20170911,1,참보면서  사람들 오지랖 넓다라는걸 느낌~ =ㅁ=;;; 나는 왜이리 억지스럽지 내용이;;;  
20170911,10,짱이네요 오랜만에 반전영화  
20170911,10,식스센스는 그냥 킬링타임 이였군..  
20170911,10,역대급 스릴러다!!! 엔딩장면은 잊을수 없다  
20170911,8,추리소설과 스릴러가 가미된듯한 한시도 방심하기힘든 특유의 연출이 좋고 반전의 반전은 매우 흥미로우나 최후의 반전은 조금 식상하고 연출상으로도 예측가능한 수준이라 아쉬웠음.. 좀 더 신선한 반전이었다면 평점의 극을 달리지 않았을까  
20170910,2,부자가바람피고 애인하고 집에가다가 뺑소니교통사고내고 뒷수습하다 지꾀에 지가 빠진다는 내용   욜라 지루한 영화임  
20170910,10,식스센스 유주얼서스팩트보다 더 반적적이였다.... 지금까지 본 반전영화중에 최고의 영화였음. 국내 상영하면 대박나겠는데?  
20170910,6,기존 추리물 반전물들 적절히 버무린 느낌. 뭐하나 창작의 느낌은 없다  
20170910,10,진짜 마지막에 소름이 대박영화  
20170910,8,조작된 기억의 퍼즐에 진실이 덧씌워질 때의 짜릿함.  
20170910,7,어느 한 연극부부의 복수극  
20170910,9,엔딩끝나고 뒷통수 몇대 후려쳐맞은것같은 기분과 동시에 전혀 예상하지도 못한 내자신에게 한심했다.  
20170909,10,별 기대생각없이 봤다가 헉하는 그런 영화있죠..ㅋㅋ포스터만 보면 따분할거같았는데..진짜 훅 빠져서봤어요..반전의반전..  
20170909,10,리얼 오졌다와....  
20170909,10,와... 진짜 대박임. 이런 류의 영화를 정말 좋아해서 유명한 명작들 다 봤는데 그 중에서 이 영화는 다섯손가락 안에 꼽힐 정도로 잘만든거 같네요. 과하지 않은 연출도 좋고 배우들의 연기도 훌륭하고 플롯이야 말할 것도 없고.. 진짜 메멘토 급의 대작  
20170909,7,이젠 반전 영화라고 하면 모든 가능성을 미리 생각하게 돼서... 결국 반전을 알아내긴 했지만 ㅎ  
20170909,10,이거야말로 잘만든 영화. 끝에 저도 모르게 박수쳤습니다.  
20170909,7,더 바디 (2012)로 인상적인 연출력을 보여준 감독답게 이야기를 탄탄하게 끌고 가는군  
20170909,10,아....왠만하면 스릴러 대충 감이 나오는데..ㅎㄷ 이건 알수가 없다. 아니 알고 할 시간이 없다. 아닥 하고 끝까지 보아라.  영화가 끝날즈음 멍할테닷.!!ㅎㅎ  
20170909,6,트랜스포머5 최후의기사 보다 보니 너무 재미없었음~  
20170909,4,개 어거지영화;; 저렇게 의뢰인의 변호사 사칭하고 정보빼내는것도 명백히 불법 증거 아닌가 ㅡㅡ  
20170909,10,드라마계의 유쥬얼서스펙트  
20170909,7,얼굴이 너무 닮아서 예리한 사람은 다 알겠습니다. 그것만 유일한 단점입니다.  
20170909,10,"와 개소름, 진짜 반전 와 ㅠㅠ  "
20170909,8,캬~~~각본지리구염  
20170909,4,스페니쉬 엑센트가 꽤 거슬리지만 반전 스릴러로서 나쁘진 않음. 다만 전개 방식이 유주얼...을 떠올리게 하는 것은 클리셰 같아 다소 아쉬움. 원작이 소설이라면 책으로 읽는 것이 더 나을 듯  
20170909,8,호텔에서 일하는 어머니가 말빨이 거의 변호사 뺨치는데 너무 어거지 아님?? 갑자기 어머니가 똑똑하게 나오는거  빼고는 볼만했음  
20170909,9,개연성이 정확히 맞아 떨어지는 완벽한 짜임새...  
20170909,7,"약간 작위적인 점도 없진 않으나.. 충분히 흥미롭다. 그리고, 반전이 과연 무얼까 궁금하며 보았는데.. 설마 그럴 줄이야.. 역시 반전의 묘미가 있네요~  "
20170909,9,반전의 반전의 반전영화. 어두운 분위기와 배경음악도 한몫했네요. 재밌었어요. 반드시 끝까지 보셔야합니다!  
20170908,10,반전에 반전에 또 반전...  
20170908,10,재밌어요 몰입하고 봤네용 ^^  
20170908,10,진짜 대박. 모든 단서 하나 허투로 쓰는게 없네요. 대단한 구성과 연출!  
