0,1,2
20170908,6,등장부터 설마 했는데 그 설마가 맞았음!!  너무 큰기대를 했나봄!  
20170908,8,촘촘히 엮인 스토리와 미스터리 스릴러로의 긴박감있는 연출이 좋았다. 남주 와이프도 무슨 역할을 하지않을까 기대했지만 그러면 너무 막장이 되는건가 ... 오리올 파울로는 주목해야할 감독임엔 분명하다.  
20170908,10,굳 말이 필요 없는거같음  
20170908,8,재밌게 봤습니다  ㅎㅎ반전 굿  
20170908,7,잘 만든 영화 킬링 타임용으로 적격  
20170908,7,안타깝네요..전 넘 일찍 알아버렸어요...변호사 딱 나오는 순간 알아버렸네요....ㅜ.ㅜ  
20170908,10,진짜 재밌어요.감독 진짜 대박  
20170907,9,약간 억지스럽지만  긴장감 넘치게  스토리를 이어나가는 영화  
20170907,10,오.. 영화 완전 꿀잼 예약  
20170907,9,스페인언어가 낯설고 인물의 패션이 어색/ 서서히 추리?하게되며 마지막까지 피곤하지 안게 드라이빙하는 몰입도 너무좋네요..  
20170907,10,"예고편 보고 완전 기대됩니다. 긴장감있는 연출하고, 시나리오적인 후반 만족도 다 느낄 수 있으리라 믿으며:)  "
20170907,10,개대박 존나 보고싶다 ㅋㅋㅋ  
20170907,10,기대가되는 작품!! 꼭 볼래요  
20170907,10,재밋어요 아닥하고 보는영화  
20170907,7,흥미진진하게 봤음근데 그 변호사가 죽은 아들 엄마인건 눈치챘음  
20170907,10,2017년 내가 본 영화중에 단연 최고다. 식스센스 이후의 최고의 반전!! 안보면 평생 후회한다.  
20170907,9,기대하지 않았는데  평점대로 재밌네요 ㅎ 아직 안 보신분들 평점믿고 보시길 ㅎ  
20170907,4,영화시작 30분만에 결말이 보였다...  
20170907,8,"반전의 ,반전에 의한, 반전을 위한 영화  "
20170906,3,극적 스토리텔링에만 치중한 오만함에 자아도취까지.  
20170906,10,스릴러다운 스릴러... 일단 빠져서 보고 있으면 시간 가는 줄 몰겠다 ㅜㅜ  
20170906,10,전주영화제에서 보고 한동안 감흥이 사라지지 않았음. 진짜 웰메이드 스릴러. 상영관 수 많았으면 ㅜㅜ  
20170906,10,반전에 반전이라고 댓글단 사람 때문에 집중이 안되네계속 그 생각만 나서 그것도 스포라는건 생각 안하시나?  
20170906,8,영화는 재밌지만 보자마자 알겠던데  
20170905,10,영화를 보기전 평점 글 남긴걸 보지않길.. 갠적으로 반전영화라고 얘기하고 보는순간 재미가 반감된다. 간만에 보는 스릴러 수작  
20170905,10,"유주얼 서스펙트, 식스섹스를 잇는 대~~박 반전 영화 진짜 한시간 이후 우와 대박 쩐다를 연발하게됩니다 변호사의 정체를 진짜 한시간동안 몰랐음 대....박!  "
20170905,8,스페인 영화는 강력한 여운이 남는다.  
20170905,10,와우 흥미진진 했어요  ㄷㄷㄷ  
20170905,6,"밀실 살인사건의 진실, 그것을 추적하는 과정이  진술이 아니라 다른 추리적 요소였다면 하는 아쉬움, 마지막 반전도 예측가능한 정도.  "
20170905,7,"영화의 재미로는 10점이나 최종 반전을 너무 일찍 알아버림 그냥 생긴 것만 봐도 닮았던데, 마지막까지 내 상상이 아니길 바랬는데....  "
20170905,7,반전은 많은데 재미가 없음  
20170905,10,시간 가는줄 모르고 집중해서 봤네요  
20170905,10,마지막 장면 연출 딱 끝나고 스텝롤 올라갈때까지.. 전율이 안멈추더라.. 여러 관점을 보여주는 추리 구성과 영리한 짜임새.. 그리고 임팩트있는 마무리까지.. 와.. 이 작품은 진짜 ㅋㅋ 한동안 못잊을 듯  
20170905,10,허허허 이거 평점보고 별기대없이봣는데 대박이네요 올해본 영화중 단연 최곱니다  
20170905,5,쏘우를 따라하고 싶었던 유즈얼 서스펙트  
20170905,6,음...대단한 반전급은이니고 예측가능한 스토리에 중반서부터 변호사가 누군지알겠더라 연출은 깔끔하고 좋았지만 내용은 그닥 신선하지않았음  
20170905,7,The Invisible Guest  
20170905,10,진짜올만에반전영화대박날듯.  
20170905,10,와..결말확인하고 영화 다시 첨으로 돌려봄..보는내내 몰랐다니.... 헐...  
20170905,5,희생자엄마가  변호사로 분장      슬리퍼스 처럼  너무 과하게 알려할때 눈치 안남?   부부가 뜬금  연극동호회에서 만났다고 했을때  ㅋㅋ 설마 했는데...기대를 너무 했나?  우쨌든  반타작은 하는 영화  
20170904,10,더 바디도 참 재밌게 봤었는데 이 영화 또한 스토리 속 스릴감과 몰입감이 대단하다. 보면서 반전은 어느정도 예상했으나 마지막에 내가 생각했던 반전 그 이상이 있었다...  
20170904,10,대박 끝까지 여운을남기고 집중할수 밖에없는 영화  
20170904,5,고통 없는 구원은 없다.  
20170904,6,초중반 좀 다른쪽(?)으로 좀 의심스럽긴했는데 어쨌든(?)반전만...정말...깜빡 속았지만...몰입도나 치밀함이 예상했던 것보다는 딱히(?)혹시나 했는데 역시나 감독님 전작들처럼 뭔가 2% 부족한 느낌을 받았던 영화...  
20170904,8,괜찬긴한데 변호사 변장좀잘하지 보자마자 누군지알겠던데...  
20170904,10,일단 평점 처음써보는데  반전중에는 최근 영화중에 최고다 한방 오지게먹었고 몰입감 연기력 그냥 너무좋았다디스트릭스9 이후 공허함이 비슷하다  
20170904,10,오~~ 진짜 스릴러~~~ 진심 괜찮네요.  
20170904,7,시나리오 도 좋고  반전또한 상쾌했다.긴장감있는 작품  
20170904,10,간만에 재밌는 반전영화를 찾았습니다. 몇년만에 보는 수작이네요~반전 대박에 끝날때까지 긴장하게 만드는 영화  
20170904,7,남주 연기 몰입이 잘 안됨. 반전은 좋았으나 스토리 전개는 그저그런  
20170904,5,그닥 재미없고 지루함 반전도 별로 놀랍지도않고ㅇㅇ진짜 알바푼것같네  
20170904,10,간만에 제대로 된 영화를 봤네요 ^^  
20170904,8,반전을 당연하게 끌어내는 연출력  
20170904,10,스릴러매니아두번보는영화  
20170904,5,솔직히 지루한데 마지막 반전만 좀 소름이였음 평점 너무 높네  
20170903,1,남주발암연기에10분보다가졸았음...마지막반전을위해억지로끌고간다...  
20170903,10,충격적이다.모든사람이 속을것이다.  
20170903,1,개봉하기전 알밥생들 풀었네..  
20170903,10,계속  생각나게 만드는 영화  
20170903,10,보다 소리질렀당 올해본 영화중 단연코 최고다 감독이 첨재인듯  
20170903,7,차라리 전작인 더 바디가 나은듯 너무 빠른전개로 대화들이 산만함.근데 몰입은 잘되는데 문제는 마지막 반전을 위해서 두서없이 복선들을 급하게 푸는 느낌이들어서 다른 인물간의 내용을 모르겠음 ㅡ한번더 봐야 이해할듯.얘기가 너무 빠름  
20170903,10,범인은 절름발이임~~  
20170903,9,오랜만에 몰입감도 좋고 스토리도 좋은 영화 봤네요..연기나 스토리 최고였습니다  
20170903,8,잘만든 영화. 플롯. 조심조심  
20170903,1,무슨 메멘토급임. 평점 보고 속아서 봤네. 반전이란건 생각지도 못한 결말일때 그 빛이 발하는건데 처음부터 의심가고 예상할 수준의 결말이었음. 마지막 씬에서도 너무 진부했다.  
20170903,10,이 영화 진짜 대박임 반전에 반전  
20170903,8,스페인 스릴러 영화는 처음인데 아주 재미있게 보았다. 관객이 편안하게 스릴러 영화를 즐길 수 있도록제작되었다. 스토리를 분석하려고 굳이 애써 머리를 굴릴 필요가 없다. 감독이 알아서 관객의 생각을 영상으로 전개해준다.단순하지 않고 많은 복선과  
20170903,10,재밌습니다. 꼭보세요  
20170903,10,"와아,...추리,반전 영화 유명한 건 다 찾아 봐서 왠만한 건 다 예측가능했는데 이 영화는 진짜 작품이다 배우연기,연출,스토리 모두 역사에 남을 반전영화다.  "
20170903,10,마지막 장면 보고 소오름~~^^b  
20170903,8,반전 예상 못했다...  
20170903,10,"듣도 보지 못한 영화임에는 틀림없습니다. 탄탄한 대본, 생생한 현장, 압도적인 연기력 반전에 반전 등 영화치고 짧은 러닝타임이지만 ""영화란 이런 것이지""를 알 수 있었습니다.  "
20170903,10,기가막힌 내용전개. 재밌는 수작  
20170903,9,굿맨의 스페인어가 주는 딱딱끊어지는 그 카랑카랑함 그 카랑카랑 똑 부러지는게 이 영화다  
20170903,10,이 영화 대박 반전이 계속 연속 마지막엔 다시 뒷통수  
20170903,9,대박 식스센스이후 반전  
20170902,10,유주얼 서스펙트 처음 봤을 때의 느낌을 또 다시 받은 최초의 영화였습니다  
20170902,10,오랜만에 영화 다운 영화봤습니다.. 몰입하게 만드네요  
20170902,10,역대급 반전 영화임..대박 소름의 소름 끼침..전혀 예상할수없는 전개..  
20170902,10,이 영화  ㅁ ㅣ쳣다 보면안다  
20170902,10,정말 강추합니다! 상상초월이네요  
20170902,10,반전에 반전 마지막의 마무리는 정말 입을 다물지 못했다  
20170902,10,작가 천재인듯. 와우 오랜만에 영화다운 영화봤네.소름끼치는 반전...  
20170902,9,탄탄한 시나리오와 반전 명품 스릴러가 갖춰야할 조건을 모두 갖췄다  
20170902,10,8월30일 용산CGV 8시30분 시사 참석. 진짜 역대급 쓸릴러 대박 이었습니다. 강추!!!  
20170902,10,꿀잼이에요. 엄청 재밋ㅅ을것 같아요  
20170902,10,버지니아 굿맨 개쩜ㅋㅋㅋㅋ 반전의 반전의 반전  
20170902,10,"끊임없는 서스펜스와 복선, 훌륭한 전개, 소름돋는 반전 오랜만에 훌륭한 영화였다.  "
20170902,10,굿~맨   굿~   보시면 아실듯^^  
20170902,6,반전에 반전이긴하지만 후반부에 문뜩보니 변호사가 부인이랑 닮아서 쟤 아니야?? 싶었는데 맞았네 ㅋㅋ  
20170901,10,시사로 먼저 봤어요. 관객들과 정정당당하고 팽팽하게 겨루는듯한 연출이 인상적이었음! 끝까지! 모든 것을 의심해야하는 영화! 미친 몰입감 최고최고 ㅋㅋㅋ  
20170901,8,27일 용산 시사회로 관람했습니다. 스페인어때문에 오히려 더 방해가 된듯한.. 반전에 반전.. 풍경도 이쁜고. 시나리오도 좋은데.. 이상하게 잘 담아내지 못한느낌?  
20170831,10,2017.08.30 CGV 용산아이파크몰 시사회 후기: 반전 쩔어요  
20170830,10,방금 영화보고 나왔는데 대박이라는 소리가 절로 나오는 영화입니다..개봉하면 다시 봐야겠어요~~^^  
20170830,10,보이는걸 그대로 믿으면 안되는 영화  
20170830,8, 사운드와 어우러진 빈틈없는 긴장선의 전개가 인상적이었던 영화였습니다:)  
20170830,10,진짜 소름돋는 명작입니다! 꼭보세요ㅠ 후회안하실겁니다.  
20170830,9,셜록같은느낌으로 너무재밌게봤어요ㅠ.ㅠ  
20170830,9,잘 쓴 추리소설 읽고 나온 기분  
20170830,6,중간부턴 결말 예상이 가서 참...  
20170830,10,반전.... 재밌습니다 !  
20170830,10,와~  진짜 한순간도 한눈 팔 수 없는 영화예요!!  엄청 집중해서 봤네요!ㅋ 이맛에 미스터리스릴러물 보는ㅎㅎ  
20170830,10,완전 흥미진진. 반전이 멋집니다..  
20170830,10,반전쩌러ㅠㅠ 잘생겨서 더 화나 ㅋㅋ  
20170830,8,오랜만에 재밌게 본 영화!  추리소설 보는 줄 알았어요!!  
20170830,10,최고 의 반전! 영화에 빨려들어간다.  
20170830,10,배우들의 입에서 대사가 나올 때마다 가슴이 철렁하는 반전의 연속.  
20170830,10,보는내내 긴장되고 스릴있습니다!  
20170830,10,계속되는 긴장감 반전에 반전 영화 넘 재밌다  
20170830,10,진짜 그냥 말필요없이 관객다속이는 그런영화..  
20170830,10,짱재밌어요 엉엉엉 반전 대박이었슴다  
20170830,9,개띵작 시사회 오졋다 와 반전개소름  
20170830,10,최고의 몰입감이네요. 잘봤습니다.  
20170830,9,보는내내 긴장감 있고 재밌었어요  
20170830,8,반전개쩔어요!!!!  
20170830,7,엄청 집중하며 보게되네요!^^  
20170830,10,끝까지 관객을 속이며 범인을 찾게 하는 긴장감이 최고에요.완성도 높은 영화로 추천해요  
20170830,10,예고편 영상이 순삭 바로 이벤트 시사회로 보러왔는데.. 세상에역시 진짜 기대를 져 버리지 않는다. 영화 볼때 진짜 까다로운데 나의 까다로움에 맡는 영화.. 보는 내내 스릴이 이런 영화를 볼수 있는기회를 놓치지 않아서 다행이였다 ㅜㅅ  
20170830,10,완전 재밌어요! 강추강추  
20170830,10,너무 재밌어요~ 완전대박 흥행예감입니다~^^  
20170830,10,소름입니다 진짜 오랜만에 너무 몰입해서 봤어요!!강추  
20170830,8,집중하고 보는 영화! 멋져요!  
20170830,10,올해 본 영화중 최고 예요  
20170830,9,유럽산 추리 소설에 빠른 템포의 편집과 강렬한 음악을 가미한 느낌  
20170830,10,시사회보고왔어요 끝까지 긴장을 놓을수없는 작품  
20170830,10,너무 재밌어요 반전도 최고!!!  
20170830,8,충격마지막...!!!잼있었어요..!!ㅎ  
20170830,10,올해 본 스릴러중 최고!  
20170830,9,생각했던것과 다른결말강츠  
20170830,8,깔끔하고 잘빠진 유럽식 스릴러  
20170830,7,똑똑한 스릴러. 반전이 대단하다  
20170830,8,몰입도가 정말 높네요 시간 순삭!  
20170830,10,간만에 괜찮은 스릴러 영화잃을게 없는 사람은 무서운게 없어요  
20170830,10,정말 반전에 반전을 거듭함 올해본영화중에 최고...  
20170830,10,전주영화제에서 수상했다고해서 기대하고 봤는데 진짜 반전의 반전 재미있었어요!  
20170830,9,"간만에 소름돋는 스페인산 미스테리, 추리 스릴러가 나왔습니다. 극의 흐름이 진행될수록 긴장감과 몰입이 엄청나게 올라가서 심장이 다 두근거렸습니다. 아주 좋은 작품 극장에서 보세요 !!  "
20170830,10,계속해서 따라가는 재미가 있습니다~좋은 스릴러 잘 보았습니다.  
20170830,10,대박이요.  마지막까지 긴장할 수가 없네요  
20170830,7,죄짓고 살지 말지어다...  
20170830,8,반전에 반전을 이은 자식을 잃은 부모의 복수극  
20170830,8,시간가는지 모르고 봣어요  
20170830,10,역대급 소름 돋는 결말이다  
20170830,10,와..진짜 한순간도 긴장을 놓을수가 없더군요. 시사회로 봤지만 정식 개봉하면 한번 더 보려고합니다.  
20170830,9,완전 재밌어요 두근두근!!  
20170830,10,소름끼치는 반전이에요 짧지만 강렬하네요 강추합니다  
20170830,9,스릴러 영화 안좋아 하는데 영화 대박 재밌어요!! 끝까지 속이는 스릴러!! 식스센스 급 이네요!!  
20170830,10,최고의 반전의 반전 너무 잼있어요  
20170830,10,골때리는반전으로 기대그대로다  
20170830,9,반전의 반전을 거듭하는 스릴러!  
20170830,10,소름돋는반전. 놀랍다.  
20170830,8,심장이 터질 것 같은 영화예요  
20170830,8,아무정보도 없이 본다면 정말 후회없을듯  
20170830,10,대박 그냥 보세요 그럼 아실거에요  
20170830,10,빈전에 반전 미친영화 ㄷㄷ  
20170830,9,재미있습니다 반전에 반전 꼭 보세요  
20170830,8,엄청난 결말입니다오래간만에ㅡ보는 확실한 스릴러네요  
20170830,8,으앗...으스스하네요!  
20170830,9,추리 미스터리 스릴러로 최고네요  
20170830,10,와우 영화끝나고 이렇게생각많이하게하는 영화는 첨인듯하네요!! 짱재밌어요!꼭보세용!  
20170830,10,방심은 금물! 끝까지 예측을 불허한다!  
20170830,10,아주 재미납니다.관객을 끝까지 속이는스릴러. 끝까지 보시라.  
20170830,10,달콤한 프랑스어로 보고 듣는 긴장감 넘치는 소설!  
20170830,10,이런 반전.... 진짜 놀라서 말이 안나와요 ... 흥행했음 좋겠습니다...  
20170830,10,짱짱 재밌었어요^^^ㅋㅋㅋ  
20170830,10,끝까지 긴장하면서 봤습니다 국제영화제출품작답네요 죄짓고 살지맙시다ㅠㅠ  
20170830,8,인비져블 게스트 잘 보고 갑니다  
20170830,7,재미있게 봤어요..끝까지 집중~~;;;  
20170830,10,완젼 재밌어요 진짜 끝까지 긴장되네요  
20170830,10,시간가는줄모르고봣습니다! 최고에요!  
20170830,10,끝까지 긴장의 끈을 놓을 수 없는 웰메이드 정통 스릴러!  
20170830,10,너무나 재미나게 보았습니다역시 영화는 끝까지 봐야 결말을 알 수 있는거네요.  
20170830,10,미쳤어 대박입니다 진짜 꼭 보세요!!  
20170830,10,감히 추측하려 하지 마라>ㅇ<!!  
20170830,10,진짜 마지막까지도 예상못햇네요 ㅋㅋㅋㅋ  
20170830,8,심증만 잇도 물증이 없을때 어찌해야하는지 보여주는 최고의 반전 스릴러  
20170830,9,와~~볼만합니다  굿이에요 굿  머리좋은사람들의싸움  
20170830,8,스릴있고  긴장감있고 보기좋았습니다..꼭 보세요..굿입니다  
20170830,10,"스토리,연출 뭐하나 빠지는거 없이 완벽한 영화 별점 10점이 아깝지 않은영화. 역시 더 바디를 연출한 올리올 파올로 감독이네요.  "
20170830,10,영화진짜 재밌네요 친구들한테도 적극 추천해야겟어요  
20170830,10,역시! 기대했던 범죄스릴러!  
20170830,10,웰메이드 스릴러 영화! 극장에서 보기를 추천한다.  
20170830,10,상영시간 내내 기분좋은 긴장과 설렘을 느낄수있었던 영화!!  
20170830,9,긴장을 늦출 수 없는 스릴러 영화!! 추천합니다!  
20170830,10,긴장을 놓칠 수 없게 만든 영화! 강추!  
20170830,8,손에 땀을 쥐는 스페인 스릴러의 백미!  
20170830,10,재미있다 슬릴넘친다 끝까이속다  
20170830,10,많이 기대하고 있었는데 행복합니다^^  
20170830,10,기대가 되는 스릴러 영화. 추천  
20170830,8,마지막까지도 예상하지 못했다는...  
20170830,8,국제영화제 수상작이라 기대가 컸는데 재미있게봤습니다.  
20170830,9,놀라운  반전 재미있어요  
20170830,9,주변에서 미리 본 지인들에게 추천 많이 받은 영화라 기대가 높았는데 만족스럽네요 저도 강추합니다  
20170830,10,이미 한국영화가 리메이크 예정이 됐다는 작품이라 어떤 내용일지 굉장히 궁금했는데 입소문 만큼이나 짜임새 있고 퍼즐 같은 영화네요. 너무 재미있게 봤습니다!  
20170830,10,끝까지 눈떼지 못할 정도로 영화 전개 굿  
20170830,9,반전좋고 재밌습니다~~~  
20170830,10,영화제에서 최고의평을 받았던작품. 역시 명불허전!  
20170830,10,스릴러의진수를~~~보여주는영화  
20170830,10,시사회에서 보았는데 더운 늦여름에 시원하게 보기 좋은 영화입니다  
20170830,9,역시 줄리아의 눈 만든 감독답게 스릴 끝네주네요^^b추천합니다...즐거워요^^  
20170830,9,마리오의 아드리안의 연기가 좋았습니다 전주영화제때 극찬 받은이유를 알겠습니다  
20170830,10,기대됩니다 인비저블게스트  
20170830,8,반전이 있는 스릴러가 짜릿한 재미를 주네요  
20170830,10,100분동안 눈을 뗄 수 없는 영화인거같아요다들 꼭 보세요 !!!!  
20170830,10,올해 2017년 영화중 세손가락 안에 드는 최고의 영화!  
20170830,10,관람전 반드시 보아야할영화!! 스릴넘지는영화로  손꼽혀서 강추해도될만한영화!!!ㅎㅎ  
20170830,9,한순간도 긴장감을 놓을수없는 연출력을 보여주는 최고의 작품  
20170830,10,숨막히는 스릴러 영화였어요 재밌어요  
20170830,9,끝까지 속이는 스릴러 이리올 파울로 감독 작품  
20170830,9,전주 영화제에서  보고 또보는 기대작 액션대작이라 할수있네요!  
20170830,10,전주국제영화제의 단연 화제작! 굳이 표현하자면 거미줄같은 영화다. 작은 요소와 신경쓰지 않고 지나칠 수 있는 사소한 부분마저도 신경쓰이게 하는... 뒷골이 띵하다. 관람객 여러분 우리 모두 뒷통수 조심?!!  
20170830,10,관객을 끝까지 속인다. 충분히 볼만한 스릴러  
20170830,10,기대된다!! 스릴러 엄청 좋아하는데 어떤 느낌일까 궁금하네요 ^^  
20170830,9,스릴넘치네요 감독님이 기대를 저버리지 않으셨어요!  
20170830,10,정말 이렇게 재밌다니 꼭 보십쇼  
20170830,9,관객을 끝까지 속이는 스릴러 맞습니다.ㅋ  
20170830,9,단 한숨도 쉴틈을 안주고 끝까지 밀어붙이는 스릴러!!  
20170830,10,믿고 보는 <더 바> 마리오카사스 주연의 스페인영화인만큼 <인비저블게스트 > 무척 기대됩니다.  
20170830,10,영화가 끝날 때 까지 멈추지 않는 두뇌게임~기대 이삼 반전의 반전 또 반전  
20170830,9,관객을 끝까지 속이는 스릴러라는데 흥미롭네요. 감독님을 믿고 봅니다.  
20170830,9,정말 대박 반전!! 개봉하면 꼭 다시보리다~~**  
20170830,10,심장쫄깃! 기대를 뛰어넘는 스토리에 푹 빠졌습니다!강추  
20170830,10,스릴감 긴장감 제대로 넘치는...끝까지 긴장을 놓을수 없는...인비저블 게스트 짱!  
20170830,8,평이 좋아 기대만땅하고 시사회 봤습니다. 근래 제대로된 스릴러 없었는데 잘봤습니다.  
20170824,10,재미있는 영화입니다.  
20170822,8,전주 국제 영화제에서 봤는데 스토리 짱입니다!! 1초도 눈을 뗄 수 없으니 꼭 보세요~  
20170822,10,전주에서 봤어요~~재밌네요  
20170822,10,전주영화제에서 본 영화중 대박이었습니다ㅎㅎ강추입니다  
20170822,10,"범죄, 스릴러 영화를 좋아하는데 마지막까지 긴장을 놓지 않으며 본 영화입니다.  "
20170822,10,보는 내내 긴장감을 놓칠 수 없는 잘 만든 작품입니다. 배우들 연기 정말 좋네요.^^  
20170822,10,"지난 전주영화제가 기억나네요. 완벽한 영화, 무조건 보셔야 하는 영화입니다.  "
20170817,10,전주 국제 영화제의 화제작!! 기다려집니다!!!  
20170812,10,전주국제영화제서 본 대박영화 상상 이상  
20170809,10,"탄탄한 짜임새 ,완성도 높은 수작이네요...강추!!!  "
20170808,10,너무너무 기대됩니다~ 개봉하면 바로 보러가야겠네요~!  
20170731,10,영화제에서 첨 봤는데 긴장감 굿굿 ㅋㅋㅋㅋ 관객들을 끝까지 속이는 스릴러다  
20170731,10,영화 좀 대박! 극적인 카타르시스 느낄 수 있는 영화입니다. 개봉하면 영화관에서 꼭꼭 보세요!  
20170731,10,규정할 수 없는 영화.!! 신선하면서도 구성과 연출이 독창적이다. 나에게 다소 충격적이었던 영화  
20170731,10,"할리우드가 배워가야할 뛰어난 구도를 갖고 있고, 우리나라 영화도 이렇게 만들수 있을 것 같은데...  "
20170731,10,한국에서 리메이크 확정이라고 하던데!!! 전주에서 볼 때  뒷통수 찰지게 몇번 때리더니만 진짜 사고쳤구만 이 영화 ㅋㅋ 대박 대박 개봉 하면 또 봐야지 와 진짜 이런 영화를 꼭 봐라 참고로 번역 황석희님 ♥  
20170731,10,1초도 방심할 수 없음 영리한 연출력에 감탄했당 대박적  
20170723,10,보고나서 후회되지 않을 것 같은 영화입니다. 꼭 관람해 보세요.  
20170721,10,국제영화제 출품작이아 더욱 기대됩니다. 배우들은 잘 모르겠는데 어떤 연기를 할지 더욱 궁금하네요  
20170721,10,"영화구성 스토리 굿~^^,보시면 후회없습니다.  "
20170721,10,재밌을것같네요. 근데 개봉은 언제 ?  
20170721,10,무더위를 잊게 만드네요  
20170521,10,메멘토급 영화임. 진짜 대박  
20170517,10,우와..아직도 이런 뻔한 스토리로 이렇게 재밌는 영화가 만들어질수 있다니 대단합니다..스페인 영화도 장난아니군요..간만에 본 수작이네요..강추합니다~..참고로 전 알바 아닙니다..ㅎ  
20170501,9,전주국제영화제에서 봤는데 정말 재미있습니다. 배우들의 연기도 좋고 무엇보다 각본이 짜임새있고 탄탄합니다.  
20170430,10,전주 국제 영화제에서 관람한 영화 중에 오늘까지 단연 1위 작품입니다. 처음부터 끝까지 손에 땀을 쥐며 봤습니다. 배우들의 연기력은 두말할 것도 없고 시나리오 완성도가 아주 훌륭합니다. 이 영화 정보를 찾아보셨다면 꼭 보세요!!  
