0,1,2
20180228,10,학창시절에 이책 안읽어본놈잇냐ㅡㅋ  
20180227,9,조아요 꼭 책으로 보고싶습니당  
20180227,8,진지하게 볼 수 있는 오랜만에 영화라 잘 보고 갑니다.  
20180227,10,이게 영화로 나온다니 진짜 벌써 부터 울컥한다..  
20180227,10,"잔잔하기만 할 줄 알았는데, 인물들 사이의 비밀을 맞추는 재미도 있네요! 추천합니다!  "
20180226,9,애니로 나왔으면 더욱 좋았을 것을....일본은 애니는 좋은데 영화는 좀....  
20180226,3,새삼 느낌. 책은 책으로 읽는 게 좋다. 시사회 당첨되어서 좋았는데 너무 기대하고 봤나...그래도 책에 남은 애정으로 3점 드림...  
20180226,10,원작의 여운이 아직도 가시지 않았어요..  
20180226,10,분위기만 살려도 좋은 영화가 될 듯 합니다.  
20180226,10,"원작에서 길잃은 고양이는 무토 하루미인데, 왜 여긴 시즈코로 되어있지? 시즈코는 달 토끼인데...  "
20180226,10,기대된다. 망작이 아니길!  
20180225,10,히가시노 게이고. 정말 쉽게 잘 쓴단말이야. 영화로는 어떨지  
20180225,9,이 영화 꼭 보고싶어요~ 책으로 재밌게 봤는데 영화도 재밌겠죠?ㅎㅎ 기대많이 하겠습니당  
20180223,9,스크린으로 볼 수 있다니 기대되면서도 과연 원작을 살릴 수 있을지 궁금하네요.  
20180222,2,"이렇게 무미건조하게 만들기도 참 힘들텐데...원작의 십분의일도 못살렸네요.차라리 다른영화를 보시는게 개이득입니다,  "
20180222,9,간만에 가슴 찡~한 영화 한편 봤네요^^ 영화를 보고나니 원작이 얼마나 더 대단한지 궁금해져서 책까지 주문해놨습니다ㅋㅋ  
20180221,1,원작을 하나도 살리지 못한다.. 좋은 기억을 위해서 안봤으면..  
20180221,9,"당신으로부터 나, 나를 통한 타인으로 전해지는 감동!  "
20180221,10,가능하겠지?....  
20180218,9,정말 좋아하는 히가시노게이고님의 작품이고 원작이 너무 재미있어서 기대반 원작에 등장하는 등장인물들의 관계가 좀 복잡하게 느껴지는 것도 머지않아 있고 스토리도 좀 길어서 걱정도 반  
20180218,1,폭망 일거같네요. 그냥 소설책으로 봅시다  
20180217,1,책을 너무너무너무 재밌게 읽어서 .... 핵실망 핵노잼 이었다  
20180214,10,나미야 잡화점의 기적  기대 됩니다.  
20180211,1,1점주기도 아까운 영화라고 생각합니다  
20180211,4,부산국제영화제에서 감상했습니다. 정말 큰 기대하지 마시기 바랍니다. 일본 특유의 감성조차도 볼 수 없는 작품이었습니다. CG팀이 누구인지 정말 잡아다 족치고 싶을 정도고.. 중간중간 각색이 너무 심하게 되어가지고 책의 팬이시라면 안보는걸 추천합니다..  
20180211,10,애니로 기대 햇는데... 애니가 아니었네요 그래도 기대 되요!  
20180211,9,기대하지 않는것이 좋을듯 합니다. 책이 워낙에 명작인데다가 그걸 2시간짜리 영화한편에 모든걸 채워넣기엔 턱없이 부족할거라고 생각.. 그래도 꼭 보러갈검미다.  
20180210,10,책으로는 존잼이엇는데..  
20180210,10,기대해도 되갓어????  
20180209,10,원작 소설 방금 다 읽었습니다. 영화화 된다니까 너무 기대되네요. 에피소드가 꽤 많고 연결관계도 다 보여줘야 되서 러닝타임내에 다 표현할 수 있을지 걱정되긴 합니다... 그래도 원작이 워낙 훌륭하니 정말 기대됩니다!  
20180208,10,백지편지 감동이였는데 어케 잘 살릴지 기대된다. ^^:  
20180204,10,와 이거 진짜 명작인데... 영화도 명작이길  
20180204,10,원작만큼이나 영화도 기대하고 있습니다!!  
20180202,1,"구지, 돈 주고는 보지맙시다...  "
20180201,10,원작을 오늘 딱 다 읽었습니다.  마지막 백지 편지에 대한 나미야 할아버지의 답장이 특히 가장 멋있었습니다. 그런데 이거 영화화하기 힘들 것 같은데... 어떻게 돼있으려나 궁금하네요  
20180201,10,예고편만 보는데도 마법 같은 순간들이 계속되는 것만 같네여~ 영화 기대됩니다!  
20180201,10,히가시노 게이고 작가 무서운 추리 소설만 쓰는 줄 알았는뎅.. 감성과 추리가 함께할 수 있다니 놀라울 뿐...ㅎㅎㅎ 곧 개봉이넹 궁금하다ㅎㅎ  
20180201,10,"2시간 동안 빨려들어가서 봤어요, 도무지 눈을 뗄 수 없는 흡입력 있는 스토리!! 정식 개봉으로 다시 한번 볼랍니다~  "
20180131,8,마음이 따뜻해지는 영화였어요. 책을 영화로 표현하기 힘들었을 텐데 최대한 잘 살린거 같았어요!  
20180130,10,"원작인 책도 정말 재밌게 봤는데 이게 곧 영화화가 된다니, 정말 기대돼요!  "
20180126,10,정말 많이 기대 됩니다. 감명 깊게 읽었던 책의 영화화라니!!!  
20180125,10,책을 너무 좋아했어서  기대하고 있습니다.  
20180124,6,비행기에서 봤는데 솔직히 좀 별로인 부분이 많았음 좀 많이 지루하기도 했고..  
20180119,10,소설책으로도 너무 감동적이고도 재밌게  봤는데...!!이제 영화로 보여주는거란요!!! 아마 보면서 폭풍감동할듯!!!ㅠㅠㅠㅠ  
20180119,10,대박 정말 이건 믿고 봐야합니다!  
20180118,10,책으로 읽은 사람들은 알겁니다. 그냥 10점 누르시면 됩니다.  
20180117,9,왠지 애니가 더 날것같은 느낌이...  
20180116,10,요즘 책을 읽고있는데 정말 재밌어요우연히 알게된 영화소식에 개봉일이 기다려집니다~♡♡  
20180115,10,"감독, 배우분들의 고민이 많았겠네요. 개봉하면 꼭 보고 싶은 영화입니다! 힘내세요!  "
20180113,9,아 원작이 너무 강해서...그냥 후회없는 영화였으면 좋겠습니다...제발 느낌 그대로 살려 주세요ㅠㅠㅠ  
20180110,10,살면서 한번은꼭봐야하는 인생작 추천합니다  
20180109,10,와...이런 명작을 영화화하네..잘만 각색해서 해준다면 신과함께 비벼볼만 한대..  
20180109,10,원작만큼 기대되요!!  
20180109,9,영화화 정말 기대됩니다~  
20180107,6,야마다요....? 과연.... 배우는 둘째 치더라도 이걸 영화화 한다니 기대는 된다만 원작 느낌을 잘 줄 수 있을란지...!  
20180107,10,진짜 원작만 잘 살리면 완전 대작일텐데.. 기대할게요!  
20180106,10,야마다ㅠㅠㅠ 기대할게....개봉하면 달려간다  
20180103,10,원작도 감명깊게 읽었는데...꼭 보러갑니다!!!  
20180102,10,띵작!! 레알 최고!!  
20180101,10,나미야 잡화점의 기적이 영화로 나온다는게 사실인가요!!!! 너무 기대되요 책으로 사서 봤는데 영화에서는 어떤게 나올지 기대되요 그럼 1월 31일 개봉하면 바로 보러갑니다  
20180101,10,기대됩니다.ㅇㅇㅇㅇ  
20171227,1,일제.친일 영화는 그냥 거른다.. 위안부 할머님들이 지금도 울고 계신다.. 절대로 잊지 말라!  
20171226,5,소설 너무 재밌고 따뜻해서 영화에 대한 기대도 컸습니다. 씨네큐브에서 상영할때 봤는데 좀 실망했습니다. 니시다 토시유키님 연기는 좋았지만 책과 다르게 각색한 부분이나 몇몇 배우의 미흡한 연기 등으로인해 책처럼 몰입하기는 어려운 영화였습니다.  
20171222,8,원작에 충실한데다 음악이 참 좋다. 나미야영감의 연기가 가장 훌륭했음  
20171222,10,소설 속 나미야 잡화점을 완벽하게 구현해내다 현실에서도 저런 곳이 있었으면  
20171217,10,오늘 책으로 다 봤는데  사람들이 서로 연결되는 걸 어떻게 표현할지 의문...  
20171214,10,야마다 믿어본다!!@  
20171214,1,"이거 시네큐브에서 봤는데 정말 최악이었음. 감독이 책을 보고 만들긴 한건가 싶고 첫 배경과 음악부터가 애매했는데 나미야 할아버지 캐릭터 잡은 것 보고 어리둥절, 도둑3인 전차 통과할때 쥬만지 보는줄; (물론 쥬만지는 훌륭한 영화입니다만) 최악입니다.  "
20171208,8,잔잔하고 감동적이었네요 오에스티 너무좋은듯  
20171207,10,무라카미 니지로 광팬인데 정말 기대되네요  
20171207,8,전개가 좀 아쉬웠다..  
20171206,7,"아름다운 감성적 인생론! 책이 아니라서 비현실적 상황을 주인공들이 너무 쉽게 믿어버리고 이야기를 풀어나가는 부분의 설득력은 조금 떨어지지만, 원작의 많은 이야기들을 영상의 장점을 살려 시각적이고 감성적으로 충분히 잘 엮고 풀어냈다. 희망차다.  "
20171206,10,일단 영화화했다는 데서 박수 쳐주고 싶다.  
20171206,10,정말 보고 후회하지 않은 영화였습니다. 내년 2월에 개봉하면 다시 보러가야겠습니다.  
20171205,5,씨네큐브에서 먼저 봤습니다.결국 삶은 자신이 만들어가야한다는 걸 다시 일깨워준 영화입니다.어린아이의 장난같은 상담부터 무거운 고민들까지사람들을 대하는 잡화점 할아버지의 따뜻한 마음이 인상적이었네요.  
20171205,9,야마다 사롱해 ㅠㅠ꼭보러갑니다 ㅠㅠ  
20171204,9,음악이 여운이 짙게 남는다. 배우의 표정과 연기가 너무 리얼해서 눈물이 날 뻔 했다. 화면 또한 아름다웠다.  
20171204,10,진짜 기대된다.. 원작 진짜 좋아하는데ㅜㅜ  
20171204,10,"나미야ㅠㅠ 이거 영화제에서 먼저 봤었는데, 보고 펑펑 울었습니다. 개봉하면 또 볼거예요  "
20171204,10,중간에 울컥.. 추운날씨에 마음 따뜻해지는 힐링시간이었슴다~~  
20171204,10,엄청 기대하고 있습니다. 최대한 빨리 개봉 되었으면 좋겠어요!ㅠㅠ  
20171204,10,가슴뭉클 감동적인 엔딩 너무 좋았습니다. 원작만큼이나 좋으네요~글구 노래 짱!  
20171204,4,엄~청 감동적이지는 않고 그냥 감동적인 정도. 주인공이 잘 생겼다.  
20171203,10,초등학생 아들 딸과 재밌게 봤습니다.  
20171203,10,"저는 시간 가는 줄 모르게 봤습니다. 배우들도 너무 좋았구요, 원작이 어떤지는 모르지만 이정도면 충분히 잘 만든 영화로 보여집니다.  "
20171202,10,원작을 읽고보면 더 좋을 영화!  
20171202,9,잘생긴주인공들 보는 재미가 솔솔합니다.  원작과 다소  다른점이 아 쉬워요. 주인공들의 갈등이 너무 적어요. 그래도 비교적 원작을 잘 살렸습니다.  
20171202,7,"지나치게 느린 템포가 계속되는데, 감독이 원했던 효과가 무엇일지 궁금하다 숨막히게 길다 배우가 눈물을 지어짤때까지 기다리는 기분이다. 하지만 확실히 원작이 가진 힘은 무시못한다  "
20171202,9,긴 실타래의 끝은 결국 내게서  
20171202,8,끝으로 갈 수록 저는 좀 전개가 느려서 지루한 감이 있었네요. 내용은 재미있었습니다.  
20171201,9,마음이 따뜻해지고 잔잔한 감동이 있는 영화이다  
20171201,9,잔잔한 감동 내 삶도 돌아보게 된 계기  
20171201,6,영화는 보통인듯해요...책을 재미있게 읽어서 그런지 영화는 뭔가 부족한 느낌??  
20171201,10,팬심으로 10점입니다 소설의 감동에는 못 미치지만 개인적으로 즐거웠습니다  
20171201,7,원작에서 기대했던 따뜻한 분위기가 있는 영화였어요  
20171201,9,오랜만에 행복한 감동을 주는 영화였습니다 130여분 전혀 지루하지 않게 잘 봤습니다  
20171201,10,인생영화를 찾은것 같아요. 책도 5번 읽았었는데 영화는 더 많이 다시 볼 것 같네요.  
20171201,10,아 진짜 애니로나왔으면 더좋았을듯..일본은 애니를 워낙잘만드니까 더 잘살리고 좋았을듯  
20171201,10,소설의 여운을 화면으로 과연 얼마나 느낄수 있을지. 기대하고 있습니다.  
20171201,10,삽화가 여러 개로 되어있는데 영화화하기 엄청 힘들었을듯(물론 공통적인 소재가 있지만)  
20171201,10,야마다 료스케나와서 10점 준다!료스케 진짜 귀염  
20171123,10,빨랑 보고싶다 히가시노 게이고님 정말 소설 잘쓰는듯^^  
20171122,9,가족의형태 아버지역할 배우 나오네요~책을재미잇게읽어서기대됩니다하지만또원작에못미칠까살짝걱정도되구요 ㅎ  
20171120,10,책은 진짜 스토리나 구성이 워낙 탄탄하고 히가시노 게이고 특유의 내용 짜임새들의 흡입력은 뭐 이루 말할것도 없다만.. 영화화? 글쎄.. 원작이 너무 넘사벽.  
20171117,10,기대되네요!어서 개봉 했으면 좋겠습니다.개봉일이 동계올림픽의 달이여서 의미있네요  
20171112,10,130분동안 모든 인물 스토리를 담을수 있다고? 불가능할거같은데 적어도 생선가게뮤지션이랑 길잃은강아지는 넣어줬음 좋겠네  
20171111,10,싱가폴에서 저번달 개봉해서 관람하고 왔는데 감동적이고 잔잔한 영상과 음악 연출이 좋았던 영화였습니다. 영화의 Reborn 이라는 주제곡은 계속 듣고 들어도 영화의 감동이 그대로 느껴집니다. 추천 할 만한 영화입니다.  
20171110,1,애니메이션으로 나오면 정말 좋을 것 같은데 아쉽네요....  
20171108,10,"와,.... 이걸 영화로 나온다고요??? 소설에서 진짜 감명깊게 봤던나야미가.... 영화에서 나온다니....ㅠㅠㅠ 진짜 잘 만들었으면 좋겟어요. 진심 눈물났거든요....ㅠㅠㅠ이거 땜에 히가시노 게이고 팬 됬었는데 ㅠㅠ  "
20171104,10,대만 직장인 입니다. 저번달에 개봉해서 봤는데 만족합니다.빠진 부분있지만 충분히 재현해 놨습니다.(극장에서 우는 사람도 있더군요)  
20171103,10,아ㅏ... 왜 한 살 더 먹고 이 영화를 봐야하는거죠?? ㅠㅠㅜ  
20171028,10,히가시노 게이고 작가님의 팬입니다. 영화 너무 기대되고 대박났으면 좋겠습니다.책으로도 많이 보셨으면 좋겠어요. 일본소설을 나미야 잡화점의 기적 으로 처음읽게 된건데 이것때문에 일본소설 아직도 재미있게 읽게  계기인것 같아요  
20171028,10,이거 책으로 정말 재밌게 읽었는데 영화가 어케 될지 궁금하네  
20171022,10,내가 진심 시간가는줄 모르고 읽은 소설. 완전 걸작인데그 길고긴 이야기를 영화로 잘 담아냈을지 기대됨  
20171014,10,부국제에서 보고 왔습니다!! 원작에 충실하면서도 원작과는 다른 재미를 느낄 수 있었습니다!! 뭉클하면서도 먹먹하면서도 기쁜 마음이 드는데도 코끝이 찡했습니다!  
20171014,10,부산국제 영화제에서 보고 왔습니다저도 못살릴것같아서 욕하려고 봤는데정말 펑펑울다 나왔습니다류이치 감독님이 제대로 살리셨더라구요  
20171014,5,소설원작영화들  생각하면 지금은이정도  
20171013,8,이야 이건 인물들의 이야기가 다 나와야 그 마지막 결말의 감동이 좍 오는데 그렇게 되면 분량 장난 아닐텐데 영화 한 3시간 될듯.. 기대반 의구심반 그래도 무조건 보러가야지 나미야 영화화 최초인데 잔잔하면서 신비롭고 따뜻한 그느낌을 살려줬으면 좋겠다  
20171005,10,원작을 그대로 살릴수 있을까.  
20171003,10,야마다 료스케  광팬인데  진짜  빨리 보고 싶다.... 달리는  장면  엄청  많이 있던데....  
20171002,9,어제 오사카가서 보고왔습니다 너무감동받았고 원작을 보진못했지만 아무것도 모르는 상태로 갔지만 큰감동을 받고왔습니다 마지막까지 감동이 전해져 영화끝까지 앉아서 영화ost까지 다 듣고 나와버렸습니다 한국에서는 개봉이 아직인데 재밌으니까 다들 걱정마세요ㅋㅋ  
20170930,10,일본이랑 비슷한 시기일줄알고 기대했는데 내년 개봉이라니ㅠㅠ잊을때쯤 나오겠어요~ 빨리보고싶어요 기대기대ㅋ  
20170928,10,연기 겁나 잘하는 야마다가 나와서 기대 됩니다  
20170920,10,애니메이션으로 나오는거 아닌가...?  
20170918,10,포스터 보고 애니메이션인줄 알았는데 아닌가보네 ㄷㄷ영화화 잘됐으면 좋겠다.  
20170913,10,그토레 탄탄하고 몰입 잘되고 좋았어요!!♥♥  
20170906,10,2장까지 읽었는데 2장 마지막에 진짜 눈물흘렀어요ㅠㅠ 인생영화 될 수 있도록 잘 만들어지길!  
20170906,10,기대됩니다. 제발 망치지만 말아주세요 ㅠㅠ 원작 그대로의 느낌이 다 실려있길.... 제발!! ㅠㅠㅠ  
20170903,9,BGM이 똥마려운거같다  
20170903,10,영화보고 책읽기!! 책이 진짜 몰입감있고 감동적이고 진짜 최고  
20170827,10,기대된다?책으로봤던것이영화로나오다니  
20170823,10,걱정반 기대반....잘살리면 히트치는거고 애매하기라도하면 망하는건 시간문제일듯...잘되기를 바랍니다  
20170819,10,ㅁ...ㅁ..ㅁ..ㅁㅊ 대박기대됨  
20170819,10,야마다가 나오다니!! 책도 재밌게 읽었는데 우아아ㅏ 기대된다 ㅠㅠ  
20170814,10,너의 이름처럼 명작이 될것입니다....  
20170731,10,카메오로 히가시노 선생님이 나왔으면 좋겠다.  
20170727,10,애니메이션으로 만들었으면 더 좋았을텐데  
20170726,10,책도 재밌게 읽었는데 야마다까지 나온다니?? 암살교실보고 진짜 마음에 든 배우.. 이건 워낙 원작책이 좋으니 영화도 기대해봅니다 제발 원작대로만 잘 살려내기를!!  
20170724,10,최고입니다!!!! 오마이갓  
20170723,10,화이팅 원작 그대로의 느낌을 잘 살려내길  
20170723,8,아... 애니인줄 알았어ㄷㄷㄷ그래도 원작이 너무 좋아서 기대된다!!  
20170723,5,"책이 명작이라 그런 기대감 때문에 영화로 만들어지면 잘 흥하진 않을듯,,, 애니로 나왔음 좋겠는데  "
20170722,5,책 못따라갈꺼야~책은 명작 이거든  
20170720,10,진짜 이건 대본이좋기때문에 쉽게 망하기 어려울거라 믿는다 정말로  
20170717,10,어디서 봣나 했더니 암살교실나온애네 얘 연기잘하던데  
20170717,10,이 작품을 영화화 한다면 이 세상의 그 어떤 만화보다 깊고 예쁘지 않을까  
20170716,10, 오.. 원래 뭐든 원작이 있는 경우에 시각화하면 원작팬들에겐 대부분 욕먹긴 마련인데.. 걱정도 되지만 기대도 된다ㅋ. 일단 개봉하면 한 번은 봐야지ㅋㅋ  
20170714,10,책에있는 내용을 어떻게 표현해서 그려낼지 너무 궁금하네요.원작이 훌륭한만큼 영화도 충분히 훌륭할꺼라 믿어 의심치 않아요.기다리는 시간이 설레네요 기대됩니다^^  
20170713,9,엄청 좋아하는 인생책 인데 영화화되다니 기대됩니다근데 포스터보고 애니인줄 알았어요 ! 애니아니어도 기대는 되지만 걱정도되네요원작의 느낌을 살릴수 있을런지아무튼 꼭 볼거에요  
20170713,10,이고이고 볼거야아~~~  
20170712,10,인생 소설을 드디어 영화로 볼수 있어서 영광입니다  
20170712,7,정말 재미있게 읽은 책인데 영화화 된다니 반갑네요. 한편으로 이 이야기를 어떻게 풀어갈지 염려도 되지만 그래도 기대합니다.  
20170710,10,히가시노 게이고 원작..키야..  
20170709,10,책으로 재미있게읽은 작품 중 하나이다 영화로 나온다고 하니 재미있게 나왔으면 좋을것같다  
20170630,10,명작을 잘살릴수있을까...정말 재밌게읽은 소설인데 야마다가나온다니 기대합니다!  
20170623,8,표지만보면 애니메이션인줄... 애니로 나오지 ..  
20170616,10,소설 나미야 잡화점의 기적 되게 좋아했는데 야마다도 나온다니까 기대되네요 국내에서도 얼른 개봉했으면 좋겠어요ㅜㅜ  
20170614,10,"잠깐, 두 사람?  그럼 히루미만 나오는건가..이 소설은 인물간 연결관계가 백미인데  "
20170610,9,책도 잘 안 읽는 절 처음으로 마음이 설레게 해준 소설이네요 450페이지 가까이의 매우 긴 장편소설인데 영화로 만들기엔 힘들 수 있을거 같은데.. 하지만 영화화 되면 정말 명작이 될거같네요 기대해볼게요 !!  
20170608,5,이걸 영화화한다고? 에반디  
20170606,1,"일본은 영화화 안하면 죽는 병이라도 걸려있는건가. 애니메이션도 아니고 실사영화로 제작한다고? 일본은 대체 실사화 안하고서는 안되는 건가? 나미야 잡화점의 기적은 소설 자체로 의미있는거다, 영화화라니 끔찍하다..  "
20170529,10,과연 재현해낼지...  
20170525,10,야....이거 영화화하기 힘들텐데....  
20170519,8,"평소에도책안읽는 내가진짜 재밌게본소설인데 너무기대도돼지만 한편으론 걱정도됀다, 스토리가엄청긴데 영화에다 담을수있을련지..  "
20170512,10,히가시노 게이고 책이 영화로 나온다니!! 특히 나미야 잡화점의 기적은 진짜 여운이 깊었는데...잘 살리면 진짜 대박 날듯  
20170510,10,히가시노 게이고 광팬인데 너무 기대 돼요 원작 그대로의 느낌으을 제대로 살렸으면 하는 바람입니다  
20170507,10,원작을 읽었으면 된거다. 믿는다 ㅋ  
20170504,1,이런명작을 영화에서 살릴수 있을지..? 경각심을가지고 봅시다  
20170409,10,야마다가 여기도 나오다니  
