0,1,2
20170425,10,아ㅠㅠ미안해요 댓글 읽다가 공감 누른다는걸 비공감 눌렀어요ㅠ 상처받지말아요ㅠ  
20170424,10,"우리 시대에 필요한 메시지, 조선인과 여성을 위해 평생을 헌신했던 상처많은 위인의 소탈했던 삶!  "
20170422,10,부산에서 찾기 어려워서 겨우 찾아서 보았습니다 많은 생각을 하게한 영화였고 제 신앙의 삶을 돌아보는 시간이었습니다 낮아지고 가난한 사람들을 돌아보고 자신의 외로움 어릴때 상처를 극복하고 그것을 통해 배운 공감으로 많은 사람을 섬기는 선교사님  
20170422,10,정말 이거 완소 영화!!^ㅡ^  
20170421,1,이거 극장용 서프라이즈  인가요???  
20170421,10,너무 기대됩니다 빨리 보고싶네요  
20170419,10,영화제목만 보고 서서평이 무슨 뜻일까 했다. 막상 영화를 보고나니 그 이름이 주는 의미가 참 깊게 들어온다. 선교사님의 삶은 상상만으로도 정신없고 복잡하고 막막했을텐데 상황에 휩쓸리지 않고 묵묵히 소명으로 걸어가신 그분의 삶이 너무 고귀하게 느껴진다.  
20170419,10,"무시받고 천대받는 여자, 서양 요괴, 목사가 아닌 간호사 신분의 평신도, 언어-음식-문화 모든 것이 거부감 느껴지셨을텐데 원주민보다 더 원주민으로 사시며 가난하고 소외된 자의 어머니가 되어주신 그런 여성입니다! 정말 존경합니다! 영화 정말 감동입니다  "
20170418,10,빨리 나오면 더 인기많을 듯  
20170418,10,"자신의 삶, 생명까지 이방인에게 다 내어주신 분. 감사합니다. 고맙습니다.  "
20170417,10,그 당시 우리나라의 상황을 알수있었고 또한 서서평 선교사님께서 자기를 낮추시고 하나님을 높이는 모습이 감동 깊었다. 낯선 땅에서 선교를 한다는것이 정말 어려운 일인데 대단하심을 느끼고 하나님을 다시한번 느낄 수 있는 영화였다.  
20170417,10,"저는 너무 많은 것을 가졌습니다. 집집마다 찾아다니며 복음을 전하다 생의 끝에서 병마와 싸우던 그녀가 ""건강한 게 부럽다""며 말하던 서서평 선교사님의 눈물을 잊지 못할것 같습니다. 자신의 이름을 뒤로하고 예수의 흔적만 남기고 떠난 그녀 많이사랑해주세요  "
20170417,10,"마음과 몸과 뜻을 다해 하나님 나라를 이루다 가신 분, 그 헌신이 이 땅을 만들었습니다. 그렇게 살고싶습니다성공이 아니라 섬김이다  "
20170417,10,편모밑에서 그것도 세번이나 엄마에게 버림 받은 한 독일계외국여인이 한국이란 궁핍하고 가난한 나라에와 예수님과 같이 자기를 희생하며 어려운 여인들과 아이들을 돌봄이 무척 감명 깊었습니다. 검소한 그녀의 삶에 많은걸 배워 갑니다  
20170417,10,외국인으로서 희생적인 삶을 사신 서서평선교사님의 삶을 닮고싶습니다.  
20170417,10,아무 연고도 없는 한국이라는 땅에 자신이 신에게 받은 사랑을  전하고 목숨을 주기까지 사랑한 선교사의 삶이 과장되지 읺는 담담함으로 그려져서 더 감동이 있었던것 같습니다. 정말 감사하다는 마음이 드네요...  
20170417,9,참 감동이 있는 영화였습니다^^  
20170417,9,"성공이 아닌 섬김이다크리스챤이라 하는 우리네들이 주일 말씀과 또 각자의 삶의 예배 속에서 매일 같이 다짐하는  그것 일 진데, 얼마나 그러한 삶을 살고 있으며 살아 가고 있는지. 다시금 한국 땅의 크리스챤들에게 질문을 던지는 영화 였습니다 감사합니다  "
20170417,10,예수님의 흔적을 온 몸과 마음으로 보여준 진정한 섬김의 선교사 서서평~ 크리스챤이라면 꼭 봐야할 영화^^~♡  
20170417,10,"성공이 아니라, 섬김이다.정말 인상깊고, 제 신앙을 돌아보게한 귀한영화였습니다. 이 시대 모든 기독교인들에게 적극 추천합니다.  "
20170417,10,"서서평 선교사의 원대로...제 2, 3의 서서평의 길을 가도록 결단하게 이끄는 다큐입니다.  "
20170417,10,예수님의 삶을 보여준 서서평 선교사님을 영화로 뵙게 되어서 정말 감사했습니다. 저또한 서서평 선교사님처럼 살아가길 소망합니다.  
20170417,10,알지못했던~인물을알게되어서~좋았습니다~^^잘봤습니다  
20170417,10,최고! 감동입니다~ 강추^^*  
20170417,10,성공이 아니라 섬김♡너희는 세상의 빛이라♡  
20170417,10,서서평 숨고한 삶에 감사드립니다  
20170417,10,오늘 서서평을보고 결심했다오직 복음을 위해 살기로  
20170417,10,낮은자세로 치열하게 사신분의 이야기  
20170417,10,어둠에 사회에 빛이된 하나님사랑의 서서평  
20170417,10,감동적인영화에요 추천합니다  
20170417,10,너무 좋은 영화이고 감동받았어요 많은 사람들이 봤으면 좋겠습니다  
20170417,10,무엇을 위해 살아야 하는지. . .어떻게 살아야 하는지. . .사명을 이루며 사는 삶에 대한 질문과 고민을  하게 하는 영화입니다.  
20170417,8,조선인보다 조선인을 사랑한 아름다운 선교사네요.천국에서 봐요.  
20170417,10,서서평씨의 헌신에 대한 한 선교사의 이야기에 슬픔이 감겨 감동으로 이루어지네요  
20170417,10,넘 존경합니다. ♡♡♡넘 잘 관람하였습니다 ^^  
20170417,10,서서평 잘 알고 갑니다  부활절 주간에 잘보고 오께요  
20170417,10,서서평 시사회 보러왔어요  
20170417,10,하나님은 정의로우시며 사랑입니다.  
20170411,10,영화관에서 보고 싶습니다.  
20170410,10,주님의 사랑을 몸소  전한  서서평선교사의 발자취를 살펴볼수 있는 기회가 되어 기대감이 큽니다.  
20170410,10,인간이란 남을위해사는것이 바람직한 인생이란걸알게해준다  
20170407,10,욕심많은 세상에 하나의 커다란 메세지이지 않을까 생각합니다.  기대됩니다.  
20170403,10,"한창 아름다울 나이, 돌아가실 때 동전 몇개와 낡은 옷 몇개가 전부였다는 것을 듣고 가슴이 뭉클합니다. 낯선 이 땅에 처녀의 몸으로 오셔서 낮고 낮은 자세로 우리 민족을 섬겨 주신 크신 사랑에 감사할 따릅입니다. 귀한 영화를 만들어 주셔서 감사합니다.  "
20170402,10,"아직 보진 안았지만,왠지 서프라이즈 보는것같은 기분이 들거같은건 뭐지?;;;  "
20170331,9,"욕심을 채우기 위해 거짓과 탐욕, 위선으로 병든 한국땅에  무엇인 진정 사람이 사람되게 하는지 알게 하고 생각하게 하는 영화 다큐 서서평 기대됩니다. 세상 거짓의 공허, 망상의 MSG없는 영화!! 기대합니다.  "
20170331,9,가슴에 시리도록 오래 남는 영화~우리들의  삶이 흔들리고 있다면 꼭 보기를강추!!합니다.  
20170327,10,참 사랑의 본을 보이신 분이네요... 존경합니다.. 감사합니다..  
20170327,10,"하나님게서 선교사님들을 한국에 보내주셔서  한국이 살아나고 가능성이 생기고 지금의 발전을 이룬 거 같아요 . 언더우드, 대천덕, 맥아더 장군 님 등 모든  파란눈의 선교사님 감사합니다  "
20170325,10,서서평의 삶을 닮은 이 영화를 통해 예수그리스도의 도를 실천하는 사람들이 많아지길~*할렐루야  
20170322,10,"어떤 분의 리뷰를 보고 나서 한참을 울었다. 시사회를 다녀와서 느꼈던 감동과는 달리 전혀 변화되지 않은 내 모습이 부끄러워졌기 때문이다.. 서서평 선교사. 나로 복음을 전해듣고, 오늘을 살아가게 한 믿음의 시작. 삶의 여러 질문에 대한 답이 되어질 듯  "
20170321,10,이 시대에 정말 필요한 메시지가 담긴 영화네요!! 끝까지 우리를 사랑하시는 예수님처럼 정말 생애 마지막까지 섬김을 실천하신 서서평 선교사님의 삶이 너무나 감동입니다!!  영화를 통해서 많은 분들이 알게되셨으면 좋겠어요!!  
20170320,10,기대하고 있습니다....  
20170320,10,교회 식구들하고 다같이 가서 보려구요. 개봉날만 손꼽아 기다리고 있습니다. 책을 통해 읽었던 감동과는 또 다르겠죠?무척 기대됩니다  
20170320,10,완전기대된다.  보고싶다  
20170319,10,실화 기반의 다큐 영화 기대합니다.  
20170319,10,"외국인이 조선에 와서 아무도 돌보지 않는 고아와 노인과 병든자를 돌보는 삶을 보면서 다시 한번 나의 삶의 도전을 받습니다. 하나님께서 주신 마지막 육신까지도 다 남김없이 내어줌으로 예수님의 삶과 같은 삶을 보여줘, 나도 내 육신을 기증하는 결심했어요.  "
20170318,8,"주어진 삶, 상처, 고통에 대해 묻는 영화입니다. 서서평이란 한 사람이 아닌 그녀와 함께 한 그 빛이 영화내내 느껴집니다.  "
20170317,10,정말 기대되는 영화입니다.  
20170317,10,복음을  믿는 사람으로 참 많은 도전이 되는 영화...이렇게 살길 원하고 함께하는 사람이 많았으면 좋겠다고 생각하게 되는 영화  
20170317,10,꼭 보고싶네요.  많이 기대되고 이런 영화 만들어주신 분들께감사말씀 드립니다.  
20170316,10,성공이 아니고 섬김이다!  현 우리나라 상황에 좋은 메시지가 될 것 같습니다.  
20170316,10, 예수님이 인류를 위해 자신을 희생하셨듯 조선의 고아들과 천대받던 여자들을 위해 자신을 희생한 서서평 선교사. 조선을 사랑해 조선을 위해 자신의 내놓은 한 여인의 감동적인 삶을 만나 볼 수 있습니다.  
20170316,10,선한영향력을 끼치는 이런 아름다운 영화는~!! 아이들과 꼭 봐야죠^^ 좋은 영화 만들어주셔서 진심으로 감사드립니다.  
20170316,10,기대 됩니다! 선교사님을 주제로 한 영화를 극장에서 보게 된다는 것도 설레는 일인 갓 같아요!  
20170316,10,100여년전 이 땅에 와서  모든 것을 주고 떠나신  서서평...오늘 이땅 대한민국을 울리는 감동과 교훈입니다.우리 자녀들 데리고 모두가 봐야할 영화입니다...  
20170316,10,대박~ 서서평 선교사님 이야기가 영화로 만들어지는군요 기대를 안할 수가 없습니다!!!  
20170316,10,  가족.친구.지인들과꼭보세요~^^  
20170316,10,좋은 영화 감사합니닷♡  
20170316,10,감사하고 사랑합니다!  
20170315,10,대한민국이 어지러운 이시기에 대한민국 사람들보다 더 대한민국을 사랑한 서서평. 아주 좋은 영화라는 얘기를 많이 들어서 기대가 많이 됩니다.  
20170315,8,여타 기독교 영화와는 조금 다른 느낌이다 드라마신이 설명적인 역활만 한것이 조금 아쉽지만감동을 강요하는지 않는다기독교인의 고난과 헌신에 대해 깊이 생각해볼 영화이다  
20170315,10,성공이 아니라 섬김이다!!  한 사람이 개인의 삶의  모든것을 내어주고 섬길 수 있다니 ....감동이 없을수가 없습니다.  영화관에서 빨리 보고싶고 기대가 되는 영화입니다.  
20170315,10,기대되는 영화에요. 이 시대에 필요한 희생과 사랑에 대해 자극시켜주는 영화가 되었으면 좋겠어요  
20170315,10,"주변을 돌아볼 여유가 없이 바쁘게 사는게 대부분인데, 누군가는 타인을 위해 살아가는 거 같네요. 저도 서프라이즈 통해 봤는데 가슴이 따뜻해지면서도 아팠어요. 영화 개봉하면 꼭 보고 싶네요.  "
20170315,10,너무 감동적이었습니다.  이런 따뜻한 영화가 널리 널리 알려져야 한다고 굳게 믿습니다.  
20170315,10,존경받아 마땅한 분들의 삶을 재조명 해주는 영화라 참 의미가 있는것 같습니다. 이런 시국에 우리는 어떤 삶을 살아야 하는지 되돌아 볼 수 있는 시간이 되었으면 좋겠습니다.  
20170315,9,세대를 넘어 사랑과 섬김이 무엇인지 알게 해주는 영화인것 같네요..기대됩니다.  
20170315,10,요즘 같은 시대에 정말 꼭 필요한 메시지가 아닐까 싶습니다. 기대됩니다!!!  
20170315,10,기다리던 영화...너무 보고 싶어요  
20170315,10,섬김은 끝까지 하는것 그리고 내 것이 없는 것인것 같습니다.성공을 목적으로 살지 않겠습니다  
20170315,10,사랑이 무엇인지를 보여주셨던 서서평. 이분을 기리는 영화가 나온다는 것이 정말 기대가 됩니다.~!!  
20170315,10,언더우드 같은 유명하신 분 말고 이런 분 얘기를 듣고 싶었어요. 꼭 보고 싶어요!  
20170315,10,사진이랑 배우랑 엄청 닮았네요 ㄷㄷ화면도 예쁜거같고 기대가됩니당  
20170315,10,진정한 선교적 삶을 보여주는 영화...잔잔하지만 큰 울림을 주는 영화!!~  
20170315,8,너무 많이 갖고 살면서 부족하다 느꼈던 그리고  앎을 실천하지  못했던...많은 부분에  부끄러움을 알게 해주는 것 같습니다.  
20170315,10,너무기대되는 작품중 하나입니다.  한국역사에 많은 선교사님들이 계셨는데 알려지지 않았던 서서평 선교사님의  대한 영화가 나와 너무 기대되고 이번을 시작으로 많은 작품이 나오길 기대 합니다.  
20170315,10,모든 것을 내어주며 연약한 자들을 사랑한 서서평 선교사님의 삶에 깊은 감동과 도전을 받습니다. 빨리 극장에서 보고싶어요!!  
20170315,9,한 사람의 인생이 이렇게 큰 파장을 줄 수 있다니... 한구의 걸인들을 위해 상처받은 사람들을 위해 외국의 한 여인이  이렇게 헌신적인 사랑을 베푼 사실이 너무 놀랍습니다. 눈물이 나네요 ㅠㅠ  
20170315,10,"기다리던 영화가 드디어 개봉하게 되네요.조선인처럼, 아니 조선인으로 살아가며 예수님의 발자취를 따라간 믿음의 선진, 서서평이야말로  이 시대를 살아가는 기독인들에게 큰 감동과 울림을 주는 분입니다.  "
20170315,10,볼만한 기독교 영화가 나왔네요!! 기대기대 !  
20170315,10,예고편도 궁금하고 하정우씨 내레이션도 기대되네요..! 서프라이즈에서 봤는데 자기 가진 식비를 줄여서 남을 도운 부분들이 너무 가슴찡하고 영양실조로 돌아가셨다는 게 넘 가슴 아프네요ㅠㅠ이런 분의 영화 만드는 거 100% 동의합니다!!!  
20170315,9,기대됩니다 하정우 내레이션이라니 더더욱이요  
20170315,10,"크리스천 뿐만 아니라 믿지 않는 가족과  그리고 친구, 동료들과 의미 있는 시간을 보내고 싶다면 꼭 추천합니다아이들에게도 교훈이 있는 영화인 것 같습니다  "
20170315,10,기대됩니다...!!  
20170315,10,기대되는 영화에요!! 많은 선교사들 중 잘 드러나지 않았던 서서평 선교사의 삶이 궁금합니다!! 꼭 볼게요>_<  
20170315,10,4월에 가장 기대되는 영화입니다~서서평 선교사님 덕분에 여성들의 인권도 아픈이들의 복지도 없던 시대에 많은 이들이 인간다운 삶을 살게 되고 예수님을 알게되지 않았나 싶습니다. 자녀들과 함께 봐도 정말 좋을것같습니다. 특히 하정우씨 나레이션 기대됩니다  
20170315,10,이런분이 계셨다는것에 감사합니다66  
20170315,10,물질이  부족하더라도 그 안에서 기쁨과 감사함을 느껴야 할 요즘이란 생각이 드네요. 영화 기대됩니다.  
20170315,10,천천히 평온하게....이름만큼 잔잔한 돌이킴을 주는 영화입니다소리없이 흐르는 눈물...  
20170315,10,종교를 넘어 인간을 대하는 자세는 본받아야 할 것 같다.  
20170315,7,지금 시국에 보면 좋을 영화네요  
20170315,10,하정우가 나레이션이라니..완전 기대되네요.울지마 톤즈의 한국버전인건가요..어떤 분인지 궁금하네요.  
20170315,10,성공이 아니라 섬김이다.. 정말 좋은 말씀이네요  
20170315,10,서프라이즈에서  봤는데 넘나 기대됨! 하정우씨 목소리로  들으면 감동 찡 올듯  
20170315,10,좋은영화예요~~ 아이들이랑 같이봤지요  
20170315,10,올봄 꼭 봐야할 영화. 개봉관이 많았으면....  
20170315,10,무척 감동적인 영화였어요.  
20170315,10,눈물이 납니다 우리 모두 주변의 섬김이 필요한 사람들에게 눈을 감지.말고 눈을 뜨고 살게되길  
20170315,10,"섬김의 리더를 상실한 요즘,한 개인이 보여줬던 헌신과 사랑이 더 사무치게 다가옵니다.서서평 선교사님의 삶을 통해,잊고 있던 사랑과 감동이 회복되는 것 같네요.  "
20170315,10,이런 분들이 계셔서 우리나라가 그나마 좋아졌다고 생각합니다.  
20170315,10,온누리 교회에서 미리 서서평에 대해 듣고 보면서 개봉을 기다리는 1인입니다.성공이 주가 되는 요즘 세상에서 성공보다 섬김을 외치며실제로 그런 삶을 산 서서평 선교사의 이야기는 마음에 울림을 줍니다.얼른 개봉되어 부모님을 모시고 가서 보고싶네요  
20170315,9,보고싶어요~ 물질이부족하더라도고아와 과부를위해 헌신했던모습기억하게될거같아요~ 기대합니다  
20170315,10,예수님의 사랑을 몸으로 보여주신 선교사님의 삶을 영화로 극장에서 만나볼 수 있다니 감사하고 또 감사합니다.  
20170315,9,일요일에 서프라이즈에 나오던데.. 영화 개봉도 준비중이군요...  과거 여성 선교사의 헌신과 감사를 느낄수 있는 좋은 영화네요..^^기대됩니다~  
20170315,10,진짜 감동은 잔잔한데서 옵니다.  서서평 선교사는 그런 분입니다.  
20170315,10,한국을 사랑한 한 여자의 일생! 어떻게 그런 마음을 갖게 되었을까.. 너무 기대됩니다! 게다가 하정우님의 내레이션이라니 >_< !!  
20170315,10,삶이 메시지인 분.. 감동+감격 ㅠㅠ 너무나 감사드리며.. 좋은 영상 많은 분들이 보실 수 있으면 좋겠어요!  
20170315,10,"섬김의 리더를 상실한 이시대, 이 영화를 통해 참된 섬김의 의미를 되새길 수 있기를 바랍니다. 기대하고 있습니다.  "
20170315,8,어떤 내용인지 궁금합니다.. 꼭 보러 갈게요..  
20170315,10,서서평 선생님의 인생을 본받고 싶습니다  
20170315,10,영화가 정말 기대가 되네요~^^  
20170315,10,이분은 진짜입니다. 기대합니다  
20170315,10,오오 안그래도 기대하고 있는 영화입니다. 개봉하면 꼭 보러 갈거예요. 요즘 기독교에 대한 시선이 곱지만은 않은데 예수님의 모습을 닮은 선교사님의 모습 통해 참 기독교의 의미를 생각해보고 싶습니다.  
20170315,10,"성공을 추구하다 어지러워진 현실속에서, 성공이 아닌 섬김을 말하는  서서평 선교사를 통해서 삶을 다시 돌아보는 계기가 되길 기대합니다..!  "
20170315,9,하정우가  내레이션을 하다니... 대박이네요~~  
20170315,10,기대만땅입니다~조선사람도 힘든일을 조선사람을 위해 외국인이...그 자체로도 감동입니다~서서평에 진심을 어떻게 그려냈을지 정말 기대됩니다^^  
20170315,10,.진짜 기대대는 영화예요~~^^  엄청 기다리고 있었습니다~  
20170315,10,정말 기대되는 영화입니당 :)  
20170315,10,하정우 목소리 대박!!! 그리고 아역 배우 춤출 때 마음 짠하면서도 너무 아름다운 장면이 가슴에 남네요.... 그리고 성공이 아니라 섬김 문구가 넘 좋아요. 대선 때 이런 humble heart랑 섬기는 마음 가진이 뽑혔으면...  
20170315,8,성공이 아니라 섬김이다 라는 서서평 선교사님의 말씀 정말 마음에 와닿았습니다.책으로만 봤었는데 다큐로 제작한다고 하니 반갑습니다.너무 팍팍해진 요즘  마데카솔같은 영화가 되길!  
20170315,10,예고편만 봐도 하나님의 은혜와 사랑이 느껴집니다. 울지마 톤즈 이후 최고의 영화 기대하고 있습니다.  
20170315,10,크리스찬들의 삶에 큰 도전이 될 것 같습니다. 기다려집니다 :)  
20170315,9,서서평 선교사님의 삶이 영화로 나온다니 기대가 됩니다~이 시대에 가운데 진정한 그리스도인의 모습이 다시금  기억 되길 바랍니다~  
20170315,10,영화 너무 기대됩니다!! 개봉날만  기다리고 있습니다ㅠㅠㅠ  
20170315,10,이런 분이 있었다는게 놀랍네요. . 우리나라도 아니고 독일에서 태어나신 분이 이런 사랑을 전할수있다는게. .마음도 퍽퍽해진 요즘 이런 삶을 보면서 위로받고 싶어요~~  
20170315,10,저번주 교회에서 목사님께서 서서평 선교사님을 소개해주셔서 너무 감동 있었는데 다큐 영화로 개봉되네요^^기대되고 감사하네요~~대박 나시길~~♡♡  
20170315,9,진짜 궁금했던 인물이었는데.. 픽션이 아닌 다큐영화라고 하니 더 기대가 되네요. 지금 한국사회에 필요한 메시지를 기대해 봅니다  
20170315,10,영화 너무 기대됩니다요~~ ^^  
20170315,10,여성선교사님들을 주제로 한 서서평이 영화로 나온다고 해서 너무 기대가 됩니다! 빨리 보고싶어요  
20170315,10,많은 것을 가지려고 하는 이때에 자신의 모든 것을 내어준 서서평 선교사님. 그분의 삶을  다큐멘터리로 그리고영화로 제작한다는 걸 알았는데 이렇게 만날 수 있게 되니 좋네요. 꼭 보고 싶습니다. 성공이 아니라 섬김이다...  
20170315,10,영화를 통해 다시한번 선교사님의 사랑과 헌신을 볼 수 있다니 정말정말 기대됩니다~~~~  
20170315,10,이런분들이 믿음의 씨앗을 뿌려 지금 우리가 자유로이 신앙생활할수 있는거겠죠~영화로 나온다고 하니 기대가 됩니다~!^^  
20170315,10,선교사들의 발자취를 이렇게 영화로 만들어져서 볼수 있다니 너무 기대되구요~ 저런 헌신이 있었기에 그 사랑이 스며들며 전해지지 않았을까요 영화를 보고 그 감동을 느껴보고 싶습니다^^ 기대기대  
20170315,8,너무 너무 기대되네요~~~  
20170315,10,"이정미 재판관님의 퇴임사 신앙고백이 너무나 감동이었는데, 이 시대 서서평같은 분이더군요. 하정우 배우의 탁월한 선택을 믿고 꼭 볼께요. 화이팅!!!  "
20170315,10,진정한 리더가 부재한 이 시대에 꼭 필요한 분이란 생각이 듭니다. 이 땅에 이런 귀한 분이 있었다는 걸 알게해주셔서 너무나 감사합니다. 개봉하면 아이들과 꼭 보고싶어요.  
20170314,10,좋은영화죠... 성공이 아니라 섬김이다. 그것이 인생의 참된 의미인거같습니다.  
20170312,10,너무 기대가 됩니다.성공이 아닌 섬김!소비되어 없어지는 영화가 아니라기억에 남는 영화가 필요한 때인데빨리 개봉되면 좋겠습니다.  
20170312,10,진짜 보고싶어요 서프라이즈에서 봤는데 서서평이라는 분은 미국 여자였는데 조선에 선교활동하러 와서 버려진 아이들 거둬서 키우고 사람들이 병 옮을까 기피하던 문둥병 걸린사람들도 간호해주고 많은 일들을 하셨어요 영양실조로 돌아가셨어요 식비 아껴서 나눠주다ㅠ  
