0,1,2
20171128,9,소재가 신선함.그런데 뒷심이  아주약간 부족한듯  
20171128,5,용두사미..아귀는 맞는데 놀랍지 않다.  
20171128,10,"김무열, 강하늘 두 배우의 형제케미와 연기력 대결은 정말 멋있습니다. 꼭 봤으면 좋겠어요! 거장 장항준 감독님의 컴백(?)작 너무 좋네요 ㅎㅎ  "
20171128,10,"짜임새가 아주 탄탄하고 스릴, 여운이 모두 남는 영화였습니다. 강추합니다!  "
20171128,7,뜻밖의 호러같은 장면도 있는데 재미있게 잘 봤어요! 두 배우 연기가 참 좋아요  
20171128,10,지금까지 본 스릴러장르 영화중에 최고에요bbbb  
20171128,9,생각지 못한 반전에 깜놀! 극단의 캐릭터들의 향연! 재밌다!!  
20171128,10,반전에 반전 !!!  스릴감 최고입니다  
20171128,8,심장이 마구 떨리네요.좋아요~~  
20171128,10,몰입도 대박! 배우님들 연기는 물론이고 처음부터 끝까지 긴장감을 놓을수없었습니다 재관람 의사 200%  
20171128,10,두번보고 세번봐야하는 영화 기억의밤 최곱니다  
20171128,9,처음에 깜짝놀라는부분이 있었지만 스토리가 탄탄해서 끝까지 재미있게 봤습니다!!ㅎㅎ  
20171128,10,짜임새있고 지금까지 본 스릴러중에서 최고입니다  
20171128,10,지루할 틈이 없지요어짜피 보게 될거 스포 당하기 전에 보세요  
20171128,10,영화 완전 쫀쫀하고 재밌습니다! 미친 연출력과 미친 연기력의 만남!  
20171128,9,드라마적 전개로 끝까지 봐야 하는 영화!!  
20171128,7,끝까지집중해서볼것!!!  
20171128,9,넘 무섭고 재밌고 슬펐어요~  
20171128,10,강하늘씨의 연기 잘봤습니다!!  
20171128,10,두배우 모두 너무 역할과 잘어울려요  
20171128,10,기대됩니다 다시 보겠습니다  
20171128,10,진짜 강추합니다~~~  
20171128,10,김무열 강하늘 연기 최고  
20171128,8,후반이 아쉽지만 그래도 재밌음  
20171128,10,너무 재밌게봤습니다. 대박나세요~^^  
20171128,9,초중반의 기이한 분위기은 일품이었다!  
20171128,10,기대하셔도 좋아요~~~~  
20171128,10,기대됬던 배우들 연기도 짱이네요...! 감독님 오랜만에 나온 영화 대박이에요~^^  
20171128,9,역시 각본이 장항준 ㅎㅎㅎ  
20171128,9,장항준 감독이 스릴러도 잘 만드는 줄 몰랐음 김무열과 강하늘의 연기도 좋고 재미있게 봤네요  
20171128,10,10점 처음이네요 대박나세요  
20171128,9,시대의 아픔을 두사람을 통해 소환하여 위로한다.  스릴러의 외피는 양념  
20171128,10,기대를 뛰어넘는 작품이네요  
20171128,10,완전 재밌고 배우의 연기도 멋지고 스토리도 짱이내요  
20171128,10,"생각보다,  기대이상의 작품이었다  "
20171128,10,세가지의 스릴러에서 진행되는것 재밌음  
20171128,8,짱짱 너무재미잇게잘봣어요  
20171128,10,너무 재밌게 봤어요!!! 완전 최고!  
20171128,10,반전이 잇는 영화 연기력이 돋보인 영화  
20171128,10,탄탄한 스토리로 돌아왔다심장이 쫄깃쫄깃 반전매력 넘쳐요  
20171128,10,오랜만에 긴장감만땅!! 추천!!  
20171128,9,2017년 마지막 스릴러로 기억될밤  
20171128,9,기억해야할 스릴러 영화  
20171128,8,"두 배우의 연기력과 짜임새 있는 각본을 위한 노력이 돋보이는 작품. 초반에는 무엇을 얘기하고 싶은건가 많은 의문을 주고, 뒤 이어서 나오는 해석에 많은 의문을 주지만, 가뭄 같은 한국 스릴러 가운데에서는 좋은 작품이었다.  "
20171128,8,탄탄한 구성 몰입감이 큽니다  
20171128,10,시사회 재밌게 잘봤습니다.전혀 예상치못한 결말이었네요.  
20171128,10,김무열 배우님!! 강하늘 배우님!! 수고하셨습니다!! 믿고 보는 배우님들!! 너무너무 기대가 됩니다!!  
20171128,10,장항준 좋아하는 사람이라 역시 좋아하는 이유가 있습니다. 평범하지 않은 스토리 좋았습니다  
20171128,10,"연기, 소재 그리고 반전 ~~~~정말 잘 만든 영화강추!!  "
20171128,10,지금보고 나왔어요.. 초반부터 눈을  땔 수없고 시간이 어떻게 흐르는지 모르게 몰입해서 봤네요.. 결말이 약간 아쉽지만 재밌게 잘 봤습니다..!!  
20171128,10,박평식 평론좀 못쓰게하면 안되나요? 뭔말인지도 모르겠고 개떡같아요.  
20171128,10,강하늘 김무열 배우의 최고의 연기가 탄생했다는 소문이~ 완전 보고파요!!  
20171128,9,"시사회 봤습니다. 쫄깃쫄깃하게 잘봤습니다. 그런데 스포하면 망할수도 있을것같습니다. 감독이 부탁한것처럼 스포하지말고, 영화관서 제대로 즐기면 좋을것같네요!!  "
20171128,1,와 쩐다도 아니고 재밌다도 아니고. 그냥..  
20171128,4,시사회로 봤는데.... 너무 정신없고 자극적이기만하다...  
20171128,9,개들의 전쟁에서 김무열 깡패한테 턱 맞는연기보고 팬됨  
20171128,10,개기대중 내가좋아하는 배우들 흥해랏  
20171128,6,시사회 보고왔습니다. 영화가 넘나 말이 많아서...중반까지는 숨막혔는데 뒤로 갈수록 웃음이...기대없이 보면 킬링타임용으로는 괜찮을거 같아요. 나름 배우들이 하드캐리 한듯 싶네요  
20171128,10,시사회!너무 재미 있어요.장항준 감독 짱!  
20171128,10,"시사회로 선관람했습니다. 초반에 갑툭튀와 극 분위기 때문에 감독님 한대 치고 싶었지만, 결말보고 박수치고 나왔습니다! 큰 반전과 작은 반전들까지. 한번 더 관람하면서 복선들을 찾아보고 싶다는 생각이 드네요.찾아보고 싶다는 생각이 둘더 군요.  "
20171128,10,시사회 보고 왔습니다. 넘 잼께 봤네요~손에 땀을 쥐게 하는 긴장감에 반전매력까지 굿입니다  
20171128,8,보는 내내 심장이 쫀득쫀득.... 꽤 볼만했음.  
20171128,8,주연배우님들 연기덕분에 영화를 감정이입해서 보게 되서 더 심장이 휘뚜루마뚜루 했어요후반부까지 반전에 반전을 거듭하며 잘 이끌어가는데 결말이 조금 아쉬운 감이 있었지만 감독님 말씀처럼 롤러코스터 타는기분으로 보는 느낌이였습니다!  
20171127,10,기억의밤 진짜 대박 강추bb 범죄도시도 진짜 꿀잼이였는데 기억의밤이 더 꿀잼이였음! 시간가는 줄 모르고 초집중해서 막 홀린듯이 보고나옴 스트레스 다 풀림bbb 진심 올 최고의 영화bb 레알 강추 꼭 보세요  
20171127,10,감독님도 배우진도 너무 기대됩니다! 얼른 보고 싶어요^^  
20171127,9,이렇게 힘들게 하기 있기~없기? 긴장도 정도껏 해야지 보는 내내 심장이 아니 온몸이 쪼그라들었잖여~ ㅎㅎ 후반부가 너무 친절해서 불편했다는 평이 있던데... 친절하게 설명하지 않으면 끝까지 절대 알 수 없는 영화... 짱!!!  
20171127,10,진짜 배우들 연기대박 반전최고 여운이 많이남는영화  시사회당첨된게 진짜행운이였던  올해본 영화중 두번째  최고영화인듯김무열  연기대박 완전멋있었던♡  
20171127,10,한국영화도 이렇게 만들수 있구나 ..대박 !!! 이건뭐.. 몰입도 짱  
20171127,10,평론가들이 점수를 저따위로 줬을까!!  
20171127,10,무서워 ㅋㅋ  겁나 재미있넹  
20171127,2,성근이 이넘만 없어다면 좋은영화인데 다 좆져났네...퉤퉤  
20171127,10,시사회평 보니 기대가 됩니다  
20171127,10,"1분 1초가 지루하지도 않았고, 계속해서 몰입하며 보았던 영화! 강추해요  "
20171126,10,평론가들 평점 5~7점  주는것보니 꽤나 괜찮은듯 보이네. 예고편만으로 일단 10점 ^^  
20171126,10,언뜻 진중권을 본거같은데..  
20171126,9,방금 출발비디오여행에서 살짝 봤는데 재밌을듯  
20171125,10,김무열 배우 팬으로서 뭔가 기대작이네요 ~  
20171125,9,시나리오 최고라고 하네요.범죄도시 이후로 최고의 영화입니다  
20171125,10,시사회후평도 좋던데 기대되네요. 개봉날 봐야할듯!!  
20171125,10,"제가 본 미스터리 스릴러 영화중 최고였습니다. 1분1초가 지루하지도 않았고, 계속 해서 몰입하며 보았던 영화인거같아요 그리고 영화사운드가  매우 돋보이는 영화였어요 강추해요  "
20171125,10,기억의밤   재미있겠네요 ㅎㅎ 기대해야되겠네요 ㅎ    강하늘  나오면  볼만 하겠네요 ㅎ  
20171125,10,평 보고나니 더 보고싶어졌어요 기대됩니다!!  
20171125,10,이영화 너무 기대됩니다  
20171124,8,전체적으로 아쉬운점보다 만족스러운 점이 더 많았어요ㅎㅎ 한번 더 봐도 재미있게 볼것 같아요. 작위적이라고 느껴졌던 장면이 몇 군데 있었지만 괜찮았습니다. 관객에게 배려심이 좀..넘쳤던 영화였어요  
20171124,10,강하늘과 김무열의 멋진연기대결~!!  
20171124,10,영화에 나온 작은역할의  배우분들까지  연기가 너무좋았고 영화가끝난후에도  많은 여운이남는 영화였습니다~~!!  
20171124,10,진짜 재미있었고 생각했던거 보다 훨배 재밌고 장항준감독님 정말 재치있게 말씀도 재미있으셔서 기억에서 잊을수가 없었습니다!!!이거 꼭 보세요 후회없습니다~~~  
20171124,9,중간까지 범인인줄 몰랐었어요 끝까지 봐야 결말을 알수있는듯  ㅎ  
20171124,9,영화속으로 들어가는줄 알았네요너무 재미있고 다시한번 보면 또다른 느낌이 들거같은 영화네요강하늘 연기 너무 좋아요  
20171124,9,시사회로 봤는데 스릴넘치고 재밌었어요!!러닝타임이 좀 길다고 생각했는데 흡입력있어서 영화 끝까지 집중해서 볼 수 있었어요!!돈 내고 봐도 후회안했을것같슴당ㅎㅎ  
20171124,9,장항준 감독의 오리지널 시나리오에 대한 기대감으로 GV시사회에 참석했는데 기대 이상이었에요. 영화 막바지까지 흡입력 있은 이야기와 주연 대우들의 섬세한 연기에 박수를 보냅니다!  
20171124,10,올해 본 영화중 가장 스릴 넘쳤다  
20171124,10,꼬리에 꼬리를 무는 추적 스릴러!!!! 와 진짜 너무 재밌게 봤어요~~  
20171124,10,"기억의 밤 , 올해 최고의 영화이길 !!예상못 한 반전,  배우들의 연기력에 흠뻑빠졌습니다-  "
20171124,10,최고입니다 최고입니다  
20171124,10,영화 재밌어요 꼭 보세여!  
20171124,9,궁금증을 일으키는 반전의 영화였어요~~!!!재밌게 잘 보고 갑니다~~~  
20171124,10,오랫동안 준비한 노력이 보인 영화네요 짱짱재미잇어요!!  
20171124,10,반전 오진다 꼭 봐야됨...  
20171124,10,"김무열 배우님, 강하늘 배우님 연기력도 정말 대단했구요~전개가 정말 두근두근 했어요^^짱이에요!!  "
20171124,9,너무 결말을 다 알려줘버려가지구 아쉬웠지만 전체적으로 잘 짜여이씀  
20171124,10,시사회로 미리 접할 수 있는 기회가 있어서 미리봣는데 진짜 최고의 영화였어요 ㅠㅠ  
20171124,10,상상치 못했던 내용전개..대박  
20171124,10,재밌게 잘 봤습니다.^^  
20171124,10,"완벽한 연출력, 뛰어난 연기력, 가히 올 하반기 최고의 영화라 할 만한 대작.  "
20171124,10,"역시 강배우, 김배우!믿고 볼수 있는 영화였습니다. 이번은 시사회였지만 담에 영화관가서 다시 한번 더 관람해야겠어요!!  "
20171124,10,배우들의 연기도 좋았고 스릴넘치게 재밌었어요!!  
20171124,10,재밌었어요! 꼭 보세요 ㅎㅎ  
20171124,10,시사회로 봣는데정말 생각하며 재미있게 잘봣습니다!! 대박나세여!!  
20171124,10,스릴있고 반전도 너무 재밌어요  
20171124,8,영화 초반부가 굉장히 흥미롭습니다!  
20171124,7,소재도 신선하고 중반까지 정말 최고였는데 마무리하는 과정이 살짝 서두른 느낌 ㅠㅠ 조금 아쉬워요  
20171124,10,심장이 두근두근 보는내내 쫄깃하다! 완전한 미스테리와 공포의 향연!  
20171124,10,무섭고 재밌게 봤습니다~반전도 쫄깃해요^^  
20171124,9,"GV시사회와서 봤어요 보는내내 심장이 쫄깃 !!예고편봤을땐 큰 긴장감이 없었는데 영화를 보니 장난아니네요ㅎㅎ열린 결말 아니어서 좋고, 친절한 전개덕분에 이해가는 부분없어서 더 잘봤습니다  "
20171124,10,시사회로 봤어요 예고편이 다인 영화가 아닙니다  
20171124,7,영화 잘봣습니다.ㅎㅎㅎ  
20171124,10,짜임좋고 김무열 강하늘님 배우님들 연기가 ㅎㄷㄷ와~~ 잘하시네요 연출도 좋고 음악도 긴장을 닞추지못하게 하네요깜짝깜짝놀래고 재밋네요 ㅎㅎ 라이터를 켜라 정말 재밋게 본 영화인데 이 밤도 실망시키지않앗어요 장감독님 ㅎㅎㅎ  
20171124,10,쫀쫀한 시나리오와 주연배우들의 연기만으로도 볼 가치가 있습니다  
20171124,7,"영화를 보면서 예상했던 것과는 다른 반전 진행에 쉴틈이 없었습니다! 호흡 끊기가 정말 어려운, 집중할 수 밖에 없는 영화였습니다!!!  "
20171124,8,올해 본 것 중에 제일 재밌어요!!  
20171124,6,나쁘지않네요 ^^ 하하하  
20171124,10,시사회보고왔는데 재미와 감동을 느낄수 있었습니다. 두 배우님의 연기 정말 잘봤습니다  
20171124,10,주인공들의 감정표현이 잘된 것 같아요  
20171124,10,완전 기대됩니다 ! 시사회에서 봤었는데 개봉하면 꼭 다시 볼거에요 ㅎㅎ  
20171124,10,장항준 감독님 연출이라 더욱 기대되고 배우분들의 조합. 연기 또한 기대됩니다!  
20171124,7,올해의 기대작!! 보러갑니다!  
20171124,10,기대됩니다!! 언니랑 같이 보러가야겠네유  
20171124,10,장한준 감독과 믿고보는 연기파 배우의 작품이라 너무 기대됩니다. 장르도 미스터리라 긴장감도 있고 재미있을 것 같아요^^  
20171124,8,기대중이에요~~ 강하늘씨 20대 마지막 영화가 성공적이기를!!  
20171124,10,정망 기대됩니다!!!  
20171124,10,손에 땀을 쥐는 극강의 긴장감! 전혀 예상할 수 없는 충격적인 반전과 결말!  
20171124,9,시사회 재미있게봤습니다  독박gv하시는 김무열배우님 홧팅입니다  
20171124,6,ㅋㅋ..배댓글들...알바티가 막나네..표좀 안나게 달아라  
20171123,1,김무열 문성근;  불쾌한 배우진이네요;  일단 강하늘 화이팅~  
20171123,1,거품감독에 거품배우라.. 50만 예상한다  
20171123,7,"중반부까지는 역대 최고작이였는데,,,그 이후론 산으로 바다로 멀리멀리 가버리네요,추격자,세븐데이즈를 넘는 걸작탄생이 될뻔했는데 아쉽,,,  "
20171123,10,장항준 감독님 잘됬으면 좋겠습니다.  
20171123,10,진심 완전 기대작...배우들도 다 너무 믿고보는분들이라 너무 기다려집니다ㅠ 얼른 개봉해라!!!  
20171122,10,장항준 메가폰 잡은지 얼마만이냐ㅋㅋㅋ 기대  
20171122,10,보는 내내 10초 뒤가 궁금하...계속 다음 장면이 궁금해 지는 영화라 100분 쇼케이스 끝나고 미칠뻔...이런 스릴러 니가 처음!  
20171122,10,김무열강하늘 좋아하는배우인데 영화재밌겠네요기대합니다~~  
20171122,10,제발 요즘 한국 영화처럼 줄거리를 이상하게 풀어나가지만 않았으면 좋겠다  
20171122,10,엄청 기대는 하고있지만 '해빙'꼴 안나길 ㅠㅠ 반전이랍시고 상황을 완전 180도 틀면 본전도 못뽑아요 ㅋㅋ  
20171122,6,배우들은 좋지만 믿고거르는감독 장항준이 좀 그렇네  
20171122,1,요즘 한국영화가 재미없는 것 같다.  
20171121,10,김민교가 주연인줄 광고 개웃기네  
20171121,9,예고편만 봐도 엄청 무서운데 보고싶음 ㅠㅠ 심장아 나대지 좀 마 ㅋㅋㅋㅋ  
20171120,10,강력 추천입니다~! 흥행 하길 바랍니다.  
20171120,10,엔딩크레딧이 올라간 후에도 뇌리를 맴도는 두 남자의 기억!  
20171120,10,숨쉬는 것도 잊어버릴 정도로 몰입한 영화. 처음부터 끝까지 계속되는 긴장감!  
20171120,10,깊게 몰입한 후에 남는 먹먹함!  
20171119,8,믿고 걸러야 하는 장항준이지만 이번 영화는 왠지 괜찮을 거 같다 마지막으로 한번만 더 믿어봄  
20171118,10,불어라 봄바람 이후 얼마만에 보는 장감독님 영환지 꼭 볼께요.  흥행하시길  
20171118,2,미안한데 제목 부터가 에러군요. 의미가 불문명한 번역투입니다.  
20171118,1,싸구려전문장항준ㆍㆍ  
20171118,2,어중간한 연출에 엉성한 스토리 구성과 전개  
20171118,10,"믿고 보는 배우 강.하.늘.동주, 청년경찰도 그랬듯이 기억의 밤도 바로 달려갑니다~기대합니다!!  "
20171118,1,영화 포스터만 봐도 걸러야겠가는 생각이 처음드는 영화  
20171117,10,러닝타임 내내 계속되는 숨 쉴 틈 없는 긴장감! 두 남자의 엇갈린 기억이 선사하는 서늘한 충격!  
20171117,10,서로 다른 두 형제의 기억이 충돌하며 만들어 내는 깊은 여운  
20171117,10,단 한 순간도 눈을 뗄 수 없는 소름 끼치는 영화! 엔딩크레딧이 올라간 후에도 뇌리를 맴도는 두 남자의 기억  
20171117,10,러닝타임 내내 숨막히는 긴장감! 마지막에 밀려오는 여운까지… 무엇 하나 놓치지 않은 스릴러  
20171117,10,"긴장감 넘치는 추격 씬이 지난 후, 면도칼처럼 날카로운 여운이 남는 영화  "
20171117,10,"강하늘, 김무열 두 배우가 남기는 섬뜩한 여운. 올해 본 최고의 스릴러 영화  "
20171117,10,단 한순간도 눈을 뗄 수 없었다! 소름 끼치는 영화  
20171117,10,마지막 여운이 자꾸 생각나게 만드는 영화  
20171117,10,집으로 돌아가서까지 여운이 남는 영화는 처음인 듯. 올해 최고의 스릴러  
20171117,10,믿고보는 강하늘 배우님의 미스터리 영화!!!  기대대됩니다  
20171117,10,예고편을 보고 샤프가 이렇게 무서운건줄 처음 알았습니다. 덜덜덜.. 김무열X강하늘 두 배우의 조합이면 연기력 만큼은 단연 최고라 기대 할 수 밖에 없네요!!  
20171117,10,장항준감독님 영화라서 많이 기대하고있어요.미스터리 스릴러장르 무척 좋아해서요 재밌는 영화이길 기대합니다+_+  
20171117,10,장항준 감독님이 아주 오래 공을들여 쓴 시나리오에 김무열 강하늘이라는 배우들이 보여줄 그 밤의 이야기가 정말 궁금합니다! 웰메이드 스릴러 극장에서 확인해봐야겠어요^^  
20171116,10,스릴러물을 엄청 좋아해서 ㅋㅋㅋ 장항준 감독님이 시나리오부터 직접 준비하시고 만든 웰메이드 스릴러라고하니 기대됩니다^^  
20171116,10,기억의밤 예고편 긴장감이 장난 아니네요. 영화에서 팽팽한 긴장감으로 전개될 듯 한데 어떤 결말이 있을지 어서 확인하고싶네요. 진짜 궁금해요. 기대하고 있어요.  
20171116,10,흥미로워요 완전 기대됩니다!!  
20171116,10,기다리고 기다리던 영화가 곧 개봉을 앞두고 있네요~예고편만으로도 시선강탈♡ 배우님들의 연기와 영화 스토리가 더욱더 기대되고 좋아하는 배우님들과 좋아하는 장르의 영화라서 기다려지고 또 기다려지네요~11월 꼭 봐야할 영화 꼭 대박 날 영화네요♡  
20171116,1,키위가 투자한 영화는 안볼꺼임  
20171116,10,"장항준 감독의 영화라 믿고 볼수 있고 강하늘,김무열 배우의 인생연기 기대가 됩니다!!  "
20171116,10,영화 매우매우 기대중입니다! 반전이 있다고 하니 매우 기대되고 김무열과 강하늘의 조합이라니 환상의 조합아닌가요...스릴러 원래 좋아하는데 이런 영화 정말 환영합니다.. 빨리 개봉날이 오기를 친구랑 손꼽아 기다리고 있어요  
20171116,9,드라마 싸인도 재미있게 봤는데 장항준 감독님이 직접 쓴 미스테리 스릴러 기대되네요!  
20171116,9,강하늘님의 입대 전 마지막 작품이라니 꼭 보고싶은 영화입니다~  
20171116,9,예고편에서 보이는 두 배우의 케미가 장난이 아니라서 완전 기대하는 영화예요. 과연 형제 사이에 무슨 일이 벌어지는지 기대됩니다. <기억의 밤> 보고 싶어요!!!  
20171116,9,되게 기대하고 있는 작품이라 평점은 높게...하지만 아직 안본 관계로 반개는 빼고..ㅋ  
20171116,10,장항준 강하늘 김무열이 만들어내는 웰메이드 스릴러! 예고편부터 인상적이라서 되게 기대하고있어요!!!  
20171116,10,김무열과 강하늘의 호흡인 영화 #기억의밤 정말 기대되고 꼭보고싶어요  
20171115,10,예고편보고 완전 소름! 진짜 기대작이에요! 김무열. 강하늘 두 배우의 연기도 넘나 기대되요! 빨리 보고싶음~!!  
20171115,10,와 김무열 강하늘 ㅠㅠ진짜 믿고 봅니다  
20171115,10,스릴러 넘치는 스토리와 연기력 좋은 두 배우 그라고 강력한 연출까지 뭐하나 빠지지 않는 영화인들해요. 액션도 좋고 너무 기대되는 영화라 개봉하면 보고 싶어요  
20171115,1,이건 청불로 갔어야 매끄럽지.. 흥행만 노리고 15세 관람가라.. 글고 장항준 인지도만 있고 히트 드라마는 있는데 여화판에서 전작은 정말 핵노잼급  
20171115,10,예고편만 봐도 이 영화가 과연 어떤내용을 담았을지 감히 상상도 안갑니다. 너무나 궁금해요! 초겨울 완전 기대작입니다!!!  
20171115,10,오랜만에 기대하는 스릴러영화가 나온듯하네요. 예고편만으로도 압도하는 영화  
20171115,10,장항준 감독님 과 대세배우 강하늘의 만남 기대되고 반갑습니다  
20171115,10,빨리 개봉해 주세요~~ㅠㅠ너무 보고싶어요~!!  
20171115,10,장항준 감독님의 스크린 귀환과 강하늘씨와 김무열씨의 명품 연기력과 미스터리 스릴러 영화 정말 기대가 크고 너무 기대가 되는것이 사실입니다 개봉하면 꼭 보러 가겠습니다.  
20171115,10,"형제의 엇갈린 기억 속 살인사건의 진실을 담은 미스터리 추적 스릴러 <기억의 밤>.치밀한 연출과 예측할 수 없는 전개, 숨통을 조이는 압도적인 서스펜스로 관객들에게 한시도 눈을 뗄 수 없는 짜릿한 긴장감을 선사해주길 기대합니다.  "
20171115,10,예고편만 봐도 상당히 재밌있는 스릴러가 될것 같은 기분이 드네요! 게다가 배우님들의 소름돋는 연기가 시선을 한번에 사로잡아서 영화로 본다면 무척 소름돋고 무서울것 같아요~~ 어두운 이미지와 배우님들의 눈빛연기 BGM들이 다 모여서 무척 무서울것 같음!  
20171115,10,엇갈린 기억으로 서로를 의심하는 형제의 진실찾기 서스펜스가 기대되는 장항준 감독의 신작 스릴러 기억의 밤!  
20171115,10,장항준 감독님의 영화라 너무 기대가 되는데요. 거기다 강하늘 김무열 두 배우의 열연도 무척 기대중입니다. 미스테리 스릴러 장르를 좋아해서 꼭 보러가야겠어요.  
20171115,10,"너무 기대되고 강하늘, 김무열배우님의 스릴러연기도 궁금해요~~  "
20171115,10,명품 스릴러 < 기억의 밤 > 이 선사할 강렬한 전율에 폭 빠져들고 싶네요. 김무열 X 강하늘 조합 최고!  
20171115,10,오....포스터 대박. 온몸에 소름이 쫘악~ 완전 기대됨요^^  
20171115,10,그 형제의 밤이 궁긍합니다. ㅎ  
20171115,10,"기억의 밤!!! 완전 기대됩니다!!!감독님, 배우님 모두 좋아요♡이번작품 천만길만 걸어요ㅎㅎ  "
20171115,9,강하늘씨와 김무열씨의 연기가 정말 기대되는 흥미있는 스릴러 같아서 꼭 보고 싶어요~!  
20171115,10,예고편만 봐도 꿀잼각입니다!!  
20171115,10,강하늘 배우의 연기라면 기대하고도 남죠. 김무열님 연기도 짱!!장항준 감독님도 멋지세요! <기억의 밤> 기대됩니다!! 응원합니다.  
20171115,10,"장항준감독님의 귀환 ! 믿고보는 두배우님들의 숨막히는 멋진 연기가 벌써부터 기대되는 영화 두남자의 엇갈린 기억속 살인사건의 진실은 무엇인지 강하늘배우, 김무열배우 의 미스터리 추적스릴러 너무 기대됩니다  ♥♥  "
20171115,10,"천재스토리텔러 장항준감독님, 명품연기자 강하늘, 김무열. 이 세 사람이 만들어낸 영화 어떨지 너무 기대됩니다.  "
20171115,10,강하늘표 스릴러 영화라 더욱 기대중입니다  
20171115,10,"장항준감독 김무열,강하늘 미스터리  심리스릴러 극장에서 꼭봐야할 영화같고요 엄청 기대중입니다  "
20171115,5,너무 흥미로운 소재고 배우분들의 긴장감있는 연기로 인해 정말 기대되고 개봉후 평점이 10으로 바뀌었으면 좋겠습니다 !!  
20171115,10,납치된 후 기억을 잃고 변해버린 형과 그런 형의 흔적을 쫓다 자신의 기억조차 의심하게 되는 동생의 엇갈린 기억 속 살인사건의 진실을 담은 미스터리 추적 스릴러 영화 #기억의밤 넘 기대되요!  
20171114,10,"김무열, 강하늘 두배우님 조합으로도 믿고보는 영화!!기억의 밤 영화 넘 기대됩니당^^  "
