0,1,2
20171114,10,"배우님들 연기, 스토리, 영상미까지 모든 것이 다 마음에 듭니다! 과연 진실은 무엇일지 너무 기대됩니다!  "
20171114,10,정말 기대되는 영화라 보고싶습니다  
20171114,10,"강하늘, 김무열의 강렬한 캐릭터와 역대급 연기 변신이 돋보이는 미스터리 추적 스릴러! 빨리 만나보고 싶네요~  "
20171114,10,예고편을 보면서 느껴지는 그 서늘함과 음산함이 남다르게 다가오는 영화 기억의밤 기대가 커지는군요!요즘 핫한 강하늘과 김무열이라는 배우의 장점이 영화에 잘 녹아있는 영화로 생각됩니다  
20171114,10,"예고편만 봐도 엄청 기대되는 영화!!! 김무열, 강하늘 스릴러라니 ! 무진장 기대되네요 ♥ 개봉하면 바로 달려가겠습니다아아아!!!!  "
20171114,10,두 형제에게 다가온 잔혹한 기억... 이사온 날 밤에 괴한에게 납치되었다가 그 기간 동안 기억을 잃고 돌아온 형과 그후 형의 수상한 행동이 의심스러운 동생이 감춰진 살인사건에 대해서 서로 다른 기억을 두고서 찾아야하는 진실 '기억의 밤' 기대해요!!  
20171114,10,감독님 믿고 봅니다. 솔직히 무서울 거 같은데 감독님 믿고 기대하고 있습니다.  
20171114,10,영화 ♡기억의 밤♡ 예전부터기다려온 영화인만큼애토록 기다려왔어요 빨리 개봉해서 보고싶어요 기억의 밤 두 주연 배우들의 강하늘☆_☆김무열 활약도 기대가 되고요 영화관에서 빨리 만나고 싶어요기억의 밤 사랑하고 또 사랑합니다  
20171114,10,정말보고싶은영화입니다 기대되네요ㅎㅎ  
20171114,10,완전기대됩니다 10점만점  
20171114,10,"빨리보고싶어요 ... 강하늘 김무열 잘 생겼다 ... 기억의 밤 잘 생겼다 ,,!  "
20171114,10,명품배우 강하늘 김무열 기대하고 있습니다  
20171114,10,기대되는 영화입니다 강하늘 배우의 연기변신도 무척 보고싶습니다  
20171114,8,각본 감독 배우들 모두 믿보배들이라 기대 중입니다  
20171114,10,"예고편만으로도 완벽 그 자체! 강하늘 김무열이 보여주는 극강의 스릴러 영화!! 기억의 밤, 엇갈린 두 형제의 기억의 조각을 맞춰라!  "
20171114,10,이번 기억의밤 재미있을것같고  기대가돼네요  
20171114,10,11월 제일 기다려지는 영화. 예고편 뜨는데 보고싶어  죽겠어요. 스릴러라니.. 심장이 쫀득쫀득할 것 같은 영화라서 기대되요.  
20171114,10,넘보고싶던 기대작!기억의밤 배우들의 연기와 소재 그무엇하나 기대되지 않는것이 없어요!얼른 개봉하길!  
20171114,10,스크린으로 빨리 보고싶네용!!  
20171114,10,"강하늘과 김무열의 강렬한 연기가 정말 기대됩니다!또, 장항준 감독님께서 어떤 스토리를 그리셨을지도 궁금합니다~♥  "
20171114,10,박진감 넘치는 장면과 몰입을 하게 되는 내용전개에 긴장하며 재밌게 볼 것 같습니다 기대가 너무 됩니다!!!  
20171114,10,"납치된 형의 충격적인 사실과 ?감춰진 살인사건의 진실이 눈을 뗄 수 없는 몰입감을 안겨줄 것 같아 기대되고 궁금해요! 강하늘,김무열,문성근등 최고의 배우들이 펼치는 섬세한 감정연기를 하루 빨리 만나고 싶습니다!! ^^  "
20171114,10,강하늘 김무열 엇갈린 기억들이 엉키면서 긴장되고 엄청난 몰입감을...ㄷㄷ 극장을 나오면서까지도 진한 여운이 남았던 영화ㅠㅠ  
20171114,10,"두 남자의 기억이 충돌하는 순간, 절정으로 치닫는다!  "
20171113,10,와....보는 내내 10초 뒤가 계속 궁금했다가 마지막엔 먹먹했음  
20171113,10,와... 보다가 중간에 숨 쉬는 걸 까먹을 정도로 몰입함 ㅋㅋㅋㅋ 첨부터 끝까지 긴장감 쩔었다  
20171113,10,강하늘 -김무열 연기 왜케 잘하나요?! 완전몰입했다가 나중엔 먹먹함!  
20171112,7,제발 쓰레기 살인자의 기억법처럼 만들지 마시길  
20171111,9,정말 기대이상이였어요 강하늘 연기도 최고고 전반부만 봐서 후반부가 너무 기대돼요!!  
20171111,1,100퍼센트 망한다에 내 손모가지와 전재산을 건다. 예고만봐도 허접함이 느껴짐. ㅋㅋ  
20171110,8,"백윤식 의--끝까지 잡는다와  같은날 개봉이니까,, 경쟁할듯,,같은 범죄스릴러 이고,,  근데 예고편보니까,,문성근이 범인같은데,,,  "
20171110,10,김무열 강하늘 장항준이라니ㅠㅠ 개봉날 바로 보러갈게요ㅠㅠ  
20171109,10,쇼케이스 보고왔더니 뒤가 더 궁금해지네요!!  배우 두분 연기 정말 좋구요~^^ 깜짝 놀라기도 했지만 무서운거 못보는 저도 흥미진진해지는 스릴러였습니다. 개봉하면 꼭 보러갈께요!!  
20171109,10,짱짱!!!완전대박!!!! 시사회에서 봤는데 진짜 기대이상 최고였어요ㅜㅜ얼른 개봉만 기다립니다ㅜㅜㅜ♡♡♡♡>  
20171109,10,60분만 봤는데도 무섭고 소름..스릴러의 거장이 돌아와서 너무좋다  
20171109,10,60분만 봤는데 나머지 부분이 너무 궁금해서 빨리 개봉 기대가 됩니다.  
20171109,10,좋아요기대됩니다 좋아여ㅛ  
20171109,10,"역시 장항준 감독, 강하늘 배우, 김무열 배우 입니다. 완전 대박날거 같아요. 긴장감 장난 아닙니다. 꼭 보세요!  "
20171109,10,누구의 기억이 맞는 건지 정말 궁금합니다. 스릴러  영화인 만큼 엄청 긴장되고 스릴 넘치는 영화라고 생각됩니다.  
20171109,9,너무 스릴넘쳐요!!!  
20171109,10,재미있었어요....  
20171109,10,아슬아슬 긴장감 몰입도 제대로...진짜 최고의 스릴러탄생...기억의 밤 대박!  
20171109,10,완전재밋어요!!!화이팅  
20171109,9,무한도전 스릴러특집이랑 비슷한늬킴  
20171109,10,역대급 스릴러가 나온거 같아요 기대됩니다  
20171109,10,60분 풋티지 지루함 없이 잘봤습니다 스릴짱!  
20171109,10,완저 기대되요ㅎㅎ 프리미엄시사회에 오고 심장 오지게 떨렸다능ㅎㅎ 갑니다 영화관!!  
20171109,10,숨을 죽이고 볼 수 밖에 없는 스릴영화.  매 순간 긴장하며 볼 수 밖에 없을 만큼 스릴넘치는 영화입니다. 배우들의 명연기와 감독님의 연출에 감탄합니다!!  
20171109,10,쇼케이스에서 60분만 봤는데 미칠 지경이다.개봉 때까지 어쩌라고!!!  
20171109,10,쇼케이스 왔어요. 스토리부터 긴장감 장난아니네요. 개봉하면 보러 갈겁니다. 손에 땀이 흥건  
20171109,8,우와..두근두근....김무열두 강하늘두....우와....  
20171109,10,두 배우의 연기 변신 꼭 보고 싶어요!  
20171109,10,영화너무 잘봤습니다~적당한 스릴러와 긴장감이 있어서 더 좋았구요 김무열 강하늘 배우님의 연기 정말 좋았습니다!!!  
20171109,10,장난아닌 스릴러입니다. 가슴이 콩닥콩닥합니다.  
20171109,8,정말정말 기대가 되는 작품이네요!!!! ㅎㅎ 연평해전 때 본 김무열씨가 나온다니 기대되네요  
20171109,9,스릴러 영화 좋아하는분 추천합니다  
20171109,10,정말 기대하고 있습니다 ㅠㅠ 완벽한 배우와 감독의 콜라보..???? 정말 재밌을거같아요ㅜㅜㅜ!!!!  
20171109,10,완전 기대되요 !!!♡♡♡  
20171109,10,이영화 소재부터 너무 흥미롭습니다.  
20171109,10,ㅎ 기억의밤 너무 기달렷구 정말 강하늘이 군대라니 너무아쉬워요ㅎ 정말좋은영화 보게돼서 너무기대중이구 ㅎ 정말너무짜릿짜릿하구 정말기대중입니당ㅎ 오래기달린많큼 정말좋은영회 기대중입니다ㅎ  정말 너무 좋아요ㅎ  
20171109,10,정말 예고편만 보아도 긴장을 늦출 수 없는 영화에요!! 넝말 기대됩니다~  
20171109,10,정말 좋아하는배우 두분이나오셔서 꼭봐야하는 영화인것같아요! 그리고 60분영화는 처음보는거같은데 진짜 60분내에 어떤반전영화가 나올지 너무 궁금하네요!! 진짜 빨리개봉해서 모든사람들이 봤으면 좋겠네요!!  
20171109,10,겁나 기대중입니다 ㅋㅋ 장항준감독님 홧팅!!  
20171109,10,기대되네요. 이런 스릴러 좋아하는데 ㅎㅎ  
20171109,10,완전기대하고 보려고합니다 쇼케이스왔는데 기대를 많이하고있어서 굉장히 두근거립니다 김무열X강하늘의 케미와 장항준감독님의 호흡을기대합니다  
20171109,9,김무열 연기력 짱!! 다시 봐도 질리지 않을것 같아요  
20171109,10,간만에 기대하는 반전스릴러입니다! 예고편만 봐도 너무 기대되서 두근두근하네요 ㅎㅎ 강하늘님 기다리는 동안 기억의 밤 보면서 지내야 할 듯 합니다!!  
20171109,10,김무열 배우와 강하늘 배우의 조화에 장항준 감덕의 방점을 찍은 영화! 닮은 듯 다른 두 배우의 연기력이 합쳐진 영화. 눈호강으로 여심 저격 짜릿한 스릴감에 남심 저격하는 영화  
20171109,10,스릴이 넘치는 영화...!! 빨리 개봉했으면 좋겠어요!  
20171109,10,무조건 봐야하는 영화  예고편은 예고편의 불가하다  
20171108,9,몰입도  정말  끝내줘여 이거  
20171107,10,너무 기대되요~~  김무열씨 나오는건 무조건봐야죠~  
20171106,10,항상 기대하는 강하늘님 영화! 이번에도 기대해요!!  
20171106,10,진짜진짜 기대가 많이 됩니다 강하늘 배우님 정말 믿고보는 배우에다가 스토리까지 너무 완벽한 것 같아요 응원합니다 개봉하자마자 바로 보러 갈게요~~♡♡♡♡  
20171105,10,기대합니다 명연기!개봉하자마자 달려갑니다  
20171104,10,간만에 볼만한 스릴러나온거같네요. 배우들이 기대됩니다.  
20171104,10,믿고보는 강하늘!!!  
20171104,5,영화의 유일한 불안요소는 감독이 장항준이라는 것.  
20171104,10,너무기대됩니다~꼭 볼래요  
20171104,9,장감독님 넘 쾌활하시고 영화기대되네요~~강하늘.김무열 배우도 연기잘해서 꼭볼게요.  
20171102,10,강하늘배우님! 청년경찰보고난후에 팬이됬는데 기억의밤 기대할게요!  존잘ㅠㅠ  
20171031,10,간만에 볼만한 스릴러가 나온 것 같다 장항준 감독도 기대된다 ㅋㅋ  
20171031,10,완전 긴장감 장난 아니네요 이런 영화 기다렸는데 스릴감에 연기력좋은 강하늘김무열 케미기대  
20171030,10,기대하고있습니다!!!  
20171029,10,기대됩니다.  스릴러 좋아하는 데... 너무 기대되네요  
20171029,10,너무기대중이에요ㅜㅜ 혹시청불은아니겠죠...성인되려면아직1달남았는데..  
20171029,10,강하늘 영화 억수로 기대됩니다 11.29일 빨리왔으면 좋겠다  
20171028,10,강하늘 배우님 진짜진짜 팬인데 이 영화가 잘 될것이라 믿어 의심치 않습니다!! 이 영화가 화이팅하기를 바래요!!  
20171026,10,엄청 기대되는 영화 !! 예고편만 봐도 스토리가 깊이있는게 느껴짐!! 그리고 배우들도 너무 좋고 장항준 감독님까지 ㅠㅠ 꼭 극장가서 본다  
20171026,10,헐 김무열배우에 장항준 감독이라니 완전 기대된다.... 개봉 빨리 했으면 좋겠네요 꼭 볼래요  
20171024,10,영화 기대되요!!! 빨리 강스카이 보고싶어요~~~  
20171022,10,와 예고편 봤는데 미쳤다ㅠㅠ진짜 재밌을듯 강하늘은 군대가기전에 명작을 남기고 갔네...대박났으면ㅎㅎ  
20171018,10,연기파 배우들 모두 나오네요. 기대됩니다.  
20171017,6,"심리전, 반전의 묘미로 봐야할 거 같은데 .. 과연 어떨지? 그냥 간단한 소개글로는 영화가 뭔소린지 이해가 안됨.  "
20171017,10,와 강하늘 미쳣다 ㅜㅜㅜ 무조건 봐야지  
20171013,1,청년경찰 보고 10분뒤 부터 영화 끝나는 시간내내 내 두번다시 니놈들 따위 나오는 영화를 극장에서 보지 않겠다고 다짐했다.  
20171013,10,안볼 이유가 전혀 없는 영화.  
20171013,10,빨리 보고 싶어요!! 나의 강스카이 군대에서 열심히 나라 지키고 있을 우리 옵하.. 얼른 스크린으로 보고 싶어용>3< 3번 볼거야!!  
20171012,10,정말 너무 기대되는 영화예요! 강하늘 배우님 항상 응원합니다 :)  
20171012,1,감독이 장항준이라고 개망하겠네 은퇴하지않았냐  
20171011,10,믿고보는 김무열배우님!!! 장항준 감독님과 강하늘 배우님까지!!! 최고의 스릴러 기대할게요~^^  
20171011,10,김무열배우 연기를 좋아하고 장항준 감독의 연출력을 신뢰하는지라 처음 영화 만든다고 할때부터 기대가 컸는데 이제 곧 개봉하나보네요.  큰 기대하며 기다려봅니다.  
20171010,9,오올  포스터부터 느낌 뽜악!!!!  카리스마 장난 아니네용!  기대됩니다 :)  
20171010,10,일단 포스터가 재밌다고 말하네요  
20171009,10,강하늘 김무열 케미조합  기대됩니다  개봉날 극장가서 볼게여~~  
20171007,10,강스카이님 응원합니다 !!  
20170927,10,강하늘배우의 스릴러! 기대됩니다  
20170927,10,진짜 완전 빨리 만나보고 싶습니다!!!! 특히나 강하늘 배우님 정말 큰 스크린에서 한번더 만나뵙고 싶어요!! 완전 짱 기대중이예요 !!  
20170926,10,오늘 드디어 개봉날짜가 공개 되었군요 11월 말쯤 대박 터뜨리라 믿고 꼭 보러가겠습니다 강하늘 배우 팬인데 믿고 봅니다. 케미도 기대할게요^^  
20170926,10,헐 보러가야지 재밌을것 같다  
20170926,10,오- 포스터부터 ㅎㄷㄷ  
20170926,10,청년경찰에 이어 강하늘배우님 또다른 작품 기억의밤!! 기대중입니다!!♥♥♥♥강스카이 보고시퍼요오ㅠ  
20170926,10,꼭 봐야지~~~~ㅇㅇㅇ  
20170926,10,와 포스터부터 강렬하다.. 장항준 감독에 강하늘 김무열이라니 믿고 보는 조합 탄생ㅠ  
20170926,10,줄거리 내용과 포스터 ~ ! 굉장히 궁금해지네요. ~ 빨리 개봉했으면 좋겠네요  
20170926,10,강하늘의 또 다른 연기를 볼 수 있을 것 같은 포스터다. 굿굿  
20170926,10,강하늘이 나오는 스릴러 영화라니 기대됩니다. 가장먼저 달려가렵니다  
20170926,10,"강하늘이랑 김무열 신선한 조합이다.. 영화 진짜 기대중김무열 드라마에서 보고 완전 배우로서 반했었는데, 이번에 어떤 연기를 보여주실지 기대되요ㅠㅠ 개봉하자마자 예매각이네요  "
20170926,10,감독 배우까지 내가 좋아하는 영화인들ㅠㅠ 포스터 보니까 더 기대된다 ㅠㅠ 언제 개봉하나요  
20170906,10,장항준 감독님 강하늘 김무열 + 미스터리라면 재밌겠네요 잔뜩 기대하고 있어요ㅎㅎ  
20170823,10,"강배우님ㅠㅠ 재심, 청년경찰 그리고 기억의 밤까지..  좋은 작품 많이 찍어주시는것은 감사하지만 팬입장으로써 건강이 걱정되네요 군대 가시기전에 조금 쉬셔야할텐데 ㅠㅠ 군대가계실동안 개봉할 기억의 밤도 기대중이에요:-)  "
20170822,10,믿보배 강하늘!!!빨리 보고싶어요ㅠㅠ  
20170819,10,강하늘배우님이 연기를 잘하셔서 강하늘 배우님 출연하시는건 다찾아보는데 요번에 실력파배우님들이랑 영화를 찍으셔서 더기대되네요 ! 빨리 개봉했으면 좋겠네용 ~  
20170819,10,믿고보는 배우 강하늘씨! 동주 재심 이번에 개봉한 청년경찰까지 잘보고 있구요 이번에도 기대해봅니다!화이팅!!!  
20170814,10,"믿을 만한 배우 , 미담자판기 톱배우 강하늘님!! 정말 기대하고 있어요 군대가서 너무 슬픈데 ㅠ 정말 제 인생 영화가 재심,청년경찰,원더우먼,택시운전사 거든요 이제 기억의 밤만 남았습니다 배우 강하늘님 사랑해요♡  "
20170806,10,강배우님이 출연하신다니 너무 기대되네요!  
20170725,10,강하늘 나온 영화는 무조건 봐야지~ 지금 연기력도 좋지만 10년후 연기력 진짜 기대대는 배우1명중 하나다!!  
20170628,10,조타장.... 키잡아  
20170502,10,기다중입니다 강하늘씨 너무 보고싶어요^^  
20170326,5,감독이 장항준이야....  
20170322,10,감독님도 배우님들도 모두 좋아하는 분들 뿐이네요~^^ 완전 기대됩니다~  
20170317,10,감독과 배우 다 기대되는 사람들 화이팅!!!  
20170315,10,열일하는 두배우분과 장항준감독님이라니! 기대중입니다!! 스릴러 장르를 좋아하는데 믿고보는 장항준 감독!! 연기력 검증된 두배우까지 꼭 보겠습니다!! 열심히 찍어주세요!!  
20170306,10,완전기대중!!!  개봉은언제하나요??  
20170305,10,완전 기대중입니다 무열배우님 쉴세없이. . 영화에 뮤지컬에. .스프링어웨이크닝 이후 첫만남인듯ㅋㅋ김무열배우님 강하늘배우님 화이팅!!  
20170305,10,이 영화 정말 기대 중입니다...!김무열 배우님 강하늘 배우님 둘 다 응원합니다:)강하늘 배우님 재심 끝나자 마자 청년경찰 찍으시고 기억의 밤까지 고생이 많으시네요ㅜㅜ팬으로서 건강도 우려되지만 정말 기대 중입니다:)  
