0,1,2
20170816,10,모두가 알아야 할 현재진행형의 이야기  
20170816,10,더 시간끌지말자 엠비도 엠비씨도  
20170816,1,좌파 집권이후 선동영화들 오지게 찍어내는구나ㅋㅋㅋ  
20170816,7,방금 시사회 보고 왔는데...문재인 대통령님의 개혁은 지금의 언론이 존재하는한 거의 불가능하다. 적폐도 이런 적폐가 없다.  언론은 또다른 이름의 최순실이다. 이번 정권 개혁과제 검찰 그리고 언론이다!! KBS 와 MBC 얘네 못바꾸면 개혁없다!  
20170816,10,어떻게 다큐가 영화보다 더 영화 같을수가 있지...응?  
20170816,1,잼있네요 잘봤습니다~  
20170816,10,언론을 탄악한 정부는 부패할 수 밖에 없다  
20170816,10,"MBC, KBS를 믿고 볼수 있을까?모든 사람들이 보고 국민의 알 권리가 얼마나 침해당하고 있는지를 알게해주는 영화다  "
20170816,10,보고 싶은데 대전에 상영관 딱 하나 주말상영은 안하고아침9시 아님 새벽 12시 넘어서 네요. 상영관좀 늘려줘여 꼭 보고 싶어요  
20170816,10,꼭봐야할영화입니다..모르면당합니다..  
20170816,10,손 바닦으로 하늘을 가릴순 없죠.  
20170816,10,이명박 전두환 당장 감옥으로 보내야하는거 아닌가요?  
20170816,1,어이가없네 언론장악 지금 문재인보다심각한 대통령이 어딨다고기가막히네  
20170816,1,자기들의 시선에서 고증된 철저하게 편협된 시각에서 본 영화. 광우병선동은 부끄러워서 뺏나보다.  
20170816,1,언론 검열은 노무현 문재인이 훨씬 심했지  
20170816,10,공범자들!!!! 시사회 안하나요??? 시사회 꼭 가고싶습니다 ㅎㅎ  
20170816,10,완전 강추 꼭 보셔요~진실이 밝혀집니다  
20170816,10,상영관이 늘어나서 좋아요~낼 보러 갑니다~~~~  
20170816,10,상영관 늘려라 ㅡㅡ 진짜 어이가 없어서 ㅋㅋㅋ CGV 고 롯데시네마고 장난치냐 너네? ㅡㅡ 이런 영화에 지원을 해야지 이런 썩어빠진것들아  
20170816,1,이명박시절 언론 OOO기 맞지 광우병 선동 아직도 생생하네  
20170816,1,광우뻥 선동은 어떻게 생각하냐    지금 내로남불 정권의 엠비시 케비에스 언론장악 중  
20170816,10,개돼지 되기 싫으면 꼭 봐라.  
20170816,10,꼭 볼껍니다. 상영관이 처음엔 너무없어서 걱정했는데 그래도 늘어났네요. 다행인거같습니다  
20170816,6,너무 분열조장이 아닌가싶네요 저도 정치관이 mb와 반대지만 이건좀ㅜㅜ  
20170816,1,정치색깔 너무 심해서 보기가 좀 그렇네요~  
20170816,10,아니 이거 IMAX로는 안나오나?! 극장가서 본다!!!  
20170816,10,"택시운전자, 공범자들 진실을 숨기려는자들과 진실을 파해치고 진실을 알리려는 자들의 현실...백번 이야기 하면 뭐합니까!직접 보고 판단하시라고 말하고 싶네요...  "
20170816,1,"헛소리도 이런 헛소리가 없다.시대는 언제가 우파가 잘못된거라고 말한다.언제나 좌파가 정권을 잡으면 이전 정부의 잘못때문에 라고 말한다.잘되면 자기들이 했다고 선전하고 못하면 우파정부때문이라고 하고, 어쩌란거지. 수강신청도 망해서 꿀꿀한데.  "
20170816,10,언론이 제대로 서야 나라다..꼭 봐야 할 영화  
20170816,10,"시사회에서 본 공범자들은 택시운전사보다 더 중요한 영화였다. 이명박과 그의 주구들이 한국사회를 얼마나 망가뜨렸나를 한눈에 보여준다. 암살에서 안옥윤이 말했던 ""알려줘야지, 우리가 싸우고 있다고""를 또한  절절히 보여준다. 싸우는 기자들을 응원한다.  "
20170815,10,명박아 깜빵가자???  
20170815,10,죄송해요 실수로 글쎄요 눌렀어요ㅠㅠㅜ진짜 죄송합니다ㅠㅜ  
20170815,10,꼴통들 1점테러 하지만 그 꼴통들의 노이즈 마케팅으로 흥함ㅋ  
20170815,10,택시운전사는 80년대 광주민주화를 보여주었다면..지금 현재 우리가 살고있는 이 시대에서는 언론이 어떻게 통제되어 왔는지 아직도 김장겸이 사장으로 있는한... 꼭 알아야하고 보아야합니다!! 재미까지 있어 완벽했던 영화입니다~!!  
20170815,10,기대 됩니다~~~ !!  
20170815,1,팩트도 없고 추측뿐인 영화인척하면서 찌라시 뿌리는 쓰레깅삼류 영상일듯  
20170815,1,진짜 이게딱 대한민국 수준이구나 ㅋ  
20170815,10,병박이를 학교로 보냅시다  
20170815,10,평식이는 6점이상 주는걸 못봣네.... 6점만점이냐?  
20170815,10,상영관이 멀지만 내가 꼭 가서 본다 이 나라의 바른 말 힘이 되어 드리고 싶습니다.  
20170815,10,이 영화 굉장히 기대됩니다. 전에 상영 가처분 신청 받아서 어떻게 될지 모른다고 하는 기사를 본 적이 있었는데 상영이 되어서 다행이네요  
20170815,1,잃어버린 10년을 영화로 만들 용자는 없겠지  
20170815,1,천안함 연평도 정으니 까발려봐라  
20170815,1,선동ㄴㄴ제발좀 이러지말장  
20170815,10,김재철과 MB 보고 빵 터졌어요. 고마워요^^  
20170815,1,"좌파들의 아니면 말고식의 언행은 강력한 벌로 없애야한다. 광우뻥 사태를 일으킨 놈들 미국산 소고기 잘만 먹고 있고, 싸드 전자파 데모하다가 전자파 하나도 없다니 꿀먹은 벙어리 되었고... 어휴, 좌파가 나라 망친다.  "
20170815,1,정권이 바뀌긴 바꼈네 ㅋㅋㅋㅋ  
20170815,10,ㅎㅎㅎ 이런날 올줄 알았다. 자 다들 극장으로  
20170815,10,이건 꼭 봐야 합니다 이명박이 무슨 짓을 해왔는디 국민으로써 꼭 봐야합니다  
20170815,10,난생처음 영화평점 매겨본다. 상식있는 국민이라면 우리가 어떤 공영방송에 노출돼 있는지 이 영화를 보고 판단해야 한다. 공영방송운영에 피같은 내 세금도 흘러들어가는 걸 자각해야 한다!!  
20170815,10,MB OUT~쥐를 잡자 쥐를 잡자 찍찍찍  
20170815,1,전세계 최초 뇌물받고 걸려서 자살한 전직대통령이랑 북한에 돈 쌀 퍼주고 핵개발 성공시켜서 지금 이 난리나게 만든 장본인 영화는 언제나옴?  
20170815,1,명박이가 공범자야? 내가 볼때는 감독인 최승호 니가 공범자인것 같은데?  
20170815,1,진짜 노무노무 무섭당~~~~!  
20170815,10,성원합니다이명박 엠비씨 에 대한 전반적인 내용을 알수 있겠네요  
20170815,10,임영박 구속되도 배츙이들이 입털수 있을까? ㅎ  
20170815,1,이명박근혜 아웃!!!! 보수는 온갖더러운짓을 다하지만 우리 깨어있는 좌파진보들은 순수깨끗 그 자체랑깨~~~~  
20170815,1,어이가 없네 이게 나라냐  
20170815,10,실화를 바탕으로 실존인물이 나오는 다큐멘타리 입니다 허구로지어진영화나소설이 아니라는거죠 꼭 봐야됩니다  
20170815,10,일성베스트 별점 테러 막기위해 10점준다  
20170815,10,이정도로 언론 탄압이 자행되는줄 몰랐네요. 많은 분들이 보시고 공영방송 정상화에 힘을 보탰으면 합니다  
20170815,10,드디어 이런 영화가 나오는군..  
20170815,10,평점 낮게 테러하는 알바님들...  제발 낙동강 가서 녹조라떼좀 배터지게 퍼 마시고 다시 댓글 달아라.  엠비 자원외교 조금만 파헤처도 니들 혈세가 어떻게 악마들 주둥이로 처 들어갔는지 답 나온다  
20170815,10,이런 영화가 많이 만들어져야 좋은나라죠. 응원합니다.  
20170815,10,왜 광주민주화운동 때 MBC가 시민들에 의해 불살라졌는지 알아야 한다. 무고한 시민들이 총칼에 죽어가는데 방송은 폭도들이 날뛰고 있다고 방송했다. 지금도 그 MBC와 KBS는 똑같은 반역을 저지르고 있다  
20170815,1,"좌익조작선동다큐멘타리, 제대로 만들려면 김대중노무현때 방송장악부터 다뤘어야지 징글징글한 좌좀들의 내로남불  "
20170815,10,"아직도 좌빨거리는 사람이 있다니 신기하다. 못배운건 알겠는데 배우려 노력하세요. 박정희 OOO 동안의 독재가 좋으면 경북은 따로 독재국가 만들던지, 박정희. 전두환. 노태우. 이명박. 박근혜 애국보수들은 얘네가 정상으로 보이나보지?  "
20170815,1,참 대단해서 할말이 없다  
20170815,10,뉴스타파 공범자들 개봉 막는 인간들이 재법 많더군요 부정부패가 나라를 망하게하는 주된원인 입니다. 국민이라면 꼭 보세요  
20170815,10,이런 좋은영화들 더 많이 나오길~~!!  
20170815,10,이건 하늘이 두쪽이나도 꼭 보고만다 극장에서  
20170815,10,이 날만 기다렸어요^^  
20170815,10,부정부패 척결과 정의사회 구현이란 이념으로 똘똘뭉친 이념주의자들을 현실과의 타협과 눈앞의 이익만 쫓는 기회주의자들은 절대 이해할 수 없을 것이다. 말도안되는 이유로 낮은 평점을 주는 당신들이 대다수인 우리를 이해할 수 없는 이유이다.  
20170815,1,ㅋㅋㅋ  정권 바뀌니까  세상 좋아졋으? 막떤져 그냥?  
20170815,1,진짜 정신나간 빨갱이영화가 따로없네 방송검열 둘째치고 감독부터 지하대꼬가서 족쳐야 할판이다  
20170815,1,이딴 것은 영화가 아니다. 영화라는 장르를 달고 있는 것 조차 나에게 불쾌감을 준다  
20170815,10,이영화는 반드시 대박나야한다.  
20170815,10,"또 누군가들은 손 부들부들 떨면서, 눈까리 시뻘개가지고, 개거품 물면서 짖어대겠네  "
20170815,10,아직 못봤지만 이건 꼭 봐야하는 영화임에 틀림없다. 이게 벌써 10년은 된 이야기일텐데 아무것도 모르는 사람들은 좀 귀좀 열고 알고 배우는 계기가 되길 바란다. 남의 나라 불구경하듯이 쳐다만 보지말고 관심좀 갖자. 우리의 관심이 저들은 제일 불안할거다  
20170815,10,볼거다 진심으로 무조건  
20170815,10,기대됩니다꼭 봐야겠네요  
20170814,1,이런 영화를 찍는 거 보니 감독이 광우병 걸린 듯?  
20170814,10,"택시운전사, 공범자들.. 이런 영화가 많이 나와야 한다. 그동안은 정말 쓰레기들이 나라를 너무 망치는걸 두고만 봤다.  "
20170814,1,이런걸로 음모론을 기정사실화하는건 좋지않음  
20170814,10,언론이 질문을 못하게 하면 나라가 망해요!!!  
20170814,10,꼭 봐야하는 영화 ...  
20170814,10,국민들이 얼마나 무서운 사람인지 이 나라 부정부패한 정치인들 뿐만 아닌 나라 꼭대기에 있는 사람들한테 알려줘야 합니다.  
20170814,10,대한민국 국민들은 필독인 영화입니다  
20170814,10,힘내야 합니다. 이겨내야 합니다:  
20170814,10,꼭 보세요~  추천합니다! 정권을 위해 언론을 장악하는 인물과 그 공범자들의 실상을 모두 확인 할 수 있습니다.이름 외우러 한번 더 보러 가렵니다.  
20170814,10,재미 있겠다. 재미 있겠어.  
20170814,10,빨리 개봉되기 바랍니다. 내용 궁금하네요  
20170814,10,세상을 바르게 똑바로 보고 살자!  
20170814,10,김장겸은 물러나라 쫌 앙  
20170814,10,지난 10년간 고생 하셨던 많은 분들이 있었구나 몰랐었던 일들이 너무 많았구나 비겁하게 외면하고 살아온 날들 이었구나 하는 생각이 들었습니다  
20170814,10,상영관을늘려주세요경상도에서도볼수있게  
20170814,10,이번주보러 갑니다. 너무 기대되네요..근데..상영관이 너무 적어요 ㅠㅠ  
20170814,1,글쎄요.이런게 언론장악 아닐런지 대통령은 광주사태 관련영화 대놓구 보러가구 때맞춰 전임자 까는영화 나오구 사실 이번 대선 알바제일 많이 쓴게 누군지는 뻔하지 눈가리고 아웅이고 나외엔 전부 적이고 정은이 숙청하듯 삼성이고 모고간에 다죽이려 혈안이 되  
20170814,1,문재인의 언론탄압과 공영방송 장악시도를 저지하자  
20170814,10,이명박과 그 밑에 기생했던 친일기레기가 단두대에 서는 날이 진정한 광복이다!  
20170814,10,봐야지g지g지g지g  
20170814,10,꼭봐야할 영화입니다 꼭  
20170814,10,꼭 봐야지.공영 방송 정상화 하는데 조금이라도 도움이 되길~~~  
20170814,1,쓰레기 좌빠 영화구나~  
20170814,10,희대의사기꾼쥐를잡자  
20170814,10,이야... 일베충들이 이렇게 많다. 이 영화에 평점 낮게 주는거 보소 ㅋㅋ  
20170814,10,법원 땡큐~~~ 꼭 본다  
20170814,10,왠만하면 다큐물은 극장에서 절대 안보는데 요것만큼은 개봉하자마자 무조껀 뛰어가서 본다  
20170814,1,네 다음 주작PD 광우뻥 선동 나는 잊지않는다.  
20170814,10,이건 안봐도 십점이네요  
20170814,10,아직도 댓글알바들이 많다.. 늬들도 얼마 남지않았다..  
20170814,10,꼭 봐야할 영화라고 생각합니다.  
20170814,1,그래서 다들 미국산 쇠고기 먹고 계시죠?  
20170814,10,최승호 PD 님 힘내세요~  
20170814,10,와 정권 바뀌니깐 할말다하네 좋아좋아 아주좋아 이건 맘에듬..언론은 자유로워야함  그에대한 책임은 언론사의 몫  
20170814,10,기대중 ~!  올라가라~!  
20170814,10,1점 테러 하는 엠 븅 신들 많네 ㅉㅉ  
20170814,10,이런 영화는 봐줘야죠 띵작  
20170814,10,이명박근혜는 사형!!  
20170814,1,이런 한쪽에 치우쳐진 영화 한편보고아 이렇구나! 내가 이렇게 정치에 관심 있다니~~난 깨시민이야 하는거 생각하면 토나온다  
20170814,10,꼭보장!! ...꼭 보자!  
20170814,10,발끈하는 별점테러 꼰대틀딱들도 나라이꼴로 만든 공범자들이다  
20170814,10,대한민국은 공정하고 정의가 살아 숨쉬는 곳이되었으면 좋겠습니다감독님 정말 수고많으셨습니다  
20170814,10,대한민국 국민으로써 꼭 봐야할 영화네요  
20170814,10,포스터.. 이명박임?  
20170814,10,아래 평론가들의 평점이 왜 저런가? 써놓은  말과 평점의 부조화... 눈치보나?  
20170814,10,저 포스터 얼굴 명박이 인가여?  일본순사처럼 생겼네 ㅋㅋ  
20170814,5,MB 정권 언론 통제가 잘못된 것은 맞음.그러나 미국 소고기 광우병 드립으로 거짓말한 언론도 문제가 있음(조작 짜집기)  
20170814,10,보러 갈께요! 사명감으로라도 보러 갈께요  
20170814,1,개 돼지 레밍 취급받기는 싫고 제대로 알아보기는 귀찮고 정치는 드라마로 배워서 그런지 선동은 오지게 잘통해요 ㅉㅉ안타깝다  
20170814,10, 정권의 나팔수 .부역자 역할을  엠.빙.신  이제 본연의 역할로 돌아가라  
20170814,10,너무나 기대되고 뭔가 찡하면서 반드시 봐야겠다는 생각이 드네요!!  
20170814,1,뇌물먹고 자살한애는 미화하고 이딴걸 영화라고 만듬 이게 나라냐?  
20170814,1,지들입맛대로네 에라이  
20170814,10,진실은 영원합니다..  
20170814,10,문재인정부가 mbc를 왜 장악하냐외부에 로고 가리고 취재나가는 허접한 언론사를ㅋㅋ  
20170814,10,꼭봐야하는 영화입니다 느낀게 많고요 꼭보세요...  
20170814,10,꼭 보고 싶은데 상영관이 많이 없네요.  
20170814,10,김장겸은 물러나라! 엠비씨 파견 비정규직 차별 반대!!  
20170814,1,와... 북한도 아니고 세뇌 영화 ㅋㅋㅋㅋ 진짜 대박이다... 언론장악은 마치 보수만 한거 마냥 이러네 ㅋㅋ  
20170814,10,벌거지들 좌표뿌렸냐? ㅋㅋㅋ 혈압약 챙겨먹어. 혈관터져서 오줌 질질 지리지말고 ㅋㅋㅋ  
20170814,10,와 천안에 상영관 하나있네....그것도 하루에 1타임만 상영하네....나참....  
20170814,10,일베&댓글부대들 잠시라도 쉴 틈이 없는것같아 안타깝다  
20170814,10,세상이 변하긴 하나봅니다.  
20170814,1,김대중 혼외자식은? 노무현 뇌물먹고 자살한거는?  
20170814,6,"정권 바뀌니깐 이런류에 다큐 엄청나오네ㄷㄷ 더 플랜을 시작으로 세월호 다큐,노무현 다큐, 이젠 명박이형 다큐까지ㄷㄷ  "
20170814,1,돈내고 보진 않을래ㅋㅋ  
20170814,1,별 하나도 아깝지만 글 쓸려고 준다. 좌좀들의 세뇌영화 이제 신물난다.  
20170814,10,꼭봐야한다. 무조건 추천.  
20170814,1,ㅋㅋ광우뻥 선동은 누구나 아는 사실인데 어디서 이런 말도 안되는 다큐 만들어서 선동 하려고?  요즘 이런 좌파성향 영화 만드는데;; 김일성 김정일 김정은 3부자 돼지들이 북한주민 세뇌용으로 만드는  세뇌 영화랑 다를게 없어 ㅋㅋ  
20170814,10,이명박근혜 사형 땅! 땅! 땅!  
20170814,10,"이제야 이런게 나오는게 아쉽기만 하지만, 그래도 이제라도 나와주셔서 감사하기만 함  "
20170814,1,이런 정치영화는 좀 안만들었으면.. 그냥 선동으로 밖에 안느껴진다. 민주당이 정권 잡았다고 이때다싶어 나대는모습 별로 보기좋진 않다.  
20170814,10,이명박 깜빵에 쳐넣어야 한다  
20170814,10,이건봐야지무조건 썩어빠진새키들 어디한번봐보자  
20170814,10,힘내십시오 우리도 응원합니다  
20170814,10,이런 영화 무조건 추천합니다  
20170814,1,광우뻥치는 사람들도 미국산쇠고기 절찬섭취중  
20170814,10,시사회에서 영화를 보는내내 가슴이 아팠습니다. 이런 현실에서 9년동안 300여명의 언론인이 정권과 맞지 않는다며 탄압을 받았습니다. 오랜시간동안 불의에 맞서며 공정보도를 지켜온 언론인들에게 감사드립니다.  
20170814,10,그냥 언론이 썩었다는건 알겠다.  
20170814,10,결론은 이명박 정말 나쁜x  
20170814,1,빨갱이들의 선동영화.  
20170814,10,언론 살해범이 나오는군요  
20170814,1,광우뻥을 이런식으로 선동하려드네.  
20170814,10,대한민국 국민의 필독 영화입니다. 화이팅!  
20170814,10,꼭 봐야지  가족들  지인들 다 데리고 꼭 볼거야  
20170814,10,2MB가 어떻게 2TERA가 되었나??  최승호 감독님 응원합니다!!  
20170814,1,노무현은 '노무현입니다'이명박은 '공범자들' 이냐.  어처구니가없다. 영화만드는거보면 보수는 저런 영화 안만드는데 좌빨들은 참으로 저런 영화 잘도 만드네  
20170814,10,상영관 늘려라.. 모든 국민이 봐야한다.  
20170814,1,  ..2..4....6...  
20170814,10,이명박 정권이 어처구니 없는 불법적인 방법을 동원해 쫓아낸 정연주 KBS 사장이 생각나는 영화이다.  
20170814,10,우와~~기대됩니다!!!!  
20170814,10,기대가 큽니다~!!응원합니다.  
20170814,10,역시 우리의 최승호감독!! 최고  
20170814,1,중립인 사람으로서 언론부터 시작해서 너무 한쪽으로만 치우치는것도 눈살이 찌푸려집니다..  
20170814,9,좃박이를 탄생시킨건 우매한 국민들이었다..그리고 그 우매한 것들로 인해 닭이 바턴을 이어 받게되었다..  
20170814,1,그냥 팩트는 맛없으니까 자극적인 카더라 가미해서 요새 한창인 좌익 시니컬리스트들 입맛 겨냥한 정치영화.. 이런 영화는 좌든 우든 재미없고 시시껄렁한 연출이 다다. 마치 본인이 대 우주의 비밀스러운 공작은 다 아는것처럼 하는 말본새며.. 안봐도 비디오  
20170814,1,그들의 내로남불의 전형  
20170814,1,다들 수입소는 안먹나보네 ㅋㅋㅋㅋ  
20170814,10,이런 영화들이 많이 만들어졌으면 좋겠다  
20170814,10,진짜 영화같은 일이네 ㅋㅋ  
20170814,10,왜 지방은 개봉관이 없는 건지? 대전에도 열어줘요 제발 ㅜㅜ  
20170814,10,비공 색깔 바꾸는게 나을듯  
20170814,10,멍멍이들....  멍뭉아 미안  
20170814,2,MB 저런 사람이 대통령이 된것이 치욕이다.. 앞으로 후보도 검증을 하고 해야 한다. 명박이나 전두환 등 제발 하늘나라로 가라...  
20170814,1,똥묻은 개가 겨묻은 개 나무란다더니.... 그때 언론을 장악햇으면 그렇게 선동을 당했을까??ㅋㅋ  
20170814,10,진짜 택시운전사 보고 다음 바로 볼 영화가 생겼다^^~아싸!!  
20170814,10,영화가 기대되네요..  
20170814,10,진정한 언론이 필요한 시대입니다.  
20170814,10,MB씨  배신남매들은 좃됬네..  
20170814,1,지금이 더 언론장악 정점이잖아!? MB 정부때 부터 지금 정부까지 언론들... 국민 우롱하는 수준이 절정이지~~ㅋㅋ  
20170814,10,"꼭 본다 진짜로, 잃어 버린 10년 찾자  "
20170814,10,칸으로 진출하길 기원함!  
20170814,10,이제 나온다 꼭 볼것이다  
20170814,10,기대 됩니다. 명박이가 어떻게 했을지  
20170814,10,영화 기다립니다 적폐청산  
20170814,1,OOO기 좌좀 영화일듯..광우뻥을 진실로 믿고 또 선동??  
20170814,10,최승호 피디님 존경합니다 고생하셨어요~~화이팅입니다  
20170814,1,언론장악??개뿔 광우뻥으로 온국민 희롱한게 니네 언론사들이야마녀사냥까지해서 정선희 남편 사업체까지 말아먹게한것들이 참 뻔뻔하다  
20170814,10,부산에..상영관이 많이없어요 메가박스는부산엔 하나도없어요ㅠ 상영관좀부탁해요~~  
20170814,10,언론 적폐청산 꼭 봐야할 영화  
20170814,10,반드시 봐야할 영화!!! 언론적폐 청산  
20170814,10,와나 ㅋㅋㅋㅋ 17일 개봉인데 14일에 기각을 하고있네 ㅋㅋㅋ 덕분에 상영관 거의없음 ㅋㅋㅋㅋ 양아치새끼들 이거 노리고 제기한거네  
20170814,10,꼭 봐야할 영화. 나라를 망친 인간들의 실체를 알수 있다.  
20170814,10,존나웃긴게 지네들이 언론장악해한건 절대 생각안하고 정권 바뀌고 前정권이 했던것을 영화화하고 방송애 내보내려니깐 좌파들 세상이니 언론장악이니 개소리를 지껄이는 우리 틀딱충들 아웃!  
20170814,10,이승만 제자 이명박 깜빵으로 5.16은 쿠테타  
20170814,1,광우병 구라에 미친소마냥 거리나와 날리치던분들 요즘엔 미국소 잘먹고 지내시던대ㅎ 진짜 사람 맞으세요?ㅋ  
20170814,10,원세훈 비리 용산참사 두개의 문  
20170814,10,2017년 꼭 봐야하는 영화!!!  
20170814,10,맹박이 언제 사형시키냐??궁금  
20170814,10,명박이 구속이 시급합니다.  
20170814,10,시사회를 보고 왔습니다.  당당히 맞써 싸우고 계신 현 기자분 및 해직기자분들의 노력을 이제야 할게 되었습니다.  힘내세요~!! 응원합니다.  
20170814,1,이런건 그냥 티비에서 해라...얼마나 또  벌어쳐먹으려구 기름낀 좌파새끼들아  
20170814,1,좌파들이 세상을 점령하는듯  
20170814,1,ㅋㅋㅋ 네이버 조작보소 몇분전까지 좌파영화라고까는건데 순식간에 호평으로 도배됨  
20170814,1,작년에 갔던 각설이 죽지도 않고 또 왔네. 승호야 백번 양보해서 니가 선동한대로라면 광우병으로 인해 지금 월드워Z찍어야 하는거 아니냐? 남을 비판하기전에 우선 처절한 자기반성부터 해라  
20170814,1,광우뻥 구라쳐서 그 난리 벌인건? ㅋㅋㅋ  참 답없다 당신들 같은 내로남불 광신도들이 더 역겹다  
20170813,10,이명박을 구속하라!~!  
20170813,1,한국 영화들은 대부분이 선동영화라서 답이없다  
20170813,1,"공범자?  최감독, 당신 얘기죠?  대한민국을 이꼴로 만든.  "
20170813,1,이상하게 이번 정부 들어서고는 이런 정치영화가 판을 친다.... 줄 서느라 바쁘다 그지 다들?  
20170813,10,공범자들.꼭 보시길 바랍니다.  
20170813,10,시사회에서 보고 왔어요. 공영방송의 정상화가 왜 필요한지 알 수있는 영화 입니다. 기존에 볼 수 없었던 내용도 많아요.꼭 보세요. 널리 알려주세요.  
20170813,10,언론장악 개소리하네 일베충 쉐키들ㅋㅋㅋ 밖에서 일반인 코스프레할거 생각하면 소름돋는다 역겨운 놈들ㅉㅉ 밖에서는 찍소리도 못하는 찐따들이 ㅉㅉㅉ  
20170813,1,애초에 거짓말 광우병 보도는 해놓고 입싹닫는 건? 좌좀색기들 지금 미국소고기 잘먹고있냐  
20170813,2,문슬람들과 네이버 포털 그리고 여론조사 기관에 의해 장악된 인터넷 여론 선동과 조작도 좀 고발해주세요. 기사 멋대로 올리고 내리고 댓글도 멋대로 지우고 가관이다  
20170813,10,팩트 영상 기대합니다.  
20170813,10,꼭볼게용  빨리개봉했으면좋겠다  
20170813,10,영화를 보고 후기를 올린건 처음이다.시사회에 참석해 보게됐다이 영화를 보고도 좌파니 우파니 편을 가르고 빨갱이니 하는데 그렇게 말하는게 진정으로 나라를 위한것일까. 이 영화는 모두를위해 개봉 되어야 한다. 그리고 알려져야한다. 국민은 알 권리가있다  
20170813,1,빨갱이 언론노조들이 언론을 장악했는데 그건 착한 언론 장악인거냐????  
20170813,1,노짱은 신격화시키고 명박이는 나쁜놈으로만들어버리네ㅋㅋ  
20170812,1,"후,,,언론장악 시작됬구나  "
20170812,1,글쎄다. 요즘 안 보던 정치뉴스보네요.  
20170812,10,최단시간에 천만관객 찍을 영화  
