0,1,2
20170804,10,"국정원 댓글부대 아직 활동하고 있는 듯. 여기 평점 1점 준 사람 전수조사 필요할듯. 어이, 니네 부대 해산된단다. 정신차려라.  "
20170804,1,광우병거짓말 선동당한 멍청이들이 보는영화  
20170804,10,다큐는  잘 안봐지는데 이건  보고싶다.  도대체 무슨 일들이 있었는지 궁금하네.  
20170804,1,그쪽분들끼리 많이 보세요 ㅎㅎ  
20170804,10,이렇게 해서라도 나라가 바로 서야 할텐데 힙냅시다  
20170804,1,전형적인 선동/날조영화  좌파정권이 집권하니 오히려 독재정권이 되어가고있음  
20170804,1,지금 광우병 걸릴까봐 미쿡산 소고기 안먹지?ㅋㅋㄱㅂ  
20170804,10,이런 영화가 스크린을 2천개 해야지 어디서 군함도가  
20170804,10,공범자들 징역살이를 위하여  
20170804,10,일베충 버러지들이랑 대긍모 버러지들이 발악을 하겠구나.  
20170804,10,일베충 댓글알바들 꼴보기싫어서 10점줍니다  
20170804,10,이제  명박이도 근혜옆방으로 보낼때입니다.  
20170804,10,이명박의 비리를 밝혀줄 좋은 다큐멘터리이길 ^^  
20170804,10,꼭 보고싶네요.!!!  
20170804,10,모두들 복직하시고.. 쥐와 재철이 장겸이 광한이 대영이 등등은 모두 감방으로 잡혀들어가길 기원합니다!! 특히 MBC는 예전의 사납고 날 선 모습이 다시 오길 바랍니다..  
20170804,10,이런거는 아이들  데리고 가서 꼭 보아야함  
20170804,10,무슨 놀라운 사실이 있는지 궁금하기는 하다.  
20170804,10,재미있을 것 같네요.~  
20170804,10,이곳에도 시급 천원도안돼는 알바들이 많이보이네요ㅋㅋㅋ 엄청 부들부들하세용  
20170804,1,정신상태가 썩어빠지고 한쪽으로만 치우친 쓰레기  
20170804,10,기다렸던 영화  꼭  보겠습니다.!!!  
20170804,10,썪어 문드러진 공영 언론의 주범들 이제 죄값을 받아야하지요.  
20170804,10,이런영화를 만들어주셔서 감사합니다  
20170804,10,이렇게 이 사회가 하나 하나 바로 잡혀 나가길 기원합니다.  
20170804,10,국민들이 바꿔야할때입니다. 배아나운서가 그랬죠 국민만 보고 가겠다고...국민이 꼭 보여줍시다.  
20170804,10,국민의 알권리다 !!!!  
20170804,10,기대감이 많이 되네요. 개봉하면 꼭 보겠습니다  
20170804,10,평점이 아직 모자르네요!  
20170804,10,기대 만땅!  언론 정상화의 첫걸음이 되어 주길  
20170804,1,또 뭐 이상한 영화 만들어냈네  
20170804,10,빨리해라 빨리보고 평가하고 싶다.  
20170804,10,정말 기대됩니다...시간내서 봐야겠네요  
20170804,5,"1점 아니면 10점, 이렇게 극단을 달리는 평점 자체가 영화의 한계를 말해줍니다. 관객의 정치색과 이념에 따라 널뛰기하는 영화의 만듦새, 그 바깥 영역이 작품성의 근간을 뒤흔들며 존재하는 이런 영화는 정말 곤란합니다. 딱 그 중간, 5점 드립니다.  "
20170804,10,말이 필요 없음 굿  10자이상  
20170804,10,최고의 기대작 꼭 볼게요  
20170804,10,9년동안 공영방송들 몰락  
20170804,10,꼭 보겠습니다. 대박나세요!  
20170804,10,전국민이 봐야하는 좋은영화!!  
20170804,10,개봉도 안했는데 0점주는 댓글알바 땜에 평점주고감  
20170804,1,광우뻥 선동하던 좌좀들 처망하고 다 어디갔나 했더니 여기모여서 똑같은 어리석은짓 반복하네 ^^ㅗ  
20170804,10,꼭 봐야겠네요! 오랜만에 영화다운 영화  
20170804,10,연론자유도가 곤두박질쳐  70위가 된 이유  
20170804,1,"결국 선동이였던 광우병 파동 , 그래서 미국산 소고기 안드시는분 계시나요 ?  "
20170804,1,1점또 주기아까워 개봉해서도 안될영화  
20170804,10,좌파 빨갱이 들 뭐라하는데 틀딱들하고 댓글부대 아직도 정신 못차리나? 제발 정신좀 차리시고 생각좀하고 사세요 이런영화를 뭐라하면서 평점깍는건 말이안됨!! 꼭 대박나길!!  
20170804,10,진실을위해싸우신분들은  퇴사하고변방으로 쫓겨가고진실을 피한놈들은 아직도 일하고있네여 전 mbc뉴스는 걍 돌립니다 그분들이 다시오려면 모를까 친일이 따로있습니까? 시청자인 저두분통이터지는데당사자들은 평생~~ 그래도 시청자들은 압니다 응원합니다  
20170804,10,사실을 가지고  좌파영화 어쩌고 하는사람의 머리속이 궁금하다 자기한테 안맞으면 다 좌파냐   ㅎㅎ  어이가없네~~~  
20170804,10,신동호 배현진 니둘은 보고나서 평점 달기 바란다ㅡ몇점줄지 궁금하다  
20170804,1,아주 나라가 온갖 좌파영화로 가득차고 미쳤구만  
20170804,9,배현진 보고있나? 저런애가 mbc 간판이다  
20170804,10,기대합니다! 개봉하면 꼭 보러가겠습니다!  
20170804,10,아직 벌레들이 날뛰는걸 보니 이 영화는 정말 좋은 영화구나. 꼭 봐야지.  
20170804,10,여기도 댓글부대 와서 평점 내리고 있나요? ㅋㅋㅋㅋ  
20170804,10,MB씨 모하시나.. ?  
20170804,1,천박한 허위선동영화 광우뻥사건 데자뷰  
20170804,10,드디어 가카 헌정영화가 나왔다  
20170804,10,저게 사람새끼인줄 아십니까?  
20170804,1,언론노조 발악을 하는구나  
20170804,10,꼭 봐야 될 영화 배현진 축하해 이젠 영화도 나오구  
20170804,10,무조건 봐야겠네요.벌써 여론에 개봉전부터 화제가 되니 mbc 간부들 못보게하려고 법원가고 아주 발악을 합니다. 국민들도 알건 알아야지요  
20170804,10,꼭 볼거임 기대가  큽니다  
20170804,1,광우뻥을 아직도 사골처럼 우려버리네  
20170804,1,리얼 아무런 논리도 없고 ..  
20170804,10,명박이가 20조를 강바닥에 쳐박았는데 왜? 콩밥을 안먹고 여전히 나불대는지 이해를 못하겠음  
20170804,1,ㅋㅋㅋㅋ 국민은 개돼지다 라는게 확실히 맞는 말인가 보다 저때 광우병 되게 욕해놓고 지금 식당이나 주변에서 쉽게 접하고 맛보는게 미국산 소고기인데 저때 시위 나간 인간도 지금 미국소 겁나 맛보고 살겠지 ㅋㅋㅋ  
20170804,10,완전 기대합니다!!!  
20170804,1,옛날엔 독재라면서 올바른소리하면 탄압당했다고 했지? 지금도 딱 그 상황아니냐? 좌빨들 맘에 안들면 다 일베충이고 무식하고 못배운새끼가 되버리네; 도대체가 왜 좌빨 영화만 나오냐...인간들아...지금 누가 역으로 독재를 하나 생각해봐라...  
20170804,9,"시사회 참여기회가 생겨서 봤는데, 최근 나온 언론관련 다큐중에 다큐로서의 정보/메시지 측면에서는 다소 아쉬우나 보는 재미는 가장 좋았음  "
20170804,1,마녀사냥 제대로하네ㅋㅋㅋ 언제까지 그쪽에서 정권 잡고있을줄아나? 죄인아 너는 니가 한만큼 돌려받게 될거야^^ 진짜 별 꼴갑들을 떤다 좌빨시키들  
20170804,10,이제서야 잘못되었던게 바로 잡히기 시작하는 것같다 정말 보고 싶은 영화다  
20170804,10,일베충들이 평범테러하고 있네 ㄱ ㅐ OOO들 ㅋㅋㅋ  
20170804,1,문재인 똥꼬 헐겠소ㅋㅋㅋ  
20170804,10,영화적 기술이나 연출이 이 영화에 중요한가? 중요한건 사실이고 이 사실을 우리가 알아야 한다는 생각합니다. 그리고 잊지 말아야 하고 범죄자에게는 응당한 심판을 해야합니다. 이 나라에 저널리즘이 아직 남아 있다고 믿게 해주는 영화입니다.  
20170804,10,쥐박이 ~!쥐박이 ~!쥐박이 ~!쥐박이 ~!  
20170804,10,가짜보수 적폐세력 절멸시켜야 한다.  
20170804,10,이건.. 점수를 안 줄수가 없다.. ㅋㅋ 일베들 평점 테러를 하겠다니.. 벌레는 극약처방으로 없애야 정답~  
20170804,1,10년전 광우뻥 조작했던 쓰레기들이 바로 정의라는거라는 영화?10년뒤 현실은 미국소잘팔려서 한우 망하게생겼는데 광우뻥 거짓선동 책임진세기들하나없고 10년뒤좌파정권잡으니마치 자기들이 정의였다는양 얼굴내밀고 잡하졌는데 진심 코미디인가요? 고영태 녹취록?  
20170804,1, 근데 얘가 PD수첩 광우병 제작진은 아니지? 그래서 짤리고 이렇게 징징대는 거라면 정말로 추하다.  
20170804,1,원래 떡달라고 맨날 울고불고 땡깡부리는 애가 사실은 떡에 욕심 제일많아 제일 많이 먹은 애다. 이 영화감독이나 현대차노조가 그렇다.언론탄압? 좌편향안되면 무조건 언론탄압이지? 당신같은 인간들이 이명박보다 백배는 더 언론자유말살한단걸 죽어도 못깨닫겠지?  
20170804,9,시사회를 갔다. 쓴 웃음이 묻어나오는 영화... 영화가 웃긴게 아니라 세상이 웃겼다. 아직 끝나지 않는 비상식. 우리는 더 나은 세상을 위해 고민해야한다. 더 나은 언론을 위해 관심을 가져야 한다.  
20170804,10,공범자등 화이팅이요 ㅋ  
20170804,10,개돼지들 별점 깎으려 발악  
20170804,10,꼭 극장가서 볼께요~~~  
20170804,1,ㅉㅉ 좌파자식들이 영화만들면 다인줄...뉴스가 언론플레이면 이건 뭐라해야되나?영화플레이? ㅉㅉㅉ  
20170804,10,"사실을 보고 평가하시길 이명박근혜 정권 9년동안 검찰,감사원,국세정 등을 이용해서 언론을 탄압했다는 것은 사실이다. 모든 국민은 언론·출판의 자유와 집회·결사의 자유를 가진다. 언론·출판에 대한 허가나 검열과 집회는 인정되지 아니한다. 헌법부터 보시길  "
20170804,10,오늘 보고 왔습니다 .아이들에게 진실을 알려주려는 부모님들은 꼭 보시길바래요~ 우리 아이들이 나쁜언론과 평생을 지내게 두지 맙시다!! 깨알  재미도 있네요^^ 최승호 감독님 고생하셨습니다 화이팅!  
20170804,1,빨갱이들이 설치는구나  
20170804,1,노무현 김대중때 mbc가 진정한 공범자들이지 ㅋㅋ  
20170804,10,진정한 민주 언론의 귀환을 기원합니다!  
20170804,10,일베충 박사모들은 이 영화를 싫어 합니다  
20170803,1,나라꼴 이렇게만드는데 좌빨 영화인들이 톡톡히 한몫했지 ㅋㅋㅋ  
20170803,1,광우뻥 인거 아직도 모르는거냐?아님 그냥 개돼지냐?  
20170803,1,좌파빨갱이 새끼들 특징  근거 없는  소리나 sns선동글 보고 미끼를 덥석 물고 까내리기 바쁨  
20170803,1,ㅉㅉ 한심하다 진짜 ㅋㅋ  
20170803,10,꼭 다뤄져야 할 내용이네요  
20170803,1,학생인 내가봐도 이런영화 만드는거 보면 좀 심한것같다...  
20170803,1,이런영화가 나오네 이명박대통령임기시절이 벌써 10년이 지나간다  근데 뭐? 광우병으로 다죽을꺼라고 뇌에구멍나서 그래놓고 지금와서 미국소 잘만처먹고 다니는 쓰.레.기같은 인간들더럽다 더러워  
20170803,10,엠OO이 나데는거 보니까  잘 만든 영화네  
20170803,10,8월 11일 상영금지가처분 신청이 기각되고 그동안 우리의 눈과 귀를 속이고 거짓과 날조 뒤에 숨어 국민을 우롱한 이들은 그 죄를 받고 그동안의 일들을 낱낱이 밝혀주길 기대하겠습니다. 최승호PD 및 노조분들의 10년간의 집념. 보상받길 바랍니다.  
20170803,10,만일 상영을 막는다면 유튜브나 온라인으로 풀어주세요!!!!응원합니다  
20170803,10,정말 기대가 큽니다. 정의를 실현시키기 위해 노력하시는 모습에 감사드립니다.  
20170803,1,ㅋㅋㅋ 진짜 아무근거도 없는 좌파식 선동류 니들 머리속에 뭐가 들었는지가 궁금하다 소설을 머리속에서 만들고 있네  
20170803,10,실제 공범자들이 상영 금지 가처분 신청을 해서 더더욱 보고싶네요  
20170803,1,역겨운 좌빨영화 이시대의 좌익선동세력은 없어지질않는구나  
20170803,1,편향적인 정치 영화 탄생 예정  
20170803,10,기대됩니다~~~~!  
20170803,1,이런것도 영화라고 쳐주는거임?  
20170803,1,선동영화 또 나왔네 ㅉㅉ  
20170803,1,"문죄인정권 들어서고 노무현 찬양하는 영화 쏟아져 나오고 이명박 까는 영화가 나오는구나. 좌파정권 무섭다.. 이것이 적폐고, 또 다른 복수를 부를것이다. 나아지는게없구나  "
20170803,1,문재앙이 대통령 되더니 온갖 허위 선동영화가 판을 치네...역겨워서 토나올것 같다...  
20170803,1,광우뻥선동은 명백한 선동이였자나 뭘 잘낫다고 이따구 개같은 영화를 만드냐?  
20170803,1,전형적인 좌좀영화. 광우병선동때를 잊고 광우병의 진실을 은폐했다니ㅋㅋㅋㅋ지금까지 미국산소고기 잘 쳐먹었으면서ㅋㅋㅋㅋ니들 말대로 빨갱이가 있다면 신고하래메?? MB가 잘못했다면 구속해봐라ㅋㅋㅋㅋ구속못하자너  
20170803,1,이야 빨갱이들 좋다고 보것네 ㅋㅋ  
20170803,9,공범자들> 영화 응원합니다. ^^ 전국민이 함께 보고 공영방송을 장악한 주범과 그들의 하수인들 끝까지 책임을 묻고 자리에서 내려오게해야 합니다~배xx아나운서 .신XX아나운서  사퇴하라 ~  
20170803,1,나도 한편 만들까 대물간첩-도요타 다이쥬(김대중)의 진실  
20170803,1,그래서 그 당시에 미국산 소고기 드신분들 중 광우병 발진으로 인한 사망자는 나왔겠지요???  
20170803,1,몰입감 괜찮았어요 또 보려고합니다 화이팅!  
20170803,10,꼮보고싶습니다!!!!  
20170803,1,와 광우뻥 선동 그렇게 당해놓고선 아직도 정신을 못차리네 괜히 개돼지 소리 나오는게 아니다  
20170803,1,광우뻥 선동? 끄덕끄덕  
20170803,9,이명박은 언제 쇠고랑 찰까요?  
20170803,1,앞으로 영화 고를 때 아무생각없이 고르지 말아야지 생각듭니다.ㅎㅎ  
20170803,10,너무 기대된다...살아있는 언론을 꿈꾸며 반드시 본다  
20170803,1,이건 또 무슨 정치영화냐 ㅋㅋㅋ아주 살판 났구만 살판났어 ㅋ  
20170803,10,진실이 승리합니다...  
20170803,1,쓰레기의빨갱이의종북의김정은똥꼬냠냠이들ㅋㅋㅋ  
20170803,10,대한민국을 망쳐놨던 지난10년동안의 정권이 감추려 했던 진실을 이젠 국민이 알아야할때가 왔다 그 진실속에 죄가 있다면 당연 처벌받아야하고 하루빨리 정의로운 사회가 실현될수 있기를 바라기에 이번영화 꼭 보고만다  
20170803,10,광주는 언제 하나요? 시사회 신청하니 유저가 없다는 팝업창만 뜹니다! 충장로 메가박스 홈페이지에선 상영작으로 나오지도 않는대광주일정도 홍보하셨음 좋겠어요!오상진아나운서가 왜 울었는지 이해가 되네요  
20170803,1,아 따 이 거 슨 뭐 당 가??  
20170803,10,대한민국에 최승호기자님같은 분들만 있다면 얼마나 좋을까요... 항상 다큐멘터리 영화 잘 보고 있습니다. 이번에도 꼭 극장 방문하겠습니다.  
20170803,10,꼭 보겠습니다 !  극장에서 꼭 상영되기를  
20170803,10,쥐랑 닭은 정말 암살조심해야할꺼임  
20170803,10,"...기회주의자라는게 단순히 이기적인 사람이라고 생각하겟지만... 이 경우를 보면... 악한 권력의 버팀목이 될수잇는 어마어마한 ..나비효과를 주는 이기적임이라는것을 ....알수있음...여러 조직들이 잇겟지...언론, 사법, 검찰, 기업인들 등  "
20170803,10,어떤 내용일지 궁금하네요  
20170803,10,베충이들이 발광하는 거 보니 좋은 영화네요. >.<  
20170803,10,공범자들 꼭 보자구요~~부역자들이 나옵니다  
20170803,8,ㅋㅋ 포스터만 보면 이명박인데 ? ㅋ  
20170803,1,최승호 이 놈 광우병 거짓선동의 주역이 아닌가? 문재인 댓글부대 파헤치다 문베충들의 테러맞고 바로 백기투항한 전형적인 이중인격 내로남불 그 자체인 놈이 또 선동영화 만드네 ㅉㅉ 하긴 뭐 여기에 넘어가는 개돼지들이 항상 받쳐주니 뭔들 못하겠나?  
20170803,10,광우뻥 사고친거만 미화시키지않으면 걸작일듯  
20170803,10,"쥐와 닭의 적폐는 조속히 청산되어야 하며, 재미, 감동, 분노, 기대가 계속 교차됩니다.  "
20170803,10,기대가 큽니다ㅋㅋㅋ 쥐새끼와 친구들이 만드는 블랙 코미디ㅋㅋㅋ  
20170803,10,일베가 와서 별을 깎아먹는것같은데 정말정말 꼭 봐야할 영화입니다. 저번 영화도 정말 훌륭했는데 이번 영화는 포기하고 욕했떤 공영방송을 관심을 꼭 가져야 할 이유를 이해할수 있을겁니다. 뉴스타파 화이팅~  
20170803,5,별하나짜리나 10개짜리나 다 똑같아  
20170803,10,역사는 말한다. 진실은 승리한다고  
20170803,1,노무현은 영화로  영웅을 만들어버리고. 이맹박은 한순간에 범죄자로 낙인 찍어버리는. 개같은  대한민국에서 살고싶지않다.. ㅉㅉ아직도 편가르기. 언제쯤 국민성이 선진국으로 갈련지.. ㅉㅉ  
20170803,10,굿굿 꼭보세요 다들~!!!  
20170803,1,"언론장악 갑은 대중이, 무현이가 절정이었지^^미국산 소고기  수입반대하면서 정권초기떄부터 촛불시위하고 언론은 온갖 거짓말들 쏟아내놓고 시민들 속여놓고 이제와서 탄압했다고 영화찍노??이중성보소 어휴.  "
20170803,10,최승호  피디님 응원합니다!!  
20170803,10,여기가 벌레가 1점 달고 있는 그 곳인가요?  
20170803,1,광우뻥 씹선동이었던건 인정하냐? 오히려 국민들 개돼지로 알고서 눈 가리고 귀 막는건 좌파 정부 아님? 개이버만 보더라도 현 정부에 불리한 기사는 메인에 걸지도 않고 어디 처 놀러가서 악수하고 다니는 것만 주구장창 찍어올리는거나 좀 따져봐라 좀비색갸  
20170803,1,편협한 사람들이 많네요 현정부에 아부하고 싶어서 전정부 전전정부 까시나요 객관적으로좀 삽시다 !!  
20170803,10,부패한 권력의 방송 장악이 다시는 일어나선 안됩니다!!!  
20170803,1,별 한개도 아깝다. 뇌물현 개븅딱쉐리가 잘나가던 영웅시대 외압넣어서 종영시킨건 착한 언론탄압이냐 18색들아??  
20170802,1,미국산 소고기 잘 쳐먹으면서 광우병 선동당한 사람들이 이 영화를 보고 정신 차려야합니다. 광우병가지고 OO하면서 종북하고 북한비판 하지않은 빨갱들이 얹론에 있습니다. 이 영화로 발끈하면 그 실체일겁니다  
20170802,10,정말 감명깊었습니다! 처음엔 아빠가 억지로 보게하셔서 봤지만 정말 좋은 영화였습니다.  
20170802,1,"아니 어떻게 된게 이 나라는 영화가 한 쪽으로 치우쳐진 영화를 공공연하게 개봉을 하냐? 이딴 정치병 걸린 영화는 정치병 걸린 애들끼리 영화관가서 보든가  이러니까 영화산업 발전이 없지 정치병, 애국, 범죄 아니면 영화를 못만듬  "
20170802,10,명박아 가자 503 옆으로  
20170802,9,자백과 함께 다큐멘터리 영화로서의 가치가 높다.  
20170801,10,꼭 보러가겠습니다. 기대됩니다.  
20170801,10,"시사회 때 영화를 보는 동안 가슴이 답답했습니다.이제 주변환경도 많이 바뀌었으니, 공공한 보도, 진전한 언론을 볼 수 있으리라 생각됩니다. 이게 그렇게 어려운 일은 아닌데 말이죠.  "
20170801,10,좋습니다. 박근혜는 물론이고 김대중 노무현에 관련된 이런 다큐 기대해봅니다  
20170801,10,꼭 보겠습니다!!용기있는제작 감사합니다MB곧감방행이겠지요  
20170801,10,보고싶네요 어여~꼭 보겠습니다  
20170801,10,명박이는 죄를 숨기지마라  
20170731,1,이런 정치사이비 선동영화 슬슬 지겨워 지려고 한다.  
20170731,1,소고기먹으면 머리구멍나서 OOO고 선동하던사람들 지금 그램그램에서 소고기먹고있다죠ㅋ  
20170731,10,"시사회 현장에서 많은분들이 공영방송을 지켜내려는 PD, 기자, 엔지니어 분들의 노력에 함께 감동하고 눈물을 흘렸습니다. 정권은 교체됐지만 공영방송과 방통위에는 아직까지 지난 정권의 잔재들이 남아있습니다. 4대강, 세월호, 최순실사태를 은폐한 공범자들!  "
20170731,10,시사회를 봤는데 정식 개봉하면 지인들과 다시 볼 생각입니다. 현재진행형인 실화라는 점에서 많은 사람들이 올 여름 꼭 봐야할 영화로 강추합니다. 블랙코미디 요소가 곳곳에 있어 지루하지 않고 재미(실소 만발)도 있어요.  
20170730,1,그래서 광우뻥은 무슨 의도로 허위사실유포해서 만든건데? 그거부터 밝혀봐라  
20170730,10,"우리 나라 언론의 모습을 알지 못했는데, 비로서 알게되었네요  "
20170730,10,시사회 봤습니다. 참 부끄러운줄 모르는 인간들. 어처구니 없는 발언들 ㅋㅋㅋㅋ 아오  
20170730,10,"영화적으로 너무 훌륭! 기승전결이 완벽하고 지금의 현실을 알기쉽게 시간순으로 말끔하게 전달, 결코 과하지않으면서도 울컥하게 감정의 흐름을 만든다. 노련한 연출이 돋보이는 수작! 내용적으로도 강추! 그곳의 '사람'들이 마음에 남는다  "
20170730,10,손바닥으로 하늘을 가릴 수는 없습니다. 적폐청산과 훼손된 정의를 바로세우는 일에 큰 역할을 할 것임을 믿어마지 않습니다. 끝까지 응원하겠습니다!!  
20170729,10,"시사회 볼 수 있어서 감사드리며 8월에 다시 보겠습니다,단언컨대 명작입니다~  "
20170729,9,오늘시사회다녀왔습니다우리아이들의미래른걱정하신다면꼭보셔야하는영화  
20170729,10,많이. 울고. 많이 웃을수. 있습니다.  가끔. 쥐랑. 닭이. 등장하니. 조심하시구요. 너무. 재밌습니다  
20170729,10,넘치는 감동! 꼼꼼한 기록 !  
20170729,10,장악당한 언론에 세뇌당하면서 그들이 원하는대로 믿고 행동하지 않도록 애써왔는데 모두들 어떻게 우리가 당했는지 제대로 알았으면좋겠다 뉴스타파 화이팅  
20170729,10,아..이X박 ...진짜..나쁘다..  
20170729,10,시사회에 다녀왔습니다. 친구와 함께 한번 더볼 의향이 있습니다. 보는 내내 화가 치밀어 올라서 마음을 자제하느라 힘들었네요. 그정도인줄 몰랐던. 젊은이들도 젊은이이지만 어르신들께서 더 보셨으면 합니다. 아무래도 그런 시대를 오랫동안 실아오셨으니까요.  
20170729,10,"그들은 어떻게 언론을 장악했나? 어떻게 공영방송을 믿지 못하는 방송으로 만들었는가? 정말 다큐영화가 맞는지 의심되는 재미, 영화내내 질문하지만 대답하지 않는 그분들 클라스 개꿀잼 ㅋㅋ 영화도중 동물이 나온다면 야유를 저질러도 좋습니다 뉴스타파 화이팅!  "
20170729,10,얼마전에 뉴스타파 회원으로 시사회다녀왔어요 재미와 감동. 대단한 뉴스타파!  지인들과 다시보러가겠습니다 오늘 감독님과의 대화도 큰 선물이었네요  
20170728,10,100여분에 보는 10년의 흔적~!!  
20170728,10,고생많으셨습니다. 좋은 결과 있으면 좋겠습니다.  
20170728,10,불법은 뻔빤하고 성실하고 끈질기다..  
20170728,10,"말티플렉스 극장을 장악한 <군함도>에 버금가는 블록버스터 다큐 <공범자들> 대단한 다큐입니다. 감동, 치열, 눈물, 희망 모든 것을 만나볼 수 있습니다. 꼭 보세요^&^  "
20170728,10,너무 훌륭한 영화! 꼭 대박나길!  
20170728,10,액션 저널리즘이라는 새 지평을 여신 최감독님ㅋㅋ 이번껀 확실히 더 감독으로 성장 (?) 하셔서인지 웃음이 터지는 부분들이 많았습니다 ㅋ 마지막 MB컷까지 짱~  
20170728,10,시사회 와서 영화 봤는데 진짜 엄청 재미있네요. 다음에 부모님 모시고 또 볼 생각합니다. 빨리 개봉 했으면 좋겠네요 감독님 계속 영화만 찍어도 될 것 같습니다.  
20170728,10,시사회에서 보고 왔습니다 또또 볼래요  
20170728,10,"한국언론의 진실.이명박,박근혜,세월호 그 모든 것의 뒤에 있는....  "
20170728,10,어제 시사회 다녀 왔습니다. 꼭 보고 알아야하는 사건을 묵묵히 다루는 묵직한 다큐입니다. 김민식 PD의 열연이  돋보였습니다.  
20170728,10,"시사회에서 봤는데 우리나라 언론에 대해서 정확하게 알게 됐음, 꼭보세요  "
20170728,1,이런 영화 짜증난다. 광우병 소동 언론은 책임졌냐?  
20170728,10,뉴스타파회원초청시사회보고왔습니다. 우선 최승호감독님 수고하셨고요... 깨어있는 분이시라면 꼭 보시길 바랍니다.  
20170728,10,어제 시사회 잘 봤습니다. 공범자들을 많은 사람들이 봐서 국민 여론을 통해 김장겸과 고대영이 스스로 사장 자리를 그만 두기를  바랍니다.  
20170728,10,"어제 시사회에서 영화를 봤습니다.재미, 감동, 분노, 기대가 계속 교차됩니다.최대한 많은 분들이 보셨으면 좋겠습니다.  "
