0,1,2
20170812,1,언론장악이나 스크린장악이나  다를게 무엇??ㅋ 제발 영화로 물타기 그만하자 가뜩이나 볼것도 없는데  정권 바꼇다고 이런영화만 주구장창 나오네  
20170812,10,"시사회 때 보고 왔습니다. 이영화 꼭 개봉해서 많은 분들이 보셔야 합니다!! 왜냐면 이영화를 적폐 집단들! MB, 박근혜 부역자들, 친일 들이 싫어하기 때문입니다. 우리나라 정권의 민낯을 그대로 드러낸 영화!! 꼭 보십쇼!!  "
20170812,10,와 하단에는 알바 쓰레기들이 짜고 1만 줬네 그래 어디 해봐라 근본없는 OOO기들 부모가 참 자랑스러워 하겠다  
20170812,1,글쎄요... 광우뻥은 전국민이 다아는사실인데  
20170812,1,언론장악은 요즘이 더심하지 않냐? 완전 땡문뉴스인데...  
20170812,10,죄를 지었으면 죄값을 받아야  공명정대한 세상 아니것습니까..  
20170811,10,자백 정말 잘 봤어요. 피디님의 용기에 정말 응원을 보냅니다. 이번영화도 저번 영화정도의 퀄리티만 뽑아도 돈이고 시간이고 다 값질 거 같아요ㅕ.  
20170811,1,노무현 처럼 자살이라도 해야 묻히지  
20170811,10,오우 굿굿...  기대된다  
20170811,1,ㅅㅂ 진짜 적당히들좀하자 정권바꼇다고 날뛰는 모습들이 과거 김대중이 정권잡고 전라도놈들이 벼슬이라도 된 마냥 엣헴거리면서 다니던게 기억나네 뭐든지 적당히들좀해라 어차피 니들한테 다시 돌아오는 화살들아니냐? ㅋㅋㅋ  
20170811,1,선동영화들이 판치는군요  
20170811,1,감독이 빨강이 한걸레신문기자 퉷퉷!  
20170811,10,진짜 얼마나 꼬리에 꼬리를 물고 연관된 쓰레기들이 많을까..위에서 까라면 까야겠지만 진짜 바퀴벌레같이 윗대가리 쳐내도 계속 나올꺼다..그래도 바퀴벌레들은 죽여야지..윗대가리부터!!  
20170811,10,기대됩니다.꼭관람할게요.  
20170811,1,미국산 소고기 먹으면 광우병 걸린다고 외치시던분들은 코스*코 안가시나요 쉨싘버거 가지마세요. 위험합니다^^  
20170811,1,캬 ㅋㅋㅋㅋ 진짜 좌좀들 대단하다 이명박대통령까지 까네  진짜 니넨 암보다 더한 존재다  
20170811,10,법원은 상영금지가처분신청을 속히 기각하라  
20170811,10,대한민국에 사는 노예 놈들이 좌파거리며 놀고 자빠졌네 니들은 그러면 돈을 주냐? 땅을 주냐? 알바비로 몇 만원이나 받냐? 돈 몇 푼에 양심을 판 드러운 놈들아  
20170811,1,우리나라 미디어는 이제 좌경화됐다 영화계는 노무현 미화에 광주미화 이젠 대놓고 이명박죽이기 영화까지 나오네 개돼지들이 우습지?  
20170811,1,미국산 소고기 먹으면 죽는당깨요!!  
20170811,10,진실은 반드시 승리한다!  
20170811,10,시사회로 관람하고 왔습니다. 꼭 보세요. 모든 면에서 완벽한 영화  
20170811,10,영화 관계자분들 고생하셨습니다! 이제 바로 잡는일만 남았네요  
20170811,10,공범자들 꼭 보세요!!!  
20170811,1,"광우뻥 사태로 시민들 선동하던 언론들, 아직도 정신 못차렸지ㅉㅉ  "
20170811,10,좌파하고 선 긋는 인간들 좀 이시대에 뒤떨어짐. OO 같은 논리임. 잘못된거 고발하는데 우파좌파가 먼 논리냐?잘못된건 잘못된거다.  
20170811,10,"하늘이 알고 땅이 알고 이 나라 주인인 국민이 아는 슬픈 대한민국의 지난 10년이 고스란히 담겨져 있어, 깊은 슬픔과 더불어 그만큼 더 크게 바로잡힐 대한민국을 희망해보게 하는 영화입니다. 교과서처럼 전국민이 보고 알아야 합니다. 흥행 기원합니다.  "
20170811,1,지질이도 울궈먹는다. 피해자 코스프레도 좀 적당히.  
20170811,10,시사회에서 관람했습니다.  언론이 무너지는 과정과 아픔.   방송이 역할을 못 하는 상황에서 꼭 필요한 영화네요.  언론의 정상화를 위해 관심을....  
20170811,1,"이건뭐,,, 말이안나온다  "
20170811,10,부산에는 왜 상영관이 없나요부산에도 상영해주세요~  
20170811,10,"어제 시사회에서 봤습니다. 보는 동안 끓어오르는 울화, 울컥이는 슬픔을 억눌러야 했습니다. 공영방송 살립시다.  "
20170811,10,"엠비씨, 케이비에스 그동안 망가질때까지 뭐했냐고 원망하는 마음이 있었지만 이 영화를 보고나니 이런 오해가 풀리고 미안해지더군요.. 보다 나은 사회를 위해서 이 영화를 보는 것도 적지 않는 힘을 보태는 거라 생각합니다. 재미도 있습니다.  "
20170811,1,시민 선동하는 영화 또 나왔네. 이런거 좌파나 잘 모르는 사람들이나 애들이나 보지 누가 돈주고 보냐. 전 재통령인 전두환 회고록은 안되고 이런 선동 좌빨 영화는 개봉 할려하고 민주주의 맞나? 미국산 쇠고기 광우병도 다 뻥이고 선동이라는거 판명 났지.  
20170811,10,국민의 방송을 망가뜨린 공범자들..반드시 응징해야!!  
20170811,10,언론이 질문을 못 하게 하면 나라가 망해요!! 언론이 질문을 못 하게 하면 나라가 망한다고... 그래서 지난 겨울에 우리는 망할뻔 했다.  
20170811,1,그렇게 만들게 없냐  적당히좀해라  
20170811,10,최승호 피디님 정의는 승리합니다. 수고 정말 많으셨습니다.  
20170811,10,영화가 좋았으면서도 적지 않은 충격을 받았습니다. 특히 자신들이 언론을 망쳐놓고 서로에게 책임을 떠넘기는 모습이 우습기도 했고 특히 '제2의 김재철'이라고 떳떳하게 말하는 김재철 전 MBC 사장은 이 영화에서 웃음을 담당하십니다  
20170811,1,적폐가 정권잡고 빨개이 영화 줄줄이 나오네 ㅋㅋㅌ  
20170810,10,꼭 봐야 할!!! 꼭 이뤄야 할!!!  
20170810,10,"방금 시사회보고 왔어요. 마음이 너무 아프네요. 최승호감독님 감사합니다. MBC, KBS 해직언론인과 현재도 외롭게 투쟁하시는 분들 힘내세요. 함께 하겠습니다. 이용마 기자님 부디 쾌차하세요 ㅜㅜ 마지막으로 김장겸은 물러나라!! 고대영은 물러나라!  "
20170810,10,김장겸은 물러나라!!! 고대영은 물러나라!!!  
20170810,10,이 영화로 언론 적폐 청산이 조속히 이루어지길 바랍니다  
20170810,10,최승호 감독님이닷! 전작에 대한 기대 때문인지 이 영화에 대한 기대가 많이 되네요.  
20170810,10,다들 꼭 봤으면 하는 영화~~  
20170810,10,시사회에서 보고 느낌은 언론이 건강해야 나라도 건강하다라는걸 느끼게 되는 영화였습니다나라가 몇명에 의해서 노예가 될수 있다는 걸 알게 해 주는 영화라 생각합니다....국민인 우리가 스스로 깨어야 합니다  
20170810,9,진실을 알게되었습니다.  
20170810,10,여기서 또 거짓말로 언론플레이하는 인간들은 뭐냐? 아직도 mb알바하냐? 닭이랑 쥐시끼 잡아야지. 국민들 등쳐먹고 버젓이 있는것이 원통하다.  
20170810,10,이건 영화 주제만 봐도 10점 만점이지.  
20170810,9,이명박근혜같은놈들이 제발 대통령이 안되게 좀 해줘라...자유한국당이 뿌리가 뽑힐때까지 두번 다시 대통령이 나오면 안된다.  
20170810,10,적폐언론 그리고 mb. 뿌리뽑아야 함  
20170810,1,"정의가 어쩌고 민주주의가 어쩌고 하는 사람들은 쥐박이,503이 언론장악 시도한건 적폐청산 이러는데 김대중 대통령이 언론장악 시도한거랑 노무현 대통령이 국정원 이용해서 댓글알바+뒷조사하고 광우병 선동으로 이명박 매장하려한 사건은 듣기싫어 하더라고요  "
20170810,10,만수무강해서 감옥 벽에 똥칠 할때까지 살아라 ㅋㅋㅋ  
20170810,1,노무현식 언론탄압은 어디로?  
20170810,10,우리가 꼭 봐야하는 영화 강력추천합니다. 김장겸은 물러가라 고대영도 물러가라  
20170810,10,최승호 감독님의 멋진 행보 응원합니다!!!  
20170810,10,정권의 앞잡이들 물러나길 간절히 희망합니다. 공범자들 부디 흥행하십시오. 상영금지는 말도 안됩니다!  
20170810,10,독과점 하지말고 이런영화좀 상영관수좀늘렸으면 ..상영관수봐라 와.. 보고싶어도 특정지역만볼수있고 하루1번 상영일수5일? ㅋㅋ 참 ...  
20170810,10,이제 명박이도 근혜곁으로 보내줘야합니다.  
20170810,1,OOO기 날조 영화는 개봉도 하지마라.  
20170810,6,노무현은 띄우고 이명박때무턴 싸잡아 비판만하려는 전략영화같네요. 이명박도 처벌받아야한다고 생각합니다만 앞으로 다양한 시점으로 볼수있게 만들었으면 좋겠습니다  
20170810,10,"아직관람전이지만 줄거리만 봤을때 대한민국 국민이라면 꼭봐여하는 다큐같네요. 우리나라 비리보도,은폐,돈,권력의 진짜 진실이 무엇인지 꼭파헤치고 국민 누구나 알았으면 합니다. 맨날 답답하게 속고만 사시지마시고.  "
20170810,10,권력의 하수인들의 앞잡이들의 추악한 행태와 뻔뻔함과이땅에올바르고 정의로운 세상을 만들어가려고 고군분투하는 언론인들이 대비되었던 모든 국민들이 보고 실상을 알고 그들을 격려했으면 한 감동의 영화 한편임  
20170810,10,베충이 엠OO따까리들땜에 평점올린다  
20170810,1,"악마 인간이 만들었네....광우병, 세월호로 트집잡아 정치 공격하는 건, 공산주의자들 생각나게 하더라. 자신들의 목적을 위해선 더러운 짓(집회, 데모, 폭력,)도 마다하지 않는  "
20170810,1,이게 영화냐 ....?  
20170809,10,상영관 좀 늘려주세요국민들은 알 권리가 있습니다!  
20170809,10,엠OO 사장 갈아치우자  
20170809,10,등장한  쓰레기출연자들  이름  꼭 정리해서 기억하겠습니다  진짜  뻔뻔한  mbc    쓰레기 검사들  권력에  아첨한  언론인들  
20170809,10,일베충 새끼들 평점테러 존나게 해대네 ㅋㅋ  
20170809,10,기대합니다. MB와 발근혜 덕분에 청산해야 할 사회의 폐기물들이 명확하게 드러났습니다. MB와 발근혜에 감사할합니다.  
20170809,1,좌좀의 좌좀을 의한 좌좀에 위한~ 꺄 좌뽕!!  
20170809,1,한쪽은 미화하느라 바쁘고 한쪽은 똥물 씌우기 바쁘네 ㅋㅋ 이런 명언이 있지젊어서 진보가 아니면 심장이 없는것이고 나이들어 보수가 아니면 뇌가 없는 것이다부디 25세 이하인 사람들이길  
20170809,10,꼭 보세요 최고의 영화입니다  
20170809,10,엠 OO은 반드시 사라져야 하고 공정한 mbc로 다시 태어나야 한다.  
20170809,1,그거 아냐? 지금 매스 미디어에서 떠드는 것 또한 언론 장악에 정치보복 이라는거? 하여튼 매번 속는건 불쌍하고 힘없는 국민이다.  
20170809,10,대한민국 국민이라면 대한민국 언론 장악을 바로 알려면그리고대한민국 희망을 간절히 바란다면반드시 봐야 할  영화  
20170809,10,MB는 이 영화를 보고 인생 회개하길...  
20170809,10,왜 우리가 방송3사의 뉴스를 안보는지 알수 있게 해주는 영화  
20170809,10,한번보고 두번보고 열번봐도 눈물이 날‥ 넘넘 슬픈영화입니다. 보고나서 다시 얘기좀 합시다. 상영금지 가쳐분이라니‥ 어의가 없네‥ ㅜㅜ  
20170809,1,좌빨들이 지 맘에 안드니까 방송사 점령하려고 만든 영화  
20170809,1,ㅋㅋㅋㅋ OOO기 영화  
20170809,9,이런 영화를 통해 대한민국을 바로 보게 되네요.  
20170809,10,시사회 보고 화가 나서 잠을 설쳤습니다많은 분들이 다 보셨으면 합니다  
20170809,1,"이명박은 훌륭한 대통령이다,평범한 직장인으로시작해 대통령된 대단한 인물이며,좌파들 선동의 피해자일뿐,얼마나 물고 뜯었던 청계천,버스환승제 그리고 이제 4대강까지 너무도 옳았다는것이 증명되고 있다,대운하했었으면 한국도 관광대국 되었을것  "
20170809,9,"포스터 참 기가막히네~~MB  ?,,ㅋ  "
20170809,10,우리가 하는 일이 무슨의미가 있을까요? 그래도 이렇게 기록을 남기는 것 자체가 의미가 있다고 봐요. 그 울림이 가슴에 남았습니다. 시민을 깨우는 언론이 시민을 대변하는 소리가 되어주셔서 참 고맙습니다. 그 시절 잘 견디어내 주셔서 고맙습니다.  
20170809,10,평점 테러 봐라  키키 쓰레기들  
20170809,10,코믹 잔혹 스릴러/기대 했던 것보다 훨씬 재미 있습니다.  
20170809,10,이명박근혜 이명박근혜  
20170809,10,오늘 공범자들 시사회 다녀왔어요~~정말정말 강추입니다....직접 보셔야해요 이건 진짜진짜루~  
20170809,1,타이밍 참 정치 보복으로 밖에 안보임  
20170809,10,단원고 학생 전원구조?! 이게 언론이냐? 기레기..티비에 나오는 뉴스가 전부인줄 알고 살았덕 나.반성합니다  
20170808,10,꼭 봐야할 영화! 꼭 이루어야할 일!  
20170808,10,역시 이곳은 비공감 쳐 누르느라 바쁘구나.  
20170808,10,꼭 봐야지 엠빙~~~싄  
20170808,1,좌파 선동영화 공산국가와 다를것이 무엇이냐?  
20170808,1,알바놈들이 북적북적한다  
20170808,10,안봐도 10점만점!!!!  
20170808,10,이명박이명박이명박이명박  
20170808,1,쓰레기 프로파간다..1점도 아깝다  
20170808,10,드뎌 개봉을 하시는군요. 우리나라 언론들 정말 썩었습니다. 당신의 용기에 큰 박수를 보내 드립니다.  
20170808,1,대통령 바뀌니깐 이딴영화수도없이 나오네  
20170808,1,광우뻥 장본인이 할짓이냐 이게 ㅋㅋ PD수첩 조작질 ㅋㅋㅋ  
20170808,10,극장에서  개봉이나  해줄지...  
20170808,10,이런 다큐 영화가 왜 상영관이 이리도 없는지..  
20170808,10,최악의  OOO기 양아 입증 MB  
20170808,10,시사회 잘 보고 왔습니다~최승호 감독님 화이팅요~  
20170808,10,보고싶네요. 친일 잔당 빨갱이 전두환의 똘마니 이명박과 305호의 언론장악 실태를 고발해 주세요 ~  
20170808,10,생각이 참 많아지는 영화. 나만 보기 아까운 영화.  
20170808,10,미안합니다.그리고 고맙습니다.  
20170808,10,네 죄를 사하노라. 그 누가 자유로우랴. 감형을 위한 노력은 시작이다  
20170808,1,그래서 미국산 소고기 안먹니 ??  
20170808,10,"누구나 봐야할 영화.언론탄압의 심각성을 일깨워주는 영화.보고나서 감명받았고, 그동안 방관하고 살아온 것 같아 정의로운 언론인들에게 많이 미안하고 또 감사했던 영화.  "
20170808,10,최승호 피디를 국회로!!  
20170808,9,시사회 보고 왔습니다.  태극기 앞에서 알랑거리던  젊은 언론인   충격이었습니다.  엠비씨 사장 뽑으러 가며 헛소리 지껄인 고영주 정말 재미있는 장면이었습니다.  
20170807,9,"이번 최순실사태때 MBC보면 확실히 언론조작 느낌이 받긴 하지만, 광우병사태때는 언론조작이라기보단 선동에 의한 허위사실이 퍼진게 좀더 크지 않나 생각이 드는데. 그래도 언론조작에 대한 고발영화라고하니 보고싶은 생각이 듭니다.  "
20170807,10,주연배우들의 리얼한 찌질 연기가 대박입니다~넘 재미나요~^^  
20170807,10,영화관 꼭 가야겠다..  
20170807,10,시사회에 다녀왔습니다대통령만 한 분 바뀐 것일 뿐 아무것도 바뀌진 않았네요김장겸은 물러나라고대영은 물러나라이진숙도 물러나라  
20170807,10,언론개혁 우리 모두가 해낼 때입니다!!  
20170807,10,젊은세대들이꼭알고  봐야할 영화인거같아요  
20170807,10,언론인이 질문을 못하면 나라가 망한다.  
20170807,10,감사합니다.너무 멋진 영화입니다.많은 분들이 보고 느꼇으면 좋겠습니다.  
20170807,10,세상이 바뀌고정권도 바뀌고과연 우리 언론은 언제쯤 바뀔지... 말로만 기레기니 쟤들은 저렇지 하지 말고 시천하는 우리가 되어야 할 것입니다.  
20170807,10,대전 시사회우리 사회의 슬픈 자화상이지만희망의 불씨  
20170807,10,고생 많이 하셨습니나. 반듯한 언론인들이  있어 든든합니다. 결코 기록으로만 끝나지 않게 홍보 열심히 할게요^^  
20170807,10,최고의영화 꼭 봐야할 영화  
20170807,10,투쟁해 오신 언론인 너무 멋지십니다. 언론인에 대해 존경하는 마음을 가집니다.  
20170807,9,암흑속에서 침묵하지 않았다는 것 가슴에 남습니다  
20170807,10,체계적이면서도 흥미로운 영화! 영화적인 면에서도 훌륭합니다. 강추!  
20170807,10,진실은 밝혀야 한다!!  
20170807,2,10년간 방송의 몰락엔 jtbc 포함이겠쥬^^  
20170807,10,버1충이들 ㅂㄷㅂㄷ 우르르르 쿵쾅쿵쾅 .버러ㅈ1들이 목숨이 징글징글하긴해?ㅋㅋ  
20170807,10,꼭 볼게요! 힘내세요!  
20170807,1,ㅉㅉㅉ 하는짓이 이명박근혜랑 똑같네   정당한척하지만 결과적으로 똑같은짓하는 정치쇼  
20170807,1,문재인이 지금언론장악해서 종북짓거리하는게 더 문제인거가튼데  
20170807,1,이명박이 얼마나 해먹었든간에 그거 감안해도 노무현보단 나았어서 1점드리고 갑니다  
20170807,10,쥐박아 같이보자~~~~  
20170807,10,만나면 좋은친구! MBC 문화방송!  
20170807,10,많은 상영관에서 만날 수 있길 기대합니다.  
20170807,1,광우병 선동했던 것들이 사죄는 못할망정!!!! 쓰레기 영화  
20170807,1,광우뻥에 대한 사죄는 없네  
20170807,10,그냥 10점드립니다. 문재인정부나 되니까 그나마 이런영화가 나오네요. 문재인 대통령을 찬양하지는 않지만 그래도 긍정적인 변화입니다!  
20170807,10,자백이후 또 다른 최승호의  걸작  
20170807,10,꼭 보러갈게요ㅋㅋㅋmb 당황하는 표정ㅋㅋ너무 리얼해  
20170807,10,꼭 보고 싶어용. 모두모두 영화보고 언론을 바로 세우는 감격의 그날을 만듭시당.  
20170807,10,"VIP시사회에 다녀왔습니다. 근래에 들어 군함도, 택시운전사, 공범자들 세 편을 일주일 사이에 보았는데 가장 울림이 컸던 영화였습니다. 적극 추천합니다. 꼭 보셨으면 좋겠습니다.  "
20170807,1,un참전용사분들 어떡해  
20170807,10,기대가 되네요~ 그동안 몰랐던 진실의 문이 열리는것 같습니다.  
20170806,10,꼭 보고 싶습니다! 어떤 내러티브로 구성되었는지 기대가 되네요  
20170806,1,애초에 언론탄압을 한 이유가 광우뻥 사건 때문인데 거기에 대한 언론의 반성도 없다  
20170806,10,최승호 PD 님은 언젠가 유력 정치인이 되어 방송통신계를 정화시키는 멋진 분이 되시실 바랍니다.  
20170806,10,이런건 꼭 봐야지!!!  
20170806,10,4대강이 좋다고 난리래 ㅋㅋㅋㅋ 최승호 피디님 이따위 댓글은 개무시하시고 영화 대박나길 바랍니다!! 개봉하면 저도 꼭 보러 갈께요  
20170806,1,문재인이빨갱이가되니까별쓰레기같은영화가다나오네.  
20170806,1,뭐 4대강을 까발려? ㅋㅋㅋ 4대강 지금 좋다고 난리인데 뭘 까발려 지들이 거짓선동 해서 국가 전복 시킬려고 그렇게 개짓거리 해놓고 광우뻥선동 4대강 선동 해서 국가를 개박살낼려고 해놓고 무슨 개짓거리냐 이딴게 무슨  
20170806,10,진실은 감춰지지 않아요  
20170806,10,적폐청산 해야한다!!!  
20170806,10,와 진짜 다큐멘터리 영화가 이렇게 기대되는 건 처음이네  
20170806,10,명박이는아주아주나뿐짓해도뻔뻔하게연금받으면서잘산다어굴봐라살이붙어서반질반질하다이제그만죄값받아야지 지금감방들어가서90살되서나와라  
20170806,10,"""자백"" 재밌게 보았습니다.  ""공범자들"" 또한 무척 기대됩니다.  "
20170806,10,영화 너무 궁금합니다.  
20170806,10,죄를 지었으면 벌을 받아야지  
20170806,10,평점 장난이 보이네요.기대합니다.  
20170806,10,최고의 영화 추천합니다  
20170806,10,와 진짜 아직도 깨어있는 사람이 있다는게 희망이 있다 아직도 ..  적폐청산 해봅시다 정말로 제발제발 이제는 나라다운 나라에서 내자식 살게 해줄꺼다 ..  
20170806,10,이런 영화라도 나와야지  
20170806,10,대박대박 평점낮추는 새끼들은 매국노냐?? 걍 두ㅣㅣㅣ져 쓰ㅡㄹㅔ기들아  
20170806,3,지금 문씨가 언론장악한건 어찌 보시는지 궁금하네요 ^^  
20170806,1,하여간 좀비 ㅅㄲ들ㅉㅉㅉ  
20170806,10,한국인이 꼭  봐야할 필독 다큐영화  
20170806,2,아니 웃긴게.. 서울시장 했다고 좋다고 지들이 뽑아놓고.. ㅋㅋ 웬 OO들인지 모르것네유..  
20170806,1,언론은 지금 죄앙이가 장악하고있다..노무현이가 언론장악한짓 똑같이 한다..준용이와 노무현 뇌물재수사부타 먼저다  
20170806,1,전라도 하루 빨리 독립되길 바랍니아.  
20170805,1,mb의 방송장악은 잘못이지만 광우뻥 선동한 mbc는 없애는게 맞음.. 2008년에 25년전 1980년대 영국에서 만든 광우병 다큐를 방송하는게 말이되냐?  
20170805,10,방송을 되찾고 MB를 잡아족치는데 힘이 될 수 있다면 내 돈 내고 가서 꼭 보겠다!!  
20170805,10,공직자는 더 엄하게 끝까지 잡아서 엄벌합시다!  
20170805,1,그럼 미국산 소고기 먹으면 광우병걸려 죽는다는 말도안되는 거짓보도를 계속 해야했다는거임? 미친 말도안되는소리하고있네;  
20170805,1,"왜 김대중이가 언론 장악하고 부산 SBS 영남출신 간부 죄다 호남 사람으로, 심지어 사람이 없으니까 계장을 부장으로 발령하는등 좌파가 방송 장악한것에 대해선 아무 액션이 없지  "
20170805,10,김장겸은 물러나라 제발 좀  
20170805,10,쥐를 잡자 쥐를 잡자 찍찍찍!  
20170805,1,'미국산 쇠고기 문제로 큰 타격을 입자...' ? 여기서부터 뭔 멍멍이 소린지 모르겠네. mbc에서도 사과하고 ㅆ선동 국가적 개망신&손해 였던거 모름? 친북반미 국가전복 세력 나와서 활개치고 다닌게 아직도 눈에 선한데 뭔 ㄱ소리  
20170805,1,광우뻥 선동은 언론과 미개한 개돼지들의 졸작품이지ㅋㅋ 허위사실로 국민을 공포에 떨게 했으니 탄압 하는게 맞지. 광우뻥 잠재기는 20년이라고 아직도 ㅈㄹ하려고 ㅋㅋㅋㅋ? 그 당시에는 10년이라고 하던데 ^ㅅ^? 광우뻥 이야기는 지우고 다시 만들어라  
20170805,10,꼭 !!!  보구야 말거야!!!  
20170805,10,역시 영화보다 현실이 훨씬 재미있네요. 필독 영화입니다.  
20170805,10,승호형을 헐리우드로~!  
20170805,1,아주 정부바뀠다고 난리를 치네  
20170805,10,"꼭!!흥행하길바랍니다,,,알아야할 사실!!  "
20170805,1,내평점글왜자꾸삭제시키는거야 ?  
20170805,10,최pd 님 정말 대단하십니다..아니땐 굴뚝에 연기 맞습니다..  
20170805,10,10년동안 그곳에서 치열하게 싸웠던 많은 이들에게..이제부터는 우리도 함께하겠습니다!!  
20170805,1,망둥이 감독들이 뛰니까 꼴뚜기 감독들도 뛰네  
20170805,1,공정한방송 MBC를 지켜내자!!!! 편파좌빨방송은 SBS가 하잔아ㅡㅡ  
20170805,10,국민들 농락한 대통령들 처벌받아라  
20170804,1,듣보잡 입진보 감독들 이때다 싶어 쓰레기 양성해대는구나  
20170804,10,"언론이 우리에게 왜 중요한지, 그것들을 어떻게 망가뜨려왔는지...우리가 앞으로 어딜 주목해야하는지를 알수 있다. 이용마 기자님 쾌차하셔서 좋은길도 함께 걸으셨으면 합니다  해직언론인 모두 좋은 세상 함께 하는 그날까지!  "
20170804,10,"방금 시사회 다녀왔습니다. 다큐지만 웃긴장면도 많아요. 영화보는 동안  웃고, 울고, 감동받고, 미안하고, 고맙고. . . 많이 느끼고갑니다. 해직언론인들 당신들은 나의 영웅들! 늘 감사합니다. ^^  "
20170804,10,오늘 시사회를 통해 보았습니다. 자백에 이어 깨어있는 시민들을 위한 영화라고 생각합니다. 최승호감독님 그리고 고생하신 많은 관계자분들 응원합니다!  
20170804,10,언론이 바로서는 나라...  
20170804,10,광우뻥은 그렇다 쳐도 이명박정권때부터 제일 신뢰가 가는 공영방송 언론장악한건 팩트잖아. 그리고 이영화의 포커스도 언론장악에 대한거고;  일베충들 좌파좌파거리면서 쌍팔년도때처럼 편가르기땜에 10점준다.  
20170804,1,노무현 시계! 밝혀져야합니다.  
20170804,10,쥐박아 빨리  깜빵가자 이왕이면 닭대가리랑  합방해라ㅋㅋ  
20170804,1,PD수첩에서 광우뻥으로 선동하다 짤린게 무슨 정의인척 저러는지 참 ㅋㅋ  
20170804,10,노무현입니다 다음으로 또 기대되는 작품입니다  
20170804,10,지난 세월 쌓여온 의혹이 풀리게 될까요?  
20170804,10,세뇌당한 수구골통들아~니들은 꼭 보고 참회하고 숟가락 놓자~  
20170804,2,딱봐도 정치선동 쓰레기 영화  
20170804,1,어휴 빨갱이새끼 그냥 북한으로 제발 꺼져라 꼴도보기싫다 전쟁나서 다 죽었으면  
