0,1,2
20170728,10,"시사회 를 봤습니다. 자백 볼때는 우울하기만 했는데, 공범자들은 마냥 우울하지만은 않았습니다. 세상이 바뀐 탓이겠죠. 한편의 다큐영화로 보자면 몰입감있게 아주 잘 만들었습니다. 보시면서 함께 아파하고 함께 웃으시면 좋겠네요. 돌마고 화이팅!  "
20170728,10,"시사회에서 관람했구요. 10년동안 kbs, mbc 등 내부적으로 이렇게 조직적으로 일이 진행된 줄 몰랐었네요.. 슬픈 사연들도 많았고 중간중간에 최승호 PD님 보여주시는 탐사 추적 스릴러도 압권이었습니다! 추천합니다!!!^^  "
20170728,9,시사회 다녀왔숩니다. 이명박근혜정부가 언론을 장악하는 모습이 그대로 담겨졌숩니다. 왜 국민들이 공영방송을 외면하고 진짜정보를 찾고 있는지도 알게됩니다. 이영화로 무지한 시민들이 깨어나기를 기대해봅니다. 공영방송의 민낯이 그대로 드러났습니다.  
20170728,10,어제 시사회에서 보는데 충격적이고 가슴이 아픕니다 많은 분들이 알았으면 좋겠습니다  
20170728,10,함께 분노하고 함께 웃고 마음과 마음이 모아져 시간이 어떻게 흘러갔는지 모를 정도로 몰입도가 높았습니다. 그만큼 진실과 공정함에 대한 갈망이 컸던 탓이겠지요. 산 높으면 골 깊듯 그만큼 어용 언론이 판 친 10년이기도 하구요. 희망을 주는 영화입니다.  
20170728,10,덕분에... 살만한 세상~감사합니다.  
20170728,10,김장겸은 물러나라. 고영대도  물러나라.영화공범자들 고급진 모든국민이 알아야할 봐야할 영화. 넘 재밌어요  
20170728,10,시사회를 통해 봤습니다. 대한민국 국민들은 필독인 영화입니다. 최승호 감독님. 고생하셨습니다.  
20170727,10,"시사회 보고 왔습니다. 이러한 사실들을 기록으로 남겼다는 자체가 큰 결과물이라며 생각되며, 그런 힘든 시기와 과정에서 침묵하지 않았던 언론인들에게 큰 감사와 존경을 표합니다. 하루 빨리 공영방송 및 언론이 정상화 되기를 희망합니다.  "
20170727,10,엄청 재밌습니다. 언론을 망친이들이 역사에 어떻게 남을지 상상하며 앞으로의 희망을 봅니다.  
20170727,10,시사회 보고 왔습니다. 저는 항상 공영방송을 비난해왔었는데 그 거지같은 공영방송 안에서 이렇게 많은 언론인분들이 투쟁을 해오고 계신지 몰랐습니다. 항상 응원할께요. 감사합니다!  
20170727,10,시사회에서 오늘보았는데 감동  
20170727,10,과거가 아닌 현재 진행형의 나쁜 사람들  
20170727,10,"시사회 다녀왔어요. 내용, 구성 모두 좋습니다. 진짜 꼭 봐야하는 영화예요. 최승호피디가 엠비 인터뷰하는 장면 진짜 압권!  "
20170727,10,"시사회 보고왔습니다. 발로뛰는 블록버스터 다큐, PD님이 인터뷰 시도 할때마다 사이다고 통쾌함이 묻었습니다. 많은사람들이 봤으면 하는 영화입니다.  "
20170727,10,언론의 자유를 위해 노력하시고 희생하시는 모습들에 마음이 아팠습니다~ 재미도있고 세상에대해 다시한번 생각할 수 있는 기회였습니다 !! 적극추첨!!  
20170727,10,재미+ 감동+ 분노+ 눈물 ... 감독님 영화 참 잘만드시네요. 꼭 보시길!!  
20170727,10,많이 기대하고 있습니다 아예 포기하고 외면했던 두 방송사를 이제 외면해선 안되겠다는 생각이드네요  
20170727,10,믿고보는 최승호 PD님의 영화. 재미와 감동 그리고 공익적인 최고의 영화!  
20170727,10,"시사회 봤습니다.안광한 사장 인터뷰를 위해 추격하는 최승호PD, 새로운 액션저널리즘을 개척한 모습을 보고 우슴 빵 터졌어요.  "
20170727,10,우리가 알아야 할 것들. 그동안 몰랐던 진실에 대한 영화입니다. 꼭 봐야해요ㅎ 곳곳에 숨은 재미는 보너스 ㅎㅎ  
20170727,10,지금 시사회 봤습니다. 저혈압이신 분들은 몸 건강의 밸런스를 위해 꼭 보세요. 고혈압이신가요? 그냥 보세요. 꼭 봐야합니다.  
20170727,10,넘 감동입니다. 꼭!!!보십시요.  
20170727,10,시사회 끝나고 한참이 지나도 여운이 가시지않아요...고생하셨습니다여러분 꼭보세요 모두 보세여 2번3번 더 보세요!  
20170727,10,꼭 보고싶어요 개봉만 기다립니다  
20170727,10,오늘보러가는데 기대되요~  
20170726,10,"공영방송 정상화에 관심을 가지고 있는 한 시민으로, 영화 기대하고 있습니다. 준비하시느라 고생 많으셨습니다~  "
20170726,10,키 잘못 눌러서 끌쎄요 눌름 쏘리요!!! 최승호 pd vs 이명박과의 한판승! 기대가 됩니다..  
20170726,10,믿고보는 최승호표 영화  
20170725,1,세월호참사는 비난받아다 마땅하지만 광우병은 선동맞잖아요  
20170725,1,정치병 걸린 영화가 자꾸 판치네 제작비가 아깝다 ㅉㅉ  
20170722,1,취향은 존중해 드립니다^^  
20170721,10,방금 자백을 보고 최승호피디님의 또 다른 다큐 작품이 나온다길래 너무 기대 됩니다 가슴 아픈 대한민국의 현실을 낱낱이 파헤쳐주세요 !!!  
20170718,10,오늘 부천 판타스틱 영화제에서 보고 왔습니다. 가슴이 아프기도 하고 애써주시는 분들께 너무 감사드려요. 최승호 감독님 수고하셨습니다.  
20170716,10,부천 국제판타스틱 영화제에서 관람했습니다.  현장에서 말씀하셧듯이 감독님이 의도하지 않으신  블랙코미디가 곳곳에 담겨있습니다. 강추드립니다.  
20170716,10,명박이는 깜방으로~!  
20170716,10,어제 부천국제영화제에서 봤어요. 언론10년사를 한눈에 보는. 현재진행형이라는 말이 가슴에 와닿았습니다. 생각있으신 부모님들은 아이들 데리고 가서 보세요. 중학생 이상이라면 현실 이해에 큰 도움이 될겁니다. 이것이 살아있는 교육입니다.  
20170623,10,언제 나옵니까! 빨리 보고싶습니다 . 어떠한 영화보다 흥미진진하고 스릴넘치는 다큐 기대됩니다 ~~~  
20170622,10,"유트브에서 예고편 봤는데, 완전 기대 만빵. 2!빠.  "
20170620,10,기대가 큽니다. 영광의 1빠.  
