0,1,2
20171011,8,초행길 조심하세요~~ 졸아도 안 끝나요..  
20171011,1,이거  웬 무신말인지 모르겠다  
20171011,1,정말 지루하다.. 예고편이 전부다!!  
20171011,10,"163분 실화냐 ,..  2시간 43분 킹콩이랑 비까뜨네  "
20171011,9,"명작시리즈이니 만큼 기대를 충족시켜주는 영화이고 미래 배경에 대한 부분이나 배우, 스토리에 대한 부분까지 맘에 드는 영화 단, 사운드가 과한건지 액션이 부족한건지 모르겠으나 강력한 사운드에 비해 화려한 액션이나 임팩트 있는 장면이 부족한것은 사실이다  "
20171011,1,노잼 임 ㅜㅜ ㅇㅋ 너 무 노잼임  
20171011,10,1년에 한두번 줄까말까한 별 10개 올해 처음 입니다. 취향을 많이타는 영화라고 생각되네요. 사이버 펑크류를 좋아하는 매니아라면 꼭 보길 추천합니다. 옛날 블레이드러너를 보라는 사람도 있던데 굳이 안봐도 볼만 합니다.  
20171011,9,영화 보신분들 다 전편은 보셨는지...? 내용이 이해가 안가고 철학적이여서 별로라는 분들이 있으신데 전편 2019를 봐야 이해가 가능 합니다 그리고 원래 철학적인 영화 입니다만...액션 기대하고 가신 님들이 이상한거 아닌가요? 영화 제대로 찾아는봄?  
20171011,10,두근두근 기대됩니다. 블레이드러너 속편을 몇년을 기다린건지..ㅎㅎㅎ  
20171011,7,전작도 솔직히 당시 시대를 앞선 특수효과 덕분에 고평가 받았을뿐 지루한 전개와 개똥철학 같은 메시지는 기타 SF영화와 도찐개찐이었음.  이번에도 보나마나 인간이 어쩌고 미래인류는 어쩌고 지루한 개똥철학 나불대는 영화겠지. 액션 기대하면 개실망합니다!!  
20171011,9,난 전편에 로이가 말한 탄호이저문에서 본 C빔이 뭔지??  오리온자리에 있던 전함이 뭔지도 알고싶다!!  
20171011,10,잼잇을거 같아요~ 대박 속편  
20171011,10,청년경찰 별다섯개 주고 이거 한개주는건 좀 너무한거 아닌가?  
20171011,10,해리슨포드 형님 열일하시네 ㄷㄷ  
20171011,10,전작 복습하고 유료시사로 봤는데  전작과 연결고리 찾는 재미에 대사 따라가는 묘미가 있다.. 아맥으로 꼭 다시 볼 영화  
20171011,10,극호! 영화가 주는 감동의 무게!  
20171011,9,자유자재로 폭풍같은 클래식을 지휘한다.  
20171011,10,"호불호가 갈리겠지만 어릴때 1편 보고 느낀 그 신선한 충격을 다시 받았다. OST, 영상, 미래의 묘사. 그리고 고슬링과 구글홈 미래버전의 아스라한 사랑이라고 해야할까.. 1편도 그랬지만 액션영화가 아닌 서사적이고 메시지가 담긴 영화  "
20171010,10,릭 데커드가 복제인간이면 어찌 아직 살아있는거냐? 나만 궁금한거임??ㅠㅠ;;  
20171010,1,대중성 떨어지고.. 공감이 안됨  
20171010,10,일단 빌뇌브감독연출이여서 그런지 잔잔하고 느린긴장감으로전개하기때문에 속도빠르고 액션씬계속나오는걸원하는사람들에겐 ㅈㄴ지루할수있음  
20171010,1,시간많고 돈많은사람만 보세요 내 시력이아깝네요 아 중간에 잠들기도함26년 인생중 영화 첫평점남기네;; 끝까지 꾸역꾸역봤는데도 내용 이해불가  
20171010,9,언제적블레이드러너인지... 짱 잼나네요...  
20171010,10,원작과 대비되는 부분이 많은 것 같네. 원작 한번 더 보고 보러가야지  
20171010,4,유료시사회 다녀왔습니다..음..앞부분 너무 루즈... 스케일은 커보이는데 결국.... 한명하고 싸우고 끝..엄청 허무했습니다. 스토리자체 짜임새가 못 받쳐준듯합니다... 배우들의 연기는 좋았습니다~ 특히 여배우 너무 이뻐요~  
20171010,10,프리퀄 영상들만 봐도 기대 만땅! 올 하반기 가장 기대되는 영화^^  
20171010,10,드니 영화중에 최고인 것 같다 인물들의 매력이 돋보임  
20171010,10,이 영화만의 세계관을 이해하는 사람이라면 충분히 재밌게 볼듯  
20171010,10,"참혹한 미래의 모습을 표현한 블레이드 러너만의 세계관, 2019가 그려낸 모습은 핵이었다면 이번엔 사막화가 되어버린 지구.. 무섭다..  "
20171010,10,"개,돼지들한테는 1점영화. 볼줄아는 사람들은5~10점영화.  "
20171010,5,유료시사 다녀왔습니다. 열성적인 드니빌뇌브의 팬인데 왜 이렇게 됐을까요.  2천억짜리 영화라면 기본적으로 오락성이 있어야 할텐데 아주 미흡. 호흡조절 실패에 플롯-캐릭터  / 설명 미흡으로 괜히 복잡하고 어려운 느낌입니다. 너무 큰 기대는 하지 말것!  
20171010,1,영상이 영화 공각 기동대랑 똑같음. 화면이 어둡고 대화도 느리고 매우 졸림. 공각기동대 봤을 때 처럼 시작과 잤음. 공각기동대가 재미있었던 분들만 보세요.  
20171010,6,다 좋은데 라이언 고슬링이 난 맘에 안드네  
20171010,2,유료시사회 봤어요.예고편에 속아서....전 전개가 빠른 영화를 좋아하는 사람인가봅니다. 감독 머릿속엔 여자의 몸을 아주 좋아하는 것처럼 보여요. 기대만땅하고 시사하고 기분 더러워져서 나왔습니다  
20171010,5,이렇게 지루하고 내용없는 영화는 첨이네요 ㅠㅜ  시간 아까워 죽는줄  
20171010,1,개망할삘인데 범죄도시나 봐야겄다..  
20171009,10,SF 명작의 반열에 올라갈 영화  
20171009,10,"로봇이 불쌍했다 ,....  "
20171009,10,SF영화의 또 다른 걸작을 봤다..근데 등급 15세는 정말로 이해안됨..  
20171009,9,세월이 지난 뒤의 릭 데커드의 모습이 궁금하다  
20171009,10,이 영화만을 기다린 보람이 있다 ㅠㅠ  
20171009,10,드니 빌뇌부가 주는 힘이 스크린을 가득채우네요 기대 이상이에요  
20171009,8,리들리스콧과 드니빌뇌브의 조합이라ㅋㅋㅋ 쩌는디?  
20171009,10,과연 인간이란 무엇인가? 장면 하나하나가 명장면이었다  
20171009,8,"이쯤이면 미래의 모습이 굉장히 궁금하다, 영화마다 다 다른 모습이라..  "
20171009,9,대박.. 보는 내내 넋이 나갔다  
20171009,10,"스토리와 영상미, 사운드, 배우들의 연기! 완벽한 비쥬얼에 제대로 압도당했다…  "
20171009,9,"보고시풍영화에여ㅠㅠ주말에 보려고 아껴두는중,..  "
20171009,10,"알고 보면 더 재밌는 영화, 복제인간인 리플리컨트들의 개념만 잘 이해한다면 영화를 보는데 큰 지장이 없을 듯 하네요  "
20171009,10,블레이드 러너 만큼 걸작은 더이상 없을 거다. 기대이상의 영화를 보게 될 것  
20171009,10,상영시간 길었는데 시간 가는줄 모르고 봤네요! 최고!  
20171009,10,단순한 sf물이 아니라 정말 여러가지로 대단한 영화였다  
20171009,10,배우들의 일품 연기와 감독의 멋있는 연출까지 굿  
20171009,10,30년이 넘어서 나온 속편인데도 위화감 없이 잘만들었네요 재미도 있고 여운도 있고 영화가 주는 메시지까지 너무 좋았습니다  
20171009,10,예언적인 영화였습니다 미쟝센이 장난 아니네요ㅎㅎ  
20171009,10,시종일관 빛났던 연출과 사운드!  
20171009,10,미래의 디스토피아를 묵직하게 냉정하게 잘 표현햇다  
20171009,9,멀지 않은 미래의 이야기였지만 왠지 슬픈 이야기ㅜㅜ  
20171009,8,인간보다 더 인간적인 조.. 탐욕스런 인간..  
20171009,10,오랜만에 만난 레이첼은 여전히 아름답더군  
20171009,10,길게 말할 필요가 없는듯ㅋ 올해 최고의 명작이 탄생함ㅋㅋ  
20171009,10,재미도 재미지만 많은걸 생각하게 하는 영화였어요  
20171009,10,드니 빌뇌브의 능력 정말 대단했습니다  
20171009,10,35년전 그 작품을 드니 빌뇌브 스타일로 재탄생시킴  
20171009,10,믿기지 않을 정도로 멋졌던 영화  
20171009,10,거의 3시간짜리 영화였는데 단 1분도 지루하지 않았음ㅋㅋㅋ 재밌고 메시지도 있고 의미있는 SF영화랄까  
20171009,10,완벽하게 계승한 마스터피스! 감독은 진짜 천재!!  
20171009,10,대박ㅋㅋ 1편도 다시 봐야지ㅋㅋ  
20171009,10,SF영화 = 하이테크놀로지 액션영화... 라고 생각하는 수준이면 집에서 만화나 봐라. 관객 물 흐리지 말고  
20171009,1,네... 여기저기서 코고는 소리가..  
20171009,10,정말 의미 깊은 영화였어요..  
20171009,8,단점은 런닝시간이 길다~~장점은 드뇌브 감독의 완벽한 연출~아티스틱한 무대 세팅~스토리는 나름 기승전결 있음  
20171009,10,블레이드 러너 2049 정말 잘만들었네요 아이맥스로 또 볼라구요ㅎ  
20171009,10,원작을 잘 살리면서 색다르게 잘만들었네  
20171009,10,엔딩 장면은 진짜 영원히 잊혀지지 않을거 같다ㅠㅠ  
20171009,10,무슨 말이 필요할까 그냥 좋다  
20171009,10,두번 봐도 재밌을 영화ㅋㅋㅋ정식으로 개봉하면 또 보러 갈거임  
20171009,10,보면서 감탄을 몇번이나 했는지ㅋㅋ 진짜 죽여준다  
20171009,1,앙기모리노무리노무리기모리1점딱  
20171009,9,조이 살아질때 진짜 맘찢ㅠㅠㅠ  
20171009,9,미래의 모습을 지금 보는 듯한 신선함으로 너무 재밌게 보고 온 영화입니당  
20171009,10,그냥 sf 영화일줄 알았는데 아니였어… 최고다 최고  
20171009,10,이건 진짜 걸작;; 미쳣다 진심  
20171009,10,왠지 호불호가 확실하게 갈릴거 같은데 나는 진짜 재밌게 보고 옴  
20171009,10,미래 사회를 통해서 보고 온 인간…  
20171009,10,재미는 말할것도 없고 보고 나면 느끼는게 많아지는 영화였어요 sf 영화지만 예술영화라고 말하고 싶습니다^^  
20171009,10,역시 좋은 영화가 될라면 좋은 감독을 만나야 한다ㅋㅋㅋ  
20171009,7,영상미가 뛰어나고 배경묘사가 재미있지만 러닝타임이 너무 길다...들어갈때 커피나 콜라 사들고가지마세요 방광터집니다  
20171009,10,35년만에 나온 후속작이 이정도라니  
20171009,10,"3시간이 1시간 처럼 느껴지더라는,,  "
20171009,10,스토리도 탄탄하고 배우들 연기도 좋고ㅋㅋ 전편을 재밌게 봤다면 이번편도 꼭 보시라고 말하고 싶네여  
20171009,10,연출 영상미 음악 등등 다 너무 좋았어요 러닝타임이 길긴 했지만 지루함 없이 푹 빠져서 볼 수 있었어요  
20171009,10,완벽 그 자체! 정식 개봉하면 아맥으로 또 볼거임!!  
20171009,10,이건 무조건 봐야 하는 영화  
20171009,10,블레이드러너 개봉전 유료 시사회로 잘 보고 왔습니다 기대이상의 영화였다고 말하고 싶어요  
20171009,10,보는내내 경이로웠던 영화~ 보면서 감탄을 몇번이나 했는지!  
20171009,10,기다린 보람이 확실히 있네ㅋㅋㅋ 그냥 말이 필요없는 영화였어  
20171009,10,재미는 물론이고 메시지까지 있는 sf 영화였음  
20171009,10,개인적으로 올해 최고의 영화라고 말하고 싶다  
20171009,10,sf라는 장르를 예술의 경지로 올려다 놨네ㅎㅎㅎ  
20171009,10,상상 그 이상의 재미.. 역시 드니빌뇌브..  
20171009,3,감독의 전작을 본적은 없지만 영화의 전작감독이었던 리들리스콧과 비교하자면 리들리스콧은 예술과 오락 사이를 적절히 조율한다면 이감독은 철저히 예술성으로 블레이드 러너를 접근했다. 미장셴은 훌륭한데 지루한건 사실. 내 옆에 아저씨는 참다가 뛰쳐나갔다.  
20171009,10,블레이드 러너 2049 개봉전인데 재밌게 잘 봤어요  
20171009,10,드니 빌뇌브 감독은 천재인듯ㅋㅋ 이번에도 완벽함 그 자체임ㅋ  
20171009,9,선개봉으로 봤는데 러닝타임 3시간.. 살짝 전개가 루즈했지만 영상미는 압권이라고 말할수 있을듯.앞 작품 블레이드러너와 조금 연관있어서 스토리 한번 훑고가는걸 추천합니다  
20171009,10,원작을 뛰어 넘는 속편~! 기대 이상의 영화였습니다!  
20171009,10,스케일 스토리 연출 연기 모든게 완벽하다  
20171009,1,리들리스콧 감독의 1편 생각하고 가시면 크나큰 실망을 맛보실겁니다. 그리고 상당히 길고 지루하므로 큰 기대없이 조용히 쉬다 오신다고 생각하고 가시기 바랍니다.  저는 중간에 나왔네요. ㅠㅠ  
20171009,2,도중에 자고 일어 낫는데 그래도 이해 가네  
20171009,10,이전작을 안보고 가서 자고 빅스케일에 기대감에 보고 나오는 사람들이여 한심..블레이드 러너 1982 / 블레이드 러너 2022 블랙아웃 을 보고 갔으면 시간낭비가 안되었을터인데  
20171009,1,재미없고 길다.풀어나가는 방식이 너무 지루하다. 반전 뻔한데 주인공만 모름. 3시간중 대부분 장면이 천천히 걸으며 암말 안하거나 미래도시 보여주는 장면인데 원작자의 철학을 위해 필요한 장면은 아닌듯. 특수효과에 돈 들여서 다 보여주려고 끼워맞춘 느낌  
20171009,10,1편 안보고 루즈하니 뭐하니 하지마셈 그런영화 아님 ㅎ  
20171009,9,이왕이면 1탄보고 가시길 바랍니다. 그리고 사운드가 장난이 아닙니다  
20171009,1,극장서 중간에 나오긴 처음이네요 완전 졸려요 다운도 받지 마요  
20171009,10,35년만에 귀환ㄷㄷㄷ 엄청나네ㄷㄷ  
20171009,10,최고다... 원작의 컨셉이나 분위기를 2017년에 맞추어 재현 시킨 것도 대단하지만 스토리의 흐름이나 연결도 완벽에 가깝다. 원작에 버금가는 명작이다. 블레이드 러너 원작 팬이라면 무조건 볼 것.  
20171009,10,기대되는 포인트가 많은것 같네요 ㅎ  
20171009,10,재밌거나 웃긴 영화는 아니다. 원작의 세계관을 이어가면서 또 다른 스타일로 세계관을 해석했다는 부분이 마음에 든다  
20171009,10,괜찮아요~ 하지만 원작을 보는게 좋긴하겠네요~ SF영화중에서도 진짜 SF영화에요ㅋㅋ  
20171009,10,전편만한 속편은 없다는건 거짓말이다! 이걸 봐라!  
20171009,9,첫 원작의 미래가 2년밖에 안남았다니;;  
20171009,10,아쉬운 부분이 없다고 하면 거짓말이겠지만 이정도면 칭찬할만하다  
20171009,10,35년만에 돌아오는 영화!  
20171009,10,시대가 지난만큼 더 업그레이드 된 기술력덕부네  한편의 작품으 감상한 느낌이네요 ㅋㅋ  
20171009,10,후반으로 갈수록 더 흥미진진.. 괜히 막 벅차오르는느낌  
20171009,10,드니빌뇌브 영화들은 다 좋게 봤는데 이번 블레이드 러너가 제일이네요!!!  
20171009,1,1편을 보고 봐야한다는데 그냥 재미가없는영화. 늘어지기만하고 스토리는 엉성하고 영화관에서 졸긴 처음입니다  
20171009,3,1편의 즐거웠던 기억이여 잘가라. 전작 안봤어도 재미만 철철 넘치는 속편도 많은데 이건 전작의 기대로 두근두근하며 본 내 기분을 갈기갈기 찟어놓는구나. 철학이고 머고 재밌는 영화는 재밌다. 너무너무 루즈하고 앞뒤 설명없이 진행되는 스토리도 개판이구  
20171009,10,예고편 보고 기대중^^ㅎㅎ  
20171009,10,압도적인 분위기.. 가히 뭐라 설명할 수 없는? 한스 짐머가 참여했다는 음악도 최고였음  
20171009,10,전작을 보기 힘드신 분들은 리플리컨트가 어떤 존재인지만 알고가셔도 도움이 될 것 같습니다^^  
20171009,10,컨텍트를 굉장히 좋게 봤는데..  
20171009,10,오우 자라드레토도 나오네영ㅋㅋ  
20171009,10,얼마전에 원작을 다시 봤는데 어떻게 35 년전에 그런 상상력과 연출을 했는지 놀랍더라; 과연 이번엔 제작자로 참여한 블레이드러너2049는 어떤 모습일지 궁금하네 ㅎ  
20171009,9,생각과 지식을 요하는 영화이네요  
20171009,4,오늘 봤습니다 1편에 누를 끼치는 이런 걸 대체 왜 찍었을까 싶네요 영화를 관통하는 철학이 전작과 달리 별 감흥없이 몹시 지루하게 이야기됩니다 한글이 세 번 나오는데 차라리 그게 기억에 남을 지경이네요 한글날 만세!!  
20171009,10,로튼 신선도도 좋고 나쁘게 나온거 같진 않네  
20171009,10,보고시픈영화 ㅎㅎ 담주 기대기대 ㅎ  
20171009,10,"드니 빌뇌브 감독답게 세세한 연출이 돋보이는 영화였음, 전편과 연계되는 부분도 많았고 드니 감독만의 세계관도 적절히 조화되어 완벽한 영화로 재탄생을 시킨 느낌이랄까? 쩃든 한번으로는 아쉬운 영화다  "
20171009,10,원작 다시 보면서 기다리는중..  
20171009,10,예고편만 잠깐 봐도 느껴지는 엄청난 영상미;; 용산 아맥 예매각이다 ㄱㄱ  
20171009,10,졸라기대된다ㅋㅋ제작진이 쩌네 ㅋㅋ  
20171009,10,최고최고.. 경이롭다..  
20171009,10,릭 데커드의 재 등장으로 전편과 이어가는 매개체 역할을 하면서 세월이 지난 뒤 리플리컨트들의 삶을 볼 수 있음. 시골 갔다오고 나서 피곤한 상태로 봐서 다시 봐야할 것 같음.  
20171009,10, 드니 빌뇌브 감독 작품은 천천히 느릿하게 전개해 나가면서 생각할 수 있는 여유를 주는게 매력이에요. 작위적인 장면은 하나도 없죠. 그렇기에 감동이 억지스럽게 다가오지 않습니다. 올해 n차 찍는 유일한 영화가 될 것 같네요.  
20171009,10,K라니.. 이름만 봐도 넘나 멋있는데..?ㅋㅋㅋ라이언고슬링 짱팬으로써 기대만땅입니당  
20171009,10,긴 러닝 타임때미 엉 덩이가 좀 아프긴햇지만;;ㅋㅋ 확실히 멋진 영화긴 했어요~~  
20171009,10,라이언고슬링>.< 빨리 보고시퍼용 >.<ㅎ  
20171009,10,이건 평점을 안남길 수가 없다.. 많은 사람들이 좋아하는 단순한 오락무비는 아니지만 이 영화만의 세계관과 메세지를 확실히 보여준다. 과연 2049년의 세계는 어떤 모습일까  
20171009,10,충분히 만족하실 겁니다.  
20171009,5,"알바들 대거 투입!아이디보니 다른영화평점은 1개도 없음ㅋㅋ그리고,원작 충분히 이해한분만 관람하세요.그렇지 않으면 2시간가량 숙면 취합니다.원작 명성때문에 후한 5점 줌ㅜㅜ  "
20171009,10,정말 기다리던 작품이라 유료시사회로 봤다. 비주얼 연기 메시지 어느 하나 빠지지 읺는 작품이다. 무엇이 우릴 인간답게 하는가라는 철학적고민이 인상적이다. 단 전작과의 연결성이 생각보다 강해서 전작을 보지 않으면 재미의 1/3쯤을 못 느낄 수 있다.  
20171009,10,유료시사회 보고왔습니다. 솔직히 리뷰에 지루하단 얘기가 많아서 걱정했는데 전 정말 재밌게 봤습니다. 1편보고 단편들을 봐야 이해갈 요소가 상당합니다. 안보고 이 영화만 접하면 이해가 안가서 재미없을 요소가 많은만큼 사전 공부가 꼭 필요합니다.  
20171009,10,CGV에서 유료시사회를 보고 왔다.전편을보고 마음에 와닿는 관객이라면  속편은 대단한걸작으로 잘 볼것이다. 전편도 안보고 일반SF물 처럼 때려부수는걸 기대하고 본다면 실망할수도 있는 작품인것 같다.그래도 이영화는 근래 보기 드문 수작이다...  
20171009,10,"공각기동대, 이노센스를 실사로 본 느낌. 줄거리의 빈약함을 비주얼과 연기로 메운다.  "
20171009,10,오늘 신촌 메가박스에서 보고 왔어요. 리들리의 원작을 훼손하지 않으면서도 빌뇌브만의 또다른 원작이랄까.... 릭 데카드라는 이름으로 나오지 않았다면 말이죠.. 오랫만에 제대로된 SF영화를 보니 기분이 좋았어요  
20171008,8,이거 꼭봐라 재밋다 근데 영화 등급이 겁나 어이 없네 이거 19금 받아야되는거아님....?? 여자가슴 누드 노출에 다 벗고나오고 잔인한데 왜 청불아님 ?...  
20171008,10,기대를 저버리지 않는 속편이네요  
20171008,10,같이 본 지인이랑 둘이 적지 않은 충격을 받음.. 이렇게나 잘만들었을 줄이야.. 앞으로 나올 드니빌뇌브의 작품들이 자꾸 기대가 된다..  
20171008,10,솔직히 오래 나온 영화 중에 이 영화 퀄리티 따라갈 영화 없는것 같네요  
20171008,10,굿 미쳐씀 대박ㅋㅋㅋ ㅇㅇ  
20171008,10,정말 어마어마하네요 ㅋㅋ 스펙터클한 SF블록버스터들과는 다른 무언의 감동이 있달까요? 분위기에서 느껴지는 긴장감과 장면 하나하나에 담겨진 의미를 찾는 재미가 있습니다  
20171008,10,혹시나 했더니 역시나...  
20171008,1,시사회 보고 나왔음.대작의 속편을 만들려다 이해할수없는 지루작이 된듯함 ㅠㅜ대체로 지루하고 내용도 엉성함  
20171008,10,"굉장히 만족스럽게 봤네요, 다만 원작을 안보고 스토리만 알고가서 그런지 이해안되는 부분이 좀 있어요ㅠ 개봉전에 원작한번 찾아보고 담주 주말에 다시 보러갈 예정입니다. 영화 완성도는 최고입니다.  "
20171008,10,역시;; 리들리 스콧이 드니빌뇌브를 선택한 이유가 있는듯ㅋㅋ  
20171008,10,"스토리, 연기, 음악, 영상미, 액션 뭐하나 빼먹지 않았네  "
20171008,10,기다림을 충족시켜주는 완벽한 영화  
20171008,10,ㅠㅠ최고의 영화를 보고와떠요  
20171008,10,어느 정도 생각을 요하는 영화이기 때문에 단순한 영화를 즐기는 사람이라면 영화에 불만이 생길 수 있을 것 같네요^^;; 워낙 원작의 팬이기도 하고 SF영화를 즐기는 편이라 제 입장에서는 괜찮은 영화였어요  
20171008,10,보는 내내 숨이 턱 막혔다.. 완벽한 미래의 세계.. 우리의 미래 모습은 어떨지..  
20171008,10,감탄했어요 핫한 배우들의 연기도 좋았고요  
20171008,10,예고편만 봐도 미친거 가틈ㅠㅠㅠ분위기 오짐ㅠㅠ  
20171008,10,이번 연휴에 본 영화 중 최고네요..  
20171008,10,"전작에 뒤쳐지지 않을 정도로 완벽한 연출과 전개, 더욱 업그레이드 된 리플리컨트들의 모습이 과하지 않게 연출되어 더 마음에 들었다. 리들리스콧이 감독을 잘 골랐ㅈ네 ㅋ  "
20171008,10,"이 영화에 열광하는 이유, 알겠다  "
20171008,10,블레이드러너만의 디스토피아 세계의 확장판. 35년만의 복귀는 성공적..  
20171008,10,이 조합.. 미쳤다..ㅎㅎㅎ  
20171008,10,"모든 것이 완벽했던 영화, 다만 원작을 모르는 사람이라면 조금 힘들수도..  "
20171008,9,반드시 1편 보시고 보시는게 좋을 듯 합니다.상당히 의미있고 심오한 내용을 담고 있어서 잘 만들어진 후속작품 같아요. 다소 지루할 수는 있겠지만 상당히 울림이 있었습니다.인간보다 더 인간다운 레플리컨트를 그려주었네요.  
20171008,10,올해 최고의 영화!! 감격!  
20171008,10,러닝타임이 길지만 단 한장면도 헛트른게 없었다  
20171008,1,"개인적으로 블레이드 러너를 좋아하고 이번 작품을 정말 기대하며 기다린 사람입니다만 너무 실망스럽네요. 최악의 연출, 초반부 중반 후반부가 어디서 어디인지도 모르겠고 너무 많은걸 보여주고싶은 욕심인지 아무의미없는 장면들 질질끌고 러닝타임은 왜이렇게 긴지  "
20171008,10,속편을 볼 수 있다는 사실만으로도 눈물이 났습니다  
20171008,9,"메가박스 파주출판도시에서 7시20분 영화 관람하고 왔습니다.  리들리 스콧의 원작 파이널 버전을 정독하고, 프리퀄 애니 2022 블랙아웃 편과,  영화 영상 두 편을 모두 보신 후 관람하시면 최고의 후속작으로 느끼실 수 있습니다!  "
20171008,10,드디어 다음주 개봉.. 설렌다♡  
20171008,10,숨막히는 163분이었다  
20171008,10,라이언 고슬링을 드라마나 멜로 같은 장르에서만 보다가 SF장르에서 보니 또 다른 느낌이네여ㅎㅎ 요즘 연기에 물올라서 그런가 연기도 너무 좋고 K역할에 딱이었던 것 같아요  
20171008,6,필리핀은 6일에 개봉해서 봄 후반부 반전은 뜬금없고 클라이막스는 무슨 동네잡범 실랑이 수준 사건을 파헤치는 긴장감 없음 화끈한 액션씬 없음 손에 땀을 쥐는 구성없음 연기는 무난 디스토피아적 느낌은 있음미래기술은 흥미로움전편내용 답습 끝~  
20171008,10,그동안 경험하지 못했던 SF영화였어요..  
20171008,10,솔직히 보고나서 감탄만 나오는 영화였다;; 원작의 세계관을 그대로 이어받아 30년 이 지난 후의 미래 모습을 새롭게 그려냈음.  
20171008,10,후회하지않는 선택이었따  
20171008,10,흥미진진..러닝타임이 긴 감이 없지 않아 있지만 볼만한 가치가 충분히 있는 영화. 드니빌뇌브의 역량이 또 한번 확인된  
20171008,10,라이언 고슬링이 선택한 영화!! 짱짱기대됨!!  
20171008,10,오랜만에 진짜 제대로 된 영화가 나왔네여 ㅋㅋ  
20171008,10,예고편 오지던데.. 빨랑 보고싶다  
20171008,10,미래도시의 또다른 단면을 보고오다.  
20171008,10,이 영화 이후에 나왔던 SF영화들은 블레이드 러너를 참고로 만들었다는 점 알고 계십니까 ㅋ  
20171008,7,재미는 크지 않지만 다 보고난 후 여운이 남았습니다  
