0,1,2
20171007,10,하반기 최고의 걸작이 될듯^^ 영화가 길긴하지만 충분히 흥미롭고 볼 가치있다. 맨첨에 주제곡만 들어도 소름돋음 ㅎㅎ  
20171007,10,기대되는 영 화입니다 드니 빌뇌브의 영화들을 보면 알 수 있죠..  
20171007,10,이름만 들어도 설레이고 예고편 보고 가슴이 두근두근  
20171007,10,"이 영화, 개봉만을 기다리고있어요  "
20171007,10,이건 닥치고 봐야할 영화!! 블록버스터계의 교과서적인존재+_+  
20171007,10,블레이드 러너를 드뎌 영화관에서 볼 수 있다니.. 생각만해도 짤릿하다ㅠㅠㅠ  
20171007,9,빨리 보고싶다 이렇게 기대해본 영화가 얼마만인가.ㅎㅎ  
20171007,10,추석 빨리가라 ㅠㅠ얼른 개봉하면 보고싶네요 !!  
20171007,10,1편보다 더 멋있었다ㅎ  
20171006,1,근래본영화중에 최악ㅋㅋ시작하지말자 잔다. 재미없는 현대미술관에 갇혀서 세시간뒤 구조된 기분  
20171006,6,"유료시사회로 봤는데, LTE 시대~! 5G 시대~! 더불어 어벤져스 시대(영화)에 이렇게 루스한 영화를 관람했다는 게 고역이었네요... 영화가 좀 많이 지루해서 6점만 주고 싶어요~ 그리고 철학적인 메시지...는 저는 별로 안 필요하다는요~  "
20171006,2,유료 시사회 보고 왔습니다.. 전작에 대한 정보가 없이 단지 감독이나 캐스팅만 보고 영화를 보시는거라면 매우 비추.. 저도 그러한 경우였고 15세 관람 이용가라는게 믿기지 않을정도로 선정적이었으며 스토리도 이해가 온전히 가지 않네요..  
20171006,10,보기 전에 전편을 보고 봐야겠다 비쥬얼 만으로도 이미 압도적이지만..  
20171006,10,걸작의 명성을 이어갈거라 믿는다 ㅠㅠ  
20171006,10,믿고보는 영화 후속작 ㄷㄷ  
20171006,10,미국 시사회 평들도 올 해 최고의 영화라고 평하던데 기대된다 ㅠㅠ  
20171006,10,개 수작..감독 믿고 봐도 될 영화같다  
20171006,10,후속작 만을 기다렸다 드뎌 개봉하다니.. 감동이야  
20171006,10,생애 최고의 영화라고 생각함 ㅠㅠ  
20171006,10,제대로 초대박 나라 ㅎㅎ  
20171006,4,"유료시시회 보고왔는데.. 이 영화는 사전지식이 없다면 완전 난해한 영화.. 화를 내면서 나가는 사람들도 많을정도..긴 런닝타임에 조금은 지루한감이 있고, 액션은 예고편이 다였음..1편이 진짜 명작이라고 다시한번 느끼게해준 영화  "
20171006,10,개봉전 유료시사로 방금 보고왔습니다전작의 감동 그대로입니다믿고보는 리들리 스콧과 드니 빌뇌브 !!!진중하고 아름다운 영화입니다  
20171006,1,유료시사회에서 바로아침에보고왓습니다.OO망작입니다 쓸떼없는장면과 불필요한시간낭비 지대로입니다.그리고 15세관람인데 여자의유륜이 그냥적나라하게 계속보여줍니다. 그리고 유사성 성관계도 영화중에보이고요 정말로 불편햇습니다 영화내용도 이해안가고 정말보지마셈  
20171006,10,12일 까지 언제기다려 ㅠㅠ 초특급 비쥬얼이 쩌네  
20171006,10,영상 보고 더 기대됩니다 걸작으로 주목받고 있는 만큼 기대되네  
20171006,10,오 블록버스터 영화의 전설이 될듯  
20171006,10,진심으로 기대되는 영화다.  
20171006,10,리들리 스콧이 제작에 참여햇다고 하니 더 궁금한데요?  
20171006,10,블레이드러너2049.. 라이언 고슬링+해리슨포드+자라드레토라니..  배우들 캐스팅만으로도 이미 볼 가치가 충분하다  
20171006,10,올 하반기 제일 주목할만한 영화  
20171006,10,짱재밌을 것 같아요.ㅋㅋ 역대급 영화일듯ㅋㅋㅋ  
20171006,10,배우들이 영화에 대한 자부심만큼이나 팬으로써 굉장히 자부심이 느껴지는 영화였습니다. 세월이 세월이니만큼 해리슨 포드는 나이가 들었지만 제 역할을 제대로 해내네요. 맘에 듭니다  
20171006,10,제작기 영상 보고 엄청 기대 하는 중입니다  
20171006,10,배우들 라인업 만으로도 이미 최고  
20171006,10,빨리 보고싶네요 스케일 어마어마 하네  
20171006,10,강렬한 비쥬얼이 좋네요 배우들의 인상 깊은 연기가 기대됩니다  
20171006,10,관객들이 단번에 매료될 영화  
20171006,10,인간의 기억에 대해 말하는 영화라서 그런지 생각하기 좋은 영화 였다.과연 2049년에는 어떤 미래가 펼쳐질지 궁금해지는군  
20171006,10,원작 이후의 세계관을 어떻게 표현해냈을지 궁금하다  
20171006,10,비쥬얼 만으로도 이미 흥행 보장 ㅎㅎ  
20171006,10,그동안의 sf영화가 담지 못한 모든 것들을 선사할 영화가 되길  
20171006,10,"블레이드러너 진짜 개봉하길 기다렸는데 유료시사 소식에 바로 달려갔습니다!!! 역시 기대이상이네요. 드니감독의 스타일에 맞게 재해석된 세계관과 수려한 영상미, 명배우들의 연기 흠잡을 게 없더군요^^ 개봉하면 제대로 한번 더 볼예정입니다.  "
20171006,1,제발 제발 제발 보지마라. 부탁이다. 마이너리티 리포트를 기대했는데 아주 뻔하디 뻔한 철학토론을 관람하고 왔다.  
20171006,10,이 영화만 기다리는중 ㅋ  
20171006,10,각 배역에 맞는 배우들로 잘 캐스팅 된 것 같네요 기대가 큽니다  
20171006,10,배우들도 인정한 영화.. 고품격 비쥬얼 오졌음 . 눈 호강 제대로했따  
20171006,10,원작을 아는 사람들이라면 무조건 기대할 수 밖에 없을듯? 특히 리들리 스콧이 제작자로 참여한 영화라서 더 빨리 보고싶네요 ㅋㅋ  
20171006,9,압도적인 비주얼 빨리 보고싶어요 기대 기대  
20171006,10,절대 실망할 수 없는 영화일 것  
20171006,10,와 라이언고슬링이라니ㅠㅠ.. 진심 재밌겟네 ㅠㅠ연휴에 개봉했으면 좋았을텐데ㅠㅠ담주에 시간내서 꼭 보러가야게따..  
20171006,10,예고편만 보아도 느껴진다..시각적으로 강렬한 영화가 될듯.. 꼭 아이맥스로 보고싶음  
20171006,10,예고편만 봐도 재밌어보여요  
20171006,10,올 하반기 극장가를 사로잡을만한 영화  
20171006,9,"드니 뷜뇌브가 선보이는 황홀한 사이버 펑크, 그 자체  "
20171006,10,"정말 대단했다.. 배우들의 연기부터시작해서 몽환적인 분위기와 거스를 수 없는 메세지, 올 해 최고의 걸작으로 주목받을만 하다  "
20171006,10,세월이 가도 클라스는 영원함.  
20171006,10,이 영화만 기다렸다 배우들 라인업 어쩔거야  
20171006,5,이 영화는 수학임 심오하고 집중력이 필요하고 또 집중도 잘 되지만 중후반가면 지루해서 졸려ㄷ ㅣ짐  
20171006,10,"확실히 이 영화는 전작을 봤냐 안봤냐에 따라 평가가 확연히 다를 것 같다. 이영화 보기 하루전 전작을 본 입장에선 장면 하나하나 전작과 비교하며 곱씹어 보아서 3시간의 러닝타임과, 영화자체의 무게감이 전혀 지루하지 않았다.  "
20171006,9,1탄같이 미래사회의 음울하고 신비로운 분위기를 잘 이어받았네요. 1탄 마니아로서 스토리도 만족. 3탄이 나올수도 있을듯. 다만 엔딩크레딧에 그유명한 신디사이저 메인테마곡이 끝끝내 안나온건 실망이네요 ㅜ 그리고 제 닉네임은 옛날부터 데커드였어요 ㅎ  
20171006,10,엄청난 기대감과 동시에 걸작으로 주목받는 영화ㅠㅠ 꼭 보고싶네요  
20171006,10,와 블록버스터의 전설이 재등장했다  
20171006,10,실력파 제작진들의 고퀄리티 작품이네요  
20171006,10,배우들의 엄청난 시너지가 굉장한 영화를 만들었네요 완성도가 엄청납니다 ㅎ 시간이 길어 지루하다고 느낄 수 있으나 굉장한 작품을 본 기분이라 돈이 아깝지 않아요  
20171006,10,고품격 비쥬얼이 좋네요  
20171006,10,예고편 보는 내내 내 두눈을 의심했다.. 화려한 캐스팅 굿  
20171006,10,핫한 할리웃 최고 배우들이 나오는 영화네요ㅋㅋ 꿀잼일듯  
20171006,10,굉장하네여!!+_+ 남친이 보재서 본건데 짱이었어여.. 진짜루눈을 뗄 수 없습니당ㅠㅠ!  
20171006,10,흥미로운 영화인데 잘 이해가 안되서 한번 더 보기로함  
20171006,9,오늘봤다. 개암울. 웃음코드제로. 무지길다. 킹스맨같은 영화가 아니다. 분위기와 주제가 시종일관 무겁게 흐르는 영화. 아주 잘 만들었음. 흥미위주 영화보는 사람은 비추. 에어리언커버넌트..느낌 레지던트이블 최종편과 비슷한 형식의 반전. 개인적으론 걸작  
20171006,8,"개인적으로 평점메기기 정말 애매할듯관람포인트, 82년 블레이드 러너를 얼마나 알고있는가에 따라서 영화 재미가 극명하게 갈리고 호불호가 심하게 갈림. 그리고 일단 82년작처럼 큰 흥행은 힘들듯  "
20171006,1,리뷰라는걸 하지 않는데 아직 보지 않은 수많은 분들을 위해 남깁니다. 이거 본다고 귀한 시간 날리지 마세요. 귀한 연휴 하루 날린 기분  
20171006,5,지루해서 죽다살았다.음향효과랑 연기력뿐이지 혼란스러운스토리는 정확한답을주지않는다. 그게 의도하신바라면 성공하셨어요.  
20171006,2,원래는 1점이지만 배우들의 연기덕분에 2점드립니다.. 유료시사봤는데 어우  
20171006,1,이야~ 유료시사회 잘자다왔다 액션 어딨냐 차만 날라다니구 홀로그램 여자만 나오면 미래냐 ? 작품성으로 개뿔난 모르겠고 드럽게 재미없네 다큐도 아니고 찰리 범죄도시나 토르가 잼있겠다  
20171006,7,"오늘 봤는데, 그런대로 잘 만들었지만 너무 지루했습니다. ㅠ-ㅠ '마이노리티 리포트'같은 오락성 재미가 별로 없고 필요 이상으로 진지한 영화였습니다...  "
20171006,1,유료 시사회 봤는데 전혀 취향 아니다.2017년 들어서 최고로 지루한 영화. 아 내 세시간ㅜㅜㅜ잠이나 잘걸ㅜㅜ  
20171006,10,블레이드 러너는 레전설이다  
20171006,10,이게 그 말로만 듣던 SF계를 있게 한 전설의 영화?!!  
20171006,10,내가 봐온 그 어떤 SF영화들 중에 최고라고 생각함  
20171006,10,"리들리 스콧 원작의 블레이드러너의 세계관을 보여주면서 드니빌뇌브 스타일의 연출로 독특하게 표현해냈네요, 라이언고슬링의 연기와 해리슨포드의 등장까지 자연스럽게 잘 어우러집니다.  "
20171006,10,흥미진진한 스토리~ 보는 내내 눈을 뗄 수 없었던~~  
20171006,10,헐.. 전설의 블레이드 러너? 실화임?  
20171006,9,그냥 블레이드 러너라는 것 자체만으로도 기대된다  
20171006,10,드니빌뇌브가 확실히 SF계의 계보를 잇는 명감독이긴 한가보다  
20171006,10,간만에 영화다운 영화를 봤군 N차 관람 찍는다  
20171006,10,라이언 고슬링과 해리슨 포드의 조합! 드니빌뇌브의 독특한연출 만큼이나 모든 배우들의 역할이 완벽했다  
20171006,10,오늘 보고 왔습니다. 진짜 말이 필요없는데 대박입니다 여러분  
20171006,10,이런건 극장에서 봐줘야지잉ㅎㅎㅎ  
20171006,10,원작은 외면 받았지만 이건 외면 받지 않길  
20171006,10,"얼마전 블레이드러너 원작 보고 엄청 감탄했는데, 2049는 어떤 느낌일까  "
20171006,10,그냥 영화를 뛰어넘어 하나의 작품이구만 ㅋㅋ  
20171006,9,외롭고 쓸쓸하다. 그 당시 정서를 다시 느낄 수 있게 된 것 자체만으로 '행운'  
20171006,10,감탄.. 엄청난 무언가를 보고온 기분  
20171006,10,라이언 고슬링의 선택이 옳길!!  
20171006,10,"블레이드 러너가 주는 철학적인 메시지, 이번에도 기대해도 되겠지..  "
20171006,10,리들리 스콧 감독이 제작에 참여해서 더 보고싶어요 ㅎ  
20171006,10,블레이드러너만의 디스토피아 세계관 기대된다  
20171006,10,복제인간ㄷㄷ 보는 내내 긴장되욧  
20171006,10,와 진짜 예고편만 봐도 감동이네  
20171006,10,옛날에 나온 블레이드러너와는 확실히 다른 느낌. 더 세련되고 더 멋있어 졌다  
20171006,10,외국평이 좋아서 급보고 싶네  
20171006,10,저보다 저희 아버지가 더 잘 알고 있는 영화더라구요 ㅋㅋ  
20171006,10,내가 꼽는 최고의 영화.기대된다  
20171006,10,많은 사람들이 기대할만 하네요^^ 잘 보고왔습니다  
20171006,10,"러닝타임이 긴건 장점이 될지 단점이 될지, 개봉하면 알겠지  "
20171006,10,아이맥스로 보면 쩔것 같아요.. 드니 영화들은 영상미도 굿인데  
20171006,2,라이언고슬링과 해리슨포드 조합으로도 극복 안 되는 지루함. 관객을 왕따시키며 지들끼리 심각함. 브금만 웅장하고 남는 내용은 하나도 없다. 2049에도 여전히 빻은 여캐사용. 기억에 남는 거라곤 여자들 찌찌 뿐..  
20171006,10,예고편 보니까 개지림-_- 무조건 보러간다 고고  
20171006,10,"감독, 제작진, 배우들 이름만 봐도 기대할 수 밖에 없는 영화  "
20171006,10,배우들까지도 영화에대한 자부심이 엄청 나던데.. 과연 영화는?  
20171006,10,드니빌뇌브 감독이라는 것도 좋은데 리들리스콧이 제작에 참여했다고 하니까 더 좋음  
20171006,10,블레이드 러너라고 해서 설마설마 했더니 진짜 블레이드러너 속편ㅠㅠㅠ나진짜 감동받아땈ㅋ  
20171006,6,유료시사회로 보고 왔는데 역시 전편이 너무 레전드 였나보다. 분위기랑 음향만큼은 압도적인데 sf치고 너무 잔잔했다  
20171006,2,15분 넘어가면서 졸음이...꾹참고 1시간 버티니 이제 언제 자리를 박차고 뛰쳐나갈까 옆자리 사람과 눈치싸움 어라 선수를 빼앗겼다 앞줄 너뎃사람들이 한숨푹쉬며 아웃오브투드헬을 외치며 겟아웃.  
20171006,10,헐랭.. 자라드레토도 나오네..ㅋ  
20171006,10,이거 반응 좋더라구요. 기대가 큽니다  
20171006,10,예고편 보고 두근두근 설레뜸 라이언 고슬링 라라랜드랑은 또 다른 모습! 멋지다잉 ㅋㅋ  
20171006,10,넘나 기대중ㅠㅠㅠ난 개봉하면 봐야징  
20171006,10,현 시대 SF장르에 엄청난 영향력을 준 신같은 존재  
20171006,10,아맥으로 무조건 본다 기다려라 ㅋㅋㅋ  
20171006,10,이번에도 강렬하다. 사람들 엄청 열광하겠군  
20171006,10,SF영화 계의 시조새라고 할 수 있는? 기대된다  
20171006,10,"블레이드 러너, 드니 빌뇌브, 리들리 스콧, 라이언 고슬링, 해리슨 포드, 안 볼 이유가??  "
20171006,10,기대할 수 밖에 없는 영화..  
20171006,10,원작 그 이상의 볼만한 가치가 있습니다^^  
20171006,10,숨막힐정도로 놀라운 영화!!  
20171006,10,재미 뿐만 아니라 철학적인 메시지 까지도!  
20171006,9,"라이언고슬링, 해리슨 포드의 캐미가 good  "
20171006,10,"엄청나다.. 압도적인 영화의 스케일과 흥미진진한 스토리, 영상미부터 시작해서 음악, 배우들의연기 뭐하나 흠 잡을 곳이 없었다  "
20171006,10,역시 믿드니! 지금까지 2017년 SF영화 중 최고의 영화  
20171006,10,해외 언론평은 무지 좋던데 궁금하다~  
20171006,10,강아지 어떻게 된거죠?  
20171006,10,또 한번 역대 최고의 SF 영화 탄생  
20171006,10,35년만의 개봉이라니.. 말만 들어도 엄청 나구나  
20171006,10,이거 볼라고 1982년 작품 찾아보고 기다리는중임  
20171006,10,라이언고슬링은 내한안하나?ㅎㅎ  
20171006,10,그때도 최고였고 지금도 최고구나..  
20171006,10,아 오늘이 유료시사회였구나ㅋ  
20171006,10,전설의 블레이드러더..ㄷㄷ  
20171006,10,라이언고슬링이 어떤 연기를보여줄지 기대가 큽니다  
20171006,10,예고편 하나하나 챙겨 보면서 기다렸는데 유료시사회 정말 감사합니다ㅠㅠ좀이씀 보러가요!!  
20171006,10,진짜 대단한 영화였음 ㅋㅋ  
20171006,10,충분히기대할 가치가있는 영화  
20171006,1,4명이서 보다가 3명 먼저 나갔습니다.  너무 재미가없어서 생에 처음으로 리뷰 남겨봅니다. 즐거운 연휴에 소중한 시간을 주고 얻은 교훈입니다. 수고하세요  
20171006,10,리들리스콧+드니빌뇌브 이런 미친조합이 다있어?ㅋ  
20171006,10,헐 캐스팅개쩐다 ㅋㅋㅋ  
20171006,10,163분이라는 긴 시간동안 긴장속에서 보게 된다.. 다시 돌아온 해리슨 포드도 반갑고 블레이드러너만의 세계관을 잃지않으면서 업그레이드 된 모습을 보여줬다  
20171006,10,내가좋아하는 스타일이네~~ㅎㅎ  
20171006,10,영화 분위기ㄷㄷㄷ빨리보고싶다  
20171006,1,이걸영화라고 개봉도 하지마라 나도 개봉하는영화마다 전부보는광이지만이런쓰레기영화는 정말돈아깝다  
20171006,5,정말 심심하고 심오해서 진심 지루햇다  
20171006,10,드니 빌뇌브의 영화를 좋아하는 편이라 이 것도 기대가 크군요ㅕ  
20171006,10,옴마나.. 라이언 고슬링..♡  
20171006,10,개 쩌는디? 영화 예매하는데 블레이드러너가 있길래 호기심에 했더니개봉한게 아니었구만.. 여튼 개봉전에 잼나게 잘보고 왔다 존잼임  
20171006,10,이거는 안본 사람은 모른다.. 오늘 보고 오길 참 잘했네 ㅎㅎ  
20171006,10,재미없을 수가 없는 영화 >.<ㅎㅎ  
20171006,10,최고였다.. 개봉하면 또봐야지..  
20171006,10,넘 보고파서 유료시사로 봤는데 역시 갓드니!!  
20171006,1,뉘미 드럽게  지루하고 잼없네요 이 영화가 흥행성공하면 내손에 장을 지진다 진짜 에라잇  
20171006,10,개봉 소식 듣자마자 달려왔어요ㅠㅠ진짜 블레이드러너라니ㅠㅠ이름만 들어도 설레는데 예고편 보고 가슴두근두근거려서 혼낰ㅆ네요 ㅠㅠ거기다 캐스팅도 완벽해ㅠㅠ  
20171006,10,이건 진짜 극장 사수지ㅡㅡ..  
20171006,10,영화사에 기리 남을 영화의 후속편이라니 기대를 안할수가 없...  
20171006,10,기대되는영화입니다!!!  
20171006,10,라이언 고슬링!!! 무조건 보새요  
20171006,10,"그래도 드니 빌뇌브 정도면 기대할만하다,원작의 명성을 저버리지않을지는 개봉해봐야 알겠지만 나쁘지 않을거같음  "
20171006,10,북미평 넘 좋아서 더 기대중 하루만 더 참음 볼수있다 ㅋㅋ  
20171006,10,개봉날바로 극장행 예약ㄱㄱ  
20171006,10,예고편 지린다 진짜 ㅋㅋㅋ  
20171006,10,사실 올 하반기 가장 기대되는 영화는 이것이었지..  
20171006,10,라이언고슬링!!+_+거기다 해리슨포드까지 다시 나온다니ㅠㅠ감동!!ㅠㅠㅠ  
20171006,10,엄청난 영화가 개봉하는구나 ㅎ  
20171006,7,"보고 왔습니다. 어떤 느낌이냐면,,, 폴아웃3 : 뉴베가스가 생각이 나네요.  "
20171006,9,어 벌써 개봉햇던데 오늘 6일인데 메가박스는 개봉햇던데  
20171006,1,기대됨 빨리 보고싶음 빨리보고싶다  
20171006,10,확실하다 드니 빌뇌브는 천재다.  
20171006,5,감독 리들리 스콧 아니였나요?  
20171006,10,블레이드러너..꼭 봐야지  
20171005,10,블레이드 러너 팬으로써는 10점이지만숀영의 그늘에서 여배우들이 빛을 볼 수 있을까? 라는 의문을 갖는다  
20171005,10,내 인생의 최고의 sf  걸작. 사이버펑크를 검색하고 여러번 반복해서 봤던 영화다...후...기대가 되는구나..  
20171005,9,완젼기되됨.E.T에 고개숙였던 치욕을 만회하기를... 아들과 같은영화를 다른버젼으로 함께 볼날이올줄 몰랐네.  
20171005,10,샹ㅋㅋ 빨리보구싶다 빨리  
20171005,8,리들리 스콧이 연출을 안하므로 일단 반은 성공.  
20171005,8,옛날의 법칙을 깨고 새롭게 태어나다.  
20171004,10,이 작품을 아는 분들이라면... 주제곡만 들어도 소름돋을 듯.  
20171004,10,제가 좋아하는 배우 실비아 획스가 나오고 또 마션에서 반한 맥켄지데이비스도 나온다니 꼭 봐야겠습니다  
20171004,10,"필립 K 딕의 원작소설을 영화화한 작품의 2탄이, 35년만에 탄생했다. 노년의 데커드가 등장했으니, 데커드가 복제인간이란 논란은 드디어 사라지는 것인가~! 블레이드-러너 역에 최적격인 라이언-고슬링! 시대변화에 걸맞는 풍경과 다자인! 기대감이 한가득!  "
20171004,10,전작은 안 봤지만 자레드 팬이라 봅니다  
20171003,1,지나치게 평점이 높아서 끌어내려주마  
20171003,1,블레이드러너 원작의 감동을  기대  
20171002,10,2017년 재패할 영화가 되길 기대한다.  
20171002,10,블레이드 시리즈 잘 봤습니다 기대됩니다~  
20171002,10,로튼 토마토 평점이 97이다 ㅎㄷㄷ 오리지널 블레이드 러너를 뛰어넘는다는 평들이 대다수다...심지어 영상은 로저 디킨스임...캬!!  
20171002,10,인간존재의 존엄성과 소중함 그리고 인간 본연의 삶에대한 처절한 욕구  
20171001,8,예고편 나올수록 점점 불안해진다...  
20171001,10,시카리오 감독이 이분이였네..믿고 본다  
20171001,8,아래 리들리 스콧이 세계적으로 거품 빠지는 감독이라고 쓴 똘추가 있네. 영화를 항문으로 보니?  
20171001,10,로튼  98 실화냐 바로 달려가서 본다  
20170930,10,빨리 보고싶다!!!! ㅎ  
20170930,10,"사이버펑크물(게임,영화)의 시초적인 작품 이거 안보면 안되는 작품  "
20170929,10,"드니 빌뇌브이기에,그리고 블레이드 러너이기에 온 시간을 기다립니다  "
20170929,10,아아 빨리 보고싶어요 ㅠ  
20170929,10,80년대 1편보다 대박나라.  
20170928,10,힝 최고로 기대됨ㅠㅠㅠ 추석 빨리 지나가라ㅠㅠㅠ  
20170928,10,이 영화를 본 사람이라면 기대할 수 밖에 없지 ㅋ  
20170928,10,"전설의 블레이드러너....ㄷㄷ 라이언고슬링 주연에 해리슨포드,리들리스콧의 참여. 그리고 새로운 감독이 드니빌뇌브라니;;  "
20170928,10,미쳤다 존잼일듯ㅠㅠㅠ  
20170928,9,이건 그냥 봐야된다 ..  
20170928,10,해리슨포드 오래사십시오  
20170927,10,미국 시사회 평들도 올 해 최고의 영화라 평가하던데 기대되네요  
20170927,1,저감독 영화 너무 지루하던데...  
20170927,10,이렇게 기대해 본 영화가 얼마만인가... 드니 빌뇌브가 만들어내는 sf.. 블레이드 러너 원작을 보곤 드니 빌뇌브와 너무 잘 맞는다고 생각했다. 진짜와 가짜 그 경계의 모호함 속에 심오한 철학을 담을 것이라 믿는다. 얼라이벌의 디자인과 함께 말이다.  
20170927,5,재미없어보이네요 아직 관람전  
20170927,9,이형 왠만하면 평작이상은 뽑아내서 다행이다  
20170927,9,"현재 세계적으로 핫한 감독 2 TOP 이죠. 크리스토퍼 놀란과 드니 빌뇌브. 세계적으로 거품 빠지는 지는 감독으로는 마이클베이,리들리스콧 등이 있죠.(이 영화를 스콧이 감독안하고 제작해서 다행;;)  감독빨로 봐도 대박일 영화!  "
20170926,10,드니 빌뇌브니 감독 믿고봄 예고편 풀릴수록 너무 기대됨  
20170926,10,블레이드 러너 를 극장에서 볼 수 잇다니ㅠㅠ  
20170926,10,"진짜, 몹시, 너무나도 기대하는 영화  "
20170926,10,드니 빌뇌브의 천재성 때문에 더 기대된다 진짜 이건 미쳤어요ㅋㅋㅋㅋ  
20170925,1,죽은 사이버펑크 XX 만지기.  
20170925,10,드니빌네브 팬으로서 광분할 기대작  
20170924,10,사이버펑크물 영화의 시초...레전드격 작품인데 제발 후속작 잘나와주기를 ㅠㅠ  
20170924,10,리부트작 아니고 공식 후속작입니다... 알고 말씀하세요. 여튼 SF영화계의 전설 블레이드 러너가 35년 만에 후속작으로 스크린에서 다시 보게 되어서 기쁩니다.  
20170923,5,이젠 어떤 영화를 봐도 우린 어디서 본거같고 익숙하게 내용을 예상한다 너무나 많은 미디어 홍수속에 수많은 영화를 봤기 때문이다 이 리부트작이 우려되는건 바로 이런이유이다.  
20170919,9,미국은 10.6 개봉인데 왜 우리는 10.12? ㅠㅠ 추석때 개봉해주지 남한산성때문인가?  
20170919,10,관람전에 전편인 2019블레이드러너 시청 필수~!!  
20170918,10,제작지은 완전 드림팀이네..  
20170918,9,갓뇌브 땜에 솔직히 원작보다 더 기대됨.  
20170917,10,"원작의 광휘가 어마어마한 작품인지라 약간의 염려는 있지만 그래도, 그래도 드니 빌뇌브의 연출이니 기대가 된다.  "
20170916,1,반젤리스가 OST 참여하지 않아서 1점  
20170916,10,35년을 기다린 후속편역시 살아 있길 잘했어!  
20170915,10,_._._.지렸다.  
20170915,6,룻거 하우어없으면 블레이드 러너가 아닌데....  
20170915,10,리메이크인줄 알았더니 후속작이었어 ㄷㄷㄷ  
20170915,6,철학은 죽고 이미지의 과잉으로 넘쳐날 것 같은 예감이 틀리길 바란다.  
20170914,9,이건 닥치고 봐야함. SF의 교과서. 이걸 다시 보게 되다니. 제작자한테 그저 고맙고 해리슨포드에게 고맙다.  
20170914,10,으~~너무 기다려져요 언제 한달 기다리냐..ㅋㅋ  
20170914,10,이거 보기전에 1편 봐야하나요?  
