0,1,2
20171008,10,보는 내내 스토리가 장난 아니었고 눈을 뗄 수 없었다 긴장감에 두근두근  
20171007,7,올해 기대했던 영화 중 하나... 1편에 비해 뭔가. 좀.. 집중하다 졸고 집중하다 졸고...영화후에 20대 남자2명 철학적(?) 이야기 및 재미있었다고 했지만.. 그냥 나 한테는  잘 않읽히는 베스트셀러를 읽은 느낌..?!  
20171007,10,말이 필요없는 영화 전편에서는 느낄 수 없었떤 2049만의 느낌이 물씬~~  
20171007,10,예고편만 봐도 감동이었는데 스크린으로 보니 더 감동이네요..생각 이상으로 멋진 영화를 만들어서 놀랐습니다  
20171007,10,또 한번 역대 최고의 블록버스터 영화가 탄생했네요 ㅠㅠ  
20171007,10,해리슨 포드와 라이언고슬링의 케미가 죽이네  
20171007,10,20년전 보았던 블레이드 러너의 이야기가 이어지는 것이 반갑습니다.  
20171007,1,공각기동다 느낌이 왤케 나냐 성적도 따라갈거냐?  
20171007,10,"오늘 타이페이에서 IMAX 3D로 봤는데, 정말 눈호강 제대로!! 독특한 배경의 미래모습과 신기술에 입이 벌어짐... 특히 보고나면 그 리모컨 하나쯤 갖고 싶을 것이다.  "
20171007,10,숨막힐 정도로 놀라운 영화다  
20171007,10,역시 기대 이상인 영화ㅎ  
20171007,10,재미뿐만 아니라 철학적인 메시지도 잊지 않는 영화여써요^^  
20171007,10,"ㅠㅠ올 해 본 영화중에 최고다 압도적인 영화의 스케일과 연기, 영상미, 음악 빠지는게 없다  "
20171007,10,원작 그 이상으로 볼 가치가 있다  
20171007,10,라이언 고슬링의 선택이 옳았다 배우들 케미가 아주 터지네 ㅋㅋ  
20171007,10,모든 배우들의 연기가 완벽했다 엄청난 것을 보고온 기분이랄까..?  
20171007,1,보다가 지루해서 나가고 싶엇는데 누군가 먼저 나가길래 따라나왓다   별4개 어이없다  
20171007,10,더 세련되고 멋있어진 영화ㅠㅠ  
20171007,10,추석연휴에 개봉전 미리 볼 수 있어서 즐거워요^^  
20171007,10,와 예전의 블레이드러너와는 확실히 다른 느낌  
20171007,10,기대 이상이네요 드니빌뇌브 스타일의 연출로 독특하게 표현했네요 ㅋㅋ  
20171007,10,극장에서 봐줘야 정석인 영화!  
20171007,10,흥미진진한 스토리도 모자라서 연기는 물론 비쥬얼도 완벽했다  
20171007,10,완벽하다. 인생영화.  
20171007,10,전설의 블레이드 러너가 개봉하다는 소리에 소름 ㅋㅋㅋ  
20171007,10,현시대 SF블록버스터 장르에서 감동을 느껴보기엔 또 처음이네..21세기 최고의 SF영화랄까..  
20171007,10,블레이드러너가 주는 철학적 메세지… 와 지렸다 진짜  
20171007,10,원작의 파이널컷 제작비화까지 아는 사람이라면 이 영화를 낮게 평가할순 없을듯. 러닝타임은 일반인이 느끼기엔 지루했을수도 있으나 원작을 안다면 일분일분이 대단하다 느꼈을듯. 원작을 이어나가는 기술은 스타워즈보다 더 영리하고 소름돋았다.  
20171007,10,리들릿 스콧 감독이 제작에 참여해서 그런지 원작을 훼손하지 않으면서 더 멋진 영화를 만들어냈다. 개인적으론 전작보다 완성도가 더 높은 느낌  
20171007,1,이유는 모르겠지만 오늘 영화관에 하나 상영하길래 봤는데 보다가 나왔어요..  
20171007,10,블레이드러너 속편이 나오다니ㅜㅜ  
20171007,10,기다린 보람이있다 배우들의 이름 하나만으로도 볼 가치가 충했는데 영화는 상상 그 이상을 보여준다.  
20171007,10,이런 영화는 무조건 스크린각이지  
20171007,10, 직접 보기 전에는 많이 조마조마 했는데 전편의 그 느낌과 분위기가 고스란히 살아있어서 정말 좋았어요. 많은 것을 생각하고 느끼게 해준 영화입니다. 생소한 배우 아나 드 아르미스의 매력이라는 덤까지 얹어주네요  
20171007,10,스토리가 천재적이다! 까칠하고 말 안듣는 실패한 인조인간 추격자 = 블레이드 러너! 끊임없는 과학기술의 발전이 주는 인조인간의 정체성을 생각케 한다. 그들도 인간과 같음을 느낀다.  
20171007,10,잔잔하면서 계속 긴장감을 주는 임펙트있던 영화.인간보다 더 인간적인 안드로이드여서 가슴이 아팠던..  
20171007,10,강추합니다 전작 안봤어도 충분히 재밌을 영화!!  
20171007,10,실력파 제작진들의 영화:) 전작보다 재밌다  
20171007,10,"내가 듣고 싶은것을 들려 주었고, 내가 보고 싶은 것을 보여주었다.  "
20171007,10,사람에 따라 호불호가 갈릴 것 예상됨. 하지만 스토리를 조금이라도 읽어보고간다면 전혀 문제 될 것 없다. 드니 빌뇌브가 차세대 SF의 거장으로 손꼽히는 이유.. 이 영화에 다 담겨져 있다  
20171007,10,배우들의 인상깊은 연기가 기대 이상  
20171007,10,예고편 보자마자 ㅠㅠ 진짜 감탄했어요 후속작만 기다렸는데 드디어!!  
20171007,10,올 하반기 제일 주목할만한 영화 고품격 비쥬얼이란 이런거다라는걸 몸소 보여주는 영화. 긴 러닝타임에 가득 담아낸 영상미와 연출이 돋보인다  
20171007,10,캐스팅 하나는 지린다 라인업 때문에라도 봐야할 영화아님?ㅋㅋㅋ  
20171007,10,"진짜 인간이 아닌 K는 인간처럼 죽음이 두려웠을까?? 스는 조이를 진심으로 사랑했을까?? really 와 heartily의 차이를 안다면,,   진짜와 진심의 차이를 비교할 줄 안다면 이영화가 결코 지루하지 않을것이라고 장담하겠다..  "
20171007,10,제작진과 감독의 이름만 봐도 덜덜;; 엄청날 것 같은 예감이..ㅋ  
20171007,10,헐리웃에서 인정받는 감독의 작품이니만큼 최고의 연출을 보여준다..  
20171007,10,예고편 그 이상으로 꿀잼인 영화  
20171007,9,SF의 고전명작이라고 추앙받는 1편만큼의 후속작을 만드는것은 불가능이라고 생각했는데 드니 빌뇌브 감독이 해냈군요. 35년만의 후속작을 보고 벅차오르는 감동을 느꼈습니다. 단 액션 기대하시면 크게 실망하실듯..  
20171007,1,너무 지루하다 보다 조는 사람 많음  
20171007,2,1편보고 가실분들 다시 생각해보세여~이상  
20171007,9,"SF의 형식만 빌린 감동 드라마. 영화 상영시간 내내 몰입감도 좋습니다.- 드니 빌뇌브 감독의 스타일로 만든 드라마.  단, SF 영화만 생각하고 보신다면 극 실망과 지루하다고 하실 것 같습니다.  "
20171007,6,"절제된 분위기, 압도적인 무게감, 잠식된 철학적 세계관의 동어반복.  "
20171007,3,별5개? 눈 어디다 달고다니시는지..  
20171007,10,기대한 것 이상의 영화를 보고 왔네요 ㅎㅎ  
20171007,10,헐..너무 보고싶다ㅠㅠㅠ!!  
20171007,10,화면을 가득 메우는 영화의 분위기  
20171007,10,"SF영화는 스토리보단 액션만 중요시 해서 별로 안좋아헀는데 이건 스토리부터 시작해서 액션은 물론 영상미, 음악 뭐하나 흠잡을 게 없네요. 무조건 개봉하면 아이맥스로 한번 더 볼겁니다  "
20171007,10,너무 멋있었던 라이언고슬링ㅠㅠㅠ 로맨스 영화가 아닌 SF에서도 이렇게 여심 폭바 시키기 있긔없긔ㅠㅠ  
20171007,10,시간이 이렇게 빨리 지나가리라고는 생각도 못했다..  
20171007,8,82년 원작본 올드팬들은 환호를! 안본 사람들은 장장2시간동안 잠을 잘 영화! 원작봤음에도 솔직히 포드할배나오기전까진 살짝 지루했음. 하긴 원작도 전개가 막 흥미진진하진 않았으니까... 그 특유의 분위기가 좋았던 영화라서...  
20171007,10,눈과 귀가 황홀했던 영호 ㅏ^^  
20171007,10,다른 영화들보느니 이거 보는게 나음 같은 가격에 러닝타임도 길고 심지어 졸라 재밌음 ㅋㅋ  
20171007,10,리들리 스콧의 블레이드러너를 뛰어넘는 속편  
20171007,10,오늘 이 영화를 본 것에 후회란 없다  
20171007,10,배우만보고 선택한 영화인데 완전 멋있네요-_-ㅋ 원작이 어마어마하다고 들었는데 조만간 한번 찾아봐야겠습니다.  
20171007,10,역시 드니 빌뇌브 영화 답게 영상미가 대박입니다 ㅎ  
20171007,10,원작이야기만 조금 알고 갔는데 굉장히 재밌더라 ㅋ 3시간 조금 안되는 러닝타임인데  긴장감이 아우..  
20171007,10,이번 추석 연휴에 본 영화 중 최고였던 것 같음  
20171007,10,보고왔다 이건 쿠키영상때문에 엔딩크레딧보는 영화가 아니다  
20171007,10,N차관람예약 개쩔더라 ㅋㅋ  
20171007,10,어마어마한 영화를 보고 왔다  
20171007,10,그동안 봐온 SF영화들과는 확실히 다르네여 왜이렇게 칭송받는지 충분히 이해되요  
20171007,10,보지 않은 사람들은 모르는 황홀함  
20171007,10,리들리스콧과 드니빌뇌브의 조화는..♡  
20171007,10,드니영화ㅠㅠ넘나 기대대여!!! 엄청난 영화라는 말에 더 기대되네요!!!  
20171007,10,최근 본 영화 중 최고..미쳤다 그냥..  
20171007,10,실망할 수가 없는 영환데? 리들리스콧+드니빌뇌브인데?  
20171007,10,빵빵 터지는 액션 영화들과는 다르지만 이 영화만의 힘이 있다. 보는 내내 황홀하고 몽환적인 비쥬얼에 넋이 나가고 보게 됬다  
20171007,10,보는 내내 숨이 턱 막히는 느낌! 어마어마하다 이 영화  
20171007,10,2049년의 모습은 어떤 모습일지.  
20171007,10,"미쳤다 이영화는.. 분위기는 물론 영상, 음악, 메시지, 배우들의 연기 까지.. 흠잡을게 없는 완벽한 영화였다  "
20171007,6,재미는 없는데 집중해서 보게됨 감독이 관객 잠오는타임을 적확하게 인지하고있어서  그게  더 소름 공포영화도 이영화 싸운드 앞에선 암것도아님.그와중에 홀로그램 여자 엄청이쁨  
20171007,10,드니 빌뇌브의 영화가 주는 힘이 스크린을 가득 메운다  
20171007,5,눈요기는 좋았습니다 다만 너무 난해하고 러닝티임도 길어서 순수 재미만 추구하고 가시는 분들은 실망하실듯 하네요  
20171007,10,"재밌네요, 단 마냥 가볍게만 볼 수 있는 이야기가 아니라 호불호가 갈릴 듯 합니다. 두세번정도는 봐야 충분히 이해할 수 있을 것 같네요^^ 개봉하면 한번 더 보러 가렵니다 ㅎ  "
20171007,10,과연 인간이란 무엇인가? 업그레이드 된 세계관과 새로운 인물들의 존재가 돋보였다  
20171007,10,와 진짜 장면 하나하나가 다 명장면이다 ㅋㅋ  
20171007,10," 범죄도시,남한산성과 더불어 이영화도 각각 그장르에선 재미있게 봤네요개인의 취향일수 있지만...전 3시간동안 지루하면 자겠다고 생각하고 봐서 그런지 엄청 재미있게 봤네요보는동안 인셉션과 인터스텔라가 오버랩되는건...나뿐인가요~ㅎㅎ  "
20171007,7,취향갈림 감독이 흥행성 고려 안함 너무잔잔  
20171007,7,세계관은 흥미롭고 재밌음. 영화음악은 긴장조장. 미국에선 18세인데 한국에서 15세라는게 놀라울만큼 꽤나 잔인하고 자극적임. 액션을 기대하진 않는게 좋음.  
20171007,1,존나루즈함 비추 제목은 액션인데 까보면 개똥철학  
20171007,3,기대를 너무했단가? 황망한 영상미 말고는 너무 지루하다 어디서 평점 어쩌고 하는 말은 믿을게 못된다는게 믿었던 감독 영화보며 깨닫게 된다  
20171007,8,유료시사를 갔다왔습니다. 머리가 터질뻔했고요 심각하게 지루합니다. 하지만 소량의 액션과 연기로 돈이 아깝지않은 영화였습니다. 근데 이거 15금 해도되나  
20171007,1,"스토리전개는 심각할만큼 지루하고 이해하기힘들게 베베꼬아놨습니다. 블레이드러너의 팬을 위한영화, 그이상도 그이하도 아님  "
20171007,1,모든 사람이 1편을 다 알고 보는 건 아니죠 그러면 예고편이나 액션영화처럼 만들지 말지..  
20171007,1,"유료시사 방금 보고 나왔습니다. 오리지널 블레이드러너의 열혈팬으로서 이런 엉망스러운 후속작을 보게 되다니 정말이지ㅠ 스토리, 구성, 재미, 의미 뭐하나 제대로 잡지 못하고 지루하기 비할때 없는 영화입니다ㅠㅠㅠ  "
20171007,1,액션인지 다큐인지.. 지루합니다  
20171007,10,인간이되 인간이 아닌 것으로서 인간됨을 말하며 인간이 아니되 인간으로서 인간 아님을 말하지 않으며 흐린 안개속에 입김이 그것을 말하리라.  
20171007,9,어렵고 지루하다고 1점 주는 분들은 뭐죠 ;; 자기 무식한거 인증하는건가? 애초에 블레이드 러너를 오락물이라고 생각하는게 이상한거 아닌가;;  
20171007,1,우리아이가 잠든영화차라리 킹스맨이 15세인듯애랑보다 깜놀  
20171007,10,올해 외화 중 단연 최고였다.  
20171007,4,철학적이고 아름다웠던 명작이었던 전작에 비해 스토리도 영화진행도 지루했던 길고 긴 영화. 여전히 영화는 아름답고 Special effects 도 훌륭했지만 궁금증도 긴장감도 전혀 없다. 보는 내내 불쌍했던 라이언 고슬링.  
20171007,9,여기는 뉴질랜드이구요 방금 보고 왔습니다 마치 블랙홀에 빨려들듯 여지껏 보지못한 비주얼과 색감 ... 내안에 잠들었던 세포가 깨어나는 느낌.. 최근 5년동안 본 영화중 최고입니다  
20171007,10,이 영화를 보면 세상과 실연당한 느낌을 받을 수 있습니다  
20171007,1,저 오늘 보고 왔는데 왜 개봉전인건지는 잘 모르겠네요.난해하기 그지없고 이해 하나도 안되고... 인생 최고 쓰레기 영화였습니다. 돈 받고도 보기 싫네요... 영화는 또 왤케 길어  
20171007,8,진짜 잘 만들었다 배경음악하며 연출력과 20년전의 명성에 맡게 심오하며 철학적이다 다만..재미는 없다. 위트없는 철학자와 3시간 동안 타이트하게 대화를 나누는 느낌...루즈함 마저 들게하는 단 1정도의 비율로 대중성은 확실히 없어보이더라  
20171007,10,아이맥스로도 개봉하겠죠?  
20171007,10,러닝타임이 엄청나게 긴데 버릴 장면이 하나도 없다는게 함정.. 엄청난 영화를 보고온 기분. 여운이 상당함  
20171007,10,전작을 안봐도 보는데 무리는 없을 것 같네요  
20171007,10,모든 것을 뛰어넘는다. SF계의 새로운 신화가 다시 시작된다  
20171007,10,라이언 고슬링은 전편들과는 또 다른 멋진 모습을 보여준다!  
20171007,10,액션영화아닙니다 예고편보고 그대로믿고가심황당하실거예요 철학적인내용입니다영화는 많은뜻을 담고있음 좀어려워요  
20171007,10,"원작과 대비되는 부분이 많은듯, 뭔가 더 고급스럽고 아름답게 그려진 느낌  "
20171007,10,드니 영화 중 최고인 것 같다.. 나오는 영화마다 최고 갱신 ㅋㅋ  
20171007,10,이 영화만의 세계와 인물들의 매력이 돋보이네요 ^^  
20171007,10,"오락 상업무비를 기대하는 이들은 실망할 수도, 이 영화만의 세계관을 이해하는 사람이라면 만족  "
20171007,10,전작의 매력을 잘 살려내면서 또 다른 시각으로 표현해낸 듯 하다. 35년 전에 비해 발전된 기술을 최대치로 활용하여 더 멋있는 영화를 만들어냈다  
20171007,6,1982년에 개봉한 영화 《블레이드 러너》의 후속편. 원작 소설이나 영화를 보지 않으면 본 영화의 내용을 이해하는데 어려움이 있다. 역시나 《블레이드 러너 2049》는 전작을 뛰어넘지 못했다. 미래는 보이지 않고 과거와 현재만 가득하다.  
20171007,10,원작의 마지막에 흐르는 ost만 들어도 원작은 봤다고 말할수 있다. 공감하면 눌러  
20171007,10,라이언 고슬링 이런 영화는 첨인것 같은뎅>.<ㅎ 어떤 모습일지 궁금하네여!!  
20171007,10,해리슨 포드의 재 등장으로 원작과의 인연을 이어가면서도 색다른 느낌을 만들어냄! 흥미로운 스토리에 눈을 떼기 힘듬  
20171007,10,생각보다 더 쩔던데 ㅋㅋ  
20171007,10,"흥행성, 오락성을 배제하면서 자신만의 스타일로 만들어낸 세계.. 모든 면에서 완벽했다  "
20171007,10,열라 기대된다 평도 열라 좋던데ㅋ  
20171007,10,라이언고슬링의 필모 중 최고 정점  
20171007,10,나한텐 10점이지만 호불호는 많이갈리는듯  
20171007,10,긴 러닝타임시간만큼이나 다양한 걸 보여주려는 부분이 마음에 들었다. 1분1초 전부 버릴게 없었던 시간. 블레이드러너만의 분위기와 그들의 이야기에 빠져들어갈 수 밖에 없었다  
20171007,10,걍 개 쩐다라는 말밖에 나오지않아여 ㅎㅎㅎ  
20171007,10,괜히 리들리스콧이 드니빌뇌브를 선택한게 아니였다. 자신의 원작을 훼손하지 않으면서도 또 다른 디스토피아적인세계를 보여주는군..  
20171007,10,걍 한마디로 작품! 돈이 아깝지 않은 명작  
20171007,10,리들리 스콧을 능가하는 연출력ㅋㅋㅋ  
20171007,7,작품성은 좋지만 대중성이 떨어지네요..  
20171007,7,이게 어떻게 15세 관람가인지 잘 모르겠다.  
20171007,4,"개봉일전인데 개봉해서 보고왔는데, 너무 지루해서 힘들었어요. 액션이나 스케일 큰 그런 영화아닙니다. 그냥 독백씬만 반절이상인 철학적영화인데 보다가 나가는 사람도 있었네요. 너무 어렵게 푼 영화. 뭘 말하려는지 대충 알겠는데, 꼭 이렇게 해야했니...  "
20171007,1,유료시사 보고옴 너무 긴시간 지루하고 이해안되는 어려운 스토리 ?  
20171007,8,"블레이드러너-공각기동대-공각기동대2-블레이드러너2서로 닮아가는 것은 좋은 데, 대중적으로 설명하며 풀어지는 게 저는 아쉬움(물론 대중성은 더 좋아졌지만)  "
20171007,1, 별 하나도 아까운 영화다. 지루해 잠들만 하면 사운드가 커지는 고문받는 듯한 영화였다.  
20171007,10,드니 빌뇌브 감독의 연출력이 또 한번 인정된 상황.. 나오는 영화들 하나하나가 감탄을 자아내더니 이번엔 인정할 수 밖에 없는 영화를 만들어 냈구나. 전 작도 어마했지만 이번엔 어마어마해졌다.원작자이자 제작자인  리드리 스콧도 놀랐을듯  
20171007,10,현지호평 쩐다. 비록 원작만큼은 아니지만 무난히 좋은 리메이크 작일것 같다.  
20171007,10,SF의 거장과 새로운 SF의 거장의 만남  
20171007,10,식상한 여느 영화들과는 다르다. 기다림의 가치를 확연히 보여주는 영화  
20171007,10,일반관에서 봐도 영상미가 엄청나던데 아맥으로 보면 지릴듯 ㅋ  
20171007,10,미침ㅋ겁나 흥미진진ㄷㄷ  
20171007,10,"오히려 전작보다 더 잘만든 영화라고 생각이듬 얼마전에 전작을 봤는데 내 입장에서는 이해하기가 좀 어렵더라. 이번 속편은 전작의 이미지를 훼손하지 않으면서도 다가가기 쉽게 전개 된다. 그 외적인요소(음악,미술 등)들도 좋았다  "
20171007,10,정적인 분위기 속에서 느껴지는 엄청난 오로라  
20171007,10,드니 빌뇌브의 세계관과 블레이드 러너의 세계관이 너무나도 잘어울려서 소름 ㅎㅎ  포스트 놀란이라는 말이 괜히 나온게 아니었어 ㅎㅎ  
20171007,10,인간과 리플리컨트가 혼재된 2049년의 이야기 너무 궁금하다  
20171007,10,12일 까지 언제 기다려?  
20171007,10,자레드 레토 기대합니다 예고편 뜨자마자 개봉만 기다리는중 천재감독님 드니빌뇌브ㅜㅜ  
20171007,10,"CGV에 예매 되는거 보고 바로 예매했는데 킹스맨과 남한산성을 포기한 보람이 있다. 굉장히 독특한 세계관을 경험한 기분? 이제껏 본 스타워즈, 에이리언 등등의 SF영화들과는 느낌이 다르다. 개봉하면 한번 더 볼 ㅇ예정  "
20171007,10,대체 몇년을 기다린건지ㅜㅜ 후속작만 기다렸다구요  
20171007,10,미쳐씀.. 진짜 올해 본 영화중 최고랄까? 오락성이 짙은건 아니라 사람에 따라 호불호가 있을 것 같긴 하지만 엄청난 걸 보고 온 듯한 기분이다. 드니 빌뇌브 감독 이쯤이면 상도 한번 받을때가 된 것 같은데..  
20171007,10,전작은 안봤지만 배우들 때문에 꼭 볼겁니다  
20171007,10,내 인생 블록버스터 걸작이 개봉하는구나  
20171007,10,엄청난 영화가 개봉하는군 올 하반기 젤 기대되는 영화  
20171007,6,유료시사회로 보고왓는데 솔직히 좀 지겨움 쓸때없는 장면이 너무많다고 할까.. 드니빌뇌브 컨덱트도 지겨웟는데 ㅠ 좀 영화자체를 흥미롭게 진행한다기보다 한단계씩 밟아 나가는 느낌  
20171007,10,아놔.. 오늘 유료시사회 놓쳐서 개봉만 목빠지게 기다린다  
20171007,10,그 때도 최고였지만 지금도 최고구나..  
20171007,10,철학적인 메시지까지 뜬다하니 더 기대되는데?? 이런 영화는 무조건 영화관 사수다ㅋㅋ  
20171007,7,어제 유료시사회로 보고 왔습니다. 솔직히 실망스럽지만 그래도 좋은 면이 있어서 추천은 합니다. 영화광인 분들만 보세요  
20171007,9,와 이보다 더 기쁜 소식은 없을듯 기다려집니다  
20171007,10,세월이 지나 감독과 작가 바뀌면서 어떤 분위기로 전환되었는지 궁금하다  
20171007,10,개봉 일주일만 땡겨주지ㅠㅠ연휴 때 보고싶었는데 ㅠㅠ  
20171007,10,이건 닥치고 봐야할 영화!! 드니빌뇌브 감독님의 영화는 무조건 믿고 본다ㅎㅎ  
20171007,1,재미 없을 것 같습니다.  
20171007,10,예고편 영상만 봐도 오졌다  
20171007,10,2049년 미래에서 새로운 관계로 만나는 이들이 궁금하다  
20171007,6,SF 액션 블럭버스터가 아니어서 다행이었습니다. 빌뇌브 감독은 꾸준한 신뢰를 주는 감독으로서 어려운 과제를 잘 풀어낸 것 같아 다행이네요. 시스템이 좋은 영화관에서 보시기를 권해 드립니다 ^^  
20171007,10,sf블록버스터 전설이라 불리우는 영화 시나리오부터 죽이는듯ㅎㅎㅎ  
20171007,10,티저 트레일러 떴을 때부터 기대했어요 추석만 지나고 바로 보러가꺼에요 ㅎ  
20171007,10,와 진짜 반전 넘치고 대박 영화네  
20171007,10,취향저격이에요 ㅠㅠ예고편 어쩔거야 믿고보는 제작진과 배우들 말이 필요없네요ㅋㅎㅋㅎ  
20171007,10,전설의 블레이드러너. 왜 전설이라 부르는지 확인하고 왔다. 엄청나네 진짜  
20171007,10,인생영화다.. 이런 고퀄리티 영화 얼마만이냐..  
20171007,10,헐..드니 빌뇌브 때문에 기대되쟈나  
20171007,10,이거 개봉 실화냐? 최고로 기대됨  
20171007,7,"세기 말 원작의 미래 세계에는 설득 당했으나, 21세기 감독이 보는 미래가 전후 서구 열강들의 씻김굿 장치 미니멀리즘(차갑고 허무한 일본의 근간)으로 포장한 것은 진부하다. 지구와 문명이 정복되고 소모된 부작용은 그들의 선택이지 우리의 미래는 아니기에  "
20171007,10,이정도면 최고의 기대작 아닐까? 아무래도 보기전에 전편 다시 봐야겟다 ㅋ  
20171007,10,제발 걸작의 명성을 이어갔으면 ㅠㅠ  
20171007,10,현실성 있는 연출력 또 한번 기대합니다  
20171007,10,이걸 후속작까지 보게되다니..진심 영광스럽다  
20171007,10,벌써부터 아드레날린 뿜뿜  
20171007,10,블록버스터 영화의 전설이라고 불리우는 영화 ^^꼭 보세요  
20171007,10,신나는 액션이 많을 줄 알고 봤는데...생각과 다른 영화였고 참 좋은 영화였음! 배우들 연기 지리고 많은 것을 생각하게 됨!  
20171007,10,최고의 걸작 블레이드 러너! 음악감독이 무려 한스짐머;;; 음악도 좋을 듯  
20171007,10,오늘 보고 왔는데 엄청나더라 ㅋㅋ와서 찾아보니까 어마어마한 영화였네... 원작이 있다는 것도 몰랐었는데 1982년도ㄷㄷ 소름이다  
20171007,10,라이언 고슬링의 연기가 기대됩니다  
20171007,10,전편이 진짜 대단했는데ㅜㅜ 얼른 보고싶다  
20171007,10,충분히 기대할 가치가 있는 영화라고 생각함  
20171007,10,전설의 블레이드러너 다시한번 기대합니다  
20171007,9,평점이 극과극인 이유는 보면암. 어떤사람한테는 올해최고영화 어떤사람은 이걸보려고3시간?자괴감드립나올수준. 참고로 이영화는 떡밥이 없다  
20171007,10,또 한번 역대 블록버스터 영화 탄생?  
20171007,10,이 작품의 위대함이 벌써부터 느껴진다  
20171007,8,드니 빌뇌브의 영상 미학은 정말 역대급이다 아카데미 5개이상 수상 예상한다  
20171007,10,예고편 보고 기다린지가 몇달이 지났는데 이제 진짜 나오네요!! 기대합니다 전편 분위기를 어떻게 이어갈지 궁금하네요  
20171007,10,제작진은 그냥 드림팀이네ㅋㅋㅋ예고편만 봐도 미쳤더라 ㅎㅎ  
20171007,10,이0건 그냥 믿고 봐야하는 영화다  
20171007,10,미친 비쥬얼 영화 !드뎌  담주 개봉하네요 제발 재밌기를  
