0,1,2
20171008,6,스토리는 괜찮은데 런닝타임만 좀 줄였으면 좋았을거같아요.. 영화가 늘어지네요 그리고 그닥 선정적이라고 하는게 애매한데 여자 가슴은 좀 많이 나와요  
20171008,9,마지막에 계단신에서 오리지널 블레이드러너와 하나가 된듯했다. 감동적이었다.  
20171008,5,블레이드 러너만 열몇번보고  후속나온다고해서 몇년 기다렸는데 막상 유료시사회가서 한 도합 20분 졸다나옴 쩝...-_-; 배우도 좋코 다 좋은데 ...  
20171008,2,◇아~~ 시간끌기의 정수를 보여주네요~~ ◇큰 의미도 없이 슬로우 모션보듯 느린 전개에 분통터지다가 뻔한 결말을 보고 2시간 넘게 버틴 내 자신에게 위로를 줘야만 했다. ◇소문난 잔치에 먹을거 없다는 속담에 딱 ~ 어울리는 영화다!  
20171008,7,대놓고 복선 깔아서 반전이 눈이 보일 정도라서 스토리는 도저히 좋은 점수 못 줍니다. 영상미 음향 1편의 재현은 좋은데 너무 기대했는지 좀 실망..매드맥스 인터스텔라 그래비티와 같은 급은 절대 아닌 듯.. 걍 수작.  
20171008,1,10/8 신도림 CGV 5:55 지금막 보고 나온다 ㅋㅋㅋ 꼭봐라 두번 봐라 나만 당할수없지 ㅋㅋㅋㅋ  
20171008,7,1편에 열광했던 관객들에게만 유의미한 영화.번식가능한 리플리컨트라면 이미 인간이 아닌가?  
20171008,10,전작을 봐야 이해가 가는 영화입니다.반젤리스와 비슷한 배경음악에 귀를 의심했고 전작과 비슷한 음울한 세계관에 크게 위화감 없었던 2049를 감상했는데 시종일관 여백의 미가  아름다워 기억에 남는군요.  
20171008,2,너무 지루함. 질질끄는 느낌이 들어서 진짜 별로에요 시간이 짧은 것도 아닌데...몸 뒤틀리는줄알았습니다.  
20171008,9,"이 영화를 보고 내가 이때까지 본 SF영화들을 잊음. 이게 SF지 하고 박수치고 싶었음. 참고로 난 루즈해도 재미있게 봤지만 끝나마자마 뒤에서 ""무슨 이딴 영화가 다 있어""라며 욕함.  "
20171008,9,10/8 메가박스에서 관람한 관람객입니다.블레이드 러너가 정확히 어떤 영화인지 알고 본 사람에게는 보석같은 영화이지만~ 그렇지 않은 사람에게는 다소 어색할 수 있는 영화~ 그리고 영화가 끝난 후 다시 철학적 질문을 생각하게 끔하는 영화~  
20171008,1,정신병자가 만든 영화...이걸 영화라고 만들었냐? 또라이들아  
20171008,9,화끈한 액션은 없어서 루즈한 면이 없잖아 있지만 이야기 전개 과정이 상당히 흥미로워서 끝까지 집중하면서 봤을 정도로 전작과 버금가는 수작이라 생각함  
20171008,6,너무 길고 루즈하고 그냥 그랬다....  
20171008,10,미친 영화... 대사 하나하나 집중해서 봤다.아이멕스로 한번 더 볼듯...  
20171008,10,모든게. 신비롭고잼있는 !!꼭보아야함. 두번봤음. 뇌리서 잊혀지지않네요. ㅎ  
20171008,10,빌뇌브는 진짜 미쳤다 진짜 미쳤어  
20171008,10,유료시사회 보고 왔는데 리부트가 아니고 30년 뒤 이야기인 속편이니까 원작 꼭 보고 보세요. 힘들다면 원작에 대한 정보라도 조금 찾아보고 보시길. 원작 팬인 제게는 올해 최고의 영화였습니다.  
20171008,6,웅장함은있지만너무지루하네요내용도잘모르것고  
20171008,10,인간보다 더 인간 다운 복제인간 진짜 이런 시대가 올까?  
20171008,10,블레이드 러너 원작 2019년 이후의 30년.. 궁금하다..  
20171008,10,"감독이나 배우 이름만 보고 보시려느 분들, 예의상 원작은 한번쯤 보고가세요^^ 더 재밌게 보실 수 있을거에요^^  "
20171008,10,좋은 점수를 줄 수 밖에 없네  
20171008,10,전체적으로 흥미로움. 드니 빌뇌브만의 스타일이 돋보이며 한스짐머가 참여했다는 음악도 완벽한 조화를 이룬다  
20171008,10,죽기전에 꼭 봐야할 영화 중 하나인 블레이드 러너!! 정말 기대됩니다!!  
20171008,10,드니 영화들은 하나같이 다 완벽해..  
20171008,10,원작의 세계관을 이어가면 또 다른 영화를 만들어냈다.  
20171008,10,원래 이런 스타일의 영화는 사람들이 말이 많은 법이지.. 바보들..  
20171008,10,기대되요.. 라이언 고슬링.. 해리슨 포드..  
20171008,10,완벽했던 디스토피아세계. 상상 그 이상의 영화  
20171008,10,인간다움이란? 여러 생가을 하게 만드네요. 마냥 가볍게만 볼 수 있는 영화는 아니었어요  
20171008,10,원작은 다운받아 봤지만 이건 꼭 극장에서 볼거임ㅎㅎ  
20171008,10,슬쩍 지나가는 한국어에 괜시리 반갑ㅎㅎ 영화잼나네요 ㅎㅎ  
20171008,10,블레이드 러너의 전설을 재 확인 할 시간이 다가오고 있다  
20171008,10,좋습니다.. 푹 빠져서 봤네여.. 다만 일반적으로 생각하는 그런 오락적인 요소가 들어있는 SF영화가 아니라 실망하시는 분들이 계실 듯 하네여^^;;  
20171008,10,라이언 고스링 팬으로서 굉장히 기대되요..  
20171008,10,러닝타임이 길어서 쪼매 힘들긴 했지만 볼만한 영화임은 확실합니다 ㅋㅋ  
20171008,10,드니빌뇌브 전작들을 이해하고 재밌게 본 사람들이라면 강추!  
20171008,10,흥미유발하는 소재들로 긴장감을 조성하다니요! 역시 드니찡ㅋㅋㅋ 짠한 감동을 주는 부분도 있고 꽤나 괜찮은 영화네요!  
20171008,10,어렵다는 말들이 좀 있길래 걱정했는데 막상보고오니 원작을 안본 사람들을 위해서 배려를 많이 했다는 생각이 드는데.. 웃고 즐길 영화를 찾는다면 그냥 킹스맨이나 봐라  
20171008,10,영화의 분위기가 주는 압도적인 무언가(?)가 있다 철학적인 메시지와 함께 눈호강 제대로 하고 왔다ㅎㅎ  
20171008,10,장면 하나하나 다 명장면이었다ㅠㅠ오랜만에 보는 고품격 퀄리티의 영화  
20171008,10,"흥미로웠던 영화, 보는 내내 눈을 뗄 수 없었다..  "
20171008,10,SF영화의 전설.. 시대를 앞서가 외면당했지만 이번에는 꼭 인정받길  
20171008,10,드니 빌뇌브의 영화를 아는 사람이라면 기대할 수 밖에 없는듯  
20171008,10,10월달은 영화가 풍년이네요..  
20171008,10,오리지널 원작의 바로 뒤를 잇는 연출이 돋보임!! 너무 오래되서 방향성을 잃었으면 어쩔까 걱정헀느데 안해도됬음 !!  
20171008,10,오랜만에 만나는 고 품격 영화  
20171008,10,진짜 흥미진진 ㅋㅋㅋ뭐이런 미친 영화가 다있어.ㅋㅋ  
20171008,10,무조건 N차 관람 필수인 영화네요 ㅎㅎ  
20171008,10,K의출생의 비밀을 찾아가는 방법이 흥미롭습니다. 전작의 의미를 그대로 이어가면서 또 다른 굉장한 영화를 만들어냈어요  
20171008,10,인간이란 무엇인가? 이 영화를 보면 해답을 찾을 수 있음  
20171008,10,와 진짜 오랜만에 진짜 영화를 본 듯한 기분.  
20171008,10,이 영화 아우라가 대단하네여ㄷㄷ;;  
20171008,10,원작 팬들을 위한 영화! 안 본 사람은 시놉시스라도 읽고 가시면 도움이 될 것 같네요^^  
20171008,10,무언갈 꺠닫게 하는 영화랄까.  
20171008,10,전작에서 보던 분위기 이상으로 오묘한 느낌? 진짜 우리의 미래는 이렇게 어둡고 몽환적일까?  
20171008,10,원작을 본 제 입장에서는 굉장히 흥미롭고 좋은 영화였습니다. 이 영화 자체를 모르는 여친님은 좀 어렵다고 하네요. 원작을 보시던가 스토리를 좀 알고 가시면 더 좋을 것 같습니다  
20171008,1,"최악이다... 내 3시간 돌려줘!! 감독은 예술영화를 찍고 싶어한듯,, 미안한 말이지만 잠자기 딱 좋은 영화  "
20171008,10,등장인물이 어마어마하네요;; 라이언고슬링에 해리슨포드;; 이거 무조건 극장행 아닌가요?  
20171008,10,보기전에 원작을 보고 간다면 더 없이 좋을 것!  
20171008,10,원작의 장점을 고스란히 이어가면서 새로운 미래에 대한 이야기를 자연스럽게 풀어냅니다  
20171008,10,"영화의 퀄리티가 엄청나다, 이해와 생각을 요하는 영화이긴 하지만 스토리, 영상, 연출, 음악 전부 깎아내릴게 없는 영화라는 건 확실, 자신이 이해하지 못한 걸 재미없다고 몰고 가는 사람들은 못배운걸 티내는게 확실하다ㅡㅡ..  "
20171008,7,워.. 10.8 롯데시네마 2시반 보고나왔는데 깜짝 놀랐네요.우선 전작에 대한 정보가 하나도 없는 상태라 완벽히 이해가 되진 않았지만 시사하는 메세지나 얘기하고자 하는 주제는 참 마음에 들었습니다. 다만 좀 길고 루즈합니다. 액션은 크게 없어요.  
20171008,10,첫장면부터 눈길을 사로잡는다..  
20171008,1,엥간하면 평점 안남기는데...유료시사회 있다해서 남들보다 빨리보고싶어서 연휴에 시간내서 거즘3시간을 투자하고...전날 전편 복습하고 프리퀄 영상 2개 찾아보구 그리고보러갔습니다...그걸 이렇게 만드냐....이딴식으로 만들고3편 만들라고 폼 잡드만...  
20171008,10,헐랭. 배우로 보나 감독으로 보나 제작자로 보내 기대할 수 밖에 없네요 ㅋㅋ  
20171008,10,인류멸망은 인류때문에 온다는걸 또 한번 느끼게 해줌  
20171008,10,진짜 리플리컨트라는 존재가 존재하면 어떨까..  
20171008,10,2049년의 미래를 상상해보게 되네요  
20171008,10,대단한 원작에 대한 부담이 컸을텐데 굉장히 잘만들었네요. 리들리 스콧이 믿고 맡길만 합니다 ㅎ.ㅎ  
20171008,10,완전 보고싶은 영화에여!!+_+  
20171008,10,드니X스콧 믿고 충분히 볼만해요  
20171008,10,이거 미친거아님?ㅋㅋ 진짜 푹빠져서 봤다 ㅋㅋ  
20171008,10,이 영화를 선택한 것에 대한 후회는 없다..  
20171008,10,전작을 좋아하는 사람들이라면 꼭 보라고 하고싶음  
20171008,10,가볍게 볼만한 영화로는 추천하고 싶지 않네요.ㅎ 하지만 조금이라도 알아보고 이해하고 보신다면 엄청난 경험을 하실섭니다  
20171008,10,원작의 분위기와 느낌을 이어가면서 또 다른 거대한 영화를 만들어냈다  
20171008,10,끝 없이 이어지는 블레이드러너만의 새로운 세계관!  
20171008,9,원작에 이어 또 한번 충격 받음  
20171008,10,와… 진짜 신비로운 영화를 본 기분이에요  
20171008,10,"최대 한글 140자까지 가능하며, 스포일러는 삭제될 수 있습니다.이 영화가 어떤 의미를 주는지도 모르고 본다는걸 굉장한 실수를 하는 것일듯. 꼭 내용을 한번 이해하고 보시길  "
20171008,10,드니빌뇌브 감독 특유의 매력이 돋보이는 영상미와 음악들!! 진짜 눈과귀가 즐거운 영화라는 말이 딱 ㅎㅎ  
20171008,10,전편의 세계관을 고스란히 간직하면서 더 깊은 질문을 내던지는 드니 빌뇌브의 연출. 전작보다 더 암울하고 복잡해진 2049년..  
20171008,10,sf영화를 좋아한다면 무조건 보세요  
20171008,10,원작에서는 풋풋했던 해리슨 포드가 이제는 많이 늙었지만 그래도 멋있더라. 블레이드 러너만의 분위기를 그대로 간직하면서 엄청난 이야기를 풀어내는 연출은 기대할만하다  
20171008,10,SF영화의 바이블이라고 불리는 이 어마무시한 영화의 속편이라니  
20171008,10,솔직히 기대되는건 어쩔 수 없다..  
20171008,10,아무에게나 추천하기는 어려운 영화일 것 같긴 하지만 나같은 영화광들에게는 무조건 보라고 하고싶음. 신세계를 경험할 것  
20171008,10,어쩌면 드니빌뇌브는 크리스토퍼 놀란이나 리들리 스콧을 뛰어 넘을 수 있을 듯 하다\  
20171008,10,하 이영화는 미쳤어요ㅠㅠ진심 대박이에요ㅠㅠ  
20171008,10,재미와 상업적으로 집중한 영화는 아니지만 원작 팬들에게 상응하는 노력과 전개방식이 마음에 든다.  
20171008,10,K와 데커드의 조합이 이루말할 것 없이 완벽했다  
20171008,10,누군가에겐 지루할 수도 있고 누군가에겐 엄청난 재미가 있을 수 있는 영화임. 생각하는걸 싫어한다면 비추 스토리텔링을 중요시 한다면 강추  
20171008,10,와.. 이렇게 경이로운 영화는 진짜 오랜만이었어요. 전 담주에 한번 더 보러갈 예정입니다ㅎ  
20171008,10,블레이드러너만의 주제를 그대로 이어가면서 자연스러운 전개를 보여준다. 세월이 변한 만큼 퀄리티도 엄청 높아진듯  
20171008,10,라이언고슬링 주연이라니까 궁금하네요..  
20171008,10,"속편으로써의 자격을 충실히 해내는 영화,  "
20171008,10,일단 보실 분들은 전편의 스토리를 대충이라고 훑어 보시고 가는걸 추천합니다. 그거 잠깐 읽는데 5분 10분이면 충분합니다. 영화를 재밌게 보려면 그정도 노력은 감수해야죠 ㅎㅎ  
20171008,1,최악이네요~~지루하고 내용도 없고~~최근 본영화 중에 최악이네요~~  
20171008,10,진짜 2049년은 어떤 모습이 될지 궁금하다 영화와 같은 방향이면 개소름일듯  
20171008,10,복제인간이라는 소재를 한 영화 중에 최고 명작이 아닐까 싶다ㅋㅋ  
20171008,10,기대림을 충족시키는 영화가 탄생했기를..  
20171008,10,드니빌뇌브 만의 독특한 연출법과 스토리텔링이 기대되요 ㅎㅎ  
20171008,10,K의 매력에 빠져들다.. 안그래도 어제 엠OO에서 라라랜드하는거 보고 검색하다가 알게 된 영화라 보고왔는데 진심 대박이네요..  
20171008,10,신뢰하고 봐도 될만한 영화였습니다^^  
20171008,10,시대를 앞서가 외면 받았던 그영화.. 이제 제대로 빛을 발할때가 온건가? 21세기 떠오르는 SF의 거장 드니빌뇌브와 원작자인 리들리스콧의 만남이라.. 기대를 안할 수 없겠구만..  
20171008,10,35년만에 나오는 이야기라니ㄷㄷ 기대되네요  
20171008,10,전편 이상의 속편이 탄생. 경이로울지경..  
20171008,10,마냥 가볍게만 볼 수는 없는 영화이지만 여운이 상당하고 엄청난 영화를 본듯한 느낌이에요  
20171008,10,"2049년은 어떤 모습일지 궁금합니다 ㅠㅠ 분위기도 좋고 영상,음악,메시지 다 좋음  "
20171008,10,미쳤다 그냥 올 해 하반기 최고의 영화라고 해도 과언이 아니다ㅋㅋ  
20171008,10,사실 보기전부터 실망할 수 없는 조합었지.. 하지만 생각한 것 보다 더 대단하다.. 드니 영화는 무조건 최고를 갱신하네..  
20171008,10,어마어마한 영화 오락무비처럼 웃기거나 빵터지거나 화려핸  액션영화들과는 다르지만 엄청나다  
20171008,10,장면 하나하나 다 명장면인거 실화임?  
20171008,10,드니 영화ㅠㅠ 기대이상입니다 업그레이드된 세계관이 돋보였어요  
20171008,1,개봉전 죽전cgv에서 와이프랑 봤는데 정말 지루하고 시간이 정말정말 안가는 영화는 오랜만입니다 중간에 나가는사람도 꽤나 많네요... 정말 스토리 전개가 지루하게 2시간반동안 늘어집니다 잠오는거 정말 참고 와이프 졸고 옆에 남자분도 주무시고....  
20171008,1,호불호 확실히 갈립니다 8명이서 봤는데 3명만 재미있다고 하네요  진짜 루즈하고 스토리의 반전은 감흥이 없습니다 연출을 공부하기 위해서 보는영화  
20171008,8,봐도  괞은   영화   추천   잼없으면  쫄던지 자는데  안잠참고  전  영화  개봉착이면  거희 다봄  
20171008,10,시나리오 그래픽 영상 다 좋았어요 시종일관 무미건조한 것도 좋고 ㅋㅋ 이전 작이랑 분위기는 좀 달라요 좀 덜 세기말 같아요 ㅋㅋ 블레이드 러너가 혼란의 디스토피아라면 2049는 그게 자리잡고 통제된 디스토피아 느낌  
20171008,1,이감독은 항상 음악을 귀청 떨어질것같이 떡칠해놓는데 일부 사람들은 이걸 좋다고 표현한다.. 이해할수 없음. 상업영화 좋아하시는 분들은 절대 이거 안보는걸 추천합니다. 정말 지루하고 재미없어요.  
20171008,10,드니빌뇌브잖아더 말이 필요해?  
20171008,10,"어제 봤습니다. 꼭 2019를 먼저 보고, 2022를 본 뒤에 2049를 보시길,,,최고!!!  "
20171008,5,액션영화가 아니다 말많고 지루한 영화다. 참을수있다면 즐기길  
20171008,2,영화를 참 좋아하는 부부라 장르 안가리고 보는데.. 보다 자다 깨다가.. 중간에 시간이 아까우니 집으로 갈까하는 고민을 한 영화는 처음임..  
20171008,10,거의 3시간 되는 런닝 타임이 길다고..지겹다고하는...그런 사람들은 아무 생각 없이 보는..트랜스포머가 딱인것 같은데..ㅋㅋ.왜 웃에 안맞는 이런 영화를 봤을까..나는 진짜 재미있게 봤는데..영화 다 보고 여운도 남고..^^  
20171008,10,엄청난 몰입감을 선사하지는 않지만 드니빌뇌브 특유의 연출력으로 괜객을 잡아 끌어서 끝까지 집중하게 만든다. 그래서 이 때문에 영화가 끝나고도 잔잔하면서도 강한 여운이 우리를 자리에 계속 붙잡아 둔다   feat.유료 시사회  
20171008,2,호주에 살구요.. 어제밤 보고왔는데... 배경은 고스터인더쉘이랑 진짜 비슷..반전 몇번나오긴하는데.. 놀랍지도않고.. 잠들지않으려고 노력을 참많이했네요.. 러닝타임이 2시간반정도 엄청 깁니다.. 라이언고슬링만 볼거면 추천합니다..  
20171008,10,하... 올해 최고의 영화입니다.  
20171008,5,악녀이후로 졸다 깨다 중간에 나가고싶은 영화는 간만이네..그많은 제작비 그래픽에 쏟아부었는지 의문이고 어떤 메세지를 줄려고 햇는지는 알겟는데 너무 지루하고 씬마다 연결성도 떨어지고차라리 1편을 다시보는게 정신건강에 이롭다. 예의상5점준다...  
20171008,10,세기의 명작. 필립k.딕이 살아있었다면 이 영화를 보고 찬사를 보내지 않았을까.. 존재의 의미와 가치를 고민하게 만드는 영화. SF영화의 새로운 바이블이 탄생했다.  
20171008,3,지루함!! 졸았음  여기알바들많다김수현에 리얼느낌여자들나체는 왜케 넣었는지불편정말지루  
20171008,10,영화가 주는 힘이 스크린을 가득 메운다..  
20171008,10,아는 사람들은 알겠지만 원작은 흠잡을게 없는 완벽한 영화였다 2049년은 어떤 모습일지??  
20171008,10,한번 보는 것 보단 두번 세번 볼 때 더 진가를 알 수 있을 듯 하다. 개봉하면 cgv아이맥스와 메가박스 M2에서 각각 볼 예정임  
20171008,10,ㄷㄷ예고편만 봐도 쩐다 배우들의 연기 또한 최고일듯?  
20171008,10,전작의 매력을 살려내면서 또 다른 시각으로 잘 표현해낸 듯. 블레이드 러너만의 세계관이 더 확장되어 또 하나의 새로운 영화를 보는 기분이 든다  
20171008,10,여운이 상당하다 뭔가 고급스럽고 아름답게 그려진 느낌!!  
20171008,6,소문난 잔치에 먹을것이 없을까?...무슨 배짱으로 일부 미리 개봉을 했을까?...러닝타임도 넘 길다고 느껴진다.  
20171008,10,드니 영화중에 최고다 ㅠㅠ 나오는 영화마다 최고 갱신하네..이번엔 내가 평가할 수 없으 정도로 경이로운 영화였다.. 리들리 스콧이 이 영화보고 무슨 생각을 했을까..  
20171008,10,이영화만의 세계꽌을 이해하는 사람이라면 꼭 보세요 ^^  
20171008,10,모든것을 뛰어넘는 영화 SF계의 새로운 신화를 다시 쓰는군요  
20171008,10,드니.. 이정도면 상받아야되는거 같은데..  
20171008,10,러닝타임이 길지만 버릴 장면이 1도 없다 블레이드 러너 개봉만을 기다린 보람이 있다.  
20171008,10,내 기준에선 전작을 안봤어도 보는데 무리가 없을 듯  
20171008,10,드니 영화중에 최고인 것 같다  
20171008,10,호불호가 갈릴듯한 영화지만 전작을 봤다면 이번 2049도 필히 보시길  
20171008,10,엄청난 영화를 본 기분이랄까? 아이맥스로도 보고싶네요  
20171008,10,마냥 가볍게 볼 수만은 없는 영화라 성향에 따라 재미 없을수도 있겠네요. 개인적으론 좋아하는 스타일의 영화라 보는 내내 두근두근했어요. 무엇보다 영상미가 대단합니다.  
20171008,10,"미쳤다!! 배우들의 완벽한 연기와 더불어 흠잡을 데 없는 비쥬얼과 메시지,영상,음악까지..올해 본 영화 중 가히 1등이라고 손꼽아도 될듯 ㅋㅋ  "
20171008,10,최고의 블록버스터 영화ㅠㅠ일단 비쥬얼이 반 먹고 들어가도 스토리에 매료된다. 해외 호평이 이해가는 순간!!  
20171008,10,보는 내내 숨이 막혔다..  
20171008,10,이 영화 진짜 재밌게 봤었는데 2049년은 과연 어떤 모습일지 궁금하다 예고편만 잠깐봐도 이 영화만의 힘이 느껴짐  
20171008,10,이 영화만의 세계와 인물들간의 매력이 돋보입니다  
20171008,10,"올 하반기 극장을 사로잡을 영화. 상상 이상, 모든 것을 뛰어넘는다..  "
20171008,10,블록버스터의 전설이라고 불리우는 블레이드 러너..다음주에 아맥으로 예매햇다.. 아 설레..  
20171008,10,감탄했다 엄청난 무언가를 본 듯한 기분이랄까  
20171008,10,"러닝타임이 길긴 하지만 보는 내내 시간가는줄 모르겠던데요? 다만 같이 본 사람은 좀 힘들어하더라구요. 생각없이 보는 오락무비를 좋아하는 분들에겐 비추, 의미있는 영화나 예술영화를 좋아하는 분들이라면 강추합니다.  "
20171008,10,예고편 보자마자 지렸는데 직접보니 더 지리네여 -_- 역시나 최고였습니다  
20171008,10,설마설마 했는데 드뎌개봉 ㅠㅠㅠ완전 감동이에요  
20171008,10,원작 그 이상으로 볼만한 가치가 있는데? 해외언론평도 좋고 국내에서도 대박날듯!!  
20171008,10,"라이언고슬링, 해리슨 포드의 캐미가 ㄷ ㄷ 굿굿  "
20171008,10,"배우들의 탄탄한 연기력과 압도적인 비쥬얼, 깊은 여운을 남기는 메시지 이들의 완벽한 조합!!  "
20171008,10,초호화 제작진의 합심으로 만들어낸 고품격 비주얼 영화  
20171008,10,비주얼과 스케일이 후덜덜… 리들리 스콧 제작에 참여한게 대박이네 ㅋ빨랑 보고싶다 ㅋ  
20171008,10,관객들이 단번에 매료될 요소가 가득 들어있네요 ~~이제껏 보지못했던 영상미에 입이 떡..ㅎㅎ 시종일관 눈이 즐거웠어요  
20171008,10,작품의 완성도가 최고였어요.  
20171008,10,이번에도 제대로 강렬합니다 아직 유료시사로 본 영화이기도하고 개봉전이니 자세한 내용은 생략하겠지만 배우들의 케미는 엄청난 시너지를 발휘할 뿐이고~  
20171008,10,미쳤다 지린다.. 배우들 자부심이 장난 아닌 이유가 있었음 해리슨 포드의 나이먹은 모습도 자연스럽게 그려졌고 라이언고슬링의 연기력이 상당하다  
20171008,10,"재미 뿐만 아니라 작품성, 비쥬얼 스케일도 제대로 잡았다  "
20171008,10,"올 하반기 최고의 영화라고 해도 과언이 아닌, 블레이드 러너  "
20171008,10,핫한 배우들의 총집합!! 본다면 진짜 기대이상일수 밖에 없는 영화  
20171008,10,블레이드러너 속편 와 감동받고 왔다 반응 장난 아니던데?  
20171008,10,압도적인 스케일에 깜짝 놀랐다.. 모든 배우들의 역할과 드니 감독의 재해석까지.. 진심 완벽했다  
20171008,10,이건 진짜 극장각이다 ㅋㅋ  
20171008,10,오늘 예매 가능하길래 당장 보고왔습니다 이건 뭐 제가 말이 필요없는 영화죠. 보세요 무조건 추천이에요  
20171008,10,이런건 정말 극장에서 봐줘야지~  
20171008,10,정말 감동적인 영화.. 러닝타임이 길긴 한데 보다보면 금방감. 그리고 버릴 장면이 하나도 없다는게 진짜 놀랄 노자였음  
20171008,10,역시 믿드니 ㅜㅜ 원작을 능가하는 압도적인 스케일과 흥미진진한 스토리~ 와 흠잡을 데가 없네 진짜 ㅋ  
20171008,10,기다린 보람이 있다 원작 그 이상의 가치^^  
20171008,10,재미뿐만 아니라 철학적인 메시지까지.. 잘만든 작품을 본 기분  
20171008,10,숨막힐 정도로 놀랍다 ㅠㅠ  
20171008,10,sf영화계의 시조새라고 할 수 있는^^  
20171008,10,사람들이 엄청나게 열광할만하네. 이런 영화일줄은 상상도 못했다.. 영화에서 느껴지는 그 분위기는 말로 설명할 수 없다..아 그리고  라이언고슬링 라라랜드와는 또다른 모습에 반했네ㅋㅋ  
20171008,10,넘나 기대했는데 역시나 이번에도 강렬하다..  
20171008,10,그냥 블레이드 러너 라는 것만으로도 기대된다  
20171008,10,진짜 눈을 뗄 수 없었습니다.. 오늘 이 영화를 선택한게 후회가 없어요  
20171008,10,라이언 고슬링의 선택이 옳았던 거 같다 더 세련되고 멋있어진 후속작!!  
20171008,10,전설의 블레이드 러너 개봉 실화임??? ㅎㅎ  
20171008,10,내가 봐온 블록버스터 영화중에 최고라고 생각합니다  
20171008,10,드니빌뇌브가 명감독이긴 해… ㅋ  
