0,1,2
20161230,1,알바생 ㅜㅜ 당했다 내 돈줘요 알바님  
20161230,10,이번편은 너무 재미 있게 보고왔습니다. 예전 스타워즈 내용 이전 내용이었네요  
20161230,10,7편은 매우 실망했는데 로그원은 진짜였음..  
20161230,10,스타워즈 팬으로서 정말 좋았고 마지막 다스 베이더 씬은 진짜 최고의 악당 같았다  
20161230,9,깨어난 포스가 나왔을때 반갑기도 했지만 영화보며 살짝 아쉬움도 있었는데 이야기의 순서를 따지자면 3.5편이 될 이 영화가 스토리도 그렇고 무게감도 그렇고 영상미도 깨어난포스보다 낫다. 영화 마지막 레아공주의 모습은 완벽히 4편과 연결된다.  
20161230,10,스타워즈 로그원 굿 다스베이더 지림  
20161230,8,"무난함. 스토리를 꽉 채운 느낌이고, 몇몇 장면은 향수를 자극하지만 전투신에서는 별 감흥을 느끼지 못했다. 범람하는 SF대작들 때문에 이정도 전투신에 크게 감명받기는 어려울 듯. 기대보다 무난한 작품이었음.  "
20161230,10,스타워즈 오프닝영상이 좀 바뀌어서 아쉬운 부분이 잇지만 나름대로 로그원 의 특색을 잘보여주었고 뒤로 갈수록 점점 빠져드는 영화!!타킨총독은 진짜 현실같이서 놀라웠어요!!! 스타워즈 시리즈에서 탑3안에 들정도로 재미있었고 특히 카시안!사랑입니다> <  
20161230,7,관람객결국 그거하나가 중요한거 였군요  
20161230,9,관람객재밌게봣습니다3d로도 보고싶네요  
20161230,7,관람객내 생의 첫 스타워즈 시리즈. 여자이기에 큰 흥미는 느껴지지않았지만 우주전투장면이나 비행신은 감탄하게 하네요ㅎㅎ  
20161230,1,팬만 즐거운 영화 올드한걸 노렸다지만 너무 올드했던 영화  
20161230,5,"이 시리즈는 확실히 매니아영화인듯...그냥 대중적인 블럭버스트로 생각하고 보신다면,굉장히 지루함. 스펙타클한장면도 그닥없고...솔직히 재미로는 노잼!  "
20161230,7,세상에 제다이 안나오니까 이렇게 재미있어지는구나  
20161230,1,내가 스알못이라 그런가 기존 스타워즈 개념이랑 너무 다르게 느껴지고 좀 지루했던거 같아요 ㅜ  
20161230,10,각자의 신념을 향한 특공대 '로그 원'오리지널 시리즈 캐릭도 잘 살렸지만 본 캐릭들은 정말 감탄이다. 각자가 가진 신념과 위치가 뚜렷했고 공동의 목적이 있기에 뭉친 '로그 원'은 아무래도 스타워즈 시리즈 중 가장 빛나던 팀이 아닐까 생각한다  
20161230,10,관람객스타워즈 7보다 훨씬 좋았습니다. 최고최고!!  
20161230,10,스핀오프가 무엇인 지 제대로 보여준다.  
20161230,10,너무 재밋게 봤습니다. 작년의 비해 훨씬 좋은 작품이네요.  
20161230,9,"주인공 살리는 영화보다는 다죽는것도 나쁘지않다고 본다. 그렇게 저평가받을, 고평가받을 영화도아니지만 생각없이 1점준 빡대가리들 때문에 9점줌.  "
20161230,10,에피소드4부에서무엇때문에 레아공주가 제국군한데쪼기는지 알게해주는영화네요  
20161230,10,관람객완전 몰입해서 봤네요~!!재미있습니다 ㅎㅎ  
20161230,10,스타워즈 입덕작으로 추천합니다  
20161230,9,분명 스타워즈 덕후가 아니라면 초중반의 지루함은 어쩔 수 없다고 본다...근데 영화라는게 기승전결을 이루려면 어쩔 수 없는거지..진중한 전개 속 약간의 유머도 넣었고 그래픽도 적절한듯..막판 다스베이더의 포스는 짧지만 강력했다..근데 레아공주는 어떻게  
20161230,10,관람객걸작. 폭풍눈물 흘렸다 진짜... 여운이 남는다  
20161230,10,이렇게 감동먹을 준 몰랐다. 드로이드 K가 굿바이할때부턴 그야말로 폭풍눈물.. 새로운 건 없었지만 진짜 이야기를 잘 짰다. 캐리피셔 굿바이...  
20161230,9,관람객3d로 봐서 좀 어지러웠다 마지막은 압권 전율  
20161230,9,관람객사뭇 진지해지고 슬퍼진 스토리 이런걸 기대하진 않았지만 나쁘진 않았다  
20161230,10,마지막이 다가올수록 몰려오는 소름은 어쩔수없다! 정말 그 숭고함을 기억할만하다  
20161230,9,우리들이 누리는 자유와 평화는 공짜로 얻을 수 있는 것이 아니다. 그 시대에 이름 하나 남기지 못했던 한 사람 한 사람이 모두 영웅이었다. 제다이의 광선검 대결이 없이도 화려하게 빛나는 영화.  
20161230,10,스타워즈 팬이라면 꼭 봐야 한다. 마지막 엔딩의 캐리 피셔의 레아 얼굴은 정말 대박이였음. 후반 전투씬 무척이나 볼만해요~  
20161230,10,관람객로봇이 하드캐리 ㅋㅋㅋ  뜻밖에 감동도 있어서 새롭다  
20161230,10,관람객스타워즈 시리즈 하나도 안봤는데 그래도 정말 재밌게 봤습니다!!!!  
20161230,10,'희생' 이 단어가 영화에 모든것을 말해 줄 수 있음. 4편 보신분들은 더 재밌게 보실 수 있을거에요!  
20161230,9,관람객1년만에 다시접한 스타워즈씨리즈 역시 실망시키지않네요. 최고에요~~~^^  
20161230,10,관람객내평점 스타워즈 팬이던 아니던 꼭 봐야하는 영화. 이유는 보면 알게됨ㅇㅇ 전 스타워즈 정주행 하러 갑니다!!!!  
20161230,7,독립적이기도 하고 연계성을 가지기도 한 단단한 고리.  
20161230,10,에피소드 4 5 7 다음으로 훌륭  
20161230,10,관람객여친 감동받아 우는걸 보고..눈치 보지 않고 다시 한 번 보러 오자고 해야겠습니다  
20161230,10,기대를 저버리지 않음.  
20161230,10,관람객지금까지 본 적이 없었는데 이거 보고 완전 입덕했음  
20161230,10,관람객오리지널 시리즈 456을 제외하면 역대 최고입니다...  
20161230,8,관람객스타워즈 시리즈 처음봤는데 볼만하네요 :)  
20161230,7,팬들이 기뻐할만한 캐릭터들이 곳곳에 등장하고Cg로 구현된 과거시리즈의 캐릭터는 신기함을 준다 특히 마지막 그분의 액션은 이영화를 보러온 값을 제대로 치뤄준다 하지만 플롯은 곳곳에 구멍이고 긴장감있어야 할 장면들에선 허술한 연출이 많다. 팬이라서 7점  
20161230,8,영화 지루하지 않고 재밌게 봤네요 딱 중국시장 노린영화구나 싶음  
20161230,7,관람객그래픽이며 뭐며 나쁜건 없지만처음 스타워즈를 접하는 분은 내용이 어려움  
20161230,3,거짓말 안하고 내 왼쪽사람 코골고 잤고 나는 4~5번 정도 졸다가 눈떴다. 마지막에 다스베이더가 혼자 10명쯤 포스와 광선검으로 죽일때는 잠을 잠시 깼다... 마블과 dc영화 보다가 이거 보려니 전반적으로 고역이었다.  
20161230,9,포스가 함께하길. 역사가 있는 브랜드는 무섭다. 우리는 로그원을 본 게 아니라 스타워즈 30년을 봤기에. 이래서 디즈니 주식을 사야하나보다.  
20161230,10,관람객너무 재미있어요. 기대를 저버리지 않음요.  
20161230,10,역시 굿 가능하면 이런 번외편 또 나왔으면 하는 바램완성도 높은 영화 찾기 힘든 요즘. 굿굿  
20161230,6,진짜  기대 많이 했는데... 너무많이 했구나..  
20161230,9,관람객괜찮은듯 싶네요 근데 스토리가좀....  
20161230,9,"초반에 살짝 지루한 느낌이 있었지만 역시, ""스타워즈""였다.  전투신 등의 CG는 그 어느 SF 영화보다 완성도가 높았으며 중반을 넘어갈수록 기존 스타워즈 시리즈에서 봤던 몇몇 씬들이 있어서 감회가 새로웠다.  게다가 종반부, 뭉클했다.  "
20161230,9,재밋어요 2시간 내내 반란군이 되는 느낌남자라면 꼭보세요  
20161230,7,스타워즈 팬이라면 영화 곳곳의 추억을 느낄 수 있는 포인트 부분이 있지만 이 영화 자체를 본다면 예고편에 비해서 많이 지루하고 긴장감 없는 영화라고 생각됩니다.  
20161230,1,주인공들이 모두 전멸.. 회사 송년회때문에 봤는데 회사직원들 졸려서 다 전멸  
20161230,10,3.5로 치기에는 너무 걸작!  진의 역활은 어쩜 레야보다 더 클 듯..  이걸 한번 더 봐야하나..  
20161230,10,관람객개인적으로 7보다 나았다. 지금껏 스타워즈랑은 다른 비극적인 분위기를 잘 연출했고 3과 4 사이의 스토리 흐름도 잘 연결시킴!  
20161230,9,관람객살짝 지루... 쥔공을 피해가는 총알들... 버뜨 베이더무쌍+쥔공몸매로다가 9점!!!! 키가 160이라는데 어찌나 비율과 경사가 그리도 극심한지.... ㄷㄷㄷ  
20161230,8,스타워즈 스토리 잘  모르고  봤는데 엔딩이 충격적이네요...강력한 절대악이랑  싸우는   자유인들의  처절함을  과장하지  않고  잘  나타낸듯요  
20161230,10,관람객스타워즈 보다가 안존거 첨이다  
20161230,10,관람객시간가는줄 모르고 완전 집중해서 봤음 한순간도 눈 돌릴 수 없음 ㅋㅋㅋ 꼭 꼭 봐야함  
20161230,1,엄청 재미없어요 돈 낭비에요 절대보지마세요 다른거보세요ㅋㅋㅋ  
20161229,8,관람객기대한거  보단 아쉬움이 있네요시종일관 어두운 분위기가 보는내내 맘에 걸림  
20161229,10,"관람객엔딩의 전율 , 울컥한다  "
20161229,10,말이 필요있나? 엄지 척  
20161229,1,스타워즈 시리즈중 최악.. 점점 갈수록 재미가 없어지냐... 노답..  
20161229,10,관람객기대 이상이네요. 이전 에피소드 비교해서 완성도도 높고 볼거리도 많고 흥미진진합니다. 강추강추. 역시 스타워즈  
20161229,10,스타워즈 팬은 아니라서 기대 안하고 봤는데...엄청 재밌어서 영화 끝나고 박수 쳤습니다 !!  
20161229,10,관람객재밌어요! 다음편이 기대되는  
20161229,10,관람객스타워즈가 처음으로 재미있게 느껴졌다.  
20161229,10,관람객생각치도 못하게 보다가 울컥 ㅠㅠㅠㅠ 여운이 남는다  
20161229,9,제다이없는 스타워즈가 재미있을까 했는데. . . 정말 재미있게봤어요!!! SF좋아하시면 후회없이 보실듯  
20161229,10,관람객스타워즈 중 가히 최고라 할만하다  
20161229,10,깨어난 포스에 실망하신 분들이 다시 스타워즈 팬이 될수 있는 영화네요... 역시 다스베이더...  
20161229,1,평점 알바 ㅡㅡ 진짜 최악이다. 재미1도없음..심각함. 왜 싸우는지도 너무 유치하고  
20161229,3,아쉬운 이야기... 악당의 부재가 영화를 늘어지게 만든다.  
20161229,9,관람객역시  스타워즈는  후반   전투장면이   쵝오...!  
20161229,7,기존 스타워즈 시리즈의 외전!스타워즈 매니아가 보면 식상할수 있을듯.  
20161229,8,추천드릴만한 작품이더군요  
20161229,9,관람객스케일이 크고 내용도 아주재미있었음 아들은 또 보고싶다고할정도임  
20161229,8,관람객로그원 스타워즈스토리 최고~!!!  
20161229,2,"스타워즈 광팬이지만, 전작은 복사판, 이번판은 쫄짝입니다. 넘 지루하고 정신없이 왔다갔다.. 별루 재미없고, 졸다 나왔습니다. ㅜㅜ  "
20161229,8,이런 숨겨진 영웅들이 스타워즈 시리즈에는 왜 안 나올까 궁금했는데 다 이유가 있었군요...  
20161229,8,관람객처음은 지루하지만 후반부에서 재밌습니다  
20161229,9,약간 지루함이잇엇지만 그래도 전투씬도 괜찮앗고 화려하거 젛앗습니다  
20161229,8,관람객만족 스타워즈 팬으로서 굿  
20161229,10,관람객오프닝부터 두근두근! 역시 스타워즈! 어렸을 때 생각나더라고요. 연말에 즐겁게 감상했어요!  
20161229,10,다스베이더랑 레아가 나오다니!!!  
20161229,10,팬 서비스가 정말 최고. 구성도 알차고 전투씬 훌륭.  
20161229,10,스타워즈 전편을 다보고 7편에서 실망한이들을 위한 위로곡  
20161229,10,마지막 장면에서 감동의 눈물을 흘렸다...  
20161229,10,"개연성, 캐릭터들 매력이 좀 떨어지는것은 사실이지만 스타워즈 팬인 나는 굉장히 만족함 특히 전쟁영화라는게 더욱 좋았음  "
20161229,10,정말 지렸다... 스타워즈 매년나오는게 행복하다  
20161229,10,관람객스타워즈 팬에게 최고의 팬서비스작품!  
20161229,10,관람객이래서 다들 스타워즈 스타워즈 했구나 싶음.명불허전 SF 끝판왕  
20161229,10,"재미, 감동, 영상미, 스케일 등 모든 면에서 탄성을 자아내게 만드는 클래식 블록버스터!! 원작 시리즈를 뛰어넘는 슈퍼 외전의 탄생!!!  "
20161229,10,관람객스타워즈 시리즈 하나도 안봤는데 로그원 덕분에 정주행 할 예정  
20161229,3,관람객별루에요 지루하고 재미 없네요 후반30분만 재미있고  
20161229,9,관람객말 그대로 스타워즈! 전투씬이 압권!  
20161229,8,"관람객스릴 만점, 아찔한 징검다리  "
20161229,10,에이브럼스가 망쳐놓은 스타워즈를 완벽하게 살려냈다.  
20161229,8,스타'워즈'다운 영화  
20161229,8,관람객스토리는 그럭저럭.  X-wing 과 Tie fighter 만으로도 팬들에게는 너무 좋은 선물임  
20161229,7,관람객다스베이더의 다크포스와 후반 전투신이 볼만함  
20161229,10,관람객대박. 로그원대박이다.  
20161229,8,관람객스토리전개가 빠름. 일부러  처리한 화면이겠지만 화면이 어두웠음.  
20161229,10,관람객마지막엔 감동이였네요!!!  
20161229,10,관람객예상했던것보다 훨씬 재미있었네요.스타워즈 매니아라면 강추!  
20161229,9,완벽하진 못했지만 이제껏 보지 못한 스토리를 만들어냈다.  
20161229,6,관람객전편보다 더 지루해요?  
20161229,7,관람객마지막 다스베이더는 광선검에대한 갈증을 어느정도 해결해주었다.  
20161229,10,관람객진짜 별 생각 없이 본건데 완전 대박임! 와 진짜 짱짱!! 액션 스케일 대박이고 중간중간 웃기기까지 함ㅋㅋㅋ  
20161229,10,프린세스 레이아는 희망이었다. 캐리피셔와 그의 어머니 데비레이놀즈의 명복을 빕니다. 포스와 함께 하길~  
20161229,10,기대를 안하고 봐서인가? 전편보다 낫다  
20161229,10,관람객스타워즈 1도 모르고 봤는데 오늘부터 정주행 하려구요! 정주행 하고 한번 더 봐야지  
20161229,10,전율 그 자체! 어떻게 이렇게!!  
20161229,10,입덕하기 좋은 영화임.  
20161229,10,관람객끝나자마자 다시 또 보고 싶다는 생각이 들었다  
20161229,10,관람객팬이라면 무조건 극장에서 봐야 할 영화입니다!!!  
20161229,8,제작진이 시스인듯 허다 ....  
20161229,8,"기존 스타워즈 시리즈에서 크게 벗어나지 않으면서도 차별화된 분위기로 만들어낸 개성이 마음에 든다. 스핀오프이긴 하나, 개인적으로는 가장 마음에 드는 스타워즈이다. R.I.P. Carrie Fisher.  May the force be with you.  "
20161229,10,관람객재밌어요! 추천합니다  
20161229,8,관람객10살딸과 재미있게 봤습니다~~  
20161229,10,관람객이거보고 4편 보려고 다운받는 중 연결고리를 찾기 위해 너와 나의 연결고리  
20161229,1,솔직히 처음봐서 그런지 모르겠으나 왜 이게 인기 시리즈인지 이해가 안간다..  
20161229,10,관람객누가 재미없데?헛소리다. 극장에서 안보면 후회할작품  3개중에 하나에 들어간다에 손목건다.  
20161229,5,예전과 다른 뭔가 해보려고한건 맞는데...어중간한 모습이네요..  
20161229,10,다 때려 부시고.. 최고다 스타워즈였지만 예상 못했던 엔딩 마지막 빨간 광선검에서 스타워즈 팬임을 다시 깨달았다.  
20161229,8,솔직히 깨어난 포스보단 재미 없습니다. 스타워즈 시리즈를 사랑하기에 영화관가서 돈주고 봤습니다. (만약 팬이 아니면 안보시는게 나을듯.)  
20161229,6,관람객무안한 상상력 첨단장비 약간의 감동. 좋앗어요  
20161229,6,관람객스토리 전개가 다소  산만함.  스타워즈 마니아가 아닌 사람은 다소 지루함  
20161229,10,관람객재미있게 봤어요 흥미로웠어요  
20161229,10,관람객기대하지 않고 본다면 아마 한 번 더 보고싶어질 것이다. 기대하고 본다면 그 이상 만족할 수 있는 내가 딱 원하는 스타워즈의 스핀오프였다  
20161229,10,스포 결국은 다 죽음 ㅠㅠㅠ  설계도만 넘겨주고 다 죽음 ㅏ 쥬금  
20161229,10,"영상전개, 영화음악 등등 80년대 느낌을 그대로 살리는 노력이 가상합니다. 재미는 그냥 그렇고 여주도 암걸릴것 같음.  근데 브랜드때매 ㅋㅋ  "
20161229,10,"""극장에서 봐야한다."" 한마디로 설명되는 영화입니다.  "
20161229,10,역대급 작품...레아공주님 좋은 곳으로...  
20161229,10,멍청이들만 모여있는 퍼스트 오더와는 차원이 다르다.계속 이 감독이 스타워즈 맡았으면 좋겠다  
20161229,10,마지막 10분... 전율이라는 단어는 이럴때 쓰는거구나...  이런느낌 얼마만인지..  
20161229,9,이영화~조지루카스가 만들었다면 더더완벽했을건데~조지루카스가만드는스타워즈가그립다  
20161229,10,스타워즈 같지 않은 로그원. 하지만 시리즈중 최고 비교불가 최고.. 안녕 스타더스트...  
20161229,10,스타워즈 시리즈 중에서 나를 2번이상 영화관에서 보고 싶게 만든 영화는 로그원이 처음이다.  
20161229,10,클래식 스타워즈 팬이라면 ㅠㅠ  
20161229,8,관람객압도적인 후반부 장난아니구먼  
20161229,10,정말 잘 만든영화같다. 지루할틈이없다  특히 후반부는 정말 감동먹을정도다  
20161229,9,다른 방향에서우 시작!  
20161229,9,여운이 엄청 남네요. 마지막 다스베이더 광선검 뽑아들땐 소름이 쫘악 ㅋㅋ  
20161229,10,관람객최고다. 주인공들이 다 죽어서 아싑다  
20161229,8,"그냥 말이 필요없어용.,.  "
20161229,10,관람객재밋게 잘봣어요 기분전환하고싶엇는데 잘됫어요 ㅎㅎ 스타워즈 원래 내용도 잇고 쓰리디로 봐서 스펙타클하네요  
20161229,10,스타워즈3.9라고 생각하고 보시면 될듯.기존 시리즈 안봤어도 내용 이해에 지장 없음..또보고싶다  
20161229,10,관람객스타워즈 시리즈 중  최고 !   말이 필요 없는 최고의 영화 !  
20161229,7,초중반 지루했고 후반 씬스틸러 다스베이더경과 레아공주땜에 모든게 용서됐다. 삼가 고인의 명복을 빕니다.  
20161229,10,"관람객저 방금 극장에서 보고 나왔는데요,,, 진짜 핵잼 ㅠㅠㅠ 조지 루카스 고마워요 이런 영화를 연말에 선물해주다니 ㅠㅠㅠㅠ  "
20161229,10,관람객스타워즈 한번도 본적없어서 걱정했는데 진짜 완전 재밌게 봤다!!!! 또볼거예요!! 진짜 짱잼  
20161229,7,"스타워즈 아류작 같은 느낌? 제다이도 없고 광선검 전투도 없는데 스타워즈라 할 수 있을까? 장담하는데 역대 스타워즈 시리즈 중 가장 재미없다. 단, 돈이 아까울 정도는 아니다. 그냥 큰 기대는 마시길..  "
20161229,10,관람객역시최고. 안보면후회.스타워즈중 최고.정말 최고 .적극추천  
20161229,9,제다이가 나오지 않아 아쉬운 영화...  
20161229,10,"관람객진짜 재밌다ㅋㅋㅋ기대 이상으로 웃기기도 하고, 액션도 화려하고! 지루하지 않게 잘 본 것 같다ㅋㅋ 또 보고싶은 오락영화!  "
20161229,10,관람객스타워즈 좋아하는 남자친구 따라서 갔다가 입덕해서 왔다. 이영화를 계기로 스타워즈라는 세계관이 궁금해졌다!  
20161229,8,자단이형이 나온다 보러가자~~  
20161229,10,관람객명불허전 스타워즈 믿고봐야함  
20161229,8,이런건 극장에서 봐줘야함. 전편보다 훨씬  재밌었음.여지껏 있으나 마나했던 스토리가 존재해 감동했음  
20161229,1,중간에 나왓나  호불호 극명하게 갈리네  
20161229,10,"팬들의 향수를 잘 자극했다. 스타워즈의 트레이드 마크인 존 윌리엄스의 스코어와 와이프 트랜지션, 오프닝 롤이 안 나온 것은 좀 아쉽지만 팬으로서 후반 20분여동안 벌어지는 다스베이더 씬과 엔딩은 흥분의 도가니였다.  "
20161229,10,관람객추천 광선검 없어도 잼있네요  
20161229,10,ㅋㅋ 꼭 보세요 아 진짜 재밌게 봤다  
20161229,10,Imax  3d 로  봤는데  너무 재밌네요 ㅎㅎ  
20161229,10,관람객마지막 슬픔 전율 쫘악~~~~ 만족했다 역시 스타워즈  
20161229,10,관람객스타워즈 이걸로 입덕시작  
20161229,9,아쉬운 부분도 있고 정말 오랜만에 보는 반가운 인물이 꽤 나오네요  
20161229,1,별로임ㅋㅋㅋ진짜 영화보는 내내 졸았다 마지막 결말까지 쓰레기같음  
20161229,10,진정한 스타워즈. 보이지 않는 자들의 희생과 노력이 있었기에 영웅담이 탄생할 수 있었다.  
20161229,10,외국에서도 후기가 좋던데 ㅋㅋ 이유가 있구만  
20161229,10,관람객스타워즈 시리즈 한번도 안봤는데 이건 진짜 안보면 손해!! 내 인생영화 등극 ㅠㅠ  
20161229,10,빰빰빠 빰빠빠~빰빰빰빠바~빰바바바~ 다스베이더 그리웠네요!  
20161229,10,스톰트루퍼 귀요미들이 전사가 되어 돌아왔네?ㅋㅋ  
20161229,10,매니악 한 영화 로그원. 감동적인 마지막 씬이었습니다  
20161229,3,다소 지루한 감이 있긴합니다.에피소드7만 못하네요  
20161229,10,까놓고 이정도면 7보다 훨씬 재미있었당  
20161229,10,와 액션씬 지림 견자단 눈빛이 완전 .. 맹인연기 맞아?  
20161229,10,관람객스타워즈매니아를 위한 최고의 영화.쵝오의 까메오와 호화로운 전투씬.초반부다소 장황한 내용설명으로 혼란스러움마저 커버한다  
20161229,10,관람객정말 완벽한 영화입니다  
20161229,10,관람객너무 재밌게 잘봤어요~ 평소 판타지물을 즐겨보지 않는데도 재밌었어요~ 영화 끝날 때까지 긴장한 채로 몰입했었네요ㅎㅎ  
20161229,10,갑자기 왤케 감동적임 ㅠㅠ 꼭 보세요  
20161229,6,돈 들인 거에 비하면 범작....  
20161229,10,"말이 필요없었다. 스타워즈 팬들에겐 단연 10점 만점에 10점. 엔딩이 정말 끝내줬다. 정말 멋졌고, 더불어 슬펐다. 그리고 다스베이더 레알 이번 영화에서 무쌍 제대로 찍어주시네...  "
20161229,10,"누구의 눈에는 멋진 SF 영화, 누구의 눈에는 ""스타워즈""가 보일 것이다.  예상보다 훨씬 잘 만들었었다.  몇몇 역대 스타워즈 장면들을 연상케 하는 터치는 가슴이 찡했다.  May the force be with you.  "
20161229,10,어? 마지막장면 본적있는것 같은데?!!!  
20161229,10,관람객표값하는 영화네요~꿀잼!  
20161229,5,관람객방대한 스토리에 지루함이 느꺼집니다.  
20161229,8,역시 스타워즈는 다스베이더가 주인공  
20161229,10,새롭게 투입된 배우들이 영화에서 한몫합니다. 견자단은 아직도 최고네요 ㅋㅋ  
20161229,10,방금 보고 왔어요. 스타워즈 팬이라면 대감동~ 너무 잼있네요.  
20161229,10,배틀프론트 psn에서 세일하던데 사야 하나요? 우리 레아공주님 조종하고 싶은데 ㅠㅠㅠㅠ  
20161229,10,관람객잼나네요 ㅎㅎㅎㅎ. 굿굿  
20161229,10,재밌는 블록버스터 보고 싶으면 로그원 추천 ㅋㅋ 지루하지 않고 중간에 웃기는 것들도 있고 액션도 좋음  
20161229,7,"스타워즈 기존 팬이라면 만족할 만하지만, 전반부의 산만한 내러티브와 개연성 부족이 후반부 스토리까지 망침. 에피소드 4로 이어지는 부분에선 감동.  "
20161229,10,마지막 스타 디스트로이어 파괴장면부터 다스베이더와 레아 공주를 보고 소름 돋았다...스타워즈를 욕할거면 나를 욕하거라  
20161229,10,레아 공주님이 영면하고 나서 다음날 그의 어머니도 영면하셨다고 합니다.  삼가 고인의 명복을 빕니다.  
20161229,8,솔직히 이거 올해의 영화임.. 감동받음  
20161229,10,스타워즈 팬이라면 꼭 꼭 보세요  가슴이 먹먹해집니다 다스베이더 목소리 들으니 전률이 쫙... 다스베이더 전투신도 압도적...  
20161229,10,평점이낮아 걱정하고  봤는데 왠걸 스타워즈 팬이라 그런지 정말잼나게봤어요 왜재미업다고 하는지 모르겠네요 팬이면 정말좋아할것같은데... 스타7 정말실망했었는데  로그원은 스타팬들에게 위안을주내요 팬이면 강추에요  
20161229,10,기대안하고 봤는데 재밌네?ㅋㅋ  
20161229,9,관람객스토리 전개는 평이했고 전투씬이 많은 점은 졸리진 않았다는 것. 스타워즈 광팬이라 봤다지만 뭐 그닥 에피소드 시리즈에 비해선 별로. 그래도 별 네 개 이상인 건 그래도  팬이라.ㅎㅎ  
20161229,9,"기존의 스타워즈가 암울한 배경에서의 밝은 액션 활극이었다면,로그 원은 어두운 전쟁 영화라 할 수 있다주요 캐릭터의 캐릭터성이 살짝 떨어지는 것이 아쉽긴 하지만 영상미와 각종 이스터 에그, 반가운 인물들이 커버해준다마지막 5분!! 꼭 볼 가치가 있다  "
