0,1,2
20170101,9,"관람객스타워즈 팬으로 재미있게 보았읍니다. 엔딩이 뜻밖이었고, 그래서 더 가슴에 와 닿네요. 늘 스타워즈의 팬으로 남아있을겁니다.  "
20170101,9,관람객재미나네요. 스타워즈 몰라도 잼 나게 볼 수 있을 듯.  
20170101,7,관람객시리즈상 3.5의 역할을 충실히 수행.올드팬들의 감성과 뉴비들의 볼거리를 둘다 자극한 훌륭한 작품.다만 가장 매력적인 캐릭터 로봇인건 안습.  
20170101,9,관람객제미있고 스릴만점 이였어요!  
20170101,8,관람객처음은 별루였는데 갈수록 재미가 있어습니다  
20170101,10,"관람객다른 스타워즈 시리즈를 보지않아도 이해하기도 쉽고, 보통 나왔던 스타워즈 보다 더 재미있었던 영화였다.^^  "
20170101,9,관람객한순간도 눈을뗄수가없어어요.굿^^  
20170101,10,관람객정말오랜만에 스타워즈 시리즈를 만나서 기쁩니다주인공 캐릭터가 약한게 아쉽네요  
20170101,10,재미있게 봤습니다. 마지막 장면으로 30년전 스토리와 연결되는 부분이 특히^^  
20170101,9,로그원의  마지막  전투에서 새로운 희망의  첫 장면. 이토록  자연스러운  연결이라니...  
20170101,10,그냥 스타워즈 3.5편으로 생각하면 되겠군... 최고다  
20170101,10,향수를 불러내는 완벽한 볼거리 역시 스타워즈  
20170101,10,스타워즈 시리즈가 나아가야할 방향을 잘 잡아준 듯한 느낌.그나저나 다스베이더의 포스는 정말 범접할 수가 없군요. 후...  
20170101,1,관람객재미없음 졸려졸려졸려  
20170101,10,개인적으로 에피소드7보다 좋았습니다. 에피소드4의 스토리에 개연성을 더해줬다고 생각합니다.  
20170101,10,인류와 우주를 위한 마지막 희망 쟁탈전! 재미있게 봤어요  
20170101,8,관람객초반에 이해가 안가는 부분빼곤 마지막 전투씬이나 예전 스타워즈 추억을 느낄 수있는 부분이 있어 좋았네용  
20170101,10,두말 필요없이 완전 최고!!!  슬프지만  매우 감동적인 스토리 ~ 또 보고싶네요 이런 백스토리가 있을 줄이야..  
20170101,8,관람객음 스타워즈 시리즈를 안보고 봐서 그런지..확실히 스케일은 다른듯해요우리나라 영화랑은ㅋㅋ 그냥 스타워즈 타이틀만 생각하고 봐도 돈아깝지않은 ㅋㅋ다음 시리즈가 벌써 기대됩니다혼자서도 재미있게 볼 수 있어서 좋았어요^.^  
20170101,10,관람객30년에 걸친 스타워즈 대장정의 마무리인듯한 스토리였다.영화 중간 중간 비쳤던 지난 내용들의 등장이 더욱 옛 장면들을 그립게했다. 실로 조지 루카스의 대단함을 실감했던 내용이었다.  
20170101,9,관람객스타워즈에서도 보지 못한  전투신이 일품. 마지막 그분의 포스는 정말로 후덜덜...  
20170101,10,관람객쉴틈 없는 전개.. 엄청난 포스의 다스베이더  
20170101,10,관람객로그원광선검언제나오나했는데마지막에 잠깐ㅋㅋ  
20170101,10,관람객스타워즈 모든 시리즈가 생각나는 영화  
20170101,6,관람객우주 영화는 내스타일이 아니다..  
20170101,8,관람객스타워즈를 이해해야 재미있게 볼 수 있을듯~  
20170101,1,졸립니다 시리즈중에서 가장 재미없게 본 듯  
20170101,10,관람객오리지널리티가 느껴져서 좋았다. 원조의 힘  
20170101,6,유치짬뽕 클리셰의 연속 블록버스터  
20170101,9,관람객Diego Luna 새로운 스타워즈. 레아공주 RIP.  
20170101,8,앞에 스토리 모르고 그냥 보면 좀 어렵습니다 아무생각 없이 봤다 졸았네 ㅜㅜ  
20170101,10,"졸작 에피소드7 에서 느꼈던 실망을 보상 받았다. 에비소드 8, 9도 이 감독이 만들었으면 좋겠다.  "
20170101,10,스타워즈 시리즈중 최고다 4d로 본걸정말다행이라생각공중전 효과 끝내주네  
20170101,1,8점이 적당해 보입니다.  평점이 생각보다 높아서 1점으로.  
20170101,9,스타워즈... 생각했던 것보다는 재미있네요.  
20170101,10,하... 너무 재밌다 마지막 장면은 소오름...  
20170101,10,제다이만의 이야기를 다룬게 아니라 병사의 이야기를 다뤄서 좋음  
20170101,5,관람객큰 기대 하지 말 것 끝이 허무하다  
20170101,10,"4d로 봐서 그런지 깜짝놀라며너 재미있게 봤어욯,  빨리 다음편 보고 싶네유  "
20170101,10,대박 잼나네요~^^ 지금까지 스타워즈 시리즈 중에서 제일 나은 듯... ㅎㅎㅎ  
20170101,10,오랜만에 신랑이랑 영화데이트였는데 재미있게 잘봤어요 조조보면서 조는편인데 안졸고 끝까지봤어요  
20170101,10,4편에서 생겼던 궁금증이나 다시보고 싶었던 인물들을 보기에는 충분히 재미있는 영화네요  
20170101,10,재밌게 새해 첫관람 잘봖어용ㅋ 역시 아이맥스  
20170101,10,역시 명불허전 스타워즈 ㅋ마지막 팬서비스차원인가요 다스베이더 광선검~^^  
20170101,9,"관람객초반의 지루함과 엉성함은 중반 이후 잊혀지고, 종반의 3분은 이 스핀오프가 왜 의미가 있는지 알게 된다.  "
20170101,8,관람객재미 있게 잘보았습니다  
20170101,9,관람객스토리라인이 별로 감흥을 주지 못합니다. CG야 거기서 거기고. 스타워즈라인 변외편으로 생각합니다.  
20170101,10,"거대한 전쟁의 한 장소, 한 흐름을 크롭하여 본것같은 영화  "
20170101,10,좋았어요. 특히 결말이 현실적이라 더욱 좋았습니다~~  
20170101,10,"스토리도 좋고, 역시 베이더는 포스 쩌네요  "
20170101,10,전 시리즈 한번도 안봤는데 재밌게 봤어요~!! 아이맥스3d로 보시는걸 추천드립니다 ㅎㅎ  
20170101,10,관람객스타워즈 폴에버 재밌어요  
20170101,10,아! 넘 좋았다. 모든 연결이 완벽하다. 눈물까지 흘렸다. 고귀한희생. . .  
20170101,10,스타워즈의 거대한 세계의 입문용으로 대단한 기능을 하는 작품. 이제 에피소드 4인 새로운 희망을 보세요.  
20170101,10,정말 재밌네요.중3 아들과 봤는데 역시 스타워즈~~시간 가는줄 모르게 봤네요^^  
20170101,10,예고편이 너무 재미있었어요!이번주 화요일에 볼꺼예요  
20170101,10,재미있었어요. 새해부터 활기차게시작할수있을것같아요.ㅎㅎ  
20170101,10,"흥미진진, 기존에 스타워즈보다더 재밌었어요  "
20170101,10,진정 완벽한 프리퀄. 스타워즈라면 갖춰야할 시각적 연출 요소들도 200% 충족해주고 있다.  
20170101,10,생각보다 전 좋았어요. 특히 마지막 예전의 공주얼굴이 나와서 향수도 일으키고..  
20170101,2,관람객스타워즈에는 역시 광선검이 나와야 제맛마지막 다스베이더 1분 나오는거 빼고는볼게없음 마지막 10분 전투신이 최고라는데 속지마세요 완전 비추  
20170101,10,명불허전 스타워즈!!! 정말 시간가는줄 모르고 잼있게 봤어요~  
20170101,10,깨어난포스는 없었지만 너무나도 재밌었습니다.!! 이래야 스타워즈죠!  
20170101,10,재미나요! 여주인공 너무 예쁨 실망 안시키는 로그원  
20170101,10,시리즈안봐도 이해는 될것 같아요 요즘 개봉한 영화중에 제일 볼만해보여서 봤습니다 가족끼리 보기에도 무난하네요  
20170101,10,새로룬 희망과 함께 레아 공주가. 포스가 함께 하시길..  
20170101,10,아이맥스로 추천합니다 요즘 볼게 없었는데 재밌게 봤어요  
20170101,10,정말 잼있었어요 ㅎㅎ 너무 재미있네요 강추~!!^^  
20170101,10,스타워즈 시리즈 영원히 쭉~~ 3D IMAX D열좌석 추천합니다^^  
20170101,10,역시는 역시 로그원 은 그자체로 최고다  
20170101,10,마지막에 다스베이더 ㄷ  
20170101,9,관람객재미있게 잘 봤습디다.  다시 한번보고싶네요.  
20170101,10,에피소드4의 소품이보여서 반가웠음 베이더의 강렬함!  
20170101,10,2017년나의 새해첫영화 재밌짱! 마지막엔딩고케리피셔 레아공주 옛모습이나와반가웠습니다 고인의명복을빌며  
20170101,10,재미있었음. 에피소드4 의 이야기랑 맞춰보는 재미도 쏠쏠 했음. 그런데.. 흑.. 여러가지 이유에서.. 좀 슬펐음..  
20170101,10,"액션과 비행 장면에서 의자의 움직임과 진동, 안개, 번개 등 많은 것들을 경험할 수 있어요. 그리고 스타워즈를 잘 모르는 사람으로써 로그 원의 전체적인 느낌은 괜찮았습니다.  "
20170101,10,꿀잼임 ㅋㅋ 꼭봐요 스타워즈 팬은 ㅋ  
20170101,10,스타워즈 무명인들의 전쟁.. 희망이 있는 한 끝나게 아니다.. 스타워즈 외전으로 충분히 관람의 가치가 있습니다  
20170101,10,한줄요약~~~ 스타워즈의 역사를 말한다!  
20170101,10,3편과 4편 사이인줄 모르고 봤지만 정말 잘만든 시리즈..  
20170101,10,아날로그로 돌아온 에피소드 4를 위한 완벽한 프롤로그 더할나위없이 최고의 영화!!  
20170101,10,스타워즈 스토리 1도 모르는데 재미있게봄 이후 스토리가 스타워즈 4라는데 찾아봐야겠군요  
20170101,10,7보다 훨씬 볼만했습니다. 그다지 진부한 느낌은 아니었네요.  
20170101,10,평식이형이 7점줬다+!!!  
20170101,8,마지막에 울컥했다 RIP프린세스  
20170101,10,엔딩이 좀 가슴아프네...  
20170101,7,관람객 아이는 재밌다하네요~  
20170101,10,관람객스타워즈 팬이라면 더욱 재미있을 영화  
20170101,10,베이더경이영화후반부에싸울때의모습은그마겐지1명과브론즈솔져6명을보는듯햇다  
20170101,9,관람객영상에 빠지는 재미와 연결된 스토리가 너무재밌었어요^-^  
20170101,9,에피소드 7보다 훨신 재밌다이 정도로만 만들지  j.j 감독이란놈이 ㅉㅉ  
20170101,10,스타워즈에 조금이라도 흥미가있다면 로그원은 완벽한 영화 지루할틈이 전혀없는 빠른진행 스토리도 완벽하다  
20170101,10,초반지루함이살짝있지만그후기존의스타워즈에서탈피한새로운스타워즈를보게될것임후반5분다스베이더 등장은명장면  
20170101,3,관람객정신업음...내용도업고 짱나.  
20170101,10,마지막 5분만으로도 이 영화는 볼 가치가 있다  
20170101,9,관람객역시 결말은 다음으로~  
20170101,8,관람객그냥 평이하다. 마지막에 광선검 볼 수 있어서 좋았다  
20170101,10,잼나네10자10자10자  
20170101,10,관람객그냥 머리 비우고 보기 최고  
20170101,10,관람객볼만은 한데 조금 지루하네요.  
20170101,1,암튼 재미없다. 나는 재미없었다  
20170101,10,관람객스타워즈 팬이 아니어도 재밌음  
20170101,10,스타워즈 보면서 눈물이 나오려는거 처음이다  이거 완전 죽여준다 슬프면서도 스타워즈 사상 최고의 전투신  
20170101,10,스토리 영상미 둘 다 잡았다  
20170101,10,자다가 마지막 5분만 봐도 영화비 아깝지 않은 영화.  
20170101,8,관람객견자단형 영어연기가 많이 좋아지신듯  
20170101,10,"기대이상 꿀잼, 제다이 없어도 재미짐  "
20170101,1,스타워즈팬이 아니라면 비추에여뭔가 허접?하고 정신사납고집중이 안되서 그런가 누가 아군이고 누가 적군인지도잘 모르겠어요  
20170101,3,관람객깨어난 포스는 재미있었는데 이번작품 로그원은 너무 지루하고 재미없네  
20170101,8,볼만했으나 아쉬운 감이 있음  
20170101,10,관람객액션씬만큼은 정말 볼만합니다  
20170101,9,관람객예상보다 더 좋았습니다. 좋은 프리퀼이네요.  
20170101,8,"기존의 스타워즈가 박근혜 퇴진까지의 과정을 보여주는 역사다큐멘터리라면 이번 편은 최순실 태블릿PC 입수,보도 과정을 다룬 휴먼드라마.  "
20170101,10,마지막에 불이 꺼진채로  '호- 파-' 하는 숨소리가 들리며 라이트 세이버가 주위를 환하게 만들었을때 경악함 ㄷㄷ  
20170101,7,관람객스타워즈 광팬이고 전편복습하고 보러갔지만 기대에 미치지못했다.  
20170101,8,"관람객스타워즈 시리즈를 전체적으로 보지 않아도 충분히 이해 가능한 영화네요. 이번 이야기는 에피소드 3 과 4 사이의 이야기이고, 제다이 특유의 화려한 광선검 결투는 없지만 넓은우주가 아닌 지상 + 공중전 위주의 전투도 매력 있고 재미있네요.  "
20170101,7,초중반까지는  스토리도 그렇고 개연성도 안좋고 보통이었지만 후반부에 내용은 참으로 좋왔습니다. 다만 제다이가 안나오니 좀 아쉬웠습니다.  
20170101,7,관람객정말 흑수저들의 희생이 아쉬운 영화였네요 견자단짱  
20170101,10,스타워즈 팬이라 그런지 역시 너무 잼있네요. 그런데 스토리를 잘 모르면 재미가 많이 반감될 것도 같아요. 어쨋든 간만에 너무 좋은 영화 잘 받습니다.  
20170101,9,"너무나도 화려하고 유쾌하며, 가슴 아프고 비극적이다.  "
20170101,8,관람객스타워즈 시리즈의 중간이야기.  
20170101,7,흑먼지날리는 오리지날분위기+배틀프런트의 전장 쾌감은인정! 하지만 ..EP4:새로운희망 이란 제목을 위해 그렇게 싹다 죽여야만 속이 후련했냐..잘만든 캐릭터를 없앤다고 어두운이야기가 되나  
20170101,6,관람객화면은 훌륭하다.하지만 스토리가 상당히 빈약하다.시리즈 팬심으로 버티고 봤는데개인적으로 실망이다.프리퀄 형식의 첫번째 시리즈라는 느낌앞으로 다음 시리즈는 스토리에 신경쓸수 있기를  
20170101,6,전개도 좀 느리고 약간 허무하기도 하고 ~  
20170101,9,관람객 명불허전 스타워즈 :-)  
20170101,10,"영화 펑점 생전 처음 써보는거 같은데...여자인데 주변에 스타워즈전편을 본 친구들이 없어서 혼자봤는데 재밌어 미치는 줄 알았습니다...클래식 스타워즈 정말 정말 반가웠습니다. 스타워즈 번외편 인거죠,,,?  진짜...하아..쵝오...  "
20170101,10,관람객잼씀 상당히히히리잉 마니  
20170101,10,관람객4편을 미리 보신분이 보면 더 잼쓸꺼같습니다  
20170101,9,관람객캬 갓자단성님과 1월1일을 맞이했습니다.  
20170101,10,관람객모든 스타워즈 시리즈의 첫이야기.. 마지막 레아공주 출연 신은 깜놀  
20170101,10,전투씬 스케일은 정말 짱! 대박입니다!  
20170101,5,관람객스타워즈 시리즈중에 이렇게 지루한건 처음인거같다.뭐라 할말이 없음  
20170101,1,관람객선전많큼  재밌지는   않았음  
20170101,4,관람객심심한 전개.어색한 연기.전보다 못한 우주씬.그냥 마지막 씬의 레이아 공주 때문에 오잉?하고 정신 듬...  
20170101,8,관람객볼만했는데 앞에내용을 몰라사 지루한것도 있음 ..  
20170101,10,성공적인 스타워즈 잔혹동화판  
20170101,9,관람객전편만큼 기대엔 못미치는듯 했지만 좋은 시간이였어요.  
20170101,8,관람객재밌었습니다만 초반에 스토리가 확확 넘어가는 부분은 의아했습니다 부모님과 같이 봤는데 초반부분이 굉장히 지루했습니다 단순이 조용하다기보다 뭔가 부족한 느낌이 팍팍들었습니다 이외부분은 만족스러웠습나다  
20170101,10,인생 최고의 스타워즈 시리즈. 정식 스타워즈 넘버링은 아니지만  가장 스타워즈 다웠던 편이었습니다.개인적으로 대 만족  
20170101,9,관람객사운드와 영상이 좋아요.  
20170101,8,중반까잔 좀 루즈햇는데...후반부는 진짜 인정해줘야된다..역대급인데  
20170101,8,관람객스타워즈를 추억하는 사람이라면 꼭봐야할영화  
20170101,4,"아는만큼 보인다며 빨아대는 스타워즈 팬이라면 볼만하겠지. 그게 아니라면 상당히 실망합니다. 제다이는 등장하지도 않고, 데스스타의 설계 등 이야기를 담아내려고 했는데, 보는내내 졸림. 무엇보다 연기력이 부족한건지 등장인물들에 공감이 안됨.  "
20170101,5,"답답한 과학자의 딸이 기계적으로 자라서 호구마 연합군과 어울리고 감정조절이상자랑 예쁜 우주 나치를 공격함. 서서히 유치함을 드러내는 삐융삐융타임에 치루트가 포스 전도를 성공해 베이즈가 포스 신도가됨. 유어낫마이파더의 전기파리채 검술, 예쁜 공주 디엔드  "
20170101,9,캐리 피셔 죽어서 안타깝네요~ 여기서 나마 애도 합니다. 그럼 앞으로 스타워즈 시리즈 어떻게 하나요?  
20170101,9,깨어난 포스를 잇는 ep.8인줄 알았는데 3.5네요 그래도 스토리를 완벽하게 잇는 영화입니다 특히 다스베이더가 광선검을 들고 등장하는 장면은 등장인물들의 존재를 압살하는 최고의 명장면입니다다스베이더의 등장과 전투신에서 몸에 전율이 흐를 정도였습니다  
20170101,10,진 어소가 죽는다..남자주인공도 죽는다..주인공 로그원팀이 있는행성에 데스스타가 행성파괴광선을 쏜다..그장면을 보고..울었다..모든 주인공이 죽다니...드로이드까지...ㅠㅠ  
20170101,10,"관람객지루할 틈이 없었다. 웃기고, 슬프고, 소름이 돋았다가...감동받은 상태에서 정신을 차려보니 엔딩크레딧이 올라가고 있었다.  "
20170101,8,관람객역시 다스베이더짱ㅋㅋ  
20170101,10,보는 내내 가슴이 벅차올랐습니다. 가장 깔끔한 마무리  
20170101,10,관람객제다이가 없는 스타워즈는 현실적이고 처참했기에 더 감동이었다  
20170101,8,관람객May the force be with you  
20170101,9,관람객재밌네요.9살아들도 신나합니다~  
20170101,9,관람객재미재미재미재미재미  
20170101,10,그래 스타워즈는 바로 이맛이지. 에피7이 망작이라는 것을 증명한 작품.  
20170101,9,번외편인데  스토리에 깊숙히 개입되있는  에피소드...  훌륭히 잘 녹여들었고  잘만든  영화  
20170101,9,관람객재미있게 잘봤습니다~~  
20170101,1,"솔직히 재미없음. 스토리도 별로고 정신없음. 스타워즈는 돈벌 생각으로 스토리를 뒤죽박죽으로 만들고 있다. 미친짓도 아니고 미래갔다가 과거갔다가 돈벌려고 별짓 다하네.  개인적으로는 에피소드3가 제일 잘만든것 같다,  "
20170101,10,"전쟁영화의 장점, 스타워즈에 걸맞는 스케일을 모두 잘 보여주었다  "
20170101,7,관람객 전작에 비해선 조금 지루했음  
20170101,7,시나리오가 좀 허술하고 어수선하지만 재미있게 보았다. 미국영화에서는 부모나 친구가 죽어도 별로 슬프지 않다. 그런 감정을 이끌어내지 못하기 때문. 그리고 부모나 친구가 죽어도 영화속 캐릭터는 영화속에서 슬픔을 오래 지속하지않는다  
20170101,10,80년대 초 스타워즈를 보고 자란 나로서는 재미 그 이상이었던 것 같네요. 마지막.... 전율에 소름이... 그 전율에 나이 40에 창피하게도 결국 눈물 쏟고 왔네요. 아... 진짜.... 생각할수록 가슴이 먹먹하네요.  
20170101,9,새로운 희망. 투쟁의 동력.  
20170101,6,다른 시리즈를안봐서그런간지...  
20170101,10,앞으로도 스타워즈 영원하길...꽃길만 걷자  
20170101,3,"솔직히 너무 지겨웠음. 어우 유치하고 ,,,, 그냥 집에서 비티비로 봤음 딱이었음.  "
20170101,10,주인공은 다스 베이더...  
20170101,7,관람객전작을 몰라도 흥미롭게 볼 수 있을까?  
20170101,10,스타워즈 팬으로서 엄청 만족한다... 잘만들었음  
20170101,9,관람객아이들과 함께 재미있게 잘봤어요  
20170101,6,스타워즈 스토리를 모르니 재미반감  
20170101,5,관람객그럭저럭 본것같아요 졸기도 하면서  
20170101,3,스타워즈의 추억 없이는 버티기 힘든 2시간  
20170101,10,관람객may the force be with us! upcoming those days  
20170101,1,스타워즈 덕훈데 역대급 망작으로 보입니다. 스타워즈 입문하시는분들에게는 괜찮지만 이 주인공 싸그리 다죽는 중간스토리 하나 만들려고 레전드 세계관을 전부 없었던 설정으로 한다니 참 어이가없네요.. 설정오류인게 레이아와 오르가나는 데스스타가 실존하는걸 진  
20170101,5,관람객스토리 내내 시간에 쫒기는듯해보였지만 스타워즈 이전작품들의 로봇이나 기체들의 모형을 잘 따왔지만 다스베이더의 내외적 묘사를 잘 살리지 못한점이 아쉽다.그리고 중간중간 보이는 심각한 오역이 매우 아쉽다  
20170101,9,"초반에는  최대한 호평해 보자면, 일단 스토리를 위해 지루했던것같다. 하지만 그래도 자꾸 갑툭튀하는 사운드가 많아서 살짝 실망햇다. 그렇지만 좀 보다보면 정말 아슬아슬하고 긴장되는 부분도 있었다 (뭔가 백 투더 퓨처 1편 끝 부분 느낌?)  "
20170101,8,관람객볼만하네요. 다음편 기대됩니다!  
20170101,10,관람객최고입니다.최고입니다최고입니다최고입니다최고입니다최고입니다  
20170101,7,관람객아쉽네요ㅠ 시리즈 중 가장 지루했어요  
20161231,7,관람객스토리가 엉성한 듯; 우주 전투씬도 뭐.. 잘 모르겠다  
20161231,10,스핀오프지만  재미는 오히려 더 낫네요. 더구나 다쓰베이더 형님의 그 씬은 와우!  
20161231,8,관람객그냥 그저 그런....  
20161231,9,"중간중간 기존 시리즈의 나왔던 인물들이 등장하여 반가웠고, 마지막 로그원 대원들은 정말 안타까워 눈물이 날정도.. 그리고 다스베이더의 마지막 피날레는 역대급  "
20161231,9,관람객이제 베이더 데리고 공포영화 하나 찍자  
20161231,10,스타워즈 시리즈중에 기억에 남을 수작. 마지막 클라이막스쪽은 정말 대단하다.  
20161231,9,관람객몰입해서 봤어요스토리 개연성이 아쉽지만 그래도 액션 최고에요 ㅎㅎ  
20161231,7,기대를 너무 해서 그런지 저는 별로였어요~ㅠ박진감도 없고 다소 황당하기도하고~~  
20161231,10,보다보면 내면에서부터 눈물 올라옴내려간 스타워즈의 위상을단숨에 복귀시키고 끌어올림극장에서 안보면 필히 후회함  
20161231,9,관람객역시 스타워즈 시리즈는 실망을 모르네요.  
20161231,10,관람객스타워즈 어렸을때부터 꿈꿔온 인생영화 ㅎㅎ  
20161231,10,와~ 에피소드 1 2 3 4 5 6 ... 이미 끝난것을...70년대 만들었던 에피4의 시작점인 데스스타 설계도 얻는 과정을 잘살렸네요! 스토리상 암흑기인 제다이기사가 안나와 아쉽지만 ㅎㅎ 에피소드 3.5  라고 보면 되것네요!!  
20161231,10,어렸을적 만화로 보고 영화로 스타워즈 시리즈 다 봤어요 연결스토리도 그렇고 볼때마다 정말 놀러워요 많은 사람들이 봤으면 좋겠네요..  
20161231,10,마지막에 나온 다스베이더가 멋지네요~ 잼있었어요  
20161231,10,재미잇게 아주 잘 봤습니다  
20161231,10,아주 깔끔하게 잘 만들어졌다. 기존의 설정을 바꾸지 앙ㅎ고서도 스타워즈 시리즈에 잘 녹아들어갔다! 최고다!!  
20161231,10,팬들에게 기대하지 않았던 거대한 선물이었습니다. 이번 편으로 이 이야기가 끝이라니 너무 아쉬워요  
20161231,10,마지막 다스베이더 씬과 견자단의 대사가 계속 머릿속에 맴도는 영화네요  
20161231,10,스타워즈를 완벽히 이해한 감독이 만든 영화. Jj브람스의 7편은 유치뽕짝이었으나 로그원은 기존 스타워즈를 뛰어넘은 수작. 루카스도 울고갈듯  
20161231,10,다스베이더.. 등장만으로 전율이 느껴진다.  
20161231,10,"4D, 아이맥스 모두 봤는데 아이맥스가 나은듯. 에피소드 6인가에서 데드스타 설계도 얻기 위해 많은 희생이 있었다고 했는데 그 내용을 너무 멋지게 다룬 영화라고 생각된다.  "
20161231,10,스타워즈시리즈 중 최고의 액션과 최고의 현실성. 그리고 최고의 재미. 화면의 연출력도 시리즈 중 최고인 듯.  
20161231,10,희망은 위대한 개인이 만든 것이 아니라 끝까지 포기하지 않은 사람들의 꿈이 모인 것이다  
20161231,1,졸려죽는줄 알았다. 돈이 아깝다!!!!  
20161231,10,로그 원 마지막 장면이 스타워즈4의 첫번째 장면  
20161231,10,내용도 좋고 마지막 전투신은 스타워즈 시리즈중에서도 역사에 남을만하다  
20161231,10,재밌어요10자10자  
20161231,10,독재자에게 자유와 평화를 빼앗기고 지배당하면 그것을 되찾는데 많은 희생이 따르고 되찾기도 어렵다는 것을 보여주는 작품.  
20161231,10,제다이가 없으니 이리도 처절하고 가슴 아프게 영화가 탄생한듯 싶다.붉은색 광선검에 소름이 돋고 공포영화 보는듯한 느낌마저 든다.  
20161231,10,"스타워즈 팬으로서 너무 감격스럽기도 했지만, 스타워즈 시리즈에서 기대하지 못했던 감동을 느껴서 너무 놀라웠습니다  "
20161231,8,관람객굿!^^ 기대를 저버리지 않는 영화.  
