0,1,2
20190127,10,그들이 있었기에 반군이 희망을 가질 수 있었습니다.  
20190127,10,레아공주 살짝 웃으며 Hope! 할때 울컥 ㅠㅠ  
20190127,9,주인공들을 다 죽여버리다니...처음이다 스타워즈  
20190127,10,오리지날 스타워즈 팬을 위한 멋진 영화  
20190126,10,와 진짜 개재밌다 데스스타 설계도를 반란군이 어떻게 얻게되었는지 알수있었던 영화였다  
20190123,9,한편의 SF영화로도 명작인데 스타워즈 팬들은...특히 엔딩은 말이 필요없다  
20190122,7,다스베이더가 스타워즈의 진정한 주인공이지. 4편으로 통하는 든든한 다리.  
20190120,7,마지막 그 장면을 보기 위해 쭉 보는 영화  
20190119,10,스타워즈 456편 다시 정주행하게 만드는 영화... 정말 명작이다  
20190119,1,1편2편이후는 전부 맘에 안듬 그만 좀 만들라고  
20190119,10,스타워즈 시리즈 중에 제일 재밌음. (내생각)  
20190118,10,라스트 제다이 이전과 이후 평가가 다른 영화오늘도 다시보고 재평가 하고 갑니다  
20190118,10,"국민학교다니기전부터 막내외삼촌따라 극장가서 4,5,6편 보고 커서 1,2,3편 전부 극장가서 본 덕후로써 티비로본 7편보다 로그원 그짧은 전율의 엔딩이 날 놀라게했다 티비에 또하면 제대로 다시봐야지ㅋ  "
20190118,10,SF 영화에서 비장미와 여운을 느끼다니  
20190118,10,3편과 4편의 자연스러운 연결고리...주연들의 희생과  라스트신이 압권!  
20190117,10,그놈의 집구석 사랑싸움에 우주가 난리법석... 콩가루 집구석 때문에 대체 얼마나 많은 사람들이 죽는거야...  
20190116,10,영화 감상이 취미.. 지금까지 수천편의 영화 감상.. 그 중 가장 좋아하는 장르가 SF... SF 보고 감동 받아 울어 보기는 처음..  
20190116,10,스타워즈 팬으로써 정말 소름끼칠듯한 명작이었다 보는내내 정말 횐호성도 지르고 너무 감격해 눈물이 계속 흘렀다 7은 이런식으로 나왔어야해 !!! 로그2도 언젠가 나오길!!!!  
20190116,10,레아공주 마지막 등장은 cg인가요? 뭉클했네요  
20190116,4,"그나마 좀 나은 스타워즈. 형은 스타워즈 만화 말고는 도저히 끝까지 못보긋더라. 노잼, 캐릭 난무,어지럽다. 애니가 단순하고 볼만하더라. 최근 스타워즈 극장판은 거의 안봄. 지루하고 긴 러닝 타임도 불만. 그나마 이건 끝까지 봐줄만. 견자단이 살림  "
20190115,9,시리즈 전작들 다 보고 보면 매우 재밌어요  
20190113,9,스타워즈 원작의 향수를 느낄만한 연출을 훌륭하게 섞어놓음.  
20190113,10,극장에서 보고 오랜만에 재탕했는데SF영화에 감동받기는 또 오랜만인듯다스베이더 분량이 작아서 아쉬웠지만 마지막 장면하나로 레알 소름 공주등장은 cg기술의 발전에 놀라울뿐로그원의 마지막 장면과 bgm은...  
20190113,10,평론가 말이 너무 웃기네 첨보는 사람한테는 당연히 이해가 안되지 해리포터나 헝거게임도 그렇게 따지면 똑같지 ㅋㅋ  
20190113,10,TV OCN방송에서 첫 방송 했는데 아무 생각없이 보다가 SF공상과학영화 보고갑자기 울기는 처음 ㅠ 대박 감동과 스토리 액션어릴때 456 보고 그 추억으로 본 123은 그다지 잼 없었는데이번 건 다시 추억이 떠오르고 가슴이 벅차올랐다  
20190113,10,와 진짜 지금 재방송해줘서 다시 봤는데 로그원 명작이다  
20190113,10,역대급 스타워즈. 감독의 역량인가. 극장에서 못본 게 뼈아프다  
20190113,10,수준 높은 스타워즈..라스트 제다이가 반만 따라갔어도..ㅠ  
20190113,8,올모스트 최고의 스타워즈. 특히 마지막 전투씬은 시리즈 통틀어 최고  
20190113,9,스타워즈 시리즈 중 최고  
20190113,10,다스베이더와 광선검 그리고 레아공주...  
20190113,7,모르겠고 스타워즈7보다 재미있었다  
20190112,10,"역대급~ 다시 시작한 스타워즈 본시리즈 7, 8보다 훨 낫다~ 다스베이더의 카리스마!!  "
20190109,9,관람객에피소드 5 다음으로 잘 만들어진 스타워즈  
20181228,8,스타워즈가 이런 감동적인 스토리를 만들 수 있다는 것을 증명한 영화. 승리를 위해서는 희생이 필요하다.  
20181225,8,"스타워즈의 위대함이 포스와 광선검에만 있는 것이 아님을 보여주는, 잘 만든 스타워즈 영화. 스타워즈의 간판과 설정을 이용만 하는 대신 스타워즈의 세계를 좀 더 풍부하게 만들어주는 재미있고 멋진 작품이다. 모든 팬들을 실신시킬 마지막 장면도 단연 압권.  "
20181225,9,스타워즈 시리즈 중에서 제일이다  
20181218,10,다시봐도 명작이며 슬프고 장엄한 스토리이다 마지막에 다스베이더 씬으로만 봐도 돈을낼 가치가 충분이 되는영화 낮은 평점준 사람들은 스타워즈에 대한 스토리를 이해못한거임 4편의희망편 이전이야기 데스스타 약점 캐내는스토리인데 대채 뭘생각하면서 본거임?  
20181215,10,"역대 최고의 스타워즈 영화! 7,8이 로그원 반의 반만 따라갔어도...  "
20181209,7,비록 악이 지배하는 세상에서도 희망을 잃어선 안돼  
20181128,10,관람객역대 스타워즈 시리즈 중 세손가락 안에 꼽을만한 수작.  
20181123,9,최고의 프랜차이즈는 역시 스타워즈!그리고 스타워즈의 주인공은 역시 다스 베이더!  
20181120,10,광선검이 영웅한테 밥 먹여주는 건 아니잖아? 광선검을 들지 않은 스타워즈 세계관 속 진정한 영웅들의 이야기  
20181116,10,"3편과 4편 사이를 이어주는 완벽한 개연성....타킨 총독,레아 공주,다스베이더를 다시 보게 되다니....  "
20181102,6,꼭 필요한 내용이긴 하나..너무 졸리다. 기본적으로 재미가 있어야지  
20181022,8,"초중반부는 솔직히 엉성해요, 근데 후반부가 영화를 다 살려놨습니다 ㄹㅇ  "
20181015,8,"초반에는 별루였는대,, 중반부부터 잼있어지네요..  "
20181003,10,외전이라서 안보구 있다가 라스트 제다이 보고 봤는데 무슨 외전이 본편보다 설정을 지키냐 라제는 정말 쓰레기다. 초반 전투에서 느려터진 폭격기로 공격하는데 저항군의 전투 스타일은 빠른 공격으로 거대 전함을 격추다. 자살 카미카제 돌격은 잊을 수 없다.  
20180928,10,"은하 내전의 진정한 영웅들, 로그 원  "
20180927,10,견자단이 출연하여 약간 어색하긴 하지만 그래도 잘 어울려진다.. 만족  
20180926,10,크하  이것도 명작이구만  
20180924,10,스타워즈 시리즈중 젤 명작..  
20180916,7,근데 꼭 그렇게 다죽여야만했나  
20180830,10,속편이지만 스토리가 너무 마음에 든다.그리고 마지막에 다스베이더가 아주...  
20180823,7,"1977년에 나온 원작 세 편의 영화에 가장 가깝게 만든 스타워즈 다운 스타워즈, 1999년에 후속작이라고 내놓은 쓰레기들보다 훨 스타워즈스러워서 만족 ... 하지만 스토리가 너무 지루하고 평이해서 아쉬움!  "
20180818,5,존나 재미없네. 스타워즈 프랜차이즈도 이제 적당한 선에서 끝내라 좀.  
20180813,8,스핀오프라지만 좀 슬프네요ㅠㅠ 주인공 캐릭터끼리의 화학적 결합이 좀 아쉽긴했지만... 본편과 약간 다른결의 번외편으로 볼만했습니다^^  
20180811,9,다스베이더 마지막 2분 등장으로 영화 장르가 공포로 바뀜  
20180805,10,라스트제다이 보고 짜증나서 봣는데 속에 꽉막혀있던 암덩어리가 다 증발해버렸다. 스타워즈 답지않게 처절하지만  갠적으론 시리즈 중 세손가락안에 드는 작품.  
20180804,7,영화는 전체적으로 평이했지만 마지막 다스베이더 등장씬이 압권이다.  
20180730,7,디즈니의 스타워즈 중 가장  원작을 존중한 영화.  
20180721,10,"전 시리즈를 통달한 스타워즈 팬이라면 알 수 있다. 정말 완벽하게 잘 만든 영화라는걸. '스핀 오프'의 교과서는 로그 원을 두고 하는 말. 3D로 극장에서 봤을때 그 느낌을 아직까지 지울수가 없다. 그냥 스타워즈 라는 스페이스 오페라, 신화 그 자체  "
20180718,8,솔직히 중반부까지는 지루하다. 등장 인물은 많은데 설명이 부족함. 하지만 후반부의 대규모 전투와 엔딩 전의 5분이 영화를 살린다. 감독의 롱샷 연출이 일품  
20180717,10,본편보다 더 재밌다 여주도 개이쁘네. 다만  너무 우울하다.  
20180712,10,스타워즈 시리즈 중 유일하게 울어버린 ㅠ  
20180705,10,로그 원. 포스가 함께 하길..  
20180701,10,"기존 시리즈들이 지나친 공상과 미래지향적 인위성으로 호불호가 갈렸다면 이 작품은 그런 스타워즈에 피와 땀냄새, 그리고 현대전투와 같은 리얼함를 녹여내어 모두가 체감할수 있는 친숙함과 강렬함을 보여준다. 줌아웃된 기존 시리즈들을 줌인하여 보여주는 명작  "
20180630,8,로그원으로 인해 스타워즈의 세계는 더욱 깊어지고 디테일해졌다.  
20180621,1,관람객최악이여따재미없었다진짜  
20180620,7,기존 스타워즈의 스타일과 이질감이 느껴지긴 했지만 그부분이 이 영화의 심장이 된듯하다.  
20180614,10,라스트제다이를 본 사람이라면 알 것 이다.메인 요리보다 맛있고 만족스런 에피타이저.  
20180611,10,이미 결말이ㆍㆍ슬픈 영화ㆍㆍ하지만 배우 하나 하나 멋있다ㆍㆍㆍ  
20180610,10,사전지식 하나도 없이 처음 접한 스타워즈 작품임 근데 점점 주연들이 죽어나가서 띠용하고 마지막엔 아예 로그원이 행성이랑 같이 증발하는데 영화 잘봤네 하고 기분좋게 나옴  
20180605,9,막판 10분 개지렸다;;;  
20180604,10,처절하고 장렬했다. 작품이라는 수식어가 걸맞다. 다스베이더는 제다이었다. 일반 휴먼은 제다이에게 녹는다.  
20180603,10,내 생각엔 최근에 나온 시리즈 작품들 중에선 최고인 듯. 무엇보다 스토리가 말이 됨. 라스트 제다이 비행기 안에서 보다 졸았다.  
20180603,9,"난 이 작품을 '스타워즈 에피소드 3.5'로 인정하며 스타워즈의 최후의 명작이라 생각하기로 했다.. I'm one with the force, and the force is with me.. 마지막 붉은 광선검 켜질 때 지린사람??  "
20180602,9,이만 하면 잘했다. 아들보다 나은 조카.  
20180602,10,스타워즈8보고나서 이걸 보니 어후....  
20180601,10,사실상 스타워즈의 마지막.  
20180601,10,시리즈 중 최고임. 소름돋음.  
20180601,10,요즘 나온 속편중에 제일 스타워즈스러운 영화  
20180529,10,"스타워즈 중에서 스토리가 탄탄하면서도 눈이 즐거운 시리즈, 꼭 보시길 바람  "
20180528,7,뭔가 아쉽네~~평타요  
20180527,10,닥 10점. 스타워즈 팬들을 위한 영화  
20180527,10,"깨어난 포스보다 더 잘만들어진 영화라 할 수 있음, 라스트제다이는 이미 안드로메다로 가버린 이상 최근 스타워즈 시리즈중에 이보다 더 나은 작품은 없는것 같다.  "
20180527,10,스타워즈 시리즈 중 탑. 고전에 대한 공경심을 감안하고서도 로그원이 최고다. 아니...고전이 있으니까 로그원이 더 빛난건가;  
20180526,6,관람객너무너무잼있자낭~만족만족♡  
20180524,9,본편 에피소드를 뛰어넘는 사이드 스토리  
20180522,10,와 내가 스타워즈팬이대 마지막 5분 어둠속 붉은 광선검 진짜 못잊겠다 와 진짜 대박였어요  
20180520,10,스타워즈는 딱 로그원까지가 진짜다  
20180518,8,본편을 더욱 풍성하게 만들어주는 이런 에피소드 내용들 너무 좋다. 오리지널 시리즈 보다 더 묵직하고 비장해서 더 기억에 남는다.  
20180510,10,"프리퀄 시리즈로 높은 완성도와 내용, 스토리. 아무리 첫 스타워즈라고 하지만 시리즈를 다 정독하고 마지막에 보시는것을 추천드립니다. 모든 시리즈의 내용을 100프로 이해하고 볼때의 그감동이란.... 말로 설명할 수 없습니다..  "
20180508,9,스타워즈 시리즈 안좋아하는데 재밌음.  
20180508,10,엔딩까지 완벽하다...군더더기 없다. 어릴때봐서 기억도 안나는 스타워즈 전편 다시 봐야겠다.  
20180506,10,하나의 영웅인 제다이가 없는 스타워즈 이야기 나오는 이들 모두가 영웅이었다. 포스가 함께하길  
20180501,10,와 기대 안하고 있다가 이제 봤는데 뭔가 슬픈 스타워즈 였다 마지막 베이더 나오는 장면이 진짜 압권이다..  
20180421,10,말이 필요없다. 스타워즈 답지 않지만 가장 스타워즈같은 스타워즈이다  
20180419,8,스타워즈 팬에 대한 의무적인 팬서비스 장면들 때문인지 몰라도 스토리 사이사이 이어지는게 좀 허접하긴 했는데 그래도 후반 40분은 숨도 못쉬고 본 것 같다.. 진짜 후반 40분부터 엔딩신까지는 스타워즈 팬이라면 인정할 수 밖에 없음.  
20180418,10,진짜 10점!! 스토리도 괜찮은것 같고 스케일이 기존의 스타워즈들보다 더 커진것같네요. 감동적인면도 있고 특히 마지막 다스베이더의 장면과 레아공주로 등장한 캐리 피셔는... 그냥 대박입니다  
20180408,10,영화관에서 못봤던 내가 후회되는영화.... 마지막에 로그 원의 진정한의미를 알았을때 깊은 감명을 받았었다. 이영화의 클라이맥스는 아무래도 레아에게 설계도를 갖다주기까지 과정이 아닐까싶다.  
20180407,7,시각적으로는 세련되어졌지만 역시 오리지날 보다는 아쉬움이 느껴진다  
20180407,9,이런 스핀오프 시리즈도 많이 있었으면..  
20180404,10,반란군의 뿌리가 희망이다.. 대의를 위해 목숨을 바친 진짜 영웅들의 이야기.. 눈물나게 슬픈데.. 마지막에 다스베이더의 포스는 ㅎㄷㄷ하다 개폭풍간지미친다 소름쫙 최고최고최고!  
20180404,10,스타워즈를 쭉 봐왔던 사람이라면..로그원이 걸작이란걸 알듯..  
20180402,1,이제 지겹다. 고마하자.  
20180330,5,이거 개봉한 나라 중에서 첫주 1위 못한건 우리나라 밖에 없네  
20180330,10,기존 스타워즈보다는 이게 더잼잇다는..뿅뿅거리는거 못보겟음;  
20180324,7,스핀 오프 치고는 괜찮은 스토리의 작품  
20180324,6,아아 많이 미흡해. 많이 미흡해.  
20180323,7,"속편이지만 본편보다 좋게 봤다.분위기가 달라지고 신선한 느낌이 들었다.클래식한 스타워즈라면 더 가볍고, 가끔씩 유치한설정들이 있는데 몰입을 방해할때가 있어서 로그원 같은 시도도 좋다고 본다. 전혀 새로운 인물들의 등장이 한몫한 것 같다.  "
20180316,9,"스타워즈 시리즈 중 가장 박진감 넘치는, '재미'와 '감흥'을 동시에!  "
20180314,10,스타워즈: 라스트 제다이를 보고 이 영화를 다시 보면 왜 이 영화가 수작인지 제대로 알 수 있음  
20180313,10,스타워즈 시리즈중 제일 재밋는 수작  
20180312,10,"전시리즈 통틀어 최고다, 로그원은 기존 스타워즈의 한계를 뛰어넘은 최고의 영화!  "
20180311,1,그닥;; 전투 개연이 너무 상식적으로 말이 안됨;;;  특히 제국 함선을 밀어서 보호막을 파괴할때~ 어이없었음  
20180227,10,최고의 프리퀄. 설계도 하나에 담긴 수많은 희생과 무게. 2000년대 이후 스타워즈 가운데 제일로 감명 깊었음.  
20180226,10,와 진심 이건 스타워즈 전편을 보거나 4편을 본 사람만이 마지막 장면을 이해할듯...ㅠ 특히 진엔딩은 우리 다쓰옹^-^  
20180226,10,그냥 어릴때본 스타워즈생각에 킬링타임용으로 봤더니 다시 감동이.. 그냥 단편으로도 진짜 잘만들었다ㅠㅠ 스타워즈 다시 봐야겠다  
20180225,8,"스타워즈 세계관을 떠나서 봐도 전체적으로 괜찮은 작품 ,  "
20180215,10,진짜 인생영화입니다.  
20180214,10,세드앤딩아님jQuery22407953017833845002_1518538369458? 걍거의 다죽어는데  
20180213,9,스타워즈 최근 시리즈중 수작임  
20180211,10,제다이들이 손쉽게 튕겨내던 광선총들이 일반인에게는 얼마나 무서운 무기였는지 그 어둠을 이겨내는 진정한 영웅들의 이야기.  
20180211,1,"..,,..,,..,,  "
20180206,10,역시 언급해야 할 것은 마지막.... 어릴적이 회상되니 소름이..ㅠ.ㅠ  
20180205,10,그들의 불가능한 미션이 시작된다!  
20180203,10,21세기에 나온 스타워즈중 최고  
20180126,10,오리지널 보다 더 완벽한 서사시. 역사는 보이지 않는 곳에서 희생한 영웅들에 의해서 이어지는것.  
20180122,10,다시봐도 감동임 나의 스타더스트 포스를 믿으렴ㅠㅠ감독 각본 각색 배우진 이 조합 최고임 감히 말한다 내게 돌을 던져도 좋다 기존 시리즈 에피 원작 보다 감동임 그 희망을 위해 희생한 숨겨진 영웅들의 이야기 다음 스타워즈 스토리가 궁금하고 보고싶다  
20180121,2,재미가 없다 너무나도  흑  
20180120,10,외전임에도 감동과 재미가 더 있어요  
20180119,10,"극장에서 처음 보고 dvd로  두번째보는데 볼수록 재밌다 7,8보다 훨나은듯 쵝오  "
20180119,10,7편과 8편은 쓰레기였지만 로그원은 걸작이라 평가받아 마땅하다!!!마지막 5분은 전율과 소름의 라스트엔딩이자 시작이다.  
20180118,10,ㅋㅋ쟁나요  만이만이영화대박나길  
20180118,9,"스타워즈만의 느낌 ,꽉 쥐었어요  "
20180115,8,라스트 제다이로 인해 깨어난 포스가 망쳐진 이 시점에선 디즈니 이후  제대로 된  스타워즈 영화는 얘 뿐이구나...  
20180114,10,스타워즈 시리즈 통틀어 가장 잔인한 다스베이더를 볼 수 있었다. 다스베이더가 얼마나 인정없고 잔인하고 감정이라곤 눈꼽만큼도 없는 놈인 줄 제대로 알게 됬다.  
20180114,5,스타워즈에 대한 예의상 끝까지 보긴 했는데...어설픈 전개와 어설픈 연기는 좀...  
20180113,10,기존 시리즈보다 이게 훨씬 재밌네ㅋㅋㅋ  
20180113,9,7보다 백배 낫네요 숨겨진 영웅들의 이야기. 특히 마지막 베이더경의 붉은 광선검과 다크포스는 그동안 시리즈 중 가히 최고!!  
20180109,10,이걸 지금에서야 보다니...스타워즈의 최고의영화라고 할수있다  
20180109,10,다스 베이더 다시 등장하다.  
20180104,10,다스베이더~  레이아공주~  타킨총독~  그리운 인물들이 등장해서 너무나도 반가웠다.   스타워즈영화중 우주전쟁신은 가장 화려하고 임팩트가 강했으며  총19번을 봤다.+  
20180103,8,오리지날 시리즈를 제외하곤 제일 재밌다.특히나 무쌍씬은 정말 최고  
20180103,10,스타워즈에게 바치는 헌정 그 자체  
20180102,8,전쟁신은 거의2차세계대전급이라고 할수있음  
20171231,10,기존 시리즈에 넣어도 위화감이 없는 작품  
20171231,10,"스핀오프격으로 기대안하고 봤는데..기존 스타워즈시리즈에서 볼수 없었던 리얼전투, 몰입감, 비장미ㅠㅠ 라스트씬은 말할것도 없고 공중 모든전투씬이 압권이었음..초강추!  "
20171227,1,마지막 10분만 잘만들면 되는구나... 어휴  
20171226,1,중간 못 넘기고 쳐 잠 :^/  
20171226,9,댐다 견자단에 나온형님도 멋있  
20171226,7,역시 다스베이더가 나와야 스타워즈지  
20171225,9,참신한 기획이 좋았음. 막판에 레이아공주보고 감상에 젖기도  
20171224,9,초반 지루함만 빼면..주인공이 없는 독립운동가들의 이야기같아 더 처절하고 위태롭다. 그래서 더 현실감있고 몰입했고 감동적이다. 새로운 스타워즈의 감성을 보여준 대작이다.  
20171224,10,스타워즈 클래식 팬들을 위한 영화. 그러나 로그원 자체만 놓고 봐도 훌륭한 영화다. 실사영화 시리즈 중 가장 큰 희망을 전달한 그들. 단순한 외전이라고 볼 수 없다. 존재감이 굉장하다.  
20171224,10,화려한 전투씬~ 비장한 엔딩~스타워즈 인생팬으로써 큰 선물을 받았네요.  
20171223,7,완전 짱이지만 18%부족  
20171223,10,전 편들을 보지 모한 분들에게는 신세계. 원조 팬들에게는 마지막 5분이 영화의 전부.  
20171223,6,마지막 다스베이더 등장씬 하나만을 위한 기다림.  
20171222,8,중반까지의 각본의 짜임새는 좀 아쉽지만 스타워즈라는 이름값은 하는 작품  
20171222,10,수많은 사람들이 그토록 처절하게 싸우면서 지키고자 했던 게 무엇인가를 생각하며 숙연해지는 영화였다. 스타워즈 전체 시리즈 중에서 가장 깊고 슬픈 영화였다. 많은 사람들이 이 영화를 보고 용기를 얻었으면 한다. 발군의 연출력은 덤.  
20171221,8,아주 거슬리는건 없었다. 컨셉아트에 신경좀 쓴듯  
20171221,1,제다이도 아닌 짱깨놈 말도안되는 포스타령 완전 꼴보기싫어  
20171220,10,스타워즈 팬이라면 무조건 봐야할 영화.  
20171220,10,스타워즈 역사를 통틀어 최고의 마스터피스  
20171220,10,로그원도 부족한 면이 있다고 생각했다. 8이 나오기 전 까지는...  
20171220,8,제다이 보다 얘네들이 훨씬 낫다.  
20171219,10,"본편들(7,8편)보다 더 재밌는 외전  "
20171219,10,꽃이지고나서야 봄인줄 알았습니다  
20171219,8,"""띵호와 견자단께서 가라사대 '나는 포스와 함께, 포스는 나와 함께 한다.' 하시니 총알이 휘어 가는 기적을 행하였노라"" -포스복음 6장 9절-  "
20171219,10,8 보고 로그원 재평가합니다  
20171218,10,역대영화 전투신중 최고다. 내용전개는 말할것두없고  
20171218,10,로그원 보고 스워8로 붕괴된 멘탈을 추스렸다 ...  
20171218,8,"스타워즈 7, 8보다 더 재미있었다. 처절한 전투씬 뿐 아니라 감동까지..  "
20171217,10,"연출부터 스토리, 배우들의 연기, 뭐 하나 빠짐없는 완벽한 영화였다. 디스트로이어를 보면서 천조국의 CG에 감탄만 나온 스타워즈의 또하나의 명작  "
20171217,9,스타워즈:라스트 제다이 보고 이걸 다시 보니 진짜 로그원은 역대급 명작이다..아 나의 스타워즈를 돌려줘라  
20171217,10,새로운 스타워즈시리즈가 애들용 만화라면 로그원은 성인을 위한 동화다.  
20171217,10,그냥 한편의 영화로 보기에는 너무도 간절하고 슬프고 아름다운 영화. 모든 근간은 희망!  
20171216,10,로그원이 본편 시퀄 3부작보다 나을듯  
20171216,10,에피8 어제 심야로보고 좀전에 로그원봤다. 에피8 평점 7점줬고 로그원 10점준다. 본편이 스핀오프보다 못하면 우짜냐  
20171216,10,기승전결..완벽한...스타워즈 영화..스핀오프..중간에 스타워즈를 설명하는 영화가 이정도 희노애락을 안겨줄줄 꿈에도 모름...마지막 다스베이더의 붉은색 광선검이 영화의 클라이막스...욕나오게...잘만든게...최고의 작품...  
20171216,10,라스트 제다이 기대했는데 로그원보고...  
20171215,10,라스트 제다이 보고 로그원이 얼마나 대단한 영화인지 알게 됩니다. 라스트 제다이로 썩은 눈 로그원으로 정화 하세요.  
20171215,10,가슴벅찬 마무리. 하아.. 정말 대단한 미션이었다. 이걸 해내다니. 후반부 스토리와 연출이 대단함.  
20171215,1,아 ㄹㅇ 평점 알바1충들이 젤 무섭네 작년에 이거보면서 극장서 ㄱ떨듯 떨면서 졸면서 억지로 봤는디 ㄹㅇ 역대급 최악 졸작 퉤~!!! ㅉㅉㅉ  
20171215,10,이제껏 스타워즈랑 연출이 꽤 다르다 그럼에도 불구하고 옛날 스타워즈 감성 잘 살리면서 잘 만든거같다 역대 스타워즈중에 가장 완성도 높은 작품  
20171215,9,"마지막 2분, 전율하리라.  "
20171215,10,이렇게 슬픈 스타워즈가 다시  나올수있을까  
20171215,10,라스트 제다이를 보고 나니까 로그원이 얼마나 킹갇제너럴이었는지 다시한번 깨닳는다....베이더형 ㅠㅠ  
20171215,10,별로라고 생각햇는데 라스트제다이보니깐 이게 갓작띵작이네ㅋㅋ  
20171214,9,오늘 라스트제다이 보고 알았네요. 로그원 감독만이 희망입니다. 제발 9편은 이분이...  
20171214,10,에피소드 4를 이해하기위해 꼭 봐야함.사항스러운진.ㅜㅡ  
20171214,10,"스타워즈 팬들에게 최고의 5분을 만들어준 영화,,  "
20171214,10,전투씬과 다스베이더의 등장은 잊을 수 없다.  
20171213,10,스타워드 팬이라면 무조건 10점이다.  
20171213,10,5편과 3편 이후로 최고  
20171212,8,"스타워즈7보다 훨씬 재미있고 잘 만들어진 영화라고 생각한다. 다만 좀 지루하고 진 어소의 캐릭터가 아쉬웠던 것 같다. 그러나, 후반부에 접어들때 어느새 다 공감되었고 점점 몰입되는 나를 발견했다. 모두들 알겠지만, 마지막은 전율 그 자체이다.  "
20171212,10,진심 에피7보다 좋았다;; 다스베이더도 그렇고 내용도 이어지는게 자연스러워서..ㅠ  
