0,1,2
20170109,8,캐릭터 부재의 아쉬움. 차라리  대규모 전투씬을 줄였더라면  
20170109,5,관람객아이랑 봤어요~~~~^^  
20170109,10,관람객마지막이 압권  이었다고 말할 수 있다.  
20170109,6,마지막 장면을 볼려고 이영화를 본듯..  
20170109,10,관람객역시 스타워즈란 말밖에....  
20170109,9,관람객역시 스타워즈는 실망시키지 않네요!  
20170109,9,"에피소드7에서 약간 실망하여 기대 안하고 보러갔는데.. 정말 괜찮았다. 여자주인공 아주 잘했고, 개인적으로 남자주인공만 조금 아쉬었고 나머지 조연배우들 모두 잘했다. 극장에서 나오면서 바로 다시 에피소드 3과 4를 보고 싶게 될것이다.  "
20170109,7,관람객마지막장면으로 모든걸 설명함  
20170109,10,생각보다 너무나 만족스러웠던 영화.  
20170109,7,"관람객여성주인공, 여성영웅서사, 여성 엑스트라 비율 등 신경을 많이 쓴 듯 보였지만 여전히 알탕영화였음.  "
20170109,7,관람객스타워즈 팬을 위한 영화인듯  
20170109,5,관람객기대했던것 보다 별로예요..광선검도 등장인물도 시선 끄는 점이 없는듯..  
20170109,10,스타워즈를 전혀 몰랐던 저는 이 영화가 끝나고 나서야 오리지널 3부작의 시작점이 된다는 사실을 알고 스타워즈에 푹 빠지게 됐다. 스잘알님들은 마지막 7분에 헠헠 대는것 같은데 난 단지 내 첫 스타워즈 영화의 주인공들이 희생에 크게 감동했다  
20170109,7,관람객재미있었지만~~ 기대에 부흥하진 못했네요 ㅠㅠ  
20170109,5,지루해 자는 사람 만터라.. 엔딩이 살렸어  
20170109,1,휴 잣습니다너무 졸림  
20170109,7,"4D 로 보았더니, 눈이 매우 피로하네요 2D 로 보세요  "
20170109,10,에피소드7을 이렇게 만들지.실망 JJ  
20170109,9,"관람객이제,, 맘속에 스타워즈를 오래오래 간직할 것입니다.  "
20170109,10,관람객스타워즈 시리즈중에서 최고  
20170109,6,"제작자와 작가, 연출자는 무엇을 보여주고 싶었는가? 알 수가 없다. 딱히 스토리상 시도라곤 새로운 리부트의 스타워즈 설정이라는 것 빼고는 아무것도 없다. 기존 스타워즈 시리즈의 명성으로 좀 벌어보겠다는 수작으로 보인다. 지나치지만 아쉽고 실망스럽다.  "
20170109,1,클리쉐덩어리 느낌의 영화라 영 별로...  
20170109,5,관람객스타워즈의  팬으로서이제는 좀올드하단 느낌을 받았다. 광선검이 없이 광선총의 액션은 샛각만큼의 리얼리티도 모잘라보인다.  
20170109,7,관람객사전지식없이 다보고 느낀건데 외전? 스토리인듯하구요. 저처럼 사전지식 없거나  전편 스토리  잘모르시면 조금 난해하지 않을까 싶습니다. 거의  막바지 전투신은 재미있게 봤었네요  
20170109,10,관람객믿고보는 스타워즈..  
20170109,10,관람객추억을 연결시켜준 다리가된 영화  
20170109,10,관람객다시 한번 스타워즈에 빠져들게 하는 영화  
20170109,8,"관람객너무기대했다 그래도 개인적으로 1,2보다 7보다 나은듯  "
20170109,9,역시 다스베이더 카일로 렌은 아직 멀었구만  
20170109,5,로봇조차 포스터가 영정사진임 그 흔한 키스라도 나오던가  
20170109,5,관람객지루했습니다 ㅠ.ㅠ  
20170109,6,"글쎄.... 마지막 다스베이더(짝퉁느낌의)의 깜짝 활약과 더불어 얼마전 돌아가신 케리누님을 그래픽으로 만났다는 거 외에는... 영화 '암살' 같은 느낌이랑까...,,  "
20170109,9,4편 연합군의 총 반격때 엄청난 희생을 댓가로 인공행성의 설계도를 입수했다라는 말 한마디가 갑자기 떠오른 영화였다. 매니아라면 기억날것이다. 이 한마디에서 시작된  절묘한 영화  
20170109,10,엔딩에서 전율이 느껴지는 연출 너무 좋았어요. 고질라는 그냥 그랬는데 멋진 연출로 성장했음. 펠리시티 존스는 너무 섹시하고 멋졌음.  
20170109,8,관람객스타워즈 스토리는 잘 모르지만 재미있네요  
20170109,8,관람객감동이 넘치늠 재미가 나는 영화엿읍니다  
20170109,8,스타워즈 시리즈를 처음 봤는데도 볼만했어요 스케일이 큰 영화인듯해서 속편 이어갔으면 하네요  
20170109,7,관람객솔직히 8점대는 매니아 층이 공감할 점수구요. 그냥 우주영화 좋아하시는 분들이라면 7점대가 정확하다고 생각되네요. 그리고 저번 영화부터 갑자기 스타워즈에 검술액션이 많이 사라졌던데.... 이부분 너무 아쉬워요. 이유가 있는건지....  
20170109,9,관람객마지막에 키스안해서 다행이다  
20170109,8,"관람객스타워즈 매니아 분들은 잼나게 보실슈있을둣~ 전 시리즈를 다 안봐서 처음,중간에 무슨얘긴지몰랐지만 전투신은 잼나게 봤어요!! 극장에서 볼만한 스케일인 영화라 괜찮았어요!!  "
20170109,9,순국 선열을 위한 묵념 같은 영화  
20170109,10,관람객가족모두 본 영화중에 모처럼 재미나게 보았네요~~^^*  
20170109,10,마지막 단 5분... 그것으로 충분하다  
20170109,10,관람객돌아온포스보다 훨 재밌다  
20170109,10,관람객우어어어 나름 잼나네요  
20170108,10,관람객긋좋아여긋입니다재미남  
20170108,10,관람객재미있어요★♥★♥★스타워즈 최고!!!  
20170108,7,관람객생각보다  재미있었네요  
20170108,10,"우주 시대의 첩보전, 정보전,함대전, 공중전. 그리고 다양한 인간군상의 모습들을 잘 살려낸 수작 SF물이다. 아울러 스타워즈 팬에게 바치는 찬사  "
20170108,9,"관람객초반 전개가 약간 엉성했지만, 이후부터는 흥미진진하게 잘 봤습니다.  "
20170108,5,관람객기대한만큼 재미가  없네요  
20170108,8,관람객처음엔 약간 지루했지만 갈수록 재미있는 영화~~후회하지 않을 영화예요  
20170108,9,관람객스타워즈 시리즈 전혀 안 봤는데도 재밌어요  
20170108,9,관람객재미잇어요 음악도ㅠ좋구  
20170108,7,관람객에피소드4와 자연스럽게 연결되는 마지막 장면에서 감동먹음  
20170108,9,노래 진짜 너무 좋아요!  
20170108,2,관람객너무 기대를 한건가 너무 노잼..신년들어 실망만하구옴  
20170108,10,관람객스타워즈 4편 70년대 영화를 보신분이라면은 꼭 보아야 내용입니다 벌써 두번이나 보았네요  
20170108,10,관람객잼나게 봤습니다 좋아요  
20170108,7,마치 90년대에 만든 sf영화를 보는 듯 하네요..정겹기는.하지만 뻔한 전개와 많이 본 듯한 캐릭터가 재미를 반감시킵니다  
20170108,8,관람객이거 전편 봐야함 10자  
20170108,10,관람객엔딩이 인상깊은 영화였다.  
20170108,10,스타워즈 팬이라면 반드시 봐야하는 영화!대규모 군단의 위용에 감탄감탄.. ^^  
20170108,7,관람객주인공이 마지막에 죽어서 아쉽네여  
20170108,5,관람객후반부는 확실히 스타워즈 같다는 느낌이 들어서 재미있는데 초반부는 너무 지루했음  
20170108,6,관람객 잘봤습니다 :) 다스베이더 짱쎔  
20170108,6,관람객스토리의 개연성도 떨어지고 결정적으로 영화에 포스가 느껴지지 않는다. 등장 인물들도 플랫하다. 감동이 인위적이고 어설프다.  
20170108,8,관람객다음작을 기대케하는 여운이 남네요  
20170108,10,짱이야~~멋있어~~^^  
20170108,9,다스베이더는 로그원에서 다시 태어난것과 같다  
20170108,10,스타워즈7보고 드디어 다스베이더를 대체하는 악당이 나온건가? 했지만 마지막 5분을 보고 알았다 카일로는 악동수준이지만 다스베이더는 악마였다  
20170108,10,관람객재미있었어요.스릴과 서스펜스~~  
20170108,9,관람객아이들이 아주 재밌어 하네요.  
20170108,10,스타워즈덕후가아니더라도즐길수있는영화스타워즈모르더라도 충분한볼거리와 감동과시간가는지모르게볼수있다  
20170108,9,관람객초반엔 좀 지루했지만 재미있었습니다 단지 아쉬운건 견자단형님의 액션씬이 부족했다는거..  
20170108,10,최고임 작년개봉한 스타워즈보다 훨씬 재밌음이거 재미없다는 인간들은 머리가 나쁘거나 타영화사홍보팀들이 악플다는거임 완전재밌음  
20170108,10,관람객이전 시리즈에 없던 감동이 느껴짐 다스베이더 등장은 간지폭풍 그자체  
20170108,10,관람객지금까지 스타워즈중 최고  
20170108,6,관람객그래픽은 좋으나 사전 지식이 필요함  
20170108,10,관람객화려한 화면도 좋았지만 3편과 4편의 어색한 이어짐을 정리한다는 것에 큰 의미가 있네요. 재밌게 봤습니다.  
20170108,9,"스타워즈 시리즈 다 안봤더라도 내용 이해하는데 큰 어려움 없고, 재미있게 잘 봄(개인적으로). 그리고 스타워즈의 진정한 팬이라면 마지막 베이더 경 씬은 진짜 소름x99  "
20170108,10,잘봤습니다^^우리가족 모두 ^^  
20170108,10,클레식의 귀환! 이런영화를 기다렸다.  
20170108,9,관람객dadaf hg jm hjk  
20170108,1,노잼.스타워즈 시리즈주인공  폭망  
20170108,10,관람객40년째  보고 있습니다.언제나  최고입니다  
20170108,10,마지막에 레어 공주 등장하면서 음악이 나올때  울컥했음  
20170108,8,관람객스타워즈는 영화 하나하나에 대한 평가보다 추억으로 보는 영화  
20170108,8,관람객숨겨진 영웅들이라는 단어가 너무 좋네요. 우리 눈앞에서 박수를 받는 사람들 뒤에도 우리가모르는 많은 숨은 영웅들이 많습니다.  
20170108,10,꼭 아이맥스3D 로 보세용  
20170108,10,스타워즈의 과거에 대한 추억이고 현재를 이어주는 다리이며 미래에 대한 약속이다. 시리즈 중 가장 슬프고 어둡고 절망적이지만 역설적이게도 숭고한 희생과 희망의 메세지는 영화를 보는 내내 가슴 벅차오르게 만든다.  
20170108,10,관람객굳굳재미쪄 스타워즈짱이야  
20170108,10,관람객크으으.맨끝장면 울뻔  
20170108,10,윾시 스타워즈 졸잼 >.<  
20170108,8,관람객내용이 아주 좋았고 군더더기 없는 내용이었습니다  
20170108,9,관람객스타워즈의 우주배경이 멋있네요.  
20170108,9,"타킨총독,다스베이더,R2D2,C3PO,레아공주까지...스타워즈오리진스토리 좋아하는사람들에겐 최고의 프리퀄  "
20170108,9,관람객스타워즈팬이라면 필수! 오랜만에 보는 베이버횽님 역시 포쓰가~~~  
20170108,7,관람객재미있었다.이젠 슬슬 물리는감도..없다곤 못하겠음  
20170108,10,관람객조카와아들함께가서봤는데모두재미있게잘봤습니다  
20170108,1,관람객재미 드럽게 없슴~~~~  
20170108,8,관람객공백을 제외하고 10자  
20170108,9,관람객좋은 영화지만 시리즈중 제일 슬프네요 ㅠㅠ  
20170108,7,관람객웅장한 스케일은 좋았으나 시나리오가 단순하고 뻔한 내용.  
20170108,9,관람객영웅사에서 돋보이는 일반인들의 이야기  
20170108,10,관람객우려했던것보다 훨씬 괜찮았습니다.다만 홍보와는 다르게 기존 스타워즈에 대해 잘 모르면 재미가 반감될 수 있긴하겠더군요.3편과 4편 사이의 에피소드인데 4의 바로 직전내용이라고 보면 이해가 빠를듯 합니다.  
20170108,10,갓베이더 성님의 존엄을 느낄 수 있음.  
20170108,1,관람객내 평생 이렇게 졸렸던 영화가 없음  
20170108,9,스타워즈 팬이라면 대만족 할듯  
20170108,9,"스타워즈4와 완벽한 연결, 제다이 없이도 완벽한 전투씬과 영상미, 주인공들의 비장함과 사랑... 이 모든게 스타워즈 스토리 중 가장 뛰어난 작품을 만들어냈다. 최고다!  "
20170108,10,스타워즈는 닥치고 대박. 이번에도 역시나 대박 2시간 타임워프 하고 옴  
20170108,8,관람객재미있게 봤어요~&&&  
20170108,7,관람객조금 덜컹거리고 아쉬운 구석이 많지만 스카이워커 이야기를 벗어나 좋은 이야기와 감동적인 장면들을 만들어냈다.  
20170108,1,이거보다 이런생각을  했습니다. 이거볼바에 차라리 '서유기 리턴즈'를 보겠다. 레알 씹노잼 개노잼 보다가 잠  
20170108,8,관람객스토리를 잘 짰네요 그런데 9점 이성은 과한듯  
20170108,9,오랜 시간 그토록 염원해 왔던 우리 시대의 스타워즈  
20170108,10,관람객스타워즈 시리즈  좋아하는 나로써 글을쓴다 잘만들었다 몇몇 스타워즈  스토리도 모르면서 재미없다고 떨들어대지말고  마지막 레아  
20170108,10,영화의 마지막 1분도 안되는 그 장면에 나는 미친듯이 열광했고 사랑에 빠졌다  
20170108,4,스타워즈 갠적으로 이번편도 엄청 기대하고 봤는데 무슨내용인지 하나도 모르겠고 그냥 로그 원에 의미가 가장 둠 마지막 붉은 광선검이 최고의 신의한수 였음 이때만 안졸림...  
20170108,10,관람객오랜만에 스타워즈  좋았어요!  
20170108,10,관람객깨어난 포스보다 재밌습니다  
20170108,7,"관람객의의로 잼있네요 7에 비하면 3,4편을 이어주는 스토리로 꼭 보긴 하셧야 될겁니다. 스타워즈 팬이라면  "
20170108,10,관람객와우~~~보는 내내 눈호강했네요~~~너무재밌어요  
20170108,7,관람객스토리 전개상 전혀 도움 안됨. . 빨 리 8편 나오길 학수고대 합니다!!  마지막 5분 다스베이더 설랬음.  
20170108,10,감독의  능력이 돋보이는 작품입니다. 마지막 전투씬 과 너무 하다는 느낌이 들긴 하지만 등장 주연 인물이 죽는 장면은 감동을 줌.  
20170108,7,관람객그래도 스타워즈입니다. 새로운 캐릭터도 재밌구요!  
20170108,10,관람객아무리 그래도 스타워즈는 스타워즈 !  
20170108,10,"다스베이더,레아 공주....  "
20170108,9,좀아쉬워도 굿....  
20170108,9,관람객7보다는 재밌었음  전투신 좋음  
20170108,5,관람객그럭저럭 괜찬은것같네요  
20170108,10,최고였어요 큰관에서 보길  
20170108,9,관람객별들의 전쟁에는 제다이만 있었던 것이 아니다  
20170108,10,관람객재밌습니다!!!!ㅋㅋ  
20170108,8,관람객벌써 다음 씨리즈가 기대되네요ㅎㅎ  
20170108,10,관람객스타워즈 광팬으로서 강추합니다너무잘봤어요  
20170108,9,이상합니다 이렇게 인기있는 영화가 보려니 하루 상영시간이 아침과 늦저녁 뿐이고 상영관도 많이 없어요 보고 싶어도 못보네요 개봉한지 얼마안된 영화인데 말이죠 이유가 뭘까요?  
20170108,10,관람객정말  잼났어요 강추합니다  
20170108,10,디즈니의 연출력만으로 10점  
20170108,7,관람객너무 기대가 컸나봐요 어차피 만사포통  
20170108,7,관람객초반 따분.  스토리도 그닥  
20170108,10,레아공주의 삼가 명복을 빕니다.포스가 함께하길...  
20170108,10,오늘 새벽에 보고 나오면서 감탄에 또 감탄을했다.. 깨어난 포스후에 느낀 엄청난 갈증을 풀어줘서 너무 감사하다.. 만일8편도 7편과 같이 만든다면.. 벌써 걱정 .. 암튼 완벽한4편을 위한 완벽한3.5편!! 대박  
20170108,6,관람객지루합니다 스타워즈 덕후만 좋아할듯  
20170108,10,20년전 회사 첫 여름휴가를 스타워즈 456편 비디오로 봤습니다. 로그원을 보고나서 입에서는 최고영화라고 나오눈데 가슴에서는 벅찬 눈물이 흐릅니다. 최!고!  
20170108,10,관람객재밌습니다 스토리몰라도 봐도되요  
20170108,8,관람객영화다보고옆에애들표정이재밌었어요ㅋ  
20170108,7,관람객에피소드7보다는 나은데.. 너무 평이하다 그래도 스타워즈라 7점  
20170108,10,관람객베리베리 굳 꼭 추천드리는 영화  
20170108,1,"돈이 아깝고 시간이 아깝네요!근데 기자,평론가 평점은 왜 높은가?거기에 속아서 영화 봤는데 재미 없어서 바람 잡을려고 돈 멕였나!!!?? 최악의 스타워즈 시리즈!  "
20170108,8,I'm one with the force and The force is with me!! 우직하게 끝까지 간다.  
20170108,10,정말 만족스럽습니다. 4편과의 연결도 깔끔하고 이전 스타워즈 시리즈와도 어색함이 전혀 없었습니다. 마지막 우주와 해변의 전투씬은 그야말로 대박이구요. 스타워즈 아예 모르시는 분들은 4편정도는 알아가시는게 좋을 것 같네요.  
20170108,9,관람객재밌게 잘봤습니다 아들하구봤는데 제가어릴적기분두나구 재밌게 잘봤습니다  
20170108,10,두번보세요 최고입니다  
20170108,1,"스타워즈는 에피소드1~6으로 끝냈어야 했음. 아니면, 에피소드1이전이나, 외전으로 제다이 광선검 전투씬을 대폭 늘려야함.  에피소드2에서 다수의 제다이 광선검 등장씬은 아직도 기억에 각인되어있다. 우주선 전투씬은 요즘시대에 전혀 호응을 못 얻음  "
20170108,10,어제 보고 왔는데 너무 재밌었다. 7보다  만족해서 더 좋았고 마지막은 슬펐다  
20170108,10,간만에 본 영화중 최고 몰입해서 재밌게 봤네요. 개인적으로 견자단의 연기력과 영화속에서 모습이 인상깊었고제다이 활극이 아닌 게릴라들의 전투씬이 미군들 전쟁영화를 보는듯한 느낌을 받았습니다. 스타워즈 시리즈 중로그원을 가장 재밌게 봤습니다  
20170108,2,스타 워즈  이제 그만 만들어라  이번건 진심으로 쓰레기다  
20170108,10,관람객번외 작품인데도 너무 잘만든 영화! 근데 한주만에 상영관이 10분의 1로 줄었네요~아들이랑 밤 11시 프로 보고 왔네요  
20170108,1,전투씬과 엔딩은 좋지만 이것 둘만 빼면 굉장히 지루할 수 있음  
20170108,7,관람객킬링타임~ 진부한 내용과 액션  
20170108,10,스타워즈 외전을 만들라고 시켰더니 감독이 에피소드 3.5 를 만들었네요 ㅋ 에피소드 4 를 먼저 보신 분들 한테는 대박인 영화 입니다 ^^  
20170108,9,관람객스타워즈판 전쟁영화 굿  
20170108,10,CG가 대박이었고 주인공 모두 개성있어서 좋았음  
20170108,10,관람객세계 정세를 좀 알아야  더욱 재미있는 영화가 된다.단순히 치고박고 싸우는 장면들 같으면  높은 점수가 어렵지만  영화가 내포하고 있눈 의미를 파악하고 본다면높은 점수를 줘도 아깝지않은 고급 정보를 많이 담고있다.  
20170108,10,관람객스타워즈 클레식을 열기 위한 배우들의 필사적인 노력  
20170108,8,관람객레아공주... RIP  
20170108,8,관람객마음이 아픈 영화다ㅜㅜ  
20170108,9,"미션 임파서블류의 첩보물 느낌까지 가미되어 기존의 스타워즈 시리즈와는 좀 다른 느낌. 무엇보다 애틋한 부성애와 남다른 희생이 있어서, 선한 가치를 말하는 영화라서 좋았다. 이 시대에도 세상을 향한 정죄보다 더 필요한 것은 나라를 살리기 위한 희생인데.  "
20170107,9,관람객굿~~재미있게 잘 봤어요~역시  
20170107,8,"스타워즈는 영웅들의 이야기지만, 로그원은 민초들의 이야기다. 그리고 진정 은하계든 지구든 대한민국이든 역사는 민초들의 희생으로 만들어져 가는것!  그 역사적 소명이 어느 에피소드보다 잘 녹아있고 그래서 감동이었다.  "
20170107,10,관람객제국군에 대항하는 반군의 스토리가 좋았습니다:) 스타워즈 팬이라면 속속 숨겨져 있는 연결의 메시지를 볼 수 있을 겁니다!! 기존 스타워즈의 영상을 그대로 가져왔기 때문에 시리즈를 안보신 분에겐 옛날 영상 같겠지만 디즈니의 영상미가 어디가진 않습니다 ㅎ  
20170107,1,스타워즈광팬인데 개실망.졸린거 팬심으로 끝까지 봐도 좃노잼. 주인공들 개못생겨서 몰입방해되고 뜬금없이 엽문은 왜 나와서 쿵푸하고 있냐 ㅋㅋ 레이저쏘는 전쟁터에서 지팡이들고 황비홍흉내 내는데 몰입이되냐?ㅅㅂ 그리고 그놈의 데스스타갖고 얼마나 우려먹을래?  
20170107,8,관람객스타워즈 스토리를 알고 본다면 좀더 재미있겠더라구요. 몰라도 재미있습니다.전형적인 액션 영화에요. 자체적인 스토리라가 보단 스타워즈 중간에 비어있는 서브 스토리격입니다.  
20170107,9,관람객흥미진진힐 스토리전개~~~재미있게 봤습니다!!!  
20170107,10,관람객추천합니다 시리즈 상관없이 재밋음  
20170107,6,관람객기대를 너무 많이했나ㅠ 기대한 의리로 평점을::::  
20170107,9,마지막에 장르를 호러로 바꾸어버린 다스베이더경에게 경의를  
20170107,10,다스베이더가 얼마나 재앙급 캐릭터인지 보여주는 영화.  
20170107,8,본편에서의 부족한 영화적 긴장감을 외전에서 찾았다!  
20170107,2,관람객비추.. 재미 없어요..  
20170107,5,마지막 다스베이더 나타나는씬빼고 볼거없음.  
20170107,10,스토리는 시리즈중 최고.쉴틈없이 이어지는 스토리라인에 시간가는줄 몰랐음^^  
20170107,9,관람객역시 스타워즈 스토리 항상 흥미진지.  
20170107,9,관람객아주 재미있게 보았습니다  
20170107,10,관람객막판 다쓰 베이더 짱 ㄷ ㄷ ㄷ  
20170107,3,관람객저는 지루해서 보다가 자버렸네요....  
20170107,9,관람객광선검이 언제나오나 궁금했었다.  스타워즈를 모르는 사람이 본다면 초반부는 이해가 조금 어렵다.  
20170107,10,너무 재밌는데 진짜 다죽이네... 포스터에 나와 있는 사람 중 산 사람이 없음  
20170107,7,관람객깨어난포스때와는 달리 원작의 분위기가 많이났다 유치하지않게 잘 연출한것같다  
20170107,9,관람객아쉽지만 나쁘지않은.  
20170107,10,관람객너무 재밌었어요...박수칠뻔했으나 꾹참음!눈물도 나오려 했으나 꾸 참음!  
20170107,9,관람객GoodgoodGoodgoodGoodgoodGoodgoodGoodgoodGoodgoodGoodgoodGoodgoodGoodgoodGoodgoodGoodgoodGoodgood  
20170107,9,관람객사이드스토리가 정말더 잼있는듯  
20170107,10,메이님처럼 스타워즈 덕후이지만 아직 로그원을 보지 못해서 아쉽네요.내일은 보러갈려고요ㅋㅋ.엽문에 나오는 견자단도 나오던데 엽문이라는 영화도 한번 보시길ㅋㅋㅋ.  
20170107,6,관람객초등학생은  재밌게 봤을듯.  
20170107,6,관람객초등학생은  재밌게 봤을듯.  
20170107,9,관람객굿!! 제국의군대와 연합군의 죽기아니면 살기...  
20170107,8,관람객스토리가 탄탄한 영화입니다 cg도 좋은 영화로 재밌는 영화입니다  
20170107,10,엔딩이 최고 슬프고 강렬함 둘다 있음 ㅋㅋㅋㅋ보시면 앎  
20170107,10,wow 세음절로 표현가능!  
20170107,10,스타워즈의 팬으로써 받을 수 있는 최고의 선물이었다.  
20170107,8,모든 시리즈를 통틀어 어둠 속에서 붉은 빛이 일어나는 그 3초의 장면이 가장 강렬하다.  
20170107,10,관람객완전꿀잼 정말꿀잼 꼭봐여  
20170107,10,관람객좋음~완전좋음~짱좋음~  
20170107,10,관람객하고자 헀던 말이 나에게 잘 전달되었다  
20170107,8,모든면에서 무난했던.. 광수같이 생긴 삐꾸가 나오는 7보다야 훨...  
20170107,10,관람객스타워즈에 관심없던 사람인데!!왜 왜 그리 열광하는지 그 역사에 호기심 증폭  
20170107,10,관람객주인공이 죽어서 충격적이였어요 ㅠ  
20170107,7,관람객마지막 다스베이더가 살렸다. 지잉~  
20170107,1,스타워즈는 갈수록 망작이 되어가는구나 역시 감독의 중요성  
20170107,10,관람객완전 재미있었어요!!!!  
20170107,7,관람객졸렸습니다. 스타워즈 영화 기대했는데 좀 지루했네요  
20170107,1,돈안내고 공짜로 봤는데 시간이 너무 아까운 영화! 만약 돈 내고 봤으면 화났을영화 사실 안내고 봤어도 화난다..  
20170107,10,영화가끝나기 5분전까지도 긴장감을 늦출수 없었는데 그때까지만 해도 그냥 다스베이더가 잠깐 카메오 출현하는 진지하고 재밌는 스타워즈 외전격영화라고  생각했다.그러나 마지막5분이 남았을때 그림자속에서 숨소리가 들려오고 붉은 불빛이 켜지자  전율을 느꼈  
20170107,8,관람객잘 봤어요.데스스타가 만들어진 이유를 알 수있는 시리즈 이네요.주인공들이. 조금 아쉽네요  
20170107,10,다스베이더 의 위력을 잠시마나 볼 수 있어서 좋았다.  
20170107,9,후욱...후욱...후욱...지이이이잉  
20170107,8,관람객마지막 다스베이더가 짧지만 강하게 나오네요. 에피소드4와 자연스럽게 연결시키려는 노력이 곳곳에 보입니다. 오리지널 스토리를 몰라도 보는데 큰 지장은 없으나 알고 보면 더 재밌어요~~  
20170107,5,영화가 너무 지루하다. 심지어 중간에 나가는 사람까지 종종 보였다  
20170107,6,관람객조금 지루하네요 ㅠㅠ 하지만 연기는 나쁘지 않았음  
20170107,9,관람객볼만했습니다 다시나왔으면 좋겠습니다  
20170107,10,"님들, 궁금한데 마지막 5분 그 전의 내용이 뭐였죠?  "
