0,1,2
20170217,7,열등감이 비롯되어 큰 파국을 만들어 낸 영화...자신의 열등감을 남에게 감정적인 승패로 승화하며 살아가는 이들은 반성을 해야 함정말 찌질하고 현실에 굴복하는 자신을 돌아보길 바란다.  
20170217,1,기분만 더러워지는 영화 극혐!  
20170217,7,"재미는 없지만 , 열등감에 대해서 생각을 해보게끔 하내여. 극 중 주인공 김하늘은 열등감과 분노가 이해 안될만큼 이상하리만치 심한데..일부러 과하게 표현해서 나라면 저 정도는 아닐텐데? 라면서 의아함을 품으면서 더 생각을 가질 수 있는거같아요.  "
20170217,5,돈주고 안 봐서 그런지 마지막에 존나 충격.  
20170217,5,"뭐지....엽기적....20대 과외선생에서,30대 비정규직 교사까지,김하늘 선생님 배역의 진화를 보는 느낌.  "
20170216,6,관람객스토리는 흥미롭습니다.  
20170216,2,"이딴 영화만들지마라,  보는내내 불편하고  댓글에 반전있어서 놀랫다더만 반전은 무슨 장난하나~ 내 시간만 허비했네~ 짜증  "
20170216,10,영화가 너무 현실적이고 담담하게 슬픔을 표현하는것 같아요연기자분들 연기 감사하고 특히 김하늘씨 고맙습니다  
20170216,10,나라도 그랬겠다~ 싶을 정도로 설득시키는 갓하늘 ㄷㄷㄷ  
20170216,1,역겹다. 교사들 이미지를 대체 어디까지 추락시킬려고  
20170215,4,관람객김하늘  연기는 좋은데 우울하다  
20170215,5,안나옵니다.ㅜㅜ 혹시나해서 천천히 감았는데도 안나옵니다  
20170215,6,"물입감은 충분한데.. 고등학생 심리묘사가 너무.. 뭐랄가 고등학생이 아니라 경험많은 아저씨처럼 묘사해놨음.. 교사와 학생의 에매하지만 흥미진진한 관계를 사랑과전쟁처럼 만들어놓음..사회부조리를 표현하고자 하는데 주인공,학생,등의 심리묘사는 판타지임  "
20170215,9,김하늘이 차를 끓이며 끝났으면 명작인데 후반에 브라브라 아쉽네....그래도 충분히 의외의 수작...  
20170215,10,관람객너무너무너무재밋어요  
20170215,1,끝까지가는것도아니고 예술성도없고 캐스팅 허접쓰레기고  이도저도아닌 무슨말이하고싶은건지   첨돈아깝고시간아까운영화였슴. 김하늘아니었슴 망했을듯.학교가무슨 놀이터도아니고 만만한게 임시직여교사인지...  
20170214,10,김하늘 등 연기도 장면들도 감정과 스토리 이어나가는것도 좋았는데 마케팅을 너무 못한듯 보고싶다가도 너무 홍보하고 노출로 마케팅하니 오히려 보기싫어졌던  
20170214,10,이 시대의 많은 비정규직을 묘사함을 뻔히 알면서도. 같은 직종에 계신분들이 매끄럽게 보기는 어려울것 같습니다. 또한 이번 정유라의 이대사건과 돈과 권력이 있으면 + 떨어지는 교권 속에 학생들이 쉽게 보아서  접근할수 있을 길을 보여주는것 같아 불쾌함.  
20170214,1,내 32살 인생 최악의 영화. 억지스런 내용과 억지스런 전개와 결말까지 모든게 억지. 베드신도 정말 개떡 같았고 사상 정말 최악의 영화였다. 다른 평들보면서 아...진정 평점 알바가 존재하는구나 하는 생각이 들게 하는 영화. 최악 최악 최악  
20170214,6,난 선생이구 넌 학생이야 도대체 몇 년전ㅜㅜ  
20170214,4,감독 믿고 봤는데 이게 무슨;; 캐릭터들이 너무 작위적이고 피상적이라 공감이 안 감. 제일 황당한 건 아무리 봐도 이희준. 쌍팔년도도 아니고 참...  
20170214,3,"정말 3류급 쓰레기영화 마지막장면 어이없네,  "
20170214,6,갑자기 몰아치는 폭풍속으로  끌려드는 마력.  
20170214,4,극단적인 상황들로만 보이네요...  
20170213,9,학생과 선생의 관계~~ 뉴스에서 가끔 접하지만 그래도 본인이 다니는 학교에 선생님인데~~ 그렇게 야한장면이 없는데도 충격적이었습니다  
20170213,6,공유될 수 없는 감정을 강요하는.  
20170213,4,차라리 여주를 신인으로 하지... 드라마도 아닌데 내용에 맞게 연기좀 화끈하게 하시지 안타깝네요 몰입도 저하될수 밖에ㅠ 남주가 젤 연기 잘한듯! 유인영씨도 어색하지 않았구요~  
20170213,10,자극적인 요소들에 가려져버린. 불평등한 사회구조속의 약자중의 약자의 감정변화를 탁월하게 그려냈다..  
20170212,8,생각을 많이하게 되네요~ 연기력때문인지 빠져봤네요  
20170212,10,가벼운 마음으로 봤다가 쇼크받았음 근래본 영화중 가장 임팩트있음 대본 너무좋고 연기 쩔어줍니다 기절  
20170212,9,하나같이 암걸리는 등장인물들... 영화보다가 진짜 암이 걸릴정도의 쫄깃함. 배우들 연기력이 돋보이고 장면 하나하나가 머릿속에 한참 기억이 남는다..  
20170212,9,비정규직 없는 세상을 꿈꾸며....김하늘의 감정표현이 정말 인상적이었어요.  
20170212,5,발단이 약하고 절정부분에선 쳐진다  
20170212,10,몰입감 쩌네..근데 왜케 평점이 안좋지 나만 재밌게봤나  
20170212,10,자극적이고 긴장감있고 재밌네요  
20170211,5,"정규직과 비정규직의 부당한 현실을 보여주긴 했지만 그게 박효주를 정당화 시켜줄순 없는거 아닌가. 이건 비정규직에 대한 영화가 아니라 그냥 넌씨눈금수저, 열등감질투에 극단적선택을 하는 여자, 사람맘을 갖고노는 고딩. 비정상적인 사람 셋이 나오는 영화.  "
20170211,1,개막장 영화 ㅋㅋ 야한것도 없고  내용은 불편  
20170211,1,오랜만에 처음부터 끝까지 욕나오는 영화봤네요..대체 뭘 말하는건지..멜로? 공포? 찝찝하고 짜증나고 아..기분드럽네..재하? 걔는 이영화를 선택하는게아니였다..포르노랑 먼 차이니?  
20170211,1,미친년 영화 싫어요.  두 여배우의 연기가 아깝게 느껴졌다  
20170211,7,관객으로부터 감정적 스트레스로 몰입에 들게하는 것은 싫기도 하지만 좋기도 하다 김하늘 왜저래 이 생각들 계속 하다가 저런 연기도 잘하는구나 싶게만듬  
20170211,8,뭔가 약간 억지스럽고 아쉽다. 난 선생이고 넌 학생이야  
20170210,10,"최고, 가볍게 봤는데 기대이상으로 재밌었다 굉장히 예상외로 굉장히 스릴있다  "
20170210,3,참 아쉬움 많이 남는 영화다. 김하늘 주연 영화면 짜임새 있는 영화라고 볼건데~~ 여주인공 2명 등장한 미씽과 너무 비교가된다.  
20170210,10,주제는 모르겠다 하지만 심리묘사와 몰입감은 10점 이상  
20170210,8,하아  지금 멍때리고 있습니다...  많은 생각을 하게 되네요  
20170210,10,심장이 서늘해졌어요김하늘씨 연기 너무 좋았음담담한 표정에 모든 감정이 다 느껴졌음  
20170209,5,주연 남자배우의 연기가 너무 어색하여 몰입이 안된다  
20170209,10,"사실 유인영씨 팬이라서 보게된 영화인데 자극적인 소재는 그냥 이야기를 끌고가는 도구(?)였을뿐이라는 생각이 드네요이 작품 감독의 다른 영화를 찾아보고 싶어졌고, 김하늘 배우...연기같지 않고 정말 실감났습니다.김하늘배우님..다시 보게 됐습니다.헐♡  "
20170209,1,공감무 현실성제로 그냥 주인공이 싸이코  
20170209,1,도대체 뭘 말하려는 건지 모르겠다...  
20170209,5,김하늘 때문에 보았는데 유인영에 눈이 가더라. 메세지는 알겠는데 고등어와의 교미란 소재가 불쾌하다. 영화 마지막 씬도 영화 수천편을 본 매니아라면 놀랍지않은 장면일 뿐. 가장 궁금한 점은 '어머니가 누구니?' 라는 것. 우리는 고등어의 아빠를 보았다.  
20170209,6,연기는 괜찮았는데 공감이 힘들다.  
20170209,9,영화는 좀 그랬지만 김하늘이란 여배우를 다시 보게 만든 영화~앞으로도 꾸준히 연기생활을 통해 대배우가 되길 바래본다  
20170209,1,참나 머냐 이게????  
20170209,1,이런게 평점 높으니 나같은 사람도 보지 뭐지 이영화는?  
20170208,7,"깨끗하지 못한 놈(사회)을 두고, 깨끗하지 못한 여자와 깨끗하지 못한 여자와의 한 판 승부  "
20170208,1,유인영이 벗다니 ㅠㅠ 안보이네 ㅠㅠ김하늘은 배드신인데 얼굴만 보임  
20170208,10,열등감이란 것. 그건 생각보다 복잡한 감정일지도 모른다.  
20170208,6,"솔직히 효주, 혜영, 재하 셋 다 제정신이 아닌 것 같다.  "
20170208,10,은근 충격적인 게 많음.. 특히 마지막..  
20170208,8,연기력 바탕 이되어  볼만합니다 ..개인적으론 자극적으로 생각안하고 메세지 위주로 생각하면 충분히 볼만합니다~^^  
20170208,1,이 영화는 정녕 2016년에 제작된 영화가 맞단 말인가. 여교사를 바라보는 시각은 2000년 초기에 흥했던 몽정기나 꽤 망한 영화인 은장도 같은 종류에서 볼 법한 클리셰 그 자체이다. 특히 데이트 할 때는 보지 말길 바란다.  
20170208,1,걍 개노답.캐릭터들의 성격과 에피소드들을 고민도 안하고 설정한 것 같다.중요한건 효주나 혜영이 '여교사' 일 필요가 없다는거다.듣기로 김하늘 배우가 캐릭터 설정이 도저히 말이 안된다고 생각해서 감독이랑 싸웠다던데 감독이 영알못  
20170208,1,없네요  재미가  없어요  재미  
20170208,10,아가씨의 임팩트와 연출력이 워낙에 강렬해서일까.. 기대치보단 별로... 그러나 유인영은 이뻣댜.  
20170208,10,영화를 보고 너무도 불편하고 여운이 이틀째 지나도 사라지지않았다.. 그만큼 나에게 정말 인상깊었던 영화다그래서 찾아봤는데 감독 전작이 '거인'인걸보고 충격먹었다거인을 봤을때도 지금과 같았기때문에.. 앞으로도 정말 기대되는 감독이다  
20170208,10,그냥  속이 후련하다   추씨같은  인간은  죽어야한다 그리고 고등학교  애새기가  너무 악마같다  진 짜 역겨운건  남자놈  정말  두놈년  죽이고  싳었는데  하나라도  고통스레  죽어  속이션타  진짜  악마들이다  
20170208,8,"어차피 혜영이를 잔인하게 죽일거였음 뒤로 갈수록 거칠게 감정을 다뤘어도 좋았을 텐데...오히려 화해와 굴복속에 나오는 살해가 황당하기도 했다.  뭐, 그럼에도 김하늘은 작정하고 인생연기를 펼쳐보여 좋았음!  "
20170208,6,정규직과 비규정규직의 사회문제를 다룬 영화이다. 마지막 장면이 충격적이고 영화속에서 파격적인 장면이 많이 나온다.영화속에서 괴물로 변해가는 김하늘의 연기가 기억에 남는다. 그런데 나의 정서에는 안좋은거 같아서 영화가 실망이다.  
20170207,8,그냥 적당히 아부떨어서 정교사 자리 차지했어야 했다..  
20170207,9,"계약직이 정규직을, 정규직이 계약직을 바라보고 대하는 상하관계 손익을 보여주려하는 지극히 현실적인 문제를 다룬 전개라고 생각했지만, 제자와의 사랑을 매개로 혈흔이 낭자할 수 있다는 전개까지는 '여'교사라는 편견 섞인듯한 영화 제목을 불편하게 만들었다.  "
20170207,8,정말 웰메이드 드라마라 생각했는데 출생의 비밀이 나오는 느낌... 왜 꼭 결말이 그래야 하는지... 가진 것이 없는 사람들은  모든것을 가진 사람들에게 그런 식으로 밖에 복수를 할 수가 없는건지... 개인적으로 아쉬운 부분... 그 외에는 굳  
20170207,9,관람객김하늘 좋다~ 평소 이미지를 180도 바꿔준 영화.  
20170207,6,개연성이 좀 부족했지만 술술 봐지는 영화였고 정말 결말은 소름돋게 충격적이다. 유인영이 얄미웠지만 가엽고 김하늘의 사이코 연기도 그의 연기생활중 제일 나아보인다.  
20170207,2,처음부터 끝까지 불편했다. 감정이입이 불가능할 정도로 모든 캐릭터가 발암. 관객이야 어떻든 혼자만 처음부터 치달은 감정선. 재하를 잡는 앵글에서 은교를 연상케 함. 초반부터 실망한 것 치고 의외로 후반전의 몰입감. 하나의 정신병동을 보는 듯.  
20170207,7,"내용은 볼만한데,현실적으로 어린것을 좋아하는 노땅들에 집착이 문제라는...영계가 좋긴한데 솔직히 엔조이면 모를까 사랑 어쩌구는 현실세계에서도 오버다...주인공이 너무 늙어서 세월에 무상함이랄까...역시 탱탱한 젊음이 ..  "
20170207,4,관람객생각보다 실망...연기력은 좋으나 스토리가 영  
20170207,8,김하늘 표정 하나 하나에 효주의 인생이 읽혀져서 보는 내내 집중 할 수 있었어요 하지만 마지막에 경찰차가 왔을때 차라리 남학생이 범인으로 잡혀 가는걸로 누명을 씌웠다면 어떨까 생각해봤어요 그럼 막장인가요 ㅋ 저는 을이라 그런가 ㅋ  
20170207,1,11만명 ㅋㅋ  독립영화도 이보단 낫겠어.  벌써 인터넷에 파일 돌아다니던데 ㅋ  정말 김하늘아 이런 영화는 좀 찍지 말자. 시간 아깝고 개런티 받기도 미안하고..에이그.  
20170207,1,사회비판 질투 다큐 찍었으면서 포스터는 왜 유혹하려는 미끼를 던질까? 제목부터가 낚시성. 작품성도 상업성도 못 건지는 헛방 낚시질.  
20170207,8,'은교'의 역함수 버젼. 대체 여심을 흔드는 것은 무엇이길래.  
20170207,1,전개가 무슨..-_-;  
20170207,8,"이 영화를 단지 질투나 반전만 건졌다면 이 영화를 이해 못한것이다.금수저,낙하산,열등감,시기 등 많은 사회 혹은 근로 문제들을 보여주고 있다.김하늘의 연기에서 볼수 있듯이 그녀의 스트레스 받는 연기가 매우 인상적이다.  "
20170206,1,난 선생이고 넌 학생이야!  
20170206,8,유인영역보다 김하늘역의 성격이 더 이상하고 모났음...없는사람의 자격지심이 사이코처럼 표출된듯한....  
20170206,7,관람객뭔가 뻔란스토리.. ㅎ  
20170206,8,무서웠어요 ㅠㅠ..아무서워 ㅠㅠ삶이라는게 지쳐가기만하면 끝도없이지치는것같음.. 자신을괴롭히는건 자기자신뿐인것같음..  
20170206,2,처음에도 지루하고 끝에가도 반전이없어서 지루하고 그냥 제가 본영화중 최악이었음 김하늘역 효주는 그냥 잠재적 싸이코인듯..  
20170206,1,여교사 효주는 그냥 싸이코라는 생각만 들고 유인영의 약점을 잡았을때 그걸 빌미로 정규직에 오를수 있게 딜을 하는것이 더 현실적이겠네요. 뜬금없이 제자에게 집착하고 사랑에 빠진 여주인공이 전혀 공감이 되질않아요. 그리고 마지막 장면 소름이에요. 싸이코  
20170206,5,똥 묻은 개가 재 묻은 개 나무란다고 둘 다 똑같은 미성년자와 성관계한 범죄자들이 서로 싸우는 것이다. 아마 여교사가 아니라 남교사였으면 아청법에 처벌받았을 것. 답답해서 폭발할 지경...하지만 영화는 영화일 뿐이지...  
20170206,7,이전까진 김하늘이라는 배우에 대한 고정관념을 깨버리기에 충분한 연기를 보여줌.  중간중간 허점은 보였지만 파격적인 스토리도 신선했고 감독이 템포를 죽이지 않으며 끝까지 영화를 끌었던 힘도 대단했음.  
20170205,6,결국은 치정이다 반전은 없다  
20170205,7,소재가 소재인지라 국내 정서와 문화에 맞질 않아 비난 받아서 그렇지 그렇게 형편없는 영화는 아니다.. 김하늘의 뛰어난 표정 연기와 끝까지 집중하며 보게 만드는 전체적인 연출력은 높이 살만하다.  
20170205,1,"평안한 일요일 저녁 재밌는 영화 한편이 일주일의마무리이자, 새로운 한 주의 시작인데..일요일 저녁 시간을 망쳤다.무얼 말하려는지 감정이입 전혀 되지 않는 영화반전이 있다기에 인내를 갖고 기다렸으나반전이 없다는게 가장 큰 반전.. 최악이다  "
20170205,7,김하늘 못되먹었다...  
20170205,5,지루하다. 지루하다. 무척이나 지루하다...  
20170205,10,별 의미없이 봤다가 몰입해서 끝까지 본 오랜만에 접해보는 수작입니다.  
20170205,3,이건 초반 30분은 이해한다. 그뒤부터 어린제자와 너무 억지스런 로맨스를 이어나간다. 하루하루 살기도 힘든 비정규직교사가 고3제자를 왜 이렇게 깊히 사랑하는지 도대체 알수가없다.. 포커스를 좀 더 비정규직 여교사의 고단한삶에 맞췄다면 더 좋았을것을..  
20170205,8,중간에 갑자기 스토리 점프한 부분이 있긴하지만 예상외의 전개도 나쁘지않다. 마지막은 스릴러 장르.  
20170205,9,스토리 전개는 장르 특성상 뻔할수 밖에 없는데... 김하늘부터 주변 배우들의 연기까지... 소름돋네요. 간만에 재밌게 봤어요.  
20170205,1,쓰레기 영화입니다절대 보지마세요  
20170205,1,보면 볼수록 불쾌한 영화. 잘봤다는 사람들은 무슨 생각을 갖고 사는지 모르겠다. 그냥 미성년자를 하나 둔 치정극. 치정극에 무슨 비정규직이 문제인가. 미성년자의 성별이 바뀌어도 사람들은 잘봤다고 할텐가.  
20170205,7,상실된 자존감이라는 감정선에 관객을 끝까지 태우고 간다  
20170205,10,"사실 영화 기대 않았었는데, 착하고 로멘틱한 캐릭터로만 봤었던 하늘씨의 달라진 변신이 신선했습니다.  "
20170205,9,"""진정한 스승""이라는 식상한 주제를 신선하고 파격적으로 보여줬다고 생각한다. 다만 중간중간 예상되는 뻔한 전개가 아쉽다.  "
20170205,7,영화 나쁘지 않은데 흥행은 너무 실패했네요. 너무 많이 잘라내서 이야기가 잘 이어지지 않은 탓인지도 모르겠네요  
20170205,9,기대이상....심리묘사 굿. 반전도 최고  
20170205,9,영화보고 이해안된게.. 혜영이랑 재하가 왜? 갑자기? 사랑에 빠졌는지 의문이였는데..편집된 비하인드 스토리에 나오네요!러닝타임 90분 이던데..왜케 편집을 많이 했는지....120분 꽉 채워도 됐을것같은데...그리고 대학교때 혜영이랑 효주도 궁금한데.  
20170205,8,"불가피한 상황속에서 질투,욕망,자격지심으로 인해 한 인간이 얼마나 극단적으로 치닫는지 잘본거같다.  "
20170205,5,간만에 본 최고의 영화 두번다시 나오지 않을 강렬함... 너도 먹고 나도먹고 너희도 먹어라  
20170205,1,초반 뭐든지 다 불만인듯한 김하늘의 케릭터 설정과 상황전개를 위해서 개연성도 없이 선배라는 이유로 무조껀 김하늘을 좋아하는 유인영의 뇌맑은 케릭터 설정 이원근의 비현실 판타지 케릭터 설정등 뭐든 케릭터 상황이 작위적이다 이희준의 케릭터만 살아있더라  
20170205,8,여배우들의 몰입감 넘치는 연기는 박수쳐줄만하다. 또한 한 여성이 사회의 멸시와 계급투쟁에서 밀렸을때 어떤 극단적인 선택으로 치닫는지 잘 표현해냈다. 아쉬운건 너무 과도하게 여러가지 면에서 결여되있는 주인공의 모습이 설정상 과했다고 본다  
20170205,2,얄팍하다못해 한심스러운 캐릭터들이네요. 너무 작위적인데 그렇다고 영화적으로 의미가 있는것도 아닙니다. 대사도 이상하고 전개도 이상하고 장면전환도 안일하고 장소섭외도 별로고 잘 찍을 맘도 없이 안일한 앵글들에.. 모든게 구린데 감독 혼자 도취되어있음  
20170205,8,여러분 정규직이 이렇게 힘듭니다.  
20170205,1,"비정규직 사회문제는 치정극이 된 순간 사라지고, 질투와 열등감으로 점철된 캐릭터는 개연성 없는 전개 때문에 이해하기 힘들었다. 김하늘은 깊은 내면 연기를 잘 못하는것 같다. 감독 쌍욕하면서 나온 건 이 영화가 처음  "
20170205,7,보는 내내 마음이 불편했습니다. 괜스레 제 자신을 돌아 보기도하고 생각 많아져 좋네요. '뭐지 이 미친영화....'라는 생각이 남습니다. 너무 터무니 없는 설정이지만 그걸 통해서 많은 것을 보여준 것 같아 좋네요^^  
20170205,9,기대안하고봤는데아주재밌게봄!  
20170204,1,B급 영화로써 평가한다면 괜찮은 수준  
20170204,6,질투 외에는 감정 공감이 잘 안되네요.  
20170204,10,.ㅇㅅ처ㅕㅞㅅㄱ힝할말없어  
20170204,1,보는내내 불편했던 쓰레기 같은 영화..  
20170204,10,자극적인 키워드에 가려진게 안타까운 영화  
20170204,7,후반부에서 지루한 감은 있지만..  
20170204,6,비정규직 사회문제 어설프게 다뤄지다 어이없게 정신병자로 변해 끝나허무  
20170204,9,그니깐 왜 까아아아불어  
20170204,8,마지막 샌드위치를 차분하게 먹을 수 밖에 없는 현실에 개탄을!!!  
20170204,10,여자의 질투는 무섭다....  
20170204,10,김하늘 개이쁘다 완전이쁘다  
20170204,1,남자 학생이랑 사랑에 빠지는 과정이 말도 안되는 소설임. 이딴걸 돈주고 보다니 리얼 노답;  
20170204,1,그냥 쓰레기다...영화도아니다~~  
20170204,10,평점 왜 이따위야? 정말 재밌게 본 영화고 입소문이 안나서 아쉽기도 한 영화임. 그리고 연기 정말 잘하네요.. 와우  
20170204,1,알바들 진짜 넘하네 여기댓글발바들이나 최순실 국정농단이나 사기가 판치는 개한민국!!!!  이걸 볼바에  친구엄마 5번봐라 그게더 재밌다  
20170204,4,후반부에 너무 지루합니다. 보통은 점점 올라가야 정상인데...ㅡ.ㅡ  
20170204,5,여자의 질투는 무섭다.는 교훈을 주었어요. 끝까지 남학생은 여교사를 사랑하지 않는다고 말하지만 마지막장면 말과 행동이 다른건 열린결말인가? 모순인가?ㅠ 개인적으로김하늘 연기가 아쉬운 작품.  
20170204,1,뭐했다고 실검1위???  
20170204,1,이게왜실검1위인지 아는게이잇노?  
20170204,10,난재밌게잘봤는데 평점이왜그러지  
20170204,1,ㅋㅋ알바들 쩌네 날 믿으셔들 이걸 보려던 당신들에겐 내가 구세주니까  
20170204,1,한국 영화수준이 쓰레기라는걸 알수 있는 영화.  
20170204,3,외국영화 몇개 짜집기한듯  
20170204,7,중고등학교 때 판타지를 자극하는 건가...  
20170204,9,오랜만에 감정선을 세밀하게표현해낸작품을 보게된것같아좋았다 사회의부조리를 겪고있는 현시대의 사회인에게더깊이와닿을영화..  배우들의연기와 감독의 연출이 잘어우러진듯하다 무겁지않지만 가볍지도않은 영화를보고난느낌  
20170204,6,"심리적인걸 잘표현, 묵직한느낌가볍게 생각하고 봤는데 마지막에 잔인해서 놀랬어요그리고 교사와학생은 아닌듯...교직분들은 불쾌할꺼 같네요  "
20170204,10,와..감정선 오졌다. 배우들 연기도 훌륭했고. 결국은 인간은 자기의 한계를 극복 못하고 늪에 빠진다. 살다보면 저런 말도 안되는 늪에 빠지게 되는 경우가 있다. 이때 정신 바짝 차려야 한다. 그렇지 못하면 저런 결말을 맞이하게 된다.  
20170204,6,극 중 나오는 주연급 배역이 모두 사이코패스 같네요두 여선생은 남학생이나 탐하고 남학생은 색이나 탐하고  제정신 아닌것들남학생 연기를 잘하는 배우로 했으면... 발레는 대역쓰고...  
20170203,10,효주씨... 추선생님보다 재하부터죽여주시지ㅠㅠ재하년아ㅡㅡ아오  
20170203,7,재밌긴한데 먼가 답답함 ㅋㅋ  
20170203,7,그냥그냥 볼만했음. 마지막 결말이 볼만했음.  
20170203,9,김하늘 인생작.. 밀도높은 연기력.. 시종일관 절망적인 무표정..잊기힘들다.. 수작이다.이건..  
20170203,5,왜저렇게변한건지 납득이안가고 이상한 결말  
20170203,8,몰입감이 좋은 영화네요 특히 김하늘의 눈빛에서 많은 걸 느꼈습니다..  
20170203,7,그냥....계속 무거워서..  
20170203,4,관람객김하늘 이희준 연기만 보임  
20170203,8,황진미가 높은 평점을 준 영화  
20170203,9,재밋엇어요 김하늘 역시연기몰입이 장난아니네요유인영 어찌저리 얄미운연기를 잘하는지...ㅎㅎ마지막에 주전자 섬뜻해요 ㅠㅠ  
20170203,1,괜찮은 소재를 잘 살려내지 못한 영상물 .  
20170203,1,"등장인물 성격의 개연성도 부족하고, 어이없는 결말. . .  "
20170203,7,이해가 안되는건 아니지만 너무 힘들게 이해를 시키려 한 영화..  
20170203,1,절반정도 보다가 볼 의미가 없어졌다  
20170203,4,딱 이정도다. 그냥 김하늘이 정신병자  
20170203,7,내용은 그럭저럭....여주인공 둘이 얼굴 몸매 보는 눈요기로만 봤음  
20170203,6,재미없고 억지스러운 전개. 참기 힘들었다  
20170203,1,"최악 최악중에 최악, 정상적이라면 비정규직이었다는 이유로 감쌀수가 없는거다.  "
20170203,9,마지막 엔딩음악..소름끼쳤다  
20170203,10,현실적인 사회문제에 대해 공감가는 부분이 많았고 두 여교사의 심리전... 배우들 연기보면서 굉장히 소름돋았습니다... 시간가는 줄도 모르고 숨죽이면서 봤네요!!  
