0,1,2
20170108,7,제목 가지고 태클인데.. 내용보고 속뜻을 좀 헤아리길. 초반부터 계약직은 정교사 되기 전 까지 결혼은 철없는 짓이라고 꿈도 꾸지말라고 교감?교장이 그럽니다 ㅋㅋ 전 갠적으로 결론이 아쉬움.. 모두가 불행해지는.. 한 쪽이라도 웃는 엔딩으로 끝맺었으면  
20170108,9,관람객갑을관계 여성경력직문제 김하늘연기 참 잘한다유인영의 백치미연기도 좋았어요이희준 욕은 참으로 맛깔나더군요 오랜연인이 서로 어떻게 지쳐가는지 ..나름 깊게생각했던 영화  
20170108,6,관람객말로 설명이안됨넉 놓고 보게됨  
20170108,4,좋은 소재에 아쉬운 스토리 전개. 시도는 좋았지만 거기 까지.  
20170108,1,아... 개오바야...  
20170108,6,기주봉의 아들이 이원근이라는 설정이 가장 파격적.  
20170108,8,"한 여자가 잃어버린 시간, 그 아름다움을 새로운 사람에게서 찾는 그런 영화.김하늘은 약간 에바 그린을 연기하고 싶었던것 같았지만 실패.뭘 표현하려는지는 알겠지만 배우, 감독 전부 아쉬웠다.그래도 재밌는 영화.""이렇게 빨리 OO이 될줄 몰랐지""  "
20170108,1,댓글 알바들 왜케 많은건지.. 돈 주고 보라해도 보기 싫은 영화  
20170108,1,진짜 별 1점도 아까운 쓰레기영화. 공짜로 보여줘도 안본다. 내용 OOO기 연기하는것도 OOO기. 걍 쓰레기 영화  
20170107,1,관람객기대하고 봤는데 완전기대이하.  
20170107,7,관람객김하늘의 변신과 연기가 돋보인다  
20170107,4,관람객음악과 분위기는 좋았다  
20170107,8, 좀 충격적임 ㅋㅋㅋㅋ 약간 막장  
20170107,10,관람객김하늘 초연한 연기잘한다  
20170107,8,관람객몰입도가 있었는데 너무막장이긴 하네요김하늘 배우 열연 돋보여써요  
20170107,10,불합리한 사회구조가 개인을 어떻게 망가뜨릴 수 있는지 보여주는 영화. 이 모든게 현실인게 더 슬픔. 주인공들의 심리에 주목하면 재미가 쏠쏠함  
20170107,7,관람객마스터 보다 괜찮음  투자비용 대비  
20170107,1,"시나리오도 구멍 투성이, 등장인물들 감정선 따라가기 힘듬, 기타 등등 정말 못 봐주겠더군요.. 좋아하는 여배우 둘이 이끌어가는 영화라 기대하고 봤는데, 굳이 이러한 소재의 '여'교사들의 신파를 만들 필요가? 제목부터 눈살 찌푸려 집니다.  "
20170107,9,관람객뭐가 어찌됐든 김하늘은 연기 잘함  
20170107,9,영화적으로 훌륭하다고 보긴 어렵지만 드라마적으로는 재밌게 볼 수 있었다. 캐릭터들이 다 이상한 혹은 부족한 점을 가지고있어 뭐야라고 할 수 있지만 한가지면만 가지고 있는 사람은 없으니 오히려 현실감있을지도. 약간 일드같음  
20170107,6,관람객김하늘의 눈빛만 기억에남는다  
20170107,10,관람객김하늘 배우님의 기대되는 선생님 연기를 볼 수 있어서 좋았어요^^ 이원근의 성숙된 연기를 볼수 있었으면 좋겠어요ㅎㅎ  
20170107,10,"관람객스릴러, 드라마, 치정극, 서스펜스, 공포... 어떤 장르로도 규정할 수 없는 치명적인 영화  "
20170107,10,관람객생각지도 못한 결말... 제발제발 하면서 숨죽이고 봄.. 하.. 아직도 생각나..  
20170107,8,김하늘이랑 유인영 연기도 좋고 다 좋은데 김하늘 캐릭터가 처음부터 너무 감정적이어서 뭐지 하는 장면도 좀 있다. 뭐 몰려있는 상황을 보면 아예 아닌것도 아닌데 처음엔 과도하다는 느낌이 아쉬웠다.  
20170107,9,관람객여교사 재미있게 봤습니다.사람 심리에 대해서 관찰하고 심도있게 묘사해서 좋았스비니다.  
20170107,9,기대안하고 봤는데 신선한 내용의 영화라 좋았네요배우들의 감정선이 처음부터 끝까지 이어져서 긴장감 놓지 않고 봤네요 여운이 길게 남는 좋은 영화라고 생각드네요  
20170107,8,관람객나름 재밌었어요 막상 끝나니 허무한데 다시 생각해보면 재밌는 그런 영화같아요  
20170107,10,결말이 뭔가 아쉽다. 다보고 기분이 찝찝하다.하지만 김하늘 연기 때문에 잘 보았고 이영화 무삭제판(감독판)으로 재개봉 했으면 좋겠다.  
20170107,8,사회문제를 다룬 영화이고 배우들 연기 좋네요  
20170107,7,내용이 지루하거나 그러진 않고 볼만 합니다. 마지막에 좀 충격이고 반전도 있습니다.  
20170107,8,관람객신재하를 연기한 이원근을 위한 영화. 첫 영화라는게 믿기지 않는 열연.  
20170107,5,청불이라고해서 요즘 애새끼들이 못보는것도아니고소재가 너무 좀 그렇다이미 바닥인 교권에 여선생을 먹을거리로 보는 요즘 새끼들한테는 너무 안좋은 영화다. 이 영화로 인해 여교사 폭행사건이나 교생들을 깔보며 강간까지 시도하려는 새끼들이 급증할듯  
20170107,8,관람객반전 하나만큼은 인정할수밖에  
20170107,9,관람객좋아요 배우들 연기도 좋아요  
20170107,10,관람객음 생각보다는 별루..  
20170107,10,"야시시한걸 기대하지 않는다면 몰입도 짱! 강추!김하늘의 샌드위치 먹는 표정은 캬~, 진짜 연기 잘하는 듯~  "
20170107,1,핵노잼입니다..;;  
20170107,1,무슨 주제인지 잘 모르겠어요  
20170107,2,이 영화 칭찬한 인간들 싹 다 잡아다가 가둬놓고 이 영화 열번 보게하기전에 조용히들 해라  
20170107,1,헛웃음이나는영화네요  
20170107,10,한여자가 질투로인해 싸이코패스로 바뀌어가는 이야기.. 반전도 있고 나름 쫄깃한 영화였네요 김하늘씨 연기 새로웠어요  
20170107,9,"한순간도 지루한 장면이 없었어요. 김하늘의 팬이라서 보게 됬는데, 정말 효주역을 잘 표현했다고 생각해요. 쓸쓸함, 공허함, 등. 유인영 이원근 배우도 조화롭게 영화에서 잘 녹아있었다고 생각합니다. 영화 추천 영화관에서 보면 더 집중이 잘 됩니다 ^^  "
20170107,10,관람객넘재밌댜 끝장난댜 아주  
20170107,8,김하늘의 연기변신이 새롭게 다가옵니다.꽤 볼만합니다^^  
20170107,10,저평가 될 영화가 아니다. 단순히 변태영화라고 생각치 말고 봐라  
20170107,1,관람객유인영은 예쁘지만 다른거 보세요....  
20170107,10,영화를 보고 김하늘을 다시 보게 됐다 여우주연상감 연기 마지막 장면의 효주가 너무 슬퍼서 집에 와서도 계속 떠오른다  
20170107,7,관람객김하늘  감정연기에  흠뻑 빠져드네요  
20170107,1,노출이 ㅈㄴ등밖에 안나온다며 정신차리라고 1점준다 한국영화계의 미래를 위해 1점주마 화끈하게 벗어 제끼란 말이야!  
20170107,1,진짜 시간을 되돌리고싶다..이런 영화를 돈주고 봤다는게..휴  
20170107,8,영화 정말 충격적이다. 각본 너무 잘썼다.  
20170107,4,심리묘사로 유명한 감독이라서 기대했는데..설득력 없는 효주 캐릭터에 짜증. 내내 내가 넘 속물적인지 주인공이 넘 멍청한 건지 그 행보에 연민도 동감도 안 듦. 김하늘의 연기와 미모가 아까울 뿐.  
20170107,1,보고 화가 나서 평점을 쓰지 않을 수가 없다. 진짜 돈 아까워 미치는줄.. 스토리 개연성도 너무 떨어지고 유인영 연기가 진짜 흐름 다 끊는다. 이야기의 중심도 임팩트도 없고 이거 10점 주는 사람은 대체 어디에 초점을 두고 영화를 봤는지 모르겠다.  
20170107,7,관람객하.... 선생과 학생의 선을 그렇게 잘지키던 김하늘은 어딜 간건지....  
20170107,5,반반 . 뭐 때문에서인지 청불은 모르겠다만 복수는 통쾌했지만 나름 잔인했던 그냥 학생하나가 여자둘이 잡네잡어  
20170107,10,이영화 을 책으로 보면 일부 누락 된장면이나와요  
20170107,1,뭘 말하려고하는지. 스토리 엉망임  
20170107,9,치정.. 극중김하늘의 진심이 이렇게 슬프게 다가올줄이야...  
20170107,9,이런 영화좋아합니다~  
20170107,7,여배우 2명의 연기력과 스토리는 괜찮은 영화. 다만 흥행요소의 영화가  아니라는게 아쉽네요.  
20170107,9,사이코 3명 .. 볼만한 영화  
20170107,8,관람객여자의 질투는 무섭다.  
20170107,10,"김하늘을 필요로 하는 사람들은 많은데, 소중히 생각하는 사람은 없다. 김하늘이 불쌍하다.  "
20170107,5,관람객ㅡㅡ넘...찝찝 ;; ..슬픈반전..잔인한 결말;;  
20170107,8,생각보다 잘 만든 영화였어요. 왠지 예전의 박찬욱 감독 영화를 보는 듯 한 느낌도 들었고요. 최근의 겉멋만 많이 든 박찬욱 감독 보다 훨씬 나았습니다.  
20170107,8,관람객강하늘의 심리상태로 전개되는 스토리가 좋았습니다. 재미와 도덕잣대 들이미시며 보시면 영화 즐기실수 없습니다. 스토리가 나름 탄탄해요. 아이엠러브 라는 영화가 생각남. 잔잔히 자극도 있음서 좋아요 :-)  
20170107,6,관람객그럭저럭....모르겠어요 ㅋㅋㅋ  
20170107,5,그냥 흔한 한국영화네요  
20170107,10,"좋았어요. 여배우 중심이라 좋았고, 김하늘의 연기변신이 좋았고...심리극이라 볼만해요~!저렴하지 않은 괜찮은 19금입니다. 파격적인 반전이 있...!  "
20170107,6,관람객괜찮은 문제의식과 진부한 풀이. 김하늘의 표정연기가 살린 영화  
20170107,5,안벗음..ㅋ 절대 안벗음..ㅋ  
20170107,10,연기 굳 기대 안하고 봤는데 정말 잘 만들어진 영화  
20170107,1,"(스포) 여적여, 강간미화, 은교는 그렇게 아름답게 포장했으면서 왜 이 영화서의 남녀 관계는 이토록 죄책감 느껴지게 표현했을까? 여심을 공략했으면서 어떤 영화보다 여혐이 심해서 보는 내내 불편했던 영화. 기대했는데 너무나 아쉬웠다.  "
20170107,10,개인적으로는 상상되었던 결말이지만마더에서 혜자여사 춤추던 장면 정도의깊은 인상을 주는 마지막 씬이 압권!연기 정말 소름돋습니다..  
20170107,10,▶인간의 본능과 이성사이에서 흔들리는 감정을 리얼하게 잘 표현했다! ▶소름돋는 두 여주의 양면적인 연기도 볼만하다! ▶적당한 긴장감과 서스펜스가 가미된 치정드라마!  
20170107,8,김하늘의 무게감 있는 연기가 인상적이었다. 영화 전반적으로 미묘한 감정선이 이어지고 있어서 긴장을 놓을 수가 없었다 ㅋㅋ 아쉬운 점은  좀 더 치명적인 매력을 가진 배우가 학생역을 맡았다면 대박이었을 듯..  
20170107,1,관람객진짜이게무슨영화인줄모르겠네...  
20170107,10,재밋엏어용!! 마지막이 여운이남네여  
20170107,8,"누구나 느껴본적 있는 감정이 극한으로 간다면...을 보여주는 영화. 감정선이 섬세하고 극 분위기가 좋았다. 하지만, 스토리 전개가 약간 매끄럽지않은 느낌. 김하늘의 눈빛에 반하고왔다.  "
20170107,8,관람객개인적으로는 아주 좋았습니다 배우분들연기도 좋고 스토리도 알차고.. 다만 호불호가 갈릴 거 같다는 느낌이 큽니다  
20170107,2,... 그냥 막장 영화.  
20170107,2,관람객억지스러운 반전 사랑도 억지스러움  
20170107,7,관람객파격적이라기보다 너무나도 개연성있는. 김하늘 배역에 참 어울린다  
20170107,2,관람객왠만하면 점수 이렇게 안주는데 돈주고 보지마세요 ㅋ  
20170107,10,구지 청불을 할 필요가?  
20170106,2,내용이 너무 별로...보고 기분나빴음  
20170106,10,이 영화 존나 재밋네 ㅋㅋㅋ 딱 내스타일ㅋㅋㅋ 김하늘 불쌍해... 이원근도 잔망스럽게 연기 잘하고  
20170106,5,ㅠ갠적으로 너무별로인...  
20170106,9,"가진 자와 못 가진자의 프레임을 넘어서서, 욕망을 강하게 품은 인간이 얼마나 더 악해질 수 있는가를 보여주는 대립의 현장이다.  "
20170106,9,글쎄 주연은 김하늘 한 명 인듯하다  
20170106,10,기대 안하고 갔었는데 예상외로 반전있고 생각을 많이 하게 되는 영화 재미있었습니다;)  
20170106,10,"배우들의 연기력, 연출력 굳~반전 결말까지!! 넘 잼있게 잘 봤습니다~~  "
20170106,5,관람객김하늘의 눈떨리는 연기가 인상적이였만 너무 막장스러운 스토리...  
20170106,5,관람객 마무리가 좀... ㅠㅠ  
20170106,10,감정선을 따라가는 변화가 보기 드문 시도였습니다.  
20170106,1,아가씨 와 더불어 더러운 개 쓰레기 영화  
20170106,6,관람객그냥 없는 자의 열등감과 직업 문제에만 집중했으면 좋았을 텐데.만난 지 한 달 된 남학생한테 사랑을 느끼고 십 년 사귄 남친 버리는 이야기가 들어가서 주인공 심리에 공감하기 힘들다.  
20170106,6,관람객그냥 없는 자의 열등감과 직업 문제에만 집중했으면 좋았을 텐데.만난 지 한 달 된 남학생한테 사랑을 느끼고 십 년 사귄 남친 버리는 이야기가 들어가서 주인공 심리에 공감하기 힘들다.  
20170106,9,감정이입해서 정말 재밌게 봤습니다. 영화 끝나고 여러 생각이 많이 들었다는...  
20170106,10,너무 극단적이고 놀라운 결말이었다.주인공 중 정상이 아무도 없었다ㅠㅠ  
20170106,1,보면 기분만 더러워짐. 처음엔 주인공한테 감정이입되고 불쌍했는데 나중엔 멍청하고 짜증남  
20170106,10,소름돋는다 믿고보는 김하늘  
20170106,9,관람객나름 재미있게 봤습니다 연기가 훌륭해요  
20170106,4,박ㄹ혜와 그 일당들 보다 더 혼이 비정상인 사람들만 나오는지라 좀 황당스러웠네요. 완성도도 좀 낮았고..자칭 비평가들의 평점이 높은건 역시나~  
20170106,1,이 영회에서 하고 싶었던 말은...??? 비 정규직의 비애??학생과선생 사이에서 있어서는 안 되는 사이??? 무슨 야기가 하고싶은 영화 였을까요.. 피리미엄 자리에 돈 까지 더 주고 보기엔... 헐... 돈만 아깝네요..;;;;  
20170106,10,세상은 결코 녹록치 않다는걸 절실히 보여준다.청불의 이유는 바로 이것이 아닌가싶다.결국 가진 자의 손에 놀아날 수 밖에 없는 우리네 보통 인간의 자화상이 가득 담긴 스크린 속 인물들에 결국 눈물 한 방울 흘렸다.무료하고 권태로운 하루가 지나간다.  
20170106,1,재미없습니다 보면 화나는 영화 극 전개도 뚝뚝끊기고 개연성도 없고 재미도 없습니다 그리고 남주 연기 너무 이상해서 몰입하다 말고 확깸  
20170106,6,관람객청년실업의 현주소를 보는 듯 한숨이 나오는 영화같네요 힘들어도 자기본분만은 잊지않는 스승과 제자 또 사회지도층의 배려심이 아쉬운 쫌 아픈 영화 ~~~  
20170106,8,긴장감과 극의 전개가  밀도있게  이루어져 관람 내내 숨죽였다 배우들의  연기도 집중도가 높아 흥미로운 관람이 되었다  다른 사람  맘 아프게 하지말아야 하겠다  
20170106,10,압구정 GV 유인영 배우 김태용 감독  
20170106,5,관람객그냥저냥... 처음엔 괜찮았는데 막판에 이야기가 좀 그러네요...  
20170106,5,관람객전 별로였습미다...ㅠ  
20170106,2,기대치가 높았나봅니다 ㅠ  
20170106,1,관람객남자만 멋있음 모델같음  
20170106,8,관람객가슴이먹먹해진다ㅠ 김하늘연기짱  
20170106,10,왠지 모르게 다보고 나서 슬퍼졌다. 김하늘의 연기에 아낌없는 찬사를...  
20170106,5,관람객색깔이 없다.청불인데 에로면 에로 스릴이면 스릴이여야 하는데딱히 어디서 잼있는 부분을 찾아야 할지 모르겠는 영화.열등감에 사로잡혀서 결국 사람을 죽이고 왜 무릎을 꿇었을까;;;  
20170106,4,노잼 무슨 내용임?....허무하게끝나렉시가부릅니다-애송이  
20170106,4,관람객기대를 너무했는지~스토리가 기대 이하라 좋은평을 하기힘드네요. 여주가 전혀 공감이 안돼는건 저만 그런걸까요? 너무 공감할수 없었습니다.  
20170106,10,관람객김태용 감독님 따봉입니다!!  
20170106,1,관람객0이없어서 1을준다....  
20170106,9,관람객빌런은 어떻게 만들어지는가. 차별과 선입견 속에 탄생하는 악(惡)의 이야기.  
20170106,1,댓글 알바들이 있나...영화 보다 뛰쳐 나오고 싶은 영화... 처음이였음....ㅡㅡ그냥 보여준다해도 보지 마세요!!!  
20170106,1,최악이다.한숨자고나옴  
20170106,3,관람객소문난 잔치집에 먹을게 없다별루다 이 인간들이 알바를 얼마나 쓰고 있는 건지평점이 이따위다  
20170106,8,탕웨이 남편 영화인 줄 알고 보러갔는데 아니었다. 연예인은 선배 중 동명이인 있으면 헷갈릴까봐 예명으로 바꾸거나하던데 감독계는 안그러나 봄. 영화는 캐스팅 완벽했고 약간 용두사미격이지만 그만하면 연출 섬세하고 훌륭했다. 앞으로 기대되는 감독임. 추천함  
20170106,7,관람객이야기끝이좀아쉽다~  
20170106,8,관람객여자들의 질투는 무서움  
20170106,9,김하늘.. 역시  실망시키지  않네요..! 고민했는데 보길  잘했습니다.  
20170106,10,관람객연출이 너무 세련되어 놀랐음  
20170106,3,"불필요한 장면들과 평면적인 캐릭터, 개연성 부족한 스토리  "
20170106,10,보는 내내 감정이입 제대로 되더라ㅡㅡ  
20170106,10,나름 통쾌함 ㅋㅋ내용도 좋고 지금 같은 시국에 볼만함  
20170106,10,자극적일 줄 알았는데 세밀한 감정연기가 일품이었다  
20170106,10,남주인공이 굉장히 매력적이드라~ 김하늘 ㅜㅜ 완전 좋아  
20170106,10,김태용 감독님의 영화는 항상 진한 울림이 있다  
20170106,10,별 기대 안했는데 슬프기도 했어요 ㅠㅠ  
20170106,10,충격적이기도 하지만 통쾌하다!  
20170106,9,김하늘 연기는 무조건 믿고 본다  
20170106,10,생각보다 괜찮았어요 이런 영화는 스크린으로 볼만 하네요 ㅋ  
20170106,9,질투가 부르는 복수를 이야기하는.. 볼만하네  
20170106,10,감독의 의도를 안다면 절대 욕할 수 없는 영화  
20170106,10,세 배우의 열연에 감동했어요ㅜㅜ 심리묘사 개쩜  
20170106,8,혜영이  왜  자꾸 효주에게  살갑게  다가가려는 과거 장면 좀 집어넣지. 굳이 청불로 만들 필요 없었을듯.  김하늘 연기 매력적이네.  
20170106,10,현실적인 영화라는 생각이 들었어요 실제로 있을 법하기도 한..?  
20170106,10,유인영이 연기를 진짜 잘하는구나 ㅋㅋ  
20170106,10,감정연기 하나는 오지네~ 배우들의 열연에 깜놀  
20170106,10,김하늘의 표정이 슬프게 느껴지고 ㅜㅜ 마지막 장면 아직도 생각남  
20170106,10,생각지도 못했던 반전에 입이 벌어지더라  
20170106,10,김하늘의 연기 변신에 박수를.. 보냅니다  
20170106,1,정말...평점보고 영화보다가 나가고싶었네요중간부터 막장막장 하더니 마지막에는 마!!!!ㄱ장!!!입니다..  
20170106,7,김하늘 VS 유인영     감성 VS 이성    시기와 질투  그리고 복수  
20170106,10,긴장감을 놓칠 수 없었던 파격적인 영화  
20170106,10,관람객영화가 파격적이고 특히 결말이 너무 마음에 들었어요. 올해 첫영화로 관람했는데 너무 색달라서 좋았고 충격적으로 잼잼!  
20170106,10,호불호는 갈릴 것 같지만 나는 무조건 호다  
20170106,1,아무런 개연성없는 전개 .최악임.  
20170106,10,인간의 욕망과 복수에 대한 이야기 극장에서 보세요  
20170106,10,평점 그 이상으로 재밌게 봤다  
20170106,10,예상치 못한 대박 반전에 충격먹음 ㅠㅠ  
20170106,10,김하늘의 영화는 무조건 믿고 보는 스타일  
20170106,10,아직도 여운이 남네 ㅋㅋ 진짜 볼만해요  
20170106,10,세 배우의 합이 놀랍다 단순한 영화가 아니엇음  
20170106,7,선생과 제자라는 금기시되는 관계를 영화가 잘 다루어주어서 흥미로웠다. 극 중 효주같은 여자를 10년동안이나 만난 남자에게 박수를....  
20170106,10,재밌게 봤습니다 탄탄한 연기력을 기반으로 사회적 문제를 잘 녹여낸듯  
20170106,10,효주의 마음이 이해가 되서 더 안타까웠던 영화  
20170106,10,질투의 끝은 이런 거구나..  
20170106,10,김하늘의 연기는 역시 빛이 난다  
20170106,10,배우들 연기력 보소~ 재밌어요 반전이 정말 파격적이었다  
20170106,10,결말이 상당히 충격적이엇어요 ㅋㅋ  
20170106,10,유인영 연기 잘하는데? 소름돋는다  
20170106,10,질투 그 이상의 것을 보여주는 영화  
20170106,10,요즘 시국과의 모습과도 맞아 떨어지는 것 같아서 감정이입 잘되더라  
20170106,10,세 배우의 미묘한 감정선이 세밀했다  
20170106,10,김하늘 연기는 무조건 믿고 본다  
20170106,10,진한 여운을 남기는 영화  
20170106,9,사람이 열등감과 질투때문에 이성을잃으면 밑도끝도없이 과감하게 될수있단걸 알았다. 다만 대중을 이끌려고 여교사와 남제자라는 부적절한 설정을 만들어냈는지 다른 방법으로 뺐는게 있었지 않았을까 생각이든다. 전체적으로는 내용전달은 좋았다  
20170106,9,관람객사랑이 죄다 사랑이 죄...  
20170106,2,이런 소재는 은교때처럼 인지도 조금 낮은 배우써서 노출을했어야 흥행에 도움이 됨  
20170106,10,잔인하다고 하지만 영화 속의 감정의 흐름도 잔인함. 보면 후회는 안 할 듯  
20170106,9,관람객김하늘 때문에 봤는데 재밌었는데 마지막에 오싹~~무서움ㅠ  
20170106,2,"영화 끝나자마자 사람들은 모두 말했지...막장, 노잼, 돈 아깝다 기타 등등..전개가 정말 놀랍도록 단순하며 결말 또한 처참하다.  "
20170106,10,관람객김하늘의 파격적인 연기 변신 입니다 정말 마지막 장면 충격적이네요ㅜ  
20170106,8,나름 지루한면도 있었습니다 여교사와 학생을 다룬영화라 그런지 19금인데 그런장면은 별로 없어보이네요  
20170106,1,막장 재미없다~~~~  
20170106,8,관람객민낯은 김하늘의 얼굴만은 아니였다젊지도 않고 배경도 없는 을의 민낯을 본 것 같아씁슬하지만 화장을 지운 후 친근감과김하늘의 당당한 연기가 좋았다  
20170106,5,정보가 없어 물어보는건데 왜 청불이예요??야한영화는 아니라그러던데결말이 잔인한가요??  
20170106,7,나는 재미있던데... 영화 끝나자 뒤에서 욕사발 터짐 ㅋ  
20170106,5,보는내내 그냥 내가정신병걸릴거같았음 분위기자체가 너무 무겁...  
20170106,4,유인영은 앵앵대고 김하늘은 화나있고 이원근은 발연기함 스토리는 지지부진하고 반전도 충분히 예상가능 감독이 남기고자 하는 이야기는 느낌이 오지만 스토리가 좋아서 오는 게 아니라 그냥 뻔해서 다가온다 심리물이라기엔 유인영 캐릭터가 너무 단순하고  
20170106,10,정말 시간가는줄 모르고 몰입해서봤습니다 한편으론 안타깝고 쓸쓸한 우리 사회모습들을 보는것같네요... 세 배우연기 모두 훌륭했고 빠져들었습니다 여운이 오래 갈듯하네요...  
20170106,8,"관람객마지막 장면이 계속 기억나요,,,ㅠ  "
20170106,10,누군가의 과도한 해맑음은 누군가에겐 던져지는 돌과 같다.  
20170106,1,정말 뻔하고 재미도 없고 ..돈앆워요 진심  
20170106,8,인간의 열등감의 끝은 어디인가?  많이  아쉬운 후반부살아있는 연기를 보여준배우 김하늘에게 박수를  
20170106,10,현 사회가 갖고 있는 현실을 이야기하고 있는듯..  
20170106,1,...재미없음 뻔한내용입니다  
20170106,10,배우들의 실감나는 연기에 푹빠졋다 ㅜㅜ 꼭 보세요  
20170106,9,보고나서충격이 가시질않는다  
20170106,10,영화 스토리가 대박이네요 김하늘의 연기가 대에박  
20170106,10,상상도 못했던 마지막 장면은 후덜덜  
20170106,8,반전이 대박임 ㅎㅎ 여자의 심리를 잘 그려낸 것 같다  
20170106,10,질투는 나의 힘이 절로 느껴지더라.. 무서워 덜덜  
20170106,10,지금 같은 시기에 봐야할 영화에요  
20170106,9,너무 김하늘 시점 이긴하지만  유인영 시점으로 보면 나쁘게 군것도 없는데금수저 젊은여자 라서 나이많은 까칠한 선배 언니가 계속 시비터는거..  
20170105,7,아무한테도 감정이입할수없는 영화인듯  
20170105,2,처음으로 후기 남겨본네요...대체 무슨 생각으로 김하늘이 이런영화에 출연했나 싶을 정도임...진심 재미없음 재미가 없으면 야하기라도 하던가...진짜 쓰레기 영황ㅁ  
20170105,1,"포르노 같다는 비난을 피하기 위해 정규직, 비정규직 문제를 버무려 고상한 척 하려 한 것 ... 영화도 아니다 이건. 건전한 거 만듭시다!  "
20170105,8,관람객세 명의 주인공에 모두 연민을 느낄 수 있는 신기한 영화. 캐릭터의 힘.  
20170105,9,관람객솔직하고 유익한 수업을 들은 기분이었어요! 전 너모나 좋았습니다  
