0,1,2
20170126,6,인간의 본질적인 욕망과 악마성을 보여주는 영화.. 근데 유인영은 그걸 보여줄 방법이 여러개였고.. 김하늘은 결말의 그 한가지 밖에 없었다는 그 차이뿐.. 두 여자 .. 아니 남학생까지 주인공 3명 모두 똑같은 욕망이 가득찬 인간들..  
20170126,10,좀더 섬세 했다면 완벽했을 영화그치만 만족스러웠음  
20170126,5,난 선생이구 넌 학생이야  
20170126,1,응 청불 어그로 ㅆㄹㄱ영화  
20170126,8,관람객김하늘 소름쫙! 야하기도했구 그냥 볼만했어오!  
20170126,7,왠지 모르게 이해되는.... 슬프고 절망적이다.  
20170126,1,뻔한 스토리 진부한 연기  
20170126,4,보면 왜 망했나 알수있지?  
20170126,8, 끝없는 박탈감. 자존감을 바닥까지 떨어뜨리는 존재 앞에서 처음으로 승리의 쾌감을 맛보게 하는 약점을 잡았나했는데....결국 그것마저 자신의 올가미가 되었네. 찌질한데 우리 현실 같아서 욕할수가 없었다. 마음 한켠에서 김하늘을 응원하게 되는 영화.  
20170126,8,정신병 걸리는 줄...  
20170126,2,사회보다 주인공 성격이 더 꼬였다  
20170126,10,영화 재밌음 솔직히  별점 1점대 많아서 볼까말까하다 봤는데 결말 깔끔하고  재밌게봤음  호불호 갈리는건 인정하는데 별점 1점짜리는 아닌거 장담함  
20170126,2,35분부터보세용~~  
20170126,10,사람 마음 가지고 장난치면 안돼지 ㅆㄹㄱ 같은 ㄴ놈들 결말이 좀 더 사이다 일 순 없나...최민식 나온 해피엔드 처럼  
20170126,5,너무. 많이. 담으려했다. 별로다  
20170126,3,알바 썼나 전부 연기 존나 못하는데 평점이 왜이리 높은지..보는내내 손발오그라들었다 유인영 연기는 못하지만 골리는건 잘하네  
20170125,7,관람객재밌게 잘봤어요 감독님도 만나뵙게 되서 반가웠구요:)  
20170125,8,영화 흥미진진하고 재미있게 잘봤습니다. 너무 재미있었네요 ^^ 결말까지 매우 쇼킹하고 좋았습니다. 영화 캐릭터가 정확히 뭘 말하는지는 모르겠어요. 영화가 뭘 말하려는지는 알겠고요.  
20170125,7,관람객뻔한 내용뻔한 스토리 전개  
20170125,6,관람객재밌었음 마지막에 살짝 징그러움ㅠㅠ  
20170124,6,관람객영화를 보고나면 어느새 몸에 배어있는 참을수없는 찝찝함  
20170123,10,내가 생각하는 나쁜 순위 1위 김하늘 2위 고딩 3등 전남친(ㅂㅅ)4등 폰뺏긴 학생놈 5등 교감 6등 유인영.  
20170123,8,관람객결말이 너무 충격적이네요..  
20170123,6,관람객한국 사회에 현실감을 보여주었고 사람에 감정에 본심을 보여줬던 영화인거같다. 나쁘진 않았던 영화임  
20170123,1,베드신이 없어요!!!!  
20170123,6,주인공의 좌절과 타락에 감정이입이 안되니 마지막 복수?마저도 불편하다.  
20170123,1,"양심이 있다면, 그리고 어느정도 지성인이라면 2점 이상 줄 수가 없다. 직접 관람한 사람들만 내가 무슨 말하는지 알거다.  "
20170123,7,많은 주제를 이야기하려다 보니 산만했음  
20170123,5,관람객내용 연결이 잘안되는 느낌이었네요ㅠ 생각보다 아쉬웠습니다..  
20170122,9,관람객김하늘 연기 정말 잘하는거같아요!남자배우분이랑 여자배우분고 이쁘고!스토리도 탄탄하고 볼만햇습니다!  
20170122,8,관람객잼남재남잼남잼남잼남  
20170122,8,관람객처음보는내용이라 신선했고 연기가 다들 괜찮아서 집중잘됐음 유인영 이쁨  
20170121,7,"관람객김하늘 배우 연기가 좋았고, 대사는 아쉽습니다  "
20170121,9,"관람객지극히 비현실적인 스토리를 지극히 현실적인 시각으루 풀어낸, 그리고 잔혹하고 슬프고 씁쓸한 영화  "
20170121,8,관람객음양과 색. . 빛을이용한 심정변화를 잘나타내어 좋앗습니다!  
20170121,9,관람객볼만한데 극단적임..  
20170121,3,아니 다필요없고 유인영 노출씬있냐고없냐고 씨이이이이발  
20170120,1,반개도 아깝다... 이해불가  
20170120,10,재밌었어요ㅡ 엄마랑 같이 봤는데 여성심리를 잘 반영해서 공감도 되고.. 김하늘 연기가 좋았어요  
20170120,10,관람객끝에 좀 놀랐긴했었는데 영화는 잘봤어요. 연기도 좋았습니다~  
20170120,8,"관람객어떤 베스트 댓글 말처럼 말그대로 심리묘사, 현실감, 결말 다 좋았다. 김하늘의 연기력에 깜짝놀라기도하고.. 비정규직에 초점이 맞춰진거 같지만 그보단 인간자체의 폭력성에 대해서 좀더 초점이 맞춰진거 같구 .. 효주의 내면을 끌어올린 영화  "
20170120,7,관람객사실 기대좀 하고 봤는데 아쉽네요 ㅎㅎ 근데 정말 내용이 좀... 나와서 찜찜한 영화중 하나입니다;ㅁ; 아쉬운 영화...  
20170120,1,남자지만 보는내내 너무 불쾌했고 본 그날 종일 기분이 울렁거렸다  
20170120,5,관람객자알봣습니다 ㅋㅋㅋㅋ  
20170119,1,11만 봤단다. 이런 영화는 만들지마시지 아님 포스터만큼 좀 붕가봉가하던지  
20170119,3,관람객지루하지는 않지만 재미잇지는 않은.  
20170119,7,관람객볼만은 한데  제 스타일은 아니네요 ㅠㅠ. 예고랑 좀 다르게 좀 충격적인내용들도 있고 볼만은 합니다~  
20170119,9,관람객살짝 막장극이긴한데 김하늘 연기력에 다시놀라고갑니더  
20170119,10,관람객볼만함 청불이라 그것을 기대하지는 말고  
20170119,6,연기는 잘하나 내용이 이상함  마지막엔 노이해..;응? 왜갑자기? 이런식으로 이해안가는 장면이 너무 많았음  
20170119,7,관람객순간순간 신선한 지점들이 있다  
20170119,1,평점이 높은듯...결말은 좋았으나 결말까지 치닫게하기에는 과정이 너무 약하고 전혀 공감이 안됨. 연기도 이희준빼고는 다 썩...  
20170118,9,무엇이 이들을 이렇게 만들었나....  
20170118,7,관람객정교함이 부족하나 돈 내고 볼만한 영화  
20170118,1,그냥 싸이코패쓰 영화라고 하지 그랬어...제목 보고 엉뚱한 걸 기대했자나 신인감독이라 주제를 못잡고 갈팡질팡한 듯  
20170118,8,"인간의 질투, 탐욕. <거인> 성인 여자 버전. 김태용 감독 특유의 섬세한 연출력이 돋보이네용!  "
20170117,10,전 진짜 재미있게 봤어요ㅠㅠ  
20170117,1,여교사니 청불이니 페이크 낚이지 마셈  
20170117,1,역겹고 더럽고 사이코패스감성. 사회문제 인간적 질투심 열등감에 대한 심오한 감정을 담은것도 아니고 그냥 사이코패스같은 느낌만 남았고  영화보다가 나가고 싶은적은 디워이후로 처음이다. 절대 추천하고 싶지않다. 정말 보던 도중에 구토감을 느꼈다.  
20170117,5,관람객이게 뭔영화래요????  
20170117,8,효주도 처음부터그렇진않았을텐데그렇게쌓인게많지않았다면혜영의 유일한잘못은 권력층임도 재하도아니라 눈치없음?;이었다 효주는 현실이그토록보기싫고우월감같은 환상이필요했을까 재하를사랑한건아님에도 재하에게자신이 혜영보다 우월함을 끝까지인정받고싶어한다  
20170117,9,관람객사람이 살아갈 때 필요한 두 다리를 잘 보여준 영화라고 생각합니다.  
20170117,7,관람객김하늘의 노력이 느껴짐  
20170117,5,관람객예상한내용그대로예요  
20170117,6,관람객약간  애매한 구성....답답한 영화인듯김하늘 배역 어울리지 않는듯  
20170117,10,예고편만봐도 딱 내스타일인데 보고나니 더좋았음ㅋㅋ 연기력 묘한긴장감 다좋았음;;  
20170117,6,자연스러운 스토리지만 소재자체가 많이 파격이라 정서상 안 맞는 느낌이 든다. 그 점만 빼면 괜찮아요.  
20170117,1,아청법 위반 영화....  
20170117,5,주인공은 정교사가 먼저였을까 사랑이 먼저였을까.정교사를 원하다가 갑자기 사랑으로 빠진다... 근데 끝에는 정교사를 원한다... 또 마지막에는 사랑... 결국 뭘 말하고 싶은건지..?  
20170116,5,"이 영화 하나가 이렇게 많은 사람들이 의견을 내놓고, 할 줄은 몰랐다. 그저 보이고 말하는대로 다 보여줬는데. 당연한 것을 그저 더욱 멋져 보이게 써 내려가는 사람들. 이건 그냥 학교판 '닥터'.  "
20170116,10,"심오하고 의미있는 영화.,.. 거인도 재밌게 봤는데 ..이것도 재밌네요  "
20170116,9,관람객기대만큼의 흥미를 따라와주진 않았지만여러 문제들을 잘 담아내서 재밋게 봤습니다  
20170116,6,관람객한국에서 흔치않은 윤리적 선을 넘은 치정극이라는 점에서 점수를 주고 싶다. 그리고 도덕과 명예로 살 것 같은 교사의 이야기라 더 치명적이다. 하지만 문제의식도 스릴러도 다 정점을 찍지는 못한다. 뭔가 아쉬움이 남는다. 김하늘의 가능성을 확인하다  
20170115,4,관람객재미도 없고 감동도 없고..  
20170115,8,관람객혹평을 많이 보고 간터라 기대안했는데 생각보다 재미있었음.  
20170115,6,관람객주제의 중심에서 약간 헛도는 느낌..?  
20170115,7,마지막장면이 너무 징그럽고 놀래서 그거 빼고는 배우들 감정몰입이나 스토리 좋았어요  
20170115,8,유인영이 얄미운 영화. ㅠㅠ 배우들 연기 정말 잘함  
20170115,8,관람객기간제여교사를 열등감으로 가득찬인물로 묘사했다는건 살짝 이해가지않는부분이지만 전체적으로 몰입도는 높았다  
20170115,1,진심 쓰레기영화!! 진짜 지루하다!!  
20170115,1,작품성 있지만 논란이 많은 영화를 기획한 것  같으나  막장 사이코가 된 영화.. 개연성도 연기도 연출도.. 다 망한 영화;;  
20170115,9,관람객누가 착한지 누가 나쁜지 누가 문제를 야기하는지 그러한 것들은 결국 우리 사회앞에서 다 사라지고 이성적인 결과만 남는다. 광기마저도 사회책임이라한다면 우리는 너무 많은것을 주위에 늘 바라기만 했는지도 모른다.  
20170115,6,관람객보는 내내 스트레스 받으며 본거같아요  
20170115,10,추천하고갑니당&^^~~~~  
20170114,8,관람객생각했던것 보단 재미있었다 충격적이고 다소 불쾌했지만 노잼은 아니었음.  
20170114,6,관람객마지막에 결말 소오오름  
20170114,1,"관람객아,,, 이거뭐,,, 하아,,,,  "
20170114,5,극장판 임성한 극본같은 막장 드라마  
20170114,7,관람객19라서 내용을 다 그쪽으로 생각하고 갔는데 아니여서 김샜다고 생각했는데 나름대로 재밌다  
20170114,10,관람객김하늘 너무 불쌍하네요..  
20170114,1,관람객짜증나고 답답하네요고구마10000개 먹은느낌  
20170114,2,"관람객뭐하자는건지 참.. 김하늘의 파격변신이라면서 겁나 홍보해놓더니 뭔변신을 한건지, 왜그랬는지 제대로 나오는 것도 아니고... 그냥 어이없는 영화.. 좋은배우 데려다놓고 쓰레기영화 만든 듯.. 돈주고보기 아까운 영화. 왜 상영관이 적은지 알겠음  "
20170114,1,그냥 베스트셀러극장 한편봤네  
20170114,7,관람객재밌게 잘 봤습니다. 흥미진진했어요.  
20170114,10,영화재밋네요~ㅋㅎ1  
20170114,7,관람객결말이충격적이지만 . . .여자끼리혹은 혼자서 인간의 심리에대해 다시한번생각할수있었던영화.두배우의 연기는 최고!  
20170114,10,최고인영화입니다ㅎㅎ  
20170114,10,관람객재밌어요 상영관이 많이 없는게 아쉽네요  
20170114,9,좀더 섹시했다면  올해흫를재패 할수 있는 영화가 되었을것을...  
20170114,9,"관람객심리묘사가 뛰어난 작품이다  우리사회의 계급,차별문제를 잘 부각시킨 작품이다  "
20170114,3,진심 이게 영화냐 드라마도 이것보단 스토리 낫다 미씽보다도 못하냐 어떻게..  
20170114,5,관람객청소년관람불가치고는 야한장면은 없었지만그래도 나름 재미있네요^^얻은 교훈은 사람이 제일 무섭다는거...기대치보단 낮았지만 한번쯤은 볼만한 영화입니다!!  
20170114,8,관람객반전이있는 내용이있어서 흥미진진햇습니다  
20170114,9,우선 나는 엄청나게 좋은 영화를 봤다고 말할 수 있다. 거인의 김태용 감독의 영화라 기대치가 너무 높다면 캐릭터의 극단적임에 불호일수도 있다. 하지만 그 극단적인 캐릭터를 잘 표현한 배우들에게 박수치고 싶다.  
20170113,8,"관람객계약직이, 시대가, 흙수저가, 악착같이 바둥대는게, 존심도 없이 서러워서.  "
20170113,10,올해시작이 좋네요 갓영화인듯 결말에서 쫄아서 타협하지않고 질러버려서 너무 좋았습니다 신경질적인 캐릭터임에도 불구하고 김하늘씨가 너무 매력적이셔서 저 못생긴 애새끼(남학생)가 어떻게 김하늘을 거부할 수가 있지?라는 생각이 자꾸 들긴 했지만요ㅋㅋㅋ  
20170113,6,관람객그저 그래요 그저그래요  
20170113,1,어이가없네~~ 라는 대사가 내입에서 자연스럽게 나오는 영화별점 알바가 이렇게나 많다는 것을 알게된 네이버 영화 리뷰메뉴네요  
20170113,6,주제가 재밌지만 스토리만 담기고 캐릭터에 먼 곳에서 바라본 느낌. 그래서 캐릭터에 대한 심리묘사가 필요하다고 생각한다. 감동적이 아니었다...  
20170113,9,관람객예고편으로 예상했던 스토리와는 생각보다 많이달라서 놀랐어요. 뻔한 결말이겠지했는데 반전의 반전을거듭하는..! 생각보다 아주 많이 흥미진진했어요. 무엇보다 김하늘씨의 아주섬세한 감정 연기에 감탄했습니다. 김스카이언니가 정말 많은노력을 한게보였어요.  
20170113,8,관람객같은노력을해도 다른출발점에서있기때문에 극복할수없는 내면적 열등감이 김하늘을통해잘표현된듯하다전형적인흙수저와금수저의 평범하고 현실적인 드라마로  이야기를 풀어가다가 극단으로 치닫다못해 스릴러로 가버린 엔딩이 좀 아쉽다  
20170113,1,김하늘은 연기왜하는지...저나이정도 저정도연륜됐으면 이제 깊어질만도하건만.. 외모가 아니라 연기가 방부제구먼~~ 진짜 저급영화임 보지마세요  
20170113,10,관람객여배우들이 주연을 하는 많은 영화가 나왔으면..!  
20170113,8,"마지막 결말이 너무 충격적이라 며칠동안 생각났다.. 김하늘, 유인영 연기도 최고!!  "
20170113,7,관람객내용 별로 연기 별로 노출 별로  
20170113,6,학교 현실적인 문제를 다룬 영화라 기대하고 본 영화 였지만 주인공 김하늘의 무표정한 연기와 넘 지루하면서 사건 전개등 매끄럽지 않은 영화였다. 사제간에 관계도 그렇고 마지막 뜨거운물 사건과 그것을 본 학생 재하가 겪을 충격 내용등....결국 범죄영화  
20170113,8,이야기를 진득한이 이끌어가는 연출과 그 이야기를 탄탄히 받쳐주는 김하늘의 연기는 일품! 다만 결말은 호불호가 갈릴수 있음  
20170113,2,관람객전개가 좀 심심함 너무 지체되는 부분이 많았음 마치 시간을 늘리려한것 같았음  
20170113,10,충격적이지만 또 현실적이고 효주의 역이 내 이야기처럼 이해가 간다  
20170113,8,질투와 복수가 서늘하게 조여온다. 그렇지만 미성년자와의 베드신은 불필요하게 느껴진다.. 과한 설정이라는 느낌.  
20170113,7,이원근 무대인사온다길래 가봄...사실 이원근이란 배우를 첨알았음ㅋㅋ 배우는 배우더라 키고크고..  
20170112,8,관람객재밋고 ncs 직무표준 화이팅  
20170112,2,관람객남주오글 끼부리는거 극혐 노잼  
20170112,4,관람객이원근 얼굴만보고옴 내용이 산으로가다못해 어디로가는지도 모르겠음  
20170112,4,보고나서 우울해짐 ㅠㅠ  
20170112,8,음... 기간제라고 정교사가 할 업무를 대신시키지는 않는다. 거기서 약간 현실 검증을 안 한 것 같고. 김하늘이 학생에게 빠지는 과정이 개연성 부족? 금사빠인가 ㅡㅡ 마지막이 섬짓. 설마 아니겠지 했는데 결국 그렇게 되더군? 장르가 스릴러였나  
20170112,9,멋지고 영화다운 영화.  
20170112,1,영화보고 평점 잘 안남기는데 이건 아니다 싶어ㅡㅡ여교사를 무슨 싸이코패스마냥..아무리 비정규래도 이건 좀..ㅡㅡ 학생들이 이런 영화 접하게 될까 걱정입니다;;  
20170112,8,관람객김하늘언니의 연기가 소름끼치네요 현실적인 연기가 보였습니다  그와중에 이희준 정말 현실 남친같았구요 헤어지는 장면 진짜 있을법한 그런 이별장면 이원근 배우님 착해보였다가 나중에는 사악해보였다가 나중에는 불쌍해짐내용이 몰입감있게 빠르전개 지겹지 않았네요  
20170112,9,유인영씨 연기 좋았어요  
20170112,5,내가 얘기했잖아 김하늘 벗으면 200만 아니면 100만이라고 ㅋㅋ 김하늘 배우되려면 멀었다 여배우는 과감해져야돼 그게 숙명이야 늘 같은 연기와 배역 질린다고 하늘아  
20170112,5,관람객재밋구만재밋어~~!!!ㅋㅋㅋㅋ  
20170112,1,Iptv에 나와도 볼생각 없네요. 배우들이 노출 어그로만 하고 실천은 안하다니 너무 분하네  
20170112,9,영화가 다른의미로 섹시했더라면 걸작이 될수 있었는데...아쉬움이. 야한걸 말하는게 아님.관능이 흘렀어야 했을 영화. 김하늘이 좋아서 봤는데 김하늘은 평타. 유인영 연기가 생각보다 돋보임 .이원근은 마스크가 인상적. 숨을 불어넣었으나 숨쉬지 못한 영화.  
20170112,5,관람객음... 살짝 허무맹랑한 스토리가 너무뻔히 보여요  
20170112,9,평점에 비해 괜찮아요 그냥 싸이코패스의 흙수저금수저 영화? 다들 연기들이 뛰어남 수위는 낮은데 생각보다는 꽤있었던거같구 내용이 쫌 그래서 청불인듯? 무엇보다도 남주의 능글맞는 연기며 눈웃음이며..심쿵... 계속 심장떨면서 영화봤네요 나중에 또봐야겠어요  
20170112,1,"열등감, 질투 이 두 단어로 도저히 설명 안되는 전개. 지루하다.  "
20170112,7,관람객연기 연출 너무 좋았습니다! 하지만 마지막 장면이 너무 충격적이였어요..  
20170112,7,"관람객개인적으로  영화가 끝나고 굉장히 많은 생각을 하게 되네요 ~ 사회적인 지위,  열등감.   비정규직 문제 ..  이사회의 어두운 면만 보게 되는거 같아  한편으로는 굉장히 우울했어요 ~  사실 예고편에 비해 임팩트나 이런것들이 약하게 느껴졋고 ..  "
20170112,4,영화가 공감도 잘안되고 몰입도 안되고 영화보다 중간에 나가고 싶다는 생각  정말 처음 해본것 같아요 ....스토리흐름이 너무 극으로  치닫게 하느 전개가 보는데 답답해요 아주 개인적인 생각입니다.  
20170112,6,"관람객비정규직의 폐해를 현실적으로 보여준 점인 인상적, 후반작업의 중요성을 간과한 것에 대해선 비관적. 주전자 물 붓는 장면에서 가글이라도 하는 줄 알았다.  "
20170112,10,관람객재미있었습니다 ㅎㅎ!!  
20170112,8,"관람객피해망상과 열등감의 끝은 파멸, 이걸 대놓고 말하면 곤란하다. 그래서 불편하다.  "
20170112,6,마지막 결말이 예상 밖이긴 함.  
20170112,9,영화가 끝나고 시간이 필요했다.김하늘이 이런 연기를 할줄이야 사회의 문제와 여자의 질투 그 이상의 무엇인가가 매우 잘 어울려진 영화  
20170111,9,관람객지루하지는 않으나 스토리적 예술성이 떨어짐  
20170111,10,나에게는 믿고보는 유일한 배우 김하늘 영화라 봤는데 김하늘은 없고 계약직 교사 박효주만 나오더라. 완벽한 연기에 찬사를. 여우주연상 받을 만한 연기였다. 내용은 조금 아쉬웠지만 생각하게 하는 무게있는 울림이 있었다. 상영관이 너무 없음  
20170111,8,관람객어우 김하늘씨....어후....  
20170111,9,관람객감독님 귀엽습니다 영화 좋네요  
20170111,6,관람객무대인사 영화로 예매해서 배우분들 잘보고 왔습니다  
20170111,10,줄무늬 파자마를 입은 소년 못지 않게 충격적 결말이네  
20170111,1,류승완의 예술버젼인가? 외유내강이 아니라 표리부동  
20170111,8,관람객김하늘유인영예쁘다짱장  
20170111,8,관람객마지막에 반전이 있어서 깜짝 놀랐어요~ 잘봤습니다~^^  
20170111,7,"'여교사' 라는 타이틀을 들었을 때 여성으로서의 교사직에 있을 때 있을법한 일들을 떠올다. 영화는 그렇게 진행되나 여교사로서 있을 법한 어려운, 힘든 이야기들을 주로 풀어나간다. 그 해소요소로서 남학생과의 로맨스를 꿈꾸지만, 끔직한 결말로 이어질줄이야  "
20170111,7,"여배우가 벗어야할 때 벗지 않는 것이 얼마나 어색한지 보여준 영화, 인기있다고 노출꺼리면 진정한 배우로 거듭날 수 없다  "
20170111,2,관람객별로..추천하고싶지않은..내용이고 영화네요.기대하고봤는데.. 내용자체가 별로고 영화가 다 끝나면! 뭐지? 하는기븐과..탐탁지 않은 기분이 들어요.  
20170111,9,여자는 힘이없지만운 사랑앞에선 남자보다 더 무서운 존제이라는걸 다시한번 깨닫게 만든 영화이네요~예상치못한 스토리... 잼미이겠봤습니다.  
20170111,10,마지막 장면의 그 처연함과 서늘함은 오랫동안 기억될 듯. 김하늘 배우님의 연기는 무조건 상 줘야 함.  
20170111,7,관람객그럭저럭 볼만 해요~~~~  
20170111,8,관람객평점낮아서 별 기대안했는데 기대 이상이네요  
20170111,10,관람객소름이돋는영화 스토리가 탄탄  
20170110,10,평점이 왜 7점대???? 보기드문 수작! 단순킬링타임용도 아니면서 상업영화의 재미까지 모두 갖춤. 정적인 장면도많았음에도 영화보는내내 긴장하며 몰입. 꼭 보세요ㅜㅜ 저평가된것 같아 안타까움  
20170110,1,웬만해서는 평점 안 다는데... 인소 보는 느낌이었습니다 돈이 아까운 영화는 또 오랜만이었네요 제발 부탁입니다 영화관에서 보지마세요 정 궁금하시면 나중에 디비디 나오면 다운받아 보세요  
20170110,7,스토리가 단순하지만 계약제 사립교사의 현실과 흔ㄱ수저의 비참한 현실을 볼 수 있는 영화. 김하늘의 상황이었다면 저런 결말이 나올수도 있다. 김하늘의 연기는 좋았다.  
20170110,8,관람객유인영예쁨 마지막 이원근 우는건 조금 어색했음  
20170110,10,생각보다 너무 재밌었어요. 긴장감이 영화 끝까지 계속 이어졌어요  
20170110,1,리틀 김기덕의 탄생또라이 감독 하나 더 나왔네 ....쓰레기 스토리  
20170110,10,"이게 진짜 여자 투톱 주연 영화... 김하늘과 유인영의 연기력이 정말 영화를 처음부터끝까지 몰입하게 만든다. 연출력과 전개 속도, 방식 모두 좋았음  "
20170110,10,관람객김하늘 유인영 연기잘함 안답답한 전개 재밌게봤습니다  
20170110,4,"재미도 없고~ 감동도 없고.. 남학생은 나쁜놈이고, 이사장 딸은 더 나쁜x이고.. 주인공은 미친x  "
20170110,5,관람객결말이 뭐지...재미도 그닥  
20170110,9,관람객세캐릭터 다 이해감 현실적인 스토리 볼만해요  
20170110,8,"관람객김하늘 꼭 아니어도 , 꼭 여교사라는 제목니 아니어도 , 기대하지 않고 와서 더 좋았던 영화 ~  "
20170110,6,치중하는 지점을 끝내 흥미롭게 잇지 못한 용두사미.  
20170110,10,관람객김하늘 연기파 배우네요 상투적 이지 않고 스토리 촬영 긴장 다 좋아요  
20170110,7,"좀 기대 했었는 데, 비록 아주 졸작은 아니어도 그렇게 걸작은 아니었다. 그낭 평타정도...   사건이 너무 극단적으로 가다가 말은 것같은 느낌이다.  볼일을 봤는 데, 시원하게 보고 오지 못하여 찝찝한 그런 느낌.  "
20170110,10,관람객심리적 묘사와 배우의 연기가 정말 압권이다!!  
20170110,1,별하나도 아까움 연초부터 핵쓰레기급 영화봄...  
20170110,5,은교보다 두수아래 평범한 남교  
20170110,7,관람객김하늘의 선생님 연기는 옳다. 어떤 모습이든..  
20170110,10,관람객와...살짝마지막 반전  
20170110,7,호불호영화라고 알고 봤는데 생각했던거보다 재미있게 본 영화  
20170110,10,"커다란 메시지를 앞에 세우고 그 뒤로 배우들의 연기, 귀를 사로잡는 음악, 적절한 설정, 그 모든 것들이 줄지어 따라간다. 전체적으로 조화롭고 전혀 이상한 부분이 없는 영화. 보고 나서 여러 생각을 하게 해주는 영화만큼 좋은 영화가 있을까요. 추천!  "
20170110,10,이원근 연기에 놀랐어요 !  
20170110,4,김하늘 유인영 연기가 아까웠던 영화  
20170110,6,관람객뭔가 이상하네 끝이..  
