0,1,2
20171126,1,아 긴말 안할게요.. 이영화볼돈으로 기부를하세요  
20171126,10,나만당할수없다빨간물감영화  
20171126,10,액션씬 정말 리얼하더라구요 잘봤습니당!  
20171126,8, 큰뜻은  없는거 같은데 그냥 재밌게 봤어여!  다이나믹!  
20171126,1,영화를 보는데 욕이나오네요진심으로 너무 재미없습니다 이 영화 감독 소질없으니까 때려치세요빡치게 하지말고  
20171126,10,"정해인배우님의 살아있는 눈빛과 액션, 평소에볼수없던 김지훈님의 무게감있는 연기, 이원종배우님과 조재윤배우님은 역시가 역시! 스턴트없이 직접한 액션도 대단하지만 대사 한마디한마디가 참 많은생각을 하게하더군요.   꼭 영화관가서 보시길 :)  "
20171126,6,관람객평을 보고 가서 솔직히 별 기대는 안했는데 생각보다 나쁘지는 않았어요 약간 지루함이 있긴 했지만요  
20171126,10,저예산 노개런티 영화인데도 출연해주신 배우분들 너무 대단.. 조재윤 배우님 자꾸 범죄도시 황사장으로 보여서 혼자빵터짐ㅋㅋㅋ감독님 근데 세기말 피튀기는 cg는 좀 아니잖아요...ㅠ  
20171126,10,관람객기가막힌 영화다?무협지도 쫓아오지 못할 끝내주는 액션?터미네이터두 이길거 같다?꼭 보구 후회하세요?  
20171126,1,영화찍으나 고생많았쑤. 2시간동안 푹 잤네 그랴 ㅋㅋ  
20171126,1,친구랑같이보러왓는데 너무재미없어서 나가자고햇는데 안나가길래 아프리카티비로 장기방송보다가 나왓습니다이만하면 평에적합햇나요  
20171126,10,재미있게 봤습니다전성열 배우님 항상 열심히 하는 모습 보기 좋아요:) 힘내세요  
20171126,10,역모는 액션으로 시작하고 액션으로 끝낸 기분이였습니다.액션신이 엄청 많아서 여름에 고생을 많이 하셨을 것 같아요.2년전에 찍은 영화지만 재밌었습니다.모든 배우님들 다 고생 많으셨습니다.대박나세요.  
20171126,8,악인과 선인의 기준이 무엇인지 다시 생각하게 만드는 영화. 상상력을 가미한 작품에 주인공이 왕이나 힘있는 세력이 아닌 포졸인 점이 흥미로웠다. 그치만 마지막 부분에 영조와 이인좌가 대면하는 부분부터는 조금 아쉬웠다.  
20171126,1,알바새끼들 10점 너무티나네... 수능끝난 수험생인데 보고 울부짖었습니다 돈아까워서  
20171126,10,개봉전에 예고편보고 재미있겠다 개봉하면 꼭봐야지 하고 있다가 개봉날 봤는데 액션빵빵하고 배우님들 연기 빵빵하고 너무 좋았어요~두번이나 봤어요 찡짱  
20171126,10,생각보단 훨씬 재미있다!! 액션사극이라 생각하면 10점을 줘도 아깝지가 않다 !!지금 평점을 낮게 주는사람들은 너무 심하게 저평가 하는것이다 아무리 박하게 줘도 8점이하를 주긴 아까운 영화이다!!  
20171125,9,"액션영화인데 1달여의 시간만에, 그리고 대역 없이 와이어 없이 찍었다는걸 알고 보니 더욱 더 액션씬들이 값지게 보였어요ㅠㅠ 액션씬이 많아서 눈이 쉴 틈도 없이 몰입해서 봤습니다ㅎㅎㅎ그리고 개인적으로 인상적인 액션씬들도 꽤 있었어요! 재밌게 봤습니다♥?  "
20171125,8,"정해인 하고 싶은거 다 해,, 꽃길걷자..♡  "
20171125,1,난 메가박스에서 알바하면서 봤다.. 진짜 관람하지마라 그리고 감독은 앞으로 영화만들지마라.  
20171125,1,브라더-미옥-역모 연속적으로 빡치게 하네 ㅅㅂ  
20171125,10,"더운 여름에 와이어도 없이, 대역도 없이 촬영하신 배우분들이 너무 존경스럽다.  "
20171125,1,이영화는평점그대로다...  
20171125,1,진짜 보기 힘들어요. 스토리 없이 싸움만 계속 하는데 그 싸움조차 재미없음 ㅠㅠㅠㅠ 촬영장소 한 네다섯개로만 찍으신 듯  
20171125,3,관람객아무리...주인공이라지만 너무 안죽는다ㅎ 불사신임ㅎ 너무질질끔  
20171125,10,평가는 직접보고...  
20171125,10,기대했던것 보다 액션도 크고 내용도 좋았습니다! 무엇보다 배우들 연기력이 한몫했네요 재밌었어요!  
20171125,10,저예산 영화치고 너무 잘만들었던데 나만그런가요 여성분들은 배우님때문에 볼만할것 같고 남자분들은 무협지 좋아하시는 분들은 볼만할것 같아요  
20171125,10,엄청쟘있어요 ㅜㅜ대박  
20171125,9,끝까지 보게 되는 영화!!!  
20171125,4,"대체 뭘 말하고 싶은건지 하나도 모르겠다. 포졸은 불사신도 이니고 혼자 계속 싸워도 죽지도 않아. 김지훈은 좀 어이없게 죽고, 대비는 대체 누가 뽑았냐! 발연기 대박이다 진짜! 옆에선 몇몇 코골고 자고 진심 나가고 싶었다..  "
20171125,1,이런 영화 만든 감독은  반성해라  
20171125,10,정말 올해 들어서 이런 액션신은 처음 본거 같아요!! 위험한장면도 직접 참여했다고 들었는데 정말 최고에요! 스토리도 연기도 굿굿ㅎ 꼭 보세요~~!  
20171125,10,원래 사극 싫어하는데 이 영화는 스릴감넘치기도 하면서 재미있었고배우 정해인님의 진지한 연기와배우 김지훈님의 액션씬과배우 조재윤님의 시크한 표정연기와배우 이원종님의 따듯한 모습이 너무 좋았고 사극을 싫어하시는 분도 재미있게 볼수있는 영화입니다!  
20171125,8,무난하게 재밌는 사극 액션 영화  
20171125,9,영화의 큰 프레임과 짧은 하룻동안 일어나는 역모중에 스토리전개는 괜찮았다. 특히  역모에 가담했다 불리해지자 순싯간에 다시 왕편에 서는 장면은 묘한 느낌을 ....  
20171125,1,역대급 진부한 스토리와 액션연기 영화보고 잔건 오래만이네요 영화보고 나가고싶다는 맘을 처음들게 하는 영화입니다  
20171125,8,일단 보시오. 그럼 알게됨. 이런 영화도 있음을...   액션의 화려함이라도 더 빛이났다면 변명이라도 할 수 있었을 텐데....  
20171125,10,평점에비해 재밌어용 액션을내가좋아해서그런가  
20171125,9,볼만한영화 연기가 최곱니당  
20171125,1,솔삐 엄청 기대했는데 개노잼이었음 ㅇㅈ;;  
20171125,1,안본 눈 삽니다. 아직 안보신 분 보지마세요. 돈 아까워  
20171125,1,진짜 개연성 1도 없이 싸우기만 디립다 싸우다가 허무하게 끝나는 영화. 스토리가 진짜 개판임  
20171125,1,재미없다.킬링타임도 아깝다.  
20171125,1,칼에 찔리고 베어도 죽지않는 우리의 슈퍼맨.. ㅋㅋㅋ  
20171125,10,이인좌의 난을 바탕으로한 액션영화인데 배우분들이 직접 찍어 생동감이 넘치는 영화였어요. 역사는 승자에 의해 기록된다. 이인좌와 김호의 서로 바라보는 신념이 달라 일어나는 일인데 과연 누군가의 잘못을 따질 수 있는가 다시금 생각하게된 영화입니다.  
20171125,2,보살들이 넘쳐 나네여ㅋㅋ 댓글들이 ㅋㅋ  
20171125,6,야 밑에 이인좌가 인조시대라는 놈있다. ㅋㅋㅋ 역알못이라도 넘 심한거 아니냐?? 인조 같은 소리 하고있네. 포털에 이인좌 검샥이라도 해라 ㅋ  
20171125,10,작은영화치곤 잘 만들었네요. 볼 만 합니다.  
20171125,1,재미없다  절대 보면 안돼는 영화  
20171125,2,극장가서 봤는데..내용도 없고..배우가 아깝다  
20171125,1,"‘하루’ 이후로 보는내내 욕만 나온 영화..정해인 팬클럽 우글거림..무대인사 끝나니 다들 빠져나감...사극/액션 좋아하는 나 지만, 이딴 영화는  상영하지 않기를..  "
20171125,1,감독의 역사의식이 궁금하다 이인좌의난이면 분명 인조새기때일인데 ㅋㅋ 아니 역적이라니 인조새기가 역적이지 무순 ㅋㅋ 오히려 역모가 충신이요 역모를 막은것들이 간신배다...인조새기가 이인좌난진압한다고 북방군을 다쳐죽여서 병자호란때쉽게뚫린거모르냐 ㅋㅋ  
20171125,10,주연배우님 누구신가요? 연기를 너무 잘하네요!^^ 잘 봣어요~  
20171125,1,80년대 홍콩영화 추억에서 아직도 헤매고 잇네  
20171125,10,"다소 아쉬움부분은 있었지만 볼만 합니다.제일 기억에 남는 장면은 이인좌가 옥에서 ""삼보""액션씬이 기억에 남네요김지훈배우가 연기한 이인좌역활이 다소 분량이 작아 아쉽네요 임팩트 강한연기를 해서인지 영화끝나고도 계속 기억에 남아있네요 영화역모 흥하시길  "
20171125,1,ㄹㅇ루다가 ㅋㅋㅋ 알바들 어떻게든 머리굴려가지고 좋은 말해주려는거 짠하자너 선과 악에 대해서 생각 엌ㅋㅋㅋㅋ  
20171125,10,와 영화 오지구연 지리구연 영화 대박 날 것 같은거           동의? 어보감  
20171125,10,역모-반란의 시대 그리고 군도-민란의 시대?  그냥 비슷한 것 같아서.. 아직 안봐서...10개..  
20171125,10,역모 라는 영화가 나올때까지 배우님들 스텝님들 모두 고생하셨을텐데 거기다가 배우님들은 와이어 없는 액션까지 하시다니 정말 대단하십니다 역모 액션신 너무 재미있게 잘봤구요! 역모 흥행했으면 좋겠습니다!  
20171125,10,영화 넘 잘보고 왔어요배우분들이 너무 고생하신것같아 마음이 짠했고대뷔1년차로 보기엔 정해인배우님 연기도 잘하시고목소리도 좋고 대역 없이 액션도 완전 좋았습니다그리고 김지훈배우님도 멋지시고 모든 배우분들도 좋았습니다 영화대박나시길 응원합니다  
20171125,9,짱 잼있어요 꼭 보세요 ㅎㅎ  
20171124,9,역사를 소재로 한 내용에 흥미를 끌고  배우들의 훌륭한 액션신과 연기력을 가미하다보니 영화를 보는내내 영화에 빠져들고 집중했어요. 평소에 액션영화를 즐겨봐서 그런지 사극에서 나오는 액션신이 다른 현대를 다룬 영화와 달리 매력적으로 그려져 좋았어요  
20171124,10,액션신이 많은 영화인데 정말 배우분들 고생하신게 보이네요 긴장감있고 굉장히 멋있습니다 또 배우분들 연기도 너무 좋고 재밌었습니다  
20171124,3,주인공 버프 쩐다 그래도 정해인때문에 봤다  
20171124,10,"장르가 액션 사극이라고해서 기대하고 봤던 영화. 보는 내내 긴장감 있었고, 배우님들 연기를 보다보니 런닝타임이훌쩍 지나가 버린 느낌. 액션씬을 위해 배우님들이 얼마나많이 고생하셨을지 느껴지는 영화~! 액션과 배우님들 연기를 보는 재미가 있는 영화~!  "
20171124,10,해인오빠 멋있어요 !!액션신 짱  
20171124,10,정말 진짜 대박이에요 재밌게 잘봤습니다  
20171124,10,배우분들이 액션을 공들여 찍으셨다고 하셨는데 보면서도 느껴졌어요! 연기력으로 말하면 짱짱인 배우분들이 나오셔서 몰입도도 좋았습니다!극중 해인님이 자기도 왜 싸우고있는지 모르겠다고 하셨는데 보는 저도 왜 저렇게까지 열심히하는걸까 궁금해지는 영화였습니다!  
20171124,10,역모라는 좋은 영화가 나오기까지많은 분들이 흘린 땀방울이 얼마일까요배우분들 연기도 너무 좋았고연출과 액션씬 또한 너무 좋았습니다!좋은 영화였습니다.  
20171124,10,"무협 만화 느낌의 프롤로그와 영화 전체적인 분위기가 조화로웠습니다. 각 장면의 색감과 배경이 아름답다는 생각이 들었고,  액션신에 많은 신경을 썼다는 것을 알 수 있었습니다. 승자가 선으로 표현될 수 밖에 없는 역사 내용을 잘 표현한 영화였습니다.  "
20171124,2,하... 남한산성 이후 역사물... 너무 비교되요... 화면은 드라마화면같고 액션씬에서는 뮤직뱅크 이상의 현란한 카메라... 심지어 피튀기는 장면에서는 일본영화 보는줄.... 스크린에 피튀기는게 좀 유치하다고해야되나... 스토리도 좀 아쉽고.  
20171124,1,응아니야응아니야응아니야  
20171124,2,조선 최악의 망작. 개연성 하나도 없고 오글거리는 헛웃음 내게 만드는 대사에 지루한 액션신. 입장료 환불 운동 벌여야 함.  
20171124,1,감독 귀엽네 마치 초딩같은 영화를15세를 달고 말야 ㅋㅋ  
20171124,1,너무하네 아 돈낭비했네  
20171124,1,진짜 올해 리얼에 이어 최대 망작이다. 사극에 순간이동 불사신 성괴가 왠말이냐  
20171124,4,저예산영화인데너무큰그림을그리려했던영화  
20171124,9,"정해인씨 출연한다고 했을때 기대 많이 했었는데.이제서라도 극장에서 봐서 좋았습니다.시작부터 끝까지..사극액션.. 즐겁게 봤네요... 참!  배우 인터뷰에서 제작비 5억으로 만들었다는데..사실인가요?   대박..  배우, 스탭분들 대박...  "
20171124,10,정해인배우님 진짜 연기도 점점느는게 보이고 앞날이 창창한것같습니다! 항상 응원할게요!!! 앞으로 더 좋은작품 기대하겠습니다 재밌게 봤습니다!  
20171124,1,가장 안타까운건 별점에 0이 없다는 것이다  
20171124,10,더운여름날 정말 배우님들이 고생하신만큼 좋은 영화입니다.편한 마음으로 잘보고왔습니다. 무대인사 갔다왔는데 해인님 실물은 대단하더라구용! 왜 그 배역마다 싸울려고 하는지 우리는 무슨목적으로 살아가는지 다시한번 생각하게 되네요!!해인님♥ 고생했어요  
20171124,10,기대안하고 봤는데~정해인씨 연기 잘하네요^^ 액션도 화려하고!! 즐겁게 봤습니다!!  
20171124,10,"저예산과 몇 번 있지 않았던 쵤영 횟수로 영화과 개봉햇다는 점에서 보면 훌륭하다. 배우들의 노력이 매우 잘 보이는 영화, 표현하고자 했던 주제를 잘 보여준다  "
20171124,10,사극 좋아하지 않는데도 액션영화를 좋아해서 정말 재밌게 봤습니다!  
20171124,8,어렵지 않고 편하게 볼 수 있는 영화!  정해인을  102분동안 볼 수 있는 것만으로도 완벽한 영화인데??  
20171124,10,배우들 연기도 좋았고 정해인의 새로운 사극 연기도 넘 좋았어요!  
20171124,10,와 액션씬 짱이에요ㅠㅠ 극장가서 꼭 볼꺼야 ㅠㅠ  
20171124,10,내평점정해인의 첫 주연작을 응원합니다!  
20171124,7,그냥 액션 좋아하는 사람들은 볼 만하다 ㅋㅋ 1점 줄 정도는 아니구 배우들 대역도 없이 찍었다는데 취향 맞는 사람은 보는 거지 ... 이런 영화도 있고 저런 영화도 있고  
20171124,1,영화야? 개콘이야? CF야? 감독아. 다신 영화 찍지마라  
20171124,10,뭔지 모르겠지만 일단 하라니까 한다  
20171124,10,일단 배우님들의 액션이 너무 멋지세요~ 와이어 없는 액션!!! 처음부터 끝까지 액션으로 이루어져 있지만 배우들의 대사를 들으며 이 영화가 어쩌면 사람 개개인의 신념에 대해 말하고 있는 것 같았어요. 정말 배우님들이 연기는 최고!!!!  
20171124,1,이거 보다가 여친하고 헤어질뻔했다  에효 돈아깝고 시간아깝 10점주는 빠순이들아  객관적으로 영화 작품성 보고 좀 댓글달아라  
20171124,10,액션신. 박진감넘치네요!!!  
20171124,10,너무 재밌게 봤어요~특시 액션신이 최고에요!  
20171124,9,배우들의 노력이 그대로 전해지는 영화  
20171124,1,활쟁이두명이랑 싸울때 서로 죽일거 예상한사람 나밖에없냐... 두시간동안 뭔가있겟지 뭔가 있을거야 하고 봤지만 역시나 ... 뻔한 액션신에 주인공 무슨 히어로도아니고 찔리고 베여도 멀쩡히 뛰어다니고 좀비냐... 제발 이럴거면 사극영화로 만들지 말아주세요  
20171124,10,살고자 싸웠던 한 남자의 이야기. 이인좌의 난이라는 역사적 소재에 기발한 상상력을 가미한 작품이네요. 스토리가 '포졸' 남자를 중심으로 이어지는게 흥미로웠어요. 뭣보다 이 영화의 백미는 액션이네요. 다소 거칠면서도 화려한 액션씬 덕에 눈이 즐거웠어요.  
20171124,10,"정해인 님과 김지훈 님의 액션 굿, 액션 신 할 때 음악 굿  "
20171124,1,누가 영화에 수면제 탔어..?  
20171124,1,이 영화 안보길 잘했네 어차피 딱 봐도 개망 영화  
20171124,1,어영청 오인방대신 독수리 오형제를 썼다면 차라리 어린이들이라도 데리고 와서 봤을텐데  
20171124,10,"기대에 부풀어서 보았는데 약간 잔인한 감도 있었지만, 그렇게 다 드러내는 연출들이 있었기에 더 흥미진진하고 긴박감이 넘쳐서 좋았어요! 내용도 알차고 액션씬도 정말 알찼기에 저는 너무나도 만족합니다 ㅎㅎ 역모 재밌으니 꼭 보세요~~  "
20171124,1,재미없으려니 한도 끝도 재미없는 영화진심 노잼  
20171124,10,일단 배우분들의 액션연기가 어색함 하나없이 자연스럽고 리얼해서 몰입해서 보게되었습니다. 과한 배경음악이 없어서 영화에 집중을 할 수 있어서 좋았습니다!! 특히 액션 몇몇 장면이 기억에 남는데 대단하시다는 생각이 들었고 정말 멋있습니다!  
20171124,1,그냥 스토리가 없어요...  
20171124,10,첫 주연치고는 잘한거고 역에 충실히 할일을 다한듯 ! 난 괜찮게 봤는데 다들 왜그러는지 이해가안됨 ... 암튼 난 재밌었고 좋게봤음 !!?? 그나저나 정해인 왜케 잘생김 사극에서도 빛나는 외모를 가지고 계신다..  
20171124,1,연기도 연출도 뭐 하나 괜찮은게 없었던  
20171124,2,액션만 있는 영화. 스토리는 없다.  
20171124,10,역사는 이긴사람의 이야기라는게 정말 소름돋았고 상영내내 액션에 푹빠져서 시간가는줄 모르고봤어요! 수능끝난 고3인데 어제도보고 오늘도 보러갑니다♡배우들도 다 명배우분들이셔서 믿고보는 역모!  
20171124,1,돈아깝긴 처음입니다.  
20171124,1,클레멘타인 2017 ver.  
20171123,1,10점 - 반란의 평점 올해들어 최악  
20171123,1,꼭.. 이래야만 했냐아~!?(해바라기 김래원ver)  
20171123,10,"처음에는 이게 뭔가 의아했지만 보면 볼 수록 집중하게 되는 영화이다. 또한 액션씬이 굉장히 노력했다는게 보이고, 그만큼 잘 나온 것 같다. 그리고 배우들의 연기도 굉장히 볼 만 하다. 선과 악이 뭔지도 생각하게 해주는 영화 같다.  "
20171123,5,예고만 봤는데... 배우들이 아깝다... 배우들의 매력을 모르시나보네  
20171123,10," 역모를 촬영했던 시기가 여름이라고 알고있습니다. 날씨도 더운 여름에 많은배우님들과 조연배우님들, 그리고 감독님들이 엄청 고생하시면서 촬영했다는 것을 영화를 보면서 느꼈습니다. 역모 액션신을 숨참으면서 봤습니다 제가 다 긴장되더라고요! 역모 짱!  "
20171123,10,나만 당할 수는 없다...  
20171123,10,오늘 개봉하자마자 본 역모! 연기파 배우분들과 감독님의 케미가 돋보였던 영화입니다!  무대인사 보려고 타지역에 살지만 서울까지 올라와서 응원하고 왔어요. 하룻밤사이의 이야기 이지만 그 시간 속에서 끊임없는 액션씬이 지루할 틈이 없게 만든 것 같습니다.  
20171123,1,한국판 개망한 히어로물  
20171123,4,피터지는 CG는 영구와공룡쮸쮸 CG같았다  
20171123,2,관람객EBS 사극 보는 느낌 드네...하아ㅏ이  
20171123,1,이정도의 소재로 뽑아낸 영화가 이정도라니...어찌보면 감독의 재능이 진심 대단하다...  
20171123,10,10정도 부족할만큼 영화 잘 봤어요액션씬도 멋있구요 손에 땀날정도로 긴장감도 있었고 순간순간 놓치지 않으려고 열심히 봤던것같애요 ㅎ앞으로 몇 번 더 보려합니다  ㅎㅎ영화 대박나세요~  
20171123,1,당황스럽다. 12시간 동안 싸우는걸 2시간 동안 봐야한다. 그것도 한사람이 싸우는걸 ..  거지도 아니고 죽지도 않고 또 살아온다.  
20171123,9,액션활극 짱!!  잼나게 보고왔음. 히힛.  
20171123,10,한편의 무협액션 만화를 보는듯한 영화였고 너무 많은 캐릭터들이 나오지않고 몇몇 주연캐릭터들의 내용을 집중적으로 볼 수 있어서 좋았던 것 같아요  
20171123,1,이 좋은 소재로 이따위 밖에 못찍냐? 감독아!!!  
20171123,10,사극영화 역시 짱~ 리얼 액션 완성도 인정  
20171123,9,관람객뭐  생각 없이 보면  티비  사극을 큰 화면으로 보는 느낌 ㅋㅋ 그래서 9점  
20171123,4,스토리가 탄탄하지못해 보는내내긴장감도 없고.. 억지로 짜맞춘것같은..스토리연기도 아쉽고..그나마 아재가 연기 제일 잘한듯  
20171123,1,노오오오잼.. 역대급 노잼임..  
20171123,10,하룻밤이라는 시간동안 각자의 삶을 지키기 위해서 목숨걸고 싸우는 와중에 악인은 누구고 선인은 누구인지 그리고 그 기준은 어디에 있는지 생각하게 하는 영화.우리의 삶에서는 그 기준이 어디에 있는지 또 한번 떠올리게 하는 영화.역모는 그런 영화입니다.  
20171123,1,ㅎㅎ 수능끝나고 즐거운 마음으로 영화보러왔는데 영화 보는 중간에 평점쓰고 있을정도로 재미없고 저퀄이에여 핸드폰으로 찍는게 더 화질이 좋을정도네염 그냥 돈 많이 남아 도신다고 하시면 한번쯤 보는것도 나쁘지 않겠는데 저같으면 차라리 치킨을 사먹을듯  
20171123,1,이 영화 처음부터 끝까지 똑같은 장면~  하품하다 눈화장  다번짐  
20171123,3,전투씬 좋아하시는 분들에게 추천해드립니다. 정말 전투씬밖에 없거든요.  
20171123,3,스토리 없이 그냥 전투 전투 전투! 하지만 나오는 하품... 약속시간 남아서 킬링타임 차원으로 봤는데 좀 심했음...  
20171123,1,"엉성한 개연성과 과한 주인공 보정, 어이없는 연출, 개나 줘버린 고증. 마지막에 이인좌와 영조가 대면하는 부분부터는 한편의 코미디가 따로 없다.  "
20171123,1,최악의 영화 --  주인공 연기도 어색하고 진짜 돈이 아깝다  
20171123,10,완죤 재미있어요~정해인 연기 볼만합니다손에 땀을 쥐게 하는 액션 ~또 보고싶어요~~  
20171123,10,"정말 수작입니다.역사적 의미가 깊은 영화,정치인들 잘하세요.한방에 훅 갈수도 있으니^^  "
20171123,1,감독님. 다신 충모로 오지마셔요  
20171123,10,완전 재밌어요!!!!  
20171123,1,이런거 별로임...ㅋㅋ  
20171123,9,예산도 작은데 알차게 보여진다. 예산많이쓰고 탑배우 쓰고 줄줄이 망하는영화에 비하면  정해인. 조재윤  역시^^  
20171123,1,느금마같은 바보같고 역겨운 영화  
20171123,3,평론가 평점에 맞추어야 할 것 같아요...  
20171123,10,완벽한 영화는 아니지만 한번 가볍게 볼 만한 영화넹ㅇ  
20171123,10,오늘 보러갑니다아아!! 통쾌한 액션 기대해요!  
20171123,1,정말 유치하기 짝이없네어떻게 영화를 이렇게 만들수가 있지?  
20171123,5,아호 ..보다가 몇번 나올뻔한걸 참고 받더니 온몸이뛰틀리고 아프네  
20171123,10,정해인씨 연기 기대됩니다~  
20171123,10,시원한 액션과 배우들의 표정연기가~  
20171123,8,100만 돌파 가능할지 모르겠다. 만화적인 요소가 많은듯 봐줄만은 했으나 ... 말을 줄이겠음  
20171123,1,"헤헤, 부라더-미옥-역모 이렇게 삼연타 맞으니까 현타온다  "
20171123,1,멋대로 튀기다간 죽도밥도 안돼지  
20171123,10,예상했던 것 보다  재미있어요.  
20171123,10,시사회 당첨돼서 봤는데 예상보다 꿀잼! 사극과 액션이라니 신선하고 배우들의 노력이 보여서 더 집중해서 봤어요 또 봐야징  
20171123,10,예산이 적다고 하던데 무지하게 알차게 잘 찍은듯! 정해인 흥하자!! 김지훈의 새로운 매력!!!  
20171123,5,1. 현실성 있는 액션2. 어..?왜....? 어어...3. 길게 늘어선 화장실 줄  
20171123,10,조재윤씨 이제 주연하자~~~~  
20171123,1,한국영화그만 사업정리하는게?  
20171123,8,예산의 한계로 인한 완벽도가 부족한 것은 사실. 그치만 액션 시도에 완전 큰 박수를 주고 싶음. 특히 스크린에 피튀기게 하는 아이디어는 정말 신의 한수인듯.  
20171123,1,나쁘다 왜 이런 영화를 찍었어요?  
20171123,7,킬링타임용으로는 굿! 정해인 보는 재미가 꿀~  
20171123,10,역사와 액션을 함께 볼 수 있어 좋았습니다!  
20171123,10,액션도 나름 괜찮고 배우 비주얼은 더 괜찮고ㅋ_ㅋ  
20171123,10,정해인ㅠㅠㅠㅠ넘좋아  
20171123,10,우유남 정해인! ㅠㅠ 사극에서도 얼굴 열일함  
20171123,10,찍을 때 고생했다고 하던데 액션 어떨지 너무 궁금해서 빨리 보러가야겠다!  
20171123,10,믿고보는 김홍선 감독! 액션 ㄹㅇ 꿀잼ㅋㅋㅋ  
20171123,10,조조로 막 보고 나오는데 귀차니즘을 이겨내고 로그인함ㅋㅋㅋㅋ 액션 장난 없이 완전 재미있음..  
20171123,10,"VIP 시사회 당첨돼서 봤는데, 킬링타임용 액션영화로 괜찮음 ㅋ 그 이상도 이하도 아님 ㅋ  "
20171123,10,간만에 보고싶은 영화가 나와서 너무 좋네요  
