0,1,2
20180417,6,"싸우는장면보다 스토리를 좀더 넣었으면 괜찮았을텐데,처음부터끝까지 정해인을위한 영화ㅎㅎ  "
20180403,1,역린을 기대 하고 봤는데 이런 ㅆㄹㄱ를 봤나 ㅋㅋㅋ  무슨 생각으로 만든건지 알수가 없네 ㅋㅋㅋ  
20180402,1,정해인볼려다....ㅜㅜ  
20180328,7,정해인 진짜 호감가는 배우인데 영화가 노잼내용이 전혀 어렵지않아서 시간때우기용으로는괜찮음딱 6-7점이 적당한 영화  
20180325,2,뇌물받고 자살한 노xx씨 탄핵하려던 추미애씨 생각나네요  
20180325,4,"피 튀며 쓴 빈약한 스토리, 그래서 역모가 됐나 보다  "
20180319,4,김원종 조재윤 김지훈 보고 6점주다..액션 충분한데 친절하게 피 튀김을 좋아하는 연출 덕에 점수 깎다가 주인공은 역대최고 히어로포졸이라..  4점..  아쉽다.. 보는 도중에 평점..역시 단도보단 장검이군..  
20180316,2,액션 훈련시간이 아깝다  
20180316,1,"부디 보지마시길.. 주조연들 액션 연습 너무 안한거 아닙니까?  칼자루 휘두른게 이리 어색할수가.. 요즘 드라마 수준이 높다는걸 실감함.. 뿌리깊은 나무, 육룡이 나르샤 보다 못함..  "
20180316,10,보지말라고 하는분들 남들 알려주기 싫어서 그러는겁니다. 꼭 보세요 인생영화입니다.  
20180309,10,정해인땜에 본건데 홍수아한테 홀딱반함♡존예♡  
20180308,1,꼭 적어야 하나....  
20180306,10,무사백동수보는줄  맨날 피만나와ㅋㅋ겁나잼따진심 나만 핫타임 뺏길순  없다  
20180306,2,"시대,출연진,뜬금없는황진기강조,궁궐격투신,검선.많은 것들이 무사 백동수를 연상.찾아보니 감독이 무사 백동수 감독.김호가 받은 이름 광택인건가.나중에 동수 스승?이건 뭐프리퀄인줄ㅡㅡ 근데 무사 백동수가 모든 면에서 훨씬 낫다. 차라리 드라마로 만들지.  "
20180228,5,제목은 역동적인데 내용은 지나치게 단조롭네요..  
20180227,1,님들 피나오는거 컴퓨터그래픽임 OOㅋㅋ ㅈㄴ 티나고 피 ㅈㄴ 터졌는데 땅바닥 ㅈㄴ 깨끗함ㅋㅋㅋ  
20180222,2,충무로의 반란 역모!!  
20180221,1,창피해요!!!쪽팔려요!!!  
20180219,1,우와아하하하....  
20180217,4,아 역린이랑 착각해서 봤네 ㅋㅋㅋ 포졸때 칼 안써서 암걸릴뻔했음  
20180215,2,쓰레기영화도 풍년이네  
20180215,10,조선판 백악관지킴이 시리즈  
20180215,8,시나리오 너무 별론데 정해인 연기는 참 잘하고 멋있음 액션에 올인했으면 차라리 나았을걸 감독의 티비드라마 보이스는 참 좋았는데 아쉬움  
20180214,2,검선에서 웃고갑니다 다큐 보는지알았어요 배우들이 아깝다는생각 첨해봄  
20180213,1,대박... 투자자들진심 대박.. 내생애 최고의 영화  
20180213,1,아무리 베어도 통증을 느끼지 못하는 주인공 날아가는 화살은 맞춰도 사람은 못 맞추는 적  
20180205,10,나만 당할수 없다!!!  
20180204,1,쓰레기 시간낭비  ㅂㅅ같은영화  
20180203,1,정말 시간아깝다 ㅎㅎ 별점에 0점을 어떻게 주지  
20180203,6,잼없단글을 하도많이 보고봐서 긍가요jQuery22404433362266532628_1517657605033저예산영환것 같고 주인공얼굴에 언뜻언뜻 유준상 있고요 진질~끄는영화보다 잼나던데요 슈퍼파워 주인공은 영화니깐~무협좋아해서 글까요??잼나던데요  
20180202,4,싸우면서 전투력이 상승하는 초사이어인인가?  감빵생활의 유대위 아니었으면 이점수도 어렵다.  
20180201,5,전투신을 조금 빼고 스토리를 넣었다면 괜찮을만한 영화인데... 케찹이 난무  
20180130,4,대체 무슨 영화가 이러냐  
20180129,1,너무한다 ㅠㅠ  이건뭐 슈퍼맨도 아니고  
20180129,1,이 영화 노잼임 1시간 봤는데 40분 내내 싸우기만 함 심지여 싸우는 장면까지 노잼임  
20180123,10,히어로 내금우장 김호 !!!  
20180123,5,액션씬이 좀 많긴했지만 나쁘지 않았음  
20180122,1,스토리도 없고 피도 가짜티 남vod로 봐서 진짜 거짓말 안 치고 한 2008년 영환줄 알았는데 의외로 2016년꺼네jQuery22409093165175209246_1516547910829? 개 신기그리고 다시 한번더 말하지만 스토리가 정~~~말 없음  
20180119,8,굳!!!  생각보다  좋았음.  
20180119,8,류태준연기좋고~ 김지훈 연기 이렇게 잘하는줄몰랐네 재발견  
20180118,1,보는 내내~~ '조선미녀삼총사' 의 산만함과 '클레멘타인' 의 빡침을 동시에 느낄수 있었다  
20180117,1,그냥 쓰레기 아...이런 영화를 만들다니..  
20180115,1,개ㅈ도OO 이게 영화냐? 4500원 아까워서 뇌가 뇌부림 치는걸 참아가며 억지로 봤다. 4500원 아끼려다 뇌에 전치4500일 정신병온듯  
20180114,10,역적들이 항상 말은 잘하더라  
20180113,1,이거보고 와이프랑 싸웠습니다. 감독 이양반을 확!!!  
20180113,1,영화보다가 하도 기가 막혀 검색해봤더니 역시...ㅋ 이렇게 화나고 욕나오는 영화는 처음이다. 2017년에 이런걸 영화라고 만들다니..  
20180113,1,엉망엉망....  
20180113,1,아 ㅡㅡ 다음부터 평댓 보고 봐야겠다  
20180109,1,스토리가 뭔지 모르겠다 ...  
20180109,7,하나의 rpg게임을 하는 느낌의 작품이었습니다재밌었습니다  
20180107,1,너무하다증말로..  너무해  
20180107,1,1점도 아까운 영화네요스토리와 연기도 엉성하고 주인공은 무적이고(칼을 몇방을 맞아도 몇분이면 회복해서 다시 덤비고)정말 처음부터 끝까지 이렇게 실망한 영화도 오래간만이네요  
20180107,4,"일단은 전투신이 강해 모든 출연진이 고생이 많았음을 생각해 별한개요.. 밤새 촬영에 고됨포함 또 별하나요..과한 피튀김부터 유난히 목숨긴 주인공, 또 그래서 세자는 어떠한 사람인지에 관한 미흡한 내용...그렇다고 상상의나래를 남긴것도아니고..아쉽네요  "
20180105,3,사극 좋아하는데 이렇게 재미없게 만드는것도 감독의 능력이다.  
20180105,10,관람객영화보는걸좋아해서 봣엇는데 전 넘 잘봣어요  
20180104,1,감독 으이그 시끼야 돈을 날리고 싶으면 얘길하지 굳이 영화로 돈을날리냐!!ㅋ  
20180103,2,잼없다~정해인 나와서 봤는디~  
20180102,3,"아직 초반이고 보는 중.. 금단비?? 대비 역 보자마자 평점 남겨요.개그콘서트 보는줄 알았어요 ㅋㅋㅋ 양심이 있으면 좀 ... 실력을 갖춰서 영화출연합시다.피의 시대 , 반란의 시대라고 제목은 진지한데 감독이 게임중독인지 연출이 장난이네요  "
20180102,10,역적들 다 잡아 쳐죽이는 영화 굳!  
20171231,1,"스토리도 없고, 액션신만 나오니까 지루하고 재미없어요ㅜㅜ전개도 느려서 하품 나옵니다.  "
20171231,1,남자 주인공.. 무슨 드래곤볼 선두 먹으면서 싸우나 ??  사람이면  저렇게 연속으로 계속 싸울수가 없음.  참.. 무술 감독은 뭐했나 ? 이런 말도 안되는 구성으로 영화를 만들다니.. 진짜 돈 아까워서  ㅎㄷㄷ  
20171230,1,주인공이 연기 심하게 못하네요 ..최악이다 ..  
20171230,1,ㅋㅋㅋㅋ 삼류 중국영화도 이보단 낫다  
20171229,5,액션은 훌륭하나 스토리가 개판임  
20171229,1,하 씹노잼이다 진짜 졸라 노잼이다 감독게임중독자냐? 여캐가제일쌔네 어휴  
20171228,9,조선액션 나는 좋았는데 평이안좋으네 ㅜㅜ  
20171228,7,관람객인기배우가 아니라서 그런지 극장에 나홀로 관람하였다. 평범한 스토리와 전개였는데 관객이 옆에 없어 더 재미가 없었다. 신인배우의 연기가 나쁘지는 않았다. 줄거리가 지나고 나니 의미가 새겨지지 않은 것이 못내 아쉬웠다. 다음엔 관객이 많은 영화를 봐야겠  
20171228,10,영화가 아닌 드라마로 좀 더 풀어서 제작이 되었으면 어땠을까 하는 아쉬움이 있지만  나름 괜찮았어요  
20171227,1,주인공 무한코인임 ㅋㅋ 더 웃긴건 폰카로 찍은것도 아니고 1980년 영화 느낌남. 대사는 더 웃김 ㅋㅋ 스토리는 디워보다 심함 ㅋㅋ 맞는소리 빼면  무성영화 급임  
20171225,3,정해인 때문에 그나마 3점 줌 ㅋㅋ 보지 마세요 시간 낭비  
20171225,1,라이터를 켜라  리부트 명작이다  
20171225,3,어떻게이렇게 허접하게만듭니까액션신은 맞을려고기다리고있고 너무 띠나는 비현실감에 공감이 안되니 당연히 망하죠  
20171224,1,와~~ 쩌네. 시간 금방감..시작했는데 잠깐 눈감았다 떠니 중후반.  
20171224,4,관람객죽고 죽이기로 끝 재미도 별로  
20171224,1,나는 조선의 먼치킨이다~!!!  
20171224,1,"감독님, 영화  대신에 tv드라마 만드세요.  "
20171223,6,관람객.... 저렴하게 찍은티가 나는영화.. 비추여  
20171223,1,진짜전투씬연속이로구나~연출이게임속같네..게임속미션클리어같다..한놈죽이면그다음위로올라가 또죽이고결국대빵까지올라와 죽이면 영화끝! 남주는연기별로못하네..사극안어울린다어색함화살로둘이서로맞아죽일때웃겨죽는줄..쇼하다결국죽음욕나옴..부연설명부족해서재미없다  
20171223,1,중간에 보다 말았는데 결말이 어케되요?  
20171223,10,또 보고싶은 영화입니다  
20171222,8,드라마 프롤로그 라고 생각하고 볼게요 감독님드라마로 제작하기 위한 거죠? 그렇죠?  
20171222,1,니들 100 : 1 맞짱이라고 들어봤어.. ㅋㅋ  
20171222,1,ㅎ 저렇게싸우면 세계통일되겠네.. 왜 상대방들은 기다렸다가 찔려주는거야? 뭐 춤이라든지 발광이라든지 좀 하지 줄서서 기다리다가 소리지르면서 찔려주는센스..  
20171222,1,진짜 살면서 영화는 최신 나오면 무조건 다 보는 영화광인데평점 처음 남기네~ 불사신은 그렇다쳐도 저정도 실력을 줄거리에 조선 최고의검이라고하고 스토리는.. 아~진짜 할말없다  
20171222,1,"시나리오 쓰레기 + 주인공 연기력은 귀여니 순정만화 스타일이라 손발이 오그라듬. 발성이 책 읽는 수준. 액션씬은 방망이+맨손액션으로 검,도, 활, 창 다 잡음. 조선판 옹박ㅇㅇ  "
20171221,5,도대체 무엇을 이야기하고 싶은건가? 포졸의 활약상?  
20171221,2,정말로 유치하다 스트리트파이터가 훨 재밌다  
20171221,3,솔직히...映畵가 좀...그렇다...너무 지루해....  
20171221,2,웬만하면 이런 영화 만들지 마세요.  
20171220,6,포졸이 무쌍찍는 스토오리  
20171220,1,저예산 영화의 단점이 다 드러난 영화.  
20171220,10,너무너무 재미있게 봤어용^^ 꽃길만 걸으시길  
20171220,1,태정태세문단세예성연중인명선광인효현숙경엉엉엉ㅠ  
20171219,3,CG가 너무 어색해요ㅠ 주인공은 그렇게 칼을 맞고도 안 죽는게 신기하고 영화가 말하고자 하는 내용이 잘 전달되지 않은 것 같아요..  
20171219,1,칼로 미친듯이 베여도 좀비마냥 일어나고 칼 휘두르는데 공격패턴이 찌르고 목 긋고 반복ㅋㅋㅋㅋ 패턴 하나밖에 없나..적들도 혼자 죽여도되는 상황을 굳이 같이 공격해서 빈틈 늘어나고..만화 그만 봅시다 감독님 그리고 명언을 끌어모아 뱉으면 다인거 아니에요  
20171219,10,정말 재밌엇우요 피터지는 장면이 정말퀄리티있고 좋은거같아요 이 영화가 인기없는게 이해가 안되네요 다들 한번씩 보시길 발랄게요^^  
20171219,1,킬링타임용으로도 아까운 영화.. 그냥 애니보다도 떨어지고 보고나서 개 후회중...  
20171219,1,쓰레기 cg디자이너를 쓴듯 ...저따구로 cg처리를 해놓으니 망하지...  
20171218,1,흠냥... 진짜  명치가..얼얼  
20171218,2,주인공 무한체력... 울버린인가?  
20171218,2,헐 무수리가 홍수아였어? 그리고 어디선가 많이 보던 포맷인데 OOO 하나 처러 못해 범죄집단이 괴멸한다.  
20171218,10,정말 재미 있어요~ 최고입니다. 칼이 널렸는데 칼을 안쓰네--어후!뒷목..ㅋㅋ  
20171218,1,부라더 미옥 7호실 채비 역모 역모하네  
20171218,1,"전하고자 하는 메세지가 뭔지,, 주연들 연기는 또 어떻고,,  "
20171218,1,이것도 많이 드린듯해요. 이좋은 배우분들을 이렇게 만드시다니 ㅜㅜ 좀더 수련이 필요해 보시이네요. 저급한표현이나 말은 삼가하겠지만....만드신분들은 정말 꼭 좀더 공부를하시고 만드시길 바랍니다.  
20171218,1,동화책보다 못한 스토리구조 .쌈박질-쌈박질-쌈박질 끝  
20171217,1,그냥 정해인이 좋아서 봤음. 팬심으로 봤지만 영화 수준은 정말 하...  
20171217,5,"조선판 다이하드를 표방한건  좋았는데,  액션도 현실적이고 다만 극 흐름이 떠있다는 점과  젊은 내금위 하위관리가 어영청 간부를 상대 한다는 어설픈 인과응보 스토리. 성장배경을 넣어 검의 수준이 도달했다는 과정을 보여주었다면...  "
20171217,3,돈주고 안보고 무료다운받아서 본게 천만다행... 그런데로 볼만은 하던데 칼맞고도 생생하게 싸우는게 시기하네...  
20171217,1,이래서 남자주인공 캐스팅이 중요한듯개연성 스토리 다무시한 삼류 쓰레기영화남주 개나대지말고 은퇴해라  
20171216,3,장소부터 소품부터 화면배경퀄리티까지 영화가 그냥 되게 저가 느낌이 물씬난다..  
20171216,1,으휴...망했다..망해..어휴  
20171216,1,진짜 내가본 사극영화중에 최고로 노잼 완전 핵노잼전투신만 가득한데 그나마도 엉하고 설명충에 하품나오고 스토리도 노잼 하여튼 1점도 아까운 영화다  
20171216,3,감독님 첫 스크린 연출작? 신고식 제대로 했네ㅠ  
20171216,1,역모! ㅋㅋㅋ 역사이야기가 아니고 무술영화다폭망한 이유가 있네 지루해 죽는줄~~!  
20171215,1,오프닝에 나오는 만화 까지만 재밋음  
20171215,1,처음고ㅏ영화가 끝난 후에 영화관에 있던 사람들 수가 다르다.... 중간에 나가고 싶었음  
20171215,4,배우와 스텝들이 고생한 부분은 인정. 하지만 CG처리 정말 성의없다 피는  튀겼는데 바닥에 피가 안보인다 주인공의 불사신같은 모습은 극을 지루하게 할뿐이다 결론은 주인공을 너무 신처럼 만들었다  
20171215,10,"시각장애를 앓고있어 청각으로만 이 영화를 감상했는데 이 영화를 듣고 봉사된지 20년만에 시력을 회복했습니다. 직접 눈으로 이영화를 보고 감동을 받아 다시 눈이 멀고 청각마저 마비가 됐습니다. 이 영화 강추합니다, 꼭 보세요  "
20171215,10,다음 작품은 잘 만들기를 기도하는 마음으로10점 드립니다.  
20171214,1,감독님 앞으로는 그냥 드라마 하세요 영화는 그만 찍읍시다  
20171214,2,감사합니다 제가 이영화덕에 잘때 코를 곤다는것을 알수 있었습니다  
20171214,1,머냐? 이런 영화도 있었음?  
20171214,1,이걸 영화라고 만들다니.... 50년대 한국 영화 수준.  
20171214,1,1점줄께요.. 배우의 노력때문임.  
20171214,4,주인공이 아이언맨도 아니고...죽지를 않네  
20171213,1,시나리오 폐급... 액션신만 있는데 그것도 리니지 칼질처럼 똑같은것만 보는 느낌으로 지루 그냥 재활용도 안되는 ㅆㄹㄱ  
20171213,2,칼쌈하다 끝나버리넹~ 확~그냥 장풍 한방이면 끝날것을~  
20171213,1,1점도 주기 아깝네요 김홍선씨 이제 내려오세요. 이렇게 감각이 없을줄이야.50년대 80년대 나왔어도 관객모독영화에요. 정말 역대급 인생 최악의 영화였네요.너무 시간이 아깝습니다.우웩  
20171213,3,감독이 피를 못봐서 환장한 듯.아무리 액션이 주라지만 뭥미?!좋은 배우들 데리고 이런 재미없는 게임 만들기 있기? 없기!  
20171213,10,나도 당할 순 없지...  
20171212,5,1류인척하고싶은 3류 사극  
20171212,1,포도청 - 포졸의 시대. 비장비장 열매 쳐먹은 주인공. 사망 플래그 장인 이원종. 김지훈 섹시 화보집. 명품조연들 용돈벌이 개꿀. 홍수아 컴백. 갸뜬금 러브라인. 감독 사요나라~  
20171212,1,하다하다 처음으로 1점 주는 영화다 ㄹㅇ..  
20171212,1,"김홍선감독은 퇴임하라. 센스 없으면 욕심 내지도 마세요. 너무 재미없어서 중간에 나오기는 또 처음이네.조명부터 망신창이스토리며 연출이며.. 쓰레기 연출..시간 낭비, 연기자들 재능낭비, 돈낭비 어후... 진짜 안본 눈 안들은 귀 삽니다.쓰레기 영화  "
20171212,3,전투신에서 잠이 오다니 왜이리 지루하냐  
20171212,1,내가 지금 내일이 쉬는날이라 기분좋게 맥주 마시면서  영화를 딱 보는데 중간에 이거 ㅆ.ㅍ 몇점이지? 하고 의문이 들어서 로그인했다. ㄱ.ㅈ.ㄷ.ㅆ.ㅍ 내가 감독하련다  
20171212,1,홍선이는 재능이없네...이런건 타고나야지 노력한다고 되는게 아녀.  
20171211,1,...?!?!ㅅㅂ..  
20171211,1,살다살다... 이런 영화에 투자한 분들이나 출연한 분들이나 ..이해가 안갈뿐...코메디 꽁트보다 못한 스토리 ..진짜 깜놀했음  
20171211,5,피터지는 효과도 그렇고 무슨 방망이로 여러명을 제압한다는게 좀 .. 또 주인공이 칼에 맞아도  금방 치료되고 그리고 주인공이 다 이겨 ㅋㅋ.. 보면서 영화 몰입이 잘 안되네요..  이 영화는 많이 아쉽네요.. ㅜ  
20171211,6,고마 싸워 ~이것들아!!  
20171211,1,조선판 다이하드냐 ㅋㅋ. 베끼려면 재미있게 베끼던가.  
20171211,2,약간 주인공은 대전게임 캐릭같네요.. 아무리 찔리고 베이고 해도.. 피가 0만 안되면 동일전투력으로계속 싸울수 있는....  
20171211,3,액션에 평점을 준다. 줄거리. 영상 모두 티비 드라마보다 못한 수준. 몇번을 졸았는지.  
20171211,2,킬링타임용? No !킬링 M e 용 !  
20171210,1,"큰 배우들이 아깝다. 조연들 연기하며내용도 이상하고 , 영상도 별로ㅠ보는 내가 스트레스 받는다.  "
20171210,1,나만 당할순 없다 꼭 보세요  
20171210,1,해인이형이 처음으로 주인공을 한건데 참... 망해도 너무 망했다  
20171210,1,주인공이 자동 치유 초능력이 있나봄. 칼에 찔리고 베어도 아이아파 하고 시간 지나면 다 나음... 체력도 무제한... 나루토인줄...  
20171210,1,아 진짜 설마 설마 했는데... 스토리전개없이 똑같은 장면만나와서 보니 다끝나감ㅋ  오프닝 그지같을때부터 알아봄 아휴  
20171210,1,이 영화를 보고 김장하는 법을 배웠습니다.  
20171210,1,이야..이거 뭐냐 진짜..옹박 짝퉁이냐??옹박은 스토리라도 있지..평점 빵점주고 싶네  
20171209,1,1점도아깝다 영화를 왜 찍음?  
20171209,1,연출 오글거려 못 봐주겠음.. 주인공이 설명충에 액스트라는 주먹만 맞아도 쓰러져 나가는데 칼 맞고도 멀쩡히 행동한는 주연들ㅋㅋㅋ  진짜 딱 90년대 영화. 요즘 중고등학생이 연출해도 이렇게는 안할듯  
20171209,10,나만 당할순 없다~~~  
20171209,1,10점주는 알바들 동원해 돈벌려는 얼치기 감독의 수준만큼딱 그만큼의 한심한 영화  
20171209,1,연출력과 스토리. .    안습이다.  
20171209,4,"각본, 연출 허술하기 그지 없는 영화 .최악  "
20171209,1,이게영화야?하하~신인연기자들 욕나올정도로 더럽게 못하네‥돈주고 영화출연한건가 한번떠보려고?에휴‥  
20171209,1,저 감독 영화는 평생 안 볼 듯...  
20171209,1,일당백 ㅋㅋㅋ주인공 목소리가 멋짐 ASMR인줄  
20171208,1,하이고야...이정도일줄은 안보시는거 추천합니다  
20171208,1,이영화가 50년대 작품이었다면 대박일텐데  
20171208,10,아..참..아~으~..쩝..  
20171208,1,주인공이 완전 좀비네. 좀비여... 혼자서 반란군을 다 제압함. ㅋㅋ  
20171208,1,참놔..뭔싸움씬이?  
20171208,1,tv용으로 적합...주인공이 휘젖고다니는데 짜증나는 그런류~  
20171208,1,싼티나는 연출기법에 캐스팅 미스에  오그라드는 대본에... 감독 이 돈 많은가 보다.  내로라 하는 조연들 몇 몇 있던데 옆에서 말좀 해주지. 조연들이 나쁘네.  
20171208,3,관객 입장은 고려하지 않은 감독의 고집만 보이는 영화...  
20171208,2,감독님아... 의도는알겠는데... 처음10분빼고 엔딩까지 주인공이 쉴틈이 읍더라말이쥐...칼침을 수도없이 맞고서도 죽지도않고 계속부활하는 주인공.어쩔꺼야.  정해인.. 힘들어서 살빠진거바...TV미니시리즈쪽으로 가심이좋을듯싶으오.. 주인공봐서 별1개.  
20171207,10,나만 당할 수는 없다. 2  
20171207,1,대비의 연기력은 최악이다  
20171207,4,밑도 끝도 없는 스토리에....배우들만 불쌍하다.  
20171207,2,한 90년대 초반에만 만들어 졌어도  성공할 영화 였는데 너무 늦게 나왔음. 연기자들이 아깝  
20171207,1,1점도 아까워.. 영웅탄생이여  
20171207,1,너무 하네~첨보는 주인공에 좀비여 뭐여?죽지를아네~ㅋ  
20171207,1,학교에서 억지로 보게했는데 아무래도 쌤들이 안보고 예매한듯..ㅋㅋㅋ피튀기는 CG 솔직히 개에바고..잘잤습니다~  
20171207,10,학교에서 억지로 보게 했어요.. .  
20171207,10,클레멘타인급 명작 꼭 보세요  
20171206,1,이 영화 보고 별점 주고 있다. 이 별점도 아깝다. 차라리 제목을 바꾸든가? 중국 무협 영화가 낫을 듯 하다.한국 영화 보기 참 힘들게 한다...  
20171206,1,주인공  불사신  하품  졸리네  
20171206,1,아직 살아있을 눈 들을위해 씁니다. 그대들이여 반듯이 누워서볼것을 권장합니다..목베게는 필수 아이템!!  
20171206,6,감독이 전하고 싶은 메시지가 뭔지 당최 모르겠음. 그리고 주인공은 통각이 없나봐;; 어깨 뚫리고 손이 뚫려도 잘만 움직임. 아니 그리고 제발 칼 좀 주워....  
20171206,5,전투씬 좋다이겁니다. 창맞고 칼맞고 무적이네 무적;;;  
20171206,1,주인공좀비네 ㅎ 1대100이네  
20171206,1,독립영화 졸작인거 같았아요. 흑흑 내눈 ㅠㅠ  
20171206,10,볼만한데 이영화 추천합니다  
20171206,10,주인공 불사신 너무 멋져요칼 맞아도 살고 창에 찔려도 살고몽둥이 하나로 6:1은 기본다리베여도 잘 걸어다니고 전지전능 주인공 넘 멋지네요.시간을 버리고 싶으신 분 꼭 보세요킬링영화임  
20171206,1,우리나라 영화계의 반란을 꿈꾸다...충무로를 침몰 시키려 한다..주인공은 울버린..계속 말짱해~~인간적으로..미옥은 여기에 비교하지 맙시다..  
20171206,1,연기?연출? 뭘봐야해?  
20171206,1,이따위로 영화만들거면 만들지마라.. 낚여서 보는 사람은 시간 돈 낭비하게 된다.. 남의 돈과 시간에 피해를 주는것 이런것이 보이스피싱과 같은것이다..  
20171206,4,시작할때는 분위기 좋았는데..  
20171206,1,와....살다살다 이렇게 재미없는 영화는 또 없을것같다.  
20171206,1,"주연배우 연기 10분 보고 ... 일단 꺼버리고, 혹시나 해서 평들 보러 와봤더니, 와보길 잘했다.  관객들 시청자들  주머니 여는 연기가 장난이야 ???  "
20171206,2,ㅋㅋ 액션이 너무 허접하다. 피튀기는 cg도 어이가  
20171205,1,정말 감독은 생각있니? 도대체 너는 누구니? 칼맞고 이렇게 금방 낫고 말이되니 감독아?  
20171205,10,재미있게 봤어요 영화니까  
20171205,1,축하해 주세요. 새로운 꿈이 생겼습니다.역모2 로 다음주에 찾아뵐게요  
20171205,2,주연배우 얼굴연기가 아주 초보수준  
20171205,10,출연진  모르고봤다가 여자배우가 홍수아라는 크레딧보고 반전에 지렸다 10점준다  
20171205,7,"역사에 기록 안 됐다면서 영화로 만든 건... 픽션이라는거냐? 그리고  조선 시대에 홍수아 같이 생긴 궁녀가 있든? 내 눈엔 완전 중국 1,2차 대전 때 막 생긴 혼혈 얼굴이던데(안티 아니다)  "
20171205,2,일단 무술감독이 배우들 연습 많이 안 시킨듯 무술이 너무 느리고 어설프다  
20171205,10,1시간42분이아깝지않길  
20171205,1,시간아깝다 딱 그정도다..  
20171205,10,아니 김지훈 박철민 조재윤씨가 나오시는데 ㅎ 어떡하지? ㅎ 이영화 어떡하지? ㅎ (한숨) 연기 존잘이신 분들이 아까운 영화ㅎ  
20171205,6,스토리가 없음.. 그냥 칼 액션 영화  
20171205,1,지루하고 내용도 없고 좋은배우들 바보만들고 됸마니  
20171205,1,역사를가장한 무술영화;;^^주인공 불사신임 안OO  
20171205,1,한국 영화도 이제 일본 영화 욕할 수준이 못되는구나...영화에 스토리는 있지도 않고 쌈박질만 하는데 그나마 CG도 구리다  피튀는거 보면 예전 대하드라마들보다 못하다 이딴걸 영화 CG라고 해놧다니 웃길뿐이다  
20171205,1,1점도 아까움 걍 스토리 하나도 없고 98%의 액션만 나옴  
20171205,10,고오급 수면제!!!!  
