0,1,2
20171205,1,이게 뭐야 싸우는걸로 시작해서 싸우는걸로 끝나네....연기도 너무 어색하고 난 매우 비추  
20171205,1,진짜 OOO기 영화. 개연성없는 스토리와 완성도 낮은 액션신. 거기다 금단비의 빛나는 발연기 포스터는 참 재밌어 보이는데 씹망작임.  
20171205,10,저의 소중한 시간을 완벽히 삶아 드셔서 감사의 마음으로 이에 별점을 드립니다.  
20171205,10,조선판 다이하드! 탈모! 발모의 시대!  
20171205,3,오랫만에  한국판 정통사극 무협액션을. 본거같아요~~ 평점은 조금 후하게 3점 드렸어요.  
20171205,6,액션은좋다 액션만좋다 아무것도없다 근데 왜 포졸 왜자꾸 몽둥이만 고집하나? 칼든놈 수십명죽여놓고선 끝까지몽둥이네.. 혹여감독이 명장관우의 연출을 생각하고 연출햇다면 개실패  
20171205,2,시간도 돈도 많이 남아도나?  
20171205,2,충분히 매력있는 소재였을텐데...아쉽습니다칼 놔두고 방망이로 싸울때 부터 ...  
20171204,4,피 튀기는 그래픽 처리가 너무 부자연스럽게 웃기네요. 만화도아니고..액션이라도 멋있던가..  
20171204,7,이정도면 볼만한데 아쉽다.  
20171204,1,이게 영화냐ㅋㅋㅋ 그렇게 정해인 팔아서 언플해도 3만도 안 본 이유가 다 있는거다. 0점이 없는게 한이다  
20171204,1,시간아깝다진심차라리뉴스를봐라  
20171204,1,내가 진짜 왠만한 다운받은 영화는 스킵없이 끝까지 보는데ㅡ 내평생 처음으로 20분에  꺼버렸다ㅡ  
20171204,1,노잼...스토리도없고 같은 액션신만 반복평점 많이주는 사람들은 정해인 팬이겠지 뭐..  
20171204,1,제목은 역모인데 결국 정의는 승리한다네 ㅋㅋ저 시대면 역모가 정의 일텐데감독이 정의를 모르는 듯 ㅋㅋㅋ  
20171204,1,정말 이렇게 역대급으로 한심한 영화는 처음본다..  
20171204,3,용두사미일세~! 제작자는 무슨 돈이 남아 돌아서 이런 시나리오 영화를 찍자고 했을 까?  
20171204,1,개막장 배우들 병맛연기 쩔었다 ㅋㅋㅋ니들은 꼭두각시 앞으로 좋은 작품 기대할께 ㅋ  
20171204,1,내가 머리털 나고 지금 까지 본 사극물 중 최악의 액션 과 최악의 내용 진심 돈주고 봤다는 사실에 소름끼치게 놀라는 중  
20171204,1,구르믈 벗어난 달이 얼마나 잼있었는지 알게 해주는 고마운 영화  
20171204,5,징짜 0점 줄려다 마니 올려줌  
20171204,3,;;; 심각하다 진짜...스토리 개연성도 없고.. 주인공 발암물질임  
20171204,10,"군더더기 없는 전개, 예산과 시간에 비해 높은 완성도, 배우들의 열연, cg가 덧칠되있지않은 순수 액션신, 그리고 현시대의 자화상을 보여주는 대사들...  박수쳐주고 싶고전체평점이 의외로 낮아 개인적으로 만점을  주게됩니다  "
20171204,1,재미없네요... 전투씬마저 재미가 없네요  
20171204,1,바람의 검심을 패러디물인가. 패러디 하려면 제대로 했어야지 ㅎㅎ  
20171204,6,조선 최고의 검  김호는 와이리 검을 안쓰노  
20171204,1,싸움이 130분 2분 엔딩 남은시간 싸움예언어쩌라고? 역사를 새로 쓰네  
20171204,9,"불사신 이긴해도, 액션 재밌게 봤네요. 보통 초반.액션.. 중후반부는 대사와 말잔치로만 끝나는 영화보다는, 재밌게 봤어요  "
20171204,1,역대 참 재미없다 ㅋㅋㅋㅋ 주인공  저래 칼맞아도 안뒈지냐... 긴장감 0.000프로에 가까운 영화 ... 에혀  
20171204,1,가짜왕을 몰아낼것이다아~아~아~ 발연기오지고  남주 불사신에 칼맞아도 상처하나안나고 얼굴만꺼매짐 ㅋㅋㅋㅋ  
20171204,1,뭐라할까 긴장감도 없었고 피튀기는것도 어색  
20171204,1,차라리 똥싸는게 더 재밌다 돈을 땅바닥에 버려도 이거보는것보단 안아까움 ;  
20171204,10,이 영화 투자자들ㅋㅋㅋ그냥 길바닥에 돈을 버리지 이런 영화에 투자하냐ㅋㅋㅋ  
20171204,1,별5개?? 알바들 많네....  
20171204,1,밑도 끝도 없는 영웅놀이노래를 한음으로만 부르는 느낌  
20171204,10,흠... 앞으로가 걱정이네요  
20171204,1,"진짜로 평점 2점 이상 남긴놈들 다 알바임..영화광인데 지금까지 한번도 평점 남긴적없는데 어이가 없어서 남김, 주인공은 칼쳐박혀도 30초뒤 멀쩡해짐 남한산성이나 대립군등등 최근 역사를 소재로한 영화들이 정말 명작이란걸 깨닫게해줌  "
20171204,1,역모 한번 맞아봐야 정신을 차릴려라  
20171204,1,어정쩡한 역적 / 어정쩡한 히어로 (충신)코미디가 적합한 영화이다기합소리 영화인가....소리만 질러.히어로를 만들고 싶으면 완벽하게 만들든가모든씬이 기승전 싸움인데뻔한 스토리 조차 없고 내용도 없고 참.너무 빈약한 무대  미술에 돈을 안쓴게  
20171204,2,"개노잼... 다른사람 말대로 같은장면 계속 반복되는거 같고 완전 지루함 덕분에 꿀잠 ㅡ,.ㅡ 영화관에서 봤음 레알 돈아까웟을듯 그리고 주연배우 뭐 대세배우 어쩌고 하던데 뭔 듣보잡이고? 그리고 뭔 조선제일검이 왤케 빌빌댐? 진짜 대충 만들엇다  "
20171204,2,"이 영화를 보니 ""역린"" 이 명작 이라는걸 알았다.  "
20171204,1,만약 과학이 발전해서 타임머신이 만들어진다면 난 가장 먼저 이 영화를 보기전으로 돌아가서 이 영화를 보려는 그때의 나를 사정없이 귓방맹이 후려갈길것 같다.  
20171204,1,뭐랄까~아침 드라마 수준의  긴박함과~9시 뉴스 사건사고 수준의 황당함과.. 군대 이등병때 ...천천이 흐르는 시간...3가지를 동시에 체험하게 해준 고마운 영화.  
20171204,1,사극 드라마보다 못한...  
20171204,8,관람객주인공의 카리스마는 어디서 찾아 볼 수 있는지 도무지 알 수 없고  기대에 미치지 못하는 구성!  
20171204,3,"중국3류 무협영화 무술보다 못하고, 3류드라마 보다 못한 시나리오로 들이된다  "
20171204,1,"평점 알바분들, 남한테 피해 안 주는 방법으로 돈 버세요. 자기 돈 벌자고 남의 귀한 시간과 돈 낚지 마시고  "
20171203,1,줄거리도 없고 액션도 별로고 오랜만에 홍수아 본게 좋았다  
20171203,5,주인공은 기계인간..칼맞과 창맞아도 멀쩡~~  
20171203,5,그럭 저럭이였어요 ㅋㅋ 근데 액션이 좀 ㅋㅋ 창의 달인 이 달인 같지는 않았슴 ㅋㅋ  
20171203,6,비급영화같더라니주인공 개사기캐ㅋㅋㅋ한국판 람보급  
20171203,1,하 이영화 20분도안보다가 껐네ㅋㅋ 황진기가 줫나 비실비실하네 황진기 황소도 던질정도로 장사에다 근육돼지였는데  
20171203,1,액션마저도 개연성이 없다  
20171203,2,진짜 머같은액션이네퓨  
20171203,1,1점도 아깝다. 보다가 포기한 2번째던가..3번째 영화..  
20171203,1,제목하고 내용하고 불일치. 어설픈 액션은 80년대초반 홍콩액션모방같지만 재미도없음  
20171203,1,이것이바로 영화관람객에대한 역모-반란의 작품이다!  
20171203,1,킬링타임용이 아니라 정말 시간을 죽였다  
20171203,1,진짜짜증난다ㅋㅋ배우들만개고생했을듯  
20171203,1,관람객혹시나  했더니 역시나..  
20171203,1,찰영기법 너무 수준 낮아요 재연드라마나 에로영화 에서 많이 본 구도 에요  
20171203,1,"그냥 월화,수목 드라마 스케일이랄까?  "
20171203,1,오글거려서 볼수가 없다.  
20171203,1,창의 달인이라면서 창을 붕붕 휘두루는 장면도 없고 둔기도 마찬가지... 좁은 통로 시퀀스는 그 장소적인 강점을 살려서 액션을 짜야하는데 그딴것도 없음.. 주인공은 포졸 방망이를 싫다고 징징 댔으면서 바닥에 널린 칼 안줍고 방망이랑 맨주먹으로만 싸워..  
20171203,1,이게 영화가..? 조주연들 발연기에 시나리오 연출 모든게 개판  
20171203,2,이런 사극 은 잘만들면 정말 재미 있고 관객들의 호평도 엄청나게 받지만 반대로 못만들거나 어중간하면 재미도 더럽게도 없을뿐더러 욕만 오지게 먹죠...해서 사극은 결코 만들기 쉬운게 아닌데 이건..아무래도 후자 같네요  
20171203,2,내용무 주인공불사 나쁜왕이 이긴 듯  
20171203,9,검선의 회복력이 너무 좋아 경의롭다.액션은 멋짐.죽이고 ..또 죽이고..  
20171203,5,"관람객배우들의 연기는 훌륭하고, 액션신도 좋았으나, 전체적인 줄거리가 아쉬운 영화  "
20171203,10,진짜 난 너무 재밋게봤다 굿굿 ♡♡ 정해인배우님 짱  
20171203,10,클레멘타인을 뛰어넘는 희대의 개명작 이영화를 보지않으면 나라를잃은거와 같은 인생을 사는거와 같다  
20171203,1,"시간 아깝네요. 캐릭터들의 매력도 전혀 안나오고, 내용이 드라마틱한것도 아니고..  "
20171203,1,로버트태권브이인가...일당백을 넘어서는구나...ㅋ  
20171203,2,"칼에 찔리고  창에 찔려도 멀쩡한 주인공 ㅡ.ㅡ;;  죽이는 건 뒤에서 다른 사람이 뒤에서 활쏘고 왕이 직접 검들고 죽이는데.. 주인공은 ""검선?"" 이건모야... 청주에서 살던 이인좌는  서울말씨, 이인좌가 규합한 세력은 영남권인데 전라도 사투리...  "
20171203,1,"감독의 연출력 정말 대단하다. 나무몽둥이 하나로 수십명의 칼잡이들을 해치우고, 이인좌의 탈출을 예상했다면서 주인공 혼자만 막으라고 보내는 설정. 개다가 액션영화가 이렇게까지 지루하기도 힘든데... 수고많았다 감독아. 이제 은퇴하자.  "
20171203,3,스케일이 너무작다  예산이 없으면 있는것처럼 보이게 만드는게 감독의 재량인데 ... 액션도 좀 별루구 시간떼우기도 좀  안된다 미안하다  
20171203,4,딱 ocn에서 나올 영화다.사극을 무협영화처럼 찍으러 노력했는데 상업영화이면서 재미가 너무 없다.그리고 왜들 그렇게 연기를 못하냐? 얼굴만 반반하면 배우가 되는줄 안다.  
20171203,1,혹시 영화미옥감독과  중국에서 동문수학 하셨나요  
20171203,8,재미있게 봤습니다. 그런데 검도 수련자 입장에서 보는 칼싸움이 너무 현실성이 떨어져서 좀 그랬네요. 실감나는 액션이면 더 재미 있었을듯..  
20171203,1,와...ㅋㅋㅋ 리얼이 더재밌더라...ㅋㅋㅋ  
20171203,1,일반적으로 배우들이 시나리오와 연출에 숨어버린 영화 입니다. 뭐...라임이 죽어버린 영화 라고 해야할까 영화찍는 내내 수고하신 분들에게는 죄송하지만.마치..처음 영화찍어보는 마치 대학교 동아리 학생들이 영화 만든듯한..이분위기는 처음 겪어봅니다  
20171203,1,주인공 조 낸 악만쓰며 똥폼만잡다끝나는영화 그리고 피튀기는씬이 다  cg다진짜 기도안찬다~  
20171203,1,이영화가 역모 그 자체다.무술감독님 고생하셨습니다. 겁나 바쁘셨겠소이다.  
20171203,1,오랜만에 즐잠했습니다 감사합니다  
20171203,1,진짜 연출이나 대본이나 유치하다... 이거제작비얼마나든거냐?쓰레기네쓰레기.. 어이가없다 이렇게 집중도떨어지는영화도 진짜 오랜만이네 개같은거 ㅋㅋ  
20171203,8,역사는  승자의 기록이야~  
20171203,1,돈주고는 커녕 다운받아볼 가치도 없음  
20171203,1,2017년 최악의 영화였습니다.  
20171203,1,"왜 망했는지 알겠네요, 액션치고 이렇게 졸린 영화는 처음  "
20171203,1,주인공이 죽었으면 좋겟다고 생각되는 영화는 이영화가 처음이었습니다. 진심 해도 너무 한다는 생각이 드네요. 배우분들은 고생하셨을지언정 스토리는 안타깝네요.  
20171203,1,심각하다 심각해 나무몽뎅이로 칼을 다 직이쁘네 장풍은 왜안쏜다요  
20171203,2,"초반에 왜 방망이 들고 싸우는지 설명좀 해라, 그냥 칼들고 싸우지 뭐냐 유치하게  "
20171203,1,"중2병 주인공.. 마지막에 ""니들이 먼저 날 거드렸자나"" 시전하는데 내인생 중 한시간 삼십분이 증발해버렸다  "
20171203,1,ㅎㅎ 제목 값하네 관람객에 대한 역모다.  
20171203,1,올해 최악의 영화드라마에 자주나오는 연기자들 모아서 일일드라마 수준 보다 못하게 만들었나 싶다  
20171203,1,"영화 중반까지 보며 느낀점은 ""칼좀써"" ""칼좀뺏어"" ""칼좀주워""  방망이 오지게 좋아하네 그럴거면  어우동을 보겟다  "
20171202,1,하품하다가 잠듬..대단한 영화  
20171202,1,액션신은 많은데 이렇게 몰입 안되는 액션도 오랜만이네 하하  
20171202,1,스토리도 약하고 주인공 혼자찍는영화의 킬링영화주인공은 왜이렇게 불사신인가..대사도 간혹 오글..  
20171202,1,감독  제정신이냐?니  앞으론 영화찍지마라감독 배우 모두 꽝!  
20171202,1,너무 재미 없습니다   뭐지 이영화  
20171202,1,니가 수고가 많았구나!  참 시나리오 후지다!!! 끝까지 참고 봤는데....  
20171202,1,아...  힘들었다...  
20171202,1,사이보그인줄...칼 수억 맞아도 안 죽음!!  
20171202,3,내용하고 전투씬 비율이 아쉽습니다. 내용이 너무 부족했던것같네요  
20171202,1,이거마이너스  점수못줌!액션이 죄다슬로우모션에  결제해서보다기  욕나옴  
20171202,10,관람객정말 재미있었어요!!  
20171202,4,"■ 피튀기고 싸운다고 영화가 흥행하지 않는다~ 내용이 부실하고, 박철민이 자살하는 상황, 구마적이 아들을 안 챙기고 이인좌한테 뜬금없이 덤벼서 죽는 상황 등이 황당할 뿐~ 액션은 좀 볼만해서 4점 준다~ ■ 박푱시기는 밥은 먹고 다니냐? ㅋㅋㅋ  "
20171202,1,평점보고 볼까말까 고민하는분들 진심으로 제끼세요 혹시나싶어서 볼생각도마세요 제가그렇게당했읍니다..  
20171202,10,나도 당할수없다. 꼭 봐서 현타오길 바란다. 꼭 봐라. 돈이 썫어나는 자들이여  
20171202,10,관람객무협만화를 실사로 완벽히 재현한 연출에 한표~게다가 잘생긴 주인공이라니~^^  
20171202,10,난 한마디로 재밌었다. 새로운 역사도 알겸.실화를 배경으로만든 역사 영화는 그 나름의 깊이와 맛이있음..단순한 액션만 바라는 단순한 사람들은 이영화 안보는게 낫다.  
20171202,5,충무로와 헐리우드의 연기력 차이는 아역들 연기력만 봐도 알 수 있음. 아직도 국어책 읽기네  
20171202,1,작정하고 iptv용으로 만든듯  
20171202,1,15분 보다 더 견딜 수 없어 껐음. 다 못 봐서 뭐라 평을 적을지...  
20171202,1,ㅋㅋㅋ 이딴것도 영화라고.  
20171202,10,난 다운받아봤지롱 ㅋㅋ 시간때우긴 괜찮음 . 정해인 혼자 OO짓하다 끝남 .객끼오짐  
20171202,6,배우들 연기는 좋은뎅..전개가..별루..액션씬 많은건 좋은디..차라리..액션이라도..제대로 하징...스토리 분위기는 흥미로우나...너무 폼만 잡은듯..전체적으로 허술...배우들아꿉..  
20171202,1,이거 보면서 주인공으로 나오는 배우가 현실에서 돈이 아주 많을 거라 생각되었다. 중2병 걸린 애가 돈 내고 영화 찍으면서 자기 한풀이 한거 같네.  
20171202,1,ㅋㅋㅋ 설마 다음에 이러는 건 아니겠지 하는 설마가 마빡을 치게함  
20171202,1,알바가 많나보네 비공감이 뭐저리 많아  정말 재미없네요  
20171202,1,평가하는 시간도 아깝내 ㅋㅋ  
20171202,2,스토리 없이 그냥 전투 전투 전투!  
20171202,5,영화가 평과는 달리 재미가 있어 왜 욕을 먹나 했더니 잘나가다 마무리가 이상하내 주인공을 람보로 만들기에는 숨겨진 설정이 설득력도 없고 아쉬운 영화내  
20171202,10,박철민은 주연인데 분량은 단역급임 ㅋㅋ  
20171202,1,음 어설픈 홍수아 연기  얼굴은  중국극에  나올 얼굴이고  스토리도 없고   무슨 영화를  이렇게   만들었을까?   홍수아 여주로  쓴게  그냥 망하자는듯 ㅋㅋ  
20171202,6,개인적으로 평점 6.5정도가 맞다고 생각합니다. 영화 내용보다는 보여주기식 액션이 너무 많습니다. 스토리나 액션의 흐름이 발전되었으면 좋겠네요. 영화를 제작하시는데 수고하셨습니다.  
20171202,1,답답하다. 참답하다. 감독 어떻게 나한테 이렇수 있어요~~  
20171202,9,그래도 가성비는좋다 저예산에 이정도면 그냥 무협액션보다 갠찬네  
20171202,2,남주인공 연기력 딸리고 스토리도 빈약하고 어설픈 액션에 총체적 난국일세  
20171202,1,0.5가 없다는게 아쉽다  
20171201,1,이게 펀딩 된게 신기하다.돈을 갖다벌릴려면 나에게 주시라.. 참 드라마 보다 못한 영화는 정말  어이가 없서 말이 안난온다.vip 급이다.  
20171201,7,스토리 빈약... 연출 빈약...  연기력은 다들 좋군... 저예산 영화인게 티가나... 조금 더 했으면 좋은 작품 하나 나올법한 내용이고 액션신이될텐데... 나름 볼만했고... 나쁘진 않았음.. 액션신은 맘에듬... 1점대는 라닌데 ㅡㅡ 7점대는 됨  
20171201,10,뭐여? 조산판 람보여?  
20171201,1,시작부터 끝까지 피 나오는 장면 겁나 거슬리네... 감독님 GG요^^  
20171201,1,얼마나 망작이면 벌써 토렌트 풀렸냐 ㅋㅋㅋㅋ  
20171201,1,홍선아 지금이라도 그냥 기술배워라  
20171201,5,관람객그냥 볼만한정도 에요 그냥 그래요  
20171201,1,주연이 조연에게 연기력이 파묻혀서 영화에 집중이안되었음  
20171201,9,관람객정해인화이팅 역모화이팅!!  
20171130,5,"현빈 주연의 ""역린""과 비교가 되었다. 영조 와 정조 때의 역모를 중심으로 하룻밤의 이야기. ""역린""에서는 악과 선의 현빈측과 조정석측이 비슷한 비율이었던거 같은데 ""역모""에선 이인좌의 씬이 차이나게 적었던거 같다. 좀 더 부  "
20171130,1,"믿고 보는 조재윤,박철민....이 있는 데도 카바가 안쳐진다....  "
20171130,2,어째 스토리나 구성이 이렇게 허접할 수가... 진중한 내용에 느닷없이 사투리를 쓰는 칼잡이들... 칼에 맞아 피가 튀는 것도 어설픈 CG... 주인공의 초인적인 파워도 어느 정도는 짐작했지만 넘 과하고... 코골며 자는 관객이 이해가 가네요~~  
20171130,2,"숨겨진 역사적 상상력, 감동적 드라마 그리고 긴장감 넘치는 한 밤의 역모....를 표현하려 한 것 같지만 이것저것 섞어 넣는 바람에 모조리 실패한 채 배우들의 연기만 아까울 뿐인 영화. 총체적 난국.  "
20171129,1,이런 x같은 식상한 영화좀 만들지마라...돈이 썩어나냐?  
20171129,9,정해인씨와 다른 배우들의 액션이 눈에 띄네요! 대역없이 배우님들이 직접 연기하셨다던데 정말 대단하신거 같아요~ 평소에 액션영화는 즐겨보지 않는 편이지만 재밌게 봤습니다^^  
20171129,6,"관람객맞아요.  색감, 배경, 등장인물에 맞는 캐스팅에도 신경을 많이 쓰신 것 같아요.  아쉽지만   무협, 게임, 저예산  세 단어 만 떠오릅니다.  "
20171129,10,"솔직히 재미있게 봤다.  빠르게 흘러 가는 스토리가 시원시원해서 좋았고, 액션이 많아서 지루할 틈이 없었다. 다만 중간중간 검에 튀는 스파크나 인위적으로 튀는 피가 몰입을 깨뜨려서 아쉬웠다.  "
20171129,1,빵점은 없냐... 아까운 내시간...  
20171129,1,이런걸 극장가서 보는 용기에 박수를 보낸다  
20171129,10,역대급 재미있었어요 ㅎㅎ 불면증을 고쳤어요  
20171129,1,이건 뭐 관람객 상대로 사기 수준인데.... 차라리 캐첩을 쓰지 그러세요?  
20171129,7,피가 가짜피로 보여서 거부감 없이 좋았습니다 활 전투 2대1 씬은 정말 긴장감 있게 가다가 주인공이 2미터점프하는거 보고 헛웃음이 났고 감독님이 게임 같은거 좋아 하나봐요  5인방 부터 2인자 보스 차례로 격파 ㅋㅋ 그리고 홍수아 칼질하기전 기압소리  
20171128,10,나름재밋습니다. 킬링타임용  
20171128,8,액션사극이란 장르를 잘 몰라서 스토리 얘기(?)가 많이 나오지 않아 조금 의아해했다. 중간에 아 맞아 이거 '액션'영화였지 하고 깨달았을 만큼 배우들의 액션은 정말 좋았다. 액션이란 장르에 호감을 가지게 해준 영화. 마지막으로 정해인도 정말 짱이었다.  
20171128,1,최악이에요... 예매하셨다면 취소하고 다른거 보시길...  
20171128,10,"액션이 탄탄해서 화려한 액션씬들 보는 맛이 쏠쏠했고, 역사는 승자의 기록이라는게 느껴졌어요연기파 배우님들 출연에, 모두 대역 없이 연기하셨다고해 정말 기대하고 봤는데 기대 이상으로 재밌어요! 특히 정해인 배우님 신인답지 않은 액션 연기에 반했네요..  "
20171128,1,"하~ 말도 안돼는 설정에 , 개연성없는 전개 , 이야기는 없고 의미없는 액션몸짓만 존재하는 기가막히는 영화 찍느라 고생한 스텝을 위해서 1점 준다  "
20171128,1,열받네...감독이 누군지 모르고 제목만 봄...  
20171128,10,엑션신에 심혈을 기울인듯한 영화보는내내 무협만화속으로 빨려들것같은느낌이었음..두번 세번은 더 봐야할영화  
20171128,10,수면방보다 가성비가 좋아요!  
20171128,9,남한산성에 비교하면 최소한 지루하지는 않는다. 오랜만에 본 시대극 액션영화  잼있고 신선했다.  영화가 좀 더  길어서  더 표현 할 시간을 주면 어땟을까?  
20171128,8,cg가 다소 어색하지만 극 흐름에는 방해되지않고 오히려 무협만화와 실사가 만난거 같아~신선했습니다.다른걸 몰라도 정해인의 20OOO 기대되네요..ㅎㅎ  
20171128,2,이건 실화다. 부산 아시아드CGV  영화시작전에 관객 50여명 있었다. 맨 앞자리에 앉았는데 끝나고 뒤돌아 보니 아무도 없었다. 이건 진짜 레알 펙트다.  
20171128,1,내용도없고 돈아까웟음  
20171128,9,관람객액션사극으로 재미있고 지루하지않음  
20171128,1,도무지 감독을 이해할수없다 어린이드라마도 이보다 말이 될듯  
20171127,1,불사신ㅋㅋ 주인공이나 홍수아나ㅋ  
20171127,7,배우들의 액션연기가 돋보이는 영화같아요 이인좌의 난에 대해 새롭게 알 수 있어서 좋았어요!  
20171127,3,정해인이 내가 주인공이요 하는 영화~~절대 죽지도  아프지도 않은가보다영화 별로임..ㅠ  
20171127,1,아... 뻔한 스토리에 유치한 액션까지 하...  
20171127,5,처음부터 끝날때까지 피만 튀기는 영화..심지어 옷에 묻지도 않아..주인공은 베어도베어도 죽지않는 불사신영화..  
20171127,10,"화려한 액션과 주연 배우들의 연기력이 인상적인 영화!대역도, 와이어도 없이 촬영했다고는 믿겨지지 않을 만큼 액션의 퀄리티가 남달랐습니다!!중년들의 엑소 김지훈 배우와 라이징 스타 정해인 배우의 연기 또한 일품이었습니다꼭꼭 보세요!!  "
20171127,9,평점 테러알바들은 왜 존재하는거지요...? 크게 다른영화에 미치지도않을거같은데..  
20171127,7,솔직히 걍 액션씬뿐이긴 함 액션씬 전까지는 졸다가 내가좋아하는 액션나와서 끝까지 봄 단체관람했는데 다들 재미없다고하긴 하는데 난 쏘쏘했다 최근봤던 사극 ‘남한산성’에 비하면 대작이여;  
20171127,10,"적은 예산임에도 알찬 내용이었습니다! 화려한 액션들과 그 안에 소소한 재미,그리고 반전까지!무엇보다 결말이 맘에 들었습니다.시간가는 줄 모르고 재밌게 봤네요. 배우님들과 스탭분들이 많이 고생하셨다고 들었는데 그 결과물에 모두 담겨져 있는 영화입니다.  "
20171127,10,재밌었숩니다!!!!  
20171127,1,알바들 평점 내용은 티가 확~~납니다. 절대 속지 마시길~  
20171127,10,지금 이시대를 대변하는  최고의 작품입니다강추드립니다  
20171127,10,배우분들의 화려한 액션 연기는 눈을 즐겁게 했고 긴장감을 더하는 웅장한 음악들도 귀를 즐겁게 해주었습니다. 신인 정해인 배우님의 패기 넘치는 모습과 배우분들의 탄탄한 연기가 조화를 이루어 어려움과 한계를 열정으로 극복하는 모습을 볼 수 있었습니다.  
20171127,9,"어제 영화 봤는데 간만에 액션사극 멋지게 봤습니다영화는 액션이지, 말이 필요없다시간 잘가면 성공한 영화~~  "
20171127,10,"개봉 전 부터 매일 기다려지는 영화만큼 개봉 후 영화를 살펴보아도 정말 손색하나 없을 정도로 완벽한 영화였습니다. 영화보러 두 번이나 보러 왕복 4시간을 다녀오게 만드는 흥미진진한 스토리,  앞으로 계속 보고 싶은 장르로서 인생영화가 됬습니다.  "
20171126,10,진짜 요분기 본영화중에 젤 뜻깊고 감동깊은 영화네요 저예산으로 이정도 영화면 진짜 대단한거 같습니다 제가 좋아하는 액션도많고 꼭보세요 역모짱!!!  
