0,1,2
20190119,2,티비 드라마인줄.. 게다가 재미없는 시청률 한자리수 대의 사극보다 못하다. 재미가없어 볼수가 없다  
20190117,2,최악입니다 칼들고 참나  
20190115,1,아 이거 양심없네 내 문화생활  시간을 낭비하게 만들었어ㅠㅠ  
20190104,2,"쓰레기. . , . . , ,  "
20190104,4,복잡한거 싫어 하는 사람에게는 추천  
20190104,1,"연출, 영상미, 배우, 각본 전부 드라마처럼찍었네.  "
20190104,1,티비로 봤는데도 끔찍하네  
20190104,1,뭔 영화가 이렇게 기승전결이 없냨ㅋㅋㅋㅋ  
20190104,1,하아 댓글 보고 볼껄지금19년인데  
20190104,4,"영화전개 방식1.주인공이 적을 만남.2. 주인공 팔,다리 같은곳에 상처입음.3. 사무라이 닌자 빙의해서 적 죽임.4.1~3 무한반복  "
20190104,2,정해인 투피엠 준호인줄  
20190104,1,장난 평범 빼면 평점이 1도 안 나오겠네...  
20190104,1,오...ㅋㅋ대박.. 이게 뭐여  
20190104,1,와.. 이걸 극장에서 본 사람들 불쌍꼬르티브  
20190104,1,클레멘타인이 없었다면 그자린 니꺼였어  
20190104,1,정해인 몰아주기 영화임?촬영 기법도 이상하고 피튀기는장면이 CG...이런 영화은 왜 만들지? 왜 출연하고 왜 투자를 해주는거지?  
20190104,1,이런 영화는 왜 만드는거에요?  
20190104,2,티비로 보는데 .오인방 달인이라는데 싸우는건 막싸우네.주인공은 포졸 을 입에 달고사네.수술할 방법이 없던 시대에 칼 맞고 어떻게 삶.특히 항생제도 없고영화 넘 허접하다.  
20190104,1,재미가 엄청 없나 보내요....  
20190104,1,아... 이건아니지!!!  
20190104,2,상세한건 김스카이가 가져올때까지 기다리자  
20190104,10,암이나았습니다.십자  
20190104,10,정해인 정해인~♡ 지금 티비에서 하는디 정해인 멋지네~♡  
20190104,1,개 잼없다 팝콘 콜라 오징어 값 물어내라ㅡㅡ  
20190104,1,근데 이런영화 보면 문득 궁금한게배우들은 예상이 되지 않을까아 이거 망할 삘인데 이런거?발 빼는 방법도 없을거 아녀필모그래피에는 그대로 남고  
20181231,1,정말 이런 OOO기 영화는 영화산업에 저하를 준다.  
20181229,2,정해인은 있고 내용이 없네. 정해인은  이영화 왜  찍었을까. 액션도 이런액션이 없네. 어이가없네. ㅎ  
20181223,6,액션씬은 나름 괜찮았다 보지만 스토리는 너무 개연성이 없었어요..  
20181223,3,6/9 전에 내가 평가했던게 결코 틀리지 않다는걸 보여주는구만 싸우는 장면 좋아하긴 하는데 이렇게 의미없이 싸우기만 하는건 좀 아니지  
20181223,1,홍수아 명치에 칼 맞고도 잘 씨부리는 장면 보고 그랬다. 쟈는 주댕이만 다친 것 같네. 정해인은 목소리부터가 내시.  
20181223,10,최고의 코미디 영화.마지막에 내시가 양산을 임금한테 기울이지 않고 지혼자 쓰고 있는 장면을 보곤 2분동안 웃기만 했다.영화사에 길이 남을 명작 중 명작.  
20181222,1,최악입니다. 정말. 최악입니다.  
20181222,1,궁금해서 그러는데 이거 왜자꾸 실시간검색어 올르냐 뭐있어?  
20181222,1,궐내침입한 역도들이 너무저능아들이라서 한숨밖에 안나온다..  
20181222,2,내가 본 영화중 최고의  졸작  
20181222,1,제발 사극 영화에 성괴들 좀 캐스팅 하지마세요.. 아오... 몰입도 안되고... 영화 자체도 그냥... 어이가 없네요...  
20181222,1,철퇴의달인이 철퇴로 항아리깨부시는데 정말놀랬음  
20181222,2,이게영화야 단편보다 악질이네 스토리도 엉망. 먼 주인공은 터미네이터네 참  군도를배겼네  
20181222,2,영화가 신선하다. 일본 사무라니 영화흉내내다 말아먹은 영화 ㅎㅎㅎ  
20181222,2,뭐냐.. 지루한 육박전..  
20181222,1,먼영화여  ㅋㅋ이런 영화찍을라고 투자받았으까이  
20181222,2,뭐야이게 하면서 계속보다가 그냥끝.  
20181222,1,평점 3.92 실화냐?  
20181222,2,헤헷 2점 줬다 올해 착한일 끝 ㅎㅎ 천국가겠다  
20181222,1,살다 살다 이런 영화 처음 봤음.. cgv 채널에서 요즘 매일 한번씩 틀어주는데 미치고 팔짝 뛰겠음 ㅠㅠ  
20181222,8,그나마 눈요기로 보기는..  
20181222,1,영화가 그정도로 거시기한가요?채널 돌려야지..  
20181222,1,아....이런걸 영화라고 찍냐  
20181216,1,이거 모냐어디서 영화를 설렁설렁 만들어  
20181215,1,TV로 봤는데 처음에는 드라마인줄알고 잘만들었다했는데 영화였음 ㅡㅡ  
20181215,10,뒤늦게 봤지만 멋진액션 좋네요  
20181214,1,Ocn 으로 방금 봤는데 이건뭐  스토리도  이상하고  내용도 없고  그냥  싸우다볼일다보고  누가 착하고  누가 나쁜놈인지도  모르겠고 ㅋ  그냥  출연진들 좋아서 봤는데  걍  돈주고는 못볼영화  평점 10점주는 인간들은 알바인가 싶음  
20181214,1,하 남편이 보길래 얼떨결에 같이 봤다가 둘이 헛웃음만... 아니 차라리 전투만 하든가 웬 오글거리는 개똥철학 나열에 허무한 결말ㅋ 창궐의 진한 향기가^^;;  
20181214,1,오랜만에 시간이 아까웠다  
20181214,10,나만 ... 보기.. 아깝구나...  
20181214,6,김지석과 정해인의 강한남자 액션신을 본것만으로도 시간이 안아까웠어요  
20181214,1,너무 아쉽다 정해인을 띄울게아니라 왕과 모반자에게 더초점을 맞췄어야하고 인물과의 관계가 너무어설퍼 싸워도 극적인게 없고 대사도 오글거리고  
20181214,1,고작 항아리 깨부시면서 철퇴의달인이라고 소개하는거 개웃기넼ㅋㅋㅋㅋ나도 하겟다 야  
20181214,8,술한잔하며 가볍게 즐기기 괜찮았음 요즘사람들은 한두시간 여가에 너무 큰의미를 부여하려는거 같아 안타깝다..  
20181214,1,뭐냐고..이게...  
20181214,1,이거 진짜 길이길이 남을 망작이내...  
20181214,1,정해인의 발연기 잘 보았습니다  
20181214,1,이거 뭐여... 이게 뭐여... 이게 뭐냐구!!!  
20181214,1,Tv 틀지말고 공부했어야 했다.  
20181214,1,쓰레기 만드느라 고생했네 다음에는 무협 소설이나 만들어  
20181214,1,근데요 저 진짜 궁금한데 어떻하면 영화감독 해서 이렇게 개봉영화 를 만들수 있어요 저 진짜 이런스토리 로 하면 두달에 한번씩 한작품 내놓을수있는데  저도 영화감독하고 싶어요 아이디 엄청많거든요  최고 배우들 데리고 이런영화 만든다면 나도 할수있어요  
20181214,1,저 지금 ocn에서 하는거보고잇는게 이게 먼수작이에요 이영화  
20181214,10,최고 최고 나만 당할 수없다  
20181211,6,김지훈 칼뺏는거 멋있어서 3점  
20181211,1,차라리 김지훈을 주연시키지. 정해인은 너무 안어울린다. 내시급이네.  
20181211,1,고문용으로 좋은자료...  
20181211,6,감독이 과정과 결론을 검객의 道가 아니라 宮의 암투와 장예모의 영웅과 같이 갈등에 집중했다면 주제를 더 살렸을지도···액션은 비주얼이다 코믹이나 화려한 촬영 그것도 아니라면 압도적 캐릭터라도 있어야한다. 주연 캐스팅이 묵직했으면 그나마 좋았을뻔했다  
20181211,1,보는 나야 속았어도 욕이나하겠지만 이영화 돈부은 사람들이랑 감독은 서로 잠이 안오겠다.영화내용  끝에 사자성어가  가짜를 끌어내리고 진짜를 세우겠다던가?ㅋㅋㅋ  
20181211,2,영화계의 막장드라마 완전 지렷다  
20181210,2,"이 영화 작년에 나온거에요?!!?!?!?아씨발꿈치처음 보는 거길래 시간내서 봤는데,영~ 에휴말을 아끼렵니다  "
20181210,1,이게연기냐?발연기 최고봉ㅎㅎㅎ실제상황배우들이나와도 이거보단잘하는거 같다  
20181210,1,댓글보면서 보니까 너무 웃김. . 지금 주인공 죽었어야되는데. . 미치겠네. . ㅎㅎ  
20181210,1,너무 하잖아 한국영화 수준이 얼마나 높은데 너무너무 창피하다ㅠㅠ  
20181210,1,2018 년 12월10일 11시30분...난 ocn에서 이영화를 보고 토했다  
20181210,2,한국영화..돈주고..안보는 이유  
20181210,10,나도..당했다...  
20181210,4,역시 역모는 즌라도지라이~~  
20181210,2,김지훈이정말잘생겼구나..정해인보다가 보니까  
20181210,1,OCN에서 보다 어이없어서 점수주러옴..댓글보고 빵터짐.큰웃음주는 영화!  
20181210,4,리뷰가 더 재밌네ㅎㅎㅎ  
20181210,1,간만에 개막장이 또나오네 제발 이딴거 만들지마라 처음부터 칼로 싸우지 나무막대기로 싸우다가 사람 한명 OOO 열받아서 칼 맞아도 다 죽이고 억지 울음바다 만들었다가 쳐 후회하고 복수한다고 혼자 초싸이언 되서 다 처리하고 개 말도 안되는 스토리 진짜 아  
20181210,1,내가 올해한 일 중 제일 잘한것은 이 영화를 ocn으로 보게 되었다는 거다. 더 잘한 것은 중간에 보다 평점구경하고 채널 돌렸다는 거.  
20181210,10,수없이 칼에베어도 죽지않는 불사신역시 주인공이야  
20181210,10,수없이 칼에베어도 죽지않는 불사신역시 주인공이야  
20181210,1,액션씬이 목적인 영화인데 액션이 너무 지루함.  
20181210,1,액션부터 점수줄수가 없네...  
20181210,2,조선제일검이 아니고 조선제일방망이 아님?ㅋㅋ  
20181210,1,엉성한 연기에 답답하고 말많은 주연 연기 갑갑해  
20181210,10,평점실화냐 3점대는첨보네 아무리개막장뜨릴러악숀두롸마도 6점은받던데 ㅎㅎ 안본입장에 그냥10점주고갑니다 이게뭔의미가있겠냐만  
20181210,2,이 영화는 제목 그대로 한국 영화의 역모다.  
20181210,1,"....!?!?,?  "
20181209,1,ㄱ ㅐ 적같은 영화.  내 인생 최악의 시간을 보냈음.  
20181208,1,티비 단편 드라마 수준의 영화를 돈주고 보는 겁니다.  
20181208,1,1점도 너무나 아까운 영화  
20181208,1,제평생 최악의 영화.부끄러움  
20181208,1,OCN에서 해주길래 보다가 채널 돌렸습니다.주인공 좀 패하면 수련하고 다시 도전해야지쓰러져도 계속 쫓아가서 싸우는건 무슨 줄거리임?딱 오락실에서 동전 계속 넣고 보스 깨는 게임 영화임  
20181208,1,자매품 성모 - 발암의 시대  
20181208,1,너무너무너무너무너무너무 재미가 없었어요  
20181208,6,무료한 시간보내기에는 괜찮았음. 정해인 얼굴보는 재미 ㅋㅋ  
20181208,2,이영화는 연출 자체가 엉망.. 스토리도 억지스럽고 유치함.. 무슨 만화영화 보는듯 했음..  
20181208,10,응 정해인..ㅋㄷㅋㄷ  
20181208,1,"액션,슬픈 장면 실실 보여 주다가 결국은 한녀들은 위한 보르노 한녀들이 한국 문화를 망치고 있다 무조건 그놈의 사랑,키스,유사 섹스 장면 없으면 안보는 개돼지 지방 보따리 보르노 한녀들!  "
20181208,4,조선판 다이하드를 만들고 싶으셨나 봐요...ㅎㅎ  
20181208,1,조재윤 같은 좋은 배우 데리고 무슨짓이냐...  
20181208,2,손 the guest 감독님은 스릴러만 갑시다.  
20181208,1,OOO기...진짜 비추다  
20181208,1,감독의 중요성을 알겠다  
20181208,1,한국은 1이라는 숫자를 좋아하지  
20181208,1,일단 미스캐스팅이 가장 큰 문제다 어딜봐서 조선제일검 처럼 생겼나? 한국영화의 현실ㅜ  
20181208,1,출연진보고 봣는데 이런 못 피했네 이제 감독도 보고 피해야지  
20181208,1,"정해인은 조선제일검이 아님,,, 별로 잘하는것 같지도 않은데 절대 안죽어,, 왜 싸우는지도 잘 모르겠어,, 처음부터 끝까지 싸우고 그냥 내용이 없어,, 아까운 내 두시간,,,,  "
20181208,1,아 드럽게 재미없네 ㄹㅇ  
20181208,1,ㅅ수후수스숫ㅅㅅㅅㄴ  
20181208,1,이 영화볼돈으로 종이비행기 만들어 날리는게더 재미있겄다2점도 아까운데 0점을 못주니 ㄷㄷㄷ  
20181208,1,0점 어떻게 주나여?ㅠㅠ 가르쳐주3  
20181208,10,그건 그렇고 뚜래주르만원권 1212원 실화??확인 >>http://yatag.me/t5nd6s73vd  
20181208,1,개유치하네 진짜 쓰레기영호ㅡ닠ㅋㅋ  
20181208,1,이걸 영화라고ㅋㅋㅋㅋ 아 웃겨ㅋㅋㅋ  
20181208,1,진짜 보지마세요...  
20181208,1,ㅠㅠ너무 나가셨다..  
20181208,1,"정해인이 출연한다고, 다 흥행하는게 아니었어  "
20181208,2,정해인이 영화찍을급은 아니지?바로앙혓네  
20181208,1,진짜 스토리 배우연기  머하나 다쓰레기더라 보는내내시간아까워 죽을뻔 진짜 돈이 아까워서 볼려다가그냥 나왔다  
20181208,1,감독님 실례지만 지금 어디세요?  
20181208,1,OCN에서 새로 나온 드라마인줄 알고 봤는데... 망했구나 싶었다... 그런데 이게 영화라는걸 안 순간 돋됐구나 싶었다...  
20181208,2,우리나라는 영화가 점점후퇴하는듯 싶다  
20181208,10,왜 다들 반응이 별루지ㅋㅋ진짜 재밌는데ㅠㅠ전투씬 넘나 머싯..♡♡  
20181208,1,평점 1점 주기도 아깝다  
20181208,1,이건 아니다 이건 아니야  
20181208,2,재미없네요 ..  군도 보는게 훨씬 몰입되고 재미있네.  
20181208,1,영화에 똥을 묻혀놨네요  
20181208,10,난 액션영화 좋아해서 재밌게 봤는데  
20181208,1,실화라서 더 감동적 이네요 제 인생 영화가 아닐까 합니다. 물론 8분 보고 껐습니다.  
20181208,2,각궁의 달인 철퇴의 달인 창의 달인 그리고 생활의달인  
20181208,1,최고의 영화 입니다. 꼭 보세요~  
20181208,4,안봤지만 평균점수로 참여합니다.  
20181208,1,사극이 재미없기도 힘든데... 그걸 해냅니다  
20181208,1,이영화를 보고 불면증이 치료 됐어요.  
20181208,2,차이나 타운(잭 니콜슨 주연 차이나 타운이 절대 아님)도 있었지.차라리 어릴때 극장에서(애국가&대한 뉴우스 끝나면)해주던 30분짜리 반공드라마 배달의기수가 더 재미있었던거 같다.이게 역사물이라면 브레이브하트나 글래디에이터는 외계인이 만든 오버테크놀로지  
20181208,4,예산은 변명이 되나 스토리는 변명이 어렵다  
20181208,10,정해인 넘 조아~~♡♡♡  
20181208,1,역모 재앙의 시대가 핵꿀잼  
20181208,4,핸님 고생하셨습니다 ?  
20181208,10,3만명뭐얔욱엑욱엑윅읙익  
20181207,3,제일검이 제일검같지도 않고... 현실적인 검대결을 생각하는건 알겠는데.. 검동작은 거의 두가지.. 휘두르고 뒤집어서 휘두르고.. 갑자기 왕내면 얘기가 나오더니.. 진짜 어려운 영화인지.. 어술픈 영화인지 감이 안잡힘..  
20181207,10,"마지막 이인좌를 죽이기전에 김호가 말한다. ''이보시오! 그만하시오~!!!!"" 내 이 영화가 끝나기전에 감독에게 말하고싶다. ""이보시오~!!그만하시오~!!!!""  "
20181207,1,진짜 재밌네 꼭 보세요 진짜루  
20181207,10,정해인배우님은 천의 얼굴이네요^발성도 좋고.. 목소리는 정말 타고 나신듯~ 배우하기 좋은 목소리네요.  
20181207,7,액션씬은 볼만했는데 주인공이 불사신이네 ㅎㅎ 그런데 홍수아 얼굴은 나올때마다 바뀌는거 같아.. 출연진 보고 알았네 ㅋ  
20181207,1,시공간이 오그라듦...꿈에 나올까봐 겁나네...  
20181207,1,정해인님 정말 좋아하는데 수염이 너무 안어울려요..  
20181207,1,때깔보고 존나 삐급영환가보네 했는데 출연진보고 개놀랐네 어쩐지 연기들은 좋더만  
20181207,1,와 개쩐다 진짜 우아 님들 꼭봐요 이런건 여러사람이 다봐야함(나만 당할쏘냐....이개망작)  
20181207,8,개인적으로 볼 만했어요.그런데 정해인 안 죽는 게 계속 웃기네요.  
20181207,1,마지막에 주인공 순간이동도 해버리네.. 스토리 무엇  
20181207,8,티비에떠서 보는데 팩트로 재밌음돈안주고보니깐 진짜재밌는데 돈주고보면 쫌 답답할듯정해인이너무약함...여기저기 쳐발림ㅠ  
20181207,1,와 이거 별1개도 아까운데 0개는 없냐 ? ?  
20181207,2,난 또 윤종빈이 연출한 영화인 줄 알았다. 군도 민란의 시대에 이은 속편 역모 반란의 시대인줄  
20181207,1,칼맞는거  보다 발차기맞고 더 아파하는 개 ㅆㄹㄱ영화ㅋㅋㅋㅋ사만명 지인들만 온거야?  
20181207,8,정해인 데뷔1년차에 찍고 인지도 생기고 뒤늦게 개봉한거. 스토리는 좀 빈약하나 저예산 영화치고는 연출 괜찮던데 연기도 볼만하고 와이어없이 저런 액션연기 했다는게 더 놀라웠음 감독님 고생한 배우들 다시 만나 퀄 좋은 장르물 드라마 같이 하길 기대함  
20181207,2,너무 형편 없네..내용도 없고...먼 화면이 시꺼메서 보는 동안 내내 겁나 짜증.  
20181207,1,이것두 영화냐?? 진짜 유치함...  
20181207,1,연기가 기가 막히는데 왜 천만이안된거지ㅋㅋㅋ  
20181207,4,참나  보다보다 시간 아깝다    현빈 멱린인줄알았다   역린도 내용부진이였는데  이건  불쌍타  정해인 연기는  또 저게뭔지 ㅉㅉ  
20181207,1,야인시대가조금더재밋어요안재모말고 김영철이하실때요핵퐁망한야인시대가디재밋  
20181207,10,정해인이었어?? 와~~연기잘한다  
20181207,2,역대급 폐급 영화 ㅋㅋ 시작하자마자 32배속 돌린건 이거랑 궁합ㅋ  
20181207,1,물괴랑 이거 만든 감독은 진짜 정신나갔다  
20181207,1,OCN에서 새로 하는 드라만줄 알았다...  
20181207,1,왜망했는지 알겠음 진짜 심각하다  
20181207,2,너무 유치하다. 아직도 이런 영화만드는 종자들이 있네^^  
20181207,10,정인해라는 배우의 또다른 모습을 볼수있어서 좋았고 너무 잼있게 영화를 보고있어요.  
20181207,1,극장에서 안봐서 천만다행  
20181207,1,절대로 나만 희생 될 수 없다! 감독 은퇴하고 스크린쿼터제 폐지하라!  
20181207,10,평점이 낮아서 기대 안했는데 기대 이상이에요^^ 애인이랑 같이 봤는데 너~무 좋아하네요! 추천합니다. -글 작성시 이 문구는 삭제후 올리시길 바랍니다.-  
20181207,2,이거. 뭐지 이거 영화맞나?코미디같은데  
20181207,8,한여름에 저예산 영화로 배우들 개고생한영화.감독이 문제인지 시나리오가 문제인지..  
20181207,8,정해인의 최고액션 영화. 영상미는 덤  
20181207,10,클레멘타인 이후 최고의 한국 영화!  탈모가 나았습니다!  
20181207,1,영화감독을 역모죄로 전라도로 귀향살이 보내버렸음 좋겠다~  
20181207,2,떳다 싶은 영홰들 요소 다 짬뽕 시켜놓은 영화.  
20181207,10,저예산으로 촬영후 2년반이  지나서야 우여곡절 끝에 개봉한 영화 역모~많은 배우들의 열정이 엿보입니다  
20181207,1,ㅋㅋㅋㅋ 영화  개까이네 ㅠㅠ  
20181207,1,"내용도 없고, 싸우다가 싸우다가 싸우다가 끝나는 영화  "
20181207,1,댓글로 영화 다 봤습니다. 감사합니다 여러분  
20181207,4,발로휘두르는 칼 씬만 기억에남네여  
20181207,6,정해인 숙성되지 못한 사극의 피해자  
20181207,2,보기도 전에 이렇게 평점 아닌거 첨보네요. 곧하는데 차라리 유투브로  다른거봐야하나? 제목은 괜찮은듯한데  
20181207,1,평할 가치도 없다‥무료라도 보지마라‥한국영화의 수치다  
20181206,6,삼만명 ㅋㅋㅋ개손해낫겟네 배우들몸값은 다 지불햇냐 정해인 첫사극 개망햇구나 김지훈영화도 ㅠㅠ  
20181130,1,"이건뭐,,스토리도 없고,,,주구장창 싸움질만,,이게 영화냐,,에효,,,투자자들 빡칠듯. 정해인은 조연이나 단역시절이 있었나? 연기도 그닥이구만 매번 주연이네~  "
20181124,2,1시간40분중 45분동안 같은공간에서 싸우기만 해서안봄  
20181121,1,"이건 영화가 아니라 쓰레기다, 포졸 한명이 수많은 무장한 군사들을 모두 해치우고있고, 칼도 아닌 나무 육모방망이를 가진자를 수많은 역졸들이 당한다니. 또한, 이야기 내용이 포졸한명과 잔당들의 애들장난이 전부인가? 스토리도 전혀없다. 이건 영화가 아니다  "
20181121,1,최근 이십여년 동안 본 영화중 젤 재미없음진심임 그 어떤 영화보다 재미없음  
20181117,2,하...암...휴....  
20181116,1,이런곳에 돈쓸바에 기부하세요...이게뭔가요 감독 더이상 미래는없다  
20181115,1,이게 영화여 뭐여!! 빵점이 없어서 1점이라도 주게되네 에고..  
20181114,1,남주가 연기를 너무 못하네. 그리고 감독님아~ 넌 그냥 기술 배워라  
20181113,10,악플러들 너무 많네요ㅡㅡ 많은 분들이 봤으면하는 명작 영화입니다  
20181112,1,호우아. 이 영화의 평점이 1점이 아님이 놀라울 뿐.  
20181102,2,감독은 도대체 무슨 생각을 한거냐.  
20181023,3,개연성이 너무 부족한거 같아 몰입감이 떨어짐  
20181020,1,전설의 고향이 더 재밋겠네요  
20181004,1,아 진심 개토나오는 쓰렉영화다 배우들도 이불킥할거다  
20180930,6,좋은 배우들 데리고 망치다니..감독의 중요성을 깨닫게 된다 배우들이 아깝다아쉬운게 참많은 영화중간중간 디테일들은 있었으나 그마저도 아쉬웠고특히 대비와 왕은 처참하다  
20180929,1,액션만 좋으면 참고 보려고했는데도... 전체적으로 너무 엉망이라.. 뭐 할말이 없다..  
20180929,4,정해인의 VR게임 관전자가 된 기분  
20180928,10,시작이 만화던데 그냥 쭈욱 만화로 갔어야 함  
20180924,1,대사들도 하나같이 70년대같어. 내가? 훗 덤벼!만화여 뭐여...그리고 주인공은 나가서 다른사람들한테 알릴기회가 많았는데 왜 계속 혼자 저래요. 혼자 진지한 코미디 한변  
20180916,1,스토리만들 능력이 안되니 허무맹랑 얼토당토안한 쓰레기 무술만 난립...실망이네..  
20180914,4,...배우비주얼과 새로운해석은 좋음  
20180912,1,와~우!뭐라...  
20180909,3,식상하고 지루하고 스토리 허술하고 CG는 유치하고 대사도 수준 낮고 열심히 연기하는 배우들이 안타깝다  
20180827,1,관객을 너무 쉽게 봤네. 단순히 칼쌈 몇번보려고 영화보지는 않는다.  
20180807,1,진짜 이렇게 엉성한 졸작은..영화과 대학생 기말 프로젝트수준  
20180729,1,인랑보고 봣는데...인랑급이네요  
20180721,2,정말 눈이 썩는 영화....스토리도 엉성하고  구성도 그렇고 이해안가는 상황도 많은 총체적 난국영화..  
20180720,1,이것도 영화인가 전파낭비 오졌다  
20180720,1,살다살다 이런 영화는 첨이네 이리 평점까지 주게 될 줄이야정해인이 아깝다 아니 작품선택을 못하는것도..  
20180706,10,tv에서 구매할려다가 말았는데 이게 다 여러분 덕분입니다.  
20180702,1,그냥 정해인보러왔는데..일도 고민없는 시나리오..대다나다..이렇게 만들기도 어렵겠다  
20180701,2,이거 보러가서 잠든 다음 꿈이 재밌어서 10점 주신 분 있다길래 캐치온으로 봤는데 덕분에 낮잠자서 재밋는 꿈 꿨어요.  
20180627,1,1점도 아깝다.  드라마보다 수준이 낮으니..  
20180623,6,별다른내용없이액션이전부네요  
20180623,2,멍~~졸려서 죽을뻔 .. 내용도 없고  
20180623,1,귀찮아서안남기는데 정말대박이다 저런걸 돈들여서 찍는다니...  
20180623,6,너무 어슬픕니다요..정해인씨 첨보는데 잘만키우면 좋은인재는 되겠네요..근데 감독이 정해인씨를 잘본 모양이네 완전 혼자 다해먹었음.ㅋㅋ  
20180621,1,옆에서 영화를 조용히 지켜보던 우리집 금붕어는 상어가 되었습니다.  
20180620,2,역사 좋아해서 봤는데 피 튈때 부자연스러운 싸구려 CG와 홍수아가 보기 불편했고 그냥 전반적으로 평점대 낮은 이유가 이런데서 나오는듯.  
20180620,4,홍수아 이상하게 변해서왓구나;;;  
20180610,10,정해인 생고생함에 별점 10 드립니다.  
20180610,10,정해인의 열연에 만점 줍니다.  
20180531,6,정해인 액션은좋다. 액션영화 기대함.  
20180522,1,무적 포졸 방망이는 어디서구입하나요  
20180511,1,여태 클레멘타인 안 보고 잘 피해왔는데 ㅜㅜ 이걸 보게 되다니 ㅜㅜ 이 자체가 역모다 ㅜㅜ  
20180505,1,정해인님만 아니면 안봤다..  
20180504,1,쓰레기 영화 ㄹㅇ 특급으로 쓰레기  
20180502,1,올해 최고의 영화 ㅋㅋ. 미치  
20180501,1,드럽게 재미없음 쿡티비로 보고 지금 바로남기는데.. 계속 사람만 죽어나가고 내용없고 재미없음.진짜 끔찍히 재미없음. 감독은 무슨생각으로 만들었을까?  
20180424,1,관객 : 반란의 시대 관람객의 반란을 유도하는 지능적 디스  
20180421,1,울버린인줄... 옷도  치유되는 기적. 돈주고 보긴 아까운 영화. 내 시간 들여 본것도 아깝다  
20180420,5,나름 애쓰신것같으나..넘 만화같은 캐릭에 내용 지지부진의 액션만 남음..핸님 볼라고 봤는데..심하게 불사신..배우들 아까움..영화 찍을때 완전 신인이었을텐데 그래도 무난한연기..  
