0,1,2
20170507,3,밀리언달러베이비를 오마쥬 하고싶었던거라면 확실히 잘 못 이해하고 인용한거다.  
20170507,9,잔잔히 밀려오는 감동과 여운에 젖어들게되는 영화  
20170507,10,완전 대박입니다 감동적이에요!!  
20170506,10,천우희. 참 선물같은 배우네요  
20170506,10,정말 좋아요...저는 천우희가 미용실 가서 대화 할때...가장 기억이 남네요...  
20170506,7,"잔잔하지만 느낌있는 영화잔잔히 깔리는 음악과 감성이 잘 어우러지네요,,,잘 봤습니다.  "
20170506,10,이런 잔잔한 영화 너무 좋아요. 2번봤습니다!  
20170506,10,아..정말 좋네요. 아름답고 많은 생각 하게 해준 고마운 영화입니다.  
20170506,10,조제가 생각나는영화 연기 음악 뷰 다좋음!  
20170506,10,관람객아련하다 ㅋㅋ 연기짱이었음  
20170506,7,해변가에서의 울음 - 상처에서 치유되는  연기 굿.  
20170506,1,내가 이해력이 딸린건가....? 진짜 뭔말인지 하나도 모르겠네  
20170506,1,어중간함....안하느니 못한 결과물....쟝르의 애매모호함은 둘째치고라도 순수창작물로서도 많이 떨어지는...  
20170506,1,결말이 영화 다 망친느낌 그리 많이 슬프지도 않고  
20170506,1,이게 뭡니까? 안락사 미화영화입니까? 결국 살인자.  
20170506,10,말이 많을 것 같은 결말이였지만 그만큼 절절했던 미소의 마음을 나타냈던게 아닐까. 인물의 감정선을 따라서 아주 천천히 느리게 흐르는 위로가 참 좋았다.  
20170505,10,김남길과천우희 역시 는 역시네요. 이렇게 가슴이 먹먹한적이 없는데....  
20170505,9,"말로는 자세히 설명할 수 없는.. 이미 내곁을 떠나버린 사람에 대한 그리움과 남아있는 추억들을 회상하고, 그런 부분에서 공감할 수 있었던 좋은 영화였습니다.  "
20170505,8,풍미 가득한 스테이크보다는 담백한 샐러드 같은 느낌의 영화였다. 그림으로 치자면 수채화같은 느낌. 잔잔하게 한방향으로 흐르며 감독의 메시지를 전하는 뚝심이 전해졌다. 김남길과 천우희의 연기 조화가 괜찮았다.  
20170505,7,영화를 조금 더 세련되게 만들었으면 좋았을 것이다. 하지만 억지로 뭘 만들어낼려고 하지않고 여운을 두는 마지막의 앤딩은 마음에 든다.  
20170505,10,선화에 대한 기억이 늘 가슴 아프고 쓰라리지만 미소를 만난 이후로 그녀가 선화에 대한 기억을 이제 좋은 추억으로 남을 수 있게 만든 매개체가 된 것 같고 끝까지 잔잔하면서 감동은 서서히 복받쳐 오게 하는 좋은 영화였습니다. 슬픈 봄비 같은 영화네요  
20170505,1,관람객졸려죽는줄ㅜㅜ재미가 없었어요ㅜ  
20170505,10,제가 왠만해서 영화보면서 이렇게 운적은 없었어요.되게 잔잔하고 자칫하면 지루하게 느낄 수도 있겠다 싶어요.하지만 저에게 가장 힐링을 준 영화입니다. 추천 꾹!  
20170505,10,관람객순수한 사랑이야기를 느끼게 해준 영화스토리 입니다.  
20170505,8,"천우희는 진짜 천생 배우인듯,,  "
20170504,1,이런분류의 여주인공역이 제일 어려운듯. 소재는 나쁘지 않았지만 소재에 비해 스토리가 너무나도 아쉽다.  
20170504,9,관람객좋은영화였어요! 다시보고싶습니다/.  
20170504,6,배우연기는 좋은데...보험사 투자받아 만들었나 내용이 뭐이래 --  
20170504,10,스토리가 조금 허술하고 억지스러운 부분이 없진않았지만한국영화특유의 억지감동 눈물즙짜내기가 없이 담백하고 천우희아닌 다른 배우였다면 이정도 감동은 못느꼈겠다싶다  
20170504,10,자꾸 장면 장면들이 생각나고 마음이 찡해진다.  
20170504,10,많은 생각이 들게 하는 영화네요.. 좋은 영화 잘봤습니다.  
20170504,3,관람객흠.. 그냥 그래용 ㅜ약간 졸리...  
20170504,10,잔잔한 반전.... ㅜ ㅜ  
20170504,10,천우희의 매력을 다시 발견했어요너무 따뜻한 영화네요 좋았습니다.  
20170503,9,첨엔 줄거리만 보았다..  그리고 두번째 볼때 주책없이 울었다.. 잔잔한 아픔을 따뜻하게~ 소장하고 싶은 영화 중 하나!! 비슷한 슬픔이 느껴질때 그리고  위로받고 싶을때..  
20170503,10,감동적이고 두 배우의 연기가 최고였어요  
20170503,7,"잊혀지는 건 슬프지만, 기억하는 사람의 슬픔도 생각하게 되는 영화.  가벼운 느낌으로 시작해서 다시 한번 생각하게 만들어주는 결말.  "
20170503,1,상황설정 하나하나 말이 안되는 게 너무 많다.  
20170503,10,"감독님 남과여도 잘봤는데어느날까지..ㅠ 김남길,천우희 배우님 연기에도 감사합니다  "
20170503,5,기대이하ㅜ 너무 지루하고 늘어지는 감이 있었음. 혼자에게 보였던만큼 예상했던 장면은 전혀없었음 신파적  
20170503,9,두배우의 호흡만으로도 9 점. 결말이 없는영화였다면 10 점 이었을텐데 마지막장면때문에 모든걸 울렁이게 만든아쉬운 영화  
20170503,10,알수없는 먹먹함이 오래남아있는다.  계속눈물이 나고 가슴이 찢어질거같다  
20170503,10,이렇게 후기 남겨보는 영화 처음인데 생각보다 평점이 낮아 당황했습니다. 스토리 자체는 어느 정도 예상이 되는 내용이지만 배우님들의 섬세한 연기력으로 관객인 저의 감정선도 영화가 끝날 때까지 이어질 수 있었습니다. 오랜만에 눈물 펑펑 흘리면서 봤습니다.  
20170503,8,"이 감독 그림 아주 잘 그린다. 여자정혜, 멋진하루 등등 존경할 만한 감독이나 이번 환타지 드라마는 좀 무리가 있는듯~ 그래도 이감독이라서 이렇게 짠하게 그릴수 있었다고 생각한다. 천우희보다 김남길에게 더 끌린다.  "
20170503,10,관람객너무 아름다운 영화였어요ㅠㅠ  
20170502,8,관람객좋아요좋아요좋아요좋아요  
20170502,8,"""잊혀지는 것보다 슬픈건 없다"",""좋은기억만..""말로는 표현할 수 없는 감정선..서로를 통한 아픔의 치료가 참 좋았다.다만 마지막 미소가 깨어나 열린 결말로 끝났으면 좋았을텐데..서로를 통한 아픔의 치료가 지속되는것을 보여줬다면 어땠을까..  "
20170502,9,김남길 천우희 너무 예쁘다. 좋은 영화.  
20170502,7,잔잔한 감성영화 잘봤습니다~ 근데...마지막이 아쉽네요ㅠㅜ 마무리만 잘했어도 더 좋았을텐데~  
20170502,8,김남길 연기가 정말 좋았다. 잔잔하면서도 깊은 여운이 남았음. 근데 결말이 너무 깼음... 현실에서 그러면..ㅋㅋ  
20170502,10,"주인공의선택이 맞는건지는 잘모르겠지만,여운이 크다.  "
20170502,6,관람객자살미화영화 보는내내 답답하고 화남  
20170502,10,"감동적인 영화 였습니다. 천우희, 김남길의 명배우들의 연기는 정말  대단했습니다!  "
20170502,9,두 주연 분들 연기 너무 좋았습니다. 잔잔하고 이쁜.. 그리고 슬펐어요.  
20170502,10,예상한 느낌이라서 크게 좋진 않았으나 나쁘진 않았다  
20170502,5,관람객조금 지루함 조금 시간이 안감  
20170502,6,죄송합니다. 쉬는날이라 영화좀 연속으로 봤는데 이거보기전에 로건을 봤더니 ;; epl 보다가 k리그 보는느낌이네요 ... 특히.. 결말이 ㅋㅋㅋ 로건보고 여운이너무깊어 리뷰글을 한참봤던 저와 사뭇다른 평을남기고있네요  
20170502,9,관람객영상미는 말할것도 없고 김남길 캐스팅은 신의 한수. 같이 보러간 제 친구는 울뻔했다고... 전 그정도까진 아니었거든요 무튼 추천합니다  
20170502,8,잔잔하니 좋네요...마지막엔  울었지만요....여운이 많이 남는영화예요  
20170502,1,1점짜리영화 진짜로 ㅡㅡ  
20170502,1,이런 영화 만들려고 김치 스크린제도 만들었냐?!!! -_- 정신 좀 차려라  
20170502,10,정말 슬픈영화이다 ㅠㅠㅠ  
20170502,9,마지막 클라이막스 10분 배경음악만 나오면서 끝나는 엔딩  
20170501,7,잔잔하게 감성을 자극하지만.. 조금은 밋밋하다..  
20170501,8,연기 잘 하는 배우를 캐스팅하니. 정말 볼만하다. 천우희 앞으로 한국 여배우의 미래다. 어두운 연기만하다 밝은 연기를 보니 앞으로 더 보고싶은 배우다.  
20170501,10,관람객지루하지 않고 재밌으면서 잔잔하게 슬펐어요  
20170501,7,사람은 기억에서 잊혀질때 죽는거라는거  
20170501,5,관람객조용조용조용슬픔슬픔슬픔  
20170501,8,관람객김남길은 우는 연기를 참 잘하는듯  
20170501,8,관람객잔잔하고 재밋어요 조금 지루했지만 마지막에 뭉클했네요 한국 영화 다운 한국영화였습니다 한번 볼만한듯  
20170501,2, 결말이 궁금해서 끝까지 보긴했으나 결말도 움...에휴  
20170501,9,찡함이 있는 영화....  
20170501,7,포스터랑 예고랑 본편이랑  다른느낌. 그래서 별 3개 뺌.올드한 스토리이지만 배우들이 열심히 연기한듯. 쪼끔    쏘쏘한 영화.  
20170501,5,다 좋은데. 막판에 보내버리는건 노이해  
20170501,1,끝까지 뭔가 있겠지 뭔가 있겠지 하면서 봤는데 끝가지 하나도 없네?완전 낚인 기분  
20170501,10,이윤기 감독은 김정범을 좋아하나보다. 매번 같이 작업하는거 보면... 그리고 나도 그들을 좋아한다...멋진하루에 이은 어느날.. 좋았어요  
20170501,7,관람객스토리가 재밌긴한데 비슷한 영화가 많은거 같은데~  
20170501,10,주조연들 연기가 너무 좋았어요  
20170430,8,영화 내용보다 더 많은 생각을 하게 한다...  
20170430,10,많은 생각을 하게 하는 영화네요.  
20170430,10,머리아픈날 당신을 힐링할 힐링영화  
20170430,6,아름다운 영화이나 전개가 너무 밋밋한.. 끝까지 그렇게 끝난 영화. 참고로 우리 꽝숙이 나옴^^  
20170430,10,관람객보는내내 가슴이 먹먹한것이 삶을 다시 생각하게 하는 영화였음..ㅠ  
20170430,10,눈이 붓도록.. 눈물이남..김남길님 연기 너무 좋았네요..  
20170430,10,진짜 잔잔하다는 말이 가장 잘 어울리는 영화네  
20170430,6,이끌어 나가는 전개는 아쉬웠어도 연기력과 브금에 빠져들었지만결국 김남길만 불쌍할 뿐이었다  
20170430,2,관람객영화줄거리는 나쁘지않았는데 전개가 아쉬웠다  
20170430,9,제작진의 연출력 의 단점을 배우들 의 연기력으로 커버하는 영화.  
20170430,10,잔잔한 분위기의 감성적인 영화 배우들의 연기가 아주 대박입니다 ㅠㅠㅠ  
20170430,10,펑펑울었어요 천우희사랑해요  
20170430,9,김남길.천우희의어느날 남들평점이 어떻든 나는최고다...  
20170430,8,관람객천우희이쁘당 헤ㅔㅎ헤  
20170430,10,오랜만에 영화보면서 펑펑울었네요...  
20170430,3,관람객그닥입니다. 걍 티비로 보세요.  
20170430,7,관람객재밋어요볼만해요  
20170430,8,재밌게잘봤어요 근데저는엔딩이좀아쉽긴하네요 판도라에이어 김남길연기진짜잘한단생각과 여주인공도귀엽고연기잘해요 얼마나많이울었던지..적어도저한텐억지울응아녔어요  
20170430,6,"극 중 남주인공 대사 ""너는 절대 이해 못 해"" 맞다 관객들이 이 영화를 이해하기엔 2시간이 너무 짧았다. ""멋진 하루""깥은 영화를 기대했는데 ㅜ  "
20170430,1,너무 재미가 없어요 잔잔한 영화의 감동을 끝부분에서 느끼기에는 너무나 지루하고 의미없는 장면들이 많습니다. 예고편만 믿고 봤던 제 자신이 너무 싫었음 예고편 만든놈이 대단한거임 이런 영화를 어떻게 예고편에서 잘 엮었는지 예고편을 만든사람이 감독해야됨  
20170430,6,천우희 연기가 꽤 오바였고 김남길도 약간 지나치게 멍해있고.. 연기가 조금씩 더 나가서 안 붙는 부분이 좀 있다. 상투적인 내용이기도 하고.. 다만 사람을 보낸 경험이 있는 분들에게는 공감이 되겠지  
20170430,3,이해불가 전형적인 감성팔이 한국영화 웃음만나옴...  
20170430,10,김남길 최고의 배우다진정한 연기자  
20170430,6,도시에서 매일 지는 노을을 모르다 가끔 보면 참 이쁘다 느끼는 감성영화  
20170430,10,"어느 부분이 슬픈지 모르겠지만, 계속 눈물이 나고 가슴이 미어지는 영화  "
20170430,9,관람객짱잼요 너무너무재밋게봣네요 최민식연기굿  
20170430,10,관람객보는 내내 눈물흘렸던 감동 깊은 영화였습니다  
20170430,5,잔잔하다 옆길로 심히 새는 영화..감정이 만든 논리에 생명은 그다음이었다라..이걸 수많은 난치병 환자보호자들은.. 흠..난 이 잔잔한 분위기에 계속 집중할수 없었음  
20170429,9,잔잔하면서도 슬픈 영화네요.. 좋은 기억만 남기려하는 모습이 더 슬퍼져요. 결말이 좀 아쉽습니다.  
20170429,9,관람객아주이주아쥬재밌다좋아  
20170429,8,음.... 약간 슬펐음 ~  
20170429,8,"관람객굿!!!...,,,(((&&&&  "
20170429,8,김날길이 참 좋은배우네요...무뢰한영화도 개인적으로 인상있게 봤습니다. 앞으로 좋은 연기력 부탁드립니다.  
20170429,10,아무생각 없이 펑펑 울었던 영화  
20170429,9,미소의 인생에 감정이입되어서. . .눈물 펑펑. . .스토리 저는 괜찮았습니다.  
20170429,9,남겨진 사람이 겪은 고통을 잘 그려냈어요. 오래 기억하고 싶은 영화에요.  
20170429,6,"김남길때문에보긴 했지만,,아무리영화라도 말이안되는부분이,,,;;영상은 이쁘다~~!어쨌든 건강이 최고~~*이감독영화 여자정혜,남과여 너무 재밌게봤는데..앞으로도 현실적인 잔잔한 영화 부탁드려요!~~^-^  "
20170429,5,잔잔함이 절대 싫지는 않지만 그안에 특별함이 없으면 그냥 잔잔함으로만 끝나는듯  
20170429,10,"삶과 죽음, 삶의 의미에 대하여 생각하여 보게 한 영화.  "
20170429,9,잔잔함이 좋은 영화였다. 싱글라이더에서 반전을 뺸 느낌.  
20170428,1,0점이 없어서 반점 준다 잠 못자고 영화 찍느냐 고생 많았다미안한데 나는 겁나 자면서 봤다 그래 정말 잔잔한 영화였어 근데 잔잔하고 또 잔잔해 감독아 화이팅하자 형이 응원한다  
20170428,10,괜찮다...일본 감성 로멘스 같은 느낌..  
20170428,9,곁에있는 소중한 이들에게 더욱 더 잘해야겠다..  
20170428,10,이윤기 감독 작품은 항상 원색적인 자극보단 어루 만져주고 대화하는 느낌을 주네요 뻔한 소재일지라도 아 또 이거네보단 마음이 편해지게 하는 힘... 늘 좋은작품 감사하고 김남길씨 또한 캐릭터 이해력이 정말 일품인거 같습니다  
20170427,10,난 재밌게 봤는데...  
20170427,10,단언컨대 정말 최고의 영화 입니다.다 보고 나서도 한동안 많은 생각을 하게 하는 영화 였습니다.이런 영화들이 많이 나왔으면 좋겠네요.천우희님 연기 정말 잘하시고 김남길 님도 정말 최고의 명작이 었습니다.  
20170427,9,호불호가 갈릴수밖에 없겠지만 난 좋았다  
20170427,8,결말만 쪼끔 아쉽네요ㅠㅠ  
20170427,10,잔잔한 영화 잘 봤습니다~~  
20170427,10,관람객김남길 연기 좋았고 천우희 너무 귀여웠다  
20170427,4,납득할 수 없는 결말. 허무...  
20170427,8,장님이라고 하시면 안되구요. 시각장애인이라고 하셔야 됩니다.  
20170427,4,"오랜만에 잔잔한 영화가 보고싶어서 보았지만, 기대를 많이 해서인지전반적으로 재미도 감동도 없었어요. 배우의 연기력, 스토리도 있지만 공감대형성이 부족합니다. 평점은 알바가 많아 보이네요.  "
20170427,6,관람객잔잔하니...천우희도 이쁘고 맘편히 볼만했음  
20170427,5,끝까지 다 보지 못하겠더라. 넘 신파적이고 뻔해서... 싱글라이더도 그렇고 이런 잔잔한 영화는 관객들한테 어필하지 못한다. 연기도 특별한건 없었다. 매우 아쉬운 영화. 둘이 로맨스가 달달한 것도 아니고. 뭘 전달하려는 의도인건지.  
20170427,10,평점이 너무 낮아서..좋은 영화라서..10점  
20170427,3,연기는 좋았다만...글쎄  
20170427,8,관람객일본영화 느낌도 조금 있었던것 같아요 재밌게 봤어요 잔잔하게  
20170426,1,"이런  쓰레기를 왜 영화라고 만들었는지 보는 내내 시간이 아깝다는 생각만 들었음, 집에있는 이윤기 감독의 영화도 모두 불싸르고 싶은 심정  "
20170426,8,관람객슬퍼요 김남길...내가어떻게너를잊겠니  
20170426,7,김남길이 젤불쌍하다...  
20170426,9,전형적인 스토리지만 그안에 짠함이 있었다  
20170426,5,나는 의리로 같이 살고 있는데...마누라한테 잘해야 것다.  
20170426,10,"눈요기 거리도 없고 자극적이지도 않고 그런데 끝까지 보게되는 영화,  과하지 않고 할 말만 하는 절제된 연기, 잘 봤습니다  "
20170426,9,육체의 장애가 영혼까지 장애는 아니다. 천우희는 시각장애인이지만 천우희의 영혼은  시각장애가 아니라 눈앞의광경이 모두처음이라는게  신선햇다 내가 지금까지 살아오면서 한번도 생각하지도 못햇다.  
20170426,1,"끝 부분 엔딩 장면이 ""밀리언 달러 베이비""라는 영화와 거의 똑같이 끝이 나는군요? 혹시...?  "
20170426,10,요세 감정이 메말라서 슬픈영화를 봐도 울지 않더라고요..사실 엄청난 울보여서조금만 슬픈영화를 봐도 진짜 잘울었는데근 1년사이 아무리 슬픈영화를 봐도 울질 않았는데'어느날'을 보고 펑 터져버렸어요... 정말 가슴이 찡..했어요너무 슬펐어요..  
20170426,4,좋은점보단 좋게 보일려고 노려가는 영화  
20170425,8,잊었던 사람을 다시금 생각하게 되는 어느날 이네요..  
20170425,4,딱히 임펙트도 없고 러닝타임은 또 길다  
20170425,9,"군데군데 연출의 아쉬움은 있지만 온갖 욕설과 폭력에 찌든 국내산 저질 영화보다 가슴 따뜻해지고, 가슴 뭉클한 이런 영화가 좋다.  "
20170425,9,관람객잔잔하게 슬픈 영화. 여운이 많이 남네요.  
20170425,1,킬러 김남길 이야기.... 의식 돌아왔는데 죽이다니  
20170425,10,조금 엉성한 부분도 있지만느릿느릿하고 잔잔한 전개가 좋다.일본 영화들에서 많이 보던 그런...간만에 괜찮은 영화.평론가들은 역시나 지들 기준으로씹어대는군.어차피 감상은 개인의 몫인데  
20170425,10,잔잔한 영화라서 마음 편하게 볼 수 있었고 가끔씩 나오는 개그 코드덕분에 지루하지 않았고 주인공의 감정에 서사히 물들어가면서 마지막에는 눈물이 나도 모르게 흘렀다.. 쓸데없는 러브라인이 없어서 너무 좋았고 영화 후에 나도 모르게 힐링된 느낌이었다ㅠㅠ  
20170425,9,나는 남겨진 이들에게 어떤 모습으로 기억될까?  
20170425,9,내 옆에 소중한 사람들을 다시 한번 생각해보는 영화  
20170425,6,"내 마음이 너무 돌덩이처럼 무뎌져서인지는 모르겠지만, 이런 아픔을 겪은 바 없는 나로써는, 그저 쓸쓸한 영화  "
20170425,9,관람객잔잔하면서 가슴 먹먹한 영화. 두 주인공의 연기가 너무 좋았다.  
20170425,9,관람객잔잔한맛이 있는 영화였어요 결말은 음  
20170425,9,"너무 너무 감성적인 영화 잔잔 멜로디가 마음을 사로잡음김남길,천우희 배우 정말 재밌게 봤고, 영화가 끝나고도여운이 오래가네요 눈물 잘 안흘리지만 김남길의'내가 어떻게 너를 잊어' 이 장면은 오래도록 간직하겠습니다.너무 재밌게 봤습니다~ 추천!!  "
20170425,7,이윤기 감독님 최초의 상업영화. 김남길의 인생연기.  가짜 벚꽃 잎의 작위성은 어떤 의도 였을까 궁금해지네....  
20170425,3,뭐하자는건지 모르겠다  
20170425,10,인간적이어서 좋았다.  
20170425,9,관람객사랑하는 사람을 추억속으로 보낸 사람은 영화를 제대로 보기 힘들다  
20170425,8,배우연기는 진짜100점이다.스토리도 다좋았는데 결말무슨생각으로 만든건지 감동 다 깨버리네  
20170425,10,"두 주인공분들 연기 정말 잘하셨고,  보면서 제가느낀 감정의흐름이 굉장히 ...슬프면서도 따뜻하기도 했어요 ~  "
20170425,5,"내용은 뭐 큰 기대 안해서 그러려니 하겠는데 천우희가 단벌로 입고 나오는 그 원피스에 니트, 색도 디자인도 재질도 너무 구려 보는 내내 옷 갈아 입혀주고 싶었다  "
20170425,10,김남길 천우희 연기 정말 감명깊고 영화 완성도도 높습니다  
20170424,9,오랜만에 영화보고울어보긴처음이네 억지로 쥐어짜내는감성적인영화가 아니라서 좋았다  
20170424,10,관람객행복하고 슬픈영화..  
20170424,10,관람객잔잔하면서 은은한 여운이 있는영화  
20170424,1,"죽음에대한 이야기를 아름답게 풀어보려한듯한데..망자들이 참이기적이네요..그나마 좋은모습일때 떠나고싶어남편앞에서 자살한 부인이나,남은사람들 힘들지않게하려고타인에게 자신의 마지막을 부탁한이나..음악과 영상미는 좋았어요 그래서 제점수는...  "
20170424,9,김남길과 천우희라는 배우를 새롭게 보게 되네요. 오랜 여운이 남네요. 먹먹함이 오래가네요.  
20170424,10,일상을 되돌아 보게 하는 영화네요~~ 이런 잔잔한 감동을 주는 영화를 간만에 보내요~~주연.조연 모든 연기자님들의 연기력에도 박수를 보내고 싶어요~^^  
20170424,9,관람객오랜만에 극장에서 펑펑운 영화입니다. 다른 사람들은 그정도는 아니라고 하는데 저는 정말 감성폭발이었습니다. 남녀 주인공 모두 너무 가엾고도 슬펐다.  
20170424,9,영화의 색감이 너무 이뻐서 마치 한편의 일본 애니메이션을 본듯한 느낌.  
20170424,7,김남길-천우희 조합이 환상적인 듯.. 다른 배우들이 주연을 했다면 영화를 망치지 않았을까 싶은 생각이 들 정도.. 전체적으로 영화가 잔잔해서 일본 영화 같은 느낌..?  다 보고 나니 어...뭐지...이게 끝인가 하는 생각도 들긴 하네.  
20170424,6,언젠가 일본영화에서 한번 본 듯한 느낌의 영화네요. 배우들의 감정연기는 칭찬해줄만 합니다.  
20170424,10,잔잔하게 애틋함이 좋왔다. 김남길님의 표정들이 아직도 애잔히 남네요  
20170424,8,관람객잔잔하니 좋았어요.. 결말은 좀 아쉬웠네요ㅠ  
20170424,1,이런 배우들이 왜 이 시나리오를 선택했는지 도대체 알수 없는 망작 연기만 좋으면 뭘하나 내용이 설득력이 하나도 없는데...여운을 주려 애를 쓴듯하나 결국 빈껍데기 마지막까지 다 본 내 시간이 너무 아까운 영화  
20170424,10,배우들의 연기는 10점 특히 김남길의 연기가 돋보였다. 음악도 스토리도 나쁘지 않았는데 정말 마지막 결론은 이제 남은 사람이 상처를 극복하고 살아가기엔 너무 큰 또다른 짐이 된다  
20170424,4,연기는좋았으나  다소 볼거리가 부족했던영화 좀지루함  
20170424,10,천우희 정말 사랑스럽다..  
20170424,6,마지막 장면으로 합리화 하려는 연출은 최악‥‥배우들 연기력은 10  
20170424,10,한국영화의 감성이란....  
20170424,10,기대안하고 봤는데..몇번이나 눈물이 왈콱ㅜㅜ연기 잘하네요  
20170424,1,의식이 돌아왔는데 이건 머??결말이 진짜 어처구니 없다.  
20170424,10,마지막 쯤 해변에 김남길이 잔잔한 바다 앞에 앉아서 회상하는 장면. 잔잔함 속에 울림이 있더군요. 전체적으로 그런 분위기가 참 잘 어울리는 영화였습니다 잘봤어요  
20170424,9,영상미가 너무 좋았어요. 잔잔하게 흘러가는 내용도 너무 좋았고요. 마음 한구석을 아련하게 들쑤시는 것 같았어요. 두고두고 생각날듯 합니다.  
20170424,4,김남길은 장르와 상관없이 어떠한 배역에서도 내뿜는 특유의 어두운 분위기가 있다. 덕분에 작품들이 그 덕을 많이 본다. 이 영화 역시 그러하지만 시나리오와 연출 자체가 너무 올드한 방식으로 진행되기에 아쉽기만하다. 안타깝게도 배경음악조차 올드하다.  
20170424,10,엄청슬픈것도아닌데눈물이미친듯이나서 휴지로닦느라정신없었네요 울고싶은날보러가세요 적극추천이요  
20170424,7,관람객런닝타임이 좀 긴 것 같아요..살짝 지루했는데 좀더 압축됐으면 좋았듯해요.  
20170424,10,영화 잘 봤습니다. 근데요. 영화 끝나자마자 출구 개방하려고 등장하는 극장알바생들. 분위기 깨는데 선수죠. 다른지역에 극장도 마찬가지인가요?  
20170424,10,좋은 영화같다 처음부터 끝까지 ..  
20170424,10,"잔잔하고, 진솔하고, 담백하다  "
