0,1,2
20190128,2,이해 안가는 결말....  
20190121,10,"2017년 비오는 어느 날 본 가슴을 울리는 슬픈 영화.영상미가 훌룡했고 중간중간에 나오는 하늘이 너무 아름다웠네요.미소 역을 맡은 천우희씨가 연기한 ""시각장애인"" 연기가 인상 깊었습니다.  "
20190114,9,천우희 목소리가 넘 예뻐서 더 슬프네요..스켈을 두고 나왔는데 다시 들어갈 수 없으니까 어렵게 한걸음씩 뗄 때 옷에 하얀 꽃이 묻는거 보고 눈물폭탄 터졌어요..아..지금도 눈시울이 붉어지네요..ㅠㅠ  
20190109,4,4점. 질질 끌고가는 감이 없지 않음  
20190101,10,영화가 되게 안정감 있게 부드러운 것이...부담도 없고...눈물도 나고...  
20190101,10,잼나요 강추입니다!ㅎ  
20181229,10,연기자로서 너무 매역적인 김남길...  
20181228,10,이렇게 좋은 영화를 이제서 보다니...감독님 좋은 작품 많이 만들어주세요 응원합니다근데 포스터를 이렇게 가볍게 만들어서 좋은 영화가 묻힌것같아 아쉽네요 마케팅팀 반성하시길...  
20181228,2,아이고 애썼다..연기하느라 고생한 두 배우 생각해서 별 한 개~!  
20181212,8,다른말이 필요없다... 너무 잔잔한 영화  
20181211,10,보면서 결말이 짐작되는 영화였지만 자극적이지 않아서 좋았어요. 김날길 배우님의 눈빛이 좋았고 천우희 배우님의 연기는 참 사랑스러웠습니다. 대여가 아닌 소장용을 구매해서 봤는데 좋은 선택이였던 것 같습니다. 다시 봐도 좋을 것 같네요 :)  
20181118,8,김남길은 잘생긴..연기파 배우다잔잔한 여운을 주는 영화  
20181116,8,두 여자가 남은 남자 하나한테 진짜 못할짓을 하네. 잔인하다. 남겨지는 고통이 더 괴롭다는걸 모를까. 아이고 이 새벽에 눈이 퉁퉁 부었네 오전에 쌍꺼풀 수술 예약되있는데 망했다. 괜히 봤어...  
20181102,9,잔잔한 바다같은 영화~두배우 연기도 너무 좋네요  
20181029,9,첫번째 보다 두번째 보니까 더 영화가 좋네요. 긴 여운으로 남아요.  
20181026,8,별 생각없이 보다가 울었다..ㅠㅠ  
20181019,6,숨쉬고 보고 느낀고 이게 얼마나 소중한지에 대해 다시한번 생각나게하는영화 결말이 슬프네..ㅠㅠ  
20181016,7,"영상과 음악, 컷의 연결은 좋은 데 템포가 느리고 대사와 상황들이 좀 진부하다. 클라이막스와 라스트는 가슴을 아프게하지만.  "
20181014,10,진짜 추천합니다....  
20181010,9,사랑하는사람들과 그상처들...ㅠㅠ  
20181003,6,김남길씨와 천우희씨의 섬세한 연기는 만점을 주고 싶습니다. 하지만...  
20180928,10,관람객김남길 매우 좋습니다.  
20180924,5,유치하고 재미없다. 요즘시대에 이런 신파를 찍나.  
20180920,10,"김남길 배우 힘빼고 담백한 연기, 하지만 상처있는 어른남자 연기 너무 좋았어요.  "
20180919,7,통속적이지만 슬프다.  
20180917,10,많은생각을 하게 만듬..  
20180903,10,잔잔한 분위기 그대로의 유지와 배우들의 연기와 스토리에 감동. 내 인생영화의 넘버원이다.  
20180829,10,너무 .... 하... 마음을 울립니다.  
20180824,5,간만에 보는 잔잔한 영화였는데 결말이 다 깎아먹었다  
20180818,10,천우희.김남길 정말 너무 영화와 잘 어울린다. 모든 인물들의 입장이 전부 공감되고 잘 어우러진다. 잔잔한 음악도 좋고. 슬프네.  
20180817,10,믿고 보는 배우 김남길!!  
20180816,7,오로지 김남길 연기에 주는 평점입니다 내용은 진부해요 그렇다고 연출이 특별하지도 않고요 엔딩은 별로네요 김남길 배우의 연기는 아주 굿  
20180803,10,(약간의 스포주의)결국 강수는 미소의 마지막소원을 들어줬군요ㅠㅠ 김남길배우 천우희 배우 모두 이쁘고 잘 어울립니다 꼭보세요!!ㅠ  
20180731,10,잔잔한 영화...최고  
20180731,10,관람객너무 찡한 영화였어요 ㅠ  
20180724,6,김남길과 천우희의 조합.. 좋았어요..근데 남은 자가 짊어져야할 마음의 상처가 깊네요. 천우희와 김남길의 아내.. 둘다 이기적으로 보이는건 저 뿐인가요.. 마지막씬은.. 그 전에 바다씬에서 끝났어도 좋았을듯한..  불편한 장면이네요.  
20180721,10,"내가 어떻게 너를 잊어,  "
20180720,10,이런 영화를 보고 있으면 내가 여기에 별점을 남기는게 무슨 의미인가 싶음. 그치만 10개 드릴게요.  
20180719,8,마지막 바닷가 색감 연기력 하지만 결말이 아쉽습니다  
20180717,7,너무나 괴롭고 외로울때 위로해줄 누군가가 있다면?  
20180717,6,천우희의 연기가 고정화 되는것이 싫다...  
20180712,10,어쩜 저리 완벽하냐 연기에 얼굴에 김남길 나오는 작품마다 가슴을 울리는 연기라서 너무 좋다♡  
20180710,6,"결말때문에 6점, 만약 결말을 그냥 뻔하게했으면 7점 결말이 정말 상상도 못하게 또한 의미있게 끝났으면 9점.  "
20180706,9,첫장면 잔잔한 배경음악과 다리아래 서있는 김남길의 뒷모습에서 어떤 상실감이 느껴졌습니다  가슴이 아리는 느낌이였어요  김남길이란배우의 편안한 연기가 울림을 주네요....배역에 맡게 사랑스러운 연기 해주신 천우희 배우님께도 감사드립니다.  
20180628,4,영상은 진짜 이쁜데...마지막 엔딩에서 많은 것을 쏟아내기 위해서 영화 초반에 설명이 안되고 그냥 넘어가는 부분이 너무 많아서 보는 내내 찝찝했음  
20180627,9,"초반에  좀 지루해하며 봤는데, 뒤로 갈수록 눈물 콧물 쏟으며 봤어요..잔잔한 영상 , 음악, 그리고  배우들 연기 .. 여운이 많이  남는 영화.  "
20180623,1,살인영화인가요. ㄷㄷㄷ  
20180616,10,모든게 완벽한 영화...  
20180615,10,먹먹함. 보는내내 먹먹함 그자체였다.  
20180614,8,장님이 아니고 시각장애인입니다!!삶에 무게가 느껴집니다..외롭고요..  
20180613,5,재미없어서 집중 안됨.  
20180613,5,다들 가지고 있던 잊고 지내던 감정들을 들춰어 내어 자극하는 영화. 그것말고 딱히 뭔가는 없다.  
20180530,7,"김남길과 천우희의 분위기도, 연기력도 너무좋아서 잔잔함을 처음부터 끝까지 계속 유지하며볼수있어서 좋았지만, 자극적인요소들이 담긴 영화들이 너무 많아서인지몰라도 왠지모르게 보면서 너무 심심한것같다는 생각이 들어서 집중이 잘 안됬던것같기도하다.  "
20180524,6,"어느날 아내가 아팠고, 모든날이 힘들었다. 어느날 아내가 떠났고, 함께한 모든날이 미안했다. 어느날 그녀를 보았고, 아팠던 모든날을 용서받았다.  "
20180516,6,중간중간 허술하고 연출력이 아쉽다.  
20180507,5,"“어느날”보다는 “어느 멋진 날”이 좋겠다. 이윤기의 전작 멋진 하루가 상처와 상실의 주제를 아래서 변주를 반복한다. 다만 매장면이 매끄럽게 연결되지는 못하고, 불필요한 클리셰가 남발되기도 한다.  "
20180503,10,특유의 잔잔한 분위기에 아름다운 영상미와 음악에 두배우의 감정연기와 눈빛이 너무 잘어울려져서 내겐정말최고의영화ㅠㅠ 보는 내내 가슴이 먹먹하다 결국 결말에서 툭하고 울어버리게 만드는.. 둘의 바닷가씬과 마지막장면의 여운은 오래오래 남을것같다  
20180501,8,잔잔한 영화가 생각날때 참 좋은 영화네요 .결말이 너무 쌩뚱 맞아서 당황스럽지만 그전 씬까진 완벽한 영화 였습니다. 결말 빼곤 다 좋았어요  
20180429,9,김남길...연기 정말 잘하네요...추천합니다...좋은영화입니다  
20180424,10,잔잔한 영화... 김남길..천우희연기가 너무 멋진 영화... 강추!!  
20180418,8,잔잔하게 슬프네요ㅜㅜ  
20180415,10,아..너무 좋은 영화이다.  
20180413,10,잔잔하다....사랑스러운 천우희랑  계속 생각나는 영화장면과 배경음악이 잘 어우러진다  
20180401,10,잔잔하고 마음이편안해지는 그런영화  
20180401,10,너무 좋은 영화 입니다~  
20180331,10,아무생각없이 평점보고 봣는데 댓글까지 달게 만드는 이 미친영환뭐지?  
20180327,2,언제까지 시대착오적 사랑을 정통멜로라 불러야 하나  
20180326,6,평소에 우울증이 있다면 보지 마시길  
20180325,8,결말 맘에 안들지만 그외는 좋았다  
20180325,8,"빈약한 스토리라인이 아쉽지만, 두 배우의 열연에 박수  "
20180325,7,남겨지는 슬픈 현실이 안타깝기만 하다.  
20180325,7,결말빼고 대체적으로 괜찮음. 특히 주연배우들. 근데 결말이 범죄잖어~잔잔한 환타지드라마에 생뚱맞은 작가주의적 결말  
20180324,5,잔잔해요 예고와는 달랐습니다.  
20180319,10,배우분들 연기좋고너무 좋은영화 였습니다.잘 봤습니다.  
20180314,10,남길이형 연기 정말 잘하시네요 무뢰한때도 정말 잘봤었습니다  
20180309,5,"그냥 마지막에 천우희 눈 뜨면서 끝내지, 의식 차린 사람에 의료장비를 꺼버리면서 죽여버리는건 아무리 영화라도 윤리적으로 용납하기가 힘들다. 영상미도 음악도 잔잔한게 마음 편하게 보다가 마지막 장면이 다 깨버리네요.  "
20180304,10,모든것이 좋았음  아주아주많이 ㅠㅠ  
20180302,1,결말이 찝찝하고 답답한 영화.... 꼭 그래야만 했나 싶은 영화  
20180227,8,천우희 연기가 점점 좋아 지고 있습니다~~  
20180225,1,남길이형 팬이라 봤는데 진짜 재미 없었다..어떡하지..  
20180223,10,진짜 펑펑 울었다ㅠㅠㅠㅠ내 인생 영화 탑10 안에 들어간다  
20180223,10,잔잔한 물결이 마지막에 파도가 되는 여운이 남는 영화  
20180223,10,잔잔한 여운을 주며연기력이 좋은 명작  
20180219,1,결말 왜이런거야..살릴수도 있었잖아..  
20180219,6,일본영화느낌이 나네요~ 저는 너무 잔잔해서 좀 싱거웠던것같아요  
20180218,10,왜.. 흥행을 못한거죠? 여운이 가시질 않아요. 바닷가 씬은 최고입니다.. 이런 감정 느끼게 해주셔서 감사해요  
20180209,10,아름다운 음악과 먹먹한 화면들이 마음을 울립니다. 배우들의 연기도 정말 놀랄만큼 진심으로 느껴집니다 이 영화를 만드는데 애써주신 모든분들께 감사드립니다  
20180203,10,연출과 연기 음악 잔잔하지만 깊었다.  
20180129,8,마지막 장면이 아쉬워서 8점. 처음부터 끝까지 잔잔하고 깊은 여운이 남는 영화  
20180125,10,김남길연기때문에10점줌. 김남길 연기는 진짜 봐도 또 봐도 너무 잘한다  
20180124,9,"가슴 먹먹한 힐링물, 그 뒤에 서있는 '우리''우리'는 미소일 수도 있고 강수일 수도 있다  "
20180123,1,결말이 모든걸 망쳤다.  
20180106,10,'죽음' 이라는 단어에 대해 다시금 생각해보게 된 영화.p.s 김남길 눈빛..(심멎)  
20180101,9,"영혼이 보인다는 소재 자체는 자극적이나 영화는 시종일관 잔잔하다. 잔잔하지만 기어이 먹먹하게 가슴을 때리는 것은 김남길, 천우희 두 배우의 연기때문이다. 가끔은 이런 영화 참 좋다.  "
20180101,10,김남길의 영화. 김남길이라는 장르.  
20171231,7,시종일관 잔잔함만이 감도는 영화  
20171231,1,올레 공짜 영화라서 보려고 했는데 성준연기 하....미쳐 나오는지 모르고 틀었어요.. 도저히 못 보겠어요.  
20171230,10,여운이 깊게 남는 영화. 김남길 배우 그 눈빛이 계속 생각난다  
20171229,9,"대사 하나하나에 담긴 감정들, 메시지들이 고스란히 나에게 전해졌다.  "
20171229,9,강수의 행동 자체는 범죄지요.하.지.만 미소가 누워있는 동안의 미소의 감정을 다느끼는건 저친구 뿐이네요. 영화내내.'쉬고 싶게 해주고 싶다' 라는 말을 영화로서 느낍니다.아무도 미소의 대리인이 되고 싶어하지않는 상황인걸요..  
20171227,10,"하...아픈 아이아빠, 남녀 주인공...  너무 뭉클한 내용이었다...  "
20171227,3,뭔가 신선한 소재같아서 봤는데 스토리 뒤죽박죽에 웃긴것도 아니고 슬픈것도 아니고...살인하고 내빼버리는 황당한 결말은 정말 현기증나더라ㅋ  
20171227,10,감동적이긴햇지만 감정 과잉이엇다.적당히 미소모와 미소의 화해 그리고 김남길의 치유를 보여주면 되는것을 거기서 극적으로 연출할려고 바다가고심지어 산소호흡기떼는건 과잉중의 과잉  
20171227,8,결말이 좀 그러하다. 눈을 뜨고 회복되는걸루 하지그렸나? 이제 김남길은 병원cctv에 찍히고 살인죄로 감옥에 가는건가....  결말이 영화 반은 깍아먹었다.  
20171226,1,띄어보기로 봐도 개노잼이네  
20171222,9,비오는날 보면 좋은영화  
20171222,1,결말 전까지만해도 잘 나가다 뭐냐 이게 씨* 결국 뇌사의 죽을권리를 얘기하자는거냐- 그럴거면  시나리오를 다르게 써야지- 멍청한 놈이 결국 두 여자를 죽인셈이네- 마지막가서 확 깨져버렸다- 0점 주려다가 없어서 1점준다  
20171222,10,나라면 어떨까 하고 생각하며 본 영화. 참 감동이다..  
20171220,10,영화계는 천우희의 등장에 감사해야 한다...김남길 천우희 다른 작품 같이 더하면 좋겠다.  
20171219,6,연기말곤 뭐하나 괜찮은 게 없다  
20171216,10,새벽에 소주한잔 땡기는 영화  
20171214,7,"차분한 분위기의 영화였고, 스토리는 무난했다고 보여진다. 질병과 장애가 인생에 미치는 영향을 잘 보여준 영화였다고 생각된다. 마지막에는 갑자기 말도안되게 혼수상태 깨어나는줄 알고 욕할려다가 정상적으로 마무리 지어서 안도했다.  "
20171214,10,배우들의 연기 영상미 스토리 너무 다 좋았어요.극장에서 큰 스크린으로 봤더라면 더 좋았을텐데 아쉽네요.  
20171213,8,한번 보면 빠져들어 보게 되는 내용  김남길 천우희 연기가 너무 좋음  
20171209,7,슬픈이야기를 너무 따뜻하게 표현한거 아닌가. 영상도 캐릭터들도 따뜻하다 무거운 주제를 최대한 조심스럽게 접근한것같다 그래서인지 뻔하게 이야기가 흘러가서 아쉽게 느껴졌다 단미소가 사랑스러웠던건 천우희가 사랑스러웠기 때문. 천우희는 정말 멋진배우다  
20171209,10,깔수가 없다..T - T  
20171121,6,"판타지에 대한 기대감이 너무컸던탓에 ㅡㅜ 잔잔한드라마, 조금은 우울한코드 판타지와 왠지 언발런스한 느낌 ㅎㅎ하지만 배우들은 제가 좋아하는 배우들이라 끝까지 다 봤습니다. 로맨틱코미디로 그려졌으면하는 혼자만의 바램이었습니당.너무 진지해요 ^^;;;  "
20171119,10,기대 안하고 봤는데 몇번을 울었냐..ㅠ잔잔한데 몰입도 높고 5번은 울었나보다... 요근래에 본 영화 중 제일 좋았다.  
20171116,10,지금 날씨랑 너무 알맞은 영화였어요. 배우분들 좋은 연기 감사합니다.  
20171115,6,뭔가 어색한 느낌은 몰까??? 부조화!  
20171112,7,두배우의 캐미는 좋았지만 호불호가 갈릴듯.  
20171105,6,상처받은 두 남녀가 조심스럽게 서로를 나름 긍정적으로 위로해주던 멋진 하루 영혼판...  
20171102,4,양산형 새드무비. 독창성은 없고 모든 것이 다 모방에 지나지 않는다. 말 그대로의 아류다.  
20171030,10,연기는 좋았으나 마무리가 약간... 그렇게 했어야 했나  
20171030,10,"아내의 방에서 천우희 병실로, 그리고 눈처럼 흩날리던 꽃잎과 김남길의 걸어가는 뒷모습으로 이어지던 엔딩씬이 이 영화의 백미이자 감독이 전하고자 하는 모든 낱말들이 나열되어 있는 명장면 입니다. 대사 한마디 없는 장면이지만 말이죠.  "
20171029,6,이상 피고의 변론이었습니다.  
20171027,10,아름다운 영화다  너무좋다  
20171027,4,천우희 의식도 돌아왔고 행복한 결말을 기대하고 있었는데.... 좀 황당하네요  
20171023,10,네번을 봤어요. 볼때마다 좋네요. 따뜻한 위로의 영화 맞네요. 처음엔 마냥 슬프기만 했는데 마지막 장면도 충분히 이해되고..강수와 미소는 서로를 통해 자신들의 상처를 바라볼 수 있게 되고 결국 서로에게 가장 큰 위로를 주게 되네요. 여운이많이남는영화.  
20171022,6,관람객신선한 영화로 잘 보았습니다  
20171014,10,김남길 천우희 캐미 쩔어요  
20171013,10,"이렇게 깊은 감정선을 잘 살리는 배우들인데, 안 알려져서 아쉽다ㅠㅠ초반의 츤데레같은 김남길은 너무 멋있었고 인간적인 모습도 멋있다!믿고 보는 배우 천우희와 김남길  "
20171009,9,처음엔 다른 영화들과 다르지 않은 평범한 영화라고만 생각했는데 시간이 지나도 영화볼때 느꼈던 느낌이 계속 생각나서 좋은 작품이라고 생각했습니다!  이런 영화를 보게 되어 정말 행복합니다!  
20171009,8,마지막 병원 장면은 조금 의아했지만 바닷가 씬에서 정말 많이 울었네요ㅠㅠ 사랑하는 사람을 다시 한번 더 소중하게 생각할 수 있게해주는 그런 영화인 것 같습니다.  
20171008,9,마지막 장면때문에 1점 깝니다  
20171006,10,깊이있는 영화 추천합니다  
20171006,8,천우희님 김남길님 연기가 정말 좋았어요 하지만 마지막엔딩에서 꼭 그렇게 끝냈어야 했는지 많이 아쉽습니다  
20171006,7,그다지 크지않은 잔잔한 감동을 느끼고 싶을 때 볼 영화  
20171004,5,영화 좋고 배우들 연기도 좋았는데 결말은 좀 마니 아쉬웠습니다.  
20171003,10,관람객김남길만의 분위기가 너무 좋았다. 이윤기감독과 김남길이 한번 더 만났으면 좋겠다  
20171003,10,잔잔한 영화를 좋아하는 나에겐 정말 가슴에 와닿던 영화 !특히 후반부에 김남길의 감성연기가 너무 아련해서 좋았다 ㅜㅜ  
20171002,10,잔잔하지만 울림이 있는 영화.  
20171001,10,잔잔하게 여운이 있는 영화  
20171001,7,천우희의 연기와 분위기때문에 재밌게봤다. 하지만 예고편을 보며 흥미진진한 소재에 기대를 했던거에 비해 생각보다 스토리가 너무 산만했다. 뭐 어쨌든 천우희 짱짱걸  
20171001,10,잔잔하고 감성적인 영화..바닷가씬에서 울컥했다  
20170930,9,관람객김남길 사랑해여!!!!남친이랑 봤는데....ㅋㅋㅋㅋ  
20170930,10,펑펑 울었습니다. 여운이 남네요.  
20170927,6,흐뭇한 감성과 혼란한 이성  
20170925,10,잔잔한데 넘 좋았어요.억지로 울리려는게 아닌데 마지막에 폭풍 눈물..ㅜㅜ김남김 연기 넘 잘하고..여운이 남네요..ㅜㅜ  
20170924,5,배우들의 연기는 역시 좋았다. 하지만 이 영화를 보면서 어떤 장면도 마음을 휘어잡지 못했다...잔잔한 것도 좋지만 조금만 더 다른 정극영화와의 차이점을 넣었다면 어땠을까...? 아쉬움이 많이 남는 영화였다..  
20170924,6,이윤기라서 봤는데 이윤기스럽지 않은 결말에 당혹스럽다  
20170923,9,엔딩때문에 별하나 뺍니다배우들 연기 정말 좋아요마지막3분은..없는게 더 좋았을것같네요  
20170922,7,김남길의 행동이 억지스럽지 않고 설득력이 있긴 했지만 좀 찜찜함이 남네요.  
20170922,5,처음부터 끝까지 잔잔하게  
20170922,10,믿고보는 김남길 연기다  
20170921,9,밀리언달러베이비는 괜찮고 어느날은 불편한결말.. 영화는영화다  
20170920,9,"파도도 비바람도 없는 잔잔하고 조용한 바다같은 영화, 그러나 그 깊이는 가늠할수 없을 만큼 많은것을 생각하게 하는 가볍지 않은 영화. 미소가 케인없이 한걸음씩 걸어갈때 그 떨리던 손끝과 바닷가에 홀로 앉아있던 강수의 뒷모습은 너무 처량하고 애처로웠다.  "
20170920,10,잔잔한 영화지만 가슴 아리게 눈물을 흘리게 되는 영화.너무 좋은 영화. 좋은 배우이다.  
20170919,10,"역시 김남길, 천우희씨 연기는  어색한데가 하나도 없네요. 두분 연기 잘 봤고 앞으로도 많은 작품에서 봤으면 좋겠어요.  "
20170919,5,관람객보고나서 무언가 허전함..볼만합니다  
20170918,9,김남길같은 사람 만나고싶다 많이 사랑해주고 슬퍼해주는사람. 그러려면 나도 그렇게 돼야겠지  
20170915,10,한장면 한장면이 모두 기억에 남는 영화였습니다. 잔잔하게 흘러가면서 마음을 어뤄만줘주는 따뜻하고 여운이 남는 영화였어요.  
20170915,9,분위기 넘나 좋은 것...  
20170912,10,"""내가 너를 어떻게 잊어"" 이 명대사는 내 가슴속에 오래남을것같다  "
20170912,8,관람객졸쟘입니다ㅎㅎ꼭보세영  
20170912,2,완전 쓰렉. 뭐야 이게 감독이 하고자 하는말이 뭐냐. 그리고 쌩둥맞게 나를 기억해 달라는둥 ㅎㅎ 마지막엔 살인까지 하더만! 완벽하게 진부한 한국 신파극  
20170912,8,엔딩장면 전에 끝났으면 더 좋았을듯..그래도 처음부터 끝까지 잔잔하니 좋았어요  
20170911,10,ㅠㅠ울었다ㅜㅜ두배우의연기일품  
20170911,10,잔잔하게 마음을 울리는 영화입니다. 비오는 날 보기좋아요~!  
20170910,10,천우희천우희천우희천우희  
20170909,6,현실에서는 살인범 김남길~  
20170909,6,사람들은 살아가면서 누구나 아픔을 안고 살아간다  
20170907,4,"관람객음,,,생각했던거 보다는 조금 지루했던 내용이에요 퐌타지를 통해 안타까운 일상을 보상해주려는거같았어요  "
20170907,10,댓글 쓰려는데...생각하니 또 눈물납니다.. 시나리오 배우연기 정말 최고의 영화입니다..  
20170906,10,김남길 너무 좋았다 매번 자기옷마냥 배역소화  
20170906,9,관람객비가 오는 날에 보기 좋은 영화인거같다  
20170906,10,김남길은 김남길만의 고유한 분위기가 있다. 그 분위기가 이 영화를 리드한다.  
20170906,8,관람객이런 잔잔한 영화 좋아요  
20170905,6,역시 너무 사랑스럽다 천우희  
20170904,10,펑펑 울면서 봤네요. 아픈 가족이 있어봤던 분들은 영화가 더더욱 와닿을거예요. 저도 엄마 생각이 나서... 김남길씨 연기 정말 너무 좋네요^^ 천우희씨도 밝은 모습뒤에 가려진 내면 연기가 너무 좋았어요.  
20170903,1,뭐지 재미도 없고 감동도 없는 이 영화는...보험사 직원과 식물인간 귀신과의 로맨스 같지도 않은 애매모호한 관계는 뭘까...보험사기꾼을 아픈 아들로 포장하는건 뭐고...귀신이 자기 죽여달라고 해서 식물인간 살인...그러면서 자기 잊지말래 소름...  
20170903,6,1234567890  
20170902,10,우희느님은 여신인게 틀림없다.  
20170902,8,천우희는 언제나 치트키인 걸  
20170901,7,잔잔하고 여운이 오래간다...근데 초중반은 지겹다 솔직히  
20170831,10,잔잔하고 감성적이고 슬픈영화.힐링되는느낌인 영화였다..  
20170830,5,내가 수준이 낮은건가?의심 될정도의 평점이다  
20170830,9,김남길 천우희 최고다ㅠㅠ  
20170829,7,결말이 황당하긴 하지만.. 김남길 멋지네요. 푹 빠짐  
20170828,10,이윤기 감독님 작품은 잔잔함 속에 항상 깊은 울림이 있어요. 멋진하루가 제 인생영화인데 이 작품도 너무너무 좋아요. 앞으로도 좋은 영화 많이 찍어주세요~  
20170828,6,그냥 그랭ㅠㅠㅠ 마지막이 아쉽  
20170828,10,어느날 누구에게나 생길 수 있는 일을 소재로 배우들의 감성 연기가 돋보였던 명작이라 감히 생각한다.  
20170827,9,잔잔한 감동이 밀려오는 영화...보는 내내 따뜻했어요^^  
20170826,7,"이해가 가지 않는 바는 아니지만, 결정적으로 동감할 수 없다.  "
20170826,8,두번 버려진다는 그 괴로움을 어떻게 이해할수 있을까? 내가 겪어보지 못한 일을 쉽게 판단하지 말자..  
20170824,5,관람객중간에보다가 나온 영화 지루했음  
20170824,7,돋보였던 김남길의 연기와 시각 장애인의 고단한 삶. 분위기가 절정에 올랐을 때 흘러 나오는 음악이 한 몫 했다.  
20170824,8,잔잔하니 정말 좋다..결말이 너무 슬픔  
20170823,10,그저 이 한마디 남기고 싶어서요. 너무 좋은 영화입니다. 감성 충만한..  
20170821,8,관람객뭔가 가슴을 뭉클하게 하는 그런 영화였음..마지막은 넘 슬퍼서 ㅠㅠ  
20170821,9,진짜 영화자체가 슬프면서도 아름다웠는데 결말이 너무 아쉽네요....  
20170820,10,너무 슬픈게 아니라 잔잔한 슬픔이여서 더 감명깊던 영화...내 소중한 사람들이 한명씩 생각나는 그런 주위를 둘러보게 하는 영화  눈 시울보다는 코끝이 찡해지는 영화  
20170819,9,영화보며 까마득히 잊었던 사람이..병상의 그 모습이 생각나서 나도 모르게 눈물이 나는데 참..집에 와서도 기분이 먹먹하네요. 보세요 마음의 정화가 필요하신 분들은...  
20170818,10,관람객생각나는 영화 보고싶어 친구야  
