0,1,2
20170408,9,"힘들고 무섭고 두려운 우리 모두의 삶을 다시금 직면하려 할때, 겪는 진통은 당연한 것. 다만, 누군가 내 손을 겹쳐 잡아준다면 그것으로 위안이 될 수 있지 않을까? 마지막 씬의 김남길의 뒷모습이 기억에 참 남는다.  "
20170408,2,관람객정말 오랜만에 본 영화데 지루하고 좀 ...  
20170408,4,본격 남주인공 인생 조지는 영화  
20170408,9,심야시간때에 소중한 사람과 단둘이 보기를 추천해주고 싶은 영화. 잔잔한 감동이 있고 많은 생각이 들게 해주는 영화.  
20170408,1,"한마디로 말해서 쫄리면 뒈지시던가라는 말이 딱 맞음.. 자살방조영화,,, 감독은 뭣이 중헌지 모르나 봄,, 안 그래도 다들 힘들게 사는데,, 자살을 미화시킨 영화 최악의 영화임  "
20170408,7,잔잔하고 여운이 너무 많이 남는 영화..배우들의 연기도 좋았고케미도 좋아서 몰입도도 좋았다.어떻게 보면 지루한면도 없진 않았지만 감동있는 영화였음..아쉬운점은 런닝타임을 조금만 줄였다면 어땠을까? 아쉬움이 남는영화였음..그리고 천우희 너무 이쁘더라..  
20170408,10,관람객재미있다!!!!....  
20170408,1, ㅋㅋ나 포함해서 다섯명 심야로 봤는데내빼고 다나감 존나욕하면서 ㅋㅋ 난 끝까지볼라햇는데 못참고 나감넘 재미없드라 솔직히 배우보고간건데 ㄹㅇ비추 이거볼시간에 딴거하세요  
20170408,10,섬세한 김남길의 연기가 돋보이는 영화였다. 잔잔하지만 가슴에 울림을 주는 그런 따뜻한 영화. 중간중간 내내 울면서 봤다ㅠㅠ 마음이 고단한 사람들이 보면 많은 위로가 될 것 같음.  
20170408,6,천우희 김남길의 안락사 공익광고  
20170408,10,대사 하나하나 감동적입니다. 이런영화가 흥행을 해야하는데 배우들 연기부터 스토리전개까지 완벽했던거 같습니다. 남자세끼가 영화보고 질질 짜다 왔습니다. 정말 꼭보세요 인생영화입니다  
20170408,1,평점 알바가 존재한다는걸 뼈저리게 느낄수 있었음...  
20170408,9,웃음과 눈물을 모두 갖춘 웰메이드 영화  
20170408,5,"구도자적인 삶에만 행복이 있는 것은 아니다. 어떤 감정을 말하고 싶은지, 어떤 생각을 보여주고 싶은지가 불분명하게 느껴졌다. 사랑에는 희생과 고통도 있지만 그게 사랑의 전부는 아닌데, 이들의 사랑은 희생과 고통만이 유일한 것 같아서 안타까웠다.  "
20170408,9,이윤기 감독은 서울 도시의 모습을 덤덤하게 잘 그려낸다...  
20170408,8,오늘 봤는데 마지막 김남길 살인죄 아니냐? 영화 몰입하다가 계속 잡혀가나 안잡혀가나에 집착함... ㅋㅋ  
20170408,9,관람객괜찮네요 뭔가찡하면서  
20170408,1,다들 알바썻나?와..로맨스도 아니고 이건뭐..뭘말하는지도 모르겟고 그냥첨부터 끝까지 잔잔 웃끼지도 않구..나첨으로 보다 잠들엇음...친구들도 최악의영화라고 돈아까움ㅡㅡ  
20170408,3,캐릭터는 붕뜨고 진부하고 스토리도 별로고  천우희가 의외로 엄청 겉도네  해어화때도 그렇고..  
20170408,6,봄영화인줄알고 설레서봤는데 이건 가을영화다. 벚꽃이아니라 단풍잎이 더 어울릴것만같은영화다. 주인공 감정에 몰입되려하면 다른 주인공의 새로운 이야기가 튀어나와 내용은 산만해지고 감정선은 들쑥날쑥이다. 내가 감성이 매말라졌나? 라는 의구심이 들었다.  
20170408,7,개인적으로 김남길의 스토리가 조금 아쉬움. 천우희 스토리는 몰입했는데..  
20170408,1,이렇게 지루하고 재미없는 영화는 첨이다.  평점에 속았다.  
20170408,10,남자인데요... 정말 잘봤습니다 추천 꾸욱  
20170408,9,잔잔하지만 진한 여운이 남는.. 그리고 그리운 누군가를 보고싶게 만드는 영화..  
20170408,10,흐린 날 혼자 보고 왔는데 정말 잔잔하고 이상하게 씁쓸함도 남았던 것 같다. 누군가는 지루하다 할 수 있는 영화라 생각되어 함부로 추천은 못했지만 난 정말 만족스럽고 끝나고 난 후 여운이 마음에 들었다. 천우희배우 너무 사랑스러워..ㅠㅠ  
20170408,10,관람객잔잔하고 감정이 서서히 올라옵니다 ㅠㅠ두 배우의 연기가 진짜 최고예요 ㅠㅠ  
20170408,7,관람객나쁘지않은 영환데 지루하긴하다.. 액션 취향이신분들이 보면 잠잘듯하고 아주아주 잔잔한 영화 좋아하시면 볼만할듯 하다 암튼 지루하긴하다  
20170407,10,관람객잼있고 감동적이었다아  
20170407,10,오래만에 너무 좋았다. 잔잔한 감성영화..  
20170407,9,감수성 자극하기 좋음.초반 전개상 스토리가 지루하나 중반부 들어서면서 탄력받은 느낌이 좋았고 여운을 잘 이끌어내면서 소화시킨듯한 느낌.결론근데 평론가들은 왜이리 짜게준지 나는 모르겠음.봄의 색이 잘 어울러져 가족애와 사랑을 그렸다고 생각한다.  
20170407,10,연기도 좋고 잘봤습니다.  
20170407,2,영화같지 않은 영화.. 처음부터 끝까지 무표정으로 봤다...  
20170407,3,관람객노감동 노잼입니다 하하하  
20170407,10,관람객가슴이찡 재미있었어요  
20170407,1,결론에 끼워맞추기식 영화.캐릭터도 희미하고 주제도 희미.이영화를 보고 이름을 김희미로 바꾸고싶어졌다.  
20170407,5,관람객첨은 심심하고 지루했어요후반부터 슬프고 ㅜㅜ  
20170407,10,재밌었습니다. 잔잔한 영화라 지루할 수도 있는데 저는 정말 좋았어요.  
20170407,10,"영화 보는 중에 리뷰남깁니다. 너무 재밌습니다. 스토리, 배우들의 연기, 몰입도까지 어느 하나 흠잡을데가 없네요!  주말 데이트코스로 손색이 없 습니다. 적극추천!!  "
20170407,9,관람객마음이 아련하네요...  
20170407,9,김남길과천우희에 감정선을 따라가보니 CG는 아지랑이가 되었다  
20170407,10,삶과 죽음과 기쁨과 슬픔에 대한 이야기  
20170407,10,영화 보고 집에 오는 내내 슬펐지만 늘 똑같았던 풍경이 아름답게 보였다. 내 인생의 어느날로 자리 잡을 영화.  
20170407,10,아픔에 대해 진심으로 공감할 줄 아는 영화.  
20170407,7,음.. 기대를 많이 해서인지 조금 실망스러웠으나 배우들 연기는 정말 좋았습니다. 영화 자체는 잔잔하고 가볍게 보기에는 괜찮은 거 같습니다. 다만... 결말이 좀.. 많이 씁쓸했습니다 차라리 열린 결말로 갔으면...하는 생각이 들더군요.  
20170407,8,먹먹하고 애잔하고 잔잔한 감성드라마  
20170407,8,장님이아니라 시각장애인입니다... 왠지 감동적이야~!  
20170407,10,"별생각없이 봤는데....잔잔한 슬픔과 감동이 있네요..여운이 남아  복잡할까봐 끝나자마자 얼른 나와버렸네요....이런 영화 많았으면 좋겠네요...관객이 별로 없었지만  여기저기서 눈물흘리며 우는 소리가 들리더라구요,,,괜찮은 영화에요.  "
20170407,7,관람객잔잔하게볼수있는영화입니다~~  
20170407,10,잔잔하면서 먹먹한 영화..ㅠ 김남길천우희 무대인사로 봤는데 너무 잘생기고 예뻐요ㅠㅠ 둘다 연기잘해서 몰입감 대박.. 둘다 울때마다 나도 따라울게됨ㅠㅠ  
20170407,5,와 5점 잘 안주는데.... 준다. 슬프고 뭔가 애잔하게 가다가 살인플래그. 므냐 이게 눈물이 쏙들어가면서 소름이 돋더라. 장르가 반전 스릴러냐?  
20170407,9,사랑하는 사람이 먼저 가신 경험이 있으시다면 펑펑 우실 영화  
20170407,10,관람객이 먹먹함이란..실컷 울고 온 영화  
20170407,9,관람객상당히 잔잔하면서도 상당히 여운이 넘치는 영화  
20170407,2,지루.... 힐링하려는 척 너무 질질끄는 영화  
20170407,10,관람객감동적입니다 오랜만이네여  
20170407,10,좋다. 그 한마디로 평가할 수 있을 것 같다. 마음이 따뜻해지고 뭉클하다  
20170407,10,잔잔하지만 정말 긴 여운이남는 영화  두 배우의 연기도 너무 좋았고 스토리가 정말 좋은 영화네요...김남길 배우 연기에 취합니다..영화가 주는 메시지의 여운이 너무나 기네요간만에 좋은 한국 감성영화를 볼 수 있어서 좋았습니다..  
20170407,5,"천우희, 김남길이 열연했지만, 이야기와 연출이 너무 진부하고 촌스럽네요. 어디선가 본 것 같은 내용을 의미없이 나열하며 섞어 만든 영화.  "
20170407,1,진심보는내내지루함 진짜 재미라고는..  
20170407,10,잔잔한영화 너무 좋았다  
20170407,1,진짜재미없고 감동도없고뻔하고 지루해죽을뻔  
20170407,10,관람객여운...결말이..생각많이되게하네요 좋은영화입니다  
20170407,10,오랜만에 이런 감성 좋다. 김남길이 로코에 나오면 잘 어울릴듯. 천우희도 로코 함 나왔으면... 요즘 로코가 없다.  
20170407,1,감독이 무슨생각으로 만든 영화인지 알수 없음.. 이게 잔잔하고 좋은 영화? 자살과 죽음에대한 미화일뿐 정말 최악의 영화  
20170407,1, 당신거기있어줄래요가 명작이엿구나  진짜 답답한구석이 한군데가아니다  
20170407,10,물론 뻔할 수 있지만 뻔해서 사람사는 얘기가 아닐까 싶다 김남길 연기에 홀딱 빠졌다  
20170407,8,잔잔 하면서도 먹먹한 이 느낌...영화 참 좋아요~~역쉬 ~ 천우희씨 연기력과간만에 본 김남길씨 얼굴보니 좋네요^^  
20170407,10,삶의 힘들고 어려운 순간 속에서도 나를 사랑해주고 소중히 여겨주는 사람들(가족)이 내 곁에 있다는 것만으로도 감사해야 함을 느끼게 해주는 영화라서 그런지 보는 내내 마음 한구석이 따뜻해지고 계속해서 눈물이 나요.  
20170407,1,핵노잼!!! 스토리도없고 대체 뭔얘기야ㅡㅡ 평점에 낚이지 마세요ㅠㅠ  
20170407,9,장님이 아니라 시각장애인 입니다!!!!  
20170407,1,전 이게 무슨 의도로 만든 영화인지 모르겠습니다.;  
20170407,8,멋진 하루 같은 영화를 기대했는데 주제가 너무 무거웠다.  
20170407,10,관람객어느 날이었던 거 같아요.살면서 어느 날이라는 의미에 대해서 다시 한번생각을 해보게 되었습니다. 무심코 찾아오는 어느 날에 대해서 의미를 주어 어느 날을 되돌아 봅니다.그럼 have a good time! 보내길!  
20170407,10,죽음에 대한 민감한 주제에 관련된 내용이라 영화가 전달하는 메시지에 대해 공감 비공감은 사람마다 다를거 같습니다. 그런데 그런거 떠나서 영화는 완성도 높고 연기들도 만족스럽고 잔잔하게 볼만한 영화네요. 특히 천우희씨 진짜 예쁩니다..  
20170407,10,불끄고 침대에 누워서 잠들기전 생각나는영화  
20170407,7,좋은 기억만 간직하기...  
20170407,10,관람객잔잔하며 몸이병들거나 장애를 가지면 망가지는 정신은 불가피한모양이다 맘이 아프다  
20170407,8,"어제 아내와 롯데용산시네마에서 봤습니다...""어떻게 살것인가""만 고민하다가 ""어떻게 사람답게 죽을것인가""를 고민하게 만드는 영화네요....마지막 바닷가씬에서  ""울컥"" 올라오더 라구요...  "
20170407,8,"관람객시간 때우려고 고른거라 기대없이 봤는데 정말 감동적이고 슬펐습니다.여운이 남는 영화이고, 배우들의 호연 잘봤습니다.  "
20170407,9,관람객김남길님 연기도 멋지네요.비오는날 어울리는 잔잔한 영화네요~  
20170407,10,영상이 자체도이쁘고 눈물을 정말 감출수없는영화  
20170407,1,그냥 잔잔만한 영화 억지로 관객들에게 눈물을 내게 하려는 의도랄까.. 전 영화보는 내내 좀 그렇더라구요...  
20170407,7,관람객너무 잔잔...슬펐어요  
20170407,1,계속 지겹게 영혼만 만나다가 억지감성팔이하고 마지막에는 가족도 아닌 보험사 직원이 살인하더니 벚꽃보면서 1킬 0데스하고 끝나는 어이없는 영화  
20170407,2,여자정혜 감독이었으면 안봤다. 영화를 보고나니 왜 진이 빠지냐..  
20170407,3,"로맨스도, 슬픔도, 여운도, 감동도, 모성애도 2%씩 빠져있다  "
20170407,10,관람객잔잔하고 여운이 많이 남는 영화였어요! 좋았습니다ㅠㅠ  
20170407,10,관람객이런 영화 좋아서 10점 드립니다  
20170407,8,"김남길, 천우희 연기력에 박수. 특히 엄마 만나고 나올때 눈물 펑펑. 보고나서 여운이 많이 남았어요.  "
20170407,9,관람객감동과 소소한 재미 예고편보다 더욱 묵직했어요.  
20170407,10,오랜만에 가슴이 뭉클하고 생각이 많아지는 좋은 영화였네요 ^^  
20170407,6,관람객무척 이나 잔잔한 영화..  
20170407,9,내가널어떻게잊어....?  
20170407,5,관람객넘 기대를 했나봐요ㅜ하지만 김남길 연기짱!! 볼만합니다  
20170407,9,결국 울었어요 ㅠ ㅋㅋ 배우들 목소리가 너무 좋고. . 노래도 좋고 너무 좋음 혼자봣음  
20170407,4,무엇을 말하려고 하는 영화인지 모르겠어요 왜 김남길만 천우희를 보는것이며 왜그렇게 천우희를 도와주는건지도.. 영화의 분위기나 영상은 감성적이고 좋았지만 스토리가 부족했던거같아요 그리고 제일 이해안갔던게 마지막은 살인죄아닌가요ㅠ알수없는 영화였습니다..  
20170407,10,관람하는 내내 감정이입하고 볼 수 있었네요 사랑하는 누군가를 잃어본적이 있다면 공감하며 볼 수 있는 좋은 영화였던것 같아요  떠난사람들에 대한 슬픔과 괴로움으로 범벅진 마음을 마지막에 좋은추억만 기억하고 잊지말라는걸로 치유해주려고하는게 가슴깊이남네요  
20170407,10,오늘 조조로 보고 왔는데 영화관에 혼자였음...나올때 눈물자국 티안내느라 고생함... 남잔데...  
20170407,10,김남길이 이런 서정적인 영화에 출연해줘서 고맙네요  
20170407,10,"쳔우희가 이리도 예뻤다니... 김남길의 눈빛을 잊을 수가 없다. 이 봄날, 이 영화와 함께라서 좋았다.  "
20170407,9,천우희 김남길씨 연기 자연스럽고 좋았어요 전 잔잔한 메인 ost가 기억 남네요 대사도 명대사...과하지 않고 괜찮은 영화같아요  
20170407,9,잔잔하게 보기 좋은 영화 엄청 울었습니다. 김남길 천우희 너무 잘 어울렸고 연기도 너무 잘하던...ㅜㅠ 근데 CG는 진짜 치명적입니다. 제작비가 부족했던건지 볼 때마다 몰입이 확 깨짐....이런 CG는 태어나서 처음 봐요 진짜 CG가 영화 다 망침  
20170407,7,사랑하는 사람을 잃은 짙은 슬픔이 절절하게 느껴지는 영화. 그런데... 마지막 엔딩이 좀 맘에 걸린다. 차라리 바닷가에서 엔딩을 내려 열린결말로 만들었다면 좋지 않았을까..  
20170407,9,재미있게 봤습니다. 뻔한 영화라고 생각하고봤는데 조금 신선했고 마지막에 울컥하고 오열할 준비했었는데 같이 간 친구때문에 빵 터졌...ㅎㅎ  
20170407,10,남길 사랑.. 스토리가 잔잔하니 재밌어요~감독 전작과는 느낌이 달라요~~  
20170407,6,슬픈영화인건 알겠으나 넘흐 지루해염 ㅠ..ㅠ 16부작 미니시리즈를 한번에 본느낌이랄까 암튼 잔잔한 내용과 배우들 연기력은  좋았음 하지만 극장에서 돈주고 볼영화는 아니엿어염  
20170407,3,김윤진연기는 칭찬! 영화가 중반까지는 볼만했으나 끝으로 갈수록 이게 뭐지..? 스릴에서 판타지로  넘어감ㅋㅋ  
20170407,10,관람객오랜만에 영화다운 영화를 본 듯한 기분!!! 엔딩 크레딧이 올라갈 때까지 여운에 취해있었습니다. 수작이네요.  
20170407,9,관람객좋은 영화 오랜만에 잘보았습니다핵폭탄급 여운이 있는네요  
20170407,10,슬픈내용을 잔잔하게 담은 영화에요천우희씨  연기는 편안하고 좋았습니다.  
20170407,1,최악의 영화  !!!감독의 양심이 의심스럽슴니다  
20170407,10,영화를 보는내내 마음이 평화로워졋네요 이 각박한세상에  
20170407,9,삶의 소소함 속에서 겪는 우리의 슬픔과 그 슬픔속에서 건져 올리는 아름다운 추억과 느낌을 담백하게 그려낸 영화  
20170407,10,진짜 보고 진짜 많이 울었당 여자친구랑 ... 뭔가 매정하면서도 너무 가슴아프네요 잊혀지는게 제일 슬프다는게... ㅠㅠㅠ  
20170407,2,포스터 분위기때문에 기대하고갔는데.. 좀 .. 다른영화더라구요 .. ㅠㅠ 에휴  
20170407,10,정말 요근래 본 영화 중 최고인거 같습니다 꼭 보세요!가족이건 친구건 여자친구건 남자친구건 혼자가던 꼭 보세요 추천  
20170407,10,제가 좋아하는 분위기의 영화와 가끔 등장하는 소소한 웃음 좋았습니다!!  
20170407,10,"잔잔한 여운을 주는, '죽음'이라는 소재를 다룸에도 불편하지 않았던 따뜻한 영화  "
20170407,8,조용한 감동?큰 기대를 가지고 보면 안되는 영화?23시 45분 티켓을 들고 들어가 앞자리를 덜렁 혼자 차지하고 본 내게 전용관이된 영화.삶을 조금씩 정리하며 살아가야겠다 너무이른가?ㅋ이번주엔 벚꽃 눈을 맞아야겠다.  
20170407,3,아  정말날씨도  좋구 잔잔한 영화볼까했더니    연출이 이게뭐냐   연기가 부족한게 아니라   좀지루하고  그닥슬프지도  아몰라  짜증  너무올드해  
20170407,10,아 정말 슬프다는 말밖에. 엄청 슬프네요. 리뷰 처음 써 봅니다. 정말 좋은 영화네요. 늦은 시간이라 관객이 적었는데 잘 됐으면 좋겠어요.  
20170407,6,평점 되게 좋네..나만 별로였나..후반부로 갈수록 감성을 자극하긴하나 전반적인 앞부분 내용이 다소 지루했음...하지만 영상미라던가 굉장히 편하다고 해야되나 나른한 영화  
20170407,10,상처와 직면하고 이를 극복하는 방법을 알려주는 영화  
20170407,10,진짜진짜여운도많이남고개인적으로이런영화를좋아해서좋게봤는데 어떻게보면많이지루했었던것같기도합니다ㅠㅠ 그치만 진짜최고였어요!  
20170407,2,완전 지루했습니다....  
20170407,8,관람객여자친구잤음.쿨쿨쿨  
20170407,10,상영시간이 흐르는게 아쉬웠다. 또 보러가야지  
20170407,10,많이 울면서 봤습니다. 감동도 잔잔한 재미도 있었고 김남길과 천우희 이 두 배우의 힘이 대단합니다.  
20170407,10,오랜만에 극장 나와서 뿌듯한 기분이 드는 영화였음. 배우 앙상블도 조코 음악도 조타  
20170407,10,일단 돈은 안아까워요 두 배우 분들의 연기에 감동 두번세번네번하고 갑니다...  
20170407,7,남길이와천우희조화가 있었지만 감독연출은밸루밸루  
20170407,10,중간중간에 웃음도 있구 힐링되는 영화  정말 봄에 어울리는 영화다 이 영화 한번쯤은 꼭 봐야한다 넘 좋음  
20170407,9,적적함 여운 감동 느끼실 준비 됬으면 함께 하시죠  
20170407,9,앞부분은 먼가 집중안되고 햇지만 점점 빠져들면서집중하게되고 오랜만에 잔잔한 영화로 생각하면서 본 따뜻한 영화네요!  
20170407,9,첨에는 조금 지루하다가.. 마지막에 울고나오는 영화.요즘 시끄러운 영화사이 잔잔해서 오히려 좋았음  
20170407,2,1. 김남길이 나와서 봤다2. 지루해서 잤다3. 눈물 따윈 나지 않았다.  
20170407,1,도대체 영화가 뭘 말하려고 하는지 전혀 모르겠습니다.어의가 없는 영화네요.  
20170407,10,역시 천우희~ 김남길잔잔하고 슬픈영화걍 올만에 편히울며본 영화 ㅎ  
20170406,10,이별을 영혼과 영상미로 표현한 수작.  
20170406,10,죽어가는 사람의 마음 남겨진 사람의 마음 떠나간 사람의 마음 떠나간 사람의 마음을 받아드리고 이해하는걸 잘 묘사한 영화다 아름다운영화였다  
20170406,2,"바닷물에 사과를 얻고 싶어 토마토를 심고, 잘 자라라고 스테이크를 뿌립니다. 무슨 개소리냐구요? 이 영화가 그렇습니다.  "
20170406,9,"관람객남겨진 사람들에 대한 이야기, 많은 생각을 하게 되는 영화!  "
20170406,10,김남길은 면도한게 낫다  
20170406,5,중반부 까지 좋았습니다.  
20170406,8,잔잔하고 볼만했어요~중간중간에 눈물콧물ㅠㅠ  
20170406,10,관람객김남길과 부인의 꽁냥꽁냥 장면에서 폭풍 눈물 ㅠㅠㅠㅠ  
20170406,8,관람객잔잔하게 스윽 들어오는 영화...^^  
20170406,3,한껏 기대하고 본 영화인데.... 감독이 무슨 느낌을 뭔하고 만들었는지는 알겠으나 너무나 촌스럽네요... 보는내내 안타까웠던 영화 ㅠㅠ  
20170406,10,관람객ㅠㅠ 무의미하지않는 ㅠㅠ입니다  
20170406,10,관람객화면이 너무 예뻤어요. 천우희도 너무 귀엽  
20170406,9,9점 오랜만에 별점남기게만드는 영화...하지만 볼수록 센치해지네요 여주건 남주건 주어진 상황이건 다 볼수록 인생 뭐같다는 느낌임...많은여운을 주는 또 생각을 주는 영화지만 개인적으로 안봤으면 좋았을거란생각도 듭니다  
20170406,10,잔잔한 영화 좋아 하시는 분 강추~~ 영화가 단백해요  
20170406,10,관람객시간이 지날수록 재밌네요!!  
20170406,10,영상이 예쁨! 다들 연기도 잘함!  
20170406,2,근래 본 영화중 최악뜬금없는 연출 어색한 연기 개연성없는 스토리알바들 그만 판치고ㅋㅋ영화 색감같은건 이뻣음 나머진 진짜 이건 아니다.  
20170406,9,파도 같은 영화인 것같다 잔잔하게 밀려오다가 영화가 끝나고 여운이 덮친다 두배우의 연기에 다시 감탄사가 나온다  
20170406,9,관람객잔잔하고 여운이 남는 영화. 특히 꽃 잡는 장면은... 정말 예뻤다...  
20170406,9,역시 천우희는... 미용실에서의 연기는 정말 굉장하다는 느낌을 받았다.  
20170406,10,관람객영화가 끝나고 알 수 없는 감정에 휩싸였다 뭘까 멍하니 생각한다 이 영화가 주는 메시지가 뭘까를 생각하는 건가 아니면 뭐지 아 멍하다 여운이 오래갈 것 같다  
20170406,1,리얼핵노잼 잔잔하다못해 지루하고 답답한영화  
20170406,9,감동을 강요하지않으면서 감동적인 영화는 오랜만이네요김남길 배우와 천우희 배우의 연기가 너무 좋았습니다  
20170406,2,보는내내 졸면서 본게 30프로  
20170406,1,진짜 재미없었던 영화 보는 중간중간에 김남길의 행동이 너무 답답했고 내용자체도 그렇게 훌륭하진 않았던 영화 중간에 나가려다가 보는사람들에게 민폐끼칠까봐 못 나갔네요. 개인적으로 비추입니다.  
20170406,6,진행전개가 느려 지루했어요  
20170406,9,잊는것만큼  슬픈게 어디있냐며ㅜㅜ내가 너를 어떻게 잊어ㅜㅜ영화끝나고나서도 슬픔이ㅜㅜ  
20170406,10,저도 잔잔하게 잘봤습니다 비가와서그런지 감정이입이 격하게 되서 중간부 부터끝까지 계속 눈물만 흘렸네요 ㅜ 앞에 남자분도 코훌쩍거리면서 보시더라구요 ... 넘나 슬픈것.  
20170406,2,익히 보아왔던 설정을 빌어왔으면...조금은 색다르게 혹은 눈물나게 감동있게라도 풀어가볼것이지- -;; 앞자리 모녀관객 졸고 계시더라는^^;;  
20170406,10,관람객담담하게 울리는 영화. 영화에서 봄기운이 물씬 난다.  
20170406,10,존나슬퍼ㅠㅠ....ㅠㅠ  
20170406,7,관람객슬프지만먼가찡하고먹먹한여운이남네요.천우희님연기잘하시네요.임화영님도너무좋았습니다  
20170406,8,관람객재밌게 잘 봤습니다 연기를 다 잘해요  
20170406,10,관람객들어갈땐 웃으며 나올땐 팅팅부어버린눈비오는날 혼자 보면 감정이입이 두배로...  
20170406,10,큰 내용은 없지만 굉장히 잔잔하고 소소하지만 그래서 눈물겨웠다.   요즘엔 센 영화가 많아서 나름 올만에 울면서 본 영화. .  
20170406,9,깊은 여운과 삶과 죽음에대해 한번더 생각하게되고악한 사람은 없고 삶은 다들  힘들고 아프다  
20170406,10,관람객김남길과 천우희두분의 조화가 굳이었어용 =)!!미소 너무 이뻐용??  
20170406,10,"드라마를 영화관에서 봐야하나라는 회의적인 나를 바꾼 걸작. 스토리도 좋고 배우 연기도 너무 좋고, ost도 굳. 오늘 하루 마음 한 구석에 서 떠나지 않은 너무 좋은 영화를 봐서 좋고 또 좋다. 다만, 남녀 커플 같이 본다면 남자들은 눈물 조심하시길  "
20170406,10,관람객방금 보고왔습니다 시간이 지날수록 감동이 진해질것 같은 영화네요 천우희언니 진짜예쁨...  
20170406,8,따뜻한데 쓸쓸한 영화.  
20170406,10,"관람객잔잔하고 슬프지만 따뜻한, 대사 하나하나 가슴에 남는 영화  "
20170406,1, 시간 남아도는 사람만 보세요 영화가 대체..  
20170406,10,관람객과하지않게 잔잔하게 흘러서 마음에 더 여운주는 영화였어요. 너무 슬퍼요ㅠㅠㅠㅠ  
20170406,8,천재감독 박평식아 조용히해  
