0,1,2
20170417,10,"관람객슬프네요....,,  "
20170417,8,"이윤기 감독님의 멋진하루, 남과 여 를 보고나서 영화에대한 기대가있었는데.. 역시나 그특유의 분위기가 좋아요 잔잔하면서 조용히흘러가는..그러면서 관객들을 영화속에 완전히 몰입시키고 무엇이 옳은가 하는듯한 질문을던지는..영화가끝난뒤에도 남는여운이 좋아요  "
20170417,5,관람객김남길 천우희의 케미나 연기력은 호소력이 있었으나 전반적인 연출이 아쉽네요ㅠㅠ 공감을 이끌어내지 못하고.. 너무 많은 이야기를 집어넣으려 했다는 느낌이 드네요 ! 배우들 모두 연기파인데 차라리 연기력이 돋보일수있는장면들을 넣는게 더 좋았을 것 같아요  
20170417,9,"관람객이윤기 감독님 영화답게 인간에 대한 따뜻한 마음이 보이고, 장면장면 예쁘고, 음악도 어울려요. 조용히 눈물이 주루룩 하는 영화. 김남길 천우희 연기 잘하는 배우들이예요~♡  "
20170417,8,관람객배우들의 연기력은 정말 좋았다고 생각합니다. 나쁘지 않은 영화라고 생각합니다만 내용에 의문이 생기는 순간이 곳곳에 있어 아쉬웠습니다.  
20170417,7,소재와 연기는 좋았지만.. 이야기 흐름이 어색했어요~ 후반부로 갈수록 너무 뒤죽박죽.. 특히 엄마 만나러 갔다가 사고 난 이야기와 바닷가씬..이 영화 한참 뒤에 나왔는데 어색했고.. 그러다 갑자기 너무 싱겁게 결말이 나는 바람에.. 전개가 아쉽습니다  
20170417,7,너무 기대를 한건가..중반넘어서 너무 지루  
20170417,10,모든것이완벽했던 영화 특히 OST 지금도 그여운이 그대로 전해져요  
20170417,10,"관람객호불호가 갈리긴 하지만 자극적인 소재, 사건 없이도 두 사람이 어떻게 관계를 맺고 서로에게 의미를 만드는지 잘 보여져서 좋았습니다 자극적인 것 없이도 사람과 사람이 만나고 성장하는지 보여주는 이야기예요  "
20170417,6,관람객무난하게 잼있게 봤어요. 많은 생각을 하게 하는 영화네요! 김남길 천우희 보러 간거라 ㅎㅎ 개인적으로 그냥그냥 볼만했습니당  
20170417,10,"음악, 시각적 아름다움, 플롯이 조화로운 명작  "
20170417,1,"어이가없다진짜,.,.,.,.,.  "
20170417,10,관람객천우희는 너무예뻣고 영화는 슬펏다  
20170416,7,관람객간만에 감성적인 영화 굿~  
20170416,9,관람객초반은지루할수잇지만그래도 감동적이고 재밋었습니다배우들연기가 다 너무 좋아요ㅠㅠ  
20170416,9,"김남길 , 천우희 씨 연기를 너무 잘해서 몰입감 장난 아니였어요 ㅠㅠ저는 워낙 이런 잔잔한 영화를 좋아해서 완전 굿이었습니다!!  "
20170416,9,순간순간 찡한 대사 장면들이 많았지만 결과가 맘에 들지않음.. 쩝  
20170416,10,관람객형식적인 표현이지만 잔잔하게 스며드는 그렇다고 지루하지도 않았습니다 계속 몰입하며 보았습니다 김남길씨의 내면감정연기와 천우희씨의 매력이랄까 계속 보고싶은 ?ㅎ 전 추천드립니다 봄날의 좋은영화인거같네요  
20170416,10,관람객천우희 김남길표 힐링영화.그냥 믿고보면 됩니다.  
20170416,5,개연성 빵점. 알바 아닌데 10점 주는 감성충들은 창피한줄 아시오 ㅋㅋ  
20170416,4,육감이란 영화와 휴머니즘이 조합됐나..말 그대로 미국영화 제목을 썼더니 글이 안 올라가지네.그래서 육감이라고 표현했다.식스**뻔한 영화란 생각이 든다.그게 아니면..왜 그 영화제목을왜 못 달게 했을까..모방은 창피한게 아닌데..  
20170416,6,관람객의도하는바는 알겠으나 스토리전개아 영상이 좀 아마추어스럽긴했어요  
20170416,10,처음부터 끝까지 잔잔하고 가슴 먹먹해지는 영화  
20170416,10,"감성의 교차로, 감성의 바다.인생영화가 되었다. 요즘처럼 햇빛이 따뜻한 날에도 잘 어울리는 것 같은 영화라고 생각된다.  "
20170416,5,잘 못만든 영화! 짐작하게하고 지루하게한다. 관객의 상상을 방해하며 불필요한 설명이 너무 많다. 그래서 끝날듯 끝날듯 끝나지 않는다. 김남길 덕에 겨우 버팀.  
20170416,1,수박 겉핥기식 영화.!  
20170416,8,관람객감성적인 장면이 너무나도 좋았고 사람답고 울게 하였다.  
20170416,1,"자살, 안락사, 장애인에 대한 시선 등 무게감 있는 주제를 다루면서도 깊이있는 접근없이 신파를 위한 소재로 휘발시켜버리니, 감정선에 개연성이 없어져 시종일관 맥락없는 슬픔만 연기하는 배우들이 불쌍해보였던 영화. 늘어지는 편집도 결말도 총체적 난국.  "
20170416,10,관람객결국 슬픔에 빠져있는 사람을 위로하고 구출해낼 수 있는건 사람입니다 우리 곁에 있는 사람들을 위로해줘요  
20170416,9,영화 잘봤습니다.. 김남길 팬이라 보게됐는데 개봉한데가 적은게 아쉽네요 이런 주옥같은!! 부분은 빵터졌습니다... 간만에 이런영화 보네요... 마지막 부분에 극적 표현을 위해서 그렇게 연출한건 알겠지만. 아쉬웠음... 도망쳐 나오는게 현실적이었을지도  
20170416,10,관람객뻔하지 않아서 좋았다 연기 good  
20170416,10,잔잔하고 영상이 예쁜 영화였습니다.  
20170416,6,관람객순간순간 좋은 장면들은 있었는데 시나리오가 특별한 재미를 주진 못하는 것 같아요.  
20170416,8,잔잔한 감성영화 좋았네요..선화와의 스토리가 짧았던게 아쉽~~ 오토바이맨..돋보이는 연기자였다는~~^^  
20170416,7,잔잔하면서 감동을 주는 영화예요 사람들이 살면서 겪는 슬픔들을 조심스럽게 다독여주는 영화~ 두분의 섬세한 감정연기가 몰입감을 주네요  
20170416,10,관람객슬픈 멜로영화였지만 감동있었습니다.  
20170416,4,관람객천우희랑 김남길의 연기가 맥빠지고 부족한 스토리를 그나마 커버햇다 배우가 아쉬워 ㅠㅠ  
20170416,10,천우희의  미용실 씬을  보는순간 감정이 북받쳤다.. 눈물이 이미  흐르고 있었다 최고의 감성 영화 ㅠㅠㅠ  
20170416,9,꾸미지 않은 잔잔함이... 간만에 본 김남길 연기 참 좋은 영화네요  
20170416,8,관람객아름답고 슬픈 영화 여운이 남는다  
20170416,3,"뻔한 스토리에, 눈물짜게 만들려는 설정이지만 눈물은 나오지 않던. 그날 같이 보러간 여자셋은 영화비는 그렇다치고 시간을 아까워하는 공통점이 있었던, 그런 영화. 설정 어색. 끼워맞추기 아쉽ㅠ  "
20170416,10,재미도있고 감동도 있는 영화  
20170416,10,관객들이 다가가기 쉬운 배우들의 연기가 돋보이는 영화♡ 캐스팅이 대박  
20170416,9,봄날에피고 저버리는벚꽂같은 영화..다소지루할수도있는  소재이지만  생각을 많이 하게되는 영화입니다. 김남길님 술취한 연기는 넘나압권♥♥♥  
20170416,10,또 보러가야지 생각할 거 많은 영화 좋아요  
20170416,8,벚꽃이 떠난 그대와 함께 떨어진 4월 어느날.  
20170416,10,혼자서 편하게 볼 수 있었던 영화. 감성을 건드려주는 영화. 좋았어요.  
20170416,1,김남길 진짜 좋아해서 좋게 보려고해도  너무 재미없다..  
20170416,10,관람객배우들의 몰입력이 뛰어나고 최고로 짜임새있는 영화  
20170416,1,OOO기중에 쓰레기 재미도 감동도 없다 진짜 이런 댓글 한번도 안달아봤는데 네이버 로그인하면서 까지 댓글 달게만드는 영화 인생영화 top3다 진짜 물론 뒤에서  
20170416,8,어느날 당신이 내게로 왔다어느날 당신이 내게서 사라졌다어느날 당신이 문득 그리워졌다그리고 어느날당신이 너무나 보고싶다그리고 어떤날나는 당신을 기억한다.  
20170416,7,남길님 팬이어서 오직 영화하나 보러 나갔다왔네요! 예고편에서 약간 코믹 느낌이 났었는데 생각보다 잔잔했구요 두분 캐미가 너무 좋았어요 특히 김남길씨보러 갔다가 천우희씨 연기보고 감명받았에요 미용실씬이 너무 기억에 남네요  
20170416,5,관람객그냥 저냥 가끔씩 볼만한 영화  
20170416,4,어스날 과학의 힘이란....  
20170416,1,믿고보는 망작 김배우의 인생 망작  
20170415,8,관람객울고 싶어  선택했는데 왜 눈물이 안나지요??  
20170415,10,정말 너무 좋았습니다...왠지 모를 찡함..  
20170415,5,관람객김남길 멋찐데 내용이 드라마네요  
20170415,1,관람객영화표를 예매하고 자리에 앉아서 영화봤어요  
20170415,8,관람객내가 너를 어떻게 잊어이 대사 하나로 심금을 울렸다  
20170415,3,관람객약간의 유머가 필요하다 하지만 슬프긴 하다 끝이다  
20170415,10,'내가 너를 어떻게 잊어' 라고 대사하시는 순간정말 이 영화 어떻게 잊나 싶었습니다 제가 본 영화중 가장 마음에 와닿는 영화였습니다 어느날 이라는 영화만들어주신 감독님 연기해주신 배우님들 모두 감사드립니다  
20170415,10,관람객바닷가씬에서 눈물 펑펑 역시 멋진 남길씨~  
20170415,8,관람객괜찮게 봤음~~!!!  
20170415,10,방금 보고왔는데 너무좋았어요 김남길 천우희 연기 너무 훌륭했고 가슴찡했네요 잔잔하면서 영화가 끝나고도 여운이 너무 강하게 남아요ㅠㅠ짱짱  
20170415,8,관람객어느날 나에게만 보이는 것이 있다.  
20170415,8,관람객잔잔하면서 슬픔영화관을 나오면서 현타오는 영화  
20170415,10,너무 감동적... 진심 추천!  
20170415,10,너와 나를 거기에 두고 오게 해준 영화  
20170415,8,관람객두번울뻔했다 좀더 숨겨진사실이 있었으면  
20170415,10,관람객재밌었어요~~~ㅎㅎㅎ  
20170415,1,관람객지루하고노잼 입니다.  
20170415,6,댓글 알바 장난아니네요...괜찮게 보긴했는데 마지막에 무슨 살인이나 마찬가지인데 결말이 어이없게 끝남ㅋㅋ  
20170415,8,관람객여자친구랑 같이 재밌게 봤네요  
20170415,7,관람객나름 재밌게 보았습니다.  
20170415,10,관람객감동적이에요 강추합니다  
20170415,10,잊혀지는거만큼 슬픈건없다....  너무슬펐어요ㅠㅠ  
20170414,10,케미굳굳굳 10점짜리  
20170414,5,관람객처음부터 끝까지 그대로~~  
20170414,9,관람객뭔가 불편했다. 모르겠다.  
20170414,1,재밌다는놈들 다 알바임  
20170414,10,"김남길과 천우희의 명품연기와 감성적인 스토리가 어울어져 환상의 하모니를 이룬 영화, 일상의 소중함을 느끼게 해주는 영화안보신 분들 꼭 보세요 ㅠㅠ 진짜 인생영화 ㅠㅠㅠ  "
20170414,10,김남길 목소리가 일단 한건 했구요 보는내내 따뜻했던 영화  
20170414,8,관람객주연배우들의연기가 좋음 김남길이 바다에서의장면은 굉장히슬프네요  
20170414,10,잔잔한 영화 넘 좋았어요  
20170414,8,바닷가씬에서 좋았던모습으로기억에남고싶다는 대사가 넘공감되면서 슬펐습니다ㅠㅠ혼자보기에도 좋고 잔잔한 감동이 오는 영화였어요그치만 저도 마지막 장면이 조금 이해가안되네요ㅠ저러면 잡혀가는거 아닌가..하는 생각도 들었어요  
20170414,8,관람객재미있게잘봤습니다.  
20170414,10,잊혀지는거보다 슬픈건 없잖아요  
20170414,7,관람객별 생각없이 봤다가 찡햇네요  
20170414,6,느리고 잔잔한거 않좋아하는 분은 비추임  
20170414,6,싱글라이더가 훨씬 감동이 있었어요 먼가 비슷하면서;;  
20170414,3,어제 보고왔습니다눈물 짜낼려고 슬픈 장면 짜집기한거 같았습니다결론은 추천안해요..  
20170414,1,여주 남주의 연결고리 부족함.살인으로 마무리되는 허무한결말.잔잔해서 잠옴  
20170414,1,진짜 극딜로 재미없음배우도 좋고 연기도 좋은데 극본과 연출이 똥망임.  
20170414,7,"관람객연기는 좋았지만, 왜 그렇게 할 수 밖에 없었는지 제대로 공감하기 힘들었다.  "
20170414,8,관람객가슴을 찡하게 하는 영화  
20170414,10,관람객생각한대로 잘 봤어요 저한텐 많은 의미를 주는영화입니다 ^^  
20170414,6,관람객급작스러우며 안그랬으면 하는 전개...  
20170414,9,재밌을거같다 ㅇㅅㅇ!!!  
20170414,10,관람객흥미진진하네요 이준기나와서 개깜놀햇네  
20170414,10,관람객처음부터 끝까지 잔잔하게 슬픈 영화  
20170414,10,관람객잔잔해서 좋았습니다-  
20170414,10,"일에 치여 살아서, 작품을 보고 울어본지가 몇년은 된 거 같은데. 덕분에 오랜만에 엄청 울었네요. 그리고 많은 생각을 하게 만들었네요. 좋은 웰빙 감성 영화입니다. 추천합니다.  "
20170413,8,약간 지루한면도 없지않아 있었지만... 바닷가에서 김남길의 주옥같은 명대사..저도 모르게 눈물이 흐르네요..  
20170413,3,관람객김남길 천우희 얼굴이 다 했다  
20170413,10,내가 좋아합니다 어느날 오래동안 해주세연  
20170413,10,남친과 안좋았을때 개봉하자마자 혼자 처음 영화를 봤는데 이영화를보며 내가 김남길에 빙의되는 느낌이였다 엄청 많이 울었지만 결정했다 남친과 헤어져야겠다는것을 이별의 아픔을 알려주고 왜 이별해야하지 알게해주는 영화  
20170413,10,잔잔하게 마음을 울리는 영화 오랜만에 아주 재밌는 영화를 본 느낌 배우분들이 연기를 너무 잘하셔서 몰입해서 봤네요!!!  
20170413,9,"""엄마라고도 하지 않을게요.. "" 진짜 울었습니다  "
20170413,10,관람객잔잔하게 아름다운 영화~!  
20170413,10,관람객혼자보기좋은 영호ㅓ  
20170413,8,관람객처음엔 잔잔한 내용이였다가 후반부로 갈수록 감동있는영화였습니다  
20170413,8,느리고 잔잔한 영화. 김남길의 절제된 연기는 역시 최고였어요 김남길의 느낌 좋아하시는 분 추천입니다~  
20170413,9,잔잔한 영화가 보고싶은봄날에 맞는 영화.설레임 가득한 김남길의 연기.또 보고싶다.  
20170413,4,관람객연기는 잘하는데... 너무 지루했어요  그냥 둘이 로맨스였다면 좋았을것을..  
20170413,10,마신 콜라만큼 눈물뺐다  
20170413,3,한숨 잘 잤습니다.. (잠실 롯데시네마에서 방금 보고)  
20170413,6,보고싶어도극장에걸리스크린이별로없어서아직보지못했음그래서평점6점  
20170413,6,감성적이지만 너무 슬픈 장면만 있어서 계속해서 집중하기 쉽지 않음. 안락사에 대한 부분은...논쟁의 여지가 없진 않네요. 그래도 실제 경험에서 나온 시나리오 같긴 합니다.  
20170413,10,관람객내용이 잔잔하고 슬퍼서 좋았어요혼자 영화보러 왔는데 너무 좋았습니다  
20170413,7,관람객무대인사 잘봤습니다사람이 많이 죽는게 아쉬웠다합니다  
20170413,3,영화상영 도중에 지루함을 못이기고 나가는 사람들이 있었는데  지금에서야그들의 통찰력에 감탄한다....  
20170413,3,"다시한번 네이버의 평점을 믿으면 안된다고 생각이드네요..예고편을 저렇게 재밌게 만들고선,,, 영화를,, 에휴돈이 아까운 영화였습니다. 영화보면서 돈아깝다고 생각나는 처음이네요.. 배우가 너무 아까운 영화입니다.  "
20170413,5,마지막 그 후에는 알아서 상상하라는건가?  이유가 어쨌든 범죄아닌가?하는 생각이 들면서 끝남.  
20170413,1,이번해 최악의 영화가 될듯 진심 처음부터 끝까지 연계성 한개도 모르겠고 어디서 왜 슬퍼야하는지 베트맨이랑 슈퍼맨이 화해하는이유 보는 느낌임  
20170413,10,관람객잔잔하고 마음 한구석이 먹먹하네요... 김남길배우 연기가 편안하고 좋았습니다  
20170413,2,보면서도 뭐지 ...? 결말은 진짜뭐지...?  
20170413,7,관람객애도에 관한 성장영화.  
20170413,10,관람객많은생각을하게하는 영화네요^^  
20170413,10,관람객일본 소설느낌살짝 지루한면이있긴해요  
20170413,7,관람객연기는 너무 좋았지만 너무 잔잔했어요...  
20170413,9,관람객영화내내 벚꽃이 너무 아름다웠구 배우님들의 연기도 내용도 참 감동적이었어요 또 보고 싶은 영화입니다  
20170413,10,왜 우리동네는 일주일만에 내려간건가요?보고싶어도 못보는..ㅜㅜ 너무하네  
20170413,5,예고편이 다한영화를 ..2시간동안  
20170413,1,"관람객한마디로 ""뽕쟁이 과장이 살인을 저지르는 영화"" 그 이상 그 이하도 아니다. 과장 와이프에게 억지로 단미쇠 인생을 억지로 끼워 맞추려했던 감독의 노력에 감동할 수 있는 영화 개연성도 앖고 억지 감동 - 간만에 최악의 영화를 돈주고 아깝게 봤다  "
20170413,9,바다씬 개 슬픔..  마음따뜻해지는 영화  
20170412,5,이 영화의 전체적인 결론은 이거임. ' 천우희를 통해 진정으로 와이프를 떠나보낸 김남길' 그렇지만 꼭 그렇게 결말을 냈어야했나.... 천우희는 그저 김남길의 각성을 위한 도구로 전락한 느낌.  
20170412,9,"잔잔하면서 뭉클한 영화네요! 김남길,천우희 배우님들 영화보고 반했어요~ 혼자 봐도 좋은 영화에요  "
20170412,7,"관람객감독의 의도적인것일수도있지만, 아내와 남자주인공의 스토리가 조금더 길게는 아니여도 깊게 다뤄졌다면 하는 아쉬움은 남습니다만. 연기가 좋았고, 연출이 좋았습니다. 영혼이라는 설정이 거슬리지도 않았구요.  "
20170412,8,서면 cgv 저녁 7시 5분 H 열에서 앞좌석에 다리 쳐 올리고 보던 여자들아! 이 글 볼지는 모르겠지만 매너라는게 없냐? 앞에 사람없다고 다리 올려도 되는거냐? 뒤에 앉은 사람은 사람도 아닌가? 신경 쓰여서 못보겠다 젠장  
20170412,4,관람객처음부터 끝까지 잔잔한 영화  
20170412,1,이건 영화가 아니다.  이 평점은 뭔가?  알바의 평점...심하군..정말 엉덩이에 쥐날 정도로 재미없다  
20170412,5,아노하나 스토리 베낀듯  
20170412,10,관람객요즘 같은 날씨에혼자서 보기 좋네요~~슬퍼요ㅠㅠ....  
20170412,9,잔잔하고 지루해서 좋았어요.맘이 쓸쓸할때 보면 꽤나 좋은 영화예요^^  뻔하지만 뻔해서 보기 편했습니다. 이런 영화가 늘었으면해요  
20170412,8,미소의 아픔을 강수가 알아가면서 서로의 아픔을 치유해나가는 이야기가 먹먹하게 다가왔고 배우분들의 연기가 좋아서 집중하며 봤습니다. 마지막 장면이 개인적으로 이해가 안갔지만 그래도 전체적인 흐름이 취향과 맞았습니다. 많은분들이 보셨으면 좋겠습니다 얍!!  
20170412,8,관람객그냥 그랬던 영화  약간 지루했어요...  
20170412,1,제발 빨리좀 끝나라. 집에갈래  
20170412,10,관람객재밌게 봤어요. 볼만 함  
20170412,8,잔잔하니 좋았네요 혹자는 살인이라고 주장하지만 제가 생각할 때 이 영화의 엔딩은 강수가 할 수 있는 최선이었다고 생각합니다  
20170412,8,초반에는 지루한 감이 있었지만 긴장감이 갈수록 고조되면서 장말 몰입하게 되고 좋은 영화인것 같습니다  
20170412,6,음 광고만 보고 잼나는 판타지로멘스인가 하고 봤는데 ... 무슨 내용인지 모르겠더라 ㅋㅋ 뭘 말하고 싶은건지..뭐가 주제인지 잘 모르겠음....재미없지만 천우희가 이뻐서 6점쥼  
20170412,10,가슴이 너무 먹먹해진다  
20170412,10,잔잔하면서 강렬한 영화  
20170412,9,"'어'느날 갑자기 '느'을 가까이서 '날' 비추던 빛이 사라진다면,  "
20170412,8,관람객김날길의 가슴울린연기 믿고보는배우천우희의 또다른 발견 집에와서도 천우희가맴돈다근데 엔딩은 어떤걸전하고싶은걸까  
20170412,9,재미있게 봤어요!!감동도 있구 김남길배우랑 천우희배우의 매력을 한껏 느낄수 있어요~~^^  
20170412,10,꿀덈인뎀 연기도 잘하고  
20170412,3,진짜이거 왜보냐....핵노잼이네 두시간동안 혼자노는게 더재미있을듯;;  
20170412,2,아니ㅜ 너무 지루해서 잤다 뭔내용인지도모르겠다  
20170412,10,이런 영화 많이 나오면 좋겟어요 ..여운이  
20170412,5,관람객한시간반 지루했고 끝에는 엉엉 울었다썸남과 봤는데 내 화장이 날아가서인지그 날로 연락이 끊겼다ㅎ  
20170412,7,관람객감독이 뭘 말하려는건지를모르겠다..그나마 김남길배우의 연기가살렸을뿐  
20170412,10,최고네요  편안하게 이야기하듯 연기하는 두배우의 모습  
20170412,8,관람객감정코드가 모두 성공적. 울다웃도 사는것 기억한다는 둑에대해 생각하게되는 영화.  
20170412,4,관람객결말도이상하고무슨의도와의미를뜨싸고만든영화인지의문  
20170412,2,"진심으로 보지 마세요... 중반 이 후로 언제끝나나 시계만 봤습니다. 너무 뻔한 스토리들과 촌스러운 대사로 울게 만드려고 애쓰는 모습이 보였습니다. 천우희 연기도 별로였고, 그다지 와 닿는 영화가 아닙니다.  "
20170412,9,맑은 어느 날에  어딘가에 걸터앉아 누군가와 웃으며 담소를 나누는듯한 그런 영화였다. 그럼에도 생을 이어가야하는 김남길의 연기와 그렇게 떠나갈지도 모르지만 맑은 천우희의 연기(마치 그녀 실제모습같은)의 앙상블만으로도 볼 가치가 충분한 영화다.  
20170412,1,"극단적으로 재미 없었던 영화.. 90년대 영화의 감성을 가져오려 한 것 같은데, 그리 재밌지도 감동적이지도 못했다.  "
20170412,10,오랜만에 가슴속 감성을 끌어올린 영화~  
20170412,10,블록버스터보다가 이런영화로 가끔 환기가 필요한듯 봄날과 너무나 잘어울리는 영화였어요  
20170412,6,관람객배우들의 연기력은 좋았음~  
20170412,10,시작부터 끝까지 감성에 젖는영화  
20170412,10,관람객감동적이고짠하게만드는영화  
20170412,10,"너에게 보이는 나란, 나에게 보이는 너란  "
20170412,9,결말이 조금 아쉬운감이 없잖아 있었지만 감독의 생각을 참 잘 우려낸 작품이라고 생각해요 . 감독님과 김남길배우님과 천우희배우님의 조화가 빛난 작품이라고 생각합니다 !!  
20170412,10,잊혀지는 것보다 슬픈 건 없잖아요  
20170412,2,관람객재미없어요ㅠㅠ재미없어요  
20170412,10,천우회 명품연기 볼 수 있어서 좋았고 김남길배우 진중한 연기 인상적이었습니다. 무엇보다 이윤기감독  이름 기억하겠습니다.  
20170412,7,관람객잔잔한 영화귀여운 천우희김남길 별로 애정하지 않았는데자연스럽게 은근히 섹시함둘의 므흣한 키차이나도 모르게 몇번 눈물이 났지만스토리는 조금 그럼환타지도 아닌것이민감한 안락사를 너무 붕뜨게 다뤘음  
20170412,5,이기적이고 무책임한 선택의 결과는 누가 감당하는가? 평점은 5/10.  
20170412,10,잔잔하고 약간지루하게느껴질수있지만 은훼이크. 감정의 묵직한 한방이 있다. 만점주고싶음. 마음껏울수있는상태로보는것을추천. 결말에대해말이많을것같은데 이영화가 일반보통상업영화와 다르다는것을확실히알수있는지점인듯. 이영화가말하고자하는것에대해 다시한번생각하게한다  
20170412,3,큰의미는 없다. 상당히별로..  
20170412,8,관람객음.. 비오는 주말 초저녁집안에 들어앉아 조용히 별생각없이보기에 좋은 영화.  
20170412,4,둘다 좋아하는 배우고 잔잔한 영화도 재미있게 보는 타입이고 평점도 높고해서 믿고 갔는데 왠만한 영화는 다 재미있게 보는데이거 정말 핵노잼이었다 ㅠㅠ 진짜 평가글 살다살다 처음남긴다무얼 말하려하는지 목적의식이 희미하고 루즈하고 영화내내 영화끝나기만을  
20170412,9,헐 광숙아! 꽈장님은?  
20170411,10,잔잔하게 펑펑울고 기분 좋게 나와써요 또 보고싶은 영화  
20170411,1,보면서 뭐지??? 화장실 괜히 참았다라고느낌...  
20170411,10,관람객돌아가신 가족이 비슷한 상황에서 돌아가셨습니다.정말 말 한마디 한마디가 위로가 되는 영화였습니다.  
20170411,10,김남길의 연기가 돋보이는 영화다. 스토리가 독특하다. 일본이나 외국에 수출하면 좋은 작품이다.  
20170411,10,먹먹한 슬픔이 따뜻하게 다가오는 그런 영화  
20170411,8,초반부부터 김날길 보고 mbc 다큐 '너는 내 운명'이 생각남... 천우희 얘기는 뭔가 좀 억지스러운거 같음...  
20170411,10,자극적이게 내 마음을 후벼파거나 들추어내는 단어가 아닌... 마치 문을 조심스레 두드리듯이 조용히 내 상처를 꺼내어 위로(?)해주는.. 그런 영화입니다. 처음 느껴보네요 이런 영화.. 감사합니다.  
20170411,9,관람객끝까지 여운이 남았던 영화천우희는 정말 연기를 잘한다는것을 다시한번 깨닫게해준 영화다  
