0,1,2
20170611,1,엄홍길대장도 안볼산악영화감독은솔직히 계좌로 돈보내라  
20170611,10,보고싶은데 상영관이...시간편성이 왜 이런가요?뭔일있었남?이런영화 많이봐줘야할텐데...  
20170611,4,관람객도망쳐 얼릉 빨리 후회하지말고  
20170611,10,누가악플달았지? 잼나던데.ㅋ  
20170611,10,완젼~감동의 도가니..일단 이정재 멋있고..요즘 보기드문 의미심장한 메세지 가득한 영화네요~보석같은 영화예요~!!!  
20170611,6,관람객스토리가 미적미적해서  
20170611,1,"평점 알바 정말 있네요... 1~3점대 악평이 수두룩 한데 갑자기 9점10점대 평들이 연타로 올라오고 또1~3점대, 어느순간 다시 9~10점 알바들 몰려옴.  "
20170611,1,도둑들 이후로 흥행 무패행진중이던 이정재 간만에 1패  
20170611,10,관람객재미없었습니다하1하1하하1하  
20170611,10,관람객역사에 대해 다시한번 생각하게 된계기가 되었던 점에서  잘 봤습니다  
20170611,5,관람객보면서 김성수 감독의 <무사>가 생각났네요.기대가 컸는지 그렇게 재밉게 본 영화는 아니었습니다.배우들의 연기는 좋았습니다.  
20170611,7,관람객영화 무사와 비슷한 내용이네요  
20170611,7,관람객기대가 커서 그랬는지 기대에 못 미친것 같아 아쉽네요  
20170611,9,관람객생각햇던거보다 재미잇습니다  
20170611,9,재미난데 왜 별로 안보나  
20170611,9,다이나믹하지않았지만 꽤 재미있게 봤다.여진구 연기는 좀 어색...  
20170611,8,관람객지루하네요 킬링타임용 으로 좋아요  
20170611,7,관람객내용이 지루하고 뻔한 스토리라 생각보다 별로였습니다  
20170611,7,남는건 골룸닮은 오랑캐뿐  
20170611,3,관람객ㅂㅈ시신ㄷㅇㅅㄱ싣ㅂ닝ㄱㄷㄴ  
20170611,6,관람객그냥 그럭저럭불만한것  
20170611,10,사실 8점 주고 싶은데 별점이 너무 낮아서 10점 줌 마지막에 끌어올려서 확 터뜨리기 위해 앞에선 지루하게 느껴진게 아닌가 싶다 우리나라 자연과 멋진 배우들과의 호흡으로 눈이 즐거웠던 영화였음  
20170611,9,영웅은  보통사람에게서  배우고  현실을 깨달아야  영웅이 된다.  
20170611,6,관람객아쉬움이 남는영화네요  
20170611,6,관람객여진구랑 이정재를 보러갔는데 관객에게 던진 메세지는 좋았으니 좀 지루했던 영화.. 보는데 자꾸 기지개 피고 스트레칭하고 싶었음ㅎㅎ  
20170611,8,관람객재밋습니다 꼭보세여 ㅎㅎ  
20170611,6,관람객아쉽네요 아쉬워.. 연결이 매끄럽지 못함  
20170611,5,관람객좋아요  좀 근데 맘이 먹하던군요  
20170611,1,역대 최악 ..무사2라고 보면 됨  
20170611,10,관람객대립군이라는 것도 있었구나 남의 목숨을 위해 자신의 목숨을 빌어 돈을 벌어야하는 삶도 있었구나  
20170611,10,감동있게 잘봤군만 여기다 별점 낮게주는사람들은 무슨 로마영화처럼 스파르타 처럼 액션신 기대했나? 딱 그시대에 걸맞는 정서와 전쟁을겪었던 사람들의 심리적 표현잘한것 같구만  
20170611,9,나라를 버리고 자기 살길 찾는 왕과 그 신하들 왕이 남겨놓고 간 세자 세자와 함께 싸우는 백성들 한 번 보시는 걸 추천합니다. 산에서 약간 지루할 수 있으나 각 캐릭터의 감정을 보시면 지루한면이 덜 할겁니다  
20170611,10,재미있어요. 많은 생각을 하게 하네요.  
20170611,7,관람객여진구 연기에 다시한번 놀라고ㅎ  
20170611,10,관람객가슴속 뜨거움이 올라 온다. 그들은 결국 현 시점에 우리 라는것.  
20170611,1,최악 등산하며 시간 질질끌고 집중안됨 긴장감 없고 산만함 그리고 한국 망작영화의 특징 감성팔이 그만좀해라 엔딩은 외국영화 빼박이고 평점 8점이상 준것들은 뇌가있냐 니들은 우뢰매나 용가리나 봐라 니들수준에 맞을거같다 이게 8점 이상받을거냐?  
20170611,4,믿고 거르는 배우가 되버렸네 여진구.. 너무 캐릭터 욕심이 많다.  
20170611,7,관람객스토리가크게없네요..  
20170611,7,관람객기대 했다가 실망했슴 ㅜㅜ  
20170611,9,관람객흥미진진하고 긴장감이 있네요.볼만해요  
20170611,4,"관람객뭐라할까? 영화구성상의 진부함이보인다.  기존의 영화와 별다른 느낌을 받지는 못했다. 좀 더,  상쾌한 느낌을 주면 좋겠다.  "
20170611,2,감성파리ㅎㅎ 웃고갑니다  
20170611,10,생각지도 못했던 김무열의 연기가 인상깊었다.이정재와 여진구도 기대를 저버리지않았다.아무생각 없이 본 영화였는데 재밌네..ㅎ  
20170611,9,관람객잼나요 볼만함 ㄱㄱㄱㄱ  
20170611,3,"여진구ㅗ2연타,,최악영화,,,서부전선,,대립군,.,그냥 드라마나직어라,,능력안되면서--영화주인공 하지말고  "
20170611,1,한국영화는 참 특유 감성팔이로 밀고가니발전이없는듯 진짜 이렇게만들거면 영화하지마라인력동원은 인정한다 으휴돈아까워  
20170611,10,"여진구,이정재,김무열,오랑캐(?) 너무 멋있다  "
20170611,4,"기대 많이 하고 봤는데 진짜 노잼,,,  "
20170611,10,"평점이 너무 별로여서 안보려다가 정말 볼게 없어서 밑져야본전이란 맘으로 봤는데, 요즘 본 영화중에서 가장 재미있었네요.뿌듯합니다  "
20170611,1,"포스터의 저 '대립군' 양 군대가 대립한 상태를 표현한 이미지 아닌가? 뭔가 적이 아니어야 하는데 적이될 수 밖에 없는 그런 상황. 재목 자체도 '대립군'이고, 근데 뭐야 이거!  "
20170611,10,관람객이정재가 너무 멋있어요  
20170611,7,관람객그냥그래여ㅎㅎ 딸아이가본거라서 잘몰라요  
20170610,8,관람객연기도 좋고 내용도 좋고ㅡ  
20170610,5,관람객역시배우들의연기력이 좋네요  
20170610,10,관람객아주재미있게봤습니다  
20170610,10,진심으로 감동이었다.  
20170610,9,관람객참 구성이 좋은 영화입니다.  
20170610,10,관람객과거에 빗대어 현재를 보니 뜻깊은 영화입니다 리더의 중요성을 깨달은 영화  
20170610,10,관람객재밌었어요 참신한소재  
20170610,6,이정재 다시 침채기 오나요..  
20170610,8,관람객기대안하고봐서그런가 재밌었어요  
20170610,8,관람객재미있었습니다. 연기력이 진짜 볼만하네요  
20170610,1,조센징 미화영화는 무조건 1점. 이순신 세종 빼고는 인간 쓰레기들을 집대성한 시대. 위고 밑이고 짐승과도 같았던 시대 미화 좀 제발 하지마라. 속고 속이고 널부러진건 개돼지뿐이었던 쓰레기나라 이씨조센!  
20170610,5,관람객그럭저럭 볼만한 영화네요.  
20170610,8,관람객기대보다는 못미치는것같음....  
20170610,1,스토리가 너무 부실함. 이건 광해군 성장 영화도 아니고 그렇다고 무슨 교훈이 있는 것도 아니고.. 그냥 이정재 데려다가 역사물 하나 찍은 것 밖에 안되는 조잡한 영화.. 뭘 말하고 싶은지 정말 알수가 없다.  
20170610,1,여진구안티는아니지만 여진구가 나오는 영화는 다망한다  
20170610,1,서부전선에 이은 여진구의 졸작여진구 나오는 영화 다시는 안본다  
20170610,8,관람객왕의 의미를 되새길수있는 시간이되었던 영화  
20170610,5,관람객그냥 캐스팅에비해 별로임  
20170610,7,관람객우끼끼끼까까뀨큐가가  
20170610,7,관람객무사와 광해를 합쳐놓은 짬뽕 영화.  
20170610,10,관람객짱 재밌음 오랜만에 재밌는영화봤어요  
20170610,10,관람객재밌어요~~~~이정재 너무 잘생김  
20170610,10,난 재밌게 봤는데..ㅠ 왜다들..  
20170610,9,관람객너무찡해서 눈물났어요ㅠ  
20170610,10,관람객정말 재미있게 봤습니다  
20170610,1,이게 영화냐? 관객이 감독 싸대기쳐도 정당방위다  
20170610,2,관람객그냥저냥재미없다..진짜 핵노잼  
20170610,4,관람객허얼 등산하다 끝나네..  
20170610,10,관람객올만에 눈물이 주루룩 먼가 가슴에남는영화같아요  
20170610,8,관람객두주인공의 네임덕도봤지만 조연배우들의 연기내공덕도본듯  
20170610,7,"관람객여진구,이정재연기력은무지좋은데,내용면에서뭔가끌어내려다끌어내지못한아쉬움이남는영화네요.^^;;  "
20170610,10,"관람객연기, 스토리, 흐름 모두다 만족...  "
20170610,9,관람객굿이야 굿맨굿럭굿그릇  
20170610,9,"왜 관객들은 역사물하면 항상 철학적이고 예술적이고 한 맺힌 것만을 원하는가..? 그래서 왠만큼 퀄리티 있게 만들지 않고서는 점수를 잘주지않는다. 나는 참 잘봤다. 내용,의미전달,연기력,  모두 훌륭하며 백성이 주인공인 영화를 원했다. 연출만 -1 준다  "
20170610,9,지도자가 못나면 나라가 망한다는 교훈을 다시 한번 느끼게 된다는.. 그러나 백성은 나라를 끝까지 지킨다는...  
20170610,9,관람객여진구존잘ㅋㅋ이정재와캐리ㅎㅎ  
20170610,10,관람객광해군은 어떤 왕이였을까요?  
20170610,10,관람객전 진짜 이정재 배우 연기 보고 감탄에 감탄에 감탄!!  
20170610,8,관람객전개부분이 넘 길어서 좀 지루했지만 대립군의 활약이 마지막까지 이어져맘 안프고 가슴찡함..  
20170610,9,역시 이정재는 위대하다  
20170610,8,관람객그냥 뭐 저냥 뭐... 이정재의 연기력이 돋보이네...  
20170610,7,관람객  Sosososososo  
20170610,9,뜬금없는 행주전쟁씬이 어이없었지만.. 영화에 허구가 적길 바람.  
20170610,1,믿고거르는 이정재와 여진구를 한 영화에 캐스팅한 감독은 제정신이냐??  
20170610,9,관람객배우의 연기들이 한층 성숙했네요 재밋게봤어요  
20170610,6,관람객그냥 볼만합니다 네 그냥볼만해여  
20170610,1,관람객노우잼ㄴㄴ 지루함ㅠㅠ  
20170610,5,관람객연기는 정말 좋았으나 내용가 재미가 떨어짐. 중간중간 흥미를 잃게되네요  
20170610,5,관람객재미있게 잘 봤습니다조금  
20170610,1,관람객잠옴....정말로 잠 옵니다  
20170610,8,관람객음..뭔가부족한느낌? 나쁘진않지만 좋지도않은느낌ㅠ  
20170610,10,여러  악평들이 난무하여  고민끝에 관람했지만  나름 의미있는  영화였다고  생각한다.  영화의 구성과 전개방식이 다소 진부할지라도  소재와  영화가  전달하고자 하는  의미는 충분히 관객들에게  부여하지 않았나 싶다 .  개인적  평점은 8점 정도.  
20170610,8,오락영화가 대세인 지금 주제가 많이 무겁네요  
20170610,10,관람객정말 꿀잼이에요 강추합니다  
20170610,1,재미없는 영화입니다.  
20170610,9,관람객정재오빠 싸라해 내맘알지? 버거킹  
20170610,9,관람객역사에 관심없는 빈깡통들은 보지마세요 원더우먼 보세요  
20170610,7,저는 그렇게 나쁘진 않았는데 생각보다 1점주신 분들이 많네요 물론 거의 뻔한 전개이긴 했음  
20170610,10,이영화가 겟아웃보다 평점이 낮은건 이해가 안된다.보는 내내 남일이 아닌 불행으로 가슴이 뜨거웠다. 재미라는 개념보다 영화와 내가 같이 가고 있었던 느낌과 공감으로 잔뜩 긴장했었다.  
20170610,6,기대에 못미치나  잔잔하게  다시한번  알게되는 사실을 보여준다.  (나약한 왕을  일깨우는 백성이 멋져요)  
20170610,5,관람객아.. 피가 하도 많이 나와서 끝나고 나오니 내가 뭘 봤나 싶었음..  
20170610,8,내용도 재밌고 다 좋았지만 영화를 보다가 중간중간 여진구의 한결같은 연기가 나올때면 영화가 아닌 드라마를 보는 착각을 불러일으켰다  
20170610,10,너무재밌어요 긴장감백배  
20170610,8,너무 일찍 상영관들이 사라져서 어렵게 막판 관람. 주변 평가에 기대치를 낮추고 봤는데 개인적으로는 꽤 만족도가 높았다. 하지만 음악이든 연출이든 조금만 힘을 뺏더라면 더 큰 울림을 받았을텐데.. 강요된 감동이 조금 아쉬웠다.  
20170610,10,관람객너무너무 슬프고 화가났어요ㅠㅠㅠ  
20170610,1,끝까지 보는데 힘들었던 영화는 처음 .. 전형적인 한국영화 클리셰.. 아니..일본 정규군을 농민들과 스님들로만막아낸다?픽션도 적당히 해야지..중간중간 말이 안되는 장면들이 한둘이 아님..그리고 마지막 장면은 정말 수준낮아서 내가 다 부끄럽더라  
20170610,7,관람객그렇게 재미있지도 재미없지도 않은 영화..  
20170610,10,관람객가서 적당히 볼만한 영화  
20170610,3,"평을 하자면 ""지루함"" 러닝타임 긴 건 예상하고 들어갔지만 시작하고 30분동안 전개되는 도입부분에 시계까지 봤다.스크린 몰아주기가 탓할게 아니라 관객 입소문날 영화는 아닌듯 하다. 내용으로 관객 가르치려는 드는 감독이 문제인 듯  "
20170610,8,관람객역사를 재해석하여 광해군을 실망시킨 시켰긴 하나 이런 역사물이 지속적으로 나온다는 건 찬성한다. 이 정도 역사 지식도 모르는 사람들을 위해서 말이다.  
20170609,9,슬금슬금 재미있어지는 영화  
20170609,9,슬금슬금 재미있어지는 영화  
20170609,1,응 망해 버렸죠.. 진구는 솔까 주인공 깜냠은 아니다. 자꾸 밀지마라.. 정재 형도 케릭터 하고 언밸런스 하고  
20170609,8,관람객볼만합니다. 약간슬픔  
20170609,1,"남녀가 비슷한 평점이면 모르겠으나, 여자들만 유독 평점이 높은 영화는 거르는게 답. 강동원, 여진구 나오는 영화가 대표적임. 영화 내용보다 남배우보고 평점 높게 줌.  "
20170609,10,관람객영화 보는 내내 서너번 울컥하고 손수건으로 눈물을 적셨음. 너무 감동적이고 스토리도 탄탄하다. 웰메이드 영화이다. 여진구 이정재는 말할것도 없고 김무열 연기 너무 잘한다.  
20170609,10,관람객대리인생  대리출석  대리모  남의 인생을  대신 사는 현실 과거 미래   참으로   모든걸   대변하는   현상황에     사는  인생  안타깝다   드라마에서  이정재의 역   과연 허구다  현실에  그런 삶이  있을까  참으로  반추하는  삶이다  
20170609,2,포스터 보고 이재수의 난2 인줄 알았음...  
20170609,2,등산하고 싸우다 죽는얘기ㅡㅡ;;; 이정재/여진구때문에 그나마도 별을줍니다  
20170609,1,"진짜 완전 실망.. 영화 중간중간 화면 전환도 너무 흐름 뚝뚝 끊기고,, 뻔하디 뻔한 내용을 더럽게 재미없게 풀어냈음.. 좋은 배우들 데려다가 이런 영화를 만들다니.. 시간 아까움.  "
20170609,7,관람객재미있었지만 재미없었다.  
20170609,8,관람객제작비의 문제였나 먼가 아까운 영화였다 소재는 좋았는데 먼가 티비 사극 보는 싼티가 났다 아까운 영화다  
20170609,3,iptv 용 금방나오겠군요  
20170609,1,"구라아니고 액션, 연기, 스토리, 교훈중에 하나도 성공한게 없음. 원더우먼이나 미이라 봐라 진심... 용 2개중에 하나는 왕이고 하나는 백성. 이거 알면 영화 다 본거임  "
20170609,6,관람객많이 기대하고 보았습니다 ‥하지만 짜여진 각본이  영~~~ㅠㅠ더 이상 표현하기가 그러네요‥  
20170609,10,생각하게 하는 영화 강추  
20170609,1,어설프게 이모티콘 써가면서 어색하게 평점남긴건 모조리 알바들같다 그런건 전부 5점인걸 보면 확실한듯  
20170609,10,관람객노무너무잘보았습니다.다른분들도 많이보셨으면 ㅠ  
20170609,4,관람객생각보다 지루함  계속 걸어만 다님  액션을 기대했다면 비추 역사는 배울수 있음  감동도 조금 있고  
20170609,10,관람객와우 배이굿 입니다ㅎㅎㅎ  
20170609,9,관람객나름 재미있게봤어요^^  
20170609,1,관람객그냥 별로였어요...  
20170609,9,관람객걸작입니다 내용이 훌륭합니다  
20170609,7,관람객그저 볼만한 영화인듯요 그닥 재밌진 않은듯요  
20170609,10,관람객잘 보고 왔어요 여진구 때문에 보러 갔네요  
20170609,6,일본군은 무한 좀비인가...  
20170609,9,관람객이정재 배우님의 사극연기는 날로 늘어가는것 같슴다비정규직은 옛날이나 지금이나 후...  
20170609,10,아니무슨 영화 개봉한지 얼마나 됐다고 죄다 상영관마다 아침 한번만 상영해주는거죠.. 너무한거 아닌가  
20170609,8,관람객현시대에 어울리는 영화였소  
20170609,6,관람객기대만큼 그닥 재미가없네요ㅡㅡ  
20170609,10,관람객재미는없어요....  
20170609,10,연기최고 몰입도 최고~~!!  
20170609,9,관람객볼만해요볼만해요 꼭봐요  
20170609,8,호불호 갈려서 걱정하면서 예매했는데 지루할틈없이 재미있게봤어요 특별한 내용이 없어서 호불호가 갈리는거 같은데 저는 결말보고 그 이후가 더 궁금해지더라구요 여진구가 너무 잘자랐다는 생각만 계속 드는영화 ㅋㅋ  
20170609,1,너무 길어욧 루즈해요ㅠㅠ  
20170609,7,"파괴왕 주호민 작가님, 이 영화 시사회 다녀오셨답니다.  "
20170609,8,영화를보면서  나라군주가   지살기위해  도망가고  나라일에부족한 세자를  대신하게해  믿에충신이나 국민이   죽을고생만하다  왕을지키다 결국  죽음으로  끝남  이정재배우분  연기잘하시고  배우분들   너무고생많이하신것같음  볼만합니다  
20170609,1,영화보다 잠오는거 처음이다 진짜  
20170609,8,관람객역사적으로 광해에대하여 많이배우고갑니다  
20170609,2,이정재 믿고 봣는데  빅매치에 이어 실패작...비추입니다 내용도 엉성하고 영화보여주고 미안한 그런영화입니다... 사과하기싫으면 .. 같이보러가자고 하지마세요 혼자보세요  
20170609,10,"난 솔직히 좋았다, 대립군이라는 뜻도 굉장히 궁금했는데 그 이유를 알수 있었고 또한 힘들었던 역사에 본인 이름 석자 남기지 못하고 돌아가신 분들의 희생을 알 수 있었다, 아픈 역사를 조금이나마 기억하려면 이러한 영화가  많이 나와줘야 한다고 생각한다.  "
20170609,1,""" 어찌 내가 왕이 될 관상인가?! ""  "
20170609,10,완젼대박~~!!!! 제가 역사를 좋아해서 그런지 내용이 재미있고 한편으로는 감동적이고 슬프네요~~~` 영화 대박 나세요~~!!!! 화이팅~~^^  
20170609,8,관람객연기가 좋았어요♡ 이정재 연기♡  
20170609,10,관람객재밌게 관람했습니다.  
20170609,8,관람객재미있게 봤습니다 배우들 연기가 좋았어요  
20170609,1,관람객이런 노잼이 있을수가 있다니...  
20170609,10,현충일에 봤는데. 주연.조연배우들의 연기에 빠져들어 몰입해서 본영화 이런 평 잘 남기지 않는데.. 이대로 다른 영화에 가려지기엔 아까운영화란 생각이 들었다이런 좋은 영화를 다른사람들과 같이 감동을 나눌수있으면 좋겠다꼭 추천하는 영화 !  
20170609,10,"역시 후회되지 않는 영화였습니다!드라마같은 영화를 좋아하시는 분, 잔잔한 감동을 느끼길 원하시는 분, 대한민국 국민이라면 보시면 좋은 영화라고 생각합니다.쟁쟁한 외화에 가려져 상영시간이 밀리고, 영화에 비해 평점이 낮게 평가되는지 안타깝습니다.  "
20170609,10,너무 잼있고 감동적입니다.옛날이나 지금이나 힘없는 백성만 고생T.T  
20170609,1,돈내고 보기 싫은 영화에 하나인듯. 영화보면서 졸린건 처음  
20170609,10,갓정재. 역시나 그의 연기력은 빛을 발휘합니다.  
20170609,6,이 좋은 배우들 데리고 뭐하시는겁니까  
20170609,1,진짜 봐라 그냥 돈아까우면ㅋㅋ 보고후회해라  
20170609,5,"2017.06.08 cgv영등포,  "
20170609,9,관람객연기도잘하고 사극인데도 지루하지않고 재미있었어요부모님도 재밌어하시더라구요ㅎㅎ  
20170609,9,요즘 총리 장관 청문회 기간인데 이런 시대를 비틀어 풍자하는 영화 만들면 당장 연예계서 퇴출당하죠  
20170609,10,간만에 재밌는 한국영화가 나온 것 같네요  
20170609,9,아름다운 자연에 아름다운 사람들이었다. 충분히 즐거웠다  
20170609,10,관람객역사물 볼때마다 울컥울컥 하면서도 역사에대해 잘 알지 못한다는 생각에 부끄럽기도 하고.. 어머니랑 같이 잘 보고 왔습니다  
20170609,9,쪼금 더좋은 스토리 넣을수있슬텐데 근데 새로운 리얼리전쟁 장면은 맘에듬  
20170609,10,"관람객나라를 버리고 간 왕, 그 나라를 지키고자 하는 백성들의 마음!런닝타임은 길어서 지루하긴했지만 그 백성들의 마음은 지금 현재 우리가 갖어야하는 마음이 아닐까 싶은 영화.우리에게 필요한 마음가짐이 아닌가 하다  "
20170609,10,"관람객오랜만에 한국영화 참 재밌게 봤네요. 무엇보다 광해라는 인물의 성장기를 풀어내는 방식이 참 좋았습니다. 좋은 리더는 좋은 백성, 좋은 국민들과 함께 세워나가는 것임을, 천천히 잘 일깨워준 영화였던 것 같습니다  "
20170609,10,"스펙타클하거나 마냥 웃긴 오락 영화들을 좋아한다면 지루하다고 할지 모르겠지만 우리역사와 우리나라의 전경을 모두 담아낸 멋진 영화.왕과 리더, 백성들의 진심이 느껴져 끝나고도 자리를 뜨기 힘들었다.. 아직도 영화 속 토우의 대사들이 머리속에 멤돈다.  "
20170609,10,관람객여진구 보러갔다가 김무열한테 빠졌어요!!! 곡수 ㅠㅠ 어찌나 짠내나는지... 잘못된 리더때문에 고통받는 백성들을 보며 보는 내내 공감할 수 밖에 없었습니다.  
20170609,10,관람객광해가 나오는 영화는 대부분 평타 이상. 근데 기존에 봤던 광해 영화들이랑은 좀 다른 것 같음. 좀 더 광해의 인간적인 면에 집중했달까... 드라마 장르로 풀어낸 것 같아서 좋았음요  
20170609,10,관람객연기도 연출도 오히려 멋부리지 않아서 좋았던 영화. 러닝타임 내내 광해와 같은 한 사람 때문에 지금의 우리가 있다는 사실을 생각해보게 되었다  
20170609,10,매우감동적  광해 훌륭한임금이다이런지도자가 나와야하는디  
20170609,7,관람객여진구 이정재 연기합이 좋았던 영화  
20170609,6,관람객다소 지루한진행이 아쉽네요  
20170609,4,정윤철은 직업윤리에 대해 진지하게 생각해보길. 상업영화를 이렇게 지루하게 찍고는 자본주의 탓?  
20170609,6,"시나리오는 작가 연습생이 한거 같고, 감독은 월급을 못받은 거 같고, 다음 전개가 예상이 되고 엑스트라도 더 쓰고 왜나라것들은 작은 배우들 많이 모아다 했으면 하는 아쉬움..그나마 배우들이 연기를 잘해서 볼만했음.  "
20170609,1,의도는 충분히 알겠는데....그 의도를 전개하는 극의 내용이 아무것도 없다 .뭐야.배우들 고생시킬라고 만든영화야?  배우들은 고생을 해도 저렇게 멋있다...는걸 보여줄라고? 완전....꽝!  
20170609,8,관람객광해군의 심리변화가 잘 그려진 영화였지만 중간부분이 조금 지루했던건 아쉬움으로 남습니다.  
20170609,8,"전쟁터에서 직접 백성들과 뒹굴며 백성들의 삶과 고통을 대면하는 과정에서 왕으로서의 가져야 할 용기와 애민을 느껴가는 과정에 초점을 둔  광해왕의 성장기. 국가란 무엇이고,  리더는 무엇인가를 생각하게 한다.  "
20170609,10,근래 본 제일 재밌는 영화 여운을 남기며 마무리하네요 지금 평점보다는 훨씬 재밌는듯합니다  
20170609,1,그래도 상영관은 넘쳐나네.. 배급사 제작이라..  
20170609,9,관람객볼만합니다. 알려지지않은 이야기를 알 수 있어서 좋았습니다.  
20170609,5,"관람객지루한 전개, 색깔이 없다  "
20170609,3,산타느라 고생한 배우와 스태프들 생각해서 3점준다...근데 진구 춤추는거 왜시켰냐 춤 안췄으면 4점줬을텐데..  
20170609,1,여러분 알바 평점 말고 갓평식 평론가의 평점을 보세요  
20170609,9,관람객재미나게보았네요 ㅎㅎ  
20170609,6,관람객역사왜곡이좀심한거같다  
20170609,6,관람객다시한번  권력에 대해 어린 왕에 대해 생각해본 시간이였다.  
20170609,6,이정재 여진구 그 외의 주조연 배우들의 연기는 대체로 좋았음.  물론 몇몇 거슬리는 배우도 있었음.  스토리 나쁘지 않으나 아마추어가  촬영했나 싶은 앵글과  편집...  지루하다...   배우들 연기가 아까운 영화  
20170609,1,"스토리도 엉망이고, 이정재 연기는 영화 암살에서 본 연기랑 너무 흡사하고, 영화암살 캐릭터 생각나서 집중도 안되고 걍 흥행 안되는 이유가 있는 대표적인 영화네요.  "
20170609,8,관람객뻔한스토리지만 감동적이고 재미떠  
20170609,7,관람객액션씬 빼고는 볼거리가 부족했다. 연기는 최고!  
