0,1,2
20170601,10,배우들이 고생한게 눈에 훤한 영화였어요!! 물론 재미까지 있습니다!!  
20170601,10,"우와 대단하네요, 추천합니다  "
20170601,10,가슴이 먹먹해지는 영화..  
20170601,1,평점 말도안되게 높아서 1점 줌. 역시 한국영화는 볼게 못돼ㅠㅠ  
20170601,10,역시 사극은 이정재야! 재밌었어  
20170601,1,평식이 재평가 필요하다. 이런영화를 5점이상준 평론가들은 돈받고 평론써주냐?  
20170601,10,언제나 나라는 백성이 국민이 피흘려 지켰지요.. 국민이 훌륭한 나라인걸 다시 한번 기억하게 되네요..  
20170601,10,나오는 배우들 마다 연기 다 잘하고 가슴 뭉클뭉클..ㅜㅜ  
20170601,5,한국사극영화를 15년을  후퇴시킨 작품  
20170601,10,왕이 도망간 나라를 지키려는 백성들의 노력  
20170601,10,가장 힘이 없어 보이는 백성이지만 나라를 지킨 것도 백성이다  
20170601,1,왜 이렇게 평이 높지 알바 풀었나...2일같은 2시간이었다. 돈도 아깝고 시간도 아깝고...다음 대사가 예상 가능한 식상함과 초반 배우들의 어설픈 연기는 이정재와 여진구 연기까지 어설퍼보이게 만들었다.  
20170601,10,위기때마다 나라를 구해온 백성들의 이야기를 담담하게 그려낸것 같다  
20170601,10,"너무 진지하지않게 그려내서 더 좋았던 것 같음 중간중간 웃음포인트들도있고, 기억에 남을 것 같은대사들과 감동까지  "
20170601,10,여진구 이정재 캐미가 돋보입니다  
20170601,10,역사를 돌이켜볼 수 있었던 좋은 시간이었습니다  
20170601,10,배우들 연기가 장난 아닌데요?  
20170601,10,광해군 대립군 이야기가 새로웠음ㅋㅋ 기대이상으로 재밌게 본 듯  
20170601,1,딱7점이맞을듯 지금평점 너무높아서  
20170601,9,관람객독립군인줄알고 일제식민시대인줄 알앗는데 조선시대라서 뜨끔하엿습니다 영화는 역시믿고보는 이정재 영화였습니다.  
20170601,10,이정재 믿고 봤는데 역시나 좋아여ㅎ  
20170601,10,진심이 느껴지는 영화라 그런지 더 와닿고 좋았음  
20170601,10,나라를 구하면 뭐하나...전쟁 끝나자마자 또 지들끼리 권력 다툼이나 하고 앉아 있고..죽어나가는건 백성이고... 민족반역자를 지지하는 어리석은 백성들도 문제고... 정말 노답이다.  
20170601,10,이정재의 강한 카리스마가 볼만합니다 재밋어요^^  
20170601,10,뭐 볼까 하다가 대립군 선택했는데 흥미진진하고 재밌게 봤습니다  
20170601,10,재밌다ㅋㅋㅋ 여진구는 어린 애가 왜 이렇게 연기를 잘하냐  
20170601,10,아 곡숰ㅋㅋ나 국수인줄 알았음 ㅋㅋ  
20170601,10,잔잔하게 흘러가지만 지루하지 않고 마지막엔 가슴 먹먹…  
20170601,10,이정재의 연기!! 새로운 느낌이라 좋았어요 ^^  
20170601,10,재미도 있고 감동도 있고 배우들의 연기까지 굿!  
20170601,7,관람객너무 직선으로만 오르내리던 영화. 그럼에도 입체감을 불어준 배우들의 연기력을 잊을 수가 없다.  
20170601,10,최선을 다하면 원하는걸 이룰 수 있다는걸 배우는 시간이 아니었나 싶네여!  
20170601,10,스토리면 스토리 연기면 연기 모든게 훌륭ㅎㅎ  
20170601,10,잘 알지 못했던 그 시대를 볼 수 있어서 역사적으로 도움도 되고 재밌게 본 것 같아요  
20170601,10,이거 국회에서 틀어줘야 되는거 아니냨ㅋ  
20170601,10,영화 속 세자를 보면볼수록 마음이 아팠어요. 아비의 사랑을 받지 못하고 자란 아들의 마음이 어땠을까요  
20170601,10,리더다운 리더가 굉장히 요구되는 영화네요. 답답..  
20170601,10,현시국과 비슷한 느낌! 역사는 반복된다!  
20170601,10,배우들 연기 볼만하고 역사를 다시 생각해볼 수 있어서 좋았음 역쉬 능력있지만 불쌍한 백성들 ㅜㅜ  
20170601,10,부모님이랑 봐도 좋을 것 같은 영화였습니다  
20170601,10,마지막에 가슴이 먹먹해져서 혼났다..  
20170601,10,뻔한 전쟁 영화인 줄 봤다가...감정씬에 이끌려가면서 시간 가는 줄 모르고 봄..  
20170601,10,"이정재 대사 중에 ""나라가 망해도 우리 팔자는 안바뀌어""라고 하는데 진짜 캐공감ㅠㅠ  "
20170601,10,남자들의 의리!! 백성과 왕의 의리!! 우리는 하나다!  
20170601,10,팩션을 소재로 한 재미와 감동의 두마리 토끼를 잡은 영화~!!!^^  
20170601,9,관람객특히 여진구 연기 정말 멋집니다. 광해군이 심리적으로 점점 성숙해져가고 변해가는 모습을 멋지게 소화해냈습니다. 이정재의 연기또한 좋았습니다. 2시간 내내 재밌게봤습니다.  
20170601,10,가족들이랑 보기에도 좋고 어린 아이를 둔 부모님들이 함께 보기에도 좋을 것 같은 유익한 영화에요  
20170601,10,이전에는 알지 못했던 '대립군'이라는 역사적 인물들을 통해 다양한 사실을 알 수 있었다. 또 한번 광해에 대해 재평가를 하게 된 영화  
20170601,10,이정재와 김무열이 꽤나 기억에 남는다  
20170601,10,대사 하나하나 너무 가슴에 와닿아요  
20170601,10,또 한번 역사 공부를 할 수 있는 시간이었습니다.  
20170601,10,뭐랄까 ㅡ 자신을 되돌아볼 수 있던 영화 ㅡㅡ 물론 부족한 부분도 있어지만 ㅡ 나는 만족힌다 ㅡ 감동 ㅡ 나는 자격도 능력도 없다 ㅡ 허나 모든것을 다가질려하니 ㅡ 추해지는구나  
20170601,10,생각보다 재미있어요..예나지금이나 나라지키는건 국민들이네요  
20170601,3,너무 기대를 하고 본듯  지루한 전개와 연출  
20170601,10,현 시대 최고배우 이정재와 미래의 최고배우 여진구  
20170601,10,CG로 스펙타클한 영화 이젠 만화같아 질리는데..사람이 만든.영화 라는 느낌적인 느낌  진정한 리더가 되는길은 쉽지않으리라는걸 힘든여정을 같이 호흡하며 느끼게 해준다. 실제로는 더 힘들었겠지..연민이 느껴지는 광해군  
20170601,10,배우들의 명연기와 확실한 메세지 등 덤덤하게 본 영화였습니다!  
20170601,9,관람객볼만함 광해는 좋은 왕이엇음  
20170601,10,이정재와 여진구의 연기가 좋았어요 제가 아는 광해랑은 많이 다르네요  
20170601,10,토우가 내뱉는 말 한마디 한마디가 다 가슴에 꽂히네요  
20170601,10,댓글에 지루하다는 얘기가 있던데. 아마도 전투 장면이 많을꺼 같다는 생각을 한게 아닐까 싶다.. 백성과 함께 성장해가는 왕의 이야기를 드라마적으로 잘 풀어낸것 같다..  
20170601,10,대사 하나하나가 다 명언이네요  
20170601,10,조금 더 빨리 개봉했었으면 진짜 우리 시국이랑 똑같아서난리낫을듯ㅋㅋ  
20170601,10,감동.. 점점 멋있어지는 광해 모습이 인상깊었다  
20170601,10,완전재미나게봄..흥미진진했음..ㅎㅎ  
20170601,10,나라를 위해 목숨을 걸고 싸우는 대립군들의 모습이 멋있었다  
20170601,10,오랜만에 보는 영화인데 볼만하네요  
20170601,1,최악중의 악 졸림 돈아까움  
20170601,10,어? 이거 얼마전의 우리나라 이야기 아니야?ㅋ  
20170601,10,백성을 생각하는 세자의 맘이 감동적이네요 오늘날에도 그런맘을 지닌 정치인. 스승님들이 많기를 바래봅니다  
20170601,10,현시국을비교해볼만한영화에요 무능한왕을두면백성이어떻게되는지..  
20170601,10,볼만했어요. 김무열 완전 엄지척!!!  
20170601,10,조선이나 대한민국이나 변함이 없네  
20170601,10,"휴머니즘이 녹아든 영화였습니다. 인간애로 인한 갈등구조도 짜임새 있었고, 배우들의 연기도 좋았습니다.  "
20170601,7,연기는 좋았으나.. 너무 지루하네요. 대립군보다가 눈물났습니다. 하품을 너무 많이해서... 대립군이 아니라 졸립군이네요.  
20170601,10,광해군의 또다른 모습을 보니 너무 감동적이고ㅠㅠ배우들 연기도 최곱니다  
20170601,10,나라와 역사에대해 다시금 생각하게하는 영화  
20170601,10,간만에 좋은 영화 잘봤습니다  
20170601,10,조선시대 역사를 다시끔 깨닫게 되었네요.. 현 시점에 좋은 영화네요.  
20170601,8,관람객이정재의 카리스마와 적절히ㅜ화려한 야ㅐㄱ션씨누암걸리다가도ㅜ약먹고ㅜ나은 느낌  
20170601,10,와 배우들 연기 소름돋는당ㅋㅋ  
20170601,10,우리나라의 역사가 슬프지만 강인한 민족성을 엿 볼 수있는 영화이다.  
20170601,10,크게 기대하지 않고 봤는데 스토리가 아주 탄탄해요. 푹 빠져서 잘 봤습니다 ^^  
20170601,10,이 나라의 백성으로 살아간다는 것이 얼마나 고달팠을꺼 생각을 안해볼수가 없네요.  
20170601,10,열심히 우리땅에서 살아갈 수 잇도록 일깨워주는 영화  
20170601,10,역시 이정재 짱^^ 다들 연기력도 넘 좋고 두시간동안 몰입해서 봤어요.  
20170601,10,감동도 있고 재미도 있고 배우들의 연기도 좋았어요  
20170601,10,ㅇㅇ남자친구랑 영화보는데 눈물나서 쪽팔렸음..  
20170601,10,이 영화를 통해 한국의 역사공부도 배우게 되고 영화배우들의 연기도 실감나고 뜻깊은 영화를 보게 되었습니다  
20170601,10,책임과 시대정신을 표현한 것에 대해 박수를 보내고싶다  
20170601,10,다음생은없소. ㅠㅠ잔내 폭발함  
20170601,10,묵직하게 다가오는 메시지와 영화가 주는 감동은 보지 않은 사람들은 모를듯  
20170601,1,2시간동안 노력한다... 참  
20170601,10,올해 본 그 어떤 영화들 중에서도 최고인듯  
20170601,10,대한민국 국민이라면 재미없을수가 없지않나?  
20170601,10,아무것도 모르던 그저 어린 아이에 불과헀던 광해가 조금씩 세상을 알아가고 백성을 이끄는 리더의 자질을 갖게 되는 과정이 인상깊었다  
20170601,10,개인적으로 굉장히 맘에 든 영화	  
20170601,10,영화 재밌네요 다들 꼭 보셨으면 합니다	  
20170601,10,역시 실망 시키지 않는 이정재와 여진구. 이 둘은 원래 사극에도 잘어울렸지만 붙여놓으니까 진짜 그림일세.. 	  
20170601,7,오늘봤는데 지루하다 여진구 춤추는씬잇는데 진짜 오글거리고 이정재안나왓음 진짜 아무것도 아닌영화될뻔햇겟더라. 그냥 내취향이 아니라서그럴수도있지만 전개가 어떻게될지뻔햇고 억지감동이런거같음. 암튼 지루햇음. 재미없음  
20170601,9,잔잔하지만 재미있게 볼 수 있었던 2시간이었습니다	  
20170601,10,"볼만하다. 짠한 장면도 있고, 배우들의 연기는 두말 하면 잔소리! 	  "
20170601,10,옛날이나 지금이나ㅜㅜ 어렵고힘든거 피하는놈따로 희생하는자따로ㅠㅠ 이런게 우리에현실!!!!	  
20170601,10,곡수가 김무열이었구나~ ㅋㅋㅋ차도남이 OOO가 되었어~~ 진짜 못알아봄.액션영화 아니고 갈등풀어가는 이야기재미있게봤음.  
20170601,9,음.. 뭔가 시시하게 끝나긴 했는데 안 지루하고 재밌었습니다 ㅎㅎ 몰입이 잘됐어요  
20170601,1,이정재 그만 캐스팅 해라.  완전 영화 별로였음. 돈 아깝다.  
20170601,10,생각없이 보면 그저 그런 영화지만 나에겐 기억에 오래 남을 것 같은 영화  
20170601,10,영화화 될만한 이야기 이기에 더 짠하다. 짠한 영화는 보고싶지 않은데  
20170601,10,재미있어요!앞부분은 살짯 지루했는데 감동적이예용  
20170601,10,긴장감있게 잘 보았어요  
20170601,9,배우들 연기가 좋았고 중간중간에 웃음도 있어서 충분한 재미가 있었어요.  
20170601,10,대립군이라는 생소한 소재에 익숙한 역사적 배경이 흥미를 줍니다  
20170601,10,지금 우리나라의 실정과 맞물려 깊은생각을 하게합니다.. 임금은 백성을 버려도 백성은 이 나라를 버리지 않는다는 것에 공감..  
20170601,10,나라가 힘이 없으면 백성들이 고생한다  
20170601,10,배우분들 연기가 좋았습니다  
20170601,10,지금 세상에 필요한 메시지와 리더쉽이 무엇인지를 잘 보여주는 영화 같아요. 액션과 스케일로만 승부하는 껍대기 영화가 아닌 아주 깊고 중한 울림이 있는 영화랍니다!  
20170601,10,배우들의 연기가 좋아서 그런지 재미있게 봤습니다  
20170601,10,사람에 따라 자칫 지루하게 느껴질수도 있겠지만 그 안에 담긴 뜻은 결코 가볍지만은 않다.  
20170601,4,실망... -김소혜가-  
20170601,10,잘 만든 정통 사극. 괜찮게 봤다.  
20170601,10,대통령님과 청와대 사람들 그리고 기타등등 국회의원들이 꼭 봐야할영화  
20170601,10,올해 천만영화이 또 나올거같네요일베츙들이 단체로 와서 비공테러중이네요반드시 봐야할 영화라고봅니다 꿀잼  
20170601,10,리더란 무엇인가? 국민과 소통하는 리더가 아닐까 하고 느낍니다.  
20170601,9,교훈이 많이 되는 영화예요  
20170601,10,저때도 대타용 비정규직... 지금도 소모용 비정규직... 예나 지금이나 달라진게 없구나.  
20170601,7,관람객스스로를 버릴순 없다 ㅠㅠ.. 눈물 주르륵 흘렀네요. 지금까지 몰랐던 광해군의 새로운 모습도 보게되고. 강추합니다!!  
20170601,5,음.대충 볼만한것 같지만...다시는 안 봐^^  
20170601,1,2시간 도망다니고 내용 20분 핵노잼  
20170601,2,알바들만 모아놨나봄.... 진짜 몰입도안되고 보는 내내 고구마200개 먹은 느낌  
20170601,10,배우들의 연기력이 돋보이던 영화였습니다 스토리와 연출력도 너무 좋았어요	  
20170601,4,지루하게 만든  무사 or 최종병기활 느낌 . 재미있게 풀수있을 광해의 의병군 끌고오는 이야기를 초반 10%만  2시간동안 보여주고  끝내버렸다.  머지.. 로그인하게 만드는  말도 안돼는 조작 평점들.. 광해말고이정재랑 여진구 보고 싶으면 보세요.  
20170601,8,기대이상이였어요. 배수빈씨가 참 인상에 남네요. 제일 멋졌어요ㅠㅠ 그리고 여진구씨를 지지하는 양반들 민폐라면민폐인데 귀요미들임ㅋㅋㅋㅋ  
20170601,10,간만에 김무열 연기터지네요 잘봤습니다^^	  
20170601,3,"히말라야인줄..처음에 산만 타다가 끝나는줄.. 산타는거 지루해서 죽을뻔.. 산올라가는 영화  다 보고 나서 힘들었음, 꼭 내가 산등산 한 것 처럼 힘들었음 밤에 그래서 잠잘잤음  "
20170601,8,"관람객주조연 화려한 캐스팅, 묵직한 메시지에 비해 감독의 연출 역량은 역부족. 광해도 선조의 대립군.  "
20170601,1,보지마세요.잠옵니다.잠와서 혼났습니다.어이없는영화  
20170601,10,탄탄한 연출력과 배우들의 소름끼치는 연기..오랜만에 평점주고 싶은 영화가 나왔다..한동안 여운이 계속 갈 듯  
20170601,8,잼나긴했으나 끝판이 좀 아쉬운듯! 이정재연기 역시 쩔어~ 연기자들 대박연기! 근데 이 아쉬운건뭐지?  
20170601,1,평점알바들 역겹다 ㅋㅋㅋ  
20170601,10,광해의 새로운 이야기를 볼 수 있었던 영화  
20170601,10,"우리나라, 우리역사는 가슴아픈 일이 너무 많았다  "
20170601,10,예나 지금이나 우리나라는 큰일이 있을때마다 국민이 나라를 구했었구나  
20170601,1,영화 시작하고 5분후.. 빨리나가고만 싶었음..  
20170601,1,이거 완전 제 인생 영화에요ㅠㅠ진심 영화보면서 울뻔했어요제가 본 영화중에 진짜미치도록제일 재미없는 영화네요하품을 하도많이햐서 눈물날지경이었어요...주연배우이외분들의 연기력이나 연출부분에 심하게 문제가 있어요...  
20170601,1,"내 단언컨대, 여기 10점주는애들은 영화라는 문화를 처음 겪어보는 인간이거나 여진구보러간 빠수니 둘중 하나다. 정상이라면 이영화가 10점이라는게 말이 안됨. 스토리 참담, 액션은 개그급, 러닝타임은 필요없이 길고 내가 영화관에서 본 영화중 최악중최악.  "
20170601,10,많은것을 생각해 볼 수 있는 좋은 영화입니다. 꼭 보셨으면 합니다.  
20170601,6,토우 진짜 이름은?  뭘까요??  
20170601,10,점점 변화하는 광해라는 인물을 보는 재미가 쏠쏠했어요  
20170601,5,이런 참신한 소재와 엄청난 배우 갖고 이 정도면 감독이 영화 하나 버린 수준임. 감독은 배우에게 미안함을 느끼길  
20170601,8,전쟁통에 아버지가 선조라니...정적이 선조라니..기구한 광해의 운명.ㅡ  
20170601,6,영화의 담긴 메세지는 매우 좋았지만 생각보다 너무 영화를 끄는듯한 느낌을 많이 받음 막 화려한 전투신을 예상하셨다면 보지마시길 지루함  
20170601,9,광해가 왕이 될 수 밖에 없는 배경이 보여지내요 이정재씨에 가려 좀 약했지만 여진구씨도 멋집니다  
20170601,10,"도망간 아버지를 대신해 반강제로 전쟁터에 던져진 18살 어린 광해군이나, 목숨을 담보로 남의 군역 대신해주며 살아가는 대립군이나...둘다 불쌍하다  "
20170601,8,배우보고봣던영화임ㅎㅎ  
20170601,10,왜이리 우리 선조들은 힘이 없었는지..ㅠㅠ안타까웠습니다.영화는 좋았어요..추천합니다^^  
20170601,9,영화가 가진 의미가 많은 듯한 영화였던 것 같다.  
20170601,10,광해가 토우(이정재)에 의해서 군주이자 리더로 각성되는 과정이 중간중간 웃음코드와 함께 잘 나타난 것 같다  
20170601,1,보고있는중... 감독이 배우들 연기 씹어먹은 케이스.. 마지막은 억지감동.. 김무열 재발견.. 영화는 6월중순쯤 안보일듯...  
20170601,6,소재 연기력 좋으나 스토리가 약함 노잼 Dvd로~  
20170601,10,배우들의 조합부터 말이 필요없는 영화. 고생하며 찍은 흔적이 고스란히 느껴지네요..재미있게 잘 봤습니다..  
20170601,10,남을대신한 군역. 새로운사실을 알게되네요  
20170601,5,재미도없는데 평점 주작아니냐 ?  
20170601,10,역사이기 때문에 이런 종류의 영화를 볼때마다 마음이 이프네요  
20170601,10,연기 너무 좋아요 잘봣슴돠  
20170601,10,관람객스토리에 울림이 있네~ 배우들 연기력까지 뒷받침해주니 돈 아까운지 모르겠음  
20170601,4,영화 무사 생각남. 무사 조선판 같은 느낌  
20170601,6,뻔한스토리인데. 더 지루한 느낌  
20170601,10,관람객전하!!두려워도 견뎌 내시어야 합니다  
20170601,9,관람객제일 빠른 시간대로 선정해서 본 건데 기대 이상이네요 배우들 연기 넘나 좋은 것!  촛불집회 참석했던 기억이 나면서 울컥했네요  
20170601,10,그냥 다른거 없다  그냥 정신없이  집중 하게 만든ㅋ  
20170601,9,오랑캐의 뜬금없는 의인 행세가 좀 ?^^  
20170601,10,배우들 전부 연기력도 좋고 대사들도 가슴에 남네요  
20170601,1,별로... 배우들 연기력이 너무 떨어짐... 지루함.. 뻔한 스토리...  
20170601,10,여진구 연기 보는데 왜 내가 다 마음이 아프냐..  
20170601,1,처음부분은 별로고 후반부에 볼만해지는 영화였음 연기력은 좋았는데 좀 지루한영화  
20170601,10,아름다운 우리나라 산천을 배경으로 전하는 감동에 진정성을 느꼈습니다.  
20170601,10,아름다운 우리나라 산천을 배경으로 전하는 감동에 진정성을 느꼈습니다.  
20170601,10,가슴아픈 우리의 역사.  
20170601,10,"좋은 사극영화,역사속에 숨겨져있던 대립군이라는 존재를 흥미롭게 풀어준 영화  "
20170601,10,관람객얼굴이 다했다...★ 존잼! 천만영화각!  
20170601,10,임진왜란 뒤에 숨겨진 이야기 :)  
20170601,1,알바들 빠지면 높아봐야 6점대후반에서 7점대초반됨  
20170601,1,1점은 아니지만8점이 넘는영화는 아닐듯뻔한스토리 뻔한전개 뻔한대사임높은평점에대한 밸런스를맞추기위해 1점줌  
20170601,10,광해는 폭군이 아니라 선조가 폭군이다  
20170601,10,버릴 캐릭터 하나도 없는 영화!  
20170601,10,최근본 한국 영화중 여러의미로 좋은 영화  
20170601,10,몰입도도 좋고 역사를 재미있게 풀어주어서 아이들디 보기에도 좋을것 같네요  
20170601,10,"518민주화운동도 그렇고..일제 강점기, 625…등등.. 우리나라 국민들은 나라를 엄청 사랑하는 조국인거 같다..^^  "
20170601,10,한번 더 보고 싶을 정도로 인상 깊었어요  
20170601,10,재밌어요 여운이남아요  
20170601,10,여진구의 광해 연기가 기억에 남네요  
20170601,9,배우들의 연기력과 노고로 이루어진 역사의 재해석이 돋보였다.  
20170601,10,이정재님 연기 너무너무 좋앗습니다~  
20170601,10,"신분, 지위 혹은 상하가 맞닿은 지점에 공감할 수 밖에.  "
20170601,10,"어느정도 스토리가 감이 오는 사극이지만...그럼에도 불구하고 매번 눈물이 나는...안타까운 우리의 슬픈 역사.,ㅠ_ㅠ  "
20170601,9,"우리가 몰랏던 역사의 한페이지,  "
20170601,10,이정재 남우주연상 감~~~^^ 대립군 인생영화 또 다른 관점에서의 광해군  
20170601,10,나라를 지키기위한 백성들의 노력이 눈물났습니다  
20170601,6,주인공 죽이기 좋아하는 한국영화 질색..  
20170601,10,너무 감동적.. ㅠ_ㅠ 꼭 봐야할 영화같아요  
20170601,10,지루했다는 평을 듣고 가서 기대하지 않았었는데 집중해서 봤습니다  
20170601,10,자기 옷을 입은듯 완벽한 연기를 보여줬던 배우들과 풍성한 볼거리들은 러닝타임 내내 눈을 떼지 못하게 한다  
20170601,10,선조의 시대 짜증나는 시대이다. 그래도 민초의 순박한 나라사랑이 현재를 오게 하지 않았나한다.  
20170601,10,여진구오빠 점점 눈빛이 변하는게 너무 소름돋게 멋있었어요  
20170601,1,와....진짜 영화 지뢰였음..아 내돈이랑 시간이아깝다  
20170601,5,관람객광해의 국토대장정과 성장기 런닝타임은 왜이리 길지 하는 작품이다  
20170601,8,임팩트는 없었지만 심리상태를 잘 표현한 배우들이 있었기에 볼 만한 영화 ~~광해군의 심리가 그 시대에는 정말 영화 속 같지 않았을까?  
20170601,8, 마지막 전투씬은 시간 가는줄 모르고 봤다. 임진왜란 당시 이순신장군뒤 이런 이야기도 있었구나라고 알게된 영화  
20170601,10,좋은배우들의 연기로 후반으로갈수록 더좋았네요.  
20170601,10,이정재가 선택한 영화는 항상 옳은듯ㅠㅠㅠ이번에도 대박징조!! 본 사람만 알 수 있는 이 영화의 위엄!  
20170601,10,영화 보기전부터 기대했는데 역시나 실망시키는 법이 없구나..  
20170601,10,이 영화 너무 인상깊게 봤어요..  
20170601,9,오랜만에 만나는 최고의 사극 영화!!  
20170601,1,영화봤는데 너무 재미없어 평점보러왔다가 너무 높아서 1점주고 갑니다. 올해 본 영화중에 최악이에요....실제론 5점 주고싶네요  
20170601,10,오랜만에 만나는 감동 사극.. 개인적으로 영화 광해 보다 인상깊게 본 것 같다  
20170601,10,뭔가 나올려나하다가 끝나버린 영화  
20170601,10,김무열 연기짱이예요...  
20170601,7,그냥그냥 그랬습니다..  
20170601,10,짠하면서도 가슴을 울리는 영화  
20170601,9,역시 굿~~~~!!!  
20170601,10,여진구와 이정재의 연기 와~~ 역시 멋있네요  
20170601,10,이젠 이정재의 연기를 믿고 볼수있을것 같습니다 잘 봤네욥~  
20170601,10,얼마전 우리의 모습과 너무나 닮았음ㅜㅜ 꼭 보시길  
20170601,8,"이정재, 여진구, 김무열 등 배우들만으로도 훈내 진동 했던 영화  "
20170601,10,영화 <대립군> 역시 기대 이상이었습니다^^  
20170601,10,별로일줄 알았는데 지루할틈 없이 시간가는줄 모르고봄 ㅋㅎㅋㅎ  
20170601,10,내가 영화를 잘 아는 사람은 아니지만 이 영화가 대단하다는 건 느낄 수 있었다  
20170601,10,광해의 성장일기랄까? 어릴적 광해의 모습은 처음이라 신선했다  
20170601,10,세자가 춤출때 눈물이..ㅜㅜ  
20170601,9,관람객비운의왕..저 당시 조상님들의 혼이 깃든 무게감있는 영화입니다. 연기력도 좋고 몰입감도 좋아 추천드리는 영화!  
20170601,10,배우들 명성에 걸맞게 연기는 두말할 것 없고 고생한게 눈에 보이더라구요.. 여진구 나이도 어린데 대단해요  
20170601,10,역사를 잘 알지 못해도 괜찮아요!영화 보면 다이해갑니다 ㅎㅎ  
20170601,10,나라가 망해도 우리 팔자는 안바뀌어 공감ㅠ  
20170601,9,솔직히 지금과 같은 시국에 영화보신 모든분들이 조금씩 찡한느낌으로 영화를 관람할수 있을거같아요. 전 솔직히 너무 좋았습니다. 베플님 말과같이 현재의 우리나라같이 나라를  구하는일은 백성의 몫이 필요하고 좋은 지도자도 필요한것을 느끼게되는 영화였습니당  
20170601,10,뜻깊은 영화였습니다. 괜히 가슴이 찌릿..하던데요  
