0,1,2
20170604,10,"액션영화를 생각한다면 보지마시길, 어린 광해가 성장하는 이야기를 담은 감동 성장드라마  "
20170604,1,관람객1점이 아까운 영화입니다  
20170604,8,뻔한 전개이긴 해도 몰입도가 상당해서 안타깝고 울컥했어요.. 조연들의 연기들도 좋아서 흠잡을게 없네요  
20170604,9,아비와는 다르게 왕이라는 직함에 책임감을 갖고 애쓰는 아들의 모습.. 그 당시 선조는 무슨 생각을 하고 아들과 백성을 버렷는가  
20170604,9,지금의 대한민국은 조상들이 만들었다고해도 과언이 아닐..  
20170604,8,생각할 수 있는 영화였어요~~  
20170604,8,이정재 멋짐 오랜만에 인상적이게봄  
20170604,8,여진구 춤추는 장면에서 웃었다는 사람들 뭐임? 난 슬프던데 -_-… 얼마나 우리 역사를 가볍게 봤으면 그런 생각을 할까ㅡㅡ  
20170604,9,솔직히 광해에 대한 재평가가 시급하다 많은 업적을 남긴 왕임에도 불구하고 폭군으로 불리는 상황이 안타깝다.  
20170604,10,끝까지 왕을 지키려는 백성들에게 감동!  
20170604,10,대작은 아니지만 여운이 길게 남네요. 리더와 왕 대해 다시한번생각해보게 되는 영화!  
20170604,9,사극을 좋아하는 편이라 재밋게 봤어요  
20170604,10,마지막 부분 넘나 감동적ㅠㅠ.. 이정재랑 여진구 연기가 좋았다  
20170604,9,볼만했어요~ 처음은 지루한듯 하다가 후반부로 갈수록 진한 감동이 느껴지네요^^  
20170604,8,중간중간 맥이끊기는 연출은 아쉽지만 전체적으로는 좋았습니다 강추는아니지만 추천할만함  
20170604,10,캐스팅도 다 마음에 들고 완전 내스타일 영화 ㅎㅎ  
20170604,8,또 한번 느낀 선조의 무능함ㅋㅋㅋ  
20170604,8,낯선곳에서 성장해가는 광해의 모습  
20170604,9,그 당시 이순신만이 나라를 지킨건 아니었구나..  
20170604,7,어떻게 아들을 팔 생각을 했을까ㅋㅋㅋ  
20170604,7,먹기 살기 위해 자신의 목숨까지 걸어야한다는데 참 마음이 아프네..  
20170604,10,하 진짜 댓글이랑 평점보고 걱정했는데... 진짜 꼭 보세요ㅠㅠ 산만 타면 어때요 겁나 재미있는데ㅠㅠㅠ  
20170604,8,이정재는 항상 뜻깊은 역할들만 하는것 같네요^^  
20170604,10,아무것도 모르는 어린왕이 전쟁을 겪으며 강해졌고 그 뒤에는 대립군이 있었다  
20170604,10,맨날 오락영화만 보다가 이런 영화 보니까 많은 생각을 하게 되네요  
20170604,10,대립군이라는 사람들에 대해 알게 되었네요  
20170604,9,여진구 너무 멋있음ㅠㅠㅠ이런 왕이 있음 참 좋을텐데ㅠ  
20170604,10,토우와 광해가 서로를 믿게 되면서 나라를 위해 변하는 모습에 감동ㅜㅜ  
20170604,10,우리가 알지 못한 새로운 인물들이 우리나라를 지켰다는걸..  
20170604,8,여진구는 날이 갈수록 연기가 느네  
20170604,8,김무열ㄷㄷ 시간이 지날수록 초췌해져가는 모습까지 신경쓴 연기열정에 놀라따..  
20170604,9,인상깊은 명대사들이 많은데 이거 다 짜집어서 이 시대의 리더들에게 보여줘야하는거 아님?  
20170604,10,좋은 스토리! 배우들의 멋진 연기가 어우러진 완벽한 하모니  
20170604,10,개인적으로 정말 잘 만든 영화라고 생각하는데 욕하면서 깎아 내리는 사람들은 납득하기가 어렵다  
20170604,9, 알고있는 내용이었지만 그시대의 아픔을 느끼고싶어 봤네요. 배우들 몰입 좋았습니다..  
20170604,8,우리 조상들이 살아온 시대는 슬프고 참담한 일들이 너무 많다  
20170604,10,"올바른 리더, 진정한 리더의 의미를 되새겨볼 수 잇는 영화  "
20170604,10,차츰 리더로써 성장해가는 광해.. 이런 리더들만 있다면 얼마나 좋을까  
20170604,8,배우들 연기는 흠잡을 게 없네여 ㅎ  
20170604,8,"여진구, 이정재 연기도 좋았지만 곡수 역에 김무열도 기억에 남는다  "
20170604,9,나라를 위해 왕을 위해 목숨을 바친 대립군  
20170604,10,"감동적이에요, 잊고 있던 애국심을 느끼게 하는 영화였습니다.  "
20170604,7,관람객사도보다 연기나 전체 구성이 좀 엉성한거 같아요. 그래서 그런지 인물의 내면묘사나 등장인물간의 심리관계가 짜임새 있게 느껴지지 않았어요. 이정재는 항상 제한된 감정묘사나 어투를 보여주고 여진구는 표현력이 떨어지는거 같아요.  
20170604,10,이정재는 진짜 사극이랑 잘어울리는 것 같다  
20170604,8,광해의 일생을 뒤돌아보면 결코 순탄하지 않았던 것 같음  
20170604,9,임진왜란이 주요 이야기일 것 같지만 하나가 되어가는 왕과 백성의 마음이 주를 이루는 영화  
20170604,10,왕도 백성을 버리고 도망쳤는데  나라가 해준것도 없는데 자신의 목숨을 걸고 싸우는 사람들… 괜히 감동 받네..  
20170604,7,"현 시국을 빗대어 보여주는 영화, 이게 픽션이 아니라 실제 있었던 소재라는게 더 흥미롭다  "
20170604,8,베플 공감 마니됨ㅠㅠ..나라를 나라답게..  
20170604,10,백성은 위대하다!! 교훈적인 영화!  
20170604,8,감동과 재미가 함께 하는 영화  
20170604,10,하.. 광해.. 당신은 왜 초심을 잃었을까요 처음 그 마음 그대로 나라를 다스렸으면 광해군이라는 칭호가 붙지 않았을텐데 말이죠  
20170604,10,배우들의연기 스토리 긴장감 모두 좋았습니다 강추합니다 후회안해요!  
20170604,8,두려움을 지니는 것은 나의 가치를 부정하는 나 이상의 힘에 대한 표상에 의한다.  
20170604,10,"왜 이영화가 까여아하는지 이해가 안간다.. 우리가 알아야할 역사의 한 부분, 그리고 다시는 일어나지 말아야할 잘못을 그려냈는데 ""재미""만으로 영화를 평가하다니  "
20170604,9,맨첨에 이정재 나올때부터 포스 장난 아님.. 생각했던것만큼 스펙타클한 영화는 아니었는데 꽤 재밋었음  
20170604,9,어린 광해가 얼마나 두려웠을까..  
20170604,8,와 선조 뭐냐 아들 버리고 도망가? 이런  썩을…  
20170604,8,나라가 있어야 왕이 있고 왕이 있어야 백성이 있다  
20170604,7,"배우 연기, 비주얼 다 좋아요. 전반적으로 약간은 미지근한 연출이 아쉽지 . 자꾸 찾아보게 되는 영화입니다.  "
20170604,8,우리 역사의 비극은 정말 다양하구나ㅠ  
20170604,10,역사영화를 워낙 좋아해서 재밌었당  
20170604,9,깃발에 용이 두마리인 이유를 아는가? 한 마리는 임금이고 하나는 백성을 뜻하는 것이겠지요  
20170604,9,그동안 알지 못해던 광해의 모습을 알 수 있었네요  
20170604,8,그래도 자기 백성을 위해서변화하는 모습이 보기좋았어요  
20170604,8,보는 동안 창피함을 느낌면서 보았내요. 어떤 옷을 입고있어도 아직은 변한 것이 없는 우리나라ㅠ  
20170604,10,잔잔했지만 여운이 남는 영화에요  
20170604,10,재밌게 보고 왔습니다. 전투신은 조금 아쉬운 부분이 있네요 하지만 내용이 너무 좋아서 그부분 빼고는 좋았습니다.  
20170604,10,여진구 나이도 어린데 연기 진짜 잘하는듯  
20170604,10,처음부터 끝까지몰입하게 만드는 영화  
20170604,9,재미나게 잘보았습니다...이정재.여진구 연기가 일품이네요 ㅎ  
20170604,10,여진구는 진짜 대단한 배우가 될것..  
20170604,10,아무것도 모르는 소년광해와 성장한 광해의 감정 연기를 참 잘했다는 생각.  
20170604,1,아놔ㅋㅋㄱㄱ 세상에서 제일  
20170604,9,재밌었습니다!!!결말이조금아쉬웠지만ㅠㅠㅠ  
20170604,7,다른영화에서 많이본장면들이 진부하게 나온다. 그래서 조금 부족하지만 볼만한영화 챙겨볼만큼은 아님  
20170604,10,완전재미있었음요ㅋㅋㄲ  
20170604,10,괜찮은 영화였어요 동생도 보여주고싶네요  
20170604,5,사도와 비교해보면 사도영화자체도 정적이긴했지만 스토리탄탄하고 가슴에와닿는 무언가가있었다면 이영화는 그저 뭔가 끼어맞추기식? 흥행요소들을 억지로 끼어넣으려고 흉내만 하다 끝난다....솔직히 배우빨 연기력 빨이 너무나도 크다....  
20170604,8,여진구는 평소에 좋아하는 배우였는데 이번에도 만족스럽네요^^  
20170604,9,나라를 위해 맞서 싸운 왕과 백성들의 모습에 감동..  
20170604,8,내가 다 마음이 아팠던 영화..  
20170604,10,보는 사람에 따라 관점이 다르겠지만 난 실망따윈 없었다. 우리 역사의 아픔이 반복되지 않기를 바라는 마음뿐  
20170604,7,배우들 연기는 굿ㅋㅋ ㅋㅋ  
20170604,9,그때 그 시절 대립군이라는 이름으로 목숨이 버려진 자들이 얼마나 많았을까..  
20170604,8,여진구 연기 되게 잘하더라~~ 나이도 어린데 장하군~  
20170604,9,촬영기법??이 꽤멋있엇던 것 같아요!  
20170604,8,젤 마음에 들었던건 무엇보다 영상미! 산이며 계곡이며 푸르른 우리나라의 전경이 너무 멋있었다  
20170604,8,그때나 지금이나 백성들은 나라를 위해 싸운다는 생각이 들더군  
20170604,10,포스터랑 에고편만 보고 가셔도 영화에 대한 이해가 쉬울 것 같네요^^  
20170604,8,셀 수 없는 수 많은 사람들의 희생으로 일궈낸 우리나라 우리 대한민국  
20170604,10,캐릭터 하나하나 매력적이었고 영화가 주는 여러가지 교훈들도 감동적이었습니다  
20170604,8,ㅠㅠ난 김무열한데 완전반해따.. 윤승아 부러웤ㅋㅋ  
20170604,9,아비는 백성을 버렸어도 아들은 버리지 않았고 함께 성장했다  
20170604,9,역사에 관심이 많은 사람들에게 강츄! 아닌 사람들에게는 호불호가 갈릴수도잇엣음  
20170604,8,점점 재밌어지는 영화!!  
20170604,1,이 영화를 보고 여친과 싸웠습니다.정말 솔직하게 재미 없으면서 너희들 왜 그래!!지금 평점은 믿을게 못됨  
20170604,10,무엇보다 배우들의 연기가ㅋㅋ  
20170604,3,작품말고 연기만 보고싶으면 보세요스토리에 허술한점이 너무 많네요  
20170604,8,성군의 자격에 대해서 생각해보게 되는 영화  
20170604,9,아니요즘 개봉영화들 다 왤케 재미있는것만 나오는거야ㅠㅠㅠ  
20170604,10,남을 위한 삶을 산 그들이지만 그들이 있었기에 이길 수 있었다  
20170604,6,산속에서 너무 많은 시간을 보내버린 왕.   관객을 놓치다  
20170604,10,내가 본 그 어떤 영화들보다 현실적이고 인상깊었다. 영상미와 코믹한 요소등등 연출도 흥미롭게 해주어서 지루하지 않게 보았습니다  
20170604,1,진심으로 영화 이따위로 만들거면 스크린 쿼터 폐ㅣ해라 뭔 아이디어도 없고 역사책이나 뒤지다가 시나리오를 쓰는건지  역사책은 커녕 그냥 아는 사람중에  역사 전공한 사람한테 뭐 신박한거 없냐고 물어보고 쓰는건지 하 진짜 대가리는 폼으로 달고 다니나  
20170604,10,대립군 보고왔는데 몰입도가 최고였어요! 헬조선의 역사는 반복되지만 백성들의 힘으로 극복할 수 있다는 용기를 얻었음요 ㅎ  
20170604,10,슬프도록 아름다운 이야기  
20170604,6,평점이나 줄거리 연기자들 보고 영화를 봤는데생각보다 재미없네요.  
20170604,8,어린 광해가 이렇게 멋진 사람인줄은 몰랐다  
20170604,8,실화를 배경으로만든 사극 영화중 가장 현실적이고 흥미진진한듯.  
20170604,9,"국민은 나라를 위해 헌신하는데 왕은 그렇지 않은 요즘, 바뀐 왕은 제발잘해주시길  "
20170604,8,과거에서 경험으로 얻어지는 값진 문제  
20170604,1,이정재가 만든영화냐? 진짜 가족끼리 봤는데 하품만 나옴 거의 뭐 그냥 내용도 0점 왜만든거에요 감독님 ㅠㅠ 진짜 이돈으로 다른영화에 만드는거에 투자나하지 ㅠㅠ 다른 좋은 작품들 돈없어서 개봉 못하는 경우도 많은데 이건 뭐 거의 쓸데없는 영화급  
20170604,10,남을 위해 대신 삶을 사는 대립군들의 모습이 지금 우리시대의 많은 직장인들의 모습과 겹쳐보이더라  
20170604,9,우리에게 필요한 리더를 대립군에서 확인한 듯  
20170604,10,임진왜란 바다에 이순신이 있었다면 육지에는 백성들이 있었다.  
20170604,8,"여진구, 이정재 연기 갑오브갑..  "
20170604,8,왕이 똑똑해야 백성이 편하다는건 예나 지금이나 변함이 없네요  
20170604,8,여진구를 어린 광해로 캐스팅한건 최고엿다고 본다  
20170604,10,점점 다양한 캐릭터를 연기하는 여진구ㅎ 진짜 어마어마한 배우가 될 것 같은 느낌  
20170604,10,나약했던 세자 광해. 역시 상황이 사람을 만드는듯  
20170604,9,역사에 관심이 없는 사람들은 쫌 지루할수도? 난 재밌었는데 내동생은 그럭저럭이라 하드라구요 ㅋ  
20170604,10,절대 그 당시 같은 실수를 반복하는 나라가 되지 않앗으면 합니다  
20170604,10,왜 사람들이 이정재 이정재 하는일 알겠더라..  
20170604,4,역사물을 좋아하는 나조차 개핵노잼~부모님 모시고 관람했는데 참 난감했습니다영화가 두시간이 좀 넘는데 편집 좀 하던지..매우 지루하고 외군과 의병의 숫자는 초라할정도로 빈약해서 드라마보다 못한 수준이었네요  
20170604,8,옛날이나 지금이나 무능한 왕은 백성들을 힘들게 하는군요 ㅋㅋ  
20170604,10,여진구가 연기하는 광해는 진짜 최고였다  
20170604,8,왕이 도망가고 나서 세자랑 백성들이 나라 지키는거 보는데 왜이렇게 마음이 아프던지..  
20170604,2,2점도  과하게 준거다.  
20170604,9,나도모르게 눈물이..ㅜㅜ 진짜 가슴에 와닿는 영화였어요  
20170604,10,뭐지 지금 우리나라의 모습과 오버랩 되는건?..  
20170604,8,이정재X여진구X김무열 셋다 짱짱  
20170604,9,재밌더라~ 역시 이정재 나오는 영화들은 평타 이상인듯  
20170604,10,우리 나라의 역사를 기반으로 한 내용이라 가족들이랑 보기에도 좋을 것 같구 무엇보다 이정재와 여진구의 연기가 참 좋았다  
20170604,9,배우들 케미 쩔고 흥미진진해요  마지막까지 몰입해서 보고 왔습니다  
20170604,10,그래도 이런 왕이 있었다는게 감동입니다!!  
20170604,10,현재의 지금을 생각하게 하는 영화 백성과 왕의 조화가 와닿았다  
20170604,10,얼마 전 우리의 모습과 닮아 있는 그 시절..  
20170604,8,사극인데도 불구하고 참 현실에 와닿는 느낌  
20170604,9,기대이상으로 재미있게 보았습니당^^  
20170604,10,영화가 주는 메시지도 뚜렷하고 마지막에는 감동까지..  
20170604,8,영화 잘만든 것 같아요 영상미는 물론 배우들의 연기도 좋았고 지금 우리 시대를 살아가는 대한민국 국민이라면 꼭 봐야하지 않을까 싶습니다  
20170604,3,대립군은 그냥 지금 비정규직의 정치적 물타기를 하는거고 대사나 이런것도 그럼 영화는 영화자체의 시나리오와 연기등등으로 승부해야는데 어설프게 녹임. 휴대폰꺼내서 야구스코어를 보게한 영화임  
20170604,9,이정재이기 때문에 꼭 봐야할 영화  
20170604,10,우리가 살아온 시대에 대해 생각해볼 수 있는 계기가 되었습니다  
20170604,9,뻔한 사극 액션영화들과는 달리 큰 울림을 주는 영화였습니다  
20170604,10,지루하지 않게 우리역사를 되돌아볼 수 있게 해준 영화였어요.  
20170604,10,점수는 높게주는데 내가생각한거랑 다른내용이라서 좀 액션위주로보긴햇음 근데 너무 예상이다됬어 근데 볼만했어  
20170604,10,"볼만합니다, 학생들에게도 보여주고 싶네요  "
20170604,7,감동과 슬픔이 공존하는 영화  
20170604,8,이 영화는 끝까지 봐야 진가를 알 수 있는 영화인 것 같습니다.  
20170604,10,예나 지금이나 나라를 바꾸는건 국민의 몫  
20170604,9,현실과 맞닿아있는 안타까움..  
20170604,10,새로운 역사이야기를 알게 되었고 그게 반복이 되고 있다는 것도 알고 있었다.  
20170604,3,스토리가 심각하다. 너무 뻔한 영화. 최종병기 활과 추노 같은 부류에 나오는 것을 모두 짬뽕시킨 듯한 영화. 너무 뻔해서 딱 다음 장면이 뭐가 나올지 다 예측됨.  
20170604,8,"그때 그 당시, 대립군이 있었다  "
20170604,9,임진왜란때 몰랐던 역사적 사실을 알 수 있었습니다  
20170604,10,감동과 슬픔이 공존하는 영화였다  
20170604,8,"과거와 현재를 시대만 바꾸어서 잘 표현한 것 같아요, 안타깝고 비참한 역사라고 생각했는데 이게 불과 몇달전 우리의 모습이었다는게 더 서러워지네요 다신 이런일이 일어나지 않길  "
20170604,9,영상미가 너무 좋아요 ㅎㅎ 촬영현장이 궁금해지네요  
20170604,9,이 나라를 지켜주신 수 많은 이름 모를 백성들의 헌신에 감사합니다.  
20170604,10,오랜만에 진짜 감동을 느낄 수 있는 영화였어요  
20170604,9,어린 광해의 처연함에 가슴이 울컥..ㅠ 어디서든 빛나능 이정재의 포스는 눈이 번쩍 드이게함 ㅋㅋ  
20170604,9,선조때의 역사는 보면 볼수록 화가난다ㅠㅠ.. 이정재와 여진구의 감정 연기 만족  
20170604,10,배우들이 서로 바라보며 감정연기 할 때마다 눈물이 계속 흘러 내렸다.영화가 끝나고도 그 여운이 잊혀지지 않는다.꼭 보라  
20170604,7,내용 굿. 뜻깊은 영화라 더 마음이 감  
20170604,8,뒷부분에 조금은 예상되는 결말을 보이지만 전개를 풀어나가는 방식이 부담 없이 편안했다  
20170604,10,이정재의 사극은 진리요 ㅎㅎ  
20170604,8,난이제 광해 하면 여진구가 더오를듯ㅎ  
20170604,9,"광해가 멋있어지게 된 계기! 광해, 왕이 된 남자와 이어서 생각해보면 더 재밌다  "
20170604,10,뒤로갈수록 몰입이 되어서 너무 좋았어요  
20170604,8,연평해전에서 김무열 보고 연기 참 잘한다고 생각했는데 대립군에서 보니 더 잘하네요ㅎㅎ 얼굴도 잘생기고 연기도 잘하고 ㅎㅎ  
20170604,10,"배우들의연기, 영화내용 다 만족! 꿀잼입니다.!  "
20170604,8,볼거리와 그런걸 생각하면 별5개정도이지만 배우들의 연기때문에 그나마 좋았던 영화. 옆자리 앞자리 뒷자리 여자들 모두 하품하거나  자더라....무거운내용을 더무겁고 지겹게 만든...참..지루했다  
20170604,9,재미있게 봤습니다. 좀 슬프고 웬지 요즘 시대상과도 맞는듯해서 마음 아픈...  
20170604,8,관람객재밋게 잘봤습니다.ㅋㅋ  
20170604,8,점점 성장해가는 왕의 모습이 대견하고 멋있었다  
20170604,9,여진구 잘컸네.. 날이 갈수록 연기가 더 빛을 발하는듯  
20170604,10,너무 재미써여ㅠ_ㅠ 간만에 진짜 영화를본 기분!  
20170604,9,내용은 단순해보일지 몰라도 풀어내는 힘이 대단하네요  
20170604,10,그들도 누군가의 가족이자 자식이었을 텐데 나라를 위해 남을 위해 대신 싸우는 모습에 감동받았다  
20170604,10,역사는 돌고 실수는 반복되지 말아야한다  
20170604,7,국민이라면 꼭 봐야할 영화가 아닐까  
20170604,8,"그 시절, 우리의 왕은 비겁했지만 광해는 비겁하지 않았다  "
20170604,10,재미있고 감동적인 영화였어요~~ 배우들의 연기며 영상이며 재미있습니다^^  
20170604,9,잊지 말아야할 우리나라의 역사 중 하나.  
20170604,10,나는 누구의 대립군으로 살고 있는가?하는 생각이 드네요  
20170604,8,배우들의 연기가 연기가 몰입할 수 잇게 해주었어요  
20170604,9,영화 시나리오가 참 좋네요  
20170604,10,여진구의 어린 광해 연기에 감탄.. 점점 성장해가는 광해의 모습에서 깊은 감동을 느꼈다  
20170604,8,이정재의 연기가 몰입을 불러 일으키네여 ㅎㅎ  
20170604,5,관람객영화에 핵심이없어요ㅋ  
20170604,9,슬프면서도 마음이 무거워지는 영화?이정재 연기는 역시 멋있네요  
20170604,10,완전 짱.. 이정재 카리스마 대박임 보길잘할듯  
20170604,9,다시한번 그때 그 아픔을 되새겨 볼 수 있는 시간이었습니다  
20170604,7,알지 못했던 역사를 알 수 있어서 좋았어요  
20170604,10,그 당시 대립군들의 마음은 어땟을까..  
20170604,7,어제 봤어요.. 1시간 지났을무렵 후반전을 언제하는거지?하고 시계를 봤어요..초반전계가 너무 길어서 조금 지루한점이 없지않아 있었어요..이정재씨 연기는 좋았어요후반에 여기저기 훌쩍이는 분들고 계시고 광해 보신분들은 좀더이해가쉬울듯  
20170604,8,훌쩍 어른이 되어버린 여진구! 광해 역할에 딱 맞지 않았나 싶다  
20170604,9,버릴 캐릭터 하나도 없는 영화였어요. 다들 인상깊은 연기로 버릴게 하나도 없는 인물들이더라구요  
20170604,10,브로맨스란 이런걸 보고 하는말이지!!  
20170604,8,왕이 될 준비가 되지 않았던 어린 광해를 멋진 왕으로 이끌어가는 토우의 모습이 인상깊었어요  
20170604,9,아버지가 역사영화를 좋아하는데 꼭 보여드리고 싶어요  
20170604,10,영화가 시대를 대변한다  
20170604,9,그동안 광해를 소재로 나왔던 영화들 중에 가장 인상깊지 않나 싶네요  
20170604,9,우리는 임진왜란 때 많은 사람들의 숭고한희생으로 이뤄졌다는 점을 잊지 말아야한다  
20170604,10,"이정재, 여진구, 김무열의 브로맨스 쵝오  "
20170604,10,"130분, 2시간이 넘는 시간이었지만 전혀 지루할 틈이 없을 정도의 몰입가믈 선사한다  "
20170604,7,와 김무열이 연기를 이렇게 잘했나?  
20170604,8,사람들이 이정재 연기 관상이랑 똑같을 거라고 하던데 전혀~~ 관상은 생각도 안난다ㅡㅡ.. 대립군의 대장 토우만 기억날뿐  
20170604,10,나는 이정재와 김무열이 그렇게 기억에 남는구나..  
20170604,9,전체적으로 꽤나 만족스러운 영화. 내용도 좋고 연기력도 상당함  
20170604,7,인물을 섬세하게 그린 안정적인 전쟁영화를 보는 뿌듯함.그 와중에도 픽션사극의 규칙을 정확히 지킨다. 후반에 스케일의 다소 아쉬움을 커버하는 드라마.  
20170604,10,흠잡을 곳 없던 배우들의 연기력  
20170604,8,"광해군의 다른 일면을 볼 수 있었고, 대립을 해서라도 살아야했던 사민들의 아픈 삶을 잘 느낄 수 있었다!  "
20170604,8,영화 내용도 좋고 영화 속 배경도 최고였어요 영상미가 정말 최고랄까?? 극에 대한 몰입감을 제대로 높여주는데요!  
20170604,9,"이정재,여진구,김무열 이 배우들의 무게감은 상상 그 이상이였다,  "
20170604,10,역사 영화로 충분히 볼만합니다  
20170604,8,마음도 너무 아프고.. 재밌었구.. 운건 안비밀ㅜㅜ  
20170604,9,지루함이 없던 최고의 영화  
20170604,9,아침부터 보고오길 잘했다는 생각..  
20170604,10,"왕이 되고 싶지 않으십니까?, "" 그대는 내 백성이 되고 싶은가?"" 하 소름…  "
20170604,8,부모님이랑 봣는데 역사 이야기라 그런지 재밌다고 하시더라구요 저는 살짝 늘어지는 것 같았어요ㅠ 그래도 전체적으로는 무난무난합니다  
20170604,7,소재나 메시지는 좋았으나 연출이 아쉬움  
20170604,10,역사의 뒤안길을 한번 더 각인 시켜준 영화  
20170604,8,완전 짱.. 사람들이 뭐라고 하는만큼 이상하지도 않았고 특히나 여진구와 이정재 카리스마 대박임 보길잘한듯  
20170604,9,이 영화 너무 좋다.. 가슴으로 말하는 영화  
20170604,8,진짜 마음으로 보게 되는 영화였어요  
20170604,10,대립군의 광해 같은 리더가 왕이 되는 날이 왔길  
20170604,9,역사는 항상 반복 된다는걸 잊지말고 반복되지 않도록 조심 또 조심합시다  
20170604,10,우리나라에도 근 10년 동안 이런 리더가 있엇으면 얼마나 좋았을까 하는 아쉬움이 듭니다. 앞으로는 국민과 함께 화합하는 좋은 리더만 나왔으면 하는 바램입니다  
20170604,8,백성과 함께 성장해가는 어린 광해의 모습이 인상깊네요  
20170604,9,여진구가 연기하는 광해는 진짜 최고였다  
20170604,10,왕이 도망가고 나서 세자랑 백성들이 나라 지키는거 보는데 왜이렇게 마음이 아프던지..  
20170604,8,나도모르게 눈물이..ㅜㅜ 진짜 가슴에 와닿는 영화였어요  
20170604,9,뭐지 지금 우리나라의 모습과 오버랩 되는건?..  
20170604,10,관람객대립군이라는게 두가지 의미가 있는것 같네요.  
20170604,10,지루할 틈 없이 연기며 몰입도까지 다 훌륭했다  
20170604,2,"좋은 소재, 좋은 배우들이 있었지만, 연출은 정말 최악이었다1시간 남짓 영화보다 정말 지루해서 뛰쳐나왔다  "
20170604,4,관람객재미없어여 지루하고 시간끌기임  
20170604,3,노잼이구요 노잼보스에요  
