0,1,2
20170721,9,관람객딱 시간때우기 좋은 영화!! 근데 쿠키영상 있는지는 몰랐넹ㅋㅋ  
20170721,10,관람객영화 흐름이 빨라서  시간 가는 줄 모르고 봄  볼만함  
20170721,10,관람객공포 영화 못보는 나한테는 볼만한 듯 그리고 생각보다 이기홍 많이 나오네?  
20170721,10,관람객한시간 반 순삭!! 제대로 몰입해서 봤네  
20170721,9,관람객극장에서 시원하게 보기 딱 좋은 영화~ 짠내땀내 안나고 오락적이고 깔끔하니 누구나 즐길 수 있는 영화임. 이기홍 넘나 귀여움. 공포영화에서 이래도 됨?  
20170721,10,관람객예상보다 완전 재밌는 영화! 킬링타임 팝콘무비로 강추! 끝까지 꼭 보세요 막판까지 예상할수 없다는!  
20170721,10,관람객막 무섭지는 않은데 킬링타임용으로 충분히 즐길만한 요소가 많음! 재밌음 ㅎ  
20170721,10,"관람객상영 시간이 길지 않아 보기 딱 좋고, 쪼이는 맛이 있음  "
20170721,10,관람객혼자보지 말고 친구나 애인이랑 보는 걸 추천. 군더더기 없이 깔끔한 호러였고 컨저링 같은 거 무서워서 못보는 사람이랑 같이 봤는데 위시어폰은 그정도까진 아니었는데 긴장하면서 끝까지 다봄 다보고 나서 재밌다고말함 끝에 이기홍 쿠키영상도 있어서 다보고왔옴  
20170721,9,관람객생각 보다 재미짐! 나름 쫀쫀한 긴장감에 뮤직박스에 목매는 주인공이  안쓰럽다 ㅠㅠ  
20170721,10,배우들 연기도 좋고 스토리도 흥미진진하네요  
20170721,9,이기홍 너무 좋음ㅎㅎ잘나가는거 같아서 보기 좋다ㅎㅎ 아 물론 영화도 꽤나 잼남  
20170721,10,사람에 따라 호불호가 갈릴것 같긴함. 난 이정도 신선한 공포 딱 좋던디  
20170721,10,시간이 어떻게 지나가는지모르겠다~ 결말이 신선함  
20170721,10,한국 배우가 나오니 더 반가운 기분 ㅋㅋ 영화도 재미씁니다 ㅋㅋ  
20170721,10,관람객시간 맞아서 봤는데 재미짐 ㅋㅋ  주인공감정에 완전 몰입 ㅠㅠ  
20170721,10,무슨 일이든 대가가 따르는법..영화는 생각보다 볼만함  
20170721,10,데이트용 무비로 강추 ㅋㅋ 지금 평점보다 더 잼미나요  
20170721,4,유치하고 재미없었음.소리만 크고 별로;;배우들 연기는 좋았지만 스토리 가 너무 재미없었고너무 진부했어요 . 설마~하는부분에서 역시나 로 바뀌게 하는ㅎㅎ  
20170721,10,관람객무섭고 재밋네요 추천!  
20170721,10,"딱 적당한 것 같아요, 오랜만에 긴장하며 봤습니다  "
20170721,6,잘 모르겠든데 여러 장르가 이상하게 짬뽕돼서  
20170721,9,고급진 공포영화였음. 역시 이런건 영화관에서 봐야 ㅎ  
20170721,9,배우들한테 감정이입해서 보게 되는 영화  
20170721,10,사운드 효과만으로도공포감 조성성공. 빵빵한 음향 땜에 극장에서 보길 추천  
20170721,10,가볍게 볼만하고 인시디어스 보다 더 긴장하고 본것 같아요  
20170721,10,하지말라는건 좀 하지마라ㅠㅠ 아우 긴장되서 혼났네  
20170721,9,재밌었어요 소름돋을정도로 무섭고  약간 잔인한부분도있긴한데 좋았어요  
20170721,6,공포인데 공포같지 않은 느낌.  
20170721,5,ㅋㅋㅋㅋ어제봤는데 살다살다 이렇게 안무서운 공포영화는 처음이였어요 진짜 옆에 내친구얼굴이 더 무서울정도  
20170721,10,지금까지 본 공포영화 중에서 제일 최고였음!!!진짜 이 영화가 귀신안나오고 무서운 영화임...!!!팝콘먹다가 목에걸려서 기침나오는데 참느라 죽을뻔함...ㅋㅋ그것만빼면 진짜최고인 영화!!연기잘함!!  
20170721,9,"10 내평점공포물너무좋아요 보고싶어요컨저링4편만들어 위시어폰 관려있는 분을 제작 만족가다중국여자 왜죽어지 내용나와다,재밌가다.  "
20170721,10,마지막에 여주가  엄마때문이엿어!! 하는 부분이 이해 ㄴㄴ인디 설명해주실분 찾아욤  
20170721,10,관람객영화관 한가운데 혼자앉아서 봤습니다.제겐 공포보다 인생의 교훈을 남기네요  
20170721,1,재미 오지게 없음;; 인종차별 개 쩌는 백인영화 딱 그 수준. 공포라면서 왜 웃기기만 하냐 여주인공은 왜 중이병에 걸렸냐  
20170721,9,재밌겠다!! 예고편 보니까 생각보다 재밌을듯  
20170721,7,관람객가볍게 보기좋은 영화입니다  
20170721,1,리얼과 견줄만한 영화 돈을주고 본다면 ㅎㅎ  
20170721,9,고2여자인데 저는 재밌었습니다 소리가 너무 무서워서 힘들었어요 그리고 정말 무섭게 죽더군요 무섭고 재밌었습니다 추천하지만 각자 무서움의 정도가 다르게 느껴질 수 있으니 알아서 보세요 그래도 추천합니다 사실 좀 아무말 대잔치같아요 아무튼 보세요  
20170721,10,골조자체는 전형적 팝콘무비. 이런장르 매니아라면 그냥 볼만은함  
20170721,1,방금  보고왔습니다 영화보고 후기  1 주운물건을  함부로 가져오지말자 2 착하게  살자  이상입니다  감사합니다  
20170721,4,본격 여주 암걸리는 드라마 욕나올뻔  아참고로 엔딩크레딧1 개있어요 ㅋㅋ 다나가고 혼자 엔딩크레딧보고왔네 쿠키영상에 이기홍 나와요  
20170721,8,[알바아님] 파이널데스티네이션 + 소원. 더운 여름 그냥 보기 좋음  
20170721,1,"후기??? 예고편이 다임 걍 보,지,마 ㅋㅋㅋ  "
20170721,4,아왜그래진짜 쥬인공 이거는 주인공 핵발암 하드캐리임 보지마세요 ㅋㅋ나  
20170721,6,관람객하이틴 드라마인가....천둥 소리가 젤 무서웠다  
20170721,10,관람객Ggahshsueuhwgyeu  
20170721,1,관람객그야말로 개노잼 왠만한영화 다 재미있게보는 1인 근대 내가재미없다면 진짜 노잼  
20170721,1,방금 봤는데 30분 보다가 배그하러 나왔습니다엔딩까지 버티시면 돈 아까워서 보신걸로 알게요  
20170721,7,관람객잔인할것같은 장면들이 묘하게 비껴나가서 비위상할건 없었다. 애들 공포영화느낌..  넘기대했나..  
20170721,7,위시어폰보다 47미터가 더 재미있음. 생각지도 못한 반전.  
20170720,3,이거 왜 CGV홈페이지에 안뜨냐  
20170720,5,영화 삽입곡들은 좋더라  
20170720,10,여주 연기가 좋음. 이기홍 멋있고 너무길지도 짧지도 않고 너무 재밌음  
20170720,9,아무 생각없이 보기에 딱! 생각보다 괜츈  
20170720,10,"스릴, 로맨스, 코믹 모든요소가 삼박자로 맞춰진 공포물로 획기적이고 너무 재밌었어요 인생영화입니다. 무서운영화를 즐겨보는 편인데 이때까지 봤던 영화 중 가장 무섭게 봤어요 강추합니다! (나만 당할 수 없다)  "
20170720,7,영화관에서 볼려고 하는데 상영관이 왜 이렇게 없나요? 장난치시는것도 아니고 1관 이라도 상영을 해야 영화를 보든 안보든 하죠...ㅜ 상영관좀 많이 열어줘요  
20170720,4,딱히 귀신이 나오는게 아니라 뭐..소원 이뤄지면 사람 죽는 그런거임귀신나오는줄알고 봣ㄱ는데..  
20170720,1,내마지막소원은 이영화를안봤을때로 되돌려줘 !  
20170720,4,방금 봤는데..영화가 .어쩐지 운수가좋다더니..끝내 그런영화고 겁많은 사람들 입문용으로좋습니다 애나벨로 엿먹이면될듯  
20170720,10,정말 무서운 영화였습니다 희대의 명작!  
20170720,10,다크하우스보고 이거보니까 겁나 명작같아보임그거 안봤어도 무난하게 볼만했다  
20170720,5,공포는아님 무서운거 안나와  
20170720,6,기대하지마세요 그냥 볼만했습니다 근데 비싼돈주고 볼만해라고 물어보면 권해드리곤 싶지 않네요  
20170720,8,"연기, 스토리 괜찮음..공포물답게 공포 요소도 꽤 다분하다 고 생각. 전 추천이요~!  "
20170720,5,알바들 열일하네;;; 공포 영화라는데 무섭지가 않음 스토리도 지루  
20170720,3,보는데 관람객기절함 ㅋㅋ;;내용은 ㅂㄹ  
20170720,5,"학교괴담 느낌이랄까요? 공포 장르를 워낙 좋아해서 볼만했습니다. 다크하우스에 비하면야 감지덕지지만, 평작 그 이상 그 이하도 아닌. 그래서 별5 중간.  "
20170720,4,걍12세 관람가 해도됨  
20170720,10,생각보다 재밌다.  킬링타임용으로 딱!  
20170720,6,B-급 하이틴 호러 무비 수준인듯  
20170720,5,그건 그렇고 준이 말한 마지막 소원이 뭘까  
20170720,10,솔직히 말해서 별 기대없이 봤는데지루하지않고 스토리흐름도 좋았습니다.피가 낭자하는 공포물을 별로 안좋아해서이영화는 보기 편했던거같습니다.  
20170720,9,팝콘무비로 적격! 기홍이 보는 맛이 있음 ㅋ ㅑ ~~>_<  
20170720,5,내가 돈을 받아야 될거 같음..  
20170720,10,와 이거 역시 죽임..ㄷㄷㄷ  
20170720,3,무섭지도 않고 스토리도...  
20170720,10,하드 꿀잼 ㅠㅠ 돈이 하나도 안아까워요  
20170720,9,생각보다 볼만함  킬링 타임 무비로 딱 인듯  
20170720,2,멍청한 여주와 어설픈 미드흉내  
20170720,4,돈주고 영화관 갔는데 스토리가 무서운게 아니고 잠들까봐 무서웠음  
20170720,5,관람객생각보다엄청별로엿다제대로보지도못햇다  
20170720,1,진짜 희대의 명작입니다. 실컷 웃고 나왔네요!  
20170720,10,호불호가 있겠지만 모든 사람들이 대체적으로 재밌게 볼만한 너무 하드하지 않은 공포라서 더 좋았네요  
20170720,8,여주 연기 덕분에 재밌게 봤음 특히 후반부에 위시어폰에 대한 집착과 광기에 대해서. 엔딩은 뭐 보는 사람 나름이지만 차라리 이랬음... 하는 뻔한 결말이 낫지 않나 싶음 스토리는 대략 소원 하나에 목숨 하나라는 데스티네이션 방식임.  
20170720,10,여름의 시작을 함께하는 공포영화였음. 엄청나게 무섭다 이런걸 떠나 탄탄한 스토리와 함께 현실을 반영하는듯한 내용이 마음에 들었다!  
20170720,10,언블리버블 호우~~ wow  
20170720,6,예고편을 봤다면.... 영화 전체를 다 본것!!  
20170720,6,아침에 조조로 보고옴. 넘 기대를 많이 해서 그런가 기대에 못 미침. 돈은 안 아까움. 이런 장르 좋아해서 나올 때 마다 그냥 보러갈 듯. 큰 기대는 하지마새오  
20170720,10,재밌어요 하하하꼭 보세요  
20170720,10,킬링타임 무비로 딱인듯! 여름을 잊었다. 겁나 시원해 ㅋ 소오름!  
20170720,9,겁 많은 편인제 이 영화는 나름 재미있게 봤다ㅋㅋㅋㅋ 이기홍 러브라인도 나와서 보는 맛이 났음  
20170720,8,그닥 무섭지는 않고 많은 여운과 교훈을 주는 영화  
20170720,5,관람객컨져링 1 2 과는 달리 B급 하이틴 호러물 정도..? 추천 못하겠네요  
20170720,1,40대평점 9점대라ㅋㅋㅋ알바인거 너무 티나는데? ㅋ  
20170720,9,무서웡 무서웡 무서웡.  
20170720,5,"인시디어스 애나벨 감독이네, 이감독 공포영화에 소질없어 보이는데...하나도 안무섭고 스토리나 감동도 없고..  "
20170720,1,아빠엄마 아이디 빌려쓴 10대 알바 친구들 많나보네 40대 이상 뭐냐 선호도  
20170720,1,조조호 영화보았는데 핵노잼 진짜 개핵노잼 돈아까워요  
20170720,5,음...이기홍때문에 보긴햇는데...ㅎㅎㅎ  
20170720,7,조조로 보고옴더운날에 시원한 영화관에서 킬링타임용으로 한판 때리기엔 딱임 전반적으로 나쁘지 않음다만 컨저링이랑 비교하는 글이 있던데 그정도 몰입감과 연출은 기대하지 마셈  
20170720,10,애나벨1이 로튼 22야 깝치지마좀  
20170720,1,로튼 19% 볼것도없네ㅋㅋㅋ  
20170720,10,이건 혁명이다. 새로운 영화의 장르를 만들다.  
20170720,10,ㅈㅂ 컨저링만큼만 잼써라  
20170720,10,내일 볼껀데 정확한 후기좀  
20170720,10,오늘 볼건데 팝콘 사야될지 말지 고민중;;  
