0,1,2
20170730,7,관람객생각보다 안무섭고 너무 뻔함  
20170729,10,잔인한 부분에서 딱 끊어줘서 오히려 좋았음 되게 긴장되고 재밌는데 상영관이 별로 없어서 실망  
20170729,7,관람객그냥 킬림타임용으로 ㄱㅊ음 조금 무섭기도 하고  
20170729,8,생각보다 무섭진 않았지만 스토리가 흥미로웠어요  
20170729,8,관람객끝이좀 허무하긴하지만 볼만함!  
20170728,6,관람객재미잇게봣습니다.무섭기도하고  
20170728,6,관람객저는 재밌게 봤는데 같이 보신분은 별로라고 하셨어요. 호불호가 갈리는 편인거 같네요.  
20170728,2,"기대했던무서움관달랐던영화.영화 끝자락으로갈수록답답해짐.그리고끝나면고구마100개먹은듯한 답답함과허무함이밀려옴.그리고 맨끝에 매우 예상가능하고 뻔한얘기를넣어놓음.만원주고이영화보기는시간대비돈이아까움.살짝의공포를즐기고싶다면봐도상관없지만, 가능한보지않는것을추천  "
20170728,10,관람객막그렇게 재미잇진않은데 깜짝깜짝놀라요  
20170728,9,관람객볼만했습니다그럭저럭무섭고  
20170728,8,평가를 하는건 안좋다고배웠지만그냥 너무완벽하고 깔끔한데..뭔가없어요 재미가 있는거같기도하면서 없기도하면서 군더더기 하나없고 찝찝한거 하나없어요 근데 그게없어요 그게 말로 표현할수없는 그거  
20170728,10,으  기홍이형나오네 .. 무서운거좋아해서 볼려는데 재밌을까  
20170728,8,관람객하나를 얻으면 하나를 잃고 결국 계속 갈망하다 마지막엔 파멸이라는 말이 숨겨진듯  
20170728,10,댓가가 아니라.. 대가  
20170728,10,옛날 tv 에서 본 환상특급이 생각나네요...ㅋㅋㅋ~~~ 그리고 영화 헬 레이저 공포 영화가 얼핏 비슷하네요... 잘 봤습니다...  
20170727,10,상영을 하는 곳이 있어야 보든가 하지;;;나쁜 놈들아  
20170727,3,관람객뭔가웃기고 희한합니다  
20170727,6,관람객집에서 무료할때 보기 좋은 영화 ㅎㅎㅎ 결말이 생각보다 좋네요  
20170727,1,이거 개봉한 날에 친구들끼리 보러갔는데 진심 영화 끝나자마자 영화관에 있던 사람들 다 뭐야 이러면서 욕함 ㅎㅎ 애들끼리 나오면서 영화값 날려서 개빡쳤음 ㅎㅎ 참고로 나는 무서운영화 못보는 사람인데도 눈 다뜨고봄  
20170727,6,관람객킬링타임으로 적절한 영화 그 이상도 이하도 아니다  
20170727,9,관람객너무재밌게봤습니다 굿  
20170727,10,관람객ㅎㅎ 의외로 잼씀. 엄마랑 손잡고 잼께 봤어요. ㅎㅎ  
20170727,9,관람객완전 재미있엇요 시간가는줄 몰랏네 ㅎㅎㅎ  
20170727,4,실 관람객임 ㅋㅋ 이거 볼 바에 몇 달 전에 개봉한 7번째 내가 죽던 날 보세요 ㅎㅎ쿠키영상 못 봐서 그런가 리얼 떡밥 줘놓고 안 풀린 것도 좀 있었음 다만 공포영화 초심자정도는 볼만함 수위가 그리 안 높음 딱 그정도임  
20170727,6,ㅋㅋ기대 안하고 보면 볼만합니당 진짜 딱 5~6점짜리 영화에여 ㅇㅇ  
20170726,10,관람객굿 재미있었어요 나에게도 저런상자가 생긴다면 소원빌수있을까  
20170726,7,"관람객그냥 청소년공포영화인데 무섭다기보단 잔인했어요 별로그냥,,,어이가없어요ㅠㅠ  "
20170726,6,무섭지  않은 것 같다. 잔인하고 소리가 커서 깜짝 깜짝 놀람  공짜란 건 없다는 걸 알려준  것 같다.  
20170726,8,관람객시간가는줄 모르고 봤네용|  
20170726,1,스샷만봐도 씹망스멜ㅌ  
20170726,8,관람객재밌게 잘 봤네요.  
20170726,1,응아니야 돌아가~~영화보기전으로 돌아가버려~~!  
20170726,6,관람객그냥 무난함. 딱히 지인들에게 추천하고 싶은 영화는 아님. 공포영화 좋아해서 개봉하면 찾아서 보러다니는데 공포영화 못보는 사람도 볼 정도...공포매니아라면 비추함.그냥 조금 있으면 애나벨이나 장산범 개봉하니까 그 영화나 기대하면서 기다리는게 이득일듯  
20170726,9,호불호가 갈리는거 같은데 댓글알바 아니고 제가 제대로된 평점 남길게요.저도 무서운거 잘보는 편이고 컨저링1이후에 괜찮은 공포영화는 없었다고 생각했는데 이 영화가 최근본 영화중에 제일 재밌고 은근 무섭습니다 앞에 내용이 예상은 가지만 스릴감 있네요  
20170726,10,재밌어요! 막 무섭진 않고 내용이 재밌네요! 보는내내 긴장도 되고 추천해요!  
20170726,1,삼류 소재와 시나리오를 적절히 사용! 불필요한 아시아 소재 사용과 이를 제대로 다루지도 못했고 나름대로 아시아인 바라보는 시각이 어떤지 알 수 있었음. 더불어 시나리오 고삐리가 써도 이것보다 나을 듯  
20170726,3,완전 허접하고 허무하고 노잼이요 집에서 봤으면 중간에 껏을 겁니다스토리 뻔하고 결말도 뻔하고 재미없고 나갈 때 다들 이게 뭐지..이러고 나갔어요이거말고 다른거 보세요 그냥 정말 킬링타임용입니다.  
20170726,8,그런대로 볼만했음ㅎㅎ  
20170725,6,시간 때우기 용이에요. 그리고 스토리 예상가능함.  
20170725,8,재밌었음 베드엔딩이라 더 재밌었네여 ㅋㅋ  
20170725,10,이 영화 엔딩이 깔끔하다고 한 자칭 평론가들은 다 쓰레기놈들이다. 지들이 허무해서 남들도 겪어보란 식으로 평점을 남긴 게 분명하다. 그러는 나도 평점 10점을 갈겨놓고 있다.  
20170725,10,기홍이 보는맛에 봤다고 하는 애들 전부 다 뚝배기 깨버려야한다.  
20170725,9,그러니까 결국엔 무언가에 힘을 빌리지말고 나 스스로 살아가라 뭐 그런 뜻 아닐까?  
20170725,8,누구나 한번쯤 생각해봤을듯한 소원들 그리고 그 소원에 따르는 댓가...음 생각보다 많이 무섭지않았어요 너무 긴장안하셔도될듯 ㅎ  
20170725,7,"워낙 공포 마니아라 기대 1없이 그날의 심야영화로 볼만 단, 여주 정신 못차리고 멜로디상자에 무분별하게 소원 빌때부터 암유발 올라오면서 몰입도급감.. 제작진 감독빨 광고라 치기엔 컨져링 못견주는 부족한영화, 데스티네이션 오버랩 정도. 단,남주의매력  "
20170725,6,오늘 조조로 봤는데  극장안에 아무도 없이 혼자서 봤는데 조금은 무서웠음.  
20170725,10,관람객공포영화라기엔 무섭지는 않지만 이기홍때문에 봤는데 스토리도 꽤 괜찮음ㅋ  
20170725,9,관람객고2여자인데 저는 재밌었습니다 소리가 너무 무서워서 힘들었어요 그리고 정말 무섭게 죽더군요 무섭고 재밌었습니다 추천하지만 각자 무서움의 정도가 다르게 느껴질 수 있으니 알아서 보세요 그래도 추천합니다 사실 좀 아무말 대잔치같아요 아무튼 보세요  
20170725,10,"공포영화치곤 그렇게 공포스럽지않고, 스토리가 소름돋게 전개되서더좋은거같다. 죽는게 특히 신기하게 죽어서 소름돋았음...  "
20170725,7,관람객그냥저냥 볼만해요. 킬링용  
20170725,1,이거 영화아님ㅋㅋ 주인공 설정이며 스토리 하나같이 쓰레기  
20170725,3,영화가쓰렉이네요ㅎ  
20170725,8,뻔하지만 볼만한영화너무 무섭거나 잔인하지않아서 좋았다  
20170725,8,컨저링과 비교하기엔 그렇지만 충분히 15세 관람가로서는 최선을 다한영화였습니다. 마지막에 점점붕괴되는 여주연기도 꽤 훌륭했구요. 개봉한지 일주일도 안되서 조조로 8시아니면 오후11시에만 시간표를 잡아놓을정도의 영화는 아니라 안타깝네요ㅠ  
20170725,1,영화 리얼 보고나서 다음영화로 이거봤다 18000원 날리는중이다  
20170725,8,"외국 영화 자막에 ""이거 실화냐?"" 라는 자막 떳을때 데드풀 번역가가 생각났었는데 맞았다 그리고 여주랑 남주 13살 차이 실화냐?  "
20170725,10,팝콘은 잘 들어가구요 ㅋㅋ 정말 처음부터 끝까지 예상되는 뻔한 스토리이구요. 내용도 정확하게 제가 꿰뚫더라구요 ㅋㅋ 뻔하지만 신선한 소재로 ㄹㅇ 브금 캐리 했습니다. 진짜 재밌어요 ㅋㅋ 집 가는 길에 친구랑 영화 얘기 엄청했어요..  
20170725,1,공포영화를 보다가 졸립긴 처음이네요  
20170725,4,관람객너무 뻔한? 식상했네요  
20170725,2,공포영화를 못보는편인데요... 이영화는 정말추천드리고싶지 않습니다. 이영화를 정보고싶으시다면 메인광고를 보시면 다본것입니다ㅜㅜ 악령이 나와 깜짝깜짝 놀래킬줄 알았는데 전혀 없더라구요ㅎㅎ 그냥 비추입니다 47m가 더무서운듯해요 ...  
20170724,1,"리얼 아무말대잔치에 개연성없이 분위기조성차 천둥번개 치는거 너무티나고, 수도꼭지랑 음식물처리기뭐라할말없고 이건뭐..이기홍은 몇장면 나오지도않고,,대사는또 왜 그런지..여자주인공은 발암물질1호,쿠키영상도 발암물질2호. 특가로 표사서봤는데 정가였으면울었다  "
20170724,7,"관람객글 쎄요, 소원상자라는 설정은 흥미를  끌기에 충분했으나 끝이 너무 뻔하달까요 ,,, 저는 결말이 너무너무 아쉬워서 ㅜㅜㅜㅜ  전체적으로 좀 별로였어요  "
20170724,2,나무 뻔한 결말과 스토리. 파이널 데스티네이션과 어설픈 틴에이지 영화의 잘못된 만남.  
20170724,4,관람객재미는 없는거같아ㅋㅋ  
20170724,10,전설의 호러+스릴러+고어=데스티네이션 1편의 귀환입니다!!!  
20170724,1," 댓글알바에 낚이는 거 오랜만이다 돈,시간 버리려면 추천! ㅎㅎ 기대 안하고 봐도 재미없음! 여주가 초딩바보임. 각본은 무섭다 무서워 무서워!인가 그 책보다 수준이 낮고 반전..은 있음 끝까지 재미가 없다는게 반전임.  "
20170724,1,시간도 돈도 아까움 덩캐르트인가 그거보셈  
20170724,6,쉽게 얻을 수 있는 행복은 달콤하지만 그 휴혹에 빠져 나오기란 너무 힘들고 댓가가 따른다.   달콤한 유혹의 행복 대신 의미 있는 하루하루를 살아 가야 하지 않을까..!!  
20170724,6,관람객공포영화치고 전혀 무섭지않았음. 공포가아니라 약간 스릴러물..?미스테리물이 적합한듯;  
20170724,9,여주 배우는 겁나 칭찬하고 싶다 연기력이 오졌는데 캐릭터 자체는 진짜 죽여버리고 싶더라 암걸림  
20170724,1,진심으로 귀신하나도 안나오는 노잼 컨저링같이 무서운거 기대하고가면 클남 그냥 영화임 커플가는사람둘 막 여자친구 꺄악꺄악 머이런거기대하지마삼  
20170724,6,솔찍한 평점으로6점드림....내용 전개는 괜찮은데....죽는방법이 좀 허무하고 긴장감이 조금 부족했다는점....  
20170724,1,주인공 뇬 답답해 미치겟네 ㅜㅋ 암걸리고 싶으면 보셈 ㅋㅋㅋ  
20170724,9,결말이좀 허무...? 라해야하나 이런느낌은좀있지만전체적으로 스토리도 괜찮고 다괜찮았는데ㅎㅎ  
20170724,1,쓰레기 좆노잼영화쿠키영상까지 쓰레기야  
20170724,1,1점도 아깝다 진지하게 평점 안쓰는데 처ㅡ음쓴다.돈 개아까움  
20170724,9,"공포영화 좀 꺼리는 편인데 이건 괜찮네요,  "
20170724,8,이기홍 존멋ㅠㅠ앞으로 자주봤으면 좋겟음!!  
20170724,10,배우들 다 매력만점ㅎㅎ 이기홍 왠지 막 자랑스러워요 ㅎㅎ  
20170724,9,소재도 신선하고 꽤 재밌는데요?! 약간 하이틴 무비 삘도 나서 신선헀습니다  
20170724,10,주변 사람의 목숨이 위협받는걸 알면서도 뮤직박스에 집착하는 사람들.. 대체 인간의 욕심의 끝은 어디까지일까..  
20170724,2,진짜 최악임 뻔한스토리에 지루하고 무섭지도 않음돈낭비 시간낭비역시 알바는 존재하는듯 ㅋㅋ속지마세요  
20170724,7,귀신이 나오는 줄 알았는데 안나와서 좀 아쉬운 건 있지만..그런대로 짧은 시간 동안 보기 괜찮았습니다. 컨저링 급 영화는 아닌 것 같고.. 여주를 지금 찾아보니까 컨저링 때 나왔던 아이였네요.ㅎㅎ 감독님과 좋은 인연으로 또다시 작품을 같이 했나봅니다!  
20170724,7,관람객별로안무섭습니다ㅣㅣ  
20170724,7,그럭저럭 괜찮음. 베헤리트 생각납니다.  
20170724,10,특히 나같은 10대들이 좋아할만한 영화!!!! 킬링타임용으로도 딱이다!!!  
20170724,3,졸작 틴에이저 호러 환타지 영화가 또 하나 나왔군요. 극장에서 보기엔 너무 시간이 아까웠네요. 여주인공이 이하이 닮았더군요.;;;  
20170724,1,노무노무  염병을 해요 ..  
20170724,1,이 영화에서 제일 흥미진진하고 재밌던 장면=뺨때리기  
20170724,9,관람객먼가 허무..?그치만 잼!  
20170724,1,와 영화보고 평점 당연히 5점대 예상하고 왔는데 이딴 영화가 평점 8? 진짜 뻔한 스토리에 여주는 암걸려 미치겠고 나중에는 어떻게 또 황당하게 죽으려나 기대하면서 영화를 봤네. 개인적으로 역대급 쓰래기 영화 딱 평론가말이 맞는듯 B급 코미디  
20170723,10,이기홍 땜시 본건데 재밋네 ㅋㅋ  
20170723,10,오르골 음악도 은근 매력적이었고 배우들 연기도 좋습니다~~ 은근 긴장감 있넴  
20170723,9,영화가 주는 메시지도 좋고 시간가는줄 모르고 볼 수 있는 영화였습니다  
20170723,9,내가 워낙에 쫄보라 그런가;; 진심 잼나게 봤네요  
20170723,1,댓글알바에 제발 낚이지마세요돈버리는 지름길입니다진짜 최악의 영화에 손꼽을정도  
20170723,10,관람객배우 연기도 좋고 사운드 및 연출 그리고 분위기까지 전부 만점이였습니다. 이번 여름 최고의 호러영화! 꼭 애인이나 부모님 손 꼭잡고 보시는걸 추천드립니다! 시간이 순식간에 식은땀과 사라질겁니다!  
20170723,8,뻔한 공포영화들과는 달라서 좋네요  
20170723,9,적당히 긴장감도 넘치고 괜찮은 영화였어요  
20170723,7,킬링타임용으로 그럭저럭. 죽을듯말듯하는장면은 쫄깃쫄깃하고 좋았다.  
20170723,10,막 잔인하거나 징그러운 공포영화가 아닌데도 은근히 사람 피말리게 하더군요  
20170723,9,음악소리 나올때마다 놀라게 되요  
20170723,8,진짜 긴장감 넘치게 잘만들었다  
20170723,9,"긴장감과 스릴 가운데, 이기홍의 연기가 좋았어요  "
20170723,10,이기홍 이번에도 훈내 진동 ㅋㅋ 헐리웃에서 인정받는 한국배우라 더 호감!! 흥하길!!  
20170723,10,세상에 공짜는 없다는걸 또 한번 깨닫게 하네요  
20170723,8,역시 사람은 하지말라면더하는듯..  
20170723,8,뮤직박스가 소원 들어줄때마다 내가 다 소름돋더라-_-  
20170723,10,재미없다는 평도 좀 있던데 난 엄청 재미있게 봄 ㅋㅋㅋㅋ  
20170723,9,올해 손에 꼽을만한 공포영화  
20170723,9,혼자 영화보러가는거 좋아해서 혼자봤는데 괜히 혼자본 기분 ㅜㅜ…  
20170723,9,식상한 공포가 아닌 업그레이드된 공포임 이건 진짜 추천이다  
20170723,2,진짜 여주가 너무답답하고 지루하기만 햇어요  
20170723,5,공포라하기엔 좀 애매한? 볼만은 하더라  
20170723,9,지루함이 보일 틈이없다 상영내내 알차게 보여줌 꿀잼이양  
20170723,8,기대이상이였고 이기홍연기도 기대이상이였다 캬캬  
20170723,10,꼭보세요. 색소폰 장면을 잊을수가 없네여. 세금 잘내자는 교훈도 얻는 올해 최고의 영화  
20170723,8,내가생각했던 장르랑 비슷해서 좋았다  
20170723,2,평식이 행님의 18자 마치 OO스러운 평론가 평이 딱 맞을듯. 평식이 행님이 곰팡내라 했으니 노잼 예상.  
20170723,9,마지막 쿠키영상있는데 맘에 들었음 이기홍 분량많아서 더좋았어 ㅠㅠ  
20170723,9,어린나이 사람들이 공감하면서 보게될것같은 느낌이다  
20170723,8,보는 내내 긴장감 안놓쳤다 손으로 가리는 영화가 아님  
20170723,10,이기홍 팬이라면 보는것도 좋을듯 무엇보다 스토리가 탄탄하다  
20170723,9,다들 연기도 소름돋게 잘하면서 내 온몸에도 소름..  
20170723,9,예상했던것보다는 덜무서웠고 무서움보단 스토리가 일리있고 굿임  
20170723,10,일반 뻔한 공포영화보다는 백배 천배는 낫다 진심  
20170723,3,그냥노잼이에요. . . .그닥. . .  
20170723,10,지금 평점보단 훨 재밌는 수준이고 공포감도 딱 적당하다  
20170723,9,잔인한거야 있지만 엄청 공포는 아니였음. 그래도 딱 스토리 있어서 좋았던거같음. 놀래키는것도 없고! 보다보면 시간 빨리감..  
20170723,8,생각보다 재미지고 이기홍이 너무귀여웠다 ㅎ><ㅎ  
20170723,9,사람의 욕심은 끝이없다.. 깔끔하게 잘 만든 영화  
20170723,9,결말..예상치못했는데 아쉽고 허무한감이있지만 너무 재밌게 봄  
20170723,9,몰입도가 높아지니까 90분이 개짧게 느껴졋다  
20170723,9,심리랑 스토리의 조화가 무서움+긴장감을 잘드러낸듯  
20170723,10,심리적인 공포.. 데스티네이션 재밌게 본사람들은 꼭 보세요  
20170723,9,스토리구성이나 설정 자체가 신선하네요  
20170723,8,기홍이.. 너무좋다 결혼한줄도 모르고 넘나 좋아했네 ㅋㅋㅋ  
20170723,9,앞으로의 일을 알것같으면서도 긴장감이랑 몰입은 최고조  
20170723,8,너무 무섭지도 않으면서 적절한 스릴러가 맘에 듭니다  
20170723,8,이기홍나와서 뭔가 되게 뿌듯하면서 자랑스러웠다 ㅎㅎ  
20170723,9,새로운 장르같은데 스토리가 매력터짐!!  
20170723,9,뮤직박스볼때마다 가슴이 찌릿ㅋㅋ 이런비슷한 영화 또나오길  
20170723,9,희대 명작 진짜 에나벨을 뛰어넘어선 수준 엄지척이다  
20170723,9,긴장감폭발이다.. 욕망뒤엔 대가가 달려있다는것을...  
20170723,8,내용은 뻔한것같아도 교훈이나 메신저주는 영화 이런게 좋드라 나는  
20170723,10,사람들의 행동으로 이어지는 공포감.. 진짜 시간가는줄모르고 좀  
20170723,10,보는내내짜증이 어휴 보면서 여주걍죽길바란영화는첨이네 ㅡㅡ  
20170723,1,와 최소1점이라서 1점줌 0점이없어서아쉽네  
20170723,2,이기홍때문에 별하나 줬다 진짜 공포영화로써 노잼  
20170723,10,반전 오져요 !!!! 생각지도 못한 결말????  
20170723,1,무서운 부분이 어딨냐?  
20170723,1,시간 많고 돈 많고 재미없는 거 좋아하면  보기 좋을 듯  
20170723,10,너무 재밋어요  다시또보싶어요  
20170723,1,알바에 속지마라 공포매니아다 30년살면서 더보이드이후 최악의 공포영화다  
20170723,10,젊은애들한테 인기많을듯 젊은나이에 오고가는 스토리랄까 굿  
20170723,8,덩케르크보단 재밋엇다.귀신 나오는거 아니고 데스티네이션 느낌이긴한데약간 b급 영화정도 라고 생각하고 기대안하고 보면 재밌을듯 .민호우 흥해라!  
20170723,8,전개가 빠르면서 유연한 공포물이라 지루하지 않았어요  
20170723,10,미친듯이 놀래키고 무서운건아니고 살짝잔인하지만 스토리구성을 잘만들었다고 본다  
20170723,10,호불호좀 갈릴거같은데 나는 이런 호러물 좋아해서 재밌게봄~  
20170723,10,긴장하면서 진짜 재밌게 잘봤다 ㅠㅠ  
20170723,9,결과는 뻔한거같았지만 중간에 스토리라던지 연기도 다 퍼펙트 했습니다  
20170723,10,친동생이 겁많은데 이거는 안가리고 잘보드라구요 ㅋㅋ  
20170723,10,볼만하고 느낌있는 공포 고급진 공포  
20170723,8,이기홍 많이 나와줘서 행복했음ㅋㅋㅋ 사랑해여  
20170723,10,데스티네이션의 색다른 시리즈를 보는듯한 느낌 넘나 재밋어용  
20170723,10,세상에 공짜없고 모든 것엔 대가를 치른다..  
20170723,9,배우들 호흡도 좋고 이기홍 너무좋다..연기도 좋고 연출 스토리 다좋아요  
20170723,10,귀신나오는것보다 이렇게 소름돋고 온몸이 찌릿해지는 영화는 이거지~  
20170723,10,이런 날씨엔 극장에서 요런공포영화보면서 팝콘먹어줘야함  
20170723,10,평범한 일반적인 공포가 아니여서 더볼만했어요 추천합니다  
20170723,10,공포보다는 인생의 교훈이 느껴진다랄까 스토리가 맘에 들었음  
20170723,10,반전있네 ㅋㅋ 무튼 데스티네이션이랑 비스무리한데 더재밌당  
20170723,1,진심 공포광인데 이렇게 재미없는것도 처음이네요수입되면서 편집을 했는지 죽는 장면도 뭐랄까..죽다가 만?? 그런 느낌이고스토리 개연성도 없고...그래도 애나벨 꼬맹이가 이렇게 훌륭하게 커서 1점 줍니다  
20170723,10,영화가 주는 메시지도 있고 교훈이 돋보이는 신선한 공포영화  
20170723,10,눈을 뗄수 없을정도로 몰입이 장난아니였어요  
20170723,4,돈이아깝다 ㅋ 결말도 허무하구... 뭔내용인지 전혀 모르겟다...  
20170723,9,진짜 간만에 몰입하면서 재밌게 봤다 연기가 다들 짱  
20170723,8,이기홍이 너무 귀엽게 나와서 무서운영화 잠시 잊음 ^^  
20170723,10,빅스케일이 아니지만 엄청나게 집중시키고 긴장시키게 만든다. 놀란 천재!  
20170723,10,시원하게 더위날리고 싶다면 이영화가 굿초이스~  
20170723,10,딱히 엄청 무섭고 그런거 없고 라이트하게 보기 좋음  
20170723,8,사람들 심리를 잘 헤아려 만든것같아요  
20170723,10,뮤직박스 그게 뭐라고.. 안타깝다 그래도 재밌게 봄  
20170723,10,배우들 연기도 좋고 여주괴롭히는애 개이쁨..  
20170723,10,가볍게 호러 즐기기 좋은 영화?  
20170723,10,되게 막 무섭지도 않고 적절한재미가 더해져서 좋았습니다  
20170723,10,사람들 한명씩 죽어나갈때마가 개소름이지만 결론은 재밌었다  
20170723,10,이기홍 올만에 스크린으로 봐서 완전 재밌게 봄 ㅠㅠ 앞으로 자주좀 나와줬음 좋겠다  
20170723,10,시간가는줄모르고 봤다 간만에 재밌는 공포영화 본듯  
20170723,10,이기홍 졸귀.. 내스타일ㅠㅠ 돈안아까움  
20170723,10,조금 아쉬움이 남지만 무난하게 잘 봤어요  
20170723,10,무서운거 잘 못보는 사람도 즐길수 있을듯  
20170723,10,웃긴것도 있으면서 공포가 더해지니 색다른 느낌이 듭니다  
20170723,10,소소하게 볼만하고 무서운것도 적당하니 추천합니다  
20170723,8,무섭지만 않고 스토리 전개도 있고 재밌어서 굿  
20170723,10,긴장감이랑 스릴이 넘치는 와중에 이기홍 연기가 너무 돋보임 ㅠㅠ  
20170723,9,이런 무더위속에선 이 영화가 딱이다  
20170723,10,킬링타임으로 보면 딱 일듯 괜찮게 봤어요!  
20170723,9,아진짜 데스티네이션 보는거같았어 것보다 더 스릴도 쩔었음  
20170723,8,징그럽긴했지만 스토리가 탄탄해서 재밌었다  
20170723,9,좀색다른 느낌? 공포여도 신선한 느낌이 팍 옴  
20170723,10,나는 개꿀잼이였는데 스릴대박이야  
20170723,9,평점보다는 훨 낫고 감독이 세부적으로 신경써서 잘만든듯  
20170723,10,생각보다는 재밌게 잘봤고 스토리도 좋았어요  
20170723,9,메이즈러너때 기홍오빠 매력에 빠졌었는데..이번에도 기대를 저버리지않았다 ^^  
20170723,10,중간중간 웃기면서 긴장감도 유발하고 내스타일이야  
20170723,9,꿀잼!! 보면서 나도모르게 헙헙 하는 부분이 만아뜸 ㅋㅋ 8점 이상은 충분히 받을만함 ㅋㅋ  
20170723,10,예고편 이상으로 무섭더라.. 올해 나온 몇 개 안되는 공포영화지만 그래도 그중에서 제일 괜찮았음  
20170723,7,가볍게보기 좋은 영화.  
20170723,10,나라면 소원 알차게 5개 다 빌고 마지막에 저 포함해서 이세상 모든 사람들에게 이물건이 안보이게 해주세요 라고 소원빈다  
20170723,8,재밌음 ㅇㅇ 볼만함 ㅇㅇ 그냥 틴에이져물임  
20170723,7,지루하지않앗던영화 정말많이무섭진않은데 2번째앞줄여자가 거품물고 쓰러지셧음..ㅠㅠ공포영화보고 쓰러지는사람이잇긴하더라구요 소리에 나두 깜짝깜짝놀랏엉  
20170723,1,리얼보다 재미없다...  
20170723,2,개노잼 희대의 돈OO 살다가 이렇게 뻔한 영화 처음 봄  
20170723,6,잔잔한 분위기로 공포를 이끄는 연출은 굿!세상에 공짜는 없다는 걸 다시 알게 해 준 영화  
20170723,10,관람객가나다라마바사아자차  
20170723,10,널 이길 방법을 찾았어 내 소원은 이 영화 보기 전으로 되돌아 가는거야  
20170723,9,관람객기대안하고 봤는데 재밌어용! 나름교훈도있고 볼만합니당  
20170723,10,영화 적당하게 무서워서 공포영화 못보는 제가 조금 즐기며 볼수 있어서 좋았습니다. 개봉전부터 평점너무 안좋아서 기대안하고 갔었는데 정말 재밋게 보고왔네요.하지만 팝콘을 던질까봐 사가지는 못했습니다...ㅎ  
20170723,3,킬링타임용 영화ㅋㅡㅅㅡ  
