0,1,2
20170723,3,댓글들 도대체 스토리가 뭐가 좋다는거야.. 뭔가 복선 나올때마다 그게 뭘로 이어질지 뭔 반전으로 나올지 다 예상가서 재미없더라. 친구랑 봣는데 내가 스토리 예측다해서 둘다 노잼으로봄ㅋ  
20170723,5,넘나 내용뻔하고 유치하네요 틴에이지스릴러라고 누가했던데 주인공생각수준과 내용이 네..딱 틴에이지..사람죽는부분에 긴장되고 조금무섭긴하나..공포영화좋아하시는분들은 화날수준..공포영화 싫어하시고 못보시는분들 나도 이런거한번!하고 도전하기는좋을듯합니다..  
20170723,10,이건 무조건 봐야합니다. 정말  최고로 재밌었던 영화. 무서우니깐 최대한 여럿이서 가세요  
20170723,6,돈 이까웠어요ㅠㅠ 잔인한건지 모르고 봤는데 엔딩도 뭔지 모르겠고... 근데 심장쪼이는 맛은 있어요  
20170722,10,진짜꿀잼이에요 강추합니다  
20170722,4,파이널데스티네이션 초등학생 용  
20170722,8,이야밤에 뭐라도 봐야해서 공포영화가 이거하나라 아무것도 모르고 처음보는 제목이지만 그냥 봤음 아무기대없고 아무내용도 모르고 무작정 본거치곤 나름 볼만했음 초반은 지루할수 있어용  
20170722,1,발연기 으웩 다신 보기 싫어 거지 같아  
20170722,7,적당히 재미있고 적당히 무섭지만 둘 다 약간 어딘가 부족한 편. 스토리 전개는 참 마음에 드는데 마지막 엔딩이 마음에 안 들어서 감점. 그래도 발상은 좋았던 영화.  
20170722,5,정확한 평점 너무 뻔하고 주인공인 여자 발.암이다 그렇게 추천하고 싶지는 않네  
20170722,8,공포영화라기보단 공포드라마??별로인듯 나쁘진않음 .. 컨저링정도  
20170722,6,골룸이 떠올르는건 왜일까?  
20170722,9,데이트 무비로 괜찮은데요 ㅋㅋ  
20170722,9,예상을 벗어나는 짜릿함이 있어요 ㅋ  
20170722,9,와 초반부터 썩어죽는거 너무 쎈거아냐?ㅠ  
20170722,10,"생각보다 재밌더라구요, 자연스러운 배우들의 연기도 좋았고 오랜만에 만족스러운 스릴러였습니다.  "
20170722,9,보는 내내 스릴만점ㅋㅋ지루할 틈이 없다  
20170722,10,잠시나마 더위를 잊게 해준 영화..  
20170722,9,"세상에 공짜는 없는법, 무엇이든 대가가 따르는것 같다  "
20170722,10,결말이 예상되기는 하는데 그 과정까지가 흥미진진함  
20170722,9,역시 여름에는 이런 영화가 와따죠 ㅋ  
20170722,9,한국 배우가 헐리웃 영화에 나오는게 자랑스럽다 ㅎㅎ  
20170722,8,"과하지 않은 공포영화, 적당한 공포?  "
20170722,10,사람이 하나하나 죽어갈때마다 내 심장도 죽어가는듯ㅠ  
20170722,9,잔인한 장면들도 꽤 있고 스릴 넘치는데여 ㅋㅋ  
20170722,9,"스토리도 나름 괜찮고, 주인공들이 어려서 하이틴 무비 보는 기분도 들음  "
20170722,10,은근 무서운데요? 저런 뮤직박스 있으면 나도 소원 빌거같음..  
20170722,8,그냥 가볍게 즐기기 좋은 공포영화  
20170722,9,이기홍 나올때 괜히 반갑ㅋㅋㅋ 재밋네요 ㅋㅋ  
20170722,10,사실 별로일거라고 생각했는데 아니어서 놀란 영화임. 은근 사람 쫄리게 하는 맛도 있고 마지막까지 긴장하고 보게함 ㅋㅋ  
20170722,10,배우들 다 매력만점ㅎㅎ 이기홍 왠지 막 자랑스러워요 ㅎㅎ  
20170722,10,질질 끌지 않아서 좋앗다~ 가볍게 보기 좋은 스릴러 공포  
20170722,9,간만에 긴장하고 본 영화였어요  
20170722,10,오랜만에 보는 스타일인데요?ㅎㅎ 이기홍배우 나올때마다 괜히 막 좋네요 ㅎㅎ  
20170722,10,다들 연기 잘하고 스토리도 은근 좋음  
20170722,10,너무 욕심부리지 말아야겠다는 생각을함  
20170722,8,극장에 사람이 없어서 더 무서웠음  
20170722,10,흥미진진 :) 배우들 보는 재미도 쏠쏠하구 마지막 쿠키영상도 맘에들어요!  
20170722,9,다들 연기도 잘하고 괜춘 ㅋ  
20170722,10,간만에 긴장하고 본 영화였어요  
20170722,10,"""공짜로 얻은 부,명예는 반드시 댓가가 따른다""라는것을 알게 해준 영화  "
20170722,10,뮤직박스에서 나오는 노래소리는 진짜 섬뜩했다.. 아직도 계속 귀에서 멤도는 느낌  
20170722,10,예상치 못한 결말이지만 뭐 나름 재밌게 볼만했당 ㅎㅎ  
20170722,9,예상햇던 것 보다 더 짜릿하고 흥미로워습니다  
20170722,10,이기홍 나와서 바로 보고왔는데 진짜 연기하며 비주얼하며 ㅠㅠ 좋다..  
20170722,10,역시 공포영화는 야밤에 봐야제맛 ㅎ  
20170722,10,꽤나 재밋는데요? 한국인 배우가 나와서 신기했네요  
20170722,9,갠적으로 잼나게 봄요~ 90분이 훅 지나감.. 내가 진짜 원했던 호러영화였다.  
20170722,9,심장 쫄깃!! 짱짱!! 맘에드는 영화  
20170722,10,반전 대박 ㅋㅋ레알 겁나놀람ㅋㅋ  
20170722,9,밤에 보니까 더 재밋는데요 ㅎㅎ  
20170722,2,관람객이점도아까움....정말로 ㅜㅜㅜ  
20170722,7,여주의 암걸릴듯한 찌질한 행동과 스토리의 뻔한전개에도 불구하고 재미는 있었다  
20170722,10,제가 무서운 영화를 잘 못보는데 이건 정말 긴장감 있기 잘 본거 같아요 :) 다 필요없고 이기홍 짱 ㅠㅠㅠ 너무 귀여워 ㅠㅠㅠ  
20170722,1,짜증나요 돈 아까워요 알바 때문에 높아요 진짜 짜증나요 보지마요  
20170722,9,솔직한영화평: 무서운거 기대하는분들은 실망할지도몰라요. 진짜 무서운 장면 하나도없고 심장만 쫄리는데 스토리좋고 신박하고 약간하이틴영화느낌나요 갠적으로 전 재밌게봤는데 남친은 별로라고하네요..호불호가 많이갈릴듯 결론: 무섭진않은데 스토리는 재밌음  
20170722,1,평점 너무 높게잡혀있음 이기홍이기홍댓글이랑여자평점이 80%가넘네.. 7점생각하시고 보면됩니다.  
20170722,2,당위성이 부족해 몰입이안되고 광고 영상이 다임.내용이 뻔한것도 뻔한건데 여주인공의 철없고 생각없는 행동이 이해할수있는 선을 넘어섬.. 보면서 스트레스받음. 놀래키는것 말고는 무서운게 없는데 놀래키는것도 몇장면 없음  
20170722,10,걔랑 보니까 좋더라..괜찮은 영화다.  
20170722,1,광고시간에 나오는 애나벨2예거폄이 더무서웠다  
20170722,9,솔직히 쫌 뻔하긴 해도 몰입하게 되더라 ㅋㅋ  
20170722,10,스토리있는 영화가 더 맘에 들어여~~  
20170722,10,"공포영화 좀 꺼리는 편인데 이건 괜찮네요,  "
20170722,9,여름에 보기 딱 좋네요ㅋㅋ  
20170722,9,이기홍 존멋ㅠㅠ앞으로 자주봤으면 좋겟음!!  
20170722,10,엄청 무섭다기 보다는 계속 소름돋는 기분? 닭살 돋아서 혼낫네 ㅋㅋ  
20170722,8,사람들이 소원을 하나하나 빌때마다 그 다음 희생자를 기다리고 있는 나를 발견..  
20170722,10,인간의 욕심은 끝이 없는 것 같다  
20170722,10,그럭저럭 볼만한 공포영화  
20170722,9,소재도 신선하고 꽤 재밌는데요?! 약간 하이틴 무비 삘도 나서 신선헀습니다  
20170722,10,눈을 뗄 수 없게 하는 긴장감!  
20170722,10,존잼 ㅋㅋ 꼭극장에서 보시길  
20170722,8,주변 사람의 목숨이 위협받는걸 알면서도 뮤직박스에 집착하는 사람들.. 대체 인간의 욕심의 끝은 어디까지일까..  
20170722,1,씹노잼 진짜 오천원이 아깝다ㅅㅂ 결말반전이라더니 다 개소리였어ㅋㅋ영화 무서운거 없고 걍 잔인하기만 함.캬~진짜 최악의 영화닼ㅋㅋ  
20170722,1,결말 ㄹㅇ 극혐  진짜 내 돈 아깝네 저 상자한테 소원빌고싶네 이 영화 보기전으로 돌아가게 해달라고ㅅㅂ  
20170722,10,이기홍 땜시 본건데 재밋네 ㅋㅋ  
20170722,10,오르골 음악도 은근 매력적이었고 배우들 연기도 좋습니다~~ 은근 긴장감 넘쳐서 눈을 뗄 수가 없었네요  
20170722,10,영화가 주는 메시지도 좋고 시간가는줄 모르고 볼 수 있는 영화였습니다  
20170722,10,내가 워낙에 쫄보라 그런가;; 진심 지렷당..  
20170722,8,뻔한 공포영화들과는 달라서 좋네요  
20170722,1,진짜 재미없어요..공포영화 좋아하는 사람들이 보면 실망할지도...  
20170722,9,적당히 긴장감도 넘치고 괜찮은 영화였어요  
20170722,10,막 잔인하거나 징그러운 공포영화가 아닌데도 은근히 사람 피말리게 하더군요  
20170722,10,음악소리 나올때마다 놀라게 되요  
20170722,8,진짜 긴장감 넘치게 잘만들었다  
20170722,9,사람이 하나하나 죽어갈때마다 내 심장도 죽어가는듯ㅠ  
20170722,10,이기홍 이번에도 훈내 진동 ㅋㅋ 헐리웃에서 인정받는 한국배우라 더 호감!! 흥하길!!  
20170722,10,세상에 공짜는 없다는걸 또 한번 깨닫게 하네요  
20170722,10,역시 사람은 하지말라면더하는듯..  
20170722,10,뮤직박스가 소원 들어줄때마다 내가 다 소름돋더라-_-  
20170722,8,상영관이 별로 없어서 힘들게 봤네요ㅠㅠ 극장에 사람이 없어서 그런가 더 무섭게 느껴졌어요  
20170722,9,내 인생에 손에 꼽을만한 공포영화  
20170722,8,혼자 영화보러가는거 좋아해서 혼자봤는데 괜히 혼자본 기분 ㅜㅜ…  
20170722,10,흥미진진 :) 배우들 보는 재미도 쏠쏠하구 마지막 쿠키영상도 맘에들어요!  
20170722,5,영화 내용보다 2017년 7월 20 일날 인천 롯데시네마 12시5분 영화 보신 분들 혹시 아실꺼예요. 영화 보는 내내 떠들고 웃고 조용히 해요 아줌마라 했더니 아줌마 아냐 사장이야 하며 쌍욕을 하신 그  아줌마 땜시 영화 망쳤어요. ^^  
20170722,10,다들 연기도 잘하고 괜춘 ㅋ  
20170722,10,올해 본 영화중에 가장 스릴넘쳤음  
20170722,10,뮤직박스에서 나오는 노래소리는 진짜 섬뜩했다.. 아직도 계속 귀에서 멤도는 느낌  
20170722,10,꿀잼 ㅜㅜ 보는 내내 긴장을 놓을 수 없었다  
20170722,10,예상햇던 것 보다 더 짜릿하고 흥미로워습니다  
20170722,9,나름 더위 식히기엔 괜찮음  
20170722,10,역시 공포영화는 야밤에 봐야제맛 ㅎ  
20170722,10,꽤나 재밋는데요? 한국인 배우가 나와서 신기했네요  
20170722,10,솔직히 나라도 소원 들어준다면 한번 해볼듯..  
20170722,10,절대 보지마시길 바랍니다 . 공포영화 매니아로 9년동안 안본 영화가 없는데.... 정말 재미없습니다... 개봉과 동시에 봤는데 스토리 개연성도 없고 작품 연출 실력도 현저히 떨어지는 C급영화 질문받습니다  
20170722,10,심장 쫄깃!! 짱짱!! 맘에드는 영화  
20170722,1,이거 영화관에서 볼바에  데스티네이션 집에서 봐라  이건 공포영화도 아니고 죽는방식도 엄청 허접함  
20170722,10,눈에 익은배우들도 많이 나오고 은근 재밋어요 하이틴 스릴러?  
20170722,10,반전 대박 ㅋㅋ레알 겁나놀람ㅋㅋ  
20170722,10,밤에 보니까 더 재밋는데요 ㅎㅎ  
20170722,9,90분의 러닝 타임도 적당하니 마음에 들고 흥미진진했습니다  
20170722,8,긴장감 쩔..ㅠ_ㅠ 올만에 몰입해서 봤다  
20170722,10,대가를 치르지 않는 소원은 없다  
20170722,10,데스티네이션 시리즈 진짜 좋아했는데 요즘 뜸해서 서운했거든요 ㅎㅎ 근데 위시어폰이 그 빈자리를 채워준듯! 둘이 비슷하면서 재밌어요 ㅎ  
20170722,7,참신하고 재미나네요^^ 싱크대 신에서 스릴감 완전 짱!!  
20170722,6,보고왔는데 그냥 볼만했어요 ㅎㅎㅎ 공폰데 데스티네이션같기도 하고 ㅎㅎ 러닝타임이 짧아서 아쉬웠어요  
20170722,9,저도오늘봤어요개인적으로이기홍너무멋있구요조이킹도완전좋아욧엔딩크레딧과마지막반전도기대할만해요^^  
20170722,4,댓글 알바인가?? 무서운 거 좋아하면 보지 마세요! 무섭지도 않고 잔인한 장면도 다 자체검열했구요. 스토리는 너무 뻔하디뻔함 ㅋㅋ 다 예측가능 ㅋㅋ 그리고 초중반부 한명씩 죽는게 너무 지루함의 연속...  
20170722,2,실망스러움 공포 영화가 아니고 그냥 하이틴+뻔한 죽음  
20170722,1,내가 이런영화를 왜 돈주고 봤을까....  후회중임  
20170722,10,안보면 후회함 끝내줌 진짜 재미남  
20170722,10,방금 심야영화로보고왔는데 진짜재밌음 무서운거못보는사람도ㄲ 그렇다고시시하다는게아니라 내용이몰입감도쩔고 공감되는것도많고 걍보샘 존잼아또보고싶다 참고로 귀신이나 유령은 1도안나왔음 마지막쿠키영상꼭보삼!!  
20170722,10,긴장감 쩔..ㅠ_ㅠ 올만에 몰입해서 봤다  
20170722,10,대가를 치르지 않는 소원은 없다  
20170722,10,데스티네이션 시리즈 진짜 좋아했는데 요즘 뜸해서 서운했거든요 ㅎㅎ 근데 위시어폰이 그 빈자리를 채워준듯! 둘이 비슷하면서 재밌어요 ㅎ  
20170722,9,생각보다 더 재밋음~~ 이기홍 나와서 더 맘에듬ㅋㅋ  
20170722,1,개에바 장르 공포아니고 드라마임  
20170722,9,분량이 이기홍이 많아서 아주 만족해요 ㅎㅎ 소재도 신선한 재미  
20170722,10,그다지 무섭지도않고 부담없이 볼수있는영화.  
20170722,10,소원! 모두의 행복을 위한 소원을 가져야 겠다는 생각이 들었다. ㅠㅠ  
20170722,10,올해 그렇다할만한 공포영화가 나오지 않아서 좀 시무룩했는데 위시어폰이 제대로 터져주는듯 간만에 긴장하면서 봤다  
20170722,10,"계속 졸리는 허접호러보다, 가볍기 즐기기 좋은 이런호러는 언제든 환영  "
20170722,10,전개가 빨라서 그런가 나도모로게 집중하면서 되네요. ㅎㅎ  
20170722,10,볼만한 공포 ㅎ 몇번이나 눈감았는지 모르겠다  
20170722,9,공포영화 못보는 사람들이 보기 적당한 작품...킬링타임 영화임  
20170722,10,"영화 흐름이 스피드하고, 시간가는줄 모르는 호러호러!  "
20170722,10,엔터테이닝한 호러영화!! 왠지 공감하면서 보게 된다는 ㅎㅎ  
20170722,10,중간중간에 제 심장을 쥐었다폈다하는 적절한 긴장감이 좋았네요~ 우리 민호 오러영화 출연작  
20170722,10,날씨가더워서 영화관에서 시원햇습니다~ 마지막 불 켜질때까지 보고나오세요 ㄷㄷ  
20170722,10,공포영화를 좋아하질 않아서 잘 안보는데 뭐랄까 하이틴스럽고 너무 무섭지않아서 좋았습니다~  
20170722,10,방학해서 친구랑 보는데 킬링타임 영화 라 좋아요 ㅋㅋ.  
20170722,10,파이널데스티네이션 같이 임팩트 있고 볼만해요~  
20170722,10,이기홍보러 갔다가 친구랑 손 부여잡고 ㅎ 움찔움찔  
20170722,10,귀신의 공포보단 장면의 긴장감과 예고된 죽음의 공포감이 저를 옭아맸습니다  
20170722,9,기대한 것 만큼 괜찮고 매력적인 영화였어요  
20170722,9,예측하면서 보는 쏠쏠한 재미가 있네요..  
20170722,10,빠르고 스피드한 스토리 전개에 쉴 틈 없이 극장재미 느낌  
20170722,10,"설정, 스토리 모두 신선하고 볼만했어요!! 굿굿  "
20170722,9,평점보다 괜찮아서 놀랐음~ 내용도 나쁘지않고 좋았어요  
20170722,10,심장 쫄깃ㅋ.. 매력적인 공포영화였음!!  
20170722,10,엇 쥔공이 컨저링 아역배우ㅎㅎ 많이 컸다ㅎㅎ 이기홍 자랑스럽 ♡  
20170722,9,꼭 사람들은 하지말라면 더하더라ㅠㅠ..배우들 연기도 좋고 끊김도 없이 자연스러워서 더 좋았음  
20170722,10,식상한 공포들 억지로 무섭게 하려고만 해서 더 거부감이 느껴지는데 요건 스토리도 흥미롭고 재밌네요~  
20170722,10,은근히 잼나요~ 남자친구랑 봤는데 둘이 손 꼭 잡고 봤어요  
20170722,9,딱딱 요점만 정리해서 나오는 기분?!  
20170722,10,사람들이 뮤직박스에 집착할때 괜히 막 공감됨. 나같았어도 그럴듯  
20170722,10,수상한 물건 만지지 말라니까 왜 자꾸 만져!1  
20170722,8,재밌다. 첨 삼촌 죽을따 웃어야될지 어째야댈지 ㅋㅋㅋㅋ 라이트하게 보기 좋은 영화. 주인공 괴롭히는 백인여자애 이쁘다  
20170722,5,딱 평점5점 정도가 무난한듯 다른 공포영화가 상영을 안해서 볼거없으면 이거보는걸 추천. 그러나 살짝 전개가 지루하고 뻔한내용이라..  제돈내고보는건 약간비추. 쿠키영상있으니 꼭보시길  
20170722,1,일점도 주기 아까운 영화 뻔한 스토리에 도대체 왜 공포영화인지도 모르겠고 쿠키영상나오는데 그거 보고 코믹영화인줄알았음 이기홍 왜 이런 영화 찍었는지 모르겠고 왜 이게 평점이 높은지 이해가 안감 보지마세요 긴장감 하나도 없는 공포영화  
20170722,1,내가 살다살다 영화보면서 평점에 후기남긴적은 처음인데 진짜 ㄹㅇ 펙트야 아직까지 얼마나 재미없었으면 영화이름도 몰라서 영화관에서 찾아보고 후기쓴다 댓글알바 너무 많이한다 얼마받고하냐 나도 알바해서 내돈찾게  
20170722,1,너무 지루한ㄷㅔ... 평점믿고 볼게안되네  
20170722,9,"어떤 내용인지 막 찾아보고 본 건 아니고그냥 공포영화 보고 싶어서 봤는데 긴장 되는 순간도 많았고, 반전도 있었고... ㅠ 무엇보다 여주가 연기를 너무 잘해서화났다가 무섭다가 슬펐다가 맘조렸다가 하면서재밌게 봤어요~ 추천입니다!!  "
20170722,1,공포영화 못보는사람도 재미없다  
20170722,3,오늘 봤는데 무섭지도않고 정말 호불호 갈린다고 하는말이 맞나봄 여자친구는 재밌다고 하는데 난 개인적으로 엄청 별로였음 배우분들 연기력은 엄청나서 1점에서 플러스 2점드림  
20170721,5,무서운거 좋아하는사람들은 절때 보지마세요 1도 안무서워요  
20170721,6,본격 여주가 빡대가리라 사람들이 고생하는 영화  
20170721,10,여자주인공 마음 충분히 이해가더라고요 반전도 있고 덤으로 이기홍까지 ~  
20170721,1,공포영화 잘보는 사람은 개노잼...뻔한스토리... 그냥 하이틴 영화 보는줄  
20170721,8,무서운걸 못보는 사람도 도전해볼만한 영화인듯  
20170721,6,"가볍게 볼 만한 영화다. 킬링타임용이다. 그닥 무섭지도 않고 잔인한 장면은 있지만 많이 충격적이지도 않았다. 딱 중간 정도. 기대한 것에 비해서는 실망감이 컸다. 스토리가 뻔하고 딱 예상 그대로. 그렇다고 핵노잼은 아니니, 기대하지 않고 보면 될듯  "
20170721,10,제인생에서 2편이 나오길 기다려지는 영화는 처음입니다 진짜 연기도 잘하고 엄청 재미잇어요 딘짜 강추합니다!!!  
20170721,1,그 엄마인가 아줌마가 긴꽁지머리로 한것부터가 좀 설정 억지같앗고 그 싱크대 통돌이돌아가는거 거기에 완전 일부러 머리카락을끼고 버튼도 일부러키고 완전 억지 완전 구립니다.  
20170721,10,꽤나 신선했던 공포영화 기존 공포영화들과는 차별화되는 느낌?? 꼭 사람들은 하지 말라고하면 더하는듯..  
20170721,9,스토리 있고 무서움도 적당한게 괜찮았네..  
20170721,10,심리적인 공포가 대단하네요;;  
20170721,10,간만에 만족스러운 영화였습니다~ 젊은 친구들이 좋아할 스타일이에요  
20170721,10,약간 하이틴 무비 느낌도 나면서 흥미진진해서 몰입해서 볼 수 있었습니다. 인간의 욕심은 어쩔 수가 없나봐요  
20170721,10,인간의 추악함과 이기심의 끝을 보여주는 영화  
20170721,7,1도 안무서워요. 진짜로ㅋㅋㅋㅋ 공포영화보면 적당히 운가리고 적당히 귀막으면서 보는 사람인데 무난~무난~한 영화라능  
20170721,3,알바분들이 많으시네요.. 오늘 봤는데 여주 너무 답답하고결말도 좀.. 귀신나오는 영화 일줄알았는데 상자가 다하고무섭다기보단 애들 죽는게 더 극혐인영화.. 솔직히 좀 돈버림..  
20170721,1,10점준 새ㅡ끼들은 알바가 틀림없다. 1점도 아깝다  
20170721,10,재밌었어요 ㅋㅋ 결과는 좀 뻔했지만 ㅠㅠ  
20170721,9,애나벨보다 재미있다.. 이번여름 공포영화하나 나왔네.  
20170721,3,개허무 개노잼....  
20170721,10,"소원을 얻었지만, 그에 맞는 대가를 치뤄야 한다..  "
20170721,10,뻔한 공포영화일줄 알았는데 아니었어요ㅠㅠ…  
20170721,9,이번 여름의 시작을 제대로 장식해주네 ㄷ ㄷ  
20170721,10,가볍게 즐길 수 있는 호러영화랄까요? 적당히 무서우면서 볼만하네요  
20170721,10,잔인함이 난무하는 일반적인 공포영화들과는달리 사람의 행동만으로도 공포를 느끼게 한다  
20170721,10,꽤나 잘만든 것 같아요~~ 볼만했습니다  
20170721,10,사람의 심리를 잘 이용한 공포영화같다  
20170721,10,올해 괜찮은 공포영화가 안나오는것 같더니 이건 제대로구나..  
20170721,10,이기홍 분량이 꽤 되더라~ 괜히 자랑스럽네 ㅋㅋ  
20170721,10,솔직히 최근 몇년사이에 나온 공포영화 중에서 가장 긴장되긴 하드라 무엇보다 사운드가 대박임  
20170721,10,스릴+공포 제대로 느낌 오랜만에 꽤나 괜찮은 공포영화가 나온듯  
20170721,10,이기홍 때문에 보게 된 영화인데 보고나서 후회ㅜㅜ.. 나와서도 계속 생각나서 큰일나씀..힝  
20170721,10,집중하다보니까 끝남 흐름도 빠르고 러닝타임도 적당함  
20170721,7,결말안타깝다 볼만해요  
20170721,10,생각보다 잼있는데?? ㅋㅋㅋㅋ 넘나 무섭 ㅠ 후아  
20170721,8,관람객요근래 나오는 외국 공포영화에서는 SNS를 스토리를 이끌어가는 주요 매개체로 사용을 많이하는것같다. SNS중독..  주인공의 욕심은 끝이없고ㅋㅋ귀신은 안나오지만 나름 깔끔하게 만든영화라는 생각이든다. 내용은 뻔하지먀 교훈을 주는영화?  
20170721,10,관람객보고 나면 여름이란걸 잊게 됨 ㅋ  
20170721,10,"이 영화는 세계관이 3개같아요. 주인공들이 계속 평행우주를 강조하여 여주의 엄마, 딸, 친구 이기홍 이렇게 각각 시선으로 세가지 세계가 있는듯 내용 참 뻔하지만 재밌어요 무서운건 거의 없어서 못보는 사람도 볼 수 있어요.  "
20170721,1,담배두갑을사는게 정신건강에 더 좋습니다  
20170721,7,관람객킬링타임용으로 봤는데 괜찮았습니당  
20170721,8,관람객걍 양호 너무 비슷한 레퍼토리  
20170721,10,아 내 팝콘.. 몰입하느라 손이 안가더라 ㅡ ㅡ  
20170721,10,"시각, 청각 모두 만족 시킨 영화  "
20170721,1,이 영화를 미국판 리얼이라는 이유를 알게될 것이다.  
20170721,10,관람객ㄷㄷ 시간가는 줄 모르고 봤네요! 추천!!!  
20170721,10,관람객팝콘을 안 사길 잘한 듯 !! 최고의 공 포 영화!  
20170721,10,올해 본 공포영화들 중에선 (몇개안되지만) 인상깊네요  
20170721,10,보는 내내 몇번이나 닭살 돋았는지 모르곘다..  
20170721,1,걍 장르를 스릴로 바꿔라무슨 이게 공포야  
20170721,9,관람객기대없이 봤는데 시간 가는줄 모르고 봤네요!  
20170721,6,음 딱히 공포에 초점을하면 그렇게 무섭지가않다 소리가커서 놀라는것뿐 무섭다고는 느껴지지않는다 그래도 나름 연기가 볼만했다 마지막 소원상자를 놓치지않겠다는 집착과 광기는 좋았다 미드를 보는느낌이였다.  
20170721,10,관람객이거 완전 레알 시간 순삭! 친구들이랑 다 같이 보기 좋은 영화 !!  
20170721,10,관람객솔까 1점 영화는 아닌데 평점 왜 이럼? 트와일라잇+데스티네이션 섞어놓은 틴에이지 판타지 슬리러물인데 약간 무서운 장면 첨가됨 지루한 부분 없고 막판 은근 예상못한 부분도 있어서 딱 7점-8점 정도. 별점 조정 용으로 10점 줌. 무난평타팝콘무비  
20170721,10,중간중간 놀라는 요소들도 많고 보는 내내 긴장도 되고 괜찮았던 영화였습니다  
20170721,9,깔금한 공포영화. 괜찮았어요  
20170721,10,생각보다 시간이 후딱 지나가네요.. 단지 무서운 영화가 아닌 교훈까지 주는 영화라 더 좋은 것 같아요  
20170721,10,관람객진짜 '시원하게 영화관에서 영화감상'하고 싶다면 굿초이스임  
20170721,10,관람객스릴러 요소가 더 많았지만 완성도가 괜찮아서 좋았음!  
20170721,7,관람객아무 생각 없이 보기 좋았어요.무섭지 않아요.  
20170721,10,관람객상자에 집착하는 여주의 모습이 넘나 공감되기도 하고.. 킬링타임으로 딱 제격입니다  
20170721,9,"기대했던영화인데 볼만해요.. 언제부턴가 국내나 일본 공포영화가 식상하드라구요, 서양쪽이 더 잘만드는 것 같아요  "
20170721,10,세상에 공짜는 없다는걸 또 한번 느끼게 해준 영화  
20170721,9,이번 방학 때 친구들이랑 보기 좋은 영화네요  
20170721,10,관람객올해 여름 본 첫 호러라 10점 준다 틴에이지 다크 판타지 스릴러 >>> 호러이 뮤직박스 있으면 나도 썩게 만들고 싶은 사람 쫌 있는데...허허  
