0,1,2
20190124,10,라이언필립 때문에 봤다  
20190121,1,ㄹㅇ 주인공 개 발암이네 진짜;;  
20190107,10,너무 재미있던데 대충 킬링타임용으로 즐기기 괜찮음  
20181214,6,적당한 킬링타임용 영화  
20181214,9,모든일엔 댓가가 따르는법...  큰교훈을주는 영화네요~~인생을 쉽게살지맙시다여주가 별로였지만 스토리는나름 괜차났요  
20181214,6,조이킹 많이컸내 .. .  
20181214,10,재밌어요 ^^이기홍씨 난중국사람인줄 ㅋ 한국분이셨네  
20181214,6,킬링타임용으로는 좋을 것 같은데 딱히 킬링 안해도 되는 시간을 써서 보는 바람에 별 삼 드립니다.. 잘걸...  
20181214,1,결말까지 예상가능한 노잼영화  
20181214,2,집에서 불끄고 혼자봤는데도 그닥 여주보다가 암걸릴려는찰라  마지막죽어서 통쾌  
20181214,6,주인공 완전 발암캐... 멍청한인간이 힘을 가지면 끔찍한 일이 일어남을 보여준다.  
20181214,2,여주인공 진짜 왜케싫지? 보는내내  
20181214,6,여주 극발암캐릭터네..  
20181214,10,존나 사춘기년 하나땜시 사람들 다 죽고 암튼 망할 사춘기년이 문제야. 기홍이는 문제없어  
20181214,10,짐 티비서 해준다.. 잼다  
20181214,4,싱크대밑의 찌꺼기 분쇄기에 머리카락이 감겨서 빨려들어가는 장면 뭐임?파이널 데스티네이션 스핀오프(외전)이냐?여주인공 가시나 귀여워서 참는다.라이언 필립은 아빠로 왜 나와?차라리 링컨차를 타는 변호사에서 했던 여성 연쇄살인마 루이스 룰레 역할이 더 나음  
20181207,10,재밌게 봤다~~ 영화는 영화로 봐야 재밌다~  
20181113,8,딱히 무섭지도 징그럽지도 않지만 스토리가 흥미있었음. 결말이야 너무 허무하지도 과하지도 않은 평범하고 뻔한 결말이지만 그렇다고 흥미 떨어뜨리진 않는거 같은데 호불호가 꽤나 갈리네..  
20181019,1,결말이 이렇게 허무한 영화는 본 적이 없다.. 너무 급작스럽게 끝난 기분..  
20181007,1,진짜 1점도 아까움...정말 뻔한 스토리..  
20181005,1,이건 절대로 1점이 아니다. 이걸 보느라 시험공부를 안해서 떨어진 내 점수가 1점이다.  
20181003,6,다소 현실감이 떨어지는 소재였지만 킬링타임용으로는 제격이었다. 영화 '파이널 데스티네이션'을 연상시키는하이틴 스릴러는 역시 언제 보아도 신선하다. 중국제 뮤직박스를 영화의 소재로 설정한것도 흥미있었고이름모를 배우들의 열연 또한 볼만했다. 다만  
20180926,8,가볍게 볼 수 있는 틴에이지 호러물.. 나쁘진 않습니다. 데스티네이션 같은거 좋아하면 재밌게 볼 수 있음..  
20180918,5,여주 졸라 멍청하네.. 숫자 계산도 제대로 못하고 가네..  
20180917,7,딱 7점짜리 영화네요.ㅋㅋ 그럭저럭 나쁘지는 않습니다.  
20180916,8,흥미진진했음! 볼만한 영화.  
20180810,1,이기홍 때문에 참고 보는데 보는 내내 욕 밖에 안 나온다 여자주인공 진짜 개답답해서 한대 치고 싶음 공포영화지만 전혀 1도 안 무섭고 그냥 사람 죽이는 거에만 초점 맞춘 쓰레기 영화.. 사람도 그렇게 흥미롭게 죽지도 않고 이건 뭐 진짜 절대 보지마세요  
20180726,10,엥 이게 호불호가 갈릴만큼 노잼이었나; 재밌었는데.. 좀 기대하고 본 영화인데 기대만큼 재미있었음. 역시 영화는 불끄고 집에서 혼자봐야되는듯. 마지막 결말이 좀 당황스러웠는데 그래도 재밌었음. 이기홍 짱!  
20180719,5,장르를 잘못 분류한듯.... 그냥 저냥 볼만한 틴에이지 무비인듯  
20180710,1,"방금 보고와서 쓴다.첨엔 재밌어보였는데 중후반 갈수록 뻔하게 흘러가고 뻔한사람이 죽고 죽는것도 개뻔하고 이걸 본 시간이 아깝고 열받아서 처음으로 리뷰쓴다 나는 시간이 남아돈다, 얼마나 뻔한지 한번 보자는 사람만 봐라  "
20180625,8,좋아요~^^ 보는동안엔 유치뽕딱 이거모야 하는느낌 들었는데 볼수록 재밌어요 저는 호러 수릴 매냐  
20180530,6,볼꺼없을때 볼만한영화라는 평점들이있길래 시간이나 때우자하고 보게됬는데 대충 어느정도 뻔한결말이였고 주인공때문에 답답함이 턱턱 막힐때도있긴했지만 어느누구라도 다 비슷비슷한 생각과 행동을 취했으리라 싶기도하고 기홍씨가 자주나와서 오히려 더 보고싶기도했다.  
20180528,10,쓸모없는 갑툭튀로 도배하는 공포영화보다 훨씬 나은 영화 거기에 기홍씨 많이 나와서 좋음 ㅋ 그리고 쿠키영상이 시사하는 바가 매우 공감 누구나 원하는 건 있지만 그것에 대한 댓가를 생각하지는 못함 뭐 이 영화의 경우는 극단적이지만 소품도 매우 정성들임  
20180520,4,음...어디가 무섭다는건지 모르겠습니다 ㅋㅋㅋㅋ  
20180516,6,주인공 여자애가 돌대가리  
20180414,1,여주가 죽어서도 민폐임...  
20180405,1,시간이 아까운 영화 그 자체  
20180405,10,2편 나오길ㅎㅎ생각없이 봤는데 넘재밌어요~~~~  
20180401,1,호불호?이기홍팬들이 그렇게 물타기라도 해보고싶은가본데 그냥 최악의영화다. 여주 핵발은케릭인데 소시오패스급이라 시덥잖은소원빌겠다고 주변인들 다죽인다. 소원빌면 주변인죽는거 알면서도 학교에서인기인되게해달라는 소원빌때 그부분이 영화에서 제일무섭더라 소오름;  
20180224,10,여주 소원비는것에 답답했지만저게 내일이면 나라도 안빈다는보장을 못하겠다...암튼 마지막 쿠키영상이 젤 맘에들었슴  
20180218,10,현실적이고 재밌었뜸ㅋㅋ  
20180217,6,꽤 괜찮은 소잰데 스토리와 연출이 많이 빈약했다. 캐릭터들은 너무 어색하고.. 상자의 비밀을 알아가는 과정이 너무 허술하다. 중간중간에는 내가 데이티네이션을 보는건디 위시어폰을 보는건지...  
20180212,8,그냥 뻔한 결말... 1소원 1목숨에 7번째 소원인거 감안하면 충분히 나올 수 있는 결과여서 그다지 반전도 아니었음 볼 거 없을때 보면 좋은 영화  
20180212,10,나름 신선했고 여주가 조금 답답하기도 했지만 충분히 공감은 갔음  
20180212,4,"7가지 소원을 통해 자신의 삶을 바꾸고 싶어하는 10대 소녀의 이야기는 그럭저럭 공감되는 부분들이 있지만, 의도하지 않게 멍청함과 웃음을 유발하는 공포 장면들은 어설프다.  "
20180211,9,볼만한 영화 중 하나다.  
20180209,2,연기들을 너무 못 해서 숨이 막힌다  
20180208,5,킬링 타임~ 하이틴류~  
20180205,8,잘봤어요 이정도믄 괜찬은데평점 너무낮다 진짜루용  
20180128,7,"무서운 소원상자에 관한 이야기이지만, 15세 관람가라서 특별히 잔인한 장면은 없습니다. 결말도 나름 반전이 있고, 그런대로 재밌는 영화 같네요.  "
20180128,9,주인공은 여러개의 평행우주를 경험했고 결국엔 해피엔딩이 아닌가.  
20180128,7,드래그 미 투 헬을 결말을 보고 안타깝다고 생각 했었다. 하지만 이 영화의 결말을 보고는 사이다 100잔 마신 느낌이었다.  
20180128,4,암걸리는 영화 클레멘타인 보고 낳았습니다  
20180126,2,모든게 엉성한  허접영화.  
20180122,4,이게 왜 평점이 높은줄 모르겠네요 유치해요 진짜 잠올뻔..  
20180121,8,해피 데스데이랑 비슷한데 좀 더 재미없음...  
20180121,6,클레어 모레츠 닮아서 봤는데 아쉽네. 내 소원은 내가 말하는대로 모든게 이뤄지는 능력을 달라  
20180120,4,볼만은한데 보다보면 여자주인공이 답답한느낌이들고마지막은 좀 허무한느낌?공포를좋아하시는분들께는 별로 추천하고싶진않아요  
20180120,6,애매하다.. 공포물이라고 하기엔 너무 부족하고..미스터리가 나으려나... 뭔가 상당히 장르가애매한데볼만은했다 킬링타임으론 좋았다  
20180114,1,너무 영화 볼게 없어서 이거 봤는데 B급도 아닌듯. 공포영화라기보다는 하이틴영화에 약간의 스릴러만 들어간 영화?이기홍이 많이 나온다는 장점 외에는 모든 것이 단점이 흠인 영화였음.  
20180112,6,신선한데 여주 개 발암 . 앜 !!!!  
20180109,8,관람객그냥 그럭저럭 볼만함 귀신안나와서좋음  
20180107,2,무섭지도 않고 죽일까 말까 밀당하는게 짜증난다 여주 하는짓땜에 보다가 암걸릴수도있다  
20180106,7,어설프지만. 킬타임 수준은 됨. 반전도 있고. 누구나 한번쯤 생각해보는 7가지 소원은 뭘까?  
20180102,6,관람객공포영화가 다 그렇듯 그냥 무섭기만하지 스토리는..  
20180102,5,중간 중간 굉장히 답답한 주인공의 행동 때문에 미칠 것 같았지만 맨 마지막에 자기가 죽였던 여러 사람들이랑 아빠는 살리고 자기 혼자 죽어서 다행이다라는 생각만 하게 되는 영화 그리고 여러 캐릭터들의 데스 씬들은 거의 다 순 억지밖에 없었다.  
20180102,5,지루하진 않은데 여주 너무 발암;  
20180101,4,소재는 좋은데 연출이 12세 관람가 수준. 여주는 너무 생각도 없고 철도 없다. 찝찝스러위 1시간 보고 더는 못보겠음.  
20171223,1,너무너무너무너무너무너무재미있습니다  
20171217,5,"여주 죄책감 없음, 공포영화라기 보단 찐따의 꿈  "
20171217,1,어슬픈전개. 지루한내용 식상하다  
20171214,5,"어딘가 익숙한 기분. 흥미는 떨어지지만. 여주인공 개짜증나고, 마지막 장면 통쾌함.  "
20171204,6,위시마스터하고 데스티네이션이 섞인 느낌  
20171204,7,익숙한데도 불구하고 궁금해진다  
20171127,8,"스릴+공포+호기심자극, 괜찮은 호러물.  "
20171126,1,여주 너무 멍청해...  
20171120,7,이제 민호가 저 소원 상자 들고 메이즈러너 가서 애들 다 쓸어 버리면 되겠넹....  
20171119,3,친구들이랑 치맥하면서 4500원 주고 봤는데 이거 보자고 한 친구 죽이고 싶었음 ㅎㅎ 인태양 ㅎㅎ  
20171114,8,그냥 조용히 보기는 좋았던 작품...  
20171112,1,진짜 OO재미없음 진짜 기가찬닼ㅋㅋㅋ 최고의 호러무비 ^^ 짱이에용^^ 강추 ^^  
20171110,8,이기홍 서양인들이랑 같이 있어도 전혀 안꿀리고 멋지네.  
20171110,4,여주 못생겼어 진짜.게다가 하는짓도 비호감.. 공포스럽진않다  
20171109,7,공포영환데 전혀 안 무서움.. 그리고 여주 중간부터 개발암 그 자체.. 그래도 재미는 있었음 기홍짱 너무 잘생기고 귀엽고.. 결말은 무한루프인가 싶었는데 내가 생각했던 결말은 아니었음 아무튼 킬링타임용 영화  
20171107,6,킬링타임용으로 적합.공포는 못느끼겠다  
20171105,10,최신공포영화.  나름 괜찮았고. 섬찟했던 영화. 밤에 혼자 보기에는 좀 무서움..암튼 재밌었음.  
20171105,1,꾸벅꾸벅 졸면서 봤다... 평점 조절  
20171104,6,어디선가 본듯한 이야기들의 짜깁기. 마치 구전동화의한부분을 보는듯한 느낌  
20171102,1,"일단 여주 개쳐빻은년이 인싸인척, 이쁜척 하는게 토악질 나오고 주변사람 죽여놓고 지 애미 숨진걸 감성팔이로 피해자 코스프레 하는게 씹역겨웠는데 결말은 괜찮았음^^  "
20171031,5,관람객너무 기대를 해서인가 별로 안무서웠어요  
20171030,8,괜찮았음 특히 하드하지않은게 젤 맘에듬  
20171029,7,뭐그럭저럭~메이즈러너의 민호를보니반가웠음ㅋ  
20171028,8,아무 기대없이 봤는데 만족스러웠던 영화. 갖고 싶은것 많은 철없는 십대가 비는 소원들이 가져오는 사람들의 죽음과 그를 감당하지 못해 극단적 결말에 치닫는 이야기를 무섭지만 살짝은 코믹한 분위기로 잘 그려냈고 사망 시퀀스의 서스펜스가 꽤나 좋았다.  
20171028,2,응 시간개아까움. 연출도졸라 지루하고 뒤로갈수록 별로 기대가안됨. 개연성 1도없고 여주는 못생겼고 조연들 연기는 서프라이즈급  
20171027,3,제임스완의 촬영감독으로만 남았어야지 왜 연출을 하니!애나벨 연출할때부터 알아봤지만 이건 더 졸작이잖아!그냥 카메라감독으로 남아줘라 아무리 애써도 당신은 제임스완이 못된다. 좋은 소재로 이렇게밖에 연출못하다니..감독의 역량이 얼마나 중요한지 알게해준다.  
20171025,8,데스티네이션 보는것 같았음.. 볼만은 한데..먼가 아쉽네요  
20171024,5,죽음(불행)을 불러온 뮤직박스 그리고 멜로디소재는 좀 흥미로운데 전개는 예상했던 것보다는 그리 공포스럽거나 스릴이 느껴지진 않았던...  
20171024,10,관람객먼가..살짝 아쉽지만 나름 볼만했던 영화.  
20171023,5,마지막에 왜죽은걸까여 이해가안돼요  
20171022,1,감독은 호러의 개념부터.  
20171022,9,애나벨보다 훨~ 잼있네~~!!!  
20171022,1,빡대갈ㅋㅋㅋ 7개빌면 죽는데 과거로 돌아간다고 안뒤지겟냐  
20171021,6,킬링타임용 심심풀이용으로 괜찮음. 다만 클리셰 덩어리  
20171021,3,하이틴 공포는 이제 유치하고 너무 뻔해서 못 보겠다  
20171021,3,소재부터....이럴수가  
20171020,2,마지막 장면 덕분에 +1  
20171020,8,20년전 미국 tv시리즈에서 봤던 흔한 내용  
20171020,2,오글거리게 유치한 졸작.  여주인공 캐릭터뿐 아니라 심지어 외모까지도 비호감이라 몰입 더 안됨 ㅋㅋ  레오네티 이 양반은  애나벨도 그렇고 공포 연출 재능이 없는듯.   샌드버그 (애나벨2 감독) 님에게 가서 좀 배우고 오도록~~  
20171019,4,서토 물건 불패 영화 같다. 서토 물건 쓰면 불행이 온다  
20171019,6,빠른전개 좋았다 나라고 해도 멈출수 있었을까??  
20171019,4,"절대 저주없이 소원을 100개로 늘려주고 이후 내 영혼도 걍 나두고 넌 세상에서 없어지렴,, 멍청한 여주  "
20171018,6,"투문정션, 트윈픽스에서 그 아름다웠던 세를린펜이 음식물찌꺼기 분쇄기에 머리가 걸려 유명을 달리하는 안타까운 옆집 할머니 역을 하다니..  "
20171018,7,데스티네이션 느낌도 나고 뭔가 유치하지만 흥미로운 영화 학생들도 보기 좋을 만한 이런식의 공포도 난 좋음.. 뭐랄까 약간 몸에 안 좋은 패스트푸드가 집밥보다 더 맛있는... 아빠가 라이언필립인거 후반부에 알았다.. 많이 늙었네  
20171018,6,"이영화에서 가장 몰입이 안되는건 여주가 그리 착하지도, 똑똑하지도, 예뻐보이지도 않는다는것이다... 그래도 현실에 만족하고 살라는 교훈은 있어 그런대로 나쁘지만은 않다.  "
20171018,1,이거보고 농담아니라 여자친구랑 헤어졌어요.  
20171018,3,주인공 여자애 진짜 너무 이기적이네..정황상 자신때문에 사람이 죽어간다는걸 저능아라도 알만한 상황인데끝까지 제 욕심만 채우려고...  
20171018,5,전형적인 10대 하이틴 b급 공포물....   공포영화 많이 본 사람이라면 굳이 볼 필요없다..  그다지 흥미롭지도 않을 테니까..  
20171018,6,관람객그냥 그럭저럭.. 무섭진않고  
20171018,6,주인공 좀 예쁜 애로 좀 쓰지... 쩝. 영화는 킬타용으로 괜찮음.  
20171017,3,미국영화 보면서 연기력에 대해 전혀 생각해본적 없었는데이영화보고 연기드럽게 못하네 라고 생각이 들었다 ㅋ더 무서운건 혹시나 이 영화가 시리즈물로 나오는게 아닐까하는생각이.. 아 내 시간 아까워  
20171017,7,전형적인 b급영화 킬링타임으로 괜찮음 기대하고 보진말길  
20171017,7,"내용 뻔함, 공포감 쏘쏘, 재미는 볼만함, 여주는 바보?  "
20171017,10,관람객생각보다잼남. 짧음.  
20171017,6,여주 귀엽고요. 남주 메이즈러너. 15금이라 공포영화 아니고요!! 파이널 데스티네이션 느낌이지만 그보다는 부족하고요. 분명 본거 같은 느낌은 느낌인가요? 리메이크 인가요? 19금이였다면 점수 더 주겠지만 아쉽네요.  
20171017,1,이게 반전이냐? 누가봐도 알겠는데 결말  
20171017,6,"섹시한 주인공도, 크게 잔인하거나 소스라치는 장면도, 굉장히 신선한 연출이나 반전도 없지만, 크게 흠 잡을 것 없는 이야기와 호기심과 긴장감의 적절한 조율이 꽤 높은 수준의 몰입감을 선사하는 아기자기한 공포 영화. 심심할 때 한 번 볼 만하다.  "
20171017,10,이런 천조국 영화에 댓글알바가 있나? 방금 봤는데 준수함 공포영화는 모조리 찾아보는 사람으로써 한마디 하자면 무섭다기보단 인과를 보면서 가볍게 보기 재밌음 데스티네이션 같은 느낌도 나고 1점 주면서 욕하는건 취향차이일듯  
20171017,1,장르를 드라마로 소개해야할 듯  
20171016,4,"영화가 실망스러운 것보다 라이언 필립의 망가진 모습이 더 슬프다. ㅠ,.ㅜ  "
20171016,7,누구나 알수있는 줄거리 결말이지만 나쁘지 않아요그냥 킬링타임용으로 적당한 영화 적극추천은 아니지만본다면 나쁘지않은 영화라고 말씀드리릴수있습니다  
20171016,7,파이널 데스티네이션 비슷한 식상한 소재지만 흥미롭게 만들었다.  
20171016,7,찐따주인공의 끝을 보여주다  
20171016,7,여주인공 호감도가 떨어지고...이기홍은 연기 공부 좀 더 해야될 듯~ 영화는 볼 만했음  
20171016,6,애나벨2보고 재밌어서 이거 봣는데 애나벨2보다는 재미 없음. 그냥 저냥 볼만한데 주인공 여자 극혐임. 보면서 주인공 빨리 OOO 빈 영화는 이게 처음임;;  
20171016,7,볼만하면서도 지루한 공포영화.  
20171016,7,"엄마의 자살후 넝마주이가 된 아빠가 상자를 줏어온다. 소원을 7개 들어준다 적혀있어 시험하니 진짜 이루어지고, 조사 해보니 소원은 피의 댓가와 7개 다쓴후 영혼을 가져간다 한다. 결국 모든 죽음이 상자때문임을 알고 마지막소원으로 시간을 되돌리고 죽는다  "
20171016,8,굉장히 재밌게 봤습니다. 나라면 어떤소원을 빌까하고....라이언필립 많이 늙으셔도 멋있네..  
20171016,9,막장이지만 재미있는건 어쩔수 없네 나또한 욕망이 없는 인간이 아니란 얘기겠지  
20171016,5,공포물로 보기에는 많이 부족하고 미스테리 정도로 생각하고 보면 그나마 볼만한듯..  
20171016,7,아주 무난하게 볼만하다 근데 공포...인가?  
20171016,7,꽁짜는 없다는 좋은 교훈을 주는 영화청소년들에게도 추천함  
20171015,7,나름 볼만은 했는데 된장년의 최후...  
20171015,7,자극적인걸 찾는분은 비추천이 많을겁니다.  제취향임^^ 킬링타임용으로 제격이고 볼만합니다  
20171015,2,평점 믿고봤다가ㅡㅡ 공포아님 귀신은 안나오고 사람죽는거만 나오다가 끝남  
20171015,4,무난한 호러물~ 타입슬립까지 해내는 상자~  
20171015,4,그렇게 펑펑쓰다가 그 꼴날줄 알았지  
20171015,2,제 소원은 이 영화 보기전으로 돌아가는것입니다. 당장요  
20171015,1,알바가 아니라 저 한국애 빠순이 애들이 평점 높게 준듯.  
20171015,7,나름 볼만하다. 간혹 잔인한 장면도 나와줘서 지루하지않고 내용전개가 물흐르듯 이어져 괜찮았다.  
20171015,5,스토리 별로고  무서운장면도 없는 영화 실망이다..  
20171015,1,속지마세요 진짜 재미없고요 여자 주인공 패죽이고싶어요  
20171015,5,멍청하면 죽는다는 교훈을 주는 영화.  
20171015,6,혼자서라도 영화관 찾는 호러매니아에게라면 욕 입빠이 먹을테지만 평범한 관객에게라면 동반인과 함께 볼만한 적당히 라이트하고 적당히 무서운 호러물. 그래도 어떻게든 제휴할인은 받아야 본전 생각이 안 날 것임은 확정이지만.  
20171015,4,주인을 잘 못 만나니 식상한 괴담 수준일 뿐  
20171015,10,저 상자 필구다!!! 갖고싶다 !!  
20171014,7,볼 만 합니다.킬링타임용으로 추천.  
20171014,8,재밌었음 아주 아주 많이  
20171014,6,"멍청한 메갈냔의 최후가 어떤건지 제대로 보여준영화,,  "
20171014,10,굿굿굿 ~!!! 왠지 감독이 후속편까지 염두한듯 ... 나왔음좋겠다!! 갠적으론 꽤괜찮은 스토리라  나올꺼같음^^  
20171014,10,재미있게 봤다. 끝을 좀 다르게 했으면 어땠을까 하는 생각도 든다.  
20171013,5,데스티네이션이랑 흡사~ 소원있고 없고 차이뿐  
20171013,2,김치년덜 영화보여줬음 팝콘 정도는 니덜이 사도 돼지 않컸니? 오늘도 뻐카하나만 달랑 없는 슴가 달랑 거리는거마냥 달랑달랑 쳐들고 다니는거?  
20171013,9,재밌기만하고만 왜들 난리 평점에 ㄹㅇ재미 없다는 평 보고 고민 많이했는데 호러물 매니아라 재미없어도 가벼운 마음으로 별 기대없이 봤는데 스토리도 마음에 들었고 나름 반전도 있고 보는 내내 몰입감 쩔었음  
20171013,2,기홍이도 딱히 작품 보는 눈은 없는듯  
20171012,7,조이킹은 귀엽고 이기홍은 풋풋하다 부담없이 볼수있는 공포영화  
20171009,4,어릴때 비디오대여점에 일단 들어가긴 했는데 진짜 볼만한 게 없어서 고민하다 억지로 집어온 그런 느낌의 영화다.  
20171001,6,"THE  FINAL DESTINATION  mix  호러 영화.   중국산 소원박스로 인해 소원이 이루어질때마다  주변사람이 다 죽어나감, 뻔한 소재지만 각 장면마다 상당히 긴장감 넘침 다만 주인공이 cute하다는 이야길 듣고 어이가 없었네요..ㅎㅎㅎ  "
20171001,10,꽤 잘만들었네요ㅎ 굳굳  
20170928,10,호불호가 심한데 까다롭지 않은 나는 그냥 재밌게봤음  
20170908,8,관람객추천하고싶은 영화!!!!  
20170827,7,관람객생각보다 많이 안 무서웟어요  
20170823,5,관람객생각보다 뻔하고 안무서움  
20170821,4,관람객그냥 그럼10자10자  
20170819,6,관람객그럭저럭 재미나게 봤습니다  
20170818,4,관람객별로였어요....ㅠ  
20170812,4,관람객그냥그래요하나도 아무서워요  
20170811,8,관람객하이틴 무비!! 그런대로 볼만함.  
20170811,8,관람객진짜 사람들이 다양하게 죽는다....마지막에 반전  
20170810,8,관람객생각보다 꽤 나쁘지 않았던 영화인거 같고 그렇다고 괜찮네 하는 영화는 또 아닌거같다  
20170810,4,"C급 하이틴과 C급 공포가  만나 B급 코미디가 되는 기적, 위시어폰과 함께 합니다..  "
20170809,9,관람객생각보다스토리가탄탄했다  
20170809,7,관람객재밌어요~~!!!!  
20170808,1,관람객500포인트 받을꼬당  
20170808,8,관람객나름 재밌게 봤는뎅..ㅋㅋㅋㅋ 굿!  
20170808,8,관람객욕심은너무무서운것..  
20170805,6,관람객..보시면 알게됩나다  
20170805,10,관람객무서운데 재밋어요 근데 데스티네이션 보는느낌 ㅎㅎ  
20170805,1,아 미개하네 한국배우 나왔다고 점수 엄청 주는거봐라. 아이엠디비 평점 4.7이다. 즉 한국에선 저 배우 안나왔으면 욕 엄청 먹었을 영화란거지  
20170804,10,관람객아주아주 신선하고 무서움  
20170804,7,관람객재밋었오용 와오아아앙  
20170803,8,관람객버려진 물건을 함부로 손대지마라~~~무섭땅~~  
20170803,9,관람객마지막은소보름 은근집중해서봣네요.  
20170803,9,관람객빠른 전개! 시간 때 우기 좋음!  
20170803,8,여자주인공극혐인데ㅋㅋㅋㅋ재밌게잘봤습니다  
20170802,8,이기홍 때문에 봤는데 많이 무섭지도 지루하지도 않았음 ㅋㅋㅋ 결말이 좀 아쉽  
20170802,9,관람객러닝타임도 짧고 오락영화로 딱 괜츈. 사건이 계속 일어나서 지루하지 않고 재미있게 봤는데 결말이 살짝 당황 스럽네요 하하하 기홍이의 쿠키 영상이 있다는 ㅋㅋㅋ  
20170802,9,관람객ㅋㅋ 클레어가 뮤직박스 막 쥐고 있을 때 겁네 공감 100% ㅋㅋㅋㅋ 막 무섭진 않은데 나름 잼남  
20170802,9,관람객너무 무섭지 않게 만든게 좀더 스토리와 주인공의 감정에 이입할 수 있도록 한 것 같아서 괜찮았다. 답답하면서도 주인공의 생각이 이해가 되는 인간적인 영화인 것 같았다.  
20170801,4,관람객기대보다 별로 그냥 배우들의 연기만 좋았지 스토리는 최악  
20170801,1,관람객재미없어요 보지 마세요  
20170801,1,관람객재미가 더럽게 없어요.... ㅜㅜ  
20170801,9,볼만했어요. 좀만 더 무섭게 만들수도 있었을거같긴 한데... 쨌든 볼만합니다!!  
20170801,8,그냥 적당히 주고싶다..  
20170731,10,엄청 무섭지도 않고 적당히 무섭고 딱 좋았습니다.  
20170731,2,관람객돈 아까워 죽겠음 걍 ㄹㅇ 영화 보기 전으로 돌아가게 해 달라고 상자한테 소원 빌고 싶다  
20170731,10,관람객재밋어요 가끔씩 놀라는 장면도 나오고  
20170731,8,관람객재미없어요 예고편이 영화의 절반임  
20170731,10,볼만하고 재밌는 영화였어요!  
20170730,6,뻔한공포에 뻔한 줄거리 그냥 노멀합니다.  
