0,1,2
20170904,8,존나웃김임창정이 너무착햇음 강도가강도같지않음 월래 만점줄려햇는데 기억남는장면이별로없오서 8점줌 근데존나웃김 또 보고싶음  
20170904,8,관람객웃기기도 하고 슬프기도 하고 오랜만에 그냥 웃어봤네요 근데  집이 신림역쪽인데 영화시간대가 없어서  일부러 가산디지털단지역 가서봤네요...한국영화 상영관이 너무 적어서 문제네요 ㅠㅠ  
20170904,10,관람객재밌어요 감동도있구 빵터지네요~  
20170904,10,관람객웃기고영롸바어자루나줓  
20170904,9,재밌어요ㅋ역시 임창정ㅋ  
20170904,1,임창정형과 최성국형이 한영화에나와 각자의 코메디연기로 좌우펀치 날려주는 색즉시공같은 코메디영화를 보고싶다.  
20170904,9,별기대는 안했는데 진짜볼만하고 재밌어요 괜찮은영화에요 보세요  
20170904,9,가볍게 보기 좋은 유쾌하고 약간의 감동까지 ㅎㅎ  
20170904,10,관람객창정이형이 좋다 그래서 재미있다  
20170904,6,관람객그냥 전형적인 한국영화..코믹부분도 있지만 거의 수준이 달마야놀자급이네요  
20170904,10,기대없이본건데울고웃고너무재미있게관람했어용♡♡  
20170904,7,주말에도 상영관이 너무없네요. 개봉관이 더 많으면 조금더 많은사람들이 볼텐데 아는 아쉬움. 영화는 재밌게 봤습니다.  
20170904,6,관람객역시 창정횽 영화임.. 재미 감동은 있는디 역시...  
20170904,10,재미만 있는게 아니고 감동도 있네요. 영화 끝나고 배우들이 무대인사 진행해서 더 좋았습니다. 지금 영화 시장에 안좋은 상황에 개봉하여 안타까울 뿐입니다.  솔직히 요즘 본 영화중에 제일 재밌었어요.  
20170904,10,넘 웃기네요 하하하하후하하하  
20170904,9,유쾌하고 따뜻한 휴먼 코미디 ^^ 개성있는 스토리와 아날로그적 분위기가 아주 좋았습니다. 역시 임창정!!  
20170904,6,"솔직히 영화보는내내 집중이 잘안됐음, 이런 류 스타일의 코미디는 2000년도 초반에나 먹혔을것 같은데, 지금볼려니 좀 지루한 맛이 느껴지는... 굳이 추천하고싶지않지만 창정이형 연기 좋아하는 사람은 추천~  "
20170904,1,이것은 11점을 주고싶은 내마음이다.. 비급감성이라고 욕하지만 말고 한번봐라. 스토리도 나름 탄탄하고 최근영화중에 나를 울게하였다... 창정이형 응원해요!  
20170904,10,그래도임창정홧팅!양꼬치엔칭타오도짱!  
20170904,10,전중재 이빠이네...화이팅입니다!  
20170904,6,코미디로 갈꺼면 그대로 하던가 왜 갑자기 신파로 가냐 중간부터 재미가 없다  
20170904,9,초반부터 끝까지 지루하지않게 잘 흘러가서 좋았네요  
20170904,10,돈안가깝고 진심 뿌듯해지는 영화다  
20170904,10,가족이랑 봣지만 남친이랑 한번 더보려구요 ㅋㅋ 졸잼  
20170904,10,임창정 너무 좋다 연기하는데 왜케 실제같냐..  
20170904,9,아무생각없이 보긴했지만 상상 초월 꿀잼이였당  
20170904,10,코믹의 신 임창정 ㅋㅋ 진짜 믿고보는 영화예요  
20170904,10,기대했던것이랑 비슷했고 나름 괜찮게 잘봤습니다~  
20170904,10,조연들도 나름 돋보이고 영화자체가 신선했어요  
20170904,10,내가 생각했던것보다 훨씬 꿀잼 배우들 하나하나 매력터짐  
20170904,10,정상훈이 생각보다 재밌게 연기 잘했네  
20170904,10,제대로 진정한 코미디 영화였다 약간의 감동이 굿굿  
20170904,10,코믹의 신 임창정 ㅋㅋ 진짜 믿고보는 영화예요  
20170904,10,가족이랑 봣지만 남친이랑 한번 더보려구요 ㅋㅋ 졸잼  
20170904,10,완전재밌어여 감동적인부분도있구..웃다가울다 그렇게봤네여구성의짜임새와 완성도면을 따지는걸 넘어서 그냥 자체가 좋은영화에여 따뜻하고재밌는그런영화  
20170904,8,예전 두사부일체나 이런 영화들 나오던 시절의 감성이 되살아나서 정말 좋았음. 간만에 영화적인 요소를 따지지 않고 본 가슴이 훈훈해지는 영화였음.  
20170904,8,관람객코믹요소가 재미있고 가볍게볼수 있는영화네요  
20170904,2,요즘 임창정 영화를 누가 보나. 공짜표였는데 중간에 나옴.  
20170904,5,시간대에 맞춰 보려다보게된 영환데 생각보다유쾌했어요^ ^청년경찰만큼이나 많이웃었던영화같아요~  
20170904,10,임창정 너무 좋다 연기하는데 왜케 실제같냐..  
20170904,10,아무생각없이 보긴했지만 상상 초월 꿀잼이였당  
20170904,10,임창정이 이렇게 매력적인남자일줄이야 ㅋㅋㅋ 사랑해여  
20170904,10,나름 짠한 감동까지.. 캬 시간 알차게 잘 만들었다  
20170904,10,큰 기대 안한거치고 진짜 재밌었다 계속 웃으면서 봤다  
20170904,10,찐한 감동과 웃음까지 선사하네요 대체적으로 좋았습니다  
20170904,10,감기걸려서 콧물이 자꾸 나는데 웃으면서 코 4번먹음 ..  
20170904,10,친구때매 보러가게된 영화인데 엄청 재미있더군요 ㅋㅋ  
20170904,10,조연들 연기보면서 진짜 노력많이했음이 보임  
20170904,10,장면마다 웃음코드 다양해서 젤 좋았다  
20170904,10,배우들 역할도 다 잘 어울렸고 임창정은 항상 최고당  
20170904,8,그냥생각없이 가볍게 생각하시면 개콘종합선물셋트정도? 잼있습니다 !  
20170904,10,와 꿀잼 ㅎㅎ 기대이상으로 웃기고 흘러가는 스토리도 좋았음  
20170904,10,의리가 중요하긴하지 ㅋㅋ 무튼 감동도있어서 재미 2배였네  
20170904,10,정상훈 연기 기대이상이였고 배우 모두들 연기 꽤 좋았움  
20170904,10,애들이랑 킬링타임으로 본다고 봤는데 생각보다 더 꿀잼이였다  
20170904,10,기대했던것이랑 비슷했고 나름 괜찮게 잘봤습니다~  
20170904,10,조연들도 나름 돋보이고 영화자체가 신선했어요  
20170904,10,돈안가깝고 진심 뿌듯해지는 영화다  
20170904,10,너무너무 웃겨여ㅠㅠㅋㅋ 잼나게봤습니다!  
20170904,10,시간맞아서 본 영화인데 엄청 웃다가 나왔네욬ㅋ  
20170904,10,가족영화로 보기에도 딱이네요  
20170904,10,임창정이 나오는것만으로도 웃김  
20170904,1,이정도면 진짜 관객모독이다 근데 웃는 색이들 있더라 ㅂㅅ들  
20170903,10,사실 임창정팬이라 무조건 봐야지 하고 기대는 없이 봣는데 요즘같이 폭력영화 살인영화 대중성영화만 나오는와중에 웃음+스토리까지 가족에대해 생각하고 내인생을 돌아보게된 영화  
20170903,8,"  단순한 영화 이지만. 코믹이 있으며, 순간 코끝 찡 ~  하게 만드는 영화.   웃고 즐기고 싶다면. 강추!  "
20170903,10,믿고 보는 임창정!!!재밌게 봤습니다  
20170903,10,관람객평점때문에 기대안하고 봐서 그런지 몰라도 강신일아저씨랑 임창정 너무 멋있고 재미있고 감동도 있었습니다  
20170903,2,관람객그냥 그저 그랬어요...임창정이 나온다길래 임창정표 코믹인줄 알았더니 그것도 아니고  코믹영화치곤 코믹이 별로 없어요....  
20170903,9,추천합니다.  후회는 안 합니다.  
20170903,8,해운대 판도라 타워 재난영화에도 눈물샘 자극 하더니코미디에서까지 하네ㅡㅡ 코미디로 시작했으면코미디로 끝내라  
20170903,10,마음 편하게 볼 수 있는 영화였습니다 ^^  
20170903,10,나름 신선했달까? 요즘 이런 스타일 잘 없자나여~ 옛 생각도 나고 무튼 잼나게 봤어여~  
20170903,10,피식피식 계속 웃게 하는 영화  
20170903,10,생각보다 빵빵 터지네여 ㅋㅋ 하하하  
20170903,10,"연기, 스토리, 재미, 감동 다 좋았어요  "
20170903,10,임창정 땜시 본건데 덕분에 실컷 웃었습니다  
20170903,8,그럭저럭 재밋게 본 것 같아요  
20170903,10,임창정식 코미디! 마냥 웃으면서 볼 수 있는 영화입니다  
20170903,10,촌스럽지만 그래서 더 재밌게 볼 수 있었던  
20170903,10,뭔가 우리네 모습을 우스꽝 스럽게 표현한 것 같아서 더 재밋게 볼 수 있었던 것 같습니다^^  
20170903,10,첨부터 끝까지 꿀잼 ㅎㅎ 제취향이네요  
20170903,10,재미없다는 사람들은 감정이 메말랏나봄  
20170903,9,의외로 감동도 있으면서 재미도있고 만족스러운 영화였어요  
20170903,10,걍 암생각없이 즐기면 되는 영화임  
20170903,10,엄마랑 같이봤는데 웃겨 죽는줄 알았네요 ㅋㅋ  
20170903,10,임창정 나오는 영화는 꼭 봐야죠ㅕ!!  
20170903,10,제법 감동도 있고 꽤나 볼만하네요  
20170903,10,임창정 특유의 코미디 연기를 보고 싶다면  
20170903,10,코미디 영화 답게 웃기네요 ㅋㅋ  
20170903,10,유치하지만 재미있어요ㅎ 임창정 연기 짱임 ㅋㅋ  
20170903,10,작품성은 그렇다쳐도 최근 본 영화중에서는 제일 많이 웃엇넹  
20170903,10,가끔은 이런 영화도 생각없이 보기엔 좋다  
20170903,10,정말 재미있게 잘봣어요 추석 가족 영화로도 좋을듯 한데.  
20170903,10,다들 연기 하나는 기가막히네여  
20170903,10,재미뿐만 아니라 뒤로 갈수록 감동과 슬픔이ㅠ_ㅠ ㅎㅎ  
20170903,10,가볍게 보기엔 딱~ 재밌기도하고 슬프기도하고 괜찮았어요  
20170903,10,임창정! 최고지 역시!!ㅎㅎㅎ  
20170903,10,오랜만에 느끼는 B급 감성ㅋ 재밋엇다  
20170903,10,진짜 안웃긴 시간이 더 짧을 정도로 웃깁니다  
20170903,10,역시 창정이형 최고 ㅋㅋㅋ기대안하고봤는데 존잼이엇음 ㅋㅋ  
20170903,10,호불호가 갈려 재미없을까 걱정했는데 제 수준에는 딱 좋았네요 ㅎㅎ  
20170903,10,간만에 극장에서 임창정씨 봐서 넘 좋았네요^ㅡ^  
20170903,10,다소 뻔한 내용이지만 임창정의 연기가 살렸달까? 덕분에 실컷 웃다왔다  
20170903,10,오랜만에 보는 B급 코미디 ㅋ 때로는 이런 영화를 보는 재미가 쏠쏠하다  
20170903,10,임창정과 공형진의 선택은 틀리지 않았다  
20170903,10,지루할 틈이 없네요ㅎㅎㅎ작품성을 따지기 보다 재미위주로 보시길 바랍니다~  
20170903,10,즐겁게 웃다가 나올 분들에게 강추  
20170903,10,부담없이 볼 수 있는 영화. 나도모르게 빠져들고있다..  
20170903,10,확실히 재밌는 있네요ㅋㅋㅋ 정상훈 임창점 콤비가 대박이에요 ㅋㅋ  
20170903,10,임창정표 코미디를 좋아한다면~  
20170903,10,유치한 매력에 끝까지 보게 되는 영화였어요  
20170903,10,재미+감동 모두 갖춘 영화! 오랜만에 스트레스 확 풀었네요  
20170903,10,머리비우기 좋은 영화랄까 ㅋㅋㅋ 너무웃김 ㅋㅋ  
20170903,10,주말밤 마음 편하게 즐기기 좋네요  
20170903,10,촌스럽고 유치하지만 재밌는건 인정ㅎㅎ  
20170903,10,오랜만에 실컷 웃게 해준 영화 ~  
20170903,10,소소한 재미와 감동이 있음55번 웃겨ㅋㅋㅎㅎ  
20170903,6,"명대사 : 사람은 미워하되 죄는 미워하지 말라, 다시 하겠습니다. ㅋㅋㅋㅋ 초반에 좀 어이가 없는 부분이 있었는데 코미디 답게 잘 넘겼습니다.  "
20170903,10,가족이랑 보러갔는데 보는내내 웃었어요 진짜 너무 재밌습니다 꼭 보세요ㅠㅠ  
20170903,10,솔직히 악평이 난무해서 걱정했는데 훨씬 재밌습니다 ^^ 역시 후기보고 영화 보지만 제대로 보지도 않고 안좋은 평 남기는 사람들때문에 묻히네요.  
20170903,10,관람객진정한 주인공은 55번 ㅋㅋ  
20170903,1,해핵노잼입니다...  
20170903,1,억지웃음 억지감동 억지연기  
20170903,6,좀더 코미디로 갓음 좋앗을듯  오랜만에 창정이형봐서  뭐 그럭저럭 볼만  
20170903,1,볼만하긴 뭐가 볼만해 임창정은 연기력에 비해 작품 보는눈이 없다  
20170903,2,감독님 예산이 참 많으신가봅니다 억지웃음에 억지울음에 끝까지 보기 좀 힘이 들었네요 휴;  
20170903,10,무대인사  예약하고 펑가가  박해 걱정을 했습니다  그런데 너무 재미있고  웃다가 눈물 났습니다   개봉전부터 나쁜  평가 이해가 안돼네요  청년경찰  로마의 휴일  모두 잼있습니다  
20170903,9,관람객꿀잼 창정이형은 믿고봐야함  
20170903,10,이런영화에서 뭔스토리를 기대하냐 애초에 창절이형 능청떠는거 보러가는거지 ㅋ  
20170903,5,관람객아무런 정보없이 관람..킬링타임 영화  
20170903,9,킬링타임용으로 굿!생각보다 너무 재밌다!  
20170903,10,"기대안하고 봣었는데,ㅎ 꽤 재미있더라구요,ㅎㅎ 꼭한번 보세요~  "
20170903,10,부탁인데 영화볼줄 모르면 눈깔 파내십쇼 오랜만에 잼있게 웃을수 있는 영화  
20170903,10,오랜만에 잼나게 웃었던 영화. 이 영화 재미없다는 사람은 몬가요??  
20170903,10,임창정씨 연기 역시 잘해여.. 무자게 웃겨여  
20170903,10,남는건 없지만 졸리 웃기다 ㅋㅋㅋ 코미디 영화가 웃기면 그만 아닌가?  
20170903,10,코믹면에서는 성공한영화~ 특히 55번이 인상적이었다  
20170903,10,기대치보다 훨씬 괜찮은영화  
20170903,10,이 영화를 보면서 나는 오랜만에 영화보는 즐거움을 마음껏 누렸다 !!!  
20170903,10,즐겁지만 어설픈것도 약간있다. 그냥 가벼운 즐거움  
20170903,10,이렇게 많이 웃었던 영화는 없었습니다  
20170903,10,임창정표 코미디 괜찮아요.. 스토리 전개는 좀 부실한 듯…  
20170903,10,보기전 많이 망설였으나 보고나니 기대이상 보세요 후회는 안함  
20170903,1,하..진짜 영화도중 나오고싶었다.최악의 영화 ..보는 내내 한번 '피식'한 영화  
20170903,10,임창정식 코미디의 정의를 내렸다 코믹하네!!  
20170903,10,약간의 억지스러움이 있긴 하지만 조연들이 감칠맛 나는 영화 55번 대박  
20170903,10,"허무하긴 하지만,,, 재미있고 감동?적이다.^^  "
20170903,10,생각없이 보면 꽤나 좋은영화인듯^^;  
20170903,10,"재밌었다,,,임창정 한국의 아담샌들러  "
20170903,10,능청스러운 임청정의 연기 ㅋ 마무리만 잘됐으면 참 좋았을텐데  
20170903,10,한번보고자지러지게웃으면되는거지!  
20170903,10,그냥 재미를요한다면 봐라 여운은없다 ㅋㅋ  
20170903,1,코미디 영화인데도 보는내내 관객석에서 웃응소리가 안남ㅠㅠ    웃기지도 않고 감동은 어설프고ㅠㅠ  돈 아까비  
20170903,3,덕분에 7000원에 대관했네요 감사합니다  
20170903,2,임창정팬이라서봤는데....이건뭘까웃기지도않고..멍때리고봄~~~할말이없네여 ㅜㅜ  
20170903,1,제목에서부터 느껴지는 b급 3류감성 영화도 역시 총체적난국  
20170903,5,"관람객웃음과 감동, 스토리와 개연성도 휴일이었다.  "
20170903,10,킬링타임으로 추천  재미있다  
20170903,10,재미감동 둘 다  있네요~  
20170903,1,돈이 아까운 영화...  
20170903,1,제목부터 감히 오드리헵번의 명작 로마의 휴일하고 똑같이 중복으로 짓는거부터 ㅂㅅ같다 그렇게 이름하나 못짓냐  
20170903,6,안타깝다. 이제 개봉 3일 되었는데 영화관이 없다. 이런거 보면 배급사가 얼마나 중요한지...  
20170903,10,기대않하고 봤는데 정말 재밌게 봤네여 마지막에 애틋한 여운도 느껴지고...  
20170903,8,처음에 너무 기대를 안하고봐서 그런지 예상치도 못한 전개랑..웃음과 감동과 눈물이ㅠ..아무생각없이 웃고울면서 마음편하게 봤어요!연기자들 연기도 짱  
20170903,10,시사회보고댓남겻엇는데 알바아니에요 ㅋ.ㅋ 좋은말만쓰면 다 알반가~~~~ 지들이 괜히 댓글만믿고봣다가 지네맘에안드니까 바로욕하네 ㅉ ㅋㅋ 불쌍행~~ ㅠㅅㅠ  
20170903,10,좀 오글거려도 웃기긴 했으니ㅎㅎ재밌긴합니다  
20170903,10,관람객너무재미잇고감동잇게봣습니당  
20170903,1,제목이 '로마의 휴일'이 뭐냐~양심도 없냐!!!!  
20170903,1,청년경찰이 더 잼있네~~  
20170903,10,관람객진짜 완전완전 자미져요  
20170903,10,너무재밌고 배우연기에빠졌습니당ㅎ이영화를보고 웃기도많이 웃고 찡..한마음에 눈물도흘릴뻔햇습니당ㅎ너무재밋게봐써요!! 안본사람들 한번쯤봐도 나쁠거 없네요ㅎㅎ그리고영화안좋게비판하시는분들 많은거같은데 제작한사람과 열심히 연기해준배우들에게 마음상처주는거같네요..  
20170903,5,유치한데 볼만해요 ~^^  
20170903,10,가볍게 보기좋고 저는 재밌었어용 헤헤  
20170903,10,다들 표정도 그렇고 코믹연기 웃겼다 ㅋㅋ 그중에서도 임창정님..  
20170903,10,간만에 코믹요소들 진정 뼈저리게 재밌게 느꼇다잉  
20170903,10,오 코믹제대로 보여줌 글고 막판에 기분좋게 만들어줌  
20170903,2,킬러의 보디가드보고 바로 봤는데 B급영하보는거 같네요연기력 비교되고 영화 내용도 별로임그냥 임창정 팬들만 좋아할거같고 아니면 지루할거같아요  
20170903,10,가족이랑도 부담없이 즐겁게 볼수있는 영화였어요^^  
20170903,10,이것은 강추다 일단 배우들 연기좋고 감동도 팡팡임  
20170903,10,회사사람들이랑 봤는데 스트레스가 풀리는 느낌이었음 히히  
20170903,10,재밌게 잘봤어요 ㅎㅎ 사람들이 괜히 보라는게 아니네요~  
20170903,10,오 이거 완전 재밌는데 ? 생각보다 진짜 꿀잼 허니잼  
20170903,10,기분전환으로 딱이었던 영화였네요 ㅎㅎ 잘보고 갑니다  
20170903,10,자동차극장에서 여친과 별 기대없이 봤는데 중간중간 빵 터지는부분이 있네요~ 스토리는 조금 아쉽지만 출연진들 모두 연기가 맛깔나서 재밌네요~^^ 추천합니다~  
20170903,10,진짜 재밌는데... 창정횽 연기는 역시 ㅋㅋ  
20170903,10,그냥 임창정이라 10점준다다시 감 찾았구나 임창정 형 많이 실망했었어 앞으로 잘하자  
20170903,10,임창정씨의 영화는 언제나 유쾌하고 감동입니다^^ 방금 보고왔는데 속시원한 장면에 웃다가 애기엄마 아들만나는 장면에 한번 인한이가 바다보며 우는 장면 마지막 동생과의 통화 장면 세번 울었네요....ㅠㅠ손수건 챙겨가세요 배우분들의 연기가 너무 좋았습니다.  
20170903,2,시간가는줄알고봤다....  
20170903,6,일로 받은 스트레스를 이 영화로 풀려했던 과장님에게 스트레스를 더 안겨준 영화.  
20170903,1,나에게 시간을 돌릴수 있는 능력이 있다면 선택하지 않았을 것이다...  
20170903,10,관람객가벼운 마음으로 우스면서도 마음 한켠 찡한 느낌을 지울수없는 참 괜찮은 영화. 믿고 볼 수 있는 역시 임창정.  
20170903,10,유쾌한영화 뒤로 갈수록 더 잼있네요 ㅋㅋㅋ  
20170903,7,가볍게 웃고 오려고 했는데 살짝 울리기 있기 없기?!  
20170903,9,진짜 개그랑 창정이형이랑 주연들이 다 연기잘해줘서 좋았고 퀄리티가 좀 떨어지지만 엄청재밌어서 집가서 예고편 봤는데 역대급노잼으로나오더라..진짜 예고..ㄹㅇ못만들었더라..그리고 25번 개이쁨  
20170902,1,거지 같은 영화. (10자)  
20170902,1,태어나서 평점 처음 작성해봐요 댓글 알바한티 낚였구요 포스터 부터 너무 싼마이길래 뭐지 했는데 영화 구성 화면 배경음악 까지 진짜 싼티나고 재미없어요 억지구성 억지감동 억지눈물 진짜 보면서 앉아있기가 끔찍한 영화였습니다 아 청년경찰볼껄  
20170902,8,설날이나 추석때 특선 영화로 나올거 같은 ㅎㅎ재밌었어요ㅋㅋ  
20170902,9,잼나게 웃다나왓네요 조연들의 코믹 엄지척입니다  
20170902,5,임창정 한물갔네 예전같으면 백만은갈텐데 십만도 힘들것네....  
20170902,1,진부한 스토리~ 억지 감동ㅠ  
20170902,1,"좋은 배우 분들 데려다 이상한 영화 만드셨네요 범죄 미화 영화의 전형이라고 볼 수 있겠네요 범죄 미화 그 자체입니다 그리고 감동과 재미를 급조한 티가 나는 것 같습니다 장면 장면 , 대사 한마디 한마디 뭔가 어색하단 뜻입니다 불편했고 상당히 아쉽습니다  "
20170902,8,그냥 진짜 기대 없이 가볍게 웃고 즐기기에 좋아요ㅋㅋㅋ약간 2000년 초반으로 돌아간 느낌이 드는데 그것도 나름 매력 있어요ㅋㅋㅋ  
20170902,9,믿고보는 임창정영화        역시   가슴찡하게  울리는  엔딩20분    눈물이 주르륵        브아피보다    감동백배 ㅎㅎ   잘봤어요  
20170902,10,"재미로 시작되어 가슴 뭉클해지며 눈물을 훔치게 되네요. 영화 종료후 갑작스런 출연진의 무대 인사와뜻밖의 상품권 당첨으로 더욱 잊지 못할 영화가 되었네요. 임창정의 감정선, 공형진의 코믹함, 정상훈의 연기력이 어우러져 있는 감동있는 영화입니다. 추천!  "
20170902,8,"솔직히 이런영화 기대하고 보는게 잘못이지 그냥 맘비우고 봐서 그런가 재밌었음 ㅋㅋ ,근데 다끝나고 여친이 영화에 대해서 말 한마디도 안함 ㅋㅋ ㄷ..  "
20170902,1,이 영화를 끝까지 본 나에게 박수를 보낸다  
20170902,1,창수에서허탈했고 로마의휴일에서 영원한 휴식을 취하고싶었다창정이형님 시나리오좀 보고 영화좀찍으시길....이건 뭐 킬링타임이라고할수없고 영화를보면서 다음씬을 예측할수있는 능력자가 되엇다.  
20170902,8,영화는  처음부터 끝까지 웃음유발 포인트가 있으나 그냥 미소정도?? 중간중간에 터지는 부분은 재밌어요 추천해요 끝나려면 멀었나??싶을때 끝납니다ㅋㅋ저는 재밌게봤어요  
20170902,8,간만에 영화관에서 재밌게 웃고 가네요  
20170902,10,재미지다 ㅎㅎ창정형님 쥐기네 ㅎㅎ  
20170902,1,끝까지 자지않은 저에게 박수를 보냅니다 기승전결도 없고 개연성도 없고 재미도 없고 흔한 신파극도 최악이에요  
20170902,10,웃기고 슬프고 어이가 읍당  
20170902,1,보다가 도중에 나옴..별한개도 아깝다는 생각이..  
20170902,10,"웃음코드가 약간은 올드한 것 같지만 그래도 가볍게 보기에는 좋은 영화입니다. 끝으로 갈수록 점점 훈훈해지는, 웃음과 주연들의 여러 사연이 잘 어우러지는 것 같아요~~  "
20170902,9,생각보다 유치하지 않고 볼만하네요코믹감동~  
20170902,8,웃음과 감동이 배우들의 연기로 적절하게 녹아들어있네요  
20170902,10,창정이형 간만에 멋있는 역할 맡으셨네요 ㅋㅋ 재밌고 킬링타임용으로는 추천할만 한 것 같아요 ㅋㅋ  
20170902,10,가족과 함께 보기에좋았습니다^^추천합니다  
20170902,1,2017년 최악의 코미디 영화  
20170902,10,관람객너무 웃겨욬ㅋㅋㅋ진짜 개웃김ㅋㅋ  
20170902,2,1시간48분이 3시간 같았다 중간에 나가지 않고 끝까지 버틴 나의 인내심에 박수를  
20170902,8,중간중간 웃으면서 재밌게봤네요~  
20170902,1,제목 보고 재개봉인 줄 알고 들어왔더니... 낚였다;  
20170902,3,55번 연기만 기억난다  
20170902,10,오랜만에 재미있는 영화 봤습니다. ㅋㅋ솔찍히 올해 본 영화중에 저는 가장 괜찮게 봤네요..택시운전사나 덩케르크도 생각보단 별루..옛날에 시실리 2km 생각하시면 그것보다 더 재미있었습니다.마지막 엔딩도 훈훈하고 저는 가슴 따뜻하고 좋았습니다.  
20170902,8,"임창정 배우겸업.날로 연기를 감동있게  보여주네요 배우로 전업해도 되겠지만   음악도 너무감동있게  잘하니가수도 소홀이 안했으면 해요 /날로좋은연기에  강편이되어갑니다  힘내시고  좋은연기,좋은노래 기대해봅니다  그외연기자분들도  어우러저감동...  "
20170902,7,어색한 웃음코드와 뻔한 내용전달력면에서는 다소 아쉽네요. ..킬링타임용으로는 오케이!  
20170902,10,임창정과 정상훈 그리고 공형진이 빛나보였다!!  
20170902,10,평믿지마시고 보세요 너무 감동적이면서 잔잔한 웃음이 관람 포인트였습니다  
20170902,10,생각치못한 부분에서 완전 웃음터진영화 ㅎㅎ 재밌었음돠  
20170902,7,관람객아쉬운느낌이매우드는영화  
20170902,10,웃음과 슬픔이 동시에 .. 울다가 웃다가 했네 ㅋㅋㅋ  
20170902,10,창정이형 역시 연기잘해 ㅎㅎ더 팬될것같아  
20170902,10,스릴도 있고 웃기고 이런 영화 또 제작해주셈  
20170902,9,생각보다 정상훈 웃겨서 좋았다 다른배우들은 말할것도 없공  
20170902,10,배우들 연기도 지렸고 웃긴것고 지렸고 ㅋㅋㅋ  
20170902,10,지루함 1도없었당 완전 내스타일 영화 !! 핵잼  
20170902,10,전개도 자연스러우면서 재밌게 잘 흘러갔던거같음  
20170902,10,웃음터져서 민망할정도 ㅋㅋㅋ임창정 매력에 홀릭됬다..  
20170902,10,드라마같이 편하고 생각없이 보면 완전 재밌음 ㅎㅎㅎ  
