0,1,2
20170925,1,"이걸 어떤넘들이 보고 평점줬기에 7점대 후반이냐??? 와... 30분만에 껐다..감독색이야...다시는 영화만들생각마라...""창수""부터..참..창정아 이감독하고 인연끊어라..  "
20170925,3,임창정은 이제 진지하게 나오면 안어울림  
20170925,1,심형래가 정말 대단한 영화 감독이었구나.  불법 다운로드 받은 '로마의 휴일'을 단 10분 보고 지우면서  절실히 느낀 점.  
20170925,2,"우선 감사의 말씀을 드립니다.집에서 만원주고 결제해서 보았습니다.불면증으로 인해서 잠을 잘 못 이루고있었는데 한40분 보다가 숙면을 취하게 되었습니다.8,90년대 같은 스타일의 영화...ㅎㅎㅎㅎ 이튿날에도 다 못보고 또 잠이들어습니다.감독 만나고싶어요  "
20170925,7,킬링타임용! 마음놓고 보시면 재밋어용  
20170925,10,잼있습니다. 혼자만 볼수 없네요. 같이 봐야죠.. ㅜㅜ  
20170925,10,심심할때 보면 소소하게 웃김  
20170925,7,웃긴거 기여도 알려쥼. 1.창정신 2.55번.3.주방장.4.재벌3세.5.지배인....여기까지 보내줄께 나머진 빠따맞게 엎드려 ㅋ  
20170925,1,"이 영화를 보는 내내 느낀 감정은 웃기다, 슬프다, 감동적이다가 아닌 민망하다 였다 ... 정말 민망하다 ... 스토리, 배우들의 연기, 개연성, 모든 장면 하나하나가 전부 민망한 영화 ... 보면 안다 ... 보는 내내 그냥 손발이 오그라든다 ...  "
20170925,3,90년대에 나왔어도  성공하긴 힘든영화 소소하게 웃기지만 그게 다인영화  
20170925,1,참... 진짜 ㅅㅂ 10자  
20170925,10,인생의 최고의 영화 우리나라의 실세를 알수있었고 또한 따뜻한사람도 아직 많다는걸 알았다 이런영화가 또있었으면 좋겠다 배우들의 배역이 하나하나 다좋았다 화이팅  
20170925,1,임창정만 믿고 영화관 간건데...ㅠ  시나리오와 연출에 배신당함  
20170924,6,코미디와 드라마 사이의 어딘가 걸쳐 있고 인상적이진 않다.  
20170924,3,아... 음... 이거 왜 봤을까.. ㅠ  
20170924,10,"나는 나쁘지 않게  봤음  폐급 영화는있지만 이건 ""쓰레기 정돈""아니라는거  "
20170924,8,관람객구성이 특이하고 재미잇어요  
20170924,1,"90년대 코미디 영화..손발이 다 오그라듬..임창정을 좋아라해서 보았지만, 이건 아니다 싶음...  "
20170924,7,다들 연기는 잘하는데 시나리오가 조금 더 좋았음했던영화  
20170924,6,식상하고 진부하다. 하지만 모든 영화가 예술일 필요는 없지. 이 영화를 보러가서 설마 대부를 기대한건 아니겠지?  ps. 임창정 최고의 코미디는 색즉시공보다는 위대한 유산!!  
20170924,10,관람객너무재밌고 또한 배우분들도 간단한시사회좋았어요  
20170924,8,솔직히 킬링용정도보단 볼만하구 나름 잼있구만감동도 있고..볼만함 다들 별로라길래 첨 올려봅니다역시 임창정...  
20170924,7,임창정 영화 특유 개그코드가 맞으면 10점 아니면 5점! 저는 쏘쏘라 7점! 그래도 재밌습니다 킬링타임으로딱!  
20170924,10,재밌는데 평점이왜이러지?  
20170924,10,댓글알바도아닌  새벽에 안복잡한영화 찾다가 보게됬는데  뭐사람들이 코미디를  따지는데  그런쪽영화는 아닌듯싶고  교훈을주는영화같네요 뭐 간단하게 아무생각없이 보기좋습니다  
20170924,8,"평점이 워낙 낮아서 기대 안하고 봤는데 생각보다 재미있게 봤네요~ 소소한 웃음 소스들도 있고, 예상되는 결말과 전개들이였지만 가끔 터지는 코믹 멘트들이  영화를 살린듯했네요~킬링타임용으로 딱좋아요  "
20170923,3,"노래는 잘 하는 임창정인데, 영화는 선택하는 것마다 이런 것만... 항상 B급 코믹 위주로만... ㅠ.ㅠ  "
20170923,10,평점 테러 때문에 10점 줍니다. 치외법권이랑 비슷하게 예상했다면 큰 오산.  
20170923,6,흠 별로 재밌지는 않네요...  
20170923,6,다른 잔인한 영화들관 달리 범인이 생각보다 착해서 놀람ㅋㅋ인질들을 풀어주고 다 먹을것도 주고한우는 웬말 부럽다ㅜ벌로 재산 절반 기부라닠ㅋ 진짜 착한듯반장님 귀여워요!  
20170923,8,동네북 55번때문에 8점드립니다 55  
20170923,7,고기먹다가 가끔 된장찌개가 땡길때가 있지.  
20170923,10,"초반에 B급 저질 영화인 줄 알았는데, 보면 볼 수록 저예산으로 저 정도 그래픽과 시나리오에 감동. 나름대로 돈과 잘못된 사회 구조를 꼬집어 주는 블랙코미디 영화로  재밌게 봄. 임창정의 창수 이후로 진지하지만 약간의 코미디가 가미된 캐릭 연기 쩜.  "
20170923,1,공장에서 만들어진 돈까스 튀겨주는 느낌. 신선함도 특이함도 없음.  
20170923,6,관람객기대치가 커서 그런지 생각보다는 별로였습니다.  
20170923,10,잠시나마 돈 현실을 떠나 힘겨운 지금의 내게 웃을 수 있게 해 줬다...  
20170923,1,2017년에 이런작품이 나올 수 있다는것에 경악을 금치 못했다.  쌍팔년도로 타임머신  타고 돌아 간 듯.. 감독은 영화 찍지마세요.. 진지합니다.  
20170923,7,팔팔정 삽니다 두알이요  
20170923,1,진짜 200년초반때 삼류영화 생각하고 영화조만들지?  
20170923,5,55번만 남긴 영화 ㅋㅋㅋㅋ  
20170922,4,휴일 수당 1점 더 챙겨 드릴게  
20170922,10,재밌고 감동도 있는데 평점1 머임 ?? 내가 기대 안하고 봐서 재밌나 ? 평점1들 보고 별론가 했지만 잘봤다는 생각이 든다  
20170922,4,창정이형 넘 좋아하는데.... 이건 좀 아님  
20170922,2,솔직평점. 스토리가 너무 재미없다. 창정이형 보로온거지.. 너무 유치하고 차라리 시실리2를 찍지 ㅋㅋㅋ 소풍왔어? 그때 너무 웃겼는데  
20170922,10,알바 아니고 난 개재밌게 봤다 울기도 울었고 ㅠㅠ 역시 임창정 영화는 웃기면서 따듯해  
20170922,8,나름 킬링타임용으로 볼만했어요다양한 조연분들 재미는 덤인듯한번쯤 보셔도 나쁘지 않습니다~  
20170922,10,난 괜찮은데 올드하지만 이정도면 괜찮지  
20170922,5,관람객한장소에서해서그런지 살짝 지루하네요  
20170922,1,보기 전에 실관객들 평점봐서 다행. 안보기로 결정. 그럼에도 1점 주는건 알바들 대응용  
20170922,1,아직도 90년도 C급 영화를 만드네 창정이가 요즘 안되는게 이런영화만 출연해서그럼  
20170922,3,"뜬금 바깥으로 나오게 해주는건 뭐냐?? 아무 앞뒤 설명도 없이??? 두서없는 연출, 부족한 코메디, 마지막 어느나라 언어야  "
20170922,1,고막 조심하세요총 막쏘다 창정이형 소리질러요  
20170922,1,시나리오 임창정이 쓴줄...  
20170922,7,그냥 코미디일 뿐 모든 것이 비현실적인 설정.  
20170922,3,총알이 넘 많타...열심히 하는 배우는 많음  
20170922,2,장르를 뭐라 해야하나 이 영화는...  
20170922,10,요즘 개봉한 영화들보다  훨씬 좋은데~  
20170922,7,청년경찰보다 오히려 좋다.  
20170922,10,55번~~ㅋㅋ나성기 ㅋㅋ둑여 일어나OOOO 벌려 ㅋㅋ  
20170922,8,시사회 봤었습니다. 개봉 영화를 보니 짤린게 많네요  
20170922,8,인맥이 좋구나 .. ㅋㅋㅋ  
20170921,5,너무한다 너무해 이게 될거라 생각했다는데 놀랍다  
20170921,10,"코미디 영화가 아니다. 그래. 기자도, 비평가도 무시하고 실제로 엉성하고 유치하지만 난 이 영화가 슬프고 따뜻하다.  "
20170921,10,장난아닙니다.배꼽돌려주세요 ㅋㅋㅋㅋ  
20170921,10,그래도 재미있게 봤는데 뭐가 노잼이라는건지 그냥 재미있게 봄  
20170921,1,와 이게 뭐지 역시 창수감독님 영화좀 그막찍어요  
20170921,2,별점 하나주면 ㅅㅂ 안보고 테러한다 생각할까봐 2개는 주고 욕한다. 90년대에도 안먹혔을 졸작 영화다. 여기 출연 왜한거냐 거물들이 에휴  
20170921,3,생각했던 것 보다 너무나 기대이하.아무리 영화지만 현실성도 없고 웃기지도 않고...차라리 최성국의 구세주가 더 웃김.  
20170921,10,가벼운 마음 으로 볼수 있는 영화 잼있고 슬프고..7번방..하모니..이런영화..개인적으로 택시보단 잼있게 봤음  
20170921,7,말도안되는 내용이지만 픽션으로 시간때우기용으로는 볼만한정도인거 같은데요...님들 영화를 현실과 너무 동실시하는 경우가 있음..만화는 만화고 영화도 걍 영화일뿐이에여  
20170921,1,영화가 창렬스럽네 ㅋㅋ 매일 창렬이랑 술 뺄더만 영화가 말도 않돼! ㅋㅋ  
20170921,6,임창정 광팬으로써 본 영화인데 솔직히 돈주고 보기는 좀 그렇다  
20170921,4,내가 갓창정형 진짜 ㅈㄴ좋아하는사람인데 영화 너무 망작이더라.. 킬링 타임으로는 그냥 중간중간 웃긴부분도 있어서 보긴했는데.. 임창정너무 안어울린다...깝죽거리고 욕하고 나대거나 시원시원스러운게 창정이형 매력인데 시종일관 무게잡고 노잼이였다..  
20170921,1,긴급조치19호 이후로 없을줄 알았는데?  
20170921,9,나름 볼만했는데 코믹영화는 생각없이 봐야지 간만에 정석코믹영화 본듯  그러나 초반코믹 막판 신파는 진짜..좀 이제좀 지루하긴함  
20170921,10,재밌는데 ㅈㄹ들이네ㅋㅋ  
20170921,3,공짜로 보긴했지만 절반 보다가 포기했다..ㅎ  
20170921,3,임창정 정도의 네임벨류와 연기력 갖춘 배우가 이런 영화는 왜 찍으신 거에요? 네? 왜에??  
20170920,2,딱 20년전 스타일의 코미디.... 이거볼 시간에 박중훈 투캅스나 할렐루야 다시 보는게 더 재밌겠음. 임창정은 시나리오 보는 눈을 영원히 못키울듯. 이정도면 감독배우 모두 관객에게 미안해해야함.  
20170920,2,임창정이라서 봤지만 b급 코믹물이라고 생각하고 킬링타임용 영화로 그냥저냥 볼만합니다.  
20170920,10,재미있다가 나중에 감동! 제목처럼 휴일같다. 힘든사람들 모두의 휴일! 아무리 힘들어도 선과 악은 구분해야하는 것 같다. 임창정이 영화안에 역할에 나왔던 강인한이 사무치도록 가슴아프면서도 멋있었다!  
20170920,1,ㅋㅋㅋㅋ 창정이형짱!  
20170920,6,관람객기대에 못미치는군요 ~ 서운하네요~~  
20170920,4,임창정이 출연한 이유  =  감독과의 의리 때문에....or  돈이 궁해서....  
20170920,3,이거 본다 했다 욕먹은 나는 무슨죄야..  
20170920,5,임창정과 공형진을 감독이 추락시키다  
20170920,5,감독  이새끼  두번다시  영화 만들어  좋은배우들  망치지말자     임창정 명배우때문에  5점준다  
20170920,10,간만에 웃고  편하게 본 영화같네요~ ㅎ  
20170920,10,코미디영화로써 만점드림 첫장면부터웃긴데 좋은배우들로 더재밌음 코믹영화에 연출력찾는 정신병자들은 시청하지말길 바람.  
20170920,2,댓글 알바들 봐라.. 이게 10점짜리라고..?  
20170920,1,관람객진짜 농담안하고 그냥그래  
20170920,1,역대급 졸작...1990년대로 돌아간듯~  
20170920,1,웃으라고 만든영화인데 웃음이 한번도 안나와  
20170920,9,큰기대 안하고 보면 재미있는영화인데 너무 기대를 많이해서 실망하는듯... 초반에 너무 몰입감 떨어지는거 말고는 재미나게 봤습니다.  
20170920,9,한국판 미스터 맥도날드랄까? 영화답게 눈으로 보고 웃고 싶으면 보시길 유머코드가 내 스타일ㅋㅋㅋ  
20170920,3,"창정이형 취미 : 노래로 번 돈, 영화로 탕진하기  "
20170920,3,90년대 유행하던 영화풍...다시보니 민망하고 유치해서 못보겠다...  
20170920,10,잼있기만 하구만ㅋㅋㅋㅋ  
20170920,1,"그냥 3류 xx기 영화...ㅡ,.ㅡ  "
20170920,10,ㅈㄴ개웃기네 웃긴배우 셋모아놓고 휴먼코미디 감동도있고 ㅋㅋ킬링타임용으로봤는데 나름 훈훈했다 ㅋㅋ존웃 ㅋ55번불쌍 ㅋ나성기랑 ㅎ부둣가 ㅅㅅ녀 존예  
20170920,10,"코믹성,감동 기대안하고봤는데 생각보다재미있네요 창정이형 연기일품이구요시간가는줄모르고 잘 봤습니다.강도후계속도망다니는게 아닌 초반에 건물에 고립후 끝날때까지 인질극 하는상황은 조금 지루하게 다가올수도있겠네요  "
20170920,7,?최소 7점 이상의 영화다 3명의 연기 케미 굿이고 코믹과 감동이 짱!!!  
20170919,7,관람객생각보다 재미없었음 중간중간에만 웃기고 좀 지루함  
20170919,1,2017년 국내외 통틀어서 최악의 영화 1위  
20170919,3,임창정 영화의 특징은 변함없는 지겨움. 웃길려는 진지함속의진부함. 한소영 예뻤다.  
20170919,7,ㅋㅋㅋ 비급영화로 재미있었다내생각인데 이런 영화는 감독이 욕심부리지말고이벤트던뭐던해서 반값으로개봉해서정말 간단한 킬링타임으로가서봐도좋을듯그럼 이런영화나 배우좋아하는 사람들 큰화면으로보고 서로좋자나ㅎㅎ  
20170919,7,관람객잘봤어요 걍 쏘쏘~~!!!  
20170919,1,창정이형 감독이랑 의리는 적당히 지키세요. 본인 생각도 해야죠  
20170919,1,감독과 임창정 의리로 찍은 영화인가... 믿고 보는 임창정 영화 역대급 흑역사... 이젠 임창정 영화도 걸러봐야할것 같다.  
20170919,1,본지2분 바야하나싶다  
20170919,1,진짜 너무 재미없어서 빵 터졌습니다. 그래도 저에게 웃음을 주긴 주네요. ^^ 너무 어이없어서  
20170919,1,OOO기 핵페기물 영화  
20170919,8,"킬링타임용으로는 재미있습니다. 시간 금방 가네요..이런 영화에 내용이 부실하다느니, 자기가 써도 더 잘쓰겠다느니 하는 놈들이 왜 이런 영화 선택해서 봤는지 이해가 안되네..  "
20170919,1,확실히 리얼못지 않았다  
20170919,5,정말 영화 내용이 어이가 없어서 웃음이 나옴. 그냥 B급영화로 만든거같은데 진짜 아무 생각 없이 보다보니 재미는 있었음 ㅋㅋ  
20170919,5,"후반에는 안타깝기도 했지만, 전체적으로 재미는 그닥...  "
20170919,1,그시간에 잠을자는게 이로운영화  
20170919,1,"감성으로 모든것을 용서하고, 벌을 주는 논리적이지 않고 다른 사람들 또는 자신의 기분으로 모든것을 단정짓는 나라는 결국 멸망할 수 밖에 없습니다. 정신을 차리고 죄를 지으면 벌을 주고, 이성적으로 세상을 보는 힘을 기르기를 바랍니다....  "
20170919,10,역시 코미디영화 천재 ~ 창정이형 !!  
20170919,10,"임창정, 정상훈~~ 좋아요~!!  "
20170919,2,저정도 배우들을 쓰고 이정도 수준으로   만드는것도 능력이다시나리오를 유치원 사생대회에서 구한듯  
20170919,5,대놓고 B급으로 찍은 듯. 촬영이나 편집이나 모든게 B급. 그나마 임창정 연기력 정도가 평타였고 나머지는 완전 B급 영화.  
20170919,4,영양가없는영화지만 아무생각없이 볼수있는 영화  
20170919,1,한번을 못웃기네 . ...  
20170918,1,공형진이 다 망쳐놓는영화 짜증나게함  
20170918,9,창정이형 영화는 이래서 본다. 웃고 싶으신분 보세요  
20170918,5,"웃기긴 했지만,  개연성과 편집 같은 것이 조금 아쉬웠다.  "
20170918,10,나름 괜찮었어요 7번방의 선물보다 낫습니다.  
20170918,10,재미있으면서 마지막에 뭔가 뜬금 감동  
20170918,1,공형진 보면서 너무 짜증이나고 답답해서 못 보겠다  
20170918,1,창정이형  영화 극장에서 못보고  올레티비로  봤는데  39분만에  껏습니다  
20170918,1,킬링 타임으로 봤는데도 화나는 영화  
20170918,2,왠지 이 감독이 전쟁영화를 찍으면 '김병장 위험해~~!!' '선임하사님~~!!' 뭐 이런 대사가 떡칠될꺼같다 임창정때문에 별 한개준다  
20170918,1,요즘 성룡코미디 영화 보고나면 이런 기분 들더라.  
20170918,10,관람객아주좋아오ㅡ 재미있음  
20170918,1,극장에서 관람한 사람들에게 위로를 전합니다.ㅋ  
20170918,1,주연 조연 단역 다 좋은데시나리오와 감독이 문제다  
20170918,10,킬링타임용으로 재밌음!ㅋㅋ  
20170918,10,임창정 코메디 영화 취향저격 입니다.코메디 영화에 왠잣대를 그리 들이대십니까??  
20170918,6,음.. 음.. 하아.. 범죄자와 범죄자를 도와주는 형사? 범죄자를 미화하며 감동과 깨알재미를 주려하나 별로... 90년대 영화 재개봉 느낌인데 이거 극장에서 하는곳이 있나요? 평점 8점은 문제가 있네요.  
20170918,1,이런 영화에  투자한 투자자가 궁금하다.  
20170918,10,ㅋㅋ편하게 웃으며보기좋은영화 잔잔한감동까지 그냥 편하게 보기조아여  
20170918,10,10점까지는 아닌데 평점이 너무 낮아서 10점 줍니다 장르에 충분히 충실한 영화였지만 마지막에 한국영화 고유의 억지 감동코드가 조금 아쉬웠습니다 왜 꼭 한국 코미디 영화의 결말은 감동이 들어가야하는지..  
20170918,8,장르에 충실 했구만 뭐.  
20170918,1,감독이 OO인것 같네요재미진걸 다 스킵하고 뭘 담으려는지 모르겠어요시간아까워요 보지마세요  
20170918,8,갠적으로 시간투자해서 볼만했음  
20170918,10,가볍게 볼 수 있는 내용. 훈훈한 내용이다. 배우들 모두 연기를 너무 잘한다. 가끔은 살짝 유치하지만 가슴 따스한 스토리 영화도 좋음!  
20170918,10,재밌는데 기자들은 코메디서 뭘 바라는거야? 기레기들 고상한 척 하긴  
20170918,5,이영화 장르가 뭐에요?  
20170918,6,"소재 너무 좋은데 연출 편집이 아쉽다..덴젤 워싱턴 주연 ""인사이드맨"" 이 생각나네요~  "
20170918,7,나쁘지는 않구만...  
20170918,1,10분도 안봤다 왜그랬을까...  
20170918,4,"창정이행님 왜이런 OOO 영화를찍으심??주인공역활도 누구나소화할수있는 배역을 맡아서,,  "
20170917,5," 언제부터인지 코미디후반에 신파극을 억지스레 넣는게 정석처럼되버렸어..  그런의도였다면 색즉시공이 딱이었다. 같은임창정이란 배우였고 훨씬더 유쾌하고 눈물도흘렸으니...   한편, 부동산양아치 부인이 안성댁이란걸 나중에알게되니 반갑기는했소이다~ㅎ  "
20170917,10,생각하게 만드는 영화였어요..! 평점 다는거 안해봤는데 생각보다 평점이 낮길래.. 너무 좋았다라는 의견을 추가합니다 :) 따뜻한 영화에요  
20170917,1,우와.. 이게정녕2017년 개봉작이 맞나요?보고있는데 기가차서.. 90년대로 순간이동한거같네여ㅎ옛날 삼류 코메디물이라 웃을타이밍을 못찾겠네요.. 90년대 코메디물 좋아하는사람들은 보세요ㅋㅋ영화관에서 안본게 다행인듯  
20170917,3,기대치를 낮춰서 본덕에 그럭저럭 보긴 했지만 그래도 혹시나 하는 마음이 있었나 봐요...중간 중간 한번씩...탄식...그리고 후반부에는 몰아치는 탄식....하...저렇게 밖에 연출할수가 없었나...(그레도 피식 피식 할때는 있었습니다.)  
20170917,1,창정이형 왜 스스로 자신의 가치를 깎아내리는지 이해불가네  
20170917,10,진짜리얼잼잇게봄짱짱  
20170917,1,진심 이배우 라인업 만 보면 겁나 웃길거 같은대 이배우 라인업을 망친 이영화가 이상하다  
20170917,10,관람객올해 최고의영화입니다ㅋ 말이 필요없어요 그냥 당장보세요ㅋ  
20170917,7,창정이형 좋아서 7점줌 아 근데 55번 ㅋ.ㅋ.ㅋ.ㅋㅋ.ㅋ.ㅋ.ㅋ  
20170917,3,"영화초반부터 이거 뭔가 싶다가 나이트로 들어가는거 보고 아 언제 나와서 재밌는장면 연출되나 했는데 , 순간 소름돋은 생각이 번뜩났다. 설마 이거 나이트이름이 영화이름이랑 같은데 영화 끝날때까지 저 안에 있는거야? 하고.. 소름이였다ㅋㅋ  "
20170917,9,난 진짜 재밌게 봄 10자끝  
20170917,10,삼류 개막장영화일줄알았는데 의위로 잼있었음볼만함  
20170917,1,음..진짜 삼류영화네...답답하다  
20170917,10,그냥 보는영화 10 자어떻게 남기냐..  
20170917,10,한화에서 알바 푼듯..정말 재밌기만 하던데 ..  
20170917,3,무슨 생각으로 영화를 만든거냐... 웃기기라도 하던가  
20170917,1,지독히도 이기적이고 멍청한 독재자들의 아래에 순종당하는 정말 멍청하기 그지없는 무정부주의자들(?)의 헤어나올 수 없는 똥통의 굴레. 이렇게 멍청하게 흐르는 영화는 정말 오랜만이라 무슨 말을 해야할 지도 모를 지경이다.  
20170917,4,"지난 1991년 미국 영화 캠퍼스군단을 바탕으로 싸게 만든 느낌이 든다. 그나마 영화를 이끌어 가고 있는 원동력은  무적의 배우 임창정과 그를 따르는 강신일, 장광 그리고 미스터 팡.  "
20170917,6,생각보다 볼만함. 베댓 말대로 2000년대 초반 코믹을 보는 듯 함.  
20170917,7,코미디장르라서 내용을 가볍게 만든것 같은데 웃긴장면은 별루 없지만 살짝 감동적인 부분이 있어 킬링타임용은 되는 듯 싶다.  
20170917,10,평점이 높게 준게 알바가 아니라 낮게 준게 알바 같네요 재미도 있고 감동도 있었고나름의 얘기할려는것들을 잘 표현한것 같네요 배우들 연기들도 좋았고요  
20170917,8,이건 감독 잘못인듯~!   이렇게 좋은 배우들 데리고 어찌하면 이리 망칠수 있을까싶은??? ㅋㅋㅋ 갠적으로 임창정 팬이라 잼나게 보긴했음!!!  
20170917,10,관람객임창정 연기마니늘었네  
20170917,2,초반만 재미있고 중반부터는 다소 지루하고 진부한  영화 입니다..  
20170917,10,댓글 알바다 뭐다 하는데 난 재밌었다 진짜!! 특히 조연들 연기도 좋았다!  
20170917,10,관람객넘잼썻음ㅎㅎ엄마랑봣는데 자극적이지않고좋았어요ㅎ  
20170917,1,55번 왠지 눈에 익는다했더니 예전에 모 프로그램에 나왔던 분이네요 미스터팡인가ㅎㅎ  
20170917,4,3류 코미디 영화 다 본 나에게 응원의 박수를  
20170917,2,말잇못... 그나마  내 돈 안주고 봐서 이정도 별점이라도 주는 거다  
20170917,10,오랜만에 그냥 아무생각없이 편하게 재미있게 봤다 배우들 연기도좋고 나는 강추함  
20170917,1,여태까지 본 영화중에 최악이었다. 이렇게 공권력을 무시하면서 정작 감독 본인은 평점 조작하는 뒤통수를 치고있음. 이래서 빨갱이 빨갱이 하나보다. 이런 영화는 절대 돈쓰면 안됨.  
20170917,10,순수하게 재미있는 영화~~^^  
20170917,7,그럭저럭 유쾌함. 그러나 누적 관객수를 보면 알겠지만 극장 가서 돈 주고  보기에는 조금 미흡함.  
20170917,1,"2000년 쯔음 쏟아져 나오던 삼류 범죄자,  조폭 영화의 재림.  "
20170917,1,이렇게 눈길안가는 영화도 드물다  
20170917,7,익살스런 임창정을 기대하고 갔으나 연출과 각본이 두고 두고 아쉬웠다. 그 아쉬운 여운이 2주가 지나도 가시질 않는다. 다만 오래간만에 느끼는 올드코미디는 한껏 만끽했다  
20170917,10,사람은 자신이 모르는 삶을 부정하려고 한다.이영화는 따듯한 블랙코미디다.상업적인 초대형 영화들보다 나는 이런영화를 추천한다.단순한 코미디 영화이며 재미를 위한 영화 연출같은 것들을 생각하지 말고 이런 사람도 있겠거니 휴머니즘을 느껴라  
20170917,9,3류코미디 임. 근데 계속 보게됨 ㅋㅋㅋ 알지 싼맛에 쓰는 그렁거 ㅋ  
20170917,7,코미디한국영화가 망해가는 이때 코미디수준의 영화로서는 상당히 좋았음.. 근데 아쉬운게 한두가지가아님. 1. 임창정 역할이 너무진지하고 웃긴것도없음.. 코믹연기대가인데 못살림.. 정상훈은 원래 노잼이라 이해하겠는데 임창정너무아쉬움..  
20170917,10,코믹영화보면서 무슨 교훈타령하는ㅅㅋ들 ㅈㄴ이해안되네ㅋㅋㅋ  
20170917,10,기대하지 않고 킬링무비로 보려했는데 생각보다 감동적이고  답답한건 바로 사이다처럼 해결해주는 게  참 좋다  
20170917,1,여러분 돈 소중합니다!별 0있으면그거주고십다!  
20170916,1,아..정말 이런 유치한고도 어설픈 영화는 .. 진짜 간만에 본다..중간에 끈다..아...  
20170916,10,영화 자체가 노잼이라기보단 촬영기법이나 연출이 별로인듯  
20170916,5,임창정이니까...5점...그냥 뭐 킬링타임용으로 보면 될 듯..진짜 옛날 코미디 같긴 함  
20170916,1,아진짜 못보겟어서 25분보다 껏다. 대체 이런 영화는 누가투자를해주냐? 감독이 이거찍으면서 자기도 재미없다는걸 느끼지 않았을까?  아진짜 창정이형팬으로써 재능낭비좀 그만했으면  
20170916,6,주유소 습격사건 아류작 느낌..  
20170916,1,창정이형 겁나 팬인데 이건 아닌 것 같네요.  
20170916,10,그냥 재밌다 너무까지들마라  
20170916,4,창정이 형 오랜만에 봐서 1점 더 준다. 막판에 깡패 새끼 미화화  모니?  
20170916,1,이건 킬링타임 영화도 못도ㅐ  
