0,1,2
20170916,7,관람객그냥 볼만했었어요 ....  
20170916,7,2000년대 초반 유행하던 코메디 영화ㅎㅎ 추억 돋네요. 잼있어요. 여기서 평론가 코스프레 하는 애들.. 독립영화는 1점 줄듯 ㅎㅎㅎ 유명인 등장해야 평점 줄꺼냐ㅎ  
20170916,7,"인생도 영화 같으면 얼마나 좋을까. 이 영화는, 정말 영화같은 영화다  "
20170916,1,좀 심하네. 국정원이 댓글 또 달았냐? 겁내 재미없음  
20170916,7,"그냥저냥 무난하게 시간때울만큼은 되는 정도였다...다만 기존 임창정,공형진 의 느낌은 전혀 안나오더라...개인적으로 이 영화에서 제일 씬스틸 에이스는 조폭두목(미스터팡)이었음...결론적으로 내점수는 7점  "
20170916,8,볼만해요~ 다만 코미디요소는 조금 적네요 ㅎㅎ  
20170916,5,형이 여기에 왜 나와?? 창정이형 창수부터 너무하다.. 좀 골라서 찍자  
20170916,5,아무생각없이 tv 드라마정도 본다고 생각하면 갠찮을지도 모르나..그것도 임창정 때문이지. 아니었으면 3점  
20170916,5,생각없이 가볍게 보면 됩니다.  
20170916,10,나 알바아니고 내돈주고 본사람인데 꿀잼ㄷ이다 .. 마지막이 너무 슬픔 굿창정  
20170916,10,재밌당 ㅋㅋㅋㅋ 난 볼만하던디  
20170916,9,관람객감동과재미둘다잌ㅅ었어요  
20170916,1,응? 이건 뭘까... 시간 아깝다...  
20170916,1,하.하.재.밌.다.아이고깔깔부장님  
20170916,6,이정도면 양반이지 //  
20170916,7,B급냄새 물씬 나지만 전혀 지루하지 않은 영화. 임창정다운 코미디 재밌게 봤습니다.  
20170916,1,2000년대초반 쏟아져 나오던 싸구려 코믹물  
20170916,8,이정도면뭐 괜찮은듯싶다 재밌게봄ㅎ  
20170916,10,호불호가 엄청 갈리는 영화이긴하나 개인적으로 이런 영화 넘흐 좋다... 맘에 안드는 배우 하나없이 다들 좋은 연기 보여주고 요즘같은 시대에 이런 마음 따뜻하게 해주는 영화가 나와서 감사히 봤다.. 흥행도 성공했다면 더 좋을뻔 했다...  
20170916,8,관람객너무나웃기고재밌어요  
20170916,1,"아... 진심 임창정 이젠 갔구나 하는걸느끼네,,,,감독이 누구냐 정말 눈물이 앞을가린다,,, 이영화찍고 사라지겠구나,,,  "
20170916,8,킬링타임으로 최고의 영화다 ㅋㅋㅋ 볼만했어 ㅋㅋ  
20170916,10,"잼있음, 연기파 배우3인방 쵝오!!  "
20170916,1,요즘 임창정 꼭 이런 단발 영화에만 나오더라...  시나리오만 봐도 쓰레기 영화겠구만..  
20170916,8,아쉬움이 많은 영화네요 영화 뭐잇나요 코메디면 유쾌하면되는거지 좀더 웃음에 치중할수잇엇지만 감동적이부분에 포커스를 맞춘것같네요 행복한 영화 입니다 추가적으로 홍보도 잘 안된것같고 영화 포스터가 최악이엿던듯  
20170916,10,잘 만든 희극이라고 생각합니다.  
20170916,4,이 감독님 영화 창수는 그런대로 괜찮게 봤는데 이거는 너무 전형적이여서 우리 창정님 노래는 잘 부르시는데 계속 망하네ㅠ  
20170916,10,그냥저냥 일줄 알았는데 처반엔 그랬으니볼만핬음 재미 감동 굿  
20170916,5,임창정 배우의 깊이 있는 연기를 보고 싶다.  
20170916,6,그냥 예능한편봤다고 치면돼요.  
20170916,5,관람객걍 넋 놓고 보세요...  
20170916,8,너무 너므 슬퍼서 하염없이 눈물만 흘렀습니다. 눈물과감동 입니다.  
20170916,9,"이 영화, 악평만큼 얼빵하지 않습니다. 오히려 꽤 재밌게 봤어요. 웃긴 코드도 많았습니다. ㅎㅎ  "
20170916,1,이건 너무 심하잖아요 우째쓰까  
20170916,10,난 재밌게 봤음. 주유소 습격 사건 생각나고 웃기에는 좋은 영화  
20170916,4,아무리 코미디영화지만 개연성이 전혀 없음  
20170916,10,아무 생각 없이 봐야 재밌고 그런 영화 최근 코미디물 중에 수작임  
20170916,1,언젠가부터 임창정 나오는 영화는 무조건 거른다.  
20170916,6,장르가 난해하네 계속 코미디로가지 그래도 55번하고 대표는 웃겼다ㅋㅋㅋ임창정은 사랑으로~  
20170916,10,전 잼있었어요 너무 평점이 안좋아서 10점드려요  
20170916,8,내용중 현실성을 완전히 거부한 몇몇 장면들이 나오긴 하는데 솔직히 뇌 꺼내놓고 그냥보기엔 큰 무리가 없습니다.자카르타를 재밌게 보신분들은 비슷한 재미를 볼정도는 되요. 물론 자카르타랑 비교하기엔 많이 부족하지만 그래도 졸작이라며 내팽겨칠 정도는 아님  
20170916,10,말도안되지만 예전영화보는거같아 추억돋네ㄲㅋ 요즘은 이런영화없지 생각없이 보면 나름 재밌는대 요즘세상에 이런영화 재미없어하는 현실이 안타까움  
20170916,7,재미있게 잘 봐씁니다. 한소영 누나 이쁨네ㅔ  
20170916,2,그냥 나무에서 떨어지는 낙엽이 더 재밌다  
20170916,8,재밌게봤으니까 코미디영화로써 어느정도 괜찮은듯. 어이없게웃기는 임창정식 유머코드가 나랑 잘맞는다  
20170916,8,냉정히 말합니다볼만 합니다  
20170916,7,ㅋㅋ 오락 영화에 뭘 이것저것 따짐  
20170916,8,개똥같은 영화에도 꽃을피울줄 아는 임창정.이번영화도 개똥 같았지만 꽃을 피울려고 노력했다는걸 안다.이제 제발 거름에서 꽃을 피우길.. 제발 거름을 택할줄아는 눈이 다시 찾아오길..  
20170916,2,거지 깽깽이 같은영화...이런류의 영화 엄청좋아하는데 이건 아니다.  
20170916,3,폼 잡고 억지구성. 올드한 코미디에 감동 우겨넣기. 보는 내가 다 민망. 그러나.. 망작을 보는 재미를 선사.  
20170916,10,얼마나 큰기대를 하셧길래 평점1점이...? 솔직히 예전코믹영화보는느낌 가볍게 볼만했음  내용이 유쾌한게 어릴적코믹영화봣던 생각이 새록새록ㅎㅎ 임창정 홧팅  
20170916,1,오늘  윈드 리버 보고 왔는데... 와 진짜 배우들 뭔 생각으로 했을까?  우리나라 온정주의 문화가 이렇게 심각하다.  
20170916,9,머리 복잡하지않고 편하게 재밌게 볼수있는 영화임창정 특유의 즐거움이듬뿍임ㅋㅋ  
20170916,10,정말 역시 갓창정 이천의 명물~!!!! 코미디 인줄 알고 봤는데  감동적인 장면도 있네 웃다가 울다가 하는 명작이다 코미디는 살짝 부족하지만 나름 웃기고 슬픔보다 더슬픈 이야기 이후로 눈물 흘린적없는데  와 눈물 쪽 뺏다....  
20170916,10," 이 영화 언뜻 보면 코미디에 감동코드 섞어 놓은 전형적인 한국영화 같지만, 스토리 자체가 너무 좋네요, 두시간 안에 이야기를 담아내야 하다보니 빈틈이 많은게 사실이긴 하지만, 짧은 티비 시리즈 처럼 시간이 많았다면 그 진가가 제대로 발휘 되었을겁니다  "
20170916,3,딱 2000년대 초반 조폭 코미디 꽁트느낌. 한국영화 질 높아진줄 알았는데 이런거 아직까지 만드는 구나..  
20170916,10, 애초에 큰기대 같은거 하지마라.그냥 보는 거다 임창정영화니깐ㅋㅋㅋ  
20170916,9,간만에 본 영환데... 시간때우려 본건데 의외로 생각을 좀더 하게되네^^ 창정님 눈가에 깊어진 주름만큼~ 많은 생각을 하게되는 작품. 상훈님 형진님 신일님 연기야 두말하면 입아프죠^^ 또 특공대장님... 여전히 잘어울리는 특공대. 근데 세월은 막을수없  
20170916,5,창정이형 안나왔으면 거들떠도 안봤을건데 팬심으로 봄...연출 진짜 개극혐...  
20170916,1,감독 배우가 양심이없네임창정팬이었는데 다시는 안본다 그래도 1시간넘게봤는데 본 내가 OO이다.세 주연배우 양심은 잇나? 시간날때마다와서 전체글 비공감누를거다  
20170916,10,인간미 넘치는 영화 생각없이 볼 수 있는 영화 임창정식의 연기 90년대 엑스트라 할렐루야 같은 느낌 오랜만에 느끼는 90년대 감성이었다.  
20170916,1,로마의 휴일 .... 당신의 휴일을 망칠 수 있습니다  
20170916,2,단순하게 웃고싶으신분 추천 ... 전 이런영화별로라 .. 돈아까웠어요 ㅜ  
20170916,10,"나랑 코드 안맞으면 다 쓰레기인가요? 재미있게 본사람들은 다 쓰레기 되는건가요? 난 정말 오랜만에 너무 재미있게 봤는데, 그럼 도대체 어떤 영화가 코미디 영화인가요? 추천이나 좀해보세요 그게 진짜 재밌으면 저도 이거 욕할꼐요  "
20170916,2,관람객   아내가 임창정이  좋아해서 어렵게  본영화  이게 적패네  
20170915,1,할말없다 댓글달아보긴첨이다 너무잼없어서  
20170915,10,킬링타임용 재미있네용  
20170915,8,나만 재밌었나봐...  
20170915,10,임창정이라 본 1인ㅋㅋ  
20170915,6,욕으로만 웃길 수 있는 것은 아닌데 이 영화는 반절은 욕으로 웃기려고 해서 실망  
20170915,1,영화제작에 참여한 모든 사람들은 들어라! 내 피같은 2시간 어떻게 보상할꺼냐!! 2시간동안 잠이라도 자면 피로라도 풀리지..내가 받은 스트레스 낭비한 시간 책임져라! 그리고 창정이형 이러는거 아니야..이건해도 너무하잖아!!!아아아악!!!!  
20170915,10,역시 임창정 알바이니고 괜찮았음 임창정표 영화  
20170915,7,재밌긴한데 다 옛날사람 같다..  
20170915,4,이건 임창정식 코메디가 아니다  
20170915,3,웃음으로 가려면 웃음으로 감동으로 가려면 감동으로... 이도 저도 아닌 섞다가 똥됐어요... ㅠㅠ  
20170915,1,"1분만에 답나옴. 색즉시공, 위대한 유산정도는 바라지도않음. 불량남녀보다도 못하고, 딱 시실리2키로 정도 급  "
20170915,2,"""창수""라는 영화를 괜찮게 봐서 임창정이란 배와와 감독의 케미를 기대하면서 봤는데 ""창수""의 그 감독이 맞는지 의심스럽다.중국 코미디 영화 보는 줄 알았다.강력하게 비추한다.  "
20170915,1,개 거지같은 영화.  시나리오 배우연기 연출 모두 최악이다  
20170915,3,국ㅂ관 두둠치 씰룩씰룩  
20170915,1,90년대 그 뭐냐? 투캅스? 박중훈 경찰 역할로 나오는. 그런 시대에 어울릴법한 영화.  
20170915,10,관람객웃고울고생각하게만드는영화~힘들고지쳐도긍정적인사고방식으로살아야겠다는생각을들게한다~잼있게잘봤습니다  
20170915,2,투자자들은 이 영화를 보고 나서 무슨 생각을 했을까? 나라면 시나리오를 보고선 돈 아까우니까 절대 영화 만들지 말라고 했을것 같다...  
20170915,2,한소영 이쁘네 그리고 나머지는 생각하는것 처럼 쓰래기  
20170915,3,창정이영화는 다운로드용.그이상 그이하도아녀 노래나해라.맨날시급도안되는영화찍노  
20170915,10,관람객재미잇어요ㅎㅎㅎㅎ감동적이에요  
20170915,10,오랜만에 코미디니깐 재미있었음 확실히 재미는있음 ㅋㅋ 개인적으로는 만족했음  댓글부대 평점 테러 이야기 많은데 서로 까고있는데 개인적으로 봐서 재밌다니깐 그걸 댓글 부대라하질않나 재미없었다하면 테러한다하고 ㅉㅉ 사람마다 다른걸 아주 지들 말이 다맞단다  
20170915,10,재미있는데 왜 그러지..ㅋㅋㅋ  
20170915,8,한국형 코미디 넷플렉스 활성화로 자주보고싶다.  
20170915,2,이렇게 좋은 컨셉과 배우들로 이런영화를 만들다니..  
20170915,2,시대에 맞지 않는 코미디 연출  
20170915,1,창정아 음악망해야 정신차리지 ㅋㅋㅋ  
20170915,1,도대체 왜 평점이 이렇게 높은거냐? ㅋㅋㅋ 진짜 이런영화는 왜 만드는건지 모르겠네  
20170915,5,스토리도 재미도 감동도 없는 옛날식 코미디. 그만하자 이런건  
20170915,3,애많이 썼다... 나도 보느냐고  
20170915,1,공형진 나오면 알만 함. 임창정도 이런 영화 이제 그만.  
20170914,1,이걸 영화라고 만들었나... 리얼과 함께 올해 본 영화중 최악이었다 창정형님 시나리오 선택 좀 잘하세요 답답하네요  
20170914,1,제목 씹극혐 감히 세계 명작 영화를삼류 영화에 갖다쓰냐?  
20170914,10,관람객가볍고 재밌게 잘 보았습니다  
20170913,10,관람객나름재밋게봄!!!!  
20170913,1,"오드리 헵번 나오는 로마의 휴일 자료 찾고 있는데, 제목이 똑같고 이것만 나와서 안습이네요.  제목이 너무 독창성 없고, 고전영화 명성에 숟가락 하나 얻어 흥행해 보겠다는 심리가 아니라면, 같은 제목은 쓰지 말았어야죠!  "
20170912,1,관람객창정오빠 이거 왜 찍으신거예요...?  
20170912,10,관람객아주감동적인 영화임 강추  
20170912,1,90년대로  돌아간 코미디  
20170912,4,관람객....ㅠㅠ아이고 진짜 주연 3명 연기력 짱 그러나 연출은..  
20170912,10,관람객잼미잼미잼미잼미잼미  
20170911,7,관람객깨알 웃음으로 볼만 했습니다 ㅎㅎ  
20170911,9,관람객영화 같진 않았지만 재미와 감동은 충분했다고 생각합니다 ㅎㅎ  
20170911,10,관람객너무너무 재미있었어요 간만에 가족이라 영화 보고 실컷 실행하고 갑니다  
20170911,8,관람객전 진짜 잼나게 봤는데요.  기대한 것보다 많이 웃고 나왔어요.  
20170911,2,명절 한낮에 tv에서나 했을 법한 90년대 영화. 나 임창정 좋아하지만 이건 돈 아까웠다. 엎어졌다가 재개봉한 느낌을 지울 수 없어서 1점 주려다가 나성기씨 끌려 들어올 때 피식해서 그나마 1점 더 준다.  
20170911,4,관람객임창정 배우께서는 매번... 쩝  
20170911,1,손익분기점 달성하였나요? ㅠ..ㅠ  
20170910,10,관람객임창정마오눈영화라 재밋음  
20170910,9,관람객너무 재미있게 봣어요~~ 임창정씨 연기는 최고에요!!!  
20170910,10,영화가 팡 터지는 느낌은 아니었지만 영화보고있는 내내 여운이 남는 아주 재밌는 영화 였습니다.영화가 다 끝났는데도 여운이 가시지 않아 자리를 뜨지 못할정도로 재미있게봤습니다.  
20170910,9,관람객재밌었슴다 창정이형ㅎㅎㅎ  
20170910,1,꽁짜로 봐서 다행이지 돈 주고 봤으면 진짜 하루종일 씩씩 거렸다ㅡㅡ  
20170910,8,관람객하하하히히히히호호호  
20170910,10,관람객굳굳 너무너무잼잇엇어요  
20170910,3,관람객그냥 아무 생각없이 봤는데도 뭐야..했음ㅋㅋㅋ  
20170910,10,관람객역시 창정이형 사라잇네 ㅋㅋㅋㅋ박하선씨 대박 이쁨....여신  
20170910,4,관람객딱 임창정이 할수있는 배역의. 딱 그정도영화였다.  
20170910,5,임창정식 코미디영화인줄 알았는데애매한 코미디  
20170909,7,별로라는 평을 보고가서 기대없이 보면 볼만함..마지막이 진짜 보다가나온느낌이긴했음. 청춘경찰을봤다면 재미없다고 느낄듯...  
20170909,1,보다나옴 진짜 쌍팔년도 영환줄. 마동석 나온 살인자도 내가 극장에서 끝까지 보고 나왔다. 이건 도저히 못보겠음  
20170909,1,이게 진심 재밌냐????  
20170909,8,관람객갓팡정ㅎㅎㅎ형님짱입니다  
20170909,10,관람객내니ㅏ루루우이ㅣ티티타웅ㅋ티잍ㅌ  
20170909,10,관람객재미있었다가나다라마바사아자차카타파하  
20170909,9,관람객역시 코믹계 하면.. 임창정 이죠 ^^허나.. 그 특공대 대가리?? 뭐하는 캐릭터 ??  
20170909,7,웃기는 많이 웃었는데 내용이 재밌어서가 아니라 그냥 임창정 말투가 웃겨서 웃은듯. 비싼돈주고 극장까지가서 볼만한 영화는 아니예요. 다른영화는 다 봐서 딱히 볼게없어서 본 영화.  
20170909,9,"관람객역시 임창정입니다~!!!엄마,이모 모시고다녀왔는데..기대한것만큼 재밌었어요~!!^^  "
20170909,8,관람객그냥 큰 기대안하고 보면 재밌는 영화네요 ㅎ임창정 씨 연기 역시 잘하더군요  
20170909,1,왠만한 코미디 다 재밌던데 진짜 재미없었음.... 옛날식 개그..?  
20170909,10,관람객재밌게 잘본듯한 그런영화 나는 재밌었눈데~_~  
20170909,10,나쁘지 않았어요 재미있게봤어요  
20170908,1,쓰레기.... 후 ;;;;  
20170908,10,잔인한 영화만 보다가 코믹하고  따뜻한 정까지 느껴지는 이영화 재미게 봤어요ㅡ배우들 연기도 짱  
20170908,10,굿 좋아요 재밌을거같습니다  
20170908,7,관람객킬링타임용 영화 재밌네요  
20170908,10,배우들 연기력좋고 재미있어요  
20170908,1,치외법권 신감독하고 이영화  이감독하고 둘이 합작해서 영화 한번 만들어 봐라 평점  0  점 생길것이야  
20170908,1,관람객술먹고봐서 그나마 1점이다  
20170908,10,유감이다..이런영화ㄹ를 10지  
20170908,5,관람객킬링파트용 괜춘함ㅋㅋㅋ  
20170908,10,댓글 다들 ㅋㅋ왜 이러지 개웃기고 개잼인데 어느 코미디 예능 프로그램보다 병맛이고 웃김ㅋㅋ끝나는 내내 웃은즛  
20170908,8,관람객전체적인 스토리구성이 좀 아쉬웠어요.배우들의 연기는 모두다 짱~이었어요.조조영화관에서 혼자 앉아 큰소리로 깔깔대며 즐겁게 웃다울다..하며 봤답니다.^^  
20170907,10,재밌습니다~코미디 영화 그리웠는데 오랜만에 이런 코미디영화보니까 유쾌하고 기분 좋아지는 영화였습니다~  
20170907,2,"안봤으니 2점이다. 봤으면 1점 줬을듯...제목, 캐스팅, 시나리오 전부 구리다  "
20170907,10,관람객재미. 감동 있습니다. 추천합니다  
20170907,1,"극장에서 보았다! 정말 돈이 너무아까웠다. 같은돈으로 이런걸본게 너무도 억울하고 아까웠다. 10,000원내고 라면먹은기분이다.  "
20170907,7,관람객재밌었어요~~ 잘봤어요~ ~~  
20170907,5,괜히 봤다. 임창정씨. 좀 다른 것 찍읍시다.  
20170907,8,관람객확실히 어이는 없었지만 재미는 있었으니 만족  
20170907,5,그냥 저냥 시간 떼우기 좋은영화.말하고자하는게 뭔지 모르겠고 끝나면 읭??.. 하지만 중간중간 웃겨서그냥 킬링타임용으로 괜찮습니다.  
20170907,8,관람객나름 재미잇엇네요 잼잼  
20170907,8,관람객그냥 웃기긴 했습니다. 큰 스토리는 없지만 볼만합니다.  
20170907,1,이런거 처음남겨본다 내돈...그냥 앉아있기가 힘들었어요  
20170907,10,관람객가나다라마바사아자차  
20170907,1,진심 벽보고 반성해라~개빡친다  
20170907,6,관람객생각보단 별로 였어요 ~~^^  
20170907,1,창수야~ 내가 당수에 당하다니 분하다.  
20170907,10,올해 영화중에 최고 였습니다!!!  
20170906,10,관람객재밌어요 유쾌한영화에요  
20170906,5,관람객55번나올땨재밌음ㅋㅋㅋ  
20170906,9,역쉬 임창정의 코믹은 재미있읍니다  
20170906,10,저는 이 영화가 좋았어요.가볍게 웃기는것 같지만 실상 풍자성이 있는 영화. 로마휴일 밖의 세상에서 해결하지 못하는 사회적기시를 받는 사람들의 문제를 강도들이 있는 로마휴일 안에서 해결되고..요즘 이런 영화들이 나와야 한다고 봄. 저는 이 영화가 대박  
20170906,5,관람객영화가 너무 애매하네용 웃기기엔 먼가 애매하고... ㅎㅎ 돈주고 보기에 조금 아까운것같기도 하고 ㅎㅎ 출연진보고 바로 영화봤는데  ㅠㅠㅠㅠ 먼가 돈주고 보기 아까웠던것  같아욫  ㅜㅜㅜ ㅎㅎ  그래도  연기력은 잘봤습니당' ㅋㅋ 아하하하 ㅓㅓㄴ ㅓ  
20170906,10,올해본거중에젤재밋었어요  
20170906,9,관람객기대를안하고봐서 잼섯음  
20170906,10,관람객ㅎㅎ재밋게잘보앗습니다ㅎㅎㅎㅎ  
20170906,9,관람객가볍게 웃고 즐기기 좋은 영환데  
20170906,8,관람객마음이우울했는데 이영화 보고 넘넘 코믹하고  즐거웠어요.칭구한테 재밌다고 꼭 보라고 권했어요.  
20170906,10,관람객너무 가까운 거리에있어 좋아요  
20170906,1,아 이런 싸구려 저질 국내 코미디영화좀 그만 만들어라. 너무 저급해 진짜!!!  
20170906,8,관람객전형적인 정통 고전코미디영화  
20170906,1,창정이형과의 의리로 봤다..  
20170906,8,나름 재밌던데.. 그래도 볼만함 ㅎ 여친도 볼만햇다고햇음  
20170906,4,창정이형.. 왜 이런 영화를 골랐어요..  
20170906,8,관람객나쁘지않음 임창정 코믹연기는 눈요기로 딱  
20170906,5,믿거임 10자10자10자  
20170906,10,답답한 요즘이었는데 정말 즐겁게 웃으면서 볼수있었습니다.탄탄한 주연부터 미친듯이 재밌었던 조연분들까지 요즘들어본 영화중에 가장 많이 웃으면서 영화관을 나온거같아요.즐겁게 힐링하고 싶으신 분들께 추천합니다!  
20170905,8,관람객즐거운 주말조조보고 왔어옹  
20170905,3,정상훈빼고 연기도 다 그냥 시트콤같음  
20170905,7,후하게 줘서 7점입니다  
20170905,7,그래도 이 영화는 재미라도 주었다 브이아피는 뭐냐  
20170905,1,영구와 드라큐라도 이것보단 재밋었겠네요  
20170905,9,가볍게보기 좋은 영화입니다  
20170905,1,역시나 역시나 역쉬나 1점  
20170905,1,초중반부 더럽게 재미없고... 헛웃음만 나옵니다후반부 억지감동... 솔직히말해 괜히 본 심정입니다..하 돈아까워라  
20170905,3,인질극 소재의 코미디 이지만 그렇게 웃기지는 않다!? 오히려 진지하다고나 할까?마치 연극배우의 대사를 보는 듯한 장면이 대부분이다!? 그것도 별 이슈없이 옥신각신 하다가 끝난다.인질극이라고 하기엔 긴박감도 스릴도 없이 신파극으로 흐른다!  
20170905,10,오랜만에 웃으면서 코믹영화봣네요 재밋어요^^!  
20170905,10,관람객너무 재밋었내요 ㅎㅎㅎ  
20170905,8,재밌네...재밌으면 됬지 뭐..  
20170905,1,한국 영화는 폭망한지 오래 이젠 뭘 개봉하든 기대조차 안되고 토렌트로 다운받아볼 맘 조차도 안생긴다  
20170905,10,여자친구랑 봤는데 정말 시간가는줄 모르고 봤네요 얼마나 웃기던지 여자친구랑 영화끝나고도 한참 웃었네요 ㅎㅎㅎ 또 보고싶은 영화네요  
20170905,1,영화 보다가 나와본 적은 처음.. 더 이상의 발전도 반전도 없을 것 같아 한숨 쉬며 나옴 결말 궁금하지도 않음ㅋ  
20170905,10,나름 코미디영화로써의 가치가 있다  
20170905,1,임창정이 좋아서 보러갔는데..아 너무 진지한 캐릭터였어도중에 사람들 나가고 코고는 소리 들리고..  
20170905,2,왜 개봉했을까나앙~?  
20170905,1,이덕희 영화 하지말고 도배 기술이나 배워라 임창정 그만 팔아먹고 이정도면 무능력 감독 이름만 봐도 기대도 안하지 투자자 돈 그만 횡령해라  
20170905,10,재밌습니다 많이웃고 감동도받고아주 좋았습니다 진심  
20170905,4,뻔한 이야기 뻔한 웃음 마지막에 억지 감동.. 가문의 영광에서 벚어나지 못하는듯...  한국영화는 욕없이는 왜 안되는것인가..  
20170905,9,재미있는 영화 오랜만에 봅니다.배우도 좋고....대박예감....  
20170905,10,영화 너무 재미있게 봤어요ㅎㅎ영화보고 무대인사에서 실물로 보니깐 더좋았어요ㅎㅎ로마의 휴일 화이팅!!!!  
20170905,4,"초반에 너무 유치해 나올뻔했는데 돈아까워 참고 계속 봄.임창정,미스터팡(인질55번),강신일빼고는 다들 연기가 어색함.전형적인 b급 싼마이 코믹영화.평점 너무 높아 균형맞추기위해 4점줍니다.미스터팡이 연기에 소질있는듯!  "
20170905,4,임창정 팬이자 동갑내기로 창정씨 보러간거니까 후회는 안하지만 영화의 주제가 뭔지 감독님이 생각이 많았나보네요 웃기려면 확 웃기던가 눈물을 주려면 확주던가 이도저도 아닌 어중간한 영화가 되버렸네요  
20170905,10,초반에는 좀 정색하면서 보다가 중반부터 빵터지고 계속 재밌게 봤네요  
20170905,6,관람객7fzgdzgyryese  
20170904,1,제목을 가져다 쓴 로마의 휴일이 개봉한 1955년에 나왔어도 진부했을 듯 하다  
20170904,1,90년대에는 이런 게 웃겼어요?  
20170904,3,1960년대 히피족들이나 좋아할만한 영화  
20170904,8,현 사회의 경종을 울려주는 영화..  
20170904,9,생각없이 봤는데 웃음 감동 다 있네요임창정 공평진 정상훈 믿고보는 세분 연기 역시 짱이였구요55 번 나이트 사장님 이전에 없던 독특한 캐릭터에 반했어요!!로마의 휴일 대박 나세요 !!!  
20170904,7,2005년도 영화느낌~ㅎㅎ근데 그냥..킬링타임용ㅋ  
20170904,5,3류 코미디 영화. 킬링타임으론 괜찮았습니다. 그래도 후반으로 갈수록 몰입하게 되더라구요. 교훈도 있는 볼만했던 영화.  
20170904,10,코미디 영화이지만 슬픔과 감동이 공존하는 정말 좋은 영화입니다임창정 주연이였던 육혈포강도단이 생각나는 영화네요  
20170904,9,예고편만 봐선 모른다 상영관수 좀 늘려주지...  
20170904,7,적당한 웃음과 눈물이 있는 추석 가족용 영화  
20170904,10,로마의휴일 진짜꿀잼이네  
