0,1,2
20190117,1,아이큐 낮은 동네형은 보고 죤내 웃더라  
20190113,1,어떻게 아직도 이런 시대 착오적인 영화가 개봉을 할 수 있는지가 한국 영화계가 어떤 상태인지 극단적으로 나타내주는 듯.  
20190109,1,공형잔 꼴보기 시름 ㅡㅡ 고구마 캐릭  
20181231,2,하...시실리 찍던 형이 그리워  
20181231,8,나는 재밌던데 왜 다들 그러는지  
20181231,8,뭐지..? 저는 재미있게 잘 봤습니다. 역시 창정이형  
20181231,1,와.. 이건 각본쓴 놈이랑 감독이 나쁜놈이다.  
20181231,8,우연히 케이블방송에서 해준거 봤는데 임창정 특유의 감성 영화! 웃기고 슬프고 나름 재밌게봄!  아무생각없이 봤었는데 시간지나 문득 떠올라서 한번 더 찾아봄! 나름 재밌다~  
20181231,1,제목 검색하는데 이상한게 위에 뜨네  
20181231,1,사랑이무서워가역대급임  
20181227,1,재료는 화려한대 요리는 형편없다  
20181224,1,도대체 어떤 하류하급인생을 살면 이런걸보고 재미있다고할수있냐? 그냥 흰쌀밥먹고 살수있는 인생에 고마워하며사는 그런 최하위인생살면 이런쓰레기 영화에 재미를 느낄수도있을까.... 0점없냐이거  
20181214,1,ㅠ.ㅠ.ㅠ.ㅠ.ㅠ.ㅠ.ㅠ.ㅠ.ㅠ.ㅠ  
20181211,10,평점알바 개조슬 도와줘 개조슬 몰라 창정이형이 좋아작정하고 만든 B급영화야 아무생각없이 웃고 울고 느꼈으면 만점짜리다  
20181210,4,씨네프에서 새벽에 시작전 광고 보는데 떠있길래 오랜만에 햅번감성에 젖고 싶어서 쉬 한번하고 블랙커피 한잔 타서 자리 앉았는데 ㅅ ㅂ 이게 나오고 자빠졋네ㅡㅡ  
20181207,10,주유소 습격사건 보는줄 ㅋㅋ  
20181204,10,댓글알바 절대 아니고 솔직히 말해서 돈주고는 안봐서 모르겠는데 그냥 아무생각없이 웃기 좋은영화라고 생각함  
20181202,1,애들은 그냥 봉사활동이나 해라  
20181128,10,나만 재밌게 본건가...저는 만족스럽습니당  
20181127,8,케이블 무료vod로 방금봤다 돈주고 봤으면 좀 아까울뻔 했으나 무료로보니 볼만하다 스토리중 슬픈사연도있고 ...  
20181127,1,별0을할수없는 안타까움ㅋ  
20181126,10,나름 재밌던데 ㅋㅋㅋ 출연자케미 ㅋㅋㅋ55번ㅋㅋㅋㅋ  
20181124,1,이런 개후진영화 돈주고 본사람들  열받겠다   공짜로봐도  시간아까워  보다가 꺼버림  삼류영화 이런영화는 첨봄  
20181124,5,스톡홀롬증후군!중간에 한명 도망치고 잡으니 다 죽이라하고 피자 삼겹이랑 술 준다니 와아아아!ㅋㅋㅋㅋ  
20181124,1,평점 빵점은 줄 수 없나요?좋은 배우들가지고 이렇게 만드는 것도 재주다!감독과 각본이 쓰레기~  
20181123,2,이 영화 왜 만들었니????  
20181119,5,임창정 특유의 코믹이 좀 약한듯 그리고 중반 이후에 너무 나갔다 너무 억지스러운 설정은 반감을 일으킨다  
20181119,8,잘봤어요 잔잔한코믹 ㅋㅋ  
20181118,1,처음 써본다. 진짜 왜만들었나?  
20181118,5,시간 때우기용 ㅎㅎ..  
20181116,6,그냥 시간때우기론 괜찮아요~ 결말이 짱나지만~그나저나 제작비 아까워서 우째  
20181114,10,원하던 결말이 아니라서 아쉽지만집에서 매우 재밌게봄  
20181113,4,범죄? 코믹?? 휴먼??? 거 당췌ㅉㅉㅉ  
20181112,1,억지 ㅜㅜ   내 시간 돌리도  
20181111,3,"안일한 각본, 감동 강박이 부른 서투른 결과  "
20181111,10,영화자체는 약간 촌스럽긴 하지만 임스타님 연기 보면서 같이 울었네요 ㅠㅠㅠㅠ 부디 좋은 감독 만나서 제발 좋은 영화 찍으시길  
20181111,5,"나이트에서 인질 잡아놓고 셋이서 삼겹살에 소주, 양주 먹는게 말이 되나요  밖에 경찰들 깔렸는데ㅡㅡ  "
20181110,8,이런 영화도 있어야지. 한정된 공간에서의 깨알같은 웃음. 괜찮은 작품임.  
20181110,4,"상황 설정, 유머 코드, 만듦새 모두 올드하다.  "
20181110,10,좀 옛날감성이지만 그래서 더 와닿은 영화. 수수께끼 풀이같은 요즘 영화보다 재밌어요.볼때마다 느끼지만 임창정님의 눈빛연기는 대단 엔딩크레딧 직전의 눈빛연기는 많은걸 생각하게 함 담백한 배우 담백한 영화. 영화관에서 봤어야 하는데 그게 가장 아쉽네요.  
20181109,1,임창정과 정상훈의 조합으로 이런쓰레기가 나올수 있다는게 감독의 능력임!  
20181109,4,에효..임창정에게 4점준다  
20181107,9,난 왜 재밌게 봤지?  이건 아침드라마를 좋아하는 취향이라고 해야 되나  
20181105,10,기대감없이 재밌게 봤던 영화.파고들려하시지 마시고 가볍게 보시면 생각보다 잘짜여진 시나리오에 깜짝 놀라게 될 것이다  
20181103,3,관람객ㅋㅋ저 이거 영화관에서 봣어요 한번도 안웃고 하.. 친구랑 얼굴 마주보며한숨쉬며 봣던기억이 ㅋㅋ 1990년도 영화느낌이엇어요 그때 찍은게 지금 개봉한 느낌의 영화였어요  
20181102,2,별한개도 아까운 영화네영 ㅎㅎ 남녀차별오지게 하고  
20181031,3,촌스러움을 모두 갖춘영화  
20181030,4,보긴 봤는데  기억이 전혀 안나는 영화  
20181025,10,2017년에 이런 쌈마이 영화가 ㅋㅋ  1997년도인줄ㅋㅋ 티비서하는거 5분보다 채널돌리다가 20분에 GG  
20181004,1,스렉라라라러라라러라라럴  
20181002,10,스타일만 맞으면 재밌게 볼수있는 영화  
20180930,10,사람마다 느끼는게 다른게 아닌가 그냥 티비에서 우연히 나오길래 다 봣는데 나름 재밋엇다 돈을 엄청 들인영화도 아니고 다들 기대를 너무 하고 보셧나봄 나는 임창정이 감독인둘알앗는데 아니네  
20180930,10,옛날스러움 자욱한~~~~ 그래서 더 몰입하기 좋았던 영화~~~~ 담아내는 방식은 아쉬웟지만 세련되지 않고 뭉퉁해서 배역과도 잘 어울렸고... 또 좀 통쾌한 면도 있고  
20180930,6,"TV로 봤는데 그냥 킬링타임용으로 가볍게 볼만 하네요,근데 억지 눈물,웃음 장면이 좀 많은듯....  "
20180930,1,2000년도 초반 영화인줄 알았는데 2017년도?.. 작년 영화인데 이따구로 만들어노면 관객이 호구입니까..  
20180926,1,이덕희 감독 상업영화 은퇴작될 듯..  
20180925,8,난웃기던데 ㅋㅋ꿀잼킬링타임  
20180919,1,덕희 감독 님 대체 왜 그러셨습니까...창수 때 임장청 씨의 의리 출연 같은데...  
20180919,6,시대에 뒤쳐진 영화는 맞으나.나름의 메세지는 있는듯?  
20180918,9,아무생각없이 보기 좋은 영화~ 성지순례갑니다.  
20180917,1,이거 어떻게 평점이 7점이지ㄲㅋㅋㄲ다같이 인질되자이건가ㅋㅋㅋ  
20180908,1,11점을 주고싶어서 이렇게 남깁니다  
20180831,8,솔직히 이런 b급영화만의 재미가 따로 있다고봅니다 tv에서 해주길레 우연히 봤는데 재밌게봤네요  
20180831,10,꾸르잼.. 한번정도는 봐보세요 ㅋㅋ  
20180831,2,지금보고인는데 임창정때문에 그나마 참고보고있씀 ...덜도말고 딱 라면한그릇먹을만큼만 봄니다.  
20180831,10,잼있게 보았어요~~^^  
20180830,5,90년대 말 2천년 초반 감성의 영화. 걍 멍하게 킬링타임으로는 갠춘. 나름 재밌게 봤습니다 :)  
20180830,1,내가 씨발 그부분만 아니면 그래도 7~8점 주려고 했구만. 풀려난 인질을 경찰특공대가 다시 총겨누면서 들어가라고 한부분에서 1점 준다 씨발. 이게 말이 되는거냐 아무리 영화라도 현실성 있게 만들어야지.  
20180812,7,그냥 생각 없이 보기에는 괜찮았다.  
20180812,1,고전 명작의 이름을 더럽히는 개 스 레 기 영화  
20180809,1,와.. 이런 영화는 누구 잘못이지..  
20180801,8,의외로 재미있게 봄. 정말 의외로 잘 만든 B급 영화임  
20180801,10,꿀잼임... 그래서 형량은?  
20180725,10,칭다오와 소주한잔의 조합...개먹기싫다..  
20180724,10,나만 이상한건지는 모르겠는데 영화관에서 못보고 티비에서 방송하는걸 우연히 봤어 진짜 너무 재밌게봐서 주변사람들한테 추천할거야 이 영화가 13만명 밖에 안된다는게 이해가 안되는거같은데  
20180724,2,시대에 뒤떨어진 코미디  
20180720,8,타임 킬링하려고 봤는데~나름 몰입감도 좋고 재밌게 봤네요ㅎㅎ특히 임창정과 공형진의 연기가 무르익어감을 느꼈습니다~  
20180715,1,영화 이렇게 만드는것도 쉽지 않을텐데 감독님 이것도 재주는 재주겠네요~ 그리고 임창정은 요즘 곱창집도 오픈한거로 아는데 돈이 궁하지도 않을텐데 아무 영화나 나오는게 실망입니다! 시대를 역행한 영화...별 반개도 아깝습니다  
20180714,8,실소를 자아내게 만드는 초반부와 달리 중반이후 부터는 기대 이상이었다  
20180707,5,기대없이 보면 소소한 웃음코드에 피식 웃게 된다....  
20180610,10,이게 영화다55번의 개과천선 연기가 일품이다  
20180606,1,나쁜 쪽으로 복고풍이라면 이런 느낌  
20180602,4,맞아 옛날 영화보는 느낌  
20180531,10,코미디잖아.. 재밌기만 하구만 왜들그래  
20180527,1,제목이 아까운 영화는 처음이야..!  
20180524,1,임창정 나오는 영화는 95프로망한다  
20180516,8,이입되네. 찐하기도 하고 가볍기도 하고.  
20180516,2,이젠 임창정 영화는 걸러보게 되네요. 옛날에 시실리2km나 색즉시공 할때나 재밌었지 어쩜 그때랑 변한게 없음.. 유머코드 바뀐지가 언젠데 아직도 옛날스타일. 아니 옛날스타일보다 더 못한듯. 치외법권보고 느꼈지만 이거보고 또 한번 느꼈음. 이젠 질려요  
20180515,1,만약에 개그가 크게 터졌다면 이 황당무개한 전개도 이해할 수 있었을 거다. 하지만 이도저도 아닌 둘 다 놓쳐버린...  
20180510,4,이런 영화가 있었나요jQuery22409457353416446053_1525909197515ㅋㅋㅋ  
20180430,10,진짜 재밌는데 왜들 그러지 ㅋㅋ 이런게 한국영화 보는 맛이지할리우드 영화를 너무 많이들 보셨나 ㅋㅋㅋ  
20180426,7,킬링 타임용으로 보니 재밌더만 결말은 예상되지만 볼많다 평점테러들 뭐지...  
20180422,10,럭키 외엔 다 코미디물이 비슷비슷하네. 80년대 감성.유치짬뽕.어이상실. 이젠 혹평을 할게 아니라 한국식 코미디영화의 색깔로 봐야하나. 지적하자면 밤 새도 모자르겠다. 아무 생각없이 보면 나름 나쁘지 않다. 그래도 다음엔 좀 더 공을 들여 만들기를  
20180420,9,난 재밋게봣는데 평은 좋지않네  밥먹으면서 우연히봣는데 재밋게봣다  
20180418,10,여동생과 재회할 때 장면은 아직도 기억속에 남는다  
20180417,1,게이트보고 빡쳐서 이것도 보다 빡친 기억이 나서 평점 남깁니다. 창정이형 요즘 왜이래..  
20180416,10,재미있었어요 인간적이고 슬프고 감동도 있고  
20180414,1,내용도 조금 부족하고 영화가 뒤로 갈수록 재미와는 점점 멀어지는 느낌이네요.  
20180414,10,이런일을어찌해야것노ㅋㄱㅠ휴  
20180410,2,도대체 이런거 왜 만든거임?  
20180409,10,은근히 병맛인데 재미지네  
20180409,1,돈을 많이 줬나....아님 졸라옛날에찍고 이제 개봉한건가  
20180408,2,일부러 이렇게 만들기도 힘들겠다  
20180408,8,2000년대초 영화인줄알았는데 핸드폰보고 그나마 최신영화구나싶었는데 2017년작품이네?ㅋㅋㅋ아 b급영화 내스탈임. 나름 재밌게봄  
20180405,2,아무리 영화라도 이건 심하잖아!!!!  
20180405,1,이게 영화냐 진짜 쓰레기네  
20180401,10,재밌네. 뻔하지만 임창정만의 매력을 보여준 영화.  
20180401,8,유치하지만 이런영화가 좋다  
20180401,1,이런 영화 만들면 감독이나 배우나 부끄럽지 않나? 이게 영화냐  
20180401,1,대략답없음 대략난감ㅋㅋ  
20180401,1,ㅋㅋㅋ어이가 없네ㅋㅋㅋ  
20180401,1,이덕희감독은 보거라.돈을 들여 똥을 만들었구나.이건 영화가 아니라..그냥 똥이다..  내생에 최악의 영화로 남을 듯... 2시간 동안 똥구경 한 듯..-10점은 왜 없는거jQuery22405386385247754746_1522512147619?  
20180401,10,스크린에서 방영해주는거로 봤는데.. 아픈 마음 잊고 웃으며 봤습니다 사람마다 성격 다르듯이 이 영화 보고 실망 하신분들 있을겁니다. 그런데 저는 너무나도 재미있게 봤습니다..!! 해피엔딩이라 너무너무 다행 ㅠㅠ  
20180401,1,"20년 전이었어도 개유치한 시나리오인데 이게 얼마 전에 나왔던 영화라는 게 믿기지가 않음. 파이란 같은 명작을 찍었던 감독이라고는 믿기지 않을 정도의 유치함. 이게 흥행될거라 믿고 찍은 건가? 감 떨어졌으면 영화 만들지도 말고, 출연하지도 말아라!!  "
20180330,6,그럴싸한 전개에 아주 작위적이고 유치한 디테일. 그러나 그 안에 사회적인 메시지가 있네.  
20180330,10,뒤늦게 돈주고 받아서 봤는데 넘 웃겨요 ㅋㅋ 요즘 이렇게 크게 웃을 일 없었는데 생각없이 보기에 좋은 영화인것 같슴다  
20180328,7,ㅋㅋ말이되게 생각하면 재미없지당연히  
20180326,5,창정아 치외법권 한 편으로 만족하지 그랬냐.. 그래도 여러 조연 유망주들이 보여서 부분 부분 웃기긴 했다  
20180322,1,노잼노잼노잼노잼노잼노잼노잼노잼노잼노잼노잼노잼  
20180321,5,창정이형은 영화 고르는 안목이 너무 없는듯ㅜㅜ  
20180319,10,기대 안하고 봤더니 재미 감동 다있는데 왜 사람들이 욕하고 13만명만 봤는지 모르겠음.. 왜 안뜬지 이해 안되는 영화 소재도 신선한데 왜 진부하다고 유치하다는지 이해안됨. 암튼 넘 재미있게 봤음 억지 웃음 유발시키는 다른 영화보다 훨~씬 나음ㅎㅎㅎㅎ  
20180319,8,킬링타임으로 볼만하고 억지웃음도 아니고 웃겨서 웃기고 훈훈해서 좋은데 왜공짜로 봐서 그런가 여튼 망작은 아니라고 봄  
20180317,1,휴 한숨 나오는 영화ㅡㅡ아오  
20180316,8,전재밌게 잘봤어요 내용도 괜찮고  
20180316,2,마지막방위 보는줄....  
20180315,1,이게2017년도영화임jQuery22407140710978724965_1521104125459  20년도더된소재를존나우려먹고 뼈만남았는데 그걸재활용해서만든영화가이거임... 웃음코드?  기가차서 헛웃음만나옴  
20180313,10,"지루한 듯 웃기고,,슬프기도 하고 짠하기도 하고 은근 감동이었어요,,로마의 휴일이라는 제목이 뜬금없는 듯했지만 잘 어울리는 영화  "
20180313,1,이제 이런 올드한 코미디 영화는 좀 안나왔으면 싶다.감독이 두사부일체 찍었던데 그래서 그런가....  
20180312,1,다 때려쳐라. 다시는 영화 만들지마라.  
20180310,10,괜찮은데 나는 좋았어요  
20180309,1,어제 모뎀 연결하고 시간남아서 봤는데 재밌네요. 곧  15대 대통령 선거도 화이팅입니다.  
20180309,8,그래 나도 안다 ㅈ같은 영화지근데 최하층민의 죽는게 편한 삶을 보고 있노라면가끔씩은 죽도록 생각나는 영화다  
20180308,1,창정이 좋아하는데 이건 좀 아니다 이게 영화냐?0점도 아깝다  
20180307,10,별저메러들 다알바냐? 난 줜나재밌게봤는데 ㅋㅋㅋ 라면먹으면서 깔깔거리면서 봤는데 문득 슬픈장면들에서는 눈물도나왔고뭐가문제인건지 ;  
20180306,10,클레멘타인이다!!!  
20180306,10,강자에겐 강하고 약자에겐 약한...개멋찜  
20180303,10,제 생애 가장 감동적인 영화였습니다.  
20180302,1,아니 이거 평점이 왜느이리높아... 개연성도 죽고 아니 그전에 내용이 없는데. 결론이 실은 강도짓하는 얘네도 착해요^^ 이거뿐이잖아  
20180302,10,"가슴아픈영화였습니다..,.  "
20180302,8,집에서 가족들이랑 웃으면서 보기에 괜찮음. 나름 메세지도 있고ㅋㅋㅋ  
20180301,1,쓰레기같은 영화 ㅗㅗㅗㅗ  
20180301,8,   와 손에 땀을 쥐게 만드는 영화네요. 언제쯤 반전이 일어날까 하고. ★★★★나만 당할쑨 없다  
20180301,8,기대안하고 보면 나쁘지않음  
20180301,10,저는 재미잇게 즐겁게 봣어요~  
20180301,1,완전 3류시나리오 B급도 안되는 C급영화다 별 하나도 아깝다  
20180228,6,우리 나라 영화가 엄청 발전했는데. 이거 만든 분들은 우리나라 영화 안보나봐요  
20180228,5,재미는있다 시간이 남는다면 봐라  
20180228,8,창정이횽님 화이팅입니다 ㅠㅠ  
20180226,8,관람객오래간만에 웃었네요.  
20180225,7,관람객어찌 모두 세련될 수 있을까  
20180225,1,노래는 레전드 가수가 왜 영화는 하나같이 싸구려 배우냐  
20180224,6,시대가빠르게 간다하여 모든것들이 첨단일 필요는 없지않는가 난가끔 신파적이긴해도 이런 인간미솔솔 풍기는 80년대스타일도 괜찮다본다  
20180224,9,영화 다괜찮고 창정이형 멋진데 ?..인질 여자싸가지가없네 풀어줫더니  
20180224,1,X발 이영화 평점이 왜 7.73이야? 알바를 얼마나 쳐 쓴거냐   1점도 주기 아깝다  
20180224,10,창정이형보고 봤는데 ㅋㅋ 역시 형은 멋있어  
20180223,1,아직 이 영화를 안 본 사람이 부럽다  
20180223,4,복고가 컨셉인가 넘버3 주유소 시절 감성이네  
20180217,8,이렇게 욕먹을 영화는 아니다 ㅠㅠ  
20180214,1,원래 영화 재미없는거 잘 못 느끼는데 이건 진짜 보는 내내 이걸 보고 있는 내 시간이 아까웠음ㅋㅋㅋ 인생 최악의 영화  
20180212,10,솔직히 억지적인 면도 있었지만 이렇게 악평 받을정도는 아닌듯. 나름 재밌고 괜찮았고 무엇보다 25번 너무이쁘다 ㅠㅠㅠㅠ 여신이네  
20180208,10,복고 향기가 나는 가벼운 코미디 장르에 충실한 영화. 선입견을 버리고 보면 재미와 휴머니즘을 느낄수있음. 13만에 그칠영화는 아님.  
20180207,1,댓글알바 OO기둘 면상을 때려버려야도ㅑ  
20180206,1,어떤 감독들은 곡성 강철비 1987 같은 작품을 만들때 어떤 감독은 로마의 휴일같은걸 만든다.  
20180203,10,킬링타임용으론 손색없는 영화입니다 악플 달 정도로 쓰레기 영화는 아닙니다. 중간 중간 많이 웃고 눈시울도 붉어졌네요  
20180203,8,임창정님과 정상훈님 보러 갔다  
20180201,2,돈 주고 보기엔 아까울 것 같네요. 몇 번 웃기는 했으나 대부분 극 중 임창정의 표정처럼 진지하게 보았습니다.  
20180130,3,지루하고...시대에  뒤떨어진 느낌입니다.  
20180130,10,나는 진짜 재밌고 감동적이라고 생각했는데 평은 나쁘네...  
20180128,5,내용 있는데...많이 아쉽네..  
20180126,9,뜻 하지않은 진주같은 느낌?^^ 잼있었어요  
20180125,1,제발 이런거찍지말라고 민망해  
20180124,8,네이버 평보고 기대를 하나도 안하고 봤는데 재밌었음  
20180121,10,진짜 대박인정!!이시대 김독들이 꼭 봐야할 명 작품.영화를 어떻게 만드면 10만관객이 나오는지 꼭 관찰해야하는 작품  
20180119,10,재밋네10자 ㄹ허ㅣㄹ  
20180117,5,관람객음....이번영화는 생각보다는 아쉽긴 했지만많이 웃을수 있는 좋은 기회 였다  
20180116,5,창정이 형...형만 믿고 영화 보기엔 요새 너무 주춤해  
20180115,1,이런거 만들면 안돼 제발좀  
20180115,5,이거 10년전에 찍은건데 이제 개봉한거라서 그래요  
20180113,7,무난한7점 믿고보는 창정성  
20180111,9,분명 웰메이드나 일류의 영화는 아니다 가볍게 즐기는영화.  웃음과 휴머니즘의 가치는 충분하다  
20180111,10,관람객명배우들 이지만 아쉬운 영화  
20180110,6,관람객약간 뻔한 내용이라고생각되요  
20180108,5,킬링 타임용으로 보니까 그냥 우끼던데 ㅋㅋ  
20180108,1,참 심하게 옛날식이네 쩝  
20180107,10,관람객Soso힘들게참고봣어요  
20180107,5,어지간함 옛날감성이라 이해하고 적당히 보려 했는데..이건 뭐 90년대후반-00년대초반에 나왔어도 망했을 영화임. 시나리오가 적당히 허접해야지..  
20180106,7,"초반엔 노잼 ,B급영화구나.. 그런 B급영화가 재밌네? 나의새로운취향발견  "
20180105,3,코믹물로 갔으면 끝까지 가야지 갑자기 신파쪽으로가네  
20180104,5,관람객예고편보고 봤는데 너무 기대 했네요...  
20180104,1,P2p불법 다운로드로 봐도 시간낭비일 영화2000년대 초반개그? 90년대에 나와도 노잼이었을 영화이런영화에 평점을 2점이상준다면 이영화 관계자 지인일 가능이 높은영화  
20180103,1,임창정..앞으로 영화 그만 찍어라  
20180102,1,에효~~1도 웃기지 않는데 어케 장르가 코미디인지?  
20180102,8,상당히 취향이 갈릴꺼 같기는 하지만 꽤 재미지게 본 영화. 코믹탬포도 잘 맞았고 액션도 멋있었고(1번뿐이지만) 나름 킬링타임용으로 생각없이 보기 좋은 영화인듯.  
20180102,9,모지? 평점1점 ? 보는사람마다 틀릴수도있는거지 뭐 보지말라고 어그로를끌까  저는 나름 잼났습니다  
20171231,3,관람객억지웃음 억지감정몰입을하게하는영화  
20171231,1,관람객내 스타일은 아닌듯 나는 한국인이다  
20171228,7,창정이형 7점 줄게 제발 로맨틱 코미디 영화좀 해 정말 재밌드라 ㅜㅜ 부탁드립니다  
20171225,6,마음편히 놓고 보면된다.  
20171224,6,관람객중간중간 재미도 있고 시간가는줄 모르게 본것같다가볍게 볼수있는 영화..가끔 생각도하게하는 영화큰 스톤리는 기대말고 유쾌하게 보고싶을때 보면좋을듯  
20171222,5,관람객정말 시간이 남아서 보긴했는데 재미없었어요ㅜㅜ  
20171221,10,관람객재밌어요 지루하지 않았어요  
20171221,1,인생역전을 꿈꾸며 현금수송차량을 턴 무장강도 3명은 도망치다 나이트클럽으로 쫓기자 인질극을 벌인다. 일주일만 더 살고 자살을 결심하나 형사반장의 끈질긴 설득에 자수하려는 찰나 특공대가 들이닥치고 결국 교도소로 가게된다. 그후 입양간 여동생이 면회온다.  
20171220,1,진짜 댓글알바들 죽이고 싶다.  
20171217,3,감독 누구야! 하고  찾아보고 나니 수긍이 가네. 마지막 코메디가 두사부일체라니...  
20171215,10,재밌네요 ~잔잔한 감동도 있고 ~^^  
20171212,8,솔직히 그렇게 나쁘지는 않았는데... 사람들 인식이 이러니 한국에서 병맛영화를 안만들려구하지.. 병맛은 그냥 병맛으로 즐깁시다.  
20171211,10,극사실주의 한국영화~~  
20171209,1,씨~발  로마의 휴일 검색하는데 자꾸 이 OOO같은 영화만 쳐 떠서 빡쳐서 들름  
20171207,5,기대라는 생각을 안하고 본다면 뜬금없이 터지는 부분이 있다.  
20171206,4,똑같은 돈을 써도 헐리우드 영화랑 왜 차이가 나는걸까?  답답하다.  
20171204,6,욕 많이 하고 신파요2000년 초반 컨셉요연기파 배우들 연기력이 안깝네요 ㅠ  
20171203,2,관람객음... 뭔가 상당히 아쉽다.  
20171203,1,정말 아닌 것 같습니다.  
20171203,7,"7점이면 적절한듯. 올드한 장르에 어쩌면 뻔한 내용일수는 있으나, 임창정 특유의 유머러스함과 정극이 만나서 뻔하지 않은 내용으로 만들었다. 영화에 처한 상황은한국청년의 삶처럼 탈출구를 찾기 어려운 현실과도 같다. 로마의 휴일이라는 제목에서 애잔함이 느  "
20171202,7,이 영화의 최대 수확은 55번의 발견이다.  
20171201,1,그넘의 신파...ㅡㅡ  
20171128,1,청룡영화제에서 나문희 선생님이 우리후배들 연기너무잘하고 자랑스럽다고...이러면 나문희 선생님 거짓말쟁이 만들어요..이러지 맙시다...  
20171128,1,ㄹㅇ 그냥 개암덩어리 영화 무슨생각으로 만든지도 모르겠고 공형진 저 싸가지 없는넘은 왜쓰냐  전번에 보니까 지가 가르치는 애들 겁나 무시하던데 지보다 높으면 굽신거리나 보네 드러운넘  
20171127,1,별 반개도 주기싫은사상 최악의 영화  
20171126,5,"기대를 하고 보면 실망할 겁니다. 솔직히 재미있을줄 알고 봤는데, 스토리의 전개가 이상합니다.(이게 어디서 웃어야할지 어디서 눈물흘릴지 알수없게 하고, 중후반에는 뜬금없이 범죄영화를 연상하는 장면, 마지막의 억지감동) 보려면 나성기 압송편까지만.  "
20171125,10,난 완전 재밌었는데..ㅋㅋ 웃고싶을때면 언제든 생각날거 같다~ 완전 강추!!!  
20171124,1,"너무 심하다! 어디서 웃어야할지 모르겠고, 경찬반장역은 늘 똑같고, 인질범이 밖에 나가 즐기다 다시 인질극하네!  "
20171123,10,창정이형님이 좋아서봤는데꿀잼  
20171123,6,웃음과 신파가 섞인 전형적인 한국영화그냥 저냥 볼만은했다2002년도쯤에 나왔다면 망하진 않았을것 같다2017년에 이런 영화는 좀...요즘 나오는 드라마보다 퀄리티가 떨어짐  
20171122,5,최고급 재료를 적은 3류 레시피. 재료가 좋으니 맛은 나겠지..  
