0,1,2
20170804,1,로튼 토마토 신선도 트랜스포머5-최후의 기사만도 못함.이걸 수입해온 양반이 자선사업가인거지...그돈을 차라리 거지에게 적선했으면  칭송이라도 들었을텐데...뭐하는 양반인거지(웃음)  
20170804,10,관람객평론가 평점 낮아도 재밌게 볼 수도 있죠.. 기발한 상상력 이렇게 까지 혹평받을 건 아닌 것 같은데 나름 재밌었어요  
20170804,10,관람객캐릭터들 너무 귀엽고 웃겼음  소재 진짜 신박한듯  
20170804,10,관람객진짜 이모티들로 이렇게 감동 받을 수 있나요?ㅠㅠ 이모티들 귀엽고 감동 제대로 줌ㅠㅠ  
20170804,10,관람객귀엽고 완전 신박한캐릭터들 꿀잼이였어요 ㅋㅋㅋㅋ  
20170804,10,관람객가볍게 보기 좋고 재밌던데 ㅋㅋ 더운 여름에 극장에서 시원한 콜라 마시면서 극캉스 좋네요 !!  
20170804,10,관람객어른의 머리로 이해하려하지 말고 아이들의 동심에서 느껴보세요. 친숙한 앱들이 스크린에 나오니까 재밌긴 하더라고요 ㅎ  
20170804,10,관람객이모티콘들의 세계라는 설정자체가 신박했고 스토리도 러블리한 영화~  
20170804,10,관람객익숙한 이모티콘이 움직이니 너무 귀엽 ㅋㅋ  매력덩어리 애니메이션  
20170804,10,관람객기발하고 톡톡 튀는 상상력에 실컷 웃고 감탄하다!  
20170804,10,관람객8점주려다 너무 평점이 그래서 10점남겨요. 조카가 하이파이브 너무 귀엽다고 좋아해요!  
20170804,7,관람객표정이 정해진 세상에서 다양한 표정을 지으면 에러...재미는 소재네요.  
20170804,1,역시 롯데시네마 클래스. 이런 영화를 단독개봉함  
20170804,1,관객들이 돈을 주고 90분짜리 앱광고를 봐야한다고?  
20170804,9,아이들과 여름방학 영화로 보고 왔어요  
20170804,2,"에휴. 아이들 방학인데 슈퍼배드는 보기 싫고, 볼 게 없어 어쩔 수 없이 봤네요. 카3나 더 상영해주지. 초딩 애들 4명 다 재미없었다네요. 아이들이 그렇게 영화보면서 리액션 안 하는 거 처음봤어요. 말이 너무 많고, 웃음코드도 영...  "
20170804,1,"로튼 수어사이드스쿼드29 다크타워21점, 이모티6점 소니 당신들은 대체  "
20170803,1,차라리 날죽여줘...  
20170803,10,관람객아이랑다녀왔어요  이모티컨나라  상상력이풍부한영화네요  공감도 100프로가고 ㅎ 잼나게봤어요  
20170803,10,정말 잘 만들었네요.  혹평 댓글이 있어서 혹시나 하고 봤는데 넘 재미있게  잘 만들었고 교훈도 있어 아이들이랑 넘 잘 보았습니다. 미취학 아동은 좀 커서 다시 봐도 좋을 듯 하네요. 어른들이 보기에도 수준이 있는 잘 만든 영화입니다  
20170803,1,ctrl+c +ctrl v 를 좋아하는  소니  
20170803,10,관람객완전 신세계네요 ㅋㅋㅋ 재미있었어요!!! 이모티콘들의 세상이라니!!!! 배꼽 빠지는줄 ㅋㅋㅋ  
20170803,1,이거 때문에 팝파이 애니가 취소!? 진짜 어이없다  
20170803,10,"관람객나름 교훈도 있고, 애들도 좋아했음캐릭터들도 동글동글 귀엽고 어른 보기에도 나쁘지 않은 영화였어요  "
20170803,10,관람객신선하고 재밌는 액션이 좋아요  
20170803,10,나름 난 귀엽던데 ㅋㅋ 저는 괜춘앗습니다.  
20170803,5,예고편을 무한반복 보는듯... 지루했네요  
20170803,10,뭔가 익숙한 이모티콘들이 나와서 귀엽고 신선하고 ㅋㅋ 볼만했음 ><  
20170803,6,관람객앞에 몬스터호텔 영상은 귀엽고 재밌어요.그런데 본 영화는 식상하네요.좀 아쉽습니다.  
20170803,1,"재미있다고 하는게 이상한 영화, imbd 점수는 10점 만점에 1.5점, 로튼토마토 점수는 100% 중 6%임. 어딜 보고 재미있다는 건지....?  "
20170803,1,문득 궁금해진다. 평점 알바하면 얼마 받는지  
20170803,1,"가장 큰 문제는, 왜 만든지 모르겠는 영화라는것.  "
20170803,1,네이버 진짜 제 정신인가? 평점 1점 주고 혹평한 평점들 5분 주기로 다 삭제 중ㅋㅋㅋ관객들 돈빨아먹는 거 말고 권리는 그냥  신경도 안 씀 ㅋㅋㅋ  
20170803,1,역사에 남을 괴작이자 쓰레기. 소니 너네는 진짜 대단하다.  
20170803,10,"관람객재미있어요^-^스마트폰 속 세상 설정이 기발해요~어린 아이들도 재미있어하지만, 고학년 정도 되면 더 잘 이해할 것 같아요. 어린아이들은 해킹, 바이러스, 클라우드, 방화벽 등 용어를 어려워할 것 같아요.유튜브, 페북, 캔디크러쉬 앱 등장이 재밌네요  "
20170803,2,아이들이 보기에 좋지않은 말들도 많고 정말 지루하네요  
20170803,9,관람객초등학교2학녕 아이가 완전 재밌었다고 합니다  
20170803,8,관람객그럭저럭~~재미있어요~~  
20170803,1,로튼토마토 7점은 이유가 있음  
20170803,10,관람객아이들때문에  기대안하고 봤는데 너무 재밌었어요.모험.재미. 감동. 애들은 슈퍼배드보다 더 재밌데요  
20170803,10,신박한 상상력에 감탄함 ㅎㅎㅎ  
20170803,9,관람객너무너무 재밌게 잘 보고 왔어요.  
20170803,9,뭐가 어수선하고  재미없단건지.. 기대않고 봤더니 신선하고 귀엽고 재밌더만. 쿠키영상 놓쳐서 아쉽다 ㅜㅜ 다운받아서 다시 봐야지.  
20170803,8,"슈퍼배드급은 아니지만,나름 솔솔한 재미가 있네요.조카들이 재밌다고 좋아라하니 머ㅎㅎ  "
20170803,9,"1점 주신분들은 도대체 뭘보고 1점준거지...;;; 미국박스오피스 2위던데, 모바일버젼 인사이드아웃이네요ㅎ 9살 아들과 재밌게 잘보고 왔어요~ㅎ  "
20170803,2,이게 영화냐 ㅋㅋㅋㅋ 살면서 무료로 봤는데 20분 못채우고 그냥 나갔다. 헐리우드도 이런거 만드는구나  
20170803,8,그냥 그저 그랬다...  
20170802,10,관람객아이는 재미있었다네요  
20170802,1,....무슨짓을 한거야?  
20170802,7,어플 지우기가 미안하구나  
20170802,10,아이가  너무재미있어  하네요  
20170802,9,7살꼬맹이 재밌데요.4살은 집중하기 어려워요.ㅎㅎ  
20170802,1,옆에 애들이 처음에 몬스터 호텔 단편하는데 잘못온거 아니냐 시작으로 막 떠들고 팝콘통 치고 머리에다 쓰고.. 조용히 하라는 사람도 없고 돈 날린기분..스마트폰 속 세계를 표현한 상상력에 10점주고 싶은데 애들땜에..끝나고 다 나가는데 쿠키영상 있어요.  
20170802,10,"이모티콘 세상이 있다는 귀여운 상상력이 애니메이션과 딱 어울렸는데, 정색하면서 노잼할 건 아닌 듯 해요~  "
20170802,1,리얼급 아니 그 이하의 작품이 여기 있구나  
20170802,7,관람객기발하지만 느무 뻔한내용의 단순한 영화네요. 미취학아동들이 봐야할듯합니다.  
20170802,9,관람객재미있는 표정을 흉내내며 재미있다고 하네요  
20170802,8,관람객여름방학해서 아이들과 봤어요재미있어요  
20170802,1,"관람객역대 최악의 오글거림과 억지소재, 억지ppl, 그리고... 그리고 ppap의 조합. 만약 당신이 자살을 고민중이라면 이 영화를 봐라. 바로 고민없이 자살고할테니까...  "
20170802,1,정의구현을 해야할 시간이네...  
20170802,8,관람객아이랑함께보기좋아요  
20170802,10,관람객여자 아이들 셋이 봤는데 재미있었다고 하네요.  
20170802,1,"아니 10점 주신 분들은 대체.. 전 딸때문에 봤는데 스토리는 중구난방에 캐릭터&연출도 어수선. 썩토 6%, imdb 1.3, 메타 10점 받은 영화가 어떻게 여기선 9점대로 둔갑하는지 아연실색하지 않을수가... 알바 있는거 안믿었는데 이젠 확신합니다  "
20170802,10,ㅋㅋㅋㅋ이모티콘들  넘나 귀여운듯  
20170802,10,ㅋㅋㅋ 역대급 귀여움이네  
20170802,10,이모티더무비 꼭보셔뇨  
20170802,10,올해 최고의애니메이션!!!!  
20170802,7,뭔가 인사이드아웃 느낌 물씬 풍기는데  
20170802,10,리얼급 영화~~~~ㅎㅎㅎㅎ  
20170802,1,좀... 아닌것 같네요  
