0,1,2
20190110,8,십여년전 회사다닐때 총무과 차장으로 매일같이 스트레스 속에서 일하다 위암으로 돌아가신 형님이 생각납니다. 스트레스는 사람 좋은 사람들이 더 많이 받는거 같아요 주위에 고마운 사람들에게 함부로 하지는 않았나 생각해보는 기회가 되면 좋겠습니다.  
20181226,10,어제 우연히 봤는데 좋은 영화네요  
20181225,1,"아..가족 다 같이 억지로 보다가 도저히 못보겠다고 느낌..억지신파에 모든 전개, 작은 개그소재까지 다 예측 가능하고ㅋㅋㅋㅋ이야 진짜 극혐1점은 별님이 연기에 준다...  "
20181225,10,너무...슬프다ㅠ..  
20181225,9,"""샤늘하다.. 가슴에 비슈가 날아와 꽂힌다."" 말 그대로  "
20181225,1,암에대해 1도모르고 만든영화  
20181225,8,귀욤 별님 연기도 대박!  
20181225,10,처음부터 안 보고 중간부터 봤는데도 진짜 수도꼭지 틀어놓은 듯이 펑펑 울었어요ㅠㅠㅠ 울고 싶고 가족의 소중함을 느끼게 되는 영화여써요ㅠㅠㅠ 코도 막혔었는데 막힌 코를 뚫게 해주는 영화~~!!! 강추강추'^'!!  
20181225,10,최고극 공감가는 영화임오랜만에 눈물범벅됐음  
20181225,10,50대 평범한 가정을 가진 아버지들의 현실을 말해주는 영화~  
20181225,10,간만에 이런ㅜㅜ 영화! 잘봤습니다.  
20181225,10,좋은영화입니다 영화 마지막삽입곡 아시는분 있나요?ㅜ  
20181225,4,딱 00년대 흔한 주말드라마 감성  
20181225,10,이런영화가 상영관이 더 많아졌으면 합니다  
20181225,10,성지루씨 연기력 탁월하네요. 덕분에 몰입이 너무 잘되었습니다. 대한민국 아빠들 응원하고 축복합니다~ 가족 만세~!!  
20181225,10,나의 가족과 제 자신을 돌아보게끔 하네요~정말 재밋게 잘 봤습니다.  
20181225,10,인생영화네요~별기대없이 봤는데펑펑 눈물쏟게만드는...가족의소중함을 다시한번 일깨워준 영화~  
20181225,10,잘봤습니다. 꼭 한번씩 보세요  
20181225,10,보는내내 어찌나 눈물이나던지..좋은영화 감사합니다.  
20181225,10,가족을생각하게만드는.. 좋은영화입니다. 배우들의연기도일품입니다.  
20181225,10,울어서 머리가아프다정말 좋은영화 나자신 그리고 울 엄마아빠를생각나게한다  
20181225,2,대한민국 아빠들 다 죽여야 영화 소재가 떨어지겠어? 왜 죽이는데? 줄거리랑 별개로 이 곳에 엄마와 엄마 사이에 태어난 애들이 보이네???  
20181225,10,크리스마스에 엄청 울었네...ㅎㅎ  
20181225,10,"왜 우리들은 가족이 아파야, 가족과 해어져야 그 소중함을 아는것일까?  "
20181225,10,자꾸만 눈물이  납니다아버지로  남편으로  감동을 줍니다  
20181225,1,"쓰래기, 태어나서 이보다 쓰래기 영화를 본적이 없다. 플롯도 흔해 빠졌는데 몰입이 안돼는 신파까지, 보다가 욕이 목구멍까지 기어나오더라  "
20181225,10,다뜻한 가족영화 크리스마스에 특집으로 봤어요  
20181225,10,정말 너무 슬퍼요... 가족을 다시 생각하게 만들어요  
20181225,10,슬프네요 와울면서보내  
20181225,10,지금 독립영화관으로 보고있는데.. 너무 쨘하고 슬퍼요 ㅜ 아버님들 사랑합니다♡  
20181225,10,너무 재밌게 본영화 가족들간의 사랑을 다룬영화  
20181225,8,솔직히 뻔한 연출이긴 합니다. 기독교를 연결시켜서 좀 그렇지  
20181225,10,정말최고네요 ~~정말 우리현실가정의모습이그대로이고  아파하는가장의모습 가정의회복 까지 눈물나요~~  
20181225,10,KBS2에서 독립영화로 오늘아침에 보여주네요!가장이자 아빠로서의 외로움 직장에서의 서러움너무 공감되다못해 위로를 해주고싶은데그냥 눈물만 흐르게 되네요!대한민국 아빠들 건강과 위로를 전합니다.  
20181225,10,평론가 평론하지마라 ㅡㅡ;; 맨날 죽이고 욕하는 뻔한 범죄영화보다 하나도 안뻔하다  
20181225,10,티비에서 하는데 왜 안봤을까...하는 생각이드네요...따뜻해질수있는 영화  
20181225,10,성탄절에 우연히 보았는데 슬프고 감동이 있는 영화  
20181225,10,가장의 역할이  무엇인지  씁쓸하네요  
20181225,10,감사합니다. 잘봤습니다.  
20181225,2,2017년에 이런 2007년 감성이 나오다니 채널을 보다 놀라 돌렸습니다.  
20181225,4,뻔한 내용...비슷한 주제에선 늘 나오는 레파토리.. 초중반 눈살이 찌푸려지는 부분도 보였고 억지눈물 흘릴수조차 없었음  
20181225,10,지금 티비에 나오는데.. 아... 이말밖에는..  
20181010,10,대한민국 남자들이여 자신의 삶을 돌아보라! 잘 살고 있는가?  
20181003,10,출연자들의 연기도 볼만했고 한가족의 가장의 이야기를 영화속의 잘 풀어낸것 같다.  
20180914,2,제가 암이 걸릴뻔했어요  
20180819,1,"20세기에나 통할법한 영화, 이게 프로메테우스 보다 평점 높은게 실화냐?  "
20180809,10,아 눈물 나~~~~ 이 세상의 모근 아빠들 화이팅~  
20180730,1,진짜 진부하고 답답하고 고구마 이백개먹은느낌이평점 진짜 기독교가준듯  
20180708,10,가족들이랑 다같이 보다가 눈물 터져버렸어요ㅠ 가족의 의미를 다시 한번 생각하게 만드는 영화! 잘봤습니다 사이가 안좋은 가족들에게 추천해요 다같이 모여서 보면 좋아요  
20180615,1,별점줘야하니까 줍니다 식상의 최고봉 기독교 맹신자여야만 재밌는 나머지 별점은 다 기독교인이 준듯 정말 식상하고 제일 재미없는 진부한 감동 억지로 일으키는 영화  
20180522,10,가족의 소중함. 아버지의 무게. 많은 것을 생각하고 돌이켜보게 되는 영화입니다. 가슴 아프고 예쁘고 감동적인 가족 영화입니다.  
20180520,10,참 좋네요~~가족이서 같이보면좋겠네요  
20180513,10,옆사람 미워하지마세요..사랑하세요..  
20180506,10,감동이에요 ㅠㅠ 연기 너무 잘하시네요  
20180504,1,가족 영화를 핑자한 신파...거기에 개독....  
20180503,10,연기력을 떠나서 내용은 좋네요  
20180426,10,아름다운 영화! 눈물이 계속ㅜ  
20180424,10,영화보는내내 너무 좋았습니다.  
20180424,9,"잘 알것 같다고 여기지만, 사실. 제대로 아는게 없는 그런 사이. 요즘 우리 가족이. 대부분 그렇지 않나.  눈물나게 공감가고  부모와 형제 자식을 떠올리게 하기에 충분했다.  아빠가 살아날줄알았는데. .죽은거였어. ㅜ.가장의 무게를 느껴보았다.  "
20180422,6,심심할때 보기.킬링타임으로.  
20180419,1,"뻔한 주제를 살리려면 밀당을 해야하는데 영화의 완급이 전혀 없다. 배우들 연기도  많이 부족하다. 시나리오, 대사도 어설프고, 연출은 더 어설프고..  "
20180410,6,공연하는 딸내미 연기졸못하네접어라걍  
20180405,10,가족의  소중함을 생각나게하는영화  
20180404,10,한번 왔다가 가는 인생...누구나 예외는 없습니다.이쁜사랑 하면서 순간순간 최선을 다하며 후회없는삶을 열심히 사랑하면서 살아가야 겠습니다  
20180330,10,너무 가볍게 시작한 영화였는데 중반부부터 내내 .. 힘들게 살아왔던 아빠를 .. 살아왔을것 같은 아빠가 너무 많이 생각나고 미안한 날이네요 .. 성지루 배우님을 비롯해 모든 배우님들에게 박수드립니다.  
20180313,6,양홍석씨를 보면서 배우의 연기력이 영화에 몰입하는데 얼마나 중요한 요소인지 다시한번 느끼고 갑니다. 성지루씨 연기하는 부분 보다가 양홍석씨 연기하는 부분 보면 이건 뭐;; 다 된 밥에 양홍석 뿌리기.  
20180311,1,영화 개 웃기네.. 4가지 없는 것들이 암걸렸다니까 다 착해져 ㅋㅋㅋ  
20180308,2,난 답답한구석 넘 많던데 아프면 일찍치료하는게 당연한거 아닌가 저건 무슨 병키워서 더빨리 죽길원하는것도 아니고 일단 치료부터하고 생각해야지 난 개OO같다저 애비는 진짜애들생각하면 일찍치료가 우선이다 하지만 이건 영화라...  
20180305,10,계속 눈물이난다. 아들과 소주마실때 너무 가슴이 아팠습니다.  
20180305,10,"오랜만에 아름다운 영화였다. 교회가 나오길래 뭔가 의구심을 품고 보긴했지만, 그리 신경쓸 비중도 아니였다. 그냥 주변에 교회다니는 가정정도... 결론은 기독교 영화도 아니고, 가족애를 느끼기에 충분한 영화였다. 내게 남은 삶이 얼마 없다면,,,,  "
20180222,7,아빠가 죽고 온가족이 화목해지는 착한(?) 한국영화  
20180220,8,이렇게 좋은 영화가 2.7만명이라니...  
20180218,8,있을때 잘하자~~!!!  
20180212,10,관람객뻔한 내용이지만 감동적인 영화예요  
20180206,10,진심이 스며있는 아주 자연스럽지만 힐링이 되는 영화에요  
20180204,1,개독들이 다 몰려왔군.. 평점 조작하러 ㅋㅋ  
20180202,10,배울만한 영화입니다~  
20180201,10,와....뭐지...엄청울었다진짜...펑펑.우리아버지가떠오르는 그런영화였습니다.. 리뷰적어놓은새끼는  영화를볼줄도모르면서 왜깝치지?? 이만큼 감동주는영화 1년에손꼽지도못할만큼없는데;; 최고의 감동영화였습니다..  
20180130,7,스치는 바람결에 사랑노래 들려요 애태웠던 지난날 들이 ~  
20180130,10,제 인생에서 가장 많이 울면서 본 영화네요...2번째는 반디불의 묘..3번째는 지금 만나러 갑니다...  
20180129,10,꼭보세요좋아요강추드립니다  
20180127,10,가족에 대해 생각하게 되는 영화~~~꼭 보세요!!!  
20180126,6,나 너를 울려버리게쒀! 하고 작정한 영화아무 생각없이 영화속 나보다 힘든거 보며 나는 저 상황은 아니니깐 괜찮아 자기위로하며 눈물 쏙 빼기엔 좋은 영화 그거빼면 아무것도 없는 영화근데 그거에 사람들은 열광하는 영화  
20180126,10,너무 울어서 눈이 퉁퉁 부었어요.  
20180124,10,배우 성지루님 외 가족들 연기 너무 좋았고 훌륭했습니다 기도의 진정한 의미도 다시 깨닫고요 너무 아름다운 영상이었습니다  
20180122,10,가족을 소중히 생각해야한다는걸 잘 말해준거 같은 영화... 한가족의 가장으로 산다는거 쉽지가 안다는거에 절대공감하고 이시대의 아빠를 사랑합시다...  
20180121,8,아들분 연기vs딸연기  
20180119,10,뻔한 스토리 맞습니다 그런데 흐르는 눈물을 멈출 수가없었습니다..  
20180119,8,평론가는 왜 있는 겁니까.. 사실 별로 평론같은거 듣고싶지 않은데.. 뻔한평론 하잖아요. 맨날 식상하다 어쨌다. 평론도 지겨운데 평론가들도 별점수 받게 되었으면 좋겠네. 아 물론 영화는 재밌게 봤습니다. 매우 현실적이더군요. 뻔하지만.. 그게 현실임  
20180118,1,눈물 구걸하는 1차원적 신파극  
20180117,10,처음으로 평점 답니다. 극장 개봉관만 늘리면 100만도 가능했었을텐데 아쉽네요 올만의 감동적인 영화를 보게되서 감사했습니다.  
20180115,10,진짜 너무 슬프고 가족을 다시 덜아 보게 만드는 영화네요  
20180115,10,감독님의 팬입니다. 좋은 영화를 만들어 주셔서 감사합니다. 앞으로도 좋은 영화를 많이 만들어주세요. 감사합니다!^^  
20180115,3,백골이 진토되도록 우려낸 지리멸렬한 설정  
20180114,8,"신과 함께 보다 더 슬픈 영화      성지루, 전미선의 연기는 끝내 준다고 나 할까!  "
20180113,8,"먼저 떠나간 가족들이 너무 보고싶어지는 영화였다, 뻔하면 어떤가 감독이 전하고 싶은 이야기는 충분히 받았는걸  "
20180112,2,연기력 정말 말이 안나옴..연기자들 하나같이 못함  성지루나 전미선은 다른데선 뛰어난데 여기선 어색함영화 시나리오나 연출력도 많이 모자라 보여요  
20180112,1,가부장적남편 미화하네 완전여혐영화  
20180111,10,유명한 배우보다도 뒤에서 조연으로 꾸준히했던 배우들이 나와서 더 좋은거 같습니다...훈훈한 가족영화 잘봤습니다~~^^  
20180106,8,"가족의 일원이 암에 걸려 사별하는 아주 평범하고 식상한 소재였으나, 주인공이 처한 환경에 너무나 공감이 가서가슴 찡했던 영화였다. 한 가정의 가장으로서 살아간다라는 것, 즉 내 삶이 아닌 가족을 위한 삶을 살아가는가장의 하루하루 고단한 삶이 너  "
20180104,10,좋은영화 감사합니다.  
20180101,6,특별한 것 없는 평범한  신파 드라마  
20171231,4,개독교를 위한 cbs영화. 굳이 종교를 억지로 갖다 붙여야만 속 후련했냐?  
20171230,10,부모님 계실때 잘합시다^^ 부모님들도 자식들한테 너무 공부공부 하지 마시구요ㅎㅎ  
20171229,10,애잔한것이 가족을 소중함을 다시 한 번 느끼게합니다.  
20171229,10,정말 아버지와 이별을 해보신분은 보면서 뻔하다 식상하다 하지시않을겁니다 연기력를 떠나 영화를 보는것만으로 돌아가신 아버지가 생각이 나고 식상하다고들하시는 소재지만 주변에 널리고 널린 이야기입니다  
20171228,1,난 성지루 성격을 알아서 전혀 와닿지가 않아 생각만 해도 열받네  
20171225,10,너무 울었따.... 가족의 소중함..ㅠㅠ  
20171225,10,최고의 영화입니다 저랑 같이 보신분들 모두 펑펑 울었어요.  믿음의 가정들이 사랑으로 회복되길 원해요  
20171225,10,마음이 따듯한영화 이시대 살아가는 가장들에 삶에 무계 그리고 가족에 대한사랑 어느때는 왼수처럼 싸우지만 또한 세상누구보다 사랑하는 가족 그리고 사랑하는 내사람들 좋은영화 만들어주셔서 감사합니다 ^^  
20171224,10,일상을 모습을 보여주는 이런 현실적인 영화 너무 좋습니다.  
20171222,10,근래본 영화중 정말  최고입니다.  
20171222,7,예전의 수많은 다른 작품에서부터 꾸준히 봐오던 무난함..  
20171222,6,"내 일이 될 수도 있음에 40대 가장이 보기에 그 소재만으로도 감정이입, 기본적으로 점수를 먹고 들어간다. 허나 아쉽다. 첫째 딸 연기가 괜찮았다. 가스펠송은 거부감이 앞선다. 배운 거 하나는 있다. 내 아들의 첫 술잔은 내가 따라줘야겠다.  "
20171222,1,"신파로 똘똘뭉친 영화, 중반부부터는 아에 관객들 눈물을 싸그리 뽑아낼라고 별짓을 다한다 배우가 너무나도 아까웠고 cbs가 이렇게 감독 뽑는 능력이 없구나 싶었다  아버지의 사랑을 알려주고 싶은 건 알겠지만 꼭 가장 비극적인 상황으로 만들어야 했을까  "
20171222,10,너무 슬프다 ㅇ엉아어어아앙ㅇ어엉  
20171221,10,진짜 나무 슬프고 감동적인 영화 꼭봐야할 영화  
20171221,10,너무슬퍼서친구들과울면서봤습니다  
20171220,10,한 가정의 인생 가족 사랑 감동을 느끼게 해준 고마운 영화.  
20171219,2,드라마에서나 영화에서 꼭 암환자는 대부분 죽음으로 끝내더라구요..열심히 치료하면 희망도 있고 살수도 있는데..이런영화보면 암환자 당사자나 가족들은 마음이 미어집니다..  
20171219,10,정말 가족을 생각하게 하는 영화~강추입니다  
20171219,7,뭐 볼만은 했는데...너무 뻔한 내용...아픈걸 알때부터 걍 억지감동모드...초반에 깔아둔 갈등이나 이렇것들은 걍 다 사라져버림...  
20171218,10,간만에 잔잔하고 감동이 밀려오는 좋은 영화였습니다.^^고맙습니다. 좋은 영화를 만들어주신 성배우님과 이외분들  
20171217,10,잘봤습니다  영화보고 눈물난 것도 오랜만이네요..  
20171216,10,내 아버지의 모습이고 내 동료들의 모습에 맘이 아푸고 위로받네요  
20171216,1,뻔하고 올드한 영화 아빠가 너무 답답함 가족을 사랑하는 아빠가 아니라 그냥 멍청한 아빠  
20171215,7,뻔한 스토리지만 슬프네요~  
20171215,4,"너무 비슷한 내용이 많다.세상에서 가장 아름다운 이별,채비 등등 식상한 소재라 아무생각 없이본다.상업영화면 색달라 하지않나 싶다.  "
20171215,9,모두다잘햇지만 성지루와 와이프 탁구엄마의 연기가 너무 돋보이고 이시대에 잘맞는 너무동떨어지지도않은현실감으로 연기 넘나 잘봤숩니다 질질짜면서 봤어요 ㅠㅠ  
20171213,10,질질짜고 울다가 끝났네근데 아빠 아들 연기 드럽게 못한다  
20171212,2,그나마 성지루 연기 땜에 이점준다..스토리 넘허접 무슨 영화를 일케 쉽게 만듦???  
20171211,10,가슴 찡한 가족 이야기네요  
20171211,5,영화는 다 좋은데 왜 기독교가 끼어 들어서 기적을 말하냐고요...아예 종교 얘기로 풀어 내던가....비종교인이 보면 짜증난다는 걸 알아줬으면 좋겠음  
20171211,7,슬픔보다는 “내게 닥칠상황!” 이라서 공포를 느꼈다!  
20171211,10,성지루님 연기 넘흐잘하십니다한가정의 가장으로써 짠하네요재미있게 잘봤습니다  
20171210,5,쓸데없이 종교적 색채가 강해서 너무 아쉽다. 기억에 남을 수 있는 영화가 될 수 있었는데....  하지만 성지루라는 배우.. 너무 훌륭하다.  
20171210,10,힘든 시기 다시 한번 나를 잡아준 영화. 아내와 아이들에게 늘 감사의 표현을 해야겠습니다.  
20171210,8,슬프다.ㅠㅠ가족영화  
20171209,1,기독교 영화 인가요?  흠..  
20171209,8,내용은 좋았으나 아들역할 발연기로 집중이 안됨...그리고 이런감정류의 영화는 일본이 더 완성도가 높을듯...  
20171207,9,성지루의 재발견...뻔하지만 너무나 슬픈 이야기....오랜만에 많이 울었다....  
20171207,9,많이 울었습니다. 20대 였을 때 봤다면 감동적인 영화다 이렇게 생각했겠지만 40대 인 지금 보니 남 얘기 같지가 않네요. 대한민국 아버지들 정말로 존경합니다.  
20171207,10,관람객눈물 콧물 쏙 빼놓은 영화. 가족을 향한 아버지의 사랑을 느낄 수 있습니다.  
20171206,10,한번보길 꼭 추천합니다.!!  
20171206,10,진심으로 강추합니다. 사랑하는 가족... 그리고 많은것을 되돌아보게 하는 영화...  
20171206,10,저희 남편도 건설쪽에  일을 하고 있는데 공감이 많이  갔습니다  남편과 같이 봤는데  처음으로  남편의 눈물을 봤습니다  가장의 무게와 가족애를 다시 한번  느끼게 되었습니다  가족영화로 추천하고 싶어요  우리가족  많이많이 사랑해  
20171205,10,아빠라는 존재가 책임이 무겁고 평생 짐을 지고 가야 할 존재.평생 가족을 지켜야 존재. 바로 아빠!당신이 있어 행복 합이다.이 영화 보신분들 한번만이라도 아빠에게 손 내밀어주세요.  
20171205,1,열심히 그들은 같이 울자고 쥐어짜지만 난 하나도 안슬프고 재미없고 잠오고 시간아깝고 돈아깝고  
20171205,10,부모님께 잘하자  이런말을 남기고싶은 영화  
20171205,1,이렇게 기교없이 펼쳐놓는 영화는 이제 그만하자...  
20171205,10,나의 모습을 성지루가 보여주었다. 눈물을 줄줄 흘리며 봤네. 공공의 적에 나오던 성지루도 좋지만 아버지의 역할을 리얼하게 연개하는 모습에 감동^♡^  
20171205,10,성지루씨 연기.. 진짜 감동적이네요..  너무 뻔한 얘기로 이렇게 감동을 주는 것도 대단한거겠죠? 평론가님???  
20171205,3,억지에 오버를 더해서 뭘 기대하나?  
20171204,8,뻔한 이야기... 하지만 가족이 뻔~해야 하는 이유 아닐까???  
20171203,3,가족에 대한 안타까움으로 감동도 있으나 이거 완전 기독교 영화임???  종교색이 너무세서 거부감 들음.  
20171203,10,헬조선에서는 결혼은 미친짓 애낳는건 인생포기 하는짓  
20171203,1,평점알바인지 출연진들 지인들 쓴 댓글인지  너무 하다는 생각 안하는지?  5점수준의 영화를.... 그리고   부모 보고 꺼지라고 하는 자녀가 있나? 딸은 아버지한테 노답이라고 하지를 않나.  손찌검하는 부모나 ...저렇게 키울꺼면 낳지를 마라.  
20171203,10,"어떻게 살아가야 하는지 참 많은 생각을 하게 됩니다. 내게 가장 가까이에 있는 사람을 소홀히 하는 경향이 있는데, 내 인생 끝에 함께할사람은 내가 소홀히 하고 있는 사람이라는 것을 잊지 말아야 한다는 것을 깨닫게 해준 영화.  "
20171203,10,"채비,푸른노을,내게남은사랑을 이렇게 세편을 오늘 종일 이불속에서 봤다..오늘 하루는 웃음도 눈물도 그리고 참, 여러가지 생각도 들게 한다...이렇게 좋은 영화들 많이 만들어주세요.세편다너무좋네요ㅠ  "
20171203,10,아빠 사랑해 우리 가족 다 사랑해  
20171203,10,우리나라 직장 문화...언제쯤 바뀌려나...아직 멀은거 같아서..씁쓸하구나...  
20171202,9,편집이 끊기고 아들연기가어색하기는하나 본인은재미있게봄 다만교회안다니는분은비추  
20171202,10,소현이 꼭 잘되었으면 좋겠다. 연기도 잘하고 너무 이쁘더라 진짜 존경하는 감독님들 소현이 잘 부탁합니다. 앞으로도 소현이 연기많이 보고 싶다. 이 영화에서의 소현이 투명감? 너무 좋았고 너무 이뻤다요.  
20171202,10,좋은영화네요.꼭봐야하는영화!!!  
20171202,10,오랜만에 많이 울고 가족의 소중함을 깨닫게 되네요  
20171202,10,이 세상에 아빠들이 봐야 할 영화  아니 가족들이 봐야 할 영화  늘 곁에 있어 줄 내게 남은 사랑을  
20171201,1,여기에도 이쁜 여배우는 안 나오나 보네요!  
20171201,10,개봉때부터보고싶었던영화였는데  pooq에올라와서결제해서봤습니다 10000원이아깝지않은영화였어요배우님들의연기도그렇고스토리도그렇고 좋아요보다가엄청울었습니다  나중에라도꼭보셨으면좋겠어요  
20171201,9,"전체적인 스토리가 감동이되고 가족에 대해 다시 생각 해 볼수 있는 영화인것 같습니다. 다만, 몇몇 배우들의 연기력은 약간 부족한것 같습니다.  "
20171201,3,우주역 홍석의 연기가 영화의 집중도를 낮추네요.  
20171124,1,10년 전에나 통할 가부장적 전개에 광신교들의 등장까지 최악이었다.  
20171120,1,X] 이걸 극장에서 일부러 볼 필요는 없을 것 같아요 조용히 티비에서 봐도 충분할 스토리  
20171116,10,영화관에서 이거 보다가 완전 눈물 바다됨요ㅜㅜㅜ  
20171115,10,가족과 함께보면 좋을 영화입니다.  
20171114,10,위로받고 싶은 날 최고의 선택입니다막내 별님이 보면서 딸 키우는 행복이 배가 됩니다 ㅎㅎ  
20171114,10,영화 완전 감동이에요 ㅠㅜ 이예원? 아역배우도 연기 정말 잘하네요.  
20171114,10,너무 감동적이었습니디. 시사회때 본 이예원양이 말을 너무 잘해 감동적이었네요!  
20171113,8,"사랑하는 사람들과 오래도록 함께하면 좋겠지만 살다보면 예기치 않은 순간들이 오는 것 같습니다. 나에겐 해당 없는 일 같지만 그 순간이 언제일지 모르기 때문에 늘 사랑하는 나의 사람들, 가족들과 즐겁게 보내면 좋겠습니다. 아낌없이 사랑을 나누고 사세요.  "
20171112,10,가족의 소중함을 다시한번 느끼게되는 좋은 영화네요♡♡♡  
20171111,10,슬픈 영화를 보면서 많은 눈물을 주기적으로 흘려주는게 눈건강에 좋은것 같습니다. 영화보시기전에 손수건 혹은 눈물 닦을 휴지 들고 영화보세요. 출연진도 연기를 잘하시고 영화 잘 만들었네요  
20171111,1,넓은 극장에서 혼자 관람함 평점 6점이상 준사람들 영화봤는지 의심됨 뻔하게 슬퍼보이는 예고편이지만 영화보면 눈물 한방울 안나옴 한숨이 많이 나오지 참고로 난 보다가 나왔음  
20171111,8,관람객아들 연기 너무 어색했던거 빼고는 좋은 영화였어요.아빠가 보고싶어지는 영화ㅠㅠ  
20171111,10,매우 감동적인 영화였네요. 가족끼리보면 좋을듯합니다  
20171109,10,좋다b 가족 각자의 사회공간에서  공감가는  스토리라 좋았다  
20171109,10,"사춘기인 남동생에게 보여주고 싶어서 가족과 같이봤습니다. 배우분들도 연기잘하시고, 가족의 고마움을 다시한번 느끼게 해주는 영화네요 . 지금 사춘기를겪고있는 가족이 있다면 더욱 추천합니다.  "
20171109,7,뻔한 내용 치고는 감동적이었습니다만... 홍석씨는...안타깝습니다...  
20171109,10,"성지루, 전미선 주연들의 연기가 너무 좋았어요중간중간에 울컥울컥하다가 마지막에는 거의 오열ㅠ아버지 생각에 ㅠ바로 연락드렸네요 좋은영화 감사해요  "
20171108,6,관람객가족의 따뜻함을 알게해준영화  
20171108,9,조금은 뻔한내용인데  우리일상이라  더 마음에 와닿았다?눈물이ㅠㅠ  
