0,1,2
20171108,1,보는 내내 아들연기 때문에 짜증나서 집중이 안됨..스토리를 떠나 내가 역대 봤던 모든 영화 최악의 캐스팅이자 연기력이였음.... 입만열면 몰입도 파괴.. 딸역은 가수출신인데 노래저렇게 못했나 싶고 기독교인 조차 보기힘든 기독뽕수준....영상기법도최악  
20171108,10,가족의 소중함을 느끼게 해주는 영화입니다. 눈물폭발 장치가 많이 보이긴 하지만 배우들의 탄탄한 연기가 영화를 몰입하게 만들어 줍니다.부모님들과 함께  보면 좋을것 같습니다~  
20171108,7,가슴 따뜻해지는 영화네요. 흔한 내용이지만 그래도 지루하지않게 잘만든거 같습니다.  
20171108,9,아빠를 다시한번 생각하게 하는^^아들 연기가 조금 어색하긴 했지만 막내딸의 귀여움으로 커버^^슬퍼슬퍼ㅜㅜ  
20171108,7,잘만들어진 영화는 아니지만 남자도 울컥하게 만드는 영화.영화관을 나오며 아버지에게 전화하게 만드는 영화.  
20171108,10,울뻔해쪄 흑흑흑흑흐규  
20171108,1,"스토리도 부족하고, 기독교신자를 위한 영화..  "
20171107,10,초중반부터끝날때까지울었다 아빠한테 당장 전화해야지  
20171107,10,CGV 에서 보고왔습니다.성지루란 배우  연기력에 감탄감탄을 하면서눈물을 너무 흘렸습니다 이시대 가장의 현실과 아픔을 그대로 담아낸듯 합니다정말 좋은영화 한편 뜻깊게 감상했습니다  
20171107,9,잊고 지냈던 가족간의 사랑과 책임을 다시금 일깨워줬네요  가족들과 꼭 한번 봐야될 영화 같습니다.  
20171107,10,ㅜㅜ 너무슬프다 부모님  보시라고 예매해주어야할 영화  
20171107,10,아버지 보고싶습니다..  
20171106,10,"나도 언젠가 아버지가 될 것이지만, 나는 어떤 아버지가 될 수 있을까. 지금의 나는 아버지와 어떠한 시간을 함께 보냈고 또 어떠한 아들이었나. 가슴이 먹먹해지는 영화였다. 조금 아쉬운 점이 있다면 기독교 홍보가 너무 많았고 아들의 연기력이 아쉬웠다.  "
20171106,10,가족의 소중함을 알게되는 영화이다 손수건 준비 안하고 보면 안될정도로 슬픔  사춘기가 와서 매일 싸우지만 누군가 아플때 그후로 후회하고 잘해주는개 아닌 내가 지금 이시간부터 효도해야 겠다고 생각해주는 좋은 영화이다  
20171106,10,평범한 가정속의 평범하지 않은 감동누구는 뻔하다고 할 수 있지만 모든장면이 공감되고 감동적인 영화였습니다.  
20171106,9,가족에 대해서 한번 더 생각해보게 되었어요 영화 잘 봤습니다  
20171106,6,"영화 자체로는 별로였지만 감동은 충분히 받을 수 있었던 작품이었다. 가족을 생각할 수 있는 작품이었고, 눈물내기에는 충분!  "
20171106,10,"올해 내 최고의 영화  중 하나에 꼽힌다.덩케르크, 공범자들, 내게 남은 사랑을..특히 이 영화는 드라이한 내게 마지막 부분 계속 눈물 흘리게했다  "
20171106,10,아니 와 1시간동안울었어 아이 씨  
20171106,10,가족끼리 같이 볼 수 있는 무지 감동적인 영화입니다...  
20171105,8,관람객정말 평범한 가정에 저런일이 닥치다니..정말 슬프고 감동적입니다.  
20171105,10,꼭보세요 처음부터끝까지 울었네ㅠㅠ 영화끝나고 한참동안 스크린만보고있었어요ㅠㅜ최고입니다  
20171105,10,진짜 이 영화 강추!!!! 손수건 꼭 들고가야됩니다!~~~진짜 펑펑 울었어요...내용이 뻔한 스토리일 수 있지만 연기력이 정말 탄탄하네요@@  
20171105,10,성지루씨 연기력에 다시 한번 감탄했습니다.장르상 스토리가 다소 진부할 수는 있으나 충분히 볼만한 영화입니다. 저예산 영화라 홍보가 부족할 것 같은데 많은 분들이 보셨으면 하는 마음에 평점 남깁니다.  
20171105,10,이런 영화는 많이 나오는게 맞다. 뻔한 스토리라니 말이냐 방구냐 인생이 뻔하니까 열심히 살아봐야 소용 없다는 여느 꼰대와 같은 말이다. 평론가 놈들이란  
20171105,10,"너무 슬펐어요ㅠㅠㅠㅜ그냥 단순히 슬픈 영화인 줄 알고 보러갔는데 너무 기대 이상으로 눈물 좍좍 다 뽑아냈네요ㅠㅠ동생이랑 보러갔는데 진짜 가족 다같이 보러가는 것도 좋을 것 같아요!!보고만 있어도 눈물이 나옵니다..가족의 소중함,따뜻함이 잘 드러난 영화  "
20171105,10,정말 슬프게 울면서 봤어요 ㅠ가족의 소중함을 느낄수 있고 특히 보면서 계속 아버지가 생각나는 영화입니다  
20171105,10,아버지의 존재에 대해 다시 생각해보게 하는 영화였습니다!  
20171105,10,부모님과 함께 보기 좋은 영화네요??가족영화로 딱 입니다  
20171105,10,너무 감동적으로 봤습니다.얼마나 울었는지 눈이 퉁퉁 부었네요.다른분들한테 추천 하고 싶네요~  
20171105,9,이 시대 대부분의 아버지들이 이렇게 사시는데...ㅜㅎㄹ쩍... 말 한마디라도 따듯하게 해야지 ...훌쩍..  
20171105,10,좋은영화좋은연기아쉬운 상영관?  
20171105,10,펑펑 울었어요....  
20171104,10,"진짜 올해 최고 감동의 영화.. 아버지의 존재에 대해서 다시 한 번 생각해보게 되었고, 정말 배우분들의 연기도 최고였다.모두가 꼭 보았으면 좋겠어요!  "
20171104,10,온가족 함께 보며 많은 생각을 했습니다. 감사합니다.  
20171104,10,가족이 생각나는 영화있을때 잘할걸 알면서도 쉽지 않지만전화라도 자주 드릴것..  
20171104,10,너무 울어서 머리가 아플정도에요ㅠㅠ아직 안보신분들 어서 가서 보세요!!!강추입니다  
20171104,10,가족의 소중함 다시함 생각해보게 해준따뜻한 영화  
20171104,10,관람객가족드라마 좋아하시는 분들은 꼭 보세요. 강추입니당  
20171104,7,한국식 가족드라마를 완벽히 답습했다하더라도 성지루 아저씨의 연기만큼은 영화를 끌어가기에 충분히 감동적이였습니다 개인적으로 아들로 나오는 양홍석과 태양형은 최악이였다 둘만나오면 집중깨짐  
20171104,1,전형적인 신파극 앞선 작들을 다 짬뽕시킨것같은 느낌의 영화네요 비추드립니다 신선함도 없고 재미도업습니다  
20171104,10,뻔한 스토리지만 흐르는 눈물을 멈출 수 없었다. 바쁜 일상에서 매일 생각하게 되는 왜 사는지에 대한 질문을 다시 던질수 있었다.  
20171104,1,예고편만 봐도 결말까지 예상이 되는 뻔한 시나리오 분명 본거같은 스토리 거지같은 감성팔이가 뭉쳐 삼위일체가 되었다  
20171104,10,"남자들이 더 울게되는영화~상업적인 영화말고, 심장을 울리는 이런 영화가 스크린 확보가 많이 되어야 따뜻한 대한민국이 될것같네요~  "
20171103,10,최근 본 영화중에 최고였네요 ㅠ 작은 이야기속에 큰 메세지가 있었어요. 진심으로 추천 합니다.  
20171103,10,평론가 의견 아무리 개인의 생각이더라도 조금 너무한 것 같다. 그렇게 치면 안흔한 영화가 어디있다고... 영화 평론가들 '직업'에 맞추어 깐깐하고 점수를 짜게주는 것  같은데... '직업'이 아닌 '개인'의 생각도 조금 반영해  
20171103,10,가슴 찡한 감동이 있는 영화네요.꼭 가족이 함께 보시길 추천합니다.서로의 맘을 헤아리지 못하고 사는 요즘 꼭봐야할 영화라고 생각합니다.강추~~  
20171103,10,원래 우리들의 가족 모습입니다아름답고 슬프고 소중한 영화입니다우연하게 보았는데  국민 모두가 보고 가족 사랑의 소중함을 느꼈으면 좋겠습니다  추천합니다  
20171103,10,가족과 함께 볼 좋은 영화네요...^^  
20171103,10,남편들이 꼭 봐야할 영화  
20171103,9,오랜만에 우리 가족 모두가 함께해서 가족애를 느낀 순간순간이었다. 아역배우 시절의  모습을 회상하면서 최고의 스타로서의 성장을 예감해 본다. 우라 학교 축제에 모두를 초대하고 싶다 그 소망이 이루어지길 기도해본다  
20171103,10,아... 눈물 그냥 주르륵 주르륵 영화 끝나고 다리 풀려서 나옴...  
20171103,10,감동입니다.보면서 계속 눈물을 흘렸습니다. 오늘날 부모님과  자녀관계를 잘 설명해 주었습니다.  
20171103,10,진솔한 가족 이야기..일상의 행복을 느끼게 해준 영화 입니다. 너무 감사하고 다시한번 돌아보게 되는 것 같습니다.  
20171103,9,아빠가생각나는너무슬픈영화  
20171103,10,"대한민국 아빠들 정말열심히살죠..늦기전에 가족들한테 가슴속에있는 진심..말합시다..여보사랑해♡우리아들,우리딸 공쥬님 사랑한다♡라구요..아빠들 오늘도 화이팅합시다! 가족을위해서!!!  "
20171103,1,글쎄요 너무식상하지않았나싶네요  
20171103,10,공감되는 이야기가 많았습니다. 아빠와 싸우거나 형제와 싸우는 등 평범해서 지루할수도 있지만 그래서 더 공감가고 집중할수잇었던것같습니다  
20171103,10,정말 펑펑 울었습니다정말 가족적인 영화입니다 전미선씨와 성지루씨의 연기에 마음이 아파왔어요  
20171102,10,가족의 소중함을 느낄수 있었던 영화입니다강추해요  
20171102,10,가족의 소중함을 느낄수 있었습니다. 강추  
20171102,9,울고싶다면 이영화를봐라 친구랑볼꺼면 왼쪽 주머니에 휴지를 몰래 들고가라 재미 없고 안슬프면 어떻하지 생각하지마라 안울려고 꾹 참고 있었는데 눈깜빡이니깐 눈물이 뚝 뚝  
20171102,10,영화관에서 걍 입에 주먹넣고 겁내울었어요 슬푸다흐어어컹커어커어커엌가족의소중함을 알게해주는영화  
20171102,1,지루한 주제에 늘상 비슷한 설정  
20171102,10,성지루랑 전미선씨 때문에 더 울컥했다...크흑ㅠ  
20171102,10,기대 안하고 봤다가 눈물 펑펑 쏟고 왔어요ㅠㅠ  이런 여운 남는 영화 너무 좋아요!  
20171102,10,엄마아빠 생각이 진짜 많이 났어요ㅠㅠㅠㅠ눈물 한바가지 쏟았네ㅠㅠㅠ  
20171102,10,영화보는 내내 울다가 나온거 같네요 ㅠㅠ  
20171102,10,스토리 너무좋다.. 한번더봐도 좋은영화다  
20171102,10,오늘 보러갔다가 오열하고 얼굴 엉망돼서 나옴..ㅠㅠㅠ 부모님 모시고 N차 찍으러 가야겠다  
20171102,10,ㅠㅠ 요즘 날씨에 가족들과 함께 보기 딱 좋은 영화였어요  
20171102,10,내게남은사랑을 정말 펑펑울었어요ㅠ.ㅠ 모두 꼭 보세요 ㅠ  
20171102,10,"손수건 없이 간다면 정말 수퍼 스튜핏...!  영원할 것 같던 가족들이 떠나간다면... 지금 당장 고백해야한다. 부모님, 사랑합니다...  "
20171102,10,성지루씨 전미선씨 명품연기에 눈물 주륵주륵 ㅜㅜ 손수건 꼭 챙겨가시길.. 가족들과 함께보기 좋은영화~~  
20171102,9,내게 남은 사랑을~제목만 들으면 노래제목 같지만 가족들이 함께 보면 늦가을의 가족의 소중한을 느낄수 있는 영화같습니다.주변 지인들에게도 추천해 줘야 겠네여~^^  
20171102,10,보는 내내 부모님 생각이 나서 많이 울었네요 ㅜㅠ 사랑과 감동으로 충만한 명품 가족극!! 진짜 강추드립니다♡♡♡  
20171102,6,무분별한 눈물의 연속. 몇몇배우들이 미스캐스팅  
20171102,9,가족의대해 다시 한번 생각할수 있는 기회가 될듯요.아빠는 외로워ㅠ  
20171102,5,공사현장 9시작하는곳도 있나요?  
20171102,10,배우의 인지도로 선택하면 스튜핏~탄탄하고 스토리와 감동적인 내용을 선택하면 그레잇~내게 남은 사랑을 선택하연 슈퍼 그레잇~  
20171102,10,이 시대를 살아가는 우리의 아버지들에게 응원의 박수 보내고 싶다. 사춘기의 까칠함을 잘 연기해준 쌍둥이 남매 홍석과 소현...성공적 영화 데뷔를 추카추카!  
20171102,10,이 시대 아버지를 본 가족의 마음과 가족을 본 아버지의 마음이 느껴지는 영화  
20171102,9,내게 남은 사랑을 드릴게요  
20171102,10,"지금의 나, 그리고 가족을 다시한번 깊이 생각하게 만들어준 영화.  "
