0,1,2
20171002,10,관람객아이들과 함께 보며 더불어 즐거워지는영화  
20171002,7,관람객다소 말투가좀 빠른편이나 워낙딸은재밋었다고하네요  
20171002,5,관람객아이들 영화라 어른들에게는 안 맞지만 재미있게아이들과 봤어요. 아이들도 보면서 즐거워하고 시간이 금방 지나갔나고 하네요. 아이들은 볼만한 영화에요.  
20171001,10,관람객딸이재밌게봤어요 좋은시간이였어용  
20171001,8,관람객메가박스 키즈전용에서 재미있게 봣어요  
20171001,10,관람객아이가 재미있어 하네요^^  
20171001,10,관람객즐거운 시간이였습니다.  
20171001,8,관람객생각보다눈요기도되고비주얼도좋고내용도있고막판애는겨울왕국내용인줄~~~  
20171001,8,관람객아이들이  좋아하네요 잼있었네요  
20171001,8,관람객8세 이하 여아 추천요..ㅎ 물론 8세 이상도 재미있다 할수 있겠지만.. 저희딸은 재밌었냐고 몇번을 물어봐도..보통 ..글쎄ㅡ. ㅡ 이런 반응이네요 ㅋㅋ 꼬꼬마 아가씨들을 위한 영화!!  
20171001,10,관람객아이들이 같이 보기 좋아요  
20171001,10,관람객6세딸이 너무좋아했어요.티브이랑 다르게 색감 노래다 좋았어요  
20171001,7,관람객그냥 애들이 좋아해서 같이 봤네요 ㅎㅎ 신비한 섬이 예뻤어요 ㅎㅎ  
20171001,8,관람객딸이 좋아해요 유니콘도 좋아졌어요ㅎ  
20171001,8,관람객공주가 좋아할 영화예요재밌게 봣어요  
20171001,9,관람객역시 디즈니라 색감과 노래가 좋아요~아이도 재밌었다네요~  
20171001,10,관람객그래픽이좋네요.딸이좋아해요  
20171001,9,소피아가 주인공이 아니라 엠버가 주인공 같았어욤  
20171001,1,실수로 예매해서 억지로 보러갔다진짜 토할정도로 오글거렸다  
20171001,7,관람객집에서 좋아했던 소피아인데요 극장판이라 좀더기대했는데 티비소피아를불꺼놓고보고왔네요ㅎ  
20170930,10,관람객아이가 너무 좋아해서 10점입니다. 즐거운 추석 맞으세요  
20170930,4,관람객티비에서 보던 거보다퀄리티가 많이 떨어져서 조금 당황스러웠음..  
20170930,10,기대안하고  통신사  무료로 봤는데  넘  재밌어요^^  
20170930,7,관람객노래는 좋은데 내용이 약간 지루함  
20170930,10,관람객소피아가 포기하지않고 나쁜마스터를 용감하게 맞서싸워서 수호자가 된것이 좋았어요-이서준아들 의견~^^♡  
20170930,8,관람객어린이들이 보기에 괜찮았습니다  
20170930,10,관람객참 재밌있네요 아이들이 좋아해요  
20170930,10,관람객딸아이랑 보기 너무 좋았어요~  
20170930,8,관람객4세 딸이 재밌게 보았고하비오메가박스 상영관이 작았는데도평일 1시반 자리는 많이 비어있었어요.그러나 저는 좀 졸았습니다  
20170930,7,관람객직전의 아발로 왕국보단 못했지만 그래도 재밌었습니다  
20170930,9,관람객아이랑 함께 재밌게 보았어요~~  
20170929,10,조카 데리고 가서 봤는데 너무 좋아하더라구요!! 뿌듯뿌듯 인형도 사달래요...ㅋㅋㅋ  
20170929,10,"딸아이가 TV시리즈 너무 좋아해서, 극장 개봉만을 손꼽아 기다렸는데, 스케일이 다르네요 역시ㅋㅋ  "
20170929,10,여자를 위한 애니인듯...  
20170928,10,시사회로 봤는데~ 울조카 보더니 소피아  앓이 지대로 하네여  
20170928,10,여자아이가 있다면 무조건 보시라고 말씀드리고 싶네요~ 아이들이 좋아해연  
20170928,10,조카랑 보러 갔는데 너무 즐거워하더라구요 ㅎㅎ 여자아이라 그런지 소피아 캐릭터를 넘 조아해여 ~  
20170928,10,조카를 위해 개봉하자마자 예매해서 봣는데.... 왜 제가 더 제미있게 본거죠...? 조카랑 함께 빠져서봤어요 TV판이랑 확 다른 버전이었네요 ㅎㅎ 재미있게봤습니다!  
20170928,10,보고나왔더니 조카가 소피아  노래 엄청 따라 부르네요~ 추석 연휴때 극장 또 가게 될 것 만 같은 예감 ㅋ  
20170928,10,"1편보다 훨씬 재밌었다! 캐릭터들 진짜 진짜 귀엽고, 노래도 뮤지컬형식이라 너무너무 좋았음 ㅜㅜ 또보고싶다!  "
20170928,10,조카랑 오늘 보고왔능데 너무 귀여웠어요~!  
20170928,10,조카가 보여달라고 생떼부려서 봤는데 꿀잼이었음ㅋㅋ그리고 엘사목소리나와서 깜놀ㅋㅋㅋ  
20170928,10,조카 데리고 다녀왔는데 역시 너무 좋아하네여ㅎㅎ 근데 제가 봐도 빠져들더라능....노래가 나오니까 엄청 신나네옄ㅋㅋㅋ  
20170928,10,아이와 함께 가족이 다함께 영화를 봤는데 아이들이 너무 좋아하더라구요~ 캐릭터도 너무 귀엽고 좋았습니다~  가족이 모두 함께 보는 디즈니 애니메이션! 추천해요~  
20170928,1,왤케 나오는 여캐들이 겁나 못생겼냐. 심지어 말까지 못생겼네. 못생긴 아이들에게 꿈과 희망을 주기 위해서 그렇게 했나...  
20170928,10,친구랑 둘이서 봤는데 정말 꿀잼이에요 시간과 돈이 아깝지 않아~~  
20170928,10,앙기모띠 평점10점준다 그라샤~  
20170928,9,애들이 너무 좋아해요~ㅎㅎ  
20170928,10,보고나왔더니 조카가 소피아  노래 엄청 따라 부르네요~ 추석 연휴때 극장 또 가게 될 것 만 같은 예감 ㅋ  
20170928,10,"1편보다 훨씬 재밌었다! 캐릭터들 진짜 진짜 귀엽고, 노래도 뮤지컬형식이라 너무너무 좋았음 ㅜㅜ 또보고싶다!  "
20170928,10,조카랑 오늘 보고왔능데 너무 귀여웠어요~!  
20170928,10,조카가 보여달라고 생떼부려서 봤는데 꿀잼이었음ㅋㅋ그리고 엘사목소리나와서 깜놀ㅋㅋㅋ  
20170928,10,조카 데리고 다녀왔는데 역시 너무 좋아하네여ㅎㅎ 근데 제가 봐도 빠져들더라능....노래가 나오니까 엄청 신나네옄ㅋㅋㅋ  
20170928,10,아이와 함께 가족이 다함께 영화를 봤는데 아이들이 너무 좋아하더라구요~ 캐릭터도 너무 귀엽고 좋았습니다~  가족이 모두 함께 보는 디즈니 애니메이션! 추천해요~  
20170928,1,왤케 나오는 여캐들이 겁나 못생겼냐. 심지어 말까지 못생겼네. 못생긴 아이들에게 꿈과 희망을 주기 위해서 그렇게 했나...  
20170928,10,친구랑 둘이서 봤는데 정말 꿀잼이에요 시간과 돈이 아깝지 않아~~  
20170928,10,앙기모띠 평점10점준다 그라샤~  
20170928,9,애들이 너무 좋아해요~ㅎㅎ  
