0,1,2
20151004,10,"사랑하는 법을 알게 해줘서 고마워. 사랑받는 법도.이 영화를 보고 내가 정말 사랑할 사람을, 그리도 나를 정말 사랑해줄 사람을 만나고 싶단 생각이 절절하게 들었습니다...꼭보세요 제발  "
20150930,10,"기대없이 봤는데 처음에 별로던 여주도 점점 이뻐보였다, 연애지침서 혹은 삶의지침서가 될수도...  "
20150928,10,익숙함에 무뎌져 사랑하는 사람을 잊고 있을 때 꼭 보세요  
20150926,10,나이어린친구들은무턱대고평점1점주는이해못하는무뇌들있다.영화자체를이해만다한다면충분히눈물나오고 감동깊은슬픈영화다. 진짜살면서 이런영화는처음본다 제작자에게감사할뿐인다.  
20150925,10,다들 명작이라고 해서 오늘 봤는데 왜 이때까지 안봤나 후회된다. 영화보면서 울어본 적이 거의 없는데 펑펑울었다. 지금 옆에 있는 남자친구한테 더 잘해야겠다는 생각이 든다. 나중에 남자친구랑 한 번 더 봐야지...  
20150924,8,이 영화같은 사랑해보고 싶다. 인생에서 이 사람이 아니면 절대 안될것 같은 그런 사람을 만나 평생을 같이 할 수 있다는 것은 큰 축복일 것이다. 계산하지 않는 순수한 사랑. 내 모든걸 바쳐도 아깝지 않는 사랑.나도 그런 사람을 만나 사랑할 수 있을까?  
20150922,10,봐도 또봐고 너무 좋은영화.. 1년에 한두번씩은 꼭보는..  
20150919,10,아 내가 원망스럽다난 왜 이영화가 감동이없지재미없는건 아니고 두번봤으니까..난 사랑을 모르나.. 하  
20150918,10,저는 귀찮아서 평을 잘안썼는데꼭 쓰고싶네요..초등학교때 마음이 이후로 영화를 보고 운적 없었는데 울었어요정말 고마운 영화에요 배우고 갑니다  
20150917,10,처음이자 마지막 평점등록 내인생최고의영화  
20150916,1,아니 마지막에 택시를 왜 타?;  
20150913,10,제니퍼 러브 휴잇 정말 이쁜듯...  
20150912,1,이거 과거로 돌아감 ㅋㅋ  
20150909,10,좋은 영화...;; ;;  
20150907,10,남자인 나를 처음으로 눈물흘리게 한 영화  
20150906,9,정말 사랑하던 사람이 하늘나라로 갔습니다. 왜 그 땐 더 열정적으로 아껴주고 사랑해주지 못했나 하루도 후회하지 않은날이 없습니다. 아마 죽을때까지 그럴것같습니다. 영화처럼 하루만 내게 더 주어진다면 얼마나 좋았을까요.  
20150906,10,그 자체로 좋은 영화가 아닐까.  
20150906,10,진짜 울만한 장면이 아닌데도 감동이 북받쳐서 울어본적은 처음이다. 내가 눈물이 많은건 알고 있었지만 .. 이렇게 펑펑 울줄이야  
20150905,10,남자친구를 만나고 있지만 문득 외로워질때가 많은 요즘.사랑받고 있지만 받고있는 것 같지 않는.. 답답해서 펑펑 울어 버리고 싶었던중 생각났던 이영화. 볼때마다 느끼는게 많은 영화에요. 오늘은 이안이 처음 택시를 타기전 사만다가 꼭 저 같아요  
20150903,10,아련하고 아름답고 감동적인 영화.  
20150828,10,사랑받는법을 알려줘서 고마워 cy아..  
20150827,9,"사랑, 그 놀라운 힘이란...!  "
20150826,10,인생영화...꼭보세요 두번 보세요...  
20150825,7,영화 후반부가 인상 깊었다  많은 생각을 하게해주었지만 눈물이 나오진 않았다  
20150823,10,제 여자친구에 대한 소중함을 다시 한번 알게 해준 영화였습니다. 정말 너무 감동이었고 영화를 보면서 이렇게 운 적은 처음인 것 같네요  
20150817,10,슬펐습니다 옛날생각이나서..  
20150817,8,'계산없는 사랑'을 해보고 다시 영화를 봐봐야겠다.  
20150816,10,몇 번을 다시봐도 볼 때마다 가슴이 저민다. 오늘같은 날. 보면 괜시리 그리워 진다. 만약 다시 그때로 돌아간다면 우리의 과거가 엉망이 되지 않게 좋게 끝내고 싶다.  
20150816,4,감동도 없고 재미도 없다. 엊그제 영화 노트북봐서 이 영화가 저하 되어 보이는걸까...?  
20150813,10,몇번을 봐도 질리지않는 내 인생영화..  
20150812,10,"처음 봤을때에는 잘만든 멜로 영화라 생각 했다. 하지만 몇년이 지나고 다시 보고 다시 몇년이 지나 다시 봤을때, 그동안 느꼈던 감동이 몇배는 되어 돌아온다. 정말 저렇게 나는 할 수 있을까.. 저런 사람으로 기억 될 수 있을까..  "
20150812,9,다좋은데 택시기사 왜욕해 ㅁㅊ넘들아  
20150810,10,사랑을 하며 이별을 해보신분이라면 가슴깊게 남을 영화가 될것같아요. 모처럼 슬프게 울었네요  
20150809,10,남자 진짜 너무 멋있고 그냥 내 인생영화  
20150807,7,계산 없이 진심으로 사랑하고 싶다  
20150804,10,아놔.. 마음이 영 울적해서 마음 좀 가라앉히겠다고 본 영화인데 마음이 더 아파짐. 괜히 밤늦게봐서 잠도 설치고.. 헤어진 여자친구 생각도 나고.. 영화가 뭐이따위인지. 에라이 별점 10점 쾅!!!  
20150801,10,"매우매우 훌륭했다. 개인적으로 너무좋아하는 소재영화, 역대 탑5에 들어가고 중간에 소름돋는장면도 몇번있었고 비록 끊어서 지하철, 차안에서 봤지만 너무 훌륭하고 뜻 깊었다. 아무렇게 보내는 하루가 이토록 뜻 깊은것이었다니, 결말도 아주좋았고 최고 !  "
20150801,7,뻔한 연출 뻔한 각본 뻔하지 않는 감동  
20150731,10,오랜만에 다시 보아도 눈물바다네요.T^T 쉽게 사랑하고 헤어지는 요즘 세대에.. '진짜 사랑은 이렇게 하는거야'라고 섬세하고 탄탄한 스토리로 알려주는 영화. 마음만 가득했지 사랑할줄 몰라 떠나보낸 그 사람이 그리워지는 영화입니다..  
20150731,5,상투적이지 않았다면 감성에 축축 젖었을텐데.  
20150730,6,목숨과 맞바꿔 지켜낸 절절함.  
20150730,10,택시기사 OOO... 감독도 OOO... ㅠㅠ  
20150727,7,지금 내곁에 있는 사람이 있다면 정말 소중하게 아끼고 사랑해주시길.  
20150726,10,"6번 이상을 본 영화입니다.정말 마음 가는 영화입니다..다른사람에게도 추천해주고싶고 여친안테도 보여주고싶네요,,  "
20150723,10,아름답고 투명한 영화..  
20150720,10,저는 정말 너무너무 재미있게 본 영화입니다지금까지 한 8번은 본거 같아요 제가 아는 로맨스 영화 중에 단연최고 이구여 너무너무 좋아해요 추천해준 친구들한테 들어보면 ^^ 이 영화를 보고 조금은 연애를 하고싶어 하는 마음이 들었습니다  
20150720,10,"진짜 영화 잘만든거같음,,  "
20150720,10,진짜 살면서 꼭 봐야되는 영화  
20150715,7,딱히 9점짜리까지 아닌거 같은데. 장르빨 많이 받음.  
20150714,7,하루의 반복과 로맨스라는 흔한 주제를 영민하게 조율했다.  
20150711,6,다 좋은데 감정 이입이 안되더라...  
20150706,10,왜 이영화를 이제서야 보게됬는지.... 너무 슬프고아름다운영화다  
20150704,10,"감성적인 사람이라면 꼭 꼭내 평점 보고 무조건 보기를,,최고!!  "
20150703,10,진짜멋있고 훌륭한 영화네요  
20150629,10,전설의 멜로영화 이영화를 보고 울지 않는다면 사랑을 안해본 사람!  
20150628,10,몇번을 보아도 생각이 많아지는 영화인거 같습니다. 운명은 변하네요. 운명은 변합니다.  
20150626,10,5분을 더살든 50년을 더살든....  
20150625,10,판타지와 사랑 희생 등등등 모두다 좋았다  
20150623,10,최고최고최고최고최고  
20150622,10,처음으로 평점써봅니다 너무 슬펐고 보는내내 계속 울었네요..마지막에 여자가 공연에서 남자를 위한 노래를 부를때 눈물이 막 흘러내렸어요..평생 기억에 남을 영화입니다.  
20150615,9,오늘 헤어졌어요 물론 차였죠 제 잘못들로 인해하루만 더 빨리 이영화를 봤다면..좋았을텐데  
20150614,10,정말 펑펑 울게 만드는 영화...더불어 많은 깨달음을 주는 영화....정말 정말 강추!!!!  
20150612,8,아 눈물 ㅜㅜ 추천합니다  
20150611,10,감동적이다. 여자의 행복뒤엔 남자의 희생이 따른다는 것 그리고 그것마저도 남자는 행복하다는 것이 인상적이네요. 사랑의 힘이죠!  
20150610,8,단 한번의 사랑이라도  해본 사람이라면 감정이입 되는 영화  
20150609,10,내인생최고의영화..  
20150609,10,과거가 아무렴 어때중요한건 이순간인데  
20150608,10,마음이 가는대로 사랑했을뿐인데... 요즘 내 마음같아서 더욱 슬프고 눈물이 펑펑 나네요.  
20150608,10,계산없이   사랑하라   ...  
20150607,10,남친이 추천해줘서 봤는데 기대도 안하고본 영화가 새벽에 눈물을 펑펑흘리게해줫다여태까지본 멜로영화 중 가장 감동적이고 슬픈영화 연애에있어서도 가족 주변 사람에 있어서도익숙함에 속아 소중함을 잃지말자 .  
20150605,10,지금 본 나에게 정말 큰 감동을 사랑하고 싶다  
20150601,10,이거는 진짜 말이 필요없는 영화임에 틀림없음.  
20150601,10,명작.... 보고 또보고  
20150530,10,초반에 지루함을 한방에 날려줄 중반부절대 처음에 지루하다고 끄지말것  
20150529,10,진짜 평생 몇번이고 다시볼영화  
20150528,10,비 오는 날 생각나는 이 영화 이런 사랑을 하고싶네요  
20150526,10,남자인데 울었다...  
20150525,10,왠만해선 슬픈감정 잘안드는데 이영화는 보고울었다..인터넷평점 쓰는것도 처음이다평점쓰게만드는 영화 저또한 사랑이란걸 배웠네요  
20150525,10,진짜 개재밌다ㅠㅡㅜ 와씨 대박 씨...ㅜㅡㅜ  
20150524,10,시간이 아깝지 않았어요 ㅠㅠ  
20150522,10,눈물난다....ㅠㅠ  
20150520,10,계산하며 남자를 사귀는 김치녀는 절대 봐서는 안될 영화..  
20150518,3,"아오 유치해.,.,.,.,.,..,  "
20150518,10,너무 감동적인 영화입니다 ㅠㅠ ♡  
20150516,10,최고의 영화입니다~~~~!  
20150516,10,해피앤딩을 바랬지만... 그래도 너무 감동적이고 단 하루동안 정말로 운명을 바꿨네요 이런남자 또 있을까요..감동적인 영화입니다 나중에 또볼래요  
20150511,9,영화 다시 보는 건 좋아하지 않는데 계쏙 보게 딥니다  
20150508,10,익숙함에 속아 소중함을 잃지 말자.. 그녀와 함께 있을 시간이 점점 줄어듦에 얼마나 가슴이 아플까.. 그녀를 울리지 않았더라면..그녀를 혼자 보내지 않았더라면.. 그녀의 소중함을 알았더라면... 상황 달라졌겠죠? 몇 번 보아도 마음이 아프네요.  
20150506,9,빗속의 장면도 슬펐지만 개인적으론 오두막집에서 끝은 무조건 비극이라는 것을 안 남자의 심경을 보는 게 정말 슬프더라.. 그 장면부터 쭉 운듯하다..  
20150505,10,죽음도 사랑을 갈라놓을순없어 이런사랑하고싶다 OO 안본사람 꼭보세요  
20150503,9,일단 명작이라고 듣고 봤는데 거품기가 하나도 없는 영화였다 최고였지만 결말은 개인적으로 아쉬웠다 하지만 비극적인 결말도 나쁘지는 않았다 연애를 해보고 이별도 해봐야 더 재미있게 볼 수 있을것 같다 영화는 정말 명작이다  
20150503,10,감동적인영화 ㅜㅜ..  
20150501,10,정말로 좋았던영화네요  
20150501,10,또 하나의 어제는 한쪽만 기울어진 사랑이었지만 나중엔 균형 잘 잡힌 시소가 되었네요. 정말 아름다운 사랑에 눈물이 쏟아져 나왔습니다. 여자친구랑 봐야하는데 아파서 입원 중이네요.  
20150501,9,마지막에 택시만 안탔어도 10점인데...  
20150430,9,감동이야ㅠㅠㅠ울어서눈부음  
20150426,10,몇번을 다시봤는지 모를만큼 많이 봤지만 볼때마다 깊은여운이 남는게 역시 명작 이런건 평생 두고두고 봐야함  
20150426,10,행복하다라는 느낌...  
20150424,10,말이필요없네요 ㅠㅠ 슬럼프가 와서 기분전환하고파 선택한영화인데 정말 많은생각을 하게해주고 좋은영화네요 .ㅠㅠ 긴장으로 두근거리면서 두사람덕에 설레는 영화입니다 ㅜㅜ  
20150421,10,많은 외국로맨스영화를 봤지만 나에겐 이프온리영화 만큼 대단하고좋아하는 영화는 없을꺼같다 옆에있는 사람의 소중함.. 권태기나 이별을생각하는 커플들이본다면 다시한번 생각하게 되는 영화일꺼같다  
20150420,10,지금 가장 중요한게 뭔지 생각하게 해주는 영화.. 사랑한다면 사랑한다고 말해야지..  
20150418,9,극히 감동스러운 러브스토리  
20150417,10,사람은 언제 세상을 떠날지 모른다... 사랑하는 사람이 곁에 있다는 것에 감사하며 살자... 따뜻한 영화 바이블이라고 할수있지... 보고 또보고 몇번을 봤는지도 모를만큼 사랑하는 영화  
20150417,10,저 남자가 첨엔 호구로 보이다가 마지막엔 대사칠때 반해버렸다 ...  
20150416,1,감동도 없고 남자 주인공 바보같이 마지막에 자살함ㅋ  
20150416,10,먹먹하고아프고슬프다...이영화정말아름납네요~~  
20150415,9,현재 일상의 소중함을 깨우쳐 주는 영화라 볼 수 있어요... 있을 때 잘하자. 쉽지만 가장 어려운 것.  
20150413,10,제일 아끼고 제일 사랑하는 영화  
20150412,10,영화보고 울어본적이 단한번도없었는데 이영화보고 처음으로 펑펑울어봣네요 그닥 슬프지도 않았던장면 노래하는장면에서 가사보면서 얼마나 눈물이나던지 어쨋든최고  
20150410,10,영화속 제니퍼 러브 휴잇의 해맑고 아름다운 미소가 이 영화를 더욱 슬프게 만든다.  
20150329,10,끝나고도 멍하게있을수밖에없는영화최고의영화 . . . 그리고 인생을바꿔준영화  
20150328,10,정말 형용할 수 없을 만큼 아름다운 사랑을 느끼게 해 준 영화.  
20150327,10,나라면 대신 탈 수 있을까..? 사랑 참 어렵다..  
20150327,10,진정한 사랑을 느끼게 해주는 영화  
20150325,10,최고의 로맨스영화! 감동감동  
20150320,8,마치 파이날 데스티네이션의  멜로 버전을 본 듯한 느낌이다. 따듯하고 뭉클하다.  
20150319,10,남주 여주 너무 매력적이다.. 여주 미소만 보면 덩달아 나까지 미소가..  
20150318,10,이 정도로 울어본 영화는 인생처음 진짜 추천합니다  
20150317,10,요즘 이런 감수성터지는영화들을 찾아보게된다...아 눈물 난다. 해피엔딩영화도찾아봐야겠다ㅜㅜ  
20150313,10,왜 영화 장르가 코미디에 있음?  
20150312,10,이런영화를 이제야 보다니...  
20150312,10,지금까지 본 수많은 영화 중에서도 이 영화는 유독 다시 찾아보게 되네요..  
20150310,10,내 인생 최고의영화.. 나는 여자주인공 대신 남자가 죽은게 아니라 원래 남자주인공이 죽을 운명이었지만 사랑을 모르는 남자에게 신이 주신 하루의 선물이라고 생각이든다..  
20150309,10,"모든재료를 보여주고 어떻게 짜맞춰야되는지 보여주는영화. 이변이 없다는게 슬플뿐이고, 과정이 아름다웠으면서 자기보단 연인이 더 소중하다는 로맨틱한사랑을 그대로 보여준영화.  "
20150307,10,나의 인생영화.... 펑펑 울었어요...  
20150304,10,최고의영화!감동적이예요  
20150302,10,왜 보라고 했는지 알 것 같아. 이제봐서 미안해. 기다리고 있을게...  
20150302,10,"기적같은 하루, 슬프지만 두사람에있어서 가장 소중한 하루...  "
20150301,10,"이건진짜 최고의 영화이다 여러번을봐도 여자의 서운한 마음이해 할수있고, 계속 노력하는 남자역시 볼때마다 눈물이 났다..  "
20150226,10,사랑을 모를때 봤을때는 이 정도의 울림은 아니였어요 근데 사랑을 알고나서 다시 이 영화를 보니 너무 슬프네요 이 영화가 왜 이리도 명작인지 알게됐습니다.  
20150226,10,러브휴잇 너무 사랑스럽게 나옴  
20150223,10,펑펑 울었던... 다시봐도 펑펑... 저런 남자가 세상에 몇이나 될까...  OST도 진짜 완.전. 좋음 여주가 부른 노래!! 좋아좋아  
20150223,10,그녀가 옆에 있는것에 감사하라. 그리고 계산없이 사랑하라  
20150222,10,대사하나하나 주옥같다  
20150220,10,역시나 명작..남자 너무 멋지다. 익숙한 소중함을 깨닫게 해주는 영화  
20150219,6,어설픈 플롯때문에 몰입이 안되긴 했지만 여자들이 사족을 못쓸 내용이긴 하다.  
20150216,1,이건 1점이 아닙니다 11점을 주고싶은 제 마음입니다  
20150215,10,10대라서 사랑을 잘 모르지만 이 영화가 인생작이 됐다..나중에 커서 한 번 더보면 더 진한 감동을 받을 수 있을 것 같다  
20150215,10,계산없이 사랑하세요.  
20150215,10,남자친구랑 같이 어제 보았는데...영화의 여운이 가시질 않네요 사랑하는 사람과 꼭 보시길  
20150210,10,사랑을해본적도없는모태솔로이지만 내인생최고의영화  
20150210,10, 나도모르게 계속계속 눈물이 흐릅니다멍하니보고있으면 정신차려보니 눈물이떨어짐..  이걸보고있자니..  내가못해줘서 헤어지게된 여자친구와의 시간을 딱한번 더 돌리고싶네요.. 그때 잘할껄 후회됩니다 택시기사가 이안에게 했던말이 자꾸 생각나네요..  
20150208,8,볼만한 영화123456  
20150208,10,보면서 엉엉 울었던 영화..  
20150206,6,"글쎄 잘 모르겠다. 약간은 어색해보이는 남자의 연기, 그리고 조금은 어설퍼 보이는 영상들에 좀 오래된 영화인가 싶었는데 그렇지도 않고, 마지막에 눈물겨운 연기는 괜찮았지만 글쎄 나에겐 큰 공감이 가지 않던 영화.  "
20150206,10,제가 본 멜로중에 가장 의미있는 영화같네요. 결말이 슬프지만 그 결말이 가장 감동을 줄 수 있었던 결말 같습니다.  
20150205,7,너무 여자 위주이지만 나름 괜찮음  
20150205,10,저는 3년동안 사귄 여자친구를 작년 8월달에 떠나보냈습니다.... 지방으로 이사를.가버려서 더 이상 만나지도 못하게 됬죠.... 이 영화를.보며 정말 펑펑.울었습니다. 제가 사귀는 동안에 잘해준게 없는거 같아서 말이죠... 정말 교훈을 많이준영화에요.  
20150205,8,너무 안타깝고 슬퍼서 눈물만 쏟아졌음..  
20150204,10,보고 울뻔함..ㅠㅠㅜ진짜 강추!!!  
20150204,10,나도 모르게 울어버렸고 남자이면서도 남주가 멋있어보였다. 죽음조차 막을수없던 사랑을 하고있는 모습이 너무나도  
20150202,10,처음에 채널돌리다가 볼께 없어서 아무 기대 없이 봤는데 정말 너무 재밌었던 영화네요.  
20150128,4,과대평가받는 영화 4점이 적당 극의 흐름이 너무 끊긴다  
20150128,10,모든걸 다 줄수 있으면 그게 바로 사랑인가보다....  
20150127,10,이 영화가 있다는 건 오래 전 부터 알고 있었는데 이제서야 보게됐다. 그런데 이 영화 진짜 대박이다...하...오랜만에 눈물 흘렸네나도 저 정도로 사랑해 봤으면 좋겠다.  
20150124,10,사랑은 위대하다...  
20150122,3,이런 영화는 너무 싫다. 유치 뽕에 어거지 감정으로 몰아가는 흐름.  
20150121,10,오늘 코끗이 찡하지않고 울어봤다  
20150119,10,정말슬픈영화라기에봤었는데왠지그냥딱슬픈장면빼고는슬프지않았는데그다음날부터내용이이해되면서여운이너무남아슬퍼죽는줄알았네요  
20150115,10,내 인생 최고의 영화 중 한 편  
20150115,10,두말 필요 없는 최고의 영화.  
20150114,10,계산없이 있는 그대로 사랑하자  
20150114,10,최고...입니다 ㅠㅜ  
20150112,10,최고의 영화 .. 열번봐도 볼때마다 슬프다  
20150111,10,진짜 그냥 인생영화..♥  
20150109,10,정말 상상도 할 수 없는 슬픔이다... 가장 기본적으로 저렇게 예상할 수 없게 내가 가장 사랑하는 사람이 그냥 갑자기 내 곁을 떠난다면... 난 과연 맨정신으로 살 수 있을까.... 같은 하늘 아래 숨을 쉬는 것도 아니고....  
20150108,10,"여자친구가 제일 좋아하는 영화. 그리고 나는 별로 좋아하지 않는 영화. 언제부턴가 여친과 다투면 혼자 보게 되는 영화. 7년 사귀며 별로 본적 없고 무덤덤햇지만 이번엔 좀 크게 싸워서인가 아님 그녀의 마음을 좀 더 이해해서인가, 날 많이 울게한 영화.  "
20150107,10,무조건 보세요 무조건 내용 뻔하다는 저 댓글 정말 지워버리고 싶어요  
20150105,10,마지막에 둘다죽지않길바랬는데..ㅠ 킬링타임 추천합니다  
20150105,10,머리가 아프독록 눈물이 났어요 아직 사랑 경험은 못해봤지만 좋은 발판이 될거같습니다 정말 감동적이였어요!  
20150104,10,저는 로맨스 영화를 왜보는지 이해안가는 10대 남자입니다 여자친구랑 많이싸워서 여자친구가 이영화 꼭보라고해서 본영화...처음엔 보기도싫고 딴거 끄적거리다가본 영화 마지막엔 눈물콧물 다 빼면서 여자친구에게 사랑한다고 바로 한영화입니다 진짜추천합니다♥  
20150103,10,무조건 봐야할 영화 0순위  
20141224,10,로맨스물 중 단연 최고여운이남는 ...  
20141221,10,이런 사랑해봤음좋겠다  
20141219,10,감성이 메마른 줄 알았는데 어느새 또르르  
20141218,10,이 영화는 볼 때마다 눈물이 흐릅니다. 단언컨데 타임슬립 영화 중 최고의 영화라고 자부할 수 있습니다.  
20141215,9,크리스마스에 보면 좋을 영화 연인들과 함께.난 혼자봤지만..  
20141215,10,"Taxi driver : Just one thing, appreciate her and what you have. Just love her  "
20141212,1,너무나 유치하고 어설픈 연출..여주도 별로 맘에 안들고.  
20141211,10,그냥 짧게애기한다 봐라  
20141210,1,전형적인 잘나가는 사업가와 미인의 러브스토리. 서민이라그런지 딱히 공감이 안감 ㅋㅋ 여자들은 딱 좋아할 백마탄왕자님식 영화  
20141209,10,이게 사랑이야...진짜 사랑...  
20141207,10,아지금 펑펑움 보고오자마자 평점쓰는데 펑펑울면서쓴닼ㅋㅋㅋㅋ  
20141206,9,좋네요 재밌게봤습니다  
20141206,10,보고 또봐도 감동인 영화  
20141128,10,처음볼때는 내용을 모르니까 가슴 먹먹하게 슬프고두번째 볼때는 결말을 아니까 남주의 표정 행동 들이 다슬프고세번째는 이별 한후에 볼꺼다 어떤느낌일지..이 영화 안봤으면 꼭보세요!!몇번 봐도 돈 안아깝고 또보고싶어요!!  
20141126,8,사랑이 매마른걸까.. 슬프지는.않았지만 감명깊게본 영화^_^  
20141124,10,괜찮은 영화로 기억함.  
20141123,7,사랑을 알게해준 영화 랄까 엄청 좋았다  
20141122,10,다시 개봉해줬으면 좋겠어요.멜로 장르중 손꼽히는 감동적인영화죠  
20141122,10,부럽다 정말 부럽다...  
20141119,10,엊그제 남자친구와 헤어졌는데 진짜.. 너무나 공감되네요. 익숙해지면 소홀해진다는 말.. 아 너무 공감되는 영화였습니다!! 눈물 펑펑 쏟았네요  
20141119,1,영화초반 여주인공 개 비호감 생긴거부터 하는 꼬라지 전부 맘에안듬 진정한 보빨영화  
20141117,10,너와같이보기로한영화인데 네가없어서 혼자봤다 맘이쓰라린다  
20141117,10,손꼽는 영화중 하나10년전쯤 극장에서 보고 또 여러번 본 영화음악도 영상도 스토리도 너무 감명깊었습니다.  
20141116,10,명작중에 명작이죠ㅠㅠ  
20141115,10,마지막 빗속 남주의 명대사는 정말 이어지는 여주의 대사처럼 할말을 잊게 만들어 버림... 돌이킬 수 없는 운명을 받아들인 후 내뱉는 너무 눈물나는 명대사 ㅠㅠ  
20141115,1,"나와는 안 맞는 장르의 영화. OST도 유명하고 해서 봤지만 별 감흥 없었음. 개인적으로는 사랑의 블랙홀이나 말할 수 없는 비밀, 시간을 달리는 소녀가 비슷한 느낌의 영화들로 이 영화보다는 훨씬 더 와 닿았음  "
20141110,10,사랑한다 사랑한다.. 사랑한다  
20141110,9,"이 영화가 우리게에 알려주는 건 사랑은 지금이라고, 아낌없이 표현하는 것이라 말한다. 애초에 결말은 중요하지 않다 계산없이 마음가는대로...  "
20141107,10,"평점 처음 남겨봐요... 원래 로맨스 영화를  좋아하지 않았는데, 이 영화를 보고, 로맨스 영화를 좋아하게 되었다. 몇년전에 본영화이지만, 아직 지금까지도,  본 영화중에 최고로 생각하고 있고, 보고 또 봐도..감동적이고  가슴찡해지는 최고영화!!!  "
20141104,10,진짜 사랑이 뭔지 알게 해준 영화소중한 사람이 있다면 다시금 소중함을 알게해주는...  
20141102,9,그냥 한번 보시는 게..  
20141102,7,"난 남자치고 눈물에 인색하지 않은 편인데, 별로 감흥에 와 닿지 않았다. 연령별 평점에서처럼, 이 영화를 보며 펑펑 우는 관객은 둘 중의 하나일 확율이 높다. 여성 혹은 이성교제에 관심많은 청춘남녀. 사랑, 이별 경험 유무와는 상관없음. 과도한 평점  "
20141031,10,로맨스 영화중 단연최고!!  
20141027,10,이거 죽이네 아.. 음.ㅠ  
