0,1,2
20170324,8,홀트 심쿵심쿵ㅠㅠ 너무멋있어여!!무조건봐야하는영화!!  
20170324,8,역시 너무너무잘생겼네요*^^*샤방샤방  
20170324,10,니콜라스 홀트 눈동자가 너무 빛났어요 한국분들도 많이 좋아하고 즐겨 보실 영화인거 같아효  
20170324,10,"솔직히 액션 그렇게 안좋아하는데 니콜라스보고 믿고 보게되었는데,역시.. 믿고 볼수있어서 감동이였습니다 재밌엇어요!!  "
20170324,9,헉 영화 다보고나서 인터넷에 쳐보니 CG없이 소화했다는.. 이영화 대박이네여  
20170324,10,차의 빠른 스피드와 충돌과 총격등 볼거리도 엄청많았고 액션신이 눈에서 잊혀지지가 않음  
20170324,10,완전 좋아하는 장르입니다!! 강추!!꼭 보세요!  
20170324,3,보지마세요 재미없어요  
20170324,10,여자들끼가서 봐야함ㅋ.ㅋ홀트 너무 잘생겨서ㅋㅋ  
20170324,9,내가 줄리엣이고 싶당ㅠㅠ 남주 장난아니야~  너어~~~~!!  
20170324,10,"저녁에 봤는데, 엄청 만족합니다^^  "
20170324,8,그냥 아무생각 없이 스트레스 풀기 좋다.연인과 보기에도 좋음  
20170324,10,여자들은그냥 어머어머하고 봤을 영화다ㅋ  
20170324,10,킬링타임 짜앙짜앙 짱이다요!!남친이랑같이봤는데 질투엄청하데요ㅋㅋㅋ  
20170324,8,솔직히 기대안하고 남주얼굴땜시 봤는디 의외의 재미ㅋㅋ  
20170324,8,헐..시간가는지 모르고봤네요 재밌어요 일단 남주 잘생겼어요ㅎ0ㅎ  
20170324,8,관람객화끈하고 잼있네요~특히 안소니 홉킨스 매력쩜  
20170324,10,왜 이제야 나온것이야!!얼마나 기다렷다구ㅡㅡ  
20170324,10,남주 너무 섹시해… 완전 팬될거 같음!!  
20170324,9,"아놔,ㅠㅠ 남여 주인공은 완전 로미오와 줄리엣인데ㅠ흑흑그래도 행복한 결말이나와서 다행..  "
20170324,10,홀트홀릭 열풍 올거같아요! 엄청 기대되는 배우 입니다!  
20170324,10,벤 킹슬리 연기 너무 재밌게 잘봤어요ㅋㅋㅋ 중간에 피식 웃기도햇네요!!  
20170324,10,스릴있어요!!! 니콜라스 보면서 눈호강 제대로 했어요 굿굿  
20170324,7,"관람객기대 별로 안 하고 봤는데 재밌었어요!-!우선, 자동차액션이 좋았구요. 사랑과 마약에 대한 내용이다 보니 스토리는 평범한 것 같아요.보면서 주인공이 참 끈질기다는 생각이 들었어요(대단한 놈이에요)ㅋㅋㅋ  "
20170324,1,솔직히 별하나도 아까움..공짜표 생겨서 보러 갔다 온건데 공짜로 봐도 아까운 영화 시간이 아까움.. 진짜 최근에 본영화 중 최악임..  
20170324,7,관람객내용이 넘 평범하고 촬영이 미지근해요  
20170324,10,액션 좋아하시는 분들에게 추천. 차가 많이 나오고 속도감이 많아서 역시나 이런거 좋아하시는 분들에게 추천.  
20170324,10,영화라고 쳐도 어떻게 총알한발 안맞냐  
20170324,2,부제: 돈가방을 갖고 튀어라  
20170324,8,"관람객뻔하지만 그만큼 뚜렷한 스토리, 우직하게 밀고 나가는 힘있는 전개가 좋았다.  "
20170323,8,질주본능을 불러 일으키는 시원한 드라이빙은 정말 멋졌습니다.  
20170323,10,시원시원한 액션 좋아하는분들운 꼭보세요 ㅎ 생각보다 훨꿀잼 진행도 빨라서 좋음 강추 ㅎ  
20170323,10,관람객처음부터 끝까지 박진감 넘치는 카체이싱 씬♡ 입 벌리고 푹 빠져서 봤네요! 음향효과도 넘 좋아서 긴장감을 늦추지 못했어요. 심장 쫄깃쫄깃 짜릿짜릿! 넘 재밌게 봤습니다. 강추!  
20170323,9,관람객홀트 얼굴만 생각남~킬링타임용으로 좋았음  
20170323,10,관람객카 액션 재밌었어요! 니콜라스 홀트도 짱짱!  
20170323,10,영국가면 홀트오빠 볼수있는건가효?  
20170323,10,영화 스케일이 정말 대단한거같아요. 실제로 엄청 많이 다쳤을듯  
20170323,8,너무 집중했나 시간이 너무 빨리 지나갔음…ㅠㅠ  
20170323,10,한국에서도 엄청 흥할거 같아요~  
20170323,9,해피엔딩이여서 모든걸 용서했음 !!!  
20170323,9,남자 여자 모두 재밌게 볼 수 있는 액션 스리러  
20170323,10,눈이 너무 예뻐요. 영화도 재밌고 남주는 멋지고  
20170323,10,봐도봐도 또 보고파요ㅠㅠ  
20170323,10,어바웃어보이에 나왔던… 꼬마가 …. 맙소사..ㅠ 0ㅠ  
20170323,8,나콜라스 한국 여성팬들 엄청 생겨날거 같네ㅋㅋ  
20170323,5,관람객니콜라스 홀트가 살린영화...  
20170323,10,자동차 액션 즐기다 갑니다!!! 다음편 기대해봅니다!  
20170323,10,명배우들 많이 등장해서 좋았음~~ 보는 재미도 쏠쏠하궁  
20170323,10,벤 킹슬리 도 너무너무 오랜만에 나왔네요~  
20170323,9,의자의 움직임이 끝도 없엇다 ㅋ 놀이기구타는줄ㅋㅋㅋ 아잉잼떠  
20170323,10,사랑타령각본 저는 너무너무 좋았어요*^-^*  
20170323,1,아.. 진짜 이렇게까지.. 리뷰 안 쓰는 사람인데.. 개망 폭망!!  네티즌 평점에 낚임;;  
20170323,10,가볍게 카체이싱 액션 즐기실분은 즐감하셔요^^  
20170323,9,홉킨스랑 니콜라스조합이 너무 긴장감있게 시작해서 오랜만에 재밌었어요!  
20170323,10,"로맨스는 조금 아쉬웠으나, 전체적으로 너무 만족하고 봤습니다  "
20170323,10,영화 너무 매력있어요. 끝날거같으면 반전있네요  
20170323,10,홉킨스형 올만에 나와서 잘 보고 갑니다!!  
20170323,8,이 영화 2탄도 기대해도 될런지요??  
20170323,3,니콜라스 홀트 때문에 봤는데 개연성 정말 없네.  
20170323,10,"훈훈한 외모로, 섹시한 몸매 까지 다음 영화도 기대돼네요.  "
20170323,10,4DX로도 한번 보고싶음 ㅠ_ㅠ  
20170323,9,킬링타임 오락영화로 즐기기엔 정말 좋아요~  
20170323,10,"요즘 볼만한 영화 없었는데 , 너무 만족합니다  "
20170323,10,카 체이싱 액션 너무 색다롭고 좋았습니다~~  
20170323,10,"남자 졸 섹쉬해여ㅡ,.ㅡ코퓌 팡팡  "
20170323,9,솔직히 이 영화 여자들을 위한 영화 아니냐.. 홀트 진짜 존멋이더라  
20170323,10,영화 끝나고 나오는데 전부 남주얘기뿐ㅋㅋ  
20170323,10,아무래도 남주때문에 이 영화 대박날거같음  
20170323,10,관람객전체적으로 볼 만해요!  
20170323,9,아우토반 다 보고 나와서 밥먹으면서 아직도 남주 얘기중ㅋㅋㅋ ㅋ  
20170323,10,반전의 반전!! 안다치길 기도햇다는…  
20170323,10,기회는 단 한번이라니까 몰입 더 잘됨ㅋ  
20170323,9,나는 개인적으로 남주보다 여주인공 캐릭터에게 시선을 뺏겼음  
20170323,10,"화려한 카체이싱 액션 이네요, 질주 좋아하시는분들 추천합니다~  "
20170323,8,남자들 이거보고 엄청 달리고 싶었을거다 ㅋㅋ  
20170323,9,뻔한스토리일수는 있으나 볼만합니다! 몰입도 은근 잘돼요!  
20170323,10,홉킨스 역할은 큰역활은 아니였지만 여전히 그의 연기는 최고였음ㅋ  
20170323,9,킬링타임 용으로 안성맞춤!  
20170323,10,안소니 홉킨스의 명연기 너무나 좋았습니다^^  
20170323,10,졸라잼있다 시간가는줄 모르고봤네  
20170323,6,그냥 볼만함 어설픈면 있음 .. 화려한거 같으면서도 뭔가 부족함 느낌  99분 영화라 길지않음 그냥 시간때우기 좋음 영화 남들에게 추천은 못하겠음  
20170323,10,"관람객니콜라스 평소에 넘 좋아해서 개봉하자마자 기다렸다가 봤는데, 기대했던대로 재밌었어요. 스릴도 넘치고 여주도 이뻐요  "
20170323,8,"관람객크게 기대했는데, 기대에는 못 미친듯...스릴은 있었고...보다가  깜짝깜짝 놀라는 장면도 있었고..보면서..역쉬. 주인공은 어떤 상황에서도 살아남는구나...라고 느꼈음.  "
20170323,10,관람객1분 1초 놓칠수가 없네요 굿~♡♡  
20170323,2,기대하면 더 열받아요 예고편이 더 재밌어요 마케팅 잘하네요 관객속이기 왜 아우토반? 자동차 광고영화? 시사회 줄이고 예매권 뿌렸으나 뭐가 다른지... 비추 비추...  
20170323,5,관람객화끈한 액션과 카체이싱을 기대했는데 정작 액션은 별로 없고 사랑싸움에 말싸움만 길게 이어지네!그러는거 아니다!!!  
20170323,8,관람객재밌습니다재밌습니다  
20170323,6,여자들은 그나마 남주 보는맛에 남자들은 그나마 차 보는 맛에 보는데 차에 관심없는 남자들은 진짜 여주얼굴빼고 볼거없음..롯데시네마 교환권있어서 봤는데 돈주고 볼건못됨  
20170323,7,볼만한 영화이긴 한데 광고가 너무 사기라서 큰 기대를 하면 실망을 할 것이다. 아우토반이라는 가제를 짓고 무한질주라고 해서 분노의 질주 같은 레이싱을 기대하게 만들었지만 솔직히 그정도 절대 아니다.그냥 킬링타임정도지 와! 소리나올 정도 단언컨데 없다.  
20170323,7,관람객스릴넘치지만 스토리전개는 미흡  
20170323,2,관람객식상한스토리. 부실한내용. 가짜같은 화면. 덜 매력적인 배우.  왜 만든 걸까요?  불면증 가지신 분들  보시면  단박에  효과 있을 듯.   스피드도...ㅡㅡ;;;;  
20170323,1,무슨 내용이 점점 산으로 가냐...목숨이 왔다갔다 하는 상황이 차에서 잠을 처자지않나...뭔 이런ㅅㅂ  
20170323,10,니콜라스 홀트 존잘...  
20170322,1,평점조절 평점조절 평점조절  
20170322,10,개봉 하자마자 본 보람이 있네요 스토리도 액션도 좋았습니다  
20170322,10,니콜라스 홀트 엄청 잘생김 영화는 그냥저냥 스트레스풀고싶을때 액션보고싶을때 정도에 가볍게 보기 좋은듯  
20170322,9,관람객신나는 클래식 액션..  
20170322,3,홀트혼자 열일하고 예상가능한 반전 알바들 많네요  
20170322,10,평론가들에 대해서 반박을 하기 위해서 나왔습니다!  
20170322,8,여자가 이정도 아름답다면 미친짓 할만하지.  
20170322,7,"관람객초반에 지루했는데, 중간 지나서 부턴 액션 장면이 많아서 잼있게 잘 봤어요.  "
20170322,1,진짜 이걸 보라고 만든건가 싶다..  
20170322,7,관람객킬링 타임용으로 적절한 러닝 타임과 영상을 주는 그런 영화  
20170322,9,로맨틱 스릴러 액션 질주 아드레날린 짱이네요  
20170322,1,다좋은데 여주를 왜 저런애로 했을까..  더 섹시하고 이쁜애들 널렸는덕...  
20170322,8,"초반부가 좀 지루 했지만, 중반을 넘어선 액션과 해피엔딩이  딱~~내 스타일이어서 좋았어요~  "
20170322,8,관람객피고인을 보는거 같았음....  
20170322,1,정신없는 쓰레기 스토리를 볶아놓은 영화.  
20170322,10,4D로 보면 장난 아니라던데 주말에 홀트 보러 가야지ㅋㅋㅋ  
20170322,10,이렇게 달달한 액션영화는 정말 처음이다.. 설레고 쫄깃하고  
20170322,10,시원한 액션들 너무 볼만하더라구요~  
20170322,4,관람객아우토반 질주 외에는 딱히... 그나마 기대했던 수퍼카도 그닥 안 나오네요ㅋ  
20170322,10,친구랑 같이 봤는데 둘다 재밌다구 난리ㅋㅋ 홀트 때문에 더 난리ㅋㅋ  
20170322,10,기대 안하고 봤는데 너무 재밌게 잘 보고 왔습니다  
20170322,3,"본격 개도망 무비 ""니콜라스 홀트의 돈보따리를 들고 튀어라""  "
20170322,10,"지고지순한 사랑, 액티브했던 드라이빙. 즐기기엔 좋아요  "
20170322,10,시원시원하고 화끈하구 보는내내 홀트 때문에 행복했다  
20170322,1,개연성없고 비현실적인 삼류  
20170322,10,올 상반기 최고의 오락영화가 아닐까 싶습니다ㅎㅎ  
20170322,10,화려했던 카체이싱! 볼거리도 배우들의 비쥬얼도 덕분에 눈호강 제대루!  
20170322,10,가볍게 즐기기엔 딱 좋은 액션무비  
20170322,10,긴장감도 있고 달달한 로맨스까지 있으니~ 내가 보기엔 너무 좋았고 재밌었다ㅎㅎ  
20170322,10,카액션은 물론 맨몸 액션까지 소화하는 홀트>.<ㅎ  
20170322,10,남자들이 좋아할 듯 싶네여 ㅋ 슈퍼카들 엄청 나와요 ㅋ  
20170322,10,사랑하는 여자를 위한 한 남자의 미친 사랑  
20170322,1,"매드맥스, 분노의질주는 얼마나 수작인가 깨닫게 해줌  "
20170322,10,니콜라스홀트 미모에 또 한번 빠져버림ㅠㅠㅠ  
20170322,8,관람객무난무난햇던영화였어요  
20170322,10,니콜라스 홀트의 거침없는 질주! 멋졌습니다!  
20170322,10,남자들은 액션과 차에 반하고 여자들은 홀트에 반하는 영화  
20170322,10,홀트팬인데 이번 영화 정말 사랑합니다 bb  
20170322,10,미친듯한 자동차 액션!! 눈이즐겁다  
20170322,10,4D로 보면 진짜 대박일거같아요 자동차 액션 장난 아님  
20170322,10,스토리도 액션신들도 굿굿 오랜만에 마음에 드는 영화 한편!  
20170322,10,진짜 쉴 틈 없이 빠져듬ㅋㅋㅋ 스토리에 홀트에~  
20170322,10,개봉일만 기다렸는데 역시 니콜라스 홀트><  
20170322,7,관람객화려한 카체이싱이 볼 만 하네요  
20170322,10,진짜 무한질주!!! 시간 가는줄 모르고 봄!!  
20170322,10,난 기대하고 봐도 잼나던뎅ㅎㅎ  
20170322,10,개꿀잼ㅜㅜㅜㅜ 홀트야아아 ♥  
20170322,2,기대를 해서 그런지 좀 그랬어용...  
20170322,10,액션영화 안좋아하는데 홀트 때문에 관람ㅋㅋㅋ 근데 로맨스도 첨가되고 잔인한 액션이 아니라서 좋았음  
20170322,1,우리도 하나 만들자. 경부고속도로.  
20170322,10,볼만한 가치가 있음ㅋㅋ 시간 훌쩍 가더라  
20170322,2,해외에서평점1이다ㅋㅋㅋ이게재밌냐?ㅋ와알바들의발악ㅋㅋ 진심대단ㅋㅋㅋ  
20170322,9,홀트.. 후즐근한 옷입고 있는데도 존멋  
20170322,5,"말도 안되는 부분들이 있어서 아쉬웠고, 다른사람들처럼 홀트가 멋있게 나오는건 사실이다. 하지만 스토리가 너무~너~~무 아쉽다.  "
20170322,1,알바들 패버린다 진짜....  
20170322,10,니콜라스 홀트 최고시다  
20170322,10,관람객재미있게 잘 보았습니다  
20170322,10,나도 저런 남자친구 만나고 싶다 ㅋ  
20170322,10,카액션 대박이다 진심 졸잼임;  
20170322,10,생각보다 너무 재밌게 봐서 만족스러워요~ 재밌게 잘보고왔습니다~!  
20170322,10,스릴감 쩔고 달달함 쩔고...ㅜㅜ  
20170322,10,저 파란가방 오지게 잘챙겨댕기네ㅋㅋ  
20170322,9,보는 재미가 쏠쏠ㅋㅋ 시간내내 지루할 틈은 없었음  
20170322,9,간만에 영화보고 눈호강ㅋㅋㅋ  
20170322,10,관람객지고지순한 사랑과 액티브한 드라이빙!!재밌어요~~~  
20170322,10,뭐 나처럼 아무생각없이 보면 잼나다  
20170322,10,안그래도 멋진데 그녀를 위한 무한질주는... 죽여준다ㅠㅠ  
20170322,10,로맨스와 액션의 조합이 이렇게나 좋다니  
20170322,10,오랜만에 보는 액션 스릴러 장르라 그런지 어찌나 재밌던지ㅋㅋ 4D가 장난 아니더라면 주말에 한번 더 볼까 생각중입니다  
20170322,9,관람객오늘 보고 왔는데 즐거웠어요. 달리면서 벌어지는 액션과 훈남 사랑꾼 남자주인공!!! 터질때마다 쾌감도 있고 자칫 다른 액션 사랑 영화와 비교할 수 있는데 나름 오! 오!!! 대단해 라는 소리가 나올정도로 괜찮았어요. ㅎㅎ  
20170322,1,핵...노잼 으아아아  
20170322,10,오 별 기대 안했는데 비쥬얼도 그렇고 볼거리도 많은 영화였음!! 니콜라스홀트? 완전 멋있더라+_+  
20170322,10,이런 액션 스릴러물 너무 좋아요ㅋㅋㅋ 재밌게 잘보고왔습니다  
20170322,1,"너무 속상한 영화네요. 개연성, 스킬, 연출 모든게 다 부족한.... 최고의 재료들로 비빔밥 혹은 섞어찌개 끓인 느낌... 분노의질주의 느낌을 재연하려고 노력했으나 나는 다르다라는걸 억지로 외치는 영화  "
20170322,8,시시한 한국영화보다  재미있어요. 2시간 후딱감...  
20170322,10,관람객홀트 꿀떨어지는 눈빛에 내가 다 설렘...안소니 홉킨스랑 벤킹슬리 조연진도 짱짱하고 연기력은 말할것도 없죠~  
20170322,10,관람객너무너무 재미있게 봤어요 ~^^good  
20170322,10,관람객독일의 쭉 뻗은 아우토반에서 펼쳐지는 화려한 자동차 액션씬은 기대를 저버리지 않았습니다. 덤으로 니콜라스 홀트의 잘생김은 영화를 보는 내내 눈을 즐겁게 하였습니다. 액션 영화라고 말하지만 사실은 로맨틱 영화임은 비밀입니다.  
20170322,8,니톨라스 홀트는 사랑입니다..♥  
20170322,10,기대안했는데 잼나요ㅎㅎ 남자친구도 재밌다구 그러네용ㅎㅎ  
20170322,10,관람객별로 기대안했는데!!!!이 영화 꿀잼이구만!!!  
20170322,10,관람객니콜라스홀트는사랑입니다  
20170322,10,관람객차 보는거 만으로도 좋네여 크  
20170322,9,와 남자 주인공도 액션들도 너무 멋있다....  
20170322,10,관람객#조조 #혼영 #꿀잼 #니콜라스 홀트 #카액션  
20170322,10,관람객니콜라스 홀트 눈빛 진짜 꿀떨어짐. 봄에 걸맞는 로맨스에 시원시원한 액션까지 일석이조 꿀잼! 요새 보기 딱 좋음 ㅋㅋ  
20170322,10,관람객시원한 액션을 보고 그간 스트레스가 다 풀리네욬ㅋㅋ홀트 잘생긴 외모도 한몫합니당  
20170322,10,잼씀 킬링타임지림요ㅋㅋ  
20170322,10,관람객화려한 슈퍼카들의 향연~액션도 멋지고 니콜라스 홀트는 더 멋짐!!  
20170322,10,관람객달달한 액션영화는 처음! 액션이 시원시원하고 니콜라스 홀트 너무 멋짐ㅜㅜ  
20170322,10,관람객전래 화끈하고 홀트 얼굴이 꿀잼 훈훈 *^^* 시간가는줄 모르고 봤네 ㅎㅎ  
20170322,10,와 진짜 액셜쩔 ㅋㅋ 생각없이 즐기기엔 딱인 영화  
20170322,10,액션 영화 좋아하면 무조건 강추!!!  
20170322,10,현실적인 액션신들 덕분에 더 빠져들게 된다는ㅎㅎㅎ  
20170322,9,이렇게 또 홀트에게 빠지게 됩니다  
20170322,10,사랑하는 여자를 위해서 위험한 거래… 니홀라스 홀트 넘 멋있잖아ㅜㅜ  
20170322,10,손에 땀을 쥐게하는 추격전이네요!! 니콜라스 홀트는 더 멋있어진듯ㅋㅋ  
20170322,10,좀비랑 야수여도 멋있었는데 그냥은 더 멋있잖아 진짜 최고다  
20170322,10,남자 주인공 비쥬얼의 끝판왕ㄷㄷ  
20170322,10,아우토반 제목부터 예사롭지 않더니 영화는 더 예사롭지 않네  
20170322,10,액션물 엄청 좋아하는데 멜로까지 첨가 된ㅋㅋㅋ재밌네  
20170322,10,액션과 로맨스~~ 여자들이 봐도 좋을 액션스릴러!  
20170322,5,돈주고 볼만한 영화는 아니다 아우토반이라는 제목에 낚였다  
20170322,8,관람객시원한 카액션 보고 스트레스 풀고왔네요~ㅋ 홀트  나오는 영화 처음 보는데 멋있네요~ 첫눈에 내가 반함-ㅋ 스토리가 조금 아쉽지만 볼만합니다!!  
20170322,10,개봉일만 기다렸다가 봤는데 기다린 보람이 있군  
20170322,9,예고편만 보고 기대했던 영환데 예고편은 아무것도 아니였네요 잘보고왔습니다  
20170322,10,사랑에 목숨 건 남자… 나도 저런 남자 만나고 싶다 정말..  
20170322,10,카액션 정말 죽여주네요 끝까지 푹 빠져서 봤습니다  
20170322,10,걍 딱 내스타일! 비쥬얼도 좋았구 액션신들 보는 재미도 쏠쏠함!  
20170322,9,"남주 존멋 존섹,, 영화도 존잼임  "
20170322,10,기대 안했는데 너무 재밌게 봤어요~ 니콜라스 홀트 오랜만에 보니까 더 멋지네요ㅎㅎ  
20170322,10,액션 스릴러라는 장르답게 시원시원한 액션과 심장 쫄깃한긴장감까지!  
20170322,10,출연진들만 봐도 별 다섯개 10점ㅋㅋㅋ  
20170322,10,킬링타임용 영화로 즐기면서 보기엔 딱이다  
20170322,10,관람객평들이 너무 안좋아서~ 스토리가 약하긴 하지만 가볍게 보기 괜찮은 영화!! 홀트가 너무 멋있음~~ㅠㅠ 너무 안좋은 평 때문에 십점!!! 그렇게 욕할 영화는 아닌거 같은데....  
20170322,10,중반부터 숨 쉴 틈 없이 진행되는 전개.. 멋졌던 영화  
20170322,6,잘나가다가 씬을 뛰어넘네 갑자기 중간이 뻥 뚫린느낌  
20170322,9,배우들과 연출은 진짜 너무 좋았어요  
20170322,10,레이싱 액션 최강이다ㄷㄷ 4D 대박이라던데 한번 더 고고?  
20170322,10,카액션은 최근 본 영화들 중 최고  
20170322,10,로맨스가 들어가서 약간의 유치함도 있지만 추격신이 더해져서 완전 꿀잼이였다  
20170322,10,제목부터 내 스탈이더니 영화 자체는 더 내 스탈ㅋ  
20170322,10,관람객조조로봤는데 아침잠이 확 달아난다  
20170322,10,관람객훠후! 스릴ㅋㅋㅋ 역시 니콜라스홀트 존멋 ㅠㅠ  
20170322,10,간만에 시원시원한 카액션! 좋다!  
20170322,10,오랜만에 홀트 영화봐서 너무 좋았어요 더 멋있어졌네요  
20170322,10,배우들도 그렇고 줄거리도 흥미진진ㅋㅋ 기대한 보람이 있네  
20170322,10,킬링 타임으로 굿 ~~! 니콜라스 홀트 오랜만이네요!  
20170322,1,노오오오오잼  으으..  
20170322,1,시사회에서 봤는데 진짜 같이가자고 한 사람한테 미안해질만큼의 영화 네이버 평점 처음 남겨보는데 이거는 진짜 억지짜임새에 급하게 마무리하는결말 모든 총알은 콩알탄에 진짜 처음에 들뜬 마음으로 보다가 끝까지 만족감이 채워지지않음 왜제목 아우토반임?차몰고끝  
20170322,10,분노의 질주와 비교하면 실망하겠지만그래도  이정도면 볼만한거 아닌가?  
20170322,2,첨으로 댓글 남기네요..재미도 없고 감동도 없고..킬링타임용으로도 아까움 ㅜㅜ  
20170322,3,4D 에서 봤는데도 재미없다.... 아...  
20170322,3,허술하게 질주하는 맥빠진 액션  
