0,1,2
20171002,8,"관람객굉장히 아름답고 현실적인 성장영화. 나중에 돌이켜도 후회하지 말라는, 엄마는 말하지 않아도 알고 있다는 엄마의 말부터 눈물이 계속 나왔다. 붙잡아서 떠나보낼 수 있었다는 말의 의미가 가슴에 콕 박혔다  "
20171002,8,관람객현실을 마주하며 어른이 되었다  
20171001,3,"아픈엄마와 사는 왕따소년 코너에게 어느날 나무괴물이 나타나 3가지 이야기를 들려주고, 진심을 말할수 있는 용기를 준다. 덕분에 엄마의 죽음을 받아 들이고, 외할머니와 관계도 개선 하는데, 자신의 상상인줄 알았던 괴물이 엄마의 소녀시절 그림속에 있었다.  "
20171001,10,관람객소년은 엄마의 손을 놓지 않았어. 그래서 엄마를 보내줄 수 있었단다.  
20171001,8,"관람객의외로 뻔한 플롯, 믿고 듣는 리암 니슨  "
20171001,7,관람객잘 만들어진 영화였어요  
20171001,9,관람객재미 있어요. 아이들이 좋아하고 가족 영화오 손색 없어요  
20171001,8,관람객눈물 없이는 못보는 영화 손수건 꼭 준비하세요  
20171001,10,인생 열손가락에 드는영화 주제의식 뚜렷하고 연출 연기 각본 다 좋았다  
20171001,10,관람객혼자 봤던 영화인데 재밌었네요  
20171001,9,"관람객솔직하게 인정하고 진심을 표현하기는 너무 어렵고 방법을 모르는 일이라, 이 영화가 위로가 되었다.  "
20171001,6,관람객네 뭐 저는 잘봤습니다 허허  
20171001,1,개노잼핵노잼조낸노잼  
20171001,9,관람객여운이 오래 남는 영화였어요초등생 아이와 함께 봐도 좋은 영화  
20171001,10,대단한 영화 인생 탑 5안에 들어갈 영화  
20171001,10,"관람객어린아이의 상처와 치유, 성장을 표현해낸 명작.  "
20171001,10,너무 슬퍼서 중 후반부터 울면서 봤다 진짜  
20170930,7,"그냥저냥..왜이렇게 극찬하는지는 의문,,,평소에 판타지 좋아하는데...  "
20170930,6,관람객참다참다결구에는탈출함  
20170929,9,관람객감동적인 영화이면서 감독의 창의성이 돋보입니다. 강추  
20170929,7,관람객그냥그랬음88999  
20170929,10,"관람객교훈이 있는 아이,어른 영화인듯  "
20170929,8,관람객여운이 남는 영화.. 아이의 심리를 통해 힐링 받는 기분이였어요. 특히 몬스터가 들려주는 세 이야기가 무척 취향 저격이네요 ㅎ  
20170929,9,동화를 현실속에서 공감할수있는영화 요즘영화들속에서  간만에  흐믓하네요  
20170929,8,관람객잔잔하고 감동있는 영화.소년의 성장을  다룬내용으로 살짝 지루할수도 있지만개인적으로는 만족함  
20170929,10,관람객재밌었어요 추천해요!!  
20170929,10,진짜 간만에 몰입해서 본 영화  
20170929,10,관람객아이라서 더 가혹하지도 덜 하지도 않는 현실을 마주하는 과정에서 오는 어쩔 수 없는 성장. 내 안의 몬스터를 깨우면 세상의 몬스터와 맞설 힘이 생긴다.  
20170929,8,"관람객 개봉 극장이 별로 없고, 상영 횟수도 적어서 처음 가본 극장에서 보게 되었는데 다행히 좋은 영화네요.  "
20170929,10,눈물이 나지만 눈물을 강요하지 않는 영화  
20170928,10,관람객코너가 성장해가는 모습이 너무 감동적이었어요~  
20170928,8,관람객7.5 정도? 암튼 자극적인 영화들보다는 이런 영화가 개봉관을 많이 잡아야 정상적인 사회가 아닌가 싶다.  
20170928,10,관람객정말 재밌습니다 꼭 보세요  
20170928,8,관람객어머니를 돌이켜 보게 되는 영화...  
20170928,9,관람객어른을 위한 동화. 담담함이 더 슬프네요  
20170928,9,관람객아역배우가 연기를 잘했다.  
20170928,8,관람객누군가에게는 꼭 필요한 영화 같습니다.  
20170928,9,너무나 현실적이라 슬픈  
20170928,8,관람객소년의 연기가 되게 좋았어요. 반전이랄까.... 어쩌면 예상할 수도 있는 내용이지만 되게 슬펐어요  
20170928,10,관람객진심으로 후벼파는 힐링영화였습니다. 엄천 울면서 본..  
20170928,1,초반에 자다가 후반부부터 깨서 보면 시간 잘감  
20170928,10,"100점만점에 200점 주고싶은영화, 한장면도 집중하지않을수없었고 아무음악도 깔리지않은 배우들의 대사를 주고받는 장면에서도 지루하지않고 빠져 볼수있었던 최고작품이었다.이렇게 영화를 잘짜여지게 만들수있나싶고  많은 사람들이 보길 추천해주고싶은영화!  "
20170928,6,"마음이 따듯한 사람들만 보세요... 마음이 파괴적인 저는 졸았습니다.,.  "
20170928,8,"관람객깊고, 깊고, 깊다. 놀라운 연기와 놀라운 연출. 좋은 궁합으로 보여주는 이야기.  "
20170928,6,관람객마지막엔 눈물이 흐르더군요  
20170928,9,어린 아이에게 엄마와의 이별은 너무 큰 시련이다. 애써 회피하고 싶지만 현실은 냉혹하다. 어루고 달래 주고 싶지만 그렇게 진실은 덤덤히 다가왔고 아이는 성장했다. 보는 내내 내 삶에 대해 나는 냉정을 잃지 않고 진실을 마주했나 되물어 본다.  
20170928,10,관람객영화 특유의 분위기가 너무 좋았어요.  
20170928,9,관람객괜찮아 괜찮아 달래주는듯한 영화  
20170927,9,기존의 판타지를 기대하고 보면 실망할수 있다.  나 또한 그랬지만 오히려 코너 오말리가 자신만의 환상의 괴물을 통해 시간이 지날수뢰 점점 조여오는 상실의 아픔을 극복해 나가는 방법이 참신하고 아름다웠다. 동시에 너무나도 가슴이 애렸던 판타지.  
20170927,10,저 원래 이런 후기 전혀 안 쓰는데 이건 정말이지 쓸 수 밖에 없네요. 곁의 누군가가 떠났을 때의 상실감을 이미 느껴 봐서 그런지 더 마음에 와닿네요. 덕분에 감기 때문에 막힌 코 뻥 뚫렸네요ㅎㅎ 제 인생영화 확정입니다.  
20170927,10,관람객진실.상처에 맞설때 치유  
20170927,10,관람객이것이 진정 힐링영화입니다.  
20170927,1,관람객잣어요 너무 졸려서 잤숩니다 ㅋㅋ  
20170927,6,관람객약간 지루해요의지할 곳 없는 사춘기 소년의 성장기록  
20170927,10,관람객앞으로의 다가올 수 있는 일들에 대해 위로가 되는 영화였다  
20170927,10,판타지 영화 좋아하는데 재밌게 봤습니다!  
20170927,8,이해도 가고 공감도 간다. 게다가  현실을  동화를  넘나드는 표현도 너무 매끄러움. 배우들의 연기는  머  리암니슨  목소리와  루이스 맥더겔의  눈빛만으로도 이미 게임오버.  우린 왜  이런영화를  못만들까.  
20170927,8,관람객한국식으로 표현하면 중2와 흑염룡?  
20170927,8,관람객어른을 위한 동화네요 감동적임 !!  
20170927,10,아이들 애니메이션인주 알았는데.. 어른들이 봐야만 이해할수있는 성장영화  
20170927,9,상실에 대해 이토록 현실적으로 표현한 힐링영화가있을까...  
20170927,8,보고 재밌으면 조카들이랑 보려고 했는데 우리 초딩 유딩들은 별로 안 좋아할 듯 ㅋㅋㅋ  
20170927,10,관람객어른이 되며 깨달을 수 밖에 없었던 진실을 이런 아름다운 영화로 마주할 수 있어서 감사했다. 평생 잊지 않겠다.  
20170927,10,이 책을 세 번이나 읽었는데 영화로 개봉되서 넘나 기쁨ㅠㅠ 책은 나온 지 몇 년 됬음! 암튼 우리나라에도 이제서 개봉하다니..! 시험 끝나면 꼭 보러 가야지!!!!  
20170926,10,"우리의 이야기는 어떻게 끝날까? 우리도 마음속의 괴물을 불러보자. 그리고 그에게 네번째 이야기를 말해보자. 스스로 외면하고 싶었던 속마음을 털어놓고, 잔혹한 현실을 받아들이자. 위기는 인생의 한 과정이 될것이고, 새로운 방향으로 인도해 줄것이다.  "
20170926,10,인생영화 하나 더 추가했습니다  
20170926,9,관람객신의 이야기에서 인간의 이야기로. 삶을 이어나가는 이야기의 힘.  
20170926,7,관람객조금 지루하고 조금 슬프고 조금 여운이 남는다  
20170926,9,관람객눈물이 많이 나는 영화인지는 잘 모르겠지만 충실하게 영상물로서 만들어진 영화라는 생각은 들었다.  
20170926,10,색다른방식의 자아발견과정 그리고 3d로 개봉해도 손색없을 특수효과  
20170926,4, 눈물샘을 자극하기는 커녕 지루하고 뒤로 갈수록 뻔한 스토리가 예상 되었던 영화.감동적이긴하나  뻔한 감동스토리였던... 평점후기에 낚였던 영화 ..  
20170926,7,관람객아름다운영화였다.. 편하게 보면서 생각하는 시간 가질수도 있고  
20170926,1,"평점너무심하다. 이걸로 알았다. 댓글알바는 실존한다는걸ㅋㅋ인생영화라니 이게? 대체 이 영화로 뭘 얘기하려는지 모르겠음, 영화자체가 너무 어두워서 짜증났었다.  "
20170926,10,관람객감동적이네요 계속생각나는결말입니다  
20170926,5,"관람객평점이 좋길래, 그리고 어른을 위한 동화라고 하여 기대하고 봤는데 왠걸 너무 지루했다 나한테 이런 신파극은 맞지 않는단걸 다시한번 깨닫게 해준 영화랄까 아님 내 동심은 다 죽었나 아무튼 너무 기대하면 안되고 런닝타임이 끝나갈 수록  지루하고 밋밋하다  "
20170926,10,관람객진짜 어른을 위한 판타지! 정말 생각한거보다 훨씬 더 큰 힐링 받고왔어요  
20170926,9,관람객재밌는 듯 졸린 듯 유치한 듯 한데 기억에 남는 듯  
20170926,10,관람객영상미도이쁘고 . 어른이봐도 전혀손색없는 스토리.감동적입니다  
20170925,8,관람객아름다운 영상미와 소재의 독특성에 후한 점수를^^  
20170925,1,진짜 너무 우울해서 짜증났음얘기하고 싶은게 머임?  
20170925,6,괜찮은 척 자기의 감정을 숨기고 살았던 주인공이 진정 자신의 감정과 마주하면서 성장하게 되는 내용을 잘 다루고 있다. 익숙한 내용과 다소 느린 진행 탓에 처지는 건 아쉽다.  
20170925,7,시고니 위버가 코너한데 할머니가 리즈시절에 말이야 하면서 에일리언 다 조져버린 얘기해주며 끝나는 줄 알았는데 없어서 많이 아쉽더라구요  
20170925,10,계속 흐르는 눈물. 이 영화를 봐서 다행이다  
20170925,10,깨달음과 위로가 섞여서 들어있는 보따리를 한아름 받은것같다.마녀와 왕자이야기는 소름돋을정도로 강했고 마지막은 더 소름끼쳤다. 반전이 여러곳에 들어있는 감각적이면서도 위로와 깨달음도 가득담긴 영화다. 고등학생이상이라면 강추한다  
20170925,8,"관람객어린아이의 극단적 상황에 내몰린 심리로 인한 허상인지,  진실을 가지고 있는 판타지인지 관람객의 판단에 따라 스토리가 달라질수 있는영화. 개관적인 시각에서 몬스터가 하는 말들은 보는 사람에게도 위로가 되는 조언이었다.  "
20170925,6,관람객응원 하겠습니다! 영원한 비밀은 없으니!  
20170925,8,관람객진실과 진심을 받아들이는 것  
20170925,2,와...제 인생에 길이 길이 남을 영화네요ㅠㅠ 불면증이 해소 됐어요ㅠㅠ  
20170925,8,관람객아이가 바라보는 아픈 엄마를 사랑하면서도 깊숙히 숨겨놓은 솔직한 마음 엄마가 생각하는 아이에 대한 사랑 많은 생각을하게되는 마음 뭉클하고 따뜻한 영화  
20170925,10,관람객아들을 지켜주려는 바람에서 시작된 것 같다. 너는 엄마였겠지.  
20170925,8,관람객정말 동화같은 내용! 엄마가 생각나는 영화  
20170925,10,내면 깊이 아물지 않은 아픔을 위로해준 영화  
20170925,10,조용히 눈물흘리는 영화입니다  
20170925,10,엄마를 병으로 잃어야하는 소년...  그 소년의 내면의 성장기...  
20170925,10,나도 막 부수고 싶다. 같이 부숴줄 몬스터가 옆에 있어주면 좋겠다.  
20170925,9,관람객좀 어린분들한테 어려울수도있는데 저도 어려서 어려웠는데 지금 다시 생각해보면 대단한 작품이고 여운이 많이 남습니다..!  
20170925,10,관람객오랜만에 펑펑 울은 감동적인 영화  
20170924,10,어른들을 위한 동화. 슬프고 아름답다  
20170924,10,"신랑이랑 둘이 울면서 봤네요아이의 마음이 아파서 울고, 아이를 남겨둬야 하는 엄마 마음 미어져서 울고..  "
20170924,9,"관람객스토리구성이 아주 좋은 영화, 난해하지 않고 감성적인 터치가 감동인 영화, 여운이 남는 작품이네요. 다만 프레임을 떠올려 줄 ost가 기억에 남지 않아서 아쉽습니다.  "
20170924,8,관람객아역이 연기를 너무 잘한다ㅠㅠ  남자친구도 몰래 눈물을 흘릴정도로 감동적인 영화  
20170924,10,생각과는 다른 진실을 마주하는 건 참으로 힘든일이지요  
20170924,8,관람객주인공 아이가 귀엽네요  
20170924,6,내용 자체가 크게 와닿지 않고 오락적 재미도 부족.  
20170924,10,12살 아들이랑 보았는데 아이가 엄청 감동받았습니다.  
20170924,5,관람객앞부분은 살짝 지루한 감이 없지않아 있었지만 뒤로 갈수록 감동적이네요  
20170924,8,관람객무슨 생각을 하는지는 중요하지 않아 무엇을 하는지가 중요하지  
20170924,10,관람객최고였어요. 마음의 위안을 받았습니다  
20170924,10,관람객자기 맘을 인정하는게 쉽지않다는걸 다시한번 깨닫고 간다.  
20170924,9,상영관이 몇군데 없어요..서둘러 가족들과 함께 꼭 보시길~~~  
20170924,10,아이의마음을 들여다봐주는 몬스터의 존재심리를 잘 표현한 수작이다청소년아이들과 함께 보기좋은 영화로 추천합니다  
20170924,10,관람객감동적이고 아이와 함께 보기에 너무 좋은 영화였어요!눈물이 안날 수 없는 영화 ㅠㅠ적극 추천드려요~  
20170924,8,소년이 어찌 연기를 잘하는지.눈물 쏙빼놓네요..주목먼수터도 무심하지  소년이 진심을 이야기하면 소원을 들어줄주 알았는데..쩝^^ 볼만해요  
20170924,1,관람객재미업엇어요 판타지여오ㅘ 조핳하는데  
20170924,8,눈물이 나와서 영화끝나고 한참후에 나왔습니다.  
20170924,6,관람객그냥 그럭저럭. 조금 지루했어요.. 대사는 좋았어요.  
20170924,10,언제나 어린 아이의 시각에서 봐야  이해가되네요...  
20170924,7,관람객누구나 지나오는 그 시절을 조망하는 따뜻한 시선  
20170924,9,"영화가 끝날때까지 동화같은 잔잔하고 깊은 감동을 느낄수있어 좋았습니다아이가보아도 부모가 보아도, 저같은 성인이 혼자 보더라도 느끼는바가 있는 이야기입니다  "
20170924,10,관람객최고의 영화였고 연기가 명품이였습니다.  
20170924,8,관람객엄마의소중함을느낄수있어좋았습니다  
20170924,9,"관람객판타지가 가미된 한 소년의 성장 영화, 코너는 남들보다 아프게 자라네요ㅠ 몬스터의 존재가 너무 아름다웠어요. 코너의 엄마인 리지의 말이 가슴 아프게 다가왔어요ㅠ 코너는 후회하지 않겠죠?  "
20170924,7,재미는 부족하지만 감동 하나는 확실히 느낄 수 있는 성장 영화  
20170924,10,관람객아들의 엄마에 대한 사랑을 느낄 수 있는 감동적인 영화  
20170924,8,"관람객글쎄, 감동은 전달 되었지만 공감은 전달 되지 않았다.  "
20170924,10,명작입니다 처음부터 끝까지  
20170924,9,관람객슬픈 장면보다 무서운 장면에서 눈물이 났다  
20170924,1,평점이 너무 과해서 1점 줍니다감동적인 이야기는 맞지만 그렇게 눈물이 난다거나 평점이 10점줄 영화는 아닙니다 영화가 히트치지 못해서 리뷰에는 점수가 좋지만 실제로 대다수의 관람객은 울지않았어요  
20170924,1, 대박이예요!!!~~우리 애가 극장에서 잠이 들었어요..  
20170924,10,엄마의 손을 놓지 않았기 때문에 엄마를 보낼 수 있었다..대사 하나하나가 주옥같고 따뜻했습니다. 제 마음의 깊은 상처 다독임 받은 시간이었습니다.  
20170923,9,각자 감동받는 포인트가 다른 이상한 영화.... 그리고 혼자 영화보러온 관객이 많았던 영화.... 상영관이 많지 않아 서운했던 영화.... 오늘 봤습니다.  
20170923,9,"관람객후반부의 네번째 이야기, 진실을 말하라는 장면에서 눈물이 흐른다. 칼 융의 그림자, 융합, 자기실현, 현실을 직시하는 용기, 불교적 동양적 철학이 깃든  "
20170923,10,Momster Calls! The best film I've ever seen^^*  
20170923,10,관람객참 동화 같은 영화. 아름답지만 또 마냥 평화롭지는 않은.  
20170923,9,관람객이 영화와 관련된 모든분들 고마워요~덕분에 잠시 치유받았어요~  
20170923,10,관람객눈물콧물 쏙빼고 왔어요..상영관이적고 오늘 한개밖에 상영안해서 부랴부랴예매하고 보라갔는데 잘한거 같음!!  
20170923,10,관람객요즘 힘든 일이 있었는데 여태껏 눌러온 감정을 발산시킬 수 있게 해준 영화. 고된 삶을 살아가고 있다면 이 영화를 한번쯤 보시길 추천합니다.  
20170923,9,어른이 봐야 할 다크판타지...  
20170923,10,관람객무조건보자두번세번  
20170923,10, 달곰한 위로 대신 진실을 마주할 용기를 주는 영화 아름다운 소년의 성장기  
20170923,10,관람객한국에도 이런영화 많이좀 만들엇으면..  
20170923,8,관람객교육용으로 좋은 영화입니다  
20170923,10,관람객감동적 힐링  영화였습니다 상실을 경험한 사람은 펑펑울지도 몰라요  
20170923,10,관람객진짜 많이 울었습나다. 최고의 감동을 주는 것 같아요..  
20170923,10,"어른이 되어갈때 깨닫는것..선과악을 동시에 가질수있으며, 투명인간은 주목받는것도 안보이는것도 싫어하며, 몬스터가 요술처럼 병을 고쳐주는 존재가 아니란것. 아빠나 할머니도 무조건 좋거나 나쁜게아닌것. 엄마의 떠남을 바라는게 코너탓이 아님을 받아들이는것.  "
20170923,10,소년과 엄마 사이의 연결고리  
20170922,7,관람객엔딩이 아쉬운 영화입니다  
20170922,10,관람객판타지라는걸 알면서도  그 무엇 보다도  미친듯이 위로가된다  
20170922,8,관람객슬픈동화 잔잔하고 좋아요  
20170922,10,불치병에 걸린 엄마를 둔 한 꼬마 아이가 겪는 감정을 괴물이라는 매개체를 통해 표현한 영화. 꼬마 아이는 그저 엄마가 떠나지 않기를 바랐을 뿐이다. 그걸 표현하는 것이 얼마나 힘들었을까. 현실과 마주하여 성장하는 꼬마를 보며 눈물을 멈출 수가 없었다.  
20170922,10,급격한 감정변화를 느끼지 못했는데 어느순간 눈물을 흘리고 있다...  
20170922,9,관람객꿈에서 현실을 이야기하는 나무현실에서 동화를 이야기하는 아이어른을 위한 동화  
20170922,9,영상미도 좋고 영화에 나오는 몬스터는 청소년의 심리상태를 잘 대변해주며 몸이 아픈 엄마 먼 곳에 있는 아빠 대신 부모의 역할을 해주지 않았나 싶다  
20170922,10,이런 잔잔한 영화 오랜만이라 더 좋았어요  
20170922,9,누구나 인정 하기 싫은 내면의 속살을 어루만져 준다.깊은 울림의 위로가 되는 영화.  
20170922,10,그냥 하염없이 울다가 나왔다  
20170922,8,관람객처음엔 주인공 소년에 동정심을 느끼다가 후반부엔 내가 그소년인지 소년이 나인지.. 위로를 받은 느낌입니다.  
20170922,10,One of the best movies of my whole life...  
20170922,10,현실에 찌들어살고있는데 영화보고 위로받았네요  
20170922,7,"관람객지루한 면도 있으나, 결국엔 눈물을 짖게 하는 영화.  "
20170922,8,관람객상처치유에 관한 볼만한 영화  
20170922,8,관람객영상이 아름다워요. 소년의 아픔도 마음 아프고요.  
20170922,9,관람객너무 아르따운 성장영화였어여 ㅠㅠㅠㅠ 감동입니다  
20170922,9,관람객감동적이고 재밌어요 따뜻한영화입니다  
20170922,10,아주 재밌지는 않지만 아주 좋은 영화였다. 그래픽도 그렇고 신비로운 느낌도 그렇고 무엇보다도 잔잔하게 감동적으로 풀어나가는 이야기가... 진짜 진짜 잘만든 영화였다.  
20170922,10,관람객몇 년전 돌아가신 아버지가 생각났어요. 주인공과 같이 성장해가는 기분이었어요  
20170922,10,관람객영화가 어렵지만 정말 교훈이있는 영화에요 꼭 추천드립니다  
20170921,10,이런 영화를 찾아다녔습니다... 누구에게나 도움이 될 영화  
20170921,10,관람객눈물이 주르륵ㅜㅜㅜㅜ  
20170921,6,나는 순수하지 않기에..  
20170921,10,지금까지 보면서 가장 많이 운 영화..  
20170921,9,관람객무의식의 나를 만나는 시간  
20170921,10,오랜만에 영화를 보고 위로받았던ㅜ..  
20170921,10,관람객아이가 숨겨온 절규나 너무나 안타깝다  
20170921,5,관람객화면은 아름다우나 상상력이 좀 진부하다. 그래도 어른과 어린아이 중간의 섬세한 감정변화와 성장이 있었습니다.  
20170921,10,누군가를 잃어본 사람들은 소리내서 울고싶을 영화에요. 그 꼬마아이의 대사가 내 마음을 그대로 얘기해서 눈물이그치질 않았네요ㅜㅜ  2년전 돌아가신 아버지가 생각나서더 울고싶었어요.. 정말 대단한 영화에요  
20170921,10,"관람객 소중한 사람이 오랫 동안 아픈 모습을 지켜보는 일이란 어른이 되지 못한 어디쯤의 작은 인간들에게는 그들을 위로할 몬스터가 필요한, 그런 일.  어리지도 다 크지도 않았던 그 때의 작은 나를 꼭 안아주는 구급상자속 빨간약 같은 영화.  "
20170921,9,성인을 위한 동화이다 영화관안에서는 어린애가 되는 또 현실을 보게되는 영화이다  
20170921,9,관람객아이와 본 감동적인 환타지  
20170921,10,"첫번째 이야기는 종이 애니메이션, 두번째 이야기는 3D 애니메이션, 세번째 이야기는..  "
20170921,7,주인공 남자애랑 배우들 연기 진짜 너무잫함..!! 근데 좀 지루했던...  
20170921,10,진심 후반부에 눈물밖에...  
20170921,1,하품 한 40번은 한것같다.2시간동안 12살짜리 사춘기 꼬맹이 투정만 보다왔다.  
20170921,10,보고 난 후 이 감정을..어떻게 말로 표현해야 할 지 모르겠다...그저 눈물이 날 뿐  
20170921,8,관람객말로 형언할 수 없는 기분...  
20170921,10,"관람객""빨리 끝났으면 좋겠어!"" 저도 비슷한일을 겪었고 속으로 저런생각을 했던적이 있기에 너무 공감되고 그떄의 기억에 괴로웠다. 엔딩에서도 아름다운이별의 말보다 겪어본 사람들이 정말로 하고싶었던 말을 해줘서 좋았다.  "
20170921,10,"엄마가 떠날 거란걸 알기 싫어. 다 끝났으면 좋겠어, 내가 떠나 보냈어. 내가 죽게 둔거야.  "
20170921,8,관람객아이와 함께 감상했는데아이가 이해하긴 다소 무거운 주제였던거 같아요^^성인 기준으론 잔잔하고죽음과 헤어짐이 대해 생각해볼 수 있는 좋은 시간을 주는 영화라고 생각해요  
20170921,10,이 정도 해줬으면 10점 줘야지라라랜드 이후 처음으로 접하는 아름다운 영화.  
20170921,7,"관람객슬프고 힘들 땐 참지마요, 그게 진정한 어른이니까  "
20170921,10,관람객너무 잘 봤다 마지막 마무리가 특히 마음에 들었어요  
20170921,10,우리아버지가 암투병중이십니다 제가 어릴때이후로한번도 울어본적없는데 이 영화를보면서 많이울었습니다 참좋은영화였습니다  
20170921,9,관람객약이 필요없는 정신치료심리영화  
20170921,10,한 줄짜리 문장을 가장 아름답게 풀어내었다.  
20170921,10,이 영화를 보고 울었다면 내 마음을 되돌아볼 필요가 있다. 내 마음은 병들었다.  
20170921,1,마이너스 없는게 한스럽네요ㆍ 눈물 많은 나도 헛웃음 나오는데 눈엔 눈물이 내돈  먹었어. 시간 돌리고싶다. 평점알바 쓰레기들이네 진짜  
20170921,1,"아.... 진짜 댓글에 속았다!!!! 감동의 명작인줄 알고 울 준비하고 봤는데, 모호한 플롯과 포인트가 뭔지도.모르겠고, 이해도 안되고... 3점정도가적당한거같은데 댓글알바에 속아서 경계하란 의미로 1점주고 간다  "
20170921,10,아역 연기 진짜 잘하네요.... 아이인데 어른 표정 보일때 마다 흠칫 흠칫 놀람.... 내용도 좋고 오랜만에 좋은 영화 봤어요 감사합니다.  
20170921,9,정말 좋았다. 이렇게 좋은 영화가 입소문을 얼른 타서 많은 분들이 보셨음 좋겠다. 스토리가 정말 대단하다. 나의 저 깊은 마음을 위로해주는 느낌이다. 10점이 아닌 이유는 원작을 안봤지만 원작소설이 분명 더욱 대박일것 같은 느낌이 들었기 때문.  
20170920,10,잘 봤습니다. 감사합니다. 별점 또한 솔직한 제 이야기니까 받아주세요.  
20170920,10,그냥 지나칠뻔 했던 동화 같은 영화마음이 아직도 짠~하네요 T.T  
