0,1,2
20180129,10,눈물없는 나를 울려준 깊은 영화. 단순한 영화가 아니라 인생을 다시한번 생각하게 해주는 영화  
20180127,10,어후 평론가들 이런 영화는 8점 이상 평균 찍어줄 것이지 짜기는. 평론가는 개뿔 . 10점 만점의 10점. 인생영화 등극.  
20180122,10,"좋은영화 입니다.,... .  "
20180122,9,관람객신파보다는 잔잔하게 눈물이 난다 묘하게 위로를 받은 영화 후회X  
20180117,10,오랜만에 영화보고 펑펑 울었습니다. 코너의 용기에 박수를.. .  
20180117,9,관람객어른의 시선으로 본 아이의 세상....  
20180117,10,상실 아픔 부재 인정 성장  
20180115,10,처음에는 이야기 전개에 어떤 필연성이 있는지 몰랐다. 하지만 영화가 끝나고 나서는 감탄이 끊이지 않았다. 섬세하고 아름다운 영화였다.  
20180112,8,지루하다는 사람도 이해는 가지만 영화 완성도가 매우 높다. 흔한 소재도 아니고. 캐스팅도 매우 잘되어 누구하나 몰입을 방해하는 인물도 없다. 오랜만에 느껴보는 감동  
20180110,10,관람객보고나서 집가는 내내 행복했어요  
20180110,10,고맙습니다 감사합니다  
20180110,10,내용이 매우 슬프고 좋네요  
20180109,10,관람객최고최고 정말 감동적이였어요  
20180108,7,힐링영화에서 두고 두고 회자될 작품  
20180108,9,관람객멋진  영화같은 영화였습니다.  
20180108,10,계속 생각이 나는 영화..슬프고 따뜻하고 위로해주는 영화  
20180107,10,"엄마의 그림책, 이야기 들로 인해 몬스터가 코너 안에 자리잡았고 코너는 어느새 용기있는 아이로 성장했다.. 엄마의 대사 꼭 기억하자.. 그옆엔 내가 있을게.. 정말 따뜻하고 감동적인 이야기였다.. 이 이야기가 내게도 엄청난 힘을 발휘하게 할 것 같다  "
20180107,10,엄마...엄마....미안해...  
20180106,10,관람객정말 너무 좋은 영화였어요!!!  
20180104,5,관람객난해하더굼. 딱히 재미를ㄹ 못 느꼈다  
20180102,10,저는 .. 40초반 남성입니다. 잊었다고 생각했던 저의 9살 떠나신 엄머니를 생각하며 많이 울었습니다. 여러분도 꼭 이 영화 보세요. 그리고 다음날 아침에 어머니 꼭 안아주세요. 사랑한다는 말과 함께요. 그리고 몇OO 후에 오늘을 기억해주세요  
20180102,9,관람객혼영으로 보면 진짜 더 좋을영화! 어른들은 위한 힐링의 판타지!  
20180102,10,"개인적으론 스스로 솔직하지 못하고, 내 진심을 외면한 적이 많았던 인생이어서 그런가. 눈물도 마음속으로 흘렸지만 ㅋㅋ 아주 좋았다.  "
20180101,8,관람객괜찮아요 아이랑 같이 봤어요  
20180101,10,관람객두려움을 직면하고 수용한다는것  
20171231,5,"억지스럽게 말만들기 좋아하는 평론가들이 볼 때 훌륭하다고 말 할 수 있는 영화. 하지만, 영화를 보다가 스르르 잠이 들었다면 그건 최소한 재미있는 영화는 아니다. 관객을 설득하지 못하는 영화가 수준이 높든 낮든 어떻게 재미있을 수 있는지.  "
20171230,10,"누군가는 경험했거나 하고있고 누군가는 경험하게될 상실에 대한 이야기. 재미없게 본사람도 언젠가 이런일을 겪게되면 다시 생각날 영화인듯. 끝까지 소년이 입밖에 내기 무서워한 악마의 외침같은 ""다 끝나버렸으면 좋겟어""는 너무나 무서운 진심이다..  "
20171226,9,'떠나는 것'과 '보내는 것'은 같으면서도 다르다.  
20171226,6,동화의 결말은 자기 자신이 만드는 것  
20171224,7,관람객생각보다 재미있게 봤네요  
20171223,1,관람객생각보다 재미없음..  
20171223,10,그동안 나는 엄마가 날 두고갔으니 미운사람 이라고 스스로 생각하게 했던것같다 근데 이 영화를 보고 알았다 엄마가 너무 보고싶어서 그렇게라도 하지않으면 내가 견딜 수 없을거라 세뇌시켰단걸  
20171222,9,잡고 있기보다 놓아 주기가 힘든법. 소년에겐 오히려  더 큰 용기가 필요했다.  
20171222,6,아 너무 기대했나.. 35살 성인이 보기에 너무 어린이 동화같았다.  
20171222,8,관람객너무 큰 기대를 했나보다 그렇지만 여전히 아름다웠던 동화 다채로운 그림에 눈은 즐거웠던 영화  
20171219,9,말하지 않음의 악몽을 끝내고 엄마를 보낸 꿈꾸는 소년의 성장기. 무겁게 흐르는 이야기라 많은 타켓층들에게 불편하게 받아들여지고 소외받을 게 아쉬운 명작.  
20171217,10,관람객진실을 말하렴인간은 복잡한 짐승이야용기괜찮아 다 괜찮아메시지가 있는 힐링 무비눈물날 것 같았다  
20171216,10,가슴이 너무 따뜻하고 애리고 슬프다.  
20171216,9,눈물이 참을수 없게 흐르는 영화..  
20171216,8,관람객어른에게도 교훈을 주는 영화인것 같아요  
20171215,10,"어른이 되었다고 생각하는 지금까지도 항상 나는 괜찮다고 생각햇는데,,,날카로운 메스가 내속을 휘집고 간듯;; 살아오며 다듬지 못한 내면을 단100분으로 성숙시켜준 인생영화  "
20171211,9,관람객너무 미스터리하고 재미있어서 9점을 줬는데 10점으로서는 조금 부족한것 같다. 하지만 정말 재미있었다.  
20171209,10,관람객동화같은 영화생각할 거리가 많은 영화  
20171209,8,관람객생각보다....아이들이보기에 어려운듯...  
20171209,10,관람객넘 감동적인영화무언갈 느낄수있는그런  
20171208,9,몬스터를 부른 건 주인공이기도 하겠지만 아들을 걱정했던 엄마일 거란 생각도 들었음 병원에서의 마지막 엔딩을 보면...12시 7분 엄마가 떠난 시간이기도 하지만 엄마와 아버지가 만나는 시간이기도 했구나  
20171207,8,"많은 생각을 하게 만드는 물음들과 현실과 판타지의 적절한 조화가 좋았고 아이답다고 생각하는 것이 가장 어른스러울 수 있다고 느꼈다. 몬스터는 자기 자신일수도, 정말 판타지적인 존재일수도 있지만 이는 주인공의 엄마에게도 존재했고, 우리들에게도 존재한다.  "
20171203,10,관람객의미있는 영화. 볼 수 있음에 감사한다.  
20171130,7,상실에 대한 주제를 어린아이가 어른으로 성장해가는 모습에 투영하여 보는 이들이 공감하고 느낄수 있도록 이야기를 잘 풀어낸 것 같다. 주인공 아이의 연기도 대단하지만 몬스터가 이야기를 해준다는 설정이 신선하다.  
20171130,10,OO 평론가 새기들 걍 다 디졋으면  
20171128,7,좋은 내용인건 알겠는데 너무 뻔하다  
20171126,10,평점 짜게준다고 좋은 평론가가 아닙니다.  
20171125,8,인간이란 결국 한 문장으로 표현할 수 없다. 그러니 이 문장 또한 모순.  
20171125,10,"""인간은 누구나 고통스럽고 부담스런 진실보단 쉽게 받아들일수있는 거짓말을 좋아해.""이장면보면서 나도모르게울컥. 정말 많은걸 생각하게하는 대사였음.내가내자신한테 솔직해져야되는게 제일힘든일인것같음.코너처럼  "
20171124,10,진짜 너무 완전 대박 좋다  
20171123,9,현실적이면서도 이상적인 위로를 건네는 영화. 가끔은 거짓위로도 필요하니까.  
20171123,9,마지막 장면까지 보고서야 무릎을 치며 영화 전체를 이해하게 되었다. 실수라면 유아용 영화인줄 알고 7살 아들과 같이 봤다는 점이다. 아들 몰래 흐르는 눈물을 감추느라 애먹었네....  
20171121,10,정말 명작. 동화 같지만 너무 공감되는 영화  
20171121,10,눈물은 마음을 치유하고 정화해가는 과정.... ND  
20171116,9,누구든지 크고 작든 상실을 품 안에 지니고 평생을 살아간다. 그 일생 속에서 언제든 외로움과 고통을 마주할 수 있는 용기만 있다면 기꺼이 괴물과 함께여도 좋다. 떠나보낸 다는 것이 모두 그렇다. 눈물이 끊임없이 흘렀다.  
20171113,6,관람객감성충만한이들에게 추천  
20171111,1,억지스럽다는 표현도 과하다  
20171111,8,관람객내면의 무거운 마음을 털어내기  
20171111,10,"이야기가 가질 수 있는 메시지와 영상미의 훌륭한 조화, 아름다우면서 슬픈 동화.  "
20171111,10,관람객언젠가는 맞이할 이별을 대하는 방법  
20171111,7,관람객환상과 현실의 벽을 허무는 몬스터는 어머니의 동화였다.  
20171111,1,"솔직히 관객들에게 어떤 방법이든 전달력이 많이 떨어진 영화, 이미지 자체로는 괜찮은 영화이나 실제로 그 외에는 모든 게 미달함. 취지만 좋았음.  "
20171111,9,간만에 보는 대작이다.  
20171110,9,코너를 연기한 루이스 맥더겔의 풍부하고 섬세한 감정표현에 감탄했다  
20171109,10,보세요 후회 안합니다.  
20171106,10,관람객너무 많이 울었어요.ㅠㅠ 묻힌 게 너무 아까운 좋은 영화입니다. 상실을 어떻게 극복해야 하는지 슬픔을 어떻게 해야 하는 건지.. 과거의 나에게 보여주고 싶다는 생각이 들었어요.  
20171106,10,코너가 혼자 아침을 차려먹고 빨래를하고 등교준비를 하면서 아픈엄마를 바라보던 눈길이 너무 슬펐다 오랜만에 찾아오는 아빠를 기다리고기다리며 기뻐하던 그 눈길도ㅜㅜ 아이의 마음으로 본 영화. 너무나 가슴아린 아이의 마음 ㅠㅠ  
20171105,10,보고난 후 가슴이 먹먹해서 움직일 수 없었어...  
20171105,9,딱히 큰 감동을 원하는 사람들에게는 추천안하지만 이 영화가 이루어내는 잔잔한 감동이 굉장히 여운깊개 오래간다.너무 좋다 사랑스럽다 핡♥  
20171105,10,별 생각 없이 보다가 후반에 엄청 울었네요.. 감정표현에 충실하자는 것과 있을 때 잘하자라는 두 의미가 맴돈 영화!  
20171104,10,관람객우든 에디션 옵티머스 프라임  
20171102,9,과정이 상처투성이 일지라도 우리는 성장해야 한다.  
20171101,7,진심을 마주하는 용기 ...   영화는 다소 지루할수 있다  
20171031,7,관람객청소년인 딸이 위로와 감동을 받았다.나로서는 너무 작위적인 느낌이 있었달까?신선하거나 재밌진 않았다.  
20171030,10,가슴 부여잡고 울어버린건 이 영화가 처음입니다..  
20171030,10,감동도 재미도 최고 눈물나네요  
20171029,10,"정말 감동적인 성장영화, 나무괴물에게 반했어요.  "
20171029,8,관람객내용이랑 소재의 선정이 독특해서 참 좋앗ㅂ니다  
20171029,10,관람객별 생각없이 들어갔다가 펑펑 울며 나온영화. 연출 극본 모두 좋았습니다 추천!!  
20171028,1,영화 해석을 못하겠네요 어디서 슬픈건지도 모르겠고..다들 평점 너무 슬프다고 적었는데 도데체 어디서 슬픈거임?  
20171027,10,아내랑 보다 마지막에 눈물이...  
20171027,6,관람객판의 미로를 생각했다면 실망할듯  
20171027,10,진짜 구라 안 치고 개 띵작  
20171026,10,관람객어흑. 어찌나 꺼이꺼이 울면서 봤던지요. 그래도 책과는 다른 마지막 장면 덕에 웃을 수 있었습니다.  
20171026,7,"소년에게 다가온 시간, 우리 모두에게도 언젠가 다가올 시간. (플롯은 조금 아쉽지만 스토리는 명확하다) 어른에게는 이해 할 만한 보편적인 정서라도 풀어내기에 따라 아이들이 공감 할지는 의문이다.  "
20171025,10,관람객마음을 따뜻하게 해주는 영화. 반전 굿  
20171025,8,소년이 나온 성인 동화.  
20171024,10,괴물을 불러 내더라도 내안의 진심을 확인할수 있었으면...  
20171023,7,나이를 먹어도 어머니는 항상 보고 싶다  
20171023,8,관람객너무 난해해요 아이들이 보기엔 좀 어려울듯하네요  
20171022,10,관람객위로가 많이 되었습니다.  
20171022,10,명작이다 정말 명작이다  
20171022,7,사랑의 힘이 우리인간을 치유한다  
20171022,10,관람객보기에 괜찮은 영화입니다.  
20171021,10,이영화를보고드디어죄를씻었다며어린아이때로돌아가서럽게우시는어머니를보고한참을울었다. 몇년간아픈외할머니를간호하며다놔버리고싶다는마음이든건절대당신탓이아니에요. 당신은최선을다했고지금은사랑하는나의어머니입니다.  
20171021,8,관람객어릴적동화가튼내용판타지같고재밌네요  
20171021,7,"관람객본인이 암으로 죽어가면서도 아들에게 줄 수 있는 백 년을 바라는 어머니, 그리고 그런 엄마를 보내는 소년의 성장.  "
20171021,6,사랑하는 사람을 잃는것 만큼 큰 슬픔은 없다  
20171020,10,관람객음악. 스토리. 연기까지 완벽  
20171020,9,관람객괜찮았고잔잔하고슬펏음  
20171019,10,역시 동화같은 영화는 최고입니다.  
20171019,8,관람객환상과 현실이 자연스럽게 어우러지는 감동적인 영화였어요 아역 연기도 굿!! 힘든 선택이나 상황 앞에 놓인 사람들이 보면 좋을것 같아요  
20171018,10,치유의 힘은 자신의 내면의 소리를 듣고 토해내는 것이라 생각한다. 상실의 시대를 살아가는 우리에게 길을 알려주는 좋은 영화였다.  
20171017,7,관람객인간이기에 어쩔 수 없이 가지게 되는양심이라는 마음에서 오는 스스로의 자책그로인해 괴로워하는 우리에게그 마음을 솔직하게 끄집어내게 한 다음괜찮다고 위로해준다.  
20171016,10,어린 소년이 감당치 못할 큰 일을 어떻게 받아들일지.. 현실을 부정하면서.. 그냥 보면서 마음이 아팠네요. 자기 감정을 인정하는거 내가 이만큼 힘들다고 이야기 하는 거. 꾹꾹 참지 않고 쏟아낼 줄 아는 것 또한 중요하다는거...  
20171015,6,몬스터와 함께 성장하는 소년의 이야기. 산다는건 무언가를 잃어버리는 과정이다.  
20171015,9,아. 가슴 아픈 소년이여  
20171015,9,관람객진짜 눈물 펑펑이고 감동적입니다ㅜㅜㅜ CG도 좋았는데 약간 스토리가 아쉬웠어요  
20171015,10,관람객스포일러를 하면 안될 거 같아 자세히는 말못하지만...되게 억지스럽지 않고 자연스러워서 저는 좋았다고 생각합니다  
20171015,8,관람객새로운 느낌의 성장 드라마. 생각을 하게 해주는 영화.  
20171015,10,관람객코너가 이제 악몽에서 벗어나 편하게 잘 수 있기를 ..  
20171015,10,관람객어른을 위한 동화라는 말이 딱 맞음 최고  
20171014,8,관람객동화적 요소로 상실감을 잘 풀어낸 듯  
20171014,10,관람객어른들이 보는 것 같아요 진짜 너무 좋아  
20171014,5,관람객별로 재미 없었어요..  
20171014,9,"관람객세상이 꼭 선과 악으로, 이쪽과 저쪽으로 나눠지지 않는다는 사실을 알아가는 코너가 너무 슬프고 또 공감이 되어 눈물을 멈출 수 없었다.  "
20171014,10,관람객느끼는 게 많은 영화. 동행이 펑펑 울었다.  
20171014,8,관람객이별과 그 여진을 다룬 독특한 영화  
20171014,6,몬스터라는 소재에서 내면연출로 한 소년의 심상을 통해 극을 이끈 건 좋았는데 외부의 사건과 잘 병행시켜 소년의 변화를 보여줬으면 더 완성도가 있었을 듯. 너무 내면으로만 파고들어간게 다소 지루하고 아쉬운 편.  
20171014,10,환타지 영화인지 알고 보고 악평한 애들은 제발 국산영화나 봐라  
20171014,10,힐링도되고무언가 후련해지는영화였다 책으로 읽었을때도그랬지만 내안의 나에게 너의진실은  뭐냐고 묻고반성하게되었던것같다 전체적인분위기가 스산하면서도  마음에들었다  
20171014,10,관람객처음에는 잔잔한데 감동 있고 교훈을 주는 영화  
20171014,9,이런영화들 너무 좋다 엄마가 올라탄 나무 몬스터끝나고도 여운이 남는다  
20171013,4,아픈 현실의 도피처이자 치유의 산물  
20171013,10,관람객알고보면 모두가 우리들의 이야기  
20171013,4,나는 조금 유치하다고 느낌..  
20171012,7,관람객동화를 입어도 감출 수 없는 성장의 고통.  
20171012,2,관람객재미없다 재미없다 재미없다  
20171012,7,관람객어린시절이 생각나는 좋은 영화였다  
20171012,10,관람객우리 모두 나무할아버지 하나쯤은 갖고싶다~♡소년의 마음 깊은 죄의식을 끌어내 털어내버리는역할 담당~^^ 목소리도 좋고요!소년의 연기도 일품이었고 시고니 위버 역시존재감 확실했어요♡  
20171012,8,관람객어른들을 위한 힐링 영화  
20171012,8,코너에게서 나를 보았다  
20171012,10,무슨 말을 해야 될지 모르겠다.. 그냥 다시 보고 싶다.이토록 섬세하고 아름답고 강렬하게 마음을 만져주는 영화가 있었을까 싶다. 이런영화가 아직까지 메가히트를 하진 않는 현실이 아쉽다.  
20171011,9,관람객힐링이라기보단 슬픔..  
20171011,7,관람객어린이의 감수성을 같이 공감할 수 있었던 시간  
20171010,8,관람객마음을 많이 어루만져주는 치유 영화였습니다^^  
20171010,10,"관람객굉장히 차분하면서도 아프고, 그러면서도 치유되는 영화였습니다. 저도 모르게 눈물 흘리고있더군요 좋은 영화였습니다.  "
20171010,9,"관람객백프로 이해는 안되지만 좋았다.,  "
20171010,10,굉장히 감동받은 영화입니다.  
20171010,10,관람객아 진짜 오늘 너무 많이 먹어서 배가 고파서 오늘 9시까정 전 대표는  
20171010,10,몬스터는 왜 그렇게 아이의 꿈 이야기를 솔직하게 이야기해야 한다 강조했나.그때문에 더욱 아이가 가엾다.인간의 양면성..서로 상반댄걸 동시에 원하는 괴로움.가슴이 너무 미어진다  
20171010,8,관람객따뜻한 위로가 되는 영화. 어른을 위한 동화.  
20171009,8,먹먹하고 재밌었고...ㅎㅎ 참 괴물을 기발하게 활용해서 좋았던거 같고 참 특이한 영화로 기억될둣 ㅎㅎ  
20171009,7,네 마음 가장 깊은곳에 진실을 말하면 되  
20171009,10,관람객슬로 무비! 나의 성장기를 생각해 볼 수 있는 영화  
20171009,8,가슴이 아프면서 진하게 여운이 남는 영화였다!소년의 진솔한 마음을 몬스터로 인해 마주하며엄마에 대한 죄책감을 덜 수 있는 좋은 영화를 보았다~^^  
20171009,10,상처를 가지고 있다면 누구나 위로받을것이다 끝까지 여운이 많이 남는다 더 성장하고 돌아보게되는 정말 봐야할 영화  
20171009,9,엄청울엇네ㅇ... 왜케 슬프지..  
20171009,10,정말 명작이에요 인생영화!  
20171009,10,올해본 영화중 최고의영화훌륭한 연기 연출 정말 꼭 한번보라고 추천해주고 싶은영화! 영화를 본 사람의 삶에 따라 수많은 생각 느낌 여운이 남을거같다 나자신과 마주보고 더는 피할수없을거같은 그런느낌 그리고 한발작 앞으로 내삶을 나아가게될거같은 마음  
20171008,9,관람객해줄 말이 없네요  
20171008,9,관람객아픈 성장에 관한 동화적 이야기  
20171008,10,아픔을 따뜻하게 감싸주는 그런 영화 꼭 추천합니다.  
20171008,4,관람객반복 그리고 또 반복지루하다  
20171008,10,관람객엔딩크레딧이 다올라갈때까지  자리에서 일어나기 힘든 영화.  
20171008,10,관람객휴지 가져가세요 제발요  
20171008,8,관람객이야기는 되어지는 것들의 흘러감  
20171008,9,관람객우리에게 필요했던.. 보석 같은 영화  
20171007,9,관람객보고 나면 여운이  강하게 남는 영화예요 단순한 영화는 아닙니다. 어른을 위한 동화  
20171007,3,관람객이해가 안가서 별로였음  
20171007,8,관람객상영관이 많지 않은 듯 하고 상영관내에 10명 남짓한 사람들과 본 영화였는데  생각 이상으로 좋았다. 주변 사람들에게 몇 번이고 이 영화 얘기를 했던 것 같다.  
20171007,9,관람객재미있게 잘 봤습니당.  
20171006,2,기대보다는 단순했습니다  
20171006,1,우화의 초심으로 돌아가다.  
20171006,7,관람객여자친구랑 좋은 추억되었어요  
20171006,9,관람객오랜만에 감동적인 영화를 잘 보았어요  
20171006,9,관람객 꽉찬 위로를 받았습니다  
20171006,10,마지막 소년의 대사에 나도모르게 참았던눈물이 왈칵쏟아졌네여.. 전 사춘기딸아이랑같이가서봤는데 정말 오랫만에 딸아이랑 이야기도 많이나눴어여.영화한편으로 둘만의 추억을만든거같아서 너무 좋았습니다.  
20171006,8,관람객재미있고 긴장감있는 영화였다  
20171006,5,관람객아이들만 봤는데 아이들이 보기엔 의미가 어려웠던것 같네요  
20171005,9,관람객내면의 치유를 시작할 수 있었던 시간  
20171005,9,잔혹한 현실 속 그 아이가 성장하는 방법  
20171005,10,관람객매우매우 재밌었습니다. 상상력이 풍부해지는 느낌. 누군가를 떠나보낸 기억이 있는 분들에게 와닿을 것 같습니다.  
20171005,10,관람객영상미 최고 잔잔한 내용  
20171005,10,마음속의 괴물이 심장을 찢고 나오는 것 같은 영화나와 만나줘서 고마워  
20171005,9,"몬스터라는 제목에 어마무시한 괴물이 나올듯한 기대를 안겨주는듯 하지만, 정 반대로 여운을 남겨주고 감성을 폭발시킨다.  "
20171004,8,관람객많은 생각을 하게 만드는 판타지네요  
20171004,10,어른들을 위한 아름다운 동화. 인생영화.  
20171004,10,계속해서다시보고싶다  
20171004,9,관람객생각하는 것 보단 행동하기  
20171004,7,"단순한 동화같은 판타지물이라 생각했는데, 자식에대한 엄마의 사랑을 몬스터와 일원화 시켜 풀어낸다. 볼만한 가치가 있는 작품  "
20171004,9,관람객굿굿잼나여 어른을 위한 성장영화에요  
20171004,8,"관람객상실의 아픔의 치유 가능성. 우리는 다 어렸지만, 그것을 극복해 낼 수는 있었다.  "
20171004,10, 3개월전 시어머님을 하늘나라로 보내드렸어요 영화속 소년이 남편같네요 가슴이 아프고 또 아파요 완성도 높은 영화예요  
20171004,9,마법과 동화는 고통을 면제시켜주지 않는다.그것은 성장하기 위한 힌트만을 제공해줄 뿐이다.  
20171004,6,"심심한 감 있지만 볼 가치가 있는 영화입니다. 영화가 끝나고 한동안 사색에 빠졌고, 소년뿐만 아니라 저또한 위로를 받았다는것을 알았습니다. 소년만이 아닌 관람객을 위로를 하기위한 영화가 아닐까 싶습니다  "
20171004,9,관람객감동적입니다~~넘재미있어요  
20171003,10,최고였습니다. 진정한 힐링무비라는게 이런거라는걸 경험했습니다. 두고두고 기억에 남을 저만의 추석 영화특선이될거 같습니다.널리 알려져야 할텐데 개봉관과 상영시간은 너무하네요.  
20171003,3,관람객생각보다 별로였습니다  
20171003,10,관람객너무 감동 적이엿다  그리고 이야기가재밋엇다  
20171003,10,"관람객상영관 좀 늘려주세요ㅠㅠ 다들 이걸 봐야 해여,,  "
20171003,9,관람객많은 생각들을 하게되는 영화입니다.. 혼자 재밌게 보고 느끼는 영화에요  
20171003,10,"""치료의 반은 반드시 낫는다는 믿음이야""  "
20171003,7,잔잔하고 감동이 있는 영화...였으나 압구정c*v 망할 틸트좌석때문에 집중도 떨어지고 허리 목 지금도 아픔 ㅜㅜ  
20171003,10,관람객 나도 모르게 눈물 흘리고 있던 영화  
20171003,5,관람객판타지 요소는 없다시피하고 지루하네요.동화라고하기엔 너무 우울한 흐름..바추네요.  
20171003,7,관람객어디선가 본 듯하다는 느낌을 도저히 지울 수가 없다.. 그러나 네 번째 이야기 시퀀스만큼은 경이롭고 아름답다  
20171003,4,잔잔한 교훈적인 감동 드라마  
20171002,2,관람객평이 좋아서 보러 갔는데 왠지 모르게 잠이 와서 꾸벅꾸벅 졸았음...  
20171002,10,당신이 없어도 나는 괜찮다고 잘 살아갈 거라고 말했어야만 했는데  
20171002,10,관람객아이들을 위한 영화인데.. 어른인 제가 눈물이 나네요.ㅜ  
20171002,9,관람객초반엔 좀 지루했지만 후반이 갈수록 연기력과 연출에 몰입이 저절로 되며 그 내포하는 내용에 공감이 되어 현실의 쓰라림이 몰려온다.  
20171002,8,관람객어른들을 위한 영화라는 후기에 백번 공강  
20171002,1,너무 지루하고 재미없습니다. 진짜 최악의 영화 시간만 날렸네 ;;  
20171002,10,관람객소년이 현실을 있는 그대로 받아들이며 제 안의 진실을 이야기할 때 비로소 성장할 수 있다.  
20171002,10,주인공의 할머니도 하나뿐인 사랑하는 자식을 잃어버리는 슬픔을 겪게되고 주인공 아버지도 자신이 사랑하는 사람을 잃어버리는 슬픔을 겪게되고 주인공도 사랑하는 엄마를 잃는 고통을 겪는다. 주인공의 옆사람들이 주인공이 겪는 슬픔을 같이 겪는다.  
20171002,10,심리학책보다 이 영화 한편이 더..  
