0,1,2
20170513,7,관람객고통가운데 있는 이들이 신은 어디에 있었는지에 대한 물음에 답을 주는 영화였습니다좋은 영화입니다.  
20170513,5,그냥 그런 영화 종교적인 부분이 너무 강함 지루해 죽는줄  
20170513,9,상영관이 많지않아 이런 좋은영화가 묻힌다는 게 넘 아쉬워요ㅎ비기독교인입장에선 모르겠지만 지극히 크리스쳔의 입장에선 주변사람 모두에게 엄청 추천하고싶네요 영상미나 스토리와 교훈면에서도 넘 좋아요  
20170513,10,관람객굿~!!너무 좋앗습니다.  
20170513,10,관람객완전 굿입니다요_()_  
20170513,10,관람객계속 울면서 봤어요ㅠㅠㅠ 짱짱!!  
20170513,9,관람객세상에서 가장 소중한 대상을 잃은 남자와 신의 대화  
20170513,10,기대안하고 갔는데 진짜 종교가 아니라 하나님 사랑이 어떤건지 그 자유함이 얼마나 짜릿한지 느끼고왔어욜 담주쯤 친구들이랑 또 보러갈예정~  
20170513,10,평론가들의 평점은 앞으로 공개하지마세요.지네들만 알게...리뷰만 제출하게 하세요.  
20170513,10,꼭 봐야 할 영화입니다.  폭력물 음란물과는 비교할 수 없는 작품입니다.상영관이 많지 않아 너무 화납니다.  
20170513,5,관람객ㅎㅎ좋아요재미네요하하  
20170513,10,관람객꼭 권합니다!...가족과 친구와 혼자서..꼭보세여!. 우리가 이해할수 없는 고통과 용서에 관해 알기 쉽게   어느가족의 일화로 풀어줍니다!..좋은 영화 명작입니다!..주님은 세상 모든것이고 섬세 하시고 사랑이시고 회복이심을 알게 합니다.  
20170513,10,관람객마음이 촉촉해지는 영화  
20170513,10,관람객크리스천의 구원의 여정을 담은 영화이다 ㅎㅎ 많은 생각을 하게 해주는 영화이다  
20170513,9,관람객진정한 용서와 놓임에 대해 생각해볼수 있도록 하는 영화였습니다.  
20170513,10,"하나님,예수님,성령님의 성품을 잘 알수있는 영화, 하나님을 오해하고 있던 부분이 사르르 녹는 영화.  "
20170513,9,관람객너무재미있어요너무재미있어요  
20170512,10,관람객영화속에서 나오고 싶지 않았다...  
20170512,10,밤 하늘에  반짝이는 별을  보게되면  하느님께서  기도를들어주시는거라는...대사가..감사하네요!영화보기  전 날  밤에  집에 들어가는데  보름달 옆으로빛나는  별이 두개  있었는데...보고 있으니..  두별  모두반짝 반짝  빛을  ...  
20170512,9,관람객사람마다 ㅈ눈물의 포인트가 다를지니..  
20170512,8,관람객책으로보는감동이더크긴해요 그래도 영상이좋아요 잼있어요  
20170512,7,관람객원작 소설의 감동을 다 살리기엔 부족한듯...  
20170512,10, 왜 나에게 이런일이 일어나는지 오래된 질문에 대답해준 영화....  
20170511,10,관람객저는 이영화를 두번 보았어요..^^엄마랑 동생 보여주고 싶어서 같이 갈 정도로 진한 감동과 힐링을 주는 영화입니다..누구나 마음에 가지고 있는 상처가 치유되는 영화로 추천합니다..^^  
20170511,9,관람객두고두고 돌려보고싶은  
20170511,10,관람객하나님의 인자하심 사랑하심을 누구나 느끼게끔 쉽고 아름답게 표현해준 영화입니다 다시 한 번 더 보고싶은 영화네요  
20170511,8,관람객설명이 좀 적었으면!! 그래도 가족관계로 풀 수 있는 행복한 세상이니 다행이다 싶고 어려운 서사 아름답게 꾸린 소설가의 힘 볼 수 있습니다^^  
20170510,6,관람객유명한 원작으로 만든 기독교영화  
20170510,10,관람객영화 두번 봤어요기회되면 한번 더 보려구오  
20170510,10,감사합니다 좋은 영화를 만들어주셔서요오랜만에 가슴 뜨거운 영화Thank GodGod is good all the time!!  
20170510,10,관람객영화를 보고  용서를 한번더 생각하며 저를 돌아보는시간이었어요  
20170510,10,관람객너무.... 좋아요 또볼래요  
20170510,10,관람객너무 아름다워서 마음이 아픈 영화  
20170509,10,관람객내안의 모든 상처와 묵혀있던 아픔들이 풀어지는 기분..영화를 보고 난 후 하나님의 묵직한 사랑이 내안을 채우는 느낌이다. 모든 사람들이 귀하게 보인다.진심으로 감사합니다!  
20170509,9,빨리 내려간게 흠이라면 흠이네요 ㅠㅠ  
20170509,9,관람객따스한 힐링영화예요. 중간중간 진리의 대사들을 만날 수 있어서 좋았답니다:)  
20170509,10,관람객Goodghjklop  
20170509,10,관람객마음에 큰 울림이 있는 감동적인 영화네요^^강추~!!♡  
20170509,10,"우리와 늘 동행하시는, 우리의 아픔을 누구보다 이해하시고 사실 우리보다 더 아파하시는 하나님을 느낄 수 있었던 시간이었습니다. 무신론자이신 부모님과 함께 봤지만 그런 부모님께도 영화를 통해 하나님께서는 잔잔히 다가오셨습니다. 기도해주세요. 추천합니다!  "
20170509,10,관람객인생영화 체인지! 이 영화로 나를 향한 주님에 계획에 대한 감사도 느끼게 되었다...! :)  
20170509,10,너무 좋은 영화예요강추합니다~^^♥  
20170509,10,관람객많은감동이있는쵝오의 영화  
20170509,10,관람객이런영화 자주 개봉했으면 합니다  
20170509,10,"영화를 보는 중에도, 보고나온 후에도..먹먹한 사랑이 남습니다..최고의 영화.,!  "
20170509,8,관람객하나님을 인간으로 만났네요.잔잔한 감동과 용서 못할ㅈ사람도 하나님이 사랑하시는 자녀임을 다시 생각하게 되었네요  
20170509,9,관람객눈이 기분 좋았던 영화!  
20170509,10,관람객그리스도인이라면 강추가 아니라 절대관람 입니다. 와 ~~~ 그 동안 제가 생각하고 막혀있던 의문이 정말 많이 해소 되어 좋았습니다.  
20170509,10,관람객크리스천들이 꼭 봐야할 영화성부 성자 성령 하나님이 친근하게 다가왔던 영화 영화를 한 편 보고 나왔는데 예배를 드리고 나온 것 같은 너무 좋은 영화네요~  
20170509,9,관람객영상미 최고였습니다 강추  
20170509,10,관람객많은 생각을 하게 해주는 영화다  
20170509,10,"관람객잔잔한영화이지만, 하나님이힘들때 도와주신다는 까닭을 알수있는,상당히 종교적으로 교훈을 주는 영화이네요  "
20170509,10,관람객하나님에 대해 오해하고 있는 사람에게 그 분이 어떤 분이신지 친절하게 보여주는 영화. 하나님의 속성과 마음을 사람으로서 조금이나마 이해할 수 있었던 영화. 크리스찬 뿐만 아니라 넌크리스찬에게도 강추합니다!!  
20170509,9,"관람객군더더기가 없고 관객으로 하여금 자신의 상처 속으로 몰입시키는힘이 있네요, 근래 보기 어려운 작품을 보게되서 기뻤답니다책을 읽은 사람이라 더 그랬던게 아니라요~  "
20170509,10,관람객적극 추천합니다. 비기독교인에게도 좋은 것 같아요. 삶의 고통에 의문이 있는 모두에게 ...  
20170509,10,"관람객맥의 핵심적인 고통이 치유되어 가는 과정이 정말 감동이었습니다.. 파파의 사랑과 선함, 늘 함께 하심이 느껴져서 많이 울었네요. 삶에서 내가 다 이해할 수 없는 일들로 인해 힘들어하고 있는 분들이 있다면, 이 영화를 추천합니다.  "
20170509,10,관람객완전 잼있었음. 하나님의 하시는 일에 대해서도 생각해볼수 있었고..  
20170509,10,관람객피할 수 없는 인생의 고통과 하나님에 대한 원망으로 똘똘 뭉친 뼈속깊은 오해를 너무나 잘 풀어주다니. 참 잘 표현했고 참 흐느끼게 한 영화.  
20170508,8,조금 난해한 부분도 잇지만  볼만한 영화  
20170508,10,관람객너무 감동적인 인생영화예요!!  
20170508,10,"또 보고 싶고, 여운이 남는 영화. 영상도 너무 아름답고 힐링이 됩니다. 강추!  "
20170508,10,관람객아주잘봤어요 감동적인영화  
20170508,10,관람객책이랑 똑같아서 좋았어요  
20170508,10,관람객삶이 신에 대한 인식과 연결됨을 엿본 영화!  
20170508,10,관람객감동이 넘치는 영화. 꼭 추천합니다  
20170508,10,"관람객남을 용서하고, 치유와 용서를 통해 정작 자신이 구원을 받음 자신이 심판자로 있으면, 나의 죄를 위해 자기 아들을 죽이신 아버지의 마음을 알고, 그 은혜와 용서로 이땅에 하나님의 마라가 이루워지기를 소망하며 그리스도인으로 살기원합다.  "
20170508,10,관람객감사합니다 주님 10자  
20170508,10,정말 좋은영화. 여운이 많이남고 인생에 대해 생각해보게됨  
20170508,8,관람객책이 어떻게 표현될지 많이 궁금했었는데 나름 만족했고 배우들의 연기가 인상적이었습니다  
20170508,8,"관람객매우 종교적인 영화지만, 그럼에도 사랑과 시련의 아픔을 극복하는 주인공의 심리적 변화가 긍정적인 영화!크리스천이 아니더라도 보는걸 추천함!  "
20170508,10,관람객감동적인 영화입니다.  
20170507,10,많이 울었네요.. 영화보는 동안 주인공과 함께 울고 분노하고 치유받은 느낌입니다.  
20170507,10,관람객좋은영화입니다. 꼭 보세요.  
20170507,10,관람객전체적으로 감동적으로 보았습니다. 맥의 차마 표현하지 못하는 절제된 슬픔이 느껴지기도 하고..선과 악에 대한 풀이도 지혜롭게 잘 되었어요~너무 재미있고 감동적이었어요! 오두막 굿굿굿!!!  
20170507,10,관람객정말 크리스챤으로서 나 자신을 돌아볼수 있는 좋은 경험이었고  은혜롭게 봤습니다!!  
20170507,9,관람객평소 궁금했던 질문들에 대한 내용이 있어서 좋았고 제 삶에 비추어보기 좋았던 스토리였어요  
20170507,10,관람객하나님을 알아감에 있어 치유를 느꼈다  
20170507,10,관람객하나님의 사랑을 다시 확인하는 좋은 시간이었습니다.  
20170507,10,관람객너무 감동적이고 눈물샘 자극하는 영화!종교적이지만 이걸 빼고도 위로가 있는 영화!  
20170507,10,내 인생 최고의 영화~!!  
20170507,10,관람객좋은 피정 다녀온 느낌.  
20170507,10,"기대 없이 보게된 영화, 기독교 영화로 분류 되어 개봉이 많은곳에서 되지 않아 아쉽다. 예상치 않게 찾아오는 고난과 사건,사고들로 방황하는 기독교인들에게 최대한 이해를 도와주려 만들어준 영화같다. 당사자만이 아픔을 알겠지만 많은 이들이 보고 위로가되길  "
20170507,10,관람객하나님은 사랑이십니다..^^  
20170507,9,관람객워낙 책으로 인산깊게 읽어서... 인간의 한계와 제가 이미 갖고 있던 질문들이 가득 들어있는 영화입니다. 책만큼의 깊이가 안되는건 아쉬운데 재밌게 봤습니다  
20170507,9,"관람객종교를 넘어, 사랑 용서 등 삶의 기본적인 질문들에 최고의 영성으로 답하는 영화. 보는내내 감동이었습니다  "
20170507,9,관람객가족다같이 보러갔어요 추천합니다:)  
20170507,10,관람객너무나 큰 마음의 울림을 주었습니다 딸과 함께 볼 수 있어서 넘 좋았습니다  
20170506,10,관람객하나님 의 사랑과 성부 성자 성령의존재를 알수있는 영화인글  느꼈습니다  
20170506,8,관람객보고싶던영화여서 예매했습니다.아쉬운 점도 있지만 단연 힐링이 되는 영화네요. 편리하게 네이버페이로 이용해서 어려움없이 예매부터 관람까지 즐겁게 봤습니다~  
20170506,10,관람객사람의 감정은 참 오묘하고 알수없는것처럼 언젠가는 미워하는 대상들을 용서하는 날이 오도록 내자신이 먼저 변화해야한다는 것을 깨달을수있었습니다.  
20170506,10,관람객파파 보고시퍼요미시는 특별한아이다  
20170506,9,"관람객엉엉 감동이에요 ㅠ 책의 내용을 압축하느라 다 담지는 못했지만 그래도 주옥같은 말들, 장면들 덕분에 감동이었답니다 !! 추천해요~~  "
20170506,10,관람객너무 감동적인 영화이었어요! 한번 더 보고싶어요  
20170506,9,관람객전개가 조금 루즈하다는 느낌이 들긴 했는데 감동적이었고 소장하고 싶어요.  
20170506,10,관람객책 이상의 감동! 꼭 보세요~~  
20170506,1,관람객가족을 치유하는 영화라는데 영화 보고 와서 교회를 안 좋아하는 큰애와 집사람의 언성이 높았다. 우리 가족에게는 가족 불화를 야기하는 영화였다. 기독교에 푹 빠져 있지 않은 분들이 보기에는 3류 교육영화다. 재미없는 것은 기본.  교훈도 없고.  
20170506,7,관람객언제나 떠나지 않는 하나님을 느낄 수 있는 좋은 영화였어요  
20170506,10,관람객관계 속에 사랑이 펼쳐지는.많이 사랑하고 용서하기 빠른 삶.맥킨지의 드라마틱한 삶!강추입니다  
20170506,9,관람객너무 감동적인 영화입니다. 상영관이 많지 않아 멀리까지 가서 찾아 본 영화인데잘 한것 같아요~~  
20170506,10,관람객좋았습니다좋았습니다  
20170506,10,관람객책에서 본 내용 그대로 화면에서 잘 표현되어서 너무 좋았어요.  
20170506,10,관람객유독 좋아한다 그리고 많이들 그사랑을 알길 원한다  
20170506,10,관람객100점 아름다운 영화이다 필히 꼭보아야할 의미가득한 영화이다  
20170505,10,관람객원작을 너무 감동적이고 은혜롭게 읽었는데 그걸 최대한 살려낸 영화였습니다! 영화를 통해 사랑과 위로의 하나님을 경험하시길 축복합니다!!!  
20170505,10,상처입은 영혼들에게 회복을 주는 감동적인 영화에요  
20170505,10,관람객너무 좋았습니다. 생각이 다시 정리됐어요.  
20170505,10,관람객끝난 다음에도 여운이 가시지 않는 영화입니다. 또 볼거예요  
20170505,10,관람객정말로  감동감동 크리스찬이아니더라도꼭보세요 손수건필히지참  
20170505,10,관람객꼭 봐야할 영화에요~~~ 상영관이 많지 않아서 아쉬웠응데 서울극장에서 상영해서 잘보고오네요|~~><  
20170505,10,관람객저희 누나 한분은 자신의 이야기 같다며 정말 다시 주님을 느끼게 해준 영화입니다  
20170505,10,"관람객원작에 충실한 매우 훌륭한 영화다. 특히.성경의 하나님을 가장 잘 표현한 문학적, 영화적 상상력이 뛰어나다.  "
20170505,10,관람객어떻게 이런 스토리를 쓸수 있는지 ^^ 감동이다  
20170505,10,관람객책을 읽어야겠어요 정말 다같이 눈시울을 붉혔습니다 또보고싶네요 대사 하나하나 저에게 하시는 말씀같았어요  
20170505,10,관람객성경의 이해안되는 부분을 잘 표현한 영화인것 같아요.!!  
20170505,8,관람객소설보다 감동은 덜하네요  
20170505,10,관람객소장해서 두고두고 꺼내보고 싶은 영화:)책의 감동을 뛰어넘는 영화네요  
20170505,10,관람객너무나도 감동적이고 아름다운 영화네요  
20170505,9,관람객눈물 없인 볼 수 없네요 성부성자성령님을 가까이서 뵌 듯 친근하고 멋진 영화예요^^크리스챤이라면 추천합니다  
20170505,10,관람객하나님을 믿지만 고통의 문제를 해결할 수 없는 분들께 추천합니다.!  
20170505,10,감동과 영상미가 잔잔한 작품  
20170504,10,관람객최고의영화였습니다엄마 아빠랑 보러갔는데..두분다 훌쩍 감동만있는게아니라 내용도 좋고 교훈도있고 힐링도되고 몰입감도 좋았습니다강추강추 초강추  
20170504,10,관람객엄마랑 보러갔는데 너무 좋았어요 다시한번 보고싶네요  
20170504,10,관람객심오하게 생각하게하는 부분이 많았고 부모의 감정에 무청 몰입할수 있었습니다 기회가된다면 소장하고 싶네요  
20170504,9,관람객종교의 힘을 빌어 절망속에서 평화를 찾고 분노 속에서 용서를 발견하는 지혜를 알려주는 소중한 영화입니다. 소중한 사람들을 생각하면서 보시길  
20170504,10,관람객좋습니다 좋아요ㅁㅁㅁㅁ  
20170504,10,관람객기독교인뿐맘 아니라 비기독교인들에게도 더 가깝게 다가갈 수 있는 하나님의  사랑과 섭리에 대해 잘 그려낸 영화입니다. 감동깊고 잔잔한 영화! 강력히 추천합니다^^  
20170504,10,관람객너무 좋은 영화였어요!!  
20170504,8,관람객하나님께서 우리와 늘 함께 하심을 다시 한번 일깨워 주는영화입니다  
20170504,9,관람객Good~~더무 잘 봤어요  
20170504,10,강추^^ 영화를 보면서 눈물을 이렇게 많이 흘린적이 있었나 싶어요*감동 감동 감동~  
20170504,10,"강요하지 않으시고 사랑으로 오라 하시는 하나님을 경험할 수 있는 시간이었습니다.삼위일체 하나님이셨기에 하나님 안에 이미 사랑의 관계(파파, 사라유, 예수의 모습)가 존재했고, 그렇기에 우리에게 사랑의 관계를 요청하실 수 있구나 생각이 들었습니다.  "
20170504,10,관람객심오하고 깊은 영화. 만들어주셔서 감사합니다.  
20170504,9,관람객아름답고 생각이 많아지는 영화였습니다~!!  
20170504,1,원작을 살리지 못하는  퀄리티. 영상으로 보여준 천국은 절대 상상을 이길 수가 없음. 비기독교인은  이 영화에서 담아내는 내용으로 기독교의 가치를 공감하기 어렵습니다. 책을 추천합니다.  
20170504,10,관람객잔잔한 감동이 있는 영화.  
20170504,8,관람객영화 자체는 너무 좋앗습니다 책으로 읽엇을때 느꼇던 감동이 그대로 전해져왔구요 영상도 너무 아름다웠네요. 다만 영화관에서 지켜야할 기본적인 배려조차 모르는 어린 학생들은 집에서 다운받아보길 권장합니다 + 고령 대가야시네마 팝콘 맛잇엇어요  
20170504,10,관람객참 따뜻하고 진정성있는 영화 잘 봤습니다~ 주님의 우리들을 향한 마음이 어떠하신지 알 수 있어서 감동이었습니다~ 좋은 영화 감사드립니다~^^  
20170504,10,관람객더 많은 곳에서 개봉했으면~~~  
20170503,10,관람객다시 보며 대사 하나하나를 묵상하고 싶다.  
20170503,10,관람객최근 본 영화중 가장 인상깊고 울림을 줬던 영화  
20170503,10,관람객기독교인이라면 꼭 봐야하는 영화임에 틀림없습니다!!  
20170503,9,관람객심오하긴하지만 신의 자비와 사랑에대해 임팩트있게 다룬 것 같다!  책과 함께라면 더욱 좋을 듯!  
20170503,10,관람객그동안 내가 얼마나 하나님에 대해 오해하고 살았는 알게되었다!  
20170503,10,관람객진짜 유익한 영화였습니다  
20170503,10,관람객정말 감동적인  영화 였습니다.마음이 치유되는 느낌이 들어서 좋았어요~^^  
20170503,9,관람객책에 묘사한 인물들이나 스토리를 시간 상 전부담아내지 못한 감이 있지만 충분히 볼 가치가 있었던영화라 생각해요~  
20170503,10,"관람객정말..영화를 보면서 다시 한 번 ..소설을 읽어봐야겠구나 생각이들었다. 정말 기독교인이든 비기독교인이든, 신은 인간을 사랑하고 있다는 것을 알려주는 영화. 원작을 잘 살려낸 것 같아서 굉장히 좋다.  "
20170503,10,관람객감동 감동 감동 감동 이상의 단어는 없네요  
20170503,10,관람객신에 대해 생각해 보는  좋은 시간!!  
20170503,10,관람객정말 감동적인 영화입니다  
20170503,10,관람객마음에 어려움이 있으신 분들에게 위로와 힐링이 되는 영화입니다. 무거운 질문을 잔잔하게 잘 풀어냈습니다  
20170503,10,관람객오두막이라는 영화를 통해서 삼위일체 하나님의 사랑을 느끼고  새힘을 얻게 되었다 ^^  
20170503,10,관람객치유의 과정이 감동스럽게 펼쳐지는 좋은 영화입니다.  
20170503,10,관람객정말 이 시대에 필요한 영화이면서 인생의 길잡이가 되는 영화네요 많이 많이 가져서 보시고 힘내세요 그분만이 우리의 전부이십니다 서로 용서하고 사랑하며 살아요 화이팅^*^  
20170503,9,"이해하지 못할 상처, 아픔에 있는 사람들에게.. 그 분이 전해주시는  치유, 위로, 용기, 회복의 메세지^^  "
20170503,8,관람객고통에 대한 진지한 고민과 신의 사랑을 아름답게 풀어낸 영화.  
20170503,10,관람객삼위일체를 사람의 모습으로형상화한 기발한 영화  
20170503,10,정말 그동안 힘들었던 제안의 고민들과 아픔들이 치유되는 기분이었습니다. 표현할 수 없을만큼 잔잔하지만 강한 영화입니다  
20170502,10,마음의 치유가 필요한 분들에게 추천해요.왜 용서해야 하는가에 대해서 생각해보게 되네요.  
20170502,9,"관람객뻔한 내용의 답정너이지만, 착한 사람이라면 한 번 쯤 고민해보았을 생각들을 같이 고민해주는 것 만으로도 살짝 위안을 얻네요  "
20170502,10,관람객중간중간 울컥할 요소들이 많네요. 많은 내용을 짧은 시간에 임팩트 있게 전달하기 위해 노력한 것이 느껴지네요. 대사 하나하나가 참 귀했습니다 :)  
20170502,9,관람객영상미도 좋았고 배우들의 연기도 좋았어요~조용조용히 흘러가는 내용 속에 가족에 대해 생각할 수 있는 가슴 뭉클한 내용들이 있어서 보는 내내 먹먹하게 관람하게 되었습니다.역시 믿고 보는 감독의 작품이 아니었나 싶어요상영관이 적은 것이 아쉽습니다ㅠ  
20170502,10,관람객모든 기독교인들에게 강추합니다  
20170502,10,관람객조금은 명확하지 않은 결말이지만가족과 사랑 용서에 대해서 다시 한번 생각하게 됐어요  
20170502,9,"때때로 우리 삶에서 하나님의 선하심을 의심하게 되는 순간들이 있지만 그 당시에는 이해가 가지 않더라도 시간이 지나 되돌아볼 때, 삶에서 왜 그런 퍼즐조각이 필요했는지 알게될 때가 있는 것 같습니다.  "
20170502,7,극장 관람객들 대부분 기독교인들ㅋ 대화내용이 많아.. 다소 졸리다는거...내용은 좋아요  
20170502,9,관람객하나님의 성품을 잘 녹여낸 영화. 상처에 대한 관점을 새롭게 할 수 있었던 영화.  
20170502,10,관람객나를 앞으로 나아가지 못하게 하는 오두막과 같은 장소는 어디인지 돌아보게 되네요. 이 영화를 통해 원망과 상처로 가득한 인생에 고통보다 더 크신 그분과 함께 오두막을 나와 참 기쁨을 누리는 분들이 많았으면 좋겠어요  
20170502,10,관람객만족스럽다 원작을곱씹게해주었다  
20170502,9,관람객넘 감동적이고한번더 보고 싶은 영화입니다  
20170502,8,관람객인생에서 큰것을 잃어본 사람들에게 추천합니다.  
20170502,10,관람객원작의 느낌을 잘 살린 영화..  
20170502,10,관람객하나님에 대해 오해하고 있는 부분들을 너무나도 잘 이해시켜주는 영화! 굿입니다!!  
20170502,10,"영화 시간대가 없어서 기다려서 봤어요~ 원작 소설을 잘 살리고, 색감이 예뻐서 큰 화면이 좋았네요. 상영관이 좀 늘어났으면 해요!  "
20170502,10,좋은영화이고 추천하고 싶은 메세지가있어 좋아요  
20170502,10,아~아름다운 하나님!! 감당하기 버거운 고통앞에 어떻게 살아야할지 깨닫게 하는 영화! 원작소설도 대박이라던데!! 영화도 대박!! 소장했다가 힘들때마다 꺼내보고싶은영화!!  
20170502,10,"관람객좋은 영화에요, 살면서 여러번 생각나서 다시 볼 것 같아요~!  "
20170502,2,극장에서 오전에 수면을 취하긴 처음이다.무신론자에겐 최악의 영화.  
20170502,10,따뜻하게 위로받고 용서를 곱씹어보게 되는 영화. 스크린이 많이 없어서 아쉬웠어요!!  
20170502,10,더 많은 사람들이 봐야할 영화인데 스크린이 없어서 아쉬울 따름  
20170502,10,상영관이 더 있었음 좋았을텐데 많이 아쉽네요  
20170502,10,관람객지극히 종교적이면서 따듯한영화  
20170502,10,관람객책도 재밌게 봤었는데 영화도 좋았습니다위로와 치유의 시간이었어요  
20170502,10,관람객인생영화라 할만큼 명작입니다 하나님의 크신 사랑을 느낄수 있는 영화네요 마음이 어렵고 힘들어 어디로 가야할지 모르시는 분들이라면 이영화를 꼭 보세요  
20170502,9,관람객누구나가 있을 마음의 상처들이 이 영화를 통해 하나하나 치유되길 기대하며 기도한다. 우리를 너무나 사랑하시는 파파를 더~ 깊이 만날 수있어 감사한 영화였다.  
20170501,9,슬프면서도 평안해지는 영화였습니다.  
20170501,8,관람객마음이 따뜻했습니다.  
20170501,9,정말 강추! 책이 더 좋지만 함축적으로  표현이 잘 되어 있고 영상으로 보니깐 더욱 내용이 쉽게 이해가 되어 좋네요~^^  
