0,1,2
20190122,10,아침부터 ocn으로 뒷부분만 봤는데 펑펑 울었다.눈물이 안멈춘다.울고 싶을때 꼭보길  
20190122,10,자기 자신에게 이야기하는 속죄 아닌 속죄  
20190121,3,너무 유치하고 지루하다.  
20190113,8,슬프고도 잔혹한 진실이야기를 한편의 동화로 풀어낸 영화  
20190109,8,"내평점잔혹한 동화를 통해 전해지는 교훈들... 동화와 영상, 애니메이션기법이 잘 조합된 영화  "
20190106,10,감동이네요 사랑히는 사람을 떠나보내야 ....  
20190106,1,분명히 좋은의미의 영화다. 그러나 이런 영화를위해 2시간을 투자할만한 가치는없다고본다. 평점이 너무 높아 조절차원에서 1점준다.  
20190106,1,CGVOO 새끼들이 이것만 틀어서 1점준다~  
20190106,10,모자의 어릴 적 상실감을 느낄 수는 없지만... 외면하고 있는 나 자신만의 진실을 꺼내 보기가 힘든 걸...  
20190105,10,아빠는 딸에게 있어 항상 든든한 버팀목이라는 걸 다시 알려준 영화.  
20190101,1,동화같은 이야기가 현실을 말하는게 싫은 나는 이제 위로를 이런 영화에서 받고 싶지않아서 인것같다. 영화따위 에서  아니라도 염증이 날만큼 현실은 어떤지 알고있으니까.  그냥  애가 징징되는것도 싫고 나와 상관없는 사람이 죽는것에 크게 슬프지않다.  
20181228,10,"이런게 성장이라면 나는 받아드리고 싶지않다 성장하지 않은채 살아가고 싶다 그러나 현실에선 선택의 여지는 없다 어린아이에게 현실의 아픔은 잔혹할 만큼 무방비하게 들이닥친다 아픔에 회쳐지면서 나약해진 자신을 어머니와의 유대, 몬스터로써 스스로를 방어한다  "
20181228,10,동심의 멱살을 잡고 진실을 말하라며 몰아붙인다. 어른이 되어도 아이같은 우리. 우는 것 말고 달리 할 수 있는게 없다.  
20181228,9,마지막 장면-엄마가 남긴 그림책 마지막에 나무괴물 장면은 음.. 참다가 울음 터졌다.  
20181228,10,시린 겨울날 만난 따뜻한 코코아같은 이야기.  
20181216,10,진짜 너무 감동적이고 교훈을 주는 영화  
20181125,10,남 이야기 같지가 않구나..ㅠㅠ  
20181108,8,왜 이제야 봤을까 싶은 영화  
20181107,8,어린이들을 위한 세편의 잔혹한 동화  
20181105,9,힐링제대로되는영화...  
20181105,9,가족을 먼저 보냈다는 이유로 아무리 거부해도 느낄 수밖에 없는 죄책감에 빠진 이들에게 마음의 위안을 주는 영화입니다. 상실의 아픔이 무서워 거부하고 숨겼던 저의 태도를 되돌아보게 만들었어요. 최고는 아니라도 따뜻하고 아름다운 영화임이 분명합니다.  
20181101,10,개꿀잼입니다바내베니미밈  
20181101,10,이렇게 원없이 울어본 영화는 8월의 크리스마스 이후에 처음 이다  
20181101,9,이런 영화가 그냥 묻혔었다니..이제라도 봐서 다행이다...가슴이 저미는구나...  
20181101,10,굿 럭 10101010  
20181030,10,마지막으로 엄마의 손을 꼭 잡아주었을 때 비로소 엄마를 떠나 보낼수있단다. ㅜㅜㅜㅜ  
20181030,10,굿굿굿!!! 그냥보세요  
20181030,10,아이 엠 그루트!!!!  
20181030,8,진실을 말할수 있는 용기..  
20181030,9,두렵다. 십여년간 키워주신 외할머니가 돌아가시고 아버지도 돌아가시고. 어머니와 살고있는데 어머니가 아프실까봐 너무 겁이났다. 항상 건강 하셨으면. 내가 아는 모든 사람. 좋은사람들  
20181030,10,울고 싶었는데...울게 해 준 영화...감사합니다ㅠㅠ  
20181030,1,평점이 높아서 억지로 보기는 했는데 글쎄... 각자 주관적인 판단이니깐... 평점이 이렇게 좋으면 분명 개봉했을때 입소문이 났을텐데... 관객동원수가 겨우 8만 조금 넘긴건 이 영화의 반증이 아닐까?  
20181030,9,간만에 좋은영화 만났네요  
20181030,10,나도 손을 놓았던 것같다  
20181030,10,마음아프고 잔인하며 따뜻한영화다..부모님이생각나는영화다..가슴먹먹해지며술한잔생각나는 명작이다.늦게본것이후회되며 또한번보고싶은영화다.  
20181028,10,ㅎ념ㄷ너ㅗㅁ다가ㅓㅈ모ㅓㄴ다  
20181019,8,"사람이 살면서 겪을 수 밖에 없는 심리적 죽음, 신체적 죽음에 대해 생각해 보게 하는 영화. 나무괴물이 네 진짜 이야기를 하라고 다그칠 때 너무 불편했고, 코너가 죽어가는 엄마 손을 잡을 때 죽음이 성큼 다가오는 듯 두려웠다.  "
20181013,8,<반지의 제왕>보다 현실적이고 <판의 미로>보다 따뜻한 판타지  
20181013,10,이토록 마음을 울리는 영화는 처음  
20181012,10,하늘에 있는 엄마가 힘들어하는 절 위해 알게해준영화같았습니다..  
20181009,8,사실은 입에서 나오지만 진실은 가슴에서 나온다.  
20181007,9,상실을 지나 마음의 어른이 되면 꼭 한번 더 찾아봐야지.  
20181007,8,우리는 진실을 알면서도 그것을 마주치기 싫어서 거짓으로 도피하려고 한다. 하지만 언젠가는 진실과 마주쳐야 한다는 것  
20181007,8,내 이야기같네 엄마와 마지막 인사를 나눌 수 있었던 코너가 부럽다 이 영화가 좋았던 건 보통의 동화가 아니라 사람이 인생을 살며 아픔을 겪을 때 우리의 태도에 대해 냉정하지만 따뜻한 시선에서 조언을 해줬기 때문이다  
20181007,10,꼭 보셨으면 좋겠어요 ㅜㅜ  
20181007,9,아름다운 이별은 없다 이별은 언제나 낯설고 힘들다 ...  
20181007,10,어른을 위한 잔혹한 동화에요 ㅠㅠ 영화관에서 이런영화가 많아져야 할텐데..  
20181007,2,우울하게생겨먹은 폭력성을띈 정신적으로 문제가있는 아이를 그린 영화다. 부모가 아프고 이혼했다고 저렇게 비상식적인 행동을 한다는건 아닌거같다.  
20181004,9,아이의 슬픔이 느껴집니다..얼마나 벗어던지고 싶었을까요..  
20181003,10,인생영화 하나 추가되는구나...  
20180927,8,우리는 모두 코너 오말리이다. 너 자신의 내면을 솔직히 표현해라너의 생각은 중요하지않다 행동이 중요하다  
20180926,9,초반에 다소 유치한 설정때문에 설정을 받아들이지 못하면 후반부의 머리가 멍해지는 감동을 받을수가 없는게 흠. 띵작인정  
20180917,10,명화.. 명작입니다.  
20180915,8,슬픈 판타지 성장 드라마. 볼만했다.  
20180912,10,인생영화 타이타닉에서 몬스터 콜로 바꼈습니다.  
20180907,10,따뜻하다... 따뜻했다... 기억에 오랫동안 남을 갓 같다...  
20180907,10,"이 영화에 적은 점수를 준 사람의 취향을 존중한다. 재미 없을 수도 있다. 하지만, 그대들의 사회성과 인성을 다시 생각해보길 바랍니다. 남들과 같을 필요는 없다. 하지만, 슬픈것을 보고 슬프지 않고 기쁜 것을 보고 기쁘지 않다면 분명 감정에 문제가..  "
20180907,6,몬스터 내한테도 콜 좀...;;;  
20180907,10,삶이란 흘러가는 것~~~~  
20180907,5,"원작을 따왔다하나, 실상 영화 스파이더맨123을 압축한 아동청소년 뮤비  "
20180907,10,어머니의 죽음을 부정하고 싶은 어린이의 악몽...재밌게 잘 보았다..  
20180907,10,"악마의 목구멍같은 절벽 끝에서 괴물에게 치받히며 겨우겨우 뱉은 ""빨리 끝났으면 좋겠다""는 고백이 얼마나 고통스러운지...  잔혹하지만 아름다운 영화다. 영화 자체로도 너무나 완벽해서 원작이 아무리 좋다고한들 실망할 것 같지 않다.  "
20180907,10,상처없이 보낸다는건 힘든 일이다 소년도 나도 말이다  
20180907,10,아이의 연기에 어느새 빠져들어 몰입하고 있는 나를 볼 수 있었다. 연출에 놀라고 스토리에 놀라고.많은 생각을 하게 하는..여운이 오래 남는 웰메이드 작품.  
20180907,10,사랑하는 사람을 병으로 잃은 경험이 있는 사람은 크게 공감할겁니다. 저는 다 큰 어른이지만 13살 아이가 꼭 저를 보는 듯해서 너무 놀랐어요. 꼭 제 맘을 들켜버린거 같은...이 영화를 통해 많이 위로받고 갑니다^^  감사합니다  
20180907,10,눈물이 펑펑.. 주륵주륵... ㅠㅠ... 작품성 최고!! 감동 최고!!  
20180907,10,소년이 안고있던  마음의 무게가 얼마나 무겁고 아팠을까요 생긴건 괴물같았지만 소년에게 위로와 용기를 준 몬스터 ! 누군가도 희망하겠죠 12:07분이 되면 찾아와 주는 이런 멋진친구있었슴하고요  
20180907,10,오랜만에 펑펑울면서 본 영화...  
20180907,10,부모님 살아계실때 잘하자 제발  
20180907,10,무슨아이가 저렇게 슬프게  우는지 ㅠㅠ  나계속 너딱매 소리죽여 울고있다. 귀여운녀석..  
20180907,10,기태와우... 할말을 잃어따  
20180907,10,'생각하는 것은 중요하지 않아. 무엇을 하느냐가 중요하지' 다 끝났으면 좋겠다는 속마음을 지닌 소년에게 몬스터가 건낸 말이었다. 마지막 장면을 보자 몬스터는 엄마가 아들에게 전한 위로의 존재가 아닐까 생각했다. 자신이 선물 받았던 것처럼 말이다.  
20180907,10,포스터만 보고 판타지일줄 알고 봤으나살면서 이렇게 눈물흘리면서 본영화가 없어요...엄마가 암걸려서 항암치료 받았던 때가 이입되면서 나오고나서도 한참 눈물 흘렸던 인생영화입니다참고로 어머니는 수술잘되고 수술후15년지난지금 건강히 계셔요 ㅎㅎㅎ  
20180907,10,오랜만에 좋은영화봤네요.  
20180907,10,그냥 울었어요.하염없이.  
20180907,8,눈물바람됬어요.. 루이스 연기짱  
20180907,10,초반엔 유치할거라고 생각했는데 너무나도 감동적이고 고마운 영화네요ㅠㅠ펑펑울었습니다  
20180907,6,감상적이고 과몰입하는 나지만  슬프진 않았고 철학적인 부분은 나쁘지 않음. 뻔하지만 영화에 나온 대사들로 하여금 상기하고 다시금  생각해 볼 수 있다는 점이 좋다.  
20180907,8,인상깊음.. SBS에 고마울 따름  
20180907,10,최대 10점밖에 줄 수 없어서 아쉬운 영화.점수로 매길 수 없는 역대급 명작입니다.펑펑 울면서 봤습니다.내 인생 최고의 영화  
20180907,10,영화보고 눈물 잘 안나는 편인데.. 이영화는 눈물이 났네요..마음을 울리는 영화같아요.치유받았어요. 정말 제 인생 영화입니다  
20180907,10,어린아이의 연기가 너무 좋았다 소년의 눈빛이 너무 슬펐고 감동적이였다 잘크기를  
20180907,9,말하고 싶지 안은 아픈 진실을 받아들여가는 한 소년의  순수의 승화  
20180907,10,강력추천합니다 감동적이네요  
20180907,10,보는 내내 울상 지으면서 봤던 영화ㅠㅠ  
20180907,10,티비에서 해주네 띵작 그치만 난 안볼거야눈물 흘리기 싫엉  
20180906,10,나에게도 이처럼 따뜻한 몬스터가 찾아와 주었으면.  
20180906,8,남자애가 데인드한이랑 닮아보이는데 더 잘생겼네  
20180906,10,몬스터  목소리 너무 좋잖아...  
20180906,1,이거 평점이 8.56???? 진심 레알 이거 평점 8점 이상 준 사람들 진짜. 개.쓰.레.기 언플 어그로 쟁이다... 암 걸려야 할 새퀴들... 일부러 평점 최악 으로 준다~~ 객관적으로 이건 7점 정도가 딱임...재미 없습니다. 이거  
20180906,8,말하기 힘든 우리의 진짜 이야기를 잘 드러내고 보여준다. 억지로 포장하지 않고 보여주는 것이 처음엔  불편하고 이해가 안 되지만 결국 그것이 숨겨져 있던 상처를 아물게 하는 방법임을 알게 해 준다. 정신없는 현실 속에서 지친 우리를 위로해 주는 영화다  
20180906,10,난 이거 재밋게봣엇음 완전  
20180827,9,가슴아프고 울림을 주는 영화네요  
20180826,9,재밌게 잘봤습니다 :)  
20180822,10,높은 영상퀄리티 깔끔한 짜임새 다만 영화가 담고있는 의미에 대해서는 진부함이 없잖아 있지만 영상이 너무 아름다워 10점  
20180805,1,? 다 부셔버리라고 부추기는데  
20180805,4,"....,,,,....  "
20180805,10,제 최고영화에요.. 주인공의 이야기 뿐만아니라 나무가 들려주는 이야기들 모두 교훈이 있고 인상적이에요  
20180803,9,"우리 어머니도 유년시절이 있었을 텐데,  슬펐다 행복하지 못했음에...  "
20180726,10,"영상, 음악, 스토리 모든 것이 다 좋았습니다.  "
20180724,10,좀 감동이었어요!모두에게 추천 드립니다~  
20180723,10,모두 우리는 그렇게 성장한다  
20180721,10,잔잔하게 스며들었다.  
20180717,10,저는 중학교 2학년때 아버지가 돌아가셨습니다.그 때의 기억이 겹쳐서 펑펑 울었네요..  
20180714,10,제가아는 모든 사람에게 보라고 추천해주고픈 영화입니다.  중딩 아들 셤끝나고 에어컨에 치킨시켜서 먹었는데 치킨 다 못먹었어요 삼켜지지도 않지만 그만큼 좋은 영홥니다. 뜻하지않게 아들에게 좋은 영화보여준거 같아 더 좋았습니다 아들도 너무 좋았다고 하네요  
20180714,4,전개가 기어가다못해 멈춰버린 영화다. 그저 지루. 진짜 심한 말인가 싶겠지만 차라리 한국감성 영화 보는게 낫겠다. 시간이 아까운 정도를 넘어서서 되돌리고 싶다. 주인공이랑 비슷한 사람이면 남일같지 않아 감동받을 듯. 근데 난 아님  
20180713,10,명----작입니다. 꼭 보시길  
20180712,10,내가 말하지 못한 말을 대신해준거 같다..  
20180708,10,어릴 때는 단순하기만 했던 세상이지만 세상은 그렇게 간단하지만은 않다는 것을 깨닫는 순간 아이는 어른이 된다는 걸 보여주는 영화. 인간에 대한 통찰력이 돋보여서 좋았다.  
20180701,10,"살면서 기적같은 기회가 1번은 올거라고 믿지만,그렇지 않은 현실이다. 여러번의 희소식과 절망의 반복으로 지친 소년이 성장하는 영화  "
20180627,8,인간으로 살면서 느끼는 오묘한 감정들로 인한 혼란스러움 끝에 결국 나의 진실을 마주한 순간 우리는 한단계 발전한다.  
20180619,10,눈물이 많이 난다. 진짜 내 인생 영화  
20180619,10,ㅜㅜ눈물이 났다ㅜㅜ 초기그런데나중주룩흘려 혼났음  
20180603,10,마지막 장면에서 뭉클... 여운이 깊다  
20180603,10,죄책감과 불안을 직시하게 되는 소년.. 몸만 컸지 아직도 내면은 소년소녀인 채 험난한 인생을 살아가는 어른아이들을 위로해주는 아름다운 스토리. 내 인생 영화 목록에 추가. 각본가 패트릭 네스와 감독 감사합니다.  
20180603,10,아 눈물이 계속 나옴 진짜 펑펑울었음 마지막장면... 아 진짜 너무 슬프다ㅠㅠ 아아아 ㅠㅠㅠㅠ  
20180601,10,어린 주인공의 상처를 치유 하도록 도와준다기보다 성장할 수 있도록 도와주는데 저 역시도 제대로 저를 마주하고 있는지 생각을 해보게 되는 영화였습니다  
20180601,8,어른을 위한 동화같은 판의미로 느낌이 나서 좋았습니다.  
20180529,10,어릴때 부모님을 잃은분들은 크게 공감하고 봤을것이다. 나도 만11살에 엄마를 잃었다~ 어린시절을 잠시 생각하게 만들어준 영화~  
20180527,10,우연히 TV에서 무료길래 봤는데 영상미도 좋고 주옥같은 명대사들이 기억에 남는 영화! 인생에서 적어도 두 번은 봐도 지루하지 않은 영화였다 그리고 리암 니슨의 목소리가 귓가에 남았다  
20180526,6,무게감만 가득한 너무 뻔한 스토리였다. 신선함이 없었고 진부하고 지루했다.  다만 왕자이야기는 참 마음에 들었다. 인간은 극단적인 경우가 더 드물다. 때론 자애롭고 때론 잔인한것이 인간이다. 그것만큼은 마음에 들었다.  
20180525,10,"주인공과 똑같이 기댈곳하나없고 상처많고, 완만한 삶을 살지 못한, 성인이 된 나에게 주는 감동과 위로.. 영화를 보고 시간이 꽤 흘렀는데도 나에게 깊은 여운을 준다...  "
20180525,10,너무나 섬세한 영화이다...  
20180523,10,밖에서 찌질이로 고통받은 스트레스를 집에서 푸는 현실 속에서 인간의 성장기를 본다  
20180523,10,그렇구나. 삶이란 이해되지 않기에 힘든거구나. 우린 그저 복잡할뿐이다.  
20180521,6,영화가 너무 어려워요. ㅠ.ㅠ  
20180520,10,판의미로와 같은 느낌처럼 이영화또한 기적만을 바라기엔 현실이 잔혹하단걸 알려주며 또한 그러한 현실도 인정할줄 알아야한다는 보는 사람또한 성장하게 만드는 영화인것 같았다  
20180520,10,끝나고도 계속 눈물이난다 곱씹을 수록 아프다  
20180516,10,정말 대단하다는 말 밖에.. 이런 이야기를 상상하고 만들어 내는 사람들은 정말이지 대단하다고 밖엔..어떻게 말로 형언 할 수 없다는 말은 이럴때 써야 할 듯 하다.  
20180514,10,환타지가 그려낸 슬픔의 미학  
20180513,10,몸이 아픈사람만 치료받는줄 알았다. .. 마음도 치료가 필요하다는걸 외면하려하려다가 더 병이 들지도 모른다  
20180511,10,감동의 눈물이 납니다!!  
20180508,10,가장 따뜻한 사랑을 보여준 몬스터  
20180508,10,너의 진실이 뭐냐는 질문의 답에한대 맞은것 같은...왜 그 생각은 못했을까...눈물이 계속... ㅠ  
20180508,10,군대에서 봤는데 아무도 모르게 혼자 침대에서 울었습니다..  
20180506,10,이영화를 볼수있었음에 감사한다.  
20180506,10,최고에요...제 인생 영화가 될 것 같아요  
20180506,10,따뜻해요.... 나이가 들어도 우린  여전히  어린시절에 머물죠  
20180506,9,감동적인 영화네요. 아이들이 크면서 한번쯤 보고 느낄 수 있는 영화네요.  
20180505,10,성장통은 아프기 마련이네요. ㅠㅠ  
20180504,10,판타진줄 알았는데 아니네요 눈물폭발함...  
20180504,10,공허하고 상실감을 느낀다  
20180503,10,자신의 속마음을 이야기 할 수 있는... 참으면 병이되는...  
20180502,10,아이라고 하기엔 너무 컷고 어른이라기엔 너무 어린 사람들을 위한 영화같다  
20180501,10,"“나중에 혹시라도, 지금 너무 화가나서 아무말 안한것에 대해 너무 마음아파할 필요없어.. 엄만 네 마음 다 알아.. 정말 다 알아...”  "
20180430,10,어른들을 위한 심리 치료 영화는 아닐까 상처받았던 어린시절을 성인이 되고나서 치유 받는 영화에요  
20180428,7,"소년은 이미 진리를 깨닫고 있었다, 다만 그 깨닫음이 아무리 잔인할지라도 자신에게 인정할때 전진할 수 있다.  "
20180426,6,너무시간이  안가는 영화입니다  
20180423,6,몬스터의 의외의 쓰임. 신선하다  
20180416,8,너무 슬프고 마음 아픔. 엉터리 개연성일지라도 엔딩을 바꾸고 싶다. 슬프다 슬프다 슬프다  
20180415,10,너무 감동적이었음 판타지 같지만 무엇보다 현실감있다  
20180413,10,진짜 정말 마지막 방에 들어가서부터 눈물펑펑.. 왜그런지는 잘 모르겠지만 슬펐다  
20180412,10,가벼운 판타지 영화인 줄 알고 봤는데 인생 영화입니다. 깊은 의미를 가지고 있지만 전혀 안 지루한 어른 동화입니다.  
20180411,10,아름답고 마음을 울리는 힐링영화  
20180411,10,나는 왜 끝나고 나서 눈물이 나고 멈추질 않는걸까요. 내 삶이 영화와 다르지 않네요  
20180406,8,나무가 참 잘생김. 첨에 무서웠는데 볼수록 츤데레임. 분위기를 공포스럽게?잡은 듯 아닌 듯. 꿈꿀때 무서워하면 악몽이 되고 괜찮다고 생각하면 괜찮은 느낌? 암환자 외모 변화를 미화시키지않고 잘 나타내서 그 부분은 현실적이었음. 일부러 그렇게 한것같음  
20180406,10,남겨진 아이의 상실과 고통 어루만져주기 어머니라는 존재의 죽음으로 말이야  
20180406,3,1.예고편으로 낚음 2. 불쌍한 찐따가 징징거리는게 이 영화의 반임 3. 그냥 불쌍한 꼬마 이야기 보려면 보고 괴물 보려면 보지 마셈. 감동은 무슨 보다가 잤음.  
20180406,1,부모님을 그닥 사랑하지 않아서인지이 영화 와닿질 않았다  
20180405,10,잊고 있었는데 내가 아버지를 보낼때.그 마음을 어떻게 알았을까.너무 놀래 펑펑 울었습니다.이버지 정말 미안하고 보고싶네요  
20180405,7,상상의 몬스터는 엄마와  아들과 항상 함께 하고 있었다.  자신만의 몬스터는 꼭 한가지씩 있었다.  
20180402,10,왜 이렇게 눈물이 멈추지 않는지..어린 소년에게 감당 하기에 너무 큰 시련.  몬스터 를.소환하며 자신에 내면과 맞서 나가는 과정. 몬스타가 필요한 이들에게 꼭 퍌요한 영화  
20180331,9,나에게 상상은 도피가 아니다. 진실과 관계를 맺는 방식이다. -기예르모 델 토로  
20180325,5,피하지 마라 맞서 싸우라는 소리는 지겹게도 들었지만 그게 안 된다니까 ㅋㅋ  
20180325,10,너무 감동적이였고 눈물이 많이 나오게 된다.  
20180318,10,판타지오락영화인줄 보다 눈물콧물 쏟음.  
20180317,10,관람객한번쯤 기적을 바라는 마음..마음을 울리는 영화  
20180315,10,ㅠㅠㅠㅠ 영화 너무 슬프네요 ㅜㅠㅠ  
20180303,9,영원한 이별을 이렇게 판타지로 슬프고도 아름답게 표현할 수 있을까요. 중간에 애니메이션도 정말 그림체가 대단합니다.  
20180302,1,더럽게 재미없어. 찌질한 남자 놈과 OO한 남자 놈의 상상친구 스토리.  
20180301,8,정말 잘 만든 성장 영화.. 여담이지만 시고니 위버 정말 보살..  
20180228,8,지금 우리의시간을 천천돌아보게되다  
20180227,10,관람객하...정말 ㅠㅠ 잘봤습니당  
20180227,10,진짜 꼭 보세요.. 이미 결말과 내용을 알고 본건데에도 표현 자체도 너무 기발하고 내용도 마음을 울리네요..  
20180224,7,"다섯번째, 여섯번째, 일곱번째 나의 이야기를 하게 되길~  "
20180223,10,때로는 진실보다 거짓된 위로가 좋을 수 있다.  
20180218,10,어른을 위한 동화 ... 인간의 솔직한 심정을..  
20180218,10,아주 감동적이었어요 ㅠ ㅠ  
20180216,10,관람객그냥 저냥 한 판타지jQuery22409888754624407738_1518770903527  
20180215,10,헤어짐을 앞두고 마음 달랠 길이 없어 이 영화를 봤다. 몬스터가 건네는 말은 때때로 위로가 되고 또 상처가 되기도 한다. 결국 그런 생각까지 하는 내가 너무 끔찍하고 혹여 남들이 알게 될까 두려웠는데 다들 그럴 수 있구나. 결국은 위로가 되어준 영화.  
20180215,10,가슴이 먹먹합니다 추천해요  
20180213,10,결코 인정하고 싶지 않은 내면의 진실과 마주할때..우린 엄청난 용기가 필요하다  
20180209,9,무슨영화가 이렇게 예쁘냐  
20180208,9,후반부 너무 슬프고 여운이 짙다.  
20180206,10,우리의 어머니들도 한 때는 꿈많은 소녀였다. 모두들 엄마한테 안부 문자라도 한 통 넣어드려요~  
20180205,5,내용상 괜찮은 영화이긴 한데..울컥하는 부분도 있었긴 했는데 쭉 예상되는 전개였고 처음부터 끝까지 재미가 없었다. 앞 부분부터 내 취향의 영화가 아님을 알아챘지만 끝까지 보긴 해야 할 것 같아서 봤던 건데 안 봐도 괜찮았을 것 같다  
20180204,10,줄거리부터 존나 슬프네  
20180204,10,진짜 성장을 그려낸것 같다 어른이 되는건 어려운것 같다그것을 잘 표현 하여 감동적이었다  
20180204,9,판타지스러운 영화를 좋아해서 보기 시작했지만 현실적인면들과 아이가 감당하기 힘든 감정들과 일들을 치유해나가는 과정을 볼수있어서 재밌었고 많이 울었습니다. 배우들연기도 너무 좋았고 상실감으로 상처받은 어른들에게 좋은 영화인거같아요 ㅠ  
20180204,10,새로운 몬스터 네요  감동적이고 많은 생각을하게하는 영화네요  
20180204,10,"영화관에서 못본게 너무 아쉽네요.알수없는 긴장감이 영화내내 느껴졌구요.공포영화 아닌데 분위기가 참 묘하다고 느꼈어요. 그리고, 색채와 표현이 완성도가 높았어요.참 어둡지만 아름다운 영화에요.엄마생각이 많이 나는 영화네요...  "
20180203,10,관람객아이와재밋게봤어요..  
20180203,9,상처받지 않기위해 항상 자신을 감추고 걸어왔습니다 이젠 들어낼 용기가 필요한때인것 같습니다  
20180202,9,처음은 지루했으나 마무리가 좋았다. 너무 슬픈 현실을 아프지만 아름답게 그렸다. 눈물이 많이 나왔다.끝나고도 가시지 않는 가슴아픈 영화이다  
20180131,10,관람객재미와 감동 모두 좋습니다!  
20180130,10,병상에 계신 어머니를 대하는 자세와 나의 모습에 대해 다시 한번 생각하게 해준 영화입니다. 죄책감과 상실감으로 고통 받는 이에 대한 치유의 영화입니만 저의 네번째 이야기를 전하기 이틀전 어머니가 돌아가셔서 저는 치유가 너무 더딥니다.  
