0,1,2
20170608,10,성부 성자 성령의 하나님이 영화를 보는 각 사람의 거대한 슬픔을 끌어 내시고 치유하시는 놀라운 하나님의 은혜가 있게 하는 영화입니다~^^  
20170608,8,관람객무언가를 잃고 절망에 빠질때 어떻게 이겨낼수있을까용서와 심판. 비종교인이지만 크게 무리는 없었다  
20170608,10,추천받고 봤는데 이상적으로 그리지않고 현실적으로 풀어가 인상깊었습니다  
20170608,10,매우좋은영화입니다.  
20170607,10,관람객몇년째 교회에 발길 끊은 저희 아빠의 감상 : 일년치 설교 같다. 이번주부터 교회 가야겠다.  
20170607,10,그분의깊은사랑...한없는친근하심...뛰어난위로하심을다시금알게한영화가장많은감동의눈물을흘리게한내인생영화입니다  
20170607,7,충분히 좋은 영화였지만 원작을 읽어보아서 그런지 비기독교인들이 보기에는 이해가 어렵지않았나 싶다  
20170607,1,독실한 분만 보시죠.. .. 뻔한 스토리  
20170607,10,"감동 그 자체, 적절한 비유  "
20170607,1,예수쟁이들 하는 사상. 하나님은 당신을 사랑하십니다. 모두 하나님의 뜻입니다. 아 그래서 내 자식을 고통받게 하셨군요. 당신과 같은 고통을 받으라고 저희를 이땅에 태어나게 하셨습니다. 예수가 고통받아 너흴구원했으니 너희ㄷ‥ 평생 고통받고 살라니ㅋ.사상  
20170607,10,하나님은 언제나 나와 함께 하신다는걸 믿는다.  
20170606,10,영화를 보고 많은 것을 느꼈습니다.  
20170606,10,"이렇게 간접적으로나마 하나님,예수님,성령님을 이미지로, 영상으로도 만날 수 있다는게 그냥 감사해요 헤헤  감사합니다 ??  "
20170606,6,관람객기독교 영화라 해서 보게 되었는데..예전에 본 영화 밀양에 대한 기억과 함께..죄와 용서에 대해 다시 한번 생각해 보게 되네요..크라스챤이 아니었다면 살짝 졸렸을 듯  
20170606,10,내가 믿는 신이 누구인가 - 생각해볼만 한 영화  
20170606,10,관람객영화 너무 좋아서 친구 보여줬네요 :)  
20170606,9,관람객용서 특히 자신을 용서하는 법을 가르쳐주는 좋은 영화이다  
20170606,1,"정말 지루합니다, 절대 비추  "
20170606,10,나의 인생 영화 갱신.. 두고 두고 또 보고 싶은 영화  
20170606,10,"관람객영화를 보며 내내 울었습니다. 뉴에이지라고 비판하는 의견도 있는가 보지만, 꼭 신앙의 패러다임으로 보지 않아도 될 것 같습니다.  "
20170605,10,말 하나하나가 깊은 뜻을 가지고 있다.  
20170605,10,꼭봐야하는명작!! 인간의근본을 얘기하고있기때문에 모두가 느낄것이다.  
20170605,10,관람객힘들게 본 오두막 영화~ 힐링의 시간~!! 책도 다시 읽고 싶어요~ 추천해요^^  
20170605,10,꼭 봐야합니당!  정말 재미있는 영화에요  
20170605,10,누군가에게는 분명 인생영화일 영화  
20170605,10,마음의 상처가 치유되는듯합니다..  
20170604,10,"한 번 더, 아니 10번 더 보고 싶은 영화.많은 이야기들이 감동하게 만든다. 남자 주인공의 아픔과 그와 함께 하는 모든 인물들이 어우러져 감동을 이룬다. 진짜 진짜 회복과 힐링 영화살아갈 힘이 생긴다.  "
20170604,10,"최고의 영화. 하나님은 사랑이시라. 선하신 하나님 아버지의 마음을 이해하게 되었고, 믿음이 없는 자들이 하나님을 향해 던지는 의문과 원망에 대한 답을 주는 영화.  "
20170604,10,관람객많은 사람들이 말한그대로처음부터 끝까지 감동이예요  
20170604,7,관람객내면의 상처와 아픔은 혼자서는 해결할 수 없기에...회복하기를 원하시거  도와주실 능력이 있는 분께 의지해야된다는 것을 다시 생각하게 되었습니다  
20170604,7,특정종교 코드만 조금 뺐으면 참 좋은 이야긴데...그저 신의 이야기를 할순없나...중반까진 말장난에 불과했던 교리이야기지만 인간적인 드라마도들어있음...  
20170604,10,"최고라는말로 표현할 수 없을정도로 잘 만들었네요. 이 영화의 원작자와 영화감독, 그리고 열연해준 배우들 모두에게 감사한 마음이 들었습니다  "
20170604,1,"원작부터도 생각했지만,  여자아이가 범죄에 당하고 죽는 사건을 꼭 스토리의 기반으로 썼어야 했나 싶다. 그게 시종일관 불쾌하고 화가 난다. 그런 자극적인 사건 없이도 하고자 하는 말을 할 수는 있잖은가. 작가의 수준이 그뿐이란 거다. 영화는 예쁘다.  "
20170603,10,관람객참으로 감동했습니다 우리의마음을 다시금 잡아봅니다 힘든일을 당했을때 우리는 어떤 마음일까 어떻개 해결해 나가야 하나 고민해봅니다  
20170603,10,이런 영화가 많이 제작되고 보급 되었으면 좋겠어요. 지혜를 만나는 동굴 안에서 주인공이 겪은 갈등을 보고 하나님 아버지께서 얼마나 나를 사랑하고 또 우리들을 사랑하시는지.. 그마음에 대해 조금이나마 알게 되었어요. 그 크신 사랑에 감사합니다.  
20170603,10,말이 필요없는 최고의 작품  
20170603,10,관람객우리를 향하신 사랑이 느껴지는 영화  
20170603,7,용서하고 사랑하는 일이 쉽지않음을... 인내심과 많은 노력을 필요로 한다는것.  
20170603,10,정말 최고의 명화!! 보고 또 보고 곱씹고 싶다  
20170603,1,드럽게 재미없다...  
20170603,10,삶에서 느끼는 진정한 용서와 자유를 이야기 하는 영화  
20170603,10,비슷한 경험과 생각을하고 있었기에 눈물흘리며 봤네요..  
20170602,10,내인생 최고작~~꼭 추천하고 싶음~  
20170602,10,관람객너무나 편안하게 아들과 관람하였습니다. 내용 너무 따뜻하고 전개 좋습니다.  
20170602,9,관람객편견과 판단으로 사랑하지 못하고 미워하고 정죄한 시간을 돌아보게 한다.  
20170602,10,I am especially fond of you :)  
20170602,10,관람객인생 가운데 찾아온 힘든 시기를 이해하고 이겨내도록 도와주는 영화  
20170602,5,고구마 백만개 먹은거 같은 영화. 치유와 용서의 과정을 아름답고 섬세하게 그렸으나 억지춘향이다. 영화 밀양에서 보고 느낀 주인공의 감정을 여기서 관객인 내가 느꼈음.. 진짜 범죄로 가족을 잃은 사람들이 이 영화를 보고 아름답다고 느낄지 의문이다  
20170602,1,관람객말도 안되는 논리로 피해자들 바보만드는 영화.이런영화가 생겨날수록 역으로 살인이 쉬워지는거다.기독교 아니신 분들은 절대 보지말길. 솔직히 종교를 떠나서도 이렇게 흡입력 없는 영화는 정말 오랜만이다..돈 시간 날리고 스트레스만 얻었다.  
20170602,1,웃기고 있네. 비기독교 인들이 보면 매우 매우 화나는 영화 뿐만 아니라 억지주장을 매우 논리적인 것 처럼 강요하는 영화임  
20170602,10,"깨우침과 삶에 대한 놀라운 통찰, 치유와 현실의 아름다운 연결이라니...감동적이고 훌륭하네요...  "
20170602,1,기독교 영화 크리스찬 아니면 보지 마시길…제발  
20170602,1,정말 1점도 아까운  개신교도에 의한 개신교를 위한 개신의 영화3류판타지의  마약과 같은 몽롱한 영화  보고나면 기분 칙칙하고 찝찝해 지는 영화  
20170601,8,관람객재미있다  재미있닼다다  
20170601,5,친구가 추천해서 봤는데 나는 그저그럼 나 기독교인인데도 '지혜'가 하는 말에 수긍이 안 감 파파가 여자였다가 막판에 남자로 바뀌는 것도 깸 성령 역의 동양여자도 신비롭긴 했지만 '동양여자가 왜 껴?' 질투비슷한 감정이 읾 결론: 그저그럼  
20170601,10,기독교인이든 아니든 모두에게 추천하고 싶은 영화  
20170601,3,영화 자체로써는 별로.. 이렇게 종교색이 짙은 영화인 줄 알았더라면..  
20170601,9,책을 다 담아내지 못해 아쉽지만 충분히 감동적이고 황홀한 시간이었음~  
20170601,10,마음에 위로를 많이 받았습니다  
20170531,8,트라우마 치유 기독교 정화되는 느낌  
20170531,9,내 인생은 왜이럴까?  싶을때 봐야할 영화  
20170531,10,관람객영화 하는 내내 거의 울다가 왔어요 ㅠㅠ 하나님의 선하심과 우리를 얼마나 사랑하시는지 잊지말아여 우리 ㅠ  
20170530,1,별로엿뜸니다. 한때 나도 교회 다녀서 교리도 다 알고 뭔소리 할라는지도 알겠는데 그걸 알겠어서 더 싫더라구요 ㅎㅎㅎ  
20170530,7,개독이 아니면 확실히 거부감이 생길 수 있는 영화...  
20170530,10,힘들때 왜 힘든일이 생겼는지..또 생각할수록 그런일들 때문에 화가 날때 보면 위로와 이해가 되는 영화..  
20170530,10,내 인생 최고의 영화....!  
20170530,9,관람객용서와 기쁨. 표면적인 단어를 마음으로 알수 있게해주는 영화네요. 꼭 보세요.  
20170530,10,그냥 영화관 나오자마자 다시 들어가서 보고싶은 영화입니다.  
20170530,1,좀 더 아픔이 많은 자들에게 직접적(!)으로 응답하시길...  
20170529,10,지난 삶의 상처를 치유해주고 회복시켜주는 영화..!영화와 책을 모두 봣지만 계속해서 나의 인생작이 되어나의 회복제가 될것같다..!용서하며 내어주는것..!사랑받아야하는 나의 자리를 지키며남을 판단하는 어리석은 짓을 하지않기..!  
20170529,10,세상을 보는 안목을 바꿔주는 좋은 영화  
20170529,10,너무나도 따뜻하고 사랑스러운 영화  
20170529,10,관람객정말 감동적이었어요.. 책으로도 보고 싶네요....  
20170529,10,"죄책감 그리고 원망과 분노. 그 뒤 찾아오는 치유와 용서.오두막에서의 주말은, 관객인 나에게도 놀라운 경험이 되었다.  "
20170529,10,관람객넘 감동이었어요특히 지혜와 이야기하는 부분에서뭔가 가슴이 먹먹해지며판단한다는게 뭔지 ?  
20170528,8,관람객중간에 좀 지루해짐..  
20170528,3,그저 영화로서의 재미가 상당히 떨어진다. 지루하다  
20170528,10,이영화를 보면 서 많은걸 느끼네요 동생을 잃었는데 저보단 부모님의 마음을  한편으론 어떻게 풀어야할지 답을 주신듯 합니다.  
20170528,10,인간의 입장에서 스토리를 풀어낸듯종교적인 관점이 아닌 그냥 신과 나와의 관계에 대한 이야기울지 않을 수 없었다  
20170528,9,자기 아이들을 죽일 수 없어 차라리 자신을 데려가라던 맥의 외침. 파파의 마음을 알게 되어 좋았습니다.  
20170528,10,"나도 파파라고 부르고 싶어지네요.마음이 잔잔해지면서 감동적인, 행복해지는 영화였어요..!  "
20170528,10,힘들때 봤던 책인데..다시 한번 가슴을 울리게 하네요..  
20170528,10,관람객힐링되는 영화였습니다^^  
20170528,10,너무나도 아름답고 보는내내 마음이 따스해 지는영화 ~이런 영화가 많이 나왔으면 좋겠다  
20170528,1,관람객노잼인건 둘째치고 종교영화임  
20170527,9,관람객종교적인 내용을 떠나서 마음의 치유가 됐던 영화. 뜻밖의 예매한 영화에서 최고의 힐링을 얻어갔다  
20170527,9,관람객영화를 보고 난 후에도 여운이 많이 남네요~ 조금 어렵게 느껴질 수도 있는 영화였어요!  
20170527,10,기독교적 종교색채가 만땅인 정말로 잘 만든영화. 잠시나마 나도 신을 뵙고 온 기분이 들었고여운이 상당히 짙다. 개신교에 반감을 가진 사람이라면 추천하지 않는 영화인데 난 이 영화보고소름이 많이 돋았다. 원수를 사랑하라는 말씀이 이 영화의 주제가  
20170527,10,평론가는 가슴이 없는 사람인듯최고의 깨달음과 감동적인 영화입니다  
20170527,10,하나님 믿는 분들... 크리스챤이든 캐돌릭이든... 반드시보세요.. 정말 후회 안하실 겁니다.  
20170527,10,관람객신에 대하여 많은  생각을 해주게 하는 영화였습니다. 또한 심리치유의 영화이기도 했습니다. 신이 존재함을 믿습니다.  
20170526,1,너무 종교적으로 이야기를 풀어가는게..거부감이 드네요. 개인차가 있겠지만 기독교인이 아니라면 공감이 덜 갈듯합니다.  
20170526,1,종교영화인줄 알았다면 안봤을텐데...  
20170526,10,상한 마음을 다독여 주는 영화  
20170526,10,방금보고 나왔는데 평점이 의미가 없네요...너무 많은 위안과 감동을 얻었습니다.  
20170526,10,영화는 잘만들었는데 감독에게 묻겠습니다. 구약시절에 대홍수로  인류를 멸망시키고 소돔과 고모라를죄악으로 가득차서 불바다로 만드신 전적이 있는 하나님이 신약부터 마음을 바꾸신건가요?  
20170526,10,상처가 많은 이들에게 좋은 영화  
20170526,10,작년.참 많이 아프고 힘들게 돌아가신 엄마생각이 많이 났어요. 즐겁게 행복하게 좋은 곳에서 쉬고 계시다고 다시 한 번 어루만져 주는..용서하게되는. 대사하나 놓칠까봐 화장실도 못 가고 봤네요. 머리안에 들었던 많은 생각을 가슴으로 움직여 녹여낸 영화.  
20170525,10,저에게 있어서 단순히 힐링차원이 아닌 용서에 대하여 깨우치게 되는 큰 뭔가가 있었습니다. 그리고 말로 표현할수 없는 감동을 느끼게 되는 영화였습니다. 눈물 한바가지 쏟았네요. ㅎ  
20170525,10,"맥캔지와 파파가 대화 할때마다 눈물이 났다. ""나는 그 아이가 유독 좋더라."" 이 대사는 성경 말씀 같이 나에게 다가왔다. 하나님께 소망이 있다. 인간이 존귀한 이유는 하나님이 창조하신 존재이기 때문이다. 인간 스스로 존귀한 존재가 아니다.  "
20170525,10,꼭봐야할 영화입니다!  
20170525,10,관람객엄청난 힐링을 가져온 영화...! 모두가 봐야하는 최고의 영화!  
20170525,7,"관람객책으로 먼저 읽었던 내용인데.. 영화에서는 조금 흐름이 어색하고 좋은 대사들이 다 담겨있지 않아 아쉬웠습니다. 하지만 wisdom이 나온 장면이나 용서, 사랑에 대한 파파의 대사들이 깊은 감동을 주었습니다.  "
20170525,10,관람객재밌게 잘 봤습니다!!!  
20170525,5,"죄와 벌의 의미를 어느정도 알게 된 영화지만 소설이 좋다고 다들 투덜 된다는,,  "
20170524,10,사랑하는 사람을 먼저 보낼수밖에 없는 남은자의 태도에 대한 영화네요..세월호 가족분들과 그로인해 슬픔을 겪는 생존자..그리고 사랑하는 사람을 먼저 보내게 된 분들에게 드리는 선물같은 영화 같습니다..보는내내 많은 생각과 슬픔에 어쩔줄 모르겠습니다..  
20170524,9,부처님 감사합니다. 사랑해요 부처님♥  
20170524,1,안믿으면 영원한 지옥불에 굽는다면서 ㅋㅋㅋ 협박하고 달래고 화전양면술 지림 ㅋ  
20170524,10,중간중간 졸면서 봤지만 킵고잉 하란말 같은데 좋은영화인듯...  
20170524,10,관람객너무 좋아요 꼭 보세요 여러븐  
20170524,10,관람객파파는 그런분이 아니다. 나의 고통을 일부러 만드시고  예비해놓으시는...그러나 파파를 믿는다고 세상의 고통이 내게서 사라지는 건 아니다. 파파는 항상 나와 함께 하신다고...많이 사랑하고 빨리 용서하라는 파파의 음성에 하염없는 눈물이 흐르는 영화  
20170524,9,정말좋은영화네요 기독교나 다른 믿음이 없지만 여기서 하는말은 맞는말이네요 자기자신이 신이며어기는 모든걸 자기기준에 맞추는 저자신을 되돌아보게되는 영화이며 저또한 이러한 실수에 후회하고 꿈에나타나 저를 괴롭히는 상처지만 이영화가 제겐 뜻있는 영화입니다  
20170524,1,중증 종교중독자들을 위한 역겨운 설교  
20170524,1,"한 분이신 하나님을 세 인격으로 묘사한 삼신론 영화입니다. 하나님은 유일하신 한 분 하나님이며, 남자의 형상을 하고 계십니다. 창조주이시며 우리 곁에 오신 하나님이시며 우리 안에 살고 계신 한 분 하나님. 그 이름 주 예수 그리스도입니다.  "
20170523,9,"관람객책으로 먼저 보고 영화로 만든다는 소식에 과연 어떻게 이 내용을 담고 표현할까.. 걱정반 기대반으로 봤는데, 전혀 실망스럽지도 어색하지도 않은 좋은 영화였습니다^^ 영화를 보며 내 삶의 오두막도 돌아보고 치유받는 느낌,,  "
20170523,10,오두막.. 최고의 영화다 원작자 윌리엄 폴영을 통해 그리고 이영화의 감독을 비롯한 사람들을 통해 주님의 사랑이 전해진다.. 내 오두막에서 하나님의 사랑을 깨닫는건 내 몫으로 남았다. 기도하며 잠드는 밤이 되어야겠다.  
20170523,10,힐링되는 영화입니다~  
20170523,3,자다깨고 자다깨고 자다깨고  
20170523,10,관람객기대 이상. 소중한 사람과 다시 한 번 보그싶은 영화.  
20170523,9,관람객기독교인이 아니어도 흥미롭게 봤습니다. 조금은 지루할 수도 있겠어요~!  
20170523,9,관람객이정도의 기독교적 상상력~ 선명하고 재밌고 감동이다  
20170523,10,관람객부모의 역할을 다시한번 생각하게되는 영화.  
20170523,4,"'신이 있다면 이런 끔찍한 일들이 왜..'라는 의문에는 여전히 답을 주지 못함. 그건 신이 한게 아니라 악이 행한 일이라며 책임회피나 하고, 힘이 있는데 왜 막지 않냐는 질문에는 니가 이해 못하는 심오한 뜻이 있다는 답정너식 궤변 밖에 들을 수 없다.  "
20170523,10,"좋다.그냥 좋다,조건없이 그냥 좋다.  "
20170523,9,좋은영화잼따 보기권함  
20170522,1,나는 이 영화가 종교에 관련된 영화일줄 몰랐다 초반부터 눈살 찌푸리게 만드는 3인방의 등장부터  감이 왔다 기독교의 그 3신 나으리들이  었다 이런영화는 논란만 부추길 뿐 그 이상 그이하도 없다  
20170522,10,관람객딸을가진엄마로서보는내내너무나절절히공감되어많이울었다무엇보다장면들이내포하는 의미들과전달하는메세지에 감동했고감사했다우리가가진하나님에대한여러의문들을 해소시켜줄 수있는 영화이고 하나님이 멀게만 느껴졌던 사람들에게는 그분을 향한 마음을 열수 있는 영화라 생각했다  
20170522,10,인생영화입니다. ㅠㅠ  
20170522,1,이건 뭐 대놓고 개독 사기를 돈 처받고 치네. 깜씨 하나님이라니 ㅋㅋ  
20170522,10,관람객소중한 사람을 잃고 죽음의 의미에 관해서 깊은 생각을 하고 있는 이 때에 이 영화는 제게 깊은 위로와 희망을 주었습니다. 언젠가 천국에서 먼저 떠난 그 분을 다시 뵐 거란 기대를 확고하게 해주는 영화입니다. 소중한 분을 잃은 분들에게 꼭 추천합니다.  
20170522,10,나를 다시금 생각하게 한 영화  
20170522,10,아역이 조토끼 아들인줄... 어쩜 그리 빼다 박았냐  
20170522,10,첨에는 뭔가하면서 알아듣기힘든 오묘한 메시지를 주려는것 같더니 병원에서 딸을 껴안으며 하는말에서 그 궁금증이 다 풀렸다  
20170521,4,자신의 고통만 볼 땐 God을 못 보는 법  
20170521,10,인생영화이예요...ㅠㅠ ㅜㅜ  
20170521,6,집중에서 보고싶은데 잠이 너무 잘옴...  
20170521,8,관람객신학적으로 왜곡된 면이 있었지만 메시지가 좋았습니다  
20170520,10,치유의 영화네여~ 계속 눈물이...  
20170520,10,가장 아픈 기억 속 파파의 오두막  
20170520,10,내가 본 가장 감동적인 영화!!!  
20170519,8,관람객기대했던것보다 재밌었어요!종교적인 내용인만큼 호불호가 갈릴 수도 있다는 생각도 들지만 그래도 상상력있는 내용과 영상에 집중하면서 봤어요  
20170519,10,관람객힐링영화입니다 강추!!!  
20170519,8,관람객보고나서 다시 보고 싶은 영화 중 하나입니다.  
20170519,10,우리에게 벌어지는 나쁜 일들..왜 하나님은 가만히 계실까.. 기독교인으로 늘 설명하기 힘든 부분을  그려주는 영화. 기독교인이 아니어도 위로가 되는 좋은 영화네요  
20170519,10,상처의 회복이 필요하시다면 꼭 보세요  
20170518,9,관람객다시 보고싶은 영화.. 또보러 갑니다  
20170518,9,관람객훌륭한 영화였다. 줄거리도 좋았지만 특히 영화에 나오는 대화들이 인상적이었다. 그리고 아름다운 연출이  주인공의 치유과정을 더 극적으로 잘 드러내는것 같았다. 끝나고도 여운이 짙게 남고 생각할 것을 남겨주는 영화!!  
20170518,4,기독교 홍보영화 잘봤습니다. 아닥하고 헌금  
20170517,10,"관람객최고의 영화!! 다시 또 보고 싶은, 인생의 고통에 대해 왜 나에게? 이런일이 이런 사람들에게 명쾌한 답을 주는...! 신의 존재를 믿지 않더라도 보면 좋을 영화 :)  "
20170517,10,내마음의 분노를 사그러지게해준 영화.. 하나님에 대한 생각도 달라지게 한 영화  
20170517,10,관람객책의 감동의 고스란히 전해집니다!크리스챤이라면 꼭봐야하는 힐링영화!  
20170517,10,말이 필요 없는 대박 영화 ~리뷰를 쓰는 이유는 많은 분들이 보았으면 합니다  
20170517,10,하나님은 늘 옳아요...  
20170517,10,관람객감동적이었어요~ 많은 생각을 하게 하는 영화 입니다!  
20170517,8,관람객먼가 느낌있더라 하지만 큰 감동은.... 없었정  
20170517,3,기독교인만10점주는 교인을위한 영화...  
20170517,10,관람객그리스도인은 봐야한다고 생각함  
20170516,10,관람객인사이트가 가득한 영화! 다시 보고싶다영화의 기반이 된 책도 사서 읽어봐야겠다  
20170516,8,관람객감동입니다. 주변사람들에게 독려하고 싶어요.  
20170516,9,관람객생각을 많이 할 수 있었던 영화  
20170516,10,완전강추!!!!  십자  
20170516,1,관람객핵노잼 개노잼 극혐 개극혐  
20170516,10,관람객영화의 의미와 배우들 연기만으로도 꽉 찬 감동을 주네요^.^  
20170516,10,관람객하나님을 조금이나마 이해할수있는 영화였습니다.  
20170516,10,관람객다시 또 다시 보고 싶은 영화입니다~!  
20170515,8,관람객너무 길어서 자다 깨다 봤네요 ㅡㅅ ㅡ ;;;그래도 감동포인트가 곳곳에 있어서 좋았어요 추천합니다 :)  
20170515,10,관람객너무나 잘 만들었습니다보는 내내 감동이옇고 보고난 후에도감동이 남아있네요주변사람들에게 강추하고 있습니다~^^  
20170515,6,관람객책을 재밌게 봤어서 영화 너무 기대했나봐요  
20170515,10,관람객오두막은 용서와사랑을 가르쳐주는 최고의 영화!  
20170515,10,영화보는내내 사랑받기 위해 태어났다는 것이 느껴집니다  
20170515,8,관람객영화가 시작한 후부터 잘보았습니다.  
20170515,7,관람객뭉클하네요 감동적입니다  
20170515,10,마음이 따뜻해지는 영화  
20170514,10,"관람객성부,성자,성령의 이야기...감동입니다..  "
20170514,10,관람객보고나오는 것 만으로 내가 치유되는 영화  
20170514,10,관람객많은 생각이 드는 영화...  
20170514,9,관람객신앙을 가진신분이 보시면 우리의 삶가운데 느끼는 신앙관 대해서 좀 더 구체적인 이해에 도움이 될듯합니다.  
20170514,10,관람객많은 생각을 하게 하는 영화  
20170514,10,관람객시간만 된다면 다시 보고싶은 영화네요. 추천합니다  
20170514,9,"관람객잘못을 저지른 자식마저도 품어 안는, 차라리 스스로가 고통받기를 자청하는 부모의 마음이 곧 파파의 마음. 그래서 엄마, 아빠를 내게 보내주셨음을 다시금 느끼고 깨닫게 된다. 신은 언제나 내곁에.  "
20170514,10,관람객오두막~ 감동입니다!!상담에 관심있는 분은 영화 내용에서 치유의 과정을 더 잘 이해하시지않은까 싶어요~^^상처난 그 곳에서 용서와 치유가 있어난다는것 그리고 그것은 과거 부모와의 용서 부분이 있고 누군가의 사랑이 있을때 이루어진다는 것을~  
20170514,10,관람객신사점 롯데시네마 브로드웨이에서 봣는데 시설이 너무 안좋아서 다음에는 이곳에서는 보고싶지 않네요 계단이 위험해서 다칠뻔했구요..그러나 영화는 다시 보고싶어요 굿굿  
20170514,10,관람객영화 내내 널 사랑한단다 하는 하나님의 음성이 들렸습니다 사랑하는 모든 이에게 추천하고 싶은 영화입니다!  
20170514,10,생각을 해보게 하는 영화입니다. 매우 좋은 영화인 것 같네요ㅎㅎ  
20170514,10,감동이 오래가는 영화!!  
20170514,10,관람객진짜 인생영화네요.. 꼭 보길 추천드립니다  
20170514,10,관람객감동이었습니다. 감격했구요  
20170514,9,관람객기독교란 어떤 종교인가  
20170514,10,제가 믿고 있는것에 대해 다시 생각할 수 있었던 영화  
20170513,10,관람객평소에 의문이었던 내 질문에 답이 될수있을것같은 영화  
