0,1,2
20190122,10,주님의 사랑하심과 언제나 함께하시는 주님 주님을 바라보는 시선을 바꾸어 주는 영화  
20190122,10,원작을 그대로 재현해낸 영화  
20190120,10,내 딸이 죽을때 신은 무얼했나요? 의 대답을 이 영화 만큼 쉽게 잘 표현한 영화는 없을듯. 처음 주인공처럼 누구나 받아들이긴 어렵겠지만 분명 깨닫는 사람이 있을듯  
20190119,10,"용서, 그리고  거대한 슬픔을 멀리하고 파파와 함께 일상을 살아가야 한다  "
20190119,10,와 이건 열번쯤 봐야겠어요. 그동안 난 뭘 믿은거죠ㅜ  
20190115,2,남자주인공이 오두막에 가서 파파로부터 설교들을때부터 지루해짐계속 성경같은말만하고ㅡㅡ나도 천주교지만 성경말씀은 성당에서만 듣고싶어요. 지루해져서 평점보러왔는데 저와 비슷한의견많네요  
20190115,10,죽기전에 꼭 봐야할 영화.  
20190111,10,세상 모든 영혼에게 추천합니다!!  
20190106,10,하나님에 대해 더 가깝게 느끼게 되었습니다난 네가 참 좋다 하시는 하나님 ..사랑  
20190105,10,정말신앙인들..특히 미지근한 신앙인들에게강추 입니당  
20181229,10,늘 함께하시는 하나님.. 이 영화를 통해 나를 사랑한다고 말씀하신다  
20181225,10,기분이 좋아지는 영화.  
20181225,10,이건 진짜 레전드 오브 레전드다  
20181223,8,용서가 안된다 전남친시간이 갈수록 분노와 증오로 가득차 죽여버리고 싶단 생각  
20181221,10,정말 최고의 영화입니다. 주인공 내면의 아픔들이 하나 하나 치유될때마다 감동의 눈물을 흘렸습니다 혼자 조용히 보실 것을 추천합니다.  
20181215,10,슬픈이들에게 위로가 될수 있는 영화같아요.저도 다시 한번 봐야겠어요.  
20181212,10,소장하고 싶은 영화네요  
20181207,1,"신이 해줄수 있는건 없으니까 피해자가 알아서 용서하고 마음 털으라는게 끝. 현실은 고통스럽고, 신은 개입할수 없다.  "
20181205,10,내 인생 최고의 영화...  
20181130,6,원작소설을 읽기전에  요약차원에서 본 영화인데 너무나 종교영화네요  
20181127,10,지금까지 본 영화중에 최고!나를 치유해준 영화  
20181125,10,주인공처럼 하나님을 만난 시간이었습니다.  
20181123,9,누가 비공감 1개씩 다 누르고 다니네...지저분한 인간  
20181117,10,일상에서 파파를 만나다.  
20181111,8,내용도 좋고  다좋은대~~딱한가지 아쉬운점.아이 무덤만드는과정에 꽃이피는것가지는좋앗는대  나비가 날라와서 아빠에게 아는척을한 부분에  안좋앗다 이미 천국에있는걸 보여줫는대..  
20181110,10,용서를 못하는 나에게 조금이라도 용기를 주네  
20181105,10,It's time to let that go  
20181104,10,봐도 봐도 감동 깊은 영화~!어쩜 세분 하나님을 이렇게도 사랑스럽게 표현했는지~♥♥♥사랑해요 예수님~~~~^^  
20181103,10,정말 첨부터 마지막 장면 하나하나 놓칠수 없이 몰입했습니다강력추천합니다그리스도인이라면..저같은 나이롱?신자라면 꼭 보세요  
20181031,1,기독교영화. 일단 교회를 의심하는 아이부터 강간당한채 죽이고 진행한다. 전형적 기독교의 기만. 대사 대부분은 말장난. 핵심은 불교철학이 설명해놓은 내용을 복사해다 쓴 수준. 그럼에도 기독교식 흑백논리에서 한치도 벗어나지 못함. 여전히 모순이 너무 많다  
20181025,10,내적치유에 좋은 영화네요.  
20181003,10,삶을 되돌아보게 하네요. 용서와 사랑에 대해서 깊은 고민을 하게 됩니다.  
20180929,10,“사랑의 증거는 용서다” 라는 깊은 메시지를 전해준 영화 세상의 비극과 악행의 주체는 신이 아닙니다 그것마저도 내포한것이 바로 이물질세계입니다 삶의 끝까지 투쟁해야되는 대상이  바로 악입니다  
20180928,5,"비주얼은 괜찮았다는 거 말고는 그닥.. 평론가의 평 중에 ""스크린의 교리문답""이란 얘기가 있는데, 딱 제가 하고 싶었던 말이네요. 삼위일체라는 개념을 3명의 배우로 표현하는 것은 살짝 위험할 수 있고, 각각의 역할이 뚜렷하게 표현되지 않은 것도 아쉽  "
20180928,10,I loved it....  
20180926,10,종교를 벗어나 꼭 봐야하는 영화!  
20180920,10,최고의 영화. 몇번이고 보고싶은 영화에요  
20180909,10,아픈 아가를 키우며 몸도 마음도 지쳐있는 아내에게 큰 위로와 힘을 준 책.. 그리고 영화.. 감사합니다.  
20180903,10,믿음생활동안 궁금하고 해결하지 못한 숙제들이 해결된것같아요 문제는 실천이 제일 큰 관건입니다. 말씀으로 전신갑주를 입고 행하는 믿음으로 살아가야 겠습니다. 예수님이 다시 오실때까지  
20180826,10,나의 파파를 만나는 시간~!  
20180825,10,모하메드 살라 연기잘하네  
20180817,10,아이들과 안심하고 함께 볼 수 있는 영화  
20180812,10,좋은 영향력을 주는 영화인것 같습니다.  
20180805,10,다른 분들도 꼭 보셨으면...내게 너무 감사한 영화  
20180731,10,사랑과 용서가 충만한 일링영화!  
20180728,1,종교를 강요하는 영화다. 종교 안 믿는 사람은 절대 보지말아라. 보다가 화나서 그날 하루 다 망친다. 조심해라.  
20180715,10,저는 갑자기 몸이 안좋아져서 원망햇엇습니다그러나 하나님은 선하시기에 하나님을 신뢰하겠습니다  
20180712,2,와우... 완전 대놓고 포교하시네  
20180711,10,감동적입니다~~오래도록 여운이 남는 영화예요  
20180709,10,우리 모두 사랑받는 소중한 존재임을 다시금 느끼는 정말 감사한 영화입니다.  
20180627,10,최고의 힐링 기독교 영화  
20180625,10,말이 필요없다 보는 내내 울었던 영화  
20180621,10,정말 감동적이네요우리 인생 힘들때 누구나 빠지기 쉬운 그 지점에서 꼭 만나 가뭄의 단비 같은 영화에요  
20180617,10,잔잔하지만 깊은 울림을 주는 영화.보고나서 많이 잔상이 남는 영화였네요.집에서 한번 더 보려구요-  
20180610,10,내가봤던 영화 중 제일 좋았던 영화  
20180607,10,어떻게 이런 영화를...완전 놀라워요!!!!  
20180606,1,영화를 본 사람들에게 묻겠습니다. 당신의 막내딸을 강간하고 살해한 사람을 고작 기독교의 교리를 신봉한다는 이유로 용서하고 마음속에 묻을수 있겠습니까?  
20180603,10,살면서 끊임없이 판단하고 평가하고 결국 미워한다. 이 영화를 보고 모든 것을 판단하고 미워하며 시간을 보낸 나를 반성하게 되었다. 용서를 배웠고 사랑을 배웠다. 이제 나는 누군가를 용서하려 하고 나 자신도 용서하려한다.  
20180602,10,주위분들과 함께나누고 싶어요^^  
20180514,10,"현재의 삶에 대해서 조금 더 시야와 마음을 넓힐 수 있게끔 생각하게 해주는 영화, 조금 더 나아가 기독교인이라면 한번쯤 고민 했을 포인트를 짚어 주는 영화. 좋은 영화네요  "
20180511,10,인격적이시고 신사이신 파파를 잘 나타내 주고 있어요. 대사 하나하나가 생각을 하게 만드는 정말 소중한 영화입니다  
20180506,10,고난의 때에 이해할수없을때몸부림을 치며 기도했던 순간들그럼에도 이해 할수없었지만 순종하기로 결단하며 많은 눈물을 흘리며 비로소 예수님 십자가 지심을 조금은 알것같았다영화를 보며 마음깊은곳부터 따뜻해진다.. 하나님은 여전히 사랑이시기에...^^  
20180506,10,ㅠㅠ너무 감동적인 영화 과거의 아픔과 상처로부터 사랑받을 줄도 모르고 자신을 온전히 사랑하지도 못하는 한 사람의 인생을 송두리째 바꾼 하나님의 사랑을 담은 영화  
20180502,10,"눈물 흘리며 봤습니다. 진정한 치유란, 자신을 용서하는 거란 걸.  "
20180423,10,마음이 따뜻해지는 그런 영화... 눈물나는 영화..  
20180422,10,제가 얼마전에 남자친구랑 헤어져서 가슴이 먹먹했는데 눈물이안났습니다. 그런데 이 영화를 보면서 하나님이 저를 사랑하시는 마음에 대해서 이해가 가게되었고 하나님이 항상 저를 사랑하신다는 것을 느끼게 되어 눈물도 흘리게 되고 힐링이 되었습니다.감사합니다.  
20180422,10,"인생이 무엇인지, 고통앞에 선 인간에게 어떻게 문제를 해결해 나가야하는지 묻게 된다  "
20180420,10,용서와 치유가 넘 잘나타나있어요  
20180408,10,많은 궁금증이 해결 되었어요.^^  
20180408,10,정말로감동입니다.추천입니다.  
20180408,10,정말로감동입니다.추천입니다.  
20180408,10,정말로감동입니다.추천입니다.  
20180406,10,마음이 따뜻해지는 영화...  
20180405,10,하나님은 살아계신다는 믿음이 강해졌다. 오늘 하루도 감사한다.  
20180404,10,종교를 떠나서 마음의 치유를 어떻게 해야 하는지 알려주는 영화  
20180326,10,어느 순간에 하나님과의 대화가 필요할 때 문답은 하지 못하더라도 그분의 말씀과 생각을 가늠해 볼 수 있는 또다른 성경...  
20180325,10,하나님에 대한 진지한 고찰을 통해 그가 어떤 존재인지 분명히 이해하고 만들어낸 작품인 것 같습니다. 하나님을 오해하고 있는 분들에게 추천!!  
20180324,10,너무 감동적인 이야기입니다  
20180314,10,보고나면 마음이 따듯해지는 영화  
20180313,10,인생영화란 이런것. 누군가에게는 인생을 바꾸는 영화  
20180305,7,사랑하는 이를 잃은 누군가에게 권할 만한 영화. 종교영화치고 덜 유치하기도 하고.  
20180304,6,힐링이 필요하신 분들을 위한 종교영화. 재미를 찾으시는 분들에겐 지루할수 있어요  
20180301,8,부담없이 보고 생각을 많이 하게  되는 영화  
20180227,10,굿..서로 사랑하는  가족.이웃이 되면 얼마나 아름다운 세상이될까..?  
20180227,5,차라리 복수물이였으면 공감했을 것 같다  
20180225,6,궤변을 영상미로 포장할 때  
20180224,10,내 생애 최고의 영화. .  
20180218,10,정말 인생 최고의 영화.  
20180218,9,상처를 치유하시는 주님 이 영화를 통해 주님이 더 친밀하게 다가왔다  
20180212,10,기대가 되는 영화예요.  
20180211,9,"방금 티비로 보았는데 간단줄거리, 예고편 보고 감동적이고 재미있어보여서 봤는데 영화자체는 정말정말 감동적이고 좋은데 중간중간 따분한 부분이 있었던것같애요ㅜ  "
20180211,10,감동적이고 좋은내용이였어요~~♡  
20180206,10,종교에 상관없이 사랑과 용서가 잘 나타나있어서 너무 좋았습니다  
20180203,10,너무 감동적이었습니다 ㅜㅜ  
20180203,10,너무 감동적이었습니다 ㅜㅜ  
20180202,1,"중동 사막 모래잡신, 전쟁의 신,피의신의 자기합리화 영화다. 기독교의 허구는 만천하가 안다. 이세 반박하기도 귀찮다  "
20180201,9,"하나님에 대한 오해를 잘 풀어주는 영화,누구나 있는 상처와 분노이기에 모두에게 추천해주고 싶네요!  "
20180201,10,보고 많이 울었어요.. 파파는 항상 제 곁에 계십니다.  
20180201,1,1점을 주는건 앞부분이 좋아서다. 거기에 속지말라  
20180201,5,이영화가 기독교영화인줄 모르고본 일반인관점으로...너무진한 기독교색이 거부감이 들었음   만약에 하나님이 존재한다하더라도 인간이 신의뜻을 다아는듯 신을 저렇게 묘사할수도 해서도 안되는것임  
20180131,10,기독교에 대한 지식이 있으면 더 좋겠지만 인생에 대한 여러 생각을 갖게 하고 의미를 주는 영화 종교에 대한 거부감 없이 봐도 좋을 영화입니다!  
20180131,10,원작만한 영화 없다고 기대 하나 없이 보기시작해 펑펑 눈물을 쏟았어요상처 받은 그 자리에서도 언제나 함께 계셨군요..용서하고 용서를 구하는데 빠르며 더욱 사랑하며 살겠습니다.주님과 함께라면 가능하겠죠  
20180122,10,하나님의 사랑은 이유없는 사랑 아버지의 사랑이다  
20180120,10,어른의 내면에도 아이의 마음이 있고 파파의 위로가 필요한듯 나처럼 다른 이들에게도 이 영화가 위로가 되었음 좋겠다고 생각했다.  
20180106,2,꿈 같은 영화다. 그래서 누군가가 다 해줄 거 같은 그러한 믿음이 끔찍하다.  
20180105,10,파파가 있다면 이러지 않을까.  
20171231,10,추천 추천 추천 추천 추천  
20171231,10,"강추합니다.   우선순위 청년들  필영화로 권장입니다.잠시도 눈을 띨수 없었어요.구절구절 치유의 방법을 잘 설명해 놓았네요.결혼을 하기전에 ,  이혼전에도...ㅎ꼭꼭 보시길  권합니다.  "
20171230,10,주인공은 바로 평범한 우리의 모습이네요. 내가 만든 기준이 결코 심판? 판단의 기준이 아니네요. 자막해석이 너무 좋네요.  
20171230,1,종교가 법 위에 있을 수 있다는게 상식적으로 말이 된다고 생각하냐.. 신앙도 정도가 있는거지 자식을 죽인 살인마를 용서하고 사랑하라는 개소리를 늘어놓는 역겨운 영화  
20171228,10,하느님을 알아가고있는 과정중에 영화를 알게되었습니다항상 의문이었던 문제가 풀리는 것 같네요저 자신을 돌아볼 수있는 계기가되서 좋았습니다대사하나하나 곱씹으며 봤어요  좋은영화 만들어줘서 고맙습니다  
20171228,7,관람객처음에는 보다 잠 들었지만 눈 떠보니 천국이였다...  
20171227,9,요즘 너무 힘들었는데 위로가 되었습니다  
20171226,10,내 인생 최고의 영화!!!  이렇게 뛰어난  내용과 연출과 감동이 있는 영화를 언제 봤던가!!!! 종교를 떠나서 용서하지 못했던 상처가 실제로 치유될 수 있는  너무나 좋은 영화다!!!  
20171221,10,하나님의 큰 정원.. 그 안에 작은 가지.. 하나님의 계획 안에 있음에 감사합니다.  
20171217,1,영화 보면서 내 눈을 의심하게 만들었다. 나도 크리천이지만 그냥 쓰레기 크리스천 무비. 세월호 유족들이 이 영화 안봤으면 좋겠다..  ㅠㅠ  
20171216,10,강추. 꼭 보세요. 정말 좋은 영화에요.  
20171215,10,"사실 그대로를 이렇게 대중적으로표현해 낼 수 있다니..삼위일체하나님 뿐만아니라 하나님의 마음 모두,주관적인 경험이 아니구나 다시금 느낄 수 있었으며,책에서의 놀라움 그대로 영상부터 출연진까지모든촬영기법이 고퀄임에 더욱 감사했습니다  "
20171214,10,하나님은 항상 옳으시다..그리고 날 많이 사랑하셔요..저도 예수님을 사랑할게요  
20171209,7,관람객한시간 이상을 끌기 어려운 소재로 유치하게 한시간 이상을 끈 영화  
20171128,10,평론가의 평가 반대로만 보면 영화 잼나더라 인생영화요~  
20171126,10,영화보면서 잘 안우는데 보면서 엄청울었네요  많은것을느끼고 가는 영화였습니다  
20171126,10,영화 보는내내 말로 설명할수는 없지만 눈물이 하염없이 흘러내렸습니다.  
20171126,10,인생영화가 되었네요...ㅠㅠ  
20171121,1,원작과 달리 너무 재미없어요.  
20171121,1,그래서 살인 옹호하는거야?  
20171119,10,내 인생 최고의 영화!!!  
20171119,8,"작가 개인의 체험을 비유했으나, 조금 직설적이라서 ""주입식"" 교육처럼 느껴졌던 영화  "
20171119,6,"딱히 별로. 줄거리 내용이 아닌 성경, 종교에 초점이 맞춰진 기분. 힐링과 종교를 좋아하는 사람에겐 추천한다. 다만 영화와 재미를 찾으려는 사람에겐 비추.  "
20171117,10,힐링에 최고의 영화입니다! 과거의 상처와 고통으로부터 헤어나오지 못하거나 자신을 용서하지 못하고 상실감속에서 인생의 방향을 잃고 사는 많은 사람들에게 강력 추천합니다 ^^  
20171115,10,믿음으로 사랑으로 살아야 겠다는 다짐을 해봅니다  
20171115,10,"크리스천 영화라고 하시는데, 영적인 것에 관심이 있으신 분이라면 파파가 단순히 ‘하나님’을 말하는게 아니라는 것을 알 수 있을 겁니다. 이건 종교영화가 아닙니다. 삶을 아우르는 진실의 얘기입니다. 꼭 한번 보세요. 세상과 나의 시야가 바뀔겁니다  "
20171114,2,종교색을 떠나서 영화가 재미가 없고 주제에 대한 설득력이 너무 떨어진다 어린이 영화수준.그래도 1점을 더준이유는 주인공연기력?;; 어휴 속지말지어다  
20171112,10,사랑은 흔적을 남긴다.  
20171112,10,신뢰와 용서에 이르는 과정을 물 흐르듯 자연스럽고 섬세하게 표현한 수작.  
20171109,10,용서와 사랑을 앎에서 실천으로 다가가게 해 주는 영화 ... 그뤠잇  
20171101,10,나의 힘이신 여호와여 내가 주를 사랑하나이다.  
20171030,10,"Good, good father  "
20171029,6,영화 전반에 지나친 종교색(기독교)이 거부감이 드는것도 사실이나 그런 류의 영화 중에서는 꽤나 대중적으로 만든 듯한. 동양여배우 굉장한 미인이고 주조연급인데 여기 출연 배우 리스트에는 들어있지도 않네 ㅡㅡ;;  
20171027,10,제 주위에 소문내게 되는 영화였습니다^^ 보시는분들마다 또 소문들 내시더라구욤~많은 사람들과 함께 극한 소통을 나누며 전 책까지 사서 읽게 되었어요~ㅎ 이거 2탄좀 만들어주면 안되나요~?!영화대사들 정말 뛰어납니다  
20171027,10,상처와 증오는 나를 그 곳에 가둬놓고 하루하루를 힘들게하고 내 영혼을 병들게한다. 상처치유와 용서는  그 곳에서 나를 해방시키고 자유하게하는... 결국 나를 위한 것이다. 어제 휴대폰으로 봤는데 극장에서 못 본게 너무 아쉽다ㅠㅠ  
20171022,4,관람객무교인 나로서는 알쏭달쏭....  
20171021,10,항상 동행하시는 삼위일체 하나님을 만나게 되는?아름다운 치유 영화! 누군가 용서해야 하는 우리들에게 꼭 봐야할 영화이다~♡ 감사해요~♡♡♡  
20171018,10,하나님의 마음 하나님의 사랑이 부드럽게 전해지는 이 기적같은 실화를 통해위로와 평안을 얻었다. 언제나 함께하시는 그리고 아무 조건없이 존재자체만으로 사랑하시는 주님의 진심을 이 영화를 통해 말씀하시는 것 같다.  
20171017,10,소설로 읽었을 때보다 더 감동적이네요! 종교를 떠나 삶에 있어 사랑과 용서가 얼마나 중요한지 깨닫게 한 명작이네요~ 꼭한번 보시길 강추합니다♡  
20171017,10,꼭 봐야할 영화 정말 잘 만들어진 영화  
20171010,10,"하나님 예수님 성령님의  가장 완벽하시고, 가장 따뜻하며, 가장 벅차오르는 사랑.  "
20171009,1,평점에 속았네.. 전 정말 잼없게 봤네요..  
20171009,10,영화를 보니 성부 성자 성령 하나님을 더욱 더 알고 싶네요꼭 보시기를 강추드립니다 ♡  
20171009,5,관람객그냥그럼..보다나옴  
20171006,10,책을 보고 영화로 나왔으면 좋겠다고 생각했는데  완성도 있는 영화를 만들어 주셔서 감사합니다~^^ 책의 감동을 또다른 측면에서 느끼는 좋은 시간이었습니다~^^ 하나님 죄송합니다 감사합니다 사랑합니다!  
20171004,8,용서라는 이름의 용기와 사랑  
20171004,1,의도를 모르겠다...  
20171001,9,꼭 한 번은 볼 만한 영화임.  
20170930,10,평소에남을쉽게판단하던나자신을돌아보게되네요‥많이울게하는영화였어요  
20170929,9,많은 인사이트를 주는 영화였습니다.  
20170925,10,보세요진짜로 마음이 변화하고 따듯해지고 벅찹니다  
20170924,10,"와.. 처음엔,중간중간 종교적으로 가는듯하다가도,그냥 진짜 힐링.  "
20170922,10,얼마나 울었는지...슬퍼서가 아니라 내영혼을 치유받는 기분때문에...  
20170922,9,마지막에 케이트(딸) 에게  용기를 주는 대화는 정말 마음속으로 눈물을 너무 많이 흘렸네요..  
20170921,10,이 영화를 볼 수 있게 되어서 감사합니다...  
20170920,10,관람객masterpiece! 내적치유가 필요하신 분께 추천 드립니다. 아름다운 영화입니다.  
20170920,6,종교에따라 희비가 갈릴듯 난무교라 루즈하고 답답했슴  
20170919,10,책으로 먼저 봤었는데 그 내용을 다 담지는 못했지만 정말 볼 만합니다 시간 아깝지 않고요 추천합니다 ㅎㅎ  
20170917,10,감사합니다 삼위일체 하나님  
20170916,10,감동받아 많이 울었습니다 늘 함께하신다는걸 잊고 살았습니다 죄송합니다  
20170915,10,감동   그  자체임....천국에  가있는  딸의  모습....  
20170914,10,누군가 내 소중한 이를 데려가도 행복할수 있어요~ 신성은 그 행복을 깨우치기 위해 인간에게 지혜를 주셨지요^^  
20170912,6,관람객음... 자세히 기억이 나지 않음  
20170912,7,주인공에게 공감가는 부분도 있고 감동도 있지만.. 진행이 좀 루즈했다 한번 볼만한 영화.  
20170911,10,"종교로 해석하지 않고 삶의 문제로 보았습니다.인생에 대해,어떤 부모가 되어야할까에 대해 많은 생각을 할 수 있는 영화였고 보고난 후 마음이 아주 평안해지는 영화였어요.대전제는 더 나아지리란 긍정, 선한 의지란 게 있다는 믿음으로 앞으로 나갈 수 있겠죠  "
20170910,10,"감동이 있는, 꼭 봐야할 따뜻한 영화  "
20170910,9,"평론가는 평점을 매길 수 없는 영화네요, 신앙은 평론가의 영역이 아닙니다  "
20170908,4,"아니 영화가 왜이리 설교조야, 보기 불편하게시리.  "
20170908,10,상처가 있는 사람들은 꼭 보셔요. 소장용영화입니다.한치도 눈을뗄수가 없는 스토리와 순간순간의 대사가 온몸에 전율과 감동 눈물을 선사합니다. 주인공이 꼭 내가 묻고 질문하고픈 것들만 질문하며 반문하는데 심히 몰입됩니다. 너무 잼나고 감동이예요  
20170907,10,"나에게 많은 까우침과 눈물과 정답과 생각을 느끼게해준 영화 , 그 이상입니다 감사합니다  "
20170906,1,저도 카톨릭 이지만 너무 이해안되고 지루한영화 종교적인 영화네요 용서와 사랑 치유? 구원  노노 ~  
20170905,10,종교가 녹아있지만 종교와 상관없이 한층 성장할 수 있는 영화..  
20170905,10,누군가를 용서할수있게 하는영화..  
20170904,1,속았다 평점에 평점은 다 광신자가 쓴거냐  
20170903,10,이 영화를 만들어 주신 감독님.하나님 아버지께 감사드립니다ㅎㅎㅎ누군가를 용서한다는건 하나님이 주신 힘밖에 없습니다  
20170902,8,고통없는 삶을 보장받고 싶은가? 그런건없어 신을 다 이해할순 없지만  또한 인간이기에 미움과 절망을 초월할수도 강요되어서도 안되고 다만 미움과 절망이 삶의 가치마저 잃게하지 말라는 ...인간은 완벽할수없으니까  
20170831,10,온가족이 봐도 좋을 영화  인생영화!  
20170829,10,나를 많이 돌아보게 만드는 영화  
20170827,10,내 인생 최고의 영화라 할 수 있음. 기독교인 아닙니다.  
20170827,9,"판타지 같은 영화. 신을 믿든 안믿든 그게 중요한게 아니다. 우리는 가장 힘든 순간 기대거나 의지할 무언가를 찾게 된다. 영화는 무조건 신을 믿으라는게 아니라, 자신이 만든 상처를 치유할 하나의 방법을 제시하는 것 뿐이다. 굉장히 몰입하여 봤다.  "
20170825,10,관람객완전강추에요ㅜㅜ엄마아빠랑다울면서봄ㅜ  
20170822,10,이런 경이로운 영화가 있는지 몰랐습니다..  
20170822,10,몇년만에 영화보면서 졸라울었다  
20170821,10,영화 내용에 담긴 모든 말들이 마치 단 한사람 '나'에게 해주는 말 같습니다 많은 위로와 사랑을 느꼈습니다 보여지는 이미지와 배경 또한 예브고 감동적인거 같아요  
20170821,3,"불신자의 입장에서 보자면 불편한 영화임에 틀림 없습니다. 특정 종교의 교리가 반복해서  나오는데 단순한 힐링영화라니...물론 삶에 대한 메세지가 있는 영화입니다만, 종교를 배제하고 보면 절대로 잘 만들어진 영화가 아닙니다. 빅피쉬를 다시 보고 말지..  "
20170821,10,"참좋은 영화네요,.언젠가 가장이 될나이에 무거운 어깨에  짊어질무게생각에 앞이 어두웟는데 삶의 아픔과 상처를 영화한편으로 위로받을수 잇어서 ,,,그리고 나의 돌아가신그분이  나를 아직도얼마나 사랑하시는지 영화한편으로 느|낄수 잇어서 너무나 좋앗습니다.  "
20170820,9,근래본영화중 작품성  제일높음   이런영화 많미 만들고 많이 상영하자  
20170820,10,용서와 회복 그리고 새로운 시작이네요.  
20170819,10,사랑과 용서가 어디서부터 시작되는지를 알려주는 영화. 진정한 자유를 찾을수 있는 영화.  
20170818,10,많은 사람들에게 치유가 됐을. 치유가 되고 있는 치유가 될 책과 영화  
20170817,10,하나님을 이렇게 잘 설명할수있을까?  
