0,1,2
20170501,10,"관람객책을 4번도 더 읽었었어요. :) 용서하지 못하는 사람이 있는 분.. 마음이 힘드신 분들은 꼭 보시길 추천드립니다. 기독교 교리나 신에 대한 미움, 궁금증이 있는 분들께도 추천드려요..! 모두 힐링 되시길..!  "
20170501,10,너어무 좋은 영화. 이 영화를 보고 만나는 사람마다 추천중  
20170501,8,관람객홀리한 영화긴 하지만 영상미가 아름답네요.  
20170501,9,"관람객삶의 태도를 아야기로도, 시각적으로도 잘 표현해냈어요  "
20170501,8,관람객책의 느낌을 실망시키지는 않은 것 같아요! 연기력이 다소 아쉬웠지만 표현하고자함은 잘 살려준 작품!  
20170501,8,관람객사전 지식이 필요한 영화  
20170501,10,관람객우리가 우리에게 잘못한 사람을 용서하여준 것같이~~용서하지 못하는 내면의 분노를 치유하고 용서함으로 죄책감과 정죄로부터 자유케하는 기독교적 해석이 잘 된 영화!  
20170501,10,나에게 오두막이 되어준 영화  
20170501,10,관람객너무 좋은 영화입니다. 기독교인들의 모든 고민이 풀리는 듯한 영화  
20170501,9,관람객넘 좋아요 ㅎㅎ 마음에 꼬여있던 문제들이 풀려가는 기분이에요  
20170501,10,관람객굿-! 스토리도 탄탄하고 영상도 멋져요  
20170501,9,관람객함부로평하기어려운영화...굳..!  
20170501,7,"관람객재밌었지만 책에는 못미친다... 영상 퀄리티도 후반에 갈수록 떨어지는 느낌이었고, 오두막의 내용을 진짜 알고싶은 사람은 책을 읽어주었으면..ㅎㅎ 주옥같은 대사들이 많이 빠져있어서 안타까웠다.  "
20170501,9,내 영혼의 치유를 원하는 자는 보길 추천합니다 삼위일체하나님을 만나고 싶은자는 추천합니다늘 함께 하시는 파파를 만나보세요~^^  
20170501,10,소설 그대로~♡ 사랑하는 주변 사람들에게 꼭 권해주고픈영화~  
20170501,10,관람객너무 감동적인 영화에요 엄마랑 함께 봤는데 정말 은혜롭고 마음이 평안해지는 시간이었어요  
20170501,10,관람객너무좋아요 여러가지 생각을 하게되네요  
20170501,10,관람객너무나 감동 ㅠㅠ진정한 치유의 영화  
20170501,9,관람객꼭 한번 볼만한 감동적 이야기 입니다  
20170501,10,진짜 최고의 영화입니다  
20170501,10,너무 감동적인 영화예요~완전 정화되는 느낌  
20170501,1,이 영화가 인간의 창작물인 것처럼 성경 역시 인간의 필요에 따라 만들어진 창작물일 뿐이다...라는 것을 깨닫지 못하는 우둔한 인간들을 위해서라도 기독교는 필요한 것 같네요. ㅠ.ㅠ 기독교인 자위행위용 무비..!!  
20170501,10,감상을 글로 담기에는 너무 깊은 영화  
20170501,10,관람객원작을 새롭게 해석해서 잘 만들었네요! 좋은 영화 강추입니다!  
20170501,10,감동적이에요~ 책이랑 똑같이요~  
20170501,10,관람객저는 기독교인이라 삼위하나님의 인격을 넘?나 잘 표현해놓은것에 만점을 드리고 싶습니다~^~  
20170501,10,관람객신앙생활을 하그있는 저에게 참 도움이 되는 영화였습니다  
20170501,10,관람객원작을 잘 구현해낸 것 같습니다. 보면서 반성도 하게되고 위로도 받을 수 있는 영화예요~  
20170501,10,"""나는 너를 사랑하지 않으적이 없고 앞으로도 그럴 것이다"" 메시지 성경에 예레미야 이 말씀이 영상으로 상영되는 순간  "
20170501,9,관람객정말 감동이예요책의 내용을 그대로!!!  
20170501,10,진정한 마음의 평화를 찾으수 있는 영화 ~삶의 방향성을 제시해주는 영화  
20170501,10,관람객아름다운 영상과 원작에 충실하려는 노력  
20170501,10,관람객완전 은혜롭게 잘 봤습니다~^^*책으로 표현되었던 것 만큼 감동을 준것 같아 넘 잘 봤어요~~  
20170430,5,평점에속았음...종교영화였음...중간중간 졸음을찾을수없었음 .거의.모든 평점이..20일날등록이 된것을 미리알았더라면 좋았을것을...  
20170430,10,관람객귀 있는 자는 들으라. 그러나 누구라도 하나님을 만날 수 있는 영화.  
20170430,10,주님의 가르침을 다시 일깨워줬고 나약한 저를 걷어주셔서 항상 감사드립니다 다시 나를 일깨워줬던 인생영화....  
20170430,8,관람객기독교 관점에서 삼위일체가 만나는 관계의 모습들이 고통과 이해할 수 없는 일들로 가득한 이 세상의 현실을 살아가는 우리에게 힘을 불어넣는다. 그럼에도 여전히 물음으로 남게되는 부분은 신은 어째서 고통의 순간을 의도하지는 않지만 막지도 않으실까.  
20170430,10,관람객감동입니다 정말 아름다운 영화입니다  
20170430,10,"관람객추천합니다! 힐링이 필요한 분, 용기가 필요한 분, 분노가 가득한 분...꼭 보세용^^  "
20170430,10,너무 좋아요 강추 꼭보세요  
20170430,10,관람객원작으로 읽었던 스토리를 영화로 다시 보게 되어 넘 감동이었어요^^눈물 펑펑 흘렸네요ㅜㅜ기독교인이 아니더라도 꼭 보시길!  
20170430,10,관람객꼭 봐야할 영화 감사합니다  
20170430,1,오직 기독교인을 위한 영화.  
20170430,10,힐링영화 혼자 보았는데 요즘 이런 영화 없어 아쉽다. 재밌더라  
20170430,8,관람객여자친구가 콧물흘리면서 볼만큼 감동적이었어요 ㅎ  
20170430,10,관람객모든 사람들이 꼭 봐야할 영화입니다..아이들이 많이 감동을 받았네요저도... 그리고 마음이 아픈 많은 사람들에게 필요한 영화입니다  
20170430,1,"내용은 정말 좋으나 연출, 연기, 시나리오 정말 별로...ㅠㅠ 어설퍼서 몰입이 안돼요...ㅠㅠㅠ  "
20170430,10,관람객저는 두번 봤습니다  책으로도 읽어서 실망하면 어쩌쥐  했는데  괜한 염렴였고 잘봤습니다  중간에 살짝 졸음이 올것 같긴했는데  잘넘겼답니다 ㅋㅋ  
20170430,10,관람객이게 진짜였음 좋겠다아..  
20170430,9,관람객주말아침 조조로 보았습니다. 종교를 믿으면서도 회의하고 자주하는 질문들이 영화에 나오더군요. 천천히 마음을 내려놓고 받아들일 때가 오면 좋겠다고 생각합니다.  
20170430,10,"관람객인생영화, 치료영화였어요!!  "
20170430,8,관람객보다 저도 모르게 울었네요 ㅜㅜ  
20170430,9,"관람객이 영화는 신은 왜 불공평하실까, 왜 우리에게 고통을 안겨주는가에 대한 나름의 답을 준다.  "
20170430,9,관람객너무쩔어요 그냥꼭보세요  
20170430,10,관람객살아가며 잊지 말아야 할 메시지들이 많았어요감사합니다  
20170430,10,정말 멋진 영화...올해 최고로 인상 깊은 영화가 될 듯.  
20170430,10,관람객기독교적인   내용이 바탕 으로 깔려있어비기독인들이이해하기힘듯부분도없지않으리라생각되었다 관계의  회복 상처의회복은 위해 원작소설을보며기대하며기다린영화였는데 감둥깊게잘보았다  
20170430,10,관람객사랑 이라는 메세지를 던져준 영화.. 단순히 2시간짜리 영화가 아닌 삶의 큰 울림을 던져준 메세지였네요ㅜㅜ  
20170429,5,관람객그저그런영화였던듯.  
20170429,8,관람객힐링되는 좋은 영화네요.  
20170429,10,관람객그분을 제대로 알고 싶다면.  
20170429,10,진짜 최고의 영화! 더 많은 곳에서 보고싶은데 상영하는 영화관이 별로 없어서 아쉬워요  
20170429,10,관람객오두막 영화를 보면서 나를 다시 돌아보기되고 영화속에서 위로를 받고 다시 삶으로 힘을 낼수있을것같아요.  
20170429,10,관람객분위기도 좋고 힐링하려고 보기 좋은 영화.  
20170429,10,인생 최고의 영화!!또보러갈예정입니다  
20170429,10,책보고 봤는데~ 역시 마음에 와닿네요...좋아요  
20170429,10,관람객크리스쳔으로  살면서 아직 부딪쳐보징솟했던부분을간접적으로경험함으로 너무큰감동을받았다 주변사람들에게권하고싶은영화다  
20170429,10,관람객너무 내용이 좋았습니다  
20170429,10,관람객자기의 마음을 믿는 자는 미련한 자요지혜롭게 행하는 자는 구원을 얻을 자니라. 잠언 28:26영화를 볼 수 있음에 감사한 시간이었습니다!  
20170429,10,관람객감동의 영화~~♡♡♡♡  
20170429,10,관람객꼭한번 보세요인생영화로 자신합니다  
20170429,10,생각을 많이 했던 영화였다  
20170429,10,관람객스스로에게 사랑이 무엇인지 관계가 무엇인지 또 용서가 무엇인지 되물어 볼수있게 해준 영화  
20170429,10,관람객영화보면서 책 내용 다시 생각나서 좋았고 영상미도 아름다웠습니다. 강추!!!  
20170429,6,관람객그냥 그냥그냥....  
20170429,7,관람객평범한 영화로 샹각했는데 생각을 많이하게 하는 영화였습니다.  
20170429,10,관람객너무 좋았습니다 감동 ㅠㅠ  
20170429,9,몇년전 책으로 읽었는데 영화로 보니 더 실감나고 감동적이었다. 대사 하나하나 너무나 의미깊은 얘기들을 하고 있어 집중하며 보았다. 우리가 쉽게 오해하고 있는 생각들을 깨주는 영화. 많이 울어서 끝나고 눈이 퉁퉁 부었던 영화였다.  
20170428,10,관람객가슴에 한과 상처가 있는 현대인의 치유되는 따뜻한 영화이다  
20170428,9,관람객비종교적인 관점에서 보려고 했어요. 주인공이랑 최대한 같은 시선으로 경험해보려구요..잘 만든 영화에요. 소설로도 다시 읽어봐야겠어요  
20170428,10,최고의 영화 이영화을 보며 신의존재대한 궁금증을품었다  
20170428,10,영화 보고나서  얼굴이  밝아짐  
20170428,10,"오두막은 책으로도 너무 좋아하던 글 이었는데, 영화로 보니 또 다른 감동이 있네요. 쉬운 내용이 절대 아닌데  영상으로 너무 아름답게 풀어냈어요. 강추 입니다~  "
20170428,10,관람객꼭보자 두번보자 DVD나 블루레이나오면 꼭산다  
20170428,10,관람객퍼펙트~~!!★★★  
20170428,10,관람객감동적인 영화예요.추천합니다  
20170428,10,상영관 왜케 없나요 이 영화. CGV는 아예 내렸네. 멀티플렉스들 돈되는 것만 올리지 맙시다. 좀. 그 정도 해먹었음 됐지. 질을 좀 봐요. 양만 보지 말고 좀.  
20170428,10,사랑하는 사람들과 꼭 한번 보세요!!!  
20170428,9,관람객파파의 따뜻한 시선과 손길에 마음의 빗장이 어느새 스르르 풀리고  눈물이 쏟아지는 영화~인간을 바라보시는 절대자의 그 바보같은 해바라기 사랑에 마음절절해지는 영화~~두번보았지만 또 보고 싶어지는 영화~그의 사랑을 잊지않고 영원히 기억하며 살고싶다  
20170428,10,평론가는 오두막 원작을 안읽어본 것 같다 원작 읽어봤으면 저런 평은 나올 수가 없는데 암튼 눈물 엄청 쏟았습니다 옥타비아 스펜서 출연해줘서 고마워요  
20170428,10,정말 큰 감동이였습니다..!!  
20170427,8,관람객감동 감동 책보다는 감동이 덜하지만 그래도 너무 좋았습니다.  
20170427,8,관람객신앙을 성장시키는 영화  
20170427,10,내가 얼마나 사랑받고 있는 존재인지 깨닫게 해준 영화에요!  
20170427,8,관람객인생을생각하는영화.어쩌면졸릴수있는 스토리지만 나름 재미있어요  
20170427,10,"이영화를 보고 받은 느낌을 간직하며 살아가야할것같은 영화. 누군가를 용서하기 힘들고,그에 대한 분노를 지금도 가진채 자신을 괴롭히고 있는 사람들이 봐야할 영화다.  "
20170427,9,관람객마음의 상처를 보듬는 따뜻한 영화입니다 강추 드립니다  
20170427,10,관람객너무 감동깊게봤어요 강추합니다  
20170427,10,관람객상처와 고통을 받는 이유와 하나님에 대한 정확한 이미지를 알 수 있어요. 한사람 한사람을 향한 하나님의 절절한 사랑이 느껴집니다..  
20170427,10,어디든 언제든지 하나님과 함께 하심을 믿고 끝없는 의문점들을 어떻게 풀어주시는지 이런내용의 영화! 완전좋다ㅠㅠ!  
20170427,8,"관람객감동적이다. 심판자에대하여, 선과 악에대하여, 그리고 우리모두를 사랑하는 신에대하여 설명하는 부분이 너무나 이해가 잘 되었다  "
20170426,10,두번이나 봤는데도 계속 눈물이 나네요가슴에 아픔을 갖고 있는 분들이 보고 위로받고 힘내시기 바랍니다  
20170426,10,내 일생의 모든 순간  나와 함께 하시는 파파  좋은 영화 많이 만들어주세요~ ^^  
20170426,10,관람객좀 내용이어려웠는데 출간된 책도 같이 읽어보면 좋을거가타요  
20170426,1,아동 흉악범죄 옹호.  그 아버지의 고통과 분노가 잘못이라고 말하는 답도 없는 영화.  
20170426,10,특별히 크리스챤이라고 하면 꼭 추천하고 싶은 영화  
20170426,10,종교적인면을떠나 내가그동안 얼마나 주변사람들의 외적인거로만 판단하며살았는가를 깨닫고반성하게해준영화입니다..반성하게하는영화였네요..스스로의 자가콰 내자신을 투영시켜보다보니 눈물이 그냥흐릅니다  
20170426,4,관람객깊은 내용을 담으려 했으나 억지로 메시지를 전달해 주려고 한 듯한 영화...평점에 낚였던 영화  
20170426,10,관람객정말 최고의 영화입니다!!  
20170426,10,다른 사람의 상황과 마음을 살피기보단  내 위주로만 생각하고 상대방에게 상처만 주었던 자신을 돌아보게 하는 영화인 것 같아요. 정말 좋네요...^^  
20170426,10,ㅎㅎㅎ!!! 종교영화가 아닌 이 영화의 유머와 지혜!가 날 계속 웃게 만들었다.정말 재밌고 아름답다.분노한 아버지가 온화하게 변해가는 과정과 터는 방법을 자식들에게 공유함으로서 함께 삶을 살아가는것.슬픔은 잠깐.기쁨은 영원히!!!^^♡사랑받는 우리^^  
20170426,10,마음에 울림이  있는  영화!! 추천합니다.!!  
20170426,10,내 상처와 직면한다는것이 정말 어렵지만 값진 일이라는 걸 다시 깨닫게 된 순간이었습니다. 영화가 진행되면서 그사람에 맞게 세밀하게 관계맺기 원하시는 하나님을 보면서 감사하며 감동했습니다.  
20170426,10,다시보고싶은영화 :)  
20170426,8,"신과 믿음, 용서로 귀결되는 이 영화! 많은 부분을 공감할 수 없지만  힘이되는 영화였어요. 상처를 어루만져주며 힐링되는 느낌!!!  "
20170426,10,나와 직면할  수 있는 시간입니다 .  
20170426,10,우리는 모두 하나님의 귀한 자식...  
20170426,1,돈내고 종교 수업 두시간 받고온 느낌 한시간 반은 잤음  
20170426,10,와 인생영화..생각많이한 영화엿네요  
20170426,10,관람객잔잔히 하나님께서 제게 말씀해주시듯. 좋았습니다  
20170426,10,관람객너무  좋은 영화네요  강추합니다  
20170426,10,꼭 보세요 말이 필요 없습니다.  
20170426,7,관람객영화를 보던 보지않던 책을 추천합니다  
20170426,1,이렇게 지루한 영화는 처음.. 보다 나왔네요. 대체 왜 평이 이리 좋은지 이해할수가 없습니다. 기독교인이 아니라 그런건지.. 평만 믿고 힘들게 예매하는게 아닌데..  
20170426,10,"사랑과 용서, 하나님이 가장 기뻐하시는 마음  "
20170426,9,"관람객어려운 성경, 눈에 보이지, 귀에 들려지지않는 성경말씀이 가시화되고 친근히 다가왔다.  "
20170426,9,관람객여운이 남는 영화였다....  
20170426,10,종교가 없어도 공감할수있는 영화. 인생 힐링 영화입니다  
20170425,8,관람객초등생 딸아이와 봤는데괜찮은선택이었어요  
20170425,10,관람객용서와사랑을 다시  회복할 수 있는 동기부여가 되는 영화였어요  
20170425,10,관람객노래도 좋았고 여러모로 많은 생각을 하게되었어요  
20170425,10,끝날때까지 계속 울었다...  
20170425,10,"패밀리즘 영화인줄 알고 봤는데 너무 가라앉고 슬프길래 노잼영화일줄알았음. 하지만 이 영화 크리스천영화였고 난 크리스천임.    하나님의 사랑을 알수 있는, 크리스천이면서 심판자에 가까운 나를 돌아보는 계기가 되었고 이 영화는 좋은 영화다. 하...  "
20170425,7,관람객그 모든 과정을 2시간여남짓의 시간에 다 담을 수 없었을것이다. 하지만 모든 시선과 생각이 기존 종교영화보다 훨씬 신선했고 의미가 깊다고 생각한다. 다만 아쉬운점은 배우들의 연기력.. 파파와 남주 외엔..아쉽다.  
20170425,10,"이 책이 왜 장기간 베스트셀러였는지 알겠네요, 하나님 사랑의 그 심오함에 대해서 묵상이 되는 영화. 후반부 대사 하나하나가 다 은혜롭네요,  "
20170425,10,하나님은 사랑이시고 살아계십니다 :)  
20170425,10,"정말 감동이 있는 영화 , 소장하고 싶은 영화  "
20170425,7,좋은 영화지만 꿀잠 각오하셔야..  
20170425,6,관람객잘받어요 부모님이좋아하세요  
20170425,10,사랑과 관계에 대해 깊이 생각할 수 있는 영화~ 소장가치 있는 영화~ 또 보고싶은 영화네요  
20170425,10,진짜 원작으로 봤다가 영화가 나왔다는 소식에 정말 기뻤어요!!! 책과 영화를 같이 보시면 뭔가 마음이 따듯해지는 기분을 느끼실수 있을거에요!!! 파파 사랑합니다  
20170425,1,핵노잼 내 30년인상중 최악  
20170425,10,아침에 영화를 보고 하루종일 홍보하고 다녔어요 ㅋㅋㅋ 진짜 너무너무너무너무 좋은영화고 모든사람들이 꼭 봤으면하는 영화입니다!!!진짜꼬옥!!  
20170425,10,고통이 없는 삶은 없다.  
20170425,10,대사하나하나가 깊은 생각을하게하는 느낌ㅜㅜㅜ진짜 멋있었당!!  
20170425,10,"소중한 사람을 잃었던 친구가 생각나고, 나를 되돌아보게 만드는 소중한 영화였습니다.  "
20170425,10,소설도 정말좋아해서 잘표현될지 우려했는데 영화 넘잘만들었네요ㅠ 사랑하며 잘살아보고싶게 만드는 영화  
20170425,10,관람객충분히 감동적이었던 영화였습니다.  
20170425,3,눈물나는.포인트 가끔 있다만 . 잠오고 분위기 넘 조용.. 그리고 신앙자 아닌 사람 입장에서 보니 좀 오글거리는 부분도 있었음. 그래도 왜 신앙을 믿는지 조금은 알겠더라  
20170425,10,그냥 막 너무 좋다!! 다른 말이 필요없음!!  
20170425,10,관람객원작소설을 영문으로 여러번 한국어로도 여러번 읽었기에 큰 기대는 하지않고 좋아하는 책을 영화로 만들었다기에 호기심에 보았는데 전혀 실망스럽지 않았고 가슴 따뜻해진채 나왔네요.  
20170425,8,관람객믿음. 주님의 자녀로써 사는삶 . 늘 느끼며 감사하며 살아야 하는데 미물이다 보니 자꾸 잊고 죄를 짓고 있습니다. 속상합니다. 고해하고 다시 기도 드립니다.  
20170425,1,관람객늦잠자는 바람에 영화를 못봤네요 ㅠㅠ 나중에 기회가 되면 보고싶네요 ㅠㅠ  
20170425,10,관람객너무너무 좋았어요...  
20170425,10,정말 많이 울고 은혜로운 시간이였습니다조껀없는 하나님의 넘치는 사랑을 받으세요~^^  
20170425,9,관람객우리가 삶속에 만나는 여러가지 질문들에 대한 대답이 있습니다.  
20170425,10,땡스갓~ 삶속에서 함께하심  
20170425,10,알 수 없는 기쁨이 흐르는 영화  
20170425,10,두고두고 꺼내볼 수 있는 영화  
20170425,10,책으로도 봤지만 영화도 너무 좋아요 섬세한 묘사와 영화 속으로 빨려들어가는 듯한 힘?  나올 땐 마음도 가벼워지는 느낌이에요  
20170425,8,한번쯤은 볼가치가 잇는영화  
20170424,6,관람객내가본건 아니고 엄마가 재밌었데요  
20170424,10,누구나 가지고 있는 마음 속 상처와 아픔을 어루만지고 토닥여주는 영화... 고통의 족쇄에서 벗어날 수 있게 하는 사랑의 힘!  
20170424,10,성삼위하나님의 마음도 섬세한 대사표현도 너무 감동적이었고 인간들 스스로가 정의의 판단의 주인이 되어있는것을 지적할때 많이 찔림이 있었습니다. 나 스스로도 이시대쉽지 않은 용서와 화평앞에 눈물이 나게 하네요..  
20170424,10,하나님의 사랑을 깊이 느낄 수 있었습니다..! 너무 감동적이예요ㅠㅠ  
20170424,9,"I forgive you. 너무나 어려운 말이다.기독교적인 영화지만 고통과 용서, 치유의 이야기다  "
20170424,10,와 이 거 책으로 봤을때 무종교지만 뭔가 힐링되면서 소름돋는 기분이였는데 영화로 나왔네요. 중간고사 끝나고 보러 가야겠다  
20170424,9,관람객잔잔하고 심금을  울리는 감동을 줍니다  
20170424,10,"신이 있다면 왜고통이 있는거지? 신에 대한원망과 분노가 있다면 , 그 근원적인 물음 앞에 답을 제시해주는 영화. 연기 탁월, 그래서 더 몰입되어 마치주인공의 분노와 신을향한 질문에 몰입되어 마치내가 답변을듣는것같은..그런기분  "
20170424,1,장난똥때리나 열자쓸말ㄷㅎ없다  
20170424,10,정말 감동이었어요. 상처가 있으신 분은 정말 힐링이 제대로 되겠어요. 주인공을 보며 저희 아버지를 보는것 같더라구요. 신은 선인이나 악인이나 모두가 자신의 자식으로 본다는 메세지더라구요. 그 누구도 지옥불로 보내는 심판을 할수 없다는 거지요  
20170424,10,관람객슬프지만 아름다운 영화입니다  
20170424,10,정말 감동적이였어요!  
20170424,10,관람객영화오두막 정말 인상깊었습니다  
20170424,10,원작의 내용을 너무 잘 살린 영화입니다. 화면 구성도 너무 좋구요ㅎㅎ 무엇보다도 원작의 감동이 전해져서 너무 좋은 영화에요  
20170424,10,"책도 재밌고. 영화는 돈주고 다운받아서라도 두고두고 봐야할 영화. 하나님에 대하여 너무나 많은것을 담고 있고, 생각할 수 있는 영화.내 삶에도 하나님이 일하고 계심에 감사-  "
20170424,10,오랜만에 와이프와 극장가서 보면서 서로 몰래 펑펑 울다왔네요.  아이를 키우는 입장에서 보면 더 감동일듯 싶네요.  
20170424,10,처음에 이런영환줄 모르고 시간에 맞춰서 본 영화다...보고난 후 내 인생이 변한듯하다  
20170424,10,관람객완전 최고입니다. 완전 힐링....  
20170424,8,"초반에 지루함이 쫌 아쉽지만, 뒤로 갈수록 너무 주옥같은  대사들때문에 감동이 컷다  "
20170424,7,관람객볼만한 영화입니다 좋은걸 알려주는 영화입니다.  
20170424,8,언젠가는 우리 모두가 치유되길...  
20170424,10,올만에 좋은 영화 입니다  
20170424,10,많은 기대 없이 봤는데.. 강추합니다.  
20170424,10,사랑이란 단어를 알게해준 영화  
20170424,7,관람객약간 지루할수 있음 눈물 포텐터지는건 딸가진 부모의 슬픔 부분이고그외의 부분은 너무 심오해서 그런지 별로 ..  
20170424,10,우리나라 교회 안에선 절대 나올 수 없는 내용의 영화 ㅋㅋㅋㅋ 정말 잘 만든것 같아요~ 하나님 성품을 잘 표현하신 것 같아요. 영상미도 한 몫한듯  
20170424,8,"사람은 사람일뿐, 사람으로 태어났으니 증오도 하고 하는거지영화자체는 나쁘지 않았음.  "
20170424,5,"와닿는게 있겠지 참고 보았으나 결국 중간에 나옴. '거짓말하는 아들과 퉁명스러운 딸 중 어느 자식을 천국, 지옥에 보내겠는가' 물을때 바로 나옴. 그게 딸 유괴살인범 얘기하다 나올 얘기인가. 논리가 없음. 원래 종교란 논리가 없다지만..  "
20170424,9,시대의 아픔을 치유하는 영화.누구나 공감될듯...  
20170424,10,종교영화이지만 교회를 마냥 찬양하지만은 않는 영화. 영화에서 신을 볼 때 종교적 관점으로 보지말고 자신을 아껴주고 사랑하는 인생의 선생님으로 보면 좋을 듯 하다. 용서하는 것은 어렵지만 복수심은 부정적영향을 끼친다는 것을 상기시켜준다.  
20170424,10,좋은영화네요  종교적인게 잇긴하지만 전 무교거든요 근데도 참 다시살게되는 영화입니다. 추천드려요  
20170424,10,"보는 동안은 조마조마했는데, 보고 난 이후에 여운이 오래 남았고, 진짜로 힐링이 많이 된 것 같아요. 영화를 본 후에 정말 오랜만에 깊은 단잠을 잤어요. 참 좋은 영화입니다.  "
20170424,10,관람객정말 잘 보았습니다.감정의 절제가 좋았어요.  
20170424,3,"미국 영국 독일 이런데서 오두막 OOO기라고 욕하고 라이프오브파이는 이안감독 능력이었다고 난리인데;; 우리나라 네티즌들은 영화평 정말 이상하다. 명작에 짜게주고 7번방,국제시장에 극찬하고 참나.. 네이버 영화평점 보다 로튼토마토 메타크릭스로 보세요  "
20170424,9,"사실 별로 저쪽 종교를 좋아라하는 사람은 아닌데, 어쩌다 보니 이 영화를 봤다.  많이 정적인 영화이지만 울림이 있고, 지금 딱 필요했던 영화인 것 같다.  "
