0,1,2
20170920,9,관람객지치고 위로가 필요한 사람들을 위한 영화  
20170920,9,뭔놈의 판타지가 세드엔딩이노....재밌게 봄. 강력추천  
20170920,7,아이들이 보기에는 심각하고 어른이 보기에는 설명이 장황하다. 하지만 성장영화로서 상당히 매력적이다.  
20170920,8,관람객마음이 찡한게 눈물났던ㅠㅠ  
20170920,10,"관람객분리, 양가감정, 억압, 죄책감에 대한 영화  "
20170920,10,오랫만에 정말 좋은 영화였습니다.  
20170920,8,도망친 나는 하염없이 울 수밖에  
20170920,1,댓글알바속지말자 졸다가 목뿌러진다  
20170920,9,관람객12시07분  잔혹한 12시07분 그래도 소년은 살아가야겠지... 안타까웠다.  
20170920,10,내나이 50 그어릴적 가정과 부모에 대한일들로 괴로울때  누군가가 괜찮다고 해주었으면 얼마나 좋았을까 말못하고 꾹꾹눌러담기만하고 참으라만했는데 지금 홧병으로 몸이 다망가짐  영화보는동안 얼마나 울었는지....  
20170920,8,관람객슬픈 성장드라마.. 주인공이 짠하다  
20170920,10,그루트 횽이왜 거기서나와?  
20170920,7,내 속에 어느 한 부분은 내 세상에만 존재하는 것. 어쩌면 묻어둬야 할 부분도 있는 것. 그런데 그것이 내 소중한 것을 지키는 방법 중 하나라는 것.  
20170920,9,관람객보는내내 너무 맘이 아팠다주인공 아이의 심리가 얼마나 복잡하고 힘들었을지..  
20170920,9,인간이기에 인간스런 나를 너무 미워하지 말자  
20170920,1,아무리 좋은영화면 뭐할까. 도저히 끝까지 볼수 없는걸... 많은 사람들이 탄식속에 중간에 영화관을 나가게 하는 마법의 영화  
20170920,8,관람객주인공 소년의 연기력이 대단하네요가슴아픈 성장기를 판타지스럽게 잘 만든 영화  
20170920,7,관람객소재와 영상미는 좋았으나 연출이 아쉬웠다.  
20170920,9,"마주하고싶지 않은 인간 내면에 숨겨진 상실에 대한 두려움과 슬픔, 분노, 좌절감, 죄책감, 선과 악의 공존..이런 인간의 감정을 직면하고 진실과 마주할 때 거기서 오는 반전과 성장을 주인공 코너와 몬스터를 통해 그려나간 영화.  "
20170920,8,애기 연기 너무 잘한다 진짜....  
20170920,6,좋은 영화고 많은 생각을 하게 하지만 그렇게 대단한 수작은 아닌듯. 판의미로가 훨씬 좋음. 그리고 그렇게 슬프지도 않음. 극장내 30명 단 한명도 안울음  
20170920,7,뻔한 이야기 뻔한 상황이지만 뻔한걸 알면서도 슬프고 눈물난다  
20170920,10,보세요. 정말 후회하지 않을 영화입니다.  
20170920,9,자신과 마주해야만 했던 아이.  
20170920,1,"예.빡쳐서 후기쓰게하는 오랜만의 영화인데요. 저도 감동스럽고 명작일줄알고 봤습니다만. 스케일크게만든 외국영화치고 판타지적인요소와 아이가 주인공인데도 불구, 삼류다. 딱 삼류입니다. 지루하고 또 지루하고. 의미도 없습니다. 다들 시간버리시지않기를..  "
20170920,10,정말 너무 좋은 영화였다.. 너무 펑펑 울게됬지만 정말 누구나 한번쯤 인생에서 잃어버린 기억이 있다면 감명깊을 영화..!  
20170920,7,상처를 마주보게 하여 용기를 북돋아 주는 이야기.  
20170920,10,영화보다 나도 모르게 눈물이..주변에 아픈 사람이 있거나 힘들일이 있을때 보면 위로가 될 영화~  
20170919,10,이게 솔직히 정보없이 보면 뭔내용인가 어리버버한데 그날밤에 자려고 누우면 계속 아련아련하다  
20170919,10,남녀노소 누구나 겪을..겪었을 상실의 아픔을 판타지로 잘 버무린 감동적인 영화  
20170919,5,"....저..왠만한영화 다 즐겁게보는 스타일인데요....여기 글이 다왜이런지 이해가 도무지 안되서 글쓰는데요...감동에,눈물에 어쩌구 할 정도는 아닌것같은데 여기 평들왜이러죠??ㅠ 많이지루하구요 많이 뻔하구요.. 영상미는 뭐 동화같기도하고 좋아요...  "
20170919,7,솔직히 공감이 안갔습니다. 저는 집에서 사랑을못받고 무관심속에 학대받으며 자랐거든요.. 그래도 잘만든 영화라 생각됩니다  
20170919,1,보다가잠듬...조금시시하네요  
20170919,10,원피스 버스터콜 현장보다 더 슬프다  
20170919,8,기대한것보다좋았어요  
20170919,1,너무 뻔한 스토리 안보시는걸 추천합니다  
20170919,10,눈물이..ㅠㅠ 꼬마가 연기 참잘하네요~~힐링 됐어요ㅠ  
20170919,10,마지막에 나도 눈물좀  흘렸다.ㅠㅠ 강추하는 영화.  
20170919,10,이별을 겪는 어른을 위한 현실적인 동화  
20170919,10,영상미가 돋보이고 내용도 좋았어요.  
20170919,10,관람객정말 진정성을  느끼게 해준 영화네요 너무 잘봤습니다. 가슴이 뭉클하면서 너무 슬펐네요..ㅜㅜ  
20170919,10,"현실적이기에 통쾌한 한 방은 없지만, 그래서 더 위로가 된다. 현실을 살아가는 상실을 경험한 사람들을 위로하는 이야기.  "
20170919,10,동화같은 현실 현실같은동화속 한 소년  
20170919,6,공감은 가는데 진부한 스토리라 좀 졸렸음...  
20170919,10,"완전히 나쁜 인간도, 착한 인간도 없다. 그러기엔 인간은 너무 복잡한 존재이니까. 잔잔하고 완성도높고 몰입도있게 잘 풀어낸 소년의 심리치료과정  "
20170919,10,관람객본질적인 것을  다시 생각케 하는 영화.  근간들어 본 영화중에 가장 좋았음.  
20170919,8,관람객재미있어요 완전히 빠져서 봤어요  
20170919,1,에이 아메리칸을 봤어야 했는데 진짜 재미없음  
20170919,10,"저 깊은 곳의 너의 진실을 말하면 돼, 자책하지도 반성도하지 마라..니 잘못이 아니야..너는 충분히 사랑받아야  하고  힘들면 힘들다고  소리질러야 해..넌 그럴자격이 충분해!  "
20170919,10,관람객재미나게 보았습니다~  
20170919,8,오만가지 생각이 다 든다. 살아계실때 자주 얼굴 뵈야한다.  
20170919,10,관람객이런 몬스터가 있었으면 좋겠다  
20170919,8,관람객아... 조금만 더 힘을 냈더라면 9점까지 갈 수 있는 영화인데... 어쨌거나 삶은 슬퍼도 아름다운 것.  
20170919,10,존나 조용히 소리지르면서 꺽꺽대며 움ㅜㅜ 너무 슬퍼요  
20170919,7,관람객진짜 오래간만에 영화보고 울었어요ㅜㅜ감덩감덩쓰  
20170919,10,엄마와의 이별을 받아들이기까지의 과정이 너무슬프다 ㅠㅠ  
20170919,9,이별을 대처하는 방법에 관한 영화  
20170919,10,관람객여운이있는 영화입니다  
20170919,10,"배우들의 연기 좋고 감독의 연출력,영상미또한 뛰어나다.하지만 갸우뚱했던 영화의 주제는 리뷰를 보면서 또렷해졌다..그러나 갸우뚱 하던중에도 나도모르게 흐르는 눈물이 있었고,,.그 눈물은 현실 마주하고 그 현실을 인정, 극복하며 치유하는 지금의 나를본걸까  "
20170919,10,"""네 마음 가장 깊은 곳에 진실을 말하면 돼""사랑하기 때문에 더욱 더 가슴 아프다!사랑, 이별, 그리움... 그 고통을 승화 시키는 방법을 동화적으로 아름답게 그려 냈다! 마음 한 구석에 자리잡고 있는 응어리가 뻥 뚤리는 힐링 감동무비다!  "
20170919,8,"어릴 적 할아버지를 떠나보낼 떄.낯설고두려운 마음 때문에 누워있는 할아버지를 똑바로 마주하지 못했다. 어릴 적 나는 그상황에서 도망쳐버렸다.사랑한다,떠나지 말라는 말 한마디 하기가 뭐가 그리 어려웠을까.엄마가 말안해도 다안다는 장면이나를위로해 줬다.  "
20170919,1,무슨 영화인지 도대체 모르겠다. 뮌 개소리 하는건지 그냥 구해줘나 봐야겠다.  암유발 영화  
20170919,8,집중이 안 됐을까?...저에게는 그다지 와 닿지 않는 영화였는데 영상미는 좋았습니다  
20170918,9,좋아요.많이 울었네요성인에게도  좋은 성장영화라고 느껴요  
20170918,10,극복의 의미를 잘 부여해준 영화꼭 보기를 추천합니다  
20170918,8,현실을 받아들이는 아이의 성숙화... 아역의 연기에 감탄하고 간다.  
20170918,9,"<빅 피쉬>에 필적할 만한 힐링, 성장영화의 등장  "
20170918,8,예상보다 다크했던 소년의 성장이야기이자 감성판타지였다. 가슴을 울리는 순간적인 임펙트가 크지는 않지만 여운은 진하고 길게 남는 작품.  
20170918,1,재미없는 영화 입니다..  
20170918,5,"흔한주제가아니고, 애매하고 잔잔하다.  착함과 나쁨은 구분지을수없고 매일 매시 달라진다.  "
20170918,10,평점 알바가 아닐까 생각했지만.. 이건 진짜에요.인생을 산 세월만큼 경험만큼 느껴지는 바가 큰거같습니다.  가슴속에서 눈물나오고 올해본영화중 가장 힐링되는 영화였습니다. 몬스터콜 짱!  
20170918,10,어른들을 위한 힐링 영화.. 괜찮아 라고 말하지만 견디기 힘들었던 아이의 모습이 나의 모습인것 같아 눈물이 하염없이 났음.. 주인공 아이의 얼굴이 어찌나 슬프고 짠하던지.. 내면 연기에 감탄~~~  
20170918,9,관람객간만에 억지스럽지않게 눈물흘린듯  
20170918,10,내안에 있던 죄책감이 몬스터를 만나 위로 받은 느낌이었다  
20170918,6,관람객요즘시대에 맞춰 아이의 감성이 그대로느껴진 영화네요  
20170918,10,관람객제발 봐주세요 한번만 봐주세요... 정말 오랜만에 수작이었음 정말 최고예요  
20170918,10,올해 본 영화중에 제일 의미있는 영화였다 영상미가 예쁨 그리고 눈물이 줄줄  
20170918,10,어릴적 상상속 수호신. 환타지속상처를 치유해주는 영화  
20170918,6,"단점은 지루하다, 장점은 다른사람이 설명해줄거야  "
20170918,10,관람객감동적이었습니다. 엄마가 회복하기를 바라는 마음과 고통이 빨리 끝났으면 하는 마음..사실은 엄마를 위한 마음이었음을 알게된 주인공에 몰입해서 관람했습니다  
20170918,9,관람객어른과 아이의 성장을 위한 영화  
20170918,1,오랜만에 푹 잘 수 있도록 도와준 영화...  
20170918,7,나는 모르겠더이다... 다들 우는데...  
20170918,6,개인적으론 그닥... 우리나라 드라마 같은에서 자주 소개되던 소재고 내용이라.. 그럴줄 알면서도 혹시나 해서 기대하다가 역시나 그런... 외국사람입장에선 슬프고 신선할수도 있겠다 싶네요. 하지만 우리나라에선 그닥... 슬픈지 잼있는지 모르고 봤음.  
20170918,10,영화 시작부터 끝날때까지 눈물이 멈추지가 않았다.  
20170918,1,"마치 평점을 보면 나만 머리가 나쁜가 싶다. 너무 졸려서 중간중간에 졸았다... 이해하기도 어렵고, 전체적으로 쉽게 즐길 수 있는 영화는 아닌 듯.  "
20170918,10,관람객마음 속 깊은 진실을 마주하는게 가끔은 힘들때가 있지만그래도 마주봐야한다 그래야 앞으로 나아간다  
20170918,7,생각보다 별로.. 내용이 임펙트가 없음슬프다고 하는데 라디-엄마 노래가 천배 더슬픔.연출이나 영상자체는 인정.  
20170918,8,어머니의 사랑을 느꼇습니다 영화자체로는 잔잔하게흘러가나 여운이 깊네요  
20170918,10,영화 말미쯤 사춘기 딸이 엄마인 저의 손을 잡았습니다.참 좋은 영화입니다.  꼭 아이들과 함께 봤으면 좋겠습니다.  
20170918,10,보는 내내 제가 영화 속의 남자아이가 된 것 같았어요. 몬스터의 위로.. 따뜻하게 잘 받았습니다. 생각도 못한 선물을 기습으로 받은 기분이에요.  
20170918,9,아이들보여주러 갔다가 내가 감동하고 온 영화에요 아이들은 초고학년이상 이 좋을거 같아요 ...대본집을 갖고 싶을정도네요  
20170918,8,관람객아름다운 동화를 읽는 듯...성장영화로 추천!  
20170918,9,"관람객어려운 영화이긴하나, 치유되는 느낌. 외면하고자했던 나쁜 모습의 내 모습도 다독여지는 느낌.  "
20170918,10,슬프지만 헤쳐나가야할 길.. 상처를 위로하며 용기를 주는 마법 같은 작품  
20170918,4,"워낙 평들이 좋아서 무난할거라는 기대와는 달리 보는 내내 불편했던 영화. 배우들의 연기력과 섬세한 표현법, 새로운방식의 기법이 주는 묘미는 좋았지만, 억지스러울 정도의 스토리진행과 반복되는 의미없는 장면들. 돈 주고 보기 아깝다.  "
20170918,8,"그래, 나도 어렸을 땐 나도 내 안엔 괴물이 살고 있었어.  "
20170918,8,나도 내가 냉정한건가 싶어서 누가 알게될까봐 무서웠었는데. 남들도 그렇구나 알게되서 다행이다...  
20170918,10,올해 최고의 영화였다. 영화가 마음을 울린다는게 뭔지 실감함. 코너 오말리가 자꾸 생각난다.  
20170918,1,작품성은 인정. 대중성은 딱히... 평점이 좋아서 기대했는데 다들 진짜 보고 쓴건지. 아니면 나도 이만큼 감성적이다 이런 티를 내고 싶은 건지. 재미는 진짜 없다. 지루하다. 상상과 현실의 애매모호한 경계선. 현실은 정신병 걸린 아이?  
20170918,10,냉정하고 잔인한 현실을 마주하는 방식을 가슴 따뜻하게 그린 최고의 영화. 억지 신파따위로 흉내낼 수 없다. 눈물을 참기 힘들다.  
20170918,10,상처있는 어른들을 위한 동화다. 가슴이 먹먹하고 공감 하게 된다  
20170918,10,엔딩 크레딧 올라가는데도 계속 눈물이 흘렀네요.  내일 어머니에게 안부전화 해야겠다.  
20170918,10,"일요일머다 극장가는데, 감히 올해본 최고의 영화. 마지막 장면 보고 눈물이 나는데 숨길 틈도 안주고 켜지는 극장 불빛이 야속했다.  "
20170918,9,"관람객화가나면 화내도 돼, 아무도 널 벌주지 않아  "
20170918,9,관람객소년의 담담함이 더욱 더 슬픔을 자극했다.  
20170917,9,잘 만든 영화입니다. 재미와 감동을 다 잡았네요.  
20170917,6,솔찍하게 감동은 덜하지만 볼만은 했다연기도 좋고 cg도 나쁘지 않음  
20170917,10,"상실, 두려움, 회피, 상처를 보듬어주는 진정한 힐링 시네마. 아름답고도 슬픈 이야기속에 따뜻한 감동이 있다  "
20170917,10,마지막 엄마 품에 눕는거 보고 눈물을 엄청나게 흘렸다..  
20170917,10,영화가 주는 교훈이 많다. 이 영화는 내가 어떻게 살아갈지 생각해보는 시간을 주었다.  
20170917,7,관람객동화라는 표면 밑에 잠식하고 있는 실존의 문제  
20170917,10,저 어린것도 진실을 마주하는데 이런 고난이 있건만..우리 어른들은 어쩌란 말인가..보는 내내 나는 할수 있을까를 생각한 영화.  
20170917,10,이 영화를 극장에서 안 봤다면 평생 후회했을 것이다 ㅜㅜ  아이가 연기를 너무 잘해ㅜㅜㅜ  
20170917,10,내면을 표현하는 방법과 전해져오는 감동. 소년의 마음이 그대로 느껴져서 펑펑 울다왔다.  
20170917,10,휴지 꼭챙겨가삼 리얼루다가 존나슬 ㅡㅁ  
20170917,10,자신의 거짓같은 진실의 마음에 마주할수있는 용기가 가끔은 필요하다.  
20170917,8,기대보다 좀못미침...내용도..먼가부족한 감이있는거같고...특별히 기억될만한 소재도없고...다른영화보는게 나음  
20170917,10,와....! ㅎㅎ...  
20170917,8,내용이 크게 나쁘진 않았는데..  
20170917,10,5학년 아들과 함께 봤어요아들도 울고 나도 울고...  
20170917,10,Your mind will believe comforting lies while also knowing the painful truths that make those lies necessary.?  
20170917,10,어른이를 위한 영화...  
20170917,9,"관람객긴 병에 효자 없다고, 엄마의 손을 놓아버린 코너 오말리와 그런 자신을 직시하고 극복하게 도와준 주목 나무 몬스터. 엄마를 떠나 보내는 힘든 과정을 아기자기한 그림과 상상력으로 따스하게 풀어내었다.  "
20170917,10,관람객지재미이던디 지재미가지재미였어 근데 마지막에 그림 주인공 마미가 그린건가  
20170917,10,관람객어린시절 안좋은 추억이나 경험이 있던사람은 공감할 이야기  
20170917,10,루이스 맥더겔 존나 잘생겻음 씨발 잘생긴거 좋아하시는 분은 꼭 보세요  
20170917,10,아름다운 이별을 준비하기 위한 영화  
20170917,9,이렇게 연기 잘하는 꼬맹이를 본적이 없다..사랑하는 사람의 죽음을 마주할때 우리가 겪는 혼란을 몬스터를 통해 훌륭하게 표현해 냈다.  
20170917,10,영화는 완벽한데 이 영화 보러 영화관에 12세 미만 애들좀 데리고 오지 마세요. 영화 보는 내내 너무 화났음. 이건 애들을 위한 판타지가 아님. 판의미로 제작진들이 만든 영화를 애들이랑 보러 온다는 것 부터 미스.  
20170917,9,내안에 내가 만들어 낸 또 다른 나  엔젤이 아닌 몬스터를 접목하여 인간이 항상 따뜻한 마음으로 삶을 살아가는게 정답은 아니다라는 생각이 드네요  
20170917,10,영화 볼 때 운 적이 별로 없었는데... 주인공에 아주 몰입해서 그런지 마음이 먹먹하고 아직 여운이 가지 않았어요. 간만에 어머니하고 좋은 영화 봤습니다. 원작도 읽고 싶네요.  
20170917,9,내 마음속 몬스터에 대해 생각해본다  
20170917,9,힘들거가 괴로울때 이영화보시먼 치유되는 느낌이랄까  
20170917,10,"마음 속 깊은 내면을 건드리는 대사들. .너무나 큰 감동 입니다. 우리모두에게도 각 자의 ""몬스터""가 있겠죠 ^^  "
20170917,9,"관람객우리들의 곁에도 이런 몬스터가 있었더라면... 서로에게 더욱 솔직해지고, 더욱 아끼고 사랑하고, 이별도 슬프기보단 아름답게 만들 수 있었겠지.  "
20170917,8,어두움은 성장의 발판이 되기도...  
20170917,10,"관람객현실적인 이야기를 동화처럼 풀어낸 영화. 아름다운 영상은 눈을 즐겁게 했고, 주인공이 겪는 일과 감정들이 결코 우리와 동떨어진 이야기가 아님에 많은 생각을 하게했다.  "
20170917,10,마음의 상처가 깊을때보면 큰 도움이 될 영화  
20170917,9,관람객따뜻하고  감동을주는 영화입니다이야기하나 상황에 맞는 뜻이있ㅇㅓ 재미있게봤어요  
20170917,10,너무 감동적이었어요. 아이랑 함께보면 더 좋아요. 인상깊은 영화 강추입니다.  
20170917,10,슬프다..흐엉....  
20170917,9,어른을 위한 힐링동화 영화입니다  
20170917,2,"어린이 성장영화. 유치하고 재미도 없음.차라리 '베이비 드라이버' 가 8점정도로 볼만하고,실화를 바탕으로한 '어메리칸메이드' 9점 강추.  "
20170917,10,기대이상 재밌습니다!ㅠ  
20170917,10,올해 최고의 영화. 진실앞에 마주한 당신의 모습을 보라  
20170917,8,"세상이 너무 썩어서, 가끔은 그래도 이런 순수감성영화보면서 묵은 정신적때를 벗겨내고싶어진다. 그런데 이 영화현실성충만한동화이고, 상당히 심오한 주제로 안내하더구나.리암니슨은 쥔공의 외할아버지다  "
20170917,10,영상이 너무 아름답고 소년의 연기가  정말 좋았다.  
20170917,10,진짜 거짓말 아니고 눈에서 눈물이 흐릅니다 오랜만에 감수성 풍부한 영화였습니다  
20170917,10,정말 중요한게 뭔지 깨닫게되는영화였어요 저에게 이런말을 하게끔한 첫번째영화였어요 -평범한20대남자-  
20170917,9,"관람객많이 슬프지는 않습니다. 그러나, 많은 것들을 생각하게 합니다. 단, 보는 이의 나이에 따라서 달라질 수 있습니다 .  "
20170917,10,감동적이다. 정말 눈물이 계속 흐른다.  
20170917,10,상실을 경험한 나에게 와 닿는영화였다. 놓쳐버리고 마는 놓고 싶지 않은 손... 가지말라고 소리라도 쳐볼수 있었으면. .  
20170917,10,관람객스토리 연기 모두 10점!  
20170917,10,"판의미로 좋아하시는 분들이라면 ^^ 역시 기대한 것처럼 좋은 영화였습니다!! 따뜻한 위로가 됐습니다, 소장하고 싶어요~!!  "
20170917,10,잘봤습니다 뭐라 얘기하기 어렵네요 점수만 남길게요모든 영화는 기대는 안하고 보는게 더재밌는것 같아요  
20170916,7,관람객관객들이 많이 우네요.  
20170916,9,치유라는 너무 아픈이야기.... 간만에 너무 좋은영화였다.  
20170916,6,눈물나서 혼났네 10자  
20170916,10,"자신이 혼란스럽고 불행할때 찾아오는 몬스터.. 그 감정의 산물...그때, 그 몬스터가 가르치는 냉혹한 진실을 받아들이고 성장해야만 극복할 수 있다. 아니면 너 자신이 몬스터가 된다.  "
20170916,10,가슴찡한이야기...잼있습니다~  
20170916,2,무엇을 전달하는건지.근 5년만에 진심으로 최고로 재미없었다..모든관객이 나오면서 하는말이 똑같다. 아 돈아깝다고..평점과 댓글이 너무너무 부풀려있다..진짜 너무 부풀려있다.관객수가는 거짓을 하지않는다  
20170916,10,자칫  지루해지기 쉬운 슬픈 영화를 몬스터의 등장으로 지루하지  않고 끝까지 흥미롭게 이끈 것에 박수를 보냅니다.  
20170916,10,"영상미, 줄거리, 연기력 모두 좋았습니다. 꼭 보세요!  "
20170916,8,현실을 이겨내고 싶었던 소년의 아픔이 절절하게 와닿는 영화였다. 소년의 눈빛이 기억에 남는 영화  
20170916,10,슬프다는것도 이야기 안해주면 더 재밌게 볼거 같은데..  
20170916,10,작품은  10점 주지만 지루하고 재미는 없습니다. 이런거 못보시는 분은 피하시길..  
20170916,7,"누구나 선하고 악해질 수 있다,  신념을 끝까지 지켜라, 어떤 상황이든 용기를 내라 >> 이런 현실을 받아들이고 진실을 추구하라  "
20170916,10,몬스터를 불러낸 건 코너였을까요 엄마였을까요  
20170916,10,"나중에 이 마지막 순간에 아무 말도 하지 않았던 것을 후회하지 않아도 돼, 괜찮아.  "
20170916,9,관람객처음에는 뭐지?했는데 볼수록 보길 잘했다는 생각했어요  
20170916,10,눈물을 참으려고 해도 참을수가 없네요 정말 명작입니다  
20170916,9,정말로 훌륭하군요. 기대 이상의 영화였습니다. 원작도 찾아봐야 겠어요.  
20170916,10,부모님이 두분모두 병으로 떠나셨기에코너의 마음이 너무 이해되었습니다또한 한 아이의 부모이기에 코너 엄마의마음또한 너무 이해가 되어 목놓아 꺼이꺼이울었습니다 딸아이 역시 너무많이 울어서 ㅜ제 인생영화가 될듯 합니다 큰 위로가 되었습니다  
20170916,10,진짜 꼭 보세요~이 영화 최고임!! 진짜 많이들 봤으면 좋겠어요~ 아 그리고 휴지 꼭 챙겨가세요! 눈물이 안멈춤...ㅠㅠㅠㅠ  
20170916,10,진짜 너무 감동적임 휴지 꼭 챙겨가야 하는 영화  
20170916,10,"내가 기억하지 못하는 어린 시절, 엄마에게서 들었던 나무 괴물이 나타나 나를 지켜주었다. 내가 힘든 일을 이겨낼 수 있었던 데는 어린 시절 엄마와 나의 유대관계가 있었다. 앞으로가 걱정되지만 나는 잘 할 수 있다. 할머니 고마워요.  "
20170916,10,관람객돌아가신 아버지 생각과 제 아이들을 잘 챙겨야겠다는 마음으로 더 눈물이 났습니다.  
20170916,10,정말 마음 깊숙이 따뜻해지는 영화예요.가을로 넘어가는 이 계절의 감성과 가장 어울리는 영화이지 않을까 하는 생각을 해 봅니다.  
20170916,1,"..,,..,,..,,  "
20170916,10,나는  눈물을 또 참았다.엄마를 놓은게 아니고 ..나의 고통을 놓았다.. 라는 대사에서 가슴이 뜨거워지고 얼굴은 일그러진다. 고통의 진실과 대면하는것은 대단한 용기가 필요하다.또한 왜곡을 바로잡아주는  어른이 필요했다  
20170916,10,왜 현실은 동화와는 달리 해피엔딩이라는 결말이 없었을까 싶었다. 몬스터의 이야기들도 실질적으론 현실과 동반된거였기 때문에 현실적 결말을 맞은거였다. 아직 아픔을 마주하고 어른이 되기엔 너무 어린 아이인데 그런 현실을 받아들이는 부분은 너무 슬프다.  
20170916,10,생각없이봤다가 눈물쏟고나왔다ㅠㅠ  
20170916,4,관람객영상미가 이뻣지만 약간 좀 지루 햇어요...  
20170916,7,관람객그냥 그랬음.그냥그랬음  
20170916,9,"관람객성장통, 현실은 결국 잔인하지...나도 우리도 살면서 참 많이 아파하다가 그렇게 늙어가는거겠죠.  "
20170916,10,너무재밌고 슬펐다 올해 최고의영화  
20170916,10,성장영화라는 측면에서 스티븐 킹 원작 롭 라이너 감독의 스탠 바이 미나 일본 환타지 애니 브레이브 스토리를 연상시키는 작품.퀄리티는 길예르모 델 토로의 판의 미로와 오필리아의 세개의 열쇠 못지 않음  
20170916,10,어른들에게도 읽고 보면서 눈물을 흘릴 수 있는  동화는 꼭 필요합니다. 이런 영화에 굳이 평가가 필요할까요.  
20170916,1,재미없어서 보다가나옴  
