0,1,2
20180303,7,개연성 없는 전개와 마무리에 잠시 당황  
20180303,1,솔직히 이승기랑 여주만 믿고 보려고했는데.. 딱전개대충보자마자 내용거의다 알겠고..할튼 ㄴㅈ  
20180303,2,내가 못알아드었나? ㅜㅜㅜ 사극이라서 예날말이 너무 어렵다 재미없어  
20180303,6,내용 부실. 연기력 부실. 감독 기획력 부실. 다만 가볍게 볼만하긴 함  
20180303,4,관람객영화와 나의 궁합은 맞지 않았다궁합이라는 거대한 틀 보단 차라리 봄날에 러브스토리로 홍보를 했으면  나았을수도  
20180303,10,관상 이후에 잠시 쉬는 타임  
20180303,9,관람객재밌었음.. 오글거리는 대사들이 많음..  
20180303,9,이승기는 여기서도 멋있구나  
20180303,8,관람객잼나게 봤어여~특히 여친이^^  
20180303,8,웃으면서 엄마랑 같이 재밌게 잘봤어요 ㅎㅎ  
20180303,10,가벼운 사극 코미디. 교훈은 덤 ㅎ  
20180303,10,"관람객영상미가 돋보이는 영화입니다. 궁합이라는 소재를 잘 활용하였다고 생각이 드네요. 잔잔하면서도 말랑말랑하고 풋풋한, 그리고 진정한 사랑이 무엇인지 생각하게끔 하는 봄에 잘 어울리는 영화입니다.  "
20180303,10,사실 이승기 보러 가긴했는데 예상밖의 재미가 ㅎ  
20180303,1,"관람객청춘사극, 영상미 좋지.. 근데 전개도 완전 맥 뚝뚝 끊기고, 얼토당토 않아서 보면서 짜증났다 원래 영화 댓글 알바라는거 잘 안믿는데 진짜 그런게 있는건가싶다  "
20180303,6,여러분 별점에 속으시면 안돼요영화 보고 엘레베이터타자마자어떤분이 재미더럽게 없네 해서공감하고 웃을뻔했다는..배우들 연기력이 아까움..조선마술사가 나음.  
20180303,10,아무리 남자들이 열폭하고 욕해도 아줌마랑 여자애들은 좋아할 영화다 ㅋ  
20180303,6,관람객시간 남을 때 킬링타임용으로 보기 좋은 그냥 그런 ..  
20180303,6,관람객너무  유치하고  재미없네요.. 40대들은 볼 영화  아닌듯  
20180303,8,관람객심각하지도않고 가벼운마음으로 보고왓습니다  
20180303,8,이승기 목소리에 심쿵한 아주미 하나 추가요^0^  
20180303,2,염병하네 이게 평점이 8.7? 0.87도 아깝;;  
20180303,8,관람객오랫만에 따뜻하구 아름다운 영화였습니다  
20180303,6,그냥..이승기 때문에 봤어요  
20180303,10,이승기 진짜 옜~~ 날에 비해서 연기 많이 늘은듯  
20180303,10,기대 안하고 봐서 그런지 재밌었음 배우들 연기도 좋고  
20180303,10,관람객사극이지만 재미있고 뜻깊은 영화였습니다.강~추!  
20180303,10,의외의 재미. 약간 하이틴 영화 느낌도 나고 ㅎㅎ 이런 영호 ㅏ자주나옴 좋겠다 ㅎㅎ  
20180303,9,잼나던데ㅠㅠ 남자들 다 잘생김 눈호강  
20180303,8,관람객걍 생각없이 볼수 있는 영화~  
20180303,1,관상보다 못한 영화 넘 실망이다 블랙팬서나 나중에 퍼시픽림 업라이징 봐야겠다  
20180303,10,뻔하지만 가볍게 ㅈ볼 수 있는 영화였다  
20180303,9,관람객기대 안했는데 나름 재밌었음심은경 너ㅠ너무 기여워..ㅠㅠ  
20180303,10,호불호가 딱히 갈릴만한 소재는 아닌거 같은데요  
20180303,10,누구나 즐길 수 있는 영화였습니다  
20180303,1,일점도아깝다OO노잼우리돼지꿈도 이것보단 리얼하다이것도영화라고만드냐이승기가 아깝다  
20180303,1,솔직히개노잼 반점도아까움  
20180303,10,그냥~ ㅎ시간이 많아서 봄 ;;  
20180303,8,어차피 남편은 이승기...  
20180303,4,관람객넘 기대하고 봤나봐요.  예상되는 전개에 좀 지루하고 진부한 내용이었어요  
20180303,9,남녀간의 사랑과 궁합에 ㄷㅐ해 이야기한다  
20180303,9,이렇게 웃긴 영화는 참 오랜만. 시작부터 깔깔깔.  
20180303,2,왜 평점이 높은지모르겠다..반전도 긴장강도없이 그냥 사랑타령...  
20180303,10,아오 오글오글ㅋㅋ 근데 묘하게 땡기더라 ㅋㅋ  
20180303,8,관람객담백한 전개가 좋았습니다  
20180303,10,관람객따뜻하고 색감좋은 가족 코미디  
20180303,10,요즘 볼거 없어서 어쩔수 없이 선택햇는데 재밋엇음 ㅋㅋ  
20180303,10,오랜만에 단ㄴ순한 영활서 괜찮았음  
20180303,4,"결말, 그리고 장면 하나하나가 예상과 너무 딱 떨어져 맞고 너무 진부하고 지루합니다 중간에 소소한 웃음 몇번. 저 포함 같이갔던 3명도 다 선택미스였다고 하네요... 같이봤던 관람객분들도 별로라는 말들이..그래도 연기는 다들 잘하시네요!  "
20180303,6,약간 어정쩡한 영화네요 미숙한부분도 많고... 기대를하고본걸까요..?  
20180303,10,관람객재미있게 잘 봤습니다 ~~  
20180303,10,"가족들, 연인들이 보기 좋은 영화같습니다.  "
20180303,2,코비디로 가릴 수 없는 지루함 운명에 휩쓸려 다니는 인간상  
20180303,1,"똑바로 평합시다.이게 영화냐?올해 최악의 영화가 될듯.다보고 나오는데 기가막혀서 헛웃음만나옴.배우들연기 잘 했는데, 감독 옆에 있으면 한대 때리고싵음.  "
20180303,8,다들 진짜 직접 보고 이리 평하는게요? 전후 작가가 바뀐 느낌은 못 받았소들?  
20180303,8,관람객재미와 감동까지! 굿굿  
20180303,10,관람객재밌음재밌음재밌음ㅋ  
20180303,6,돈주고보기 아까운영화.. 평점잘안쓰는데 이건써야겠네요. 왜 다들 10점을 주는지 의문; 진짜 알바생들인건지ㅜ_ㅜ 재밌는수준은 아닌것같은뎀.. 걍 이승기 심은경 팬이면 보러가세요  
20180303,4,평점 왜캐 높은지 진짜이해안됨..배우들이 아까운 영화.. 관상같은 영화 기대하고갓다가 내내 지루햇음옆에 아줌마 시작 30분도 안되서 코골고.. 중간중간 깨알 웃음 포인트가 잇긴있지만 전반적으로 유치하고 억지설정이 많음  
20180303,1,"진짜 궁금해서 그러는데 10점이 왜 이렇게 많죠 친구랑 많이 아쉽다 한 영화였는데,,, 심은경님 좋아하는 배우인데 이번작품과는 많이 맞지않고 연기 너무 아쉬웠어요. 작가님이 만든 공주 캐릭터도 설정자체가 미스인듯,, 내용은 뻔한 가벼운영화입니다.  "
20180303,1,정말 평점 이건 조작아니면 이정도 점수가나올수있나요? 정말 이렇게  지루하고 잼없는영화는 처음이네요 승기가 주연이라고해서 봤는데 근데 보는 내내 이건아니다라는 생각이들더라  승기야 니가 싫어서 그런거 아니다 정말 영화 넘잼없어서 지루해 죽는줄알았다  
20180303,6,관람객생각보다 별로임..너무 오글오글ㅜㅜ  
20180303,10,오늘봤는데 잼있게봤어요 ㅎㅎ^^  
20180303,1,아 네이버 평점 좋아서 봤더니 알바들한테 속았네ㅡㅡ오글거리고 유치하고. . 90년대 영화보는 줄  
20180303,10,관람객모두듫꼭 보세로ㅗ료료료료룡~!  
20180303,10,관람객달달합니다 인생에 사랑을 빼면 무엇이 남을까  
20180303,2,관람객어쩜 이리도 형편없는 시나리오로 배우들이 연기를 열심히 했네요노력에 박수를  
20180303,2,창고에서 2년 넘게 썪다 나온거 치고는 백만은 볼듯  
20180303,10,달달하고 포근한 영화네요 ㅎㅎㅎ  
20180303,7,인생에서 사랑을 빼면 무엇이 있겠습니까 > <  
20180303,10,승기씨사극에어울리고봄향기가득상큼하게영이화에빠져들게재미있게봤습니다  
20180303,10,관람객ㅋㅋ재미있었네요ㅎ추천이요  
20180303,6,관람객잔잔한영화였어요중간중간웃음코드쬬금씩  
20180303,6,관람객재미있게 잘 보고 봄날같은 영화.  
20180303,10,연우진 이번에 진짜 반햇음...연기도잘하고 잘생기구 악역이여도 진짜 좋았다..목소리 꿀...♡ㅎㅎㅎ  
20180303,1,간만에 영화관에서 잣음 졸작수준  
20180303,10,심은경은 이뻤고 이승기는 멋있던 영화. 주연들 말고 조연들의 연기도 좋았던 영화. 오랜만에 재밌는 사극을 봤어요.  
20180303,8,관람객볼만합니다 ㅎㅎ 마지막장면 이쁘게 끝나요  
20180303,9,오랜만에 착한 영화?를 본 것 같아 좋았어요 요즘엔 선정적이고 폭력적이고 무거운 영화들이 많은데 이런 잔잔하고 흐뭇한 착한 영화들도 많이 만들어졌으면..  
20180303,8,관람객재밌어요 오래만에 재밋는 영화를 보았네요.  
20180303,7,심은경이 다 해줬어요 심은경때문에 7점  
20180303,10,궁합 너무재밋어요 최고예요!!! 호호ㅗ  
20180303,2,"최악의 영화.. 계연성도 없구, 별하나도 아까움. 장르도 모호하고  "
20180303,1,평점보고 속았다.재미도 없고 감동까지 없는 클리셰의 연속. 클리셰를 넣으면 보통 재밌지않나?감독이름 기억해놔야지 ㅡㅡ 코미디라서 웃기기라도 할까했는데 웃기긴커녕 답답하고 짜증남의 연속 ㅡㅡ  
20180303,8,관람객조복래라는 배우 연기잘하네요  
20180303,8,관람객편안하게 보면 기분좋아지는 영화  
20180303,8,영상미 하나는 참 잘뽑아냈다  
20180303,1,영화관에서 돈내고 볼수준은 아니다... 이승기 제법.. 심은경 실망  
20180303,10,2년전 승기를 보게 도리줄이야 ㅎㅎ  
20180303,8,로코인줄 모르고 봐서 그런가 굉장히 재미있었어요 이승기씨 발성이 꽤 좋구나 라고 느꼈습니다대박 나시길 바래요  
20180303,10,산뜻하네용^^ 이승기 뉘집 자식인지 참 잘생겼어요  
20180303,2,관람객풍수3부작이라길래 봤는데 예상외로별로  
20180303,9,심심함 속에서 느껴지는 깨알재미 !  
20180303,1,방금 영화보고 왔는데요 평점써본적없는데 너무 재미없어서 남깁니다 영화끝나고 서로 다같이 최악이라고 이야기했네요 유치하고 몰입안되고 뜬금없고.. 중간에 개그적인 요소도 있지만 그냥 이 영화는 돈주고 보기 너무 아깝습니다.  
20180303,9,가벼워 보이지만 메세지가 담겨있다  
20180303,10,달달허니 좋더라 ㅎ 간만에 머리비우고 봄  
20180303,6,관람객재밌어여 약간 아쉬운면이 있긴했어도 볼만합니다  
20180303,10,"예상 되는 전개, 스토리였지만 그냥 생각없이 보기 좋다  "
20180303,4,관람객관상 차기작이라고 들었는데 맞나요...? 아닌것같은데...  
20180303,10,심은경 뺴고 다 좋았음 ㅋㅋ  
20180303,10,웃으면서 즐겁게 잘 관람했어요  
20180303,10,코미디 물로 딱..소박하지만 웃음이 있는  
20180303,10,관람객스토리 재밌음 ! 캐스팅도 ㅋㅋ 이승기 ㅠㅠㅠ  
20180303,9,우리나라에는 열폭인자들이 너무많음ㅋㅋ 세상이 삐뚠가봐 ㅋㅋ  
20180303,10,맘 편히 볼 수 있어서 좋았어요  
20180303,7,킬링타임하기 좋은 영화.. 오글거리고 뻔하고  알고봤으니 딱 그정도  
20180303,10,큰기대안햇는데 생각보다 볼만하고 재밋다 특히이승기 목소리 연기톤도 그동안 듣던거랑 뭔가달라서 신선하고 좋앗음 이런캐릭터로 청춘사극 들마로 한번하면 좋겟다!! 내용도 너무 무겁지도 가볍지도 않고 자극적이지않아 좋앗음 봄에 어울리는 부담없이 즐길만한 영화  
20180303,9,관람객마음 정화되는 기분 ㅋ 영상미가 화사해서 기분까지 좋아진다  
20180303,10,이것저것 다 때려박고 진지하다고 잘만든 영화가 아니다.. 가끔은 이런 가볍게 웃을 수 있는 영화도 있어야한다  
20180303,10,관람객궁합맞는 사람과 보면 더 좋습니당^^  
20180303,10,아름다웠다.감초같은 여럿의 아역연기자들과 어린아이의표정으로마음을 공유하는듯합을 이루는 심은경의연기도 좋았고 늑대의유혹 강동원의 우산씬의 멱살을 잡는 이승기의 소맷자락씬은 남자의 심장까지 나대게 한다.  
20180303,8,남자친구랑 잼나게 봤어요!!  
20180303,10,보고나서도 기분이 좋아지는 영화  
20180303,4,관람객하... 이걸 돈주고보다니  10점들  댓글알바냐 사악하다진짜루  
20180303,10,정말 봄에 잘 어울리고 가볍게 즐길 수 있는 영화! 궁합입니다~  
20180303,10,무대인사 오는줄 몰랐다가 진짜 심장폭행당함ㅋㅋㅋ영화도 개꿀잼♡  
20180303,7,관상에 비해서 몰입도가 많이 떨어짐... 조금 b급 영화 스멜이 납니다 연기는 조연인 김상경 빼고는 다 어색함 그래도 이승기 연기 꽤 늘은듯하네요 이제 제법 배우같음 영화 내용은 그냥저냥 볼만합니다  
20180303,6,딱 기대만큼 그냥 볼만해요~  
20180303,10,요즘 보기 힘들었던 가볍고 귀여운 로맨스물ㄹ  
20180303,10,관람객저는 재밌게 봤어요 ㅋㅋ 이승기 잘생긴거 몰랐는데 잘생겼네요 ㅋㅋ  
20180303,10,사극 로맨스 코미디! 다들 연기 잘함 ㅎ  
20180303,10,관람객마음이 따뜻해지는 영화 ^^;; 오글거리는 멘트들까지도 내취향 ㅎ  
20180303,8,우려헀던것과 달리 재미짐 ㅎㅎ  
20180303,9,관람객기대치가 없어서 긍가 잼나더라  
20180303,8,관람객가볍게 보기 좋은 청춘로맨스사극! 개인적으로 재밌게 잘봤습니다~  
20180303,9,잘보고 왔습니다~ 오늘 날씨도 살랑살랑하니 잘어울리네요 ㅎ  
20180303,7,그냥 볼만한 정도입니다. 배우의 힘이 너무 약한 건 아쉽습니다.  
20180303,2,평점 왜이리 좋은지..내가 좋아하는 배우들만 나와서 개봉하자마자 믿고 봤는데!! 보는내내 유치하고 오글거려서 미치는줄 알았 ㅠㅠ 브금은 또 왜그래.. 사랑을빼면뭐가남나요대사후에 브금은 잊혀지지않음... 원래 취지가 병맛영화였다면 완전 잘만든영화..  
20180303,10,관람객스트레스 풀긴 괜찮네요 ㅋㅋ병맛인데 ㄱ잼나긴해요  
20180303,1,11점을 주고싶은 나의 마음이다.  
20180303,8,관람객재밌게 잘 봤습니다! 훈훈한 영화이네요!  
20180303,9,관람객가볍게 재밌느 영화였습니다.  
20180303,8,관람객잔잔한  영화네요. 신선하고  격하지  않아서  좋습니다  
20180303,1,정말 유치하고 뻔하고 지루한 영화끝까지 다 못보겠다는 생각만 드는 영화두시간이 안되는 시간이 얼마나 큰 시간인지 깨닫게 해주는 영화이승기 집사부일체 화이팅!!!  
20180303,10,"단언컨데 올해 최고의 영화입니다ㅎㅎ 클레멘타인, 리얼만큼 재밌어요. 다들 꼭꼭 보러가세요!  "
20180303,8,관람객재밋어요~~무겁지 않고 상큼하니 이쁩니다~~  
20180303,10,색감도 이쁘고 재밌음 궁특히 궁합 풀어내는게재밌었음  
20180303,1,아니 ㅋㅋ 후반부터 감독 ㅂㅏ뀐줄;; 이승기만 세상 멋진역할 다 몰아주고 심은경이 후반에 진지하게 인생에서 사랑빼면 머있냐고 할때 다 웃었어욤. ㅜㅡ걍 인소같아욤.  걍병맛같아서 재밌었음 ㄱ웃기댱 ㅇ3ㅇㅇ  
20180303,8,관람객음...관상과는 다른 느낌이네요  
20180303,8,관람객기대이상 잼나게 봤네요  
20180303,1,최악영화보는 내내 한숨만 내리나옴클레멘타인급 끝  
20180303,2,진짜 어이가 없고 개연성이라고는 1도 찾아 볼수 없으며 주인공들은 전형적인 선과악이며 캔디등장 졸작중에 졸작 감독은 은퇴하라  
20180303,10,관람객배우들도 한 몫하고 나름의 반전들도 있고 개인적으로 유쾌하게 봤습니다ㅎㅎ  
20180303,7,관람객관상보다는 가벼운 느낌이에요심은경 캐릭터도 괜찮았어요잠을 얼마 못자고 가서 본거라ㅋ약간 졸았는데ㅋㅋㅋ그래도 재밌었어요 졸아서 못본부분 다시 보고싶어요ㅋ  
20180303,9,관람객재미있게 볼수 있는 영화~  
20180303,2,식상한 영화. 배우나 스토리나 지루라네  
20180303,10,생각보다 더 재밌었어요! ㅋㅋㅋ 나중에 소장각:)  
20180303,9,관람객꼭 보지 않은 사람들이 욕하는거같아ㅠ  
20180303,10,관람객연우진 연기도 잘하고 존멋..  
20180303,10,관람객유치하지만 괜찮아 ㅎㅎ흐흐  
20180303,10,인생에 사랑을 빼면 무엇이 남습니까?  
20180303,1,재밌다 재밌다해서 보러갔는데 이게 웬 ... 지루하고 진부한 전개에 웃긴 포인트도 그다지 웃기지도 않고 .. 오글거리기까지 정말 별로였습니다  
20180303,10,영상미가 너무 예쁜듯. 다가오는 봄을 설렌마음으로 기대하게 되는 영화네요  
20180303,6,관람객풋풋하긴함. 근데 그냥 풋풋함에서 끝ㅋ 더도덜도 없음. 남편은 옆에서 코골고 잠. 민망해서 죽을뻔. ㅠㅠ  
20180303,2,관람객조선마술사 이후 최악의 사극~ 그레이의 50가지 그림자는 피했는데 궁합은 못 피했다  
20180303,8,관람객볼만했음.처음부터 무슨 교훈을 얻거나 감동을 받거나 하려 본게 아니라 청춘로먄스물이라 생각하고 봐서 그런지 몰라도...  
20180303,1,별점 1점도 아깝넼ㅋㅋ 처음으로 돈이 아깝다고 느껴지네요.  
20180303,1,이게 대체 무슨 내용이지...? 오글오글 거리다 손발 없어질뻔... 어이없어서 눈물나고 웃김  
20180303,9,관람객음 볼만하지만 월요일이사라졌다가 더재밋음 그냥 아무생각없이보기엔 좋아요 역시우리나라는 기승전사랑ㅎㅎ  
20180303,10,관람객고딩 딸이랑 둘이봤는데 딸은 눈물도 찔끔하고ㅋㅋ봄바람  살랑살랑 가볍고 산뜻한 느낌의 영화 재밌게 봤어요  
20180303,1,관람객보고있기 어려운 영화였습니다.  
20180303,2,장난하냨ㅋ진짜 알바들 너무 하네 ㅋㅋ  
20180303,10,관람객중간 중간 빵터짐.오랜만에 웃어본 영화  
20180303,8,관상 이랑 전혀 상관없는 감독님인데 ㅡㅡ영화는 90년대 영화보는거같아유 승기팬이라 8점 줍니다.  많이 준거임  
20180303,1,유치하기 짝이 없으며 돈과 시간이 너무 아깝습니다 절대 보지마세요 이거 볼바엔 DVD방 가서 골든슬럼버랑 염력을 보는게 나을거 같네요  
20180303,6,관람객잼있어요!!!! 출연진분들 연기력도 Good!!  
20180303,1,중간까진 그냥 볼만한데 후반에 진짜 손발 오그라들어서 나왔다 평점 너무 높다 내리자  
20180303,9,관람객로맨틱코미디는 언제나죠타ㅠㅠ  
20180303,4,딱 4점영화 시간은 잘가네요 가벼움으로 인해 유치한 건 어쩔수 없었나보네요  
20180303,1,인터넷에 영화평점 주는거 처음인데 0점이 없다는게 안타까울 따름. 30년동안 영화관에서 본 영화중 최악. 몰입도 안되고 주인공들 연기력도 별로에 뻔한 대사 뻔한 전개. 재미도 없고 후반부엔 어이가 없어서 웃음이 나옴. 공짜로 다운 받아서라도 안볼 영화  
20180303,2,평점 다들 알바임? 지겨워 죽을뻔 포레스트보셈 아까운 내 두시간  
20180303,1,너무 기대했나봅니다. 재미없음  
20180303,2,그냥 화가 납니다 tv드라마로도 안볼 것 같습니다  
20180303,6,관람객이승기라 산뜻했지만 심은경을 좋아하는팬이지만 영화마다 비슷한이미지라 살짝 아쉬웠다 ?음 기대치보단 못한영화였다  
20180303,10,관람객여자친구랑 보러갔는데 재밌도요!  
20180303,6,관람객그저 그렇네요‥ 그렇게  추천하고 싶지 않네요  
20180303,10,생각보다 재밌었어요 좀 유치할거라 생각했는데 타임킬링용으로 괜찮아요 한국영화에서는 가장 최근에 본게 꾼이었는데 꾼보다는 재밌게보았어요  
20180303,10,생각보다재미있어서 놀랬습니다... 사실 평점쓰는게처음이라하핳 드라마같은영화였어요  
20180303,1,지루하고 뻔한 스토리..  
20180303,1,개연성 하나도 없고 뻔하고 유치한데 재미까지 없었네요 본격 관객 왕따시키는 영화임 히말라야급 노잼인데 댓글 알바인지 배우팬들인지 ㄷㄷ 중간 자리라 나가지도 못하고 지루해 죽는 줄 알았네요  
20180303,2,예능에서 많이본 배우들이 많이있어서인지 몰입이 잘 안되고 극중 몰입을 줄수있는 요소들이 떨어져 조금 지루할수 있습니다.  
20180303,10,내가 너무감성적인가 왜케 눈물이났죠..?ㅋㅋ육아하느라 영화관도 와본지 오래됐는데 아주 재밌게봤네요^^심은경 이승기씨 연기 잘하네요~!  
20180303,1,궁합 진짜 개노잼;;  재밋다는 사람들 다 알바인듯 웃기지도 않고 감동도 없고 연기도 별로고... 돈만 아까웠다 친구꺼도 같이 냇는데 정말 후회된다 올해 최악의 영화..  
20180303,8,이승기가 존나게 멋있고 잘생기게 나온 영화.  
20180303,10,관람객웃음과 감동이 적절하게 들어 있어 보기 좋았어요  
20180303,9,관람객이승기 보려 갔는데 심은경이 더 돋보이던  
20180303,1,봄바람같은 봄내음나는 봄같은 봄봄봄 아무리봄이라지만 알바들 창의성 너무 없는거아니냐?  
20180303,1,관람객내 평생(53년) 이렇게 재미없는 영화는 처음이네...중간에 나기는 사람들도 여러명 있더군요심은경 연기도.. 연출도...빵점!!500원짜리도 아까워요0점 줘야하는데..  
20180303,10,존잼 예상할수없는 전개 지렸다 덕분에 여자친구랑 즐거웠네요 ^^ 제가 빈혈이있었는데 다 나았어요  
20180303,1,관람객솔직히 클레멘타인이 더 재밌었어요...  
20180303,10,관람객유치해도 기분좋게 봣어요오오~~^^*  
20180303,1,진짜 평점 다는건 처음인데 8점대는 아니죠 ㅎㅎ 여성분들이 이승기 보러온다는 마음가짐으로 본다면  모를까 전체적으론 7점대도 턱걸이 수준이네요.  
20180303,9,관람객돈주고 봤는데 안아까워요  
20180303,10,관람객사극까지 잘하는 이승기~심은경도 너무 귀엽네요.2탄 꼭 보고 싶습니다.^^  
20180303,8,관람객주말에 가볍고 유쾌하게 보기 좋은거 같아요^^  
20180303,2,재밋다는 사람 진심임?  
20180303,1,와 백퍼 알바뿌리는구나 진짜 절대말도안된다 2점이상 줄 수 없는 영화임 이거 호감도 순으로 뜨는지도모르고 평점보니까 다 10점이길래 본건ㄷ 진짴ㅋㅋㅋㅋ사극 인소 보는 기분인데 연출 극본 다 똥망에배우 케미마저 없어서 총체적난국  
20180303,2,장난하나. 알바가 많은건지 다들 10대 감성들인건지. 인터넷소설본느낌. 재미도없고 유치해서 못보겠음  
20180303,10,오늘 가족이랑 보고왔는데 장면 연결이 살짝 매끄럽게 느껴지진 않았지만 진짜 잼있게 봤어요!!완죤 강추!!♡합니다ㅎㅎ 이승기 사극목소리 너무 멋있습니다♡  
20180303,7,관람객가볍게 볼 수 잇는 영화입니다조금 오글거리기는 하지만..  
20180303,2,관람객스토리전개가 맥락없고 연기가 어색해보여서 집중이 안됐어요 그래도 어르신들은 좋아하시더라구요 ㅎㅎ..  
20180303,4,다들 꼭 봤으면 좋겠음 ㅠㅠ나만 느낄 순 없음 이 시간낭비와 돈ㅈㄹ을  
20180303,1,이걸 영화라고 돈주고 보고온 내가 미친놈이지...이번에 다시 한번 결심했다.  순위 그딴거 믿지 말고 보고온 사람말을 믿자!  
20180303,1,초반이라 평점 과대평가 정확히 한 5점 정도임  
20180303,2,너무 재미없다..이렇게 만들기도 힘들듯. ㅜㅜ 배우들도 넘 별로고.  
20180303,8,관람객가벼운 마음으로 가볍고 즐겁게 볼 수 있는 영화! 중간에 조연들의 애드리브로 빵터졌넴  
20180303,8,전 재밌게봤는데 웃음코드가 달라서인지 재밌다는사람도있고 없다는사람도있네요.. 삼일절 전날 밤에봐서 성인분들 많았는데 다들 소리내서 웃고재밌는 분위기였어요 같이간 친구도 재밌게봤고..제 친구들과 가족들한테는 적극 추천했네요 재밌었다고  
20180303,10,오늘 친구하고 궁합무대인사 보고왔습니다 정말 시간가는줄 모르고 봤습니다~특히 마지막 장면은 정말 이뻤습니다ㅎㅎ 대박나시길 바랍니다ㅎㅎ 궁합화이팅!500만 이상 가즈아ㅎㅎ  
20180303,10,요새 이승기 왜이리 좋냐ㅠ  
20180303,10,관람객재미있게  잘봤습니다강추가 ~~  
20180303,4,모임 단체 관련 어쩔수 없이 봤는데 정말 시간.돈아까움  
20180303,6,관람객그냥 그럭저럭 입니다. 감동이나 기억에 남는것은없어요  
20180303,9,이승기와 심은경의 색다른 매력을 볼 수 있었던 영화!  
20180303,1,처음 관람평 남긴다 재미 진짜 없다 뻔한 권선징악 뻔한 멜로 예매율 보고 속았다  
20180303,1,하.. 한숨밖에 안나옵니다.. 진짜 연인과 함께보세요.  
20180303,10,엄마랑 보고 왔는데 재밌었어용 이승기 진짜 너무 멋있더라구용  
20180303,8,가볍게 볼수있고 재미있는 영화입니다^^  
20180303,6,관람객으아ㅏㅏㅏ오글오글..  
20180303,9,이승기 생각보다 사극이 잘어울려서 놀랐음ㄷㄷ  
20180303,10,그냥 코미디 영화인지 알았는데 여운 짱ㅜㅜ  
20180303,6,관람객그닥 재미가있지도 감동이있지도 않음  
20180303,9,웃음과 감동을 동시에 느낄 수 있었던 영화  
20180303,9,관람객재밋게 봣스빈다 재밋습니다  
