0,1,2
20180301,8,가볍게 보기에 나쁘지 않았어요 . 생각보다 재미있음 ㅋㅋㅋ  
20180301,8,관람객역시 심은경이예요~실망을안시키더구요~연기는잘해이승기도연기가많이안정적이고많이웃었네요궁합에맞추는조선시대에역시사랑이최고예요  
20180301,10,유쾌한 조선 로맨스~~~재미있게 보았습니다. 역시 심은경~~^  
20180301,1,정말정말 재미있고 엄청나게 잼있다 ㅡ두번보고싶다  ㅡ 제길 나만 당할순없다  
20180301,10,재미있었습니당 꿀잼!ㅎㅎ  
20180301,4,이거 뭐여...!!!!ㅎ헤헿  
20180301,10,잘보았어요 감초역활하셨던 조연덕분에 더웃었어요ㅋㅋ  
20180301,6,굳이 이승기였어야 했나 심은경의 연기력과 귀여움이 얕은 영화를 살림  
20180301,10,누구나 다 즐길 수 있는 영화  
20180301,1,"진짜너무진부하고 끼워맞추고 오글거리고 . . .ㅋㅋ 단편스페셜드라마보는줄. ,  "
20180301,10,이승기 최고! 역시 믿고 보는 배우이승기 심은경 꼭 추천 할 만한 영화.상큼한 영화  
20180301,10,관람객재미있었어요다시봐도괞찮을꺼같아요  
20180301,5,평들이 어째 이리들 비슷한지. 봄날 봄내음 봄바람 키워드 가지고 알바 풀었다는데 500원 건다.  
20180301,10,옹주의 대사 한마디가 이 영화의 포인트가 된것같네요  
20180301,10,관람객사랑이 없다면 뭐가 남겠습니까?  
20180301,8,관람객유치하긴한데 마음이따뜻해져서 좋았어요  
20180301,2,음... 진부하고 내용 뻔하고 핵.노.잼...  
20180301,10,인생이서 사랑을 빼면 머가 있겠습니까?!ㅎㅎ유쾌한영화!!  
20180301,8,기대안하고 보면 쏘쏘 ㅋㅋ  
20180301,2,별점 조작하지마라 빠순이들아 진짜 최악이다 돈 아깝다 개봉 미룬 이유가 있다 이승기가 분명 말렸을 거다  
20180301,4,별로 잼없는데.. 남는게 없어  
20180301,10,ㅋㅋㅋ뭐 퓨전사극드라마 본느낌 오글은 있음  
20180301,4,나는 애국자다. 공백을 제쇠하고ㅈ19자  
20180301,2,나만 당할순 없지 역대 개꿀잼~!!!  
20180301,2,처음부터 끝까지 웃을 일이 별로 없내요  
20180301,8,관람객영화 너무 재밌어요~ 돈아깝지않슴니당  
20180301,1,와 진짜 억지로맨스 ... 도대체 영화의 중심을 어디로 잡아야할지 모르는 것 처럼 보였다;;;; 하...진짜.... 관상가가 싸움은 어찌나 잘 하는지....  갑자기 로맨스로 이어져서 끝나는 것도 웃기고 어후 노잼  
20180301,10,사랑하며 아끼는모습이 좋았습니다  
20180301,10,"방금 보고왔습니다! 한동안 범죄수사 스릴러물이 주를 이루더니 간만에 가벼운 로맨스 영화 잘 보고와서 좋네용ㅎㅎ관상이 코믹과 새드, 역사영화를 오가는 느낌이었다면 궁합은 확실히 가볍게, 따뜻한 봄에 보기좋은 영화에요!! 추천합니다:)  "
20180301,6,관람객혼기앞둔젊은이들한테훈훈한사랑이야기가될듯  
20180301,10,조선시대 사랑은 역시 답답합니다~^^  
20180301,1,지금까지 본 영화 중 재미없다고 느낀 영화는 이 영화가 처음!  
20180301,9,유치하지만 재밋네요!!!  
20180301,10,가볍게 보기 딱좋은 영화였음  
20180301,1,보자고 조르던 남친 목을 조르고 싶네요  
20180301,10,어르신들도 아이들도 좋아할 영화였어요 웃음소리가 많았어요  
20180301,6,관람객엄청 재밌진 않네요~~그냥그래요.  
20180301,9,관람객기대없이 가볍게 보기에 딱심은경 매력에 ㅎㅎ  
20180301,10,유쾌한 영화에요. 사랑하세요  
20180301,10,영화 궁합 영상미가 정말 최고의 작품입니다.거기에 배우들의 연기력도 정말 일품이네요.궁합이라는 주제를 이렇게 풀 수 있다는게 정말 처음부터 끝까지 완전 몰입해서 봤습니다@!!  
20180301,9,소소하게 보기는 좋은 영화  
20180301,10,관람객이승기가 넘 멋있다. 옛날에 태어났다면 정말 그랬을거같은~~~  
20180301,2,이것은 절대1점이 아니다 사람들이 살면서 1번1번이라도 봐야하는 명작이다 ㅎㅎ  
20180301,10,인생에서 남는건 사랑뿐이다  
20180301,10,관람객재미 있네요.  친구들에게 적극 추천합니다  
20180301,1,꼬라지를 보니 망했네. ㅋㅋ  
20180301,10,재밌게 봤어요^^ 가족끼리 볼만한 이야기였어요.  
20180301,8,관람객재미는 있고... 임팩트는 좀...화악 하는 느낌은 없었지만 가족이 보기에 괜찮은 영화.  
20180301,1,덕분에 숙면 했습니다....알바는 실존 합니다!  
20180301,1,"X] 이건 범작도 아니고 평점 ""가장 좋아하는 그룹 40대 여자"" 제목만 보고 합 맞히는건지 알고 봤나 보네  "
20180301,10,생각보다 재밌어서 놀람! 이승기랑 나머지 남자배우들도 연기 좋고 잘생기고~ 안볼 이유가 없는듯~~  
20180301,10,궁합별10개더더사극로맨스 조아욭  ㅎㅎ  
20180301,8,관람객훈훈하고 재밌었어요!  
20180301,10,생각보다 더 재밌어서 깜놀 이승기가 배역을 잘 소화한듯  
20180301,10,정말 재밌어요 ~~!! 꼭 보세요들~~~(나만당할순없다 ㅋㅋㅋㅋ)  
20180301,10,좋았어요 주인공들연기도. 이승기 멋지네요ㅎ  
20180301,10,생각보다 매우 재밌는 영화. 이승기 짱임!  
20180301,10,잔잔하고 재미있어요~  
20180301,10,"이승기 넘 멋있게 나오더라, 내용도 나쁘지 않고  "
20180301,6,"관람객그냥 킬링타임용으로 적당한 영화 인터넷 소설같은 느낌이 사라지지 않음..""인생에 사랑을 빼면 남는게 무엇입니까?""라는 대사에서 내 인생은 남는게 없구나를 느끼게 해주는 영화  "
20180301,7,관람객좀 뻔했지만 연기들 잘한거 같다  
20180301,10,영화 완전 괜찮드만 왤케 까대는거냐? 엻폭이냐?  
20180301,10,신선하고 산뜻한 영화. 젊은 배우들이 많이 나와서 보는 내내 기분이 좋더라. 젊어지는 기분~  
20180301,8,그럭저럭 볼만하네요. 여자분들은 눈호강 제대로 하겠어요~  
20180301,10,솔직히 이승기팬인데 이 영화 이승기 아님 망....ㅎㅎ  
20180301,1,ㅈ노잼 개노잼 개 씹노잼  
20180301,10,어린친구들이 좋아할만한 소재. 오랜만에 이런것도 나쁘지 않네  
20180301,10,자극적이지않은 가족들이봐도 좋을 영화  
20180301,2,음. . 기대를 많이해서 그런것이겠죠 ㅠ  
20180301,6,관람객이승기연기가 저 개인적으로는 좋았구요마지막엔딩장면샬랑샬랑 꽃들도 그들도 예뻤어요  
20180301,10,그냥저냥 보기 나쁘지 않은 것 같아요. 달달하니 커플들이 보면 좋을듯  
20180301,10,청춘물로는 딱! 사람들 너무 앞서나가지말고 그냥 저냥 오락영화로만 봅시다~~  
20180301,10,이수지가 하드캐리~^.^ 귀여워!  
20180301,8,관람객재미었는데 후반부가 좀 약했어요  
20180301,10,왜 아줌마들까지 이승기를 찬양하는지 알겠더라-0-  
20180301,10,관람객승기 너무 예뻤어요!!!  
20180301,10,갓도윤ㅠㅠㅠ너무 매력적인거 아이가ㅠㅠ 손오공보다 더 잘어울린다잉!  
20180301,6,알바가 많은듯... 조금 있으면 평점이 확 내려갈 영화입니다.  
20180301,9,시간때우기 좋았네요 ㅎㅎ지루하진 않더라구요  
20180301,8,관람객안지루하고 재밌음. 심은경이랑 이승기 케미는....  
20180301,10,가끔은 이런장르도 좋지않나?  
20180301,2,주연배우들이 그다지 끌리지않는 영화  
20180301,10,연기로는 깔 수 없다는게 팩트. 솔직히 재밌긴했음  
20180301,10,기분 좋아지는 상큼한 영화~  눈물도 한방울 ?  
20180301,6,관람객웃긴부분이 많아서 재밋엇어용  
20180301,6,"그렇게 재밌지도 재미있지도 않은 그런영화. 주연배우들과 조연, 단역까지 연기가 매끄럽지는 안았다. 한번은 볼만함 연화고 B급 간간한 웃음코드와 약간 억지스런 감동짜내기 영화  "
20180301,10,"관상이랑은 비교할 수 업는 장르. 관상은 관상대로, 궁합은 궁합대로 잘만들었다  "
20180301,10,관람객2번보고 싶은 영화는 아니지만 킬링타임용으로  좋은 영화였어요. 배우분들 연기도 좋아요~~^^  
20180301,10,재미있네요 가슴따뜻해지는 영화입니다  
20180301,1,관람객저는 기대를 많이 하고 가서 그런지 생각보다 재미가 없어서요  
20180301,8,"생각않하고 봤는데 재밌었음 ㅋㅋ 웃음포인트도 많았고, 재밌었음  "
20180301,10,이승기 사랑해요??!!  
20180301,2,내가 염력은 피했는데 궁합을못피했네...  
20180301,1,OO 시간땜에 어쩔수없이봣는데 뭔유튜브드라마보다 허접하냐 영화별로 받는돈 더르게해야됨 욕나오는영화 신은경 연기력도 더시생각하게된다 매번같은발성에말투 아짜증나  
20180301,1,진짜 믿고 거른다 심은경  
20180301,8,관람객별기대를 안했는데 그런데로 볼만  
20180301,10,살면서 어쩌면 현실같지않고 꿈만같이상황을 상상해본적이나 꿈에서본적이 있습니다이영화가 그영화인 것 같네요 감성을자극하기 충분하고 아름다운배경과 잊을수없는대사가 제마음을 크게 울렸습니다 사랑이없다면 어찌살란말입니까 라는대사에 말을 한동안잊지못했습니다  
20180301,10,와진짜 이건꼭봐야됨 진짜 졸잼 와 진짜 와  
20180301,2,알바들인듯...다들.. .이렇게 신파극인줄알았음  안봤어ㅜㅜ  
20180301,1,이걸 돈주고 보다니....  
20180301,8,재미있게보았어요 후보들마다 반전의반전이라ㅎㅎ  
20180301,10,관람객잼있어요 막판에 감동이네요  
20180301,10,재밌었어요 무겁지않고 재미있게 즐기고 웃을 수 있는 영화였어요  
20180301,10,댓글보고 재미없을줄알았는데 재미있었당 배우들도 괜찮고  
20180301,8,관람객반전없고 흐름그대로 간 영홥니다 근데 재미있었습니다  
20180301,5,"관상 연출팀이라며, 의상팀만 보임... 알바놈들....  "
20180301,2,관람객나랑 궁합이 안 맞는다.  
20180301,10,관람객재미있게 이쁜색감의 따뜻한영화!!  
20180301,10,별 기대없이 봤는데 아름답고 따뜻하고 감동! 이승기♡서도윤 넘 멋지고 빠져든다.  
20180301,10,관람객재밋엇어용ㅋ!ㅋㄷㅇㄹ  
20180301,1,정말 뻔한 스토리와 심은경씨의 오그라드는 연기가 합쳐져 도저히 눈뜨고 볼 수 없는 영화로군요..  
20180301,10,잔잔한재미가 느껴지는 영화네요사극의 시나리오가 대단합니다  
20180301,7,관람객서도윤의 진중한 캐릭터와 예쁜 영상이 좋았어요심은경 배우의 말투는 수상한 그녀 때와 너무 똑같아서 어색했던 것 같아요김상경씨도 왕 역할 자리잡은 듯ㅎㅎ  
20180301,7,그냥 딱 7점짜리였음 이승기라서 7점 줍니다  
20180301,10,엄청 재미있게봤어요사극 배경이라서 무겁고 지루할줄만 알았는데유쾌하고 웃는장면이 많아서 좋았습니다이승기 명연기가 한 몫 해주는거 같았어요재미있습니다!  
20180301,10,진짜 개재밌고요 이승기 도포 휘날리는거 겁나 멋잇음애드립두 재밌어용 ㅠㅠ이  
20180301,6,관람객기승전 이승기 결말의 픽션스토리 잘봤어요  
20180301,10,자극적이지 않아서 좋아요.  
20180301,4,관람객가볍운 마음으로 관람하기 좋을듯  
20180301,10,관람객재미있어요!! 약간 허무하지만 킬링타임 보내기 딱 좋아요 ㅎㅎ  
20180301,1,댓글 보니 다 봄날같은...이란 댓글. 댓글부대에다 '봄날' '봄날같은' 이란 문구를 넣으라 시켰나보네. 어떻게 별 10개짜리 댓글은 다양성도 없이 다 획일적이냐... 안볼란다 ㅋㅋㅋ  
20180301,1,진짜 댓글 알바들 OO다 아오 내 구천원진짜 내 발가락이 더 연기 잘할듯 심은경 뭐하는거임 진짜 욕이 턱밑까지 차오른다봄내음은 무슨;;네 유쾌합니다 보는내내 어이가 없어서 헛웃음만 나왔네요 돈 버리고 싶은분들께 추천!  
20180301,10,관람객기대안하고 봤는데 너무 재밌고 배우분들의 연기도 돋보이는 영화였어요 강추  
20180301,8,무난하게 볼만 중간에 좀 지루 쏘쏘  
20180301,6,관람객뭐야 더외로워졌어 이영화보고 세상달달  
20180301,4,평점 10점만점에 딱 4점정도 되는 영화  
20180301,8,전개되는 동안 재미있는 내용 구성과 배우들의 완벽한 연기에 빠져서 보느라 시간이 가는 줄 몰랐다. 하지만 끝에서는 이상적인 결말이라 완결되었다는 느낌은 없었다. 많은 기대없이 가볍게 즐기기 좋은 영화라 생각한다.  
20180301,8,관람객편안하고 기분좋게 볼수 있는 영화 재미있어요  
20180301,7,관람객그냥저냥 한번쯤 킬림타임용으로 볼만했음  
20180301,8,영화자체가 개연성이나 무엇 인가 모자라지 않기에 런닝타임 내내 볼만 하다. 그러나 무엇인가 기대하고 간다면 기대감에 런닝타임내내 불편함을 가지고 볼수도 있을것 같다.  
20180301,1,뻥치지마 염력급 영화 보다가 잠듬  
20180301,10,이정도면 굿이다 심은경 울때 같이 울었다 믿고보는 은경찡  
20180301,6,관람객사극이라 흥미는 있는데 코미디네요  
20180301,10,확실히 봄이 오려나보다 보자마자 꼼냥꼼냥하넼ㅋㅋㅋ  
20180301,1,댓글보고 보러갔는데 .... 10점 주신분들 생각을 무시하려고 하는건 아닌데 너무 하시네요...정말...  
20180301,10,심은경은 이런역할 너무 잘어울린다  
20180301,10,너무궁금해서 개봉전날 예매 후 28일 관람 ㅋ넘 잼나요 배우들 연기도 좋고 내용도 흥미로운 소재라 집중이 잘되더라고여 ㅎ  
20180301,2,심은경 연기가 어색해요ㅠ염력이후 또ㅠㅠ 심은경 연기의 한계인가요?ㅠ  
20180301,1,별 반개까진 아니지만 총 평점이 왜이리 높은지 이해가 안되네요... 첨엔 재밌게보다가 끝부분 갈수록 손발 오글거려서 못보겠더라구요 ㅠㅠ 대사는 왜그리 유치한지.. 관상 생각하신분들은 보지마세요..  
20180301,1,첫 컷 나오자마자 나오고 싶기는 처음 조연이 다했다 진짜 최악  
20180301,8,의외로 요즘 나온 쓰레기 영화중에서는 그나마 제일 볼만함. 심은경도 좋았고 이승기도 좋았으나 마지막 결말 조금 더 멋지게 마무리할 수 있었던거같은데. 아쉽습니다. 볼만해요  
20180301,6,관람객조금 아쉬운 영화입니다  
20180301,6,관람객고만고만 하다. 코믹도 엑션도 갈등도  
20180301,2,출연진의 명성보다 스토리가너무 약해 영화가 좀 이상하게전개되어서 보는 내내 불편했다  
20180301,8,"관람객별 기대하지 않고 봐서 소소한 재미가 있었다.하지만 영화관에서 보기에는 다소 아쉬운면이 많은 영화~;;""인생에서 사랑을 빼면 뭐가 남나요?""  "
20180301,1,평점 7점이 적당하다. 좀 낮추자  
20180301,10,믿고보는 이승기 심은경  
20180301,10,나 혼자 죽지않아 캬캬캬  
20180301,1,아진짜 보지마라 ..진짜로 ;;;; 이승기는때문에 박차고 안나옴 ㅋ진짜 핵 멸망 영화죄송합니다 . ㅜㅋㅋ핵노잼  
20180301,8,관람객가볍게 보기 좋은 영화였어요~다만 엔딩이 약간 아쉬운 느낌이라 8점 드립니다!  
20180301,10,"관람객명리학을 한번 공부해볼까했다는... 그리고, 수지ㅋㅋㅋ  "
20180301,10,관람객가족과 함께 따뜻한 영화!기분 좋은 오후~~  
20180301,10,생각보다 재밌게 관람 했습니다.  
20180301,1,평점 알바가 너무 심합니다  
20180301,4,생각보다별로ㅠㅠ스토리가부실함 진부하고...  왤케호평인지 의문  
20180301,7,여자친구가 많이 웃었어요이승기랑 민호가 기억에 남는데요  
20180301,6,관람객짧은 드라마 한편을 본 느낌  
20180301,8,관람객영화가 너무 예뻐요~^^  
20180301,8,재밌었는데 심은경 연기력이 아쉽  
20180301,1,지금 영화보고 나오는 길인데 각본 진짜 유치하고 개연성 없음  
20180301,10,관람객기대안했는데 재밌게 봤어용  
20180301,6,스토리맥락부족  승기님이 왜 선택했을까 하는 생각이 들정도네요 지루함에 졸고 있네요  
20180301,10,관람객재밌었어욜~~~~ㅎㅎㅎ  
20180301,1,죄송해요...  오글거려서 잠도 안왔어요..보고나서 허탈함에 웃음이 나와요  
20180301,9,관람객후기쓰고 오백원 상타치  
20180301,9,관람객재미있어요 가족끼리보기도 좋아요  
20180301,8,뻔한 스토리와 전개 하지만 재미있게 볼만한영화  
20180301,10,관람객엄청 재미있었습니다 대박영화  
20180301,6,관람객딱 이승기씨 영화 입니다  
20180301,10,관람객여자분들이조아하는 로맨스코미디 넘넘조아써여  
20180301,1,이건 너무 심했다...  
20180301,8,관람객재밌었어용 지루하지도 않았고  
20180301,8,관람객저만 오글거리는건 아닌가봐요ㅜㅜ 캐스팅땜시 집중이 잘안되는거 말고는 잼나쑤요ㅎㅎ  
20180301,9,주인공들 다 잘생긴거실화냐고ㅋㅋㅋ내용도나쁘지않고 이정도면꽤나볼만한데?  
20180301,10,이승기 졸라멋싯오. 팬아닌데도 팬으로만드는마법…  
20180301,8,이승기 스크린 도전은 성공적ㅋ  
20180301,6,재밌었는데 최우식이 벌 안 받고 뭔가 흐지부지 끝난 느낌. 열린 결말 같다.  
20180301,7,관람객그럭저럭 관람할수 있는  영회ㅡ  
20180301,1,처음부터 심은경 이승기 이어질줄 알았는데... 내가 궁합 더 잘보는듯?  
20180301,10,관람객정말정말정말 재밌어유  
20180301,10,관람객승기 정말 멋지네 ^^ 재밌게 보고 왔어요 ㅋㅋ 최우식이 젤 무서워 ㅠㅠ  
20180301,6,보다가 잠들음 평점만 보고 기대하고갔는데 괜히 본듯  
20180301,10,이승기의 재발견. 연기를 이렇게나 잘할줄이야!!! 이 영화 일등공신이고 신생팬 엄청 늘어날듯.심은경은 매우 실망스러웠음.  
20180301,10,관람객중간중간 재밌는내용도 많고 볼만하네요  
20180301,10,이런거 잘 안쓰는데 이 영화 이승기 믿고 볼만하네요.  
20180301,10,관람객적당히 섞여이5는 개그요소들이 너무 재밌습니다  
20180301,9,관람객깔끔한 구성에 발암없이 기분좋게 볼수있다.  
20180301,10,살짝 중간에 지루해지는게 있었으나 그냥 보기엔 좋았음. 서도윤 활약이 좀 더 나왔으면 좋지 않았을까...싶고. 좀 아숩.  
20180301,8,관람객개연성이 조금 부족하긴 해도 재밌게 봤어요  
20180301,9,관람객가볍게보기무난하고 약간의 판티지  
20180301,10,관람객인생에서 사랑을 빼면 무엇이 남습니까  
20180301,9,아 여라 오글거리는데 재밌는거 ㅇㅈㅋㅋ  
20180301,9,좋았어요!!보는데시간도금방지나갔고!!  
20180301,9,영상이너무예쁘다아~~괜히사람설레게하는영상톤!  
20180301,10,코믹함과 진지함이 적절하게 잘섞여있당ㅋ  
20180301,10,빵빵 터지는 웃음과 잔잔한 감동  
20180301,1,내용은 괜찮은거 같은데 계속 졸았다. 옆에서 코고는 아저씨들 엄청 많음...  
20180301,9,이승기의 목소리가진짜좋네!사극이랑은근잘어울리는걸?  
20180301,10,마지막 결말까지도 내맘에 쏙 ㅎ  
20180301,1,하 핵노잼. 오글거림. 7점대도 아까움  
20180301,10,저 오늘부로 이승기 팬됬습니다ㅋㄷㅋㄷ  
20180301,10,"이승기,연우진,강민혁,최우식훈내진동  "
20180301,8,코미디영화였는데도 불구하고 스토리가 은근좋은데요  
20180301,9,사랑스러운 영화였습니다~ 연애하고 싶어지는 마음^^;;  
20180301,2,관람객솔직히 별한개도  아깝네요  뻔한  내용  뻔한 스토리  이래서  배우를 보고  영화보면  안된다는 것을   다시 한번  느끼고 옵니다  
20180301,10,믿고보는 이승기!사람들이 팬들 작작하라고 한들 이승기 나오는건 대부분 평타 이상인걸 어쩌냐..ㅋㅋ  
20180301,10,관람객넘넘재미있네요감동이있네요  
20180301,9,머리쓰면서 보는 영화가 아니라 더 좋았던것같음.  
20180301,10,재미있어요.가족끼리 와서 보세요.  
20180301,10,가족끼리 볼만한 영화에요!! 재밌었습니다^^  
20180301,7,관람객좋은 소재로 잘 만든 볼만한 영화  
20180301,10,배우들의 연기도 좋았고 스토리도 좋았고 구성도 탄탄했어요  
20180301,8,잔잔하게 흘러 가지만 웃음 빵빵ㅋㅋㅋ 이승기 넘 좋아  
20180301,2,평점알바 개심각하네 이걸 10점주냐 양심도 없이  
20180301,8,영화 재밌던데요?관상처럼 무겁진않구 그냥 가볍게 볼수있는 영화였습니다!그나저나 심은경 한복 잘어울리네여 ㅎㅎ  
20180301,8,관람객딸들과 재미있게 봤어염  
20180301,8,관람객무난하게 즐길수 있는 영화였네요^^  
20180301,8,너무 무겁지도 너무 가볍지 않아서 더 좋았던 영화  
20180301,9,옹주 역할엔 심은경이 딱이였고 서도윤역할엔 이승기가 딱이였다  
20180301,10,역시ㅎㅎ기대한 만큼 재밌군ㅎㅎ  
20180301,6,관람객편집이 많은듯한 느낌이라 감정이 잘 이해가 안될수도 있는데 그냥 볼 영화  
20180301,1,유치하고 오글거리고 뻔해서 보기 너무 힘들었구요 주연 캐릭터가 너무 무매력이고 어색합니다 설마 뭐하는거 아니겠지 라고 생각하면 백퍼 다 하는 영화.. 평점 알바님들 덕에 시간버리고 왔어요 감사해요 ㅋㅋ♥  
20180301,1,기대가 너무 컸나봄. 코메디도 로맨스도 뜨뜨미지근  
20180301,1,와진짜 이정도로재미없고 개연성없는 영화는처음 절대보지마세요 일점도아깝다  
20180301,2,지금 보고나오면서 남깁니다.. 진짜 재미없네요  
20180301,5,관람객아무생각없이 보면 코메디 영화 창고영화꺼내지말지..  
20180301,10,관람객재밌어요 추천합니다.  
20180301,1,월요일이 사라졌다 갑자기 상영 취소돼서 봤는데 그냥 블랙팬서 다시 보거나 집 갈걸 그랬네요  
20180301,8,관람객나중에 쫌 지루함뻔한스토리라인 but 주연연기는 좋았음  
20180301,8,관람객봄을 느끼게 해준 영화네요! 따뜻합니다  
20180301,4,기대 안하고 봤는데딱 그정도였습니다  
20180301,1,평점 댓글 알바생 있다는거 안믿었는데 믿게된 영화.  
20180301,10,관람객오랜만에 재미있는 영화본거 같아요. 마음이 간질간질 설레는 봄이 오는 기분이였어요.  
20180301,6,"관람객약간 밋밋합니다. 심은경 귀엽고, 이승기 연기잘합니다.  "
20180301,5,관람객모 그냥저냥 볼만했습니다  
20180301,1,이거 만점주는 이유 뭔지 알거 같아요 덕분에 까암빡 속았네여^^ 영화 클라멘타인인가요? 그 영화처럼 다들 의도하셨나봅니다 다들 화이팅!!  
20180301,2,관람객관상 넘사벽.음악감독 일한거 맞냐. 인생에서 사랑이 빠지면 무엇이 남겠습니까 대사에서 그따위 작위적인 선율로 영화 흐름을 흐트려놓아야했나연출력이 아쉬운 것인지 시나리오가 나쁘지는 않았는데 당최 찝찝함이 가시지 않는 작품이다.김상경은 정말 미스캐스팅  
20180301,4,지루해서 엉덩이 아파요  
20180301,10,"주연배우들 케미와 연기 너무 좋고 재밌다. 도윤의 도포자락과 검술 ,강직한 도윤의 모습이 멋지다..송화옹주를 돕는 도윤 너무 멋지다..봄같은 영화 궁합 또 보고싶다.  "
20180301,10,화면이 너무 예뻐요이승기 연기도 좋고 목소리도 좋고  
20180301,10,화면이 예뻐서 시간 가는 줄 모르고 봤습니다. 맨날 조는 남편도 재밌다고...ㅎㅎ  
20180301,8,관람객가족들과 재미있게 관람했어요  
20180301,8,관람객가볍고 산뜻한 사극영화  
20180301,10,스토리는 탄탄하지 못했지만 역시 믿고 보는 배우들이 총 집합해서 좋았던거같음! 이승기와 조복래! 정말 좋았던거 같음. 참고로 관상 못 봐서 궁합이 별로인지는 잘 모르겠다 내한테만 재미있으면 되지~^^  
20180301,8,관람객간만에ㅈ재미나게봤슴다  
20180301,6,관람객그냥저냥 너무기대하지말고보는게  
20180301,1,난 11점 짜리 영화라고 본다. 그래서 1점 더줬다. (보다가 잔건 쉿 비밀)  
20180301,10,관람객가벼운마음으로재밌게보았습니다  
20180301,8,기대안하고봤는데볼만하네요  
20180301,2, 유치하고 뻔한 스토리 정말 그냥 가볍게 보시면될것같고요 별 기댄 안하셨으면 좋겠네요ㅠ  
20180301,8,관람객재밌네요 ㅋ ㅋ흥미롭고 이승기 땜시 봤으요  
20180301,10,재미와 멜로가 적절히 잘 조합된 영화~~ 이승기목소리 죠으다~ 예쁜 화면도 좋고 조복래배우의 감초역할도 ^^  
20180301,10,대박 멜로영화네요~~^^ 웃음과 감동은 보너스로....간만에 영화다운영화 즐겁게 봤습니다!!평정 10점만점에 100점입니다^^  
20180301,8,관람객이승기 짱.txitsigxutsitx6riycogx6rsigzitsiydoyditsohcohxiyxiyxoucitxogxoyxoydigcigziyzitzjgzigxitzitziyxogxitxiyxigxigxigxitzitxihxhocihcycy8fi  
20180301,6,관람객생각했던것 보다 별로에요  
