0,1,2
20180310,6,"이승기씨 말만 듣고 처음으로 작품 봤는데 이 분 연기 참 좋았네요. 공주역할을 맡은 분은 많이 어색해 보였어요. 사극에 전혀 어울리지 않는 말투, 억양 등. 각본인지 연기인지 암튼 보는 동안 연기력이 많이 부족하구나 생각했어요. 한복은 최고였어요  "
20180310,2,역대 나온 한국영화중 최악..주위사람들 잘못왔다는  어처구니 없는 표정..일부 자고 있음  
20180310,1,0점은 없나요jQuery22405959271804941813_1520653413313? 진심...  
20180310,10,관람객말이 필요없어요!!최고예요.어우 짱 재밌었어요.  
20180310,1,"굉장히 실망한 영화. 이승기만 볼만하였고 여러가지 부분에서 허술함이 보였습니다.역사쪽에 지식이 조금만 있더라도 납득이 가지않는 부분이 너무  많았으며 ""재미""역시도 상당히 떨어지는 영화였습니다.돈주고 보기에는 아깝습니다. 다른 영화 보세요.  "
20180310,6,관람객결말은 항상해피엔딩 ㅋㅋㅋㅋ  
20180310,1,진짜 알아들 해도해도 너무하네.. 보는내내 지루하고 주인공 캐미 전혀 없다. 정말 간만에 본 영화중에 최악이었다. 두 주인공이 그냥 남매느낌뿐이 없다.  껴맞추기 사랑에...ㅎㅎ 진짜 어이 없더라  
20180310,5,지난 주말에  통신사에서  포인트로  예매를 해서 봤는데 마지못해 봤다. 보다가 잘 뻔 했다. 다만 내가 주는 포인트 5점은 심은경의 연기력이 8할의 지분이 들어가있다  
20180310,10,남편하고 친구들이랑 재미있게 봤습니다 스토리의 디테일이 아쉽지만 꽤 재미있고 영상들이 예쁘네요.  
20180310,1,사람마다 다르게 느끼겠지만 개인적으로 저는 영화값이 아깝다고 느낀 영화였어요. 좀 더 색다른 유머요소나 스토리를 기대했는데 전개가 뻔히 예상이 되고 유머요소도 주로 성적인 소재를 다뤄서 가족들이랑 보기 민망했어요..  
20180310,8,관람객즐겁고 유쾌한 영화였네요~좀 더 웃긴 장면이 나왔음하는 아쉬움이 있어요~^^  
20180310,4,"관람객관상 기대하고 보면 졸망, 재미없음. 구성어눌, 사건형성 미약, 관상학적 이론 배경도 안보이는 듯.그냥 배우보는 맛으로 별 두개  "
20180310,10,서도윤 매력에 푹 빠졌어요~^^  
20180310,4,지루하고 하품만 나오네요  
20180310,1,사랑타령 하다 쳐 망한 영화 ㅋㅋ  
20180310,10,관람객웃다가 나이탓인지 눈물도 남 ㅋ  
20180310,2,영화보고 실망해서 글남깁니다 좋은배우들 출연시키고 엉성한 스토리전개에 지루하여 영화시청중에 글남깁니다 지루합니다  
20180310,2,평점처음써보는데..정말지루하네요 어떻게평점이8이상이나올수있는지. 이건정말아니에요. ㅎㅎ  
20180310,10,관람객여든이신 엄마와 언니들하고  재밌게 웃으며봤습니다.특히 조복래님  연기도 좋았고 이분같은 연기자가 계셨구나 하는 느낌!?유쾌하게 잘 봤습니다.^^  
20180310,1,개인적으로 정말 최악이었던 영화.  
20180310,8,솔직히 조폭영화 자극성 심한 영화 투성이라 영화 고를때 늘 찜찜하다. 좀 더 밝고 힐링되는 따뜻한 영화도 좀 만들지...하는... 그 참에 참 괜찮은 영화 한편...  
20180310,10,"봄처럼 따뜻한 영화라서 너무너무 따뜻하게 봤습니다ㅎㅎ사랑스러운 영화, 영상미도 너무 예쁘고, 배우들은 더욱더 최고입니다ㅎㅎ젊은 배우들이 많이 나와서 즐겁게 봤습니다ㅎㅎ궁합 추천추천합니다ㅎㅎ따뜻하게 볼 수 있는 영화라서 너무 좋습니다.  "
20180310,1,헐 요즘영화수준이 왜이럼ㅠㅠ  
20180310,8,관람객생각없이 봤는제 재밌었어요  
20180310,1,별점 알바가 있다는 생각에 확신을 갖게 해준 영화.  
20180310,2,어제 보고 돈이 아깝단 생각을 한 영화  
20180310,1,시시하고유치합니다ㅜ  
20180310,1,이승기 빠순이랑 영화 알바랑 애쓴 보람이 있네 같은 졸작인 골든슬럼버는 결국 망했는데  ㅋ  
20180310,6,와 개연성 없고 심은경은 좀 연기력을 위해 무르익어야 할 듯... 인생의 경험 같은 것이 더 필요할듯... 그리고 영화 제작진... 부끄러워요.  
20180310,1,쓰레기라는 말밖에안나온다제작진이 망친영화인거같다 영화에 신경쓴점은 오로지 캐스팅밖에없었다 정신연령어린 여자애들이나 좋아할만하고각본은 중학생 인터넷소설보다 못했고연출또한 마찬가지  
20180310,7,상콤하고 봄에 어울리는 영화네요 서도윤 짜앙  
20180310,8,관람객보고 싶었어요 에서 감동이었어요 흑흑  
20180310,1,"헐.,.,.,.,.  "
20180310,8,관람객영화가 되게 매력있네요  
20180310,1,장르는 코미디 하지만 단 한번도 웃은적이없음  
20180310,1,진짜 보지마세요. 전개도 엉망진창이여서 집중도 안돼고 제 개인적인 주관이지만 여주인공과 남주인공이 어울리지 않습니다.  
20180310,10,관람객엄마랑 봤는데너무재밋었어요~근데 나랑 궁합맞는사람은 어딧는거디...ㅠ  
20180310,8,관람객끝이 좀 허무했지만 잔잔하게 즐길만한 영화  
20180310,1,관람객개노잼 음향도 잘안들리고 스토리도 이해가 잘안가고 유치함 코리안b급 애로영화같은 스토리  
20180310,8,관람객나름 괜찮은 영화였음 생각보다는  
20180310,1,ㅋㅋㅋ진짜..후..  
20180310,4,진행이 매끄럽지 못하고 유치해요...  
20180310,8,관람객잼나게 .웃으면서  잘봤서요.  
20180310,10,관람객잼나게 볼만 지루하지않은  
20180310,8,나쁘지는 않았다. 단지 좀 아쉬운 면이 있었을 뿐....이 짧은 시간안에는 풀 수 없는 것 같다.차라리 드라마로 만들었으면 좋았을 것 같다  
20180310,10,잘생긴 남정네들 덕분에 눈호강 제대로 하고 왔습니다 ㅋ  
20180310,9,시간가는줄 모르고 보게됨. 다들 풋풋하고 싱그러워..부럽다 젊음이..  
20180310,9,재밌네요. 어제 어머니랑 보고 왔는데 어머니도 재밌다고 하시고요  
20180310,8,관람객동양철학과 사랑의 만남 재미있게 보았음.  
20180310,10,관상이랑 180도 다른 스타일! 나름 매력있다  
20180310,8,유치뽕짝 스타일ㅋㅋ그럼에도 빠져든다..  
20180310,9,대사땜에 닭살이 돋았지만 나도모르게 헤벌ㄹㅔ 웃으면서 보게되는..;;  
20180310,9,생각없이 공짜표 생겨서 봤는데 꽤 재밌었다. 이승기는 남자가 봐도 ㅇㅈ  
20180310,10,궁합이라는 소재를 귀엽게 풀어낸 영화!  
20180310,8,재밌게 봤어요. 그냥 가볍게 즐기기 좋은 로코물입니다  
20180310,6,관람객영화 오래만에 재밌게 봤습니다  
20180310,7,승기가 군대가기 전이라 얼굴이 포동포동 넘넘 귀엽 ㅋㅎㅋㅋ  
20180310,8,"이승기, 연우진, 강민혁, 등등.. 다 잘생겼구나..  "
20180310,9,색안경 끼지말고 그냥 생각없이 보면 나쁘지 않을걸요 ㅋ  
20180310,8,마지막 부분에서는 감동까지ㅜㅜ  
20180310,9,유치함 속에서 느껴지는 재미 ㅎㅎ  
20180310,7,친구랑 넘나 재밌다구 할정도로 괜찮게 본 영화에요!  
20180310,9,오글거리는데 매력있는 영화>><  
20180310,8,사람들이 좋아하는 이유를 알겠어요 ㅋㅋ  
20180310,9,이승기와 심은경이 의외로 잘어울려서 놀람.. 볼까말까 했었는데 나름 나쁘지 않으듯?  
20180310,7,사극과 로맨스의 결합!! 넘넘 귀엽고 사랑스럽다  
20180310,8,가볍게 즐길 수 이는 로맨틱 코미디  
20180310,3,기대치에 훨씬 못 미쳤던 작품. 작품 내에 여러가지 사연을 풀어 놓고선 엔딩까지 회수하지도 않았다. 아직도 민호 눈이 멀었다는 건 무슨 설정인지 잘 모르겠음. 분명 로맨스일텐데도 소꿉장난 구경하는 기분이었다.( ????? )  
20180310,6,관람객그냥 쏘쏘하게 봤어요잔잔하다?  
20180310,1,아 정말 재미없어여 뻔하고 지루 10점은 정말 알바네요 ㅠㅠㅠ  
20180309,10,관람객기분전환하는영화~~좋네요  
20180309,1,이걸 돈주고 보는 내가 부모님께 죄송스럽다 돈아끼고싶은 마음이 절로들게하는 영화. 진짜 댓글알바 정ㅡ말 많다는걸 깨닫게해주는 영화.  
20180309,2,관람객재미없어요 재미없어요 재미없어요  
20180309,10,가볍고 상큼하고 맑은 영화에요 인생에 사랑이없으면 이라는 대사가 마음에 남아요 기대는 하지말고 보셔야 재미를 느끼는거같아요~~  
20180309,6,관람객가볍게 시간 보내기 좋은 영화.  
20180309,8,관람객넘 재미있게봤고 연기도 너무좋았어요  
20180309,1,아 씨 * 알바들한테 낚여서 이걸 돈주고 봤네.  
20180309,1,승기야.ㅇ....어쩌냐  
20180309,1,그냥 보지마세요ㅜㅜㅜ  
20180309,1,최근 몇 년간 본 영화들중 최악.수준낮은 애들 댓글보지말고.감독을 보고 판단하시길. 영화이렇게 만들기도 쉽지 않을텐데 참.. 영상미가 아름답다고 하는 또라이들은 영상미 아름다운 영화를 보질못했나. 인생의 첫영화를 본거냐 뭐냐 . 리틀포레스트가 훨 낫다  
20180309,10,관람객평점들이 너무 안좋은 것들을 보았는데 전 너무 반대해요 전 너무 재미있었고 또 보라면 또 볼수 있는 영화 였습니다 재미있었어요 ~  
20180309,6,"관람객일단 생각없이 보고 웃을수있는 드라마같은 영화.이승기비롯 다른 조연들연기는 진짜괜찮은데,신은경연기  어쩔...ㅠㅠ책을읽는건지...기가차서,보면서   내친구가 훨  대사를 잘한다고느낄정도...  "
20180309,2,진짜 유치해요. 저랑 동생은 너무 재미없어서 나올뻔했는데 부모님은 재밌다고 좋아하셨어요. 기대안하고 킬링타임용으로 가시면 괜찮을거같아요. 이승기 정말 연기 잘해요. 근데 걱정안했던 심은경 연기가 실망스러웠어요. 거슬릴정도는 아닙니다.  
20180309,2,아... 알바댓글에 낚였어요. 던져주는 메시지는 분명한데 지루해요. 주인공보다 감초들의 연기가 더 재밌었습니다.  
20180309,2,관람객유치합니다ㅜㅜ 그냥 진짜 할꺼 없을때 시간때우기용ㅇ  
20180309,10,가볍게 보는 영화 좋아하시는분들 보세요보세요♡♡ 불금에 잘봐써요!!!♡♡  
20180309,10,전기대안해서그런지재밌게봤어요  
20180309,2,완전 후회했네요~~재미없어요  
20180309,3,아 제발 이딴걸로 스크린독점좀 하지 마세요. ㅠㅠ온리 더 브레이브 이런게 왜 묻혀야 되냐고  
20180309,5,무난무난~ 이승기 사극 잘어울리고 심은경 눈동자가 이리 이쁜지 몰랐다.  
20180309,6,관람객여주인공에 대해 몰입이 안됨 마지막 전개가 뜬금없어요  
20180309,2,억지코메디에 뻔한 스토리 진부한 결말  
20180309,7,관람객너무 많은걸 담으려다가 이렇게 된건가; 허허허  
20180309,1,점수주기도 아깝다ㅋ진짜 패망패작임... 딱한마디로 요약해서 보자면 드라마 16부작을 1시간반으로 끌어모아 보여준 느낌?  
20180309,1,공짜로 봐도 시간아까워서 안 볼듯  
20180309,2,돈주고 보기 아깝고... 아무리 코미디라지만 유쾌함보다는 유치함이 더 컸다... 구성도 대사도 연기도 별로... 궁합이라는 소재가 아깝다...  
20180309,5,관람객그냥돈주고보긴아깝지만 돈내고보기엔좀 아까웟음  
20180309,1,"어색한 연기력, 어색한 전개, 7급 공무원 수준  "
20180309,8,"관람객지루하지않고, 그렇다고 명작이라고할만한정도는 아니고. 무난하게 어느누구와 함께 보든 볼만해요.  "
20180309,10,이승기의 사극 연기가 드라마 구가의서 때보다도 더 성장했다는 느낌! 심은경과의 케미도 예상보다 괜찮았고 조연들도 좋았음ㅇㅇ 생각보다 유치한 감이 없지 않았지만 한번쯤 볼만한 영화인 듯하다! 중간중간 가끔 나오는 웃음 포인트 꿀잼ㅋㅋ  
20180309,10,관람객대박나세요 화이팅입니다  
20180309,6,8점대는아니야...아니야....지금 볼게 너무없어...시기 잘탔어...  
20180309,6,관람객걍~ 승기님 보려고 보고왔어요~^^  
20180309,1,"골든슬럼버도  돈 아깝다 생각했는데 , 골든슬럼버보다  높은 평점이 이해가 안감.그나마 골든슬럼버는  안자고  봤는데자느라  내용도  중간부분은    생각이  안남.  "
20180309,6,정말 딱 6점입니다. 영화의 전체적인 색감은 감독이 의도했던 화사함을 느낄 수 있었지만 대사가 무진장 유치하거니와 내용도 거의 없다고 봅니다. 내용이 없는 영화니 그 점 감안하고 보시면 좋을 것 같네용  
20180309,10,최근에봣던 영화중 최고~!  
20180309,3,딱 인터넷 소설 수준..  
20180309,1,"화면이 이뻐 뭐합니까? 영화가 내용이 산으로 갔다가 바다로 갔다가 담을 이야기는 많아서 인지 중간에 확확 넘어가버리고, 차라리 후보 5명이 아닌 1명 연우진과 그 비리를 파헤치는게 더 재미있었을 듯 싶네요. 성드립은 또 얼마나 많은지.  "
20180309,1,스크린 쿼터제 폐지 제발  
20180309,10,알바아닙니다 처음엔 좀 지루해서 괜히 봤나했는데 뒤로갈수록 재밌네요>< 꼭 보세요~~  
20180309,3,관람객전 이 영화랑 궁합이  안 맞는거 같아요. 그래도 킬링타임용으로 가볍고 재미있게  볼 마음으로 극장 들어가면 좋을듯! 영화 색감은  정말 이뻣어요.  
20180309,3,집에서 다운이나 받아보셔 그것도 무료로다가...  
20180309,2,여기 다 좋다는건 댓글알바같아요... 정말... 너무 뻔하고 스토리도 탄탄하다고 못 느꼈어요 ㅠㅠ 평점같은거 원래 안남기는데 내돈주고 보기엔 아까운 영화였습니다 ㅠ  
20180309,7,관람객전혀 예상하지 못했던 전개였어요.. 결론은 재미없어요...  
20180309,10,재밌게봤어요 ㅋ 영화도좋지만 드라마원츄~  
20180309,10,재미있고 즐굽게 볼수 있는 영화 입니다.강추해요  
20180309,1,이게 영화냐?시간이 아깝네 ㅜㅜ  
20180309,6,관람객주말에 부모님 보여드렸어요  
20180309,1,별로.유치.10자채우기  
20180309,8,관람객재밌어요.기대않고 봤는데 소소한 재미가 있고 보고나면 기분이 좋네요  
20180309,6,관람객배우들 신선해서 좋았음~  
20180309,1,보다가 나왔어요 완전 실망입니다  
20180309,10,오랜만에 잼나게 본 영화입니다  
20180309,10,간만에 즐겁게 웃고 마지막에 감동도 있는 영화  
20180309,9,유치한 감이 있긴 하지만 요 근래에 이런 따스한 영화들이 몇 없어서 저에겐 아주 신선하게 다가왔네요 다가올 봄을 예견한 따스한 이야기와 개그코드들 그리고 영상미가 너무 예술이었어요  
20180309,8,연애하고픈영화♡재밌게 잘봤다 심은경 너무 귀엽다  
20180309,6,그냥 아무생각없이 가벼운 마음으로 시간때우기 좋을듯  
20180309,1,"평점 처음 남겨봅니다... 그만큼 최악인 영화ㅠㅠ 개연성도 너어무 떨어지고, 갑작스러운 분위기 변화에 웃기지도 않은 억지스러운 유머.. 그리고 여자주인공의 과한 연기..  "
20180309,6,관람객연인과 함께  가볍게  보기 좋은  영화.  
20180309,1,돈아까으ㅓ x발 영화보는내내 지루해OO 드라마인줄알앗노  
20180309,1,최악의 영화(라고 쓰기도 아깝다)  
20180309,1,지루합니다 영화가 좀 ? 중간에 나왔습니다 ㅠ  감독이 누구인지 참 ?  
20180309,8,관람객볼만한 영화임. 아무생각 없이 봤다가 키득키득하고 나옴  
20180309,4,돈아까웠던 영화 이게 왜 박스오피스 순위가 높은건지 의문  
20180309,1,"ㅋㅋㅋ 진짜 이거 레알 평론가들 말을 믿어야함 ㅋㅋ 진짜 뻔한 전개. 이승기는 어색한 느낌이아닌데, 심은경 연기는 진짜 좀;그냥 살짝(?) 돈 좀 쓴 단편 드라마 한편 보는느낌;;  "
20180309,8,봄에 보기좋은 영화인듯.  
20180309,10,핵 꿀잼!! 강추 합니다.  
20180309,1,1점밑은 왜 못주는가.  
20180309,1,진심으로 이게 재미있다고 하는건지 궁금해질 지경이다. 왠만한 한국영화를 다 좋아하는 나도 예고편을 보고 궁금하지 않았던 영화는 궁합이 처음이었다. 친구가 평점 높다고 보고 싶다고 자기가 보여준다고 해서 봤는데 중간에 나왔다. 그때 산 팝콘이 너무 아깝  
20180309,4,평점에 속아 본 영화...진짜 10점 주신분들은 알바신가봐요 . 댓글에 낚이는게 이런거였군...  
20180309,8,관람객그냥 보통입니당...  
20180309,1,돈 주고 보라그래도 안 볼것같아요... 대사도 너무 유치하고 편집도 이상하고...돈낭비 시간낭비했네요ㅠㅜ  
20180309,1,"이게 어떻게 평균8점이나 되있는거지? 내가 봤던 영화중 가장 유치한 대사에 몰입안되는 편집기술이었다. 코미디랍시고 사이에 몇개넣은 코미디는 웃음기가 하나도없었으며, 중반부터 사랑타령하며 들어간 쓰레기같은 유사명대사는 미친듯이 오글거리고 중2병같았다.  "
20180309,8,기대안하고 봤는데 재미있어요~  
20180309,10,배경도 그렇고 젊은층에 있어서 세롭네요. 세가지가 다들어가있어요 .음악 배경 로맨스 과하지도안고 억지로 짜여지지않는 궁합 잘봤어요. 이승기 나쁜남자로 나와도 좋을거갔아요.  
20180309,8,"관람객가볍게 볼 수 있는 로맨스영화,  킬링타임용으로 제격. 탄탄한 스토리는 기대말 것. 이런 스토리는 당연 해피엔딩!  "
20180309,1,이거 얼마전에 블랙팬서를 잡았다라나 뭐라나 하면서 언플하더만 그냥 빈집이었네 ㅋㅋ  
20180309,10,귀엽다가도 웃기고 웃기다가도 잠시 스릴넘치고 그러다가도 설레면서 영화가무엇을말하고있는지에 대해 공감가는 영화였숨당 어제봣는데 생각보다 재밌고 좋았슴ㅠ  
20180309,1,처음으로 댓글단다 리얼노잼...  
20180309,6,관람객내용이 다소 억지스러워서 매끄럽지 못했다아주 가볍게 보면되는 로맨틱코미디 정도  
20180309,1,알바극혐 천원도아까움  
20180309,1,진짜 이승기..의리로 봤다...내가 왜 돈주고 영화관에서 봤는지 모르겠다..스토리 다튀고 계연성음꼬 인물들 왜그러는지 모르겠고..그냥 화난다!!!!  
20180309,1,믿고 거르는 한국영화 한국영화는 돈받고봅시다  
20180309,1,이딴 영화 만들돈으로 불우이웃을 돕자  
20180309,1,심은경 어떡하냐.. 수그 이후로는 진짜 한개도 빠짐없이 싹다 망했네... 아련..  
20180309,1,알바 개 오래 쓰시네.. 이 정도면 사기 수준 아닌가요? 너무 하시네요. 이렇게 재미 없는 영화를 억지로 팔아 먹고 한 순간 이익 보면 끝날 거라고 생각하시죠jQuery22403844367563989952_1520533856693 앞으로 네이버 평점 아무도 안 믿을 거  
20180309,2,승기형아 요번에도 미안해요요번영회도 그렇게 재밌지가않아요..진심말그대로 궁합보다영화인데 전 별로네요  
20180309,10,인생에서 사랑을 빼면 머가 남나요~~~^^잼나게 잘보고 왔습니다  
20180309,9,애초부터 유치하라고 만든 영환데 뭘 그리 기대함 ㅋㅋ 목적에 맞게 아주 잘 만들었다고 봄. 그저 결말부의 약간 억지 전개가 아주 아쉬워서 별 하나 뺌.  
20180309,1,코미디 인데 와진짜 지루하고 잠와서 두번 자다가 깼는데 그나마 꼬마도령이 쫌웃기고 완전 재미 없다 진짜 웃음 제로 잠이 와서 죽는줄  
20180309,1,재미없음웃길려고하는건지 감동을주자는건지여배우가 너무 캐릭터랑 안어울림  
20180309,8,완벽하진 않지만 그낭 그럭저럭  
20180309,1,올한해 영화 리얼을 뛰어넘는 진정한 대작  
20180309,3,초등학생용. 멜로사극  
20180309,9,심은경 먼가 인생?사주? 가 불쌍하다 느꼈으나 이승기만나는걸로 행복 .. ㅜ 가볍게 보기 좋은거같아요  
20180309,1,보지마라....돈아깝다ㅋㅋ  
20180309,6,기대보단 별로네요 스토리도 많이 아쉽고..배우들 연기는 좋았지만 로코인데.. 설레지도 않고 빠져들기힘듬ㅋ..그냥 주인공들이 너무 안어울리네요.. 둘궁합은 별로인걸로..  
20180309,2,아무리 최근에 볼영화가 없었다지만 이게 백만이 들었다고? 이승기가 군대가기전에 찍어서 전역한 후 개봉한 이유가 있다 올해 아니 최근 3년간 극장에서 본 영화 수십편 중 단연 최악  정치기사 댓글알바뿐 아니라 영화평점 댓글알바도 잡아야된다고본다  
20180309,1,"평점 0점은 못 달아..? 0점, 이게 내 평점인데...  "
20180309,8,"사극치고 무겁지 않은 영화 12세 관람 다움내용이 조금 유치해서 그렇지 배우들 연기가 조금 가려지는 느낌이 든 게 너무 아쉬움ㅠㅠ개인적으로 영화가 재미있어서 2번 봤고, 외국인 친구도 재미있게 봄  "
20180309,1,이건 그냥 전래 동화였음 은비까비 이야기급  
20180309,1,이런 거 처음 다는데 진짜 졸라 재미없음  
20180309,6,생각보다 유치하고 너무 빠른전개임 뭔가 시간이 부족한 영화임 내용에 더 있어야될것 같은 이야기 보고난후 후련하기보단 부족한 느낌  
20180309,2,음....솔직히 너무오글ㅠㅜ  
20180308,2,평점개구라다 ㅡㅡ속지마라  
20180308,8,관람객인생에서 사랑을 빼면 무엇이 있겠습니까?  
20180308,8,영상도 이쁘고 내용도 상콤상콤하고..좋았습니다~  
20180308,1,으앙...ㅠㅠ울거야...ㅜㅜ내돈  
20180308,1,솔직히 너무 유치해..  
20180308,1,어디서 영상미를 찾을 수 있다는건지...  
20180308,10,이승기 넘 멋있고 사극에 잘 어울려요 사극 드라마도 부탁합니다  
20180308,1,영화상영 내내  끊었던 담배가 생각나게 한 영화  
20180308,2,유치해요...스토리도끊어지는감이있고...연기어색하고...하..ㅠ  
20180308,5,관람객그저그럼 막 재미있지는 않지만 소소한 재미는있다  
20180308,1,지루하고너무재미없어요~요즘한국영화가더재밌는데진짜재미없었음 재미있다는사람다알바인가?  진짜돈아깝고하나도안웃기고 이렇게재미없는영화 오랜만인듯 후회  
20180308,10,재미있습니다심은경의 코믹과 자신의 역할에 맞는 옷을 입엇달까이승기의 향상되 연기력 아주 훌륭한 보이스 캐스팅은아주 훌륭합니다  
20180308,1,지루하고 유치한내용.  평점믿고 보러갔다 완전 실망하고왔네요. 뭐가재밌다는건지 1도 모르겠다는...제취향과는 거리가 멀어서인가봅니다.  
20180308,8,관람객재밌게 잘봤습니다~~~  
20180308,6,"앞부분에선 잘만들었다 생각하며, 빠져들고 있었습니다. 뒷부분부터는 분명 눈물나는 로맨스인데 너무 웃겨서 배잡고 봤네요... 사랑을 빼면 인생에 무엇이 남는단 말입니까? 그 부분부터 끝까지ㅠㅠ.. 후반만 잘 마무리했다면 대작이었을텐데 아쉽습니다.  "
20180308,8,관람객생각보다 괜찮았어요 ㅎㅎ  
20180308,1,내용은 둘째치고 옹주캐스팅 최악이였다  
20180308,1,기본적인뻔한스토리에 정신없는 짤막하고뚝뚝끊기는전개 보는 내내 지루했습니다. 배우들은 연기를 잘하지만 뭐하는건지모르겠는대사와 끊기는전개가 집중을 흐트려놓는군요.  
20180308,1,"만약 영화를 보지 않았더라면, 2시간동안 할 수 있었던 다른 일들이 무엇이였는지 생각나게하는 영화.  "
20180308,1,관람객노잼 리얼로다가 핵노잼...  
20180308,1,관람객이런영화처음입니다... 이승기연기빼고는다..별로 내용도..이상 그냥 이상한드라마하나보고온느낌입니다  
20180308,10,관람객코믹도 있고  잼있니다.  궁합보다 직접격어 보는것이 중요하다는거~  
20180308,10,관람객뻔한거 빼면 재밌었습니다  
20180308,10,이런따뜻한사극오랜만이네요~ 이승기씨역시훈남이신듯~♡  
20180308,1,알바 구분법 평점 10점짜리를 올려놓은 닉네임을 클릭한다. 평점 등록이 한개밖에 안되어있다. 그 ㅅㄲ 알바다  
20180308,1,진짜...노잼...남자출연자들 얼굴보며 나가고싶은거 참으면서 봤다  
20180308,10,관람객가볍게 보는 사극..  기분좋게 관람했내요  
20180308,10,난   재밌게 봤음. 무슨 말이 필요함  
20180308,6,관람객이승기씨연기가좋아서그나마볼만했어용  
20180308,1,한국영화 끝물인걸 점점느낀다  
20180308,8,보통 이승기 연기가 어색함  
20180308,6,드라마좋아하면 좋아할것같습니다 저는 드라마를 안좋아해서 별로였어요  
20180308,8,조금유치한감은잇었지만 중간중간코믹요소들덕분에 재미있게보고왔어요~~마지막즘 눈물도한방울흘려주고^^드라마로제작했으면더재미있었을듯^^  
20180308,4,관람객어떻게 평점이 이렇게 높지 눈에 뭐가 씌여 이걸 보러 갔을까이런 영화를 영화관에서 보다니 웃음이난다  
