0,1,2
20170304,10,관람객신념에 대한 이야기 실화 감동적입니다.  
20170304,10,"관람객신념에대한 ...  살면서 꼭 , 젊은이들이  꼭 봤으면 하는 영화입니다  "
20170304,10,가슴 뭉클한 영화. 실화라는게 더 놀랍다.  
20170304,10,관람객오랜만에 좋은 영화봤네요^^  
20170304,8,관람객미국 우월주의 색채가 강하고 신념이 강한 도스를 믿어준 여자 주인공 같은 여자를 만나서 사랑하는 모습이 아름답다  
20170304,10,"개그요소, 개연성, 줄거리 부터 시작해서 전쟁씬 까지 나에게 있어서는 모든것이 완벽한 영화였다. 주인공은 이상한게 아닌 독특한 멋진놈 같다  "
20170304,10,시간가는줄 몰랐다. 개독이라면 학을 떼는 나지만 이거는 진짜 추천해드림. 전쟁영화 좋아하시는분들은 필히 관람해야함ㅋㅋ  
20170304,10,좋은영화네요 잘봤습니다 근데 평보면 병역거부라하시는데 집총거부지 병역거부가 아니에요....  
20170304,10,감동적이면서도 화가나기도 하고 저는 흥미진진하게 감상했습니다  
20170304,10,좀 더 하나님을 느끼게 하는 영화  
20170304,8,리얼하다. 멜깁슨이라 기대했지만  전투신 뺴고는 큰 감흥이 없다.  
20170304,9,전쟁영화 좋아하시는 분들이라면 추천합니다.  
20170304,10,관람객너무 감명깊었던 영화 :)  
20170304,10,관람객실화을 바탕으로  현실감  굿굿  
20170304,8,"충분히 느낄 수 있었던 신념,  주인공 외의 캐릭터들의 힘은 다소 아쉬웠던  "
20170304,9,후반이 좋다.1010  
20170304,10,"죽기전에 꼭 봐야할 명작인것 같습니다.아직도 여운이 가시질 않네요.아쉬운점이라면, 상영하는 극장이 많이 없다는거네요;;  "
20170304,6,점수분포보소  10점이 73% 이정도면 공산당 아니냐 절대 이정도 수준 아니다영화 보고 적어도 삼일 후에 점수 줘봐라 진짜 10점을 줄 수 있는 영환가  
20170304,9,이 영화는 전쟁장면만 봐도 가치가 있다.  
20170304,10,관람객너무 감동적이네요!!  
20170304,10,감동이네 명작이군요 ㅎ  
20170304,8,관람객전쟁 묘사가 매우 현실적. 스토리라인은 평범.  
20170303,9,영국에서 감명 깊게 보고 옴. 우리 나라에서 생각보다 반응이 작은 거 같아 아쉽네요.  
20170303,9,관람객재밌게 잘봤습니다. 추천  
20170303,10,멜 깁슨의 할 말을 들어 낸 용기를 높이 삼전투를 경험한 듯함  
20170303,1,"시체를 방패 삼아 달려가면서 일본인 사살하는 장면,화염방사기로 일본군 싹쓸이하는 장면 등등 아주 비현실적인 전쟁신이 많이 거북함..  "
20170303,10,아픈과거 때문에 생긴 작은산념이었지만 그끝은 창대했다  
20170303,10,신념을 가진 사람은 가장 큰 용기를 얻는다  
20170303,9,이영화가 어딜봐서 기독교인에 대한 미화라는거지.. 사람을 죽이기 싫은건 누구나 다 같은마음아 닌가   부처가 됬든 하나님이 됬든 그 신념하나로 사람을 구하러 전쟁에 뛰어들어가는데 어디부분이 미화라는거지? 신 믿으니깐 살아남았다는 뜻인가?  
20170303,10,관람객주인공의 신념~너무너무 감동적~!!!!신념은 두려움도 이겨낼수 있는~강한 그 무엇~나를 반성케 하는 영화~  
20170303,10,진심 명작인데 왜 창원은 상영을 안하지... 속상함  
20170303,10,가필드..스파이더맨 보고 괜찮고 잘생기고 그정도의 배우라고 생각했는데 이 영화 덕분에 정말 다시 봤다. 진싱으로 팬 됐다.  
20170303,10,올해 본 영화중에 가장 재미있게 봤다.전쟁씬이 정말 실감나더라.양심적 병역거부자에 대해 다시 생각하는 계기가 되었다.근데 저런사람 몇이나 될까 하는 생각도 되더라..  
20170303,7,멜깁슨. 클린트이스트우드. 어릴적 유명 배우들께서 나란히 감독 잘하시네. '실화'가 아니었다면 말도 안되는 스토리 갖고 진행한다며 궁시렁댔을텐데. 믿기 힘든 감동실화. 멜깁슨이 만들어내는 전쟁씬은 갈수록 노하우가 쌓인듯.  
20170303,10,반전은 필요없어 영웅이 필요할뿐  
20170303,10,관람객도스의 연기에 인상깊었어요다시한번 그에게 박수를 보냅니다.  
20170303,10,"관람객재밌어요. 장면들 실감나고 몰입되고, 좋은영화입니다.  "
20170303,10,"영화 보는 내내, 나라면 저 상황에서 저럴수 있었을까? 하는 생각이 든 영화였습니다.  "
20170303,10,관람객오랜만에 감명깊은 영화관람이었습니다. 관람 강추합니다^^  
20170303,7,관람객뭔가 .. 뭔가가.. 아쉽다  
20170303,10,밴드오브브라더스가 영화로 나왔다면 이랬을것.우선 실화라는 점부터 놀랍고 마지막 인터뷰 장면은 많은 것을 생각하게 했다.  전투 장면 묘사 부터 일본군의 만행 그리고 미군의 그 암울한 심리묘사등등  전쟁영화와 드라마적 요소를 모두 잡았다.  
20170303,10,군인이라면 꼭 봐야되는 영화 top3안에 드는 영화  
20170303,9,이거 보면서 라이언 일병 구하기가 문득 생각났다 ㅋㅋㅋ  
20170303,10,감동~~꼭 봐야 할 영화  
20170303,10,완벽한 영화~~감도입니다...맬 깁슨과 앤드류 가필드에게 경의를...쌤 워싱턴도 멋져요^^신념을 갖게 되었어요...꼭 바야할 영화이고 돈 아깝지 않은  영화입니다...  
20170303,8,종교보다는 개인의 가치관에 관한 영화. 너무 애국적이라 작품상에 어울리는 작품인지는 의문스러움. 2차대전 시절에 이미 미국은 그 가치관을 존중하는 시스템을 갖고 있었다. 우리나라는 아직 멀었네.  
20170303,8,초반에는 쪼금 지루할수있으나 재판부터 뭉클하더니 전쟁에서 숨막히고 결말에서 감동과 존경...  
20170303,10,라이언 일병 구하기 이후 대박 전쟁 영화  
20170303,9,관람객재밋게 봤다.. 무슨말이 더 피료해?  
20170303,8,관람객잔인히긴 하지만  종교적 신념을 잘표현한듯  
20170303,10,양심적 병역 거부자들에 대해 다시 한번 생각해 볼 수 있었던 영화.올바른 신념을 가지고 기적을 일으킨 그를 존경한다.  
20170303,10,실감나는 전투씬잘봤습니다  
20170303,10,사스가 멜깁슨.. 영화다보고 박수침  
20170303,10,관람객신념이 생기기까지 일련의 사건들을 다루는 부분과 처절한 전장에서 몸부림치는 그 실천이 퍽 감동을 주었습니다.  
20170303,9,영화에 대해 이야기 하면서 '하느님 믿는 사람이 무기 없이 군대에 들어가서 의무병으로서 많은 병사들을 구하고 온 이야기'라고 소개했는데 옆에 있던 사람이 정색을 하면서 '기독교는 그런거 안해요'라고 말함...진짜 우리나라 개신교도들이 포용력  
20170303,10,간만에 전율을 느꼈다.  
20170303,9,올해 대박영화~ 몰입도 최고 시간가는줄 몰랐던 시단들 이런 영화가 흥행되야하는데~  
20170303,10,관람객라이언 일병 구하기 이후 최고의 전쟁영화  
20170303,8,"Mel  ""The God"" Gibson.  "
20170303,10,수많은 주검속에서 총으로 사람을 구하다! 미화된 측면도 있지만 실화속에서 신념을 중히 여기는 잘 만들어진 영화.  
20170303,10,관람객신념에 대해서 생각해보게 만드는 영화.  
20170303,10,나에게도 생명을 향한 주인공과같은 마음이 있었으면~~~  
20170303,10,초현실적인 헌신이 느껴지네요;; 진짜 보는내내 시간가는줄도 모르고 봤습니다 11점 주고싶네요  
20170303,10,관람객감동적입니다재미있어요  
20170303,9,신념이라‥‥ 현실 사회에서 소위 말하는 외골수가 아닌가 단체 생활에 있어서 자기고집만 부리는 부적응자라 할수있다 더군다나 명령불복종 이라니 상식적으론 납득이 안간다 하지만 결국 받아주는 미국문화와 자신만의 정신력신념이 또하나의영웅을 만든게 아닌가싶다  
20170303,5,영화는 그럭저럭 지루하진 않았습니다.실화 이기도 하고 주인공이 총도 없이 대단하다는 생각은 드는데 미국식 영웅만들기에 솔직히 염증을 느낍니다. 참고로 제칠일안식교를 기독교라고 싸잡아서 욕하는분 있는데 엄연히 프로테스탕트  와 제칠일 안식교는 다릅니다  
20170303,10,두시간 가까이 된다는데두시간인지도 모르고봣음  
20170303,10,관람객감동 그 자체 였습니다!  
20170303,10,처음부터 끝까지 지루하지않게 봤네요   별기대안하고 본영화인데 정말 감동적이고 재미있었습니다  10점이 아깝지않은 영화인거같아요  
20170303,10,라이언일병구하기 태극기 휘날리며  ?  쨉도안된다.대단한 명작중 명작이다 10만원 주고 봤어도 돈안아깝다  
20170303,9,대작. 명감독 명배우가 빚어낸 걸작.  
20170303,7,화끈한액션은 아닙니다. 전쟁이 얼마나 잔인한지 보여주는 영화입니다. 이런영화는 재미를 논하기 애매하네요. 저는 재미있게 봤어요. 여친이랑둘이서 보심 여친이 싫어하실수도.. 존잔혹한 장면이 많아서 실화라서 더 놀랍운 영화.  
20170303,10,그냥 아무생각없이 보는데 전투신이 뭐가 이렇게 처참하냐 지금까지 본 전쟁영화중 이게 진짜 전쟁같았다. 스토리도 좋고  
20170303,10,관람객너무나감동적이고 인간의 의지가얼마나강한지알게되었다  
20170303,7,"인간의 신념이 영웅을 만든다. 신은 동기부여만 할뿐,  "
20170302,10,최근본 전쟁영화중 사실감과 감동 두마리를 다  잡은 영화인듯하다. 보는내내 가슴이 먹먹했다.  
20170302,8,평론가들 글쓰는 폼새가 참 딱하구나 그리도 표현력이 없고 영화를 보는 안목이 없으면서 어찌 평론가를 자처할까.ㅉㅉㅉ실화영화라면 최대한으로 과장을 피하고 있었던 그 일 자체를 여과없이 보여주는 것이 미덕일 것인데...  반전을 기대하다니....  
20170302,9,초반엔좀지루한감이있지만 전투씬은정말몰입해서보게되네요. 강추영화bb  
20170302,1,"전쟁영웅이긴하나 평점믿고봤다가 무척실망이다.재미도 감동도 없지만, 그렇다고 10점을 줘야만하나?  "
20170302,10,대단하다 대단해....  
20170302,9,몰입도대박이다! 추천  
20170302,7,"여호와의 증인은 이렇게 할 자신 있으면 군대가고, 아니면 감방 가라. 종교가 아닌 신념의 승리였을 뿐 특정종교는 미화될 자격이 없다. 생명의 가치를 수호하기 위해 75명을 구한 한 위인만을 칭찬하고 싶을 뿐..  "
20170302,9,관람객영화와 메시지 자체만 놓고 볼 수 있다면 굿굿  
20170302,10,여느 다른 전쟁영화와는 사뭇 틀린 잔잔한 감동을 안겨준 영화  
20170302,10,감동적이다.  그거면 됐지 뭘 더 바라는건가?  
20170302,9,관람객남들이 보기엔 그의 신념은 미련해보이고 이해할수 없지만 그에게 있어 신념은 그를 새상 누구보다도 강하게 만들었다  
20170302,10,"""Medic!!! Help me!! "" 소름이 돋았다  "
20170302,10,관람객인간의 의지와 신념에 대해 생각하게 끔 하는 꽤 만족스러운 영화. 실화라는 점이 놀라울 따름이다.  
20170302,9,관람객평점보고 선택했었는데...역쉬~~ㅎㅎ  
20170302,10,누가 이 영화의 개봉관에 저지를 했을까? 분명 영화는 대작인데 상영관과 상영시간을 아무도 보지 못하게 누군가가 돈으로 매수해 조작한 것 같은 이 느낌은 무엇일까요? 우리가 이렇게 미개했나요?  
20170302,8,앤드류가필드가 잘 크고 있구나. 언제나 최고의 각본은 실화다.  
20170302,10,very toucing. I was surprise for tthat this movie was the true story. I cry sooo much. It was just awsome and amazing. Respect Desmond.  
20170302,9,허남웅이 만점줄 영화는 남조선이 적화통일 되는 영화일듯. 하다못해 시나리오라도 써본인간들이 평론을 하면 어떨까?  
20170302,7,왜 일본군은 절벽위 사다리를 철거하지 않는가?  
20170302,10,양심적 병역 거부자라는 말은 바로 주인공 같은 이들을 두고 하는 말이다. 겁쟁이라서가 아니었다. 총을 들지 않겠다는 자신의 확고한 신념일뿐 그는 가장 용감한 이었다. 독특한 신앙관을 가졌지만 나라를 위해 싸우겠다는 마음만은 남들과 다르지 않았다.  
20170302,10,저는 이 영화가 종교를 떠나서 '도스'라는 인물이 자신의 신념을 바탕으로  사람의 생명을 존중하고 구하는 것에 깊은 감동을 받았습니다. 요즘 같은  현실에 '도스'와 같은 인물이 존재했다는 것에 마음에 위로를 받았습니다.  
20170302,1,개인취향이겠지만 별로...  
20170302,10,관람객너무재밌어요!!!!강추!!  
20170302,10,"""신념은 바로 자신이다"" 정말 인생 최고의 영화였어요..  "
20170302,9,"관람객실화를 바탕으로 한 영화인만큼 확실히 내용이 좋네요♥ 실제 에피소드를 녹여낸 점, 드라마틱한 구성들도 너무 좋네요  "
20170302,10,관람객눈물 흘리며 본 영화!!ㅠㅠㅠㅠ  
20170302,10,솔까 평점은 평론가보다 일반인이 말하는게 더납득이간다. 평론가들은 너무 모순된것같다...  
20170302,10,깊은감동과 여운을 주는 영화전쟁씬은 역대급 장면..그리고 테레사 팔머 진심 예쁘다  
20170302,9,용산롯시] 멜깁슨은 배우로서 보다 역시 감독으로서 더욱 감탄하게 된다. 재미와 감동 모든걸 잡았다. 단순한 종교영화이상이라 본다. 내용면에선 개인의 고집이 좋은 결과로 귀결됬기에 신념이라지만 아니었다면 어리석다는 비판넘어 욕을 먹었을 거다.  
20170302,10,라이언 일병 이후로 전쟁을 잘 묘사한 내 인생의 최고의 영화  
20170302,9,관람객감동적인 내용및 극적인 최고의 전투장면등  강추할 만한최고의  명작  
20170302,10,마지막에 삽입된 인터뷰 내용은 영화가 끝난 후 스쳐 지나갔던 장면들을 되새기게하며 감동을 주기 충분했다.한 인물에 초점을 맞춰 몰입도도 좋았고 단지 개인적으론 그의 신념에 집중하느라 사랑하고 입대하는 내용이 약간 빈약해긴감이있어서 조금 아쉽다  
20170302,9,너무 리얼한 장면들이었지만 진정 숭고한 인간의 믿음에 경의를 표합니다 다시는 이런 비극이 일어나지 않아야합니다  
20170302,10,진~~짜 감동이었음...최고의 전쟁영화^^또 보고싶다  
20170302,10,관람객실제 있었던일이라서인지 감동 이었습니다  
20170302,10,너무 감명 깊은 영화 였습니다. 이런 영화가 많이 상영하지 않는 것이 이해가  안되네요.  
20170302,8,관람객재미있었습니다. 전쟁씬이 실감나고 좋았어요  
20170302,10,2시간20분 동안 높은 집중력으로 자리를 떠본적이 없다..  
20170302,10,한명만 더....이 대사에 울컥 울컥....이런 좋은 영화가 개봉관이 이렇게 없다니...  
20170302,1,"실제로 오키나와 전투는 미군 60만,일본군3만4천+오키나와민간인8만이 싸운 전투임. 마에다 능선(핵소고지)의 경우 실제 미군은 전차,화염방사차,폭격기,전투기,전함포격 동원됨. 일본군 그에 대항한 잔존병력 중화기로 맞써싸운 이미 승패가 예정된 전투임.  "
20170302,10,관람객완전짱정정말너너무ㅋ  
20170302,10,감동과 재미 .꼭보세요상영관이 없어서 불편했지만그래도 볼만한영화  
20170302,10,그의 숭고한 희생정신에 경의를 표합니다..영화도 엄청 재밌었구요!  
20170302,10,전쟁영화가 이렇게 감동적일수가....  
20170302,10,전쟁영화이지만 이렇게 감동을 받기는 처음이다. 개인의 신념을 따라 총을 거부하며 전쟁터에서 사람을 살리는 병사가 된 데스몬드 도스 그는 진정 영웅이었다. 이 영화를 만든 배경을 살펴 보았더니 더 감동이다 그는 그의 이야기를 만들지 않기를 원했다.  
20170302,9,관람객신념의 위대함을 다시한번 생각해보게하는 영화..감동!!  
20170302,10,"난 신을 믿지 않는다. 하지만 데스몬드 도스는 초인이요, 위인임이 틀림없다. 개인의 삶에서 신념을 가지는것이 이토록 가치있는것임을 다시 한번 상기하게 된다. 그 동기가 종교에서 비롯되었든, 다른 무언가에서 비롯되었든 상관없다. 신념은 위인을 만든다.  "
20170302,8,지하통로에서 일본군이 못보고 지나갈만한 은폐술 기가막혔다. 잘만든영화 추천!  
20170302,10,평론가리뷰에도 업다운있었으면좋겠다영화보고쓴건지의심되네  
20170302,10,좋다~ 엄청 잘 봤다~ 믿고 봐라~  
20170302,10,역시 멜깁슨 영화잘만든다....영화너무 재미있게잘봤습니다. 참고로 평론가들은 평론하지마세요..영화보는데 방해만됩니다  
20170302,10,관람객넘나재밋어요.ㅎㅎ최고인것같아요꼭보셈들  
20170302,8,연출은 10점 만점에 11점짜리~!  근데.. 스파이더맨 연기가 개 구림.. 기본적인 감정표현만 할줄알지..  전쟁터에서의 그 어떤 공포심.. 패닉 연기는 못하는듯..  
20170302,8,관람객실화를 옮긴 영화 감동햇어용  
20170302,8,재미가 아닌 한 인물을 그려낸 영화로 좋았다. 다만 전쟁소재는 어쩔 수 없이 영화의 반은총알이 날라다닌다. 신념이 얼마나 큰 힘을 주는지 알게 되었다. 보고나면 조금이나마 삶의힘을 얻는다.  
20170302,10,그냥..꼭 봐야하는 영화일듯..!  
20170302,9,기대하지 않고 봤다가 몰입하게 된 영화! 댓글 남기게 되네요. 상영관이 많지 않아 아쉽네요.  
20170302,9,일본인들 발연기만  아쉽다  
20170302,10,"종교를 떠나서, 주인공의 신념에 감동.  "
20170302,6,관람객실화를 바탕으로 한 영화를  좋아하는데 ? 잘봤습니다  
20170302,10,이런 대박영화가 왜 지금 상영을 잘안하는지 모르겠어요.진짜  전쟁영화중 최고인듯 ..이게 실화라니  정말 .. 놀랍네요  
20170302,10,관람객앤드류 가필드가 연기 최고네요  
20170302,10,신격화 허구적인 과장이 아닌 실제 이야기 종교보다 자신의 신념에 충실했던 진짜 영웅의 이야기  
20170302,8,관람객좋아하는 배우의 연기를 봐서 좋았다  
20170302,10,당신의 신념에 질문을 던지는 영화. 실화를 바탕으로 올바른 신념이 주변을 어떻게 변화 시키는지 보여주며 지나간 역사로 미래를 바꿀 수 있다는 신념과 현재의 나를 돌아보게 만든다. 실제 전쟁을 겪은 인물들과 영화를 만든 멜깁슨 감독에게 찬사를 보낸다.  
20170302,10,"설마 이게 실화라고는 생각못했는데, 정말 대단하다..군대가 의무인 우리나라에서 '양심적 거부자'하면 뻔한 시선으로 쳐다보곤 했는데, 이제 약간의 다른관점도 생겼다.  "
20170301,10,저는 개인적으로 라이언일병구하기보다 더 좋은 작품이였습니다.  
20170301,10,관람객재밋음진짜재밋어요ㅎ  
20170301,10,올해 최고의 영화길이길이남을 나만의 명작  
20170301,10,관람객첨부터 기다리고 기대했던 작품이에요.. 실화라 더 감동했구요 ㅠㅠ!! 한번 더 보려규요  
20170301,10,관람객극장에서 사람들이 박수까지 치던데. 상영광 좀 늘려주세요.  주인공과 스미티 . . . 두 남자의 찐한 우정! 잊을수가 없네요!  
20170301,10,"내가본  전쟁영화씬중 최고 몰입감 예술 단 한씬도 불필요한씬이없고 정말재밌었어요  눈물도 살짝 찔끔 ㅠㅠ 일본쪽바리들때문에 소리두번 지름 놀래서,, 저는 정말 재밌게봤네요 정말 돈아깝지 않았어요 영화관에서 안봤으면 후회할뻔한 영화 정말 만족합니다 !!  "
20170301,7,"백병전, 고지전 하에서 보병의 운명은 어떤 것인가? 멜 깁슨은 클린트 이스트우드에 이어서 ""진짜 미국 영웅 찾기""에 두각을 드러낼 것으로 보인다.  "
20170301,9,특히 전투씬이 전 영화들보다 디테일하고 현실성있게 촬영되어 재미있었다  
20170301,10,왠만하면 댓글안쓰는사람인데요. 평론가 새x들은 정말 노답인듯  
20170301,9,감동실화 지리구연ㅠㅠ  
20170301,10,지금까지 본 전쟁 영화 중 최고인 듯!!근데 상영관 수  좀 늘려주세요...하루에 2번은 좀..  
20170301,10,마지막 전사한 전우를 챙기는 모습이 전율단순 자존심을 세우는게 아닌 신념을 지키는 모습이..  
20170301,10,벅차게오르게 하는 영화  
20170301,10,관람객감동 그자체였네요..  
20170301,10,재밌어요 추천합니다.  
20170301,8,"신념으로 가득 찬 영웅인가?, 아니면 보통 사람들 보다 뛰어난 초인인가?  "
20170301,10,관람객감동그자체입니다 액션신도 짱이구요  
20170301,10,정말 감동적인 실화 영화.  
20170301,10,"제 삶의 전쟁배경 영화 중에서 닥터지바고 이상의 영화.실존인물이라서 더욱 감동.I Help me get one more. 감동에 빠진 날 당분간 세상에서 구해주지말기를. 믿음을 전파하고 싶다면 이들처럼.신앙,종교영화라고 하기엔 신념과 위인영화!  "
20170301,10,아주 훌륭한 영화!3번이나 봤음요!이 영화를 종교적의도가 담겨져있다고 몰아가시는분들은 책 좀 읽으셔야할듯하네요.그리고 영화 끝무렵에 앤드류 가필드의 수류탄을 쳐내는 모습은 픽션이든 실화이든간에 아주 잘 찍으신것같습니다.  
20170301,10,관람객순간 순간?최선을 다해서 살아야 겠다는  반성! 을 준 영화 ?  
20170301,9,일본군들 대가리 터지는장면이 일품입니다  
20170301,10,".,:;""-.,'-  "
20170301,10,와 진심 어의없다 영화 시간 없어서 못보는데 간만에 아카데미 봐서 상받은 영화라서 보러고 했는데 다 내림 개봉한지 2주도 안됫는데  
20170301,7,관람객밴드오브브라더스 라이언일병구하기 재밌게보신분들은 좋아할듯 감동적인 영화  
20170301,10,정말 감동적인 영화였습니다 간만에 눈물이 흘렀네용 강추~~  
20170301,10, 웃기고 로맨틱하며 신앙적이면서 사실적이고 스릴넘치며 긴장감있고 교훈적이고 감동적이었다. 여러가지 요소들을 잘 조합해 넣어서 재밌게 보았다.  
20170301,10,관람객굿굿 왜 상영관이 적은지 모를정도로 명작  
20170301,9,관람객전쟁영화 보면서 울컥한건 처음인듯  
20170301,8,"초반부에 또 예수쟁이 영화야? 하고 싫어했는데, 이게정말 100%실화라면 정말 대단하다  "
20170301,10,원래 평점 잘 안하는데 평점쓰게 만드네요  
20170301,7,"사람을 구하는건 역시 무기, 종교가 아니라 신념멜깁슨 거장에 올라서다  "
20170301,10,"종교적 신념을 지킬 수 있는 사람이 지구상에 몇이나 있을까..심지어 실화라는 것이 놀랍고 영화적요소도 놓치지않아서 놀랍다. ""한명만 더"" 대사는 잊을 수가 없다  "
20170301,8,관람객감동적인 영화에요....구성는 약간 허술하지만 나름 만족스러웠네요  
20170301,8,민감한 사회적 주제를 너무 단순한 영웅적 소재로만 그려낸게 아쉽다  
20170301,10,"관람객영화가 끝나고 나서도 진한  여운에 발길이 떨어지지 않았다.한마디로 감동적이다.이렇게 훌륭한 영화가 어떻게 이 정도 밖에 알려지지 않았는지 안타깝다.재미,스토리,연기,스릴,음악 등 거의 완벽하다.  "
20170301,10,관람객감동적인 영화.개인의 신념에 대한 확신  
20170301,9,"간만에 사실적 영화를 보내요...   영화가  아무것도 모르고 봐야 재대로 평이 나오는법,  종교가 이영화에 주가 아니라 목숨을 건 전우애가 영화가 전하는 내용인데.. 무슨  종교 얘기가 이래 많어   영화 끝까지 보고 말하기를...  "
20170301,10,실화여서 더욱 몰입하게 되는영화  잘만든 영화입니다  
20170301,1,인천상륙작전보다도 노잼이라  정말 많이 실망.  
20170301,10,와... 패션오브크라이스트 멜깁슨 한국서 제7안식교는이단이나 미국에서는 이단이아닌 개신교로써 5번째 큰교단.. 종교인들 부끄러워할줄알아야한다.  여호와의증인 대답해보아라 이단이든 아니든 양심적 집총 거부하고 의무병이든 기술병이든 들어가서 봉사해라  
20170301,10,그냥 명작 보면 압니다 보세요  
20170301,9,인간의 신념에 대해서 다시한번 되돌아 볼수잇엇고.실화를 바탕으로해서인지 진심이 느껴졋습니다.  
20170301,8,영웅이니...그사람 종교가 뭐건 중요하지 않다...위생병 굿~...  
20170301,9,관람객감동실화라서 감동먹엇습네다!!  
20170301,9,담백하고 크게 과장되지 않는 잔잔한 스토리 라인이 인상적인 영화.  
