0,1,2
20170708,7,"스릴, 서스펜스, 스펙터클한 전투신 덕분에 시간 가는 줄 모르고 봤다. 영화가 말하고자 한 건 그게 아니었겠지만.  "
20170708,10,전쟁영화 보면서 울어보는건 처음이다  
20170708,10,관람객눈물이난다~ㅠㅠㅠㅠ  
20170708,10,허남웅 면상이 궁금하네  
20170707,9,관람객주인공의 감정선이 너무 애뜻해요  
20170707,10,한명만 더 구하게 하소서  
20170707,10,자기자신의 신념 하나로 나라를 구했다..!  
20170707,10,단순 종교영화라고 치부할게 아니다 너무 감동적 ㅜㅠ  
20170707,10,실화냐? 는 이런 영화를 보고 나서 쓰는 말입니다 최고에요  
20170707,10,우리나라 진짜 참전용사 박대하는거 나라로써 할짓이아니다 진짜  
20170706,9,고증도 완벽하고 표현력도 완벽하고 스토리도 완벽하고 감동까지 ㅠㅠ 대박이다  
20170706,10,"신념을 지키는 삶이 무엇인지, 말이 아니라 행동으로 보여준 실제 영웅의 이야기를 영화로 담아냈다.  "
20170706,10,울나라 고지즨 모티브 얻었지?요. 인정하삼  
20170706,7,"극사실주의 영화로는 손색이 없지만 감동이나 재미 면에서는 조금 떨어지지 않았나 싶고, 조금 밋밋했음. 다만 타 영웅들을 살리려 했던 도스의 신념과 행동에 찬사를 보내고 싶음. 그래서 평점 7점 줍니다. 잘 봤습니다.  "
20170705,10,때를 놓쳐서 늦게 봤는데 이렇게 멋있고 감동적인 영화는 처음이었다  
20170704,8,"2시간20분의 짧지 않은 러닝타임이, 짧게 느껴졌다.개인적으론 관객을 잘 빨아들이는 영화가 좋은 영화라고 생각하는데. 그런 의미에서 난 핵소고지에 완전히 흡수됐었다. 다만 아쉬운건 주인공이 너무나도 초현실적인 인물로 묘사돼서 거리감이 느껴지는것정도  "
20170704,1,종교적인 관점을 빼고 보더라도 재미없는 영화.  
20170703,10,허씨 다운 헛소리ㅋㅋㅋ 이런 영화에 반전 ㅇㅈㄹ 자격 재심사 필요하다 대체 누가 평론가로 인정해 주는거??  
20170703,10,악의축 잽 열자열자열자열자  
20170702,10,"너무 감동적이고, 이영화가 실화라는 점에 또 한번 감동한다  "
20170702,10,여호와의증인들에게 이 영화를 권합니다.  
20170702,10,"일본 영화사이트 핵소고지 평은 이렇게 좋지 않습니다. 일본에서 보고 오는길인데 일본애들이 ""일본인 얼마나 죽였냐?"" 라고 들어서 너무 웃겼음ㅋㅋㅋㅋ 개인적으로 평점 100++  "
20170701,10,영웅은 전쟁이 있기 때문에 존재한다.우리에게 필요한건 영웅이 아닌 반전이다.  
20170701,10,이 내용들이 실화라는게 믿기지 많는다.전우들 구하는 장면 장면마다 숨죽이고 봤다.묘한 감동의 전율이 흐른다.부족하지도 과하지도 않게 보여준 수작임에 틀림없다. 멜깁슨 감독이 연출한  브레이브하트에 이어 핵소고지 또한 내 마음속에 영화로 기억 될거같다.  
20170630,10,감동 먹었어요.전쟁신에서는 가슴을 졸여가며 봤습니다.비쩍마른 체격에 75명을  구해냈다는 사실이 ~~!! 정말 대단합니다.  
20170630,10,제발 별 한개만 더 주게 해주세요  
20170630,10,인간이 저지를 수 있는 최악의 상황인 전쟁 속에서 아이러니하게도 인간미의 극치를 보여주기에 더 가슴이 찡해지는 휴머니즘 영화의 백미...  
20170630,7,"영화자체는 정말 훌륭했지만, 실제 모델이었던 분이 살아있으셨더라면 과연 이 영화를 보고나서 뭐라했을까?  "
20170629,10,신념에 10 점. 한사람의 신념은 모두를 바꿀수 있는 에너지.  
20170629,10,"별 기대안하고 봤는데, 전투신도 매우 리얼하고 인간의 신념에 대해 다시 생각해보게 되는 영화  "
20170629,10,평점 잘안남기는데너무 감명깊게 봤음 .. 최고 ㅜ  
20170628,8,간만에 괜찮았던 전쟁영화  
20170628,10,오래간만에 본 의미있는 명작  
20170627,10,뭐 이렇게 악플이 많아. 이해안된다는 사람도 있고.. 도대체 뭐가 이해가 안됩니까?  
20170627,8,종교의 색이 짙은영화 별로지만 대단한 신념이다~ 영화 굿  
20170627,10,제일 기억에 남는 영화가 될 것 같습니다.   신념이 저리 굵다니.. 멋있습니다.  
20170627,8,8점 이상 받을 자격은 충분하네요  
20170627,10,good job영화에서 주는 메세지가 매우뜻 깊었습니다  
20170626,8,매우 사실적인 전쟁묘사와 가슴 뭉클한 영웅의 실화 이야기...허남웅씨 여기서 반전을 왜 바라는 건가요? 영화를 너무 많이 보셨세여...  
20170625,10,전쟁영화 싫치만ㅠ넘잼나용  
20170623,10,말이필요없는영화 오랜만에 영화다운영화를보았습니다전쟁의 참혹함을 잘살려냈기에 그안에서 주인공의 신념이 더빛났던영화  
20170622,10,감동적이다. 이런게 정말 히어로영화 아닐까  
20170622,8,전쟁에서 영웅이 나오고 영웅은 신념에서 나온다  
20170621,10,기독교의 색이 강한 것을 떠나서 생명의 존엄성을 느낄수있는 명작이었다  
20170621,3,재미없던데 핸드폰으로 봐서 그런가. 여주는 개이쁨  
20170620,3,점수 높네요. 전쟁 영화인 줄 알았는데 그냥 개독영화..그의 희생과 용기는 성경책에서 나옵니다. 신앙심은 신념이 아닙니다.  
20170620,10,굿최고 졸잼 꿀잼 완전잼  
20170620,10,소름돋았어요....  
20170620,10,믿음!신념! 최고의 영화!! 도스! 당신은 구세주입니다!!  
20170619,8,모든 인간적인 것이 사라지는 전쟁속에서 아이러니하게도 가장 필요했던 것은 양심이었던가  
20170618,10,오랜만에 이런 별점. 불굴의 신념이 만들어낸 드라마.  
20170618,9,"흔하디 흔한 영웅영화, 킬링타임용 전쟁영화가 아니라서 일부는 실망할 수는 있을거다. 그런데 자신과 다른 신념을 가진 사람도 방식이 달랐을뿐 위대한 일을 해낼수 있다는걸 알려준다. 생각해볼 여지가 많은듯. 살면서 나도 다른 영웅을 무시해오진 않았나?  "
20170618,10,양심적 병역거부자는 죄가 아니었다 근데 전쟁은 누구를 위해 하는건가  
20170618,10,단점이 보이지않는 완벽한영화  
20170617,10,종교를 떠나.. 한 사람의 신념이 이렇게나 대단한 일을 해낼수 있다는 것이 놀랍다. 꼭 보시길.  
20170617,10,반전..반전이 필요했나? 곰곰히 생각해봐도 버러지같은 생각이다 ㅋㅋㅋㅋ 평론가새기들  혀깨물고 안뒤지냐?  
20170617,10,전쟁의 참혹성 속에 자신의 신념을 지키는 도스의 모습이 정말 감동적입니다!! 실화이기에  잊지 못할 영화^^  
20170616,8,"가슴으로는 그를 지지하지만, 글쎄... 전쟁터 한가운데 우리 중대원이라면.... 머리로는 끔찍한 상황이다.  "
20170615,10,영화 정말 잘 만들었다. 이런 영화류는 전쟁신이 허접하던가  스토리 개연성 둘 중하나는 뒤쳐지는데 둘 다 어느하나 빠짐없이 정말 잘 만들었다.  
20170614,10,관람객완전 재밌어요!!!!  
20170613,9,그냥 아주 많은 꼭 봐야할 영화에 손색이 없는 그런영화  
20170613,9,실화를 바탕으로 했기에 +1점. 앤드류가필드를 보고있자니 영화 '사일런스'를 다시보고 있는 착각을 하게만든다. 지나친 종교적 신념을 이야기하는 영화는 눈살을 찌푸리게만든다. 물론 이는 한국의 개독교 때문이겠지.  
20170613,10,정말 꼭 보세요. 최근에 본 영화중에 최고입니다.  
20170612,10,재밋따 뭉클함 ㅎㅎㅎㅎ 역시뭐니뭐니해도 쪽바리는 싸그리다모아서 대가리가자르고토막내서 쥐먹이로줘버려야됨  
20170612,10,와진짜...최고다...감독이 멜깁슨인것에 더 놀랏고 실화였다는거에더놀랍고 진짜 최고다  
20170612,10,글로 표현이 안되는 최고의 영화  
20170612,9,감동적이네요...ㅠㅠ  
20170612,9,전쟁이란 정말 참혹하다... 그와중에 빛나는 실화... 믿기지 않는다 일본과 미국 싸움에 희생되는 군인들... 맘아픔  
20170611,10,내 인생 단연코 최고의 영화. 사람의 마음가짐이 다른 사람들의 마음을 이끌어 낼 수  있다는 것을 보여준 사례. 도스가 밤새 다친 전우들을 내리지 않았다면 다음 전투에서 그만한 사기로 일본의 항복을 받아낼 수 있었을까?  
20170611,10,가족끼리.봤는데 정말 감동적인 영화였어요. 제 인생 영화입니다. 꼭 보세요!!  
20170611,10,최고의 영화입니다.보는 내내 가슴이 두근거렸습니다.  
20170610,10,단지 종교나 영웅물이 아닌이걸 보고 진짜 느낀게 많습니다...특히 대부분 나라를 제외한 우리나라에서는 범죄가 되는양심적 병역 거부...  슬픈 한국의 군대 현실  
20170610,10,기존 영화들과 다르게 전투장면보다 구조 장면에 더 초점을 맞춰서 신선한 영화. 부상도 굉장히 사실적이고 보고난 후애도 감동이 큼. 나의 인생영화 하나 추가  
20170610,10,위대한 신념. 가슴을 울린다  
20170609,10,총 안들고  저렇게 용감할 수 있을까 라는 생각이 들고 군필이지만 전쟁의 참혹성은 시각적으로 다가오니 전쟁은 일어나선 안된다고 생각이 드네요  
20170609,10,오랜만에 좋은 영화 본거 같아요 영화관에서 못본게 아쉽네요  
20170609,9,지금껏 본 전쟁영화 중 최고였다...총이 메인이 아니었던 전쟁영화..  
20170609,10,확고한 신념만큼 자신을 강하게 만드는것은 없다.. 재미없을줄 알았는데 보는내내 소름돋음..  
20170608,9,'우리에겐 데스몬드가 있다'  
20170608,10,정말 감동적이고 좋습니다  
20170608,10,뻔한 내용을 재밌게 잘살렸습니다. 전투장면은 정말사실적이여서 전쟁의 참상을 제대로 느꼈습니다...세계의자유를 위해 싸우신 모든분들께 감사드립니다  
20170607,10,살다살다 이런 영화를 보다니그냥 가슴을 뛰게 해준 영화단 빨갱이 좌빨들이 싫어할수 있는 영화..  
20170607,7,그래.. 어쨋든.. 죄다 군대를 보내자~ㅎㅎ  
20170607,7,"고난의 상황에서 그 사람이 보여주는 행동이 그의 모든 신념이며, 신념이 두터울수록 그 가치가 발현된다.  "
20170607,10,이런 사람들 때문에 다른 사람들이 세상에서 숨쉬고 살 수 있다  
20170606,10,"보는 내내 대단하다는 말밖에 안나오는 그런 영화, 신념을 지킨다는게 얼마나 용기 있는것인지 보여준 영화  "
20170606,10,"한명만 더, 한명만 더, 살려야한다  "
20170606,10,보면서 울었다. 시간이 어떻게 갔는지 모르겠다. 진심 명작이네.  
20170606,10,종교가 아닌 한사람의 신념 그리고 용기와 사명감  
20170606,10,초반은살짝 지루한듯했으나 단연최고의영화입니다  
20170604,6,신념을 가진 사람의 위대함을 담은 영화..!시간이 지날수록 멋있어 지는 데스몬드  
20170604,10,감동적..근데 난 2차대전 태평양전쟁물만 보면 저 일본군 중에 강제 징용 끌려와 반자이 어텍 강요 당하며 개죽음 당해간 많은 우리네 할아버지들이 있었겠구나..생각하며 가슴이 아픔.  
20170604,9,실화였다니!! 우리나라도 병역 거부자들은 총만 안들게 하고 군대 보냈음 좋겠지만 다 민폐 관심사병 될듯..  
20170603,10,진짜최고입니다말이필요없네요꼭보시길그리고평론가들의글같지않은글에말을잃었습니다  
20170603,10,종교를 떠나서.. 그때 당시 그 자리에서 홀로 75명을 구하는 그 시간동안 데스몬드 도슨이라는 분이 느꼈을 책임감 외로움 공포감 슬픔 불안함 ..그모든게 다 느껴지는 기분이였습니다 . 영화도 매우 잘 만들었지만 그분에대한 존경심이 생기네요  
20170603,10,.. 하느님께서 특별히 임무를 주신 분 같다. 주님의 뜻을 실행하고 그것을 보게 해준 사람..  
20170603,10,허남웅 ㅋㅋㅋㅋ 실화 바탕 영화 보면서 반전 드립치네 ㅋㅋㅋㅋ 우동뇌인듯  
20170603,8,관람객종교를 가진 사람이 어떤 식으로 생활에 지장이 가지 않게 하는지 알 수 있었습니다.  
20170603,10,"뭉클하다. 전쟁이란 이렇게 무서운 것이구나. 누군가를 지키려고 하는 정신, 자신의 신념과의 괴리. 어려운 얘기다. 근데 이게 실화라니.. 남 녀 두 주인공의 미소가 매력적이다. 좋은 주제를 실화를 배경으로 잘 풀어 주었다. 감동적이다.  "
20170603,10,앤드류가필드 연기 굳굳  
20170603,10,감동의 연속입니다 please load help us  
20170603,10,이 실화의 주인공인 데스몬드에게 경의를 표한다  
20170603,10,자신의 신념을 지키기위한 위대한 노력이 아름답다.  
20170603,10,이건 내 인생 영화다... 후유증이 심하다  
20170603,10,완벽하다 무슨말이 필요할까  
20170602,9,수작이다. 특히 중반부터의 전쟁은 극사실적으로 표현하여 전쟁에 대해 막연하던 생각에 깨우침을 일으킨다. 근데 허남웅? 정말 평론가로 밥벌어먹고사는사람맞나? 실화에서 반전을 찾다니. 어벤져스 너무 많이보신거아녜요?우쭈쭈~  
20170602,10,정말로 의미있고 재밌는 영화 입니다.  
20170602,10,어제 비디오포털에 무료로 떠서 봤는데 감동적이더군요. 극장에서 봤어야 했는데 후회되네요.  
20170601,10,말이 필요없는 영화 보지 않으면 느낄 수 없다  
20170601,10,정말 감명깊게봤습니다 ..종교적신앙을떠나서...영화가 가슴에너무 와닿네요 그전쟁터속에서 자기자신을 믿었다는게 대단하네요  
20170601,7,그런데로 볼만함 너무 영웅화 종교적냄새등이 쫌...  
20170531,7,난 종교가 없지만 실화에서 오는 스토리가 감동적이다.  
20170531,8,전쟁영화는 뭉클함이지  
20170531,10,전쟁을 현실적으로 그려내면서 이야기도 감동 그 자체다  
20170531,10,감동적인 영화 시간이 안아까웠다  
20170530,10,전쟁에 나가는데 무기를 들지않고 사람들을 구해낸 후 살아서 돌아왔다는게 정말 놀랍네요..  
20170530,10,눈물나는 전쟁영화..  
20170529,10,간만에 울림이 있는 영화다. 강추  
20170528,10,힘들고지칠때종교를찾고믿고의지하지만결국엔그것또한내신념이아니면안되는것종교를떠난인간의위대함을느끼게해준영화  
20170527,9,잘 만들어진 실화 베이스 영화 재미도 있고 감동까진 아니지만 볼만한 가치가 있다고 느낌  
20170527,10,실화라서 더욱 위대했던 영화. 공동체의 룰을 위반해서 피해를 입히자 동료들로부터 폭행을 당했고 조직의 부조리에 분노해 방황하기도 했다. 하지만 결국 신념을 지켰다. 사랑하는 아내와 부모님이 있었기 때문. 신념을 지켰고 핵소고지에서 기적을 일궈냈다.  
20170527,9,음...감동이 있네요...눈물낫네요...종교적 영화는 아님...일본은 역시 소름 ....  
20170526,10,자신의 소신들 굽히지 않는 용기와 한 사람 한사람에대한 간절함이 묻어나왔던 영화입니다. 개인적으로 여러번 봤는데 잔인한 장면이 있어서 보기 힘든 부분이 있었지만 가슴뭉클함이 있던 좋은 영화였다고 생각됩니다.  
20170524,10,타아타닉 다음으로 인생영화 등극 일주일에 3번 다시봄 진짜 감동 소름돋음 ㅠㅠ 앤드류 가필드 진짜 연기잘하네요 멋있어 멋있어  
20170524,10,정말 잼있게 잘봤습니다  
20170524,5,"영화 자체는 괜찮았는데.. 솔직히 주인공의 신념은 상당히 이기적인 신념이네요... 애초에 그럴꺼면 군대에 지원을 하지 말았어야지, 그렇게 사람 살리고 싶었으면 공부해서 의사가 되던가... 영화는 잘 만들었는데 솔직히 주인공의 행동은 이해는 안가네요  "
20170522,10,종교를 크게 믿는 편은 아니고 전쟁을 다룬 영화라 다소 잔인한 부분이 나왔지만 굉장히 감명깊은 영화였다. 어느 종교이냐를 떠나서 그 강인한 믿음과 이를 바탕으로 보여준 기적은 감동을 충분히 불러일으켰다.  
20170522,8,폭탄보다 크게 터지는그의 신념  
20170521,10,라이언 일병 구하기 이후 내 생애 최고의 전쟁 영화다!! 적을 죽이는 것 뿐만아니라 아군을 살리는 것도 엄청난 전과라는 걸 깨닫게 해주는 영화!!  
20170521,10,실화라서 감동적입니다. 정말 전쟁은 너무 잔인합니다. 일어나선 안됩니다.  
20170521,7,매드 맥스가 또 한 껀 해냈구나. 오랜 만에 본 제대로 된 전쟁영화.  
20170521,10,군인이란 죽이는 것만 하는 존재가 아닌누군가를 구하고 무언가를 지키는 존재  
20170520,10,"데스몬드, 잊지 못 할 이름일 것 같네요. 종교도 없고 전쟁이나 군인에 대한  깊은 생각을 해 본 적 없는 사람이지만. . 생각하게 만드는 멋진 영화였습니다. 실화라.. 소름끼치게 감동적이면서 .. 전쟁은.. 역시 끔찍했습니다..  "
20170520,10,"영화의 작품성도 중요하지만 영화라는 매개체를 통해서 전달하고자 하는 의미들을 좀 알면서 봤으면 하는 영화. 실화를 담은 영화로써 그 순수한 의미를 너무 잘 표현해내었고, 주인공이 어벙벙 할수 있지만 그만큼 그사람의 모습을 일부러 담아낸 것임을 알아라.  "
20170519,8,실화라니 믿을 수가 없군 ;;  
20170518,5,"주인공이 조금 가벼워보이는것만 빼면 괜찮았는데 후반  슬로우모션 진격은 너무 진부하고 주인공 수류탄 테니스, 축구차기는 완전 깬다.  "
20170517,5,"미뽕과 신뽕에 취해서 몰핀달라고 악을 쓰다가, 100kg 거구 쨉애들 반격하는 거 보고 기겁해서 웃다가 사레들림.  "
20170517,6,실화이기에 최대한 실화적으로 보이려 했으나 허술한 부분이 다소 노출됨. 잘 만들었기에 그만큼 작은 흠 조차 아쉬움. 빈축을 살 정도는 아님.  
20170515,10,관람객감동적이었네요 뚜렸한 소신과 용기 대단했습니다  
20170515,9,모든 면에서 보시길 추천~  
20170515,10,진짜 전쟁영화 싫어해서 믿고 거르던 십대 여자인데요 보는 내내 와 이런 명작을 놓칠 뻔 했구나 생각하고 감탄하면서 봤어요..볼까말까 고민하신다면 꼭 보세요 추천합니다ㅠㅠ그리고 앤드류 가필드 넘 머시쪙ㅠㅠ연기잘해요ㅠ  
20170514,1,전투신 특수효과는 나름 괜찮은데 감정이입이 안되는 영화  
20170514,10,와...진짜 정말인생영화라고 할 정도로감명깊게봤다..앤드류가필드 원래 좋아했는데 이영화보고 또 반했다♥  
20170514,10,ONE MORE... 믿고 보는 멜깁슨감독의 작품입니다.  
20170514,10,보고나서 멍해지는.. 시간가는줄도 모르고봤네요최고였습니다 ..  
20170514,10,허세와 영웅심리 없이 진지하고 겸손하게 가장 큰 용기와 업적을 보여준  최고의 전쟁 영화. 주인공이 진심으로 존경스럽고 배우고 싶었음.  
20170514,8,멜깁슨이 대작영화를 하나 만들었다  
20170514,9,영화보다 영화같은 실화  
20170513,10,최고. 평론가들 뭐하냐  
20170512,3,내 스타일은 아니다 액션신은 볼만했다. 쨌든 난 아직 멜깁슨이 좋다.  
20170512,10,당신의 희생이 헛되지 않았음을 기억합니다..  
20170511,10,와 진짜 미쳤다...묘사들이 너무너무 현실적이라서 전쟁터에 내가 있는느낌이 들었다. 전쟁은 정말 없어져야 한다고 느꼈고 80명을 넘게 구한 데스몬드 정말 대단하다고 생각한다. 마지막에 실제 인터뷰영상 보면서 눈물이 터지더라 와 정말 이 영화 대박이다.  
20170511,10,시간이 아깝지않은 영화였습니다!!!!  
20170509,10,"한 사람이 75명을 살린 것이, 실화라는 사실에 완전 깝놀함~!  "
20170509,9,감동적이다 도스 그는 짱짱맨!  
20170509,10,와...평론가들 진짜 ㅈㄴ 꼴보기 싫은 말을 뱉네..난 완전 뭉클하고 스릴넘치고 재밌었는데  
20170508,10,전쟁영화 중 가장 최고인듯  
20170508,10,감동 감동 감동 무한감동~  
20170508,9,종교를 떠나 도스의 신념과 희생은 볻받아 마땅하다.  
20170508,10,오랜만에 대작을 만났네요. 정말 훌륭한 영화입니다.  
20170508,6,앞절반질질끄는거 참지못하고 도중에 그만봤다.  
20170507,10,사람을 변하게만드는영화 이제 다른종교라고차별하지말아야겟다....  
20170507,10,실화를 바탕으로 만든 감동으로 소름돋게 만드는 영화  
20170507,10,625당시 수많은 양민들 목을 잘라 쌓아놓고 프사찍던 김일성에 대한 평가는 아직 이르다는 경기도교육감 이재정! 힘없이 고개떨군체 처형당하는 유대인 영상은 수없이 접하면서 정작 625참상은 햇볕정책의 영향탓인지 찾아보기 힘들다. 아픈 비극을 잊지말자!  
20170506,10,"처절한 현실 앞에 던져진 우리는 어떤 존재인가? 또 어떤 행동을 취할 수 있는가? 그 존재의 질문에 관한 답을, 도스 이병을 통해 찾는 영화. 신념은 평범한 자에게 영웅이 될 용기를 준다. 그러나 역시 일어나선 안될 개 같은 전쟁의 단편들..  "
20170506,10,일단 도스의 가치관에 박수를 치고 싶네요.그리고 이 영화가 잔인해서 싫다는 사람들은 이해가안가네요.;;전쟁이 애들 장난도아니고 오히려 저것보다 더 심한데 그리고 종교영화라고 하시는분들은 종교를 가진 사람들이 다 저렇게 할수있는것도아니고  
20170506,4,클린트가 보이는 보수주의 영화  
20170506,10,항상 좀비물에만 집중도를 보인 나를 집중하게 만든 영화속 동료를 위한 그의 헌신적인 모습에 크나큰 감동을 받았다 물론 배우도 참 괜찮았다  
20170506,10,내 신념을 지키며 살 수 있을까?에 대한 생각을 하게 해준 영화. 잊지말고 지키며 살자  
20170505,10,재판때 도스의 아버지께서 하신 말씀에 공감한다.  
20170505,10, 자신이 믿는 것에 대한 확고한 신념 그거하나로 관객을 울리는 구나.. 영화 주인공한테 배워간다 종교에 대한 배움이 아니라 참고로 나는 무교다  
20170505,10,관람객첨엔 좀 지루 했지만 보다보니 빠져 들게 되었다'ㅜ  
20170504,8,와... 위생병이 이렇게 많은 사람을 구하다니.. 감동  
20170503,10,"영화 초반부에 양심적 병역거부에 대해 나올떄는 군필자로서 너무 답답햇지만, 헥소고지에서의 전쟁의 참상을 너무 잘 묘사했으므로 종교적 인 요소가 있더라도  명작임은 틀림없다  "
20170503,10,보세요 잔인한 일본 ..  
20170503,10,내인생 최고의 전쟁영화다 진짜 잘만드셨고  천국가셨으리라고 믿어요 ㅎ  
20170503,10,이게 실화라니...오키나와 전투를 다시 한번 알아본 계기가 되었습니다.  
20170503,10,관람객개꿀잼 절대 후회안해요  
20170503,9,첨엔 주인공이 답답해보이다가 갈수록 멋지고 섹시하기까지! 포마드 헤어가 진짜 너무 잘어울리고 뒤통수마저도 완전 이쁘다. 내용이야 두말할것도 없이 감동적이고 연출도 디테일하게 잘만든 영화임. 꼭꼭 보시길.  
20170503,10,안보고 말을 하지말라..  
20170502,10,"생각이 다르면 차별받는 현실, 자신의 신념을 존중하지 못하는 나약함. 우린 모두 신념이 있다. 다만, 커가며, 타협하며, 스스로 위로하고 외면하며...그렇게.. '그'들이 되어간다. 영화를 마치며, 먼지쌓인 내 책장 속에 신념을 다시한번 꺼내보았다.  "
20170502,10,오랜만에 울컥하면서 봤습니다  
20170501,10,"평론가 이 ㅂ.,ㅅ들은 뭐하는 새끼들이지? 난 이영화에 10점을 주겠다.  "
20170501,9,이 영화를 종교 영화나 단순한 이단종교의 영화로 취급한다면 진심으로 영화를 평할 자격이 없다. 종교와 상관없이 생명의 존엄함과 소중함을 다룬 영화이다.  
20170501,10,나에게 또 하나의 새로운 역대급 전쟁영화  
20170501,10, 신앙의 힘  내게도  그런 용기가. . .  
20170501,10,한마디로 암이걸렸다가 후반가서 암이 나은 영화!  
20170501,10,저게 신념이고 용기다.  
20170430,10,"신념을 끝까지 지키고, 위생병으로서 목숨걸고 누구보다 최선을 다한것에 경의를..  "
20170430,10,이성의 시대에도종교가 있어야 하는 이유를말하는 영화  
20170429,10,내가 본 영화중 최고였다. 故도스님에게 애도를...  
20170428,5,이영화가 이리 평점이 높다니....결국 큰일햇지만 이게  신념?...난 정상으로 안보인다..남들이 다 꼴보기 싫어하는데 굳이 거기서 그래야되는건가...그 신념 다른데 쓰면 안되는건가..보는거 자체가 불편하다  
20170428,10,너무 뻔한 스토리임에도 불구하고 너무 재밌게 봤습니다. 개인적으로 이런 뻔한 스토리를 좋아하는지라....보면서도 절대 주인공 죽으면 않된다고 빌면서...역시 멜깁슨 형님은 배우로서나 감독으로서나 최고입니다.  
