0,1,2
20170226,10,믿음과 신념을 지키는 것이 진정 상남자..인생 영화 컬렉션에 무난히 안착!감동실화..  
20170226,8,관람객데스몬드는 천국에 갔을거다.어메이징 데스몬드  
20170226,9,신념과 용기가 감동이 되다. 한명 만 더..  
20170226,10,왜 이렇게 예매율이 낮은지 이해가 되지 않는 영화. 죵교영화라기 보다는 신념이 깊은 한 남자의 이야기. 전투씬만 보아도 충분한 명작.  
20170226,10,종교고 뭐고 잘만든 영화고 실제로 저렇게 얘기했다고 하는데 뭐가 문제임  
20170226,10,감동입니다 재밌었어요  
20170226,10,관람객재밋어요오!! 남주 연기진짜잘하는거같아용  
20170226,10,미쳣습니다... 그냥 데스먼드도스님.. 말로표현할수없을만큼 대단합니다  
20170226,10,"내 가슴을 울린 주인공의 대사""주님 한 명만 더, 한 명만 더 구할 수있게 저를 도와주소서""나도 이런 간절함과 실천을 닮고 싶다.  "
20170226,10,실화를 바탕으로 만들어진 영화 전쟁중에 비전투 요원으로 참여하여 포탄이 쏟아지는 전쟁터에서 아군 뿐 아니라 적군까지 구출해내는 아무리 신앙인이라 쉽지는 않았을텐데 해도 자신을 돌아보지 않고 살신성인하는 모습에 감동이였어요 존경스럽네요  
20170226,10,멜 깁슨이 또 하나의  인생작 등단이네 진짜 전쟁은 절대 나지 말아야 한다는 참상을 잘 보여줌 아비규환 생지옥이란게 이런거지 ㄷㄷ  
20170226,6,"초반에 살짝 지루, 갠적으로 그의 신념이 맘에 들지만은 않음. 하지만 그럼에도 실화라는게 감동적인 영화  "
20170226,9,관람객아주 좋은영화 잘봤습니다..  
20170226,10,진짜 잘 만든 영화다.... 굳굳  
20170226,9,관람객전개가좋습니다 실화라는점에서 마지막부분이 인상적이었습니다  
20170226,8,원 모 어... ㄷㄷ ㅠㅠ  
20170226,10,배우들의 연기도 좋고 스토리를 이끌어 나가는 방식도 좋았다.첫 장면부터 끝까지 지루할 틈이 없었던 영화  
20170226,8,관람객나름 볼만한 영화입니다.  
20170226,10,정말 잘 만들어진 강추하고픈 영화!!!  
20170226,10,신념 믿음 신뢰 내자신에게 제일 가치있는 순간 비로소 보이는 것들.  
20170226,10,관람객감동적입니다...강추해요  
20170226,9,관람객줄거리가 탄탄하고 전투신은 정말 잔인할정도로 실감납니다. 약간 지루한 면도 있었지만 재미있었습니다.  
20170226,9,관람객실화라서 더 감동적인~  
20170226,10,최고의 전쟁영화..남자라면 보고난뒤 뭔가 끓어오를것이다..한명만더 한명만더..  
20170226,8,관람객기억에 남을 용기에 대한 영화  
20170226,9,동료들의 폭행과 수류탄을 손발로 차내는 허구땜에 1점감점이지만 주인공의 정신과 무척이나 현실적인 전투 장면으로 만점을 받을만 하다. 전쟁사에 관심있다면 오끼나와 전투가 얼마나 처절하고 잔혹했는지 일본군이 얼마나 광신적이었는지 그대로 보여준다. 진짜다.  
20170226,9,뜬금없이 쪽바리 할복장면은 왜 넣었지?  
20170226,10,지금까지 본 전쟁씬 중 가장 리얼했다  
20170226,7,볼만하게 만들긴 했는데 위워솔져에 이은 자국뽕 영화네.  
20170226,9,관람객 신념을 지키며 산다는것 잠시생각해 볼 수 있는 시간이었습니다  
20170226,10,멜깁슨 감독의 브레이브 하트 이후 최고의 영화!!!!  
20170226,9,관람객현실감있는 전투신이 좋았습니다.중간중간 놀라는 부분이 있어서임산부관람은...좀...  
20170226,10,어디에서나 빽이 중요하다  
20170226,10,관람객최고의 영화 시간가는줄 몰랐다  
20170226,10,관람객한 사람이 또 다른 사람의 생명을 구하는 것은 숭고한 일이다  
20170226,10,오마이갓 처음부터 끝까지 그냥 너무 영화같았음내가 그 전쟁통속에 있는거 같았고정말 대단한 사람이라는 감동도 받았고 무튼 두번보고싶은영화  
20170226,7,마지막 큰 한방을  기대했는데 그냥 끝나버림  
20170226,10,감동.ㅠ안봤으면 후회할뻔  
20170226,10,끝부분에 일본장수 할복장면이 굳이 그렇게 자세히 나왔어야했나.그부분 없애고 도스가 집으로 돌아가서 결혼식도 하고 행복해지는 부분을 영화에서 보고싶었다. 그거빼고는 완벽했다  
20170225,9,관람객잼있어요 사실적인 전투묘사...  
20170225,10,관람객짱잼 존잼!!!! 꼭 보세요  
20170225,10,"전쟁 속에서 선악을 떠나, 자신의 양심과 신념대로 아군과 적군 모두를 구한 진정한 영웅. 세계가 분열되고 있을 때 조금이나마 도움이 되고 싶다고 이야기 하던 데스몬드 도스. 정말 존경스럽습니다.  "
20170225,9,자신의 신념을 끝까지 믿는 것이 가장 큰 용기  
20170225,9,이 정도의 작품에는 반전이 필요없다. 전쟁 영화에 한 획을 그은 듯  
20170225,1,"역시 '평 낮은 순'으로 보니, 이 영화 엉망이네요^^  "
20170225,10,감동 철철이다. 엑소 찬열 생각남..  
20170225,10,관람객자신보다 전우를 살릴고자 하는 정신이 너무 아름답다  
20170225,10,관람객감동적인영화입니다특별히 신앙있으신분들강축  
20170225,10,저는 제목보고 볼생각이없었는데  안봤으면 후회했을듯 정말 봐야합니다ㅋㅋ  실화에다 종교를 떠나 전쟁상황에  70명이나 구한건 정말 뜻깊고 꼭 봐야한다생각해요20대 대딩입니다ㅋㅋ  
20170225,10,솔직히 재심보다 훨 재밌고 감동적인데 왜! 재심이 1위인가! 이런 영화를 좀 많이 상영해라  
20170225,10,관람객도스의 고독한 싸움..멋지다  
20170225,10,관람객신념에 대한 생각을 해봐여  
20170225,10,인생영화. 나를 다시 돌아보게 해주는  
20170225,10,절말 별 10개이상 주고싶은영화 중후반 앤드류 가필드의 연기력이 정말 뛰어났다고 생각한다. please one more ...  진심 소름... 영화 보신분들은 공감하실듯  
20170225,9,관람객멜깁슨은 항상 종교영화인줄알았는데 그안에 신념이라는 더 중요한 주제가 내포되어있었다  
20170225,10,"내가 가진 신념을 지키고 믿는다는 것, 어쩌면 가장 어렵고 큰 용기가 필요한 일.  "
20170225,8,관람객앤드류 연기는 좋은데 할복장면부터 좀 읭싶음  
20170225,9,"신념 눈물 전쟁의 잔혹함, 멜깁슨. Must See!  "
20170225,10,"실화고, 잘 표현했고.. 더할나위 없음  "
20170225,10,간만에  제대로된 전쟁영화를 봤습니다  
20170225,10,멜깁슨... 영화 잘만들었네 쪽바리의 비열함 또한 잘 표현되었다.  
20170225,10,"관람객간만에 정말 재밌고, 감동적인 영화를 봤네요.  "
20170225,10,영화사에 길이 기억될 대작이다. 라이언 일병과 어깨를 나란히 할 작품!  
20170225,6,"테크닉은 훌륭하지만, 멜 깁슨이 보수백인우월주의자, 예수 빠돌이인 티가 너무 난다. 마지막 시퀀스가 영화 전체를 미완성으로만들었다.  "
20170225,10,감동이었습니다 10자  
20170225,10,오랜만에 제대로 된 전쟁영화 한편을 보았다.  
20170225,10,한번봐라. 두번봐라. 세번봐라...  
20170225,10,인생작에 추가됐습니다  
20170225,9,관람객신념이 강한 사람은 절대 포기하지 않는다는 것을 느꼈습다.  
20170225,9,볼만 합니다 감동이예요  
20170225,10,대단한 영화. . .  감동과 눈물이 있는 최고의 영화다. . .  
20170225,10,라이언 일병 구하기 이후로 동급 영화의 출연을 기다리고 있었다. 드디어 진짜가 나왔다. 10점주는 몇 안되는 작품이다  
20170225,8,관람객재밌어요. 그런데 깜짝깜짝놀래는 장면이좀있어서. . 공포영화보는느낌. .  
20170225,10,관람객태어나서 이렇게 완벽한 전쟁영화 처음봄ㄹㅇ 아는사람 모두한테 존나추천해주고싶은 띵작  
20170225,8,오랜만에 본 전쟁영화 실화라서 더 감동적이다  
20170225,10,관람객이런 감동적인 내용이 실화라니 놀랍습니다전쟁영화는 역시 극장에가서 봐야함을 다시한번 느낍니다  
20170225,9,관람객감동적이고 실화를 바탕으로 한 것이라 그런지 더 강하게 와닿았다.  
20170225,9,관람객전쟁은 절대 없도록 합시다. 모든걸 파괴함. 그속의 숭고한 도스 같은 사람도 있지만 그걸 우리생에 바라는건 너무 확률이 희박하니까.  
20170225,10,너무너무감동적인영화였당 기억에계속 남을까같당??  
20170225,10,실제로 이런일이 있다는게 대단하고 이영화가 전쟁의 잔혹함을 잘 보여주는듯 감동이다  
20170225,9,관람객우리 스파이더맨 연기 장난아닙니다  
20170225,10,생각없이 봤다가 진하게 감동 재미 다 느끼고갑니다 게다가 실화라니..앤드류가필드 연기도좋고 전쟁 전 씬들도 전혀 지루하지않고 시간가는지모르고봤습니다  
20170225,10,"재미, 감동 , 긴장 그리고 아이러니한 전쟁의 참혹함을 보여주는 영화이다.  "
20170225,10,"나와 다른 생각을 지닌 사람들을 존중해야 하고, 함께 가야 하는 이유를 말하는 영화.  지금 우리 사회에 꼭 필요한 영화.  "
20170225,10,ㅋㅋ 영화좀 잘본답시고 영화평론하는애들이 아카데미수상식 후보작을 평론가평점 6점대가 말이되냐 ㅋㅋ 이영화는 종교적인것도 강하지만 보기불편하진 않고 멜로도조금있어서 달달하고 가필드의연기는 말이필요없고 전쟁신은진짜 압도적이고 실화라서 10점이다  
20170225,10,진짜 이런사람이 있긴있나..믿기지않는 실화..  
20170225,10,관람객즐겁게 잘 관람했습니다  
20170225,10,총으로 무장한 100명의 병사보다 강한 신념을 가진 한 명의 병사가 더 무섭다.  
20170225,10,끝까지 긴장을 놓칠수없는 영화  
20170225,10,요새 한국영화 보면서도 계속 재미 있었는데.. 전쟁씬은 정말 차원이 다르네요. 내용도 좋았어요  
20170225,9,핵 쏘고 싶었음...ㄷㄷㄷ  
20170225,10,처음엔 사랑스럽더니 나중에는 정말 감동입니다.  
20170225,10,"너무재밌어요.악몽꿀때너무놀랐는데,진짜완성도높은영화인듯  "
20170225,9,139분의 런닝 타임이 순식간에 지나갔다. 그만큼 빠져들어서 보았다. 자신의 신념을 위해 희생하는 정신이 멋지다. 앤드류 가필드 연기도 개잘한다 진짜..  
20170225,10,관람객긴 여운이 남는영화.. 재밌다  
20170225,10,관람객난보았다 진정한 영웅을....  
20170225,10,오랜만에 눈물을 글썽이며 영화를 봤다. 주인공이 겪는 심리나 감정들에 몰입하고 감동하며 봤다... 추천하고 싶은 영화!  
20170225,10,"보면서 펑펑 울었다...이런 영화에 10점밖에 줄 수 없다는 게 정말 안타깝다. 나도 한 생명을 더 살리기 위해, 올바른 신념을 가지고 훌륭한 군인이 되야겠다. 정말 많은것을 느끼고 깨닫게 해준 영화다. 전쟁묘사도 그 어떤 영화보다 좋다  "
20170225,10,시간가는 줄 모르고 봤네 몰입도가 엄청나요!!! 이런영화가 1위여야 되는데..  
20170225,10,"다시한번 느끼지만 전쟁은 절대 변하지 않고 절대 일어나서는안된다. 북한 치자고 하시는 분들, 정말 닥치고 있어라 전쟁은 간단한 총싸움인줄 아는놈들  "
20170225,10,관람객재미짐ㅋ 개꿀잼ㅋ 십자  
20170225,10,아..어마어마합니다 이런거 진짜안남기는데..정말 감동 그이상을 넘어섰네요  
20170225,10,훌륭합니다 연기 연출 이야기 깔끔했고 너무도 군인으로서 감동받고 영감을 받았습니다  
20170225,10,관람객호안에서  잘때  꿈꾸는장면에서  옆사람 놀라서  재밋게 봣어요 ㅋㅋㅋ  
20170225,9,관람객생각할거리가 많은 영화  
20170225,10,맬깁슨 대단합니다..내 인생영화. 대감동입니다.  
20170225,10,관람객재밌습니다! 추천해요ㅎㅎㅎ  
20170225,10,전쟁묘사가 너무 사실적이라 저같이 비위 약한 분들께는 조금 힘들 수 있지만.. 억지로 감동을 주려는 느낌 없이 이야기를 담담하게 풀어내서 참 좋았어요.  멜 깁슨 영화 처음보는데 솔직히 제가 본 배우 출신 감독 영화 중 가장 수작이었어요. 추천!  
20170225,10,전투씬은 잊지못할정도로 심장 졸이며 봤다..  
20170225,10,관람객조아요좋아요저야여조음  
20170225,10,라이언일병을 능가하는 리얼한 전투신. 믿고 보는 맬깁슨 영화.  
20170225,10,진짜로 좋은영화다 근데 영화를 보고 평론가들의 글을 보면 너무 확 깨고 화가 난다... 이상한 소리만 짓거리고  
20170225,10,오랜만에 제대로 된 영화본 것 같음  
20170225,10,관람객잘봤어요 감사합니다 수고하세요  
20170225,9,관람객정말 좋고 감동적인 영화~  
20170225,10,재밌게 봤어요 실화라 더 감동  
20170225,9,관람객논란의 여지없는 웰메이드 무비...평론가들의 지적 허영은 쓰레기통으로..그들의 별점 무시해버려!  역사적 실화는 작위적 복선이나 반전 따위로 꾸며져있지 않아...멜깁슨의 필모그라피...인간에 대한 진지한 천착...차기작이 기대돼...  
20170225,10,관람객멜깁슨의 종교적 마인드는 그닥이지만  그의 영화들은 연출과 사실적 묘사만으로도 기대를 만족시킨다  
20170225,9,내가 아는 제칠일 안식일 예수재림교인도 성실하고 정직한데 좋은 인상을 받네요  
20170225,9,감동적이고 여운이 많이 남는다.실제 전쟁같은 전투씬 대박.실제 전투에서는 저렇게 피튀기고 창자 터질것이다.생지옥 한가운데서 피어나는 놀라운 신념과 전우애!!!  
20170225,8,관람객전형적인 미국의 영웅 만들기 영화.그래도 재미있게 봄. 중간중간 잔인한 장면이 있었지만 볼만하다 싶은 영화임.  
20170225,7,"한사람의 위대한 희생정신은 알겠으나, 우리나라의 양심적 병역거부는 다르다!  "
20170225,10,관람객감동적입니다  추천해요  
20170225,1,핵노잼완전지루함ㅁㅇ  
20170225,8,관람객픽션이 많은 듯 하나 어찌됬든 재밌고 감동적 이네요.  
20170225,10,작품성 연기력 전부 좋았다실화이며 정말 생생했던 영화  
20170225,10,관람객요즘 보기드물게 좋은영화군요~ 멜깁슨은 배우출신인데 감독도 너무 잘합니다...브레이브하트도..대부분 배우가 감독하면 졸작이 탄생하거든요 ㅋㅋ  
20170225,9,관람객잘봑어영  좀 일본을 마니 시러하는거같기도하고  
20170225,10, 정말 많은걸 느끼게해주는영화였습니다. 보는내내집중하고봤어요.안봤으면 후회할뻔  
20170225,10,관람객인간의 대한 신념의 위대함을 보여주는 영화 입니다 정말 기적과 같은 일을 실제로 했다니 그 어느누구보다 용감하고 위대하지 않을까 싶습니다 짱~~~  감동적인 영화 이었습니다  
20170225,10,관람객요즘같은 휴머니티 흉년시대에 이런 진정한 인간미를 보여주는 영화를 올만에 봐서 감동이었다주인공 진짜 대단함ㅠㅠ 의로운일을 하시고 천국에 계실꺼라고 믿는다  
20170225,10,이 이상의 반전 영화는 당분간 만들기 힘들 겁니다. 전쟁의 비참함이 너무나도 극명함. 감독은 거장임.  
20170225,10,관람객전쟁의 비참한 아픔을 볼수있었고 데스몬드라는 인물을 기억하게 되었습니다.  
20170225,10,올해 가장 영화다웠던 영화  
20170225,9,관람객처음 도입부에서는 지루한감이있었으나 중간부분부터 이어지는 전투장면에서는 너무나 실감난 나머지 기절할정도였다 특히 주인공의 양심에의한병력거부장면에서는 많은감명을받았다 앞으로 이 영화는 나의생각으로 대박날것같은 예감이든다  
20170225,10,내 인생 최고의 영화 처음 달아보는 평점인데 처음부터끝까지 완벽했다나도 내 자리에서 최선을 다하는 삶을 살길  
20170225,10,하...이런엄청난영화가 상영시간이 별로없다니ㅠㅜ 이영화좀밀어줘라..우려한게현실이돼뿟네  
20170225,10,멜깁슨은 배우하지 말고 감독만 계속 하시길.  
20170225,10,전쟁영화라 안 봤다면 후회할뻔..  
20170225,9,관람객라이언 일병 구하기 이후 최고의 전쟁 영화  
20170225,10,"웃다가 울다가..정말 많은 걸 느낀 인생영화입니다. 감동을 잊을 수가 없네요..종교 이상의 확고한 신념, 전우애를 비롯한 사랑과 희생, 용서 등이 잘 어우러져있고 전쟁씬은 그 어느 영화보다도 대단했습니다. 10점 주는 첫 영화입니다. 별이 모자라요.  "
20170225,10,이건 전쟁영화가 아니야.  뭐라 말하기 힘들다.  
20170225,10,오랜만에 정말 재미있는 영화 한편본듯  
20170225,10,전쟁은 없어야 한다는걸 다시한번느끼게 한 영화였어요남편이랑 보면서 둘다 뭉클했네요(울음을 짜내는 영화 아닙니다)  
20170225,9,와~전쟁영화면서 공포영화라고 말해도될듯. 영화관에서 보세요 진짜 리얼함. 지금까지 전쟁영화중에 탑입니다. 물흐르듯 긴박하게 진쟁되는 스토리도 좋고요. 군더더기 없네요.다만 마무리가 살짝 아쉽네요. 종교적냄새가 강해요.  인터뷰내용만 빼면 명작입니다  
20170225,10,솔직히 1점 준 사람들은 국봉이라고 생각하고 전쟁 장면이 너무 현실적이라 재밌었다. 가필드의 연기또한 뛰어났다고 생각한다  강추  
20170225,10,관람객군인신분으로써 너무재미있게본거같습니다.  
20170225,10,관람객좋은 영화 잘 봤습니다 감사합니다  
20170225,10,관람객나 자신이 헥소고지에 들어와 있는 느낌이었다. 단순한 양심적 병역 거부자가 아니라 개인의 신앙과 신념이었고 누구보다 용감하고 희생적인 사람이었다.  
20170225,10,다들 데즈몬드 도스 없이는 저 고지에 올라가지 않을껍니다. [이장면 .소름  전쟁의 수호신과 같은 느낌이 들었ㄷ  
20170225,10,종교를 위한 신념이 아닌 스스로의 신념이 만들어낸 기적 ! 그 스토리에 (제가 느끼기에) 지금까지의 어떤 전쟁영화보다 사실적인 전투장면과 특수효과가 더해지니 인생영화가 아니라고 할 수 없다  
20170225,10,관람객너무 재미있었어요~~  
20170225,9,총없는 그가 전쟁터에서 살아돌아온 건 지나친 비약과 거짓말이다. 그런데 이게 실화다...내게 남은 건 숭고 그 자체!  
20170225,9,조금 징그럽기는 했지만 전쟁씬이 실감났다. 종교영화는 아니다. 주인공의 신념이 대단했다. 지루하지 않게 봤다. 최근에 본 영화 중에서는 재심과 이 영화가 볼만했다.  
20170225,8,관람객전쟁씬 정말 잘찍었어요  
20170225,10,진심으로 감동적입니다.  
20170225,10,가장 강한사람은 이기는자가아닌 살아남는자가 강한것이다  
20170225,10,자기 자신을 다시 한번 돌아보게 되는  
20170225,10,전쟁영화중 제일 인상깊은 영화였다  
20170225,10,종교인들이여 그 전에 신념은 충분한가?  
20170225,10,양심적 병역거부자들은 총없이라도 가게해야한다 저게 진짜로 비폭력주의자 인것이다 비겁하게 안가는게 아니라..  
20170225,10,이런영화가 너무너무좋아^^!!!!  
20170225,10,"최고다,. 특수분장, 배우연기력 연출 모두 훌륭하다. 그러나 관객수가 참 안습이구나  "
20170225,10,관람객최고의 몰입도와 감동 그리고 여운  
20170225,1,이거 평점에 낚여서 봤는데 솔직히 1점은 아닌데 평점대 낮추려고 1점준다. 최대가 8점 초반인 영화  
20170225,10,다시 또보고 싶네요!! 재미를 넘어 감동이 가득했습니다.  
20170225,10,인생최고의영화 한명만 더 구하게 허락해주시옵소서  
20170225,10,대체 평점을 이따구로 달거면 평론가 왜 하세요? 진심으로 자괴감든적은 없나요? 반전이니 하늘에서 내려온 천사니.. 참나 그냥 한국영화의 댓글알바로 밖에 안보여요 돈은 많이들 버시겠네  
20170225,9,영화는 재밌엇는데 주인공은 또라이 아니냐. 누군 사람죽이고 싶어서 죽이나.  만약 모든사람이 주인공 같았으면 우린 지금 혼모노다.  
20170225,7,솔직한후기전쟁영화매니아라면 그다지 높은평점이 나올것같진 않습니다.  전쟁영화 입문자라면 추천드리구요. 조금 말이 안되는 장면이 몇개있지만 실화라서 패스  
20170225,10,내인생 최고의영화  전쟁영화 안좋아하는데도 너무 재미있다 감동과 소름을 동시에 느낌  
20170225,10,재미있었어요. 실존인물이라곤 상상도 못했네요.  
20170225,10,PS. 허남웅 이런 영화에 반전을 바란다고?  평론가 자질이 부족하네 힘내라 ㅎ  
20170225,10,테레사 팔머 개이쁘다 영화 감동적이다  
20170225,7,픽션이었으면 무리한 설정으로 너무 감동을 쥐어짜내려고 하는 것처럼 보였겠지만 실화라는 사실이 놀랍고 맬깁슨은 정말 극사실주의의 명장이다  
20170225,10,재밌네요 23아이덴티티 루시드드림 핵소고지 이렇게봤는데 핵소고지가 정말재밌어요 왜 순위가 낮은지모르겠네요 몰입해서봣네요 실화라서 더 감동적이었어요 꼭보세요!  
20170225,10,최고의 전쟁영화 였음.  
20170225,7,일종의 정신일도 하사불성 류의 보통사람 영웅담에 깊이 감동받은 적은 없다. 어떤 극단이니까. 일본군 대장의 할복장면은 왜 넣은 거냐.  
20170225,10,한치라도 눈을 뗄 수 없었던 영화... 한명만 더 라는 대사가 심장을 울렸다ㅠㅠ  
20170225,10,관람객다시한번  되돌아보는 영화인것같습니다  
20170225,9,다좋은데.. 끝부분 슈류탄발차기 슈류탄야구는 좀 아니지... 거기서 리얼리티가 확 죽네.. 쨌듯 이번 아카데미 남우주만큼은 라이언고슬링 말고 너다.  
20170225,8,관람객스토리가 지루하지는 않았지만..너무나 종교적인 영화라는 생각이 들어 안타까웠음  
20170225,10,그렇게 잘 만든거 같지는 않은데 충분히 괜찮다 고민 없이 볼만하다  
20170225,10,"전쟁영화임이도 불구하고 여자가 재밌어 할 영화. 전쟁의 잔혹함은 스토리를 끌어내기 위한 장면일 뿐, 실화이기에 가슴을 다시 한 번 울리는 최고의 영화. 지금같은 우리시대에도 도스같은 영웅이 나타나 줘야 할텐데..  "
20170225,10,영화를 보는 종일 내내 스스로 하여금 나를 돌아보고 생각하게 하는 영화였다. 단순히 전쟁영화가 아닌 교훈과 큰 깨달음을 주는 영화.  
20170225,8,관람객너무 실제 같았고  너무 재미 있었다  
20170225,10,139분이 이렇게 짧게 느껴지긴 처음입니다재미와 감동을 동시에 잡다!!  
20170225,10,허남웅은 왜 반전을 논하는지모르겠다  
20170225,10,웃다가 울다가 나오는영화. 정말 전쟁영화로서만이 아니라 영화자체로서 수작이라 칭찬하고싶다  
20170225,7,관람객전쟁영화를실감있게그려내어볼만합니다~  
20170225,10,악을 무찌르고 정의와 선을 지키기위해 총을 들어야된다. 하지만 데즈몬드 도스는 자신을 지키기위해 사람을 죽일뻔한 경험과 약자를 지키기위해 사람에게 살해위협을 가한 경험을 통해 누구보다도 생명에 대한 소중함과 인류애가 강해졌기에 총을 드는것을 거부했다  
20170225,9,감동했습니다. 재미도 있구요  
20170225,10,정말 좋은 영화네요. 가슴 찡합니다.  
20170225,10,멜깁슨형 사랑해요!! 쪽바리 때려잡자!!!!  
20170225,10,비평가들은 영화 볼때마다 일단 삐딱한 시선으로 보는 듯. 그냥 불만만 많은 일반인들 같음  
20170225,9,진짜헐리우드전쟁영화란이런것이다... 평점9점을 남기게하는구나 평점은9.0점주고싶다.  
20170225,6,재미는 있었다 마지막 장면 빼고 보면 거슬리지는 않지만 종교적 요소는 분명 있고... 후반에 좀 잉? 되는 부분이 있긴 있었다 데스몬드가 수류탄을 발로 차서 일본군 쪽으로 보내는 장면... 뭘까 싶었다  
20170225,9,"심야로 봤고, 꽤 긴 러닝타임인데시간가는줄 몰랐고 너무 감동적이었서용 ㅠㅜㅜㅜ실화라니 정말 리스펙 !!!간만에 영화관에서 볼만한: )  "
20170225,10,그냥 전쟁영화하고 차원이다름  
20170225,10,정말 영화같은 이야기네 했는데 끝에 실화라니 나오면서 소름이 계속 돋았어요 멋지고 감동적이며 나 자신을 돌아보게 하는 명작!!  
20170225,10,관람객저에겐 출발이자 마지막같은 영화였습니다.  
20170225,7,좋은영화 감정도 좋다 하지만 두번보기엔좀...중후반부터 약간 어그러지는느낌을 받았다. 앤드류가필드에게서 스파이더맨이 보이는건 나만의 착각인가 전쟁터에서 상처하나없이 뛰어다니는게 너무 당연하다는듯이 나와서 좀 아쉽네여  
