0,1,2
20190128,10,말이 필요없는 인생영화  
20190117,9,실화라서 더 감동적이다.   신앙의 힘의 위대함을 보여준다.  신념에 어울리는 능력을 갖추는건 결코 쉬운일이 아니다.  
20190116,10,꼭보세요..!!전쟁의 무서움을 다시 느낍니다  
20190116,9,멜깁슨은 실망을 주지 않는다 감동...  
20190115,10,슬퍼서가 아니라 감동받아 울었던 영화는 근 몇년동안 처음이였다  
20190114,10,평론가들 진심 평론할 자격 없는 인간들 뿐이네.덩케르크 보다 나으면 나앗지 못하지 않다.진정한 명작임  
20190113,8,주인공이 위대한거지. 종교완 별개.  
20190112,10,색안경끼고 영화보면 안됌  
20190112,8,전쟁씬은 손에 꼽을정도로 리얼하게 잘찍었다  
20190111,10,전쟁의 현실을 정말 잘표현한 작품.. 너무 잔인하다구요? 그게 전쟁입니다..  제일 소름돋는부분이 포화속에서 Helf 들릴때와 도스가 신에게 Please One more 할때..  
20190110,10,간만에 정말 재미있는 전쟁영화를 봤네요평점이 높을만한 이유가 있는듯 거기다가 실화라니 이영화 추천드립니다  
20190110,10,버바 우리 새우잡이 배 해야지. 포레스트검프  
20190107,10,모처럼 별5개를 주는 영화다.실화  바탕이라도 다큐멘타리가 아닌 드라마를 살리는게 진짜 영화다.  
20190106,10,"한국 종교병역거부자 의무도 하기 싫다면, 권리도 박탈하면 좋겠다. 한국 국민 박탈해라. 그게 맞지.  "
20190105,10,광광 우럭따  남자라면 이거 보고  광광 운다  
20190104,10,영화 내용에 한번 감동이었고 실화라는 것에 두번 감동하였습니다. 군대에서 보여주면 좋을것같네요  
20190101,10,감동적이고 영웅처럼 보이는 영화가 실화인게 놀라울 따름.  
20181230,10,가슴을 울렸다. 꼭 봐야할 영화  
20181228,8,옥의티가 있는데 일본군은 도대체 왜 자꾸 타고 올라오는 그물 안자르는 거임? 아무도 안지키드만.  
20181221,10,정말 참전군인들에게 존경심을 더욱 가지게할수있는영화 명화입니다  
20181221,10,재밌어요 꼭보세요^^^^  
20181217,10,그저 감탄만 나오는 그의 신념~~  
20181215,10,내 인생 최고의 영화...  
20181210,10,"라이언 일병 구하기 다음으로 재밌게 보았던 전쟁 영화, 실화라는 것에 더 놀랐다.  "
20181208,8,메딕의 전설.. 이게 바로 메딕이다  
20181203,10,양심적 병역거부하는놈들 취사병이나 통신병이나 의무병이나 운전병이나 굳이 총없이도 군생활할수있는 보직으로 보내면된다 비양심적 병역 거부자들아  
20181202,10,지금껏 봤던 전쟁영화중 가장 참혹한 장면들도 많아서 가끔 손가려야 했지만 노년의 주인공들 인터뷰 감동이었어요  
20181201,10,데스몬드 도스 님 그리고 멜깁슨 감독에게 경의를 표합니다.  
20181129,8,아놔 이거 봤는데 2016년영화네보니까 한창 영화보면서 평점날릴때인데 왜 펑점 날렸냐 16년에바로본영화인데ㅡㅡ 개화나네 태평양전쟁영화에서 영웅적서사시를 잘살림작품 평점가지고장난치치말어라  
20181129,10,반전이 안담겨? 오케이 좋은데 그딴소릴 한국어로 적지 말고 일본어로 적지 그러냐? 니네가 한국어로 떠들 자유는 일본인+ 조선인과 태평양에서 싸운 미군이 지켜준 자유인데? 일본제국을 패망시키기위해 태평양에서만 미국청년 10만명이 죽었다.  
20181127,10,사람을 겉으로만 판단하지 말라는것을 깨닫게해준영화... 그리고 총을들지않은 그저 사람의 목숨 하나만을 바라보고 뛰어가는 의무병한명의 믿음만으로 부대원들의 사기까지 올려버리는 믿기지않는 감동실화.. 진짜 완전명작이다 추천  
20181126,10,요즘 시대에는 입대를 피하기 위해서 갖가지 수단과 방법을 이용또는 악용해서 입대를 하지 않는데 도스는 양심적 병역거부자라 가지 않아도 되지만 자원입대를 한 것이 양심적인 것 같다. 그리고 자신만의 신념을 지키면서 꿋꿋하게 군생활을 이어가는게 대단하다  
20181126,10,감동적이고 대단하다...  
20181126,10,평론가 애시키들 눈은 우주갓냐.. 화나  이런 인생 영화를..개  롸 슥 평론가들 도대체 눈알은 달고 사는지 궁금하다..  차라리 내가 너네보다  더 평가 잘하것다 ㅋ  
20181126,1,도대체 전쟁은 누구를 위한것이며 전쟁의 피해자는 누구며 가해자는 누구인가  
20181126,10,한국판 여호와증인 영화로 생각했지만 130분후 바꼈다. 매우 감동적인 실화 영화였다  
20181125,9,개꿀잼.... 굉장히 잘만든 영화다  
20181125,10,실화가 더 비현실적인 활약이여서각색했다는대..평론가들은 뭔 개소리들 하고 있지  
20181120,3,뻔한스토리임. 중간까지보다 전쟁씬들어가면서 포기  
20181115,10,비록 무신론자지만 이런 강한 신념을 가진 종교인들이 더 많이 존재한다면 세상이 훨씬 아름다워질거같다 보는내내 감동 받았습니다  
20181114,10,이게 진심 실화인가...  
20181114,10,너무 좋은 영화입니다.  
20181113,10,눈물날 정도의 벅차다. 전쟁의 참혹함에서 한 인간에게 신의 가호가 진짜 있을것같다고 믿게 만드는 영화같은 실화  
20181111,8,평론가 허남웅씨가 표현한 반전은 스토리의 반전이 아니라 전쟁을 반대하는 반전의 정신을 의미하는거 아닐까요?  
20181111,9,굿~~이런게영화지.  
20181110,1,이단 사이비 제7안식교 홍보영화  
20181106,8,죽음의 전장에서 총도 없이 신념 하나로 끝까지 놓지 않는 한마디..One more~..^&^  
20181105,8,멜깁슨의 화려한 복귀!!  
20181104,10,양심적 병역거부하면 대체복무도 현역 장병들 박탈감안느끼게 해야되는거아니냐?ㅋㅋㅋㅋ 대체복무까지도 편한거 바라시는 여호와 증인 병역거부자들이 이 영화보고서 깨달으시길 기원합니다.  
20181104,10,이건..  역대급이다..  
20181102,1,ㅈ같은 양심적 병역거부 ㅡㅡ  
20181102,10,지금 양심적 병역거부 어쩌구하며 입대자체를 거부하는 여호와의증인들이 꼭 봐야할영화. 군대에는 꼭 총을들고 적군을 죽이는것만 있는게 아니다. 총이없어도 살상을하지 않아도 얼마든지 군인이될수있다. 진정한 신념이 무엇인지 생각해봐야한다  
20181101,10,전쟁씬은 실제 생존자 증언 토대로 그려진걸로 알고있는데  
20181028,6,전쟁씬이 조금만 더 사실적으로 묘사되었다면  
20181028,10,너무 재밌게 봤구 종교적으로 다시금 깨닫는게 많았던 계기였네여  
20181023,10,편견이란... 깨라고 있는것.. 보고나서... 한참이나 여운이 남는 영화 입니다. 볼까 말까 망설인다면 과감하게 선택하세요.  
20181023,8,볼만한 영화...그런데 전쟁씬은 좀 잔인하더라...  
20181020,10,한줄평: 이거 실화냐??  
20181018,10,멜깁슨이 감독이라 놀랐던분들...브레이브하트를 보면 놀랄만한 일도 아닙니다. ㅋ  
20181011,10,정말 제 인생 최고의 영화였습니다. 주인공이 원 모얼 그 순간 온몸에 전율이 느껴진 인생 최고에 영화입니다.. 자신있게 추천드려요  
20181010,10,다운받아서 보는데 전쟁의 참혹한 모습에 너무슬펐고. 주인공의 신념과 행동에 감동받았습니다 .영화끝나고 나도 여운이 가시질 않아요  ㅠㅠ  
20181009,9,진정한영웅  자기희생  헌신  종교를떠나 현실판 영웅 이야기  
20181005,10,허남웅 평론가가 말하는 반전은 반전 스릴러의 반전이 아닙니다.. 조금만 생각해보면 알 것을.. 무식하기 그지 없는 댓글에 달린 공감 수 보면서 통탄하고갑니다  
20181005,10,진흙속의 진주. 감독이 멜깁슨에 깜놀.  
20181004,10,신념과 순수는 절대 그 무엇과도 바꾸면 안된다는 것을 더시 한번 깨닫게 되는...그런 영화  
20181003,10,전쟁영화만 30편 정도를 봤는데 미루고미루던 핵소고지를 보고 처음으로 울어봤다. 감동이었다.  
20181002,10,정말 이런 소름끼치는 작품을 외면하는 한국영화 알바들이 불쌍할뿐이다!! 그대들에게 자신있게 추천한다!!  
20180930,10,실화에 멜깁슨이 감독이라니 놀랍네요 정말 재밌게 봤어요  
20180930,9,한국도 OO 총안쏜다고 깜빵 보낼게 아니라 시원하게 아프간 의무병 이런거 파병 보내라  
20180929,10,절대 범접할 수 없는 그 숭고한 의지에 찬양한다  
20180929,10,주인공 표정. 연기. 실화영화라서 더 감동입니다.  
20180929,10,한명만 더 구하게 해주소서!한명만 더…    외로운 신념이 만들어낸 놀라운 기적. 가슴뭉클해지는 감동적 실화영화다.  
20180929,10,정말 훌륭합니다...  
20180929,9,이런사람도 있기에...  
20180929,10,"진짜 믿음, 신념이란 나 자신을 나타낸다  "
20180925,10,지금까지 봤던 전쟁 장면 중에 가장 연출이 리얼했다.  디렉터 멜깁슨 존경하고  몰핀 맞고 싶을 만큼 진정거리는 가슴을 다독여야 했다. ㅜ도스와 같은 양심적 병역 거부자에  다시 생각해 볼 기회가 되기도 했고.  
20180921,10,간만에 재밌는 영화다..시종일관 눈을 땔수 없는 의외로 수작인 영화  
20180915,10,실화는 영화보다 더 영화 같다고하네요...  
20180910,9,기독교 영환데 기독교적 색채가 많이 드러나지 않아서 더욱 좋았던 영화.  
20180909,10,믿고보는 감독님 진짜 깊이있는 영화란게 이런거죠  
20180909,10,자신의 신념을 굳게 잡고 끝까지 사람을 구한 데스몬드 도스의 모습을 보며 나는 과연 내 신념이나 의지를 잡고 끝까지 한게있나 돌아보게 된다.  
20180907,10,신념이라는 것이 이렇게 숭고한거구나 느끼게됩니다  
20180905,10,말이필요없다 재미없을줄알고 안봤는데 이걸 왜 이제야 봤을까...  
20180905,9,"그 누구를 위해서도 총을 들지 않았지만, 똑같이 전장에 나갔고 물러서지 않으며 수많은 목숨을 구했던 모습이..단지 종교영화라기보단 국가나 이념을 초월한 위대한 인류애를 보여준 용감한 아주 이상적인 업적이 아니었나 싶다. 오랜만에 감동 받고 눈물 났다  "
20180905,10,영화 본 후 느꼈다. 평론가는 정말 쓸데없는 직업이란 걸. 전투씬에 카메라 흔들기 없어서 좋았다. 태극기휘날리며는 카메라 엄청 흔들어서 관람중에 눈 아프고 어지럽기만 했었다.  
20180905,10,말할것도 없다.역사는위대하다.  
20180904,6,이런 실화가 존재한다는 게 놀랍 그의 희생과 봉사 정신이 놀라웠다. 하지만 잘 만든 영화라도 뻔한 전개와 결말이라 아쉬웠다. 뻔해서 좋았고 뻔해서 아쉬웠다.  
20180904,10,대단하는 말밖엔 안나온다  
20180901,10,"평론가,... ㅋㅋ 저게 영화평론인가.. 초딩 독후감보다 더 못쓰내 ..  "
20180827,10,멜 깁슨이 허세 부리지 않고 휴머니즘에 충실한 결과. 오키나와의 생지옥에서 기독교적인 박애를.  
20180824,10,오랜만에 보는명작이엿다  
20180824,10,핵소고지의 영웅 스파이더맨  
20180819,10,후반부 적군인 일본군 까지 밧줄로 끌어 내려줄때 충격적이었다 ...개인의 신념과 가치관의 정도가 위대함을 넘어섰다.  
20180818,10,도스의 믿음을 앤드류가필드가 연기하다.  
20180817,7,"개인이 가질수 있는 신념과 가치관의 정도가 얼마나 위대할 수 있는지 잘 보여준 영화, 허남웅 평론가의 반전은 反戰일텐데 다들 영화에서 사용하는 내용의 반전을 생각하고 욕하는 거 같아서 아쉽네요:(  "
20180817,10,우리나라 병역거부자들도 저렇게 맨몸으로 지뢰제거하기 이런거 시켜주세요  
20180816,4,감동있지만~ but 노잼  
20180808,10,왜 종교랑 엮어서 평가하냐. 저런 사실이 있었다는 것만으로도 믿을 수가 없다. 니네가 핵소의 생존자였다면 종교타령하겄냐.. 할 말이 없네. 이 명작을 왜 이제야 봤지. 전쟁 영화를 상당히 좋아하지만 이렇게 와닿는 전쟁영화는 첨이다.  일본놈들역시독하다  
20180807,10,대단한영웅.존경합니다.  
20180803,10,..ㄴ디ㅡㅇ지ㅡ읟ㅅ  
20180802,10,종교고뭐고를떠나 도스이병 은 아주 대단하다 영화멋지네  
20180730,10,말이필요없습니다. 인생영화..  
20180728,10,전쟁영화에 감동과 눈물이... 평론가들은 가슴이 없는건지 영화를 안본건지 평론이 수준 미달~  
20180727,10,아 진짜 눈물이 너무 너무 .... 감동의 도가니.  
20180727,10,진짜 인생영화입니다. 처음엔 그냥 종교적 신념인줄 알았는데.. 한명만더...한명만더...할때 진짜 눈물나요.  
20180727,10,뭔 반전이 필요해 실화인데 ㅋㅋ  
20180724,10,나쁘지 않은 전쟁 영화였다  
20180723,10,감동 크 꼭 보시길 ...  
20180723,10,명작 그자체 ㅇㅇㅇ꼭 보자  
20180722,10,스스로 나를 돌아보고 반성하게 만드는 영화  
20180722,10,대단하네요. 비극적인 전쟁에서 신념과 용기있는 영웅의 인류애를 사실적으로 보여준 영화입니다.  
20180722,10,그냥 진짜 최고다 평점도 처음 등록해봄; 감동영화 별로 좋아하지도 않는데 이건 정말 최고임  
20180721,8,이런전쟁영화도 괜찮다.  
20180720,9,양심적 병역거부자들이 저정도의 신념이 있었다면  
20180720,10,오랜만에 감동적인 영화 한편 잘봤습니다^^  
20180718,10,핵감동..종교를  떠나 핵감동..눈물 나고 가슴이 뜨거워짐..기도해야지ㅠㅠ  
20180714,10,처음에는 웃으면서 봤는데 전투부분은 장난없더군요. 전쟁영화중에서 이렇게 몰입해서 본 영화는 없었는데 정말 잘 만든 명작이라고 생각합니다. 신념을 지킨다는 것이 뭘까에 대해서도 생각해보게 하네요.  
20180713,10,sjan woaltrh rkaehdwjrdls duddghk rkdcn  
20180713,10,재밌게 본 영화어메이징스파이더맨의 주인공이었다는걸 상상도 못할만큼 배역 소화 잘했다  
20180711,6,처절하리만큼 자신의 정의와 신념을 보여주는 모습이 식상하지만 감동적이다. 초반의 분위기와 달리 은근히 잔인한 장면이 있는 것도 의외였다.  
20180710,8,언제나 그렇듯 전쟁영화는 옳다!  
20180708,9,쏟아져나오는 일본군을 보면서 갑자기 저 안에 대부부인 조선인이겠지라는 생각이 들었다. 양심이든 종교든 전쟁은 다신 안 된다. 모두를 위해  
20180706,10,이영화를 지금알다니ㅠㅠ  
20180705,10,국내 양심적병역 거부자들아.. 보고 배워라.. 발끝에 때만도 못배울거 알지만 이영화를 보고 너희에 인생을 한번되돌아봐라  
20180703,10,친구가 보자고 해서 별 생각없이 봤다가 2016년 가장 기억에 남는 영화가 됐음. 본격적인 스토리 이전에 주인공과 소속 집단의 갈등이 전혀 지루해지지 않게 전개된 것도 인상적이었습니다.  
20180702,10,한국의 양심적병역거부랑 동일시하지마라걔넨 전우버리고 튈놈들이다  
20180701,10,"개명작이다, 앞으로 전쟁영화를 논할때 핵소고지를 꺼내 들어라.  "
20180630,6,"인간성의 희망, 선함의 가치  "
20180630,10,양심에 의해 병역을 거부 할 수 있다고 믿으면 꼭 봐야 한다  
20180629,10,핵꿀잼 리얼로!!jQuery22407104546445724231_1530267910510  
20180628,6,신념을 비웃는 자들에게 한 방!  
20180625,7,실화영화가 갖춰야 할 모범적인 마무리.  
20180617,8,종교의 힘이 아닌 신념과 믿음의 힘. 이걸 종교영화로 보는 사람은 그저 색안경을 끼고 벗을 생각을 하지 않을 뿐.  
20180615,7,멜 깁슨 출연하는 줄 알고 봤는데 감독이었군! 실화를 바탕으로 한 전쟁영화로 초중반의 전계가 중후반으로 갈수록 엉성한 부분이 다소 있지만 실화인 걸 감안하면 볼만함  
20180615,10,조금  잔인했지만  너무  멋진  작품이네요^^  
20180614,10,도스가 기도를하는데 전 대원들이 군소리 없이 모두다 기다려주는거보고 감동했습니다.  
20180613,10,신앙과 사회현실 속에서 열심히 사는 모습이 감동을 주었다~~  
20180612,10,이런 영화가 관객수 17만명 이라니... 참으로 비참하다.  
20180611,10,또한편의  잘 만들어진 2차대전 영화!. 실화라서 더 가슴 뭉클하고 감동적이다..  
20180608,10,꼭비평을해야만 평론가야?나는 좋다고 말할줄도 아는게 진정한평론가라고 생각한다 영화가 잔인한부분이묘사된건 전쟁의장면을 생생하게 묘사함으로써 한명의 사람이보여주는 신념과 믿음이 가져오는 변화가 포커스지 비폭력주의를 미화나 포장이라고하는건 얼마나 꼬인건지  
20180606,9,"전쟁에 대한 거부감, 살인에 대한 거부감이 충돌하면서 우여곡절 끝에 의무병이 되어 전장에서 수 많은 병사들을 살려내는 기적의 드라마. 상당히 뭉클함. 실화였다는 것이 더욱 놀라움.  "
20180605,10,한명 만 더....한명 만더....  
20180604,10,help me get one more  
20180603,10,양심적 병역거부자들 도스처럼 의무병의 역할이라도 이행하라  
20180603,10,영화를 보는 내내 종교적 신념을 떠나 한 인간의 인류애와 강한 신념과 용기에 가슴 벅차는 시간이었다. 어찌하면 그 말도 안되는 극한 상황 속에서도 흔들리지 않고 자신의 길을 꿋꿋이 갈 수 있단 말인가...데스몬드...진짜 멋있는 사람이며 위대하다.  
20180603,10,이런영화를 이제야 봤다니  
20180603,8,와 개인적 신념과 전쟁을 결합한 둘다 만족을 주시고 믿음이 이런 것이구나 라는 것 느껴주네  
20180602,10,평론가도 악플로 인기를 얻을려고 하는건가. 작품성에서 100점을 줘도 부족한 판에 말장난을 하고있구나.  마치 어린아이에 평론을 보는거 같군요. 어떤기준으로 평론가를 뽑는지 모르겠지만 저런 분들은 평론을 하시면 안될듯합니다.  
20180602,10,인간들은 왜 서로 죽여야 하나요. 친하게 지냅시다. 욕심이 화근  
20180601,9,예수쟁이들아 말보단 도스처럼해야 우리도 믿어볼 생각이나하겠다  
20180529,10,진짜 내 인생 최고의 영화다. 나도 같은 사람이지만 저런 신념과 확고함을 흉내라도 내 볼 수 있을까 생각한... 나한테는 저 의무병이 신처럼 보였다.  
20180529,9,"중반까지 질질끄는게 너무 지루했지만, 그거만 빼면 되게 좋았음. 총을 들지 않는 주인공이 나오는 전쟁 영화라서 맘에듬. 그게 실화라 더 좋고.  "
20180528,10,전쟁 영화중 정말 감명 깊게 본 영화중 하나다... 실존 인물이라는거에 더 감명 받았다..  
20180528,9,"실화를 바탕으로 한 영화, 전쟁터에서 이렇게 자신의 신념을 지키며 목숨을 건 용기를 낸다는 것 자체가 대단하다는 생각이 듭니다. 일본 놈들도 죽을 것 알면서도 항복은 없다고 버티는 신념이었죠. 그릇된 정치인의 야욕, 없어져야 할 대상이죠.  "
20180527,10,"전쟁영화를 싫어해서 처음엔 앤드류 가필드때문에 봤는데 진짜 너무 뜻깊고 개연성,고증,연기 등등 모두다 완벽한 명작 그자체임  "
20180527,10,감동감동감동또감동^^  
20180527,10,뭔 반전이 필요해 실화인데 ㅋㅋ  
20180527,10,보다가 전투신에서 너무 생생하게 잔인한게 보여서 움찔했지만 진짜 본 전쟁영화 중에서 갑!!  
20180527,10,허남웅이 말한 반전이 전쟁을 반대한다는 말 아닌가요?  
20180527,10,멜 깁슨 영화는 너무 좋다  
20180527,10,비평가들의 평론보다 못한 평론가의 평론  
20180527,8,감동적인 영화입니다. 강력한 무기를 지니지 않고도 진정한 영웅이 되네요.  
20180527,10,우리나라 양심적 병역거부자들이 봤으면 합니다 종교의 가면뒤에숨어 의무를 이행치않은 3류인간들 특히  
20180527,10, 전쟁현실성을 높여서 잔인하게 사실적으로 만든건데 고어물? ㅋㅋㅋ  
20180527,10,평론가에게 위생병을 보내죠  
20180522,10,지렸다 그냥최고의 실화 최고의 영화라고 밖에말이안나온다  
20180519,10,간만에 감동적인 영화를 본듯.  
20180516,10,"사람을 많이죽이고 정복업적을 남겨야 영웅이아니라, 사람을살려고 위대하다고 평가받아야 영웅이다.  "
20180511,10,내 최애 영화다시보기 스무번해도 또보고싶음  
20180511,10,실화인게 믿기지않는다  
20180507,8,한 사람의 강한 신념이 전쟁이 미치는 영향.  
20180503,1,"현실은 조금, 포장은 한가득.  "
20180501,10,평론가들 얼마나 졸면서 봤길래  영화를 전혀 이해를 못했어 ㅋㅋ 정말 잘만든 실화 바탕의 명작입니다.  
20180501,10,용기를 가지긴 쉽진 않다. 특히 생사가 걸린 전쟁에선.  
20180430,10,양심적병역거부 하는 사람들 모아놓고 보여준뒤에 똑같이 시키면  좋겠다  그리고  데스몬드  그  정신력은 두고두고 기억하며  나를 돌아보는 데에 써야 할 것 같다 훌륭한 영화 어려운 상황에 있거나 그렇지 않은 사람들도  한번쯤은 꼭 보길 추천  
20180429,10,감동의감동의감동최고다  
20180428,10,전쟁영화찾고 있다가 봤는데 정말 재미있다. 실제 인물을 대상으로  만들었다는 것에 두번 놀랐다 충분한 상황전개 와 후반 격렬한 전투씬까지  정말 잘만든 영화이다.  
20180425,5,잘만든 전쟁영화는 아니다. 전쟁의 시대에서 벌어진 경이로운 드라마라면 모를까.  
20180420,6,한 영웅의 신념과 용기는 존경할만하나 그의 공훈을 보여주는 데만 매몰되어있다.  
20180418,10,영화 잘봤습니다..최고 영화 영화에 출연한 모든 분들고생하셨습니다 ㅎ  
20180418,10,처음으로 댓글 남긴다 최고의 영화다 꼭 보세요  
20180418,10,오직 별점으로만 평가 합니다.  
20180418,10,근데 최군은 군대 언제가냐?  검사받은거 아직도 결과 안 나왔냐? ㅋㅋㅋ  
20180418,10,재미있었다고 본다. 아마도  
20180417,1,전쟁광 미국넘들 구라네...  
20180414,10,종교를 떠나 인간의 신념만을 보고 봐야 할 영화  
20180414,10,진짜 평론가 새기들 싸대기 ㅈㄴ치고싶네  
20180412,8,"이게 진짜 실화면 ,, 그는 영웅이다  "
20180409,10,멜깁슨  감독 작품이라서 늦게나마 봤지만 역시나 저를 실망시키지 않네요 자기의 신념에 따라서 총을 들진않지만 의무병으로서 전쟁 격전지에서 75명의 부상당한 군인을 구한다는게 그것도 실화라서 놀랐네요 전투신도 너무 리얼히고 실감나네요 강추입니다  
20180409,10,개인적으로 핵소고지가 덩게르크보다 훨씬 나은거 같네요  
20180408,10,주임공 정말 존경스럽습니다.감동.스토리.재미 다 잡은 별100개도 넘치는 영화....  
20180403,8,탄탄하고 역사고증이 잘된 영화  
20180331,10,극장에서 안 본걸 후회한다  
20180331,10,최고라는 말밖에 안나온다. 하나님 주님의 힘을 다시 깨닫는 계기가 되었다..  
20180331,10,제칠일 안식일 예수 재림교인정통 근본주의 교회다.  
20180331,10,군대에서보고 눈물난 영화 그냥 명작이라는 말밖에  
20180330,9,멜깁슨=R등급  재미있게  보았습니다 !  
20180330,10,두말할것없는 영화였습니다.감사합니다.  
20180330,8,마지막 장면 열라 싫네.. 니뽕벌레새ㅇ끼 자살하는걸 왜 그릏게 멋진척 해놨는지 ㅉㅉ  
20180330,10,모든병력이 철수하고 주인공혼자서 의무병을 찾는 병사들에게 달려가는 장면에서 앞부분에서 나온 그 끔찍한 장면이 오버랩되면서 저길 다시간다고? 이생각이 들지않았음jQuery22406016495909522037_1522391052626 과연 초반 전쟁터씬을 잔혹하고 폭력적으  
20180329,8,그의 신념만은 진정성이 느껴졌다.  
20180328,7,"여호와의증인 정신은 잘 살렸으나, 사실감은 많이 떨어짐  "
20180325,10,진짜여운 남는영화. 처음부터끝까지 지루한적없이 몰입했던영화예요 너무재밌어요  
20180325,10,그 냥 1 0 점 을 주 겠 습 니 다.  
20180321,10,진짜 이 영화를 보면서 제가 지금까지 얼마나 인생을 헛되게 살았던 것도 더 느끼게 되었고 사람이 살면서 자기 자신에게 쪽팔리게 살지 않아야 겠다는 정말 큰 생각을 갖게 되었습니다. 존경합니다.데스몬드님  
20180321,10,신념은 그 사람 자체이다  
20180318,10,뒤늦게봤는데 진짜 감동적이고 ㅠㅠㅠ명작이에요 여러분 보세요  
20180316,1,폭력이 당연한 전쟁터에서 자기를 향해 총을 쏘는 적을 앞에 두고 비폭력을 추구한 한 사람의 신념과 고뇌가 담겨있을줄 알았는데 진부한 미국 개신교식 히어로물이었다.  
20180312,8,영웅이 아니라 반전이 필요하다는 말은 미국식 영웅집어치우고 전쟁반대 한다는 말 같은데  
