0,1,2
20190129,10,이런 명작이 네티즌 평점 8점에 그치다니.. 보는 내내 가슴이 먹먹했습니다.  
20190129,10,오만하고 벌레같은 인간들보다 시저가 더 위대했다  
20190127,8,관람객자연의 승리..유인원..사람...음  
20190123,1,"쓰레기중에 쓰레기 시리즈 네임빨 믿고 끝까지 봤으나 시간 낭비 그자체, 시리즈 첫편의 드라마요소와 스토리는 어디가고 2편의 영상미와 볼거리 마저 실종. 시종일관 지루한 전개에 뻔하디 뻔한 결말. 눈쌀 찌푸려지는 몇몇 어이없는 설정들까지.  "
20190114,6,"사람보다 더 인간적인 유인원들의 생존기. 유인원이 세상을 지배하게 된건 유인원의 문제가 아니라 사람들의 문제였다 라는 발상.  유인원이라는 주체만 빼고는 줄거리가 신선하지는 않다. 속박,억압,복수,탈출,전투,미래.  "
20190107,7,좀지루한감이없지않고내용도약간이상한부분이있다그런데볼만은함...평점은7.4점주고싶다  
20190103,5,맷 리브스란 감독은 뭔가 대단한 걸 보여줄것 같으면서도 결과가 신통찮아.시저의 맥없는 퇴장.  
20181230,6,전작의 비범한 접근과 날카로운 사색이 빚어놓은 길을 범작으로 마무리  
20181228,10,고생했다 굿바이 시저..  
20181220,8,시저도 나이를 먹어가고있구나.  
20181220,10,존나 재밋엇다 강추 (알바 아님)  
20181217,7,"나름 신경쓴거 같기는 한데, 전작들에 비해서는 스토리나 전개 수준이 떨어집니다  "
20181207,6,허술한 각본을 화려한 CG로 다 덮기는 무리였다. 딱 아동용 수준의 각본  
20181202,8,"경이롭다....,,  "
20181130,10,넘 재밌었어요 가슴이 넘 먹먹하네요ㅜㅜ근데 평점1점주는 사람은 뭐저?심지어 똑같은 댓글을 계속다네..알반가?ㅋ  
20181129,8,원숭이도 저렇게 영어를 잘하는데 참  
20181127,10,밖에 나갔다오면 손을 잘 씻기 바랍니다...  
20181125,10,고전과 연결이 깔끔하네!  
20181121,10,길에서 테블릿 보다가 현눈물 터지긴 첨이네요...ㅜㅜ  
20181103,10,완벽한 마무리 3부작이라 생각합니다~시저의 카리스마와 멋진 지도자의 모습에 마지막까지 눈을 뗄수 없었습니다..감동에 엔딩...! ㅜ ㅜ  
20181023,10,이건 제 인생에있어서 제일 '''감동적인 액션'''영화입니다...시저처럼 진짜 멋있고 자애롭고 희생할줄아는 리더의 자세...그리고 애틋함..진짜 이건 명작입니다 이런 명작에다 1점 2점주고 재미없다고 평점테러하고 튀는새끼들은  
20181022,10,신은 유인원으루선택했다.유인원이 인간을 미워하게된 당위성을 부여한 영화  
20181008,10,왁꾸텽과 팬치들...  
20181006,10,존나 재밌는데 7.92 실화냐... ㅄ같은 국산 영화랑 비교가 안돼요  
20181006,10,혹성탈출 종의전쟁 ...  
20181004,1,평점 너무높은거 아님? 방금 봤는데  기대이하다..너무 시저 몰아주기식 스토리잖아....킹콩이 잡혀왔는데 살려준다 ..띠용? 반기를 들어도 살려준다..띠용? 친구들이 갑자기 숨겨진 입구를 찾는다.... 띠용?  참고로 1편부터 전편까지 전부 재밌게 봄  
20181003,9,잼있어서 진화의시작부터 종의전쟁까정 계속 보게 만드네...인간보다 더 인간미 있는 시저...너무 멋있었다!!!!  
20181002,8,우!!우!!우!1! 와!!와!!와1!와!! 오와! 오와!! 오와!!  
20180930,10,뻥안치고 진심 세상에서 제일재밌음  
20180923,10,이 시리즈를 보면서 한번도 인간을 응원하지 않았다 인간인 내가....  
20180922,8,관람객감동도 함께 느낄수 있는 영화  
20180908,10,유인원은 뭉치면 강하다..ㅠ  
20180904,10,반지의 제왕과 더불어 최고의 대작  
20180903,10,그렇게 새로운 에덴의 동산에서 다시 일어서고 다시 진화를 하여 다시 똑같은 패턴을 반복하겠지....정말 명작이였습니다  
20180829,10,졸잼..!!!~~~  
20180825,10,결국 인간은 지들끼리 싸우다 자멸하는구나  
20180825,1,2편의 액션과 재미를 생각해서 봤는데 전개도 지루하고 노잼이다. 종의 전쟁이라길래 봤는데 제목사기다. 전쟁안함. 감정선 표현도 별로고 인간성 운운하는 것도 글쎄? 그냥 유인원 탈출기에다가 되도 않는 감정요소를 추가한 느낌이다.  
20180824,9,눈사태가 이리도 무섭더나.. 완전 다른 영화가 되어가던 찰나 깔끔한 마무리에 평점 남기고 갑니다.  
20180821,8,특정 구간에 몰아서 1점 테러가 있는건 너무 알바 티 나는거 아니냐 ㅋㅋ  
20180817,8,전작하고 연결고리를 찾으려고 좀 억지스러운감이 있긴있는 듯  
20180815,7,해피엔딩인지 새드엔딩인지  
20180815,1,노잼 ㄹㅇ  
20180811,1,너무지루하다....  
20180806,7,혹성탈출의 센스는 헐리우드의 자랑  
20180805,10,한 편의 예술 영화를 봤다.  
20180804,10,이 영화를 1점준 사람들 특징 혹성탈출을 전쟁영화로 알고 있음  
20180801,8,알바가 굉장히 많네 알바들은 양심도 없냐 양심팔아서 돈받는 벌레들...  
20180731,10,인간성에 대해 말한 영화라기보단 인간성 그 자체에 대한 물음의 영화같습니다.  
20180731,8,과연 인간적이란게 뭘까? 더 높은 지위에 있으면 갑질하려는 성향. 자신의 편의를 위해서라면 같은 종족인 인간도 이용해먹고 노예처럼 부리려하는 그것이 진정 인간의 본성은 아닐까.. 인간도 보다 더 월등한 무엇이 나타나면 가축이 될 수 있다.  
20180730,6,과연 무엇이 달라졌는가.  
20180729,8,그니까 여기서 노바라는 여자아이가 찰튼해스톤이 나온 원작에서 그 우리에 갇혀있던 여자네?? 인류가 왜 말도 못하게된 존재가 된 것도 설명하고..그럴싸하게 연계시켰군. 그럼 이 작품하고 원작하고 자연스레 이어지니 4편은 안나오는 듯?  
20180726,7,의리로 봤습니다. 소소한 재미와 긴장감은 있었지만 전 두 편에 비해 너무 지루하네요. 마지막 단계라 그랬던거같네요.  
20180725,9,시리즈 물 중 유일하게 기대하며 보는 명작. 마지막 장면은 너무 아쉽다. 꼭 그렇게 안했어도 되지 않나.  
20180725,10,시저는 지능적으로나 육체적으로 강했지만 시저가 성장하면서 사랑을 알았고 시저역시 가족을 사랑했기때문에  강하지만  시저역시 무너질수밖에없었다  
20180724,10,정말 멋진 영화다.돈이 아깝지 않다. 감독도 배우도 모두 훌륭했다.  
20180724,10,영화 볼 줄 모르는 빡머가리들이 꼭 아는 척은 지리게 해요 여자애 첫 등장부터 코피 흐른 자국 있는데 초회차 감상에도 놓치지 않는 부분을 놓치는게 빡머가리들 수듄.. 한국 영화나 주구장창 보시길  
20180723,9,"명작은 명작이네,,,, 잘만들엇다,,,,  "
20180722,6,지능을 높이는 약물을 만들지 말아야  한다 .  
20180720,9,기대했던 것 만큼 훌륭한 후속편이었습니다.  
20180720,2,유인원이 짱먹는 스토리는 용납할 수 없음 시저 빨리 죽으라고 기도했음 빨리 다른 원숭이도 죽었으면  
20180720,1,노잼임노잼임노잼임노잼임노잼임노잼임  
20180718,6,중간까지는 인간들이 왜이렇게 답답한지몰랐다.처음에 인간들이 유인원들에게 침투할때 인상이 전략적이였기에 인간세력도 정상이라고 프레임이씌워졌기때문이다.하지만 대령조차도 거리낌없이 치부를들어내고 병사들도답답하게행동하는걸보고알았다.인류는 이미퇴화되는중이라는걸  
20180714,9,"음~.혹성탈출 1편,왜 인간은 말을 못하지?  왜 인간이 몽키들의 지배를 받게 됐을까? 하는 의문을 풀어주는 영화.그런걸 생각하며 보니 몰입감이 좋아요  "
20180713,1,너무 구시대적 영화로 만들어놨네  
20180707,1,이거 각본 쓴 사람 누구?  
20180704,8,시저아들이 리더로 등장하는 속편 등장할듯  
20180703,9,엄청난 명작 ㄷㄷ... 뭐랄까... 이렇게 찍는거 자체가힘들꺼같네요  
20180630,8,혹성탈출은 봐도 질리지않는작품  
20180616,10,완벽한 삼부작의 감성적이고 장엄한 마무리  
20180615,1,원숭이가 개똥폼 잡는 영화  
20180612,7,과연 인간은 자연을 학대할 권리가 있나  
20180607,10,3부작의 완벽한 완성이다  
20180607,10,인돤과 오랑우톤 공존 사뢰  
20180604,10,혹성탈출 주인공 문석환 ㅇㅈ??  
20180603,1,VOD로 봤는데 빨리보기 수십번 돌렸다...전개는 너무 지루하고 그냥 유인원 탈  쓴  인간들 탈옥영화 같고... 하품만 몇 번 한지 모르겠네  
20180603,1,혹성탈출 리메이크 판은 1->2->3 갈수록 졸작  
20180602,10,완벽하게 그려넣은 마지막 용의 눈  
20180526,8,영화 로건같은 분위기임 그러니까 화려한 액션이나 엄청 긴박함이런건 별로없음 초반까진 조금 느슨한데 중후반부터는 그래도 흥미진진하고 긴장감있음  
20180524,9,심하게 루즈한게 흠이긴 하지만  
20180517,8,시저는 인간 그 이상이었음을 보여줬다  
20180512,10,진짜.이연호ㅓ가 평점8점대 말도안담  
20180510,2,ㄹㅇ 보다가 중간에 잤음. 이건 그냥 유인원 다큐멘터리...말도 몇분동안 안하고 자기들만 아는 수화로 말하고 거기다 잠오는 브금까지 까는데 잠이 올수밖에 없지...  
20180507,8,나쁘지않음 심심하믄보세효  
20180506,10,"1,2 탄에비해 루즈할 수도 있지만 이 영화가 담는 메시지와 철학은 시리즈 전편 중 최고라 생각함.  "
20180503,10,으휴 알바시키들 쓰레기시키들...  
20180429,8,"한 유인원, 숭고한 삶을 살다  "
20180429,2,영화보다고 끈 몇안되는 명작.  
20180428,7,오프닝은 몰입도가 상당했는데 후반에 가면서 전체적으로 영화의 텐스를 잃어가는 느낌을 받았다.  
20180427,9,21세기 최고의 트릴로지중 하나. 가장 인간스러운 리더의 일대기. 시저의 눈빛은 영원히 잊지 못할 것이다.  
20180426,10,23살 영화보고 처음으로 울었습니다. 인간도 아닌 시저에게 눈물을 흘린 이유를 스스로 잘 모르겠지만 확실한건 시저는 유인원과 인간 모두에게 있어 '이해자'였습니다. 잘 가. 시저...  
20180424,9,블록버스터 보러갔는데 2시간넘게 잔잔하게  전개가 되니 호불호가 갈릴수밖에..  
20180423,8,점점 퇴화하고 있는 인류와 점점 진화하고 있는 유인원 사이의 갈등은 이번 편을 기점으로 서로의 자리를 바꿔치기한다. 이제 지구의 주인이 될 Caesar의 유인원에게는 길들여지지 않은 새로운 유인원(Bad Ape)과의 갈등이 시작될 것이다.  
20180423,10,시저 존멋~~~!!!  
20180422,8,배급사 줄거리 그따구로 쓰지 마라  
20180420,7,개인적으로는 1이 명작이었던 것 같네요.  
20180417,9,"이념 vs 이념을 다른 존재들에게 퍼지지 않게 자신만의 싸움으로만 한정하려는 시저, 인간 vs 유인원을 이분법적인 편견이 아닌 '노바'로 설명해주는 모리스. 일관성 있는 모리스도 멋있지만, 자신과 다른 생각도 포용력 있게 받아들이는 시저가 너무 멋있다  "
20180414,5,초반은조금지루할뻔했지만내용이전개될수록흥미진진해지면서집중하고보게됐음. 내용이좀 뜬금포기는했지만나름볼만했다바이러스에대한얘기를자세히얘기하지않아조금이해가되지않았음원숭이들이나무에서살아남은장면은뭔가대단해보였음 귀엽고진지하다가도웃게되는그런영화였음  
20180414,10,시저 원숭이가 위대해 보일 줄이야  
20180410,10,여운이안가심 표정들이섬세해서  
20180407,10,감명깊은 마무리였어요  
20180406,1,1 2편에 비하면 쓰레기 오브 쓰레기 이딴 영화는 현시대 동물원 침팬치가 만들어도 이것보다는 잘만든다  
20180404,8,영화의 스케일과 재미와는 별개로 이 장엄한 서사에 감격하지 않기란 불가능하다. 엔디서키스의 시저는 두말하면 입아플정도. 여러모로 인상적이다  
20180404,4,그럴듯한 시작으로 기대심을 불러 일으켰지만 결국 진부하게 끝난 영화.  
20180402,10,숨죽이고 몰입해서 보게됐던 영화  
20180402,8,"대다수의 블록버스터가 갖지 못 한 걸 왕창 갖고 있지만, 블록버스터란 영화의 기본 재미를 왕창 잃어버린 영화. 그럼에도 8점 이상은 가는 명작.  "
20180331,1,"액션, 연출은 몰라도 스토리는 ㄹㅇ OOO기 영화였음 영화관에서 봤는데 도중에 나가고 싶었을 정도. 그래도 팝콘이 있었기 때문에 팝콘먹는 낙으로 자리를 버텼다 ㄹㅇ;;  "
20180330,4,사실 액션을 기대하고 본 나로써는 좋은 평점을 주고 싶지는 않다  
20180323,1,전작에서 코바와 시저에대한 인연이 그리 깊은거같지않은데 여기선 엄청두드러지게표현하네 그리고 저 여자애는 중요한역할일줄알았는데 분량이랑 전개가 너무아쉬웠다.그리고 결말도 전작들에 비교해선 많이 아쉽다 평점은 7점대가 적당하다  
20180322,5,"혹성탈출 시리즈 다 봤는데 1,2편에 비해 이번 혹성탈출은 혹평탈출하기 힘들거 같다  "
20180322,9,시저의 위대한 여정의 마무리로 모자람이 없다. 원숭이들의 연기는 그야말로 압권.  
20180318,5,지루하다. 볼거리가 많지 않다. 시리즈 영화를 좋아하는 사람만 보는 매니아 영화처럼 되가는 듯.인간과 자연의 공존은 불가능한 것인가?  
20180317,8,시저 이제 편히 쉬어 ~ 수고했어  
20180314,9,너무나 재밌게 봤습니다!!  
20180311,10,고생했어 시저 그생각밖에 안드네  
20180311,1,이거 평점 왜 이리 높음? 진짜 이렇게 지루할수가 없네. 기대하고 본건데  
20180310,6,"군함도를 보고 나서 봐서 그런가 어떤 장면은 비슷하다는 느낌이 강했음. 인간간의 전쟁,  그리고 유인원이 최후의 승자가 되어 지구의 주인이 된 프리퀄의 최종판인 듯. 우디 해럴슨의 카리스마 있는 모습은 신선했음  "
20180310,10,액션에 찌든놈들 영화볼 줄 모르네 감정연기를 봐라 좀 ㅋ 답답 액션충들  
20180310,10,액션에 찌든놈들 영화볼 줄 모르네 감정연기를 봐라 좀 ㅋ 답답 액션충들  
20180308,10,단 한번도 날 실망시키지 않은 시리즈. 시저 안녕 그동안 고생했다 인간보다 배울게 많았던 리더  
20180307,7,시리즈와 다른 스토리가 산으로 간 느낌.인간과 인간의전투씬이어진 산사태는 종의 생존은 한 종 우월함이 아닌 자연의 선택이었다는 것.겸손해진다. 전투씬응 실망.아파치가 헬파이어 들고 대공미사일 있는 기지에 정면돌파.이어진 군인들 떼샷결과를위해짜마춰진느낌  
20180303,10,"인류는 아마 멸종 직전까지 전쟁을 계속하겠지...소중한 이들을 잃은 시저에게 너무 미안했고, 그럼에도 변함 없던 그의 모습에 영화 보는 내내 눈물이 멈추질 않았다. 반지의 제왕, 다크나이트 시리즈에 이은 내 인생 트릴로지...  "
20180303,8,유인원판 첩보영화 같다.  
20180228,10,굿바이 시저..가슴 먹먹해지는 영화..  
20180224,9,노바 그 이후가 궁금하다. 혼자 인간인데 잘 살아갈지 너무 걱정되고 안타깝다.. 정체성에 혼란이 많이 오겠지  
20180224,8,장엄하다. 네 발로 딛는 출애굽!  
20180222,7,이 영화시리즈가 참 잘만든 영화인 것은 알지만  현실적으로 잘 와닿지가 않아서  크게 흥미롭지는 않다. 그러나 시사하는 바는 무시할 수만은 없겠지.  
20180221,10,"장엄하고 쓸쓸한 시저라는 인물의 퇴장,마지막인 만큼 마무리가 탄탄하다.  "
20180219,10,관람객너무 재밋었어요 감동적이고 시저는 멋있네요 ㅋㅋ  
20180219,10,안해야돼 안그래야해..  
20180218,10,시저의 이야기를 두고 두고 기억하게 되는게 그 아들만은 아닐거야... 나만 해도...  
20180217,8,관람객볼만해요 재밌어여 ㅎㅎㅎ  
20180217,6,관람객기대보다 별로...여서 정말 아쉬움  
20180216,10,"관람객시저, 그는 유인원의 예수였다  "
20180216,10,관람객굳굳 너무재미있었어요  
20180216,9,관람객이거보려고 지하철만 7정거장 갔어  
20180214,9,관람객전작을안봐도이해가능  
20180213,10,관람객인류의 끝이 궁금하다 어찌될지...  
20180212,1,아이고 평레기들 아주 신났어 1편을 먹칠한 졸작  
20180211,7,"메시지는 많지만, 트랜스포머 시리즈처럼 1 2 3 편 주인공만 같지 항상 다른 영화보는 느낌  "
20180211,10,관람객원숭이들의반란무시뮤시무시뮤시부시하다  
20180210,10,시저 최고 아름다운결말 ㅠㅠ  
20180210,8,관람객오지고요 지리고요 렛잇고요  
20180208,10,"평론가 하기 정말 쉽구나. 지구의 미래? 인간 실격, 시저 합격! 이따위 소리나 하고, 인간다움은 무엇에서 비롯되고, 인간이 인간일 수 있는 자격은 무엇인가?라니... 정말 영화를 보긴 했는지 뭘 말하고 싶은건지 본인도 써 놓고 이해 못할 평론이다.  "
20180207,10,진짜 명작이다ㅠㅠ 감동적이다  
20180206,6,음 스케일만 클뿐 지루하다  
20180206,9,기대한것보다 더 좋았어요  
20180206,8,좋았다. 처음 시리즈가 생각 안날만큼 진화 한 시저ㅠ  
20180206,1,"1,2를 너무 재밌게 봤던 기억에 너무 지루함  "
20180205,5,관람객전편을 전혀 안보고 봤을땐 좋았는데 뒤늦게 전작을 찾아보니 아쉬움...  
20180205,9,관람객너무 기대를 하고 봤나?  
20180204,10,인간보다 위대한 영웅을 기억하며...  
20180204,8,"관람객전편보다, 스케일은 크네요. 그러나 내용은 1편이 제일이었던같습니다  "
20180204,10,대작의마무리  ㄹㅇ 소름돋음  
20180203,10,정말 완벽한 3부작이다  
20180203,10,관람객결말이 인상적이였습니다.  
20180202,10,시저같은 리더가 있을까..  
20180202,10,관람객진짜 이거보고 한국영화 안보기로함  
20180130,7,"관람객1,2편 처럼 빠져드는 느낌은 없지만,나름 의미를 담은 결말이었습니다.  "
20180130,10,관람객역시 혹성탈출! 3편도 꿀잼  
20180129,8,관람객오락영화로 보기엔 재미있었습니다  
20180129,10,관람객재밌습니다 또 보고싶네요  
20180128,10,개봉당시 못 보고 티비로 봤는데 결말이 참 맘에 드네요  
20180128,10,ㅠㅠㅠㅠ최고에여..ㅇ  
20180127,7,관람객재밌으나 약간 진부하고  
20180127,10,ape들을 볼 때마다 가슴이 뭉클하다... 시저와  헤어지게 되어 슬펐다..올해들어 가장 감명깊게 본 영화!..  
20180126,5,"관람객용두사미, 시작은 창대하지만 그 끝은 미미하리라!  "
20180125,10,관람객역시 자연은 무서워요나비효과를 보여주는 영화인것 같네요  
20180125,5,벽만들기가 아니라 자기들의 전쟁을 도우라고 강요하는 대령이었으면 캐릭터가 살지 않았을까? 언제 전쟁이 시작될지 모르는 요새 안에 가연성 탱크로 사방을 둘러싸서 수류탄 하나에 전부 폭파 되도록 놔뒀다고? 멋진 vfx와 음악이 허술한 시나리오에 무너진다.  
20180125,8,관람객전 시리즈를 안 보았을 경우 놓치는 것이 많을지도... 시리즈의 먹먹한 완결  
20180125,8,관람객삼부작 시리즈의 모범적인 맺음작  
20180124,1,뭘 어쩌란건지 모르겠는 좆망 영화 8000원으로 꿀잠 굿  
20180124,1,너무 개연성이 없다. 전작들에 비해 구성이 너무 허접함. 진짜 실망했다. 별 반개도 아깝다. 17년도 최악의 졸작.  
20180122,10,관람객3부작의 마지막을 아름답게 마무리했습니다. 꿀잼!!  
20180121,9,재미있는 헐리웃 영화의 표본 마지막 장면에서 그동안 시저 살아왔던 전 영화 장면들 썼으면 좋았을텐데 좀 아쉬움  
20180121,8,유인원의 지구정착기...인간의 지구생존기...찬란한 슬픔의 마무리  
20180120,8,관람객유인원의 승리? 자연의 승리!  
20180120,8,시저의 마지막 모습을 잘 나타내었다 액션신을 기대한다면 약간 실망할수도...  
20180119,10,시리즈 마지막으로 이만한 영화가 없다  
20180119,5,1시간 짜리 스토리를 2시간으로 늘여놓음  
20180119,10,관람객감동도있고 재미도있었어요애들도 입벌리고 집중했네요^^  
20180119,9,마지막 시저의 죽음 장면에서 모리스가 유인원을 낙원으로 이끌고(구원하고) 죽은 시저의 죽음을 슬퍼하는  모습이 미켈란젤로의 조각 '피에타'에서 성모마리아가 예수의 죽음을 슬퍼하는 모습과 겹쳐 보여서 인상적이었습니다.  
20180118,9,관람객시저 ㅠㅠㅠ 너무재밌고 4도 나왓으몉좋겟어요 ㅠㅠ  
20180118,1,1.2편은 괜찬다.   3편은 5점 이하다!!!  
20180118,6,"1편이랑 2,3편은 감독이 다른거냐? 완전히 다른 영화를 본 기분이다. 영화 내 캐릭터며 개연성이며 연출이며 모든게 1편에 비하면 졸작  "
20180118,10,관람객인원의 승리가 아니라 자연의 승리  
20180118,8,"이렇게 또 한세대가 가는구나,...  "
20180118,8,관람객재미있어요 조금 졸리긴했지만요  
20180117,8,관람객난 이영화 보면서 잠만잠  
20180117,5,관람객그냥그래요뻔한스토리예요  
20180117,7,관람객경종을 울리는 아이들을 위한 영화  
20180116,6,"관람객적당한 마무리, 전편들에 비하면 아쉬움  "
20180116,10,그냥 말이안나오네 와...  
20180116,8,관람객재밌게 봤지만 앞부분이 지루해서 집중이 잘 안됐습니다  
20180115,10,관람객흥미진진 넘무재미있었어요  
20180115,10,관람객시져는 정말 머싯다. 3부작 완벽  
20180115,10,관람객시져 ㅠㅠ 다시 보고싶다  
20180115,6,관람객동물과 인간의 교감이 빛난영화  
20180114,10,헐리웃이 잘 만들긴 잘만든다. 정말 리얼하다.  
20180114,8,관람객생각보다 괜찮은 영화였음.  
20180114,9,시저의 삶...이제 편히 쉬길... 여운이 가시질 않네요  
20180114,8,관람객재밌었음 전작 필수로 다 보고 봐야함  
20180113,9,"관람객좋은배우, 좋은영화였습니다.  "
20180113,5,관람객그냥그럈어요 지루하구ㅠ  
20180113,10,관람객완전 재미있어요~~~강추!!  
20180112,7,관람객괜찮은듯....생명체는 다 소중한듯~~  
20180112,8,관람객시저불쌍해서어떡하니  
20180112,10,작년에 봤던 영화중 가장 기억에 남아요.  
20180111,10,관람객유종의 미 굿 좋았음 짱짱  
20180111,5,관람객싸워서 못봤지만 꼭 보고싶어요 ㅠㅠ  
20180111,4,기대가 크면 실망도 큰 법 어찌 점점 재미 없게 만든담  
20180111,7,관람객기대보다 실망스럽다.  
20180110,9,관람객최고.~입니다... .  
20180110,10,관람객1이랑 또 다른 느낌이라 재밌었어요~슬프기도 하고  
20180110,10,관람객10101010101010101010자  
20180110,5,관람객전편을 못봐서 내용을 이해하기 어려웠음  
20180109,10,관람객잼났어요 CG 보면볼수록 대단하다는  
20180109,8,CG도 숨기지 못하는 앤디서키스의 눈빛연기  
20180108,9,혹성탈출 시리지 다 봤는데 역시 잼있엉  
20180108,8,관람객재미있는 영화였습니다.  
20180108,8,관람객ㄱㅊ았던거 같ㅇ았습니다  
20180108,1,그냥 영화가 지루함 처음부터끝까지  
20180108,10,관람객올키굿잡베리베리망치올리굿잡잉  
20180108,10,<다크나이트>3부작이나 <반지의 제왕>3부작급일지는 모르겠으나 완벽한 3부작 영화가 무엇이 있냐고 묻는다면 리부트 혹성탈출 3부작도 이야기할것이다.  
20180107,7,관람객마지막 좀 슬펐습니다.. 또 시리즈 나왔으면 좋겠어요!  
20180107,8,관람객혹성탈출은 극장판으론 첨으로 보았다.동물영화라 선입견 부터 가졌는데 감동과 휴머니즘을 모두 안겨준 영화였다  
20180107,10,관람객영화관람 잘했습니다^^  
20180107,8,명작은 아니지만 마무리 잘한 수작 느낌. 3편 동안 고생했던 시저 굿바이 ㅠㅠ  
20180107,9,마지막에 시저 왜 죽어ㅜ  
20180107,10,관람객재밌다재밌다재밌다10자  
20180107,8,관람객볼만햇어요나름재밋었어요  
20180107,9,"전작에 비해 별로라는 사람이 몇몇 있길래 기대 안하고 봤는데,전작에 비해 액션 비중만 줄었지 작품성은 훨씬 좋고 몰입도도 뛰어났다..  "
20180107,10,관람객역시 재밌었습니다 굿ㅇㅇ  
20180106,10,관람객인간의 본성에 대한 성찰과 미래의 인간세상을 들어다 보는 반성의 계기가 된 영회  
20180106,10,관람객그런데로 잼있고 괜찮았어요  
20180106,10,관람객사실상 스토리의 종료 오리지널 작품 리메이크가 되어지길 기대한다  
20180106,9,관람객진짜로 재미있었아요!!!!  
20180106,10,관람객킹왕짱 꿀잼이었다요 처음보단 못하지만  
20180105,6,관람객그냥 딱 중간인 영화였습니다..  
20180105,9,관람객씨지에 항상 감탄 스토리도 탄탄 다음편이 너무 기대돼!!  
