0,1,2
20170819,10,개인적으로 가연성 폐기물 폭파 및 전투로 인해 산사태가 일어나는 장면이 인상깊네요. 자연의 섭리를 자꾸 거스르면 아주 주옥되는거야..  
20170819,6,관람객전편들보다보다 아쉬운 영화  
20170819,8,저번 시즌과 비슷한 느낌~ 저번 시즌이 재밌었으먄 이번에두 재밌고 저번시즌이 고냥고랬으면 이번에도 그럴듯싶네여..  
20170819,1,유인원판 군함도...  
20170819,10,관람객최고의 영화  ~~~~굿  
20170819,10,어쩜 팀버튼보다 리부트 감독들이 영화 더잘만듬 ㅋㅋ  
20170819,8,관람객시저의 눈빛 표정 말투 분위기 대단하다고 밖에 느껴지지 않는다  
20170819,10,사람이나 동물이나 카리스마가 중요하단걸 깨달음 ㅋㅋ  
20170819,10,인간의 입장에서 영화 속에 나오는 인간들은 참 못됬다..  
20170819,6,금발소녀 노바의 불행은 이제부터 시작이다...  
20170819,1,하암~~~~졸다와씀  
20170819,10,"꿀잼ㅠㅠ1,2,3편 다 재밋어 ㅋㅋ 미쳣다 ㅋㅋ  "
20170819,4,평점처음달아보는데진짜 이게 재밌다고??명작이라고??흔하디흔한 플롯에 지루한전개꽃 머리에 꽂을때랑 인형주는 두개시퀀스가 이영화수준말해준다명작수준이라할만한 전작에 비해3편은 딱 7~8세 아동용이다  
20170819,10,관람객하 시저 늙어서 자연의 섭리가 느껴짐...  
20170819,10,다른분들은 어떨지 몰라도 저는 굉장히 잼나게 봤네요  
20170819,8,관람객스토리가 탄탄하당ㅎㅎ  
20170819,10,난 개인적으로 정말 재밌게 봤다 시저도 시저지만 대령의 인간적인 모습이 되게좋았다 대령의 죽음이 약간 허무 하긴했지만그리고 특히 시저의 감정을 나타내는게 정말 대단한것같다 폭팔로 인한 눈사태도 딱히 부자연스럽진 않고 여자이이 역할도 맘에 들었다.  
20170819,4,너무 지겨움 난 퍼퍼펑 우지직 와장창 보러 갔는데 무슨...유인원 신파극 보는 줄 알았음... 그냥 유인원 드라마임 절대 비추  
20170819,8,관람객시리즈의 엔딩에 준수한 결말  
20170819,9,관람객즐겁게관람했습니다. 아쉬움이조금남아요  
20170819,9,관람객꼭 보시라 권할 만한 영화다~~ 재밌게 잘 보았다  
20170819,9,"관람객원작과는 다른 내용이지만, 나름대로 재미나게 보았습니다!  "
20170819,2,데우스 엑스 마키나. 내 시간 물려내라  
20170819,10,관람객시리즈물로써는 최고!~!!  
20170819,7,관람객초반엔좀 지루했으나 중반이후부터는 볼 만했어요.  
20170819,1,아들이 보러가자해서갔는데 아들 때릴뻔한영화였어요최근에 보기드물게 최악의 영화를 봤습니다제점수는요 100점 만점에 3점입니다보다가 극장에서 탈출할뻔한 유인원영화입니다  
20170819,2,진짜 재미없어요!!! 혹성탈출 팬인데 실망...  
20170819,6,개인적으론 영화의 주제의식을 모르겠습니다..러닝타임도 길어서 다소 늘어지는 감이있네요.  
20170819,8,관람객마지막화치곤 강렬하지않아ㅛ음  
20170819,8,관람객괜찮았습니당~~~~  
20170819,10,"1,2편보다 스펙타클하거나 액션이 많은건 아니지만 감동은 더 크다  "
20170819,10,관람객3부작 시리즈 완결 막을 내렸다. 마무리는 잘했다고 생각. 앤디서키스 연기가 진짜 제대로였는데..이것만 해도 평점 충분.. 아 아미아 밀러 그대로만 자라다오!! 완전 반했음....  
20170819,10,진짜 나중에 자연앞에 인간이 무너질 것 같음  
20170819,10,생각보다 훨씬 재밌는데요?  
20170819,10,시저만한 캐릭터는 없는 것 같은  
20170819,10,인간vs유인원 같은 인간인데 유인원을 응원하게 되는 영화  
20170819,10,관람객Apes together strong  
20170819,10,"아,,,, 시저,,,, 넌 최고였어,,,,  "
20170819,6,솔직히 엄청 기대 했는데 루즈한건 맞아요. 그래도 고생했다 시저야! 시저가 죽는구나....  
20170819,10,관람객잔잔한 감동~ 시저의 감동 매음이 느껴집니다요  
20170819,10,방금 보고 왔습니다. 초반은 지루하게 전개되었지만 중반부터는 이 시리즈의 마지막을 장식할만큼 좋은 영화였습니다.  
20170819,9,관람객혹성탈출 역시재미있다  
20170819,10,내시저!너무재밌었다ㅠㅜ  
20170819,10,관람객남친이랑 저랑 둘다 잼있네 봐써요~^ㅡ^  
20170819,10,와 오늘 안보러 갔음 후회할뻔했네  
20170819,10,이 영화가 끝나는게 이렇게 아쉬울줄이야ㅠㅠ  
20170819,10,러닝타임이 길다는 세ㅐㅇ각이 안들던데..140분인거 지금 알았다..  
20170819,10,갠적으론 무지하게 인상깊었던 영화입니다  
20170819,6,너무 지루해서 중간에 졸았음~  
20170819,10,"시저야 인간보다 동물이 더 나을수도있구나느낀다.물론 영화지만, 교훈은 반드시 있음  "
20170819,10,"시리즈의 완벽한 마무리. <반지의 제왕>, <대부>, <스타워즈>, <다크 나이트>, <토이 스토리>와 함께 역대 최고의 3부작 반열에 올라설 영화.  "
20170819,10,보통 평론가 평점이 이정도면 네티즌도 8.75 정도는 걍 하는데 이건 왜이러지 아직 안봐서 모르겠지만 재밌다기보다는 작품성이있는건가  
20170819,8,관람객너무 졸렸어요 기대한것보다는 좀..  
20170819,1,유인원들의 군함도...  
20170819,10,마지막까지 진정한 리더 시저의 모습에 아직까지 여운이 남고 가슴이 먹먹하네요 유인원은 뭉치면 강하다  
20170819,10,관람객재미있게 관람했어요히히히히  
20170819,3,지루합니다~~ 실망했습니다  
20170819,9,진정한 리더의 모습을 유인원에게서 발견하다니... 침팬지가 잘생겨보이기는 또 처음이네요  
20170819,8,"좋은 소재로 2편마냥 너무 총질에 소모한게 아닌가 싶고, 생명/공존/인간성 등 조금 더 생각해 볼 수 있는 의미를 담아냈으면 좋았을텐데, 스토리가 아쉬운 영화.  "
20170819,10,시져를보내야하다니...해피엔딩을기대했는데..마지막모습이넘처연해서..맘이아픕니다..  
20170819,7,관람객인간은 무능했고유인원은 뭉치면 강했다  
20170819,9,"윈터(자연)의 승리구나.보는내내 긴장도했고 결말도막크게 속시원하진 못했으나 역시는역시.인간이 얼마 잔인한지 보여주기도 하고 고문 당하는것에비해속시원히복수를못했다고 생각한다.이 영화의 마침표를 찍었다는것이제일아쉬운부분이라고생각한다.마지막으로 안녕,시저!  "
20170819,8,괜찮았음ㅋㅋ 진행이 살짝 루즈하긴 했지만  
20170819,9,관람객아들이랑 재미있게 보았어요.  
20170819,10,우오.. 헐리웃 기술력에 또 한번 감탄합니다  
20170819,10,유인원들의 움직임 하나하나가 실제를 보는 것 같이 엄청 완벽했다.  
20170819,1,주제 모호 영상 치중 스토리 지루  
20170819,10,시저으 ㅣ리더쉽과 카리스마에 눈물날뻔 ㅠ  
20170819,10,이번 3편은 뭔지 모를 감동이 엄청나네요  
20170819,10,1편부터 봐야지 재밌습니다. 뭐 근데 친구는 3편이 첨이었는데 잼나다고 하네요  
20170819,10,굉장히 철학적인 영화다. 인간도 유인원도 각자 옳다고 생각하는 가치관과 정의에 따라 움직일 뿐이다. 정답은 없기에 굉장히 재밌었던 영화이다. 개인적으로 내취향!  
20170819,10,와 너무 고급지고 재밌어요. 개인적으로 3편이 재일 좋아요 ㅋㅋ  
20170819,8,관람객유인원 다큐멘터리 소녀만이쁘고귀엽  
20170819,10,관람객재밌네요 근데 이전시리즈를 ㅅ좀 봐놔야할듯요  
20170819,10,시대의 변화에 맞서 사람도 변해야하는것을..  
20170819,10,관람객말이 필요없다. 꼭 보시길.  
20170819,10,자연의 섭리 앞에 무릎을 꿇수 밖에 없는 인간의 나약한 모습이 잘 나타나 있다  
20170819,10,포디 고민하시는 분들 강추요! 진짜 좋아요!  
20170819,7,전작 두편에 비하면 좀 루즈합니다. 뭔가 시원 시원한 액션보다는 약간 잔잔한 서사시 보는 느낌이에요. 취향 안맞는 사람은 졸 수도 있어요. 그래도 완결편이니 혹성 탈출 관심있는 분은 봐도 괜찮을듯 합니다.  
20170819,1,평점 조작 영화...돈주고 볼 영화는 아니라고 봅니다.ㅜㅜ최악의 영화네요...  
20170819,10,지금 생각해도 대단한 영화였다고 생각함  
20170819,10,그래픽이 엄청 리얼하네영 ㅋㅋ  
20170819,1,최악최악최악 보다나왔음 ㅡㅡ  
20170819,10,시저와 아들 나올때 진짜 울컥할번 ㅜ.ㅜ  
20170819,10,앤디서키스.. 진짜 연기 되게 잘한다..  
20170819,9,관람객재미있게 잘 봤습니다.  
20170819,7,이번 작품도 메시지가 좋았습니다.그간 시저가 해왔던 모든 행동들을 영원히 잊지 못할 겁니다.  
20170819,8,관람객재밌어요 흥미진진 해요  
20170819,10,이전 시저와는 또 다른 느낌이네요?  
20170819,10,뒷이야기도 궁금한데..~ 여튼 쫌 슬퍼요 마지막에  
20170819,10,재밌어용! 그 여자애 진짜 이쁘드라구요~~  
20170819,10,아이맥스로 관람할만 하네요 ㅎ  
20170819,10,유인원들 표정연기 개쩌름 ㅋㅋ  
20170819,10,우디해럴슨도 멋잇던데 ㅎㅎ 너무 시저만 좋아해 다들 ㅎㅎ  
20170819,9,외유내강 버전 아쉬울순 있어도 실망하지 않을것이다.  
20170819,10,정말 하나하나 놓칠수있는게 없는 영화였어요~ 그리고 왜 여자애가 있냐고 하는 분들 노이해... 스포여서 말은 못하지만 그여자애가 꼭 잇어야만하쥬...  평점 1000점 드리고싶음.... 개감동영화 시저 사랑햄  
20170819,10,인간 이상으 ㅣ인간미와 리더쉽을 보여주는 시저에게 반하지 않을 수 없네요  
20170819,10,정말 인상적인 연기를 보여준 앤디서키스  
20170819,10,관람객인간을 뛰어넘은 타종족의 인간성을 보여준다.인간성은 인간만의 전유물이 아니라는 것을 보여주는 작품이다  
20170819,10,혹성탈출 굿~~ 아이들 방학이라 조조로 저렴하게 봐서 기분좋고영화가 너무재밌있었고 너무좋은 영화 감사합니다  
20170819,1,보지마세요 여러분 졸려요  
20170819,10,1점 주는 놈들 뭐냐 ㅋㅋㅋ 이번이 제일 나은데  
20170819,3,몰입도는 최고인거 같지만막상 무슨말을 하고싶은건지 모르겠어요  
20170819,9,로봇계 최고리더는 옵티머스프라임 동물계최고리더는 시저...굿바이 시저  
20170819,10,시간 가는줄도 모르고 너무 재밌게봤어요~^^ 후속작은 재미없는 경우가많은데 최고였습니다 특히 골룸같은 유인원 감초역활 최고네요~~  
20170819,7,"장엄하고 묵직하지만 흥이 안난다.  1,2편에 비해 오락적인 재미는 부족.  "
20170819,10,시저의 부드러운 카리스마!! 이런 리더가 있으면 얼마나 좋을까  
20170819,7,결국 인간과 인간의 대결로 명망..이런 영화를 택시 운전수 같은 정치풍자물 영화로 인해 스크린 독점으로 개봉관이 적다는것이 참 안타깝다.쓰레기에 가린것이 아쉽다..  
20170819,10,액션도 충분하고 무엇보다 드라마적인 요소가 많아서 더 흥미롭게 본것같아요  
20170819,7,관람객전달력이 좀 떨어지는 영화. 좀 지루한면이 있습니다.당황스러운 영화... 좀 아쉽네요.  
20170819,1,어제  북수원에서  봤는데   너무 지루합니다영화 끝나니까  옆에 있는분 하품하고 뒤에 앉아 계신분 자고 있음. 돈아까워요.  
20170819,10,시저를 통해 우리가 지키고 이어가야할 가치가 무엇인지 생각하게 한다  
20170819,10,오리지널 시리즈에 OOO 않는 완벽한 프리퀄  
20170819,10,시리즈가 전달하는 메시지와 감정은 확실하다  
20170819,10,개인적으로 굉장히 좋아하는 영화 중 하나입니다  
20170819,8,관람객지루하나 볼만했어요.  여자아역배우가 가장 기억에 남는건 뭐지...  
20170819,6,유인원도 참 잘생길 수 있구나 ? 이것만 느끼다 왔네요스토리가 ㅠㅠ  넘 아쉽내요오히려 배경음악이  극을 끌고 가는 느낌 배경음막은  별 다섯  
20170819,10,토탈리콜 리부트 나이트메어 리부트 등등 수많은 리부트 작품이 나왔지만 원작을 뛰어넘는 리부트는 혹성탈출 리부트 3부작이 최고일꺼다  
20170819,10,인간들 스스로가 인간다움을 잃어가는게 안타까울 뿐이다  
20170819,10,시작부터 끝까지 다 본 1인. 재밌었음  
20170819,10,인간보다 더 감정이 풍부한 유인원들.. 많은 반성을 하게 되네요  
20170819,10,앤디서키스!! 그동안 수고 많이 했어요~~  
20170819,10,처음보는 등장인물들도 있었는데 전부 다 좋았어요 ㅎㅎ 그래도 시저가 제일이지만 ㅎ  
20170819,1,전작들에 비해 너무 지루  
20170819,10,시리즈물 다 본 사람으로써 마지막도 인정 합니당 ㅎ  
20170819,6,관람객지루합니다 액션신이 너무없어요  
20170819,10,이렇게 낮은 점수가 이해안가네요  
20170819,8,관람객꾸르잼열자열자열자욜자  
20170819,8,관람객기분좋게볼만하네욤~  
20170819,10,만족만족!! 짱 재밌구 멋있었어용!  
20170819,9,철학적인 의미를 담고 있는 영화임에도 불구 이렇게까지 사랑을 받는건 혹성탈출이 유일무이할 듯 싶다  
20170819,10,어떻게 보느냐에 따라 영화에 대한 가치가 달라질 것  
20170819,10,어찌 유인원이 사람보다 더 인간적인가  
20170819,10,역쒸~^^ 재미쩡 혹성탈출!!+_+  
20170819,10,시저의 감정변화를 따라가면서 보게되네요  
20170819,10,140분이 어떻게 지나갔는지 모를정도 ㅋㅋ  
20170819,1,1탄만 재밌네요 실망 ㅜ  
20170819,10,3년마다 개봉했던 혹성탈출 시리즈. 3년뒤에는 또 다른 이야기가 펼쳐졌으면 좋겠다  
20170819,10,이렇게 유종의 미를 거두네요^^  
20170819,10,인간이 잃어버린게 무엇인가..  생각하게 만드네요  
20170819,10,관람객재미씀!! 불쌍해 ㅠㅠ 전쟁 시러 ㅠㅠ  
20170819,10,영화값이 안아까워요. 처음으로 과자사서가서 안먹고 너무 재미있어서 영화만 봤습니다.  
20170819,10,진정한 리더로 거듭한 시저의 모습이 멋있었어요  
20170819,9,관람객시간남으면 볼만한영화에요<  
20170819,10,시리즈 영화의 좋은 예 ㅋㅋㅋ  
20170819,6,혹성탈출에서 파생되어서 이것만 보고는 왜 유명한지 모르겠다  
20170819,10,인간과 유인원의 (지능과 감성)이 반비례하는 모습. 현 시대의 우리 인류를 반영하고 지적하고 있는게 아닌가.  
20170819,10,철학과 서사가 들어있는 영화. 그렇다고 지루하지도 않음  
20170819,10,오늘 보고 왔습니다. 재밌게 봤어요  
20170819,9,"관람객대자연의 관점에서 인간의 존재가 어떤 의미인가에 대한 의문을 가지게 합니다. 인류 사회의 발전과 그 사이에 발생하는 종교, 인종, 국가 사이의 갈등이 얼마나 부질 없는가를 생각해 봅니다.  "
20170819,9,"종의 전쟁은 서로가 투닥이는 것만을 의미하지 않는다. 대자연의 눈사태에 인간은 쓸려나갔으나 유인원은 살아남았다. 자연의 선택, 적자생존. 인상깊은 표현에 고개를 절로 끄덕이며 영화관을 나올 수 있었다.  "
20170819,10,섬세한 감정선을 따라가게 되면 긴 러닝타임도 길지 안헥 느껴진다  
20170819,10,완벽한 리부트의 마무리를 보여준다  
20170819,10,관람객보는 내내 눈물이 ㅜㅜ 재미와 감동을 다가진 영화!  
20170819,10,관람객평점테러라고 밖에는.. 기대이상이었고 내용도 흐름도 모두 좋았어요  
20170819,10,관람객마지막까지 깔끔한 교과서 영화  
20170819,9,14日엣지액정배터리무상틸교체원두막셀프백반15日엄빠틸문리버테라로사소나기마을17日父권팀장정릉봉화묵집틸깜장옥수수종의전쟁18日대기중틸모짜새우버거13번14번성공아내와아들을잃은시저는분노했으나고난의끝에유인원들과꼬마노바를새터전으로인도한후모두다이루었다는듯눈감다아듀시저  
20170819,10,앤디서키스의 연기 덕분에 진정한 시저가 탄생한 것 같음  
20170819,7,노바 귀요미 때문에 그나마 7점줍니다...너무 실망이었습니다.  
20170819,8,"관람객시저 위주로 돌아가는 줄거리, 그리고 새로운 종자의 발견. 재미있었습니다. 살짝 지루한 면이 있어서 평점8점  "
20170819,10,관람객모든 것은 다 연결되어진 완벽한 영화입니다  
20170819,10,그 동안 고생 많았다 씨저야  
20170819,10,"cg를 구현해낸게 진짜 최고인듯,., 어찌 저렇게 주름이나 털 하나하나 섬세하게 표현할 수 있지?  "
20170819,7,관람객생각보다 이해하기 어렵고 지루했어요  
20170819,10,간접적인 경고의 메시지를 보내는 느낌?.  
20170819,9,전쟁을 하는 인간의 입장에서 봤다그런 선택을 할 수 밖에 없는 대령을 이해하게된다  
20170819,10,시저와 유인원들을 연기한 사람들 진짜 짱짱맨!!  
20170819,10,영화 속에서 벌어지는 이야기들이 왠지 영화에서만은 일어날 것 같지 않네요  
20170819,10,영화가 주는 메시지가 좋았다  
20170819,10,역대급 명작 반열에 오를 영화!!  
20170819,10,인간의 오만과 탐욕으로 태어났지만 인간과는 달랐던 시저  
20170819,9,"관람객보는눈은 즐겁지만 1,2 편에 비해 몰입감이 떨어짐. 다만 시리즈 마지막 작품이 아니라고 하니 향후 작품도 기대해도 좋은듯..  "
20170819,9,관람객기대으로  재미있습니다  ~시간과돈이 아깝지않습니다  
20170819,8,"원작의 연결점을 잘 찾은 영화,, 6년의 시간이면 의리!!!  "
20170819,10,정말정말 감동적이었습니다  
20170819,5,허술했고 루즈했고 이해가가지 않는 장면이 많다'재미'에서도 전편에 비해 떨어졌고 '치밀함'은 1편만 못하다  
20170819,8,전작에 비해 잔잔하고 다소 지루한감이 있지만 영화가 주는 교훈은 분명하다. 잼게봤습니다  
20170819,10,자연의 섭리 앞에 무릎을 꿇수 밖에 없는 인간의 나약한 모습이 잘 나타나 있다  
20170819,10,포디 고민하시는 분들 강추요! 진짜 좋아요!  
20170819,10,"시저의 완벽한 연기, 장면 하나하나 보는 사람을 감성 젖게함  "
20170819,9,"이시대에 필요한 리더 시저,  "
20170819,10,사람과 유인원을 보는데 왜 유인원에게 더 정이 가고 마음이 가지..  
20170819,8,유인원이 살아남아 인간이 되었다는 막장스토리까진 가지않았네 처음부터 끝까지 아주 잔잔한 영화  
20170819,6,줄거리도 아쉽고 연관성도 떨어집니다  
20170819,10,앤디서키스는 이만하면 상한번 받아야할 것 같음 ㅋㅋ  
20170819,10,한편의 대 서사를 본 기분.  
20170819,10,스토리가 탄탄한 영화였어요  
20170819,10,마지막에 시저가....  
20170819,6,"관람객좋은 CG 로 볼거리가 많으며, 영화를 즐겁게 볼 수 있도록 마련해놓은 장치들이 좋았다.  "
20170819,10,인간의 이기심과 욕심은 세상을 병들게 한다..  
20170819,10,연기좋고~ 스토리 좋고~ 모든게 완벽  
20170819,10,시저 표정연기가 진짜 압권이었다 ㅋㅋ140분이라 조금 지루할법도 한데 참을만 햇음  
20170819,10,너무 재밌게 봤습니다.  
20170819,10,전편에 이어 이번에도 흡족 스러워요 ^ㅡ^  
20170819,10,3부작 마무리 잘된것같습니다..이제 시저를 볼수없어 아쉽지만.. 위대한시저..ㅠㅠ  
20170819,10,존잼 ㅋㅋ간만에 시간가는줄 모르고 봤다 ㅋㅋ  
20170819,10,진짜 너무너무너무 명작이에요...  
20170819,9,시저의 아들 이름이 코넬리우스라는 것에서 깜짝 놀랬음..  허허.. 코넬리우스라니... 코넬리우스는 미래에서 과거로  와서 아내 지라와의 사이에서 낳은 시저의 아빠가 아닌가...하하하하...  돌고 도는 역사인가 아니면... 다른 코넬리우스? 재밌네.  
20170819,10,"1,2편을 안보고 봤는데도 시리즈의 한편으로 훌륭하게 느껴지더군요  "
20170819,10,캐릭터 묘사가 기술적으로도 스토리 안에서 감정적인 면에서도 매우 훌륭했다!  
20170819,10,기대하면 항상 실망했었는데 처음으로 기대한 보람이 있었네요.  
20170819,10,시리즈의 마무리를 정말 멋지게 끝냈다  
20170819,10,평식이 7=다크나이트  
20170819,10,마지막 편도 잼잇게 봣습니다 ㅠㅠ안녕 시저...ㅠㅠ  
20170819,10,인간들의 덩게르크 탈출이야기가 최악이었다면 유인원의 탈출이야기는 최고였다.  
20170819,10,시저의 고뇌와 희생이 강하게 느껴진 연기와 연출에 감동 받고 왔어요ㅠㅠ  
20170819,1,최악의 3편.. 실컷 졸다가 나옴. 그 다음날까지 후유증이 있는 2017년 최악의 영화  
20170819,10,뻔하지 않아서 더 고개가 끄덕여지는?  
20170819,6,영어공부해야겠단 생각뿐.. 원숭이보단 잘해야지  
20170819,10,모든 것이 완벽했던 영화  
20170819,6,기대보다 지루했어요..  
20170819,1,그 망할 눈사태만 아녔어도 뻐~킹~ 네츄럴!  
20170819,10,관람객이제더이상 시리즈는 없는건가 최고다  
20170819,6,딱 6점짜리 영화인듯 ㅡ 혹성탈출 시리즈중 최악  ㅡ 내돈 돌려줘잉  
20170819,2,"굳이 3편까지 만들 필요는 없는 듯... 다만  패딩 원숭이의 구여움  땜시 간혹 웃고, 택시운전사의 엄태구처럼 당나귀의  한방이 멋지네요  "
20170819,9,에이프 좀 웃기고 나머진 좀 슬펐다.. 후반에 시저 ㅜ  
20170819,2,지루함. 왜 봤을까? 아까비 내돈  
20170819,10,"솔직한 후기 남기면 재미 순서로는 2,1,3인거 같습니다.그래도 재밌음.  "
20170819,8,관람객전편보다는좀덜재미있었지만~~그래두괜찮았음~~^^  
20170819,9,옆에 아저씨 나이처먹고 왜그렇게 중간중간 스마트폰 최대밝기로하고 보는지 눈뽕때문에 집중이안됬어요 하품 그렇게 소리내서 쩍쩍 하는건 어디서배워처먹은 버릇인가요 기본이안되어있는 아재를 영화관에 데리고오면 어떻게함 그냥 찜질방이나 보내세요제발  
20170819,10,이 영화에 별점 비상식적으로 낮게 준 얘들 특징: 군함도 청녕경찰은 10점 ^^ 알바들 열일하느라 고생이 많다  
20170819,6,그냥 그래요...   전편 마무리하는  내용  
20170819,7,관람객원숭이판 군함도..?  
20170819,10,관람객너무 잘봤습니다 대박ㅋㅋ  
20170819,10,마무리까지 성공ㅠㅠㅠㅠ  
20170819,10,블록버스터 3부작들 중 가장 훌륭하네요!  
20170819,10,유인원 시저의 일대기의 완벽한 완결  
20170819,10,"킹콩, 콩, 혹성탈출 123 다 봤는데이제 뭘 보지... 나 빨리 유인원 시리즈 또 보고싶다  "
20170819,7,"시리즈를 마치는 영화로는 충분한영화 인것같았어요 1.2편같은 액션원하시는분들 한테는 약간 아쉬울수있고, 영화 볼때 지루할수도 있을것 같네요 전 괜찮게 봤어요!  "
20170819,10,"볼만하네요, 전작들이랑 이어져서 더 좋아요  "
20170819,10,마지막 장면들은 최고였음 명성이 아깝지 않은 영화  
20170819,6,의미는 있을지모르겠으나 졸리고 지루했슴  
20170819,10,인간과 유인원의 입장을 바꿔봐도 공감이 되는 스토리 좋은 결말입니다  
20170819,10,올해 본 영화 중 BEST!!  
20170819,10,촬영도 잘했고 CGㅇ처리도 완벽한듯  
20170819,10,시저ㅠㅠ아쉽지만 보내야겟죠ㅠㅠ  
20170819,7,관람객그냥저냥 돈은 아깝지 않은영화  
20170819,10,마지막까지 눈을 뗄 수 없을 정도 ㅎㅎ  
20170819,8,관람객트럼프 시대에 어울리지 않을 정도의 우직한 드라마…  
20170819,10,인간은 항상 같은 실수를 반복한다  
20170819,10,재밌게 잘봤어요 ㅎ 영상미가 좋아서 일반관에서 봐도 괜찮네요  
20170819,10,혹성탈출 처음보는건데 진짜 재밌네요~!! 친구가 왜케 보자고 헀는지 알거같아요 ㅎㅎ  
20170819,10,몰입하면서 정말 재밌게 봤어요  
20170819,10,실제 유인원이 연기한거 아님? 쩔어 진짜 ㅋㅋ  
20170819,10,CG가 대박인 영화  10점 만점에 10점  
20170819,10,완벽한 리부트가 탄생했다 ㅎ  
20170819,4,"관람객잔잔하면서 자연과 사람, 인간의 이기심에대해 생각하게 되었너요  "
20170819,10,재미와 감동 모두 주는 영화  
20170819,10,유인원과 인간이 서로 대적해서 하는 엄청난 액션신을 기댜했던 사람들이 지루하다고 하는 거 같은데.. 난 애초에 이게 더 현실적인거같다..난 개인적으로 너무 너무 재밌었음  
20170819,10,"관람객인간 스스로 자만에 대한 반성의 시간을 가질 수 있는 휴머니즘 영화. . 인간에 대한 새로운 관점으로, 인간이 아닌 시저를 통해 배울수 있는 리더쉽과 삶의 가치에 대해 고민해볼 수 있는  소중한 시간이였습니다.  "
