0,1,2
20170816,9,유인원이 주연인 영화를 봤지만 대단히  휴먼드라마를  본거같음.  시저 멋진 리더! 그도 가족을잃는 슬픔앞에선 흔들렸으나 진정한 리더임을 보여줌. 시져는  모세????  
20170816,8,종의전쟁이라는 부제때문에 엄청난 스케일을 기대했는데 그게 아닌게 좀 에러였지만 여전한 시저의 카리스마있는 케릭터 트릴로지를 마무리하는 좋은 엔딩까지 뭐 꽤나 만족. 그리고 꼬마인간아이는 참 귀여웠다.  
20170816,10,시저의 존재감이 엄청나는구나..ㅠ기억에 오래남을 듯 싶다  
20170816,10,"네티즌 평점 왤케 낮음?  재밌어요 1,2편과 함께 꼭 보시길  "
20170816,10,전체적으로 꽤나 잘만든 영화네요  
20170816,10,시리즈의 완성. 화려한 액션과 볼거리는 없지만 이영화의 시리즈를 보신분이라면 충분히 밀도있고 잘만들어진 엔딩이라고 느껴질만한 구성과 스토리였습니다.^^  
20170816,10,관람객CG도 훌륭하고 감동적이네요  
20170816,10,시사회도 봣던영화 이런영화는 무조건 스크린 사수지! 기대 안했는데 재밌었다 오프닝 10분만에 압도당함ㅋㅋㅋ 꼭 보세요  
20170816,9,냉정하게 이게 7점대 영화는 아니지않음??  탄탄한 스토리에 내용이나 전개도 엄청 잘만들어서 시리즈 굉장히 잘 마무리한거같은데 1점주는사람들은 알바인거임? 영화볼줄모르는거임? 한번 직접 보세요. 후회할영화 아닙니다  
20170816,6,"1,2편의 탄탄한 내용과는 비교할 수없네요!! 실망스럽습니다.  "
20170816,10,현실적이라서 아무말없이 모두 겸손한 마음으로 보게된 듯 한 영화그 사이에 잔잔한 웃음을 줘서 정말 재밌었다  
20170816,8,관람객잘만든 영화같네요. 잘 봤습니다.  
20170816,10,"시리즈 1,2는 극장에서 못보고 3만 극장에서 봣는데 진짜 재밌음. 꼭 극장에서 보길 추천함. 소리에 압도됨.  "
20170816,10,관람객존잼ㅠㅠ 에입스 투게더 스트롱!!  
20170816,8,반격의 서막이 재밌어서 기대했더니재미보다는 스토리가 더 뛰어나고스토리도 좀 지루... 그래도 좋은 영화였음  
20170816,9,증오에 차있는 시저의 눈빛이 인상적이였다... 넘재밌다..  
20170816,10,솔직히 기대는 안했는데 진짜 꿀잼이었네요!!보다보니 저절로 시저 편을 들게되고 응원하게 된답니다.안 보신 분들 추천합니당  
20170816,8,인류에게는 경각심을 주는 듯 재미있게 보았습니다  
20170816,10,1편에서 주인공이 아버지의 알츠하이머 병을 고칠려고 개발한 바이러스가 인간을 죽음에 이르게 하고 변종까지 되서 인간에게 알츠하이머를 발OO켜서 지능을 퇴화시키는군요. 인간 입장에선 두려울만 하네요. 지능을 완전히 잃고 가족들도 못알아보는 상태가 된다면  
20170816,8,기대만큼덜재밌네 혹성도안 나오고ㅋ  
20170816,6,"액션을 기대하지 말고, 드라마라고 생각하고 보시면 될듯. 왠지 x맨 영웅의 몰락의 애절함과  희망을 보여준 로건을 따라하고 싶었던 듯한. 어쨋든 원숭이와 오랑우탄의 어~우~아~ 어~ 한 끝없는 대화는 실망 포인트!! 모든걸 대화로만 설명하려 하였다는.  "
20170816,5,하아..감독이 바뀐줄 알았네요ㅠㅠ그래도 시저때문에 5점 줍니다..  
20170816,10,정말 감동적이었고 눈물이 났네요 ㅠ.ㅠ2017 최고의 영화라고 생각이 듭니다!  
20170816,10,매력적인영화! 마지막까지 만족스럽다  
20170816,7,"약간은 긴 상영시간이 충분히 가치있는 영화. 시저,영웅의 찬란한 서사시.  "
20170816,8,"지루하다는 리뷰도 일부 공감되긴하지만, 시저와 동료 유인원들의 엄청난 표정연기가 선사하는 풍부한 감정들이 그 어떤 영화보다 가슴을 뜨겁게 함을 부정할수없다. 시저가 전편과 달리 리더로서의 단호함보다 감정적인모습을 보이는게 인간보다 더욱 인간적임ㅠ  "
20170816,7,기대했는데 많이 졸렸어요!  
20170816,4,"두 아들과 같이 보러 갔다 왔는데, 영화보다 졸린건 처음입니다.  옆자리 아저씨는 영화 시작 30분 후부터 계속 코 골며 주무시다가 마지막 전투신에서 잠깐 깨시고는 바로 영화가 끝나니 얼른 가시더라구요..큰 기대는 하지 않았지만 이건 좀 심하더군요..  "
20170816,10,진리에 다가서는  발걸음. 대단하다.그러나 슬프다. 시저 보고싶다  
20170816,2,진짜 너무 지루...2편이 너무 재밌어서 개봉하자마자 봤는데...정말 너무 실망했어요  
20170816,10,진짜 흥미진진하게 봤네요 ㅎㅎㅎ  
20170816,6,왜 그랬는지 알겠지만 지루한 건 어쩔 수 없다  
20170816,8,마지막이라니 아쉽네여 ㅜㅜ  
20170816,10,혹성시리즈 역대급이다 ㅠㅠ  
20170816,4,기대 많이하고 손꼽아 기다렸다가 어제 개봉하자마다 보러갔다 왔는데요... 솔직히 그 전 편이 훨씬 재밌었네요.. 스토리가 너무 부성애 중심인 것 같고 확 끌어당기는 재미는 없었습니다.  
20170816,1,관람객시작은 좋았건만...  
20170816,4,잠왔어요 ㅠㅠ...2편이더재밌는듯  
20170816,8,관람객생각보다 철학적인 의미를 내포하는 영화!!  
20170816,2,BGM도 이상하고 너무 지루합니다...전투씬도 별로 없고ㅠㅠ  
20170816,10,이제 혹탈 끝인가요..?재밌게봤는데..슬픔  
20170816,10,이런게 명작이지... 후회없는 선택  
20170816,7,ㅋㅋ 원숭이들이 다 탈출하는데 아무도 모름 겉으로 보기엔 철저 한데ㅋㅋ 근데 이영화는 메세지 전달하는건 좋은데 전개가 빠름 주의하삼  
20170816,10,수준에 따라 지루하냐 안하냐에 달린거 같습니다물론 엄청난 전쟁신을 기대하면 지루할수도 있지만 무작정 싸우는거보단 이영화에서 주고자하는 교훈을 생각한다면 진짜 걸작입니다...반성도 하고 많은 생각을 하게되는 영화에요  
20170816,10,너무재미있게 잘봤어요 아이들도 좋아하고요 ^^  
20170816,1,....음.. 이영화는..'  
20170816,6,초반엔 흥미롭다가 점점 힘을 잃는 ...  
20170816,5,관람객스토리를 너무 질질끄시네요  
20170816,10,올해 본 영화중 최고였어요. 시저의 눈빛연기가 넘좋았고 많은 생각을 하게되는 영화였어요. 유인원이 이렇게 멋있게 느껴질수도있다니 영화의 힘은 진짜 크네요  
20170816,8,1편 2편보다는 재미 별로임  
20170816,6,"시저는 인상적이지만, 내용은 정말 지루했습니다.  "
20170816,7,좀 지루했다좀 지루했다  
20170816,4,감동은 없다....뭐하자는건지  
20170816,5,관람객종의 전쟁이라고 부제 띄워놨으면 인간 대 유인원 구도를 잡아야지 이건 뭐...혹성탈출만이 가진 특유의 대립구도가 사라지고 유인원을 노예로 전락시켜려서 그냥 루즈했음. 유인원이 아니라 같은 사람이 노예가 됬어도 전혀 이상하지 않았을듯  
20170816,1,보다가 하품만 하고 잘뻔했다. 딱 그정도 영화.  
20170816,7,재미와 액션을 바라고 보면 안되는 영화. 부제가 종의 전쟁이지만 대규모적인 종의 전쟁은 나지 않는다. 2편 마지막의 시저의 리더로서 확고한 모습이 보이지 않아 아쉽다. 다만 좋았던 점은 인간들의 행동 유인원들의 행동을 보며 여러생각이 든다.기대가넘컸다  
20170816,10,짱잼 꿀잼 잼잼잼쟘잼잼  
20170816,6,재미있는 기대감이었는데  좀 지루한 감 있음  
20170816,6,기대가 크면 실망도 크다고 2편까지는 너무 재밌게 봐서 명작의 아성을 이어가겠구나 했는데 CG는 전편들과 마찬가지로 정말 흠잡을데 없을정도로 최고지만 스토리가 너무 별로다 막말로 너무 구림. 보다가 졸뻔했다 진심 아...너무 실망임ㅜㅜ  
20170816,8,혹성탈출 3편중에서 제일 재미있었어요  
20170816,6,초반 까진 좋았는데 뒤로 갈수록 개연성이 떨어짐..이 리부트 시리즈를 좋아했던 만큼 실망도 큼.  
20170816,10,ㅽ 나만 당할순 없지... 유인원이 무슨 람보냐????!!!  
20170816,10,시저야 수고했다..!!!  
20170816,2,기대이하. 혹성탈출시저시저  
20170816,2,노잼 이보다 더 재미없을수는 없다  
20170816,6,전작을 생각하게 만드는 이름놀이보다 스토리의 개연성에 좀 더 신경썼어야 했다.. 죄다 눈뜬 장님들만 나왔음  
20170816,10,혹성탈출 시리지는 다 재밌게 봤는데 이번에도 시간가는줄 모르고봤어용!!  
20170816,7,"무슨 라이언일병급으로 기대한건 아닌데, 종의 전쟁이라 해놓고 어떻게 전쟁장면은 초반빼고 하나도 안나오냐... 뜬금포가 많고 지루하다. 제일 이해안되는 건, 마지막 눈사태씬은 왜 연출한거죠? 영어제목도 워 오브더플래닛이라 해놓고 전쟁은 하나도 없다.  "
20170816,10,일단 보고 판단하세요 .... 재미있어요  
20170816,1,"춥다. 영화관도 춥고, 내용도 썰렁하고.  "
20170816,9,역사에 길이남을 트릴로지의 위대한 마무리  
20170816,5,지루한  신파  2편보다  훨씬 못하네요  
20170816,1,비싸게 상암 IMAX에서 봤는데...보다 잠. ㅠㅠ 정말임.. ㅠㅠ  
20170816,10,"보고 왔는데 재밌어요,꼭 보세요  "
20170816,10,재미없다는사람들 제대로 보고 쓰는건지...??저는 전편도 넘 재밌게 본지라 이번 시리즈 엄청 기대했었는데 기대이상으로 시간가는줄 모르고 너무 재미있게 봤어요~~ 마무리도 깔끔하고 스토리 전개도 굿!!!  
20170816,10,서로 총질하고 싸우는 장면이없어서 루즈했다?? ㅋ  
20170816,6,"생각보다 별로네요. 원숭이다큐멘터리 + 모세 출애굽 + 십자가 골고다 + 데우스엑스마키나의 남발. 공짜예매로 봤는데 팝콘값이 아깝네요. 처음 30분정도 재밌고 나중엔 억지에 지루해요. 1,2편이 재밌어서 기대를 너무 많이 한 것 같네요.  "
20170816,4,걍 오락영화입니당~ㅋㅋ  
20170816,6,중반부에 지루해서 살짝 졸았다  
20170816,10,"믿고보는 혹성탈출 ~1,2편 봤으면 3편도 꼭 봐야해요  "
20170816,10,씨저 그자체로 최고인 영화  
20170816,8,중간에 노바가 혼자 부대들어가서 걸리지않고 돌아다닐 수 있는 이유가 분명히 있었을텐데. 설명이 너무 없었음..  
20170816,5,군함도 생각이 많이 났다  
20170816,10,1.2를 너무 재미있게 봐서 8시 55분 조조로 봤어요~ 물론 저처럼 혼자오신분들 많더군요~ ㅎㅎㅎ 저는 집중도 잘되었고 많이 얻고 왔습니다~  
20170816,10,솔직히 최근 나온 영화 다봤는데 이게 제일 재미있는데 박평식이 7점 준 거는 다 이유가 있음 꿀잼 꼭 보셈  
20170816,10,관람객정말 요즘 영화중에서 가장 볼만한것같습니다ㅜㅜㅜ  
20170816,4,전편에 비해 너무 지루해서 재미가 없네요  
20170816,1,"길고 지루한 2시간, 자고 보든지 보면서 자든지 둘 중 하나는 선택해야  "
20170816,10,"알바 아님. 개봉일 조조로 보길 정말 잘 했다고 생각든 영화. 전쟁씬보다, 앤디 서키스의 감탄할만한 연기를 통해 시저의 감정과 고뇌를볼 수 있어 더 좋았고. 인류의 미래가 절대 이렇게 되지 않으리라고 장담할 수가 없다. 지금의 인간들을 보면...  "
20170816,8,기대가 너무 컷나보네요. 그래도 재밌습니다.오리지널 시리즈도 리메이크 되었으면 좋겠네요  
20170816,10,"메시지가 굉장히 좋은 영화네요, 욕심이 과하면 화를 부릅니다  "
20170816,10,진짜 미친듯이 재밌었음 내일 또 보러 갈거임  
20170816,8,종의전쟁이라길래 유인원 vs 최후의 인류들을 원했다만...그래도 재밌었어  
20170816,1,솔직히 이거 잼잇다는 사람들 머냐 택시운전사나 함더봐라  
20170816,9,관람객지루할틈없이 재밌게봤습니다!  
20170816,8,3부작의 완벽한 마무리.시저의 일대기를 모두 본 것만으로 좋았다.  
20170816,10,관람객 평점이 더 진실에 가까움. 8~10점 비율이 관람객이 네티즌보다 높고 1점 비율은 네티즌의 3분위 1.  
20170816,6,기대보다 미흡...시저가 갇히는 부분부터는 지루함.  
20170816,10,노바 너무 귀엽다...  
20170816,10,넘재밌게 봤어요 꼭보세용!!  
20170816,10,제임스 프랭코가 나오지 않아 아쉬울 뿐이다...  
20170816,5,관람객유인원은 뭉치면 강하다처음부터 중간까지는 볼 만 한데결말은 허무....  
20170816,10,관람객내 인생 최고의 영화 n차 관람 찍는다  
20170816,10,"훌륭한 영화, 멋진 피날레!  "
20170816,10,심장이두근두근하게 잘봤어여.. 졸렸는데 눈부릅뜨고봤네요  
20170816,10,지루하다고 해서 걱정했는데 하나도 안지루했고 애나벨보다 훨씬재밌어서 좋았어요  
20170816,10,역시 기대를 저버리지 않았어~~  이번 시리즈도 잼나요!  
20170816,1,진짜 개 재미없다...저번에 나왔던거랑 똑같이 말안하고 ...뭐 동물원 쇼보는 줄... 예고편이 훨씬 재밌는 듯....진짜 진짜 비추..  
20170816,10,관람객와씨 대미친 이런 역대급 명작을 극장에서 볼수 있다는 것에 감사하고 감사하면서 봤움  
20170816,10,관람객시리즈전편다보구너무재밌어서이번에개봉하자마자봤어요~너무기대를했는지전편에비해아주조금심심했지만역쉬시저는멋져멋져~~^^  
20170816,1,숙면 취하기 좋은 내용에 영화관의 적절한 온도조절로 숙면취하기 좋은 시간 가지고왔습니다 별 1개는 꿀잠 잘 자고와서 줌  
20170816,7,"전편 전부 극장에서 본 관람색으로써 한마디 하자면?..대작 라인업인 영화임에 비해서 심심하고 별로였음..어린 여자애 이목구비는 대박..원숭이 털,표정 연기 대박..마지막 전투,스토리 허무~  "
20170816,2,내용이 너무 단순하고 따분하다 1시간째 겨우보다 졸려서 나옴 평가보고 영화표 끊었다가 개실망함 절대비추임  
20170816,8,관람객너무 기대했나 봅디다..  
20170816,10,속편은 전편보다 별로라는 공식은 더이상 없다! 굿!!  
20170816,9,관람객감정선을 잘 살렸어요 근데 지루하게 보시는분들도 있을듯ㅋㅋ전 그냥 마지막이라 생각하니 좋게보여지더라구요  
20170816,10,평점 알바가 존재하긴하나보네.0점 준 애들 하나같이 보다 졸았다는둥 잼없어서 도중에 나와다는둥 쓰는데 이 영화가 보다가 뛰쳐나올 정도면 대체 볼만한 영화는 무엇이며 2시간 보는 것조차 참지못하고 표를 버릴 정도로 인내심이 없으면 사회생활이 가능하긴해?  
20170816,10,시저를 보고 진정한 리더를 배웠다..  
20170816,9,예술영화의 경지로 승화된 여름 블롤버스터! 3부작 퀄러티가 다 이렇게 고른 영화는 정말 드물다... 꼭 보세요  
20170816,10,10을 받아마땅하다...  
20170816,10,네티즌에 평점을 보고 흔들려서 보지 말지 말고평론가의 평점과 관란객의 평점을 봐라진짜 좋은 영화다  
20170816,10,시간 가는줄 모르고 봤습니다 ^^  
20170816,10,웅장함 기묘함 그 이상의 의미  
20170816,9,"1960년대 혹성탈출과 스토리연결 완벽! 노바 캐릭터도 연결되고, 시저는 정말 잊을 수 없는 캐릭터...인간과 유인원의 얘기가 아니고 다른 상황으로 빗대어서 시사하는 바가 매우 크다!!! 자비가 없다면 공생과 평화는 불가하고 결국 자멸이다.  "
20170816,10,이런게 바로 영화다!! 간만에 만족스러운 시간!!  
20170816,10,시리즈 영화 중 제일 의미있고 재미있는 영화!  
20170816,10,살기 위해 살리는... 살기 위해 죽이는... 다른 종들의 살기 위한 전쟁  
20170816,10,인간에게 또 한번 꺠우침을 주능 여화  
20170816,10,점수가 왜이래 ..잼나기만하더만..인간과 유인원이 뒤바꿔야해서 씁쓸하기하다..  
20170816,10,영상미도 좋고 감성적인 부분까지 너무 즐겁게 봤습니다^^  
20170816,10,인간은 욕심을 버려야한다.. ㅠㅠ  
20170816,10,유인원은 인간을 지배하지 않았다  
20170816,10,결말 굉장히 맘에 드렁여! 마지막이라서 너무 슬픔 ㅜㅜ  
20170816,10,진짜진짜 재밌어요ㅠㅠㅜ! 지금껏 봤던 4D중에 가장 재밌었어요 중간중간 감동적인 부분들 있어서 찔끔찔끔 계속 울었네ㅠ  
20170816,10,역시 믿고보는 시리즈! 이번편도 핵꿀잼  
20170816,10,헤일 시저!!! 시저ㅠㅠㅠ  
20170816,10,난 괜찮게 봤는데..ㅋ 어제 보고 집에와서 역주행 했어요 ㅋㅋ 다들 꼭 보세요~  
20170816,8,"혹성탈출 시리즈... 가상의 주인공, CG가 아닌 이웃집? 원숭이의 삶을 지켜본 것 같이 사실적이고 현실적이라 뭉클하다. 그동안 고생 많았다 시저.  "
20170816,10,역시 묵직한 힘이 있는 영화~~시저 카리스마 폭발!!  
20170816,10,역시 믿고보는 혹성 시리즈 !! 시저는 역시나 최고였고 감동임 ㅠㅠ  
20170816,10,ㅋㅋㅋ혹 ㅡ성탈출보는데 전남친 얼굴이..ㅋㅋ  
20170816,10,역대급으로 기대되네요 혹성탈출 무조건 봐야될 영화각 ~!!과연 마무리가 어떻게 될지 궁금해 미치겠네요!!  
20170816,10,시저의 감동의 에이프 서사시!  
20170816,1,"영화관이 너무 추웠고, 영화는 재미없고. 극한의 고통속에서 잘잤습니다^^  "
20170816,5,노잼임예전시리즈보다는 못함  
20170816,10,이 영화는 인물묘사에 최고봉이라 할수 있는 가장 잘 다듬어진 영화다. 지루할 틈이 없으며 섬세한 묘사장면 덕분에 개개인에 더 몰입될 수 있었다. 빨리빨리 이야기 전개하여 묘사빈약한 한국영화는 이 영화를 보고 반성해야한다.  
20170816,7,"1, 2 와 다르게 좀 뭔가 빡! 하고 오는 임팩트가 없었음.  "
20170816,7,기대가 커서라기보다는.. 확실히 스토리나 중간중간 전개 과정이 뭔가 아쉬운 부분이 많았네요..  
20170816,6,  ㅎㅎ 보다 나올뻔 했네요  
20170816,10,감동적이였어요 인간의 이기적인 마음을 잘 나타낸 영화입니다  
20170816,5,"혹성탈출 반격의 서막,  진화의 시작보다는 재미와 감동이 들 했습니다. 그리고 영화 중반부에 가서는 기존 혹성탈출과는  다른 탈출 스토리만 으로 이루어져서 아쉬어 졌다.  "
20170816,1,혹성탈출 노잼;;;ㅠㅠ  
20170816,8,혹성탈출 트리올로지의 깔끔한 마무리 맷 리브스의 배트맨 트리올로지도 정말 기대된다 !  
20170816,8,반지의제왕과 더불어 최고의시리즈  
20170816,10,인간의 멸망이라는 소재를 이렇게 희망차게 담을 순 없을 거에요. 제 인생 최고의 3부작입니다. 뭐 4편도 나온다고 하지만  
20170816,10,굿..하댜냐재댜여더너녀  
20170816,1,내가 알던 혹성탈출이 아니었음.. 많이 당황 했다. 인생 처음으로 영화관에서 꾸벅 졸았음... 역린 보면서도 안졸았는데.. 동물의 왕국 한편 거하게 돈주고 시간주고 .. 나오니까 비는 또 무지하게 오고.. 우울해..  
20170816,8,관람객좀 루즈한 감이 있는데 퀄리티가 짱입니다.... 마지막 시리즈인만큼 볼만한 가치가 충분한 것 같아요!!  
20170816,6,로튼토마토가 실망인건 이번이 처음이다!  역시 버터가 다른가봐  
20170816,6,이번 건 별로네요. 장면 하나하나가 감동먹으라고 억지부리는 것 같아서 보기 불편했습니다. So Emtional!  
20170816,1,"지루하고..재미없었다..중간에 나갈뻔했다...결말도 시원하지 않고 아이맥스로 봤는데 돈이아까웠다.,.큰 감동과 교훈을 못느꼈음... 영화가 원래 이렇게 길었던가 느꼈던 영화다...  "
20170816,7,어제보고왓어요  그저그래요 재밋지두 재미없지두 돈주고보긴아깝지만 지금까지 시리즈봐왓으니까 걍본건데 그저그래요 차라리 애나벨이 더재밋게봣다는ㅡㅡ  
20170816,10,관람객시저 죽는데 눈물이 주르륵 엄지 착 감동물결 줄줄  
20170816,10,혹성탈출 시리즈는 다 재밌는 데 이게 가장 재밌는 것 같네요.  
20170816,3,요즘 외국영화들 왜이렇게 재미없어졌나요?옛날 우리나라 영화처럼 감동 눈물 질질로건보고 노잼 그랬는데로건 원더우먼 트렌스포머5 혹성탈출보니로건은 재밌구나라는 생각이드네요  
20170816,10,관람객너무너무 재밌었습니다.잘봤습니다.  
20170816,1,관람객1편이 처음이자 마지막인듯..2편3편 갈수록...산으로가네...  
20170816,10,관람객진지한 흐름 가운데 배드 에이프 캐릭터가 웃음을 계속 줘서 귀여웠다ㅋㅋ 전 시리즈를 안봤는데도 시저에게 몰입되고 진정한 리더상을 보여준 것 같다. 인간보다 더 인간 같은 시저... 한동안 시저뽕에 취해있을 듯..  
20170816,10,관람객혹성 시리즈 중 단연 최고!  
20170816,10,관람객시리즈의 마지막을 장식  
20170816,3,자세한설명을 듣기에는 사건 자체가 길지않다... 러닝타임.. 스토리.. 감정선.. 모든것에서 실패  
20170816,10,관람객진정한 리더 ㅎ 배드 에이프가 아닌  굳 에이프!  자연의 승리였다.  
20170816,10,관람객기존 시리즈부터 쭉 보고 있습니다~ 요번게 젤 재밌는듯! 추천함  
20170816,9,잼있더라 어제 보고왓는데 시져 안녕 ㅠ  
20170816,4,"지루합니다.. 혹성탈출 시리즈 매니아 이신분들은 잘 모르겠으나, 그냥 종의 전쟁이라고 해서 화끈한 이종 간의 전쟁을 기대했던 저로서는.. 재미없었습니다. 6점 정도 주려했으나, 평균보정을 위해서 4점 줍니다  "
20170816,6,"관람객그래픽은 볼만했는데 너무 우연, 억지 전개가 많았음  "
20170816,10,시리즈를 안보고 같이 본 친구가 1보러 가자고 하네요  
20170816,1,영화를보다가 영화관을 탈줄 했습니다.  탈출시키는 영화 추천합니다!!  
20170816,6,처음엔 재밌었는데 끝으로 갈수록 지루했어요. 2시간 20분을  2시간 정도로 줄였어야 했어요.  
20170816,10,관객들은 진지하고 조용하고 그속에서 스크린은 유인원으로 빛났다  
20170816,10,완전 감동적이었고 자연의 승리  
20170816,1,소문난 잔치에 먹을 것 없다 정말 지루했다 이 영화에 10점 주는 사람들 무슨 생각들을 하는지 영화 알바가 아닐까 하는 생각 ..그 많은 돈을 투입해서 만든 영화라고는 도저히 믿기지 않은 실화아 정말 아쉽다 ...  
20170816,10,관람객3부작 끝이 이렇게 났네요ㅠ_ㅠ. 스케일에 완전 무릎꿇었음  
20170816,3,휴... 이 영화는 그냥  유인원의 감정을 현대 영화기술로 얼마나 잘 나타낼 수 있느냐를 보여주기 위한 의도로 만들어진 것 같다. 유인원 얼굴 표정좀 잘 감상하라고 일부러 인간들 연기를 좀 허접하게 하라고 감독이 지시한거 같기도 하고....  
20170816,10,APES NEED WATER AND FOOD WATER FIRST  
20170816,7,"시저의 리더쉽에 다시 한 번 박수를,,,근데 지루하긴 합니다  "
20170816,10,관람객혹성탈출 종의전쟁은 역대급 내 인생영화!!! 앤디 서키스에게 꼭 아카데미상을 줘야한다! 액션 부터 드라마까지 뭐하나 손색없는 영화!  
20170816,4,재미없음. 유인원 버전의 감옥 탈출 영화.  
20170816,10,택시운전사도 재밌는데 느낌이 택시운전사 알바들이 테라하는것 같네요  
20170816,10,2시간 내내 너무 긴장됨. 꼭 아이맥스로 보시길 추천드립니다. 2010년 이후로 개인적으로 최고의 영화.  
20170816,1,"기대했던 것 만큼 전쟁, 액션 같은 것은 없었다  "
20170816,1,극장 가느라구 쓴 내 돈과 시간이 아깝다...  
20170816,10,재밌는 영화에 평점 테러하는 애들 딱 한 부류지  
20170816,10,"초반엔 지루한 감이 있었지만, 몰입도는 계속이어졌다. 맘같아서는 8점대주고싶은데 평점테러가 너무 심한것같아서 10점줍니다.  "
20170816,6,재미없진 않은데 따분하다ㅋ참고로 박평식 8점준 영화 로스트 인 더스트 꼭봐라  
20170816,10,"1.2편에 비해선 다소 아쉬운부분이있지만, 시저라는 유인원의 감정과 고뇌,결단력에 대해선 동경한다.  "
20170816,10,역시 시저네요 혹탈최고  
20170816,10,관람객시저의 연기가 정말 인상적이었다ㅠㅠㅠ최고의 영화인듯..노바랑 배드 에이프도 넘 귀여워ㅠㅠㅠㅠ최고입니당!!!  
20170816,10,시저의 내면적 갈등을 다룬 영화. 프리퀄 3편중에서 난 최고라고 평가하고 싶다.  
20170816,9,지루한 감이 없지 않아 있었으나 재밌음  
20170816,4,전편영화생각하고보면 많이 지루함~~~ 내용있는 영화~  
20170816,8,올 여름 최고의 영화~~  
20170816,10,박평식이 7점 줬다. 이건 꼭 봐야한다  
20170816,10,관람객이 근래 본 외화중 가장 완성도 높은 흠잡을데없는 영화//  극장에서 봐야할 영화는 바로 이런거임  
