0,1,2
20190127,1,"뭔 제목이 이따위야..수입사 혹은 제작사는 알아야한다포스터,제목,홍보문구도 중요하단걸..옛날처럼 이런 엽기적인 제목 더 이상 안먹혀  "
20190124,10,감동도 있지만 결말이 좀 ..  
20190122,10,기억은안나지만 잼게본거같아서 함더봐야지  
20190120,10,메신저 전송 잘못 눌렀을때 인생 케공감 ㅋㅋㅋ  
20190119,10,재맜네요. 여주 연기 잘하고  
20190119,10,제목이랑 다르게 좋은 영화  
20190119,10,잼나요. 정말 재밌어요~ㅋㅋㅋ  
20190119,1,여성혐오적인 제목이네요.  
20190119,10,"진짜최고임,,이영화를 봐서너무다행일정도!!  "
20190119,10,보는 내내 유쾌했던 영화ㅋㅋ  
20190119,2,10대들 개혐오 제목 잘 지었음  
20190119,1,OO발광 문재인 문재인 OO발광  
20190117,10,세상에 저런 선생님이 있다면! 사춘기를 바라보는 어른의 자세에 대해 생각해보게 했다  
20190116,10,여주 잠바뭐냐? cj택배임?  
20190115,9,네이딘의 모습에서 내 모습이 보였다. 그래도 네이딘 정도면 성공한 인생인듯.  
20190115,10,좋았음. 이걸로 영어공부하면 좋을 듯  
20190115,6,로코 좋아하는 사람들은 킬링 타임으로 아주 가볍게 볼만함. 그냥 사춘기를 바탕으로 한 청소년물 같은 느낌? (김어원은 괜츈함)  
20190115,10,세상 최애 릐얼 갬동 인생영화  
20190115,1,제목이 막나가네....  
20190115,10,한글 제목이 맘에 안들었는데 정말 OO발광하는 17살짜리 여자애를 보았다..ㅋㅋ  
20190115,10,"성인이 된 지금은 사춘기의 성장통이 아무 것도 아닌 것 같아 보이지만 그 때는 그게 전부였다. 친구, 가족, 사랑, 인생. 더 나이가 들면 지금의 고민도 아무 것도 아닌 것 같겠지. 그 때의 고민도 지금의 고민과 사춘기의 고민과 본질은 같을 것인데도.  "
20190115,6,저 정도면 정신 장애 아님? 어리니까 사춘기지 성인이면 정신과 가야함  
20190110,10,하이틴영화중 질풍노도의 그 시기를 잘 담아내서 무엇보다도  공감이 많이 가는 영화 중 하나.  네이딘이 아주 매력적임. 그녀는 착한심성이잇고 그렇다보니 본인을 미워햇던건 아닐까 싶다. 우린 누구나 네이딘이진 않앗을까?  퀸카로살아남는법처럼 재밋게 봄!  
20190108,8,열입곱이 훨씬 지나고도 여전히 모난 내 모서리를 다시 한번 뒤돌아보게됨. 서른일곱전엔 부디 네이딘처럼 극복할 수 있길...!!  
20190108,7,대사가 참 신선했다. 17년의 OO발광이 하루아침에 싹 해결되는게 너무 영화같았지만..ㅋㅋ  시간안에 마쳐야 되니 어쩔수 없었겠지..ㅋㅋ  
20190108,7,"재미있다. 제목이 구린 줄 알았는데 The Edge of Seventeen 그대로 번역해서 썼다면 밋밋했을 듯. 마지막 거의 끝장면ㄷ이 인상적이고, 우디 해러슨은 좋은 선생님이다. 그리고 지금 내가 네이딘 같아서 공감이 많이 되었음. 나도 변할래.  "
20190108,8,감정이든 뭐든 서툴 수 밖에없다  
20190108,10,어린 시절의 나를 보는 거 같아서 그 혼란스러움과 분노가 너무 공감됐다. 근데 한국어 제목은 진짜 아쉽다. 영화를 보고 지은 제목인지 의심스러울 정도니깐....  
20190108,9,네이딘 너무 연기 잘한다 .. 스토리도 공감되면서 따뜻하고  배우들이 모두 캐릭터를 잘 살려서  재밌는영화!  
20190108,5,"17세 소녀의 폭풍같은 사춘기를 그린 영화. 헤일리 스테인필드와 우디 해럴슨을 비롯한 여러 배우들의 훌륭한 연기로 삐뚤어진 사춘기 소녀의 이모저모를 생생히 담았지만, 그 완성도만큼 호불호도 확연히 갈릴 듯하다. 종반부의 형편 좋은 격변도 다소 아쉽다.  "
20190108,10,정말 공감이 많이 간 영화였다. 웃긴 장면인데 난 왜 눈물이 나는지  
20190108,6,남주 개못생김. 짝사랑남도 치명적인척 하더니 별거없어서 시시했음 그냥 흔한 싸구려 허벌남. 주인공 성격 재밌어서 봤는데 결말 뭐임? 하룻밤만에 급 착해져서 어리둥절 결말이 좀 아쉽다 너무 급전개.. 주인공때문에 끝까지 봄 ㅎ  
20190108,10,힘들때 여주한테 해보라던 엄마의 말이 와 닿는다다들 비참하고 공허하다나보다 연기를 더 잘할뿐이다  
20190108,7,"지나친 의역이 영화를 망친 사례~대미를 장식하는 어윈 킴의 애니가 정말 웃김,여주인공 헤일리 스테인필드 매력 포텐 터짐.스파이더맨 뉴 유니버스의 그웬이기도 하고 범블비의 애정녀 찰리이기도 하고...헤일리 올해에 대운이 왔나보다.오래 보고 싶은 여배우다  "
20190108,2,사춘기라고 다 저러지않음ㅇㅇ 그냥 쌉민폐여주 그리고 자기가 그렇게 문자 보내놓고 닉이 그러니까 ㅈㄴ 나쁜놈만드네 ㅉ  
20190108,10,OO발광 17세를 겪은 1인으로서공감하고 웃고 울면서 봤네요.인생 하이틴영화가 될것같아요.  
20190108,10,오늘 채널CGV에서 중간부터 봤는데 제가 본 영화중 가장 가슴에 와닿는 영화였던거 같아요. 저도 올해 16살이 되는 중학생인데 주인공을 보고 마치 저와 같은 생각을 가진 사람같아서 너무 감명깊었습니다. 그래서 최고의 영화였습니다.  
20190108,10,정말 잘만든다. 가슴이 울컥하는 밝지만 어두운  
20190108,10,중국계인데;;;;난 내인생영화였음  
20190108,1,사춘기영환줄알았는데걍정신병자같음..왜이랬 저랬닺ㄹ이야진짜OOOO이네제목한번잘지음ㅋㅋ 하진짜ㅂㅅ같은내용임ㅋㅋ뭐어쩌란거야?성격파탄자샊이를17세란변명에숨겨주고 ㅈㄹ이네 혼자 북치고장구치더니 남탓이나해 그리고 gpfu야여배우가아니라배역이지ㅈ찐따야구분도못함?  
20190108,2,정말 보는내내 짜증만 나는 영화 정말 찌질의 극치  
20190107,1,동양인을 한국인으로 설정했는데 전범기가 나온다?? 배급사가 SONY...ㅋ 이거 완전 멕일려고 만들었네 한국돈만 꿀꺽할려고  
20190107,5,ㅈㄴ 키도 크고 이쁘고 매력있는데 옷을 아무리 거지같이 입혀도 간지남....아싸로 포장해도 인싸 느낌 물씬 ㅋㅋㅋㅋ힘들때마다 찾는 동양인 남사친은 ㅈㄹ 부자에 영화까지 만드는 능력자 결국 백인 OOO라도 동양남자는 부자에 능력자라야 얻을 수 있다는게  
20190106,5,여주 얼굴이 좀 아쉽지만 육덕진 허벅지에 미국애들 같지 않게 블랙팬티스타킹을 즐겨 신어서 볼 만 했던ㅋ  
20190102,10,다시 찾아보기용용죽게싲  
20181230,10,엄청난 힐링영화다.~~ 여주 사랑스럽다!!감동적인 장면은 대위기에서 네이딘이 사과하고 오빠가 안아주는 장면!! 역시 가족이다!!!  
20181229,10,괜찮기만 하구만 여주인공 많이뜰듯  
20181229,8,친구랑 오빠 졸ㄹ라싫어 근데 영화는 재밌음  
20181223,7,선생님이 행복해 보여서 마음이 놓임  
20181221,10,여주가 정말 매력있네.  
20181209,1,왜 내 평점이 삭제되었지?  
20181205,10,"한국 제목이 좀 이상하네요..다른 제목도 많았을텐데..여러가지 면에서 생각을 해 주게 하는 영화였네요..청소년 입장 부모 그리고 형제, 선생님의 입장까지도..  "
20181202,10,우디해럴슨은 삐뚤어져 보이지만 정말 마음써주는 어른 역할 참 잘 어울린다 ㅋㅋ 여주도 정말로 공감되게 연기도 참잘하고 오랜만에 맘에드는 성장영화였다  
20181129,10,너무 공감됌... 떨어진 자존감이 세상에서 내가가장 우울하고 불쌍하다 생각하게 만듬  
20181110,9,전형적이거나 요란하지 않아 더 좋았던 영화  
20181110,7,한글 제목을 왜... 이 모양으로 지었을까...  
20181102,7,따악 킬링타임용. 아무생각없이 보기좋다  
20181031,1,진짜 평점 처음 써본다 여주 성격 짜증나고 별로...  
20181026,8,나도 한글 제목 보고 제목에 희생당한 영화가 또 있네 싶었는데 솔직히 영화보고 '17세의 위기'라든가 하는 제목보다 더 찰떡이네 싶었음ㅋㅋㅋ 코미디프로 보고도 잘 안웃는데 이 영화 은근 웃김ㅋㅋ진짜 여자주인공 OO발광임!  
20181014,6,"인생은 방황과 변화의 연속, 그 때나 지금이나. 우디 해럴슨과의 씬이  짧아서 아쉬움  "
20181013,10,굿굿굿굿 간만에 너무 유치하지 않고 유쾌한 영화  
20181013,6,친구 재수없다 갑자기 밝아진것도 이해가 가질않는다  
20181010,8,17살에 섹스를 다룬 영화는 이제 괜찮나요? 미국만 그런가?넷플릭스로 봤는데키싱부스도 그렇고...  
20181006,4,보는내내 여배우 응석을 받아주느라 나까지 피곤해진 영화  
20181003,10,주인공이 너무 스스로 고난을 만드는 성격... 진짜 싫은 타입의 사람. 불만 투성이에 모든것에 자기 잘못은 없다는 식. 그 와중에 김어윈 너무 좋음ㅋㅋㅋ  
20181003,6,어윈 몸짱이라서 설렜던 사람?근데 어윈 발음이 중국인 같고처음에 티 어디서 샀냐고 물을 때 게이인 줄..  
20180930,2,말로 떼우려는 영화. 급한 마무리.  
20180930,10,"사춘기 때의 인간관계에 공감가는, 섬세하게 잘 만든 영화  "
20180930,10,감동적이고 잼있음 어윈 진짜 귀엽 ㅎ  
20180923,10,마지막 장면 너무 좋아요 행복해요ㅠㅠㅠ 네이딘 사랑해 내가 마니 아껴♥  
20180922,10,재미있게 봤습니다 ㅎ 코미디 적인 측면과 ~ 성장물적인  측면 ㅎ 굿굿굿  주인공 캐릭터가 아주 흥미로웠습니다  
20180921,1,영화 장면마다 전범기 나오는데 어윈은 또 한국인 설정인거? 뭔....  
20180920,10,처음부터 끝까지 내 얘기같아서 펑펑 울기만 했네  
20180916,10,끝까지 공감가는 영화. 네이딘에게서 17의 내가 보였다  
20180914,10,다른영화에서도 가끔 봤었는데 여주가 너무 매력터짐  
20180911,1,아니 욱일기가 왜 나오는 거지??? 잘 보다가 계속해서 나오는 것을 보고 꺼버렸네요.  
20180908,9,재밌던데? 1234567891  
20180824,5,그냥 딱 킬링타임용 왜 오빠한테 사과해야되는지도 모르겠고 친구 진짜^^;;;그래..음..  
20180823,9,친구 진짜ㅎㅎ...ㅠ  
20180822,2,계속 눈에 보이는 전범기에 여주마저 짜증남  
20180816,10,너무나 좋은 영화! 나의 사춘기 시절을 돌아봄  
20180814,6,영화는 괜찮았습니다그런데 배경에 전범기가 너무 거슬리네요보는 내내 불편했습니다  
20180814,1,전범기 왜이리 많이 나옴?  
20180813,10,나를 그냥 그려낸 영화..  
20180810,10,제목좀 바꿨으면 좋겠음  
20180809,10,상처를 소독한 듯 따끔거리게 한 영화. 이제는 직시하고 치료할 일만.  
20180809,8,왜 네이던이 사과하는지 잘 모르겠다 절친 오빠랑 잔 친구나 동생 절친이랑 잔 오빠나 아빠 돌아가시고 정신 논 엄마나 어릴때부터 오빠만 신경쓰는 가정환경이나 누가봐도 네이던이 사춘기여서 저러는건 아닌것같은데ㅋㅋ  
20180731,10,여주 진짜 매력적인듯ㅋㅋㅋ 끝에 오빠랑 친구랑 셋이서 있는 부분에서 쬐끔 인위적인 느낌 나긴 했는데 그것만 빼면 다 좋았음 어윈이도 넘 매력적ㅋㅋ  
20180720,10,어릴적 공감이되는 잘본영화네요ㅎ  
20180720,6,킬링타임용여주 입에 걸레좀 빼주세요 엄마 젖이 덜렁덜렁이 뭐니  
20180718,8,기집애들 영화지만 좀 재밌음 ㅋ 한글 제목도 좋아요  
20180711,8,무난무난 성장영화입니다  
20180711,10,닉 눈빛이 너무 섹시했어요 엉엉  
20180706,1,다 좋은데 여자는 남자가 친구 소개 시켜주기 전까지 친구 못 사귀나??  
20180702,10,헤일리 개이쁘다 ㅠㅠ 어윈 만화 겁나귀여움 ㅋㅋ  
20180626,10,"매력적 영화 ,,, 오졌다  "
20180626,10,제목 좀 더 산뜻하게하지 너무 좋은 영환디  
20180626,10,여주가연기를너무잘해요 크으  
20180625,10,제목이랑 내용때문에 뻔한 하이틴물일줄알고 스킵했는데 넷플에 볼게없어서 봤더니ㅠㅠㅠ 진짜... 누구나 한번쯤 해봤던 고민들. 상황들. 여주 연기 정말 잘한다.  
20180624,6,그냥저냥 성장드라마.  
20180621,8,헤일리 스테인펠드 이 작품으로 알게됐는데 매력넘치네요. 가수도 겸하고 있던데 곡들도 좋고.  
20180620,5,보는 내내 너무 답답했다. 성장영화가 아니었으면 그냥민폐녀  
20180620,10,최고의 결말.어정쩡한 느낌이 아닌 이 영화의 사건의 시작과 끝이 함께 어우러지는 결말이었다. 영화가 끝나지 않길 바랐지만 끝나고 났을땐 여기서 끝낸게 좋은작품일 수 있었던 이유였던것 같다며 안심했다.  
20180616,8,역시 남자친구가 최고야  
20180607,9,"저런 상황을 겪은 적이 없어서 이해가 안가서 그런데.. 왜 절친이 형제,자매,남매중 한명 만나는걸 그토록 싫어하는 거임? 그 상황에 싸우고 난리치는거 이해가 안가네  "
20180603,10,공감이 많이 가서 네이든의 성장에 힐링 받은 기분.  네이든이 정뚝떨하게하는 말 많이 했는데도 해바라기 김어윈.ㅠㅠ 나도 어윈이 한명만...ㅠㅠ  
20180603,7,"한국적 정서하고는 매치가 안되지만, 감독의 의도는 알겠다. 다만 크게 재미는 없는듯..  "
20180601,10,커가면서 겪는 일들 을 소소하게 써내려가는 영화  
20180526,4,교실에 전범기가 걸려있는게 너무 거슬려요 감독이 친일인가 한국인 역활도 있던데 살짝있는것도 아니고 국기가 떡하니 내용은 그냥그랬어요  
20180525,6,보다가 전범기봐서 ㅈ같았음  
20180523,10,보고 나면 기분 좋아지는 영화  
20180522,1,1점도 아깝다 17세에 저정도로 사회성이 결핍되었다는 것은 말도 안되는 일인듯  
20180520,10,감동이고 내용이 정말 신선하다.  
20180520,9,"마지막에 환하게 웃는 모습, 그리고 다른 사람들에게 맘을 여는 모습 보기좋네요^^ 선생님 ㅋㅋ 좋아요^^ 오빠도 어윈도 ~~굿  "
20180516,6,김어원 ... 쏘 스 윗 너땜에 끝까지 봤다 ...  
20180515,10,비슷한 나이의 학생으로서 매우 공감가는 영화  
20180513,10,공감되고 재밌음 여주 사랑스러워ㅠㅠ  
20180512,10,개잼존잼ㅠㅠㅠ 한국 정서엔 이해하기 힘든 17살이지만 ㅋㅋㅋ진심 존잼 어윈 쏘스윗♡.♡  
20180512,9,영화 진짜 잘만들었다..그냥 별 거 없는 teen 무비일줄 알았는데..한국이든 외국이든 어떤 사람이든 가정이란 건 다 똑같은 거 같네 사람이기 때문에..  
20180512,10,주인공이 답답하고 짜증만 난다면 영화를 다시 한 번 시청해주기를 바란다고 말하고 싶다. 평생 이렇게 생각하며 살아야할까 무섭다는 대사는 제목 중 The edge of에 너무 잘 어울린다. 열일곱이 아닌 모든 방황하는 이들이 이 영화를 봤으면 한다.  
20180509,1,"여주가 연기를 참 잘했다 싶은게, 보는 내내 때려주고 싶을 정도로 계속 미웠다. 발암발암!!! 선생이었던 우디의  대사가  아주 좋았다.  멋짐!  "
20180509,10,마지막 10대 나이 때 보기에 공감도 많이 가고 지금 느낄 수 있는 감정과 같다. 정말 재밌다.  
20180507,5,여주 감정은 공감되어서 되게 좋았는데 구성이 엉성하고 빈약하다. 왜 넣은지 모르겠는 장면들때문에 다소 정신 사납고 임팩트가 딱히 없어서 영화에서 뭘 전하려는지 모르겠다.  
20180503,1,씹아싸 최종진화의 영화  
20180429,10,잼있음!!!!  한글제목이 넘 이상함  
20180423,10,이런 매력있는애가 친구없다는건 말이 안됨!!아무생각없이 시간떼우려고 봤는데 넘나 재밌었다ㅋ  
20180420,10,더브레이브 연기보고 신인일 뿐인 꼬맹이가 뭐 저렇게 연기를 잘하지 했는데 벌써 숙녀가 됐네.. 진짜 더브레이브에서의 연기는 다코타패닝이나 엠마왓슨보다 더 충격적이었음.  
20180411,9,믿고 보는 배우들. 헤일리 스테일펠드 and 우디 해럴슨.  
20180408,10,그냥 하이틴 로맨스인줄로만 알았는데 하나하나 마음을 울리는대사들이 많았다..  
20180406,7,에이딘이랑 같은 감정을 공유하게 되는 영화. 마지막엔 같이 웃게되었다.  
20180329,10,이거 분명 코미디인데 왜 난 계속 울고 있지 ㅋㅋㅋ ㅠㅠ 나이 29에 17살에 감정이입하네  
20180323,7,가볍고 재미있는 영화를 예상했지만 무겁고 심도깊었다. 네이딘의 연기는 매우 인상적이고 압권이었다. 앞으로가 기대되는 배우다.  
20180322,6,한국이엇으면 돈좀 벌라고 여주가 선생 고소햇을듯 성추행 당햇다고 실제로 그런 사례도 많고  
20180318,10,헤일리 스테인펠드 연기 잘하네요  
20180315,10,난 이런 '아싸' '루저' 평범하지 않은듯 평범하고 소심하면서도 자리가 마련되면 외향적인 사람들의 이야기가 좋더라.. 나를 보는 느낌. 10대 하이틴 멜로물 싫어하는 사람이지만 재밌게 봤음 (본인 애아빠 31세)  
20180309,10,"정말, 처음부터 끝까지 등장인물들의 행동이 이해가지않는 장면이 없었다. 무슨 생각으로 저렇게 말하고 무슨 생각으로 저런 표정을 짓는지 까지 완벽하게 알 수 있었다. 연출과 연기 모두 너무 최고였다 거창한 건 아니지만 정말 공감가고 대단하다..  "
20180304,10,네이딘 주변사람 복이 너무 좋은거같은데 선생님과 어윈 오빠랑 절친 엄마도 모두 정말 현실에선 보기힘든 좋은사람들!  
20180304,9,여주 팬인데 잴 사랑함... 한국놈하고 이어지는 결말이라 너무 좋네...ㅋㅋㅋ  
20180303,8,약간 내 상황같기도 해서 공감가고..  
20180303,2,성장단계 이기 때문에 저렇게 행동하는 거 알면서도 보는 내내 짜증나서 힘들게 봤다. 어휴~  하이틴 영화인지 알고 봤는데..  
20180301,6,여주 연기도 잘하고 다 괜팒은데 왜 전범기가 계속보이냐...유럽으로치면 나치상징이나 마찬가지인데 영화 내내 계속 나오네ㅋㅋ  
20180225,1,전범기 계속나오니까 이거 제발 보지마세요 그냥 넷플릭스에 가입하니까 꽁짜라서 한번 봣는데 돈주고 봣으면 욕나올뻔 미국은 멍청한건가 배급사가 소니라서 그런가 전범기 진짜 계속 나옴ㅋ 마이너스 점수 주고싶다  
20180223,7,"집중도(지루함여부):★★★, 신선도:★★★, 여운:★☆  "
20180223,6,글쎄 자신의 불행을 억지로 유지하려는듯한 느낌이 드는 영화  
20180222,10,네이딘은 참 괜찮은 사람이다. 평균 이상의 유머감각과 배려심을 가졌다. 나는 언제부터 네이딘처럼 자기 비하를 하기 시작했을까? 아마 한사람 쯤은 나를 정말 괜찮은 사람으로 볼지도 모른다고 생각하게 됐다. 그냥 큰 위로가 되는 영화...  
20180221,10,"20살 남자가 봐도 재밌었다.우리나라는 이런영화 절대 못만들지. 왜냐? 창의력, 상상력이 ㅈㄴ 떨어지거든. 앞뒤 꽉꽉 막힌 한국 감독들  "
20180220,2,유교탈레반 한국에선 절대 나올수없는 청소년영화 그렇다고 재밌지도 않다  
20180220,8,"주인공여배우 진짜 매력있어요 살짝 오글거릴때도 있지만, 사춘기소녀역할을 진짜 잘 소화한듯. 편안하면서도 즐겁게 봤어요  "
20180218,8,노래도 부르는걸 이제 알았네 노래잘불러서 8점줌  
20180218,8,헤일리 스테인필드 너무 매력적이고 연기도 잘한다. 아 나도 딸은 커가고 걱정이네.  
20180217,10,오랜만에 웃어본 영화네요 나의 유년시절을 짧게나마 경험했던 기억나네요. 지금도 가끔 진정이 안되곤 하지만 ㅎ  
20180214,8,참 재밌는데 전범기가 배경으로 종종 나옵니다. 정확히 16줄이에요. 이유는 모르겠습니다.영화를 시청하는 건 자유지만 알고 보는거랑 모르고 보는거랑은 다르다고 생각합니다.주인공 참 사랑스럽네요. 재밌습니다.  
20180212,10,인생을 다시한번 돌아보게는 영화...  
20180209,10,이래서 헐리우드 영화가 좋다. '브레이브'의 그 처연한 아이가 참 잘컸네.. 우디 해럴슨도 좋고. 제목 번역도 결론적으론 잘한듯하다. 베프 캐릭터 정말 잘만들었고 캐스팅도 잘했다. 추천영화 ^^  
20180206,6,왜 OO발광인지 알겠다 아오  
20180204,2,자기만 세상에서 제일 불쌍하게 여겨질 나이니까 네이든이 겁나 짜증 유발하게 해도 참겠는데어느정도 이해도 할 수 있고학교 교실의 욱일기는 참 아무렇지 않게 달려 있어서 서양인들의 인식이 놀랍고 거슬린다.하켄크로이츠도 그렇게 걸어 놔 보시지?  
20180204,2,영화중 전범기 무엇 오지게나오는거 실화냐  
20180203,10,왜 울었는지 모르겠는데 영화를 보면서 울었다ㅠㅠ 주인공 성격 꼬였는데 전혀 밉지않고 안쓰러웠다 제목때문에 B급 영화인줄 알았는데 여운도 남고 좋은 영화였다  
20180203,10,별생각없이 틀었는데 지루하지않게 끝까지잘본영화 진짜 투덜대는 10대를 보는느낌이라 주인공이 참 짜증나고 귀엽다 인물들도 다 공감가게 그려져있음 가벼우면서 무거움이있다  
20180203,2,정신나간 싸이코패스 여주인공  
20180202,10,근래에 본 외화 드라마중 으뜸입니다.  
20180201,8,상영중일 때 영화관에서 봤눈뎅 이제서야 평을 올리네용~ 이 영화 좋은 영화 입니당 재밌구 네이딘의 심정이 이해 되었어용~ 아마 완벽하게 이해한건 아니궁 조금은 이해를 한 것 같네용 좋은 영화 입니당~:)  
20180201,10,진짜 재밌당 유명한 하이틴 영화들이 오래되서 촌스러운 느낌이 나는 영화들이 많은데 이건 정말 재밌어요!! 꼭 보세용  
20180129,10,"10대 성장영화,여주 매력있어요!  "
20180129,8,중간중간 내 얘기같아 이상하게 눈물이 났다 러프스위트힐링무비  
20180126,10,나만그런건 아니였어. 내일도 살자~  
20180124,8,정말 오랜만에 보는 유쾌한 사춘기영화 였습니다. 재밌게 잘 봤어요^^!!!!  
20180121,8,헤인리가 아직 국내서 유명안하긴 한가보네요 ㅎ 이미 10대초반 아카데미 후보든적도 있고 미국서는 이미 10대 스타중 하나입니다ㅎ 이미 뜬 배우에요  
20180115,1,핵노잼 핵노잼 핵노잼 핵노잼  
20180115,10,평점낮게준 내용 봤는데 재밌다고 하는사람보고 찐따같다하는데 잘 아시네요^^ 그렇게 평가해줘서 고마워요. 왜냐 난 여주처럼 불행한 삶을 산다고 생각했으니깐.영화보고 소리지름.남자때문에 사람사귀는게 아니라 사람사귈발판을 만들어 줬다고 생각하는게 맞는듯?  
20180113,10,헤일리 귀여워 죽겠음.... 광대 승천해브렀다  
20180111,7,네이딘이 답답할 때도 있지만 그 또한 공감을 하면서 보게 된다.ㅎㅎ  
20180111,10,너무 슬펏다. 항상 겉돌고 남들처럼 평범하지도 않은 평균이하의 주인공 모습이 진짜 나같았다. 자살은 아직까지는 못해서 처음으로 평점을 남긴다. 네이딘 항상 응원할께  
20180107,7,여주인공 매력 + 어원이 매력  
20180105,6,여주 지가 다 일벌려놓고 지가 제일 화냄 보는내내 개발암 공감안됌 여주 땜에 애키우기 무서워짐 마음에 드는 캐릭터 선생님 뿐임 쌤 직언 존나잘함ㅋ  
20180104,6,피해의식과 부정적인 시각이 있다면 모든 것이 안 좋게 보이는 법.  
20171226,8,왜이렇게 여주가 G랄맞지 하면서도 한편으론 이해가 갔기때문에 보는 내내 마음이 쓰일수밖에없었다...여동생 하나뿐인 친구 채가는 오빠가 너무하다싶었는데 동생한테 아주 소중한존재였던거처럼 오빠의 숨통을 트여준다는 말은 거짓이 아닌듯...그리고어윈멋졋음ㅜㅜ  
20171225,10,너무재밌고요 남자배우둘다 멋있음. 어윈이 젤멋있음 ㅎ  
20171225,8,이지A의 엠마스톤이 오버랩된다. 내용도 내용이거니와 주인공의 넘치는 매력이 극을 시종 흥미롭게 끌고간다. 대스타의 탄생을 알리는 작품이 되길 기대해본다.  
20171224,9,우디 해럴슨을 다시 보게된 영화.  
20171222,10,"오래보고 싶은 매력적인 캐릭터 헤일리,앞으로 성장해나갈 이야기도 보고싶어짐  "
20171218,10,정말 재밌게 봤다. 근데 선생님 좋았다고 하는 분들 뭔가요? 번호준거 말고는 아무런 도움도 위안도 되지 못하던데... 막말하고 내리라 명령하고 그냥 애들 다루는 능력 부족을 여실히 보여주는 캐릭터던데 뭘 보고 좋았다는 건지;; 눈이 있는 건지 궁금..  
20171215,9,나만 특별하다고 생각했지만 엉망진창이어도 나니까. 사춘기가 아닌 모두에게 전하는 이야기. 여기 선생님이 참 좋았다.  
20171211,2,하이틴 좋아하지만 이건 별로.. 러브라인이 뭔가 조  
20171211,9,제목 번역 때매 네개 반 드림 :)  
