0,1,2
20170712,10,그냥 최고인데 청소년기 때 이야기를 잘 표현해주고! 너무 좋은 영화였다 연기도 최고  
20170712,1,장난해? 뭐가 코미디야 ㅋㅋㅋ보다 중간에 열받아서 자고 있는 친구 깨워서 나왔다...집에서 불법 다운으로도 안본다  
20170712,6,[2017-6-22/19:30] 이야기가 주는 메세지는 받아들여도 인물들의 성격과 행동들이 전혀 공감이 안 됬다.  
20170711,10,우연히. 보았다가 너무 재미있어 멍한 영화  
20170711,10,재밌게봤다. 감정이 소용돌이치는 사춘기를 잘 표현한 것 같다.  
20170711,10,이거 영화표 현장발매할때 좀 그렇겠다ㅋㅋ OO발광 17세 하나요ㅋㅋㅋ  
20170711,10,내 사춘기 시절을 회상할 수 있었다  
20170711,10,헤일리가 나오니깐 봐야지 ㅋㅋㅋ. 피치퍼펙트도 기대 함~  
20170711,9,선생님이랑 할줄 알았는데 아쉽네용;  
20170711,9,별생각없이 보다가 점점 빠져드는 영화  ♡ 근데  담임선생님 진짜 극한 직업 .  
20170711,10,사춘기를 겪는 17살으로서 너무좋은 내용인거같아요 공감 많이 되고 힐링도 됐어요..ㅜ  
20170710,10,영화 초반 부에는 네이딘은 영화 속의 주인공으로만 생ㄱ각했는데 점점 볼수록 나?를 볼수 있는 영화..공감된다 뭔가..!  
20170710,9,???내 후기 어디감???  
20170710,8,지금에 17살 아이들이 보기에는 괜찮을것같은데요 그리고 어린 아이들이 이 영화를보고 그후에 17살이되면 이 영화를 생각했으면 좋겠습니다  
20170710,10,두번보세요 세번보세요  
20170710,9,머머리 욕듣고도 쿠키 나눠준 선생님께 존경을 표함  
20170710,6,그냥편하게보기좋은.  
20170710,10,우디헤럴슨 선생님 너무 멋있다ㅜㅜ헤일리 스테인펠드 영화 다 찾아보다가 보석같은 영화발견했네.네이딘~괜찮다고 잘하고있다고 꼭 안아주고싶다.  
20170710,3,보는중인데 여주인공매력은 어디서봐야하나요때리고싶은장면은 몇장면있었다만새상만사 삐뚤어져있어서 나까지 꼬이는듯한 기분임옆에있는 친구는 꿀잠자네요  
20170709,1,이것도 영화야? 혐오스러울 뿐이다.  
20170709,9,학창시절 공감가는영화 흐뭇하게 봤습니다  
20170709,8,참 OO맞다.  난 제목이랑 잘어울리는거같음.  주인공 연기 참잘한다고생각해서 찾아보니 맙소사 비긴어게인 딸내미였구나  
20170709,7,"괜찮은 하이틴영화. 주인공처럼 행동하진 않았지만, 그 질풍노도의 심리상태는 충분히 공감가능했던. 그런 의미에서 난 아직 사춘기인가보다.  "
20170709,9,영화보다 빵 터지게 몇번 웃었네여~미쿡 청소년들 성장통 얘기들~ 비오는데 개인적으로 별기대없이 영화 봤는데 재밌있게 봤네여. 꾸밈은 적지만 괜찮은 성장통 스토리였어여.  
20170709,10,"올해 본 최고의 영화, 이제 저 감독, 저 주연배우 나오는 영화를 다 찾아서 볼 것 같다. 사랑스럽고 아프고 뭉클하고, 그리고 겁나 웃기다  "
20170709,1,예고편 보고 기대했지만 기대 이하였던 영화  
20170708,7,"결말을 너무 빠르게 마무리 한것같아 아쉽고, 여주인공이 좀 이해안되기도 했지만 전체적으로 재미있게 본것같아요~  "
20170708,1,진짜 누가재밋다고하냐이걸 ㅋㅋㅋㅋ보다나왓다  
20170708,8,오빠역 캐스팅 갑bb 눈호강하다왔음 ㅋㅋㅋ주인공같은 성격인데 영화 공감 많이 됐어요ㅠㅜ  
20170708,8,"나쁘진않다 성장기소녀에대한 내용! 근데 객관적으로 봤을땐 여주정말 OO발광한다... 나로서는 저심리, 행동 모두잘이해안됬던ㅠㅜ  "
20170708,10,스펙타클 한 인생살면서 한번쯤 미친듯이 제정신 아니듯 사는 인생살이를 매력있게 잘풀어낸듯  
20170708,9,미드한편본거같았어요!  그 시기의 사춘기를 잘 표현한거 같아서 좋았습니다..그리고 어윈너무 귀여워  
20170708,10,나도 빨리 나의 자존감을 높혀줄 멋진남자 만나고싶다  
20170708,10,헤일리 스테인필드의 연기력이 돋보이는 영화네요!! 재밌어요!  
20170708,10,흐뭇한 웃음을 짓게 하는 멋진 성장영화  
20170708,10,헤일리 스타인펠드는 만능 엔터테이너야..  
20170708,10,네이든이 행복했음 좋겠어요  
20170708,10,두시간내내 웃엇던영화 어원멋져  
20170707,7,어윈이란친구 한국계로나오는데 보면 볼수록 존박 닮은거 같기도하고 매력있는듯~~ 지잘난거 알고 친구뺏어가는 주인공 오빠가 밥맛!  
20170707,10,그냥 깔끔하니 저나이때 고딩여자애의 심리와 미국문화를 엿볼수 있어 좋았다.  
20170707,7,위기는 언제나 온다 열일곱 말고도  
20170707,10,괜찮아요. 철 들지않은 나를 본듯ㅎㅎㅎ 사랑은 마음의 병을 치유하죠  
20170707,1,근데 너무 못생겨서 보기싫다. 매력이라도 있어보여야지 ㅠ.ㅠ  
20170707,5,결말이 고구마..우울증걸린 여동생의 하나뿐인친구랑 사귀는 오빠가 젤 노이해; 갑작스럽게 잠자리가지고 사귄거면서 자기가 숨돌릴 수 있는여자라며;;여주성격도 저렇게된거 피코하는 오빠때문인듯...이 요소만아니면 괜찮은영화라고 생각함  
20170707,9,여주 진짜 답답하고 진짜 패버리고싶었는데 끝나고 나니 내 모습이 보였던 것 같은 느낌.. 주변에 저렇게 좋은 사람들만 가득하다니 너무 부럽다. 엄마랑 오빠랑 친구랑 선생님 그리고 어윈한테 하루에 3번씩 절해라 진짜.. 오빠랑 어윈 진짜 개훈남....  
20170707,10,"오늘 보았는데 스토리와 영화속에 정말 중요하고 대단한 의미를 완벽하게 섞어주셨네요. 단지 여주가 왜 저리 못났고. 이 영화는 그냥 웃긴장면보고 웃는다가 아니라, 한 사람과 관련된 사람들의 인생과 그로 인한 결과까지 다방면으로 삶에서 배울게 많네요.  "
20170707,9,보는내내 흐뭇한 영화~~  
20170706,10,이런 영화 너무 좋아요 사랑스러운 영화♡  
20170706,8,재밌게 봤습니다. 여주인공이 매력적이네요  
20170706,10,계속웃다가왔네요 ㅋㅋㅋ오랜만에 재미있는영화본것같아용  
20170706,10,썸녀랑보면개꿀잼!각이여  
20170706,9,뻔한내용 같은소리하네 애들나오면 다 뻔하고 유치하냐알지도못하는 찐따들아 성장영화 하이틴영화 같은 소리하자말어라 찌질이들아 이건그냥 재밌는영화다  
20170706,8,한국에서는 OO발광이   주의집중력 결여 아동들이그 축에  끼는편.  그리고  pc방 많이 가는편  
20170706,10,여자가 이뻐여 정말정말  
20170706,9,너무뻔한 얘기지만 나름 꽤 재미있었다.  
20170705,8,재밌고 주연 배우가 굉장히 매력적이었다  
20170705,10,"말할 것도없이, 최근에 본 영화 중 최고였다  "
20170705,9,요즘시대 성장통을 겪는 사춘기 소녀의 심리묘사를 잘 표현해냈다. 헤일리 스테인필드의 감정연기는 앞으로도 주목 할 필요가 있다.  
20170705,9,미쿡 여고생의 리얼한 삶을 보여준 영화 같아요! 감정표현이 좋습니다. 추천합니다!  
20170705,9,한마디만 할게요 꿀잼~!  
20170705,9,진찌 웃기고 재밌게 기분좋은 영화  
20170705,10,청소년들한테 좋은 영화일듯!  
20170705,10,"솔직히 기대 하나도 안하고 그냥 볼게 없어서 봤는데 최근 몇년 사이에 본 영화중에서 가장 맘에드는 영화였다. 주인공, 주인공 오빠, 주인공 친구 등 주변에 있을만한 사람들의 충분히 와닿는 감정, 고민 등이 매우 유쾌하게 잘 담겨있다.  "
20170705,7,적당히 재밌고 적당히 섬세하다.  
20170704,10,재미뿐만아니라 감동 있고 나의 17살을 떠오르게해주는영화  
20170704,6,네이딘의 삶이 너무 괴로워서 보고있기 괴로움  
20170704,1,하.. 제목 번역 수준;;;  
20170704,7,조금은 지나친 소녀와 주변 인물들  
20170704,8,누구나의 성장 이야기. 공감이 많이 간다.  
20170704,10,나도 모르는 사이에 주인공과 같은 마음이 되어버렸다  
20170704,1,주인공 진짜 개 싸이코 발암 물질1급인듯..엄마한테 하는 꼬라지하며 오빠한테 하는 꼬라지..하며선생님한테 하는 막말하며..니가 중2병걸렸으막하고 다녀도 되냐?개싸이코 같은 메세지로 잘생긴애 꼬드겨서..그남자애 또라이로 만들고ㅋㅋㅋㅋ노답  
20170704,7,나 빼고 다 잘나고 행복해 보이는 것 같애...곁으론 안그런 척 하면서 사는거지...선생님과의 신경전(케미)...은근 따숩네...다정다감 볼매 어윈~~@@  
20170704,8,현재 극장에 걸린 박열 트포 리얼 옥자 미이라 등등 영화중 이게 최고다.  
20170704,10,정말. 정말. 정말. 재미있는 코믹드라마 영화이네요...ㅋㅋㅋ~~~제목은 마음에 안들지만... 내용은 마음에드네요...  
20170704,10,저 진짜 알바아니고요 새벽에 할거없어서 혼자 영화보고왔는대 너무 잼있었어요 여주도 이뿌고 연기도 잘하고요 진짜 겜있어요 보세요 그리고이거는 cgv만상영해요 알바아니에요 진짜  
20170703,10,유일한 단점은 여주가 너무 매력있어서 외톨이라는게 신빙성이 떨어진다는 점  
20170703,8,확실히 여주인공은 OO발광을 한다. 그런 사람이 주변에 있으면 좋아할사람 없다. 자격지심에 자존심은 지나치게 세고 안하무인에 자기만 생각하고 자기를 아껴주는 사람에게는 끊임없이 받아달라 칭얼대며 함부로 대한다. 스스로를 가다듬어야 타인을 볼수있을것이다  
20170703,10,오~~ 크리스틴 집에 일찍왔네~~~?ㅋㅋㅋㅋ  
20170703,10,공감대가 없는 사람이 본다고 해도 적어도 한부분 정도는 공감될만한 점이 있고 뭔가 네이딘 모습에 내가 보이는거 같아서 더 집중하면서 볼 수 있었던 영화였다 진짜 지루함 없이 그냥 계속 보게 됐던것 같다  
20170703,9,마지막 엄마와 문자를 고민하면서 나누는 장면이 정말 인상적이였어요! 실제 사춘기 자녀와 부모님의 모습을 잘그려낸것 같아서 코끝이 찡했습니다.  
20170703,10,잠깐의 예고편을 보고 삘이 딱 꽂혔다. 최근에 유스전을 보고와서인지 청춘에 관한 이야기라기에 너무 보고싶었고 결국 친구와 보고왔는데 정말 만족스러웠다. 친구나 연인끼리 보기엔 좋고 가족단위는 좀 민망할수있다. 드립이 꽤나 강하다  
20170703,10,포스텈ㅋㅋㅋ 저거 왜넣었고 제목은 엣지오브 세븐틴에서 왜 OO발광이 되어버린거니...헤일리 겁나 이쁘고 헤이미치 오랜만에 보는느낌나서 좋았음  
20170703,10,제목 인정. OO발광쌍욕까지 하는 네이딘을 다 받아 주는 브루너 쌤은 만랩 보살! 평점이 약간 올라가도 될 것 같아서 10점.  
20170703,6,조금지루함 .. 글쎄 난 보면서 네이딘 좀 짜증나더라 ㅋㅋ 내가 나이가 든건가 ㅋㅋ  
20170703,1,어떻게 영어를 배우면 저 제목을 OO발광으로 해석할수가 있는지 참 무식한놈들 기준으로 평준화 당하는거 같다  
20170703,10,여주인공이 너무 예쁨. 웃기고 귀엽고ㅎ  
20170703,8,받아들이고 인정해야만 앞으로 나아갈수있다는 어쩌면 당연한 사실을 한번 더 일깨워준 영화.  
20170703,8,진짜 OO 맞은데 귀여움ㅋ  
20170703,9,"김어원,,전래 매력있어..  "
20170703,10,로봇.영웅물 안보길 잘함 최고  
20170702,10,여주가 연기 잘한다 제목이랑 딱맞음ㅋㅋㅋ어윈도 멋있고..선생님도 진짜 저런 선생님을 만나면 좋을 것 같다 어쨌든 한 번쯤은 볼 만한 영화  
20170702,7,딱히 재미도 감흥도 없었음  
20170702,10,네이딘의 마음과 행동이 너무나 공감되고 이해됐다. 나도 그런 철없는 시기를 겪고 있어서. 중간중간 유쾌한 부분도 많아서 좋았다. 유쾌하고 눈물 나는 영화.  
20170702,10,진짜 너무 재밋어 어윈킴 내꼬 ㅜㅠㅜㅜ  
20170702,10,웃긴부분은 진짜 빵터지고 공감되는 부분은 눈물 폭발 ㅜㅜ 분위기가 너무 예뻐요 한번 더 보고싶은 영화  
20170702,10,여주인공 너무 매력적 !  
20170702,10,완전 유쾌하게 잘 봤어요.  
20170702,10,재미있게 볼만한 영화였어요^^  
20170702,9,"언뜻  보면 우리 주변에 있는 평범한 소재지만, 이상하게도 계속 몰입해서 보게 되는 영화였다. 우디 해럴슨을 제외하고는 생소한 배우들이어서 조금은 걱정했지만, 영화를 보고나서는 그들의 연기력에 한방 맞은 기분이었다. 유쾌하고 미소 짓게 되는 영화 !  "
20170702,10,이용철 평론가 말하는거봐ㅋㅋㅋ 정확히 말하네  
20170702,10,잔잔하면서 공감도 되고 재미도 있네요  
20170702,10,간만에 유쾌한  영화봤어요ㅋ굿!!입니다  
20170702,5,영화 공감가는것도 많고 십대때 추억 떠올리면서 보긴 봤는데 여주가 아빠돌아가신걸로 선생님이랑 오빠한테 그러는거 개별루 글구 중간에 교실에서 욱일기 나오는거 나만불편? 거기다 김어윈은 한국사람으로 나오는데 감독이 미친건가 ㅡㅡ;  
20170702,6,자기연민에 빠진 철없는 소녀의 유치한 인생 이야기  
20170702,10,"왕따를 당해봐서 그에대한 공감과 좋은 선생님이 있었다면에 대한 슬픔 등으로 크레딧이 올라가는 그 순간까지 눈물이 났던 인생영화였다. 이걸보는 모두가 그저 가볍게 웃고 넘기지 않고, 현재 학교 어딘가에서 괴롭힘 당하고 있을 아이들을 돕길 간절히 원합니다  "
20170701,10,잘만든 성장영화 재밌게봤습니다  
20170701,8,평이함 미숙한 느낌도 있음  
20170701,10,오랜만에 가볍게 본 유쾌한 영화네요.현실반영을 정말 잘 한 듯 합니다.  
20170701,10,우리나라 정서와 다르지만 좌충우돌 사춘기 잘 묘사한것 같다.. 우리나라 고딩들은 공부하느라 정신없는데...  
20170701,8,간만에 괜찮은 틴에이저 무비  
20170701,10,네이딘이 왜저러나 싶으면서도 그 안에 내가 보여서 씁쓸했다ㅠㅠ 깨알웃음코드도재밋엇음 ㅋㅋㅋ이런하이틴영화 조아  
20170701,10,웃기고 재밌고 공감되는 영화  
20170701,10,"여주인공뿐만아니라 오빠,엄마도 함께 성장하는 모습이 너무 좋았어요 오랜만에 좋은 영화를 볼 수 있어서 기분 좋았습니당  "
20170701,10,여자친구랑 같이 봤는데 재미있어요  
20170701,5,"글쎄, 잘 공감 되지 않는다.  "
20170701,1,걍 왜 봤는지 의문 돈 아깝고 시사회 당첨돼서 공짜로 봤는데 시간아까움  
20170701,10,10년전 17살 난어땠을까?생각하며 1시간40분갓 그래 저때 나도저랬지 하고 공감을갖게 해준 영화  
20170701,10,17살에 철들었네 쩬짱.. 부럽다 ㅠ  
20170701,5,여주가 너무 못생김. 얘 피치퍼펙트에서도 나오던데 영화사에 연줄이 있나?  
20170701,10,진짜 이번년도에 재밌는게 하나도 없어서 아무거나 보러왔는데 간만에 웃었네요 공감되는 부분도 많고 너무재밌었어요 우울했는데 오늘하루 이영화보고 기분좋네요ㅎㅎㅎㅎ  
20170701,10,기대완 달리 너무 재밌고 뜻깊은 영화였습니다! 좋은 배우들도 알아갈수 있어서 더 좋네요 연기너무잘하는~~^^  
20170701,2,초반에만 재밌고 후반부는 전개도 이상하고 고구마.. 돈주고보기 아까워요ㅜㅜㅜㅜ  
20170701,6,ㄹㅇOO발광 했지만.... 선생님이 치유해줘서(나를) 6점영화자체는 훈훈해서 좋았다  
20170701,10,제목이 참 지x발광 ㅋㅋㅋ  
20170630,10,여주인공 연기 좋았어요!  
20170630,7,영화에 몰입이 엄청 잘됬다 한국과 환경은 다르지만 어쨌든 다들 겪었던 17살이고 되게 공감가는 내용이 많았다 근데 마지막에 여주가 바뀌는 부분 결말이 좀 아쉽다.  
20170630,4,내 주변에 부디 없기를 바라는 열등감 덩어리의 끝판 으 짜증지대로  
20170630,10,사춘기때 느꼈던 주체할수없는 감정의  쓰나미를 다시 느낄 수 있음  
20170630,10,재밌게봄 영어제목으로 치면 더 찾기쉬움  
20170630,9,"네이딘이 그렇게 방황했던것도, 오빠가 네이딘에게 지지 않으려고 했던것도 결국은 각자가 너무 힘들었으니까 그랬던거겠지. 내 17살이 생각나 너무 공감된다. 웃음코드도 너무 화끈하고 감동도 진하다! 그리고 헤일리와 우디 해럴슨의 연기는 언제나 최고!  "
20170630,10,진짜 보고싶었던 영화인데 생각했던것보다 너무 재미있게봤어요 10번봐도 재밌을꺼같아요  
20170630,9,병맛 코미디 일줄알고 봤는데 마지막쯤 울었음...  주인공한테 너무 몰입함 ㅠㅠ  
20170630,5,여주인공 암덩어리....  
20170630,3,ㅈㄹ맞은영화ㅎㅎㅎㅎ  
20170630,7,영화는 나쁘지 않은데 제목을 왜 이따구로 바꾼 건지  
20170630,7,내가 세상의 중심인줄 알았는데 세상에 잠깐 머물다 가는 먼지라는걸 깨닫는 나이...그래도 나는 니 나이가 부럽기만하네  
20170630,10,평식이 형이 6점준 숨겨진 히든 띵작  
20170630,10,일단 재밌습니다.소소한 에피소드로 때론 내 얘기처럼 혹은 내 자식의 마음을 들여보는 것 같은 마음이 들었던 영화네요.여주인공을 더 브레이브때도 연기를 잘한다고 느꼈었지만 7년이 지난 지금은 물이 올랐네요.  
20170630,10,내가 10대때 했던 생각들을 하는 여주를 보면서 공감이 참 많이 갔고 여주는 그래도 나처럼 배배 꼬이지 않아서 부러웠다. 먼저 사과할 줄 아는 그 용기가 얼굴도 이쁘지만 더 이뻐보였다.  
20170630,10,영화 넘 재밌게 잘 봤습니다^^ 아주 따뜻하고 기분좋은 영화였어요~ 주인공의 발광(?)을 받아주는 선생님의 모습이 정말 멋있었습니다♡♡  
20170630,8,여러면에서 웃고 즐기면서 볼 수 있는 영화!  
20170630,9,간만에 웃으며 볼 수있는 영화를 봤네여~^^  
20170630,10,이거 보고 싶은데.. 가까운 상영관 찾기가 어려움ㅜㅠㅠㅠ 상영관 좀 늘려줘여  
20170630,8,이 영화 너무 보고싶은데.. 상영관이 넘 없어요 ㅠㅠ 상영관 좀 늘려주세오.ㅠㅠㅠㅠ  
20170630,9,"15t세 관람가인데 영화제목을 이따위로 만들어서 한국에 배포한 사람 당장 잡아들여라! 장난하냐? 아무리 번역해도 이런말이?배급사 누구고? 어떤 개양야치가 배급했으? 모서리의 edge가 어떻게 OO발광이 되냐??  걍 날카로운 17세, 똘끼 17세  "
20170630,5,대부분의 관객들이 자신의 어린 시절 했던 잘못이나 실수를 되짚어보게 되며 '그땐 그랬지~'하며 공감할 영화.  
20170630,9,유쾌하고 어린 그 시절이 떠올랐어요 ㅎㅎ  
20170630,10,재밌어요! 청소년기 메세지를 주는 작품~  
20170630,10,각본과 연출력이 훌륭하다. 가볍지도 무겁지도 않게 영화 참 잘 만들었다. 배우들이 자기 옷 입은 것처럼 배역을 잘 연기했다. 특히 선생님 역할 배우 연기 참 잘한다. 이런 장르 영화 많이 나오길!  
20170630,10,포스터랑 제목 왜저랩..  
20170630,10,여자주인공 비긴어게인에 나왔을때부터 괜찮다 생각했었는데 이번에 주연으로 나와 새롭네요.17세의 감정연기를 너무잘했고 선생님도 너무 유머스럽고좋았습니다.여주 주변에 잘생긴남자와 좋은분이많아 부럽기도하면서 이런영화는 미국이라 가능한가같다 재밌게잘봤습니다  
20170630,8,재밌었지만 해피엔딩으로 보기엔 엄마의 삶의 너무 무겁지 않았나.한국계 남친을 보니 아직 동양인에 대한 편견이 많은 것도 같다.특히 한국 제목은 더 고심해서 붙여줬으면 하는 바람.무튼 비긴어게인 사춘기 소녀에가 사춘기 숙녀로 돌아와 반가웠다.  
20170629,10,너무공감되서 네이딘울때마다 같이 운것같다.슬픈영화도아닌데 쪽팔리게왜케눈물은나는지ㅋㅋㅋ인간관계에 지치고 내자신이 싫어져서 힘들때마다 다시보고싶은영화  
20170629,10,누구나 겪어야 하는 사춘기의 방황에 대한 이야기  
20170629,10,감독의 첫작품이라는데 정말 마음에드는 영화였다.  
20170629,9,영화 보고싶은 거 딱히 없어서 기대 정말 하나도 기대 안하고 봤는데 정말 선생님과 제자의 재치있는 대사들이 정말 웃긴것 같아요 재밌어요  
20170629,8,"잼있는 영화...^,.^~~  "
20170629,9,배우들 연기가 좋아요. 특히 여주랑 저는 선생님 연기가 좋았어요 ㅋㅋㅋㅋ 빵빵터지는 포인트도 많고 재미있었습니다.  
20170629,7,더 브레이브부터 헤일리 스테인펠드 팬이었는데 그녀는 이제 믿고 보는 연기파배우!  
20170629,10,요새 영화판 개판인데 이상한거보지말고 이거봐라 훠월씬잼있따 보는내내 웃음이 나오는영화  
20170629,10,"누가 내 이야기 영화로 만들어놨는지, 보는 내내 실소가 나왔다. 시간 아깝지 않고 가볍게 내가 저랬을까 생각해보게 된 영화.  "
20170629,10,"간만에 보면서, 울고 웃고 공감했던 하이틴영화. 17살의 끝자락에서 네이딘은 이기적이었으나 동시에 가장 여렸다  "
20170629,9,영화가 위트있고 사랑스럽다. 주인공도 너무 러블리하고.이런류 영환 못해도 평균이상.  
20170629,10,볼거없어서봤는데 꿀잼일세 ㅎ  
20170629,7,그냥 저냥 그랬다 볼만함  
20170629,8,한글 제목을 왜 이렇게 했지 ?  
20170629,5,5천원에 봐서 참았고  헤일리 스테인필드 나와서 또  참았다.  
20170629,8,누가 제목 지었는지 너무 딱 맞네. OO발광 ㅋㅋㅋ  
20170629,10,The Edge of Seventeen을 OO발광 17세로 만들다니.. 제목 만든사람 대체 누구....;;  
20170629,1,아무리영화가 좋다해도 전범기 들어간 영화는 쓰레기다나치문양 들어갔으면 OO발광했을거를;;어유노답쓰  
20170629,10,화려한 영화들 속에서 정말 보길 잘했다 싶은 영화.영화가 뒤죽박죽하지 않고 웃음코드도 있으면서 감동코드까지 있어서 좋았다. 부모님과의 관계도 다시한번 생각해보게 만드는 영화  
20170629,10,여주 연기력이 엄청남 오랜만에 웃기고 감동적인영화봄 ㅠㅠㅜㅜ다들 보세요 진짜 시간가는줄모르고 봄  
20170629,10,여주 연기력이 엄청남 오랜만에 웃기고 감동적인영화봄 ㅠㅠㅜㅜ다들 보세요 진짜 시간가는줄모르고 봄  
20170629,8,남의 이야기가 아닌....  
20170629,10,"인사이드 아웃의 라일리가 생각나게 만드는 영화였습니다. 취업길 헤쳐나가는 이때에,  다시금 학창시절을 잠시나마 뒤돌아볼 수 있어 즐거웠습니다 ^^)  "
20170629,9,트랜스포머 를 포기하고 본 보람이 있다!영화보는데 빵빵 터지면서 유쾌하게 본게 얼마만인지..주인공의 남자친구가 한국인인 설정..!할리우드에서 우리나라의 위상이 얼마나 높아졌는지 감격스럽다.ㅎ  
20170629,10,진짜재미없는데 그냥저냥...  
20170628,10,보길잘했다 울다가 웃다가  
20170628,10,보고 너무 힐링되고 공감되는 부분이 많아서 많이 웃고 울었습니다 여자 주인공이 연기 너무 잘하네요ㅋ 그러나 아버지의 죽음은 좀 황당했어여 ㅎㅎ  
20170628,10,이렇게 사랑스러운데 친구가 한명밖에 없었다니...  
20170628,10,항상 인간관계에서 트러블을 겪는 나로서는 더할 나위 없이 가장 공감되는 영화. 더 이상 비참한 현실에 체념하지 않고도 스스로 더 나은 삶을 살아갈 수 있게 된 네이딘을 축하하며.  
20170628,10,주인공의 주변에 좋은 오빠가 있어서 다행이네요 오빠가 넘 킹카  
20170628,10,"달콤쌉싸름한 초콜릿같은 영화.어디로 터질지 못하는 갑툭튀 여고생의 파란만장 스토리.너무 공감되고 같이 웃고 울고.. 네이딘 마지막 웃는모습 넘 이뻤다.  그리고, 우디 헤럴슨 연기는  언제나 옳다.  "
20170628,6,방금 보고 왔어요. 음... 그냥 킬링타임용으로 딱인 영화 같아요. 문화의 날이라서 그냥 오랜만에 기분 전환 했다고 생각하려구요  
20170628,10,배우들의 연기력이 마치 다들 사춘기로 돌아간듯한 모습을 자아내서 좋았다.  
20170628,8,재밌긴한데 마무리가 너무 간단하게 끝나버리는 느낌..  
20170628,5,로맨틱 코미디물이라고 보는게 맞는듯. 여주의 말재간과 행동력 정도면 학생 회장도 무리가 없다... 게다가 주변 인물들 이거 뭐....  
20170628,9,성장통 이야기. 순수하고 진심어려서 좋다  
20170628,9,재밌고 여주의 연기가 인상깊었음 평범한 어린시절을 보낸 나에겐 이해하지 못할 행동도 많았지만 미국에서는 이게 현실이겠지? 산만하고 산만하지만 진솔하고 사랑스러운 영화  
20170628,1,개봉날짜가 28일 인데 개봉관이 없네요 ;;;  
