0,1,2
20171207,9,단지 사랑받고 싶었을뿐 다가가는 방법을 몰랐던 10대의어린투정 영화 한번쯤 다들 그생각하지않을까 세상에서 내가 제일 불쌍한것같다고  
20171205,10,평점이 왜이렇게 낮냐..? 영화가 안끝났으면 했다.. 너무 재밌어서ㅜㅜ  
20171203,6,교훈 : 남자를 잘 만나야 한다.  
20171130,9,한글 제목 그따위로 지은 이유 좀...  
20171130,10,재밌고 공감되는 영화.  
20171127,9,꽃다운나이 17.. 그 시기의 심리와 상황들을 너무 잘 보여줘서 17세로 돌아간듯 했다 ㅋㅋ 여주가 너무 상큼하고 이쁘네  
20171124,10,여주 말하는거개웃김 꼭보세요!  
20171124,8,지나고 나면 민망하지만 그 나이에는 죽을만큼 절실하다.  
20171124,10,"본인 성격이 너무 주인공과 똑같고 지금 겪고 있는 문제랑 아주 똑같아서 공감이 안 갈 수가 없었다. 사실 어떻게 해야 할지, 이런 것에 대해 갈피를 잡은 것은 아니나 공감이 되어 그것만으로도 큰 힘이 된 영화였다.  "
20171124,7,또라이여주  매력있네 ㅎㅎ  
20171124,10,너무너무 재미있어요 영상미도 좋고!!  
20171123,8,여주뿐만 아니라 등장하는 모든 인물이 다 성장을 하게되는 영화. 엄마와의 관계가 특히 더 공감이 가네요 재밌게 잘봤어요  
20171123,1,요즘 중고등학생은 저러고 놀아요? 난 30이 넘고 애 낳을 생각이 있는데 저런 지저분한 말들을 입에 담으며 살 딸이나 아들을 생각하니 머리가 아픈데... 펠라티ㅗ? 펠라치오? 라는 말도 이 영화에서 처음 들음. 저런 지저분한 말들이 15세관람가?  
20171123,10,어윈... 멋있어요 이마라인 넓은 거 빼고 완벽ㅋㅋㅋ  
20171123,10,내인생영화..재밌음  
20171123,6,이 또한 다 지 나 가 리 라 . . . ; ; ;  
20171123,8,재밌네. 근데 한국제목은 왜 저모양이지 제목만 보고 2000년대 초반 영화인 줄 알았다 제목 짓는 센스가 왜저래  
20171123,3,문화차이를 받아들이기가 어렵다.  
20171123,10,여주가 너무사랑스럽고 전체적으로너무 좋았어요  
20171123,10,다른나라에서 도플갱어를 마주한 느낌  
20171120,10,지금의 나에게 꼭 필요한 영화.그리고 흠잡을 데 없이 완벽했던 영화.  
20171120,9,"17살, 얼마나 빛나는 나이인지 그땐 모르지...  "
20171118,10,와진짜 청소년야기일줄알고 망설였는데 리얼팩트 재밌음 지루할틈없이 웃기고자연스럽고 짱  
20171116,6,내동생이었으면... 최악!!  
20171115,10,진짜 원래 영화보고 리뷰 같은거 안하는데 가볍게 보려고 햇다가  주인공의 이야기가 저랑 너무 비슷해 주인공의 오빠도 다른 사람들도 다 자기의 마음을 숨기며 괜찮은척 살아가는게 현실적이고 영화의 마무리도 너무 맘에 들어요  지금까지 본 영화중 넘버원임!  
20171115,1,이해할수 없는 미국 정서. 주인공 싸이코같음 완전 민폐캐릭터.  
20171113,10,공감이 많이 되었던 영화 교훈과 감동 웃음 모두를 겸비한 영화라고 생각한다  
20171112,9,세상에서 내가 제일 불행한 것만 같고 끝없이 자기 부정하게 되는 사춘기의 모습을 잘 그러난 영화. 근데 솔직히 오빠랑 친구는 나도 싫더라..주인공이 오빠때문에 비교 당하고 열등감 가진거도 있는데 다 가진 오빠가 유일한 친구마저 뺏어갔으니 화날만 하지  
20171112,5,한국제목 찰떡같이 잘어울리는 여주인공... 말그대로 OO발광을 한다. 저런 딸 있으면 미치지 않을 엄마 없을듯. 난 이렇게 미친 사춘기를 보내질 않아서 그런걸까 아님 한국정서와 너무 안맞아서 그런걸까 공감은 1도 안되지만 재미는 있었다.  
20171112,10,공감되고 사랑스러운 영화  
20171104,8,여주인공이 사람 속 잘 뒤집어 놓지만 단순해서 좋음  
20171031,10,난 이런 성장영화가 너무 좋다. 부국제에서'포큐파인 호수'감독에게 관객이 이 영화와 비교하며 질문했던거 생각난다. 역사 선생님 캐릭터 귀엽다.  
20171030,6,의외로 좀 밋밋한 영화.  
20171029,10,"십여년전 겪은 사춘기가 생각나는 영화. 겉으로는 잘 지내는 척 가면쓰면서 세상에 혼자 남겨진 것 같고 불행하다고 생각했는데. 네이딘에 공감하고, 또 네이딘으로 인해 힘들어하는 주위사람에게도 공감이 된다. 엄마 사춘기때 힘들게해서 미안해요ㅋㅋㅋㅋ  "
20171026,1,찐따가 왜 찐따인가를 보여주는 영화. 이 영화가 재밌다고 하는 사람들은 하루에 고구마 100개씩 먹는게 취미인듯  
20171022,7,한글 제목으로 누가 했는지 모르겠지만 ㅋㅋ 참 제목대로 ㅈ ㄹ 맞더라 ㅋㅋ  
20171022,9,나도 나랑 맞는사람이 별로 없어서 친구를 못사귀는데 이 영화의 주인공이 내 친구같아서 기분이 좋았다..  
20171021,7,너무 재밌는데 전범기가 너무 많이나와서 빡침극중에서 남주가 한국인인데 교실에 떡하니 전범기를 붙여놓다니... 이건 좀 아니다 싶었음  
20171021,8,더 어릴때 봤으면 좋았을 영화. 그러나 지금이니까 이해할수있는 영화  
20171020,10,전체적으로  다좋은 영화ㅜㅜ꺅영화속 사람들이 불쌍해서 울어는봤지공감 하면서 울어보긴 처음이였다  
20171016,9,예고편에 낚였다. 생각보다 깊이있는영화. 한소녀의 이야기지만 성인에게도 메세지가 있는영화다  
20171014,5,진짜 후반까지 암걸리는줄... 보다 몇번이나 끌뻔했는지... 틴에이저 무비 좋아하는데 이건 나랑은 안맞음  
20171014,6,방황과 민폐는 구분했으면한다. 현실은 자기맘대로 받아들이라고 존재하는게 아니다. 모든주변환경이 시궁창이면 그원인은 실질적으로 자신에있음을알고 주위에 누가됨이없이 받아들여야되며 17살이면 그걸알만할나이다. 이영화가의 마지막 메세지는 그런 의미일것이다  
20171013,9,재밌게봤어요. 여주 매력있어요!!  
20171010,6,그렇게 새로울 것은 없었던 영화. 한국 재목이 더 와 닿았다 ㅋㅋ  
20171010,8,재밌어요 ㅋㅋ 어윈이랑 네이딘이랑 정말 잘 어울리는 것 같네요 ~~  
20171008,9,"엄청 유쾌한 영화일줄 알고 기대했는데, 생각보단 조금 무거운 느낌?  또한 한국이랑 정서가 조금은 다르기에 완벽한 공감이 가진 않지만, 그래도 딱 그 나이대 10대들이 고민할 법한 통통 튀는 이야기들이 웃음과 공감, 그리고 소소한 감동을 주기도 했다.  "
20171008,10,영화판 : 호밀밭의 파수꾼  
20171007,10,"내 자신을 억아바는게 아닌, 스스로가되어 표출함의 중요성을 깨달았따  "
20171006,10,아 친구맞냐 친구젤짜증남  
20171005,10,진짜 재밌게 잘 봤네요 ! 여주 넘 이쁨 ㅜ  
20171005,1,도저히 보다 보다 재미없어 못 보겠다.  
20171004,8,여주가 한녀기질이 있네 주위사람 광역 어그로에 동양남닉 동시 추파에 지가 유혹해 놓고 나쁜놈 만들기 오지고 양녀는 저게 사춘기때만이지만 한녀들은.. 닉정도면 상위 1퍼인데 주제를 알아야지 주위가 성인군자라 저렇게 해피엔딩이지 현실은 폐기되도 할말 없다  
20171003,9,스토리나 전체적인 메세지도 좋았어요  
20171003,8,이 세상 모든 네이딘을 위한 영화  
20171001,9,공감가는부분도많고 재밌어옹 시간 가는줄 모르고봤네  
20170930,6,많은 사람들이 공감할 수 있는 소개라서 좋았던 영화  
20170930,3,문제는 제시 했으나 해결책은 없었다.도데체 어딜봐서 성장영화 인거지?  그냥 코미디인데....  
20170929,4,진짜 여주가 OO발광을한다  
20170927,9,유쾌하고 만족스런 성장영화  
20170926,10,9900원 할 때는 그 정돈 아날 거 같아 참다BTV 2000원으로 가격 내렸길래 킬링타임용으로 시청~그냥 9900원 할 때 볼 걸(..*나의 17세 그리고 현재를 돌아보게 하는 영화!  
20170922,10,급하게 끝난 결말이 조금 아쉬웠지만 간단히 생각을 바꾸면 쉽게 모든게 바뀐다는 의미도 가지고 있을듯....몇년간 본 영화중 최고  
20170920,9,어원김 기엽다! 피식피식 웃음이 가는 영화였음!  
20170916,10,아 오랜만에 사람감정 물씬 느껴지는 영화봤네요~ 여주가 연기를 진짜 잘하네요  
20170916,2,단점도 많지만 장점도 많은 러블리한 작품  
20170916,9,이런류의 영화를 안좋아하는데 꽤 재밌게 봤음. 암덩어리 여주의 심정이 어느정도 이해되기도하고 매력있음.  
20170916,2,다른 하이틴보다 노잼 진짜 보다보면 답답함 주인공이 찌질이로 시작해서 찌질이로 끝나는 영화 주변사람들이 도움을 준다기 보단 방치하는 느낌이 들며'너만 힘든거 아니니까 가만히 있어' 그런느낌 욱일승천기도 맘에 안들고 한국인들을 일반화하는 모습 극혐  
20170915,9,잼있어요!! 고민많은 여주인공 딱 고나이 아이네여 ㅎ  
20170914,9,배우들이 연기도 잘하고 음악이나 촬영기법도굉장히 좋앗고 나의 10대를 회상할수있었던 영화였던거 같다  
20170913,8,청소년기의 고민과 성장을 재미있게 그려냄..해일리스테인펠드의 연기도 너무 좋았음  
20170912,10,너무 재밌고 눈물 엄청 흘리면사 봤네욤 최고에요  
20170911,10,굿~~~~잼있네여 ㅋㅋㅋ  
20170910,10,"나랑 비슷한 심리를 가지고 있어서 그런가, 보는 내내 울컥한 장면이 많았다.  "
20170910,7,"""부끄러움은 우리의 몫""  "
20170909,2,영화내용: 패륜아 같은년 잘못 세상에 싸질러서 그래도  키워보니 한술더떠서 피해망상에 메갈 워마드 꼴페미 에다가 보적보로 자라서 OO 골때리는 영화  
20170908,9,좋은 영화네요^^...  
20170907,3,이거 강제개봉 시킨애들  제 정신이냐?  
20170906,10,기분좋은 영화 17세 사춘기처럼 롤러코스터인 영화 30대가 봐도 마음이 뭉클합니다 ~  
20170904,10,영화팬이 영화에 대한 기대치를 충족 싶은 영화로써는 갸우뚱.드라마로는 너무나 완벽하다. 가장 크게웃고 만족한 귀한 장르 영화.심슨 팬이라면 정말 좋아할거란 생각.리사의 고교 시절을 보는거 같기도 하고 누구나 공감가능하지만 흔치않은 좋은 이야기  
20170903,8,한글영화제목이 왜 이따구냐면 ㄹㅇ여주가 OO발광임  
20170903,6,진짜 이기적이고 자기중심적에 예의없고 생각없고 피해망상에 가득찬 지가 못난게 세상때문이라고 생각하는 생각없는 17세 찐따이야기 보다가 암걸릴뻔  
20170903,1,"네이딘이 세상을 마주할 수 있는 열쇠가 결국 남자때문이였고, 네이딘 친구 크리스타도 남친으로 인해서 세상과 연결됨 무슨 이런 영화가 있지?.. 솔직히 초반엔 네이딘이 웃겨서 많이 웃었는데 갈수록 어떻게 네이딘이 극복해낼까 궁금했는데;; 정답이 남자라니  "
20170902,6,꽤 괜찮은 영화이지만 아쉬운점 세가지  1. 제목번역  2. 두 친구 모두 남자를 통해서 세상과 연결된다는 점. 3. 주인공 옆에 부자에 능력있고 다정한 남자가 대기해 있는 점... 남자인 내가 봐도 좀 아쉬움.  
20170901,10,정말 배우가 연기를 잘해서 몰입하기가 쉬웠음외롭고 힘들때 보면 같이 웃고 울 수 있는 좋은 영화다ㅠ인생영화리스트에 적어야겠다  
20170901,7,손 쉽게 감동엔딩으로 몰아가지 않는 연출이 마음에 든다. 지 무덤 지 손으로 파는 사회 부적응자 상돌아이에 답답해 하다 불현듯 성장기 나 자신의 단켠이 떠오른다. 저 정도까진 아니어도 누구나 비슷한 일부분 하나쯤 있을 거다. 여주 연기가 꽤나 볼만하다  
20170829,10,꼬맹이 연기 잘 하네..ㅋ  
20170829,9,개인적으로 선생님이 최고네요. 저런 선생님 계시면 애들 여럿 인간 될 듯...  
20170829,10,17세를 훌쩍 넘긴 나인데도 공감하면서 봤다 오글거리는 억지 교훈이 없어서 편하고 유쾌하게 볼수있었던 영화  
20170828,6,주인공이 비호감 덩어리라 보는 내내 참 가지가지 한다라고 생각했는데 다시 생각해보면 배우가 그만큼 연기를 잘했다는 생각이 든다  
20170828,9,모두까기 여주 짜증났지만 보는 내내 지루하지 않았음  
20170828,10,네이든 사랑스럽고 영화 정말 재밌어요!!  
20170827,6,내 동생이 저랬다면 진짜 머리 밀어서 절로 보내버릴듯..보면서 내가 숨막혀 죽는지 알았네.  
20170827,9, 영화자체는꿀임^^첫장면보고꺼버리려다가참고계속봤는데끝까지보길잘했다고생각함!!다만아쉬운부분?이해안가는부분은....친구오빠랑꼭그랬어야했는가....내가삐뚤어져서그런건지....나였으면걔랑끝까지말안했을듯....내가아니니까이렇게좋은영화로해피엔딩으로끝난거겠지뭐ㅋㅋ  
20170827,10,미국 청소년들은 저렇게 가족과 친구의 관계를 고민할때.. 한국 청소년의 대부분은 공부와 성적을 걱정해야하니 맘아프다.. 청소년들이여 국영수도 중요하지만 사람이 먼저 되소서  
20170826,10,재밌음 ㅋㅋ 주인공 매력있어♡  
20170824,7,'산다는 게 그런 거란다. 아가야.' 라고 다독여 주고 싶다  
20170823,8,자기만의 세상이 스스로 고독하게 만든다.  
20170823,5,"문화적 이질감 없이, 그시절이 공감된다. 영화적 임팩트는 없다.  "
20170822,7,이유없이 모든게 싫었던 시절..  
20170822,8,중간중간 진짜 내동생같고 한대 줘패고 싶었는데 정신차리는 꼴보니 그래도 흐뭇한 표정이 지어짐  
20170821,8,귀엽다~~헤일리 스테인벨트의 원맨쇼~  
20170821,8,우리말 제목을 저 따위로 지은 사람은 도대체 무슨 OO발광인가.  
20170821,9,공감 그것 하나만으로도 충분한 예쁜 영화.  
20170820,8,현실반영 영감이 되는 톡톡튀고 유쾌함과 생기발랄 하이틴 이다  
20170820,7,여주가 재미있게 연기를 했네요 그런데 동양인 남자가 나오는 시종일관 동양인 차별 또는 비하의 성격이 짙어서 매우 유쾌하지 만은 않았네요  
20170820,10,톡톡톡! 캐릭터가 살아 있다  
20170820,10,정말 매력적인 사춘기 성장 영화! 나 자신이 죽도록 싫었던 때가 있었던 모든이에게... ㅎ 그시절은 과거에만 있기를.  
20170820,1,"여주 극혐. 평범한 남학생 강간범 만들고. 좋은 엄마 쓰레기 만들고. 현실에 없는 완벽한 오빠의 배려와 이해 오직 그거 하나로 영화는 해피엔딩. 리얼이었다면? 여주인공 왕따, 고립, 성격 변태, 히키코모리, 폐인, 영화니까 귀여워 보이는거지.  "
20170820,7,"영화는재밌어요 근데 영화에계속보이는 전범기는 어떤의미죠 ? 설마 모르고 저걸 영화에넣었을리없고 한국사람이 부모님인 어원이랑 마지막이잘된걸로보아 일본을 비판하는 의미로 넣은건가요., 영화는 좋은데 계속 신경쓰이더라고요  "
20170820,9,하이틴 드라마 보는 기분ㅋㅋ 연기 잘하고 재밌었음 주인공들도 예쁘고 멋짐  
20170820,10,여주 진짜 사랑스러워. 나도 김어원같은 친구가 있었으면 좋겠다.  
20170819,7,그냥 저냥 볼만한듯ㅎㅎ  
20170819,6,그냥 미국 소녀 사춘기 끝  
20170819,7,누구든 상대를 이해하지 못하는 때가 있다. 그 해결의 첫 걸음은 바로 자기 자신을 인정하는 것부터. 네이든은 그 과정을 참고 기다려준 좋은 가족과 좋은 친구가 있어서 다행이야. 현실은 그러지 못한 아이들이 너무 많아 안타깝다.  
20170819,8,헐리우드의 전형적인 하이틴 물인줄 알았는데 생각보다 더 참신했다 네이딘 이뿌네  
20170819,10,훈제계란급 훈훈한 마무리 ㅎㅎ 선생님이 진짜 좋으신 분인 것 같다. 원제목인 17세의 끝도 괜찮지만 오히려 OO발광17세로 번역한게 더 전달력이 뛰어난 것 같다. 재밌는 하이틴 영화!!  
20170819,8,애키우기 힘들다.. 그래도 가족뿐..  
20170818,9,난 이런 영화가 웃기고 재미나드라.ㅋ 여주인공 사랑스러움. ㅎㅎ  
20170817,10,정말이지.... 굿입니다^^  
20170817,10,끄덕여지는 부분이 많아서 좋았는 영화  
20170817,10,고민없는 제목과는 다르게 17세 모든 방황하는 청춘들을 위하여~!  
20170816,7,어떤 잡종OOO가 번안 한글제목을 이따구로 지어놨냐?  
20170816,7,그런대로 볼만했습니다 제목을 왜 이렇게 지었는지 이해가 가네요 마지막에 해피엔딩이라 다행입니다  
20170815,9,모두가 재밌어 하는 건...공감!!..네이딘과 어릴 적 자신이 오버랩 됐기에..  
20170814,10,내가 본 영화중에 가장 공감 된 영화다.  
20170814,7,배부른 투정....그래도 성장영화는 귀엽다  
20170813,10,"10대 사춘기 소녀의 이야기를 잘 담아낸 영화같아요. 배우들 연기도 좋고 처음에는 네이딘이 왜저러지 했는데, 가족에게 마음을 열기를 점점 응원을 하게되었어요 :)  "
20170809,10,평점 처음쓰는데 이번년도 최고의 영화였음  
20170807,9,너무나 사랑스러운 스토리엿고 한편으로는 우리나라의17세와는 너무도다른 외국학생들의 저런자유분방함이 부러웟다  
20170807,7,"제멋대로에 엉망진창으로 흑역사를 만들어내지만, 결국 스스로 깨닫는 사춘기 시절의 어느 한 지점  "
20170806,8,공감이많이되영화네요  
20170806,10,성인이 봐도 공감이 많이가는 영화에요 지루할틈도 없고 잔잔하면서 좋네요 일요일 오후에 보기 좋아요 ~ㅎㅎ  
20170805,1,교실에 떡하니 전범기 뭐냐;;  
20170805,6,여주는 아무리 가정배경의 영향이라해도 좀 심함; 누가 그런 메시지에 진지하게 만나겠냐 오빠한테 열등감 폭발 그리고 왕따되니 한국인한테 가서 붙는거봐 막말오지고 아시안 고정관념 꽉꽉 넣고 걍 별로였음 배려심 부족 피해개줌 하지만 메시지 하난 ㅇㅈ함  
20170804,6,기대에 크게 못미쳤다. 우디 해럴슨 캐스팅은 왜한건지...  
20170804,8,"자의식 과잉과 열등감이 합쳐져 세상이 다 밉기만 한 10대 시절을 지나, 어른이 되어 이제 세상과  소통하는 법을 알게 된 지금- 비교하며 보니 재미있네요.  "
20170803,10,만약 저런 여자가 내 옆에 있었더라면 바로 친구로 사겼을거다.  
20170803,9,재밌음~~~~ㅋㅋㅋ  
20170802,8,17살의 나로 돌아가고싶다  
20170802,9,그  나이대의 감정들을 예쁘게 잘 풀어나간 영화였다 :)  
20170802,9,여주 오빠 절친 한국친구 선생님 누구하나 매력이 없는 사람이 없다..십대의 방황을 이겨내는 잼나는 영화였다  
20170801,5,하이틴 영화다운 스토리와 해피엔딩~   한방의 깨달음은 역시나 한계~  
20170801,10,"힘내,네이딘. 넌 너무 사랑스러워! 이 영화는 네이딘을 응원하게되는 영화 ㅠㅠ 처음 쓴다  평점! 그리고 여기 한국인 나오는데 너무 좋다 ㅜㅜㅜㅜ 엉엉 여러분 볼까 말까 하면 그냥 보세요  "
20170801,10,누구나 한번쯤 겪었을 학창시절 감정의 변화를 잘표현한 영화.  
20170731,10,여자여자취향 영화 시간가는줄모르고 봤다 웃기고 설레고  
20170731,10,아무생각 없이 봤다가 재밌게 보고 나왔어요  
20170730,8,제목이 왜이럼???ㅇ?  
20170729,8,"다들 지나가봤으니 알게다. 그 시절 그 나이 때는 깊은 공감까지 갈 필요도 없고 사실 그들이 하는 말을 들어주는 것, 그리고 그런 사람이 있는 것만으로도 꽤 많은 문제가 해결될 수 있다는 사실을.  "
20170729,3,염병해도 주변에 좋은 사람만 있어서 좋겠네! 배고프면 고기먹으면 되지않냐고 말하는  누구같은데....  
20170728,10,재미있어요. ㅎㅎㅎㅎ  
20170728,10,2000년도 초반 하이틴영화 명작이 여럿나온 이래 간만에 재밌고 발랄하면서. 의미도 깊은 하이틴영화가 나온듯 하다.  
20170728,10,꿀잼잼ㅜㅜ알렉산더칼버트 짱좋하...  
20170728,8,배우들 연기 너무 좋았고 생활속에 자연스러운 웃음을 유발해서 좋았습니다. 하지만 15세가 관람하기엔 조금 무리한 설정이 있지 않나 싶기도 합니다. 포스터 제목과 문구도 잘 넣은거 같습니다.  
20170727,9,욱일기는 스텝 ? 중 일본인이 있더라구요.누가 욱일기 지적해서..딸과 끝장면에서 문자 나눌 때 썼다 지웠다 하다 결국 오케이! 이게 이 영화 핵심같네요..선생님 은근 멋지고..^^한국인 남친 어버버 진심 짜증나게 묘사했구요  
20170725,6,철없는 십대 사춘기 어른이 대기위한 준비과정  
20170725,7,"기/승/전 좋았는데, 결이 허무하게 급마무리.  "
20170724,10,예민한 사람들이 보면 공감할 것 같은 영화  
20170724,10,너무 공감되고 재미있었음  
20170724,10,간만에 어릴쩍 기분 느낌.. 좋아하는 오빠랑 단둘이 있던 기억도 남..ㅋ 보는내내 설레고 귀여웟음 간만에 영화다운 영화봄  
20170723,5,재미는 있지만 주인공 죽이고 싶다  
20170722,1,영화초반교실씬에 전범기 소위욱일기가 겁나거슬림낙일기라는소리도있으나 딱봐도 그냥전범기  
20170720,10,어원은 매력터지고 네이딘은 진짜 말할 수 없을만큼 매력이..완전 좋네  
20170720,10,여주 네이딘 넘나 예쁘고 영화도 재밌고  
20170720,4,그냥 봄. 그냥 돈아까워서  
20170719,6,제목이 큰몫 차지하는데 누가 지었냐 ㅋㅋ 절대 돈주고안본다  
20170719,9,여자가 먼저 하겠다고 해놓고 통수치는데 남자잘못임?  
20170719,10,인생영화가 될거 같다!  
20170718,10,보면서 내내 즐거워요! 머리식힐겸 보면 정말 행복해질 수있어요!!!ㅎㅎ  
20170718,9,'너의 뇌수술은 성공적이었다'ㅋㅋㅋ  
20170718,7,"재미는 있는데 인종차별적인 요소도 있고,  마지막은  끼리끼리 ...편견을  갖고 있는 소녀가  그무리에 끼게됐는데  과연.  "
20170717,9,원제목 보다 한국어 번역 제목이 더 좋을수 있다니...  
20170717,10,우디해럴슨의 묵직한연기와 여주의 러블리한모습 짱임ㅎㅎ여주 연기진짜잘한다 나중에크게될듣 비긴어게인에서도 ㅋㅋ마크러팔로딸로나왔었군  
20170716,7,여주가 너무나도 사랑스럽다  
20170716,10,정말 좋은 영환데.. 한글제목 휴  
20170716,10,청소년에게도 어른에게도 재밌는 영화  
20170716,8,가끔씩 이런 영화가 보고 싶을 때가 있다.  
20170716,7,"누구나 그 시기를 지났기 때문에 누구나 웃으며 공감할 수 있는 사춘기 이야기. 불편하게 보여주거나 현실성 없이 그리지 않아 더욱 몰입이 되고, 헤일리 스테인펠드는 좋은 연기를 펼친다.  "
20170716,10,꿀잼. 보는 내내 옛 학창시절 생각이 문뜩 떠오르는 영화  
20170715,8,Everyone in the world is as miserable and empty as I am.They're just better at pretending.정말 그럴까? 란 생각이 들면서도  누구나의 비밀이라는 생각이들었다.  
20170715,8,한글제목을 진자 OO발광같이 지었네;; 무슨 8090년대에 배우 이름 내걸던 시절도 아니고;;2017년 맞음?  
20170714,10,재밌다. 누구나  한번쯤은 겪는 일.  
20170714,2,제목 참 ㅈㄹ같이 지어놧네  
20170714,7,그래 가끔 하늘을...아니 ..하이틴 영화를 보자..나쁘진 않다~  
20170714,10,할리우드 영화가 마냥 크기로만 승부한다고 조롱할 수 없는 것은 이런 빛나는 영화들이 끊어지지 않고 나오기 때문. 일상 속에서 느끼는 공감되는 감정과 에피소드들을 콕콕 집어내 관객들과 소통하는 이런 영화들은 미국이 왜 영화 강국인지를 잘 보여준다.  
20170713,3,대주려면 대주든가 진짜 여자 오함마로 뚝배기 깨고싶었다.. 그리고 어윈은 한국인인데 노골적으로 반에 들어올때 마다 시선강탈하는 욱일승천기... 무슨 의도냐?  
20170713,6,평점에 비해 그냥 그랬음...마무리가 좀 억지 급마무리 느낌나고...  
20170713,1,이상한 제목붙여서 싸구려 영화처럼 만들지말기를... 영화 제목 로고도 진짜 구리고 포스터 조잡하게 편집한것도 진짜 별로다  
20170713,8,킬링타임용으로 생각하고 우연히 봤는데 보길 잘했다.  
20170713,10,17살인 저에게는 공감이 많이갔던 영화 . 저뿐만 아니라 인간관계가 힘드신 모든 분들이 보면 좋을 것 같아요 .  
20170713,2,노잼 남는게 없음....  
20170712,10,좋다가 안좋고 다시 좋고 그것이 인생  
20170712,9,"어쩌다 보니 스파이더맨, OO발광 17세같이 성장드라마를 연달아 보게 됐는데, 이게 더 느낌을 많이 주네요. 정말 성격의 끝(Edge)를 보여주면서 아슬아슬한 말들을 쏟아내는 게 요즘의 10대들을 보는 것 같았습니다.  "
20170712,9,재밌어요유치한 하이틴 영화라고 느껴지지 않았어요!추천합니다!  
