0,1,2
20170628,10,꿀잼이에요 ㅋㅋㅋ 전 왜 OO발광 17세인지 알 것 같아요! ㅜㅜㅜ영화보다가 웃고 공감되서 울고 이런 영화는 처음인둣  
20170628,4,이래저래 나는 방황했고 방황을 끝냈다는 웅얼거림  
20170628,9,어른이 되면 잊혀지고 돌아보면 부끄럽지만 가장 기억에 남는 나이. 17살이라는 거울.  
20170628,10,성장통이 마냥 17세에게만 있는게 아닌듯이 어른영화같은 하이틴영화  
20170628,10,이런 하이틴영화 극장에서 보는거 넘 오랜만이라 좋다 여주인공은 윤소희 닮았고 여주친구는 에이핑크 보미 닮았다 ㅋㅋㅋ  
20170628,7,세상을 마주하는 태도를 갖기 까지 겪어야 하는 성장통  
20170628,10,지금의 나 그리고 17살쯤의 나를 보는 것 같아서 진심으로 네이딘의 극복을 응원했던 영화.  
20170628,7,제목 작명수준이 뭐 섹X 마네킹 급...  
20170628,7,내가 17살로 다시 돌아가면 그때와는 다른선택들을 할까?라는 생각을 해봤다. 대답에 확신이 생기지 않았다. 난 아직 17살인가 보다  
20170628,10,다시 17살 그시절로 돌아가고 싶다...  
20170628,9,"Sns로 자신을 포장하는, 남의 눈의식하는 사람들에게 진정한 자신을 위한 인생이 무엇인지 알게해주는영화 나에게도 저런오빠가 있었으면..영화는영화  "
20170628,9,여주가 진짜 연기를 잘하내요 앞으로 스타성이 높은 배우인뜻!!  
20170628,8,로맨틱 코미디가 아닌 외로운 청춘 성장기. 해피엔딩의 결말이 한국계 남자친구라니 (돈밖에 모르는 슈퍼마켓 주인으로나 등장하던)한국인에 대한 이미지가 많이 좋아졌구나 싶기도.  
20170628,10,영화는 정말 재밌다. 근데 제목 번안을 이따구로 해야하니? OO발광이 뭐니? 참내..  
20170628,9,간만에 재미와 작품성을 겸비한 탄에이저 무비  
