0,1,2
20170713,10,관람객추ㅠㅜ 잔잔한 영화..  
20170713,8,관람객아무생각없이 보면 괜찮은 파괴신영화  
20170712,10,관람객어른들이 꼭 봐야할영화입니다  
20170712,10,관람객볼만했네요 잘봤습니다.  
20170711,2,여주  민폐...짜증남ㅋㅋ 재미없다소리잘안하는데재미없어요  
20170710,5,관람객기대 수준 이하입니다..  
20170710,8,관람객괜찮았어요~ 결말이 아쉽습니당  
20170709,1,이걸.. 내가..결재해가며 봤다..센과치히로 많이보고 짝퉁찍어낸느낌.. 도데체가 뭘 얘기하고싶은건지 모르겠씀!!  
20170709,9,관람객유치할수도 있는데 나름 기억에 많이 남는 매력있는 애니메이션 영화였어요 ㅎㅎ  
20170709,2,지브리애서 고소 안당하는게 신기함....키키가 나오는 줄 알았음  
20170709,5,관람객그냥저냥 추 정말로 짜안..  
20170708,1,어우... 안대요 이건  
20170708,3,창문열고 소리지르고싶다. 고구마 한박스 먹은느낌..  
20170707,6,관람객노래에 빠져들었다 내용은  
20170707,8,"관람객슬프긴한데 슬프기만 하다. 누군가는 계속 희생을 하다가 끝나서 더 슬프네, 눈물이 많은 편이라 울긴 많이 울었다...  "
20170707,7,관람객그럭저럭 봤어요  가족끼리요주변이 넘 한정된것 같아요ㅡㅡ  
20170706,8,관람객아이하고 보기엔  조금어려운 작품이네요  
20170703,6,관람객조금은아쉬운애니메이션이었네요  
20170703,6,블라인드 테스트 해보고 싶다. 일본어로 더빙한다음 사람들한테 보여주면 어떤반응일지 ㅋ 김치년들이란  
20170702,9,펑펑울었습니다.. 저는 너무 재밌게봤어요 정말 희생과 희생 이야기...  
20170702,10,관람객소년을 살리기 위한 소녀의 희생  
20170702,1,중국 고전에서 왜 센과 치히로에 나오는 캐릭터들이 깜짝등장 도대체 남자역할 맡은 중국 가수인지 배우인지 빠순이들이 10점 테러로 점수가 높았다. 진짜 이런 답없는 지뢰작에 만도 못한 쓰레기가 작품이 원작은 수작업해도 안걸렸는데 cg범벅인 작품이.ㅋㅋ  
20170701,10,진짜 내 인생 최고의 영화였다.  
20170701,5,관람객재미있기는 재미있었다  
20170701,3,관람객중국 감성이 물씬 풍기면서 손발이 오그라들지만 볼만함.  
20170630,6,관람객생각이 많아지게하는 영화네요 하지만 영화는 재미 없었음  
20170630,6,중국인들이 붉은색좋아해서 붉은고래인가  
20170630,9,관람객생각보다 너무 좋았음. 내용적으로 ㄱ영상적으로도.  
20170630,1,내용없이 지브리따라한다고 짜집기..참...내용이 개연성도 없고ㅋ총체적 난국인 애니메이션임ㅋ  
20170630,10,관람객즐겁고 감동이 많은..  
20170630,7,관람객남자애 불쌍했당....  
20170630,10,관람객생각했던거보다 재미잇고 감동적이네요  
20170630,9,춘의 사랑이 사랑임을 몰랐기에 곤에 대한 죄책감때문일거라며 시작한 영화는 첫사랑의 어리숙함이 성숙함으로 나아가는 과정이었다. 소녀와 소년의 사랑은 완벽할 수 없으며 실수 투성이다. 그게 정상이다. 동화같지만 슬프고 아픈만큼 아름답다.  
20170630,1,3D애니메이션은 미국 2D애니메이션은 일본 ..한국 중국은 아직 한참 멀었습니다  
20170630,8,관람객흠... 이기적인 여자아이.  
20170630,1,이거 안  본 뇌 삽니다....  
20170630,6,영상을 보다보면 센과 치히로의 행방불명이 보고 싶어진다. 어른스럽고 똑똑한 아이가 아니점을 감안하고 보면 덜 불편할 거 같지만 그런걸 제외하고 보기엔 머리가 너무 굵어지지않았나 싶다.  
20170628,1,여주때문에 고구마천만개먹은거같은느낌 남자한테 눈이멀어 다망치는스토리 추는왜죽이냐 개빡치네 그저 여주머리에는 곤밖에없음  
20170628,10,곤(땅)만 바라보는 춘(봄).춘(봄)만 바라보는 추(가을).추는 봄의 땅(생명의 시작)을 살림으로써 봄을 이해하고 이름처럼 생명의 결실(부활)을 얻는다.  
20170628,1,나의 붉은 개잡짬뽕  
20170628,5,관람객일본 작품을 대놓고 베껴서 만든 중국영화. 중국스러운 것이라고는 빨간색과 중국어뿐인 카피작.  
20170628,9,섬세한 영상미와 더불어 이야기의 기반과 의미가 인상적입니다. 편집된 것 같은 스토리도 넣었으면 훨씬 더 좋은 이야기가 되었을 것 같습니다. 삶과 죽음 그리고 희생에 대해 생각해볼 수 있는 시간을 마련해 준 것 같네요.  
20170628,7,"관람객지브리 스타일로  차별화된 매력은 없었지만, 낙후되었던 중국 애니메이션이 발전하는 계기가 되어줄 작품임에는 틀림 없다는 느낌입니다. 아름다운 영상미가 돋보였습니다.  "
20170628,1,일본에 가장 잘하는걸 중국이 짝퉁으로 만들었다. 그뿐.  
20170627,1,지루하고 지루하고 지루했다  
20170627,9,관람객중국이 이제 애니메이션도 잘 만드네요. 프리윌리와 센과치히로는 섞어놓은 듯한 영화였어요. 츈 진짜 개핵철벽녀. 츄 개핵까임...불쌍한 츄  
20170627,1,정말 이 영화는 말이 필요없다  
20170627,9,하이큐보단  재미있게봐서  9점  
20170627,2,관람객감정이입하는데 조금 어려웠던 영화!  
20170626,10,전체적으로 이야기가 너무 긴편인것만 빼면더빙도 보고싶은 다시보고싶은 영화  
20170626,5,관람객지루햇~~!~!~!~!~!~!~!~|~}  
20170626,2,노래만 만드는데 12년 걸렸나보다. 생각하면 할 수록 별점 5점이나 줬던게 아까워 다시 고칠 정도. ost 덕분에 2점 줍니다..  
20170625,9,"관람객감동적이었습니다. 스토리 규모 자체가 크고 장황하게 시작했다가 다소 급하게 마무리한 느낌도 들지만, 참신하다고 느껴진 부분도 많고, 보는 내내 한편으로 마음도 푸근했어요.  "
20170625,10,이 영화를 보고 중국은 대단한 나라라는걸 느꼇다.  쥐어짜내는 억지 감동을 만들어내는 일본애니보다  이 영화처럼 감정표현을 잘 소화시키고 꽃말하나하나 까지 디테일 하게 챙기는 부분에서 중국을 다시 보게됬다. 추 너무 멋있었고 진짜 감동적이었다...  
20170625,2,"기괴한 디자인과 보기싫은 스토리만 있는 괴작. 갑툭튀하는 설정과 전혀 이입안되는 여주의 언동이 이를 배가시킨다. 헌신적인 추에게는 조금 마음이 가지만 그외엔 무슨 의미인지 알지도 딱히 알고 싶지도 않은, 그저 따분한 중국식 판타지세계만 보여주는 영상.  "
20170625,1,이런 애니를 기대하고 보는사람들이 더신기 예고편만봐도 토나오는 지브리 따라한 애니더만...12년동안 지브리 따라하는 짱깨 클라스 유사인류..어디가겟냐  
20170625,1,별 반개도 아까운 그런...  
20170624,10,따뜻한 내용이였어요~ 좋네요  
20170624,1,"""나의 잃어버린 2시간 "" 왜 마이너스평점은 없나...사전 검열을 통해 수입 및 배급을 막았어야 하는 영화. 나의 붉은 뿔달린 날치. 혹은 나의 지갑과 시간 도둑  "
20170624,10,기대하지않고 보았는데 생각보다 훌륭했습니다. 극중 개연성이 다소 떨어지기는 했지만 아름다운 미장센이 계속 여운에 남네요.  
20170624,7,관람객스토리가 크게 재미있진 않네요.  
20170623,6,원래 중국작품은 생각이라는걸 안해서 뜬금없는 경우가 많음.  
20170623,10,관람객나의 붉은 고래♡ 뒤에 쿠키영상있으니깐 꼭꼭! 보세요!  
20170623,1,영화보다 암 걸리고 싶으면 추천함  
20170623,7,관람객그냥 그럭저럭.. 잼나지는 않았어요...영화관에서 보긴  아깝단 생각이..  
20170623,1,영화보다가 뛰쳐나오고 싶었던 적은 처음.  
20170623,1,보고나서 황당한 영화는 처음이었다. 분명 영화 초반까지는 신선한 세계관 설정에 재미있었는데 그게 끝이다. 연출도 정말 조잡하고 세계관이나 인물 설정의 부실함이 그대로 드러난다. 내 돈 으악  
20170623,1,진짜 쓰레기이다.. 내용이 뭔지도 모르겠고..영화를 관통하는 주제가 없다.  
20170622,8,관람객무난한 평작 결말은 좋았다  
20170622,10,평소에 고래를 좋아해서 그런지 몰라도 진짜 여태껏 봤던 영화(애니)중 제일 재미있었음 ㅜㅜ 물론 추가 안타깝고 여주가 답답했지만ㅜㅜ 또 보러가고 싶은 영화 ㅜㅜ  한중일 합작이라고 들었는데 중국 일본느낌은 나는데 한국느낌은 찾아볼 수가 업어서 아쉬웠음  
20170622,5,관람객무슨 스토리인지 모르겠다..  
20170622,2,뭔가만들다가 이상하게되버린영화  
20170622,10,관람객중국어 더빙 위화감도 없고 굿!  
20170622,2,이 영화를 12년간 만들었다고? 12살이 만든 게 아니라?  
20170622,8,관람객만남과 이별에 대해 생각을 하게 만들었습니다  
20170622,8,관람객음... 추가 정말 보는내내 안쓰러웠던 ....  
20170622,7,관람객일본 애니메이션인지 알고 봤다가 중국 애니라서 깜놀..이것 저것 영화를 너무 짬뽕을 해놔서 깜짝놀랬어요.그냥 보기에는 무난해요  
20170622,1,12년이 걸리면서 내용이 너무 심오해지고 배가 산으로 간 느낌... 그래서 어떤걸 이야기 하고 싶은것인지.... 그래서 무엇에 감동이던 재미이던 교훈이던 남아야 하는것이 있을텐데 무엇이 남았는지  추가 주인공인건지 아니면 추의 사랑을 말하고 싶은건지  
20170622,1,어....음...그러니까  
20170622,3,관람객잼없..었음.... 하지만 그림은 이쁨  
20170621,8,관람객굿굿굿굿수ㅛ수ㅛㅜ슈슈슈슈ㅛ  
20170621,1,이 영화를 보며 애틋한 감정을 느끼려했지만 결국 남자친구랑 낄낄대며 봄  
20170621,7,관람객기대없이 봐서 그런지 지루하지않고 재밌게 봤어요. 그림도 좋았어요. ㅋ^^  
20170621,10,마지막 메시지가 좋았어요  
20170621,1,관람객무근본 영화의 한계를 보여준다  
20170621,3,그림은 좋으나 내용이 ....  
20170621,10,영상미 짱짱 스토리 개연성은 좀 없어도...오글거리고 심쿵하는 맛으로 봐따!!  
20170621,10,나의... 붉은... 고래?..  
20170621,3,평점 보고 갈걸..완전 후회했네요.... 휴...민폐 여주와 서브남주의 일방적 희생 지고지순한 사랑 이야기  
20170621,1,"우리나라는 예술을 탄생시킬 수 없다. 왜냐하면 진정 혼을담아내는 작품이 없거든, 애니도 면밀히 따지며 문학 예술이거늘, 이 나라 앞날이 답답하다.  "
20170621,6,"관람객스토리는 정말 이상하고, 그림체는 아름답다  "
20170621,2,관람객기대이하의 전개와 영상미  
20170621,1,짱깨들 영화가 뭐 발전이있나? 쓰레기지  
20170621,10,관람객뭔가 신비스러운영화..대박추천 감동적이면서 해피앤딩  
20170621,3,관람객여주 개발암 지브리짬뽕영화ㅎ같이 보러간 사람에게 미안한 마음  
20170621,6,12년짜리똥. 대작?글쎄다..  
20170621,10,최고입니다최고입니다  
20170620,8,"관람객나래이션이 몰입에 조금 방해됐지만,, 오랜만에 좋은 애니를 만났네요..  "
20170620,2,"이 영화는제 생각으로 11년은 놀고, 1년동안 제작한 영화 같다..'  "
20170620,1,역시 짝퉁국이 만든 짝퉁 영화.  왜 이렇게 평점이 높은지 정말 이해 불가  
20170620,5,관람객중국 특유의 세계관이 약간 불편하지만 어디서도 보지 못했던 느낌의 에니메이션임은 확실.  
20170620,1,역시 일본 애니메이션만 봐야겠네요...  
20170620,7,"평점이 생각보다 낮아서 긴장하고 봤는데 난 재밌었음!!확실히 지브리 느낌도 많이 나고 어색한부분도 있었던건 사실이지만, 여주의 민폐도 답답했지만ㅋㅋㅋ  그정도의 평점을 받을정도인가? 싶다. 난 재밌었다  "
20170620,4,이야기를 막 어거지로 이어간다. 어이가없어서 눈물이났다  
20170620,9,관람객순수하고 상당히 공을 들인 적품이라고 생각함. 공간을 상상력으로 창조한다는 것이 쉽기도 하지만 어렵기도 함 잘 했다고 봄 고래에 대한 애정이 있다면 그렇게 욕이 나오지는 않을 것임 중국도 아 런것을 잘하지 라고 생각했음  
20170620,10,나는 너무 재밌고 너무슬프고 너무너무 좋았어  
20170620,1,"열심히 디자인한 캐릭터는 이유없이 사라지고 인물들의 감정엔 도저히 이입이 안되며, 정말 의미 없었던 나레이션 어딘지 어색한 작화 등 불만만 쌓여서 나오는 영화  "
20170620,1,12년을 제작했다는대 정말  의문이고 스토리 연계가 전혀 안됨  기대를 엄청했더니 기대라는 놈한태 뚜까 맞고왔내요 ㅎㅎ  
20170620,9,관람객흥미롭게 봤지만 마지막내용이 흐릿  
20170620,1,영상미는 있지만 캐릭터는 매력 없고 스토리는 맥락 없음  보다가 개민폐 여주 때문에 짜증까지 남  
20170620,10,관람객너무 잘 만든 그림체...  
20170620,1,이거 제작하는데 뭐 십 몇년 걸렸다해서 기대하고 봤더니 와 내용이 똥은 여자애가 싸놓고 치우는건 그 여자애 좋아하는 남자애가 치움 여주 발암이고요 진짜 겁나 지루함 나랑 영화 같이 본 사람 잤어요  
20170620,1,베스트 말처럼  왜  12년이 걸렸는지 도무지 알수가 없다.한달평균  2회가량 개봉관을 찾는 내가 이때까지 상영중에 나와본게 처음이다쓰레기 완전 OOO기....일본 애니메이션을 따라하려고 한것같은데실상은 영 아니올시다~별 1점도 아까움...  
20170620,8,영상미는 좋았다고 봄. 하지만 인물이나 배경 설명이 부족해서 설정에 대해 이해하는데 30분..  
20170620,6,글쎄~~~왜 12년이나 걸렸을까요???  
20170620,4,비와 바람 어쩌고에서 빵 터졌다... ㅋㅋ  캐릭터들 설정도 이상하고 스토리가 개연성이 전혀 없다.  영상미만 노력한 흔적은 보임.  
20170620,10,하루 알바생들이 있는건가.. 난 진짜 하루가 존노잼에 내용 반복에 억지스럽고 뻔한내용이라 노잼이고 이건 그래도 신박한 스토리에 영상미가 너무 이쁘던데..? 중국영화맞아..?하고 생각했음 근데하루가 평점이 높고 이건 평점이 쓰레기네 왜지  
20170620,1,와..진짜 이걸 만들려고 12년 고생 한 사람들이 대단하다...앞으로 중국은 애니 만들지 말았으면 좋겠다!  장면 장면 볼때마다 오버랩되는 다른 영화들이 떠올라서.하아...ㅜㅜ  
20170619,10,관람객완전 재밌엇어여인생영화  
20170619,1,어디서 센과치히로에 비교를 해? 스토리 전개 뜬금없고 지루하다  
20170619,1,1점도 아까운 영화임ㅉㅉ  
20170619,1,1도 아깝다 0.1도 만들어달라  
20170619,1,영화판엔 디워가 있다면 애니판엔 나의붉은고래가있다 김청기도 을고갈 일본애니 배끼기기의 달인  
20170619,3,"토토로, 센과치히로의 행방불명, 고양이의 보은...오마쥬라기보단 지브리 아류의 느낌. 이야기의 개연성까지 떨어져 당황스럽기까지한 개성없는 애니메이션.  "
20170619,3,진짜 재미없어요스토리 개연성이 너무 없어서 짜증이 났어요  
20170619,5,이런 류(지브리를 지나치게 의식한) 만화영화들이 제일 자주 빠지는 문제가 설정을 만들기 위한 불필요한 설정을 너무 많이 넣는다는 점입니다. 자연스럽게 영화가 난잡해지고 개연성이 우주를 향해갑니다. 작화는 나름 괜찮았는데 개연성이 모든걸 망쳤습니다.  
20170619,1,살다가 이런 쓰레기 영화는 처음이다 억지강동+노잼+주인공암덩어리+조잡함  
20170619,1,그림체도마음에 안들고 센과치히로 같고  
20170619,1,여주 개발암물질 아몰랑 어떻게든 되겠지라는 마인드랑 남자새끼는 지가 박스안열어보고 병걸리고 대신 할아버지 디지고 또 왜 여주한테 지 모든걸 바치냐??? 이걸 12년동안 만들었덴다 ㅋㅋ  
20170619,1,여느 영화는 세 줄로 스토리 요약이 가능한데 이 영화는 이야기가 중국 산으로 가서 요약이 불가함ㅋㅋ 예고편에 나온 장면이 제일 예쁜 장면. 나머지는 걍 은비까비 보는게 낫겠다 싶을 정도의 작화.... 얼굴 작화 붕괴 올 정도면 말 다했음.  
20170619,5,관람객첨엔 잘보다가 후반부에는 졸았어요...  
20170619,7,다른 생각 없이 다른 영화랑 비교도 없이 논리성이나 개연성에 굴하지 않고 그냥 아무생각없이 감정선만 따라가다보면 감동적이게 볼 수있는 영화. 12년 걸린건 여전히 의문.  
20170619,7,이영화추가 다살린영화 민폐라는 단어는 춘을 위해 주인공이 민폐영화  
20170619,1,최대 12프레임의 잃어버린 12년  
20170619,10,난 진짜 감동적이게 봤어요외람된 얘기지만 영화 ost는 멜론에 왜 없는건가요 ㅠ노래가 너무 좋은데 ㅠ  
20170619,10,영상미와 가슴 저릿하게 만드는 목소리의 글귀들.. 극이 끝나고 참 좋았네요  
20170619,10,비와 바람이 되어 너에게 갈게. ㅜㅜ  
20170619,1, 지삐 모르는 여주인공 주위 상황이랑 변화가 시작되었으면 그걸 알야아하는대 지삐모를는 x년 발암 그자체 보지마라  보는 내내 열불터진다  
20170619,1,영화 번역하다 암걸림.  
20170619,8,관람객내용은 신박하고 좋았는데 좀더 독보적인 스타일로 표현했다면 좋았을거같아요. 영화보는내내 지브리가 생각나더라고요~ 아쉽습니다.  
20170619,1,"정말 재미없어요, 졸리고, 이건 뭔가요? 내돈 돌리도. 심하다 심해, 이거 언릉 개봉관 내리시죠. 다른 사람들 피해입히지 말고요, 무슨 수익 몇억이니 다 개소리  "
20170619,3,기본점수 1점에 돌고래 소리 녹음하느라 고생한거 1점 그리고 고생만하다 가는 추를 위해 1점 준다. 나머진 그냥 의식의 흐름기법으로 만든 듯.  
20170619,1,관람객이건 뭐 일본흉내도 정도껏 해야지... 철학을 좀 담아보겠다고 시작은 했는데 중국 특유의 우기기와 아몰랑. 밑도 끝도 없는 전개. 앞뒤 하나도 안맞는 캐릭터들의 행동.  
20170619,8,관람객전체적으로볼거리늠있어서좋았으나 그래픽이떨어지고타깃이산만해몰입도가약햇다  
20170619,1,최하 별점이 하나라는게 너무 아쉽네요. 줄수만 있다면 한 -10점까지는 때려박고싶은데... 영화 개연성은 똥국에 말아먹은 수준이고 여자애는 완전 발암 캐릭터에....만약 이 영화보러갈 생각이있다면 당신의 뇌를 뜯어 말리세요.  
20170619,6,"관람객그래픽은 진짜 많이, 퀄리티가 떨어집니다. 어쩌다가 구름이나 마법쓰면 나오는 그래픽이 훨씬 좋아요. 스토리는 진짜, 누가 주인공인지 모르겠어요. 너무 우울한 장면들이 10에 11는 돼서, 보는내내 우울했어요. 마지막에는 우울을넘어 분노로 바뀌죠.  "
20170619,1,가장 중요한 인물의스토리와 전개가 불친절하고 겉멋만든영화 떡밥회수는 하지않고 내용전개도부실하고 한정된시간에 중요인물외에 인물에대한내용을넣으려하니 내용이초과되어 제대로 설명된부분이없다 메인악역이없으니 갈등요소가 고조되지않았다  
20170619,9,이거 진짜 안보면 후회함..나도 평보고 볼까 말까 고민했지만 보길 너무 잘했다는 생각이 듬  
20170619,10,블루레이 국내출시를 위해서도 100만이상 흥행을 했으면 합니다. 한중일 합작의 좋은 예가 되었으면 합니다. 주인공이 제 취향이네요. 음악도 괜찮습니다.  
20170619,5,처음부터 끝까지 추의 희생으로 만들어진 영화. 앞부분은 초스피드 전개 보여줘서 당혹스러웠는데 고래키우는 얘기는 쓸데없이 길다.  
20170619,9,네 저는 워낙 좋은 색안경 끼고 보는 사람이라 심하지 않은 이상 뭐든지 감동받고 좋아합니다.  개인적으로 '고래' 라는 소재를 좋아하기도 했고 판타지이려면 애니밖에 소화할 수 없다고 생각하기 때문에 전 너무 감명깊게 봤습니다. 사랑하는 마음을 배워가요  
20170619,1,예고편만 봤을때 대작이라고 생각하면서 오랜만에 영화관에 갔지만 볼수록 후회만 되는 영화. 초반 CG와 방향성은 나쁘지 않았던거 같은데 개연성 없는 스토리 진행에 마지막으로 갈수록 여주의 민폐는 갑오브 갑... 제목을 악녀로 바꾸면 스토리 공감은 될듯  
20170619,10,다들 쿠키영상 보셨는지 몰라도.. 스포일려나..  남주 살아나는거 알고 있을려나?  
20170618,9,관람객재미있는데 중국어라 집중이 좀 안되고 안와닿은점이 없지않아있네유  
20170618,10,관람객신박한 내용으로 어린아이들이 보기에 볼만합니다  
20170618,10,나만 당할 수 없다. 꼭봐라 ㅜ ㅜ  
20170618,3,"뭔가 대단한 애니메이션을 만드려고 했던 것 같으나 실패.중국의 제작자, 관객 수준을 알 수 있었던 영화  "
20170618,10,"중국 애니 의외네요. 붉은 고래들, 노을 등 은은한 붉은 톤 색감도 예쁘고, 영상미가 돋보이는 영화였어요. 전반적으로 재밌게 봤습니다만, 서브남주가 너무 안됐네요ㅠㅠ  "
20170618,1,과연 예고편의 광고는;;  
20170618,9,색감이나 등장인물들의 디자인 같은건 신선했음ㅠㅠ 아 진짜 추ㅜㅠㅠㅜ 브금도 분위기에 맞았고... 살짝 등장인물들에게 감정이입을 못하겠긴 했음 근데 진짜 추ㅠㅜㅠㅠ마지막 진짜 울컥... 스토리는 한국 성향??엔 안맞아도 먼가 다른 애니메이션과는 좀 다른  
20170618,1,여주 발암;; 지루했어요  
20170618,1,여주랑 서브 남주의 할머니 할아버지만 존나 불쌍하다;애들 살릴라고 다 죽어가는 할아버지랑 이미 죽은 할머니까지 도와준데다가 부모없는 손주를 할미가 열심히 키워줬드만 폐륜도 저런 폐륜이 없음.  
20170618,1,사공이많아 겁나 헛질한 느낌 여주 초민폐녀 주인공 사는 곳이 타락해서 노아의 방주마냥 리셋하는 개념이면 이해라도함 내용 자체에서 여주가 하는 행동에 공감대형성 불가  
20170618,5,"더 주자니 카피적인 부분이 너무 노골적이고덜 주자니 노력한 부분으로 노력상 정도의 반 점수를 줍니다. 한일중 애니라고 영화 홍보 때리던 것에 비해 한국 비중 거의 없고, 스토리 너무 끊어지듯 튀어나오고 그래 솔직히 공감 가는 거라곤 삶은 힘들다 이뿐  "
20170618,10,일본 애니메이션과는 또다른 중국애니메이션이 너무 매력적이였습이다. 연인끼리 보러가는 것을 추천합니다~ 대한극장이서 너무재밌게 봤어요.  
20170618,2,감성이 쥐어짠다고 나오나..그냥 춘장냔이 여기저기 개민폐인 영화 개답답 여주인공  
20170618,1,진짜 절대로 보지마세요역대최악  
20170618,4,12년동안 뭐한거야...추만 불쌍해..  
20170618,10,오늘 영화 보고 왔는데 너무 재미있었어요! 중국어로 나오기도 하고 저한테는 너무 좋은 경험이었어요  
20170618,7,오랜 기간 공을 들인  영화라고 해서 기대하고 봤던 영화.하지만 스토리가 단순하고 전개가 매끄럽지 않아 중간 중간 의문이 드는 장면이 종종  있었네요. 그래서인지 보는 도중 주변에서 왜? 어떻게 된거지? 애매모호?하여 재차 확인하면서 보더군요.그냥보통  
20170618,1,10점이 이렇게 많다니 알바 뿌린 것도 아니고... 여주인공은 쓸데없이 이기적이고 서브남주는 쓸데없이 희생적이다. 너무 많은 걸 담으려다 보니 연출에 좀 더 시간을 둬야 하는 장면이 휙휙 넘어간다.  
20170618,1,원래 잘 웃는편이 아닌데 보면서 끅끅대면서 웃었습니다인물들 대사같은거  인상깊게 하려고 여기저기서 많이 참고한거 같은데 뭔소린지 모르겠구요 돌고래 재주넘는거 보다가  돌고래 트라우마 생길거 같은 영화 그리고 쥐 할머니 어떻게 된거  
20170618,4,국내에서 볼 때 절반 정도가 잘려나간것처럼 개연성도 없고 뜬금없고...  보고나서 시간 아까운 영화는 살면서 손에 꼽는데 그 중에 하나입니다.  
20170618,1,핵노잼쓰레기입니다 열글자쓸시간도아깝다  
20170618,9,재밌었음 ㅋㅋ 솔찍히 기대없이 봤음 중국꺼라 ㅋㅋ근데 재밌었음 좀 슬퍼영 ㅠㅠ  
20170618,1,"스토리 설정은 좋음, 작화도 나룸 괜찮음, 스토리는....공짜로 보여준다는데 시간 때울 거 없으면 그때 보셈.  "
20170618,1,배경 음악이 아주 좋아서 잘 잤습니다!  
20170618,1,김치년이 버무려진 영화. 이래서 내가 여친을 안 만든다.  
20170618,1,중국 애니메이션은 무조건 거르자  
20170618,1,우와 10점 준 사람의 싫어요 수가 1점 준 사람의 싫어요 수보다 훨씬 많은 영화는 처음이야  
