0,1,2
20170618,1,제작기간동안 대체 뭘 한건지 이해가안된다.여주인공을 개 패고 싶은 감정이 생기는 영화.  
20170618,1,그냥 달빛궁궐임;; 걍 달빛궁궐 보세요  
20170618,1,여주 왜사냐 진심...약속시간 남지만 않았어도 보다 나오는것을 겨우 버팀..신나는 동물농장 이후 역대급 애니메이션..  
20170618,10,처음으로 평점써보네요 개인적으로'너의 이름은'보다 재미있었습니다 엄마랑 보러갓는데 나오면서 둘다 눈시울이 붉어져서 나왔네요 !!보러가시는김에 쿠키영상도 꼭 보시고 한번쯤은 볼만한 영화라고 생각합니다 추 짱♥♥♥  
20170618,10,전 진짜 재미있게 봤는데 하지만 추가 불쌍한건 사실이지만 저는 애니를 원래부터 좋아하고 중국애니는 처음보는거라 나쁘진 않았습니다.  
20170618,6,배경은 볼만합니다.그러나 캐릭터의 개성도 없고스토리를 이끌어가는 힘도 부족한듯  
20170618,7,관람객호구남의 사랑이야기...퀄리티는 그럭저럭이지만 재밌었네요.  
20170618,1,아직 애니미개국 짱개수준... 노력은 했지만 애니 전체적 완성도를 보면 일본은 넘사벽이고 한국보다도 아래... 이걸 만들려고 그리 오래걸렸나...  
20170618,10,스케일도 거대하고 전체적인 분위기도 대륙스러워서 좋았다. 거대한 스케일을 보고 있으면 가슴이 탁 트이는 기분이었다. 개연성은 좀 아쉬운데 너무 혹평 때리는 사람들이 있으니까 10점. 개인적으로는 7.5점 정도 주고싶다  
20170618,2,너무  빨강색만 강조대 보여요 호감가는 캐릭터도 없고  
20170618,1,사건의 개연성이 엉망입니다. 이 영화가 말하고자 하는 바를 찾을 수 없습니다.런타임을 맞추기 위해서인지 세세한 감정 묘사는 모두 배제되어 있고 그 덕분에 짧은 감정 묘사로도 충분히 안타까움을 묘사할 수 있는 서브 남주만 부각되었습니다.  
20170618,7,"Cg는 참..., 동작은 부자연, 한심한 뜬금포 연출.좋은 그림체와 참신한 소재를 가지고 이정도밖에 안되나?카피하면서 느는거라지만 이건 정말...ㅜㅜ소재와 그림체때문에 그나마7점  "
20170618,1,1점 준다. 많이 줬다. 7년 만들었다고?? 지브리 같은 소리하네. 70년 만들어도 힘들듯.  
20170617,9,내용은 좀 아니지만 영상은 정말 멋졌어요!! 추도!!  
20170617,7,뭔가 아쉬운 느낌의 진지함.. 확실히 지브리 따라가긴 멀었구나  
20170617,10,기대 하나도 안했는데 너무 감명있게 봤습니다!! 사운드도 예술이었습니다  
20170617,10,"재밌네요,그럭저럭ㅋㅋㅋ근데 스토리는 좋은데 아니 그 여주는 왜 그래요ㅋ별 내용이 없고 할아버지 할머니 엄마 추만 불쌍해 죽을듯ㅋㅋㅋㅋ 그 다른 남신 분량 좀 몇초나온 캐릭이 더 멋짐ㅋㅋㅋ12?13년은 이해가 안가지만 재밋엇음  "
20170617,10,영화가 참 좋았는데 번역이 부족해  
20170617,10,관람객굳굳굳!!!대박이예요 ^^  
20170617,9,아름답다..  중국감성도 좋네요  
20170617,1,...센과치히로 아류작  
20170617,4,"자연의 아름다움을 듬뿍 보여주는 연출은 정말 최고였습니다만, 그외에는 정말이지 알 수가 없어요.  결국엔 영화에서의 재앙은 모두 여주가 발생시킨거고 그래놓곤 여주가 애써 해결하려 하고 그걸 사랑하는 조연이 커버해주고..교훈도없고 반전도 없는..  "
20170617,10,나만 볼순없지....  
20170617,10,내 생애 최고의 애니메이션 영화  
20170617,6,아름다운 사랑이야기로 미화한 철 없는 여자애가 남자 한테 정신 팔려서 자기 마을 집안 한 남자 인생 모두 망친 내용이다. 애들하고 같이 볼 영화는 절대 아니고 남녀 커플끼리도 보지 말고 여자애들끼리만 가서 봐도 여주 욕하고 나오는게 이 영화다.  
20170617,6,그냥 중국어가 듣고 싶어서 보러갔을 뿐  
20170617,4,평식햏 말이 맞다...  
20170617,1, 절때보지마라 제발 진짜 부탁이다 보지마라 보고 후회했다  
20170617,1,이렇게 성의없는 그림의 애니는 간만에 본다.이정도일줄은...배추도사 무도사..가 생각났고...물론..그보다 더 아래...아 실망....안본눈 사고싶다  
20170617,1,휴 ㅋㅋ 끝나기만을 기다렸네  
20170617,1,와.진짜 시간도 아깝고 돈도 아깝고 재미도 없고 제작 시간만 길지 뭐 재미가.에휴..진짜 돈 아깝다 보지 마시길.  
20170617,6,12년 제작한중 합작아름다운 영상미거대한 홍보 아래 초라한 콘텐츠 아쉽다  
20170617,2,영상만 아름다운 영화...왜 12년이 걸린거지?화면보다 스토리에 더 집중했음 좋았을텐데...  
20170617,2,"불효녀에 사람들에게 그 한명이 엄청난 피해를 주고,답답하디 답답한 영화  "
20170617,8,추의 일편단심에 가슴앓이 하다 갑니다 ㅠ...  
20170617,10,허위주와 붉은고래 그 자체이다  
20170617,10,너무 슬퍼서 소리내서 하루종일 끅끅 거렸음 ㅜㅜ 조조라서 나밖에 없어서 다행이지 추... 너무슬퍼 아직도우는중  
20170617,9,관람객비와 구름이 되어 널 만나러갈게 :)  
20170617,7,역시 애니는 일본....  
20170617,4,영상미는 괜찮지만 스토리 개연성이 무지 떨어짐 복선은있으나 마나... 캐릭터나 이야기 전개 과정이 많이 아쉬움  
20170617,10,관람객추 너무 멋있다ㅠㅠ 시사회때 보고 개봉하고 또 봤는데 진짜 좋아요 한번 더 볼꺼임 끝나고 쿠키영상도 있어요ㅋㅋ  
20170617,10,관람객영상도 스토리도 완전 좋았음ㅠㅠ!  
20170617,10,관람객재밌어요 ㅎㅎ 나의붉은고래  
20170617,5,영상미는 괜찮았는데... 모든 일의 원흉인 여주인공 발암^^ 떡밥도 다 안풀리고 흰머리 남자애 추만 개고생하는 영화...  
20170617,10,관람객극장 갔다가 예고편 보고 궁금해서 개봉날 바로 봤는데 기대 이상 ㅠㅠ 영상미 대박입니다  
20170617,10,재밋어요  오늘 또 보러갈거에요  
20170617,10,관람객 간만에 내 스타일 영화 찾음 !! 눈호강 실컷 하고 나온 애니메이션! 시각에 집중하다보면 어느새 스토리까지 마음에 찡- 하게 들어옵니다 ㅠㅠ 여운 장난아님 ㅠㅠ  
20170617,1,난생처음 별점남기러 들어왔어요 ㅠ웬만한 지루한영화 잘본다고 자부하는데 그냥 잔잔~~하게 시간때우기용으로 봣고 끝나기2-30분은 그냥 짐짜 나가고싶었어요 영화보다 나간다는 사람들 이헤안됫는데 진짜 나갈뻔햇어요  
20170617,1,진짜 보는동안 언제끝나는지만 기다렸을정도...  
20170617,1,지브리 짝퉁 애니메이션  
20170617,1,별 한개도 아깝다. 개소리를 아주 찰지게 들은 기분이다. 제작자 입장에서 평점이 낮으면 기분이 나쁠 수 있겠지만 영화를 본 주관적인 관객의 평점이 다 한 목소리로 말하니 주관적의견이 객관적 의견이 되는거다 반대폭탄 만들지말고 겸허히 받아들이시길.  
20170617,1,"지브리 애니메이션과 비교하면 우리나라나 중국이나 일본따라가기 멀었다는 생각이 많이 드네요... 우리나라, 중국 애니메이션은 인물들 표정이나 움직임이 왠지모르게 어색해요.. 상황에 안맞는 표정 움직임 같다는 느낌이랄까? 지브리는 안그런데..  "
20170617,10,개연성은 조금 부족하지만 작화가 훌륭하고 추의 사랑이 마음 아프게 한다  
20170617,4,개봉 뜸들이는 영화치고 괜찮은 작품 본 적이 없다.  
20170617,4,감동도 재미도 없었던 영화  
20170617,1,진짜 돈이 아갑고 화만 나네요  
20170617,1,여주 때매 세상 멸망할뻔 함 민폐 개오져서 빡침  
20170617,1,"그림체 3d 배경 움직임 다 어색하고 조잡해요...2,30년전 만화영화같아요 인물 배경 등 지브라 따라한 거 같고, 이야기가 계속 늘어져요 같은 내용이 반복되고,,,, 억지 감동짜낼려하고,, 혼자봤으면 중간에 나갈 뻔했네요  "
20170617,10,아니 평점왜케 안좋지ㅋㅋㅋㅋ 난 재밌었는데 울면서 본 난 뭐가됨..  
20170617,8,정말 괜찮았던영화. 영상미에 너무 신경을써서 스토리가 약간 묻히기도함  
20170617,10,허위주 때문에 보러온거라서 기대 안하고 봤는데 진짜 재밌고 가슴 먹먹한 영화.  
20170617,10,관람객감명있게 잘보았고 중국 만화 역사중 최고 였다.  
20170616,10,방금 보고왔는데 추 이시대의 진정한 남자다  
20170616,1,솔직히 1점도 아깝다. 중국 영화여서 그런지 자본력을 이용한 알바 댓글이신가 아님 기대를 진짜 안하고 보셨나.. 사실 일본 영화 정도로 기대한건 아니지만 너무하다. 이게 최선이라면 중국은 20년은 필요할듯. 줄거리 뿐만 아니라 케릭터의 행동도 이해x  
20170616,10,재밌었어요! 추가 넘 멋있엇어요 추를 위한 영화  
20170616,3,"영상,ost 좋았습니다. 근데 설명이 부족하고 캐릭터들의 행동들이 전혀 이해가 안 갈 정도로 개연성이 부족했습니다. 제값 주고 볼 영화는 아닌듯요.  "
20170616,6,전체적인 구성은 좋은데 부분적으로 보면 분명 어디서 본거고 특히 비주얼은 그냥 센과 치히로임 아름다운 화면과 노래로 참 멋진 장면이다. 생각하는 동시에 지브리 어느 장면이 떠오름. 왜 그 좋은 제작능력으로 독자적인걸 만들지 못하는걸까?  
20170616,10,그냥 이건 두번 볼수있는 영화다 죽음과 사랑이 마음의와닿는영화 꼭 영화관에서 봐야하는 영화  
20170616,9,"기대를 안하고봤는데 영상미, 설정이랑 분위기..그리고 짠한 스토리가 너무 좋았어요ㅠㅠ완성도가 아주높은건 아니지만 나름의 분위기가 그걸 커버해주네요.. 유명 애니영화처럼 입이 쩍벌어지는걸 생각하고 오시는건 피하는걸 추천드립니다. 암튼 좋은영화였네요  "
20170616,9,개연성은 떨어지나 영상미도 좋고 음악도 좋았다. 추같은 사랑이 있을까 싶다  
20170616,1,굉장히 불친절한 영화 심각하게 급전개만 하는다가 이해가 안되는 부분이 너무 많음 그렇다고 재밋거나 영상미가 좋지도 않고  
20170616,6,예술을 함에 있어 누군가를 따라하는 게 명예로운 행동은 절대 아니다. 하지만 현실은 그 따라한다는 것 조차 쉽지가 않다는게이걸 보고 좀 느껴진다  
20170616,1,돈보다 시간이 아까운 영화 그냥 최악임 영화 1년만에 보면 재밌게 볼듯  
20170616,1,리얼리티는 김치 전사가 우위다 ㅅㅂ ㅋ  
20170616,7,"짝사랑하는 여자애를 위해 그 고생을 했는데, 여자애가 한다는 소리가 ""오빠 같아.""  "
20170616,10,그림체가 너무 멋있어요! 감동적인 부분도 있네요!  
20170616,2,근데 진짜 뱀이랑 왜싸움?  
20170616,1,돌고래소리 녹음하느라 수고하셨습니다.  
20170616,4,걍. 드럽게 재미 없음...세상 이기적인 주인공 여자가 일다 벌리고 개민폐. 엄마랑 '추'만 세상 불쌍함.. 비와 바람이 되어 찾아 갈께. 진짜 좋아하는 사람은 볼 줄도 모르고 기적이니 나발이니 아우 막판엔 천불나고 추만 불쌍.. 영상미만 볼만함  
20170616,10,더이상 상상이 아닌현실 철학 적인 애니  
20170616,9,이거보러갔다가 영 아닌거같아서 티켓안사고 한참 망설이다 본건데 대박일단 시나리오가 억지없이 너무 잘 나왔네요마지막에는 나도 모르게 눈물이 주륵주륵...하 정말 간만에 대박영화  
20170616,1,중국놈들 사드때문에 한국놈들 죽인다는데 중국영화 수입해서 트는건 사대주의냐?  
20170616,9,"영상미,스토리 이정도면 솔직히 좋은영화다..평점 태러할꺼면 안보면될것을...하울에움직이는성,센과치히로 등등 이런 영화급으로는 아니지만 영상미하나는 진짜좋다고본다.게속 평가 내릴꺼면 다른 애니영화 보러가라  "
20170616,9,관람객워낙 발전된 애니메이션 영화에 익숙해서 다소 매끄럽지 않은 느낌은 있지만.. 또 그만큼 참신한 느낌은 있습니다.  
20170616,10,추.. 너를 기억할게ㅠㅠ 사랑하는 사람을 향한 추의 모습이 너무 슬퍼요ㅠㅠ 영상미 진짜 예쁘고 여운도 남으니까 꼭 한 번 보세요!!  
20170616,10,기대 했음에도 불구하고 대만족!!! 시간나면 또 보러가고싶을 정도!  
20170616,10,스토리 핵슬프고 영상미  엄청 좋음   오늘 n차 할 예정  
20170616,10,재밌었어요 영상미도 스토리도 굿굿  
20170616,10,개봉하는날 바로 봤는데 역시나!!! 영화 너무 재밌었어요!  
20170616,10,보세요 보세요 두번보세요  
20170616,10,왜 다들 중국 중국 하는건지 편견으로 뭔가를 보는게 참 안타깝다.. 영화자체로만 보니 너무 아름답고 뛰어난 영화였음!  
20170616,8,"초중반엔 너무 유치하고.. 개연성도 부족, 주인공 행동도 맘에안들고.. 그저 지브리 따라간것같은 몇몇 요소가 보여서 별로였지만 끝까지 보고나면 괜찮은 영화인것같습니다. 애니보고 펑펑운것도 참 오랜만. 전체적으로 다소 미흡하지만 감성하나는 좋았네요.  "
20170616,10,"최고의 영화 , 추천합니다  "
20170616,1,요새 힘드신 분들만 보길.. 어이없어서 웃음밖에 안나옵니다 덕분에 많이웃은듯... 본격 주인공 지들만 행복한 영화.... 내가 평점알바한테 속을 줄은 몰랐다.  
20170616,5,돈주고 보시면 큰일나는 영화예요서브남주의 고난과 역경과 멋짐보고 싶으면 추천해드려요남주는 뭐하는 거 없음 그냥 존재만 하니까 남주보시고 싶으시몀 비추천해드려요  
20170616,1,보면서 내내 고구마를 물없이 먹은거같다.. 민폐여주 너무 지겹고.. 중국만화영환줄도 모르고 그냥 예매해서 봤던건데..기대하지말걸.. 풍경은 예뻤다 근데 중간중간 작화와 어울리지않는 쓰리디란..  
20170616,8,그냥 추가 너무 멋지다...스윗가이  
20170616,10,추...존잘...하..내가 살다 살다 애니메이션 남주를 고정픽하게 될 줄은..  
20170616,10,영상미대박이구 추너무 애잔행?  
20170616,1,이거 짝퉁 일본에니메이션이네요  
20170616,9,작품성을 놓고 보기에는 조금 난해할 수도 있는데 스토리도 좋고 영상미랑 음악이 정말 괜찮아서 극장에서 몰입하고 보는게 너무 즐거웠다. 추 앓이 추가요.  
20170616,10,관람객영상도 너무 예쁘고 여운이 오래가는 영화. 가슴에 콕콕 박히는 대사도 참 많고 마지막엔 눈물도 나오더라 ㅠㅠ 추 행복해라  
20170616,5,평점을 보니  어떤 영화인지 더 보고 싶어지는데? 얼마나 쓰레기면 평점이  다 이래?  
20170616,1,솔직히 1점도아까움 내돈주고보면 더 욕했을법한 영화1분광고가 다였던 영화... 스틸컷또한^^..기대많이했으나 최악이었음재미도없고 감동도없고 여주가 고구마 오백개는먹은듯한 답답함을갖고있음  
20170616,10,비와 바람이 되어 너에게 갈께  
20170616,10,오늘봤는데 최고의영화....너무 신선했고 중국감성 좋았고 아름다웠어요ㅠ 저는 지루할틈없이 울고웃고반복하면서 보았네요 저에겐 최고의영화  
20170616,10,나만 엿 먹을 순 없다....  
20170616,1,미세먼지 책임전가에 경제보복이나 하는 깡패국가 영화는 평점 1점이 딱 알맞다  
20170616,1,1점도아깝다옛날만화영화 깨비깨비..배추도사무도사.. 그런거생각나는 비주얼에개연성 전혀없는 스토리..열심히만들어놓은 cg는 뜬금없는 곳에서 의미없게튀어나와서 호기심이전혀. 네버. 들지않음대체 난 왜본걸까엿먹이려고 싫어하는사람한테 추천해야겠다.  
20170616,1,"제가 본 모든 영화통들어 가히 베스트오베스트 최악이라 자부합니다. 내 삶에 몽정기2, 성냥팔이소녀의 재림보다 더한 영화를 보다니... 무시무시한 영화임엔 확실함  "
20170616,10,기대없이 봤는데 정말 정말 나와서도 한동안 마음아프고 생각나는 영화 최고  
20170616,7,민폐여주갱신 ㅋㅋㅋㅋ 추를외치고있는나를볼수잇음  
20170616,9,잔잔하게 진행되는이야기라 지루할수도 있으나 충분히 아름답고 슬퍼요  
20170616,1,너희가 뭘 좋아할지 몰라 다 준비해봤어 (욕) 써놨다니 평점이 사라졌네 ? 이게뭐람 ?  
20170616,1,재미가 심하게 없어요...화장실만 가고 싶어지는 영화. 다 어디서 본듯한 장면뿐 30분짜리였으면 우와 했겠지만 요 그 좋은 오스트도 계속 나오니 소음공해 같았습니다  
20170616,10,방금 보고 오신분 있나보다 전 좋았어요 혼자 울면서봤음  
20170616,9,관람객기대를 1로 두고 갔더니 9로 오름. 또 볼 것이다! (그래요 좀 많이 어디서 본 것 같은 익숙함 뭐 이런 거 있긴 했어... 그럼에도 난 만족스럽다  
20170616,10,생각보다 괜찮았어요! 웅장하고 음악 아름답네요  
20170616,9,"개인적으로 최근 동안 나온 스토리가 산으로 가는 느낌인  지브리 작품들보다는 훨씬 낫습니다(지브리 골수팬이니 오해없으시길) 여러 작품을 섞어 놓은 느낌이 다소 없지않아 있지만 인간사, 윤회 등의여러가지를느낄 수 있는 작품. 영상미 또한 아름답습니다.  "
20170616,8,"일단 총제작기간12년이라는 중국특유의 뻥튀기(허풍)는 걸러내고 보는게 맞는데, 영화보면 그래도 많은인원이 오랜시간작업한거같음. 아직 일본애니에비해 섬세함+완벽성추구가 확실히딸림. 스토리진행 개연성 개뜬금포, 과유불급이 보엿던영화. 그래도 가능성은보엿음  "
20170616,1,와 진짜 짜깁기 일본 하울움직이는성 주인공 헤어스타일 귀걸이 진짜 한시간 반동안 고래키우고 ... 내용은 뭐가 먼지 모르겠고 진짜.ㅣ최악  
20170616,8,흥미진진하고 볼만한듯  
20170615,1,갠적으로 인소보고 온 기분....  
20170615,10,일단 허위주씨 목소리가 너무 멋있었고요ㅠㅠ 내용도 감동적이고 교훈도 있어서 눈물났습니다..중국애니 앞으로 기대해볼만큼 좋았고 영상미도 좋네요!!  또보러 주말에 가고 싶어요  
20170615,9,"여주인공 때문에 암걸려서 항암치료 받아야겠습니다,외눈할아버진 악마인줄 알았더니 천사.. 남주는..하.. 안타깝다 개운하진 않은 영화지만 영삼미도 좋고 나름 중국인의 사상이나 뭘말하고싶은지는 알수있는 영화입니다 감동도 있고  "
20170615,3,"도대체 왜 12년이 걸렸는지 의문이 드는 영화. 12년동안에 있었던 괜찮은 영화란 영화를 다 때려박기 위함인가. 마지막의 마지막까지 뜬금없음을 보여주는 일관성을 가진다. 영화의 모든요소들이 이렇게 애매하기도 쉽지 않은데, 어떤의미로는 대단하기까지하다.  "
20170615,10,진짜 방금 보고왔는데 계속 기억에 남을정도로 재밋었고 감동이였어요 그냥 한번봐볼까하고 보셔도 진짜 재밋으실꺼에요! 전 기다리고 있던 영화라 예고편도 안보고 봤는데 진짜 재밋었습니다. 스크린 안으로 들어가려고 한건 이 영화가 처음이였어요! 진심으로 추천  
20170615,9,"아주 먼 옛날, 아름답고 슬픈 사랑 이야기 여운이 오래 남습니다  "
20170615,10,광고 그림체보고 혹!해서 봤다가 좔라 훅 갔음 영화관에서 보다가 재미있겠지 있겠지 하다가 후반부갈수록 재미는 포기하고 여기까지 왔는데 엔딩이나 보고 가자가자하는데 질질끌며 계속 질질짬 그러다가 엔딩보고 곤이 아니고 내가 현실세계에 돌아온 기분.실화냐?  
20170615,5,머리가 두개야 해일이 오는데 엄마 나두고 할머니 앞에서 자살 패륜무쌍  
20170615,1,음.이건 좀 ..영상미가 뭘 따라한거 같은데 그래도 마니바니마니마니 부족 합니다. 비추라고 자연스럽게 말할수있어요 중국 아직 애니메이션은....  
20170615,5,  지브리 벼랑위의포뇨랑 내용이랑 센과치히로 합친거 같은느낌이 드는거같아요  
20170615,4,돌고래 곤이가 말을 안해요...… ... . 왜죠...  
20170615,10,남자 킬러....ㅎㅎ  
20170615,10,보고싶어요 ㅠ...예고편 중국노래 무비 너무 슬퍼요  
20170615,1,실화냐 진짜...하...할말도없다  
20170615,7,중국이 문화강국이 되면 한국은 개털되네!!  진짜 분위기가 완전 지부리구만 에효!!  한국은 아직도 기억나네!!  만화책 모아놓고 불싸지른 기억!  꼰대나  꼴페미나!!  에어리언 대 프레데터!!  누가 이기든 희망이 없다!!  
20170615,6,이 영화는 중국에서 개봉했을때 스토리땜에 정말 육을 많이 먹었는데 한국에서 좋은 평가 많이 받은거 같아서 신기  
20170615,8,관람객자국의 스토리를 잘 변형 시키고 있다는 점에서 중국 애니메이션의 미래는 그리 어둡지않아 보인다.  
20170615,6,기대만큼은 아니였어요.. ㅎㅎ  
20170615,10,관람객기대 이상의 감동... 추를 잊을 수가 없어요ㅠㅠ 쿠키영상 보고 오여루ㅜㅜ 휴 꼭 보세요. 영상미나 스토리 모두 완벽  
20170615,10,뭔가 포뇨랑 센과치히로 느낌났다! 애니감성은 역시 감동과 여운이 진하다!!  
20170615,10,진짜 여운 최고네요...  
20170615,10,마지막에 울 뻔했어요ㅠㅠ 간만에 제대로 된 애니 봤네요다시 보고싶어요ㅎㅎ 엔딩크레딧 있으니까 꼭 보세요!!  
20170615,10,재미있을법한데 인기 아니면 패작이겠네960억투자하고 12년동안만든거면  
20170615,9,화려한색감과 스토리가 굿이였습니다 슬퍼요 ㅠㅜ  
20170615,10,색감도 그림체도 전부 이뻤음!  
20170615,10,영상미도 넘나 좋고 오랫만에 취저 애니 ㅠㅠ 넘 좋당  
20170615,10,"SNS에서 예고편만 보고도 넘나 기대했는데, 기대만큼 잘봤구나 싶었던 영화!!  "
20170615,10,오오~ 간만에 애니메이션 느낌이 참 좋으다 긋긋  
20170615,10,개봉만 기다렸는데 정말 재밌게봤어요! 쿠키영상도 있으니까 다들 꼭꼭 보길 ㅠㅠ  
20170615,10,넘 재밋어요 화려함도 잇고 감동적ㅠㅠ  
20170615,10,아름답고 슬프고ㅠㅠ.... 영상미와 음향 스토리까지 빼놓지 않고 다 좋았어요ㅠㅠ dvd 나오면 살거예요 ㅠ  
20170615,10,완전 진짜 재밌어요!! 다들 꼭 보시길!!!  
20170615,10,재미지게 잘봤네요~!  
20170615,10,재밌다던데 보고 싶습니다.  
20170615,7,서브 남주가 주인공인 영화..  
20170615,10,관람객중국의 세계관과 애니메이션이라는 장르의 조화가 너무나 좋았습니다  
20170615,10,"솔직히 중국 애니 기대안했고 친구추천으로 본거지만 후회없는 영화였어요 성우분들 연기 잘 하시고, 스토리도 탄탄해서 재밌게 본 것 같아요. 친구랑 같이 또 보러갈꺼에요.  "
20170615,10,정말 너무 좋았습니다. 재밌었고 감동적이었어요. 그래픽도 완전 화려하고 자연스럽더라구요 웅장하고 진짜 최고!!  
20170615,8,이게 중국갬성인가요?ㅋㅋㅋ 처음맛보는 중국애니.. 신선했어요  
20170615,10,신선한 캐릭터 생각보다 정교한 cg 돈아깝지않았음  
20170615,10,이름난 영화들 장르불문 하루에도 극장에서 두편씩도보는 20대여잔데요 요근래본영화중 최고고 앞으로 내인생영화 러셀크로우의뷰티풀마인드 담이에요 너무 슬퍼서 소리내서 하루종일 끅끅 거렸음 ㅜㅜ 조조라서 나밖에 없어서 다행이지 추... 너무슬퍼 아직도우는중  
20170615,6,그럭저럭 재미는 있었으나 여자주인공 민폐기질에 눈살 찌푸리고 보게됨...여주와 남주는 참 비호감임 영화에서 오히려 서브남주가 측은해질 지경..영상미는 참 예뻤는데 지브리 느낌이 많이 났음  
20170615,1,"스토리개연성, 12년동안 뭘한건가 싶을 정도의cg ,이해가안되는 컨셉의 캐릭터들, 암걸리는남주와여주, 복선이 있으나 마나인 스토리전개... 오랜만에 영화 관람하며 지인과 함께 실성하고 욕했네요. 10점 준 사람들은 진짜 재밌게 본건지 알바인지 의문..  "
20170615,8,영화 끝나고 추를 울부짖으며 앓는 나를 발견..이건 추를 위한 영화다..  
20170615,10,흠 지브리를 연상시켰으나 재밌게 봤습니다 중국이라 짝퉁인줄 알았는데 전혀 그런느낌 안들었어요! 꼭 보세요  
20170615,3,이런류의 영화들은 지브리의 그림자에서 벗어날 수 없지..  
20170615,2,별로 지브리 짝퉁 느낌 10자  
20170615,10,흠.. 그럭저럭 좋네요 ㅎㅎ  
20170615,10,정말 멋진 영화!!!!  
20170615,3,[지브리] 하위호환버전  
20170615,6,기존 동양권 애니메이션들의 설정을 긁어모은 듯한 기시감  
20170615,4,중국판 <달빛궁궐> 본 듯  
