0,1,2
20190128,9,추가 하드캐리했네 ㅠㅠ 다들 행복해라  
20190124,3,거대한 똥 싸질러 놓은다음 그래도 일단 치워놓긴 한 여주그런데 똥을 치워도 냄새가 남아서 그 냄새 대신 없애주느라 뛰고 구른 서브남주여주가 똥을싸든 말든 아무 짝에도 쓸모없는 남주  
20190123,1,추는 그냥 똥차녀를 사랑한죄박에 ㅜㅜㅜ 그냥제발 추 행복하게해줘 장난하냐고  
20181206,6,여러분 고래는 물고기가 아니라 포유류에요  
20181122,10,잼나요 비교없이 아무생각없이보면 잼남  
20181027,8,"볼때 마다 울게되요 보면서 3번정도는 운거같아요 ㅠ 이해 안되는 부분도 있지만 울음이 나도 모르게 나와요 . 재미는 없고 분위기도 어두운 편이지만 춘,추,곤 각 인물의 희생이 감동적이에요.  "
20181022,10,"중국식 애니모방의 결정판, 짬뽕스타일  "
20181014,2,평점 누가 이렇게 준거지? 이거 남편이랑 첫데이트에 보고 영화 선택권 잃은 영화입니다. 억지스러운 전개와 황당한 세계관이 영화 몰입도를 매우 낮추어 보고 나면 맛없는 음식을 배부르게 먹고 소화가 안되는 느낌입니다...  
20181010,10,영상미도 예쁘고 재밌다..  
20180927,2,어장녀의 망상을 판타지의껍데기를 잔득 씌워 만든 영화; 딱 돌싱녀들이 좋아할 영화임;  
20180922,4,오글오글×뜬금없음의 하모니!! 나도 고래고기 먹고 싶다~!  
20180904,10,나를 울린 추의 애절함이  
20180825,6,제목이랑 예고편 보고 뭔가 대단한 스토리가 있을 줄 알고 기대하고 봤는데 개연성 너무 떨어지는 듯....; 내용 전개를 너무 흔하고 쉽게 쓴 느낌... 시간 낭비한 느낌입니다...ㅠ  
20180822,5,미야자키 하야오의 거대한 그늘.  
20180822,10,비와 바람이 되어 너에게 갈게  
20180816,1,아 발암... 영화를 보고 병을 얻을것만 같은 답답함 여주가 주변사람들 다 죽이는 스토리  
20180707,1,"0점이 있었다면 0점을 주었을 영화 12년 은 어디다 팔아 치웠는지 모르겠고 일본 애니의 진득~~ 한 클리셰들과 , 쉽게 이야기를 설명 하자면 개연성 하나 없고 논리 하나 없이 한국 영화 스타일로 울어라 이자식들아~~~ 하는 영화.. 보지마세요  "
20180624,10,너무재밌다.. 감동적  
20180622,1,그냥 추가 너무 불쌍함...솔직히 여주 민폐였음; 뒷북이지만 자고 싶으시면 보는거 추천드림...  
20180620,10,중국 애니의 선입견을 깬거 같네요 ㅎ 중국의 지브리 같은감성ㅎ  
20180601,3,개연성 없고 뜬금없는 스토리  
20180529,2,추가 너무 불쌍하다...ㅠㅠ  여주인공은 너무 이기적이고 참 답답한 스토리...보고난뒤 기분이 별루다... 추가 주인공으로 나왔으면 슬픈애니메이션로 평점 높았을거 같다... 추가 좋은여자만나 행복하길~!!!  
20180527,6,영상은 예쁘지만 스토리가 다소 아쉽네요..너무 기대하고본것같아요.  
20180515,6,음악이 너무좋아요 ㅠ ㅠ  
20180424,8,열린결말은 정말 끔찍하게 싫다 덕분에 우울증걸릴삘이다 지금. 제발 좀 해피엔딩으로 확! 그었으면 아니 그보다 남주 여동생은 죽었나 살았나? 마지막에 그걸 보여줬으면 좋겠는데 보호자가 남주인거 같은데 여동생 설마 오세암에 길손이 처럼 아사했으려나? ㅜㅜ  
20180422,9,보는내내 울컥하고 질질짯는데..ㅠㅜ흑마지막 장면 짱이에요 ㅜㅜㅜ  
20180413,10,비와 바람이 되어 너에게 갈께  
20180409,2,이걸 지브리 애니랑 비슷하다는 말은 안 했느면 좋겠음 지브리그 저렇게 그림을 부자연스럽게 그렸냐? 마법천자문정도의 수준이라도 생각하면됨  
20180401,1,늙은 할머니쥐 호루라기 들고 인간세상 갔는데  그뒤 어떻게 된건지?  
20180331,1,"미야자키 하야오의 여러 작품에서 스토리와 화풍과 캐릭터까지 여기저기 베끼고 짜집기하고 짬뽕해서 만든, 그야말로 중국스러운 한심한 잡탕 만화! 욕이 절로 나온다. 1점도 아깝다.  "
20180328,10,"꿀잼,감동이거 보고 동생 울음ㅠㅠ  "
20180326,8,추..ㅠㅠ♡ 넘 좋다..  
20180326,9,"네이버평점은 무시가 답.스토리 전개 중 설명이 필요한 부분이 몇개 있긴하지만, 충분히 멋진 영화다. 애니 보고 운건 가구야 이후로 처음이네.다소 난해했지만 여주 행동이 이해안가는건 아님. 춘은 곤을 연민. 추는 춘을 사랑. 하지만 춘은 추를 우정.  "
20180326,1,내용:죽고살리고 죽고살리고 죽고살리고 싸우다말고 싸우다말고 싸우다말고 울다말고울다말고울다말고만드느라고생한것이외에는점수를줄수없는작품.아니동영상평:중국을 지나고 나오는 이세상의 모든것은 짝퉁 쓰레기가 된다.중국은 삼국지와 미세먼지 두가지로말한다.  
20180326,1,춘 개 민폐.추~~~ㅠㅠ  
20180326,10,와..이렇게 멋진영화를 왜이제야 본건지  
20180326,6,미쳤다 진짜 ㅋㅋ 추의 마음은 대체 어디로... 영상미만좋고 스토리 개연성이 부족함  
20180326,1,이거 5점 이상 다 알바임 레알  
20180326,1,센과 치히로의 행방불명 2002년작이다. 언제 벗어날래.  
20180326,10,마음을 비우고 차분하게 볼수만있다면~~분명 뭉클해지는 순간이 많은 작품입니다..요즘과같은 물질만능 주의~변심을 밥먹듯하는 세태를꾸짖는 작품인것같아~~오랜만에 즐~감상했네요..^^시작하는 연인들에게~~꼭추천해주고 싶은 작품입니다..^^  
20180325,10,"아래 안좋은 평들이  많은게 도저히 이해 안가네요. 저는 정말 재미있게 봤습니다. 삶과 인생에 대해 던지는 메시지도 강렬하게 남겼고, 여러가지 모습의 사랑과 감정이 풍부하게 담겨있어요. 정말 감동받았어요 꼭 보세요 인생영화에요  "
20180325,8,추가 다했다 진심... 추 너무 짠하잖아...  
20180325,7,추가 다한영화...영화보는내내 추만 불쌍했다...  
20180325,1,"처음에 일본 애니메이션인 줄 알고 봤는데, 보면 볼수록 일본 애니를 엉성하게 따라한 느낌을 지울 수 없었음. 스토리도 개연성 없이 흘러가는 느낌. 보고 나서 이렇게 찝찝한 기분은 간만임.  "
20180325,6,"울면서 보긴했는데 할아버지랑 추가 ""굳이 그렇게까지 희생해야했을까""하는 생각이 드네요 좀 납득이 안가요  "
20180325,7,추... 다음에는 꼭 만나서 사랑을 이루길..  
20180325,10,난 재밋게봤는데? 중국애니매이션 처음보는데 잘만들었잖아 너무 그러지마  
20180325,6,주인공을 별로 응원해주고 싶지 않았다.   곤 하나 살리고 자기 죄책감 덜자고 모든 이에게 민폐였던 춘에게 감정이입을 느끼기 어려웠다.  
20180325,2,센과 치히로 외 지브리 애니 죄다 섞어놓음. 역시 중국.  
20180320,4,영상미랑 특유의 분위기는 좋지만 스토리가 너무 개판이다. 추 말고는 정가는 캐릭터도 없고 여주인공 개발암 캐릭터  
20180310,10,추..너 때문에 펑펑 울었다....  
20180227,10,재미있었다굳굳 추ㅠㅠ  
20180224,4,센과치히로느낌약간나긴하는데 그림체라던지 자연스러운 이어짐과 스토리성과 디테일이 너무 다르고 디테일이 없기에 그냥 만화라는 느낌이 듭니다. 그리고중국특유의 느낌이나기때문에 비슷한것같네요 생각없이 보기에 괜찮네요  
20180213,6,그냥  평범하게 봤는데 추 진짜 너무 불쌍하고 여주는 암걸리고  
20180210,10,엄청난 감동이였습니다. 보는 내내 많이 울었네요.  
20180206,6,요고 뱃사공 볼때만해두..ㅋㅋㅋ 진짜 센과치히로 완전 베꼈단 소리가 허튼소리는 아니구나 싶었는데용...다르네용ㅋㅋㅋ이건 이거대로 명작ㅠㅠ센과 치히로는 신기해함서 잼나게 봤었는데이건ㅠㅠ휴지붙들고 봤어요ㅠㅠ서브남주 혼자 다 하는 영화ㅠㅠ추 살려줘ㅠㅠ  
20180202,10,서로를 위하는 마음이 아름답네요  
20180131,8,별 기대없이 봤는데 재밌어요뭔가 뭉클한 느낌~  
20180126,4,아... 이건 뭐. 무슨 소리야?  
20180123,1,보자마자 센과치히로의 행방불명 따라한건줄 바로 알았다  
20180119,1,초반 분위기 잡더니 무너지는 영화  
20180117,3,그냥 중국문화체험 시킨다고 치파오입히고 차마시게하는데 왜 이러고있는지는 안가르쳐주는느낌.  
20180116,7,재밌는데 울컥 할 정도 물론 집에서 봤지만  
20180115,3,"본격 고래 육성 영화. 1시간 반동안 고래 키움. 총 3점인데 고래 울음소리 녹음한 제작진에게 1점, 왜 12년이 걸렸는지는 모르겠지만 12년 걸렸다니까 예의상 1점, 마지막 1점은 추가 불쌍해서 줌.  "
20180115,3,여주가 추를 무시해버리는데? 추만 불쌍하잖아;  
20180115,10,제 인생 최고의 영화입니다.  
20180108,10,"진짜...제 인생의 명작입니다.  ... 진짜웬만하면 안우는데... 3번이나 ㅇ움.... 인생의   영화....많은것을 느끼게ㅔ 해주었어요!!!....감사합니다.,  "
20171231,3,이렇게 공감 안 되는 스토리와 캐릭터들은 처음 ...  
20171228,5,마지막에 울긴했는데 처음부터 끝까지 답답함. 곤아 봄 가라면 가 계곡 안가고 주인공 위험에 처하게해.  
20171228,4,진짜 배경 이랑 서브 남주로 4점인 줄 알아라 배경 만 이쁨 스토리 거지 같고 여주 매력없고 이기적이고 심지어 연기 못하는 배우 같음ㅋㅋ 이해안가는게 어떻게 무슨 생각으로 고래키우는 스토리로 2시간을 채울려고 한건지...추 너무 불쌍히ㅐ  
20171220,9,결말은 맘에 안들지만 나름 재밌는 영화였다  
20171214,5,발암물질인 여주 때문에  1점  주려다가  추를 생각해서 5점 남긴다 .  추 ㅠㅠㅠㅠ  
20171209,2,관람객서브 남주가 주인공이여야 한다...  
20171206,1,관람객이돈으로 치킨 사 드세요 여러분  
20171203,10,자신을 희생해가며 사랑하는 사람?을 지켜주는..ㅜ 감동 ㅠ  
20171201,10,별 기대 안하고 봤는데 영상미도 좋다만 결말에 마음이 무거워지긴합니다  
20171129,10,이해 안되는 장면도 많았는데 이상하게 눈물은 왜이리 나는지..  
20171126,2,쿤 목소리 들으러 갔더니 앞에 대사 열마디 나오고 고래로 사라진 후 내용은 총체적 난국.... 내가 뭘 본 것인가.. 나중에 추가 고구마를 굽더군... 그게 바로 이 영화다. 발암 여주는 끝내 먹지도 않던 그 고구마  
20171123,1,정말로 여주를 사랑하고 몸바쳐 헌신한 사람은 바로 추였는데 정작 여주는 그것도 몰라주고 곤만 찾고... 너무 답답하고 짜증났다. 이 영화의 진짜 주인공은 바로 추인것같다.  
20171122,1,여주인공 씨111발련아 그렇게 살지마 ㅈ같은년아 내가 널 죽여버릴뻔했잖아 이개11새111끼야  
20171114,3,관람객너무 별로였다... 분위기도 내내 무겁고... 시각적으로도..너무 옛날 스타일 ㅠㅠ  
20171112,9,평들이 왜 안좋을까요. 전 갠적으로 너무 흥미있고 재미있었어요. 소장해야 겠어요.  
20171112,10,평균조정 차원. 사드땜에..ㅋㅋ  5점대는 아님  
20171106,1,이것은 11점을 주고싶은 내 마음이다  
20171102,8,별점왜이렇게낮지..  
20171028,9,"솔직히 개연성 없는 전개로도 흐르고,다른영화랑 비슷하다고 느낀 부분도 있음.12년동안 준비했다지만 그만큼 대단한걸 못 느낀건 사실임.그래도 영상미가 좋아서 그림보면서 눈호강도 했고,나름의 탄탄한 스토리였다고 생각함. 보면서 울었음  "
20171027,10,너무 평가절하된 작품~.~  
20171025,1,춘 저× 뭐야 존나 욕하다가 끝아 대륙감성 힘들다  
20171023,1,처음에 스토리 괜찮다 싶었는데 고래 키우는 내용만 3분의 2를 차지하는거 같다. 너무 질질끄는거 같아서 지루함.한마디로 노잼.  
20171020,1, 이걸 12년 동안 제작 했다고 했나요?그림체는 일본 애니메이션 따라 한것같고 스토리 전개가 뻔하고 뭔내용인지? 간추려 보면 남주 죽음 여주가 살려냄 그과정에서여주 남자 사람 친구 죽음 결론: 남주 여주 해피엔딩 끝? 그런스토리 나도 만듬  
20171019,6,영상이나 분위기는 괜찮은데 스토리가 중구난방에 후반으로 갈수록 아쉽다.  
20171014,9,관람객영화에 대한 만족도는 9점 까진 아니지만 한중일 연합된 애미메이션이라는 것에 의의를 두며 큰 시도라 생각을 두고 점수를 드립니다. 가볍게 보면 재밌어요  
20171012,9,"일본 하울움직이는성 주인공 헤어스타일 귀걸이와 비슷하게 보이는건 우연의 일치가 아닐까? 주인공의 헤어스타일은 전형적인 중국국민시대의 단발머리다. 중국국민시대를 배경으로 한 여자애들의 헤어스타일은 거의다 비슷하다, 그걸 베낀거라고 하면 너무 억지다.  "
20171012,3,중국은 애니에도 국뽕이 숨어있네  
20171011,6,시원섭섭하네요 ㅌㅌㅌㅌ  
20171009,1,후기 보고 결정할걸 IP 티비로 4천5백원이나 줬는데 세상짜증남 그 눔에 고래는 인간계로 왜이리 안가  
20171005,8,관람객애들보다는 어른들이 보기 좋은 애니메이션 이었던것 같아요  
20171004,8,관람객신비로운 이야기 속에 들어갔다 왔네요  
20170930,1,고구마 백개 하루종일 질질짜고 안헤어지는 영화내용의 전부  
20170925,10,잘봤어요.분명 해피엔딩인데 많이슬픔  
20170919,10,"영계 상상력도 뛰어나고, 여름의 눈과 홍수가 현재 기상재해와 비슷한 타이밍이 신기하고, 희생으로서 재탄생하는 곤과 춘과 추가 멋집니다. 셋 다 누군가를 위해 목숨을 바쳤네요. 홍수는 결국 영혼관리자의 세상 정화였던 듯하고, 추는 곤과 춘도 만나겠네요.  "
20170919,1,"다 보고나서 이시대영화인가 의문이 듬 .연약한척하고 의지없고 의존적이고 고집만 더럽게 세서 ,주변사람들 죄다 희생 시키고 마지막에 원하는대로 되서 환하게 웃으면서 끝남. 고구마백개먹은기분 .  "
20170910,8,관람객재밋다재밌다 재미있다 재미지다  
20170909,1,중국 짝퉁자동차 같이 이거저거 다 합쳤군.  
20170831,10,"짱!우리 아이들도 재밌다고 하네요담에  또 보고 싶다고~^^근데 별 하나 주는 사람은 이해가 안가네요그래도  제작가님,목소리 출연한 분들 별하나만 있어도 화이팅!  "
20170828,9,포스터만 보고선 일본애니라 생각했는데 중국어가 나오길래 당혹ㅋㅋ 마지막에 영매가 추 살려줘서 참 다행  
20170827,2,시나리오 작가가 중간에 교체됐거나 투자자가 개입한게 아닌가 싶을정도로 사건전개가 엉망진창이다다만 영상연출이나 작화가 지긋지긋한 사회주의 리얼리즘은 벗어난듯하고 발전가능성도 보인다열심히 베끼다보면 어쩌다 30년내로 물건하나 나올듯  
20170825,1,짝퉁 일본영화.  모든 요소를 담다보니 아무것도 담지 못함. 등장인물들이 어떤 행동을 왜 하는지 아무도 공감하지 못함. 여자애는 감정없는 로보트같고 남자애는 시키지도 않은 짓 골라하며 희생정신 오지는척. 개연성이란걸 갖췄으면.  
20170824,10,펑펑울엇다. 역대급...  
20170823,8,평점 좋겠지하고 들어왔는데 엄청 욕먹었구나 이 영화.. 난 개펑펑 울어서 눈부었는뎉ㅋㅋㅋ 여주 발암은 인정하지만 재밌게 잘봤음 역시 평점보고 영화 선택하면 안될듯 늑대소년 이후로 제일 짠내나는 남주는 추다.. ㅠㅠㅠㅠ  
20170820,10,비와바람이되어 너에게갈게 .  
20170820,7,막 재밌진 않아도 실망스럽진 않았는데.. 다들 평이 안좋네용12년이 걸렸는지는 의문점이 걸리긴 하죠...하지만 좋은 영화였어요. 중국에서도 이런 퀄리티가 나오구나 싶었죠! 저는 나름 재밌게 봤답니다  
20170817,6,불교기반 중국의 윤희사상을 잘 표현. 시각적으로 굿. 스토리라인은 별로다. 특히 몇몇 이해불가 행동들은 거슬린다. 그건그렇고 이쁜이로 변신한 쥐아줌마의 뒷 얘기가 궁금타.  
20170817,9,관람객남자의 첫사랑과 짝사랑을 보여주는 영화  
20170815,1,제작기간 12년....그동안 무슨일이 있었던거니?  
20170814,1,이런 쓰레기 영화는 오랜만이구나  
20170812,8,관람객나름 감동적이었습니다  
20170812,7,추ㅜㅜ여주진짜;;추가 여주보고 인간세상가서. 같이 살라 할 때. 얼마나 울었는지 모르겠다.정말 딴거 다 됐고. 추가 너무 불쌍해ㅠ 추ㅠㅜㅠ  
20170811,1,난 또 나만재미없었나~했네;;다른분들의 말씀에 동의합니다^^12년 고생해서 만든 쓰레기입니다.정말 여주답답하네요..남주도물론답답하고 마지막에 둘이 안이어지고끝나는것도 답답하고 질질끌어서싫고 결론 ----보지마세용  
20170811,10,난 그림체도 좋고 재밌게봤는데ㅠ신서유기를 봐서그런지 중국전통집?아파트?도 눈여겨보게되고ㅎㅠ추도 춘도 모두 이해가되던뎅....중국냄새가 여기저기났지만 일본애니만 보다가 보니까 신선했음!!!그래서 추 얘기만 따로 안나옴?ㅎ새사랑찾아 추..  
20170811,1,나의 붉은 돌고새? 마지막에 돌고래야 날개야 뭐여  
20170810,8,주인공때문에 화나고 서브남주로 감동다잡은 영화  
20170807,1,OOO기같은 어우 열받아 결제하고 봣다가 빡쳐서 껏다  
20170806,10,관람객화려한영상!! 아이들과 저도 모두 만족스러운 영화였어요!!  
20170802,1,곤은 고자 새X이다...  
20170802,10,관람객첨 부터 끝까지 푹빠져서 본듯하다  
20170731,10,관람객재미없었어 이거 노재 보지마게요  
20170728,10,추 너무좋다 ㅠㅠ .. 2기나와서 추랑춘 이어졌으면 ..  
20170728,10,?? 중국에서 이미 본 사람인데 번역이 약간 이상하네요..?  
20170727,10,삶과 세상의 이치에 대한 매우 감성적이고 미친듯이 슬픈영화 매우재있다  
20170727,2,여주인공 세상민폐녀.... 남주인 '추'가 다했음.. 하ㅠㅠ  
20170727,1,추가 밥상을 차리고 숟가락을 밥을 떠서 춘과 곤에게 떠먹여줬는데 받아먹는것도 못함. 손으로 턱을 움직여줘야 할정도.  
20170726,3,개발암 역대급 여주인공. 보는 내내 답답 짜증이나서 몰입이 되질 않았다.  
20170726,1,이건진짜말도안되고그냥쓰레기.  
20170725,10,아름답구 슬퍼서 울면서 봤는데...  의외로 평점 너무 낮당  
20170725,5,자신을  희생하는 장면에서 사실 슬펐는데 추만 불쌍하고 기억에 남는다. 중국드라마나 영화에선 늘 서브남주만 개고생하고 기억에 남는 그 특징이 그대로 드러난것 같네  
20170725,9,관람객지브리 따라 그리고 어쩌고 다 떠나서 감명깊게 보았습니다 영상미와 사운드가 무척 훌륭하네요 설화같은 이야기 좋았고 아름다운 영화였어요 보면서 많이 울었네요  
20170725,1,여주민폐년 보는 내내 속터지는줄돈아까워서 끝까지 봤는데 그냥 이해 안가는것들 투성이육성으로 욕이 터져너옴  
20170723,7,지브리 카피와 스토리 개연성은  정말...별로였지만..영상미는 좋았습니다.  
20170723,1,이건 똥이다 보는 내내 발암이고뭔 희생은 남들이 다하고보고나면 짜증만남 개똥임  
20170723,1,12년 걸릴 게 뭐가 있다는 거지. 일본 애닐 뱃긴 흔적이 역역하구먼 ㅉㅉㅉ 하여튼 짱깨 새끼들은 인성이 참...  
20170723,10,관람객재밌게봤어요 너무재미있습니다. 강추!!  
20170722,5,그... 마녀는 인간세계에 왜 간거에요? 왜 봉인 되었던거고?  
20170722,10,깊이와 감성이 있는 에니메이션이네요. 지브리와는 또 다른 감동을 받고 갑니다. 감사합니다.  
20170722,10,"아이에게 보여주고 싶지 않은 애니. 할아버지 할머니의 손녀사랑, 추 소년의 모든것을 희생한 아픈사랑을 다뤘지만 관객들의 평점이 낮은 이유는 여주의 행동때문. 그만큼 몰입하고 봤다는건데900억 이상의 흥행수입을 올렸지만  평점은 지속적으로 하락세.  "
20170721,1,이해하지 못했다...  
20170721,5,여주인공 한명 때문에 몇명이 죽어나갔는지.. 그 쥐몰고 다니던 할머니는 갑자기 젊은 여자가되서 인간계로 갈거라고 갔는데.. 왜 간건지..? 내가 못보고 놓친건지.. 막판으로 갈수록 이해하기 힘든영화.  
20170720,3,지브리횽내? 표절? 한다고 용쓴느낌이 많은데 중국치곤 나름 잘만듬  
20170720,9,추때문에 별점높다..사랑한다 추야...★  
20170720,5,지고지순한 불쌍한 추... 추생각에 눈물이난다. 에라이나쁜 남주여주  
20170720,10,희생이 너무 감동적이네요  
20170719,7,관람객빨강의 여운이 남는 영화  
20170719,10,나 이거 3번봤음 3번다 울었고 매번 볼때마다 재밌었음 리얼 실화임  
20170718,8,관람객재밌었습니다. 중국영화라 걱정했는데  
20170718,2,일단 스토리개연성이 아니다  
20170718,10,정말 인생영화 하나 더 늘었네요 ㅠㅠ 폭풍눈물  
20170718,5,뜸금포가 너무 많은 애절함  
20170718,10,"와 평점이 생각보다 낮아서 의외다. 난 진짜 재밌게 봤는데. 지브라 스튜디오 영화를 좋아해서 그런지 유대감도 있었고.아름다운 영상, 아름다운 음악, 그리고 스토리가 굉장히 좋았어. 한편의 아름다운 동화같지 않았어? 난 만족해!  "
20170717,10,재미있게 봤어요...고래소리도 좋고  다양한 인물들... 상상력이 풍부하네요~~ 여러번윤회를 거쳐야 삶을 살수있다는..말이 가슴에 와 닿네요..그리고 추. 비와바람이 되어 너에게 갈께..안녕~ ㅠㅠ  
20170717,1,너무너무너무재미없습니다  
20170717,10,넘  재밌고  넘슬퍼서 울뻔  
20170717,9,관람객환상적인 비주얼과 음악  
20170717,1,이걸 12년에 걸처 만들다니....12년 동안 뭘한거야??  
20170717,6,진짜 영상미만 좋은 영화 추가 살아서 춘이랑 이어졌으면 별 다섯개인데..  
20170717,10,"이 영화에 8점 미만으로 준 무지인들은,, 춘,추,거름,여름비,겨울눈을 이해  못했거나 중국을 무조건 반대하는 수꼴이거나 영화를 볼줄모르거나 일본애니오타쿠 4명 중 하나이다..가장 속상한게 2010년 이후 한국영화중 이영화보다  잘만든 영화는 없다는것  "
20170716,6,장면 하나하나 아름다운데 보면 볼수록 화가 나는 영화  
20170716,7,관람객서브 남주인 추 때문에 심장 아팠어요ㅠㅠ추야 사랑해ㅠㅠ  
20170716,9,슬프고 여운이 많이 남는 영화이네요결말이 좀 어설프긴하지만볼만한 영화였어요  
20170716,5,주연보다 조연 비주얼이 더 예쁨... 그 물다루는애랑 불다루는애랑 약만드는앤가 너무 예뻤어  
20170716,10,관람객애니메이션을 좋아해서.작년에 중국버젼으로 여러번 봤지만 한국서 개봉하길래 보게 되었음 일본애니와 비슷하지만 특유의 아련함보다는 색채나 음향 배경들속에 중국만의 느낌을 살리려는 면이 보여서 좋았음 앞으로의 중국애니도 살짝 기대을 해 볼수있겠다싶음  
20170715,1,짝퉁천국 짱깨들이 이번엔 일본명작을 카피해서 만들었네요. 작작 좀 하지...1점도 아까운 쓰레기..  
20170715,1,너무 지루하고 스토리가 재미 없음.. 돈아깝게 봄 ㅠ  
20170715,1,짝퉁천국 중국이 센과치히로 짝퉁 영화 만듬 ㅇㅇ  
20170715,1,역대급 민폐녀자기살려준남주하나살려주겠다고자기좋아하는 어릴적 친구죽이고마을 물에담굼질하고친할아버지 민폐로 죽이고친할머니타고다니고근데그것도 그 남자애를 졸졸따라댕겨서 혼자 쌩난리치다가 죽은남자애가구해준거영화에 복선은많은데하나도안걷음스토리엉망  
20170715,10,중국의 첫 애니메이션의 발판이 되어 앞으로도 일본을 능가하는 고유의 색깔로 스크린을 채우고 관객들을 사로잡기를 야기하며 10점 전하고자합니다.  
20170715,2,초반 : 설마 중국이 이걸..??후반  : 역시 중국  
20170715,1,당신의 빨간고래는 안녕하신가요라는 책이 있는데 그 책에 빨간 돌고래가 나옴. 그 작가는 좀 억울할듯  
20170715,1,고구마로 시작해서 고구마로 끝나는군요... 뭐...뭐야 이건....  
20170715,3,제목을 [나의 붉은 고래]가 아니라 [나의 중화 사상]이라고 바꿔야될거 같다  
20170714,1,12년 동안 지브리 카피한다고 애썻네 ... 지브리 애니인줄 알고 다운로드 했다가 중국어 나와서 당황 .. 그림만 베낀줄 알았더니 ... 등장인물.. 전개방식 .. 버라이어티하게 베꼈네 ....  
20170714,2,관람객이거 왜 개봉했어요? 왜???  
20170713,10,관람객너무재밌얶어요ㅠㅠㅠㅠ제동생도 너무좋아했네요  
