0,1,2
20190126,4,정말 혼동 그 자체입니다...ㅡ.ㅡ;  
20190125,1,애초에 배경지식을 가지고 봐야 이해할 수 있는 영화. 그런 영화라면 대중성도 없고 감독이 지가 만들고 싶은 영화를 만든 느낌. 아무것도 모르는 관객이 본다면 이게 뭔가 싶고 굉장히 불쾌하고 짜증남.  
20190121,1,암유발 개짜증. 불편해  
20190120,10,나는 어릴때부터  내가 싫어하는 행동들을 남들도 그리 느낄거라 생각하고 절대하지않았다하지만 나처럼 생각하고 행동하는사람들은 많지 않았다 남의 배려를 당연하게 생각하고 자신들에게 무례하게굴면 그걸지적하면서도 정작 자신들도무례한 행동을 한다  
20190112,7,무차별적인 신뢰와 추앙의 공포  
20190110,6,"뭔가 정의하기 힘든 '이질감(?)'  때문에 영화에 몰입했는데, 결말에는 '불편함'만 남음. 성경적 내용을 상징적으로 대입했다는데, 감독이나 평론가들만 만족할만한 끔찍한 혼종이었음. 그나마 배우들의 연기가 훌륭했음.  "
20190110,7,심오한 주제로 은유적인 영화를 만들어내는 감독들이 정말 감탄스럽다  
20190105,10,★★★★명작★★★★  
20190104,3,앞뒤 안맞고 짜증나는 상황 어이없어 나중에 설명한 거 보니 그냥 기독교 은유 비판인거 같은데 비판을 할래도 논리를 갖고 해야지 이거때문에 시간소비한 우린 모가 되나...참 관객모욕적인 영화...  
20190103,10,불쾌하지만 심오한영화개인적으로 잘봤어요  
20190101,10,네티즌 평점 실화냐?? 이거 완전 대박 영화인데!!  
20181231,10,"신과 인간 사이에서, 하느님ㅡ아버지와 사랑ㅡ어머니 사이에서. 신이 인간을 창조하는가, 인간의 맹목적인 사랑이 신을 창조하는가.  "
20181229,10,영화가 보여주는 메세지를 조금이라도 이해한다면장면 하나 하나에 감탄을 안 할수 없다.한가지 확실한건 특정 집단들이 굉장히 싫어할 영화라평점 테러를 받을 수 밖에 없다.이 영화는 1점 아니면 10점 그 이상의 영화다.  
20181220,2,병맛영화 이래서 종교적 정치적 메세지 담은 영화는 영화판에 나오질 말아야해  
20181220,7,상징이란 단어를 쓰기가 민망할 정도로 대놓고 노골적. 멋지게 볼 수도 있지만 어찌보면 좀 촌스럽다. 그래서인지 비판적이고 파격적인 내용이지만 그에 상응하는 만큼의 깊이까진 안느껴진다  
20181220,3,평론가들이 환장하는 영화  
20181208,6,상징이  너무 노골적인데다가 잘 맞아떨어지지 않음. 남편이 젤 패고싶은 놈인데 걔가 신이라니  
20181205,1,답답해서 OO뻔했던 영화...종교관련 영화라고 눈치니는 챘지만 나에게는 너무 어려웟던영화..  
20181201,1,뭐지이게 평점보고 봤다가 속터질뻔했넹  
20181201,1,진심 노잼이다 이딴게 재밋을거라고만들엇나  
20181126,6,성경과 신. 세계의 은유 놀이. 외모도 내면도 연기도 아름다운 제니퍼 로렌스! 아 근데 이 영화를 통해 감독  대런 아로노프스키와 연인이 되었다는 것이 진정 사실이란 말인가. 21살 차이. (홍상수 감독과 배우 김민희 22살 차이)  
20181126,9,박평'이 짧은 평을 남긴 것을 지금껏 두고보니.. 이양반 아무래도 게이'인 듯?  
20181122,10,성경에 대한 이 영화의 해석법이 딱 맞는말이다. 자연을 소중히 생각해라. 그리고 또 생각하고 아끼고 실천해라  
20181120,1,진짜 내인생에 한국 영화보다 더쓰레기 같은 영화 이게 왜 7점이나 받앗는지 OO같은 예술가들? 염병 떠네 코에걸면 코걸이 귀에걸면 귀걸이 같은영화 뭔들 안붙하면 뭐가 없겟나 가져다 붙힐 수만 있으면 모든기 붙힐 수 있는 쓰레기 같은 영화  
20181111,2,정말 쓰레기영화 ㅡㅡ 기독교 어쩌구 하는데 정말 너무 심하게 짜집기하고 억지로 갖다붙힌 .... ㅋㅋ별 하나도 아깝  
20181110,9,리뷰 보고 영화가 뭘 말하려는지 설명을 보고나니  상당히 잘 만든 영화였네요. 한번 더 봐봐야겠어요  
20181105,2,남편 스타병 개 쩌네 짜증나  
20181102,10,재밌는데  생각나서 또 찾아봄  
20181028,5,위대한 미드를 소유한 제니퍼로렌스. 제목이 마더! 여서 감동 주는 영화인가 싶어서 봤는데 시123발 내용이 이상해  
20181024,10,"""너무나도 여혐적이고 미개한 야훼와 성경""을 사이다처럼 대차게 까는 영화.야훼관련 종교들의 민낯을 낱낱이 까발려버리는 대작임 진짜 꼭봐야될 수작중의 수작  "
20181020,4,조용하게 화나면서 집중된다. 해석이 필요한 영화를 좋아하지 않고 그것이 특히 종교와 관련되었다면 두번생각하고 싶지 않다. 종교의 해석으로 서로 싸우는 시간은 너무나 무의미하다.  
20181018,10,찐따 유일신을 믿느라고 인간답게 못사는 개독교들이 사라져야함을 알려주는 영화.  
20181018,10,아로노프스키는 항상 끝까지 간다. 숨 좀 쉬자.. 영화가 할수있는 가장 극단의 쾌감  
20181017,9,미친 영화인류역사의 2시간 축소판  
20181014,4,"아메리칸크라임과, 이든레이크와 어깨를 나란히 할 만한 빡치는 영화. 해석이야 뭐 나중 문제고....  "
20181010,4,결론이 뭐여? 싸이코영화도아니고 갈수록 막장이네;;;  
20181009,10,난 이런 영화가 좋더라 알고보면 더 재밌는 영화  
20181009,10,기독교란 무엇일까..  
20181009,10,너무 무서운 공포물ㄷㄷ  
20181008,8,첨엔 공포물인줄 알았음  중간부분 지나서스토리가 산으로  가는줄 알았음  결론가기전남편행동 보고  결말보고   웃겻음  결긕  신은 위대하담  
20181006,10,몰입도최강 성경의다른해석  
20180927,8,제니퍼의 연기는 좋았지만 너무 종교적인 상징적 코드를 이용해서...대놓고 코드 맞추게 해서... 보기 불편했음... 좀 더 일상적이었다면 좋았을 영화. 다양성에서 이런 시도는 칭찬하고 싶음.  
20180921,7,뭘 말하고 싶어 하는건지 모르겠다.  
20180904,4,어렵게 만든다고 있어 보이는 건 아닌데...  
20180902,10,"얼핏 영화가 답답하고 어려운 듯 보이기도 하지만, 그럼에도 이 영화만큼은 추천리뷰를 찾아보지 않고도 이해할 수 있었다. 세상이 원래 그렇다. ND  "
20180828,1,영화가 뭘 말하려고 하는지 도저히 모르겠다전문가들의 해석이 필요하면 내가 식견이 부족한건가  
20180827,7,"잿더미 속에서 새로 지은 두 사람만의 파라다이스에 불청객이 하나둘씩 침입하고 그 공간은 피를 흘리고, 조각조각 떨어져 나간다. 타인으로 인해 자신과 모두가 침몰하는 그 과정이 흥미롭다가도 종국에는 피곤해진다.  "
20180826,1,왜  파더는 마더를 힘들게 하는가  
20180826,10,이 영화는 평점을 첨부터 끝까지 모두 읽고 보았다. 정말 호불호가 심하게 갈려 내심 기대를 많이 했었다. 보통 기대치가 높으면 실망도 큰 법인데...인간의 본능과 가치관의 차이을 스크린에서 모두 쏟아 보여준 감독과 배우경이의 열연에  경이를 표한다.  
20180825,7,재미는 있는데 너무 과하다  
20180824,1,내용이 모냐구..짜증 졸라나..  
20180821,1,머리 좋은 사람이 너무 머리 쓰면 이런 영화가 나옴...  
20180820,10,다보고 해석보면 이해가 되네요  
20180819,7,기독교를 풍자한 영화 ..그중에서도 개신교 교회를 돌려서 까는 영화 .  
20180818,1,이런 그지같은 영화가 다있나 미친영화  
20180816,10,평론가같은말은 오글거임 걍 재미있던데  
20180816,5,한동안 내가 기분이 너무 좋았었다 하시는분들이 보시면 단번에 타이슨과 맞짱뜰 분노가 샘솟거나 평소 앓던 지병이 도질 수 있는 영화  
20180815,1,미스트나 사일런트힐 처럼 집단의광기 개인 사이의 갈등을 잘 이용해 관객을 빡치게 만들고 영화에 더욱 몰입하게 하는 장치로 도배된 영화로 반전도 황당하고 영화 내용자체가 딱 중2병 망상 수준이나 마이너한 만큼 본인 취향에 맞으면 재밌게 볼  수도있습니다  
20180814,1,결말까지 보고 싶지도 않을만큼 보다가 홧병날거 같다.  
20180806,2,처음 보고도 다시 못보겠다 점점 현기성이 심한 영화가 끔찍하다 간신과도 똑같다!  
20180730,7,"적나라한 비판, 뼈를 파고드는 풍자.  "
20180729,2,한마디루 별루입니다 돈주고보지마세요  
20180722,7,불편함과 불쾌함을 넘어서는 혐오감을 감당할 자신이 없다면 이 영화를 권해드리고 싶지 않습니다  
20180722,8,대지모 사상과 지구 그리고 신에 대한 인간들 이야기. 다들 또다른 불청객이 되지 않도록 쓰레기 잘 버립시다  
20180718,10,신이 착하다는건 편견이다  
20180716,8,감독의 의도를 분석하다보면 짜증나지만 몰입도 하나는 끝내준다  
20180715,10,"기독교적인 은유는 그저 도구일뿐 ~""마더""랜드를 대하는 인간들에 대한 충고! 마 그니까 지구를 아끼자고!!  "
20180711,8,개독들 꼭 보길. 이 영화 보고 난 후 기독교가 더 싫어짐  
20180626,9,종교에 대한 강력한 비판과 감독의 거대비유를 향한 의지..그리고 하비에르의 강렬한 연기....극도의 심리 살인  
20180625,1,첨엔 심리스릴러인줄 알았는데 갑자기 난장판 종교물로 급변하는데 이때부터 보는게 죽을맛.난데없고 쌩뚱맞은 개꿈같은영화.  
20180618,2,"비유,은유고 뭐고 뭐 이따우 남편쉑끼가 다 있어!영화보다가 암세포 자라는 줄 알았다.  "
20180616,9,최근평이 너무안좋다.. 물론 이영화를 이해하고 말고는 개인적인 차이겠지만 감독이 말하고싶은 주제를 이렇게 직설적이고 대담하게 다룰수있는 감독은 몇없다고 생각한다  
20180614,8,"사랑이 원하는 것, 사람이 원하는 것. 다시, 사랑이 원하는 것!  "
20180613,4,실험적이고 상징들로 가득찼다. 의미를 알수없는 것들이 수두룩하다. 시도는 좋지만 불친절하고 허세 가득하다. 영화란 무엇인가  
20180613,5,집에들어온 모든 인간들 죽여버리고 싶게 만드는게 시나리오다. 배우들의 연기는 모두 일품이지만 지나친 비유와 상징들이 보는내내 불편함을 만들고 거장이란 칭호가 영화의 버프를 준다.  
20180613,4,종교 은유를 눈치채고부터 지루하고 짜증. 제니퍼로렌스 명연기가 위안거리.  
20180610,2,이 영화를 이해한다면 당신은 이미 종교에빠져 주위사람을 돌보지 않은 사람이다  
20180610,2,쓰래기 쓰래기  쓰래기 쓰래기  
20180609,1,시이이이바아아아알아아아아  
20180605,7,다시 보니까 대런 감독이 종교적으로 헷갈리면서 찍은거 같네요...ㅠㅠ  
20180531,1,"이 영화를 이해한 사람들은 '미''친'사람들 이다. 현실에서 안봤으면 좋겠다. 시간버리고, 내 정신상태 버리고, 그냥 2시간내내 스트레스만 받은영화. 진짜 개 ㅈ같은 영화. 다시는 보고싶지 않다. 종교는 사라져야한다. 더러운 영화.  "
20180529,8,내용이 담는 의미를 모르고 보면 그냥 미치갱이 영화감독의 연출은 이번에도 역시 였다  
20180529,1,"연출의도를 안다해도,,, 암걸릴영화 안보는걸 추천  "
20180528,4,평점이 좋아서 보고 .이해해볼려고 찾아보고.보고.보고. 근데...왜? 대체 왜?  
20180523,1,지구에 대해 말하고 싶었다면서 왜 기독교의 신이 남주인거야? 스토리를 너무 심하게 갖다 발랐잖아  
20180514,1,평점이 좋아서 봤더니 그냥 개독영화였네. 개독 싫어하면 절대 보지 마세요. 1시간동안은 무슨영화일까 기대하면서 봤는데 1시간 30분 지나면서 짜증이 밀려오기 시작. 알고보니 개독영화였음. 절대 절대 비추. 평점에 낚여서 아까운 2시간만 날렸다.  
20180514,4,설마 뭐가 있겠지 ?? 좀만 더 좀만 더  참고 기다리면 엄청난 반전이  카타르시즘을  줄거라 굳게 믿었는데  카타르시즘은 개뿔 2시간 발암스토리는 다시  처음부터 시작된다 ?  그래도 버틸수 있었던 이유는 눈부시게  열연한  제니퍼로렌스의 연기력  
20180513,1,별 한개도 아깝다. 영화의 내용이 문제가 아니라. 이건 영화를 만든게 아니라  관객을 담보로 장난질 친거로 밖에 생각이 안된다.  
20180513,6,"이번영화는 ""사랑""편이었으니 ""공평과 정의""로 속편이 만들어져야 그나마 막힌가슴이 뚫릴것같다..  "
20180513,2,보지마셈 정신병 걸릴 것 같음  
20180512,3,난해하다. 시간아깝다. 좀 더 한가할때 틀어놓고 집안일이라도 할껄  
20180511,1,관람객평점이낮은데는다이유가잇음예고편보고속지마시고 걍보지마샘  
20180511,4,같은 영화를 보면서 종교인은 인간으로서 죄의식과 감사를 느끼고 비종교인은 신의 무능력과 비뚤어진  감성을 본다.  다만 이 영화는 현실과 다르다. 인간의 노력을 심도있게 다루지 못했기 때문이다. 이 영화의 의미는 딱 여기까지다. 나머지는 엉망.  
20180508,1,이딴영화 수입 하느라 돈질하는 회사도 있구나..한마디로 감독이 정신병자 수준!!  
20180502,1,줄수 있는 최하 평점이 0점이 아니라 1점이라는 것을 알게해 준 내 생애 최악의 영화. 이 영화를 보고난 후 다른 매체의 도움없이 감독의 의도를 이해했다면 당신은 정신과 상담이 필요한 상태이다.  
20180501,5,주님 저는 사랑도 용서도 할 수 없을 것 같아요.  
20180430,6,미리 공부하고 보란 말인가.. 성경이란 단어 한마디만 초반에 언급했어도 영화가 100배는 재미있었을거다.  
20180427,2,암유발하는 내생에 최악의 영화.  
20180427,9,대체 누가 저 집의 주인이라고 주장 할 수 있나? 우린 자연이라는 제니퍼 로렌스에게 용서를 구하고 반성합시다  
20180423,9,"기독교,반기독교,성경 논쟁 다 무의미합니다. 굳이 따지자면 오히려 반기독 영화겠죠. 일반인의 기본적인 성경지식만 있어도 이해가능하고 이해도와 상관없이 재미있고 독특한 영화라고 생각들어 평점조금 높이고 갑니다.  "
20180419,10,소름 ㅋㅋㅋㅋ 보석의 정체  
20180415,10,"하나님(남편)은 모든사람들을 사랑하고 용서하기 원하지만 인간은(아내)자신이 사랑하는대상과 안락한 삶만을 추구하기를 원한다.하지만 관계들로 이루어진 세상에 인간들의 다양한(전쟁,죽음,이기적인 인간의죄)혼란가운데 자신의집(구원문제)을 태우기도 살리기도..  "
20180415,7,마케팅을 제대로 하던가...사전지식 없이 단순히 예고편에 끌려서  이 영화를 본 관객은  얼마나 황당하고 불쾌했을까...  
20180414,6,작가의 의도를 알지 못하면 그냥 답답한 폭력 영화  
20180414,6,다음엔 어떤 또.라이 짓을 할까 궁금해서 지루하진 않지만 예수님의 어설픈 해석과 이해로 만든 영화같음..이 영화에 정말 많은 사람들이 나오는데 정상인은 제니퍼밖에 없는 듯 ㅋㅋ  
20180407,1,아니 이해하고 싶지 않아 종교적인 스토리는 알고 싶지 않으니까 너네만 알고 있어주라 1점 줄게 근래 본 영화중에 제일 극 혐  
20180401,6,스릴과 연기력 때문에 몰입하면서 나름 재밋게? 보긴 햇지만 인간의 추악함만 모아두고 난리치니 스트레스 받앗다  
20180331,7,성경을 많이 담았다고 하네요.리뷰 보고 아하~한 영화임.정보 모르고 보니 신경쇠약증에 걸려있고 자신의 집을 자기와 동일시 할 만큼 사랑하는 폐쇠적 아내와 창작의 고통을 느끼지만 사람들을 좋아하고 우유부단한 시인 남편의 독특하게 풀어낸이야기로 다가옵니다  
20180330,8,머리 나쁜 애들은 이 영화 보면서 지루했을 거야  
20180329,1,거짓과 무의미의 차이.  
20180328,8,신을 믿는가? 그렇다면 그 이유는 무엇인가?  
20180327,6,관람객제니퍼 로렌스 존예...  
20180325,3,"사전 해설 없이 보자니 이게 뭔소린가 싶고, 친절한 해설을 찾고 보니 굳이 볼 필요가 있나 싶은 인텔리 감독의 자작극. 종교의 끝간 데 없는 폭력성에 대한 살벌한 표현력에는 점수를  "
20180325,3,심오한 성경내용을 담으려 노력하였으나 아무런 배경지식없이 보니 무지 힘들었던 영화. 상징하고 나타내는 것은 많으나 영화에서 잘 드러나지 않아서 보고 나서도 어리둥절 했던 영화임. 스포일러를 보고나서야 겨우 알 정도 였으니. 무교여서인지 별로 감동은없었  
20180322,10,"신이 완전한 존재였다면 굳이 인간을 창조했을까..관심과 사랑이라는 양식을 독점적으로 먹기위해 인간을 만들었고, 또한 우리의 존재도 관심과 사랑때문이라는걸 말해주는 참 악마같은 엄마같은 철학적인 영화.  "
20180319,7,제니퍼로렌스의 연기를 보는것만으로도  
20180319,9,몰입감뛰어나고  전혀 예상못하는 전개가 흥미로웠다.  
20180319,8,시인은 자기 세계에서는 창조주다.마음대로  자기의 세계를 창조한다.그 장단에 사람들은 휘둘린다.새로운 시를 쓰고 또 새로운 허상의 세계를 창조한다  모두 부질없다. 뭐 이런 내용 같이 보이네요.  
20180316,8,종교가 어떻게 생겨났는지 알수있는영화..제니퍼로렌스의 연기가 돋보인다.진짜여신~  
20180316,7,관람객이게당최먼지 머리아픈영화  
20180315,3,여러모로 불편하게 만드는 영화  
20180314,9,어머니 빼고 모든것이 비판받았다  
20180314,10,제목이 왜 마더인지 생각하면 느낄 수 있는 영화  
20180313,2,종교있는애들이나 보게해라  
20180312,1,그냥 개독영화. 그들만이 이해할수있는 세상. 똥이 얼마나 숭고한 과정끝에 나오게되었는지 의미를 찾아보자  
20180306,2,아기있는 애엄마입니다. 평소좋아하던 배우들이 출현한 영화라 망설이지않고 봤는데 다 끝나고나니 기억에 남는건 딱 한장면뿐이었네요. 애있는 분들이나 출산예정이신분은 정말 안보셨으면해요. 속이 울렁거리고 끔찍하다는 말로는 다설명이 안되네요.  
20180305,10,관람객나도 사람이 너무 싫다.  
20180305,1,제니퍼 로렌스 가슴만 볼만했다  
20180304,1,보다가 죽을 뻔 했다 정말 고통스러웠다  
20180304,8,종교적이지만 이건 왜곡이다.  
20180302,10,초현실주의적이지만  흐름이 있다.  
20180302,1,보편적인 가치관을 옆구리에 끼고 있는 성경을 중시하여 표현하여 개독들이 찬양하고 합리화 하기 좋은 영화. 보고나서 무언가를 깨우친 듯 지구네 인간이네 뭐네 하지만 내일 니네들이 할 짓 은 뻔하지. 제발 다른사람한테 영향끼치지 말고 혼자 믿고 살자.  
20180228,9,가출하고 싶어지는 영화.  
20180228,8,독특하고 후반으로 갈수록 재미있음^^  
20180227,5,영화가 말하고자하는 바를 감 잡히긴하는데 이해를 하기싫은 영화.. 영화속 주인공들의 캐릭터도 보는내내 답답하고 인상 찌푸리게 되는 스토리.. 다만 그래픽CG는 의외로 흠 잡을데 없는듯...  
20180226,10,호기심을 엄청나게 자극한다.  
20180226,7,영화 볼 때는 암 걸리는 영화 보고 나서는 기억에 해석을 맞추는 영화 조금 더 친절 했더라면 어땠을까?  
20180225,5,대런 감독은 대중성에는 관심이 없음을 확인함.  
20180224,10,인간의 오만함과 인간의 파괴성 스스로 되돌아보게된다..  
20180224,1,중2 영화천재가 검정고시로 예대 가서 만든 졸업작품  
20180224,1,재미없어서 1점 주는 건 아니고 후반부 아기 씬에서 정말로 크게 충격 받아서 내 생의 최악의 영화 장면들 리스트에 들어간다 정말 너무 충격이었다  
20180223,2,이런 xx 영화후기에 욕남기긴첨이네 먼내용인지 예고편보고낚였네. 예고편보면 남편이 아내를 폭력할것같고 영혼나오는것같던데 ``결말은  죽은 여주인공 심장을 꺼내 그것으로 또 새집을 짓고 새로운 부인이 첫장면에 나왔던 여주인공처럼 침대에서 일어나면서끝``  
20180221,8,요즘 우리나라 보는듯한.  
20180218,2,참 지저분한 영화네..제니퍼 로렌스 때문에 계속보긴 했는데..끝내 암걸리게 만드네..기대한 내가 바보지..  
20180216,1,고구마 백만개먹은  이 느낌!  
20180216,1, 예술성? 그냥 자기 예술성에 심취한 나르시스트의 쓰레기 영화. 시간이 아깝다. 제니퍼의 연기력이 아깝다. 1점도 아까워.  
20180213,6,영화가  불쾌감을 준다.  
20180213,7,영화 등장인물의 의미와 상징을 설명해주는걸 보고 영화를 봤는데.. 의미를 비추어보는 재미가있었지만.. 클로버필드?처럼 어지러운 촬영기법이었던것같아서ㅠㅠ 보고나서 답답하고 불쾌한 기분이었어요ㅠㅠ  
20180211,9,진정한 사랑이 무엇일지 다시한번 생각하게 만든 영화 굿!  
20180211,1,개빡친다 4500원주고봣는데 돈은돈대로 시간은시간대로처날렷네 인생최악의영화다 종교적지식하나도없는사람은절대보지마라 난스릴러라되있길래 제니퍼가 사실 부인이아니고 딸이고 이런내용일줄알앗는데 개낚엿네 장르에 스릴러라적지말고 종교라적어라  
20180210,1,핵노잼 욕나오는 영화ㅡㅡ  
20180210,1,빵점 못주냐? 내 인생 통틀어 어메리칸크라임만큼 빡치고 다 고통스럽게 죽이고싶은 영화는 처음이다 씨이이//발  
20180210,8,제니퍼로렌스의 연기력이 좋았어  
20180209,10,노아 만들고 빡쳤나보네 ㅋㅋㅋㅋ  
20180209,7,무식하면 노잼인가.. 잘표현했다 뭐그러는데 잘모르것다  
20180208,7,"역시 심리를 잘 그려내는 감독이란 생각이 든다. 영화의 주제나 상징과는 별개로, 중후반부까지의 감정선이 상당히 몰입감이 있었다.  "
20180208,8,극도의 불쾌감과 짜증을 제대로 유발시키킨다  
20180204,6,가이드를 먼저 읽고 영화를 봤다 영화 속 마더나  가톨릭의 성모마리아 이 두 인물이 불쌍하다는 생각뿐  
20180204,10,난 좋은데...그리 해석안될정도로 난해한가 이영화가? 신과 성경에대해 생각해본사람으로써는 흥미로웠다  
20180202,3,누가 봐도 성경 내용으로 은유 비유 상징 다 썼는데 성경 내용이 아니라니 어이가 없다 누가 이걸 지구 보호 차원에서 이해하냐 감독이 예술병 지대로 걸렸네  
20180130,1,영화가 정말 마더파더 하다.  
20180130,1,0점이 없는게 아쉽다 보는내내 기분 엿같구 답답함 아....스트레스 받는다 제니퍼 보려고 봤는데 짜증만 난다  
20180130,1,진짜 툭 까놓고 해석 없이 이 영화이해 못한다 진짜 이 감독 머리 겁나 굴리네영화 보는 내내 스트레스만 받았고해석 보고 더 스트레스 받았다  
20180129,1,"영화로 현대미술을 어설프게 흉내내고 앉아있네. 별 볼 것 없는 망상에 어거지식 은유를 깊은 비유인 마냥, 개연성 없고 완급조절 없이 비벼놓고 던져놓은 이런 영화에 예술성 운운하는 걸 보자니 점 하나 찍힌 그림이 왜 수십억에 팔리는 것도 수긍이 간다.  "
20180128,5,개꿈도 잘 영화화 했네요  
20180128,1,무교인으로써 보는 내내 암걸리고 역겨운 영화해석이란 해석들을 다 찾아보고 이해를 해보려고 하지만 절대 이해할수 없는 해석 제니퍼 나오길래 예고편도 없이봤는데 후회막심  
20180127,6,종교적 관념의 나랑은 맞지않는 영화  
20180127,2,제니퍼 로렌스가 어머니 지구? 흠.. 참 지구가 섹시하네.  
20180126,2,OOO기 영환데? 그냥? 유산한 여자의 정신 상태를 표현한 영환가? 내돈 4500원 ㅠ iptv 결제함 ㅠ  
20180126,1,너무 불친절한 그리고 무책임한  
20180125,9,제니퍼 로렌스 버전 석포빌라 B02호  
20180125,10,"아내는 자연(지구), 인간군상들은 말그대로 자연을 파괴하고있는 인간.. 남편이 의미하는게 뭘까하고 봤는데 다보고 해석보니 알겠네요. 혼자보길 잘한듯.. 아무나랑 같이 못볼영화  "
20180125,5,90년대 나왔더라면 대단한 영화가 되었을텐데...이젠 식상함...  
20180125,3,그냥 보면서 온갖 짜증과 화는 다 나는 영화  
20180124,9,매장면이 메타포의 연속이고 관객들에게 해석을 요구하는 영화다 요즘관객취향에서는 피로를 느낄수있고 사람에 따라선 해석을 못하는 경우가 꽤 있겠다 인간이 얼마나 파괴적이고 엉망인지 보여주는 영화  
20180124,10,이 영화가 왜 6점대?? 과연 개이버는 문닫아야될 회사다  
20180124,10,엄청난 컨텐츠 홍수 속에서 이토록 새로운 소재는 못봤다 오지게 몰입하면서 잘봤음 제 인생영홥니다  
