0,1,2
20171023,8,암유발시키는 영화이기는 하나 잘만들기는 한것 같다. 해설본을 봐야 이해가 되는 다소 어려운 영화다. 표면적으로 봐선 너무 짜증나지만 말이다. 그래서 두번은 보고싶지 않다.  
20171023,8,호러영환줄 알고 봤는데 더욱 뼛속까지 호러스러웠던 영화  
20171023,6,"시점을 속인? 감독이, 관객을 대놓고 놀려본? 듯한 느낌.  "
20171023,6,"귀에 걸면 귀걸이, 코에 걸면 코걸이,  예술을 가장한 퍼즐 맞추기  "
20171023,7,"1 ""이웃을 내몸과 같이 사랑""하고, ""오른쪽 뺨을 맞으면 왼쪽 뺨을 내밀""고, ""원수를 사랑""하고, ""일곱번씩 일흔번 용서""하면 일어날 수 있는 일2 독생자를 보내주니 싹다 뜯어먹는 신도  "
20171023,8,노골적인 주제의식 드러내기. 제니퍼 아니면 3류 영화임  
20171023,8,관람객아무런 배경지식 없이 봐서 그런지 많이 어려웠네요 나중에 배경설명을 좀 보고나니까 이해가 가더라구요  
20171023,8,art art art 예술이죠  
20171023,1,하.. 감독믿고 봤더니 완전 똥을 만들었네. 이건 스릴러가 아니라 sf다. 십자가 믿는 것들은 하나같이 머리가 어떻게 된 건가? 재미라도 있으면 말도 안하지. 아까운 내 돈!! 다운로드용으로 봐도 시간낭비인 영화. 진짜 하.. 마이너스 주고 싶다.  
20171023,8,질주하는 환상의 세계관들  
20171023,10,기본적으로 성경의 내용 그리고 Mother Nature라는 이론을 알면 소름이 끼치도록 대단한 영화라는 것을 느낄것이다.  
20171023,9,"세계와 인간, 종교에 대한 가장 냉소적인 상징들로 만들어 낸 기분 나쁜 우화  "
20171023,5,다빈치코드같은 영화인가??  
20171023,4,지극히 남자의 입장만. 신은 남자들만의 신인가  
20171023,1,신을믿지않기에...기분나쁜영화..연기때문에 1점드림  
20171023,1,또라이같은 영화.남자들은 절대보지 말것!!  
20171023,8,설명할 길이 없다. 종교인이 본다면 하나님아버지의 타인에 대한 크나큰 사랑에 눈물흘릴 것이고 비종교인이 본다면 하나님아버지 와이프의 고통과 절망과 절규와 마지막 남은 사랑까지 빼앗긴 채 재가 되어버린 허망함에 가슴이 미어질 것이다.  
20171023,7,관람객제가 이해하기에는 약간 어려운 영화였습니다.  
20171023,8,순전히 배우들 연기때문에 8점줌...그리고 이영화 주제가 불교 vs기독교냐 아니면 스님 vs 예수냐?  
20171023,5,상당히 불쾌한 영화 무례한 군중 배려없는 남편 기분히 나빠지는 영화 예술도 좋지만 배려하고 살자 뭐 마지막 10분의 급변함은 상당히 높게 평가한다 전체적으론 흥행을 위한 영화는 아니다 재미없다  
20171023,9,이 영화는 미쳤다 후반부 모든것이 폭발할때 감당 할 수 없을것이다..  
20171023,1,올해 본것중 제일 핵노잼에다가 짜증나는 영화  
20171023,1,여기 별점 실화인가..  
20171023,8,관람객마지막에반전이네요 볼땐 뭐지했는데 마지막에 신이라는 존재로 생각하니  뒤늦게 전율이있었습니다.  
20171023,6,작품을 보러 온 관객들에게 상당히 불친절한 영화  
20171023,7,제니퍼로렌스의 몸매 하나만으로 이 영화를 볼 이유가 충분하다.  
20171023,8,파괴에서 재창조로 폭주하는 후반부 연출이 인상적  
20171023,5,미안해 지구야 자연아 ㅠㅠㅠㅠ 내가 잘못해써 엄청 힘들지?  
20171023,1,의미를 이해한다고 이 영화가  좋게 해석 될 수는 없다.  
20171023,8,인문학과 종교. 인간과 지구. 구태여 설명하지 않는게 미덕이자 흠이었다. 비슷한 영화 : 라이프 오브 파이  
20171023,2,감독이 자위하면서 설교하는 영화. 그 이상도 그 이하도 아닌...  
20171022,8,관람객보고 나서도 계속 생각나게 하는 영화  
20171022,1,내 인생의 개 쓰레기 욕이 나오는 영화. OOO끼OOO들  
20171022,10,관람객영화끝나고 해석이 기다려지는 영화  
20171022,3,"재미없고 불편하고 역겨움직접적으로 표현했어도 재미없는걸간접적으로 표현함, 있는척하기 좋아하는 사람들을 위한 영화  "
20171022,3,"차라리 끝까지 스릴러로 만들었다면 좋았을 걸... 종교적 상징성이 너무나 노골적으로 드러나서, 그리고 감독의 시선이 조롱 일색이라서 새롭다기보다는 편협함이 느껴짐. 성경이라는 오래된 이야기를 재해석 한다고 해서 뭐든지 JCS가 되는 건 아니다.  "
20171022,10,볼땐 그저 그랬는데 곱씹을수록 상징들이 하나둘 매치가 되면서 '아..!' 하게 되는 영화.  
20171022,10,먼저 성경에 대해 모르면 그냥 부부집에서 일어난 말도 안되는 영화. 그러나 성경(특히 구약성서)애 대해 아는 사람들에겐 근래 보기드문 명작으로 다가온다. 성모마리아지만 아들을 하느님의 뜻대로 세상에 희생되게 지켜봐야 하는 어머니의 고통이 가슴을 줘판다  
20171022,9,기독교적 지식이 없는 사람들에게는 상당히 불친절한 영화.  
20171022,8,관람객굿!! 생각보다 괜찮았음!!  
20171022,8,치밀한 연출과 컷구성으로 숨이 턱턱막힘...심해에 있는 기분이었다  
20171022,1,뭐 이런 쓰레기가.. 미친시인에 그시를 보고 집에 찾아와서 미친짖하는 사람들.. 도대체 뭘 보고 종교적이라는거지  
20171022,1,기독교를 안믿는 사람은 안보는 걸 추천안본 눈 삽니다  
20171022,10,크레딧을 보면 완벽히 맞춰지는 퍼즐  
20171022,1,몇점을 줘야할지 모르겠어서 1점을 준다 근데 10점영화같기도한데 그렇다고 10점주기는 싫고 그렇다고 어정쩡한 점수는 더더욱 줄 수 없는 영화인듯....  
20171022,1,태교에 도움되는 영화라고 그가 말씀하셨다  
20171022,4,아 정말 너무 지루하고 재미없고  마지막에 뭐 있을줄알고 끝까지 봤는데 하... 정말 숙면취하기 좋은영화임  
20171022,6,관람객종교영화였던건인가.은유로 가득한 영화는 에너지가 많은 관객에게만 추천  
20171022,4,똥을 던져놓고 이게 예술이다 하는 느낌.. 짜증과 물음표 밖에 안남는 영화..  
20171022,1,영화 이해했다는 사람들 해석좀해보삼 대단하다 뭔가있다 식의 말만하지말고 그냥 OOO기인데..?? 그냥 사이코 사이비가 만든 사이비영화인듯  
20171022,6,아종교영화라고 말을해주지 정신없고 줫같음 그래도 제니퍼로렌스랑 나름 공포장르라서 그런지 지루하진 않음  
20171022,1,관람객재가 이해하기에는 ..말을 잇지 못할 이 기분  
20171022,10,신이 허락해 주신 마스터피스!!  
20171022,8,관람객재밌어요~~동생이랑 봤는데 동생은 별로래요  
20171022,2,"허술한 대본, 정교하지 못한 떡밥, 감독의 자의식 과잉이 불러온 대참사. 초반 1시간은 꽤나 단단했기(그렇게 보였기) 때문에 1점 추가.  "
20171022,10,"관람객신, 지구, 아담, 이브, 카인, 아벨, 지구를 함부로 소비하는 인간들..지금도 여전히 똑같이 지구를 파괴하려는 인간과 지구의 재생능력으로의 회복이 반복해서 재현되고 있다는 순환을 보여주려 한걸까요?  "
20171022,7,관람객내용이해하기가 조금 어렵습니다.  
20171022,7,관람객블랙스완 너무 취향이라 이것도 보러 갔는데 좀 난해하고 아기 엄마로서 좀 불편한 장면도 있고 그르네요;;; 제니퍼 로렌스는 증말 이뻐용!!!  
20171022,9,망구 다 구찮다 혼자있고싶다 아지매들 수다소리도 듣기싫다 나는 적막을 원한다  
20171022,3,예술성은 그렇다치더라도 일단 재미는 전혀없었다  
20171022,8,"불쾌하다, 짜증난다 하지만 배우들의 신들린 연기과 감독의 뛰어난 연출로 인해  런닝 타임이 훌쪽 지나간다.  "
20171022,10,"제니퍼 로렌스의 연기가 압권이다 좁은 집안에서의 롱테이크, 핸드헬드와 극단적인 클로즈업 멀미날뻔 했지만  스토리의 몰입감이 장난아니다  종교적 비유가 엄청난 영화  "
20171022,1,러닝타임 내내 불쾌함과 긴장. 악의가 가득한 장면이 계속이어진다.형언할 수 없는 불쾌감에 한껏 젖어 버렸다.내 인생 최악의 영화.  
20171022,8,몰입감 좋고  여운도 많이 남는다.   모든 것은 신의 유희이다.  
20171022,10,관람객성질돋구는데 최고 미쳐 미쳐종교냄새가 나는것이 좀 흠이네  
20171022,10,전 마더! 무척 좋았습니다. 제니퍼 로렌스가 하나의 인간이 아닌 다른 존재일지라도 혹은 하나의 인간일지라도 너무 짠하고 불쌍한 캐릭터였어요. ㅠㅠ 본 후 먹먹함이 오래 지속되더군요.  
20171022,10,관람객관람후 해석본 꼭보시길  
20171022,10,특이하다. 희한하다.  
20171022,1,관람객이해하기 힘든 영화입니다  
20171022,5,몰입해서 볼만 했지만 영화 자체만으로 이해하기에는 안 풀리는 부분이 많음. 해설 보조 필요. 결국 큰 재미와 감동을 느끼기 어려움.  
20171022,8,"관람객레퀴엠 한스푼, 노아 한스푼, 블랙스완 한스푼  "
20171022,1,진심 보면서 스트레스 너무 받아서 암걸릴뻔. 네이버 평점은 거짓말을 안해요  
20171022,9,관람객평론가의 해석을 봐야 이해할수 있는 영화. 스릴러를 위장한 종교영화.  
20171022,1,무신론자가 보면 해석을 봐도 이해안되는 영화  
20171022,6,관람객보고난 후에 기분이 별로 안좋습니다  
20171022,6,관람객상당히난해하고ㅇ초자연적영화초현실적  
20171022,10,아무것도 모르고봐서 처음에는 충격적이었지만 영화보고난후 찾아보면서 퍼즐을 맞춰보니 감탄하게되는영화  
20171022,8,실소가 터져나오는 과장스런 진지함 다른 건 모르겠고 인간 감정의 표현력은 정말 이 감독 뛰어넘는 사람 없는 것 같다. 또 한번 인간 내면의 감정이 극으로 치달아 가는 그 느낌이 좋았지만 좀 너무 종교적으로 변해버려서 아쉽기도 하고 좀 그렇다  
20171022,9,와 몰입도 대박..해석 보고나니 한번 더 보고싶다  
20171022,8,"사랑과 헌신, 무엇보다 생명의 표징이 된 예수를 엄마 또는 예수 옆 다른자의 관점에서 본 예수 이야기. / 예수를 사랑하는 자였다면, 그의 말을 따르던지 아니면 절대 용납할 수 없다고 이렇게 극명하게 갈렸으리라. / 몰입도가 지배적인 만큼 짜증이 난다  "
20171022,9,"세상을 멸망시킨 것은 불을 지른 마더일까, 배경을 창조한 '그'일까, 아니면 집을 파괴한 사람들일까.  "
20171022,10,관람객럴수럴수 이럴수가! 이걸 이런식으로 표현할줄은 꿈에도 몰랐을 영화. 영화를 보는내내 긴장감과 박진감이 넘치고 결말 이후 속 뜻을 알게되면 놀라움과 소름만이 남음  
20171021,9,"종교적인 의식이 많이 담겨있지만, 여러가지 의미가 담겨있다. 다만 내용이 무겁다  "
20171021,10,"간만에 정말 충격적이고 신선한 영화였다. 아무것도 모른채 봐서 힘들게 봤지만, 다 본 후에도 계속 생각이 나는 영화..  "
20171021,10,"볼때는 엄청 힘들지만, 다 보고나면 무릎을 몇번이나 치게되는 영화  "
20171021,7,성경에 대한 많은 은유를 알기 전까진 제니퍼 로렌스가 사람들 뒤치닥거리 하다가 암 걸리는 영화인 줄.  
20171021,8,충격적이긴하다. 다들 종교얘기만 하는데 이것을 이야기 창작의 고통으로 해석한 건 저뿐인가요  
20171021,2,예술같은 소리하네 ..  
20171021,10,"보는내내 의미를 생각하며 두려움과 당혹감에 쉽싸이게 되었음 . . .신선하고 충격적이며, 마더의 입장에서 우리의 삶을 고민해보게 함  "
20171021,8,관람객후반부로 갈수록 선명해지는 알레고리가 좋았지만... 마지막엔 거의 해설에 가까웠던 듯  
20171021,10,최고다 비유를 너무 소름끼치게 잘한 감독의 연출력과 제니퍼의 연기력은 정말 최고의 합작이 분명하다  
20171021,9,영화의 포스터가 성모마리아를 연상시키는 건 우연이 아니다. 종교적인 배경이나 신앙생활의 경험 없이는 정말 돈이 아까울 영화. 실제 종교들에서 가르치는 교리와 많이 다르게 그려져 논란이 되지만 영화는 그보다 더 인간의 근본적인 심성을 표현한 것 같다.  
20171021,4,관람객보고 난 후 멘붕이 왔지만 무슨 뜻이 영화에 있었다는 것을 알고 소름이 끼친 영화였습니다  
20171021,1,쓰레기....돈이 아까웠어요  
20171021,10,생각하게 만드는 영화그냥 영화가 아닌 내가 감독이 되고 주인공이 되는 영화예전 영화 향수가 생각난다  
20171021,9,신과자연  아담과이브 카인과아벨 그리고 인간들  
20171021,1,관람객신은 모두에게 있을 수 없기에 어머니를 만드셨다.  
20171021,8,관람객어렵다..근데 재밌당  
20171021,5,관람객혼란스럽고 난해하네요.  
20171021,9,관람객지구는 인간들 때문에 증식하는 고통을 어떻게 감내할까?  
20171021,10,"크리스트교의 고대 여성신 편입을 통한 가부장제 강화를 개인간 서사로 표현, 직관적으로 묘사한 수작. 감독이 공부 많이한 티가 남. 올해 최고의 영화. 말하고자 하는 바가 너무 명확하여 논점이 오히려 없다는 점이 유일한 아쉬움.  "
20171021,10,관람객오랜만에 참 좋은 느낌이었네요.  
20171021,7,하...이해하지 못했다면 암걸려 OO 영화 이해했다면 화나서 OO거같은 영화  
20171021,8,성경이니 철학적 이니  똥같은 소리 다 제외하고 그냥 영화제목을부부클리닉 : (또라이 관심병 남편 과의 부부 생활) 이렇게 바꾸면 될듯  
20171021,1,연기는 좋은데...성경이고 나발이고...영화는 거지같네...예수는 개뿔...할렐루야~~~  
20171021,1,다필요없고 보는내내 진심 암걸릴뻔함 욕나옴  
20171021,10,첨엔 무슨 영환가 하면서 봤다가 중후반으로 가면서 제대로 미친 영화! 특히 제니퍼로렌스 연기가 제대로 미친 영화!  
20171021,9,관람객이거 이거 마치 과거 인류로부터 현시대까지의 인간과 신의 대한 이야기같다 어떻게 이렇게 비유와 은유를 잘 표현 했을까 와 ㅠㅠ  
20171021,10,관람객상징성을 찾아낸다면 매 장면이 성경이다.  
20171021,1,인류에게 주어진 자연을 전쟁 살인 욕심으로 파괴시킨다는 비판은 좋다. 하지만 나머지 내용은 감독이 자기만의 세계에 갇혀있는것 같아 아쉽다. 제작사와 투자자의 의견이 반영되지 않은 대런 아로노프스키 혼자만의 영화인듯.  
20171021,8,여주는 유대인을 의미..내가 세운 집에 이방인을 들이지 말라고 계속 애원하지만 집주인은 사람들이 있는게 좋다고하고.. 모두 나누라고 말했다며 사랑(심장)을 버리고 집안에서 온갖 부정(살인과 음란)을 저지르며 아기(예수)의 살을 뜯고..결국 불로 심판?  
20171021,10,근래들어 본 가장 잘 만들어진영화  
20171021,10,극도로 협소한 시점과 미친 음향이 만드는 서스펜스. 플롯을 통해 쏟아지는 상징. 처음과 끝의 연결. 보여지는 감독의 천재성  
20171021,7,상징과 클리셰 범벅의 영화. 감독이 뭘 의도했건 후반부로 갈수록 말이 안되가는 플롯을 상쇄시킬만한 납득할만한 근거가 부족하다.  
20171021,10,신이 나에게 가져다 주는 최고의 선물이다  
20171021,10,와 이거 쩌네..ㄷㄷㄷ  
20171021,7,"무교인 나로서는 현실성, 과학성 제로, 괜히 이해하려 혼자 생쇼하고 이유가 나타나겠지 하면서 보다 내머릿속은 이미 폭발하고 후반부터는 그냥 내려놓고 봄. 토탈 이클립스도 어려운데 이 영화도 만만하지 않네  "
20171021,7,내가 이 영화를 보면서 느꼈던 감정 best 31.빡침 2.두려움 3. 혼란  
20171021,1,감독이 이 영화를 통해 하고싶은 말 : 남의집에 방문해서 민폐끼치지 말고 왠만하면 밖에서 만나라  
20171021,10,배경지식하나없이보면 암걸릴영화 그러나 너무 ㄱ정교하다  
20171021,9,대런 아로노프스키의 팬이라면 실망하지 않을 영화  
20171021,7,난해하긴 했지만 곱씹게 되는 영화하지만  관객수준 너무 떨어져몰입방해됨~영화보다 전화받고 볠소리크게울리고 통화도 길게하는 남녀.영화속악마같은 인물들이 화면밖에 퉈어나온줄~매너없고 배려심 1도없는 .스토리와 오버랩이 묘하다다신 구로CGV 가지않으리~  
20171021,10,이런게 진짜 영화다. 은유와 상징 그리고 유니크한 종교적 해석이면서 과감하면서도 거침없는 표현은 기묘한 카타르시스를 선사한다. 신과 자연 인간에 대한 이야기를 이렇게 독특하게 표현하다니. 대런 감독 천재 인증.  
20171021,7,하고싶은거 다 한거 같은데  보기 좀 불편했다. .좋아 하는 감독인데  좀 아쉬웠다..엄마의 마음은 이해했다..  
20171021,10,관람객극단적인 영화일뿐만아니라 제니퍼로렌스의 시점에서 바라보는 첫번째 관람과 하비에르관점에서 보는 두번째 관람의 맛도 극단적이다  
20171020,2,나쁜 진실은 그것이 설령 진실이라 하더라도 마주하기 불편하다  
20171020,10,하느님이 이 영화를 보시고 스님이 되셨답니다.  
20171020,10,와 압도적이다 이런 영화는 또없을것이야  
20171020,6,남의 집 함부로 방문하는거 아니다...그 집 아주머니 스트레스로 한 줌의 재로 화하는 꼴 보고싶지 않으면 그러지 마라..그냥 웬만하면 밖에서 만나  
20171020,9,약간의 설명을 보고 기본바탕을 이해하고 보는것을 추천. 후반부로 갈수록 보기 고통스러운? 장면이 다소 있음. 보고나서 바로 일어나지 못하는 영화...  
20171020,10,이 영화 속 크고 작은 비유와 상징을 이해 하든 못 하든 둘 모두에게 고통스러운 영화.. 내게는 결론적으로 긍정적인 고통을 주었기에 10점! 간만에 아주 신선한 영화를 본 듯..  
20171020,5,말하고자하는게 추상적이고 은유적으로 표현되었다.난해한 부분은 타인의 리뷰와 평론가의 평을 통해 알았다^^  
20171020,10,이건뭐말이필요없음 봐야할영화  
20171020,5,"중간까지는 제법 괜찮았는데, 끝으로 갈수록 정말 가관이다. 난 외국의 곡성이라고 해서 기대했더니 이건 뭐.... 영화에 난장판을 쳐놨네  "
20171020,9,불친절한 영화지만 재밌어용  
20171020,9,"신을 바라보는 인간, 인간을 바라보는 신. 둘다 추악하다  "
20171020,5,관람객안해하고 정채성이 뭔지 힘듬  
20171020,1,"지구와 신, 성경의 상징성 얘기하는 분들 많은데 성경을 진짜 모르셔서 그렇게 말씀하시는것 같아요. 이 영화는 감독 혼자의 난해한 해석으로 예술영화는 커녕 최악의 망작입니다. 다운받아서라도 보지마세요...  "
20171020,7,장르: 스트레스  하...  
20171020,9,눈물이 마르지않았던 작품  
20171020,10,"제니퍼 로렌스, 환상의 연기력으로 악몽의 우화를 창조하다.  돌고 도는 뫼비우스의 띠라니.  "
20171020,7,제니퍼네 민박. 맘씨 좋은 오지라퍼 남편과 눈치없고 염치없는 민박객들 때문에 폭망!  
20171020,8,용서는 없다. 오직 불의 심판뿐!  아로노프스키는 종말론자다.  창조적 종말론.  새로운 세상을 만들자는!  
20171020,8,관람객종교와 관련된 은유적 표현의 받아들임에 따라 전혀 다른  영화가 되는것 같습니다.  
20171020,10,너무나 깊이 공감이 되는 대사가 삶의 필요한 순간에 와 닿은 영화  
20171020,9,"대자연의 시점에서 본 인간의 광기와 폭력, 파괴의 역사  "
20171020,7,Mother!...  
20171020,10,관람객재밌었습니다나중에 한번 더 봐야겠어요  
20171020,6,제목이 주는 호감에 무조건 영화 보았는데 내내 긴장하며 몰입해서 본 영화이다.허지만 영화관 나오니 기분이 별로다.이런영화는 굳이 안봐도되는 영화로 치부하고 싶다.  
20171020,8,보는 내내 뭐지????하는 의문이 계속 따라다닐 겁니다. 종반 까지 진짜 블랙코미디 아닌가 싶을 정도로 의도를 모를 내용 전개가 산재하나 마지막 종반부 보고 나면 모든게 이해 되고 신선한 충격을 먹으실 겁니다 ㅋ (힌트는 이건 철저한 종교영화 란 점  
20171020,10,대런감독!레퀴엠이후 내머리속을 하얗게만들어버리는 기묘한재주가있는 감독.그대는.천재다. 영화는 감독의예술.드라마는 작가의예술.연극은 배우의예술.그러나이모든편견을깨버리는 제니퍼로렌스의 연기!!대박임한번더볼예정.대런감독. 다음 영화 기대하겠음!  
20171020,4,제니퍼로렌스는 명불허전하지만 분노유발이 영화의 의도 였다면 대성공!감독의 거장놀이에 놀아난기분. 영화보는 내내 인상을 써서 이마에 주름이잡혔다.  
20171020,1,정말 제가 살다  본영화중 최악!!!!  무슨 의도인지는 알겠으나  그걸  꼭  저렇게 비정상적으로 풀어내야 했나 싶네요  1점도 아까워요  
20171020,10,사람들의 본성 자체가 무엇인지 보여 주었고 강렬한 거칠감은 여전히 살아있어요.  
20171020,7,성경에대한지식있는사람만보길  
20171020,10,작가 대런 아로노프스키가 들려주는 거대한 자연 신화  
20171020,8,"의도치 않게 모든걸 내어주는 자의 공포와 무절제의 악을 시각화한 블록버스터급 강박의 교과서. 블랙스완이 예술가의 강박이라면, 이건 그 강박에 피해받는자의 또다른 강박이다.  "
20171020,10,"종교에 대한 약간의 지식만 있다면, 영화 중반쯤 머리를 탁 치게 된다. 그때부터 전혀 다른 영화로 보이고, 감독의 의도가 눈에 보인다.인간의 추악함을 표현한 후반 클라이막스부분에서는 나도 모르게 눈물이 흘렀다.  "
20171020,5,성경을 모른다면 아무 의미없는 2시간이 될 것  
20171020,1,일반적인 관객이라면 이렇게 스트레스를 주는 영화는 보지 않기를 권합니다. 다만 자칭 영화매니아라면 봐줄만할수도 있겠습니다. 참고로 호불호가 갈린 <설국열차>를 전 평점 9점 이상 줬습니다.  
20171020,1,스트레스만 받고 감정소모 오지는 영화 꿈보다 해몽 모든 걸 관객한테 맡긴 불친절한 영화 ㅡㅡ  
20171020,5,관람객어려움 그냥 예쁘고 멋있음!  
20171020,10,마더! 계속 곱씹고 생각해보게 하는 영화 ㅠㅠ 마더가 지구였다니... 대박 소름  
20171020,5,관람객라면이 익는 2분 도 못기다려서 생라면 버적버적 씹어먹는 감독...존나 날림. 존나 있는척. 그냥 제니퍼 찌찌 와 빵딩이 감상하는 두시간.  
20171020,10,특이한 영화ㅜ.ㅜ 굳이 추천하진 않아요.. 너무기괴했어요  
20171020,10,마더 보고 욕한 사람이라면 아 내가 빠가구나 생각하면 될 듯. 영화 장면 요소 하나하나 의미가 있는 영화인데 곧이곧대로 보니 이상하지.. 영화아이큐 낮은 거 인증 하는 꼴... 마더는 최고의 영화다  
20171020,2, 처음으로 혼자본 영화인데.. ㅜㅜ 예술이라면 정말 다 예술일거같은 이상한영화에요 몰입감때문에 지루한건 없었는데. 후반부로갈수록 여주만 정말 불쌍한 느낌이었어요.. 신과 창조에 대한 내용.  그리고 조건없는 무한한 사랑 그것이 엄마라는 존재  
20171020,7,창조와 종말을 인간으로 표현한영화 여자는 대자연 집은 지구 아기는 평화 크리스탈은 사과나무  
20171020,8,"제니퍼 로렌스, 이것으로  연기상 탈 것 같은 정도. but 너무 불친절한 영화. 곡성에 이어 '이런 영화를 굳이 왜 만들지?'란 생각을 두번째로 해 봄.  "
20171020,1,"단지 세상의 끝, 다크 하우스, 송투송 그리고 마더! 2017년 4대 막장 영화!!  "
20171020,10,참 여러각도로 생각하게 만드네요~이런 영화도 한번식 봐주는 센스~^.~  
20171020,9,신이 창조해 낸 세계에서 우리는 너무나 소중히 대하지 못했다  
20171020,4,"블랙스완이 폴란스키에게 바치는 포르노라면, 이 영화는 블랙스완을 가지고 다시 마스터베이션 한 작품. 할리웃에서 제니퍼로렌스 미스 캐스팅 얘기나온건 이번이 처음임  "
20171020,1,내가 본 영화중에 최고 지루하고 한숨만쉬던영화임.왜 평이 좋은지 이해불가  
20171020,10,세상에 이 영화를 발암이라고 하다니 이 영화는 대박이다 진짜  
20171020,9,영화가 끝났는데 진짜 재를 뒤집어쓴 기분이었다. 2D영화가 선사하는 극강의 체험력. 웬만하면 작은 상영관서 보세요... 진짜 멀미 나서 토할수도 있음.  
20171020,10,보는내내 긴장하고 봄. 남편:신  와이프:대자연  이라고 생각하면 이해가 빠릅니다.  
20171020,5,관람객아로노프스키가 쓴 바이블  
