0,1,2
20180124,10,알고 봐야 재미있는 영화  
20180123,10,두 시간이라는 러닝타임 동안 집중해서 봤다 평소 대런의 스타일을 좋아하기에 이번 영화도 재미 있게 느껴졌다 나중에서야 심오한 의미를 알게 되지만 영화를 보는 동안 그 의미가 뭔지 곰곰이 생각할 수 있게 한 점이 좋았다  
20180123,1,관람객사실 여자친구와 아무생각없이 남는시간에 골라본 영화인데 전혀 이해할수 없는 영화였습니다. 다 끝나고 찾아보고나서야 아 그렇구나 알수 있는영화입니다.  
20180123,9,관람객아로노프스키는 이제 거장이 되었다  
20180121,10,재밌었음 각자 해석하는 재미도 있고. 막판에 고통받는 모습좀 제대로 보여줘서 카타르시스라도 느끼게 해주지 ㅋ  
20180121,2,신이라는 사나이 부터 죽이고 싶다. 인간이 만들어 놓은 상징일 뿐....  
20180121,10,성경을 안다면 잼있는 영화 기독교에 대한 성찰 필요  
20180120,2,무슨 영화가 처음부터 끝까지 불편하다가 끝나냐..갑둑튀에 이해할수 없는 인물 설정 감독이 자기만의 세계에 빠져서 만든 망작이다  
20180120,4,나 같은 무식이한테는 너무 어려운 영화같다.  
20180120,1,영화가 많은 의미를 내포하는것 같은데 너무 대중성이 없는듯 그냥 보는 내내 암걸릴거 같네요  
20180119,1,지이이인짜로 본 시간이 아까워요 호불호갈린다고 해서 봤는데 지이인짜 걍 볼 생각 마세요 보더라도 20분넘게 보면 시간아깝고 그냥 후.. 배경지식이라고 해야하나? 그거 알고 봐도 재미없으니까 이 영화는 평점 1점만도 못하다 라고 알아주시길  
20180119,4,제니퍼로렌스는 대자연(만물의어머니)이고 하비에르바르뎀은 신이며 아기는 예수를 의미한다. 미셸파이퍼는 이브고 에드해리스는 아담이며 집은 세계이고 부서진싱크대는 대홍수이다. 엔딩장면은 아포칼립스이다. 성경 속 상징성을 나타내려는 현학적 허세가 가득한 영화  
20180118,4,"의미하는 바는 알겠지만, 지루하고 별로였네요.  "
20180117,10,"영화를 보기 전에 미리 내용이나 배경지식을 알아두고 가면 영화보면서 덜 불쾌하다. 그리고 덧붙여, 이건 크리스찬을 위한 영화가 아니다. 크리스찬 영화였으면 교회에서 개봉했겠지...  "
20180114,1,지루한 종교 비판적 영화. 신에겐 열광하면서 자신이 살고있는 지구에겐 너무도 무뢰하고 비상식적인 인간을 표현한걸로 보임  
20180113,6,관람객표현의 의도는 알겠으나 너무나도 적나라해 오히려 거부감.  
20180112,1,쓰레기영화. 보는 내내 설마 반전이라도 있겠지 기대했지만결국 재미도 반전도 신선함도 없었다  
20180112,10,굉장한 영화. 한 장면 장면마다 다 의미가 있다. 감독이 고민 많이 했겠다.  
20180112,5,아무리 예술이니 뭐니 해도. 1시간 가까이 보면서 이게 뭐지.뭐지.아..짜증.. 이러다가. 마지막에 뭔가 있으면 뭐하냐.그전에 나는 꺼 버렸는데. 다못봤음.40분보고 포기했음.  핫도그 큰 덩어리 겉이 맛이 더럽게 없는데 알맹이 쏘세지 조그마한거 보고  
20180110,7,기자평점하고 나랑같은건 처음이네...남주가 웬워킹데드 나쁜놈이다 했더니  격이 다른...여튼 짜증나는영화  
20180110,5,"꼭 봐라, 같이 죽자. 상징이고 뭐고 갖다 붙여도 소용없음.. 제니퍼 나와서 1점 추가  "
20180109,6,볼때는 뭐야 싶었는데 리뷰를 보니 이해가 간다.. 영화보고 리뷰도 보고 의미를 되새겨서 봐야하는 영화...영화 자체만으로보면 이해가 안갈겁니다... 개독이 되어야만 알수 있는 영화인듯..영화자체적으로 설명이 너무 불친절하니 높게는 못주겠음  
20180109,6,심오함의 깊이를 이해하지 못한 나..  
20180109,4,뭐이런 OO갓은영화가 예술로 둔갑하려해  
20180109,1,Garbage Movie  
20180107,7,제니퍼 로렌스 진짜 이쁘더라.  
20180107,10,해석을 보고나니 감독이 천재같다  
20180107,1,예술은 개뿔. 몰입해서 보면 짜증밖에안나온다. 이딴영환 감독니혼자보라구!!돈이많아서 이런영활만든걸까.평점에낚이지마세요.  
20180106,5,신을 벗어나지 못하는 서양인들의 일천한 철학이 지구와 인류를 어떻게 망쳐왔는지 성찰하는 내용. 그러나 결론 또한 신을 벗어나지 못한다. 여러 이벤트를 하나로 묶어내는 감독의 능력은 대단하지만 설정과 상징이 자의적이다. 기독교는 결코 반성이 없는 종교.  
20180105,1,스트레스 암 유발 싸이코영화..아내가 너무불쌍하다..  
20180105,1,그들만을 위한 영화....  
20180104,9,지구의 고통이 아프게 전해진다 인류는 이렇게 소멸되고 다시 창조된다  
20180104,2,이 영화는 종교적 해석이 다분히 필요한 영화 겠지만 나같이 영화를 머리 식힐겸 보는 사람 한테는 영화 보는 내내 답답하기만 하고 여화가 끝난다음에는 제수가 더럽게 없다는 생각이 든 영화 제니퍼 로렌스 덕에 2점이다.  
20180103,5,거장이 들려주는 성경이야기의 불편함  
20180103,3,그냥 종교. 기독교 찬양 영화 ... 인간은   타락. 허세 .폭력. 광기. 등등 온갖  안 좋은걸로  포장...파멸도  결국 인간이 저지른짓.... 그러나 ...  신은  그래도  관대하다 ㅋㅋㅋㅋ 뭐냐  감독이 예수쟁이냐 ?  
20180103,3,"상징성을 이해하지만,왜 그랬는지는 이해 못함.  "
20180102,10,무슨내용인지모르고봤는데 다보고나서아웃사이더노래피에로의눈물이생각났어요  
20180102,8,감독의 역량아닌가? 역시나 레퀴엠과 블랙스완 감독이었군. 호불호가 극명하게 갈릴 것 같은 영화에서 난 항상 호였다. 감독이야기를 들으러 와서 지맘에 안든다고 징징대는 심보들은 뭐지?  
20180102,1,..../..../  
20180102,7,저도 담석이 생겼습니다ㅇㅅㅇ 여자로 시작해서 결국 남자로 끝나네요...ㅋ  
20180101,1,남편이 진짜 OOO네 인간말종이라고밖엔  
20171231,9,관람객아주 잔혹하게 잘 비꼬운 해석  
20171231,1,아는 척 잘난 척 뭔가 있는 척 하는 사람들이 좋아할만한 영화. 이 감독 영화는 다 이 따위임. 그 중에서도 최악이었다. 제니퍼 때문에 겨우 참고 봤네.  
20171231,8,감독의 신앙고백이었음. 감독 특유의 싸이코패스 느낌과 싸한 분위기가 괜찮음. 제니퍼 로렌스의 연기를 다시 보게 됨.  
20171231,9,미쳤다 이영화  충격적이다  
20171231,1,"평점이 6점 이나 돼서 이상하다 싶었는데, 광신도 개독교인들이 몰려와서 평점 올리고 고상한척 하다 갔네 ㅋㅋ  "
20171230,10,개인적으로 명작이라고 생각합니다.처음부터 개인 캐릭터의 역할만 알고 봤습니다.종교생활을 하시는 분들이라면 곰곰히 생각하게 만드는 영화인듯 싶습니다.  
20171230,1,처음부터 끝까지 스트레스  
20171230,1,주접 싸고 앉았다. 영화 노아 이후로 이런 신성모독 영화는 첨 보네요. 제가 본 올해 최악의 영화입니다.  
20171230,1,분노유발영화.  예술이고나발이고 감독이 미쳤구나. 의도를 떠나서 짜증나게 만들어따.  블랙스완때랑은  완전딴판이네.  
20171230,1,감독은 내영화 이해해보라고 하는데 난 이해하고싶지 않다  
20171229,1,기독교인이라면 그냥 비유모른체로 보는게나을수도있는 영화.  노아이후로 한번더 교회다니는 사람들 속뒤집어주는영화인것은확실합니다.  
20171228,1,포스터에 종교영화라고 큼지막하게 좀 써놓으면 안되나? 무교인이 보기엔 1점도 아깝다  
20171228,10,종교적 관점으로 으로 바라볼 수있는가하면 개인적으로 어머니를 생각하며 봤다. 어머니의 무한한 사랑 이후에 남은 보석같은사랑으로 아내에게 주는사랑 또 그아내는 그사랑을받고 다시 자식이생겨 배푸는것  
20171228,10,상징과 은유로 가득한  숨은그림 찾기.  
20171228,8,무슨말인지나는 잘이해못하겟다 근데몰입감최고 제니퍼로렌스 존예 근데남펀왜저러는거얄?  
20171227,1,웬만하면 보지마시길 근 10년간 본영화중 가장 최악탄탄한 스토리 기반으로 결과를 도출 하는 과정을 그려야지 결과에 의해 과정이 짜맞추기식으로 흘러가니 말도안되고 개답답함 1점도 아까움  
20171226,7,집의 요정 로렌스~~♡  
20171226,2,개인 취향이지만 스킵없이 보기 힘들었다  
20171226,10,저평가된 수작. 불쾌함으로 달리다 장렬하게 불타오른다. 올해 본 영화중 가장 충격적이었던 영화  
20171226,1,핵노잼...종교인들이나 보세요~~  
20171225,1,어거지 영화. 그냥 최악임. 해설없으면 안될 영화. 이게 영화임?  
20171225,1,하아...가슴에 손을 얹고 진심으로 다시 생각해봐라 이게 몇점짜린지  
20171225,1,나무아미타불 관세음보살  
20171225,1,"그닥... 생각없이 만든 영화에 의미부여 하기 힘드네. 종교든 자연이든 뭐든 개연성이나 짜임새는 있어야지. 중딩 수준의 허접한 연출이지만 감독, 배우 이름값 더해지니 심오한 영화가 되어버림 ㅋㅋ  "
20171225,1,마누라의 의견이란 의견은 무시하는영화  마누라 인격무시  마누라 존중무시 이영화보고 세상 모든 남편들ㅇㅣ 보고 배울까봐 두려워지는 영화  절대 가족끼리 보지마세요  
20171224,1,가슴 실화냐 가슴 실화냐  
20171224,2,불편하다 불편하다 불편하다 모두들 폭력에 민감하게 생각하고  한평생 사세요~~영화 스토리는 너무 갔다 과하다  
20171224,9,내것을 침범당했을때의 공포...  
20171224,10,관람객87utyitry4ud65tyfgu41dytru  
20171224,1,층간소음 있는 작은집에 사는 게 감사하다감독 죽이러가야긋다내 피같은 시간  
20171223,1,연출감독의 불순한 의도가 너무 싫어요...  
20171223,1,"상징성과 연출의도를 일반인들은 얼마나 이해를 할까요,, 극소수 만을 위한 영화는 영화 가 아니라고 생각하네요.. 뭔가를 찾으려고 지루하지만 끝까지 봤습니다. 정말 앞이랑 연결이 안되는 결말을 ....절대 보지마세요  "
20171223,1,"정말 수많은 영화를 봤지만 이것보다 재미 없는 영화는 내 인생에 단언컨대 단 하나도 없었다. 설정부터 무엇을 말할 려는 건지, 목적과 방향성이 하나도 제시 되지않고 독자들, 관객들을 이해시킬려고 하지 않는 그냥 돼지같은 영화인데 어떻게 이게 7점이지?  "
20171223,1,감독의 대중성은 딱 블랙스완까지였던듯. 설정을 미리 읽고 봤는데도 정말 핵노잼. 제니퍼 로렌스는 왜 뭐에 반한건가 감독  
20171223,8,비인간적이고 무지했던 시대에 발생한 종교를 현대 시점에 대입하니까 그 모순이 너무 절실하게 드러나는 영화. 집깨부시건 와이프를 패건 아들을 죽이건 (지가 뭔데)용서하는 사람=(구)창조주=(현)쓰렉. 고로 제니퍼가 암걸려 죽는 이야기.  
20171223,9,이 미친영화를 이제 보다니  
20171223,1,내 인생 최악의 영화. 담고있는 의미와 상징은 너무 단순한데 영화는 쓸데없이 난잡하다. 그래서 결국은 뭐지? 기독교를 조롱하려고 만든 영화인가? 그러면 성공.  
20171223,1,씨발 암걸리는 영화!!! 임산부는 절때보지마  
20171222,10,이영화가 6점대? 8점이상은 해야됨  
20171222,1,하.. 답답하다 답답해..  
20171221,4,옳고 그름은 인간이 판단할 문제가 아니다.  
20171221,7,처음부터 끝까지 느껴지는 답답함...어쨌든 끝날때까지 이해해보려고 노력함.... 집중하게 만드는 힘은 있다.  
20171221,7,남편이 오지랖 대마왕 ㅎㅎ  
20171220,8,개인적으로 쩐다10자하기  
20171220,1,기독교나 성경을 읽지 않은 비종교인이 본다면.. 수많은 은유와 비유때문에 그냥 엉망징창이 영화를 보는 기분일듯.. 아무런 정보없이 보는것 보다 영화적 해석을 한번 읽어보고 보시는것을 추천드립니다.. 전 공포영화인줄 알고 봤는데 ㅎㅎ 개인적으로는 꽝이네  
20171219,1,쓰레기같은 영화. 4배속으로 보고나도 시간이 아깝다는 생각뿐이다.  
20171219,5,한마디로 표현되네 관종 오브 관종의 무한루프 놀이  
20171219,6,"은유적인 영화였던, 심오한 영화였던  영화가 끝나면 사기당한 기분. 그리고 아주 정신없는 화면과 정신없는 연출로 머리속을 산만한게 하는 영화  "
20171219,10,처음엔 스릴러로 가다가 후반부는 킹스맨이네요  
20171218,7,비현실적이고 비전형적인 전혀 느껴보지 못한 새로운 영화  
20171218,1,집안에서 갑자기 철조망이 생기더니..어?총격전 ㅋㅋㅋ  극적인 스토리를 위해서지만 가정집에 ....  
20171218,1,초반부터 지루해서 이 속에 어떤은유가 숨어 있는지 조차 궁금하지 않군  
20171218,6,임수연 평론가의 평이 가장 정확한 듯. 왜 요즘 영화들은 이렇게 상징과 암시의 향연이 되어 버렸는지 모르겠다. 상징과 관객의 감정이 같이 움직이게 만들어줘야지원...영화 보는 내내 이건 무슨 뜻이지? ㅎㅎ  
20171218,10,정말 난해한 영화였지만 인간의 대한 이기심을 적나라하게 그려낸 영화. 잘봤습니다.  
20171217,6,기대를 많이 한탓에 본영화인데너무 난장판이다  
20171217,8,차라리 제목을 시인으로 했으면.  
20171217,1,"성경이고 은유고 나발이고, 진짜 시간 아까운 영화  "
20171217,6,"신에게 인간관점으로 부인이 있다고 가정하면, 자기 아들 죽여서 사람들에게 나눠 주면, 엄마 입장에선 미치고 팔짝 뛸 노릇이지..  "
20171217,7,리뷰보니 이해간다....넘나 은유적인 영화...  
20171217,5,유치하기 그지없는 결말...  
20171217,10,꼭봐야되는 영화는 절대로 아니지만....봐야되는 영화. 뭐라고 딱! 설명하기가 어려움.  
20171217,1,보는내내 열불나는 영화 오기로 끝까지 봤다 내몸에서 사리가 나올것같다  
20171217,6,이런 난해하고 짜증나는 외국영화는 첨인듯..루실 아저씨 착한 역이다 했더니 역시나 실망시키진 않네요  
20171216,5,영화의 메세지가 뭔지 감독의 의도가 뭔지 이해함.. 그런데 굉장히 거북했음 어쩔 수 없는 사실이고 수명이 줄어든 느낌임 내가 로렌스였으면 상상이상으로 다 죽여버렸을 듯  
20171216,8,인류의 역사 그모든것이 집약되어있다 그역사의 시작이자 마지막이고 가장많은 고통과아픔을 겪었을 그이름 마더!  
20171215,1,진심 안보는게 좋습니다. 난해하고 끝맛이 아주 불쾌하고 심신미약은 보지말아야할 최악의 영화입니다.  
20171215,1,이게 영화냐? 욕만 나오네  
20171215,9,"평점보고 별기대를 안했는데 라스트가 기분 더러워서 그렇지 소재도 신선했고 처음부터 끝까지 몰입하면서 봤는데 연출, 연기 모두 괜찮았다.  정말 미스터리, 스릴러물에 약간의 공포도 느끼면서 반전 아닌 반전의 여운이 짙게 남았다..  "
20171215,8,서양식 요괴 영화임 여주인공 이쁨  
20171215,9,신을 인간 수준으로 끌어내린 영화. 다만 참신성과 표현력을 높이 평가한다.  
20171215,5,종교라는 개념을 탑재하지 않고. 자연이라는 개념을 봤을때도 그냥 그런영화. 스릴러도 아니고. 그냥. 마더인지 머더인지.. 나중 쓸데없는 잔인한 장면만 내놓음.  보다가 언제 끝나나 영화기 기네. 반전이 있나?라는 생각을 했다가..치잇하고 만 영화.  
20171215,7,역겹지만 인간의 이기심과 신의 인간에 대한 맹목적 사랑을 이렇게 연출한건 천재적임. 마더를 자연으로 본다면 그 고통이 북극의 눈물보다 훨씬 극적으로 와닿음  
20171215,1,종교에 빠진 정신병자가 영화만들면 이렇게 됨  
20171215,1,쓰레기 중에 쓰래기 같은 영화. 항상 개독교들은 아주 개ㅈㄹ을 하는구먼... 어떻게 해서든 개독교 판을 만들려고 개 안달에 OOOO이야...  정말 개독교들이여 좀 조용히 살면 안 되나... 꼭  이런 식으로 개ㅈㄹ을 해야 하나... 에잇 퉷...  
20171215,8,그러니까 나는 무교다.  
20171215,10,영화를 보며 제니퍼 로렌스의 심정을 이해 못하는 사람은 없겠죠. 모든게 확 와닿는 명작입니다.  
20171214,7,"굳이 거창한 종교관과 세계관의 은유법을 대입하지 않더라도, 생을 마감하는 마지막 순간까지 조건없는 무한한 희생을 결코 마다하지않는 우리네들 어머니의 모습을 떠올리며 가슴 한켠이 시렸다면, 당신은 이 영화를 가치있게 본 것이다.  "
20171214,10,신을 섬기겠단 종교집단. 섬긴다는 이유면 살인과 폭력과 절도와 강간 모든게 합당하지. 무법천지에서 사랑과 질서 와 권리를 외쳐봐야 미치광이로 내몰고. 죄는 죄대로 짓고살면서 회개와 용서라니. 말뚝을 때려박아놓고 희생을 기리다니.. 이 영화는 10점이다  
20171214,1,올해 본 최악의 영화. 아니 내생에 최악의 영화일 수도ㅋ  
20171214,8,"종교를 믿는 사람이 보면 무지 충격먹을 영화. 그 난리가 지나간 후에도 마더가 가진 단 한가지 바람은 집에서 나가는 것이었다. 하지만 마더는 집 자체, 벽에 귀를 기울이면 심장이 뛴다. 지금까지 종교 관점을 한번에 뒤집는 엄청난 아이러니의 영화.  "
20171214,10,기독교적 배경지식없이 본다면 황당하고 비현실만 가득한 영화일테고 그게 아니라면 사실 너무 쉬운 은유와 스토리다. 해석이 당췌어려울게 없음. 성경에 나온 창조 부터 멸망까지를 영화적상상력으로 창조된 ‘엄마’의 시선에서 보고 느끼는것일 뿐.  
20171214,6,재밌음. 근데 감독과 생각이 다름. 자연이나 이치가 제일 무서운데. 마더는 호구가 아니야. 이치 이후에 창조주가 있나요? 영화로 겨우 이 정도의 상징사전을 만드는 이유가 뭘까. 돈 벌려고? 추상화를 그리자! 그게 빠르고 경제적이야.  
20171213,10,"우리 자신을 너무나 선명하게 보여준 영화. 남에겐 배려하나 자신의 가족이겐 홀대하고, 끝없는 욕망에 사로잡혀 눈이먼...이것이 하나님의 계획인가. 인간의 본성은 악인가.  "
20171213,5,해몽은 멋드러지나 영화가 악몽이다. 모든 걸 이해했다 해도 절대 재밌지가 않다.  
20171213,1,   충격적이다....    먼내용인지  1도 이해가안간다...  
20171213,1,아  ㅆ  bal     정말  욕만  나온다   너  혼자  영화  만들어서  너  혼자만  봐라  
20171213,2,마더파더 젠틀맨 뭘 말하려는지 알기에는 너무 지루하다  
20171213,7,"인기와 그에 대한 열망, 애정은 얼마나 무서운 것인가에 대한 상징과 은유.  "
20171213,8,대런 아로노프스키가 너무 멀리 가지만 않았으면 좋겠다.  
20171213,1,아 ㅅㅂ 해석보고 영화보라는거야 머야 그럴거면 첫장면에 성경을 기초로 비유와 상징으로 만든 영화라고 하든가 ..천재감독은 무슨 미친감독이지.. 아 진짜 스릴러인지알고 끝까지 참고 보다 마지막에 모니터 부슬뻔했네  
20171213,10,시작하고 결말보기전까진 개암걸려 OOO줄알았다  
20171213,3,"비기독교인으로서 처음엔 단순 스릴러인줄 알았다가, 종교의 폭력성, 인종문제, 예술에 대한 광기로 추론해갔는데 결국 성경에 대한 내용이란 걸 보고 허탈했다 성경을 모르는 입장에서 개연성은 똥망. 기독교인이 아니라면 차라리 모든 후기를 보고 영화 보시길  "
20171213,1,기독교를 자기 마음대로 해석한 영화. 그 이상도 이하도 아니다.  
20171213,1,기분 더럽다...최악이네  
20171213,8,한편의 꿈을 본거같은 느낌  
20171213,10,무신론자지만 영화보는 내내 몰입했고 다양한 해석글을 보고 더 소름느낌.. 성경내용은 잘 모르지만 몰라도됨. 자연에게 미안한느낌듬.  
20171213,8,"처음 봤을 땐 너무 여주인공 주변 사람들의 예의 없는 비이성적인 모습에 기분이 나빠서 화가 났는데,, 영화를 다 보고 의미를 알고보니 그렇게 행동했던 이유가 가슴에 오랫동안 남는 것 같아요 추천합니다 단, 영상이 잔인할수있음  "
20171213,9,정말 미친영화! 보는내내 텐션이 1센치도 떨어지지  못했고  내가 영화를 보고있는건지 악몽을 꾸고있는건지 착각이 들정도의 환각 증세에 화면밖을 봐야지 이게 영화라는걸 느낄정도 였다  대런 감독은 정말 미쳤다...  
20171213,1,왠만하면 잼없어도 참는데 정말 넘하네요똥을 보는것도 기분더러운데 똥을 씹어 먹은 느낌이 팍팍드네요해설을 봐도 기분나빠  
20171213,6,"상업 영화 감독이 이런 영화를 만들고 유명 배우들이 많이 출연한 것이 무척 놀라웠음. 그러나, 감독의 의도를 고려하면, 영화의 내용이 너무 가볍다고 생각함. 마지막 장면에서는 약간 웃음이 나왔음.  "
20171213,1,남편새끼를 대신 죽여버리고 싶어서 집중이 안되는 영화.  근데 결국 남편새끼가 신?ㅋㅋ 제니퍼는 암걸려서 OOO 무한루프 쓰레기영화  
20171212,7,그냥 저냥 나쁘지 않음..  
20171212,10,저는 너무 재미있게 봤습니다제니퍼로렌스 너무 이쁘고. 하비에르바르뎀 너무 멋있어요  
20171212,10,성경을 모른다면 그냥 답답하고 끔찍할 영화. 아는사람에겐 은유를 찾는 재미가 쏠쏠한영화.  
20171212,4,어머니 VS 맘충의 대결구도 같은 영화.  
20171212,5,해석하기에 따라서는 잘못된 생각을 할수도 있는 영화..감독만의 생각을 관객이 어찌 다 알수있을까..  
20171212,8,"성경을 잘 모르는 나도 감독이 비유하는것이 어떤것인지 짐작할 수 있었다 이기적이고 타락한 인간들이 ""집""을 파괴하는것은 곧 인간이 사는 세계를 표현하는것이 아닐까. 결국 ""리셋""만이 답인것인가. 어렵고 불친절하지만 러닝타임내내 몰입감이 좋았  "
20171212,3,영화에 빠져들면서 자연스레 종교적 이야기구나를 알게되었지만 너무  상징적요소가 과한 영화. 종교적 소재였단걸 알았다면 보지도 않았을것이다.  
20171211,10,"표현했다는 것 자체가 의미있고, 가치 있다고 생각한다..  "
20171211,7,"변주 속 연출에서 들어나는,  인간 본연의 얼굴.  "
20171211,6,안봤는데 평점보니 암걸릴것 같아 안봅니다...!!!  
20171211,5,대충 은유적으로 판타지적으로 만들어놓고 온갖 의미를 담으면 그게 명작이 되는 줄 아는가 보다..  
20171211,1,대체 뭘 말하려했던 거야  
20171211,1,아 짜증을 참고 보다가 이럴줄은 몰랐네. 감독아 너무 갔다 진짜. 너무 영화제 의식하는거 아니냐.  
20171211,1,비유와 상징? 중2병 걸린 감독이 멋지게 보니고 싶어 만든 영화 같은데  
20171211,3,개독새끼들 불태울때 존나 통쾌!  
20171211,1,신이 할짓없이 맨날  와이프만 창조하냐?  일부 다처제냐?  진짜신이 얼마나 할일이 없는지를 여실히 보여주는 영화임  
20171211,1,기독교 상징 보다보니 눈치챘는데 영화만드는건 감독맘이지만 저란식에 예술허세치면서 개독교스토리는 전혀보고싶지않음  
20171211,5,코미디영화 재미있게잘봤습니다  어이없는설정에 나도모르게헛웃음이나더군요 ㅋㅋㅋ  
20171211,1,영화 처음에는 남편이 쓰레기처럼 느껴지다어느새 영화감독이 쓰레기 처럼느껴졌다마지막에는 영화를 본 내가 쓰레기 처럼 느껴지는 영화  
20171211,8,제목의 마더란 인간의 엄마인 여자가 아닌 mother of nature로 봐야할듯. 이것 혼동하면 상당히 위험한 영화. 다주는게 인간 마더가 아니에요.  자연은 인간에게 다 주지만.. 혼동하면 이성이 파괴됩니다.  
20171210,9,"돈벌이 출세한답시고, 아내의 사랑을 뽑아먹고 바깥에서 남들과 어울리는 남자들 정신차려라. 가정의 에너지는 가정에서 쓰고 바깥에서 쓸 에너지는 바깥에서 구해서 쓰는 것이 답. 관객의 수준에 따라 여러 모로 해석가능한, 2017년에 나온 고전영화.  "
20171210,2,이걸 재밋다고 해야 영화좀 보네..소리들을건가?? 그냥 찝찝함 그자체 로렌스때문에 그나마 1점더준다  
20171210,1,말이 필요없음~시간이 아까움  
20171210,5,성경적인 비유였나. 대지를 마더 어쓰 라고도 하죠. 지구를 막 대하는 인간에게 결국 지구가 벌을 내리는 장면이었군요. 그러고 신은 다시 세상을 창조하면 그만이라는 전지적인 무책임함. 안타까운건 영화가 너무 불친절하다는거다. 설명에 인색한 영화였다  
