0,1,2
20171210,7,레퀴엠은 감독이 약 빨고 만들었네라는 느낌이였다면 마더는 아 이 감독 약빨 떨어졌네라는 느낌.  
20171210,1,감독아 정도껏 해라 없어 보인다  
20171210,10,최고의 영화 추천합니다  
20171210,8,일단 대단한 영화임엔 분명한데 나 왜 병 걸릴것같지  
20171210,9,이해할 수 있는 사람들만 이해하는 영화. 난해함 속에 해답이 있다.  
20171210,2,"너희는 이것을 모두 받아 먹어라, 이는 너희를 위해 내어주는 내 몸이니라...영성체 예식을 이런식으로 표현하다니..충격적이다. 유대인, 비유대인을 나눈 것과 경찰의 진압은 분명 로마인들의 탄압을 표현한 것이겠지. 제니퍼 로랜스의 연기력만 빛났을 뿐.  "
20171210,7,"이영화는 성서속의 마리아를 바라보는 인간의,여성 특히 어머니의 시선으로 그려낸 영화이다. 창조주의 이야기인 성경 조차도 엄마를 희생을 당연시 한다는 인간적인 시선이 담겨있다  "
20171210,1,짬짜면. 노잼. 끝까지 불편할뿐.  
20171210,9,"영화는 한마디로 세상은 요지경을 말하는 듯... 보면서 뜻을 혼자 유추해내는 재미는 있었지만, 핵고구마 얹게 하는 내용때문에 영화가 끝나면 내가 잿더미를 뒤집어 쓴 기분이 들게 한다ㅠㅠ  "
20171210,8,세상은 고약한 취미를 가진 신이 만든 난장판.  
20171210,1,염병OO하는 영화가 바로 이것  
20171210,10,"한 부부의 이야기로 비유된 성경이야기. 신과 종교의 아이러니까지 느껴지게 만든  감독의 발상이 너무 천재적이다! 비유를 이애못하면 망작이라 느낄 영화,  "
20171210,6,감독이 제정신 아닌건 알았지만 이건 좀 인간이 멸종해야 한다고 하는 거같은 영화  
20171210,1,"1점이라도 준건 제니퍼 연기때문, 토할거같은 저질 영화다.  "
20171210,6,영화가 아니라 연극으로 만들었으면 이렇게 평이 극단적으로 갈리지 않았을것.  
20171210,10,주연들의 연기가 쩌네요..  
20171210,1,아 정말 쓰레기 사이코 영화네요~ 스릴러가 아닌 호러네요~ 정말 재미없습니다!!  
20171210,1,너무 억지스럽게 껴맞추려한 느낌.  
20171210,8,보는 내내 불편했다. 마지막에 그가 신이었다는 사실을 알고서는 더 그랬다. 내가 불편함을 느꼈던 그런 부류의 인간 중 하나라는 사실에.  
20171210,1,이런영화 평점을 왜주나 모든걸 과장한 종교 사기영화인데  
20171210,6,웃으면안돼ㅋ 진지한예술영화라규  
20171210,8,오만한 인간에게 던지는 가장 통렬한 비유  
20171210,8,보는 내내 불편하다...불안하다...집을(지구를) 엉망으로 만든 사람들은 이 지구를 엉망으로 만든 우리를 말하는 것일 것이다. 계속 우리가 방종한다면 그 끝은 이영화의 결말과 같을 것....이 지구는 인류의 탄생과 함께 죽어가기 시작했다  
20171210,4,무교라 근가 ?  이해안됨  종교 가져보려고 설교동영상 여러편돌려보고 포기했을때 기분  기독교인들을 위한 영화인가  
20171210,2,찬욱이는 양반이 었구나  
20171210,10,"마블 히어로만 주구장창 찍어대던 나라에서 이런 영화 만들었다는 것만도 환영할 일. 별로 어려운 내용 아니던데...마더=지구, 남편=종교의 신, 나머지는 개난장판이 된 인간세상의 축소판.  "
20171210,9,"아..나는 ""남주 = 가장, 여주 = 아내, 불청객 = 돈""으로 생각하고 봣는데,마지막쯤에 남주가 여주에게 이런말을하지""난 저들을 쫒아내지 못하겟어""  "
20171210,1,지금 영화 보면서 하도 개답답해서 더이상 못보겠다 OOO기 영화 이거보다가 암걸릴듯  
20171210,10,그로테스크한 라스트신은 전율 이였다...제니퍼와 바르뎀과 대런에게 경배를...  
20171210,7,"그의 역사로 회귀하고야 마는, 폭력. 누군가는 저 지긋한 반복을 끝내야 한다.  "
20171210,1,진짜 개 10 쓰 ㄴ래기영화. 감독이 약빨고 만든 바로 그영화. 약빨면 나타날수 있는 전개 개연성.  그게 다인영화. ㅈ같은 영화 ㅆ ㅂ쓰래기같은 영화. 감독이 약빨앗지만 그와중에 나 어려운 영화좀 본다는 ㅅㄲ ㅣ들이 좋다고 들고 설칠영화.  
20171210,9,"아기죽고나서도 용서해야된다고 할때  개소름  신을 냉정하게 조롱하는 장면이다  온갖추악한 군상들은 바로 우리들의 모습이고 그들을 무조건 용서하는건 남자,  로렌스는 한발 물러나서 신과우리들의 모습을  비춰주는듯  "
20171210,8,예술이나 성경적인  얘기가 아닌 그냥 드라마였으면 더나았을거같은데..암튼 몰입되고 잘봤습니다.  
20171210,1,그래 끝까지 이해못한 내가 바보다.  
20171210,1,끝으로 갈수록  이야기 산으로가네... 보면볼수록짜증만유발하게만들고 오죽하면 끝에는그냥안봤을까..시간만버렸네  
20171210,7,아..  볼수록 실망스러움..  
20171209,1,"유명해지면 똥을 싸라. 그래도 박수를 받을 테니, 란 병맛 명언이 가장 잘 어울리는 영화. 어설픈 상징은 예술일 수 없다.  "
20171209,1,이런..뭐..아놔ㅋㅋㅋ중반까진재밌게봤었는데갑자기임신하면서이상해지더니 결말은진짜아놔ㅡㅡ종교영화인줄알았음안봤을텐데;;  
20171209,8,창작이라는 것의 고통을 한 부부의 이야기를 통해 그려낸듯한 영화. 모든것을 창조하고 다시 부수는 과정의 반복이 즉 창작의 과정이라는 것을 보여주려는 것 같은 느낌이었으나 영화적 표현이 너무 과격해서 보기가 힘들었던 작품.  
20171209,10,2017년 최고의 영화 !!! 전편을 휘감는 큰 그림과 암시 비유 풍자 등 최고의 결말을 선사한 영화!! 기독교인들이 어떻게 평가할 지 궁금해 진다  
20171209,4,곡성 매니아인데마더보고나니 한숨나오네요제니퍼 혼자 열일했고하비에르바이뎀 데려다 정말 망작만든듯  
20171209,8,오호 잼있는데 하비에르가  스스로있는자  성경의 하나님임 그걸알고보면 졸잼있음  
20171209,1,"옜다 관심 ....,....,....,....,  "
20171209,9,지금 우리인간이 사는세상은 공포의 연속이다.하루하루 치열하게 살아가는것자체가 공포이며 무의식속에 죽음에 대한공포도 존재한다 이영화는 그런공포속에서 사는 인간의 모습을 투영한것이 아닐까  
20171209,1,처음에흥미로왔는데갈수록삼천포루빠지는이해할수없는영화이영화만든감독은이해하구영활만들었는지묻고싶다 아~  시간낭비지데루햇네  
20171209,4,종교를 까던 찬양하던 공감이 가야되는데 전혀 공감ㅇ안되는 고구마 1억개 영화. 자신만의 세계에 빠져서 ...전혀.  
20171209,9,당신은 나를 사랑하는게 아니야! 당신을 사랑하는 내 모습을 사랑하는 거지! 신(바르뎀)은 에드해리스(아담)의 갈비뼈를 빼서 미셀파이퍼(이브)를 만들고 도널글리슨(카인)이 싸움끝에 브라이언글리슨(아벨)을 죽인다. 그리고 마더(제니퍼)는 예수를 낳는다  
20171209,9,어렵지 않고 친절하다. 종교가 없는 나도 몰입할 수 있는 영화. 해석 먼저 본다면 큰 실수.  영화 보는 내내 감독에 대한 의구심이 들었지만 대런은 천재였다.  
20171209,8,볼수록 생각할수록 높아지는 평점  
20171209,9,어떤감독은 약빨고 영화를 제작하고 어떤감독은 저승을 다녀와서 제작하고...단언코 영화에서 볼 수 있는 가장 현실적인 저승이다..  
20171209,1, 보는내내 불편하기만한 유치한 은유와 의도가 뻔한 영화다.  
20171209,9,로렌스의 노브라냐 ㅡ 집을 강탈하는 폭도가 되느냐 ㅡ 바르뎀의 창조냐 ㅡ 음 역시 노브라  
20171209,1,"특정종교인이 아니라면, 혹은 그것에 대해 알고 있는 사람이 아니라면, 그냥 똥, 쓰레기, 오물 과 같은 영화역사상 최악의 영화중 하나로 기억될 것. 똑같이 돈을 주고 보는데 일부의 사람들만 이해한다면 그것은 영화가 아니고 똥이 맞지  "
20171209,10,제니퍼 로렌스의 노브라를 본게 어디냐  
20171209,8,"영화해석 알아야 볼수 있는 영화/제니퍼=대자연=인간의타고난본성(순수영혼), 하비에르=종교/신=에고/ 인간들=세상 /으로 대입해서 봐도 좋았음/ 종교인으로써 좋은 영화인것 같고 종교/교리의 교만함은 질책받아 마땅함/  "
20171209,9,-잔디밭에 들어가지 마시오-를 무시하는 사람들  
20171209,1,OO들을 해요 하나도 이해안가는구만 평점 좋게 주는 인가들 지네가 뭔 이해한척 아는척 꼴깝을한다 이해안된다면 무식해보이지?니들중에 이해한세끼 있음 내손모가지를 건다 1도 아깝다 이영화  
20171209,4,자고로 글 쓰는 남자와 임신한 여자는 피하는게 상책.  
20171209,9,예수는 자신을 사랑하는 사람을 사랑한다. 물론 그것도 예수를 사랑한다는 인간들이 지어낸 말이겠지만..  
20171209,1,한마디로 그지같음..어필되는거없이 짜증유발케하는영화.뒤끝은 더 않좋음..붹  
20171208,1,"일반인이 본다면 대체 무슨 내용인지 모르고, 사람들의 태도를 보고 분이 날 것이다. 다만 여러 상징을 생각해 보니 특정 종교가 떠올랐고, 악의적인 왜곡으로 가득 찬 것을 알 수 있었다. 그리고 악의적인 특정 종교 비판 영화로 결론을 내렸다.  "
20171208,10,종교를 비판하기 위해 종교를 이해해야 하는 모순된 영화  
20171208,1,결국 이영화를본 당신도 결국 저들중의 하나가 될것이다..라고 단언컨데 감독은 말합니다(감독혼자 극찬한 영화)....혹은 암전문 보험회사에서 만든게아닐까 싶기도하고;;;  
20171208,10,재미있었어요ㅜㅜ이런영화짱좋아  
20171208,7,영화제목을 마더보다 메리지라고 하는게 더 어울릴듯  여자의 크리스탈 사리로 유지되는 남자의 집=메리지  
20171208,10,영화가 너무도 고통스럽다. 내 자신이 저 지독한 군상떨고 광광대는 인간이라는게 죄스럽게 느껴지고 참으로 잘 만들었는데 보는것만으로도 스트레스가 너무도 심한 영화라 두번 다시는 또한 보고 싶지가 않다.  
20171208,1,아 OOO기영화 돈이아깝다  
20171208,10,"인간 존재에 대해서, 또한 창조하는 자에 대한 많은 생각을 품게 하는 영화. 그런 동시에 늘 품었던 의구심이 더욱 더 밀려오게 만들기도 한다.  "
20171208,9,불안감과 긴장감을 느끼게 만드는 감독의 연출 방식이 대단했고 뒤늦게 깨닫게 되는 의미도 충격적이었다. 많은 걸 생각하게 만드는 영화.  
20171208,7,스릴러인줄 알았는데 전쟁영화였네  
20171208,7,초반 불청객 의사  등에 있던 상처가 아담의 갈비뼈 였다니 ㄷㄷ  
20171208,1,"아, 무슨 엄청난 철학과 예술이 들어갔는지는 모르겠는데... 도저히 지루하고 답답해서 못봐주겠다. 45분 포기.  "
20171208,1,노잼 ㅎㅌㅊ 시간낭비 ㅇㅈ? 어 ㅇㅈ~  
20171208,7,지구(자연)아 미안하다.  아낌없이 주기만 하는 자연에게 나를 비롯한 인간들은 뭘더 얻으려 하는건가ㅠㅠ  
20171208,7,신의 세계에선 인간의 큰 희생이 필요하다.  
20171208,1,남편이 암유발자.. 중반이후로 스토리가 지루하고 유치해짐.  
20171208,1,마더 뭐가 마지막 애기 죽어서 불싸지르는게 마더야 근데 어디서 모성애를 느껴야 되지 2시간보는 내내 짜증나고 후반부 수백명의 파티속 미치광이들의 속터지는 개독들 재수없다 꺼져 썅  
20171208,7,신이 양아치네 ㅋㅋㅋ .  
20171208,1,보다가 암걸리는 영화 최악  
20171208,3,화재로 모든걸 잃은 중년시인과 결혼한 젊은아내는 어느날 찾아온 낯선가족의 살인사건과 임신을 통해 남편이 새로운 작품을 발표하자 수많은 광팬이 찾아와 난동부리고 갖난 아기까지 해치자 집을 불살라 버리나 남편은 인간이 아닌 존재였고 이모든걸 다시 창조한다  
20171208,8,"예술은 본질적으로 기만이므로, 거창해지면 우스꽝스러워진다. 대런 아로노프스키의 얼굴에서 스티브 잡스를 보다.  "
20171208,10,어머니가 겪은 인고의 단면을  2시간동안 만 지켜 보는 것 뿐인데  견디기 힘들고 화나고 먹먹하고 ... 애들아  남편들아  어머니 속  썩히지 마라  
20171208,1,결국 아기가 예수라는거고 결국 개독영화가 되어버리는군  
20171208,1,"중반이후로 속터지는 영화, 영화임을 포기한 의미부여 알고싶지도 않다  "
20171208,8,멋대로 만들었으니 멋대로 생각하는 게 맞다. 문단속 잘 하자.  
20171208,1,"이딴 쓰레기 영화에 상징성, 연출 의도, 예술을 찾는 평점 알바 새끼들한테 당했다. 보다가 정신병 걸릴 뻔... 멀미는 전혀 안 나고 일단 남편, 아내 둘다 싸이코인데 남편이 훨씬 싸이코. 임신한 아내를 두고서 집에 사람 수십 수백명 들여보냄ㅋ  "
20171208,4,배우가 각본은 보고 영화고른건지 의문임  
20171208,7,창작자의 내부에서 한 작품이 영감을 통해 잉태되고 예술로 승화되는 과정을 형상화한 수작.  
20171207,1,내가 왠만하면 네이버에 평점안남기는데 역대 최고 쓰레기영화임  
20171207,1,니가 이기나 내가 이기나 오기로 보는 영화. 결국 내가 이김 큭ㅋㅋ  
20171207,7,자칭 신을 믿는다는 한국 기독교 광신도들이 봤으면 하는 영화 .... 니들이 착하고 기독교인이라고 ? 할렐루야? 너네들이 바로 저 손님들이다  .  
20171207,5,뭔말인진 알겠는데 깝깝해서 5점준다.  
20171207,6,도통 모르겠음; 종교영화인가? 인간들이 신에게 요구만 하고 신은 용서하고 신은 고통을 주며 끝내 우린 신을 저주하나 신은 다시 생명을 주고 아 ㅅㅍ 욕나와~ 마더? 마리아? 머야 이 영화. 영화평을 읽어보던지 해야겠군  
20171207,1,절대 보지말아야 할 영화. 의미없는 영상미와 카메라전환에 의해 토만 나온다.관객들을 조롱하고 화를 내게 만든다.기독교적 의미? 상징성? 엮어놓은 말에 불과하다.보면 짜증만 난다.  
20171207,8,아무내용도 모르고 봤는데 뭔 영화가 뜬금없이 난잡하냐 했는데 감독의도를 알고다시보니 잘만든영화다  
20171207,8,연출력이 뒷받침되지 않는다면 꿈꿀 수 없는 아이디어  
20171207,9,페미니즘적 자아로 본 도그마의 모순을 표현한 석호빌라 B02호. 그럴듯한 상징보다는 알기쉽게 후벼파는 날카로움이 아쉬운 판타지.  
20171207,9,"영화 속 상징들을 알지 못한다면, 정말 어렵고도 어려운 영화. 성경에 대한 관심이 별로 없는 나에게는 '뭘 말하고 싶은거야?' 하는 궁금증이 끊임없이 들었지만, 역시나 대런은 대런이었다. 어떤 감독보다도 섬세한 인물들의 심리묘사는 압권이다.  "
20171207,5,본격 순도100% 성악설 광고 영화  
20171207,1,돈주면서 봐라해도 다신 안볼영화  
20171207,3,미술세계는 역시 나와 어울리지 않는다.세계적인 명화에 점하나 찍고 몇십억 팔렸다 등등그림속 예술도 이해 안가는데이 영화도 그런 예술과 비슷한 느낌의 예술.그저 끼리끼리 그들만의 세상이랄까. 그들끼리 이해하고 토론하고 그저 그들끼리 어울리는 영화  
20171207,1,난 이 영화에 과감히 1점을 주겠다  
20171207,8,믿음은 믿음을 주려는 자보다 믿으려는 자의 고통과 희생을 빨아먹고 자란다  
20171207,7,내용은 어렵다. 그러나 몰입도가 장난이 아니다. 그리고 감독 작가와 다르게 내 생각을 가질 수 있는 영화  
20171207,6,"창세기에 입각해 굉장히 기독교적이며, 표현을 소름끼치게 해놨다...지구와 신에 관한 이야기라고 해석됨...종교적 관점을 배제하는 순간 모든게 혼돈이라는게 아쉬운점...  "
20171207,5,별점보게 우리나라 영화수준이 이리 높단말인가  쟝르가머야 도데체 고딕이냐 -_- ㅅㅂ  
20171207,1,이영화는 단하나의 표현으로 말하게된다 좆  
20171207,10,"리뷰보고 해석이 됬어요.. 성경으로 은유해서 쓰레기 인간들 다나옴 (남의 물건 부시고 반성도 없는 인간, 남 배려하지 않는 인간, 종교에 미친 인간, 남의 여자 탐하는 인간, 돈에 미쳐 사람을 죽이는 인간, 포주, 도둑, 전쟁, 학살 등등)  "
20171207,9,영화를 많이 봐서인지 보는 내내 저집과 제니퍼로렌스가 자궁내지 인간의몸 그리고 지구라고 생각하고 남편과 찾아오는 사람들은 암세포등등으로 해석했는데 종교적 관점으로 해석이 되있네요ㅎㅎㅎ어쨋든 되게 몰입해서 인상깊게 봤습니다  
20171207,6,이해 할 수 없지만 끝까지 의문에 대한 해답을 듣고 싶어 보게 되는 영화. 결국 이해 할 순 없었지만 뭔가 대단하단 생각이 든다. 왜 그럴까?  
20171207,2,또 이름난 평론가는 해석 가르치려들며 별5개를 주겟지. 성경을 비유로 가득채우려하였지만 sf도 아니고 공포도 아닌 짬뽕 감독 자신만의 작품이 되어버림. 성경을 빗대는게 우습다  
20171207,9,신의모습을 닮은인간들을  수습하는 모습이 보였졌다 인간들이 내자신의 한부분이라고 느낀걸까 ㅠ  
20171207,1,두번다시 보고싶지 않읏 쓰레기 영화  
20171207,8,이 영화 미쳤다. 앗아간 내 정신  
20171207,4,나같은 영알못은 보다가 암에 걸려서 죽기 직전이다..해석을 보고서야 아..그렇구나 이해한거지 영화를 보는내내 답답함과 두통에 돌아버리는 줄 알았다. 욕만 나온다  
20171207,1,일점도 아까운 영화! 예술이라 포장하면서 감독의 미친 세계를 보여주면서 관객에게 시간과 돈과 정신을 빼앗는 아주 나쁜 영화다!  
20171207,7,"늙은여편내:유혹의 뱀/두아들:가인과아벨/로렌스:마리아/아기:예수/대머리교주:적그리스도/남편:하나님,아담 등 등  "
20171207,8,심볼리즘이나  연출  자체는 굉장히  훌륭하다.그러나 대런 감독이 이제 천재놀이에서 벗어났으면 한다. 더이상 대중매체는 예술가만의 예술이 아니다. 해몽 뿐만 아니라 꿈마저도 훌륭한 영화를  더이상 만들지 않는다면 대중들에게 외면받는 천재감독으로 남을것  
20171207,1,처음 방문객들이 아담 하와 가인 아벨 이었었나 봅니다.  그걸 이해하지 못해 죄송하고..  개독영화가 아니라 반 기독교 영화라고 봅니다만..  정말 재미 없습니다 !  
20171207,9,태초부터 불안정하기만 했던 스스로 존재하는 자  
20171207,6,고등학생 시절 교과서의 시를 잘게 쪼개서 굳이 그 의미를 씹어 먹여주던 국어선생님이 생각난다. 은유도 좋고 상징도 좋지만 결국 영화는 그 자체로 존재할 때 의미가 있는 것이 아닐까? 감상하고 싶지만 학습하게 되었다.  
20171207,5,해석 안봐도 너무 노골적인 비유라 충분히 유추 가능한 내용.. 모든 내용을 상징이랑 은유로 뭉치니 당연히 아다리가 안 맞지... 블랙스완이 명작이라고 일컫어지는건 적절한 상징과 적절한 아다리다. 대런감독 빨리 성경에서 나오길.. 이래서 종교쟁이가 싫어  
20171207,7,"비유도뭣도아니다  신을 뭣대로 조롱하는영화.2시간내내고통받은것을 멋대로 자연에비유했다라고 억지씀,.사이비교주에빠진듯한감독.대자연이여주라면 대자연이자연재해를일으킨걸인간몇놈죽인걸로표현하는데..인간이자연을반격한다?거의죽일정도로? 지진 나면 자연한테보복??  "
20171206,10,시간 가는줄 모르고 본 영화.  
20171206,1,이런영화는이젠지겹다 또 한무리 뭘좀아는척하는것들이 상상의나래를 펼치겟군 허허  
20171206,10,"결국 나 역시도 추악한 불청객들 중 하나에 지나지 않는다는 것을 느끼게 해주는 영화, 참 생각을 많게 해주는 영화  "
20171206,6,"소재도 좋고 배우도 좋고...딱 초반 30분까지만...너무 설명없이 가는 전개가 재미를 반감시킴,  "
20171206,10,시종일관 도배된 불변함에 숨을 제대로 쉴 수 조차 없다. !가 너무나도 많은 것을 함축한다. 이 작품의 세계관을 이해할 수 있는가?  
20171206,1,진짜 웬만해선 평점 안남기는데 1점도 아깝다 하 내시간..  
20171206,1,무한반복은 그 머냐 영화 있는데...제목이 생각안나네... 무한반복 아니길 바랬는데. 창의적인 것도 아니고 이건 머....  
20171206,5,내가 이렇게 무식할 줄이야ㅠㅠ  
20171206,9,신과 같이 사는거 참 피곤하네  
20171206,5,너무 멀리갔다는 생각이 드네요. 종교든 휴머니즘이든  
20171206,4,그냥 개독영화 성경을 모르면 더 이해하기 힘들듯  
20171206,4,도대체 무슨영화인지? 정신병환자들 이야기...무한반복주제는 타영화랑 다른게 없고...제니퍼로렌스 미모때문에 봤다...닝구미..  
20171206,10,"영화가 앞뒤 장면의 개연성이 없고 상징적인것으로 연결되어있어서, 코스요리처럼 친절하게 떠먹여주지 않아서 뷔펫같은 영화  "
20171206,1,별..씹쓰레기같은 영화보느라 시간만 낭비했네..  
20171206,10,바닥에 핏자국은 여인의 마음이었던 것 같습니다. 결국 새까맣게 타버린 여인의 마음이 안타깝습니다. 무엇으로도 덮어 가릴 수 없는 그 마음은 오직 예수 그리스도 주님의 위로만이 영원히 가릴 수 있음을 믿습니다.  
20171206,10,의미를 모르면 이상한영화 하지만 의미를 알고난후에는  이영화가 왜  미친영화인줄 알게된다.  
20171206,10,"와! 감독의 다른시각과 인용, 연출. 제니퍼 로렌스의 연기는.. 좋았다.  "
20171206,1,보는 내내 기분 더러워 죽는줄 알았다. 시작부터 결말까지 내 인생 최악의 OOO기 핵폐기물급 개독영화. 종교영화는 이래서 걸러야 하는가보다  
20171206,7,영화에 날이 잔뜩 서있다. 보는사람조차 신경쇠약에 걸릴듯한 공기  
20171206,5,"같은 류의 한국영화라도 항상 헐리웃보다 줫문가짓으로 폄하하는 줫티즌급식들 ㅈㄴ 그럴듯한 미사여구로 포장한다고 애쓴다 ㅎㅎ 양심적으로 가자;  ㅈㄴ 급식문가들 딴에 허세분석,(알맹이는없고 죄다 추상적단어남발  줫식견있는양 )개극혐  "
20171206,7,"그녀의 외침과 절규는 세상의, 지구인들, 지구의 절규  "
20171206,10,나에게는 대작이였음 해석하는 재미도 있고 종교를 비판하는 내용도 흥미로움  
20171206,1,중간정도까지 몰입하고 보다가 막장인거 같아서 바로 skip하고 결말을 보니 역시 막장이구나 생각이 든다. 그냥 보지마삼.  그냥 모든게 다 허상임.  
20171206,5,제니퍼로렌스가  그래서 명치를 부여잡았나봄. 홧병사리각. 근데 연기훌륭한지 모르겠음. 유명세빨이지. 마지막 내용은 기분이 그냥 더러움. 홧병사리각  
20171206,9,놀라운 영화다 남편이 창조주 즉 신이라 생각하면 영화의 이해에 도움이 될거다  
20171206,5,"의도는 알겠는데 굳이 마지막을 sf로 가야만했는지 너무 억지감독의 의도대로 만들려면 어쩔수없는 거라 생각들지만서도 그냥 너무 억지야억지,,  "
20171206,1,개 사이비 감독쌔이 다신 니꺼 안 본다 배우들이 아깝다뭐 대단하게 만들고 싶었는지 싶다 꼬지말고 그냥 기독교 영화 만들든가 개독교 안 믿는 사람들 헷갈리게 하지말고 OO아  
20171206,1,0점이 없어서 1점 줌.  
20171206,10,"인간의 끝없는 욕심, 반복되는 죄악을 기독교가 타락되는 역사의 과정에 표현한 매우 직설적이고 상징적인 영화.  "
20171205,8,성경을 조금이라도 이해하고 깔고 가야 영화의 의미를 이해하는 영화. 그 의미를 동시에 해석하지 않으면 노잼 노연애 노와이프  
20171205,3,"상징성? 의미? 아오 진짜.. 왜이렇게 있어뵈는 인간들이 많냐. 내가 이놈의 암걸리는 영화를 2시간동안 끝까지 본건 저 불쾌한 것들을 어떻게 쓸어버리는지 궁금해서였다. 영화속 무례한 것들로부터 스트레스받고, 영화밖 댓글로 두배 더 빡친다.  "
20171205,1,신어 포용과 관대함을 왜이리 잔인하게 표현하는지 모르겠네요. 자신의 아기를 죽이는건 뭔가요?  
20171205,9,관람객이런영화 좋어 재밋어 돌려까기  
20171204,1,신은 무슨 ㅉ 10자가 아깝다  
20171203,6,이 영화를 추천하거나 비판하고 싶지가 않다. 전체적인 틀은 종교에 맞춰져 있는데 종교를 옹호하기 보다 비판을 한 점이 영화를 보면서 마음에 들었고영화에서 비춰주는 여성(으로 표현된)의 모습이 헌신적이여서 안타까웠을 뿐 그 이상도 이하도 아니였다.  
20171202,1,시간 돈 아깝다 그지같다  
