0,1,2
20171210,9,특별시민2네라고 생각없이 보다가 뜬금반전에 돌아가신 아버지 생각나서 펑펑울었다  
20171210,10,관람객꿀잼이에요 꼭보세요 ㅋㅋ  
20171210,10,원작에 비해서 구성이나 연출의 섬세함과 세련미가 떨어지긴 하지만 배우들의 연기력으로 많이 커버된것 같아서 10점드려요  
20171210,10,원인제공한 딸이 가장 죄인이네요.. 아버지 사랑에 왜 참견인지...  
20171210,10,관람객최민식씨 연기에 빠져들었네요  
20171210,8,볼만해요 10자이상...  
20171210,1,최민식의 연기력에 10%밖에 안 쓴 너무 조용한 영화. 최민식은 뭔가 폭발하는 듯한 연기력이 일품인데 여기선 대기업 회장으로 나와서 처음부터 끝까지 너무 조용... 최민식 형 작품 좀 제대로 고르자ㅠㅠ  
20171210,10,역시 민식형님의 연기력은 깔수가없네요 ㅜ ㅜ진짜 최고입니다  
20171210,10,베스트  총평이 가장 맞는 말만 골라서 하신 것 같네요  
20171210,9,자식새끼 잘키워야한다.  
20171210,7,"내용은 좀 그렇지만 이것이 가장의 그릇인듯..마지막에 최민식이 화장대에 걸쳐앉아서 침묵하다가""미안해.""하는데 진짜 슬펏음..  "
20171210,4,엉성하고 빈약한  이야기... 오직 마지막 반전하나를 위한 구성  
20171210,10,너무너무 멋진영화 여운이 가시질않네요  
20171210,8,솔직히 스토리는 좀 말도 안되는데보면서 최소 두 번 울었습니다진짜 삐끗하면 돈 아까운 삼류영화가 됐을 법 한데연출을 잘 하신 건지 배우들 덕인지이상하게 그럴듯하네요스트리밍이 없어서 다운로드 받았는데 소장할만한 영화입니다  
20171209,3,주차장에 류준열 찾으러간다는 검사는 어디가고 늦게 출발한 박신혜만 도착해서 최민식이 류준열이랑 짜고 납치 연기하는걸 구경하고있어 ㅋㅋ 그리고 류준열은 돈도 필요없는 이하늬 골수팬이라면서 이하늬 죽인 범인 바꿔치기에 적극협조.. 개연성은 진짜 최악이다  
20171209,5,과연 딸앞에서 재벌이 저렇게 할 사람이 있을까?모두 다 돈으로 누군가희생양을 사려고 하겠지...내용은 아름답지만 좀 억지스럽다  
20171209,6,평점이 너무 높은듯. 솔직히 너무 억지이고 개연성도 너무 떨어짐 그냥 최민식이라 그런거지..  
20171209,1,재벌딸년은 살인을 해도 부성애로 아름답게 포장될 수 있음을 보여준 영화.영화는 영화로 받아들이고 싶은데 이딴 메시지는 너무 역겹다.이하늬도 누군가의 소중한 딸이다.  
20171209,5,재미없다... 추천하지않음  
20171209,10,이렇게 가장을 다시생각하게한적은 없다고 생각합니다 개인적으로  
20171209,10,가슴이 참 먹먹해지는 영화.. 잘보았습니다..베댓님 말씀처럼 중년남자의 두가지 사랑을 보여주는 영화.. 여운이 깊게 남을것같습니다..  
20171209,10,역시 최민식입니다 간만에 좋은 영화  
20171209,8,슬프고 아름답게 마무리. 출연 배우 모두 연기 굿. 끝까지 집중하게 함. 여주인공 예쁨.  
20171209,10,아 정말 재미있습니다. 슬픕니다  
20171209,10,펑펑울었다 올해본영화중 세손가락 안에 꼽히는 영화  
20171209,9,관람객보는 내내  흥미진진 역시  최민식  
20171209,6,돈많은 아버지만 가능한 침묵..태국 프로젝트는 그저 놀라울 따름..^&^  
20171209,9,관람객최민식 역시 연기 짱넘 재밌게봤어여  
20171209,8,자식이 없는 사람들은 이해하기 힘든 내용  
20171209,7,딸이 진짜 범인인거죠?  
20171209,8,최민식만이 할 수 있는 연기. 내부자들이 현실보다 덜 영화같아져 버린 영화라 논리가 어쩌고 이야기하는 평론가들은 참 시대착오적이다. 그렇게 따지면 히어로무비는 영화도 아니냐. 두 가지 사랑에 대한 한 남자의 진심을 영화적으로 잘 담아냈다.  
20171209,10,"눈 물 지리며 봤습니다. 이따위 영화가 한국에서 개봉하다니 헐리우드 안부러움,, 인생영화...  "
20171209,10,이 영화가 50만명 밖에 관객 동원을 못했다니... 홍보가 덜 된것인가... 배급사를 잘못 만난것인가? 올해 개봉한 한국영화중 가장 몰입도가 높고 여운이 남는 영화가 아닐까싶다.  
20171209,8,역시.. 믿고보는 최민식  
20171209,10,최민식 최고입니다....  
20171209,7,사실 스토리 좋고 최민식 연기 좋고근데 변호사 둘....거기다가 마지막에 희생을 너무 길게 자랑하는 듯 한...  
20171208,10,아 뭉클ㅠㅠ재밌었다!  
20171208,6,"돈이면 못할게 없는 세상.... 최민식의 해운대 씬에서 터키 감독, 누리 빌게 제일란  풍의 감성 짙은  고독씬....정지우에게도 이런 감성이....은교는 최악이더니만...  "
20171208,8,"원작의 존재, 뻔한 반전을 잊게 만드는 뒷심있는 영화.. 자신의 여자와 딸을 너무나 사랑하는 최민식의 감정연기가 마음을 움직인다.  "
20171208,5,왜 이렇게 평점이 높지.... 저게 부성인가요...?  
20171208,10,최고다.. 내용 스토리가 정말탄탄하다  
20171208,10,제 인생에서 감히 베스트 영화가 되지 싶습니다영화를 보고나서 여운이 아직까지 가지않아 2번을 더보고 원작인 침묵의그림자까지 보고 이렇게 평점도 처음 남겨봅니다너무 감동적이고 슬펐습니다 배우분들 특히 최민식님의 연기에 너무 감사함을 전하고 싶습니다  
20171208,9,배우들의 완벽한 조화 꼭 보세요  
20171208,10,대반전영화  관객수가 아쉽네  재밌게봤습니다  
20171208,2,원작  침묵의 목격자가 100배는 더 잼있고 더 감동적임  
20171208,6,아빠가 재벌이라서 전혀 공감대가 형성되지 않음. 내용자체가 억지스러운 부분도 있고...  
20171208,10,까다로운 남편 눈에는 잼썼다고하니....평점 10 투척이여~ 왜이렇게 저평가됬는지 영문을 모르겠다고함.  
20171208,10,한 남자의 절규...딱 들어맞네요 먹먹해지는 영화 추천합니다!!!!  
20171208,3,2 Much 4Shadowing  
20171208,10,민식이 형님의 연기는 캬!  
20171208,5,철딱써니  없는 딸 년의 살인죄를 대신  스스로 뒤집었고 감옥가는 아버지이야기  
20171208,5,하...  이영화 개봉했다고 티비에서 침묵의목격자 틀어주길래 본거또보고 또감동받아서 이영화도 궁금해서 9900원 결제하고 보고있는데..  내가 원작을봐서 그런건가 진짜 못봐주겠네ㅜㅜ 9900원이 너무아깝다 미라? 얜 누군데 연기가왜이래진짜  
20171208,10,웬만하면 눈물 안흘리는데 마지막에 눈물샘 고장났다.. 반전에 반전의 반전영화  
20171207,2,원작 모독 수준의 원작 훼손..최민식 연기는 좋았으나 명량과 다른게 없었고 박신혜의 발연기는 도저히 나아지질않네  
20171207,10,마지막 장면에서 눈시울이 붉어졌습니다....  
20171207,7,"배우들의 연기력에 감탄생각치 못한 결과에 충격.허나, 몇가지 장면에서의 지루함  "
20171207,6,정지우의 습작인가? 정지우가 아니면 이런 평점을 줄까?  
20171207,10,말이필요없는 최민식의 열연..생각치 못한 반전..가슴을 먹먹하게 만든 여운이 긴 영화  
20171207,6,"최민식이면 모두 OK 인가? 물론 연기는 잘하시는듯. 그러나 스토리가 10년 전 스토리같다. 사과하는 이도, 사과의 방식도 모두 동의할 수 없다.  "
20171207,7,자식이 웬수지....  
20171207,10,올해 처럼 영화 가뭄인 해가 있었던가?  약간 많이 아쉽지만 올해 영화중에는 볼만한 영화 솔까말 7점이지만 추천  
20171207,10,"남들이 다 비난하고 내가 고통스러워도 좋다... 내 딸을 지킬 수 있다면 나는 ""침묵""한다 - 그의 ""침묵""은 ""사랑""이었다  "
20171207,7,관람객최민식 연기는 짱 짱 넘 연기 잘해요~~  
20171207,10,진짜 평 잘안남기는데 이건 진짜 모든배우도 연기잘하지만 최민식 연기...최고다 믿고 보는배우 그리고 이하늬도 너무 여운있게 연기해서 너무 감동...추천합니다  
20171207,5,원작에 비해 이건 억지스럽네  
20171207,3,최민식 하나 보고 영화 봤는데 솔직히 재미없더라. 근데 영화끝나고 배우진찾아봤음 조한철이라는 배우때문에 이사람 기억하고 있어야할듯.  
20171207,4,열정적인 연기들을 커버치지 못하는 구린 대사와 억지상황  
20171207,8,최민식 연기 잘하네 반전 연기  
20171207,10,아   내가 아들에게  자격이  있는지..  
20171207,9,간맛에 보는 괜찮은 한국영화...  
20171207,9,"시나리오 최고였다, 반전도 쩜, 아니 완전 닭살돋으면서 봤는데 관객수가 49만인가 아이러니.마지막부분에서 정승기 쌀국수먹다가 울먹이는장면에서 나도 살짝눈물나왔다. 최민식과 이하늬연기가 돋보이던영화.진짜 범죄도시만큼이나 재밌게 봤다  "
20171206,7,쪼끔더 쫄깃한 전개였음... 뭔가 아쉬움  
20171206,1,연기 못 하는 배우들만 델꾸 왔구만 작가야? 감독이야? 편집이야? 도대체 누가 잘못한거야? 내 죄다 박신혜 나오는 걸 본 내 죄 !! 형에서는 아주 쪼금 볼만하더니 침 묵에서는 역시나구만/ 형에서는 대사가 얼마 없어서 봐줄만 했나보다  
20171206,4,멋있는척을하는 중학생같은 영화  
20171206,10,감독에게 100퍼 깔끔하게 속았습니다근데 억울하지가 않네요  
20171206,9,평이한 법정물인 줄 알았던 작품이 반전 이후 특별한 영화가 되었다.  
20171206,8,진짜 침묵이구만... 잘 봤습니다  
20171206,1,재미없내요 왜 다들 높은평주는지 이해 안가네요  
20171206,10,엔딩이후에 멈추지 않는 눈물... ㅠㅠ  
20171206,3,여성혐오적인 스토리 요소가 난무하고 최민식과 이하늬가 어울릴거라고생각하나반전만남고 수준미달최민식광고같은 영화  
20171206,7," 억지스런부분이 많다. 변호인과 딸의 관계  그 변호인과 검사가 선후배, 당연스럽게 의뢰인을 배신하는 변호인, 다시 변호를 의뢰하는 주인공. 무언가 반전을 위한 무리한 설정?이란 느낌이들지만 볼가치는 충분히 있고 이하늬의 연기가 굿. 예전 아주 비슷한  "
20171206,9,박신혜 외모가 비현실적일 정도로  예쁘다며 극찬하던데 연기도 잘하고 예쁘고 영화 드라마 다 통하는 배우더군. 영화 영평상도 이미 받았고  한류인기도 톱인데  드라마 영화 다 통하는 배우  
20171206,9,"평점이 너무 낮아요;; 진짜 엄청난 명작입니다;; 진짜 마지막에 제가 참 나쁜놈이구나 라는 생각을합니다, 진짜 이런 반전이라니... 중간에 예상 못할뻔한건 아니지만, 너무 흑백논리에 빠졌던거같네요. 명작..!  "
20171206,7,황진미 평점과 평론은 항상 그렇듯 역.겹.다.  
20171206,10,피아제 부엉이 두부외상 노무재밌었다  
20171206,10,역시 믿고 보는 갓민식!  
20171206,8,진부하다 싶다가도 몰입하게되는 영화  
20171206,1,뭔가 요즘 세태를 반영안해서 비현실적인 느낌의 영화  로맨틱가이  최민식만 남네 그려  
20171206,10,최근 본것중 가장 슬프다..  
20171206,10,역시 최민식! 감독의 연출과 배우들 연기력 덕분에 몰입감 최고! 마지막에 눈물펑펑쏟음  
20171206,7,박신혜  포지션이 애매함  외모가  뛰어난것도 아니고 영화를 하기에는 연기도 부족하다그냥 어중간함  
20171206,10,돌아가신 아버지가 보고싶다.. 눈물이 난다..  
20171205,10,심야로 보고 집왔는데 자꾸 생각남 ㅋㅋ  
20171205,10,소름ㅜㅜ재미땅우왕우놩짱이에여  
20171205,9,침묵에 반전은 이세상에 그 어느 반전들보다 뭉클하고 애틋했던 반전은없다.  
20171205,10,피아제 어디 숨겼니?? 논두렁에 버렸니??  
20171205,10,우와...이말뿐 할말이 없군요.  
20171205,10,감동 반전 대박 완전 빠져든 영화  
20171205,8,"어쩌면 이미 생각할수있을법한 반전이라고도 할수있겠지만, 누구나 알법힌 것을 누가 표현하는가에 따라 이렇게 다를 수 있다는걸 느꼈다. 연출이나 대본도 괜찬긴했는데, 배우들의 연기가 생각보다 더 빛났다.  "
20171205,1,"1점도 아깝다,  아니  조각조각 같다가 붙여도 이것보단 더 스토리가 충실하겠다. 이하늬가 갑자기 배타고 어딜 가길래 이건 또 모니 했더만 그냥  끝나 버리네.... 10점준 개아들놈은 다 모냐? 하여튼 정치든 영화든 알바쉐퀴들은 다 디져야 한다.  "
20171205,7,관람객반전에 반전을 입힌 영화 최민식짱  
20171205,8,응답하라1988에서 성동일이 그렇게 철좀들으라했는데 결국사고치는구나  
20171205,8,"주관적으로 범죄도시를 재밌게 봤지만, 객관적으로는 이 영화가 범죄도시보다 흥행에 성공했어야 했다. 개인적으로 최고의 장면은 최민식의 증인석에서의 열연에서 보여지는 풍자,비판이 베스트씬이었다. 아쉬운건 백윤식처럼 임팩트있는 한 마디가 있었으면 좋았을껄,  "
20171205,10,아.. 아버지란 이런거구나 가슴이 먹먹하다 너무 재밌습니다  
20171205,10,정말 감동적인영화 연기정말 잘한다!!!  
20171205,10,마지막장면 최고네요....영화 보고난후 아주조금은 아버지의 마음을 느낄수 있었네여  
20171205,10,최고의영화 모든 복합적인감정을 느낄수있다 평론가색히들은 대체 어떤영화가 최곤대?  
20171205,10,그 남자가 헤아릴 수 있는 마음의 높이는 태산같았다명작이라고 생각합니다.  
20171205,10,최민식의 내공이 느껴지는 멋진 영화~ 뒤쪽으로 갈수록 몰입감이 깊어지는 그런 영화임.  
20171205,5,원작 중국의 영화가 더 재미있음 너무나도 뭐야 라고 할수 있음  
20171205,7,나쁘진않지만 빼어나지 않은..  
20171205,9,와..오랜만에 만난 좋은영화~ 피곤한 하루였는데 스트레스가 다 풀리네요^^ 정지우 감독님의 다른영화도 찾아보고 싶어집니다  
20171205,10,배우 최민식 진심으로 존경합니다 영화끝나고나서도 잔잔한울림이 남아있는듯한 아버지 모습 하....진짜 영화 잘만든거같아요  
20171205,10,반전이 너무 오버스런 느낌도 있지만.. 확실히 충격적임.. 그거면 일단 성공 아닌가..  
20171205,10,먼가 아련하고 아쉬움이 남는다. 그렇게까지 아버지 노릇하고 싶은게 아버지인가보다. 힘들면 힘들다고 얘기하지..  
20171205,10,아. 아빠의마음.  눈물난다  
20171205,9,간만에 한국영화에서 묵직한 감동을 느꼈다  
20171205,7,"끝났다 생각할 때, 갑자기 놀라 입을 반 쯤 벌리고 닫질 못하다가 영화가 끝날 땐 전혀 놀라지 않은 표정 애써 짓게 만든다. 그들은 정말 사랑했을까? 아. 정말 사랑했구나...  "
20171205,6,졸작. 악인이 없다. 잘못키운 딸을 위해 모든걸 짊어진 아버지에 사랑에 대한 드라마.  
20171204,10,이건정말뭐라말로표현이안되네요  하.. 걍 봐야함..  
20171204,10,와... 정말 최민식 당신은대체.... 엔딩크레딧 노래나올때가 참았던 눈물이 터져나왔습니다.  
20171204,6,"직원수 2078명 밖에 안되는 회장님이 지가 무슨 이건희가 된거처럼 설치고 돈쓰고 가수여친만나고 태국에 세트장짓고 고급차 들여오고 허무맹랑 스토리부터 모든게 허술한, 최민식의연기는 여전히 같은 톤을 유지하는, 진부한 영화 10점 준놈들은 만화책이나봐라  "
20171204,10,평론가들 다 ㄲㅈ!!!  
20171204,10,아니 진짜 앵간하면 평점같은거 안남기는대이건 남겨야겠네요반전의 반전이 너무 쓰린마음이 드는데어떻게 이런소재로 이런연기가 이뤄졌는지도무지 여운이 가시질않네요네티즌 평점에 많이 영향을 받았었는데이건 네티즌 평점 점수 잘못된거같아요  
20171204,10,최민식 이하늬 솨라있네  
20171204,10,조한철님 연기 잘하심. 뭐 주연배우는 말이 필요없고. 영화 스토리는 별로. 그럼에도 잘 만든영화라 10점 드립니다.  
20171204,6,'침묵'의 과정이 다소 매끄럽지 못했던 범작.  
20171204,10,이런것도 감동이 되나? 싶었는데 왜 눈물이 고이지? 다만 확실한건 최민식과 이하늬 연기가 너무 좋았던것같다..  
20171204,2,침묵의 목격자가 더재밌는듯  
20171204,7,관람객조금 지루했지만.. 나름 괜찮았어요.  
20171204,6,영화의 완성도와 스토리가 너무 떨어집니다.  
20171204,10,ㅜㅜㅜ감동최고였습니닷..여운쩌는...  
20171204,1,배우가 아깝다. 너무너무 딱 평점 6점이 어울린다.  
20171204,5,"저거 계획적 살인 , 의도적 살인이 아니라서 , 2~3년 살다 나오는 무슨 이런 오버를 하냐.... 현실성이 너무 없어요. 부자니 합의금이 많으면 그냥 2년입니다.   오버~~~오버~~~  "
20171204,5,부성애란 이름의 자기합리화? 남은건 최민식의 연기.  
20171204,10,왜 눈물이 멈추지 않을까..  그 마음이 그대로 와 닿은 영화입니다.  
20171204,10,최고의 수작입니다. 반전에 반전 마직막은 눈시울이 뜨거워지는데 그국수한그릇 건네는데 찡해지데요 ㅜㅜ한시도 눈을 못때었네요. 최민식 배우의 내공이 느껴졌네요.  
20171204,4,"내용, 스토리는 좋음. 근데 연출이 엉망임. 특히 류준열 최민식에 반말하는건 완전 에러. 최민식 연기덕에 그나마 영화 살아났다고 본다.  "
20171204,6,자식을 향한 아버지의 무한한 사랑.  
20171204,10,정말잼있습니다!!! 강추  
20171204,10,이해불가네 이런영화가 흥행을 못했다니;;;;  
20171204,5,느린템포에 결말까지 가기 너무 지루했다 . 끝나고도 되뇌이는 작품이라 5점 후하게 쳐준다.  
20171204,10,별점 10개가 모자랄 정도로 올해 본 영화중 최고임 민식이행님 영화는 항상 여운이 남음 눈물이 안 그치려고 함ㅠ 너무너무 재밌음 민식이행님 오랫동안 건강하셔서 뜻깊은영화 많이 찍어주셨음 좋겠음 아 진짜 신이 내린 배우임  
20171204,6,특별히 재미 없습니다.돈이 아까움  
20171204,10,이런 영화가 흥행을 못했지...참 이해가 안되네  
20171204,1,바보냐? 심신미약으로 들어가면 끽해야 몇년인데 ...법정에서 난리를 부려서 일부러 들어간다...헐헐헐...  
20171204,7,기대에 못미쳤던 영화이기도 하고 약간 어거지 느낌이 들어서 재미가 반감되었음.  
20171204,10,최민식.... 하 뭐라 말로 표현할 수 없는 마지막 페이드아웃  
20171204,9,최고의 부성애. 최민식의 부성애  
20171204,10,영화가 끝나고 반전이하나 더찾아 오네요. 특별시민에서는 딸이 대신 아버지의 죄를 치르고... 침묵에서는 아버지가 대신 딸의 죄를 치르고 그것도 같은 배우... 소림 돋았음...(참고로 둘다 교통사고)  
20171203,10,관람객재밌어요재밌어요재밌어요  
20171203,10,침묵 영화  잼있네요 역시 최민식님 카리스마 있어요  
20171203,10,결론이 참 좋네요~ 사랑하는 사람들을 위한 희생~ 요즘 더럽고 비열한 소재의 한국 영화가 참 많은데 이런 따뜻한 영화 참 좋습니다.  
20171203,10,중년의 남자가 보여주는 두가지의 사랑. 그것을 보여주는 최민식의 내공  
20171203,1,실패한 성형은 인위적인 느낌이 납니다. 이 영화가 그렇습니다. 반전이나 결말이 인위적인 조작 느낌이 강하게 느껴져서 1점.  
20171203,3,보는 사람들이 집중해야 됐었던 게 부성애였는지 이성애였는지 권력욕이었는지.  
20171203,9,재미있었어요 하지만 최민식이.. 가진 포스에비해 너무 동내북같아서 아쉬웠네요..  
20171203,1,조연 배우들이 너무나 어설프다. 특히 동검사의 연기력은 처참한수준. 연출력이 떨어지다보니 어설픈느낌이 너무심하다. 심지어 최민식도 어설퍼보였으니. 이야기는 지나치게 현실감이 떨어져 공감이 되질않는다. 최악이다.  
20171203,7,원작이 훨 낫네 ㅎㅎ..  
20171203,5,재벌급만 가능한 부성애... 박탈감 느끼는 딴 아부지들의 절망감은 어쩔???  
20171203,10,마지막 반전... 최민식님의 연기 깜짝놀램...  
20171203,10,진짜 최민식의 내면연기 대한민국 최고인듯  
20171203,10,"남자의 사랑, 아버지의 사랑 그리고 최민식  "
20171203,10,뻔한 스토리의 영화인줄알았는데.. 감동이 있는 반전스토리가 넘 좋았던 영화  
20171203,10,마지막 이하늬와 최민식의 눈빛이  맘에 와 꽂히네요. 잘 만드셨어요.  
20171203,1,연출이 너무 하자 였잔아 솔찍히 영상미도 없고 오로지 배우연기말곤  
20171203,10,아버지란 이름과연인이란... 영화지만 참 진정한 남자다  
20171203,9,마더라는 영화 정말 슬프게 봤었는데...  아빠 버젼인 파더 라는 감동적인 영화입니다. 정말 슬펐어요ㅜㅜ  
20171203,6,배우 연기나 연출에 있어서는 매우 좋았으나이야기 구성이 매우 버블붕괴현상이다.확 긴장했다가 확 김이 빠지는 내용이다. 전체적인 내용면에서는 너무 재미없었다.  
20171203,10,미안하다.. 몰라봤었다.  
20171203,1,류준열 뭔 반말찍찍 류준열새끼땜에 1점이다. 아니 0.1점  
20171203,3,평점 알바가 있다고 확신했다.  돈을 내고 보진 않아서 다행이다  
20171203,10,관람객내용보단 연기력으로 보는맛  
20171203,3,침묵의 목격자보다 못함...정리가 덜되서 보여주는 군더더기들많은...  
20171203,10,진짜 여운이 많이 남네요... 아무리 영화지만... 나라면 과연.. 어떤결정을 했을지..~~ 여운이 많이 남는 영화입니다~~  
20171203,6,현실에선 절대로 있을수 없는 결말이라 본다...한번더 반전이 있길 바랬건만.. 아쉽네..  
20171203,6,배우들의 연기가 스토리를 살렸다.  
20171203,8,관람객그냥 볼만한 영화임 많이재밌는건아님  
20171203,10,깊게 들어갈수록 매력적인 영화  
20171203,4,원작을 넘어서는 리메이크는 거의 없다는 사실을 다시한번 확인시켜주는 영화  
20171203,1,아씨~~~ 내돈내놔~~ 뭐이런 쓰레기같은 영화가..짜증나~  
20171203,7,마지막 10분만 다시 편집하면 평점 9점 일듯2% 가 아쉽다  
20171203,7,"만약 최민식이 아니라, 윤여정이었다면 베댓엔 맘충으로 도배됐을 요즘의 한국  "
20171203,7,나름 반전의 반전인데 첫번째는 너무 뻔했고 두번째는 무게잡은 것만큼은 아니었다.  
20171203,1,"무엇이감동입니까?살인범인자식을위해돈이면다되는게그게감동입니까?저는이번8살토막살인사건이생각났습니다.살인을한자식을위해변호인12명을섭외한부모나시종일관생각나지않는다심신미약을주장한딸이나...영화소재가이시대돈이면다된다는부모,살인자...연기자들연기는좋았습니다  "
20171203,5,감동적이고 이런재벌도 존재할수도 있겠지만 우리나라 재벌들 하는짓들을 보면 재벌미화된 영화란 생각을 지울수가없네요.  
20171203,10,영화잘봤습니다. 이런생각 드는 영화  
20171203,9,도대체 이 영화가 왜 망했는지...오랜만에 여운이 가시지 않는 영화 잘 봤습니다..마지막 태국씬에서 모든 복선이 깔끔하게 마무리 되는게 좋았습니다. 근데 최민식씨 연기는 말할것도 없는데 개인적으로 박신혜씨와 검사역 연기자분 연기가 몰입을 방해하네요  
20171203,5,돈이면 다된다고 생각하는 사람이 진정한 사랑을 위해 돈을 쓰는 영화..대사중 하나인 이 사건(영화)의 본질을 모르겠다  
20171203,7,침묵이 너무 기니 과호흡을 부른다  
20171203,8,관람객재밌게 보았습니다 신선  
20171202,8,박신혜가 마지막에 진범을 다시 유추하여 진실을 밝히는결말이었으면 훨씬 완성도가 높았을텐데 그점이 아쉽네요  
20171202,9,옳진 않지만 왜이렇게 눈물이 나던지.. 머리론 아닌데 마음이 맞다고하네요 ^^;  
20171202,1,"박신혜가 도대체 왜 주연급으로 나왔는지 알 수 없는 영화  최민식 일인포커싱으로 설계돼있는, 오로지 최민식의 최민식에 의한 최민식을 위한 영화라고밖에 생각이 안 든다 이럴 거면 그냥 주연 최민식 조연 나머지 로 하지 그랬나 어처구니가 없을 따름  "
20171202,10,명품배우들의 연기 잘봤습니다!!^^  
20171202,9,관람객역쉬 최민식 연기 짱이네요~^^  
20171202,7,동성식에게 거절 당할때의 동성식 태도. 김동명 역시 보자마자 반말. 회장 임태산의 자세는?  
20171202,5,원작 침묵의 목격자를 보고나서 침묵을 보면 높은 점수를 주지 못하는것을 느낄수 있습니다.  
20171202,10,진짜 너무 멋지다.. 최민식이라는 연기자.. 처음으로 연기자에게 이런 느낌을 가져보네요..  
