0,1,2
20171106,8,배우들 모두 제게 맞는 옷을 입은듯 연기했다.  ㅂ전이라는 스포로인해 예상이되었다. 왜 중간에 태국 클럽이 등장하겠는가? 역사엔 언제나 어떤 여자의 닮은 여자를 찾을땐 사창가에서 찾았다. 마리앙투아네트도 그랬다. 이걸 아는 난 ㅂ전을 느낄수없었다.  
20171106,7,관람객기대이상과 기대이하가 함께 존재하는듯....  
20171106,10,ㅜㅜ딸이 웬수군 웬수여 10자라니?  
20171106,1,연기력때문에별하나준다 배우갖다가 뭐하세요  
20171106,10,영화관에서 처음 울어봤다 .... 영화가 끝날때까지 몰입하다가 엔딩크레딧이 나오자마자 터진 눈물이 주체가 안됐다...  
20171106,2,관람객철없는 자식새끼 죄 덮어써주려고 돈OO 떠는 애비의 막장드라마. 세상엔 억울하게 누명쓰고도 힘없어서 법의 보호도 못받는 사람 투성이다. 지 새끼 살린다고 법도 돈으로 맘대로 하는걸 꼭 그따위로 정당화 해야되냐? 역겨워. 민식이형 연기땜에 별1개준다.  
20171106,10,마지막 엔딩에 침묵 제목 진짜 잘 지었다 생각함  
20171106,10,다시 또 보고싶은 영화이다  
20171106,7,영화는 좋았다 하지만 최민식의 삐뚤어진 부성애를 그렇게 아름답게 포장했어야했나싶기도  
20171106,5,개인적으로는  중국판을 먼저봐서 그런지 비교가 되더라구요~ 긴장감도없도 뭔가 내용을 전달하려는 부분이 루즈해서  아쉽더라구요ㅠㅠ  중국의 원작인 침묵의 목격자를  차라리 다시보는편이 재미있겠어요  
20171106,8,"한국 영화에서 이렇게 여운을 주고 반전을 주는 영화가 있을까 싶다. 배우들의 연기들도 완벽하고 최민식의 묵직한 연기를 보는 재미도 있다. 어느 관점에서 보느냐에 따라 다른 느낌으로 다가오는 영화이지만, 논리적인 점에선 아쉬운 부분이 있다.  "
20171106,6,그에겐 사랑이 가장 중요했네  
20171106,10,다소 긴면이 있었지만 나름 재밌게 봤어요. 배우들 연기도 좋아서 더 몰입해서 봤네요.  
20171106,10,영화 보고 후유증이  ㅠㅠ 아버지는 위대하군요 정말. . 최민식 연기도 좋고 박신혜 이쁘기도 이쁘고 연기 정말 짱 잘하더라.  별 생각없이 봤다가 여운 땜에  가슴 먹먹  
20171106,3,너무 배우들만 앞세운것 같던데요.. 노감동 노재미 노 연출 .. 허술해요 최민식이 아깝구먼..  
20171106,9,지루한감이 없이 않아 있지만  반전도 있고  보고난후  작은 교훈과  여운이 남는 영화.  
20171106,9,영화 재밌게 봤습니다^^  
20171106,10,너무너무 잘만들었다 먹먹해짐  
20171106,6,"관람객열심히 했지만, 점수는 글쎄...  "
20171106,3,영화의 개연성이나 스토리가 좀 억지스러운 면이 있습니다. 또한 박신혜가 연기한 인물은 변호사이지만  그저 정의감만 내세우는 무능력한 변호사의 모습으로 비춰줍니다. 영화 중간최루성 장면을 연출하면서 영화의 스토리보다는 딸을 위한 부성애만 강조합니다  
20171106,10,보는 내내 몰입하게 되는 깊은여운을 주는 강한 울림이 있는 영화 모든 사람이 꼬옥 한번은 봤으면 하는영화  아빠의 무한 사랑에 가슴 아파지는 영화라 추천해요 적극!! 최고입니다  
20171106,1,아빠소리 듣기 참 힘들구나 느낀영화 잘못된 부성애가 이렇게도 해석되는가  
20171106,8,배우 최민식의 감정선이 참 좋던 영화.어쩌면 뻔한 스토리지만담담하게 부성애를 그려냄  
20171106,8,"관람객반전의 반전, 여운이 남는 영화네요.ㅎ잘봤습니다~  "
20171106,8,관람객아버지의   맘   이 이런거였나요반전의  내용 이  있었네요  
20171106,8,관람객스토리가 아쉽지만 배우들 연기 좋습네요  
20171106,9,류준열의 현실성떨어지는 연기 -1점으로 9점드립니다.그냥 보세요 진짜최고입니다.  
20171106,3,.따라갈수 없는 최민식을 기용했으나 .리듬감이 너무늘어졌다 .버무리는 연기력은 좋았지만 .민짜 합판처럼 싱거웠다  
20171106,5,그냥 그렇다! 좀 지루하고 ..  
20171106,9,관람객아버지는 위대하다!!  
20171106,10,진중한 분위기 속 예상치 못한 반전의 묘미와 덕후 냄새 나는 류준열을 포함한 배우들의 매력적인 연기  
20171106,9,관람객재미잇게봤어요~~^^  
20171106,9,이 영화에 1점 준 사람들은 7번방의선물과 은밀하게위대하게 는 10점을 준 사람들이다  
20171106,6,관람객최민식 연기가 좋았습니다.  
20171106,9,관람객반조네반조네반조네반전  
20171106,1,지루했다..많이..낚이지 말것  
20171106,4,"개연성 없고, 마구 꽈놓고, 다시 다 설명, 싫어. 부녀의 눈물은 신파.92년 ^어퓨굿맨^이 자꾸 생각나.류준열은 어디다 붙여도 천상 배우.이하늬의 연기가 의외로 돋보였다.  ""나는 괜찮아~~""박신혜는 드라마에서 더 돋보인다.~  "
20171106,10,평이 안좋아 고민하던 순간이 있었던것 조차 잊었어요.최민식이 미안하다며 눈물을 흘리던 그 눈빛 아직도 가슴이 먹먹하네요.딸의 잘못을 덮은것은 무모하지만 한치의 고민도 없이 다 짊어지는 모습이 남자와 아빠의 모습을 같이 본것같아서 계속 눈물이 납니다..  
20171106,10,자식이 뭐기에 ..   영화도 재밌고 배우들 연기도 다 좋았다  박신혜 연기 많이 늘었더라  
20171106,8,관람객진실은침묵으로인해감춰진다  
20171106,10,너무너무 재미있었어요!! 간만에 한국 스릴러 재밌게 본것같네요 ㅎㅎ  
20171106,1,돈아까움..재미없음..부라더볼껄그랫네영..너무아까움 .. ㅜㅜㅜ내용이좀그래여..  
20171106,9,전 이런영화가 좋더라....오랜만에 재밋게 봤습니다.쵝오~!!  
20171106,9,관람객아 안울라했는데 끝에가서 울었다ㅠㅠ  
20171106,8,관람객마지막에 ㆍ너무 슬펐어요 추처ㆍ  
20171106,9,관람객몰입하는 와중에 반전..그리고 또다시 몰입하게 만드는 침묵..진실이든 거짓이든 그들의 진심이 묵직하게들어오네요~~  
20171106,10,극장에서보길잘했네요  
20171106,10,관람객와우 너무너무 굿이에요  
20171106,10,그 역할에 가장 잘 어울리는 배우들로만 정확하게 캐스팅한 영화  
20171106,5,캐릭터들의 설정이 전반적으로 애매하네요 반전을 주려고 일부러 뒤섞어논거 같음 마지막에 반전도 다 보여줘버리고..  
20171106,7,관람객그럭저럭 볼만했음. 영화가 생각보다 긴박감이 없어서 중간중간 조금 지루하고 법정공방에서 박신혜 연기가 조금 오글거렸지만 나중에 반전이 몇번 있어서 스토리는 그럭저럭 괜찮았다는 느낌..  
20171106,10,왔따시아 장태산 데스네  
20171106,10,개인적으로 여운이 깊이 남는 영화입니다. 또 겨울왕국과 더불어서 자녀교육의 중요성도 생각하게 되네요..  
20171106,10,관람객영화..최민식의 연기.넘좋았습니다..  
20171106,2,박신혜 = 무능력한 변호조무사  도대체 왜 출연했는지 전혀 스토리에 비중이 없다.  
20171106,4,관람객지루하고 이해가 안가는 영화  
20171106,8,관람객변호사양반 거참 매력적이십니다  
20171106,10,그냥 그런 영화인줄 알았는데 알고보면 반전적인영화중간에 끝나는 분위기라 영화내용에 휘말려 확신을 가졌지만뒷내용은 반전이라는거에 스토리구성에 마음에 들었다.  
20171106,8,정말 재밌게 잘봤습니다 스토리도 탄탄하고 아버지의 사랑이 느껴지는 영화  
20171106,10,관람객리뷰도 보지말고 관람하길 추천합니다  
20171106,3,브라더 비슷한 수준 다큐맨터리 수준 ㅎㅎㅎ!  
20171106,7,관람객반전에반전 재미나게 봤네요  
20171106,10,솔직히 말해서 평에 비해 더욱더 볼만했다  
20171106,5,블록버스터급 부성애.  
20171106,9,특별시민2 인줄 알았으나 보고나니 아빠의 순정  
20171106,10,올해 영화중 감히 최고라 할수있음 반전에 반전..연기는 물론 마음까지 짠해지는 영화 개봉관이 많았음 좋을텐데 진짜 강추  
20171106,1,장르가 도대체 뭔지 모르겠는 갸우뚱하게 만드는 영화  
20171106,3,아침부터 기분 더럽네 뭘 침묵하고 싶은거야 돈 없는 아빠는 결국 아빠노릇 하고 싶어도 못한다는 거야? ㅋ  
20171106,10,영화는 보는 내내 집중이 되고 긴장이 넘치면 재밌는 영화라고 생각합니다. 반전도 나름 괜찮았고 적당히 스릴넘치고 훈훈하고 우선 배우들의 연기가 진짜 굳  
20171106,10,관람객젤 쟁나는구냥 냥 두번본다  
20171106,10,이런 장르 안좋아하는데 2시간이 가는줄 모르고 봤네요  
20171106,10,최고였어요 ! 동명이 연기가 계속 기억에 남아요  
20171106,8,보는내내  관객을 침묵하게 만들어버리는 감독의  연출력은 진짜 높이 평가 하고 싶습니다. 개인적으로 호불호가 갈리는 작품이 아닐까 합니다.저는 전혀 지루하지 않았고 너무 재밌게  봤습니다.  
20171106,10,관람객반전이  있네요. 나름 재밋었음  
20171106,7,이게 부라더 보다는 났다  
20171106,7,"최민식, 이하늬, 류준열의 연기는 물론 신예로 주목 받는 이수경의 연기는 퍽 눈길을 끌었다. 다만 극중 반전은 데우스 엑스 마키나로 모든 걸 해결하려는 시도로 밖에 보이지 않았으며, 돈으로 해결되는 부성애는 좀처럼 이해가 가지 않았다.  "
20171106,10,관람객와....한 중년남자의 사랑을 그려냈다...멋지다 재미있다....최고다  
20171106,7,관람객임태산의 고독을 느꼈다  
20171106,10,좋은 영화는 항상 긴 여운을 줍니다.  좋은 영화입니다.  
20171106,8,관람객잘봤습니다 연기좋았습니다  
20171106,10,최민식에게 감정몰입이되니 눈물이줄줄 ㅠㅠ 별생각없이 보러갔는데 좋은영화였습니다  
20171106,10,꿀잼이였어요 최민식 존멋  
20171106,3,최민식 혼자 다하는 영화. 반전흉내내는게어설픔.  
20171106,8,야 내가 너 좋아하면 안돼냐?  
20171106,8,관람객내용이 조금 초반엔 지루하고 이해하기어려운데 후반부로 갈수록 좀 재밌고 이해가는거같아여  
20171106,6,최민식에게만 의존한 영화  
20171106,10,관람객류준열님의 또다른모습을 기대합니다^^재미있게 감동있게 잘보았어요^^  
20171106,10,이하늬는 결국 최민식을 만나는걸들켰다.용의자는 장첸.  
20171106,7,관람객반전에 반전 덕에 그나마 뻔한 느낌이 덜했다최민식 선생님의 처음과 끝이 진하게 남는다  
20171106,1,네이버는 알바천국인가돈 몇푼에 양심을 팔지마라 이놈들아 이게 영화냐  
20171106,9,간만에 영화 같은 영화 강추~~  
20171106,10,최고네요 최민식배우의 열연과 심리를 다룬 세심한 영화  
20171106,8,관람객사랑하는 여인과 자식사이에 일어난 사건에서 누구보다 괴로운 아빠의 모습을 잘 표현한거같다.  
20171106,8,관람객뒷부분 지루했어요 극장에서 볼만은 합니다연기하는 사람은 최민식님뿐  
20171106,10,좋다. 엔딩크레딩시 올라갈때 왜 침묵인지 알게 된다  
20171106,10,여러가지 묘한감정이 뒤섞이는영화 각각 인물들의 입장에서 보면 너무나도 슬픈영화..  
20171106,8,관람객자식교육에 교훈이 되네요.  
20171106,7,관람객잼나게 잘보았어요 최민식 연기가 좋았습니다  
20171106,8,관람객나름  예상가능한 반전과  감동을 주는 최민식영화  
20171106,10,잼난다  이게  왜  흥행이  안되는지??  
20171106,6,관람객그냥 그렇함 기대가많아서 그런가봄  
20171106,10,몰입도 좋았고 배우들도 열연했으며 반전은 반전이었습니다.  아직 못보셨다면 꼭 들 보세요~~~!!!^^  
20171106,9,처음에 뭐지 먼영화가이래 먼내용이야 하다가 재미없어서 화장실 갔다오니 아니 이게뭐래 이게 무슨일이야 대박 모든 내용을알고 정확히 2분동안 입을 다물지 못했다. 진심이다  
20171106,9,여운을주는반전드라마 연기력도 너무멋있게잘봤습니다.  
20171106,10,관람객탄탄한스토리전개와연기력  
20171106,10,괜찮아... 사랑이야  
20171106,10,관람객올해 본 영화중 최고입니다 최민식의 믿고보는 연기 크~~~  
20171106,1,폼만 잡아서야 억지 선동 영화에 불과하다.  
20171106,10,간만에 여운이 오래 남는 영화 .  
20171106,8,재밌게 잘 봤다. 태국 신은 감독판 or 우려 먹기 용으로 따로 나왔으면 완성도가 더 높았을 듯 ...밀당이 조금 부족했다.  
20171106,10,토르랑 부라더에 밀리기는 너무 아까운 영화  
20171106,7,한국 상업영화에서 관객이 요구해 왔던 재벌의 모습에 대한 패러디  
20171106,6,관람객최민식...그리고 반전  
20171106,4,반전을 위해 내용을 너무 많이 짤라서 개연성이 부족해졌다.  
20171106,10,배우들이 연기를 너무 잘해요 ㅠㅠ 이수경 배우가 울 때 따라 울게 되는 힘이 있음. 류준열 서사가 좀만 더 많았으면 극의 재미가 더 높아졌을텐데 분량이 아쉬웠고.. 아무튼 추천할만 합니다!  
20171106,10,류준열배우의 연기덕분에 더욱 지루함없이 집중할 수있었다. 깊은 여운이 남는 영화  
20171106,8,관람객반전 그리고 아버지로써 약혼자로써의 따뜻함이 느껴진 영화였어요.  
20171106,10,최민식 짱 짱 짱 짱 짱  
20171106,9,관람객공포영화도 아닌데 심장 콩닥거리며 보다 생각지도 못한 반전에 뭉클했네요...사랑과 돈 그 어느 사이정도로 해두죠...예상하지못한 내용였고 요즘 사회에 던지는 어떤 의미심장한 내용이라기보단! 의미심장했던 느낌 이라고해두죠~!!!  
20171106,2,"광명롯시] 이젠 식상한 패턴의 양산형 영화로, 반전 강박증과 억지감동 줄려는 시도만 느껴진다., 음악이나 사운드는 아예 없고 배우들과 배역이 안 맞는 캐릭터가 많았다. 스토리 진행도 루즈해 법정 영화 특유의 긴장감도 없다.  너무 재미 없었다.  "
20171106,9,최민식은 명불허전이고 이하늬는 재발견이다엔딩장면이끝나고 침묵이라는 제목이 뜨는순간 그제목의 의미가 무엇이었는지 조금은알것같고 많은의미를 담고있는말이었구나..생각했고 가슴이 아팠다 여운이남고 생각하게만드는영화다  
20171106,10,어떤 영화인지도 모르고 봤는데정말 반전의 반전..울컥했네요 강추!!  
20171106,7,최민식이 진짜 존X 멋있게 나온 영화. 최민식이 다 했다. 영화 평점의 반 정도는 최민식이라서 나오는거 같다.  
20171106,10,집중100%일수밖에없는영화  
20171106,10,관람객정말 기다렸던 영화 정지우감독님 이런 좋은 작품만들어주셔서 감사합니다 최민식 선배님 존경합니다 최고 아직도 여운이 남아있네요  
20171106,10,저는 진짜 재미있게 봤는데 왜 평점이 안좋은걸까요... 최민식 연기 진짜 좋았어요  
20171106,10,아.... 남자의 길이란....  
20171106,10,올해의 영화다.단언컨대 별1개주고 스포하는 사람들이 알바다.  
20171106,7,한국 법정영화중 최고네여  
20171106,9,관람객반전에반전이 재밋엇음  
20171106,8,처음에 지루한 감이 있어서 괜히받다 싶었는데 점점 몰입되더니 법정씬부터는 와 하며보다 마지막 반전에 깜놀함.. 잘만든 영화인것 같음 클래식음악으로 따지면 잔잔한 시작으로 해서 마지막하이라이트부분웅장함?? 무튼  괜찮음  
20171106,10,태국의 장면에서 최민식배우님의 눈빛에 너무 슬펐어요 그 눈빛에 ㅠㅠ  
20171106,8,관람객뻔한 스토리를 억지로 늘려놓은 느낌  
20171106,10,관람객잼있네요!!~~꼭 보세요!!!  
20171106,8,관람객시나리오 가 약간 아쉬운...새로운 구성은 좋았으나..  
20171106,7,관람객ㅗ몸버도ㅃ묘번ㅍㄴ보머뎐ㅍㅁ  
20171106,10,여운이 정말 크게 남는 영화.. 재밌고 감동있어서 좋았어요:)  
20171106,1,정말 개연성없음..ㅜ 연기빼곤 노노  
20171106,1,관람객0점없나 진짜개뻔한한국삼류영화졸작임이영화를본나한테침묵..선임한변호사가 검사옛여친임ㅋ집에서치킴먹고잣으몀 돈도시간도아꼇겟다  
20171105,10,20년 살면서 날 울린영화는 네가 2번째야 (연애를 해서그런가 감정이입이 너무 잘 되도라고요)  
20171105,8,관람객괜찮네요 반전도 ㅋㅋ괜찮고 최민식의 특별시민하고 오버랩되네요 ㅋㅋ조금 업그레이드 버전이라고 해야하나  
20171105,10,관람객오늘 최민식 배우님의 클라스를 보았슴니다  
20171105,10,내인생 최고의 한국영화  
20171105,8,관람객반전!! 그리고 신기한내용이고 마지막에눈물도ㅠㅠ  
20171105,7,관람객뻔한 반전  침묵이라는 제목처럼 묵직함은 없었다  
20171105,8,최민식부터 딸내미 꼬꼬마까지 연기력 정말 최고. 시러하던 이하늬까지 새롭게 보이게 만든 연출자의 능력. 잘만든 영화  
20171105,6,"관람객반전하나, 나에겐 조금 어려운 영화  "
20171105,10,아직까지 여운에서 헤어나올 수가 없다. 꼭 보시길  
20171105,9,관람객재밌었어요~ 최민식 연기 개쩜  
20171105,9,관람객지루한 듯하지만 꾸준하게 끌고가다가 큰 반전과 감동을 주는 영화.  
20171105,8,관람객이하늬의 재발견 최민식의 묵직함을 온화하게 빛내주더라  
20171105,10,관람객두가지 사랑을 볼수있던잡품ㅠㅠ  
20171105,8,"관람객해피엔딩 이후 정지우 감독과 최민식의 만남의 기대최민식의 절제, 정지우 디테일그 모든것들이 아주 미세하지만 그 미세함이 엄청나게 다름을 보여줬다사랑 그리고 가족 그리고 아버지정지우 감독은 우리에게 무엇을 보여주고 싶었을까?  "
20171105,1,돈이면 다 되는 것 맞구만. 결국 이 결론을 내려고 2시간짜릴 만들었나 정말 침묵밖에 할 수 없는 영화  
20171105,1,내 인생 최악의 영화. 반전이 너무 짜증나서 차라리 반전이 없기를 바랬을 정도 대폭소함  
20171105,9,영화의 분위기와 영상이 잘 어울어져 보는 재미가 있었던 영화. 이야기의 반전을 추측하며 보아도 반전에 반전을 거듭하니 깜놀할 준비를 하고 보아도 괜찮은 영화.  
20171105,10,관람객내용그대로 침묵입니다  
20171105,10,제가 평점을 처음 남긴 영화입니다 재판이 나오는 영화 특성상 진실이 도대체 뭘까 자칫 답답할수도 있었지만 그것들은 아무것도 아닌것이 될 만큼 그 진실의 내면은 감동적이고 많은 것을 생각할 수 있는 영화였습니다 여운이 길게 남네요  
20171105,10,연내에 또 한 훌륭한 한국 영화다. 중국 영화 <침묵의 목격자>를 원작으로 하긴 했는데 이런 사회적인 주제는 한국아니라 중국도 잘하네요.  
20171105,9,저 영화를 보고나서 왜 저런딸을 위해 저렇게까지 하냐는 평은 뭔가싶다. 부모와 자식이 괜히 천륜인가나름 사건을 풀어나가는 미스테리 법정 스릴러에서 갑자기 전환하는 반전도 좋았고 재밌었음 배우들 연기도 좋음  
20171105,10,관람객영화재밋게봣어요~짱짱  
20171105,4,관람객배우들 비중도 그렇고.. 음 조금 알쏭달쏭한 영화...아쉽다  
20171105,7,돈의 무게감과 사랑의 무게감  
20171105,9,최민식은 최민식이다.!!여운이 남네요  
20171105,8,관람객조아요. 최민식 박신혜 이하늬 연기 조았어요.  
20171105,5,침묵 흥행 망한건가? 부라더한테 밀리네 하긴 내용이 이수경배우의 발견 말고는 볼게 없었어  
20171105,10,초중반에 보여지는 일들은 마지막을 위해 꾸며진 일들이며 결국 진실은 침묵속에 담겨있었습니다 좋은 영화 잘봤습니다  
20171105,6,중국 원작보고 너무 감명 받아 이거 봤는데 감동이 배가 되는게 아니라 반감이 되어 아쉽네요!!  아리리 영화지만 억지가 심함. 중국 원작은 긴장감이라도 있었는데 이건 뭐가뭔지 @@  
20171105,6,여자배우 이하늬랑 딸로나온얘 둘이 연기를 못하니 이 좋은영화를 집중해서 못보겠네 ㅡㅡ  
20171105,7,관람객ㅂㅁㅎㅇ ㅇㅎ ㅂㅁㅎㅇ  
20171105,9,잔잔한듯 묵직한 한방이 있네요 저는 너무재미있게봤어요  
20171105,10,저는 10점 줘도 아깝지 않다고 생각듬 보고나서 ..  금방 2시간 이 어떻해 가는지도 몰르고 보게됬음 연기력은 진짜 대박임  ..  
20171105,10,많은 사람들이 꼭 보았으면 좋겠다.  
20171105,5,마지막은 감동이었지만 줄거리보고 기대했는데 생각보다 스토리가 뭐가 하나빠진것처럼 영화에 빈공간이 있는 기분이었습니다.  
20171105,9,관람객감동이 느껴지는 간만의 영화였습니다  
20171105,9,보기전까지 재미없을까봐 걱정했으나 재밌음 시간가는줄몰랐고 엄청낭반전에 약간이해가안되기도했음  관객수가저조한이유가이해되지않음  
20171105,10,관람객반전에 반전에 반전잔잔한듯 하지만 절대 지루하지않은.배우들의 연기력도 최고여운이 남는영화  
20171105,6,"흥미로운 소재, 좋은 배우와 연기를 가지고 이 정도밖에 못 뽑았다는 점 때문에 아쉬움을 넘어 짜증이 밀려옴. 플롯이 성글고, 디테일이 약해서 이야기가 붕 뜸. 기대하지 않은 최민식의 멜로 연기를 볼 수 있다는 건 수확.  "
20171105,1,"재미가없고, 영화전개 애매하고, 중간에 시간끌고 엄청 붕뜨고,, 그러네요.. 영화 댓글알바 생각보다 만쿠나..  "
20171105,9,관람객중간에 약간 이해하기 힘든 부분이 있었는데 너무너무 재밌었어요  
20171105,10,최민식이  왜 스토리텔리의 대가라고 한 이유를 알거 같습니다  
20171105,3,"댓글 알바에 속아서 봤다는 느낌을 지울 수가 없네요... <해피 엔드>를 정말 좋아해서 기대가 컸던 탓일까요ㅠㅠ 중간에 나가는 관객도 많았고, 최민식씨 외에는 연기, 스토리, 영상, 음향, 미술 어느것 하나 특별할 것 없는 작품이었습니다...  "
20171105,10,감정이입 제대로 !!!  
20171105,8,관람객재밌습니다 부모님은 다같은마음이겠죠  
20171105,10,진짜 재미있었어요!최근 본 영화중 가장 인상깊었습니다.  
20171105,10,관람객영화 중후반까지 왜 제목이 침묵인지 의문이었는데 그 이후부터는 계속 울고 끝난 후에도 여운이 많이 남는영화.  
20171105,6,관람객첨엔 영상도 좋고 배우들 표정도 자연스럽고 스릴있게 잡더만 제가 보기엔 영화중간부터 촬영감독이 짤려서 잡는앵글이나 영상미가 다큐멘터리가 된것 같은데요  
20171105,5,홍콩.. 침묵의 목격자...리메이크인지???알수 없으나홍콩 것이 더 치밀하고 재밌음  
20171105,8,관람객초반에는 좀 답답했는데 끝에는 먹먹하네요...  
20171105,6,관람객역시 최민식이란 생각이 드는 영화전달하고자하는 의도는 알겠지만 좀 지루한 느낌 ?  
20171105,7,관람객최민식과 이하늬의  명품연기를 또 보게되었지만 류준열이 너무 안나와서 안타깝네요!! 나쁜범죄라도 벌을 받아야 된다고 생각하게되네용  
20171105,9,텅 빈 상영관에서 몇몇 분들과 앉아서 오프닝을 기다릴 때까지만 해도 혹시나 했는데. . 역시 민식이 오빠야는 최고였어요. 스포 위험있어서 더는 얘기를 못하겠네요. 좋은 영화 감사합니다. 우리끼리만 알고 있게요. ㅋ아부지 생각나서 울었습니다.  
20171105,9,관람객연기력이 매우 돋보였습니다  
20171105,10,"처음과 끝이 최민식이라 좋았고, 그 외 배우들 연기가 좋았어요. 마지막 쯤 이하늬와 최민식이 주고 받은 눈빛과 대사가 계속 생각나요.  "
20171105,10,관람객마지막 30분이 살렸네요  
20171105,10,진짜 보세요 진짜 연기의 끝 하늬언니와 최민식배우님의 연기에 감동받고 울다왔네요 진짜너무 좋았어요ㅜㅜ  
20171105,10,최민식이 너무멋있었다  
20171105,9,관람객너무슬펏다 최민식의연기가  최고다  
20171105,10,보는 내내 긴장을 늦출수 없었던 영화! 반전에 반전에 반전을 거듭하고 마지막엔 감동과 여운을 남긴 영화!  
20171105,9,이거 보고 재미없다 지루하다라는 사람들은 걍 유치하고 생각 없는 사람들임 번개 망치질 하는 영화보세요ㅗㅗ  
20171105,9,관람객애정 과 부성애가 돋보이는 감동을주는 영화랍니다.  
20171105,10,정말 반전의 반전 꼭보세요!!  
20171105,8,볼까 말까 갈등했는데 볼만하네  
20171105,10,관람객반전에 반전! 잘 봤습니다! 역시  
20171105,9,대학로에서 한편의 연극을 보고온 느낌입니다.  
20171105,5,"최민식, 이수경 외에는 ...  "
