0,1,2
20190129,8,기대 없이 봤는데 끊지 못함...다소 뻔하지만...세상일이 다 그렇지...최민식 연기는...굿..류준열 캐릭터가 좀 어색  
20190129,1,영화 감독 ㄹㅇ영화 ㅈ같이 못만드넹  
20190128,10,"정말 잘 만든영화. 하지만 안타깝게도 이해를 못한 사람들이 많아서 관객수가 많지 않았던 듯.우리집 남자도 설명을 해주니 그제서야 끄덕끄덕. 감독이 너무 친절하게 설명해주면 관객 수준을 낮개 보는것같아 기분 나쁜데 , 적당히 덜친절한 세련된 영화  "
20190127,10,진짜 이런 영화....  
20190127,10,갸꿀잼....!꼭봐어ㅡ  
20190127,8,벼랑 끝에서 그런 선택을 할 수도 있겠구나!  
20190126,7,스토리는 좋다하지만 개연성이 떨어진다이때만 하더라도 음주사고라 하더라도초범이면 길어야 몇년이고 슈퍼변호사 쓰면단기로 나올텐데그걸 원한에 의한 살인으로 덮다니ㅋㅋ좀 웃김  
20190126,7,아니 그렇게 착한 남성이 저런 갑부가 될수있나? 갑부면은 자식도 버릴정도로 냉혈한이 돼야하는데.딸을 지키기 위해 재산을 포기하고 감방에서 썩는다니 납득안간다  
20190126,10,그냥 인생영화다. 오랜만에 영화다웠다  
20190125,10,생각보다 너무 재밌었다영화 내용이랑 리뷰가 틀려 의아했는데 반전 나오고 최민식 울기 시작할때부터 영화 끝날때까지 계속 울었다최민식이 무게감있는 역할을 많이 해서 몰랐는데 아빠나 남자로도 정말 최고다  
20190122,4,그냥그렇네요 반전에 반전을했는데 둘다 예상했음  
20190121,8,다 좋은데 박신혜 연기랑 검사 연기때문에 거슬려서 8점ㅋ 최민수가 멱살 끌고 간 영화. 대배우 한 명이 이렇게 큰 비중이라는 걸 알게해준 영화.. 그나저나 이하늬 미모는 국보급..  
20190120,9,"우와,,, 최민식..  우아ㅏㅏ..  "
20190118,9,훌륭한 영화.. 위조된 증거물에 속지않는 자들을 위해 철저하게 준비하는 브로커...  
20190117,10,나라면... 그럴수 있을까??  
20190115,10,1년이 넘었는데도 머리속에 여운이 남아있는 영화...최고의 명작이다  
20190115,8,자식이 반대하는 결혼은 안하는게 좋을듯하다.. 나이들수록 혼자는 외롭긴하지..  
20190114,2,재미없음 인기없고 흥행안된데엔 이유가있음 조온나 노잼 마지막에 세트만들어서 씨시티비 조작한것도 ㅋㅋ 호흡도 존나 느림 한가지 장르만 파세요  
20190110,9,민식이형이 그냥 목줄잡고 끌고가네  
20190110,9,기대를 안해서일수도있지만 생각보다 훨씬더 재밌었음  
20190109,10,최고입니다! 마지막에 눈물이 ㅜㅜ  
20190108,10,완전 수작인데..너무 몰입도 좋은 영화였어요..  
20190108,4,존나 재미업음.. 이런것도 사랑이라고 미화하는것도 어이없음.. 2017년 영화라는것이 놀랍네요 2007년이라고해도 못믿을거같은데. 존나 과정이 전부 그사세라 몰입도 안되고 마지막에 반전이랍시고 태국 나왔을때 개황당했음. 연출도 지루함.  
20190108,9,슬퍼졌다ㅜ ㅜ 후반부 태산와 유나의 얼굴이 자꾸 생각난다  
20190108,10,왜 흥행을 못했을까 ..보시면 느끼겠지만 정말 잘 만든 영화입니다.쓸대 없는 심파극도 없고.. 이런 영화 만들어주셔서 감사합니다  
20190107,10,영화 '침묵' 2017장르:최민식 주연:최민식 엔딩크레딧:최민식  
20190107,6,이게 원작이 너무 대박이라...  
20190107,2,너무 비현실적이고 엉성한 스토리.  
20190106,4,원작만큼만 했어도 좋았을걸 거기에 위기의 중년남자 감성을 과하게 끼얹어서 다망침ㅠ 뜨거운 최민식보다는 원작의 차가운 순흥레이가 오히려 더 절절했음 유일하게 좋은 건 이하늬와 이수경  
20190105,10,마지막 국수를 같이 먹던 장면 수십번을 돌려봤네요..  
20190105,10,몰입해서봣다 수작임. 왜 흥행못햇을까  
20190104,10,할 말이 없다 최고라는 말 밖에  
20190103,10,나에게 배우를 꿈꾸게 해준 영화 그리고 최민식의 연기.  
20190103,10,최고였다   최민식의 연기에 푹 빠지는 영화  
20190101,10,최고의 영화보기드문 수작  
20190101,10,진짜 영화같은 영화를 보았다.  
20181231,10,"지금봤는데. . .예상보다 훨씬 재밌었어요.심심풀이로 봤는데,돈으로 안되는것도 있다는것을 깨달았어요ㅋ재밌고 묵직하고 암튼 괜찮은 영화네요  "
20181231,10,역시....부모의 사랑이 보입니다.  
20181231,10,왜 흥행을 못했을까요. 정말 모든게 완벽했던 영화네요 ㅜㅜ  
20181231,10,와...이게 무슨감정인지 모르겠어요영화끝나는 순간까지 믿을수가 없는 결말아.아버지ㅜㅜ  
20181231,10,몰입감도 좋고 스토리 전개도 좋고 잼있는 스릴러 영화네요. 반전은 서비스구  
20181230,8,최민식의 무게감이 이 영화의 무게를 싣는다  
20181230,10,슬픈영화  였네  먹먹하다  
20181228,10,....대박....  
20181228,2,중국판 리메이크작  짝퉁은 결코 오리지널에 안된다  
20181227,10,"짜임새 있는 플롯, 예기치도 못한 전개와 여운 진한 결말까지  "
20181227,10,1년만에 두번째로 보니 생각이 많아지는 영화네요  
20181226,10,여운이 남네요.. 아빠한테 전화 한 통 드려야지...  
20181226,10,이 영화가 기억나는 것은 후반부에 최민식이 이미 죽어버린 약혼녀 이하늬를 떠나 보내는 장면에서 나오던 음악이다.때맞춰 흘러나온 'Caro mio ben'는 이 영화의 백미를 빛내주었다.  
20181226,8,이하늬 연기 잘하네 발견.  
20181226,9,나쁘지않아용!!~~^^  
20181225,10,반전 ㄷㄷ 너무잼나게봤어요  
20181225,1,싸구려 촌극을 보는 느낌이네이런걸 돈주고 보라고 만든거냐?박신혜는 뭐냐? 정의의 사도 뭐 그런건가?위선 개쩐다 돈받고 변호하는 변호인이 의뢰인 배신하고 자기 멋대로 재판 뒤집는 경우도 있냐?류준열 캐릭터는 더 환장한다 연예인 빠돌이 주제  
20181223,10,마지막 부분이 잊혀지지 않음  
20181223,1,도대체 뭐하자는거냐  살인자 감싸주고 미화하는 영화라는걸 말하고 싶은거냐?  
20181221,10,이 남자는 치밀한 거짓처럼 보여야할만큼 사랑 앞에선 진심이었다.  
20181220,9,기대 안하고 봤는데 재미있습니다 아버지의 사랑이 느껴지네요 한번 보세요~!  
20181220,4,"생각보다 잼낫는데요, 자기자식 사랑하는 방법이 너무 잘못된 방법이라 생각해서 평점 낮게 드립니다..  "
20181220,1,"헐 ... 뭔 평점을 이리 후하게 주냐, 진부하고  연기들도 다들 판에 박혔는데???  "
20181220,7,다좋은데 감독이 시켰는지모르지만 나이많은사람한테 욕하고 반말하고 그런거는 애들이보고 배운다. 요즘애들 따라하는건잘해.  
20181219,10,최고입니다이제야 명작을 보다니ㅜㅜ  
20181219,10,최민식 배우가 곁들여졌기 때문에 더욱 감명깊은 영화.. 또 기억에 남겠내요.. 잘봤습니다..  
20181218,5,술먹고 차로 사람죽여도 기억이 전혀 안나요..흑흑 하면 걍 잠깐 드갔다 나오는 건데 왜 사서 고생하는지 전혀 공감안됨  
20181217,10,최고!쵝오!최곤!최곡!  
20181217,8,한번더 반전을 기대했는데 좀 아쉽지만 볼만해요  
20181216,10,난 왜 이영화를 지금봤지..무게잇고 정말 재밋어요  
20181215,10,반전에 반전 연기력 최고  
20181215,8,아무생각없이 봤는데 신선하다. 뻔 한영화보단 한3배정도 낫다  
20181211,7,"나름 괜찮았던 영화인데, 뭔가 모를 부족함이 느껴지네요.결말도 왠지 어디서 본 것만 같은 기분이여서 이 영화 본거 같은데 하는 느낌을 받았어요.  "
20181211,7,봇에서 민식이형이 침묵쓰고 딸이 상대 미포 킬따는 영화  
20181211,2,ㅋㅋ다 알바냐이게 어떻게 10점이냐  
20181210,10,역시! 최민식! 재미있네요~  
20181210,8,잘 봤습니다. 배우들 연기도 훌룡하고 스토리도 괜찮습니다. 거기에 비해 관람객수가 아쉽네요.  
20181210,10,최민식....그냥 말이필요없다 배우를 위해 태어난남자  
20181209,8,후반부 전개와 배우들 연기는 정말 압권. 다만 중반부까지는 전개가 좀 지루했음. 최민식 연기력 진짜... 존경스러울 지경.  
20181209,9,웰메이드 영화. 아버지의 마음에서 공감을 이끌어낸다.  
20181208,8,아 최민식 좋았음.굿~!  
20181208,1,이 영화가 평점이 높은이유는 모르겠지만 흥행못한 이유는 알겠다 정지우 감독꺼 이제 다시는 안본다  
20181208,4,중반까지는   계속보게만들지만    감동을주기위한  무리한설정   그냥  딸내미 에게 최고의변호사 쓰면  집행유예로 풀려나겟구만  
20181207,10,마지막 엔딩 가슴이 먹먹해진다..법정드라마가 아니라 진짜 사랑이 이런건가 싶은 멜로드라마  
20181207,10,2017년 작품 중에 가장 완벽한  명품 영화였다....  
20181204,10,와 뭐이런영화가 다있냐 아주 잘봤습니다  
20181202,1,침묵의목격자랑 내용똑같..  
20181201,10,"최민식 아저씨 진짜 계속연기하세요. 와.... 기대않하고 봤다가.... 최민식, 이하늬에 치이고 본...  "
20181201,10,최민식 배우의 최고의 로맨스 영화  
20181130,10,마지막장면 인상적이었요  
20181130,10,그냥 보세요. 정말 재미있습니다. 진실과 진심의 힘  
20181130,2,개소리를 정성껏 한 영화  
20181129,10,이하늬언니 욕하는거 진짜무서워여  
20181129,4,평점 높아서 봤는데.. 뻔한 스토리를 개인적으로 너무 루즈하게 풀어나가 지루했다.  
20181129,10,아... 어마어마한 영화였더  
20181128,9,반전의 반전을 거듭한 영화  
20181127,10,정말 최민식 연기 최고입니다.. 많은오해를 하면서 영화를 봣는데 점점 가슴이 먹먹해졋으며 왜 제목이 침묵인지 영화를보면서 알게되었습니다.  
20181127,10,정말 멋진 영화입니다 아직까지 가슴이 먹먹 합니다 최민식 최고입니다  
20181126,10,정말 괜찮은 영화 입니다.9점  
20181126,10,이거보면 눈물 흘린다.  
20181126,10,이영화보면서 최민식씨가 너무 멋져서 여러번 봤던 기억이 납니다..  
20181126,10,이런 영화가 왜 흥행을 못한건지 중반부는 좀 무료했는데 후반 몰입에 반전에 소름은...  역대급입니다  
20181126,9,최민식님 연기는 진짜 대박이네요...  
20181126,8,연기는 좋으나 소재가 진부하긴 하다  
20181126,6,"딸의 만행을 페이스북에 올려 회사 주가를 올리려는 행동이 정당화되진 않는데, 급작스런 전개에 감정이 복받쳐  사실에 대한 감독과 관객들의 침묵  "
20181126,10,이 영화 왜 50만도 못넘겼지...  
20181126,10,최민식 형님 영화라 인정합니다.  
20181126,10,박신혜 존나게 예쁘다 말되나  
20181126,1,드라마 보려 영화관을 가네..돈이 아깝지 안니?한국것은 흥행해도 절대 안본다.  
20181126,2,정말 최악의영화 우리나라영화 다신안본다  
20181126,10,이게 왜 흥행을 못했지 볼만함  
20181126,10,저평가된 영화라고 생각함 최민식 연기는 최고다 정말  
20181126,6,박신혜님 법정씬은 좀 어색했어요..  톤 때문인지어쨌든 보다보면 아빠생각도 나고 끝은 좀 찡했어요  
20181126,1,진부하고 노잼이었던 영화. 단편드라마로  나와야할게 영화로 둔갑한 제작비 삥땅쳐먹기 위해 만들어진 영화  
20181126,4,차라리 원작을 두번 보겠다  
20181126,10,최근 한국영화중에 수작에 속하는거같은대... 연기도 쩔엇고..이거 왜망한거야  
20181125,6,시나리오는 충분히 괜찮았던거같은데 편집이 뭔가 문제가 있는거 아닌지..글구 류준열행님 연기는 일부러그런거죠?  
20181125,10,화나고 통쾌하고 억울하고 아팠다.. 나는 그런 아버지가 될수 있을까..? 의문과 걱정이 남는 영화였다  
20181125,10,와 이런영화가 어떻게 50만밖에안됐죠?엄청나네요..  
20181125,10,두 가지 사랑...ㅎㅎ  
20181124,10,최민식... 이하늬 이수경 조현철 재발견  
20181123,10,철부지였던 제가 자식이 생기니 조금이나마 부모님의 마음을 알겠더군요..  
20181123,10,왜 저는 이제야 본거죠??ㅠ  
20181122,4,최민식이 아깝다~ 살인사건을 그것이 알고싶다 보다도 재미없게 전OOO냐 지루해 죽겠다~검사같지도 않은 역할로 더 답답하고 반말찍찍하는 준열이 보기 싫다  
20181120,7,중후반까지 매우 지루하고 후반부부터 극후반까지 퍼즐이 맞춰짐 류준열의 분량을 1/3정도만 늘렸으면 좋았을텐데 박신혜가 변호사역할이 좀 많아서 상황도 비슷한게 많고 지루하게 느껴졌음 끝부분의 반전은 박수받을만함. 믿고 보는 최민식씨  
20181120,10,의외로 재밌게 봤습니다. 최민식님은 뭐 유명하고 이하늬님랑 이수경님 그리고 비서분 연기보고 깜놀함...  
20181120,9,이런 심도있는 연기와 스토리 좋습니다  
20181119,8,전혀 기대안하고 봤다가영화 초반에 에이 범인이 딱 쟤구만...후반부에 범인 쟤맞네 뻔하네 했다가반전... 뭐 허술한점도 있지만생각지도 않았던 결말이라나름 신선하게 잘봤어요.  
20181118,1,침묵의 목격자  리메이크 영화 자나 왜 설명이 없냐   원작보다 못함  
20181117,10,최민식 우리나라  최고  연기자  
20181117,1,부성애를 보여주기엔 최민식이 너무 재벌인 듯.. 한 몇 개월 구치소 살다 박신혜랑 눈 맞고  집행유예로 나오거나 일당 몇 억 짜리 황제 노역하고 치울 듯  
20181116,8,온몸 바쳐 다하는 완벽한 침묵  
20181116,8, 마! 내가 어! 느그 어미하고 어!  
20181115,7,아 ..민식이형..하아  
20181114,9,"이수경배우 연기에 놀랐고, 개인적으로 좋아하는 장르라 재밌게봄ㅎㅎ  "
20181114,10,재밌네요역시 최민식 연기력에 빠져드네요  
20181113,10,참... 가슴이 먹먹해집니다..  
20181113,10,스릴러인줄 알았는데 드라마였다..  
20181112,8,최민식 연기로 다 끝남.  계속 반전을 찾으려고 하다가 한방 먹은 느낌. 기대안했다가 꽤 여운있었음.  
20181112,10,"스토리 괜찮고, 반전까지... 괜찮게 봤네요  "
20181111,10,"시나리오, 연기 모든게 다 최고에요  "
20181111,10,역시 최민식....가슴이 먹먹하고 이하늬가 연기를 잘 하는 배우로 인식하게된 영화.  
20181110,10,심쿵.. 열글자 채울 필요가 없음.. 그냥 철렁..  
20181110,7,한국버전으로 보니 부정이 더 애뜻하게 느껴진다.  
20181110,10,가시지 않는 여운이 자리를 뜨지 못하게 만든다. 아빠를 참 많이 떠오르게 만드는 그런 영화.  
20181110,10,"최고. 아무런 기대 없이 봤는데, 영화관에서 안봤다는게 아쉽다.  "
20181110,6,박신혜... 참 편하게 돈 번다  
20181110,1,연기 실패 연출 실패 현실 실패분노조절 환자들만 득시글한 영화  
20181109,1,원작을 재밌게 본 사람이 느끼는 충격이란.  
20181109,10,옹두사미의 윤리학이 그런 의미였구나 ㅎㅎ기습적으로 다가온 따뜻한 영화였네요^^역시 최민식 아빠의 영화는 믿을만 합니다. 그전의 영화들 이미지 때문에 더더욱 따뜻한 한방^^감사합니다^^  
20181108,4,연출의 실패... 보는 내내 불편한 흐름....  
20181106,1,영화 초반 검사의 말 : 블랙박스 다 수거해블랙박스 다 수거했다면서요?근데 이걸 당한다고?  
20181105,10,딸이 쓰레기였네^^ 열받는다 술먹고 죄짔는것고 엄연한 죄라는걸 알려주는 영화  
20181104,10,이건 진짜 감동이에요ㅠㅠ  
20181104,10,"리뷰처음씁니다.역시 최민식님,몰입도와 마지막 반전영화가끝난뒤에도 남아있는 여운.  "
20181104,10,괜찮아.끝까지 여운남네  
20181103,10,영화를 보고 난 후 제목대로 침묵하게 됩니다.  
20181103,4,억지영화 같은느낌 이라보는 내내힘들었어요 최민식배우가아니었다면 폭망했을영화  
20181102,6,그냥 킬링용으로 적당함  
20181102,10,"사회가 흉흉한데, 스토리는 좋다만 뭔가 씁쓸함. 쯥  "
20181101,10,"사랑하고, 사랑했네요....  "
20181101,4,검사 연기하신분...배역이 너무 안맞거나...아님 연기를 너무 못하거나.. 중요한역할인데 전혀 검사같지않아서 영화 집중하는데 거슬림.  
20181101,10,기대없이봤는데 너무재밌게봤다.  
20181030,10,이정도배우들이나온영화가 이정도스토리 를 가지고있는영화가 50만관객도보지않으니 우리는점점 공장에서찍어내는 흥행공식만때려넣은 영화만보며살수밖에..  
20181028,10,"침묵 = 사랑., ,   뭐가 더 있나..  "
20181028,10,푹 빠져서 보고나서 마음이 너무 무겁고 불편하다... 최민식의 연기는 말할것도 없지만 여기 나오는 여배우들의 재발견이라고 보고 싶다  
20181025,10,이제  다운받아서 봣네요 ㅜㅜ 왜이영화를 이제 봣는지 ㅜㅜ 너무 재밌고 최민식 연기 너무 ㅜㅜ 최고에요  
20181025,10,최민식의 연기는 말할 것도 없고....조한철의 연기력에 다시한번 감탄합니다...  
20181025,10,아버지란 ㅠㅠ.. 아빠보고싶어요!  
20181025,10,좋다. 잘만든 영화다.  
20181024,10,말문을 막히게 하는 영화....  
20181023,1,"최민식 연기가 아까움...류준열, 박신혜 연기는...;; 도대체 누가 점수를 저렇게나 준거냐...알바가 열일하나...  "
20181022,10,진짜 감정 잘 살렸다 최민식님은 당연히 말할 것도 없이 탑이시고 조한철님 이렇게 연기 잘 하시는 줄 몰랐는데 진짜 잘 하신다 이하늬씨도 다시 봤다 정말 연기파 배우에 감정살린 연출까지 좋은 영화다  
20181022,10,방금 옥수수앱으로 봣는데 걍 영화보는내내 역시 최민식 이더라 주연조연 전부연기잘하고 굿 명작 ㅇㅈ  
20181019,10,그냥 범인 찾는 영화인줄 알았는데...대박이네...  
20181019,10,그냥 범인 찾는 영화인줄 알았는데...대박이네...  
20181019,10,최고에요 .. 최고의 영화 ..  
20181019,10,사랑이란... 여러가지 모습으로 보여지지만... 본질은 하나인듯...  
20181015,5,"바보로 보다가 천재로 보듯, 관객을 선정하지 않은 영화  "
20181015,9,"베댓처럼 차갑지만 따뜻한 영화, 역시 최민식  "
20181015,6,아빠약혼녀가섹스비디오영상봐서 빡쳐서 술김에죽였다면10년이하나올텐데..더좋은변호사사서 형량줄임되지.돈있는사람들이렇게하던데.결말이 찜찜해.세트장하나만드는것보다 변호사대거사서 재판하는게남는장사.남자검사역 진짜 연기 못한다따로노는느낌.의외로 딸역나온여자잘하네  
20181015,9,그 남자의 사랑법. 연인과 자식을 위한. 어느 것 하나 빠질 것 없는 영화. 마지막 fo가 가슴을 저민다  
20181014,1,유준열 이 새키 연기가 너무 병맛이네  
20181013,10,정말 좋은 반전 영화. 이유를 모르겠지만 적은 관객이 아쉽다.  
20181012,10,와....최민식 연기는 진짜....기대없이봤는데 상당한 수작임  
20181012,1,별로였어요 박신혜의 연기가 심각하네요  
20181012,1,별로였어요 박신혜의 연기가 심각하네요  
20181012,1,별로였어요 박신혜의 연기가 심각하네요  
20181012,7,왜 이영화가 여운에 남느냐면... 죄를 지은사람이 벌을 받지않아서  
20181011,6,"임태산이 나쁜 놈일거라 편견갖고 보면 이게 뭥미, 뭔가 사려깊은 사람일거라 편견 갖고 보면 오!  "
20181010,8,원작보다 한결 풍성해진 스토리... 명불허전 최민식보다 놀라운건 딸로 나온 이수경의 입체적인 연기...  
20181010,10,진짜 연기력만으로승부본영화후반부 장난없는감동이다  
20181009,10,최민식이 체포되면서 법정에서 한말들이 인상깊고마지막에 우동먹는 장면  
20181009,1,가만히 서있는 차 들이 받을 때 영화 종료했습니다. 후회없어요. 오늘 부터 네이버 평점을 더 자세히 봐야겠습니다. 알바 분들 적당히하세요  
20181008,10,원작보다 좋다. 결과를 알고 한번더보면 최민식의 OOO기가 보인다.  
20181007,10,역시 최민식!! 힘있는 딸바보 아빠  
20181007,8,나름 예상관객의 기대와 반전.. 하지만 한국관객이나 나같은 사람이 결과적인 권선징악에 초점을 두고있기에 흥행이 좀 덜됐나?라는 생각이든 난 나름 이하늬가 마지막에 상상으로 해석하지 않았다. 문맥상 상상속의 그녀지만 ..  
20181007,6,스릴러물을 가장한 판타지물. 극적 드라마를 위한 전개 흐름 설정이 죄다 엉망이다. 특히나 결말의 중요한 트릭은 데우스 엑스 마키나 수준이다. 그나마 다행인건 최민식의 연기 스펙트럼을 확인할 수 있던 것과 기대 이상의 이하늬 정도.  
20181006,9,시나리오도 탄탄하고 책임과 진실 사이 고뇌하는 박신혜 연기가 정말 좋았음 박신혜는 이런 전문직 역할도 잘 어울리고  드라마 영화 오가는 행보가 좋은듯  
20181006,1,박신혜 캐스팅은 신의 악수 다된밥에 박신혜뿌리기...그나저나 21세기에 그 주차장 고급차량들에 블랙박스가 하나도 없는건 진짜 황당 그리고 죄는 지은사람이 받아야 마땅함 불편한 결말이었음  
20181006,2,OOOO OO 어거지 부성애 잘보았습다  
20181005,8,이수경 배우 연기 정말 좋네요. 앞으로가 기대됩니다!  
20181005,10,최민식 연기가 와 역시 대브악  
20181005,10,재밌는데...ㅠㅠ 왜이렇게 안떴는지 모르겠네요  
20181001,8,흥행결과가 아숩네. 저것보단 잘 나왔어야 하는 것 같은데.  
20180929,9,그래도이정도반전이면나쁘지않앗다. 이렇게쉽게침묵해도되나싶지만그남자의 스토리라고보면 멋지긴햇다쉽지않은선택인것을..  
20180928,10,마음을 울리는 영화!!긴장감과 감동이 주는 영화!!마지막 장면이 여운이 오래가네요최민식 연기 최고였어요!!  
20180926,10,괜찮은 한편의 드라마같은 영화  
20180926,10,울었어요 ㅜㅜ  넘 짠하다  
20180926,5,잘 찍은 영화 같은데 뭔가 엉성한데가 많다. 편집? 구성? 무엇이 문제일까?  
20180926,10,영화가 참 여운이 길고 가슴이 찡하게 슬프네요 감독이 은교만드신 분이네요  은교도 저는 너무 슬펐거든요 사람의 깊은 감정을 잘 표현하시는것 같아요  
20180926,10,간만에 재미있게봤음 반전  
20180924,5,이하늬 소리지를때 지려따  
20180922,8,"황진미 혼자 에바하네. '이런 인물의 이러한 사랑이야기도 있구나' 하는 거지, 갑자기 어디서 튀어나온 추인 타령. 평론가는 극영화의 보편적 합리성과 가치를 따져야지 지극히 개인적인 잣대로 캐릭터 품평을 해선 안 된다.  "
20180922,5,재밌게 봤는데 침묵의 목격자를 보고나니 이 영화를 굳이 왜 만들었을까 하는 생각이 들정도로 침묵의 목격자보다 나은게 하나도 없다  
20180920,6,새엄마죽었을때부터 최민식이범인일거라고생각해서 재미없었는데 마지막에는볼만했음  
20180918,4,원작을보구 평점 줘라!   연출은 쓰레기요 연기는 눈뜨고 못봐주겠다. 최민식은 개성이 강하지않는 섬세함을 요구하는 캐릭터연기는 완전 잼병. 보고나서 형편없는 영화임에 침묵하고만다  
20180918,7,부성애라 하기엔 딸 상태가 병맛인데 저게 포장이 되나? 끝에서 아빠~엉엉 하면서 끝나기엔 죄가 너무 무거운데..ㅋㅋ 그나마 반전 재밌고 최민식연기에 몰입해서 봐서 그렇지.. 내 상식선에선 이해가 안간다  
20180917,10,영화보고 울었습니다..아버지의 사랑은 위대한거죠..  
20180916,8,관람객그럭저럭 볼만했습니다끝에 반전도 있고..  
20180916,1,이거 평점 왜이렇게 높아요??  죄는 딸이 지어놓고 증거조작으로 아빠가 감옥행^^... 이게바로 돈ㅈㄹ이지.... 너무 억지스럽게 감동을 끌어내려 하시네요;  
20180916,1,알바들 쩐다! 진짜! 토 나온다!  
20180915,7,반전을 위해 너무개연성을 포기한느낌이 없지않아있음. 허나 평식이형님 말처럼 개연성을 감성이 그나마 채워준느낌? 그냥 최민식님 감정연기와 재미를 위한영화.  
20180914,10,두번보니 더슬프다..  
20180914,2,감동하다가 순간 주인공이 김무성같은 사람이라면..? 최민식이 김무성이라고 생각하면 눈물 역행하고 끝까지 욕하고 보게됨.  
20180914,8,다 좋은데.. 정승길이 살인하는 장면을 보고 어떻게 단박에 임태산이 사주한 게 기정사실화 되지? 재판 후 정승길이 어떻게 자유롭게 나돌아다니면서 임미라에게 집을 얻어주지? 허점치고는 참 큰 허점인데 수백명의 배우들과 스탭들이 못 깨달았나..  
20180913,10,이번에도 역시 잘봤습니다.  
