0,1,2
20171123,10,세번의반전이있는영화，반전에반전，，마지막반전은　나의마음ㅠㅠ　딸보고　자주올꺼지？보고싶으니까자주와　할때．．．그웃는얼굴이　왜그렇게　아플까요　마음이　ㅠㅠ마지막　장면에선　두남자들　모두，，，너무슬픕니다　ㅠ　정말　여운이깊게남아요꼭보세요，，  
20171123,8,관람객생각보다 볼만 함...  
20171123,1,그냥 좀 억지스럽다;;  
20171123,10,재미있네요 생각하게 만드는 ...  
20171123,10,아빠로서 연인으로서 세상에서 사랑할수 있는 두 여자를 모두 온전히 사랑하기는 힘들다는걸 생각하면서 면회때 딸을 보며 찡긋하는 최민식님의 모습은 우리네 아빠의 모습 그 이상도 이하도 아니었다. 인간 최민식을 느낄수 있었다.  
20171123,10,역시 최민식이였고 박신혜의 안정감있는 연기와 의로운 이미지를 영화에 그대로 이식한 캐스팅은 신의 한 수였다. 그러나 다소 불친절한 전개와 신파적인 요소가 거슬렸으나 몰입을 방해할만큼은 아니여서 그런대로 괜찮았다. 모든 연기자들에게 박수를 보낸다  
20171123,9,아버지의 이름으로...이게 왜 흥행 실패했는지 이해가 안가네요와~ 난 진짜 이 영화가 올해의 영화네요태어나서 영화에 처음 평점 먹여봄  
20171123,9,처음에 너무 사건전개가 뒤죽박죽인것만 빼면 좋을뻔했는데..그래도 어느순간부터 몰입이 됨영화제목을 남자가 사랑할때 라고 하는게 더 어울릴듯 하네요  
20171123,1,박신혜 캐릭터는 뭐냐 진짜? 변호사가 고용주 반대편에서서 검사랑 짜고 뭐하는 짓?? 진짜 임태산 말마따나 돈주고 고용된사람이?? 변호인이 저래도됨? 솔까 usb에 미라가 죽이는 영상이라도 있었음 어쩔라고?? 박신혜 연기도 캐릭터도 다 노답이였음.  
20171123,9,민식이 행님의 연기에 한번 지리고.. 설계에 두번 지렸다. 그리고 마지막으로.. 아버지는 위대하당ㅠㅜ. 두여자에 대한 민식이형의 진실된 사랑!!  먹먹하다ㅠㅜ  
20171123,1,'엉성함' 이라는 단어가 딱 맞는듯-. 뭘 말하고 싶은 지는 알겠는데 공감은 안감.. 그래서 애비덕에 그 살인마년은 잘먹고 잘사는게 끝이라니 .. ㅠ 영화관에서 봤음 솔직히 울었다 돈아까워서 .. 반전도 힘이 없고 전개도 미지근하고 감정선도 엉성함  
20171123,7,뒷심이 부족해 아쉬웠던 영화. 어울리지 않을것같던 이하늬와 최민식의 연인연기가 어색하지않았다. 딱히 인상깊은 영화는 아니였다.  
20171123,10,답답햇지만 묵직한영화다. 임태산의 드라마  
20171123,1,간만에 쓰레기 같은 영화다  
20171123,10,저런회장이 있으면 얼마나좋을까  
20171123,1,류준열 연기 못해서 깜놀했네.  
20171123,5,관람객마지막 반전이 아니었다면 끔찍했을듯  ㅠㅠ  
20171123,1,특별시민이나 다름없는 영화...와중에 최민식  케이온에 나오는 아키야마 미오 닮음  
20171123,9,반전이 다가 아닌 영화. 여운이 길다.  
20171123,4,최민식 박신혜가 다햇네 나머진 연기가 오글거리고 가짢은 쌍도말투의 검사역은 수준낮고 이질감생겻음 최민식박신혜봐서 4점준다  
20171123,10,"이거 왜 못뜬거냐.. 정말 완성도 높다, 배우들 연기도 너무 좋고  "
20171123,10,관람객연기가 정말... 거기다 편집의 마법이랄까  
20171123,1,이런 영화는 봐주면 안된다. 엉성하고 촌스럽다.최민식 혼자 튀는데 영화 캐릭터도 뭔가 납득 못한 느낌이고 최민식이 그 정도면 다른 배우들은 완전 어떻게 했겠는지 이 감독은 늙은남자 젊은여자 판타지도 있고 촌스럽고 영화찍지 마시길 같이  
20171123,10,꿀잼~~계속 긴장타면서 봄.. 원작이 궁금  
20171123,10,이히늬 노래 잘 부른다. 100점  
20171123,10,두 여자를 사랑한 한남자..영화라는 설정을 배제하더라도 과연 이것과 비슷한 상황인 사람이 없을까?  난 묻고싶다 무엇이 최선인가  
20171123,10,정말 진심일때만 평점 남깁니다. 꼭 보세요 결코 후하하지 않으실 거에요. “최민식” 세글자만 봐도 알 수 있듯이요. 제겐 올해 최고의 영화에요.  
20171123,10,감동 ㅠ 정말 잼있는데..평점이 왜 이것뿐..?  
20171123,3,부잣집딸내미가 태국에 배낭여행간줄  
20171123,4,리메이크...짱깨 침묵의 목격자가 더 신선했던 것 같네요  
20171123,8,참 끝에서 허무했는데 그 허무함이 내가 가진 선입견때문이라는게 찝찝하다... 분명 있을수도 있는 일이지만 이영화를 보기전까진 생각도 못해본 아니 안해본것. 시간 지나니 참 신선한 영화였음.  
20171123,1,딸하고 상대측 변호사  유명한 조연쓰고  실제 사고장면 보여주고... 여자가  딸을 많이 챙기는 장면 넣었으면 좋았을거 같은데  너무 아쉬운 영화네  류준열역은 조연으로 쓰지 ㅋㅋ; 이해안간다 ㅋㅋㅋ  
20171123,5,몇년전 영화 침묵의 목격자와 완전내용이 똑같은데 리메이크한영화인가.. 주목할것은 배우들의 연기력뿐 120분이 다소 길게느껴졋다. 반전이있지만 너무매끄러운전개로 오히려 거부감이 든다고할까 마지막 20분만 기억이남는다.  
20171123,1,어쩔수없이 극중 연기하는 캐릭터다만 류준열 진짜 보기도 싫을정도로 짜증난다. 미친  
20171123,10,박신혜 연기 너무 잘하드라~~ 원래 팬이었지만.. 이번엔 완전 세세한 표현까지 완전 연기 쩔었음..  
20171123,8,최민식이었기에 가능한 반전이었을듯. 그간 전 영화로 쌓아놓은 부정적인 이미지에 편견이 생겨 이번에도 그러겠지 하는 심리 반전인듯. 거기에 점수 주고 싶다.  
20171123,6,연장이 아깝다는 생각밖에 안듬애들 칼싸움에 보검을 들고 나간격억지스러운 스토리를 그나마 배우들이 잘 끌고 갓네요  
20171123,8,한 남자의 사랑 이야기. 마지막 음악이 먹먹하네요.  
20171123,10,영화보고나서 지렸다..라는말이 절로나오는데 오ㅑ 평점이 이런지 의문ㅠㅠ진쩌 최민식연기...최민식 수행비서연기..둘다 지림..  
20171123,6,민식이형 형같은 사람은 그만 욕심 좀 부렸으면 좋겠어요 언제부턴가 독보적 존재감 시나리오에만 묻히는데 정말 연기력이 나오는 영화 좀 이제 선택했으면 좋겠어요 당신의 연기인생은 이게 아니잖아요  
20171123,5,이거 몇년전에 나온 중국영화 표절한건데.. 제목이 생각이 안나네  배우 배경이  좀 달라서 그렇지 내용은 완전 똑같음  
20171123,1,이게현실에서가능함? 감정이입안됨  
20171123,10,역시 최민식 배우님 믿고 봅니다  
20171123,1,반전영화에선 반전이 핵심인데  반전이... 그냥 그렇네  
20171123,9,1점은 내자존심.. 참 어려운역할인것같은데 역시 베테랑..  
20171123,10,별생각 없이 봤는데 대박이네.. 흡입력 인정  
20171123,5,이리저리 멀리 쓰며 나는 다르다고 외치는거 같지만.. 거기까지가 한계인 영화.  
20171123,10,반전에 반전 슬프다..  
20171123,1,류준열 빽빽 나대는 부분에서 흥이 다 깸 연기 개못하네  
20171123,10,최근에 본 영화 중 최고입니다. 최민식의 연기는 정말..침묵하게 만드네요.  
20171123,10,이 영화를 보기에는 너무 어리다는 걸 느꼈다. 아이도 없고 결혼도 하지 않았고 과연 내가 딸을 위해 임태산과 같이 할 수 있을지 10년 후 다시 한번 봐야 알 수 있을 것 같다.  10년 후 다시 이 영화를 본 후에 답을 찾을 수 있을 것 같다.  
20171123,1,아니 솔직히 침묵의 목격자 리메이크란걸 감안해도너무 질질 끌고 한국영화 특유의 좀 그런게 있어서느와르물 느낌이 전혀 안나네  
20171123,9,단순하게 눈에 보이는 결말이 다가 아니네요. 곰곰히 따져보면 여러가지로 해석할수 있는 부분이 있네요. 이 영화는 볼땐 잘 모르지만 다 보고 나서 뒤늦게 재미가 오는군요  
20171123,10,"영화는 달달하고, 충격적이고, 슬프고, 행복하다  "
20171123,10,자식을 가진 아버지로서 자식을 위해 대신 죽음을 택할 수도 있는데... 그깟 깜방살이가 대수일까? 공감가는 영화!  
20171123,10,어찌 100만을 못 찍는건지 이해가 안된다..  
20171123,7,누구나 예상할수있는 영화...6+ 1은 부성애  
20171123,9,"평생 자식 생각에 돈만 벌어오는 아버지를 응원합니다. 엄마, 여자 힘든거만 조명하지말고 아빠도 봅시다  "
20171123,4,저런 배우로 저런 정도의 영화가 나오다니.. 정말 대단한 마이너스손이다.  스토리를 지루하게 풀어내는 능력과  캐릭터를 살리지 못하는 .. 정말 2시간이 아깝다.  어떻게 표현해야할지.. 차라리 드라마 스페셜이 훨씬 좋다.  
20171123,1,그냥중국영화그대로 베낀영화 ㅡㅡ  
20171123,7,중국영화 침묵의목격자 리메이크자품이네요 중국영화가 진짜잘만든듯   민식형님연기쩔어주시고 중국영화주인공도 연기쩔어주시고 ㅋ  
20171123,10,와 영화 참 괜찮네요 반전에 반전...그리고 배우들 연기 정말 좋았습니다  
20171123,6,예전 외국영화가 생각나지 않지만 주차장을 그대로 복사해서 사기쳤는지 속였는지 했던 영화에서 영감을 얻으신 것 같은데요..데쟈뷰를 불러오는 영화같아서 약간 아쉽습니다  
20171123,1,평점 사기다....와.. 평절알바가 진짜 있나보네...  
20171123,8,최민식의 연기는 좋으나 남자 검사의 연기는 정말..너무 거슬릴정도로 어설프다고 해야하나.. 미생때도 거슬렸는데 그때의 느낌그대로..  
20171123,10,말없이  눈물만 주루륵 ..최민식님 눈빛이 너무 애잔...  
20171123,8,이정도면 볼만한정도는 아닌가??내가 긍정적인건가  아니면 우리나라 사람들 영화보는 눈이 그렇게 높은건가...별한개달고 까기만하는사람들은  평론가수준이나 대단한 작가수준의 실력이라도 있는건지 모르겠다. .별점테러 알바면 다행이고ㅎㅎ  
20171123,10,범인은 누굴까 생각하며 보던 중 마지막 씬을 맞이했네요.마지막 씬이 참 많은 것을 생각하게 하네요. 역시 그는 최고였습니다.  
20171123,10,왜 이렇게 눈물이 나는지ㅠㅠ  
20171123,5,딸도 문제 그애비에 그자식  
20171123,8,겉으로 보이는게 전부가 아니다. 사나이의 사명은 손해를 보더라도 가슴이 시키면 핑계대지않고 내어준다.  
20171123,5,"도데체 누가 죽은거냐?만약 죽은 사람이 없다면 태산은 왜 깜빵에 가는거데,죽은 사람 없어면 침묵할필요있냐?다 사기극이라고 이야기하고 죽은 사람도 없어니 풀어 달라고하면 되지.  "
20171123,10,많은 생각이 들게하는 영화네요  
20171123,10,멋지다 묻혀서 아쉽다보세요 후회 안해요  
20171123,7,이래서 자식농사가 중요한거다..  
20171123,10,딸을 지키기 위해 스스로를 쓰레기로 만들어 버린 아빠의 부정  
20171123,10,배우분들   연기에 감탄하며 봤습니다.반전에 반전 내용에  처음부터 끝까지 몰입했고.끝나고도  여운이  오래가는.다운받아 또 보고싶은 영화 1위 추천합니다.  
20171123,10,전개가 별로였지만 최근본 국내영화중에 가장 좋았다중년 가장의 사랑과 책임감 그리고 외로움 또 사회생활등등...이하늬의 재발견...  
20171122,10,최민식아니였으면 1점이었다  
20171122,10,"최민식의 연기가, 뭐 다 했어.  "
20171122,9,쌓아논 이미지를 이용한  감독의 노림수 성공적~~칭찬해~  
20171122,7,평이 안좋아 기대 않고 봤지만 가슴이 먹먹했다 여운이 남는다  
20171122,1,스토리도 연출도 진짜 별로고 배우들 연기도 유명한 배우임에도 이번에는 연기가 다 별로로 느껴짐. 암튼 한국영화 전반적으로 퇴보하는 느낌임.  
20171122,6,원작  홍콩영화 침묵의 목격자 리메이커 한거죠  
20171122,10,한 남자의 진실된 사랑과 부정  
20171122,5,"다른 식으로 반전을 구성할 수 는 없었나. 억지다 솔직히. 보는 내내 궁금한 지점들이 너무 많았고 그만큼 몰입도가 있었는데, 걍 개허탈.. 설마 그런 식으로 풀어가진 않겠지, 근데 방법이 그것밖엔 없는 것 같은데 설마.. 했던 게 실사화 됨. 개황당;  "
20171122,7,하나두 안졸리면서  졸린다 정말 이상하게  지루하면서도  안지루하다  아빠의  명석한 두뇌로  딸을  살리려는  고도의  작전을 짠 스토리  대단하다  
20171122,1,원작보고 만들어도 이렇게 엉성하냐?좋은 배우들 망치는 기술이 대단함.조연들은 학예회 수준임. 책  읽는 줄..  
20171122,6,로얄샬루트를 맥주병에 채워도 맛이 좋기는 좋구나.  
20171122,10,간만에 볼만한 한국영화를 봤네요러닝타임 내내 지루하지 않았습니다. 법정에서의 씬이 많았지만 뭔지 모를 긴장감(?)으로 재미있었네요결말도 예상 밖이라 더 흥미로웠습니다.  
20171122,4,최민식 형님 때문에 4점이나 준다  1점짜리 영화다  최민식 법정에서 끌려가고나서 부터 반전이 예상이 금방 되는데 그걸 또 엄청 늘려놔서 아놔 결말 아는데 계속 하네 라는느낌... 고구마천개먹은답답함이  
20171122,9,한참 생각 했네요 퍼즐이네  진짜  
20171122,9,최민식 배우 연기는 언제 봐도 좋군요....  
20171122,3,태국 아고고서 데려온 여자가 중국말하네. 마지막 caro mio ben 흐르며 바미행 맜있게 먹어서 3점  
20171122,10,명작입니다  역시 최민식  
20171122,8,영화를 보며 관객이 알아보기 힘든 성의 없는 씬에 불만을 가지고 감상했으나 바로 이것이 영화의 반전이었다. ㅋㅋ'최민식은 딸바보'였다라는 것이 이 영화의 핵심 주제라면 주제가 될 것이다. 애인보다 딸을 더 사랑했던 주인공!~알듯말듯 이야기가 전  
20171122,8,몰입감 짱!.. 진실이 도대체 뭐야...끝까지 집중하게 만드는...마지막에 뭔지모를 눈물이 하염없이...추천합니다.  
20171122,1,평이 좋아서 기대했는데 그냥 7점정도 재미의 영화인 것 같다영화를 보면서 조금 억지스럽다는 생각이 들었다  
20171122,9,관람객대박. 이건 꼭 보자. 누가 머리하는.대박. 이건 꼭 보자. 누가 머리하는대박. 이건 꼭 보자. 누가 머리하는대박. 이건 꼭 보자. 누가 머리하는대박. 이건 꼭 보자. 누가 머리하는대박. 이건 꼭 보자. 누가 머리하는대박. 이건 꼭 보자.  
20171122,1,"반전인 부분도 있지만, 큰틀을 보면 역시나 지루한 영화... '세븐데이즈'의 반의 반도 못따라가네... 그나마 최민식이라서 참고 끝까지 봤네.  "
20171122,5,최순실 이후로 알았어. 저런검사는 존재하지 않았음을 영회는 걍 영화지 괴리감 느껴져 그래서 망핸겨  
20171122,10,입에 계속 맴도는 침묵이라는 단어 대박영화  
20171122,5,머 이렇게 지루하냐?ㅋㅋ법정영화 참 좋아하는데 진짜 이렇게 지루하게 만들수있나ㅋㅋ  
20171122,4,앞뒤가 맞지도 않고 케릭터의 일관성도 없다.깔게너무많은 허술한 각본의 영화  
20171122,10,처음에는 뭐야. 이렇게 끝나나? 했는데 또 반전의 반전. 그리고 슬픔. 마지막 정승길 국수 먹는 장면에서 눈물 쏟음. ㅠㅠ  
20171122,10,아..최민식 연기는 반박할수가 없다.  
20171122,9, 그전부터 보고싶었던 영화라 기대했는데 잼있음 와~ 역시 최민식!!연기 정말 잘하심!이하늬도 잠깐 나왔지만 인상깊었음 굿!!!마지막 가슴이 먹먹하더라ㅠ근데 런닝타임 길어서 조금은 지루한감은 없지않아있었다 더 쓰고싶지만 스포 일것같아서ㅠ잼나게 잘봤습니다  
20171122,10,한마디로  볼만  합니다 잔잔하게  뭔가 다가오는 느낌  
20171122,5,망할만하네. 요즘 최민식 작품안목이나 행보가 안타깝다.  
20171122,3,망하는 데는 이유가 있다.  
20171122,1,원작 침욱의목격자 보고 댓글 다는거냐 ??  OOO기 영화구만  댓글조작 하지마라 !! 돈10000원내고 btv영화로 보고있는데 이게 평점 8점대라고 생각하냐 십월넘들아  
20171122,5,홍콩리메이크에 연기력이 좀  아님  
20171122,9,이거 흥행 왜이래 진짜 시나리오 돌았는데너무재밌다  
20171122,10,역시!!!최민식....  
20171122,7, 조연들 연기 너무 OOO다..ㅉ 안습. 그리고 박신혜는 밉상. 연기를 해도 늘 왜 이중성이 보이지  
20171122,3,우리 신혜랑 조연들이 다 망쳐논 영화ㅜ  
20171122,10,범인은 최민식이다 ㅋㅋㅋ  
20171122,10,믿고봤습니다. 중반까지 약간 지루한감이 없지않아 있었는데.. 뭐가 있겠지 있겠지 하고 봤어요 ㅋㅋㅋ 역시 있더라구요 ㅎㅎ  
20171122,7,검사 변호사 러브라인 설정은 최악이다  
20171122,7,평점이 왜 높은가 했더니 얼마 나오지도 않는 류준열 때문인가 보내 빠순이들 보소  
20171122,10,확신이 있는 묵직한 한 방과 사랑이 있는 한 남자의 고독  
20171122,7,"쉽게 풀어나간 법정드라마와 극적으로 연출한 반전의 묘미, 그러나 배우들의 클래스 차이가 쉽게 드러나는 것은 아쉽다.  "
20171122,5,반전을 위해 스토리를 다소 지루하게 끌고가 멋진 반전을 반감시켜버린 영화.  
20171122,8,"재미있게 봤는데 흥행하지 못함이 아쉽네요. 조금은 이해 안가는 포인트도 있으나, 스토리 및 연기 모두 좋은데 말이죠. 배우 최민식의 연기야 익히 알았고, 이 영화의 또다른 발견은 배우 '이수경' 같습니다.  "
20171122,10,40년인생에 영화평점남길라고 처음 글씁니다.. 명장입니다 연기도 그렇고 마지막 장면이 참 가슴에 와 닿네요  
20171122,5,뭔가 억지 반전이다..  
20171122,10,검사님도 16사람한테 도와 달라는 부탁한번 할일이 없을 까요? 나는 그사람한테 잊을수없는 선물을 해주었습니다. 이세상은 혼자못사는세상입니다.~ 버리고 싶은 딸.사랑하는 젊은여자 . 평범하지만 평범이상을 넘는 사랑. 어디서 종지부를 찍어야할지모르느사랑  
20171122,9,초반부에 조금 지루하다 싶다가 중간에는 갑자기 뭐지 싶다가..마지막에 이런 반전이 있을 줄은..나도 모르게 눈물이 나는 영화..두 가지의 사랑 내면연기 너무 눈물나더라고요..  
20171122,7,■ 무게감과 감성을 모두 잘 표현한 최민식의 연기~ 반전이 있으니 끝까지 참고 볼 것~ 이하x는 가ㅈ 친ㅊ 빽이 세서 그런가? 연기 외모 매력 다 별로인데 왜 자꾸 나와??? ~ ■ 똥을 뭉갠 박ㅍ시기의 엉덩이~ 푱시가 밥은 먹고 다니냐? ㅋㅋㅋ  
20171122,5,내용은 좋았으나 혐오스러운 정치성향을 자꾸 삽입해서 보기가 싫었다  
20171122,10,감사합니다.고맙습니다. 마지막부분에 나온 Caro mio be 감사합니다.진짜 최민식!! 그리고 나왔던 모든 배우들께 감사 또 고생한 스텝 그리고 정지우감독님께 감사드립니다. 오랜만에 눈시울이 적셔지네요.  
20171122,10,최민식이라서 가능한 연기다 그이상 그이하도 아니다  
20171122,10,오랜만에 울었네요..  
20171122,10,최민식의 표정 속에서 모든 감정이 내포되어 있네요  
20171122,6,원작에 못미침...  특히 딸배역은 정말 아닌듯  
20171122,10,딸아이를  위한  아빠의마음  맘이아프네요  
20171122,6,돈이 모든것이라 믿는 재벌총수가 딸을위해 모든것을 던지는 설득력 떨어지는 논리의 비약을 최민식으로 커버하다  
20171122,10,7점대 영화는 아닌데... 소름돋는 영화였어요 제목을 소름으로 했어도 될듯  
20171122,1,류준열 연기 진짜 못해..와...  
20171122,10,진짜진짜 재미따 이하니조네  
20171122,1,쓰으으벌....평점에 낚이고 최민식에 낚이지마라 이거 정말 보는순간 인생에 2시간을 날려버리는거임...극장가서 안본게 조상대대로 감사할따름  
20171122,10,크흐  믿고봅니다 최민식  
20171122,6,딸녀ㄴ이 아버지 등골까지 빼먹는다.  
20171122,10,가을처럼 쓸쓸하고 여운남는 영화  
20171122,6,말그대로 꼬리가 너무 길다. 좀 지저분... 제목 하나는 잘 지은듯...  
20171122,10,반전에 반전이 거듭되면서 처음부터 끝까지 몰입해서 봤네요  남녀간에 부녀간에 진정한 사랑을 보여준 모처럼 순수한사랑을 그린 영화 재밋게 잘 봤어요  
20171122,10,이렇게 좋은 영화가 개봉 3주만에 극장을 떠난다는건 비극이다. 한국대중의 수준이 개탄스럽다. 사랑스러운 작품이다. 감독이 각 배우들을 얼마나 좋아하는지 보여진다. 최민식의 연기가 오랜만에 기술을 넘어 진심을 울리는 감동으로 다가오게 만들어준 작품이다  
20171122,10,최민식의 연기가 빛을 발한 영화.  
20171122,4,낡은 연출과 비호감 배우들. 최민식의 고군분투는 임태산에게는 의미있는지는 몰라도 관객들에게는 그 나물에 그 반찬.  
20171122,10,영화 보고 평점 남기는 건 처음.. 본지 이틀 지났는데 여운이 가시지 않아서 다른 사람들은 어떻게 느꼈을까 리뷰 들어와 보고 평점 남기고 가요!  
20171122,1,원작의천분의일도표현못한망작!감독은원작보고도이따구로하는겁니까?이배우들데리고진짜뭐하는겁니까?연출이이게뭡니까 진짜!!!!답답하네당신은원작을봤으니이런식으로연출해도전개가 되겠지만관객은아님!임태산과딸변호사검사와의심리전표현이엉망징창이며전개는아진심화가치밀어오르네요!  
20171122,6,관람객너무 지루하네요 현실적으로  
20171122,10,최민식 배우님의 연기가 매우 인상깊고 아버지에 대한 사랑이 대단하다 생각하며 완전 몰입해서 봤습니다!!대박 반전에 너무 찡한 결말 ㅜㅜㅜㅜ최고!  
20171122,10,정말 재미있게 봤습니다.. 연기도 좋고 스토리도 좋고 추천합니다.  
20171122,7,원작해비해 사족이 많아 진행이 느리다는단점..하지만 최민식의연기는 볼만 하다 ..사족을 붙일려면 마지막에 재심을 한다든지 모든것을 제자리로 돌려놓아주길 바랄뿐..딸년이 처벌받아 마땅..딸케스팅은 원작처럼 문근영같은 스타일이 딱인데  
20171122,8,변호사와 검사는 상당히 OO하고 역할이 별로 없는듯..그래도 전체적인 전개나 시나리오가 참신한것 같습니다.  
20171122,6,걍 뭥미다 현실성이 없다 몰입감은 있으나 영화가 망할만했다 무엇을 위한 침묵인지 개연성이 없다구  
20171122,10,영화보고  한참  멍때렸다.. 여운이깊은 영화...  구런데  왜 관객수가  침묵인지 궁금하네요...  영화  잘만들있고  연기도 최고인데.. 내생각으론..  홍보가부족했고  임팩트가약한스토리라서그럴듯   시기잘못마춰 개봉한  
20171122,1,시나리오가 초딩이 쓴 수준이네~억지에 억지에 억지 이걸 끝까지 본 내가 바보지 에휴~꼬아도 적당히 꼬와야지~그냥 반전영화 만들고 싶어서 반전에 반전에 반전을 넣을려니 억지로 겨우겨우 끼워맞췄네~  
20171122,4,이게 지금 개연성이 있다고 생각합니까... 회장씩이나 되는사람이 사건 처리를 이렇게 단순 무식하게.... 아빠가 사건처리가 저학력자의 평범한 소시민이었으면 납득이 가겠네  
20171122,7,관람객그냥그냥그래용~드라마로만들었으면 더좋았을듯요ㅋ  
20171122,7,박신혜 ㅈㄴ거슬림 0도 안어울림아 최민식님 역시 캐리 연기 보는맛에 끝까지봤다엄청난 스케일로 침묵하게만든 아버지...잘봤습니다  
20171122,5,"감동 반전을 꿈꿨지만, 재미도 의미도 없다.  "
20171122,8,적어도 100만은 당연히 넘겼어야될 영화  
20171122,6,전체적인 분위기는 노잼이었는데.. 마지막에 가면서 볼만 했음... 마지막 반전 개멋지더라... 법정에서 최민식이 대사 쏟아낼때 연기오지더라...  
20171122,1,진짜 영화거 침묵 되버린 영화 ㅜㅜ  
20171122,4,어떤 맛도 나지 않는 영화.  
20171122,10,눈물쏫고 봤네요 ~너무  잼써요  
20171122,1,애국가는1절만. ...  
20171122,9,관람객반전의 반전이었던 거임  
20171122,8,어떤정보도 없이 봤는데....좋았다....  
20171122,1,잠이 쏟아져 참다참다 결국 잠들었다일어나서 다시봤는데 종반에가서야  즐거리를 알수있었다나를 잠들게 한죄로 1점준다...마지막음악이 절묘했다...  
20171122,7,잘만든 영화는 아니지만 못만든영화도 아님  
20171122,10,..예상치 못한 반전에 마음이 먹먹하네요..  
20171122,1,평점절대올리지마세요 네티즌착각함.. 쓰레기영화..  이런쓰레기영화또없읍니다  
