0,1,2
20170622,10,다른분들은 어떻게생각하시는지몰라도 저는 이거보고 참많이 웃고 울었던것같네요.  저에게는 평생 기억에 남을 영화인것같아요  
20170621,10,재밋고 나름무거운부분도있어섲ㅎ아  
20170621,5,"딱 한국에서 좋은 평점 나올 영화. 화면 이쁘고, 주인공 외모 좋고(이쁘고 잘생기면 연기 천재가 됨), 음악 많이 나오고, 뻔한 얘기여도 감성적인 척하면 인생영화란 극찬이.. 어바웃 타임도 그런 영화였지.. 그나저나 미와 노래는 어째 비슷한게 많은듯;  "
20170621,7,관람객딱 청춘영화~!그 이상도 이하도 아닌 잔잔하고 무난한 영화~  
20170621,9,관람객어음.... 어... 높은점수.... 어... 그냥 후하게...드림...사실... 남자 배우가 잘생긴것 빼곤... 진부하달까...  
20170621,6,타임머신보다 훨씬  지루했다 신선함도  없었다  
20170621,10,순수한 사랑이야기가 너무아름다웟고 영상미도이쁘고..ㅠ 무엇보다 켄타로가존잘  
20170621,8,관람객켄타로 짱짱 멋있음 우와왕  
20170621,4,생각보다.. 별로 보다가 끔;;  
20170620,6,켄타로 얼굴볼려고봤다. 다보고나니까 시간아까웠음. 결말도 그렇고 뻔하다. 켄타로 연기랑 얼굴은 넘사벽이긴하네.. 켄타로아니였음 중간에껐을뻔  
20170620,8,관람객여주의 연기가 몰입에 방해를 주었지만 이쁜 사랑이야기에 흡족 ~~~~ 지난 학창시절을 떠올리는 영화였습니당  
20170620,10,친구가 보재서 마지못해 끌려갔다가 나오면서 고맙다고 감사인사한영화.. 켄타로 얼굴도존잘이지만 그보다는 스토리가 참 소재가독특하고 가슴먹먹하게 하는 감동이있네요 역시 사랑도 마지막이있어야 아름다워지는법 보는 내내 펑펑 울었습니다 ㅠㅠㅠ두번세번보고싶어요  
20170620,6,관람객그냥저냥 볼만해요. 미와의 목소리와 켄타로의 얼굴이 열심히 일하는 영화입니다.  
20170619,10,사랑스럽다. 다시 20살로 돌아가고 싶다.  
20170619,10,관람객재미있었어요=_= =_=  
20170619,10,관람객잔잔한일본멜로영화...!!!  
20170619,6,관람객클리셰 덩어리의 로맨스 영화. 그 이하 그 이상일 것도 없었지만 ost와 남자주인공의 감정선은 정말 좋았습니다.  
20170619,10,관람객또 보고 싶다 그래서 집에서 다운받아서 볼것이다 물론 굿 다운로드 ~!~!  
20170619,1,너무너무 재미없다 연기때문에 몰입불가ㅋㅋㅋㅋ시간아깝고 돈 아까운영화나한테도 인생 레코드가 있었다면이 영화보기 전으로 시간을 되돌리고싶다..ㅠㅠ  
20170619,1,이 영화에 대한 평은 크게 두가지 나눌 수 있다.'X나게 재미없다' 또는 'X나 개 재미없다'  
20170619,9,관람객영화 ost가 너무 좋았어요 풋풋하고 설레는 영화였습니다  
20170618,10,관람객OST사고싶다ㅠㅠ 켄타로 너무 잘생겼다ㅠㅠ  
20170618,8,관람객상상했던 것보다는 슬프지않았다.  
20170618,8,관람객100번째때 울뻔햇슴다  
20170618,10,관람객켄타로ㅠㅠㅠ너무좋아요  
20170618,8,"관람객진부한 스토리라고들 하지만 자기 삶에서 아오이가 받았던 리쿠의 사랑을 체험한 적이 있다면, 리쿠와 아오이같은 슬픈 이별을 해본적이 있다면, 리쿠같이 홀로서기를 해야한다면 함께 한 시간에 대해 정리하고 의미를 되새김질 하게 도와줄만한 아름다운 영화.  "
20170617,7,관람객켄타로 존잘 감탄하다 끈난 영화  
20170617,10,관람객여운이 남는 영화였고 노래들이 너무 좋았다  
20170617,7,관람객볼만해요 음악 좋았어요  
20170617,9,"관람객시카쿠치켄타로 스고이!! ㅋㅋㅋㅋ삼월부터 기다린영화니 만큼, 일본영화니만큼 잘봤습니다~  "
20170617,10,관람객정말 재밋게 보고왔습니다ㅠㅠ 영상미도 너무 예쁘고 내용도 알차고 재밋었습니다!  
20170617,7,관람객기대 이하이지만 재미있었습니다!  
20170616,9,무작정 본 영화에서 보석을 발견ㅎ켄타로 멋져도 넘 멋지다..순수하고 예쁜 마음을 잘 녹여 표현한 영화.음악도 좋고...옥수수에서 다시 다운 받아 다섯 번이나 봄..사랑하는 연인을 보낼 수 밖에 없는 안타까움을 순수한 감정으로잘 표현해냈다.  
20170616,5,관람객재미있고 잔잔하지만 유치한 딱 상상했던 영화. 일본감성이 좋았고 음악이 좋았다. 중간에 지루해서 졸았지만 볼만했다.  
20170616,10,관람객존잼이어떠염^_^또보래요  
20170616,10,관람객ㅅㅇ로허라사가아느주둗  
20170616,10,"관람객캔타로 너무 잘생겼다. 푹 빠지게 된 영화였다.중간중간 지루한 요소도 있었지만 너무 가족, 연인에 관해서는 감동적인영화  "
20170616,8,아 이따가 보려고 했는데 밑에 스포하신 분 때문에 기분 잡침  
20170616,10,너무너무 재미있고 감동적인 영화였습니다 노래도 너무 좋고 달달하고 너무 아름다운 영화  
20170616,10,관람객구성이 아주 훌륭한 영화같습니다눈물 주륵..  
20170616,5,관람객켄타로랑 다른배우는 좋은데여주가 맘에 안듬ㅠㅡㅠ  
20170615,6,관람객아쉬운 연기력이 몰입을 방해  
20170615,6,관람객중간에 잤다 와이프는 잼있다고해서 6점  
20170615,10,사랑해요 켄타로 미와 ♡  
20170615,10,관람객너무 너무  감동적으로 봤어요...남주의 애틋한마음  .그리고 여주의  결단~~~그사이로 흐르는  음악들도  너무 좋았습니다.기회가되면 한번  더 보고싶네요~~  
20170615,10,관람객제 인생영화가 됬어요 10836194725번 더볼까에요ㅠ  
20170615,6,관람객노래 좋고 남주 애틋하고 여주 귀엽다.  
20170614,10,나 진짜 펑펑울면서 봤네ㅜㅜㅜㅜ켄타로 입덕도 하곸ㅋㅋㅋ노래도 갑bb내 인생영화가 되버렸당  
20170614,3,관람객볼만합니닿ㅎ재미있어요  
20170614,9,관람객아나노오ㅓ므뉴노머누노냐누눙  
20170614,8,관람객일반로맨스물인줄알고갔는데 켄타로얼굴에 빠지고.. 나름나쁘진않았는데 마지막은좀지루한감이있었어요  
20170614,7,여주연기 너무 오그라듬... 영화 소재도 진부하고 내용도 진부함 근데 보다보면 복선? 이라해야하나 자잘자잘한게 좀 있어서 볼만했음  
20170613,10,관람객너무 좋았습니다..!  
20170613,10,관람객켄타로정말머싯어요!!  
20170613,9,관람객애틋하고 설렜다 특히 사카구치 켄타로가...♥?  
20170613,7,헐..켄타로팬들을 위한 영화라 그런지 평점에 사심이 가득하네ㅋㅋ켄타로를 위한 영화..여주 연기만 괜찮았어도 참 좋았을텐데....예쁜영화 그 이상은 아니였음..  
20170613,10,관람객마지막 노래에 감동을 받았어요!  
20170613,10,관람객팬들이 많아 거슬리는데 그거 빼면 영화는 감동적  
20170613,10,관람객엄청슬펐어요진심..음..어  
20170613,9,켄타로 보러 간거아닌 일반관객입니다 일드 좋아하는 편인데 진짜 슬프고 재밌는 영화구요 그렇게 유치하지도 않는게 켄타로 성격이 유치하지 않게 자연스러운 츤데레를 잘 표현해준것 같아요 기대이상입니다 ㅠ 여주 연기 잘하는데 왜들그러는지 잘 모르겟네요  
20170613,8,관람객켄타로 잘생김..눈물 한 3번뽑음  
20170613,10,관람객넘나 재밌고 넘나 슬프고 넘나 풋풋해 고로 이 영화는 사랑입니다.  
20170612,10,관람객켄타로 별점 10!그냥 달달하고 좋았어욤  
20170612,8,와 밑댓진짜 볼라했는데 결말왜 스포함? ㅋㅋㅋㅋ 신고할라하니까 신고사유가 안되네 아 화가난다....  
20170612,8,관람객남주 핵존잘... 진짜 잘생기긴 잘생겼음ㅋㅋㅋ 약간 어바웃 타임 같기도 하고 스토리는 괜찮았어요!다만 여배우 연기력이 정말...  
20170612,8,관람객재미있었습니다.켄타로 보러간 영화였는데내용도너무 좋았어요ㅎ  
20170612,7,관람객여주인공의 죽음이 아쉽긴했지만 운명에도 우연은 없다라는 느낌을 잘 살려준 영화였던 것 같습니다. 잘 봤습니다.  
20170612,8,관람객재밌는 영화였어요~~  
20170612,10,관람객남주 넘멋있음 ㅠ 진짜 울고나오는영화ㅠㅠㅠ  
20170612,10,"관람객중간중간에 나오는 노래들이 하나같이 다 너무 좋았고, 오랜만에 로맨스 영화를 봐서 그런가 여운이 깊었다.  여주와 남주는 매컷마다 선남선녀여서 그런가 보는 내내 눈호강했다.  "
20170612,10,"영상 예쁘고, OST 좋고! 휴지 챙겨가세요.  "
20170612,10,관람객엔딩이 아쉬웠지만 로맨스 영화로서 재밌었어요.  
20170612,8,소재는 흔했다. 켄타로 때문에 봄  
20170612,9,관람객진짜 최고에요!추천해요!!  
20170611,10,관람객잔잔하고 소소한 영화라 좋았어요. ost가 특히 좋네요..♡  
20170611,10,관람객일본의 뻔한 로맨스 영화였을 수 있지만 여운이 참 긴 영화네요. OST너무 좋았어요! 영화관에서는 딱 1번 보고 소장해서 두고두고 보고 싶은 영화예요! 켄타로 흥해라!  
20170611,10,인생영화 추천 ...♡♡영화관에서 목놓고 울뻔 했다...♡  
20170611,10,오늘 보고 왔습니다!어떻게 보면 여주의 약간 오글거리는 연기 때문에 별로라고 생각할 수 있겠지만 오히려 순수해 보여서 더 여운이 남는 것 같아요!간만에 메말랐던 감성이 올라오네요 ㅎㅎ마지막 ost... 감동입니다  
20170611,9,"관람객꽤잘만들어진 일본식 정서와 전개, ost 결코 손해는 보지않을 작품.  "
20170611,10,관람객연애가 하고싶어지는 영화  
20170611,9,관람객딱 일본로맨스영화네여  
20170611,10,연인과 보기 좋은 영화다진짜 엄청 슬프고 ost도 좋고 켄타로도 잘생겼고 교훈도 있고 여운이 많이 남는 영화다. 인생영화등극  
20170611,8,관람객무난하게 보기 좋습니다 생각보다 괜찮은 영화에요  
20170611,10,관람객나의 인생영화 다음에또보고싶다..  
20170611,10,관람객켄타로 짱 멋있어요!!!!  
20170611,10,관람객시간가는줄모르고 봤습니다 켄타로 넘 잘생겼어요!!  
20170610,10,관람객진짜 너무 슬퍼서 엄청 울었어요ㅠㅠㅠ완전 명작입니다!!!  
20170610,1,"관람객스토리,대사는 물론이거니와 여배우의 연기가 화룡정점  "
20170610,10,켄타로랑미쿠 둘다 너무 이쁘고 잘생겨서 보는내내 호강했고 스토리도 지금 현재를 소중히 여기자는 느낌이 와닿고 노래도 영화를 보고들으면 더 울컥하고 가사 하나하나가 추억이 담긴 사진처럼 느껴져서 더더욱 좋았다  
20170610,10,켄타로 뿐만아니라 내용도진짜좋아요ㅠㅠ ost대박..  
20170610,10,관람객최근 본 영화중 최고 ㅠㅠㅠ  
20170610,7,"관람객뻔한 타임슬립로코, 켄타로 영상 화보집  "
20170610,10,관람객너무 감동적 ㅠㅠㅠ 남자인 친구가 여자인 친구를 위해서 남자친구랑 봣는데 눈물이 나왓어요 마지막에 너무 슬펐어요 ㅠㅠㅠ  
20170610,8,관람객뻔하지만 그거대로 괜찮은 스토리. 연기력은 좀 별로였는데 그래도 괜찮았던 영화  
20170610,10,관람객Ost도 너무 좋았고 슬펐어요ㅠ  
20170610,10,관람객너무잘생겼고ㅠㅠ감동적인ㅜㅜ  
20170610,10,관람객영화속 음악과 배우들의 모습을 보고있으면 그저 행복해지는 영화였어요  
20170610,9,관람객약간오글거리지만 재미있었어용  
20170610,8,관람객어느정도 전개가 예상되는 영화지만 타임리프의 방법도 새로웠고 뻔한 전개를 음악을 통해서 충분히 잘 그렸다고 생각해요 미와(여주인공) 연기가 초반에 어색하지만 중후반부엔 괜찮아져요 청춘멜로영화로 괜찮고 음악도 정말 좋아요!  
20170610,8,관람객반전도 있고 너무 재밌어요  
20170610,9,관람객소재는 좋았으나 전개가 미흡.... 가수출신 여주라 연기톤이 너무..  
20170610,9,관람객일본 특유의 오글거림 때문에 일본 영화를 잘 못봤는데 이 영화는 그게 덜했던것 같아요! 뻔한 로맨스 영화지만  그래도 재밌게봤어요! 켄타로 연기가 너무 좋았고 멋이ㅣㅆ었어요!! 켄타로로 눈호강  
20170609,6,관람객연인과 보면 좋을 예쁜이야기  
20170609,5,내가 켄타로팬인데 이건 쫌 너무했다.감독이랑 각본 누구냐ㅜ예고편은 설렜는데 그냥 예고편만봐도 될듯..여주노래는 잘하는데 배우할 목소리는 아니다ㅜ캔타로때문에 설렜지만 스토리나 여주 연기땨문에 한숨나오는 영화  
20170609,10,관람객처음부터 끝까지 놓치기 아까운 장면들이 많았다남자 주인공의 순애보가 너무 아련했다  
20170609,10,내용도 탄탄하고 여운이 남네요  
20170609,5,관람객그저그런영화 역시 일본영화  
20170609,8,관람객어바웃타임이후 비슷한 소재들이 떼거지로 나오는 와중에 나온  재밌었던 영화. 소재의 지루함은 있었지만 일본만의 느낌을 잘 섞은 것 같네요  
20170609,10,"관람객진짜 내인생영화 찾음 ,,  "
20170609,10,관람객최고에요최고에요최고에요최고에요  
20170609,5,관람객보다가 잠들었습니다.... 너무 뻔함  
20170609,5,영화관에서 제돈주고 보기는 아까운 영화. 뻔한 3류영화 스토리에 ost나 켄타로 얼굴빼고는 볼 이유가 없다. 솔직히 저 소재로 슬픈건 당연한거고 연출 자체적으로 아련함이나 슬픔은 전달되지 않음. ost때문에 5점.. 아니면 3.5점  
20170609,10,관람객너무재밌어요일본감성이라..지금 켄타로에빠졌어  
20170609,10,관람객인생영화다 켄타로가 나온다고 해서 보러갔지만 스토리에 반했다  
20170609,7,관람객내용이 곧 켄타로...영상화보집본거같았음ㅠ넘좋다  
20170608,10,호불호가 갈리네요ㅎㅎ 저는 아주 재밌고 여운이 남는 영화였습니다 ost도 좋았고 다소 의역은 조금 아쉬웠네요 남자지만 켄타로 멋있네요ㅎㅎ  
20170608,7,관람객딱히 기억에 남는 영화는 아닌데 남주 얼굴만 기억나요...ㅎㅅㅎ  
20170608,10,관람객혼자봤는데 너무좋았어요 눈물이쥬르륵  
20170608,10,관람객마법의 순간을 만드는 켄타로!!  
20170608,10,관람객진짜 감동적이에요....  
20170608,10,관람객감동적이고 감동적이고 감동적이고남자주인공잘생겼습니다  
20170608,10,관람객남주 얼굴만으로도 영화 심쿵하며 보실수 있습니다... 최고^^  
20170608,9,관람객반복되는 것이 좀 졸렸는데 재밌었네요 남주가 하드캐리ㅋㅋ  
20170608,10,관람객진짜 근래본 연화중 젤 재미있었음퓨ㅠ  
20170608,8,켄타로는 정말 너무 잘생겨서 두번이나 보러갔는데 진짜 여주인공 미와....연기 너무 못해요..진짜 두번봤지만 미와 연기력때문에 자리 박차고 나가고싶었음 그래도 켄타로때문에 참음..이거보고 우는사람들 신기해요 미와때문에 아예 집중도 안되던데;;  
20170608,10,관람객정말 설레임 가득한 영화  
20170608,6,관람객진짜 켄타로군이 너무너무 잘생겨서 좋았어요. 생각보다 많이 슬펐고 애잔했으며 끝부분도 짠했어요 그래서 저는 별로였습니다! 해피엔딩찬양자 이므로! 그래도 한번쯤은 보면 좋은영화..  
20170607,10,관람객영화의 긴 시간도 지루하지않을 정도  
20170607,10,관람객에코 : 마음대로 해. 되돌리면 되니까! 시공간 붕괴!  
20170607,6,관람객사카구치 켄타로 얼굴이 다한 영화 나머지는 노래가 좋았다 정도? 시간 날때 가볍게보면 좋을듯하다 일본영화 특유의 내용이라 약간 진부함  
20170607,9,영화 완전 재밌음. 근데 남자 주인공 코디 문제있는게 영화 2시간동안 똑같은 바지만 입고나옴  
20170607,10,관람객진짜 캔타로도 완전 잘생겻구내용도 조금 유치할꺼같긴 하지만 진짜 재밋어옹 ㅠㅠ인생영화 ?  
20170607,9,관람객음악도좋고 배우도 잘생기고예쁜사람도많고 스토리도 좋앗어요 처음엔 지루햇지만 마지막에 완전 감동이요!  
20170607,9,옆에 소리와 진동덕분에 쫄아서 제데로보진못햇지만.죽을운명인 여주인공 그 여주를 살리고싶은 남주인공한편으로는 나라면 어떻게 햇을까 생각이드는영화엿네요 잼잇엇음다  
20170607,10,관람객내용은 뻔하지만 잔잔하고 좋아하는편이라 괜찮았는데 여자들 함성소리에 다 깻음  
20170607,6,관람객사카구치 잘생겼고 에리나 예쁘다 그게 전부  
20170607,5,관람객アイオクリ...!!  
20170606,1,이거 0점은 없나요.. 켄타로 팬이라도 영화볼때는 에티켓좀 지켜줬으면 싶네요  
20170606,10,"기대없이 봤는데, 영상미도, 노래도 좋고 , 감동적으로 잘 봤습니다..!눈물이 주륵주륵 ㅠㅠㅠ..  "
20170606,10,스토리애련애련..잔잔해서좋다..  
20170606,10,OST 나왔으면 ㅠㅠ 영화 정말 좋았어요  
20170606,10,켄타로 존잘ㅠㅠ노래도 너무 좋다  
20170606,9,관람객크 끝내줍니다!!!!  
20170606,10,관람객켄타로 얼굴이 다한 영화  
20170606,10,노래도 좋고 스토리도 괜찮았던 슬픈 영화ㅜㅜ  
20170606,10,기대없이 보러갔다가 완전 감동. 남자주인공 팬될듯  
20170606,7,관람객잘 봤습니다 잘 봤어요 잘 봤습니다  
20170606,10,우주미남 켄타로 무슨 말이 더 필요합니까!!!!뻔한 스토리이긴 했지만 눈도 행복하고 귀도 행복하고 켄타로 얼굴보려면 영화관에서 꼭 보세요!! 휴지도 들고  
20170606,10,뻔하다 유치하다 라는 소재일수는 있겠다하지만 사랑에대한 감정만은 충분히 차고 넘치게 받을 수 있었다.  
20170606,10,진짜 너무 설레고ㅠ 인생영화임 ㄹㅇ  
20170606,5,진짜 너무 억지로 감정이끌어낼려고 좀슬픈것같네 하면 특히 여주가 감정선을 자꾸 깸 ㅋㅋㅋㅋ나중엔 걍 어이없어 웃음이나옴 진짜집중안되는영화 그리고 본사람들은 헤에에?이거에서 빵터졌을거라생각듬 평점첨써봄  
20170606,10,진짜 켄타로가 얼마나 잘생겼는지 보여주는 영화 미와도 너무 예뻤다 ㅠㅠ  
20170606,8,관람객일본감성의 잔잔한 영화였던거같아요ㅎㅎ 끝나고 ost가 계속 맴도네요  
20170606,6,관람객오글거리고재밌다 일본특유의분위기랑 뻔한스토리지만 색감이나구도가 이쁨  
20170606,10,관람객분위기도 좋고 배우들이 다 연기를 잘해서 몰입도가 뛰어납니다  
20170606,10,눈물 펑펑 쏟은 영화 ㅠ켄타로는 사랑입니다 무조건보세요 한 번 더 보러 갈련다!!  
20170606,10,관람객켄타로 진짜 존잘...  
20170605,10,관람객너무슬퍼요ㅠㅠ정말엉엉운듯  
20170605,8,관람객사카구치 켄타로 얼굴이 다 함  
20170605,10,나만 슬펏나 마지막에 ㅜㅜㅜㅜ 아니 영화관에서 나혼자 질질짠것같아ㅡㅜㅜ켄타로를 위한영화였고 그냥 너무 재밋엇다 난 백점  
20170605,5,두말할것 없이 켄타로가 목적이었지만 여주 발암이 너무 강력해서 할 말이 없네요... 내용은 처음부터 끝까지 진부했지만 켄타로 용안이 그만큼 아름다웠습니다 차라리 여주 시점으로 영화를 찍었으면 좋았을껄...  
20170605,8,여주인공 민폐 정말 좋아하면 힘들어도 같이 살아서 행복할생각을 안하고 무모한짓함 아무튼 좀 유치한 스토리긴한데 노래도좋구 영상미도 좋아요  
20170605,9,관람객너무슬퍼요 ㅠㅠㅠ진짜 스토리도갠찮고 진짜 노래도좋았어요  
20170605,10,ost하고 내용모두 기대이상으로 좋았다한번쯤보면 좋을것같은 영화다  
20170605,10,켄타로 보러 가기 딱 좋아요 ㅜ ㅜ 너무 뻔한 스토리라고 싫어하시는분들도 계실텐데 조금 뻔하지만 스토리가 너무 재미있고 일본의 특유 느낌이 나서 좋은 것 같습니다.  켄타로 너무 잘생겼어요 ㅜ ㅜ 그리고 친구랑 마지막에 펑펑 울고 왔습니다.  
20170605,1,왜 봤지....졸면서 봤습네다...  
20170605,8,관람객사카구치 켄타로 팬이어서 보러갔는데 생각보다 재밌게 잘 보고온듯  
20170605,7,관람객켄타로....너무 달달하고 설레는 영화에요 ㅠ  
20170605,6,"일단  켄타로 얼굴에 감탄사 연발이고,  내용은 글쎄요...  여주랑 케미가 좋지 않았어...  "
20170605,7,"관람객사카구치가 겁나멋있고, 노래가 좋음  "
20170605,10,오랜만에 제대로된 영화를 본거같다  
20170605,10,OST 안나오나욤 ㅠㅠ  
20170605,7,관람객오글거렸지만 캔타로 존잘...전형적인 일본 스타일 로맨스 였음  
20170604,10,집에와서도켄타로 얼굴이 아른아른 거린다... 설레서 죽는중  
20170604,8,관람객일본 감성 터짐.. 특히 가상 남친이 보고싶다면 봐도 좋을듯!  
20170604,10,와진짜 너무 재밌어서 말이 안나올정도에요.아직도 여운이가시지않는..진짜 이건 저의인생영화같아요.나의소녀시대다음으로 정말재미있게봤어요.진짜보는내내설레서죽을뻔했어요!!진짜설레요그리고 갈수록 진짜 슬퍼요..진짜여자라면 꼭 한번봐볼만한영화같아요진짜재미있어요!  
20170604,10,관람객정말 대박이에요 내용부터 연출까지 정말 너무 좋았어요ㅠㅠㅠ꼭 보세요 엉엉ㅠㅠ  
20170604,10,관람객켄타로..겁나좋앙 켄타로땜에설래면서봣다  
20170604,10,진짜 대박이에요진짜마지막에 정말 오열하면서 울었습니다 집에서봣다면소리를내면서 울었을텐데 영화관이라서 많이 울지는 못했네요 냈든 진짜 대박이에요이건 진짜제인생영화에요정말켄탏땨문에보게된거지만켄타로하고는상관없이진짜 대박이에요10분전에영화보고나오는건데정말..  
20170604,10,인생 영화 ㅠㅠ 너무 울어서 나올 때 창피했다..   진짜 남주보고 2시간 내내 힐링했습니다.  
20170604,10,하 진짜 최곱니다ㅠㅠ 너무 달달하고 마지막에 새드앤딩이라 좀 아쉽지만 이번 해에 본 영화중 제일 재밌었어요ㅠ!! 켄타로 넘 잘생겨서 눈호강도ㅎ♥  
20170604,10,켄타로ㅜㅜ연기 진짜 잘하구 마음찢어지구 진짜 재밋는 영화엿어요  
20170604,10,관람객켄타로 영상화보집.. 꼭 영화관에서 봐야합당  
20170604,8,관람객노래가 정말 좋았어요ㅠㅠ  
20170604,10,삼촌도 좋아하는사람에게 몇번이나 되돌아가봐는데 안되더라 그보다 중요한거는 그시간에 그 애 옆에서 추억은 만드는구나 라고 느꼈다  
20170604,10,공연하면서 노래하는 장면이 마지막에 있는데 자막보면서 듣는데 진짜 너무 가사가 마음이 아팠음 그냥 OST도 좋고 스크린으로 안보면 후회했을만큼 좋은 영화였음 오랜만에 영화다운 영화를 본듯  
20170604,10,관람객뻔한 러브스토리지만 너무 감동적이고 재밌게봤어요 ㅠㅠ 순수한 사랑을 하고싶게하는 영화였습니다특히 여주가 죽기전 마지막에 같이부르는 노래가 좋았어요!!  
20170604,10,"관람객남주 여주 누군지도 모르고 봤지만 폭풍감동, 마지막 라이브 잊을수없다.  "
20170603,8,"관람객마지막 공연의 노래가 갠인적으로 좋았어요일본느낌의 영화 분위기,의도가 느껴지는 영화.역시 켄타로는 얼굴이 열일합니다. 연기 물론 좋았습니다.마지막에 눈물이 흐를뻔 했지만 꾹참고 보았습니다 노래 음원을 다운받고 싶은데 한국서버에서는 안된다고해서 아쉽네요  "
20170603,1,뻔하고 진부 일본영화는 발전이 없네 내가 이런것만 보게되는건가 아니면 진짜로 그런건가  
20170603,10,"관람객영상미와 ost, 그리고 켄타로까지.. 진짜 너무 좋았어요ㅠㅠ  "
20170603,7,관람객시간은 변하지 않는다. 하지만 좋은 추억이 될지 후회가 될지는 우리애게 달렸다.  
20170603,5,관람객그냥 켄타로 얼굴 영화... 그냥 가볍게 보기 좋음 옆에 있는 사람한테 잘 하자는 교훈  
20170603,10,관람객진짜 잘생긴남자가 우니까 너무맴찢 ㅠㅠ  
20170603,10,켄타로는 오늘도 얼굴 열일.여주 목소리가 너무 이뻤음.Ost가 정말 매력적임.뻔한소재지만 뻔히지않았고 결말도 마음에 들었음오랜만에 편하게 자지도않고 끝까지 열심히 본 영화상영관도 많이없던데 빨리 보시길!  
20170603,8,관람객혼자 보기 좋은 영화엿던 것 같아요  
20170603,10,영화 저는 너무 재미있었어요ㅠㅠ 중간중간 설렜다가 슬펐다가.. 그리고 켄타로가 너무 잘생겼음.. 왜 인기가 많은지 알거같은! 이 영화 보고 저도 켄타로 팬이 되었다는..  
20170603,10,관람객너무 슬펐다. 인생영화..  
20170603,10,스토리 너무 좋고 ost도 듣기 좋았어요! 한번 더 보고싶네요 여운이 강해요. 아쉬운 점은 자막이 의역이 너무 많았어요.  
