0,1,2
20171004,10,바람같이 스쳐가듯 인연도 운명도 스쳐가는 거 같네요.인연이었지만 운명이 어쩔수없나봐요.  
20171004,6,남주의 미모가 여주의 발연기 앞에 무너지다. 이런 상태의 연기를 영화로  내보나다니...  
20171001,5,켄타로 연기 개못해 우우우우  
20170930,10,관람객재밌었어요ㅎㅎㅎ너무멋집니다  
20170930,10,켄타로가 노래하는 장면에서 울컥...  
20170927,6,둘이 잘 어울리는 듯 하면서도 여자 배우 키가 너무 작아 몰입이 잘 안됐다. 지루하다가도 마지막 무대에서의 노래가 가슴을 아리게 했다.  
20170926,10,아무 생각 없이 틀었는데 끝에가서 엄청 울었어요ㅠㅠ노래부르는 장면에서 상황이랑 가사가 너무 슬퍼서 계속 눈물이 나더라고요꼭 보세요! 너무 감동적인 영화..대사며 노래가사며 저는 너무 좋았던 영화:)  
20170925,7,관람객의외로 재밌고 감동적으로 봤다.  
20170919,10,아 너무 가슴 시리다 ㅠㅠ  
20170917,7,켄타로 얼굴이 재밌었음. 내용이 재밌지는 않았음.  
20170916,8,여주인공의 아이돌 스러운 연기만 극복한다면 소재의 흥미와 이야기의 잔잔한 전개가 즐겁게 느껴집니다. 여튼 남자주인공 얼굴이 굉장히 매력있게 생겼네요  
20170915,10,이 영화가 진짜 제목이 언젠가 이 사랑을 떠올리면 울 것 같은 그런 영화네요.... 진짜 남녀 주인공한테 너무 이입해서 오열하면서 봤습니다....  
20170914,10,ost 판매가 시급합니다..  
20170914,10,관람객굿굿짱이에요짱짱짱이에용좋아용  
20170909,9,따뜻하고 아련한 영화. 스토리도 괜찮고 남주가 엄청납니다.  
20170909,10,지네들이 연기해본던가 대사나 외울지 궁금함 아니 미와왜이렇게 욕하는거임 다 켄타로 보러온 여성관객이 많아서 질투하는거임 다들 그렇게 쉽게 말하지말고 응원해주삼 난 재밉게 봤는데  
20170909,10,이 영화는 시간은 지나가면 끝이기 때문에 그시간을 소중히 써야한다는걸 깨닫는 내용이에요 영화를 보면서 켄타로의 100번째사랑이 슬퍼서 울었네요  
20170903,10,관람객설레고 감동적인 영화! 같은 영화 다시 잘 안보는데 이건 보고 싶어요 .  
20170902,10,"막을 수 없는 신의 장난, 그것은 시간여행자.  "
20170902,8,관람객그럭저럭볼만합니다 무난했음  
20170901,10,켄타로 보는맛도 있고 아련미도 있었다  
20170829,1,여주에게서 사랑스러움이라곤 1도 느낄수없는데 로맨스가 웬말이더냐  
20170823,10,나의 로맨스를 찾아준 영화  
20170822,10,존잼... 사카구치 켄타로 얼굴이 만점....  
20170822,10,새벽에 맥주 한켄 먹으면서 보다가 가슴이 먹먹해서 미칠뻔했다 여주가참 노래를 잘한다 좀더이뻤으면 좋았겠지만 영화 자체가 너무 이쁘다 일본멜로영화답겨 색감이 따듯하다  
20170821,6,서강준과 이홍기가 있다  
20170820,8,관람객지금순간을 소중히 ..  
20170818,8,"영화 내용은 별론데 켄타 너무 잘생겼다ㅠㅠㅠ,  "
20170817,10,♥♥♥♥짱짱♥♥♥♥  
20170817,5,관람객음 그냥 켄타로 보러가는거인듯  
20170815,9,여운이있는영화였어요 여주연기가 아쉬웠지만요  
20170815,10,관람객진짜 연애하고싶게 만드는 영화  
20170815,9,울었습니다. 내용이 마냥 가볍지만은 않네요. 재밌기도 했고 여주남주가 귀엽네요 ㅎㅎ  
20170815,3,시간여행 로코물인데..여주인공이 너무 아니다.  
20170814,4,"영화를 집중하는 데 있어서 방해하는 요소가 너무 많다. 연기며, 연출이며  "
20170813,3,잘생긴 남자4명 나와서 2점여주친구 예뻐서 1점여주 발연기에 입꼬리 개 어색 그 자체노래 잘 함좀 흥미롭다가도 노잼이었다아 항상 여주발암이야 너무 싫어 싫어 싫어  
20170813,9,새드엔딩입니다후반에 잠깐 여주가 발암유발하니 주의  
20170812,9,켄타로 보려고 다운받았는데 생각보다 정말 괜찮은 영화였어요. 마지막에 아오이가 부르는 노래 나올때 너무 슬퍼서 눈물이 저절로 나더라구요.. 정말 예쁜 영화같아요.  근데 자막 넣은 사람 누군지 정말 쓰레기같이 넣었더라구요.. 그것만 빼면 정말 괜찮..  
20170812,8,풋풋해서 보기좋았음. 남자주인공보고 배우 이민기가 계속 생각났던건 나뿐이던가..?  
20170810,10,관람객캔타로 개사랑햄♡♡♡♡**  
20170809,9,관람객로맨스물은 처음 접하는데 나름 재밌게 잘봤습니다.  
20170809,9,나름대로 이영화의 아름다움이 있었다.영상미뿐만아니라 스토리와 주인공들 모두누구와보고 어떤때에보고 어디서보느냐가이 영화의 느낌을 좌지우지할 것같다는 생각도 든다.가슴이 먹먹해지고싶을 때 꼭 보길  
20170808,10,처음에는 무덤덤하게 봤었는데  후반이 되게 슬픕니다. 엄청 울었네요  
20170807,10,짝사랑하는 풋풋한 여주의 느낌이 너무 잘 나타남 애초에 연기자도 아니었는데 기대한 것 부터.. 결말 때문인지 주연들의 연기 덕분인지 여운이 크게 남음 자기 전에 생각나고 밥 먹다가 생각나고 핸드폰 하다가도 생각남 영화가 끝나고 나서까지도 울었던 영화  
20170806,9,켄타로땜에 본건데 넘슬픈데행복하기도하고 특히 켄타로 진짜 잘생겼어요 게다가OST가 넘조아여 그리구 마지막에 끝날때 생각났는데 두배로 슬펐던 점이 뭐 영화상이긴한데 히로인실격에선 켄타로가 조연이라 안됬구 이번엔 주연이라 안되구 진짜 것땜에 넘 슬펐어요ㅠ  
20170806,9,해피인줄알았어ㅠㅠ....슬펐다  
20170806,1,이영화 평점이 왜 높은가 했는데. 남자때문이구나. 별로임. 재미없음. OST는 괜찮음. 미와 노래 좋아하는데 연기가 몰입을 망침.  
20170805,10,저한테는 인생영화예요  
20170805,2,1점주고싶은데 켄타로봐서 2점준다  
20170804,6,관람객달콤한 멜로. 사카구치 켄타로는 일본의 박보검?  
20170804,10,그냥 말이 필요없다 켄타로 존잘.  
20170804,10,오랜만에 세드엔딩 영화 인데 여운이 남는다  
20170803,6,하아...여주 연기력 땜에 켄타로고 나발이고 포기했음요...  
20170802,10,관람객굿 조아연 재밌었음ㅠㅠㅠ  
20170802,2,한국 영화도 충분히 저질인데 굳이 이런걸 수입해 올 필요까지야  
20170801,7,어제 봤는데 아직까지 슬프다 눈이 팅팅부었다.  
20170731,10,이걸 왜 이제 본걸까 후반부엔 영화 보는내내 운것같다..ㅠㅠㅠㅠ  
20170731,2,여주가 너무나 짜리몽땅(150 ㅡㅡ;;)해서 도무지 도무지 몰입이 안 되었음. 아무리봐도 여주인공 친구로 나오던 그 처자(찾아보니 마노 에리나로 지명도가 휠씬 더 있는데 왜 왜!)가 이런영화 주연급이던데...  
20170730,8,"식상한 소재지만, 일본영화 특유의 감성이 잘 살려진듯....  "
20170730,10,잔잔하게 흘러가면서 슬펐던 영화  
20170730,1,여주 이진아 닮았고 여주남주 연기력 1점도 아깝다.남주얼굴보고보는맛임. 어바웃타임이랑비슷.  
20170730,5,"이 영화의 백미인 음약의  중요성을 생각하면 가수를 캐스팅한게 충분히 이해가 가지만, 여주인공으로서의 연기와 비주얼이 너무 부족하다. 비주얼은 남주와 에리나가 메꿔준다해도  연기가 정말 한숨이.. 그래도 미와의 목소리와 노래가 좋기는 하다.  "
20170729,9,나 같으면 계속 과거 반복하면서 살텐데 ㅋㅋ  
20170729,10,오늘 부로 인생영화 하나 만들었어요혼또니 아리가또 켄타로상♥♥  
20170728,7,아무기대없이보면 잘봐짐.일본영화특유의 건조하면서도 풋풋한 느낌이잘살아있고내용은 뻔하지만 스토리를 이끌어가는 각본은괜찮았는데 여주가 연기력이 부족하고심하게 귀여운척하는 연기라서 솔직히 감정이입이 힘들었다.전체적인 분위기랑 남주가 열일한 영화.  
20170727,6,관람객뭔가 애매하게 끝 난 기분 ? ..  
20170727,7,"일본 영화스러운, 잔잔한 하이틴물 남주의 연기가 시크할땐 괜 찮았는데 감정연기 할때는 조금 부족 해 조금 아쉬웠다.  "
20170725,6,여주가 영화에 몰입하지 못하게 함. 반복되는 장면이 지겨움  
20170725,10,켄타로존나잘생김ㅜㅜ 여친있다던데  
20170724,10,평소 켄타로의 팬으로 본 영화이지만 영화의 분위기를 잘 나타내는  연기와 음악은 매일 마음속에 남아있으며 제 마음속의 저장인 영화였습니다.  
20170724,8,내용은 볼만했는데 연기력이 좀...  
20170724,7,너무 달달하긴 해도 일본 로맨스특유의 맛은 갖춰. 남주는 잘생겼군. 소녀들이 흥분할 만 해.  
20170723,7,평점보고 기대했는데 사카구치켄타로 조아하지만 솔직히 별로였다 7점도 조금아까움  
20170722,10,내용도 너무재미있고 무엇보다 켄타로미모에 시선루팡  
20170721,10,여주연기좋고 켄타로잘생겼고 너무재밌고ㅠ  
20170721,10,너무재밌음 ㅜㅜ 켄타로 내사랑  
20170720,10,마지막에 울뻔했어요ㅠㅠ 보고 후회ㅎ안할영화  
20170720,10,"이야기가 유치하다고 생각은 되겠지만 스토리, 음악, 요소 등 골고루 나에게 감동을 줬다. 정말.. 몇 번이고 더 보고 싶어질 정도입니다.  "
20170719,6,배우들 얼굴 말곤 볼 것 없는 영화  
20170719,10,켄타로...♡너무재밌었고 진짜새드엔딩이여서 슬펐던 영화ㅠㅠ  
20170717,5,여주인공도 못 생겼고 내용도 유치함. 사춘기 아이들은 재미있을 수도..  
20170717,7,관람객기대 이상으로 재밌었던것 같어요~  
20170717,8,이거 왜 오열하면서 봤는지 모르겠는데 진짜 사카구치 켄타로를 위한 영화다 앓다죽을 켄타로  
20170716,1,여배우 넘 안이쁘고 연기도 못해서 몰입할 수 없었다. 보다가 자다가 깼음 결국 끝까지 보는거 포기함  
20170716,10,이걸 보고 켄타로 팬이되어버린...보면서 설레고 가슴 먹먹해지는 영화 추천합니다.  
20170716,8,여주가 좀더 이뻤으면 하는 아쉬움이 있음. 러닝타임이 살짝 긴것같고 그외엔 볼만함  
20170715,9,"남주 멋있는 영화, 여주는 연기가 살짝 아쉬웠지만 캐릭터에 맞는 배우인것같다. 자기자신보다 사랑하는 사람이 생기는건 어떤 기분일까 라는 생각을 하게된다  "
20170715,10,정말 가슴이 먹먹해지는 영화 어제 저녁에 보았지만 오늘 아침까지 여운이 남는 그런영화  
20170714,7,관람객역시 켄타로. 사실 내용은 별 기대를 안 하고 갔었는데 생각보다 내용이 괜찮아서 재미있게 보고 왔어요ㅎㅎ  
20170713,6,솔직히... 스토리나 영상이나 배경음악은 좋은 편임. 근데 남주와 여주가 연기를... 겁나 못하고 둘이 서로 사랑한다는 캐미가 느껴지지 않음. 여주는.... 어색한 목소리 표정 게다가 비주얼이...뭘 보고 여주인지 모르겠음. 여주가 넘 못생김  
20170713,8,오랜만에 영화를 보면서 잔잔히 밀려오는 감동을 느낄수있었던 작품 화려하진않지만 일본의 감성을 고스란히 느낄수 있었다.  
20170713,10,켄타로 때문에 보게된 영화였지만 정말 정말 인생영화로 남을 것 같다. 일본분위기도 느낄 수 있었고 장면 하나하나 너무 아름다웠다. 특히 노래가 스토리에 맞게 잔잔하면서 가사가 너무 예뻤다. 마음이 따뜻해지는 영화였다  
20170712,10,여주인공의 환한 미소에 영화가 넘 훈훈했어요. 마지막 공연때는 그냥 마음이 막 울컥해졌네요!  
20170712,2,"일단 여자 배우분 연기가 매우 어색했던거같네요^^; 스토리 전개도 겁나 느리구요, 게다가 스토리 자체도 너무 뻔해요ㅋㅋㅋ켄타로 팬이 아닌 이상은 안보시는걸 추천해드려요  "
20170711,8,고마워요 나를 좋아해줘서  
20170711,3,여자 너무 못생겨서 이입 안되고 게다가 연기도 안돼..  
20170711,10,너무 좋았다..후후....켄타로 너무 좋아  
20170710,10,관람객켄타로 존잘.. 내용도 재밌다용  
20170710,10,와...역시 사카구치 켄타로 나오는건 다  
20170710,10,일본감성이 나오는 영화에여 다운받아서라도 꼭 보세여ㅠㅠ여주가 오글거리긴해도 연기못하는것도 아니고 얼굴 예쁜데 밑에 댓글이 아주 OOO네영 오크는 자기들같은데..열폭  
20170710,10,진짜 좋아하는 느낌의 영화였습니다. 일본풍의 로맨스적인 느낌이 있어서 뻔해보이지만 배우들의 연기로 조금 색달라져서 더 애절하게 느껴졌던 것 같습니다. 그리고 영화관보다는 비디오를 구매하거나 티비나 핸드폰 결제를 통해 집에서 보는 것을 추천드립니다.  
20170710,5,켄타로 볼려고 봤는데 흐음. . 나쁘진 않지만 좋지도 않아요. . 켄타로만 봤어요 ㅋ. .나는 ost도 별로던데 . .  
20170710,7,관람객어설펐던 부분도 많은데 괜찮은 부분도 많음 특히 엔딩.그리고  조연으로 나오는 여자 배우가 더 이쁨  
20170710,6,관람객가슴 먹먹해지긴하지만.. 음.. 뭐랄까 아쉽습니다  
20170709,10,평점을 보기전에는 발연기를 느끼지  못했고 팬이아니여도 저는 충분히 재밌게 본것같습니다  
20170708,10,사랑스럽고 슬픈이야기♥  
20170708,7,후반에서야 절정에 치닫는 슬픔. 그리고 타임리프 소재로 치열하지않으면서 아름다운 연출. 배경이 참 아름답다. 배우도.  
20170708,8,관람객남주보려면 가시는거 추천  
20170708,10,관람객재밋어 꼭봐 물론 혼자말고  
20170708,7,켄타로 진짜 ㄹㅇ 얼굴깡패ㄷㄷ 나오야씨는 첨에 이홍기인줄  
20170708,10,너무너무 어울리는 커플인것 같아요 아쉬운점은 제가 생각한것 보다 좀 이야기가 그럭저럭 해서 아쉽네요 그래도 너무 재밌고 기억에 오래 남고 싶네요 계속 보고 싶은 영화 같아요.많이 많이 사랑할게요  
20170707,10,켄타로 너무너무 진짜 잘생겼고 보는 내내 진짜 설레고 좋아요!!!!내용도 너무 좋고  3번 울었습니다ㅠㅠ 슬프기도하고 뭔가 따뜻한 느낌도 있어요  
20170707,10,인생영화 ㅠㅠ 켄타로랑 미와랑 케미가 대단합니다 ㅠㅠ 달달하고 뭉클하고 애잔한 아주 좋은 영화입니다.시간날 때 꼭 보세영  
20170707,10,리뷰를 써보는 것도 처음이지만 기대를 하고 봤음에도 기대에 져버리지 않았고 기대 이상의 영화였습니다. 웃으며 울며 봤고 감동 그 자체 였고 제 인생 영화가 되었습니다.  
20170707,3,켄타로가 잘생겼다.. 진짜 잘생겼다... 그뿐이다..  
20170707,10,관람객핵잼이에요ㅠㅠㅠ보고 완전 울음  
20170706,10,정말 영화 감동이 넘칩니다 켄타로 나오는 장면마다 감탄하면서 봤네요 그냥 사랑입니다ㅠㅠㅠ  
20170706,10,인생 로맨스 영화중 하나로 넣음  
20170705,5,"리쿠에겐 치노바지를 아오이에겐 동안마사지쿠폰을 선물해 주고 싶다는,,  "
20170705,9,지금은 영원하지 않다.  
20170704,10,관람객진짜 너무 재미있게 봣어요  
20170704,10,"너무나도 아름다운 사랑,아름다운 작품...  "
20170704,8,관람객재미씀결말잊조금아쉽긴해  
20170703,6,관람객영화에 나오는 ost가 좀더 영화를 몰입시켜주었다  
20170703,9,내용 좋고 결말고 여운남고 웃기고ㅎ연기력은 기대하지 않는 편이 좋습니다..손 위치 하나하나가 다 삐걱거리는 느낌영화만 놓고보면 최고!! 인생영화 등극  
20170703,10,켄타로 진심 잘생겻다 ...  
20170702,10,남자로서 켄타로 물론 잘생겼지만스토리 자체가 그냥 최고였어요말이 필요없네요  
20170702,2,그저 그런 감성영화라고 표현하면 맞을까요. 일본 특유의 청량미나 감성적인 대사 그리고 ost. 하지만 감동은 주지 못한 작품인 것 같아요. 굳이 흠잡을 것이라면 여배우의 연기력 하나인데 이상하게 감동도 없고 다시 보고싶은 영화는 아니네요. 아쉬워요.  
20170702,8,여주의 연기가 아쉽긴했지만 그녀가 부른 ost는 정말 좋다! 그리고 중간에 켄타로 파노라마는 팬이 만든 뮤비인줄..ㅎㅎ  
20170701,10,관람객으앙 너무 좋아요ㅠㅠ 판타지 이지만 마지막은 현실이어서 더 좋았어요  
20170701,10,진짜 좋은 영화입니다 추천 슬프지만  
20170701,5,관람객꿍뚱웅두우욷루굴우우둥넘나졸재미쓰흫흫흫흐흐흐  
20170701,6,"관람객솔직히 남주인 사카구치 켄타로 때문에 본 영화, 남주가 다 한 영화랄까? 사카구치 켄타로 팬이면 환영!! 그렇지 않다면 그닥,,  "
20170630,5,관람객뻔한 로멘스 소재였다 킬링타임으로 봐줄만 하다.  
20170630,8,뻔한스토리이지만 어느정도 볼만한 영화였음음악도 좋았고 감동적이기도했고  
20170630,5,여주가 너무연기를 못하네 와꾸가뛰어난것도 아니고ㅋ 볼만은함 그냥  
20170629,9,남주의 비주얼이 매우 훌륭했다  
20170629,7,마지막 한 10분만 봐도 될듯 너무 질질끌었음  
20170629,2,여주 연기 진짜 심각하다.  
20170629,10,관람객일본에서 개봉시 보고 너무 좋아서 한국에서 또봤습니다!!  
20170629,10,관람객켄타로가 존잘입니당 두번 보세요  
20170629,10,역시 내첫사랑을 너에게바친다 이후로 이렇게 좋은영화는처음인듯...  역시 여자의 적은 여자랫던가 십대여자들이 내놓는평은 무시하고 보시길..  참고로 여주 예쁘고 연기잘함!! 메퇘지들.. 부들부들  
20170629,5,일본은 시간관련 영화가 많은듯 ㅎ.ㅎ 음악이 좋았는데 배우의 연기가 아쉬웠음...  
20170628,8,"관람객평범한 일본 로맨스였지만, 켄타로의 비주얼과 특유의 청량감 그리고 ost 덕분에 잘 보고 나왔어요. 타임관련 된 영화 중에 가볍게 보기 좋은 영화  "
20170628,10,관람객겁나재밋어여ㅎㅎㅎㅎ  
20170628,5,연기자들 연기력이 안타깝다.... 남주와 ost가 볼만한 정도  
20170628,10,나도먹고싶다 초콜렛엘피  
20170628,10,"관람객켄타로얼귤보러 간것도 있지만 그걸떠나 내용,노래,배경음악 다 너무 좋고 슬펐음...ㅜ 켄타로 영화 더 많이 찍어줬음 좋겠다..  "
20170628,1,서강준 약간 닮은 찌질이ㅅㅋ가 구하는거포기ㅋㅋㅋ하긴 지도 여자 질렷겠지 이프온리인데 못구한 찌질남ㅋㅋㅋㅋ초콜릿레코드 주고 쳐먹지도 못하게함 매년 초콜릿레코드 준거생각하면 끔찍하네  
20170628,10,켄타로진짜...하..  
20170627,10,"사실 등장인물 보지도 않고, 일본 로맨스류 라서 조금 흥미가 생겨서 생각없이 보기 시작한 영화지만.. 시간의 소중함을 알려주는 영화였네요. 후반 부 보는 내내 울다가 갑니다. 뻔하지만.. 이런것도 좋잖아요..?  "
20170627,1,개노잼. 잘생긴 남주인공 밖에 볼 게 없는 영화.  
20170627,10,현재의 시간의 소중함을 깨닫는 영화..  
20170627,10,관람객당신거기있어줄래요와 비슷한듯하지만 더 풋풋한 느낌  
20170626,5,아니 세상에나 전 이영화가 이미 개봉을했었다는걸 한달이 지난 오늘에서야 알게됬네요 ㅜㅜㅜ 아쉽지만 집에서 봐야겠네요  
20170626,1,요즘 맨날 한국이고 일본이고 타임루프... 지겨워죽겠다. 그냥 남주팬들을 위한 영화 그 이상 그 이하도 아니다... 여주는 연기도 못하고 노래도 못하고 얼굴도 개구리상이고...  
20170626,10,관람객루이 존나 강렬해....  
20170626,10,관람객부담없이 보기에 정말 좋았던 것 같아요  
20170626,7,#타임슬립 #노력하다..결국포기 #좋은OST  
20170626,8,남자가 봐도 잘 생긴 남주가 50점. 썩 괜찮은 ost가 40점.뻔한 스토리가 -10점.  
20170626,10,관람객음악이 좋았어요.담백한 노랫말과 여주인공 목소리 그 수수한싱그러움에 반했습니다.지금은 헤어진 여자친구와 이 영화를 봤는데 주인공들의 마지막 노래가 담긴 이 영화가저한테는 그 친구와의 마지막 영화가 되었네요.오래 기억날 거 같아요.  
20170625,2,네이버에 이 영화의 주요 관람인은 10대 여성으로 분류되어 있다는 것을 잊지말자. 어바웃 타임과 일본 특유의 학교물을 섞어 놓은 영화이다.  
20170625,10,관람객켄타로 얼굴이 다 했어요  
20170625,10,누가 노잼이라고 보지말라했냐.... 시간이 안아까울정도로 취향저격이었던 영화였음. 해피엔딩이었으면 더 좋았겠지만 켄타로랑 여주 둘다 풋풋하고 예뻐서 볼맛났고ㅠㅠㅠㅠ 켄타로는 또 리즈를 갱신했다. 노래도 너무 듣기 좋았다ㅠㅠ  
20170625,2,재미와 관계없이 보는 것만으로 좋을 때가 있죠켄타로 멋쪙  
20170625,1,여주보다  친구리나. 여주 엄마가 더 이쁨...남주도 별로. 차라리 조연이 더 잘생긴듯. 내용은 어디서 본것들 붙여서 짜집기 한듯..b급티남. 평점은 한 5점이 적당한듯.  
20170625,8,정말 일본 정통판타지멜로.봐도 돈은 안아까움.  내 취향은 아오이보다 리나.  
20170625,10,"후기가 호불호 갈리길래 기대안하고 봤는데 생각보다 너무 빠져들어서 봤고 여운에 빠져 허우덕 거립니다ㅠㅠ켄타로의 여운에 빠진건가,,,잔잔하고 영상미 좋은 로맨스 일본영화 좋아해서 재밌게봤습니다! 다음에 남자친구랑 다시 보고싶네요.  "
20170625,4,켄타로 나온다길래 무조건봐야겠다 하고 봤는데 영화시작한지 5분만에 여주연기하는거보고 아 지루하겠다 딱 느낌. 켄타로 아니였으면 도중에 나갔을거임  
20170625,8,일단 보는 것을 추천! 켄타로땜에 봤는데 켄타로가 모델출신이라 그런지 연기는 별로.. 그래도 워낙 외모가 출중하여 .. 외모가 열일! 스토리는 괜찮은데 좀 지루한 감이 없지 않아있네요  
20170625,7,여주못생겨서 집중안됨..켄타로가 더이쁨  
20170624,6,여주...오크에 발연기에 호빗에다가 아...내용은좋은데 여주이빨때문에 그흔한눈물한번못흘린영화네요  
20170624,6,여주...오크에 발연기에 호빗에다가 아...내용은좋은데 여주이빨때문에 그흔한눈물한번못흘린영화네요  
20170624,10,진짜 켄타로가 최고다 최고  
20170624,10,관람객배우들 연기부터 내용 켄타로 얼굴 다 너무너무 좋았는데 영화가 하루에 한번꼴로 밖에 안해서 조금 아쉬워요ㅠㅠ 꼭 한번 봤으면 하는영화!  
20170624,10,저는 이거 이번주 금요일날 학교에서 3~4교시때 봤던 영화인데 내용이 진짜 슬펐어요...그래도 영화에 나왔던 음악은 좋았습니다!  
20170623,8,때 묻지 않은 순정이 참 이쁘다  
20170623,5,여주를 에리나로 했으면 나았을듯 미와한테서 전혀 매력을 못느끼겠다  
20170623,1,"재밌게 본 분들 계시다면 죄송합니다. 전 보통 이것저것 가리지 않고 보는 편이지만, 연기나 번역이나 스토리 자체나... 여러가지 의미로 굉장히 인상깊은 영화였어요. 이 감독의 전작이 좋았다거나 켄타로를 봐야겠다 하시는 분들은 보셔도 좋을 것 같네요.  "
20170623,9,관람객오랜만에 좟던 깨그솻하고 밁ㄴ읒 잏존영화 엿스1지다 여주인공 이 엄첟 이1ㅡ4ㅗ 쁘고 순수ㅘ게 잘 좟던 용화엿습니다 스리소 스토리라인돛샌각보3ㅏ 되게 되세 탄탄해서 좋앗어요 시간애 관련괸 영화  재미잇고 좋아요 그리고 음악도 일본풍으로 깔끔라고 재밋  
20170623,3,시간을 되돌려 반복되는 허접한 이야기  
20170623,10,처음 평점을 달아볼만큼 추천 하는 영화입니다켄타로 보고싶어서 봤는데 연기가 기대이상으로 섬세한 감정을 드러냄 기다리고 보길 정말잘했어  
20170623,7,"솔직히 유치하고 스토리도 허술하고 배우들의 연기도 부족했지만...그래도 ""편법""없이 직진으로 가는 영화라 좋았다 따뜻한 영화  "
20170623,6,켄타로 땜에 끝까지 봤다..일본 특유의 청량함은 좋은데 오글거리고 클리셰 ㅜㅜ 통통튀는척하고 여리고 연약한 여자캐릭터 지루함 매력없음  
20170622,9,진짜 가슴아파서 펑펑울었어요 ㅠ 남자사랑대단해  
20170622,10,감동적이었다ㅜㅜ 저런 사랑을 해보고싶다  
20170622,10,보기전엔 어떤 영화인지 누가 나오는지 몰랐는데 남주 대박이네요....  
20170622,10,관람객과거의시간보다 현재의시간이 더 값지다는 교훈을준 영화였습니다~~  
20170622,7,내용은 잔잔하고 좋은데 타임슬립이 레코드 라는점이 와닿지 않는다  
20170622,3,개인적으로 기대했는데 이도 저도 아닌 밍밍한영화  
20170622,6,관람객조르잼 머무설렛슴ㅂ니다  
