0,1,2
20190126,6,여자 발연기  ㅋㅋ 보다 끈건 처음이다  
20190114,10,"일본영화의 장점인 감성과 특유의 색감ㅇㅣ 돋보였고,  시간이라는 주제로 담백 담담하게 풀어냄과 동시에  정말 깊은 여운을 느까게 해주는 영화였다.. 슬픔을 억지로 쥐어짜내는 영화가  아니라서 너무 좋았다. 연기도 노래도 모두 훌륭했다.  "
20190102,10,"이제 앞으로 나아가 당신의 날들을 살아요 - 내가 사랑한 그 웃음 , 보여줘요  "
20181231,3,발연기 그 자체.. 실망이 큽니다 스토리도 너무 뻔하고  
20181229,10,리쿠와 아오이의 시간을 뛰어넘은 사랑이야기♡지하철에서 보는데 자꾸 눈물이 차올라서 난감했던...그만큼 참 감동적이고 가슴에 새겨질 영화. 애틋하고 아련한 감정이 가득했다. 여주인공의 밝고 통통튀는 매력+남주인공의 훈훈하고 츤데레 매력 콜라보레이션~♡  
20181217,10,Ost 좋고 켄타로 얼굴 열일하고..  
20181130,1,진ㄴ자 볼 게 켄타로 얼.굴. 밖에 없는 영화다  
20181129,6,"남주얼굴이 열일하는 영화, 이 여주는 가수라서 찍은거죠? 그쵸?  "
20181128,1,여주야 좋은말로할때 레코드고쳐놓고가라  
20181124,9,여주가 발연기라기 보단 설정이 그런거 같은데마지막 레코드 음악에서 울어주는게 포인트...  
20181106,2,여주 외모가 ... 친구가 더이쁘면 어카노  
20181105,9,일단 당연하게 OST가 너무 좋았고 일본의 평범한 로맨스 영화라고 생각했지만 기대 이상이였던 것 같아요 그리고 켄타로 역시 연기를 기대 이상으로 너무 잘해서 몰입도가 최고였지만 나머지 주연분들도 너무 좋았습니다 앞으로도 이런영화 많이 보고싶네요  
20181104,10,이런 영화를 주기적으로 봐줘야한다는 걸 깨닫게해준 영화였다 진심으로 눈물콧물 다쏟으면서 봄  
20181031,1,보다가 잤다. 그리고 여주는 완전히 미스캐스팅이다.  
20181022,9,"처음 보고 너무 좋아서 5번이나 본 영화.뻔한 스토리와 전개였지만, 그럼에도 불구하고 영화와 최적합한 o.s.t를 통해 감동을 만들어낸 영화. 흐르는 시간에 대한 소중함을 알려준 영화. 켄타로의 매력을 알려준 영화.  "
20181016,6,스토리는 나름 몰입해서 봤는데 여주인공이 정말 연기를 못해서 후반으로 갈수록 몰입을 방해해요ㅠㅠ 귀엽고 사랑스러운 캐릭터인데 어울리지 않아 아쉽네요..  
20181015,3,여주의 임부복과 말할수없을만큼 어색한 연기 ㅠㅠ 가 인상에 남네요 뭔가 일본특유의 감성 짜내기 .. 켄타로 얼굴은 훌륭해요..  
20181009,6,"먼가 배우들의 반응이 느리다고나 할까? 일본 특유의 감성이, 너무 드러나는 것 같다  "
20181005,1,노잼요 ㅋ에바에바진짜 노잼데스요  
20181003,2,내가 본 일본 영화중 최악!!  
20180930,10,리타를 위한 노래 가사...마음이 저려옴  
20180926,10,여주 이쁘던데 지들 얼굴은 생각도 안하고 별로라고 하네 ㅋㅋㅋ  
20180925,8,1. 일본 로멘스의 특징을 다 가지고 있다. 그게 보기 싫은 분들은 비추2. OST가 꽤 좋다. 그게 반은 먹고 들어간다3. 내용은 신선하다고 할 순 없다만 꽤 볼 만하다.4. 연기는 여주가 배우가 아니라 그런지 약간 어색하긴 하다.  
20180907,2,이영화의 여주인공이 손예진이였다면 모든순간순간 표정연기로 감정들 몇만배 끌어내지않을까하는생각하면서 봄 그리고 스토리진부함도 있지만 연출도 진부함 감정을 극적으로 표현을 못함  
20180829,10,초반에는 재미없었지만 뒤로 갈수록 흥미해지고 재밌어진 영화.  
20180827,10,정말 여운이 엄청 많이 남는 영화였다 마지막에 나오는 노래도 정말 슬프다  
20180809,10,켄타로 얼굴도 재밌지만 난 굉장히 영화 재밌게 봤는데.. 개인취향 차이인듯 이런 로맨스판타지 좋아하는 전 되게 재밌게봤어요!!  
20180808,6,너무 억지다 전개가 어색하고 여주의 연기도 어색함... 남는건 켄타로의 얼굴뿐  
20180806,10,재밌었음 켄타로 얼굴 짱  
20180801,6,색감 너무 예쁘고 노래 너무 좋았다. 근데 자막은 좀 의역이 많아서 거슬렸다. 은유적인 대사들을 간단한 한국어로 번역해버리네..  
20180725,6,"감독, 작가, 배우 등에게서 고민의 흔적을 찾을 수 없다. 타임리프라는 소재를 쓰지 않는 편이 나았을 듯.  "
20180723,8,운명이란 돌이킬 수 없는 것일까요. 마지막 페스티벌 공연 노래 듣다가 울었습니다. 가사 너무 영화랑 잘맞게 들렸네요.  
20180721,10,재밌음 남주 존잘 여주 존예  
20180720,6,어색한 연기. 이해는 하지만. 스펙의 할아버지 여친이 이렇게 잘 컸구나.  
20180718,10,"ㅠㅠ나는 너무 좋았는걸,,, 영상미도 에쁘구.  "
20180718,8,여주 남상 .인줄 키작고 근육질 줌마스탈 ㅋㅋㅋ 가수라 저 여자 섭외햇나보내요 ㅠㅠ 남주는 만찢남  
20180716,10,켄타로 얼굴이 다한 영화  
20180716,9,노래가 좋아서 몰입 더 잘되고 켄타로 웃는거 우는거 다 잘생겨서 심장아프다ㅠㅜ♥ 애틋한 사랑때문에 마음 너무 아프고 엄청 많이 울고ㅠㅜㅠㅜ 다음에 또 보고싶은 영화♡  
20180714,10,새벽에 봤는데 뻔하지만 뻔하지 않았던 일본 영화였습니다. 계속 찾아볼 것 같아요. 인생영화가 되었습니다!  
20180714,10,눈물이 멈추질 않았네요.. 제 인생 영화  
20180710,3,보다 잤습니다 죄송합니다  
20180706,10,영화관에서 못봤는데 다시 영화관에서 볼 수 있으면 좋을거 같다는 생각이 들었습니다ㅎㅎㄹ 켄타로 너무 멋있어용  
20180705,8,"평이 별로 안 좋아서 스토리를 아예 기대 안 하고 켄타로 볼 생각으로 봤는데, 일본 특유의 그 느낌 있지만 일드보면서 익숙해져서 나름 볼 만 했고  스토리가 조금 뻔하긴 해도 처음 예상과는 전혀 다르게 전개돼서 나쁘지는 않았음 한 번쯤 봐도 괜찮은 듯  "
20180705,2,여주가.. 안습.. ㅜㅜ 졸못에 하 아줌마얼굴에 몰입이 안되네  
20180704,4,좋아하는 여자를 구하기 위해 시간을 여러번 돌린다는 설정은 좋으나 그외에 볼거라곤 잘생긴 남주 원샷밖에 없는 영화..  
20180703,10,전 켄타로팬이라 아주 좋았어요  
20180703,10,켄타로의 감성 자극 영화인듯! 이 영화는  ost도 한 몫 합니다! 꼭 들어보세요!  
20180628,10,잘봤습니다.좋아요.  
20180627,8,일본 전용설정에 충실해서 조금은 식상하다는 느낌을 받긴했지만 영화 구성자체가 깔끔하고 복선도 조금씩 깔려있어서 생각하면서 볼수있었다.그리고 여주 노래 잘부른다 했더니..가수였네..!감정이입이 제대로 된다면 아마 충분히 울수있지싶다.  
20180620,10,7월 3일 내한 확정    ㅠㅠㅠ  
20180602,8,여주 연기랑 외모가 좀 아쉬웠지만 켄타로가 다 커버해줌ㅋㅋㅋ뻔한 내용이어도 재밌게 봤네요  
20180530,2,정말 켄타로 얼굴감상 영화임.. 시간을 다룬 소재는 좋았지만 시간을 돌리는 도구가 레코드 일뿐 내용은 진부 그 자 체. 다 보고나면 내가 뭘 본건가싶음;; 영상 끊겨서 뒷부분 못 봤는데 궁굼하지도 않아서 굳이 다시 보지도 않음..  
20180525,6,내용은 좋으나 연기가 살짝 어색  
20180522,8,지금의 순간도 소중히. 이별후 보기 딱좋은 영화 엉엉울면서 봤어요 ㅎㅎ  
20180521,10,자신이 좋아하는 여자를 위해 몇 백번의 사랑도 다시 하는 켄타가 너무 멋져보였습니다.아 그리고 미와의 얼평이라던가 발연기라던가 너무 심한데... 미와는 본업이 가수 아니에요..? 어쩔 수 없잖아요 ㅠㅠ 그래도 목소리가 꿀이니 좋다구요..  
20180519,8,보는 내내  여주랑 남주가  안어울려 영화몰입도를 떨어지게 만들었지만  그냥 켄타로 보는 재미로 잘~~봤어요 여주인공 캐스팅이 아니야~~  
20180519,2,"너무 캐미가 없음남주랑 여주랑 외모 갭이 커서 몰입이 안됌,,웬만하면 집중 되는데 너무,, 아주머니 같아요.여주를 여주친구로 바꿔주지 진짜..입술도 자꾸 뀨 하고 귀척하고 발연기켄타로도 연기 그닥인데 여주는 더 발연기  "
20180513,10,켄타로 너무 잘생겼다 ㅈㅅㅠ 그동안 켄타로 얼굴만 보고 연기 못봐서 안본 봤는데 연기도 좋네요! 목소리도! 전개방식이 너무 보편적이라 실망이구 여주연기도 살짜쿠리 아쉬움 하지만 재밌게 봤어요 영화보구 사카구치켄타로한테 한번 더 반함ㅠ  
20180508,9,일단 켄타로 얼굴 5점. 그리고 뻔한 스토리지만 일본 특유의 청량한 분위기가 너무 좋다. 로맨스 영화 보고싶을때 볼만함  
20180508,10,설렘 가득한 영화였습니다.  
20180506,10,감동적이고 예쁜 영화였습니다~  
20180503,8,레코드...부수지 않았어도 됐잖아....ㅠㅠ  
20180429,4,나에게 시간을 되돌리는 레코드가 있다면....영화를 보기 전으로 가고싶습니다. 가슴을 울릴정도로 나의 2시간이 소중하다는것을 깨닫게 해 준 영화입니다.  
20180418,1,너의췌장을먹고싶어보고 비슷한영화인거같아서 봤는데 OO이 재미없습니다  
20180416,10,켄타로 진짜 잘생겼다. 솔직히 켄타로 볼려고 봤는데 내용도 좋고 여주 목소리도  좋다. 노래도 일본감성인데 듣기 좋은 멜로디 인거 같음  
20180415,10,영화자체는 너무 좋았어요남주 연기도 좋고!  
20180413,10,연기가 필요한 영화는 아닌듯함.. 하지만 일본 특유의 영상미   청춘   타임리프 컨셉을 잘 살려냄 사카구치 켄타로가 아님 안 봤을 것 같음 그래도 대학시절 떠올리며 보기에도 괜찮은 킬링타임용 영화라고 생각됨 ㅋ  
20180410,10,"영화관에서 본 켄타로 비주얼은 말잇못,,, 진심 클로즈업 장면 하나하나 다시 멈추고 돌려보고 싶을지경ㅋㅋㅋ켄타로 여태 나온 필모중 비주얼 갑ㅠㅠ 여주한테 감정이입 하면서 봄,, ost도 개좋음ㅠㅠ 비주얼만으로도 만점임,,ㅠㅠ 영화관에서 또 보고픔ㅠㅠ  "
20180407,10,켄타로도 멋지고 ost도 멋지고 내용도 멋지다. 너무 슬프다ㅏ....  
20180407,10,이 영화보고 미와 팬 되었어요. 노래도 잘 하는 가수.  
20180406,10,"영화 내용 자체에 한번 감동하고, ost에 한번더 감동했습니다  "
20180401,10,켄타로와 ost로 10점 드립니다  
20180401,2,개인적으로 진짜 별로였음..너무 지루해 이런 소재의 다른 영화랑 비교됨  
20180327,8,완벽한 켄타로의 영상 화보집이네요 여주도 이쁘지만 가수인지라 노래는 잘하는데 연기는 조금 어색..그래도 켄타로자체로 개연성이고 진부함 속의 새로움이에요 ㅋㅋㅋ 무엇보다 맘에든건 영화내용과 완벽일치하는 ost와 뻔하지 않았던 결말로 여운이 남는영화예요  
20180323,5,스토리는 여성들이 좋아할 스토리인데 여주 연기가 진짜 너무 형편없고...켄타로도 진짜...걍 둘다 도찐개찐이다...걍 전형적인 연기 못하는 스타 느낌  
20180320,6,타입슬립 소재를 좋아하는데.. 많이 기대하고 봐서그런가  좀 실망했네요. 단조롭고 지루해서 며칠 나눠서 봄... 근데 마지막 ost는 좋아요!!!  
20180319,10,영화관에서 보고 여운이남았어요  
20180318,10,세상에서 본영화중에 제일감동적이다 타이타닉다음으로....순간을소중히 내옆에있는 사람을 소중히  
20180317,1,진짜 더럽게 재미없네. 켄타로때문에 끝까지 참고봄.  
20180315,10,켄타로 ㅊㅅㅊㅅ ^^7  
20180313,6," 제목 안 보고 남주 잘생겨서 봤다가 울컥했네요 ㅠㅠ 여주가 인생레코드 부쉈을 때 남주한테 인입되서 빡치고, 여주가 마지막 페스티벌 폭죽 터질 때 편법 썼냐고 농담할 때도 빡치고, 초콜릿 레코드 막판에 먹어도 된다고 할 때 빡쳤네요. 여주는 끝까지..  "
20180313,6,전개가 너무 뻔한 영화입니다. 예고편을 보지않았는데도 제목과 초반부 스토리의 진행부터 남자주인공이 시간을 돌린다는걸 알아채기 쉽습니다. 반전없이 예상대로 스토리도 흘러갔습니다.그래도 영화의 장면 장면이 다 아름다웠습니다.  
20180311,10,"진짜로 감동을 엄청 받았습니다,  "
20180311,1,평점 봐라 8.48jQuery22405374246180501971_1520701732026미쳤냐?? 차라리 OOO같은 영화 엣지 오브 투모로우를 봐라  
20180309,8,여주인공 연기력만 빼면 굳 ㅋㅋㅋ  
20180308,6,볼만한것같아요 조금 뻔함  
20180304,10,너무 재밌게 봤습니다!  
20180301,10,이 영화는 뻔-한타임루프 시나리오 중 하나지만 アイオクリ에서 토스하고 君と100回目のコイ에서 스파이크 때리는 영화라고 생각한다. 오랜만에 영화보고 팬티 갈아입습니다. 영화는 8.0 ost는10.0  
20180228,6,여주인공이 연기를 못하는건지 캐스팅  실패인건지 계속 거슬리네요  
20180228,8,"물과 같은 시간, 주워담을 수 없다. 후회하지 않게, 매 순간을... 소중히 살아가자  "
20180226,10,아주아주아주아주아주감수성있는영화  
20180224,6,다카하시 쇼코? ㅋㅋㅋ  
20180224,2,여주 개발암 진짜보는데 짜증나서 껐다켄타 얼굴보는걸로만 만족할래  
20180223,5,나에게 지금 만나러 갑니다를 뛰어넘을 타임리프 영화는 없는건가 ㅠㅠ 왜이리 슬프지가 않은거지....  
20180222,9,해피엔딩인듯 해피엔딩아닌 해피엔딩같은 새드엔딩  
20180220,10,늦게나마 봐서 다행이예요 좋은 영화  
20180219,10,리쿠는 귀신입니다. 첫장면이후로 계속 아오이의 꿈이에요. 눈치 못채신분들이 많으네요^^  
20180215,10,"진짜 순간 순간을 소중히 하자는 것, 좋아하는 사람이 있다면 당장 티내세요 여러분.. 정말 사람 가는데 순서없습니다 ㅠㅠ  "
20180215,10,최고예요 음원도 대박이네요 진짜 좋아요 ㅠㅠ  
20180214,6,허술한 짬뽕 러브스토리. 어바웃 타임같은 영화의 설정을 어설프게 집어넣음. 보면서 응? 하는 장면도 꽤 많았음. 여주 캐릭터는 나쁘지 않은데 매력이 안 느껴짐.  
20180213,10,"너무 감동적이고 진짜 인생영화되겠다,,,,ㅠ  "
20180212,10,남잔데 그냥 마지막엔 눈물이.. 당연하게 내일 또 살겠지라고 오늘을 안일하게 보내고 있는건 아닌지... 사랑하는 사람을 살리기 위해서.. 슬프네요 스토리라인 뻔하지만 그래도 보면서 충분히 호흡가능한 영화였어요  
20180211,10,별 기대를 안하고 봄일본영화는 뭔가 편하게 볼수있어서 좋음..특유의 오글거림이있어도 순수한느낌나서 좋아하는지라 여주가 연기를 못한다?고 해도 별 신경 안쓰고 본듯..난 솔직히 한국로맨스물보단 일본께 더 감정선 좋아서 펑펑 울고싶을때 꼭 찾아보게됨  
20180209,10,소중한 사람을 소중하게 한번 더 생각하게 되는 영화  
20180208,2,정말 노잼....요즘 연애세포가 죽어서 그런 것 같다...  
20180207,6,오스트와 켄타로 미모만 남은 영화.  
20180206,2,"켄타로 빼고는 볼 게 없는 영화 유행하는 요소 음악적,타임루프,로맨스 다 짬뽕시켜놓고 이도 저도 아님  "
20180202,8,"여배우연기 쫌 그랬는데 밝은성격을 잘표현한것같고,켄타로는 역시나 잘생겼다!근데 중간에 웃음소리가 쫌 부자연스러웠다.아무리 슬픈영화를 봐도 꾹참는데 너무 슬퍼서 울어버렸다.나도 모르게 몰입이 된것같았다.이제 막 사랑하는데 바로 헤어지다니..너무 슬프다ㅠ  "
20180201,9,정말 재미있어요 하지만 의역이 좀 많고 놓는사람이 돌아갈 수 있다고 했는데 어떻게 레코드를 놓아서 켄타로와 미와가 같이 돌아가는지 좀 의문이었어요 근데 그것 빼고는 너무 좋아요 여운이 가시질 않는 영화 입니다!!! ost도 좋아요~~~ 추천합니다!!!  
20180201,10,소소하게 맘편하게 감정을 느끼면서 보기 좋아따.  
20180201,9,음악이 진짜 좋았지만 여주의 오글거리는 연기를 버틸수 있을까용  
20180201,6,내용은 그냥 뻔한거 몇개 가져온듯.. 그리고 남자가 비주얼이 너무 압도적이야 ㅋㅋ  
20180201,9,20대 입니다. 정말 딱 일본인의 감성. 밴드음악 좋아하시는분들한테 추천합니다. 그리고 모두에게 '카르페디엠'  
20180131,5,너무 진부한 소재인 것 같다. 영화 소재에 걸맞게 보면서도 봤던 것 같은 데자부를 느낀 영화..  
20180128,10,허호호호허허허헣ㅎ하하핳허홓  
20180127,4,여주가 몰입을 심히 방해함 키도 너무 작고 아줌마 같아서 보는 내내 여주 캐스팅을 왜 하필 저렇게 했나 싶더라 진심 하는 행동도 답답하고 이기적임 보는 내내 화나게 만듬 하  
20180126,2,"일본 멜로 영화는 특유의 미취학 아동 느낌나는 여주 때문에  거부감 일어남..역시 영화는 프랑스, 스웨덴이 진리구나를 다시 한번 느낌  "
20180122,10,"지금 봐서 그런지 해피데스데이 비슷한 소재 였지만, 주제는 너무 달달했고... 캔타로 얼굴 밖에 안보이는 이유좀...jQuery22405097055415122657_1516598452467ㅋㅋ  "
20180119,3,유치하고 뻔한 스토리...남자주임공이 잘생기긴 했지만 내가 남자라...;;;  
20180118,10,완전 좋다!영화보기전에는 그냥 노래 따라불렀는데 영화보고난후 노래에 담긴 의미를 알고 더 영화랑 같이 좋아졌다  
20180117,8,남자주인공 너무잘생겼다....  
20180108,9,두번보니까 켄타로 대사들이 다 ~~복선이네  
20180107,7,"음악은 좋았다 여주의 아쉬운 연기,  "
20180106,10,켄타로 영상사진집...  
20180106,8,러블리 해야 하는 여주인공이 너무 아줌마 같이 생겨서 몰입 방해됨.  
20171229,7,"정확한 평점은 7점 정도 되는 것 같아요. 감수성이 예민하지 않으신 분이면 좀 재미없고, 일본식 연기에서 좀 어색함도 느껴질 것 같아요. 수작은 아닌데 켄타로 덕을 봐서 7점!  "
20171224,2,"일본판 어바웃 타임이라니, 견줄 게 따로 있지 ㅋㅋㅋ  "
20171224,10,아리가또~ 넘나 재밌다 폭풍눈물  
20171223,1,켄타로빼고 다른 배우들이 연기를 너무못해요...집중 하나도안되고 짜증남 ㅜㅠ  
20171222,6,아니 여주랑여주친구랑얼굴바꾸지 친구가훨씬이쁜데 다 여주를좋아한다는게ㅎ 현실성읎다  
20171219,9,아 뭐 재미없다고 하는 사람들도 많은데 저는 진짜 재밌게 본거같아요 동양판 어바웃타임이니 또 말할수없는 비밀이니 의미없는거 같아요 그냥 영화 그자체로 아름다운 영화였던거 같아요ㅎㅎ 꼭 한번 보면 행복해지는 영화에요 ㅎㅎㅎㅎ  
20171217,1,웬만한 로맨스 영화는 거의 다 설레여하고 웃고 울며 보는 사람임. 나라 안가리고. 근데 여주가 연기 너무 못해서 화나서 걍 영화 껐음 그냥 못하는 수준이 아니라 쓰레기 그 자체다ㅋㅋ 무시하고 켄타로 얼굴만 보려고 해도 참을 수준이 아님 토나온다 진짜  
20171212,3,이건 정말 재미없네..  
20171211,1,설마 이 정도로 재미없을 줄이야. 만화의 실사화보다 더 문제가 커 보인다.  
20171204,10,관람객101번째 사랑을 하고싶게 만드는재미  
20171203,4,나도 시간여행으로 시간을 되돌리고 싶다.  
20171127,10,하... 10분째 우는중이다...  못본사람은 꼭보세요 진짜  
20171122,7,티임리프라는 진부할수도 있는 소재지만 우리의 사랑에는 항상 바람이 되는 타임리프가 한 몫 했다. OST와 배우들의 외모가 영화속 내용을 100퍼센트로 못끌어내지 않았나  
20171118,10,관람객켄타로 존잘! 펑펑 울면서 봤어요..  
20171117,3,"타임루프...소재인데...설레임도,애틋함도...흥미로움도...안 느껴지던...특히나 여쥔공 역의 배우의 연기도...매력도...잘 모르겠다...  "
20171117,10,"나도 되돌리고 싶다 , 시간을 .. ost  너무  좋아 ,,  "
20171117,10,존잼이라구 네이버야 10자 이상적게 하지마 귀차나  
20171114,8,2016년 7월 31일 18시 10분 나에게도 의미있는 시간이었다.  
20171113,1,그래요 켄타로는 얼굴 천재에요. 휴... 매우 매우 지루한데 그나마 켄타로 얼굴보며 버텼네.. 여주 목소리 참 이쁘네여 그러나 연기는... 아 기대를 너무 했나봅니다..  
20171113,5,타임슬립 영화를 굉장히 좋아하는 사람으로서 이영화를 보자마자 떠오른 영화가 스티븐 스필버그의 타임머신이였다 사랑하는 사람을 살리기 위해 과거로 매번 돌아가 노력하고 자책하고 원망하는 일본의 감성을 잘살리는 시간을 되돌리는 레코드  
20171112,10,여주 목소리가 좀 듣기 거북함  
20171111,10,"뭔가 이렇게 영화가 끝나고도 여운이 남는 영화는 정말 드문데 1,2달 계속 여운이 남았다 마치 리쿠와 시간이 멈춘것같다랄까  "
20171111,10,"여주, 남주 다 괜찮았고 OST도 좋았습니다. 스토리도 개연성 있고요. 영화관 가서 봐도 좋았겠다 싶습니다.  "
20171111,8,"관람객언제난 일본영화는 먹먹 , 뻔한 스토리지만 뻔하기에 충분히 마음을 울리수 있었다  "
20171110,7,여주인공이  아쉽다. 주연보다 조연이 더 돋보이네...  
20171109,10,내용도 꿀잼 OST대박 켄타로 얼굴 대박  
20171108,10,진짜 첨에는 아무생각없이 보다가 뒤에서 울었다 ㅠㅠ  
20171108,6,관람객기대를 너무많이해서인지 생각보다 감동적이지않았다 슬픈장면과 요소들은 있었지만 여운이 깊게 남는 장면은 없다. 이건 개인적인 생각이지만 결말이 조금 아쉬웠다고 생각한다.  
20171105,7,여주 캐스팅이 재앙수준 몰입이 힘듬  
20171104,9,엔딩...예상은 했지만 켄타로 존나 불쌍하다..  
20171104,10,다좋은데   키차이가  너무나서   남자주인공  목이꺾일듯 ~~~^^^^  
20171101,10,OST  가 너무 좋았다..  
20171101,9,좋은 영화인데 한국 켄타로 팬들이 영화평을 망쳐놨네  
20171031,10,요번에 상영하는 너췌먹보고 보게되었습니다. 감독님 작품 괜찮네요  
20171028,8,여주 얼굴 박살이라 몰입 불가  
20171024,10,"영상미가  아름다웠던  영화,  바닷소리가 노랫소리가 아직도 기억에 남는 영화  "
20171023,6,내용은좋은데요..여주얼굴..몰입안되요...  
20171022,10,뒤늦게 봤는데 평점이 생각보다 낮고 타임슬립소재라서 뻔하지 않을까 걱정했는데 진짜 재밌고 감동적이였다  켄타로 이영화로 처음 접했는데 너무 잘생겼고 연기도 잘하고 팬된것같다 다른 영화도 찾아봐야지...여배우 연기는 제가 일어를 못해서 그런지 괜찮았음  
20171021,8,켄타로 얼굴만 재밌었다 뻔한소재에 지루한 전개 흠 시간을 달리는 소녀랑 비교했을때 시달소가 훨 재밌다  
20171020,10,넘 감동...슬퍼요 ㅠ  
20171020,8,음악과의 조화가 영화를 더 돋보이게 해주었다.가사마저 가슴에 꽂히잖아 ㅠㅠ  
20171018,7,초반에는 좀 지루한감이 없지나마 있지만 중후반으로 갈수록 전달하고자하는 내용이 잘 묻어난거같고 전체적인 그림이 아름다운 영화인거 같다. 결말이 슬프긴 하지만 그또한 아름답게 잘 풀어나간거 같아서 다보고나면 되게 마음이 차분해지는 영화인거 같다  
20171015,10,"진짜 여운 장난 아니네요. 아직도 아이오쿠리, 너와 100번째 사랑만 들으면 눈물 남  "
20171012,7,볼만은 했지만  타임리프 소재 작품들이 이미 많아서    진부한면이 없잖아 있네요       그리고 보면서   남자가 봐도 남주 존잘이라고 생각했었는데    뭔 베스트평점들이 다 그 소리 ..  
20171011,10,뻔하지만 너무 좋았다 ost와 너무 잘어울림  
20171010,9,비행기 vod로 우연히 봤는데 푹 빠져서 봤네요. 일어 모르고 자막도 영어였지만 너무 재밌게 봤어요. 남주가 유명한 사람이군요 ㅋㅋ 뻔한 내용이지만 이쁜 영상에 음악도 good!  
20171009,6,관람객스토리는..식상했지만 bgm이 너무나 좋았던..ㅎ  
20171008,9,사람의 죽음은 정말 운명으로 정해져 있는걸까  
20171008,5,여주 매력이 부족해서 아쉬웠음. 켄타로 매력어필 영화인듯 (큰 손 계속 강조하고 설렐만한 대사에 얼굴 클로즈업 등). 나 남잔데 켄타로가 고백하면 정체성 흔들릴것 같음. 아무튼 평점을 보면 알겠듯이 여성향 로맨스다.  
20171008,1,이걸 보기 전으로 시간 돌리고싶다.이 영화보라고 추천한 친구 때리고싶다.  
20171007,5,관람객헐ㅡ.ㅡ 더할말이없네여  
20171007,8,관람객생각보다 재밋었어요 볼만합니다  
20171006,1,이 영화를 가장 좋아하는 그룹은 10대 여자입니다.  
