0,1,2
20170603,2,관람객영상때문에 2점이고욤... 마지막에 그 레코드먹어도 된다는 말은 왜 넣은건지 재미도 없고 감동도 없어요 뻔한 스토리 여주 연기 너무 웃기만하네요ㅜㅜ  
20170603,5,관람객그냥 켄타로얼굴보러갓죠.ㅎ  
20170603,10,관람객매 순간을 최선을 다해^^  
20170603,5,켄타로랑 노래때문애 그나마 5점..켄타로 아니면 안볼 영화임  
20170603,9,관람객마음이 순수해지는 느낌 ㅜㅜ  
20170603,10,관람객아름다운 영화에요 다박  
20170603,8,남주 느무느무 잘생겨따..! 이별도 때로는 받아들일줄 알아야된다.. 이별을 마주하는건 어려운듯.. 그래서마지막에 남자주인공이 더 안타까워보이고 맘이 아팠다  
20170603,10,영화 보는 내내 눈과 귀가 즐거웠습니다! 꼭 보세요~  
20170603,10,관람객켄타로..?? 머시써유유ㅠ유융  
20170603,10,최근에 본 일본 영화중에서 가장 재미있었어요- 그리고 영화를 보는내내 음악이 너무 좋았어요-  
20170602,8,딱 정말 타임슬립영화네요일본 특유 영상미 좋았구요켄타로 미모가 열일했네요진짜 영화관에서 매너 좀 지켜주세요 켄타로 잘생긴건 누구나 아니까 제발~  
20170602,10,감성을 자극하고 이별이 얼마나 슬픈지 알 수 있어요  
20170602,10,ost 너무 좋았어요!음반트랙살꺼에요 켄타로 진짜 너무너무 잘생겼네요ㅜㅜ  
20170602,10,스토리도 좋고 영상미도 좋고 음악도 좋고 켄타로도 좋고 여주랑 켄타로 키차이도 바람직하고... 여운남는 영화였어요!!! 평점 보고 가서 에티켓 없는 사람들 만날까봐 무서웠는데 다행히 너무 재밌게 또 후반에는 펑펑 울고왔네요 ㅠㅠ 또 보러가고싶을정도!  
20170602,10,관람객별로 기대안하고 갔는데 켄타로 얼굴에 한번 감성쩌는 ost에 두번 일본감성에 세번 반하고 왔네요ㅠㅠ 여운쩔어ㅠ  
20170602,3,아..연기력이 ㅠㅠ 남주 얼굴이 정말 열일했네요. 여주 연기력땜에 정말이지 너무 집중 안됐어요  
20170602,1,하아 이걸 돈 주고 보다니.. 유치하고 말두 안되고. 이런 왜놈 영화보지말자  
20170602,9,관람객켄타로 얼굴만 보고있어도 행복해요 정말로.. 행복한 영화입니다  
20170602,10,관람객스토리는 좀 뻔하지만 노래 배경 좋았어요  
20170602,6,기존에 아주 많이 시도되었던 방식입니다. 다음장면이 너무 예상됩니다. 스토리는 진부 남주 외모는 훌륭. 전체적으로 주인공들 연기도 꽤나 어색했습니다. 끝나고 남는건 남주 옆모습이 서강준같았다는것뿐  
20170602,8,"켄타로 때문에 영화 알게됐고, 미와 노래때문에 영화 안 지루했음. 켄타로, 미와 아니였음...그냥 뻔한 일본 감동영화  "
20170602,8,"잔잔하면서,  악용할 수 있는 소재인데 참 아름다운 곳에만 사용하는 순수한 영화네요  "
20170602,2,"관람객배우 켄타로의 다른 영화를 보지는 못했지만, 어색한 표정, 떨어지는 연기력으로, 상활별 공감도도 떨어지고..더군다나 서강준이 생각도 나고..미와의 경우, 정은지가 생각나고.. (미와는 연기력 괜찮았음)결말도 그냥 그런, 몰입도 떨어지는 영화  "
20170602,10,켄타로 진ㄴ심 개 잘생김. 진짜 개 설렘//  
20170602,1,일본영화 수준도 낮은데 왜 보냐  
20170602,9,난 여자지만.. 여배우 참 사랑스럽네...  
20170601,9,이 영화 속 노래 국내음반 발매좀 제발요 !!!!  
20170601,5,관람객끝내 설명하길 두려워하는 영화  
20170601,8,관람객두 번 볼 정도로 음악 좋았다  
20170601,10,ㅠㅠ진짜 100번 보세요 ㅠㅠㅠ켄타로 너무 잘 생겨서 연애도 못 하겠어요 ㅠㅠㅠ영화도 너무 재밌고 스토리가 알차요!! 정말 ㅠㅠㅠ켄타로♥♥♥  
20170601,10,"켄타로만 보이는 영화꼭보세요꼭보세요!눈물,, 여운 쩔어요.,,  "
20170601,10,일단 지루한 틈이 없이 2시간 반? 엄청 잘가고 일단 켄타로 진짜 역대급 진짜 본사람들 다 팬될꺼같음 반전도있고 1월달부터 기더려서 사소한거 다보고 예고편계속보고해소 약간 지루하지않을까 했는데 진짜 재밌음 ㅠㅠ 꼭 보세요  
20170601,10,아 사카구치 켄타로는 진짜 한국 와요 팬미팅 갈게요  
20170601,10,관람객잔잔하게 볼만해요~~  
20170601,10,일본판 어바웃타임. 소재가 판타지라 결말도 판타지로 이어지나 했는데 그나마 현실적인 결말로 여운이 더 남는 영화. 켄타로랑 ost가 짱  
20170601,10,관람객정말 재미있엇다. 켄타로는 너무 잘생겻다. 그래서 부럽다  
20170601,8,관람객언젠가 켄타로군이 한국에 내한 하기를 바라며..ㅎㅎ ! 영화내용도 일본순정만화 느낌이였네요 ㅎㅎ 여주 목소리 너무 좋은거 같아요! 멜론에는 음악 안뜨려나ㅠㅠ 검색해도 없네요ㅠㅠ 켄타로팬이라면 꼭 보시길 ㅎㅎ  
20170601,10,관람객정말 켄타로 배우님의 화보집인 줄 알았어요~ 너무 멋지고 주변에 영화보고 있던 사람들 다 울고 저도 역시 울고....ㅠㅠ 오랫만에 감성에 젖었던 영화였습니다.  
20170601,9,노래도 좋고 분위기도 좋고 딱 일본스러운 나올때 기분좋은영화 아 그리고 일본어 번역은 원래 의역 많습니다 참고  
20170601,10,사실 기대 하나도 안하고 본 영화인데 정말 잘 봤어요~ 친구랑 둘이 봤는데 둘이 울고 난리났었어요ㅋㅋㅋㅋ 개인적으로는 친구랑 저랑 한 번 더 보고싶다거나 dvd나오면 산다는 얘기까지 했네요ㅎㅎㅎ 전 추천하는 영화에요!  
20170601,9,관람객재밌고 감동적이고 아름다운 영화네요.  
20170601,7,관람객저는 살짝 지루하긴 했는데 스토리도 나름 탄탄한거같고 엔딩이 제일 기억에 남네요  
20170601,10,관람객놓아주는 것에 대해 생각해볼 계기를 준 영화  
20170531,10,관람객켄타로  잘생겼어 ㅎㅎㅎ  
20170531,8,관람객연애하고 싶어지는 판타지 순정로맨스인데 일본 특유의 색깔이 잘 묻어나오는 영화라서 좋아하시는 분들깨 추천합니다. 기대하고 보지는 마세용 편한 마음으로가서 감상하시면 더 큰 감동을 받았을거 같네요~  
20170531,9,재밌네여 슬프고..!  
20170531,10,남자인데 켄타로한테 반할뻔  
20170531,8,관람객영화가 켄타로빨을 받았다... 주변커플들은 다 울던데 울 정도는 아니였고 무난하게 볼 영화였다 켄타로를 좋아한다면 보러갈만한 영화입니당  
20170531,6,여배우 연기를 너무 못하고 초중반이 너무 지루함...극장 나가고 싶었음  
20170531,10,순정만화 속에 들어갔다 나온 느낌입니다 스토리도 정말 예뻤구 음악도 너무 좋았습니다 일본풍 순정을 좋아하신다면 추천해 들고 싶습니다  
20170531,3,사전에 여자주인공의 발연기를 알고 가더라도 감당하기 힘들다. 켄타로의 얼굴만이 이 영화를 빛낸다.  
20170531,10,관람객흨흑흨ㅠㅠ진짜 인생영화ㅜ너무슬프  
20170531,10,관람객진짜 존잘러ㅠㅠ켄타로 얼굴이랑 웃음이랑 보조개들어가는게 너무설렘 켄타로보는게 재밌음  
20170531,7,와 남주 이새키 머임? 겁나게 잘생겼네 남자보고 설렌거 윤두준 이후로 첨이다...  
20170531,8,"좋았습니다. 시간 소재를 한 스토리는 평범했지만 음악이 좋았어요. 남주도 잘 생기셨고, 여주분이 딱히 연기를 못했다는 생각은 안 들더군요. 그리고 다른 분들 말씀대로 좀 많이 의역한 부분들이 중간중간 거슬렸습니다.  "
20170531,7,관람객도돌이표형식이 약간 지겨움  
20170531,10,일본에서 보고 한국에서 한 번 더 봤는데 의역이 너무 심하다.. 진짜 완전 다르게 해석해뒀네  
20170531,10,기대안하고 걍봤다가 심장폭행!!!켄타로때문에 3번봤구여100번보여주면 100번볼수있고 오에스티도좋고 그냥대존잘 너무잘생겼어진짜 이영화보고 입덕!아 오늘또보고싶다ㅠㅠ  
20170531,10,관람객저같은 영원한 사카켄과 미와에 미쳐사신다면 보세요 매우 만족  
20170531,10,관람객너무 재밋다~!~!~~!~!~!  
20170531,10,관람객계속계속 또 보고 싶은 영화  
20170530,7,일본영화 특유의 포근한 영상미+켄타로 얼굴이 다한 영화... 켄타로 얼굴천재...  
20170530,9,관람객켄타로 얼굴 진짜 대박이구요 ㅠㅠ 중간중간에 나오는 사운드트랙들 다 진짜 너무 좋아요 ㅠㅠ 전곡 다 다운받았습니다. 영화와 음악이 잘 어우러졌던것 같아요. 다만.. 의역 ㅠㅠ나 공연 하고 싶다. 너희와 함께 뭐냐구요..  
20170530,10,추천합니다 ㅜㅜ 일본 특유의 로맨스 감성을 잘 살린 영화에요ㅠ  
20170530,8,노래 좋고 번역이 조금 거슬리고 켄타로가 잘생겼네요..  
20170530,10,관람객일본풍의 배경이 아름다운 영화  
20170530,8,관람객어떤 결말인지 알면서도 그 결말을 선택하는 게 인상적이었다.  
20170530,10,주변에 롯데시네마가 없다 ㅠㅠㅠ  
20170530,10,관람객풋풋한 사랑 냄새가 나는 영화였어요~ 특히 남주 얼굴이 열일!!  
20170530,9,관람객켄타로 얼굴 열일 영화  켄타로 입덕 영화. 여자 못생겨서 반점 깎는다.나름 타임리프 소재라 그런지 뻔한 로맨스 치고 의외로 슬프게 흘러가서 잼게봄  
20170530,10,관람객켄타로의 켄타로를 위한 켄타로의 의한 영화  
20170530,9,한줄평 : 그냥 켄타로 얼굴이 대유잼.  
20170530,10,관람객켄타로의 잘생김이 너무 재미있다. 100번도 보겠어.  
20170530,1,"1점도 아깝다. 색감은 예뻤지만 이 영화에서 사랑을 느낄 수는 없었다. 사랑이라기 보다는 어린 감정의 이기심 아니었을까, 딱히 절절하지도 않았고 감동적이지도 않았다. 연기도 연출도 스토리도 어느 것 하나 빼어난 게 없는 영화.  "
20170530,8,관람객내용은 뻔한내용이지만 켄타로 얼굴이 열일합니당행동하나하나가 설렘...! 여자분들 보러가시면 심쿵해요  
20170530,10,관람객내 취향저격 영화.대박은 아니지만 소수매니아를 만들수있는 영화로 애절감성을 샘솟게한다  
20170530,10,켄타로가 아주 잘생겼음  
20170530,10,타임리프라는 소재를 일본감성으로 잘 풀어낸거같고 10점을 준 최애이유는 ost와 여주목소리가 너무 좋아서.. 타임리프를 소재로 한 스토리치고는 좀 진부한느낌이있는건 사실  
20170530,10,재밌었어요 소재가 조금흔하고 평범했을지라도 저는되게 좋았어요 약간오글거리긴했는데 너무좋았다는♥그리고ost 진짜좋았어요 제일좋았던부분이 노래나오는부분이라는ㅎㅎ♥켄타로 대존잘러스♥대부분 관객들이 시끄러웠다는분들계시던데 저는 되게 조용해서 괜찮았어요 몰입굿  
20170530,10,켄타로 얼굴 열일.. 여주  목소리 너무 예쁘고 ost 레전드  
20170529,10,정말 최고의 인생영화 내용부터 배우 그리고 노래 그 어느것 하나 빠짐없이 최고의 감동을주었음.  
20170529,2,남주여주 모두 발연기에 여주의 임부복장과 얼큰과 어설픈 노랫소리만 쟁쟁할뿐..지루한 전개로 수면유발.  
20170529,3,여주가 진짜.. 황당하게 연기 못하고 어색해요. 로맨스물이지만 전혀 감정이입안되고 너무나 유치합니다ㅠ 남자주인공 팬분들이라면 볼 만 하겠지만..오랜만에 일본 로맨스영화 기대하고 보시는분들이라면 제발 보지마시라고 네이버 평점 처음 써봅니다ㅋ  
20170529,6,영화가 잔잔하고 감성적인데 켄타로의 어린팬들이 다 망쳐놨다. 어느정도 예상은 하고 갔지만 소리지르고 사진찍고 팬미팅 수준이여서 집중이 안됬다.. 나도 켄타로 팬이지만 이 영화 청소년관람불가 해야할 것 같네요.  
20170529,7,전반적으로 100퍼 일본 전형적인 패턴의 영화! 켄타로 보고싶으신분들에겐 최적의영화 !.! 로맨스 일본영화좋아하시는분들에게도 추천  
20170529,10,조조영화로 보러가면 사람이 거의없어서 편하게 볼수있어서 너무좋았어요...아침부터 감성적이게되고 너무좋았어요  
20170529,8,진짜 그냥 켄타로에게 빠질 수 있는 영화  
20170529,3,진짜 켄타로팬이고 모델시절부터 진짜 너무 좋아해서 드라마부터 영화 하나하나 나올때마다 챙겨보곤했는데 요번 영화는 너무 기대를 많이해서 그런가 개연성없는 전개와 너무 오글거리는 대사와 말투톤 그리고 연기를..다른때보다도 더 못한거같아 조금 실망한..☆☆  
20170529,10,오늘 보고왔는데...^^너무 잘보고왔어요 켄타로 연기짱좋아요한번 더볼까해요  
20170529,8,관람객기대안하고 보면 오히려 감동하고 나오는 영화입니다! 순수한사랑이 뭔지 깨닫게해주는 영화  
20170529,9,"생각없이 보러갔던 영화에서 주목할만한 배우를 만났네요..남주 처음 카세 료 라는 일본 배우를 봤을 때와 비슷한 느낌이었어요..좋은 배우로 성장할 둣..스토리도 좋았고, 등장인물들 다 연기도 나쁘지 않고, 특히 노래들이 좋았어요.. 그런데 의역이 많음  "
20170529,10,존잼ㅇ예요 진짜 비주얼 대박  
20170529,10,관람객잼댐잼잼댐재맺매재재재맴  
20170529,2,많이 지루한 영화 너무 길게 끈 듯  
20170529,9,기대없이 봤는데 너무슬프네요 ㅠㅠ  
20170529,10,켄타로 니 다해 먹어라 핵잘생~  
20170529,1,노잼...ㅎㅎㅎ...  
20170529,8,관람객재밌습니다볼만해요~~!  
20170529,10,별 기대 안하고 봤는데 의외로 얻어걸렸다!! 노래도 좋고 재밌음  
20170529,10,여자학생들이 보면 되게 좋아할만한 영화인것같네요 ㅠㅠ 슬프고 예쁘게 봤네요 영상미도 좋고 비주얼도 훈훈해서 좋았어요 제가 딱 원하던 영화에요 !!!  
20170529,7,관람객진부한 느낌이었습니다  
20170529,10,한번 더 보고싶어요ㅠㅠㅠ 켄타로때문에 본 것도 있는데 오스트도 대박젛아여... 아이오쿠리음원좀주세요ㅠㅠ  
20170529,10,"켄타로가 다 했다 진짜.,,  "
20170529,10,관람객일상에 무뎌지고 소중함이 지루함이 되어갈 쯔음 누구에게는 그 시간이 절박한 시간이라는 걸 알게해 준 영화!  
20170528,10,진짜 켄타로 얼굴처음 나오는 순간부터 반했어요  진짜 ost 다좋앗고요 무조건 이건 봐야 됩니다. 세상에 리쿠같은 남자있으면 얼마나 좋을까요ㅜㅜ눈물  
20170528,10,누구에게나 이별이있고 그 이별을 받아들이는 과정을 일본만의 영상미와 따듯한 가사가 감정몰입에 도움이된것같아요 그리고 연기력 말이 많던데 저는 무리없이 잘봤어요 연기가 오히려 순수함을 잘 나타낸것같아서 오히려 더 슬펐고 마음에 와닿았습니다  
20170528,10,완전 조아요 ㅠ 켄타로 짱  
20170528,6,"관람객켄타로 팬이라서 보러 갔는데 영화 자체는 별로 였다. 미와 연기도..;;영화 설정 자체가 좀 무리가 있어서 그런지 리쿠가 미와 껴안을 때 진지한 장면이었는데 모두 오글그려서 영화관 전체가 웃었다...ㅋ 그냥 설레는 장면은 많았지만 쏘쏘,,  "
20170528,10,관람객꼭보세요 너무너무 여운남고 영상미도 최고에요 사카구치 켄타로는 말할것도 없이 잘생겼어요...  
20170528,10,관람객재밋게봣어요~~~~ㄹㄹ  
20170528,9,오늘 봤는대 너무 기대를 해서 그런지 저는 그냥 그랬는데친구는 펑펑 울더라구요ㅋ 초중반에는 좀 지루하고 후반에는 흥미진진하면서 재밌고 감동적이면서 슬퍼요ㅠ 그리고 OST는 진짜 인정..진짜 너무 다운받고 싶을정도로 좋습니다 노래 너무 제스타일이였어요ㅠ  
20170528,9,관람객생각보다 재밌음!!!!  
20170528,1,핵노잼 3명이서보고 2명 잠 켄타로좋아해서본건데도 노잼 진심노잼 노잼이런말로더표현해낼수없는노잼  
20170528,10,관람객이런 남사친&남친 어디없나요??사운드트랙도 너무좋아요~~~  
20170528,10,감동적일때도있고 재미있을때도있어서 너무좋았습니다또보러 가고싶네요  
20170528,5,관람객켄타로 영상 화보집. 뻔한 타임리프 영화.  
20170528,10,여자들이 보면은 후회절대 안하는 영화!  
20170528,1,억지감성 끌어올리기 바쁘고 일본로맨스는 이제 여주나 남주 좀그만죽이면 안되냐? 뻔해서 몰입도안되더라  
20170528,5,관람객뻔한 스토리. 억지로 짜내는 눈물. 여주인공의 부자연스러운 연기. 아쉬웠어요.  
20170528,2,켄타로를 좋아한다면 봐도 괜찮은 영화... 내용은 한마디로 10노잼..ㅠㅠ 켄타로+팜플렛 때문에 별 하나는 줬다...  
20170528,10,인생영화 눈물도나고 슬프고 예뻤어요 켄타로ㅠㅠㅠ또보러가야지  
20170528,10,켄타로는 사랑입니다. 영화보는 내내 켄타로만 봄. 이 영화는 최고였음.  
20170528,10,저는 완전 좋았어요! 연기 못한다는 평점 꽤 있던데 저는 연기 잘 몰라서..ㅋㅋㅋ 그냥 좋게 봤어요 마지막 부분은 진짜 너무 슬펐어요 오에스티도 좋았고.. 저는 또 보고 싶은 영화입니다!  
20170528,10,남주가 너무 잘생겨서 현실성떨어짐  
20170528,10,영화 초반에서 중반까지는 지루한데 후반쯤 가면 집중되고 너무 슬퍼요ㅠㅠ근데 재미있어요ㅜㅜ  
20170528,7,개인적으로 사카구치켄타로를 정말 좋아하고 가수 미와도 좋아해서 기대를 많이했던 영화입니다. 일단 사카구치 켄타로 잘생겼고 연기도 괜찮다 했는데 감정이입부분에서 연기력이 딱 티가 나더군요.. 좀더 연습많이 하셔야할거같아요  
20170528,8,켄타로 아니였으면 안봤을 영화..  
20170528,10,관람객와 진심 엄청 울었어요 진짜 꼭보세요 노래 엄청 좋아요  
20170528,2,남쥬가 켄타로인거요 그사람 빼고 다 별로 물론 전 남자임 ㅇㅇ 남주는 연기도 적당하고 비주얼도 적당했는데 나머지는 비주얼도 연기도 수준이하 그리고 괜히 내가 부끄러운 장면들이 많이 연출되서 마지막까지 몰입을 방해하다가 앤딩에서 잠깐 괜찮은 그런 영화  
20170528,7,여배우의 연기력이 정말 못봐줄정도 였지만 스토리가 신선하고 힐링이 되는 영화  
20170528,7,뻔한 결말의 영화.  켄타로를 보기 위해 만든 영화같은 느낌이 들었다. 중간중간 관람객들의 민폐 때문에 영화에 대한 좋은 느낌은 하나도 없었다. 아이돌 팬사인회 온 느낌. 전반부에 계속 끊기는 듯한 연출에 내 집중력이 끊겼다  
20170528,10,재밌어요!!!강추!  
20170528,10,남주 팬들을 위한 영화라는 말은 우리나라에서 켄타로 인기가 많아나오는말이다 원래 로맨스가 주인공이 반은 먹고 들거가는거 아닌가? 일본 영화를 애호가는 알겠지만 오글거리는 영화도 아닐뿐더러메시지도 잘 전달했다고 본다. 우리와 다른 문화를 이해하지 못할뿐  
20170528,9,켄타로 얼굴보러 갔다가 뜻밖에 눈물을 찔끔 흘린 영화당연한 일본영화의 억지스러운 해피엔딩이겠거니 했지만 꽤 괜찮은 영상미와 ost 다만 여주의 연기가 조금 거슬렸지만 생각보다 그렇게 어색하지도 않았다  
20170528,10,켄타로 얼굴이 존잼입니다  
20170528,10,좋네요...진짜..  
20170528,9,스토리 내용이 계속 반복이 심해서 살짝 지루한 느낌이 있었지만 노래 ost랑 켄타로 얼굴 잘생겨서 좋았음 그리고 중간중간에 설레는 장면도 있고 다만 살짝 지루했던게 단점이다  
20170528,10,관람객진짜 영화보는데 다 여자들밖에 없더라구요ㅋㅋㅋ 켄타로 얼굴 클로즈업 될 때마다 사람들 다 꺅꺅 거리고ㅋㅋㅋ 이 영화는 켄타로 얼굴을 보기 위한 영화이기도 하지만 나름 스토리 구성도 괜찮고 영상미도 좋더라구요ㅎㅎ 남친 없는 여자분들께 추천합니다!ㅋㅋ  
20170528,1,연기력 부족에 스토리하며.. 보통이런영화 평타는 쳐줄텐데 진짜 보는 내내 지루해 죽는줄알았네요.켄타로도 얼굴 빼면 볼거하나도없음.행복목욕탕이나 나의 소녀시대 생각하고 가시면 뒷통수제대로 맞습니다 ㅋㅋ 할인받고봤는데도 돈버리고 시간도 버리는 영화  
20170528,9,관람객마지막 감동만 아니였으면 켄타로만을위한 영화일뻔한하지만 여운잔잔한 밴드멜로영화  
20170528,10,사키구치 켄타로는 최고다.. 미와상도 예쁨...! 그냥 보셈  
20170528,5,관람객노래만 좋았던 영화...남주가 외모열일 한거같다.어바웃타임처럼 정렬된 영화는 아닌거 같아서 좀... 많이 아쉽다...로멘스 좋아하는 로덕으로서 제 돈주고 보기는...아까운 영화같다 내용이 기억이...잘 안나는 영화...  
20170528,10,관람객영화잼있네요~~슬프기도하고ㅠㅠ  
20170528,8,관람객오랜만에 일본 특유의 유쾌함과 밝음 덕분에 즐거운 영화  
20170528,10,관람객이 영화만큼은 꼭 혼자보고싶어서 심야영화로 봤는데 의외로 혼자보러오는사람들이 많아서 좋았고 절절했어요. 켄타로님 미모 열일하시고 최고  
20170528,10,보는 내내 울었습니다. 소중한 사람을 잃지 않기위해 발버둥치는 리쿠의 모습에 동화되어 열중해서 봤네요. 사랑하는 연인과 보면 후회하지 않을거라 생각합니다.  
20170528,5,일단 켄타로 연기 너무 못하고 스토리도 너무 진부함 진짜 일본 감성멜로 웬만한 건 다 봤는데 최악 of 최악 ㅠㅠ 좋은 건 ost뿐.. ost는 소장 각입니다  
20170528,10,인생영화라 해도될만큼 재미있게 봤고 켄타로 잘생김을 다시 한번 알게되는 영화ㅜㅜ여주 목소리 너무이쁨...계속귀에 맴도는 목소리랄까 여튼 난 좋았다 진짜.나중에 또봐야지  
20170528,9,켄타로 짱짱!! 보다가 폭풍오열 했네요 ㅠㅠ 스토리 자체는 진부했지만 결말이 예상밖이라 놀랐어요..  
20170528,10,재미있고 감동적이고 켄타로 너무 잘생겼고♥ 또 보러가고싶은 영화에요!!♥ 적극추천 후회안할영화  
20170528,9,노래가 좋고요 내용은 좀 뻔하고 아오이 연기하신분이 가수라서 그런지 노래는 참 잘했는데 연기는 참 못했어요 그리고 개연성이 좀 부족했던거 같습니다 하지만 괜찮아요 켄타로의 얼굴이 개연성입니다아아아아악!!!! 미쳤따리 오졌따리 너무 잘생겼어요  
20170528,10,솔직히 켄타로보러 간건데 내용도 너무 재밌었음 눈물 오열하다가 왔음 유치하고 진부하지만 아직은 이런게 좋다 ost음원 좀 내주세요  
20170528,10,사카구치 켄타로 봐서...  
20170527,7,관람객무난한 일본영화 그이상은아님  
20170527,10,진짜 설마했는데 내용이 색달라서 좋았고그만큼 새드지만 커버가 될만큼 감성적이엿다ㅠㅠㅠ  
20170527,10,뭔가 십대 여학생을 위한 로맨스 같아서 기대안했는데 일본 영화 답게 풍경도 아름답고 ost도 좋네요 여주남주 다 사랑스럽고 슬프기도 하고 흔한 소재이긴 하지만 나쁘진 않은 것 같습니다 켄타로 존잘  
20170527,10,관람객노래. 멜론에 언제나와여  
20170527,7,관람객켄타로때문에 설렜는데 솔직히 계속반복반복반복...아무리 스토리라쳐도...하핳  
20170527,1,개 핵노잼 여주 오글거리는연기때매 토할뻔 차라리 여주친구가 더나음 발연기들때문에 집중도안되고 차라리 나가는게 시간아끼는 개이득인거같아서 중간에 나옴ㅋㅋ  
20170527,10,진짜진짜 추천합니다ㅠㅠ!! 중간중간 나오는 노래고 좋구 스토리도 괜찮아요! 다 보고 계속 여운이 남은 영화에요.  
20170527,10,나만 미와보러간건가...끝나고 나갈때 켄타로 켄타로 거리면서 여성분들만 우루루 내려오네..싱어송라이터 미와 팬으로써 정말 만족하고 또 만족한 영화. (ost 는 말할것도없이 좋다.)  
20170527,9,켄타로를 위한 켄타로에 의한  영화. .네가 열일하는구나. . .  
20170527,1,관람객존내 재미없다....  
20170527,10,진짜 켄타로오빠 너무 머싰어요!!! 보는 내내 켄타로오빠보면서 행복하고 좋았어요~~~~ 완전 강추인 부분 ㅇㅈ? 행님들 ㅇㅈ?  
20170527,5,내가 켄타로 좋아해서 보러가긴 했지만 어느정도 스토리가 노잼일거라는 생각은 하고 갔음에도 불구하고 너무 지루하고 뻔한 내용이여서 처음으로 영화관에서 졸뻔했다.그 이외에는 켄타로는  잘생기고 ost도 좋았다는 점? 그점만 장점될듯. 그냥 켄타로 얼굴 짱  
20170527,10,너무 좋았어요 ㅠㅠ 포스터도 쟁여왔네요! 진정한 정신적이고 순수한 사랑이 뭔지 다시한번 되돌아 볼 수 있는 영화였어요 :-)  
