0,1,2
20171202,1,감독아 제발 추리물이라도  사람 죽이고  특히 가족 죽이고  하는건 만들지 마라.. 이런 영화 만드니까 재밌냐? 영화본 관객은 무슨죄냐? 이렇게 사람 쳐죽이는 영화보고나서  똥같은 기분 느끼라고 만드냐? 제발 깊은 산속 절에가서 정신수양후 영화만들어라  
20171202,10,짜임새 있는 구성 그리고 강하늘 김무열의 연기력에 박수를 보냅니다 끝나고 나올때 심장이 아팠어요  
20171202,10,연기 대박 강하늘 안어울릴줄알았는데 너무 잘어울렸어요 근데 마무리가 조금 미흡한게 좀 있긴 했지만 볼만 했어요!  
20171202,8,관람객중반까지는 좋았는데 후반부에는 감독의 치기가 넘쳐서 개연성이 부족하다고 생각합니다.  
20171202,3,댓글알바쩌네요 영화개연성 완전떨어지고 안풀리는 시나리오 두세개 합쳐놓은 것 같던데.. 기분도 더럽고 완전 별로였어요. 중반까지 흥미진진했는데 이후부터는 산으로 가는 영화. 마지막 엔딩도 어거지고 중간에 귀신 그냥 어이없고요. 배우 연기만 볼만 합니다  
20171202,10,관람객완전 강추 해요!!! 반전의 반전... 돈 안 아까워요.  
20171202,10,스토리에 몰입할 수 있었던 영화!!  
20171202,6,초반부 몰입감 좋습니다. 정말 예고편에서 느낀것처럼 긴장감 쩔었는데.. 파출소에서 나오면서 갑자기...용두사미이긴하지만 돈아까울정도는아닙니다.  
20171202,6,"연기는 김무열 >>> 강하늘김무열은 명불허전영화 자체는 중반까지 역대급 몰입도였으나,후반부에 떡밥 회수가 되긴 되는데 반전이 약하고,엔딩이 별로임보고 나면 찝찝한 영화  "
20171202,10,스포포함영화보다 끝나고 나오면서 포스터보고 더놀랬다 진심..  
20171202,10,오랜만에 예측안되는 영화. 심장쫄깃쫄깃하며 봤네요.반전도있고. 영화를 자주봐서 보면서 어느정도 다  예측하는데 이건예측이 안되는 영화였어요 강추!  
20171202,10,대박임... 기대안하고 봣는데 개꿀잼 돈이 안아까움  
20171202,10,관람객꿀잼영화여씀 진짜루 ㄹㅇ  
20171202,2,솔직히 서로 진실을 알고있었는데도 결말이 둘 다 그렇게 끝나기엔 좀 어거지가 아닌가 싶다관객입장에서야 당장 눈앞의 현실이지만 인물입장에선 이미 수OO 지난 일인데...  
20171202,8,관람객지루할 타이밍이 좀 없네요 좋아요. 장르도 모르고 가서 봤는데 초중반 몰입도 좋아요. 뒤로 갈수록 좀 으잉??하는 부분은 있지만 순식간에 영화끝남 12회 드라마 줄여놓은 느낌  
20171202,10,재밌습니다 심장이쫄깃쫄깃해요  
20171202,10,대규모 시사회를 안한 이유를 영화 보고 알았음. 스릴러물 좋아하는데 한국 영화 역사상 최고의 반전임.  
20171202,4,영화관련해서 무한도전에 나온사람들 영화는 노잼이네요 아수라보다 재미없네요너무 스토리가 억지입니다  
20171202,6,관람객그저그랬어요 그래도 볼만은했어요  
20171202,10,관람객정말 재밌었어요! 오랜만에 긴장을 놓을 수 없는 재밌는 영화였어요~!  
20171202,9,관람객끝까지 지루할 틈이 없음  
20171202,10,"영화 보는 내내 지루할 틈이 없었고 시간 가는줄 몰랐다.온갖 추리를 하며 본 영화였고 정말 반전에 반전. 영화가 끝나고 나니 진이 다 빠질정도. 배우들의 합이 정말 좋았고, 김무열과 강하늘의 연기는 평점 10점으로도 모자라다.  "
20171202,10,와....오늘 친구들이랑 같이 봤는데 아니 무슨 처음부터 몰입감 ㅈㄴ 잡으면서 시작하지? 심지어 김무열 연기 개지린다ㅎㄷㄷ 무엇보다 굳이 내가 가장 기억에 남는장면은 동생이 자고있는데 샤프심으로 천천히...와 그때난 긴장 ㅈㄴ개빨았음ㅎㄷㄷㄷ  
20171202,8,관람객처음에는 흥미롭고 재밌고 참신한 것 같아서 좋았는데 갈수록 예상이 되는 전개가 없지않아 있다고 생각이 들었습니더.☆ 그래도 만족하지 않는 영화는 아니였던 것 같아요!!! 한번 보시는거 추천 합니다☆! 강하늘 연기 너무 잘합니다 ㅜ 강하늘은 사랑이에여ㅜ  
20171202,3,지금 영화 막 보고 나와서 후기 씁니다..하아...중간에 감독님이 바뀐건지 시나리오 작가가 바뀐건지..중반으로 딱 넘어감과 동시에 스토리가 개똥으로 변합니다. 고퀄 영화가 넘쳐나는 시대에 신선하게 B급 영화 보시고 싶으신거면 굳이 말리지 않겠습니다.  
20171202,10,그냥 보세요 스릴러별로안좋아하는데 그런사람도 감수하고 볼만한가치가있는영화  
20171202,10,관람객반전에 반전 최고였습니다  
20171202,10,시간가는줄 모르고 봄. 볼만함.  
20171202,1,관람객감독의 공백기가 느껴지는 허름한 영화  
20171202,10,진짜 재밋게봣습니다!!! 평론가들 점수 너무짜네  
20171202,7,관람객반전을 위한 영화입니다  
20171202,10,반전의 반전을 엿볼 수 있는 영화.스릴 있는거 좋아하시는 분들은 보시는 것을 추천드립니다.  
20171202,10,"김무열과 강하늘의 연기가 다했다. 특히, 영화 후반부 김무열의 연기는 정말 어마어마하다.  "
20171202,10,강하늘 연기 너무 잘한다ㅠ 그리고 보는내내 긴장하면서봄..반전도 진짜 쩔었다 추천영화!! 강스카이사랑해요ㅠㅠ  
20171202,10,관람객기대안하고 봤는데 꿀잼이어서 돈 안아깝네요  
20171202,2,무엇을 말하고자 하는지 모르겠네요...  
20171202,10,대박영화그냥 믿고 보면됨  
20171202,2,올드함  촌스러움 어거지 ㅅㅂ 귀신나올때 소리지름 ㅜㅜ 개뜬금없어  
20171202,5,관람객그럭저럭 볼만했어요~  
20171202,10,모든것이 완벽했다.이거 뒷심받아 대박날거같음.마니 놀래고 긴장하면서 봤는데 여운도 남고..^^  
20171202,10,진짜 미치도록 재밌네요  
20171202,10,배우들연기도좋고 오랜만에 시간가는줄모르고 봤음  
20171202,10,스릴러 좋아하시면 꼭보세요ㅠㅠ전 그런거 잘 못봐서 심장 오그라드는줄ㅠㅠㅠㅠ흑..두사람 연기 짱짱..!!!  
20171202,8,중간에 깜놀해서 간떨어질뻔  
20171202,10,강하늘 김무열 연기 미쳤음 인생영호ㅓ!!!!  
20171202,10,관람객간만에 본 스릴러 중 제일 좋았습니다!!  
20171202,10,관람객혹평을받을 만큼 재미없지 않아요 잼나요 배우들도 좋구  
20171202,10,우리나라엔 쓸데없는 손가락 평론가가 너무 많은 것 같다.  
20171202,9,ㅎㅎ두배우다넘나좋앗네요  
20171202,10,관람객오랜만에 제대로 된 국산스릴러영화  
20171202,2,현실성 0 시바 이거 다 알바냐?? ㅋㅋㅋㅋ 진짜 에휴 ㅅㅂ;; 요즘 한국영화 꼬라지 졎같다 이거나 꾼이나 둘다 병#신;; 그나마 뭐라도 보고 싶다면 차라리 꾼을보시길... 뭐 병#씬은건 매한가지지만  
20171202,10,관람객기대 없이 봤는데! 오!! 개이득!장항준 감독님 영화 많이 찍어주세오  
20171202,8,강하늘+김무열 케미 좋네요 특히 김무열씨 연기 잘하시네요대존잘 승아언니 승리자!여운도 남고 스릴러물이라 좋았어요.  
20171202,1,알바. 그러지마.   진짜. 혼나  
20171202,1,반전이 심하면 막장처음 흥미진진중간 막장 오글거림끝 슬픔처음과 긑이 괜찮았던 영화  
20171202,10,진짜 영화관에서 꼭 봐야한다.놓칠세라 눈을 안감았더니 렌즈 뻑뻑해지는 영화  
20171202,10,관람객정말 박진감 넘치고 스릴 있었습니다. 반전 과 함께 너무 재미있게 봤습니다 !!! 연기력 짱 !! 스토리 짱 !!  
20171202,9,결말 전까진 미친 집중이었는데 마지막이 좀 아쉽네요  
20171202,10,여러분!!! 진짜 재밋어요!!! 저 알바아니니까 믿으시고 제발 보세요  
20171202,10,관람객반전이 너무신선했어요  
20171202,8,관람객배우 연기가 참 좋아요 ㅎㅎㅎ  
20171202,1,영화 보지마세요.. 돈아깝습니다 공포인지 스릴리인지 모르겠어요 반전도 무슨 반전도아닌게 진자 노잼영화  
20171202,10,절대 여기 평점이나 후기글 보지말고 영화보시길 추천합니다. 스포들이 남발하네요  
20171202,8,관람객배우들 연기가 정말 최고..김무열의 재발견..강하늘의 소름 돋는 연기변신..장감독님의 끝장 시나리오..사실 시나리오 내용이 너무 좋아서 저 긴장감을 끝까지 살렸으면 얼마나 멋졌을까하는 아쉬움이 계속 남는 작품!어쨌든 강추합니다.  
20171202,10,"돈이 안아까운 영화 , 반전의 반전 스릴있는 영화  "
20171202,9,관람객나름대로  구성이  잘되어있음  
20171202,10,대박.대박이라 하려했는데 10자 적으래서 채운다  
20171202,8,관람객반전의 반전이네요와우  
20171202,7,관람객그냥 볼만 합니다 너무 기대는 하지 마세여  
20171202,10,최곱니다. 뻔하지않고 지루하지도읺게 재밌게 봤습니다. 반전 오지고 소재도 신선하네요  
20171202,8,"김무열,강하늘 연기 최고.. 문성근 아저씨도 무서웠어요. 마지막 김무열이 본인 밝히는 대사가 좀 투머치 였으나 전반적으로 재밌었어요. 감독님 예전에 티비에서 엄청 귀여우셨는데 이런 섬뜩한 스릴러 만드셨다니 깜놀이에요! 무대인사때 귀여우심 ㅋ  "
20171202,9,강하늘은 계속 소리지르지 말라는데 어찌 안지를수있어요ㅠ 초반부터 께엑!! 소리지르다 나옴 ㅠㅠ 무섭 ㅠ  
20171202,10,돈이 하나도 안아까운 영화네요  
20171202,9,스토리연기영상떡밥 모든게 조화롭게 잘 어울렸다 마지막 장면역시 뭔가 슬프지만 소름돋는 장면이였다  
20171202,8,관람객좋아하는  장르라서 너무기대를 많이했나?2%부족한듯하지만 ...마지막에 김무열이 죽은건  좀 ...암튼긴장하면서 잘 밨어요^-^  
20171202,10,재밌었습니다 근데 의문이 아들이 아버지가 보험을 탔다는 사실을 최근에 안 겁니까 아니면 강하늘을  찾기 전부터 안 겁니까?  
20171202,9,관람객스토리짱 재밌게 봤어요  
20171202,10,충격 반전! 강하늘 연기 최고!  
20171202,10,영화평점 처음 매겨봅니다 올해본 영화중 가장재밌었음  
20171202,1,알바에 돈 써서 평점 올릴 생각부터 하지 말고 영화를 잘 찍어서 좋은 평점 받을 생각을 하세요 장항준 씨.. 당신도 적폐 확정입니다.  
20171202,10,다시 보고 싶은 영화입니다.스토리가 반전의 반전을 주면서 기발한 소재로 심장을 쫄깃하게 또 아리게 하는 외화보다 훨씬 훌륭한 작품입니다.  
20171202,10,와 진짜 조연까지 반전있는 영화..ㄷ;;;  
20171202,9,관람객재미있네요 배우들도 연기잘하고  
20171202,10,진짜 이거 꼭봐라..꿀잼이다..10점으로 부족하다  
20171202,7,"전혀 다른 영화 두개를 이어서 본 느낌. 몰입감, 연기력은 최고지만 어디서 본 듯한 전개에 그저 쓴웃음만. 가면산장살인사건이랑 7년의 밤을 합쳐 놓은 것 같네  "
20171202,8,관람객볼만했어요 김무열 연기굿  
20171202,9,시간가는줄 모르고봤어요. 스릴넘치고.강하늘 진짜 청년경찰에서도 그렇고 여기서도 무지하게 뛰네요~~열일하는 배우 강하늘~~  
20171202,10,흥미로운 이야기를 지루하지않게 풀어낸영화였음. 끝까지 긴장하고 본 영화 마지막까지 짜임새있었던 ㅎㅎ  
20171202,10,관람객존잼입니다 리얼입니다  
20171202,10,관람객그냥 너무재밋네옄ㅋㅋ또ㅡ보고싶습니댜  
20171202,1,평점이 너무 높다.. 8점짜리 영화는 아닌듯..처음엔 진짜 재밌었는데 중반 넘어가면서 지루하기 시작. 차라리 그 작은 방에 다른 반전이 있었으면 더 재밌었을것같음  
20171202,7,연기력이 쩔어요!  스토리는 약간억지ㅠ  
20171202,1,진짜 보지마세요 제발.막장에 막장에 막장이에요강하늘이 왜 이 작품을 선택했는지 의문..초반 20분까지는 긴장감 넘치는데그 이후론 .. (말잇못) 암튼 보지마세요평점이 왜 8점인지 이해할 수가 없네여  
20171202,10,"반전에 반전, 최고! 끝까지 긴장을 늦출 수 없었음  "
20171202,7,비극과 비극 처음부터 끝까지 몰입이 좋았어요  
20171202,10,심장 약하신분들 비추마눌 심장마비 ㅅㅁ한줄 알았삼  
20171202,6,관람객후반부가 지루했어요!!!!  
20171202,6,"공포나스릴러장면이 그냥교과서 수준, ...후반부에 뜬금없는저개  "
20171202,10,연기 내용 훌륭하지만..정신건강 안좋아요ㅠㅠ 머리아프다  
20171202,9,재미나요 글구 좀 슬퍼요  
20171202,9,"장항준감독, 한 건 할 줄 알았다.김무열, 강하늘 애정함. 엄마인 나는 안아주고 싶었다.ㅜㅜ잘 봤습니다.  "
20171202,10,보는 내내 스릴감 대박ㅎ 공포감도 느끼면서 보는내내 지루하지않음 반전의 반전 완전 강추!!  
20171202,10,"정말 한번도 눈안떼고봄 연기력도 최고 스토리도몰입감쩌는.,!!!  "
20171202,8,재밋네요 볼만해요 10자  
20171202,10,대박~~~~잘만든 영화에요^^  
20171202,10,관람객짱입니다요~~~!!  
20171202,10,관람객와 무쟈게 놀랬습니다 ㅠㅠㅠ 굳굳  
20171202,2,중간까진 몰입하며 봤는데 그후로 영화가 산으로 가네요 억지로 끼어맞춤..여기 점수높은사람들 중간후로 잤어요??  
20171202,7,기대가 너무 컸나봉가..  
20171202,10,배우분들 연기도 좋았고 계속 긴장하면서 봤어요! 재밌었습니다  
20171202,9,강하늘 연기 너무 좋았음  
20171202,10,관람객끝날때까지 너무 재밌게 봤어요~~  
20171202,9,초6 아들이랑 봤는데 아들이 엔딩후 폭풍오열해서 난감했네요.  저는 적폐 오픈월드 시절을 욛했고  절박함에 빠진 상황에서 과연 '나'는 어떤 선택을 했을까 이입함. 살인의 정당성 용납안되지만 그 상황이 관객들에 던지는 감독의 의도를 느꼈음.연기력 굳!  
20171202,8,긴장감 있음.. 강하늘 좋아하진 않았는데 보면 볼수록 연기 잘하는 배우라는 생각..  
20171202,9,몰입도 짱이에요 추천합니다 ㅋㅋ  
20171202,8,관람객잘봤습니다 연기가 소름돋았어요  
20171202,10,진짜 꿀잼  김무열 강하늘 연기 진짜 잘한다  
20171202,10,진짜 이거보고나서 배우하고싶단생각이 드네요  
20171202,3,관람객노잼이에여 뻔한 반전시나리오  
20171202,6,반전이 그렇게 좋았나. 스토리도 내팽개쳐 버릴 만큼...  
20171202,10,기대안하고 무슨영화인줄도 모르고 봤는데 와 진짜 대박 깜놀  
20171202,7,관람객배우들의연기가 볼때마다 소름돋았고 생각 햌ㅅ더  
20171202,10,와 이거 미쳤어요.... 영화 몰입쩔어요 ㅠㅠ또 볼 예정입니다  
20171202,10,지금 막보았는데 계속 긴장하게되고 궁금해지는 ㅎ마지막까지 ㅎ 잼나요 ㅎ  
20171202,6,"개연성이 부족하고, 쓸데없는 장면이 많으며, 내용이 넘 오락가락.. 지루했음!  "
20171202,9,관람객을 빨아들이고 한시도 놓칠수없는 리얼빈전영화  
20171202,10,관람객스릴러 무서워서 잘 못조는데 배우 연기력독분애 그래도 꾹꾹참으면서 끝까지 봤어요!!ㅠㅠ 너무너무 추천함니다  
20171202,9,관람객잘 쓰여진 시놉과 잘만들어진 영화 .. 조금 억지스러운 전개도 있지만 이정도면 만족스러운 영화 9점이면 딱좋을 듯  
20171202,9,흥미진진하고 존잼!!! 연기 존잘 근데 나쁜놈 미화하는가 같음 ㅜ  
20171202,9,장항준 감독님 이번 영화는 성공적^^시간 가는줄 모르고 봤어요  
20171202,8,중반까지 완전 소름돋고 몰입도도 높았는데 그 이후에 좀 아쉬웠어요~ 하지만 극장에서 보기를 추천합니다. 박진감 넘치고 재밌었어요!!  
20171202,9,보다가 너무 몰입해서 팝콘을 남겼어요 ㄷㄷ 진짜 나름 잘 만든것 같아요  
20171202,10,어제 보고 왔는데 시간가는줄모르고 봣어요! 진짜 재밋고 특히 김무열 연기...겁나 잘해요  
20171202,10,재밋군 기대안라고봣는데..ㅋ  
20171202,10,강스카이연기최고!!!! ㅠㅠ  
20171202,10,스릴 넘친다. 간만에 본 스릴러 중 최고였다. 내내 긴장하먼서 봤다. 김무열 연기  
20171202,7,초중반부 몰입감은 쩌는데 후반부로 갈수록 너무 짜깁기하는 느낌이 들긴해요 그리고 한번 깜놀하는 장면 주의  
20171202,9,관람객기대 안했는데 재밌었습니다! 포스터가 다가 아닌 영화였습다!  
20171202,6,관람객음향감독님 칭찬합니당 신선한소재였으나 떡밥회수를못하고 뒤로갈수록 언제끝나 라는말이 나왔음  
20171202,8,관람객적당히 무섭네요.마지막은 좀 슬프네요.  
20171202,10,첨부터 끝까지 시간가는줄 모르고 봤네요 강추!!^^  
20171202,7,관람객기대한것보다는 아쉽네요  
20171202,10,진짜 역대급 반전 너무 재밌어요  
20171202,9,관람객반전의 반전의 반전이있는 생각을 많이 하게되는 영화입니다.  
20171202,8,관람객재밌어요 볼만합니다.. 반전은 좀 예측가능한..  
20171202,9,"관람객연기,시나리오 모두 좋았습니다너무 쓸데없이 놀래키는 설정만 빼면~^^  "
20171202,7,해빙 + 시간위에 집 = 기억의 밤.개인적인 생각. 좀지루함  
20171202,10,엄청 재미있었어요.소름에 소름.반전에 반전.취향저격 당했어요.  
20171202,1,별여러개단사람-누구냐  
20171202,9,"오래만에 스릴러 다운 스릴러 봤어요, 넘 기대하고 가서 실망 할가 걱정했는데, 진짜 잼있게 봤네요  "
20171202,1,총체적난국 10자10자  
20171202,3,보면 볼수록 뭔가 싶은 영화  
20171202,9,관람객그냥 그래요재미없어보지마셈  
20171202,10,몰입감 최고~  잠시도 틈을 주지 않고 몰아붙이는 전개와 반전 또 반전 올해본 영화중 제일 재밌음  
20171202,9,김무열 강하늘 연기 정말. 물익었네..김무열 마지막 연기는 오래기억남을 장면  
20171202,1,관람객ㄴ잼너무재미가업머요  
20171202,8,아놔~ 귀신은 뭔데.깜짝놀래라  
20171202,1,말이 필요 없는 영화 피로감만 쌓인다  
20171202,10,오랜만에완전몰입해서봤습니다~첨부터심장쫄깃하게..첨부터..몰입감최고네요!!  
20171202,10, 나도 모르게 어느 순간 강하늘 김무열 역할에 감정이입이 되었어요. 그만큼 연기를 잘하심...  
20171202,8,모든것은 imf때문이었다  
20171202,6,초반부에 비해 후반부가 약하다볼만하다  
20171202,5,딱 경찰서까지만.. 거기서 끝냈어야됐는데  
20171202,10,긴장감도있고 대박 재밌다 꼭 보셈 지루하지 않고 시간뚝딱  
20171202,6,관람객몰입감이  좋아요. 결말이  슬프지만 재밌네요  
20171202,9,관람객대박어ㅏㄴ전졸잼 짱짱  
20171202,8,관람객배우들 연기 짱이네요재밌게 잘봤습니다  
20171202,8,관람객킬링타임용 1프로아쉬움  
20171202,10,개꿀잼이다 강하늘 잘생김 김무열 잘생김  
20171202,10,강하늘도 멋있지만 김무열 진짜 대박  
20171202,8,재미있고 연기력 엄청남..근데 보면우울해짐.  
20171202,9,관람객재밋엇어요~ 조금 무서웟긴 햇지만 볼만햇네요  
20171202,9,재밌다..연기 굿.. 긴장긴장  
20171202,8,간만에 괜찮은 한국 스릴러를 감상해서 즐거웠습니다  
20171202,8,관람객반전의 반전 몰입하면서 볼만했습니당  
20171202,10,정말 스릴감 최고!!!  반전에반전을 느낀영화였어요~~!!!추천합니다!  
20171202,10,관람객재밌어요 몰입도 최고 ㅋ  
20171202,4,"장항준의 호들갑스러운 성격 그대로 담은 영화,,, 그리고 새롭게 발견한 그의 섬세함... (매우 설명충이었다는 점),,이번 영화 만들면서 스스로 자아도취를 심하게 하신 듯 합니다. 너무 흥분해서 여기 힌트이따! 힌트다! 힌트야! 힌트 여기여기!!  "
20171202,10,아 진짜 마지막에 운사람 저뿐인가요? 너무 슬퍼요ㅠ 아 진짜 너무 대박인 영화 연기력최고다 강하늘김무열 짱짱 ㅠㅠ♥?♥?  
20171202,7,초반은 재미있었는데 중반으로 갈수록 뭔가 부실하더니 후반에 마무리가 아쉽네요  
20171202,6,떡밥들이 억지스럽게 연결되있는 느낌을 받았음. 연기나 몰입은 최고!  
20171202,10,진짜 이건 인생영화다. 반전의 반전의 반전이 있는 영화. 모든 스토리가 처음부터 끝까지 연결되어있는 영화다. 같이 보는 친구들 마저도 모두 인생 영화라고 했을 정도로. 꼭 보길 추천한다.  
20171202,1,꾼다음으로 최악의 영화.막장드라마 수준이다.어이없는 시나리오..정말 돈아깝다.이영화를 선택한 강하늘에게 실망..  
20171202,5,스토리가 정말 별로입니다 무한상사가 더 훌륭한 작품인가같네요... 휴....  
20171202,10,와 반전.. 처음부터 끝까지 집중하면서 볼수있었고 연기는 두말할거없고 너무슬픈 스릴러네요..최고였습니다  
20171202,10,진짜 스릴러 못보는데 계속 눈 가리면서도 궁금해서 보게되고 반전 나오는순간 진짜 지금까지 본 영화중에 제일 놀랐던것같아요!!배우들도 다 연기 너무 잘하고 사람하나 소품하나도 그냥 지나가는부분이 없다는게 너무 놀라웠습니다!!  
20171202,9,관람객처음에 엄청 쫄리고 마지막에 슬펐어요  
20171202,10,긴장감이 오진듯 초중반에 ㅈㄴ 사람 궁금하게 만드는게 있어서 재밌다가 후반에 살짝 지루할뻔했는데 결말이 충격적이라 괜찮았음  
20171202,10,지루할뻔했으나 지루하지 않았던 영화  
20171202,10,거짓말안하고 재밌었음 추리하느맛으로 봄  
20171202,6,마지막 너무 짜맞추기식 ...  
20171202,10,관람객넘 쫄깃한 영화 갓무열갓하늘 짱!!! 예상했던 모든것을 반전시키는 스토리 재밌어요  
20171202,7,"나름의 긴장감을 느낄 수 있어 지루하지 않았다. 하지만 중반부에 예상하지 못했던 반전은 끝이났고, 그 이후로는 전부 예상가능한 스토리 전개였다. 또한  지나치게 강조된 복선이나, 정직한 대사, 스토리 설명을 위해 독백을 사용한 건 너무 아쉬웠다.  "
20171202,10,기대한만큼 재밌었고 연기 오졋습니다 이런영화 좋아요~  
20171202,9,반전의 반전의 반전...1 따봉 드립니다  
20171202,2,김무열 1점!! 강하늘 1점!! 총 2점!!  
20171202,10,재밌었다 진짜  계속 쫄았음 긴장감이 끝까지 갔다  
20171202,7,관람객돈아깝진않움 내용이너무많음 긴장감은 최고 책으로보면 더 재밋을거같음 ㅎ임 !!!  
20171202,10,잼씀ㅇdhふぇdhj  
20171202,10,진짜 보면서 너무 소름 돋았어요....  
20171202,8,슬픈 복수극.그리고  강하늘의 재발견  
20171202,10,형이....왜 거기서나와?  
20171202,9,예상 가능한 스토리 그래도 볼만하다  
20171202,8,우리나라 영화 치곤 재밌었음. 근데 명작영화들을 꽤뚫고있는사람들이라면 그다지 흥미롭지않은 스토리였을듯. 근데 배우들 연기력은 너무너무 흠잡을곳이 없더라  
20171202,10,졸잼혼자보면 안될듯 생각보다 무섭  
20171202,6,어제실제로봄 극장소리가너무커 귀막고봄 무의미하게 깜짝깜짝놀래키는데 초반30분은 연기력에 몰입했으나 후반부에 너무지루하고 개연성없는 스토리ㅜ 무한도전에나왔던스릴러 소리만계속나옴  
20171202,9,장항준 능력치...기대이상  
20171202,10,영화 진짜 잘 만들었다. 개연성 설득력이 충분하다 보니 주인공들의 행동이 다 이해가 됐음. 강하늘 김무열 둘다 찢어지게불쌍함. 근데 여자 귀신은 쌩뚱맞게 왜 등장한거지?  
20171202,10,최근들어 본 국내영화중 스토리가 가장 탄탄한 영화  
20171202,8,처음 몰입감과 신선한 전개로 재밌게보았지만 전반부에비해 후반부에 조금 진부한 전개로 쫌 힘이 빠진느낌?  
20171202,9,크.. 마지막 결말까지 완벽한 영화네요! 짱짱  
20171202,6,아무리 그래도 강하늘이 영어단어 hypnotized 공부한거 나오는 떡밥은 너무하지 않았나  
20171202,9,한국영화...오!!!좋았어요  
20171202,9,스릴러인줄 알고 봤는데 공포영화구나 하고 보다가진짜 귀신나올줄은 몰랐음ㅋㅋㅋ 근데 다시 스릴러로 돌아감  
20171202,10,생각지도 못했던 반전에 충격을 머금고 웃으면서 봤습니다 꼭 보세요 꼭  
20171202,9,마지막에 아쉬운 부분 두가지는 있었지만 정말 잘만들었네 하는 말이 절로 나오는 영화. 끝난 뒤 밑도끝도 없이 게릴라처럼 흐르는 눈물과 우울감은 관객의 몫. 너무 우울하고 씁쓸해서 아픈 마음 달래려 다른 즐거운영화를 약처방 하듯 봐야할 정도 였어요.  
