0,1,2
20190129,7,결말이 아쉽다.. 정말 초반이 짱인듯 중후반 갈수록 뭐지 이 막장은 이런 느낌이 아주 조금 들었다.. 그래도 긴장감 쩔고 어느정도 여운도 남는..결말을 내가 상상해서 바꿔보고싶은..그래도 킬링타임으로 볼만하다 재밌음!!  
20190129,10,재밌습니다 정말 잼있게 봤네요 중반넘어갈수록 몰입감 상당하고 생각못한 반전에 정말 잼있게 봤어요  
20190126,6,음..괜찮은 영화였어요..초반까지는 쫄리면서 봤는데 중후반부에는 좀..뻔해져서 그 부분은 아쉽네요  
20190126,7,잘 나가다가...왠지 김 빠지는 이야기 전개...김무열이를 그 현장의 그 xx로 설정한건 오바다..  
20190125,9,간만에 제대로 된 스릴러!  
20190123,10,블루 크리스마스 노래 나올때 진짜 소름돋았다 ㅎㄷㄷ..  
20190123,6,결말이 너무 마음에 안 드네요.  
20190122,8,배우들 연기만으로도 긴장감이 절로 들어서 좋았다. 개인적으로 영화보다는 드라마 느낌이 강했음. 길게 만들어도 괜찮았을 듯.  
20190122,10,역대급으로 재밌었다 김무열 짱  
20190122,5,마누라인 시그널 김은희 작가가 전반부 쓰다말고 한켠에 쳐박아뒀던 원고를 남편인 감독이 주워다 후반부 붙여쓰고 만든거 같다. 몰입도 좋은 쫀쫀한 전반부와는 다르게 후반부는 전혀 다른사람이 만든듯 엉성하고 억지스럽고 결말도 어이없다. 반쪽짜리라 점수도 반  
20190122,2,그냥 갈거라면서 따라가지 다 죽이는 센스... 이게 왜 평점이 높지?  
20190122,1,보는 내내 고구마..정말 답답한 전개 ~ 무미건조한 남주 연기  
20190122,10,진짜 너무 명작인데 묻힌듯 해서 평점 남기고 가요.. 꼭 보세요  
20190122,10,"우와 강하늘, 김무열 연기가 어마어마합니다. 내용도 탄탄하고 심지어 액션도 좋아요~!!  "
20190120,8,"사람을 죽인 자를 탓해야 하나, 그것을 시킨 자를 탓해야 하나, 이런 OO 맞은 상황을 탓해야 하나, 그 상황을 유발시킨 재수 없는 자들을 탓해야 하나...  "
20190118,7,"강하늘은 원래 연기 잘하는거 알고 있었는데, 김무열이 원래 이렇게 연ㄱ  "
20190115,10,스토리가 뻔하지 않아서 좋았던 것 같아요몰입감도 정말 좋았고 배우분들 연기야 뭐 두말할 것도 없구요 시간가는줄 모르고 본 것 같습니다  
20190114,10,긴장감쩔어요.어설픈 영화보다 훨 나음  
20190114,10,아 무섭다 둘다 연기 짱...소름  
20190113,10,김무열 얼굴이 만점임 ㅋㅋ  
20190113,10,너무 재밌네요.. 오랜만에 재밌는 스릴러 영화 봤습니다 ㅎㅎ  
20190113,10,오랜만에 집중해서 봤네요 감사합니다  
20190112,10,재밌다 간만에 괜찮은 영화였다  
20190111,4,초중반말고 가면갈수록 넘 어거지임...  
20190111,9,연기력 좋음 김무열 검사만 알고 있었는데 너무 좋았습니다  
20190108,10,영화감독할쉨키들 개많네ㅋㅋㅋ 이정도면 스토리 괜찮은건데ㅋㅋㅋㅋ 니들이 그래 눈이 높다면 제발 니들이 한국영화 수준좀 높일수있게 감독되서 영화좀 만들어라ㅋㅋㅋ  
20190107,9,"미친 연기와 무모한 비극을 향해 가는 엄청난 줄거리, 그러나 아쉬운 친절함  "
20190106,10,김무열 ..  아름다운 나의 신부... 에서도  너무 연기를  잘하셔서  감동을 주더니  역시 여전하네요  
20190106,4,먀오가 추천해줘서 봤는데 ㅠㅠ  
20190105,2,관람객강하늘과 김무열 연기 쩐다능 ㅠㅠ 무섭드  
20190104,10,쫄렷어요ㅠㅠㅠ아 심장아파  
20190104,10,너무재밌었다기대를 안해선지 초반에 깜놀연속귀신 너무무셔워~심장쫄깃해짐후반부가 좀 느슨하고 살인의이유가 억지스럽지만 곡성이후 재미있고 탄탄한내용이라 생각한다배우분들 모두다 연기 너무잘함.강하늘이 조금좋아짐  
20190102,7,뒤로 갈수록 허술해지지만 스토리 신선하고 연기도 ㅅㅌㅊ  
20190102,9,Good Job! Well made!  
20181231,6,초중반까지 스릴러물로서 썩 괜찮았습니다. 김무열 연기 훌륭한거야 알고있었고 강하늘도 참 괜찮네요. 특히 엄마 무섭습니다. ㅎㅎ 결말이 아쉽고 스토리가 수습이 안되네요  
20181231,10, 대박 와... 엄마랑 같이 숨죽이며 봤습니다  
20181231,6,디브이디방에서 볼꺼없어서 봤는데 나름 괜춘  
20181231,7,진실이 밝혀지기 전까지는 긴장감있고 재밌었는데 진실이 밝혀진 후부터 어이없고 급허술해짐.  
20181228,10,진짜 기대안했는데 여운 쩔고 재밌어요 꼭 보세요  
20181226,10,대박 이 영화 대박인데 왜 대박이 안났을까 꼭 한번은 봐야되는 영화  
20181226,10,몰입감 쩔어요 ㅠㅠㅠ 대박 재밌어요  
20181225,10,돌았음 개꿀잼 열자아아아  
20181224,10,정말 멋졌다 반전의 연속  
20181223,8,국산작품중엔 잘만들었는데. 꼬마의 포부가 너무 장대해서 스토리의 현실성이 떨어짐...저렇게할수있다는게 0.01%는 될까 싶다  
20181223,9,연기도 좋고 각본도 좋고  
20181221,10,강하늘 ... 연기 잘봤습니다  
20181219,10,이영화 미쳤네요~ 같이 경쟁작이었던 영화가 뭐였길래 평점테러가 심한건지...?? 한국영화중에 이정도 만든거 잘 없는데~  
20181219,9,놀랍도록 몰아치는 초중반! 약빨 떨어지는 후반부.  
20181217,10,재미있다 충분히 굿굿스  
20181216,10,미스터리 스릴러물중에 손에 땀을쥐면서 시간가는줄 모르고 몰입해서 본적은 처음인거 같아요! 가히 장항준 감독님겸 각색하신 분께 이런 작품을 만들어주셔서 감사의 말씀을 드립니다.  
20181216,10,넷플릭스로 봤는데 이게 왜 138만명인지..모르겠다..넘나 수작..  
20181215,8,처음에  공포영화 인줄.. 교통사고로 인하여 악연이 되어버린 두남자의 이야기  
20181214,8,강하늘과 김무열 연기의 여운이... 길어요.1시간동안은 숨막히는 기분이었고 점점 뒤로갈수록 소름돋고 슬펐네요. 둘의 인연이 참 기구해서 더 슬펐어요.  
20181214,8,진짜 초반부 존잼이었음 와 이런영화가 다있나? 반전까지 완벽 워후 상상도 못했음 ㅋㅋㅋ 근데 결말....이랑 개연성이 쪼꼼.... 읭... ㅜㅜ 결말만 완벽했어도 진짜 대박터졌을텐데.... 스윽 묻혀버렸넹...  
20181213,9,주연배우들의 연기력ㅎㄷㄷ스토리도 신선하다 우연히 보게된 올해 탑3안에 드는영화  
20181213,10,이정도면 진짜 수작이야....눈높이를 조금만 낮춰라  
20181212,10,씹명작 진짜 겁나 참신하다 ;; 전형적인 영화들 속 한줄기의 빛  
20181211,10,지금껏 본 영화중에 제일 몰입갑 쩔고 무섭네요 ㅠ  
20181211,10,"기대이상이었다, 연기 정말 장난 아니고 앞부분 숨막히게 쫄깃하고ㅠ  "
20181211,8,뒷부분만 잘마무리했음 아쉬움 ㅠㅠ  
20181211,10,정말 재밌게 봤네요 흔하고 뻔한 다른 스릴러 영화들과는 다르게 신선했고 시간가는줄 모르고 봤던 영화  
20181209,10,너무 가슴이 먹먹해지고 우울하다. 김무열 원래 연기 잘 하는데 모르는 사람들이 많은 듯.. ㅅㅂ 졸라 우울해지네 ㅠㅠ  
20181209,6,진짜 초중반까지만 스릴넘치고 볼만하다가..  
20181209,10,스토리 대박!!! 초반에 조금 무서워요  
20181208,7,소리지르지마 발암 상황극은 뭐냐  마무리까지 조금만 다듬었으면 수작인데  
20181207,10,진짜 짱이다. 엄청 잘짜여진 플롯이다.  
20181205,8,이만하면 수작 아닌가. 평론가 나부랭이땜에 안볼뻔했에  
20181205,10,스릴과 스토리  모두 잡은영화.반전도 참신하고 창의적이라서 이감독님 차기작도 궁금해짐ㅎ보고나서여운이랑 쓸쓸함이 장난아니다ㅜㅜ  
20181204,10,평범한 소재로 긴장감을 놓지않게 만듬. 처음부터 끝까지 재밌게 봤다 리얼 스릴러  
20181204,6,진짜 딱 가족들 의심할때까진 정말 재미있었는데갈수록 산으로 가는 스토리너무 억지스러움  
20181203,10,잘 알려지지 않은 꿀잼 영화 발견!! 장항준 감독의 차기작이 기대된다 꼭 여러편 더 하시기를.. 너무 잘봤습니다. 감독님 배우분들!  
20181201,8,"주인공 꿈에서 맞은편 방 귀신으로 깜짝 놀래킬 때, 진심 심장 떨어지는 줄 알았다ㅡㅡ  "
20181130,6,신선한 반전이나 전개는 허술하다  
20181130,10,몰입감ㅋㅋㅋㅋ쩔어요  
20181130,6,"전 영화의 취지를 1도 모르겠습니다, 도대체 뭘 말하고자 영화를 만든 것인가요,,,?  "
20181129,10,OO들 해리성기억장애있는사람이 어떻게 문제를 풀어나가냐 ㅋㅋ당연이 설명이 필요하니까 복선에 넣은거지 에휴 지적충들 ㅣㅋㅋ 영화나보며 비꼴줄이나 알지 ㅋ  
20181129,9,넘나 슬프다ㅠ저렇게 끝날수밖에없는거겠지역시  
20181129,1,영화보고 네이버 평점보고 놀랐다는 사람에게 격한공감을 보냄.저정도 평점 영화는 아니라는 생각에 1점줌. 재미없단건 알고봤지만 진짜 이정도일줄이야..한국영화 스릴러는 아직도 멀었다..초반에는 스릴있더니 뒤로갈수록 갈피를 못잡는 느낌..산으로 간다 산으로  
20181129,8,"김무열은 역시 연기 잘하네강하늘도 연기 좋았다 특히  ""소리 치지마""라면서 왜 따라가서 죽여버리는지 어처구니 없었음 ㅋㅋㅋ 그 장면만 아니었으면 최고였을텐데 무슨 생각으로 그렇게 연출했을까?  "
20181129,10,어머!!  기대 이상이었어요~  생각 못했던 스토리네요  
20181128,10,왜 나 이거 지금 봣냐...  
20181128,10,이건 극장가서봐도 후회안했을영환데 무료로봐서 좀찔리네요  
20181128,3,떡밥을 회수하기 전까지만 기억될 밤  
20181128,3,초중반까진 괜찮았는데 그 이후부터 내용을 너무 꼬아서 앞뒤가 안맞는 느낌 스킵 버튼 10번은 더 누른듯 배우들의 열연만 남은 영화 개인적으로 정말 별로였음 보다보면 기분 나빠지는 오묘한 영화  
20181127,10,개연성이 조금 부족하지만 상당히 잘 만들어진 스릴러물. 반전도 예상치 못한 반전이라 재밌었음. 관객수가 더 많이 나올수 있는 작품인데 의아함.  
20181127,10,난 ㅈㄴ 재밌게 봤음 계속 봐도 재밌는 영화  
20181127,6,초반의 몰입감에 비해 중반부부터 너무 아쉬운 영화... 복수를 소재로 올드보이 느낌을 내고자 한 것 같은데 너무 산으로 간 듯.. 초반의 몰입감은 최고 였음  
20181126,8,망작인 줄 알고 봤는데 재밌다.  
20181125,10,보다가. 대박.. 또 보다가 대박. 또 보다가 대박.. 이라는 말을 몇번을 했는지 모르겠다..  
20181125,8,"좋네요. 재밌음. ,,,  "
20181124,10,역시 연기는 연기자가 해야돼. 처음씬이 연기하는 연기였다니 연기 대단  
20181124,8,재밌다.  구성도 좋다 열자이상  
20181124,9,개인차야 있겠지만서도... 아무리 안좋게 봐도 1점짜리 영화는 아니다 진짜. 1점이 하도 많아서 지나가다 남겨본다 ㅋ  
20181124,10,우와ㅡ영화가 끝날때까지 숨 죽이고 봤어요ㅋ진부한 부분도 없지않아 있었지만..   탄탄한 스토리와 연기들이 흡입력이 엄청 나네요ㅋ정말 잘 봤습니다~~~  
20181124,10,우리 나라에선 이런 영화 흥행 절대 못해 그저 깨고 부수고 육두문자가 난무하는 영화 거기다 코믹요소 +감동코드 흥행공식 아니더냐 아무리 각본 치밀하게 쓰고 배우들 연기좋아도 한계가 있더라  
20181123,10,와우 대박  ..  소름  반전의 반전  
20181122,10,하 정말 잼따 스토리도 탄탄하고 스토리도 좋고 연기도 대박 특히 막판 강하늘 고개 절래절래하면서 자기가 다 혼자 꾸민거라는건 정말 명장면중의 명장면이다  
20181122,10,다시봐도 강하늘씨 연기력 보는내내 소름돋는다  
20181121,10,이런영화가 천만이어야지 100만명대네...  
20181121,6,중간까지는 최고인데... 갈수록 영화를 끌고가는 힘이 없네 아쉬운작품  
20181120,1,쓰레기쓰레기쓰레기쓰레기쓰레기  
20181119,9,"범죄가 정당화 될 순 없지만, 두 남자의 비슷한 처지를 보다보니 참 안타까웠다. 슬픈 스릴러.  "
20181118,10,이런영화를몰랏다는게 아쉽네요 영화 잘봤어요  
20181118,9,임팩트 요소는 충분히 많았는데 그걸 군데군데 잘 살리지 못 한 것 같습니다  
20181117,7,소재가 너무 좋고 신선한데 뒷심이 부족 아쉽다 ㅜ  
20181117,9,결국 누구도 악역이 아니였네요  
20181117,10,와씨 진짜 초반엔 뭐야 이거 공포였나 싶을정도로 쫄깃 스릴대박ㅋㅋㅋ근데 전 후반도 괜찮았어요! 진짜 이영화 이제 본게 아쉬울만큼! 그리고 집에서 혼자본게 너무 아쉽네요ㅠㅠ친구들한테 추천해줘야겠어요ㅋㅋ간만에 진짜 대만족!!!  
20181116,10,몰입감 최고 강하늘 연기 최고  
20181113,9,재밋다 반전 대박 스릴러 좋아하면 추천  
20181113,10,와 씨... 반전이 몇 개야  
20181113,2,중간부터 너무 뜬금 없다. 탄탄하고 치밀한 척 하지만 개연성 떨어지는 형편 없는 스토리. 영화가 끝나고 남는 게 아무것도 없다. 여운도 감동도 없음. 강하늘 김무열 연기력이 너무 아깝다.  
20181112,10,아무 가대없이 봤다가 재대로 몰입되었네요. 열연에 박수를!  
20181111,1,존나 유치하네.. '소리지르지 마세요! 그냥 갈께요! ' 외치면서 2층따라 쫓아가서 칼로 찔러죽이는건 머임?? 걍 도망치면 되잖아. 참 나 어이가 없어서...  
20181111,9,스토리가 꽉 차서 보는 내내 즐거웠다  
20181110,10,몰입도 최고임. 시간금방 감  
20181109,10,"강하늘이 40대 분장보니 50대 분장한것 같은디,요세  40대 초반  중반는  강하늘의 노가 있는거심하지. 않음   경찰서에  문재인등장하는것과  1977년생이라거보면  너무 늙은  노안인데  "
20181108,10,보고난 후 여운이 남음.  
20181108,2,경찰서 이후로 설명충이 되버린 김무열..  
20181107,10,영화관에서 봤음 더 재밌었을것 같은데 영화관에서 못본게 후회됨 재밌게봄  
20181106,10,나의 인생영화라고 감히 말이나 할 수 있는 영화다. 영화보고 감독의 천재성을 인정하게 되었다.  
20181106,10,유튭으로 봤는데 몰입감 미침 . .  
20181105,4,"영화 초중반 연출은 정말 긴장감이 극조로 치달렸다. 하지만 극이 중반을 넘어 반전이 시작됐을 때, 특히 과거 살인을 상기하며, '소리 지르지마'를 반복해서 외치면서 따라가서 결국 죽이고 말았던 장면에서는 실소가 터져나왔다. 뒷통수 제대로 맞은 영화.  "
20181104,7,"재미있는데..!!! 근데 많은 분들 말처럼 중반부터 좀.. 너무 설명..ㅋㅋㅋ느낌이라 약간 아쉽긴했지만, 전 재밌게봤습니다  "
20181104,10,미친영화 장항준 감독님 존경합니다 ..  
20181103,10,설명을 너무 했다. 모든 떡밥은 거둬야지 느낌이라 아쉬웠지만 카메라 구도 같은 세세한 것들이 좋았음  
20181102,10,잼나게봤어요....  
20181102,10,재밋어요 스릴 있었음. 연기도 잘하고  
20181102,6,강하늘& 김무열연기가 압권 스토리는 뭔가 허술해요  
20181102,8,반전도 있고 생각보다 재밌음  
20181102,10,와..대박영화ㅜㅜ 슬프다ㅜㅜ 둘다 너무 불쌍해ㅠ  
20181101,6,떡밥은 무성한데 정작 낚여보니 강태공이 아닌 초짜  
20181101,8,"초 중 반까지의 긴장감을 보아, 충분히 조금 더 스토리를 끌수있었는데, 반전이 너무 일찍 등장했다. 후반에 지루해지는 추격씬을 삭제하고 경찰서씬부터 과거회상까지 타이트하게 갔다면 정말 수작이 되었을 영화인데... 아쉽다.  "
20181101,1,18.10.31스크린.시나리오 이제와서 또보니 흐음~ 좋아.더파이브보단 서스펙트하진 않지만..강하늘이 누군가 했더니 순수의시대의 부마녀석이군? 강한나랑 우쌰쌰~ 와우~~강한나....OO시키 신하균  
20181027,10,강하늘과 김무열의 연기도 대단하지만 무엇보다 영화의 구성과 전개가 가장 신선하고 기억에 남는 영화  
20181027,1,노답이야... 개빡쳐...  
20181027,8,뉴이에프소나타는 2001년  출시했다  
20181027,10,극장에서 못본게 후회될 정도ㅠ 집에서 세번봤어요 너무 딱 내스타일에 스릴러반전 영화임 주연배우들 연기대박이다  
20181026,5,솔직히 별다섯개짜리 영화는 아님후반에 전개 유치해지고 몰입도도 떨어짐 그리고 보고나면 기분 개더러워집니다  
20181024,7,초중반까지는 몰입도 최강이였는데 가족들 정체 밝혀지기 시작하면서 힘이 쫙빠짐김무열은 왜 죽는지 전혀 모르겠다초중반에 엄청 재미나게 봐서 7점  
20181023,4,"소재는 재미있었고,  앞쪽은 좀 타이트 했는데...뒤로 갈 수록 힘이 다해서 끼워맞추는 클리셰범벅이 된 영화  "
20181022,10,일단  보는 재미가 있다. 내 기준 제일 중요한 부분인데 이 영화는 그점에 있어서 아주 훌륭. 장항준 감독의 스토리텔링 아주 흡족.  
20181022,6,"내가 너무 영화를 많이봤나ㅠㅠ 예고편도 일체 안보고 봤는데 클리셰가 너무 뻔해서 영화 시작한지 10-20분만에 그냥 앞으로가 다 그려졌다,, 그래도 두 배우들의 OOO기력에 볼만은 했음  "
20181021,8,스토리 탄탄!연기력까지 탄탄!!^^  
20181021,10,재평가가 시급한 이시대 한국 스릴러의 명작  
20181020,10,방금 낮에 집에서 봤는데 무서워서 팔이 오그라들며 비명지른 영화는 이게 처음. 후반부로 갈수록 재밌네요. 진작 개봉했을때 영화가서 볼 걸 넘나 아쉬운 명작입니다. 근데 극장에서 봤으면 초반에 넘 무서워서 나 민폐끼쳤을듯  
20181020,10,엘비스 프레슬리의 블루 크리스마스라는 음악을 선택한건 최고였다.  
20181020,9,난 첨에 아무 정보 없이 봐서 공포물인줄알았음ㅎ 초반부도 반전이 드러나는 후반부도 나는 다 좋았다 배우들 연기도 좋고 영화스토리나 분위기도 개취 다좋았음 -1점은 설명충부분이 좀 긴거때문  
20181019,10,완성도가 높다! 강하늘 연기 너무 잘함  
20181019,7,삼수생에게 왜 저런 시련이..ㅜㅜ사수 확정이다  
20181018,10,정말 짜임새 있게 만든 영화네요. 몰입해서 넘 재밌게 봤습니다. 최고!  
20181018,8,이거왜 dvd로 출시를안하지?  
20181018,10,개재밌음... 스릴러 영화의 끝판  
20181018,6,배우들 연기는 좋은데.. 영화 초반부까진 완전 흥미로웠는데..중후반 갈수록 우연이 겹치고 겹쳐서 어거지로 짜맞춘듯 하더니만..결국 반전을 위해서였더라. 대사도 오그라들고..글구 설명이 너무 친절해서 별로.  
20181016,10,진짜 김무열에 반하고간다 심장 쫄깃  
20181015,1,진짜 OOO기 영화 개연성 1도없고 개막장에 심지어  반전이랍시고 있는 스토리도 뻔해서 신박하지도않음 이딴영화로 전달하려는 메시지가뭐죠? ㅈ같음인가  
20181014,2,진짜 이걸 본 내 시간이 너무 아깝다...솔직히 초반까지 흥미롭게 봤습니다..하지만 중후반이 이후로는 억지스러운 상황과 이해할수 없는 캐릭터들의 연기로 모두 산산조각....  
20181013,10,와...엄청 재밌는데 마지막에 내용 다 알고나니까슬프다 ㅠㅠ너무 비극 ..다 죽었네 결국..ㅠㅠㅠㅠ김무열 연기짱..ㅠㅠ 마지막에 여러감정섞인표정 너무 슬프다..  
20181013,1,변동준... 방배중학교 개양아치놈을 여기서 보네... 진짜 이놈 티비 나오면 당시 학교 폭력하고 갈취했던거 폭로한다. 그렇게 뜨지도 않겠지만...  
20181012,10,초반에 내용 전개에 있어 어설픈 연출과 스토리라고 생각했는데 끝을 보고 나니 충분히 잘해내었던 전개르 생각된다. 이 뛰어난 영화가 흥행에 실패한건 아쉬움.  
20181011,2,네이버 평점을 믿을 수 없다는 걸 체감했다.  
20181011,10,최고또 보고 싶은 영화기억에 남을 영화  
20181007,10,인생영화 인생영화 인생영화  
20181004,10,"떡밥, 잘풀었고 잘가져갔다  "
20181001,9,OOO에 본 한국영화 중 최고  
20181001,10,기억에 많이 남는 영화네요  
20180929,10,20OOO 최고의 한국영화 ㅇㅇ  
20180928,1,아놔`` 여기서 귀신이 왜 나와 ``  
20180927,8,"연출 9, 각본 7, 연기 11  "
20180926,7,배우들이 연기로 살린 대표적인 케이스~~  
20180925,2,대체 이 영화 평점이 왜 이리 높은건지...  
20180924,8,"어찌보면  다른영화이긴 한데 또 살인자의 기억법이 떠오르긴 하다,,  "
20180924,8,초반에 엄청 스릴러적이다 후반에 약간 오락영화같았지만 두배우 연기도 매우 잘하고 잼있음 요즘 찍어내는 한국영화보고 평점줘라 ㅋ  
20180923,10,초반부보다는 후반으로 갈 수록 이야기를 잘 쓴것 같다. 새로운 주제로 생각지도 못한 이야기를 이끌어 내는 각본가의 능력을 높이 산다. 그러나 초반에서 후반으로 이어질때 분량을 잘 분배를 했다면 지루함을 줄일 수 있었을 것이다. 근데 이거 망한거아니지?  
20180923,1,"용두사미의 영화다. 스토리 쓰다가 중반부터는 대충 휘갈긴게 분명함. 결말도 허무. 원래 5점 주려고 했는데, 평점이 말도 안되는 점수여서  조절용으로 1점.  "
20180923,10,"슬프게 잘 만들었어요!!! 근데 김무열이 연기를 잘하지만, 나이를 껴맞추다보니 뭔가 어색하게 만드네요 ㅠ.ㅠ  "
20180923,8,기억하기싫은 기억을 지울수있다니..  
20180915,8,"와 몰입력 대박이에요. 김무열, 강하늘 배우의 연기력도 볼 수 있었고 긴장감있고 좋았어요. 갑자기 분위기 귀신만 빼면요...  "
20180914,6,이게 뭔 내용인가 했네요...너무 억지로 내용을 짜맞추는 느낌이... 배우들 연기는 잘하네요  
20180913,9,와 몰입감 오졌다 쌔드라 아쉽네  
20180912,10,슬프다. 모두들 행복할 수 있었는데 사고와 욕심때문에.우리나라 영화에서 의사캐리터는 항상. 절박함을 이용하려 하다니.  
20180911,10,죽이내 영화 잘만들었구먼  
20180909,1,걍 어설프게 셔터 아일랜드 따라한 영화  
20180909,2,1점도 아까운데 2점이 최저라 할수없이 줌  
20180908,10,우리나라도 이런영화가. 대박  
20180906,8,재밌네요 ㅎㅎㅋㅋ강추  
20180905,10,물론 좋은 영화는 수도없이 많지만 영화 끝난 뒤 별점을 주고 이렇게 글을 적은 영화는 이영화가 처음이네요.  
20180902,4,"배우 연기 10점뜬금없는 공포영화 분위기 연출 -10점흥미로운 소재 10점말도 안 되는 엮기 -10점그러나 배우들의 연기와, 창의적인 소재는 좋았다. 배우를 잘 뽑은 게 감독의 실력이라면 실력. 그러나 삼류 영화처럼 엮어놓은 말도 안되는 전개  "
20180902,10,두 배우가 커리어에 정점을 찍는 연기를 보는 즐거움. 유려한 스토리.  
20180901,1,이 영화가 레알 8점대 영화인가?상당히 의문스럽다!  
20180830,10,넘재밌음 진짜진짜 강추  
20180830,10,와진짜대박한국영화잘안보고평점도잘안쓰는데진짜대박  
20180829,10,최고네요~! 몰입하고 봤네요 ㅋㅋ  
20180828,10,오늘 케이블티비에서 우연히 밧는데.후반부 넘 슬펏어요....눈물 나올라는거 엄마 옆에 잇어서 참느라.강하늘 김무열 둘 다 불쌍함. 그 돈의 돈이 먼지  
20180828,8,초반 흥미진진 중반 반전도 좋았는데 마무리가 아쉽네용. 볼만합니다.  
20180828,8,처음과 끝의 온도차가 크다. 덕분에 중간에 반전이 인상깊지만 후반으로 가선 암울함을 쥐어짜내려는 억지(나가다말고 조용하라며 칼빵...)도 좀 보여서 아쉬움.  
20180828,10,빗소리와 함께 본다면 더 최고. 스토리 연출 연기 bgm 까지 모두가 완벽  
20180828,10,한국스릴러잘안보는데우연히봤어요 스토리도잼있구연기들도다들감탄요  
20180828,10,OOO기력. 오져떠요  
20180828,10,이런게 진짜 영화지. 몰입감 대박. 마지막은 마음 아프다. . .  
20180828,10,존잼 여운이 많이 남았어용  
20180828,10,스토리도 괜찮고 이렇게 몰입도 높은 영화는 정말 오랜만에 본다 그리고 강하늘도 강하늘이지만 김무열 연기가 진짜 감탄스럽다 김무열의 재발견!  
20180828,10,대박이다...기대안했는데 소름  
20180828,10,반전대박잘만들었다.  
20180828,10,여러번 봐도 질리지 않고 신선한 영화  
20180828,10,굳굳짱이다 졸잼띠ㅎㅎ  
20180828,8,그럭저럭 볼만한 스릴러  
20180828,10,빠져들어 봤다. 김무열도 강하늘도 과연 배우로구나  
20180827,10,몰입력 진짜 최고인것 같아요.결국 살인의 동기는 전부 사랑하는 사람 이었네요형을 위해서 자식을 위해서 행복해져선 안되는 결말인것 같아요  
