0,1,2
20171208,5,"꼬일대로 꼬인 기존의 스릴러와는 다르게 생각을 이리저리 안해도 되는 영화여서 좋았다.하지만, 심장을 쪼일만큼의 내용이 없었던 것 같다.너무 무난 했던 것 같은 느낌!하지만 배우들의 연기는 건들 수 없을 만큼 냉탕과 온탕을 잘 뛰어 다녔다.  "
20171208,7,관람객나름정말괜찮았던거같아요  
20171208,10,강하늘의 연기가 돋보이는 스릴러  
20171208,10,반전대박 ! 연기력 Good !  
20171208,10,극전개와 배우분들 연기가 매력적 이네요^^  
20171208,9,연기력이 너무 좋아서 재미있게봤어요! 궁금했던 결말도 흥미로웠습니다.  
20171208,9,투톱의 연기가 장난이 아니네요~~간만에 스릴있게 잘 봤어요^^  
20171208,10,몰입감 엄청나고 그냥 시간 순삭함 강하늘이랑 김무열 진짜 연기 너무 잘합니다 꼭 보세요!!  
20171208,10,아주 재미 있게 잘 봤습니다  
20171208,10,신선한 소재와 예측불가능한 반전스토리!!  
20171208,10,연기소름끼쳤어요 굿 슬퍼요  
20171208,10,아 정말 연기가 최고에요 김무열님 반함 너무 멋있는 스토리도 좋고 생각지도 못한 공포에 소리도 꽥 지르고  
20171208,10,진짜 반전의반전 ㅜㅜ 완전 깜짝깜짝 놀랫어요... 진짜 재밌어요~  
20171208,10,완전 예상못하고 갓다가 오지게 놀라고 온 영홬 ㅋ 스릴만땅 괜찮았음 ㅎㅎ  
20171208,10,영화보면서 소리지른적은 처음.. 스토리도 재밌고 전개가 참신해요  
20171208,10,심장을 쫄깃하게하는 영화. 배우들 연기도 소오름!! 메쏘드의 집합체!!!  
20171208,10,생각보다 반전이 있어사 재밌게 잘봤습니다.  
20171208,10,영화보면서 놀라 소리 지른적이 없었는데 정말 무섭지만 재밌게 봤어요  
20171208,10,배우들의 연기력에 빠져들어서 몰입감이 정말 대단했습니다.  
20171208,10,강하늘 연기 소름끼치게 잘해요!!  
20171208,9,잘만든영화! 하늘님은 진짜 연기잘하구 무열님 매력 ㅎㄷㄷ  
20171208,10,김무열 연기력 끝내주네요. . 스토리 전개력도 대단 상상불허~생각보다 잘 봤어요.  
20171208,1,왜 이게 평점이 8.4인가요 금요일에 돈날리고 짜증나네요장항준 감독이 에나벨을 아주 재미잇게 봣나보네요진짜 보지마세요  
20171208,9,역시 장항준 감독 짱!스토리도 좋고 연기도 완전 볼만함  
20171208,10,강하늘 김무열 둘 다 연기 짱이에요  
20171208,10,신선한 장르의 매끄러운 진행입니다. 재밌게 관람 했습니다.  
20171208,10,정말 재밌게봤어요 스릴감으로 심장이 쫄깃쫄깃 강하늘연기 최고  
20171208,10,너무 좋앗어요ㅋㅋㅋ믿고 보는 배우 강하늘 최고입니다  
20171208,10,스릴러 느낌이 강한 추리물..나름 반전도 있고 볼만하네요  
20171208,10,반전도있고 진짜긴장과 스릴넘치는전개!! 재밌게봤어요 연기력도너무좋구 짱짱!!  
20171208,10,중간중간놀래서 심장 몇번떨어질뻔. 무서워요  
20171208,10,너무 무서워요 ㅠㅠ 놀라는 부분도 많구용  
20171208,10,연기도 좋았고 스토리 전개도 아주 스릴있고 재미있었어요~  
20171208,10,진짜 스릴있고 반전있는 영화네요 슬픈것도 있고 배우들의 연기력에 빠졌어요ㅎㅎ  
20171208,10,영화에 나온 배우 모두 연기력 최고! 스릴넘치게 보았습니다!  
20171208,10,재밌었당!!! 연기도잘하고 반전도있고♡  
20171208,10,반전을 거듭하는 재미가 있었어요  
20171208,7,아 김무열! 얼굴의 변신이 진짜  
20171208,10,앞의 쫄깃함과 배우들의 연기..그걸로 된거죠  
20171208,10,와 한 장면에 진짜 놀랬어요!!! 긴장감있게 봤어요..  
20171208,7,재밌지만 아쉬운 점!! 감춰뒀던 이야기가 넘많아서 후반부에서 사건의 전말들을 풀어내는데 이게 해명하는 느낌이라 아쉬움 이 연출과 각본이 최선이었겠지? 그리고 강하늘의 ‘택시 안 탔는데’ 대사가 이런 장르에서 뻔한 레퍼토린데 여기서도 나오다니 으 아쉽다  
20171208,10,반전있어 더욱놀램 .연기 넘잘하시네요^^  
20171208,10,반전의 반전 두남자 배우 연기 대박이네요 쵝오의 영화임~~!!  
20171208,10,초반 중반부의 그 몰입도는 정말 2017년 영화 통틀어서 Top3 안에 들 정도로 어마어마했다.  
20171208,10,배우들의 연기가 뛰어나고 영상미는 아주 좋았으며 스토리가 반전에 스릴을 더하며 아주 실로 놀랍네요  
20171208,9,반전의 반전의 반전의 반전이였던 영화..마무리가 좀 아쉬운 부분은 있었지만 시간이 가는지도 모르게 봤던 영화 개인적으로 지루한 부분이 없어서 좋았음  
20171208,7,연기는 진짜 미쳤는데 스토리 중반부터 너무 막장... 너무 잡다한 걸 많이 넣은느낌  
20171208,8,"아이디어가 신선하다만, 김은희 작가에게 대본 조금만 손 봐달라고 부탁했으면 더 완성도가 있었을듯...도와줬을라나? 하여튼 몇 가지 부분에서 개연성이 떨어지는게 옥의 티. 연기도 좋고, 전반적으로 괜찮았다  "
20171208,2,댓글알바냐 영화가 조잡함  
20171208,9,관람객스릴러지만 공포영화같이 깜짝 놀라는 장면들이 많이 있습니다. 그치만 스토리는 정말 좋은 것 같아요 추천합니다  
20171208,10,처음으로 영화평점 등록하게하는 영화.  
20171208,7,관람객장르가 뭔지 궁금합니다  
20171208,10,소오름... 소오름.. 영화끝나고 영화관이 추운줄 알았는데 그냥 소름 돋았던것임..  
20171208,8,관람객급하게 마무리 되는 느낌이 있네요주인공들이 왜 그런 결정을 내렸는지와 닿지 않아요 저만 그런가요 ㅠㅠ  
20171208,10,영화보는 내내 긴장해서 목이 비틀어지는 줄ㅇㅠㅠ 유튜브에 리뷰 별로 안좋길래 기대 안했는데 스토리도 그렇고 배우들 연기도 좋았음  
20171208,10, 너랑 본 마지막 영화였다. 너무 잘 지내지는 마  
20171208,10,인생영화ㅠㅠ 진짜스릴러장르좋아하면 꼭봐야함  
20171208,7,관람객생각보다재밌엇어요ㅎㅎㅎ  
20171208,10,스릴러 영화 진짜 안 좋아하는 데 기억의 밤 너무 재밌게 봤어요 ㅜㅜ 하늘님을 비롯해서 영화에 나오시는 모든 분들 연기 진짜 최고였고 스토리도 지루하지 않았어요 !  
20171208,8,진짜 연기구멍이 없는 영화... 김무열이 이정도로 연기를 잘한다니 놀랍다..강하늘은 원래 잘하는 사람이니 믿고보는 영화  
20171208,10,관람객긴장감 넘치는 시간이엿습니당  
20171208,8,가해자 미화로 별 하나 뺌.  
20171208,10,몰입감과 반전의 묘미 재밌게 봤네요!  
20171208,10,반전이였어요.. 이렇게 속을 줄이야.. 저 뿐만 아니라 관람객 전부를요스토리가 너무 좋았습니다. 슬프기도 하고. 기대하지않고 봤는데 기대이상으로 많이 느끼고 다시 한번 보고싶은 영화인것 같습니다.배우분들 연기력도 최상이였어요.너무 잘 봤습니다.  
20171208,10,관람객꿀잼 정말 잘보고왔어요  
20171208,10,굴잼꿀잼영화관에서첨으로소리질러봄  
20171208,1,"개인적으로 평점을 잘 안 남기는 스타일입니다만,  배우들의 연기만 빛나고 연출은  너~~~무너무 아쉬웠네요.  "
20171208,9,"배우들의 연기와 몰입력, 그리고 연출까지....그들의 노고에감탄해서 첫 평점 남겨봐요!! 한국에서 보기힘든 웰메이드스릴러영화에용 오랜만에 영화재밌개봤네요!! 여러분 절대 스포1도당하지말고보세요!!! 짱  "
20171208,1,관람객못봄 시간잘못알아서 못감  
20171208,3,소리지르지마!!!! 소리지르지 말라고!!!!  
20171208,8,관람객어느정도 예상가능했었지만재밋었어요  
20171208,8,관람객반전에 반전.... 하지만 마지막에 엔딩은.. 무언가 ... 답답? 씁쓸?..  
20171208,1,다들 평점 진심이세요?  
20171208,10,긴장감 후덜덜 김무열 강하늘의 연기에 감탄하게 됨  
20171208,10,관람객짱!이였어요!ㅎㅎ 볼만합니다  
20171208,5,관람객재밋엇어용두번봣어요!꿀잼!  
20171208,1,한국영화는 안봐. 재미는 있는데. 어설퍼  
20171208,8,무섭고 슬픈 영화. 생사가 교차되는 지점. 스토리 전개가 탄탄합니다  
20171208,10,한국영화치고는   꽤  괜찬은 영화입니다간만에    돈   아깝지  않은   한국영화  
20171208,1,두 주연배우의 연기는 좋았지만 복선과 설명이 너무 과한 탓에 반전의 묘미가 없었고 후반부 전개가 너무 작위적이고 억지스러웠다. 돈이 아까워서 끝까지는 봤음.  
20171208,10,처음엔 무섭고 중간엔 스릴 있고 마지막엔 반전있어요 연기도 완전 미쳤고 꿀잼ㅜㅜ 스토리 대박  
20171208,9,이번영화는 인정합니다.. 배우들의 연기도 쩔었구요  시나리오도 최고였습니다  
20171208,10,오늘 보고 한동안 자리에서 떠나지 못했습니다 장항준 감독님 대단하신것 같아요 스릴러 좋아하는 저인데 좀 색다른것같아요~두 배우님 연기도 진짜 잼있게 잘봤어요~ 관객수가 안타까울뿐ㅜ 진짜 좋은 영화 잘봤습니다 감독님 배우님들 다 감사드려요~  
20171208,5,관람객그냥그저그런....  
20171208,2,장항준감독을 좋아해 반의리로 봤는데 실망이 너무 크네요.전체적 시나리오는 나쁘지 않은듯 한데 대사의 전개나 설정들이 지나치게 부자연스럽습니다. 개연성 없는 억지공포설정도 그렇고요. 평론가평점이 왜 낮은지 공감가네요. '반드시잡는다'나 볼 걸ㅠ  
20171208,10,간만에   몰입하며  본  영화우리   영화도   넘  잘  만든다끝에   눈물도   핑  ~~    짠하다  
20171208,7,관람객후반 억지 설정이 옥에티네요  
20171208,10,진짜 이거 작가 누구지ㅜㅜ진짜 ㄹㅇ 개잘썻다ㅜ진짜 개오진다ㅜ꼭보세요ㅜ  
20171208,6,"처음에는 재밌다가 반전 있고나서부터 재미없어짐 .. 반전이 억지스럽고, 단서로 추측할수 있는 반전이 아니라 그냥 마무리 어떻게 할지 몰라서 새로 스토리 쓴 느낌입니다. 배우들의 연기는 좋았습니다 ~~  "
20171208,10,재미있고 작품의 완성도도 좋아요  
20171208,9,관람객너무 무서워요... 결말이 조금 허무하긴하지만 나름 괜찮게봤어요  
20171208,10,너무 재밌어요 한번 더보고싶어요 ㅠㅠ  
20171208,10,관람객반전ㄴ이뻔해도재미있에야  
20171208,10,인생영화였습니다. 무조건 꼭 보세요. 근데 좀 힘들어요 ㅋㅋㅋ 끝나고 힘이 하나도 안 남았네요.  
20171208,7,관람객생가보다  첨엔 괜찮았는데 중간에 내용이 좀꼬여서 기대보단 별로였다  
20171208,10,혼란스러웠는데 뒤에 하나하나 풀리면서 재밌었어요!  
20171208,9,"스토리, 연기력 모두 훌륭함. 오랜만에 영화다운 영화 본듯!!! 굿굿  "
20171208,7,어디선가 본거같은 요소들이 엄청많이 짬뽕되어있다. 다행이 짬뽕이 맛있긴한데 너무 과하게 친철했다. 내가 따로 생각할부분이 없다.  
20171208,10,쫄깃쫄깃하게 잼나게 잘봤네요~^^  
20171208,9,스릴넘치고 가슴졸이며 봤어요~~  
20171208,10,피곤할때 봤는데도 몰입도 높고 매순간 긴장하게 만든 영화였어요???  
20171208,10,연기 스토리 음악 전부 너무 좋았다  
20171208,10,재밌게봤습니다~처음에 너무 깜짝놀래서 마음조리며봤어요~배우들연기잘봤습니다~  
20171208,10,"배우의연기,긴장감넘치는스토리,카메라까지 영화다운 영화를 보았습니다  "
20171208,10,몰입도 장난아닌 영화 완전잼남!!!  
20171208,10,너무재밌어용! 스릴짱 반전매력짱!  
20171208,10,몰입도 좋은 영화인거 같아요 초반에 너무 놀래서 계속 긴장하면서 봤어요  
20171208,10,공포영화 느낌도 살~짝나고 후반부엔 납득이 가지만 심장 쫄깃하게 볼만하네요  
20171208,10,악연과 인연의 차이는한순간인듯  
20171208,10,10점 준 사람이 알바라고? 난 진짜 재밌게 봤는데ㅋㅋㅋ 난 1점 준 사람들 이해가 안간다.. 살면서 가장 재밌게 본 영화 중 하나로 손꼽힌다ㄹㅇ 믿고 보시길  
20171208,10,짱 되게 스릴있고 좋았어요  
20171208,10,이만하면 재밌는겁니다. 김무열이다시보이네요^^*  
20171208,9,관람객몰입도  좋았음. 억지로 놀래키려는 시도만빼면 좋았음  
20171208,10,지루하지 않고 재밌게 봤습니다  
20171208,10,여자 귀신인가 (?)나와서 당황ㅋㅋㅋ배우분들 다 연기 잘하시고 스토리 전개도 나름 괜찮았어요  
20171208,10,"강하늘, 김무열씨의 연기는 환상이고, 영화의 장르 또한 독특하며 영화보는 내내 긴장감을 놓을 수 없었습니다.  "
20171208,10,"개인적으로 영화를 많이 보았지만, 이렇게 놀라게 하는 영화는 처음이네요.. 흥행할것같고 둘이서 보았는데 공포영화 보다 더 실감났어요 굳  "
20171208,10,반전 !! 강하늘 너무 귀엽고 .. 반전이 충격적 .. 재밌습니다!  
20171208,10,두 주연배우의 연기로 승화된 작품 이네요~??  
20171208,10,중간중간 깜짝 놀람 생각보단 괜찮았음!  
20171208,10,와씨 영화보다가 소리지른건 첨이네  
20171208,10,대단히 몰입하게 만드는 힘이 있는 영화. 그리고 드는 생각은 어떻게 이런 시나리오를 썼을까 !  
20171208,1,감독이 똥을 싸고 그걸 두시간동안 보는게 더 재밌을지도모른다.  
20171208,10,배우들의 OOO기력과 연출 으 너무 심장쫄깃  
20171208,9,독특한 연출력 긴장의 끈을 놓을 수 없었어요  
20171208,10,"배우들의 연기, 감독의 연출, 충격적 반전이 만들어낸 수작  "
20171208,8,관람객믿고보는 강하늘 연기력  
20171208,10,배우들의 숨은 연기와 스토리가 재미와 긴장감을 늦출수 없게 만든영화였던거 같아요.  
20171208,10,스토리 탄탄하구 배우도 좋아서 시간가는줄 모르고 봤어요  
20171208,10,흥미진진하고 내용 구성이 탄탄해서 좋았어요  
20171208,10,구성이 참 좋았어요!!! 연기도 물론이거니와!  
20171208,10,공포영화인줄... 오랜만에 숨죽이고 영화에 집중하며봤다  
20171208,10,최근 본 영화중 가장 신선했던 영화에요!! 연기도 잘하구 스릴있었어요.  
20171208,10,무서웠지만 다시한번 배우들 연기에 박수칩니다 ~~ 재밌어요bb  
20171208,10,"스토리, 연기,연출 다 좋았다는  "
20171208,9,스토리전개 탄탄하고 새로웠던영화  
20171208,10,고급 스릴러물. 긴장감잇게 따라가다보니 몰입도짱이네요 굿!  
20171208,9,관람객후반부가 살짝 아쉬웠지만 전체적으로 재밌게 봤습니다!!두배우의 연기력이 영화를 이끌었다고 생각합니다.  
20171208,10,예상하지 못했던 전개 반전에 반전 의외의 결말 볼만했음 김무열 존잘  
20171208,10,"반전에, 반전에 또 반전 !...대박 재밌게 봤어요, 배우들의 연기가 진짜 굿ㅎ??  "
20171208,10,깜짝깜짝놀라는부분이 많았고 스토리도너무 재밌어요  
20171208,5,운전을 조심히 해야겠다고 느꼈습니다.  
20171208,10,개꿀잼...반전에 반전... 기대 안했는데 재밌어요~두 주연배우 연기도 굿  
20171208,10,너무 재밌었어요. 스토리도 배우연기도 아주 일품이었어요. 강추  
20171208,10,"연출,연기모두 최고였습니다~손에땀을쥐고봤네요ㅎㅎ  "
20171208,10,예상치 못한 귀신에 너도 나도 소리지르기 꺄아아아악!!!  
20171208,8,관람객스토리가 신선하네요!  
20171208,9,영화재밌습니다.김무열 25살 이란것만 빼면? 그래도 뭐 무열님 연기  참잘하데요.재조명시급! 나름 반전이랄까? 암튼 시나리오도 좋고 연출도 좋고 재밌습니다!아.. 이삿짐아저씨 강하늘 한테 김무열 형이냐고 물어볼때 눈치 챘어야되는데..  
20171208,10,진짜 김무열 연기 대박 너무 잘해요ㅠㅠㅠ 스토리도 탄탄하고 좋음  
20171208,5,관람객뻔한 스토리로 다 예상이 됨.  
20171208,10,관람객뻔하지 않았던 스토리 전개라 끊임없이 긴장하며 관람했습니다  
20171208,8,연기는 미쳣다.하지만 후반에 실마리가 풀리며 살짝 늘어지는 부분이 있다  
20171208,8,관람객재밌어요! 기대이상!  
20171208,10,"강하늘,  김무열 연기 너무 잘하네요. 장항준감독의 각본, 연출력이 빛나는 영화에요.시간 가는줄 모르고 봤네요  "
20171208,10,제가 생각했던 내용과 달라서 더욱 재미있었구요 배우들도 완전 연기 탄탄하고 반전의 반전이에요 꿀잼 제 친구는 갑툭튀 장면에서 팝콘 던져버렷어여ㅋㅋㅋㅋ꿀잼꿀잼  
20171208,10,"강하늘, 김무열 연기 미쳤다너무 잘함.. 새로운 발견임둘다 얼굴에 선함과 악함을 같이 가지고 있는듯악할때는 사이코패스 같음  "
20171208,7,장항준감독의 영화 그리고 배우들의 연기력이 물오른다. 스토리는 좋으나 결말이 뻔하다. 복선을 너무 알려줘서 예측이 가능함.. 그리고 코믹적인 요소는 거의 없어서 아쉬웠다.  
20171208,8,재밌었음! 사알짝 지루한 부분도 있었지만 연기력이 다 커버한 듯연기력 하나는 끝내줍니다 반전의 반전의 반전인 게 재밌었어요 추천합니다  
20171208,1,"진심 10점 주는 사람들은 너도 한 번 당해봐라임. 내가 한국 영화의 혁신을 바랐지만, 이런 병맛영화를 원하는 건 아니었다.... 진심 감독의 생각이 궁금해지는 영화임;그리고 몰입이 안 되어서 그런가 연기도 별로.. 무서움을 의도했는데 웃음이 나옴ㅋ  "
20171208,10,김무열 연기 ㅠㅜ 진짜 기대안하고갔는데  
20171208,9,재미있었네요~~~후반이 조금은 아쉬웠어요~~  
20171208,4,관람객별루에욘뭔냐용인디하나도모르게쒀여  
20171208,10,리얼 지렸다.. 올해 본거중 최고  
20171208,2,놀래킬 타이밍이 예상 가능하고 뻔했음 카메라 앵글에 형체 걸쳐서 인물 보여주고 창밖에서 보여주고 옆으로 빠지면서 장면전환 많은거 이유가 있는건가요? 내용도 전부 어쩔수없었던 불쌍한 사정과 우연... 진짜 질리고 후반부 김무열 창문씬은 보면서 웃었음  
20171208,8,강하늘씨와 김하늘씨의 연기가 좋네요~  
20171208,10,장항준감독 천재인줄..진짜 저런 반전이있을줄은..  
20171208,10,올해 봤던 스릴러 중 가장 긴장 하면서 봤던 것 같아요ㅋㅋ연출력이 굉장히 좋았어요!  
20171208,10,배우들 연기 최고였고 근래 들어 본 영화 중 가장 재밌고 신선했다. 영화관 가서 두번이나 봤는데 감독판 DVD같은 거 나오면 사고싶다 최고였다  
20171208,6,여기저기 가져온 티는 나지만 장항준감독도 영화 계속 찍으니 늘긴 느네요. 그런데 전반부에 쓸데없이 엄청 놀래킴. 지루하지는 않습니다.  
20171208,8,관람객꽤 재밌음 분위기가 마음에 들어요  
20171208,10,관람객김무열 강하늘 케미 정말 좋았어요^^  
20171208,10,관람객배우들연기도잘햇고 반전도 대당햇어요 굳굳 꿀잼  
20171208,10,신선한고 짱짱한 스토리   강하늘 김무열 연기쩐다 강추천합니다  
20171208,3,뭘 말하려는 내용은 아닌것 같고 그냥 이야기임. 후에 생각나고 남아 있는 게 없음. 그냥 연기때문에 끝까지 앉아서 봄.  
20171208,1,지루하고 뻔하고 하품이 많이나오네요  
20171208,10,기대 안 하고 봤는데 재미떠염  
20171208,8,"초반부 ""오~!"" 후반부 ""응?""  "
20171208,10,관람객두번봐도 재미있을영화  
20171208,10,신선하고 재밋네요 깔깔ㅋㅋ  
20171208,10,연기때문에 10이요 사실 내용은 뭘말하고있는지 모르겠음 배우분들 연기는 정말정말 대박입니다 후반부에 좀 힘이 빠지네요 흠...  
20171208,9,영화 조조로 혼자봤는데 초반이넘나무서웟어요ㅋㅋㅋ근데 후반에 그의사가 나와서 청부살인요청하는부분은 이해가안가네요~그부분빼고는 중간중간 소름돋고 지루하지않게봤어요ㅎㅎ  
20171208,7,관람객초반에는 적절한 긴장감과함께 흥미진진하였으나 후반에는 지루한 면이 있었습니다  
20171208,9,보다가 팝콘. 공중에. 날렸다ㅠㅠ  
20171208,10,와.. 진짜 어떻게 이렇게 100분에 탄탄한 스토리를 집약적으로 넣을수있는지 이런 영화못보는데도 정말 재미있게 봤어요 꼭 보세요! 두번보세요!  
20171208,10,와.. 진짜 어떻게 이렇게 100분에 탄탄한 스토리를 집약적으로 넣을수있는지 이런 영화못보는데도 정말 재미있게 봤어요 꼭 보세요! 두번보세요!  
20171208,10,관람객재밋습니다!! 아주아주아중자  
20171208,10,강하늘 연기 지림. 첼시 화이팅  
20171208,10,관람객진짜스토리잘짜여졌네..마지막장면은과거추억이면서도모두를만난다는암시였네  
20171208,4,스토리는 참신하나 매끄러운전개가 아니고 이해가 되지않는부분도 많았다. 그냥 재미로 보는영화지 명작은 아님  
20171208,10,"진짜 재밌었어요! 스토리에 푹 빠져서 지루할 틈이 없었네요  진짜 강하늘,김무열님 연기 최고에요 ㅠㅠ  "
20171208,7,관람객아...김무열...  
20171208,10,관람객와우 정말 추웅우우웅격  
20171208,7,관람객사람 깜놀하게 만드는 초반부 때문에... 어 좋았어요. 연기는 기가 막히게 뛰어나구요. 스토리는 약간 구멍송송 뚫린 느낌.. 저는 등장인물이 한명이라도 더 살아남는 걸 좋아하는 스타일이라 결말도 약간 아쉬웠지만 잘만든 영화인건 틀림없어요  
20171208,10,관람객너무 종앗슴디아히히호호헤헤  
20171208,7,반전시작되기전까지만 재밌다 반전시작되면서 억지로 끼워맞추는 느낌에 예상한 전개대로 흘러가더라  
20171208,10,관람객영화시작부터 마지막까지  주인공들의 연기력에 몰입감 최고.  
20171208,9,"강하늘 김무열 외모, 연기 존잘. 오랜만에 본 영환데 스릴러물로 쫄깃하고 재밌었음. 생각치도 못한 반전 있고 굳굳bb  "
20171208,10,끝까지 몰입해서 재미있게 본 영화는 이 영화가 처음인듯.손에 땀을 쥐게하는 박진감 넘치는 전개가 매우 만족스러웠다.  
20171208,5,연기는 좋았으나 좀 반전이나 결말이 좀 아쉽다  그냥 soso수준 넘 기대해서 그런듯ㅠ  
20171208,9,스토리 소름 김무열 강하늘 연기 ㅜㅜㅜ  
20171208,9,ㄹㅇ 반전 감독이 약간 천잰듯  
20171208,10,스토리 연기 둘다 탄탄해요  
20171208,4,평점이 왤케높냐 별 4개가 적당함 감독이 고민없이 그냥 의식의 흐름대로 만든 영화같음.. 생각할 꺼리도 없고 끝으로 갈수록 노답 삼류영화;; 휴... 앞에서 공포설정으로 긴장감은 있었지만 결말이 골때림  
20171208,9,연기 스토리 반전까지 넘 잼나요  
20171208,9,잘짜여진 소설 한권을 정신없이 읽어내려간 기분이다.  
20171208,10,조르잼! 스릴러를 좋아하는 난데 이게 딱 내스탈이였다! 김무열이랑 강하늘 연기 미쳤음 ㅠㅠ 반전은 더 대박  
20171208,10,재밌었어요 끝까지 긴장을 놓칠수없고 흥미진진~~~ 강추합니다!!!!  
20171208,10,"간만에 보는 스토리, 연기 탁월한 영화~~강력추천~~  "
20171208,7,반전의 반전 나름 괜찮습니다 볼만해요 굿굿  
20171208,10,꼭 보세요..기대안하고 봤는데..넘재밌게 잘봤어요..베베 꼬지않고 그대로 해석해주는 그러나 예측할수없는반전도 좋았고 김무열 넘 멋있고..스토리 넘 짠하네요..  
20171208,10,범죄도시처럼 1차원적인 영화들보다 이런영화가 흥행해야 된다고 생각함. 진짜 두사람 연기 대단했음  
20171208,7,관람객평점보고 많이 기대하고 봤는데 여러가지 아쉬운부분이 많네요 그래도 볼만합니다  
20171208,9,"초중반 스토리의 흐름, 연출 너무 완벽했습니다. 굉장히 재미있게 봤는데 관객수가 낮은 게 이해가 안 갑니다..ㅠㅠ  "
20171208,8,몰입도 있고 반전도 있어서 잘 봤습니당김무열이 진짜루 잘생겻음ㅋㅋ  
20171208,8,관람객초반에 긴장감은 쩔엇음...근데 반전이 좀 너무 뻔하긴햇지만재미있었습니다ㅎㅎ  
20171208,8,중반부까지 인물 심리묘사가 쫄깃했어요. 소재도 신선했고 배우의 연기도 빛난 영화였다 생각합니다  
20171208,1,관람객너무 짜집기한 느낌 ..기대이하 ㅠ  
20171208,10,그냥 다 필요없고 연기력으로 모든걸 조져버린 영화  
20171208,10,관람객재밋어요ㅜㅜㅜ배우들 대박  
20171208,3,넘 별로...끝이 너무 허무...무슨 대박 반전 잇을쥴 알앗는데 뭐 사고가 아니면 전개가 안됨  
20171208,6,중반부까지좋았구 샤프심 발견까지소름 거울보는반전까지 깜놀후반부가 아쉽네요  
20171208,7,관람객고함연기 몰입도떨어짐  
