0,1,2
20190126,1,못생긴 남주에 이쁜 여주에  상황을 바꾸어서 썼더라면 악평 수준이 아니라 상영금지에 감독은 범죄자 취급을 받았을것. 처음엔 페미들이 '미러링'할려고 만든 영화인줄 알았는데 그마저도 아니였다. '그 성별'들의 '선택적 공감능력'  
20190126,10,키스 얘기가 자주 나왔으니까 키스하는 것도 보여줬으면 좋았을 것 같은데 영화 찍을 당시에는 아직 많이 어려서 그런가 ㅠㅠ 그래도 그때만 느낄 수 있는 풋풋한 감정들이 잘 표현돼서 좋았다 주인공들의 독백 형식으로 이루어졌는데도 물 흘러가듯 자연스러웠음!  
20190125,10,남주가 너무 너무 너무 잘생김 ㅠㅠㅠ  
20190122,10,설레는 영화였다! 브라이스 존잘탱  
20190121,9,"미소도, 눈물도 짓게 하는, Iridescent movie.  "
20190120,10,자극적인 요소가 없는데도 지루하지 않았던 영화였어요 자극적이지 않고 맑으면서도 깨달음을 주는 서사라 더 몰입할 수 있었어요 줄리의 가치관이 신기하고 부럽고 닮고싶었습니다 재밌었어요  
20190120,10,인생영화입니다....  
20190116,8,재밌다 줄레베이커 인상적이다  
20190116,10,나도  누군가에게  오색 찬란한 사람이 될 수 있을까?내 평생 그런 사람을 만날 수는 있을까?  
20190113,10,알흠다운 소년과 소녀의 순수한 사랑 이야기  
20190113,10,정말 진심으로 너무 재밌게 봤습니다.  
20190111,8,왜 내옆집엔 브라이스 같은애가 없을까...☆  
20190111,10,"Its goood, great and wonderful  "
20190109,10,인생영화가 뭔지 모르고 살았었는데 오늘 깨달았다.  
20190107,10,10대만이 가질 수 있는 느낌을 잘 표현한 영화. 각각의 감정과 서투른 표현을 너무 잘 나타내었고 엔딩은 왜 그리 빨리 찾아오는지 모르겠다.  
20190106,10,너무 풋풋하고 좋았던 영화  
20190106,10,영화가 끝나지 않기를 바랬다. 이 리플을 이해하지못했다. 그러나 영화를 보면서  이해할수있었다.   나역시 영화가 끝나지 않기를 바랬다.  
20190104,10,정주행 3번한 영화. 두 시점에서 이야기를 풀어나가니까 지루할 틈이 없다  
20190102,10,어릴적 짝사랑을 떠올리게햇던 정말 풋풋한사과향같은영화!!!!  
20190101,10,너무 이쁘다 좋다 치유되는 힐링 영화 그냥 입가에 미소가... 가정이 중요하단걸... 확실히 알게 된..  
20181231,10,너무 수수하고 예쁜 영화같다  
20181231,10,"훈훈혔다,,,,..  "
20181230,10,좀 아쉬웠음 둘이 성인돼서 본격적으로 사귀는것도 보여줬음 좋았을텐데...ㅎ 키스신도 기대했는데 없고 ㅜㅜ  
20181227,10,할아버지의 명대사들이 너무 공감되었던...  
20181223,10,귀여운 사랑 이야기인데 마냥 귀엽기만 한건 아니였다. 순수함이 너무 사랑스럽다  
20181222,10,조금더 어린나이에 이영화를 봤다면 ♡  
20181221,10,Perfect .. that is best pleasure what i can ever watch??  
20181221,10,또 하나의 인생영화.  앞으로 몇 번은 더 볼 듯 하다.  
20181221,10,너무 재밌어서 시간 가는줄 몰랐다  
20181220,10,여주인공 보면 댜른 배우들에 비해서 그렇게 예쁜건 아닌데 묘한 매력이 있음  
20181220,10,여주인공 보면 댜른 배우들에 비해서 그렇게 예쁜건 아닌데 묘한 매력이 있음  
20181217,10,이렇게 명작을 이제야 본 내가 정말 ㅠㅠ 진짜 남주 존잘 시점 2개인거 너무 좋아요. 보는 내내 몰입도도 짱♥?  
20181216,10,재탕해도 좋을 영화..특히 감정선을 잘 표현해서 좋았고 두 사람의 시점에서 각자의 감정과 생각을 공감 할 수 있어서 좋았고 특히나 줄리가 무화과 나무 위에서 세상을 바라보는 관점을 봤을때 눈물이 날 정도로 감동 받음....  
20181216,10,굿 이쁜영화였습니다. 안보신분들에게 추천합니다  
20181211,10,"인생영화,,여자 주인공 너무 매력있게 생겼음  "
20181209,10,감히 인생영화라고 말 한다. 세번이나 넘게 돌려봤지만 보고 또 봐도 질리지 않는다.  온전히 순수한 어린아이들의 사랑을 나타낸 영화는 이 영화밖에 없을 것이다.  
20181208,10,"미성숙하지만 풋풋한 두 아이의 사랑이, 담백하면서도 밝게 묘사된 작품..이따금 사라져가는 나의 맑음과 풋풋함에 까지 생기를 복돋아주는 그런 작품..최고  "
20181203,10,이렇게나 아름다운 영화를 만들어준 배우와 감독 등 관계자에게 감사드립니다. 영화의 모든 장면이 생생하네요.  
20181130,9,넘나 기분좋은 영화. 사랑이 샘솟는 영화. 어린이들의 로맨스에 이리 설레다니? 놀라울 정도로 재밌는 구성!!!! 강추  
20181127,1,여주  걍  도태스토커변태망상녀임  남자였으면 무조건  쓰레기남이라고 욕했을텐데..  
20181126,8,사랑에 서투를 때 하지만 그 모습 자체로 아름다울 때. 누구나 저럴 때가 있었다.  
20181126,8,멜로라기보다는깔끔한성장영화기대밖의훌륭한영화 어리지만 자신의 사랑과 가족을지키는 보통의 사람이지만 이세사을 지키는 사람들의이야기끝나는게 아쉬운 영화  
20181121,10,줄리 아버지와 로스키 할아버지 같은 사람이 되고 싶다. 선입견은 배척하는 그들의 모습을 보자면 존경심이 들엉.  
20181119,8,여자의 섬세한 면이 좋은 이유. 남자의 애타는 그 마음이 웬지 끌리는 이유.  
20181119,10,부분만 보지말고 전체를 봐라.. 할아버지 명언이 기억에 남는다. 2시간채워도 아쉬웠을텐데 너무 짧았다.. 아버지가 왜 겁쟁이가 됐는지도 알려주지.  
20181117,10,나도 모르게 미소지어지는 행복한 영화  
20181115,10,영화가 예쁘다 따뜻하고..  
20181113,10,그들의 순수한 심오함이 부럽다 나는 지금 너무 찌들어있는 것 같다..  
20181111,10,그저그런 롤코영화가아닌 교훈이 있는영화 브라이스가 나무를 심고있을때 줄리가 문밖으로 나오면서 바람이 날리는 장면은 진짜 눈을 땔수가 없었음  
20181109,10,멈춰있던 나의 심장을 두드린 영화.  
20181104,10,솔직히 마지막엔 남주 ㅈㄴ 멋있었다.  전에 잘못한 것들 한번에 만회하고 남을만큼....  
20181101,10,나도 이런 순수한 사랑 한번 해보고 싶다  
20181030,10,졸잼이에용 내 인생영화 너무 재미져  
20181028,10,진짜 시간가는줄 모름.. 두 주인공이 넘나 풋풋하고 사랑스러웠다  
20181028,10,진짜  내 인생영화다..  
20181026,10,어른을 위한 로맨스 영화  
20181026,10,정말 순수했다. 영화가 유독 빨리 끝난 느낌이라 아쉬웠다. 인생영화다.  
20181022,10,둘다 너무 사랑스럽다.  
20181022,10,최근 몇년간 이토록 사랑스럽고 귀여운 소녀가 등장하는 이야기가 있었나?  
20181021,10,과연 응원해주고픈 커플이었다.  
20181020,10,잔잔하고 따뜻한 느낌의 영화  
20181020,10,최고다 마지막에 살짝 눈물 나옴ㅠㅠㅠ 계속 보고 싶은 영화  
20181018,10,남주 여주 아역부터 너무 귀엽고 순수한 사랑  
20181014,6,쿨한 미국 청소년들이란  
20181014,10,쥴리같은 여자가되고싶다. 아이이지만 어른스럽고 사랑스러운 캐릭터  
20181014,8,귀여움 진짜..ㅜ 남자애도 넘 잘생겼고 여자애도 넘 매력 터짐..  
20181010,6,풋풋함. 유치하게 느껴진다면 당신의 사랑은 식었다.  
20181009,10,진짜 너무너무 재미있고 슬펐던 영화 인생영화  
20181009,10,ㄹㅇ 인생영화 보는 내내 여주에 몰입되서 남주가 밉기도 하고 좋기도 하고 싱숭생숭 했다..ㅠㅠ  
20181008,10,"저는 영화를 보고 인생영화다, 라고 생각해 본적이 없는 것 같아요. 두 번 본 영화도 없고요. 근데 플립은 진짜 제 인생영화에요. 안보신 분들 꼭 보세요! 늦게라도 봐서 정말 다행이에요ㅠㅠ  "
20181005,10,나이 들어서 다시 봐도 참 예쁜 영화다 ㅠㅠ  
20181003,10,설렌다..키스신 왜 업나ㅠ  
20181003,10,인생영화 어른영화인데도 눈물이 난다  
20181002,10,길게 설명할 필요는 없다 무조건 봐라  
20181001,10,"말로 표현하기 힘든 감동, 공감  "
20180930,10,영화 긴거 매우 싫어하는데도 이영화가 길지 않은게 안타까웠음  
20180927,10,사랑스러운 이야기 너무 재밌게 보았다  
20180925,10,보기 좋은 영화였음. 여주 매력 터짐  
20180924,10,내 어릴 적 첫사랑이 오버랩되면서 보는 내내 싱그럽게 봤던 영화  
20180924,10,그냥..이 영화를 보고 후회했다는 사람들이 안쓰러울 뿐  
20180923,10,마음이 정화되네요 정말 좋은 영화입니다  
20180923,10,보는 내내 설레던 기분.  
20180919,10,세상을 바라보는 줄리의 시각 제가.지키거 싶은 것이기에 보는내내 행복하고 아름다웠습니다 우리 모두 배려하며 사랑합시다  
20180918,10,"동화같은 영화, 순수한감성이 그대로 전해지는 영화이다  "
20180917,10,보는 내내 흐뭇입니다.  특히 브라이스로 나온 남주 외모가  바람직한. ..너무 바라보는 시선이 중학생 같지 않은. ..  
20180917,8,재밌다 귀여운 영화임 나름 철학적인 영화  
20180913,10,모든영화를 통틀오서 내 인생 최고의 영화였다  
20180912,10,오랫만에 가슴뛰는 영화였다인생영화 리스트에 추가해야지 ^^  
20180910,9,방금봤는데 정말 풋풋하고 미소짓는 영화인거같다그리고 줄리 정말 부럽다 자존감높을수밖에 없는 가정  
20180909,8,신선하지 않은 주제 신선한 캐릭터들과 몽상가들  
20180909,10,시간가는줄모르고봤다.  
20180908,10,빠라라 빠빠 빠라 빠 빠빠 빠라라 빠빠 빠바 yee~11살 딸래미랑 함께 봤는데 마음이 따뜻해지는 시간이었어요~^^ 강추*10000 꼭 보세요~ 꼭!  
20180907,9,어린시절로 돌아가고싶었던 따뜻한영화  
20180905,1,와 너무 지루해서 껐다. 나의소녀시대 이게 훨 재밌다. 첨부터 끝까지 너무 잔잔하다. 그리고 여자 얼굴때매 몰입도 안됨  
20180905,10,"행복하다, 행복해~♥  "
20180902,10,진짜 첫사랑 영화 이만한 게 어딨어  
20180901,10,영화가 너무 사랑스럽고 좋다!!  
20180830,10,"서른인 내가, 영화를 보는동안 12살인줄알고봤다 ㅎㅎ 최고의 작품  "
20180829,10,가슴설레는 첫 사랑의 순간.  
20180829,10,정말 끝나질 않길 바랬어요  
20180829,10,너무 너무 예쁜영화 ^^  
20180827,10,"인생영화다. 사랑에 대해서 다시한번 생각해보게되었다. 앞으로 내가할 사랑도, 저렇게 순수했으면 좋겠다  "
20180825,6,걍 초딩들 연애하는 내용.  
20180825,10,내 인생영화?? 볼때마다 주인공들의 순수함에 설레여서 뭔가 마음이 정화되는 기분이 들어요ㅎㅎ  
20180819,9,다 좋은데 엔딩이 넘 아쉽다.. 키스하는 걸 봤어야 하는데..에이..((라고 저희 엄마가 그랬습니다 허헣 네 저도 동의하구여ㅋㅋ  
20180815,10,유치하면서도 진심어린 사랑을 보여주는 영화. 멜로의 주인공들을 어린층으로 잡으니까 서로가 서로를 이해하며 성장해가는 스토리라 너무좋다.  
20180814,10,정말로 재미있어요^^  
20180813,1,"학교에서 보여줬는데 여주는 김칫국 마시고 스토킹하고 남주 머리 냄새나 맡아, 남주는 달걀 버리고 억지로 키스할려고 해서 여주가 놀라서 숨는데 계속 연락하고 찾아와...진짜 이해안간다 결말이 제일 어이없음 남주가 나무 하나 심었다고 풀리는것도 이해안됌  "
20180812,10,요 근래 본 인생영화다.풋풋한 저 시절 난 뭘했었는지도 기억이 안나네.남주의 집안보다는 여주의 집안이 더 내가 원하는 환경이다.  
20180809,10,그냥 참 예쁘고 예쁘다.  
20180808,10,줄리가 정말 생각이 깊은 것 같다. 나도 닮고 싶다  
20180807,7,"겁쟁이 남자주인공이 친구가 여자 욕하는거 동조했는데, 나중에 나무하나 심는다고 갑자기 화해하는게 개연성이 떨어지긴 하네요.. 그래도 보면 기분이 정말 좋아지는 영화.  "
20180804,10,이 아이들이 커서도 잘지내는 모습이 보고싶다  
20180731,9,마음이 몽글몽글해졌다  
20180727,10,"어떻게 저렇게 멋있는 남주가 있나 하며 보는내내 설레임을 놓을수 없었다. 다만 한가지 아쉬운 점은 마지막이 열린결말 이라는 것 ,아이라 그런지 잔잔한(?)로맨스 라는것 . 그래도 정말 평점 100점은 줘야할 영화다  "
20180724,8,"풋풋한 사랑 얘기가 솔직하게 그려졌다. 그리고, 여자들 맘이란 참 복잡하다.  "
20180723,10,관객들이 강제로 개봉시킨 영화답게 너무 재밌게 잘봤다  
20180720,8,이런 소재는 잘 안 보는 편인데 몰입감 있게 봄. 영화가 너무 빨리 끝나는게 아쉬웠다.  
20180718,10,봐도봐도 재밌음  진심 남녀노소 누구나 좋아할 만한 영화이다. 현대적이지 않고 시골같은? 분위기가 주인공들의 풋풋함과 어울려서 더 좋았당  
20180715,10,정말 이 영화를 보고 내 마음도 따뜻해지는 것 같았어요.  
20180714,10,정말 너무 재미있게 본거같다  
20180711,8,공포나 판타지를 좋아하는 사람은 이해하기 힘들거같아요.. 이런 영화는 정말 어렵네요ㅠㅠ 하지만 같은 장르의 다른 영화보다는 더 와닫는거같아요  
20180711,10,아이고~ 달달해라 ㅋㅋ  
20180709,10,영화가 너무짧다...빨리끝내기엔 그들의 이야기를 더듣고싶은데ㅜㅜ  
20180706,10,진짜 인생작 깔끔한 스토리 세세한 감정표현. 다 외모들도 훌륭했고 연기도 좋았다 설렜고 남녀 둘다의 이야기를 들을 수 있어서 좋았다  
20180705,10,보는 내내 울 일도 아닌데 눈물이나고 마음에 사랑과 설렘과 따뜻함과 행복이 끊이질 않았다 배댓말처럼 영화가 끊나지 않기를 바랬고 마지막엔 엄청난 여운이 쓰나미 밀려오듯 내마음을 덮쳤다 이 영화를 본 후로 내 인생영화 1위로 등극했다  
20180704,10,보고 난 후 플립 같은 영화를 찾게 되는 영화  
20180703,8,관람객그럴수도 있겠다는 생각이 드는 영화  
20180701,10,"보는 내내 지루하지 않고, 감동깊게 보았습니다  "
20180630,10,주위 시선에서 자유롭고 내 마음에 솔직해질때 비로소 상대방의 마음을 열 수 있다.  
20180629,10,로맨스의 정석. 강렬한 스킨십이 아닌 정말 가슴이 설레는 순수한 사랑영화. 유년시절의 순수한 두근거림을 간접 체험하고 싶다면 이 영화를 강력추천한다.  
20180627,10,아..좋았어요 - 한줄평!  
20180627,7,평점이 너무 쓸때없이 높은거 같은데...  
20180627,10,아..난 왜저나이때 저런 추억이 없는가영화로 대리만족할배명언 가슴에 새깁니다  
20180625,9,나도 모르게 웃음 지어지는 영화. 너무나 사랑스럽다  
20180625,10,지루할줄 알았는데 은근한 재미가 있네요^^  
20180622,10,ㅜㅜ진짜 끝나지않았으면 하고 계속 봤음  
20180621,10,초등학생 자녀들과 함께 봤습니다.다시 한번더 보고싶은 영화예요.  지인들에게 많이 추천했어요.  
20180619,10,대사 하나하나가 아름답다  
20180617,10,그저 사랑스러운 영화....  
20180615,10,사랑과 인생 꿈을 위해 용기내어 플립해라는 메세지가 인상 깊네요  
20180609,10,플립보다 더 재밌는 영화있나요? 있으면추천해주세요..완전 제 인생영화입니다ㅠㅠ  
20180604,10,인생영화 진짜 너무 좋아요  
20180602,10,"성장기 아이들에게 꼭 보여주세요. 진정한 친구, 우정, 사랑. 따뜻하고 좋은 영화 입니다.  "
20180530,10,영화 내내 마음이 포근해지는 기분. 특히 남주 외모는 끝장나게 잘생겼더라.. 무튼 미국느낌 물씬나는 영화  
20180530,10,뭔가 추억돋는 영화인거같다..ㅜㅜ 왜우는지 모르겠는데 나도 모르게 눈물 찔끔ㅠㅠ 잔잔하고 설레이게 해주는 영화♥  
20180530,10,그저 다 좋았다. 영화의 포커스랑 조금 어긋나지만 줄리네 집 가정교육 방식이 정말 좋아보였음..  
20180528,10,줄리의 엄마와 아빠를 보면 줄리가 올바로 자란 아이라는 것이 백퍼 공감이 된다. 캐릭터 하나하나 버릴 것이 없는 최고의 감동 영화.  
20180527,10,순수하고 마음이따뜻해지는 영화입니다 꼭 보시길 추천드립니다 ⌒⌒  
20180526,10,보는내내 위로받았던 영화. 보고난후 평생 내 인생영화.  
20180521,10,진짜 너무너무 설레고 남주 진짜 존잘... 보는 내내 설렜습니다 ㅠㅠㅠ 진짜 너무 좋아여 내 인생영화 플립 ㅠㅠㅠ  
20180520,10,내 인생영화라고 부르고 다닐 정도로 만족스럽고 여운이 깊었던 영화. 짧게 끝나버린 내 첫사랑을 다시 한번 상기시켜준 소중한 영화.  
20180520,10,진짜 줄리랑 브라이스랑 같이 있는 장면 보는데 뭉클함♥  
20180518,6,볼만하고 재밌있는 영화  
20180518,10,정말 끝나지않길....  
20180516,9,풋풋함을 있는데로 섞어만든 순수함의 결정체  
20180515,10,"사랑스럽고, 힐링되는 영화.  "
20180513,9,초등학생때로 돌아간 기분이다  
20180513,8,풋풋하고 사랑스럽다. 귀엽고 말랑말랑하다. 보는 내내 설렜다.  
20180508,10,진짜 인생 영화 개재밌음  
20180506,9,정말 잼있다. 할아버지가 한 말이생각나네.. 어릴때 성향이 죽을때까지 반영된단말... 정말 가정교육의 중요함을 느끼네...  
20180506,10,다시는 없을 것 같은 그런 영화  마음 설레는 그런 영화  
20180501,10,나도 빨리 철들어야 할텐데..  
20180428,10,보이 밋츠 걸의 정석을 보여준다!  
20180428,10,한순간도 놓칠수 없는 명장면 명대사의 향연. 꼭 봐야할 당신 인생의 영화. 아 가슴 찡하다  
20180426,10,내가 브라이스였음 좋겟다고 생각한영화 진짜 힐링된다  
20180425,9,순수하고 풋풋한 사랑이야기  
20180422,10,아 진짜 1시간 30분이 10분처럼 느껴짐요 ㅠㅠㅠ  
20180421,9,기분이 몽글몽글하게 좋아지는 영화  
20180421,10,볼까 말까 고민하는중이라면 꼭보셈 진짜 ㅠㅠㅠㅠ 공감되는 부분도 있고 풋풋함이 뇌까지 전해져 온다 영화 내내보면서 안끝나길 원했던거같음 ㅠㅠㅠㅠ 꼭보셈 인생영화다  
20180417,10,진짜 인생영화. 보면서 이유도 모르고 계속 울었는데 다시봐도 또 눈물 나오는 영화. 남자주인공과 여자주인공 케미도 좋았다아무래도 이 플립 영화는 2탄이 나와줘야 한다. 결말이 2%정도 부족했지만 색감과 스토리가 98%를 다 채워줌  
20180410,10,하 진짜 띵작 진짜로 꼭보세요 짐짜  
20180410,7,막 재밌을라니까 끝나네. 뷔페 브레이크타임 걸린 느낌.  
20180408,10,최고에요. 꼭 보세요!!  
20180407,1,여주가 매력적이라는 사람은 기본적인 상식부터 다시 공부해야한다.엄연히 사유지인 땅에 있는 나무에 올라가 못벤다며 징징거리고 브라이스를 좋다고 쫓아다니며 머리냄새까지 킁킁거리며 맡았을때 소름이 돋았다. 스토커 민폐 여주에 찌질한 남주. 남주외모만 열일  
20180406,10,한 노인이 사람의 성격은 어렸을 때 형성된다고 말씀하셨다. 어쩌면 그게 왜 브라이스 아빠에 대한 이야기가 빠졌는지에 대한 답이 아닐까...아름다운 동화 뒤에 가려진 슬픈 이야기처럼  
20180404,7,비슷한 장면을 교차하여 보여주면서 각자의 감정선을 잘 살렸다  
20180403,9,이 영화를 보고 진짜 순수하게 사랑에 빠질 수 있을까 나한테도 그런 기적같은 일이 일어날 수 있을까라는 생각이 들었는데 그 사람이랑 안부 하나 주고 받을 수 없어서  
20180403,10,단순히 재미보다는 잔잔한 감동이 있는 영화.  
20180402,10,영화가 끝나지 않기를 바랬다 는 말이 너무나도 공감....  
20180402,10,나도 모르게 영화에 몰입해 빠져들고 있었다  
20180402,10,이 영화 보고 평론가 나부랭이들 안믿기로 했다  
20180329,10,꼭보ㅓ라~~ 꿀쟘이다  
20180328,10,아.마음 따뜻해진다..참 부럽다  
20180327,10,이 영화를 보고 내 학창시절을 돌이켜보니오로지 외모만봤지 내면을 보지 못했단 생각이 드네그때로 돌아갈수 있다면 줄리같은 아이와 한번 만나보고싶다..  
20180327,9,왜 이제서야 봤니 ㅠㅠㅠ 감동 ㅠ  잃어버린 순수와  첫 사랑을 떠올리게 했다.  
20180326,10,부분도 전체도 빛나는 영화  
20180326,10,이게 전문가 평점 6점짜리영화냐? 참....  
20180326,1,재밌다고 해서 봤는데 노잼이던데 청춘물중에서는 그시절 우리가 좋아했던 소녀 넘는거 없다.뭔가 여기서 재밌다는 사람들은 하이틴에대한 로망이 있다고 생각하는듯  
20180326,10,아 좋다 이런 분위기 영화 너무 좋다  
20180326,10,감히 10점을 주고 싶었다  
20180326,10,와아~~ 이 영화 진짜 좋네요. 따뜻해지는 영화임. 그리고 영어회화 공부하기에 매우 알맞은 영화임. 대사들이 간단해서 알아듣기에 쉬움. 이웃집 일상 보는 것 같아서 질리지도 않음.  
20180326,8,아빠 개때리고싶네 진짜  
20180325,10,하아 영화 너무 사랑스럽네요 내내 미소지으면서 봄ㅋㅋㅋ  
20180325,8,누군가에 대해 나도 모르겠는 감정에 혼란을 겪으며 성숙해지는 시기가 떠올라 미소 지으며 본 영화  
20180325,10,정말 안보면 못배기는 영화  
20180324,10,힐링됬다..인생영화  
20180317,10,성숙한 소녀와 순수한 소년의 이야기  
20180316,10,"유명한 영화라서 봐야겠단 생각은 했는데, 왜 진작에 안봤나 싶을정도였다. 그냥 줄리 그 자체가 너무 사랑스러웠다!  "
20180314,10,어릴때봤을땐 재미없었는데 30대되고나서보니 괜시리 눈물나는 영화  
20180313,10,최고의영화다 추천합니다  
20180313,10,최고의영화다 추천합니다  
20180313,10,세상이 좀 순수해지길..영화 보는내내 너무 좋았고 저 나이로 돌아가고 싶다는 생각이 들었다 정말 좋았다  
20180312,10,"인생영화..,,,,  "
20180311,9,종반부 브라이스가 줄리한테 강제로 키스한걸 미투운동으로 결말냈으면 10점을 줬을것있다. 물론 셰리가 브라이스 뺨 때린거 전치 2주 끊어서 갔으면 리얼 팝콘각이었고  
20180311,10,영화채널 돌리다 우연히 봤는데 빠져들었다 유료로 다운받아서 보고 또 봤다. 철이 든 줄리에게 감정이입을 너무 했나 나도 모르게 눈물이 났다. 10대 로맨스 영화라고만 하기엔 뭔가가 더 있다. 오랜만에 마음이 따뜻해지 영화를 봐서인지 여운이 안가신다  
20180311,10,무심코 봤다가 눈을 못떼고 약속도 늦을뻔.. 최근본 영화중 마음을 가장 사로잡았다. 추천ㅎㅎ !!  
20180311,10,잔잔하면서 보는 내내 입가에 미소가...  
20180311,10,최근에 또 다시보면서 행복해진 영화아름다운 영상미 흘러가듯 나오는 명대사들까지.  
20180311,10,설레임과 위트 그리고 가슴따듯한 영화  
20180311,10,방금 오씨엔에서 3번째 보는건데 결국 또 다봐버렸다  
20180311,10,마음이 따뜻해지네요 10자  
20180311,10,정말 감동적이네요 ㅎ 일요일 아침 어디 가려다가 못가고 있었네요  
20180311,10,꼭보세요 흥행은35만이지만 이리저평가될이유절대없음  
20180311,10,와..내가 평론가라면 난 만점을 주겠다  
20180310,10,너무나 아름다운 따뜻한영화  
20180310,10,인생영화다 안본 사람들에게 꼭 추천한다  
20180309,10,잔잔하게 오래 여운이 남는다. 난 줄리와 브라이스처럼 자라나고 싶다. 마지막 무화과 나무를 심어주는 브라이스와 그 옆의 줄리의 모습은 둘 다 성장했다는 이야기겠지. 영화가 순수하고 아름답다  
20180308,10,우연히 봤는데 빠져드는 영화네요두 주인공이 성장한 플립2도 나왔으면...주인공의 아름다운 결말이 좀 더 나왔으면....  
20180307,10,첫사랑이 생각나는 영화...  
20180305,10,"기분 좋아지는 영화, 사랑스러운 영화  "
20180305,9,저런 여자애 친구로 두면 진짜 내가 잘해줄텐데...  
20180303,1,나만 개노잼인가...너무 지루했는데 러브로지보고 이거보니 너무 재미없게 느껴졌음...  
20180303,2,z랄을해라  그냥 잔잔하고 소소하다 그게다야~  
20180302,10,웃으면서 보고 있었는데 이상하게 목이 메였다.  
20180301,10,사랑스러운 영화 . 장면 장면이 너무 예뻤다  
20180227,10,끝나고 보니 내가 집중하고 있었던 것을 알았네..  
20180226,10,이런 영화 넘 조으다. 또 봐야지  
20180226,10,첫사랑의 풋풋함 상큼함!!!! 훈훈한 메세지까지!!  남주의 근황이 좀 아쉽네....  
