0,1,2
20170812,10,관람객굿굿입니다. 오랜만에 배꼽잡고웃다가 배꼽 떨어져나갓내요 ㅎ  
20170812,10,관람객사랑스러운 영화입니닷  
20170812,10,추천해주고 싶은 영화. 인생영화 a movie that will flip me  
20170812,5,관람객사실 영화가 엄청 잘만들어졌단 생각은 안드는데 풋풋한 매력이 있음  
20170812,2,지루함. 영화 이제 시작하나 했는데 끝나버림. 과대평가된동화.  
20170811,10,이건 무슨 내용인가 한번 넘겨보다가 끝까지 눈을 못뗐다. 두 소년 소녀와 그들의 부모님 이야기까지도 너무나 아름다운!  
20170811,9,관람객귀여운~풋풋한~ 웃음나는 그시절  
20170811,8,관람객그냥 뭐 어린애덜 순수한 럽스톨이 ㅎ ㅎ .. . 다쥬이랑 럽스톨이가 펼쳐졌으니 8점 줌  
20170811,9,관람객모르겠다1234567890  
20170811,10,  늘 사랑을 현실적으로 보려는 나에게 그들이 선물해준 순수한 정직함은  내사랑의 또 다른  문을 열어주는것같다.  
20170811,10,관람객좋아요 보호 받는 받고 있습니다 근데 왜 이렇게  
20170811,10,관람객인생영화 또봐야지ㅎㅎ  
20170811,6,관람객넘나 지루합니다....기억에 안남을 영화  
20170811,10,관람객유ㅓ넌묘ㅓ나네ㅡㅏ터ㅓ퉅ㅌ  
20170811,10,관람객처음은 좀 지루한 부분이 있었는데 갈수록 재밌었어용??  
20170811,9,관람객달달하고 귀여운 청춘의 이야기우리 아들 여자친구도 쥴리처럼 당차고 자기신념이 강한 사람을 만나길 바란다  
20170811,10,잔잔하지만 마음속에 오래 남는 영화인것 같습니다.  
20170811,10,"지금까지 인생영화는목소리의 형태,그 시절 우리가 좋아했던 소녀이번 플립을 본 후 오르가즘이 돌았다  "
20170811,10,관람객최고의 영화입니다! 너무 감동적이었고 좋았어요.. 감수성이 풍부해진 순수한 영화... 너무 잘 담은고 같아요..  
20170811,7,누군가의 그 시절도 항상 이렇게 엇갈렸던 풋사랑.그래서 더 애틋하고 소중한 첫사랑.  
20170811,10,몇 번을 봐도 좋네요.. 대사도 너무 좋아요^^  
20170811,10,무슨 이런 영화가 다 있지? 감동적이다 눈물도 난다  
20170811,9,관람객소소한 일상과 첫사랑 그리고 내면의 아름다움에 대한 이야기였다. 잔잔한 울림과 따스함을 참 잘 전달한 영화여서 모처럼 편안한 느낌으로 볼 수 있어 좋았다.  
20170811,10,관람객시간  때우기용 이상의 영화  
20170810,9,관람객잊지못할 첫사랑의 추억  
20170810,10,청소년 권장영화. 이 영화가 나에게 줄리가 되어준듯  
20170810,10,"관람객정말재밌어요!!! 연인끼리본다면 더 좋을것같아요!! 내용알차고, 교훈도많이주는 영화인것같아요!  "
20170810,10,끝나서 너무 아쉬웠던 영화풋풋하고 순수한 사랑같았다 후속작이 꼭 나왔음 좋겠다  
20170810,9,관람객두 사람의 시점으로 이야기를 풀어나가 각자의 감정이 잘 와닿았던거같아요  
20170810,10,재미없다 그치만 최고다  
20170810,7,관람객졸렸다상대에  따라 저렇게느낌이 틀릴 수도 있구나를 알았다.  
20170810,10,관람객아쉬워요이잉이이잉잉  
20170810,10,진잔한 영화 좋아하는 사람들은 정말 좋아할만한 내용이다. 가까이 있는 사람들과의 따뜻한 정을 느낄수 잇엇다. 무엇보다 빈티지 스러운 영상 느낌과 여주 옷이 넘나 이쁨... 여주 옷때문에 몇번 더 돌려볼거같다.  
20170810,10,관람객언제봐도 힐링되는 영화ㅎㅎ  
20170810,10,명작입니다 강추합니다  
20170810,10,관람객가슴이 따뜻해지는 영화이런 영화가 좋아요딸에게도 보여주고싶네요부분이 모여서 전체^^  
20170810,10,"플립, 내 인생영화ㅠㅠ  "
20170810,9,관람객가벼운마음으로 볼만했습이다  
20170810,9,기대를 너무 해서 그런걸까 끝부분만 뭔가 아쉽네요(이렇게 끝?) 이런느낌  
20170810,10,관람객끝나는것이 아쉬운 영화였습니다  
20170810,9,관람객난 왜 남중남고공대의 테크일까  
20170810,10,관람객너무 아름답고 오래 기억에 남을 영화에요!  
20170810,10,관람객시간가는줄 모르고본 영화  
20170810,10,태어나서 후기쓰게 만드는 영화에요 이거 못봤으면 당장 보세요 서로의 나레이션을 듣는 것도 좋았고 감정선들을 공감하면서 봤어요 이런 명작을 이제서야 보다니 꼭 소장하고 싶네요ㅠㅠ꼭보세요  
20170810,10,너무나도 아름다운 영화  
20170809,6,관람객재밌어요 옆에서 여자친구가 자네요  
20170809,10,관람객'I Flipped'  
20170809,10,관람객완전 굿이에요 최고영화  
20170809,9,관람객단순히 꼬마아이들 사랑이야기로써만 볼 게아니었다. 꼬마아이들이 세상을 보는 가장 솔직한 시선을 느낄 수 있었다.  
20170809,10,관람객잔잔함과 교훈이 어우러진 영화였다.  
20170809,10,관람객진짜진짜재밌는영ㅎ하  
20170809,9,남학생도 몰입해서 보고 영상미도 좋고 괜히 보는 사람도 풋풋하게 하는 영화  
20170809,10,내가 무슨 단어든 쉽게 인생이란 말 안붙이는데 그래도 이건 인생영화라고 꼭 말하고싶다 센과치히로랑 플립은 정말 내 인생영화..내 노트북에 있는 유일한 영화임ㅜㅜ극장에서 볼 수 있어서 행복했음  
20170809,8,관람객재미있었습니다 약간 지루한 부분도 있지만 볼만한영화  
20170809,10,관람객세상에... 예쁜 첫사랑 얘긴줄로만 알았는데  인생의 모든 얘기가있는 대단한 영화였다  
20170809,8,관람객꽁냥꽁냥한 청소년 사랑 얘기인줄 알았는데 생각보다 삶에 대한 다른 자세를 보여주는 영화였음  
20170809,8,관람객다음생에는 저런 연애를...  
20170809,10,관람객주인공 둘의 시점을 교차시켜가며 진행해 둘의 생각이 어떻게 다른지 이해하기가 쉬웠다. 잔잔한 로맨스. 플립 보시고 힐링하세요??  
20170809,5,관람객잉?? 잘모르겠고 목요일에 여자친구랑 보러감  
20170809,9,관람객여자 남자 나레이션 내용이 재미있어서 좋았음  
20170809,10,관람객풋풋한10대로다시돌아간듯~  
20170809,9,"관람객저는 친구말구 어머니랑 같이 봤는데, 영화가 끝나구 나서 어머니께서 모처럼 가슴 따뜻한 영화봤다구 좋아하셨어요! ㅎㅎ  "
20170809,10,관람객이미 본 영화를 또 보러 온건 정말 재미있어서니까. 남자친구는 걔들이 어른이 될 때까지 할 줄 알았는데 씩 웃고 끝나니까 허무하다그러네요. 그런데 재미있는 영화였어요  
20170809,7,관람객잔잔하게 흘러가서 보기 좋았던 영화  
20170809,9,다 좋은데 브라이스 아빠 성격이 왜 저래?  
20170809,8,관람객애들과 재밌게 봤습니다.  
20170809,8,관람객엔딩이 너무 조금 허무해야될까 마지막에 좀더 달달한게 뭔가 있을꺼같은데 없는게 조금 함정이라면 함정..  
20170809,10,너무 빨리 끝나서 아쉬운 영화  
20170809,10,저토록 평범한 소재로 이토록 큰 즐거움을 주는 영화  
20170809,8,관람객어린아이들의 순수한 사랑이 귀여웠다  
20170809,10,유쾌하게 재밌게 안달(?)하며 봤어요^^  
20170809,10,관람객진짜 너무너무 좋아요 ㄹㅇ 인생영화..  
20170809,10,관람객너무 재밌고 감동적인영화  
20170808,10,관람객풋풋한 사랑이야기 좋아요  
20170808,10,잔잔한 감동이 밀려들어서 계속 미소지으며 봤습니다.. 좋은 영화.  
20170808,10,관람객정화 되는 느낌. 성장이라는 단어가 넘 잘어울리는 영화  
20170808,9,"관람객풋풋하고 달달했고 , 전개방식이 새로웟다  "
20170808,9,관람객여주 오빠들이 잘생김 ㅎㅎ  
20170808,10,인생영화  순수했던 옛날이 생각나는~~^^  
20170808,7,관람객언제봐도 기분좋고 귀여운 영화 :-) 재개봉 덕분에 극장에서 다시 봐서 좋았어요!  
20170808,1,관람객100일 기념으로 남자친구랑 같이 봤는데 내가 이상한데서 웃는다고 다음부터는 따로 앉아서 보자고 하네요^^! 끝나고 옆구리좀 찌르니까 이런 영화보고도 그런데 만지고 싶냐고 그러네요^^! 씨발 내가 여자냐 니가 여자냐? 연인끼리 보지마세요 빡치니깧ㅎㅎ  
20170808,8,관람객순수한 사랑의 감성을 자극하는 맑고 청순한 동심의 첫사랑을 떠을리게하는  사랑스런 작품입니다.  
20170808,10,관람객옆에서 자는 여자친구를 혼내주고싶었다. (입술박치기로)  
20170808,10,관람객너무 사랑스럽고 예쁜영화♥♥  
20170808,10,관람객시간가는줄 모르고 오랜만에 아름다운 영화 한편 감상했네요. 완전추천!  
20170808,9,관람객예전에 봤었는데 영화관에서 다시 볼 수 있어서 너무 좋았어요 !  
20170808,10,관람객마음이 정화되서 나왔다  
20170808,8,관람객영화같지 않은 따뜻한 영화  
20170808,8,관람객잔잔하다 피곤한나 잠잠들다  
20170808,9,관람객귀엽고 풋풋해요. 여름밤에 보기 안성맞춤  
20170808,9,관람객풋풋한 어린시절 이야기.. 볼만합니다^^  
20170808,10,관람객지루할수도 있는내용을 참 잘풀어냈어요...넘 재밌었음...  
20170808,9,관람객역시 감동그 자체 풋풋함이 되살아났다  
20170808,8,관람객전반적으로 잔잔해서 이런 잔잔한거 싫어하는 사람들은 지루해할수도.. 하지만 주인공들의 심리변화가 또렷하게 드러났고 전반적인 스토리나 배경들이 실제 그당시를 잘 표현한것같아서 난 개인적으로 너무 좋았다! 마치 소설한권 읽은것같은 기분^^  
20170808,10,관람객시간 가는 줄 몰랐습니다.  
20170808,9,시간 가는 줄 모르고 봤다 .  
20170808,6,관람객어린시절 첫사랑의 추억  
20170808,10,관람객정말 뜻깊은 좋은 영화였습니다.  
20170808,9,이런 영화 제가 참 좋아합니다.  
20170808,10,사실 이 영화가 2010년에 개봉한 영화를 한국에선 이제서야 개봉했다는게 놀랍다.. 그래도 이 영화가 이제서야 빛을 보게된건 반갑다..  
20170808,8,관람객재밌었긴했는데 너무 스토리가 반전없이 예고그대로 이어져서 조금 실망했어요 그래도 남주도 잘생기고 볼만한 영화였습니다.  
20170808,8,"관람객요즘, 참 드문 가슴 따뜻해지는 이야기.  "
20170808,9,관람객잔잔하게 보기 좋았다!  
20170808,10,관람객굿꿀잼진짜재밋다다다  
20170808,9,관람객꾀 행복하고 유익한 영화  
20170808,10,2편 나왔으면 좋겠다!!!  
20170808,9,롭 라이너 영화는 거의 나레이션이 들어간다.  
20170808,10,관람객워후워어어어아어엉어아앙  
20170808,8,"관람객영화 떄문에, 함께한 사람 때문에 보는 내내 행복했던 영화  "
20170807,9,관람객그 마음이 너무 반짝여서 간직하고 싶다.  
20170807,10,성장영화를 뻔하지않게 잘 그려냈다  
20170807,10,이거야 이거라구 내가 원하던 영화!!  90분이 20분같았다ㅠㅠ  
20170807,10,미소가 지어지고 너무나 아기자기한 영화  
20170807,7,관람객좋네요우야도마뉴뉴댜뮵훃ㅍㅁ  
20170807,10,이렇게 아름다운 영화를 만들어 낼 수 있는 미국의 감성이 너무너무너무 좋다.. 왜 이제서야 본 걸까.. 영화를 본 지금 난 이미 사랑에 빠진 것 같다. 이 소설을 쓴 작가에 대해너무 알고싶어졌다. 배우 캐스팅도 너무 훌륭하다. 영화 노트북 이후 걸작  
20170807,10,관람객너무 감동적인 영화에요! 첫사랑이 생각나네요  
20170807,10,관람객첫사랑 영화의 바이블이라 불릴만하다. 어찌 그리도 사랑스러운지.  
20170807,9,관람객잔잔하고 이쁜이야기....  
20170807,10,관람객아름다운내용인데 슬픈거뭐죠?!!  
20170807,9,보는 내내 기분 좋은 영화.  
20170807,10,관람객알콩달콩 재밌었어요~  
20170807,9,관람객색감이 너무너무 예쁜 영화였고 여자주인공 매력이 넘쳤어요  
20170807,9,관람객연인과 가족 누구에게나 관계란 단어를 아름답게 표현한 작품이라 생각하며 적극 추천합니다.  
20170807,8,관람객풋풋한 사랑이야긔><  
20170807,10,역시 찾아 보길 잘 했다는 생각이 들어요  
20170807,10,관람객아이들의 첫사랑 같지만 '어른들도 이런 관계의 미숙함이 있지 않을까?' 생각이 드네요. 관계에 대해서 생각해보는 영화였어요  
20170807,10,관람객시간 가는줄 모르고 봤습니다...개인적으로 후속편 나왔으면 싶더라는 ㅠㅠ  
20170807,9,관람객순수한 사랑 이야기! 이제는 그런 순수한 사랑을 할 수 없는 나이가 된 것 같음에 씁쓸하네요  
20170807,9,어쩔땐 나를 웃게 하고 어쩔땐 나를 울게 한다.  
20170806,8,관람객마음이 순수해지는 영화  
20170806,10,관람객재개봉 하는 이유를 알것같은 최고의 영화  
20170806,8,관람객밈매미난ㅌ트자재트타나니ㅣ미  
20170806,10,나는 액션좋아하는 남자지만....이영화보면고 나도 이런 사랑을 만날수있을까 했다 실평점은 9점대지만 10점박고간다  
20170806,10,관람객볼만했숩니다. 남주 귀엽네요  
20170806,10,관람객좋네요 좋아요 좋습니다  
20170806,10,관람객영상미가 너무 좋은 영화 ㅠ  
20170806,5,그냥 보통 로맨스인데  호들갑은!  
20170806,7,관람객나쁘지않었다 여자친구도 좋아하구  
20170806,10,관람객색감이이쁘고볼때마다재밌다  
20170806,10,관람객굿재밌게봣어요!!굿 좋네요  
20170806,10,순수하고 사랑스럽고 행복한 영화....부분이 만나 만들어낸 여운이란...  
20170806,10,줄리는 사랑스러웠고 브라이스는 찌질했지만 귀여웠다! 순수하고 풋풋해서 더 예뻤고 플립 속 브라이스는 그 누구보다 잘생겼다 ..  
20170806,6,관람객극장가서 봤는데 극찬할 정도는 아님..  
20170806,10,관람객풋풋함을 되살려준 행복한 영화  
20170806,9,관람객최고의 작품이다 하하1하1하하1하  
20170806,10,당찬 줄리 멋있다 !!!!  
20170806,9,관람객귀엽고 사랑스러운 영화입니다 행복감이 증진되는 기분이예요 줄리 참 멋지네요  
20170806,10,싸구려 한국영화에 지친 그대들에세 달달한 영화 한편을 자신있게 추천한다!!  
20170806,10,정말 여러모로 좋은생각하게 만들고 풋풋한 첫사랑의 감정도 되새기며 재밌게 봤어요 전 올해 이영화가 가장 인상깊네요 아직도 여운이 ^^  
20170806,10,줄리는 언제봐도 사랑스런아이.  
20170806,9,관람객잔잔하고 예쁜사랑 이야기  
20170806,10,관람객은은하게 마음을 저리게 한다  
20170806,10,큰 기대없이 봤다가 영화가 끝나지 않길 바랬다  
20170806,10,관람객시간가는줄모르고 봤어요~~~진짜 너무 재밌고 보는동안 기분좋은 영화였어용  
20170806,10,평론가 옛날 방식이라고 전혀_ 시간이 어떻게 가는지 몰랐네  
20170806,7,브라이스는 가진게 얼굴밖에 없었는데 줄리가 얼빠였다. 영상미가 예쁘고 의외로 눈물나게하는 독특한 주인공의 성장이 참좋다.  
20170805,9,관람객역시는역시군1234  
20170805,10,진짜 인생영화 어떤 로맨스 영화보다 재밌었다.  
20170805,9,분명 엔딩은 완벽하고 끝까지 봤는데...왜 보다 만기분이 든거 같지?  
20170805,10,개 재미있음 ㅠㅠ청춘영화  
20170805,7,실컷 재미있게 보다가 마지막에 똥  싸다가  끊긴 기분...  
20170805,10,When I first saw bryce my heart flipped.  
20170805,10,관람객풋풋 신선 미소짓게 하는 영화  
20170805,10,아름다웠던 영화입니다  
20170805,10,관람객순수해서 너무 이뻤다.  
20170805,10,관람객보지는 못했다 하지만 추천  
20170805,10,관람객언제봐도 재밌어 감정선 탁월한 영허ㅏ  
20170805,9,관람객풋풋하다! 여주 매력 짱짱  
20170805,10,잔잔하게 내 마음을 따뜻하게 한다..  
20170805,10,최고다. 순수한 감정으로 시작되는 사랑이 값지다고 생각되어지는 지금  
20170805,9,예쁘고 풋풋하고.. ♥ 남자 배우의 눈 빛에 나도 반할 뻔..  
20170805,10,정말 재밌고 우리의 영화 우리가족이 모두 재밌다며 보던 양화이다~^^ 1시간 30분 짧지 않고 길지 않았다... 딱 시간도 적당했던 영화이다!!! 모든 가족이 보기에 딱 좋았던 영화이다 최고  
20170805,10,관람객정말 사랑스러운 영화에요. ㅠ  
20170805,10,진짜 마음이 따듯해지는 영화♡  
20170805,9,관람객누군가를 좋아하고 싶어지는 영화  
20170805,10,재밌어요 좋아요ㅎㅎㅎㅎ  
20170805,9,왜 성인물이 아닌 성장영화를 보고 봉인되있던 연애세포가 깨어난건지..0.5점을 남겨놓은건 당장 내 꽉찬 사랑을 나눌 대상이 없다는 안타까운 현실 때문이다ㅠ.ㅠ  
20170805,10,플립은 인생영화인것 같다  
20170805,3,관람객딱 재개봉 스러운 영와였음  
20170805,10,관람객정말 좋은영화에요 추천합니다  
20170805,10,방금 cgv에 나오길래 보다보니 끝났다.점점 빠지네 대박 이건 꼭 봐야돼  
20170805,10,잔잔하지만 정말 빠져들어 봤네요 요즘 보기힘든 착한?영화네요  
20170805,10,깔끔한 구성이 소년 소녀의 감성을 만퍼센트 효과가 좋았어요  
20170805,10,정말 큰 감동을 받았어요~잔잔하지만 큰 여운을 남기는 영화  
20170805,10,마지막 서로 손을 잡게 될 때... 어릴때 가슴앓이만 했던 추억이 떠올랐다. 참 아름다운 영화였다.  
20170805,9,관람객기분좋게볼수잇는 영화에요ㅎㅎㅎ  
20170805,10,관람객다시 본 영화지만 더 재밌고 감동적이었어요~  
20170805,9,영화평점 생애 처음으로 남겨봐요. 최고에요!  안보신분들 꼭 보시길  
20170805,8,관람객뭔가가 아쉬워... 그냥 사랑싸움이야기  
20170805,10,평론가 평 개떡같네ㅋㅋㅋ7년전 영화 재개봉한거니까 당연히 옛스타일이지 평론 저딴식으로 해도 평론가 하는구나  
20170805,9,관람객첫사랑 느낌의 영화였습니다.  
20170805,10,영화를 보는 내내 아빠인 나로서도 반성을 해야 하는 생각을 많이 했다마지막에 왜 이렇게 눈물이 나는지 처음부터 끝까지 웃으면서 본 내 인생의 영화  
20170805,9,관람객기대했던만큼 재밌었지만 결말이 뭔가 아쉬웠음  
20170805,8,관람객기대보단 덜했지만 그래도 첫사랑때 제 모습이 생각나는 영화였어요 재밌게봤습니다  
20170805,10,내 자신도 돌아보게 만드는 재밌고 따뜻한 영화  
20170805,10,관람객호 너무너무너무 좋네요 ㅎㅎ  
20170805,10,진짜 인생 영화이다. 첫사랑의 풋풋함을 잘 나타내었다.  
20170804,10,관람객끝날때까지 엄마미소 나오는 영화  
20170804,7,"관람객재밌긴 한데 90분 짧은 상영 시간 탓인지 좀 더 들려줬으면 하는 부분(할아버지와 할머니의 옛이야기, 아버지가 이웃집 예술가들을 보며 화내는 이유)도 들려주지 못한게 아쉬운점  "
20170804,10,관람객강추! 잔잔하게 마음을 울리는 영화!  
20170804,10,진짜 시간가는줄 모르고 본 영화  
20170804,10,마음이 정화되는 아름다운 영화  
20170804,9,보는내내 행복했고 쓰라렸다  
20170804,10,이거 옛날 영화 아닌가요? 이제야 개봉을 한 거네요. 인생영화임. 사춘기 꼬마들 너무 아기자기 풋풋하고 좋음.  
20170804,8,관람객보는내내 미소짓게 만드는 힐링이 되는 영화예요 시간이빨리 지나간 것 같았어요~^^  
20170804,10,관람객잔잔하고 여운이 길게 남는 영화. 호불호가 갈릴 수도 있겠지만 정말 내 취향이어서 정말 재밌게 봤다.  
20170804,10,"관람객전체적인 분위기가 잔잔하고 평온해서 보기좋았고,영화내내 대사가 하나하나 마음에 와닿는 영화인것 같다.  "
20170804,6,관람객볼만했다 성장후의 이야기가 없는 점은 아쉬웠다  
20170804,10,관람객잔잔한 감동이 있는 영화  
20170804,8,관람객미국적인 가치를 전해주는 미국적인 영화. 그래도 편안하게 볼 수 있는 영화  
20170804,10,최고최고진짜 지루하지도않고 재밌었따  
20170804,9,관람객세번째 본 영화에요ㅎ추천합니다  
20170804,9,관람객나는 우리가 오랫동안 이야기 나눌 것임을 알았다.  
20170804,10,관람객좋아요ㅠㅠ좋아요ㅠㅠ  
20170804,10,관람객인생 영화다. 한 순간도 지루할 틈이 없다. ㅡㅜㅇ  
20170804,9,관람객제작에 돈이 별로 안들었음. 근데 재밌네요  
20170804,10,관람객진짜 너무 재밌었어요..  
20170804,7,다소 지루했다. 그러나 기대를 많이한 내 자신을 탓해야할 듯. 분명 영화 속에서 배울 것은 많았다. 공감 되진 않지만 누구나 갖고 있을 어렸을 때의 추억을 꺼낸 것도.  
20170804,10,관람객첫 사랑이 생각나는 영화네요.  
20170804,7,관람객재밌어요짱 재밌습니다  
20170804,10,왜 그런지 마음이 힐링되는 느낌이었어요.  
20170804,10,관람객풋풋한 첫사랑의 순수함을 보며 계속 미소를 짓게 되는 영화  
20170804,10,관람객완전너무너무너무너무재미써  
20170804,9,관람객우왕 짝 한시간짜리 영화인데 데이트할때 보기좋아요 근데 엔딩 쬬끔 허무함 ㅋㅋㅋㅋ  
20170804,10,잔잔하고 소소해서 행복한 것같은 영화  
20170804,8,관람객우선 남주가 너무 잘생겨서 집중력 구웃 보는 내내 여주의 당찬 성격이 너무 부러웠다 남주 아빠에 대한 얘기가 좀 더 들어가 있었으면 하는 아쉬움이 있었다  
20170804,9,관람객신선하고재밌엇어요....!!  
20170804,10,관람객십대 딸이랑 대만족하며 봤습니다^^  
20170804,10,관람객이보다 완벽할 순 없다! 엇갈린 남녀의 톱니바퀴가 맞춰져가는 흐름!!  
20170804,10,영화 자체가 너무 아름다워요~~  
20170804,10,마음이 시원해지는 영화  
20170803,8,관람객오랫만에 저절로 미소짓게하는 잔잔한 영화다.저 아름다운 시절을 떠올리게하는 스토리와 음악이 전편에 흐른다  
20170803,10,또 보고 또 봐도 너무 좋다.  
20170803,9,관람객처음에는 지루했는데 동화같이 잔잔한 느낌이라 좋았습니다. 치유되는 기분이었습니다.  
20170803,10,"관람객심장이 말랑말랑해지는 영화, 개인적으로 할아버지의 대사 하나하나가 너무 와닿았네요  "
20170803,7,관람객풋풋하고 사랑스러운 영화. 전체적인 색감이 너무 예뻤다. 마지막이 급 마무리된 느낌이라 좀 더 길었으면 좋았을것같다  
20170803,10,영화가 끝나지 않길 바랬다~~ 러닝 타임 너무 짧아!!  
20170803,10,관람객인간관계에 대해 알아가는 영화였고 꿀잼임 :-)  
20170803,9,"관람객순수함, 그 안에 의미있는 대사를 통해 세상을 보는 시선을 말하고 있다. 잔잔하지만 깊이감있는 울림이 있는 영화.  "
20170803,10,관람객마음이 훈훈한 영화~!  
20170803,8,한편의 동화같은 순수한 이야기가 맘에 들엇다  
20170803,10,관람객남자인데 지린영화였다  
20170803,2,이게 인생 영화면 평생 영화 한편 본거;  
20170803,10,긴말필요없이 너무 좋은 영화  
20170803,10,관람객너무 귀여운 남녀 주인공~~!! 극장에 재개봉 한 이유를 알겠네요^^  
20170803,10,"관람객올해 최고의 영화였습니다. 모드를 편견을 가진 시선으로 봤던게 아닌가.. 하는 생각에 좀 부끄러웠고, 그 용기에 감동했습니다.  "
20170803,10,너무 좋네요....^^  
20170803,10,가슴이 뭉클한 사랑이엿다  
20170803,10,보는 내내 행복했고 내 추억을 꺼내보듯 소중한 느낌이 드는 영화였습니다. 몇번이고 다시 볼 영화...꼭 보세요  
20170803,10,"인생 영화, 아름다운 영화  "
20170803,10,얘네 고등학교시절도만들어라!!!!  
20170803,10,"관람객재미있게 봤어요 ,소소하게 삶을 돌아보게 하는  영화였어요 강추입니다. 살아가는 데  정말로 중요한것이 무엇인지에 대하여..  "
20170803,3,관람객가볍게 볼만한 영화 기억에 남는건 그다지..  
20170803,9,관람객새로운 느낌의 신선한 영화네요....  
20170803,10,아.. 첫사랑의 풋풋함  
20170803,10,"관람객정말 귀엽고, 귀엽고 사랑스러워요 여자친구는 끝나고 귀엽다는 말만 연신 하더군요 ㅋㅋ첫사랑 있으신 분 없으신 분 모두 귀여운 설렘을 보시길 추천합니다  "
20170803,10,관람객정말 재밌게 봤다. 견고하게 짜여진 영화.  
20170803,10,관람객모두 하나쯤은 간직하고 있는 추억들이 문뜩문뜩 떠올라요  
20170803,10,관람객아기자기한 감성영화입니다  
20170803,10,관람객너무너무 따뜻해진영화 ..남자입장 여자입장이 이렇게 다를줄은 ㅎㅎ  
20170803,10,영화속 명언 : 사람의 인성은 어렸을때 현성이 된다.  할아버지는 지혜로우셨고 아버지는 많이 부족했다.  
