0,1,2
20170727,10,"관람객제 어린시절의 꿈과 첫사랑이 아스라이 떠오려지는 이 영화,좀더 오래 상영해주셨으면좋겠어요~  "
20170727,10,진짜 많은 생각을 하게 만드는 영화  
20170727,10,관람객첫사랑이 생각나는 힐링영화  
20170727,10,정말 보는 내내 재미있었던 영화이다.  
20170727,10,관람객진짜...보구나서 미소가 절로..가슴따듯하고 부럽기도하고..ㅋ  
20170727,10,관람객첫사랑을 다시 느끼게 해준 사랑스러운 영화  
20170727,9,예쁘고 아련하고 ??? 미국판 응팔 꼬마들의 첫사랑기억같은 느낌? 참 좋다?여주 아빠의 답답함와 남주 아빠의 고약함이 좀 이해 안돼서 별반개 감점  
20170727,8,관람객재밌어요~줄리 너무 사랑스러움  
20170727,10,관람객진심 최고의 영화예요^^  
20170727,10,관람객너와 나를 보는 것 같아 눈물지었고 결말이 달라 더 슬펐던 영화  
20170727,10,관람객참 신기하다 남자애 에게 상처를 수어번 받았음에도 용서가 되는 사랑이  
20170727,10,관람객부분에 너무 몰두하지 말아요. 상대의 부분뿐만 아니라 스스로의 부분에도.  
20170727,10,순식간에  지나갔네요~~넘 이쁜영화에요  
20170727,10,관람객잔잔한 감동 재밌는영화였습니다.  
20170727,10,너무 예쁘고 사랑스러운 영화  
20170727,10,관람객말해뭐해요..30번은본것같아요 대사외울지경 ㅠㅠ 극장에서보고 울었어요  
20170727,8,관람객풋풋 소소 사랑 이야기.  
20170727,10,줄리거 너무 사랑스럽고 예쁘다. 마음씨가. 그리고 주변사람들을 보면 정말 행복해보인다. 나까지 마음이 따뜻해졌다. 이제 브라이스도 행복을 느낄 차례이다.  
20170727,9,관람객마음이 일렁이는 좋은 영화  
20170727,10,관람객기분이좋아지는영화인것같습니다  
20170727,10,관람객굿굳궂굿굳궂굿굳궂굿  
20170727,5,관람객볼만해요 정말로 달달함  
20170727,10,중학색된아이와 함께보기 너무 좋았어요 요즘보기드문 감성적인 영화였고 추천할만하네요  
20170727,8,보는 것만으로도 좋다.  
20170727,10,관람객굿굿재미있어요 추천합니다  
20170727,10,관람객남녀주인공이 너무 이쁜 영화  
20170727,10,관람객영화가안끝나기를바라게됨  
20170727,1,관람객예매취소 안되네요 네이버 쓰레기  
20170727,10,관람객행복해지는영화 너무 잘생김  
20170727,9,관람객풋풋하고 예쁜 소년소녀와 작은 감정의 변화들까지 섬세하고 예쁘게 묘사되어서 보는 동안 미소가 지어지는 영화네요.  
20170727,10,관람객잔잔히 흐르는 영상과 스토리가 맘을 촉촉히 적시네요  
20170727,7,관람객제 취향이 아니라서 보다 나왔네요..  
20170727,10,여주 같은 딸 낳고싶다.  내용이 풋풋하고 너무 귀엽다.  
20170727,10,관람객너무 힐링되고 재미 있었습니다  
20170727,8,관람객재미있었습니다~~~~  
20170727,10,관람객되게 풋풋한 사랑이야기를 시점을 계속 바꾸면서 보여줘서 더 좀 실감나게 느낄수있었고 되게 귀엽고 즐거운 영화인듯  
20170727,10,인생영화 5번도 넘게 봤지만 볼때마다 좋아요 ??  
20170727,5,나이먹고 봐서 그런가 한 25살때쯤 보니까 그냥 그렇던데... 감성영화가 나랑 잘 안맞나  
20170727,8,관람객옛날생각나는 영화 잘봤네요  
20170727,10,관람객서글픈 역사앞에 3시간동안 긴장의 연속이였습니다  
20170727,10,관람객어렸었을때 느꼈던 감정을 플립으로 다시 느껴보네요 추천합니다  
20170727,8,관람객풋풋하고 사랑스럽고 예쁜 작품이었습니다. 하지만 가볍고 유쾌한 로코물을 기대했다면 호불호가 갈릴 거예요  
20170727,10,관람객진짜 인생영화입니다ㅠㅠ 진짜 풋풋한 첫사랑 얘기이구여 진짜 후회없는 영화인것같습니다 주인공들 모두다 잘생기고 이뻐서 보는 내내 눈이 즐거웟습니다 좀 아쉬웟던 것은 첫키스를 마지막에 보여줄주 알앗는데 안보여줘서넘무 아쉬웟습ㄴ다ㅜㅠㅜ 꼭 보세요 강력추천!  
20170727,10,인생 영화가 바뀌는 순간  
20170727,9,무엇보다 빠른 전개가 좋았고 결말까지 우리에게 생각할 여지를 남겨두어 여운이 많이 남는다. 그냥 푸근하고 행복해지는 영화.  
20170727,5,그냥 오래된 영화. 너무 유치하고 심심해~ 노트북으로 볼걸 그랫어..  
20170727,7,관람객끝날때 든 생각이 끝났다고?  
20170727,10,줄리 사진 프린트된 티셔츠 파는곳 알려주세요  
20170727,10,사건마다 줄리와 브라이스의 관점으로 보여줘 지루할 틈없이 영화가 금방 끝나버렸다.  
20170727,10,관람객보고있노라면 마음이 따뜻해지는 그런 영화.이런 어린 아이들의 시점에서 느낄 수 있는 새롭고 깨끗한 표현들...인생영화 등극이다.  
20170727,10,관람객굿 정말 잼있음 굿굿굿굿  
20170727,9,한번도 평점 남겨본적 없는데남기고싶다! 남녀의 입장에서 잘표현된순수함에 설레고잔잔함에 감동이  
20170727,10,관람객간단하게볼수있는영화  
20170727,8,관람객너무 기대를 많이해서 그런가뭐 그냥 동화처럼 큰 탈없이 잘 흘러가네요  
20170727,10,관람객이쁜내용이었고재밌었어요~  
20170727,10,관람객너무 잼남 애들이 넘귀여움  
20170727,10,헐 이거 한국에도 드디어 정식개봉했구나 이미 봤지만 한번더 보러가야지 진짜 명작중에명작 ㅜㅜ마음이 따뜻해지는영화임 한국엔 언제개봉하나했더니ㅠㅠ  
20170727,10,"오랜만에 정말 재미있게 본 영화입니다. 감동, 즐거움 다있어요  "
20170727,10,관람객보는 내내 미소가 떠나지 않았던 영화  
20170727,10,관람객제목 그대로 서서히 뒤집히는 모습이 사랑스러웠다.  
20170727,8,관람객굿 재밌었음 잔잔하니~|  
20170727,10,"관람객생애 첫 특별한 감정의 빅뱅을 경험하는 소중한 시절의 아름다운 이야기가 마음을 다하여 집중하게 하고,미소와 뭉클함을 느끼게 한다. 두근거리는 첫사랑과 좋은 어른들이 가르쳐 주시는 삶의 이치,서사하는 방식 모두가 작위적이지 않아서 오롯하게 보고 느꼈다.  "
20170727,9,아름답게 녹아든 아이들의 순수와 사색  
20170727,9,관람객처음부터 끝까지 풋풋한 사랑에 지루할 틈이 없었지만 다소 끝부분이 아쉽게 느껴진 마무리였다. 하지만 아쉬운 마무리를 무마할정도의 탄탄한 스토리라 재미있게 봤다 ^.^  
20170727,9,흐믓한영화입니다~~^^  
20170727,10,"재밌다,, 너무 재밌다,,  "
20170727,10,마음이 따뜻해지는 영화. 영화가 끝나지 않길 바랬다 내 하루를 치유해준 영화  
20170727,10,관람객너무재밌어요 간만에 크게 웃었네요ㅎ  
20170727,7,관람객기대만큼 재밌진 않고 그냥 혼자 별생각 없이 보기 좋울정도  
20170727,10,많은 것을 느끼게 해주는 영화다  
20170727,9,편히 볼 수 있는영화. 주인공 2명의 시점으로 보는 방식이 좋았다.  
20170727,9,같이 영화를 본 사람은 나와는 성격이 어떻게 다른지를 느낄수 있내요  
20170727,10,관람객네번째 보는데 그래도 넘 좋아요ㅜㅜ 따뜻한 영화  
20170727,10,"관람객진짜 최고영화,,,사랑합니다  "
20170727,8,관람객첫사랑이 떠오르고 아이들의 순수함에 너무 좋았던 영화입니다  
20170727,10,군함도 보고 짜증난 여자친구 이 영화로 풀어줬습니다....  
20170727,10,관람객열번넘게보고 영화관가서도 보고 봐도봐도 재미있는 영화  
20170727,10,내 인생 영화 힐링되는 기분이었다  
20170727,9,관람객심야영화로 봤는데 좋았어요  
20170727,10,누구나 무지개처럼 빛나는 사랑이 있다. 유년시절의  추억과 풋풋함과 싱그러운 향기가 전해지는 힐링영화. 그 흔한 키스신이 없지만 마지막씬에서 손을잡고 눈을바라보며 키스씬은 관객의 상상으로 편집한 감독에게  박수를 보낸다. 렛잇비미 ost도 멋지다.  
20170727,10,순수하고 담백했다 최고 가벼운 마음으로 흐뭇하게 볼수있는 그런 영화 최고다.  
20170727,10,기자들  평점을 보면 항상 난 이런 생각을 한다. 조선시대 사림이 딱 저꼴이지 않을까.  
20170727,10,그냥 정말 순수하고 맑다 한 백서른마흔스물다섯여섯번 보면 질리려나. 첫사랑. 그자체  
20170727,10,평점을 본 후 부푼 기대감을 가지고 본다면 실망할지도 ..? 그큰 기대 없이 본 영화인데 스토리 탄탄하고 가끔 있는 웃음 포인트! 동화같은 이야기여서 보는내내 마음이 설레였다.  
20170727,10,관람객티비서밧던영화네요.  
20170727,7,관람객주인공들 심리변화를 보는게 귀여움  
20170727,8,잔잔하고 재미있다 비포시리즈의 십대버전 느낌  
20170727,10,다시 한번 보고 싶은 영화  
20170727,10,그동안 봤던 로멘스 영화중 최고!  
20170727,8,관람객진짜 어른들을 위한 동화라는게 딱 맞는 표현인듯  
20170727,9,힐링되는영화 인생영화  보길 잘한것같다.  
20170726,10,오만과 편견 이후로 내 인생영화  
20170726,10,관람객진짜 내 인생 최고의 영화로 기억될 것 같습니다.  
20170726,10,선선한 저녁 아니 조금 늦은 밤 플립 영화를 볼 수 있어서 행복했어요 ㅎㅎ 7년만에 재개봉한 영화였군요~!! 담백하지만 귀엽고 솔직하고 순수한 아이들 모습이 너무 예뻤어요 특히 닭 모이는.. 아 영화관 사람들 다 웃느라 bb  
20170726,10,관람객짱임 재밌음 잔잔하고 어린애들사랑얘기  
20170726,10,관람객풋풋한 사랑이야기! 재밌게 봤습니다.^^  
20170726,10,히야 너무 잼따 그냥 아주그냥 인생영화구만  
20170726,10,인생영화 나무에서 본 풍경. 나도보고싶다  
20170726,10,딱 편안하게 보면서도 마음이 따뜻해지는 영화였다 요즘 감동을 짜낼려고 만든 영화나 시각적인면만 신경쓰는 화려하기만한 영화들에 지친 사람들이라면 보면 진심으로 후회하지 않을 것이다 첫사랑의 서툰 마음과 성숙해지는 과정을 과하지않게 예쁘게 그려 넣었다  
20170726,9,관람객기억에 남는 좋은 대사가 많네요.  
20170726,8,"관람객함께 본 사람이 애인 이라면 행복. 남편이라면 화불끈. 이런 맘, 언제였을지. 그리고 용서와 이해. 사랑의 의미란 다채로운 색깔이니까.  "
20170726,10,관람객화성인 소년과 금성인 소녀가 지구에서 사랑하는 법 ^^  
20170726,10,행복함과 설레임에 풍덩 빠지고 싶다면!! 오늘은 이거다!!!!  
20170726,9,때 묻지 않은 영화...  
20170726,10,관람객연인끼리 같이 보기 좋은 영화에요!  
20170726,8,관람객첫사랑의추억을되새겨볼수있었던영화!  
20170726,8,관람객가슴속 깊이 진하게 남는 영화.  
20170726,10,예전에 보던..캐빈은 12살이라는 미드가 생각나네여..즐거웠어여..^^  
20170726,9,영화가 끝났을때 너무 아쉬웠지만 거기서 끝내야 하는게 맞는것 같다 오래 전 영화여서 색감도 예쁘고 빈티지하고 남자주인공이 진짜 잘생겼다 ㅋㅋ  
20170726,9,관람객재개봉이라 기대하고 봤습니다!그냥 아름다운 영화  
20170726,10,두 주인공의 각각 다른 시점을 이해하려고 하다보니 시간가는줄모르고 본  
20170726,10,관람객올해 가장 재밌게 본 영화입니다. 추천해준 여자친구에게 감사의 말을 전하고싶어요  
20170726,10,마음에 깊게 남는 영화. 화면 연출 연기 소재 모든게 아름다웠고 풋풋했다. 또래보다 성숙한 줄리와 아직 미숙한 브라이스가 서로를 알면서 사랑이라는 감정을 배우게 된다는 아름다운 순간을 알았다. 내 가슴 깊은 곳 둘의 사랑이 영원히 그려지기를.  
20170726,10,관람객오랜만에 마음이 따뜻해지는 영화였어요.이런 영화가 군함도에 밀려 하루에 한두번밖에 상영안한다는게 슬프네요  
20170726,10,관람객너무너무너무재밌었다...  
20170726,10,정말 최고 짧지만 여운이 길게 남는 영화에요 ㅎㅎ  
20170726,10,관람객어릴 땐 그럭저럭 재밌게 봤고 이번엔 청승맞게 봤음  
20170726,7,관람객기냥 연인이랑 볼만한정도?기대하고 보면 노잼  
20170726,7,풋풋한 주인공들의 밀당(?)이 정말 ㅋㅋㅋ입가에 미소 한 가득...달달하니 넘 사랑스럽고 이쁜거돠...줄리가 그렇게 집착(?)하던 그 나무...마지막...브라이스에 행동에 조금 감동했어...  
20170726,8,근래엔 보기 드문  따뜻한 감성의 문학적인 영화였다.  
20170726,10,무난하고 재미있었다.  
20170726,10,관람객재밌게봤습니다 101010  
20170726,5,관람객무난하다 깜박깜박 존건 내 탓이야  
20170726,10,아름다운 영화입니다 영혼이 맑아지는.. 10대가 봐도 좋을것같습니다♥  
20170726,8,관람객소년과 소녀의 귀여운 사랑이야기  
20170726,10,인생 영화다. 어린애둘이 썸타는 영화순수함과 내면의 풍경..보는내내 행복했다  
20170726,8,관람객풋풋한 어린시절의 소중한 감정이 다시 생각나더라구요~ 다만 끝날때 약간 허무하더라구요 ㅎ  
20170726,7,관람객훈훈 오그라듬 영상미굳  
20170726,10,관람객굿굿 재밌었고 열린결말젛았어요  
20170726,10,관람객첫사랑의 설레임을 너무 자연스레녹여놓은영화진짜재밌어요 설레고 눈물도나구  
20170726,8,관람객정말재밌게봣어요 잔잔한감동  
20170726,1,노잼 ㅡㅜㅜㅜ 노잼 노잼  
20170726,8,관람객순수한 첫사랑을 느낄수있던영화  
20170726,9,관람객첫사랑도 있지만 그 나이일 때 느끼는 것들과 성장도 같이 있어서 좋음  
20170726,9,관람객순수한 영화 입니다. :)  
20170726,10,어린시절의 추억은 없지만 추억이 있었나 착각을 불러일으킬만큼 좋았다.  
20170726,10,관람객별점깍을이유가없는영화  
20170726,10,관람객좋아요좋아요좋아요좋아요  
20170726,10,관람객전체가 부분들의 합보다 나은 사람이 되었으면!!  
20170726,10,"아진짜 너무좋은데 이거보고 너무 연애하고싶어졌다,,,  "
20170726,7,관람객처음에는 재미있었는데 점점 지루해짐  
20170726,10,풋풋한 감성이 너무 좋아요  
20170726,10,영화 보는 시간동안은 행복했다  
20170726,9,관람객첫사랑영화의 클래식.  
20170726,10,이야 재개봉한 건데도 관객수 보소. 멜로영화는 이렇게 만드는 거다 알겠냐?  
20170726,6,관람객미소짖게 만드는^^ㅎㅎㅎ  
20170726,10,관람객설레이고 항상웃게만들어주는영화!!  
20170726,9,"관람객경제적으로 부유하지만 내면의 행복지수는 그리 높지 않은 한 가정과 반대로 소박하게 살지만 가족간 소통이 잘되고 서로에게 따뜻한 말 한마디 건넬수 있는 삶의 양면성을 볼수있어 행복했던 시간, 그리고 가슴과 영혼이 따뜻해지는 그런영화...  "
20170726,10,관람객진짜 인생 영화다. 지루하지않고 내용도 재밌어서 좋았다.  
20170726,10,관람객없는 첫사랑도 기억나게 하는 그런 영화.. 두 아이들의 순수한 사랑을 따라하고 싶을만큼 매력이 철철 넘치는 영화였어요..♡  
20170726,10,소장용영화 열자쓰는거 짜증나네  
20170726,10,관람객달달 그 자체입니다.. 여자친구랑 너무 좋은 시간 보냈어요.  
20170726,10,관람객지금까지 보았던 해외영화중 최고  
20170726,10,시간이 지나가는것도 모를정도로 훅 지나간거같다. 영화를 보는동안 순수한 감정으로 동심에 돌아간거 같아서 너무 좋았음  
20170726,10,관람객완전 재밌어요 아무생각없이 볼수있어서 좋았어요 순수한 영화라서 더 이뻤던 영화같네요  
20170726,10,인생영화!! 꼭 봐야할 영화인듯해요  
20170726,10,관람객따뜻하고 예쁜영화!!!  
20170726,10,그들의 이야기가 한편의 서사시가 되는법  
20170726,10,관람객just the way you are  
20170726,9,관람객나도 나무를 심고싶어졌다  
20170726,10,나이40에 즐거운 생각을 하게하는영화~~~굿  
20170726,10,관람객마음이 따뜻해지는 영화  
20170726,10,관람객혼자 봐도 재밋어서 친구들이랑 두번 본 영화!!  
20170726,10,관람객소소하게보기 좋은영화  
20170726,10,관람객감정 이입되는 부분도 많고 달달해서 좋았어요.  
20170726,10,다운받아서 4번째 보고 있어요! 볼 때마다 기분 좋아지고 교훈도 얻을 수 있어요 ㅎㅎ 정말정말 인생영화예요!!!  
20170726,10,관람객달달하고 좋아요!!ㅎㅎㅎ  
20170726,8,"관람객기대안하고 봤는데, 재밌습니다.  "
20170726,9,"사랑스러우면서도 인생을 알려주는, 꽤나 성숙한 이야기였음  "
20170726,10,ㄹㅇ 인생영화.. 영화가 예쁘다는 표현이 잘 어울리는듯  
20170726,10,시간가는 줄 몰랐던 영화네요. 순수하고 감동이 있고 최고예요. 다시 보고 싶어요!!!  
20170726,8,풋풋한 감성을 너무 귀엽게 녹인 영화 ㅋㅋㅋ  
20170726,10,두근두근 설레는 영화. 풋풋하고 사랑스럽다.  
20170726,10,귀엽고 사랑스러운 영화였음 ㅎ  
20170726,8,관람객훈훈하고 마음이 따뜻해지는 영화다  
20170726,2,네이버 진짜 오염됐구나 ㅈㄴ재미없다. 보지마라. 종편드라마급이다.  
20170726,10,"추천을 받았지만 예고편, 줄거리를 보고 보기를 꺼려했던 내가 원망스러울 정도로 너무 좋았다. 마냥 어렸을적 소꿉장난하는 영화로 생각했던 내가 영화 초반부부터 후반부까지 펑펑 울진 몰랐다..명작이다. 일단 봐라. 진정 진실된 사랑을 했다면 공감할것이다.  "
20170726,10,인생영화 가장 재밌게 본 영화!!!  
20170725,9,마지막에 키스안해서 좀 아쉽... ㅜㅡㅜ 흐잉  
20170725,10,개인적으로 너무좋았던영화 오늘부로 인생영화가되었네요! 개인적으로 영화 색감이 너무좋았고 줄거리나 모든면에서 만점주고싶어요! 보는내내 느껴지는게많았던 영화입니다  
20170725,10,관람객한국에서 개봉 하기 전부터 거짓말 없이 몇십번은 본 영화인데 이걸 영화관에서 보다니 새로웠어요! 앞으로도 변함없이 볼 영화. 자막은 안보고 영화를 보는걸 추천합니다 제발 자막 좀 어떻게 해주세요 시적인 요소 다 뻄  
20170725,7,엔딩은 각자 생각하는걸로  
20170725,10,진짜 너무 사랑스럽고 영상도 색감이 진짜 좋고 배우가 입고 나오는 옷도 예뻐서 OO뒤에 한번 더 봐도 안촌스러울 것 같다  
20170725,10,"평점 보고 봤는데, 시간 가는줄 몰랐어요 ㅎㅎ  "
20170725,10,너무나 이쁜 영화.ㅠㅠ  
20170725,10,레알인생영화 단백하고 뒷부분에 또있을까 계속 기다렸다..  
20170725,10,"진짜 줄리가 나무 위에서 풍경을 보는 장면이 정말 좋았네요, 거기서 정말 넋놓고 봤습니다..!!!  "
20170725,10,관람객너무재밌음ㅜㅜ 브라이스  
20170725,8,관람객한없이 풋풋하고 아름답다  
20170725,10,키스신없어도 심쿵한다  
20170725,10,최고의 영화 주인공도 할아버지도대사도느낌도  
20170725,10,관람객잔잔하고 생각보다 웃긴장면도 많아서  지루하지않게 봤어요  
20170725,8,영화 내내 두 주인공의 감정이 독백으로 거의 처리 됐던 이유가 있었다는걸 마지막 장면의 대사에서 알 수 있었다.  
20170725,8,관람객보는 내내 잔잔한 미소를 머금게 만든 영화..  
20170725,5,진짜 너무지루하고 돈 주고 아까운 영화 인 만큼 은 아니지만 영화관에서 자고 싶은 영화 인 것 같다 . 너무 너무너무 재미없다  
20170725,10,관람객어린애들이 주인공이라 순수했음  
20170725,10,다시 봐도 좋았다.. 어릴때 봤을때랑은 또 다른 감성이 느껴진다.. 내 인생 영화 중 한편 ^^  
20170725,8,관람객배우들 연기 좋고 감성 돋는 좋은 영화!  
20170725,9,영화가 예쁘고 순수하다. 그 시절로  돌아가고 싶은  
20170725,10,엔딩곡 넘 감미로워서 네이버에 렛잇비미 검색하니 플립 영화 기사가 나와있네요. 흔한 올드팝이 좋은영화랑 결합하니영화와 음악 둘다 감동 두배. 마지막 자막 올라가는거ㅜ 끝나는게 아쉬웠어요. 아숩다.  
20170725,10,관람객대사들이 머리에서 가슴으로 전달된다.  
20170725,10,기분좋아지는영화이다. 책을 읽어내려가는 느낌으로 영화내내 미소지으며 보게된다.  
20170725,10,관람객부분과 전체 이야기를 하는데 왠지 모를 눈물이  
20170725,1,그래서 요점이 뭐야...? 어렸을때 소년의 사랑이야기? 이제 시작인가~~ 하고 보는데 갑자기 엔딩...  
20170725,7,관람객혼자 보기 좋아요. 과거를 잔잔한 추억 속에 느껴보고 싶으시다면 추천합니다  
20170725,9,관람객잔잔하면서 집중되는 순수하고 귀여운이야기 너무재밌어요  
20170725,9,관람객여주 정말 매력적이네요~  
20170725,10,관람객귀여운사랑이네요 므흣..  
20170725,8,관람객엄마랑 봤는데 저는 영화관에서 재개봉해서 너무 좋은것같아요  
20170725,10,관람객집에서 본 영화였는데 재개봉해서 친구 3명이랑 또 보러갔어요 완전 좋아요  
20170725,10,"언제 이후로 이런영화가 처음이었을까 생각해봤지만 아무래도 지금은 이영화가 최고인것같은..영상, 스토리, 연기 어느것 하나 빠짐없이 좋은 영화였다.어린 브라이스가 왜이렇게 멋진거니?  "
20170725,9,관람객잔잔하고 소소하게 잘봤습니다  
20170725,10,관람객잔잔한데 감동이에요 두번 세번 보면 느낌이 다를 영화예요  
20170725,10,진짜....인생영화 평점 처음 남겨봄  
20170725,10,관람객기분좋아지는 영화였어요~^^  
20170725,9,이 영화 본지가 언젠데 이제 개봉하는지~잊어버릴뻔 했다.  
20170725,10,관람객잼잇는데 은근지루 키키  
20170725,8,관람객글쎄요? 기대를 너무 많이 했나요? 걍~ 평평합니다.  
20170725,10,"초반에 영화보다가 내용이 익숙해서 먼가 했더니 책으로 예전에 봤던 내용이었다,, 영화로 봐도 책으로 봐도 아름다운 내용인듯  "
20170725,9,관람객보는내내 아주 몰입해서 봤다  
20170725,10,영화보는내내   브라이스는 잘생겼다....  
20170725,10,관람객한번더 봐야겠어요...  
20170725,10,어떤 SF영화보다 무협영화보다 서부영화보다 이 어린 둘의 이야기가 더욱 흥미진진하고 긴박하고 멋지다.  
20170725,8,"관람객영상미, 설레임.. 그리고 순수한 사랑이 보여진 작품입니다  "
20170725,10,"이 영화는 단순 로맨스 영화가 아니다. 스마트폰이 문명화 된 요즘, 카톡이나 sns활동으로 사랑이 싹 트는 것이 아닌, 진지하고 순수했던 그 시절의 로맨스..  또 여주인공의 당차고 바른 가치관을 배우며 많은 교훈과 감명을 받았던 작품.  "
20170725,6,기대하지 않을 수록 좋은 영화 다 보고 나오니 줄리의 몇몇 대사들 정도를 제외한 모든 게 날아가고 없다.  
20170725,5,관람객노잼영화였습니다 진짜 보지마세요 비추  
20170725,1,관람객플립이 아니고 슬립아님 ?  
20170725,10,"얼핏 현실적인듯 보이지만, 절대 현실에 없는 순수한 아이들. 다른 의미로 완벽한 판타지라 너무너무 좋았다  "
20170725,10,너무나 사랑스럽고 행복한영화.울컥할 정도로 마음이 예쁜 줄리베이커♡  
20170725,10,관람객남주 여주의 감정이 너무 잘 표현된거같아요 심심할때 다시 볼 예정ㅠㅠ  
20170725,10,다운받아서 3번 보고 재개봉 한다길래 영화관가서 봤는데 아무리봐도 안질리고 감동적입니다ㅠㅠ 슬퍼요ㅠㅠ역시 영화는 영화관가서 봐야 더 재밌나 보뮤ㅠㅠㅠ  
20170725,10,정말 보는데 하나도 안질루하고 정말 마음이 편해지는 영화이며 제가 봤던 영화중 인생영화다 라고 말할수있고 평점 한번도 안썼는데 평점남길정도로 후회안한영화다  
20170725,9,관람객너무 잼께 잘봣는데 남자배우가 디카프리오닮고 그냥 남자배우 얼굴이 열일  
20170725,10,아름답고 행복했다 두 아이들의 연기에 찬사를 보낸다 마지막 장면은 정말 잊을 수 없을것이다  
20170725,10,밤에 봤다가 밤 샜다ㅜㅜ 진짜 너무 재밌고 풋풋함  
20170725,8,관람객달달한 영화였습니당.  
20170725,10,관람객너무너무너무너뭔무너눈  
20170725,9,딸이랑봤어요.잔잔하고예쁜영화아쉬운점은 남자주인공아버지의 내면의아픔이무엇인지왜 성격이이상한지 그걸풀어주지못한점결말이쪼금...  
20170725,10,가장 순수한 감정의 사랑인거 같습니다. 보는 내내 미소가 지어져요! 줄리는 밀당의 고수~  
20170725,10,환상적인 영화를 보는내내 행복했습니다.♡  
