0,1,2
20170719,10,정말 최고고 많은 값진 것들을 얻었다. 영화속에서 살고싶은 생각이 들었고 행복이 어떤것인지 어떻게 접근하는것인지를 느끼게 해준다.  
20170719,10,관람객내 인생에서 가장 풋풋한 영화 인생영화의 바로 전단계?  
20170718,8,"관람객그냥 저냥 볼만했다. 시간 가는 줄 모르고 봤고, 그만큼 아쉬움이 많이 남았던 영화였다. 러닝 타임 3시간으로 잡고 같이 늙어가는 모습도 담았더라면 더욱 환상적인 영화가 되었을 것이다.  "
20170718,9,관람객힐링되는 영화였어용 좋아요  
20170718,10,관람객피곤한 삶에서 잠시나마 귀여운 남주 여주 보면서 달달 힐링했어요  
20170718,10,관람객마음이 맬랑 몰랑 간질 간질 죽어있는 연애세포들이여 일어나라!!  
20170718,10,관람객아 역시 명작 재개봉한 이유가 있습니다 박수짝짝  
20170718,10,관람객다시봤는데 너무 좋네여 ㅠㅠ 다들 꼭 보세욤  
20170718,9,로맨스 영화 드럽게 싫어하는 내가 외국인 친구 때문에 어쩔 수 없이 같이 본 영화...(스파이더 맨은 이미 봤다길래..) 근데 정말 재밌게 봤다. 추천.  
20170718,6,관람객좀 지루했어요...그냥 그럭저럭  
20170718,8,관람객새콤달콤한 사과쥬스 한잔 마신 것 같네요.  
20170718,10,최고요!!!123456789  
20170718,9,인간미가 느껴지는 따뜻한 영화다...원작이 있는 영화 특유의 디테일이 있다  
20170718,10,관람객순수한 사랑얘기에 감동받았다.기회가 된다면 또 한번쯤 보고싶은영화.  
20170718,9,관람객순수함에 마음이 평온해지는 영화  
20170718,8,풋풋한 아이들의 사랑이야기 잘봤어요  
20170718,10,관람객짱잼입니다 추천합니다  
20170718,9,"관람객내 어린날이 생각나 뭉클하면서, 사랑이 하고 싶어지는 영화  "
20170718,10,관람객아주 재밌게 잘 봤습니다  
20170718,10,"왜 그토록 관객들이 이 영화를 스크린에서 보기를 원했는지 영화관을 나오며 느낄 수 있었고, 한편의 성장 영화가 아닌 많은 것을 담고 있는 철학 영화였다. 성장해가는 두 사람을 보며 사랑도 배우고, 인생도 배울 수 있는 아주 뜻깊고 감사한 시간이었다.  "
20170718,10,관람객결말이 열린결말이긴한데 재밋어요 시간가는줄몰랏어요ㅋㅋㄱㄲ굿!!  
20170718,10,관람객재미있다. 여자주인공이 어른스러워서 좋았다.  
20170718,5,인생영화라고난리친사람들한테낚여서봤는데 극장서볼영화는아님  돈아깝 그냥그냥 그러다가그냥끝남  
20170718,10,관람객개꿀잼 기기 ㄱㄱ기기 ㄱㄱ 가기  
20170718,10,"관람객색감도 너무 예쁘고 영상미도 마음에 들 뿐만 아니라, 보는 내내 어릴 때의 그 옛 감정인, 내 첫사랑이 계속 떠올랐다. 오래되어서 마음 깊숙이 있던 그 때 그 감정이 꿈틀댔다. 또 하나의 인생영화가 생긴 것 같다.  "
20170718,10,관람객영화를 보고 난후 마음이 너무 따뜻해졌습니다  
20170718,10,관람객캬 감성자극 연애세포가 일어나거 있습니다!!!  
20170718,10,관람객강추강추강추진짜강추  
20170718,10,관람객인생 영화에요 보는내내 여주인공이 된 기분이여서 좋았습니다~^^  
20170718,10,관람객이런 영화가 흥행 하기를  
20170718,10,너무 사랑스러워요남녀노소 관람하기 좋은 영화인듯...강추네요  
20170718,10,댓글봐도 눈물이 나. 영화는 끝났는데 계속보고 싶어  
20170718,10,시작부터 끝까지 보는내내 눈물흘린건 저뿐이려나요.. 진정한 치유영화입니다  
20170718,9,관람객잔잔한 첫사랑 생각나게하는 영화  
20170718,10,너무너무 행복했어여 뿌잉뿌잉  
20170718,10,관람객오오오오옹ㅇ오ㅗ오오오 잼남 볼만해요  
20170718,4,솔까 인생영화까지는 아님 그냥 보고나면 잠깐 마음이 착해짐  
20170718,10,관람객유일하다고 꼽을 수 있는 첫사랑 영화  
20170718,10,관람객순수하고 풋풋해서 귀여운 느낌을 받았어요.추천합니다! 인생영화.  
20170718,9,관람객여친이랑 보러왓는데 생각보다 볼만합니다. 로맨스 그닥 좋아하진 않지만 뭐랄까 처음 사귈때 느낌을 다시 느낀거같아요  
20170718,10,가끔은 침묵이 말보다 더 친근하게 우리를 묶어준다...  
20170718,10,이쁘고. 사랑스런 영화다  
20170718,10,리얼보고걸린병 플립보고치유했다는 평보고 봤는데 이억만프로공감했다  
20170718,10,관람객역시 너무 귀여운 영화! 어무 풋풋하고 귀엽고 극중 할아버지 말이 너무 와닿는 영화..일어나지 않을꺼에 직찹하지마라  
20170718,7,관람객나중에 또 봐야겠다 플립  
20170718,8,관람객쏘쏘~~멜로드라마영화가없는지금볼만한영화아이들과함께봐도될듯싶네요  
20170718,8,관람객예전 어릴적 일들이 생각나네요  순수함이 그대로 묻어나는 영화입니다  
20170718,10,아이들 데리고 영화관 가서 봐야 긋다 ㅎㅎㅎ  
20170718,9,"관람객전개가 지루하지 않고, 영상이 좋았다!  "
20170718,10,관람객내 인생 영화 (?♡?♡)??º·˚  
20170718,8,동심으로 돌아가 잔잔히 볼만함  
20170718,10,관람객헿좋았어요 짱짱짱짱ㅋㅋ  
20170718,8,관람객달달하네요 혼자봤는데 지루하지않고 좋았어요  
20170718,8,관람객귀엽고 풋풋한 영화네요 ~  
20170718,10,관람객최고... 생각해볼게 많은 주제  
20170718,10,관람객쟤미서여오아오아오오옹  
20170718,10,관람객재미있었습니다 즐거운시간보냈습니다  
20170718,7,관람객순수하고 예쁜 사랑의 시기  
20170718,10,"관람객너무 달달했던 영화. 아이들의 시점과 변화도 좋았고, 영화 다봤는데 끝난지도 몰랐다.... 아름답고 행복하고 동화같이 예뻤던 영화. 한번봤던 영화였는데 극장에서 보길 너무 잘했다  "
20170718,10,너와 처음 본영화.영화보단 집중하는 너의 모습이 너무 좋았다.  
20170718,10,관람객너무너무너무 좋어요!  
20170718,8,관람객인생영화까지는아닌듯  
20170718,10,영화가 잔잔해보여서 재미없을 것 같았는데 생각보다 너무 재미있음!! 진짜 감동도 있고 아이들보면서 나도 모르게 웃게됨. 근데 주인공남자아이 이장우 닮은듯  
20170718,5,관람객뻔한 가슴따뜻함과 뻔한 스토리. 뻔했지만 나쁘진 않았다  
20170718,10,몰입감 최고. 감정의 소용돌이  
20170718,9,관람객사랑스럽고 기분 좋게 만들어주는 영화였습니다.  
20170718,10,정말 동화같았다 어린친구들이 연기도잘하고 내용도 괜찮았다  
20170718,9,관람객많은것을 생각하게하는 아주 좋은 영화였어요 :))  
20170718,10,7년 지나서 다시봐도 역시나 .... 아쉬운건 이 아이들이 다른영화에서 볼수없어서.. 특히나 매들린은 스윙보트나 플립보고 더 많이 볼수있을줄알았는데  
20170718,10,관람객재밌었다나아아아ㅏ아  
20170718,10,관람객와 진짜... 동심을 깨워주는 영화 힐링했어요 ㅠㅠ 두번세번 봐도 안지겨울거같은 영화  
20170718,10,관람객너무 좋았어요~~~~  
20170718,10,배캠 추천으로 봤습니다.풋풋한 첫사랑얘기인 줄 알고 봤는데.장애인 작은아빠얘기도 담담하지만 진실되게 다뤄줘서 엄청울었어요.제  딸이 지적 장애가 있거든요. 이 영화 참 담백하고 이쁩니다!  
20170718,10,여운이 정말 많이 남는영화...  
20170718,10,"""그 누가 줄리 베이커로부터 도망치고 싶어할까.""  "
20170718,1,관람객뭐지 댓글 알바인건가 아니면 클레멘타인을 잇는 영화인지 너무 지루했다. 단지 순수함 하나로 만든 영화인 것 같다.  
20170718,6,관람객재밌는지 재미없는지 헷갈리는영화  
20170718,2,관람객인터넷에서 재밌다고 해서 기대 많이하고갔는데 정말 지루했네요 차라리 스파이더맨을 두번보는게 이득이에요;뒷자리사람은 코까지 골면서 잤습니다..  
20170718,10,관람객순수한 영화. 잔잔하고 마음이 따뜻해지는 영화. 정말 좋았습니다  
20170718,10,정말 재밌게 봤다 ㅎ 치유되는 영화~^^  
20170718,10,관람객보고나니까 내가 맑아지는 느낌이네요 ㅋ 잼있습니다  
20170718,9,관람객미소 지으면서 보는 영화!!  
20170718,9,관람객가볍게 보러 갔는데 생각이 많아지는 영화였어요두 주인공 다 사랑스러워요  
20170718,8,어린 아이들의 미숙한 사랑 이야기를 잘 표현했다.  
20170718,10,다시 극장에서 봤더니 더 풋풋하고 좋다  
20170718,10,관람객풋풋한 이야기~~  뒷 이야기가 계속 되었으면~~ 끝나지 않았으면 하는 생각이 들었다~~ 이런 영화들이 많이 만들어졌으면 좋겠다~~  
20170718,10,"세상의 복잡한 이해관계 속에서 , 내 영혼에 잠시 휴식을 주는 영화. .  "
20170718,10,여자의 마음을 지금까지 모르고있었다  
20170718,9,관람객괜찮네요 지루하지안고 봤어요  
20170718,10,기대없이 봤다가 영화 남은시간 확인하며 안끝나길 바란 유일한 영화  
20170718,10,영화에 빠져들었어요☆☆  
20170718,8,관람객결말이 너무 어시어워요요요오오오  
20170718,10,관람객최근 본 영화중 최고였습니다 ㅠㅠ  
20170718,10,대사 하나하나가 이렇게 와닿다니 ..너무 좋았어요  
20170718,10,관람객너무너무 재밌습니다ㅎㅎ  
20170718,9,풋풋했던 첫사랑이 떠오르는 영화  
20170718,10,관람객재밌어요! 설레는 두근두근한 느낌이 너무 좋았어요  
20170718,10,수업시간에 딴 생각하다가 선생님의 질문에 엉뚱한 대답을 하였을때... 그 대답이 다른 질문에 대한 정답이 될 수도 있겠지만 지금은 아니란다. 라고 했던 선생님의 대응에서 우리 아이들도 저런 교육을 받았으면 싶었다.  
20170718,10,관람객감동적이다  네이버페이500웑 주라  
20170718,10,너무 이쁜영화 평점 10 점줍니다  
20170718,10,관람객너무너무 재미있어요~~ 두번보세오  
20170718,10,관람객너무 따뜻한 영화에요 엔딩이 너무 감동이에요  
20170718,10,보는 내내 즐거웠어요~  
20170718,10,감동이 있는 영화..!  
20170717,10,관람객인생 첫사랑영화인듯~~  
20170717,10,관람객사랑스럽고 따듯했던 영화!  
20170717,9,관람객소소하지만 서로 상황이 재밌음  
20170717,10,관람객재개봉 한대서 바로 달려갔어요~ 단순히 첫사랑의 풋풋함 뿐만 아니라 성장하면서 보고 겪는 감정선을 잔잔하고 예쁜 풍경과 함께 느낄 수 있어서 좋았어요. 힐링이 필요하다면 추천합니다 :)  
20170717,10,관람객순수한 감성이 너무 좋았습니다ㅠㅠ  
20170717,10,예상 가능한 결말임에도 모두가 이리도 극찬하는 이유는 자신들의 이루어지지않은 사랑과 닮아서가 아닐까  
20170717,10,관람객보는내내 은근한 웃음이 떠나질않았고 학창시절 첫사랑 생각에 오랜만에 심장이 뛰었다^^그..나무 이름이생각나지않는데..꼭 실제로 보고싶고 오르고싶다...  
20170717,8,관람객예쁜 첫사랑에 느낌이 물씬 ㅎ 보는 내내 맘이 찡하고 눈물이 ㅜㅜ 마음이 정화되는 느낌에 영화~^^♥  
20170717,10,관람객진짜재밌는영화!!너무즐가웠어요  
20170717,10,별생각없이 봤는데 인생영화중 한편으로 등록!!많은사람들이 봤으면 좋겠다^^  
20170717,9,정말 재밋다. 최고다.  
20170717,8,관람객어린날에 풋사랑이 떠오르고 좋아요  
20170717,6,관람객남녀의 마음을 아름답게 묘사했음  
20170717,10,관람객생각보다 너무 재밌게 봤어요 ㅎㅎ  
20170717,10,넘좋당 ㅜㅜ남자존잘 ..지금은아니지만 ㅜㅜ  
20170717,9,관람객두 주인공이 너무 귀여워서 영화보는내내 웃음지면서 봤네요! 중간중간 많은 생각을 하게 하는 대사들도 좋았구요! 마음 편하게 볼 수 있는 영화에여!  
20170717,10,잔잔하니 재밌었다. 가볍게 시작해서 따뜻한 마음으로 끝나는 영화인듯.  
20170717,10,지루할 틈 없는 풋풋하고 즐거운 영화였어요.  
20170717,10,관람객요근래 보았던 내인생 역대급 명작  
20170717,8,"이런 감정을 느낀게 언제던가, 다시 느낄수나 있을까  "
20170717,9,관람객감정들이 너무 잘나타나잇엇던 영화인거같아요 따뜻햇어요  
20170717,9,관람객여주는 보살인가..사리나오겠다  
20170717,9,관람객킬링타임용으로 좋다!  
20170717,10,관람객다시 봐도 정말 최고의 영화였다  
20170717,10,와우 진짜 인생영화♡♡이거 안보신분들 후회할거니까 꼭 보세요!!  
20170717,1,관람객달달한 재미없는영화 감명깊지않았다  
20170717,10,예전부터 너무 보고싶은 영화였지만 Btv에 없어서 못봐서 너무 아쉬웠는데 개봉한 주 주말에 보러갔는데 너무 재밌었다. 최고. 기회가 된다면 한번 더 보고싶은 영화다. 여주인공도 보면 볼수록 너무 예뻐보이고 남자주인공도 너무 귀여움 ㅎㅎ  
20170717,10,ㄹㅇ 보고 생긴 암이 자연치유되는 영화  
20170717,10,아...캘런 한국 방문해 주세요 제발요ㅠㅠ 역주행 짱  
20170717,10,올해 영화중에 제일 재밌었음  
20170717,10,관람객풋풋한 사랑 이야기가 너무 재미있고 공감되는 내용이었다.둘의 행동이 너무 재미있어 중간중간 웃음이 났다.나중에 시간이 지나서 한 번 더 보고싶다.  
20170717,10,관람객재밌었어요하하호호히히  
20170717,10,관람객순간순간 변하는 둘의 감정과 교차되는 감정이 독백으로 잘 편집되어 재밌게 봤어요  
20170717,9,관람객대사 하나하나가 멋짐. 눈이 아니라 가슴으로 봤음.  
20170717,10,"관람객처음봤을땐 기대없이 봤었는데, 마음을 크게 울렸고 제 인생영화가 됐어요. 두 번째 봤을땐 처음에 이해못했던 말들이 이해가 되서 위로가 되었고, 또 지금 영화관에서 보니 사람들과의 관계에 치이고 차가워진 제 마음을 다시 따뜻하게 데워주는 기분이 드네요.  "
20170717,10,관람객첫사랑이랑 봐서 좋았어요 영화가 눈에 안들어 오긴 했지만 재밌어요  
20170717,10,나도 누군가에게 무지개처럼 빛나는 사람일수 있을까?  
20170717,10,"When Harry Met Sally의 제작진들이 참여해서 그런지, 진부한 로맨틱 클리셰를 다 넘어뛰었다.두 주인공에 집중하며 쓸모없는 내용은 다 걸러낸다. 그리고 한국에는 첫 개봉이라니! 호주에서 방송했을때 텔비전을 킨 내 자신이 고마울뿐이다.  "
20170717,9,수수하고 아름다운 영화  
20170717,10,슬픈장면이 아닌데도 계속 눈물이 날것만 같았다.  
20170717,10,관람객인생 영화네요 힐링이 됩니다.  
20170717,10,관람객2번째 리뷰 작성하는데 가슴 따뜻해지는 영화네요 이런 영화 볼수있어서 너무 좋습니다ㅠㅠ  
20170717,10,관람객작고어린사랑이 아름답다  
20170717,10,이건 진짜 다시봐도 명작이다 꼭보셈  
20170717,10,"관람객어떤 사람들은 엔딩이 허무하다, 아버지 이야기가 더 나오지 않아 아쉽다고 말하지만, 나는 그 부가적인 이야기를 주저리주저리 풀어냈다면 영화의 완성도가 오히려 떨어졌을거라 확신한다. 내 기준에선 그들의 미래를 상상할 거리가 있는 여운남는 엔딩은 완벽했다  "
20170717,9,관람객보는내내 흐뭇한미소지었어요 너무재밌었아요~  
20170717,10,광명롯시] 자극적이지 않은 소재이면서도 상당히 흥미진진하고 무척 재밌다. 그리고 여운도 남는다. 사랑스러운 영화다. 헐리우드 히어로물만 보다가 이런 영화 보니까 미국의 새로운 면모에 놀라게된다.  
20170717,6,솔직히 이걸 돈주고 보기엔 아까워요ㅠ 뭐니뭐니해도 재미가 있어야 하는데 이건 그냥 조용한 영화에요..  
20170717,10,관람객대박영화.. 꼭 보러 가세요  
20170717,8,이처럼 풋풋한 첫사랑 이야기에 왜 눈물이 나는걸까.... 지난 뒤에만 알게 되는 가장 찬란했던 순간이여.  
20170717,10,러브레터나 플립 같은 영화류 좋아요. 그 시절 짝사랑 첫사랑 생각나고 풋풋하니 재밌게 봤어요.  
20170717,10,관람객어ㅑㅇ제ㅠ오애뉺터자내튵  
20170717,10,관람객순수해서 더 예뻤던 영화  
20170717,10,관람객귀여운 주인공들...잔잔한 영화예요.  
20170717,7,관람객너무 기대한 탓인가 내사랑이랑 고민 후 어제는 내사랑 오늘은 플립 봤는데  둘중 고민하신다면 내사랑 보세여. 물론 플립도 괜찮은데 저는 7점이여~  
20170717,10,잘봤어요 정말감동적입니다  
20170717,10,관람객영화가 끝나질 않길 바랬을 뿐이다.  
20170717,10,관람객분위기도 좋고 영상도 예쁜 영화  
20170717,10,관람객너무 순수하고 사랑스러운 영화였어요 강추!!!  
20170717,8,관람객풋풋한 느낌이 많에 들어 좋았어요  
20170717,8,관람객그때그시절의 찬란했던 기억들  
20170717,10,말이 필요없는 감동 영화죠. 몇년전에 봤는데 요번에 개봉해서 영화관에서 또 봤어요. 몇몇 장면엔 살짝 눈물도 나고 웃음도 나고 뭔가 되게 찡한 감동이 생겨요. 부분보다 전체를 볼 수 있는 눈과 마음을 가진 줄리가 참 예뻐요~  
20170717,10,관람객아름다운영화입니다~  
20170717,8,알라들의 순수한 동화같은 사랑영화. 현자같은 할아버지가 있는 브라이스가 부럽다  
20170717,10,보는 내내 영화가 안끝나길 바랬어요. 감정을 쥐어짜내는 영화가 전혀아닌데 왜그렇게 울었나..바보같네요 ㅎㅎ  
20170717,10,오랜만에 마음이 따뜻해지는 영화였어용  
20170717,9,관람객감동적이고 유쾌하네요  
20170717,6,남성비추영화 .. 나는잤는데 여친은좋아하더이다  
20170717,10,"보는 내내 집중이 흐려지지 않았던 영화. 사랑도 있고 다툼도 있고 오해도 있지만 어른들의 로맨스가 아니라 아이들의 순수했던 시절의 감정이라 더욱 감동적이고 아름다운 영화였던 것  같다. 이런 영화 너무 좋다 두번보고 싶고, 또 생각날 것 같다.  "
20170717,10,관람객그 나이대로 돌아가서 설레는 내용의 영화였습니다 완전  추천드려요 !! 꿀잼~  
20170717,8,관람객잘보았습니다...ㅎ  
20170717,9,관람객잔잔하 성장기 아동들의 아름다운 사랑. 과거를 회사하게 한다.  
20170717,10,평점이높은이유기있네요  
20170717,10,이거 진짜 재밌음. 처음엔 뭐지.. 이게 왜 명작이지 했는데 다시 보면 볼수록 졸잼  
20170717,8,관람객감동적인데... 졸려서 제대로 못봐ㅅ어ㅛ  
20170717,10,관람객재밌었습니다 여자친구랑봐서  
20170717,10,관람객정말 정말 잼있게 잘봤어요 또볼수있어요!  
20170717,10,관람객왜 인생영화라고 하는지 알 것 같다 순수함과 인생을 배워가는 두주인공의 잔상이 길게 남는다  
20170717,10,풋풋하고 감성적인 영화. 보는 내내 자꾸 미소를 짓게 되는 영화. 얼마전 전위예술무용보고 불쾌하고 찜찜했던 마음이 치유되었음.  
20170717,10,다시 사랑을 믿게됨 명자깅다  
20170717,9,관람객지금 사랑하고 있다면 또는 이별중이시라면 이 영화는 자신을 알아가는데 큰 도움이 될 것 입니다.  
20170717,9,관람객감성가득영화 오랫만에 즐감  
20170717,9,영화 정말 너무 좋네요..   런닝타임  짧은게 아쉬울뿐..  
20170717,6,그대는 풀잎 나는 이슬 이잖~~~나  
20170717,10,너무 힐링이되는 영화였다.가족을 사랑하는 어깨가 무거운 가장의 모습을 보며 눈물도 났고 화목한 가정상을 봐 가슴 따뜻했다.강추합니다.  
20170717,9,여자애가 마치날 보는듯했다 하지만 나는 실패했다  
20170717,9,"영화 참 잘만들었네요..두 아이의 관점에서 얘기를 풀어나가는 방식이 참 신선했고,순수하고 때로는 솔직하지 못한 아이들의 모습에 공감도 가고 안타깝기도했지만 끝내는 감동과 함께 미소가 지어지는 그런 영화였습니다.  "
20170717,10,멋진 여운이 남는 영화~ 다음날까지도 기분좋고~ 다시보고싶은 그런 영화다~~  
20170717,10,관람객인생영화로 손색이 없습니다  
20170717,10,관람객타인의 삶에 대한 이해와 더불어 자기 성찰을 가능케 하는 영화. 추천합니다 안 보신 분들이 계시다면.  
20170717,10,"관람객이미 여러차례 본 영화이지만, 한국에서 재개봉한다는 소식을 듣고 바로 예매해서 봣네요 ㅎㅎㅎ 너무좋아요  "
20170717,8,관람객줄리처럼 당당하고 따듯한 용기를 가진 사람이 되고 싶었다 언제나  
20170717,10,관람객잘 재미잇게 보았습니다  
20170717,10,평론가 점수 6점 뭐임?;;영화를 영화로 즐겨야지 이런 인생영화에 6점주면 지가 좀 있어보이나?도저히 이해할수 없는 점수다 이 영화는 삶을 대하는 자세를 어렵지 않게 이야기해주는 영화라고 본다  
20170717,10,4년전에 다운받고 현재까지 간간히 꺼내보는 영화어쩐지 삭제하질 못하겠다 내 인생영화  
20170717,5,관람객좀 지루해요..졸립니다  
20170717,10,관람객인생영화였다 분위기와 기법이 훌륭함  
20170717,10,관람객지루할틈없는영화!!  
20170717,10,이건 안 보면 후회합니다. 너무 재미있어요.  
20170717,8,우리 남주 눈빛 진짜 너무 멋지더라...ㅎㅎ 풋풋한 사랑이야기 귀여웠음  
20170717,10,재개봉 한만큼 많은 사람이 보았으면 하는 영화다.  
20170717,10,관람객역대급 최고 영화!!!  
20170717,10,교훈적이고 배울것이 많은 영화..  
20170717,8,관람객재밌었어요!!!!추천쭈천~~~  
20170717,8,관람객귀여운 로맨스 결말이 마음에 든다  
20170717,8,관람객풋풋함 사랑이 너무 좋았던 영화의도는 알겠지만 결말이 읭?? 하게 되는 영화  
20170717,10,오랫만에 순후하고 아름다운 영화봤네요서로의 시선에서 얘기하는게 귀여우면서도 여주가 세상보는시선이 아이이지만 참예쁘네요꼭보셔요 힐링타임될껍니다  
20170717,8,"관람객인생영화가 되기직전, 갑작스럽고 허무한 결말이  안타까웠다.  "
20170717,10,관람객브라이스 아빠 한대 치고싶다  
20170717,10,관람객예고편에서 봤던 것처럼 성장영화였어요~ 지금 한창 사춘기인 딸아이들과 공감이 될까?하면서 봤는데... 너무너무 재밌게 봤답니다^^  풋풋한 첫사랑의 감정은 모두를 설레고 두근두근하게 만든다는걸 다시 한번 확인했어요. 보고 나면 딸과 친구가 될 수도~  
20170717,10,몇년간 봤던 수많은 영화중에 가장 잼있게 본 영화다....  
20170717,10,또보러 가야겠다는 생각만들었다  
20170717,10,연출과 대사하나하나가 너무 좋았다 끝나는게 너무 아쉬울정도로 아름다운 영화인것 같다!  
20170717,9,관람객마음속 깊은곳 서랍속에 순수한 감정을 꺼내서 잘있는지 확인해 볼수 있는 시간 주인공들의 드라마가 관객의 꿈과 현실의 안부를 묻는  영화  
20170717,9,"아이들의 이야기임에도 불구하고 성인인 나도 많은 걸 느끼게 해준 작품. 배우들의 연기는 두 말할 것도 없고, 감정을 풀어내는 과정이 너무 아름다웠다. 시끄럽고 현란한 장면이 없음에도 1분도 지루하지 않았다.  영화의 끝이 아쉬웠지만 분명 좋은 영화이다  "
20170717,10,간지럽고 풋풋하고 상큼했던...  
20170717,10,"몽글몽글한, 순수했던 감정이 되살아나는 기분  "
20170717,10,"관람객시점이 변하면서, 사춘기를 겪으며 성숙해지고 달라지는 10대의 소년 소녀의 모습을 볼 수 있었다. 흔히 고민해 봤던 연애문제. 재밌게 잘 풀어냈다.  "
20170717,10,내 인생 영화..처음 보고 엄청 울었음  
20170717,10,관람객서로다른 관점에서 아름답게표현  
20170717,10,시간이 진짜 금방가더라 너무 재밌는 영화ㅠㅠㅠ 애기들 너무 귀엽고 진짜 행복햇다  
20170717,10,상황이 보는 사람에 의해서 달라져도 결국엔 마음은 전해지는 법  
20170717,10,말로 표현할 수가 없다 아껴서 나눠 보고싶은...끝날때 너무 아쉬운 영화  
20170717,10,시계를 한번도 들여다보지 않았던 첫 영화  
20170717,10,매 순간순간 소년 소녀의 순수하고 예쁜 대사들을 곱씹게 되고소년 소녀때의 순수함으로 돌아가게  해주는모든 순간이 사랑스러운 영화  
20170717,8,관람객잔잔한 여운이 남는 영화였다  
20170717,10,관람객예쁘다는 표현이 저절로 나오는 영화였습니다.대사 하나하나가 정말 예뻐요ㅠㅠ  
20170717,10,"인생 영화,, 너무 좋았다,, 그리고 브라이스가 너무 잘생김  "
20170717,10,진짜 힐링되는 영화 인생영화!!  
